[32m[I 2024-10-13 01:46:32,966][0m Trial 980 finished with value: 45882.4338904507 and parameters: {'depth': 9, 'learning_rate': 0.25063248259676346, 'iterations': 370, 'l2_leaf_reg': 0.00039150516038244924, 'border_count': 93, 'bagging_temperature': 0.07496390437450741, 'random_strength': 8.825413369234454, 'grow_policy': 'SymmetricTree', 'min_data_in_leaf': 882}. Best is trial 726 with value: 37144.045766835996.[0m
[32m[I 2024-10-13 01:46:35,327][0m Trial 981 finished with value: 52318.277000537884 and parameters: {'depth': 10, 'learning_rate': 0.26852581409780996, 'iterations': 458, 'l2_leaf_reg': 0.0006127376982739039, 'border_count': 71, 'bagging_temperature': 0.055106169550137134, 'random_strength': 0.9450038403470451, 'grow_policy': 'SymmetricTree', 'min_data_in_leaf': 845}. Best is trial 726 with value: 37144.045766835996.[0m
[32m[I 2024-10-13 01:46:36,587][0m Trial 982 finished with value: 74570.68660143082 and parameters: {'depth': 8, 'learning_rate': 0.00239640716558934, 'iterations': 354, 'l2_leaf_reg': 0.00036778185026962773, 'border_count': 67, 'bagging_temperature': 0.2620682055914004, 'random_strength': 9.140261055946654, 'grow_policy': 'SymmetricTree', 'min_data_in_leaf': 997}. Best is trial 726 with value: 37144.045766835996.[0m
[32m[I 2024-10-13 01:46:38,338][0m Trial 983 finished with value: 39275.15311548507 and parameters: {'depth': 9, 'learning_rate': 0.29864797615183736, 'iterations': 436, 'l2_leaf_reg': 0.00061303668107828, 'border_count': 54, 'bagging_temperature': 0.0387118983497543, 'random_strength': 9.337721142390382, 'grow_policy': 'SymmetricTree', 'min_data_in_leaf': 907}. Best is trial 726 with value: 37144.045766835996.[0m
[32m[I 2024-10-13 01:46:51,037][0m Trial 984 finished with value: 43163.54663508038 and parameters: {'depth': 14, 'learning_rate': 0.2260087076958652, 'iterations': 346, 'l2_leaf_reg': 0.0003295982534654747, 'border_count': 73, 'bagging_temperature': 0.03532552591574831, 'random_strength': 9.036381984582896, 'grow_policy': 'SymmetricTree', 'min_data_in_leaf': 975}. Best is trial 726 with value: 37144.045766835996.[0m
[32m[I 2024-10-13 01:46:51,809][0m Trial 985 finished with value: 56028.27175670926 and parameters: {'depth': 9, 'learning_rate': 0.2986909530590767, 'iterations': 551, 'l2_leaf_reg': 0.00022673685088599494, 'border_count': 69, 'bagging_temperature': 0.06706973670035989, 'random_strength': 9.324702670855311, 'grow_policy': 'Lossguide', 'min_data_in_leaf': 862, 'max_leaves': 101}. Best is trial 726 with value: 37144.045766835996.[0m
[32m[I 2024-10-13 01:46:54,013][0m Trial 986 finished with value: 51793.09235161382 and parameters: {'depth': 10, 'learning_rate': 0.29863333974171147, 'iterations': 405, 'l2_leaf_reg': 0.0002797627615137181, 'border_count': 79, 'bagging_temperature': 0.1038053473731424, 'random_strength': 8.690067475425272, 'grow_policy': 'SymmetricTree', 'min_data_in_leaf': 921}. Best is trial 726 with value: 37144.045766835996.[0m
[32m[I 2024-10-13 01:46:55,862][0m Trial 987 finished with value: 51690.406497075 and parameters: {'depth': 10, 'learning_rate': 0.23479277979930732, 'iterations': 319, 'l2_leaf_reg': 0.0002391887905776705, 'border_count': 66, 'bagging_temperature': 0.29011310450200023, 'random_strength': 8.914367287913077, 'grow_policy': 'SymmetricTree', 'min_data_in_leaf': 937}. Best is trial 726 with value: 37144.045766835996.[0m
[32m[I 2024-10-13 01:47:10,318][0m Trial 988 finished with value: 59316.18984995713 and parameters: {'depth': 9, 'learning_rate': 0.2021145670621197, 'iterations': 2942, 'l2_leaf_reg': 0.00048508053769246237, 'border_count': 82, 'bagging_temperature': 0.0005427931150080376, 'random_strength': 1.3685434043682756, 'grow_policy': 'SymmetricTree', 'min_data_in_leaf': 914}. Best is trial 726 with value: 37144.045766835996.[0m
[32m[I 2024-10-13 01:47:12,284][0m Trial 989 finished with value: 45484.21584912904 and parameters: {'depth': 9, 'learning_rate': 0.25742259822282104, 'iterations': 492, 'l2_leaf_reg': 0.0007858759768295789, 'border_count': 166, 'bagging_temperature': 0.046047295680147884, 'random_strength': 9.151248185494328, 'grow_policy': 'SymmetricTree', 'min_data_in_leaf': 939}. Best is trial 726 with value: 37144.045766835996.[0m
[32m[I 2024-10-13 01:47:14,033][0m Trial 990 finished with value: 44118.87747185224 and parameters: {'depth': 9, 'learning_rate': 0.22682561901133644, 'iterations': 408, 'l2_leaf_reg': 0.00036537730512360803, 'border_count': 71, 'bagging_temperature': 0.0195651616151419, 'random_strength': 9.392313581596921, 'grow_policy': 'SymmetricTree', 'min_data_in_leaf': 896}. Best is trial 726 with value: 37144.045766835996.[0m
[32m[I 2024-10-13 01:47:16,123][0m Trial 991 finished with value: 40250.3293723834 and parameters: {'depth': 10, 'learning_rate': 0.26120550372978046, 'iterations': 344, 'l2_leaf_reg': 0.0001910060902540983, 'border_count': 94, 'bagging_temperature': 0.018447041015458777, 'random_strength': 9.484123562072327, 'grow_policy': 'SymmetricTree', 'min_data_in_leaf': 871}. Best is trial 726 with value: 37144.045766835996.[0m
[32m[I 2024-10-13 01:47:20,367][0m Trial 992 finished with value: 53275.13810197409 and parameters: {'depth': 8, 'learning_rate': 0.1769237059411377, 'iterations': 848, 'l2_leaf_reg': 0.000139637761089681, 'border_count': 76, 'bagging_temperature': 0.05664923626919286, 'random_strength': 9.185934454225432, 'grow_policy': 'SymmetricTree', 'min_data_in_leaf': 934}. Best is trial 726 with value: 37144.045766835996.[0m
[32m[I 2024-10-13 01:47:23,734][0m Trial 993 finished with value: 45095.980669339144 and parameters: {'depth': 11, 'learning_rate': 0.23026441532989886, 'iterations': 455, 'l2_leaf_reg': 0.0008461923567284806, 'border_count': 85, 'bagging_temperature': 0.033402598944737016, 'random_strength': 9.7488192946291, 'grow_policy': 'SymmetricTree', 'min_data_in_leaf': 890}. Best is trial 726 with value: 37144.045766835996.[0m
[32m[I 2024-10-13 01:47:25,631][0m Trial 994 finished with value: 47327.40160128063 and parameters: {'depth': 10, 'learning_rate': 0.1444456120147295, 'iterations': 320, 'l2_leaf_reg': 0.1710222723236978, 'border_count': 79, 'bagging_temperature': 0.07878726898136225, 'random_strength': 9.485397556173792, 'grow_policy': 'SymmetricTree', 'min_data_in_leaf': 913}. Best is trial 726 with value: 37144.045766835996.[0m
[32m[I 2024-10-13 01:47:27,274][0m Trial 995 finished with value: 48608.00770996466 and parameters: {'depth': 9, 'learning_rate': 0.2634489480184469, 'iterations': 381, 'l2_leaf_reg': 2.5489465047961745e-05, 'border_count': 73, 'bagging_temperature': 0.12728719388775736, 'random_strength': 8.969602712605399, 'grow_policy': 'SymmetricTree', 'min_data_in_leaf': 960}. Best is trial 726 with value: 37144.045766835996.[0m
[32m[I 2024-10-13 01:47:28,177][0m Trial 996 finished with value: 58646.77423798731 and parameters: {'depth': 9, 'learning_rate': 0.20043311963668287, 'iterations': 525, 'l2_leaf_reg': 0.27609618792254553, 'border_count': 59, 'bagging_temperature': 0.0006923329232614886, 'random_strength': 9.291274936222143, 'grow_policy': 'Depthwise', 'min_data_in_leaf': 970}. Best is trial 726 with value: 37144.045766835996.[0m
[32m[I 2024-10-13 01:47:29,971][0m Trial 997 finished with value: 38793.30550485617 and parameters: {'depth': 10, 'learning_rate': 0.26389153120031494, 'iterations': 309, 'l2_leaf_reg': 0.12549820233705883, 'border_count': 64, 'bagging_temperature': 0.019493544001046945, 'random_strength': 9.781327068365513, 'grow_policy': 'SymmetricTree', 'min_data_in_leaf': 954}. Best is trial 726 with value: 37144.045766835996.[0m
[32m[I 2024-10-13 01:47:31,460][0m Trial 998 finished with value: 39538.746064955834 and parameters: {'depth': 9, 'learning_rate': 0.26857823994795765, 'iterations': 315, 'l2_leaf_reg': 0.1005270662024895, 'border_count': 113, 'bagging_temperature': 0.00044720545711400897, 'random_strength': 9.843297206045632, 'grow_policy': 'SymmetricTree', 'min_data_in_leaf': 999}. Best is trial 726 with value: 37144.045766835996.[0m
[32m[I 2024-10-13 01:47:32,826][0m Trial 999 finished with value: 121015.72539874425 and parameters: {'depth': 9, 'learning_rate': 0.0005574356663129839, 'iterations': 308, 'l2_leaf_reg': 0.11211601667586038, 'border_count': 58, 'bagging_temperature': 0.01846432299996488, 'random_strength': 9.793159154955045, 'grow_policy': 'SymmetricTree', 'min_data_in_leaf': 965}. Best is trial 726 with value: 37144.045766835996.[0m
CatBoost: RMSE = 37144.0458
      Model          RMSE
0  CatBoost  37144.045767

Best hyperparameters for CatBoost:
{'depth': 9, 'learning_rate': 0.2982380892853731, 'iterations': 271, 'l2_leaf_reg': 0.5903164170075648, 'border_count': 245, 'bagging_temperature': 0.01688593892850543, 'random_strength': 9.560235555266887, 'grow_policy': 'SymmetricTree', 'min_data_in_leaf': 116}
