[32m[I 2024-10-13 01:05:05,404][0m Trial 312 finished with value: 40457.500096913136 and parameters: {'depth': 10, 'learning_rate': 0.2821406663686639, 'iterations': 362, 'l2_leaf_reg': 0.23158588135563773, 'border_count': 229, 'bagging_temperature': 0.018037136878449933, 'random_strength': 8.954462922351349, 'grow_policy': 'SymmetricTree', 'min_data_in_leaf': 120}. Best is trial 311 with value: 39161.29598039471.[0m
[32m[I 2024-10-13 01:05:08,437][0m Trial 313 finished with value: 40030.50919581177 and parameters: {'depth': 10, 'learning_rate': 0.2949104446102059, 'iterations': 362, 'l2_leaf_reg': 0.10940073756264482, 'border_count': 229, 'bagging_temperature': 0.0035084021714500147, 'random_strength': 6.65481433307545, 'grow_policy': 'SymmetricTree', 'min_data_in_leaf': 124}. Best is trial 311 with value: 39161.29598039471.[0m
[32m[I 2024-10-13 01:05:11,531][0m Trial 314 finished with value: 41737.94735018803 and parameters: {'depth': 10, 'learning_rate': 0.2989200570496229, 'iterations': 388, 'l2_leaf_reg': 0.09853791985192155, 'border_count': 230, 'bagging_temperature': 0.018195172460444053, 'random_strength': 9.285037018544546, 'grow_policy': 'SymmetricTree', 'min_data_in_leaf': 121}. Best is trial 311 with value: 39161.29598039471.[0m
[32m[I 2024-10-13 01:05:14,693][0m Trial 315 finished with value: 41307.38983635818 and parameters: {'depth': 10, 'learning_rate': 0.2211814149115231, 'iterations': 379, 'l2_leaf_reg': 0.10721668832258462, 'border_count': 226, 'bagging_temperature': 0.01572835439502989, 'random_strength': 9.083303335042565, 'grow_policy': 'SymmetricTree', 'min_data_in_leaf': 109}. Best is trial 311 with value: 39161.29598039471.[0m
[32m[I 2024-10-13 01:05:17,484][0m Trial 316 finished with value: 40953.349561634306 and parameters: {'depth': 10, 'learning_rate': 0.21078941065770357, 'iterations': 393, 'l2_leaf_reg': 0.0874146014666919, 'border_count': 225, 'bagging_temperature': 0.018627374002916468, 'random_strength': 9.096434444621575, 'grow_policy': 'SymmetricTree', 'min_data_in_leaf': 122}. Best is trial 311 with value: 39161.29598039471.[0m
[32m[I 2024-10-13 01:05:18,555][0m Trial 317 finished with value: 56642.9219356497 and parameters: {'depth': 10, 'learning_rate': 0.2947472917922621, 'iterations': 371, 'l2_leaf_reg': 0.11703696771617017, 'border_count': 229, 'bagging_temperature': 0.016284860179663452, 'random_strength': 8.919540754040908, 'grow_policy': 'Depthwise', 'min_data_in_leaf': 125}. Best is trial 311 with value: 39161.29598039471.[0m
[32m[I 2024-10-13 01:05:21,553][0m Trial 318 finished with value: 39575.38742294943 and parameters: {'depth': 10, 'learning_rate': 0.28576406962392903, 'iterations': 385, 'l2_leaf_reg': 0.21150144269505605, 'border_count': 225, 'bagging_temperature': 0.0001496312275669591, 'random_strength': 9.150923611897392, 'grow_policy': 'SymmetricTree', 'min_data_in_leaf': 112}. Best is trial 311 with value: 39161.29598039471.[0m
[32m[I 2024-10-13 01:05:24,681][0m Trial 319 finished with value: 38829.28660377016 and parameters: {'depth': 10, 'learning_rate': 0.28012468157727355, 'iterations': 406, 'l2_leaf_reg': 0.0803364288421676, 'border_count': 226, 'bagging_temperature': 0.004695828859066846, 'random_strength': 9.188192268745679, 'grow_policy': 'SymmetricTree', 'min_data_in_leaf': 121}. Best is trial 319 with value: 38829.28660377016.[0m
[32m[I 2024-10-13 01:05:27,630][0m Trial 320 finished with value: 40946.7942352944 and parameters: {'depth': 10, 'learning_rate': 0.2753064038694937, 'iterations': 387, 'l2_leaf_reg': 0.09100254757477756, 'border_count': 228, 'bagging_temperature': 0.0022931192266792658, 'random_strength': 9.155339928370692, 'grow_policy': 'SymmetricTree', 'min_data_in_leaf': 118}. Best is trial 319 with value: 38829.28660377016.[0m
[32m[I 2024-10-13 01:05:30,678][0m Trial 321 finished with value: 41304.778420313545 and parameters: {'depth': 10, 'learning_rate': 0.29892077252452587, 'iterations': 389, 'l2_leaf_reg': 0.09692958819059885, 'border_count': 224, 'bagging_temperature': 0.0010258272725372844, 'random_strength': 9.154415018555575, 'grow_policy': 'SymmetricTree', 'min_data_in_leaf': 125}. Best is trial 319 with value: 38829.28660377016.[0m
[32m[I 2024-10-13 01:05:33,900][0m Trial 322 finished with value: 41393.57546095655 and parameters: {'depth': 10, 'learning_rate': 0.2979294310116697, 'iterations': 365, 'l2_leaf_reg': 0.09243268395127333, 'border_count': 225, 'bagging_temperature': 0.0017125764099001212, 'random_strength': 9.290494937907061, 'grow_policy': 'SymmetricTree', 'min_data_in_leaf': 120}. Best is trial 319 with value: 38829.28660377016.[0m
[32m[I 2024-10-13 01:05:36,967][0m Trial 323 finished with value: 40789.36596375943 and parameters: {'depth': 10, 'learning_rate': 0.29455696419802374, 'iterations': 393, 'l2_leaf_reg': 0.06340914787909761, 'border_count': 223, 'bagging_temperature': 0.0024509315121493055, 'random_strength': 9.164937893564167, 'grow_policy': 'SymmetricTree', 'min_data_in_leaf': 117}. Best is trial 319 with value: 38829.28660377016.[0m
[32m[I 2024-10-13 01:05:39,567][0m Trial 324 finished with value: 39420.53664359894 and parameters: {'depth': 10, 'learning_rate': 0.27833261162956463, 'iterations': 380, 'l2_leaf_reg': 0.06629410405154267, 'border_count': 224, 'bagging_temperature': 9.726488327775965e-05, 'random_strength': 9.139139346527227, 'grow_policy': 'SymmetricTree', 'min_data_in_leaf': 122}. Best is trial 319 with value: 38829.28660377016.[0m
[32m[I 2024-10-13 01:05:42,110][0m Trial 325 finished with value: 40261.786294450365 and parameters: {'depth': 10, 'learning_rate': 0.2977969221515276, 'iterations': 349, 'l2_leaf_reg': 0.07383740251883783, 'border_count': 225, 'bagging_temperature': 0.00027974590374960074, 'random_strength': 9.155406329974216, 'grow_policy': 'SymmetricTree', 'min_data_in_leaf': 136}. Best is trial 319 with value: 38829.28660377016.[0m
[32m[I 2024-10-13 01:05:45,260][0m Trial 326 finished with value: 41529.657443789874 and parameters: {'depth': 10, 'learning_rate': 0.29823036856628293, 'iterations': 410, 'l2_leaf_reg': 0.07469687005106372, 'border_count': 224, 'bagging_temperature': 0.018055996920432905, 'random_strength': 9.223417086159154, 'grow_policy': 'SymmetricTree', 'min_data_in_leaf': 132}. Best is trial 319 with value: 38829.28660377016.[0m
[32m[I 2024-10-13 01:05:48,354][0m Trial 327 finished with value: 41299.12250697749 and parameters: {'depth': 10, 'learning_rate': 0.2894255743541595, 'iterations': 402, 'l2_leaf_reg': 0.0753703222874317, 'border_count': 223, 'bagging_temperature': 0.01925163586532132, 'random_strength': 9.222511275473908, 'grow_policy': 'SymmetricTree', 'min_data_in_leaf': 131}. Best is trial 319 with value: 38829.28660377016.[0m
[32m[I 2024-10-13 01:05:51,326][0m Trial 328 finished with value: 41742.73828171688 and parameters: {'depth': 10, 'learning_rate': 0.2939986134223847, 'iterations': 387, 'l2_leaf_reg': 0.07636466333123478, 'border_count': 224, 'bagging_temperature': 0.000846052648251213, 'random_strength': 9.387188839885136, 'grow_policy': 'SymmetricTree', 'min_data_in_leaf': 137}. Best is trial 319 with value: 38829.28660377016.[0m
[32m[I 2024-10-13 01:05:54,619][0m Trial 329 finished with value: 41213.486414240506 and parameters: {'depth': 10, 'learning_rate': 0.299714096911185, 'iterations': 399, 'l2_leaf_reg': 0.07616957002470126, 'border_count': 222, 'bagging_temperature': 0.0016771198651827958, 'random_strength': 9.25441772386876, 'grow_policy': 'SymmetricTree', 'min_data_in_leaf': 137}. Best is trial 319 with value: 38829.28660377016.[0m
[32m[I 2024-10-13 01:05:55,832][0m Trial 330 finished with value: 57305.52147441466 and parameters: {'depth': 10, 'learning_rate': 0.2977184599979741, 'iterations': 399, 'l2_leaf_reg': 0.0735777381876893, 'border_count': 223, 'bagging_temperature': 0.0004765256840260613, 'random_strength': 9.287445608905653, 'grow_policy': 'Lossguide', 'min_data_in_leaf': 135, 'max_leaves': 162}. Best is trial 319 with value: 38829.28660377016.[0m
[32m[I 2024-10-13 01:05:58,989][0m Trial 331 finished with value: 41088.48941444128 and parameters: {'depth': 10, 'learning_rate': 0.25626290627873854, 'iterations': 395, 'l2_leaf_reg': 0.05247786391244129, 'border_count': 224, 'bagging_temperature': 0.0006003147436240228, 'random_strength': 9.517638160449636, 'grow_policy': 'SymmetricTree', 'min_data_in_leaf': 123}. Best is trial 319 with value: 38829.28660377016.[0m
[32m[I 2024-10-13 01:06:02,168][0m Trial 332 finished with value: 41088.67084237035 and parameters: {'depth': 10, 'learning_rate': 0.25523926949132175, 'iterations': 399, 'l2_leaf_reg': 0.04669510969879238, 'border_count': 222, 'bagging_temperature': 0.0018527169104918324, 'random_strength': 9.550837379038459, 'grow_policy': 'SymmetricTree', 'min_data_in_leaf': 123}. Best is trial 319 with value: 38829.28660377016.[0m
[32m[I 2024-10-13 01:06:05,781][0m Trial 333 finished with value: 41366.09066369542 and parameters: {'depth': 10, 'learning_rate': 0.25049290702347593, 'iterations': 417, 'l2_leaf_reg': 0.04833377561722257, 'border_count': 224, 'bagging_temperature': 0.0003073103391503405, 'random_strength': 9.833796255999655, 'grow_policy': 'SymmetricTree', 'min_data_in_leaf': 121}. Best is trial 319 with value: 38829.28660377016.[0m
[32m[I 2024-10-13 01:06:09,457][0m Trial 334 finished with value: 40784.35189409302 and parameters: {'depth': 10, 'learning_rate': 0.2587490736493862, 'iterations': 401, 'l2_leaf_reg': 0.04727926407100862, 'border_count': 223, 'bagging_temperature': 0.0018335022268582458, 'random_strength': 9.889380728508465, 'grow_policy': 'SymmetricTree', 'min_data_in_leaf': 123}. Best is trial 319 with value: 38829.28660377016.[0m
[32m[I 2024-10-13 01:06:12,391][0m Trial 335 finished with value: 40828.1495586344 and parameters: {'depth': 10, 'learning_rate': 0.2533959226085576, 'iterations': 413, 'l2_leaf_reg': 0.023086854199669847, 'border_count': 224, 'bagging_temperature': 0.0012064366198919342, 'random_strength': 9.825256027475438, 'grow_policy': 'SymmetricTree', 'min_data_in_leaf': 128}. Best is trial 319 with value: 38829.28660377016.[0m
[32m[I 2024-10-13 01:06:15,876][0m Trial 336 finished with value: 40603.022444811155 and parameters: {'depth': 10, 'learning_rate': 0.26229783767238324, 'iterations': 415, 'l2_leaf_reg': 0.020286442897062763, 'border_count': 224, 'bagging_temperature': 7.846671309718321e-05, 'random_strength': 9.787507373460615, 'grow_policy': 'SymmetricTree', 'min_data_in_leaf': 126}. Best is trial 319 with value: 38829.28660377016.[0m
[32m[I 2024-10-13 01:06:19,566][0m Trial 337 finished with value: 41246.27055395662 and parameters: {'depth': 10, 'learning_rate': 0.2551465173408766, 'iterations': 420, 'l2_leaf_reg': 0.02538828431281957, 'border_count': 224, 'bagging_temperature': 0.015565488537696825, 'random_strength': 9.927113538926667, 'grow_policy': 'SymmetricTree', 'min_data_in_leaf': 125}. Best is trial 319 with value: 38829.28660377016.[0m
[32m[I 2024-10-13 01:06:23,040][0m Trial 338 finished with value: 42343.730865632 and parameters: {'depth': 10, 'learning_rate': 0.2468765898006337, 'iterations': 427, 'l2_leaf_reg': 0.021074095592021582, 'border_count': 216, 'bagging_temperature': 0.0015358035875271848, 'random_strength': 9.994119559675708, 'grow_policy': 'SymmetricTree', 'min_data_in_leaf': 122}. Best is trial 319 with value: 38829.28660377016.[0m
[32m[I 2024-10-13 01:06:26,685][0m Trial 339 finished with value: 41587.08655311105 and parameters: {'depth': 10, 'learning_rate': 0.2542196875521034, 'iterations': 491, 'l2_leaf_reg': 0.0491077105329905, 'border_count': 220, 'bagging_temperature': 0.017791798020702916, 'random_strength': 9.695965944801147, 'grow_policy': 'SymmetricTree', 'min_data_in_leaf': 146}. Best is trial 319 with value: 38829.28660377016.[0m
[32m[I 2024-10-13 01:06:30,300][0m Trial 340 finished with value: 41370.356762764415 and parameters: {'depth': 10, 'learning_rate': 0.2516716604041939, 'iterations': 486, 'l2_leaf_reg': 0.03391945221291129, 'border_count': 220, 'bagging_temperature': 0.0005017087361558464, 'random_strength': 9.710255171678396, 'grow_policy': 'SymmetricTree', 'min_data_in_leaf': 142}. Best is trial 319 with value: 38829.28660377016.[0m
[32m[I 2024-10-13 01:06:33,758][0m Trial 341 finished with value: 40197.239065371046 and parameters: {'depth': 10, 'learning_rate': 0.23623654011475415, 'iterations': 440, 'l2_leaf_reg': 0.010904236088848447, 'border_count': 225, 'bagging_temperature': 0.0008364031616706643, 'random_strength': 9.582737762506826, 'grow_policy': 'SymmetricTree', 'min_data_in_leaf': 158}. Best is trial 319 with value: 38829.28660377016.[0m
[32m[I 2024-10-13 01:06:34,980][0m Trial 342 finished with value: 54893.74629492355 and parameters: {'depth': 11, 'learning_rate': 0.23094931365017068, 'iterations': 527, 'l2_leaf_reg': 0.008159635416812474, 'border_count': 210, 'bagging_temperature': 0.01644007671794622, 'random_strength': 9.5906052078959, 'grow_policy': 'Depthwise', 'min_data_in_leaf': 154}. Best is trial 319 with value: 38829.28660377016.[0m
[32m[I 2024-10-13 01:06:38,084][0m Trial 343 finished with value: 40945.77382450262 and parameters: {'depth': 10, 'learning_rate': 0.24864346221815098, 'iterations': 439, 'l2_leaf_reg': 0.0278559598073311, 'border_count': 218, 'bagging_temperature': 0.0008289815285534581, 'random_strength': 9.844981119830987, 'grow_policy': 'SymmetricTree', 'min_data_in_leaf': 119}. Best is trial 319 with value: 38829.28660377016.[0m
[32m[I 2024-10-13 01:06:41,724][0m Trial 344 finished with value: 46956.2080921653 and parameters: {'depth': 10, 'learning_rate': 0.22176135059356167, 'iterations': 450, 'l2_leaf_reg': 0.02701837031047412, 'border_count': 215, 'bagging_temperature': 0.450686952667597, 'random_strength': 9.783537292654174, 'grow_policy': 'SymmetricTree', 'min_data_in_leaf': 164}. Best is trial 319 with value: 38829.28660377016.[0m
[32m[I 2024-10-13 01:06:45,608][0m Trial 345 finished with value: 39468.869000185216 and parameters: {'depth': 10, 'learning_rate': 0.25285988679411814, 'iterations': 473, 'l2_leaf_reg': 0.01284630442093029, 'border_count': 219, 'bagging_temperature': 0.0027118830590111102, 'random_strength': 9.030126028462826, 'grow_policy': 'SymmetricTree', 'min_data_in_leaf': 146}. Best is trial 319 with value: 38829.28660377016.[0m
[32m[I 2024-10-13 01:06:50,370][0m Trial 346 finished with value: 50876.227269773706 and parameters: {'depth': 10, 'learning_rate': 0.2489167267073593, 'iterations': 545, 'l2_leaf_reg': 0.013885103293841794, 'border_count': 225, 'bagging_temperature': 0.0006288408633950276, 'random_strength': 9.00005075293273, 'grow_policy': 'SymmetricTree', 'min_data_in_leaf': 116}. Best is trial 319 with value: 38829.28660377016.[0m
[32m[I 2024-10-13 01:06:53,898][0m Trial 347 finished with value: 43001.699854995604 and parameters: {'depth': 10, 'learning_rate': 0.224575796942528, 'iterations': 424, 'l2_leaf_reg': 0.048922339676898005, 'border_count': 219, 'bagging_temperature': 0.0009272546937840952, 'random_strength': 8.673569289571283, 'grow_policy': 'SymmetricTree', 'min_data_in_leaf': 148}. Best is trial 319 with value: 38829.28660377016.[0m
[32m[I 2024-10-13 01:06:57,067][0m Trial 348 finished with value: 40551.84895746995 and parameters: {'depth': 10, 'learning_rate': 0.2619866785472016, 'iterations': 426, 'l2_leaf_reg': 0.025291188262200486, 'border_count': 226, 'bagging_temperature': 0.026695152957064934, 'random_strength': 9.511888463021684, 'grow_policy': 'SymmetricTree', 'min_data_in_leaf': 118}. Best is trial 319 with value: 38829.28660377016.[0m
[32m[I 2024-10-13 01:07:00,809][0m Trial 349 finished with value: 42293.26411654432 and parameters: {'depth': 10, 'learning_rate': 0.21672624940249705, 'iterations': 468, 'l2_leaf_reg': 0.009610522402088425, 'border_count': 217, 'bagging_temperature': 0.025334614375983108, 'random_strength': 9.491757059536756, 'grow_policy': 'SymmetricTree', 'min_data_in_leaf': 173}. Best is trial 319 with value: 38829.28660377016.[0m
[32m[I 2024-10-13 01:07:03,747][0m Trial 350 finished with value: 40315.74200866333 and parameters: {'depth': 10, 'learning_rate': 0.2622585758085573, 'iterations': 414, 'l2_leaf_reg': 0.0225996858409648, 'border_count': 205, 'bagging_temperature': 0.025585147740158153, 'random_strength': 9.080924751727489, 'grow_policy': 'SymmetricTree', 'min_data_in_leaf': 134}. Best is trial 319 with value: 38829.28660377016.[0m
[32m[I 2024-10-13 01:07:11,198][0m Trial 351 finished with value: 51894.800334964835 and parameters: {'depth': 10, 'learning_rate': 0.26591796381687516, 'iterations': 512, 'l2_leaf_reg': 0.0229695251064392, 'border_count': 208, 'bagging_temperature': 0.02980984707496117, 'random_strength': 8.784270999495451, 'grow_policy': 'SymmetricTree', 'min_data_in_leaf': 137}. Best is trial 319 with value: 38829.28660377016.[0m
[32m[I 2024-10-13 01:07:15,331][0m Trial 352 finished with value: 44678.07809870122 and parameters: {'depth': 11, 'learning_rate': 0.26275378492166634, 'iterations': 440, 'l2_leaf_reg': 0.01262316439169165, 'border_count': 213, 'bagging_temperature': 0.02778790792660281, 'random_strength': 9.500433789831519, 'grow_policy': 'SymmetricTree', 'min_data_in_leaf': 160}. Best is trial 319 with value: 38829.28660377016.[0m
[32m[I 2024-10-13 01:07:18,703][0m Trial 353 finished with value: 42636.5100716149 and parameters: {'depth': 10, 'learning_rate': 0.20405223128544514, 'iterations': 424, 'l2_leaf_reg': 0.033628409374861834, 'border_count': 219, 'bagging_temperature': 0.031157838439935533, 'random_strength': 9.100101472105912, 'grow_policy': 'SymmetricTree', 'min_data_in_leaf': 128}. Best is trial 319 with value: 38829.28660377016.[0m
[32m[I 2024-10-13 01:07:19,828][0m Trial 354 finished with value: 54963.154714770346 and parameters: {'depth': 9, 'learning_rate': 0.26493891809203646, 'iterations': 503, 'l2_leaf_reg': 0.026679979760858643, 'border_count': 227, 'bagging_temperature': 0.054113196494105315, 'random_strength': 9.883104818415504, 'grow_policy': 'Lossguide', 'min_data_in_leaf': 110, 'max_leaves': 125}. Best is trial 319 with value: 38829.28660377016.[0m
[32m[I 2024-10-13 01:07:22,741][0m Trial 355 finished with value: 40589.616704848304 and parameters: {'depth': 10, 'learning_rate': 0.2592029992239515, 'iterations': 393, 'l2_leaf_reg': 0.04569332173237517, 'border_count': 221, 'bagging_temperature': 0.000425865992284428, 'random_strength': 8.84449987638846, 'grow_policy': 'SymmetricTree', 'min_data_in_leaf': 146}. Best is trial 319 with value: 38829.28660377016.[0m
[32m[I 2024-10-13 01:07:35,628][0m Trial 356 finished with value: 55175.35844726092 and parameters: {'depth': 11, 'learning_rate': 0.2160959900934545, 'iterations': 582, 'l2_leaf_reg': 0.018449028970354955, 'border_count': 195, 'bagging_temperature': 0.022563332551580485, 'random_strength': 8.468304712193857, 'grow_policy': 'SymmetricTree', 'min_data_in_leaf': 186}. Best is trial 319 with value: 38829.28660377016.[0m
[32m[I 2024-10-13 01:07:38,684][0m Trial 357 finished with value: 40525.810126238735 and parameters: {'depth': 9, 'learning_rate': 0.26013449330015975, 'iterations': 463, 'l2_leaf_reg': 0.04397467296350458, 'border_count': 220, 'bagging_temperature': 0.020680522926485187, 'random_strength': 8.814813312714934, 'grow_policy': 'SymmetricTree', 'min_data_in_leaf': 149}. Best is trial 319 with value: 38829.28660377016.[0m
[32m[I 2024-10-13 01:07:42,036][0m Trial 358 finished with value: 46169.487971066505 and parameters: {'depth': 9, 'learning_rate': 0.2466971667063725, 'iterations': 465, 'l2_leaf_reg': 0.04409756841397248, 'border_count': 205, 'bagging_temperature': 0.051179483769794684, 'random_strength': 8.896524182198807, 'grow_policy': 'SymmetricTree', 'min_data_in_leaf': 150}. Best is trial 319 with value: 38829.28660377016.[0m
[32m[I 2024-10-13 01:07:46,076][0m Trial 359 finished with value: 45717.297630287394 and parameters: {'depth': 9, 'learning_rate': 0.1980865092519518, 'iterations': 475, 'l2_leaf_reg': 0.03488710357398512, 'border_count': 215, 'bagging_temperature': 0.03207699977482766, 'random_strength': 9.553400965145343, 'grow_policy': 'SymmetricTree', 'min_data_in_leaf': 171}. Best is trial 319 with value: 38829.28660377016.[0m
[32m[I 2024-10-13 01:07:55,334][0m Trial 360 finished with value: 55448.47747103538 and parameters: {'depth': 9, 'learning_rate': 0.2510377139644213, 'iterations': 545, 'l2_leaf_reg': 0.017372011129978906, 'border_count': 220, 'bagging_temperature': 0.018386618808334598, 'random_strength': 9.98109890539327, 'grow_policy': 'SymmetricTree', 'min_data_in_leaf': 148}. Best is trial 319 with value: 38829.28660377016.[0m
[32m[I 2024-10-13 01:07:58,173][0m Trial 361 finished with value: 42759.08807184989 and parameters: {'depth': 10, 'learning_rate': 0.21184566561098417, 'iterations': 363, 'l2_leaf_reg': 0.05524189540565266, 'border_count': 228, 'bagging_temperature': 0.037286610744860615, 'random_strength': 8.77824806067684, 'grow_policy': 'SymmetricTree', 'min_data_in_leaf': 95}. Best is trial 319 with value: 38829.28660377016.[0m
[32m[I 2024-10-13 01:08:01,143][0m Trial 362 finished with value: 41894.984022698554 and parameters: {'depth': 10, 'learning_rate': 0.25894737632662157, 'iterations': 414, 'l2_leaf_reg': 0.008596930367951797, 'border_count': 211, 'bagging_temperature': 0.018030215828899722, 'random_strength': 9.507032977147611, 'grow_policy': 'SymmetricTree', 'min_data_in_leaf': 108}. Best is trial 319 with value: 38829.28660377016.[0m
