[32m[I 2024-10-13 01:43:26,466][0m Trial 928 finished with value: 45588.58983303999 and parameters: {'depth': 9, 'learning_rate': 0.16192941692274, 'iterations': 372, 'l2_leaf_reg': 4.653584133601656, 'border_count': 69, 'bagging_temperature': 0.03903379800175731, 'random_strength': 9.571578359965537, 'grow_policy': 'SymmetricTree', 'min_data_in_leaf': 101}. Best is trial 726 with value: 37144.045766835996.[0m
[32m[I 2024-10-13 01:43:31,556][0m Trial 929 finished with value: 48546.29495105796 and parameters: {'depth': 13, 'learning_rate': 0.19512927708072383, 'iterations': 243, 'l2_leaf_reg': 0.9011246082384972, 'border_count': 89, 'bagging_temperature': 0.08514057115149662, 'random_strength': 2.686739814942858, 'grow_policy': 'SymmetricTree', 'min_data_in_leaf': 313}. Best is trial 726 with value: 37144.045766835996.[0m
[32m[I 2024-10-13 01:43:32,127][0m Trial 930 finished with value: 52208.23905823312 and parameters: {'depth': 8, 'learning_rate': 0.23447219806428887, 'iterations': 153, 'l2_leaf_reg': 2.968923050168091, 'border_count': 98, 'bagging_temperature': 0.0005499656555620624, 'random_strength': 9.165006936111528, 'grow_policy': 'Depthwise', 'min_data_in_leaf': 984}. Best is trial 726 with value: 37144.045766835996.[0m
[32m[I 2024-10-13 01:43:33,886][0m Trial 931 finished with value: 38660.19165455259 and parameters: {'depth': 9, 'learning_rate': 0.29916540259846003, 'iterations': 419, 'l2_leaf_reg': 0.28642886132822043, 'border_count': 98, 'bagging_temperature': 0.03504723113623825, 'random_strength': 9.716091764566727, 'grow_policy': 'SymmetricTree', 'min_data_in_leaf': 72}. Best is trial 726 with value: 37144.045766835996.[0m
[32m[I 2024-10-13 01:43:35,547][0m Trial 932 finished with value: 47473.105438977705 and parameters: {'depth': 9, 'learning_rate': 0.25760721517202717, 'iterations': 417, 'l2_leaf_reg': 0.27345362413728175, 'border_count': 100, 'bagging_temperature': 0.09608795166000751, 'random_strength': 9.387136093867461, 'grow_policy': 'SymmetricTree', 'min_data_in_leaf': 44}. Best is trial 726 with value: 37144.045766835996.[0m
[32m[I 2024-10-13 01:43:37,260][0m Trial 933 finished with value: 49526.924654640825 and parameters: {'depth': 9, 'learning_rate': 0.2114384633994426, 'iterations': 435, 'l2_leaf_reg': 0.2565593132368252, 'border_count': 92, 'bagging_temperature': 0.07234279541945421, 'random_strength': 9.059687273906958, 'grow_policy': 'SymmetricTree', 'min_data_in_leaf': 68}. Best is trial 726 with value: 37144.045766835996.[0m
[32m[I 2024-10-13 01:43:38,984][0m Trial 934 finished with value: 44547.65896630607 and parameters: {'depth': 9, 'learning_rate': 0.2576606332521629, 'iterations': 428, 'l2_leaf_reg': 0.271220666670107, 'border_count': 98, 'bagging_temperature': 0.06396588955938674, 'random_strength': 9.49015881713606, 'grow_policy': 'SymmetricTree', 'min_data_in_leaf': 35}. Best is trial 726 with value: 37144.045766835996.[0m
[32m[I 2024-10-13 01:43:40,296][0m Trial 935 finished with value: 51517.17070890913 and parameters: {'depth': 8, 'learning_rate': 0.18190844305137238, 'iterations': 369, 'l2_leaf_reg': 0.46973078548981556, 'border_count': 102, 'bagging_temperature': 0.04944649950680162, 'random_strength': 9.23775028183943, 'grow_policy': 'SymmetricTree', 'min_data_in_leaf': 61}. Best is trial 726 with value: 37144.045766835996.[0m
[32m[I 2024-10-13 01:43:42,486][0m Trial 936 finished with value: 50957.318228806354 and parameters: {'depth': 9, 'learning_rate': 0.22647220411490407, 'iterations': 443, 'l2_leaf_reg': 0.19152292604627855, 'border_count': 108, 'bagging_temperature': 0.10953803567489714, 'random_strength': 9.641565702876136, 'grow_policy': 'SymmetricTree', 'min_data_in_leaf': 71}. Best is trial 726 with value: 37144.045766835996.[0m
[32m[I 2024-10-13 01:44:00,430][0m Trial 937 finished with value: 56932.75924189567 and parameters: {'depth': 9, 'learning_rate': 0.25951873712049883, 'iterations': 741, 'l2_leaf_reg': 0.34657395702523225, 'border_count': 101, 'bagging_temperature': 0.05129707641013213, 'random_strength': 8.896042962648607, 'grow_policy': 'SymmetricTree', 'min_data_in_leaf': 46}. Best is trial 726 with value: 37144.045766835996.[0m
[32m[I 2024-10-13 01:44:03,617][0m Trial 938 finished with value: 50317.73807971206 and parameters: {'depth': 9, 'learning_rate': 0.20469274755567698, 'iterations': 389, 'l2_leaf_reg': 0.4290041129581541, 'border_count': 95, 'bagging_temperature': 0.39503238664887574, 'random_strength': 9.422960620688256, 'grow_policy': 'SymmetricTree', 'min_data_in_leaf': 89}. Best is trial 726 with value: 37144.045766835996.[0m
[32m[I 2024-10-13 01:44:05,889][0m Trial 939 finished with value: 39314.28144574383 and parameters: {'depth': 9, 'learning_rate': 0.2998767761995976, 'iterations': 351, 'l2_leaf_reg': 0.22887299929215155, 'border_count': 160, 'bagging_temperature': 0.0371097007768078, 'random_strength': 9.687655783797066, 'grow_policy': 'SymmetricTree', 'min_data_in_leaf': 76}. Best is trial 726 with value: 37144.045766835996.[0m
[32m[I 2024-10-13 01:44:07,756][0m Trial 940 finished with value: 49690.31216265299 and parameters: {'depth': 9, 'learning_rate': 0.1418503741569468, 'iterations': 465, 'l2_leaf_reg': 0.3371557932250782, 'border_count': 89, 'bagging_temperature': 0.06380682430497879, 'random_strength': 9.234471379076496, 'grow_policy': 'SymmetricTree', 'min_data_in_leaf': 33}. Best is trial 726 with value: 37144.045766835996.[0m
[32m[I 2024-10-13 01:44:09,263][0m Trial 941 finished with value: 46961.702745931645 and parameters: {'depth': 8, 'learning_rate': 0.2586501062473383, 'iterations': 405, 'l2_leaf_reg': 1.0446152987468318, 'border_count': 99, 'bagging_temperature': 0.035322202455878665, 'random_strength': 9.52885769479823, 'grow_policy': 'SymmetricTree', 'min_data_in_leaf': 52}. Best is trial 726 with value: 37144.045766835996.[0m
[32m[I 2024-10-13 01:44:10,158][0m Trial 942 finished with value: 55404.53044255448 and parameters: {'depth': 10, 'learning_rate': 0.2994006457399577, 'iterations': 321, 'l2_leaf_reg': 0.17637218353484377, 'border_count': 113, 'bagging_temperature': 0.2428506022216377, 'random_strength': 9.043547468238415, 'grow_policy': 'Lossguide', 'min_data_in_leaf': 89, 'max_leaves': 38}. Best is trial 726 with value: 37144.045766835996.[0m
[32m[I 2024-10-13 01:44:11,701][0m Trial 943 finished with value: 47079.120434196644 and parameters: {'depth': 9, 'learning_rate': 0.023197241545347563, 'iterations': 354, 'l2_leaf_reg': 0.5281689700938695, 'border_count': 108, 'bagging_temperature': 0.08354817001372984, 'random_strength': 8.703985635072389, 'grow_policy': 'SymmetricTree', 'min_data_in_leaf': 67}. Best is trial 726 with value: 37144.045766835996.[0m
[32m[I 2024-10-13 01:44:13,652][0m Trial 944 finished with value: 48328.70761229518 and parameters: {'depth': 9, 'learning_rate': 0.22899558669794629, 'iterations': 499, 'l2_leaf_reg': 1.680773431015331, 'border_count': 55, 'bagging_temperature': 0.033318430557242866, 'random_strength': 9.717252044645639, 'grow_policy': 'SymmetricTree', 'min_data_in_leaf': 97}. Best is trial 726 with value: 37144.045766835996.[0m
[32m[I 2024-10-13 01:44:15,493][0m Trial 945 finished with value: 48715.09170133126 and parameters: {'depth': 9, 'learning_rate': 0.16855029200168356, 'iterations': 429, 'l2_leaf_reg': 0.32386451537394434, 'border_count': 79, 'bagging_temperature': 0.05281329231411122, 'random_strength': 9.331529698504005, 'grow_policy': 'SymmetricTree', 'min_data_in_leaf': 69}. Best is trial 726 with value: 37144.045766835996.[0m
[32m[I 2024-10-13 01:44:17,384][0m Trial 946 finished with value: 44410.001077866014 and parameters: {'depth': 10, 'learning_rate': 0.2245277884658394, 'iterations': 316, 'l2_leaf_reg': 0.732988803560808, 'border_count': 102, 'bagging_temperature': 0.03193799183955154, 'random_strength': 9.849191862200929, 'grow_policy': 'SymmetricTree', 'min_data_in_leaf': 108}. Best is trial 726 with value: 37144.045766835996.[0m
[32m[I 2024-10-13 01:44:19,096][0m Trial 947 finished with value: 38745.22823501128 and parameters: {'depth': 9, 'learning_rate': 0.2992196243712262, 'iterations': 390, 'l2_leaf_reg': 0.2374938681141902, 'border_count': 87, 'bagging_temperature': 0.017712966074528227, 'random_strength': 9.533266002346945, 'grow_policy': 'SymmetricTree', 'min_data_in_leaf': 939}. Best is trial 726 with value: 37144.045766835996.[0m
[32m[I 2024-10-13 01:44:21,462][0m Trial 948 finished with value: 38863.589022352804 and parameters: {'depth': 10, 'learning_rate': 0.2584817372520037, 'iterations': 455, 'l2_leaf_reg': 0.2060177958785193, 'border_count': 84, 'bagging_temperature': 0.018927679050381035, 'random_strength': 9.177051220238788, 'grow_policy': 'SymmetricTree', 'min_data_in_leaf': 952}. Best is trial 726 with value: 37144.045766835996.[0m
[32m[I 2024-10-13 01:44:30,071][0m Trial 949 finished with value: 53801.111958448186 and parameters: {'depth': 10, 'learning_rate': 0.2509068870947609, 'iterations': 555, 'l2_leaf_reg': 0.15405358452176238, 'border_count': 83, 'bagging_temperature': 0.019972166178149786, 'random_strength': 8.765383128619517, 'grow_policy': 'SymmetricTree', 'min_data_in_leaf': 933}. Best is trial 726 with value: 37144.045766835996.[0m
[32m[I 2024-10-13 01:44:34,225][0m Trial 950 finished with value: 49257.6824087854 and parameters: {'depth': 10, 'learning_rate': 0.2663184261838983, 'iterations': 539, 'l2_leaf_reg': 0.16193053556761927, 'border_count': 71, 'bagging_temperature': 0.015614886526216102, 'random_strength': 8.994856290326773, 'grow_policy': 'SymmetricTree', 'min_data_in_leaf': 951}. Best is trial 726 with value: 37144.045766835996.[0m
[32m[I 2024-10-13 01:44:36,639][0m Trial 951 finished with value: 40355.85839076567 and parameters: {'depth': 10, 'learning_rate': 0.29993820861498854, 'iterations': 459, 'l2_leaf_reg': 0.22431621585968545, 'border_count': 106, 'bagging_temperature': 0.018732182160265804, 'random_strength': 8.85953737265521, 'grow_policy': 'SymmetricTree', 'min_data_in_leaf': 948}. Best is trial 726 with value: 37144.045766835996.[0m
[32m[I 2024-10-13 01:44:38,843][0m Trial 952 finished with value: 58185.86779135113 and parameters: {'depth': 10, 'learning_rate': 0.19871369190419463, 'iterations': 2113, 'l2_leaf_reg': 0.1834394188479533, 'border_count': 87, 'bagging_temperature': 0.04587676832563269, 'random_strength': 9.07629271115305, 'grow_policy': 'Depthwise', 'min_data_in_leaf': 937}. Best is trial 726 with value: 37144.045766835996.[0m
[32m[I 2024-10-13 01:44:47,022][0m Trial 953 finished with value: 53147.19299274913 and parameters: {'depth': 10, 'learning_rate': 0.25519004285589114, 'iterations': 502, 'l2_leaf_reg': 0.23585283110963073, 'border_count': 92, 'bagging_temperature': 0.017072240227032, 'random_strength': 9.20723919056645, 'grow_policy': 'SymmetricTree', 'min_data_in_leaf': 900}. Best is trial 726 with value: 37144.045766835996.[0m
[32m[I 2024-10-13 01:44:49,625][0m Trial 954 finished with value: 47239.48483655004 and parameters: {'depth': 10, 'learning_rate': 0.2566781569039047, 'iterations': 494, 'l2_leaf_reg': 0.16118066050964114, 'border_count': 87, 'bagging_temperature': 0.05812266934997667, 'random_strength': 8.9507801059358, 'grow_policy': 'SymmetricTree', 'min_data_in_leaf': 918}. Best is trial 726 with value: 37144.045766835996.[0m
[32m[I 2024-10-13 01:45:05,600][0m Trial 955 finished with value: 54102.802218501856 and parameters: {'depth': 10, 'learning_rate': 0.2994050459959919, 'iterations': 665, 'l2_leaf_reg': 0.2451494312788524, 'border_count': 79, 'bagging_temperature': 0.49336875456959534, 'random_strength': 9.200506352989128, 'grow_policy': 'SymmetricTree', 'min_data_in_leaf': 942}. Best is trial 726 with value: 37144.045766835996.[0m
[32m[I 2024-10-13 01:45:08,011][0m Trial 956 finished with value: 41897.38659785452 and parameters: {'depth': 10, 'learning_rate': 0.21363228932248315, 'iterations': 454, 'l2_leaf_reg': 0.14538911792104378, 'border_count': 81, 'bagging_temperature': 0.034581774017709926, 'random_strength': 8.697954669707883, 'grow_policy': 'SymmetricTree', 'min_data_in_leaf': 989}. Best is trial 726 with value: 37144.045766835996.[0m
[32m[I 2024-10-13 01:45:10,298][0m Trial 957 finished with value: 54435.84366050411 and parameters: {'depth': 3, 'learning_rate': 0.1899036801516243, 'iterations': 536, 'l2_leaf_reg': 0.23769623044029933, 'border_count': 78, 'bagging_temperature': 2.008219006762249e-05, 'random_strength': 9.27182218466423, 'grow_policy': 'SymmetricTree', 'min_data_in_leaf': 918}. Best is trial 726 with value: 37144.045766835996.[0m
[32m[I 2024-10-13 01:45:12,862][0m Trial 958 finished with value: 38997.17027933886 and parameters: {'depth': 10, 'learning_rate': 0.22718505098860786, 'iterations': 425, 'l2_leaf_reg': 0.3235232714615265, 'border_count': 75, 'bagging_temperature': 0.01697977371031277, 'random_strength': 9.083488815267819, 'grow_policy': 'SymmetricTree', 'min_data_in_leaf': 911}. Best is trial 726 with value: 37144.045766835996.[0m
[32m[I 2024-10-13 01:45:22,718][0m Trial 959 finished with value: 53895.419762042286 and parameters: {'depth': 10, 'learning_rate': 0.2995913969776829, 'iterations': 585, 'l2_leaf_reg': 0.17800269523499831, 'border_count': 85, 'bagging_temperature': 0.048321868008069285, 'random_strength': 9.33842072427789, 'grow_policy': 'SymmetricTree', 'min_data_in_leaf': 984}. Best is trial 726 with value: 37144.045766835996.[0m
[32m[I 2024-10-13 01:45:25,173][0m Trial 960 finished with value: 39179.87132841959 and parameters: {'depth': 10, 'learning_rate': 0.2546718025957921, 'iterations': 468, 'l2_leaf_reg': 0.30301108267695837, 'border_count': 88, 'bagging_temperature': 0.03292236507930262, 'random_strength': 8.91767144651673, 'grow_policy': 'SymmetricTree', 'min_data_in_leaf': 963}. Best is trial 726 with value: 37144.045766835996.[0m
[32m[I 2024-10-13 01:45:27,342][0m Trial 961 finished with value: 45479.27423698236 and parameters: {'depth': 10, 'learning_rate': 0.23134712508851585, 'iterations': 395, 'l2_leaf_reg': 0.22734057740158695, 'border_count': 82, 'bagging_temperature': 0.07407402401163377, 'random_strength': 9.428337055811273, 'grow_policy': 'SymmetricTree', 'min_data_in_leaf': 950}. Best is trial 726 with value: 37144.045766835996.[0m
[32m[I 2024-10-13 01:45:29,513][0m Trial 962 finished with value: 39458.44775033421 and parameters: {'depth': 10, 'learning_rate': 0.1942939952131909, 'iterations': 407, 'l2_leaf_reg': 0.14752099784726574, 'border_count': 92, 'bagging_temperature': 0.0001985671429404953, 'random_strength': 9.14563800334506, 'grow_policy': 'SymmetricTree', 'min_data_in_leaf': 949}. Best is trial 726 with value: 37144.045766835996.[0m
[32m[I 2024-10-13 01:45:40,322][0m Trial 963 finished with value: 54411.111514996264 and parameters: {'depth': 10, 'learning_rate': 0.2581636546864835, 'iterations': 522, 'l2_leaf_reg': 0.3797027986019066, 'border_count': 91, 'bagging_temperature': 0.023188405414206505, 'random_strength': 8.790287746370266, 'grow_policy': 'SymmetricTree', 'min_data_in_leaf': 969}. Best is trial 726 with value: 37144.045766835996.[0m
[32m[I 2024-10-13 01:45:41,203][0m Trial 964 finished with value: 54092.24772640524 and parameters: {'depth': 10, 'learning_rate': 0.26004742588816787, 'iterations': 455, 'l2_leaf_reg': 0.24311566079809488, 'border_count': 75, 'bagging_temperature': 0.04813680424960014, 'random_strength': 9.992923880091706, 'grow_policy': 'Lossguide', 'min_data_in_leaf': 970, 'max_leaves': 137}. Best is trial 726 with value: 37144.045766835996.[0m
[32m[I 2024-10-13 01:45:43,317][0m Trial 965 finished with value: 40533.201194824134 and parameters: {'depth': 10, 'learning_rate': 0.2995615745119323, 'iterations': 388, 'l2_leaf_reg': 0.0005663940732670558, 'border_count': 88, 'bagging_temperature': 0.0002944480084394324, 'random_strength': 9.343179024078408, 'grow_policy': 'SymmetricTree', 'min_data_in_leaf': 902}. Best is trial 726 with value: 37144.045766835996.[0m
[32m[I 2024-10-13 01:45:45,103][0m Trial 966 finished with value: 46566.297360682496 and parameters: {'depth': 9, 'learning_rate': 0.16332352242562012, 'iterations': 448, 'l2_leaf_reg': 0.1351376512329218, 'border_count': 97, 'bagging_temperature': 0.017860518585880652, 'random_strength': 9.539924335361778, 'grow_policy': 'SymmetricTree', 'min_data_in_leaf': 900}. Best is trial 726 with value: 37144.045766835996.[0m
[32m[I 2024-10-13 01:45:47,182][0m Trial 967 finished with value: 53902.44062712087 and parameters: {'depth': 10, 'learning_rate': 0.20826623415959547, 'iterations': 385, 'l2_leaf_reg': 0.3977826137469826, 'border_count': 93, 'bagging_temperature': 0.03356163148438612, 'random_strength': 0.4009907957011478, 'grow_policy': 'SymmetricTree', 'min_data_in_leaf': 949}. Best is trial 726 with value: 37144.045766835996.[0m
[32m[I 2024-10-13 01:45:48,726][0m Trial 968 finished with value: 53114.31409995849 and parameters: {'depth': 8, 'learning_rate': 0.23019463678468902, 'iterations': 496, 'l2_leaf_reg': 0.35255178718016106, 'border_count': 84, 'bagging_temperature': 0.06304019293541836, 'random_strength': 9.729117242869197, 'grow_policy': 'SymmetricTree', 'min_data_in_leaf': 972}. Best is trial 726 with value: 37144.045766835996.[0m
[32m[I 2024-10-13 01:45:50,319][0m Trial 969 finished with value: 41409.66363049873 and parameters: {'depth': 9, 'learning_rate': 0.2615316398470638, 'iterations': 374, 'l2_leaf_reg': 0.2153331472130098, 'border_count': 82, 'bagging_temperature': 0.01600452326722331, 'random_strength': 8.525861697860455, 'grow_policy': 'SymmetricTree', 'min_data_in_leaf': 936}. Best is trial 726 with value: 37144.045766835996.[0m
[32m[I 2024-10-13 01:45:52,479][0m Trial 970 finished with value: 41340.131206722166 and parameters: {'depth': 10, 'learning_rate': 0.1786343872188537, 'iterations': 418, 'l2_leaf_reg': 0.14182907836982617, 'border_count': 96, 'bagging_temperature': 0.041337556752851445, 'random_strength': 9.998526474617693, 'grow_policy': 'SymmetricTree', 'min_data_in_leaf': 878}. Best is trial 726 with value: 37144.045766835996.[0m
[32m[I 2024-10-13 01:45:54,303][0m Trial 971 finished with value: 42270.66106566534 and parameters: {'depth': 9, 'learning_rate': 0.22783182259799517, 'iterations': 476, 'l2_leaf_reg': 0.3954983202632635, 'border_count': 78, 'bagging_temperature': 0.0005608706626612919, 'random_strength': 9.068378575206124, 'grow_policy': 'SymmetricTree', 'min_data_in_leaf': 987}. Best is trial 726 with value: 37144.045766835996.[0m
[32m[I 2024-10-13 01:45:56,331][0m Trial 972 finished with value: 59642.17912874121 and parameters: {'depth': 10, 'learning_rate': 0.004380157613092561, 'iterations': 350, 'l2_leaf_reg': 0.5106750927722505, 'border_count': 89, 'bagging_temperature': 0.03126425006609379, 'random_strength': 9.281235737884593, 'grow_policy': 'SymmetricTree', 'min_data_in_leaf': 924}. Best is trial 726 with value: 37144.045766835996.[0m
[32m[I 2024-10-13 01:45:57,987][0m Trial 973 finished with value: 47653.347308216245 and parameters: {'depth': 9, 'learning_rate': 0.2657614648224402, 'iterations': 423, 'l2_leaf_reg': 0.18773936963987303, 'border_count': 62, 'bagging_temperature': 0.06145663195520956, 'random_strength': 9.464588452385, 'grow_policy': 'SymmetricTree', 'min_data_in_leaf': 926}. Best is trial 726 with value: 37144.045766835996.[0m
[32m[I 2024-10-13 01:45:58,803][0m Trial 974 finished with value: 55758.73375599338 and parameters: {'depth': 11, 'learning_rate': 0.29991018533299374, 'iterations': 353, 'l2_leaf_reg': 2.189022269369023e-06, 'border_count': 97, 'bagging_temperature': 0.01897138524461435, 'random_strength': 9.672773317571528, 'grow_policy': 'Depthwise', 'min_data_in_leaf': 954}. Best is trial 726 with value: 37144.045766835996.[0m
[32m[I 2024-10-13 01:46:09,993][0m Trial 975 finished with value: 54146.35634157407 and parameters: {'depth': 10, 'learning_rate': 0.2169034079524492, 'iterations': 579, 'l2_leaf_reg': 0.31936331116188893, 'border_count': 87, 'bagging_temperature': 0.21341452299443098, 'random_strength': 8.97868092497108, 'grow_policy': 'SymmetricTree', 'min_data_in_leaf': 886}. Best is trial 726 with value: 37144.045766835996.[0m
[32m[I 2024-10-13 01:46:16,985][0m Trial 976 finished with value: 53866.99355693343 and parameters: {'depth': 9, 'learning_rate': 0.25949368463901235, 'iterations': 503, 'l2_leaf_reg': 0.5349708342265496, 'border_count': 145, 'bagging_temperature': 0.09001240746439595, 'random_strength': 9.198904223281833, 'grow_policy': 'SymmetricTree', 'min_data_in_leaf': 944}. Best is trial 726 with value: 37144.045766835996.[0m
[32m[I 2024-10-13 01:46:18,827][0m Trial 977 finished with value: 63473.45833968122 and parameters: {'depth': 9, 'learning_rate': 0.0031088872472744425, 'iterations': 405, 'l2_leaf_reg': 0.25972786549252874, 'border_count': 90, 'bagging_temperature': 0.04625534501672147, 'random_strength': 9.552077621344136, 'grow_policy': 'SymmetricTree', 'min_data_in_leaf': 964}. Best is trial 726 with value: 37144.045766835996.[0m
[32m[I 2024-10-13 01:46:29,674][0m Trial 978 finished with value: 53945.73384534017 and parameters: {'depth': 10, 'learning_rate': 0.1947544982014056, 'iterations': 612, 'l2_leaf_reg': 0.11760126569952942, 'border_count': 99, 'bagging_temperature': 0.01680316045152605, 'random_strength': 9.766446389086466, 'grow_policy': 'SymmetricTree', 'min_data_in_leaf': 921}. Best is trial 726 with value: 37144.045766835996.[0m
[32m[I 2024-10-13 01:46:31,288][0m Trial 979 finished with value: 38227.71076072275 and parameters: {'depth': 9, 'learning_rate': 0.29871197814633854, 'iterations': 349, 'l2_leaf_reg': 0.0003083336444652664, 'border_count': 73, 'bagging_temperature': 0.032139885719492375, 'random_strength': 9.421598697732326, 'grow_policy': 'SymmetricTree', 'min_data_in_leaf': 885}. Best is trial 726 with value: 37144.045766835996.[0m
