[32m[I 2024-10-13 01:38:53,400][0m Trial 772 finished with value: 50816.626231545866 and parameters: {'depth': 9, 'learning_rate': 0.2586980091973207, 'iterations': 229, 'l2_leaf_reg': 0.6742167581459705, 'border_count': 136, 'bagging_temperature': 0.856485262533638, 'random_strength': 9.781046364207228, 'grow_policy': 'SymmetricTree', 'min_data_in_leaf': 130}. Best is trial 726 with value: 37144.045766835996.[0m
[32m[I 2024-10-13 01:38:54,163][0m Trial 773 finished with value: 54100.855338302856 and parameters: {'depth': 9, 'learning_rate': 0.1924331092696831, 'iterations': 306, 'l2_leaf_reg': 0.3036989481153054, 'border_count': 128, 'bagging_temperature': 0.04077160411041493, 'random_strength': 9.499738503597433, 'grow_policy': 'Depthwise', 'min_data_in_leaf': 757}. Best is trial 726 with value: 37144.045766835996.[0m
[32m[I 2024-10-13 01:38:55,269][0m Trial 774 finished with value: 48998.649780162355 and parameters: {'depth': 9, 'learning_rate': 0.2617273059546318, 'iterations': 204, 'l2_leaf_reg': 0.6243553924281229, 'border_count': 119, 'bagging_temperature': 0.3576383447578346, 'random_strength': 9.788763860578534, 'grow_policy': 'SymmetricTree', 'min_data_in_leaf': 687}. Best is trial 726 with value: 37144.045766835996.[0m
[32m[I 2024-10-13 01:38:56,351][0m Trial 775 finished with value: 46169.46444530644 and parameters: {'depth': 8, 'learning_rate': 0.29938886247948676, 'iterations': 260, 'l2_leaf_reg': 0.37263467099683645, 'border_count': 127, 'bagging_temperature': 0.0006543300396020905, 'random_strength': 9.622541480266554, 'grow_policy': 'SymmetricTree', 'min_data_in_leaf': 916}. Best is trial 726 with value: 37144.045766835996.[0m
[32m[I 2024-10-13 01:38:57,836][0m Trial 776 finished with value: 47111.45179037935 and parameters: {'depth': 9, 'learning_rate': 0.22802032247587187, 'iterations': 325, 'l2_leaf_reg': 1.2894680738322783, 'border_count': 237, 'bagging_temperature': 0.07694892350980083, 'random_strength': 9.807626141793785, 'grow_policy': 'SymmetricTree', 'min_data_in_leaf': 895}. Best is trial 726 with value: 37144.045766835996.[0m
[32m[I 2024-10-13 01:38:59,249][0m Trial 777 finished with value: 40550.27304208711 and parameters: {'depth': 9, 'learning_rate': 0.21150739070332986, 'iterations': 309, 'l2_leaf_reg': 0.9023922740890437, 'border_count': 120, 'bagging_temperature': 0.020803879439897706, 'random_strength': 9.457365611417057, 'grow_policy': 'SymmetricTree', 'min_data_in_leaf': 815}. Best is trial 726 with value: 37144.045766835996.[0m
[32m[I 2024-10-13 01:39:00,550][0m Trial 778 finished with value: 133297.38738389264 and parameters: {'depth': 9, 'learning_rate': 0.00023459970990595436, 'iterations': 247, 'l2_leaf_reg': 0.31255475054870996, 'border_count': 125, 'bagging_temperature': 0.04970863395890959, 'random_strength': 9.644633979090791, 'grow_policy': 'SymmetricTree', 'min_data_in_leaf': 109}. Best is trial 726 with value: 37144.045766835996.[0m
[32m[I 2024-10-13 01:39:01,694][0m Trial 779 finished with value: 42234.77628348651 and parameters: {'depth': 9, 'learning_rate': 0.299868996449296, 'iterations': 204, 'l2_leaf_reg': 0.5184133630198933, 'border_count': 142, 'bagging_temperature': 0.01589855560705233, 'random_strength': 9.443276803975422, 'grow_policy': 'SymmetricTree', 'min_data_in_leaf': 778}. Best is trial 726 with value: 37144.045766835996.[0m
[32m[I 2024-10-13 01:39:03,158][0m Trial 780 finished with value: 39447.306600377655 and parameters: {'depth': 9, 'learning_rate': 0.16851500136766803, 'iterations': 308, 'l2_leaf_reg': 0.7090942955926786, 'border_count': 128, 'bagging_temperature': 0.038539836037150506, 'random_strength': 9.993823923112046, 'grow_policy': 'SymmetricTree', 'min_data_in_leaf': 95}. Best is trial 726 with value: 37144.045766835996.[0m
[32m[I 2024-10-13 01:39:04,660][0m Trial 781 finished with value: 39151.983359779086 and parameters: {'depth': 9, 'learning_rate': 0.2553187818151435, 'iterations': 323, 'l2_leaf_reg': 0.26372836059427734, 'border_count': 237, 'bagging_temperature': 0.019879210647366367, 'random_strength': 9.785558648889737, 'grow_policy': 'SymmetricTree', 'min_data_in_leaf': 116}. Best is trial 726 with value: 37144.045766835996.[0m
[32m[I 2024-10-13 01:39:05,812][0m Trial 782 finished with value: 49799.62484113774 and parameters: {'depth': 9, 'learning_rate': 0.23585643173851825, 'iterations': 241, 'l2_leaf_reg': 0.29979559284619745, 'border_count': 115, 'bagging_temperature': 0.30554908219307364, 'random_strength': 9.609972681145129, 'grow_policy': 'SymmetricTree', 'min_data_in_leaf': 762}. Best is trial 726 with value: 37144.045766835996.[0m
[32m[I 2024-10-13 01:39:06,870][0m Trial 783 finished with value: 49448.78493191686 and parameters: {'depth': 9, 'learning_rate': 0.20259996835415436, 'iterations': 183, 'l2_leaf_reg': 0.3660439980012624, 'border_count': 133, 'bagging_temperature': 0.11127349571626273, 'random_strength': 9.800478103998147, 'grow_policy': 'SymmetricTree', 'min_data_in_leaf': 610}. Best is trial 726 with value: 37144.045766835996.[0m
[32m[I 2024-10-13 01:39:08,269][0m Trial 784 finished with value: 38550.864934123645 and parameters: {'depth': 9, 'learning_rate': 0.257724405707798, 'iterations': 328, 'l2_leaf_reg': 0.5206724174764983, 'border_count': 239, 'bagging_temperature': 0.00021630923914145797, 'random_strength': 9.451683461294472, 'grow_policy': 'SymmetricTree', 'min_data_in_leaf': 790}. Best is trial 726 with value: 37144.045766835996.[0m
[32m[I 2024-10-13 01:39:09,022][0m Trial 785 finished with value: 55512.1242873183 and parameters: {'depth': 8, 'learning_rate': 0.1852282355192873, 'iterations': 257, 'l2_leaf_reg': 0.5658084157649829, 'border_count': 118, 'bagging_temperature': 0.018177009468662, 'random_strength': 9.42726713972466, 'grow_policy': 'Lossguide', 'min_data_in_leaf': 787, 'max_leaves': 129}. Best is trial 726 with value: 37144.045766835996.[0m
[32m[I 2024-10-13 01:39:10,463][0m Trial 786 finished with value: 43485.42252147573 and parameters: {'depth': 9, 'learning_rate': 0.1523443240808372, 'iterations': 301, 'l2_leaf_reg': 0.8745769838854042, 'border_count': 240, 'bagging_temperature': 0.0019295605937589967, 'random_strength': 9.40679229583686, 'grow_policy': 'SymmetricTree', 'min_data_in_leaf': 88}. Best is trial 726 with value: 37144.045766835996.[0m
[32m[I 2024-10-13 01:39:11,506][0m Trial 787 finished with value: 47034.17912355188 and parameters: {'depth': 9, 'learning_rate': 0.23035132291614552, 'iterations': 196, 'l2_leaf_reg': 1.6367420626941724, 'border_count': 115, 'bagging_temperature': 0.0006869868364230772, 'random_strength': 9.654755091249397, 'grow_policy': 'SymmetricTree', 'min_data_in_leaf': 811}. Best is trial 726 with value: 37144.045766835996.[0m
[32m[I 2024-10-13 01:39:12,883][0m Trial 788 finished with value: 41497.67260173305 and parameters: {'depth': 9, 'learning_rate': 0.19994177675695182, 'iterations': 313, 'l2_leaf_reg': 0.44914072257339055, 'border_count': 244, 'bagging_temperature': 0.0003181674318773753, 'random_strength': 9.431146902117057, 'grow_policy': 'SymmetricTree', 'min_data_in_leaf': 842}. Best is trial 726 with value: 37144.045766835996.[0m
[32m[I 2024-10-13 01:39:14,095][0m Trial 789 finished with value: 43398.90789298296 and parameters: {'depth': 9, 'learning_rate': 0.2502587307923997, 'iterations': 255, 'l2_leaf_reg': 0.42264121605906724, 'border_count': 237, 'bagging_temperature': 0.03342321428772122, 'random_strength': 9.810796048176032, 'grow_policy': 'SymmetricTree', 'min_data_in_leaf': 59}. Best is trial 726 with value: 37144.045766835996.[0m
[32m[I 2024-10-13 01:39:15,325][0m Trial 790 finished with value: 52024.46787862943 and parameters: {'depth': 8, 'learning_rate': 0.17025771879667462, 'iterations': 327, 'l2_leaf_reg': 0.9296659635713015, 'border_count': 250, 'bagging_temperature': 0.061855180507844415, 'random_strength': 9.557678989209318, 'grow_policy': 'SymmetricTree', 'min_data_in_leaf': 444}. Best is trial 726 with value: 37144.045766835996.[0m
[32m[I 2024-10-13 01:39:16,322][0m Trial 791 finished with value: 42110.95940542456 and parameters: {'depth': 9, 'learning_rate': 0.2585223332951123, 'iterations': 178, 'l2_leaf_reg': 0.33746735939851263, 'border_count': 130, 'bagging_temperature': 0.00035903939846598787, 'random_strength': 9.812886496373958, 'grow_policy': 'SymmetricTree', 'min_data_in_leaf': 803}. Best is trial 726 with value: 37144.045766835996.[0m
[32m[I 2024-10-13 01:39:17,548][0m Trial 792 finished with value: 40318.33354786063 and parameters: {'depth': 9, 'learning_rate': 0.2249865779868462, 'iterations': 260, 'l2_leaf_reg': 0.5949453146219743, 'border_count': 242, 'bagging_temperature': 0.03300062810170934, 'random_strength': 9.387279274156572, 'grow_policy': 'SymmetricTree', 'min_data_in_leaf': 829}. Best is trial 726 with value: 37144.045766835996.[0m
[32m[I 2024-10-13 01:39:28,590][0m Trial 793 finished with value: 52286.2326765168 and parameters: {'depth': 9, 'learning_rate': 0.13922380336530316, 'iterations': 1974, 'l2_leaf_reg': 0.279574190272421, 'border_count': 237, 'bagging_temperature': 0.01876414114696789, 'random_strength': 9.623774660120699, 'grow_policy': 'SymmetricTree', 'min_data_in_leaf': 780}. Best is trial 726 with value: 37144.045766835996.[0m
[32m[I 2024-10-13 01:39:30,000][0m Trial 794 finished with value: 48729.50828826622 and parameters: {'depth': 9, 'learning_rate': 0.2586496451936229, 'iterations': 329, 'l2_leaf_reg': 0.6418156449045046, 'border_count': 241, 'bagging_temperature': 0.04890409535065397, 'random_strength': 9.996519534833057, 'grow_policy': 'SymmetricTree', 'min_data_in_leaf': 741}. Best is trial 726 with value: 37144.045766835996.[0m
[32m[I 2024-10-13 01:39:31,152][0m Trial 795 finished with value: 90274.09101577043 and parameters: {'depth': 9, 'learning_rate': 0.002501612715780701, 'iterations': 230, 'l2_leaf_reg': 0.3403267279082772, 'border_count': 248, 'bagging_temperature': 0.018592684666917852, 'random_strength': 9.418187053474687, 'grow_policy': 'SymmetricTree', 'min_data_in_leaf': 649}. Best is trial 726 with value: 37144.045766835996.[0m
[32m[I 2024-10-13 01:39:31,922][0m Trial 796 finished with value: 55782.872694154714 and parameters: {'depth': 9, 'learning_rate': 0.2085504979632388, 'iterations': 341, 'l2_leaf_reg': 1.3040814519483541, 'border_count': 237, 'bagging_temperature': 0.03658570880160921, 'random_strength': 9.792739707636139, 'grow_policy': 'Depthwise', 'min_data_in_leaf': 366}. Best is trial 726 with value: 37144.045766835996.[0m
[32m[I 2024-10-13 01:39:33,293][0m Trial 797 finished with value: 51291.896754024354 and parameters: {'depth': 9, 'learning_rate': 0.0077929472049322514, 'iterations': 286, 'l2_leaf_reg': 0.2444027506175661, 'border_count': 241, 'bagging_temperature': 0.0774023825018624, 'random_strength': 9.578480048897147, 'grow_policy': 'SymmetricTree', 'min_data_in_leaf': 720}. Best is trial 726 with value: 37144.045766835996.[0m
[32m[I 2024-10-13 01:39:34,105][0m Trial 798 finished with value: 50848.03179450961 and parameters: {'depth': 8, 'learning_rate': 0.2608389494202209, 'iterations': 144, 'l2_leaf_reg': 0.8508298346932383, 'border_count': 245, 'bagging_temperature': 0.05971678884116563, 'random_strength': 9.391231839597477, 'grow_policy': 'SymmetricTree', 'min_data_in_leaf': 791}. Best is trial 726 with value: 37144.045766835996.[0m
[32m[I 2024-10-13 01:39:35,558][0m Trial 799 finished with value: 41774.74584333642 and parameters: {'depth': 9, 'learning_rate': 0.2999189040024337, 'iterations': 335, 'l2_leaf_reg': 0.4976883958470923, 'border_count': 236, 'bagging_temperature': 0.017597628770850537, 'random_strength': 9.8287613293949, 'grow_policy': 'SymmetricTree', 'min_data_in_leaf': 638}. Best is trial 726 with value: 37144.045766835996.[0m
[32m[I 2024-10-13 01:39:36,651][0m Trial 800 finished with value: 43316.089340486236 and parameters: {'depth': 9, 'learning_rate': 0.18422396757585446, 'iterations': 212, 'l2_leaf_reg': 0.26024153351851137, 'border_count': 237, 'bagging_temperature': 0.038802797157364816, 'random_strength': 9.68193699293379, 'grow_policy': 'SymmetricTree', 'min_data_in_leaf': 707}. Best is trial 726 with value: 37144.045766835996.[0m
[32m[I 2024-10-13 01:39:37,911][0m Trial 801 finished with value: 43528.19150374971 and parameters: {'depth': 9, 'learning_rate': 0.2265809635098103, 'iterations': 279, 'l2_leaf_reg': 0.4205888821764992, 'border_count': 147, 'bagging_temperature': 0.016797867508769986, 'random_strength': 9.994936191212432, 'grow_policy': 'SymmetricTree', 'min_data_in_leaf': 818}. Best is trial 726 with value: 37144.045766835996.[0m
[32m[I 2024-10-13 01:39:39,368][0m Trial 802 finished with value: 47779.3320445849 and parameters: {'depth': 9, 'learning_rate': 0.2531816080693252, 'iterations': 347, 'l2_leaf_reg': 2.3267889460671807, 'border_count': 251, 'bagging_temperature': 0.04915134734785814, 'random_strength': 9.509330908909407, 'grow_policy': 'SymmetricTree', 'min_data_in_leaf': 791}. Best is trial 726 with value: 37144.045766835996.[0m
[32m[I 2024-10-13 01:39:40,465][0m Trial 803 finished with value: 51823.042748220505 and parameters: {'depth': 8, 'learning_rate': 0.20316035220837889, 'iterations': 262, 'l2_leaf_reg': 0.8088926035580569, 'border_count': 243, 'bagging_temperature': 0.031091526386912496, 'random_strength': 1.854766058300119, 'grow_policy': 'SymmetricTree', 'min_data_in_leaf': 107}. Best is trial 726 with value: 37144.045766835996.[0m
[32m[I 2024-10-13 01:39:41,918][0m Trial 804 finished with value: 43518.833808438 and parameters: {'depth': 9, 'learning_rate': 0.23012150593980715, 'iterations': 347, 'l2_leaf_reg': 0.3382399144828758, 'border_count': 118, 'bagging_temperature': 0.0003446834310801422, 'random_strength': 9.324729631556059, 'grow_policy': 'SymmetricTree', 'min_data_in_leaf': 506}. Best is trial 726 with value: 37144.045766835996.[0m
[32m[I 2024-10-13 01:39:42,987][0m Trial 805 finished with value: 49908.42443034657 and parameters: {'depth': 9, 'learning_rate': 0.26019084788257885, 'iterations': 186, 'l2_leaf_reg': 0.5238589698607667, 'border_count': 178, 'bagging_temperature': 0.07042774610627278, 'random_strength': 9.665438218062302, 'grow_policy': 'SymmetricTree', 'min_data_in_leaf': 665}. Best is trial 726 with value: 37144.045766835996.[0m
[32m[I 2024-10-13 01:39:44,363][0m Trial 806 finished with value: 46898.049377111274 and parameters: {'depth': 9, 'learning_rate': 0.18994089924198204, 'iterations': 302, 'l2_leaf_reg': 1.2315709122115166, 'border_count': 234, 'bagging_temperature': 0.09261500946832381, 'random_strength': 9.787141454050301, 'grow_policy': 'SymmetricTree', 'min_data_in_leaf': 93}. Best is trial 726 with value: 37144.045766835996.[0m
[32m[I 2024-10-13 01:39:45,782][0m Trial 807 finished with value: 42537.83654709022 and parameters: {'depth': 9, 'learning_rate': 0.15714512330233868, 'iterations': 336, 'l2_leaf_reg': 3.743220305665953, 'border_count': 88, 'bagging_temperature': 0.017328485157907105, 'random_strength': 9.346919401516226, 'grow_policy': 'SymmetricTree', 'min_data_in_leaf': 867}. Best is trial 726 with value: 37144.045766835996.[0m
[32m[I 2024-10-13 01:39:46,805][0m Trial 808 finished with value: 48161.64525099011 and parameters: {'depth': 8, 'learning_rate': 0.2627433557213305, 'iterations': 241, 'l2_leaf_reg': 0.25132054454127867, 'border_count': 242, 'bagging_temperature': 0.03355161350682229, 'random_strength': 9.550653043815043, 'grow_policy': 'SymmetricTree', 'min_data_in_leaf': 424}. Best is trial 726 with value: 37144.045766835996.[0m
[32m[I 2024-10-13 01:39:47,711][0m Trial 809 finished with value: 48565.985695336174 and parameters: {'depth': 9, 'learning_rate': 0.22149471905482482, 'iterations': 138, 'l2_leaf_reg': 0.6428483532507216, 'border_count': 248, 'bagging_temperature': 0.05614147177295503, 'random_strength': 9.812586034126518, 'grow_policy': 'SymmetricTree', 'min_data_in_leaf': 50}. Best is trial 726 with value: 37144.045766835996.[0m
[32m[I 2024-10-13 01:39:49,520][0m Trial 810 finished with value: 55026.90924883349 and parameters: {'depth': 9, 'learning_rate': 0.2542241016086848, 'iterations': 1491, 'l2_leaf_reg': 0.2723540546242666, 'border_count': 235, 'bagging_temperature': 0.01614025154272081, 'random_strength': 9.99302043680568, 'grow_policy': 'Lossguide', 'min_data_in_leaf': 116, 'max_leaves': 158}. Best is trial 726 with value: 37144.045766835996.[0m
[32m[I 2024-10-13 01:39:51,273][0m Trial 811 finished with value: 49747.25610688415 and parameters: {'depth': 9, 'learning_rate': 0.20817846209620333, 'iterations': 367, 'l2_leaf_reg': 0.4152637623991007, 'border_count': 238, 'bagging_temperature': 0.3283649667484448, 'random_strength': 9.361836190895085, 'grow_policy': 'SymmetricTree', 'min_data_in_leaf': 122}. Best is trial 726 with value: 37144.045766835996.[0m
[32m[I 2024-10-13 01:39:52,651][0m Trial 812 finished with value: 46234.789437291045 and parameters: {'depth': 9, 'learning_rate': 0.29933838301718013, 'iterations': 280, 'l2_leaf_reg': 1.4826797204765285, 'border_count': 130, 'bagging_temperature': 0.041144906084298646, 'random_strength': 9.577501096882207, 'grow_policy': 'SymmetricTree', 'min_data_in_leaf': 768}. Best is trial 726 with value: 37144.045766835996.[0m
[32m[I 2024-10-13 01:39:53,656][0m Trial 813 finished with value: 46607.7485826348 and parameters: {'depth': 8, 'learning_rate': 0.2594946788638152, 'iterations': 206, 'l2_leaf_reg': 0.22748696954565933, 'border_count': 65, 'bagging_temperature': 0.019038269789225404, 'random_strength': 9.650444118099703, 'grow_policy': 'SymmetricTree', 'min_data_in_leaf': 736}. Best is trial 726 with value: 37144.045766835996.[0m
[32m[I 2024-10-13 01:39:55,327][0m Trial 814 finished with value: 42354.94446080425 and parameters: {'depth': 9, 'learning_rate': 0.16630140736986232, 'iterations': 372, 'l2_leaf_reg': 0.5552089119643903, 'border_count': 244, 'bagging_temperature': 0.0005177752727417682, 'random_strength': 9.355830165802809, 'grow_policy': 'SymmetricTree', 'min_data_in_leaf': 699}. Best is trial 726 with value: 37144.045766835996.[0m
[32m[I 2024-10-13 01:39:56,771][0m Trial 815 finished with value: 46661.71121251055 and parameters: {'depth': 9, 'learning_rate': 0.2990195102285608, 'iterations': 292, 'l2_leaf_reg': 0.3495094999949839, 'border_count': 142, 'bagging_temperature': 0.05986295624468772, 'random_strength': 9.717633732806409, 'grow_policy': 'SymmetricTree', 'min_data_in_leaf': 78}. Best is trial 726 with value: 37144.045766835996.[0m
[32m[I 2024-10-13 01:40:23,852][0m Trial 816 finished with value: 48368.16670121682 and parameters: {'depth': 15, 'learning_rate': 0.22722708816943837, 'iterations': 383, 'l2_leaf_reg': 0.9639528140811142, 'border_count': 83, 'bagging_temperature': 0.03372653357957692, 'random_strength': 9.814245546153682, 'grow_policy': 'SymmetricTree', 'min_data_in_leaf': 96}. Best is trial 726 with value: 37144.045766835996.[0m
[32m[I 2024-10-13 01:40:24,859][0m Trial 817 finished with value: 43772.770910464926 and parameters: {'depth': 9, 'learning_rate': 0.18814439137007594, 'iterations': 233, 'l2_leaf_reg': 0.2317623542453031, 'border_count': 235, 'bagging_temperature': 0.0363874228765753, 'random_strength': 9.480797293445285, 'grow_policy': 'SymmetricTree', 'min_data_in_leaf': 124}. Best is trial 726 with value: 37144.045766835996.[0m
[32m[I 2024-10-13 01:40:25,719][0m Trial 818 finished with value: 55981.862323067 and parameters: {'depth': 8, 'learning_rate': 0.2995594958959995, 'iterations': 323, 'l2_leaf_reg': 0.7594711374402093, 'border_count': 248, 'bagging_temperature': 0.0166016475300265, 'random_strength': 1.6238282170053946, 'grow_policy': 'Depthwise', 'min_data_in_leaf': 854}. Best is trial 726 with value: 37144.045766835996.[0m
[32m[I 2024-10-13 01:40:27,659][0m Trial 819 finished with value: 89132.61076396694 and parameters: {'depth': 9, 'learning_rate': 0.0015789548037755006, 'iterations': 389, 'l2_leaf_reg': 0.5287721905270606, 'border_count': 240, 'bagging_temperature': 0.08167384566396227, 'random_strength': 9.321054652781966, 'grow_policy': 'SymmetricTree', 'min_data_in_leaf': 76}. Best is trial 726 with value: 37144.045766835996.[0m
[32m[I 2024-10-13 01:40:28,750][0m Trial 820 finished with value: 48914.185759623586 and parameters: {'depth': 9, 'learning_rate': 0.23238633182360333, 'iterations': 147, 'l2_leaf_reg': 0.350200410506333, 'border_count': 133, 'bagging_temperature': 0.051221958285672, 'random_strength': 9.989137487470188, 'grow_policy': 'SymmetricTree', 'min_data_in_leaf': 805}. Best is trial 726 with value: 37144.045766835996.[0m
[32m[I 2024-10-13 01:40:36,452][0m Trial 821 finished with value: 50242.47147115759 and parameters: {'depth': 9, 'learning_rate': 0.2550573179734268, 'iterations': 895, 'l2_leaf_reg': 0.2130077944340139, 'border_count': 233, 'bagging_temperature': 0.001680365897945884, 'random_strength': 9.572774732448439, 'grow_policy': 'SymmetricTree', 'min_data_in_leaf': 100}. Best is trial 726 with value: 37144.045766835996.[0m
[32m[I 2024-10-13 01:40:37,787][0m Trial 822 finished with value: 45197.760431808885 and parameters: {'depth': 9, 'learning_rate': 0.20614576147493097, 'iterations': 291, 'l2_leaf_reg': 1.2074861048376393, 'border_count': 233, 'bagging_temperature': 0.0312596677982012, 'random_strength': 9.797206764601665, 'grow_policy': 'SymmetricTree', 'min_data_in_leaf': 758}. Best is trial 726 with value: 37144.045766835996.[0m
[32m[I 2024-10-13 01:40:39,133][0m Trial 823 finished with value: 48398.26868778023 and parameters: {'depth': 8, 'learning_rate': 0.2586183784890016, 'iterations': 353, 'l2_leaf_reg': 0.4422370695638087, 'border_count': 241, 'bagging_temperature': 0.01854410704223109, 'random_strength': 9.326654026733255, 'grow_policy': 'SymmetricTree', 'min_data_in_leaf': 48}. Best is trial 726 with value: 37144.045766835996.[0m
