[32m[I 2024-10-13 01:13:24,831][0m Trial 414 finished with value: 59169.67661394817 and parameters: {'depth': 10, 'learning_rate': 0.004365109585140537, 'iterations': 327, 'l2_leaf_reg': 0.03163330545303835, 'border_count': 217, 'bagging_temperature': 0.03557502639546449, 'random_strength': 9.224415769395995, 'grow_policy': 'SymmetricTree', 'min_data_in_leaf': 177}. Best is trial 375 with value: 38635.313654123056.[0m
[32m[I 2024-10-13 01:13:27,031][0m Trial 415 finished with value: 40350.21772761874 and parameters: {'depth': 9, 'learning_rate': 0.2599599813873367, 'iterations': 427, 'l2_leaf_reg': 0.06293098506110739, 'border_count': 225, 'bagging_temperature': 0.020343385259475447, 'random_strength': 8.983276649829733, 'grow_policy': 'SymmetricTree', 'min_data_in_leaf': 130}. Best is trial 375 with value: 38635.313654123056.[0m
[32m[I 2024-10-13 01:13:29,264][0m Trial 416 finished with value: 47873.255458998654 and parameters: {'depth': 9, 'learning_rate': 0.2954181653797185, 'iterations': 371, 'l2_leaf_reg': 0.06733146909793315, 'border_count': 227, 'bagging_temperature': 0.07265954320800116, 'random_strength': 9.007532234227225, 'grow_policy': 'SymmetricTree', 'min_data_in_leaf': 212}. Best is trial 375 with value: 38635.313654123056.[0m
[32m[I 2024-10-13 01:13:31,196][0m Trial 417 finished with value: 45293.77206451419 and parameters: {'depth': 9, 'learning_rate': 0.2105913067266769, 'iterations': 312, 'l2_leaf_reg': 0.12380992490679625, 'border_count': 233, 'bagging_temperature': 0.05394178946847054, 'random_strength': 8.564333701317038, 'grow_policy': 'SymmetricTree', 'min_data_in_leaf': 138}. Best is trial 375 with value: 38635.313654123056.[0m
[32m[I 2024-10-13 01:13:33,895][0m Trial 418 finished with value: 40639.92789444547 and parameters: {'depth': 9, 'learning_rate': 0.2569830887613551, 'iterations': 483, 'l2_leaf_reg': 0.05653982864269809, 'border_count': 224, 'bagging_temperature': 0.030928564101239238, 'random_strength': 8.826550227855577, 'grow_policy': 'SymmetricTree', 'min_data_in_leaf': 88}. Best is trial 375 with value: 38635.313654123056.[0m
[32m[I 2024-10-13 01:13:45,054][0m Trial 419 finished with value: 53770.74817896386 and parameters: {'depth': 9, 'learning_rate': 0.29577207168301856, 'iterations': 593, 'l2_leaf_reg': 0.06187258272963844, 'border_count': 230, 'bagging_temperature': 0.06393453553215532, 'random_strength': 8.861302360373138, 'grow_policy': 'SymmetricTree', 'min_data_in_leaf': 88}. Best is trial 375 with value: 38635.313654123056.[0m
[32m[I 2024-10-13 01:13:54,405][0m Trial 420 finished with value: 53729.81748671182 and parameters: {'depth': 9, 'learning_rate': 0.22964965498262613, 'iterations': 500, 'l2_leaf_reg': 0.10612996600786488, 'border_count': 223, 'bagging_temperature': 0.037272972973009716, 'random_strength': 8.698808459555478, 'grow_policy': 'SymmetricTree', 'min_data_in_leaf': 85}. Best is trial 375 with value: 38635.313654123056.[0m
[32m[I 2024-10-13 01:13:57,079][0m Trial 421 finished with value: 39437.43631974597 and parameters: {'depth': 9, 'learning_rate': 0.2994533925474777, 'iterations': 482, 'l2_leaf_reg': 0.19472975904008638, 'border_count': 234, 'bagging_temperature': 0.029543905075141413, 'random_strength': 8.987145962286926, 'grow_policy': 'SymmetricTree', 'min_data_in_leaf': 158}. Best is trial 375 with value: 38635.313654123056.[0m
[32m[I 2024-10-13 01:14:06,392][0m Trial 422 finished with value: 54536.01735326341 and parameters: {'depth': 9, 'learning_rate': 0.17884060078632721, 'iterations': 545, 'l2_leaf_reg': 0.1940918527245429, 'border_count': 233, 'bagging_temperature': 0.0945582069172344, 'random_strength': 8.969694029749988, 'grow_policy': 'SymmetricTree', 'min_data_in_leaf': 164}. Best is trial 375 with value: 38635.313654123056.[0m
[32m[I 2024-10-13 01:14:07,740][0m Trial 423 finished with value: 54214.213475721204 and parameters: {'depth': 9, 'learning_rate': 0.24900446203121984, 'iterations': 487, 'l2_leaf_reg': 0.18268175191707206, 'border_count': 228, 'bagging_temperature': 0.07197649797425162, 'random_strength': 8.513783863573654, 'grow_policy': 'Lossguide', 'min_data_in_leaf': 176, 'max_leaves': 231}. Best is trial 375 with value: 38635.313654123056.[0m
[32m[I 2024-10-13 01:14:10,516][0m Trial 424 finished with value: 48522.1064194624 and parameters: {'depth': 9, 'learning_rate': 0.2058822110835059, 'iterations': 474, 'l2_leaf_reg': 0.09504749535495288, 'border_count': 235, 'bagging_temperature': 0.04685998731013284, 'random_strength': 8.816720644255199, 'grow_policy': 'SymmetricTree', 'min_data_in_leaf': 197}. Best is trial 375 with value: 38635.313654123056.[0m
[32m[I 2024-10-13 01:14:22,781][0m Trial 425 finished with value: 56081.7844726215 and parameters: {'depth': 9, 'learning_rate': 0.25815256481548177, 'iterations': 585, 'l2_leaf_reg': 0.14181509853575353, 'border_count': 210, 'bagging_temperature': 0.03476849465385131, 'random_strength': 9.064167718692183, 'grow_policy': 'SymmetricTree', 'min_data_in_leaf': 160}. Best is trial 375 with value: 38635.313654123056.[0m
[32m[I 2024-10-13 01:14:25,948][0m Trial 426 finished with value: 53335.20510387652 and parameters: {'depth': 9, 'learning_rate': 0.22393417842226337, 'iterations': 434, 'l2_leaf_reg': 0.045178638935303064, 'border_count': 228, 'bagging_temperature': 0.05620208039946562, 'random_strength': 8.105029250066536, 'grow_policy': 'SymmetricTree', 'min_data_in_leaf': 147}. Best is trial 375 with value: 38635.313654123056.[0m
[32m[I 2024-10-13 01:14:35,913][0m Trial 427 finished with value: 53539.49573334034 and parameters: {'depth': 9, 'learning_rate': 0.2621920394685219, 'iterations': 534, 'l2_leaf_reg': 0.09654459398328452, 'border_count': 220, 'bagging_temperature': 0.026026047699455192, 'random_strength': 9.3027540515499, 'grow_policy': 'SymmetricTree', 'min_data_in_leaf': 102}. Best is trial 375 with value: 38635.313654123056.[0m
[32m[I 2024-10-13 01:14:38,422][0m Trial 428 finished with value: 40706.62222416097 and parameters: {'depth': 10, 'learning_rate': 0.29623091712659977, 'iterations': 351, 'l2_leaf_reg': 0.04330489271700393, 'border_count': 226, 'bagging_temperature': 0.021815126580684532, 'random_strength': 8.662670957481751, 'grow_policy': 'SymmetricTree', 'min_data_in_leaf': 137}. Best is trial 375 with value: 38635.313654123056.[0m
[32m[I 2024-10-13 01:15:02,363][0m Trial 429 finished with value: 51790.96528648693 and parameters: {'depth': 10, 'learning_rate': 0.20048855657345463, 'iterations': 2473, 'l2_leaf_reg': 0.18822624474990057, 'border_count': 162, 'bagging_temperature': 0.05365319379319383, 'random_strength': 8.606971705371251, 'grow_policy': 'SymmetricTree', 'min_data_in_leaf': 151}. Best is trial 375 with value: 38635.313654123056.[0m
[32m[I 2024-10-13 01:15:07,454][0m Trial 430 finished with value: 52318.25717443866 and parameters: {'depth': 11, 'learning_rate': 0.2985973444698358, 'iterations': 334, 'l2_leaf_reg': 0.0789624355872586, 'border_count': 234, 'bagging_temperature': 0.0840065369629201, 'random_strength': 8.42072722332505, 'grow_policy': 'SymmetricTree', 'min_data_in_leaf': 195}. Best is trial 375 with value: 38635.313654123056.[0m
[32m[I 2024-10-13 01:15:11,305][0m Trial 431 finished with value: 42004.61211605577 and parameters: {'depth': 10, 'learning_rate': 0.2308804097697585, 'iterations': 322, 'l2_leaf_reg': 0.038790259249329814, 'border_count': 229, 'bagging_temperature': 0.030052480851506906, 'random_strength': 8.838745915180063, 'grow_policy': 'SymmetricTree', 'min_data_in_leaf': 224}. Best is trial 375 with value: 38635.313654123056.[0m
[32m[I 2024-10-13 01:15:15,962][0m Trial 432 finished with value: 43732.35782245044 and parameters: {'depth': 10, 'learning_rate': 0.18026062722862263, 'iterations': 438, 'l2_leaf_reg': 0.12913676674359872, 'border_count': 216, 'bagging_temperature': 0.03045578035759479, 'random_strength': 9.093001649264028, 'grow_policy': 'SymmetricTree', 'min_data_in_leaf': 134}. Best is trial 375 with value: 38635.313654123056.[0m
[32m[I 2024-10-13 01:15:19,368][0m Trial 433 finished with value: 48501.3189882901 and parameters: {'depth': 9, 'learning_rate': 0.2984793034194749, 'iterations': 369, 'l2_leaf_reg': 0.06149069608383038, 'border_count': 234, 'bagging_temperature': 0.06142697332591506, 'random_strength': 8.708689417427648, 'grow_policy': 'SymmetricTree', 'min_data_in_leaf': 177}. Best is trial 375 with value: 38635.313654123056.[0m
[32m[I 2024-10-13 01:15:21,217][0m Trial 434 finished with value: 54322.41256400328 and parameters: {'depth': 9, 'learning_rate': 0.257257108896098, 'iterations': 508, 'l2_leaf_reg': 0.03313493064732457, 'border_count': 173, 'bagging_temperature': 0.021391331077966768, 'random_strength': 8.908536135926404, 'grow_policy': 'Depthwise', 'min_data_in_leaf': 152}. Best is trial 375 with value: 38635.313654123056.[0m
[32m[I 2024-10-13 01:15:26,846][0m Trial 435 finished with value: 40500.75808309103 and parameters: {'depth': 10, 'learning_rate': 0.2998061880918301, 'iterations': 450, 'l2_leaf_reg': 0.015048762028216586, 'border_count': 226, 'bagging_temperature': 0.020535666124821616, 'random_strength': 9.343587488553123, 'grow_policy': 'SymmetricTree', 'min_data_in_leaf': 102}. Best is trial 375 with value: 38635.313654123056.[0m
[32m[I 2024-10-13 01:15:36,697][0m Trial 436 finished with value: 53544.57071241195 and parameters: {'depth': 9, 'learning_rate': 0.2222519204117632, 'iterations': 636, 'l2_leaf_reg': 0.013701341353087235, 'border_count': 202, 'bagging_temperature': 0.04810757291128303, 'random_strength': 9.36539748241074, 'grow_policy': 'SymmetricTree', 'min_data_in_leaf': 81}. Best is trial 375 with value: 38635.313654123056.[0m
[32m[I 2024-10-13 01:15:42,057][0m Trial 437 finished with value: 42368.76753834132 and parameters: {'depth': 10, 'learning_rate': 0.20438263092379064, 'iterations': 467, 'l2_leaf_reg': 0.006295391771371033, 'border_count': 222, 'bagging_temperature': 0.0420067796816372, 'random_strength': 9.214445129723092, 'grow_policy': 'SymmetricTree', 'min_data_in_leaf': 99}. Best is trial 375 with value: 38635.313654123056.[0m
[32m[I 2024-10-13 01:15:55,362][0m Trial 438 finished with value: 52177.0478315786 and parameters: {'depth': 10, 'learning_rate': 0.29923347748560825, 'iterations': 555, 'l2_leaf_reg': 0.010038690692245656, 'border_count': 231, 'bagging_temperature': 0.02129859005046835, 'random_strength': 9.518500670145961, 'grow_policy': 'SymmetricTree', 'min_data_in_leaf': 108}. Best is trial 375 with value: 38635.313654123056.[0m
[32m[I 2024-10-13 01:16:00,169][0m Trial 439 finished with value: 57943.17630539591 and parameters: {'depth': 11, 'learning_rate': 0.24239894312957905, 'iterations': 431, 'l2_leaf_reg': 0.016707606409458738, 'border_count': 218, 'bagging_temperature': 0.34053952501412066, 'random_strength': 9.398173515029063, 'grow_policy': 'SymmetricTree', 'min_data_in_leaf': 128}. Best is trial 375 with value: 38635.313654123056.[0m
[32m[I 2024-10-13 01:16:22,809][0m Trial 440 finished with value: 103491.48691907882 and parameters: {'depth': 12, 'learning_rate': 0.0007420661385620889, 'iterations': 504, 'l2_leaf_reg': 0.0020832522822540286, 'border_count': 228, 'bagging_temperature': 0.06701858599891432, 'random_strength': 9.025063610546923, 'grow_policy': 'SymmetricTree', 'min_data_in_leaf': 164}. Best is trial 375 with value: 38635.313654123056.[0m
[32m[I 2024-10-13 01:16:26,520][0m Trial 441 finished with value: 37467.065243356185 and parameters: {'depth': 10, 'learning_rate': 0.2552715138021654, 'iterations': 393, 'l2_leaf_reg': 0.19506875881323787, 'border_count': 209, 'bagging_temperature': 0.018686210169575748, 'random_strength': 9.211414042532626, 'grow_policy': 'SymmetricTree', 'min_data_in_leaf': 84}. Best is trial 441 with value: 37467.065243356185.[0m
[32m[I 2024-10-13 01:16:31,606][0m Trial 442 finished with value: 43198.3160154925 and parameters: {'depth': 10, 'learning_rate': 0.1705276289749912, 'iterations': 391, 'l2_leaf_reg': 0.16875059890501234, 'border_count': 193, 'bagging_temperature': 0.018970635307023857, 'random_strength': 9.257336192165273, 'grow_policy': 'SymmetricTree', 'min_data_in_leaf': 109}. Best is trial 441 with value: 37467.065243356185.[0m
[32m[I 2024-10-13 01:16:35,489][0m Trial 443 finished with value: 40935.83789938234 and parameters: {'depth': 10, 'learning_rate': 0.22403027327770356, 'iterations': 309, 'l2_leaf_reg': 0.18536845307634184, 'border_count': 209, 'bagging_temperature': 0.019441892069352852, 'random_strength': 9.523759216115105, 'grow_policy': 'SymmetricTree', 'min_data_in_leaf': 133}. Best is trial 441 with value: 37467.065243356185.[0m
[32m[I 2024-10-13 01:16:41,980][0m Trial 444 finished with value: 64855.93907521349 and parameters: {'depth': 11, 'learning_rate': 0.00295171152481266, 'iterations': 420, 'l2_leaf_reg': 0.23246763789540958, 'border_count': 205, 'bagging_temperature': 0.04587488547419259, 'random_strength': 9.12275895401283, 'grow_policy': 'SymmetricTree', 'min_data_in_leaf': 184}. Best is trial 441 with value: 37467.065243356185.[0m
[32m[I 2024-10-13 01:16:46,357][0m Trial 445 finished with value: 40380.58918597403 and parameters: {'depth': 10, 'learning_rate': 0.26093376707580584, 'iterations': 368, 'l2_leaf_reg': 0.004725342430243304, 'border_count': 212, 'bagging_temperature': 0.017273741609296258, 'random_strength': 9.562743574893863, 'grow_policy': 'SymmetricTree', 'min_data_in_leaf': 153}. Best is trial 441 with value: 37467.065243356185.[0m
[32m[I 2024-10-13 01:16:50,042][0m Trial 446 finished with value: 49532.034584357265 and parameters: {'depth': 10, 'learning_rate': 0.2022818664894579, 'iterations': 305, 'l2_leaf_reg': 0.005751086883977147, 'border_count': 212, 'bagging_temperature': 0.0787359423315897, 'random_strength': 9.306325587047736, 'grow_policy': 'SymmetricTree', 'min_data_in_leaf': 160}. Best is trial 441 with value: 37467.065243356185.[0m
[32m[I 2024-10-13 01:16:51,930][0m Trial 447 finished with value: 53990.69883484468 and parameters: {'depth': 10, 'learning_rate': 0.26178609364260785, 'iterations': 381, 'l2_leaf_reg': 0.11684128033566801, 'border_count': 198, 'bagging_temperature': 0.044169379158145894, 'random_strength': 9.047874788366098, 'grow_policy': 'Lossguide', 'min_data_in_leaf': 152, 'max_leaves': 139}. Best is trial 441 with value: 37467.065243356185.[0m
[32m[I 2024-10-13 01:16:55,794][0m Trial 448 finished with value: 40424.414689024066 and parameters: {'depth': 10, 'learning_rate': 0.29595881607969265, 'iterations': 310, 'l2_leaf_reg': 0.004555976745840836, 'border_count': 209, 'bagging_temperature': 0.02447730155801134, 'random_strength': 9.575526767774692, 'grow_policy': 'SymmetricTree', 'min_data_in_leaf': 177}. Best is trial 441 with value: 37467.065243356185.[0m
[32m[I 2024-10-13 01:16:59,958][0m Trial 449 finished with value: 47989.77060586161 and parameters: {'depth': 10, 'learning_rate': 0.22796969316125928, 'iterations': 316, 'l2_leaf_reg': 0.0032200445165029112, 'border_count': 205, 'bagging_temperature': 0.06519464663815232, 'random_strength': 9.604904883969343, 'grow_policy': 'SymmetricTree', 'min_data_in_leaf': 194}. Best is trial 441 with value: 37467.065243356185.[0m
[32m[I 2024-10-13 01:17:03,696][0m Trial 450 finished with value: 40499.3289230208 and parameters: {'depth': 10, 'learning_rate': 0.2966194509240674, 'iterations': 299, 'l2_leaf_reg': 0.005363048083919615, 'border_count': 208, 'bagging_temperature': 0.04237020566013203, 'random_strength': 9.392181583310569, 'grow_policy': 'SymmetricTree', 'min_data_in_leaf': 213}. Best is trial 441 with value: 37467.065243356185.[0m
[32m[I 2024-10-13 01:17:07,489][0m Trial 451 finished with value: 52035.3514426986 and parameters: {'depth': 10, 'learning_rate': 0.29507043480526074, 'iterations': 298, 'l2_leaf_reg': 0.004141500721010585, 'border_count': 202, 'bagging_temperature': 0.09230146224060741, 'random_strength': 9.384187021947156, 'grow_policy': 'SymmetricTree', 'min_data_in_leaf': 235}. Best is trial 441 with value: 37467.065243356185.[0m
[32m[I 2024-10-13 01:17:11,178][0m Trial 452 finished with value: 51893.013579929895 and parameters: {'depth': 9, 'learning_rate': 0.2977642108172286, 'iterations': 341, 'l2_leaf_reg': 0.004694974439124321, 'border_count': 196, 'bagging_temperature': 0.04525019884714397, 'random_strength': 9.229243347713242, 'grow_policy': 'SymmetricTree', 'min_data_in_leaf': 210}. Best is trial 441 with value: 37467.065243356185.[0m
[32m[I 2024-10-13 01:17:15,591][0m Trial 453 finished with value: 52470.52558258203 and parameters: {'depth': 11, 'learning_rate': 0.298499728015613, 'iterations': 290, 'l2_leaf_reg': 0.006811299461291451, 'border_count': 210, 'bagging_temperature': 0.06037066307118803, 'random_strength': 9.614014715107986, 'grow_policy': 'SymmetricTree', 'min_data_in_leaf': 180}. Best is trial 441 with value: 37467.065243356185.[0m
[32m[I 2024-10-13 01:17:20,066][0m Trial 454 finished with value: 47450.67054924116 and parameters: {'depth': 10, 'learning_rate': 0.19522514302812333, 'iterations': 361, 'l2_leaf_reg': 0.0014423490059760164, 'border_count': 206, 'bagging_temperature': 0.3993352443983021, 'random_strength': 9.372045340577355, 'grow_policy': 'SymmetricTree', 'min_data_in_leaf': 215}. Best is trial 441 with value: 37467.065243356185.[0m
[32m[I 2024-10-13 01:17:23,500][0m Trial 455 finished with value: 40101.38264415958 and parameters: {'depth': 10, 'learning_rate': 0.2311721255286737, 'iterations': 300, 'l2_leaf_reg': 0.004007904667804285, 'border_count': 211, 'bagging_temperature': 0.03312733557502659, 'random_strength': 9.148725131378443, 'grow_policy': 'SymmetricTree', 'min_data_in_leaf': 189}. Best is trial 441 with value: 37467.065243356185.[0m
[32m[I 2024-10-13 01:17:27,303][0m Trial 456 finished with value: 43341.192401155255 and parameters: {'depth': 10, 'learning_rate': 0.16970447327911414, 'iterations': 298, 'l2_leaf_reg': 0.003372201338126745, 'border_count': 199, 'bagging_temperature': 0.042730948378937844, 'random_strength': 9.150844823259687, 'grow_policy': 'SymmetricTree', 'min_data_in_leaf': 251}. Best is trial 441 with value: 37467.065243356185.[0m
[32m[I 2024-10-13 01:17:28,624][0m Trial 457 finished with value: 54049.329083343364 and parameters: {'depth': 10, 'learning_rate': 0.22806183415272088, 'iterations': 292, 'l2_leaf_reg': 0.0049820273645504, 'border_count': 210, 'bagging_temperature': 0.0796692454454655, 'random_strength': 9.477848843659405, 'grow_policy': 'Depthwise', 'min_data_in_leaf': 202}. Best is trial 441 with value: 37467.065243356185.[0m
[32m[I 2024-10-13 01:17:31,776][0m Trial 458 finished with value: 39708.19492495966 and parameters: {'depth': 10, 'learning_rate': 0.22944248323053626, 'iterations': 360, 'l2_leaf_reg': 0.0023096054355197723, 'border_count': 213, 'bagging_temperature': 0.019412846414013658, 'random_strength': 9.208558642610477, 'grow_policy': 'SymmetricTree', 'min_data_in_leaf': 188}. Best is trial 441 with value: 37467.065243356185.[0m
[32m[I 2024-10-13 01:17:35,094][0m Trial 459 finished with value: 48215.017142810786 and parameters: {'depth': 10, 'learning_rate': 0.2077666949856443, 'iterations': 348, 'l2_leaf_reg': 0.002060271767674993, 'border_count': 202, 'bagging_temperature': 0.056114685901928966, 'random_strength': 9.0214940991568, 'grow_policy': 'SymmetricTree', 'min_data_in_leaf': 230}. Best is trial 441 with value: 37467.065243356185.[0m
[32m[I 2024-10-13 01:17:37,726][0m Trial 460 finished with value: 41644.39791902525 and parameters: {'depth': 10, 'learning_rate': 0.23078560843814647, 'iterations': 289, 'l2_leaf_reg': 0.0028559861963114532, 'border_count': 189, 'bagging_temperature': 0.03797467518024184, 'random_strength': 9.608910083783206, 'grow_policy': 'SymmetricTree', 'min_data_in_leaf': 192}. Best is trial 441 with value: 37467.065243356185.[0m
[32m[I 2024-10-13 01:17:41,677][0m Trial 461 finished with value: 43249.04071322852 and parameters: {'depth': 11, 'learning_rate': 0.17352254842740958, 'iterations': 355, 'l2_leaf_reg': 0.005710562715259638, 'border_count': 207, 'bagging_temperature': 0.018756439426996743, 'random_strength': 9.133514139006833, 'grow_policy': 'SymmetricTree', 'min_data_in_leaf': 211}. Best is trial 441 with value: 37467.065243356185.[0m
[32m[I 2024-10-13 01:17:44,125][0m Trial 462 finished with value: 39815.64645325504 and parameters: {'depth': 10, 'learning_rate': 0.23689425996997532, 'iterations': 292, 'l2_leaf_reg': 0.0038800988575861156, 'border_count': 213, 'bagging_temperature': 0.037374185091156815, 'random_strength': 9.205427384210907, 'grow_policy': 'SymmetricTree', 'min_data_in_leaf': 175}. Best is trial 441 with value: 37467.065243356185.[0m
[32m[I 2024-10-13 01:17:47,081][0m Trial 463 finished with value: 43083.97056311811 and parameters: {'depth': 10, 'learning_rate': 0.19782755034574928, 'iterations': 368, 'l2_leaf_reg': 0.002818217467555371, 'border_count': 213, 'bagging_temperature': 0.01743406396540184, 'random_strength': 8.939843685182646, 'grow_policy': 'SymmetricTree', 'min_data_in_leaf': 179}. Best is trial 441 with value: 37467.065243356185.[0m
[32m[I 2024-10-13 01:17:49,443][0m Trial 464 finished with value: 48034.77539432751 and parameters: {'depth': 10, 'learning_rate': 0.23437663783935467, 'iterations': 356, 'l2_leaf_reg': 0.003827534624526183, 'border_count': 213, 'bagging_temperature': 0.06798271805981707, 'random_strength': 9.208101896140858, 'grow_policy': 'SymmetricTree', 'min_data_in_leaf': 171}. Best is trial 441 with value: 37467.065243356185.[0m
