[32m[I 2024-10-13 01:08:06,104][0m Trial 363 finished with value: 44613.65831607318 and parameters: {'depth': 11, 'learning_rate': 0.299625486946983, 'iterations': 470, 'l2_leaf_reg': 0.02730265016226964, 'border_count': 219, 'bagging_temperature': 0.0012894051338165494, 'random_strength': 8.374896427827519, 'grow_policy': 'SymmetricTree', 'min_data_in_leaf': 140}. Best is trial 319 with value: 38829.28660377016.[0m
[32m[I 2024-10-13 01:08:11,183][0m Trial 364 finished with value: 53115.03164152343 and parameters: {'depth': 10, 'learning_rate': 0.23162146162736263, 'iterations': 535, 'l2_leaf_reg': 0.0052395911933812425, 'border_count': 226, 'bagging_temperature': 0.0571361158581297, 'random_strength': 9.6840207506956, 'grow_policy': 'SymmetricTree', 'min_data_in_leaf': 163}. Best is trial 319 with value: 38829.28660377016.[0m
[32m[I 2024-10-13 01:08:13,780][0m Trial 365 finished with value: 42794.42237541993 and parameters: {'depth': 10, 'learning_rate': 0.19874797103663633, 'iterations': 371, 'l2_leaf_reg': 0.047570128403771166, 'border_count': 228, 'bagging_temperature': 0.034640622106498764, 'random_strength': 8.931638561172266, 'grow_policy': 'SymmetricTree', 'min_data_in_leaf': 117}. Best is trial 319 with value: 38829.28660377016.[0m
[32m[I 2024-10-13 01:08:15,049][0m Trial 366 finished with value: 54273.44611468948 and parameters: {'depth': 10, 'learning_rate': 0.2544002391564995, 'iterations': 424, 'l2_leaf_reg': 0.058198317102229474, 'border_count': 215, 'bagging_temperature': 0.0008049752036895534, 'random_strength': 9.421543184098987, 'grow_policy': 'Depthwise', 'min_data_in_leaf': 94}. Best is trial 319 with value: 38829.28660377016.[0m
[32m[I 2024-10-13 01:08:19,169][0m Trial 367 finished with value: 43056.751858334625 and parameters: {'depth': 11, 'learning_rate': 0.2580682938032504, 'iterations': 365, 'l2_leaf_reg': 0.014085561205362062, 'border_count': 221, 'bagging_temperature': 0.0006212372683437853, 'random_strength': 9.085254011193252, 'grow_policy': 'SymmetricTree', 'min_data_in_leaf': 191}. Best is trial 319 with value: 38829.28660377016.[0m
[32m[I 2024-10-13 01:08:22,049][0m Trial 368 finished with value: 39916.786324690715 and parameters: {'depth': 10, 'learning_rate': 0.2999406299595065, 'iterations': 448, 'l2_leaf_reg': 0.03302629764311764, 'border_count': 228, 'bagging_temperature': 0.023801923582532632, 'random_strength': 8.629512681487338, 'grow_policy': 'SymmetricTree', 'min_data_in_leaf': 141}. Best is trial 319 with value: 38829.28660377016.[0m
[32m[I 2024-10-13 01:08:32,697][0m Trial 369 finished with value: 52336.06079047245 and parameters: {'depth': 10, 'learning_rate': 0.29878375764195125, 'iterations': 603, 'l2_leaf_reg': 0.03714807478586394, 'border_count': 229, 'bagging_temperature': 0.05547077158956273, 'random_strength': 8.65362272464673, 'grow_policy': 'SymmetricTree', 'min_data_in_leaf': 151}. Best is trial 319 with value: 38829.28660377016.[0m
[32m[I 2024-10-13 01:08:43,353][0m Trial 370 finished with value: 53247.72502543571 and parameters: {'depth': 10, 'learning_rate': 0.20970264787767331, 'iterations': 502, 'l2_leaf_reg': 0.06007261368763628, 'border_count': 217, 'bagging_temperature': 0.03563632351765442, 'random_strength': 8.862610882093136, 'grow_policy': 'SymmetricTree', 'min_data_in_leaf': 109}. Best is trial 319 with value: 38829.28660377016.[0m
[32m[I 2024-10-13 01:08:45,920][0m Trial 371 finished with value: 42093.95632017769 and parameters: {'depth': 10, 'learning_rate': 0.22971375741120392, 'iterations': 349, 'l2_leaf_reg': 0.10809181161407973, 'border_count': 230, 'bagging_temperature': 0.0200236065412656, 'random_strength': 8.209330295265197, 'grow_policy': 'SymmetricTree', 'min_data_in_leaf': 138}. Best is trial 319 with value: 38829.28660377016.[0m
[32m[I 2024-10-13 01:08:49,217][0m Trial 372 finished with value: 42728.87808394818 and parameters: {'depth': 10, 'learning_rate': 0.18941369819155213, 'iterations': 459, 'l2_leaf_reg': 0.017982878935894706, 'border_count': 221, 'bagging_temperature': 0.00027552844314219615, 'random_strength': 8.56088991725517, 'grow_policy': 'SymmetricTree', 'min_data_in_leaf': 165}. Best is trial 319 with value: 38829.28660377016.[0m
[32m[I 2024-10-13 01:09:30,308][0m Trial 373 finished with value: 54094.343773452776 and parameters: {'depth': 10, 'learning_rate': 0.2655541676021444, 'iterations': 2884, 'l2_leaf_reg': 0.038830045081474224, 'border_count': 212, 'bagging_temperature': 0.0742920136999812, 'random_strength': 9.361659024793692, 'grow_policy': 'SymmetricTree', 'min_data_in_leaf': 93}. Best is trial 319 with value: 38829.28660377016.[0m
[32m[I 2024-10-13 01:09:35,036][0m Trial 374 finished with value: 48520.65109674495 and parameters: {'depth': 11, 'learning_rate': 0.22584742165644625, 'iterations': 352, 'l2_leaf_reg': 0.13496066893565725, 'border_count': 227, 'bagging_temperature': 0.043774147769028805, 'random_strength': 9.092503087411227, 'grow_policy': 'SymmetricTree', 'min_data_in_leaf': 123}. Best is trial 319 with value: 38829.28660377016.[0m
[32m[I 2024-10-13 01:09:38,079][0m Trial 375 finished with value: 38635.313654123056 and parameters: {'depth': 9, 'learning_rate': 0.29550992591779784, 'iterations': 427, 'l2_leaf_reg': 0.06621376401338529, 'border_count': 221, 'bagging_temperature': 0.022198214147848852, 'random_strength': 9.64257445070931, 'grow_policy': 'SymmetricTree', 'min_data_in_leaf': 148}. Best is trial 375 with value: 38635.313654123056.[0m
[32m[I 2024-10-13 01:09:42,945][0m Trial 376 finished with value: 55423.52047853745 and parameters: {'depth': 9, 'learning_rate': 0.1885640488833847, 'iterations': 557, 'l2_leaf_reg': 0.02970789233604979, 'border_count': 201, 'bagging_temperature': 0.03318488812585722, 'random_strength': 9.679060065112546, 'grow_policy': 'SymmetricTree', 'min_data_in_leaf': 185}. Best is trial 375 with value: 38635.313654123056.[0m
[32m[I 2024-10-13 01:09:45,320][0m Trial 377 finished with value: 48321.31202496023 and parameters: {'depth': 9, 'learning_rate': 0.2620674755539014, 'iterations': 479, 'l2_leaf_reg': 0.05511284584537137, 'border_count': 217, 'bagging_temperature': 0.04714910845209441, 'random_strength': 9.539028164817639, 'grow_policy': 'SymmetricTree', 'min_data_in_leaf': 159}. Best is trial 375 with value: 38635.313654123056.[0m
[32m[I 2024-10-13 01:09:48,395][0m Trial 378 finished with value: 48202.9123412954 and parameters: {'depth': 10, 'learning_rate': 0.2292863434894624, 'iterations': 442, 'l2_leaf_reg': 0.02135125098965265, 'border_count': 229, 'bagging_temperature': 0.06496719869487003, 'random_strength': 8.814146176903954, 'grow_policy': 'SymmetricTree', 'min_data_in_leaf': 107}. Best is trial 375 with value: 38635.313654123056.[0m
[32m[I 2024-10-13 01:09:50,196][0m Trial 379 finished with value: 41147.48871596399 and parameters: {'depth': 9, 'learning_rate': 0.2667491047872632, 'iterations': 337, 'l2_leaf_reg': 0.1266354401037377, 'border_count': 222, 'bagging_temperature': 0.021168091086571625, 'random_strength': 8.934082668663184, 'grow_policy': 'SymmetricTree', 'min_data_in_leaf': 140}. Best is trial 375 with value: 38635.313654123056.[0m
[32m[I 2024-10-13 01:09:57,284][0m Trial 380 finished with value: 52539.65012625746 and parameters: {'depth': 10, 'learning_rate': 0.2110074823601841, 'iterations': 517, 'l2_leaf_reg': 0.012792952040788527, 'border_count': 211, 'bagging_temperature': 0.02248431189730631, 'random_strength': 9.762445751804021, 'grow_policy': 'SymmetricTree', 'min_data_in_leaf': 93}. Best is trial 375 with value: 38635.313654123056.[0m
[32m[I 2024-10-13 01:09:59,231][0m Trial 381 finished with value: 57224.8197834466 and parameters: {'depth': 10, 'learning_rate': 0.29259182308630444, 'iterations': 416, 'l2_leaf_reg': 0.04054903269031799, 'border_count': 182, 'bagging_temperature': 0.03686119712554265, 'random_strength': 9.402968873375594, 'grow_policy': 'Lossguide', 'min_data_in_leaf': 118, 'max_leaves': 87}. Best is trial 375 with value: 38635.313654123056.[0m
[32m[I 2024-10-13 01:10:03,478][0m Trial 382 finished with value: 39272.28102823841 and parameters: {'depth': 10, 'learning_rate': 0.29956091983149113, 'iterations': 368, 'l2_leaf_reg': 0.06793848309477718, 'border_count': 230, 'bagging_temperature': 0.020258507266191834, 'random_strength': 9.6226542000475, 'grow_policy': 'SymmetricTree', 'min_data_in_leaf': 172}. Best is trial 375 with value: 38635.313654123056.[0m
[32m[I 2024-10-13 01:10:06,706][0m Trial 383 finished with value: 46817.89273961037 and parameters: {'depth': 9, 'learning_rate': 0.23004226015821985, 'iterations': 347, 'l2_leaf_reg': 0.0777089654602876, 'border_count': 231, 'bagging_temperature': 0.06025156763096041, 'random_strength': 9.21829647897591, 'grow_policy': 'SymmetricTree', 'min_data_in_leaf': 205}. Best is trial 375 with value: 38635.313654123056.[0m
[32m[I 2024-10-13 01:10:11,856][0m Trial 384 finished with value: 45941.52823541886 and parameters: {'depth': 10, 'learning_rate': 0.18256714444102587, 'iterations': 465, 'l2_leaf_reg': 0.10570967604367863, 'border_count': 227, 'bagging_temperature': 0.08271532800777516, 'random_strength': 8.705743139816354, 'grow_policy': 'SymmetricTree', 'min_data_in_leaf': 179}. Best is trial 375 with value: 38635.313654123056.[0m
[32m[I 2024-10-13 01:10:16,616][0m Trial 385 finished with value: 43202.05215570032 and parameters: {'depth': 11, 'learning_rate': 0.29740538862036664, 'iterations': 334, 'l2_leaf_reg': 0.0032508261428993283, 'border_count': 231, 'bagging_temperature': 0.022211477859578575, 'random_strength': 8.254196275841922, 'grow_policy': 'SymmetricTree', 'min_data_in_leaf': 152}. Best is trial 375 with value: 38635.313654123056.[0m
[32m[I 2024-10-13 01:10:29,299][0m Trial 386 finished with value: 52703.01786606696 and parameters: {'depth': 10, 'learning_rate': 0.22999921566364748, 'iterations': 618, 'l2_leaf_reg': 0.00735427114236543, 'border_count': 207, 'bagging_temperature': 0.04091638480525565, 'random_strength': 8.990684578547246, 'grow_policy': 'SymmetricTree', 'min_data_in_leaf': 170}. Best is trial 375 with value: 38635.313654123056.[0m
[32m[I 2024-10-13 01:10:32,759][0m Trial 387 finished with value: 39312.06163542113 and parameters: {'depth': 9, 'learning_rate': 0.26361596548667704, 'iterations': 394, 'l2_leaf_reg': 0.0709701469841974, 'border_count': 225, 'bagging_temperature': 0.020195998561318415, 'random_strength': 9.827525744916851, 'grow_policy': 'SymmetricTree', 'min_data_in_leaf': 140}. Best is trial 375 with value: 38635.313654123056.[0m
[32m[I 2024-10-13 01:10:44,558][0m Trial 388 finished with value: 50948.25147552072 and parameters: {'depth': 9, 'learning_rate': 0.200891489634801, 'iterations': 517, 'l2_leaf_reg': 0.13883290194281775, 'border_count': 216, 'bagging_temperature': 0.05578193985172952, 'random_strength': 9.797436559182392, 'grow_policy': 'SymmetricTree', 'min_data_in_leaf': 150}. Best is trial 375 with value: 38635.313654123056.[0m
[32m[I 2024-10-13 01:10:46,608][0m Trial 389 finished with value: 55806.78699050369 and parameters: {'depth': 9, 'learning_rate': 0.2990768879915862, 'iterations': 444, 'l2_leaf_reg': 0.0742792093851107, 'border_count': 232, 'bagging_temperature': 0.02763397740206382, 'random_strength': 9.143142891450246, 'grow_policy': 'Depthwise', 'min_data_in_leaf': 88}. Best is trial 375 with value: 38635.313654123056.[0m
[32m[I 2024-10-13 01:10:49,858][0m Trial 390 finished with value: 45482.33589221512 and parameters: {'depth': 9, 'learning_rate': 0.25685649458497517, 'iterations': 364, 'l2_leaf_reg': 0.027661766069351865, 'border_count': 226, 'bagging_temperature': 0.04834649281168127, 'random_strength': 9.97121807316248, 'grow_policy': 'SymmetricTree', 'min_data_in_leaf': 137}. Best is trial 375 with value: 38635.313654123056.[0m
[32m[I 2024-10-13 01:10:55,164][0m Trial 391 finished with value: 45015.716531327475 and parameters: {'depth': 11, 'learning_rate': 0.2999446363238669, 'iterations': 444, 'l2_leaf_reg': 0.01867285850675053, 'border_count': 217, 'bagging_temperature': 0.020308927056659733, 'random_strength': 9.771576514580591, 'grow_policy': 'SymmetricTree', 'min_data_in_leaf': 107}. Best is trial 375 with value: 38635.313654123056.[0m
[32m[I 2024-10-13 01:10:58,236][0m Trial 392 finished with value: 41246.44100449458 and parameters: {'depth': 10, 'learning_rate': 0.22034702229517517, 'iterations': 330, 'l2_leaf_reg': 0.06721132003347802, 'border_count': 221, 'bagging_temperature': 0.023811142506980625, 'random_strength': 9.360199090644134, 'grow_policy': 'SymmetricTree', 'min_data_in_leaf': 165}. Best is trial 375 with value: 38635.313654123056.[0m
[32m[I 2024-10-13 01:11:15,995][0m Trial 393 finished with value: 55217.68614341491 and parameters: {'depth': 10, 'learning_rate': 0.18886033548476497, 'iterations': 562, 'l2_leaf_reg': 0.034045505129550395, 'border_count': 229, 'bagging_temperature': 0.06416276915317941, 'random_strength': 8.581009295612631, 'grow_policy': 'SymmetricTree', 'min_data_in_leaf': 137}. Best is trial 375 with value: 38635.313654123056.[0m
[32m[I 2024-10-13 01:11:20,325][0m Trial 394 finished with value: 39586.11844864415 and parameters: {'depth': 10, 'learning_rate': 0.24834467031586646, 'iterations': 388, 'l2_leaf_reg': 0.10750595555382539, 'border_count': 226, 'bagging_temperature': 0.03804700584273661, 'random_strength': 8.89711357797767, 'grow_policy': 'SymmetricTree', 'min_data_in_leaf': 195}. Best is trial 375 with value: 38635.313654123056.[0m
[32m[I 2024-10-13 01:11:24,792][0m Trial 395 finished with value: 41282.3507232908 and parameters: {'depth': 9, 'learning_rate': 0.2494646502266781, 'iterations': 498, 'l2_leaf_reg': 0.14383302498168382, 'border_count': 233, 'bagging_temperature': 0.03694919447256602, 'random_strength': 8.82485487462649, 'grow_policy': 'SymmetricTree', 'min_data_in_leaf': 187}. Best is trial 375 with value: 38635.313654123056.[0m
[32m[I 2024-10-13 01:11:42,486][0m Trial 396 finished with value: 55852.630392637126 and parameters: {'depth': 10, 'learning_rate': 0.26158223419235055, 'iterations': 690, 'l2_leaf_reg': 0.01477194268057999, 'border_count': 215, 'bagging_temperature': 0.07576870985859185, 'random_strength': 9.637865888101766, 'grow_policy': 'SymmetricTree', 'min_data_in_leaf': 203}. Best is trial 375 with value: 38635.313654123056.[0m
[32m[I 2024-10-13 01:11:47,279][0m Trial 397 finished with value: 52126.31330922693 and parameters: {'depth': 10, 'learning_rate': 0.2981583975406015, 'iterations': 387, 'l2_leaf_reg': 0.03674018595199394, 'border_count': 220, 'bagging_temperature': 0.048402497118951546, 'random_strength': 9.342898342012669, 'grow_policy': 'SymmetricTree', 'min_data_in_leaf': 157}. Best is trial 375 with value: 38635.313654123056.[0m
[32m[I 2024-10-13 01:11:50,998][0m Trial 398 finished with value: 41707.010276715 and parameters: {'depth': 10, 'learning_rate': 0.2327635526523393, 'iterations': 328, 'l2_leaf_reg': 0.10385992982232818, 'border_count': 227, 'bagging_temperature': 0.018500800926162655, 'random_strength': 8.98291407409802, 'grow_policy': 'SymmetricTree', 'min_data_in_leaf': 175}. Best is trial 375 with value: 38635.313654123056.[0m
[32m[I 2024-10-13 01:11:57,988][0m Trial 399 finished with value: 43429.147309140564 and parameters: {'depth': 11, 'learning_rate': 0.18242561370999139, 'iterations': 494, 'l2_leaf_reg': 0.06181290788244644, 'border_count': 211, 'bagging_temperature': 0.03560915066480742, 'random_strength': 9.634601679321253, 'grow_policy': 'SymmetricTree', 'min_data_in_leaf': 102}. Best is trial 375 with value: 38635.313654123056.[0m
[32m[I 2024-10-13 01:11:59,903][0m Trial 400 finished with value: 54324.76929645592 and parameters: {'depth': 10, 'learning_rate': 0.2608260654259648, 'iterations': 451, 'l2_leaf_reg': 0.024278283718311273, 'border_count': 231, 'bagging_temperature': 0.00022363260340497668, 'random_strength': 8.745212140192313, 'grow_policy': 'Lossguide', 'min_data_in_leaf': 138, 'max_leaves': 182}. Best is trial 375 with value: 38635.313654123056.[0m
[32m[I 2024-10-13 01:12:03,838][0m Trial 401 finished with value: 41899.05633297141 and parameters: {'depth': 9, 'learning_rate': 0.22702914440336003, 'iterations': 402, 'l2_leaf_reg': 0.15918626761224744, 'border_count': 222, 'bagging_temperature': 0.000202858400472768, 'random_strength': 9.99306639963648, 'grow_policy': 'SymmetricTree', 'min_data_in_leaf': 161}. Best is trial 375 with value: 38635.313654123056.[0m
[32m[I 2024-10-13 01:12:07,805][0m Trial 402 finished with value: 41397.7024791862 and parameters: {'depth': 10, 'learning_rate': 0.2984451820039057, 'iterations': 324, 'l2_leaf_reg': 0.049105884833447605, 'border_count': 227, 'bagging_temperature': 0.019820236880053355, 'random_strength': 8.489951781352458, 'grow_policy': 'SymmetricTree', 'min_data_in_leaf': 113}. Best is trial 375 with value: 38635.313654123056.[0m
[32m[I 2024-10-13 01:12:20,223][0m Trial 403 finished with value: 54247.77896057147 and parameters: {'depth': 10, 'learning_rate': 0.21760482185367883, 'iterations': 559, 'l2_leaf_reg': 0.009398989332291288, 'border_count': 206, 'bagging_temperature': 0.05067512856490639, 'random_strength': 9.15629445850613, 'grow_policy': 'SymmetricTree', 'min_data_in_leaf': 86}. Best is trial 375 with value: 38635.313654123056.[0m
[32m[I 2024-10-13 01:12:24,741][0m Trial 404 finished with value: 39163.80506197904 and parameters: {'depth': 10, 'learning_rate': 0.2594513871476634, 'iterations': 431, 'l2_leaf_reg': 0.07746726043975287, 'border_count': 218, 'bagging_temperature': 0.01763770628997379, 'random_strength': 9.47560929170651, 'grow_policy': 'SymmetricTree', 'min_data_in_leaf': 143}. Best is trial 375 with value: 38635.313654123056.[0m
[32m[I 2024-10-13 01:12:31,205][0m Trial 405 finished with value: 54523.66349571833 and parameters: {'depth': 11, 'learning_rate': 0.1852295542102628, 'iterations': 438, 'l2_leaf_reg': 0.024199421813110557, 'border_count': 217, 'bagging_temperature': 0.5303120834244575, 'random_strength': 9.803463090200696, 'grow_policy': 'SymmetricTree', 'min_data_in_leaf': 147}. Best is trial 375 with value: 38635.313654123056.[0m
[32m[I 2024-10-13 01:12:42,972][0m Trial 406 finished with value: 55285.19156214345 and parameters: {'depth': 9, 'learning_rate': 0.2499473763669668, 'iterations': 502, 'l2_leaf_reg': 0.03863600528981332, 'border_count': 213, 'bagging_temperature': 0.08627770178695654, 'random_strength': 9.482869855176594, 'grow_policy': 'SymmetricTree', 'min_data_in_leaf': 192}. Best is trial 375 with value: 38635.313654123056.[0m
[32m[I 2024-10-13 01:12:46,729][0m Trial 407 finished with value: 48330.47497375651 and parameters: {'depth': 10, 'learning_rate': 0.298415216298411, 'iterations': 327, 'l2_leaf_reg': 0.06735896903800294, 'border_count': 219, 'bagging_temperature': 0.2857637316796839, 'random_strength': 9.620613731858313, 'grow_policy': 'SymmetricTree', 'min_data_in_leaf': 176}. Best is trial 375 with value: 38635.313654123056.[0m
[32m[I 2024-10-13 01:12:51,402][0m Trial 408 finished with value: 43323.08735737761 and parameters: {'depth': 10, 'learning_rate': 0.22103592749208126, 'iterations': 445, 'l2_leaf_reg': 0.011630300080699953, 'border_count': 223, 'bagging_temperature': 0.036452813937665, 'random_strength': 9.325636731440648, 'grow_policy': 'SymmetricTree', 'min_data_in_leaf': 140}. Best is trial 375 with value: 38635.313654123056.[0m
[32m[I 2024-10-13 01:12:54,417][0m Trial 409 finished with value: 45968.41093478541 and parameters: {'depth': 9, 'learning_rate': 0.24582451636336322, 'iterations': 381, 'l2_leaf_reg': 0.04751141588567943, 'border_count': 233, 'bagging_temperature': 0.06063305740474019, 'random_strength': 8.926320695803438, 'grow_policy': 'SymmetricTree', 'min_data_in_leaf': 158}. Best is trial 375 with value: 38635.313654123056.[0m
[32m[I 2024-10-13 01:13:06,828][0m Trial 410 finished with value: 53967.72276693683 and parameters: {'depth': 10, 'learning_rate': 0.17499641784932302, 'iterations': 532, 'l2_leaf_reg': 0.12788431464576008, 'border_count': 221, 'bagging_temperature': 0.020080244900763232, 'random_strength': 9.785980586567378, 'grow_policy': 'SymmetricTree', 'min_data_in_leaf': 129}. Best is trial 375 with value: 38635.313654123056.[0m
[32m[I 2024-10-13 01:13:07,921][0m Trial 411 finished with value: 83712.3796574951 and parameters: {'depth': 10, 'learning_rate': 0.0021961143846154297, 'iterations': 466, 'l2_leaf_reg': 0.019864820325706353, 'border_count': 213, 'bagging_temperature': 0.040928790527838, 'random_strength': 9.455729772705272, 'grow_policy': 'Depthwise', 'min_data_in_leaf': 98}. Best is trial 375 with value: 38635.313654123056.[0m
[32m[I 2024-10-13 01:13:18,170][0m Trial 412 finished with value: 54298.72493230736 and parameters: {'depth': 10, 'learning_rate': 0.20346188447631863, 'iterations': 633, 'l2_leaf_reg': 0.17658218385358349, 'border_count': 225, 'bagging_temperature': 0.019154181834917218, 'random_strength': 8.739820031096603, 'grow_policy': 'SymmetricTree', 'min_data_in_leaf': 147}. Best is trial 375 with value: 38635.313654123056.[0m
[32m[I 2024-10-13 01:13:22,343][0m Trial 413 finished with value: 44626.14703681959 and parameters: {'depth': 11, 'learning_rate': 0.2595289139290096, 'iterations': 386, 'l2_leaf_reg': 0.09094194495902724, 'border_count': 232, 'bagging_temperature': 1.718642890041061e-05, 'random_strength': 8.333997043209722, 'grow_policy': 'SymmetricTree', 'min_data_in_leaf': 113}. Best is trial 375 with value: 38635.313654123056.[0m
