[32m[I 2024-10-13 01:22:42,035][0m Trial 516 finished with value: 45539.22853794497 and parameters: {'depth': 9, 'learning_rate': 0.2615669250594318, 'iterations': 337, 'l2_leaf_reg': 0.0006871458865943857, 'border_count': 232, 'bagging_temperature': 3.0372795535835856e-05, 'random_strength': 8.823363996620703, 'grow_policy': 'SymmetricTree', 'min_data_in_leaf': 132}. Best is trial 441 with value: 37467.065243356185.[0m
[32m[I 2024-10-13 01:22:44,036][0m Trial 517 finished with value: 47943.90723498568 and parameters: {'depth': 10, 'learning_rate': 0.22937104573094533, 'iterations': 395, 'l2_leaf_reg': 0.002938948166202952, 'border_count': 222, 'bagging_temperature': 0.07262532681308263, 'random_strength': 9.27956544185895, 'grow_policy': 'SymmetricTree', 'min_data_in_leaf': 178}. Best is trial 441 with value: 37467.065243356185.[0m
[32m[I 2024-10-13 01:22:56,036][0m Trial 518 finished with value: 53025.155593430754 and parameters: {'depth': 11, 'learning_rate': 0.29937670534253036, 'iterations': 507, 'l2_leaf_reg': 0.09759943472370071, 'border_count': 236, 'bagging_temperature': 0.033597029534966856, 'random_strength': 9.041195371566031, 'grow_policy': 'SymmetricTree', 'min_data_in_leaf': 219}. Best is trial 441 with value: 37467.065243356185.[0m
[32m[I 2024-10-13 01:22:57,627][0m Trial 519 finished with value: 41600.407020568826 and parameters: {'depth': 10, 'learning_rate': 0.18362236988377814, 'iterations': 272, 'l2_leaf_reg': 0.15836283779684115, 'border_count': 230, 'bagging_temperature': 0.01754672102638094, 'random_strength': 8.714021996935246, 'grow_policy': 'SymmetricTree', 'min_data_in_leaf': 269}. Best is trial 441 with value: 37467.065243356185.[0m
[32m[I 2024-10-13 01:22:59,965][0m Trial 520 finished with value: 49021.1500184055 and parameters: {'depth': 10, 'learning_rate': 0.25887018652641963, 'iterations': 448, 'l2_leaf_reg': 0.055646157141736645, 'border_count': 217, 'bagging_temperature': 0.05443305541291937, 'random_strength': 9.40592212811307, 'grow_policy': 'SymmetricTree', 'min_data_in_leaf': 161}. Best is trial 441 with value: 37467.065243356185.[0m
[32m[I 2024-10-13 01:23:01,608][0m Trial 521 finished with value: 38454.49305784505 and parameters: {'depth': 9, 'learning_rate': 0.29880386292922495, 'iterations': 369, 'l2_leaf_reg': 0.003941972472108319, 'border_count': 225, 'bagging_temperature': 0.03356234187591019, 'random_strength': 9.844534190201145, 'grow_policy': 'SymmetricTree', 'min_data_in_leaf': 112}. Best is trial 441 with value: 37467.065243356185.[0m
[32m[I 2024-10-13 01:23:03,170][0m Trial 522 finished with value: 42367.732959307024 and parameters: {'depth': 9, 'learning_rate': 0.2975500409582757, 'iterations': 326, 'l2_leaf_reg': 0.032662784740566275, 'border_count': 151, 'bagging_temperature': 0.5964167781602532, 'random_strength': 9.955982760103844, 'grow_policy': 'SymmetricTree', 'min_data_in_leaf': 80}. Best is trial 441 with value: 37467.065243356185.[0m
[32m[I 2024-10-13 01:23:04,781][0m Trial 523 finished with value: 45519.63882090861 and parameters: {'depth': 9, 'learning_rate': 0.23359456675305004, 'iterations': 405, 'l2_leaf_reg': 0.0018339866331469824, 'border_count': 226, 'bagging_temperature': 0.06733218077699504, 'random_strength': 9.827749827684684, 'grow_policy': 'SymmetricTree', 'min_data_in_leaf': 105}. Best is trial 441 with value: 37467.065243356185.[0m
[32m[I 2024-10-13 01:23:07,302][0m Trial 524 finished with value: 56728.26982631332 and parameters: {'depth': 9, 'learning_rate': 0.20701616752169427, 'iterations': 2594, 'l2_leaf_reg': 0.09729674437350393, 'border_count': 231, 'bagging_temperature': 0.0927224702535433, 'random_strength': 9.83076718897796, 'grow_policy': 'Depthwise', 'min_data_in_leaf': 116}. Best is trial 441 with value: 37467.065243356185.[0m
[32m[I 2024-10-13 01:23:13,277][0m Trial 525 finished with value: 52557.97807555318 and parameters: {'depth': 9, 'learning_rate': 0.2565407193023459, 'iterations': 538, 'l2_leaf_reg': 0.0004121452016554036, 'border_count': 236, 'bagging_temperature': 0.03692722414326289, 'random_strength': 9.086675757153195, 'grow_policy': 'SymmetricTree', 'min_data_in_leaf': 100}. Best is trial 441 with value: 37467.065243356185.[0m
[32m[I 2024-10-13 01:23:15,115][0m Trial 526 finished with value: 40074.05394385152 and parameters: {'depth': 9, 'learning_rate': 0.2969814232462888, 'iterations': 478, 'l2_leaf_reg': 0.14905403380874419, 'border_count': 225, 'bagging_temperature': 0.034559221580041516, 'random_strength': 9.684934801647644, 'grow_policy': 'SymmetricTree', 'min_data_in_leaf': 120}. Best is trial 441 with value: 37467.065243356185.[0m
[32m[I 2024-10-13 01:23:17,034][0m Trial 527 finished with value: 49298.50622322166 and parameters: {'depth': 9, 'learning_rate': 0.29746568770710735, 'iterations': 479, 'l2_leaf_reg': 0.21955259049550988, 'border_count': 222, 'bagging_temperature': 0.05808887565229908, 'random_strength': 9.746249613877461, 'grow_policy': 'SymmetricTree', 'min_data_in_leaf': 82}. Best is trial 441 with value: 37467.065243356185.[0m
[32m[I 2024-10-13 01:23:21,311][0m Trial 528 finished with value: 53703.54419820038 and parameters: {'depth': 9, 'learning_rate': 0.2240649955353289, 'iterations': 604, 'l2_leaf_reg': 0.16466619442733188, 'border_count': 229, 'bagging_temperature': 0.04254491704450318, 'random_strength': 9.680348290971306, 'grow_policy': 'SymmetricTree', 'min_data_in_leaf': 119}. Best is trial 441 with value: 37467.065243356185.[0m
[32m[I 2024-10-13 01:23:31,951][0m Trial 529 finished with value: 54155.47803826191 and parameters: {'depth': 10, 'learning_rate': 0.26222763206081234, 'iterations': 522, 'l2_leaf_reg': 0.2765224516702694, 'border_count': 226, 'bagging_temperature': 0.07578764500537948, 'random_strength': 9.97134325568622, 'grow_policy': 'SymmetricTree', 'min_data_in_leaf': 100}. Best is trial 441 with value: 37467.065243356185.[0m
[32m[I 2024-10-13 01:23:33,787][0m Trial 530 finished with value: 43867.476819072894 and parameters: {'depth': 10, 'learning_rate': 0.16116578638529663, 'iterations': 315, 'l2_leaf_reg': 0.0039657884779292765, 'border_count': 236, 'bagging_temperature': 0.035708711220834896, 'random_strength': 9.629585045135803, 'grow_policy': 'SymmetricTree', 'min_data_in_leaf': 137}. Best is trial 441 with value: 37467.065243356185.[0m
[32m[I 2024-10-13 01:23:36,255][0m Trial 531 finished with value: 46878.358016953855 and parameters: {'depth': 10, 'learning_rate': 0.29819280567639395, 'iterations': 466, 'l2_leaf_reg': 0.12343911284921501, 'border_count': 220, 'bagging_temperature': 0.05384219526190426, 'random_strength': 9.997093299555024, 'grow_policy': 'SymmetricTree', 'min_data_in_leaf': 191}. Best is trial 441 with value: 37467.065243356185.[0m
[32m[I 2024-10-13 01:23:54,034][0m Trial 532 finished with value: 55325.25561638167 and parameters: {'depth': 9, 'learning_rate': 0.21674136215429232, 'iterations': 2993, 'l2_leaf_reg': 0.009229220665920091, 'border_count': 229, 'bagging_temperature': 0.031034174120616553, 'random_strength': 9.442709335873836, 'grow_policy': 'SymmetricTree', 'min_data_in_leaf': 143}. Best is trial 441 with value: 37467.065243356185.[0m
[32m[I 2024-10-13 01:23:55,987][0m Trial 533 finished with value: 38251.4861000246 and parameters: {'depth': 10, 'learning_rate': 0.25847961917790035, 'iterations': 371, 'l2_leaf_reg': 0.1715340248284608, 'border_count': 217, 'bagging_temperature': 0.019096044785137555, 'random_strength': 9.25661665568893, 'grow_policy': 'SymmetricTree', 'min_data_in_leaf': 74}. Best is trial 441 with value: 37467.065243356185.[0m
[32m[I 2024-10-13 01:23:58,211][0m Trial 534 finished with value: 46814.43122412599 and parameters: {'depth': 11, 'learning_rate': 0.19339251241967512, 'iterations': 268, 'l2_leaf_reg': 0.1812270774967077, 'border_count': 221, 'bagging_temperature': 0.0012802013977434397, 'random_strength': 9.300359830852761, 'grow_policy': 'SymmetricTree', 'min_data_in_leaf': 70}. Best is trial 441 with value: 37467.065243356185.[0m
[32m[I 2024-10-13 01:23:59,712][0m Trial 535 finished with value: 38899.657172430445 and parameters: {'depth': 9, 'learning_rate': 0.23416249823565136, 'iterations': 361, 'l2_leaf_reg': 0.23920966751639736, 'border_count': 217, 'bagging_temperature': 0.01916862654390905, 'random_strength': 9.601199098493323, 'grow_policy': 'SymmetricTree', 'min_data_in_leaf': 74}. Best is trial 441 with value: 37467.065243356185.[0m
[32m[I 2024-10-13 01:24:01,340][0m Trial 536 finished with value: 47170.37607844258 and parameters: {'depth': 9, 'learning_rate': 0.29611697463532866, 'iterations': 367, 'l2_leaf_reg': 0.2900019223404504, 'border_count': 225, 'bagging_temperature': 0.052777557463837, 'random_strength': 9.78443042477761, 'grow_policy': 'SymmetricTree', 'min_data_in_leaf': 67}. Best is trial 441 with value: 37467.065243356185.[0m
[32m[I 2024-10-13 01:24:02,984][0m Trial 537 finished with value: 47883.77123959623 and parameters: {'depth': 9, 'learning_rate': 0.299470337458381, 'iterations': 383, 'l2_leaf_reg': 0.1440768066843762, 'border_count': 232, 'bagging_temperature': 0.09178766705694949, 'random_strength': 9.659505648969162, 'grow_policy': 'SymmetricTree', 'min_data_in_leaf': 81}. Best is trial 441 with value: 37467.065243356185.[0m
[32m[I 2024-10-13 01:24:03,973][0m Trial 538 finished with value: 55994.23324004678 and parameters: {'depth': 9, 'learning_rate': 0.2208576670431089, 'iterations': 451, 'l2_leaf_reg': 0.25558593456759, 'border_count': 215, 'bagging_temperature': 0.03458530854792555, 'random_strength': 9.460765121658087, 'grow_policy': 'Lossguide', 'min_data_in_leaf': 74, 'max_leaves': 216}. Best is trial 441 with value: 37467.065243356185.[0m
[32m[I 2024-10-13 01:24:18,418][0m Trial 539 finished with value: 52704.42091292403 and parameters: {'depth': 9, 'learning_rate': 0.17683335166271325, 'iterations': 2430, 'l2_leaf_reg': 0.2900072231309642, 'border_count': 224, 'bagging_temperature': 0.0682517208284067, 'random_strength': 9.613035974501958, 'grow_policy': 'SymmetricTree', 'min_data_in_leaf': 94}. Best is trial 441 with value: 37467.065243356185.[0m
[32m[I 2024-10-13 01:24:20,317][0m Trial 540 finished with value: 39250.19264089041 and parameters: {'depth': 10, 'learning_rate': 0.23169986280903831, 'iterations': 355, 'l2_leaf_reg': 0.17115185611090059, 'border_count': 236, 'bagging_temperature': 0.024202095610533172, 'random_strength': 9.816731481717635, 'grow_policy': 'SymmetricTree', 'min_data_in_leaf': 246}. Best is trial 441 with value: 37467.065243356185.[0m
[32m[I 2024-10-13 01:24:27,174][0m Trial 541 finished with value: 81766.14427715655 and parameters: {'depth': 9, 'learning_rate': 0.0013827960734353816, 'iterations': 526, 'l2_leaf_reg': 0.19715759616433506, 'border_count': 237, 'bagging_temperature': 0.05213360017906299, 'random_strength': 9.834835796935378, 'grow_policy': 'SymmetricTree', 'min_data_in_leaf': 235}. Best is trial 441 with value: 37467.065243356185.[0m
[32m[I 2024-10-13 01:24:29,237][0m Trial 542 finished with value: 45762.46777332866 and parameters: {'depth': 10, 'learning_rate': 0.1591908686583233, 'iterations': 401, 'l2_leaf_reg': 0.30598548624460353, 'border_count': 236, 'bagging_temperature': 0.07538703744396014, 'random_strength': 9.767943306944659, 'grow_policy': 'SymmetricTree', 'min_data_in_leaf': 197}. Best is trial 441 with value: 37467.065243356185.[0m
[32m[I 2024-10-13 01:24:31,568][0m Trial 543 finished with value: 38159.61218940492 and parameters: {'depth': 10, 'learning_rate': 0.2011691407096745, 'iterations': 475, 'l2_leaf_reg': 0.16297018134952557, 'border_count': 232, 'bagging_temperature': 0.03352368052882201, 'random_strength': 9.839998945130358, 'grow_policy': 'SymmetricTree', 'min_data_in_leaf': 274}. Best is trial 441 with value: 37467.065243356185.[0m
[32m[I 2024-10-13 01:24:39,531][0m Trial 544 finished with value: 52918.31113901091 and parameters: {'depth': 9, 'learning_rate': 0.19197098263071966, 'iterations': 650, 'l2_leaf_reg': 0.18514482363298504, 'border_count': 237, 'bagging_temperature': 0.01981111871164006, 'random_strength': 9.95529542483362, 'grow_policy': 'SymmetricTree', 'min_data_in_leaf': 217}. Best is trial 441 with value: 37467.065243356185.[0m
[32m[I 2024-10-13 01:24:48,823][0m Trial 545 finished with value: 53713.41947084887 and parameters: {'depth': 11, 'learning_rate': 0.20258271227405156, 'iterations': 544, 'l2_leaf_reg': 0.12883625214063518, 'border_count': 218, 'bagging_temperature': 0.05062878768789804, 'random_strength': 9.835113421656377, 'grow_policy': 'SymmetricTree', 'min_data_in_leaf': 208}. Best is trial 441 with value: 37467.065243356185.[0m
[32m[I 2024-10-13 01:24:51,318][0m Trial 546 finished with value: 40352.31284319014 and parameters: {'depth': 10, 'learning_rate': 0.2256220842358292, 'iterations': 481, 'l2_leaf_reg': 0.19814353576259036, 'border_count': 230, 'bagging_temperature': 0.0328033310417404, 'random_strength': 9.984301456440928, 'grow_policy': 'SymmetricTree', 'min_data_in_leaf': 250}. Best is trial 441 with value: 37467.065243356185.[0m
[32m[I 2024-10-13 01:24:53,903][0m Trial 547 finished with value: 47269.11671082648 and parameters: {'depth': 10, 'learning_rate': 0.16765001094390178, 'iterations': 485, 'l2_leaf_reg': 0.11361690174374808, 'border_count': 142, 'bagging_temperature': 0.06302413202583165, 'random_strength': 9.625251539803191, 'grow_policy': 'SymmetricTree', 'min_data_in_leaf': 323}. Best is trial 441 with value: 37467.065243356185.[0m
[32m[I 2024-10-13 01:24:56,858][0m Trial 548 finished with value: 52694.97095507892 and parameters: {'depth': 9, 'learning_rate': 0.009164749862221294, 'iterations': 2855, 'l2_leaf_reg': 0.2998204027737685, 'border_count': 228, 'bagging_temperature': 0.019774927628173008, 'random_strength': 9.767696468587152, 'grow_policy': 'Depthwise', 'min_data_in_leaf': 287}. Best is trial 441 with value: 37467.065243356185.[0m
[32m[I 2024-10-13 01:24:59,297][0m Trial 549 finished with value: 47332.25681230643 and parameters: {'depth': 10, 'learning_rate': 0.23197852787044804, 'iterations': 452, 'l2_leaf_reg': 0.13974607670915415, 'border_count': 213, 'bagging_temperature': 0.10584735865806869, 'random_strength': 9.638683513618066, 'grow_policy': 'SymmetricTree', 'min_data_in_leaf': 290}. Best is trial 441 with value: 37467.065243356185.[0m
[32m[I 2024-10-13 01:25:09,392][0m Trial 550 finished with value: 56465.01083123665 and parameters: {'depth': 12, 'learning_rate': 0.1903647007695789, 'iterations': 565, 'l2_leaf_reg': 0.10515075182950478, 'border_count': 235, 'bagging_temperature': 0.04563757250603151, 'random_strength': 9.5507920271038, 'grow_policy': 'SymmetricTree', 'min_data_in_leaf': 263}. Best is trial 441 with value: 37467.065243356185.[0m
[32m[I 2024-10-13 01:25:20,962][0m Trial 551 finished with value: 51928.727107026745 and parameters: {'depth': 10, 'learning_rate': 0.2358875750029036, 'iterations': 588, 'l2_leaf_reg': 0.23739833366863708, 'border_count': 222, 'bagging_temperature': 0.018618224906836983, 'random_strength': 9.843435188198796, 'grow_policy': 'SymmetricTree', 'min_data_in_leaf': 258}. Best is trial 441 with value: 37467.065243356185.[0m
[32m[I 2024-10-13 01:25:32,976][0m Trial 552 finished with value: 52748.39128237212 and parameters: {'depth': 10, 'learning_rate': 0.20660624121295895, 'iterations': 937, 'l2_leaf_reg': 0.15206423659412832, 'border_count': 232, 'bagging_temperature': 0.03630962843691831, 'random_strength': 9.542174480633289, 'grow_policy': 'SymmetricTree', 'min_data_in_leaf': 223}. Best is trial 441 with value: 37467.065243356185.[0m
[32m[I 2024-10-13 01:25:34,561][0m Trial 553 finished with value: 53754.27145698237 and parameters: {'depth': 9, 'learning_rate': 0.16175495314286067, 'iterations': 335, 'l2_leaf_reg': 0.09357648287218882, 'border_count': 219, 'bagging_temperature': 0.0796071530698509, 'random_strength': 9.772095675824055, 'grow_policy': 'SymmetricTree', 'min_data_in_leaf': 245}. Best is trial 441 with value: 37467.065243356185.[0m
[32m[I 2024-10-13 01:25:37,716][0m Trial 554 finished with value: 45402.088160203006 and parameters: {'depth': 11, 'learning_rate': 0.2440494757634902, 'iterations': 426, 'l2_leaf_reg': 0.18834680790265174, 'border_count': 226, 'bagging_temperature': 0.019290304358128438, 'random_strength': 9.440557105428887, 'grow_policy': 'SymmetricTree', 'min_data_in_leaf': 198}. Best is trial 441 with value: 37467.065243356185.[0m
[32m[I 2024-10-13 01:25:44,602][0m Trial 555 finished with value: 55301.25073074093 and parameters: {'depth': 13, 'learning_rate': 0.2539930338001816, 'iterations': 342, 'l2_leaf_reg': 0.08856982096386001, 'border_count': 237, 'bagging_temperature': 0.05344702565834009, 'random_strength': 9.985026419962853, 'grow_policy': 'SymmetricTree', 'min_data_in_leaf': 182}. Best is trial 441 with value: 37467.065243356185.[0m
[32m[I 2024-10-13 01:25:46,098][0m Trial 556 finished with value: 41968.069023526055 and parameters: {'depth': 10, 'learning_rate': 0.19041727609318465, 'iterations': 269, 'l2_leaf_reg': 0.35838869366684145, 'border_count': 210, 'bagging_temperature': 0.018316568665565407, 'random_strength': 9.626521870308382, 'grow_policy': 'SymmetricTree', 'min_data_in_leaf': 172}. Best is trial 441 with value: 37467.065243356185.[0m
[32m[I 2024-10-13 01:26:09,290][0m Trial 557 finished with value: 51926.91008053247 and parameters: {'depth': 10, 'learning_rate': 0.22502006022962906, 'iterations': 1831, 'l2_leaf_reg': 0.2815523620653576, 'border_count': 216, 'bagging_temperature': 0.038180222768049804, 'random_strength': 9.324298569018111, 'grow_policy': 'SymmetricTree', 'min_data_in_leaf': 235}. Best is trial 441 with value: 37467.065243356185.[0m
[32m[I 2024-10-13 01:26:16,649][0m Trial 558 finished with value: 53731.811047165465 and parameters: {'depth': 9, 'learning_rate': 0.24857174838161672, 'iterations': 513, 'l2_leaf_reg': 0.10772353659632664, 'border_count': 223, 'bagging_temperature': 0.017143126785710682, 'random_strength': 9.484984639091818, 'grow_policy': 'SymmetricTree', 'min_data_in_leaf': 210}. Best is trial 441 with value: 37467.065243356185.[0m
[32m[I 2024-10-13 01:26:17,621][0m Trial 559 finished with value: 80731.16885781677 and parameters: {'depth': 10, 'learning_rate': 0.0018052613946582844, 'iterations': 428, 'l2_leaf_reg': 0.16540279623048382, 'border_count': 230, 'bagging_temperature': 0.06989519214187266, 'random_strength': 9.993624478089956, 'grow_policy': 'Lossguide', 'min_data_in_leaf': 69, 'max_leaves': 205}. Best is trial 441 with value: 37467.065243356185.[0m
[32m[I 2024-10-13 01:26:19,643][0m Trial 560 finished with value: 42455.126615729605 and parameters: {'depth': 10, 'learning_rate': 0.20744747217055604, 'iterations': 369, 'l2_leaf_reg': 0.07949274321790786, 'border_count': 228, 'bagging_temperature': 0.04271517122814162, 'random_strength': 9.694013453509847, 'grow_policy': 'SymmetricTree', 'min_data_in_leaf': 273}. Best is trial 441 with value: 37467.065243356185.[0m
[32m[I 2024-10-13 01:26:21,488][0m Trial 561 finished with value: 41062.92538141613 and parameters: {'depth': 9, 'learning_rate': 0.25584406441973195, 'iterations': 478, 'l2_leaf_reg': 0.19908811131269066, 'border_count': 221, 'bagging_temperature': 0.01638751531274137, 'random_strength': 9.341499981610967, 'grow_policy': 'SymmetricTree', 'min_data_in_leaf': 306}. Best is trial 441 with value: 37467.065243356185.[0m
[32m[I 2024-10-13 01:26:23,084][0m Trial 562 finished with value: 43622.3581207295 and parameters: {'depth': 10, 'learning_rate': 0.15283519881069427, 'iterations': 267, 'l2_leaf_reg': 0.12384943063589646, 'border_count': 214, 'bagging_temperature': 0.034288931561769154, 'random_strength': 8.15450855854137, 'grow_policy': 'SymmetricTree', 'min_data_in_leaf': 166}. Best is trial 441 with value: 37467.065243356185.[0m
[32m[I 2024-10-13 01:26:25,008][0m Trial 563 finished with value: 47454.9996513977 and parameters: {'depth': 10, 'learning_rate': 0.2595569091478836, 'iterations': 323, 'l2_leaf_reg': 0.3201914891756161, 'border_count': 233, 'bagging_temperature': 0.0611649466648069, 'random_strength': 9.253868792850907, 'grow_policy': 'SymmetricTree', 'min_data_in_leaf': 190}. Best is trial 441 with value: 37467.065243356185.[0m
[32m[I 2024-10-13 01:26:28,238][0m Trial 564 finished with value: 42443.06660585553 and parameters: {'depth': 11, 'learning_rate': 0.1783375079265361, 'iterations': 419, 'l2_leaf_reg': 0.05948643526830327, 'border_count': 226, 'bagging_temperature': 0.0009203315748721151, 'random_strength': 9.80867793100369, 'grow_policy': 'SymmetricTree', 'min_data_in_leaf': 111}. Best is trial 441 with value: 37467.065243356185.[0m
[32m[I 2024-10-13 01:26:29,853][0m Trial 565 finished with value: 41815.793975563065 and parameters: {'depth': 9, 'learning_rate': 0.217531081567749, 'iterations': 377, 'l2_leaf_reg': 0.14056567692418662, 'border_count': 238, 'bagging_temperature': 0.00012719356537519572, 'random_strength': 9.503129052477902, 'grow_policy': 'SymmetricTree', 'min_data_in_leaf': 160}. Best is trial 441 with value: 37467.065243356185.[0m
[32m[I 2024-10-13 01:26:41,077][0m Trial 566 finished with value: 53581.717848505796 and parameters: {'depth': 10, 'learning_rate': 0.25919705333236115, 'iterations': 1692, 'l2_leaf_reg': 0.09029010803508995, 'border_count': 220, 'bagging_temperature': 0.03183693129631626, 'random_strength': 8.880319055145355, 'grow_policy': 'SymmetricTree', 'min_data_in_leaf': 85}. Best is trial 441 with value: 37467.065243356185.[0m
