[32m[I 2024-10-13 01:17:52,587][0m Trial 465 finished with value: 42534.752471673484 and parameters: {'depth': 11, 'learning_rate': 0.19240832094369031, 'iterations': 281, 'l2_leaf_reg': 0.0012240829142254833, 'border_count': 215, 'bagging_temperature': 0.034843621306728904, 'random_strength': 8.997183017640944, 'grow_policy': 'SymmetricTree', 'min_data_in_leaf': 188}. Best is trial 441 with value: 37467.065243356185.[0m
[32m[I 2024-10-13 01:17:55,452][0m Trial 466 finished with value: 40733.9215265546 and parameters: {'depth': 10, 'learning_rate': 0.2469540490532023, 'iterations': 397, 'l2_leaf_reg': 0.000972613407143638, 'border_count': 214, 'bagging_temperature': 0.01828782137725456, 'random_strength': 9.205363089599068, 'grow_policy': 'SymmetricTree', 'min_data_in_leaf': 174}. Best is trial 441 with value: 37467.065243356185.[0m
[32m[I 2024-10-13 01:17:57,951][0m Trial 467 finished with value: 48710.49646308712 and parameters: {'depth': 10, 'learning_rate': 0.17017566041021184, 'iterations': 350, 'l2_leaf_reg': 0.010406635550438317, 'border_count': 204, 'bagging_temperature': 0.0546451168725824, 'random_strength': 9.602292641701098, 'grow_policy': 'SymmetricTree', 'min_data_in_leaf': 167}. Best is trial 441 with value: 37467.065243356185.[0m
[32m[I 2024-10-13 01:18:00,856][0m Trial 468 finished with value: 42266.94816765141 and parameters: {'depth': 10, 'learning_rate': 0.22723509269185768, 'iterations': 413, 'l2_leaf_reg': 0.0023577423087478688, 'border_count': 215, 'bagging_temperature': 0.017362162279333196, 'random_strength': 9.667339072080011, 'grow_policy': 'SymmetricTree', 'min_data_in_leaf': 161}. Best is trial 441 with value: 37467.065243356185.[0m
[32m[I 2024-10-13 01:18:01,688][0m Trial 469 finished with value: 53737.958048599176 and parameters: {'depth': 9, 'learning_rate': 0.25568055789508753, 'iterations': 309, 'l2_leaf_reg': 0.007632523990297621, 'border_count': 208, 'bagging_temperature': 0.03601291884936403, 'random_strength': 0.551997891746554, 'grow_policy': 'Lossguide', 'min_data_in_leaf': 190, 'max_leaves': 255}. Best is trial 441 with value: 37467.065243356185.[0m
[32m[I 2024-10-13 01:18:04,657][0m Trial 470 finished with value: 41800.66786829078 and parameters: {'depth': 10, 'learning_rate': 0.20633230261944469, 'iterations': 402, 'l2_leaf_reg': 0.004045705226935171, 'border_count': 216, 'bagging_temperature': 0.01871248445632485, 'random_strength': 8.96945514881012, 'grow_policy': 'SymmetricTree', 'min_data_in_leaf': 148}. Best is trial 441 with value: 37467.065243356185.[0m
[32m[I 2024-10-13 01:18:07,071][0m Trial 471 finished with value: 40267.74366392527 and parameters: {'depth': 10, 'learning_rate': 0.25436826144907043, 'iterations': 304, 'l2_leaf_reg': 0.0016043529220957367, 'border_count': 218, 'bagging_temperature': 7.820053105996039e-05, 'random_strength': 9.400640440537055, 'grow_policy': 'SymmetricTree', 'min_data_in_leaf': 133}. Best is trial 441 with value: 37467.065243356185.[0m
[32m[I 2024-10-13 01:18:09,214][0m Trial 472 finished with value: 52132.891778509176 and parameters: {'depth': 10, 'learning_rate': 0.23177415447385344, 'iterations': 284, 'l2_leaf_reg': 0.0015475659613458461, 'border_count': 210, 'bagging_temperature': 0.08114717997720239, 'random_strength': 9.43880885282432, 'grow_policy': 'SymmetricTree', 'min_data_in_leaf': 164}. Best is trial 441 with value: 37467.065243356185.[0m
[32m[I 2024-10-13 01:18:21,578][0m Trial 473 finished with value: 54892.596416259104 and parameters: {'depth': 9, 'learning_rate': 0.1644931019791354, 'iterations': 1205, 'l2_leaf_reg': 0.002367822310631314, 'border_count': 216, 'bagging_temperature': 0.037028182472666635, 'random_strength': 9.249553896586173, 'grow_policy': 'SymmetricTree', 'min_data_in_leaf': 332}. Best is trial 441 with value: 37467.065243356185.[0m
[32m[I 2024-10-13 01:18:24,574][0m Trial 474 finished with value: 51001.13923911438 and parameters: {'depth': 11, 'learning_rate': 0.25418726704680417, 'iterations': 276, 'l2_leaf_reg': 0.001822134864563559, 'border_count': 218, 'bagging_temperature': 0.05571553446927843, 'random_strength': 9.657830890829192, 'grow_policy': 'SymmetricTree', 'min_data_in_leaf': 136}. Best is trial 441 with value: 37467.065243356185.[0m
[32m[I 2024-10-13 01:18:27,868][0m Trial 475 finished with value: 48711.318112110006 and parameters: {'depth': 10, 'learning_rate': 0.19672234316755516, 'iterations': 459, 'l2_leaf_reg': 0.000883780259776276, 'border_count': 212, 'bagging_temperature': 0.4245434419450828, 'random_strength': 9.386783232809512, 'grow_policy': 'SymmetricTree', 'min_data_in_leaf': 185}. Best is trial 441 with value: 37467.065243356185.[0m
[32m[I 2024-10-13 01:18:29,836][0m Trial 476 finished with value: 44928.05454831332 and parameters: {'depth': 9, 'learning_rate': 0.25609946837876785, 'iterations': 339, 'l2_leaf_reg': 0.003118426347982418, 'border_count': 219, 'bagging_temperature': 0.018883919740762086, 'random_strength': 9.17513984786024, 'grow_policy': 'SymmetricTree', 'min_data_in_leaf': 199}. Best is trial 441 with value: 37467.065243356185.[0m
[32m[I 2024-10-13 01:18:32,890][0m Trial 477 finished with value: 42263.15954493572 and parameters: {'depth': 10, 'learning_rate': 0.21424432638473476, 'iterations': 420, 'l2_leaf_reg': 0.007448940000253383, 'border_count': 203, 'bagging_temperature': 0.01611589180788821, 'random_strength': 9.507629890301287, 'grow_policy': 'SymmetricTree', 'min_data_in_leaf': 163}. Best is trial 441 with value: 37467.065243356185.[0m
[32m[I 2024-10-13 01:18:35,451][0m Trial 478 finished with value: 135056.26577358026 and parameters: {'depth': 10, 'learning_rate': 0.0001434465362550364, 'iterations': 282, 'l2_leaf_reg': 0.004160487820635603, 'border_count': 209, 'bagging_temperature': 0.03754167751160613, 'random_strength': 9.047254988678795, 'grow_policy': 'SymmetricTree', 'min_data_in_leaf': 137}. Best is trial 441 with value: 37467.065243356185.[0m
[32m[I 2024-10-13 01:18:38,026][0m Trial 479 finished with value: 40713.19847206983 and parameters: {'depth': 10, 'learning_rate': 0.2539424579047144, 'iterations': 355, 'l2_leaf_reg': 0.0015637262947090077, 'border_count': 220, 'bagging_temperature': 0.0005598279936107863, 'random_strength': 9.249513540497494, 'grow_policy': 'SymmetricTree', 'min_data_in_leaf': 172}. Best is trial 441 with value: 37467.065243356185.[0m
[32m[I 2024-10-13 01:18:39,132][0m Trial 480 finished with value: 54425.40382290299 and parameters: {'depth': 11, 'learning_rate': 0.1851919751295961, 'iterations': 503, 'l2_leaf_reg': 0.11915640019035256, 'border_count': 213, 'bagging_temperature': 0.07024568974030004, 'random_strength': 9.740330880460455, 'grow_policy': 'Depthwise', 'min_data_in_leaf': 149}. Best is trial 441 with value: 37467.065243356185.[0m
[32m[I 2024-10-13 01:19:11,617][0m Trial 481 finished with value: 54187.93228527534 and parameters: {'depth': 10, 'learning_rate': 0.297010607048099, 'iterations': 1951, 'l2_leaf_reg': 0.08230999551593515, 'border_count': 219, 'bagging_temperature': 0.036637137863425984, 'random_strength': 9.436202250355203, 'grow_policy': 'SymmetricTree', 'min_data_in_leaf': 127}. Best is trial 441 with value: 37467.065243356185.[0m
[32m[I 2024-10-13 01:19:37,988][0m Trial 482 finished with value: 53484.89932122074 and parameters: {'depth': 10, 'learning_rate': 0.22718239949585964, 'iterations': 2174, 'l2_leaf_reg': 0.009138002644432326, 'border_count': 199, 'bagging_temperature': 0.017875059482463478, 'random_strength': 8.913394531380296, 'grow_policy': 'SymmetricTree', 'min_data_in_leaf': 202}. Best is trial 441 with value: 37467.065243356185.[0m
[32m[I 2024-10-13 01:19:41,183][0m Trial 483 finished with value: 53866.93267734292 and parameters: {'depth': 10, 'learning_rate': 0.25981682357092084, 'iterations': 433, 'l2_leaf_reg': 0.0005897210642855095, 'border_count': 235, 'bagging_temperature': 0.052350799281793335, 'random_strength': 9.139259809127232, 'grow_policy': 'SymmetricTree', 'min_data_in_leaf': 232}. Best is trial 441 with value: 37467.065243356185.[0m
[32m[I 2024-10-13 01:19:43,314][0m Trial 484 finished with value: 40913.75733388203 and parameters: {'depth': 9, 'learning_rate': 0.29933484976053504, 'iterations': 365, 'l2_leaf_reg': 0.15922426651217714, 'border_count': 205, 'bagging_temperature': 0.03203831044104816, 'random_strength': 9.659842783412156, 'grow_policy': 'SymmetricTree', 'min_data_in_leaf': 150}. Best is trial 441 with value: 37467.065243356185.[0m
[32m[I 2024-10-13 01:19:45,243][0m Trial 485 finished with value: 127319.44598195495 and parameters: {'depth': 9, 'learning_rate': 0.000362328762261216, 'iterations': 310, 'l2_leaf_reg': 0.22072609891671757, 'border_count': 222, 'bagging_temperature': 0.015559686283349845, 'random_strength': 9.992078335469305, 'grow_policy': 'SymmetricTree', 'min_data_in_leaf': 82}. Best is trial 441 with value: 37467.065243356185.[0m
[32m[I 2024-10-13 01:19:48,833][0m Trial 486 finished with value: 48355.75166654084 and parameters: {'depth': 10, 'learning_rate': 0.2108994273656693, 'iterations': 470, 'l2_leaf_reg': 0.0023498865008126247, 'border_count': 214, 'bagging_temperature': 0.05178613129953752, 'random_strength': 9.32392157249116, 'grow_policy': 'SymmetricTree', 'min_data_in_leaf': 116}. Best is trial 441 with value: 37467.065243356185.[0m
[32m[I 2024-10-13 01:19:59,143][0m Trial 487 finished with value: 52294.06658627586 and parameters: {'depth': 11, 'learning_rate': 0.1691716938174322, 'iterations': 561, 'l2_leaf_reg': 0.00621599316735884, 'border_count': 35, 'bagging_temperature': 0.00021033904399376727, 'random_strength': 8.725733467599166, 'grow_policy': 'SymmetricTree', 'min_data_in_leaf': 173}. Best is trial 441 with value: 37467.065243356185.[0m
[32m[I 2024-10-13 01:20:02,293][0m Trial 488 finished with value: 51099.22446889508 and parameters: {'depth': 10, 'learning_rate': 0.2552286663803503, 'iterations': 415, 'l2_leaf_reg': 0.09083425694365943, 'border_count': 218, 'bagging_temperature': 0.10189185105452836, 'random_strength': 8.97906426877919, 'grow_policy': 'SymmetricTree', 'min_data_in_leaf': 146}. Best is trial 441 with value: 37467.065243356185.[0m
[32m[I 2024-10-13 01:20:04,050][0m Trial 489 finished with value: 42304.20230432486 and parameters: {'depth': 9, 'learning_rate': 0.22444293341608512, 'iterations': 276, 'l2_leaf_reg': 0.13413127157123308, 'border_count': 209, 'bagging_temperature': 0.01741009070624992, 'random_strength': 9.511528295992745, 'grow_policy': 'SymmetricTree', 'min_data_in_leaf': 130}. Best is trial 441 with value: 37467.065243356185.[0m
[32m[I 2024-10-13 01:20:06,807][0m Trial 490 finished with value: 40207.37777941082 and parameters: {'depth': 10, 'learning_rate': 0.2985890911774823, 'iterations': 389, 'l2_leaf_reg': 0.004582879205475837, 'border_count': 231, 'bagging_temperature': 0.03426508544638339, 'random_strength': 9.196605374403642, 'grow_policy': 'SymmetricTree', 'min_data_in_leaf': 101}. Best is trial 441 with value: 37467.065243356185.[0m
[32m[I 2024-10-13 01:20:07,867][0m Trial 491 finished with value: 54487.851549962965 and parameters: {'depth': 10, 'learning_rate': 0.256413393097021, 'iterations': 490, 'l2_leaf_reg': 0.004504241402695881, 'border_count': 235, 'bagging_temperature': 0.07223965693883214, 'random_strength': 9.752571559888615, 'grow_policy': 'Lossguide', 'min_data_in_leaf': 916, 'max_leaves': 69}. Best is trial 441 with value: 37467.065243356185.[0m
[32m[I 2024-10-13 01:20:10,949][0m Trial 492 finished with value: 46800.697850411256 and parameters: {'depth': 10, 'learning_rate': 0.19983161073601008, 'iterations': 395, 'l2_leaf_reg': 0.0036950143334057357, 'border_count': 224, 'bagging_temperature': 0.5691077905491039, 'random_strength': 9.27256808027076, 'grow_policy': 'SymmetricTree', 'min_data_in_leaf': 97}. Best is trial 441 with value: 37467.065243356185.[0m
[32m[I 2024-10-13 01:20:12,913][0m Trial 493 finished with value: 62583.84805916551 and parameters: {'depth': 9, 'learning_rate': 0.2313598371010513, 'iterations': 336, 'l2_leaf_reg': 0.0059656631466127865, 'border_count': 13, 'bagging_temperature': 0.05095272858267487, 'random_strength': 9.476577013250377, 'grow_policy': 'SymmetricTree', 'min_data_in_leaf': 80}. Best is trial 441 with value: 37467.065243356185.[0m
[32m[I 2024-10-13 01:20:16,386][0m Trial 494 finished with value: 38835.840306017715 and parameters: {'depth': 10, 'learning_rate': 0.261669627040657, 'iterations': 431, 'l2_leaf_reg': 0.010810813741989214, 'border_count': 232, 'bagging_temperature': 0.03742330700845307, 'random_strength': 9.15432341591134, 'grow_policy': 'SymmetricTree', 'min_data_in_leaf': 183}. Best is trial 441 with value: 37467.065243356185.[0m
[32m[I 2024-10-13 01:20:27,515][0m Trial 495 finished with value: 51357.79690761059 and parameters: {'depth': 10, 'learning_rate': 0.005761303675740771, 'iterations': 528, 'l2_leaf_reg': 0.009738828989313988, 'border_count': 232, 'bagging_temperature': 0.09048366433987108, 'random_strength': 9.164885843971616, 'grow_policy': 'SymmetricTree', 'min_data_in_leaf': 201}. Best is trial 441 with value: 37467.065243356185.[0m
[32m[I 2024-10-13 01:21:01,834][0m Trial 496 finished with value: 55899.159250926234 and parameters: {'depth': 15, 'learning_rate': 0.1864302688225822, 'iterations': 456, 'l2_leaf_reg': 0.011794343184629933, 'border_count': 234, 'bagging_temperature': 0.06318085704825936, 'random_strength': 9.07353385977706, 'grow_policy': 'SymmetricTree', 'min_data_in_leaf': 108}. Best is trial 441 with value: 37467.065243356185.[0m
[32m[I 2024-10-13 01:21:09,624][0m Trial 497 finished with value: 51103.36181318594 and parameters: {'depth': 11, 'learning_rate': 0.23183154800312444, 'iterations': 570, 'l2_leaf_reg': 0.0074949222790321015, 'border_count': 228, 'bagging_temperature': 0.04069049991503694, 'random_strength': 8.803020288275643, 'grow_policy': 'SymmetricTree', 'min_data_in_leaf': 156}. Best is trial 441 with value: 37467.065243356185.[0m
[32m[I 2024-10-13 01:21:11,366][0m Trial 498 finished with value: 44251.047418132126 and parameters: {'depth': 9, 'learning_rate': 0.2985172056467348, 'iterations': 453, 'l2_leaf_reg': 0.012795418893993625, 'border_count': 223, 'bagging_temperature': 0.4861922728304316, 'random_strength': 9.296630636789406, 'grow_policy': 'SymmetricTree', 'min_data_in_leaf': 133}. Best is trial 441 with value: 37467.065243356185.[0m
[32m[I 2024-10-13 01:21:20,030][0m Trial 499 finished with value: 50522.5405144599 and parameters: {'depth': 10, 'learning_rate': 0.00706490215485742, 'iterations': 511, 'l2_leaf_reg': 0.08641690228214673, 'border_count': 235, 'bagging_temperature': 0.0005060017163317444, 'random_strength': 8.565240760701265, 'grow_policy': 'SymmetricTree', 'min_data_in_leaf': 185}. Best is trial 441 with value: 37467.065243356185.[0m
[32m[I 2024-10-13 01:21:31,589][0m Trial 500 finished with value: 55924.96619747211 and parameters: {'depth': 10, 'learning_rate': 0.2004293922660434, 'iterations': 1072, 'l2_leaf_reg': 0.07174020945866325, 'border_count': 230, 'bagging_temperature': 0.035179002753722294, 'random_strength': 9.028800750346608, 'grow_policy': 'SymmetricTree', 'min_data_in_leaf': 105}. Best is trial 441 with value: 37467.065243356185.[0m
[32m[I 2024-10-13 01:21:39,137][0m Trial 501 finished with value: 59246.580967989335 and parameters: {'depth': 10, 'learning_rate': 0.25539031210091995, 'iterations': 749, 'l2_leaf_reg': 0.008381487173005537, 'border_count': 225, 'bagging_temperature': 0.07033486468775937, 'random_strength': 0.03927823166348787, 'grow_policy': 'SymmetricTree', 'min_data_in_leaf': 225}. Best is trial 441 with value: 37467.065243356185.[0m
[32m[I 2024-10-13 01:21:41,553][0m Trial 502 finished with value: 43725.806007588515 and parameters: {'depth': 10, 'learning_rate': 0.16227146893552033, 'iterations': 404, 'l2_leaf_reg': 0.002831631789701078, 'border_count': 219, 'bagging_temperature': 0.034930897172191784, 'random_strength': 9.330390072632357, 'grow_policy': 'SymmetricTree', 'min_data_in_leaf': 161}. Best is trial 441 with value: 37467.065243356185.[0m
[32m[I 2024-10-13 01:21:44,702][0m Trial 503 finished with value: 54814.476962531095 and parameters: {'depth': 11, 'learning_rate': 0.2528074358097387, 'iterations': 411, 'l2_leaf_reg': 0.002022671320720144, 'border_count': 230, 'bagging_temperature': 0.25595776242289775, 'random_strength': 8.874268436716253, 'grow_policy': 'SymmetricTree', 'min_data_in_leaf': 130}. Best is trial 441 with value: 37467.065243356185.[0m
[32m[I 2024-10-13 01:21:45,990][0m Trial 504 finished with value: 55000.57539083706 and parameters: {'depth': 10, 'learning_rate': 0.2199696552296985, 'iterations': 853, 'l2_leaf_reg': 0.1210480088115557, 'border_count': 224, 'bagging_temperature': 0.31660703243775123, 'random_strength': 9.138928306077188, 'grow_policy': 'Depthwise', 'min_data_in_leaf': 89}. Best is trial 441 with value: 37467.065243356185.[0m
[32m[I 2024-10-13 01:21:52,978][0m Trial 505 finished with value: 47595.113036075214 and parameters: {'depth': 9, 'learning_rate': 0.2995039701859474, 'iterations': 676, 'l2_leaf_reg': 0.016495254233534058, 'border_count': 235, 'bagging_temperature': 9.930789439460339e-05, 'random_strength': 9.371575463653256, 'grow_policy': 'SymmetricTree', 'min_data_in_leaf': 144}. Best is trial 441 with value: 37467.065243356185.[0m
[32m[I 2024-10-13 01:21:54,741][0m Trial 506 finished with value: 48096.048901810704 and parameters: {'depth': 9, 'learning_rate': 0.25578313342853787, 'iterations': 468, 'l2_leaf_reg': 0.062350588666778416, 'border_count': 216, 'bagging_temperature': 0.055234527535418146, 'random_strength': 8.362067726515354, 'grow_policy': 'SymmetricTree', 'min_data_in_leaf': 168}. Best is trial 441 with value: 37467.065243356185.[0m
[32m[I 2024-10-13 01:21:56,682][0m Trial 507 finished with value: 40903.043213831304 and parameters: {'depth': 10, 'learning_rate': 0.1919273034863493, 'iterations': 371, 'l2_leaf_reg': 0.08232514820116606, 'border_count': 220, 'bagging_temperature': 0.03433004874320862, 'random_strength': 9.75982562342632, 'grow_policy': 'SymmetricTree', 'min_data_in_leaf': 112}. Best is trial 441 with value: 37467.065243356185.[0m
[32m[I 2024-10-13 01:22:04,731][0m Trial 508 finished with value: 49388.53767256309 and parameters: {'depth': 10, 'learning_rate': 0.2283903792315924, 'iterations': 610, 'l2_leaf_reg': 0.001268497319496088, 'border_count': 226, 'bagging_temperature': 0.015082741431467444, 'random_strength': 8.808754443134768, 'grow_policy': 'SymmetricTree', 'min_data_in_leaf': 203}. Best is trial 441 with value: 37467.065243356185.[0m
[32m[I 2024-10-13 01:22:12,343][0m Trial 509 finished with value: 53529.78566951545 and parameters: {'depth': 10, 'learning_rate': 0.25981012824732014, 'iterations': 500, 'l2_leaf_reg': 0.13541104457602118, 'border_count': 229, 'bagging_temperature': 0.05138413797910728, 'random_strength': 9.130523947742068, 'grow_policy': 'SymmetricTree', 'min_data_in_leaf': 140}. Best is trial 441 with value: 37467.065243356185.[0m
[32m[I 2024-10-13 01:22:14,014][0m Trial 510 finished with value: 50654.2704701355 and parameters: {'depth': 9, 'learning_rate': 0.21157361198823024, 'iterations': 429, 'l2_leaf_reg': 0.011070315073450888, 'border_count': 215, 'bagging_temperature': 0.08548726534740488, 'random_strength': 8.967367504273124, 'grow_policy': 'SymmetricTree', 'min_data_in_leaf': 183}. Best is trial 441 with value: 37467.065243356185.[0m
[32m[I 2024-10-13 01:22:15,886][0m Trial 511 finished with value: 40722.081726244316 and parameters: {'depth': 10, 'learning_rate': 0.2585803288025634, 'iterations': 340, 'l2_leaf_reg': 0.029296242967475877, 'border_count': 234, 'bagging_temperature': 8.516774227488796e-05, 'random_strength': 9.505993485889114, 'grow_policy': 'SymmetricTree', 'min_data_in_leaf': 965}. Best is trial 441 with value: 37467.065243356185.[0m
[32m[I 2024-10-13 01:22:18,984][0m Trial 512 finished with value: 43236.8471233645 and parameters: {'depth': 11, 'learning_rate': 0.16909459125238474, 'iterations': 384, 'l2_leaf_reg': 0.005868428771822957, 'border_count': 222, 'bagging_temperature': 0.0323284246305878, 'random_strength': 9.22573371368819, 'grow_policy': 'SymmetricTree', 'min_data_in_leaf': 77}. Best is trial 441 with value: 37467.065243356185.[0m
[32m[I 2024-10-13 01:22:29,853][0m Trial 513 finished with value: 55097.115473483645 and parameters: {'depth': 10, 'learning_rate': 0.2956670696457869, 'iterations': 557, 'l2_leaf_reg': 0.0662851195023538, 'border_count': 213, 'bagging_temperature': 0.016163639469803433, 'random_strength': 8.55808542691649, 'grow_policy': 'SymmetricTree', 'min_data_in_leaf': 119}. Best is trial 441 with value: 37467.065243356185.[0m
[32m[I 2024-10-13 01:22:30,708][0m Trial 514 finished with value: 54737.84621652046 and parameters: {'depth': 10, 'learning_rate': 0.22512863655444929, 'iterations': 445, 'l2_leaf_reg': 0.23726422733358757, 'border_count': 226, 'bagging_temperature': 0.04850278883412524, 'random_strength': 9.465229246688171, 'grow_policy': 'Lossguide', 'min_data_in_leaf': 155, 'max_leaves': 110}. Best is trial 441 with value: 37467.065243356185.[0m
[32m[I 2024-10-13 01:22:40,799][0m Trial 515 finished with value: 52171.71471440342 and parameters: {'depth': 14, 'learning_rate': 0.19604569136750138, 'iterations': 269, 'l2_leaf_reg': 0.01845793282678065, 'border_count': 219, 'bagging_temperature': 0.018453963484405304, 'random_strength': 9.651679678773004, 'grow_policy': 'SymmetricTree', 'min_data_in_leaf': 94}. Best is trial 441 with value: 37467.065243356185.[0m
