[32m[I 2024-10-13 01:37:15,947][0m Trial 720 finished with value: 56187.09413944516 and parameters: {'depth': 11, 'learning_rate': 0.255892276970611, 'iterations': 299, 'l2_leaf_reg': 0.00012908884193550557, 'border_count': 15, 'bagging_temperature': 0.03332646249550229, 'random_strength': 9.731841439939355, 'grow_policy': 'SymmetricTree', 'min_data_in_leaf': 152}. Best is trial 441 with value: 37467.065243356185.[0m
[32m[I 2024-10-13 01:37:27,789][0m Trial 721 finished with value: 52227.764306844554 and parameters: {'depth': 10, 'learning_rate': 0.17781087243830151, 'iterations': 599, 'l2_leaf_reg': 0.07894011918088745, 'border_count': 133, 'bagging_temperature': 7.809046189901465e-05, 'random_strength': 9.19775371736197, 'grow_policy': 'SymmetricTree', 'min_data_in_leaf': 55}. Best is trial 441 with value: 37467.065243356185.[0m
[32m[I 2024-10-13 01:37:31,511][0m Trial 722 finished with value: 50386.119354973984 and parameters: {'depth': 9, 'learning_rate': 0.2124056190512968, 'iterations': 473, 'l2_leaf_reg': 0.0006051839945800838, 'border_count': 228, 'bagging_temperature': 0.06968715591874519, 'random_strength': 9.376979092249682, 'grow_policy': 'SymmetricTree', 'min_data_in_leaf': 225}. Best is trial 441 with value: 37467.065243356185.[0m
[32m[I 2024-10-13 01:37:34,967][0m Trial 723 finished with value: 39731.396928966526 and parameters: {'depth': 10, 'learning_rate': 0.2562006062060899, 'iterations': 344, 'l2_leaf_reg': 0.26307348681760356, 'border_count': 233, 'bagging_temperature': 0.017483644886641482, 'random_strength': 9.042912043272624, 'grow_policy': 'SymmetricTree', 'min_data_in_leaf': 120}. Best is trial 441 with value: 37467.065243356185.[0m
[32m[I 2024-10-13 01:37:37,849][0m Trial 724 finished with value: 38664.63721700388 and parameters: {'depth': 10, 'learning_rate': 0.26692864947558304, 'iterations': 300, 'l2_leaf_reg': 0.31482013618917126, 'border_count': 238, 'bagging_temperature': 0.018687325937975948, 'random_strength': 9.127699005167925, 'grow_policy': 'SymmetricTree', 'min_data_in_leaf': 119}. Best is trial 441 with value: 37467.065243356185.[0m
[32m[I 2024-10-13 01:37:39,496][0m Trial 725 finished with value: 40857.72123428321 and parameters: {'depth': 10, 'learning_rate': 0.2996224153464381, 'iterations': 264, 'l2_leaf_reg': 0.42018888073269606, 'border_count': 173, 'bagging_temperature': 0.016039713004010112, 'random_strength': 9.253887606325227, 'grow_policy': 'SymmetricTree', 'min_data_in_leaf': 95}. Best is trial 441 with value: 37467.065243356185.[0m
[32m[I 2024-10-13 01:37:40,804][0m Trial 726 finished with value: 37144.045766835996 and parameters: {'depth': 9, 'learning_rate': 0.2982380892853731, 'iterations': 271, 'l2_leaf_reg': 0.5903164170075648, 'border_count': 245, 'bagging_temperature': 0.01688593892850543, 'random_strength': 9.560235555266887, 'grow_policy': 'SymmetricTree', 'min_data_in_leaf': 116}. Best is trial 726 with value: 37144.045766835996.[0m
[32m[I 2024-10-13 01:37:41,494][0m Trial 727 finished with value: 52455.010904298935 and parameters: {'depth': 9, 'learning_rate': 0.2625224338339684, 'iterations': 213, 'l2_leaf_reg': 0.5699255264402502, 'border_count': 245, 'bagging_temperature': 0.015681921140486922, 'random_strength': 9.778060603212968, 'grow_policy': 'Depthwise', 'min_data_in_leaf': 112}. Best is trial 726 with value: 37144.045766835996.[0m
[32m[I 2024-10-13 01:37:42,778][0m Trial 728 finished with value: 38516.769862315625 and parameters: {'depth': 9, 'learning_rate': 0.29822387669796147, 'iterations': 233, 'l2_leaf_reg': 0.7039359762737866, 'border_count': 242, 'bagging_temperature': 0.0012447276843967764, 'random_strength': 9.98415776703188, 'grow_policy': 'SymmetricTree', 'min_data_in_leaf': 95}. Best is trial 726 with value: 37144.045766835996.[0m
[32m[I 2024-10-13 01:37:43,917][0m Trial 729 finished with value: 41943.49634535066 and parameters: {'depth': 9, 'learning_rate': 0.29995048199940816, 'iterations': 196, 'l2_leaf_reg': 0.34517181412221903, 'border_count': 245, 'bagging_temperature': 0.001481305764623117, 'random_strength': 9.986856308998577, 'grow_policy': 'SymmetricTree', 'min_data_in_leaf': 98}. Best is trial 726 with value: 37144.045766835996.[0m
[32m[I 2024-10-13 01:37:45,068][0m Trial 730 finished with value: 39038.78016366217 and parameters: {'depth': 9, 'learning_rate': 0.2986827271479189, 'iterations': 202, 'l2_leaf_reg': 0.6599548230946918, 'border_count': 240, 'bagging_temperature': 0.0015997216395599624, 'random_strength': 9.84775645635818, 'grow_policy': 'SymmetricTree', 'min_data_in_leaf': 119}. Best is trial 726 with value: 37144.045766835996.[0m
[32m[I 2024-10-13 01:37:46,139][0m Trial 731 finished with value: 52846.36791009186 and parameters: {'depth': 8, 'learning_rate': 0.2995277128853611, 'iterations': 203, 'l2_leaf_reg': 1.5852763469653277, 'border_count': 240, 'bagging_temperature': 0.0021033477221020676, 'random_strength': 9.954579416893443, 'grow_policy': 'SymmetricTree', 'min_data_in_leaf': 118}. Best is trial 726 with value: 37144.045766835996.[0m
[32m[I 2024-10-13 01:37:47,126][0m Trial 732 finished with value: 46167.42913509012 and parameters: {'depth': 8, 'learning_rate': 0.2959262998154275, 'iterations': 202, 'l2_leaf_reg': 0.4052606172235437, 'border_count': 241, 'bagging_temperature': 0.00019451880223301382, 'random_strength': 9.811323172550418, 'grow_policy': 'SymmetricTree', 'min_data_in_leaf': 88}. Best is trial 726 with value: 37144.045766835996.[0m
[32m[I 2024-10-13 01:37:48,317][0m Trial 733 finished with value: 41184.73286888304 and parameters: {'depth': 9, 'learning_rate': 0.26416839554574273, 'iterations': 212, 'l2_leaf_reg': 0.46003989916128324, 'border_count': 244, 'bagging_temperature': 0.015281345844059248, 'random_strength': 9.727351795228758, 'grow_policy': 'SymmetricTree', 'min_data_in_leaf': 126}. Best is trial 726 with value: 37144.045766835996.[0m
[32m[I 2024-10-13 01:37:51,488][0m Trial 734 finished with value: 45464.01568882462 and parameters: {'depth': 12, 'learning_rate': 0.2642238872208768, 'iterations': 243, 'l2_leaf_reg': 0.8265036506463097, 'border_count': 244, 'bagging_temperature': 0.013746402702834323, 'random_strength': 9.868404384696294, 'grow_policy': 'SymmetricTree', 'min_data_in_leaf': 106}. Best is trial 726 with value: 37144.045766835996.[0m
[32m[I 2024-10-13 01:37:52,653][0m Trial 735 finished with value: 38766.12329531038 and parameters: {'depth': 9, 'learning_rate': 0.2612150073415508, 'iterations': 254, 'l2_leaf_reg': 0.667108419184333, 'border_count': 238, 'bagging_temperature': 0.00033912809206500195, 'random_strength': 9.961785264647375, 'grow_policy': 'SymmetricTree', 'min_data_in_leaf': 83}. Best is trial 726 with value: 37144.045766835996.[0m
[32m[I 2024-10-13 01:37:53,758][0m Trial 736 finished with value: 39717.83174875472 and parameters: {'depth': 9, 'learning_rate': 0.2995380432621322, 'iterations': 207, 'l2_leaf_reg': 0.7020256431867393, 'border_count': 239, 'bagging_temperature': 0.020560705047440547, 'random_strength': 9.96830068885866, 'grow_policy': 'SymmetricTree', 'min_data_in_leaf': 78}. Best is trial 726 with value: 37144.045766835996.[0m
[32m[I 2024-10-13 01:37:54,799][0m Trial 737 finished with value: 52311.19637189269 and parameters: {'depth': 8, 'learning_rate': 0.23102453745509352, 'iterations': 248, 'l2_leaf_reg': 1.4785557980755364, 'border_count': 245, 'bagging_temperature': 0.0031580904883719424, 'random_strength': 9.843020813241834, 'grow_policy': 'SymmetricTree', 'min_data_in_leaf': 91}. Best is trial 726 with value: 37144.045766835996.[0m
[32m[I 2024-10-13 01:37:55,812][0m Trial 738 finished with value: 48296.1249467373 and parameters: {'depth': 9, 'learning_rate': 0.25734150385916665, 'iterations': 175, 'l2_leaf_reg': 0.6880389620789659, 'border_count': 246, 'bagging_temperature': 0.7226223533524755, 'random_strength': 9.969703735782238, 'grow_policy': 'SymmetricTree', 'min_data_in_leaf': 77}. Best is trial 726 with value: 37144.045766835996.[0m
[32m[I 2024-10-13 01:37:56,531][0m Trial 739 finished with value: 54201.411062639185 and parameters: {'depth': 9, 'learning_rate': 0.2978074524185269, 'iterations': 246, 'l2_leaf_reg': 1.1144935295570222, 'border_count': 236, 'bagging_temperature': 0.0004584510650430468, 'random_strength': 9.985667192757056, 'grow_policy': 'Lossguide', 'min_data_in_leaf': 130, 'max_leaves': 109}. Best is trial 726 with value: 37144.045766835996.[0m
[32m[I 2024-10-13 01:37:57,642][0m Trial 740 finished with value: 60804.84538547967 and parameters: {'depth': 8, 'learning_rate': 0.22647813602489977, 'iterations': 265, 'l2_leaf_reg': 0.7956216841088524, 'border_count': 4, 'bagging_temperature': 0.0001871263113314009, 'random_strength': 9.765837686211245, 'grow_policy': 'SymmetricTree', 'min_data_in_leaf': 100}. Best is trial 726 with value: 37144.045766835996.[0m
[32m[I 2024-10-13 01:37:58,856][0m Trial 741 finished with value: 40709.8090726707 and parameters: {'depth': 9, 'learning_rate': 0.2599669805270873, 'iterations': 236, 'l2_leaf_reg': 0.5708390399928749, 'border_count': 240, 'bagging_temperature': 0.030135792433899404, 'random_strength': 9.690911663307096, 'grow_policy': 'SymmetricTree', 'min_data_in_leaf': 112}. Best is trial 726 with value: 37144.045766835996.[0m
[32m[I 2024-10-13 01:37:59,965][0m Trial 742 finished with value: 39783.60929688813 and parameters: {'depth': 9, 'learning_rate': 0.2983234858524457, 'iterations': 205, 'l2_leaf_reg': 0.6672706893225478, 'border_count': 238, 'bagging_temperature': 0.02900318191687782, 'random_strength': 9.657611181613321, 'grow_policy': 'SymmetricTree', 'min_data_in_leaf': 137}. Best is trial 726 with value: 37144.045766835996.[0m
[32m[I 2024-10-13 01:38:01,023][0m Trial 743 finished with value: 47989.27598832361 and parameters: {'depth': 9, 'learning_rate': 0.299795506569923, 'iterations': 183, 'l2_leaf_reg': 0.7333199551544853, 'border_count': 242, 'bagging_temperature': 0.04498564057604518, 'random_strength': 9.995695065709244, 'grow_policy': 'SymmetricTree', 'min_data_in_leaf': 85}. Best is trial 726 with value: 37144.045766835996.[0m
[32m[I 2024-10-13 01:38:02,343][0m Trial 744 finished with value: 40188.893281812336 and parameters: {'depth': 9, 'learning_rate': 0.20791060415017731, 'iterations': 282, 'l2_leaf_reg': 0.5870828197721503, 'border_count': 148, 'bagging_temperature': 5.8251633951872384e-05, 'random_strength': 9.687780045570936, 'grow_policy': 'SymmetricTree', 'min_data_in_leaf': 116}. Best is trial 726 with value: 37144.045766835996.[0m
[32m[I 2024-10-13 01:38:03,704][0m Trial 745 finished with value: 39014.75597631091 and parameters: {'depth': 9, 'learning_rate': 0.23658805646367176, 'iterations': 283, 'l2_leaf_reg': 0.5795358613281905, 'border_count': 247, 'bagging_temperature': 0.020701076346679042, 'random_strength': 9.60938469649198, 'grow_policy': 'SymmetricTree', 'min_data_in_leaf': 133}. Best is trial 726 with value: 37144.045766835996.[0m
[32m[I 2024-10-13 01:38:04,802][0m Trial 746 finished with value: 52241.310157617765 and parameters: {'depth': 8, 'learning_rate': 0.20030877365683514, 'iterations': 219, 'l2_leaf_reg': 1.0764317053912436, 'border_count': 247, 'bagging_temperature': 0.04826271092207379, 'random_strength': 9.807140779112249, 'grow_policy': 'SymmetricTree', 'min_data_in_leaf': 95}. Best is trial 726 with value: 37144.045766835996.[0m
[32m[I 2024-10-13 01:38:05,767][0m Trial 747 finished with value: 39348.54975310908 and parameters: {'depth': 9, 'learning_rate': 0.23015225801636321, 'iterations': 151, 'l2_leaf_reg': 0.916963463396821, 'border_count': 246, 'bagging_temperature': 0.029297345164302407, 'random_strength': 9.999145574974046, 'grow_policy': 'SymmetricTree', 'min_data_in_leaf': 73}. Best is trial 726 with value: 37144.045766835996.[0m
[32m[I 2024-10-13 01:38:06,735][0m Trial 748 finished with value: 48217.98346189762 and parameters: {'depth': 9, 'learning_rate': 0.17126751417029543, 'iterations': 150, 'l2_leaf_reg': 0.6215497150661965, 'border_count': 248, 'bagging_temperature': 0.17040616025525904, 'random_strength': 9.991928724245016, 'grow_policy': 'SymmetricTree', 'min_data_in_leaf': 62}. Best is trial 726 with value: 37144.045766835996.[0m
[32m[I 2024-10-13 01:38:07,865][0m Trial 749 finished with value: 44957.50698035782 and parameters: {'depth': 9, 'learning_rate': 0.19562400860960502, 'iterations': 198, 'l2_leaf_reg': 2.462808673598132, 'border_count': 246, 'bagging_temperature': 0.02910385153757241, 'random_strength': 9.810844316558944, 'grow_policy': 'SymmetricTree', 'min_data_in_leaf': 77}. Best is trial 726 with value: 37144.045766835996.[0m
[32m[I 2024-10-13 01:38:08,821][0m Trial 750 finished with value: 58572.2451170275 and parameters: {'depth': 9, 'learning_rate': 0.010686106290157874, 'iterations': 155, 'l2_leaf_reg': 1.257073804676471, 'border_count': 247, 'bagging_temperature': 0.0591315988730102, 'random_strength': 9.802268466793663, 'grow_policy': 'SymmetricTree', 'min_data_in_leaf': 52}. Best is trial 726 with value: 37144.045766835996.[0m
[32m[I 2024-10-13 01:38:09,795][0m Trial 751 finished with value: 45978.15396968137 and parameters: {'depth': 9, 'learning_rate': 0.22135360718945107, 'iterations': 153, 'l2_leaf_reg': 1.2394434734884747, 'border_count': 244, 'bagging_temperature': 0.023421281772139115, 'random_strength': 9.631123149913902, 'grow_policy': 'SymmetricTree', 'min_data_in_leaf': 82}. Best is trial 726 with value: 37144.045766835996.[0m
[32m[I 2024-10-13 01:38:10,833][0m Trial 752 finished with value: 46036.367379296265 and parameters: {'depth': 9, 'learning_rate': 0.23428184662577617, 'iterations': 159, 'l2_leaf_reg': 1.1148020556701985, 'border_count': 244, 'bagging_temperature': 0.04690116179186688, 'random_strength': 9.97178495972529, 'grow_policy': 'SymmetricTree', 'min_data_in_leaf': 68}. Best is trial 726 with value: 37144.045766835996.[0m
[32m[I 2024-10-13 01:38:11,567][0m Trial 753 finished with value: 53321.748177614296 and parameters: {'depth': 9, 'learning_rate': 0.14690885690406588, 'iterations': 258, 'l2_leaf_reg': 1.9753056810208414, 'border_count': 250, 'bagging_temperature': 0.017439668791154425, 'random_strength': 9.989432616176469, 'grow_policy': 'Depthwise', 'min_data_in_leaf': 106}. Best is trial 726 with value: 37144.045766835996.[0m
[32m[I 2024-10-13 01:38:12,474][0m Trial 754 finished with value: 49243.848187870186 and parameters: {'depth': 8, 'learning_rate': 0.18121613464940506, 'iterations': 174, 'l2_leaf_reg': 0.8088928713864757, 'border_count': 248, 'bagging_temperature': 0.03491825716437169, 'random_strength': 9.651277272715603, 'grow_policy': 'SymmetricTree', 'min_data_in_leaf': 91}. Best is trial 726 with value: 37144.045766835996.[0m
[32m[I 2024-10-13 01:38:13,692][0m Trial 755 finished with value: 115817.51285873684 and parameters: {'depth': 9, 'learning_rate': 0.0011117366364687587, 'iterations': 224, 'l2_leaf_reg': 0.8692830663850237, 'border_count': 240, 'bagging_temperature': 0.04996328126904634, 'random_strength': 9.596527930474238, 'grow_policy': 'SymmetricTree', 'min_data_in_leaf': 72}. Best is trial 726 with value: 37144.045766835996.[0m
[32m[I 2024-10-13 01:38:15,074][0m Trial 756 finished with value: 46777.43336894234 and parameters: {'depth': 9, 'learning_rate': 0.21712135834085716, 'iterations': 280, 'l2_leaf_reg': 0.5509362037762001, 'border_count': 239, 'bagging_temperature': 0.7710429157824794, 'random_strength': 9.779240548331003, 'grow_policy': 'SymmetricTree', 'min_data_in_leaf': 105}. Best is trial 726 with value: 37144.045766835996.[0m
[32m[I 2024-10-13 01:38:16,351][0m Trial 757 finished with value: 38061.658842641045 and parameters: {'depth': 9, 'learning_rate': 0.2549099957933514, 'iterations': 266, 'l2_leaf_reg': 0.7856631581270385, 'border_count': 123, 'bagging_temperature': 0.02172041275691399, 'random_strength': 9.598328471437002, 'grow_policy': 'SymmetricTree', 'min_data_in_leaf': 623}. Best is trial 726 with value: 37144.045766835996.[0m
[32m[I 2024-10-13 01:38:17,171][0m Trial 758 finished with value: 50750.85637981083 and parameters: {'depth': 8, 'learning_rate': 0.19334025174222738, 'iterations': 139, 'l2_leaf_reg': 1.799122449629387, 'border_count': 115, 'bagging_temperature': 0.07298807623253244, 'random_strength': 9.837057672609703, 'grow_policy': 'SymmetricTree', 'min_data_in_leaf': 581}. Best is trial 726 with value: 37144.045766835996.[0m
[32m[I 2024-10-13 01:38:18,197][0m Trial 759 finished with value: 48082.903048035485 and parameters: {'depth': 9, 'learning_rate': 0.23420934407720198, 'iterations': 188, 'l2_leaf_reg': 0.887088010650525, 'border_count': 243, 'bagging_temperature': 0.054535172982318275, 'random_strength': 9.59559909906983, 'grow_policy': 'SymmetricTree', 'min_data_in_leaf': 671}. Best is trial 726 with value: 37144.045766835996.[0m
[32m[I 2024-10-13 01:38:19,307][0m Trial 760 finished with value: 41032.76485341275 and parameters: {'depth': 9, 'learning_rate': 0.16067464036145523, 'iterations': 217, 'l2_leaf_reg': 0.7037641370348521, 'border_count': 128, 'bagging_temperature': 0.034297976808269695, 'random_strength': 9.997387371332502, 'grow_policy': 'SymmetricTree', 'min_data_in_leaf': 611}. Best is trial 726 with value: 37144.045766835996.[0m
[32m[I 2024-10-13 01:38:20,563][0m Trial 761 finished with value: 39143.93742220087 and parameters: {'depth': 9, 'learning_rate': 0.25023991615502267, 'iterations': 262, 'l2_leaf_reg': 0.47290271610071216, 'border_count': 128, 'bagging_temperature': 0.030324509911078452, 'random_strength': 9.653363236207829, 'grow_policy': 'SymmetricTree', 'min_data_in_leaf': 741}. Best is trial 726 with value: 37144.045766835996.[0m
[32m[I 2024-10-13 01:38:21,279][0m Trial 762 finished with value: 52653.21957682748 and parameters: {'depth': 9, 'learning_rate': 0.2581481598172335, 'iterations': 266, 'l2_leaf_reg': 0.4978519111737424, 'border_count': 123, 'bagging_temperature': 0.058462546813852226, 'random_strength': 9.580889815184445, 'grow_policy': 'Lossguide', 'min_data_in_leaf': 560, 'max_leaves': 79}. Best is trial 726 with value: 37144.045766835996.[0m
[32m[I 2024-10-13 01:38:22,574][0m Trial 763 finished with value: 49754.192706166315 and parameters: {'depth': 9, 'learning_rate': 0.2577814244928311, 'iterations': 282, 'l2_leaf_reg': 0.4898137411389137, 'border_count': 125, 'bagging_temperature': 0.08355818675736704, 'random_strength': 9.556063414345026, 'grow_policy': 'SymmetricTree', 'min_data_in_leaf': 706}. Best is trial 726 with value: 37144.045766835996.[0m
[32m[I 2024-10-13 01:38:23,944][0m Trial 764 finished with value: 42479.69122965786 and parameters: {'depth': 9, 'learning_rate': 0.20034725003734957, 'iterations': 267, 'l2_leaf_reg': 0.42682804893827714, 'border_count': 139, 'bagging_temperature': 0.01878842176809569, 'random_strength': 9.68336482729465, 'grow_policy': 'SymmetricTree', 'min_data_in_leaf': 732}. Best is trial 726 with value: 37144.045766835996.[0m
[32m[I 2024-10-13 01:38:45,271][0m Trial 765 finished with value: 53840.94293035235 and parameters: {'depth': 9, 'learning_rate': 0.25286914368226804, 'iterations': 2327, 'l2_leaf_reg': 0.6829469947282655, 'border_count': 110, 'bagging_temperature': 0.19964594173359818, 'random_strength': 9.500412043476683, 'grow_policy': 'SymmetricTree', 'min_data_in_leaf': 860}. Best is trial 726 with value: 37144.045766835996.[0m
[32m[I 2024-10-13 01:38:46,566][0m Trial 766 finished with value: 48859.13771404786 and parameters: {'depth': 9, 'learning_rate': 0.21760900840549482, 'iterations': 293, 'l2_leaf_reg': 0.42157128512902337, 'border_count': 122, 'bagging_temperature': 0.046716598100173944, 'random_strength': 9.758609606642493, 'grow_policy': 'SymmetricTree', 'min_data_in_leaf': 831}. Best is trial 726 with value: 37144.045766835996.[0m
[32m[I 2024-10-13 01:38:47,355][0m Trial 767 finished with value: 50783.85796452416 and parameters: {'depth': 4, 'learning_rate': 0.2991766195556246, 'iterations': 255, 'l2_leaf_reg': 1.5928050067771224, 'border_count': 124, 'bagging_temperature': 0.030888286027159918, 'random_strength': 9.524049225873682, 'grow_policy': 'SymmetricTree', 'min_data_in_leaf': 128}. Best is trial 726 with value: 37144.045766835996.[0m
[32m[I 2024-10-13 01:38:48,577][0m Trial 768 finished with value: 45847.02684818285 and parameters: {'depth': 8, 'learning_rate': 0.2558329951811205, 'iterations': 298, 'l2_leaf_reg': 0.5521864870526559, 'border_count': 136, 'bagging_temperature': 0.018585719380879724, 'random_strength': 9.697086360766798, 'grow_policy': 'SymmetricTree', 'min_data_in_leaf': 583}. Best is trial 726 with value: 37144.045766835996.[0m
[32m[I 2024-10-13 01:38:49,586][0m Trial 769 finished with value: 52521.31447922825 and parameters: {'depth': 8, 'learning_rate': 0.1818755513409202, 'iterations': 232, 'l2_leaf_reg': 0.4274861346902262, 'border_count': 102, 'bagging_temperature': 0.06402055942509927, 'random_strength': 9.789993263603993, 'grow_policy': 'SymmetricTree', 'min_data_in_leaf': 746}. Best is trial 726 with value: 37144.045766835996.[0m
[32m[I 2024-10-13 01:38:50,896][0m Trial 770 finished with value: 47110.773103944426 and parameters: {'depth': 9, 'learning_rate': 0.22277503351257572, 'iterations': 301, 'l2_leaf_reg': 1.0812091774916661, 'border_count': 122, 'bagging_temperature': 0.045678987537480086, 'random_strength': 9.542736567223804, 'grow_policy': 'SymmetricTree', 'min_data_in_leaf': 538}. Best is trial 726 with value: 37144.045766835996.[0m
[32m[I 2024-10-13 01:38:52,248][0m Trial 771 finished with value: 121067.2086183267 and parameters: {'depth': 9, 'learning_rate': 0.0005649901458980452, 'iterations': 314, 'l2_leaf_reg': 0.37285564473829114, 'border_count': 133, 'bagging_temperature': 0.02169041813107122, 'random_strength': 9.512370998075607, 'grow_policy': 'SymmetricTree', 'min_data_in_leaf': 623}. Best is trial 726 with value: 37144.045766835996.[0m
