[32m[I 2024-10-13 00:57:47,657][0m Trial 104 finished with value: 50783.02434990926 and parameters: {'depth': 7, 'learning_rate': 0.036326101407027446, 'iterations': 1243, 'l2_leaf_reg': 0.005802091443757844, 'border_count': 193, 'bagging_temperature': 0.9744994879006086, 'random_strength': 1.949834704626744, 'grow_policy': 'SymmetricTree', 'min_data_in_leaf': 441}. Best is trial 26 with value: 46418.5230534429.[0m
[32m[I 2024-10-13 00:57:48,538][0m Trial 105 finished with value: 47761.90068114914 and parameters: {'depth': 7, 'learning_rate': 0.0542909095324247, 'iterations': 141, 'l2_leaf_reg': 1.9952219736065096e-05, 'border_count': 113, 'bagging_temperature': 0.08569005632160676, 'random_strength': 3.515056805489472, 'grow_policy': 'SymmetricTree', 'min_data_in_leaf': 468}. Best is trial 26 with value: 46418.5230534429.[0m
[32m[I 2024-10-13 00:57:49,407][0m Trial 106 finished with value: 50064.63613675067 and parameters: {'depth': 6, 'learning_rate': 0.0905398997253289, 'iterations': 130, 'l2_leaf_reg': 2.9513414788238187e-05, 'border_count': 133, 'bagging_temperature': 0.26658338334093223, 'random_strength': 3.500612434484693, 'grow_policy': 'SymmetricTree', 'min_data_in_leaf': 523}. Best is trial 26 with value: 46418.5230534429.[0m
[32m[I 2024-10-13 00:57:50,373][0m Trial 107 finished with value: 52774.14640846728 and parameters: {'depth': 7, 'learning_rate': 0.080594561329738, 'iterations': 216, 'l2_leaf_reg': 0.0005255859078029889, 'border_count': 111, 'bagging_temperature': 0.1939155302704217, 'random_strength': 4.127937136807557, 'grow_policy': 'Depthwise', 'min_data_in_leaf': 430}. Best is trial 26 with value: 46418.5230534429.[0m
[32m[I 2024-10-13 00:57:55,978][0m Trial 108 finished with value: 50530.88272918248 and parameters: {'depth': 7, 'learning_rate': 0.05285750356326568, 'iterations': 501, 'l2_leaf_reg': 2.1230545975572812e-05, 'border_count': 118, 'bagging_temperature': 0.42184336454960153, 'random_strength': 3.2755222389382483, 'grow_policy': 'SymmetricTree', 'min_data_in_leaf': 467}. Best is trial 26 with value: 46418.5230534429.[0m
[32m[I 2024-10-13 00:57:56,933][0m Trial 109 finished with value: 52278.24003011469 and parameters: {'depth': 6, 'learning_rate': 0.06436877603991813, 'iterations': 162, 'l2_leaf_reg': 7.315086634428787e-05, 'border_count': 87, 'bagging_temperature': 0.5183155898151508, 'random_strength': 1.5436675271479414, 'grow_policy': 'SymmetricTree', 'min_data_in_leaf': 592}. Best is trial 26 with value: 46418.5230534429.[0m
[32m[I 2024-10-13 00:58:06,150][0m Trial 110 finished with value: 52640.94090908227 and parameters: {'depth': 5, 'learning_rate': 0.13305968399019721, 'iterations': 1354, 'l2_leaf_reg': 9.846133802499694e-06, 'border_count': 122, 'bagging_temperature': 0.05076029651077563, 'random_strength': 4.384500077465186, 'grow_policy': 'SymmetricTree', 'min_data_in_leaf': 382}. Best is trial 26 with value: 46418.5230534429.[0m
[32m[I 2024-10-13 00:58:07,269][0m Trial 111 finished with value: 48611.62606673098 and parameters: {'depth': 7, 'learning_rate': 0.04161331664185744, 'iterations': 225, 'l2_leaf_reg': 0.00033229732584659754, 'border_count': 102, 'bagging_temperature': 0.6968856403320972, 'random_strength': 2.942487949132633, 'grow_policy': 'SymmetricTree', 'min_data_in_leaf': 493}. Best is trial 26 with value: 46418.5230534429.[0m
[32m[I 2024-10-13 00:58:08,686][0m Trial 112 finished with value: 50044.96595672265 and parameters: {'depth': 7, 'learning_rate': 0.033493522146480756, 'iterations': 247, 'l2_leaf_reg': 0.00022983093814063382, 'border_count': 212, 'bagging_temperature': 0.6735999302925519, 'random_strength': 2.6541566512406733, 'grow_policy': 'SymmetricTree', 'min_data_in_leaf': 494}. Best is trial 26 with value: 46418.5230534429.[0m
[32m[I 2024-10-13 00:58:10,580][0m Trial 113 finished with value: 49489.37777052429 and parameters: {'depth': 7, 'learning_rate': 0.026477288864163145, 'iterations': 373, 'l2_leaf_reg': 4.792165741364409e-06, 'border_count': 106, 'bagging_temperature': 0.7017780247345498, 'random_strength': 2.9674099212267846, 'grow_policy': 'SymmetricTree', 'min_data_in_leaf': 525}. Best is trial 26 with value: 46418.5230534429.[0m
[32m[I 2024-10-13 00:58:11,938][0m Trial 114 finished with value: 51356.252117842916 and parameters: {'depth': 6, 'learning_rate': 0.042499494452756095, 'iterations': 288, 'l2_leaf_reg': 0.00016542997630988033, 'border_count': 113, 'bagging_temperature': 0.6401748727765147, 'random_strength': 2.4921321870006565, 'grow_policy': 'SymmetricTree', 'min_data_in_leaf': 551}. Best is trial 26 with value: 46418.5230534429.[0m
[32m[I 2024-10-13 00:58:12,762][0m Trial 115 finished with value: 49278.106496515335 and parameters: {'depth': 7, 'learning_rate': 0.10641973440255534, 'iterations': 100, 'l2_leaf_reg': 3.688379485604194e-07, 'border_count': 95, 'bagging_temperature': 0.6567193793912741, 'random_strength': 3.394483988720236, 'grow_policy': 'SymmetricTree', 'min_data_in_leaf': 616}. Best is trial 26 with value: 46418.5230534429.[0m
[32m[I 2024-10-13 00:58:14,238][0m Trial 116 finished with value: 50941.647961547635 and parameters: {'depth': 6, 'learning_rate': 0.05141406712375816, 'iterations': 421, 'l2_leaf_reg': 0.00031669036031317476, 'border_count': 128, 'bagging_temperature': 0.7330153103261928, 'random_strength': 5.106298887803345, 'grow_policy': 'SymmetricTree', 'min_data_in_leaf': 574}. Best is trial 26 with value: 46418.5230534429.[0m
[32m[I 2024-10-13 00:58:15,191][0m Trial 117 finished with value: 51349.86844775287 and parameters: {'depth': 5, 'learning_rate': 0.0735343496314061, 'iterations': 175, 'l2_leaf_reg': 4.634170694042732e-05, 'border_count': 70, 'bagging_temperature': 0.9337036850340811, 'random_strength': 3.9258796513323744, 'grow_policy': 'SymmetricTree', 'min_data_in_leaf': 273}. Best is trial 26 with value: 46418.5230534429.[0m
[32m[I 2024-10-13 00:58:18,360][0m Trial 118 finished with value: 52744.29164440926 and parameters: {'depth': 8, 'learning_rate': 0.060878060431813555, 'iterations': 2096, 'l2_leaf_reg': 6.439720820673376e-08, 'border_count': 101, 'bagging_temperature': 0.9655482844980586, 'random_strength': 3.0566045946896496, 'grow_policy': 'Lossguide', 'min_data_in_leaf': 461, 'max_leaves': 170}. Best is trial 26 with value: 46418.5230534429.[0m
[32m[I 2024-10-13 00:58:31,974][0m Trial 119 finished with value: 52400.62225301583 and parameters: {'depth': 7, 'learning_rate': 0.03441484734188073, 'iterations': 1593, 'l2_leaf_reg': 8.737499295344429e-05, 'border_count': 59, 'bagging_temperature': 0.056260544852819394, 'random_strength': 2.7886966561792885, 'grow_policy': 'SymmetricTree', 'min_data_in_leaf': 493}. Best is trial 26 with value: 46418.5230534429.[0m
[32m[I 2024-10-13 00:58:48,375][0m Trial 120 finished with value: 53814.43857910617 and parameters: {'depth': 5, 'learning_rate': 0.08428078480290672, 'iterations': 2267, 'l2_leaf_reg': 1.3932975821840895e-05, 'border_count': 89, 'bagging_temperature': 0.8395202684344825, 'random_strength': 5.486760793271105, 'grow_policy': 'SymmetricTree', 'min_data_in_leaf': 140}. Best is trial 26 with value: 46418.5230534429.[0m
[32m[I 2024-10-13 00:58:58,337][0m Trial 121 finished with value: 49453.7992598164 and parameters: {'depth': 7, 'learning_rate': 0.028505728000345124, 'iterations': 705, 'l2_leaf_reg': 2.2664433259121587e-06, 'border_count': 97, 'bagging_temperature': 0.788407280463685, 'random_strength': 3.659764326950578, 'grow_policy': 'SymmetricTree', 'min_data_in_leaf': 779}. Best is trial 26 with value: 46418.5230534429.[0m
[32m[I 2024-10-13 00:58:59,480][0m Trial 122 finished with value: 47875.8728705285 and parameters: {'depth': 7, 'learning_rate': 0.016126205921617832, 'iterations': 247, 'l2_leaf_reg': 9.977729006931481e-06, 'border_count': 105, 'bagging_temperature': 0.7478434637460146, 'random_strength': 4.65094487270198, 'grow_policy': 'SymmetricTree', 'min_data_in_leaf': 525}. Best is trial 26 with value: 46418.5230534429.[0m
[32m[I 2024-10-13 00:59:01,316][0m Trial 123 finished with value: 52568.56379591438 and parameters: {'depth': 7, 'learning_rate': 0.010649196097284926, 'iterations': 468, 'l2_leaf_reg': 9.913341242940122, 'border_count': 104, 'bagging_temperature': 0.7052119871475446, 'random_strength': 4.781940386468927, 'grow_policy': 'SymmetricTree', 'min_data_in_leaf': 526}. Best is trial 26 with value: 46418.5230534429.[0m
[32m[I 2024-10-13 00:59:02,451][0m Trial 124 finished with value: 49259.38097324318 and parameters: {'depth': 6, 'learning_rate': 0.01664131257282718, 'iterations': 236, 'l2_leaf_reg': 1.9178036205057668e-05, 'border_count': 139, 'bagging_temperature': 0.7514481445288608, 'random_strength': 4.069521007559725, 'grow_policy': 'SymmetricTree', 'min_data_in_leaf': 544}. Best is trial 26 with value: 46418.5230534429.[0m
[32m[I 2024-10-13 00:59:04,444][0m Trial 125 finished with value: 48958.17364597224 and parameters: {'depth': 8, 'learning_rate': 0.03977887749441401, 'iterations': 341, 'l2_leaf_reg': 3.6468448298521125e-05, 'border_count': 80, 'bagging_temperature': 0.4817493625359548, 'random_strength': 4.6555913127334545, 'grow_policy': 'SymmetricTree', 'min_data_in_leaf': 499}. Best is trial 26 with value: 46418.5230534429.[0m
[32m[I 2024-10-13 00:59:06,409][0m Trial 126 finished with value: 49860.65539149168 and parameters: {'depth': 8, 'learning_rate': 0.04546765813755776, 'iterations': 351, 'l2_leaf_reg': 1.2021352097616727e-05, 'border_count': 81, 'bagging_temperature': 0.3544976720915646, 'random_strength': 4.598678258029334, 'grow_policy': 'SymmetricTree', 'min_data_in_leaf': 429}. Best is trial 26 with value: 46418.5230534429.[0m
[32m[I 2024-10-13 00:59:08,248][0m Trial 127 finished with value: 51028.3539480456 and parameters: {'depth': 8, 'learning_rate': 0.055896486727156476, 'iterations': 335, 'l2_leaf_reg': 3.1822398597257354e-05, 'border_count': 112, 'bagging_temperature': 0.08987247095751583, 'random_strength': 2.267179368132858, 'grow_policy': 'SymmetricTree', 'min_data_in_leaf': 497}. Best is trial 26 with value: 46418.5230534429.[0m
[32m[I 2024-10-13 00:59:09,742][0m Trial 128 finished with value: 48187.156117686114 and parameters: {'depth': 7, 'learning_rate': 0.039866338174942485, 'iterations': 263, 'l2_leaf_reg': 1.082725664244444e-06, 'border_count': 239, 'bagging_temperature': 0.001251891647507733, 'random_strength': 4.3019437091464665, 'grow_policy': 'SymmetricTree', 'min_data_in_leaf': 468}. Best is trial 26 with value: 46418.5230534429.[0m
[32m[I 2024-10-13 00:59:10,895][0m Trial 129 finished with value: 48460.101220091216 and parameters: {'depth': 7, 'learning_rate': 0.1022443733874563, 'iterations': 234, 'l2_leaf_reg': 2.021692723065495e-07, 'border_count': 118, 'bagging_temperature': 0.10627648080640734, 'random_strength': 3.7828546944194548, 'grow_policy': 'SymmetricTree', 'min_data_in_leaf': 470}. Best is trial 26 with value: 46418.5230534429.[0m
[32m[I 2024-10-13 00:59:11,856][0m Trial 130 finished with value: 52923.24988704867 and parameters: {'depth': 7, 'learning_rate': 0.10487707909259184, 'iterations': 258, 'l2_leaf_reg': 5.690425702621395e-07, 'border_count': 254, 'bagging_temperature': 0.1047607129275846, 'random_strength': 3.7367275835985687, 'grow_policy': 'Depthwise', 'min_data_in_leaf': 400}. Best is trial 26 with value: 46418.5230534429.[0m
[32m[I 2024-10-13 00:59:12,843][0m Trial 131 finished with value: 50719.156145336674 and parameters: {'depth': 7, 'learning_rate': 0.0727976114951728, 'iterations': 158, 'l2_leaf_reg': 1.274254548232062e-06, 'border_count': 220, 'bagging_temperature': 0.0935023641948356, 'random_strength': 3.361847095625229, 'grow_policy': 'SymmetricTree', 'min_data_in_leaf': 456}. Best is trial 26 with value: 46418.5230534429.[0m
[32m[I 2024-10-13 00:59:13,947][0m Trial 132 finished with value: 48349.48249326831 and parameters: {'depth': 7, 'learning_rate': 0.05043127864793934, 'iterations': 190, 'l2_leaf_reg': 1.0226005468919361e-07, 'border_count': 120, 'bagging_temperature': 0.21614261056840314, 'random_strength': 4.355177510104981, 'grow_policy': 'SymmetricTree', 'min_data_in_leaf': 483}. Best is trial 26 with value: 46418.5230534429.[0m
[32m[I 2024-10-13 00:59:15,057][0m Trial 133 finished with value: 48349.22879834275 and parameters: {'depth': 7, 'learning_rate': 0.05024820724554789, 'iterations': 206, 'l2_leaf_reg': 1.9840054272445898e-07, 'border_count': 238, 'bagging_temperature': 0.17504957417600836, 'random_strength': 3.8679864847572363, 'grow_policy': 'SymmetricTree', 'min_data_in_leaf': 482}. Best is trial 26 with value: 46418.5230534429.[0m
[32m[I 2024-10-13 00:59:15,916][0m Trial 134 finished with value: 47755.350097044 and parameters: {'depth': 7, 'learning_rate': 0.06804376754010497, 'iterations': 102, 'l2_leaf_reg': 1.8809210337859045e-07, 'border_count': 236, 'bagging_temperature': 0.13314807642843138, 'random_strength': 4.373809925916222, 'grow_policy': 'SymmetricTree', 'min_data_in_leaf': 475}. Best is trial 26 with value: 46418.5230534429.[0m
[32m[I 2024-10-13 00:59:16,820][0m Trial 135 finished with value: 48388.184057626204 and parameters: {'depth': 7, 'learning_rate': 0.156762877710148, 'iterations': 109, 'l2_leaf_reg': 2.2380992821061145e-07, 'border_count': 235, 'bagging_temperature': 0.015384368550313374, 'random_strength': 4.326716038816288, 'grow_policy': 'SymmetricTree', 'min_data_in_leaf': 473}. Best is trial 26 with value: 46418.5230534429.[0m
[32m[I 2024-10-13 00:59:17,777][0m Trial 136 finished with value: 53267.39024597248 and parameters: {'depth': 8, 'learning_rate': 0.16103234568530372, 'iterations': 128, 'l2_leaf_reg': 2.7872459457259765e-07, 'border_count': 233, 'bagging_temperature': 0.14039279896901735, 'random_strength': 4.21407708764387, 'grow_policy': 'SymmetricTree', 'min_data_in_leaf': 437}. Best is trial 26 with value: 46418.5230534429.[0m
[32m[I 2024-10-13 00:59:19,446][0m Trial 137 finished with value: 48023.241307049255 and parameters: {'depth': 7, 'learning_rate': 0.09093696042195096, 'iterations': 291, 'l2_leaf_reg': 1.766315145884745e-07, 'border_count': 232, 'bagging_temperature': 0.19774021659120178, 'random_strength': 4.3701236860864885, 'grow_policy': 'SymmetricTree', 'min_data_in_leaf': 382}. Best is trial 26 with value: 46418.5230534429.[0m
[32m[I 2024-10-13 00:59:21,251][0m Trial 138 finished with value: 48747.20292533417 and parameters: {'depth': 7, 'learning_rate': 0.1329761625506122, 'iterations': 288, 'l2_leaf_reg': 1.6958759262272414e-07, 'border_count': 229, 'bagging_temperature': 0.01771778745648795, 'random_strength': 4.369053507403776, 'grow_policy': 'SymmetricTree', 'min_data_in_leaf': 306}. Best is trial 26 with value: 46418.5230534429.[0m
[32m[I 2024-10-13 00:59:22,720][0m Trial 139 finished with value: 49179.28253155666 and parameters: {'depth': 7, 'learning_rate': 0.22052640789321626, 'iterations': 184, 'l2_leaf_reg': 1.1053230478009838e-07, 'border_count': 241, 'bagging_temperature': 0.20475632182785228, 'random_strength': 4.030622534068834, 'grow_policy': 'SymmetricTree', 'min_data_in_leaf': 378}. Best is trial 26 with value: 46418.5230534429.[0m
[32m[I 2024-10-13 00:59:24,693][0m Trial 140 finished with value: 47770.228668597694 and parameters: {'depth': 7, 'learning_rate': 0.09493577432717133, 'iterations': 403, 'l2_leaf_reg': 4.6962753721728676e-08, 'border_count': 237, 'bagging_temperature': 0.13311756061587351, 'random_strength': 5.0580578319861615, 'grow_policy': 'SymmetricTree', 'min_data_in_leaf': 457}. Best is trial 26 with value: 46418.5230534429.[0m
[32m[I 2024-10-13 00:59:26,434][0m Trial 141 finished with value: 48115.80370073004 and parameters: {'depth': 7, 'learning_rate': 0.09412697959374965, 'iterations': 428, 'l2_leaf_reg': 5.2273022485166544e-08, 'border_count': 247, 'bagging_temperature': 0.1442943655388441, 'random_strength': 5.077029239056615, 'grow_policy': 'SymmetricTree', 'min_data_in_leaf': 476}. Best is trial 26 with value: 46418.5230534429.[0m
[32m[I 2024-10-13 00:59:28,272][0m Trial 142 finished with value: 52073.14019769568 and parameters: {'depth': 8, 'learning_rate': 0.08362870288875052, 'iterations': 415, 'l2_leaf_reg': 1.0796085598539775e-07, 'border_count': 249, 'bagging_temperature': 0.1561221522452198, 'random_strength': 5.057739644639698, 'grow_policy': 'SymmetricTree', 'min_data_in_leaf': 413}. Best is trial 26 with value: 46418.5230534429.[0m
[32m[I 2024-10-13 00:59:33,860][0m Trial 143 finished with value: 51924.1824517696 and parameters: {'depth': 8, 'learning_rate': 0.12062621843806476, 'iterations': 528, 'l2_leaf_reg': 4.163237828154098e-08, 'border_count': 240, 'bagging_temperature': 0.006602085193292889, 'random_strength': 5.275284662843022, 'grow_policy': 'SymmetricTree', 'min_data_in_leaf': 353}. Best is trial 26 with value: 46418.5230534429.[0m
[32m[I 2024-10-13 00:59:34,809][0m Trial 144 finished with value: 48653.83581253783 and parameters: {'depth': 7, 'learning_rate': 0.06475386743847933, 'iterations': 105, 'l2_leaf_reg': 6.193489204307926e-08, 'border_count': 249, 'bagging_temperature': 0.2163783196429439, 'random_strength': 4.4918767383879565, 'grow_policy': 'SymmetricTree', 'min_data_in_leaf': 452}. Best is trial 26 with value: 46418.5230534429.[0m
[32m[I 2024-10-13 00:59:35,906][0m Trial 145 finished with value: 50819.63846167429 and parameters: {'depth': 7, 'learning_rate': 0.16574417794589674, 'iterations': 180, 'l2_leaf_reg': 8.793430962736606e-08, 'border_count': 233, 'bagging_temperature': 0.13147251263980791, 'random_strength': 4.943653244410333, 'grow_policy': 'SymmetricTree', 'min_data_in_leaf': 476}. Best is trial 26 with value: 46418.5230534429.[0m
[32m[I 2024-10-13 00:59:37,288][0m Trial 146 finished with value: 48374.92404530581 and parameters: {'depth': 7, 'learning_rate': 0.09275337280090087, 'iterations': 301, 'l2_leaf_reg': 2.1179798108342853e-08, 'border_count': 245, 'bagging_temperature': 0.24015096921781098, 'random_strength': 4.304408438241963, 'grow_policy': 'SymmetricTree', 'min_data_in_leaf': 519}. Best is trial 26 with value: 46418.5230534429.[0m
[32m[I 2024-10-13 00:59:39,243][0m Trial 147 finished with value: 52602.40013795114 and parameters: {'depth': 8, 'learning_rate': 0.09707076013604114, 'iterations': 389, 'l2_leaf_reg': 2.210265283357415e-08, 'border_count': 245, 'bagging_temperature': 0.24572803292410764, 'random_strength': 4.612920694367648, 'grow_policy': 'SymmetricTree', 'min_data_in_leaf': 521}. Best is trial 26 with value: 46418.5230534429.[0m
[32m[I 2024-10-13 00:59:39,976][0m Trial 148 finished with value: 52808.39256336402 and parameters: {'depth': 7, 'learning_rate': 0.08953613077259925, 'iterations': 296, 'l2_leaf_reg': 3.027302525306404e-08, 'border_count': 227, 'bagging_temperature': 0.18895748236777973, 'random_strength': 5.902041698285986, 'grow_policy': 'Lossguide', 'min_data_in_leaf': 998, 'max_leaves': 91}. Best is trial 26 with value: 46418.5230534429.[0m
[32m[I 2024-10-13 00:59:45,600][0m Trial 149 finished with value: 53883.90826234377 and parameters: {'depth': 7, 'learning_rate': 0.07130649700193925, 'iterations': 576, 'l2_leaf_reg': 4.579496127150992e-08, 'border_count': 246, 'bagging_temperature': 0.17211320058376778, 'random_strength': 4.86776357133883, 'grow_policy': 'SymmetricTree', 'min_data_in_leaf': 427}. Best is trial 26 with value: 46418.5230534429.[0m
[32m[I 2024-10-13 00:59:47,378][0m Trial 150 finished with value: 48042.211295743495 and parameters: {'depth': 7, 'learning_rate': 0.06765221305642374, 'iterations': 450, 'l2_leaf_reg': 1.7657873981844826e-08, 'border_count': 213, 'bagging_temperature': 0.12759659683145272, 'random_strength': 3.909650792865794, 'grow_policy': 'SymmetricTree', 'min_data_in_leaf': 214}. Best is trial 26 with value: 46418.5230534429.[0m
[32m[I 2024-10-13 00:59:49,086][0m Trial 151 finished with value: 48483.970067195914 and parameters: {'depth': 7, 'learning_rate': 0.059104109478630124, 'iterations': 443, 'l2_leaf_reg': 1.5672982379907725e-08, 'border_count': 207, 'bagging_temperature': 0.2293665116444843, 'random_strength': 4.137307920708722, 'grow_policy': 'SymmetricTree', 'min_data_in_leaf': 18}. Best is trial 26 with value: 46418.5230534429.[0m
[32m[I 2024-10-13 00:59:50,442][0m Trial 152 finished with value: 49030.40014685739 and parameters: {'depth': 7, 'learning_rate': 0.07855654663017525, 'iterations': 280, 'l2_leaf_reg': 1.556452897424222e-08, 'border_count': 237, 'bagging_temperature': 0.1307139949357243, 'random_strength': 3.8988010244143037, 'grow_policy': 'SymmetricTree', 'min_data_in_leaf': 222}. Best is trial 26 with value: 46418.5230534429.[0m
[32m[I 2024-10-13 00:59:51,727][0m Trial 153 finished with value: 47506.20499617383 and parameters: {'depth': 7, 'learning_rate': 0.06717380795115367, 'iterations': 323, 'l2_leaf_reg': 5.57708419845583e-07, 'border_count': 221, 'bagging_temperature': 0.06696736893863456, 'random_strength': 4.4076343385793955, 'grow_policy': 'SymmetricTree', 'min_data_in_leaf': 224}. Best is trial 26 with value: 46418.5230534429.[0m
[32m[I 2024-10-13 00:59:53,779][0m Trial 154 finished with value: 51930.11172729007 and parameters: {'depth': 8, 'learning_rate': 0.04962075536319675, 'iterations': 478, 'l2_leaf_reg': 5.916362263475242e-07, 'border_count': 220, 'bagging_temperature': 0.05841608111254639, 'random_strength': 5.162853928966513, 'grow_policy': 'SymmetricTree', 'min_data_in_leaf': 188}. Best is trial 26 with value: 46418.5230534429.[0m
[32m[I 2024-10-13 00:59:55,204][0m Trial 155 finished with value: 50191.1266973149 and parameters: {'depth': 6, 'learning_rate': 0.0647811323378269, 'iterations': 400, 'l2_leaf_reg': 3.8198478471204414e-07, 'border_count': 224, 'bagging_temperature': 0.08041336468050465, 'random_strength': 3.5637623635310893, 'grow_policy': 'SymmetricTree', 'min_data_in_leaf': 185}. Best is trial 26 with value: 46418.5230534429.[0m
