[32m[I 2024-10-13 00:59:56,191][0m Trial 156 finished with value: 47962.863488820956 and parameters: {'depth': 7, 'learning_rate': 0.0706156996847317, 'iterations': 211, 'l2_leaf_reg': 1.0829404106827356e-07, 'border_count': 217, 'bagging_temperature': 0.12323923230669127, 'random_strength': 4.469783210123066, 'grow_policy': 'SymmetricTree', 'min_data_in_leaf': 247}. Best is trial 26 with value: 46418.5230534429.[0m
[32m[I 2024-10-13 00:59:59,693][0m Trial 157 finished with value: 49428.83028739829 and parameters: {'depth': 11, 'learning_rate': 0.11466563118146679, 'iterations': 356, 'l2_leaf_reg': 6.46190739439408e-08, 'border_count': 205, 'bagging_temperature': 0.04299852337074092, 'random_strength': 5.4155112277522885, 'grow_policy': 'SymmetricTree', 'min_data_in_leaf': 241}. Best is trial 26 with value: 46418.5230534429.[0m
[32m[I 2024-10-13 01:00:20,696][0m Trial 158 finished with value: 52671.91206404576 and parameters: {'depth': 6, 'learning_rate': 0.07135401932561662, 'iterations': 2626, 'l2_leaf_reg': 1.5418821901118203e-07, 'border_count': 214, 'bagging_temperature': 0.071598443713909, 'random_strength': 4.539143387074977, 'grow_policy': 'SymmetricTree', 'min_data_in_leaf': 285}. Best is trial 26 with value: 46418.5230534429.[0m
[32m[I 2024-10-13 01:00:21,782][0m Trial 159 finished with value: 52876.07858208005 and parameters: {'depth': 7, 'learning_rate': 0.08350768375308754, 'iterations': 504, 'l2_leaf_reg': 8.397384910200818e-07, 'border_count': 217, 'bagging_temperature': 0.1592546734774667, 'random_strength': 3.964012836751709, 'grow_policy': 'Depthwise', 'min_data_in_leaf': 223}. Best is trial 26 with value: 46418.5230534429.[0m
[32m[I 2024-10-13 01:00:23,358][0m Trial 160 finished with value: 51370.37217038149 and parameters: {'depth': 8, 'learning_rate': 0.0573793263025676, 'iterations': 241, 'l2_leaf_reg': 1.9265902550425758e-07, 'border_count': 230, 'bagging_temperature': 0.12470238152704521, 'random_strength': 4.823521380642381, 'grow_policy': 'SymmetricTree', 'min_data_in_leaf': 245}. Best is trial 26 with value: 46418.5230534429.[0m
[32m[I 2024-10-13 01:00:24,589][0m Trial 161 finished with value: 59498.845108177804 and parameters: {'depth': 7, 'learning_rate': 0.05134492715770108, 'iterations': 190, 'l2_leaf_reg': 1.0164376050581157e-07, 'border_count': 3, 'bagging_temperature': 0.11478915997489159, 'random_strength': 4.126821621891226, 'grow_policy': 'SymmetricTree', 'min_data_in_leaf': 195}. Best is trial 26 with value: 46418.5230534429.[0m
[32m[I 2024-10-13 01:00:25,701][0m Trial 162 finished with value: 48893.455448126806 and parameters: {'depth': 7, 'learning_rate': 0.0667460870055392, 'iterations': 172, 'l2_leaf_reg': 1.2216096917461992e-07, 'border_count': 224, 'bagging_temperature': 0.1486643244094424, 'random_strength': 4.394616775586024, 'grow_policy': 'SymmetricTree', 'min_data_in_leaf': 510}. Best is trial 26 with value: 46418.5230534429.[0m
[32m[I 2024-10-13 01:00:27,200][0m Trial 163 finished with value: 48640.41843180476 and parameters: {'depth': 7, 'learning_rate': 0.07570444264790153, 'iterations': 333, 'l2_leaf_reg': 3.012003377819428e-07, 'border_count': 238, 'bagging_temperature': 0.18502324342367896, 'random_strength': 3.8397292398448903, 'grow_policy': 'SymmetricTree', 'min_data_in_leaf': 448}. Best is trial 26 with value: 46418.5230534429.[0m
[32m[I 2024-10-13 01:00:28,655][0m Trial 164 finished with value: 47795.4612924149 and parameters: {'depth': 7, 'learning_rate': 0.05050844581330123, 'iterations': 243, 'l2_leaf_reg': 3.812831870830255e-08, 'border_count': 241, 'bagging_temperature': 0.06798075848160699, 'random_strength': 4.727803130226827, 'grow_policy': 'SymmetricTree', 'min_data_in_leaf': 155}. Best is trial 26 with value: 46418.5230534429.[0m
[32m[I 2024-10-13 01:00:30,252][0m Trial 165 finished with value: 47821.97505079161 and parameters: {'depth': 6, 'learning_rate': 0.035879653346412806, 'iterations': 428, 'l2_leaf_reg': 3.889578427723187e-08, 'border_count': 243, 'bagging_temperature': 0.07265828332253625, 'random_strength': 4.988908834882043, 'grow_policy': 'SymmetricTree', 'min_data_in_leaf': 72}. Best is trial 26 with value: 46418.5230534429.[0m
[32m[I 2024-10-13 01:00:32,121][0m Trial 166 finished with value: 51336.37601160484 and parameters: {'depth': 6, 'learning_rate': 0.10643036599911715, 'iterations': 453, 'l2_leaf_reg': 3.5749626159346795e-08, 'border_count': 252, 'bagging_temperature': 0.03741092072074441, 'random_strength': 5.073968683723526, 'grow_policy': 'SymmetricTree', 'min_data_in_leaf': 39}. Best is trial 26 with value: 46418.5230534429.[0m
[32m[I 2024-10-13 01:00:37,389][0m Trial 167 finished with value: 50908.98897813376 and parameters: {'depth': 6, 'learning_rate': 0.03616710100344673, 'iterations': 608, 'l2_leaf_reg': 5.259657609212863e-08, 'border_count': 242, 'bagging_temperature': 0.07365431192433028, 'random_strength': 5.572224386850939, 'grow_policy': 'SymmetricTree', 'min_data_in_leaf': 82}. Best is trial 26 with value: 46418.5230534429.[0m
[32m[I 2024-10-13 01:00:39,083][0m Trial 168 finished with value: 49133.42748733867 and parameters: {'depth': 6, 'learning_rate': 0.06003235306890437, 'iterations': 381, 'l2_leaf_reg': 2.702978951914839e-08, 'border_count': 232, 'bagging_temperature': 0.09963396298017077, 'random_strength': 6.2111730322366405, 'grow_policy': 'SymmetricTree', 'min_data_in_leaf': 93}. Best is trial 26 with value: 46418.5230534429.[0m
[32m[I 2024-10-13 01:00:40,351][0m Trial 169 finished with value: 49537.073664870164 and parameters: {'depth': 6, 'learning_rate': 0.09512432026282824, 'iterations': 287, 'l2_leaf_reg': 1.0678155532667016e-08, 'border_count': 226, 'bagging_temperature': 0.06385341456528759, 'random_strength': 4.65159472175081, 'grow_policy': 'SymmetricTree', 'min_data_in_leaf': 128}. Best is trial 26 with value: 46418.5230534429.[0m
[32m[I 2024-10-13 01:00:46,331][0m Trial 170 finished with value: 53081.82879577017 and parameters: {'depth': 7, 'learning_rate': 0.13189029698659255, 'iterations': 523, 'l2_leaf_reg': 7.503467578241486e-08, 'border_count': 249, 'bagging_temperature': 0.11549219910430322, 'random_strength': 5.225038733025868, 'grow_policy': 'SymmetricTree', 'min_data_in_leaf': 135}. Best is trial 26 with value: 46418.5230534429.[0m
[32m[I 2024-10-13 01:00:47,478][0m Trial 171 finished with value: 47440.83908221026 and parameters: {'depth': 7, 'learning_rate': 0.03122292954516668, 'iterations': 235, 'l2_leaf_reg': 2.852350771052664e-07, 'border_count': 237, 'bagging_temperature': 0.030730457812922773, 'random_strength': 4.797514339437093, 'grow_policy': 'SymmetricTree', 'min_data_in_leaf': 165}. Best is trial 26 with value: 46418.5230534429.[0m
[32m[I 2024-10-13 01:00:48,974][0m Trial 172 finished with value: 119436.30257484903 and parameters: {'depth': 7, 'learning_rate': 0.0007076499542540474, 'iterations': 259, 'l2_leaf_reg': 3.085511383728114e-07, 'border_count': 242, 'bagging_temperature': 0.030311758105477704, 'random_strength': 4.926554853103753, 'grow_policy': 'SymmetricTree', 'min_data_in_leaf': 108}. Best is trial 26 with value: 46418.5230534429.[0m
[32m[I 2024-10-13 01:00:50,931][0m Trial 173 finished with value: 48278.35837253277 and parameters: {'depth': 7, 'learning_rate': 0.03194528553607174, 'iterations': 416, 'l2_leaf_reg': 5.023749035599581e-07, 'border_count': 232, 'bagging_temperature': 0.07438343930573003, 'random_strength': 4.713146717880014, 'grow_policy': 'SymmetricTree', 'min_data_in_leaf': 159}. Best is trial 26 with value: 46418.5230534429.[0m
[32m[I 2024-10-13 01:00:52,926][0m Trial 174 finished with value: 48476.42490885987 and parameters: {'depth': 7, 'learning_rate': 0.032251946398130664, 'iterations': 418, 'l2_leaf_reg': 1.3342243229241123e-06, 'border_count': 255, 'bagging_temperature': 0.08577949730097065, 'random_strength': 4.734678999362294, 'grow_policy': 'SymmetricTree', 'min_data_in_leaf': 154}. Best is trial 26 with value: 46418.5230534429.[0m
[32m[I 2024-10-13 01:00:54,484][0m Trial 175 finished with value: 48258.19712588138 and parameters: {'depth': 6, 'learning_rate': 0.02283383135593128, 'iterations': 352, 'l2_leaf_reg': 5.078722210284849e-07, 'border_count': 236, 'bagging_temperature': 0.0428524340158973, 'random_strength': 4.536295955793981, 'grow_policy': 'SymmetricTree', 'min_data_in_leaf': 201}. Best is trial 26 with value: 46418.5230534429.[0m
[32m[I 2024-10-13 01:00:55,892][0m Trial 176 finished with value: 48147.54168917906 and parameters: {'depth': 6, 'learning_rate': 0.02153260034016061, 'iterations': 342, 'l2_leaf_reg': 4.3460456470915464e-08, 'border_count': 237, 'bagging_temperature': 0.001963241639394693, 'random_strength': 4.4958102547593075, 'grow_policy': 'SymmetricTree', 'min_data_in_leaf': 176}. Best is trial 26 with value: 46418.5230534429.[0m
[32m[I 2024-10-13 01:00:57,684][0m Trial 177 finished with value: 47977.69390465901 and parameters: {'depth': 6, 'learning_rate': 0.03907715621339904, 'iterations': 480, 'l2_leaf_reg': 3.353244889256927e-08, 'border_count': 220, 'bagging_temperature': 0.0014847862913463378, 'random_strength': 4.161025980331839, 'grow_policy': 'SymmetricTree', 'min_data_in_leaf': 58}. Best is trial 26 with value: 46418.5230534429.[0m
[32m[I 2024-10-13 01:01:02,778][0m Trial 178 finished with value: 52267.617383456694 and parameters: {'depth': 6, 'learning_rate': 0.03771432397141091, 'iterations': 571, 'l2_leaf_reg': 4.557145853495015e-08, 'border_count': 220, 'bagging_temperature': 0.023162992318602756, 'random_strength': 4.127961942572759, 'grow_policy': 'SymmetricTree', 'min_data_in_leaf': 169}. Best is trial 26 with value: 46418.5230534429.[0m
[32m[I 2024-10-13 01:01:04,162][0m Trial 179 finished with value: 52775.68979284243 and parameters: {'depth': 6, 'learning_rate': 0.029691152696114963, 'iterations': 492, 'l2_leaf_reg': 3.7496970324796814e-08, 'border_count': 209, 'bagging_temperature': 0.1391587629126677, 'random_strength': 4.996923951331419, 'grow_policy': 'Lossguide', 'min_data_in_leaf': 212, 'max_leaves': 45}. Best is trial 26 with value: 46418.5230534429.[0m
[32m[I 2024-10-13 01:01:05,873][0m Trial 180 finished with value: 48181.572470443294 and parameters: {'depth': 6, 'learning_rate': 0.02660859229604814, 'iterations': 361, 'l2_leaf_reg': 2.4944941634370834e-08, 'border_count': 228, 'bagging_temperature': 0.04903114810557441, 'random_strength': 3.514134860896463, 'grow_policy': 'SymmetricTree', 'min_data_in_leaf': 74}. Best is trial 26 with value: 46418.5230534429.[0m
[32m[I 2024-10-13 01:01:07,506][0m Trial 181 finished with value: 48214.55358088675 and parameters: {'depth': 6, 'learning_rate': 0.02388795803213901, 'iterations': 462, 'l2_leaf_reg': 1.42892409539412e-08, 'border_count': 228, 'bagging_temperature': 0.09969472609619687, 'random_strength': 3.504943240740383, 'grow_policy': 'SymmetricTree', 'min_data_in_leaf': 68}. Best is trial 26 with value: 46418.5230534429.[0m
[32m[I 2024-10-13 01:01:08,914][0m Trial 182 finished with value: 48768.86164649394 and parameters: {'depth': 6, 'learning_rate': 0.019568668857102574, 'iterations': 336, 'l2_leaf_reg': 1.941564195912034e-08, 'border_count': 223, 'bagging_temperature': 0.002366242595939135, 'random_strength': 3.5911144316078465, 'grow_policy': 'SymmetricTree', 'min_data_in_leaf': 44}. Best is trial 26 with value: 46418.5230534429.[0m
[32m[I 2024-10-13 01:01:10,867][0m Trial 183 finished with value: 48274.4906732664 and parameters: {'depth': 6, 'learning_rate': 0.027753936879689352, 'iterations': 393, 'l2_leaf_reg': 2.8228344956880286e-08, 'border_count': 213, 'bagging_temperature': 0.03748589557935255, 'random_strength': 3.6943275512719396, 'grow_policy': 'SymmetricTree', 'min_data_in_leaf': 106}. Best is trial 26 with value: 46418.5230534429.[0m
[32m[I 2024-10-13 01:01:12,456][0m Trial 184 finished with value: 50201.74410934831 and parameters: {'depth': 5, 'learning_rate': 0.04478546841765285, 'iterations': 314, 'l2_leaf_reg': 8.049749784327143e-08, 'border_count': 201, 'bagging_temperature': 0.057895828233039015, 'random_strength': 4.49211644583365, 'grow_policy': 'SymmetricTree', 'min_data_in_leaf': 176}. Best is trial 26 with value: 46418.5230534429.[0m
[32m[I 2024-10-13 01:01:19,982][0m Trial 185 finished with value: 52570.12661261193 and parameters: {'depth': 6, 'learning_rate': 0.05906883028658959, 'iterations': 660, 'l2_leaf_reg': 5.3737338660256705e-08, 'border_count': 23, 'bagging_temperature': 0.08381919293855905, 'random_strength': 5.3355187455479145, 'grow_policy': 'SymmetricTree', 'min_data_in_leaf': 117}. Best is trial 26 with value: 46418.5230534429.[0m
[32m[I 2024-10-13 01:01:24,771][0m Trial 186 finished with value: 51189.3321420517 and parameters: {'depth': 5, 'learning_rate': 0.03539644917084872, 'iterations': 520, 'l2_leaf_reg': 1.0649960341102386e-08, 'border_count': 216, 'bagging_temperature': 0.1215446993294548, 'random_strength': 3.3767932151913493, 'grow_policy': 'SymmetricTree', 'min_data_in_leaf': 3}. Best is trial 26 with value: 46418.5230534429.[0m
[32m[I 2024-10-13 01:01:26,209][0m Trial 187 finished with value: 48973.8415804507 and parameters: {'depth': 6, 'learning_rate': 0.04327199398146683, 'iterations': 229, 'l2_leaf_reg': 3.4293642826150774e-08, 'border_count': 231, 'bagging_temperature': 0.028333536858802348, 'random_strength': 4.052281969794449, 'grow_policy': 'SymmetricTree', 'min_data_in_leaf': 146}. Best is trial 26 with value: 46418.5230534429.[0m
[32m[I 2024-10-13 01:01:28,638][0m Trial 188 finished with value: 47589.463546686085 and parameters: {'depth': 7, 'learning_rate': 0.06942287558133002, 'iterations': 462, 'l2_leaf_reg': 1.3899572154346402e-07, 'border_count': 244, 'bagging_temperature': 0.05058320468036206, 'random_strength': 4.830551192543624, 'grow_policy': 'SymmetricTree', 'min_data_in_leaf': 55}. Best is trial 26 with value: 46418.5230534429.[0m
[32m[I 2024-10-13 01:01:31,217][0m Trial 189 finished with value: 47341.182931659554 and parameters: {'depth': 7, 'learning_rate': 0.07090809875630598, 'iterations': 453, 'l2_leaf_reg': 1.2875667757633865e-07, 'border_count': 245, 'bagging_temperature': 0.10684024123005705, 'random_strength': 4.864903225142523, 'grow_policy': 'SymmetricTree', 'min_data_in_leaf': 41}. Best is trial 26 with value: 46418.5230534429.[0m
[32m[I 2024-10-13 01:01:39,385][0m Trial 190 finished with value: 53801.5260322122 and parameters: {'depth': 7, 'learning_rate': 0.07088634247088554, 'iterations': 569, 'l2_leaf_reg': 1.3561337112849273e-07, 'border_count': 247, 'bagging_temperature': 0.15346840141795248, 'random_strength': 4.870921962028186, 'grow_policy': 'SymmetricTree', 'min_data_in_leaf': 297}. Best is trial 26 with value: 46418.5230534429.[0m
[32m[I 2024-10-13 01:01:41,913][0m Trial 191 finished with value: 48417.67055311047 and parameters: {'depth': 7, 'learning_rate': 0.08583870580776581, 'iterations': 443, 'l2_leaf_reg': 7.610865975379712e-08, 'border_count': 243, 'bagging_temperature': 0.09722262630818863, 'random_strength': 5.048772073002346, 'grow_policy': 'SymmetricTree', 'min_data_in_leaf': 46}. Best is trial 26 with value: 46418.5230534429.[0m
[32m[I 2024-10-13 01:01:44,275][0m Trial 192 finished with value: 47541.39539782167 and parameters: {'depth': 7, 'learning_rate': 0.05539488077958574, 'iterations': 474, 'l2_leaf_reg': 0.031954651314894215, 'border_count': 237, 'bagging_temperature': 0.07277236539319168, 'random_strength': 4.745601910476789, 'grow_policy': 'SymmetricTree', 'min_data_in_leaf': 48}. Best is trial 26 with value: 46418.5230534429.[0m
[32m[I 2024-10-13 01:01:51,198][0m Trial 193 finished with value: 53540.487925032336 and parameters: {'depth': 7, 'learning_rate': 0.05367645010266548, 'iterations': 502, 'l2_leaf_reg': 0.01992804131197141, 'border_count': 250, 'bagging_temperature': 0.12005973067347771, 'random_strength': 4.85423926261593, 'grow_policy': 'SymmetricTree', 'min_data_in_leaf': 58}. Best is trial 26 with value: 46418.5230534429.[0m
[32m[I 2024-10-13 01:01:59,201][0m Trial 194 finished with value: 52859.79382216047 and parameters: {'depth': 7, 'learning_rate': 0.06557876474768731, 'iterations': 640, 'l2_leaf_reg': 0.048400628903886855, 'border_count': 243, 'bagging_temperature': 0.0740813456044136, 'random_strength': 5.196522901460156, 'grow_policy': 'SymmetricTree', 'min_data_in_leaf': 18}. Best is trial 26 with value: 46418.5230534429.[0m
[32m[I 2024-10-13 01:02:01,175][0m Trial 195 finished with value: 47275.72627480504 and parameters: {'depth': 7, 'learning_rate': 0.07590402775308525, 'iterations': 449, 'l2_leaf_reg': 0.1536395210330445, 'border_count': 255, 'bagging_temperature': 0.0626727752766074, 'random_strength': 4.677626039573936, 'grow_policy': 'SymmetricTree', 'min_data_in_leaf': 37}. Best is trial 26 with value: 46418.5230534429.[0m
[32m[I 2024-10-13 01:02:27,454][0m Trial 196 finished with value: 51759.44903878204 and parameters: {'depth': 8, 'learning_rate': 0.057590233701653754, 'iterations': 2257, 'l2_leaf_reg': 0.24414386606845076, 'border_count': 235, 'bagging_temperature': 0.0653007488833866, 'random_strength': 4.626254365031429, 'grow_policy': 'SymmetricTree', 'min_data_in_leaf': 260}. Best is trial 26 with value: 46418.5230534429.[0m
[32m[I 2024-10-13 01:02:30,496][0m Trial 197 finished with value: 53923.35584278955 and parameters: {'depth': 7, 'learning_rate': 0.0743436460255702, 'iterations': 596, 'l2_leaf_reg': 0.06382698901079628, 'border_count': 255, 'bagging_temperature': 0.09174872611480163, 'random_strength': 4.2402403072325185, 'grow_policy': 'Depthwise', 'min_data_in_leaf': 1}. Best is trial 26 with value: 46418.5230534429.[0m
[32m[I 2024-10-13 01:02:38,495][0m Trial 198 finished with value: 50809.1999296067 and parameters: {'depth': 8, 'learning_rate': 0.04840224691318352, 'iterations': 539, 'l2_leaf_reg': 0.41598962659687355, 'border_count': 240, 'bagging_temperature': 0.05044310203185846, 'random_strength': 4.709565253424115, 'grow_policy': 'SymmetricTree', 'min_data_in_leaf': 32}. Best is trial 26 with value: 46418.5230534429.[0m
[32m[I 2024-10-13 01:02:39,529][0m Trial 199 finished with value: 47919.80330425017 and parameters: {'depth': 7, 'learning_rate': 0.06393604051982289, 'iterations': 147, 'l2_leaf_reg': 0.10493950622926548, 'border_count': 251, 'bagging_temperature': 0.11258387374256013, 'random_strength': 4.337769868328571, 'grow_policy': 'SymmetricTree', 'min_data_in_leaf': 89}. Best is trial 26 with value: 46418.5230534429.[0m
[32m[I 2024-10-13 01:02:40,403][0m Trial 200 finished with value: 48800.746618602985 and parameters: {'depth': 7, 'learning_rate': 0.0487553602808103, 'iterations': 100, 'l2_leaf_reg': 0.0972751653613151, 'border_count': 248, 'bagging_temperature': 0.10705132043249435, 'random_strength': 4.281594430678565, 'grow_policy': 'SymmetricTree', 'min_data_in_leaf': 92}. Best is trial 26 with value: 46418.5230534429.[0m
[32m[I 2024-10-13 01:02:41,392][0m Trial 201 finished with value: 47770.951007456104 and parameters: {'depth': 7, 'learning_rate': 0.06649366957911106, 'iterations': 170, 'l2_leaf_reg': 0.1523733906626748, 'border_count': 255, 'bagging_temperature': 0.06882947700702646, 'random_strength': 4.4402441775721675, 'grow_policy': 'SymmetricTree', 'min_data_in_leaf': 66}. Best is trial 26 with value: 46418.5230534429.[0m
[32m[I 2024-10-13 01:02:42,529][0m Trial 202 finished with value: 47229.36690681394 and parameters: {'depth': 7, 'learning_rate': 0.07783249387183863, 'iterations': 176, 'l2_leaf_reg': 0.068450768018125, 'border_count': 253, 'bagging_temperature': 0.06495822127245353, 'random_strength': 4.414311214652179, 'grow_policy': 'SymmetricTree', 'min_data_in_leaf': 61}. Best is trial 26 with value: 46418.5230534429.[0m
[32m[I 2024-10-13 01:02:43,621][0m Trial 203 finished with value: 48162.25949949582 and parameters: {'depth': 7, 'learning_rate': 0.05948497571367004, 'iterations': 142, 'l2_leaf_reg': 0.07269671190347006, 'border_count': 253, 'bagging_temperature': 0.06364516923048141, 'random_strength': 4.8261620797032405, 'grow_policy': 'SymmetricTree', 'min_data_in_leaf': 62}. Best is trial 26 with value: 46418.5230534429.[0m
[32m[I 2024-10-13 01:02:44,509][0m Trial 204 finished with value: 45843.93465193719 and parameters: {'depth': 7, 'learning_rate': 0.07803149735904548, 'iterations': 154, 'l2_leaf_reg': 0.15085606225029247, 'border_count': 251, 'bagging_temperature': 0.02464965361569906, 'random_strength': 4.4928627493726205, 'grow_policy': 'SymmetricTree', 'min_data_in_leaf': 87}. Best is trial 204 with value: 45843.93465193719.[0m
[32m[I 2024-10-13 01:02:45,448][0m Trial 205 finished with value: 46713.822063272215 and parameters: {'depth': 7, 'learning_rate': 0.07810759578045531, 'iterations': 159, 'l2_leaf_reg': 0.15200955919590406, 'border_count': 255, 'bagging_temperature': 0.029051132650011392, 'random_strength': 4.557123717148026, 'grow_policy': 'SymmetricTree', 'min_data_in_leaf': 91}. Best is trial 204 with value: 45843.93465193719.[0m
[32m[I 2024-10-13 01:02:46,341][0m Trial 206 finished with value: 45616.69256612981 and parameters: {'depth': 7, 'learning_rate': 0.08004516696560178, 'iterations': 156, 'l2_leaf_reg': 0.18214991846405026, 'border_count': 255, 'bagging_temperature': 0.027857926603199603, 'random_strength': 4.715190457317563, 'grow_policy': 'SymmetricTree', 'min_data_in_leaf': 79}. Best is trial 206 with value: 45616.69256612981.[0m
[32m[I 2024-10-13 01:02:47,448][0m Trial 207 finished with value: 45818.50977882521 and parameters: {'depth': 7, 'learning_rate': 0.07782764764058252, 'iterations': 161, 'l2_leaf_reg': 0.1727660709731156, 'border_count': 255, 'bagging_temperature': 0.03054801932252451, 'random_strength': 4.941363046828533, 'grow_policy': 'SymmetricTree', 'min_data_in_leaf': 35}. Best is trial 206 with value: 45616.69256612981.[0m
