[32m[I 2024-10-13 01:41:39,403][0m Trial 876 finished with value: 56927.63405997363 and parameters: {'depth': 9, 'learning_rate': 0.2227240768049071, 'iterations': 181, 'l2_leaf_reg': 0.9417463706755351, 'border_count': 187, 'bagging_temperature': 0.43263123822605387, 'random_strength': 9.834349737434009, 'grow_policy': 'Lossguide', 'min_data_in_leaf': 56, 'max_leaves': 170}. Best is trial 726 with value: 37144.045766835996.[0m
[32m[I 2024-10-13 01:41:40,514][0m Trial 877 finished with value: 47425.73538460056 and parameters: {'depth': 8, 'learning_rate': 0.2609807872181946, 'iterations': 255, 'l2_leaf_reg': 2.4283086396630567, 'border_count': 245, 'bagging_temperature': 0.04001852127509349, 'random_strength': 9.990154711253725, 'grow_policy': 'SymmetricTree', 'min_data_in_leaf': 100}. Best is trial 726 with value: 37144.045766835996.[0m
[32m[I 2024-10-13 01:41:41,479][0m Trial 878 finished with value: 50095.27916137053 and parameters: {'depth': 8, 'learning_rate': 0.1712900237052938, 'iterations': 204, 'l2_leaf_reg': 0.479214064094361, 'border_count': 230, 'bagging_temperature': 0.020771654791648324, 'random_strength': 9.570214408661904, 'grow_policy': 'SymmetricTree', 'min_data_in_leaf': 79}. Best is trial 726 with value: 37144.045766835996.[0m
[32m[I 2024-10-13 01:41:42,714][0m Trial 879 finished with value: 38855.428579746644 and parameters: {'depth': 9, 'learning_rate': 0.2619362161952684, 'iterations': 251, 'l2_leaf_reg': 0.7920832802022266, 'border_count': 105, 'bagging_temperature': 0.0005064200914599304, 'random_strength': 9.20928195206511, 'grow_policy': 'SymmetricTree', 'min_data_in_leaf': 106}. Best is trial 726 with value: 37144.045766835996.[0m
[32m[I 2024-10-13 01:41:44,012][0m Trial 880 finished with value: 45942.258943595014 and parameters: {'depth': 9, 'learning_rate': 0.29868735371553917, 'iterations': 273, 'l2_leaf_reg': 1.8192114803597244, 'border_count': 90, 'bagging_temperature': 0.0006120581561758348, 'random_strength': 9.070814087027289, 'grow_policy': 'SymmetricTree', 'min_data_in_leaf': 101}. Best is trial 726 with value: 37144.045766835996.[0m
[32m[I 2024-10-13 01:41:54,675][0m Trial 881 finished with value: 47498.26142519232 and parameters: {'depth': 9, 'learning_rate': 0.25795334372877576, 'iterations': 983, 'l2_leaf_reg': 4.016173483704927e-06, 'border_count': 99, 'bagging_temperature': 0.0005052192541256166, 'random_strength': 9.134468855282464, 'grow_policy': 'SymmetricTree', 'min_data_in_leaf': 108}. Best is trial 726 with value: 37144.045766835996.[0m
[32m[I 2024-10-13 01:41:55,946][0m Trial 882 finished with value: 46396.154482038306 and parameters: {'depth': 9, 'learning_rate': 0.26157025247606913, 'iterations': 260, 'l2_leaf_reg': 1.3820690759260499, 'border_count': 102, 'bagging_temperature': 0.01867156285418714, 'random_strength': 9.250949565137615, 'grow_policy': 'SymmetricTree', 'min_data_in_leaf': 112}. Best is trial 726 with value: 37144.045766835996.[0m
[32m[I 2024-10-13 01:41:57,249][0m Trial 883 finished with value: 38600.839871757606 and parameters: {'depth': 9, 'learning_rate': 0.2636924331435045, 'iterations': 269, 'l2_leaf_reg': 0.9574728546333433, 'border_count': 97, 'bagging_temperature': 0.015117414551645062, 'random_strength': 9.124030322400557, 'grow_policy': 'SymmetricTree', 'min_data_in_leaf': 938}. Best is trial 726 with value: 37144.045766835996.[0m
[32m[I 2024-10-13 01:42:16,226][0m Trial 884 finished with value: 50705.70047872467 and parameters: {'depth': 9, 'learning_rate': 0.2132020291070665, 'iterations': 1226, 'l2_leaf_reg': 3.0073899806271758, 'border_count': 253, 'bagging_temperature': 0.018933790147936412, 'random_strength': 9.045212015828707, 'grow_policy': 'SymmetricTree', 'min_data_in_leaf': 134}. Best is trial 726 with value: 37144.045766835996.[0m
[32m[I 2024-10-13 01:42:17,448][0m Trial 885 finished with value: 52339.76247373656 and parameters: {'depth': 8, 'learning_rate': 0.18620668243354016, 'iterations': 274, 'l2_leaf_reg': 1.227947197853648, 'border_count': 99, 'bagging_temperature': 0.00046602757925389565, 'random_strength': 9.055069433233461, 'grow_policy': 'SymmetricTree', 'min_data_in_leaf': 118}. Best is trial 726 with value: 37144.045766835996.[0m
[32m[I 2024-10-13 01:42:18,973][0m Trial 886 finished with value: 42034.29037349129 and parameters: {'depth': 9, 'learning_rate': 0.29993111726104527, 'iterations': 289, 'l2_leaf_reg': 4.7492331167345085, 'border_count': 105, 'bagging_temperature': 0.03554080079925888, 'random_strength': 9.121297138781358, 'grow_policy': 'SymmetricTree', 'min_data_in_leaf': 893}. Best is trial 726 with value: 37144.045766835996.[0m
[32m[I 2024-10-13 01:42:19,768][0m Trial 887 finished with value: 53787.16143188957 and parameters: {'depth': 9, 'learning_rate': 0.23349132534877198, 'iterations': 275, 'l2_leaf_reg': 0.8847872237283957, 'border_count': 247, 'bagging_temperature': 0.05544995379255849, 'random_strength': 9.234369529318013, 'grow_policy': 'Depthwise', 'min_data_in_leaf': 109}. Best is trial 726 with value: 37144.045766835996.[0m
[32m[I 2024-10-13 01:42:20,904][0m Trial 888 finished with value: 47121.51975068172 and parameters: {'depth': 8, 'learning_rate': 0.22733771584323445, 'iterations': 264, 'l2_leaf_reg': 1.1104815627798128, 'border_count': 245, 'bagging_temperature': 0.03053905563040365, 'random_strength': 9.023817321815503, 'grow_policy': 'SymmetricTree', 'min_data_in_leaf': 599}. Best is trial 726 with value: 37144.045766835996.[0m
[32m[I 2024-10-13 01:42:22,124][0m Trial 889 finished with value: 47966.13709535587 and parameters: {'depth': 9, 'learning_rate': 0.2584496514069063, 'iterations': 232, 'l2_leaf_reg': 1.7259669569349982, 'border_count': 101, 'bagging_temperature': 0.017521436382901493, 'random_strength': 9.306748532751339, 'grow_policy': 'SymmetricTree', 'min_data_in_leaf': 848}. Best is trial 726 with value: 37144.045766835996.[0m
[32m[I 2024-10-13 01:42:23,548][0m Trial 890 finished with value: 46797.18837790214 and parameters: {'depth': 9, 'learning_rate': 0.20562089873274103, 'iterations': 303, 'l2_leaf_reg': 0.4607778627455288, 'border_count': 110, 'bagging_temperature': 0.05497357684994959, 'random_strength': 9.2503212997858, 'grow_policy': 'SymmetricTree', 'min_data_in_leaf': 132}. Best is trial 726 with value: 37144.045766835996.[0m
[32m[I 2024-10-13 01:42:24,879][0m Trial 891 finished with value: 38814.476669326825 and parameters: {'depth': 9, 'learning_rate': 0.2993310588736997, 'iterations': 289, 'l2_leaf_reg': 0.8739170562752848, 'border_count': 93, 'bagging_temperature': 0.00044930958577203424, 'random_strength': 9.000447402817326, 'grow_policy': 'SymmetricTree', 'min_data_in_leaf': 944}. Best is trial 726 with value: 37144.045766835996.[0m
[32m[I 2024-10-13 01:42:26,338][0m Trial 892 finished with value: 45815.966685471496 and parameters: {'depth': 9, 'learning_rate': 0.18027928546546923, 'iterations': 303, 'l2_leaf_reg': 0.948612967050576, 'border_count': 85, 'bagging_temperature': 0.5463253045737816, 'random_strength': 9.081253584441315, 'grow_policy': 'SymmetricTree', 'min_data_in_leaf': 130}. Best is trial 726 with value: 37144.045766835996.[0m
[32m[I 2024-10-13 01:42:27,660][0m Trial 893 finished with value: 43348.636914551316 and parameters: {'depth': 9, 'learning_rate': 0.2511498013593957, 'iterations': 224, 'l2_leaf_reg': 2.2350422189763646, 'border_count': 94, 'bagging_temperature': 0.03376760022110115, 'random_strength': 8.919828453316477, 'grow_policy': 'SymmetricTree', 'min_data_in_leaf': 901}. Best is trial 726 with value: 37144.045766835996.[0m
[32m[I 2024-10-13 01:42:29,033][0m Trial 894 finished with value: 46585.06817409906 and parameters: {'depth': 9, 'learning_rate': 0.22623854467536453, 'iterations': 305, 'l2_leaf_reg': 1.3821263230369354, 'border_count': 94, 'bagging_temperature': 0.07737852671676794, 'random_strength': 8.853216316000006, 'grow_policy': 'SymmetricTree', 'min_data_in_leaf': 947}. Best is trial 726 with value: 37144.045766835996.[0m
[32m[I 2024-10-13 01:42:30,385][0m Trial 895 finished with value: 39412.49995158223 and parameters: {'depth': 9, 'learning_rate': 0.2608187365950189, 'iterations': 316, 'l2_leaf_reg': 0.9213826280475249, 'border_count': 97, 'bagging_temperature': 0.017649231127500463, 'random_strength': 8.995483647825646, 'grow_policy': 'SymmetricTree', 'min_data_in_leaf': 914}. Best is trial 726 with value: 37144.045766835996.[0m
[32m[I 2024-10-13 01:42:31,496][0m Trial 896 finished with value: 47411.1931439904 and parameters: {'depth': 9, 'learning_rate': 0.1966242286804215, 'iterations': 221, 'l2_leaf_reg': 0.3995527380712474, 'border_count': 89, 'bagging_temperature': 0.04587284615461795, 'random_strength': 9.372408942503505, 'grow_policy': 'SymmetricTree', 'min_data_in_leaf': 966}. Best is trial 726 with value: 37144.045766835996.[0m
[32m[I 2024-10-13 01:42:32,248][0m Trial 897 finished with value: 54793.54266164385 and parameters: {'depth': 8, 'learning_rate': 0.25981020811011013, 'iterations': 275, 'l2_leaf_reg': 1.9316790006227054, 'border_count': 98, 'bagging_temperature': 0.5805425123976029, 'random_strength': 9.073921069319347, 'grow_policy': 'Lossguide', 'min_data_in_leaf': 963, 'max_leaves': 241}. Best is trial 726 with value: 37144.045766835996.[0m
[32m[I 2024-10-13 01:42:33,758][0m Trial 898 finished with value: 43347.985697310214 and parameters: {'depth': 9, 'learning_rate': 0.15836303618300407, 'iterations': 345, 'l2_leaf_reg': 0.8378802942478601, 'border_count': 92, 'bagging_temperature': 0.01844398093194595, 'random_strength': 9.480117527495317, 'grow_policy': 'SymmetricTree', 'min_data_in_leaf': 942}. Best is trial 726 with value: 37144.045766835996.[0m
[32m[I 2024-10-13 01:42:34,892][0m Trial 899 finished with value: 47866.892739918694 and parameters: {'depth': 9, 'learning_rate': 0.21957090178231847, 'iterations': 215, 'l2_leaf_reg': 0.418731019553109, 'border_count': 95, 'bagging_temperature': 0.063750427898953, 'random_strength': 9.28927374505983, 'grow_policy': 'SymmetricTree', 'min_data_in_leaf': 1000}. Best is trial 726 with value: 37144.045766835996.[0m
[32m[I 2024-10-13 01:42:36,265][0m Trial 900 finished with value: 39402.09307084032 and parameters: {'depth': 9, 'learning_rate': 0.26020938564566576, 'iterations': 279, 'l2_leaf_reg': 0.614347338803117, 'border_count': 108, 'bagging_temperature': 0.0006803626921448973, 'random_strength': 9.139567220814229, 'grow_policy': 'SymmetricTree', 'min_data_in_leaf': 973}. Best is trial 726 with value: 37144.045766835996.[0m
[32m[I 2024-10-13 01:42:37,705][0m Trial 901 finished with value: 42272.54422250934 and parameters: {'depth': 9, 'learning_rate': 0.19286728351453616, 'iterations': 337, 'l2_leaf_reg': 0.41174987809377345, 'border_count': 105, 'bagging_temperature': 0.033999945290009284, 'random_strength': 9.686691846451092, 'grow_policy': 'SymmetricTree', 'min_data_in_leaf': 935}. Best is trial 726 with value: 37144.045766835996.[0m
[32m[I 2024-10-13 01:42:38,718][0m Trial 902 finished with value: 46162.6784488753 and parameters: {'depth': 9, 'learning_rate': 0.2983130602935953, 'iterations': 174, 'l2_leaf_reg': 1.2926434790506882, 'border_count': 88, 'bagging_temperature': 0.09701749851305272, 'random_strength': 9.509583078358038, 'grow_policy': 'SymmetricTree', 'min_data_in_leaf': 344}. Best is trial 726 with value: 37144.045766835996.[0m
[32m[I 2024-10-13 01:42:40,000][0m Trial 903 finished with value: 51404.88096778195 and parameters: {'depth': 9, 'learning_rate': 0.2287445231233544, 'iterations': 247, 'l2_leaf_reg': 0.8054207019326084, 'border_count': 85, 'bagging_temperature': 0.000390313792655899, 'random_strength': 2.0908868500725983, 'grow_policy': 'SymmetricTree', 'min_data_in_leaf': 567}. Best is trial 726 with value: 37144.045766835996.[0m
[32m[I 2024-10-13 01:42:41,628][0m Trial 904 finished with value: 46956.822630008086 and parameters: {'depth': 9, 'learning_rate': 0.25989571216595253, 'iterations': 365, 'l2_leaf_reg': 1.4588719699053831, 'border_count': 80, 'bagging_temperature': 0.04785073060262314, 'random_strength': 9.845555241049022, 'grow_policy': 'SymmetricTree', 'min_data_in_leaf': 917}. Best is trial 726 with value: 37144.045766835996.[0m
[32m[I 2024-10-13 01:42:42,991][0m Trial 905 finished with value: 46414.59522176718 and parameters: {'depth': 9, 'learning_rate': 0.1412058322430363, 'iterations': 294, 'l2_leaf_reg': 2.3377829803994046, 'border_count': 94, 'bagging_temperature': 0.029906878052633482, 'random_strength': 8.931252022118558, 'grow_policy': 'SymmetricTree', 'min_data_in_leaf': 143}. Best is trial 726 with value: 37144.045766835996.[0m
[32m[I 2024-10-13 01:42:43,902][0m Trial 906 finished with value: 47068.22089548314 and parameters: {'depth': 8, 'learning_rate': 0.2981085794421874, 'iterations': 188, 'l2_leaf_reg': 0.6077002802454391, 'border_count': 103, 'bagging_temperature': 0.00014542572396198175, 'random_strength': 9.34587240289898, 'grow_policy': 'SymmetricTree', 'min_data_in_leaf': 935}. Best is trial 726 with value: 37144.045766835996.[0m
[32m[I 2024-10-13 01:42:45,428][0m Trial 907 finished with value: 43129.55993452777 and parameters: {'depth': 9, 'learning_rate': 0.23159616435793348, 'iterations': 377, 'l2_leaf_reg': 0.3229067441840833, 'border_count': 82, 'bagging_temperature': 0.02109282785853353, 'random_strength': 9.151041741118522, 'grow_policy': 'SymmetricTree', 'min_data_in_leaf': 956}. Best is trial 726 with value: 37144.045766835996.[0m
[32m[I 2024-10-13 01:42:46,848][0m Trial 908 finished with value: 49334.04587333682 and parameters: {'depth': 9, 'learning_rate': 0.2999567685684363, 'iterations': 322, 'l2_leaf_reg': 0.8970950414926971, 'border_count': 97, 'bagging_temperature': 0.07179273619291573, 'random_strength': 9.670492964207192, 'grow_policy': 'SymmetricTree', 'min_data_in_leaf': 872}. Best is trial 726 with value: 37144.045766835996.[0m
[32m[I 2024-10-13 01:42:47,992][0m Trial 909 finished with value: 45122.788919809864 and parameters: {'depth': 9, 'learning_rate': 0.1926877122899651, 'iterations': 236, 'l2_leaf_reg': 2.952211594951341, 'border_count': 77, 'bagging_temperature': 0.04759128869636634, 'random_strength': 9.491548776317748, 'grow_policy': 'SymmetricTree', 'min_data_in_leaf': 990}. Best is trial 726 with value: 37144.045766835996.[0m
[32m[I 2024-10-13 01:42:48,627][0m Trial 910 finished with value: 133304.897516978 and parameters: {'depth': 8, 'learning_rate': 0.0007827970001013988, 'iterations': 101, 'l2_leaf_reg': 0.5056706134174638, 'border_count': 104, 'bagging_temperature': 0.01943648770428308, 'random_strength': 9.851519029290248, 'grow_policy': 'Depthwise', 'min_data_in_leaf': 81}. Best is trial 726 with value: 37144.045766835996.[0m
[32m[I 2024-10-13 01:42:50,297][0m Trial 911 finished with value: 47028.21249395772 and parameters: {'depth': 9, 'learning_rate': 0.22766780138816617, 'iterations': 401, 'l2_leaf_reg': 1.2578477717985208, 'border_count': 110, 'bagging_temperature': 0.03664851478917945, 'random_strength': 9.327451434836362, 'grow_policy': 'SymmetricTree', 'min_data_in_leaf': 982}. Best is trial 726 with value: 37144.045766835996.[0m
[32m[I 2024-10-13 01:42:51,251][0m Trial 912 finished with value: 69313.47593950486 and parameters: {'depth': 9, 'learning_rate': 0.006190396822337168, 'iterations': 165, 'l2_leaf_reg': 0.35327970367078687, 'border_count': 96, 'bagging_temperature': 0.0216974606145781, 'random_strength': 9.01002557170901, 'grow_policy': 'SymmetricTree', 'min_data_in_leaf': 484}. Best is trial 726 with value: 37144.045766835996.[0m
[32m[I 2024-10-13 01:42:52,568][0m Trial 913 finished with value: 48468.342072380205 and parameters: {'depth': 9, 'learning_rate': 0.2588252951497717, 'iterations': 278, 'l2_leaf_reg': 0.6581050736503271, 'border_count': 92, 'bagging_temperature': 0.05826158776609233, 'random_strength': 9.565351036053524, 'grow_policy': 'SymmetricTree', 'min_data_in_leaf': 630}. Best is trial 726 with value: 37144.045766835996.[0m
[32m[I 2024-10-13 01:43:05,402][0m Trial 914 finished with value: 46741.00392372777 and parameters: {'depth': 9, 'learning_rate': 0.16802084776005255, 'iterations': 1099, 'l2_leaf_reg': 1.062468469178467, 'border_count': 109, 'bagging_temperature': 0.01758705315307165, 'random_strength': 9.81871712555073, 'grow_policy': 'SymmetricTree', 'min_data_in_leaf': 950}. Best is trial 726 with value: 37144.045766835996.[0m
[32m[I 2024-10-13 01:43:07,055][0m Trial 915 finished with value: 41947.23924597498 and parameters: {'depth': 9, 'learning_rate': 0.20386667764904695, 'iterations': 325, 'l2_leaf_reg': 0.3506302553548035, 'border_count': 92, 'bagging_temperature': 4.2568337193862394e-05, 'random_strength': 9.189190353338617, 'grow_policy': 'SymmetricTree', 'min_data_in_leaf': 972}. Best is trial 726 with value: 37144.045766835996.[0m
[32m[I 2024-10-13 01:43:08,161][0m Trial 916 finished with value: 51509.5717916896 and parameters: {'depth': 8, 'learning_rate': 0.25637488765683264, 'iterations': 219, 'l2_leaf_reg': 1.7003811682193004, 'border_count': 104, 'bagging_temperature': 0.040692910127286756, 'random_strength': 9.46789117822393, 'grow_policy': 'SymmetricTree', 'min_data_in_leaf': 895}. Best is trial 726 with value: 37144.045766835996.[0m
[32m[I 2024-10-13 01:43:09,756][0m Trial 917 finished with value: 48345.48200286377 and parameters: {'depth': 9, 'learning_rate': 0.22254013939602932, 'iterations': 371, 'l2_leaf_reg': 0.5771150854362421, 'border_count': 86, 'bagging_temperature': 0.07531644005410557, 'random_strength': 8.877056602609837, 'grow_policy': 'SymmetricTree', 'min_data_in_leaf': 958}. Best is trial 726 with value: 37144.045766835996.[0m
[32m[I 2024-10-13 01:43:11,069][0m Trial 918 finished with value: 43222.18579671952 and parameters: {'depth': 9, 'learning_rate': 0.2579070185222194, 'iterations': 281, 'l2_leaf_reg': 0.40764085649971604, 'border_count': 86, 'bagging_temperature': 0.03398635059678961, 'random_strength': 9.983745203529075, 'grow_policy': 'SymmetricTree', 'min_data_in_leaf': 923}. Best is trial 726 with value: 37144.045766835996.[0m
[32m[I 2024-10-13 01:43:11,936][0m Trial 919 finished with value: 54789.36316835897 and parameters: {'depth': 9, 'learning_rate': 0.1799170886772636, 'iterations': 405, 'l2_leaf_reg': 0.90252713602114, 'border_count': 75, 'bagging_temperature': 0.017592626595966075, 'random_strength': 9.67617205339998, 'grow_policy': 'Lossguide', 'min_data_in_leaf': 907, 'max_leaves': 210}. Best is trial 726 with value: 37144.045766835996.[0m
[32m[I 2024-10-13 01:43:13,021][0m Trial 920 finished with value: 52661.34351829014 and parameters: {'depth': 8, 'learning_rate': 0.26237626008090664, 'iterations': 210, 'l2_leaf_reg': 0.6778349352265767, 'border_count': 101, 'bagging_temperature': 0.04954980267930974, 'random_strength': 9.297163205560768, 'grow_policy': 'SymmetricTree', 'min_data_in_leaf': 947}. Best is trial 726 with value: 37144.045766835996.[0m
[32m[I 2024-10-13 01:43:14,575][0m Trial 921 finished with value: 57516.39618778943 and parameters: {'depth': 9, 'learning_rate': 0.22307448401575444, 'iterations': 331, 'l2_leaf_reg': 0.3114394461492072, 'border_count': 42, 'bagging_temperature': 0.018026071570854875, 'random_strength': 9.641561109539332, 'grow_policy': 'SymmetricTree', 'min_data_in_leaf': 536}. Best is trial 726 with value: 37144.045766835996.[0m
[32m[I 2024-10-13 01:43:16,710][0m Trial 922 finished with value: 46844.776423323776 and parameters: {'depth': 12, 'learning_rate': 0.296892624573739, 'iterations': 146, 'l2_leaf_reg': 1.1914103868710044, 'border_count': 107, 'bagging_temperature': 0.053318790408877687, 'random_strength': 9.44778311023198, 'grow_policy': 'SymmetricTree', 'min_data_in_leaf': 926}. Best is trial 726 with value: 37144.045766835996.[0m
[32m[I 2024-10-13 01:43:18,049][0m Trial 923 finished with value: 54300.566648152584 and parameters: {'depth': 9, 'learning_rate': 0.29958815676471195, 'iterations': 253, 'l2_leaf_reg': 0.7817281999941366, 'border_count': 95, 'bagging_temperature': 0.8907390261490254, 'random_strength': 9.99920255838614, 'grow_policy': 'SymmetricTree', 'min_data_in_leaf': 929}. Best is trial 726 with value: 37144.045766835996.[0m
[32m[I 2024-10-13 01:43:20,916][0m Trial 924 finished with value: 42079.65197121528 and parameters: {'depth': 9, 'learning_rate': 0.20339000282175348, 'iterations': 428, 'l2_leaf_reg': 0.46237872345884606, 'border_count': 83, 'bagging_temperature': 0.028367719832905158, 'random_strength': 9.112764577564235, 'grow_policy': 'SymmetricTree', 'min_data_in_leaf': 142}. Best is trial 726 with value: 37144.045766835996.[0m
[32m[I 2024-10-13 01:43:22,494][0m Trial 925 finished with value: 47249.05982368175 and parameters: {'depth': 9, 'learning_rate': 0.23104835879055088, 'iterations': 327, 'l2_leaf_reg': 1.664743839123328, 'border_count': 103, 'bagging_temperature': 0.06660888118529354, 'random_strength': 9.796952703325621, 'grow_policy': 'SymmetricTree', 'min_data_in_leaf': 877}. Best is trial 726 with value: 37144.045766835996.[0m
[32m[I 2024-10-13 01:43:23,586][0m Trial 926 finished with value: 43141.062093865396 and parameters: {'depth': 9, 'learning_rate': 0.2587467635700259, 'iterations': 190, 'l2_leaf_reg': 0.34313168060389215, 'border_count': 113, 'bagging_temperature': 0.01793725988657644, 'random_strength': 9.348824274722372, 'grow_policy': 'SymmetricTree', 'min_data_in_leaf': 83}. Best is trial 726 with value: 37144.045766835996.[0m
[32m[I 2024-10-13 01:43:24,951][0m Trial 927 finished with value: 39305.8065443173 and parameters: {'depth': 9, 'learning_rate': 0.2995963682028801, 'iterations': 273, 'l2_leaf_reg': 0.5934827720769937, 'border_count': 91, 'bagging_temperature': 0.0005150616027889965, 'random_strength': 8.904422150092087, 'grow_policy': 'SymmetricTree', 'min_data_in_leaf': 121}. Best is trial 726 with value: 37144.045766835996.[0m
