[32m[I 2024-10-13 01:40:40,452][0m Trial 824 finished with value: 47358.495971094264 and parameters: {'depth': 9, 'learning_rate': 0.01781727515459128, 'iterations': 239, 'l2_leaf_reg': 0.18691932387777935, 'border_count': 123, 'bagging_temperature': 0.06198103709176826, 'random_strength': 9.995184379841538, 'grow_policy': 'SymmetricTree', 'min_data_in_leaf': 113}. Best is trial 726 with value: 37144.045766835996.[0m
[32m[I 2024-10-13 01:40:42,231][0m Trial 825 finished with value: 47950.353973638914 and parameters: {'depth': 9, 'learning_rate': 0.22633352252929817, 'iterations': 403, 'l2_leaf_reg': 0.8221006565616507, 'border_count': 251, 'bagging_temperature': 0.04667732166397009, 'random_strength': 9.617044506467602, 'grow_policy': 'SymmetricTree', 'min_data_in_leaf': 141}. Best is trial 726 with value: 37144.045766835996.[0m
[32m[I 2024-10-13 01:40:43,411][0m Trial 826 finished with value: 43207.994658481664 and parameters: {'depth': 9, 'learning_rate': 0.1854889067717055, 'iterations': 197, 'l2_leaf_reg': 0.24505905521824636, 'border_count': 237, 'bagging_temperature': 0.0012771980360014798, 'random_strength': 9.45976814623802, 'grow_policy': 'SymmetricTree', 'min_data_in_leaf': 79}. Best is trial 726 with value: 37144.045766835996.[0m
[32m[I 2024-10-13 01:40:45,005][0m Trial 827 finished with value: 43289.504133135604 and parameters: {'depth': 9, 'learning_rate': 0.26149114859498257, 'iterations': 327, 'l2_leaf_reg': 0.3531096142120542, 'border_count': 245, 'bagging_temperature': 0.019448443956225577, 'random_strength': 9.811991746623823, 'grow_policy': 'SymmetricTree', 'min_data_in_leaf': 129}. Best is trial 726 with value: 37144.045766835996.[0m
[32m[I 2024-10-13 01:40:46,262][0m Trial 828 finished with value: 39046.68443150373 and parameters: {'depth': 9, 'learning_rate': 0.29914706210404235, 'iterations': 260, 'l2_leaf_reg': 0.6063289313108712, 'border_count': 234, 'bagging_temperature': 5.634537522429799e-05, 'random_strength': 9.296082524533338, 'grow_policy': 'SymmetricTree', 'min_data_in_leaf': 104}. Best is trial 726 with value: 37144.045766835996.[0m
[32m[I 2024-10-13 01:40:47,045][0m Trial 829 finished with value: 52235.78449204058 and parameters: {'depth': 8, 'learning_rate': 0.2648892748315362, 'iterations': 106, 'l2_leaf_reg': 1.8832885215051829, 'border_count': 234, 'bagging_temperature': 0.0007469787594960135, 'random_strength': 9.288471888174607, 'grow_policy': 'SymmetricTree', 'min_data_in_leaf': 100}. Best is trial 726 with value: 37144.045766835996.[0m
[32m[I 2024-10-13 01:40:47,773][0m Trial 830 finished with value: 54993.994970602806 and parameters: {'depth': 9, 'learning_rate': 0.2999176547663499, 'iterations': 210, 'l2_leaf_reg': 0.6828056256111975, 'border_count': 241, 'bagging_temperature': 0.00028182791138453567, 'random_strength': 9.240913994248514, 'grow_policy': 'Lossguide', 'min_data_in_leaf': 67, 'max_leaves': 98}. Best is trial 726 with value: 37144.045766835996.[0m
[32m[I 2024-10-13 01:40:49,034][0m Trial 831 finished with value: 39705.98460852789 and parameters: {'depth': 9, 'learning_rate': 0.2630158098758647, 'iterations': 264, 'l2_leaf_reg': 1.1339248262694914, 'border_count': 231, 'bagging_temperature': 0.01887333332490989, 'random_strength': 9.26682025214545, 'grow_policy': 'SymmetricTree', 'min_data_in_leaf': 119}. Best is trial 726 with value: 37144.045766835996.[0m
[32m[I 2024-10-13 01:40:50,037][0m Trial 832 finished with value: 39051.95096871457 and parameters: {'depth': 9, 'learning_rate': 0.29973599017055685, 'iterations': 164, 'l2_leaf_reg': 0.6815340932981323, 'border_count': 233, 'bagging_temperature': 0.0010835518295513082, 'random_strength': 9.452815311024793, 'grow_policy': 'SymmetricTree', 'min_data_in_leaf': 89}. Best is trial 726 with value: 37144.045766835996.[0m
[32m[I 2024-10-13 01:40:50,877][0m Trial 833 finished with value: 45829.07649113298 and parameters: {'depth': 9, 'learning_rate': 0.299417869045321, 'iterations': 103, 'l2_leaf_reg': 1.694119891165653, 'border_count': 234, 'bagging_temperature': 0.0008871687607288068, 'random_strength': 9.204655743827436, 'grow_policy': 'SymmetricTree', 'min_data_in_leaf': 64}. Best is trial 726 with value: 37144.045766835996.[0m
[32m[I 2024-10-13 01:40:51,820][0m Trial 834 finished with value: 38917.02278519637 and parameters: {'depth': 9, 'learning_rate': 0.2981703351114663, 'iterations': 154, 'l2_leaf_reg': 0.8231203821909017, 'border_count': 239, 'bagging_temperature': 0.001556634882389891, 'random_strength': 9.485141649572576, 'grow_policy': 'SymmetricTree', 'min_data_in_leaf': 87}. Best is trial 726 with value: 37144.045766835996.[0m
[32m[I 2024-10-13 01:40:52,980][0m Trial 835 finished with value: 39020.24926672546 and parameters: {'depth': 9, 'learning_rate': 0.2968396305461574, 'iterations': 207, 'l2_leaf_reg': 0.9930757699640093, 'border_count': 241, 'bagging_temperature': 0.03315836066238859, 'random_strength': 9.509101881950818, 'grow_policy': 'SymmetricTree', 'min_data_in_leaf': 50}. Best is trial 726 with value: 37144.045766835996.[0m
[32m[I 2024-10-13 01:40:53,822][0m Trial 836 finished with value: 39122.57306600407 and parameters: {'depth': 9, 'learning_rate': 0.2956691046315664, 'iterations': 122, 'l2_leaf_reg': 1.0390956347044178, 'border_count': 245, 'bagging_temperature': 0.03657433983843685, 'random_strength': 9.50595388235186, 'grow_policy': 'SymmetricTree', 'min_data_in_leaf': 50}. Best is trial 726 with value: 37144.045766835996.[0m
[32m[I 2024-10-13 01:40:54,740][0m Trial 837 finished with value: 45761.483089443005 and parameters: {'depth': 9, 'learning_rate': 0.2995007250741846, 'iterations': 124, 'l2_leaf_reg': 1.5665326856137076, 'border_count': 248, 'bagging_temperature': 0.08976515307467375, 'random_strength': 9.3587346530178, 'grow_policy': 'SymmetricTree', 'min_data_in_leaf': 44}. Best is trial 726 with value: 37144.045766835996.[0m
[32m[I 2024-10-13 01:40:55,538][0m Trial 838 finished with value: 41312.7989397975 and parameters: {'depth': 9, 'learning_rate': 0.29354909331964646, 'iterations': 105, 'l2_leaf_reg': 3.540395527477771, 'border_count': 250, 'bagging_temperature': 0.043552061173869026, 'random_strength': 9.450583862832925, 'grow_policy': 'SymmetricTree', 'min_data_in_leaf': 50}. Best is trial 726 with value: 37144.045766835996.[0m
[32m[I 2024-10-13 01:40:56,514][0m Trial 839 finished with value: 48425.40368294257 and parameters: {'depth': 9, 'learning_rate': 0.2975117710342743, 'iterations': 146, 'l2_leaf_reg': 3.229978537264495, 'border_count': 245, 'bagging_temperature': 0.06756139701125853, 'random_strength': 9.199573188279226, 'grow_policy': 'SymmetricTree', 'min_data_in_leaf': 48}. Best is trial 726 with value: 37144.045766835996.[0m
[32m[I 2024-10-13 01:40:57,330][0m Trial 840 finished with value: 47226.78816099213 and parameters: {'depth': 8, 'learning_rate': 0.299503543765608, 'iterations': 129, 'l2_leaf_reg': 2.248398421560573, 'border_count': 247, 'bagging_temperature': 0.03679755705871658, 'random_strength': 9.46702222179063, 'grow_policy': 'SymmetricTree', 'min_data_in_leaf': 62}. Best is trial 726 with value: 37144.045766835996.[0m
[32m[I 2024-10-13 01:40:57,983][0m Trial 841 finished with value: 52742.829968333645 and parameters: {'depth': 9, 'learning_rate': 0.29670335858850333, 'iterations': 146, 'l2_leaf_reg': 2.3075660164892895, 'border_count': 251, 'bagging_temperature': 0.0011751691687353419, 'random_strength': 9.288110907277535, 'grow_policy': 'Depthwise', 'min_data_in_leaf': 934}. Best is trial 726 with value: 37144.045766835996.[0m
[32m[I 2024-10-13 01:40:58,836][0m Trial 842 finished with value: 54481.7144252902 and parameters: {'depth': 9, 'learning_rate': 0.2611121525194285, 'iterations': 102, 'l2_leaf_reg': 1.067100413422321, 'border_count': 244, 'bagging_temperature': 0.7947402059769134, 'random_strength': 9.496511386812417, 'grow_policy': 'SymmetricTree', 'min_data_in_leaf': 46}. Best is trial 726 with value: 37144.045766835996.[0m
[32m[I 2024-10-13 01:40:59,971][0m Trial 843 finished with value: 46831.1595112876 and parameters: {'depth': 9, 'learning_rate': 0.23428934547360958, 'iterations': 174, 'l2_leaf_reg': 1.5426570229142058, 'border_count': 252, 'bagging_temperature': 0.04796833865640876, 'random_strength': 9.532224588186603, 'grow_policy': 'SymmetricTree', 'min_data_in_leaf': 42}. Best is trial 726 with value: 37144.045766835996.[0m
[32m[I 2024-10-13 01:41:00,826][0m Trial 844 finished with value: 40846.38437571018 and parameters: {'depth': 9, 'learning_rate': 0.2968576708996427, 'iterations': 107, 'l2_leaf_reg': 1.1271098079585058, 'border_count': 241, 'bagging_temperature': 0.0005941297740792725, 'random_strength': 9.227018928616674, 'grow_policy': 'SymmetricTree', 'min_data_in_leaf': 962}. Best is trial 726 with value: 37144.045766835996.[0m
[32m[I 2024-10-13 01:41:01,882][0m Trial 845 finished with value: 39385.088056679066 and parameters: {'depth': 9, 'learning_rate': 0.25751071427637345, 'iterations': 162, 'l2_leaf_reg': 0.8923957765009567, 'border_count': 245, 'bagging_temperature': 0.00017406354594555907, 'random_strength': 9.433632055706056, 'grow_policy': 'SymmetricTree', 'min_data_in_leaf': 67}. Best is trial 726 with value: 37144.045766835996.[0m
[32m[I 2024-10-13 01:41:08,011][0m Trial 846 finished with value: 47192.58347052844 and parameters: {'depth': 14, 'learning_rate': 0.2998311623973834, 'iterations': 155, 'l2_leaf_reg': 1.919807017236728, 'border_count': 245, 'bagging_temperature': 0.03156972409966926, 'random_strength': 9.546525920103674, 'grow_policy': 'SymmetricTree', 'min_data_in_leaf': 42}. Best is trial 726 with value: 37144.045766835996.[0m
[32m[I 2024-10-13 01:41:09,018][0m Trial 847 finished with value: 45840.391745711546 and parameters: {'depth': 9, 'learning_rate': 0.22848107040010954, 'iterations': 178, 'l2_leaf_reg': 1.280893818072986, 'border_count': 240, 'bagging_temperature': 0.07316590949617226, 'random_strength': 9.211205487317036, 'grow_policy': 'SymmetricTree', 'min_data_in_leaf': 74}. Best is trial 726 with value: 37144.045766835996.[0m
[32m[I 2024-10-13 01:41:10,013][0m Trial 848 finished with value: 38941.44720188671 and parameters: {'depth': 9, 'learning_rate': 0.258088760328824, 'iterations': 139, 'l2_leaf_reg': 0.9330394168761721, 'border_count': 240, 'bagging_temperature': 0.023882744667118976, 'random_strength': 9.620518605000946, 'grow_policy': 'SymmetricTree', 'min_data_in_leaf': 73}. Best is trial 726 with value: 37144.045766835996.[0m
[32m[I 2024-10-13 01:41:11,236][0m Trial 849 finished with value: 39116.7629397768 and parameters: {'depth': 9, 'learning_rate': 0.22722880379318575, 'iterations': 182, 'l2_leaf_reg': 0.7234576098912171, 'border_count': 240, 'bagging_temperature': 0.017918660714196365, 'random_strength': 9.682247079802044, 'grow_policy': 'SymmetricTree', 'min_data_in_leaf': 80}. Best is trial 726 with value: 37144.045766835996.[0m
[32m[I 2024-10-13 01:41:12,304][0m Trial 850 finished with value: 43630.90020673425 and parameters: {'depth': 9, 'learning_rate': 0.2138249833432986, 'iterations': 187, 'l2_leaf_reg': 6.959662766008966, 'border_count': 234, 'bagging_temperature': 0.020185498170438732, 'random_strength': 9.647296046722596, 'grow_policy': 'SymmetricTree', 'min_data_in_leaf': 84}. Best is trial 726 with value: 37144.045766835996.[0m
[32m[I 2024-10-13 01:41:13,224][0m Trial 851 finished with value: 49258.75017026873 and parameters: {'depth': 8, 'learning_rate': 0.25434350021111046, 'iterations': 179, 'l2_leaf_reg': 0.7852355287140126, 'border_count': 239, 'bagging_temperature': 0.023082310398467837, 'random_strength': 9.308123446011335, 'grow_policy': 'SymmetricTree', 'min_data_in_leaf': 68}. Best is trial 726 with value: 37144.045766835996.[0m
[32m[I 2024-10-13 01:41:14,051][0m Trial 852 finished with value: 48743.86986949572 and parameters: {'depth': 9, 'learning_rate': 0.21358949147135867, 'iterations': 105, 'l2_leaf_reg': 1.339994288295415, 'border_count': 239, 'bagging_temperature': 0.0006303769273310056, 'random_strength': 9.583233626636334, 'grow_policy': 'SymmetricTree', 'min_data_in_leaf': 95}. Best is trial 726 with value: 37144.045766835996.[0m
[32m[I 2024-10-13 01:41:14,764][0m Trial 853 finished with value: 53391.39016059249 and parameters: {'depth': 9, 'learning_rate': 0.25871528488455575, 'iterations': 195, 'l2_leaf_reg': 0.8165508918650985, 'border_count': 238, 'bagging_temperature': 0.05560839411233097, 'random_strength': 9.36461790091601, 'grow_policy': 'Lossguide', 'min_data_in_leaf': 84, 'max_leaves': 150}. Best is trial 726 with value: 37144.045766835996.[0m
[32m[I 2024-10-13 01:41:15,971][0m Trial 854 finished with value: 39073.99670923876 and parameters: {'depth': 9, 'learning_rate': 0.22626103312998933, 'iterations': 207, 'l2_leaf_reg': 0.6683137469884256, 'border_count': 232, 'bagging_temperature': 0.03523503120848104, 'random_strength': 9.665687463887869, 'grow_policy': 'SymmetricTree', 'min_data_in_leaf': 61}. Best is trial 726 with value: 37144.045766835996.[0m
[32m[I 2024-10-13 01:41:17,039][0m Trial 855 finished with value: 43889.093957679586 and parameters: {'depth': 9, 'learning_rate': 0.14223170906550808, 'iterations': 146, 'l2_leaf_reg': 0.7269428478380096, 'border_count': 232, 'bagging_temperature': 0.01938497103116546, 'random_strength': 9.81407491342583, 'grow_policy': 'SymmetricTree', 'min_data_in_leaf': 64}. Best is trial 726 with value: 37144.045766835996.[0m
[32m[I 2024-10-13 01:41:18,126][0m Trial 856 finished with value: 46464.12359616205 and parameters: {'depth': 9, 'learning_rate': 0.1837488096753466, 'iterations': 178, 'l2_leaf_reg': 1.1056497449938807, 'border_count': 244, 'bagging_temperature': 0.048522556208442494, 'random_strength': 9.123491243911763, 'grow_policy': 'SymmetricTree', 'min_data_in_leaf': 55}. Best is trial 726 with value: 37144.045766835996.[0m
[32m[I 2024-10-13 01:41:19,362][0m Trial 857 finished with value: 43139.75412980028 and parameters: {'depth': 9, 'learning_rate': 0.20724525951645428, 'iterations': 204, 'l2_leaf_reg': 2.0381303011819716, 'border_count': 232, 'bagging_temperature': 0.01766684235586939, 'random_strength': 9.36438062438077, 'grow_policy': 'SymmetricTree', 'min_data_in_leaf': 38}. Best is trial 726 with value: 37144.045766835996.[0m
[32m[I 2024-10-13 01:41:20,265][0m Trial 858 finished with value: 51661.700256866585 and parameters: {'depth': 8, 'learning_rate': 0.17215127017653065, 'iterations': 161, 'l2_leaf_reg': 0.8285991025321499, 'border_count': 249, 'bagging_temperature': 0.1159270368013294, 'random_strength': 9.66035845517291, 'grow_policy': 'SymmetricTree', 'min_data_in_leaf': 60}. Best is trial 726 with value: 37144.045766835996.[0m
[32m[I 2024-10-13 01:41:21,510][0m Trial 859 finished with value: 48350.70861618073 and parameters: {'depth': 9, 'learning_rate': 0.20272177057407514, 'iterations': 216, 'l2_leaf_reg': 0.6109242614066464, 'border_count': 239, 'bagging_temperature': 0.044379007451688504, 'random_strength': 9.469597610606437, 'grow_policy': 'SymmetricTree', 'min_data_in_leaf': 78}. Best is trial 726 with value: 37144.045766835996.[0m
[32m[I 2024-10-13 01:41:22,423][0m Trial 860 finished with value: 48490.35778293003 and parameters: {'depth': 9, 'learning_rate': 0.23019143411773385, 'iterations': 107, 'l2_leaf_reg': 0.6204002757583338, 'border_count': 241, 'bagging_temperature': 0.06575457548008623, 'random_strength': 9.195131636049643, 'grow_policy': 'SymmetricTree', 'min_data_in_leaf': 39}. Best is trial 726 with value: 37144.045766835996.[0m
[32m[I 2024-10-13 01:41:23,683][0m Trial 861 finished with value: 44557.621089060165 and parameters: {'depth': 9, 'learning_rate': 0.23370784111036705, 'iterations': 205, 'l2_leaf_reg': 1.8377459111006467, 'border_count': 251, 'bagging_temperature': 0.1472296527887123, 'random_strength': 9.8164619815533, 'grow_policy': 'SymmetricTree', 'min_data_in_leaf': 81}. Best is trial 726 with value: 37144.045766835996.[0m
[32m[I 2024-10-13 01:41:24,807][0m Trial 862 finished with value: 46154.6769054451 and parameters: {'depth': 9, 'learning_rate': 0.19198468666480215, 'iterations': 173, 'l2_leaf_reg': 1.347694599724998, 'border_count': 231, 'bagging_temperature': 0.0007634595812413304, 'random_strength': 9.631236589920094, 'grow_policy': 'SymmetricTree', 'min_data_in_leaf': 57}. Best is trial 726 with value: 37144.045766835996.[0m
[32m[I 2024-10-13 01:41:25,706][0m Trial 863 finished with value: 47675.12249036737 and parameters: {'depth': 8, 'learning_rate': 0.2548025372505156, 'iterations': 153, 'l2_leaf_reg': 0.972107841765673, 'border_count': 236, 'bagging_temperature': 0.030879238922706328, 'random_strength': 9.993869767857252, 'grow_policy': 'SymmetricTree', 'min_data_in_leaf': 93}. Best is trial 726 with value: 37144.045766835996.[0m
[32m[I 2024-10-13 01:41:26,550][0m Trial 864 finished with value: 54871.94177113119 and parameters: {'depth': 9, 'learning_rate': 0.22864157258282053, 'iterations': 239, 'l2_leaf_reg': 0.6572309320132429, 'border_count': 245, 'bagging_temperature': 0.016722593886718127, 'random_strength': 9.459062355385026, 'grow_policy': 'Depthwise', 'min_data_in_leaf': 64}. Best is trial 726 with value: 37144.045766835996.[0m
[32m[I 2024-10-13 01:41:27,738][0m Trial 865 finished with value: 47099.57245786819 and parameters: {'depth': 9, 'learning_rate': 0.1551019631846726, 'iterations': 229, 'l2_leaf_reg': 1.0491293306882024, 'border_count': 231, 'bagging_temperature': 0.47546688198751214, 'random_strength': 9.244139943205539, 'grow_policy': 'SymmetricTree', 'min_data_in_leaf': 39}. Best is trial 726 with value: 37144.045766835996.[0m
[32m[I 2024-10-13 01:41:28,783][0m Trial 866 finished with value: 48786.60960511838 and parameters: {'depth': 8, 'learning_rate': 0.20269003703167057, 'iterations': 219, 'l2_leaf_reg': 0.6396750680646295, 'border_count': 237, 'bagging_temperature': 0.00013671800216255928, 'random_strength': 9.697492610337475, 'grow_policy': 'SymmetricTree', 'min_data_in_leaf': 87}. Best is trial 726 with value: 37144.045766835996.[0m
[32m[I 2024-10-13 01:41:29,695][0m Trial 867 finished with value: 40487.0366444784 and parameters: {'depth': 9, 'learning_rate': 0.257994861632446, 'iterations': 147, 'l2_leaf_reg': 2.7717934438450125, 'border_count': 242, 'bagging_temperature': 0.035951564057504576, 'random_strength': 9.173327019627347, 'grow_policy': 'SymmetricTree', 'min_data_in_leaf': 74}. Best is trial 726 with value: 37144.045766835996.[0m
[32m[I 2024-10-13 01:41:30,828][0m Trial 868 finished with value: 48225.60896701986 and parameters: {'depth': 9, 'learning_rate': 0.17263980331283627, 'iterations': 216, 'l2_leaf_reg': 0.4784078601387408, 'border_count': 232, 'bagging_temperature': 0.054653407372641155, 'random_strength': 9.448735964958225, 'grow_policy': 'SymmetricTree', 'min_data_in_leaf': 992}. Best is trial 726 with value: 37144.045766835996.[0m
[32m[I 2024-10-13 01:41:32,067][0m Trial 869 finished with value: 43460.67645384374 and parameters: {'depth': 9, 'learning_rate': 0.29999804711235406, 'iterations': 227, 'l2_leaf_reg': 0.5359014048521993, 'border_count': 250, 'bagging_temperature': 0.019887614461131593, 'random_strength': 9.79552548196677, 'grow_policy': 'SymmetricTree', 'min_data_in_leaf': 89}. Best is trial 726 with value: 37144.045766835996.[0m
[32m[I 2024-10-13 01:41:32,923][0m Trial 870 finished with value: 47338.88815964558 and parameters: {'depth': 9, 'learning_rate': 0.22921944393472066, 'iterations': 102, 'l2_leaf_reg': 1.591855950189547, 'border_count': 237, 'bagging_temperature': 0.08583082098483394, 'random_strength': 9.618019345323901, 'grow_policy': 'SymmetricTree', 'min_data_in_leaf': 98}. Best is trial 726 with value: 37144.045766835996.[0m
[32m[I 2024-10-13 01:41:33,784][0m Trial 871 finished with value: 39106.0869279793 and parameters: {'depth': 9, 'learning_rate': 0.25468497645589455, 'iterations': 100, 'l2_leaf_reg': 1.0086193642192263, 'border_count': 242, 'bagging_temperature': 0.035910658046129876, 'random_strength': 9.381372443175568, 'grow_policy': 'SymmetricTree', 'min_data_in_leaf': 56}. Best is trial 726 with value: 37144.045766835996.[0m
[32m[I 2024-10-13 01:41:34,870][0m Trial 872 finished with value: 48907.02797548462 and parameters: {'depth': 9, 'learning_rate': 0.20281861742572918, 'iterations': 171, 'l2_leaf_reg': 0.7749247276062953, 'border_count': 230, 'bagging_temperature': 0.06383286068532676, 'random_strength': 9.844522720175929, 'grow_policy': 'SymmetricTree', 'min_data_in_leaf': 36}. Best is trial 726 with value: 37144.045766835996.[0m
[32m[I 2024-10-13 01:41:36,192][0m Trial 873 finished with value: 39170.561153035436 and parameters: {'depth': 9, 'learning_rate': 0.25022418706519123, 'iterations': 239, 'l2_leaf_reg': 0.4896499377987803, 'border_count': 154, 'bagging_temperature': 0.018047516852146474, 'random_strength': 9.125982144397693, 'grow_policy': 'SymmetricTree', 'min_data_in_leaf': 74}. Best is trial 726 with value: 37144.045766835996.[0m
[32m[I 2024-10-13 01:41:37,275][0m Trial 874 finished with value: 46596.92950358425 and parameters: {'depth': 9, 'learning_rate': 0.2613920608419715, 'iterations': 163, 'l2_leaf_reg': 1.387122641037042, 'border_count': 236, 'bagging_temperature': 0.045951588142498806, 'random_strength': 9.614347609632786, 'grow_policy': 'SymmetricTree', 'min_data_in_leaf': 99}. Best is trial 726 with value: 37144.045766835996.[0m
[32m[I 2024-10-13 01:41:38,592][0m Trial 875 finished with value: 39143.48211741133 and parameters: {'depth': 9, 'learning_rate': 0.202603868886169, 'iterations': 247, 'l2_leaf_reg': 0.5577597925429951, 'border_count': 255, 'bagging_temperature': 0.018616098903611808, 'random_strength': 9.39471002345284, 'grow_policy': 'SymmetricTree', 'min_data_in_leaf': 403}. Best is trial 726 with value: 37144.045766835996.[0m
