[32m[I 2024-10-13 01:33:54,243][0m Trial 669 finished with value: 47588.97075964137 and parameters: {'depth': 10, 'learning_rate': 0.2606951214466639, 'iterations': 320, 'l2_leaf_reg': 0.0006909915207686012, 'border_count': 203, 'bagging_temperature': 0.09935791651480617, 'random_strength': 9.282804552490889, 'grow_policy': 'SymmetricTree', 'min_data_in_leaf': 206}. Best is trial 441 with value: 37467.065243356185.[0m
[32m[I 2024-10-13 01:34:00,022][0m Trial 670 finished with value: 51931.64930240043 and parameters: {'depth': 11, 'learning_rate': 0.1796113355827269, 'iterations': 388, 'l2_leaf_reg': 0.00015018500276229357, 'border_count': 208, 'bagging_temperature': 0.22823869790056645, 'random_strength': 0.7929997950043086, 'grow_policy': 'SymmetricTree', 'min_data_in_leaf': 656}. Best is trial 441 with value: 37467.065243356185.[0m
[32m[I 2024-10-13 01:34:01,066][0m Trial 671 finished with value: 55540.54394158387 and parameters: {'depth': 10, 'learning_rate': 0.29831269106767677, 'iterations': 284, 'l2_leaf_reg': 0.001098866030937707, 'border_count': 214, 'bagging_temperature': 0.03556244331211776, 'random_strength': 8.780351358004543, 'grow_policy': 'Lossguide', 'min_data_in_leaf': 219, 'max_leaves': 240}. Best is trial 441 with value: 37467.065243356185.[0m
[32m[I 2024-10-13 01:34:04,814][0m Trial 672 finished with value: 46823.82673071335 and parameters: {'depth': 10, 'learning_rate': 0.22865650107790939, 'iterations': 409, 'l2_leaf_reg': 0.0004042216677144541, 'border_count': 226, 'bagging_temperature': 0.08095930941332788, 'random_strength': 8.352443031256493, 'grow_policy': 'SymmetricTree', 'min_data_in_leaf': 177}. Best is trial 441 with value: 37467.065243356185.[0m
[32m[I 2024-10-13 01:34:06,887][0m Trial 673 finished with value: 45719.34987571652 and parameters: {'depth': 9, 'learning_rate': 0.25062779451290357, 'iterations': 242, 'l2_leaf_reg': 5.46762179293038e-05, 'border_count': 235, 'bagging_temperature': 0.05324023291917779, 'random_strength': 9.354419452274431, 'grow_policy': 'SymmetricTree', 'min_data_in_leaf': 196}. Best is trial 441 with value: 37467.065243356185.[0m
[32m[I 2024-10-13 01:34:15,042][0m Trial 674 finished with value: 57257.074620142404 and parameters: {'depth': 9, 'learning_rate': 0.14751191274120581, 'iterations': 1281, 'l2_leaf_reg': 0.00014497164080898826, 'border_count': 229, 'bagging_temperature': 0.027830284528643973, 'random_strength': 9.006761946958084, 'grow_policy': 'SymmetricTree', 'min_data_in_leaf': 249}. Best is trial 441 with value: 37467.065243356185.[0m
[32m[I 2024-10-13 01:34:17,016][0m Trial 675 finished with value: 49319.08140889725 and parameters: {'depth': 10, 'learning_rate': 0.2983055274881749, 'iterations': 347, 'l2_leaf_reg': 0.00020016854050799985, 'border_count': 215, 'bagging_temperature': 0.05028896855139261, 'random_strength': 9.178199548523548, 'grow_policy': 'SymmetricTree', 'min_data_in_leaf': 177}. Best is trial 441 with value: 37467.065243356185.[0m
[32m[I 2024-10-13 01:34:19,501][0m Trial 676 finished with value: 42881.586146139656 and parameters: {'depth': 10, 'learning_rate': 0.19521032310015268, 'iterations': 496, 'l2_leaf_reg': 0.00041165296059636036, 'border_count': 224, 'bagging_temperature': 0.028417346928414695, 'random_strength': 9.410185754136142, 'grow_policy': 'SymmetricTree', 'min_data_in_leaf': 217}. Best is trial 441 with value: 37467.065243356185.[0m
[32m[I 2024-10-13 01:34:22,659][0m Trial 677 finished with value: 51452.19845579647 and parameters: {'depth': 11, 'learning_rate': 0.23392498235902104, 'iterations': 422, 'l2_leaf_reg': 0.048380615245340916, 'border_count': 231, 'bagging_temperature': 0.0714735638000513, 'random_strength': 9.99621740457969, 'grow_policy': 'SymmetricTree', 'min_data_in_leaf': 171}. Best is trial 441 with value: 37467.065243356185.[0m
[32m[I 2024-10-13 01:34:24,360][0m Trial 678 finished with value: 39594.61641876627 and parameters: {'depth': 10, 'learning_rate': 0.2593740992876277, 'iterations': 294, 'l2_leaf_reg': 0.00013777833952291997, 'border_count': 242, 'bagging_temperature': 0.03173491132650129, 'random_strength': 8.925683213844161, 'grow_policy': 'SymmetricTree', 'min_data_in_leaf': 58}. Best is trial 441 with value: 37467.065243356185.[0m
[32m[I 2024-10-13 01:34:25,521][0m Trial 679 finished with value: 45999.3343146537 and parameters: {'depth': 9, 'learning_rate': 0.1697707655575697, 'iterations': 225, 'l2_leaf_reg': 9.138280424058861e-05, 'border_count': 243, 'bagging_temperature': 0.05121013690355658, 'random_strength': 9.033006275455168, 'grow_policy': 'SymmetricTree', 'min_data_in_leaf': 64}. Best is trial 441 with value: 37467.065243356185.[0m
[32m[I 2024-10-13 01:34:27,292][0m Trial 680 finished with value: 42531.74286756621 and parameters: {'depth': 10, 'learning_rate': 0.20360563286837993, 'iterations': 309, 'l2_leaf_reg': 0.0005419387713834676, 'border_count': 235, 'bagging_temperature': 0.034690680499911176, 'random_strength': 9.248785828618464, 'grow_policy': 'SymmetricTree', 'min_data_in_leaf': 61}. Best is trial 441 with value: 37467.065243356185.[0m
[32m[I 2024-10-13 01:34:28,771][0m Trial 681 finished with value: 48044.72922591998 and parameters: {'depth': 10, 'learning_rate': 0.22709312971246323, 'iterations': 231, 'l2_leaf_reg': 0.00025889676969488134, 'border_count': 242, 'bagging_temperature': 0.06847270785731664, 'random_strength': 9.526600218853115, 'grow_policy': 'SymmetricTree', 'min_data_in_leaf': 49}. Best is trial 441 with value: 37467.065243356185.[0m
[32m[I 2024-10-13 01:34:29,647][0m Trial 682 finished with value: 51195.639853107 and parameters: {'depth': 9, 'learning_rate': 0.25430020980068085, 'iterations': 276, 'l2_leaf_reg': 0.00026672079515692996, 'border_count': 240, 'bagging_temperature': 0.020099264786451763, 'random_strength': 8.89457528426196, 'grow_policy': 'Depthwise', 'min_data_in_leaf': 58}. Best is trial 441 with value: 37467.065243356185.[0m
[32m[I 2024-10-13 01:34:31,364][0m Trial 683 finished with value: 47222.19227899751 and parameters: {'depth': 10, 'learning_rate': 0.18561034254838849, 'iterations': 309, 'l2_leaf_reg': 0.0004291680014444826, 'border_count': 242, 'bagging_temperature': 0.046621965656247114, 'random_strength': 9.18286200132573, 'grow_policy': 'SymmetricTree', 'min_data_in_leaf': 79}. Best is trial 441 with value: 37467.065243356185.[0m
[32m[I 2024-10-13 01:34:32,879][0m Trial 684 finished with value: 45550.228330170685 and parameters: {'depth': 9, 'learning_rate': 0.25980653945867327, 'iterations': 357, 'l2_leaf_reg': 0.0001838607670318564, 'border_count': 209, 'bagging_temperature': 0.09354091054720601, 'random_strength': 9.376765348642426, 'grow_policy': 'SymmetricTree', 'min_data_in_leaf': 255}. Best is trial 441 with value: 37467.065243356185.[0m
[32m[I 2024-10-13 01:34:34,462][0m Trial 685 finished with value: 46604.65075930684 and parameters: {'depth': 10, 'learning_rate': 0.21226518919723508, 'iterations': 279, 'l2_leaf_reg': 0.0002313012906621787, 'border_count': 237, 'bagging_temperature': 0.6808332187548642, 'random_strength': 9.654602857242708, 'grow_policy': 'SymmetricTree', 'min_data_in_leaf': 195}. Best is trial 441 with value: 37467.065243356185.[0m
[32m[I 2024-10-13 01:34:36,418][0m Trial 686 finished with value: 40142.128983054405 and parameters: {'depth': 10, 'learning_rate': 0.2604698964266571, 'iterations': 368, 'l2_leaf_reg': 0.00022568499430231312, 'border_count': 204, 'bagging_temperature': 0.020142209175795376, 'random_strength': 8.984333132713589, 'grow_policy': 'SymmetricTree', 'min_data_in_leaf': 227}. Best is trial 441 with value: 37467.065243356185.[0m
[32m[I 2024-10-13 01:34:55,286][0m Trial 687 finished with value: 55003.940509787215 and parameters: {'depth': 11, 'learning_rate': 0.14933328463722031, 'iterations': 1628, 'l2_leaf_reg': 0.00011583816127622065, 'border_count': 216, 'bagging_temperature': 0.03987959059073604, 'random_strength': 9.404991182420595, 'grow_policy': 'SymmetricTree', 'min_data_in_leaf': 56}. Best is trial 441 with value: 37467.065243356185.[0m
[32m[I 2024-10-13 01:34:56,670][0m Trial 688 finished with value: 66555.17845698135 and parameters: {'depth': 10, 'learning_rate': 0.004830184064863287, 'iterations': 226, 'l2_leaf_reg': 0.0004470884791735761, 'border_count': 220, 'bagging_temperature': 0.06084785046640784, 'random_strength': 9.146032369256464, 'grow_policy': 'SymmetricTree', 'min_data_in_leaf': 96}. Best is trial 441 with value: 37467.065243356185.[0m
[32m[I 2024-10-13 01:34:58,085][0m Trial 689 finished with value: 45572.285985400355 and parameters: {'depth': 9, 'learning_rate': 0.21869604297368014, 'iterations': 319, 'l2_leaf_reg': 6.984845949330553e-05, 'border_count': 236, 'bagging_temperature': 0.019340625715473805, 'random_strength': 8.74173113005936, 'grow_policy': 'SymmetricTree', 'min_data_in_leaf': 82}. Best is trial 441 with value: 37467.065243356185.[0m
[32m[I 2024-10-13 01:34:59,383][0m Trial 690 finished with value: 46257.545259437684 and parameters: {'depth': 8, 'learning_rate': 0.2985977173757955, 'iterations': 384, 'l2_leaf_reg': 0.00011799365631425248, 'border_count': 212, 'bagging_temperature': 0.03479031561122109, 'random_strength': 9.566499956775282, 'grow_policy': 'SymmetricTree', 'min_data_in_leaf': 202}. Best is trial 441 with value: 37467.065243356185.[0m
[32m[I 2024-10-13 01:35:01,140][0m Trial 691 finished with value: 48884.447312986915 and parameters: {'depth': 10, 'learning_rate': 0.17659934809018835, 'iterations': 304, 'l2_leaf_reg': 0.0003867720994419355, 'border_count': 222, 'bagging_temperature': 0.08052482493361915, 'random_strength': 9.7924850911806, 'grow_policy': 'SymmetricTree', 'min_data_in_leaf': 180}. Best is trial 441 with value: 37467.065243356185.[0m
[32m[I 2024-10-13 01:35:03,195][0m Trial 692 finished with value: 40158.78314303231 and parameters: {'depth': 10, 'learning_rate': 0.2594356863280432, 'iterations': 390, 'l2_leaf_reg': 0.00014352662025320968, 'border_count': 232, 'bagging_temperature': 0.01865876764064424, 'random_strength': 9.2648932606165, 'grow_policy': 'SymmetricTree', 'min_data_in_leaf': 218}. Best is trial 441 with value: 37467.065243356185.[0m
[32m[I 2024-10-13 01:35:03,904][0m Trial 693 finished with value: 50925.84338622589 and parameters: {'depth': 11, 'learning_rate': 0.015014177435181915, 'iterations': 235, 'l2_leaf_reg': 0.00017398362594421384, 'border_count': 242, 'bagging_temperature': 0.04978487862036904, 'random_strength': 8.932880219022147, 'grow_policy': 'Lossguide', 'min_data_in_leaf': 81, 'max_leaves': 56}. Best is trial 441 with value: 37467.065243356185.[0m
[32m[I 2024-10-13 01:35:42,954][0m Trial 694 finished with value: 56669.72238073325 and parameters: {'depth': 10, 'learning_rate': 0.22783418559406665, 'iterations': 2704, 'l2_leaf_reg': 0.0008048339164196717, 'border_count': 226, 'bagging_temperature': 0.8220196337081618, 'random_strength': 9.494404835903195, 'grow_policy': 'SymmetricTree', 'min_data_in_leaf': 282}. Best is trial 441 with value: 37467.065243356185.[0m
[32m[I 2024-10-13 01:35:50,798][0m Trial 695 finished with value: 46172.62813076046 and parameters: {'depth': 13, 'learning_rate': 0.20195801156660748, 'iterations': 348, 'l2_leaf_reg': 4.159000163384099e-05, 'border_count': 194, 'bagging_temperature': 0.017282082293924233, 'random_strength': 9.085264286531125, 'grow_policy': 'SymmetricTree', 'min_data_in_leaf': 396}. Best is trial 441 with value: 37467.065243356185.[0m
[32m[I 2024-10-13 01:35:52,447][0m Trial 696 finished with value: 38490.689199177665 and parameters: {'depth': 9, 'learning_rate': 0.2989504764609876, 'iterations': 446, 'l2_leaf_reg': 0.0003076295779154467, 'border_count': 130, 'bagging_temperature': 0.03585373952293761, 'random_strength': 9.681115528795033, 'grow_policy': 'SymmetricTree', 'min_data_in_leaf': 161}. Best is trial 441 with value: 37467.065243356185.[0m
[32m[I 2024-10-13 01:35:56,475][0m Trial 697 finished with value: 52008.75266751917 and parameters: {'depth': 8, 'learning_rate': 0.29857700752782507, 'iterations': 570, 'l2_leaf_reg': 0.00020114893292370683, 'border_count': 238, 'bagging_temperature': 0.0611505416289468, 'random_strength': 9.866557084556861, 'grow_policy': 'SymmetricTree', 'min_data_in_leaf': 158}. Best is trial 441 with value: 37467.065243356185.[0m
[32m[I 2024-10-13 01:35:58,441][0m Trial 698 finished with value: 49892.84333318672 and parameters: {'depth': 9, 'learning_rate': 0.2624087656825669, 'iterations': 486, 'l2_leaf_reg': 0.0003027740300053904, 'border_count': 35, 'bagging_temperature': 0.12651984584831857, 'random_strength': 9.73055560592918, 'grow_policy': 'SymmetricTree', 'min_data_in_leaf': 98}. Best is trial 441 with value: 37467.065243356185.[0m
[32m[I 2024-10-13 01:36:02,276][0m Trial 699 finished with value: 52405.64725787136 and parameters: {'depth': 9, 'learning_rate': 0.26317019310711015, 'iterations': 526, 'l2_leaf_reg': 0.00010073393812580442, 'border_count': 25, 'bagging_temperature': 0.00044714279870548823, 'random_strength': 9.647579590287426, 'grow_policy': 'SymmetricTree', 'min_data_in_leaf': 59}. Best is trial 441 with value: 37467.065243356185.[0m
[32m[I 2024-10-13 01:36:04,066][0m Trial 700 finished with value: 45505.31939171579 and parameters: {'depth': 9, 'learning_rate': 0.2512913036886359, 'iterations': 435, 'l2_leaf_reg': 0.0002662250315015925, 'border_count': 233, 'bagging_temperature': 0.030294147367997227, 'random_strength': 9.839769368035483, 'grow_policy': 'SymmetricTree', 'min_data_in_leaf': 154}. Best is trial 441 with value: 37467.065243356185.[0m
[32m[I 2024-10-13 01:36:05,859][0m Trial 701 finished with value: 51790.93990936396 and parameters: {'depth': 9, 'learning_rate': 0.22578248919481006, 'iterations': 438, 'l2_leaf_reg': 0.00036698507333364326, 'border_count': 73, 'bagging_temperature': 0.04356324926616099, 'random_strength': 9.520273312709897, 'grow_policy': 'SymmetricTree', 'min_data_in_leaf': 101}. Best is trial 441 with value: 37467.065243356185.[0m
[32m[I 2024-10-13 01:36:12,677][0m Trial 702 finished with value: 54263.74554572837 and parameters: {'depth': 9, 'learning_rate': 0.270860151642962, 'iterations': 1894, 'l2_leaf_reg': 0.00029166257208720106, 'border_count': 50, 'bagging_temperature': 0.016414975210839233, 'random_strength': 9.871979968906427, 'grow_policy': 'SymmetricTree', 'min_data_in_leaf': 188}. Best is trial 441 with value: 37467.065243356185.[0m
[32m[I 2024-10-13 01:36:14,601][0m Trial 703 finished with value: 50477.69974639796 and parameters: {'depth': 9, 'learning_rate': 0.2008241822209672, 'iterations': 483, 'l2_leaf_reg': 0.0007291101166555643, 'border_count': 94, 'bagging_temperature': 0.06855040923133121, 'random_strength': 9.647845151774535, 'grow_policy': 'SymmetricTree', 'min_data_in_leaf': 68}. Best is trial 441 with value: 37467.065243356185.[0m
[32m[I 2024-10-13 01:36:16,453][0m Trial 704 finished with value: 42442.08806629001 and parameters: {'depth': 9, 'learning_rate': 0.2990420858527275, 'iterations': 412, 'l2_leaf_reg': 0.000167211597029662, 'border_count': 229, 'bagging_temperature': 0.6495089430146394, 'random_strength': 9.982033004595516, 'grow_policy': 'SymmetricTree', 'min_data_in_leaf': 161}. Best is trial 441 with value: 37467.065243356185.[0m
[32m[I 2024-10-13 01:36:17,988][0m Trial 705 finished with value: 47937.69153610644 and parameters: {'depth': 8, 'learning_rate': 0.23401240735033232, 'iterations': 450, 'l2_leaf_reg': 0.0005366624235435636, 'border_count': 128, 'bagging_temperature': 0.033209605559605865, 'random_strength': 9.346212949050464, 'grow_policy': 'SymmetricTree', 'min_data_in_leaf': 238}. Best is trial 441 with value: 37467.065243356185.[0m
[32m[I 2024-10-13 01:36:19,008][0m Trial 706 finished with value: 54595.08768794888 and parameters: {'depth': 9, 'learning_rate': 0.2593416810961981, 'iterations': 555, 'l2_leaf_reg': 0.00015864675570567775, 'border_count': 159, 'bagging_temperature': 0.01789763318758127, 'random_strength': 9.487470941764633, 'grow_policy': 'Depthwise', 'min_data_in_leaf': 127}. Best is trial 441 with value: 37467.065243356185.[0m
[32m[I 2024-10-13 01:36:20,781][0m Trial 707 finished with value: 44471.3468028645 and parameters: {'depth': 9, 'learning_rate': 0.2964193517686489, 'iterations': 383, 'l2_leaf_reg': 0.00022612155292531756, 'border_count': 224, 'bagging_temperature': 0.04784573015565874, 'random_strength': 9.660961583153616, 'grow_policy': 'SymmetricTree', 'min_data_in_leaf': 717}. Best is trial 441 with value: 37467.065243356185.[0m
[32m[I 2024-10-13 01:36:22,660][0m Trial 708 finished with value: 44744.412955983775 and parameters: {'depth': 9, 'learning_rate': 0.2999517457383336, 'iterations': 480, 'l2_leaf_reg': 0.00011270988766138735, 'border_count': 239, 'bagging_temperature': 0.0850523777624324, 'random_strength': 9.334899372973172, 'grow_policy': 'SymmetricTree', 'min_data_in_leaf': 89}. Best is trial 441 with value: 37467.065243356185.[0m
[32m[I 2024-10-13 01:36:24,879][0m Trial 709 finished with value: 41795.82987504479 and parameters: {'depth': 10, 'learning_rate': 0.18544484084022256, 'iterations': 369, 'l2_leaf_reg': 0.18438150364915093, 'border_count': 168, 'bagging_temperature': 0.015113881348769705, 'random_strength': 8.799256312862598, 'grow_policy': 'SymmetricTree', 'min_data_in_leaf': 211}. Best is trial 441 with value: 37467.065243356185.[0m
[32m[I 2024-10-13 01:36:29,572][0m Trial 710 finished with value: 53879.195284794514 and parameters: {'depth': 9, 'learning_rate': 0.2341323610429564, 'iterations': 653, 'l2_leaf_reg': 0.00046283520843934275, 'border_count': 231, 'bagging_temperature': 0.0547588572432119, 'random_strength': 9.777459362327695, 'grow_policy': 'SymmetricTree', 'min_data_in_leaf': 262}. Best is trial 441 with value: 37467.065243356185.[0m
[32m[I 2024-10-13 01:36:31,724][0m Trial 711 finished with value: 42364.30194795995 and parameters: {'depth': 10, 'learning_rate': 0.20727318371783268, 'iterations': 418, 'l2_leaf_reg': 0.00020338949422704755, 'border_count': 183, 'bagging_temperature': 0.029308954445392457, 'random_strength': 9.435465932957532, 'grow_policy': 'SymmetricTree', 'min_data_in_leaf': 144}. Best is trial 441 with value: 37467.065243356185.[0m
[32m[I 2024-10-13 01:36:38,292][0m Trial 712 finished with value: 49451.88746567447 and parameters: {'depth': 10, 'learning_rate': 0.2995711592716266, 'iterations': 529, 'l2_leaf_reg': 7.219771323725577e-05, 'border_count': 219, 'bagging_temperature': 0.015905432279856437, 'random_strength': 9.059992728614885, 'grow_policy': 'SymmetricTree', 'min_data_in_leaf': 105}. Best is trial 441 with value: 37467.065243356185.[0m
[32m[I 2024-10-13 01:36:39,635][0m Trial 713 finished with value: 50134.97836207053 and parameters: {'depth': 8, 'learning_rate': 0.16116939276501524, 'iterations': 339, 'l2_leaf_reg': 0.0003594245996936668, 'border_count': 226, 'bagging_temperature': 0.0008650227408537742, 'random_strength': 9.977794530312314, 'grow_policy': 'SymmetricTree', 'min_data_in_leaf': 167}. Best is trial 441 with value: 37467.065243356185.[0m
[32m[I 2024-10-13 01:36:42,444][0m Trial 714 finished with value: 41299.30838834371 and parameters: {'depth': 9, 'learning_rate': 0.2563790845985545, 'iterations': 417, 'l2_leaf_reg': 0.17714643374100497, 'border_count': 243, 'bagging_temperature': 0.03900392874981992, 'random_strength': 9.612700403637033, 'grow_policy': 'SymmetricTree', 'min_data_in_leaf': 197}. Best is trial 441 with value: 37467.065243356185.[0m
[32m[I 2024-10-13 01:36:46,858][0m Trial 715 finished with value: 46765.04107948538 and parameters: {'depth': 10, 'learning_rate': 0.2991278998593416, 'iterations': 454, 'l2_leaf_reg': 0.3196865514430357, 'border_count': 110, 'bagging_temperature': 0.06592029896426457, 'random_strength': 8.71253052220173, 'grow_policy': 'SymmetricTree', 'min_data_in_leaf': 134}. Best is trial 441 with value: 37467.065243356185.[0m
[32m[I 2024-10-13 01:37:01,986][0m Trial 716 finished with value: 55284.45277795571 and parameters: {'depth': 9, 'learning_rate': 0.22438047115653906, 'iterations': 2185, 'l2_leaf_reg': 0.0009749948701670751, 'border_count': 235, 'bagging_temperature': 0.03571191360257145, 'random_strength': 8.523522453189265, 'grow_policy': 'SymmetricTree', 'min_data_in_leaf': 682}. Best is trial 441 with value: 37467.065243356185.[0m
[32m[I 2024-10-13 01:37:02,834][0m Trial 717 finished with value: 52026.55285869929 and parameters: {'depth': 10, 'learning_rate': 0.19836668816024072, 'iterations': 350, 'l2_leaf_reg': 0.0003319856115139523, 'border_count': 59, 'bagging_temperature': 0.09840408322385678, 'random_strength': 9.257064022967603, 'grow_policy': 'Lossguide', 'min_data_in_leaf': 73, 'max_leaves': 195}. Best is trial 441 with value: 37467.065243356185.[0m
[32m[I 2024-10-13 01:37:12,322][0m Trial 718 finished with value: 53309.63063962862 and parameters: {'depth': 10, 'learning_rate': 0.2532291944425514, 'iterations': 514, 'l2_leaf_reg': 0.15152545495317438, 'border_count': 137, 'bagging_temperature': 0.01573353866532252, 'random_strength': 8.93882279719707, 'grow_policy': 'SymmetricTree', 'min_data_in_leaf': 177}. Best is trial 441 with value: 37467.065243356185.[0m
[32m[I 2024-10-13 01:37:13,940][0m Trial 719 finished with value: 49325.29060592683 and parameters: {'depth': 9, 'learning_rate': 0.22706067389138188, 'iterations': 395, 'l2_leaf_reg': 0.5438763069762359, 'border_count': 221, 'bagging_temperature': 0.0529734415920019, 'random_strength': 9.490596109683, 'grow_policy': 'SymmetricTree', 'min_data_in_leaf': 113}. Best is trial 441 with value: 37467.065243356185.[0m
