[32m[I 2024-10-13 08:01:57,148][0m Trial 351 finished with value: 3508.062919860539 and parameters: {'depth': 7, 'learning_rate': 0.23616087604628036, 'iterations': 2890, 'l2_leaf_reg': 1.1710847900065243e-06, 'border_count': 55, 'bagging_temperature': 0.6580426449053092, 'random_strength': 0.16945304256397486, 'grow_policy': 'Depthwise', 'min_data_in_leaf': 221}. Best is trial 243 with value: 2588.074208285989.[0m
[32m[I 2024-10-13 08:02:02,126][0m Trial 352 finished with value: 8940.264202405182 and parameters: {'depth': 7, 'learning_rate': 0.1818287756387676, 'iterations': 3000, 'l2_leaf_reg': 0.004556548712338772, 'border_count': 6, 'bagging_temperature': 0.5859473891806479, 'random_strength': 0.46219605536344566, 'grow_policy': 'Lossguide', 'min_data_in_leaf': 183, 'max_leaves': 40}. Best is trial 243 with value: 2588.074208285989.[0m
[32m[I 2024-10-13 08:02:05,358][0m Trial 353 finished with value: 2799.654016803068 and parameters: {'depth': 8, 'learning_rate': 0.26827074411916807, 'iterations': 2802, 'l2_leaf_reg': 0.00012629150196343488, 'border_count': 45, 'bagging_temperature': 0.5622789604740126, 'random_strength': 0.6953864481809653, 'grow_policy': 'Lossguide', 'min_data_in_leaf': 151, 'max_leaves': 43}. Best is trial 243 with value: 2588.074208285989.[0m
[32m[I 2024-10-13 08:02:10,528][0m Trial 354 finished with value: 4926.285468199851 and parameters: {'depth': 7, 'learning_rate': 0.03521855531758233, 'iterations': 2804, 'l2_leaf_reg': 0.00010541282326991509, 'border_count': 50, 'bagging_temperature': 0.52689320512061, 'random_strength': 0.9344198635273517, 'grow_policy': 'Lossguide', 'min_data_in_leaf': 495, 'max_leaves': 92}. Best is trial 243 with value: 2588.074208285989.[0m
[32m[I 2024-10-13 08:02:15,738][0m Trial 355 finished with value: 4962.786385003841 and parameters: {'depth': 8, 'learning_rate': 0.21703806462088998, 'iterations': 2934, 'l2_leaf_reg': 7.147779289054775e-05, 'border_count': 37, 'bagging_temperature': 0.5590443095233832, 'random_strength': 0.7571453883177144, 'grow_policy': 'Lossguide', 'min_data_in_leaf': 109, 'max_leaves': 44}. Best is trial 243 with value: 2588.074208285989.[0m
[32m[I 2024-10-13 08:02:20,643][0m Trial 356 finished with value: 4450.380396115373 and parameters: {'depth': 9, 'learning_rate': 0.29764312190850883, 'iterations': 2861, 'l2_leaf_reg': 0.0001644005530926423, 'border_count': 57, 'bagging_temperature': 0.5425787761734229, 'random_strength': 6.424667408515308, 'grow_policy': 'Lossguide', 'min_data_in_leaf': 138, 'max_leaves': 72}. Best is trial 243 with value: 2588.074208285989.[0m
[32m[I 2024-10-13 08:02:25,502][0m Trial 357 finished with value: 5279.617655231055 and parameters: {'depth': 7, 'learning_rate': 0.1888428858828021, 'iterations': 2795, 'l2_leaf_reg': 4.784237383429575e-05, 'border_count': 29, 'bagging_temperature': 0.5650400981732643, 'random_strength': 1.405046227704415, 'grow_policy': 'Lossguide', 'min_data_in_leaf': 151, 'max_leaves': 43}. Best is trial 243 with value: 2588.074208285989.[0m
[32m[I 2024-10-13 08:02:26,584][0m Trial 358 finished with value: 5039.947813540528 and parameters: {'depth': 8, 'learning_rate': 0.23111094720572484, 'iterations': 576, 'l2_leaf_reg': 0.00013392465391847118, 'border_count': 41, 'bagging_temperature': 0.6107547893259441, 'random_strength': 0.3394975526247312, 'grow_policy': 'Lossguide', 'min_data_in_leaf': 118, 'max_leaves': 48}. Best is trial 243 with value: 2588.074208285989.[0m
[32m[I 2024-10-13 08:02:31,219][0m Trial 359 finished with value: 3267.503497208173 and parameters: {'depth': 7, 'learning_rate': 0.15929655245984672, 'iterations': 2900, 'l2_leaf_reg': 0.00022106096079521642, 'border_count': 45, 'bagging_temperature': 0.6305706680114568, 'random_strength': 1.1619547610382706, 'grow_policy': 'Lossguide', 'min_data_in_leaf': 179, 'max_leaves': 38}. Best is trial 243 with value: 2588.074208285989.[0m
[32m[I 2024-10-13 08:02:35,820][0m Trial 360 finished with value: 4462.2932135777055 and parameters: {'depth': 7, 'learning_rate': 0.2631789598262681, 'iterations': 2650, 'l2_leaf_reg': 3.256426712865942e-05, 'border_count': 51, 'bagging_temperature': 0.5130814616438625, 'random_strength': 0.7192397699844921, 'grow_policy': 'Lossguide', 'min_data_in_leaf': 132, 'max_leaves': 42}. Best is trial 243 with value: 2588.074208285989.[0m
[32m[I 2024-10-13 08:02:40,836][0m Trial 361 finished with value: 3974.0815555001673 and parameters: {'depth': 7, 'learning_rate': 0.19944139748435713, 'iterations': 2946, 'l2_leaf_reg': 7.784666859856352e-06, 'border_count': 61, 'bagging_temperature': 0.6509312283191035, 'random_strength': 0.022592450889355256, 'grow_policy': 'Lossguide', 'min_data_in_leaf': 98, 'max_leaves': 234}. Best is trial 243 with value: 2588.074208285989.[0m
[32m[I 2024-10-13 08:02:45,468][0m Trial 362 finished with value: 23921.081900535162 and parameters: {'depth': 8, 'learning_rate': 0.00013998557481219784, 'iterations': 2768, 'l2_leaf_reg': 6.615217206005201e-05, 'border_count': 41, 'bagging_temperature': 0.6039540531035636, 'random_strength': 0.870305438938979, 'grow_policy': 'Lossguide', 'min_data_in_leaf': 155, 'max_leaves': 36}. Best is trial 243 with value: 2588.074208285989.[0m
[32m[I 2024-10-13 08:02:49,940][0m Trial 363 finished with value: 4306.298171720528 and parameters: {'depth': 7, 'learning_rate': 0.004699526265289046, 'iterations': 2847, 'l2_leaf_reg': 2.7569219476496245e-05, 'border_count': 34, 'bagging_temperature': 0.6784389326290872, 'random_strength': 0.23459879760421148, 'grow_policy': 'Lossguide', 'min_data_in_leaf': 132, 'max_leaves': 46}. Best is trial 243 with value: 2588.074208285989.[0m
[32m[I 2024-10-13 08:02:52,293][0m Trial 364 finished with value: 2883.333413771301 and parameters: {'depth': 7, 'learning_rate': 0.2968207088902653, 'iterations': 1163, 'l2_leaf_reg': 8.762631113037926e-05, 'border_count': 47, 'bagging_temperature': 0.5606693926250571, 'random_strength': 0.6586811185565815, 'grow_policy': 'Lossguide', 'min_data_in_leaf': 177, 'max_leaves': 51}. Best is trial 243 with value: 2588.074208285989.[0m
[32m[I 2024-10-13 08:02:55,548][0m Trial 365 finished with value: 3822.116480443425 and parameters: {'depth': 8, 'learning_rate': 0.22936820925906196, 'iterations': 2627, 'l2_leaf_reg': 3.7130305352577278e-06, 'border_count': 52, 'bagging_temperature': 0.11760151363565996, 'random_strength': 0.4366380230614386, 'grow_policy': 'Lossguide', 'min_data_in_leaf': 111, 'max_leaves': 39}. Best is trial 243 with value: 2588.074208285989.[0m
[32m[I 2024-10-13 08:03:00,720][0m Trial 366 finished with value: 6480.05968673551 and parameters: {'depth': 7, 'learning_rate': 0.2999130967322675, 'iterations': 2950, 'l2_leaf_reg': 1.1423287191658713e-05, 'border_count': 40, 'bagging_temperature': 0.5858275686988998, 'random_strength': 0.9544948659555043, 'grow_policy': 'Lossguide', 'min_data_in_leaf': 157, 'max_leaves': 44}. Best is trial 243 with value: 2588.074208285989.[0m
[32m[I 2024-10-13 08:03:05,417][0m Trial 367 finished with value: 2557.3553637654795 and parameters: {'depth': 8, 'learning_rate': 0.18596795810372233, 'iterations': 2753, 'l2_leaf_reg': 3.3467978028040076e-05, 'border_count': 45, 'bagging_temperature': 0.6289069618121937, 'random_strength': 0.16672645677321637, 'grow_policy': 'Lossguide', 'min_data_in_leaf': 95, 'max_leaves': 63}. Best is trial 367 with value: 2557.3553637654795.[0m
[32m[I 2024-10-13 08:03:10,341][0m Trial 368 finished with value: 5155.266953088786 and parameters: {'depth': 8, 'learning_rate': 0.15092781827186702, 'iterations': 2823, 'l2_leaf_reg': 4.310983942914779e-05, 'border_count': 36, 'bagging_temperature': 0.6407259425838896, 'random_strength': 0.008047336589463383, 'grow_policy': 'Lossguide', 'min_data_in_leaf': 198, 'max_leaves': 63}. Best is trial 367 with value: 2557.3553637654795.[0m
[32m[I 2024-10-13 08:03:15,370][0m Trial 369 finished with value: 2808.4758529980363 and parameters: {'depth': 7, 'learning_rate': 0.16177789442157375, 'iterations': 2750, 'l2_leaf_reg': 3.825110498909075e-05, 'border_count': 45, 'bagging_temperature': 0.6697335249083896, 'random_strength': 0.177451260763642, 'grow_policy': 'Lossguide', 'min_data_in_leaf': 86, 'max_leaves': 57}. Best is trial 367 with value: 2557.3553637654795.[0m
[32m[I 2024-10-13 08:03:21,317][0m Trial 370 finished with value: 2890.877992077539 and parameters: {'depth': 7, 'learning_rate': 0.16412739770454965, 'iterations': 2884, 'l2_leaf_reg': 0.00011847916470582546, 'border_count': 57, 'bagging_temperature': 0.6752501254219138, 'random_strength': 0.0043622846609774335, 'grow_policy': 'Lossguide', 'min_data_in_leaf': 75, 'max_leaves': 68}. Best is trial 367 with value: 2557.3553637654795.[0m
[32m[I 2024-10-13 08:03:26,605][0m Trial 371 finished with value: 3353.237387934092 and parameters: {'depth': 7, 'learning_rate': 0.13750195078582514, 'iterations': 2782, 'l2_leaf_reg': 5.5872291170015354e-05, 'border_count': 51, 'bagging_temperature': 0.6682105123727543, 'random_strength': 0.2188689075515517, 'grow_policy': 'Lossguide', 'min_data_in_leaf': 88, 'max_leaves': 62}. Best is trial 367 with value: 2557.3553637654795.[0m
[32m[I 2024-10-13 08:03:33,062][0m Trial 372 finished with value: 4991.628078767174 and parameters: {'depth': 7, 'learning_rate': 0.1649650351861473, 'iterations': 2880, 'l2_leaf_reg': 3.448010063336647e-05, 'border_count': 29, 'bagging_temperature': 0.6537833946376809, 'random_strength': 0.22695802522928515, 'grow_policy': 'Lossguide', 'min_data_in_leaf': 61, 'max_leaves': 59}. Best is trial 367 with value: 2557.3553637654795.[0m
[32m[I 2024-10-13 08:03:52,483][0m Trial 373 finished with value: 4247.679364417958 and parameters: {'depth': 7, 'learning_rate': 0.18627535581602978, 'iterations': 2743, 'l2_leaf_reg': 6.280382297436447e-05, 'border_count': 41, 'bagging_temperature': 0.6263988621289281, 'random_strength': 0.18202664263461893, 'grow_policy': 'SymmetricTree', 'min_data_in_leaf': 94}. Best is trial 367 with value: 2557.3553637654795.[0m
[32m[I 2024-10-13 08:03:57,175][0m Trial 374 finished with value: 2975.7905781187496 and parameters: {'depth': 6, 'learning_rate': 0.182478085104513, 'iterations': 2998, 'l2_leaf_reg': 4.2124273720382486e-05, 'border_count': 46, 'bagging_temperature': 0.6906650514814546, 'random_strength': 0.3814931197537552, 'grow_policy': 'Lossguide', 'min_data_in_leaf': 116, 'max_leaves': 65}. Best is trial 367 with value: 2557.3553637654795.[0m
[32m[I 2024-10-13 08:04:01,871][0m Trial 375 finished with value: 4880.698150591178 and parameters: {'depth': 7, 'learning_rate': 0.13002332443501022, 'iterations': 2832, 'l2_leaf_reg': 2.480276990671741e-05, 'border_count': 37, 'bagging_temperature': 0.637402458424282, 'random_strength': 0.00017779782438909209, 'grow_policy': 'Depthwise', 'min_data_in_leaf': 138}. Best is trial 367 with value: 2557.3553637654795.[0m
[32m[I 2024-10-13 08:04:08,306][0m Trial 376 finished with value: 3232.283222017632 and parameters: {'depth': 7, 'learning_rate': 0.20449227409990337, 'iterations': 2465, 'l2_leaf_reg': 4.0685300321832345e-05, 'border_count': 53, 'bagging_temperature': 0.6145346817992934, 'random_strength': 0.37063619624299865, 'grow_policy': 'Lossguide', 'min_data_in_leaf': 45, 'max_leaves': 56}. Best is trial 367 with value: 2557.3553637654795.[0m
[32m[I 2024-10-13 08:04:12,927][0m Trial 377 finished with value: 2661.873606101149 and parameters: {'depth': 7, 'learning_rate': 0.20588603702141847, 'iterations': 2697, 'l2_leaf_reg': 9.554417380861639e-05, 'border_count': 44, 'bagging_temperature': 0.6491121405310878, 'random_strength': 0.15678141476791774, 'grow_policy': 'Lossguide', 'min_data_in_leaf': 101, 'max_leaves': 53}. Best is trial 367 with value: 2557.3553637654795.[0m
[32m[I 2024-10-13 08:04:18,160][0m Trial 378 finished with value: 2719.3154539192383 and parameters: {'depth': 7, 'learning_rate': 0.1580626287901242, 'iterations': 2724, 'l2_leaf_reg': 0.0005120998195901873, 'border_count': 48, 'bagging_temperature': 0.6789019373771402, 'random_strength': 0.46900682380536346, 'grow_policy': 'Lossguide', 'min_data_in_leaf': 71, 'max_leaves': 57}. Best is trial 367 with value: 2557.3553637654795.[0m
[32m[I 2024-10-13 08:04:23,448][0m Trial 379 finished with value: 3023.1210962500168 and parameters: {'depth': 7, 'learning_rate': 0.1411834117751524, 'iterations': 2678, 'l2_leaf_reg': 0.0002679717907043237, 'border_count': 57, 'bagging_temperature': 0.6860084778099295, 'random_strength': 0.43668163863941956, 'grow_policy': 'Lossguide', 'min_data_in_leaf': 70, 'max_leaves': 71}. Best is trial 367 with value: 2557.3553637654795.[0m
[32m[I 2024-10-13 08:04:28,556][0m Trial 380 finished with value: 3443.6216325388436 and parameters: {'depth': 7, 'learning_rate': 0.04793421585743873, 'iterations': 2698, 'l2_leaf_reg': 0.0001322891141485332, 'border_count': 50, 'bagging_temperature': 0.6627810181253406, 'random_strength': 0.21366190133984103, 'grow_policy': 'Lossguide', 'min_data_in_leaf': 46, 'max_leaves': 56}. Best is trial 367 with value: 2557.3553637654795.[0m
[32m[I 2024-10-13 08:04:31,910][0m Trial 381 finished with value: 3189.68602295318 and parameters: {'depth': 7, 'learning_rate': 0.15446665957886105, 'iterations': 2616, 'l2_leaf_reg': 9.599958883436458e-05, 'border_count': 64, 'bagging_temperature': 0.6943665859644499, 'random_strength': 0.5188387787033876, 'grow_policy': 'Lossguide', 'min_data_in_leaf': 80, 'max_leaves': 53}. Best is trial 367 with value: 2557.3553637654795.[0m
[32m[I 2024-10-13 08:04:37,240][0m Trial 382 finished with value: 4394.84936028127 and parameters: {'depth': 7, 'learning_rate': 0.12055272835141566, 'iterations': 2736, 'l2_leaf_reg': 7.81337299392031e-05, 'border_count': 41, 'bagging_temperature': 0.6747212379332775, 'random_strength': 0.3707863563086483, 'grow_policy': 'Lossguide', 'min_data_in_leaf': 93, 'max_leaves': 58}. Best is trial 367 with value: 2557.3553637654795.[0m
[32m[I 2024-10-13 08:04:42,513][0m Trial 383 finished with value: 4913.6481325884315 and parameters: {'depth': 6, 'learning_rate': 0.1761807932158001, 'iterations': 2568, 'l2_leaf_reg': 0.02459124495608867, 'border_count': 32, 'bagging_temperature': 0.6476396106760661, 'random_strength': 0.19292208507041803, 'grow_policy': 'Lossguide', 'min_data_in_leaf': 64, 'max_leaves': 55}. Best is trial 367 with value: 2557.3553637654795.[0m
[32m[I 2024-10-13 08:04:47,435][0m Trial 384 finished with value: 2940.9902254163844 and parameters: {'depth': 9, 'learning_rate': 0.17667840377056085, 'iterations': 2770, 'l2_leaf_reg': 0.00041505582740176, 'border_count': 48, 'bagging_temperature': 0.6561467447481512, 'random_strength': 0.4785657193301092, 'grow_policy': 'Lossguide', 'min_data_in_leaf': 103, 'max_leaves': 61}. Best is trial 367 with value: 2557.3553637654795.[0m
[32m[I 2024-10-13 08:04:52,087][0m Trial 385 finished with value: 3716.924081974619 and parameters: {'depth': 8, 'learning_rate': 0.13601857265438466, 'iterations': 2696, 'l2_leaf_reg': 0.00013981539926938893, 'border_count': 55, 'bagging_temperature': 0.6735325110624667, 'random_strength': 0.1942778278992186, 'grow_policy': 'Lossguide', 'min_data_in_leaf': 842, 'max_leaves': 51}. Best is trial 367 with value: 2557.3553637654795.[0m
[32m[I 2024-10-13 08:04:56,875][0m Trial 386 finished with value: 4332.52101150807 and parameters: {'depth': 7, 'learning_rate': 0.2006908654849734, 'iterations': 2652, 'l2_leaf_reg': 1.6532407649581454e-06, 'border_count': 147, 'bagging_temperature': 0.6224566007939148, 'random_strength': 0.5993652176865767, 'grow_policy': 'Lossguide', 'min_data_in_leaf': 81, 'max_leaves': 61}. Best is trial 367 with value: 2557.3553637654795.[0m
[32m[I 2024-10-13 08:05:02,700][0m Trial 387 finished with value: 3996.983543684837 and parameters: {'depth': 6, 'learning_rate': 0.16324527315538775, 'iterations': 2534, 'l2_leaf_reg': 2.8294436910559842e-05, 'border_count': 43, 'bagging_temperature': 0.6428835972605594, 'random_strength': 0.3528861642208938, 'grow_policy': 'Lossguide', 'min_data_in_leaf': 29, 'max_leaves': 57}. Best is trial 367 with value: 2557.3553637654795.[0m
[32m[I 2024-10-13 08:05:07,784][0m Trial 388 finished with value: 4770.750878111867 and parameters: {'depth': 7, 'learning_rate': 0.2050913874327305, 'iterations': 2772, 'l2_leaf_reg': 2.235471520494766e-06, 'border_count': 37, 'bagging_temperature': 0.7086647448033238, 'random_strength': 0.6074994437954326, 'grow_policy': 'Lossguide', 'min_data_in_leaf': 111, 'max_leaves': 66}. Best is trial 367 with value: 2557.3553637654795.[0m
[32m[I 2024-10-13 08:05:12,586][0m Trial 389 finished with value: 3256.2224223876697 and parameters: {'depth': 7, 'learning_rate': 0.20924286964967384, 'iterations': 2690, 'l2_leaf_reg': 7.613685291215215e-05, 'border_count': 49, 'bagging_temperature': 0.6082102754015024, 'random_strength': 0.21747349760564444, 'grow_policy': 'Lossguide', 'min_data_in_leaf': 93, 'max_leaves': 48}. Best is trial 367 with value: 2557.3553637654795.[0m
[32m[I 2024-10-13 08:05:17,811][0m Trial 390 finished with value: 3561.412526686302 and parameters: {'depth': 8, 'learning_rate': 0.23637905424064987, 'iterations': 2597, 'l2_leaf_reg': 4.649377387724502e-05, 'border_count': 45, 'bagging_temperature': 0.6329387392228218, 'random_strength': 0.367955712954791, 'grow_policy': 'Lossguide', 'min_data_in_leaf': 66, 'max_leaves': 52}. Best is trial 367 with value: 2557.3553637654795.[0m
[32m[I 2024-10-13 08:05:20,824][0m Trial 391 finished with value: 4100.890390097839 and parameters: {'depth': 7, 'learning_rate': 0.17584086353576547, 'iterations': 2783, 'l2_leaf_reg': 4.496619605053496e-06, 'border_count': 60, 'bagging_temperature': 0.657208220640223, 'random_strength': 0.5633655906745668, 'grow_policy': 'Lossguide', 'min_data_in_leaf': 118, 'max_leaves': 48}. Best is trial 367 with value: 2557.3553637654795.[0m
[32m[I 2024-10-13 08:05:27,373][0m Trial 392 finished with value: 3211.5139899636047 and parameters: {'depth': 7, 'learning_rate': 0.2665415578892165, 'iterations': 2721, 'l2_leaf_reg': 2.4034019004446055e-05, 'border_count': 53, 'bagging_temperature': 0.595060834800945, 'random_strength': 0.18983366269336138, 'grow_policy': 'Lossguide', 'min_data_in_leaf': 42, 'max_leaves': 52}. Best is trial 367 with value: 2557.3553637654795.[0m
[32m[I 2024-10-13 08:05:52,399][0m Trial 393 finished with value: 4996.349146335156 and parameters: {'depth': 8, 'learning_rate': 0.1418010691302875, 'iterations': 2820, 'l2_leaf_reg': 9.22975734650672e-05, 'border_count': 40, 'bagging_temperature': 0.5308505168450159, 'random_strength': 1.8543575088994397, 'grow_policy': 'SymmetricTree', 'min_data_in_leaf': 93}. Best is trial 367 with value: 2557.3553637654795.[0m
[32m[I 2024-10-13 08:05:56,439][0m Trial 394 finished with value: 4677.90967509619 and parameters: {'depth': 7, 'learning_rate': 0.20240071216189306, 'iterations': 2421, 'l2_leaf_reg': 0.003412049767000092, 'border_count': 135, 'bagging_temperature': 0.6310348543272749, 'random_strength': 0.003357137870655766, 'grow_policy': 'Lossguide', 'min_data_in_leaf': 125, 'max_leaves': 83}. Best is trial 367 with value: 2557.3553637654795.[0m
[32m[I 2024-10-13 08:06:01,420][0m Trial 395 finished with value: 3008.081835443682 and parameters: {'depth': 6, 'learning_rate': 0.2533831054009872, 'iterations': 2512, 'l2_leaf_reg': 1.095454357373865e-06, 'border_count': 48, 'bagging_temperature': 0.5955361034251551, 'random_strength': 0.6739070181880291, 'grow_policy': 'Lossguide', 'min_data_in_leaf': 76, 'max_leaves': 58}. Best is trial 367 with value: 2557.3553637654795.[0m
[32m[I 2024-10-13 08:06:06,761][0m Trial 396 finished with value: 5086.201891480664 and parameters: {'depth': 7, 'learning_rate': 0.1608758216154577, 'iterations': 2631, 'l2_leaf_reg': 0.0001841079254193848, 'border_count': 34, 'bagging_temperature': 0.7208947943102247, 'random_strength': 0.379862265762962, 'grow_policy': 'Lossguide', 'min_data_in_leaf': 108, 'max_leaves': 35}. Best is trial 367 with value: 2557.3553637654795.[0m
[32m[I 2024-10-13 08:06:12,095][0m Trial 397 finished with value: 20329.606162938122 and parameters: {'depth': 8, 'learning_rate': 0.00024549277591526004, 'iterations': 2741, 'l2_leaf_reg': 3.569646552428751e-05, 'border_count': 44, 'bagging_temperature': 0.5497006321550251, 'random_strength': 0.5243774985402476, 'grow_policy': 'Depthwise', 'min_data_in_leaf': 138}. Best is trial 367 with value: 2557.3553637654795.[0m
[32m[I 2024-10-13 08:06:18,019][0m Trial 398 finished with value: 4708.904079251499 and parameters: {'depth': 9, 'learning_rate': 0.22875502858632876, 'iterations': 2834, 'l2_leaf_reg': 5.567288726992277e-07, 'border_count': 170, 'bagging_temperature': 0.6770639021585534, 'random_strength': 1.1988478905780553, 'grow_policy': 'Lossguide', 'min_data_in_leaf': 51, 'max_leaves': 132}. Best is trial 367 with value: 2557.3553637654795.[0m
[32m[I 2024-10-13 08:06:22,924][0m Trial 399 finished with value: 4754.685634433485 and parameters: {'depth': 7, 'learning_rate': 0.18640634043802076, 'iterations': 2667, 'l2_leaf_reg': 2.0361563346065828e-05, 'border_count': 39, 'bagging_temperature': 0.577394640290527, 'random_strength': 0.18482879837555494, 'grow_policy': 'Lossguide', 'min_data_in_leaf': 119, 'max_leaves': 46}. Best is trial 367 with value: 2557.3553637654795.[0m
[32m[I 2024-10-13 08:06:27,533][0m Trial 400 finished with value: 4585.095421509818 and parameters: {'depth': 8, 'learning_rate': 0.2994537768910177, 'iterations': 2368, 'l2_leaf_reg': 5.870004420576263e-06, 'border_count': 53, 'bagging_temperature': 0.6107333913990451, 'random_strength': 0.7999498844745894, 'grow_policy': 'Lossguide', 'min_data_in_leaf': 96, 'max_leaves': 69}. Best is trial 367 with value: 2557.3553637654795.[0m
