[32m[I 2024-10-13 07:57:43,959][0m Trial 301 finished with value: 4946.1931057194715 and parameters: {'depth': 7, 'learning_rate': 0.1703295095016677, 'iterations': 2647, 'l2_leaf_reg': 9.99395130260729e-06, 'border_count': 39, 'bagging_temperature': 0.5819886332279554, 'random_strength': 0.24565652463517013, 'grow_policy': 'Lossguide', 'min_data_in_leaf': 122, 'max_leaves': 55}. Best is trial 243 with value: 2588.074208285989.[0m
[32m[I 2024-10-13 07:57:54,417][0m Trial 302 finished with value: 5438.594462373825 and parameters: {'depth': 8, 'learning_rate': 0.19934280425326403, 'iterations': 2487, 'l2_leaf_reg': 0.000182289378094198, 'border_count': 192, 'bagging_temperature': 0.5455902199976638, 'random_strength': 0.6257110526317637, 'grow_policy': 'SymmetricTree', 'min_data_in_leaf': 152}. Best is trial 243 with value: 2588.074208285989.[0m
[32m[I 2024-10-13 07:57:57,146][0m Trial 303 finished with value: 3742.0445643418443 and parameters: {'depth': 9, 'learning_rate': 0.23161738696714704, 'iterations': 2806, 'l2_leaf_reg': 1.6011122027959297e-05, 'border_count': 54, 'bagging_temperature': 0.6148096402067956, 'random_strength': 0.4285516477137601, 'grow_policy': 'Lossguide', 'min_data_in_leaf': 189, 'max_leaves': 100}. Best is trial 243 with value: 2588.074208285989.[0m
[32m[I 2024-10-13 07:58:00,088][0m Trial 304 finished with value: 10706.34130333873 and parameters: {'depth': 7, 'learning_rate': 0.0006730178482444068, 'iterations': 2936, 'l2_leaf_reg': 0.00010669614989554821, 'border_count': 45, 'bagging_temperature': 0.6387291382272546, 'random_strength': 0.8959240001973221, 'grow_policy': 'Depthwise', 'min_data_in_leaf': 87}. Best is trial 243 with value: 2588.074208285989.[0m
[32m[I 2024-10-13 07:58:02,588][0m Trial 305 finished with value: 5293.899498717501 and parameters: {'depth': 7, 'learning_rate': 0.1509823714518189, 'iterations': 2586, 'l2_leaf_reg': 4.6762298029701053e-05, 'border_count': 29, 'bagging_temperature': 0.5948347629961237, 'random_strength': 0.19036260801026014, 'grow_policy': 'Lossguide', 'min_data_in_leaf': 133, 'max_leaves': 123}. Best is trial 243 with value: 2588.074208285989.[0m
[32m[I 2024-10-13 07:58:05,286][0m Trial 306 finished with value: 3769.3601870387206 and parameters: {'depth': 8, 'learning_rate': 0.19275776288107524, 'iterations': 2864, 'l2_leaf_reg': 2.3506240873760115e-05, 'border_count': 58, 'bagging_temperature': 0.5808682805064492, 'random_strength': 1.192041633311487, 'grow_policy': 'Lossguide', 'min_data_in_leaf': 168, 'max_leaves': 64}. Best is trial 243 with value: 2588.074208285989.[0m
[32m[I 2024-10-13 07:58:09,259][0m Trial 307 finished with value: 5013.144115642617 and parameters: {'depth': 7, 'learning_rate': 0.250559259970051, 'iterations': 2677, 'l2_leaf_reg': 7.702363261907324e-06, 'border_count': 37, 'bagging_temperature': 0.5617236963172564, 'random_strength': 0.7116082008431509, 'grow_policy': 'Lossguide', 'min_data_in_leaf': 106, 'max_leaves': 36}. Best is trial 243 with value: 2588.074208285989.[0m
[32m[I 2024-10-13 07:58:13,758][0m Trial 308 finished with value: 16902.7464075731 and parameters: {'depth': 7, 'learning_rate': 0.000371826711091599, 'iterations': 2770, 'l2_leaf_reg': 5.903935664500263e-05, 'border_count': 48, 'bagging_temperature': 0.6226818279357355, 'random_strength': 0.42588504735770444, 'grow_policy': 'Lossguide', 'min_data_in_leaf': 139, 'max_leaves': 255}. Best is trial 243 with value: 2588.074208285989.[0m
[32m[I 2024-10-13 07:58:18,503][0m Trial 309 finished with value: 2771.7890840494947 and parameters: {'depth': 8, 'learning_rate': 0.22012562717214268, 'iterations': 2717, 'l2_leaf_reg': 3.0592282800270495e-06, 'border_count': 43, 'bagging_temperature': 0.6038087169702749, 'random_strength': 0.02052988582806959, 'grow_policy': 'Lossguide', 'min_data_in_leaf': 205, 'max_leaves': 45}. Best is trial 243 with value: 2588.074208285989.[0m
[32m[I 2024-10-13 07:58:23,510][0m Trial 310 finished with value: 4050.5978624249183 and parameters: {'depth': 5, 'learning_rate': 0.178991078089395, 'iterations': 2824, 'l2_leaf_reg': 2.3409153937368053e-06, 'border_count': 42, 'bagging_temperature': 0.6670107520581334, 'random_strength': 0.19194202233790988, 'grow_policy': 'Lossguide', 'min_data_in_leaf': 206, 'max_leaves': 44}. Best is trial 243 with value: 2588.074208285989.[0m
[32m[I 2024-10-13 07:58:28,486][0m Trial 311 finished with value: 5660.272548883954 and parameters: {'depth': 7, 'learning_rate': 0.21114974993262664, 'iterations': 2750, 'l2_leaf_reg': 4.150165756503779e-06, 'border_count': 33, 'bagging_temperature': 0.6069896043150702, 'random_strength': 0.06569746296383344, 'grow_policy': 'Lossguide', 'min_data_in_leaf': 186, 'max_leaves': 38}. Best is trial 243 with value: 2588.074208285989.[0m
[32m[I 2024-10-13 07:58:29,435][0m Trial 312 finished with value: 3629.7563314659687 and parameters: {'depth': 6, 'learning_rate': 0.29956449684228037, 'iterations': 344, 'l2_leaf_reg': 1.3057599243107888e-06, 'border_count': 43, 'bagging_temperature': 0.6368813967026565, 'random_strength': 0.003357176369864101, 'grow_policy': 'Lossguide', 'min_data_in_leaf': 168, 'max_leaves': 35}. Best is trial 243 with value: 2588.074208285989.[0m
[32m[I 2024-10-13 07:58:34,597][0m Trial 313 finished with value: 4859.63142604834 and parameters: {'depth': 8, 'learning_rate': 0.1483883818730231, 'iterations': 2905, 'l2_leaf_reg': 3.113325619925875e-06, 'border_count': 38, 'bagging_temperature': 0.5997055444429333, 'random_strength': 1.5474394674056637, 'grow_policy': 'Lossguide', 'min_data_in_leaf': 219, 'max_leaves': 42}. Best is trial 243 with value: 2588.074208285989.[0m
[32m[I 2024-10-13 07:58:40,195][0m Trial 314 finished with value: 3653.5713486033583 and parameters: {'depth': 7, 'learning_rate': 0.2145467499358237, 'iterations': 2997, 'l2_leaf_reg': 5.211609204958827e-06, 'border_count': 53, 'bagging_temperature': 0.6202521983554304, 'random_strength': 2.2451496190604088, 'grow_policy': 'Lossguide', 'min_data_in_leaf': 150, 'max_leaves': 47}. Best is trial 243 with value: 2588.074208285989.[0m
[32m[I 2024-10-13 07:58:45,063][0m Trial 315 finished with value: 2853.0297064579863 and parameters: {'depth': 8, 'learning_rate': 0.2628837721284291, 'iterations': 2720, 'l2_leaf_reg': 8.581341823350839e-07, 'border_count': 45, 'bagging_temperature': 0.589212302914, 'random_strength': 0.5383736710455918, 'grow_policy': 'Lossguide', 'min_data_in_leaf': 159, 'max_leaves': 31}. Best is trial 243 with value: 2588.074208285989.[0m
[32m[I 2024-10-13 07:58:49,845][0m Trial 316 finished with value: 5727.0914330100595 and parameters: {'depth': 7, 'learning_rate': 0.25715613321567365, 'iterations': 2827, 'l2_leaf_reg': 2.1623689970236736e-06, 'border_count': 33, 'bagging_temperature': 0.6441253119568968, 'random_strength': 1.0091136576309139, 'grow_policy': 'Lossguide', 'min_data_in_leaf': 165, 'max_leaves': 33}. Best is trial 243 with value: 2588.074208285989.[0m
[32m[I 2024-10-13 07:58:54,638][0m Trial 317 finished with value: 4717.811612935384 and parameters: {'depth': 6, 'learning_rate': 0.2563845700129536, 'iterations': 2708, 'l2_leaf_reg': 8.594216985784041e-07, 'border_count': 42, 'bagging_temperature': 0.5779375343509617, 'random_strength': 0.6374156172200133, 'grow_policy': 'Lossguide', 'min_data_in_leaf': 195, 'max_leaves': 31}. Best is trial 243 with value: 2588.074208285989.[0m
[32m[I 2024-10-13 07:58:59,493][0m Trial 318 finished with value: 4887.10566205687 and parameters: {'depth': 7, 'learning_rate': 0.17595683486728822, 'iterations': 2884, 'l2_leaf_reg': 6.697895377632837e-07, 'border_count': 38, 'bagging_temperature': 0.6250962887182299, 'random_strength': 0.7809835672115117, 'grow_policy': 'Lossguide', 'min_data_in_leaf': 180, 'max_leaves': 39}. Best is trial 243 with value: 2588.074208285989.[0m
[32m[I 2024-10-13 07:59:04,602][0m Trial 319 finished with value: 8161.856602987698 and parameters: {'depth': 8, 'learning_rate': 0.2984898713406307, 'iterations': 2945, 'l2_leaf_reg': 4.2199820298486467e-07, 'border_count': 26, 'bagging_temperature': 0.5460974572188, 'random_strength': 0.4990037941631075, 'grow_policy': 'Lossguide', 'min_data_in_leaf': 148, 'max_leaves': 36}. Best is trial 243 with value: 2588.074208285989.[0m
[32m[I 2024-10-13 07:59:09,413][0m Trial 320 finished with value: 3136.2267158149 and parameters: {'depth': 9, 'learning_rate': 0.20306495182342066, 'iterations': 2750, 'l2_leaf_reg': 1.3042882403339934e-06, 'border_count': 45, 'bagging_temperature': 0.6053800516091393, 'random_strength': 0.3218667237782325, 'grow_policy': 'Lossguide', 'min_data_in_leaf': 129, 'max_leaves': 41}. Best is trial 243 with value: 2588.074208285989.[0m
[32m[I 2024-10-13 07:59:14,049][0m Trial 321 finished with value: 3546.8410064355785 and parameters: {'depth': 7, 'learning_rate': 0.23219712323785552, 'iterations': 2807, 'l2_leaf_reg': 7.419303595941091e-06, 'border_count': 52, 'bagging_temperature': 0.664693431108042, 'random_strength': 0.8854664915410742, 'grow_policy': 'Lossguide', 'min_data_in_leaf': 160, 'max_leaves': 31}. Best is trial 243 with value: 2588.074208285989.[0m
[32m[I 2024-10-13 07:59:18,800][0m Trial 322 finished with value: 3595.782515806554 and parameters: {'depth': 7, 'learning_rate': 0.17959621994688862, 'iterations': 2848, 'l2_leaf_reg': 2.313072037820526e-07, 'border_count': 59, 'bagging_temperature': 0.5877122974344602, 'random_strength': 1.3355813428045662, 'grow_policy': 'Lossguide', 'min_data_in_leaf': 199, 'max_leaves': 245}. Best is trial 243 with value: 2588.074208285989.[0m
[32m[I 2024-10-13 07:59:22,670][0m Trial 323 finished with value: 8227.644235245838 and parameters: {'depth': 8, 'learning_rate': 0.001361361500170614, 'iterations': 2433, 'l2_leaf_reg': 0.0012277694341984793, 'border_count': 229, 'bagging_temperature': 0.5223404500336088, 'random_strength': 0.5590965596324917, 'grow_policy': 'Lossguide', 'min_data_in_leaf': 142, 'max_leaves': 36}. Best is trial 243 with value: 2588.074208285989.[0m
[32m[I 2024-10-13 07:59:26,331][0m Trial 324 finished with value: 5376.257400671035 and parameters: {'depth': 6, 'learning_rate': 0.00226764652076579, 'iterations': 2924, 'l2_leaf_reg': 3.0329244722033015e-06, 'border_count': 45, 'bagging_temperature': 0.5619379197139044, 'random_strength': 0.17247693081771215, 'grow_policy': 'Lossguide', 'min_data_in_leaf': 172, 'max_leaves': 44}. Best is trial 243 with value: 2588.074208285989.[0m
[32m[I 2024-10-13 07:59:29,678][0m Trial 325 finished with value: 5140.045981174475 and parameters: {'depth': 7, 'learning_rate': 0.25920302465027906, 'iterations': 2716, 'l2_leaf_reg': 1.3699940513498538e-07, 'border_count': 36, 'bagging_temperature': 0.6169909424081614, 'random_strength': 1.1077232600026043, 'grow_policy': 'Lossguide', 'min_data_in_leaf': 81, 'max_leaves': 52}. Best is trial 243 with value: 2588.074208285989.[0m
[32m[I 2024-10-13 07:59:53,520][0m Trial 326 finished with value: 3587.4315868817803 and parameters: {'depth': 8, 'learning_rate': 0.21346513318743132, 'iterations': 2546, 'l2_leaf_reg': 8.494318238416856e-05, 'border_count': 50, 'bagging_temperature': 0.6473456744000481, 'random_strength': 0.3617661316177492, 'grow_policy': 'SymmetricTree', 'min_data_in_leaf': 124}. Best is trial 243 with value: 2588.074208285989.[0m
[32m[I 2024-10-13 07:59:58,685][0m Trial 327 finished with value: 2959.735069441601 and parameters: {'depth': 7, 'learning_rate': 0.26267857332111594, 'iterations': 2631, 'l2_leaf_reg': 1.137546635731916e-05, 'border_count': 44, 'bagging_temperature': 0.599466232713552, 'random_strength': 0.7931335703395781, 'grow_policy': 'Lossguide', 'min_data_in_leaf': 184, 'max_leaves': 39}. Best is trial 243 with value: 2588.074208285989.[0m
[32m[I 2024-10-13 08:00:03,893][0m Trial 328 finished with value: 4889.732988045391 and parameters: {'depth': 7, 'learning_rate': 0.1972969216219586, 'iterations': 2876, 'l2_leaf_reg': 3.864218281709937e-05, 'border_count': 40, 'bagging_temperature': 0.5714866106223743, 'random_strength': 0.002442957314364936, 'grow_policy': 'Depthwise', 'min_data_in_leaf': 145}. Best is trial 243 with value: 2588.074208285989.[0m
[32m[I 2024-10-13 08:00:07,492][0m Trial 329 finished with value: 5138.671285372971 and parameters: {'depth': 7, 'learning_rate': 0.13902244267497746, 'iterations': 2783, 'l2_leaf_reg': 4.904310208510557e-07, 'border_count': 31, 'bagging_temperature': 0.6170204135290269, 'random_strength': 0.5057230755253083, 'grow_policy': 'Lossguide', 'min_data_in_leaf': 635, 'max_leaves': 35}. Best is trial 243 with value: 2588.074208285989.[0m
[32m[I 2024-10-13 08:00:12,611][0m Trial 330 finished with value: 3942.1684483024665 and parameters: {'depth': 8, 'learning_rate': 0.15966506031222694, 'iterations': 2946, 'l2_leaf_reg': 1.6385911843376257e-06, 'border_count': 56, 'bagging_temperature': 0.583778996029, 'random_strength': 1.7063851959191827, 'grow_policy': 'Lossguide', 'min_data_in_leaf': 101, 'max_leaves': 59}. Best is trial 243 with value: 2588.074208285989.[0m
[32m[I 2024-10-13 08:00:17,156][0m Trial 331 finished with value: 5201.483718464398 and parameters: {'depth': 8, 'learning_rate': 0.2288903911876691, 'iterations': 2674, 'l2_leaf_reg': 0.0003310586968353737, 'border_count': 49, 'bagging_temperature': 0.6381317357216334, 'random_strength': 0.6323493960928089, 'grow_policy': 'Lossguide', 'min_data_in_leaf': 158, 'max_leaves': 41}. Best is trial 243 with value: 2588.074208285989.[0m
[32m[I 2024-10-13 08:00:22,118][0m Trial 332 finished with value: 5678.643576866544 and parameters: {'depth': 6, 'learning_rate': 0.266259851621131, 'iterations': 2734, 'l2_leaf_reg': 1.9534810369424555e-05, 'border_count': 39, 'bagging_temperature': 0.848963349517749, 'random_strength': 0.24911307619582418, 'grow_policy': 'Lossguide', 'min_data_in_leaf': 122, 'max_leaves': 48}. Best is trial 243 with value: 2588.074208285989.[0m
[32m[I 2024-10-13 08:00:26,321][0m Trial 333 finished with value: 2758.535060958085 and parameters: {'depth': 7, 'learning_rate': 0.1882041824800805, 'iterations': 2582, 'l2_leaf_reg': 9.75530476043241e-07, 'border_count': 46, 'bagging_temperature': 0.5498714740700511, 'random_strength': 0.9682394435754147, 'grow_policy': 'Lossguide', 'min_data_in_leaf': 92, 'max_leaves': 31}. Best is trial 243 with value: 2588.074208285989.[0m
[32m[I 2024-10-13 08:00:30,786][0m Trial 334 finished with value: 7799.070367528092 and parameters: {'depth': 7, 'learning_rate': 0.1687017886461108, 'iterations': 2493, 'l2_leaf_reg': 5.279000039519046e-06, 'border_count': 22, 'bagging_temperature': 0.5354579535839302, 'random_strength': 1.1207335313936757, 'grow_policy': 'Lossguide', 'min_data_in_leaf': 83, 'max_leaves': 31}. Best is trial 243 with value: 2588.074208285989.[0m
[32m[I 2024-10-13 08:00:36,424][0m Trial 335 finished with value: 3364.4392480693714 and parameters: {'depth': 8, 'learning_rate': 0.23262713919068484, 'iterations': 2997, 'l2_leaf_reg': 9.669090611393492e-07, 'border_count': 52, 'bagging_temperature': 0.5307387116981295, 'random_strength': 1.3319172881617432, 'grow_policy': 'Lossguide', 'min_data_in_leaf': 74, 'max_leaves': 44}. Best is trial 243 with value: 2588.074208285989.[0m
[32m[I 2024-10-13 08:00:41,616][0m Trial 336 finished with value: 2645.941962135295 and parameters: {'depth': 7, 'learning_rate': 0.2971387405247376, 'iterations': 2574, 'l2_leaf_reg': 8.555093763819906e-07, 'border_count': 47, 'bagging_temperature': 0.5193783049984217, 'random_strength': 0.9903908498563058, 'grow_policy': 'Lossguide', 'min_data_in_leaf': 101, 'max_leaves': 55}. Best is trial 243 with value: 2588.074208285989.[0m
[32m[I 2024-10-13 08:00:46,690][0m Trial 337 finished with value: 3193.6138075518975 and parameters: {'depth': 7, 'learning_rate': 0.2991671733804176, 'iterations': 2582, 'l2_leaf_reg': 8.803040616749912e-07, 'border_count': 60, 'bagging_temperature': 0.5525559647499516, 'random_strength': 0.9575214804645884, 'grow_policy': 'Lossguide', 'min_data_in_leaf': 93, 'max_leaves': 56}. Best is trial 243 with value: 2588.074208285989.[0m
[32m[I 2024-10-13 08:00:51,777][0m Trial 338 finished with value: 5508.098804513312 and parameters: {'depth': 7, 'learning_rate': 0.25701412688088754, 'iterations': 2556, 'l2_leaf_reg': 4.904671626252224e-07, 'border_count': 49, 'bagging_temperature': 0.5494640575372409, 'random_strength': 1.1641646477499692, 'grow_policy': 'Lossguide', 'min_data_in_leaf': 585, 'max_leaves': 53}. Best is trial 243 with value: 2588.074208285989.[0m
[32m[I 2024-10-13 08:00:56,186][0m Trial 339 finished with value: 4263.699122252875 and parameters: {'depth': 7, 'learning_rate': 0.29891764603822046, 'iterations': 2409, 'l2_leaf_reg': 1.4421675832988963e-06, 'border_count': 54, 'bagging_temperature': 0.5108821592757474, 'random_strength': 0.8676746304058507, 'grow_policy': 'Lossguide', 'min_data_in_leaf': 113, 'max_leaves': 60}. Best is trial 243 with value: 2588.074208285989.[0m
[32m[I 2024-10-13 08:01:00,508][0m Trial 340 finished with value: 2982.280511745141 and parameters: {'depth': 6, 'learning_rate': 0.23343201756952223, 'iterations': 2505, 'l2_leaf_reg': 8.658276896805523e-07, 'border_count': 45, 'bagging_temperature': 0.5651638286199078, 'random_strength': 0.7287390889826066, 'grow_policy': 'Lossguide', 'min_data_in_leaf': 131, 'max_leaves': 35}. Best is trial 243 with value: 2588.074208285989.[0m
[32m[I 2024-10-13 08:01:04,363][0m Trial 341 finished with value: 7018.145900851123 and parameters: {'depth': 5, 'learning_rate': 0.26184469663665677, 'iterations': 2871, 'l2_leaf_reg': 3.240570504453895e-07, 'border_count': 36, 'bagging_temperature': 0.5767003490925993, 'random_strength': 1.0325043345640526, 'grow_policy': 'Lossguide', 'min_data_in_leaf': 97, 'max_leaves': 51}. Best is trial 243 with value: 2588.074208285989.[0m
[32m[I 2024-10-13 08:01:11,379][0m Trial 342 finished with value: 3196.669522461595 and parameters: {'depth': 7, 'learning_rate': 0.20952819188082794, 'iterations': 2803, 'l2_leaf_reg': 2.444837467141633e-06, 'border_count': 41, 'bagging_temperature': 0.5955475559894502, 'random_strength': 0.6812583264709281, 'grow_policy': 'Lossguide', 'min_data_in_leaf': 51, 'max_leaves': 40}. Best is trial 243 with value: 2588.074208285989.[0m
[32m[I 2024-10-13 08:01:16,639][0m Trial 343 finished with value: 4367.449528752517 and parameters: {'depth': 8, 'learning_rate': 0.29636829215920335, 'iterations': 2925, 'l2_leaf_reg': 5.870506531745057e-05, 'border_count': 160, 'bagging_temperature': 0.5745757787438674, 'random_strength': 1.2722889498995023, 'grow_policy': 'Lossguide', 'min_data_in_leaf': 71, 'max_leaves': 45}. Best is trial 243 with value: 2588.074208285989.[0m
[32m[I 2024-10-13 08:01:21,692][0m Trial 344 finished with value: 4483.450184847538 and parameters: {'depth': 7, 'learning_rate': 0.014073970129858884, 'iterations': 2587, 'l2_leaf_reg': 5.382167118874053e-07, 'border_count': 64, 'bagging_temperature': 0.5480758584947897, 'random_strength': 0.8789755018313201, 'grow_policy': 'Lossguide', 'min_data_in_leaf': 118, 'max_leaves': 49}. Best is trial 243 with value: 2588.074208285989.[0m
[32m[I 2024-10-13 08:01:26,337][0m Trial 345 finished with value: 2784.059470008056 and parameters: {'depth': 8, 'learning_rate': 0.23373305816748022, 'iterations': 2654, 'l2_leaf_reg': 1.8397084930543928e-06, 'border_count': 48, 'bagging_temperature': 0.5951828760922925, 'random_strength': 0.5095094062434117, 'grow_policy': 'Lossguide', 'min_data_in_leaf': 151, 'max_leaves': 31}. Best is trial 243 with value: 2588.074208285989.[0m
[32m[I 2024-10-13 08:01:31,397][0m Trial 346 finished with value: 4007.949937496626 and parameters: {'depth': 8, 'learning_rate': 0.2577612093064974, 'iterations': 2639, 'l2_leaf_reg': 1.3270207114526633e-06, 'border_count': 55, 'bagging_temperature': 0.595335499376416, 'random_strength': 0.547000627891593, 'grow_policy': 'Lossguide', 'min_data_in_leaf': 149, 'max_leaves': 34}. Best is trial 243 with value: 2588.074208285989.[0m
[32m[I 2024-10-13 08:01:39,458][0m Trial 347 finished with value: 4027.780930504232 and parameters: {'depth': 8, 'learning_rate': 0.23190737529954286, 'iterations': 791, 'l2_leaf_reg': 7.357488798844562e-07, 'border_count': 49, 'bagging_temperature': 0.6119161144253138, 'random_strength': 1.5238920008359593, 'grow_policy': 'SymmetricTree', 'min_data_in_leaf': 141}. Best is trial 243 with value: 2588.074208285989.[0m
[32m[I 2024-10-13 08:01:44,685][0m Trial 348 finished with value: 4304.99746863717 and parameters: {'depth': 9, 'learning_rate': 0.1889081295307909, 'iterations': 2744, 'l2_leaf_reg': 3.4500962196244934e-06, 'border_count': 34, 'bagging_temperature': 0.009982065133624762, 'random_strength': 0.7840354356563306, 'grow_policy': 'Lossguide', 'min_data_in_leaf': 203, 'max_leaves': 31}. Best is trial 243 with value: 2588.074208285989.[0m
[32m[I 2024-10-13 08:01:48,758][0m Trial 349 finished with value: 3071.0782846805505 and parameters: {'depth': 7, 'learning_rate': 0.2629509708883258, 'iterations': 2836, 'l2_leaf_reg': 2.4549014080008267e-06, 'border_count': 48, 'bagging_temperature': 0.63054649250691, 'random_strength': 1.061319185646006, 'grow_policy': 'Lossguide', 'min_data_in_leaf': 164, 'max_leaves': 38}. Best is trial 243 with value: 2588.074208285989.[0m
[32m[I 2024-10-13 08:01:52,061][0m Trial 350 finished with value: 5135.496676320946 and parameters: {'depth': 8, 'learning_rate': 0.21086575734650426, 'iterations': 2699, 'l2_leaf_reg': 1.8511469498630166e-06, 'border_count': 41, 'bagging_temperature': 0.5987333625545457, 'random_strength': 0.5292653779856131, 'grow_policy': 'Lossguide', 'min_data_in_leaf': 128, 'max_leaves': 35}. Best is trial 243 with value: 2588.074208285989.[0m
