[32m[I 2024-10-13 08:15:59,228][0m Trial 502 finished with value: 2923.3628739557603 and parameters: {'depth': 7, 'learning_rate': 0.17613037976177986, 'iterations': 2826, 'l2_leaf_reg': 2.213662595857083e-05, 'border_count': 43, 'bagging_temperature': 0.564676335332756, 'random_strength': 0.3002523050550656, 'grow_policy': 'Lossguide', 'min_data_in_leaf': 159, 'max_leaves': 66}. Best is trial 472 with value: 2453.464132483589.[0m
[32m[I 2024-10-13 08:16:03,677][0m Trial 503 finished with value: 5299.785117244914 and parameters: {'depth': 7, 'learning_rate': 0.2181297846282318, 'iterations': 2967, 'l2_leaf_reg': 5.192009722566427e-05, 'border_count': 36, 'bagging_temperature': 0.5991205308592806, 'random_strength': 0.6988613994529869, 'grow_policy': 'Lossguide', 'min_data_in_leaf': 124, 'max_leaves': 40}. Best is trial 472 with value: 2453.464132483589.[0m
[32m[I 2024-10-13 08:16:06,995][0m Trial 504 finished with value: 3680.6305580466724 and parameters: {'depth': 8, 'learning_rate': 0.10069443660184817, 'iterations': 2665, 'l2_leaf_reg': 5.273975395241147e-06, 'border_count': 54, 'bagging_temperature': 0.9157319181477909, 'random_strength': 0.3253269352432432, 'grow_policy': 'Lossguide', 'min_data_in_leaf': 98, 'max_leaves': 45}. Best is trial 472 with value: 2453.464132483589.[0m
[32m[I 2024-10-13 08:16:25,123][0m Trial 505 finished with value: 5893.996639266657 and parameters: {'depth': 7, 'learning_rate': 0.2637773937095099, 'iterations': 2416, 'l2_leaf_reg': 1.5259608460530526e-06, 'border_count': 20, 'bagging_temperature': 0.7054554397731685, 'random_strength': 0.5083131131061751, 'grow_policy': 'SymmetricTree', 'min_data_in_leaf': 39}. Best is trial 472 with value: 2453.464132483589.[0m
[32m[I 2024-10-13 08:16:29,513][0m Trial 506 finished with value: 3360.8721192756543 and parameters: {'depth': 8, 'learning_rate': 0.1440369526589758, 'iterations': 2513, 'l2_leaf_reg': 3.599265243667256e-05, 'border_count': 46, 'bagging_temperature': 0.6408176787694188, 'random_strength': 0.0033014110142716713, 'grow_policy': 'Lossguide', 'min_data_in_leaf': 185, 'max_leaves': 127}. Best is trial 472 with value: 2453.464132483589.[0m
[32m[I 2024-10-13 08:16:33,014][0m Trial 507 finished with value: 3566.622757051189 and parameters: {'depth': 7, 'learning_rate': 0.20414342101622548, 'iterations': 2892, 'l2_leaf_reg': 9.363223889077883e-07, 'border_count': 41, 'bagging_temperature': 0.6702670519746383, 'random_strength': 0.8400589796318781, 'grow_policy': 'Lossguide', 'min_data_in_leaf': 83, 'max_leaves': 31}. Best is trial 472 with value: 2453.464132483589.[0m
[32m[I 2024-10-13 08:16:37,901][0m Trial 508 finished with value: 3534.245535046984 and parameters: {'depth': 7, 'learning_rate': 0.23458208655413015, 'iterations': 2736, 'l2_leaf_reg': 9.446665112013688e-06, 'border_count': 58, 'bagging_temperature': 0.6220223445003518, 'random_strength': 0.21027643487265038, 'grow_policy': 'Lossguide', 'min_data_in_leaf': 134, 'max_leaves': 38}. Best is trial 472 with value: 2453.464132483589.[0m
[32m[I 2024-10-13 08:16:58,822][0m Trial 509 finished with value: 5123.566366290184 and parameters: {'depth': 8, 'learning_rate': 0.1698426097611852, 'iterations': 2806, 'l2_leaf_reg': 4.6648166911525874e-07, 'border_count': 49, 'bagging_temperature': 0.5860938383490788, 'random_strength': 1.2877238284930057, 'grow_policy': 'Lossguide', 'min_data_in_leaf': 3, 'max_leaves': 57}. Best is trial 472 with value: 2453.464132483589.[0m
[32m[I 2024-10-13 08:17:03,610][0m Trial 510 finished with value: 5325.748357245084 and parameters: {'depth': 7, 'learning_rate': 0.29718535804550256, 'iterations': 2683, 'l2_leaf_reg': 0.11910182146628515, 'border_count': 38, 'bagging_temperature': 0.5380015507940246, 'random_strength': 1.0518225395381462, 'grow_policy': 'Depthwise', 'min_data_in_leaf': 107}. Best is trial 472 with value: 2453.464132483589.[0m
[32m[I 2024-10-13 08:17:09,468][0m Trial 511 finished with value: 5868.921556834361 and parameters: {'depth': 6, 'learning_rate': 0.2549591533694373, 'iterations': 2990, 'l2_leaf_reg': 6.555094508516332e-05, 'border_count': 33, 'bagging_temperature': 0.6092721863706331, 'random_strength': 1.6726756097066038, 'grow_policy': 'Lossguide', 'min_data_in_leaf': 158, 'max_leaves': 49}. Best is trial 472 with value: 2453.464132483589.[0m
[32m[I 2024-10-13 08:17:15,383][0m Trial 512 finished with value: 2961.8886587718125 and parameters: {'depth': 8, 'learning_rate': 0.19817205652298792, 'iterations': 2873, 'l2_leaf_reg': 2.2448665339867147e-05, 'border_count': 44, 'bagging_temperature': 0.5566996198014844, 'random_strength': 5.923903920759537, 'grow_policy': 'Lossguide', 'min_data_in_leaf': 70, 'max_leaves': 41}. Best is trial 472 with value: 2453.464132483589.[0m
[32m[I 2024-10-13 08:17:18,660][0m Trial 513 finished with value: 3678.569692573948 and parameters: {'depth': 7, 'learning_rate': 0.2256624502966684, 'iterations': 2566, 'l2_leaf_reg': 1.654217951789216e-05, 'border_count': 53, 'bagging_temperature': 0.6484155763237266, 'random_strength': 0.6602997489573478, 'grow_policy': 'Lossguide', 'min_data_in_leaf': 128, 'max_leaves': 54}. Best is trial 472 with value: 2453.464132483589.[0m
[32m[I 2024-10-13 08:17:23,687][0m Trial 514 finished with value: 3087.859439614542 and parameters: {'depth': 8, 'learning_rate': 0.17877078413123332, 'iterations': 2777, 'l2_leaf_reg': 3.932859376131639e-06, 'border_count': 47, 'bagging_temperature': 0.5861309706979336, 'random_strength': 0.4091490473013253, 'grow_policy': 'Lossguide', 'min_data_in_leaf': 98, 'max_leaves': 36}. Best is trial 472 with value: 2453.464132483589.[0m
[32m[I 2024-10-13 08:17:28,960][0m Trial 515 finished with value: 5835.327102612645 and parameters: {'depth': 7, 'learning_rate': 0.2581297588735954, 'iterations': 2921, 'l2_leaf_reg': 2.9318912694464666e-05, 'border_count': 40, 'bagging_temperature': 0.620991795004873, 'random_strength': 0.17382984606297203, 'grow_policy': 'Lossguide', 'min_data_in_leaf': 148, 'max_leaves': 46}. Best is trial 472 with value: 2453.464132483589.[0m
[32m[I 2024-10-13 08:17:33,787][0m Trial 516 finished with value: 7630.503044153719 and parameters: {'depth': 9, 'learning_rate': 0.14833684132050942, 'iterations': 2723, 'l2_leaf_reg': 7.392975679200634e-07, 'border_count': 27, 'bagging_temperature': 0.6025128102647994, 'random_strength': 0.8105344246496993, 'grow_policy': 'Lossguide', 'min_data_in_leaf': 176, 'max_leaves': 62}. Best is trial 472 with value: 2453.464132483589.[0m
[32m[I 2024-10-13 08:17:38,150][0m Trial 517 finished with value: 10648.663929556016 and parameters: {'depth': 7, 'learning_rate': 0.20077439400660324, 'iterations': 2624, 'l2_leaf_reg': 1.294237591017238e-06, 'border_count': 2, 'bagging_temperature': 0.5751635706406558, 'random_strength': 0.5315028113662659, 'grow_policy': 'Lossguide', 'min_data_in_leaf': 54, 'max_leaves': 43}. Best is trial 472 with value: 2453.464132483589.[0m
[32m[I 2024-10-13 08:17:43,235][0m Trial 518 finished with value: 6018.218396916343 and parameters: {'depth': 14, 'learning_rate': 0.29779757310919697, 'iterations': 2840, 'l2_leaf_reg': 5.1582332333305835e-05, 'border_count': 50, 'bagging_temperature': 0.5256746191249254, 'random_strength': 0.3070609141404038, 'grow_policy': 'Depthwise', 'min_data_in_leaf': 514}. Best is trial 472 with value: 2453.464132483589.[0m
[32m[I 2024-10-13 08:17:48,088][0m Trial 519 finished with value: 4891.280208051595 and parameters: {'depth': 8, 'learning_rate': 0.2282822884037378, 'iterations': 2687, 'l2_leaf_reg': 2.5375404892100287e-06, 'border_count': 186, 'bagging_temperature': 0.6653476086926083, 'random_strength': 0.6817206419246767, 'grow_policy': 'Lossguide', 'min_data_in_leaf': 436, 'max_leaves': 51}. Best is trial 472 with value: 2453.464132483589.[0m
[32m[I 2024-10-13 08:17:52,069][0m Trial 520 finished with value: 4441.856091269419 and parameters: {'depth': 7, 'learning_rate': 0.17312250538019308, 'iterations': 2468, 'l2_leaf_reg': 8.279236421444966e-05, 'border_count': 64, 'bagging_temperature': 0.6405179827913242, 'random_strength': 9.525537382504389, 'grow_policy': 'Lossguide', 'min_data_in_leaf': 117, 'max_leaves': 35}. Best is trial 472 with value: 2453.464132483589.[0m
[32m[I 2024-10-13 08:17:57,505][0m Trial 521 finished with value: 2770.1012879440964 and parameters: {'depth': 8, 'learning_rate': 0.2612919494750978, 'iterations': 2936, 'l2_leaf_reg': 1.7165744066017297e-07, 'border_count': 43, 'bagging_temperature': 0.6863983151960037, 'random_strength': 1.008654361445888, 'grow_policy': 'Lossguide', 'min_data_in_leaf': 90, 'max_leaves': 39}. Best is trial 472 with value: 2453.464132483589.[0m
[32m[I 2024-10-13 08:18:03,077][0m Trial 522 finished with value: 3014.2972811709155 and parameters: {'depth': 6, 'learning_rate': 0.26518683116082814, 'iterations': 2949, 'l2_leaf_reg': 8.991265959499308e-08, 'border_count': 56, 'bagging_temperature': 0.6902637778466855, 'random_strength': 1.2647757832792368, 'grow_policy': 'Lossguide', 'min_data_in_leaf': 69, 'max_leaves': 48}. Best is trial 472 with value: 2453.464132483589.[0m
[32m[I 2024-10-13 08:18:08,636][0m Trial 523 finished with value: 4144.001369571756 and parameters: {'depth': 7, 'learning_rate': 0.25974740076086505, 'iterations': 2795, 'l2_leaf_reg': 3.1184491528268714e-07, 'border_count': 37, 'bagging_temperature': 0.7256096432448794, 'random_strength': 1.4736123178698943, 'grow_policy': 'Lossguide', 'min_data_in_leaf': 80, 'max_leaves': 56}. Best is trial 472 with value: 2453.464132483589.[0m
[32m[I 2024-10-13 08:18:13,084][0m Trial 524 finished with value: 2517.918053925927 and parameters: {'depth': 8, 'learning_rate': 0.2138692127414477, 'iterations': 2588, 'l2_leaf_reg': 1.8603004821046783e-07, 'border_count': 44, 'bagging_temperature': 0.7107539854846093, 'random_strength': 1.0253448111567565, 'grow_policy': 'Lossguide', 'min_data_in_leaf': 93, 'max_leaves': 43}. Best is trial 472 with value: 2453.464132483589.[0m
[32m[I 2024-10-13 08:18:18,151][0m Trial 525 finished with value: 7770.133915700925 and parameters: {'depth': 7, 'learning_rate': 0.2996656655495241, 'iterations': 2557, 'l2_leaf_reg': 1.35573887990092e-05, 'border_count': 31, 'bagging_temperature': 0.742946352306717, 'random_strength': 1.144298104023033, 'grow_policy': 'Lossguide', 'min_data_in_leaf': 88, 'max_leaves': 50}. Best is trial 472 with value: 2453.464132483589.[0m
[32m[I 2024-10-13 08:18:26,293][0m Trial 526 finished with value: 3254.6673821704608 and parameters: {'depth': 7, 'learning_rate': 0.19506384790118558, 'iterations': 2493, 'l2_leaf_reg': 1.9527793409606397e-07, 'border_count': 40, 'bagging_temperature': 0.7321227659474621, 'random_strength': 1.373532835712431, 'grow_policy': 'Lossguide', 'min_data_in_leaf': 39, 'max_leaves': 45}. Best is trial 472 with value: 2453.464132483589.[0m
[32m[I 2024-10-13 08:18:33,119][0m Trial 527 finished with value: 3278.1707503721586 and parameters: {'depth': 9, 'learning_rate': 0.12892018941495836, 'iterations': 3000, 'l2_leaf_reg': 4.2891115230857914e-08, 'border_count': 43, 'bagging_temperature': 0.7102673932268633, 'random_strength': 1.0668380896692378, 'grow_policy': 'Depthwise', 'min_data_in_leaf': 60}. Best is trial 472 with value: 2453.464132483589.[0m
[32m[I 2024-10-13 08:18:35,326][0m Trial 528 finished with value: 5013.8795839413015 and parameters: {'depth': 8, 'learning_rate': 0.15811620737650192, 'iterations': 1029, 'l2_leaf_reg': 1.7566418815056243e-07, 'border_count': 34, 'bagging_temperature': 0.7023611953526142, 'random_strength': 1.5423645176314045, 'grow_policy': 'Lossguide', 'min_data_in_leaf': 686, 'max_leaves': 54}. Best is trial 472 with value: 2453.464132483589.[0m
[32m[I 2024-10-13 08:18:50,101][0m Trial 529 finished with value: 5511.527718303303 and parameters: {'depth': 6, 'learning_rate': 0.21150247494333366, 'iterations': 2350, 'l2_leaf_reg': 1.1101492418321435e-07, 'border_count': 45, 'bagging_temperature': 0.720391164569921, 'random_strength': 0.9460012435237183, 'grow_policy': 'SymmetricTree', 'min_data_in_leaf': 99}. Best is trial 472 with value: 2453.464132483589.[0m
[32m[I 2024-10-13 08:18:55,494][0m Trial 530 finished with value: 3222.9058390642 and parameters: {'depth': 8, 'learning_rate': 0.18251505756916478, 'iterations': 2896, 'l2_leaf_reg': 7.262318930582103e-08, 'border_count': 49, 'bagging_temperature': 0.6869366695873802, 'random_strength': 1.3283583651062119, 'grow_policy': 'Lossguide', 'min_data_in_leaf': 83, 'max_leaves': 42}. Best is trial 472 with value: 2453.464132483589.[0m
[32m[I 2024-10-13 08:19:01,373][0m Trial 531 finished with value: 3299.68900172865 and parameters: {'depth': 8, 'learning_rate': 0.23341725911318673, 'iterations': 2599, 'l2_leaf_reg': 1.2180676274206308e-07, 'border_count': 38, 'bagging_temperature': 0.6956533629915915, 'random_strength': 1.1612861102819496, 'grow_policy': 'Lossguide', 'min_data_in_leaf': 55, 'max_leaves': 49}. Best is trial 472 with value: 2453.464132483589.[0m
[32m[I 2024-10-13 08:19:05,998][0m Trial 532 finished with value: 3647.7948842838664 and parameters: {'depth': 7, 'learning_rate': 0.20524608084993146, 'iterations': 2999, 'l2_leaf_reg': 1.8534184599439658e-07, 'border_count': 52, 'bagging_temperature': 0.6737565215581497, 'random_strength': 0.9186388433726146, 'grow_policy': 'Lossguide', 'min_data_in_leaf': 96, 'max_leaves': 80}. Best is trial 472 with value: 2453.464132483589.[0m
[32m[I 2024-10-13 08:19:09,730][0m Trial 533 finished with value: 3391.5050767496095 and parameters: {'depth': 7, 'learning_rate': 0.26661169031725923, 'iterations': 2445, 'l2_leaf_reg': 2.755228707926209e-07, 'border_count': 43, 'bagging_temperature': 0.7482108147967002, 'random_strength': 0.9977617603052631, 'grow_policy': 'Lossguide', 'min_data_in_leaf': 72, 'max_leaves': 60}. Best is trial 472 with value: 2453.464132483589.[0m
[32m[I 2024-10-13 08:19:13,785][0m Trial 534 finished with value: 5592.2332638045345 and parameters: {'depth': 8, 'learning_rate': 0.1645860454978344, 'iterations': 2526, 'l2_leaf_reg': 6.024344917716351e-08, 'border_count': 81, 'bagging_temperature': 0.7078666836284672, 'random_strength': 3.1932132968682145, 'grow_policy': 'Lossguide', 'min_data_in_leaf': 115, 'max_leaves': 43}. Best is trial 472 with value: 2453.464132483589.[0m
[32m[I 2024-10-13 08:19:21,673][0m Trial 535 finished with value: 4040.298224593942 and parameters: {'depth': 7, 'learning_rate': 0.23249676189795535, 'iterations': 2839, 'l2_leaf_reg': 3.5003885189268505e-07, 'border_count': 59, 'bagging_temperature': 0.6765103495678136, 'random_strength': 1.2185013958594921, 'grow_policy': 'Lossguide', 'min_data_in_leaf': 31, 'max_leaves': 53}. Best is trial 472 with value: 2453.464132483589.[0m
[32m[I 2024-10-13 08:19:26,921][0m Trial 536 finished with value: 2822.8351464082934 and parameters: {'depth': 6, 'learning_rate': 0.19410723569838556, 'iterations': 2930, 'l2_leaf_reg': 4.765090213178389e-07, 'border_count': 46, 'bagging_temperature': 0.7218211826785693, 'random_strength': 0.8846789254385709, 'grow_policy': 'Lossguide', 'min_data_in_leaf': 97, 'max_leaves': 66}. Best is trial 472 with value: 2453.464132483589.[0m
[32m[I 2024-10-13 08:19:32,281][0m Trial 537 finished with value: 6040.546592184493 and parameters: {'depth': 8, 'learning_rate': 0.2991796525421743, 'iterations': 2758, 'l2_leaf_reg': 1.7766495983430004e-07, 'border_count': 34, 'bagging_temperature': 0.7859701018929705, 'random_strength': 0.7514163384027127, 'grow_policy': 'Depthwise', 'min_data_in_leaf': 114}. Best is trial 472 with value: 2453.464132483589.[0m
[32m[I 2024-10-13 08:19:34,868][0m Trial 538 finished with value: 2791.7449631997865 and parameters: {'depth': 7, 'learning_rate': 0.1457336789366259, 'iterations': 1298, 'l2_leaf_reg': 2.3444668707165667e-07, 'border_count': 54, 'bagging_temperature': 0.6836956471878195, 'random_strength': 1.758132880425853, 'grow_policy': 'Lossguide', 'min_data_in_leaf': 76, 'max_leaves': 39}. Best is trial 472 with value: 2453.464132483589.[0m
[32m[I 2024-10-13 08:19:40,346][0m Trial 539 finished with value: 5693.897535027315 and parameters: {'depth': 7, 'learning_rate': 0.2422823265709981, 'iterations': 2847, 'l2_leaf_reg': 1.5678843627316737e-07, 'border_count': 40, 'bagging_temperature': 0.6599072811893428, 'random_strength': 1.0409115052952989, 'grow_policy': 'Lossguide', 'min_data_in_leaf': 104, 'max_leaves': 49}. Best is trial 472 with value: 2453.464132483589.[0m
[32m[I 2024-10-13 08:19:45,344][0m Trial 540 finished with value: 2765.735570773029 and parameters: {'depth': 7, 'learning_rate': 0.20666373438914065, 'iterations': 2708, 'l2_leaf_reg': 5.681458808946585e-07, 'border_count': 45, 'bagging_temperature': 0.5021065003386881, 'random_strength': 0.7337068659895043, 'grow_policy': 'Lossguide', 'min_data_in_leaf': 90, 'max_leaves': 58}. Best is trial 472 with value: 2453.464132483589.[0m
[32m[I 2024-10-13 08:19:51,917][0m Trial 541 finished with value: 3479.4302292022085 and parameters: {'depth': 8, 'learning_rate': 0.1681607145907068, 'iterations': 2746, 'l2_leaf_reg': 3.921727448710827e-07, 'border_count': 42, 'bagging_temperature': 0.4718378532261377, 'random_strength': 2.0892073535096167, 'grow_policy': 'Lossguide', 'min_data_in_leaf': 58, 'max_leaves': 60}. Best is trial 472 with value: 2453.464132483589.[0m
[32m[I 2024-10-13 08:19:55,305][0m Trial 542 finished with value: 5508.191744531741 and parameters: {'depth': 7, 'learning_rate': 0.11873851797334849, 'iterations': 2388, 'l2_leaf_reg': 2.5267309371041214e-07, 'border_count': 29, 'bagging_temperature': 0.480831073685383, 'random_strength': 0.8064434222686591, 'grow_policy': 'Lossguide', 'min_data_in_leaf': 75, 'max_leaves': 68}. Best is trial 472 with value: 2453.464132483589.[0m
[32m[I 2024-10-13 08:19:58,724][0m Trial 543 finished with value: 4645.714702083413 and parameters: {'depth': 7, 'learning_rate': 0.1871752358535717, 'iterations': 2880, 'l2_leaf_reg': 5.38686545471843e-07, 'border_count': 37, 'bagging_temperature': 0.49763978503334605, 'random_strength': 1.1401011740965612, 'grow_policy': 'Lossguide', 'min_data_in_leaf': 803, 'max_leaves': 63}. Best is trial 472 with value: 2453.464132483589.[0m
[32m[I 2024-10-13 08:20:04,122][0m Trial 544 finished with value: 4831.132124237113 and parameters: {'depth': 8, 'learning_rate': 0.14295949797198332, 'iterations': 2801, 'l2_leaf_reg': 2.986015676459799e-07, 'border_count': 140, 'bagging_temperature': 0.5205221625498972, 'random_strength': 0.8851671742607774, 'grow_policy': 'Lossguide', 'min_data_in_leaf': 45, 'max_leaves': 56}. Best is trial 472 with value: 2453.464132483589.[0m
[32m[I 2024-10-13 08:20:07,557][0m Trial 545 finished with value: 2734.4629453348007 and parameters: {'depth': 9, 'learning_rate': 0.20494776641229814, 'iterations': 2610, 'l2_leaf_reg': 5.439811391830685e-07, 'border_count': 47, 'bagging_temperature': 0.47029761064354886, 'random_strength': 7.042280264896401, 'grow_policy': 'Lossguide', 'min_data_in_leaf': 91, 'max_leaves': 44}. Best is trial 472 with value: 2453.464132483589.[0m
[32m[I 2024-10-13 08:20:10,892][0m Trial 546 finished with value: 3080.430663287145 and parameters: {'depth': 10, 'learning_rate': 0.16634688942457332, 'iterations': 2588, 'l2_leaf_reg': 1.2423659433898305e-07, 'border_count': 51, 'bagging_temperature': 0.437256105697533, 'random_strength': 7.398547499274015, 'grow_policy': 'Depthwise', 'min_data_in_leaf': 84}. Best is trial 472 with value: 2453.464132483589.[0m
[32m[I 2024-10-13 08:20:14,808][0m Trial 547 finished with value: 3127.6819022534705 and parameters: {'depth': 9, 'learning_rate': 0.19472041466279527, 'iterations': 2509, 'l2_leaf_reg': 5.818941592892665e-07, 'border_count': 48, 'bagging_temperature': 0.47194539249514916, 'random_strength': 8.812291858211438, 'grow_policy': 'Lossguide', 'min_data_in_leaf': 60, 'max_leaves': 71}. Best is trial 472 with value: 2453.464132483589.[0m
[32m[I 2024-10-13 08:20:24,042][0m Trial 548 finished with value: 4753.892772422694 and parameters: {'depth': 6, 'learning_rate': 0.20914417060709894, 'iterations': 2605, 'l2_leaf_reg': 3.862806891063084e-07, 'border_count': 56, 'bagging_temperature': 0.45480362550811776, 'random_strength': 6.280249695808288, 'grow_policy': 'Lossguide', 'min_data_in_leaf': 24, 'max_leaves': 122}. Best is trial 472 with value: 2453.464132483589.[0m
[32m[I 2024-10-13 08:20:27,674][0m Trial 549 finished with value: 4789.840634980325 and parameters: {'depth': 10, 'learning_rate': 0.13544359673278922, 'iterations': 2546, 'l2_leaf_reg': 2.2316512581378013e-07, 'border_count': 72, 'bagging_temperature': 0.5262882945132142, 'random_strength': 7.517189411983159, 'grow_policy': 'Lossguide', 'min_data_in_leaf': 92, 'max_leaves': 40}. Best is trial 472 with value: 2453.464132483589.[0m
[32m[I 2024-10-13 08:20:31,335][0m Trial 550 finished with value: 3086.333308906117 and parameters: {'depth': 9, 'learning_rate': 0.1833222735692097, 'iterations': 2940, 'l2_leaf_reg': 3.9819029958857865e-07, 'border_count': 46, 'bagging_temperature': 0.4867358727981584, 'random_strength': 6.987356709479464, 'grow_policy': 'Lossguide', 'min_data_in_leaf': 72, 'max_leaves': 45}. Best is trial 472 with value: 2453.464132483589.[0m
[32m[I 2024-10-13 08:21:01,219][0m Trial 551 finished with value: 5239.538353824758 and parameters: {'depth': 9, 'learning_rate': 0.22074456292285133, 'iterations': 2635, 'l2_leaf_reg': 7.285406577089019e-07, 'border_count': 52, 'bagging_temperature': 0.49877434031717377, 'random_strength': 1.4709196662644346, 'grow_policy': 'SymmetricTree', 'min_data_in_leaf': 94}. Best is trial 472 with value: 2453.464132483589.[0m
