[32m[I 2024-10-13 08:58:31,235][0m Trial 902 finished with value: 3503.4932664974376 and parameters: {'depth': 7, 'learning_rate': 0.24683674255856627, 'iterations': 1889, 'l2_leaf_reg': 9.234051742513958e-06, 'border_count': 47, 'bagging_temperature': 0.6598499051532535, 'random_strength': 2.3000209677556898, 'grow_policy': 'Lossguide', 'min_data_in_leaf': 75, 'max_leaves': 51}. Best is trial 472 with value: 2453.464132483589.[0m
[32m[I 2024-10-13 08:58:40,834][0m Trial 903 finished with value: 3898.0030854412435 and parameters: {'depth': 8, 'learning_rate': 0.18308409044169546, 'iterations': 2766, 'l2_leaf_reg': 2.9104131837261315e-06, 'border_count': 38, 'bagging_temperature': 0.597239088904447, 'random_strength': 1.0571253585630924, 'grow_policy': 'Lossguide', 'min_data_in_leaf': 22, 'max_leaves': 37}. Best is trial 472 with value: 2453.464132483589.[0m
[32m[I 2024-10-13 08:58:45,092][0m Trial 904 finished with value: 3814.514426369912 and parameters: {'depth': 7, 'learning_rate': 0.14564648841840255, 'iterations': 2456, 'l2_leaf_reg': 4.274035669572289e-06, 'border_count': 53, 'bagging_temperature': 0.7038708868581297, 'random_strength': 0.7521319232437377, 'grow_policy': 'Lossguide', 'min_data_in_leaf': 921, 'max_leaves': 47}. Best is trial 472 with value: 2453.464132483589.[0m
[32m[I 2024-10-13 08:58:49,583][0m Trial 905 finished with value: 2398.0485076415025 and parameters: {'depth': 11, 'learning_rate': 0.2151110553042793, 'iterations': 2680, 'l2_leaf_reg': 1.7526824597185874e-08, 'border_count': 44, 'bagging_temperature': 0.6397815338916675, 'random_strength': 4.954066082948334, 'grow_policy': 'Lossguide', 'min_data_in_leaf': 97, 'max_leaves': 58}. Best is trial 905 with value: 2398.0485076415025.[0m
[32m[I 2024-10-13 08:58:54,325][0m Trial 906 finished with value: 5339.979666250754 and parameters: {'depth': 11, 'learning_rate': 0.001859318204202844, 'iterations': 2650, 'l2_leaf_reg': 1.1279014252842241e-07, 'border_count': 24, 'bagging_temperature': 0.683747444436848, 'random_strength': 5.645269596243798, 'grow_policy': 'Lossguide', 'min_data_in_leaf': 127, 'max_leaves': 57}. Best is trial 905 with value: 2398.0485076415025.[0m
[32m[I 2024-10-13 08:59:24,939][0m Trial 907 finished with value: 5907.287109487596 and parameters: {'depth': 11, 'learning_rate': 0.26213200998620245, 'iterations': 1346, 'l2_leaf_reg': 3.9040552113758703e-08, 'border_count': 34, 'bagging_temperature': 0.6495367465745571, 'random_strength': 5.573744536420342, 'grow_policy': 'SymmetricTree', 'min_data_in_leaf': 104}. Best is trial 905 with value: 2398.0485076415025.[0m
[32m[I 2024-10-13 08:59:29,510][0m Trial 908 finished with value: 13060.245136002382 and parameters: {'depth': 12, 'learning_rate': 0.0006119283612239835, 'iterations': 2559, 'l2_leaf_reg': 1.1219558023270993e-08, 'border_count': 39, 'bagging_temperature': 0.6700550766824198, 'random_strength': 5.381524436234224, 'grow_policy': 'Lossguide', 'min_data_in_leaf': 137, 'max_leaves': 44}. Best is trial 905 with value: 2398.0485076415025.[0m
[32m[I 2024-10-13 08:59:34,631][0m Trial 909 finished with value: 2828.9916936488335 and parameters: {'depth': 11, 'learning_rate': 0.2269790895659338, 'iterations': 2794, 'l2_leaf_reg': 1.828457086237657e-08, 'border_count': 44, 'bagging_temperature': 0.6419155251465498, 'random_strength': 5.441075254478157, 'grow_policy': 'Depthwise', 'min_data_in_leaf': 107}. Best is trial 905 with value: 2398.0485076415025.[0m
[32m[I 2024-10-13 08:59:38,169][0m Trial 910 finished with value: 5464.006481703598 and parameters: {'depth': 13, 'learning_rate': 0.2567230101016394, 'iterations': 2610, 'l2_leaf_reg': 2.837673380645965e-08, 'border_count': 35, 'bagging_temperature': 0.6550651082535945, 'random_strength': 5.278951489699416, 'grow_policy': 'Lossguide', 'min_data_in_leaf': 156, 'max_leaves': 53}. Best is trial 905 with value: 2398.0485076415025.[0m
[32m[I 2024-10-13 08:59:41,522][0m Trial 911 finished with value: 7993.825394693602 and parameters: {'depth': 12, 'learning_rate': 0.2125876659109757, 'iterations': 2724, 'l2_leaf_reg': 2.4429906649676475e-08, 'border_count': 28, 'bagging_temperature': 0.6320412720195809, 'random_strength': 1.735152211518939, 'grow_policy': 'Lossguide', 'min_data_in_leaf': 93, 'max_leaves': 50}. Best is trial 905 with value: 2398.0485076415025.[0m
[32m[I 2024-10-13 08:59:44,535][0m Trial 912 finished with value: 5492.344904470575 and parameters: {'depth': 10, 'learning_rate': 0.23223825439618104, 'iterations': 2416, 'l2_leaf_reg': 1.4119868000529914e-08, 'border_count': 41, 'bagging_temperature': 0.686885855283036, 'random_strength': 4.988501348842846, 'grow_policy': 'Lossguide', 'min_data_in_leaf': 121, 'max_leaves': 59}. Best is trial 905 with value: 2398.0485076415025.[0m
[32m[I 2024-10-13 08:59:49,578][0m Trial 913 finished with value: 2809.0414423277516 and parameters: {'depth': 12, 'learning_rate': 0.17386262707789576, 'iterations': 2484, 'l2_leaf_reg': 1.724755893960455e-08, 'border_count': 45, 'bagging_temperature': 0.6418872539837396, 'random_strength': 4.4888599100032405, 'grow_policy': 'Lossguide', 'min_data_in_leaf': 92, 'max_leaves': 54}. Best is trial 905 with value: 2398.0485076415025.[0m
[32m[I 2024-10-13 08:59:55,277][0m Trial 914 finished with value: 5007.510525992937 and parameters: {'depth': 12, 'learning_rate': 0.20448651367543902, 'iterations': 2814, 'l2_leaf_reg': 1.1556397993580353e-08, 'border_count': 38, 'bagging_temperature': 0.6676906915655868, 'random_strength': 7.181521140254804, 'grow_policy': 'Lossguide', 'min_data_in_leaf': 140, 'max_leaves': 34}. Best is trial 905 with value: 2398.0485076415025.[0m
[32m[I 2024-10-13 08:59:59,398][0m Trial 915 finished with value: 23525.049517207095 and parameters: {'depth': 10, 'learning_rate': 0.0001802314060876666, 'iterations': 2330, 'l2_leaf_reg': 3.020121464332028e-08, 'border_count': 48, 'bagging_temperature': 0.6195642408765532, 'random_strength': 5.137388337277191, 'grow_policy': 'Lossguide', 'min_data_in_leaf': 115, 'max_leaves': 48}. Best is trial 905 with value: 2398.0485076415025.[0m
[32m[I 2024-10-13 09:00:04,273][0m Trial 916 finished with value: 7324.903920100591 and parameters: {'depth': 11, 'learning_rate': 0.26260352960652356, 'iterations': 2667, 'l2_leaf_reg': 1.654960908036872e-08, 'border_count': 32, 'bagging_temperature': 0.6338433285766774, 'random_strength': 4.665779302881427, 'grow_policy': 'Lossguide', 'min_data_in_leaf': 91, 'max_leaves': 43}. Best is trial 905 with value: 2398.0485076415025.[0m
[32m[I 2024-10-13 09:00:08,710][0m Trial 917 finished with value: 3214.3032238905307 and parameters: {'depth': 12, 'learning_rate': 0.16662618522426795, 'iterations': 2721, 'l2_leaf_reg': 5.287299200373375e-08, 'border_count': 43, 'bagging_temperature': 0.6563334704964967, 'random_strength': 1.511357310220653, 'grow_policy': 'Lossguide', 'min_data_in_leaf': 742, 'max_leaves': 40}. Best is trial 905 with value: 2398.0485076415025.[0m
[32m[I 2024-10-13 09:00:13,665][0m Trial 918 finished with value: 4678.486443562338 and parameters: {'depth': 11, 'learning_rate': 0.22471773441800993, 'iterations': 2561, 'l2_leaf_reg': 1.976989699265183e-06, 'border_count': 39, 'bagging_temperature': 0.9338238692254843, 'random_strength': 5.079657028444423, 'grow_policy': 'Depthwise', 'min_data_in_leaf': 113}. Best is trial 905 with value: 2398.0485076415025.[0m
[32m[I 2024-10-13 09:00:19,054][0m Trial 919 finished with value: 2881.9620481803636 and parameters: {'depth': 11, 'learning_rate': 0.193553248955723, 'iterations': 2618, 'l2_leaf_reg': 1.155707616452845e-08, 'border_count': 48, 'bagging_temperature': 0.7130856834139857, 'random_strength': 5.202589911416197, 'grow_policy': 'Lossguide', 'min_data_in_leaf': 82, 'max_leaves': 58}. Best is trial 905 with value: 2398.0485076415025.[0m
[32m[I 2024-10-13 09:00:22,915][0m Trial 920 finished with value: 4421.072663179607 and parameters: {'depth': 8, 'learning_rate': 0.2613883881295732, 'iterations': 1756, 'l2_leaf_reg': 9.488616438141701, 'border_count': 180, 'bagging_temperature': 0.61535428972248, 'random_strength': 4.6164787353089185, 'grow_policy': 'Lossguide', 'min_data_in_leaf': 154, 'max_leaves': 141}. Best is trial 905 with value: 2398.0485076415025.[0m
[32m[I 2024-10-13 09:00:27,803][0m Trial 921 finished with value: 3336.702530308756 and parameters: {'depth': 11, 'learning_rate': 0.1565469725701622, 'iterations': 2761, 'l2_leaf_reg': 3.636119526250143e-08, 'border_count': 43, 'bagging_temperature': 0.6701616302473301, 'random_strength': 1.2474228813137949, 'grow_policy': 'Lossguide', 'min_data_in_leaf': 124, 'max_leaves': 122}. Best is trial 905 with value: 2398.0485076415025.[0m
[32m[I 2024-10-13 09:00:33,366][0m Trial 922 finished with value: 4493.649865307935 and parameters: {'depth': 11, 'learning_rate': 0.22007325019645305, 'iterations': 2839, 'l2_leaf_reg': 0.7993017769526908, 'border_count': 50, 'bagging_temperature': 0.2770702029173552, 'random_strength': 4.499877805628854, 'grow_policy': 'Lossguide', 'min_data_in_leaf': 511, 'max_leaves': 51}. Best is trial 905 with value: 2398.0485076415025.[0m
[32m[I 2024-10-13 09:00:38,788][0m Trial 923 finished with value: 5050.878651811131 and parameters: {'depth': 10, 'learning_rate': 0.11629515240098065, 'iterations': 2523, 'l2_leaf_reg': 1.9025160929564858e-08, 'border_count': 34, 'bagging_temperature': 0.6249649598322189, 'random_strength': 4.944757710878287, 'grow_policy': 'Lossguide', 'min_data_in_leaf': 78, 'max_leaves': 35}. Best is trial 905 with value: 2398.0485076415025.[0m
[32m[I 2024-10-13 09:00:42,654][0m Trial 924 finished with value: 2905.2808931303207 and parameters: {'depth': 10, 'learning_rate': 0.26012187114369806, 'iterations': 2666, 'l2_leaf_reg': 4.5494581970943326e-08, 'border_count': 43, 'bagging_temperature': 0.6885560558867128, 'random_strength': 8.61848680858856, 'grow_policy': 'Lossguide', 'min_data_in_leaf': 103, 'max_leaves': 46}. Best is trial 905 with value: 2398.0485076415025.[0m
[32m[I 2024-10-13 09:00:47,636][0m Trial 925 finished with value: 4692.55104762697 and parameters: {'depth': 10, 'learning_rate': 0.19127959436637787, 'iterations': 2709, 'l2_leaf_reg': 0.016531327584394392, 'border_count': 38, 'bagging_temperature': 0.6468340002582496, 'random_strength': 8.934982047913996, 'grow_policy': 'Lossguide', 'min_data_in_leaf': 135, 'max_leaves': 55}. Best is trial 905 with value: 2398.0485076415025.[0m
[32m[I 2024-10-13 09:00:50,904][0m Trial 926 finished with value: 2946.4450904781097 and parameters: {'depth': 4, 'learning_rate': 0.2327894583037609, 'iterations': 1517, 'l2_leaf_reg': 8.611216689054142e-08, 'border_count': 47, 'bagging_temperature': 0.608818319099184, 'random_strength': 4.8582717396151525, 'grow_policy': 'Depthwise', 'min_data_in_leaf': 93}. Best is trial 905 with value: 2398.0485076415025.[0m
[32m[I 2024-10-13 09:00:56,046][0m Trial 927 finished with value: 3771.4909282851954 and parameters: {'depth': 11, 'learning_rate': 0.17739035480053822, 'iterations': 2468, 'l2_leaf_reg': 2.3786283625212687e-08, 'border_count': 53, 'bagging_temperature': 0.6450593593081431, 'random_strength': 4.337127911844476, 'grow_policy': 'Lossguide', 'min_data_in_leaf': 686, 'max_leaves': 63}. Best is trial 905 with value: 2398.0485076415025.[0m
[32m[I 2024-10-13 09:01:01,291][0m Trial 928 finished with value: 6464.098006128024 and parameters: {'depth': 12, 'learning_rate': 0.1426600309179661, 'iterations': 2940, 'l2_leaf_reg': 1.7767357434366526e-08, 'border_count': 29, 'bagging_temperature': 0.6259262345318992, 'random_strength': 8.192557353965379, 'grow_policy': 'Lossguide', 'min_data_in_leaf': 69, 'max_leaves': 31}. Best is trial 905 with value: 2398.0485076415025.[0m
[32m[I 2024-10-13 09:01:05,161][0m Trial 929 finished with value: 6411.332911715007 and parameters: {'depth': 8, 'learning_rate': 0.26716413722893934, 'iterations': 2785, 'l2_leaf_reg': 1.1529544277342616e-05, 'border_count': 41, 'bagging_temperature': 0.7482969448418479, 'random_strength': 4.065882413544011, 'grow_policy': 'Lossguide', 'min_data_in_leaf': 114, 'max_leaves': 42}. Best is trial 905 with value: 2398.0485076415025.[0m
[32m[I 2024-10-13 09:01:09,812][0m Trial 930 finished with value: 2808.2106487886035 and parameters: {'depth': 12, 'learning_rate': 0.2046825061466909, 'iterations': 2617, 'l2_leaf_reg': 0.0009189237286091203, 'border_count': 47, 'bagging_temperature': 0.5489364203433805, 'random_strength': 1.074636519072721, 'grow_policy': 'Lossguide', 'min_data_in_leaf': 100, 'max_leaves': 51}. Best is trial 905 with value: 2398.0485076415025.[0m
[32m[I 2024-10-13 09:01:35,850][0m Trial 931 finished with value: 5214.56953505049 and parameters: {'depth': 9, 'learning_rate': 0.16556649518558153, 'iterations': 2180, 'l2_leaf_reg': 2.0056281009435467e-05, 'border_count': 36, 'bagging_temperature': 0.6025393890707746, 'random_strength': 5.9639508117117925, 'grow_policy': 'SymmetricTree', 'min_data_in_leaf': 141}. Best is trial 905 with value: 2398.0485076415025.[0m
[32m[I 2024-10-13 09:01:39,885][0m Trial 932 finished with value: 3030.134625529148 and parameters: {'depth': 11, 'learning_rate': 0.23632457409916785, 'iterations': 2865, 'l2_leaf_reg': 6.623288742095359e-06, 'border_count': 51, 'bagging_temperature': 0.6993242079560383, 'random_strength': 5.00882774016393, 'grow_policy': 'Lossguide', 'min_data_in_leaf': 75, 'max_leaves': 109}. Best is trial 905 with value: 2398.0485076415025.[0m
[32m[I 2024-10-13 09:01:45,096][0m Trial 933 finished with value: 3329.9254082686316 and parameters: {'depth': 8, 'learning_rate': 0.26687666903593726, 'iterations': 2096, 'l2_leaf_reg': 2.784348092460343e-05, 'border_count': 45, 'bagging_temperature': 0.6660101523580406, 'random_strength': 4.303407120736285, 'grow_policy': 'Lossguide', 'min_data_in_leaf': 58, 'max_leaves': 61}. Best is trial 905 with value: 2398.0485076415025.[0m
[32m[I 2024-10-13 09:01:49,692][0m Trial 934 finished with value: 5310.34006935826 and parameters: {'depth': 7, 'learning_rate': 0.20402122963612981, 'iterations': 2555, 'l2_leaf_reg': 0.0067710925579305085, 'border_count': 40, 'bagging_temperature': 0.6347943894106374, 'random_strength': 0.2086172927093644, 'grow_policy': 'Lossguide', 'min_data_in_leaf': 115, 'max_leaves': 38}. Best is trial 905 with value: 2398.0485076415025.[0m
[32m[I 2024-10-13 09:01:54,874][0m Trial 935 finished with value: 2985.984415641999 and parameters: {'depth': 7, 'learning_rate': 0.057715008380977297, 'iterations': 2414, 'l2_leaf_reg': 1.1789936657106338e-06, 'border_count': 55, 'bagging_temperature': 0.6005971300629956, 'random_strength': 1.4954989892320816, 'grow_policy': 'Depthwise', 'min_data_in_leaf': 84}. Best is trial 905 with value: 2398.0485076415025.[0m
[32m[I 2024-10-13 09:01:59,714][0m Trial 936 finished with value: 6143.69755774291 and parameters: {'depth': 8, 'learning_rate': 0.12916123889331277, 'iterations': 2737, 'l2_leaf_reg': 1.035764250046721e-05, 'border_count': 12, 'bagging_temperature': 0.5405968258596823, 'random_strength': 4.888412450462223, 'grow_policy': 'Lossguide', 'min_data_in_leaf': 102, 'max_leaves': 56}. Best is trial 905 with value: 2398.0485076415025.[0m
[32m[I 2024-10-13 09:02:04,733][0m Trial 937 finished with value: 5438.406460974467 and parameters: {'depth': 11, 'learning_rate': 0.1805789078940369, 'iterations': 2818, 'l2_leaf_reg': 1.5658999627188796e-06, 'border_count': 34, 'bagging_temperature': 0.5687438890273437, 'random_strength': 3.5376698928404497, 'grow_policy': 'Lossguide', 'min_data_in_leaf': 133, 'max_leaves': 48}. Best is trial 905 with value: 2398.0485076415025.[0m
[32m[I 2024-10-13 09:02:11,378][0m Trial 938 finished with value: 3468.870106331088 and parameters: {'depth': 7, 'learning_rate': 0.21495238747957107, 'iterations': 2668, 'l2_leaf_reg': 2.7060211005909643e-08, 'border_count': 50, 'bagging_temperature': 0.6198745678196672, 'random_strength': 0.9086368748663523, 'grow_policy': 'Lossguide', 'min_data_in_leaf': 55, 'max_leaves': 43}. Best is trial 905 with value: 2398.0485076415025.[0m
[32m[I 2024-10-13 09:02:14,666][0m Trial 939 finished with value: 3172.003943607973 and parameters: {'depth': 7, 'learning_rate': 0.15061363175975997, 'iterations': 2508, 'l2_leaf_reg': 1.071484416843104e-08, 'border_count': 44, 'bagging_temperature': 0.6551246562829248, 'random_strength': 0.31683158982503545, 'grow_policy': 'Lossguide', 'min_data_in_leaf': 167, 'max_leaves': 38}. Best is trial 905 with value: 2398.0485076415025.[0m
[32m[I 2024-10-13 09:02:20,435][0m Trial 940 finished with value: 3707.37887946223 and parameters: {'depth': 10, 'learning_rate': 0.236564060443252, 'iterations': 2954, 'l2_leaf_reg': 5.045882559077894e-06, 'border_count': 41, 'bagging_temperature': 0.681648605395089, 'random_strength': 9.43448704282046, 'grow_policy': 'Lossguide', 'min_data_in_leaf': 79, 'max_leaves': 47}. Best is trial 905 with value: 2398.0485076415025.[0m
[32m[I 2024-10-13 09:02:25,180][0m Trial 941 finished with value: 3710.6074679532176 and parameters: {'depth': 8, 'learning_rate': 0.02425335748743698, 'iterations': 2585, 'l2_leaf_reg': 0.07891471813156556, 'border_count': 47, 'bagging_temperature': 0.5895485130494704, 'random_strength': 2.985917037728664, 'grow_policy': 'Lossguide', 'min_data_in_leaf': 105, 'max_leaves': 53}. Best is trial 905 with value: 2398.0485076415025.[0m
[32m[I 2024-10-13 09:02:29,325][0m Trial 942 finished with value: 6277.933045687466 and parameters: {'depth': 13, 'learning_rate': 0.26628955435782514, 'iterations': 2706, 'l2_leaf_reg': 2.960187488326562e-06, 'border_count': 21, 'bagging_temperature': 0.6352905750178116, 'random_strength': 4.775905157984105, 'grow_policy': 'Lossguide', 'min_data_in_leaf': 124, 'max_leaves': 60}. Best is trial 905 with value: 2398.0485076415025.[0m
[32m[I 2024-10-13 09:02:33,150][0m Trial 943 finished with value: 3754.125595378683 and parameters: {'depth': 7, 'learning_rate': 0.09914255115818357, 'iterations': 2999, 'l2_leaf_reg': 6.963866402412251e-08, 'border_count': 55, 'bagging_temperature': 0.5623697832463886, 'random_strength': 1.217260033614283, 'grow_policy': 'Lossguide', 'min_data_in_leaf': 153, 'max_leaves': 42}. Best is trial 905 with value: 2398.0485076415025.[0m
[32m[I 2024-10-13 09:02:38,244][0m Trial 944 finished with value: 4615.009934507791 and parameters: {'depth': 9, 'learning_rate': 0.18271425304054148, 'iterations': 2636, 'l2_leaf_reg': 0.0005418404492274882, 'border_count': 37, 'bagging_temperature': 0.6095173997972183, 'random_strength': 0.5362990332373478, 'grow_policy': 'Depthwise', 'min_data_in_leaf': 87}. Best is trial 905 with value: 2398.0485076415025.[0m
[32m[I 2024-10-13 09:02:44,726][0m Trial 945 finished with value: 4938.039894212417 and parameters: {'depth': 8, 'learning_rate': 0.20817602702432528, 'iterations': 2784, 'l2_leaf_reg': 6.808242559414954e-07, 'border_count': 109, 'bagging_temperature': 0.7204808545174525, 'random_strength': 0.7772751947439888, 'grow_policy': 'Lossguide', 'min_data_in_leaf': 55, 'max_leaves': 35}. Best is trial 905 with value: 2398.0485076415025.[0m
[32m[I 2024-10-13 09:02:49,896][0m Trial 946 finished with value: 4369.346152406909 and parameters: {'depth': 7, 'learning_rate': 0.1575217386739343, 'iterations': 2895, 'l2_leaf_reg': 0.001574661061819502, 'border_count': 51, 'bagging_temperature': 0.5267245015133732, 'random_strength': 1.0103652291947607, 'grow_policy': 'Lossguide', 'min_data_in_leaf': 104, 'max_leaves': 31}. Best is trial 905 with value: 2398.0485076415025.[0m
[32m[I 2024-10-13 09:02:52,421][0m Trial 947 finished with value: 3120.5540330133636 and parameters: {'depth': 12, 'learning_rate': 0.22915413367612658, 'iterations': 1083, 'l2_leaf_reg': 3.1053680887259805e-05, 'border_count': 43, 'bagging_temperature': 0.5818388018220725, 'random_strength': 0.13221333381127087, 'grow_policy': 'Lossguide', 'min_data_in_leaf': 330, 'max_leaves': 64}. Best is trial 905 with value: 2398.0485076415025.[0m
[32m[I 2024-10-13 09:02:55,191][0m Trial 948 finished with value: 7730.673002643676 and parameters: {'depth': 7, 'learning_rate': 0.2684085509792405, 'iterations': 2260, 'l2_leaf_reg': 1.971446117433582e-05, 'border_count': 31, 'bagging_temperature': 0.6510654832486297, 'random_strength': 0.4554015162351752, 'grow_policy': 'Lossguide', 'min_data_in_leaf': 74, 'max_leaves': 50}. Best is trial 905 with value: 2398.0485076415025.[0m
[32m[I 2024-10-13 09:02:58,608][0m Trial 949 finished with value: 3188.940638447748 and parameters: {'depth': 8, 'learning_rate': 0.1871157702225712, 'iterations': 2829, 'l2_leaf_reg': 1.3601035365748303e-05, 'border_count': 48, 'bagging_temperature': 0.6768463660313464, 'random_strength': 0.7003566812344668, 'grow_policy': 'Lossguide', 'min_data_in_leaf': 128, 'max_leaves': 57}. Best is trial 905 with value: 2398.0485076415025.[0m
[32m[I 2024-10-13 09:03:04,140][0m Trial 950 finished with value: 3599.578782519586 and parameters: {'depth': 7, 'learning_rate': 0.13468677242788732, 'iterations': 2701, 'l2_leaf_reg': 2.2127670519109928, 'border_count': 40, 'bagging_temperature': 0.6109470289754259, 'random_strength': 0.3122554312197592, 'grow_policy': 'Lossguide', 'min_data_in_leaf': 40, 'max_leaves': 47}. Best is trial 905 with value: 2398.0485076415025.[0m
[32m[I 2024-10-13 09:03:15,862][0m Trial 951 finished with value: 5115.404009064958 and parameters: {'depth': 7, 'learning_rate': 0.22797075273914172, 'iterations': 1601, 'l2_leaf_reg': 8.59104200630457e-07, 'border_count': 58, 'bagging_temperature': 0.5559526033068299, 'random_strength': 1.4195146854665324, 'grow_policy': 'SymmetricTree', 'min_data_in_leaf': 93}. Best is trial 905 with value: 2398.0485076415025.[0m
