[32m[I 2024-10-13 08:39:11,972][0m Trial 702 finished with value: 5010.355843815042 and parameters: {'depth': 8, 'learning_rate': 0.0010700128190648589, 'iterations': 2944, 'l2_leaf_reg': 0.00042596034082514054, 'border_count': 33, 'bagging_temperature': 0.6582636349452536, 'random_strength': 7.64009088692877, 'grow_policy': 'Lossguide', 'min_data_in_leaf': 53, 'max_leaves': 191}. Best is trial 472 with value: 2453.464132483589.[0m
[32m[I 2024-10-13 08:39:15,902][0m Trial 703 finished with value: 5088.247581715516 and parameters: {'depth': 13, 'learning_rate': 0.2301063951346737, 'iterations': 2639, 'l2_leaf_reg': 3.7503961132769023e-07, 'border_count': 196, 'bagging_temperature': 0.5860935766624683, 'random_strength': 1.2981866337620316, 'grow_policy': 'Lossguide', 'min_data_in_leaf': 105, 'max_leaves': 118}. Best is trial 472 with value: 2453.464132483589.[0m
[32m[I 2024-10-13 08:39:20,385][0m Trial 704 finished with value: 3174.153523009814 and parameters: {'depth': 7, 'learning_rate': 0.29816668638766713, 'iterations': 2744, 'l2_leaf_reg': 1.3935733435501503e-05, 'border_count': 47, 'bagging_temperature': 0.6314150337177376, 'random_strength': 0.9578031684032864, 'grow_policy': 'Lossguide', 'min_data_in_leaf': 83, 'max_leaves': 65}. Best is trial 472 with value: 2453.464132483589.[0m
[32m[I 2024-10-13 08:39:24,986][0m Trial 705 finished with value: 3725.056526696925 and parameters: {'depth': 7, 'learning_rate': 0.14255707683610164, 'iterations': 2503, 'l2_leaf_reg': 0.0018473657985704909, 'border_count': 53, 'bagging_temperature': 0.6902327358700349, 'random_strength': 6.9715968785672295, 'grow_policy': 'Depthwise', 'min_data_in_leaf': 124}. Best is trial 472 with value: 2453.464132483589.[0m
[32m[I 2024-10-13 08:39:29,702][0m Trial 706 finished with value: 4457.144664300894 and parameters: {'depth': 8, 'learning_rate': 0.19012605138223343, 'iterations': 2993, 'l2_leaf_reg': 0.0001663800147563869, 'border_count': 114, 'bagging_temperature': 0.6160223299198277, 'random_strength': 0.5575077210370483, 'grow_policy': 'Lossguide', 'min_data_in_leaf': 66, 'max_leaves': 105}. Best is trial 472 with value: 2453.464132483589.[0m
[32m[I 2024-10-13 08:39:30,708][0m Trial 707 finished with value: 5507.816574516528 and parameters: {'depth': 7, 'learning_rate': 0.23324096222121016, 'iterations': 352, 'l2_leaf_reg': 7.900634590408805e-06, 'border_count': 41, 'bagging_temperature': 0.5948795066383301, 'random_strength': 0.37405437271777975, 'grow_policy': 'Lossguide', 'min_data_in_leaf': 96, 'max_leaves': 51}. Best is trial 472 with value: 2453.464132483589.[0m
[32m[I 2024-10-13 08:39:53,209][0m Trial 708 finished with value: 4321.9510799418495 and parameters: {'depth': 6, 'learning_rate': 0.20233666476292328, 'iterations': 2821, 'l2_leaf_reg': 2.8209732130259847e-05, 'border_count': 59, 'bagging_temperature': 0.6486095444999882, 'random_strength': 0.11906117670598318, 'grow_policy': 'SymmetricTree', 'min_data_in_leaf': 141}. Best is trial 472 with value: 2453.464132483589.[0m
[32m[I 2024-10-13 08:39:59,013][0m Trial 709 finished with value: 3071.9108792865077 and parameters: {'depth': 7, 'learning_rate': 0.26179761820015107, 'iterations': 2889, 'l2_leaf_reg': 1.8122375419624956e-05, 'border_count': 47, 'bagging_temperature': 0.5754850440975326, 'random_strength': 0.7665202157377128, 'grow_policy': 'Lossguide', 'min_data_in_leaf': 114, 'max_leaves': 60}. Best is trial 472 with value: 2453.464132483589.[0m
[32m[I 2024-10-13 08:40:03,961][0m Trial 710 finished with value: 2965.00222149562 and parameters: {'depth': 8, 'learning_rate': 0.16914106070717877, 'iterations': 2317, 'l2_leaf_reg': 4.857113639895901e-08, 'border_count': 43, 'bagging_temperature': 0.623959673764413, 'random_strength': 9.154635053472084, 'grow_policy': 'Lossguide', 'min_data_in_leaf': 76, 'max_leaves': 45}. Best is trial 472 with value: 2453.464132483589.[0m
[32m[I 2024-10-13 08:40:07,296][0m Trial 711 finished with value: 4328.012174011113 and parameters: {'depth': 8, 'learning_rate': 0.22838828451692428, 'iterations': 1087, 'l2_leaf_reg': 4.526124992783857e-06, 'border_count': 37, 'bagging_temperature': 0.44564040707618796, 'random_strength': 1.0252546679240973, 'grow_policy': 'Lossguide', 'min_data_in_leaf': 44, 'max_leaves': 50}. Best is trial 472 with value: 2453.464132483589.[0m
[32m[I 2024-10-13 08:40:10,563][0m Trial 712 finished with value: 4050.196032496817 and parameters: {'depth': 7, 'learning_rate': 0.1284504976374776, 'iterations': 2566, 'l2_leaf_reg': 7.92337759147619e-05, 'border_count': 50, 'bagging_temperature': 0.5935342291813467, 'random_strength': 0.4980141393095981, 'grow_policy': 'Lossguide', 'min_data_in_leaf': 96, 'max_leaves': 221}. Best is trial 472 with value: 2453.464132483589.[0m
[32m[I 2024-10-13 08:40:15,673][0m Trial 713 finished with value: 5690.248644152418 and parameters: {'depth': 7, 'learning_rate': 0.26246660691922263, 'iterations': 2778, 'l2_leaf_reg': 5.024140978216195e-07, 'border_count': 35, 'bagging_temperature': 0.7145342936193759, 'random_strength': 2.699074703815543, 'grow_policy': 'Lossguide', 'min_data_in_leaf': 128, 'max_leaves': 68}. Best is trial 472 with value: 2453.464132483589.[0m
[32m[I 2024-10-13 08:40:20,817][0m Trial 714 finished with value: 3071.934339907256 and parameters: {'depth': 7, 'learning_rate': 0.1877400420498821, 'iterations': 2667, 'l2_leaf_reg': 8.363976586383895e-08, 'border_count': 45, 'bagging_temperature': 0.6703656431622426, 'random_strength': 0.7205533519352605, 'grow_policy': 'Lossguide', 'min_data_in_leaf': 158, 'max_leaves': 42}. Best is trial 472 with value: 2453.464132483589.[0m
[32m[I 2024-10-13 08:40:25,825][0m Trial 715 finished with value: 3489.110111619238 and parameters: {'depth': 9, 'learning_rate': 0.15717831469141302, 'iterations': 2399, 'l2_leaf_reg': 3.790242726735346e-05, 'border_count': 54, 'bagging_temperature': 0.50553858200843, 'random_strength': 0.0006028000956759816, 'grow_policy': 'Depthwise', 'min_data_in_leaf': 110}. Best is trial 472 with value: 2453.464132483589.[0m
[32m[I 2024-10-13 08:40:38,454][0m Trial 716 finished with value: 4303.998725561319 and parameters: {'depth': 8, 'learning_rate': 0.21759022434049716, 'iterations': 2839, 'l2_leaf_reg': 0.00015852398283483726, 'border_count': 40, 'bagging_temperature': 0.6402577216423206, 'random_strength': 0.2036324768111208, 'grow_policy': 'Lossguide', 'min_data_in_leaf': 21, 'max_leaves': 56}. Best is trial 472 with value: 2453.464132483589.[0m
[32m[I 2024-10-13 08:40:43,369][0m Trial 717 finished with value: 3885.6528132126414 and parameters: {'depth': 7, 'learning_rate': 0.19881886431655055, 'iterations': 2730, 'l2_leaf_reg': 0.00027807097573830276, 'border_count': 64, 'bagging_temperature': 0.4737785907613461, 'random_strength': 3.571544215201676, 'grow_policy': 'Lossguide', 'min_data_in_leaf': 541, 'max_leaves': 48}. Best is trial 472 with value: 2453.464132483589.[0m
[32m[I 2024-10-13 08:40:48,435][0m Trial 718 finished with value: 3288.2543582183944 and parameters: {'depth': 15, 'learning_rate': 0.2646586276069924, 'iterations': 2604, 'l2_leaf_reg': 2.6459353242328255e-07, 'border_count': 49, 'bagging_temperature': 0.570117713778022, 'random_strength': 0.37250216710480266, 'grow_policy': 'Lossguide', 'min_data_in_leaf': 68, 'max_leaves': 97}. Best is trial 472 with value: 2453.464132483589.[0m
[32m[I 2024-10-13 08:40:52,318][0m Trial 719 finished with value: 6473.247979992637 and parameters: {'depth': 7, 'learning_rate': 0.23018425594781877, 'iterations': 2490, 'l2_leaf_reg': 6.111869099648476e-05, 'border_count': 32, 'bagging_temperature': 0.6094819236841953, 'random_strength': 1.1888569885470235, 'grow_policy': 'Lossguide', 'min_data_in_leaf': 88, 'max_leaves': 175}. Best is trial 472 with value: 2453.464132483589.[0m
[32m[I 2024-10-13 08:40:57,437][0m Trial 720 finished with value: 3095.116047749627 and parameters: {'depth': 8, 'learning_rate': 0.17816301981325175, 'iterations': 2913, 'l2_leaf_reg': 1.8633504525066302e-06, 'border_count': 45, 'bagging_temperature': 0.5534274850602039, 'random_strength': 8.026880679574377, 'grow_policy': 'Lossguide', 'min_data_in_leaf': 138, 'max_leaves': 38}. Best is trial 472 with value: 2453.464132483589.[0m
[32m[I 2024-10-13 08:41:04,115][0m Trial 721 finished with value: 3269.023541983138 and parameters: {'depth': 6, 'learning_rate': 0.29977896690595546, 'iterations': 2681, 'l2_leaf_reg': 1.7405932496942836e-05, 'border_count': 55, 'bagging_temperature': 0.6518524782827105, 'random_strength': 0.9074106988419103, 'grow_policy': 'Lossguide', 'min_data_in_leaf': 55, 'max_leaves': 241}. Best is trial 472 with value: 2453.464132483589.[0m
[32m[I 2024-10-13 08:41:09,941][0m Trial 722 finished with value: 4887.2646322603705 and parameters: {'depth': 5, 'learning_rate': 0.1455739237895397, 'iterations': 2780, 'l2_leaf_reg': 8.05674583692991e-06, 'border_count': 37, 'bagging_temperature': 0.6160311237352278, 'random_strength': 0.6711003918389902, 'grow_policy': 'Lossguide', 'min_data_in_leaf': 108, 'max_leaves': 62}. Best is trial 472 with value: 2453.464132483589.[0m
[32m[I 2024-10-13 08:41:15,358][0m Trial 723 finished with value: 4351.3464152480365 and parameters: {'depth': 7, 'learning_rate': 0.2092117176056262, 'iterations': 2448, 'l2_leaf_reg': 1.3111363268519024e-07, 'border_count': 105, 'bagging_temperature': 0.6785458660155692, 'random_strength': 0.5500301260864984, 'grow_policy': 'Depthwise', 'min_data_in_leaf': 86}. Best is trial 472 with value: 2453.464132483589.[0m
[32m[I 2024-10-13 08:41:21,353][0m Trial 724 finished with value: 4368.214806245274 and parameters: {'depth': 7, 'learning_rate': 0.016786191455039463, 'iterations': 2947, 'l2_leaf_reg': 3.584779360298554e-05, 'border_count': 42, 'bagging_temperature': 0.5809433903613248, 'random_strength': 1.4602938401942327, 'grow_policy': 'Lossguide', 'min_data_in_leaf': 122, 'max_leaves': 206}. Best is trial 472 with value: 2453.464132483589.[0m
[32m[I 2024-10-13 08:41:23,456][0m Trial 725 finished with value: 5300.082942551331 and parameters: {'depth': 8, 'learning_rate': 0.24598907991918817, 'iterations': 876, 'l2_leaf_reg': 0.0001168574977999835, 'border_count': 86, 'bagging_temperature': 0.5327150024423205, 'random_strength': 0.3164202829519662, 'grow_policy': 'Lossguide', 'min_data_in_leaf': 167, 'max_leaves': 53}. Best is trial 472 with value: 2453.464132483589.[0m
[32m[I 2024-10-13 08:41:25,086][0m Trial 726 finished with value: 3455.2460614569445 and parameters: {'depth': 7, 'learning_rate': 0.16899213981564737, 'iterations': 713, 'l2_leaf_reg': 5.425747665771465e-07, 'border_count': 51, 'bagging_temperature': 0.6281255922090617, 'random_strength': 1.0884236078185243, 'grow_policy': 'Lossguide', 'min_data_in_leaf': 71, 'max_leaves': 44}. Best is trial 472 with value: 2453.464132483589.[0m
[32m[I 2024-10-13 08:41:28,274][0m Trial 727 finished with value: 2952.647056997355 and parameters: {'depth': 8, 'learning_rate': 0.20729950888169102, 'iterations': 2626, 'l2_leaf_reg': 0.0004630249172422546, 'border_count': 48, 'bagging_temperature': 0.6960508374467151, 'random_strength': 0.752056163709047, 'grow_policy': 'Lossguide', 'min_data_in_leaf': 144, 'max_leaves': 59}. Best is trial 472 with value: 2453.464132483589.[0m
[32m[I 2024-10-13 08:41:33,304][0m Trial 728 finished with value: 4216.0205503594025 and parameters: {'depth': 10, 'learning_rate': 0.2613362430779041, 'iterations': 2840, 'l2_leaf_reg': 0.11240587581597498, 'border_count': 59, 'bagging_temperature': 0.5961687321321636, 'random_strength': 0.4936883053355029, 'grow_policy': 'Lossguide', 'min_data_in_leaf': 104, 'max_leaves': 40}. Best is trial 472 with value: 2453.464132483589.[0m
[32m[I 2024-10-13 08:41:38,057][0m Trial 729 finished with value: 4818.475788871078 and parameters: {'depth': 8, 'learning_rate': 0.18549507849063335, 'iterations': 2702, 'l2_leaf_reg': 1.1155986245742045e-05, 'border_count': 40, 'bagging_temperature': 0.5549318284938968, 'random_strength': 0.18416129891281544, 'grow_policy': 'Lossguide', 'min_data_in_leaf': 371, 'max_leaves': 48}. Best is trial 472 with value: 2453.464132483589.[0m
[32m[I 2024-10-13 08:41:45,376][0m Trial 730 finished with value: 3936.386330484001 and parameters: {'depth': 9, 'learning_rate': 0.2301128576079553, 'iterations': 2559, 'l2_leaf_reg': 2.5175542563015615e-05, 'border_count': 31, 'bagging_temperature': 0.6620098680524672, 'random_strength': 0.8957182504215182, 'grow_policy': 'Lossguide', 'min_data_in_leaf': 38, 'max_leaves': 157}. Best is trial 472 with value: 2453.464132483589.[0m
[32m[I 2024-10-13 08:41:50,073][0m Trial 731 finished with value: 2975.1101126753197 and parameters: {'depth': 7, 'learning_rate': 0.26520517399255017, 'iterations': 2997, 'l2_leaf_reg': 3.6804980782219175e-07, 'border_count': 44, 'bagging_temperature': 0.6102212593431128, 'random_strength': 9.669493980960969, 'grow_policy': 'Depthwise', 'min_data_in_leaf': 258}. Best is trial 472 with value: 2453.464132483589.[0m
[32m[I 2024-10-13 08:42:10,818][0m Trial 732 finished with value: 4190.726880170307 and parameters: {'depth': 7, 'learning_rate': 0.2992483443603265, 'iterations': 2758, 'l2_leaf_reg': 8.269172448245263e-05, 'border_count': 53, 'bagging_temperature': 0.4848472293917473, 'random_strength': 0.0032651712961100365, 'grow_policy': 'SymmetricTree', 'min_data_in_leaf': 86}. Best is trial 472 with value: 2453.464132483589.[0m
[32m[I 2024-10-13 08:42:15,926][0m Trial 733 finished with value: 3334.441995274851 and parameters: {'depth': 6, 'learning_rate': 0.1505106123392507, 'iterations': 2889, 'l2_leaf_reg': 0.00022394720526077366, 'border_count': 48, 'bagging_temperature': 0.6423118309073025, 'random_strength': 1.7577595491613405, 'grow_policy': 'Lossguide', 'min_data_in_leaf': 128, 'max_leaves': 70}. Best is trial 472 with value: 2453.464132483589.[0m
[32m[I 2024-10-13 08:42:21,917][0m Trial 734 finished with value: 5177.550997794681 and parameters: {'depth': 8, 'learning_rate': 0.19892329193864705, 'iterations': 2815, 'l2_leaf_reg': 2.1691285338260026e-07, 'border_count': 243, 'bagging_temperature': 0.576589823013395, 'random_strength': 0.5908329099767535, 'grow_policy': 'Lossguide', 'min_data_in_leaf': 62, 'max_leaves': 54}. Best is trial 472 with value: 2453.464132483589.[0m
[32m[I 2024-10-13 08:42:26,562][0m Trial 735 finished with value: 4937.18919326614 and parameters: {'depth': 7, 'learning_rate': 0.22464873800485324, 'iterations': 2360, 'l2_leaf_reg': 1.4026067503907666e-06, 'border_count': 37, 'bagging_temperature': 0.595429448146369, 'random_strength': 1.293117982295305, 'grow_policy': 'Lossguide', 'min_data_in_leaf': 182, 'max_leaves': 145}. Best is trial 472 with value: 2453.464132483589.[0m
[32m[I 2024-10-13 08:42:31,812][0m Trial 736 finished with value: 2627.658683677036 and parameters: {'depth': 7, 'learning_rate': 0.171178536632436, 'iterations': 2652, 'l2_leaf_reg': 0.0009384115704605394, 'border_count': 43, 'bagging_temperature': 0.6260767072580613, 'random_strength': 0.32814509263404773, 'grow_policy': 'Lossguide', 'min_data_in_leaf': 98, 'max_leaves': 36}. Best is trial 472 with value: 2453.464132483589.[0m
[32m[I 2024-10-13 08:42:34,913][0m Trial 737 finished with value: 3399.949965413447 and parameters: {'depth': 7, 'learning_rate': 0.11697610887658824, 'iterations': 2538, 'l2_leaf_reg': 0.0012359212447035938, 'border_count': 40, 'bagging_temperature': 0.639445224048695, 'random_strength': 0.23025757531661206, 'grow_policy': 'Lossguide', 'min_data_in_leaf': 86, 'max_leaves': 183}. Best is trial 472 with value: 2453.464132483589.[0m
[32m[I 2024-10-13 08:42:39,008][0m Trial 738 finished with value: 3208.1827838462573 and parameters: {'depth': 7, 'learning_rate': 0.1217182112912457, 'iterations': 2594, 'l2_leaf_reg': 0.0009204153976971406, 'border_count': 46, 'bagging_temperature': 0.6617161753183598, 'random_strength': 8.81265878262001, 'grow_policy': 'Lossguide', 'min_data_in_leaf': 56, 'max_leaves': 66}. Best is trial 472 with value: 2453.464132483589.[0m
[32m[I 2024-10-13 08:42:43,707][0m Trial 739 finished with value: 3751.256892632262 and parameters: {'depth': 7, 'learning_rate': 0.13074558427567198, 'iterations': 2639, 'l2_leaf_reg': 0.000693750246415816, 'border_count': 55, 'bagging_temperature': 0.6373591959922643, 'random_strength': 0.29621661601077337, 'grow_policy': 'Lossguide', 'min_data_in_leaf': 100, 'max_leaves': 200}. Best is trial 472 with value: 2453.464132483589.[0m
[32m[I 2024-10-13 08:42:47,454][0m Trial 740 finished with value: 8569.456744403811 and parameters: {'depth': 6, 'learning_rate': 0.06894999140314365, 'iterations': 2505, 'l2_leaf_reg': 0.0006805749379828319, 'border_count': 28, 'bagging_temperature': 0.6207326579079058, 'random_strength': 0.45261480593021053, 'grow_policy': 'Lossguide', 'min_data_in_leaf': 74, 'max_leaves': 77}. Best is trial 472 with value: 2453.464132483589.[0m
[32m[I 2024-10-13 08:42:55,137][0m Trial 741 finished with value: 3543.785077134213 and parameters: {'depth': 7, 'learning_rate': 0.15873613425861044, 'iterations': 2583, 'l2_leaf_reg': 0.00044032642788431966, 'border_count': 35, 'bagging_temperature': 0.681516757102027, 'random_strength': 0.8978958772162366, 'grow_policy': 'Depthwise', 'min_data_in_leaf': 38}. Best is trial 472 with value: 2453.464132483589.[0m
[32m[I 2024-10-13 08:43:00,287][0m Trial 742 finished with value: 4436.564713655716 and parameters: {'depth': 7, 'learning_rate': 0.09888632838782715, 'iterations': 2660, 'l2_leaf_reg': 0.004629894894603467, 'border_count': 42, 'bagging_temperature': 0.6471463191200061, 'random_strength': 5.5353069015913805, 'grow_policy': 'Lossguide', 'min_data_in_leaf': 710, 'max_leaves': 35}. Best is trial 472 with value: 2453.464132483589.[0m
[32m[I 2024-10-13 08:43:04,799][0m Trial 743 finished with value: 4132.587002759749 and parameters: {'depth': 6, 'learning_rate': 0.16197689514789027, 'iterations': 2442, 'l2_leaf_reg': 0.0005032148457725466, 'border_count': 62, 'bagging_temperature': 0.6251895016198523, 'random_strength': 0.7137238853763326, 'grow_policy': 'Lossguide', 'min_data_in_leaf': 107, 'max_leaves': 45}. Best is trial 472 with value: 2453.464132483589.[0m
[32m[I 2024-10-13 08:43:09,203][0m Trial 744 finished with value: 3170.2848106150946 and parameters: {'depth': 7, 'learning_rate': 0.1681079622538564, 'iterations': 2532, 'l2_leaf_reg': 0.00022277571811495203, 'border_count': 52, 'bagging_temperature': 0.6592060678983827, 'random_strength': 1.082084350908021, 'grow_policy': 'Lossguide', 'min_data_in_leaf': 82, 'max_leaves': 91}. Best is trial 472 with value: 2453.464132483589.[0m
[32m[I 2024-10-13 08:43:21,881][0m Trial 745 finished with value: 4387.653674464506 and parameters: {'depth': 7, 'learning_rate': 0.13614793828527735, 'iterations': 2651, 'l2_leaf_reg': 0.0007712966160706177, 'border_count': 47, 'bagging_temperature': 0.7021155501576344, 'random_strength': 6.6261746647917805, 'grow_policy': 'Lossguide', 'min_data_in_leaf': 17, 'max_leaves': 41}. Best is trial 472 with value: 2453.464132483589.[0m
[32m[I 2024-10-13 08:43:27,476][0m Trial 746 finished with value: 3949.2185622239463 and parameters: {'depth': 7, 'learning_rate': 0.17862407466405034, 'iterations': 2707, 'l2_leaf_reg': 0.00034054371917362436, 'border_count': 37, 'bagging_temperature': 0.6268667661233376, 'random_strength': 0.32076797226526343, 'grow_policy': 'Lossguide', 'min_data_in_leaf': 61, 'max_leaves': 58}. Best is trial 472 with value: 2453.464132483589.[0m
[32m[I 2024-10-13 08:43:32,195][0m Trial 747 finished with value: 4367.2081633551015 and parameters: {'depth': 7, 'learning_rate': 0.19327763411378074, 'iterations': 2608, 'l2_leaf_reg': 0.00030558822008395033, 'border_count': 42, 'bagging_temperature': 0.6773670979247751, 'random_strength': 3.100790962471577, 'grow_policy': 'Lossguide', 'min_data_in_leaf': 456, 'max_leaves': 51}. Best is trial 472 with value: 2453.464132483589.[0m
[32m[I 2024-10-13 08:43:36,047][0m Trial 748 finished with value: 3299.5048332626575 and parameters: {'depth': 7, 'learning_rate': 0.20190972909437793, 'iterations': 2116, 'l2_leaf_reg': 2.5668678866059243e-06, 'border_count': 57, 'bagging_temperature': 0.6101766393364647, 'random_strength': 0.5819624127553329, 'grow_policy': 'Lossguide', 'min_data_in_leaf': 93, 'max_leaves': 247}. Best is trial 472 with value: 2453.464132483589.[0m
[32m[I 2024-10-13 08:43:40,484][0m Trial 749 finished with value: 4805.060510668318 and parameters: {'depth': 6, 'learning_rate': 0.15029240283742165, 'iterations': 2470, 'l2_leaf_reg': 0.0013824036805909978, 'border_count': 50, 'bagging_temperature': 0.5169293681957041, 'random_strength': 5.0745097499780085, 'grow_policy': 'Lossguide', 'min_data_in_leaf': 108, 'max_leaves': 62}. Best is trial 472 with value: 2453.464132483589.[0m
[32m[I 2024-10-13 08:43:45,416][0m Trial 750 finished with value: 4453.035425754847 and parameters: {'depth': 7, 'learning_rate': 0.2352546879916887, 'iterations': 2709, 'l2_leaf_reg': 0.0004878846133349213, 'border_count': 70, 'bagging_temperature': 0.7207848154589404, 'random_strength': 0.15842751123087445, 'grow_policy': 'Depthwise', 'min_data_in_leaf': 120}. Best is trial 472 with value: 2453.464132483589.[0m
[32m[I 2024-10-13 08:43:49,298][0m Trial 751 finished with value: 7278.775532185219 and parameters: {'depth': 7, 'learning_rate': 0.1777750987503687, 'iterations': 2563, 'l2_leaf_reg': 3.0030811129496536e-08, 'border_count': 23, 'bagging_temperature': 0.6539465369794193, 'random_strength': 0.43608566949490507, 'grow_policy': 'Lossguide', 'min_data_in_leaf': 77, 'max_leaves': 36}. Best is trial 472 with value: 2453.464132483589.[0m
