Optimizing CatBoost...
[32m[I 2024-10-13 07:32:54,172][0m Trial 0 finished with value: 4787.763367522526 and parameters: {'depth': 13, 'learning_rate': 0.1794211792044382, 'iterations': 1639, 'l2_leaf_reg': 1.6418222233946848e-07, 'border_count': 176, 'bagging_temperature': 0.10063246574206508, 'random_strength': 5.859188038887149, 'grow_policy': 'SymmetricTree', 'min_data_in_leaf': 394}. Best is trial 0 with value: 4787.763367522526.[0m
[32m[I 2024-10-13 07:32:58,299][0m Trial 1 finished with value: 4915.605242081118 and parameters: {'depth': 3, 'learning_rate': 0.026372915658127594, 'iterations': 1267, 'l2_leaf_reg': 0.0001617463741664612, 'border_count': 19, 'bagging_temperature': 0.9589001743041154, 'random_strength': 9.779422160605062, 'grow_policy': 'SymmetricTree', 'min_data_in_leaf': 665}. Best is trial 0 with value: 4787.763367522526.[0m
[32m[I 2024-10-13 07:33:52,739][0m Trial 2 finished with value: 16391.018379023102 and parameters: {'depth': 10, 'learning_rate': 0.000317288467687206, 'iterations': 2494, 'l2_leaf_reg': 1.018739183003408, 'border_count': 139, 'bagging_temperature': 0.7358996387151806, 'random_strength': 4.878474783396306, 'grow_policy': 'SymmetricTree', 'min_data_in_leaf': 110}. Best is trial 0 with value: 4787.763367522526.[0m
[32m[I 2024-10-13 07:33:53,548][0m Trial 3 finished with value: 5180.248148080635 and parameters: {'depth': 8, 'learning_rate': 0.25843455005676974, 'iterations': 427, 'l2_leaf_reg': 1.8370566291650872e-07, 'border_count': 106, 'bagging_temperature': 0.20679044763206567, 'random_strength': 0.5246101697620731, 'grow_policy': 'Lossguide', 'min_data_in_leaf': 333, 'max_leaves': 220}. Best is trial 0 with value: 4787.763367522526.[0m
[32m[I 2024-10-13 07:33:55,022][0m Trial 4 finished with value: 4403.278841688138 and parameters: {'depth': 13, 'learning_rate': 0.1480185873203199, 'iterations': 1220, 'l2_leaf_reg': 0.0003614487803895568, 'border_count': 63, 'bagging_temperature': 0.2833785563990845, 'random_strength': 6.615922383125321, 'grow_policy': 'Lossguide', 'min_data_in_leaf': 789, 'max_leaves': 45}. Best is trial 4 with value: 4403.278841688138.[0m
[32m[I 2024-10-13 07:33:56,035][0m Trial 5 finished with value: 26109.173385615442 and parameters: {'depth': 5, 'learning_rate': 0.0004165120227273627, 'iterations': 415, 'l2_leaf_reg': 0.004905537853877714, 'border_count': 181, 'bagging_temperature': 0.5092669616568017, 'random_strength': 0.5732300911814581, 'grow_policy': 'SymmetricTree', 'min_data_in_leaf': 964}. Best is trial 4 with value: 4403.278841688138.[0m
[32m[I 2024-10-13 07:33:56,852][0m Trial 6 finished with value: 7613.858465790588 and parameters: {'depth': 7, 'learning_rate': 0.019988683263490303, 'iterations': 102, 'l2_leaf_reg': 0.42438726603135224, 'border_count': 251, 'bagging_temperature': 0.23910277003014335, 'random_strength': 7.902899851590165, 'grow_policy': 'Depthwise', 'min_data_in_leaf': 2}. Best is trial 4 with value: 4403.278841688138.[0m
[32m[I 2024-10-13 07:33:59,835][0m Trial 7 finished with value: 3064.1480611469387 and parameters: {'depth': 15, 'learning_rate': 0.20233552833482707, 'iterations': 2301, 'l2_leaf_reg': 0.9058120467894848, 'border_count': 57, 'bagging_temperature': 0.5198438276995909, 'random_strength': 6.486858839396289, 'grow_policy': 'Lossguide', 'min_data_in_leaf': 47, 'max_leaves': 40}. Best is trial 7 with value: 3064.1480611469387.[0m
[32m[I 2024-10-13 07:35:20,070][0m Trial 8 finished with value: 5830.514921636563 and parameters: {'depth': 13, 'learning_rate': 0.006959060626266638, 'iterations': 724, 'l2_leaf_reg': 5.845878831279387e-08, 'border_count': 230, 'bagging_temperature': 0.9065731969441434, 'random_strength': 7.317744019541436, 'grow_policy': 'SymmetricTree', 'min_data_in_leaf': 227}. Best is trial 7 with value: 3064.1480611469387.[0m
[32m[I 2024-10-13 07:35:21,996][0m Trial 9 finished with value: 17025.138548927833 and parameters: {'depth': 5, 'learning_rate': 0.0005278739678696196, 'iterations': 1995, 'l2_leaf_reg': 0.18440874524137846, 'border_count': 203, 'bagging_temperature': 0.365993927877051, 'random_strength': 6.969237767321937, 'grow_policy': 'Depthwise', 'min_data_in_leaf': 287}. Best is trial 7 with value: 3064.1480611469387.[0m
[32m[I 2024-10-13 07:35:24,677][0m Trial 10 finished with value: 9554.647618804931 and parameters: {'depth': 15, 'learning_rate': 0.001576088059846751, 'iterations': 2927, 'l2_leaf_reg': 0.01137260965846273, 'border_count': 3, 'bagging_temperature': 0.5548451733879963, 'random_strength': 3.308133052459953, 'grow_policy': 'Lossguide', 'min_data_in_leaf': 554, 'max_leaves': 31}. Best is trial 7 with value: 3064.1480611469387.[0m
[32m[I 2024-10-13 07:35:26,152][0m Trial 11 finished with value: 5374.643415869169 and parameters: {'depth': 15, 'learning_rate': 0.07650380166270684, 'iterations': 1230, 'l2_leaf_reg': 3.823686925295229e-05, 'border_count': 70, 'bagging_temperature': 0.3816149723630368, 'random_strength': 4.059540554445652, 'grow_policy': 'Lossguide', 'min_data_in_leaf': 817, 'max_leaves': 36}. Best is trial 7 with value: 3064.1480611469387.[0m
[32m[I 2024-10-13 07:35:28,330][0m Trial 12 finished with value: 3896.802616279651 and parameters: {'depth': 11, 'learning_rate': 0.05751722363208755, 'iterations': 2229, 'l2_leaf_reg': 7.8679719725047805, 'border_count': 57, 'bagging_temperature': 0.6623598971968953, 'random_strength': 9.184162683774284, 'grow_policy': 'Lossguide', 'min_data_in_leaf': 690, 'max_leaves': 100}. Best is trial 7 with value: 3064.1480611469387.[0m
[32m[I 2024-10-13 07:35:30,500][0m Trial 13 finished with value: 3972.818288579052 and parameters: {'depth': 10, 'learning_rate': 0.03931611475633092, 'iterations': 2208, 'l2_leaf_reg': 6.588368261363896, 'border_count': 52, 'bagging_temperature': 0.6700467051464152, 'random_strength': 9.963176714871446, 'grow_policy': 'Lossguide', 'min_data_in_leaf': 527, 'max_leaves': 126}. Best is trial 7 with value: 3064.1480611469387.[0m
[32m[I 2024-10-13 07:35:32,903][0m Trial 14 finished with value: 5364.010861693783 and parameters: {'depth': 12, 'learning_rate': 0.0075301568032346035, 'iterations': 2566, 'l2_leaf_reg': 3.852649351460739, 'border_count': 101, 'bagging_temperature': 0.7544400999986799, 'random_strength': 8.672838946393124, 'grow_policy': 'Lossguide', 'min_data_in_leaf': 652, 'max_leaves': 112}. Best is trial 7 with value: 3064.1480611469387.[0m
[32m[I 2024-10-13 07:35:34,840][0m Trial 15 finished with value: 4930.619043003487 and parameters: {'depth': 11, 'learning_rate': 0.06890446417338517, 'iterations': 1860, 'l2_leaf_reg': 0.0360304013544214, 'border_count': 35, 'bagging_temperature': 0.6118705883222303, 'random_strength': 2.6585613196923514, 'grow_policy': 'Lossguide', 'min_data_in_leaf': 431, 'max_leaves': 88}. Best is trial 7 with value: 3064.1480611469387.[0m
[32m[I 2024-10-13 07:35:38,417][0m Trial 16 finished with value: 6594.8625308069995 and parameters: {'depth': 15, 'learning_rate': 0.0025801612473562974, 'iterations': 2969, 'l2_leaf_reg': 8.388097961681238, 'border_count': 92, 'bagging_temperature': 0.8337710455095214, 'random_strength': 8.789998558937324, 'grow_policy': 'Depthwise', 'min_data_in_leaf': 165}. Best is trial 7 with value: 3064.1480611469387.[0m
[32m[I 2024-10-13 07:35:40,714][0m Trial 17 finished with value: 5553.660536672101 and parameters: {'depth': 9, 'learning_rate': 0.015320042394387338, 'iterations': 2377, 'l2_leaf_reg': 0.1353137420879421, 'border_count': 144, 'bagging_temperature': 0.40821774673012234, 'random_strength': 5.308906141098186, 'grow_policy': 'Lossguide', 'min_data_in_leaf': 830, 'max_leaves': 193}. Best is trial 7 with value: 3064.1480611469387.[0m
[32m[I 2024-10-13 07:35:42,797][0m Trial 18 finished with value: 4360.935640000059 and parameters: {'depth': 12, 'learning_rate': 0.07714050462823806, 'iterations': 2047, 'l2_leaf_reg': 2.1850649106684628e-06, 'border_count': 38, 'bagging_temperature': 0.007949744918410717, 'random_strength': 8.26459662033104, 'grow_policy': 'Lossguide', 'min_data_in_leaf': 650, 'max_leaves': 87}. Best is trial 7 with value: 3064.1480611469387.[0m
[32m[I 2024-10-13 07:35:45,307][0m Trial 19 finished with value: 25666.649035655595 and parameters: {'depth': 14, 'learning_rate': 0.00010692826160814414, 'iterations': 2666, 'l2_leaf_reg': 0.0018133725331847183, 'border_count': 80, 'bagging_temperature': 0.44723665460607975, 'random_strength': 6.476757527911792, 'grow_policy': 'Lossguide', 'min_data_in_leaf': 962, 'max_leaves': 173}. Best is trial 7 with value: 3064.1480611469387.[0m
[32m[I 2024-10-13 07:35:49,687][0m Trial 20 finished with value: 5047.047162349115 and parameters: {'depth': 11, 'learning_rate': 0.2663100710479492, 'iterations': 1629, 'l2_leaf_reg': 0.03987014702710344, 'border_count': 120, 'bagging_temperature': 0.6493447965605941, 'random_strength': 9.192462794784372, 'grow_policy': 'Depthwise', 'min_data_in_leaf': 18}. Best is trial 7 with value: 3064.1480611469387.[0m
[32m[I 2024-10-13 07:35:51,799][0m Trial 21 finished with value: 4002.1724602346635 and parameters: {'depth': 10, 'learning_rate': 0.029134571350981176, 'iterations': 2179, 'l2_leaf_reg': 9.789877801815523, 'border_count': 47, 'bagging_temperature': 0.6936770729970435, 'random_strength': 9.82354437276174, 'grow_policy': 'Lossguide', 'min_data_in_leaf': 532, 'max_leaves': 143}. Best is trial 7 with value: 3064.1480611469387.[0m
[32m[I 2024-10-13 07:35:54,010][0m Trial 22 finished with value: 3940.5309800647583 and parameters: {'depth': 8, 'learning_rate': 0.04352767400904845, 'iterations': 2261, 'l2_leaf_reg': 1.2903072715530328, 'border_count': 57, 'bagging_temperature': 0.5730303398434763, 'random_strength': 7.752794614447101, 'grow_policy': 'Lossguide', 'min_data_in_leaf': 462, 'max_leaves': 127}. Best is trial 7 with value: 3064.1480611469387.[0m
[32m[I 2024-10-13 07:35:56,621][0m Trial 23 finished with value: 5273.972965856326 and parameters: {'depth': 7, 'learning_rate': 0.1308790420925192, 'iterations': 2725, 'l2_leaf_reg': 1.272886085880087, 'border_count': 79, 'bagging_temperature': 0.5270459451226701, 'random_strength': 7.748431511854547, 'grow_policy': 'Lossguide', 'min_data_in_leaf': 731, 'max_leaves': 86}. Best is trial 7 with value: 3064.1480611469387.[0m
[32m[I 2024-10-13 07:35:58,870][0m Trial 24 finished with value: 6060.514427442577 and parameters: {'depth': 8, 'learning_rate': 0.049690942296431465, 'iterations': 2333, 'l2_leaf_reg': 1.0963288132049003, 'border_count': 13, 'bagging_temperature': 0.5704011237850063, 'random_strength': 6.163069808901077, 'grow_policy': 'Lossguide', 'min_data_in_leaf': 438, 'max_leaves': 68}. Best is trial 7 with value: 3064.1480611469387.[0m
[32m[I 2024-10-13 07:36:00,725][0m Trial 25 finished with value: 5803.609570052151 and parameters: {'depth': 6, 'learning_rate': 0.010340969208477862, 'iterations': 1746, 'l2_leaf_reg': 0.09835421751542256, 'border_count': 26, 'bagging_temperature': 0.8106887425433535, 'random_strength': 7.486570745452774, 'grow_policy': 'Lossguide', 'min_data_in_leaf': 108, 'max_leaves': 160}. Best is trial 7 with value: 3064.1480611469387.[0m
[32m[I 2024-10-13 07:36:02,668][0m Trial 26 finished with value: 5558.987923331165 and parameters: {'depth': 9, 'learning_rate': 0.0036282478854046158, 'iterations': 1952, 'l2_leaf_reg': 1.4967324572702168, 'border_count': 48, 'bagging_temperature': 0.4548496234156588, 'random_strength': 5.05137459201319, 'grow_policy': 'Lossguide', 'min_data_in_leaf': 326, 'max_leaves': 116}. Best is trial 7 with value: 3064.1480611469387.[0m
[32m[I 2024-10-13 07:36:04,232][0m Trial 27 finished with value: 4475.596241962653 and parameters: {'depth': 3, 'learning_rate': 0.11190603543998479, 'iterations': 1419, 'l2_leaf_reg': 0.016310588445584206, 'border_count': 63, 'bagging_temperature': 0.6158853940270548, 'random_strength': 8.321468515626187, 'grow_policy': 'Lossguide', 'min_data_in_leaf': 579, 'max_leaves': 253}. Best is trial 7 with value: 3064.1480611469387.[0m
[32m[I 2024-10-13 07:36:06,782][0m Trial 28 finished with value: 5320.958406410258 and parameters: {'depth': 14, 'learning_rate': 0.012632210253371804, 'iterations': 2768, 'l2_leaf_reg': 0.4419813467145281, 'border_count': 122, 'bagging_temperature': 0.8288541240288945, 'random_strength': 9.12633000902601, 'grow_policy': 'Lossguide', 'min_data_in_leaf': 890, 'max_leaves': 62}. Best is trial 7 with value: 3064.1480611469387.[0m
[32m[I 2024-10-13 07:36:09,056][0m Trial 29 finished with value: 5652.718367411107 and parameters: {'depth': 12, 'learning_rate': 0.16698052288142373, 'iterations': 2212, 'l2_leaf_reg': 0.002341682663807728, 'border_count': 164, 'bagging_temperature': 0.4867463979998108, 'random_strength': 7.096304313608005, 'grow_policy': 'Depthwise', 'min_data_in_leaf': 449}. Best is trial 7 with value: 3064.1480611469387.[0m
[32m[I 2024-10-13 07:36:28,602][0m Trial 30 finished with value: 6783.529173038742 and parameters: {'depth': 8, 'learning_rate': 0.2955149470174949, 'iterations': 2420, 'l2_leaf_reg': 2.1733346274854873e-05, 'border_count': 91, 'bagging_temperature': 0.7316697699766165, 'random_strength': 5.7333753370352945, 'grow_policy': 'SymmetricTree', 'min_data_in_leaf': 694}. Best is trial 7 with value: 3064.1480611469387.[0m
[32m[I 2024-10-13 07:36:30,682][0m Trial 31 finished with value: 4062.1338576638254 and parameters: {'depth': 10, 'learning_rate': 0.03369831920251679, 'iterations': 2193, 'l2_leaf_reg': 3.2997540383034787, 'border_count': 57, 'bagging_temperature': 0.6732245821534516, 'random_strength': 9.67399200596597, 'grow_policy': 'Lossguide', 'min_data_in_leaf': 597, 'max_leaves': 124}. Best is trial 7 with value: 3064.1480611469387.[0m
[32m[I 2024-10-13 07:36:32,540][0m Trial 32 finished with value: 5698.878708820064 and parameters: {'depth': 9, 'learning_rate': 0.04336525927248775, 'iterations': 1777, 'l2_leaf_reg': 9.8426139663805, 'border_count': 28, 'bagging_temperature': 0.606991679047536, 'random_strength': 9.358640691796705, 'grow_policy': 'Lossguide', 'min_data_in_leaf': 493, 'max_leaves': 133}. Best is trial 7 with value: 3064.1480611469387.[0m
[32m[I 2024-10-13 07:36:34,222][0m Trial 33 finished with value: 4678.79018401465 and parameters: {'depth': 11, 'learning_rate': 0.05626106680277717, 'iterations': 1531, 'l2_leaf_reg': 0.32509315455383014, 'border_count': 50, 'bagging_temperature': 0.7619455854114662, 'random_strength': 9.978306157462265, 'grow_policy': 'Lossguide', 'min_data_in_leaf': 357, 'max_leaves': 107}. Best is trial 7 with value: 3064.1480611469387.[0m
[32m[I 2024-10-13 07:36:36,317][0m Trial 34 finished with value: 4951.7284468945845 and parameters: {'depth': 7, 'learning_rate': 0.09898737621825698, 'iterations': 2104, 'l2_leaf_reg': 3.1032025368990865, 'border_count': 76, 'bagging_temperature': 0.9954612012837031, 'random_strength': 8.324961821578281, 'grow_policy': 'Lossguide', 'min_data_in_leaf': 748, 'max_leaves': 151}. Best is trial 7 with value: 3064.1480611469387.[0m
[32m[I 2024-10-13 07:36:44,579][0m Trial 35 finished with value: 11199.819099817596 and parameters: {'depth': 10, 'learning_rate': 0.025141490953655962, 'iterations': 2543, 'l2_leaf_reg': 0.7466351420687273, 'border_count': 1, 'bagging_temperature': 0.6859763038303763, 'random_strength': 9.024081650187792, 'grow_policy': 'SymmetricTree', 'min_data_in_leaf': 492}. Best is trial 7 with value: 3064.1480611469387.[0m
[32m[I 2024-10-13 07:36:46,796][0m Trial 36 finished with value: 5433.30285459034 and parameters: {'depth': 14, 'learning_rate': 0.16033874376328697, 'iterations': 2334, 'l2_leaf_reg': 0.096007988295782, 'border_count': 107, 'bagging_temperature': 0.29762939870898675, 'random_strength': 7.95615244244922, 'grow_policy': 'Lossguide', 'min_data_in_leaf': 621, 'max_leaves': 103}. Best is trial 7 with value: 3064.1480611469387.[0m
[32m[I 2024-10-13 07:36:48,669][0m Trial 37 finished with value: 4632.606656743174 and parameters: {'depth': 8, 'learning_rate': 0.04295603736632621, 'iterations': 1907, 'l2_leaf_reg': 2.4279735176726946, 'border_count': 17, 'bagging_temperature': 0.5452986539389407, 'random_strength': 6.712180549906181, 'grow_policy': 'Lossguide', 'min_data_in_leaf': 241, 'max_leaves': 63}. Best is trial 7 with value: 3064.1480611469387.[0m
[32m[I 2024-10-13 07:38:30,274][0m Trial 38 finished with value: 5193.320376420201 and parameters: {'depth': 13, 'learning_rate': 0.01869334006552428, 'iterations': 2289, 'l2_leaf_reg': 0.0003580254910257684, 'border_count': 141, 'bagging_temperature': 0.8808431132738131, 'random_strength': 4.4823024578269495, 'grow_policy': 'SymmetricTree', 'min_data_in_leaf': 388}. Best is trial 7 with value: 3064.1480611469387.[0m
[32m[I 2024-10-13 07:38:32,670][0m Trial 39 finished with value: 4102.313716313272 and parameters: {'depth': 6, 'learning_rate': 0.2012126059525786, 'iterations': 2563, 'l2_leaf_reg': 4.873285544125198e-07, 'border_count': 38, 'bagging_temperature': 0.14876046342252103, 'random_strength': 1.6592540050252245, 'grow_policy': 'Lossguide', 'min_data_in_leaf': 88, 'max_leaves': 178}. Best is trial 7 with value: 3064.1480611469387.[0m
[32m[I 2024-10-13 07:38:34,323][0m Trial 40 finished with value: 4611.761568348504 and parameters: {'depth': 10, 'learning_rate': 0.09601146733434175, 'iterations': 1407, 'l2_leaf_reg': 0.2773096682808738, 'border_count': 64, 'bagging_temperature': 0.48659499922534505, 'random_strength': 5.820048576141262, 'grow_policy': 'Depthwise', 'min_data_in_leaf': 170}. Best is trial 7 with value: 3064.1480611469387.[0m
[32m[I 2024-10-13 07:38:36,420][0m Trial 41 finished with value: 3877.271472833028 and parameters: {'depth': 10, 'learning_rate': 0.029458113887376437, 'iterations': 2135, 'l2_leaf_reg': 6.167595174015801, 'border_count': 47, 'bagging_temperature': 0.693460189899223, 'random_strength': 9.784574053820155, 'grow_policy': 'Lossguide', 'min_data_in_leaf': 534, 'max_leaves': 138}. Best is trial 7 with value: 3064.1480611469387.[0m
[32m[I 2024-10-13 07:38:38,462][0m Trial 42 finished with value: 4186.423240291504 and parameters: {'depth': 11, 'learning_rate': 0.030639335875315716, 'iterations': 2085, 'l2_leaf_reg': 4.265088545629705, 'border_count': 50, 'bagging_temperature': 0.6392255753123705, 'random_strength': 9.659838607946906, 'grow_policy': 'Lossguide', 'min_data_in_leaf': 514, 'max_leaves': 140}. Best is trial 7 with value: 3064.1480611469387.[0m
[32m[I 2024-10-13 07:38:39,722][0m Trial 43 finished with value: 5414.825912939867 and parameters: {'depth': 9, 'learning_rate': 0.020193426666327494, 'iterations': 1007, 'l2_leaf_reg': 0.7167035361512728, 'border_count': 87, 'bagging_temperature': 0.7203175704600947, 'random_strength': 8.626383740821263, 'grow_policy': 'Lossguide', 'min_data_in_leaf': 697, 'max_leaves': 132}. Best is trial 7 with value: 3064.1480611469387.[0m
[32m[I 2024-10-13 07:38:42,107][0m Trial 44 finished with value: 5503.312653848792 and parameters: {'depth': 12, 'learning_rate': 0.009398692998299837, 'iterations': 2490, 'l2_leaf_reg': 1.6187652670735448, 'border_count': 71, 'bagging_temperature': 0.5896336299128989, 'random_strength': 7.564966492057868, 'grow_policy': 'Lossguide', 'min_data_in_leaf': 569, 'max_leaves': 156}. Best is trial 7 with value: 3064.1480611469387.[0m
[32m[I 2024-10-13 07:38:44,020][0m Trial 45 finished with value: 5099.4206143253605 and parameters: {'depth': 9, 'learning_rate': 0.06181288520114908, 'iterations': 1844, 'l2_leaf_reg': 5.882637112128338, 'border_count': 105, 'bagging_temperature': 0.3191276814256266, 'random_strength': 9.386965381812495, 'grow_policy': 'Lossguide', 'min_data_in_leaf': 622, 'max_leaves': 98}. Best is trial 7 with value: 3064.1480611469387.[0m
[32m[I 2024-10-13 07:39:09,361][0m Trial 46 finished with value: 5205.8328667603055 and parameters: {'depth': 10, 'learning_rate': 0.00578039477424235, 'iterations': 2841, 'l2_leaf_reg': 0.05021638516622451, 'border_count': 14, 'bagging_temperature': 0.80634660423492, 'random_strength': 8.70056192061391, 'grow_policy': 'SymmetricTree', 'min_data_in_leaf': 476}. Best is trial 7 with value: 3064.1480611469387.[0m
[32m[I 2024-10-13 07:39:11,364][0m Trial 47 finished with value: 5259.569143032301 and parameters: {'depth': 6, 'learning_rate': 0.19984318070566037, 'iterations': 2037, 'l2_leaf_reg': 0.5482901421596086, 'border_count': 34, 'bagging_temperature': 0.9030694929716415, 'random_strength': 7.944379830992094, 'grow_policy': 'Lossguide', 'min_data_in_leaf': 271, 'max_leaves': 119}. Best is trial 7 with value: 3064.1480611469387.[0m
[32m[I 2024-10-13 07:39:13,786][0m Trial 48 finished with value: 9768.943410746764 and parameters: {'depth': 13, 'learning_rate': 0.0009103203416112181, 'iterations': 2629, 'l2_leaf_reg': 0.1811939575345603, 'border_count': 59, 'bagging_temperature': 0.7786349404372414, 'random_strength': 9.995848288495651, 'grow_policy': 'Lossguide', 'min_data_in_leaf': 391, 'max_leaves': 76}. Best is trial 7 with value: 3064.1480611469387.[0m
[32m[I 2024-10-13 07:39:16,112][0m Trial 49 finished with value: 5185.966765728827 and parameters: {'depth': 4, 'learning_rate': 0.08273907259804758, 'iterations': 2440, 'l2_leaf_reg': 2.92478027606802, 'border_count': 208, 'bagging_temperature': 0.4242962935927833, 'random_strength': 7.259546395694449, 'grow_policy': 'Lossguide', 'min_data_in_leaf': 869, 'max_leaves': 50}. Best is trial 7 with value: 3064.1480611469387.[0m
[32m[I 2024-10-13 07:39:18,412][0m Trial 50 finished with value: 4409.268478756807 and parameters: {'depth': 11, 'learning_rate': 0.042211210790536156, 'iterations': 2256, 'l2_leaf_reg': 2.6681949722740475e-08, 'border_count': 42, 'bagging_temperature': 0.6472362152261433, 'random_strength': 9.378980282729756, 'grow_policy': 'Depthwise', 'min_data_in_leaf': 792}. Best is trial 7 with value: 3064.1480611469387.[0m
