[32m[I 2024-10-13 08:49:57,454][0m Trial 802 finished with value: 5423.445305130637 and parameters: {'depth': 7, 'learning_rate': 0.17684747205344303, 'iterations': 2590, 'l2_leaf_reg': 1.1234346674884578e-06, 'border_count': 123, 'bagging_temperature': 0.5435320210464175, 'random_strength': 0.36655572789573376, 'grow_policy': 'Lossguide', 'min_data_in_leaf': 120, 'max_leaves': 54}. Best is trial 472 with value: 2453.464132483589.[0m
[32m[I 2024-10-13 08:50:02,216][0m Trial 803 finished with value: 5506.174439349247 and parameters: {'depth': 6, 'learning_rate': 0.11989527106217737, 'iterations': 2652, 'l2_leaf_reg': 2.3455603779783787e-06, 'border_count': 33, 'bagging_temperature': 0.6277437976271625, 'random_strength': 0.8366891494369011, 'grow_policy': 'Lossguide', 'min_data_in_leaf': 645, 'max_leaves': 58}. Best is trial 472 with value: 2453.464132483589.[0m
[32m[I 2024-10-13 08:50:08,272][0m Trial 804 finished with value: 3745.9132652966514 and parameters: {'depth': 7, 'learning_rate': 0.25989444017015606, 'iterations': 2761, 'l2_leaf_reg': 6.520192683449971e-07, 'border_count': 44, 'bagging_temperature': 0.5200537447251535, 'random_strength': 1.307106419772665, 'grow_policy': 'Depthwise', 'min_data_in_leaf': 57}. Best is trial 472 with value: 2453.464132483589.[0m
[32m[I 2024-10-13 08:50:11,418][0m Trial 805 finished with value: 3142.0355429647902 and parameters: {'depth': 7, 'learning_rate': 0.20884747572531367, 'iterations': 2488, 'l2_leaf_reg': 4.720656791770853e-06, 'border_count': 58, 'bagging_temperature': 0.5910389776166188, 'random_strength': 0.6350597702230705, 'grow_policy': 'Lossguide', 'min_data_in_leaf': 92, 'max_leaves': 41}. Best is trial 472 with value: 2453.464132483589.[0m
[32m[I 2024-10-13 08:50:16,802][0m Trial 806 finished with value: 4488.404616903226 and parameters: {'depth': 7, 'learning_rate': 0.14903009212554333, 'iterations': 2696, 'l2_leaf_reg': 1.0902610422564265e-08, 'border_count': 51, 'bagging_temperature': 0.6705517726818744, 'random_strength': 9.030342398068967, 'grow_policy': 'Lossguide', 'min_data_in_leaf': 103, 'max_leaves': 253}. Best is trial 472 with value: 2453.464132483589.[0m
[32m[I 2024-10-13 08:50:21,659][0m Trial 807 finished with value: 4102.097448038688 and parameters: {'depth': 6, 'learning_rate': 0.22932331775316858, 'iterations': 2568, 'l2_leaf_reg': 9.607246839618104e-07, 'border_count': 39, 'bagging_temperature': 0.6095755783083282, 'random_strength': 0.16325742789429423, 'grow_policy': 'Lossguide', 'min_data_in_leaf': 77, 'max_leaves': 38}. Best is trial 472 with value: 2453.464132483589.[0m
[32m[I 2024-10-13 08:50:26,681][0m Trial 808 finished with value: 7724.994704678799 and parameters: {'depth': 7, 'learning_rate': 0.18560607957098643, 'iterations': 2787, 'l2_leaf_reg': 3.29373838271387e-07, 'border_count': 27, 'bagging_temperature': 0.7146568678491345, 'random_strength': 1.0002650872260026, 'grow_policy': 'Lossguide', 'min_data_in_leaf': 119, 'max_leaves': 68}. Best is trial 472 with value: 2453.464132483589.[0m
[32m[I 2024-10-13 08:50:32,078][0m Trial 809 finished with value: 3103.7889737983282 and parameters: {'depth': 7, 'learning_rate': 0.25510192241422086, 'iterations': 2999, 'l2_leaf_reg': 5.591435171009199e-07, 'border_count': 45, 'bagging_temperature': 0.5737743493282238, 'random_strength': 0.34111050028803924, 'grow_policy': 'Lossguide', 'min_data_in_leaf': 565, 'max_leaves': 47}. Best is trial 472 with value: 2453.464132483589.[0m
[32m[I 2024-10-13 08:50:38,624][0m Trial 810 finished with value: 3522.0531863031733 and parameters: {'depth': 6, 'learning_rate': 0.20905642567154067, 'iterations': 2216, 'l2_leaf_reg': 1.6530858993735602e-07, 'border_count': 60, 'bagging_temperature': 0.8025962528890872, 'random_strength': 1.9885771448979435, 'grow_policy': 'Lossguide', 'min_data_in_leaf': 43, 'max_leaves': 51}. Best is trial 472 with value: 2453.464132483589.[0m
[32m[I 2024-10-13 08:50:41,953][0m Trial 811 finished with value: 5186.214053643854 and parameters: {'depth': 7, 'learning_rate': 0.26164396343530616, 'iterations': 2436, 'l2_leaf_reg': 2.4794720879423863e-07, 'border_count': 158, 'bagging_temperature': 0.629954412943679, 'random_strength': 0.5982501827440936, 'grow_policy': 'Lossguide', 'min_data_in_leaf': 63, 'max_leaves': 60}. Best is trial 472 with value: 2453.464132483589.[0m
[32m[I 2024-10-13 08:50:45,848][0m Trial 812 finished with value: 2833.48837051634 and parameters: {'depth': 7, 'learning_rate': 0.1618327297803106, 'iterations': 2881, 'l2_leaf_reg': 1.900623452018056e-06, 'border_count': 48, 'bagging_temperature': 0.6511081641185494, 'random_strength': 0.7729252855831558, 'grow_policy': 'Depthwise', 'min_data_in_leaf': 91}. Best is trial 472 with value: 2453.464132483589.[0m
[32m[I 2024-10-13 08:50:50,177][0m Trial 813 finished with value: 4999.565882814354 and parameters: {'depth': 6, 'learning_rate': 0.29947245857385246, 'iterations': 2640, 'l2_leaf_reg': 8.24074075023243e-07, 'border_count': 136, 'bagging_temperature': 0.5478860328632693, 'random_strength': 0.44003494975125124, 'grow_policy': 'Lossguide', 'min_data_in_leaf': 130, 'max_leaves': 74}. Best is trial 472 with value: 2453.464132483589.[0m
[32m[I 2024-10-13 08:50:54,644][0m Trial 814 finished with value: 5503.474348448829 and parameters: {'depth': 7, 'learning_rate': 0.21800088574911425, 'iterations': 2517, 'l2_leaf_reg': 4.328416964987226e-07, 'border_count': 36, 'bagging_temperature': 0.6018827827718449, 'random_strength': 1.132338372045243, 'grow_policy': 'Lossguide', 'min_data_in_leaf': 110, 'max_leaves': 45}. Best is trial 472 with value: 2453.464132483589.[0m
[32m[I 2024-10-13 08:50:58,141][0m Trial 815 finished with value: 2722.3968413599364 and parameters: {'depth': 7, 'learning_rate': 0.18813780610963446, 'iterations': 1682, 'l2_leaf_reg': 3.945120523396878e-06, 'border_count': 53, 'bagging_temperature': 0.5746901714122368, 'random_strength': 7.432342012938896, 'grow_policy': 'Lossguide', 'min_data_in_leaf': 82, 'max_leaves': 54}. Best is trial 472 with value: 2453.464132483589.[0m
[32m[I 2024-10-13 08:51:02,417][0m Trial 816 finished with value: 3294.989056415053 and parameters: {'depth': 7, 'learning_rate': 0.12699348379529157, 'iterations': 2936, 'l2_leaf_reg': 7.734746778155387e-06, 'border_count': 62, 'bagging_temperature': 0.5632347806288593, 'random_strength': 1.6723540043575273, 'grow_policy': 'Lossguide', 'min_data_in_leaf': 62, 'max_leaves': 57}. Best is trial 472 with value: 2453.464132483589.[0m
[32m[I 2024-10-13 08:51:09,466][0m Trial 817 finished with value: 3608.5089009771505 and parameters: {'depth': 7, 'learning_rate': 0.14780520226572078, 'iterations': 1667, 'l2_leaf_reg': 6.188056170404579e-06, 'border_count': 55, 'bagging_temperature': 0.5857735112920576, 'random_strength': 8.450284517109605, 'grow_policy': 'Lossguide', 'min_data_in_leaf': 31, 'max_leaves': 53}. Best is trial 472 with value: 2453.464132483589.[0m
[32m[I 2024-10-13 08:51:12,883][0m Trial 818 finished with value: 3758.0653902136755 and parameters: {'depth': 7, 'learning_rate': 0.17711239993283887, 'iterations': 1677, 'l2_leaf_reg': 4.616835255049028e-06, 'border_count': 56, 'bagging_temperature': 0.5673614612388106, 'random_strength': 3.716578258584413, 'grow_policy': 'Lossguide', 'min_data_in_leaf': 489, 'max_leaves': 62}. Best is trial 472 with value: 2453.464132483589.[0m
[32m[I 2024-10-13 08:51:27,828][0m Trial 819 finished with value: 5829.009564658059 and parameters: {'depth': 7, 'learning_rate': 0.1775757861426696, 'iterations': 1739, 'l2_leaf_reg': 3.57243769628716e-06, 'border_count': 65, 'bagging_temperature': 0.5832243998382436, 'random_strength': 0.22355563005150136, 'grow_policy': 'SymmetricTree', 'min_data_in_leaf': 78}. Best is trial 472 with value: 2453.464132483589.[0m
[32m[I 2024-10-13 08:51:32,505][0m Trial 820 finished with value: 3566.8463893309395 and parameters: {'depth': 7, 'learning_rate': 0.2353156934132697, 'iterations': 1632, 'l2_leaf_reg': 3.338092415843383e-06, 'border_count': 53, 'bagging_temperature': 0.5423893018857671, 'random_strength': 0.9384774617490093, 'grow_policy': 'Lossguide', 'min_data_in_leaf': 44, 'max_leaves': 170}. Best is trial 472 with value: 2453.464132483589.[0m
[32m[I 2024-10-13 08:51:39,528][0m Trial 821 finished with value: 4357.0401951031445 and parameters: {'depth': 6, 'learning_rate': 0.15135016284676353, 'iterations': 1700, 'l2_leaf_reg': 4.189708809762658e-06, 'border_count': 42, 'bagging_temperature': 0.6085856195370093, 'random_strength': 7.57652324130727, 'grow_policy': 'Lossguide', 'min_data_in_leaf': 15, 'max_leaves': 66}. Best is trial 472 with value: 2453.464132483589.[0m
[32m[I 2024-10-13 08:51:41,684][0m Trial 822 finished with value: 4397.803311281798 and parameters: {'depth': 7, 'learning_rate': 0.10759038323473101, 'iterations': 1492, 'l2_leaf_reg': 5.5525746584475715e-06, 'border_count': 51, 'bagging_temperature': 0.5741103444380344, 'random_strength': 0.669107453320156, 'grow_policy': 'Depthwise', 'min_data_in_leaf': 101}. Best is trial 472 with value: 2453.464132483589.[0m
[32m[I 2024-10-13 08:51:44,678][0m Trial 823 finished with value: 2749.090054708852 and parameters: {'depth': 3, 'learning_rate': 0.1979830764276748, 'iterations': 1703, 'l2_leaf_reg': 2.0628458456182952e-06, 'border_count': 58, 'bagging_temperature': 0.5956894373698246, 'random_strength': 1.412850690634011, 'grow_policy': 'Lossguide', 'min_data_in_leaf': 80, 'max_leaves': 179}. Best is trial 472 with value: 2453.464132483589.[0m
[32m[I 2024-10-13 08:51:49,670][0m Trial 824 finished with value: 5090.948265465161 and parameters: {'depth': 7, 'learning_rate': 0.26590880058778815, 'iterations': 2842, 'l2_leaf_reg': 3.953411569309831e-06, 'border_count': 92, 'bagging_temperature': 0.6225924875560348, 'random_strength': 0.3756287068546216, 'grow_policy': 'Lossguide', 'min_data_in_leaf': 137, 'max_leaves': 59}. Best is trial 472 with value: 2453.464132483589.[0m
[32m[I 2024-10-13 08:51:54,657][0m Trial 825 finished with value: 2853.4622321486086 and parameters: {'depth': 7, 'learning_rate': 0.22751186102123427, 'iterations': 2894, 'l2_leaf_reg': 9.762392810969753e-06, 'border_count': 44, 'bagging_temperature': 0.5526269690501546, 'random_strength': 9.311230511772177, 'grow_policy': 'Lossguide', 'min_data_in_leaf': 116, 'max_leaves': 55}. Best is trial 472 with value: 2453.464132483589.[0m
[32m[I 2024-10-13 08:52:00,224][0m Trial 826 finished with value: 3060.802655192404 and parameters: {'depth': 7, 'learning_rate': 0.1344748497570026, 'iterations': 2786, 'l2_leaf_reg': 5.8356433413673845e-06, 'border_count': 49, 'bagging_temperature': 0.6426432803630914, 'random_strength': 9.872581209335467, 'grow_policy': 'Lossguide', 'min_data_in_leaf': 68, 'max_leaves': 64}. Best is trial 472 with value: 2453.464132483589.[0m
[32m[I 2024-10-13 08:52:03,656][0m Trial 827 finished with value: 5256.097122349842 and parameters: {'depth': 7, 'learning_rate': 0.1780741081001518, 'iterations': 1630, 'l2_leaf_reg': 2.5031211645084242e-06, 'border_count': 38, 'bagging_temperature': 0.5703061945504436, 'random_strength': 0.0067736299689569734, 'grow_policy': 'Lossguide', 'min_data_in_leaf': 92, 'max_leaves': 56}. Best is trial 472 with value: 2453.464132483589.[0m
[32m[I 2024-10-13 08:52:05,789][0m Trial 828 finished with value: 4257.444095462427 and parameters: {'depth': 7, 'learning_rate': 0.2988078444069665, 'iterations': 1535, 'l2_leaf_reg': 2.2942287233878395e-06, 'border_count': 54, 'bagging_temperature': 0.6119197598887384, 'random_strength': 0.8772241040276527, 'grow_policy': 'Lossguide', 'min_data_in_leaf': 111, 'max_leaves': 70}. Best is trial 472 with value: 2453.464132483589.[0m
[32m[I 2024-10-13 08:52:11,081][0m Trial 829 finished with value: 3488.811280386592 and parameters: {'depth': 7, 'learning_rate': 0.20690560197268934, 'iterations': 2379, 'l2_leaf_reg': 8.005039318059866e-06, 'border_count': 44, 'bagging_temperature': 0.5905981877935624, 'random_strength': 0.5445408985515624, 'grow_policy': 'Lossguide', 'min_data_in_leaf': 49, 'max_leaves': 53}. Best is trial 472 with value: 2453.464132483589.[0m
[32m[I 2024-10-13 08:52:14,739][0m Trial 830 finished with value: 4677.6306056509975 and parameters: {'depth': 6, 'learning_rate': 0.09246445640698488, 'iterations': 1605, 'l2_leaf_reg': 0.002813458203894177, 'border_count': 70, 'bagging_temperature': 0.5386780978357132, 'random_strength': 0.74810490346901, 'grow_policy': 'Depthwise', 'min_data_in_leaf': 81}. Best is trial 472 with value: 2453.464132483589.[0m
[32m[I 2024-10-13 08:52:19,844][0m Trial 831 finished with value: 6318.80729279294 and parameters: {'depth': 6, 'learning_rate': 0.24023989540527832, 'iterations': 2838, 'l2_leaf_reg': 1.2025331321697883e-05, 'border_count': 32, 'bagging_temperature': 0.6868490704744791, 'random_strength': 0.1839549921731708, 'grow_policy': 'Lossguide', 'min_data_in_leaf': 130, 'max_leaves': 50}. Best is trial 472 with value: 2453.464132483589.[0m
[32m[I 2024-10-13 08:52:25,507][0m Trial 832 finished with value: 15526.373490889386 and parameters: {'depth': 7, 'learning_rate': 0.00031336069736878815, 'iterations': 2744, 'l2_leaf_reg': 1.5448648724408886e-06, 'border_count': 63, 'bagging_temperature': 0.6701092608723994, 'random_strength': 1.100463037154388, 'grow_policy': 'Lossguide', 'min_data_in_leaf': 68, 'max_leaves': 60}. Best is trial 472 with value: 2453.464132483589.[0m
[32m[I 2024-10-13 08:52:29,231][0m Trial 833 finished with value: 3015.8206693297993 and parameters: {'depth': 7, 'learning_rate': 0.18877878383063393, 'iterations': 1795, 'l2_leaf_reg': 2.5327674368549186e-06, 'border_count': 48, 'bagging_temperature': 0.63498063732182, 'random_strength': 0.43125268572357645, 'grow_policy': 'Lossguide', 'min_data_in_leaf': 101, 'max_leaves': 82}. Best is trial 472 with value: 2453.464132483589.[0m
[32m[I 2024-10-13 08:52:32,658][0m Trial 834 finished with value: 5677.87376753439 and parameters: {'depth': 6, 'learning_rate': 0.251021334933155, 'iterations': 1944, 'l2_leaf_reg': 3.817784900499825e-06, 'border_count': 40, 'bagging_temperature': 0.556698580695594, 'random_strength': 0.7147386357460457, 'grow_policy': 'Lossguide', 'min_data_in_leaf': 120, 'max_leaves': 63}. Best is trial 472 with value: 2453.464132483589.[0m
[32m[I 2024-10-13 08:52:37,231][0m Trial 835 finished with value: 3365.181381941478 and parameters: {'depth': 7, 'learning_rate': 0.16177085912082284, 'iterations': 1790, 'l2_leaf_reg': 0.027598757252891626, 'border_count': 52, 'bagging_temperature': 0.5822859143059381, 'random_strength': 0.31583754212651616, 'grow_policy': 'Lossguide', 'min_data_in_leaf': 59, 'max_leaves': 49}. Best is trial 472 with value: 2453.464132483589.[0m
[32m[I 2024-10-13 08:52:40,621][0m Trial 836 finished with value: 3225.5053417360414 and parameters: {'depth': 7, 'learning_rate': 0.21634271307012845, 'iterations': 1582, 'l2_leaf_reg': 3.606325747405186e-08, 'border_count': 57, 'bagging_temperature': 0.5311867363344722, 'random_strength': 8.032520885527239, 'grow_policy': 'Lossguide', 'min_data_in_leaf': 90, 'max_leaves': 161}. Best is trial 472 with value: 2453.464132483589.[0m
[32m[I 2024-10-13 08:52:43,368][0m Trial 837 finished with value: 3002.2902954884953 and parameters: {'depth': 7, 'learning_rate': 0.2578900195491929, 'iterations': 1288, 'l2_leaf_reg': 1.345131333094684e-06, 'border_count': 43, 'bagging_temperature': 0.6169870338176683, 'random_strength': 1.345814022667429, 'grow_policy': 'Lossguide', 'min_data_in_leaf': 310, 'max_leaves': 39}. Best is trial 472 with value: 2453.464132483589.[0m
[32m[I 2024-10-13 08:52:47,156][0m Trial 838 finished with value: 4863.062365797791 and parameters: {'depth': 7, 'learning_rate': 0.16461082640257002, 'iterations': 1866, 'l2_leaf_reg': 1.3031595507192589e-05, 'border_count': 35, 'bagging_temperature': 0.6588907304313101, 'random_strength': 9.647322266894738, 'grow_policy': 'Depthwise', 'min_data_in_leaf': 139}. Best is trial 472 with value: 2453.464132483589.[0m
[32m[I 2024-10-13 08:52:57,744][0m Trial 839 finished with value: 4147.041879736911 and parameters: {'depth': 6, 'learning_rate': 0.19940940533143778, 'iterations': 2736, 'l2_leaf_reg': 0.2957837492543393, 'border_count': 48, 'bagging_temperature': 0.059576048618896205, 'random_strength': 0.5459370529442671, 'grow_policy': 'Lossguide', 'min_data_in_leaf': 27, 'max_leaves': 53}. Best is trial 472 with value: 2453.464132483589.[0m
[32m[I 2024-10-13 08:53:02,824][0m Trial 840 finished with value: 5028.019392007474 and parameters: {'depth': 7, 'learning_rate': 0.22776914100213633, 'iterations': 2922, 'l2_leaf_reg': 5.588123786939208e-06, 'border_count': 40, 'bagging_temperature': 0.6102762928253036, 'random_strength': 0.8865323167982024, 'grow_policy': 'Lossguide', 'min_data_in_leaf': 108, 'max_leaves': 70}. Best is trial 472 with value: 2453.464132483589.[0m
[32m[I 2024-10-13 08:53:08,740][0m Trial 841 finished with value: 6916.445145267308 and parameters: {'depth': 7, 'learning_rate': 0.13164945793229063, 'iterations': 2956, 'l2_leaf_reg': 0.0016595214399069149, 'border_count': 29, 'bagging_temperature': 0.6450512223032975, 'random_strength': 0.22177841379526497, 'grow_policy': 'Lossguide', 'min_data_in_leaf': 88, 'max_leaves': 47}. Best is trial 472 with value: 2453.464132483589.[0m
[32m[I 2024-10-13 08:53:21,640][0m Trial 842 finished with value: 4673.727874711942 and parameters: {'depth': 7, 'learning_rate': 0.014469214368109379, 'iterations': 1822, 'l2_leaf_reg': 0.0039973648760018195, 'border_count': 46, 'bagging_temperature': 0.5878527855942044, 'random_strength': 1.178580384090176, 'grow_policy': 'SymmetricTree', 'min_data_in_leaf': 55}. Best is trial 472 with value: 2453.464132483589.[0m
[32m[I 2024-10-13 08:53:26,850][0m Trial 843 finished with value: 3050.581529740826 and parameters: {'depth': 8, 'learning_rate': 0.19213962528692613, 'iterations': 2827, 'l2_leaf_reg': 1.1316484543812789e-07, 'border_count': 54, 'bagging_temperature': 0.5631756100169253, 'random_strength': 0.6010319756159412, 'grow_policy': 'Lossguide', 'min_data_in_leaf': 77, 'max_leaves': 66}. Best is trial 472 with value: 2453.464132483589.[0m
[32m[I 2024-10-13 08:53:31,679][0m Trial 844 finished with value: 6104.983493753521 and parameters: {'depth': 7, 'learning_rate': 0.2583813236222261, 'iterations': 2707, 'l2_leaf_reg': 1.0211912881743493e-06, 'border_count': 19, 'bagging_temperature': 0.700173961143201, 'random_strength': 0.9043149081273969, 'grow_policy': 'Lossguide', 'min_data_in_leaf': 120, 'max_leaves': 57}. Best is trial 472 with value: 2453.464132483589.[0m
[32m[I 2024-10-13 08:53:36,903][0m Trial 845 finished with value: 4003.5097455490145 and parameters: {'depth': 6, 'learning_rate': 0.1538220964496894, 'iterations': 2898, 'l2_leaf_reg': 1.5906195506341677e-06, 'border_count': 59, 'bagging_temperature': 0.6272149801211707, 'random_strength': 0.4164282594134963, 'grow_policy': 'Lossguide', 'min_data_in_leaf': 140, 'max_leaves': 37}. Best is trial 472 with value: 2453.464132483589.[0m
[32m[I 2024-10-13 08:53:41,972][0m Trial 846 finished with value: 5937.471264585708 and parameters: {'depth': 13, 'learning_rate': 0.2984622534725435, 'iterations': 2784, 'l2_leaf_reg': 0.49962770643159105, 'border_count': 50, 'bagging_temperature': 0.6022945315204338, 'random_strength': 0.2007693378834853, 'grow_policy': 'Lossguide', 'min_data_in_leaf': 99, 'max_leaves': 42}. Best is trial 472 with value: 2453.464132483589.[0m
[32m[I 2024-10-13 08:53:45,095][0m Trial 847 finished with value: 4509.810108402329 and parameters: {'depth': 8, 'learning_rate': 0.21498630985705808, 'iterations': 2429, 'l2_leaf_reg': 0.0004574992958185333, 'border_count': 36, 'bagging_temperature': 0.5262974198982407, 'random_strength': 5.818214313080526, 'grow_policy': 'Lossguide', 'min_data_in_leaf': 66, 'max_leaves': 50}. Best is trial 472 with value: 2453.464132483589.[0m
[32m[I 2024-10-13 08:53:50,830][0m Trial 848 finished with value: 3515.0544088478287 and parameters: {'depth': 7, 'learning_rate': 0.17951712475773687, 'iterations': 1728, 'l2_leaf_reg': 0.0010392724014375305, 'border_count': 43, 'bagging_temperature': 0.6656078156349787, 'random_strength': 8.75592839271222, 'grow_policy': 'Depthwise', 'min_data_in_leaf': 40}. Best is trial 472 with value: 2453.464132483589.[0m
[32m[I 2024-10-13 08:53:53,935][0m Trial 849 finished with value: 3130.390357929045 and parameters: {'depth': 14, 'learning_rate': 0.2992586478478982, 'iterations': 1772, 'l2_leaf_reg': 8.186688243800712e-06, 'border_count': 47, 'bagging_temperature': 0.734843060649254, 'random_strength': 7.375643554581391, 'grow_policy': 'Lossguide', 'min_data_in_leaf': 106, 'max_leaves': 60}. Best is trial 472 with value: 2453.464132483589.[0m
[32m[I 2024-10-13 08:53:59,271][0m Trial 850 finished with value: 3248.230337024125 and parameters: {'depth': 7, 'learning_rate': 0.23473502886442507, 'iterations': 2869, 'l2_leaf_reg': 1.7831647400253594e-05, 'border_count': 40, 'bagging_temperature': 0.5724307333799963, 'random_strength': 0.005196699032269603, 'grow_policy': 'Lossguide', 'min_data_in_leaf': 80, 'max_leaves': 77}. Best is trial 472 with value: 2453.464132483589.[0m
[32m[I 2024-10-13 08:54:04,440][0m Trial 851 finished with value: 3805.6403579476937 and parameters: {'depth': 7, 'learning_rate': 0.19968165901509105, 'iterations': 2678, 'l2_leaf_reg': 2.31607757626319e-08, 'border_count': 52, 'bagging_temperature': 0.5995254341434999, 'random_strength': 0.7111018023037189, 'grow_policy': 'Lossguide', 'min_data_in_leaf': 122, 'max_leaves': 46}. Best is trial 472 with value: 2453.464132483589.[0m
