[32m[I 2024-10-13 09:03:19,548][0m Trial 952 finished with value: 5227.5381080756815 and parameters: {'depth': 8, 'learning_rate': 0.2992412503643516, 'iterations': 2537, 'l2_leaf_reg': 1.265742754188114e-06, 'border_count': 119, 'bagging_temperature': 0.6297452491785854, 'random_strength': 1.980136611716389, 'grow_policy': 'Lossguide', 'min_data_in_leaf': 145, 'max_leaves': 39}. Best is trial 905 with value: 2398.0485076415025.[0m
[32m[I 2024-10-13 09:03:24,286][0m Trial 953 finished with value: 3218.976462947445 and parameters: {'depth': 7, 'learning_rate': 0.17853240688563043, 'iterations': 2605, 'l2_leaf_reg': 2.2761325827330053e-06, 'border_count': 47, 'bagging_temperature': 0.5992667210066607, 'random_strength': 0.8744720872059997, 'grow_policy': 'Lossguide', 'min_data_in_leaf': 66, 'max_leaves': 54}. Best is trial 905 with value: 2398.0485076415025.[0m
[32m[I 2024-10-13 09:03:29,364][0m Trial 954 finished with value: 5290.201840217651 and parameters: {'depth': 7, 'learning_rate': 0.20613642485086942, 'iterations': 2755, 'l2_leaf_reg': 0.0004077208584501552, 'border_count': 34, 'bagging_temperature': 0.5735589047784975, 'random_strength': 0.5853301768483606, 'grow_policy': 'Depthwise', 'min_data_in_leaf': 113}. Best is trial 905 with value: 2398.0485076415025.[0m
[32m[I 2024-10-13 09:03:33,518][0m Trial 955 finished with value: 3218.6293945477096 and parameters: {'depth': 7, 'learning_rate': 0.258173774497008, 'iterations': 2406, 'l2_leaf_reg': 4.521570700762718e-06, 'border_count': 51, 'bagging_temperature': 0.6634901499672401, 'random_strength': 0.17384397345112854, 'grow_policy': 'Lossguide', 'min_data_in_leaf': 89, 'max_leaves': 68}. Best is trial 905 with value: 2398.0485076415025.[0m
[32m[I 2024-10-13 09:03:37,837][0m Trial 956 finished with value: 4302.011711776494 and parameters: {'depth': 8, 'learning_rate': 0.006230081818884851, 'iterations': 2458, 'l2_leaf_reg': 0.03482785353159337, 'border_count': 43, 'bagging_temperature': 0.704790034798111, 'random_strength': 6.382458013743892, 'grow_policy': 'Lossguide', 'min_data_in_leaf': 117, 'max_leaves': 46}. Best is trial 905 with value: 2398.0485076415025.[0m
[32m[I 2024-10-13 09:03:42,904][0m Trial 957 finished with value: 9092.70947464868 and parameters: {'depth': 7, 'learning_rate': 0.2994634986653288, 'iterations': 2665, 'l2_leaf_reg': 4.149247556827628e-05, 'border_count': 27, 'bagging_temperature': 0.6440711449175356, 'random_strength': 1.1942011378173503, 'grow_policy': 'Lossguide', 'min_data_in_leaf': 70, 'max_leaves': 42}. Best is trial 905 with value: 2398.0485076415025.[0m
[32m[I 2024-10-13 09:03:47,820][0m Trial 958 finished with value: 4503.828949666584 and parameters: {'depth': 7, 'learning_rate': 0.15514720847145116, 'iterations': 2834, 'l2_leaf_reg': 0.002472215159670363, 'border_count': 39, 'bagging_temperature': 0.5349136837175961, 'random_strength': 0.39095094845405093, 'grow_policy': 'Lossguide', 'min_data_in_leaf': 136, 'max_leaves': 35}. Best is trial 905 with value: 2398.0485076415025.[0m
[32m[I 2024-10-13 09:03:49,190][0m Trial 959 finished with value: 3260.6763098163433 and parameters: {'depth': 8, 'learning_rate': 0.20103715278549303, 'iterations': 941, 'l2_leaf_reg': 8.194075148340717e-06, 'border_count': 54, 'bagging_temperature': 0.6230937381577254, 'random_strength': 8.018383527684815, 'grow_policy': 'Lossguide', 'min_data_in_leaf': 91, 'max_leaves': 51}. Best is trial 905 with value: 2398.0485076415025.[0m
[32m[I 2024-10-13 09:03:57,689][0m Trial 960 finished with value: 3361.394662126035 and parameters: {'depth': 7, 'learning_rate': 0.23373062957350443, 'iterations': 2902, 'l2_leaf_reg': 1.3541439678858075e-05, 'border_count': 46, 'bagging_temperature': 0.587815663055248, 'random_strength': 1.0354780328076219, 'grow_policy': 'Lossguide', 'min_data_in_leaf': 44, 'max_leaves': 58}. Best is trial 905 with value: 2398.0485076415025.[0m
[32m[I 2024-10-13 09:04:02,922][0m Trial 961 finished with value: 4622.246512810886 and parameters: {'depth': 12, 'learning_rate': 0.17048782521265293, 'iterations': 2768, 'l2_leaf_reg': 1.542269162208974e-07, 'border_count': 37, 'bagging_temperature': 0.6148770995403505, 'random_strength': 0.6548156530532686, 'grow_policy': 'Depthwise', 'min_data_in_leaf': 102}. Best is trial 905 with value: 2398.0485076415025.[0m
[32m[I 2024-10-13 09:04:07,417][0m Trial 962 finished with value: 2665.9904243601477 and parameters: {'depth': 7, 'learning_rate': 0.2358479005290037, 'iterations': 2591, 'l2_leaf_reg': 0.0006866146500494955, 'border_count': 44, 'bagging_temperature': 0.686048208790462, 'random_strength': 6.817026545821906, 'grow_policy': 'Lossguide', 'min_data_in_leaf': 161, 'max_leaves': 65}. Best is trial 905 with value: 2398.0485076415025.[0m
[32m[I 2024-10-13 09:04:11,918][0m Trial 963 finished with value: 6462.649061234022 and parameters: {'depth': 7, 'learning_rate': 0.297532190736, 'iterations': 2536, 'l2_leaf_reg': 0.0004992986184974148, 'border_count': 33, 'bagging_temperature': 0.6978357263294184, 'random_strength': 0.12031702381347845, 'grow_policy': 'Lossguide', 'min_data_in_leaf': 169, 'max_leaves': 79}. Best is trial 905 with value: 2398.0485076415025.[0m
[32m[I 2024-10-13 09:04:16,724][0m Trial 964 finished with value: 4736.825070023636 and parameters: {'depth': 9, 'learning_rate': 0.26101830632840806, 'iterations': 2578, 'l2_leaf_reg': 0.0008609335371054297, 'border_count': 42, 'bagging_temperature': 0.7097349690164724, 'random_strength': 0.8183617827353632, 'grow_policy': 'Lossguide', 'min_data_in_leaf': 190, 'max_leaves': 72}. Best is trial 905 with value: 2398.0485076415025.[0m
[32m[I 2024-10-13 09:04:20,053][0m Trial 965 finished with value: 4914.827420239185 and parameters: {'depth': 7, 'learning_rate': 0.23961317646946872, 'iterations': 2597, 'l2_leaf_reg': 0.0005767343518333276, 'border_count': 37, 'bagging_temperature': 0.7346063102312481, 'random_strength': 1.646378091096396, 'grow_policy': 'Lossguide', 'min_data_in_leaf': 151, 'max_leaves': 76}. Best is trial 905 with value: 2398.0485076415025.[0m
[32m[I 2024-10-13 09:04:23,449][0m Trial 966 finished with value: 3136.8533416180003 and parameters: {'depth': 8, 'learning_rate': 0.26220665897043816, 'iterations': 2488, 'l2_leaf_reg': 0.0007462600880011296, 'border_count': 44, 'bagging_temperature': 0.6834180302598308, 'random_strength': 3.8698461780999844, 'grow_policy': 'Lossguide', 'min_data_in_leaf': 180, 'max_leaves': 66}. Best is trial 905 with value: 2398.0485076415025.[0m
[32m[I 2024-10-13 09:04:26,831][0m Trial 967 finished with value: 5580.546627876815 and parameters: {'depth': 10, 'learning_rate': 0.22625170384070126, 'iterations': 2657, 'l2_leaf_reg': 0.00033400259725826955, 'border_count': 29, 'bagging_temperature': 0.690402389727635, 'random_strength': 0.32975205324095624, 'grow_policy': 'Lossguide', 'min_data_in_leaf': 167, 'max_leaves': 72}. Best is trial 905 with value: 2398.0485076415025.[0m
[32m[I 2024-10-13 09:04:31,516][0m Trial 968 finished with value: 3025.836065318971 and parameters: {'depth': 7, 'learning_rate': 0.21670789180473743, 'iterations': 2618, 'l2_leaf_reg': 0.0015357362846103663, 'border_count': 47, 'bagging_temperature': 0.7141553908198041, 'random_strength': 1.3238232270788723, 'grow_policy': 'Lossguide', 'min_data_in_leaf': 163, 'max_leaves': 69}. Best is trial 905 with value: 2398.0485076415025.[0m
[32m[I 2024-10-13 09:04:35,988][0m Trial 969 finished with value: 5242.800072446504 and parameters: {'depth': 11, 'learning_rate': 0.2658741255754935, 'iterations': 2492, 'l2_leaf_reg': 0.0023137341962323225, 'border_count': 39, 'bagging_temperature': 0.6832071612430599, 'random_strength': 6.653772961035795, 'grow_policy': 'Lossguide', 'min_data_in_leaf': 153, 'max_leaves': 64}. Best is trial 905 with value: 2398.0485076415025.[0m
[32m[I 2024-10-13 09:04:40,805][0m Trial 970 finished with value: 4500.632304050212 and parameters: {'depth': 6, 'learning_rate': 0.29681552658170574, 'iterations': 2565, 'l2_leaf_reg': 0.0013474754704770652, 'border_count': 132, 'bagging_temperature': 0.6629536540928271, 'random_strength': 0.4981107571556123, 'grow_policy': 'Depthwise', 'min_data_in_leaf': 142}. Best is trial 905 with value: 2398.0485076415025.[0m
[32m[I 2024-10-13 09:04:43,664][0m Trial 971 finished with value: 22231.709514756934 and parameters: {'depth': 8, 'learning_rate': 0.0004203140999861337, 'iterations': 1224, 'l2_leaf_reg': 0.0003482858641521324, 'border_count': 44, 'bagging_temperature': 0.6705155043612957, 'random_strength': 0.9623788708345702, 'grow_policy': 'Lossguide', 'min_data_in_leaf': 195, 'max_leaves': 62}. Best is trial 905 with value: 2398.0485076415025.[0m
[32m[I 2024-10-13 09:04:47,120][0m Trial 972 finished with value: 4639.16124129677 and parameters: {'depth': 7, 'learning_rate': 0.20876201734541677, 'iterations': 2643, 'l2_leaf_reg': 0.00048425468640051026, 'border_count': 50, 'bagging_temperature': 0.6555638844344399, 'random_strength': 0.002763809567030595, 'grow_policy': 'Lossguide', 'min_data_in_leaf': 131, 'max_leaves': 67}. Best is trial 905 with value: 2398.0485076415025.[0m
[32m[I 2024-10-13 09:04:50,497][0m Trial 973 finished with value: 5222.4526563517775 and parameters: {'depth': 8, 'learning_rate': 0.23208435615533762, 'iterations': 2714, 'l2_leaf_reg': 0.0009779697155634834, 'border_count': 35, 'bagging_temperature': 0.7440653966892328, 'random_strength': 6.268264564918396, 'grow_policy': 'Lossguide', 'min_data_in_leaf': 246, 'max_leaves': 200}. Best is trial 905 with value: 2398.0485076415025.[0m
[32m[I 2024-10-13 09:04:53,874][0m Trial 974 finished with value: 4164.673928230334 and parameters: {'depth': 7, 'learning_rate': 0.19545905922988574, 'iterations': 2531, 'l2_leaf_reg': 0.0006635362711706799, 'border_count': 42, 'bagging_temperature': 0.7181738820863695, 'random_strength': 0.6258732741727103, 'grow_policy': 'Lossguide', 'min_data_in_leaf': 152, 'max_leaves': 38}. Best is trial 905 with value: 2398.0485076415025.[0m
[32m[I 2024-10-13 09:05:14,386][0m Trial 975 finished with value: 4757.068808458463 and parameters: {'depth': 7, 'learning_rate': 0.24648520994819612, 'iterations': 2318, 'l2_leaf_reg': 0.0007199928105932179, 'border_count': 50, 'bagging_temperature': 0.6992278006924149, 'random_strength': 9.979490863610907, 'grow_policy': 'SymmetricTree', 'min_data_in_leaf': 219}. Best is trial 905 with value: 2398.0485076415025.[0m
[32m[I 2024-10-13 09:05:18,008][0m Trial 976 finished with value: 5156.865049623787 and parameters: {'depth': 8, 'learning_rate': 0.18539599032975942, 'iterations': 2676, 'l2_leaf_reg': 0.0010864812852506508, 'border_count': 169, 'bagging_temperature': 0.6764448775921004, 'random_strength': 0.3267310485741383, 'grow_policy': 'Lossguide', 'min_data_in_leaf': 131, 'max_leaves': 34}. Best is trial 905 with value: 2398.0485076415025.[0m
[32m[I 2024-10-13 09:05:19,388][0m Trial 977 finished with value: 4927.3067677535855 and parameters: {'depth': 6, 'learning_rate': 0.25720697981414575, 'iterations': 621, 'l2_leaf_reg': 0.0003848998661678388, 'border_count': 39, 'bagging_temperature': 0.6497691374197984, 'random_strength': 0.7578059397042012, 'grow_policy': 'Lossguide', 'min_data_in_leaf': 176, 'max_leaves': 114}. Best is trial 905 with value: 2398.0485076415025.[0m
[32m[I 2024-10-13 09:05:23,984][0m Trial 978 finished with value: 2573.7035095220403 and parameters: {'depth': 9, 'learning_rate': 0.21379012522021942, 'iterations': 2591, 'l2_leaf_reg': 0.0011270058239025462, 'border_count': 46, 'bagging_temperature': 0.7300850628604055, 'random_strength': 0.49895657134890486, 'grow_policy': 'Lossguide', 'min_data_in_leaf': 124, 'max_leaves': 60}. Best is trial 905 with value: 2398.0485076415025.[0m
[32m[I 2024-10-13 09:05:28,169][0m Trial 979 finished with value: 7219.484461529757 and parameters: {'depth': 9, 'learning_rate': 0.2991286385339714, 'iterations': 2464, 'l2_leaf_reg': 0.0038259899011081, 'border_count': 25, 'bagging_temperature': 0.7646374420586531, 'random_strength': 6.043175013223573, 'grow_policy': 'Lossguide', 'min_data_in_leaf': 164, 'max_leaves': 73}. Best is trial 905 with value: 2398.0485076415025.[0m
[32m[I 2024-10-13 09:05:33,936][0m Trial 980 finished with value: 5779.335522140845 and parameters: {'depth': 9, 'learning_rate': 0.22847723830886613, 'iterations': 2559, 'l2_leaf_reg': 0.001423946089406485, 'border_count': 33, 'bagging_temperature': 0.6306815358560888, 'random_strength': 5.717808720142032, 'grow_policy': 'Depthwise', 'min_data_in_leaf': 141}. Best is trial 905 with value: 2398.0485076415025.[0m
[32m[I 2024-10-13 09:05:40,063][0m Trial 981 finished with value: 11869.978877107344 and parameters: {'depth': 9, 'learning_rate': 0.258887899119806, 'iterations': 2530, 'l2_leaf_reg': 0.0015947815936447948, 'border_count': 1, 'bagging_temperature': 0.7566541832480097, 'random_strength': 1.0831976841510125, 'grow_policy': 'Lossguide', 'min_data_in_leaf': 126, 'max_leaves': 63}. Best is trial 905 with value: 2398.0485076415025.[0m
[32m[I 2024-10-13 09:05:46,130][0m Trial 982 finished with value: 4497.698679703118 and parameters: {'depth': 9, 'learning_rate': 0.012336279382849919, 'iterations': 2588, 'l2_leaf_reg': 0.0007714190039882253, 'border_count': 41, 'bagging_temperature': 0.7491793289241151, 'random_strength': 0.8042592224382819, 'grow_policy': 'Lossguide', 'min_data_in_leaf': 150, 'max_leaves': 84}. Best is trial 905 with value: 2398.0485076415025.[0m
[32m[I 2024-10-13 09:05:50,494][0m Trial 983 finished with value: 4764.151463906264 and parameters: {'depth': 9, 'learning_rate': 0.21528940436333108, 'iterations': 2436, 'l2_leaf_reg': 0.0011647073735142992, 'border_count': 202, 'bagging_temperature': 0.7318976457296084, 'random_strength': 6.8578668054283565, 'grow_policy': 'Lossguide', 'min_data_in_leaf': 126, 'max_leaves': 102}. Best is trial 905 with value: 2398.0485076415025.[0m
[32m[I 2024-10-13 09:05:55,031][0m Trial 984 finished with value: 2827.56091582144 and parameters: {'depth': 10, 'learning_rate': 0.257867094137123, 'iterations': 2480, 'l2_leaf_reg': 0.0017605415058320514, 'border_count': 45, 'bagging_temperature': 0.7500010636674671, 'random_strength': 0.4880988444066786, 'grow_policy': 'Lossguide', 'min_data_in_leaf': 272, 'max_leaves': 31}. Best is trial 905 with value: 2398.0485076415025.[0m
[32m[I 2024-10-13 09:05:59,138][0m Trial 985 finished with value: 4906.00645543631 and parameters: {'depth': 10, 'learning_rate': 0.20959469094968539, 'iterations': 2599, 'l2_leaf_reg': 3.0759517867087297e-07, 'border_count': 101, 'bagging_temperature': 0.7989622905334312, 'random_strength': 0.20224250130545054, 'grow_policy': 'Lossguide', 'min_data_in_leaf': 178, 'max_leaves': 60}. Best is trial 905 with value: 2398.0485076415025.[0m
[32m[I 2024-10-13 09:06:03,681][0m Trial 986 finished with value: 5156.426150852201 and parameters: {'depth': 10, 'learning_rate': 0.23684366105964624, 'iterations': 2524, 'l2_leaf_reg': 0.003421310153102605, 'border_count': 36, 'bagging_temperature': 0.7186160160912611, 'random_strength': 1.3229248416515271, 'grow_policy': 'Lossguide', 'min_data_in_leaf': 118, 'max_leaves': 67}. Best is trial 905 with value: 2398.0485076415025.[0m
[32m[I 2024-10-13 09:06:08,137][0m Trial 987 finished with value: 3051.694231443484 and parameters: {'depth': 9, 'learning_rate': 0.19630935768514457, 'iterations': 2370, 'l2_leaf_reg': 2.7420549147846227e-05, 'border_count': 46, 'bagging_temperature': 0.7293327886895927, 'random_strength': 0.005056936479025442, 'grow_policy': 'Lossguide', 'min_data_in_leaf': 156, 'max_leaves': 40}. Best is trial 905 with value: 2398.0485076415025.[0m
[32m[I 2024-10-13 09:06:11,511][0m Trial 988 finished with value: 3755.9594991702784 and parameters: {'depth': 10, 'learning_rate': 0.27101239124399024, 'iterations': 2618, 'l2_leaf_reg': 2.0141615192352616e-07, 'border_count': 58, 'bagging_temperature': 0.700564143446198, 'random_strength': 0.9883425403020623, 'grow_policy': 'Depthwise', 'min_data_in_leaf': 137}. Best is trial 905 with value: 2398.0485076415025.[0m
[32m[I 2024-10-13 09:06:16,137][0m Trial 989 finished with value: 5080.721566069261 and parameters: {'depth': 9, 'learning_rate': 0.019650113511651288, 'iterations': 2497, 'l2_leaf_reg': 2.0675623301507808e-08, 'border_count': 31, 'bagging_temperature': 0.7787601950794917, 'random_strength': 5.1629844541837695, 'grow_policy': 'Lossguide', 'min_data_in_leaf': 113, 'max_leaves': 174}. Best is trial 905 with value: 2398.0485076415025.[0m
[32m[I 2024-10-13 09:06:20,554][0m Trial 990 finished with value: 6084.170154270568 and parameters: {'depth': 8, 'learning_rate': 0.2982911614154292, 'iterations': 2554, 'l2_leaf_reg': 5.681520856072881e-07, 'border_count': 50, 'bagging_temperature': 0.726395549855475, 'random_strength': 0.6152302108067429, 'grow_policy': 'Lossguide', 'min_data_in_leaf': 111, 'max_leaves': 63}. Best is trial 905 with value: 2398.0485076415025.[0m
[32m[I 2024-10-13 09:06:25,172][0m Trial 991 finished with value: 4898.724893699005 and parameters: {'depth': 10, 'learning_rate': 0.22799346238738977, 'iterations': 2631, 'l2_leaf_reg': 0.2038285958274403, 'border_count': 41, 'bagging_temperature': 0.7767579687177858, 'random_strength': 0.3986759927337734, 'grow_policy': 'Lossguide', 'min_data_in_leaf': 141, 'max_leaves': 186}. Best is trial 905 with value: 2398.0485076415025.[0m
[32m[I 2024-10-13 09:06:28,986][0m Trial 992 finished with value: 3716.1002149242145 and parameters: {'depth': 8, 'learning_rate': 0.19005801366012778, 'iterations': 2443, 'l2_leaf_reg': 0.0009939874554913668, 'border_count': 53, 'bagging_temperature': 0.6396667885052241, 'random_strength': 1.1868176953149208, 'grow_policy': 'Lossguide', 'min_data_in_leaf': 125, 'max_leaves': 44}. Best is trial 905 with value: 2398.0485076415025.[0m
[32m[I 2024-10-13 09:06:33,396][0m Trial 993 finished with value: 2791.368108917262 and parameters: {'depth': 8, 'learning_rate': 0.23284615308850679, 'iterations': 2600, 'l2_leaf_reg': 4.088466928893084e-05, 'border_count': 43, 'bagging_temperature': 0.6163381061100224, 'random_strength': 0.7318965637785086, 'grow_policy': 'Lossguide', 'min_data_in_leaf': 171, 'max_leaves': 69}. Best is trial 905 with value: 2398.0485076415025.[0m
[32m[I 2024-10-13 09:06:37,829][0m Trial 994 finished with value: 5052.747080929585 and parameters: {'depth': 11, 'learning_rate': 0.18230292564606002, 'iterations': 2667, 'l2_leaf_reg': 7.360587886560334e-07, 'border_count': 36, 'bagging_temperature': 0.5991912580047102, 'random_strength': 0.24063289145000472, 'grow_policy': 'Lossguide', 'min_data_in_leaf': 108, 'max_leaves': 36}. Best is trial 905 with value: 2398.0485076415025.[0m
[32m[I 2024-10-13 09:06:42,102][0m Trial 995 finished with value: 2837.0623516664573 and parameters: {'depth': 9, 'learning_rate': 0.20996539923406318, 'iterations': 2391, 'l2_leaf_reg': 2.288158086355087e-05, 'border_count': 48, 'bagging_temperature': 0.7316892126780823, 'random_strength': 0.8689697968524117, 'grow_policy': 'Lossguide', 'min_data_in_leaf': 151, 'max_leaves': 59}. Best is trial 905 with value: 2398.0485076415025.[0m
[32m[I 2024-10-13 09:07:13,988][0m Trial 996 finished with value: 4660.663938217846 and parameters: {'depth': 9, 'learning_rate': 0.254716700433006, 'iterations': 2541, 'l2_leaf_reg': 0.0020998063348526435, 'border_count': 40, 'bagging_temperature': 0.6428617567797277, 'random_strength': 4.831163616384768, 'grow_policy': 'SymmetricTree', 'min_data_in_leaf': 124}. Best is trial 905 with value: 2398.0485076415025.[0m
[32m[I 2024-10-13 09:07:18,673][0m Trial 997 finished with value: 3617.1856293064025 and parameters: {'depth': 8, 'learning_rate': 0.17209703518504743, 'iterations': 2654, 'l2_leaf_reg': 9.560184191797667e-08, 'border_count': 56, 'bagging_temperature': 0.6256265065434834, 'random_strength': 0.5359807566837989, 'grow_policy': 'Depthwise', 'min_data_in_leaf': 109}. Best is trial 905 with value: 2398.0485076415025.[0m
[32m[I 2024-10-13 09:07:24,383][0m Trial 998 finished with value: 4925.706388125982 and parameters: {'depth': 8, 'learning_rate': 0.21301331597349513, 'iterations': 2959, 'l2_leaf_reg': 4.913954968576204e-08, 'border_count': 152, 'bagging_temperature': 0.6587579538111944, 'random_strength': 1.396816400445525, 'grow_policy': 'Lossguide', 'min_data_in_leaf': 196, 'max_leaves': 43}. Best is trial 905 with value: 2398.0485076415025.[0m
[32m[I 2024-10-13 09:07:29,097][0m Trial 999 finished with value: 2641.439708870267 and parameters: {'depth': 13, 'learning_rate': 0.26212379236691424, 'iterations': 2591, 'l2_leaf_reg': 2.89395472879275e-07, 'border_count': 45, 'bagging_temperature': 0.5136283525180283, 'random_strength': 0.3541791499107194, 'grow_policy': 'Lossguide', 'min_data_in_leaf': 102, 'max_leaves': 39}. Best is trial 905 with value: 2398.0485076415025.[0m
CatBoost: RMSE = 2398.0485
      Model         RMSE
0  CatBoost  2398.048508

Best hyperparameters for CatBoost:
{'depth': 11, 'learning_rate': 0.2151110553042793, 'iterations': 2680, 'l2_leaf_reg': 1.7526824597185874e-08, 'border_count': 44, 'bagging_temperature': 0.6397815338916675, 'random_strength': 4.954066082948334, 'grow_policy': 'Lossguide', 'min_data_in_leaf': 97, 'max_leaves': 58}
