[32m[I 2024-10-13 07:55:06,205][0m Trial 251 finished with value: 3883.0158226469725 and parameters: {'depth': 7, 'learning_rate': 0.24540419846397293, 'iterations': 2997, 'l2_leaf_reg': 6.050543868419157e-05, 'border_count': 52, 'bagging_temperature': 0.6168068074827356, 'random_strength': 0.8788595965762338, 'grow_policy': 'Lossguide', 'min_data_in_leaf': 144, 'max_leaves': 41}. Best is trial 243 with value: 2588.074208285989.[0m
[32m[I 2024-10-13 07:55:08,876][0m Trial 252 finished with value: 7406.103958068554 and parameters: {'depth': 7, 'learning_rate': 0.1983636957352454, 'iterations': 2839, 'l2_leaf_reg': 2.762381614682915e-07, 'border_count': 30, 'bagging_temperature': 0.6003853555298198, 'random_strength': 0.5876846549814941, 'grow_policy': 'Lossguide', 'min_data_in_leaf': 97, 'max_leaves': 31}. Best is trial 243 with value: 2588.074208285989.[0m
[32m[I 2024-10-13 07:55:11,649][0m Trial 253 finished with value: 3065.5888322711 and parameters: {'depth': 8, 'learning_rate': 0.2687443763122432, 'iterations': 2945, 'l2_leaf_reg': 0.00015420978890957538, 'border_count': 47, 'bagging_temperature': 0.6275100514723931, 'random_strength': 1.1363278728608461, 'grow_policy': 'Lossguide', 'min_data_in_leaf': 192, 'max_leaves': 50}. Best is trial 243 with value: 2588.074208285989.[0m
[32m[I 2024-10-13 07:55:14,139][0m Trial 254 finished with value: 4574.164403500722 and parameters: {'depth': 7, 'learning_rate': 0.22537649084980435, 'iterations': 2652, 'l2_leaf_reg': 9.212859020220007e-05, 'border_count': 51, 'bagging_temperature': 0.65506346088033, 'random_strength': 0.14419380427830852, 'grow_policy': 'Lossguide', 'min_data_in_leaf': 999, 'max_leaves': 38}. Best is trial 243 with value: 2588.074208285989.[0m
[32m[I 2024-10-13 07:55:16,716][0m Trial 255 finished with value: 3207.4367085694576 and parameters: {'depth': 7, 'learning_rate': 0.182938218845931, 'iterations': 2772, 'l2_leaf_reg': 2.546515387397061e-05, 'border_count': 43, 'bagging_temperature': 0.5461228831220883, 'random_strength': 0.5953359398154036, 'grow_policy': 'Lossguide', 'min_data_in_leaf': 770, 'max_leaves': 54}. Best is trial 243 with value: 2588.074208285989.[0m
[32m[I 2024-10-13 07:55:32,539][0m Trial 256 finished with value: 3595.409197166087 and parameters: {'depth': 7, 'learning_rate': 0.26383883366231947, 'iterations': 2897, 'l2_leaf_reg': 1.8788330732535438e-05, 'border_count': 37, 'bagging_temperature': 0.6080211019707469, 'random_strength': 0.24784642997348327, 'grow_policy': 'SymmetricTree', 'min_data_in_leaf': 213}. Best is trial 243 with value: 2588.074208285989.[0m
[32m[I 2024-10-13 07:55:35,075][0m Trial 257 finished with value: 5821.478357341916 and parameters: {'depth': 7, 'learning_rate': 0.2967459154590323, 'iterations': 2709, 'l2_leaf_reg': 2.973301132928554e-06, 'border_count': 49, 'bagging_temperature': 0.5823993447324504, 'random_strength': 0.859213412127861, 'grow_policy': 'Lossguide', 'min_data_in_leaf': 718, 'max_leaves': 42}. Best is trial 243 with value: 2588.074208285989.[0m
[32m[I 2024-10-13 07:55:37,702][0m Trial 258 finished with value: 3237.5440414115565 and parameters: {'depth': 7, 'learning_rate': 0.15991284605915498, 'iterations': 2817, 'l2_leaf_reg': 6.2723446530240584e-06, 'border_count': 44, 'bagging_temperature': 0.6206318456603142, 'random_strength': 0.4601929590813471, 'grow_policy': 'Lossguide', 'min_data_in_leaf': 172, 'max_leaves': 35}. Best is trial 243 with value: 2588.074208285989.[0m
[32m[I 2024-10-13 07:55:40,491][0m Trial 259 finished with value: 7232.6802161922105 and parameters: {'depth': 8, 'learning_rate': 0.2117645954937795, 'iterations': 2949, 'l2_leaf_reg': 6.55882487108612e-07, 'border_count': 25, 'bagging_temperature': 0.5663491423669066, 'random_strength': 1.5523976213557833, 'grow_policy': 'Lossguide', 'min_data_in_leaf': 123, 'max_leaves': 58}. Best is trial 243 with value: 2588.074208285989.[0m
[32m[I 2024-10-13 07:55:43,053][0m Trial 260 finished with value: 4634.933266898683 and parameters: {'depth': 7, 'learning_rate': 0.23609956020476397, 'iterations': 2603, 'l2_leaf_reg': 1.0458057329252921e-05, 'border_count': 39, 'bagging_temperature': 0.5964602748383407, 'random_strength': 1.2545749862646836, 'grow_policy': 'Depthwise', 'min_data_in_leaf': 97}. Best is trial 243 with value: 2588.074208285989.[0m
[32m[I 2024-10-13 07:55:45,520][0m Trial 261 finished with value: 3887.9149187384755 and parameters: {'depth': 6, 'learning_rate': 0.19959327392227547, 'iterations': 2504, 'l2_leaf_reg': 4.201566154412721e-05, 'border_count': 52, 'bagging_temperature': 0.6449157679992242, 'random_strength': 0.1556634029254425, 'grow_policy': 'Lossguide', 'min_data_in_leaf': 143, 'max_leaves': 44}. Best is trial 243 with value: 2588.074208285989.[0m
[32m[I 2024-10-13 07:55:48,221][0m Trial 262 finished with value: 5350.892023581392 and parameters: {'depth': 7, 'learning_rate': 0.17735982049083462, 'iterations': 2867, 'l2_leaf_reg': 3.2853135576009145e-05, 'border_count': 34, 'bagging_temperature': 0.632538719821716, 'random_strength': 0.0170083861868508, 'grow_policy': 'Lossguide', 'min_data_in_leaf': 113, 'max_leaves': 39}. Best is trial 243 with value: 2588.074208285989.[0m
[32m[I 2024-10-13 07:55:50,876][0m Trial 263 finished with value: 2819.8421484639525 and parameters: {'depth': 8, 'learning_rate': 0.23886993219493885, 'iterations': 2730, 'l2_leaf_reg': 1.7541337240412334e-05, 'border_count': 45, 'bagging_temperature': 0.5802550359688718, 'random_strength': 0.6814848715565552, 'grow_policy': 'Lossguide', 'min_data_in_leaf': 163, 'max_leaves': 31}. Best is trial 243 with value: 2588.074208285989.[0m
[32m[I 2024-10-13 07:55:53,539][0m Trial 264 finished with value: 2916.938950573935 and parameters: {'depth': 8, 'learning_rate': 0.29524107707811154, 'iterations': 2742, 'l2_leaf_reg': 1.682305226975247e-05, 'border_count': 47, 'bagging_temperature': 0.5770968689805394, 'random_strength': 0.5817986977912728, 'grow_policy': 'Lossguide', 'min_data_in_leaf': 164, 'max_leaves': 50}. Best is trial 243 with value: 2588.074208285989.[0m
[32m[I 2024-10-13 07:55:56,130][0m Trial 265 finished with value: 6197.823483484746 and parameters: {'depth': 9, 'learning_rate': 0.28811428235879116, 'iterations': 2682, 'l2_leaf_reg': 1.6200602289888065e-05, 'border_count': 40, 'bagging_temperature': 0.5464108841454903, 'random_strength': 0.6437188558318423, 'grow_policy': 'Lossguide', 'min_data_in_leaf': 167, 'max_leaves': 64}. Best is trial 243 with value: 2588.074208285989.[0m
[32m[I 2024-10-13 07:55:58,793][0m Trial 266 finished with value: 3894.4040867952954 and parameters: {'depth': 8, 'learning_rate': 0.2574921181537893, 'iterations': 2766, 'l2_leaf_reg': 2.63186692222963e-05, 'border_count': 52, 'bagging_temperature': 0.5723726652246794, 'random_strength': 0.3771991908125386, 'grow_policy': 'Lossguide', 'min_data_in_leaf': 189, 'max_leaves': 52}. Best is trial 243 with value: 2588.074208285989.[0m
[32m[I 2024-10-13 07:56:01,390][0m Trial 267 finished with value: 2762.163025410187 and parameters: {'depth': 8, 'learning_rate': 0.29374520666295667, 'iterations': 2724, 'l2_leaf_reg': 5.414880139421484e-05, 'border_count': 47, 'bagging_temperature': 0.5825931128043942, 'random_strength': 0.5391770383273985, 'grow_policy': 'Lossguide', 'min_data_in_leaf': 163, 'max_leaves': 48}. Best is trial 243 with value: 2588.074208285989.[0m
[32m[I 2024-10-13 07:56:03,850][0m Trial 268 finished with value: 5813.851939730658 and parameters: {'depth': 8, 'learning_rate': 0.24491424723997873, 'iterations': 2632, 'l2_leaf_reg': 6.797375148608356e-05, 'border_count': 31, 'bagging_temperature': 0.547043564349017, 'random_strength': 0.2617950938258853, 'grow_policy': 'Lossguide', 'min_data_in_leaf': 131, 'max_leaves': 46}. Best is trial 243 with value: 2588.074208285989.[0m
[32m[I 2024-10-13 07:56:06,393][0m Trial 269 finished with value: 5041.328581247208 and parameters: {'depth': 8, 'learning_rate': 0.21868737113688572, 'iterations': 2684, 'l2_leaf_reg': 3.742934698074563e-05, 'border_count': 38, 'bagging_temperature': 0.5890675888343245, 'random_strength': 0.7072532663294463, 'grow_policy': 'Lossguide', 'min_data_in_leaf': 149, 'max_leaves': 41}. Best is trial 243 with value: 2588.074208285989.[0m
[32m[I 2024-10-13 07:56:09,079][0m Trial 270 finished with value: 5821.52691013349 and parameters: {'depth': 8, 'learning_rate': 0.2998395144511252, 'iterations': 2816, 'l2_leaf_reg': 0.00011576699041297397, 'border_count': 50, 'bagging_temperature': 0.6019965676079208, 'random_strength': 0.43391494145559156, 'grow_policy': 'Lossguide', 'min_data_in_leaf': 213, 'max_leaves': 47}. Best is trial 243 with value: 2588.074208285989.[0m
[32m[I 2024-10-13 07:56:11,585][0m Trial 271 finished with value: 2878.3745522302197 and parameters: {'depth': 8, 'learning_rate': 0.24257168415527872, 'iterations': 2604, 'l2_leaf_reg': 4.7200134972439294e-05, 'border_count': 43, 'bagging_temperature': 0.5616754091206667, 'random_strength': 0.20186258567760465, 'grow_policy': 'Lossguide', 'min_data_in_leaf': 181, 'max_leaves': 54}. Best is trial 243 with value: 2588.074208285989.[0m
[32m[I 2024-10-13 07:56:14,029][0m Trial 272 finished with value: 5161.934609457006 and parameters: {'depth': 8, 'learning_rate': 0.2563157305145733, 'iterations': 2552, 'l2_leaf_reg': 0.00023308149097136136, 'border_count': 111, 'bagging_temperature': 0.5641314927012806, 'random_strength': 0.18278109771326603, 'grow_policy': 'Lossguide', 'min_data_in_leaf': 181, 'max_leaves': 60}. Best is trial 243 with value: 2588.074208285989.[0m
[32m[I 2024-10-13 07:56:16,559][0m Trial 273 finished with value: 5102.816571843854 and parameters: {'depth': 9, 'learning_rate': 0.1502829325577277, 'iterations': 2619, 'l2_leaf_reg': 5.377536053636405e-05, 'border_count': 41, 'bagging_temperature': 0.600648886774615, 'random_strength': 0.050062251688657564, 'grow_policy': 'Lossguide', 'min_data_in_leaf': 195, 'max_leaves': 54}. Best is trial 243 with value: 2588.074208285989.[0m
[32m[I 2024-10-13 07:56:18,978][0m Trial 274 finished with value: 3813.1182158183824 and parameters: {'depth': 6, 'learning_rate': 0.20882117303374917, 'iterations': 2469, 'l2_leaf_reg': 7.26358784130526e-05, 'border_count': 55, 'bagging_temperature': 0.5450701671338686, 'random_strength': 0.5712200051036704, 'grow_policy': 'Lossguide', 'min_data_in_leaf': 130, 'max_leaves': 38}. Best is trial 243 with value: 2588.074208285989.[0m
[32m[I 2024-10-13 07:56:21,580][0m Trial 275 finished with value: 5767.666471780754 and parameters: {'depth': 8, 'learning_rate': 0.2543729909292876, 'iterations': 2730, 'l2_leaf_reg': 2.2636461509259694e-05, 'border_count': 34, 'bagging_temperature': 0.5860489512947413, 'random_strength': 0.28775623741644396, 'grow_policy': 'Lossguide', 'min_data_in_leaf': 167, 'max_leaves': 52}. Best is trial 243 with value: 2588.074208285989.[0m
[32m[I 2024-10-13 07:56:24,123][0m Trial 276 finished with value: 3045.037605316148 and parameters: {'depth': 7, 'learning_rate': 0.19766132338402062, 'iterations': 2662, 'l2_leaf_reg': 1.1552645734311652e-05, 'border_count': 43, 'bagging_temperature': 0.9533265166802012, 'random_strength': 0.7936852852165632, 'grow_policy': 'Lossguide', 'min_data_in_leaf': 122, 'max_leaves': 58}. Best is trial 243 with value: 2588.074208285989.[0m
[32m[I 2024-10-13 07:56:26,909][0m Trial 277 finished with value: 3480.753096453182 and parameters: {'depth': 7, 'learning_rate': 0.2975650794624803, 'iterations': 2999, 'l2_leaf_reg': 0.0005023703555276139, 'border_count': 52, 'bagging_temperature': 0.5597277919400543, 'random_strength': 0.030797459638793455, 'grow_policy': 'Lossguide', 'min_data_in_leaf': 93, 'max_leaves': 42}. Best is trial 243 with value: 2588.074208285989.[0m
[32m[I 2024-10-13 07:56:43,694][0m Trial 278 finished with value: 5602.789249446891 and parameters: {'depth': 8, 'learning_rate': 0.17066921317378675, 'iterations': 2612, 'l2_leaf_reg': 5.000508753844838e-05, 'border_count': 37, 'bagging_temperature': 0.5319522999707681, 'random_strength': 0.4381002845388423, 'grow_policy': 'SymmetricTree', 'min_data_in_leaf': 156}. Best is trial 243 with value: 2588.074208285989.[0m
[32m[I 2024-10-13 07:56:46,226][0m Trial 279 finished with value: 3002.278797110768 and parameters: {'depth': 8, 'learning_rate': 0.22835973595399575, 'iterations': 2556, 'l2_leaf_reg': 2.6994847299036793e-05, 'border_count': 46, 'bagging_temperature': 0.612303621635379, 'random_strength': 0.25435326616477294, 'grow_policy': 'Lossguide', 'min_data_in_leaf': 87, 'max_leaves': 36}. Best is trial 243 with value: 2588.074208285989.[0m
[32m[I 2024-10-13 07:56:48,853][0m Trial 280 finished with value: 4565.350055885232 and parameters: {'depth': 7, 'learning_rate': 0.25226361648411605, 'iterations': 2707, 'l2_leaf_reg': 9.932683229973075e-08, 'border_count': 60, 'bagging_temperature': 0.5869841177748343, 'random_strength': 0.7047578924272945, 'grow_policy': 'Lossguide', 'min_data_in_leaf': 137, 'max_leaves': 49}. Best is trial 243 with value: 2588.074208285989.[0m
[32m[I 2024-10-13 07:56:51,577][0m Trial 281 finished with value: 4279.070960607429 and parameters: {'depth': 6, 'learning_rate': 0.008316693520452292, 'iterations': 2794, 'l2_leaf_reg': 9.936195594844654e-05, 'border_count': 41, 'bagging_temperature': 0.6062655051931518, 'random_strength': 0.5533523002147145, 'grow_policy': 'Lossguide', 'min_data_in_leaf': 174, 'max_leaves': 35}. Best is trial 243 with value: 2588.074208285989.[0m
[32m[I 2024-10-13 07:56:54,520][0m Trial 282 finished with value: 4840.546501578913 and parameters: {'depth': 8, 'learning_rate': 0.20465276799013463, 'iterations': 2962, 'l2_leaf_reg': 0.002211795619540613, 'border_count': 49, 'bagging_temperature': 0.565576290216597, 'random_strength': 0.22022385583009313, 'grow_policy': 'Depthwise', 'min_data_in_leaf': 120}. Best is trial 243 with value: 2588.074208285989.[0m
[32m[I 2024-10-13 07:56:56,861][0m Trial 283 finished with value: 7477.19262252097 and parameters: {'depth': 9, 'learning_rate': 0.17509252254203012, 'iterations': 2523, 'l2_leaf_reg': 1.4534031705231743e-05, 'border_count': 28, 'bagging_temperature': 0.5849957722122566, 'random_strength': 0.4060978677469176, 'grow_policy': 'Lossguide', 'min_data_in_leaf': 202, 'max_leaves': 116}. Best is trial 243 with value: 2588.074208285989.[0m
[32m[I 2024-10-13 07:56:59,538][0m Trial 284 finished with value: 2714.8985546582107 and parameters: {'depth': 7, 'learning_rate': 0.22468594976561188, 'iterations': 2760, 'l2_leaf_reg': 9.977748097448898e-06, 'border_count': 44, 'bagging_temperature': 0.6091984648199907, 'random_strength': 0.8195053285209052, 'grow_policy': 'Lossguide', 'min_data_in_leaf': 147, 'max_leaves': 43}. Best is trial 243 with value: 2588.074208285989.[0m
[32m[I 2024-10-13 07:57:02,262][0m Trial 285 finished with value: 3603.57651177671 and parameters: {'depth': 7, 'learning_rate': 0.20464997920938208, 'iterations': 2766, 'l2_leaf_reg': 1.0839903044904241e-05, 'border_count': 55, 'bagging_temperature': 0.6604814667442402, 'random_strength': 0.8597527502963278, 'grow_policy': 'Lossguide', 'min_data_in_leaf': 146, 'max_leaves': 43}. Best is trial 243 with value: 2588.074208285989.[0m
[32m[I 2024-10-13 07:57:04,956][0m Trial 286 finished with value: 5101.931403436164 and parameters: {'depth': 7, 'learning_rate': 0.15375430650832234, 'iterations': 2829, 'l2_leaf_reg': 2.0784190353708842e-05, 'border_count': 35, 'bagging_temperature': 0.6146697146420179, 'random_strength': 1.3576904998209183, 'grow_policy': 'Lossguide', 'min_data_in_leaf': 111, 'max_leaves': 40}. Best is trial 243 with value: 2588.074208285989.[0m
[32m[I 2024-10-13 07:57:07,673][0m Trial 287 finished with value: 2878.2382980648463 and parameters: {'depth': 7, 'learning_rate': 0.22348448057279247, 'iterations': 2723, 'l2_leaf_reg': 1.669732093417436e-05, 'border_count': 47, 'bagging_temperature': 0.6158174027118347, 'random_strength': 0.7881425991830266, 'grow_policy': 'Lossguide', 'min_data_in_leaf': 85, 'max_leaves': 46}. Best is trial 243 with value: 2588.074208285989.[0m
[32m[I 2024-10-13 07:57:10,450][0m Trial 288 finished with value: 3599.943923820044 and parameters: {'depth': 7, 'learning_rate': 0.2662165554314599, 'iterations': 2933, 'l2_leaf_reg': 9.907250179822285e-06, 'border_count': 53, 'bagging_temperature': 0.6484508220596769, 'random_strength': 1.0145497818297917, 'grow_policy': 'Lossguide', 'min_data_in_leaf': 135, 'max_leaves': 32}. Best is trial 243 with value: 2588.074208285989.[0m
[32m[I 2024-10-13 07:57:13,122][0m Trial 289 finished with value: 4414.122714842728 and parameters: {'depth': 6, 'learning_rate': 0.02068765671809115, 'iterations': 2863, 'l2_leaf_reg': 5.873943621496807e-07, 'border_count': 38, 'bagging_temperature': 0.6008879320693734, 'random_strength': 0.5876543784884185, 'grow_policy': 'Lossguide', 'min_data_in_leaf': 158, 'max_leaves': 38}. Best is trial 243 with value: 2588.074208285989.[0m
[32m[I 2024-10-13 07:57:16,117][0m Trial 290 finished with value: 3610.883002021755 and parameters: {'depth': 7, 'learning_rate': 0.003552486590317474, 'iterations': 2782, 'l2_leaf_reg': 3.2660989124000315e-07, 'border_count': 44, 'bagging_temperature': 0.6319320684855144, 'random_strength': 1.1795389081072023, 'grow_policy': 'Lossguide', 'min_data_in_leaf': 88, 'max_leaves': 31}. Best is trial 243 with value: 2588.074208285989.[0m
[32m[I 2024-10-13 07:57:18,711][0m Trial 291 finished with value: 3880.127639622612 and parameters: {'depth': 7, 'learning_rate': 0.18497398382742417, 'iterations': 2654, 'l2_leaf_reg': 8.278649020422172e-06, 'border_count': 59, 'bagging_temperature': 0.5891311958279041, 'random_strength': 0.5037236407090968, 'grow_policy': 'Lossguide', 'min_data_in_leaf': 111, 'max_leaves': 42}. Best is trial 243 with value: 2588.074208285989.[0m
[32m[I 2024-10-13 07:57:21,407][0m Trial 292 finished with value: 5235.286471607501 and parameters: {'depth': 7, 'learning_rate': 0.15446652806853603, 'iterations': 2914, 'l2_leaf_reg': 3.129663026209865e-05, 'border_count': 49, 'bagging_temperature': 0.6165132022892036, 'random_strength': 0.7899557317306649, 'grow_policy': 'Lossguide', 'min_data_in_leaf': 136, 'max_leaves': 48}. Best is trial 243 with value: 2588.074208285989.[0m
[32m[I 2024-10-13 07:57:23,953][0m Trial 293 finished with value: 6616.956650474816 and parameters: {'depth': 6, 'learning_rate': 0.29933590659964543, 'iterations': 2700, 'l2_leaf_reg': 1.4943902865389095e-05, 'border_count': 40, 'bagging_temperature': 0.598754018346521, 'random_strength': 0.025406138202764942, 'grow_policy': 'Lossguide', 'min_data_in_leaf': 106, 'max_leaves': 36}. Best is trial 243 with value: 2588.074208285989.[0m
[32m[I 2024-10-13 07:57:26,714][0m Trial 294 finished with value: 4967.036017981033 and parameters: {'depth': 7, 'learning_rate': 0.22239653837166076, 'iterations': 2963, 'l2_leaf_reg': 4.223668698307494e-06, 'border_count': 127, 'bagging_temperature': 0.5778510156610666, 'random_strength': 0.31716039664856893, 'grow_policy': 'Lossguide', 'min_data_in_leaf': 158, 'max_leaves': 75}. Best is trial 243 with value: 2588.074208285989.[0m
[32m[I 2024-10-13 07:57:29,464][0m Trial 295 finished with value: 5446.571019823952 and parameters: {'depth': 7, 'learning_rate': 0.19105489364780234, 'iterations': 2848, 'l2_leaf_reg': 2.22557483755278e-05, 'border_count': 33, 'bagging_temperature': 0.6451252784059404, 'random_strength': 0.5152740008815544, 'grow_policy': 'Lossguide', 'min_data_in_leaf': 123, 'max_leaves': 43}. Best is trial 243 with value: 2588.074208285989.[0m
[32m[I 2024-10-13 07:57:30,685][0m Trial 296 finished with value: 22746.76154805491 and parameters: {'depth': 8, 'learning_rate': 0.0005390018904036767, 'iterations': 900, 'l2_leaf_reg': 5.1612162434102226e-08, 'border_count': 97, 'bagging_temperature': 0.5341140104319135, 'random_strength': 1.9331298447241234, 'grow_policy': 'Lossguide', 'min_data_in_leaf': 144, 'max_leaves': 50}. Best is trial 243 with value: 2588.074208285989.[0m
[32m[I 2024-10-13 07:57:33,417][0m Trial 297 finished with value: 3098.6244039242583 and parameters: {'depth': 7, 'learning_rate': 0.2559328962605979, 'iterations': 2787, 'l2_leaf_reg': 1.8173417622052048e-06, 'border_count': 46, 'bagging_temperature': 0.6279391915456285, 'random_strength': 0.6796691095612888, 'grow_policy': 'Lossguide', 'min_data_in_leaf': 81, 'max_leaves': 38}. Best is trial 243 with value: 2588.074208285989.[0m
[32m[I 2024-10-13 07:57:36,125][0m Trial 298 finished with value: 3736.3333607636832 and parameters: {'depth': 7, 'learning_rate': 0.22451392975027673, 'iterations': 2898, 'l2_leaf_reg': 7.081480187833984e-05, 'border_count': 52, 'bagging_temperature': 0.6609398059875707, 'random_strength': 0.006054217922652403, 'grow_policy': 'Lossguide', 'min_data_in_leaf': 105, 'max_leaves': 46}. Best is trial 243 with value: 2588.074208285989.[0m
[32m[I 2024-10-13 07:57:38,716][0m Trial 299 finished with value: 4499.330477502612 and parameters: {'depth': 6, 'learning_rate': 0.26003342506439026, 'iterations': 2733, 'l2_leaf_reg': 4.048469100542332e-05, 'border_count': 42, 'bagging_temperature': 0.5630765924441211, 'random_strength': 0.346204916191472, 'grow_policy': 'Lossguide', 'min_data_in_leaf': 172, 'max_leaves': 31}. Best is trial 243 with value: 2588.074208285989.[0m
[32m[I 2024-10-13 07:57:41,460][0m Trial 300 finished with value: 5990.42204481125 and parameters: {'depth': 8, 'learning_rate': 0.2996098423613081, 'iterations': 2997, 'l2_leaf_reg': 2.891484917964354e-05, 'border_count': 49, 'bagging_temperature': 0.604282600498819, 'random_strength': 0.9600474721825477, 'grow_policy': 'Lossguide', 'min_data_in_leaf': 228, 'max_leaves': 40}. Best is trial 243 with value: 2588.074208285989.[0m
