[32m[I 2024-10-13 07:52:34,181][0m Trial 201 finished with value: 3040.656044468948 and parameters: {'depth': 7, 'learning_rate': 0.22246326897828253, 'iterations': 2570, 'l2_leaf_reg': 7.225368713883459e-06, 'border_count': 48, 'bagging_temperature': 0.5914957741291585, 'random_strength': 0.25257780667412166, 'grow_policy': 'Lossguide', 'min_data_in_leaf': 108, 'max_leaves': 47}. Best is trial 144 with value: 2690.2497230447584.[0m
[32m[I 2024-10-13 07:52:36,648][0m Trial 202 finished with value: 2809.8001140591064 and parameters: {'depth': 7, 'learning_rate': 0.23004766841586916, 'iterations': 2569, 'l2_leaf_reg': 7.13109397216582e-06, 'border_count': 46, 'bagging_temperature': 0.5998082626857764, 'random_strength': 0.3678605747216775, 'grow_policy': 'Lossguide', 'min_data_in_leaf': 110, 'max_leaves': 40}. Best is trial 144 with value: 2690.2497230447584.[0m
[32m[I 2024-10-13 07:52:39,324][0m Trial 203 finished with value: 2963.422883521744 and parameters: {'depth': 6, 'learning_rate': 0.22292804389160856, 'iterations': 2784, 'l2_leaf_reg': 1.5306131632446854e-05, 'border_count': 47, 'bagging_temperature': 0.5917833401915634, 'random_strength': 0.3833676589198718, 'grow_policy': 'Lossguide', 'min_data_in_leaf': 118, 'max_leaves': 46}. Best is trial 144 with value: 2690.2497230447584.[0m
[32m[I 2024-10-13 07:52:41,816][0m Trial 204 finished with value: 2872.4295443590177 and parameters: {'depth': 8, 'learning_rate': 0.22426472896498328, 'iterations': 2672, 'l2_leaf_reg': 2.9777513096665104e-05, 'border_count': 48, 'bagging_temperature': 0.5909212552077832, 'random_strength': 0.2382665516902977, 'grow_policy': 'Lossguide', 'min_data_in_leaf': 117, 'max_leaves': 47}. Best is trial 144 with value: 2690.2497230447584.[0m
[32m[I 2024-10-13 07:52:44,476][0m Trial 205 finished with value: 2908.293506214884 and parameters: {'depth': 8, 'learning_rate': 0.23272097007719061, 'iterations': 2848, 'l2_leaf_reg': 3.570933773229175e-05, 'border_count': 46, 'bagging_temperature': 0.5761096991217148, 'random_strength': 0.4043537831341805, 'grow_policy': 'Lossguide', 'min_data_in_leaf': 149, 'max_leaves': 45}. Best is trial 144 with value: 2690.2497230447584.[0m
[32m[I 2024-10-13 07:52:47,110][0m Trial 206 finished with value: 2767.189152333941 and parameters: {'depth': 7, 'learning_rate': 0.21668655380577528, 'iterations': 2840, 'l2_leaf_reg': 3.289690212636928e-05, 'border_count': 44, 'bagging_temperature': 0.6035869504192428, 'random_strength': 0.07071039351030226, 'grow_policy': 'Lossguide', 'min_data_in_leaf': 151, 'max_leaves': 40}. Best is trial 144 with value: 2690.2497230447584.[0m
[32m[I 2024-10-13 07:52:49,820][0m Trial 207 finished with value: 4625.120371703191 and parameters: {'depth': 6, 'learning_rate': 0.21604773798624907, 'iterations': 2863, 'l2_leaf_reg': 4.6774374368874113e-05, 'border_count': 39, 'bagging_temperature': 0.6046448935237491, 'random_strength': 0.12553935943716812, 'grow_policy': 'Lossguide', 'min_data_in_leaf': 146, 'max_leaves': 39}. Best is trial 144 with value: 2690.2497230447584.[0m
[32m[I 2024-10-13 07:52:52,582][0m Trial 208 finished with value: 2793.007224664507 and parameters: {'depth': 7, 'learning_rate': 0.23529404452233874, 'iterations': 2998, 'l2_leaf_reg': 2.361674597288746e-05, 'border_count': 45, 'bagging_temperature': 0.6007604203143239, 'random_strength': 0.4587575316965168, 'grow_policy': 'Lossguide', 'min_data_in_leaf': 157, 'max_leaves': 34}. Best is trial 144 with value: 2690.2497230447584.[0m
[32m[I 2024-10-13 07:52:55,383][0m Trial 209 finished with value: 2737.946908789128 and parameters: {'depth': 7, 'learning_rate': 0.23923149867193125, 'iterations': 2938, 'l2_leaf_reg': 1.765584766527033e-05, 'border_count': 44, 'bagging_temperature': 0.6464558798647143, 'random_strength': 0.43746028989878705, 'grow_policy': 'Lossguide', 'min_data_in_leaf': 156, 'max_leaves': 33}. Best is trial 144 with value: 2690.2497230447584.[0m
[32m[I 2024-10-13 07:52:58,153][0m Trial 210 finished with value: 5211.709083952531 and parameters: {'depth': 7, 'learning_rate': 0.26148337402606686, 'iterations': 2969, 'l2_leaf_reg': 2.733875087021562e-05, 'border_count': 174, 'bagging_temperature': 0.6433168843868631, 'random_strength': 0.4528508885847027, 'grow_policy': 'Lossguide', 'min_data_in_leaf': 181, 'max_leaves': 34}. Best is trial 144 with value: 2690.2497230447584.[0m
[32m[I 2024-10-13 07:53:00,822][0m Trial 211 finished with value: 2693.5655671019886 and parameters: {'depth': 7, 'learning_rate': 0.2266928864250837, 'iterations': 2856, 'l2_leaf_reg': 2.789516956441721e-05, 'border_count': 44, 'bagging_temperature': 0.6057164883985237, 'random_strength': 0.48535423424525537, 'grow_policy': 'Lossguide', 'min_data_in_leaf': 155, 'max_leaves': 48}. Best is trial 144 with value: 2690.2497230447584.[0m
[32m[I 2024-10-13 07:53:03,565][0m Trial 212 finished with value: 2790.6630788692005 and parameters: {'depth': 8, 'learning_rate': 0.23559012433013177, 'iterations': 2905, 'l2_leaf_reg': 6.352805445709471e-05, 'border_count': 43, 'bagging_temperature': 0.6148255557438226, 'random_strength': 0.5149920604875099, 'grow_policy': 'Lossguide', 'min_data_in_leaf': 167, 'max_leaves': 32}. Best is trial 144 with value: 2690.2497230447584.[0m
[32m[I 2024-10-13 07:53:06,181][0m Trial 213 finished with value: 5152.49327245069 and parameters: {'depth': 8, 'learning_rate': 0.22505282298858326, 'iterations': 2807, 'l2_leaf_reg': 2.6669131002838963e-05, 'border_count': 40, 'bagging_temperature': 0.617026815771531, 'random_strength': 0.4527767961681307, 'grow_policy': 'Lossguide', 'min_data_in_leaf': 164, 'max_leaves': 31}. Best is trial 144 with value: 2690.2497230447584.[0m
[32m[I 2024-10-13 07:53:08,850][0m Trial 214 finished with value: 5641.488816881231 and parameters: {'depth': 8, 'learning_rate': 0.20432908714609319, 'iterations': 2885, 'l2_leaf_reg': 7.63072593562953e-05, 'border_count': 32, 'bagging_temperature': 0.6046944168583506, 'random_strength': 0.6014805741595265, 'grow_policy': 'Lossguide', 'min_data_in_leaf': 153, 'max_leaves': 42}. Best is trial 144 with value: 2690.2497230447584.[0m
[32m[I 2024-10-13 07:53:11,593][0m Trial 215 finished with value: 5187.600001516756 and parameters: {'depth': 7, 'learning_rate': 0.29752969571847027, 'iterations': 2940, 'l2_leaf_reg': 1.3752521205707925e-05, 'border_count': 42, 'bagging_temperature': 0.6435692532466276, 'random_strength': 0.1297853255450322, 'grow_policy': 'Lossguide', 'min_data_in_leaf': 183, 'max_leaves': 51}. Best is trial 144 with value: 2690.2497230447584.[0m
[32m[I 2024-10-13 07:53:14,130][0m Trial 216 finished with value: 2756.8189408183425 and parameters: {'depth': 8, 'learning_rate': 0.23167839899445516, 'iterations': 2761, 'l2_leaf_reg': 4.993454491795477e-05, 'border_count': 44, 'bagging_temperature': 0.5773325597746105, 'random_strength': 0.4162917242839759, 'grow_policy': 'Lossguide', 'min_data_in_leaf': 138, 'max_leaves': 37}. Best is trial 144 with value: 2690.2497230447584.[0m
[32m[I 2024-10-13 07:53:16,920][0m Trial 217 finished with value: 2643.1945200558007 and parameters: {'depth': 7, 'learning_rate': 0.24483981358776596, 'iterations': 3000, 'l2_leaf_reg': 3.566244212002917e-05, 'border_count': 44, 'bagging_temperature': 0.5779619719586454, 'random_strength': 0.4068829128025717, 'grow_policy': 'Lossguide', 'min_data_in_leaf': 140, 'max_leaves': 36}. Best is trial 217 with value: 2643.1945200558007.[0m
[32m[I 2024-10-13 07:53:19,551][0m Trial 218 finished with value: 5353.37212063152 and parameters: {'depth': 6, 'learning_rate': 0.24103476004792423, 'iterations': 2783, 'l2_leaf_reg': 3.493885260691859e-05, 'border_count': 35, 'bagging_temperature': 0.6084464808324971, 'random_strength': 0.4017828845714645, 'grow_policy': 'Lossguide', 'min_data_in_leaf': 139, 'max_leaves': 36}. Best is trial 217 with value: 2643.1945200558007.[0m
[32m[I 2024-10-13 07:53:40,730][0m Trial 219 finished with value: 4315.693375858494 and parameters: {'depth': 8, 'learning_rate': 0.2026073010050696, 'iterations': 2985, 'l2_leaf_reg': 4.810707716509673e-05, 'border_count': 42, 'bagging_temperature': 0.5853460238596706, 'random_strength': 0.5077614785327288, 'grow_policy': 'SymmetricTree', 'min_data_in_leaf': 166}. Best is trial 217 with value: 2643.1945200558007.[0m
[32m[I 2024-10-13 07:53:43,418][0m Trial 220 finished with value: 2819.6341719585826 and parameters: {'depth': 7, 'learning_rate': 0.2368597692918156, 'iterations': 2888, 'l2_leaf_reg': 5.65832047214272e-05, 'border_count': 44, 'bagging_temperature': 0.6244949533521088, 'random_strength': 0.02998022289933544, 'grow_policy': 'Lossguide', 'min_data_in_leaf': 136, 'max_leaves': 39}. Best is trial 217 with value: 2643.1945200558007.[0m
[32m[I 2024-10-13 07:53:46,114][0m Trial 221 finished with value: 2805.518991307504 and parameters: {'depth': 7, 'learning_rate': 0.24175519929848588, 'iterations': 2918, 'l2_leaf_reg': 7.078510051179213e-05, 'border_count': 44, 'bagging_temperature': 0.6316270656878681, 'random_strength': 0.0239946702509366, 'grow_policy': 'Lossguide', 'min_data_in_leaf': 128, 'max_leaves': 40}. Best is trial 217 with value: 2643.1945200558007.[0m
[32m[I 2024-10-13 07:53:48,805][0m Trial 222 finished with value: 5077.174121408848 and parameters: {'depth': 7, 'learning_rate': 0.23090316821467094, 'iterations': 2885, 'l2_leaf_reg': 6.988180777305399e-05, 'border_count': 37, 'bagging_temperature': 0.6242456780666871, 'random_strength': 0.05340555527158358, 'grow_policy': 'Lossguide', 'min_data_in_leaf': 134, 'max_leaves': 39}. Best is trial 217 with value: 2643.1945200558007.[0m
[32m[I 2024-10-13 07:53:51,379][0m Trial 223 finished with value: 3085.80020131782 and parameters: {'depth': 7, 'learning_rate': 0.1991728973672275, 'iterations': 2730, 'l2_leaf_reg': 3.5414401019820754e-05, 'border_count': 44, 'bagging_temperature': 0.5928512678062354, 'random_strength': 0.25555583838803175, 'grow_policy': 'Lossguide', 'min_data_in_leaf': 152, 'max_leaves': 44}. Best is trial 217 with value: 2643.1945200558007.[0m
[32m[I 2024-10-13 07:53:54,092][0m Trial 224 finished with value: 5701.246220135919 and parameters: {'depth': 7, 'learning_rate': 0.23676342472027906, 'iterations': 2916, 'l2_leaf_reg': 6.33582778863024e-05, 'border_count': 29, 'bagging_temperature': 0.5766669288024509, 'random_strength': 0.5957450200776091, 'grow_policy': 'Lossguide', 'min_data_in_leaf': 196, 'max_leaves': 48}. Best is trial 217 with value: 2643.1945200558007.[0m
[32m[I 2024-10-13 07:53:56,639][0m Trial 225 finished with value: 3003.178432188544 and parameters: {'depth': 7, 'learning_rate': 0.19705938096311928, 'iterations': 2673, 'l2_leaf_reg': 1.8709781426488434e-05, 'border_count': 44, 'bagging_temperature': 0.6352480854590463, 'random_strength': 0.32243007552457376, 'grow_policy': 'Lossguide', 'min_data_in_leaf': 171, 'max_leaves': 32}. Best is trial 217 with value: 2643.1945200558007.[0m
[32m[I 2024-10-13 07:53:59,234][0m Trial 226 finished with value: 5343.867902150022 and parameters: {'depth': 8, 'learning_rate': 0.24625669208329823, 'iterations': 2776, 'l2_leaf_reg': 3.2455395308734315e-05, 'border_count': 37, 'bagging_temperature': 0.6100446565898612, 'random_strength': 0.07079860415719921, 'grow_policy': 'Lossguide', 'min_data_in_leaf': 124, 'max_leaves': 38}. Best is trial 217 with value: 2643.1945200558007.[0m
[32m[I 2024-10-13 07:54:02,069][0m Trial 227 finished with value: 3069.700651999856 and parameters: {'depth': 6, 'learning_rate': 0.20057061700747003, 'iterations': 2998, 'l2_leaf_reg': 2.3897545721223258e-05, 'border_count': 45, 'bagging_temperature': 0.553685046176489, 'random_strength': 0.3915820272230265, 'grow_policy': 'Depthwise', 'min_data_in_leaf': 137}. Best is trial 217 with value: 2643.1945200558007.[0m
[32m[I 2024-10-13 07:54:04,748][0m Trial 228 finished with value: 25315.12427679918 and parameters: {'depth': 7, 'learning_rate': 0.00010429120557103655, 'iterations': 2837, 'l2_leaf_reg': 0.00010014542770851117, 'border_count': 40, 'bagging_temperature': 0.5960195853203336, 'random_strength': 0.6106515053868986, 'grow_policy': 'Lossguide', 'min_data_in_leaf': 116, 'max_leaves': 42}. Best is trial 217 with value: 2643.1945200558007.[0m
[32m[I 2024-10-13 07:54:07,538][0m Trial 229 finished with value: 4758.4453730934565 and parameters: {'depth': 6, 'learning_rate': 0.005797176205677509, 'iterations': 2897, 'l2_leaf_reg': 7.766467350995146e-06, 'border_count': 32, 'bagging_temperature': 0.5744190084391354, 'random_strength': 0.19856633315859173, 'grow_policy': 'Lossguide', 'min_data_in_leaf': 161, 'max_leaves': 36}. Best is trial 217 with value: 2643.1945200558007.[0m
[32m[I 2024-10-13 07:54:10,155][0m Trial 230 finished with value: 3161.7452388225297 and parameters: {'depth': 8, 'learning_rate': 0.2576328713233146, 'iterations': 2714, 'l2_leaf_reg': 5.0381782979292876e-05, 'border_count': 47, 'bagging_temperature': 0.6457408076299229, 'random_strength': 0.005391207196334236, 'grow_policy': 'Lossguide', 'min_data_in_leaf': 145, 'max_leaves': 51}. Best is trial 217 with value: 2643.1945200558007.[0m
[32m[I 2024-10-13 07:54:12,644][0m Trial 231 finished with value: 2870.097703817775 and parameters: {'depth': 7, 'learning_rate': 0.1957808325527834, 'iterations': 2669, 'l2_leaf_reg': 1.704719604768731e-05, 'border_count': 44, 'bagging_temperature': 0.6203237603787598, 'random_strength': 0.3348451691301877, 'grow_policy': 'Lossguide', 'min_data_in_leaf': 170, 'max_leaves': 36}. Best is trial 217 with value: 2643.1945200558007.[0m
[32m[I 2024-10-13 07:54:15,348][0m Trial 232 finished with value: 2988.899191605343 and parameters: {'depth': 7, 'learning_rate': 0.22326462365398028, 'iterations': 2934, 'l2_leaf_reg': 1.6074684664152994e-05, 'border_count': 45, 'bagging_temperature': 0.6179238361619471, 'random_strength': 0.9053137015374773, 'grow_policy': 'Lossguide', 'min_data_in_leaf': 174, 'max_leaves': 45}. Best is trial 217 with value: 2643.1945200558007.[0m
[32m[I 2024-10-13 07:54:17,847][0m Trial 233 finished with value: 4996.713075510214 and parameters: {'depth': 7, 'learning_rate': 0.19788388943365942, 'iterations': 2648, 'l2_leaf_reg': 0.0001649524792631776, 'border_count': 38, 'bagging_temperature': 0.6113941523938711, 'random_strength': 0.41615405058168053, 'grow_policy': 'Lossguide', 'min_data_in_leaf': 115, 'max_leaves': 31}. Best is trial 217 with value: 2643.1945200558007.[0m
[32m[I 2024-10-13 07:54:20,482][0m Trial 234 finished with value: 4608.518659123611 and parameters: {'depth': 8, 'learning_rate': 0.25943195226891014, 'iterations': 2770, 'l2_leaf_reg': 2.782913335569628e-05, 'border_count': 51, 'bagging_temperature': 0.5905982576998526, 'random_strength': 0.6492374844434149, 'grow_policy': 'Lossguide', 'min_data_in_leaf': 204, 'max_leaves': 40}. Best is trial 217 with value: 2643.1945200558007.[0m
[32m[I 2024-10-13 07:54:23,042][0m Trial 235 finished with value: 3174.7994361883316 and parameters: {'depth': 7, 'learning_rate': 0.18007856721069565, 'iterations': 2817, 'l2_leaf_reg': 9.125209317739756e-06, 'border_count': 44, 'bagging_temperature': 0.5564564033811201, 'random_strength': 0.2630652005029734, 'grow_policy': 'Lossguide', 'min_data_in_leaf': 132, 'max_leaves': 36}. Best is trial 217 with value: 2643.1945200558007.[0m
[32m[I 2024-10-13 07:54:25,650][0m Trial 236 finished with value: 22099.200117512984 and parameters: {'depth': 8, 'learning_rate': 0.00018218301162371692, 'iterations': 2854, 'l2_leaf_reg': 2.0632373928385426e-05, 'border_count': 41, 'bagging_temperature': 0.6334746966308387, 'random_strength': 0.5260569482433354, 'grow_policy': 'Lossguide', 'min_data_in_leaf': 104, 'max_leaves': 48}. Best is trial 217 with value: 2643.1945200558007.[0m
[32m[I 2024-10-13 07:54:28,192][0m Trial 237 finished with value: 4715.81255586993 and parameters: {'depth': 7, 'learning_rate': 0.22652470826456178, 'iterations': 2690, 'l2_leaf_reg': 9.642222841564442e-08, 'border_count': 50, 'bagging_temperature': 0.5730177593595255, 'random_strength': 0.0013792968462552485, 'grow_policy': 'Lossguide', 'min_data_in_leaf': 150, 'max_leaves': 54}. Best is trial 217 with value: 2643.1945200558007.[0m
[32m[I 2024-10-13 07:54:30,913][0m Trial 238 finished with value: 3033.090439027849 and parameters: {'depth': 6, 'learning_rate': 0.26684515381510826, 'iterations': 2938, 'l2_leaf_reg': 5.438869967330724e-05, 'border_count': 47, 'bagging_temperature': 0.6586390746579671, 'random_strength': 0.2847425302300199, 'grow_policy': 'Lossguide', 'min_data_in_leaf': 186, 'max_leaves': 43}. Best is trial 217 with value: 2643.1945200558007.[0m
[32m[I 2024-10-13 07:54:33,360][0m Trial 239 finished with value: 5333.5838462977545 and parameters: {'depth': 8, 'learning_rate': 0.1910541500507861, 'iterations': 2546, 'l2_leaf_reg': 3.5009184501512094e-05, 'border_count': 35, 'bagging_temperature': 0.5971944985786535, 'random_strength': 0.7734605559335999, 'grow_policy': 'Lossguide', 'min_data_in_leaf': 120, 'max_leaves': 38}. Best is trial 217 with value: 2643.1945200558007.[0m
[32m[I 2024-10-13 07:54:35,962][0m Trial 240 finished with value: 5211.073023559612 and parameters: {'depth': 9, 'learning_rate': 0.29899693750598133, 'iterations': 2742, 'l2_leaf_reg': 2.2709232253468243e-05, 'border_count': 42, 'bagging_temperature': 0.619147136415169, 'random_strength': 0.4223858552319749, 'grow_policy': 'Lossguide', 'min_data_in_leaf': 156, 'max_leaves': 48}. Best is trial 217 with value: 2643.1945200558007.[0m
[32m[I 2024-10-13 07:54:38,816][0m Trial 241 finished with value: 2813.778226786068 and parameters: {'depth': 7, 'learning_rate': 0.22458130021408254, 'iterations': 2930, 'l2_leaf_reg': 1.3822195816070757e-05, 'border_count': 45, 'bagging_temperature': 0.6130943549816739, 'random_strength': 0.9328044652212949, 'grow_policy': 'Lossguide', 'min_data_in_leaf': 175, 'max_leaves': 43}. Best is trial 217 with value: 2643.1945200558007.[0m
[32m[I 2024-10-13 07:54:41,585][0m Trial 242 finished with value: 3670.19794916772 and parameters: {'depth': 7, 'learning_rate': 0.22832476420612235, 'iterations': 2996, 'l2_leaf_reg': 1.4069830126845787e-05, 'border_count': 52, 'bagging_temperature': 0.5829740848572866, 'random_strength': 0.20970379030018693, 'grow_policy': 'Lossguide', 'min_data_in_leaf': 135, 'max_leaves': 42}. Best is trial 217 with value: 2643.1945200558007.[0m
[32m[I 2024-10-13 07:54:44,374][0m Trial 243 finished with value: 2588.074208285989 and parameters: {'depth': 7, 'learning_rate': 0.23176432913633138, 'iterations': 2894, 'l2_leaf_reg': 5.293484194980118e-06, 'border_count': 45, 'bagging_temperature': 0.632068554979765, 'random_strength': 0.9803295277356423, 'grow_policy': 'Lossguide', 'min_data_in_leaf': 103, 'max_leaves': 37}. Best is trial 243 with value: 2588.074208285989.[0m
[32m[I 2024-10-13 07:54:47,183][0m Trial 244 finished with value: 2932.806529135048 and parameters: {'depth': 7, 'learning_rate': 0.23003032436378693, 'iterations': 2890, 'l2_leaf_reg': 6.38661205387523e-06, 'border_count': 47, 'bagging_temperature': 0.6332776697189875, 'random_strength': 1.0671961861282777, 'grow_policy': 'Lossguide', 'min_data_in_leaf': 991, 'max_leaves': 34}. Best is trial 243 with value: 2588.074208285989.[0m
[32m[I 2024-10-13 07:54:49,934][0m Trial 245 finished with value: 5191.3775539585595 and parameters: {'depth': 7, 'learning_rate': 0.21902619904217435, 'iterations': 2876, 'l2_leaf_reg': 9.29244703498893e-06, 'border_count': 38, 'bagging_temperature': 0.6414194024843847, 'random_strength': 1.0965753395321058, 'grow_policy': 'Lossguide', 'min_data_in_leaf': 176, 'max_leaves': 36}. Best is trial 243 with value: 2588.074208285989.[0m
[32m[I 2024-10-13 07:54:52,700][0m Trial 246 finished with value: 2960.71029669985 and parameters: {'depth': 7, 'learning_rate': 0.1872319970992465, 'iterations': 2900, 'l2_leaf_reg': 5.66748684533979e-06, 'border_count': 44, 'bagging_temperature': 0.6269908576992826, 'random_strength': 0.95572968870149, 'grow_policy': 'Lossguide', 'min_data_in_leaf': 104, 'max_leaves': 31}. Best is trial 243 with value: 2588.074208285989.[0m
[32m[I 2024-10-13 07:54:55,401][0m Trial 247 finished with value: 4152.283332779343 and parameters: {'depth': 7, 'learning_rate': 0.17271987595834384, 'iterations': 2925, 'l2_leaf_reg': 6.350344910866591e-06, 'border_count': 42, 'bagging_temperature': 0.6295386108890033, 'random_strength': 0.9653958047313812, 'grow_policy': 'Lossguide', 'min_data_in_leaf': 105, 'max_leaves': 31}. Best is trial 243 with value: 2588.074208285989.[0m
[32m[I 2024-10-13 07:54:58,032][0m Trial 248 finished with value: 5180.955833887485 and parameters: {'depth': 7, 'learning_rate': 0.19403252262833548, 'iterations': 2841, 'l2_leaf_reg': 5.853753423679962e-06, 'border_count': 35, 'bagging_temperature': 0.6104934940823349, 'random_strength': 0.7241512515451702, 'grow_policy': 'Lossguide', 'min_data_in_leaf': 891, 'max_leaves': 34}. Best is trial 243 with value: 2588.074208285989.[0m
[32m[I 2024-10-13 07:55:00,763][0m Trial 249 finished with value: 2975.3867592057645 and parameters: {'depth': 7, 'learning_rate': 0.16246559637203248, 'iterations': 2927, 'l2_leaf_reg': 4.006462195813493e-06, 'border_count': 44, 'bagging_temperature': 0.6597225600640494, 'random_strength': 1.000090970076194, 'grow_policy': 'Lossguide', 'min_data_in_leaf': 98, 'max_leaves': 39}. Best is trial 243 with value: 2588.074208285989.[0m
[32m[I 2024-10-13 07:55:03,445][0m Trial 250 finished with value: 4415.098558677998 and parameters: {'depth': 7, 'learning_rate': 0.011077997223186429, 'iterations': 2887, 'l2_leaf_reg': 3.671277169899054e-05, 'border_count': 40, 'bagging_temperature': 0.6395735890055763, 'random_strength': 0.7469924515306016, 'grow_policy': 'Lossguide', 'min_data_in_leaf': 156, 'max_leaves': 35}. Best is trial 243 with value: 2588.074208285989.[0m
