[32m[I 2024-10-13 08:29:15,654][0m Trial 602 finished with value: 21069.572271591496 and parameters: {'depth': 10, 'learning_rate': 0.000255457095597737, 'iterations': 2383, 'l2_leaf_reg': 9.543623551515154e-07, 'border_count': 42, 'bagging_temperature': 0.579926131137625, 'random_strength': 0.9586200996121874, 'grow_policy': 'Lossguide', 'min_data_in_leaf': 139, 'max_leaves': 52}. Best is trial 472 with value: 2453.464132483589.[0m
[32m[I 2024-10-13 08:29:21,113][0m Trial 603 finished with value: 10630.325704955794 and parameters: {'depth': 7, 'learning_rate': 0.0007726917380014739, 'iterations': 2886, 'l2_leaf_reg': 4.4181783873757746e-07, 'border_count': 166, 'bagging_temperature': 0.6167012412142698, 'random_strength': 1.504246250424111, 'grow_policy': 'Lossguide', 'min_data_in_leaf': 111, 'max_leaves': 39}. Best is trial 472 with value: 2453.464132483589.[0m
[32m[I 2024-10-13 08:29:25,451][0m Trial 604 finished with value: 2809.473677857129 and parameters: {'depth': 7, 'learning_rate': 0.18596665739425805, 'iterations': 2713, 'l2_leaf_reg': 3.0096732625614534e-05, 'border_count': 55, 'bagging_temperature': 0.47808760787759697, 'random_strength': 0.7805175294165585, 'grow_policy': 'Lossguide', 'min_data_in_leaf': 72, 'max_leaves': 56}. Best is trial 472 with value: 2453.464132483589.[0m
[32m[I 2024-10-13 08:29:28,838][0m Trial 605 finished with value: 4158.794488932564 and parameters: {'depth': 8, 'learning_rate': 0.22081595616002786, 'iterations': 2594, 'l2_leaf_reg': 6.775619184638553e-07, 'border_count': 37, 'bagging_temperature': 0.5295252786999515, 'random_strength': 7.578874084723774, 'grow_policy': 'Lossguide', 'min_data_in_leaf': 88, 'max_leaves': 47}. Best is trial 472 with value: 2453.464132483589.[0m
[32m[I 2024-10-13 08:29:33,441][0m Trial 606 finished with value: 5031.097484158008 and parameters: {'depth': 8, 'learning_rate': 0.26277988886702386, 'iterations': 2511, 'l2_leaf_reg': 0.00019598444553481964, 'border_count': 49, 'bagging_temperature': 0.5489866894503573, 'random_strength': 0.5690848941538488, 'grow_policy': 'Lossguide', 'min_data_in_leaf': 158, 'max_leaves': 240}. Best is trial 472 with value: 2453.464132483589.[0m
[32m[I 2024-10-13 08:29:38,406][0m Trial 607 finished with value: 4643.35098293209 and parameters: {'depth': 6, 'learning_rate': 0.2017617350640859, 'iterations': 2761, 'l2_leaf_reg': 1.1353824702067072e-05, 'border_count': 63, 'bagging_temperature': 0.6768515496966626, 'random_strength': 0.25244504056006833, 'grow_policy': 'Lossguide', 'min_data_in_leaf': 123, 'max_leaves': 31}. Best is trial 472 with value: 2453.464132483589.[0m
[32m[I 2024-10-13 08:29:45,347][0m Trial 608 finished with value: 3974.3283260638505 and parameters: {'depth': 7, 'learning_rate': 0.1621235391115339, 'iterations': 2904, 'l2_leaf_reg': 4.214527833359908e-05, 'border_count': 31, 'bagging_temperature': 0.5975438360552398, 'random_strength': 1.075888320785502, 'grow_policy': 'Depthwise', 'min_data_in_leaf': 42}. Best is trial 472 with value: 2453.464132483589.[0m
[32m[I 2024-10-13 08:29:50,626][0m Trial 609 finished with value: 2707.588966211709 and parameters: {'depth': 7, 'learning_rate': 0.2354339305996766, 'iterations': 2686, 'l2_leaf_reg': 3.735137702447434e-07, 'border_count': 45, 'bagging_temperature': 0.6397536489405726, 'random_strength': 0.45847561534505166, 'grow_policy': 'Lossguide', 'min_data_in_leaf': 102, 'max_leaves': 42}. Best is trial 472 with value: 2453.464132483589.[0m
[32m[I 2024-10-13 08:29:56,009][0m Trial 610 finished with value: 3166.7851050054314 and parameters: {'depth': 7, 'learning_rate': 0.2609371945149112, 'iterations': 2652, 'l2_leaf_reg': 2.424914967020903e-07, 'border_count': 53, 'bagging_temperature': 0.6658375372600761, 'random_strength': 0.7673020074005044, 'grow_policy': 'Lossguide', 'min_data_in_leaf': 65, 'max_leaves': 66}. Best is trial 472 with value: 2453.464132483589.[0m
[32m[I 2024-10-13 08:30:00,586][0m Trial 611 finished with value: 2896.8088553104503 and parameters: {'depth': 8, 'learning_rate': 0.2984059617358898, 'iterations': 2599, 'l2_leaf_reg': 2.463889240827919e-07, 'border_count': 45, 'bagging_temperature': 0.6442869694627442, 'random_strength': 0.5349387726476709, 'grow_policy': 'Lossguide', 'min_data_in_leaf': 94, 'max_leaves': 59}. Best is trial 472 with value: 2453.464132483589.[0m
[32m[I 2024-10-13 08:30:05,512][0m Trial 612 finished with value: 3552.54015923678 and parameters: {'depth': 7, 'learning_rate': 0.2344715929589848, 'iterations': 2679, 'l2_leaf_reg': 3.7374680012150514e-07, 'border_count': 59, 'bagging_temperature': 0.6981129005719691, 'random_strength': 0.9230955726385182, 'grow_policy': 'Lossguide', 'min_data_in_leaf': 80, 'max_leaves': 51}. Best is trial 472 with value: 2453.464132483589.[0m
[32m[I 2024-10-13 08:30:10,541][0m Trial 613 finished with value: 4819.6919682204925 and parameters: {'depth': 5, 'learning_rate': 0.18292634038402242, 'iterations': 2548, 'l2_leaf_reg': 4.5141112287903574e-07, 'border_count': 41, 'bagging_temperature': 0.6362306578007021, 'random_strength': 0.6504141296758805, 'grow_policy': 'Lossguide', 'min_data_in_leaf': 105, 'max_leaves': 46}. Best is trial 472 with value: 2453.464132483589.[0m
[32m[I 2024-10-13 08:30:14,332][0m Trial 614 finished with value: 3331.8844950847915 and parameters: {'depth': 6, 'learning_rate': 0.2201751968698151, 'iterations': 2622, 'l2_leaf_reg': 6.143156719673331e-07, 'border_count': 48, 'bagging_temperature': 0.6627036544467334, 'random_strength': 1.1717564742815565, 'grow_policy': 'Lossguide', 'min_data_in_leaf': 60, 'max_leaves': 226}. Best is trial 472 with value: 2453.464132483589.[0m
[32m[I 2024-10-13 08:30:19,506][0m Trial 615 finished with value: 5253.02846374305 and parameters: {'depth': 8, 'learning_rate': 0.26684741806089257, 'iterations': 2713, 'l2_leaf_reg': 6.156195502448596e-08, 'border_count': 38, 'bagging_temperature': 0.6330895956528901, 'random_strength': 9.067027335640839, 'grow_policy': 'Lossguide', 'min_data_in_leaf': 104, 'max_leaves': 42}. Best is trial 472 with value: 2453.464132483589.[0m
[32m[I 2024-10-13 08:30:24,413][0m Trial 616 finished with value: 3268.816419334362 and parameters: {'depth': 7, 'learning_rate': 0.20408919187441335, 'iterations': 2672, 'l2_leaf_reg': 0.01933064103445874, 'border_count': 52, 'bagging_temperature': 0.45582153313635554, 'random_strength': 0.45292746493279895, 'grow_policy': 'Lossguide', 'min_data_in_leaf': 83, 'max_leaves': 54}. Best is trial 472 with value: 2453.464132483589.[0m
[32m[I 2024-10-13 08:30:29,771][0m Trial 617 finished with value: 6957.804720814241 and parameters: {'depth': 7, 'learning_rate': 0.2429525215231028, 'iterations': 2735, 'l2_leaf_reg': 1.432765578339439e-08, 'border_count': 25, 'bagging_temperature': 0.6894783487595325, 'random_strength': 1.6460039195886416, 'grow_policy': 'Depthwise', 'min_data_in_leaf': 124}. Best is trial 472 with value: 2453.464132483589.[0m
[32m[I 2024-10-13 08:30:34,131][0m Trial 618 finished with value: 2785.018080547468 and parameters: {'depth': 8, 'learning_rate': 0.14798719331065854, 'iterations': 2491, 'l2_leaf_reg': 3.3867744506709423e-07, 'border_count': 45, 'bagging_temperature': 0.6235409299524375, 'random_strength': 0.8178408316147603, 'grow_policy': 'Lossguide', 'min_data_in_leaf': 92, 'max_leaves': 71}. Best is trial 472 with value: 2453.464132483589.[0m
[32m[I 2024-10-13 08:30:43,184][0m Trial 619 finished with value: 4556.414801660088 and parameters: {'depth': 9, 'learning_rate': 0.03270211445672887, 'iterations': 2615, 'l2_leaf_reg': 1.0841961052351561e-06, 'border_count': 33, 'bagging_temperature': 0.1676960511124057, 'random_strength': 0.6387053773187459, 'grow_policy': 'Lossguide', 'min_data_in_leaf': 43, 'max_leaves': 36}. Best is trial 472 with value: 2453.464132483589.[0m
[32m[I 2024-10-13 08:30:52,728][0m Trial 620 finished with value: 4572.444255459175 and parameters: {'depth': 6, 'learning_rate': 0.17873564010816448, 'iterations': 1236, 'l2_leaf_reg': 1.9158055253218018e-07, 'border_count': 42, 'bagging_temperature': 0.5180894348872078, 'random_strength': 0.9907275885679484, 'grow_policy': 'SymmetricTree', 'min_data_in_leaf': 66}. Best is trial 472 with value: 2453.464132483589.[0m
[32m[I 2024-10-13 08:30:57,724][0m Trial 621 finished with value: 5020.145641071405 and parameters: {'depth': 7, 'learning_rate': 0.2610499708346889, 'iterations': 2788, 'l2_leaf_reg': 6.820829177843363e-07, 'border_count': 49, 'bagging_temperature': 0.654241776707163, 'random_strength': 0.4136011947784084, 'grow_policy': 'Lossguide', 'min_data_in_leaf': 118, 'max_leaves': 61}. Best is trial 472 with value: 2453.464132483589.[0m
[32m[I 2024-10-13 08:31:02,233][0m Trial 622 finished with value: 3726.9669187011823 and parameters: {'depth': 8, 'learning_rate': 0.21674239519686786, 'iterations': 2550, 'l2_leaf_reg': 4.452291620172423e-07, 'border_count': 56, 'bagging_temperature': 0.5711489587932914, 'random_strength': 0.8067658784701524, 'grow_policy': 'Lossguide', 'min_data_in_leaf': 105, 'max_leaves': 44}. Best is trial 472 with value: 2453.464132483589.[0m
[32m[I 2024-10-13 08:31:07,376][0m Trial 623 finished with value: 6146.245169950376 and parameters: {'depth': 7, 'learning_rate': 0.2992703691727354, 'iterations': 2673, 'l2_leaf_reg': 1.1908888355758614e-06, 'border_count': 36, 'bagging_temperature': 0.6148261331874385, 'random_strength': 0.5965063862191446, 'grow_policy': 'Lossguide', 'min_data_in_leaf': 78, 'max_leaves': 50}. Best is trial 472 with value: 2453.464132483589.[0m
[32m[I 2024-10-13 08:31:10,760][0m Trial 624 finished with value: 3252.5629227262903 and parameters: {'depth': 7, 'learning_rate': 0.12268420816888499, 'iterations': 2417, 'l2_leaf_reg': 2.6407781270173585e-07, 'border_count': 46, 'bagging_temperature': 0.6758202038613905, 'random_strength': 1.24059284590742, 'grow_policy': 'Lossguide', 'min_data_in_leaf': 952, 'max_leaves': 39}. Best is trial 472 with value: 2453.464132483589.[0m
[32m[I 2024-10-13 08:31:16,009][0m Trial 625 finished with value: 4132.199149397711 and parameters: {'depth': 8, 'learning_rate': 0.17739444371933408, 'iterations': 2748, 'l2_leaf_reg': 1.3725828156650194e-06, 'border_count': 51, 'bagging_temperature': 0.4922719709795815, 'random_strength': 0.3284875476634601, 'grow_policy': 'Lossguide', 'min_data_in_leaf': 130, 'max_leaves': 48}. Best is trial 472 with value: 2453.464132483589.[0m
[32m[I 2024-10-13 08:31:28,769][0m Trial 626 finished with value: 4333.840830689831 and parameters: {'depth': 13, 'learning_rate': 0.0044559178190521015, 'iterations': 2468, 'l2_leaf_reg': 1.2738357183236321e-07, 'border_count': 43, 'bagging_temperature': 0.5524142502314294, 'random_strength': 0.9565989144661716, 'grow_policy': 'Depthwise', 'min_data_in_leaf': 22}. Best is trial 472 with value: 2453.464132483589.[0m
[32m[I 2024-10-13 08:31:33,889][0m Trial 627 finished with value: 6224.700531981751 and parameters: {'depth': 9, 'learning_rate': 0.22840014989314597, 'iterations': 2622, 'l2_leaf_reg': 9.175157332681607e-07, 'border_count': 39, 'bagging_temperature': 0.6419423971360264, 'random_strength': 1.4063255715248155, 'grow_policy': 'Lossguide', 'min_data_in_leaf': 98, 'max_leaves': 55}. Best is trial 472 with value: 2453.464132483589.[0m
[32m[I 2024-10-13 08:31:39,110][0m Trial 628 finished with value: 2726.5464119868857 and parameters: {'depth': 7, 'learning_rate': 0.19526039717161148, 'iterations': 2692, 'l2_leaf_reg': 0.00011179024951891865, 'border_count': 61, 'bagging_temperature': 0.587273426383814, 'random_strength': 0.5267257600104813, 'grow_policy': 'Lossguide', 'min_data_in_leaf': 62, 'max_leaves': 65}. Best is trial 472 with value: 2453.464132483589.[0m
[32m[I 2024-10-13 08:31:47,630][0m Trial 629 finished with value: 3387.6340865615493 and parameters: {'depth': 6, 'learning_rate': 0.14748300342712561, 'iterations': 2566, 'l2_leaf_reg': 0.00011838677847218999, 'border_count': 58, 'bagging_temperature': 0.5900693058665195, 'random_strength': 0.2511939728579303, 'grow_policy': 'Lossguide', 'min_data_in_leaf': 36, 'max_leaves': 65}. Best is trial 472 with value: 2453.464132483589.[0m
[32m[I 2024-10-13 08:31:54,058][0m Trial 630 finished with value: 4956.128130634923 and parameters: {'depth': 8, 'learning_rate': 0.1734871514691764, 'iterations': 2808, 'l2_leaf_reg': 0.000246423122131756, 'border_count': 67, 'bagging_temperature': 0.5788804917639858, 'random_strength': 0.46643000919796984, 'grow_policy': 'Lossguide', 'min_data_in_leaf': 48, 'max_leaves': 69}. Best is trial 472 with value: 2453.464132483589.[0m
[32m[I 2024-10-13 08:32:04,895][0m Trial 631 finished with value: 4985.777386557315 and parameters: {'depth': 7, 'learning_rate': 0.25641069751753404, 'iterations': 2671, 'l2_leaf_reg': 0.00012912868135840449, 'border_count': 54, 'bagging_temperature': 0.6033028187955314, 'random_strength': 0.390272473089573, 'grow_policy': 'Lossguide', 'min_data_in_leaf': 12, 'max_leaves': 36}. Best is trial 472 with value: 2453.464132483589.[0m
[32m[I 2024-10-13 08:32:09,608][0m Trial 632 finished with value: 4762.524463812258 and parameters: {'depth': 8, 'learning_rate': 0.10027197063098349, 'iterations': 2954, 'l2_leaf_reg': 0.0001053562357653458, 'border_count': 97, 'bagging_temperature': 0.6169689654480974, 'random_strength': 0.6179136166920548, 'grow_policy': 'Lossguide', 'min_data_in_leaf': 61, 'max_leaves': 31}. Best is trial 472 with value: 2453.464132483589.[0m
[32m[I 2024-10-13 08:32:13,754][0m Trial 633 finished with value: 2853.385015677203 and parameters: {'depth': 7, 'learning_rate': 0.20540626469195972, 'iterations': 2354, 'l2_leaf_reg': 7.28179282654595e-05, 'border_count': 60, 'bagging_temperature': 0.5731982949022373, 'random_strength': 0.19108145775132848, 'grow_policy': 'Lossguide', 'min_data_in_leaf': 69, 'max_leaves': 43}. Best is trial 472 with value: 2453.464132483589.[0m
[32m[I 2024-10-13 08:32:18,146][0m Trial 634 finished with value: 4577.771755708455 and parameters: {'depth': 7, 'learning_rate': 0.16407722288334145, 'iterations': 2837, 'l2_leaf_reg': 0.07911168632483388, 'border_count': 50, 'bagging_temperature': 0.5978021940449846, 'random_strength': 0.49520395899202846, 'grow_policy': 'Depthwise', 'min_data_in_leaf': 133}. Best is trial 472 with value: 2453.464132483589.[0m
[32m[I 2024-10-13 08:32:23,878][0m Trial 635 finished with value: 10922.436639309099 and parameters: {'depth': 7, 'learning_rate': 0.00043897711221051606, 'iterations': 2758, 'l2_leaf_reg': 0.00014854462193952158, 'border_count': 35, 'bagging_temperature': 0.8246458594617322, 'random_strength': 0.23284840661090078, 'grow_policy': 'Lossguide', 'min_data_in_leaf': 35, 'max_leaves': 64}. Best is trial 472 with value: 2453.464132483589.[0m
[32m[I 2024-10-13 08:32:28,402][0m Trial 636 finished with value: 5515.358676016298 and parameters: {'depth': 8, 'learning_rate': 0.2313769715935373, 'iterations': 2616, 'l2_leaf_reg': 0.00019464481586934078, 'border_count': 40, 'bagging_temperature': 0.6266111883025622, 'random_strength': 7.322459881905457, 'grow_policy': 'Lossguide', 'min_data_in_leaf': 113, 'max_leaves': 39}. Best is trial 472 with value: 2453.464132483589.[0m
[32m[I 2024-10-13 08:32:33,541][0m Trial 637 finished with value: 6023.601665836389 and parameters: {'depth': 8, 'learning_rate': 0.18798719531707234, 'iterations': 2702, 'l2_leaf_reg': 0.00036044323782794446, 'border_count': 30, 'bagging_temperature': 0.7313919532653059, 'random_strength': 0.728338813294428, 'grow_policy': 'Lossguide', 'min_data_in_leaf': 75, 'max_leaves': 82}. Best is trial 472 with value: 2453.464132483589.[0m
[32m[I 2024-10-13 08:32:39,122][0m Trial 638 finished with value: 3285.170761592653 and parameters: {'depth': 10, 'learning_rate': 0.26356201694948733, 'iterations': 2500, 'l2_leaf_reg': 7.831036779266903e-05, 'border_count': 47, 'bagging_temperature': 0.5633246924890677, 'random_strength': 2.932863771206891, 'grow_policy': 'Lossguide', 'min_data_in_leaf': 55, 'max_leaves': 46}. Best is trial 472 with value: 2453.464132483589.[0m
[32m[I 2024-10-13 08:32:42,924][0m Trial 639 finished with value: 3663.772862048388 and parameters: {'depth': 7, 'learning_rate': 0.13589735359530403, 'iterations': 2915, 'l2_leaf_reg': 0.005649297130736839, 'border_count': 55, 'bagging_temperature': 0.5921556773251493, 'random_strength': 1.0561138489339077, 'grow_policy': 'Lossguide', 'min_data_in_leaf': 145, 'max_leaves': 75}. Best is trial 472 with value: 2453.464132483589.[0m
[32m[I 2024-10-13 08:33:09,424][0m Trial 640 finished with value: 6499.949958993625 and parameters: {'depth': 9, 'learning_rate': 0.29718399928740036, 'iterations': 2567, 'l2_leaf_reg': 6.0603140854556184e-05, 'border_count': 71, 'bagging_temperature': 0.643830670049034, 'random_strength': 3.372499390638631, 'grow_policy': 'Lossguide', 'min_data_in_leaf': 1, 'max_leaves': 34}. Best is trial 472 with value: 2453.464132483589.[0m
[32m[I 2024-10-13 08:33:31,376][0m Trial 641 finished with value: 5149.055940822704 and parameters: {'depth': 6, 'learning_rate': 0.2053138717811524, 'iterations': 2782, 'l2_leaf_reg': 7.4791877806544825e-06, 'border_count': 50, 'bagging_temperature': 0.6106419541643359, 'random_strength': 0.4276881681429452, 'grow_policy': 'SymmetricTree', 'min_data_in_leaf': 95}. Best is trial 472 with value: 2453.464132483589.[0m
[32m[I 2024-10-13 08:33:36,051][0m Trial 642 finished with value: 3897.2570572385403 and parameters: {'depth': 7, 'learning_rate': 0.2359948292447184, 'iterations': 2660, 'l2_leaf_reg': 7.596469924154083e-08, 'border_count': 63, 'bagging_temperature': 0.5804399646412973, 'random_strength': 0.6072706426284616, 'grow_policy': 'Lossguide', 'min_data_in_leaf': 113, 'max_leaves': 138}. Best is trial 472 with value: 2453.464132483589.[0m
[32m[I 2024-10-13 08:33:40,732][0m Trial 643 finished with value: 2765.3679811707852 and parameters: {'depth': 8, 'learning_rate': 0.17096665837295036, 'iterations': 2847, 'l2_leaf_reg': 2.1939694398673576e-05, 'border_count': 43, 'bagging_temperature': 0.6592328032481589, 'random_strength': 0.8349968001881246, 'grow_policy': 'Lossguide', 'min_data_in_leaf': 82, 'max_leaves': 51}. Best is trial 472 with value: 2453.464132483589.[0m
[32m[I 2024-10-13 08:33:45,527][0m Trial 644 finished with value: 4580.607839968851 and parameters: {'depth': 7, 'learning_rate': 0.19479192774526335, 'iterations': 2725, 'l2_leaf_reg': 0.011868708043410682, 'border_count': 38, 'bagging_temperature': 0.7051642586960621, 'random_strength': 0.2576686855323959, 'grow_policy': 'Depthwise', 'min_data_in_leaf': 134}. Best is trial 472 with value: 2453.464132483589.[0m
[32m[I 2024-10-13 08:33:48,900][0m Trial 645 finished with value: 2820.8922812503597 and parameters: {'depth': 6, 'learning_rate': 0.24975829336476507, 'iterations': 2993, 'l2_leaf_reg': 0.00010948683193544136, 'border_count': 48, 'bagging_temperature': 0.6269866499469096, 'random_strength': 0.3758820651523488, 'grow_policy': 'Lossguide', 'min_data_in_leaf': 156, 'max_leaves': 43}. Best is trial 472 with value: 2453.464132483589.[0m
[32m[I 2024-10-13 08:33:52,242][0m Trial 646 finished with value: 8690.82297479014 and parameters: {'depth': 5, 'learning_rate': 0.29906169063184007, 'iterations': 2257, 'l2_leaf_reg': 0.26227036042806, 'border_count': 22, 'bagging_temperature': 0.5611633563814618, 'random_strength': 0.6228879374557578, 'grow_policy': 'Lossguide', 'min_data_in_leaf': 63, 'max_leaves': 61}. Best is trial 472 with value: 2453.464132483589.[0m
[32m[I 2024-10-13 08:33:55,979][0m Trial 647 finished with value: 4031.252871844873 and parameters: {'depth': 14, 'learning_rate': 0.1447300068415077, 'iterations': 2432, 'l2_leaf_reg': 4.9062831911818424e-05, 'border_count': 54, 'bagging_temperature': 0.6056180997332011, 'random_strength': 1.1523149701521769, 'grow_policy': 'Lossguide', 'min_data_in_leaf': 103, 'max_leaves': 38}. Best is trial 472 with value: 2453.464132483589.[0m
[32m[I 2024-10-13 08:34:01,617][0m Trial 648 finished with value: 5262.958126046061 and parameters: {'depth': 7, 'learning_rate': 0.2219514432467253, 'iterations': 2902, 'l2_leaf_reg': 0.0030599106287764665, 'border_count': 34, 'bagging_temperature': 0.5487057481389838, 'random_strength': 0.15048683695420983, 'grow_policy': 'Lossguide', 'min_data_in_leaf': 83, 'max_leaves': 187}. Best is trial 472 with value: 2453.464132483589.[0m
[32m[I 2024-10-13 08:34:06,166][0m Trial 649 finished with value: 3219.223333936312 and parameters: {'depth': 8, 'learning_rate': 0.19504813172295143, 'iterations': 2601, 'l2_leaf_reg': 1.9906483165092044e-06, 'border_count': 45, 'bagging_temperature': 0.6742806505309825, 'random_strength': 0.8814701992753362, 'grow_policy': 'Lossguide', 'min_data_in_leaf': 121, 'max_leaves': 217}. Best is trial 472 with value: 2453.464132483589.[0m
[32m[I 2024-10-13 08:34:15,800][0m Trial 650 finished with value: 3777.988899422901 and parameters: {'depth': 7, 'learning_rate': 0.2586755054473086, 'iterations': 2822, 'l2_leaf_reg': 0.00033292806281612526, 'border_count': 41, 'bagging_temperature': 0.5841013966403843, 'random_strength': 1.360618396747408, 'grow_policy': 'Lossguide', 'min_data_in_leaf': 34, 'max_leaves': 231}. Best is trial 472 with value: 2453.464132483589.[0m
[32m[I 2024-10-13 08:34:19,521][0m Trial 651 finished with value: 8037.8273163034855 and parameters: {'depth': 9, 'learning_rate': 0.1616426754974316, 'iterations': 2750, 'l2_leaf_reg': 0.00017446194971167738, 'border_count': 28, 'bagging_temperature': 0.6445583645459296, 'random_strength': 0.543992169584365, 'grow_policy': 'Lossguide', 'min_data_in_leaf': 147, 'max_leaves': 53}. Best is trial 472 with value: 2453.464132483589.[0m
