[32m[I 2024-10-13 07:39:20,545][0m Trial 51 finished with value: 4155.8701980717915 and parameters: {'depth': 10, 'learning_rate': 0.024315106840837507, 'iterations': 2178, 'l2_leaf_reg': 8.601274913282605, 'border_count': 49, 'bagging_temperature': 0.7176092029217154, 'random_strength': 8.763869292967044, 'grow_policy': 'Lossguide', 'min_data_in_leaf': 527, 'max_leaves': 147}. Best is trial 7 with value: 3064.1480611469387.[0m
[32m[I 2024-10-13 07:39:22,654][0m Trial 52 finished with value: 4921.383778565255 and parameters: {'depth': 9, 'learning_rate': 0.033715541657964386, 'iterations': 2116, 'l2_leaf_reg': 7.654333205939504, 'border_count': 24, 'bagging_temperature': 0.5628919211784726, 'random_strength': 9.802922618283647, 'grow_policy': 'Lossguide', 'min_data_in_leaf': 527, 'max_leaves': 128}. Best is trial 7 with value: 3064.1480611469387.[0m
[32m[I 2024-10-13 07:39:25,032][0m Trial 53 finished with value: 5005.449304956011 and parameters: {'depth': 8, 'learning_rate': 0.06258326041470652, 'iterations': 2428, 'l2_leaf_reg': 1.5426388478169089, 'border_count': 69, 'bagging_temperature': 0.6750102365240916, 'random_strength': 9.462219857057375, 'grow_policy': 'Lossguide', 'min_data_in_leaf': 546, 'max_leaves': 172}. Best is trial 7 with value: 3064.1480611469387.[0m
[32m[I 2024-10-13 07:39:26,819][0m Trial 54 finished with value: 5570.711088065229 and parameters: {'depth': 10, 'learning_rate': 0.015650447201502132, 'iterations': 1662, 'l2_leaf_reg': 9.850083817086242, 'border_count': 84, 'bagging_temperature': 0.7136967267012765, 'random_strength': 8.978093513556646, 'grow_policy': 'Lossguide', 'min_data_in_leaf': 667, 'max_leaves': 137}. Best is trial 7 with value: 3064.1480611469387.[0m
[32m[I 2024-10-13 07:39:28,780][0m Trial 55 finished with value: 3437.663425118719 and parameters: {'depth': 12, 'learning_rate': 0.13389779799478843, 'iterations': 1934, 'l2_leaf_reg': 0.9054358231862962, 'border_count': 43, 'bagging_temperature': 0.5107609491151277, 'random_strength': 8.282238138804011, 'grow_policy': 'Lossguide', 'min_data_in_leaf': 461, 'max_leaves': 164}. Best is trial 7 with value: 3064.1480611469387.[0m
[32m[I 2024-10-13 07:39:30,706][0m Trial 56 finished with value: 5277.355316288318 and parameters: {'depth': 12, 'learning_rate': 0.11986970770598018, 'iterations': 1995, 'l2_leaf_reg': 0.013638829915786178, 'border_count': 30, 'bagging_temperature': 0.5025236939506587, 'random_strength': 8.159115989530779, 'grow_policy': 'Lossguide', 'min_data_in_leaf': 322, 'max_leaves': 192}. Best is trial 7 with value: 3064.1480611469387.[0m
[32m[I 2024-10-13 07:39:32,616][0m Trial 57 finished with value: 3823.0630054807507 and parameters: {'depth': 15, 'learning_rate': 0.13736894047552725, 'iterations': 1915, 'l2_leaf_reg': 0.31906709366124997, 'border_count': 56, 'bagging_temperature': 0.3607445247022425, 'random_strength': 6.816946624837429, 'grow_policy': 'Lossguide', 'min_data_in_leaf': 460, 'max_leaves': 164}. Best is trial 7 with value: 3064.1480611469387.[0m
[32m[I 2024-10-13 07:39:34,499][0m Trial 58 finished with value: 6772.238319721588 and parameters: {'depth': 15, 'learning_rate': 0.23019733085741073, 'iterations': 1887, 'l2_leaf_reg': 0.3277723613144075, 'border_count': 9, 'bagging_temperature': 0.35886187788601137, 'random_strength': 6.266993479480088, 'grow_policy': 'Lossguide', 'min_data_in_leaf': 413, 'max_leaves': 163}. Best is trial 7 with value: 3064.1480611469387.[0m
[32m[I 2024-10-13 07:39:36,298][0m Trial 59 finished with value: 3811.8974637801907 and parameters: {'depth': 14, 'learning_rate': 0.13602763805557758, 'iterations': 1737, 'l2_leaf_reg': 0.06531489724416528, 'border_count': 58, 'bagging_temperature': 0.25645927006509717, 'random_strength': 6.879869131382096, 'grow_policy': 'Lossguide', 'min_data_in_leaf': 206, 'max_leaves': 200}. Best is trial 7 with value: 3064.1480611469387.[0m
[32m[I 2024-10-13 07:40:22,474][0m Trial 60 finished with value: 5126.99051917998 and parameters: {'depth': 14, 'learning_rate': 0.12902516015916668, 'iterations': 1692, 'l2_leaf_reg': 0.05314472599577091, 'border_count': 96, 'bagging_temperature': 0.23993269224701072, 'random_strength': 6.79677581090878, 'grow_policy': 'SymmetricTree', 'min_data_in_leaf': 48}. Best is trial 7 with value: 3064.1480611469387.[0m
[32m[I 2024-10-13 07:40:24,337][0m Trial 61 finished with value: 4068.3685631466096 and parameters: {'depth': 15, 'learning_rate': 0.15506199082546893, 'iterations': 1822, 'l2_leaf_reg': 0.9474534876686482, 'border_count': 60, 'bagging_temperature': 0.34927468671138656, 'random_strength': 7.055525618388127, 'grow_policy': 'Lossguide', 'min_data_in_leaf': 153, 'max_leaves': 213}. Best is trial 7 with value: 3064.1480611469387.[0m
[32m[I 2024-10-13 07:40:26,280][0m Trial 62 finished with value: 4005.895207770807 and parameters: {'depth': 14, 'learning_rate': 0.22800483294797713, 'iterations': 1977, 'l2_leaf_reg': 0.1328103515638829, 'border_count': 42, 'bagging_temperature': 0.21861951661725293, 'random_strength': 6.25051758927944, 'grow_policy': 'Lossguide', 'min_data_in_leaf': 214, 'max_leaves': 189}. Best is trial 7 with value: 3064.1480611469387.[0m
[32m[I 2024-10-13 07:40:28,020][0m Trial 63 finished with value: 5120.413706617824 and parameters: {'depth': 13, 'learning_rate': 0.08323673972064273, 'iterations': 1596, 'l2_leaf_reg': 0.00011180872071013531, 'border_count': 71, 'bagging_temperature': 0.40084923697713365, 'random_strength': 7.659399658701881, 'grow_policy': 'Lossguide', 'min_data_in_leaf': 468, 'max_leaves': 208}. Best is trial 7 with value: 3064.1480611469387.[0m
[32m[I 2024-10-13 07:40:29,720][0m Trial 64 finished with value: 3897.442699791004 and parameters: {'depth': 15, 'learning_rate': 0.10616272861968333, 'iterations': 1516, 'l2_leaf_reg': 2.1544670999731754, 'border_count': 55, 'bagging_temperature': 0.2581433623519284, 'random_strength': 7.296880229747898, 'grow_policy': 'Lossguide', 'min_data_in_leaf': 371, 'max_leaves': 243}. Best is trial 7 with value: 3064.1480611469387.[0m
[32m[I 2024-10-13 07:40:31,093][0m Trial 65 finished with value: 5953.537550748892 and parameters: {'depth': 15, 'learning_rate': 0.11209157061696234, 'iterations': 1091, 'l2_leaf_reg': 0.005378789250172427, 'border_count': 24, 'bagging_temperature': 0.16262745109141358, 'random_strength': 6.548248552691525, 'grow_policy': 'Lossguide', 'min_data_in_leaf': 296, 'max_leaves': 242}. Best is trial 7 with value: 3064.1480611469387.[0m
[32m[I 2024-10-13 07:40:32,880][0m Trial 66 finished with value: 4164.163529754568 and parameters: {'depth': 14, 'learning_rate': 0.15085656657975063, 'iterations': 1447, 'l2_leaf_reg': 2.553985719218149, 'border_count': 40, 'bagging_temperature': 0.2784655442761553, 'random_strength': 5.286331238808812, 'grow_policy': 'Depthwise', 'min_data_in_leaf': 348}. Best is trial 7 with value: 3064.1480611469387.[0m
[32m[I 2024-10-13 07:40:34,900][0m Trial 67 finished with value: 4684.027645059015 and parameters: {'depth': 15, 'learning_rate': 0.09530946718853336, 'iterations': 1350, 'l2_leaf_reg': 0.48672787904702075, 'border_count': 79, 'bagging_temperature': 0.2662957882057126, 'random_strength': 7.3157061491621675, 'grow_policy': 'Lossguide', 'min_data_in_leaf': 59, 'max_leaves': 222}. Best is trial 7 with value: 3064.1480611469387.[0m
[32m[I 2024-10-13 07:40:36,708][0m Trial 68 finished with value: 4310.475416825709 and parameters: {'depth': 13, 'learning_rate': 0.2935104874842596, 'iterations': 1768, 'l2_leaf_reg': 0.025759422201989426, 'border_count': 55, 'bagging_temperature': 0.3270412141050305, 'random_strength': 8.44245937570272, 'grow_policy': 'Lossguide', 'min_data_in_leaf': 424, 'max_leaves': 225}. Best is trial 7 with value: 3064.1480611469387.[0m
[32m[I 2024-10-13 07:40:38,382][0m Trial 69 finished with value: 5392.446196523037 and parameters: {'depth': 14, 'learning_rate': 0.06805388074132812, 'iterations': 1561, 'l2_leaf_reg': 0.2499692787807103, 'border_count': 66, 'bagging_temperature': 0.045566717385387895, 'random_strength': 5.924756349019782, 'grow_policy': 'Lossguide', 'min_data_in_leaf': 207, 'max_leaves': 31}. Best is trial 7 with value: 3064.1480611469387.[0m
[32m[I 2024-10-13 07:40:39,227][0m Trial 70 finished with value: 29198.895789928323 and parameters: {'depth': 15, 'learning_rate': 0.000187001152602245, 'iterations': 407, 'l2_leaf_reg': 0.0007495087804350528, 'border_count': 74, 'bagging_temperature': 0.18460751835916403, 'random_strength': 6.875327310062628, 'grow_policy': 'Lossguide', 'min_data_in_leaf': 143, 'max_leaves': 202}. Best is trial 7 with value: 3064.1480611469387.[0m
[32m[I 2024-10-13 07:40:41,337][0m Trial 71 finished with value: 3904.341122708852 and parameters: {'depth': 14, 'learning_rate': 0.1710535159114727, 'iterations': 2117, 'l2_leaf_reg': 1.6982783948176123, 'border_count': 53, 'bagging_temperature': 0.5332071314508624, 'random_strength': 7.929622645852763, 'grow_policy': 'Lossguide', 'min_data_in_leaf': 451, 'max_leaves': 167}. Best is trial 7 with value: 3064.1480611469387.[0m
[32m[I 2024-10-13 07:40:43,279][0m Trial 72 finished with value: 3162.337159241862 and parameters: {'depth': 14, 'learning_rate': 0.18570288838178048, 'iterations': 1933, 'l2_leaf_reg': 4.837275513075979, 'border_count': 45, 'bagging_temperature': 0.5345386677398268, 'random_strength': 8.022643337570056, 'grow_policy': 'Lossguide', 'min_data_in_leaf': 381, 'max_leaves': 175}. Best is trial 7 with value: 3064.1480611469387.[0m
[32m[I 2024-10-13 07:40:45,154][0m Trial 73 finished with value: 4583.565572789405 and parameters: {'depth': 15, 'learning_rate': 0.20140451265501214, 'iterations': 1915, 'l2_leaf_reg': 4.216013205836358, 'border_count': 34, 'bagging_temperature': 0.10644180990089075, 'random_strength': 5.509508867765458, 'grow_policy': 'Lossguide', 'min_data_in_leaf': 383, 'max_leaves': 180}. Best is trial 7 with value: 3064.1480611469387.[0m
[32m[I 2024-10-13 07:40:46,922][0m Trial 74 finished with value: 3403.6953072165416 and parameters: {'depth': 12, 'learning_rate': 0.1310942915573611, 'iterations': 1687, 'l2_leaf_reg': 0.7590040908078668, 'border_count': 45, 'bagging_temperature': 0.4561937689029373, 'random_strength': 7.375929992767569, 'grow_policy': 'Lossguide', 'min_data_in_leaf': 254, 'max_leaves': 185}. Best is trial 7 with value: 3064.1480611469387.[0m
[32m[I 2024-10-13 07:40:48,713][0m Trial 75 finished with value: 3356.4161287151737 and parameters: {'depth': 12, 'learning_rate': 0.1323304228920206, 'iterations': 1704, 'l2_leaf_reg': 0.8840774552648515, 'border_count': 44, 'bagging_temperature': 0.4626449157214447, 'random_strength': 3.4114123622129315, 'grow_policy': 'Lossguide', 'min_data_in_leaf': 261, 'max_leaves': 185}. Best is trial 7 with value: 3064.1480611469387.[0m
[32m[I 2024-10-13 07:40:50,523][0m Trial 76 finished with value: 3264.0195308808848 and parameters: {'depth': 12, 'learning_rate': 0.24209097368582347, 'iterations': 1720, 'l2_leaf_reg': 0.8033552200898262, 'border_count': 43, 'bagging_temperature': 0.44967156673392616, 'random_strength': 3.512931250856886, 'grow_policy': 'Lossguide', 'min_data_in_leaf': 249, 'max_leaves': 201}. Best is trial 7 with value: 3064.1480611469387.[0m
[32m[I 2024-10-13 07:40:52,012][0m Trial 77 finished with value: 5422.506372704026 and parameters: {'depth': 12, 'learning_rate': 0.23314448270591132, 'iterations': 1290, 'l2_leaf_reg': 0.07378961449501201, 'border_count': 20, 'bagging_temperature': 0.4599198740632509, 'random_strength': 3.328118325739951, 'grow_policy': 'Lossguide', 'min_data_in_leaf': 188, 'max_leaves': 185}. Best is trial 7 with value: 3064.1480611469387.[0m
[32m[I 2024-10-13 07:40:53,866][0m Trial 78 finished with value: 5390.731161406653 and parameters: {'depth': 13, 'learning_rate': 0.13599856055248916, 'iterations': 1727, 'l2_leaf_reg': 0.7694382717569387, 'border_count': 156, 'bagging_temperature': 0.43156904836947324, 'random_strength': 3.877469820460043, 'grow_policy': 'Lossguide', 'min_data_in_leaf': 267, 'max_leaves': 198}. Best is trial 7 with value: 3064.1480611469387.[0m
[32m[I 2024-10-13 07:40:55,661][0m Trial 79 finished with value: 7433.271061963123 and parameters: {'depth': 12, 'learning_rate': 0.18502649257269002, 'iterations': 1636, 'l2_leaf_reg': 0.16996607078932977, 'border_count': 8, 'bagging_temperature': 0.3960661623434819, 'random_strength': 2.9138747017261717, 'grow_policy': 'Depthwise', 'min_data_in_leaf': 247}. Best is trial 7 with value: 3064.1480611469387.[0m
[32m[I 2024-10-13 07:42:31,687][0m Trial 80 finished with value: 6874.323194771121 and parameters: {'depth': 13, 'learning_rate': 0.275606288052265, 'iterations': 1798, 'l2_leaf_reg': 0.3739415497275539, 'border_count': 32, 'bagging_temperature': 0.48119855537879863, 'random_strength': 3.398957452719057, 'grow_policy': 'SymmetricTree', 'min_data_in_leaf': 281}. Best is trial 7 with value: 3064.1480611469387.[0m
[32m[I 2024-10-13 07:42:33,616][0m Trial 81 finished with value: 2867.3734371536007 and parameters: {'depth': 11, 'learning_rate': 0.13710487731024368, 'iterations': 2016, 'l2_leaf_reg': 1.069537033020179, 'border_count': 44, 'bagging_temperature': 0.5116426364865335, 'random_strength': 4.508847154934621, 'grow_policy': 'Lossguide', 'min_data_in_leaf': 102, 'max_leaves': 182}. Best is trial 81 with value: 2867.3734371536007.[0m
[32m[I 2024-10-13 07:42:35,665][0m Trial 82 finished with value: 3435.4750465362395 and parameters: {'depth': 12, 'learning_rate': 0.12591904290352177, 'iterations': 2015, 'l2_leaf_reg': 0.9567394305785607, 'border_count': 47, 'bagging_temperature': 0.5154895447655977, 'random_strength': 4.56302998804372, 'grow_policy': 'Lossguide', 'min_data_in_leaf': 306, 'max_leaves': 181}. Best is trial 81 with value: 2867.3734371536007.[0m
[32m[I 2024-10-13 07:42:37,490][0m Trial 83 finished with value: 3509.845064449645 and parameters: {'depth': 11, 'learning_rate': 0.07960499835357264, 'iterations': 1708, 'l2_leaf_reg': 0.9242224708592455, 'border_count': 43, 'bagging_temperature': 0.5154269323996514, 'random_strength': 4.720915089372762, 'grow_policy': 'Lossguide', 'min_data_in_leaf': 126, 'max_leaves': 183}. Best is trial 81 with value: 2867.3734371536007.[0m
[32m[I 2024-10-13 07:42:39,534][0m Trial 84 finished with value: 4628.84144458344 and parameters: {'depth': 11, 'learning_rate': 0.07500993360869675, 'iterations': 2006, 'l2_leaf_reg': 0.9211359831148194, 'border_count': 41, 'bagging_temperature': 0.5156849206500146, 'random_strength': 4.16622987062824, 'grow_policy': 'Lossguide', 'min_data_in_leaf': 106, 'max_leaves': 183}. Best is trial 81 with value: 2867.3734371536007.[0m
[32m[I 2024-10-13 07:42:45,305][0m Trial 85 finished with value: 5166.840975082082 and parameters: {'depth': 12, 'learning_rate': 0.18055051713219145, 'iterations': 1490, 'l2_leaf_reg': 4.338178111878026e-06, 'border_count': 45, 'bagging_temperature': 0.47617596739186274, 'random_strength': 4.71835164364879, 'grow_policy': 'Lossguide', 'min_data_in_leaf': 13, 'max_leaves': 173}. Best is trial 81 with value: 2867.3734371536007.[0m
[32m[I 2024-10-13 07:42:47,151][0m Trial 86 finished with value: 4351.073117939404 and parameters: {'depth': 11, 'learning_rate': 0.08823676423585931, 'iterations': 1820, 'l2_leaf_reg': 0.5731250986042413, 'border_count': 20, 'bagging_temperature': 0.4458493967747866, 'random_strength': 2.19467376815017, 'grow_policy': 'Lossguide', 'min_data_in_leaf': 305, 'max_leaves': 175}. Best is trial 81 with value: 2867.3734371536007.[0m
[32m[I 2024-10-13 07:42:49,212][0m Trial 87 finished with value: 5021.625163290391 and parameters: {'depth': 12, 'learning_rate': 0.052763333461400365, 'iterations': 2065, 'l2_leaf_reg': 1.1692565016287892, 'border_count': 30, 'bagging_temperature': 0.5945284453729154, 'random_strength': 3.680085019632908, 'grow_policy': 'Lossguide', 'min_data_in_leaf': 132, 'max_leaves': 192}. Best is trial 81 with value: 2867.3734371536007.[0m
[32m[I 2024-10-13 07:42:51,225][0m Trial 88 finished with value: 4396.510423389668 and parameters: {'depth': 11, 'learning_rate': 0.21745687808117312, 'iterations': 1675, 'l2_leaf_reg': 5.021352337740641, 'border_count': 38, 'bagging_temperature': 0.539198266458548, 'random_strength': 4.7723609099239965, 'grow_policy': 'Lossguide', 'min_data_in_leaf': 79, 'max_leaves': 211}. Best is trial 81 with value: 2867.3734371536007.[0m
[32m[I 2024-10-13 07:42:53,196][0m Trial 89 finished with value: 5347.885122426839 and parameters: {'depth': 11, 'learning_rate': 0.10755257043936517, 'iterations': 1947, 'l2_leaf_reg': 0.1305488393860731, 'border_count': 246, 'bagging_temperature': 0.5106616120632165, 'random_strength': 4.234414316418983, 'grow_policy': 'Lossguide', 'min_data_in_leaf': 240, 'max_leaves': 154}. Best is trial 81 with value: 2867.3734371536007.[0m
[32m[I 2024-10-13 07:42:55,096][0m Trial 90 finished with value: 5638.413900091517 and parameters: {'depth': 12, 'learning_rate': 0.2558050754926705, 'iterations': 1875, 'l2_leaf_reg': 2.4670643942314756, 'border_count': 22, 'bagging_temperature': 0.5563934088598155, 'random_strength': 4.4309408104781856, 'grow_policy': 'Lossguide', 'min_data_in_leaf': 178, 'max_leaves': 184}. Best is trial 81 with value: 2867.3734371536007.[0m
[32m[I 2024-10-13 07:42:56,887][0m Trial 91 finished with value: 4471.910552920596 and parameters: {'depth': 13, 'learning_rate': 0.12279234785310338, 'iterations': 1754, 'l2_leaf_reg': 0.222990063256205, 'border_count': 63, 'bagging_temperature': 0.4683248072190795, 'random_strength': 2.816136646871861, 'grow_policy': 'Lossguide', 'min_data_in_leaf': 121, 'max_leaves': 201}. Best is trial 81 with value: 2867.3734371536007.[0m
[32m[I 2024-10-13 07:42:58,588][0m Trial 92 finished with value: 3492.0485333346187 and parameters: {'depth': 12, 'learning_rate': 0.15515578324160303, 'iterations': 1571, 'l2_leaf_reg': 0.7153348526213814, 'border_count': 46, 'bagging_temperature': 0.41877705579936214, 'random_strength': 3.6807418813086215, 'grow_policy': 'Lossguide', 'min_data_in_leaf': 196, 'max_leaves': 198}. Best is trial 81 with value: 2867.3734371536007.[0m
[32m[I 2024-10-13 07:43:01,891][0m Trial 93 finished with value: 8939.025227418831 and parameters: {'depth': 12, 'learning_rate': 0.1611599640810333, 'iterations': 1596, 'l2_leaf_reg': 0.6096398265723282, 'border_count': 28, 'bagging_temperature': 0.4233389212116884, 'random_strength': 3.672593384336472, 'grow_policy': 'Lossguide', 'min_data_in_leaf': 32, 'max_leaves': 195}. Best is trial 81 with value: 2867.3734371536007.[0m
[32m[I 2024-10-13 07:43:03,513][0m Trial 94 finished with value: 3280.8250659862088 and parameters: {'depth': 12, 'learning_rate': 0.17656724166308269, 'iterations': 1465, 'l2_leaf_reg': 1.2370652050564643, 'border_count': 43, 'bagging_temperature': 0.4993579446867453, 'random_strength': 4.581317187156857, 'grow_policy': 'Lossguide', 'min_data_in_leaf': 324, 'max_leaves': 170}. Best is trial 81 with value: 2867.3734371536007.[0m
[32m[I 2024-10-13 07:43:05,121][0m Trial 95 finished with value: 6984.394884077233 and parameters: {'depth': 12, 'learning_rate': 0.0033260192139263354, 'iterations': 1386, 'l2_leaf_reg': 3.6975583869584687, 'border_count': 49, 'bagging_temperature': 0.4928300235060685, 'random_strength': 3.013789342413534, 'grow_policy': 'Lossguide', 'min_data_in_leaf': 331, 'max_leaves': 168}. Best is trial 81 with value: 2867.3734371536007.[0m
[32m[I 2024-10-13 07:43:06,455][0m Trial 96 finished with value: 4723.750302744755 and parameters: {'depth': 13, 'learning_rate': 0.1987720939406925, 'iterations': 1092, 'l2_leaf_reg': 1.2677951496656357, 'border_count': 35, 'bagging_temperature': 0.3809577634459582, 'random_strength': 5.091969093131333, 'grow_policy': 'Lossguide', 'min_data_in_leaf': 308, 'max_leaves': 160}. Best is trial 81 with value: 2867.3734371536007.[0m
[32m[I 2024-10-13 07:44:30,262][0m Trial 97 finished with value: 5894.500408135943 and parameters: {'depth': 13, 'learning_rate': 0.2980907187224956, 'iterations': 1462, 'l2_leaf_reg': 1.9130532795904782, 'border_count': 188, 'bagging_temperature': 0.6231321973309107, 'random_strength': 2.380050048363631, 'grow_policy': 'SymmetricTree', 'min_data_in_leaf': 355}. Best is trial 81 with value: 2867.3734371536007.[0m
[32m[I 2024-10-13 07:44:33,096][0m Trial 98 finished with value: 3538.876920492853 and parameters: {'depth': 12, 'learning_rate': 0.15630548811173842, 'iterations': 1335, 'l2_leaf_reg': 0.44120125898546186, 'border_count': 48, 'bagging_temperature': 0.4363872430124282, 'random_strength': 3.909609639296402, 'grow_policy': 'Lossguide', 'min_data_in_leaf': 256, 'max_leaves': 177}. Best is trial 81 with value: 2867.3734371536007.[0m
[32m[I 2024-10-13 07:44:36,292][0m Trial 99 finished with value: 6779.822639113103 and parameters: {'depth': 13, 'learning_rate': 0.2526368234103677, 'iterations': 1562, 'l2_leaf_reg': 0.02412567183505466, 'border_count': 13, 'bagging_temperature': 0.5686723714393529, 'random_strength': 4.4572938872494845, 'grow_policy': 'Depthwise', 'min_data_in_leaf': 192}. Best is trial 81 with value: 2867.3734371536007.[0m
[32m[I 2024-10-13 07:44:39,055][0m Trial 100 finished with value: 4319.259884109152 and parameters: {'depth': 12, 'learning_rate': 0.09998838853668274, 'iterations': 1211, 'l2_leaf_reg': 0.09518725684638916, 'border_count': 63, 'bagging_temperature': 0.5425248241582117, 'random_strength': 3.584902292891203, 'grow_policy': 'Lossguide', 'min_data_in_leaf': 285, 'max_leaves': 190}. Best is trial 81 with value: 2867.3734371536007.[0m
