[32m[I 2024-10-13 07:49:29,536][0m Trial 151 finished with value: 3242.210089578379 and parameters: {'depth': 12, 'learning_rate': 0.17511353146105632, 'iterations': 1403, 'l2_leaf_reg': 9.355484258338873, 'border_count': 51, 'bagging_temperature': 0.6655666264807518, 'random_strength': 4.573174992583588, 'grow_policy': 'Lossguide', 'min_data_in_leaf': 56, 'max_leaves': 150}. Best is trial 144 with value: 2690.2497230447584.[0m
[32m[I 2024-10-13 07:49:31,799][0m Trial 152 finished with value: 3320.2981326303016 and parameters: {'depth': 12, 'learning_rate': 0.17162228691122197, 'iterations': 1475, 'l2_leaf_reg': 7.968683586947161, 'border_count': 50, 'bagging_temperature': 0.6574635234577019, 'random_strength': 4.575390359185939, 'grow_policy': 'Lossguide', 'min_data_in_leaf': 50, 'max_leaves': 141}. Best is trial 144 with value: 2690.2497230447584.[0m
[32m[I 2024-10-13 07:49:33,497][0m Trial 153 finished with value: 4285.20552208512 and parameters: {'depth': 12, 'learning_rate': 0.2525563283328991, 'iterations': 1270, 'l2_leaf_reg': 9.10083531251393, 'border_count': 69, 'bagging_temperature': 0.6123609045166261, 'random_strength': 4.4380464763336285, 'grow_policy': 'Lossguide', 'min_data_in_leaf': 79, 'max_leaves': 154}. Best is trial 144 with value: 2690.2497230447584.[0m
[32m[I 2024-10-13 07:49:36,017][0m Trial 154 finished with value: 3525.812424796745 and parameters: {'depth': 13, 'learning_rate': 0.2078166529281122, 'iterations': 1370, 'l2_leaf_reg': 3.184282727642565, 'border_count': 64, 'bagging_temperature': 0.6404463143644252, 'random_strength': 4.278519078543613, 'grow_policy': 'Lossguide', 'min_data_in_leaf': 31, 'max_leaves': 145}. Best is trial 144 with value: 2690.2497230447584.[0m
[32m[I 2024-10-13 07:49:38,137][0m Trial 155 finished with value: 3162.5606050553024 and parameters: {'depth': 12, 'learning_rate': 0.17355508434411207, 'iterations': 1590, 'l2_leaf_reg': 4.417403268648623, 'border_count': 55, 'bagging_temperature': 0.6285029047517366, 'random_strength': 4.894102125688429, 'grow_policy': 'Lossguide', 'min_data_in_leaf': 62, 'max_leaves': 164}. Best is trial 144 with value: 2690.2497230447584.[0m
[32m[I 2024-10-13 07:49:40,185][0m Trial 156 finished with value: 3040.373672359653 and parameters: {'depth': 12, 'learning_rate': 0.2593410813349063, 'iterations': 1538, 'l2_leaf_reg': 5.048935140788746, 'border_count': 56, 'bagging_temperature': 0.7059956965018035, 'random_strength': 4.813708136816338, 'grow_policy': 'Lossguide', 'min_data_in_leaf': 62, 'max_leaves': 163}. Best is trial 144 with value: 2690.2497230447584.[0m
[32m[I 2024-10-13 07:49:42,137][0m Trial 157 finished with value: 3016.9850188634273 and parameters: {'depth': 12, 'learning_rate': 0.26430806517895716, 'iterations': 1552, 'l2_leaf_reg': 5.495287687935318, 'border_count': 56, 'bagging_temperature': 0.679731893303698, 'random_strength': 4.813165622911883, 'grow_policy': 'Lossguide', 'min_data_in_leaf': 64, 'max_leaves': 150}. Best is trial 144 with value: 2690.2497230447584.[0m
[32m[I 2024-10-13 07:49:44,124][0m Trial 158 finished with value: 3309.543750580347 and parameters: {'depth': 13, 'learning_rate': 0.2945614805787277, 'iterations': 1419, 'l2_leaf_reg': 9.661567590521937, 'border_count': 57, 'bagging_temperature': 0.7004270426603811, 'random_strength': 4.862751181848875, 'grow_policy': 'Lossguide', 'min_data_in_leaf': 54, 'max_leaves': 164}. Best is trial 144 with value: 2690.2497230447584.[0m
[32m[I 2024-10-13 07:49:57,751][0m Trial 159 finished with value: 5232.4059435708095 and parameters: {'depth': 12, 'learning_rate': 0.2575650626338862, 'iterations': 1561, 'l2_leaf_reg': 5.60205051162493, 'border_count': 77, 'bagging_temperature': 0.6757752451982364, 'random_strength': 5.373287389242161, 'grow_policy': 'Lossguide', 'min_data_in_leaf': 4, 'max_leaves': 151}. Best is trial 144 with value: 2690.2497230447584.[0m
[32m[I 2024-10-13 07:49:59,588][0m Trial 160 finished with value: 4880.343529259075 and parameters: {'depth': 13, 'learning_rate': 0.21659441756876993, 'iterations': 1329, 'l2_leaf_reg': 3.743672712201736, 'border_count': 70, 'bagging_temperature': 0.6668304441847039, 'random_strength': 4.785839314491586, 'grow_policy': 'Lossguide', 'min_data_in_leaf': 64, 'max_leaves': 152}. Best is trial 144 with value: 2690.2497230447584.[0m
[32m[I 2024-10-13 07:50:01,098][0m Trial 161 finished with value: 4100.7624851768915 and parameters: {'depth': 12, 'learning_rate': 0.2545313702664534, 'iterations': 1209, 'l2_leaf_reg': 4.308312098300678, 'border_count': 57, 'bagging_temperature': 0.6256019947487677, 'random_strength': 4.673611464668663, 'grow_policy': 'Lossguide', 'min_data_in_leaf': 101, 'max_leaves': 162}. Best is trial 144 with value: 2690.2497230447584.[0m
[32m[I 2024-10-13 07:50:04,020][0m Trial 162 finished with value: 3557.051732413243 and parameters: {'depth': 12, 'learning_rate': 0.18031908009530317, 'iterations': 1523, 'l2_leaf_reg': 2.4423458232361885, 'border_count': 52, 'bagging_temperature': 0.6941894844437829, 'random_strength': 4.936820975924798, 'grow_policy': 'Lossguide', 'min_data_in_leaf': 31, 'max_leaves': 158}. Best is trial 144 with value: 2690.2497230447584.[0m
[32m[I 2024-10-13 07:50:05,982][0m Trial 163 finished with value: 4264.816590623519 and parameters: {'depth': 12, 'learning_rate': 0.21724063253433196, 'iterations': 1607, 'l2_leaf_reg': 5.597700815930591, 'border_count': 84, 'bagging_temperature': 0.6562711009676936, 'random_strength': 4.202591662367876, 'grow_policy': 'Lossguide', 'min_data_in_leaf': 77, 'max_leaves': 166}. Best is trial 144 with value: 2690.2497230447584.[0m
[32m[I 2024-10-13 07:50:07,736][0m Trial 164 finished with value: 4601.607066878108 and parameters: {'depth': 13, 'learning_rate': 0.24799971783364722, 'iterations': 1511, 'l2_leaf_reg': 3.209516891551736, 'border_count': 63, 'bagging_temperature': 0.7409669604088295, 'random_strength': 5.009658003868103, 'grow_policy': 'Lossguide', 'min_data_in_leaf': 115, 'max_leaves': 135}. Best is trial 144 with value: 2690.2497230447584.[0m
[32m[I 2024-10-13 07:50:09,669][0m Trial 165 finished with value: 3287.2942474338106 and parameters: {'depth': 12, 'learning_rate': 0.2994288851834681, 'iterations': 1412, 'l2_leaf_reg': 6.45979847012846, 'border_count': 50, 'bagging_temperature': 0.6249541414181481, 'random_strength': 4.481781569491368, 'grow_policy': 'Lossguide', 'min_data_in_leaf': 58, 'max_leaves': 147}. Best is trial 144 with value: 2690.2497230447584.[0m
[32m[I 2024-10-13 07:50:11,456][0m Trial 166 finished with value: 5294.000138666503 and parameters: {'depth': 12, 'learning_rate': 0.18287670186058358, 'iterations': 1617, 'l2_leaf_reg': 0.007819935408992605, 'border_count': 39, 'bagging_temperature': 0.7888183870845079, 'random_strength': 4.763640916628382, 'grow_policy': 'Lossguide', 'min_data_in_leaf': 91, 'max_leaves': 172}. Best is trial 144 with value: 2690.2497230447584.[0m
[32m[I 2024-10-13 07:50:16,381][0m Trial 167 finished with value: 3201.080509532741 and parameters: {'depth': 12, 'learning_rate': 0.16182128901166945, 'iterations': 2406, 'l2_leaf_reg': 0.00012909795762391295, 'border_count': 57, 'bagging_temperature': 0.7056997899163496, 'random_strength': 4.3510337048170475, 'grow_policy': 'Lossguide', 'min_data_in_leaf': 34, 'max_leaves': 167}. Best is trial 144 with value: 2690.2497230447584.[0m
[32m[I 2024-10-13 07:50:21,108][0m Trial 168 finished with value: 3474.7176217326787 and parameters: {'depth': 12, 'learning_rate': 0.15412380745495813, 'iterations': 2526, 'l2_leaf_reg': 4.2947724234548845e-05, 'border_count': 54, 'bagging_temperature': 0.7425647855751931, 'random_strength': 5.695674823875676, 'grow_policy': 'Lossguide', 'min_data_in_leaf': 37, 'max_leaves': 156}. Best is trial 144 with value: 2690.2497230447584.[0m
[32m[I 2024-10-13 07:50:59,963][0m Trial 169 finished with value: 5531.19453915149 and parameters: {'depth': 13, 'learning_rate': 0.19762839765593568, 'iterations': 2304, 'l2_leaf_reg': 0.00023375336251097578, 'border_count': 60, 'bagging_temperature': 0.7161527728709319, 'random_strength': 4.297321566447635, 'grow_policy': 'Lossguide', 'min_data_in_leaf': 1, 'max_leaves': 167}. Best is trial 144 with value: 2690.2497230447584.[0m
[32m[I 2024-10-13 07:51:02,178][0m Trial 170 finished with value: 3032.158152396092 and parameters: {'depth': 3, 'learning_rate': 0.16865710331389816, 'iterations': 2048, 'l2_leaf_reg': 1.5975963800899992e-05, 'border_count': 48, 'bagging_temperature': 0.6859332885486121, 'random_strength': 1.3056133544875628, 'grow_policy': 'Lossguide', 'min_data_in_leaf': 65, 'max_leaves': 150}. Best is trial 144 with value: 2690.2497230447584.[0m
[32m[I 2024-10-13 07:51:07,694][0m Trial 171 finished with value: 4131.501659680281 and parameters: {'depth': 12, 'learning_rate': 0.16562784213816678, 'iterations': 2404, 'l2_leaf_reg': 0.0008912133225572247, 'border_count': 48, 'bagging_temperature': 0.7137353346614931, 'random_strength': 5.099766128645459, 'grow_policy': 'Lossguide', 'min_data_in_leaf': 25, 'max_leaves': 148}. Best is trial 144 with value: 2690.2497230447584.[0m
[32m[I 2024-10-13 07:51:10,096][0m Trial 172 finished with value: 2988.0097130653003 and parameters: {'depth': 11, 'learning_rate': 0.11678917267859294, 'iterations': 2057, 'l2_leaf_reg': 1.3072208711388725e-06, 'border_count': 55, 'bagging_temperature': 0.6801677663846892, 'random_strength': 4.5637674941764885, 'grow_policy': 'Lossguide', 'min_data_in_leaf': 63, 'max_leaves': 140}. Best is trial 144 with value: 2690.2497230447584.[0m
[32m[I 2024-10-13 07:51:12,452][0m Trial 173 finished with value: 3098.2888749296108 and parameters: {'depth': 7, 'learning_rate': 0.12986467749889283, 'iterations': 2124, 'l2_leaf_reg': 4.1313163929846266e-06, 'border_count': 56, 'bagging_temperature': 0.6909495494872172, 'random_strength': 0.7752101458041116, 'grow_policy': 'Lossguide', 'min_data_in_leaf': 74, 'max_leaves': 60}. Best is trial 144 with value: 2690.2497230447584.[0m
[32m[I 2024-10-13 07:51:14,806][0m Trial 174 finished with value: 4582.855522660872 and parameters: {'depth': 3, 'learning_rate': 0.10982541141686736, 'iterations': 2125, 'l2_leaf_reg': 1.921276968215745e-06, 'border_count': 66, 'bagging_temperature': 0.7697132479291354, 'random_strength': 1.0486801593837822, 'grow_policy': 'Lossguide', 'min_data_in_leaf': 67, 'max_leaves': 34}. Best is trial 144 with value: 2690.2497230447584.[0m
[32m[I 2024-10-13 07:51:16,957][0m Trial 175 finished with value: 3508.120463462802 and parameters: {'depth': 5, 'learning_rate': 0.133630569736033, 'iterations': 2043, 'l2_leaf_reg': 5.664770888449448e-06, 'border_count': 55, 'bagging_temperature': 0.6881635832704877, 'random_strength': 0.7645979046157021, 'grow_policy': 'Lossguide', 'min_data_in_leaf': 88, 'max_leaves': 79}. Best is trial 144 with value: 2690.2497230447584.[0m
[32m[I 2024-10-13 07:51:19,117][0m Trial 176 finished with value: 4364.803768334201 and parameters: {'depth': 5, 'learning_rate': 0.0993021168539726, 'iterations': 2165, 'l2_leaf_reg': 8.536516099644493e-06, 'border_count': 63, 'bagging_temperature': 0.6976509793767609, 'random_strength': 0.9952414434182489, 'grow_policy': 'Lossguide', 'min_data_in_leaf': 112, 'max_leaves': 142}. Best is trial 144 with value: 2690.2497230447584.[0m
[32m[I 2024-10-13 07:51:21,351][0m Trial 177 finished with value: 5095.288911008351 and parameters: {'depth': 8, 'learning_rate': 0.13620746199098624, 'iterations': 2215, 'l2_leaf_reg': 4.5256368171613293e-07, 'border_count': 72, 'bagging_temperature': 0.7537468202629726, 'random_strength': 1.4560656404188046, 'grow_policy': 'Lossguide', 'min_data_in_leaf': 139, 'max_leaves': 57}. Best is trial 144 with value: 2690.2497230447584.[0m
[32m[I 2024-10-13 07:51:32,761][0m Trial 178 finished with value: 3443.4575526014905 and parameters: {'depth': 7, 'learning_rate': 0.11574722914778408, 'iterations': 2079, 'l2_leaf_reg': 9.093870586268405e-07, 'border_count': 59, 'bagging_temperature': 0.6512731943265166, 'random_strength': 0.4938246073990059, 'grow_policy': 'SymmetricTree', 'min_data_in_leaf': 72}. Best is trial 144 with value: 2690.2497230447584.[0m
[32m[I 2024-10-13 07:51:35,330][0m Trial 179 finished with value: 3533.283425847203 and parameters: {'depth': 3, 'learning_rate': 0.15486982328064702, 'iterations': 2029, 'l2_leaf_reg': 8.086601793475951e-05, 'border_count': 56, 'bagging_temperature': 0.6744785359872949, 'random_strength': 1.1123217759547908, 'grow_policy': 'Lossguide', 'min_data_in_leaf': 47, 'max_leaves': 38}. Best is trial 144 with value: 2690.2497230447584.[0m
[32m[I 2024-10-13 07:51:41,487][0m Trial 180 finished with value: 4271.8956662977025 and parameters: {'depth': 15, 'learning_rate': 0.19076474012706088, 'iterations': 2240, 'l2_leaf_reg': 1.8965668192927382e-06, 'border_count': 38, 'bagging_temperature': 0.7258364474825837, 'random_strength': 0.6580667251241568, 'grow_policy': 'Lossguide', 'min_data_in_leaf': 26, 'max_leaves': 109}. Best is trial 144 with value: 2690.2497230447584.[0m
[32m[I 2024-10-13 07:51:43,847][0m Trial 181 finished with value: 2711.765115701656 and parameters: {'depth': 7, 'learning_rate': 0.2221714612073144, 'iterations': 2361, 'l2_leaf_reg': 1.1974758696204548e-06, 'border_count': 47, 'bagging_temperature': 0.5994424374747126, 'random_strength': 1.3385469463955686, 'grow_policy': 'Lossguide', 'min_data_in_leaf': 95, 'max_leaves': 54}. Best is trial 144 with value: 2690.2497230447584.[0m
[32m[I 2024-10-13 07:51:46,266][0m Trial 182 finished with value: 3088.097662523034 and parameters: {'depth': 4, 'learning_rate': 0.21669353362235025, 'iterations': 2367, 'l2_leaf_reg': 1.146282631412281e-06, 'border_count': 48, 'bagging_temperature': 0.5907654026187058, 'random_strength': 0.3047627811314458, 'grow_policy': 'Lossguide', 'min_data_in_leaf': 79, 'max_leaves': 56}. Best is trial 144 with value: 2690.2497230447584.[0m
[32m[I 2024-10-13 07:51:48,666][0m Trial 183 finished with value: 2698.903740138057 and parameters: {'depth': 7, 'learning_rate': 0.2222209690642638, 'iterations': 2449, 'l2_leaf_reg': 5.797897344179208e-07, 'border_count': 48, 'bagging_temperature': 0.5966268327756915, 'random_strength': 1.3571833895802698, 'grow_policy': 'Lossguide', 'min_data_in_leaf': 97, 'max_leaves': 60}. Best is trial 144 with value: 2690.2497230447584.[0m
[32m[I 2024-10-13 07:51:50,949][0m Trial 184 finished with value: 3327.4618262228328 and parameters: {'depth': 4, 'learning_rate': 0.21226403730552754, 'iterations': 2322, 'l2_leaf_reg': 7.654922630909364e-07, 'border_count': 49, 'bagging_temperature': 0.5888020112085393, 'random_strength': 1.8099762732034428, 'grow_policy': 'Lossguide', 'min_data_in_leaf': 93, 'max_leaves': 57}. Best is trial 144 with value: 2690.2497230447584.[0m
[32m[I 2024-10-13 07:51:53,367][0m Trial 185 finished with value: 5048.981310486808 and parameters: {'depth': 7, 'learning_rate': 0.2241231515043269, 'iterations': 2447, 'l2_leaf_reg': 1.2049668103628162e-06, 'border_count': 41, 'bagging_temperature': 0.6320093833810917, 'random_strength': 0.25477461093507237, 'grow_policy': 'Depthwise', 'min_data_in_leaf': 128}. Best is trial 144 with value: 2690.2497230447584.[0m
[32m[I 2024-10-13 07:51:55,634][0m Trial 186 finished with value: 3963.557522970297 and parameters: {'depth': 4, 'learning_rate': 0.26841165820387425, 'iterations': 2353, 'l2_leaf_reg': 3.8003981016963355e-07, 'border_count': 52, 'bagging_temperature': 0.6024733256932188, 'random_strength': 1.192044700459931, 'grow_policy': 'Lossguide', 'min_data_in_leaf': 106, 'max_leaves': 68}. Best is trial 144 with value: 2690.2497230447584.[0m
[32m[I 2024-10-13 07:51:58,288][0m Trial 187 finished with value: 2857.940293072318 and parameters: {'depth': 6, 'learning_rate': 0.2134929012067433, 'iterations': 2573, 'l2_leaf_reg': 2.170013826272482e-07, 'border_count': 46, 'bagging_temperature': 0.5732326711170344, 'random_strength': 0.3292028432497866, 'grow_policy': 'Lossguide', 'min_data_in_leaf': 77, 'max_leaves': 54}. Best is trial 144 with value: 2690.2497230447584.[0m
[32m[I 2024-10-13 07:52:00,992][0m Trial 188 finished with value: 5876.0470754205535 and parameters: {'depth': 6, 'learning_rate': 0.1999297134125572, 'iterations': 2692, 'l2_leaf_reg': 1.6823792358578926e-07, 'border_count': 35, 'bagging_temperature': 0.5712058161957186, 'random_strength': 0.23375999480375453, 'grow_policy': 'Lossguide', 'min_data_in_leaf': 70, 'max_leaves': 41}. Best is trial 144 with value: 2690.2497230447584.[0m
[32m[I 2024-10-13 07:52:03,337][0m Trial 189 finished with value: 3323.6174100463086 and parameters: {'depth': 7, 'learning_rate': 0.22425527510657783, 'iterations': 2466, 'l2_leaf_reg': 2.654271849559597e-06, 'border_count': 53, 'bagging_temperature': 0.6184734970584084, 'random_strength': 1.4032271163363048, 'grow_policy': 'Lossguide', 'min_data_in_leaf': 87, 'max_leaves': 55}. Best is trial 144 with value: 2690.2497230447584.[0m
[32m[I 2024-10-13 07:52:06,546][0m Trial 190 finished with value: 3504.6702287877856 and parameters: {'depth': 6, 'learning_rate': 0.17810922136194696, 'iterations': 2531, 'l2_leaf_reg': 2.399380314101086e-07, 'border_count': 41, 'bagging_temperature': 0.594245428597342, 'random_strength': 0.5840376728387886, 'grow_policy': 'Lossguide', 'min_data_in_leaf': 50, 'max_leaves': 67}. Best is trial 144 with value: 2690.2497230447584.[0m
[32m[I 2024-10-13 07:52:09,096][0m Trial 191 finished with value: 2831.4166810064166 and parameters: {'depth': 8, 'learning_rate': 0.25956424401621525, 'iterations': 2652, 'l2_leaf_reg': 1.0849000935294537e-05, 'border_count': 46, 'bagging_temperature': 0.5683646189453773, 'random_strength': 0.7544369423378938, 'grow_policy': 'Lossguide', 'min_data_in_leaf': 101, 'max_leaves': 49}. Best is trial 144 with value: 2690.2497230447584.[0m
[32m[I 2024-10-13 07:52:11,565][0m Trial 192 finished with value: 2876.9642876136395 and parameters: {'depth': 8, 'learning_rate': 0.24436389922487797, 'iterations': 2619, 'l2_leaf_reg': 1.3773831683564374e-05, 'border_count': 48, 'bagging_temperature': 0.5711169335202776, 'random_strength': 0.397809312698272, 'grow_policy': 'Lossguide', 'min_data_in_leaf': 105, 'max_leaves': 50}. Best is trial 144 with value: 2690.2497230447584.[0m
[32m[I 2024-10-13 07:52:14,016][0m Trial 193 finished with value: 2971.13655730528 and parameters: {'depth': 8, 'learning_rate': 0.25809462468466415, 'iterations': 2572, 'l2_leaf_reg': 1.1819556945162296e-05, 'border_count': 47, 'bagging_temperature': 0.5646699379848503, 'random_strength': 0.43476744732327716, 'grow_policy': 'Lossguide', 'min_data_in_leaf': 128, 'max_leaves': 46}. Best is trial 144 with value: 2690.2497230447584.[0m
[32m[I 2024-10-13 07:52:16,584][0m Trial 194 finished with value: 3082.4102491350554 and parameters: {'depth': 8, 'learning_rate': 0.2588974557968601, 'iterations': 2603, 'l2_leaf_reg': 1.2347947297871119e-05, 'border_count': 48, 'bagging_temperature': 0.5674667877221994, 'random_strength': 0.8478984191036383, 'grow_policy': 'Lossguide', 'min_data_in_leaf': 119, 'max_leaves': 45}. Best is trial 144 with value: 2690.2497230447584.[0m
[32m[I 2024-10-13 07:52:18,968][0m Trial 195 finished with value: 4945.546514165083 and parameters: {'depth': 8, 'learning_rate': 0.2601858824595715, 'iterations': 2593, 'l2_leaf_reg': 1.1231773664940441e-05, 'border_count': 215, 'bagging_temperature': 0.5769805507902903, 'random_strength': 0.3728269286571253, 'grow_policy': 'Lossguide', 'min_data_in_leaf': 132, 'max_leaves': 46}. Best is trial 144 with value: 2690.2497230447584.[0m
[32m[I 2024-10-13 07:52:21,605][0m Trial 196 finished with value: 5473.501456217067 and parameters: {'depth': 8, 'learning_rate': 0.26087992651331837, 'iterations': 2829, 'l2_leaf_reg': 2.0405989796257344e-05, 'border_count': 49, 'bagging_temperature': 0.5534591858154093, 'random_strength': 0.7352185509871987, 'grow_policy': 'Lossguide', 'min_data_in_leaf': 108, 'max_leaves': 52}. Best is trial 144 with value: 2690.2497230447584.[0m
[32m[I 2024-10-13 07:52:24,119][0m Trial 197 finished with value: 3964.7285461101537 and parameters: {'depth': 8, 'learning_rate': 0.2288116482770756, 'iterations': 2616, 'l2_leaf_reg': 1.1641109355410716e-05, 'border_count': 61, 'bagging_temperature': 0.6038105937777333, 'random_strength': 0.8761617751664116, 'grow_policy': 'Lossguide', 'min_data_in_leaf': 150, 'max_leaves': 43}. Best is trial 144 with value: 2690.2497230447584.[0m
[32m[I 2024-10-13 07:52:26,628][0m Trial 198 finished with value: 2780.2245728851094 and parameters: {'depth': 7, 'learning_rate': 0.2934424337204231, 'iterations': 2672, 'l2_leaf_reg': 2.501670573720316e-05, 'border_count': 47, 'bagging_temperature': 0.5699843201082254, 'random_strength': 0.09565403074855522, 'grow_policy': 'Lossguide', 'min_data_in_leaf': 122, 'max_leaves': 51}. Best is trial 144 with value: 2690.2497230447584.[0m
[32m[I 2024-10-13 07:52:29,212][0m Trial 199 finished with value: 4988.93289027888 and parameters: {'depth': 7, 'learning_rate': 0.2995826401146731, 'iterations': 2740, 'l2_leaf_reg': 2.0593928764750008e-05, 'border_count': 149, 'bagging_temperature': 0.571941918984544, 'random_strength': 1.2900260298337933, 'grow_policy': 'Lossguide', 'min_data_in_leaf': 127, 'max_leaves': 62}. Best is trial 144 with value: 2690.2497230447584.[0m
[32m[I 2024-10-13 07:52:31,730][0m Trial 200 finished with value: 6266.565134835203 and parameters: {'depth': 7, 'learning_rate': 0.2540474822364696, 'iterations': 2654, 'l2_leaf_reg': 3.737929316731977e-06, 'border_count': 35, 'bagging_temperature': 0.5482333098959355, 'random_strength': 0.011871710353391574, 'grow_policy': 'Lossguide', 'min_data_in_leaf': 93, 'max_leaves': 51}. Best is trial 144 with value: 2690.2497230447584.[0m
