[32m[I 2024-10-13 08:54:09,011][0m Trial 852 finished with value: 4856.998324298807 and parameters: {'depth': 6, 'learning_rate': 0.0374921082390213, 'iterations': 2350, 'l2_leaf_reg': 3.6602246371349468e-06, 'border_count': 145, 'bagging_temperature': 0.6306686717939936, 'random_strength': 1.066422387202428, 'grow_policy': 'Lossguide', 'min_data_in_leaf': 93, 'max_leaves': 53}. Best is trial 472 with value: 2453.464132483589.[0m
[32m[I 2024-10-13 08:54:13,219][0m Trial 853 finished with value: 4135.057022535624 and parameters: {'depth': 7, 'learning_rate': 0.008023094155351044, 'iterations': 2783, 'l2_leaf_reg': 1.154080560917787e-05, 'border_count': 44, 'bagging_temperature': 0.5393684400609838, 'random_strength': 0.5236553760190378, 'grow_policy': 'Lossguide', 'min_data_in_leaf': 140, 'max_leaves': 189}. Best is trial 472 with value: 2453.464132483589.[0m
[32m[I 2024-10-13 08:54:17,043][0m Trial 854 finished with value: 4592.303329799782 and parameters: {'depth': 8, 'learning_rate': 0.2526290289361253, 'iterations': 1561, 'l2_leaf_reg': 1.4552412462971844e-06, 'border_count': 32, 'bagging_temperature': 0.6477759449883903, 'random_strength': 0.3479119432112331, 'grow_policy': 'Lossguide', 'min_data_in_leaf': 63, 'max_leaves': 36}. Best is trial 472 with value: 2453.464132483589.[0m
[32m[I 2024-10-13 08:54:21,193][0m Trial 855 finished with value: 3687.873956328243 and parameters: {'depth': 7, 'learning_rate': 0.157297634067327, 'iterations': 2036, 'l2_leaf_reg': 2.4520658447136053e-06, 'border_count': 55, 'bagging_temperature': 0.5538190995142772, 'random_strength': 0.8289642317949036, 'grow_policy': 'Lossguide', 'min_data_in_leaf': 113, 'max_leaves': 58}. Best is trial 472 with value: 2453.464132483589.[0m
[32m[I 2024-10-13 08:54:26,821][0m Trial 856 finished with value: 3251.8485466323855 and parameters: {'depth': 6, 'learning_rate': 0.18208377607065052, 'iterations': 2948, 'l2_leaf_reg': 0.0002936002088141847, 'border_count': 63, 'bagging_temperature': 0.5959460522789842, 'random_strength': 1.2994722936371885, 'grow_policy': 'Depthwise', 'min_data_in_leaf': 83}. Best is trial 472 with value: 2453.464132483589.[0m
[32m[I 2024-10-13 08:54:33,248][0m Trial 857 finished with value: 3342.017873857125 and parameters: {'depth': 8, 'learning_rate': 0.22614848876388413, 'iterations': 2730, 'l2_leaf_reg': 2.1109401823419682e-05, 'border_count': 38, 'bagging_temperature': 0.6838944456039154, 'random_strength': 0.613386609827145, 'grow_policy': 'Lossguide', 'min_data_in_leaf': 55, 'max_leaves': 42}. Best is trial 472 with value: 2453.464132483589.[0m
[32m[I 2024-10-13 08:54:38,908][0m Trial 858 finished with value: 5039.660756578142 and parameters: {'depth': 7, 'learning_rate': 0.26252911897796394, 'iterations': 2848, 'l2_leaf_reg': 0.0006023230589486863, 'border_count': 49, 'bagging_temperature': 0.6242015023799478, 'random_strength': 0.14160181376598802, 'grow_policy': 'Lossguide', 'min_data_in_leaf': 90, 'max_leaves': 50}. Best is trial 472 with value: 2453.464132483589.[0m
[32m[I 2024-10-13 08:54:43,714][0m Trial 859 finished with value: 2948.9890260381876 and parameters: {'depth': 7, 'learning_rate': 0.20909334072260788, 'iterations': 2678, 'l2_leaf_reg': 9.266889782877212e-07, 'border_count': 44, 'bagging_temperature': 0.5776842937152088, 'random_strength': 1.575211340972234, 'grow_policy': 'Lossguide', 'min_data_in_leaf': 133, 'max_leaves': 66}. Best is trial 472 with value: 2453.464132483589.[0m
[32m[I 2024-10-13 08:54:48,613][0m Trial 860 finished with value: 4680.289175108546 and parameters: {'depth': 8, 'learning_rate': 0.1205086481258512, 'iterations': 2494, 'l2_leaf_reg': 0.0001107481724262771, 'border_count': 50, 'bagging_temperature': 0.5143614455399212, 'random_strength': 0.41930064287704705, 'grow_policy': 'Lossguide', 'min_data_in_leaf': 106, 'max_leaves': 153}. Best is trial 472 with value: 2453.464132483589.[0m
[32m[I 2024-10-13 08:54:56,461][0m Trial 861 finished with value: 5663.068596760431 and parameters: {'depth': 7, 'learning_rate': 0.2998921042913425, 'iterations': 2595, 'l2_leaf_reg': 7.450463782019817e-07, 'border_count': 235, 'bagging_temperature': 0.6066173918513185, 'random_strength': 0.9295778967754282, 'grow_policy': 'Lossguide', 'min_data_in_leaf': 24, 'max_leaves': 55}. Best is trial 472 with value: 2453.464132483589.[0m
[32m[I 2024-10-13 08:54:59,354][0m Trial 862 finished with value: 2733.5836977406607 and parameters: {'depth': 6, 'learning_rate': 0.168274345544682, 'iterations': 1992, 'l2_leaf_reg': 5.801096076372725e-06, 'border_count': 58, 'bagging_temperature': 0.6519688671985682, 'random_strength': 0.6956432011442875, 'grow_policy': 'Lossguide', 'min_data_in_leaf': 74, 'max_leaves': 39}. Best is trial 472 with value: 2453.464132483589.[0m
[32m[I 2024-10-13 08:55:01,492][0m Trial 863 finished with value: 5557.368881984697 and parameters: {'depth': 8, 'learning_rate': 0.23903978338985743, 'iterations': 1163, 'l2_leaf_reg': 2.2668924500673956e-07, 'border_count': 36, 'bagging_temperature': 0.5562354604201297, 'random_strength': 1.0364059146250773, 'grow_policy': 'Lossguide', 'min_data_in_leaf': 148, 'max_leaves': 46}. Best is trial 472 with value: 2453.464132483589.[0m
[32m[I 2024-10-13 08:55:04,926][0m Trial 864 finished with value: 3666.922624023637 and parameters: {'depth': 5, 'learning_rate': 0.1456352661676971, 'iterations': 730, 'l2_leaf_reg': 9.068445369842887e-06, 'border_count': 42, 'bagging_temperature': 0.7150445962450597, 'random_strength': 0.33444140545719525, 'grow_policy': 'SymmetricTree', 'min_data_in_leaf': 114}. Best is trial 472 with value: 2453.464132483589.[0m
[32m[I 2024-10-13 08:55:12,705][0m Trial 865 finished with value: 3366.147257333884 and parameters: {'depth': 7, 'learning_rate': 0.20349120044944602, 'iterations': 2799, 'l2_leaf_reg': 0.0002203784333514743, 'border_count': 47, 'bagging_temperature': 0.6215876228265166, 'random_strength': 2.767975523802828, 'grow_policy': 'Depthwise', 'min_data_in_leaf': 43}. Best is trial 472 with value: 2453.464132483589.[0m
[32m[I 2024-10-13 08:55:16,707][0m Trial 866 finished with value: 3770.099435203559 and parameters: {'depth': 7, 'learning_rate': 0.2625149938218945, 'iterations': 2280, 'l2_leaf_reg': 1.279236397443377e-06, 'border_count': 53, 'bagging_temperature': 0.587753391777376, 'random_strength': 3.330282588241713, 'grow_policy': 'Lossguide', 'min_data_in_leaf': 99, 'max_leaves': 61}. Best is trial 472 with value: 2453.464132483589.[0m
[32m[I 2024-10-13 08:55:21,934][0m Trial 867 finished with value: 3459.5411149335814 and parameters: {'depth': 7, 'learning_rate': 0.18343600012529163, 'iterations': 2740, 'l2_leaf_reg': 4.2020282619393296e-07, 'border_count': 40, 'bagging_temperature': 0.570588105885325, 'random_strength': 0.5421666596375158, 'grow_policy': 'Lossguide', 'min_data_in_leaf': 70, 'max_leaves': 73}. Best is trial 472 with value: 2453.464132483589.[0m
[32m[I 2024-10-13 08:55:27,241][0m Trial 868 finished with value: 7929.591843756171 and parameters: {'depth': 6, 'learning_rate': 0.22253393522829362, 'iterations': 2999, 'l2_leaf_reg': 3.940891393076837e-05, 'border_count': 26, 'bagging_temperature': 0.6695554866040471, 'random_strength': 4.146016606498639, 'grow_policy': 'Lossguide', 'min_data_in_leaf': 119, 'max_leaves': 51}. Best is trial 472 with value: 2453.464132483589.[0m
[32m[I 2024-10-13 08:55:32,768][0m Trial 869 finished with value: 2557.9020444292846 and parameters: {'depth': 7, 'learning_rate': 0.1695909266175144, 'iterations': 2639, 'l2_leaf_reg': 1.4682660567366983e-05, 'border_count': 46, 'bagging_temperature': 0.6456655433317049, 'random_strength': 1.8060642009758505, 'grow_policy': 'Lossguide', 'min_data_in_leaf': 87, 'max_leaves': 34}. Best is trial 472 with value: 2453.464132483589.[0m
[32m[I 2024-10-13 08:55:39,822][0m Trial 870 finished with value: 3945.280338809931 and parameters: {'depth': 7, 'learning_rate': 0.11217040015508692, 'iterations': 2620, 'l2_leaf_reg': 1.136446257591183e-05, 'border_count': 35, 'bagging_temperature': 0.6492238665433093, 'random_strength': 1.8862975846996122, 'grow_policy': 'Lossguide', 'min_data_in_leaf': 48, 'max_leaves': 31}. Best is trial 472 with value: 2453.464132483589.[0m
[32m[I 2024-10-13 08:55:44,195][0m Trial 871 finished with value: 3814.362506395715 and parameters: {'depth': 15, 'learning_rate': 0.1289010107782545, 'iterations': 2567, 'l2_leaf_reg': 1.627759511866499e-05, 'border_count': 42, 'bagging_temperature': 0.6789295636138377, 'random_strength': 1.5833210339485517, 'grow_policy': 'Lossguide', 'min_data_in_leaf': 72, 'max_leaves': 34}. Best is trial 472 with value: 2453.464132483589.[0m
[32m[I 2024-10-13 08:55:48,992][0m Trial 872 finished with value: 3386.8096568556184 and parameters: {'depth': 7, 'learning_rate': 0.0839892590134786, 'iterations': 2652, 'l2_leaf_reg': 1.4263488219256825e-05, 'border_count': 46, 'bagging_temperature': 0.6346628921332829, 'random_strength': 1.4677980198668528, 'grow_policy': 'Lossguide', 'min_data_in_leaf': 128, 'max_leaves': 35}. Best is trial 472 with value: 2453.464132483589.[0m
[32m[I 2024-10-13 08:55:51,903][0m Trial 873 finished with value: 4887.407924790633 and parameters: {'depth': 7, 'learning_rate': 0.1426875591648836, 'iterations': 1422, 'l2_leaf_reg': 1.9462384752098987e-05, 'border_count': 36, 'bagging_temperature': 0.6528730350754209, 'random_strength': 1.830985358944036, 'grow_policy': 'Lossguide', 'min_data_in_leaf': 93, 'max_leaves': 31}. Best is trial 472 with value: 2453.464132483589.[0m
[32m[I 2024-10-13 08:55:53,660][0m Trial 874 finished with value: 4556.562709059911 and parameters: {'depth': 8, 'learning_rate': 0.15187996011652594, 'iterations': 452, 'l2_leaf_reg': 7.224458300857625e-06, 'border_count': 31, 'bagging_temperature': 0.692679510839111, 'random_strength': 1.6721189836724637, 'grow_policy': 'Depthwise', 'min_data_in_leaf': 58}. Best is trial 472 with value: 2453.464132483589.[0m
[32m[I 2024-10-13 08:55:58,256][0m Trial 875 finished with value: 5254.3875122583695 and parameters: {'depth': 7, 'learning_rate': 0.165415724418941, 'iterations': 2554, 'l2_leaf_reg': 2.527097465972774e-05, 'border_count': 41, 'bagging_temperature': 0.666962008716402, 'random_strength': 1.3206948979563822, 'grow_policy': 'Lossguide', 'min_data_in_leaf': 147, 'max_leaves': 39}. Best is trial 472 with value: 2453.464132483589.[0m
[32m[I 2024-10-13 08:56:03,184][0m Trial 876 finished with value: 7488.69800356117 and parameters: {'depth': 8, 'learning_rate': 0.0013051589661924783, 'iterations': 2645, 'l2_leaf_reg': 1.479986012904873e-05, 'border_count': 46, 'bagging_temperature': 0.6351911073180745, 'random_strength': 1.200527954939802, 'grow_policy': 'Lossguide', 'min_data_in_leaf': 102, 'max_leaves': 35}. Best is trial 472 with value: 2453.464132483589.[0m
[32m[I 2024-10-13 08:56:14,263][0m Trial 877 finished with value: 4677.515571074746 and parameters: {'depth': 7, 'learning_rate': 0.17184635911331184, 'iterations': 2522, 'l2_leaf_reg': 9.725234491049404e-06, 'border_count': 39, 'bagging_temperature': 0.6143517420884064, 'random_strength': 1.4703611248068522, 'grow_policy': 'Lossguide', 'min_data_in_leaf': 10, 'max_leaves': 41}. Best is trial 472 with value: 2453.464132483589.[0m
[32m[I 2024-10-13 08:56:19,500][0m Trial 878 finished with value: 3467.300656946081 and parameters: {'depth': 7, 'learning_rate': 0.1340393606378319, 'iterations': 2670, 'l2_leaf_reg': 2.4814690406425677e-05, 'border_count': 49, 'bagging_temperature': 0.6382565321249085, 'random_strength': 2.4789513373639913, 'grow_policy': 'Lossguide', 'min_data_in_leaf': 80, 'max_leaves': 38}. Best is trial 472 with value: 2453.464132483589.[0m
[32m[I 2024-10-13 08:56:28,650][0m Trial 879 finished with value: 3621.259833553996 and parameters: {'depth': 7, 'learning_rate': 0.17106647878622275, 'iterations': 2594, 'l2_leaf_reg': 6.8097133507881605e-06, 'border_count': 44, 'bagging_temperature': 0.613953557055464, 'random_strength': 0.2425871578515033, 'grow_policy': 'Lossguide', 'min_data_in_leaf': 37, 'max_leaves': 44}. Best is trial 472 with value: 2453.464132483589.[0m
[32m[I 2024-10-13 08:56:33,976][0m Trial 880 finished with value: 5951.747340079475 and parameters: {'depth': 7, 'learning_rate': 0.13910075941739428, 'iterations': 2709, 'l2_leaf_reg': 4.774262643275125e-06, 'border_count': 32, 'bagging_temperature': 0.7027662001485524, 'random_strength': 2.095583889036813, 'grow_policy': 'Lossguide', 'min_data_in_leaf': 123, 'max_leaves': 35}. Best is trial 472 with value: 2453.464132483589.[0m
[32m[I 2024-10-13 08:56:38,202][0m Trial 881 finished with value: 2960.221930111912 and parameters: {'depth': 8, 'learning_rate': 0.19398806798397547, 'iterations': 2448, 'l2_leaf_reg': 5.600988893175949e-05, 'border_count': 51, 'bagging_temperature': 0.6596541314759923, 'random_strength': 5.309235480141481, 'grow_policy': 'Lossguide', 'min_data_in_leaf': 80, 'max_leaves': 43}. Best is trial 472 with value: 2453.464132483589.[0m
[32m[I 2024-10-13 08:56:43,124][0m Trial 882 finished with value: 4668.985109549764 and parameters: {'depth': 7, 'learning_rate': 0.10794333731480679, 'iterations': 2472, 'l2_leaf_reg': 3.1641461084907875e-05, 'border_count': 39, 'bagging_temperature': 0.7735148891638347, 'random_strength': 0.0029314500908105834, 'grow_policy': 'Depthwise', 'min_data_in_leaf': 105}. Best is trial 472 with value: 2453.464132483589.[0m
[32m[I 2024-10-13 08:56:48,021][0m Trial 883 finished with value: 3191.1804127464143 and parameters: {'depth': 7, 'learning_rate': 0.15640106528691625, 'iterations': 2643, 'l2_leaf_reg': 0.056808903946429644, 'border_count': 45, 'bagging_temperature': 0.5968080070402969, 'random_strength': 1.78426806758055, 'grow_policy': 'Lossguide', 'min_data_in_leaf': 62, 'max_leaves': 39}. Best is trial 472 with value: 2453.464132483589.[0m
[32m[I 2024-10-13 08:56:53,205][0m Trial 884 finished with value: 3433.2885491998204 and parameters: {'depth': 7, 'learning_rate': 0.19127563658956578, 'iterations': 2553, 'l2_leaf_reg': 1.568227202260095e-05, 'border_count': 48, 'bagging_temperature': 0.022625963218865452, 'random_strength': 0.3029606274632577, 'grow_policy': 'Lossguide', 'min_data_in_leaf': 619, 'max_leaves': 48}. Best is trial 472 with value: 2453.464132483589.[0m
[32m[I 2024-10-13 08:57:12,650][0m Trial 885 finished with value: 7821.244039123554 and parameters: {'depth': 8, 'learning_rate': 0.1901332341184684, 'iterations': 2711, 'l2_leaf_reg': 3.5116239894129934e-06, 'border_count': 6, 'bagging_temperature': 0.6262244733928659, 'random_strength': 1.2258443027712653, 'grow_policy': 'SymmetricTree', 'min_data_in_leaf': 131}. Best is trial 472 with value: 2453.464132483589.[0m
[32m[I 2024-10-13 08:57:17,961][0m Trial 886 finished with value: 3076.7326646058063 and parameters: {'depth': 7, 'learning_rate': 0.16379400860825585, 'iterations': 2404, 'l2_leaf_reg': 9.971186846175628e-06, 'border_count': 42, 'bagging_temperature': 0.6728798779266838, 'random_strength': 0.1429311884949162, 'grow_policy': 'Lossguide', 'min_data_in_leaf': 88, 'max_leaves': 34}. Best is trial 472 with value: 2453.464132483589.[0m
[32m[I 2024-10-13 08:57:21,657][0m Trial 887 finished with value: 5032.981178231137 and parameters: {'depth': 8, 'learning_rate': 0.2102310042748632, 'iterations': 2612, 'l2_leaf_reg': 0.00012059641079496442, 'border_count': 36, 'bagging_temperature': 0.6447163656983268, 'random_strength': 0.5144182489902728, 'grow_policy': 'Lossguide', 'min_data_in_leaf': 153, 'max_leaves': 45}. Best is trial 472 with value: 2453.464132483589.[0m
[32m[I 2024-10-13 08:57:24,940][0m Trial 888 finished with value: 3832.993289858855 and parameters: {'depth': 7, 'learning_rate': 0.1379914633886297, 'iterations': 2514, 'l2_leaf_reg': 5.444090088557199e-08, 'border_count': 52, 'bagging_temperature': 0.5891040102489566, 'random_strength': 7.768475818117833, 'grow_policy': 'Lossguide', 'min_data_in_leaf': 107, 'max_leaves': 53}. Best is trial 472 with value: 2453.464132483589.[0m
[32m[I 2024-10-13 08:57:29,793][0m Trial 889 finished with value: 3196.626168517236 and parameters: {'depth': 7, 'learning_rate': 0.19013178083595272, 'iterations': 2677, 'l2_leaf_reg': 2.5604718761619946e-05, 'border_count': 45, 'bagging_temperature': 0.6104439640836475, 'random_strength': 4.719585365068696, 'grow_policy': 'Lossguide', 'min_data_in_leaf': 65, 'max_leaves': 31}. Best is trial 472 with value: 2453.464132483589.[0m
[32m[I 2024-10-13 08:57:36,210][0m Trial 890 finished with value: 4254.512021443992 and parameters: {'depth': 8, 'learning_rate': 0.22178489827432918, 'iterations': 2585, 'l2_leaf_reg': 6.0423049817912756e-05, 'border_count': 29, 'bagging_temperature': 0.6254965798663936, 'random_strength': 0.6860827400496505, 'grow_policy': 'Lossguide', 'min_data_in_leaf': 44, 'max_leaves': 64}. Best is trial 472 with value: 2453.464132483589.[0m
[32m[I 2024-10-13 08:57:41,020][0m Trial 891 finished with value: 4866.387133739692 and parameters: {'depth': 8, 'learning_rate': 0.16727076631152207, 'iterations': 2689, 'l2_leaf_reg': 4.210563510468788e-05, 'border_count': 39, 'bagging_temperature': 0.5755715305445198, 'random_strength': 9.206140185436526, 'grow_policy': 'Depthwise', 'min_data_in_leaf': 117}. Best is trial 472 with value: 2453.464132483589.[0m
[32m[I 2024-10-13 08:57:46,587][0m Trial 892 finished with value: 3884.4002867618274 and parameters: {'depth': 7, 'learning_rate': 0.22139584816126784, 'iterations': 2761, 'l2_leaf_reg': 0.00046630116722880477, 'border_count': 50, 'bagging_temperature': 0.6024502911627486, 'random_strength': 1.0740222417702372, 'grow_policy': 'Lossguide', 'min_data_in_leaf': 84, 'max_leaves': 41}. Best is trial 472 with value: 2453.464132483589.[0m
[32m[I 2024-10-13 08:57:51,931][0m Trial 893 finished with value: 2832.538252079719 and parameters: {'depth': 7, 'learning_rate': 0.12396482608461513, 'iterations': 2625, 'l2_leaf_reg': 2.1943819062625602e-06, 'border_count': 44, 'bagging_temperature': 0.6865019485549537, 'random_strength': 0.383543056613397, 'grow_policy': 'Lossguide', 'min_data_in_leaf': 99, 'max_leaves': 57}. Best is trial 472 with value: 2453.464132483589.[0m
[32m[I 2024-10-13 08:57:56,785][0m Trial 894 finished with value: 5106.815526547675 and parameters: {'depth': 7, 'learning_rate': 0.18500397755592593, 'iterations': 2706, 'l2_leaf_reg': 6.001199283707101e-06, 'border_count': 36, 'bagging_temperature': 0.6642933657594989, 'random_strength': 0.17108442590047146, 'grow_policy': 'Lossguide', 'min_data_in_leaf': 134, 'max_leaves': 48}. Best is trial 472 with value: 2453.464132483589.[0m
[32m[I 2024-10-13 08:58:01,520][0m Trial 895 finished with value: 3253.6008036746425 and parameters: {'depth': 7, 'learning_rate': 0.15087949851003243, 'iterations': 2496, 'l2_leaf_reg': 0.0002804507851654945, 'border_count': 53, 'bagging_temperature': 0.643053667956871, 'random_strength': 0.6912960876097356, 'grow_policy': 'Lossguide', 'min_data_in_leaf': 68, 'max_leaves': 38}. Best is trial 472 with value: 2453.464132483589.[0m
[32m[I 2024-10-13 08:58:04,400][0m Trial 896 finished with value: 3083.871067629427 and parameters: {'depth': 8, 'learning_rate': 0.23112702647257563, 'iterations': 1658, 'l2_leaf_reg': 0.011400008302730445, 'border_count': 47, 'bagging_temperature': 0.5875678819305152, 'random_strength': 1.3384324207493883, 'grow_policy': 'Lossguide', 'min_data_in_leaf': 109, 'max_leaves': 69}. Best is trial 472 with value: 2453.464132483589.[0m
[32m[I 2024-10-13 08:58:09,376][0m Trial 897 finished with value: 5396.706219160807 and parameters: {'depth': 7, 'learning_rate': 0.20128320125324847, 'iterations': 2749, 'l2_leaf_reg': 1.9069338576853314e-05, 'border_count': 41, 'bagging_temperature': 0.7272775084416612, 'random_strength': 0.5264738740107158, 'grow_policy': 'Lossguide', 'min_data_in_leaf': 389, 'max_leaves': 45}. Best is trial 472 with value: 2453.464132483589.[0m
[32m[I 2024-10-13 08:58:13,744][0m Trial 898 finished with value: 3264.375320075562 and parameters: {'depth': 7, 'learning_rate': 0.23576314232718368, 'iterations': 2537, 'l2_leaf_reg': 7.559823278944107e-05, 'border_count': 49, 'bagging_temperature': 0.6120581852213531, 'random_strength': 0.8656138680051015, 'grow_policy': 'Lossguide', 'min_data_in_leaf': 89, 'max_leaves': 61}. Best is trial 472 with value: 2453.464132483589.[0m
[32m[I 2024-10-13 08:58:18,305][0m Trial 899 finished with value: 4353.097352647022 and parameters: {'depth': 7, 'learning_rate': 0.16911042288710013, 'iterations': 2641, 'l2_leaf_reg': 0.13975061433182012, 'border_count': 32, 'bagging_temperature': 0.5610101751912633, 'random_strength': 0.3808759529475841, 'grow_policy': 'Lossguide', 'min_data_in_leaf': 49, 'max_leaves': 55}. Best is trial 472 with value: 2453.464132483589.[0m
[32m[I 2024-10-13 08:58:23,049][0m Trial 900 finished with value: 4334.139423841977 and parameters: {'depth': 8, 'learning_rate': 0.030439577270984952, 'iterations': 2582, 'l2_leaf_reg': 1.4905809219411032e-05, 'border_count': 42, 'bagging_temperature': 0.6266401802620339, 'random_strength': 0.0074319112477276295, 'grow_policy': 'Depthwise', 'min_data_in_leaf': 151}. Best is trial 472 with value: 2453.464132483589.[0m
[32m[I 2024-10-13 08:58:27,293][0m Trial 901 finished with value: 3788.691598955394 and parameters: {'depth': 7, 'learning_rate': 0.20376322570939195, 'iterations': 2371, 'l2_leaf_reg': 0.0001572217099533793, 'border_count': 55, 'bagging_temperature': 0.5771298923019179, 'random_strength': 8.356889513524479, 'grow_policy': 'Lossguide', 'min_data_in_leaf': 122, 'max_leaves': 41}. Best is trial 472 with value: 2453.464132483589.[0m
