[32m[I 2024-10-13 08:21:02,832][0m Trial 552 finished with value: 3539.158850550143 and parameters: {'depth': 9, 'learning_rate': 0.15644767675223265, 'iterations': 811, 'l2_leaf_reg': 4.992424189211618e-07, 'border_count': 62, 'bagging_temperature': 0.4474291944547565, 'random_strength': 8.756203423306328, 'grow_policy': 'Lossguide', 'min_data_in_leaf': 50, 'max_leaves': 58}. Best is trial 472 with value: 2453.464132483589.[0m
[32m[I 2024-10-13 08:21:05,815][0m Trial 553 finished with value: 6084.214199459406 and parameters: {'depth': 7, 'learning_rate': 0.23541509939047928, 'iterations': 2459, 'l2_leaf_reg': 1.4919866127535103e-07, 'border_count': 41, 'bagging_temperature': 0.7583466672299863, 'random_strength': 1.0427827441960589, 'grow_policy': 'Lossguide', 'min_data_in_leaf': 104, 'max_leaves': 41}. Best is trial 472 with value: 2453.464132483589.[0m
[32m[I 2024-10-13 08:21:09,322][0m Trial 554 finished with value: 2674.8735525541724 and parameters: {'depth': 10, 'learning_rate': 0.19107091089004077, 'iterations': 2685, 'l2_leaf_reg': 3.668107332381436e-08, 'border_count': 46, 'bagging_temperature': 0.507389611853178, 'random_strength': 9.213091499688725, 'grow_policy': 'Lossguide', 'min_data_in_leaf': 79, 'max_leaves': 204}. Best is trial 472 with value: 2453.464132483589.[0m
[32m[I 2024-10-13 08:21:14,768][0m Trial 555 finished with value: 3065.9870687815774 and parameters: {'depth': 7, 'learning_rate': 0.11037864987258361, 'iterations': 2666, 'l2_leaf_reg': 6.75510632489248e-07, 'border_count': 52, 'bagging_temperature': 0.5039150390801744, 'random_strength': 9.23010159830145, 'grow_policy': 'Lossguide', 'min_data_in_leaf': 67, 'max_leaves': 204}. Best is trial 472 with value: 2453.464132483589.[0m
[32m[I 2024-10-13 08:21:20,133][0m Trial 556 finished with value: 3203.149496886412 and parameters: {'depth': 6, 'learning_rate': 0.1414529465027693, 'iterations': 2686, 'l2_leaf_reg': 1.9404248927515215e-08, 'border_count': 47, 'bagging_temperature': 0.4672692247395513, 'random_strength': 8.135915607110254, 'grow_policy': 'Depthwise', 'min_data_in_leaf': 611}. Best is trial 472 with value: 2453.464132483589.[0m
[32m[I 2024-10-13 08:21:24,892][0m Trial 557 finished with value: 3899.4881500380525 and parameters: {'depth': 7, 'learning_rate': 0.17595640617901595, 'iterations': 2574, 'l2_leaf_reg': 2.268018038698387e-08, 'border_count': 57, 'bagging_temperature': 0.4852384046848417, 'random_strength': 9.074837707466832, 'grow_policy': 'Lossguide', 'min_data_in_leaf': 118, 'max_leaves': 196}. Best is trial 472 with value: 2453.464132483589.[0m
[32m[I 2024-10-13 08:21:33,870][0m Trial 558 finished with value: 3512.404051715517 and parameters: {'depth': 7, 'learning_rate': 0.15828717199930292, 'iterations': 2637, 'l2_leaf_reg': 4.7816031070091496e-08, 'border_count': 37, 'bagging_temperature': 0.4734974108289265, 'random_strength': 8.617540382996623, 'grow_policy': 'Lossguide', 'min_data_in_leaf': 34, 'max_leaves': 199}. Best is trial 472 with value: 2453.464132483589.[0m
[32m[I 2024-10-13 08:21:38,242][0m Trial 559 finished with value: 3178.9051008315437 and parameters: {'depth': 7, 'learning_rate': 0.027192514925811772, 'iterations': 2699, 'l2_leaf_reg': 1.9125875603464582e-08, 'border_count': 49, 'bagging_temperature': 0.5021599762091027, 'random_strength': 9.53257716537787, 'grow_policy': 'Lossguide', 'min_data_in_leaf': 79, 'max_leaves': 205}. Best is trial 472 with value: 2453.464132483589.[0m
[32m[I 2024-10-13 08:21:42,879][0m Trial 560 finished with value: 3708.600025661664 and parameters: {'depth': 7, 'learning_rate': 0.19792385888293001, 'iterations': 2733, 'l2_leaf_reg': 4.093304218853083e-08, 'border_count': 53, 'bagging_temperature': 0.515666199033678, 'random_strength': 0.7046850737015536, 'grow_policy': 'Lossguide', 'min_data_in_leaf': 108, 'max_leaves': 64}. Best is trial 472 with value: 2453.464132483589.[0m
[32m[I 2024-10-13 08:21:49,196][0m Trial 561 finished with value: 7396.373820681259 and parameters: {'depth': 10, 'learning_rate': 0.17602199659650924, 'iterations': 2537, 'l2_leaf_reg': 3.289497973300647e-08, 'border_count': 24, 'bagging_temperature': 0.5110299574369123, 'random_strength': 9.482217242009655, 'grow_policy': 'Lossguide', 'min_data_in_leaf': 52, 'max_leaves': 54}. Best is trial 472 with value: 2453.464132483589.[0m
[32m[I 2024-10-13 08:21:54,395][0m Trial 562 finished with value: 2879.4382619424837 and parameters: {'depth': 10, 'learning_rate': 0.0913918974807795, 'iterations': 2599, 'l2_leaf_reg': 0.0024960550464771117, 'border_count': 45, 'bagging_temperature': 0.4810233508330408, 'random_strength': 8.11656668325173, 'grow_policy': 'Lossguide', 'min_data_in_leaf': 85, 'max_leaves': 59}. Best is trial 472 with value: 2453.464132483589.[0m
[32m[I 2024-10-13 08:21:59,490][0m Trial 563 finished with value: 4516.60206746979 and parameters: {'depth': 10, 'learning_rate': 0.005088618110670464, 'iterations': 2763, 'l2_leaf_reg': 1.2161569064291286e-08, 'border_count': 33, 'bagging_temperature': 0.45759946711822574, 'random_strength': 9.954654057987046, 'grow_policy': 'Lossguide', 'min_data_in_leaf': 123, 'max_leaves': 49}. Best is trial 472 with value: 2453.464132483589.[0m
[32m[I 2024-10-13 08:22:03,244][0m Trial 564 finished with value: 3612.464775697852 and parameters: {'depth': 5, 'learning_rate': 0.13116998290946158, 'iterations': 2652, 'l2_leaf_reg': 8.885696879075866e-07, 'border_count': 39, 'bagging_temperature': 0.5373580406743591, 'random_strength': 9.979855942347244, 'grow_policy': 'Depthwise', 'min_data_in_leaf': 70}. Best is trial 472 with value: 2453.464132483589.[0m
[32m[I 2024-10-13 08:22:10,422][0m Trial 565 finished with value: 4928.706321173716 and parameters: {'depth': 7, 'learning_rate': 0.2037817091137089, 'iterations': 2692, 'l2_leaf_reg': 7.923780286332327e-07, 'border_count': 59, 'bagging_temperature': 0.43224683658709995, 'random_strength': 7.7283767714592555, 'grow_policy': 'Lossguide', 'min_data_in_leaf': 16, 'max_leaves': 54}. Best is trial 472 with value: 2453.464132483589.[0m
[32m[I 2024-10-13 08:22:14,298][0m Trial 566 finished with value: 5766.807455633732 and parameters: {'depth': 7, 'learning_rate': 0.16599623886489948, 'iterations': 2795, 'l2_leaf_reg': 1.0084530991961643e-06, 'border_count': 92, 'bagging_temperature': 0.4918665353482722, 'random_strength': 8.424410542041343, 'grow_policy': 'Lossguide', 'min_data_in_leaf': 102, 'max_leaves': 46}. Best is trial 472 with value: 2453.464132483589.[0m
[32m[I 2024-10-13 08:22:18,569][0m Trial 567 finished with value: 4814.294906212887 and parameters: {'depth': 9, 'learning_rate': 0.21066302271274084, 'iterations': 2406, 'l2_leaf_reg': 4.713876097809739e-07, 'border_count': 49, 'bagging_temperature': 0.5228176551020531, 'random_strength': 7.9072707229630295, 'grow_policy': 'Lossguide', 'min_data_in_leaf': 128, 'max_leaves': 96}. Best is trial 472 with value: 2453.464132483589.[0m
[32m[I 2024-10-13 08:22:23,310][0m Trial 568 finished with value: 2888.3241757752326 and parameters: {'depth': 6, 'learning_rate': 0.2282612556498434, 'iterations': 2501, 'l2_leaf_reg': 6.535303293436365e-07, 'border_count': 43, 'bagging_temperature': 0.06410585348037601, 'random_strength': 8.492919710463545, 'grow_policy': 'Lossguide', 'min_data_in_leaf': 86, 'max_leaves': 74}. Best is trial 472 with value: 2453.464132483589.[0m
[32m[I 2024-10-13 08:22:27,094][0m Trial 569 finished with value: 5086.188662690121 and parameters: {'depth': 6, 'learning_rate': 0.19148022759275213, 'iterations': 2732, 'l2_leaf_reg': 3.0426776398272095e-07, 'border_count': 152, 'bagging_temperature': 0.5388052911987364, 'random_strength': 8.972038607509894, 'grow_policy': 'Lossguide', 'min_data_in_leaf': 110, 'max_leaves': 62}. Best is trial 472 with value: 2453.464132483589.[0m
[32m[I 2024-10-13 08:22:32,884][0m Trial 570 finished with value: 5602.632647331009 and parameters: {'depth': 7, 'learning_rate': 0.15805949039882627, 'iterations': 2627, 'l2_leaf_reg': 1.0790295322512568e-06, 'border_count': 11, 'bagging_temperature': 0.502066031692475, 'random_strength': 9.28623278467713, 'grow_policy': 'Lossguide', 'min_data_in_leaf': 54, 'max_leaves': 234}. Best is trial 472 with value: 2453.464132483589.[0m
[32m[I 2024-10-13 08:22:37,558][0m Trial 571 finished with value: 3647.504379562428 and parameters: {'depth': 7, 'learning_rate': 0.2310658988645246, 'iterations': 2822, 'l2_leaf_reg': 4.94026546046638e-07, 'border_count': 54, 'bagging_temperature': 0.5202857251371487, 'random_strength': 7.0834949930433595, 'grow_policy': 'Lossguide', 'min_data_in_leaf': 748, 'max_leaves': 87}. Best is trial 472 with value: 2453.464132483589.[0m
[32m[I 2024-10-13 08:22:42,560][0m Trial 572 finished with value: 3111.5948494878326 and parameters: {'depth': 7, 'learning_rate': 0.19354732434953106, 'iterations': 2572, 'l2_leaf_reg': 3.374277301270396e-05, 'border_count': 46, 'bagging_temperature': 0.5471638971114369, 'random_strength': 6.706420747854349, 'grow_policy': 'Depthwise', 'min_data_in_leaf': 128}. Best is trial 472 with value: 2453.464132483589.[0m
[32m[I 2024-10-13 08:22:47,843][0m Trial 573 finished with value: 3327.6433243668675 and parameters: {'depth': 11, 'learning_rate': 0.25678837688952405, 'iterations': 2704, 'l2_leaf_reg': 2.2390873215040658e-05, 'border_count': 37, 'bagging_temperature': 0.5599038314129219, 'random_strength': 0.6231318964126898, 'grow_policy': 'Lossguide', 'min_data_in_leaf': 71, 'max_leaves': 192}. Best is trial 472 with value: 2453.464132483589.[0m
[32m[I 2024-10-13 08:22:52,166][0m Trial 574 finished with value: 5282.744028069643 and parameters: {'depth': 7, 'learning_rate': 0.1417811416062652, 'iterations': 2299, 'l2_leaf_reg': 9.685198811272205e-07, 'border_count': 66, 'bagging_temperature': 0.5512718261958566, 'random_strength': 0.7527840757279318, 'grow_policy': 'Lossguide', 'min_data_in_leaf': 103, 'max_leaves': 51}. Best is trial 472 with value: 2453.464132483589.[0m
[32m[I 2024-10-13 08:26:18,326][0m Trial 575 finished with value: 4905.446790274034 and parameters: {'depth': 15, 'learning_rate': 0.17834055525449566, 'iterations': 2755, 'l2_leaf_reg': 0.00013339562200020155, 'border_count': 50, 'bagging_temperature': 0.46467539966587323, 'random_strength': 5.404925145740192, 'grow_policy': 'SymmetricTree', 'min_data_in_leaf': 40}. Best is trial 472 with value: 2453.464132483589.[0m
[32m[I 2024-10-13 08:26:21,478][0m Trial 576 finished with value: 3156.5945175775555 and parameters: {'depth': 6, 'learning_rate': 0.21512593062125115, 'iterations': 2855, 'l2_leaf_reg': 9.783469539218473e-06, 'border_count': 42, 'bagging_temperature': 0.4891957254123957, 'random_strength': 0.5727207272345795, 'grow_policy': 'Lossguide', 'min_data_in_leaf': 90, 'max_leaves': 36}. Best is trial 472 with value: 2453.464132483589.[0m
[32m[I 2024-10-13 08:26:24,852][0m Trial 577 finished with value: 5837.350804102771 and parameters: {'depth': 10, 'learning_rate': 0.25725404183881045, 'iterations': 2786, 'l2_leaf_reg': 4.406056391331427e-05, 'border_count': 32, 'bagging_temperature': 0.5117600240060435, 'random_strength': 0.8441369275065698, 'grow_policy': 'Lossguide', 'min_data_in_leaf': 137, 'max_leaves': 44}. Best is trial 472 with value: 2453.464132483589.[0m
[32m[I 2024-10-13 08:26:30,078][0m Trial 578 finished with value: 3640.166693517756 and parameters: {'depth': 7, 'learning_rate': 0.2124657529916909, 'iterations': 2477, 'l2_leaf_reg': 1.6606488704079747e-05, 'border_count': 57, 'bagging_temperature': 0.6532392204965245, 'random_strength': 0.4818244620515651, 'grow_policy': 'Lossguide', 'min_data_in_leaf': 116, 'max_leaves': 57}. Best is trial 472 with value: 2453.464132483589.[0m
[32m[I 2024-10-13 08:26:36,008][0m Trial 579 finished with value: 3022.997013150106 and parameters: {'depth': 7, 'learning_rate': 0.17197896254297992, 'iterations': 2644, 'l2_leaf_reg': 0.00868487948199964, 'border_count': 46, 'bagging_temperature': 0.6345084071940593, 'random_strength': 6.09004747476142, 'grow_policy': 'Lossguide', 'min_data_in_leaf': 62, 'max_leaves': 67}. Best is trial 472 with value: 2453.464132483589.[0m
[32m[I 2024-10-13 08:26:40,944][0m Trial 580 finished with value: 3355.370722904435 and parameters: {'depth': 7, 'learning_rate': 0.26072078775857377, 'iterations': 2533, 'l2_leaf_reg': 6.404658835964117e-07, 'border_count': 39, 'bagging_temperature': 0.41315289746263434, 'random_strength': 5.696369100383187, 'grow_policy': 'Lossguide', 'min_data_in_leaf': 91, 'max_leaves': 37}. Best is trial 472 with value: 2453.464132483589.[0m
[32m[I 2024-10-13 08:26:44,182][0m Trial 581 finished with value: 4457.757858480134 and parameters: {'depth': 9, 'learning_rate': 0.11917134156641711, 'iterations': 2706, 'l2_leaf_reg': 9.484960314991253e-05, 'border_count': 50, 'bagging_temperature': 0.5644492179265258, 'random_strength': 1.3202355058131339, 'grow_policy': 'Lossguide', 'min_data_in_leaf': 133, 'max_leaves': 47}. Best is trial 472 with value: 2453.464132483589.[0m
[32m[I 2024-10-13 08:26:47,943][0m Trial 582 finished with value: 4672.638890206433 and parameters: {'depth': 7, 'learning_rate': 0.23231428483160796, 'iterations': 2878, 'l2_leaf_reg': 7.99228528122879e-08, 'border_count': 127, 'bagging_temperature': 0.5429755819936604, 'random_strength': 7.208588604435471, 'grow_policy': 'Depthwise', 'min_data_in_leaf': 106}. Best is trial 472 with value: 2453.464132483589.[0m
[32m[I 2024-10-13 08:26:53,502][0m Trial 583 finished with value: 3518.6622953501956 and parameters: {'depth': 9, 'learning_rate': 0.18647949011796827, 'iterations': 2804, 'l2_leaf_reg': 3.044971429686281e-08, 'border_count': 40, 'bagging_temperature': 0.631109489806396, 'random_strength': 6.589380623141598, 'grow_policy': 'Lossguide', 'min_data_in_leaf': 78, 'max_leaves': 237}. Best is trial 472 with value: 2453.464132483589.[0m
[32m[I 2024-10-13 08:26:58,371][0m Trial 584 finished with value: 3127.7457645044938 and parameters: {'depth': 7, 'learning_rate': 0.14553177968574385, 'iterations': 2740, 'l2_leaf_reg': 0.0002845237287412153, 'border_count': 45, 'bagging_temperature': 0.6633232913856153, 'random_strength': 0.724240942197025, 'grow_policy': 'Lossguide', 'min_data_in_leaf': 121, 'max_leaves': 208}. Best is trial 472 with value: 2453.464132483589.[0m
[32m[I 2024-10-13 08:27:02,745][0m Trial 585 finished with value: 4267.706739216724 and parameters: {'depth': 14, 'learning_rate': 0.2994851657510056, 'iterations': 2584, 'l2_leaf_reg': 3.636992766260295e-07, 'border_count': 54, 'bagging_temperature': 0.5782102247127422, 'random_strength': 0.41517725376770753, 'grow_policy': 'Lossguide', 'min_data_in_leaf': 140, 'max_leaves': 51}. Best is trial 472 with value: 2453.464132483589.[0m
[32m[I 2024-10-13 08:27:07,283][0m Trial 586 finished with value: 4413.745956784066 and parameters: {'depth': 4, 'learning_rate': 0.20791591485113625, 'iterations': 2661, 'l2_leaf_reg': 3.066514991188808e-05, 'border_count': 35, 'bagging_temperature': 0.6173296515299812, 'random_strength': 0.6311951119152366, 'grow_policy': 'Lossguide', 'min_data_in_leaf': 58, 'max_leaves': 42}. Best is trial 472 with value: 2453.464132483589.[0m
[32m[I 2024-10-13 08:27:12,203][0m Trial 587 finished with value: 3610.996417830326 and parameters: {'depth': 6, 'learning_rate': 0.2454894972041018, 'iterations': 2848, 'l2_leaf_reg': 1.5273439206190484e-06, 'border_count': 61, 'bagging_temperature': 0.5311078210626468, 'random_strength': 0.8465970618737644, 'grow_policy': 'Lossguide', 'min_data_in_leaf': 93, 'max_leaves': 57}. Best is trial 472 with value: 2453.464132483589.[0m
[32m[I 2024-10-13 08:27:13,453][0m Trial 588 finished with value: 4532.837915446519 and parameters: {'depth': 7, 'learning_rate': 0.16253415318257175, 'iterations': 512, 'l2_leaf_reg': 5.160469912443096e-05, 'border_count': 49, 'bagging_temperature': 0.6391602940244402, 'random_strength': 1.1553012195519123, 'grow_policy': 'Lossguide', 'min_data_in_leaf': 110, 'max_leaves': 35}. Best is trial 472 with value: 2453.464132483589.[0m
[32m[I 2024-10-13 08:27:18,316][0m Trial 589 finished with value: 2784.6098067321027 and parameters: {'depth': 8, 'learning_rate': 0.2095158620143839, 'iterations': 2219, 'l2_leaf_reg': 0.00017445049281907172, 'border_count': 43, 'bagging_temperature': 0.5930930848183027, 'random_strength': 8.749185928607002, 'grow_policy': 'Lossguide', 'min_data_in_leaf': 75, 'max_leaves': 53}. Best is trial 472 with value: 2453.464132483589.[0m
[32m[I 2024-10-13 08:27:28,439][0m Trial 590 finished with value: 2979.7537945821955 and parameters: {'depth': 7, 'learning_rate': 0.259197080011184, 'iterations': 2904, 'l2_leaf_reg': 1.8449945744690484e-05, 'border_count': 53, 'bagging_temperature': 0.5607099648911694, 'random_strength': 1.930084511476759, 'grow_policy': 'Depthwise', 'min_data_in_leaf': 44}. Best is trial 472 with value: 2453.464132483589.[0m
[32m[I 2024-10-13 08:27:33,626][0m Trial 591 finished with value: 3242.1302002416 and parameters: {'depth': 8, 'learning_rate': 0.07740818133365499, 'iterations': 2612, 'l2_leaf_reg': 8.18410419022375e-07, 'border_count': 46, 'bagging_temperature': 0.4998740128304642, 'random_strength': 0.3849542368347125, 'grow_policy': 'Lossguide', 'min_data_in_leaf': 141, 'max_leaves': 45}. Best is trial 472 with value: 2453.464132483589.[0m
[32m[I 2024-10-13 08:27:37,703][0m Trial 592 finished with value: 7029.924026888567 and parameters: {'depth': 7, 'learning_rate': 0.1799584781500956, 'iterations': 2446, 'l2_leaf_reg': 1.3168259717943233e-06, 'border_count': 29, 'bagging_temperature': 0.6528211871472182, 'random_strength': 0.5977645037447585, 'grow_policy': 'Lossguide', 'min_data_in_leaf': 99, 'max_leaves': 249}. Best is trial 472 with value: 2453.464132483589.[0m
[32m[I 2024-10-13 08:27:43,740][0m Trial 593 finished with value: 4241.967861786449 and parameters: {'depth': 6, 'learning_rate': 0.041474434284215, 'iterations': 2788, 'l2_leaf_reg': 1.178609024227442e-05, 'border_count': 228, 'bagging_temperature': 0.6158811349908239, 'random_strength': 9.655975644603213, 'grow_policy': 'Lossguide', 'min_data_in_leaf': 73, 'max_leaves': 110}. Best is trial 472 with value: 2453.464132483589.[0m
[32m[I 2024-10-13 08:27:48,513][0m Trial 594 finished with value: 4394.418552815096 and parameters: {'depth': 8, 'learning_rate': 0.012718145571359982, 'iterations': 2695, 'l2_leaf_reg': 2.8384076620943335e-07, 'border_count': 38, 'bagging_temperature': 0.5894143308261752, 'random_strength': 0.9359322808108657, 'grow_policy': 'Lossguide', 'min_data_in_leaf': 122, 'max_leaves': 39}. Best is trial 472 with value: 2453.464132483589.[0m
[32m[I 2024-10-13 08:27:59,556][0m Trial 595 finished with value: 4626.890733345431 and parameters: {'depth': 7, 'learning_rate': 0.22983399212141925, 'iterations': 2956, 'l2_leaf_reg': 2.6313926487201696e-05, 'border_count': 43, 'bagging_temperature': 0.5413892340146247, 'random_strength': 0.36252845584669224, 'grow_policy': 'Lossguide', 'min_data_in_leaf': 20, 'max_leaves': 61}. Best is trial 472 with value: 2453.464132483589.[0m
[32m[I 2024-10-13 08:28:46,731][0m Trial 596 finished with value: 4703.258848443359 and parameters: {'depth': 11, 'learning_rate': 0.2987971780354481, 'iterations': 2850, 'l2_leaf_reg': 5.614724905964773e-07, 'border_count': 49, 'bagging_temperature': 0.5668794534097975, 'random_strength': 8.323779672007461, 'grow_policy': 'SymmetricTree', 'min_data_in_leaf': 99}. Best is trial 472 with value: 2453.464132483589.[0m
[32m[I 2024-10-13 08:28:51,694][0m Trial 597 finished with value: 3700.2098357081427 and parameters: {'depth': 7, 'learning_rate': 0.1977484803464693, 'iterations': 2747, 'l2_leaf_reg': 6.354758892728821e-05, 'border_count': 57, 'bagging_temperature': 0.6303985037988183, 'random_strength': 0.7010132896237173, 'grow_policy': 'Lossguide', 'min_data_in_leaf': 148, 'max_leaves': 48}. Best is trial 472 with value: 2453.464132483589.[0m
[32m[I 2024-10-13 08:28:57,359][0m Trial 598 finished with value: 2841.028185196116 and parameters: {'depth': 8, 'learning_rate': 0.1556443522264309, 'iterations': 2999, 'l2_leaf_reg': 6.9338913713608826e-06, 'border_count': 40, 'bagging_temperature': 0.6031320112924116, 'random_strength': 1.2609494521880178, 'grow_policy': 'Lossguide', 'min_data_in_leaf': 85, 'max_leaves': 42}. Best is trial 472 with value: 2453.464132483589.[0m
[32m[I 2024-10-13 08:29:02,044][0m Trial 599 finished with value: 5444.257815441711 and parameters: {'depth': 9, 'learning_rate': 0.2449438978380979, 'iterations': 2547, 'l2_leaf_reg': 4.284895490978469e-05, 'border_count': 34, 'bagging_temperature': 0.2420039706927759, 'random_strength': 0.27878822847626283, 'grow_policy': 'Depthwise', 'min_data_in_leaf': 119}. Best is trial 472 with value: 2453.464132483589.[0m
[32m[I 2024-10-13 08:29:08,408][0m Trial 600 finished with value: 3460.813952430695 and parameters: {'depth': 8, 'learning_rate': 0.13160450934535434, 'iterations': 2649, 'l2_leaf_reg': 8.786680827140485e-05, 'border_count': 51, 'bagging_temperature': 0.5097735436645008, 'random_strength': 7.853427975339658, 'grow_policy': 'Lossguide', 'min_data_in_leaf': 53, 'max_leaves': 35}. Best is trial 472 with value: 2453.464132483589.[0m
[32m[I 2024-10-13 08:29:11,707][0m Trial 601 finished with value: 4076.239124096303 and parameters: {'depth': 7, 'learning_rate': 0.009198791120513397, 'iterations': 2808, 'l2_leaf_reg': 1.6983348685333455e-05, 'border_count': 46, 'bagging_temperature': 0.6539578237736515, 'random_strength': 0.4923332756247288, 'grow_policy': 'Lossguide', 'min_data_in_leaf': 405, 'max_leaves': 214}. Best is trial 472 with value: 2453.464132483589.[0m
