[32m[I 2024-10-13 08:06:33,023][0m Trial 401 finished with value: 3214.625170707172 and parameters: {'depth': 7, 'learning_rate': 0.22198693449915835, 'iterations': 2769, 'l2_leaf_reg': 4.7930520469708215e-05, 'border_count': 49, 'bagging_temperature': 0.6458384776453351, 'random_strength': 0.3529392873368401, 'grow_policy': 'Lossguide', 'min_data_in_leaf': 81, 'max_leaves': 39}. Best is trial 367 with value: 2557.3553637654795.[0m
[32m[I 2024-10-13 08:06:36,420][0m Trial 402 finished with value: 5327.502676785426 and parameters: {'depth': 8, 'learning_rate': 0.25277087424055467, 'iterations': 2607, 'l2_leaf_reg': 3.211103346950259e-06, 'border_count': 23, 'bagging_temperature': 0.4916881209250695, 'random_strength': 1.5174808000787183, 'grow_policy': 'Lossguide', 'min_data_in_leaf': 145, 'max_leaves': 63}. Best is trial 367 with value: 2557.3553637654795.[0m
[32m[I 2024-10-13 08:06:39,844][0m Trial 403 finished with value: 2851.8660641080273 and parameters: {'depth': 7, 'learning_rate': 0.19729650172070165, 'iterations': 2690, 'l2_leaf_reg': 1.579484985087059e-06, 'border_count': 44, 'bagging_temperature': 0.5723036479112784, 'random_strength': 0.67936651407637, 'grow_policy': 'Lossguide', 'min_data_in_leaf': 123, 'max_leaves': 31}. Best is trial 367 with value: 2557.3553637654795.[0m
[32m[I 2024-10-13 08:06:44,921][0m Trial 404 finished with value: 5382.911579805699 and parameters: {'depth': 7, 'learning_rate': 0.11351105069803767, 'iterations': 2831, 'l2_leaf_reg': 6.509209317034398e-05, 'border_count': 15, 'bagging_temperature': 0.606277640819556, 'random_strength': 0.9960073920575944, 'grow_policy': 'Lossguide', 'min_data_in_leaf': 665, 'max_leaves': 44}. Best is trial 367 with value: 2557.3553637654795.[0m
[32m[I 2024-10-13 08:06:49,229][0m Trial 405 finished with value: 4235.523344602124 and parameters: {'depth': 8, 'learning_rate': 0.1559078497750461, 'iterations': 2544, 'l2_leaf_reg': 2.9959714207751238e-05, 'border_count': 60, 'bagging_temperature': 0.6265588494149703, 'random_strength': 0.1348486608459407, 'grow_policy': 'Lossguide', 'min_data_in_leaf': 105, 'max_leaves': 55}. Best is trial 367 with value: 2557.3553637654795.[0m
[32m[I 2024-10-13 08:06:55,335][0m Trial 406 finished with value: 4344.00841894356 and parameters: {'depth': 7, 'learning_rate': 0.2579101504005453, 'iterations': 2917, 'l2_leaf_reg': 1.085005671369402e-08, 'border_count': 31, 'bagging_temperature': 0.5906572957281944, 'random_strength': 0.5001615566076559, 'grow_policy': 'Lossguide', 'min_data_in_leaf': 65, 'max_leaves': 35}. Best is trial 367 with value: 2557.3553637654795.[0m
[32m[I 2024-10-13 08:07:00,186][0m Trial 407 finished with value: 4923.393005972372 and parameters: {'depth': 7, 'learning_rate': 0.2154672507886096, 'iterations': 2741, 'l2_leaf_reg': 1.8610552933034594e-05, 'border_count': 38, 'bagging_temperature': 0.5438508380568478, 'random_strength': 0.32645315609701864, 'grow_policy': 'Lossguide', 'min_data_in_leaf': 150, 'max_leaves': 50}. Best is trial 367 with value: 2557.3553637654795.[0m
[32m[I 2024-10-13 08:07:05,436][0m Trial 408 finished with value: 3923.613425740346 and parameters: {'depth': 6, 'learning_rate': 0.1811462615087994, 'iterations': 2956, 'l2_leaf_reg': 8.000501189652861e-07, 'border_count': 51, 'bagging_temperature': 0.6609078018712415, 'random_strength': 0.8232659517234333, 'grow_policy': 'Lossguide', 'min_data_in_leaf': 125, 'max_leaves': 41}. Best is trial 367 with value: 2557.3553637654795.[0m
[32m[I 2024-10-13 08:07:09,929][0m Trial 409 finished with value: 2715.9827669235215 and parameters: {'depth': 8, 'learning_rate': 0.24749119693549856, 'iterations': 2465, 'l2_leaf_reg': 0.010081041775202339, 'border_count': 43, 'bagging_temperature': 0.562209100105635, 'random_strength': 0.5571835935381766, 'grow_policy': 'Lossguide', 'min_data_in_leaf': 103, 'max_leaves': 40}. Best is trial 367 with value: 2557.3553637654795.[0m
[32m[I 2024-10-13 08:07:14,866][0m Trial 410 finished with value: 5999.667639344348 and parameters: {'depth': 8, 'learning_rate': 0.26553276824785016, 'iterations': 2430, 'l2_leaf_reg': 0.008755426967490251, 'border_count': 35, 'bagging_temperature': 0.5557411485350167, 'random_strength': 0.0065124068095068766, 'grow_policy': 'Lossguide', 'min_data_in_leaf': 80, 'max_leaves': 35}. Best is trial 367 with value: 2557.3553637654795.[0m
[32m[I 2024-10-13 08:07:15,601][0m Trial 411 finished with value: 5215.678660370967 and parameters: {'depth': 9, 'learning_rate': 0.265091362224698, 'iterations': 231, 'l2_leaf_reg': 0.00023129717492062344, 'border_count': 253, 'bagging_temperature': 0.5680057878475994, 'random_strength': 1.2671384496572764, 'grow_policy': 'Lossguide', 'min_data_in_leaf': 100, 'max_leaves': 47}. Best is trial 367 with value: 2557.3553637654795.[0m
[32m[I 2024-10-13 08:07:20,524][0m Trial 412 finished with value: 4534.086795691694 and parameters: {'depth': 8, 'learning_rate': 0.21451565203473463, 'iterations': 2882, 'l2_leaf_reg': 0.031966352425845904, 'border_count': 42, 'bagging_temperature': 0.5253350576460822, 'random_strength': 6.1148700576098625, 'grow_policy': 'Lossguide', 'min_data_in_leaf': 137, 'max_leaves': 54}. Best is trial 367 with value: 2557.3553637654795.[0m
[32m[I 2024-10-13 08:07:25,456][0m Trial 413 finished with value: 3757.0862287994896 and parameters: {'depth': 8, 'learning_rate': 0.18392292954473247, 'iterations': 2499, 'l2_leaf_reg': 0.0017704239582094377, 'border_count': 56, 'bagging_temperature': 0.5159897957059617, 'random_strength': 0.6164472894647322, 'grow_policy': 'Lossguide', 'min_data_in_leaf': 165, 'max_leaves': 41}. Best is trial 367 with value: 2557.3553637654795.[0m
[32m[I 2024-10-13 08:07:33,629][0m Trial 414 finished with value: 9107.24137252893 and parameters: {'depth': 8, 'learning_rate': 0.2995120622329987, 'iterations': 2316, 'l2_leaf_reg': 0.0001429995693588819, 'border_count': 26, 'bagging_temperature': 0.7000770328721316, 'random_strength': 1.0143303824671526, 'grow_policy': 'Lossguide', 'min_data_in_leaf': 38, 'max_leaves': 31}. Best is trial 367 with value: 2557.3553637654795.[0m
[32m[I 2024-10-13 08:07:38,765][0m Trial 415 finished with value: 2792.432045285177 and parameters: {'depth': 8, 'learning_rate': 0.23401034503804918, 'iterations': 2805, 'l2_leaf_reg': 0.0007029306479706353, 'border_count': 47, 'bagging_temperature': 0.5463204941502285, 'random_strength': 0.7587835054106661, 'grow_policy': 'Lossguide', 'min_data_in_leaf': 90, 'max_leaves': 214}. Best is trial 367 with value: 2557.3553637654795.[0m
[32m[I 2024-10-13 08:08:04,354][0m Trial 416 finished with value: 6061.347333114338 and parameters: {'depth': 8, 'learning_rate': 0.2370274067049467, 'iterations': 2813, 'l2_leaf_reg': 0.0004494301994807413, 'border_count': 68, 'bagging_temperature': 0.5366481614821197, 'random_strength': 2.1347398178862353, 'grow_policy': 'SymmetricTree', 'min_data_in_leaf': 127}. Best is trial 367 with value: 2557.3553637654795.[0m
[32m[I 2024-10-13 08:08:09,487][0m Trial 417 finished with value: 5255.414858705244 and parameters: {'depth': 8, 'learning_rate': 0.24859317643220974, 'iterations': 2881, 'l2_leaf_reg': 0.000827526459889677, 'border_count': 49, 'bagging_temperature': 0.5120934982970722, 'random_strength': 0.8231543530980183, 'grow_policy': 'Lossguide', 'min_data_in_leaf': 151, 'max_leaves': 37}. Best is trial 367 with value: 2557.3553637654795.[0m
[32m[I 2024-10-13 08:08:16,139][0m Trial 418 finished with value: 3300.2366721895232 and parameters: {'depth': 9, 'learning_rate': 0.21824095777505767, 'iterations': 2959, 'l2_leaf_reg': 0.05609169584640935, 'border_count': 40, 'bagging_temperature': 0.5492219249246034, 'random_strength': 1.0021491113254317, 'grow_policy': 'Lossguide', 'min_data_in_leaf': 56, 'max_leaves': 209}. Best is trial 367 with value: 2557.3553637654795.[0m
[32m[I 2024-10-13 08:08:21,327][0m Trial 419 finished with value: 4524.935819182422 and parameters: {'depth': 8, 'learning_rate': 0.2973253887053531, 'iterations': 2806, 'l2_leaf_reg': 0.013225313398951633, 'border_count': 55, 'bagging_temperature': 0.5651805739113214, 'random_strength': 0.7269499055750235, 'grow_policy': 'Depthwise', 'min_data_in_leaf': 557}. Best is trial 367 with value: 2557.3553637654795.[0m
[32m[I 2024-10-13 08:08:25,495][0m Trial 420 finished with value: 2830.2234237009457 and parameters: {'depth': 8, 'learning_rate': 0.2575799356403566, 'iterations': 2864, 'l2_leaf_reg': 0.0004708728616117783, 'border_count': 47, 'bagging_temperature': 0.580269859259068, 'random_strength': 1.3585254267603133, 'grow_policy': 'Lossguide', 'min_data_in_leaf': 920, 'max_leaves': 227}. Best is trial 367 with value: 2557.3553637654795.[0m
[32m[I 2024-10-13 08:08:30,300][0m Trial 421 finished with value: 4891.732958301278 and parameters: {'depth': 8, 'learning_rate': 0.2051768215062237, 'iterations': 2457, 'l2_leaf_reg': 0.0007671434523686076, 'border_count': 88, 'bagging_temperature': 0.5381786505904073, 'random_strength': 1.129180714277757, 'grow_policy': 'Lossguide', 'min_data_in_leaf': 182, 'max_leaves': 214}. Best is trial 367 with value: 2557.3553637654795.[0m
[32m[I 2024-10-13 08:08:32,410][0m Trial 422 finished with value: 6863.3879676427305 and parameters: {'depth': 8, 'learning_rate': 0.23399107480443493, 'iterations': 944, 'l2_leaf_reg': 0.0003736096456763269, 'border_count': 34, 'bagging_temperature': 0.5611964383435958, 'random_strength': 0.5491854010415411, 'grow_policy': 'Lossguide', 'min_data_in_leaf': 97, 'max_leaves': 43}. Best is trial 367 with value: 2557.3553637654795.[0m
[32m[I 2024-10-13 08:08:37,825][0m Trial 423 finished with value: 4971.1148962501475 and parameters: {'depth': 8, 'learning_rate': 0.1952201493117038, 'iterations': 2924, 'l2_leaf_reg': 9.388479332401836e-05, 'border_count': 41, 'bagging_temperature': 0.5880424109697259, 'random_strength': 0.8642401883966908, 'grow_policy': 'Lossguide', 'min_data_in_leaf': 117, 'max_leaves': 35}. Best is trial 367 with value: 2557.3553637654795.[0m
[32m[I 2024-10-13 08:08:43,161][0m Trial 424 finished with value: 4652.941461253854 and parameters: {'depth': 9, 'learning_rate': 0.2627533645270846, 'iterations': 2998, 'l2_leaf_reg': 0.0005395988026417044, 'border_count': 51, 'bagging_temperature': 0.4987627815148536, 'random_strength': 0.5673197987360745, 'grow_policy': 'Lossguide', 'min_data_in_leaf': 141, 'max_leaves': 244}. Best is trial 367 with value: 2557.3553637654795.[0m
[32m[I 2024-10-13 08:08:48,594][0m Trial 425 finished with value: 2737.314414143304 and parameters: {'depth': 8, 'learning_rate': 0.22060797020682596, 'iterations': 2799, 'l2_leaf_reg': 0.0001940772104305832, 'border_count': 45, 'bagging_temperature': 0.6044560768180094, 'random_strength': 0.7439656221268987, 'grow_policy': 'Lossguide', 'min_data_in_leaf': 168, 'max_leaves': 222}. Best is trial 367 with value: 2557.3553637654795.[0m
[32m[I 2024-10-13 08:08:53,469][0m Trial 426 finished with value: 3878.0950198956816 and parameters: {'depth': 8, 'learning_rate': 0.18153070662240936, 'iterations': 2688, 'l2_leaf_reg': 0.00024208744011607413, 'border_count': 61, 'bagging_temperature': 0.5836599651630833, 'random_strength': 1.0491831058460501, 'grow_policy': 'Lossguide', 'min_data_in_leaf': 200, 'max_leaves': 49}. Best is trial 367 with value: 2557.3553637654795.[0m
[32m[I 2024-10-13 08:08:58,957][0m Trial 427 finished with value: 3017.83646901827 and parameters: {'depth': 9, 'learning_rate': 0.21283192667543596, 'iterations': 2733, 'l2_leaf_reg': 0.0010311824250805646, 'border_count': 47, 'bagging_temperature': 0.5537544012245075, 'random_strength': 0.8194572070235158, 'grow_policy': 'Lossguide', 'min_data_in_leaf': 166, 'max_leaves': 223}. Best is trial 367 with value: 2557.3553637654795.[0m
[32m[I 2024-10-13 08:09:03,201][0m Trial 428 finished with value: 4801.767112384752 and parameters: {'depth': 8, 'learning_rate': 0.14640770676473203, 'iterations': 2805, 'l2_leaf_reg': 0.00016039309307880705, 'border_count': 37, 'bagging_temperature': 0.601999013569772, 'random_strength': 0.7388554158266727, 'grow_policy': 'Lossguide', 'min_data_in_leaf': 221, 'max_leaves': 229}. Best is trial 367 with value: 2557.3553637654795.[0m
[32m[I 2024-10-13 08:09:07,904][0m Trial 429 finished with value: 4417.532142332135 and parameters: {'depth': 8, 'learning_rate': 0.2991133766017586, 'iterations': 2642, 'l2_leaf_reg': 0.0014148567147534753, 'border_count': 54, 'bagging_temperature': 0.5753922816791552, 'random_strength': 1.609525261126294, 'grow_policy': 'Lossguide', 'min_data_in_leaf': 171, 'max_leaves': 229}. Best is trial 367 with value: 2557.3553637654795.[0m
[32m[I 2024-10-13 08:09:12,457][0m Trial 430 finished with value: 3898.3660757557363 and parameters: {'depth': 8, 'learning_rate': 0.23052033504987185, 'iterations': 2375, 'l2_leaf_reg': 0.0003502171432239403, 'border_count': 42, 'bagging_temperature': 0.5249960156873656, 'random_strength': 1.20901488257058, 'grow_policy': 'Lossguide', 'min_data_in_leaf': 238, 'max_leaves': 31}. Best is trial 367 with value: 2557.3553637654795.[0m
[32m[I 2024-10-13 08:09:25,862][0m Trial 431 finished with value: 4056.62528684728 and parameters: {'depth': 8, 'learning_rate': 0.02381834054688521, 'iterations': 2772, 'l2_leaf_reg': 0.00021033019260489747, 'border_count': 49, 'bagging_temperature': 0.6067212440897076, 'random_strength': 0.9169751491691707, 'grow_policy': 'Lossguide', 'min_data_in_leaf': 19, 'max_leaves': 45}. Best is trial 367 with value: 2557.3553637654795.[0m
[32m[I 2024-10-13 08:09:31,070][0m Trial 432 finished with value: 5124.213646101116 and parameters: {'depth': 8, 'learning_rate': 0.17539702832483778, 'iterations': 2717, 'l2_leaf_reg': 0.0005881588588065221, 'border_count': 29, 'bagging_temperature': 0.5480534039967038, 'random_strength': 0.6472474047283433, 'grow_policy': 'Lossguide', 'min_data_in_leaf': 157, 'max_leaves': 220}. Best is trial 367 with value: 2557.3553637654795.[0m
[32m[I 2024-10-13 08:09:36,589][0m Trial 433 finished with value: 4286.960563440815 and parameters: {'depth': 8, 'learning_rate': 0.19715829307531207, 'iterations': 2580, 'l2_leaf_reg': 1.10032834355131e-06, 'border_count': 102, 'bagging_temperature': 0.5708492460478011, 'random_strength': 0.5392415982331652, 'grow_policy': 'Lossguide', 'min_data_in_leaf': 64, 'max_leaves': 221}. Best is trial 367 with value: 2557.3553637654795.[0m
[32m[I 2024-10-13 08:09:41,558][0m Trial 434 finished with value: 5027.535909892787 and parameters: {'depth': 9, 'learning_rate': 0.002782924568317141, 'iterations': 2811, 'l2_leaf_reg': 0.000274407500379785, 'border_count': 44, 'bagging_temperature': 0.617886471272218, 'random_strength': 0.43453928033640377, 'grow_policy': 'Lossguide', 'min_data_in_leaf': 193, 'max_leaves': 39}. Best is trial 367 with value: 2557.3553637654795.[0m
[32m[I 2024-10-13 08:09:46,226][0m Trial 435 finished with value: 3894.1141809282763 and parameters: {'depth': 8, 'learning_rate': 0.2614054515297688, 'iterations': 2670, 'l2_leaf_reg': 0.003512649061077188, 'border_count': 57, 'bagging_temperature': 0.5960845862326674, 'random_strength': 0.7297272671504975, 'grow_policy': 'Lossguide', 'min_data_in_leaf': 106, 'max_leaves': 236}. Best is trial 367 with value: 2557.3553637654795.[0m
[32m[I 2024-10-13 08:09:50,273][0m Trial 436 finished with value: 5024.116430792919 and parameters: {'depth': 8, 'learning_rate': 0.22766973771420548, 'iterations': 2472, 'l2_leaf_reg': 1.9548901607358476e-06, 'border_count': 38, 'bagging_temperature': 0.5850206378237812, 'random_strength': 1.053938023219244, 'grow_policy': 'Lossguide', 'min_data_in_leaf': 188, 'max_leaves': 234}. Best is trial 367 with value: 2557.3553637654795.[0m
[32m[I 2024-10-13 08:09:55,263][0m Trial 437 finished with value: 5184.86852950003 and parameters: {'depth': 8, 'learning_rate': 0.19736833030091702, 'iterations': 2856, 'l2_leaf_reg': 0.00012569341461127876, 'border_count': 243, 'bagging_temperature': 0.5336449195846877, 'random_strength': 8.545563647346771, 'grow_policy': 'Lossguide', 'min_data_in_leaf': 143, 'max_leaves': 35}. Best is trial 367 with value: 2557.3553637654795.[0m
[32m[I 2024-10-13 08:10:17,637][0m Trial 438 finished with value: 5670.111336802377 and parameters: {'depth': 7, 'learning_rate': 0.1636737909994727, 'iterations': 2753, 'l2_leaf_reg': 0.00010641021071777871, 'border_count': 51, 'bagging_temperature': 0.6196354919369645, 'random_strength': 1.4164785874850203, 'grow_policy': 'SymmetricTree', 'min_data_in_leaf': 80}. Best is trial 367 with value: 2557.3553637654795.[0m
[32m[I 2024-10-13 08:10:21,951][0m Trial 439 finished with value: 5771.5119670741815 and parameters: {'depth': 7, 'learning_rate': 0.2549135587959582, 'iterations': 2618, 'l2_leaf_reg': 4.534521329864933e-07, 'border_count': 33, 'bagging_temperature': 0.5603353007016615, 'random_strength': 0.46416418958629196, 'grow_policy': 'Lossguide', 'min_data_in_leaf': 161, 'max_leaves': 51}. Best is trial 367 with value: 2557.3553637654795.[0m
[32m[I 2024-10-13 08:10:26,633][0m Trial 440 finished with value: 2819.0999126754928 and parameters: {'depth': 8, 'learning_rate': 0.29778236617971665, 'iterations': 2847, 'l2_leaf_reg': 2.323848640547299e-06, 'border_count': 46, 'bagging_temperature': 0.5974851724319961, 'random_strength': 0.844709704023717, 'grow_policy': 'Lossguide', 'min_data_in_leaf': 112, 'max_leaves': 218}. Best is trial 367 with value: 2557.3553637654795.[0m
[32m[I 2024-10-13 08:10:31,438][0m Trial 441 finished with value: 4918.549189092094 and parameters: {'depth': 6, 'learning_rate': 0.1338724251668303, 'iterations': 2537, 'l2_leaf_reg': 8.258915626313534e-07, 'border_count': 41, 'bagging_temperature': 0.6288845210223122, 'random_strength': 0.6764445255717662, 'grow_policy': 'Lossguide', 'min_data_in_leaf': 136, 'max_leaves': 45}. Best is trial 367 with value: 2557.3553637654795.[0m
[32m[I 2024-10-13 08:10:36,005][0m Trial 442 finished with value: 4058.180398975476 and parameters: {'depth': 9, 'learning_rate': 0.21732071509708956, 'iterations': 2703, 'l2_leaf_reg': 0.01891368079214314, 'border_count': 120, 'bagging_temperature': 0.5765347993179609, 'random_strength': 2.8866735916476136, 'grow_policy': 'Depthwise', 'min_data_in_leaf': 86}. Best is trial 367 with value: 2557.3553637654795.[0m
[32m[I 2024-10-13 08:10:39,374][0m Trial 443 finished with value: 3678.1183634321856 and parameters: {'depth': 7, 'learning_rate': 0.1873884862011979, 'iterations': 2796, 'l2_leaf_reg': 5.487104890681238e-05, 'border_count': 54, 'bagging_temperature': 0.6095776925363607, 'random_strength': 7.5426952972980255, 'grow_policy': 'Lossguide', 'min_data_in_leaf': 179, 'max_leaves': 62}. Best is trial 367 with value: 2557.3553637654795.[0m
[32m[I 2024-10-13 08:10:44,214][0m Trial 444 finished with value: 4240.392769821102 and parameters: {'depth': 8, 'learning_rate': 0.25897936858540194, 'iterations': 2897, 'l2_leaf_reg': 2.447956169960925e-05, 'border_count': 63, 'bagging_temperature': 0.5436526566502636, 'random_strength': 0.3629151669194122, 'grow_policy': 'Lossguide', 'min_data_in_leaf': 209, 'max_leaves': 41}. Best is trial 367 with value: 2557.3553637654795.[0m
[32m[I 2024-10-13 08:10:45,235][0m Trial 445 finished with value: 3265.557433239179 and parameters: {'depth': 8, 'learning_rate': 0.22543481520978415, 'iterations': 623, 'l2_leaf_reg': 1.2827199646789238e-05, 'border_count': 47, 'bagging_temperature': 0.5054920736195604, 'random_strength': 1.098005940076964, 'grow_policy': 'Lossguide', 'min_data_in_leaf': 125, 'max_leaves': 201}. Best is trial 367 with value: 2557.3553637654795.[0m
[32m[I 2024-10-13 08:10:48,952][0m Trial 446 finished with value: 3328.079475451219 and parameters: {'depth': 7, 'learning_rate': 0.2651698955314524, 'iterations': 2781, 'l2_leaf_reg': 0.000163448817531346, 'border_count': 37, 'bagging_temperature': 0.6466040725884771, 'random_strength': 0.5103326701237175, 'grow_policy': 'Lossguide', 'min_data_in_leaf': 63, 'max_leaves': 37}. Best is trial 367 with value: 2557.3553637654795.[0m
[32m[I 2024-10-13 08:10:53,873][0m Trial 447 finished with value: 4412.968670735245 and parameters: {'depth': 7, 'learning_rate': 0.1620810183857799, 'iterations': 2671, 'l2_leaf_reg': 6.143970767572481e-07, 'border_count': 42, 'bagging_temperature': 0.5889572853899495, 'random_strength': 0.3203046188861599, 'grow_policy': 'Lossguide', 'min_data_in_leaf': 157, 'max_leaves': 48}. Best is trial 367 with value: 2557.3553637654795.[0m
[32m[I 2024-10-13 08:10:59,113][0m Trial 448 finished with value: 5030.245662933927 and parameters: {'depth': 7, 'learning_rate': 0.01724810966976567, 'iterations': 2856, 'l2_leaf_reg': 3.321395194339486e-05, 'border_count': 49, 'bagging_temperature': 0.5667914443938438, 'random_strength': 0.9126015001626542, 'grow_policy': 'Lossguide', 'min_data_in_leaf': 101, 'max_leaves': 218}. Best is trial 367 with value: 2557.3553637654795.[0m
[32m[I 2024-10-13 08:11:03,765][0m Trial 449 finished with value: 3682.4922385210925 and parameters: {'depth': 8, 'learning_rate': 0.20138885069640414, 'iterations': 2605, 'l2_leaf_reg': 1.4568433456542279e-06, 'border_count': 57, 'bagging_temperature': 0.6175253025543073, 'random_strength': 0.6055941392894013, 'grow_policy': 'Lossguide', 'min_data_in_leaf': 147, 'max_leaves': 31}. Best is trial 367 with value: 2557.3553637654795.[0m
[32m[I 2024-10-13 08:11:10,641][0m Trial 450 finished with value: 6174.210945625913 and parameters: {'depth': 7, 'learning_rate': 0.0009130189002914573, 'iterations': 2736, 'l2_leaf_reg': 0.07599510839775252, 'border_count': 52, 'bagging_temperature': 0.598971064380274, 'random_strength': 1.2928237231590427, 'grow_policy': 'Lossguide', 'min_data_in_leaf': 45, 'max_leaves': 209}. Best is trial 367 with value: 2557.3553637654795.[0m
