[32m[I 2024-10-13 08:11:16,329][0m Trial 451 finished with value: 2700.5226803493792 and parameters: {'depth': 8, 'learning_rate': 0.2334442169080015, 'iterations': 2942, 'l2_leaf_reg': 1.7898905848848267e-05, 'border_count': 44, 'bagging_temperature': 0.5577720742556791, 'random_strength': 0.2882876493113415, 'grow_policy': 'Lossguide', 'min_data_in_leaf': 117, 'max_leaves': 54}. Best is trial 367 with value: 2557.3553637654795.[0m
[32m[I 2024-10-13 08:11:21,803][0m Trial 452 finished with value: 5741.648202291537 and parameters: {'depth': 7, 'learning_rate': 0.17595769279752513, 'iterations': 2973, 'l2_leaf_reg': 9.964628099625607e-06, 'border_count': 33, 'bagging_temperature': 0.5265818090071935, 'random_strength': 0.2232564138721198, 'grow_policy': 'Lossguide', 'min_data_in_leaf': 81, 'max_leaves': 58}. Best is trial 367 with value: 2557.3553637654795.[0m
[32m[I 2024-10-13 08:11:27,044][0m Trial 453 finished with value: 4904.375926206229 and parameters: {'depth': 7, 'learning_rate': 0.22288033221122, 'iterations': 2940, 'l2_leaf_reg': 1.700298921370539e-05, 'border_count': 37, 'bagging_temperature': 0.6418667251017576, 'random_strength': 0.35109365881913934, 'grow_policy': 'Lossguide', 'min_data_in_leaf': 112, 'max_leaves': 54}. Best is trial 367 with value: 2557.3553637654795.[0m
[32m[I 2024-10-13 08:11:32,371][0m Trial 454 finished with value: 5143.76070845325 and parameters: {'depth': 8, 'learning_rate': 0.1347051467546989, 'iterations': 2914, 'l2_leaf_reg': 4.3529345803406664e-06, 'border_count': 42, 'bagging_temperature': 0.5810479255816269, 'random_strength': 7.195040681799056, 'grow_policy': 'Lossguide', 'min_data_in_leaf': 97, 'max_leaves': 61}. Best is trial 367 with value: 2557.3553637654795.[0m
[32m[I 2024-10-13 08:11:38,096][0m Trial 455 finished with value: 3185.9846118894357 and parameters: {'depth': 9, 'learning_rate': 0.194585423837722, 'iterations': 2993, 'l2_leaf_reg': 1.5335744954416166e-05, 'border_count': 47, 'bagging_temperature': 0.6293925281156009, 'random_strength': 0.23017234264891984, 'grow_policy': 'Lossguide', 'min_data_in_leaf': 126, 'max_leaves': 57}. Best is trial 367 with value: 2557.3553637654795.[0m
[32m[I 2024-10-13 08:11:43,132][0m Trial 456 finished with value: 3308.9658882673216 and parameters: {'depth': 7, 'learning_rate': 0.23017256647751902, 'iterations': 2884, 'l2_leaf_reg': 2.2517355476638293e-05, 'border_count': 51, 'bagging_temperature': 0.558517084410059, 'random_strength': 8.934864817294994, 'grow_policy': 'Lossguide', 'min_data_in_leaf': 68, 'max_leaves': 224}. Best is trial 367 with value: 2557.3553637654795.[0m
[32m[I 2024-10-13 08:11:47,511][0m Trial 457 finished with value: 5842.563435172318 and parameters: {'depth': 6, 'learning_rate': 0.29897270011212473, 'iterations': 2517, 'l2_leaf_reg': 8.099856122723863e-06, 'border_count': 39, 'bagging_temperature': 0.6062183628368207, 'random_strength': 0.45409193395318465, 'grow_policy': 'Lossguide', 'min_data_in_leaf': 109, 'max_leaves': 53}. Best is trial 367 with value: 2557.3553637654795.[0m
[32m[I 2024-10-13 08:11:51,273][0m Trial 458 finished with value: 6774.996762474614 and parameters: {'depth': 8, 'learning_rate': 0.15849436319481652, 'iterations': 2941, 'l2_leaf_reg': 3.2957863363513165e-05, 'border_count': 29, 'bagging_temperature': 0.5377432426644322, 'random_strength': 0.13844664194294531, 'grow_policy': 'Lossguide', 'min_data_in_leaf': 92, 'max_leaves': 212}. Best is trial 367 with value: 2557.3553637654795.[0m
[32m[I 2024-10-13 08:11:54,301][0m Trial 459 finished with value: 3106.4147542462765 and parameters: {'depth': 8, 'learning_rate': 0.18706294947990404, 'iterations': 2406, 'l2_leaf_reg': 3.0618545389406715e-06, 'border_count': 44, 'bagging_temperature': 0.5805392019132658, 'random_strength': 0.35602866616604406, 'grow_policy': 'Lossguide', 'min_data_in_leaf': 132, 'max_leaves': 35}. Best is trial 367 with value: 2557.3553637654795.[0m
[32m[I 2024-10-13 08:11:59,362][0m Trial 460 finished with value: 3589.9408895566785 and parameters: {'depth': 7, 'learning_rate': 0.2343779680530897, 'iterations': 2851, 'l2_leaf_reg': 3.8166804045473704e-07, 'border_count': 57, 'bagging_temperature': 0.6201458794607315, 'random_strength': 0.6043929126802222, 'grow_policy': 'Lossguide', 'min_data_in_leaf': 119, 'max_leaves': 66}. Best is trial 367 with value: 2557.3553637654795.[0m
[32m[I 2024-10-13 08:12:19,825][0m Trial 461 finished with value: 5213.5467569233615 and parameters: {'depth': 7, 'learning_rate': 0.1985148460275041, 'iterations': 2577, 'l2_leaf_reg': 2.0308413669696922e-05, 'border_count': 51, 'bagging_temperature': 0.4875747156308853, 'random_strength': 1.740473600595939, 'grow_policy': 'SymmetricTree', 'min_data_in_leaf': 73}. Best is trial 367 with value: 2557.3553637654795.[0m
[32m[I 2024-10-13 08:12:24,607][0m Trial 462 finished with value: 4376.192243268836 and parameters: {'depth': 6, 'learning_rate': 0.15264740063693835, 'iterations': 2709, 'l2_leaf_reg': 5.058128180655351e-05, 'border_count': 42, 'bagging_temperature': 0.5147338128038109, 'random_strength': 0.16703810044254586, 'grow_policy': 'Lossguide', 'min_data_in_leaf': 170, 'max_leaves': 48}. Best is trial 367 with value: 2557.3553637654795.[0m
[32m[I 2024-10-13 08:12:30,974][0m Trial 463 finished with value: 4156.558767679175 and parameters: {'depth': 9, 'learning_rate': 0.2522235209287891, 'iterations': 2653, 'l2_leaf_reg': 1.4933195741722804e-05, 'border_count': 36, 'bagging_temperature': 0.5967461708018569, 'random_strength': 0.8383812621935376, 'grow_policy': 'Lossguide', 'min_data_in_leaf': 54, 'max_leaves': 53}. Best is trial 367 with value: 2557.3553637654795.[0m
[32m[I 2024-10-13 08:12:35,970][0m Trial 464 finished with value: 2507.228487078205 and parameters: {'depth': 7, 'learning_rate': 0.21509816754802963, 'iterations': 2923, 'l2_leaf_reg': 1.2386211151256998e-06, 'border_count': 47, 'bagging_temperature': 0.6428522928900874, 'random_strength': 0.4955463289809177, 'grow_policy': 'Depthwise', 'min_data_in_leaf': 92}. Best is trial 464 with value: 2507.228487078205.[0m
[32m[I 2024-10-13 08:12:41,427][0m Trial 465 finished with value: 2869.6728688396215 and parameters: {'depth': 8, 'learning_rate': 0.17101853552353477, 'iterations': 2839, 'l2_leaf_reg': 8.965968427206168e-07, 'border_count': 60, 'bagging_temperature': 0.6589206083169025, 'random_strength': 0.5133696867992897, 'grow_policy': 'Depthwise', 'min_data_in_leaf': 78}. Best is trial 464 with value: 2507.228487078205.[0m
[32m[I 2024-10-13 08:12:46,133][0m Trial 466 finished with value: 3745.289371582146 and parameters: {'depth': 7, 'learning_rate': 0.2090287123434817, 'iterations': 2792, 'l2_leaf_reg': 1.789208036916565e-06, 'border_count': 53, 'bagging_temperature': 0.19895626824339507, 'random_strength': 0.9841028595137009, 'grow_policy': 'Depthwise', 'min_data_in_leaf': 100}. Best is trial 464 with value: 2507.228487078205.[0m
[32m[I 2024-10-13 08:13:00,052][0m Trial 467 finished with value: 4525.017902574037 and parameters: {'depth': 8, 'learning_rate': 0.133439555424831, 'iterations': 2897, 'l2_leaf_reg': 1.2573636681686751e-06, 'border_count': 46, 'bagging_temperature': 0.6430377289266959, 'random_strength': 0.3153855117442427, 'grow_policy': 'Depthwise', 'min_data_in_leaf': 22}. Best is trial 464 with value: 2507.228487078205.[0m
[32m[I 2024-10-13 08:13:08,393][0m Trial 468 finished with value: 3304.763628491962 and parameters: {'depth': 7, 'learning_rate': 0.2990169572082639, 'iterations': 2756, 'l2_leaf_reg': 6.136870383993102e-07, 'border_count': 49, 'bagging_temperature': 0.6523185757291371, 'random_strength': 0.7388233383883045, 'grow_policy': 'Depthwise', 'min_data_in_leaf': 46}. Best is trial 464 with value: 2507.228487078205.[0m
[32m[I 2024-10-13 08:13:13,641][0m Trial 469 finished with value: 3513.826850372353 and parameters: {'depth': 7, 'learning_rate': 0.007128462339423502, 'iterations': 2478, 'l2_leaf_reg': 2.323414667694737e-06, 'border_count': 39, 'bagging_temperature': 0.6334498359764775, 'random_strength': 0.0034202735008541096, 'grow_policy': 'Depthwise', 'min_data_in_leaf': 89}. Best is trial 464 with value: 2507.228487078205.[0m
[32m[I 2024-10-13 08:13:18,863][0m Trial 470 finished with value: 5101.351078937901 and parameters: {'depth': 8, 'learning_rate': 0.18160947234248856, 'iterations': 2651, 'l2_leaf_reg': 1.148278986981715e-06, 'border_count': 33, 'bagging_temperature': 0.5521404298711654, 'random_strength': 0.591315774730965, 'grow_policy': 'Depthwise', 'min_data_in_leaf': 108}. Best is trial 464 with value: 2507.228487078205.[0m
[32m[I 2024-10-13 08:13:24,273][0m Trial 471 finished with value: 3010.542605430872 and parameters: {'depth': 7, 'learning_rate': 0.059827391933889945, 'iterations': 2839, 'l2_leaf_reg': 4.846811118474432e-06, 'border_count': 55, 'bagging_temperature': 0.687987713286698, 'random_strength': 1.1282043110880526, 'grow_policy': 'Lossguide', 'min_data_in_leaf': 68, 'max_leaves': 64}. Best is trial 464 with value: 2507.228487078205.[0m
[32m[I 2024-10-13 08:13:29,295][0m Trial 472 finished with value: 2453.464132483589 and parameters: {'depth': 6, 'learning_rate': 0.22694756203609306, 'iterations': 2740, 'l2_leaf_reg': 3.4692392591541025e-07, 'border_count': 45, 'bagging_temperature': 0.6160705845843327, 'random_strength': 8.161210708466216, 'grow_policy': 'Depthwise', 'min_data_in_leaf': 92}. Best is trial 472 with value: 2453.464132483589.[0m
[32m[I 2024-10-13 08:13:45,249][0m Trial 473 finished with value: 5956.108908028761 and parameters: {'depth': 5, 'learning_rate': 0.21685991067902324, 'iterations': 2674, 'l2_leaf_reg': 2.5872612724947113e-07, 'border_count': 67, 'bagging_temperature': 0.6592442179568411, 'random_strength': 6.902080276675157, 'grow_policy': 'SymmetricTree', 'min_data_in_leaf': 127}. Best is trial 472 with value: 2453.464132483589.[0m
[32m[I 2024-10-13 08:13:49,967][0m Trial 474 finished with value: 4801.3197999485 and parameters: {'depth': 6, 'learning_rate': 0.15550230634746062, 'iterations': 2596, 'l2_leaf_reg': 3.1646940231363796e-07, 'border_count': 41, 'bagging_temperature': 0.6270308354506237, 'random_strength': 9.22889080861177, 'grow_policy': 'Depthwise', 'min_data_in_leaf': 118}. Best is trial 472 with value: 2453.464132483589.[0m
[32m[I 2024-10-13 08:13:54,168][0m Trial 475 finished with value: 7085.011925982182 and parameters: {'depth': 6, 'learning_rate': 0.2499301270919876, 'iterations': 2287, 'l2_leaf_reg': 6.41474958959924e-07, 'border_count': 26, 'bagging_temperature': 0.6128294583772466, 'random_strength': 6.420079863822294, 'grow_policy': 'Depthwise', 'min_data_in_leaf': 98}. Best is trial 472 with value: 2453.464132483589.[0m
[32m[I 2024-10-13 08:13:59,147][0m Trial 476 finished with value: 3174.087912782642 and parameters: {'depth': 6, 'learning_rate': 0.19006787274260534, 'iterations': 2714, 'l2_leaf_reg': 2.116446437267703e-07, 'border_count': 43, 'bagging_temperature': 0.673607190826188, 'random_strength': 0.1841595278813135, 'grow_policy': 'Depthwise', 'min_data_in_leaf': 138}. Best is trial 472 with value: 2453.464132483589.[0m
[32m[I 2024-10-13 08:14:04,198][0m Trial 477 finished with value: 4546.9282642404905 and parameters: {'depth': 6, 'learning_rate': 0.26302208114610126, 'iterations': 2747, 'l2_leaf_reg': 3.9406587539028377e-07, 'border_count': 111, 'bagging_temperature': 0.6300359569456102, 'random_strength': 5.6121210450093075, 'grow_policy': 'Lossguide', 'min_data_in_leaf': 73, 'max_leaves': 104}. Best is trial 472 with value: 2453.464132483589.[0m
[32m[I 2024-10-13 08:14:08,719][0m Trial 478 finished with value: 4843.31510625093 and parameters: {'depth': 6, 'learning_rate': 0.11706654377900991, 'iterations': 2514, 'l2_leaf_reg': 8.276527994332485e-07, 'border_count': 36, 'bagging_temperature': 0.6438490930752976, 'random_strength': 0.33704756803762487, 'grow_policy': 'Depthwise', 'min_data_in_leaf': 111}. Best is trial 472 with value: 2453.464132483589.[0m
[32m[I 2024-10-13 08:14:14,470][0m Trial 479 finished with value: 3915.542741691087 and parameters: {'depth': 5, 'learning_rate': 0.21017825200088663, 'iterations': 2628, 'l2_leaf_reg': 1.6519060603221213e-06, 'border_count': 50, 'bagging_temperature': 0.6135613852196451, 'random_strength': 8.27849366360344, 'grow_policy': 'Depthwise', 'min_data_in_leaf': 51}. Best is trial 472 with value: 2453.464132483589.[0m
[32m[I 2024-10-13 08:14:19,945][0m Trial 480 finished with value: 4890.325645345668 and parameters: {'depth': 7, 'learning_rate': 0.2993234600249036, 'iterations': 2891, 'l2_leaf_reg': 1.462092385662963e-07, 'border_count': 213, 'bagging_temperature': 0.5920392672902222, 'random_strength': 0.018995947870040664, 'grow_policy': 'Depthwise', 'min_data_in_leaf': 88}. Best is trial 472 with value: 2453.464132483589.[0m
[32m[I 2024-10-13 08:14:24,735][0m Trial 481 finished with value: 2826.9863861111835 and parameters: {'depth': 7, 'learning_rate': 0.17155219783644016, 'iterations': 2697, 'l2_leaf_reg': 4.4452462966488134e-07, 'border_count': 45, 'bagging_temperature': 0.611114531835692, 'random_strength': 0.40793803675465085, 'grow_policy': 'Depthwise', 'min_data_in_leaf': 133}. Best is trial 472 with value: 2453.464132483589.[0m
[32m[I 2024-10-13 08:14:30,170][0m Trial 482 finished with value: 3476.103992746935 and parameters: {'depth': 7, 'learning_rate': 0.22524882123591744, 'iterations': 2775, 'l2_leaf_reg': 0.006196895378197889, 'border_count': 54, 'bagging_temperature': 0.5777894015690959, 'random_strength': 0.23768915288138295, 'grow_policy': 'Depthwise', 'min_data_in_leaf': 148}. Best is trial 472 with value: 2453.464132483589.[0m
[32m[I 2024-10-13 08:14:34,806][0m Trial 483 finished with value: 4934.329319963576 and parameters: {'depth': 6, 'learning_rate': 0.2560706944174617, 'iterations': 2564, 'l2_leaf_reg': 1.1633104144885784e-06, 'border_count': 39, 'bagging_temperature': 0.6522344319824624, 'random_strength': 0.49418816799163606, 'grow_policy': 'Depthwise', 'min_data_in_leaf': 112}. Best is trial 472 with value: 2453.464132483589.[0m
[32m[I 2024-10-13 08:14:40,229][0m Trial 484 finished with value: 2897.95137273185 and parameters: {'depth': 7, 'learning_rate': 0.1950882639556357, 'iterations': 2852, 'l2_leaf_reg': 5.930109462761422e-07, 'border_count': 48, 'bagging_temperature': 0.6331544946732304, 'random_strength': 7.7974918534785855, 'grow_policy': 'Depthwise', 'min_data_in_leaf': 77}. Best is trial 472 with value: 2453.464132483589.[0m
[32m[I 2024-10-13 08:14:45,299][0m Trial 485 finished with value: 3983.3143581086 and parameters: {'depth': 7, 'learning_rate': 0.14732985533137502, 'iterations': 2936, 'l2_leaf_reg': 2.4128285827911e-06, 'border_count': 59, 'bagging_temperature': 0.5986016008676283, 'random_strength': 1.4482087314139291, 'grow_policy': 'Depthwise', 'min_data_in_leaf': 171}. Best is trial 472 with value: 2453.464132483589.[0m
[32m[I 2024-10-13 08:14:49,789][0m Trial 486 finished with value: 5341.043858601635 and parameters: {'depth': 9, 'learning_rate': 0.21976312788573263, 'iterations': 2446, 'l2_leaf_reg': 2.917542869760838e-06, 'border_count': 30, 'bagging_temperature': 0.6809073572028337, 'random_strength': 8.104257290595129, 'grow_policy': 'Depthwise', 'min_data_in_leaf': 134}. Best is trial 472 with value: 2453.464132483589.[0m
[32m[I 2024-10-13 08:14:53,576][0m Trial 487 finished with value: 2901.3113087240963 and parameters: {'depth': 8, 'learning_rate': 0.16780004576936922, 'iterations': 2723, 'l2_leaf_reg': 5.895511584340228e-05, 'border_count': 43, 'bagging_temperature': 0.5760909825810374, 'random_strength': 2.618975895432622, 'grow_policy': 'Lossguide', 'min_data_in_leaf': 92, 'max_leaves': 59}. Best is trial 472 with value: 2453.464132483589.[0m
[32m[I 2024-10-13 08:14:59,727][0m Trial 488 finished with value: 3967.0773545621464 and parameters: {'depth': 7, 'learning_rate': 0.26439189253057205, 'iterations': 2351, 'l2_leaf_reg': 6.540685275241013e-06, 'border_count': 52, 'bagging_temperature': 0.6155913209704252, 'random_strength': 0.15104406799826198, 'grow_policy': 'Depthwise', 'min_data_in_leaf': 32}. Best is trial 472 with value: 2453.464132483589.[0m
[32m[I 2024-10-13 08:15:03,933][0m Trial 489 finished with value: 4117.7029007896945 and parameters: {'depth': 8, 'learning_rate': 0.0016722217968006198, 'iterations': 2629, 'l2_leaf_reg': 1.0640800946677852e-06, 'border_count': 35, 'bagging_temperature': 0.9756747446804865, 'random_strength': 0.6200267477826946, 'grow_policy': 'Lossguide', 'min_data_in_leaf': 63, 'max_leaves': 48}. Best is trial 472 with value: 2453.464132483589.[0m
[32m[I 2024-10-13 08:15:07,346][0m Trial 490 finished with value: 3086.7091511472076 and parameters: {'depth': 7, 'learning_rate': 0.2007193640265221, 'iterations': 2793, 'l2_leaf_reg': 3.893551469159899e-05, 'border_count': 46, 'bagging_temperature': 0.598836106502153, 'random_strength': 0.360408286133908, 'grow_policy': 'Lossguide', 'min_data_in_leaf': 191, 'max_leaves': 70}. Best is trial 472 with value: 2453.464132483589.[0m
[32m[I 2024-10-13 08:15:11,096][0m Trial 491 finished with value: 5382.91373459682 and parameters: {'depth': 6, 'learning_rate': 0.23889465800979567, 'iterations': 2948, 'l2_leaf_reg': 7.677701300174587e-05, 'border_count': 38, 'bagging_temperature': 0.635966884021429, 'random_strength': 9.749439402344237, 'grow_policy': 'Lossguide', 'min_data_in_leaf': 113, 'max_leaves': 75}. Best is trial 472 with value: 2453.464132483589.[0m
[32m[I 2024-10-13 08:15:16,199][0m Trial 492 finished with value: 3999.5355827316953 and parameters: {'depth': 5, 'learning_rate': 0.17941160959528493, 'iterations': 2879, 'l2_leaf_reg': 2.7712542328177787e-05, 'border_count': 42, 'bagging_temperature': 0.6658389725272693, 'random_strength': 6.733472619612494, 'grow_policy': 'Lossguide', 'min_data_in_leaf': 151, 'max_leaves': 51}. Best is trial 472 with value: 2453.464132483589.[0m
[32m[I 2024-10-13 08:15:20,662][0m Trial 493 finished with value: 5038.993535081964 and parameters: {'depth': 7, 'learning_rate': 0.26514139840377915, 'iterations': 2711, 'l2_leaf_reg': 1.7625735114650459e-06, 'border_count': 50, 'bagging_temperature': 0.5738875622039001, 'random_strength': 0.9161559959344581, 'grow_policy': 'Lossguide', 'min_data_in_leaf': 100, 'max_leaves': 44}. Best is trial 472 with value: 2453.464132483589.[0m
[32m[I 2024-10-13 08:15:25,173][0m Trial 494 finished with value: 4378.75742418765 and parameters: {'depth': 7, 'learning_rate': 0.2987000112763582, 'iterations': 2556, 'l2_leaf_reg': 3.2170873618956757e-07, 'border_count': 57, 'bagging_temperature': 0.5901516972959824, 'random_strength': 0.7093094531329551, 'grow_policy': 'Lossguide', 'min_data_in_leaf': 131, 'max_leaves': 114}. Best is trial 472 with value: 2453.464132483589.[0m
[32m[I 2024-10-13 08:15:30,116][0m Trial 495 finished with value: 5004.7273046257515 and parameters: {'depth': 8, 'learning_rate': 0.21512445409183012, 'iterations': 2775, 'l2_leaf_reg': 1.05086816695787e-05, 'border_count': 202, 'bagging_temperature': 0.6191096075195658, 'random_strength': 0.1898054647445508, 'grow_policy': 'Lossguide', 'min_data_in_leaf': 175, 'max_leaves': 251}. Best is trial 472 with value: 2453.464132483589.[0m
[32m[I 2024-10-13 08:15:34,747][0m Trial 496 finished with value: 4456.345030736298 and parameters: {'depth': 8, 'learning_rate': 0.010666206030143977, 'iterations': 2653, 'l2_leaf_reg': 6.604437346075055e-07, 'border_count': 63, 'bagging_temperature': 0.5625876439550312, 'random_strength': 1.1929560515281625, 'grow_policy': 'Lossguide', 'min_data_in_leaf': 144, 'max_leaves': 55}. Best is trial 472 with value: 2453.464132483589.[0m
[32m[I 2024-10-13 08:15:37,791][0m Trial 497 finished with value: 3369.188988041728 and parameters: {'depth': 4, 'learning_rate': 0.1549256320460138, 'iterations': 1138, 'l2_leaf_reg': 3.3178356817207297e-06, 'border_count': 46, 'bagging_temperature': 0.29799546176157626, 'random_strength': 0.4652087206834432, 'grow_policy': 'Lossguide', 'min_data_in_leaf': 58, 'max_leaves': 40}. Best is trial 472 with value: 2453.464132483589.[0m
[32m[I 2024-10-13 08:15:43,128][0m Trial 498 finished with value: 4935.662059983294 and parameters: {'depth': 8, 'learning_rate': 0.2277928706796893, 'iterations': 2840, 'l2_leaf_reg': 3.901340666856442e-05, 'border_count': 32, 'bagging_temperature': 0.6490560017870307, 'random_strength': 2.3639559004926856, 'grow_policy': 'Lossguide', 'min_data_in_leaf': 81, 'max_leaves': 60}. Best is trial 472 with value: 2453.464132483589.[0m
[32m[I 2024-10-13 08:15:46,468][0m Trial 499 finished with value: 3688.6366887732165 and parameters: {'depth': 7, 'learning_rate': 0.19348019028337377, 'iterations': 2915, 'l2_leaf_reg': 1.3630702391333632e-05, 'border_count': 52, 'bagging_temperature': 0.6062889770407689, 'random_strength': 0.006210169041624247, 'grow_policy': 'Depthwise', 'min_data_in_leaf': 471}. Best is trial 472 with value: 2453.464132483589.[0m
[32m[I 2024-10-13 08:15:49,777][0m Trial 500 finished with value: 4808.182846988161 and parameters: {'depth': 9, 'learning_rate': 0.12526355435822445, 'iterations': 2752, 'l2_leaf_reg': 0.04193512935500163, 'border_count': 40, 'bagging_temperature': 0.5833438273007617, 'random_strength': 0.9403066963116585, 'grow_policy': 'Lossguide', 'min_data_in_leaf': 114, 'max_leaves': 46}. Best is trial 472 with value: 2453.464132483589.[0m
[32m[I 2024-10-13 08:15:54,292][0m Trial 501 finished with value: 3219.904819656669 and parameters: {'depth': 6, 'learning_rate': 0.2524577840018046, 'iterations': 2606, 'l2_leaf_reg': 8.442247186337163e-05, 'border_count': 48, 'bagging_temperature': 0.6275595852458773, 'random_strength': 0.5312170369890856, 'grow_policy': 'Lossguide', 'min_data_in_leaf': 208, 'max_leaves': 51}. Best is trial 472 with value: 2453.464132483589.[0m
