[32m[I 2024-10-13 08:43:56,161][0m Trial 752 finished with value: 3395.864591524227 and parameters: {'depth': 7, 'learning_rate': 0.21267417081197235, 'iterations': 2940, 'l2_leaf_reg': 0.00034616502431073995, 'border_count': 45, 'bagging_temperature': 0.605238442244995, 'random_strength': 0.8080760133180684, 'grow_policy': 'Lossguide', 'min_data_in_leaf': 52, 'max_leaves': 43}. Best is trial 472 with value: 2453.464132483589.[0m
[32m[I 2024-10-13 08:44:13,711][0m Trial 753 finished with value: 6914.512739025222 and parameters: {'depth': 6, 'learning_rate': 0.2634260498108278, 'iterations': 2403, 'l2_leaf_reg': 7.980451717793549e-07, 'border_count': 32, 'bagging_temperature': 0.6367609796407667, 'random_strength': 1.1587633760603415, 'grow_policy': 'SymmetricTree', 'min_data_in_leaf': 96}. Best is trial 472 with value: 2453.464132483589.[0m
[32m[I 2024-10-13 08:44:17,069][0m Trial 754 finished with value: 3217.8393548071153 and parameters: {'depth': 7, 'learning_rate': 0.13423988457294014, 'iterations': 2624, 'l2_leaf_reg': 0.0020677802637706208, 'border_count': 50, 'bagging_temperature': 0.6169845334387289, 'random_strength': 0.6897097992722725, 'grow_policy': 'Lossguide', 'min_data_in_leaf': 71, 'max_leaves': 55}. Best is trial 472 with value: 2453.464132483589.[0m
[32m[I 2024-10-13 08:44:20,368][0m Trial 755 finished with value: 4610.032578663047 and parameters: {'depth': 7, 'learning_rate': 0.18271833421731037, 'iterations': 2753, 'l2_leaf_reg': 0.00022452147744338223, 'border_count': 39, 'bagging_temperature': 0.464445654571105, 'random_strength': 1.522845111707261, 'grow_policy': 'Lossguide', 'min_data_in_leaf': 118, 'max_leaves': 48}. Best is trial 472 with value: 2453.464132483589.[0m
[32m[I 2024-10-13 08:44:24,638][0m Trial 756 finished with value: 2790.3327486011863 and parameters: {'depth': 7, 'learning_rate': 0.23575909801192005, 'iterations': 2269, 'l2_leaf_reg': 6.034326994726595e-06, 'border_count': 46, 'bagging_temperature': 0.5948470643422613, 'random_strength': 7.285241143209918, 'grow_policy': 'Lossguide', 'min_data_in_leaf': 587, 'max_leaves': 216}. Best is trial 472 with value: 2453.464132483589.[0m
[32m[I 2024-10-13 08:44:29,533][0m Trial 757 finished with value: 2733.3832328587446 and parameters: {'depth': 6, 'learning_rate': 0.2979359738932996, 'iterations': 2890, 'l2_leaf_reg': 4.4679300054069196e-07, 'border_count': 57, 'bagging_temperature': 0.4953316227600114, 'random_strength': 0.8770466416828453, 'grow_policy': 'Lossguide', 'min_data_in_leaf': 91, 'max_leaves': 225}. Best is trial 472 with value: 2453.464132483589.[0m
[32m[I 2024-10-13 08:44:36,424][0m Trial 758 finished with value: 5067.027812724224 and parameters: {'depth': 5, 'learning_rate': 0.2728259276892369, 'iterations': 2689, 'l2_leaf_reg': 6.831469054668058e-07, 'border_count': 75, 'bagging_temperature': 0.46164043105955455, 'random_strength': 1.0698267671142712, 'grow_policy': 'Lossguide', 'min_data_in_leaf': 38, 'max_leaves': 219}. Best is trial 472 with value: 2453.464132483589.[0m
[32m[I 2024-10-13 08:44:41,729][0m Trial 759 finished with value: 4562.885391694757 and parameters: {'depth': 6, 'learning_rate': 0.2995398336472991, 'iterations': 2819, 'l2_leaf_reg': 3.8597610463031985e-07, 'border_count': 64, 'bagging_temperature': 0.49196327331360074, 'random_strength': 0.9262534404564428, 'grow_policy': 'Lossguide', 'min_data_in_leaf': 89, 'max_leaves': 215}. Best is trial 472 with value: 2453.464132483589.[0m
[32m[I 2024-10-13 08:44:50,349][0m Trial 760 finished with value: 2899.391779917077 and parameters: {'depth': 6, 'learning_rate': 0.29518749578159986, 'iterations': 2516, 'l2_leaf_reg': 2.4395771756136923e-07, 'border_count': 57, 'bagging_temperature': 0.459655216227145, 'random_strength': 1.4595237755391097, 'grow_policy': 'Depthwise', 'min_data_in_leaf': 69}. Best is trial 472 with value: 2453.464132483589.[0m
[32m[I 2024-10-13 08:44:57,216][0m Trial 761 finished with value: 3476.704850390293 and parameters: {'depth': 6, 'learning_rate': 0.2536388924156556, 'iterations': 2870, 'l2_leaf_reg': 3.992131226322713e-07, 'border_count': 56, 'bagging_temperature': 0.4876534482483081, 'random_strength': 1.169954642317429, 'grow_policy': 'Lossguide', 'min_data_in_leaf': 48, 'max_leaves': 227}. Best is trial 472 with value: 2453.464132483589.[0m
[32m[I 2024-10-13 08:45:02,502][0m Trial 762 finished with value: 4567.884162085731 and parameters: {'depth': 5, 'learning_rate': 0.22271569761920187, 'iterations': 2751, 'l2_leaf_reg': 1.5955276813473208e-07, 'border_count': 65, 'bagging_temperature': 0.39807315409659755, 'random_strength': 0.9351856019873019, 'grow_policy': 'Lossguide', 'min_data_in_leaf': 93, 'max_leaves': 231}. Best is trial 472 with value: 2453.464132483589.[0m
[32m[I 2024-10-13 08:45:08,156][0m Trial 763 finished with value: 3195.323245711469 and parameters: {'depth': 6, 'learning_rate': 0.2556054825046737, 'iterations': 2642, 'l2_leaf_reg': 3.0128622573165815e-07, 'border_count': 61, 'bagging_temperature': 0.5047583015088914, 'random_strength': 1.2172991314495816, 'grow_policy': 'Lossguide', 'min_data_in_leaf': 73, 'max_leaves': 222}. Best is trial 472 with value: 2453.464132483589.[0m
[32m[I 2024-10-13 08:45:13,073][0m Trial 764 finished with value: 3609.4265122942634 and parameters: {'depth': 6, 'learning_rate': 0.19710168691183552, 'iterations': 2578, 'l2_leaf_reg': 5.195309073952354e-07, 'border_count': 53, 'bagging_temperature': 0.5095647911734414, 'random_strength': 0.866589914984067, 'grow_policy': 'Lossguide', 'min_data_in_leaf': 102, 'max_leaves': 229}. Best is trial 472 with value: 2453.464132483589.[0m
[32m[I 2024-10-13 08:45:20,834][0m Trial 765 finished with value: 3923.465290212657 and parameters: {'depth': 6, 'learning_rate': 0.002325592048304948, 'iterations': 2796, 'l2_leaf_reg': 9.220151889399664e-07, 'border_count': 59, 'bagging_temperature': 0.48233074037919715, 'random_strength': 1.2913903044665687, 'grow_policy': 'Lossguide', 'min_data_in_leaf': 61, 'max_leaves': 220}. Best is trial 472 with value: 2453.464132483589.[0m
[32m[I 2024-10-13 08:45:25,466][0m Trial 766 finished with value: 4002.266498323907 and parameters: {'depth': 6, 'learning_rate': 0.1674378663996295, 'iterations': 2699, 'l2_leaf_reg': 5.43408822357889e-07, 'border_count': 52, 'bagging_temperature': 0.5306755767849282, 'random_strength': 0.609648637410134, 'grow_policy': 'Lossguide', 'min_data_in_leaf': 111, 'max_leaves': 222}. Best is trial 472 with value: 2453.464132483589.[0m
[32m[I 2024-10-13 08:45:30,969][0m Trial 767 finished with value: 5793.040982043501 and parameters: {'depth': 6, 'learning_rate': 0.29968384543843085, 'iterations': 2867, 'l2_leaf_reg': 1.2869607208438243e-06, 'border_count': 49, 'bagging_temperature': 0.5140562022083048, 'random_strength': 2.222974435620598, 'grow_policy': 'Lossguide', 'min_data_in_leaf': 875, 'max_leaves': 238}. Best is trial 472 with value: 2453.464132483589.[0m
[32m[I 2024-10-13 08:45:35,438][0m Trial 768 finished with value: 4508.610114280232 and parameters: {'depth': 6, 'learning_rate': 0.20940123397367585, 'iterations': 1863, 'l2_leaf_reg': 3.8911221577737837e-07, 'border_count': 69, 'bagging_temperature': 0.4445703187061935, 'random_strength': 0.834676892766893, 'grow_policy': 'Depthwise', 'min_data_in_leaf': 84}. Best is trial 472 with value: 2453.464132483589.[0m
[32m[I 2024-10-13 08:45:44,798][0m Trial 769 finished with value: 4511.844771828696 and parameters: {'depth': 5, 'learning_rate': 0.14405436603213917, 'iterations': 2509, 'l2_leaf_reg': 7.939580044515602e-07, 'border_count': 56, 'bagging_temperature': 0.4928750673174666, 'random_strength': 0.9796801547270578, 'grow_policy': 'Lossguide', 'min_data_in_leaf': 25, 'max_leaves': 86}. Best is trial 472 with value: 2453.464132483589.[0m
[32m[I 2024-10-13 08:45:50,000][0m Trial 770 finished with value: 5085.027696072494 and parameters: {'depth': 6, 'learning_rate': 0.23877858255155365, 'iterations': 2661, 'l2_leaf_reg': 1.6852047103024508e-07, 'border_count': 49, 'bagging_temperature': 0.5396170906976167, 'random_strength': 8.233112752712607, 'grow_policy': 'Lossguide', 'min_data_in_leaf': 773, 'max_leaves': 226}. Best is trial 472 with value: 2453.464132483589.[0m
[32m[I 2024-10-13 08:45:54,996][0m Trial 771 finished with value: 3152.6374248604902 and parameters: {'depth': 9, 'learning_rate': 0.19463003299898485, 'iterations': 2736, 'l2_leaf_reg': 9.782875365673228e-08, 'border_count': 43, 'bagging_temperature': 0.7424027483611148, 'random_strength': 6.101454142305753, 'grow_policy': 'Lossguide', 'min_data_in_leaf': 104, 'max_leaves': 211}. Best is trial 472 with value: 2453.464132483589.[0m
[32m[I 2024-10-13 08:45:59,889][0m Trial 772 finished with value: 3880.693275044816 and parameters: {'depth': 14, 'learning_rate': 0.29963508490523255, 'iterations': 2450, 'l2_leaf_reg': 0.0008096740309939981, 'border_count': 60, 'bagging_temperature': 0.5075736431896128, 'random_strength': 0.5799366149929719, 'grow_policy': 'Lossguide', 'min_data_in_leaf': 80, 'max_leaves': 232}. Best is trial 472 with value: 2453.464132483589.[0m
[32m[I 2024-10-13 08:46:04,727][0m Trial 773 finished with value: 3270.65123452046 and parameters: {'depth': 6, 'learning_rate': 0.24466020637670235, 'iterations': 2801, 'l2_leaf_reg': 0.01414146095626022, 'border_count': 49, 'bagging_temperature': 0.5559519715107526, 'random_strength': 9.396784127585336, 'grow_policy': 'Lossguide', 'min_data_in_leaf': 55, 'max_leaves': 72}. Best is trial 472 with value: 2453.464132483589.[0m
[32m[I 2024-10-13 08:46:52,874][0m Trial 774 finished with value: 4670.674175829866 and parameters: {'depth': 10, 'learning_rate': 0.1637323325564604, 'iterations': 2606, 'l2_leaf_reg': 0.008046987915305795, 'border_count': 54, 'bagging_temperature': 0.4778542692993414, 'random_strength': 0.7320133752689271, 'grow_policy': 'SymmetricTree', 'min_data_in_leaf': 2}. Best is trial 472 with value: 2453.464132483589.[0m
[32m[I 2024-10-13 08:46:57,240][0m Trial 775 finished with value: 4822.36321213697 and parameters: {'depth': 13, 'learning_rate': 0.2163722123482289, 'iterations': 2377, 'l2_leaf_reg': 3.243858411768007e-07, 'border_count': 42, 'bagging_temperature': 0.9121218067377175, 'random_strength': 7.789218707362178, 'grow_policy': 'Lossguide', 'min_data_in_leaf': 120, 'max_leaves': 223}. Best is trial 472 with value: 2453.464132483589.[0m
[32m[I 2024-10-13 08:47:03,658][0m Trial 776 finished with value: 2834.7903610733206 and parameters: {'depth': 7, 'learning_rate': 0.24416486747039065, 'iterations': 2900, 'l2_leaf_reg': 9.67427240821649e-07, 'border_count': 45, 'bagging_temperature': 0.43230665208017777, 'random_strength': 1.3427236072461808, 'grow_policy': 'Lossguide', 'min_data_in_leaf': 423, 'max_leaves': 64}. Best is trial 472 with value: 2453.464132483589.[0m
[32m[I 2024-10-13 08:47:10,721][0m Trial 777 finished with value: 5802.610678271165 and parameters: {'depth': 8, 'learning_rate': 0.18707974917478407, 'iterations': 2560, 'l2_leaf_reg': 6.41927103025966e-07, 'border_count': 36, 'bagging_temperature': 0.5292944574233978, 'random_strength': 1.0258655271013466, 'grow_policy': 'Depthwise', 'min_data_in_leaf': 91}. Best is trial 472 with value: 2453.464132483589.[0m
[32m[I 2024-10-13 08:47:17,185][0m Trial 778 finished with value: 2814.186294895956 and parameters: {'depth': 7, 'learning_rate': 0.1070694793922293, 'iterations': 2725, 'l2_leaf_reg': 0.00016521761937727215, 'border_count': 53, 'bagging_temperature': 0.5672909468278106, 'random_strength': 1.6080308074549123, 'grow_policy': 'Lossguide', 'min_data_in_leaf': 71, 'max_leaves': 59}. Best is trial 472 with value: 2453.464132483589.[0m
[32m[I 2024-10-13 08:47:22,380][0m Trial 779 finished with value: 5371.120567520417 and parameters: {'depth': 7, 'learning_rate': 0.264831155216346, 'iterations': 2848, 'l2_leaf_reg': 2.266716841942697e-07, 'border_count': 39, 'bagging_temperature': 0.5787915534261882, 'random_strength': 0.35571923322174265, 'grow_policy': 'Lossguide', 'min_data_in_leaf': 113, 'max_leaves': 52}. Best is trial 472 with value: 2453.464132483589.[0m
[32m[I 2024-10-13 08:47:27,208][0m Trial 780 finished with value: 3362.078894689891 and parameters: {'depth': 8, 'learning_rate': 0.1451477922434879, 'iterations': 2677, 'l2_leaf_reg': 0.00034672331842291375, 'border_count': 47, 'bagging_temperature': 0.5436262128432252, 'random_strength': 0.7441367108386608, 'grow_policy': 'Lossguide', 'min_data_in_leaf': 129, 'max_leaves': 56}. Best is trial 472 with value: 2453.464132483589.[0m
[32m[I 2024-10-13 08:47:33,589][0m Trial 781 finished with value: 3639.977286273561 and parameters: {'depth': 10, 'learning_rate': 0.20993840814143835, 'iterations': 2773, 'l2_leaf_reg': 0.0009679832667265357, 'border_count': 43, 'bagging_temperature': 0.12007722700876311, 'random_strength': 0.019889479045355873, 'grow_policy': 'Lossguide', 'min_data_in_leaf': 49, 'max_leaves': 67}. Best is trial 472 with value: 2453.464132483589.[0m
[32m[I 2024-10-13 08:47:38,411][0m Trial 782 finished with value: 4853.114649781565 and parameters: {'depth': 11, 'learning_rate': 0.29993853245990226, 'iterations': 2950, 'l2_leaf_reg': 4.3991334099897247e-07, 'border_count': 219, 'bagging_temperature': 0.5832153716115295, 'random_strength': 8.60632136890317, 'grow_policy': 'Lossguide', 'min_data_in_leaf': 93, 'max_leaves': 49}. Best is trial 472 with value: 2453.464132483589.[0m
[32m[I 2024-10-13 08:47:42,010][0m Trial 783 finished with value: 3307.1884228050176 and parameters: {'depth': 7, 'learning_rate': 0.17246605864555253, 'iterations': 2637, 'l2_leaf_reg': 1.761242218414774e-06, 'border_count': 51, 'bagging_temperature': 0.6001564781454245, 'random_strength': 0.4824602856732674, 'grow_policy': 'Lossguide', 'min_data_in_leaf': 75, 'max_leaves': 129}. Best is trial 472 with value: 2453.464132483589.[0m
[32m[I 2024-10-13 08:47:46,854][0m Trial 784 finished with value: 4580.639227348248 and parameters: {'depth': 6, 'learning_rate': 0.003923037511787853, 'iterations': 2484, 'l2_leaf_reg': 0.0006033294922683892, 'border_count': 60, 'bagging_temperature': 0.620159344409296, 'random_strength': 1.0856490865774429, 'grow_policy': 'Lossguide', 'min_data_in_leaf': 101, 'max_leaves': 194}. Best is trial 472 with value: 2453.464132483589.[0m
[32m[I 2024-10-13 08:47:52,126][0m Trial 785 finished with value: 5589.769293330869 and parameters: {'depth': 9, 'learning_rate': 0.22940923553556483, 'iterations': 2819, 'l2_leaf_reg': 5.643968401285682e-07, 'border_count': 34, 'bagging_temperature': 0.5023549197195039, 'random_strength': 6.810682179505395, 'grow_policy': 'Lossguide', 'min_data_in_leaf': 130, 'max_leaves': 226}. Best is trial 472 with value: 2453.464132483589.[0m
[32m[I 2024-10-13 08:48:03,324][0m Trial 786 finished with value: 3398.174654334594 and parameters: {'depth': 7, 'learning_rate': 0.1920981224833788, 'iterations': 2898, 'l2_leaf_reg': 0.00014869288549095662, 'border_count': 40, 'bagging_temperature': 0.524940371641426, 'random_strength': 0.17761505834818714, 'grow_policy': 'Depthwise', 'min_data_in_leaf': 37}. Best is trial 472 with value: 2453.464132483589.[0m
[32m[I 2024-10-13 08:48:08,835][0m Trial 787 finished with value: 3089.482400832408 and parameters: {'depth': 8, 'learning_rate': 0.259818843764456, 'iterations': 2580, 'l2_leaf_reg': 6.375244288326961e-08, 'border_count': 48, 'bagging_temperature': 0.5589247212718302, 'random_strength': 6.4734317336568905, 'grow_policy': 'Lossguide', 'min_data_in_leaf': 65, 'max_leaves': 61}. Best is trial 472 with value: 2453.464132483589.[0m
[32m[I 2024-10-13 08:48:14,551][0m Trial 788 finished with value: 3565.263032358478 and parameters: {'depth': 5, 'learning_rate': 0.15881206741727405, 'iterations': 2994, 'l2_leaf_reg': 2.8739146024140004e-06, 'border_count': 54, 'bagging_temperature': 0.6015414735086317, 'random_strength': 0.6949588775138273, 'grow_policy': 'Lossguide', 'min_data_in_leaf': 114, 'max_leaves': 54}. Best is trial 472 with value: 2453.464132483589.[0m
[32m[I 2024-10-13 08:48:19,705][0m Trial 789 finished with value: 2649.796043884317 and parameters: {'depth': 7, 'learning_rate': 0.2172130019309364, 'iterations': 2722, 'l2_leaf_reg': 1.390002214549204e-06, 'border_count': 44, 'bagging_temperature': 0.5847014844235694, 'random_strength': 0.3539743936864341, 'grow_policy': 'Lossguide', 'min_data_in_leaf': 90, 'max_leaves': 46}. Best is trial 472 with value: 2453.464132483589.[0m
[32m[I 2024-10-13 08:48:25,264][0m Trial 790 finished with value: 3373.86360864835 and parameters: {'depth': 7, 'learning_rate': 0.2121732902875083, 'iterations': 2681, 'l2_leaf_reg': 1.388460364044347e-06, 'border_count': 38, 'bagging_temperature': 0.5413341525444799, 'random_strength': 0.298990784069329, 'grow_policy': 'Lossguide', 'min_data_in_leaf': 88, 'max_leaves': 48}. Best is trial 472 with value: 2453.464132483589.[0m
[32m[I 2024-10-13 08:48:29,306][0m Trial 791 finished with value: 3439.094350957219 and parameters: {'depth': 7, 'learning_rate': 0.1351111971777183, 'iterations': 2619, 'l2_leaf_reg': 1.2003782541216067e-06, 'border_count': 44, 'bagging_temperature': 0.5699357315907472, 'random_strength': 0.1520509404469354, 'grow_policy': 'Lossguide', 'min_data_in_leaf': 54, 'max_leaves': 44}. Best is trial 472 with value: 2453.464132483589.[0m
[32m[I 2024-10-13 08:48:34,333][0m Trial 792 finished with value: 6959.28231733446 and parameters: {'depth': 7, 'learning_rate': 0.1767741884105297, 'iterations': 2530, 'l2_leaf_reg': 3.3311127211766958e-06, 'border_count': 29, 'bagging_temperature': 0.3188263733803054, 'random_strength': 0.01685448820853014, 'grow_policy': 'Lossguide', 'min_data_in_leaf': 79, 'max_leaves': 51}. Best is trial 472 with value: 2453.464132483589.[0m
[32m[I 2024-10-13 08:48:39,370][0m Trial 793 finished with value: 2827.6468160382574 and parameters: {'depth': 7, 'learning_rate': 0.2595300308672589, 'iterations': 2702, 'l2_leaf_reg': 1.0886669104486262e-06, 'border_count': 48, 'bagging_temperature': 0.8642748089237441, 'random_strength': 0.3848903804712177, 'grow_policy': 'Lossguide', 'min_data_in_leaf': 96, 'max_leaves': 45}. Best is trial 472 with value: 2453.464132483589.[0m
[32m[I 2024-10-13 08:48:44,659][0m Trial 794 finished with value: 4525.658140509284 and parameters: {'depth': 6, 'learning_rate': 0.22996201805946997, 'iterations': 2328, 'l2_leaf_reg': 1.9658570702881322e-06, 'border_count': 35, 'bagging_temperature': 0.47244843624314764, 'random_strength': 0.29374495826823555, 'grow_policy': 'Depthwise', 'min_data_in_leaf': 65}. Best is trial 472 with value: 2453.464132483589.[0m
[32m[I 2024-10-13 08:48:47,806][0m Trial 795 finished with value: 4437.814961050415 and parameters: {'depth': 6, 'learning_rate': 0.19740935766552342, 'iterations': 1456, 'l2_leaf_reg': 1.768965645103995e-06, 'border_count': 41, 'bagging_temperature': 0.5202257106376884, 'random_strength': 0.47853028903878647, 'grow_policy': 'Lossguide', 'min_data_in_leaf': 89, 'max_leaves': 41}. Best is trial 472 with value: 2453.464132483589.[0m
[32m[I 2024-10-13 08:48:52,405][0m Trial 796 finished with value: 3982.055254574891 and parameters: {'depth': 7, 'learning_rate': 0.254878220736168, 'iterations': 2619, 'l2_leaf_reg': 8.301937993651888e-07, 'border_count': 56, 'bagging_temperature': 0.5532195695323064, 'random_strength': 0.00038132254698725054, 'grow_policy': 'Lossguide', 'min_data_in_leaf': 107, 'max_leaves': 56}. Best is trial 472 with value: 2453.464132483589.[0m
[32m[I 2024-10-13 08:48:59,157][0m Trial 797 finished with value: 3462.0450943118353 and parameters: {'depth': 7, 'learning_rate': 0.15991796288557428, 'iterations': 2426, 'l2_leaf_reg': 7.628262399166486e-07, 'border_count': 52, 'bagging_temperature': 0.5818325958729902, 'random_strength': 0.5246267819912089, 'grow_policy': 'Lossguide', 'min_data_in_leaf': 46, 'max_leaves': 50}. Best is trial 472 with value: 2453.464132483589.[0m
[32m[I 2024-10-13 08:49:40,627][0m Trial 798 finished with value: 5857.079585503356 and parameters: {'depth': 11, 'learning_rate': 0.2995466986364107, 'iterations': 2666, 'l2_leaf_reg': 1.466599732685823e-06, 'border_count': 66, 'bagging_temperature': 0.6904656729323129, 'random_strength': 0.23838903164548186, 'grow_policy': 'SymmetricTree', 'min_data_in_leaf': 73}. Best is trial 472 with value: 2453.464132483589.[0m
[32m[I 2024-10-13 08:49:44,726][0m Trial 799 finished with value: 3083.818119216743 and parameters: {'depth': 7, 'learning_rate': 0.1905547157953729, 'iterations': 2723, 'l2_leaf_reg': 4.7637564286748837e-07, 'border_count': 46, 'bagging_temperature': 0.5888401446680995, 'random_strength': 0.47313886252733506, 'grow_policy': 'Lossguide', 'min_data_in_leaf': 101, 'max_leaves': 43}. Best is trial 472 with value: 2453.464132483589.[0m
[32m[I 2024-10-13 08:49:50,639][0m Trial 800 finished with value: 3546.304498282039 and parameters: {'depth': 7, 'learning_rate': 0.04962926565539374, 'iterations': 2546, 'l2_leaf_reg': 3.034582590729117e-06, 'border_count': 40, 'bagging_temperature': 0.5641170200303594, 'random_strength': 0.20777684285109443, 'grow_policy': 'Lossguide', 'min_data_in_leaf': 28, 'max_leaves': 63}. Best is trial 472 with value: 2453.464132483589.[0m
[32m[I 2024-10-13 08:49:54,031][0m Trial 801 finished with value: 3666.181620154999 and parameters: {'depth': 7, 'learning_rate': 0.22569314382591088, 'iterations': 2742, 'l2_leaf_reg': 2.8902608680445824e-07, 'border_count': 50, 'bagging_temperature': 0.4918300831382124, 'random_strength': 0.5627345229341713, 'grow_policy': 'Lossguide', 'min_data_in_leaf': 77, 'max_leaves': 47}. Best is trial 472 with value: 2453.464132483589.[0m
