[32m[I 2024-10-13 08:34:24,540][0m Trial 652 finished with value: 4972.18190757444 and parameters: {'depth': 8, 'learning_rate': 0.22568537465631472, 'iterations': 2521, 'l2_leaf_reg': 0.001413691749261934, 'border_count': 51, 'bagging_temperature': 0.608017571714888, 'random_strength': 0.35567489431552657, 'grow_policy': 'Depthwise', 'min_data_in_leaf': 104}. Best is trial 472 with value: 2453.464132483589.[0m
[32m[I 2024-10-13 08:34:31,068][0m Trial 653 finished with value: 3706.745017939112 and parameters: {'depth': 7, 'learning_rate': 0.186939610132248, 'iterations': 2680, 'l2_leaf_reg': 1.3702338921061841e-05, 'border_count': 60, 'bagging_temperature': 0.6232384609193202, 'random_strength': 7.950998891837724, 'grow_policy': 'Lossguide', 'min_data_in_leaf': 55, 'max_leaves': 203}. Best is trial 472 with value: 2453.464132483589.[0m
[32m[I 2024-10-13 08:34:37,052][0m Trial 654 finished with value: 3206.846990600886 and parameters: {'depth': 8, 'learning_rate': 0.2595362213541018, 'iterations': 2955, 'l2_leaf_reg': 7.88813583149663e-06, 'border_count': 43, 'bagging_temperature': 0.5781799450550819, 'random_strength': 9.400658723661065, 'grow_policy': 'Lossguide', 'min_data_in_leaf': 82, 'max_leaves': 47}. Best is trial 472 with value: 2453.464132483589.[0m
[32m[I 2024-10-13 08:34:42,413][0m Trial 655 finished with value: 4785.417729587407 and parameters: {'depth': 7, 'learning_rate': 0.22316178406553483, 'iterations': 2630, 'l2_leaf_reg': 0.032336481011258224, 'border_count': 37, 'bagging_temperature': 0.5409717608704375, 'random_strength': 8.272771174406124, 'grow_policy': 'Lossguide', 'min_data_in_leaf': 168, 'max_leaves': 31}. Best is trial 472 with value: 2453.464132483589.[0m
[32m[I 2024-10-13 08:34:47,274][0m Trial 656 finished with value: 5655.078128014167 and parameters: {'depth': 7, 'learning_rate': 0.15472007130466067, 'iterations': 2866, 'l2_leaf_reg': 9.049778871755403e-05, 'border_count': 177, 'bagging_temperature': 0.5965661639186892, 'random_strength': 0.7868480717425574, 'grow_policy': 'Lossguide', 'min_data_in_leaf': 127, 'max_leaves': 42}. Best is trial 472 with value: 2453.464132483589.[0m
[32m[I 2024-10-13 08:34:52,244][0m Trial 657 finished with value: 24125.44989450843 and parameters: {'depth': 6, 'learning_rate': 0.00013618275984818217, 'iterations': 2777, 'l2_leaf_reg': 2.9805024356468577e-05, 'border_count': 55, 'bagging_temperature': 0.6559705295305546, 'random_strength': 1.02629463493851, 'grow_policy': 'Lossguide', 'min_data_in_leaf': 106, 'max_leaves': 56}. Best is trial 472 with value: 2453.464132483589.[0m
[32m[I 2024-10-13 08:34:57,199][0m Trial 658 finished with value: 2773.154652409344 and parameters: {'depth': 7, 'learning_rate': 0.12069771624528419, 'iterations': 2708, 'l2_leaf_reg': 1.8933229962147797e-05, 'border_count': 47, 'bagging_temperature': 0.5662879394516036, 'random_strength': 8.92235427752176, 'grow_policy': 'Lossguide', 'min_data_in_leaf': 70, 'max_leaves': 35}. Best is trial 472 with value: 2453.464132483589.[0m
[32m[I 2024-10-13 08:35:01,310][0m Trial 659 finished with value: 4748.957343970254 and parameters: {'depth': 8, 'learning_rate': 0.19076583445920461, 'iterations': 2572, 'l2_leaf_reg': 5.562044994552576e-05, 'border_count': 41, 'bagging_temperature': 0.6324943859972902, 'random_strength': 0.0013514757777262076, 'grow_policy': 'Lossguide', 'min_data_in_leaf': 838, 'max_leaves': 49}. Best is trial 472 with value: 2453.464132483589.[0m
[32m[I 2024-10-13 08:35:06,239][0m Trial 660 finished with value: 3643.703980696569 and parameters: {'depth': 11, 'learning_rate': 0.23164304513737052, 'iterations': 2807, 'l2_leaf_reg': 2.6639207113052228e-08, 'border_count': 50, 'bagging_temperature': 0.6900219429596356, 'random_strength': 5.258637154281882, 'grow_policy': 'Depthwise', 'min_data_in_leaf': 88}. Best is trial 472 with value: 2453.464132483589.[0m
[32m[I 2024-10-13 08:35:06,899][0m Trial 661 finished with value: 4660.169914961674 and parameters: {'depth': 7, 'learning_rate': 0.26046628914406705, 'iterations': 177, 'l2_leaf_reg': 5.3529485631812855e-06, 'border_count': 35, 'bagging_temperature': 0.5889353945578232, 'random_strength': 0.4683520520080048, 'grow_policy': 'Lossguide', 'min_data_in_leaf': 136, 'max_leaves': 40}. Best is trial 472 with value: 2453.464132483589.[0m
[32m[I 2024-10-13 08:35:11,655][0m Trial 662 finished with value: 2970.219677405862 and parameters: {'depth': 7, 'learning_rate': 0.1720806505053585, 'iterations': 2662, 'l2_leaf_reg': 3.23028874642664e-07, 'border_count': 47, 'bagging_temperature': 0.611722168560656, 'random_strength': 0.6936948729105857, 'grow_policy': 'Lossguide', 'min_data_in_leaf': 118, 'max_leaves': 58}. Best is trial 472 with value: 2453.464132483589.[0m
[32m[I 2024-10-13 08:35:37,833][0m Trial 663 finished with value: 5466.133017271857 and parameters: {'depth': 8, 'learning_rate': 0.20495112196630277, 'iterations': 2942, 'l2_leaf_reg': 4.022059618090485e-05, 'border_count': 41, 'bagging_temperature': 0.5601424164079094, 'random_strength': 9.798195485263216, 'grow_policy': 'SymmetricTree', 'min_data_in_leaf': 162}. Best is trial 472 with value: 2453.464132483589.[0m
[32m[I 2024-10-13 08:35:45,282][0m Trial 664 finished with value: 2810.1568354851615 and parameters: {'depth': 10, 'learning_rate': 0.29804593805562307, 'iterations': 2857, 'l2_leaf_reg': 1.077742491730105e-07, 'border_count': 56, 'bagging_temperature': 0.6442523696710957, 'random_strength': 0.3739506368383503, 'grow_policy': 'Lossguide', 'min_data_in_leaf': 49, 'max_leaves': 133}. Best is trial 472 with value: 2453.464132483589.[0m
[32m[I 2024-10-13 08:35:50,289][0m Trial 665 finished with value: 2639.9950068429257 and parameters: {'depth': 8, 'learning_rate': 0.2306324888989571, 'iterations': 2461, 'l2_leaf_reg': 0.0002628486519929391, 'border_count': 45, 'bagging_temperature': 0.531737004921668, 'random_strength': 0.9526431121310138, 'grow_policy': 'Lossguide', 'min_data_in_leaf': 94, 'max_leaves': 69}. Best is trial 472 with value: 2453.464132483589.[0m
[32m[I 2024-10-13 08:35:54,599][0m Trial 666 finished with value: 6673.351376497206 and parameters: {'depth': 9, 'learning_rate': 0.1482737579797006, 'iterations': 2377, 'l2_leaf_reg': 0.0003314414813657182, 'border_count': 31, 'bagging_temperature': 0.5166650107631785, 'random_strength': 1.2144384074254657, 'grow_policy': 'Lossguide', 'min_data_in_leaf': 88, 'max_leaves': 71}. Best is trial 472 with value: 2453.464132483589.[0m
[32m[I 2024-10-13 08:35:59,825][0m Trial 667 finished with value: 7745.302986966496 and parameters: {'depth': 7, 'learning_rate': 0.17677341039264727, 'iterations': 2448, 'l2_leaf_reg': 0.000373173280225217, 'border_count': 17, 'bagging_temperature': 0.5260715741568978, 'random_strength': 1.405687506260332, 'grow_policy': 'Lossguide', 'min_data_in_leaf': 65, 'max_leaves': 68}. Best is trial 472 with value: 2453.464132483589.[0m
[32m[I 2024-10-13 08:36:04,896][0m Trial 668 finished with value: 5972.845441658804 and parameters: {'depth': 7, 'learning_rate': 0.20621147954849428, 'iterations': 2502, 'l2_leaf_reg': 0.0007135887269424562, 'border_count': 38, 'bagging_temperature': 0.5284381167456645, 'random_strength': 1.0459041689102273, 'grow_policy': 'Lossguide', 'min_data_in_leaf': 96, 'max_leaves': 77}. Best is trial 472 with value: 2453.464132483589.[0m
[32m[I 2024-10-13 08:36:10,795][0m Trial 669 finished with value: 3309.512756301241 and parameters: {'depth': 8, 'learning_rate': 0.11089182709389801, 'iterations': 2346, 'l2_leaf_reg': 0.00015538797788077873, 'border_count': 44, 'bagging_temperature': 0.5354143586463896, 'random_strength': 1.1530334522951406, 'grow_policy': 'Lossguide', 'min_data_in_leaf': 31, 'max_leaves': 69}. Best is trial 472 with value: 2453.464132483589.[0m
[32m[I 2024-10-13 08:36:16,256][0m Trial 670 finished with value: 3528.012587412402 and parameters: {'depth': 7, 'learning_rate': 0.006174586551972966, 'iterations': 2402, 'l2_leaf_reg': 0.0006362883009859617, 'border_count': 52, 'bagging_temperature': 0.561350911909951, 'random_strength': 1.6496130217959868, 'grow_policy': 'Depthwise', 'min_data_in_leaf': 73}. Best is trial 472 with value: 2453.464132483589.[0m
[32m[I 2024-10-13 08:36:20,678][0m Trial 671 finished with value: 2835.8416307563816 and parameters: {'depth': 9, 'learning_rate': 0.17874739239343373, 'iterations': 2426, 'l2_leaf_reg': 0.0005662206384462174, 'border_count': 46, 'bagging_temperature': 0.7235529848792527, 'random_strength': 0.937581827886651, 'grow_policy': 'Lossguide', 'min_data_in_leaf': 102, 'max_leaves': 64}. Best is trial 472 with value: 2453.464132483589.[0m
[32m[I 2024-10-13 08:36:25,531][0m Trial 672 finished with value: 3981.0978094809925 and parameters: {'depth': 8, 'learning_rate': 0.13112405698025806, 'iterations': 2491, 'l2_leaf_reg': 0.0003036889605529867, 'border_count': 39, 'bagging_temperature': 0.5430339051357107, 'random_strength': 0.8916107415170423, 'grow_policy': 'Lossguide', 'min_data_in_leaf': 77, 'max_leaves': 72}. Best is trial 472 with value: 2453.464132483589.[0m
[32m[I 2024-10-13 08:36:31,240][0m Trial 673 finished with value: 3701.1271510235497 and parameters: {'depth': 6, 'learning_rate': 0.21897915226805614, 'iterations': 2453, 'l2_leaf_reg': 0.00022704668945846472, 'border_count': 50, 'bagging_temperature': 0.6646859783083521, 'random_strength': 1.5214024913218445, 'grow_policy': 'Lossguide', 'min_data_in_leaf': 54, 'max_leaves': 63}. Best is trial 472 with value: 2453.464132483589.[0m
[32m[I 2024-10-13 08:36:34,167][0m Trial 674 finished with value: 5009.814116085586 and parameters: {'depth': 7, 'learning_rate': 0.15279964316238193, 'iterations': 2293, 'l2_leaf_reg': 7.230614094412815e-07, 'border_count': 35, 'bagging_temperature': 0.628852206564807, 'random_strength': 1.2629340189543488, 'grow_policy': 'Lossguide', 'min_data_in_leaf': 112, 'max_leaves': 61}. Best is trial 472 with value: 2453.464132483589.[0m
[32m[I 2024-10-13 08:36:38,503][0m Trial 675 finished with value: 2713.9637019101847 and parameters: {'depth': 7, 'learning_rate': 0.23497374294989626, 'iterations': 2521, 'l2_leaf_reg': 0.00020485608854161485, 'border_count': 43, 'bagging_temperature': 0.6780292569953106, 'random_strength': 0.7724479084434769, 'grow_policy': 'Lossguide', 'min_data_in_leaf': 90, 'max_leaves': 65}. Best is trial 472 with value: 2453.464132483589.[0m
[32m[I 2024-10-13 08:36:43,039][0m Trial 676 finished with value: 7126.603093979471 and parameters: {'depth': 8, 'learning_rate': 0.0017335545789600398, 'iterations': 2518, 'l2_leaf_reg': 0.00033652171642649164, 'border_count': 78, 'bagging_temperature': 0.6518282132128077, 'random_strength': 0.6772080996046043, 'grow_policy': 'Lossguide', 'min_data_in_leaf': 116, 'max_leaves': 67}. Best is trial 472 with value: 2453.464132483589.[0m
[32m[I 2024-10-13 08:36:47,483][0m Trial 677 finished with value: 9933.736944593782 and parameters: {'depth': 6, 'learning_rate': 0.24170638047013882, 'iterations': 2459, 'l2_leaf_reg': 0.00013668345162492725, 'border_count': 25, 'bagging_temperature': 0.6923519848188865, 'random_strength': 8.624243617609931, 'grow_policy': 'Lossguide', 'min_data_in_leaf': 89, 'max_leaves': 74}. Best is trial 472 with value: 2453.464132483589.[0m
[32m[I 2024-10-13 08:36:53,401][0m Trial 678 finished with value: 3278.6869814961788 and parameters: {'depth': 7, 'learning_rate': 0.021575075587151517, 'iterations': 2528, 'l2_leaf_reg': 0.0001360611726896307, 'border_count': 42, 'bagging_temperature': 0.6827575118204467, 'random_strength': 0.1957505987493191, 'grow_policy': 'Lossguide', 'min_data_in_leaf': 62, 'max_leaves': 66}. Best is trial 472 with value: 2453.464132483589.[0m
[32m[I 2024-10-13 08:36:57,939][0m Trial 679 finished with value: 6338.859044956428 and parameters: {'depth': 8, 'learning_rate': 0.23651719583077582, 'iterations': 2469, 'l2_leaf_reg': 0.0005031747480951212, 'border_count': 32, 'bagging_temperature': 0.7339708604067744, 'random_strength': 0.8171923316522065, 'grow_policy': 'Depthwise', 'min_data_in_leaf': 99}. Best is trial 472 with value: 2453.464132483589.[0m
[32m[I 2024-10-13 08:37:02,221][0m Trial 680 finished with value: 4906.326432394617 and parameters: {'depth': 7, 'learning_rate': 0.2129494822695324, 'iterations': 2419, 'l2_leaf_reg': 0.00019835767398514664, 'border_count': 39, 'bagging_temperature': 0.6795032227485294, 'random_strength': 0.5452751829434832, 'grow_policy': 'Lossguide', 'min_data_in_leaf': 126, 'max_leaves': 77}. Best is trial 472 with value: 2453.464132483589.[0m
[32m[I 2024-10-13 08:37:06,509][0m Trial 681 finished with value: 3181.107667749095 and parameters: {'depth': 7, 'learning_rate': 0.2590591861010315, 'iterations': 2168, 'l2_leaf_reg': 0.00025672036744770784, 'border_count': 45, 'bagging_temperature': 0.7052164198114383, 'random_strength': 0.6224772519369243, 'grow_policy': 'Lossguide', 'min_data_in_leaf': 79, 'max_leaves': 62}. Best is trial 472 with value: 2453.464132483589.[0m
[32m[I 2024-10-13 08:37:11,909][0m Trial 682 finished with value: 3304.1313376589183 and parameters: {'depth': 6, 'learning_rate': 0.20164662115231646, 'iterations': 2334, 'l2_leaf_reg': 0.00015812604075990115, 'border_count': 60, 'bagging_temperature': 0.6707501174093013, 'random_strength': 0.220821307495655, 'grow_policy': 'Lossguide', 'min_data_in_leaf': 45, 'max_leaves': 68}. Best is trial 472 with value: 2453.464132483589.[0m
[32m[I 2024-10-13 08:37:16,950][0m Trial 683 finished with value: 4851.9402432826255 and parameters: {'depth': 8, 'learning_rate': 0.0029740260493723715, 'iterations': 2997, 'l2_leaf_reg': 0.0002238695409296052, 'border_count': 53, 'bagging_temperature': 0.6715608872899764, 'random_strength': 0.7910305080923641, 'grow_policy': 'Lossguide', 'min_data_in_leaf': 111, 'max_leaves': 59}. Best is trial 472 with value: 2453.464132483589.[0m
[32m[I 2024-10-13 08:37:25,418][0m Trial 684 finished with value: 4314.199941922162 and parameters: {'depth': 4, 'learning_rate': 0.2602822807704519, 'iterations': 2564, 'l2_leaf_reg': 0.00045441293208217827, 'border_count': 35, 'bagging_temperature': 0.6969866250996459, 'random_strength': 0.4254615405306114, 'grow_policy': 'Lossguide', 'min_data_in_leaf': 24, 'max_leaves': 71}. Best is trial 472 with value: 2453.464132483589.[0m
[32m[I 2024-10-13 08:37:51,256][0m Trial 685 finished with value: 4057.2336861300723 and parameters: {'depth': 7, 'learning_rate': 0.22781384715540706, 'iterations': 2906, 'l2_leaf_reg': 0.00010379804554085449, 'border_count': 42, 'bagging_temperature': 0.6508426853859403, 'random_strength': 0.18185702978099116, 'grow_policy': 'SymmetricTree', 'min_data_in_leaf': 132}. Best is trial 472 with value: 2453.464132483589.[0m
[32m[I 2024-10-13 08:37:56,358][0m Trial 686 finished with value: 2976.9718922056313 and parameters: {'depth': 8, 'learning_rate': 0.1900850035360588, 'iterations': 2388, 'l2_leaf_reg': 0.001051926506035943, 'border_count': 49, 'bagging_temperature': 0.717091449860163, 'random_strength': 0.9873013819555858, 'grow_policy': 'Lossguide', 'min_data_in_leaf': 66, 'max_leaves': 211}. Best is trial 472 with value: 2453.464132483589.[0m
[32m[I 2024-10-13 08:37:59,861][0m Trial 687 finished with value: 4051.8571852652512 and parameters: {'depth': 7, 'learning_rate': 0.2687497698226986, 'iterations': 1938, 'l2_leaf_reg': 0.00028620922350084175, 'border_count': 65, 'bagging_temperature': 0.6371751594794722, 'random_strength': 2.4545590473542216, 'grow_policy': 'Lossguide', 'min_data_in_leaf': 90, 'max_leaves': 65}. Best is trial 472 with value: 2453.464132483589.[0m
[32m[I 2024-10-13 08:38:04,135][0m Trial 688 finished with value: 3038.9706570004314 and parameters: {'depth': 7, 'learning_rate': 0.16682065970482504, 'iterations': 2536, 'l2_leaf_reg': 0.0002098114313676781, 'border_count': 44, 'bagging_temperature': 0.7507879043378878, 'random_strength': 0.5943336430958084, 'grow_policy': 'Lossguide', 'min_data_in_leaf': 108, 'max_leaves': 56}. Best is trial 472 with value: 2453.464132483589.[0m
[32m[I 2024-10-13 08:38:08,583][0m Trial 689 finished with value: 2971.916361998932 and parameters: {'depth': 10, 'learning_rate': 0.21960994277499243, 'iterations': 2917, 'l2_leaf_reg': 9.708653203339365e-06, 'border_count': 56, 'bagging_temperature': 0.6153689886162336, 'random_strength': 1.8968018836958893, 'grow_policy': 'Depthwise', 'min_data_in_leaf': 80}. Best is trial 472 with value: 2453.464132483589.[0m
[32m[I 2024-10-13 08:38:14,462][0m Trial 690 finished with value: 4167.102413620664 and parameters: {'depth': 9, 'learning_rate': 0.23453669049975437, 'iterations': 2598, 'l2_leaf_reg': 9.663630302069868e-05, 'border_count': 31, 'bagging_temperature': 0.6633156389407049, 'random_strength': 6.2972601906731525, 'grow_policy': 'Lossguide', 'min_data_in_leaf': 53, 'max_leaves': 61}. Best is trial 472 with value: 2453.464132483589.[0m
[32m[I 2024-10-13 08:38:19,532][0m Trial 691 finished with value: 4966.598490355822 and parameters: {'depth': 8, 'learning_rate': 0.19290688553592947, 'iterations': 2869, 'l2_leaf_reg': 0.1769724721361077, 'border_count': 38, 'bagging_temperature': 0.7061457112592983, 'random_strength': 5.871124997885206, 'grow_policy': 'Lossguide', 'min_data_in_leaf': 147, 'max_leaves': 80}. Best is trial 472 with value: 2453.464132483589.[0m
[32m[I 2024-10-13 08:38:22,633][0m Trial 692 finished with value: 2787.5323163384733 and parameters: {'depth': 7, 'learning_rate': 0.2986974571502813, 'iterations': 2471, 'l2_leaf_reg': 0.0001893005418600881, 'border_count': 46, 'bagging_temperature': 0.63649459785669, 'random_strength': 0.7563651836429357, 'grow_policy': 'Lossguide', 'min_data_in_leaf': 122, 'max_leaves': 197}. Best is trial 472 with value: 2453.464132483589.[0m
[32m[I 2024-10-13 08:38:28,482][0m Trial 693 finished with value: 3205.7584134593403 and parameters: {'depth': 6, 'learning_rate': 0.17347389270903393, 'iterations': 2939, 'l2_leaf_reg': 1.2591666162657694e-05, 'border_count': 52, 'bagging_temperature': 0.6183971498149182, 'random_strength': 0.3867652195678545, 'grow_policy': 'Lossguide', 'min_data_in_leaf': 91, 'max_leaves': 55}. Best is trial 472 with value: 2453.464132483589.[0m
[32m[I 2024-10-13 08:38:32,558][0m Trial 694 finished with value: 5305.485945898406 and parameters: {'depth': 7, 'learning_rate': 0.2581914853870727, 'iterations': 2812, 'l2_leaf_reg': 1.7243153329144717e-07, 'border_count': 41, 'bagging_temperature': 0.3694771119274956, 'random_strength': 1.1056565267356175, 'grow_policy': 'Lossguide', 'min_data_in_leaf': 136, 'max_leaves': 53}. Best is trial 472 with value: 2453.464132483589.[0m
[32m[I 2024-10-13 08:38:37,976][0m Trial 695 finished with value: 3267.6940480105477 and parameters: {'depth': 8, 'learning_rate': 0.213929931438086, 'iterations': 2624, 'l2_leaf_reg': 0.0002751341599454521, 'border_count': 49, 'bagging_temperature': 0.6554956339877925, 'random_strength': 0.138594855893853, 'grow_policy': 'Lossguide', 'min_data_in_leaf': 68, 'max_leaves': 58}. Best is trial 472 with value: 2453.464132483589.[0m
[32m[I 2024-10-13 08:38:40,422][0m Trial 696 finished with value: 4392.518543248487 and parameters: {'depth': 7, 'learning_rate': 0.19498887222420083, 'iterations': 1372, 'l2_leaf_reg': 7.408916544835486e-05, 'border_count': 37, 'bagging_temperature': 0.4247816003863999, 'random_strength': 0.5021172218489663, 'grow_policy': 'Lossguide', 'min_data_in_leaf': 107, 'max_leaves': 63}. Best is trial 472 with value: 2453.464132483589.[0m
[32m[I 2024-10-13 08:38:44,669][0m Trial 697 finished with value: 6333.6026617116395 and parameters: {'depth': 8, 'learning_rate': 0.24391888920413168, 'iterations': 1008, 'l2_leaf_reg': 2.448409464609102e-05, 'border_count': 27, 'bagging_temperature': 0.676505068021886, 'random_strength': 0.8556030306646183, 'grow_policy': 'Depthwise', 'min_data_in_leaf': 35}. Best is trial 472 with value: 2453.464132483589.[0m
[32m[I 2024-10-13 08:38:49,882][0m Trial 698 finished with value: 4118.560207860057 and parameters: {'depth': 6, 'learning_rate': 0.15501007223403873, 'iterations': 2770, 'l2_leaf_reg': 0.00010672060415498839, 'border_count': 57, 'bagging_temperature': 0.6008009537063406, 'random_strength': 3.8979507406330547, 'grow_policy': 'Lossguide', 'min_data_in_leaf': 97, 'max_leaves': 73}. Best is trial 472 with value: 2453.464132483589.[0m
[32m[I 2024-10-13 08:38:55,020][0m Trial 699 finished with value: 2994.049723873088 and parameters: {'depth': 11, 'learning_rate': 0.2626992660184345, 'iterations': 2548, 'l2_leaf_reg': 1.6631496033105225e-08, 'border_count': 45, 'bagging_temperature': 0.634080304494302, 'random_strength': 8.447466591917241, 'grow_policy': 'Lossguide', 'min_data_in_leaf': 77, 'max_leaves': 52}. Best is trial 472 with value: 2453.464132483589.[0m
[32m[I 2024-10-13 08:39:00,202][0m Trial 700 finished with value: 4047.504970939666 and parameters: {'depth': 9, 'learning_rate': 0.2095754600724134, 'iterations': 2866, 'l2_leaf_reg': 0.050433252997244465, 'border_count': 51, 'bagging_temperature': 0.6065010367472067, 'random_strength': 0.3220745139785305, 'grow_policy': 'Lossguide', 'min_data_in_leaf': 123, 'max_leaves': 57}. Best is trial 472 with value: 2453.464132483589.[0m
[32m[I 2024-10-13 08:39:05,554][0m Trial 701 finished with value: 5296.601886325916 and parameters: {'depth': 7, 'learning_rate': 0.17256963149117274, 'iterations': 2701, 'l2_leaf_reg': 2.2251874635943675e-07, 'border_count': 41, 'bagging_temperature': 0.7665700583595552, 'random_strength': 0.6745784824776294, 'grow_policy': 'Lossguide', 'min_data_in_leaf': 145, 'max_leaves': 46}. Best is trial 472 with value: 2453.464132483589.[0m
