[32m[I 2024-10-13 07:44:42,394][0m Trial 101 finished with value: 3349.185897044029 and parameters: {'depth': 11, 'learning_rate': 0.12204852427540354, 'iterations': 1658, 'l2_leaf_reg': 0.8563065030288425, 'border_count': 44, 'bagging_temperature': 0.5117519775636228, 'random_strength': 3.1450444191443965, 'grow_policy': 'Lossguide', 'min_data_in_leaf': 163, 'max_leaves': 184}. Best is trial 81 with value: 2867.3734371536007.[0m
[32m[I 2024-10-13 07:44:46,120][0m Trial 102 finished with value: 4757.695188058727 and parameters: {'depth': 11, 'learning_rate': 0.1756952257443772, 'iterations': 1635, 'l2_leaf_reg': 0.6955432038719541, 'border_count': 38, 'bagging_temperature': 0.45258010139447574, 'random_strength': 3.1589362595211634, 'grow_policy': 'Lossguide', 'min_data_in_leaf': 233, 'max_leaves': 168}. Best is trial 81 with value: 2867.3734371536007.[0m
[32m[I 2024-10-13 07:44:50,760][0m Trial 103 finished with value: 3067.5403683202144 and parameters: {'depth': 12, 'learning_rate': 0.13100672314860018, 'iterations': 2041, 'l2_leaf_reg': 1.3130187227335102, 'border_count': 47, 'bagging_temperature': 0.5815775904852173, 'random_strength': 2.575424444997866, 'grow_policy': 'Lossguide', 'min_data_in_leaf': 87, 'max_leaves': 186}. Best is trial 81 with value: 2867.3734371536007.[0m
[32m[I 2024-10-13 07:44:55,486][0m Trial 104 finished with value: 8797.159492157722 and parameters: {'depth': 12, 'learning_rate': 0.0011997522829112585, 'iterations': 2181, 'l2_leaf_reg': 1.444411740648791, 'border_count': 54, 'bagging_temperature': 0.49767622954691565, 'random_strength': 1.5546147380068136, 'grow_policy': 'Lossguide', 'min_data_in_leaf': 87, 'max_leaves': 178}. Best is trial 81 with value: 2867.3734371536007.[0m
[32m[I 2024-10-13 07:44:59,426][0m Trial 105 finished with value: 7254.6791479862995 and parameters: {'depth': 11, 'learning_rate': 0.12984925804051972, 'iterations': 2065, 'l2_leaf_reg': 3.894606438231163, 'border_count': 27, 'bagging_temperature': 0.5803302415658235, 'random_strength': 2.4933967277408664, 'grow_policy': 'Lossguide', 'min_data_in_leaf': 408, 'max_leaves': 187}. Best is trial 81 with value: 2867.3734371536007.[0m
[32m[I 2024-10-13 07:45:03,052][0m Trial 106 finished with value: 4995.940017519216 and parameters: {'depth': 11, 'learning_rate': 0.12047921505923449, 'iterations': 1851, 'l2_leaf_reg': 5.74916430163599, 'border_count': 67, 'bagging_temperature': 0.5261256325588936, 'random_strength': 1.699543108390837, 'grow_policy': 'Lossguide', 'min_data_in_leaf': 157, 'max_leaves': 148}. Best is trial 81 with value: 2867.3734371536007.[0m
[32m[I 2024-10-13 07:45:08,441][0m Trial 107 finished with value: 4894.92295100298 and parameters: {'depth': 13, 'learning_rate': 0.2193041758334906, 'iterations': 2320, 'l2_leaf_reg': 2.283119160501106, 'border_count': 35, 'bagging_temperature': 0.6050435012634576, 'random_strength': 1.9837173208690484, 'grow_policy': 'Lossguide', 'min_data_in_leaf': 65, 'max_leaves': 205}. Best is trial 81 with value: 2867.3734371536007.[0m
[32m[I 2024-10-13 07:45:12,456][0m Trial 108 finished with value: 4404.095605418269 and parameters: {'depth': 12, 'learning_rate': 0.08941920449788407, 'iterations': 1962, 'l2_leaf_reg': 0.2514671619542088, 'border_count': 42, 'bagging_temperature': 0.6252964931020102, 'random_strength': 2.7461216049803143, 'grow_policy': 'Lossguide', 'min_data_in_leaf': 107, 'max_leaves': 216}. Best is trial 81 with value: 2867.3734371536007.[0m
[32m[I 2024-10-13 07:45:16,276][0m Trial 109 finished with value: 3799.924495046204 and parameters: {'depth': 11, 'learning_rate': 0.06922449512960802, 'iterations': 2039, 'l2_leaf_reg': 0.46849174964663404, 'border_count': 52, 'bagging_temperature': 0.5529898463761151, 'random_strength': 4.934417841671358, 'grow_policy': 'Lossguide', 'min_data_in_leaf': 318, 'max_leaves': 174}. Best is trial 81 with value: 2867.3734371536007.[0m
[32m[I 2024-10-13 07:45:20,625][0m Trial 110 finished with value: 4094.544411095133 and parameters: {'depth': 12, 'learning_rate': 0.10954105441850125, 'iterations': 2150, 'l2_leaf_reg': 1.000064728704015, 'border_count': 60, 'bagging_temperature': 0.4702748139626207, 'random_strength': 0.030081147730393276, 'grow_policy': 'Lossguide', 'min_data_in_leaf': 217, 'max_leaves': 157}. Best is trial 81 with value: 2867.3734371536007.[0m
[32m[I 2024-10-13 07:45:23,892][0m Trial 111 finished with value: 3297.681947545353 and parameters: {'depth': 12, 'learning_rate': 0.15312750139725687, 'iterations': 1788, 'l2_leaf_reg': 1.6191248076700575, 'border_count': 44, 'bagging_temperature': 0.4139652644357268, 'random_strength': 3.953061453127272, 'grow_policy': 'Lossguide', 'min_data_in_leaf': 345, 'max_leaves': 196}. Best is trial 81 with value: 2867.3734371536007.[0m
[32m[I 2024-10-13 07:45:27,568][0m Trial 112 finished with value: 3385.712524980613 and parameters: {'depth': 12, 'learning_rate': 0.14345227408558697, 'iterations': 1807, 'l2_leaf_reg': 1.6400134313230326, 'border_count': 45, 'bagging_temperature': 0.4999229219056299, 'random_strength': 4.034652564154973, 'grow_policy': 'Lossguide', 'min_data_in_leaf': 350, 'max_leaves': 195}. Best is trial 81 with value: 2867.3734371536007.[0m
[32m[I 2024-10-13 07:45:31,243][0m Trial 113 finished with value: 3731.4068575039464 and parameters: {'depth': 13, 'learning_rate': 0.18841139437195992, 'iterations': 1794, 'l2_leaf_reg': 3.0782841324779238, 'border_count': 51, 'bagging_temperature': 0.4841394660648132, 'random_strength': 4.292661354852485, 'grow_policy': 'Lossguide', 'min_data_in_leaf': 266, 'max_leaves': 195}. Best is trial 81 with value: 2867.3734371536007.[0m
[32m[I 2024-10-13 07:45:35,046][0m Trial 114 finished with value: 4940.839653335142 and parameters: {'depth': 12, 'learning_rate': 0.15594741898986578, 'iterations': 1871, 'l2_leaf_reg': 1.8753519426067844, 'border_count': 32, 'bagging_temperature': 0.38329330303008624, 'random_strength': 3.948460575692832, 'grow_policy': 'Lossguide', 'min_data_in_leaf': 371, 'max_leaves': 207}. Best is trial 81 with value: 2867.3734371536007.[0m
[32m[I 2024-10-13 07:45:38,761][0m Trial 115 finished with value: 3226.7451059101736 and parameters: {'depth': 11, 'learning_rate': 0.2480020043341227, 'iterations': 1683, 'l2_leaf_reg': 1.3591895727035168, 'border_count': 46, 'bagging_temperature': 0.4535865635376694, 'random_strength': 4.064514691118866, 'grow_policy': 'Lossguide', 'min_data_in_leaf': 349, 'max_leaves': 188}. Best is trial 81 with value: 2867.3734371536007.[0m
[32m[I 2024-10-13 07:45:45,375][0m Trial 116 finished with value: 4791.793075812789 and parameters: {'depth': 10, 'learning_rate': 0.24762124551554363, 'iterations': 1676, 'l2_leaf_reg': 1.5088584506401768, 'border_count': 116, 'bagging_temperature': 0.4110525310361943, 'random_strength': 3.1762691981953406, 'grow_policy': 'Lossguide', 'min_data_in_leaf': 31, 'max_leaves': 188}. Best is trial 81 with value: 2867.3734371536007.[0m
[32m[I 2024-10-13 07:45:48,924][0m Trial 117 finished with value: 4782.467555467295 and parameters: {'depth': 11, 'learning_rate': 0.2094011550325361, 'iterations': 1720, 'l2_leaf_reg': 0.3719154342233642, 'border_count': 38, 'bagging_temperature': 0.4471648646478003, 'random_strength': 3.36258644176397, 'grow_policy': 'Lossguide', 'min_data_in_leaf': 347, 'max_leaves': 48}. Best is trial 81 with value: 2867.3734371536007.[0m
[32m[I 2024-10-13 07:46:24,645][0m Trial 118 finished with value: 4451.96871688176 and parameters: {'depth': 10, 'learning_rate': 0.26198105810907873, 'iterations': 1517, 'l2_leaf_reg': 5.65246476021536, 'border_count': 59, 'bagging_temperature': 0.4602135869465735, 'random_strength': 4.057835784354092, 'grow_policy': 'SymmetricTree', 'min_data_in_leaf': 340}. Best is trial 81 with value: 2867.3734371536007.[0m
[32m[I 2024-10-13 07:46:28,099][0m Trial 119 finished with value: 5308.86942245133 and parameters: {'depth': 11, 'learning_rate': 0.1798078168656756, 'iterations': 1820, 'l2_leaf_reg': 2.8789494822805017, 'border_count': 74, 'bagging_temperature': 0.5821244085108711, 'random_strength': 3.47070884868133, 'grow_policy': 'Lossguide', 'min_data_in_leaf': 369, 'max_leaves': 229}. Best is trial 81 with value: 2867.3734371536007.[0m
[32m[I 2024-10-13 07:46:31,488][0m Trial 120 finished with value: 17840.087992979767 and parameters: {'depth': 13, 'learning_rate': 0.0005786940764720171, 'iterations': 1635, 'l2_leaf_reg': 1.9573445650910477, 'border_count': 28, 'bagging_temperature': 0.34008076590829367, 'random_strength': 3.805496279913777, 'grow_policy': 'Depthwise', 'min_data_in_leaf': 407}. Best is trial 81 with value: 2867.3734371536007.[0m
[32m[I 2024-10-13 07:46:35,734][0m Trial 121 finished with value: 3207.3335963265804 and parameters: {'depth': 12, 'learning_rate': 0.14701846838489863, 'iterations': 2236, 'l2_leaf_reg': 1.0032958938535699, 'border_count': 47, 'bagging_temperature': 0.52589414865551, 'random_strength': 4.533141247447598, 'grow_policy': 'Lossguide', 'min_data_in_leaf': 285, 'max_leaves': 179}. Best is trial 81 with value: 2867.3734371536007.[0m
[32m[I 2024-10-13 07:46:38,983][0m Trial 122 finished with value: 3380.2770464262567 and parameters: {'depth': 11, 'learning_rate': 0.14400228262986906, 'iterations': 1737, 'l2_leaf_reg': 0.5518341534366819, 'border_count': 45, 'bagging_temperature': 0.5336789278868006, 'random_strength': 5.214035350312997, 'grow_policy': 'Lossguide', 'min_data_in_leaf': 284, 'max_leaves': 191}. Best is trial 81 with value: 2867.3734371536007.[0m
[32m[I 2024-10-13 07:46:43,547][0m Trial 123 finished with value: 3800.9996081317317 and parameters: {'depth': 11, 'learning_rate': 0.14365443418592827, 'iterations': 2289, 'l2_leaf_reg': 1.2324708328442253, 'border_count': 53, 'bagging_temperature': 0.500765975909843, 'random_strength': 5.50048797243687, 'grow_policy': 'Lossguide', 'min_data_in_leaf': 294, 'max_leaves': 194}. Best is trial 81 with value: 2867.3734371536007.[0m
[32m[I 2024-10-13 07:46:47,573][0m Trial 124 finished with value: 4900.956886175804 and parameters: {'depth': 11, 'learning_rate': 0.2227667912323543, 'iterations': 2213, 'l2_leaf_reg': 0.5299520835122322, 'border_count': 36, 'bagging_temperature': 0.5340665039160156, 'random_strength': 5.029748374320542, 'grow_policy': 'Lossguide', 'min_data_in_leaf': 327, 'max_leaves': 204}. Best is trial 81 with value: 2867.3734371536007.[0m
[32m[I 2024-10-13 07:46:51,015][0m Trial 125 finished with value: 3149.6476661945658 and parameters: {'depth': 10, 'learning_rate': 0.1842330533579306, 'iterations': 1751, 'l2_leaf_reg': 0.1867109629937037, 'border_count': 43, 'bagging_temperature': 0.5601406862365202, 'random_strength': 4.149428360390382, 'grow_policy': 'Lossguide', 'min_data_in_leaf': 282, 'max_leaves': 171}. Best is trial 81 with value: 2867.3734371536007.[0m
[32m[I 2024-10-13 07:46:55,671][0m Trial 126 finished with value: 3810.5503775248408 and parameters: {'depth': 10, 'learning_rate': 0.1898934366173358, 'iterations': 2366, 'l2_leaf_reg': 0.20485196699726133, 'border_count': 57, 'bagging_temperature': 0.5597184136726616, 'random_strength': 4.29679120216277, 'grow_policy': 'Lossguide', 'min_data_in_leaf': 274, 'max_leaves': 169}. Best is trial 81 with value: 2867.3734371536007.[0m
[32m[I 2024-10-13 07:47:00,606][0m Trial 127 finished with value: 3116.094697319539 and parameters: {'depth': 10, 'learning_rate': 0.29426416996221677, 'iterations': 1889, 'l2_leaf_reg': 0.40166199746288994, 'border_count': 41, 'bagging_temperature': 0.5284431470886305, 'random_strength': 5.168820671579029, 'grow_policy': 'Lossguide', 'min_data_in_leaf': 53, 'max_leaves': 179}. Best is trial 81 with value: 2867.3734371536007.[0m
[32m[I 2024-10-13 07:47:05,458][0m Trial 128 finished with value: 7113.091737618698 and parameters: {'depth': 9, 'learning_rate': 0.27727918037768845, 'iterations': 1910, 'l2_leaf_reg': 0.29558953495142165, 'border_count': 25, 'bagging_temperature': 0.5977635882476795, 'random_strength': 4.6213904696190555, 'grow_policy': 'Lossguide', 'min_data_in_leaf': 45, 'max_leaves': 178}. Best is trial 81 with value: 2867.3734371536007.[0m
[32m[I 2024-10-13 07:47:08,713][0m Trial 129 finished with value: 6200.874589906095 and parameters: {'depth': 10, 'learning_rate': 0.28953862175556894, 'iterations': 1981, 'l2_leaf_reg': 0.15424408168781387, 'border_count': 18, 'bagging_temperature': 0.5744605928673405, 'random_strength': 4.3734425253102245, 'grow_policy': 'Lossguide', 'min_data_in_leaf': 77, 'max_leaves': 171}. Best is trial 81 with value: 2867.3734371536007.[0m
[32m[I 2024-10-13 07:47:13,333][0m Trial 130 finished with value: 4270.577462916848 and parameters: {'depth': 10, 'learning_rate': 0.23596443298069028, 'iterations': 2491, 'l2_leaf_reg': 3.8726053150602007, 'border_count': 40, 'bagging_temperature': 0.47819267900568563, 'random_strength': 3.1242061423163157, 'grow_policy': 'Lossguide', 'min_data_in_leaf': 142, 'max_leaves': 163}. Best is trial 81 with value: 2867.3734371536007.[0m
[32m[I 2024-10-13 07:47:13,962][0m Trial 131 finished with value: 4911.3522241894325 and parameters: {'depth': 10, 'learning_rate': 0.17077952779080252, 'iterations': 102, 'l2_leaf_reg': 0.587889816864915, 'border_count': 49, 'bagging_temperature': 0.527309352083973, 'random_strength': 4.870887033222215, 'grow_policy': 'Lossguide', 'min_data_in_leaf': 98, 'max_leaves': 188}. Best is trial 81 with value: 2867.3734371536007.[0m
[32m[I 2024-10-13 07:47:17,202][0m Trial 132 finished with value: 4937.2300801580395 and parameters: {'depth': 11, 'learning_rate': 0.10206377870721926, 'iterations': 1765, 'l2_leaf_reg': 1.0430647492369787, 'border_count': 34, 'bagging_temperature': 0.5407259603756528, 'random_strength': 5.246242445138224, 'grow_policy': 'Lossguide', 'min_data_in_leaf': 230, 'max_leaves': 182}. Best is trial 81 with value: 2867.3734371536007.[0m
[32m[I 2024-10-13 07:47:29,020][0m Trial 133 finished with value: 3957.718925735719 and parameters: {'depth': 11, 'learning_rate': 0.19857339459292475, 'iterations': 1884, 'l2_leaf_reg': 0.39228762979583115, 'border_count': 43, 'bagging_temperature': 0.5200011651907521, 'random_strength': 5.5234079498732935, 'grow_policy': 'Lossguide', 'min_data_in_leaf': 11, 'max_leaves': 175}. Best is trial 81 with value: 2867.3734371536007.[0m
[32m[I 2024-10-13 07:47:31,410][0m Trial 134 finished with value: 3805.7411945893264 and parameters: {'depth': 9, 'learning_rate': 0.16434250171816092, 'iterations': 1624, 'l2_leaf_reg': 2.522430577020413, 'border_count': 51, 'bagging_temperature': 0.5603327413251699, 'random_strength': 5.963449994194219, 'grow_policy': 'Lossguide', 'min_data_in_leaf': 166, 'max_leaves': 190}. Best is trial 81 with value: 2867.3734371536007.[0m
[32m[I 2024-10-13 07:47:34,641][0m Trial 135 finished with value: 5631.1235179103505 and parameters: {'depth': 11, 'learning_rate': 0.24097164250153116, 'iterations': 1716, 'l2_leaf_reg': 1.0803427319900372e-07, 'border_count': 31, 'bagging_temperature': 0.4366186707819606, 'random_strength': 4.159097868410076, 'grow_policy': 'Lossguide', 'min_data_in_leaf': 288, 'max_leaves': 180}. Best is trial 81 with value: 2867.3734371536007.[0m
[32m[I 2024-10-13 07:47:39,015][0m Trial 136 finished with value: 4572.004637787895 and parameters: {'depth': 11, 'learning_rate': 0.11828095419974484, 'iterations': 1526, 'l2_leaf_reg': 1.2977966869511806, 'border_count': 67, 'bagging_temperature': 0.48206512710633903, 'random_strength': 3.823362784532665, 'grow_policy': 'Lossguide', 'min_data_in_leaf': 53, 'max_leaves': 198}. Best is trial 81 with value: 2867.3734371536007.[0m
[32m[I 2024-10-13 07:47:42,810][0m Trial 137 finished with value: 5008.899336112103 and parameters: {'depth': 10, 'learning_rate': 0.2093403978701236, 'iterations': 2246, 'l2_leaf_reg': 1.0494631281273867e-08, 'border_count': 40, 'bagging_temperature': 0.5496927465696584, 'random_strength': 2.618294015341585, 'grow_policy': 'Lossguide', 'min_data_in_leaf': 254, 'max_leaves': 186}. Best is trial 81 with value: 2867.3734371536007.[0m
[32m[I 2024-10-13 07:47:47,710][0m Trial 138 finished with value: 4813.7380686972065 and parameters: {'depth': 10, 'learning_rate': 0.14429085626432264, 'iterations': 2102, 'l2_leaf_reg': 0.6747314179494389, 'border_count': 132, 'bagging_temperature': 0.6419355544719413, 'random_strength': 4.593780734213655, 'grow_policy': 'Lossguide', 'min_data_in_leaf': 34, 'max_leaves': 172}. Best is trial 81 with value: 2867.3734371536007.[0m
[32m[I 2024-10-13 07:47:51,467][0m Trial 139 finished with value: 4119.903617904856 and parameters: {'depth': 9, 'learning_rate': 0.08579371023595957, 'iterations': 1750, 'l2_leaf_reg': 7.111607834010699, 'border_count': 62, 'bagging_temperature': 0.4984166830496003, 'random_strength': 3.5343889562020494, 'grow_policy': 'Lossguide', 'min_data_in_leaf': 294, 'max_leaves': 192}. Best is trial 81 with value: 2867.3734371536007.[0m
[32m[I 2024-10-13 07:47:54,739][0m Trial 140 finished with value: 6765.317120874026 and parameters: {'depth': 12, 'learning_rate': 0.00214306754064116, 'iterations': 1945, 'l2_leaf_reg': 0.2366083134438803, 'border_count': 45, 'bagging_temperature': 0.4002164256378317, 'random_strength': 4.84460357194927, 'grow_policy': 'Lossguide', 'min_data_in_leaf': 318, 'max_leaves': 91}. Best is trial 81 with value: 2867.3734371536007.[0m
[32m[I 2024-10-13 07:47:57,708][0m Trial 141 finished with value: 3183.2709078432963 and parameters: {'depth': 12, 'learning_rate': 0.2989025473373213, 'iterations': 1801, 'l2_leaf_reg': 1.817271264230646, 'border_count': 45, 'bagging_temperature': 0.502695852530609, 'random_strength': 4.122175935941179, 'grow_policy': 'Lossguide', 'min_data_in_leaf': 340, 'max_leaves': 181}. Best is trial 81 with value: 2867.3734371536007.[0m
[32m[I 2024-10-13 07:48:00,809][0m Trial 142 finished with value: 3996.9499651545298 and parameters: {'depth': 12, 'learning_rate': 0.29999215892144826, 'iterations': 1806, 'l2_leaf_reg': 0.407146306953121, 'border_count': 56, 'bagging_temperature': 0.5246415922580961, 'random_strength': 4.108262751090993, 'grow_policy': 'Lossguide', 'min_data_in_leaf': 382, 'max_leaves': 181}. Best is trial 81 with value: 2867.3734371536007.[0m
[32m[I 2024-10-13 07:48:04,456][0m Trial 143 finished with value: 4792.733763324535 and parameters: {'depth': 14, 'learning_rate': 0.23937125710183704, 'iterations': 1847, 'l2_leaf_reg': 0.8375572159763949, 'border_count': 38, 'bagging_temperature': 0.465349610478921, 'random_strength': 5.142818670730618, 'grow_policy': 'Lossguide', 'min_data_in_leaf': 340, 'max_leaves': 177}. Best is trial 81 with value: 2867.3734371536007.[0m
[32m[I 2024-10-13 07:48:07,855][0m Trial 144 finished with value: 2690.2497230447584 and parameters: {'depth': 12, 'learning_rate': 0.17614263756527496, 'iterations': 1694, 'l2_leaf_reg': 2.058678073492131, 'border_count': 48, 'bagging_temperature': 0.5875831650117262, 'random_strength': 4.493870437765935, 'grow_policy': 'Lossguide', 'min_data_in_leaf': 71, 'max_leaves': 186}. Best is trial 144 with value: 2690.2497230447584.[0m
[32m[I 2024-10-13 07:48:18,961][0m Trial 145 finished with value: 4073.2844508010835 and parameters: {'depth': 12, 'learning_rate': 0.18951332425502393, 'iterations': 1665, 'l2_leaf_reg': 4.428229441730507, 'border_count': 49, 'bagging_temperature': 0.607165433826486, 'random_strength': 4.418139532347994, 'grow_policy': 'Lossguide', 'min_data_in_leaf': 12, 'max_leaves': 185}. Best is trial 144 with value: 2690.2497230447584.[0m
[32m[I 2024-10-13 07:48:22,135][0m Trial 146 finished with value: 3024.2817434147373 and parameters: {'depth': 12, 'learning_rate': 0.29924726231117066, 'iterations': 1594, 'l2_leaf_reg': 2.2846393085479533, 'border_count': 54, 'bagging_temperature': 0.5692101053661466, 'random_strength': 3.6799620863777465, 'grow_policy': 'Lossguide', 'min_data_in_leaf': 65, 'max_leaves': 164}. Best is trial 144 with value: 2690.2497230447584.[0m
[32m[I 2024-10-13 07:49:21,374][0m Trial 147 finished with value: 5134.880795433694 and parameters: {'depth': 12, 'learning_rate': 0.2981806924161304, 'iterations': 1447, 'l2_leaf_reg': 2.6409959521301545, 'border_count': 54, 'bagging_temperature': 0.5824154181990866, 'random_strength': 3.6783249518080896, 'grow_policy': 'SymmetricTree', 'min_data_in_leaf': 72}. Best is trial 144 with value: 2690.2497230447584.[0m
[32m[I 2024-10-13 07:49:23,467][0m Trial 148 finished with value: 6594.821512635014 and parameters: {'depth': 13, 'learning_rate': 0.23761600057676074, 'iterations': 1586, 'l2_leaf_reg': 1.8680198059363577, 'border_count': 32, 'bagging_temperature': 0.5869428210858316, 'random_strength': 4.047455121275798, 'grow_policy': 'Lossguide', 'min_data_in_leaf': 93, 'max_leaves': 159}. Best is trial 144 with value: 2690.2497230447584.[0m
[32m[I 2024-10-13 07:49:25,510][0m Trial 149 finished with value: 3899.747375925595 and parameters: {'depth': 14, 'learning_rate': 0.20823916605885412, 'iterations': 1986, 'l2_leaf_reg': 5.456993295091905, 'border_count': 60, 'bagging_temperature': 0.5600908320787844, 'random_strength': 3.811915027279394, 'grow_policy': 'Depthwise', 'min_data_in_leaf': 120}. Best is trial 144 with value: 2690.2497230447584.[0m
[32m[I 2024-10-13 07:49:27,500][0m Trial 150 finished with value: 3143.734410817975 and parameters: {'depth': 12, 'learning_rate': 0.1698773347946738, 'iterations': 1486, 'l2_leaf_reg': 3.4645484717789685, 'border_count': 51, 'bagging_temperature': 0.6227703600983481, 'random_strength': 4.597571502332656, 'grow_policy': 'Lossguide', 'min_data_in_leaf': 60, 'max_leaves': 151}. Best is trial 144 with value: 2690.2497230447584.[0m
