[32m[I 2024-10-13 14:34:03,998][0m Trial 603 finished with value: 209.22106066238769 and parameters: {'depth': 6, 'learning_rate': 0.004226288339152398, 'iterations': 2818, 'l2_leaf_reg': 4.172276670761715, 'border_count': 26, 'bagging_temperature': 0.8882408010718471, 'random_strength': 6.3011331410875835, 'grow_policy': 'Lossguide', 'min_data_in_leaf': 590, 'max_leaves': 82}. Best is trial 557 with value: 199.73000305555982.[0m
[32m[I 2024-10-13 14:34:06,701][0m Trial 604 finished with value: 234.89272821824784 and parameters: {'depth': 6, 'learning_rate': 0.004324945875402121, 'iterations': 2825, 'l2_leaf_reg': 4.054879599163059, 'border_count': 19, 'bagging_temperature': 0.8854126574010311, 'random_strength': 6.235794763571614, 'grow_policy': 'Lossguide', 'min_data_in_leaf': 610, 'max_leaves': 90}. Best is trial 557 with value: 199.73000305555982.[0m
[32m[I 2024-10-13 14:34:09,465][0m Trial 605 finished with value: 239.93908736198148 and parameters: {'depth': 6, 'learning_rate': 0.010681175487942325, 'iterations': 2914, 'l2_leaf_reg': 6.567807918355044, 'border_count': 25, 'bagging_temperature': 0.85118359635006, 'random_strength': 5.9588702713141, 'grow_policy': 'Lossguide', 'min_data_in_leaf': 595, 'max_leaves': 84}. Best is trial 557 with value: 199.73000305555982.[0m
[32m[I 2024-10-13 14:34:12,057][0m Trial 606 finished with value: 289.99506183776776 and parameters: {'depth': 6, 'learning_rate': 0.005204304079789972, 'iterations': 2699, 'l2_leaf_reg': 3.049899080130775, 'border_count': 10, 'bagging_temperature': 0.7925275654223701, 'random_strength': 6.37067015326789, 'grow_policy': 'Lossguide', 'min_data_in_leaf': 592, 'max_leaves': 90}. Best is trial 557 with value: 199.73000305555982.[0m
[32m[I 2024-10-13 14:34:14,812][0m Trial 607 finished with value: 234.54673026600855 and parameters: {'depth': 5, 'learning_rate': 0.004216331018141338, 'iterations': 2870, 'l2_leaf_reg': 4.057657921792699, 'border_count': 21, 'bagging_temperature': 0.8274223443886128, 'random_strength': 6.141893922196848, 'grow_policy': 'Lossguide', 'min_data_in_leaf': 573, 'max_leaves': 81}. Best is trial 557 with value: 199.73000305555982.[0m
[32m[I 2024-10-13 14:34:17,617][0m Trial 608 finished with value: 205.9868675187574 and parameters: {'depth': 5, 'learning_rate': 0.005024286002471045, 'iterations': 2670, 'l2_leaf_reg': 6.65044177254678, 'border_count': 26, 'bagging_temperature': 0.8882249853476828, 'random_strength': 6.476724643161857, 'grow_policy': 'Lossguide', 'min_data_in_leaf': 612, 'max_leaves': 97}. Best is trial 557 with value: 199.73000305555982.[0m
[32m[I 2024-10-13 14:34:20,387][0m Trial 609 finished with value: 234.55175754052783 and parameters: {'depth': 5, 'learning_rate': 0.006474070998235034, 'iterations': 2721, 'l2_leaf_reg': 9.95679103201441, 'border_count': 15, 'bagging_temperature': 0.8879884177918058, 'random_strength': 6.482840619967582, 'grow_policy': 'Lossguide', 'min_data_in_leaf': 623, 'max_leaves': 98}. Best is trial 557 with value: 199.73000305555982.[0m
[32m[I 2024-10-13 14:34:23,096][0m Trial 610 finished with value: 207.3405936854279 and parameters: {'depth': 5, 'learning_rate': 0.004956150727774344, 'iterations': 2660, 'l2_leaf_reg': 5.879906990962073, 'border_count': 26, 'bagging_temperature': 0.8684192270028247, 'random_strength': 6.240845821727713, 'grow_policy': 'Lossguide', 'min_data_in_leaf': 602, 'max_leaves': 97}. Best is trial 557 with value: 199.73000305555982.[0m
[32m[I 2024-10-13 14:34:25,935][0m Trial 611 finished with value: 232.50111911010174 and parameters: {'depth': 5, 'learning_rate': 0.005236373971959262, 'iterations': 2774, 'l2_leaf_reg': 5.868727524609716, 'border_count': 21, 'bagging_temperature': 0.8703146755676174, 'random_strength': 6.283531859374382, 'grow_policy': 'Lossguide', 'min_data_in_leaf': 654, 'max_leaves': 107}. Best is trial 557 with value: 199.73000305555982.[0m
[32m[I 2024-10-13 14:34:28,681][0m Trial 612 finished with value: 236.42981868384453 and parameters: {'depth': 5, 'learning_rate': 0.00812295117592911, 'iterations': 2664, 'l2_leaf_reg': 2.0825208875514205, 'border_count': 27, 'bagging_temperature': 0.8519770684442972, 'random_strength': 5.972657004262682, 'grow_policy': 'Lossguide', 'min_data_in_leaf': 604, 'max_leaves': 102}. Best is trial 557 with value: 199.73000305555982.[0m
[32m[I 2024-10-13 14:34:31,317][0m Trial 613 finished with value: 240.37589195468206 and parameters: {'depth': 5, 'learning_rate': 0.006299366235607947, 'iterations': 2727, 'l2_leaf_reg': 4.73315048389809, 'border_count': 17, 'bagging_temperature': 0.8703572062761621, 'random_strength': 6.4489753215826235, 'grow_policy': 'Lossguide', 'min_data_in_leaf': 633, 'max_leaves': 97}. Best is trial 557 with value: 199.73000305555982.[0m
[32m[I 2024-10-13 14:34:34,055][0m Trial 614 finished with value: 211.3011197547028 and parameters: {'depth': 6, 'learning_rate': 0.005204292099023138, 'iterations': 2823, 'l2_leaf_reg': 6.780642584237405, 'border_count': 25, 'bagging_temperature': 0.8893966721189044, 'random_strength': 6.191483150019563, 'grow_policy': 'Lossguide', 'min_data_in_leaf': 591, 'max_leaves': 93}. Best is trial 557 with value: 199.73000305555982.[0m
[32m[I 2024-10-13 14:34:36,835][0m Trial 615 finished with value: 275.2778452487482 and parameters: {'depth': 6, 'learning_rate': 0.005283418707709224, 'iterations': 2847, 'l2_leaf_reg': 7.028673205015212, 'border_count': 9, 'bagging_temperature': 0.8876394582354072, 'random_strength': 6.166764580811406, 'grow_policy': 'Lossguide', 'min_data_in_leaf': 616, 'max_leaves': 94}. Best is trial 557 with value: 199.73000305555982.[0m
[32m[I 2024-10-13 14:34:39,602][0m Trial 616 finished with value: 238.04809874318804 and parameters: {'depth': 6, 'learning_rate': 0.007010111309690287, 'iterations': 2854, 'l2_leaf_reg': 2.8718375679117467, 'border_count': 24, 'bagging_temperature': 0.8440062327048912, 'random_strength': 5.83000162726545, 'grow_policy': 'Lossguide', 'min_data_in_leaf': 586, 'max_leaves': 99}. Best is trial 557 with value: 199.73000305555982.[0m
[32m[I 2024-10-13 14:34:42,532][0m Trial 617 finished with value: 237.50367077273108 and parameters: {'depth': 6, 'learning_rate': 0.00593981487601687, 'iterations': 2895, 'l2_leaf_reg': 7.008443353230412, 'border_count': 14, 'bagging_temperature': 0.8912994193104364, 'random_strength': 6.366235740104271, 'grow_policy': 'Lossguide', 'min_data_in_leaf': 598, 'max_leaves': 92}. Best is trial 557 with value: 199.73000305555982.[0m
[32m[I 2024-10-13 14:34:45,235][0m Trial 618 finished with value: 234.6416981041194 and parameters: {'depth': 5, 'learning_rate': 0.004614909552704543, 'iterations': 2780, 'l2_leaf_reg': 4.419223706880441, 'border_count': 20, 'bagging_temperature': 0.8605802991900557, 'random_strength': 6.1829784184890855, 'grow_policy': 'Lossguide', 'min_data_in_leaf': 577, 'max_leaves': 88}. Best is trial 557 with value: 199.73000305555982.[0m
[32m[I 2024-10-13 14:34:48,055][0m Trial 619 finished with value: 232.18302288711436 and parameters: {'depth': 6, 'learning_rate': 0.00550799057428163, 'iterations': 2991, 'l2_leaf_reg': 1.7207869910660103, 'border_count': 25, 'bagging_temperature': 0.8226417959627047, 'random_strength': 5.554420647458742, 'grow_policy': 'Lossguide', 'min_data_in_leaf': 614, 'max_leaves': 93}. Best is trial 557 with value: 199.73000305555982.[0m
[32m[I 2024-10-13 14:34:50,771][0m Trial 620 finished with value: 235.2614834014318 and parameters: {'depth': 5, 'learning_rate': 0.004961006829751754, 'iterations': 2814, 'l2_leaf_reg': 3.9576059860981454, 'border_count': 18, 'bagging_temperature': 0.8732341307134533, 'random_strength': 6.00103480051683, 'grow_policy': 'Lossguide', 'min_data_in_leaf': 648, 'max_leaves': 103}. Best is trial 557 with value: 199.73000305555982.[0m
[32m[I 2024-10-13 14:34:53,479][0m Trial 621 finished with value: 221.6887580668774 and parameters: {'depth': 5, 'learning_rate': 0.007774766809172879, 'iterations': 2743, 'l2_leaf_reg': 6.926348850831104, 'border_count': 27, 'bagging_temperature': 0.8913788525286369, 'random_strength': 6.296293261143182, 'grow_policy': 'Lossguide', 'min_data_in_leaf': 556, 'max_leaves': 96}. Best is trial 557 with value: 199.73000305555982.[0m
[32m[I 2024-10-13 14:34:56,134][0m Trial 622 finished with value: 238.93421382801102 and parameters: {'depth': 5, 'learning_rate': 0.004590021030414773, 'iterations': 2709, 'l2_leaf_reg': 2.611757039899088, 'border_count': 21, 'bagging_temperature': 0.8331492126149159, 'random_strength': 6.497402972839298, 'grow_policy': 'Lossguide', 'min_data_in_leaf': 589, 'max_leaves': 87}. Best is trial 557 with value: 199.73000305555982.[0m
[32m[I 2024-10-13 14:34:58,706][0m Trial 623 finished with value: 206.84365079870003 and parameters: {'depth': 5, 'learning_rate': 0.006111333343360144, 'iterations': 2673, 'l2_leaf_reg': 9.339363015100002, 'border_count': 26, 'bagging_temperature': 0.8640311411692193, 'random_strength': 5.847507147299635, 'grow_policy': 'Lossguide', 'min_data_in_leaf': 571, 'max_leaves': 90}. Best is trial 557 with value: 199.73000305555982.[0m
[32m[I 2024-10-13 14:35:01,234][0m Trial 624 finished with value: 276.6245933015257 and parameters: {'depth': 5, 'learning_rate': 0.005904519424184561, 'iterations': 2676, 'l2_leaf_reg': 9.425974724201664, 'border_count': 12, 'bagging_temperature': 0.8528804694613679, 'random_strength': 5.772104334086815, 'grow_policy': 'Lossguide', 'min_data_in_leaf': 568, 'max_leaves': 92}. Best is trial 557 with value: 199.73000305555982.[0m
[32m[I 2024-10-13 14:35:03,879][0m Trial 625 finished with value: 552.2092951168918 and parameters: {'depth': 6, 'learning_rate': 0.00795166861336088, 'iterations': 2785, 'l2_leaf_reg': 5.35137626282083, 'border_count': 1, 'bagging_temperature': 0.86682828400055, 'random_strength': 5.595354164929874, 'grow_policy': 'Lossguide', 'min_data_in_leaf': 607, 'max_leaves': 99}. Best is trial 557 with value: 199.73000305555982.[0m
[32m[I 2024-10-13 14:35:06,666][0m Trial 626 finished with value: 226.16271002309466 and parameters: {'depth': 5, 'learning_rate': 0.00876756491419731, 'iterations': 2929, 'l2_leaf_reg': 9.722973587774167, 'border_count': 25, 'bagging_temperature': 0.8881172718138526, 'random_strength': 5.9992769228053495, 'grow_policy': 'Lossguide', 'min_data_in_leaf': 565, 'max_leaves': 87}. Best is trial 557 with value: 199.73000305555982.[0m
[32m[I 2024-10-13 14:35:09,193][0m Trial 627 finished with value: 243.62533173766298 and parameters: {'depth': 5, 'learning_rate': 0.006217991836040708, 'iterations': 2677, 'l2_leaf_reg': 3.5025855645084336, 'border_count': 16, 'bagging_temperature': 0.8015210456626842, 'random_strength': 5.872765991971859, 'grow_policy': 'Lossguide', 'min_data_in_leaf': 534, 'max_leaves': 110}. Best is trial 557 with value: 199.73000305555982.[0m
[32m[I 2024-10-13 14:35:11,847][0m Trial 628 finished with value: 236.61690582067487 and parameters: {'depth': 5, 'learning_rate': 0.006879067762831852, 'iterations': 2850, 'l2_leaf_reg': 5.3828415118325665, 'border_count': 21, 'bagging_temperature': 0.8376888694700162, 'random_strength': 6.131545362883971, 'grow_policy': 'Lossguide', 'min_data_in_leaf': 582, 'max_leaves': 92}. Best is trial 557 with value: 199.73000305555982.[0m
[32m[I 2024-10-13 14:35:14,464][0m Trial 629 finished with value: 224.80505777956353 and parameters: {'depth': 6, 'learning_rate': 0.005251462518257021, 'iterations': 2747, 'l2_leaf_reg': 1.3345641878561745, 'border_count': 26, 'bagging_temperature': 0.8717973802298212, 'random_strength': 5.411616079754503, 'grow_policy': 'Lossguide', 'min_data_in_leaf': 552, 'max_leaves': 84}. Best is trial 557 with value: 199.73000305555982.[0m
[32m[I 2024-10-13 14:35:17,035][0m Trial 630 finished with value: 231.70278243175105 and parameters: {'depth': 5, 'learning_rate': 0.004797337571086859, 'iterations': 2649, 'l2_leaf_reg': 6.537786348583614, 'border_count': 20, 'bagging_temperature': 0.855071299763418, 'random_strength': 5.744724923062578, 'grow_policy': 'Lossguide', 'min_data_in_leaf': 625, 'max_leaves': 91}. Best is trial 557 with value: 199.73000305555982.[0m
[32m[I 2024-10-13 14:35:19,593][0m Trial 631 finished with value: 223.12459557094886 and parameters: {'depth': 5, 'learning_rate': 0.005842291068443724, 'iterations': 2781, 'l2_leaf_reg': 2.6262768553979305, 'border_count': 27, 'bagging_temperature': 0.8857649214042574, 'random_strength': 6.103781784176023, 'grow_policy': 'Lossguide', 'min_data_in_leaf': 520, 'max_leaves': 98}. Best is trial 557 with value: 199.73000305555982.[0m
[32m[I 2024-10-13 14:35:22,114][0m Trial 632 finished with value: 238.29189390710243 and parameters: {'depth': 5, 'learning_rate': 0.004200619000007696, 'iterations': 2698, 'l2_leaf_reg': 4.663813897496709, 'border_count': 15, 'bagging_temperature': 0.81310664853125, 'random_strength': 6.493408873629924, 'grow_policy': 'Lossguide', 'min_data_in_leaf': 574, 'max_leaves': 82}. Best is trial 557 with value: 199.73000305555982.[0m
[32m[I 2024-10-13 14:35:33,044][0m Trial 633 finished with value: 297.156199041033 and parameters: {'depth': 5, 'learning_rate': 0.006842350166058081, 'iterations': 2633, 'l2_leaf_reg': 9.84411423331831, 'border_count': 23, 'bagging_temperature': 0.8417030796929356, 'random_strength': 6.260343452460908, 'grow_policy': 'SymmetricTree', 'min_data_in_leaf': 597}. Best is trial 557 with value: 199.73000305555982.[0m
[32m[I 2024-10-13 14:35:35,650][0m Trial 634 finished with value: 279.0235141782831 and parameters: {'depth': 6, 'learning_rate': 0.005114654356675257, 'iterations': 2729, 'l2_leaf_reg': 3.3641805464705103, 'border_count': 9, 'bagging_temperature': 0.8957897748134527, 'random_strength': 5.946701761009859, 'grow_policy': 'Lossguide', 'min_data_in_leaf': 667, 'max_leaves': 88}. Best is trial 557 with value: 199.73000305555982.[0m
[32m[I 2024-10-13 14:35:36,706][0m Trial 635 finished with value: 334.3228169452874 and parameters: {'depth': 5, 'learning_rate': 0.004055050732058253, 'iterations': 632, 'l2_leaf_reg': 6.697852182683223, 'border_count': 26, 'bagging_temperature': 0.8651699413210225, 'random_strength': 5.169690381121744, 'grow_policy': 'Lossguide', 'min_data_in_leaf': 539, 'max_leaves': 79}. Best is trial 557 with value: 199.73000305555982.[0m
[32m[I 2024-10-13 14:35:39,179][0m Trial 636 finished with value: 253.326734467172 and parameters: {'depth': 5, 'learning_rate': 0.009534758499273675, 'iterations': 2634, 'l2_leaf_reg': 2.1137169756028906, 'border_count': 19, 'bagging_temperature': 0.8928994145488877, 'random_strength': 5.638405273796014, 'grow_policy': 'Lossguide', 'min_data_in_leaf': 555, 'max_leaves': 94}. Best is trial 557 with value: 199.73000305555982.[0m
[32m[I 2024-10-13 14:35:41,891][0m Trial 637 finished with value: 210.1363436815747 and parameters: {'depth': 5, 'learning_rate': 0.0045240929554114274, 'iterations': 2823, 'l2_leaf_reg': 4.448058166347177, 'border_count': 27, 'bagging_temperature': 0.8697455959148311, 'random_strength': 6.347446006326756, 'grow_policy': 'Lossguide', 'min_data_in_leaf': 634, 'max_leaves': 86}. Best is trial 557 with value: 199.73000305555982.[0m
[32m[I 2024-10-13 14:35:44,677][0m Trial 638 finished with value: 218.74203483370584 and parameters: {'depth': 5, 'learning_rate': 0.00561067237642993, 'iterations': 2938, 'l2_leaf_reg': 4.324392164664553, 'border_count': 26, 'bagging_temperature': 0.8714243516045282, 'random_strength': 6.299264539076001, 'grow_policy': 'Lossguide', 'min_data_in_leaf': 629, 'max_leaves': 86}. Best is trial 557 with value: 199.73000305555982.[0m
[32m[I 2024-10-13 14:35:47,313][0m Trial 639 finished with value: 246.42561424590784 and parameters: {'depth': 5, 'learning_rate': 0.0044048353765392895, 'iterations': 2822, 'l2_leaf_reg': 0.7823616258600573, 'border_count': 16, 'bagging_temperature': 0.8444240140508507, 'random_strength': 6.5069733972876405, 'grow_policy': 'Lossguide', 'min_data_in_leaf': 638, 'max_leaves': 89}. Best is trial 557 with value: 199.73000305555982.[0m
[32m[I 2024-10-13 14:35:50,005][0m Trial 640 finished with value: 237.44365109015325 and parameters: {'depth': 6, 'learning_rate': 0.004773392962555742, 'iterations': 2879, 'l2_leaf_reg': 3.0245698245853134, 'border_count': 21, 'bagging_temperature': 0.8765447200383113, 'random_strength': 6.070739414730386, 'grow_policy': 'Lossguide', 'min_data_in_leaf': 603, 'max_leaves': 84}. Best is trial 557 with value: 199.73000305555982.[0m
[32m[I 2024-10-13 14:35:52,617][0m Trial 641 finished with value: 203.81326603386515 and parameters: {'depth': 5, 'learning_rate': 0.003983320577441861, 'iterations': 2683, 'l2_leaf_reg': 5.571440012457424, 'border_count': 27, 'bagging_temperature': 0.858248092999537, 'random_strength': 5.812776689250001, 'grow_policy': 'Lossguide', 'min_data_in_leaf': 582, 'max_leaves': 95}. Best is trial 557 with value: 199.73000305555982.[0m
[32m[I 2024-10-13 14:35:55,229][0m Trial 642 finished with value: 201.38076726359807 and parameters: {'depth': 5, 'learning_rate': 0.004095213344122083, 'iterations': 2714, 'l2_leaf_reg': 6.9579328263145594, 'border_count': 27, 'bagging_temperature': 0.816230456964669, 'random_strength': 5.831998780833737, 'grow_policy': 'Lossguide', 'min_data_in_leaf': 592, 'max_leaves': 102}. Best is trial 557 with value: 199.73000305555982.[0m
[32m[I 2024-10-13 14:35:57,832][0m Trial 643 finished with value: 274.4505707373461 and parameters: {'depth': 5, 'learning_rate': 0.0049704258203949565, 'iterations': 2820, 'l2_leaf_reg': 9.880352412380166, 'border_count': 11, 'bagging_temperature': 0.8180506038415859, 'random_strength': 5.43995100568267, 'grow_policy': 'Lossguide', 'min_data_in_leaf': 651, 'max_leaves': 102}. Best is trial 557 with value: 199.73000305555982.[0m
[32m[I 2024-10-13 14:36:00,535][0m Trial 644 finished with value: 210.81347109185535 and parameters: {'depth': 5, 'learning_rate': 0.005864494995905463, 'iterations': 2740, 'l2_leaf_reg': 7.025519141773324, 'border_count': 27, 'bagging_temperature': 0.8317254603074928, 'random_strength': 5.822607740306429, 'grow_policy': 'Lossguide', 'min_data_in_leaf': 620, 'max_leaves': 98}. Best is trial 557 with value: 199.73000305555982.[0m
[32m[I 2024-10-13 14:36:03,278][0m Trial 645 finished with value: 231.63934194741816 and parameters: {'depth': 5, 'learning_rate': 0.006263652323899262, 'iterations': 2752, 'l2_leaf_reg': 7.676154185636912, 'border_count': 20, 'bagging_temperature': 0.7836803776168773, 'random_strength': 5.699894660316385, 'grow_policy': 'Lossguide', 'min_data_in_leaf': 586, 'max_leaves': 106}. Best is trial 557 with value: 199.73000305555982.[0m
[32m[I 2024-10-13 14:36:06,049][0m Trial 646 finished with value: 227.7379551469916 and parameters: {'depth': 6, 'learning_rate': 0.008083311328028456, 'iterations': 2875, 'l2_leaf_reg': 6.227074152026393, 'border_count': 28, 'bagging_temperature': 0.8104584784199597, 'random_strength': 5.845510927650266, 'grow_policy': 'Lossguide', 'min_data_in_leaf': 678, 'max_leaves': 101}. Best is trial 557 with value: 199.73000305555982.[0m
[32m[I 2024-10-13 14:36:08,651][0m Trial 647 finished with value: 229.69488874138338 and parameters: {'depth': 5, 'learning_rate': 0.007343384454475523, 'iterations': 2821, 'l2_leaf_reg': 6.435032250180392, 'border_count': 22, 'bagging_temperature': 0.8325006946145714, 'random_strength': 5.622705741032329, 'grow_policy': 'Lossguide', 'min_data_in_leaf': 592, 'max_leaves': 96}. Best is trial 557 with value: 199.73000305555982.[0m
[32m[I 2024-10-13 14:36:11,286][0m Trial 648 finished with value: 238.02613328687036 and parameters: {'depth': 5, 'learning_rate': 0.005777682999879045, 'iterations': 2740, 'l2_leaf_reg': 4.891257015893828, 'border_count': 16, 'bagging_temperature': 0.828647680276712, 'random_strength': 5.357290684171121, 'grow_policy': 'Lossguide', 'min_data_in_leaf': 613, 'max_leaves': 105}. Best is trial 557 with value: 199.73000305555982.[0m
[32m[I 2024-10-13 14:36:11,950][0m Trial 649 finished with value: 672.1391614873901 and parameters: {'depth': 5, 'learning_rate': 0.005407983131025228, 'iterations': 102, 'l2_leaf_reg': 9.695290259614431, 'border_count': 23, 'bagging_temperature': 0.8460174025513445, 'random_strength': 5.810647756901263, 'grow_policy': 'Lossguide', 'min_data_in_leaf': 570, 'max_leaves': 111}. Best is trial 557 with value: 199.73000305555982.[0m
[32m[I 2024-10-13 14:36:14,624][0m Trial 650 finished with value: 221.77124980416247 and parameters: {'depth': 5, 'learning_rate': 0.006824263359173592, 'iterations': 2775, 'l2_leaf_reg': 5.397322804237642, 'border_count': 28, 'bagging_temperature': 0.8016579164020796, 'random_strength': 6.108746529765259, 'grow_policy': 'Lossguide', 'min_data_in_leaf': 590, 'max_leaves': 96}. Best is trial 557 with value: 199.73000305555982.[0m
[32m[I 2024-10-13 14:36:17,231][0m Trial 651 finished with value: 231.8735548527606 and parameters: {'depth': 5, 'learning_rate': 0.004066783852716934, 'iterations': 2718, 'l2_leaf_reg': 6.909008758391479, 'border_count': 17, 'bagging_temperature': 0.856156082606502, 'random_strength': 5.890890494494129, 'grow_policy': 'Lossguide', 'min_data_in_leaf': 638, 'max_leaves': 99}. Best is trial 557 with value: 199.73000305555982.[0m
[32m[I 2024-10-13 14:36:19,863][0m Trial 652 finished with value: 212.70083612420427 and parameters: {'depth': 6, 'learning_rate': 0.004727073878667673, 'iterations': 2832, 'l2_leaf_reg': 4.291195336647507, 'border_count': 27, 'bagging_temperature': 0.8296186988514237, 'random_strength': 5.5261660601018106, 'grow_policy': 'Lossguide', 'min_data_in_leaf': 571, 'max_leaves': 95}. Best is trial 557 with value: 199.73000305555982.[0m
