[32m[I 2024-10-13 14:22:52,988][0m Trial 352 finished with value: 219.799865631679 and parameters: {'depth': 4, 'learning_rate': 0.0030905901450323345, 'iterations': 2403, 'l2_leaf_reg': 3.420895212594914e-05, 'border_count': 30, 'bagging_temperature': 0.8941604078230103, 'random_strength': 7.424056256119202, 'grow_policy': 'Depthwise', 'min_data_in_leaf': 392}. Best is trial 249 with value: 218.928091082675.[0m
[32m[I 2024-10-13 14:22:55,355][0m Trial 353 finished with value: 226.6321679383739 and parameters: {'depth': 4, 'learning_rate': 0.002488244178996491, 'iterations': 2468, 'l2_leaf_reg': 2.5726191048810226e-05, 'border_count': 24, 'bagging_temperature': 0.9146094667888177, 'random_strength': 7.501686166864614, 'grow_policy': 'Depthwise', 'min_data_in_leaf': 544}. Best is trial 249 with value: 218.928091082675.[0m
[32m[I 2024-10-13 14:22:57,694][0m Trial 354 finished with value: 226.12081285623498 and parameters: {'depth': 4, 'learning_rate': 0.0021504919967752457, 'iterations': 2265, 'l2_leaf_reg': 8.476505442545358e-05, 'border_count': 38, 'bagging_temperature': 0.9326779392729857, 'random_strength': 2.2311664886377125, 'grow_policy': 'Depthwise', 'min_data_in_leaf': 501}. Best is trial 249 with value: 218.928091082675.[0m
[32m[I 2024-10-13 14:23:00,219][0m Trial 355 finished with value: 219.2036942903129 and parameters: {'depth': 4, 'learning_rate': 0.0028271121038044604, 'iterations': 2540, 'l2_leaf_reg': 4.55148786069982e-05, 'border_count': 33, 'bagging_temperature': 0.9461579938328449, 'random_strength': 7.022868980561686, 'grow_policy': 'Depthwise', 'min_data_in_leaf': 544}. Best is trial 249 with value: 218.928091082675.[0m
[32m[I 2024-10-13 14:23:02,676][0m Trial 356 finished with value: 247.82866883056042 and parameters: {'depth': 4, 'learning_rate': 0.003184667495341373, 'iterations': 2522, 'l2_leaf_reg': 4.738888599962118e-05, 'border_count': 20, 'bagging_temperature': 0.9334621607647287, 'random_strength': 6.512488704116306, 'grow_policy': 'Depthwise', 'min_data_in_leaf': 508}. Best is trial 249 with value: 218.928091082675.[0m
[32m[I 2024-10-13 14:23:05,896][0m Trial 357 finished with value: 237.02606849234562 and parameters: {'depth': 4, 'learning_rate': 0.002770227660670863, 'iterations': 2424, 'l2_leaf_reg': 6.715082435367437e-05, 'border_count': 26, 'bagging_temperature': 0.8877855861809797, 'random_strength': 6.885794748666148, 'grow_policy': 'Depthwise', 'min_data_in_leaf': 57}. Best is trial 249 with value: 218.928091082675.[0m
[32m[I 2024-10-13 14:23:08,354][0m Trial 358 finished with value: 250.6674624537933 and parameters: {'depth': 3, 'learning_rate': 0.0018047236666505649, 'iterations': 2573, 'l2_leaf_reg': 4.47045175264472e-05, 'border_count': 142, 'bagging_temperature': 0.9505531084909233, 'random_strength': 7.01659590258941, 'grow_policy': 'Depthwise', 'min_data_in_leaf': 549}. Best is trial 249 with value: 218.928091082675.[0m
[32m[I 2024-10-13 14:23:10,738][0m Trial 359 finished with value: 221.03377935004283 and parameters: {'depth': 4, 'learning_rate': 0.0023312791625439387, 'iterations': 2485, 'l2_leaf_reg': 0.00023517803145441612, 'border_count': 33, 'bagging_temperature': 0.9094005755133108, 'random_strength': 6.256560765403479, 'grow_policy': 'Depthwise', 'min_data_in_leaf': 566}. Best is trial 249 with value: 218.928091082675.[0m
[32m[I 2024-10-13 14:23:13,111][0m Trial 360 finished with value: 221.39753442814464 and parameters: {'depth': 4, 'learning_rate': 0.0034806014770354748, 'iterations': 2418, 'l2_leaf_reg': 0.0001405723115617559, 'border_count': 29, 'bagging_temperature': 0.9713538033573471, 'random_strength': 7.728718418656933, 'grow_policy': 'Depthwise', 'min_data_in_leaf': 535}. Best is trial 249 with value: 218.928091082675.[0m
[32m[I 2024-10-13 14:23:15,550][0m Trial 361 finished with value: 236.28336092688338 and parameters: {'depth': 4, 'learning_rate': 0.002940678821883901, 'iterations': 2524, 'l2_leaf_reg': 3.5361935674987024e-05, 'border_count': 44, 'bagging_temperature': 0.9325072819715056, 'random_strength': 7.347750419698882, 'grow_policy': 'Depthwise', 'min_data_in_leaf': 284}. Best is trial 249 with value: 218.928091082675.[0m
[32m[I 2024-10-13 14:23:17,832][0m Trial 362 finished with value: 225.2569915969517 and parameters: {'depth': 4, 'learning_rate': 0.0021226338219245584, 'iterations': 2341, 'l2_leaf_reg': 1.765520654089204e-05, 'border_count': 34, 'bagging_temperature': 0.9520497685623983, 'random_strength': 7.088021926182614, 'grow_policy': 'Depthwise', 'min_data_in_leaf': 522}. Best is trial 249 with value: 218.928091082675.[0m
[32m[I 2024-10-13 14:23:20,243][0m Trial 363 finished with value: 226.1279617504972 and parameters: {'depth': 11, 'learning_rate': 0.002552188812825211, 'iterations': 2561, 'l2_leaf_reg': 2.6274983190120687e-05, 'border_count': 24, 'bagging_temperature': 0.9691407154469501, 'random_strength': 7.5538522473440075, 'grow_policy': 'Depthwise', 'min_data_in_leaf': 548}. Best is trial 249 with value: 218.928091082675.[0m
[32m[I 2024-10-13 14:23:22,568][0m Trial 364 finished with value: 220.06572231024919 and parameters: {'depth': 3, 'learning_rate': 0.00312484932034046, 'iterations': 2460, 'l2_leaf_reg': 0.00114068804867479, 'border_count': 40, 'bagging_temperature': 0.9829604537891118, 'random_strength': 4.0631042993284225, 'grow_policy': 'Depthwise', 'min_data_in_leaf': 579}. Best is trial 249 with value: 218.928091082675.[0m
[32m[I 2024-10-13 14:23:25,070][0m Trial 365 finished with value: 249.81393969555145 and parameters: {'depth': 4, 'learning_rate': 0.0037839896385702615, 'iterations': 2611, 'l2_leaf_reg': 7.786582112004251e-05, 'border_count': 74, 'bagging_temperature': 0.6670004029841692, 'random_strength': 7.2343301536229525, 'grow_policy': 'Depthwise', 'min_data_in_leaf': 474}. Best is trial 249 with value: 218.928091082675.[0m
[32m[I 2024-10-13 14:23:27,388][0m Trial 366 finished with value: 315.9184601554364 and parameters: {'depth': 4, 'learning_rate': 0.002489136618479234, 'iterations': 2386, 'l2_leaf_reg': 1.6933188210324254e-05, 'border_count': 12, 'bagging_temperature': 0.22126808355376348, 'random_strength': 7.454218251380067, 'grow_policy': 'Depthwise', 'min_data_in_leaf': 346}. Best is trial 249 with value: 218.928091082675.[0m
[32m[I 2024-10-13 14:23:29,713][0m Trial 367 finished with value: 229.03988681731755 and parameters: {'depth': 3, 'learning_rate': 0.0018619710213683425, 'iterations': 2483, 'l2_leaf_reg': 4.1202968862240635e-05, 'border_count': 33, 'bagging_temperature': 0.9465405271100775, 'random_strength': 6.672647043205815, 'grow_policy': 'Depthwise', 'min_data_in_leaf': 298}. Best is trial 249 with value: 218.928091082675.[0m
[32m[I 2024-10-13 14:23:37,972][0m Trial 368 finished with value: 284.06791857264017 and parameters: {'depth': 4, 'learning_rate': 0.002851997841872601, 'iterations': 2278, 'l2_leaf_reg': 2.2896855479268227e-05, 'border_count': 58, 'bagging_temperature': 0.9245534138228991, 'random_strength': 7.673624992926079, 'grow_policy': 'SymmetricTree', 'min_data_in_leaf': 257}. Best is trial 249 with value: 218.928091082675.[0m
[32m[I 2024-10-13 14:23:40,367][0m Trial 369 finished with value: 225.4317769920656 and parameters: {'depth': 4, 'learning_rate': 0.0042821692391222235, 'iterations': 2572, 'l2_leaf_reg': 5.745029999737533e-05, 'border_count': 28, 'bagging_temperature': 0.9672785300990917, 'random_strength': 7.068717959942995, 'grow_policy': 'Depthwise', 'min_data_in_leaf': 200}. Best is trial 249 with value: 218.928091082675.[0m
[32m[I 2024-10-13 14:23:42,782][0m Trial 370 finished with value: 638.3791751018987 and parameters: {'depth': 5, 'learning_rate': 0.00023303880311677973, 'iterations': 2530, 'l2_leaf_reg': 1.3777425935107799e-05, 'border_count': 46, 'bagging_temperature': 0.9820894721108707, 'random_strength': 7.334812961230261, 'grow_policy': 'Lossguide', 'min_data_in_leaf': 496, 'max_leaves': 43}. Best is trial 249 with value: 218.928091082675.[0m
[32m[I 2024-10-13 14:23:44,398][0m Trial 371 finished with value: 305.0384793287123 and parameters: {'depth': 4, 'learning_rate': 0.002136197810611382, 'iterations': 1408, 'l2_leaf_reg': 2.8797985241353995e-05, 'border_count': 19, 'bagging_temperature': 0.9552078611669163, 'random_strength': 6.913919019488407, 'grow_policy': 'Lossguide', 'min_data_in_leaf': 447, 'max_leaves': 49}. Best is trial 249 with value: 218.928091082675.[0m
[32m[I 2024-10-13 14:23:46,747][0m Trial 372 finished with value: 225.37851861578127 and parameters: {'depth': 4, 'learning_rate': 0.003390380857436477, 'iterations': 2441, 'l2_leaf_reg': 8.478742420101414e-06, 'border_count': 36, 'bagging_temperature': 0.4786513465870406, 'random_strength': 7.926259100127364, 'grow_policy': 'Depthwise', 'min_data_in_leaf': 230}. Best is trial 249 with value: 218.928091082675.[0m
[32m[I 2024-10-13 14:23:49,201][0m Trial 373 finished with value: 242.57294030144777 and parameters: {'depth': 3, 'learning_rate': 0.001544431849183901, 'iterations': 2593, 'l2_leaf_reg': 9.587929208893866e-05, 'border_count': 41, 'bagging_temperature': 0.42954541389836043, 'random_strength': 7.2268075513056065, 'grow_policy': 'Lossguide', 'min_data_in_leaf': 424, 'max_leaves': 66}. Best is trial 249 with value: 218.928091082675.[0m
[32m[I 2024-10-13 14:23:51,758][0m Trial 374 finished with value: 219.10766044355833 and parameters: {'depth': 5, 'learning_rate': 0.0025800836751962773, 'iterations': 2783, 'l2_leaf_reg': 1.3968041332974873e-05, 'border_count': 32, 'bagging_temperature': 0.938273234159172, 'random_strength': 7.597772025972011, 'grow_policy': 'Lossguide', 'min_data_in_leaf': 273, 'max_leaves': 74}. Best is trial 249 with value: 218.928091082675.[0m
[32m[I 2024-10-13 14:23:54,301][0m Trial 375 finished with value: 220.81182889407694 and parameters: {'depth': 5, 'learning_rate': 0.0023591011659435477, 'iterations': 2823, 'l2_leaf_reg': 5.5802471352917105e-06, 'border_count': 29, 'bagging_temperature': 0.9052126900733872, 'random_strength': 7.6928093481533955, 'grow_policy': 'Lossguide', 'min_data_in_leaf': 274, 'max_leaves': 74}. Best is trial 249 with value: 218.928091082675.[0m
[32m[I 2024-10-13 14:23:56,949][0m Trial 376 finished with value: 246.36578127922283 and parameters: {'depth': 5, 'learning_rate': 0.0030624960003336763, 'iterations': 2877, 'l2_leaf_reg': 1.975663628059938e-05, 'border_count': 21, 'bagging_temperature': 0.8681629556372545, 'random_strength': 8.034366251305256, 'grow_policy': 'Lossguide', 'min_data_in_leaf': 256, 'max_leaves': 40}. Best is trial 249 with value: 218.928091082675.[0m
[32m[I 2024-10-13 14:23:59,638][0m Trial 377 finished with value: 222.98991206066668 and parameters: {'depth': 5, 'learning_rate': 0.0025169463428069932, 'iterations': 2937, 'l2_leaf_reg': 1.1042199510651147e-05, 'border_count': 25, 'bagging_temperature': 0.9180387699495771, 'random_strength': 7.574126383054988, 'grow_policy': 'Lossguide', 'min_data_in_leaf': 271, 'max_leaves': 60}. Best is trial 249 with value: 218.928091082675.[0m
[32m[I 2024-10-13 14:24:02,513][0m Trial 378 finished with value: 223.43670271869834 and parameters: {'depth': 5, 'learning_rate': 0.0019737117764922147, 'iterations': 2803, 'l2_leaf_reg': 3.1731462067798986e-05, 'border_count': 32, 'bagging_temperature': 0.6237716806801656, 'random_strength': 7.8061867547041235, 'grow_policy': 'Depthwise', 'min_data_in_leaf': 291}. Best is trial 249 with value: 218.928091082675.[0m
[32m[I 2024-10-13 14:24:05,056][0m Trial 379 finished with value: 223.0281198456287 and parameters: {'depth': 5, 'learning_rate': 0.0035449418275679996, 'iterations': 2786, 'l2_leaf_reg': 1.5293084252416063e-05, 'border_count': 34, 'bagging_temperature': 0.9335671809292462, 'random_strength': 7.434176426638954, 'grow_policy': 'Lossguide', 'min_data_in_leaf': 324, 'max_leaves': 199}. Best is trial 249 with value: 218.928091082675.[0m
[32m[I 2024-10-13 14:24:07,632][0m Trial 380 finished with value: 246.17507423812546 and parameters: {'depth': 4, 'learning_rate': 0.0027301219059336964, 'iterations': 2739, 'l2_leaf_reg': 4.3782607451838574e-05, 'border_count': 210, 'bagging_temperature': 0.9448220401501716, 'random_strength': 7.516464544497284, 'grow_policy': 'Lossguide', 'min_data_in_leaf': 309, 'max_leaves': 52}. Best is trial 249 with value: 218.928091082675.[0m
[32m[I 2024-10-13 14:24:09,855][0m Trial 381 finished with value: 298.97838606044326 and parameters: {'depth': 4, 'learning_rate': 0.0011225183484397635, 'iterations': 2335, 'l2_leaf_reg': 8.140639939008014e-06, 'border_count': 220, 'bagging_temperature': 0.5575954130662452, 'random_strength': 7.777166564261385, 'grow_policy': 'Lossguide', 'min_data_in_leaf': 222, 'max_leaves': 242}. Best is trial 249 with value: 218.928091082675.[0m
[32m[I 2024-10-13 14:24:12,389][0m Trial 382 finished with value: 306.48981896440273 and parameters: {'depth': 4, 'learning_rate': 0.13236494324131493, 'iterations': 2692, 'l2_leaf_reg': 0.00012882674364220336, 'border_count': 29, 'bagging_temperature': 0.9992148981290143, 'random_strength': 7.337886515280503, 'grow_policy': 'Lossguide', 'min_data_in_leaf': 526, 'max_leaves': 73}. Best is trial 249 with value: 218.928091082675.[0m
[32m[I 2024-10-13 14:24:14,708][0m Trial 383 finished with value: 222.52338301237506 and parameters: {'depth': 5, 'learning_rate': 0.0022333460473600983, 'iterations': 2399, 'l2_leaf_reg': 2.384564603701353e-05, 'border_count': 36, 'bagging_temperature': 0.9006149158883695, 'random_strength': 7.620630974449755, 'grow_policy': 'Depthwise', 'min_data_in_leaf': 246}. Best is trial 249 with value: 218.928091082675.[0m
[32m[I 2024-10-13 14:24:16,993][0m Trial 384 finished with value: 767.1459926191683 and parameters: {'depth': 4, 'learning_rate': 0.00010225293117067171, 'iterations': 2495, 'l2_leaf_reg': 5.698821400682388e-06, 'border_count': 26, 'bagging_temperature': 0.9627794642650067, 'random_strength': 8.097270140643918, 'grow_policy': 'Lossguide', 'min_data_in_leaf': 561, 'max_leaves': 63}. Best is trial 249 with value: 218.928091082675.[0m
[32m[I 2024-10-13 14:24:17,924][0m Trial 385 finished with value: 311.7587541152053 and parameters: {'depth': 4, 'learning_rate': 0.00467119062359071, 'iterations': 516, 'l2_leaf_reg': 6.627414047878291e-05, 'border_count': 41, 'bagging_temperature': 0.9279707291902279, 'random_strength': 7.157617004998866, 'grow_policy': 'Lossguide', 'min_data_in_leaf': 285, 'max_leaves': 68}. Best is trial 249 with value: 218.928091082675.[0m
[32m[I 2024-10-13 14:24:20,338][0m Trial 386 finished with value: 247.207731041356 and parameters: {'depth': 3, 'learning_rate': 0.0031012291267995605, 'iterations': 2633, 'l2_leaf_reg': 1.7664922071601804e-05, 'border_count': 18, 'bagging_temperature': 0.8830676355649326, 'random_strength': 7.436637236124662, 'grow_policy': 'Lossguide', 'min_data_in_leaf': 490, 'max_leaves': 55}. Best is trial 249 with value: 218.928091082675.[0m
[32m[I 2024-10-13 14:24:22,880][0m Trial 387 finished with value: 224.250646774347 and parameters: {'depth': 4, 'learning_rate': 0.0036921350650227468, 'iterations': 2743, 'l2_leaf_reg': 1.084870417150989e-05, 'border_count': 31, 'bagging_temperature': 0.9788943530309301, 'random_strength': 7.885971017640424, 'grow_policy': 'Lossguide', 'min_data_in_leaf': 244, 'max_leaves': 76}. Best is trial 249 with value: 218.928091082675.[0m
[32m[I 2024-10-13 14:24:32,056][0m Trial 388 finished with value: 287.1046374326279 and parameters: {'depth': 4, 'learning_rate': 0.0017134760475511852, 'iterations': 2531, 'l2_leaf_reg': 3.062971611727112e-05, 'border_count': 35, 'bagging_temperature': 0.9447451124907795, 'random_strength': 7.261031014960304, 'grow_policy': 'SymmetricTree', 'min_data_in_leaf': 467}. Best is trial 249 with value: 218.928091082675.[0m
[32m[I 2024-10-13 14:24:34,240][0m Trial 389 finished with value: 223.9746722570451 and parameters: {'depth': 5, 'learning_rate': 0.002689144717640985, 'iterations': 2234, 'l2_leaf_reg': 0.00043583170387283564, 'border_count': 25, 'bagging_temperature': 0.9662969818819851, 'random_strength': 7.679663655628401, 'grow_policy': 'Depthwise', 'min_data_in_leaf': 595}. Best is trial 249 with value: 218.928091082675.[0m
[32m[I 2024-10-13 14:24:36,496][0m Trial 390 finished with value: 235.19648217193088 and parameters: {'depth': 4, 'learning_rate': 0.002347580172543104, 'iterations': 2382, 'l2_leaf_reg': 4.799637430583277e-05, 'border_count': 47, 'bagging_temperature': 0.9991166543863869, 'random_strength': 7.118565357033752, 'grow_policy': 'Lossguide', 'min_data_in_leaf': 264, 'max_leaves': 58}. Best is trial 249 with value: 218.928091082675.[0m
[32m[I 2024-10-13 14:24:38,802][0m Trial 391 finished with value: 220.1302875862429 and parameters: {'depth': 3, 'learning_rate': 0.0032005950458404925, 'iterations': 2452, 'l2_leaf_reg': 1.2004545978914659e-05, 'border_count': 38, 'bagging_temperature': 0.953556527463617, 'random_strength': 7.433430942437815, 'grow_policy': 'Lossguide', 'min_data_in_leaf': 441, 'max_leaves': 70}. Best is trial 249 with value: 218.928091082675.[0m
[32m[I 2024-10-13 14:24:41,086][0m Trial 392 finished with value: 225.8209880989934 and parameters: {'depth': 5, 'learning_rate': 0.0021040032034872667, 'iterations': 2313, 'l2_leaf_reg': 7.357400696087124e-06, 'border_count': 31, 'bagging_temperature': 0.9808018520183218, 'random_strength': 7.582894672823822, 'grow_policy': 'Lossguide', 'min_data_in_leaf': 195, 'max_leaves': 37}. Best is trial 249 with value: 218.928091082675.[0m
[32m[I 2024-10-13 14:24:43,481][0m Trial 393 finished with value: 232.10508482945713 and parameters: {'depth': 4, 'learning_rate': 0.004033023435461748, 'iterations': 2639, 'l2_leaf_reg': 1.9483898659035434e-05, 'border_count': 23, 'bagging_temperature': 0.9241700946945886, 'random_strength': 7.020839023547656, 'grow_policy': 'Lossguide', 'min_data_in_leaf': 210, 'max_leaves': 80}. Best is trial 249 with value: 218.928091082675.[0m
[32m[I 2024-10-13 14:24:46,090][0m Trial 394 finished with value: 235.73078077985087 and parameters: {'depth': 4, 'learning_rate': 0.0027035301513126347, 'iterations': 2513, 'l2_leaf_reg': 3.53802508479961e-05, 'border_count': 43, 'bagging_temperature': 0.95969332621922, 'random_strength': 7.291176590626182, 'grow_policy': 'Depthwise', 'min_data_in_leaf': 458}. Best is trial 249 with value: 218.928091082675.[0m
[32m[I 2024-10-13 14:24:48,510][0m Trial 395 finished with value: 220.0203999289967 and parameters: {'depth': 4, 'learning_rate': 0.003062348739695307, 'iterations': 2432, 'l2_leaf_reg': 4.675741733120138e-06, 'border_count': 28, 'bagging_temperature': 0.9840787191113342, 'random_strength': 7.89936551657247, 'grow_policy': 'Lossguide', 'min_data_in_leaf': 418, 'max_leaves': 63}. Best is trial 249 with value: 218.928091082675.[0m
[32m[I 2024-10-13 14:24:51,077][0m Trial 396 finished with value: 226.63836492849487 and parameters: {'depth': 5, 'learning_rate': 0.0018803176080643743, 'iterations': 2582, 'l2_leaf_reg': 2.5427761422444005e-05, 'border_count': 35, 'bagging_temperature': 0.9442680060166687, 'random_strength': 6.810380354989088, 'grow_policy': 'Lossguide', 'min_data_in_leaf': 514, 'max_leaves': 72}. Best is trial 249 with value: 218.928091082675.[0m
[32m[I 2024-10-13 14:24:53,454][0m Trial 397 finished with value: 247.6985523843412 and parameters: {'depth': 3, 'learning_rate': 0.002453421921059187, 'iterations': 2486, 'l2_leaf_reg': 1.3392992710107397e-05, 'border_count': 200, 'bagging_temperature': 0.9076004005294447, 'random_strength': 7.399874464275378, 'grow_policy': 'Lossguide', 'min_data_in_leaf': 477, 'max_leaves': 66}. Best is trial 249 with value: 218.928091082675.[0m
[32m[I 2024-10-13 14:24:56,053][0m Trial 398 finished with value: 222.63241681851167 and parameters: {'depth': 4, 'learning_rate': 0.0036063909580604653, 'iterations': 2688, 'l2_leaf_reg': 5.763464118092458e-05, 'border_count': 41, 'bagging_temperature': 0.9999667942174189, 'random_strength': 7.210394999500727, 'grow_policy': 'Depthwise', 'min_data_in_leaf': 225}. Best is trial 249 with value: 218.928091082675.[0m
[32m[I 2024-10-13 14:24:58,380][0m Trial 399 finished with value: 252.62752478046863 and parameters: {'depth': 4, 'learning_rate': 0.0028376008499254716, 'iterations': 2374, 'l2_leaf_reg': 9.197615242707953e-06, 'border_count': 14, 'bagging_temperature': 0.966449429496883, 'random_strength': 7.660089459359644, 'grow_policy': 'Lossguide', 'min_data_in_leaf': 382, 'max_leaves': 61}. Best is trial 249 with value: 218.928091082675.[0m
[32m[I 2024-10-13 14:25:00,764][0m Trial 400 finished with value: 221.0784817549306 and parameters: {'depth': 5, 'learning_rate': 0.0022289927583978336, 'iterations': 2553, 'l2_leaf_reg': 1.7685491442816703e-05, 'border_count': 33, 'bagging_temperature': 0.9350681778327651, 'random_strength': 7.016394694620595, 'grow_policy': 'Lossguide', 'min_data_in_leaf': 305, 'max_leaves': 76}. Best is trial 249 with value: 218.928091082675.[0m
[32m[I 2024-10-13 14:25:03,251][0m Trial 401 finished with value: 220.11777673689977 and parameters: {'depth': 4, 'learning_rate': 0.003323012848983733, 'iterations': 2628, 'l2_leaf_reg': 0.7801691320529194, 'border_count': 22, 'bagging_temperature': 0.9806116187707989, 'random_strength': 8.075307801796747, 'grow_policy': 'Lossguide', 'min_data_in_leaf': 350, 'max_leaves': 54}. Best is trial 249 with value: 218.928091082675.[0m
[32m[I 2024-10-13 14:25:05,758][0m Trial 402 finished with value: 227.98593106999562 and parameters: {'depth': 4, 'learning_rate': 0.0043618636168383604, 'iterations': 2742, 'l2_leaf_reg': 3.607743404085627e-05, 'border_count': 29, 'bagging_temperature': 0.9530079693922159, 'random_strength': 7.494812500735665, 'grow_policy': 'Depthwise', 'min_data_in_leaf': 536}. Best is trial 249 with value: 218.928091082675.[0m
