[32m[I 2024-10-13 14:42:22,078][0m Trial 753 finished with value: 212.7167984455772 and parameters: {'depth': 7, 'learning_rate': 0.004845490652182998, 'iterations': 2946, 'l2_leaf_reg': 6.481433723768535, 'border_count': 58, 'bagging_temperature': 0.7337856730194674, 'random_strength': 3.282928290203426, 'grow_policy': 'Lossguide', 'min_data_in_leaf': 475, 'max_leaves': 142}. Best is trial 684 with value: 198.81639474308358.[0m
[32m[I 2024-10-13 14:42:24,840][0m Trial 754 finished with value: 204.82386633673008 and parameters: {'depth': 7, 'learning_rate': 0.003951059167754989, 'iterations': 2893, 'l2_leaf_reg': 9.845747003087878, 'border_count': 66, 'bagging_temperature': 0.697532134662531, 'random_strength': 4.521121747514982, 'grow_policy': 'Lossguide', 'min_data_in_leaf': 531, 'max_leaves': 127}. Best is trial 684 with value: 198.81639474308358.[0m
[32m[I 2024-10-13 14:42:27,546][0m Trial 755 finished with value: 200.38197824871276 and parameters: {'depth': 9, 'learning_rate': 0.0033517627006478933, 'iterations': 2947, 'l2_leaf_reg': 9.831950217835521, 'border_count': 43, 'bagging_temperature': 0.7765987131563459, 'random_strength': 4.160321503061038, 'grow_policy': 'Lossguide', 'min_data_in_leaf': 505, 'max_leaves': 123}. Best is trial 684 with value: 198.81639474308358.[0m
[32m[I 2024-10-13 14:42:30,277][0m Trial 756 finished with value: 206.71408442673268 and parameters: {'depth': 9, 'learning_rate': 0.0033539888695443307, 'iterations': 2890, 'l2_leaf_reg': 4.438220316345186, 'border_count': 49, 'bagging_temperature': 0.7882215212068353, 'random_strength': 4.85763238426249, 'grow_policy': 'Lossguide', 'min_data_in_leaf': 524, 'max_leaves': 131}. Best is trial 684 with value: 198.81639474308358.[0m
[32m[I 2024-10-13 14:42:33,054][0m Trial 757 finished with value: 219.55614869731428 and parameters: {'depth': 8, 'learning_rate': 0.0045341087815930995, 'iterations': 3000, 'l2_leaf_reg': 3.4330437603329997, 'border_count': 44, 'bagging_temperature': 0.7651649576013653, 'random_strength': 4.167791162361661, 'grow_policy': 'Lossguide', 'min_data_in_leaf': 506, 'max_leaves': 122}. Best is trial 684 with value: 198.81639474308358.[0m
[32m[I 2024-10-13 14:42:35,680][0m Trial 758 finished with value: 211.0615403956267 and parameters: {'depth': 8, 'learning_rate': 0.0039975869226814105, 'iterations': 2942, 'l2_leaf_reg': 6.364416124144306, 'border_count': 55, 'bagging_temperature': 0.7980044259764261, 'random_strength': 3.93952746642405, 'grow_policy': 'Lossguide', 'min_data_in_leaf': 505, 'max_leaves': 125}. Best is trial 684 with value: 198.81639474308358.[0m
[32m[I 2024-10-13 14:42:38,349][0m Trial 759 finished with value: 205.41417922918754 and parameters: {'depth': 9, 'learning_rate': 0.0031947308780581793, 'iterations': 2893, 'l2_leaf_reg': 4.570619399150228, 'border_count': 44, 'bagging_temperature': 0.7764737316433208, 'random_strength': 4.610948874681849, 'grow_policy': 'Lossguide', 'min_data_in_leaf': 524, 'max_leaves': 136}. Best is trial 684 with value: 198.81639474308358.[0m
[32m[I 2024-10-13 14:42:41,226][0m Trial 760 finished with value: 200.34830377448918 and parameters: {'depth': 7, 'learning_rate': 0.003264156168609868, 'iterations': 2998, 'l2_leaf_reg': 9.76031755438907, 'border_count': 50, 'bagging_temperature': 0.7803420179433832, 'random_strength': 4.421044190243008, 'grow_policy': 'Lossguide', 'min_data_in_leaf': 472, 'max_leaves': 132}. Best is trial 684 with value: 198.81639474308358.[0m
[32m[I 2024-10-13 14:42:44,115][0m Trial 761 finished with value: 199.95180456337317 and parameters: {'depth': 7, 'learning_rate': 0.0032480823786602076, 'iterations': 2999, 'l2_leaf_reg': 9.836445827493044, 'border_count': 43, 'bagging_temperature': 0.801410736048025, 'random_strength': 4.296855281682268, 'grow_policy': 'Lossguide', 'min_data_in_leaf': 475, 'max_leaves': 132}. Best is trial 684 with value: 198.81639474308358.[0m
[32m[I 2024-10-13 14:43:05,370][0m Trial 762 finished with value: 300.32133269950845 and parameters: {'depth': 7, 'learning_rate': 0.003219144547578087, 'iterations': 2949, 'l2_leaf_reg': 6.627819424173728, 'border_count': 43, 'bagging_temperature': 0.8024226852037837, 'random_strength': 4.428926055019401, 'grow_policy': 'SymmetricTree', 'min_data_in_leaf': 464}. Best is trial 684 with value: 198.81639474308358.[0m
[32m[I 2024-10-13 14:43:08,142][0m Trial 763 finished with value: 639.2621078466641 and parameters: {'depth': 7, 'learning_rate': 0.0001985461253813048, 'iterations': 2999, 'l2_leaf_reg': 4.599096424783716, 'border_count': 52, 'bagging_temperature': 0.7852246760211569, 'random_strength': 4.7885993222468075, 'grow_policy': 'Lossguide', 'min_data_in_leaf': 469, 'max_leaves': 138}. Best is trial 684 with value: 198.81639474308358.[0m
[32m[I 2024-10-13 14:43:10,962][0m Trial 764 finished with value: 323.0019289064857 and parameters: {'depth': 7, 'learning_rate': 0.1262409500923846, 'iterations': 2999, 'l2_leaf_reg': 6.545518725885252, 'border_count': 47, 'bagging_temperature': 0.79999247332978, 'random_strength': 4.440277207732013, 'grow_policy': 'Lossguide', 'min_data_in_leaf': 485, 'max_leaves': 142}. Best is trial 684 with value: 198.81639474308358.[0m
[32m[I 2024-10-13 14:43:13,696][0m Trial 765 finished with value: 205.36506330174893 and parameters: {'depth': 7, 'learning_rate': 0.0032307950965444333, 'iterations': 2889, 'l2_leaf_reg': 9.976048105809173, 'border_count': 56, 'bagging_temperature': 0.8013786571403085, 'random_strength': 4.640603192342115, 'grow_policy': 'Lossguide', 'min_data_in_leaf': 477, 'max_leaves': 170}. Best is trial 684 with value: 198.81639474308358.[0m
[32m[I 2024-10-13 14:43:16,372][0m Trial 766 finished with value: 211.06791350428836 and parameters: {'depth': 7, 'learning_rate': 0.003246011893305066, 'iterations': 2937, 'l2_leaf_reg': 3.4085292157214293, 'border_count': 43, 'bagging_temperature': 0.778913656352435, 'random_strength': 3.7278983756174187, 'grow_policy': 'Lossguide', 'min_data_in_leaf': 463, 'max_leaves': 132}. Best is trial 684 with value: 198.81639474308358.[0m
[32m[I 2024-10-13 14:43:19,066][0m Trial 767 finished with value: 203.59435272092728 and parameters: {'depth': 7, 'learning_rate': 0.003843827448896339, 'iterations': 2947, 'l2_leaf_reg': 6.572974104556903, 'border_count': 50, 'bagging_temperature': 0.761341938895506, 'random_strength': 4.321290100081851, 'grow_policy': 'Lossguide', 'min_data_in_leaf': 487, 'max_leaves': 133}. Best is trial 684 with value: 198.81639474308358.[0m
[32m[I 2024-10-13 14:43:21,862][0m Trial 768 finished with value: 205.79213377375964 and parameters: {'depth': 7, 'learning_rate': 0.0032167430808226777, 'iterations': 2999, 'l2_leaf_reg': 4.777839448764982, 'border_count': 42, 'bagging_temperature': 0.8053442302239274, 'random_strength': 4.915283961805597, 'grow_policy': 'Lossguide', 'min_data_in_leaf': 492, 'max_leaves': 138}. Best is trial 684 with value: 198.81639474308358.[0m
[32m[I 2024-10-13 14:43:24,646][0m Trial 769 finished with value: 204.54857381087677 and parameters: {'depth': 7, 'learning_rate': 0.0037508214256213035, 'iterations': 2998, 'l2_leaf_reg': 6.428640570757816, 'border_count': 42, 'bagging_temperature': 0.7460753757047381, 'random_strength': 4.5417463059393155, 'grow_policy': 'Lossguide', 'min_data_in_leaf': 529, 'max_leaves': 129}. Best is trial 684 with value: 198.81639474308358.[0m
[32m[I 2024-10-13 14:43:27,314][0m Trial 770 finished with value: 203.35045924712634 and parameters: {'depth': 7, 'learning_rate': 0.005188704578152064, 'iterations': 2888, 'l2_leaf_reg': 9.990056736203265, 'border_count': 49, 'bagging_temperature': 0.7224331101794262, 'random_strength': 3.9617731886413106, 'grow_policy': 'Lossguide', 'min_data_in_leaf': 461, 'max_leaves': 143}. Best is trial 684 with value: 198.81639474308358.[0m
[32m[I 2024-10-13 14:43:30,016][0m Trial 771 finished with value: 214.02790915561428 and parameters: {'depth': 7, 'learning_rate': 0.0039608314885719205, 'iterations': 2940, 'l2_leaf_reg': 3.4321488583454243, 'border_count': 45, 'bagging_temperature': 0.7829311925801459, 'random_strength': 4.169098026096425, 'grow_policy': 'Lossguide', 'min_data_in_leaf': 494, 'max_leaves': 135}. Best is trial 684 with value: 198.81639474308358.[0m
[32m[I 2024-10-13 14:43:32,760][0m Trial 772 finished with value: 206.31389312415385 and parameters: {'depth': 7, 'learning_rate': 0.003191799411660609, 'iterations': 2890, 'l2_leaf_reg': 6.393758791888313, 'border_count': 53, 'bagging_temperature': 0.8058659848383914, 'random_strength': 4.735635915995897, 'grow_policy': 'Lossguide', 'min_data_in_leaf': 529, 'max_leaves': 129}. Best is trial 684 with value: 198.81639474308358.[0m
[32m[I 2024-10-13 14:43:35,594][0m Trial 773 finished with value: 212.86675759993088 and parameters: {'depth': 7, 'learning_rate': 0.0045792179079042275, 'iterations': 3000, 'l2_leaf_reg': 4.6110239426751765, 'border_count': 41, 'bagging_temperature': 0.7588986994446427, 'random_strength': 4.267117593604579, 'grow_policy': 'Lossguide', 'min_data_in_leaf': 476, 'max_leaves': 139}. Best is trial 684 with value: 198.81639474308358.[0m
[32m[I 2024-10-13 14:43:38,274][0m Trial 774 finished with value: 332.99994352939683 and parameters: {'depth': 7, 'learning_rate': 0.08566780215914688, 'iterations': 2879, 'l2_leaf_reg': 2.9535705154543908, 'border_count': 49, 'bagging_temperature': 0.7311016503174922, 'random_strength': 4.455747380058638, 'grow_policy': 'Lossguide', 'min_data_in_leaf': 510, 'max_leaves': 158}. Best is trial 684 with value: 198.81639474308358.[0m
[32m[I 2024-10-13 14:43:40,975][0m Trial 775 finished with value: 203.5472182625689 and parameters: {'depth': 8, 'learning_rate': 0.0039379639624561895, 'iterations': 2950, 'l2_leaf_reg': 6.7826903309987765, 'border_count': 42, 'bagging_temperature': 0.7770049038182056, 'random_strength': 5.031230409563118, 'grow_policy': 'Lossguide', 'min_data_in_leaf': 462, 'max_leaves': 150}. Best is trial 684 with value: 198.81639474308358.[0m
[32m[I 2024-10-13 14:43:43,677][0m Trial 776 finished with value: 206.52550169878583 and parameters: {'depth': 7, 'learning_rate': 0.0033042268684460095, 'iterations': 2880, 'l2_leaf_reg': 9.688657475536594, 'border_count': 62, 'bagging_temperature': 0.6812080372727112, 'random_strength': 3.4299838756771326, 'grow_policy': 'Lossguide', 'min_data_in_leaf': 497, 'max_leaves': 119}. Best is trial 684 with value: 198.81639474308358.[0m
[32m[I 2024-10-13 14:43:46,472][0m Trial 777 finished with value: 219.60447632420784 and parameters: {'depth': 7, 'learning_rate': 0.005055581752856301, 'iterations': 2999, 'l2_leaf_reg': 4.849265743535455, 'border_count': 58, 'bagging_temperature': 0.741068853844307, 'random_strength': 4.730587488007051, 'grow_policy': 'Lossguide', 'min_data_in_leaf': 527, 'max_leaves': 135}. Best is trial 684 with value: 198.81639474308358.[0m
[32m[I 2024-10-13 14:43:49,281][0m Trial 778 finished with value: 202.25309879018528 and parameters: {'depth': 8, 'learning_rate': 0.0039639433047546566, 'iterations': 2947, 'l2_leaf_reg': 6.7618338609149, 'border_count': 47, 'bagging_temperature': 0.807872068629544, 'random_strength': 3.7852213999744624, 'grow_policy': 'Lossguide', 'min_data_in_leaf': 481, 'max_leaves': 142}. Best is trial 684 with value: 198.81639474308358.[0m
[32m[I 2024-10-13 14:43:51,996][0m Trial 779 finished with value: 201.40247005790212 and parameters: {'depth': 7, 'learning_rate': 0.0033468826091902944, 'iterations': 2884, 'l2_leaf_reg': 9.820591021349497, 'border_count': 41, 'bagging_temperature': 0.7108699168093076, 'random_strength': 4.551676958054161, 'grow_policy': 'Lossguide', 'min_data_in_leaf': 511, 'max_leaves': 131}. Best is trial 684 with value: 198.81639474308358.[0m
[32m[I 2024-10-13 14:43:54,695][0m Trial 780 finished with value: 271.9217865883996 and parameters: {'depth': 7, 'learning_rate': 0.027323495846447138, 'iterations': 2944, 'l2_leaf_reg': 6.516504013046549, 'border_count': 46, 'bagging_temperature': 0.7640027359910426, 'random_strength': 4.333216994599875, 'grow_policy': 'Lossguide', 'min_data_in_leaf': 493, 'max_leaves': 136}. Best is trial 684 with value: 198.81639474308358.[0m
[32m[I 2024-10-13 14:43:57,488][0m Trial 781 finished with value: 224.70382552707974 and parameters: {'depth': 7, 'learning_rate': 0.004539385926208903, 'iterations': 3000, 'l2_leaf_reg': 3.0593313574215335, 'border_count': 53, 'bagging_temperature': 0.7865237771883347, 'random_strength': 3.9459501192678914, 'grow_policy': 'Lossguide', 'min_data_in_leaf': 461, 'max_leaves': 165}. Best is trial 684 with value: 198.81639474308358.[0m
[32m[I 2024-10-13 14:44:00,222][0m Trial 782 finished with value: 206.30363176265055 and parameters: {'depth': 7, 'learning_rate': 0.003809430260680156, 'iterations': 2943, 'l2_leaf_reg': 5.038837564020315, 'border_count': 41, 'bagging_temperature': 0.8127338138149454, 'random_strength': 4.823571019812012, 'grow_policy': 'Lossguide', 'min_data_in_leaf': 534, 'max_leaves': 127}. Best is trial 684 with value: 198.81639474308358.[0m
[32m[I 2024-10-13 14:44:20,987][0m Trial 783 finished with value: 295.6488909114833 and parameters: {'depth': 7, 'learning_rate': 0.0031602787973951927, 'iterations': 2876, 'l2_leaf_reg': 6.8061329548710425, 'border_count': 40, 'bagging_temperature': 0.763045899671105, 'random_strength': 4.143912884466197, 'grow_policy': 'SymmetricTree', 'min_data_in_leaf': 509}. Best is trial 684 with value: 198.81639474308358.[0m
[32m[I 2024-10-13 14:44:23,677][0m Trial 784 finished with value: 203.12963208220313 and parameters: {'depth': 8, 'learning_rate': 0.0051396989963969734, 'iterations': 2947, 'l2_leaf_reg': 9.745466901632994, 'border_count': 48, 'bagging_temperature': 0.7857490028257899, 'random_strength': 4.590213895049171, 'grow_policy': 'Lossguide', 'min_data_in_leaf': 484, 'max_leaves': 144}. Best is trial 684 with value: 198.81639474308358.[0m
[32m[I 2024-10-13 14:44:26,395][0m Trial 785 finished with value: 209.58291048244863 and parameters: {'depth': 7, 'learning_rate': 0.00413926435158926, 'iterations': 2999, 'l2_leaf_reg': 4.689544431920756, 'border_count': 40, 'bagging_temperature': 0.8033782525769264, 'random_strength': 4.389761094267276, 'grow_policy': 'Lossguide', 'min_data_in_leaf': 531, 'max_leaves': 132}. Best is trial 684 with value: 198.81639474308358.[0m
[32m[I 2024-10-13 14:44:29,072][0m Trial 786 finished with value: 206.87892864383966 and parameters: {'depth': 7, 'learning_rate': 0.003098350429038476, 'iterations': 2877, 'l2_leaf_reg': 9.944815725535845, 'border_count': 57, 'bagging_temperature': 0.7307637944804491, 'random_strength': 4.984475496752915, 'grow_policy': 'Lossguide', 'min_data_in_leaf': 472, 'max_leaves': 149}. Best is trial 684 with value: 198.81639474308358.[0m
[32m[I 2024-10-13 14:44:31,788][0m Trial 787 finished with value: 202.46416748483924 and parameters: {'depth': 8, 'learning_rate': 0.0037317081885699273, 'iterations': 2937, 'l2_leaf_reg': 6.827868069851446, 'border_count': 46, 'bagging_temperature': 0.7478390678750875, 'random_strength': 3.5888867479448616, 'grow_policy': 'Lossguide', 'min_data_in_leaf': 500, 'max_leaves': 139}. Best is trial 684 with value: 198.81639474308358.[0m
[32m[I 2024-10-13 14:44:34,499][0m Trial 788 finished with value: 201.3964053183646 and parameters: {'depth': 7, 'learning_rate': 0.004615313045926935, 'iterations': 2939, 'l2_leaf_reg': 9.915607235216704, 'border_count': 40, 'bagging_temperature': 0.7762076146110729, 'random_strength': 4.2440052338476955, 'grow_policy': 'Lossguide', 'min_data_in_leaf': 515, 'max_leaves': 139}. Best is trial 684 with value: 198.81639474308358.[0m
[32m[I 2024-10-13 14:44:37,225][0m Trial 789 finished with value: 224.9733151264946 and parameters: {'depth': 7, 'learning_rate': 0.0032352775316416924, 'iterations': 2879, 'l2_leaf_reg': 2.9007817194242795, 'border_count': 168, 'bagging_temperature': 0.8101220704322473, 'random_strength': 4.01198225263188, 'grow_policy': 'Lossguide', 'min_data_in_leaf': 484, 'max_leaves': 127}. Best is trial 684 with value: 198.81639474308358.[0m
[32m[I 2024-10-13 14:44:40,037][0m Trial 790 finished with value: 216.77206763802982 and parameters: {'depth': 8, 'learning_rate': 0.003811198023876659, 'iterations': 2999, 'l2_leaf_reg': 4.40596844865642, 'border_count': 52, 'bagging_temperature': 0.6991815454770476, 'random_strength': 4.706264994333605, 'grow_policy': 'Lossguide', 'min_data_in_leaf': 461, 'max_leaves': 134}. Best is trial 684 with value: 198.81639474308358.[0m
[32m[I 2024-10-13 14:44:42,687][0m Trial 791 finished with value: 211.66194471154373 and parameters: {'depth': 7, 'learning_rate': 0.004525234401719752, 'iterations': 2942, 'l2_leaf_reg': 6.575952585770767, 'border_count': 64, 'bagging_temperature': 0.7562539783669919, 'random_strength': 4.456125542781421, 'grow_policy': 'Lossguide', 'min_data_in_leaf': 535, 'max_leaves': 117}. Best is trial 684 with value: 198.81639474308358.[0m
[32m[I 2024-10-13 14:44:45,324][0m Trial 792 finished with value: 219.22674727329084 and parameters: {'depth': 7, 'learning_rate': 0.005206851774649819, 'iterations': 2884, 'l2_leaf_reg': 6.7008651651319315, 'border_count': 92, 'bagging_temperature': 0.7216280279313605, 'random_strength': 4.184101605160574, 'grow_policy': 'Lossguide', 'min_data_in_leaf': 501, 'max_leaves': 156}. Best is trial 684 with value: 198.81639474308358.[0m
[32m[I 2024-10-13 14:44:48,098][0m Trial 793 finished with value: 206.60990186179976 and parameters: {'depth': 8, 'learning_rate': 0.003192712401769594, 'iterations': 2999, 'l2_leaf_reg': 4.408475427683508, 'border_count': 44, 'bagging_temperature': 0.7907134306204207, 'random_strength': 4.883763767748253, 'grow_policy': 'Lossguide', 'min_data_in_leaf': 521, 'max_leaves': 144}. Best is trial 684 with value: 198.81639474308358.[0m
[32m[I 2024-10-13 14:44:50,879][0m Trial 794 finished with value: 206.5212623894825 and parameters: {'depth': 7, 'learning_rate': 0.003823403292968966, 'iterations': 3000, 'l2_leaf_reg': 9.737646320037811, 'border_count': 39, 'bagging_temperature': 0.4503516717813566, 'random_strength': 4.634012369581026, 'grow_policy': 'Lossguide', 'min_data_in_leaf': 483, 'max_leaves': 131}. Best is trial 684 with value: 198.81639474308358.[0m
[32m[I 2024-10-13 14:44:53,616][0m Trial 795 finished with value: 205.35906330446807 and parameters: {'depth': 8, 'learning_rate': 0.004389116644709486, 'iterations': 2938, 'l2_leaf_reg': 6.6785469469018, 'border_count': 49, 'bagging_temperature': 0.7662852651466687, 'random_strength': 3.83741209194281, 'grow_policy': 'Lossguide', 'min_data_in_leaf': 461, 'max_leaves': 137}. Best is trial 684 with value: 198.81639474308358.[0m
[32m[I 2024-10-13 14:44:56,378][0m Trial 796 finished with value: 210.16299742447174 and parameters: {'depth': 7, 'learning_rate': 0.003170399897244465, 'iterations': 2876, 'l2_leaf_reg': 3.2632491475184304, 'border_count': 44, 'bagging_temperature': 0.8185088910416833, 'random_strength': 4.393411573357463, 'grow_policy': 'Lossguide', 'min_data_in_leaf': 502, 'max_leaves': 122}. Best is trial 684 with value: 198.81639474308358.[0m
[32m[I 2024-10-13 14:44:59,029][0m Trial 797 finished with value: 200.39610850831048 and parameters: {'depth': 7, 'learning_rate': 0.0036478059746425416, 'iterations': 2941, 'l2_leaf_reg': 9.908128327059478, 'border_count': 39, 'bagging_temperature': 0.7370612307929102, 'random_strength': 4.563126694801842, 'grow_policy': 'Lossguide', 'min_data_in_leaf': 517, 'max_leaves': 142}. Best is trial 684 with value: 198.81639474308358.[0m
[32m[I 2024-10-13 14:45:01,671][0m Trial 798 finished with value: 248.84590901405807 and parameters: {'depth': 8, 'learning_rate': 0.005182159830022209, 'iterations': 2869, 'l2_leaf_reg': 3.699933086678281e-08, 'border_count': 52, 'bagging_temperature': 0.7906900248361127, 'random_strength': 4.1082477471651435, 'grow_policy': 'Lossguide', 'min_data_in_leaf': 536, 'max_leaves': 149}. Best is trial 684 with value: 198.81639474308358.[0m
[32m[I 2024-10-13 14:45:04,416][0m Trial 799 finished with value: 209.91908576235952 and parameters: {'depth': 7, 'learning_rate': 0.004296977039064885, 'iterations': 2941, 'l2_leaf_reg': 4.944122476904807, 'border_count': 39, 'bagging_temperature': 0.8114911412111102, 'random_strength': 4.807339016260875, 'grow_policy': 'Lossguide', 'min_data_in_leaf': 479, 'max_leaves': 128}. Best is trial 684 with value: 198.81639474308358.[0m
[32m[I 2024-10-13 14:45:07,148][0m Trial 800 finished with value: 314.46072187279793 and parameters: {'depth': 7, 'learning_rate': 0.17667110934978258, 'iterations': 2901, 'l2_leaf_reg': 9.897813801113491, 'border_count': 43, 'bagging_temperature': 0.7472881297596299, 'random_strength': 4.33231252654586, 'grow_policy': 'Lossguide', 'min_data_in_leaf': 495, 'max_leaves': 136}. Best is trial 684 with value: 198.81639474308358.[0m
[32m[I 2024-10-13 14:45:09,902][0m Trial 801 finished with value: 211.93489397111986 and parameters: {'depth': 8, 'learning_rate': 0.003148907757556012, 'iterations': 2946, 'l2_leaf_reg': 4.77274420337526, 'border_count': 54, 'bagging_temperature': 0.8248505787579833, 'random_strength': 5.033166214164187, 'grow_policy': 'Lossguide', 'min_data_in_leaf': 518, 'max_leaves': 133}. Best is trial 684 with value: 198.81639474308358.[0m
[32m[I 2024-10-13 14:45:12,644][0m Trial 802 finished with value: 202.81440195597736 and parameters: {'depth': 7, 'learning_rate': 0.003733216321438152, 'iterations': 2944, 'l2_leaf_reg': 6.4973215669158995, 'border_count': 48, 'bagging_temperature': 0.7729205932715595, 'random_strength': 4.559354783687304, 'grow_policy': 'Lossguide', 'min_data_in_leaf': 462, 'max_leaves': 141}. Best is trial 684 with value: 198.81639474308358.[0m
