[32m[I 2024-10-13 14:54:41,002][0m Trial 953 finished with value: 199.2423274132837 and parameters: {'depth': 7, 'learning_rate': 0.004072876051375348, 'iterations': 2895, 'l2_leaf_reg': 9.820298138591381, 'border_count': 42, 'bagging_temperature': 0.812070079167557, 'random_strength': 3.086601940283556, 'grow_policy': 'Lossguide', 'min_data_in_leaf': 482, 'max_leaves': 137}. Best is trial 684 with value: 198.81639474308358.[0m
[32m[I 2024-10-13 14:54:43,687][0m Trial 954 finished with value: 217.0086443106721 and parameters: {'depth': 7, 'learning_rate': 0.006132505465753881, 'iterations': 2799, 'l2_leaf_reg': 6.90199004196182, 'border_count': 51, 'bagging_temperature': 0.8121973551967117, 'random_strength': 2.9913094669456375, 'grow_policy': 'Lossguide', 'min_data_in_leaf': 476, 'max_leaves': 120}. Best is trial 684 with value: 198.81639474308358.[0m
[32m[I 2024-10-13 14:54:46,380][0m Trial 955 finished with value: 222.24711555409957 and parameters: {'depth': 8, 'learning_rate': 0.004883634246818835, 'iterations': 2852, 'l2_leaf_reg': 3.003364481409726, 'border_count': 43, 'bagging_temperature': 0.774638914154291, 'random_strength': 2.4645069148089114, 'grow_policy': 'Lossguide', 'min_data_in_leaf': 461, 'max_leaves': 146}. Best is trial 684 with value: 198.81639474308358.[0m
[32m[I 2024-10-13 14:54:48,965][0m Trial 956 finished with value: 207.1521809236599 and parameters: {'depth': 7, 'learning_rate': 0.00516715969368452, 'iterations': 2813, 'l2_leaf_reg': 6.856169324188474, 'border_count': 47, 'bagging_temperature': 0.7930448261287227, 'random_strength': 3.344196617097773, 'grow_policy': 'Lossguide', 'min_data_in_leaf': 505, 'max_leaves': 139}. Best is trial 684 with value: 198.81639474308358.[0m
[32m[I 2024-10-13 14:54:51,617][0m Trial 957 finished with value: 204.87042408712782 and parameters: {'depth': 9, 'learning_rate': 0.00421453161872727, 'iterations': 2884, 'l2_leaf_reg': 9.999496143873719, 'border_count': 54, 'bagging_temperature': 0.8129981950461036, 'random_strength': 3.2899623415369623, 'grow_policy': 'Lossguide', 'min_data_in_leaf': 534, 'max_leaves': 129}. Best is trial 684 with value: 198.81639474308358.[0m
[32m[I 2024-10-13 14:54:54,327][0m Trial 958 finished with value: 203.20528390546292 and parameters: {'depth': 7, 'learning_rate': 0.004090438910397908, 'iterations': 2900, 'l2_leaf_reg': 9.862867418447898, 'border_count': 59, 'bagging_temperature': 0.7735062257396897, 'random_strength': 3.1923227974185444, 'grow_policy': 'Lossguide', 'min_data_in_leaf': 447, 'max_leaves': 154}. Best is trial 684 with value: 198.81639474308358.[0m
[32m[I 2024-10-13 14:54:56,917][0m Trial 959 finished with value: 207.45695343612437 and parameters: {'depth': 7, 'learning_rate': 0.0038424258524852725, 'iterations': 2843, 'l2_leaf_reg': 4.592662629141149, 'border_count': 45, 'bagging_temperature': 0.7969072134854076, 'random_strength': 3.003252617214281, 'grow_policy': 'Lossguide', 'min_data_in_leaf': 484, 'max_leaves': 133}. Best is trial 684 with value: 198.81639474308358.[0m
[32m[I 2024-10-13 14:54:59,646][0m Trial 960 finished with value: 230.04092473758473 and parameters: {'depth': 8, 'learning_rate': 0.004782917776926932, 'iterations': 2905, 'l2_leaf_reg': 1.8313483558132884, 'border_count': 42, 'bagging_temperature': 0.745494767472709, 'random_strength': 3.545022095369229, 'grow_policy': 'Lossguide', 'min_data_in_leaf': 515, 'max_leaves': 142}. Best is trial 684 with value: 198.81639474308358.[0m
[32m[I 2024-10-13 14:55:02,399][0m Trial 961 finished with value: 200.01555732690312 and parameters: {'depth': 7, 'learning_rate': 0.0032128255577240855, 'iterations': 2938, 'l2_leaf_reg': 9.895385959782908, 'border_count': 50, 'bagging_temperature': 0.8282881789574921, 'random_strength': 2.842789965748606, 'grow_policy': 'Lossguide', 'min_data_in_leaf': 554, 'max_leaves': 186}. Best is trial 684 with value: 198.81639474308358.[0m
[32m[I 2024-10-13 14:55:05,059][0m Trial 962 finished with value: 221.54809912297634 and parameters: {'depth': 7, 'learning_rate': 0.0061822170475535326, 'iterations': 2860, 'l2_leaf_reg': 4.689225752457286, 'border_count': 39, 'bagging_temperature': 0.7829133829206303, 'random_strength': 3.078454303802904, 'grow_policy': 'Lossguide', 'min_data_in_leaf': 488, 'max_leaves': 126}. Best is trial 684 with value: 198.81639474308358.[0m
[32m[I 2024-10-13 14:55:07,772][0m Trial 963 finished with value: 203.55556323358996 and parameters: {'depth': 8, 'learning_rate': 0.003966685155571993, 'iterations': 3000, 'l2_leaf_reg': 6.91623497323778, 'border_count': 47, 'bagging_temperature': 0.7626654306456417, 'random_strength': 2.532625264930444, 'grow_policy': 'Lossguide', 'min_data_in_leaf': 531, 'max_leaves': 137}. Best is trial 684 with value: 198.81639474308358.[0m
[32m[I 2024-10-13 14:55:10,519][0m Trial 964 finished with value: 203.4356128994205 and parameters: {'depth': 7, 'learning_rate': 0.0030031982899785736, 'iterations': 2942, 'l2_leaf_reg': 9.944678544289662, 'border_count': 41, 'bagging_temperature': 0.732358617832083, 'random_strength': 5.255907276846263, 'grow_policy': 'Lossguide', 'min_data_in_leaf': 505, 'max_leaves': 133}. Best is trial 684 with value: 198.81639474308358.[0m
[32m[I 2024-10-13 14:55:13,111][0m Trial 965 finished with value: 221.1310015952769 and parameters: {'depth': 7, 'learning_rate': 0.005259001999891944, 'iterations': 2799, 'l2_leaf_reg': 3.4873188250747518, 'border_count': 64, 'bagging_temperature': 0.8114806361515631, 'random_strength': 3.8708272978993077, 'grow_policy': 'Lossguide', 'min_data_in_leaf': 470, 'max_leaves': 144}. Best is trial 684 with value: 198.81639474308358.[0m
[32m[I 2024-10-13 14:55:15,830][0m Trial 966 finished with value: 209.0342882366639 and parameters: {'depth': 8, 'learning_rate': 0.0026330517835622866, 'iterations': 2904, 'l2_leaf_reg': 4.975713450309033, 'border_count': 56, 'bagging_temperature': 0.7921010267509581, 'random_strength': 2.786366308238759, 'grow_policy': 'Lossguide', 'min_data_in_leaf': 522, 'max_leaves': 129}. Best is trial 684 with value: 198.81639474308358.[0m
[32m[I 2024-10-13 14:55:18,576][0m Trial 967 finished with value: 205.88156951866765 and parameters: {'depth': 7, 'learning_rate': 0.004440939648797891, 'iterations': 2956, 'l2_leaf_reg': 6.883618157706251, 'border_count': 37, 'bagging_temperature': 0.8276770873694489, 'random_strength': 3.662641744215862, 'grow_policy': 'Lossguide', 'min_data_in_leaf': 492, 'max_leaves': 119}. Best is trial 684 with value: 198.81639474308358.[0m
[32m[I 2024-10-13 14:55:21,231][0m Trial 968 finished with value: 199.28117343809728 and parameters: {'depth': 9, 'learning_rate': 0.003530811560803672, 'iterations': 2875, 'l2_leaf_reg': 9.922628632672513, 'border_count': 49, 'bagging_temperature': 0.7603663626666152, 'random_strength': 5.01269315072031, 'grow_policy': 'Lossguide', 'min_data_in_leaf': 557, 'max_leaves': 138}. Best is trial 684 with value: 198.81639474308358.[0m
[32m[I 2024-10-13 14:55:23,842][0m Trial 969 finished with value: 207.6300633912697 and parameters: {'depth': 9, 'learning_rate': 0.0032942871120752158, 'iterations': 2807, 'l2_leaf_reg': 6.685319512261513, 'border_count': 59, 'bagging_temperature': 0.7153587344382564, 'random_strength': 5.142335017232981, 'grow_policy': 'Lossguide', 'min_data_in_leaf': 550, 'max_leaves': 136}. Best is trial 684 with value: 198.81639474308358.[0m
[32m[I 2024-10-13 14:55:26,510][0m Trial 970 finished with value: 222.25490633955954 and parameters: {'depth': 7, 'learning_rate': 0.003864366667112526, 'iterations': 2857, 'l2_leaf_reg': 2.63094778829773, 'border_count': 51, 'bagging_temperature': 0.7448115253358583, 'random_strength': 4.972514768018757, 'grow_policy': 'Lossguide', 'min_data_in_leaf': 560, 'max_leaves': 123}. Best is trial 684 with value: 198.81639474308358.[0m
[32m[I 2024-10-13 14:55:29,171][0m Trial 971 finished with value: 213.8201743600546 and parameters: {'depth': 9, 'learning_rate': 0.00254729260471115, 'iterations': 2864, 'l2_leaf_reg': 4.913106302849192, 'border_count': 55, 'bagging_temperature': 0.7775045473891775, 'random_strength': 4.833993068000509, 'grow_policy': 'Lossguide', 'min_data_in_leaf': 560, 'max_leaves': 131}. Best is trial 684 with value: 198.81639474308358.[0m
[32m[I 2024-10-13 14:55:31,749][0m Trial 972 finished with value: 241.63400000227915 and parameters: {'depth': 9, 'learning_rate': 0.003026331131501749, 'iterations': 2803, 'l2_leaf_reg': 0.003270661343629689, 'border_count': 50, 'bagging_temperature': 0.6987873944988121, 'random_strength': 4.678176097746458, 'grow_policy': 'Lossguide', 'min_data_in_leaf': 539, 'max_leaves': 114}. Best is trial 684 with value: 198.81639474308358.[0m
[32m[I 2024-10-13 14:56:15,004][0m Trial 973 finished with value: 303.5829656677203 and parameters: {'depth': 9, 'learning_rate': 0.0044893586454045325, 'iterations': 2902, 'l2_leaf_reg': 6.915991301565152, 'border_count': 45, 'bagging_temperature': 0.8095374899856649, 'random_strength': 4.558706585840568, 'grow_policy': 'SymmetricTree', 'min_data_in_leaf': 563}. Best is trial 684 with value: 198.81639474308358.[0m
[32m[I 2024-10-13 14:56:17,701][0m Trial 974 finished with value: 225.2939999680108 and parameters: {'depth': 7, 'learning_rate': 0.005550971317454471, 'iterations': 2940, 'l2_leaf_reg': 3.7449814559088077, 'border_count': 55, 'bagging_temperature': 0.8441867023419036, 'random_strength': 4.982886181764793, 'grow_policy': 'Lossguide', 'min_data_in_leaf': 537, 'max_leaves': 138}. Best is trial 684 with value: 198.81639474308358.[0m
[32m[I 2024-10-13 14:56:20,434][0m Trial 975 finished with value: 204.48647960173838 and parameters: {'depth': 7, 'learning_rate': 0.0035546775798269144, 'iterations': 3000, 'l2_leaf_reg': 9.79931608056407, 'border_count': 64, 'bagging_temperature': 0.7556110001757381, 'random_strength': 5.165350981589105, 'grow_policy': 'Lossguide', 'min_data_in_leaf': 515, 'max_leaves': 249}. Best is trial 684 with value: 198.81639474308358.[0m
[32m[I 2024-10-13 14:56:23,208][0m Trial 976 finished with value: 198.72646190432525 and parameters: {'depth': 7, 'learning_rate': 0.004021997087502321, 'iterations': 2861, 'l2_leaf_reg': 9.890753695408794, 'border_count': 50, 'bagging_temperature': 0.7952248987337306, 'random_strength': 4.7375902728654555, 'grow_policy': 'Lossguide', 'min_data_in_leaf': 540, 'max_leaves': 127}. Best is trial 976 with value: 198.72646190432525.[0m
[32m[I 2024-10-13 14:56:25,759][0m Trial 977 finished with value: 218.30802441997798 and parameters: {'depth': 7, 'learning_rate': 0.006347627574939874, 'iterations': 2808, 'l2_leaf_reg': 6.602482715315376, 'border_count': 62, 'bagging_temperature': 0.7277705054057533, 'random_strength': 4.73023889094391, 'grow_policy': 'Lossguide', 'min_data_in_leaf': 558, 'max_leaves': 124}. Best is trial 976 with value: 198.72646190432525.[0m
[32m[I 2024-10-13 14:56:28,418][0m Trial 978 finished with value: 218.57775293364074 and parameters: {'depth': 7, 'learning_rate': 0.005020125335418588, 'iterations': 2800, 'l2_leaf_reg': 5.132315692677889, 'border_count': 51, 'bagging_temperature': 0.7631531672278321, 'random_strength': 4.958111392135127, 'grow_policy': 'Lossguide', 'min_data_in_leaf': 547, 'max_leaves': 127}. Best is trial 976 with value: 198.72646190432525.[0m
[32m[I 2024-10-13 14:56:31,204][0m Trial 979 finished with value: 209.63236827392737 and parameters: {'depth': 6, 'learning_rate': 0.0044865262796944414, 'iterations': 2859, 'l2_leaf_reg': 6.815641834298503, 'border_count': 58, 'bagging_temperature': 0.7782701665481151, 'random_strength': 5.2721929665832885, 'grow_policy': 'Lossguide', 'min_data_in_leaf': 564, 'max_leaves': 119}. Best is trial 976 with value: 198.72646190432525.[0m
[32m[I 2024-10-13 14:56:33,240][0m Trial 980 finished with value: 212.01972015590414 and parameters: {'depth': 7, 'learning_rate': 0.005391268800214476, 'iterations': 1927, 'l2_leaf_reg': 3.5377224274778776, 'border_count': 48, 'bagging_temperature': 0.7395423764642447, 'random_strength': 4.794629325985946, 'grow_policy': 'Lossguide', 'min_data_in_leaf': 531, 'max_leaves': 126}. Best is trial 976 with value: 198.72646190432525.[0m
[32m[I 2024-10-13 14:56:36,037][0m Trial 981 finished with value: 212.9070878148483 and parameters: {'depth': 6, 'learning_rate': 0.00414372842211711, 'iterations': 2800, 'l2_leaf_reg': 4.958327275664648, 'border_count': 53, 'bagging_temperature': 0.8299232620950626, 'random_strength': 4.611915369326321, 'grow_policy': 'Lossguide', 'min_data_in_leaf': 541, 'max_leaves': 149}. Best is trial 976 with value: 198.72646190432525.[0m
[32m[I 2024-10-13 14:56:38,640][0m Trial 982 finished with value: 208.26012819765322 and parameters: {'depth': 7, 'learning_rate': 0.004528441453517483, 'iterations': 2853, 'l2_leaf_reg': 7.2577388619484005, 'border_count': 59, 'bagging_temperature': 0.7867195329810497, 'random_strength': 5.0010980298703105, 'grow_policy': 'Lossguide', 'min_data_in_leaf': 539, 'max_leaves': 135}. Best is trial 976 with value: 198.72646190432525.[0m
[32m[I 2024-10-13 14:56:41,358][0m Trial 983 finished with value: 224.4679509049385 and parameters: {'depth': 7, 'learning_rate': 0.003842390356352203, 'iterations': 2891, 'l2_leaf_reg': 2.025120071096172, 'border_count': 67, 'bagging_temperature': 0.7616009379706807, 'random_strength': 4.779630237531554, 'grow_policy': 'Lossguide', 'min_data_in_leaf': 566, 'max_leaves': 145}. Best is trial 976 with value: 198.72646190432525.[0m
[32m[I 2024-10-13 14:56:43,976][0m Trial 984 finished with value: 201.4787423096882 and parameters: {'depth': 7, 'learning_rate': 0.005143873044865158, 'iterations': 2891, 'l2_leaf_reg': 9.861215332894618, 'border_count': 48, 'bagging_temperature': 0.8602198265811136, 'random_strength': 5.27394193841193, 'grow_policy': 'Lossguide', 'min_data_in_leaf': 516, 'max_leaves': 130}. Best is trial 976 with value: 198.72646190432525.[0m
[32m[I 2024-10-13 14:56:46,561][0m Trial 985 finished with value: 212.89161305749573 and parameters: {'depth': 9, 'learning_rate': 0.0039857378100803895, 'iterations': 2843, 'l2_leaf_reg': 5.012514816976503, 'border_count': 53, 'bagging_temperature': 0.8175542232568292, 'random_strength': 4.538255396206148, 'grow_policy': 'Lossguide', 'min_data_in_leaf': 528, 'max_leaves': 139}. Best is trial 976 with value: 198.72646190432525.[0m
[32m[I 2024-10-13 14:56:49,337][0m Trial 986 finished with value: 201.7835732477614 and parameters: {'depth': 7, 'learning_rate': 0.003416719843997017, 'iterations': 2944, 'l2_leaf_reg': 6.867010187771162, 'border_count': 37, 'bagging_temperature': 0.7880862998456077, 'random_strength': 4.4889142383856795, 'grow_policy': 'Lossguide', 'min_data_in_leaf': 547, 'max_leaves': 118}. Best is trial 976 with value: 198.72646190432525.[0m
[32m[I 2024-10-13 14:56:51,939][0m Trial 987 finished with value: 209.42074497640584 and parameters: {'depth': 7, 'learning_rate': 0.006251365796610987, 'iterations': 2785, 'l2_leaf_reg': 9.833604021643493, 'border_count': 47, 'bagging_temperature': 0.6814458650473835, 'random_strength': 4.699436145771265, 'grow_policy': 'Lossguide', 'min_data_in_leaf': 516, 'max_leaves': 122}. Best is trial 976 with value: 198.72646190432525.[0m
[32m[I 2024-10-13 14:56:54,674][0m Trial 988 finished with value: 215.99554995781835 and parameters: {'depth': 7, 'learning_rate': 0.004566031864286307, 'iterations': 2899, 'l2_leaf_reg': 3.0920321187332487, 'border_count': 41, 'bagging_temperature': 0.7355187980702415, 'random_strength': 4.913636850174504, 'grow_policy': 'Lossguide', 'min_data_in_leaf': 564, 'max_leaves': 134}. Best is trial 976 with value: 198.72646190432525.[0m
[32m[I 2024-10-13 14:56:55,888][0m Trial 989 finished with value: 290.34367771128046 and parameters: {'depth': 8, 'learning_rate': 0.003730136969746839, 'iterations': 942, 'l2_leaf_reg': 9.893499722804902, 'border_count': 54, 'bagging_temperature': 0.708299155582716, 'random_strength': 4.152299617874998, 'grow_policy': 'Lossguide', 'min_data_in_leaf': 524, 'max_leaves': 141}. Best is trial 976 with value: 198.72646190432525.[0m
[32m[I 2024-10-13 14:56:58,549][0m Trial 990 finished with value: 212.50561348423008 and parameters: {'depth': 7, 'learning_rate': 0.004848725420140047, 'iterations': 2938, 'l2_leaf_reg': 4.818887755033085, 'border_count': 47, 'bagging_temperature': 0.8397516281057928, 'random_strength': 4.41289169385541, 'grow_policy': 'Lossguide', 'min_data_in_leaf': 504, 'max_leaves': 153}. Best is trial 976 with value: 198.72646190432525.[0m
[32m[I 2024-10-13 14:56:59,603][0m Trial 991 finished with value: 398.53253387023517 and parameters: {'depth': 6, 'learning_rate': 0.0030464391403022795, 'iterations': 625, 'l2_leaf_reg': 6.715904694857331, 'border_count': 32, 'bagging_temperature': 0.8029042540752187, 'random_strength': 5.049739027399699, 'grow_policy': 'Lossguide', 'min_data_in_leaf': 538, 'max_leaves': 127}. Best is trial 976 with value: 198.72646190432525.[0m
[32m[I 2024-10-13 14:57:02,228][0m Trial 992 finished with value: 210.211261844066 and parameters: {'depth': 9, 'learning_rate': 0.003969219123014339, 'iterations': 2855, 'l2_leaf_reg': 3.703261188689124, 'border_count': 36, 'bagging_temperature': 0.7494498473211766, 'random_strength': 4.72093300381042, 'grow_policy': 'Lossguide', 'min_data_in_leaf': 509, 'max_leaves': 147}. Best is trial 976 with value: 198.72646190432525.[0m
[32m[I 2024-10-13 14:57:04,945][0m Trial 993 finished with value: 202.29175801942893 and parameters: {'depth': 7, 'learning_rate': 0.003450136377574843, 'iterations': 2949, 'l2_leaf_reg': 6.489125228904231, 'border_count': 42, 'bagging_temperature': 0.7736704486278663, 'random_strength': 4.303961377317418, 'grow_policy': 'Lossguide', 'min_data_in_leaf': 550, 'max_leaves': 137}. Best is trial 976 with value: 198.72646190432525.[0m
[32m[I 2024-10-13 14:57:07,627][0m Trial 994 finished with value: 213.70183910389608 and parameters: {'depth': 8, 'learning_rate': 0.005816390630460503, 'iterations': 2898, 'l2_leaf_reg': 6.824349194491115, 'border_count': 71, 'bagging_temperature': 0.8526808477971218, 'random_strength': 4.525797850392589, 'grow_policy': 'Lossguide', 'min_data_in_leaf': 524, 'max_leaves': 113}. Best is trial 976 with value: 198.72646190432525.[0m
[32m[I 2024-10-13 14:57:10,434][0m Trial 995 finished with value: 221.36319029572874 and parameters: {'depth': 7, 'learning_rate': 0.00445043282646783, 'iterations': 2944, 'l2_leaf_reg': 2.6989988677130423, 'border_count': 50, 'bagging_temperature': 0.8255270609409529, 'random_strength': 4.829793049370849, 'grow_policy': 'Lossguide', 'min_data_in_leaf': 497, 'max_leaves': 131}. Best is trial 976 with value: 198.72646190432525.[0m
[32m[I 2024-10-13 14:57:32,687][0m Trial 996 finished with value: 635.3504727698478 and parameters: {'depth': 7, 'learning_rate': 0.0003711847476304546, 'iterations': 3000, 'l2_leaf_reg': 9.888486034574047, 'border_count': 57, 'bagging_temperature': 0.7202462290834185, 'random_strength': 4.12384915542326, 'grow_policy': 'SymmetricTree', 'min_data_in_leaf': 560}. Best is trial 976 with value: 198.72646190432525.[0m
[32m[I 2024-10-13 14:57:35,276][0m Trial 997 finished with value: 204.74556809596345 and parameters: {'depth': 7, 'learning_rate': 0.002881128420530465, 'iterations': 2797, 'l2_leaf_reg': 4.782765946155167, 'border_count': 31, 'bagging_temperature': 0.7934881440823127, 'random_strength': 4.6037117806750825, 'grow_policy': 'Lossguide', 'min_data_in_leaf': 488, 'max_leaves': 142}. Best is trial 976 with value: 198.72646190432525.[0m
[32m[I 2024-10-13 14:57:37,935][0m Trial 998 finished with value: 202.74241521095442 and parameters: {'depth': 8, 'learning_rate': 0.00401459097866898, 'iterations': 2856, 'l2_leaf_reg': 7.09212857257473, 'border_count': 44, 'bagging_temperature': 0.7630663967999872, 'random_strength': 5.268711847935561, 'grow_policy': 'Lossguide', 'min_data_in_leaf': 518, 'max_leaves': 122}. Best is trial 976 with value: 198.72646190432525.[0m
[32m[I 2024-10-13 14:57:40,593][0m Trial 999 finished with value: 200.81771980382302 and parameters: {'depth': 6, 'learning_rate': 0.003381075230363599, 'iterations': 2904, 'l2_leaf_reg': 9.826065724482662, 'border_count': 38, 'bagging_temperature': 0.7387709236610372, 'random_strength': 4.274100923737985, 'grow_policy': 'Lossguide', 'min_data_in_leaf': 543, 'max_leaves': 134}. Best is trial 976 with value: 198.72646190432525.[0m
CatBoost: RMSE = 198.7265
      Model        RMSE
0  CatBoost  198.726462

Best hyperparameters for CatBoost:
{'depth': 7, 'learning_rate': 0.004021997087502321, 'iterations': 2861, 'l2_leaf_reg': 9.890753695408794, 'border_count': 50, 'bagging_temperature': 0.7952248987337306, 'random_strength': 4.7375902728654555, 'grow_policy': 'Lossguide', 'min_data_in_leaf': 540, 'max_leaves': 127}
