[32m[I 2024-10-13 14:48:18,350][0m Trial 853 finished with value: 295.0896971583807 and parameters: {'depth': 8, 'learning_rate': 0.04488702447772995, 'iterations': 2918, 'l2_leaf_reg': 6.89129975911796, 'border_count': 47, 'bagging_temperature': 0.7565703761271884, 'random_strength': 3.8191412904567485, 'grow_policy': 'Lossguide', 'min_data_in_leaf': 477, 'max_leaves': 140}. Best is trial 684 with value: 198.81639474308358.[0m
[32m[I 2024-10-13 14:48:21,106][0m Trial 854 finished with value: 200.55347713754742 and parameters: {'depth': 7, 'learning_rate': 0.004052796531170729, 'iterations': 2943, 'l2_leaf_reg': 9.840113856019933, 'border_count': 40, 'bagging_temperature': 0.7348142327328164, 'random_strength': 4.5802206439969275, 'grow_policy': 'Lossguide', 'min_data_in_leaf': 514, 'max_leaves': 150}. Best is trial 684 with value: 198.81639474308358.[0m
[32m[I 2024-10-13 14:48:23,683][0m Trial 855 finished with value: 225.5900275311068 and parameters: {'depth': 7, 'learning_rate': 0.0035046873159346615, 'iterations': 2851, 'l2_leaf_reg': 1.9270567707126016, 'border_count': 52, 'bagging_temperature': 0.7846250376461925, 'random_strength': 4.42180298081317, 'grow_policy': 'Lossguide', 'min_data_in_leaf': 485, 'max_leaves': 124}. Best is trial 684 with value: 198.81639474308358.[0m
[32m[I 2024-10-13 14:48:26,451][0m Trial 856 finished with value: 214.3353668107561 and parameters: {'depth': 7, 'learning_rate': 0.004677280969122608, 'iterations': 3000, 'l2_leaf_reg': 4.718054263571314, 'border_count': 34, 'bagging_temperature': 0.7709574011427335, 'random_strength': 5.143840605021264, 'grow_policy': 'Lossguide', 'min_data_in_leaf': 543, 'max_leaves': 135}. Best is trial 684 with value: 198.81639474308358.[0m
[32m[I 2024-10-13 14:48:29,186][0m Trial 857 finished with value: 203.6421160429358 and parameters: {'depth': 7, 'learning_rate': 0.0028763679688183974, 'iterations': 2890, 'l2_leaf_reg': 9.999467484212204, 'border_count': 42, 'bagging_temperature': 0.8436898596143277, 'random_strength': 3.974047102846652, 'grow_policy': 'Lossguide', 'min_data_in_leaf': 517, 'max_leaves': 145}. Best is trial 684 with value: 198.81639474308358.[0m
[32m[I 2024-10-13 14:48:31,838][0m Trial 858 finished with value: 240.709393427248 and parameters: {'depth': 7, 'learning_rate': 0.014040022904577142, 'iterations': 2945, 'l2_leaf_reg': 9.972500163014407, 'border_count': 32, 'bagging_temperature': 0.7975846224760913, 'random_strength': 4.201462455165825, 'grow_policy': 'Lossguide', 'min_data_in_leaf': 497, 'max_leaves': 116}. Best is trial 684 with value: 198.81639474308358.[0m
[32m[I 2024-10-13 14:48:34,530][0m Trial 859 finished with value: 212.36063201118392 and parameters: {'depth': 7, 'learning_rate': 0.0039645210096953785, 'iterations': 2890, 'l2_leaf_reg': 3.862545556539264, 'border_count': 46, 'bagging_temperature': 0.7432493524590472, 'random_strength': 4.7912284736123505, 'grow_policy': 'Lossguide', 'min_data_in_leaf': 455, 'max_leaves': 129}. Best is trial 684 with value: 198.81639474308358.[0m
[32m[I 2024-10-13 14:48:37,249][0m Trial 860 finished with value: 233.46526800796968 and parameters: {'depth': 8, 'learning_rate': 0.005294623032680738, 'iterations': 2951, 'l2_leaf_reg': 0.2256792485341959, 'border_count': 38, 'bagging_temperature': 0.8199529857905206, 'random_strength': 4.524758909796779, 'grow_policy': 'Lossguide', 'min_data_in_leaf': 472, 'max_leaves': 139}. Best is trial 684 with value: 198.81639474308358.[0m
[32m[I 2024-10-13 14:48:39,928][0m Trial 861 finished with value: 204.94019848960616 and parameters: {'depth': 7, 'learning_rate': 0.003447808317302025, 'iterations': 2945, 'l2_leaf_reg': 6.516697765868325, 'border_count': 50, 'bagging_temperature': 0.6286282126206278, 'random_strength': 4.294092124703565, 'grow_policy': 'Lossguide', 'min_data_in_leaf': 525, 'max_leaves': 131}. Best is trial 684 with value: 198.81639474308358.[0m
[32m[I 2024-10-13 14:48:42,643][0m Trial 862 finished with value: 210.90439840591182 and parameters: {'depth': 8, 'learning_rate': 0.00470782378525696, 'iterations': 3000, 'l2_leaf_reg': 6.678038845818198, 'border_count': 37, 'bagging_temperature': 0.6792014118226462, 'random_strength': 3.6780727989964057, 'grow_policy': 'Lossguide', 'min_data_in_leaf': 501, 'max_leaves': 144}. Best is trial 684 with value: 198.81639474308358.[0m
[32m[I 2024-10-13 14:48:45,338][0m Trial 863 finished with value: 210.2070223164516 and parameters: {'depth': 7, 'learning_rate': 0.0029945614665001148, 'iterations': 2842, 'l2_leaf_reg': 2.839221670219892, 'border_count': 33, 'bagging_temperature': 0.720131018032108, 'random_strength': 4.927886553011631, 'grow_policy': 'Lossguide', 'min_data_in_leaf': 487, 'max_leaves': 137}. Best is trial 684 with value: 198.81639474308358.[0m
[32m[I 2024-10-13 14:48:47,962][0m Trial 864 finished with value: 199.8517078384714 and parameters: {'depth': 7, 'learning_rate': 0.003986598275172708, 'iterations': 2899, 'l2_leaf_reg': 9.961151077825411, 'border_count': 42, 'bagging_temperature': 0.7657151553498851, 'random_strength': 4.720284984220267, 'grow_policy': 'Lossguide', 'min_data_in_leaf': 548, 'max_leaves': 122}. Best is trial 684 with value: 198.81639474308358.[0m
[32m[I 2024-10-13 14:48:50,610][0m Trial 865 finished with value: 218.46659051064088 and parameters: {'depth': 8, 'learning_rate': 0.005736902265914915, 'iterations': 2880, 'l2_leaf_reg': 4.9889924268718895, 'border_count': 45, 'bagging_temperature': 0.762912683760864, 'random_strength': 4.446147573841479, 'grow_policy': 'Lossguide', 'min_data_in_leaf': 515, 'max_leaves': 125}. Best is trial 684 with value: 198.81639474308358.[0m
[32m[I 2024-10-13 14:48:53,348][0m Trial 866 finished with value: 211.3586533764109 and parameters: {'depth': 7, 'learning_rate': 0.004372183305978022, 'iterations': 2900, 'l2_leaf_reg': 7.137934350517217, 'border_count': 55, 'bagging_temperature': 0.7778766751328886, 'random_strength': 3.351877692092221, 'grow_policy': 'Lossguide', 'min_data_in_leaf': 468, 'max_leaves': 122}. Best is trial 684 with value: 198.81639474308358.[0m
[32m[I 2024-10-13 14:48:56,041][0m Trial 867 finished with value: 211.16252416895716 and parameters: {'depth': 8, 'learning_rate': 0.0034398870175942143, 'iterations': 2827, 'l2_leaf_reg': 3.602579772331365, 'border_count': 43, 'bagging_temperature': 0.7516727731816751, 'random_strength': 3.9909416639812703, 'grow_policy': 'Lossguide', 'min_data_in_leaf': 501, 'max_leaves': 151}. Best is trial 684 with value: 198.81639474308358.[0m
[32m[I 2024-10-13 14:49:40,417][0m Trial 868 finished with value: 294.22598014957646 and parameters: {'depth': 9, 'learning_rate': 0.2928682334328478, 'iterations': 2901, 'l2_leaf_reg': 6.675311323050491, 'border_count': 48, 'bagging_temperature': 0.7836519435124857, 'random_strength': 4.621528800724045, 'grow_policy': 'SymmetricTree', 'min_data_in_leaf': 546}. Best is trial 684 with value: 198.81639474308358.[0m
[32m[I 2024-10-13 14:49:43,026][0m Trial 869 finished with value: 208.819848359329 and parameters: {'depth': 7, 'learning_rate': 0.0029070784779024147, 'iterations': 2942, 'l2_leaf_reg': 5.072631601060201, 'border_count': 62, 'bagging_temperature': 0.7331985687970498, 'random_strength': 4.105957265243733, 'grow_policy': 'Lossguide', 'min_data_in_leaf': 525, 'max_leaves': 171}. Best is trial 684 with value: 198.81639474308358.[0m
[32m[I 2024-10-13 14:49:45,619][0m Trial 870 finished with value: 204.16977665777057 and parameters: {'depth': 7, 'learning_rate': 0.0038301924801716724, 'iterations': 2847, 'l2_leaf_reg': 9.74637706364619, 'border_count': 52, 'bagging_temperature': 0.811065458801549, 'random_strength': 4.293063796815526, 'grow_policy': 'Lossguide', 'min_data_in_leaf': 481, 'max_leaves': 133}. Best is trial 684 with value: 198.81639474308358.[0m
[32m[I 2024-10-13 14:49:48,329][0m Trial 871 finished with value: 206.6183313532887 and parameters: {'depth': 7, 'learning_rate': 0.00457178830585668, 'iterations': 2944, 'l2_leaf_reg': 6.826146068613627, 'border_count': 41, 'bagging_temperature': 0.7655658004271614, 'random_strength': 4.675213475745128, 'grow_policy': 'Lossguide', 'min_data_in_leaf': 454, 'max_leaves': 128}. Best is trial 684 with value: 198.81639474308358.[0m
[32m[I 2024-10-13 14:49:50,938][0m Trial 872 finished with value: 199.24949971747088 and parameters: {'depth': 8, 'learning_rate': 0.0034505686539415812, 'iterations': 2842, 'l2_leaf_reg': 9.846747751888842, 'border_count': 48, 'bagging_temperature': 0.7946084937131709, 'random_strength': 3.8310408484829255, 'grow_policy': 'Lossguide', 'min_data_in_leaf': 506, 'max_leaves': 119}. Best is trial 684 with value: 198.81639474308358.[0m
[32m[I 2024-10-13 14:49:53,631][0m Trial 873 finished with value: 209.87592425895605 and parameters: {'depth': 8, 'learning_rate': 0.0029585345353856864, 'iterations': 2835, 'l2_leaf_reg': 4.713518908380297, 'border_count': 60, 'bagging_temperature': 0.7454568784887851, 'random_strength': 3.475747923522331, 'grow_policy': 'Lossguide', 'min_data_in_leaf': 548, 'max_leaves': 115}. Best is trial 684 with value: 198.81639474308358.[0m
[32m[I 2024-10-13 14:49:56,274][0m Trial 874 finished with value: 212.60583652519253 and parameters: {'depth': 8, 'learning_rate': 0.0033293992282853154, 'iterations': 2834, 'l2_leaf_reg': 3.201773454302942, 'border_count': 47, 'bagging_temperature': 0.7127293558425907, 'random_strength': 3.742592154723293, 'grow_policy': 'Lossguide', 'min_data_in_leaf': 515, 'max_leaves': 121}. Best is trial 684 with value: 198.81639474308358.[0m
[32m[I 2024-10-13 14:49:58,949][0m Trial 875 finished with value: 208.21887675667378 and parameters: {'depth': 8, 'learning_rate': 0.0028441395252017973, 'iterations': 2894, 'l2_leaf_reg': 6.903242893353571, 'border_count': 69, 'bagging_temperature': 0.7826257862249248, 'random_strength': 3.7980433279764325, 'grow_policy': 'Lossguide', 'min_data_in_leaf': 535, 'max_leaves': 120}. Best is trial 684 with value: 198.81639474308358.[0m
[32m[I 2024-10-13 14:50:01,643][0m Trial 876 finished with value: 245.756261600405 and parameters: {'depth': 8, 'learning_rate': 0.0034623242403504727, 'iterations': 2899, 'l2_leaf_reg': 0.005788524698810052, 'border_count': 55, 'bagging_temperature': 0.7535512428357561, 'random_strength': 3.9175543847533203, 'grow_policy': 'Lossguide', 'min_data_in_leaf': 508, 'max_leaves': 159}. Best is trial 684 with value: 198.81639474308358.[0m
[32m[I 2024-10-13 14:50:04,252][0m Trial 877 finished with value: 204.03542879740567 and parameters: {'depth': 9, 'learning_rate': 0.004312168668784052, 'iterations': 2851, 'l2_leaf_reg': 9.923359675848072, 'border_count': 53, 'bagging_temperature': 0.7963176599189863, 'random_strength': 3.5605634760626232, 'grow_policy': 'Lossguide', 'min_data_in_leaf': 527, 'max_leaves': 125}. Best is trial 684 with value: 198.81639474308358.[0m
[32m[I 2024-10-13 14:50:07,013][0m Trial 878 finished with value: 246.0724274397882 and parameters: {'depth': 8, 'learning_rate': 0.005510302475003314, 'iterations': 2946, 'l2_leaf_reg': 2.3010100906268742, 'border_count': 49, 'bagging_temperature': 0.25467316662026845, 'random_strength': 3.142518455806326, 'grow_policy': 'Lossguide', 'min_data_in_leaf': 497, 'max_leaves': 167}. Best is trial 684 with value: 198.81639474308358.[0m
[32m[I 2024-10-13 14:50:09,743][0m Trial 879 finished with value: 211.99678108098786 and parameters: {'depth': 9, 'learning_rate': 0.00397958243097649, 'iterations': 2915, 'l2_leaf_reg': 5.243810031180302, 'border_count': 58, 'bagging_temperature': 0.7267172007935464, 'random_strength': 5.021686476486441, 'grow_policy': 'Lossguide', 'min_data_in_leaf': 550, 'max_leaves': 128}. Best is trial 684 with value: 198.81639474308358.[0m
[32m[I 2024-10-13 14:50:12,445][0m Trial 880 finished with value: 204.12093174269722 and parameters: {'depth': 8, 'learning_rate': 0.002884197747996124, 'iterations': 2893, 'l2_leaf_reg': 9.841806979902854, 'border_count': 45, 'bagging_temperature': 0.765927388338983, 'random_strength': 4.142420635318869, 'grow_policy': 'Lossguide', 'min_data_in_leaf': 477, 'max_leaves': 119}. Best is trial 684 with value: 198.81639474308358.[0m
[32m[I 2024-10-13 14:50:15,199][0m Trial 881 finished with value: 199.92291850012856 and parameters: {'depth': 8, 'learning_rate': 0.003382519002908323, 'iterations': 2999, 'l2_leaf_reg': 9.957860026754485, 'border_count': 50, 'bagging_temperature': 0.739401311853173, 'random_strength': 4.4967346419427985, 'grow_policy': 'Lossguide', 'min_data_in_leaf': 511, 'max_leaves': 133}. Best is trial 684 with value: 198.81639474308358.[0m
[32m[I 2024-10-13 14:50:17,919][0m Trial 882 finished with value: 211.23188615748447 and parameters: {'depth': 8, 'learning_rate': 0.00325570751289503, 'iterations': 2956, 'l2_leaf_reg': 4.717140589634194, 'border_count': 58, 'bagging_temperature': 0.6914422751638303, 'random_strength': 4.732124564114558, 'grow_policy': 'Lossguide', 'min_data_in_leaf': 529, 'max_leaves': 132}. Best is trial 684 with value: 198.81639474308358.[0m
[32m[I 2024-10-13 14:50:20,601][0m Trial 883 finished with value: 204.39278330067165 and parameters: {'depth': 9, 'learning_rate': 0.0027744684339714946, 'iterations': 2954, 'l2_leaf_reg': 6.706807359629996, 'border_count': 49, 'bagging_temperature': 0.7182247111434185, 'random_strength': 4.447171620884709, 'grow_policy': 'Lossguide', 'min_data_in_leaf': 552, 'max_leaves': 126}. Best is trial 684 with value: 198.81639474308358.[0m
[32m[I 2024-10-13 14:50:23,311][0m Trial 884 finished with value: 216.79256537005776 and parameters: {'depth': 7, 'learning_rate': 0.003270580686907891, 'iterations': 2996, 'l2_leaf_reg': 3.537063386555866, 'border_count': 53, 'bagging_temperature': 0.7357939048779665, 'random_strength': 3.89583385750364, 'grow_policy': 'Lossguide', 'min_data_in_leaf': 494, 'max_leaves': 141}. Best is trial 684 with value: 198.81639474308358.[0m
[32m[I 2024-10-13 14:50:25,952][0m Trial 885 finished with value: 204.9559143311725 and parameters: {'depth': 8, 'learning_rate': 0.002831072225144323, 'iterations': 2824, 'l2_leaf_reg': 9.883236290879209, 'border_count': 50, 'bagging_temperature': 0.8412157634326957, 'random_strength': 4.878120869179956, 'grow_policy': 'Lossguide', 'min_data_in_leaf': 509, 'max_leaves': 133}. Best is trial 684 with value: 198.81639474308358.[0m
[32m[I 2024-10-13 14:50:28,688][0m Trial 886 finished with value: 214.63213001428025 and parameters: {'depth': 7, 'learning_rate': 0.0033916849718987475, 'iterations': 2949, 'l2_leaf_reg': 6.531982572333722, 'border_count': 255, 'bagging_temperature': 0.7060077008443048, 'random_strength': 5.157479509621703, 'grow_policy': 'Lossguide', 'min_data_in_leaf': 467, 'max_leaves': 137}. Best is trial 684 with value: 198.81639474308358.[0m
[32m[I 2024-10-13 14:50:31,349][0m Trial 887 finished with value: 220.8514450262541 and parameters: {'depth': 7, 'learning_rate': 0.004888533486097724, 'iterations': 2886, 'l2_leaf_reg': 4.884464561445516, 'border_count': 56, 'bagging_temperature': 0.5917338331547475, 'random_strength': 4.614399237557824, 'grow_policy': 'Lossguide', 'min_data_in_leaf': 526, 'max_leaves': 129}. Best is trial 684 with value: 198.81639474308358.[0m
[32m[I 2024-10-13 14:51:01,479][0m Trial 888 finished with value: 298.3481820388252 and parameters: {'depth': 8, 'learning_rate': 0.003671892368978558, 'iterations': 2951, 'l2_leaf_reg': 6.406609054988289, 'border_count': 45, 'bagging_temperature': 0.818706498034427, 'random_strength': 3.673614601366981, 'grow_policy': 'SymmetricTree', 'min_data_in_leaf': 488}. Best is trial 684 with value: 198.81639474308358.[0m
[32m[I 2024-10-13 14:51:04,147][0m Trial 889 finished with value: 214.06456130616115 and parameters: {'depth': 7, 'learning_rate': 0.0027728973890948014, 'iterations': 2999, 'l2_leaf_reg': 3.3033754885999893, 'border_count': 64, 'bagging_temperature': 0.7939159537625, 'random_strength': 4.165544085446222, 'grow_policy': 'Lossguide', 'min_data_in_leaf': 457, 'max_leaves': 117}. Best is trial 684 with value: 198.81639474308358.[0m
[32m[I 2024-10-13 14:51:06,940][0m Trial 890 finished with value: 211.57291466863475 and parameters: {'depth': 8, 'learning_rate': 0.004327465257663068, 'iterations': 2997, 'l2_leaf_reg': 6.785846480880747, 'border_count': 52, 'bagging_temperature': 0.7685472050157643, 'random_strength': 4.508194835414978, 'grow_policy': 'Lossguide', 'min_data_in_leaf': 512, 'max_leaves': 143}. Best is trial 684 with value: 198.81639474308358.[0m
[32m[I 2024-10-13 14:51:09,722][0m Trial 891 finished with value: 200.44075676580354 and parameters: {'depth': 7, 'learning_rate': 0.0034004353908365288, 'iterations': 2895, 'l2_leaf_reg': 9.833336821410409, 'border_count': 41, 'bagging_temperature': 0.7386014054896648, 'random_strength': 3.455733946113586, 'grow_policy': 'Lossguide', 'min_data_in_leaf': 541, 'max_leaves': 124}. Best is trial 684 with value: 198.81639474308358.[0m
[32m[I 2024-10-13 14:51:12,449][0m Trial 892 finished with value: 207.10350180495158 and parameters: {'depth': 7, 'learning_rate': 0.003907153707785907, 'iterations': 2831, 'l2_leaf_reg': 4.613265872073027, 'border_count': 45, 'bagging_temperature': 0.8256982641754923, 'random_strength': 4.020891944439072, 'grow_policy': 'Lossguide', 'min_data_in_leaf': 485, 'max_leaves': 192}. Best is trial 684 with value: 198.81639474308358.[0m
[32m[I 2024-10-13 14:51:15,085][0m Trial 893 finished with value: 202.04378067187469 and parameters: {'depth': 7, 'learning_rate': 0.004900875744858299, 'iterations': 2904, 'l2_leaf_reg': 9.857470588724096, 'border_count': 50, 'bagging_temperature': 0.7825374583633355, 'random_strength': 4.748372914210859, 'grow_policy': 'Lossguide', 'min_data_in_leaf': 523, 'max_leaves': 134}. Best is trial 684 with value: 198.81639474308358.[0m
[32m[I 2024-10-13 14:51:17,826][0m Trial 894 finished with value: 200.5180815628561 and parameters: {'depth': 8, 'learning_rate': 0.003086251971816964, 'iterations': 2942, 'l2_leaf_reg': 9.953073615219603, 'border_count': 39, 'bagging_temperature': 0.8454140383216633, 'random_strength': 4.4298226655453865, 'grow_policy': 'Lossguide', 'min_data_in_leaf': 502, 'max_leaves': 147}. Best is trial 684 with value: 198.81639474308358.[0m
[32m[I 2024-10-13 14:51:20,645][0m Trial 895 finished with value: 219.5709218346733 and parameters: {'depth': 7, 'learning_rate': 0.004206658172796851, 'iterations': 2860, 'l2_leaf_reg': 6.532715998802975, 'border_count': 59, 'bagging_temperature': 0.3628885462881245, 'random_strength': 4.963908554374021, 'grow_policy': 'Lossguide', 'min_data_in_leaf': 474, 'max_leaves': 140}. Best is trial 684 with value: 198.81639474308358.[0m
[32m[I 2024-10-13 14:51:23,320][0m Trial 896 finished with value: 212.80433743052282 and parameters: {'depth': 7, 'learning_rate': 0.0026677093786510397, 'iterations': 2940, 'l2_leaf_reg': 2.651386351969576, 'border_count': 47, 'bagging_temperature': 0.8008083359723055, 'random_strength': 4.267787948913975, 'grow_policy': 'Lossguide', 'min_data_in_leaf': 554, 'max_leaves': 130}. Best is trial 684 with value: 198.81639474308358.[0m
[32m[I 2024-10-13 14:51:25,981][0m Trial 897 finished with value: 206.6569452090555 and parameters: {'depth': 7, 'learning_rate': 0.0035377534083228896, 'iterations': 2956, 'l2_leaf_reg': 4.823146663229516, 'border_count': 40, 'bagging_temperature': 0.7716105990009108, 'random_strength': 3.860153433683956, 'grow_policy': 'Lossguide', 'min_data_in_leaf': 516, 'max_leaves': 135}. Best is trial 684 with value: 198.81639474308358.[0m
[32m[I 2024-10-13 14:51:28,584][0m Trial 898 finished with value: 219.59483750509816 and parameters: {'depth': 7, 'learning_rate': 0.005698270589869637, 'iterations': 2818, 'l2_leaf_reg': 6.34210624080647, 'border_count': 53, 'bagging_temperature': 0.7361560933659568, 'random_strength': 4.538760998198798, 'grow_policy': 'Lossguide', 'min_data_in_leaf': 456, 'max_leaves': 127}. Best is trial 684 with value: 198.81639474308358.[0m
[32m[I 2024-10-13 14:51:31,243][0m Trial 899 finished with value: 226.0689187013066 and parameters: {'depth': 8, 'learning_rate': 0.0046862976744804835, 'iterations': 2883, 'l2_leaf_reg': 3.6915580540883273, 'border_count': 43, 'bagging_temperature': 0.4729559200690227, 'random_strength': 4.162903296982445, 'grow_policy': 'Lossguide', 'min_data_in_leaf': 491, 'max_leaves': 227}. Best is trial 684 with value: 198.81639474308358.[0m
[32m[I 2024-10-13 14:51:33,967][0m Trial 900 finished with value: 199.86046432801115 and parameters: {'depth': 7, 'learning_rate': 0.0037498768032486166, 'iterations': 2952, 'l2_leaf_reg': 9.966400006470247, 'border_count': 39, 'bagging_temperature': 0.759437036112524, 'random_strength': 4.802310468440279, 'grow_policy': 'Lossguide', 'min_data_in_leaf': 535, 'max_leaves': 141}. Best is trial 684 with value: 198.81639474308358.[0m
[32m[I 2024-10-13 14:51:36,611][0m Trial 901 finished with value: 214.5643400101335 and parameters: {'depth': 7, 'learning_rate': 0.0030430848314659783, 'iterations': 2998, 'l2_leaf_reg': 1.9249314637636108, 'border_count': 35, 'bagging_temperature': 0.7543574588531844, 'random_strength': 5.076737523358974, 'grow_policy': 'Lossguide', 'min_data_in_leaf': 539, 'max_leaves': 132}. Best is trial 684 with value: 198.81639474308358.[0m
[32m[I 2024-10-13 14:51:39,371][0m Trial 902 finished with value: 202.49548622230407 and parameters: {'depth': 8, 'learning_rate': 0.003421367310774016, 'iterations': 3000, 'l2_leaf_reg': 6.709455778528103, 'border_count': 37, 'bagging_temperature': 0.774164075893321, 'random_strength': 4.787947041458862, 'grow_policy': 'Lossguide', 'min_data_in_leaf': 506, 'max_leaves': 121}. Best is trial 684 with value: 198.81639474308358.[0m
