[32m[I 2024-10-13 14:06:00,017][0m Trial 51 finished with value: 240.00643111961728 and parameters: {'depth': 10, 'learning_rate': 0.011063558843636126, 'iterations': 453, 'l2_leaf_reg': 0.0472611263696913, 'border_count': 52, 'bagging_temperature': 0.8638519844357501, 'random_strength': 7.488685683361509, 'grow_policy': 'Lossguide', 'min_data_in_leaf': 824, 'max_leaves': 129}. Best is trial 37 with value: 226.5553977197405.[0m
[32m[I 2024-10-13 14:06:02,505][0m Trial 52 finished with value: 294.4337799448761 and parameters: {'depth': 10, 'learning_rate': 0.013977881499834862, 'iterations': 725, 'l2_leaf_reg': 0.6560519323952101, 'border_count': 11, 'bagging_temperature': 0.8746417716141859, 'random_strength': 6.632281652203715, 'grow_policy': 'Lossguide', 'min_data_in_leaf': 775, 'max_leaves': 105}. Best is trial 37 with value: 226.5553977197405.[0m
[32m[I 2024-10-13 14:06:04,661][0m Trial 53 finished with value: 259.774142076076 and parameters: {'depth': 8, 'learning_rate': 0.020843571516902498, 'iterations': 1416, 'l2_leaf_reg': 0.005542681614132673, 'border_count': 45, 'bagging_temperature': 0.7288098710668385, 'random_strength': 7.2174914109907995, 'grow_policy': 'Lossguide', 'min_data_in_leaf': 960, 'max_leaves': 66}. Best is trial 37 with value: 226.5553977197405.[0m
[32m[I 2024-10-13 14:06:06,296][0m Trial 54 finished with value: 220.51762968009376 and parameters: {'depth': 9, 'learning_rate': 0.0064682612127943415, 'iterations': 953, 'l2_leaf_reg': 0.2752692016360097, 'border_count': 34, 'bagging_temperature': 0.8973748640935011, 'random_strength': 7.823012437166023, 'grow_policy': 'Lossguide', 'min_data_in_leaf': 896, 'max_leaves': 111}. Best is trial 54 with value: 220.51762968009376.[0m
[32m[I 2024-10-13 14:06:09,697][0m Trial 55 finished with value: 252.8847321591751 and parameters: {'depth': 12, 'learning_rate': 0.03774855914140617, 'iterations': 984, 'l2_leaf_reg': 0.3002203416746588, 'border_count': 30, 'bagging_temperature': 0.9655252070656736, 'random_strength': 8.226625087246386, 'grow_policy': 'Lossguide', 'min_data_in_leaf': 706, 'max_leaves': 134}. Best is trial 54 with value: 220.51762968009376.[0m
[32m[I 2024-10-13 14:06:10,757][0m Trial 56 finished with value: 246.76193121966793 and parameters: {'depth': 8, 'learning_rate': 0.027442606008927225, 'iterations': 270, 'l2_leaf_reg': 2.8903034013021727, 'border_count': 19, 'bagging_temperature': 0.7710441123405403, 'random_strength': 7.816235858514689, 'grow_policy': 'Lossguide', 'min_data_in_leaf': 907, 'max_leaves': 118}. Best is trial 54 with value: 220.51762968009376.[0m
[32m[I 2024-10-13 14:06:12,187][0m Trial 57 finished with value: 222.29849031569938 and parameters: {'depth': 9, 'learning_rate': 0.006311180493212595, 'iterations': 1296, 'l2_leaf_reg': 0.005446483516245936, 'border_count': 35, 'bagging_temperature': 0.9037750605464223, 'random_strength': 9.205537341753644, 'grow_policy': 'Lossguide', 'min_data_in_leaf': 869, 'max_leaves': 145}. Best is trial 54 with value: 220.51762968009376.[0m
[32m[I 2024-10-13 14:06:13,752][0m Trial 58 finished with value: 285.07832606778857 and parameters: {'depth': 14, 'learning_rate': 0.006417537348838807, 'iterations': 1321, 'l2_leaf_reg': 8.417160543283236, 'border_count': 6, 'bagging_temperature': 0.9401921067512881, 'random_strength': 9.307500703176222, 'grow_policy': 'Lossguide', 'min_data_in_leaf': 874, 'max_leaves': 162}. Best is trial 54 with value: 220.51762968009376.[0m
[32m[I 2024-10-13 14:06:15,168][0m Trial 59 finished with value: 228.34652004050918 and parameters: {'depth': 9, 'learning_rate': 0.011466275082030302, 'iterations': 1133, 'l2_leaf_reg': 0.008908652572764082, 'border_count': 36, 'bagging_temperature': 0.810800104808324, 'random_strength': 9.516696539891948, 'grow_policy': 'Lossguide', 'min_data_in_leaf': 968, 'max_leaves': 182}. Best is trial 54 with value: 220.51762968009376.[0m
[32m[I 2024-10-13 14:06:16,594][0m Trial 60 finished with value: 243.6441823881897 and parameters: {'depth': 9, 'learning_rate': 0.003937435795255128, 'iterations': 1107, 'l2_leaf_reg': 0.009447736147061538, 'border_count': 56, 'bagging_temperature': 0.8148600797893492, 'random_strength': 9.410564540550304, 'grow_policy': 'Lossguide', 'min_data_in_leaf': 771, 'max_leaves': 190}. Best is trial 54 with value: 220.51762968009376.[0m
[32m[I 2024-10-13 14:06:18,036][0m Trial 61 finished with value: 230.56787512531486 and parameters: {'depth': 8, 'learning_rate': 0.012145735306087022, 'iterations': 1182, 'l2_leaf_reg': 0.0013308930012727236, 'border_count': 40, 'bagging_temperature': 0.6949514037929874, 'random_strength': 8.435766070682845, 'grow_policy': 'Lossguide', 'min_data_in_leaf': 966, 'max_leaves': 193}. Best is trial 54 with value: 220.51762968009376.[0m
[32m[I 2024-10-13 14:06:19,734][0m Trial 62 finished with value: 248.36359661433167 and parameters: {'depth': 8, 'learning_rate': 0.01027251974832288, 'iterations': 1506, 'l2_leaf_reg': 0.000861125548650367, 'border_count': 42, 'bagging_temperature': 0.7000969107487074, 'random_strength': 9.907926994635288, 'grow_policy': 'Lossguide', 'min_data_in_leaf': 998, 'max_leaves': 210}. Best is trial 54 with value: 220.51762968009376.[0m
[32m[I 2024-10-13 14:06:21,181][0m Trial 63 finished with value: 252.58544413187713 and parameters: {'depth': 9, 'learning_rate': 0.01573824261377176, 'iterations': 1141, 'l2_leaf_reg': 0.0022347683819472484, 'border_count': 75, 'bagging_temperature': 0.9104919649634912, 'random_strength': 8.45126658011997, 'grow_policy': 'Lossguide', 'min_data_in_leaf': 903, 'max_leaves': 208}. Best is trial 54 with value: 220.51762968009376.[0m
[32m[I 2024-10-13 14:06:22,438][0m Trial 64 finished with value: 257.6823477259992 and parameters: {'depth': 11, 'learning_rate': 0.005977011338003501, 'iterations': 903, 'l2_leaf_reg': 9.608752059844516e-05, 'border_count': 18, 'bagging_temperature': 0.6325929103704742, 'random_strength': 8.90613342877217, 'grow_policy': 'Lossguide', 'min_data_in_leaf': 929, 'max_leaves': 179}. Best is trial 54 with value: 220.51762968009376.[0m
[32m[I 2024-10-13 14:06:23,711][0m Trial 65 finished with value: 227.07172570951906 and parameters: {'depth': 9, 'learning_rate': 0.005151105488580496, 'iterations': 922, 'l2_leaf_reg': 0.0004561084703004564, 'border_count': 36, 'bagging_temperature': 0.7941916711059192, 'random_strength': 8.526695163862929, 'grow_policy': 'Lossguide', 'min_data_in_leaf': 851, 'max_leaves': 141}. Best is trial 54 with value: 220.51762968009376.[0m
[32m[I 2024-10-13 14:06:25,208][0m Trial 66 finished with value: 221.73575736572124 and parameters: {'depth': 7, 'learning_rate': 0.004273009794560601, 'iterations': 1369, 'l2_leaf_reg': 0.00035421627523218435, 'border_count': 37, 'bagging_temperature': 0.7768121496840468, 'random_strength': 9.616662475865036, 'grow_policy': 'Lossguide', 'min_data_in_leaf': 964, 'max_leaves': 140}. Best is trial 54 with value: 220.51762968009376.[0m
[32m[I 2024-10-13 14:06:26,685][0m Trial 67 finished with value: 221.33858434824248 and parameters: {'depth': 7, 'learning_rate': 0.004661033269450179, 'iterations': 1328, 'l2_leaf_reg': 0.00035237157359682746, 'border_count': 37, 'bagging_temperature': 0.7994342417385399, 'random_strength': 9.642402662789028, 'grow_policy': 'Lossguide', 'min_data_in_leaf': 883, 'max_leaves': 142}. Best is trial 54 with value: 220.51762968009376.[0m
[32m[I 2024-10-13 14:06:28,120][0m Trial 68 finished with value: 244.5059679879645 and parameters: {'depth': 7, 'learning_rate': 0.003365611257671235, 'iterations': 1291, 'l2_leaf_reg': 0.00032684928891790706, 'border_count': 69, 'bagging_temperature': 0.775316586059529, 'random_strength': 9.727187670523458, 'grow_policy': 'Lossguide', 'min_data_in_leaf': 897, 'max_leaves': 146}. Best is trial 54 with value: 220.51762968009376.[0m
[32m[I 2024-10-13 14:06:29,677][0m Trial 69 finished with value: 396.1133661601778 and parameters: {'depth': 6, 'learning_rate': 0.0017933677711611234, 'iterations': 1366, 'l2_leaf_reg': 0.00016884238730290727, 'border_count': 10, 'bagging_temperature': 0.9530610371942352, 'random_strength': 9.00407612710408, 'grow_policy': 'Lossguide', 'min_data_in_leaf': 857, 'max_leaves': 141}. Best is trial 54 with value: 220.51762968009376.[0m
[32m[I 2024-10-13 14:06:31,257][0m Trial 70 finished with value: 227.0777633931773 and parameters: {'depth': 7, 'learning_rate': 0.0051037770553107546, 'iterations': 1499, 'l2_leaf_reg': 4.8351326213001664e-05, 'border_count': 23, 'bagging_temperature': 0.8387960316664308, 'random_strength': 9.094483659619485, 'grow_policy': 'Lossguide', 'min_data_in_leaf': 742, 'max_leaves': 158}. Best is trial 54 with value: 220.51762968009376.[0m
[32m[I 2024-10-13 14:06:32,881][0m Trial 71 finished with value: 220.50298826963083 and parameters: {'depth': 7, 'learning_rate': 0.005056783881845297, 'iterations': 1464, 'l2_leaf_reg': 4.245632593092594e-05, 'border_count': 26, 'bagging_temperature': 0.8432756845269782, 'random_strength': 9.109653410725919, 'grow_policy': 'Lossguide', 'min_data_in_leaf': 790, 'max_leaves': 162}. Best is trial 71 with value: 220.50298826963083.[0m
[32m[I 2024-10-13 14:06:34,507][0m Trial 72 finished with value: 237.51123638312262 and parameters: {'depth': 7, 'learning_rate': 0.004700376135331236, 'iterations': 1473, 'l2_leaf_reg': 2.6853282557418718e-05, 'border_count': 46, 'bagging_temperature': 0.8325957511465333, 'random_strength': 9.050730665807967, 'grow_policy': 'Lossguide', 'min_data_in_leaf': 791, 'max_leaves': 160}. Best is trial 71 with value: 220.50298826963083.[0m
[32m[I 2024-10-13 14:06:36,418][0m Trial 73 finished with value: 232.19217981124572 and parameters: {'depth': 6, 'learning_rate': 0.0028744658707664265, 'iterations': 1763, 'l2_leaf_reg': 4.8844911548392875e-05, 'border_count': 23, 'bagging_temperature': 0.7531393867322864, 'random_strength': 9.999176644463294, 'grow_policy': 'Lossguide', 'min_data_in_leaf': 737, 'max_leaves': 157}. Best is trial 71 with value: 220.50298826963083.[0m
[32m[I 2024-10-13 14:06:38,392][0m Trial 74 finished with value: 254.6353594810582 and parameters: {'depth': 7, 'learning_rate': 0.004620295773303026, 'iterations': 1395, 'l2_leaf_reg': 1.0988079269641773e-05, 'border_count': 14, 'bagging_temperature': 0.7908097938167555, 'random_strength': 8.702269215922778, 'grow_policy': 'Lossguide', 'min_data_in_leaf': 688, 'max_leaves': 168}. Best is trial 71 with value: 220.50298826963083.[0m
[32m[I 2024-10-13 14:06:41,314][0m Trial 75 finished with value: 260.1442633733806 and parameters: {'depth': 6, 'learning_rate': 0.0021358644007986424, 'iterations': 1557, 'l2_leaf_reg': 0.0004370748990551027, 'border_count': 37, 'bagging_temperature': 0.8331903614964276, 'random_strength': 9.197077835689589, 'grow_policy': 'Lossguide', 'min_data_in_leaf': 884, 'max_leaves': 142}. Best is trial 71 with value: 220.50298826963083.[0m
[32m[I 2024-10-13 14:06:43,871][0m Trial 76 finished with value: 310.47177685713183 and parameters: {'depth': 8, 'learning_rate': 0.0032440074438725305, 'iterations': 1672, 'l2_leaf_reg': 0.0006668055789368186, 'border_count': 5, 'bagging_temperature': 0.6980795205115399, 'random_strength': 9.608488511379376, 'grow_policy': 'Lossguide', 'min_data_in_leaf': 774, 'max_leaves': 151}. Best is trial 71 with value: 220.50298826963083.[0m
[32m[I 2024-10-13 14:06:48,653][0m Trial 77 finished with value: 240.01919688178253 and parameters: {'depth': 7, 'learning_rate': 0.005207360703006362, 'iterations': 1893, 'l2_leaf_reg': 0.0001017277792154137, 'border_count': 48, 'bagging_temperature': 0.8967314546991523, 'random_strength': 8.264006850897736, 'grow_policy': 'Lossguide', 'min_data_in_leaf': 930, 'max_leaves': 137}. Best is trial 71 with value: 220.50298826963083.[0m
[32m[I 2024-10-13 14:06:50,487][0m Trial 78 finished with value: 227.91408133618566 and parameters: {'depth': 5, 'learning_rate': 0.00828237796904631, 'iterations': 1006, 'l2_leaf_reg': 5.080075750911013e-06, 'border_count': 23, 'bagging_temperature': 0.8434848435130623, 'random_strength': 8.678407593324373, 'grow_policy': 'Lossguide', 'min_data_in_leaf': 881, 'max_leaves': 172}. Best is trial 71 with value: 220.50298826963083.[0m
[32m[I 2024-10-13 14:06:52,883][0m Trial 79 finished with value: 270.15063076748106 and parameters: {'depth': 8, 'learning_rate': 0.002533774707448506, 'iterations': 1324, 'l2_leaf_reg': 4.638418121978221e-05, 'border_count': 92, 'bagging_temperature': 0.7183203573460125, 'random_strength': 9.71004944884397, 'grow_policy': 'Lossguide', 'min_data_in_leaf': 758, 'max_leaves': 114}. Best is trial 71 with value: 220.50298826963083.[0m
[32m[I 2024-10-13 14:06:58,306][0m Trial 80 finished with value: 451.8013837358891 and parameters: {'depth': 5, 'learning_rate': 0.0009146635334297936, 'iterations': 1463, 'l2_leaf_reg': 0.00019387398759081596, 'border_count': 126, 'bagging_temperature': 0.7908648924246713, 'random_strength': 9.197410991510356, 'grow_policy': 'Depthwise', 'min_data_in_leaf': 799}. Best is trial 71 with value: 220.50298826963083.[0m
[32m[I 2024-10-13 14:07:00,086][0m Trial 81 finished with value: 244.97502896727818 and parameters: {'depth': 7, 'learning_rate': 0.004179020291089217, 'iterations': 920, 'l2_leaf_reg': 0.004409797458215352, 'border_count': 28, 'bagging_temperature': 0.9285836725781139, 'random_strength': 8.613149434849522, 'grow_policy': 'Lossguide', 'min_data_in_leaf': 849, 'max_leaves': 135}. Best is trial 71 with value: 220.50298826963083.[0m
[32m[I 2024-10-13 14:07:03,721][0m Trial 82 finished with value: 225.04314175812834 and parameters: {'depth': 9, 'learning_rate': 0.007227518393037161, 'iterations': 1301, 'l2_leaf_reg': 0.0001604298904857164, 'border_count': 35, 'bagging_temperature': 0.7559173917509211, 'random_strength': 7.954589742806701, 'grow_policy': 'Lossguide', 'min_data_in_leaf': 839, 'max_leaves': 112}. Best is trial 71 with value: 220.50298826963083.[0m
[32m[I 2024-10-13 14:07:07,974][0m Trial 83 finished with value: 245.48301931539623 and parameters: {'depth': 6, 'learning_rate': 0.007176350554470225, 'iterations': 1597, 'l2_leaf_reg': 0.0029147834582925283, 'border_count': 59, 'bagging_temperature': 0.7615088502517401, 'random_strength': 8.026565975262558, 'grow_policy': 'Lossguide', 'min_data_in_leaf': 800, 'max_leaves': 83}. Best is trial 71 with value: 220.50298826963083.[0m
[32m[I 2024-10-13 14:07:10,109][0m Trial 84 finished with value: 250.8604402444261 and parameters: {'depth': 8, 'learning_rate': 0.009429891298649426, 'iterations': 1288, 'l2_leaf_reg': 0.000530809312160791, 'border_count': 16, 'bagging_temperature': 0.6538784504861654, 'random_strength': 8.852166458581316, 'grow_policy': 'Lossguide', 'min_data_in_leaf': 708, 'max_leaves': 109}. Best is trial 71 with value: 220.50298826963083.[0m
[32m[I 2024-10-13 14:07:13,934][0m Trial 85 finished with value: 222.38515740386282 and parameters: {'depth': 8, 'learning_rate': 0.00540011940943606, 'iterations': 1521, 'l2_leaf_reg': 0.0001300772428497901, 'border_count': 35, 'bagging_temperature': 0.8569215840029576, 'random_strength': 8.37682465020791, 'grow_policy': 'Lossguide', 'min_data_in_leaf': 943, 'max_leaves': 150}. Best is trial 71 with value: 220.50298826963083.[0m
[32m[I 2024-10-13 14:07:16,348][0m Trial 86 finished with value: 237.61318292196043 and parameters: {'depth': 9, 'learning_rate': 0.0029812345225780834, 'iterations': 1405, 'l2_leaf_reg': 0.00013592661904686664, 'border_count': 34, 'bagging_temperature': 0.5692785031264318, 'random_strength': 8.319605021476857, 'grow_policy': 'Lossguide', 'min_data_in_leaf': 945, 'max_leaves': 92}. Best is trial 71 with value: 220.50298826963083.[0m
[32m[I 2024-10-13 14:07:17,087][0m Trial 87 finished with value: 702.3024361792756 and parameters: {'depth': 8, 'learning_rate': 0.0035981820567888394, 'iterations': 114, 'l2_leaf_reg': 0.00025304627413130423, 'border_count': 47, 'bagging_temperature': 0.8079971452681808, 'random_strength': 7.973872671970106, 'grow_policy': 'Lossguide', 'min_data_in_leaf': 923, 'max_leaves': 145}. Best is trial 71 with value: 220.50298826963083.[0m
[32m[I 2024-10-13 14:07:20,307][0m Trial 88 finished with value: 247.14214097368486 and parameters: {'depth': 9, 'learning_rate': 0.005927050491877837, 'iterations': 1695, 'l2_leaf_reg': 2.3897013324858542e-05, 'border_count': 74, 'bagging_temperature': 0.8554166239099834, 'random_strength': 9.529676298881455, 'grow_policy': 'Depthwise', 'min_data_in_leaf': 899}. Best is trial 71 with value: 220.50298826963083.[0m
[32m[I 2024-10-13 14:07:22,330][0m Trial 89 finished with value: 223.37660004327466 and parameters: {'depth': 10, 'learning_rate': 0.007545277707501862, 'iterations': 1259, 'l2_leaf_reg': 0.0012519702183801682, 'border_count': 41, 'bagging_temperature': 0.8986906276948154, 'random_strength': 7.069545188579961, 'grow_policy': 'Lossguide', 'min_data_in_leaf': 869, 'max_leaves': 67}. Best is trial 71 with value: 220.50298826963083.[0m
[32m[I 2024-10-13 14:07:27,870][0m Trial 90 finished with value: 240.01924264540617 and parameters: {'depth': 10, 'learning_rate': 0.008026795819435547, 'iterations': 1225, 'l2_leaf_reg': 0.0013450832390284988, 'border_count': 43, 'bagging_temperature': 0.9057221153702428, 'random_strength': 6.953123864433744, 'grow_policy': 'Lossguide', 'min_data_in_leaf': 976, 'max_leaves': 46}. Best is trial 71 with value: 220.50298826963083.[0m
[32m[I 2024-10-13 14:07:30,180][0m Trial 91 finished with value: 221.7042935999248 and parameters: {'depth': 10, 'learning_rate': 0.004442962479264966, 'iterations': 1340, 'l2_leaf_reg': 0.0003930184766382623, 'border_count': 35, 'bagging_temperature': 0.9961139989192739, 'random_strength': 6.018249495459882, 'grow_policy': 'Lossguide', 'min_data_in_leaf': 873, 'max_leaves': 47}. Best is trial 71 with value: 220.50298826963083.[0m
[32m[I 2024-10-13 14:07:32,274][0m Trial 92 finished with value: 244.01555574191548 and parameters: {'depth': 10, 'learning_rate': 0.006781148061133355, 'iterations': 1381, 'l2_leaf_reg': 0.0009516060966586247, 'border_count': 54, 'bagging_temperature': 0.887013100902157, 'random_strength': 6.049535905878666, 'grow_policy': 'Lossguide', 'min_data_in_leaf': 871, 'max_leaves': 58}. Best is trial 71 with value: 220.50298826963083.[0m
[32m[I 2024-10-13 14:07:35,001][0m Trial 93 finished with value: 231.71304110585564 and parameters: {'depth': 11, 'learning_rate': 0.010093686129325668, 'iterations': 1532, 'l2_leaf_reg': 6.485984587501781e-05, 'border_count': 26, 'bagging_temperature': 0.9997961565603379, 'random_strength': 6.714197489857315, 'grow_policy': 'Lossguide', 'min_data_in_leaf': 945, 'max_leaves': 31}. Best is trial 71 with value: 220.50298826963083.[0m
[32m[I 2024-10-13 14:07:37,247][0m Trial 94 finished with value: 225.69606493944946 and parameters: {'depth': 10, 'learning_rate': 0.004034985453365197, 'iterations': 1258, 'l2_leaf_reg': 0.00029914296750532896, 'border_count': 41, 'bagging_temperature': 0.9512587065747532, 'random_strength': 7.26017603249707, 'grow_policy': 'Lossguide', 'min_data_in_leaf': 828, 'max_leaves': 65}. Best is trial 71 with value: 220.50298826963083.[0m
[32m[I 2024-10-13 14:07:40,416][0m Trial 95 finished with value: 239.11207921933882 and parameters: {'depth': 10, 'learning_rate': 0.00415624226285644, 'iterations': 1175, 'l2_leaf_reg': 0.0002923051878465072, 'border_count': 64, 'bagging_temperature': 0.9620126330928763, 'random_strength': 7.262455983357188, 'grow_policy': 'Lossguide', 'min_data_in_leaf': 823, 'max_leaves': 65}. Best is trial 71 with value: 220.50298826963083.[0m
[32m[I 2024-10-13 14:07:42,503][0m Trial 96 finished with value: 283.77003291977206 and parameters: {'depth': 10, 'learning_rate': 0.0022760228136917515, 'iterations': 1260, 'l2_leaf_reg': 0.0001543381481266469, 'border_count': 40, 'bagging_temperature': 0.9807717424938575, 'random_strength': 6.427774616622065, 'grow_policy': 'Lossguide', 'min_data_in_leaf': 914, 'max_leaves': 40}. Best is trial 71 with value: 220.50298826963083.[0m
[32m[I 2024-10-13 14:07:45,523][0m Trial 97 finished with value: 372.2007350821235 and parameters: {'depth': 8, 'learning_rate': 0.0017646975543273062, 'iterations': 1050, 'l2_leaf_reg': 0.0025882704760569262, 'border_count': 51, 'bagging_temperature': 0.9429824152563075, 'random_strength': 5.30983960593797, 'grow_policy': 'Lossguide', 'min_data_in_leaf': 888, 'max_leaves': 74}. Best is trial 71 with value: 220.50298826963083.[0m
[32m[I 2024-10-13 14:07:50,231][0m Trial 98 finished with value: 258.59583876189737 and parameters: {'depth': 9, 'learning_rate': 0.0028115966195886035, 'iterations': 1344, 'l2_leaf_reg': 8.550905404044655e-05, 'border_count': 170, 'bagging_temperature': 0.8993657976672035, 'random_strength': 5.920471252291554, 'grow_policy': 'Lossguide', 'min_data_in_leaf': 982, 'max_leaves': 48}. Best is trial 71 with value: 220.50298826963083.[0m
[32m[I 2024-10-13 14:07:52,590][0m Trial 99 finished with value: 219.56324459923857 and parameters: {'depth': 10, 'learning_rate': 0.0042730918191807195, 'iterations': 1445, 'l2_leaf_reg': 0.0007202582588472336, 'border_count': 33, 'bagging_temperature': 0.9806215528657538, 'random_strength': 7.633020456253836, 'grow_policy': 'Lossguide', 'min_data_in_leaf': 806, 'max_leaves': 59}. Best is trial 99 with value: 219.56324459923857.[0m
[32m[I 2024-10-13 14:08:17,658][0m Trial 100 finished with value: 308.86351601199436 and parameters: {'depth': 9, 'learning_rate': 0.005745375212306103, 'iterations': 1449, 'l2_leaf_reg': 0.0007869318704039719, 'border_count': 33, 'bagging_temperature': 0.9787640200641609, 'random_strength': 7.732443917213841, 'grow_policy': 'SymmetricTree', 'min_data_in_leaf': 948}. Best is trial 99 with value: 219.56324459923857.[0m
