[32m[I 2024-10-13 14:18:18,168][0m Trial 251 finished with value: 220.64354536969853 and parameters: {'depth': 4, 'learning_rate': 0.0033513421048987197, 'iterations': 2482, 'l2_leaf_reg': 7.816745573590641e-06, 'border_count': 26, 'bagging_temperature': 0.9659814457973472, 'random_strength': 7.579252486457919, 'grow_policy': 'Depthwise', 'min_data_in_leaf': 286}. Best is trial 249 with value: 218.928091082675.[0m
[32m[I 2024-10-13 14:18:20,593][0m Trial 252 finished with value: 219.3823576329606 and parameters: {'depth': 4, 'learning_rate': 0.002910388281066142, 'iterations': 2537, 'l2_leaf_reg': 1.93372484404658e-05, 'border_count': 33, 'bagging_temperature': 0.9808217338337124, 'random_strength': 7.336324019351484, 'grow_policy': 'Depthwise', 'min_data_in_leaf': 235}. Best is trial 249 with value: 218.928091082675.[0m
[32m[I 2024-10-13 14:18:23,003][0m Trial 253 finished with value: 220.0474058326717 and parameters: {'depth': 4, 'learning_rate': 0.002946420619099401, 'iterations': 2520, 'l2_leaf_reg': 1.2584052664104606e-05, 'border_count': 31, 'bagging_temperature': 0.973439035423394, 'random_strength': 6.935226234775304, 'grow_policy': 'Depthwise', 'min_data_in_leaf': 234}. Best is trial 249 with value: 218.928091082675.[0m
[32m[I 2024-10-13 14:18:25,380][0m Trial 254 finished with value: 229.3408311740234 and parameters: {'depth': 4, 'learning_rate': 0.00353586028376306, 'iterations': 2538, 'l2_leaf_reg': 1.3981180666941032e-05, 'border_count': 23, 'bagging_temperature': 0.9811751040405906, 'random_strength': 6.87282145767885, 'grow_policy': 'Depthwise', 'min_data_in_leaf': 206}. Best is trial 249 with value: 218.928091082675.[0m
[32m[I 2024-10-13 14:18:27,680][0m Trial 255 finished with value: 226.27758451940034 and parameters: {'depth': 4, 'learning_rate': 0.0020008254837535727, 'iterations': 2405, 'l2_leaf_reg': 1.9935554937722736e-05, 'border_count': 32, 'bagging_temperature': 0.9831240887515594, 'random_strength': 7.048370830037229, 'grow_policy': 'Depthwise', 'min_data_in_leaf': 178}. Best is trial 249 with value: 218.928091082675.[0m
[32m[I 2024-10-13 14:18:30,165][0m Trial 256 finished with value: 219.92854570115253 and parameters: {'depth': 4, 'learning_rate': 0.002898253517270854, 'iterations': 2559, 'l2_leaf_reg': 1.1353967787408661e-05, 'border_count': 30, 'bagging_temperature': 0.9996401406469986, 'random_strength': 7.320540816814887, 'grow_policy': 'Depthwise', 'min_data_in_leaf': 256}. Best is trial 249 with value: 218.928091082675.[0m
[32m[I 2024-10-13 14:18:32,676][0m Trial 257 finished with value: 221.38004730252246 and parameters: {'depth': 4, 'learning_rate': 0.003408906262529141, 'iterations': 2563, 'l2_leaf_reg': 8.987830078416543e-06, 'border_count': 26, 'bagging_temperature': 0.9968669303711235, 'random_strength': 7.375616559164317, 'grow_policy': 'Depthwise', 'min_data_in_leaf': 265}. Best is trial 249 with value: 218.928091082675.[0m
[32m[I 2024-10-13 14:18:35,031][0m Trial 258 finished with value: 219.38208525142647 and parameters: {'depth': 3, 'learning_rate': 0.002868949585065547, 'iterations': 2471, 'l2_leaf_reg': 2.1275171919800812e-05, 'border_count': 33, 'bagging_temperature': 0.9639299652999648, 'random_strength': 7.308793025316083, 'grow_policy': 'Depthwise', 'min_data_in_leaf': 253}. Best is trial 249 with value: 218.928091082675.[0m
[32m[I 2024-10-13 14:18:37,360][0m Trial 259 finished with value: 221.78445405636967 and parameters: {'depth': 3, 'learning_rate': 0.00219682838407865, 'iterations': 2483, 'l2_leaf_reg': 2.065358910589882e-05, 'border_count': 34, 'bagging_temperature': 0.9608734496645565, 'random_strength': 7.413924862795773, 'grow_policy': 'Depthwise', 'min_data_in_leaf': 305}. Best is trial 249 with value: 218.928091082675.[0m
[32m[I 2024-10-13 14:18:39,644][0m Trial 260 finished with value: 221.54420983896244 and parameters: {'depth': 3, 'learning_rate': 0.0024932298331834675, 'iterations': 2391, 'l2_leaf_reg': 2.1032422030739353e-05, 'border_count': 27, 'bagging_temperature': 0.9620257421138544, 'random_strength': 7.576240779196003, 'grow_policy': 'Depthwise', 'min_data_in_leaf': 214}. Best is trial 249 with value: 218.928091082675.[0m
[32m[I 2024-10-13 14:18:42,004][0m Trial 261 finished with value: 220.83220114779942 and parameters: {'depth': 4, 'learning_rate': 0.0036000225463102735, 'iterations': 2468, 'l2_leaf_reg': 7.388150058839752e-06, 'border_count': 33, 'bagging_temperature': 0.9665603436914084, 'random_strength': 7.101120618175113, 'grow_policy': 'Depthwise', 'min_data_in_leaf': 447}. Best is trial 249 with value: 218.928091082675.[0m
[32m[I 2024-10-13 14:18:44,423][0m Trial 262 finished with value: 227.2513089938959 and parameters: {'depth': 3, 'learning_rate': 0.0030284396611489073, 'iterations': 2553, 'l2_leaf_reg': 1.4735614473453985e-05, 'border_count': 23, 'bagging_temperature': 0.938137992701214, 'random_strength': 7.3036322345565905, 'grow_policy': 'Depthwise', 'min_data_in_leaf': 280}. Best is trial 249 with value: 218.928091082675.[0m
[32m[I 2024-10-13 14:18:46,661][0m Trial 263 finished with value: 230.18374957856864 and parameters: {'depth': 4, 'learning_rate': 0.0019422620803319294, 'iterations': 2305, 'l2_leaf_reg': 2.6293156048709023e-05, 'border_count': 33, 'bagging_temperature': 0.9851382618915822, 'random_strength': 7.6016641408944485, 'grow_policy': 'Depthwise', 'min_data_in_leaf': 236}. Best is trial 249 with value: 218.928091082675.[0m
[32m[I 2024-10-13 14:18:49,240][0m Trial 264 finished with value: 235.54084783314624 and parameters: {'depth': 3, 'learning_rate': 0.002447565593236131, 'iterations': 2724, 'l2_leaf_reg': 6.591204182823633e-06, 'border_count': 45, 'bagging_temperature': 0.9656351388798228, 'random_strength': 6.597326242403435, 'grow_policy': 'Depthwise', 'min_data_in_leaf': 423}. Best is trial 249 with value: 218.928091082675.[0m
[32m[I 2024-10-13 14:18:58,400][0m Trial 265 finished with value: 276.2155396477466 and parameters: {'depth': 4, 'learning_rate': 0.00296876024021771, 'iterations': 2588, 'l2_leaf_reg': 1.0903702397384478e-05, 'border_count': 44, 'bagging_temperature': 0.9849490432908504, 'random_strength': 7.444935079407613, 'grow_policy': 'SymmetricTree', 'min_data_in_leaf': 256}. Best is trial 249 with value: 218.928091082675.[0m
[32m[I 2024-10-13 14:19:00,829][0m Trial 266 finished with value: 247.34794612221796 and parameters: {'depth': 4, 'learning_rate': 0.003534757860001104, 'iterations': 2507, 'l2_leaf_reg': 1.760302188091674e-05, 'border_count': 20, 'bagging_temperature': 0.9350903046304158, 'random_strength': 7.083838817230067, 'grow_policy': 'Depthwise', 'min_data_in_leaf': 223}. Best is trial 249 with value: 218.928091082675.[0m
[32m[I 2024-10-13 14:19:03,202][0m Trial 267 finished with value: 223.34162535754177 and parameters: {'depth': 4, 'learning_rate': 0.002165665747379867, 'iterations': 2427, 'l2_leaf_reg': 7.512008077604709e-06, 'border_count': 34, 'bagging_temperature': 0.95800603308915, 'random_strength': 7.287396296165505, 'grow_policy': 'Depthwise', 'min_data_in_leaf': 438}. Best is trial 249 with value: 218.928091082675.[0m
[32m[I 2024-10-13 14:19:05,696][0m Trial 268 finished with value: 220.4136293062168 and parameters: {'depth': 3, 'learning_rate': 0.0027362264845314684, 'iterations': 2661, 'l2_leaf_reg': 2.1282798132683053e-05, 'border_count': 28, 'bagging_temperature': 0.9839479602425206, 'random_strength': 7.623167552280437, 'grow_policy': 'Depthwise', 'min_data_in_leaf': 162}. Best is trial 249 with value: 218.928091082675.[0m
[32m[I 2024-10-13 14:19:08,035][0m Trial 269 finished with value: 223.19582421661968 and parameters: {'depth': 4, 'learning_rate': 0.003862831970410745, 'iterations': 2488, 'l2_leaf_reg': 1.1379303842971912e-05, 'border_count': 36, 'bagging_temperature': 0.9639350798174668, 'random_strength': 6.789406801623725, 'grow_policy': 'Lossguide', 'min_data_in_leaf': 509, 'max_leaves': 58}. Best is trial 249 with value: 218.928091082675.[0m
[32m[I 2024-10-13 14:19:10,406][0m Trial 270 finished with value: 243.30207143512422 and parameters: {'depth': 4, 'learning_rate': 0.0017998991965651162, 'iterations': 2591, 'l2_leaf_reg': 2.694632035245449e-05, 'border_count': 47, 'bagging_temperature': 0.6055541910434348, 'random_strength': 7.437409329875099, 'grow_policy': 'Lossguide', 'min_data_in_leaf': 452, 'max_leaves': 48}. Best is trial 249 with value: 218.928091082675.[0m
[32m[I 2024-10-13 14:19:12,689][0m Trial 271 finished with value: 247.62935544843003 and parameters: {'depth': 4, 'learning_rate': 0.003059407115306893, 'iterations': 2373, 'l2_leaf_reg': 1.5187394530908222e-05, 'border_count': 189, 'bagging_temperature': 0.9355457486044201, 'random_strength': 7.051807426350754, 'grow_policy': 'Lossguide', 'min_data_in_leaf': 200, 'max_leaves': 60}. Best is trial 249 with value: 218.928091082675.[0m
[32m[I 2024-10-13 14:19:15,263][0m Trial 272 finished with value: 219.68051456774444 and parameters: {'depth': 4, 'learning_rate': 0.0024441838466644325, 'iterations': 2729, 'l2_leaf_reg': 2.789364359562947e-06, 'border_count': 27, 'bagging_temperature': 0.9986209159949156, 'random_strength': 7.28295135356495, 'grow_policy': 'Lossguide', 'min_data_in_leaf': 294, 'max_leaves': 65}. Best is trial 249 with value: 218.928091082675.[0m
[32m[I 2024-10-13 14:19:24,825][0m Trial 273 finished with value: 288.69428177672256 and parameters: {'depth': 4, 'learning_rate': 0.002418925389467518, 'iterations': 2746, 'l2_leaf_reg': 2.7903964288003417e-06, 'border_count': 22, 'bagging_temperature': 0.9967800658005761, 'random_strength': 7.698495723669852, 'grow_policy': 'SymmetricTree', 'min_data_in_leaf': 271}. Best is trial 249 with value: 218.928091082675.[0m
[32m[I 2024-10-13 14:19:27,194][0m Trial 274 finished with value: 235.8994299910427 and parameters: {'depth': 4, 'learning_rate': 0.0016338616858937636, 'iterations': 2542, 'l2_leaf_reg': 2.7148040039534732e-05, 'border_count': 30, 'bagging_temperature': 0.9990683952227204, 'random_strength': 7.471279405978461, 'grow_policy': 'Lossguide', 'min_data_in_leaf': 295, 'max_leaves': 65}. Best is trial 249 with value: 218.928091082675.[0m
[32m[I 2024-10-13 14:19:29,880][0m Trial 275 finished with value: 227.33889382548094 and parameters: {'depth': 3, 'learning_rate': 0.002201716159115855, 'iterations': 2709, 'l2_leaf_reg': 9.743151195030133e-06, 'border_count': 24, 'bagging_temperature': 0.9752310474712512, 'random_strength': 6.951882404639621, 'grow_policy': 'Lossguide', 'min_data_in_leaf': 467, 'max_leaves': 66}. Best is trial 249 with value: 218.928091082675.[0m
[32m[I 2024-10-13 14:19:32,220][0m Trial 276 finished with value: 219.29675727037636 and parameters: {'depth': 4, 'learning_rate': 0.002643154114837371, 'iterations': 2458, 'l2_leaf_reg': 5.232621204386424e-05, 'border_count': 34, 'bagging_temperature': 0.9810183951829186, 'random_strength': 7.296414356271322, 'grow_policy': 'Lossguide', 'min_data_in_leaf': 422, 'max_leaves': 51}. Best is trial 249 with value: 218.928091082675.[0m
[32m[I 2024-10-13 14:19:34,555][0m Trial 277 finished with value: 228.92152501443027 and parameters: {'depth': 4, 'learning_rate': 0.001977038189993451, 'iterations': 2454, 'l2_leaf_reg': 5.990196925300501e-05, 'border_count': 28, 'bagging_temperature': 0.9768663174018193, 'random_strength': 7.264566635795334, 'grow_policy': 'Lossguide', 'min_data_in_leaf': 419, 'max_leaves': 56}. Best is trial 249 with value: 218.928091082675.[0m
[32m[I 2024-10-13 14:19:36,773][0m Trial 278 finished with value: 220.54292822183797 and parameters: {'depth': 4, 'learning_rate': 0.0025465701733019992, 'iterations': 2360, 'l2_leaf_reg': 3.30569403584015e-05, 'border_count': 34, 'bagging_temperature': 0.9523140650267964, 'random_strength': 6.781005734763381, 'grow_policy': 'Lossguide', 'min_data_in_leaf': 434, 'max_leaves': 50}. Best is trial 249 with value: 218.928091082675.[0m
[32m[I 2024-10-13 14:19:39,157][0m Trial 279 finished with value: 252.13094545856148 and parameters: {'depth': 4, 'learning_rate': 0.0024428854203719296, 'iterations': 2503, 'l2_leaf_reg': 1.7231920669599157e-05, 'border_count': 19, 'bagging_temperature': 0.9426281298763173, 'random_strength': 7.26720339786837, 'grow_policy': 'Lossguide', 'min_data_in_leaf': 538, 'max_leaves': 52}. Best is trial 249 with value: 218.928091082675.[0m
[32m[I 2024-10-13 14:19:41,609][0m Trial 280 finished with value: 259.8363789543503 and parameters: {'depth': 4, 'learning_rate': 0.0013390291676915792, 'iterations': 2552, 'l2_leaf_reg': 4.6826375849801235e-05, 'border_count': 27, 'bagging_temperature': 0.9821256943180884, 'random_strength': 7.628287136611301, 'grow_policy': 'Depthwise', 'min_data_in_leaf': 109}. Best is trial 249 with value: 218.928091082675.[0m
[32m[I 2024-10-13 14:19:43,985][0m Trial 281 finished with value: 292.3995972474282 and parameters: {'depth': 3, 'learning_rate': 0.07020779901837934, 'iterations': 2426, 'l2_leaf_reg': 5.311477245129707e-05, 'border_count': 37, 'bagging_temperature': 0.9599021611474136, 'random_strength': 6.378128477772647, 'grow_policy': 'Lossguide', 'min_data_in_leaf': 383, 'max_leaves': 71}. Best is trial 249 with value: 218.928091082675.[0m
[32m[I 2024-10-13 14:19:46,404][0m Trial 282 finished with value: 307.0193629213478 and parameters: {'depth': 4, 'learning_rate': 0.0009563482485727313, 'iterations': 2612, 'l2_leaf_reg': 2.104928689442916e-05, 'border_count': 43, 'bagging_temperature': 0.9986307861697826, 'random_strength': 7.081520573941146, 'grow_policy': 'Lossguide', 'min_data_in_leaf': 460, 'max_leaves': 59}. Best is trial 249 with value: 218.928091082675.[0m
[32m[I 2024-10-13 14:19:48,903][0m Trial 283 finished with value: 220.81763519435864 and parameters: {'depth': 4, 'learning_rate': 0.0033483272045525332, 'iterations': 2474, 'l2_leaf_reg': 1.1985185470005468e-05, 'border_count': 36, 'bagging_temperature': 0.9369997399254574, 'random_strength': 7.437624112104174, 'grow_policy': 'Lossguide', 'min_data_in_leaf': 331, 'max_leaves': 44}. Best is trial 249 with value: 218.928091082675.[0m
[32m[I 2024-10-13 14:19:51,388][0m Trial 284 finished with value: 222.6498165031902 and parameters: {'depth': 4, 'learning_rate': 0.0020770308615089654, 'iterations': 2583, 'l2_leaf_reg': 7.1025297055441524e-06, 'border_count': 30, 'bagging_temperature': 0.9993225068093011, 'random_strength': 7.238567731781045, 'grow_policy': 'Lossguide', 'min_data_in_leaf': 411, 'max_leaves': 35}. Best is trial 249 with value: 218.928091082675.[0m
[32m[I 2024-10-13 14:19:53,965][0m Trial 285 finished with value: 222.63079677899415 and parameters: {'depth': 3, 'learning_rate': 0.0038449724257316135, 'iterations': 2534, 'l2_leaf_reg': 3.077542827538163e-05, 'border_count': 41, 'bagging_temperature': 0.9682847933801946, 'random_strength': 7.634137359850374, 'grow_policy': 'Lossguide', 'min_data_in_leaf': 435, 'max_leaves': 63}. Best is trial 249 with value: 218.928091082675.[0m
[32m[I 2024-10-13 14:19:56,566][0m Trial 286 finished with value: 234.82816573304612 and parameters: {'depth': 4, 'learning_rate': 0.002658050586364308, 'iterations': 2659, 'l2_leaf_reg': 1.4852485112535167e-05, 'border_count': 24, 'bagging_temperature': 0.11443577812052397, 'random_strength': 1.834537724296026, 'grow_policy': 'Lossguide', 'min_data_in_leaf': 477, 'max_leaves': 52}. Best is trial 249 with value: 218.928091082675.[0m
[32m[I 2024-10-13 14:19:58,956][0m Trial 287 finished with value: 243.06649328910888 and parameters: {'depth': 4, 'learning_rate': 0.0017481922839564748, 'iterations': 2409, 'l2_leaf_reg': 2.1485157347651654e-05, 'border_count': 49, 'bagging_temperature': 0.9799335566985705, 'random_strength': 6.969837089193732, 'grow_policy': 'Lossguide', 'min_data_in_leaf': 313, 'max_leaves': 68}. Best is trial 249 with value: 218.928091082675.[0m
[32m[I 2024-10-13 14:20:01,562][0m Trial 288 finished with value: 221.24541191444726 and parameters: {'depth': 4, 'learning_rate': 0.0032904871975972636, 'iterations': 2612, 'l2_leaf_reg': 8.601052800543098e-06, 'border_count': 35, 'bagging_temperature': 0.923533469459012, 'random_strength': 5.1547304814684205, 'grow_policy': 'Depthwise', 'min_data_in_leaf': 524}. Best is trial 249 with value: 218.928091082675.[0m
[32m[I 2024-10-13 14:20:04,027][0m Trial 289 finished with value: 244.2696560528668 and parameters: {'depth': 3, 'learning_rate': 0.0023195553158380368, 'iterations': 2501, 'l2_leaf_reg': 4.474847406963119e-06, 'border_count': 87, 'bagging_temperature': 0.9590102065211491, 'random_strength': 7.413835856770756, 'grow_policy': 'Lossguide', 'min_data_in_leaf': 449, 'max_leaves': 74}. Best is trial 249 with value: 218.928091082675.[0m
[32m[I 2024-10-13 14:20:06,369][0m Trial 290 finished with value: 219.38862618812504 and parameters: {'depth': 4, 'learning_rate': 0.002857313336820841, 'iterations': 2298, 'l2_leaf_reg': 0.00011508044540406024, 'border_count': 30, 'bagging_temperature': 0.978590936220081, 'random_strength': 6.651226820494526, 'grow_policy': 'Lossguide', 'min_data_in_leaf': 398, 'max_leaves': 61}. Best is trial 249 with value: 218.928091082675.[0m
[32m[I 2024-10-13 14:20:08,592][0m Trial 291 finished with value: 220.28230940622467 and parameters: {'depth': 4, 'learning_rate': 0.002828850242804374, 'iterations': 2288, 'l2_leaf_reg': 4.2472724694650754e-05, 'border_count': 29, 'bagging_temperature': 0.9841247078561403, 'random_strength': 1.4630297393463385, 'grow_policy': 'Lossguide', 'min_data_in_leaf': 390, 'max_leaves': 60}. Best is trial 249 with value: 218.928091082675.[0m
[32m[I 2024-10-13 14:20:10,784][0m Trial 292 finished with value: 228.50943365853664 and parameters: {'depth': 4, 'learning_rate': 0.003870108024115286, 'iterations': 2306, 'l2_leaf_reg': 0.00010386535913267742, 'border_count': 23, 'bagging_temperature': 0.9998378265658527, 'random_strength': 6.789128961296685, 'grow_policy': 'Lossguide', 'min_data_in_leaf': 409, 'max_leaves': 54}. Best is trial 249 with value: 218.928091082675.[0m
[32m[I 2024-10-13 14:20:13,002][0m Trial 293 finished with value: 248.1760822090405 and parameters: {'depth': 4, 'learning_rate': 0.00331212110545874, 'iterations': 2369, 'l2_leaf_reg': 1.300324465713062e-05, 'border_count': 19, 'bagging_temperature': 0.9389348326328317, 'random_strength': 7.508959374646368, 'grow_policy': 'Lossguide', 'min_data_in_leaf': 421, 'max_leaves': 66}. Best is trial 249 with value: 218.928091082675.[0m
[32m[I 2024-10-13 14:20:15,298][0m Trial 294 finished with value: 219.92106006430748 and parameters: {'depth': 4, 'learning_rate': 0.002690040555141275, 'iterations': 2426, 'l2_leaf_reg': 2.7430080098885193e-05, 'border_count': 31, 'bagging_temperature': 0.9598079549014954, 'random_strength': 6.9811890551694695, 'grow_policy': 'Lossguide', 'min_data_in_leaf': 375, 'max_leaves': 62}. Best is trial 249 with value: 218.928091082675.[0m
[32m[I 2024-10-13 14:20:17,649][0m Trial 295 finished with value: 249.19635260801215 and parameters: {'depth': 4, 'learning_rate': 0.003124311621919299, 'iterations': 2476, 'l2_leaf_reg': 6.566406382041408e-06, 'border_count': 13, 'bagging_temperature': 0.9798371729320084, 'random_strength': 7.6988548994837025, 'grow_policy': 'Lossguide', 'min_data_in_leaf': 272, 'max_leaves': 70}. Best is trial 249 with value: 218.928091082675.[0m
[32m[I 2024-10-13 14:20:20,101][0m Trial 296 finished with value: 236.01726187452417 and parameters: {'depth': 3, 'learning_rate': 0.0026843761793099, 'iterations': 2546, 'l2_leaf_reg': 1.012665735264512e-05, 'border_count': 42, 'bagging_temperature': 0.9515604841689546, 'random_strength': 6.619486727275192, 'grow_policy': 'Depthwise', 'min_data_in_leaf': 394}. Best is trial 249 with value: 218.928091082675.[0m
[32m[I 2024-10-13 14:20:29,399][0m Trial 297 finished with value: 272.9917659467733 and parameters: {'depth': 4, 'learning_rate': 0.003912934495390475, 'iterations': 2694, 'l2_leaf_reg': 1.742569439724933e-05, 'border_count': 27, 'bagging_temperature': 0.9246557365410873, 'random_strength': 7.154151963763898, 'grow_policy': 'SymmetricTree', 'min_data_in_leaf': 424}. Best is trial 249 with value: 218.928091082675.[0m
[32m[I 2024-10-13 14:20:31,745][0m Trial 298 finished with value: 226.3169900892586 and parameters: {'depth': 4, 'learning_rate': 0.0020180466659017538, 'iterations': 2459, 'l2_leaf_reg': 3.890670514915575e-06, 'border_count': 34, 'bagging_temperature': 0.9764685903296738, 'random_strength': 7.404753317107305, 'grow_policy': 'Lossguide', 'min_data_in_leaf': 346, 'max_leaves': 57}. Best is trial 249 with value: 218.928091082675.[0m
[32m[I 2024-10-13 14:20:34,005][0m Trial 299 finished with value: 247.31848143984337 and parameters: {'depth': 4, 'learning_rate': 0.003404041826017417, 'iterations': 2334, 'l2_leaf_reg': 3.081792052141482e-05, 'border_count': 135, 'bagging_temperature': 0.9997737391043177, 'random_strength': 7.28684075201285, 'grow_policy': 'Lossguide', 'min_data_in_leaf': 234, 'max_leaves': 72}. Best is trial 249 with value: 218.928091082675.[0m
[32m[I 2024-10-13 14:20:36,423][0m Trial 300 finished with value: 219.900328846562 and parameters: {'depth': 5, 'learning_rate': 0.00250054175612864, 'iterations': 2566, 'l2_leaf_reg': 4.6538351012073236e-05, 'border_count': 38, 'bagging_temperature': 0.950990072495234, 'random_strength': 7.643733993490491, 'grow_policy': 'Lossguide', 'min_data_in_leaf': 446, 'max_leaves': 66}. Best is trial 249 with value: 218.928091082675.[0m
[32m[I 2024-10-13 14:20:38,780][0m Trial 301 finished with value: 235.45780523775963 and parameters: {'depth': 3, 'learning_rate': 0.002912927610780134, 'iterations': 2530, 'l2_leaf_reg': 3.1612618966894844e-06, 'border_count': 46, 'bagging_temperature': 0.9683067763119436, 'random_strength': 6.922133048260597, 'grow_policy': 'Lossguide', 'min_data_in_leaf': 210, 'max_leaves': 77}. Best is trial 249 with value: 218.928091082675.[0m
