[32m[I 2024-10-13 14:39:28,773][0m Trial 703 finished with value: 200.225377880774 and parameters: {'depth': 7, 'learning_rate': 0.0035688511996201234, 'iterations': 2995, 'l2_leaf_reg': 9.72580980077574, 'border_count': 35, 'bagging_temperature': 0.7461691295429691, 'random_strength': 4.32614547548642, 'grow_policy': 'Lossguide', 'min_data_in_leaf': 495, 'max_leaves': 145}. Best is trial 684 with value: 198.81639474308358.[0m
[32m[I 2024-10-13 14:39:31,499][0m Trial 704 finished with value: 200.90241747370857 and parameters: {'depth': 7, 'learning_rate': 0.003505257690201002, 'iterations': 2993, 'l2_leaf_reg': 9.71678364085474, 'border_count': 36, 'bagging_temperature': 0.7080350240710737, 'random_strength': 4.304564993702636, 'grow_policy': 'Lossguide', 'min_data_in_leaf': 489, 'max_leaves': 146}. Best is trial 684 with value: 198.81639474308358.[0m
[32m[I 2024-10-13 14:39:34,237][0m Trial 705 finished with value: 200.58821344100605 and parameters: {'depth': 7, 'learning_rate': 0.003559050801349116, 'iterations': 2990, 'l2_leaf_reg': 9.953932857770685, 'border_count': 37, 'bagging_temperature': 0.7238644872560469, 'random_strength': 4.3497909295660495, 'grow_policy': 'Lossguide', 'min_data_in_leaf': 487, 'max_leaves': 147}. Best is trial 684 with value: 198.81639474308358.[0m
[32m[I 2024-10-13 14:39:37,048][0m Trial 706 finished with value: 200.97117183114213 and parameters: {'depth': 7, 'learning_rate': 0.003537233113485955, 'iterations': 2996, 'l2_leaf_reg': 8.923313081582972, 'border_count': 37, 'bagging_temperature': 0.706003351850338, 'random_strength': 4.253649985079147, 'grow_policy': 'Lossguide', 'min_data_in_leaf': 481, 'max_leaves': 148}. Best is trial 684 with value: 198.81639474308358.[0m
[32m[I 2024-10-13 14:39:39,791][0m Trial 707 finished with value: 200.83859176142363 and parameters: {'depth': 7, 'learning_rate': 0.003530733844759436, 'iterations': 2998, 'l2_leaf_reg': 8.798730086200012, 'border_count': 38, 'bagging_temperature': 0.7112896158073045, 'random_strength': 4.255511939484226, 'grow_policy': 'Lossguide', 'min_data_in_leaf': 486, 'max_leaves': 148}. Best is trial 684 with value: 198.81639474308358.[0m
[32m[I 2024-10-13 14:39:42,568][0m Trial 708 finished with value: 201.22539487401522 and parameters: {'depth': 7, 'learning_rate': 0.0032924565731599215, 'iterations': 2936, 'l2_leaf_reg': 9.664597615886866, 'border_count': 39, 'bagging_temperature': 0.7329121029613699, 'random_strength': 4.3960096444483785, 'grow_policy': 'Lossguide', 'min_data_in_leaf': 486, 'max_leaves': 145}. Best is trial 684 with value: 198.81639474308358.[0m
[32m[I 2024-10-13 14:39:45,300][0m Trial 709 finished with value: 200.48934126132292 and parameters: {'depth': 7, 'learning_rate': 0.003564332946967012, 'iterations': 3000, 'l2_leaf_reg': 9.89033639072918, 'border_count': 37, 'bagging_temperature': 0.7468861925785222, 'random_strength': 4.020654978384377, 'grow_policy': 'Lossguide', 'min_data_in_leaf': 486, 'max_leaves': 153}. Best is trial 684 with value: 198.81639474308358.[0m
[32m[I 2024-10-13 14:39:48,049][0m Trial 710 finished with value: 200.83987273697662 and parameters: {'depth': 7, 'learning_rate': 0.0035384040850658708, 'iterations': 2934, 'l2_leaf_reg': 9.746718125242872, 'border_count': 39, 'bagging_temperature': 0.6934266400057255, 'random_strength': 4.047387178991426, 'grow_policy': 'Lossguide', 'min_data_in_leaf': 487, 'max_leaves': 153}. Best is trial 684 with value: 198.81639474308358.[0m
[32m[I 2024-10-13 14:39:50,841][0m Trial 711 finished with value: 199.77217563550923 and parameters: {'depth': 7, 'learning_rate': 0.0035552385928278754, 'iterations': 2949, 'l2_leaf_reg': 9.864416486199785, 'border_count': 42, 'bagging_temperature': 0.7557345215422064, 'random_strength': 4.115852194088057, 'grow_policy': 'Lossguide', 'min_data_in_leaf': 495, 'max_leaves': 155}. Best is trial 684 with value: 198.81639474308358.[0m
[32m[I 2024-10-13 14:39:53,643][0m Trial 712 finished with value: 211.56344753556206 and parameters: {'depth': 7, 'learning_rate': 0.0035484974374523086, 'iterations': 3000, 'l2_leaf_reg': 9.577464208933312, 'border_count': 143, 'bagging_temperature': 0.7460838773164803, 'random_strength': 4.529306660739644, 'grow_policy': 'Lossguide', 'min_data_in_leaf': 479, 'max_leaves': 139}. Best is trial 684 with value: 198.81639474308358.[0m
[32m[I 2024-10-13 14:39:56,369][0m Trial 713 finished with value: 199.97968732487462 and parameters: {'depth': 8, 'learning_rate': 0.0035800458126520017, 'iterations': 2933, 'l2_leaf_reg': 9.293139676096704, 'border_count': 43, 'bagging_temperature': 0.7614298618208357, 'random_strength': 3.5095171169900983, 'grow_policy': 'Lossguide', 'min_data_in_leaf': 499, 'max_leaves': 141}. Best is trial 684 with value: 198.81639474308358.[0m
[32m[I 2024-10-13 14:39:59,030][0m Trial 714 finished with value: 204.51088088109424 and parameters: {'depth': 8, 'learning_rate': 0.0035594734725427997, 'iterations': 2931, 'l2_leaf_reg': 9.703767582847545, 'border_count': 63, 'bagging_temperature': 0.7636507015102061, 'random_strength': 3.380669508210434, 'grow_policy': 'Lossguide', 'min_data_in_leaf': 500, 'max_leaves': 157}. Best is trial 684 with value: 198.81639474308358.[0m
[32m[I 2024-10-13 14:40:01,815][0m Trial 715 finished with value: 199.25161907359023 and parameters: {'depth': 8, 'learning_rate': 0.003609071074851701, 'iterations': 2936, 'l2_leaf_reg': 9.788579245894935, 'border_count': 46, 'bagging_temperature': 0.7419572354292697, 'random_strength': 3.580263163535099, 'grow_policy': 'Lossguide', 'min_data_in_leaf': 503, 'max_leaves': 141}. Best is trial 684 with value: 198.81639474308358.[0m
[32m[I 2024-10-13 14:40:04,475][0m Trial 716 finished with value: 205.96845384261263 and parameters: {'depth': 8, 'learning_rate': 0.003497438940822446, 'iterations': 2929, 'l2_leaf_reg': 9.641968407252774, 'border_count': 52, 'bagging_temperature': 0.742717254767974, 'random_strength': 3.5523716098415816, 'grow_policy': 'Lossguide', 'min_data_in_leaf': 503, 'max_leaves': 143}. Best is trial 684 with value: 198.81639474308358.[0m
[32m[I 2024-10-13 14:40:07,277][0m Trial 717 finished with value: 199.1897391903447 and parameters: {'depth': 7, 'learning_rate': 0.003520472579105527, 'iterations': 2931, 'l2_leaf_reg': 9.999077974236348, 'border_count': 44, 'bagging_temperature': 0.7315527452607483, 'random_strength': 4.118565411402538, 'grow_policy': 'Lossguide', 'min_data_in_leaf': 505, 'max_leaves': 132}. Best is trial 684 with value: 198.81639474308358.[0m
[32m[I 2024-10-13 14:40:10,053][0m Trial 718 finished with value: 204.85783307183155 and parameters: {'depth': 8, 'learning_rate': 0.0035463937835973377, 'iterations': 2929, 'l2_leaf_reg': 9.816904380628152, 'border_count': 51, 'bagging_temperature': 0.7743385008971345, 'random_strength': 3.6877004086774376, 'grow_policy': 'Lossguide', 'min_data_in_leaf': 476, 'max_leaves': 133}. Best is trial 684 with value: 198.81639474308358.[0m
[32m[I 2024-10-13 14:40:30,889][0m Trial 719 finished with value: 295.3507893154665 and parameters: {'depth': 7, 'learning_rate': 0.004203782653748074, 'iterations': 2929, 'l2_leaf_reg': 5.734697038620849, 'border_count': 47, 'bagging_temperature': 0.7268719326885115, 'random_strength': 4.0901993548757005, 'grow_policy': 'SymmetricTree', 'min_data_in_leaf': 502}. Best is trial 684 with value: 198.81639474308358.[0m
[32m[I 2024-10-13 14:40:33,613][0m Trial 720 finished with value: 210.5133646884 and parameters: {'depth': 7, 'learning_rate': 0.0036249666195906772, 'iterations': 2927, 'l2_leaf_reg': 6.26121414084374, 'border_count': 55, 'bagging_temperature': 0.7717011739435777, 'random_strength': 4.5206093232484585, 'grow_policy': 'Lossguide', 'min_data_in_leaf': 507, 'max_leaves': 130}. Best is trial 684 with value: 198.81639474308358.[0m
[32m[I 2024-10-13 14:40:36,376][0m Trial 721 finished with value: 205.74731669893873 and parameters: {'depth': 7, 'learning_rate': 0.004169736828458704, 'iterations': 2926, 'l2_leaf_reg': 6.385305526990222, 'border_count': 45, 'bagging_temperature': 0.7295838177281984, 'random_strength': 4.511809762636703, 'grow_policy': 'Lossguide', 'min_data_in_leaf': 475, 'max_leaves': 151}. Best is trial 684 with value: 198.81639474308358.[0m
[32m[I 2024-10-13 14:40:39,206][0m Trial 722 finished with value: 202.27590979503856 and parameters: {'depth': 8, 'learning_rate': 0.0035370605982013264, 'iterations': 2924, 'l2_leaf_reg': 6.485389454750876, 'border_count': 46, 'bagging_temperature': 0.7688673912794175, 'random_strength': 4.147781849498937, 'grow_policy': 'Lossguide', 'min_data_in_leaf': 476, 'max_leaves': 142}. Best is trial 684 with value: 198.81639474308358.[0m
[32m[I 2024-10-13 14:40:42,021][0m Trial 723 finished with value: 207.08290027679942 and parameters: {'depth': 7, 'learning_rate': 0.0034146337825562314, 'iterations': 2998, 'l2_leaf_reg': 6.537083670557677, 'border_count': 58, 'bagging_temperature': 0.7307542669558881, 'random_strength': 3.9394644395577596, 'grow_policy': 'Lossguide', 'min_data_in_leaf': 499, 'max_leaves': 135}. Best is trial 684 with value: 198.81639474308358.[0m
[32m[I 2024-10-13 14:40:44,756][0m Trial 724 finished with value: 200.14317149882427 and parameters: {'depth': 8, 'learning_rate': 0.003987835467681493, 'iterations': 2927, 'l2_leaf_reg': 9.588709107000945, 'border_count': 43, 'bagging_temperature': 0.7546992275860422, 'random_strength': 4.398647738408031, 'grow_policy': 'Lossguide', 'min_data_in_leaf': 507, 'max_leaves': 160}. Best is trial 684 with value: 198.81639474308358.[0m
[32m[I 2024-10-13 14:40:47,475][0m Trial 725 finished with value: 200.42163412597637 and parameters: {'depth': 8, 'learning_rate': 0.004408455426693906, 'iterations': 2917, 'l2_leaf_reg': 9.928490886088499, 'border_count': 49, 'bagging_temperature': 0.7573796221578485, 'random_strength': 2.879126094599055, 'grow_policy': 'Lossguide', 'min_data_in_leaf': 510, 'max_leaves': 125}. Best is trial 684 with value: 198.81639474308358.[0m
[32m[I 2024-10-13 14:40:50,201][0m Trial 726 finished with value: 212.91613809741358 and parameters: {'depth': 8, 'learning_rate': 0.004293770759995636, 'iterations': 2901, 'l2_leaf_reg': 6.070752404754743, 'border_count': 52, 'bagging_temperature': 0.7535002855534831, 'random_strength': 3.0934402389101403, 'grow_policy': 'Lossguide', 'min_data_in_leaf': 508, 'max_leaves': 162}. Best is trial 684 with value: 198.81639474308358.[0m
[32m[I 2024-10-13 14:40:52,962][0m Trial 727 finished with value: 199.44843876000834 and parameters: {'depth': 8, 'learning_rate': 0.004353773592229962, 'iterations': 2920, 'l2_leaf_reg': 9.946775906183614, 'border_count': 49, 'bagging_temperature': 0.7846600591646495, 'random_strength': 4.578642855186181, 'grow_policy': 'Lossguide', 'min_data_in_leaf': 511, 'max_leaves': 124}. Best is trial 684 with value: 198.81639474308358.[0m
[32m[I 2024-10-13 14:40:55,723][0m Trial 728 finished with value: 214.11309680162316 and parameters: {'depth': 8, 'learning_rate': 0.004570152925330429, 'iterations': 2916, 'l2_leaf_reg': 5.736804122133618, 'border_count': 54, 'bagging_temperature': 0.7811421219099368, 'random_strength': 2.631976656086649, 'grow_policy': 'Lossguide', 'min_data_in_leaf': 514, 'max_leaves': 131}. Best is trial 684 with value: 198.81639474308358.[0m
[32m[I 2024-10-13 14:40:58,425][0m Trial 729 finished with value: 210.7678100333621 and parameters: {'depth': 8, 'learning_rate': 0.0043187637299114115, 'iterations': 2921, 'l2_leaf_reg': 6.108417499451984, 'border_count': 60, 'bagging_temperature': 0.7854400028068957, 'random_strength': 2.8974391103807777, 'grow_policy': 'Lossguide', 'min_data_in_leaf': 516, 'max_leaves': 124}. Best is trial 684 with value: 198.81639474308358.[0m
[32m[I 2024-10-13 14:41:01,098][0m Trial 730 finished with value: 206.70996905211453 and parameters: {'depth': 8, 'learning_rate': 0.004294025638167034, 'iterations': 2929, 'l2_leaf_reg': 6.262112562026789, 'border_count': 50, 'bagging_temperature': 0.759590961793834, 'random_strength': 4.601136532272283, 'grow_policy': 'Lossguide', 'min_data_in_leaf': 470, 'max_leaves': 126}. Best is trial 684 with value: 198.81639474308358.[0m
[32m[I 2024-10-13 14:41:03,846][0m Trial 731 finished with value: 204.79548259874346 and parameters: {'depth': 8, 'learning_rate': 0.0043623659994153335, 'iterations': 2910, 'l2_leaf_reg': 9.96035482581311, 'border_count': 51, 'bagging_temperature': 0.7531852442638517, 'random_strength': 3.55193499452804, 'grow_policy': 'Lossguide', 'min_data_in_leaf': 512, 'max_leaves': 141}. Best is trial 684 with value: 198.81639474308358.[0m
[32m[I 2024-10-13 14:41:06,605][0m Trial 732 finished with value: 215.57118978345247 and parameters: {'depth': 8, 'learning_rate': 0.004214791199916121, 'iterations': 2936, 'l2_leaf_reg': 5.071113349454948, 'border_count': 55, 'bagging_temperature': 0.776393193503174, 'random_strength': 2.2637642502029087, 'grow_policy': 'Lossguide', 'min_data_in_leaf': 473, 'max_leaves': 154}. Best is trial 684 with value: 198.81639474308358.[0m
[32m[I 2024-10-13 14:41:09,340][0m Trial 733 finished with value: 212.98258534021025 and parameters: {'depth': 8, 'learning_rate': 0.004461682115618311, 'iterations': 2931, 'l2_leaf_reg': 4.419211953610229, 'border_count': 47, 'bagging_temperature': 0.7907893635187698, 'random_strength': 4.603997598906467, 'grow_policy': 'Lossguide', 'min_data_in_leaf': 506, 'max_leaves': 137}. Best is trial 684 with value: 198.81639474308358.[0m
[32m[I 2024-10-13 14:41:12,150][0m Trial 734 finished with value: 205.36770268290914 and parameters: {'depth': 7, 'learning_rate': 0.003385116584130704, 'iterations': 3000, 'l2_leaf_reg': 9.911961042950807, 'border_count': 60, 'bagging_temperature': 0.6885209213389556, 'random_strength': 4.08731928952517, 'grow_policy': 'Lossguide', 'min_data_in_leaf': 516, 'max_leaves': 129}. Best is trial 684 with value: 198.81639474308358.[0m
[32m[I 2024-10-13 14:41:14,829][0m Trial 735 finished with value: 204.74845029928832 and parameters: {'depth': 7, 'learning_rate': 0.003941638840871397, 'iterations': 2900, 'l2_leaf_reg': 6.262466429017885, 'border_count': 47, 'bagging_temperature': 0.7143427723624881, 'random_strength': 4.417686638166151, 'grow_policy': 'Lossguide', 'min_data_in_leaf': 483, 'max_leaves': 160}. Best is trial 684 with value: 198.81639474308358.[0m
[32m[I 2024-10-13 14:41:17,511][0m Trial 736 finished with value: 199.55708490769328 and parameters: {'depth': 7, 'learning_rate': 0.0033453940044324277, 'iterations': 2943, 'l2_leaf_reg': 9.852955326364707, 'border_count': 44, 'bagging_temperature': 0.7621969032046572, 'random_strength': 4.626693472901828, 'grow_policy': 'Lossguide', 'min_data_in_leaf': 507, 'max_leaves': 139}. Best is trial 684 with value: 198.81639474308358.[0m
[32m[I 2024-10-13 14:41:20,262][0m Trial 737 finished with value: 201.2615840022103 and parameters: {'depth': 8, 'learning_rate': 0.0033345953352493514, 'iterations': 2892, 'l2_leaf_reg': 6.46436949488654, 'border_count': 47, 'bagging_temperature': 0.7913615960548102, 'random_strength': 4.654458622832497, 'grow_policy': 'Lossguide', 'min_data_in_leaf': 520, 'max_leaves': 141}. Best is trial 684 with value: 198.81639474308358.[0m
[32m[I 2024-10-13 14:41:23,021][0m Trial 738 finished with value: 207.84210685535547 and parameters: {'depth': 7, 'learning_rate': 0.004674829051598285, 'iterations': 2939, 'l2_leaf_reg': 9.894400177442588, 'border_count': 54, 'bagging_temperature': 0.7491726091131193, 'random_strength': 4.473257438084835, 'grow_policy': 'Lossguide', 'min_data_in_leaf': 470, 'max_leaves': 134}. Best is trial 684 with value: 198.81639474308358.[0m
[32m[I 2024-10-13 14:41:25,766][0m Trial 739 finished with value: 208.58361395763797 and parameters: {'depth': 7, 'learning_rate': 0.003344647949329596, 'iterations': 2939, 'l2_leaf_reg': 4.21847055078275, 'border_count': 49, 'bagging_temperature': 0.734269002157692, 'random_strength': 4.0938726809668715, 'grow_policy': 'Lossguide', 'min_data_in_leaf': 505, 'max_leaves': 122}. Best is trial 684 with value: 198.81639474308358.[0m
[32m[I 2024-10-13 14:41:28,474][0m Trial 740 finished with value: 217.97324880938262 and parameters: {'depth': 8, 'learning_rate': 0.0042194856670157415, 'iterations': 2895, 'l2_leaf_reg': 6.229337309905081, 'border_count': 72, 'bagging_temperature': 0.7661853600586545, 'random_strength': 4.657336151968978, 'grow_policy': 'Lossguide', 'min_data_in_leaf': 520, 'max_leaves': 130}. Best is trial 684 with value: 198.81639474308358.[0m
[32m[I 2024-10-13 14:41:49,233][0m Trial 741 finished with value: 297.94122224378043 and parameters: {'depth': 7, 'learning_rate': 0.00347792795354359, 'iterations': 2935, 'l2_leaf_reg': 4.404323234968746, 'border_count': 57, 'bagging_temperature': 0.7929600156757698, 'random_strength': 4.398230141931338, 'grow_policy': 'SymmetricTree', 'min_data_in_leaf': 471}. Best is trial 684 with value: 198.81639474308358.[0m
[32m[I 2024-10-13 14:41:51,964][0m Trial 742 finished with value: 209.2405593275704 and parameters: {'depth': 7, 'learning_rate': 0.0046850248643858375, 'iterations': 2945, 'l2_leaf_reg': 6.6429462148130325, 'border_count': 43, 'bagging_temperature': 0.6694832291102734, 'random_strength': 4.114202090325164, 'grow_policy': 'Lossguide', 'min_data_in_leaf': 500, 'max_leaves': 138}. Best is trial 684 with value: 198.81639474308358.[0m
[32m[I 2024-10-13 14:41:54,796][0m Trial 743 finished with value: 199.43513645339007 and parameters: {'depth': 8, 'learning_rate': 0.003959245439001649, 'iterations': 2996, 'l2_leaf_reg': 9.930279856414268, 'border_count': 45, 'bagging_temperature': 0.7412882036210403, 'random_strength': 4.673400611406493, 'grow_policy': 'Lossguide', 'min_data_in_leaf': 518, 'max_leaves': 128}. Best is trial 684 with value: 198.81639474308358.[0m
[32m[I 2024-10-13 14:41:57,434][0m Trial 744 finished with value: 204.85066240699715 and parameters: {'depth': 8, 'learning_rate': 0.004085519608126065, 'iterations': 2889, 'l2_leaf_reg': 9.892673214676176, 'border_count': 62, 'bagging_temperature': 0.7072338278386222, 'random_strength': 4.689131236762404, 'grow_policy': 'Lossguide', 'min_data_in_leaf': 520, 'max_leaves': 125}. Best is trial 684 with value: 198.81639474308358.[0m
[32m[I 2024-10-13 14:42:00,225][0m Trial 745 finished with value: 211.13639201195508 and parameters: {'depth': 8, 'learning_rate': 0.0033105927995052005, 'iterations': 2900, 'l2_leaf_reg': 4.45508184673254, 'border_count': 68, 'bagging_temperature': 0.7259485914521906, 'random_strength': 3.700203868007252, 'grow_policy': 'Lossguide', 'min_data_in_leaf': 510, 'max_leaves': 151}. Best is trial 684 with value: 198.81639474308358.[0m
[32m[I 2024-10-13 14:42:02,987][0m Trial 746 finished with value: 209.422936466491 and parameters: {'depth': 8, 'learning_rate': 0.004852340113942288, 'iterations': 2996, 'l2_leaf_reg': 6.5553712870204155, 'border_count': 45, 'bagging_temperature': 0.7439989093843815, 'random_strength': 4.530199014835982, 'grow_policy': 'Lossguide', 'min_data_in_leaf': 469, 'max_leaves': 128}. Best is trial 684 with value: 198.81639474308358.[0m
[32m[I 2024-10-13 14:42:05,714][0m Trial 747 finished with value: 199.6454145027365 and parameters: {'depth': 7, 'learning_rate': 0.004049006036669661, 'iterations': 2999, 'l2_leaf_reg': 9.96091030240471, 'border_count': 49, 'bagging_temperature': 0.7547620376641888, 'random_strength': 4.788690356084198, 'grow_policy': 'Lossguide', 'min_data_in_leaf': 523, 'max_leaves': 142}. Best is trial 684 with value: 198.81639474308358.[0m
[32m[I 2024-10-13 14:42:08,380][0m Trial 748 finished with value: 220.47890624221196 and parameters: {'depth': 7, 'learning_rate': 0.004418044047512211, 'iterations': 2886, 'l2_leaf_reg': 3.822147685884016, 'border_count': 53, 'bagging_temperature': 0.7878607727481391, 'random_strength': 4.688621232994393, 'grow_policy': 'Lossguide', 'min_data_in_leaf': 518, 'max_leaves': 142}. Best is trial 684 with value: 198.81639474308358.[0m
[32m[I 2024-10-13 14:42:11,175][0m Trial 749 finished with value: 209.71325083415832 and parameters: {'depth': 7, 'learning_rate': 0.004062657049034703, 'iterations': 2951, 'l2_leaf_reg': 6.2619070729553705, 'border_count': 57, 'bagging_temperature': 0.758052134260819, 'random_strength': 4.768815409908623, 'grow_policy': 'Lossguide', 'min_data_in_leaf': 523, 'max_leaves': 132}. Best is trial 684 with value: 198.81639474308358.[0m
[32m[I 2024-10-13 14:42:13,901][0m Trial 750 finished with value: 209.1416332348787 and parameters: {'depth': 8, 'learning_rate': 0.004805474123008063, 'iterations': 2945, 'l2_leaf_reg': 6.473816803337316, 'border_count': 46, 'bagging_temperature': 0.7186989702633546, 'random_strength': 4.903234002181031, 'grow_policy': 'Lossguide', 'min_data_in_leaf': 500, 'max_leaves': 119}. Best is trial 684 with value: 198.81639474308358.[0m
[32m[I 2024-10-13 14:42:16,669][0m Trial 751 finished with value: 212.08133435662867 and parameters: {'depth': 9, 'learning_rate': 0.004027677997299594, 'iterations': 2886, 'l2_leaf_reg': 3.898687585862323, 'border_count': 50, 'bagging_temperature': 0.7950059248270381, 'random_strength': 4.459920487861158, 'grow_policy': 'Lossguide', 'min_data_in_leaf': 527, 'max_leaves': 139}. Best is trial 684 with value: 198.81639474308358.[0m
[32m[I 2024-10-13 14:42:19,377][0m Trial 752 finished with value: 206.8210714741595 and parameters: {'depth': 8, 'learning_rate': 0.003308215705023912, 'iterations': 2947, 'l2_leaf_reg': 6.508404701783686, 'border_count': 51, 'bagging_temperature': 0.7570526080017825, 'random_strength': 2.8903167577717874, 'grow_policy': 'Lossguide', 'min_data_in_leaf': 501, 'max_leaves': 134}. Best is trial 684 with value: 198.81639474308358.[0m
