[32m[I 2024-10-13 14:20:41,098][0m Trial 302 finished with value: 246.70807909735046 and parameters: {'depth': 4, 'learning_rate': 0.0015310675549247846, 'iterations': 2408, 'l2_leaf_reg': 7.379623005129562e-06, 'border_count': 31, 'bagging_temperature': 0.935865153910615, 'random_strength': 7.121004745328757, 'grow_policy': 'Lossguide', 'min_data_in_leaf': 283, 'max_leaves': 80}. Best is trial 249 with value: 218.928091082675.[0m
[32m[I 2024-10-13 14:20:43,659][0m Trial 303 finished with value: 224.1092599323444 and parameters: {'depth': 4, 'learning_rate': 0.002226812481184923, 'iterations': 2660, 'l2_leaf_reg': 1.5097738867104989e-05, 'border_count': 25, 'bagging_temperature': 0.9807268491915055, 'random_strength': 7.465915371355673, 'grow_policy': 'Depthwise', 'min_data_in_leaf': 256}. Best is trial 249 with value: 218.928091082675.[0m
[32m[I 2024-10-13 14:20:46,270][0m Trial 304 finished with value: 243.24233647835015 and parameters: {'depth': 3, 'learning_rate': 0.0037231696813920107, 'iterations': 2769, 'l2_leaf_reg': 2.3605646051519806e-05, 'border_count': 54, 'bagging_temperature': 0.9642707511680443, 'random_strength': 6.653219474486583, 'grow_policy': 'Lossguide', 'min_data_in_leaf': 221, 'max_leaves': 61}. Best is trial 249 with value: 218.928091082675.[0m
[32m[I 2024-10-13 14:20:48,760][0m Trial 305 finished with value: 223.61813028340754 and parameters: {'depth': 5, 'learning_rate': 0.0028900518145866063, 'iterations': 2593, 'l2_leaf_reg': 9.955098461775929e-06, 'border_count': 40, 'bagging_temperature': 0.5255384416240618, 'random_strength': 0.3725810475801392, 'grow_policy': 'Lossguide', 'min_data_in_leaf': 474, 'max_leaves': 48}. Best is trial 249 with value: 218.928091082675.[0m
[32m[I 2024-10-13 14:20:51,162][0m Trial 306 finished with value: 228.94729998157442 and parameters: {'depth': 4, 'learning_rate': 0.0018598444622104529, 'iterations': 2493, 'l2_leaf_reg': 1.9069655329350143e-06, 'border_count': 33, 'bagging_temperature': 0.9107650567416096, 'random_strength': 7.748791402768778, 'grow_policy': 'Lossguide', 'min_data_in_leaf': 414, 'max_leaves': 68}. Best is trial 249 with value: 218.928091082675.[0m
[32m[I 2024-10-13 14:20:53,715][0m Trial 307 finished with value: 250.35866123742207 and parameters: {'depth': 12, 'learning_rate': 0.002473959093265465, 'iterations': 2693, 'l2_leaf_reg': 9.667712884076677e-05, 'border_count': 18, 'bagging_temperature': 0.9998399920605634, 'random_strength': 4.73263650943818, 'grow_policy': 'Lossguide', 'min_data_in_leaf': 299, 'max_leaves': 53}. Best is trial 249 with value: 218.928091082675.[0m
[32m[I 2024-10-13 14:20:56,166][0m Trial 308 finished with value: 221.53042671894104 and parameters: {'depth': 5, 'learning_rate': 0.003342894516466736, 'iterations': 2621, 'l2_leaf_reg': 0.0005210291032585084, 'border_count': 37, 'bagging_temperature': 0.949771668015521, 'random_strength': 7.303963239218196, 'grow_policy': 'Lossguide', 'min_data_in_leaf': 399, 'max_leaves': 73}. Best is trial 249 with value: 218.928091082675.[0m
[32m[I 2024-10-13 14:20:58,531][0m Trial 309 finished with value: 239.01550366733898 and parameters: {'depth': 4, 'learning_rate': 0.004152657216368466, 'iterations': 2377, 'l2_leaf_reg': 5.85121835858285e-06, 'border_count': 44, 'bagging_temperature': 0.9733463906226563, 'random_strength': 7.076575204816647, 'grow_policy': 'Depthwise', 'min_data_in_leaf': 436}. Best is trial 249 with value: 218.928091082675.[0m
[32m[I 2024-10-13 14:21:00,918][0m Trial 310 finished with value: 220.1470573691118 and parameters: {'depth': 4, 'learning_rate': 0.0027611096227849125, 'iterations': 2532, 'l2_leaf_reg': 1.6854048134277378e-05, 'border_count': 27, 'bagging_temperature': 0.9278478648065592, 'random_strength': 7.531988172033613, 'grow_policy': 'Lossguide', 'min_data_in_leaf': 374, 'max_leaves': 64}. Best is trial 249 with value: 218.928091082675.[0m
[32m[I 2024-10-13 14:21:03,292][0m Trial 311 finished with value: 220.43718743434317 and parameters: {'depth': 3, 'learning_rate': 0.0023043052981579037, 'iterations': 2459, 'l2_leaf_reg': 3.633025320676609e-05, 'border_count': 33, 'bagging_temperature': 0.9821401400728629, 'random_strength': 3.0395887400465442, 'grow_policy': 'Lossguide', 'min_data_in_leaf': 464, 'max_leaves': 81}. Best is trial 249 with value: 218.928091082675.[0m
[32m[I 2024-10-13 14:21:05,702][0m Trial 312 finished with value: 220.23385869219084 and parameters: {'depth': 5, 'learning_rate': 0.0031666397256401376, 'iterations': 2578, 'l2_leaf_reg': 1.103297961376314e-05, 'border_count': 41, 'bagging_temperature': 0.9510155329939957, 'random_strength': 6.891314184387754, 'grow_policy': 'Lossguide', 'min_data_in_leaf': 264, 'max_leaves': 59}. Best is trial 249 with value: 218.928091082675.[0m
[32m[I 2024-10-13 14:21:08,153][0m Trial 313 finished with value: 223.06140295967552 and parameters: {'depth': 4, 'learning_rate': 0.002077771573667361, 'iterations': 2673, 'l2_leaf_reg': 5.309538548684089e-05, 'border_count': 29, 'bagging_temperature': 0.9799548900331249, 'random_strength': 8.058886367506808, 'grow_policy': 'Lossguide', 'min_data_in_leaf': 241, 'max_leaves': 74}. Best is trial 249 with value: 218.928091082675.[0m
[32m[I 2024-10-13 14:21:10,552][0m Trial 314 finished with value: 235.53024268566182 and parameters: {'depth': 5, 'learning_rate': 0.002643471197968774, 'iterations': 2502, 'l2_leaf_reg': 0.0008185154357264901, 'border_count': 48, 'bagging_temperature': 0.9595719162823207, 'random_strength': 7.339242394026588, 'grow_policy': 'Lossguide', 'min_data_in_leaf': 430, 'max_leaves': 213}. Best is trial 249 with value: 218.928091082675.[0m
[32m[I 2024-10-13 14:21:12,737][0m Trial 315 finished with value: 223.0809637595477 and parameters: {'depth': 4, 'learning_rate': 0.0035094832726466356, 'iterations': 2285, 'l2_leaf_reg': 2.534099220850377e-05, 'border_count': 22, 'bagging_temperature': 0.9983053244506374, 'random_strength': 7.656614836935988, 'grow_policy': 'Lossguide', 'min_data_in_leaf': 194, 'max_leaves': 68}. Best is trial 249 with value: 218.928091082675.[0m
[32m[I 2024-10-13 14:21:15,098][0m Trial 316 finished with value: 252.5487325384482 and parameters: {'depth': 4, 'learning_rate': 0.0017821715299589796, 'iterations': 2431, 'l2_leaf_reg': 3.3732930993004206e-06, 'border_count': 153, 'bagging_temperature': 0.9320627104279894, 'random_strength': 7.182963922805406, 'grow_policy': 'Depthwise', 'min_data_in_leaf': 564}. Best is trial 249 with value: 218.928091082675.[0m
[32m[I 2024-10-13 14:21:17,487][0m Trial 317 finished with value: 219.93727533521803 and parameters: {'depth': 5, 'learning_rate': 0.0029447756933150054, 'iterations': 2595, 'l2_leaf_reg': 1.5718118210438533e-05, 'border_count': 36, 'bagging_temperature': 0.9683660633221494, 'random_strength': 7.9198276382336195, 'grow_policy': 'Lossguide', 'min_data_in_leaf': 228, 'max_leaves': 87}. Best is trial 249 with value: 218.928091082675.[0m
[32m[I 2024-10-13 14:21:20,067][0m Trial 318 finished with value: 224.9630621970733 and parameters: {'depth': 4, 'learning_rate': 0.004045640123479688, 'iterations': 2772, 'l2_leaf_reg': 4.797556227708812e-06, 'border_count': 32, 'bagging_temperature': 0.9810254033388213, 'random_strength': 7.475192674542696, 'grow_policy': 'Lossguide', 'min_data_in_leaf': 393, 'max_leaves': 78}. Best is trial 249 with value: 218.928091082675.[0m
[32m[I 2024-10-13 14:21:22,444][0m Trial 319 finished with value: 220.67403482965085 and parameters: {'depth': 3, 'learning_rate': 0.0024050622861793865, 'iterations': 2551, 'l2_leaf_reg': 9.935488487317926e-06, 'border_count': 40, 'bagging_temperature': 0.9421597793779606, 'random_strength': 5.782551820432835, 'grow_policy': 'Lossguide', 'min_data_in_leaf': 458, 'max_leaves': 57}. Best is trial 249 with value: 218.928091082675.[0m
[32m[I 2024-10-13 14:21:31,728][0m Trial 320 finished with value: 278.70566507543214 and parameters: {'depth': 4, 'learning_rate': 0.0020846502524454287, 'iterations': 2636, 'l2_leaf_reg': 0.00018580164763699758, 'border_count': 27, 'bagging_temperature': 0.9996275688958072, 'random_strength': 7.710583263878074, 'grow_policy': 'SymmetricTree', 'min_data_in_leaf': 249}. Best is trial 249 with value: 218.928091082675.[0m
[32m[I 2024-10-13 14:21:34,288][0m Trial 321 finished with value: 221.91667234994736 and parameters: {'depth': 5, 'learning_rate': 0.003159134169924436, 'iterations': 2727, 'l2_leaf_reg': 2.086699872940223e-05, 'border_count': 37, 'bagging_temperature': 0.9096444140245722, 'random_strength': 7.307323758409834, 'grow_policy': 'Lossguide', 'min_data_in_leaf': 357, 'max_leaves': 65}. Best is trial 249 with value: 218.928091082675.[0m
[32m[I 2024-10-13 14:21:36,571][0m Trial 322 finished with value: 226.4178391149033 and parameters: {'depth': 4, 'learning_rate': 0.002632947742135134, 'iterations': 2381, 'l2_leaf_reg': 7.436993822214287e-06, 'border_count': 31, 'bagging_temperature': 0.389192505634655, 'random_strength': 7.08222315930074, 'grow_policy': 'Lossguide', 'min_data_in_leaf': 500, 'max_leaves': 71}. Best is trial 249 with value: 218.928091082675.[0m
[32m[I 2024-10-13 14:21:38,989][0m Trial 323 finished with value: 238.59192388862414 and parameters: {'depth': 4, 'learning_rate': 0.00362380987559342, 'iterations': 2499, 'l2_leaf_reg': 2.480499046466145e-06, 'border_count': 46, 'bagging_temperature': 0.9625792106237757, 'random_strength': 6.881722839879357, 'grow_policy': 'Depthwise', 'min_data_in_leaf': 414}. Best is trial 249 with value: 218.928091082675.[0m
[32m[I 2024-10-13 14:21:41,483][0m Trial 324 finished with value: 227.1310890549369 and parameters: {'depth': 5, 'learning_rate': 0.00232365385543661, 'iterations': 2566, 'l2_leaf_reg': 6.742386380116678e-05, 'border_count': 23, 'bagging_temperature': 0.981747275302739, 'random_strength': 6.466724267796398, 'grow_policy': 'Lossguide', 'min_data_in_leaf': 278, 'max_leaves': 83}. Best is trial 249 with value: 218.928091082675.[0m
[32m[I 2024-10-13 14:21:43,786][0m Trial 325 finished with value: 237.70820629804734 and parameters: {'depth': 3, 'learning_rate': 0.002927489504086039, 'iterations': 2445, 'l2_leaf_reg': 3.230625541521241e-05, 'border_count': 52, 'bagging_temperature': 0.9472908058208585, 'random_strength': 7.543276850763294, 'grow_policy': 'Lossguide', 'min_data_in_leaf': 443, 'max_leaves': 54}. Best is trial 249 with value: 218.928091082675.[0m
[32m[I 2024-10-13 14:21:46,270][0m Trial 326 finished with value: 240.42350295767525 and parameters: {'depth': 4, 'learning_rate': 0.004195352945723932, 'iterations': 2641, 'l2_leaf_reg': 0.002057577056466664, 'border_count': 43, 'bagging_temperature': 0.9614267976051966, 'random_strength': 7.359572411273468, 'grow_policy': 'Lossguide', 'min_data_in_leaf': 481, 'max_leaves': 62}. Best is trial 249 with value: 218.928091082675.[0m
[32m[I 2024-10-13 14:21:48,508][0m Trial 327 finished with value: 251.90225474368552 and parameters: {'depth': 13, 'learning_rate': 0.0018764899481427363, 'iterations': 2344, 'l2_leaf_reg': 1.2853109884971274e-05, 'border_count': 118, 'bagging_temperature': 0.981704509093405, 'random_strength': 7.767773184990008, 'grow_policy': 'Lossguide', 'min_data_in_leaf': 428, 'max_leaves': 76}. Best is trial 249 with value: 218.928091082675.[0m
[32m[I 2024-10-13 14:21:51,180][0m Trial 328 finished with value: 250.45087479998114 and parameters: {'depth': 4, 'learning_rate': 0.0024792378477922197, 'iterations': 2840, 'l2_leaf_reg': 7.175939134881844e-06, 'border_count': 15, 'bagging_temperature': 0.9272266823623099, 'random_strength': 7.14733284509431, 'grow_policy': 'Lossguide', 'min_data_in_leaf': 212, 'max_leaves': 69}. Best is trial 249 with value: 218.928091082675.[0m
[32m[I 2024-10-13 14:21:53,554][0m Trial 329 finished with value: 220.13115008690568 and parameters: {'depth': 5, 'learning_rate': 0.003097111560532632, 'iterations': 2511, 'l2_leaf_reg': 1.343087712343903e-06, 'border_count': 34, 'bagging_temperature': 0.9628911278785274, 'random_strength': 7.991864677050271, 'grow_policy': 'Lossguide', 'min_data_in_leaf': 389, 'max_leaves': 87}. Best is trial 249 with value: 218.928091082675.[0m
[32m[I 2024-10-13 14:21:55,786][0m Trial 330 finished with value: 515.1759033801144 and parameters: {'depth': 4, 'learning_rate': 0.00046338395782002093, 'iterations': 2239, 'l2_leaf_reg': 2.1254329487279874e-05, 'border_count': 39, 'bagging_temperature': 0.9994405931539153, 'random_strength': 7.5127137787055736, 'grow_policy': 'Depthwise', 'min_data_in_leaf': 303}. Best is trial 249 with value: 218.928091082675.[0m
[32m[I 2024-10-13 14:21:58,274][0m Trial 331 finished with value: 222.8835560155932 and parameters: {'depth': 15, 'learning_rate': 0.0034715936785664186, 'iterations': 2712, 'l2_leaf_reg': 1.3306301660394075e-05, 'border_count': 28, 'bagging_temperature': 0.9445608116140636, 'random_strength': 6.812929428557828, 'grow_policy': 'Lossguide', 'min_data_in_leaf': 251, 'max_leaves': 46}. Best is trial 249 with value: 218.928091082675.[0m
[32m[I 2024-10-13 14:22:00,774][0m Trial 332 finished with value: 222.53221151785954 and parameters: {'depth': 3, 'learning_rate': 0.0020803628587802298, 'iterations': 2613, 'l2_leaf_reg': 4.8965509983603134e-05, 'border_count': 36, 'bagging_temperature': 0.9801676128664545, 'random_strength': 7.04401560023914, 'grow_policy': 'Lossguide', 'min_data_in_leaf': 453, 'max_leaves': 62}. Best is trial 249 with value: 218.928091082675.[0m
[32m[I 2024-10-13 14:22:03,049][0m Trial 333 finished with value: 251.70785441166976 and parameters: {'depth': 11, 'learning_rate': 0.002613113043894706, 'iterations': 2446, 'l2_leaf_reg': 5.105008522885854e-06, 'border_count': 21, 'bagging_temperature': 0.9630500718358679, 'random_strength': 7.305732340909443, 'grow_policy': 'Lossguide', 'min_data_in_leaf': 410, 'max_leaves': 81}. Best is trial 249 with value: 218.928091082675.[0m
[32m[I 2024-10-13 14:22:05,460][0m Trial 334 finished with value: 245.65565315281944 and parameters: {'depth': 4, 'learning_rate': 0.0014592261699098799, 'iterations': 2561, 'l2_leaf_reg': 3.245071566642464e-05, 'border_count': 31, 'bagging_temperature': 0.9814325521526639, 'random_strength': 7.7157249389190685, 'grow_policy': 'Lossguide', 'min_data_in_leaf': 234, 'max_leaves': 73}. Best is trial 249 with value: 218.928091082675.[0m
[32m[I 2024-10-13 14:22:07,904][0m Trial 335 finished with value: 236.41825367402222 and parameters: {'depth': 4, 'learning_rate': 0.0027421239068433573, 'iterations': 2657, 'l2_leaf_reg': 0.0001073935957564124, 'border_count': 44, 'bagging_temperature': 0.919103920638035, 'random_strength': 7.5402100112576695, 'grow_policy': 'Lossguide', 'min_data_in_leaf': 181, 'max_leaves': 50}. Best is trial 249 with value: 218.928091082675.[0m
[32m[I 2024-10-13 14:22:10,345][0m Trial 336 finished with value: 224.46500271557457 and parameters: {'depth': 5, 'learning_rate': 0.0021664870007516383, 'iterations': 2504, 'l2_leaf_reg': 2.0283175633233504e-05, 'border_count': 26, 'bagging_temperature': 0.9416220053240975, 'random_strength': 7.179496866549068, 'grow_policy': 'Depthwise', 'min_data_in_leaf': 523}. Best is trial 249 with value: 218.928091082675.[0m
[32m[I 2024-10-13 14:22:12,637][0m Trial 337 finished with value: 222.51093359334746 and parameters: {'depth': 5, 'learning_rate': 0.004182267326984124, 'iterations': 2403, 'l2_leaf_reg': 9.732269489960298e-06, 'border_count': 37, 'bagging_temperature': 0.9982507181550782, 'random_strength': 6.662252320700389, 'grow_policy': 'Lossguide', 'min_data_in_leaf': 467, 'max_leaves': 66}. Best is trial 249 with value: 218.928091082675.[0m
[32m[I 2024-10-13 14:22:15,123][0m Trial 338 finished with value: 220.74594426484464 and parameters: {'depth': 4, 'learning_rate': 0.0033045062149167762, 'iterations': 2606, 'l2_leaf_reg': 2.2944525280675263e-06, 'border_count': 41, 'bagging_temperature': 0.9640654368011687, 'random_strength': 7.903684739823928, 'grow_policy': 'Lossguide', 'min_data_in_leaf': 268, 'max_leaves': 58}. Best is trial 249 with value: 218.928091082675.[0m
[32m[I 2024-10-13 14:22:17,765][0m Trial 339 finished with value: 241.11007882008707 and parameters: {'depth': 3, 'learning_rate': 0.0016862059156888163, 'iterations': 2693, 'l2_leaf_reg': 3.6744766931736907e-06, 'border_count': 50, 'bagging_temperature': 0.9822783444589942, 'random_strength': 8.210859928292574, 'grow_policy': 'Lossguide', 'min_data_in_leaf': 333, 'max_leaves': 78}. Best is trial 249 with value: 218.928091082675.[0m
[32m[I 2024-10-13 14:22:20,183][0m Trial 340 finished with value: 219.0083853237688 and parameters: {'depth': 4, 'learning_rate': 0.0029260742110851583, 'iterations': 2543, 'l2_leaf_reg': 1.439498770288069e-05, 'border_count': 33, 'bagging_temperature': 0.9477995507626443, 'random_strength': 7.332342334990728, 'grow_policy': 'Lossguide', 'min_data_in_leaf': 431, 'max_leaves': 84}. Best is trial 249 with value: 218.928091082675.[0m
[32m[I 2024-10-13 14:22:22,549][0m Trial 341 finished with value: 221.08950113152187 and parameters: {'depth': 4, 'learning_rate': 0.0023468938987873914, 'iterations': 2463, 'l2_leaf_reg': 1.6165333363410615e-05, 'border_count': 30, 'bagging_temperature': 0.9219150355251496, 'random_strength': 6.9519010917776916, 'grow_policy': 'Lossguide', 'min_data_in_leaf': 437, 'max_leaves': 89}. Best is trial 249 with value: 218.928091082675.[0m
[32m[I 2024-10-13 14:22:24,972][0m Trial 342 finished with value: 227.57310436289097 and parameters: {'depth': 4, 'learning_rate': 0.0033649666498811815, 'iterations': 2532, 'l2_leaf_reg': 2.8629233739059554e-05, 'border_count': 24, 'bagging_temperature': 0.9428901636038839, 'random_strength': 7.307108148226822, 'grow_policy': 'Lossguide', 'min_data_in_leaf': 403, 'max_leaves': 84}. Best is trial 249 with value: 218.928091082675.[0m
[32m[I 2024-10-13 14:22:27,235][0m Trial 343 finished with value: 219.46045310534834 and parameters: {'depth': 4, 'learning_rate': 0.002786055655821983, 'iterations': 2360, 'l2_leaf_reg': 1.1991137282188554e-05, 'border_count': 33, 'bagging_temperature': 0.8981912310680291, 'random_strength': 7.169622554756846, 'grow_policy': 'Lossguide', 'min_data_in_leaf': 371, 'max_leaves': 70}. Best is trial 249 with value: 218.928091082675.[0m
[32m[I 2024-10-13 14:22:34,820][0m Trial 344 finished with value: 308.9268843890786 and parameters: {'depth': 3, 'learning_rate': 0.003987902390877024, 'iterations': 2336, 'l2_leaf_reg': 3.919168819894117e-05, 'border_count': 16, 'bagging_temperature': 0.9089782923918943, 'random_strength': 7.007734195743307, 'grow_policy': 'SymmetricTree', 'min_data_in_leaf': 373}. Best is trial 249 with value: 218.928091082675.[0m
[32m[I 2024-10-13 14:22:37,071][0m Trial 345 finished with value: 220.83593225071127 and parameters: {'depth': 4, 'learning_rate': 0.0029558360434197347, 'iterations': 2362, 'l2_leaf_reg': 1.8914179560279072e-05, 'border_count': 29, 'bagging_temperature': 0.904510449281339, 'random_strength': 7.148794322612305, 'grow_policy': 'Depthwise', 'min_data_in_leaf': 358}. Best is trial 249 with value: 218.928091082675.[0m
[32m[I 2024-10-13 14:22:39,288][0m Trial 346 finished with value: 250.65681540798795 and parameters: {'depth': 4, 'learning_rate': 0.0019959265141766876, 'iterations': 2295, 'l2_leaf_reg': 8.840473882675271e-06, 'border_count': 99, 'bagging_temperature': 0.8962764746208848, 'random_strength': 7.3804086377822795, 'grow_policy': 'Lossguide', 'min_data_in_leaf': 387, 'max_leaves': 64}. Best is trial 249 with value: 218.928091082675.[0m
[32m[I 2024-10-13 14:22:41,540][0m Trial 347 finished with value: 220.60528859496003 and parameters: {'depth': 4, 'learning_rate': 0.003471507512157933, 'iterations': 2415, 'l2_leaf_reg': 1.2610771532220137e-05, 'border_count': 34, 'bagging_temperature': 0.9385389583859279, 'random_strength': 6.841228687846305, 'grow_policy': 'Lossguide', 'min_data_in_leaf': 412, 'max_leaves': 54}. Best is trial 249 with value: 218.928091082675.[0m
[32m[I 2024-10-13 14:22:43,639][0m Trial 348 finished with value: 258.5722081745264 and parameters: {'depth': 4, 'learning_rate': 0.002376955887570868, 'iterations': 2182, 'l2_leaf_reg': 5.677214781572174e-05, 'border_count': 20, 'bagging_temperature': 0.9248795579578306, 'random_strength': 7.584868070242749, 'grow_policy': 'Lossguide', 'min_data_in_leaf': 371, 'max_leaves': 90}. Best is trial 249 with value: 218.928091082675.[0m
[32m[I 2024-10-13 14:22:45,975][0m Trial 349 finished with value: 220.27829176685563 and parameters: {'depth': 3, 'learning_rate': 0.002784220392632141, 'iterations': 2470, 'l2_leaf_reg': 6.546990028747232e-06, 'border_count': 26, 'bagging_temperature': 0.9526834810484266, 'random_strength': 7.1708402732624466, 'grow_policy': 'Lossguide', 'min_data_in_leaf': 322, 'max_leaves': 58}. Best is trial 249 with value: 218.928091082675.[0m
[32m[I 2024-10-13 14:22:48,267][0m Trial 350 finished with value: 221.13146851577002 and parameters: {'depth': 4, 'learning_rate': 0.00378293350245349, 'iterations': 2351, 'l2_leaf_reg': 2.3115894507451706e-05, 'border_count': 32, 'bagging_temperature': 0.9702763806770172, 'random_strength': 6.721112009076333, 'grow_policy': 'Lossguide', 'min_data_in_leaf': 429, 'max_leaves': 69}. Best is trial 249 with value: 218.928091082675.[0m
[32m[I 2024-10-13 14:22:50,626][0m Trial 351 finished with value: 219.46398836583836 and parameters: {'depth': 4, 'learning_rate': 0.0030650227591351893, 'iterations': 2417, 'l2_leaf_reg': 2.9574211020673014e-05, 'border_count': 33, 'bagging_temperature': 0.9364465112892453, 'random_strength': 7.458384791957624, 'grow_policy': 'Depthwise', 'min_data_in_leaf': 543}. Best is trial 249 with value: 218.928091082675.[0m
