[32m[I 2024-10-13 14:08:21,869][0m Trial 101 finished with value: 236.50447563226814 and parameters: {'depth': 10, 'learning_rate': 0.004233193243348418, 'iterations': 1633, 'l2_leaf_reg': 0.00039325534318294654, 'border_count': 42, 'bagging_temperature': 0.9458085269219474, 'random_strength': 7.1829292419529365, 'grow_policy': 'Lossguide', 'min_data_in_leaf': 831, 'max_leaves': 54}. Best is trial 99 with value: 219.56324459923857.[0m
[32m[I 2024-10-13 14:08:24,689][0m Trial 102 finished with value: 258.26356184985696 and parameters: {'depth': 10, 'learning_rate': 0.0036178328838539467, 'iterations': 1555, 'l2_leaf_reg': 0.001350842845994223, 'border_count': 15, 'bagging_temperature': 0.9182110498241924, 'random_strength': 8.159612213516622, 'grow_policy': 'Lossguide', 'min_data_in_leaf': 807, 'max_leaves': 74}. Best is trial 99 with value: 219.56324459923857.[0m
[32m[I 2024-10-13 14:08:27,554][0m Trial 103 finished with value: 237.937994048764 and parameters: {'depth': 11, 'learning_rate': 0.007673099975776811, 'iterations': 1256, 'l2_leaf_reg': 0.00027519145121182614, 'border_count': 58, 'bagging_temperature': 0.9979057175117214, 'random_strength': 6.228548354661912, 'grow_policy': 'Lossguide', 'min_data_in_leaf': 908, 'max_leaves': 62}. Best is trial 99 with value: 219.56324459923857.[0m
[32m[I 2024-10-13 14:08:30,319][0m Trial 104 finished with value: 224.95654424651568 and parameters: {'depth': 10, 'learning_rate': 0.006828753714670185, 'iterations': 1430, 'l2_leaf_reg': 0.00012555053992021695, 'border_count': 38, 'bagging_temperature': 0.8631129179936085, 'random_strength': 6.743525251556557, 'grow_policy': 'Lossguide', 'min_data_in_leaf': 863, 'max_leaves': 42}. Best is trial 99 with value: 219.56324459923857.[0m
[32m[I 2024-10-13 14:08:35,814][0m Trial 105 finished with value: 225.2664070832609 and parameters: {'depth': 8, 'learning_rate': 0.006860942124958378, 'iterations': 1440, 'l2_leaf_reg': 1.3935148349819492e-05, 'border_count': 34, 'bagging_temperature': 0.8557158091042301, 'random_strength': 6.733076123934482, 'grow_policy': 'Lossguide', 'min_data_in_leaf': 868, 'max_leaves': 40}. Best is trial 99 with value: 219.56324459923857.[0m
[32m[I 2024-10-13 14:08:38,542][0m Trial 106 finished with value: 250.5512332751392 and parameters: {'depth': 9, 'learning_rate': 0.0093363673802655, 'iterations': 1775, 'l2_leaf_reg': 3.2862477308913834e-05, 'border_count': 21, 'bagging_temperature': 0.8236400656696893, 'random_strength': 7.620695500400531, 'grow_policy': 'Lossguide', 'min_data_in_leaf': 934, 'max_leaves': 41}. Best is trial 99 with value: 219.56324459923857.[0m
[32m[I 2024-10-13 14:08:40,509][0m Trial 107 finished with value: 237.2507665915748 and parameters: {'depth': 8, 'learning_rate': 0.005239828171814472, 'iterations': 1088, 'l2_leaf_reg': 0.00012594157344144075, 'border_count': 48, 'bagging_temperature': 0.8806291847966228, 'random_strength': 9.369284516393618, 'grow_policy': 'Lossguide', 'min_data_in_leaf': 845, 'max_leaves': 130}. Best is trial 99 with value: 219.56324459923857.[0m
[32m[I 2024-10-13 14:08:43,185][0m Trial 108 finished with value: 294.464737750513 and parameters: {'depth': 10, 'learning_rate': 0.0058074974882940476, 'iterations': 1352, 'l2_leaf_reg': 0.008318506956062198, 'border_count': 9, 'bagging_temperature': 0.8586419463815065, 'random_strength': 7.879885924049375, 'grow_policy': 'Lossguide', 'min_data_in_leaf': 513, 'max_leaves': 151}. Best is trial 99 with value: 219.56324459923857.[0m
[32m[I 2024-10-13 14:08:45,205][0m Trial 109 finished with value: 230.8038472895035 and parameters: {'depth': 9, 'learning_rate': 0.013033620433569138, 'iterations': 1157, 'l2_leaf_reg': 0.0006326700682859703, 'border_count': 32, 'bagging_temperature': 0.9281707002559629, 'random_strength': 9.75306361205578, 'grow_policy': 'Lossguide', 'min_data_in_leaf': 887, 'max_leaves': 52}. Best is trial 99 with value: 219.56324459923857.[0m
[32m[I 2024-10-13 14:08:48,291][0m Trial 110 finished with value: 221.67136418164506 and parameters: {'depth': 7, 'learning_rate': 0.004608537378981621, 'iterations': 1625, 'l2_leaf_reg': 0.00017164602916507302, 'border_count': 26, 'bagging_temperature': 0.894045693811595, 'random_strength': 8.867130831079672, 'grow_policy': 'Lossguide', 'min_data_in_leaf': 786, 'max_leaves': 100}. Best is trial 99 with value: 219.56324459923857.[0m
[32m[I 2024-10-13 14:08:53,814][0m Trial 111 finished with value: 220.94995117387953 and parameters: {'depth': 7, 'learning_rate': 0.004657629107459138, 'iterations': 1642, 'l2_leaf_reg': 0.00020266859028381584, 'border_count': 28, 'bagging_temperature': 0.8851440056016097, 'random_strength': 8.84383889928986, 'grow_policy': 'Lossguide', 'min_data_in_leaf': 783, 'max_leaves': 105}. Best is trial 99 with value: 219.56324459923857.[0m
[32m[I 2024-10-13 14:08:56,412][0m Trial 112 finished with value: 221.11997518450522 and parameters: {'depth': 7, 'learning_rate': 0.0046265098361833006, 'iterations': 1617, 'l2_leaf_reg': 6.498056703193369e-06, 'border_count': 27, 'bagging_temperature': 0.8963103385431709, 'random_strength': 9.235576205763165, 'grow_policy': 'Lossguide', 'min_data_in_leaf': 754, 'max_leaves': 101}. Best is trial 99 with value: 219.56324459923857.[0m
[32m[I 2024-10-13 14:09:02,330][0m Trial 113 finished with value: 223.00308080978795 and parameters: {'depth': 7, 'learning_rate': 0.004612088586183643, 'iterations': 1976, 'l2_leaf_reg': 1.5151554040376306e-06, 'border_count': 26, 'bagging_temperature': 0.8966294247856144, 'random_strength': 8.87491299402725, 'grow_policy': 'Lossguide', 'min_data_in_leaf': 752, 'max_leaves': 98}. Best is trial 99 with value: 219.56324459923857.[0m
[32m[I 2024-10-13 14:09:05,716][0m Trial 114 finished with value: 220.9083680357429 and parameters: {'depth': 7, 'learning_rate': 0.003296603750819715, 'iterations': 2011, 'l2_leaf_reg': 1.1166352276030364e-06, 'border_count': 26, 'bagging_temperature': 0.9761326233280652, 'random_strength': 8.787019917076526, 'grow_policy': 'Lossguide', 'min_data_in_leaf': 754, 'max_leaves': 100}. Best is trial 99 with value: 219.56324459923857.[0m
[32m[I 2024-10-13 14:09:13,208][0m Trial 115 finished with value: 251.23981265842022 and parameters: {'depth': 6, 'learning_rate': 0.003089401772838691, 'iterations': 2195, 'l2_leaf_reg': 6.512400347208948e-06, 'border_count': 20, 'bagging_temperature': 0.9789774176768844, 'random_strength': 9.320807775528396, 'grow_policy': 'Lossguide', 'min_data_in_leaf': 685, 'max_leaves': 103}. Best is trial 99 with value: 219.56324459923857.[0m
[32m[I 2024-10-13 14:09:18,922][0m Trial 116 finished with value: 265.6917708588167 and parameters: {'depth': 7, 'learning_rate': 0.0025063352471295227, 'iterations': 1810, 'l2_leaf_reg': 7.718224002575108e-07, 'border_count': 13, 'bagging_temperature': 0.9213957351543863, 'random_strength': 8.755889941452608, 'grow_policy': 'Lossguide', 'min_data_in_leaf': 770, 'max_leaves': 85}. Best is trial 99 with value: 219.56324459923857.[0m
[32m[I 2024-10-13 14:09:42,941][0m Trial 117 finished with value: 315.7366533255222 and parameters: {'depth': 7, 'learning_rate': 0.002133267015285747, 'iterations': 1729, 'l2_leaf_reg': 3.4013481171306145e-07, 'border_count': 26, 'bagging_temperature': 0.9532790744411008, 'random_strength': 9.152456674445702, 'grow_policy': 'SymmetricTree', 'min_data_in_leaf': 717}. Best is trial 99 with value: 219.56324459923857.[0m
[32m[I 2024-10-13 14:09:45,477][0m Trial 118 finished with value: 308.171272889138 and parameters: {'depth': 7, 'learning_rate': 0.003457964191115687, 'iterations': 1590, 'l2_leaf_reg': 2.626235610990391e-06, 'border_count': 6, 'bagging_temperature': 0.96765849738891, 'random_strength': 4.453953281185805, 'grow_policy': 'Lossguide', 'min_data_in_leaf': 789, 'max_leaves': 120}. Best is trial 99 with value: 219.56324459923857.[0m
[32m[I 2024-10-13 14:09:52,783][0m Trial 119 finished with value: 246.59449863101878 and parameters: {'depth': 6, 'learning_rate': 0.003878396949573507, 'iterations': 2894, 'l2_leaf_reg': 6.229546555157983e-05, 'border_count': 18, 'bagging_temperature': 0.8845733739168655, 'random_strength': 9.553344663596004, 'grow_policy': 'Lossguide', 'min_data_in_leaf': 674, 'max_leaves': 95}. Best is trial 99 with value: 219.56324459923857.[0m
[32m[I 2024-10-13 14:09:55,241][0m Trial 120 finished with value: 220.592099489007 and parameters: {'depth': 7, 'learning_rate': 0.004443827479371781, 'iterations': 1660, 'l2_leaf_reg': 1.154136418923184e-06, 'border_count': 27, 'bagging_temperature': 0.9186968713714944, 'random_strength': 8.440972048984207, 'grow_policy': 'Lossguide', 'min_data_in_leaf': 725, 'max_leaves': 166}. Best is trial 99 with value: 219.56324459923857.[0m
[32m[I 2024-10-13 14:10:00,285][0m Trial 121 finished with value: 220.74986486885183 and parameters: {'depth': 7, 'learning_rate': 0.004725576536318501, 'iterations': 1662, 'l2_leaf_reg': 3.6930161639710264e-07, 'border_count': 31, 'bagging_temperature': 0.9325051519283596, 'random_strength': 8.484360472412076, 'grow_policy': 'Lossguide', 'min_data_in_leaf': 727, 'max_leaves': 164}. Best is trial 99 with value: 219.56324459923857.[0m
[32m[I 2024-10-13 14:10:05,261][0m Trial 122 finished with value: 223.56718656186317 and parameters: {'depth': 7, 'learning_rate': 0.004785389330494491, 'iterations': 1928, 'l2_leaf_reg': 9.699327732467667e-08, 'border_count': 29, 'bagging_temperature': 0.9334695717701427, 'random_strength': 8.505463432294297, 'grow_policy': 'Lossguide', 'min_data_in_leaf': 604, 'max_leaves': 165}. Best is trial 99 with value: 219.56324459923857.[0m
[32m[I 2024-10-13 14:10:08,246][0m Trial 123 finished with value: 315.2680158909074 and parameters: {'depth': 6, 'learning_rate': 0.0014976623617225402, 'iterations': 1629, 'l2_leaf_reg': 5.107347737355585e-07, 'border_count': 22, 'bagging_temperature': 0.9153278833061189, 'random_strength': 9.052312003030568, 'grow_policy': 'Lossguide', 'min_data_in_leaf': 729, 'max_leaves': 108}. Best is trial 99 with value: 219.56324459923857.[0m
[32m[I 2024-10-13 14:10:13,193][0m Trial 124 finished with value: 553.9890739618188 and parameters: {'depth': 7, 'learning_rate': 0.003353019521310223, 'iterations': 1659, 'l2_leaf_reg': 1.231613088162177e-06, 'border_count': 1, 'bagging_temperature': 0.98360312616706, 'random_strength': 9.868210360469217, 'grow_policy': 'Lossguide', 'min_data_in_leaf': 657, 'max_leaves': 169}. Best is trial 99 with value: 219.56324459923857.[0m
[32m[I 2024-10-13 14:10:16,872][0m Trial 125 finished with value: 311.91706601927666 and parameters: {'depth': 7, 'learning_rate': 0.0025562527966772794, 'iterations': 2003, 'l2_leaf_reg': 3.4573664431613188e-06, 'border_count': 11, 'bagging_temperature': 0.960199618151742, 'random_strength': 8.682619921038212, 'grow_policy': 'Lossguide', 'min_data_in_leaf': 761, 'max_leaves': 176}. Best is trial 99 with value: 219.56324459923857.[0m
[32m[I 2024-10-13 14:10:22,490][0m Trial 126 finished with value: 220.82897604138373 and parameters: {'depth': 6, 'learning_rate': 0.00454438385187526, 'iterations': 1496, 'l2_leaf_reg': 2.012641557249046e-07, 'border_count': 29, 'bagging_temperature': 0.9114058746851219, 'random_strength': 8.897532756545578, 'grow_policy': 'Lossguide', 'min_data_in_leaf': 626, 'max_leaves': 90}. Best is trial 99 with value: 219.56324459923857.[0m
[32m[I 2024-10-13 14:10:25,073][0m Trial 127 finished with value: 221.63237550190647 and parameters: {'depth': 5, 'learning_rate': 0.004366123845925251, 'iterations': 1895, 'l2_leaf_reg': 1.4459989317341313e-07, 'border_count': 28, 'bagging_temperature': 0.942116540432781, 'random_strength': 8.950038550936329, 'grow_policy': 'Lossguide', 'min_data_in_leaf': 629, 'max_leaves': 100}. Best is trial 99 with value: 219.56324459923857.[0m
[32m[I 2024-10-13 14:10:30,226][0m Trial 128 finished with value: 221.61177481658297 and parameters: {'depth': 4, 'learning_rate': 0.00459586496229771, 'iterations': 1857, 'l2_leaf_reg': 1.937710620737637e-07, 'border_count': 27, 'bagging_temperature': 0.941825635008157, 'random_strength': 8.823237457584558, 'grow_policy': 'Lossguide', 'min_data_in_leaf': 638, 'max_leaves': 94}. Best is trial 99 with value: 219.56324459923857.[0m
[32m[I 2024-10-13 14:10:35,621][0m Trial 129 finished with value: 257.07635615836557 and parameters: {'depth': 4, 'learning_rate': 0.0029794976317169737, 'iterations': 1843, 'l2_leaf_reg': 1.959655440752161e-07, 'border_count': 17, 'bagging_temperature': 0.9453481223993793, 'random_strength': 8.891892350571105, 'grow_policy': 'Lossguide', 'min_data_in_leaf': 580, 'max_leaves': 90}. Best is trial 99 with value: 219.56324459923857.[0m
[32m[I 2024-10-13 14:10:38,489][0m Trial 130 finished with value: 224.65336806524726 and parameters: {'depth': 5, 'learning_rate': 0.003680696991645105, 'iterations': 2035, 'l2_leaf_reg': 2.8766227977870997e-08, 'border_count': 25, 'bagging_temperature': 0.8803540522088787, 'random_strength': 8.587742547297204, 'grow_policy': 'Lossguide', 'min_data_in_leaf': 607, 'max_leaves': 102}. Best is trial 99 with value: 219.56324459923857.[0m
[32m[I 2024-10-13 14:10:43,403][0m Trial 131 finished with value: 223.5696204554285 and parameters: {'depth': 5, 'learning_rate': 0.004754610869643026, 'iterations': 2109, 'l2_leaf_reg': 1.487376979265415e-07, 'border_count': 32, 'bagging_temperature': 0.9166693242130151, 'random_strength': 8.852279085920152, 'grow_policy': 'Lossguide', 'min_data_in_leaf': 633, 'max_leaves': 80}. Best is trial 99 with value: 219.56324459923857.[0m
[32m[I 2024-10-13 14:10:48,849][0m Trial 132 finished with value: 223.94199771541477 and parameters: {'depth': 4, 'learning_rate': 0.005651264677769483, 'iterations': 1846, 'l2_leaf_reg': 2.937415520765357e-07, 'border_count': 29, 'bagging_temperature': 0.9828803488648397, 'random_strength': 8.192142731423472, 'grow_policy': 'Lossguide', 'min_data_in_leaf': 697, 'max_leaves': 97}. Best is trial 99 with value: 219.56324459923857.[0m
[32m[I 2024-10-13 14:10:51,462][0m Trial 133 finished with value: 237.50478316699883 and parameters: {'depth': 4, 'learning_rate': 0.004626490010867576, 'iterations': 1724, 'l2_leaf_reg': 4.363755536973959e-08, 'border_count': 45, 'bagging_temperature': 0.9446268140525816, 'random_strength': 8.38897472154414, 'grow_policy': 'Lossguide', 'min_data_in_leaf': 715, 'max_leaves': 115}. Best is trial 99 with value: 219.56324459923857.[0m
[32m[I 2024-10-13 14:10:56,219][0m Trial 134 finished with value: 258.31763498623775 and parameters: {'depth': 6, 'learning_rate': 0.0028856672166804372, 'iterations': 1876, 'l2_leaf_reg': 1.1374269256970343e-06, 'border_count': 21, 'bagging_temperature': 0.9979601555462916, 'random_strength': 9.238260661752753, 'grow_policy': 'Lossguide', 'min_data_in_leaf': 637, 'max_leaves': 107}. Best is trial 99 with value: 219.56324459923857.[0m
[32m[I 2024-10-13 14:11:00,215][0m Trial 135 finished with value: 253.75288110138433 and parameters: {'depth': 5, 'learning_rate': 0.003805624459500505, 'iterations': 1802, 'l2_leaf_reg': 5.331411624640714e-07, 'border_count': 15, 'bagging_temperature': 0.9616051545678178, 'random_strength': 8.983312269923397, 'grow_policy': 'Lossguide', 'min_data_in_leaf': 735, 'max_leaves': 87}. Best is trial 99 with value: 219.56324459923857.[0m
[32m[I 2024-10-13 14:11:03,400][0m Trial 136 finished with value: 225.03533253996656 and parameters: {'depth': 3, 'learning_rate': 0.005839480723183867, 'iterations': 1914, 'l2_leaf_reg': 1.5629478898718033e-07, 'border_count': 26, 'bagging_temperature': 0.9247991080656254, 'random_strength': 8.559231421239215, 'grow_policy': 'Lossguide', 'min_data_in_leaf': 573, 'max_leaves': 92}. Best is trial 99 with value: 219.56324459923857.[0m
[32m[I 2024-10-13 14:11:09,434][0m Trial 137 finished with value: 251.97837023424208 and parameters: {'depth': 6, 'learning_rate': 0.0020425963692428366, 'iterations': 2182, 'l2_leaf_reg': 7.696442409902729e-07, 'border_count': 220, 'bagging_temperature': 0.8959106149958258, 'random_strength': 9.458668698024935, 'grow_policy': 'Lossguide', 'min_data_in_leaf': 779, 'max_leaves': 112}. Best is trial 99 with value: 219.56324459923857.[0m
[32m[I 2024-10-13 14:11:11,986][0m Trial 138 finished with value: 294.07292550774355 and parameters: {'depth': 6, 'learning_rate': 0.004278855224746142, 'iterations': 1704, 'l2_leaf_reg': 9.530229904686947e-08, 'border_count': 9, 'bagging_temperature': 0.8441197407355399, 'random_strength': 8.224303500555376, 'grow_policy': 'Lossguide', 'min_data_in_leaf': 677, 'max_leaves': 185}. Best is trial 99 with value: 219.56324459923857.[0m
[32m[I 2024-10-13 14:11:32,229][0m Trial 139 finished with value: 307.5339572151829 and parameters: {'depth': 7, 'learning_rate': 0.0033735217769020115, 'iterations': 1556, 'l2_leaf_reg': 1.6803344123854838e-06, 'border_count': 31, 'bagging_temperature': 0.9662945763769435, 'random_strength': 9.08480115005437, 'grow_policy': 'SymmetricTree', 'min_data_in_leaf': 747}. Best is trial 99 with value: 219.56324459923857.[0m
[32m[I 2024-10-13 14:11:37,789][0m Trial 140 finished with value: 632.4828913688405 and parameters: {'depth': 7, 'learning_rate': 0.00042566618624939086, 'iterations': 1496, 'l2_leaf_reg': 5.9014288437823086e-08, 'border_count': 19, 'bagging_temperature': 0.9323347477181022, 'random_strength': 8.712648839894223, 'grow_policy': 'Lossguide', 'min_data_in_leaf': 525, 'max_leaves': 103}. Best is trial 99 with value: 219.56324459923857.[0m
[32m[I 2024-10-13 14:11:40,036][0m Trial 141 finished with value: 221.1720803816401 and parameters: {'depth': 7, 'learning_rate': 0.005077554273760961, 'iterations': 1611, 'l2_leaf_reg': 3.463864174228423e-07, 'border_count': 38, 'bagging_temperature': 0.8217900121371277, 'random_strength': 9.645980192905, 'grow_policy': 'Lossguide', 'min_data_in_leaf': 800, 'max_leaves': 125}. Best is trial 99 with value: 219.56324459923857.[0m
[32m[I 2024-10-13 14:11:44,708][0m Trial 142 finished with value: 222.54348807474415 and parameters: {'depth': 7, 'learning_rate': 0.005145562268233817, 'iterations': 1630, 'l2_leaf_reg': 1.312240952134521e-07, 'border_count': 39, 'bagging_temperature': 0.8724136613262983, 'random_strength': 9.23939828550095, 'grow_policy': 'Lossguide', 'min_data_in_leaf': 806, 'max_leaves': 125}. Best is trial 99 with value: 219.56324459923857.[0m
[32m[I 2024-10-13 14:11:47,117][0m Trial 143 finished with value: 246.59743656652776 and parameters: {'depth': 6, 'learning_rate': 0.008586075395005992, 'iterations': 1754, 'l2_leaf_reg': 3.886965752228851e-07, 'border_count': 45, 'bagging_temperature': 0.8213897740779574, 'random_strength': 9.474302770028082, 'grow_policy': 'Lossguide', 'min_data_in_leaf': 720, 'max_leaves': 95}. Best is trial 99 with value: 219.56324459923857.[0m
[32m[I 2024-10-13 14:11:53,455][0m Trial 144 finished with value: 249.18210645499812 and parameters: {'depth': 7, 'learning_rate': 0.006147097351391683, 'iterations': 1553, 'l2_leaf_reg': 7.579889963114797e-06, 'border_count': 119, 'bagging_temperature': 0.9075463582929231, 'random_strength': 9.74080413997469, 'grow_policy': 'Lossguide', 'min_data_in_leaf': 782, 'max_leaves': 242}. Best is trial 99 with value: 219.56324459923857.[0m
[32m[I 2024-10-13 14:11:56,189][0m Trial 145 finished with value: 246.61281713809475 and parameters: {'depth': 3, 'learning_rate': 0.004261643882222576, 'iterations': 1690, 'l2_leaf_reg': 2.477767652899803e-07, 'border_count': 163, 'bagging_temperature': 0.8742426057130391, 'random_strength': 8.845979120502896, 'grow_policy': 'Lossguide', 'min_data_in_leaf': 753, 'max_leaves': 119}. Best is trial 99 with value: 219.56324459923857.[0m
[32m[I 2024-10-13 14:11:59,374][0m Trial 146 finished with value: 222.30689402108965 and parameters: {'depth': 6, 'learning_rate': 0.00526933293546294, 'iterations': 1595, 'l2_leaf_reg': 7.884640267936422e-07, 'border_count': 29, 'bagging_temperature': 0.9356672634168273, 'random_strength': 8.413402845249212, 'grow_policy': 'Lossguide', 'min_data_in_leaf': 807, 'max_leaves': 163}. Best is trial 99 with value: 219.56324459923857.[0m
[32m[I 2024-10-13 14:12:02,514][0m Trial 147 finished with value: 248.95702248182494 and parameters: {'depth': 7, 'learning_rate': 0.0025449488972661685, 'iterations': 1513, 'l2_leaf_reg': 2.099749509598326e-07, 'border_count': 50, 'bagging_temperature': 0.8445297750454084, 'random_strength': 9.33106840330057, 'grow_policy': 'Lossguide', 'min_data_in_leaf': 699, 'max_leaves': 100}. Best is trial 99 with value: 219.56324459923857.[0m
[32m[I 2024-10-13 14:12:05,335][0m Trial 148 finished with value: 225.81860017565816 and parameters: {'depth': 4, 'learning_rate': 0.006496179179680443, 'iterations': 1662, 'l2_leaf_reg': 2.586650874576818e-06, 'border_count': 36, 'bagging_temperature': 0.8982816475938539, 'random_strength': 9.907165203274495, 'grow_policy': 'Lossguide', 'min_data_in_leaf': 451, 'max_leaves': 156}. Best is trial 99 with value: 219.56324459923857.[0m
[32m[I 2024-10-13 14:12:10,451][0m Trial 149 finished with value: 227.68610363739677 and parameters: {'depth': 7, 'learning_rate': 0.003602111001514784, 'iterations': 1962, 'l2_leaf_reg': 4.6889683653648016e-07, 'border_count': 23, 'bagging_temperature': 0.9786962785503335, 'random_strength': 9.082718109434952, 'grow_policy': 'Lossguide', 'min_data_in_leaf': 818, 'max_leaves': 109}. Best is trial 99 with value: 219.56324459923857.[0m
[32m[I 2024-10-13 14:12:15,081][0m Trial 150 finished with value: 220.86595469683584 and parameters: {'depth': 8, 'learning_rate': 0.004619248014261959, 'iterations': 1783, 'l2_leaf_reg': 8.588099913166205e-07, 'border_count': 32, 'bagging_temperature': 0.9534868974284799, 'random_strength': 8.042414258916354, 'grow_policy': 'Lossguide', 'min_data_in_leaf': 764, 'max_leaves': 80}. Best is trial 99 with value: 219.56324459923857.[0m
