[32m[I 2024-10-13 14:29:45,957][0m Trial 503 finished with value: 220.06131750764564 and parameters: {'depth': 4, 'learning_rate': 0.0028827840931866695, 'iterations': 2719, 'l2_leaf_reg': 1.3794815372443451e-05, 'border_count': 36, 'bagging_temperature': 0.9502703004626333, 'random_strength': 7.809414304097702, 'grow_policy': 'Lossguide', 'min_data_in_leaf': 540, 'max_leaves': 67}. Best is trial 453 with value: 218.61327854597363.[0m
[32m[I 2024-10-13 14:29:48,483][0m Trial 504 finished with value: 254.05881170522488 and parameters: {'depth': 3, 'learning_rate': 0.0023184004289926344, 'iterations': 2531, 'l2_leaf_reg': 5.106511611586162e-06, 'border_count': 20, 'bagging_temperature': 0.6442437666549014, 'random_strength': 7.406040083895882, 'grow_policy': 'Depthwise', 'min_data_in_leaf': 363}. Best is trial 453 with value: 218.61327854597363.[0m
[32m[I 2024-10-13 14:29:50,877][0m Trial 505 finished with value: 222.74348927220527 and parameters: {'depth': 5, 'learning_rate': 0.004150743404696733, 'iterations': 2454, 'l2_leaf_reg': 2.48377032240271e-05, 'border_count': 32, 'bagging_temperature': 0.9671402165584881, 'random_strength': 6.87328862377684, 'grow_policy': 'Lossguide', 'min_data_in_leaf': 446, 'max_leaves': 54}. Best is trial 453 with value: 218.61327854597363.[0m
[32m[I 2024-10-13 14:29:53,512][0m Trial 506 finished with value: 235.41980282986748 and parameters: {'depth': 4, 'learning_rate': 0.0030302909413539468, 'iterations': 2646, 'l2_leaf_reg': 6.262167449664416e-05, 'border_count': 42, 'bagging_temperature': 0.99997299314795, 'random_strength': 7.163989093673915, 'grow_policy': 'Lossguide', 'min_data_in_leaf': 153, 'max_leaves': 61}. Best is trial 453 with value: 218.61327854597363.[0m
[32m[I 2024-10-13 14:29:55,800][0m Trial 507 finished with value: 221.01833024643403 and parameters: {'depth': 4, 'learning_rate': 0.0036336744005987403, 'iterations': 2305, 'l2_leaf_reg': 1.795632367001614e-05, 'border_count': 38, 'bagging_temperature': 0.89087418406467, 'random_strength': 7.455839047983696, 'grow_policy': 'Depthwise', 'min_data_in_leaf': 222}. Best is trial 453 with value: 218.61327854597363.[0m
[32m[I 2024-10-13 14:29:58,182][0m Trial 508 finished with value: 229.8736795764971 and parameters: {'depth': 11, 'learning_rate': 0.0019834758589725877, 'iterations': 2399, 'l2_leaf_reg': 4.062750420497311e-05, 'border_count': 26, 'bagging_temperature': 0.9437470315167621, 'random_strength': 7.717825682204064, 'grow_policy': 'Lossguide', 'min_data_in_leaf': 323, 'max_leaves': 76}. Best is trial 453 with value: 218.61327854597363.[0m
[32m[I 2024-10-13 14:30:00,705][0m Trial 509 finished with value: 219.45542707450494 and parameters: {'depth': 4, 'learning_rate': 0.0024996816324994917, 'iterations': 2528, 'l2_leaf_reg': 7.69963837853947e-06, 'border_count': 32, 'bagging_temperature': 0.9646963802048933, 'random_strength': 7.985837956944253, 'grow_policy': 'Lossguide', 'min_data_in_leaf': 395, 'max_leaves': 69}. Best is trial 453 with value: 218.61327854597363.[0m
[32m[I 2024-10-13 14:30:03,231][0m Trial 510 finished with value: 250.2601620122998 and parameters: {'depth': 4, 'learning_rate': 0.0027351328980675573, 'iterations': 2475, 'l2_leaf_reg': 5.101146449438884e-06, 'border_count': 13, 'bagging_temperature': 0.9733420014880698, 'random_strength': 7.2262515327718795, 'grow_policy': 'Lossguide', 'min_data_in_leaf': 406, 'max_leaves': 83}. Best is trial 453 with value: 218.61327854597363.[0m
[32m[I 2024-10-13 14:30:05,826][0m Trial 511 finished with value: 229.49135191005522 and parameters: {'depth': 4, 'learning_rate': 0.0033398297482080596, 'iterations': 2528, 'l2_leaf_reg': 3.4587957589553705e-06, 'border_count': 23, 'bagging_temperature': 0.9829593033304308, 'random_strength': 6.946239686289504, 'grow_policy': 'Depthwise', 'min_data_in_leaf': 100}. Best is trial 453 with value: 218.61327854597363.[0m
[32m[I 2024-10-13 14:30:08,359][0m Trial 512 finished with value: 208.19174135014148 and parameters: {'depth': 4, 'learning_rate': 0.002665878309133917, 'iterations': 2576, 'l2_leaf_reg': 2.9067945074586383, 'border_count': 30, 'bagging_temperature': 0.9679592130155709, 'random_strength': 7.567285852744671, 'grow_policy': 'Lossguide', 'min_data_in_leaf': 459, 'max_leaves': 70}. Best is trial 512 with value: 208.19174135014148.[0m
[32m[I 2024-10-13 14:30:10,867][0m Trial 513 finished with value: 226.26685089751598 and parameters: {'depth': 4, 'learning_rate': 0.004658268747575857, 'iterations': 2589, 'l2_leaf_reg': 0.017355356295201383, 'border_count': 28, 'bagging_temperature': 0.9590390140791629, 'random_strength': 7.6635351805629, 'grow_policy': 'Lossguide', 'min_data_in_leaf': 480, 'max_leaves': 72}. Best is trial 512 with value: 208.19174135014148.[0m
[32m[I 2024-10-13 14:30:13,247][0m Trial 514 finished with value: 248.60975109272823 and parameters: {'depth': 9, 'learning_rate': 0.0031257356448432362, 'iterations': 2371, 'l2_leaf_reg': 0.010140145322528412, 'border_count': 19, 'bagging_temperature': 0.7518947925636505, 'random_strength': 7.987796609243438, 'grow_policy': 'Lossguide', 'min_data_in_leaf': 457, 'max_leaves': 255}. Best is trial 512 with value: 208.19174135014148.[0m
[32m[I 2024-10-13 14:30:15,703][0m Trial 515 finished with value: 222.84185011371096 and parameters: {'depth': 3, 'learning_rate': 0.00391934689562793, 'iterations': 2480, 'l2_leaf_reg': 7.776829298023051e-06, 'border_count': 30, 'bagging_temperature': 0.9228221921308316, 'random_strength': 7.536419328437354, 'grow_policy': 'Lossguide', 'min_data_in_leaf': 427, 'max_leaves': 77}. Best is trial 512 with value: 208.19174135014148.[0m
[32m[I 2024-10-13 14:30:18,330][0m Trial 516 finished with value: 226.66442861614576 and parameters: {'depth': 4, 'learning_rate': 0.002712902287116439, 'iterations': 2570, 'l2_leaf_reg': 8.23939458624602e-05, 'border_count': 23, 'bagging_temperature': 0.9646168378733901, 'random_strength': 7.815786701371259, 'grow_policy': 'Depthwise', 'min_data_in_leaf': 457}. Best is trial 512 with value: 208.19174135014148.[0m
[32m[I 2024-10-13 14:30:20,763][0m Trial 517 finished with value: 227.0497200814089 and parameters: {'depth': 5, 'learning_rate': 0.005328368582480341, 'iterations': 2436, 'l2_leaf_reg': 9.999370097152678e-05, 'border_count': 32, 'bagging_temperature': 0.9995412911044935, 'random_strength': 8.158336617897287, 'grow_policy': 'Lossguide', 'min_data_in_leaf': 508, 'max_leaves': 86}. Best is trial 512 with value: 208.19174135014148.[0m
[32m[I 2024-10-13 14:30:23,224][0m Trial 518 finished with value: 216.2913217784812 and parameters: {'depth': 10, 'learning_rate': 0.0022508608074166595, 'iterations': 2526, 'l2_leaf_reg': 4.491479393579793, 'border_count': 41, 'bagging_temperature': 0.9632636730295265, 'random_strength': 7.2878734056248655, 'grow_policy': 'Lossguide', 'min_data_in_leaf': 428, 'max_leaves': 65}. Best is trial 512 with value: 208.19174135014148.[0m
[32m[I 2024-10-13 14:30:24,868][0m Trial 519 finished with value: 370.19442077497155 and parameters: {'depth': 9, 'learning_rate': 0.0015963686731274515, 'iterations': 1429, 'l2_leaf_reg': 7.952074037685947, 'border_count': 49, 'bagging_temperature': 0.9140504536481749, 'random_strength': 6.667920296445327, 'grow_policy': 'Lossguide', 'min_data_in_leaf': 422, 'max_leaves': 71}. Best is trial 512 with value: 208.19174135014148.[0m
[32m[I 2024-10-13 14:30:27,444][0m Trial 520 finished with value: 298.05488531423384 and parameters: {'depth': 10, 'learning_rate': 0.06075946133452575, 'iterations': 2610, 'l2_leaf_reg': 6.849358752412126, 'border_count': 45, 'bagging_temperature': 0.9450811262248109, 'random_strength': 7.1049654435157805, 'grow_policy': 'Depthwise', 'min_data_in_leaf': 404}. Best is trial 512 with value: 208.19174135014148.[0m
[32m[I 2024-10-13 14:30:29,867][0m Trial 521 finished with value: 221.16343114292306 and parameters: {'depth': 10, 'learning_rate': 0.002052318047001117, 'iterations': 2533, 'l2_leaf_reg': 2.8945935304398756, 'border_count': 39, 'bagging_temperature': 0.9608590801442758, 'random_strength': 6.816422692004422, 'grow_policy': 'Lossguide', 'min_data_in_leaf': 469, 'max_leaves': 67}. Best is trial 512 with value: 208.19174135014148.[0m
[32m[I 2024-10-13 14:30:32,059][0m Trial 522 finished with value: 241.29517123789876 and parameters: {'depth': 10, 'learning_rate': 0.0023115296545056746, 'iterations': 2231, 'l2_leaf_reg': 0.030070110569812104, 'border_count': 55, 'bagging_temperature': 0.9318545300411748, 'random_strength': 7.293010728882843, 'grow_policy': 'Lossguide', 'min_data_in_leaf': 441, 'max_leaves': 77}. Best is trial 512 with value: 208.19174135014148.[0m
[32m[I 2024-10-13 14:30:34,479][0m Trial 523 finished with value: 228.0401107209181 and parameters: {'depth': 10, 'learning_rate': 0.001795492762426178, 'iterations': 2640, 'l2_leaf_reg': 0.14933842973297665, 'border_count': 40, 'bagging_temperature': 0.9623888458827827, 'random_strength': 7.056797312059239, 'grow_policy': 'Lossguide', 'min_data_in_leaf': 425, 'max_leaves': 81}. Best is trial 512 with value: 208.19174135014148.[0m
[32m[I 2024-10-13 14:30:41,284][0m Trial 524 finished with value: 359.3340774972583 and parameters: {'depth': 5, 'learning_rate': 0.0036047377247012957, 'iterations': 1548, 'l2_leaf_reg': 9.812045041402829, 'border_count': 26, 'bagging_temperature': 0.027544294041389805, 'random_strength': 8.451226651374457, 'grow_policy': 'SymmetricTree', 'min_data_in_leaf': 493}. Best is trial 512 with value: 208.19174135014148.[0m
[32m[I 2024-10-13 14:30:43,992][0m Trial 525 finished with value: 229.3991887344783 and parameters: {'depth': 10, 'learning_rate': 0.0029144026618886814, 'iterations': 2962, 'l2_leaf_reg': 1.985144215515248, 'border_count': 44, 'bagging_temperature': 0.9336181340760487, 'random_strength': 7.280802210686873, 'grow_policy': 'Depthwise', 'min_data_in_leaf': 446}. Best is trial 512 with value: 208.19174135014148.[0m
[32m[I 2024-10-13 14:30:46,458][0m Trial 526 finished with value: 286.5463883487932 and parameters: {'depth': 10, 'learning_rate': 0.001184936248075151, 'iterations': 2579, 'l2_leaf_reg': 4.198994500927023, 'border_count': 32, 'bagging_temperature': 0.8621978460866799, 'random_strength': 6.923346164161193, 'grow_policy': 'Lossguide', 'min_data_in_leaf': 399, 'max_leaves': 64}. Best is trial 512 with value: 208.19174135014148.[0m
[32m[I 2024-10-13 14:30:48,641][0m Trial 527 finished with value: 222.1959438705832 and parameters: {'depth': 11, 'learning_rate': 0.002176674775604751, 'iterations': 2333, 'l2_leaf_reg': 2.2527269940448265, 'border_count': 38, 'bagging_temperature': 0.9075895858975171, 'random_strength': 6.626129076870854, 'grow_policy': 'Lossguide', 'min_data_in_leaf': 417, 'max_leaves': 74}. Best is trial 512 with value: 208.19174135014148.[0m
[32m[I 2024-10-13 14:30:51,001][0m Trial 528 finished with value: 220.66859174328363 and parameters: {'depth': 10, 'learning_rate': 0.0025255773377697625, 'iterations': 2476, 'l2_leaf_reg': 0.08577603554276743, 'border_count': 29, 'bagging_temperature': 0.9777029527453416, 'random_strength': 7.442423820125032, 'grow_policy': 'Lossguide', 'min_data_in_leaf': 384, 'max_leaves': 67}. Best is trial 512 with value: 208.19174135014148.[0m
[32m[I 2024-10-13 14:30:52,546][0m Trial 529 finished with value: 372.5927307178745 and parameters: {'depth': 6, 'learning_rate': 0.0031717009400814384, 'iterations': 1328, 'l2_leaf_reg': 2.2553104068736785, 'border_count': 4, 'bagging_temperature': 0.9516685377576919, 'random_strength': 7.147888991651804, 'grow_policy': 'Depthwise', 'min_data_in_leaf': 528}. Best is trial 512 with value: 208.19174135014148.[0m
[32m[I 2024-10-13 14:30:54,803][0m Trial 530 finished with value: 228.18847419952297 and parameters: {'depth': 5, 'learning_rate': 0.0020168251956856147, 'iterations': 2402, 'l2_leaf_reg': 4.3359439140029155, 'border_count': 41, 'bagging_temperature': 0.9709144566782285, 'random_strength': 7.657497385173409, 'grow_policy': 'Lossguide', 'min_data_in_leaf': 478, 'max_leaves': 91}. Best is trial 512 with value: 208.19174135014148.[0m
[32m[I 2024-10-13 14:30:57,154][0m Trial 531 finished with value: 243.52345565051905 and parameters: {'depth': 10, 'learning_rate': 0.002737317374326961, 'iterations': 2526, 'l2_leaf_reg': 5.114654140952595e-05, 'border_count': 48, 'bagging_temperature': 0.5228845108710659, 'random_strength': 7.347768068626037, 'grow_policy': 'Lossguide', 'min_data_in_leaf': 440, 'max_leaves': 71}. Best is trial 512 with value: 208.19174135014148.[0m
[32m[I 2024-10-13 14:30:59,656][0m Trial 532 finished with value: 248.01110784889272 and parameters: {'depth': 4, 'learning_rate': 0.0014209517703163306, 'iterations': 2646, 'l2_leaf_reg': 0.31337066578226214, 'border_count': 34, 'bagging_temperature': 0.9423559835327421, 'random_strength': 7.013184414347046, 'grow_policy': 'Depthwise', 'min_data_in_leaf': 370}. Best is trial 512 with value: 208.19174135014148.[0m
[32m[I 2024-10-13 14:31:01,908][0m Trial 533 finished with value: 249.14008967068065 and parameters: {'depth': 4, 'learning_rate': 0.003712966635083666, 'iterations': 2434, 'l2_leaf_reg': 3.177852254987351e-05, 'border_count': 17, 'bagging_temperature': 0.9991908951956113, 'random_strength': 7.888619883761063, 'grow_policy': 'Lossguide', 'min_data_in_leaf': 464, 'max_leaves': 80}. Best is trial 512 with value: 208.19174135014148.[0m
[32m[I 2024-10-13 14:31:04,315][0m Trial 534 finished with value: 219.93787191192737 and parameters: {'depth': 3, 'learning_rate': 0.002445812729102784, 'iterations': 2592, 'l2_leaf_reg': 4.2330843690944855, 'border_count': 24, 'bagging_temperature': 0.5904851692248541, 'random_strength': 7.5160591878382315, 'grow_policy': 'Lossguide', 'min_data_in_leaf': 402, 'max_leaves': 60}. Best is trial 512 with value: 208.19174135014148.[0m
[32m[I 2024-10-13 14:31:06,658][0m Trial 535 finished with value: 203.81678525386107 and parameters: {'depth': 5, 'learning_rate': 0.0030425881628364485, 'iterations': 2498, 'l2_leaf_reg': 4.944815144520253, 'border_count': 35, 'bagging_temperature': 0.9178204695966965, 'random_strength': 7.238046614055558, 'grow_policy': 'Lossguide', 'min_data_in_leaf': 427, 'max_leaves': 84}. Best is trial 535 with value: 203.81678525386107.[0m
[32m[I 2024-10-13 14:31:09,024][0m Trial 536 finished with value: 241.47759750185415 and parameters: {'depth': 5, 'learning_rate': 0.0017168334175130127, 'iterations': 2504, 'l2_leaf_reg': 5.2328500540552145, 'border_count': 37, 'bagging_temperature': 0.9300276028411211, 'random_strength': 6.797022421458708, 'grow_policy': 'Lossguide', 'min_data_in_leaf': 511, 'max_leaves': 84}. Best is trial 535 with value: 203.81678525386107.[0m
[32m[I 2024-10-13 14:31:11,389][0m Trial 537 finished with value: 235.30873723557733 and parameters: {'depth': 5, 'learning_rate': 0.002289160234640056, 'iterations': 2472, 'l2_leaf_reg': 1.3920723013866605, 'border_count': 43, 'bagging_temperature': 0.8946183669948857, 'random_strength': 7.171989521066131, 'grow_policy': 'Depthwise', 'min_data_in_leaf': 429}. Best is trial 535 with value: 203.81678525386107.[0m
[32m[I 2024-10-13 14:31:13,786][0m Trial 538 finished with value: 207.19537926587338 and parameters: {'depth': 5, 'learning_rate': 0.002957475886572282, 'iterations': 2548, 'l2_leaf_reg': 3.1008864617248046, 'border_count': 30, 'bagging_temperature': 0.9030263860852993, 'random_strength': 6.951898543651907, 'grow_policy': 'Lossguide', 'min_data_in_leaf': 540, 'max_leaves': 91}. Best is trial 535 with value: 203.81678525386107.[0m
[32m[I 2024-10-13 14:31:16,187][0m Trial 539 finished with value: 203.83254258886421 and parameters: {'depth': 5, 'learning_rate': 0.003061456033854326, 'iterations': 2569, 'l2_leaf_reg': 6.4334494965585, 'border_count': 27, 'bagging_temperature': 0.8703823457992516, 'random_strength': 6.578304401238194, 'grow_policy': 'Lossguide', 'min_data_in_leaf': 575, 'max_leaves': 86}. Best is trial 535 with value: 203.81678525386107.[0m
[32m[I 2024-10-13 14:31:18,573][0m Trial 540 finished with value: 241.66943555508223 and parameters: {'depth': 5, 'learning_rate': 0.003246240864427437, 'iterations': 2561, 'l2_leaf_reg': 1.9235226776152514, 'border_count': 19, 'bagging_temperature': 0.9049412803786571, 'random_strength': 6.704502956833022, 'grow_policy': 'Lossguide', 'min_data_in_leaf': 597, 'max_leaves': 91}. Best is trial 535 with value: 203.81678525386107.[0m
[32m[I 2024-10-13 14:31:21,023][0m Trial 541 finished with value: 206.3927186706831 and parameters: {'depth': 5, 'learning_rate': 0.0029095662605637153, 'iterations': 2617, 'l2_leaf_reg': 6.0641375908513035, 'border_count': 25, 'bagging_temperature': 0.8704946113432497, 'random_strength': 6.316501408073554, 'grow_policy': 'Lossguide', 'min_data_in_leaf': 581, 'max_leaves': 87}. Best is trial 535 with value: 203.81678525386107.[0m
[32m[I 2024-10-13 14:31:23,458][0m Trial 542 finished with value: 235.04951830976253 and parameters: {'depth': 5, 'learning_rate': 0.0035306413469303943, 'iterations': 2607, 'l2_leaf_reg': 6.296749547664287, 'border_count': 14, 'bagging_temperature': 0.8422558435200918, 'random_strength': 6.487554186113843, 'grow_policy': 'Lossguide', 'min_data_in_leaf': 591, 'max_leaves': 90}. Best is trial 535 with value: 203.81678525386107.[0m
[32m[I 2024-10-13 14:31:25,900][0m Trial 543 finished with value: 255.87518793171384 and parameters: {'depth': 5, 'learning_rate': 0.0020165595635327936, 'iterations': 2666, 'l2_leaf_reg': 5.776484665040243, 'border_count': 21, 'bagging_temperature': 0.9129853725327843, 'random_strength': 6.386608203666076, 'grow_policy': 'Lossguide', 'min_data_in_leaf': 617, 'max_leaves': 91}. Best is trial 535 with value: 203.81678525386107.[0m
[32m[I 2024-10-13 14:31:28,282][0m Trial 544 finished with value: 212.61582419111045 and parameters: {'depth': 5, 'learning_rate': 0.0029491594955234476, 'iterations': 2555, 'l2_leaf_reg': 3.7889197790589986, 'border_count': 24, 'bagging_temperature': 0.8662322643935803, 'random_strength': 6.273107039899985, 'grow_policy': 'Lossguide', 'min_data_in_leaf': 559, 'max_leaves': 85}. Best is trial 535 with value: 203.81678525386107.[0m
[32m[I 2024-10-13 14:31:30,736][0m Trial 545 finished with value: 234.53619933540088 and parameters: {'depth': 5, 'learning_rate': 0.0038494271702450107, 'iterations': 2613, 'l2_leaf_reg': 4.371223856782193, 'border_count': 13, 'bagging_temperature': 0.821198828136851, 'random_strength': 6.163327510879394, 'grow_policy': 'Lossguide', 'min_data_in_leaf': 572, 'max_leaves': 86}. Best is trial 535 with value: 203.81678525386107.[0m
[32m[I 2024-10-13 14:31:33,160][0m Trial 546 finished with value: 291.6047665054667 and parameters: {'depth': 5, 'learning_rate': 0.0030805197093175677, 'iterations': 2600, 'l2_leaf_reg': 3.195776533317869, 'border_count': 10, 'bagging_temperature': 0.8626806314268956, 'random_strength': 6.240778826249553, 'grow_policy': 'Lossguide', 'min_data_in_leaf': 568, 'max_leaves': 94}. Best is trial 535 with value: 203.81678525386107.[0m
[32m[I 2024-10-13 14:31:35,613][0m Trial 547 finished with value: 237.14248484547207 and parameters: {'depth': 5, 'learning_rate': 0.0041364179557913175, 'iterations': 2656, 'l2_leaf_reg': 3.1466815841005324, 'border_count': 18, 'bagging_temperature': 0.9006063008382008, 'random_strength': 5.7273733701078005, 'grow_policy': 'Lossguide', 'min_data_in_leaf': 574, 'max_leaves': 84}. Best is trial 535 with value: 203.81678525386107.[0m
[32m[I 2024-10-13 14:31:38,007][0m Trial 548 finished with value: 222.78665795470192 and parameters: {'depth': 5, 'learning_rate': 0.003087528539518095, 'iterations': 2564, 'l2_leaf_reg': 0.8983923520026935, 'border_count': 24, 'bagging_temperature': 0.772083622181778, 'random_strength': 6.285778101544536, 'grow_policy': 'Lossguide', 'min_data_in_leaf': 560, 'max_leaves': 89}. Best is trial 535 with value: 203.81678525386107.[0m
[32m[I 2024-10-13 14:31:40,655][0m Trial 549 finished with value: 209.01910947166434 and parameters: {'depth': 5, 'learning_rate': 0.0027319262825688945, 'iterations': 2669, 'l2_leaf_reg': 4.335208433871148, 'border_count': 25, 'bagging_temperature': 0.8776024685768451, 'random_strength': 6.436065560217965, 'grow_policy': 'Lossguide', 'min_data_in_leaf': 539, 'max_leaves': 86}. Best is trial 535 with value: 203.81678525386107.[0m
[32m[I 2024-10-13 14:31:43,132][0m Trial 550 finished with value: 234.17501936231233 and parameters: {'depth': 5, 'learning_rate': 0.003342672387918737, 'iterations': 2562, 'l2_leaf_reg': 7.4968700056348805, 'border_count': 18, 'bagging_temperature': 0.8745882783485502, 'random_strength': 6.510061757224629, 'grow_policy': 'Lossguide', 'min_data_in_leaf': 541, 'max_leaves': 87}. Best is trial 535 with value: 203.81678525386107.[0m
[32m[I 2024-10-13 14:31:45,746][0m Trial 551 finished with value: 294.1119812412005 and parameters: {'depth': 5, 'learning_rate': 0.002757069282630665, 'iterations': 2655, 'l2_leaf_reg': 3.103893397281483, 'border_count': 10, 'bagging_temperature': 0.8732279641579818, 'random_strength': 5.993977355561862, 'grow_policy': 'Lossguide', 'min_data_in_leaf': 594, 'max_leaves': 95}. Best is trial 535 with value: 203.81678525386107.[0m
[32m[I 2024-10-13 14:31:48,177][0m Trial 552 finished with value: 232.48102329994356 and parameters: {'depth': 5, 'learning_rate': 0.0022279401509475803, 'iterations': 2541, 'l2_leaf_reg': 9.291305435367677, 'border_count': 22, 'bagging_temperature': 0.8415261381183612, 'random_strength': 6.249749760609149, 'grow_policy': 'Lossguide', 'min_data_in_leaf': 549, 'max_leaves': 80}. Best is trial 535 with value: 203.81678525386107.[0m
