[32m[I 2024-10-13 14:51:42,055][0m Trial 903 finished with value: 206.24997226013892 and parameters: {'depth': 7, 'learning_rate': 0.0026354010365218024, 'iterations': 2999, 'l2_leaf_reg': 4.5001697517853145, 'border_count': 40, 'bagging_temperature': 0.799073345087383, 'random_strength': 4.68865355126134, 'grow_policy': 'Lossguide', 'min_data_in_leaf': 475, 'max_leaves': 139}. Best is trial 684 with value: 198.81639474308358.[0m
[32m[I 2024-10-13 14:51:44,739][0m Trial 904 finished with value: 206.5834892375687 and parameters: {'depth': 7, 'learning_rate': 0.0036402302731035024, 'iterations': 2906, 'l2_leaf_reg': 5.014944907191507, 'border_count': 36, 'bagging_temperature': 0.7515992263361083, 'random_strength': 4.904049123207993, 'grow_policy': 'Lossguide', 'min_data_in_leaf': 552, 'max_leaves': 137}. Best is trial 684 with value: 198.81639474308358.[0m
[32m[I 2024-10-13 14:51:47,373][0m Trial 905 finished with value: 201.99586421555813 and parameters: {'depth': 8, 'learning_rate': 0.003126325195292775, 'iterations': 2843, 'l2_leaf_reg': 6.879039414143725, 'border_count': 41, 'bagging_temperature': 0.8206747232975804, 'random_strength': 5.210254011822368, 'grow_policy': 'Lossguide', 'min_data_in_leaf': 495, 'max_leaves': 130}. Best is trial 684 with value: 198.81639474308358.[0m
[32m[I 2024-10-13 14:51:50,250][0m Trial 906 finished with value: 204.682850522439 and parameters: {'depth': 7, 'learning_rate': 0.004236200173865033, 'iterations': 2905, 'l2_leaf_reg': 6.850785182278452, 'border_count': 33, 'bagging_temperature': 0.8425016598049078, 'random_strength': 4.612313705583762, 'grow_policy': 'Lossguide', 'min_data_in_leaf': 522, 'max_leaves': 125}. Best is trial 684 with value: 198.81639474308358.[0m
[32m[I 2024-10-13 14:51:53,068][0m Trial 907 finished with value: 200.19160017318674 and parameters: {'depth': 8, 'learning_rate': 0.0036907857440530915, 'iterations': 2942, 'l2_leaf_reg': 9.995676058264355, 'border_count': 38, 'bagging_temperature': 0.723001820835954, 'random_strength': 4.383296142469137, 'grow_policy': 'Lossguide', 'min_data_in_leaf': 473, 'max_leaves': 148}. Best is trial 684 with value: 198.81639474308358.[0m
[32m[I 2024-10-13 14:51:55,826][0m Trial 908 finished with value: 219.70972219592647 and parameters: {'depth': 8, 'learning_rate': 0.002763329222838771, 'iterations': 2879, 'l2_leaf_reg': 9.988557034259697, 'border_count': 44, 'bagging_temperature': 0.29271350715718936, 'random_strength': 4.915241279144432, 'grow_policy': 'Lossguide', 'min_data_in_leaf': 508, 'max_leaves': 116}. Best is trial 684 with value: 198.81639474308358.[0m
[32m[I 2024-10-13 14:52:12,780][0m Trial 909 finished with value: 257.59628155943085 and parameters: {'depth': 7, 'learning_rate': 0.004528876480886866, 'iterations': 2818, 'l2_leaf_reg': 3.391964014533478, 'border_count': 32, 'bagging_temperature': 0.7871315582128963, 'random_strength': 1.3149995255491573, 'grow_policy': 'SymmetricTree', 'min_data_in_leaf': 533}. Best is trial 684 with value: 198.81639474308358.[0m
[32m[I 2024-10-13 14:52:15,658][0m Trial 910 finished with value: 213.6920075916454 and parameters: {'depth': 9, 'learning_rate': 0.003103218999641797, 'iterations': 2999, 'l2_leaf_reg': 9.955396416863909, 'border_count': 194, 'bagging_temperature': 0.7610378445957773, 'random_strength': 4.672327650252719, 'grow_policy': 'Lossguide', 'min_data_in_leaf': 452, 'max_leaves': 141}. Best is trial 684 with value: 198.81639474308358.[0m
[32m[I 2024-10-13 14:52:18,494][0m Trial 911 finished with value: 207.7402091593959 and parameters: {'depth': 7, 'learning_rate': 0.0037242398468184277, 'iterations': 3000, 'l2_leaf_reg': 4.980166566994312, 'border_count': 49, 'bagging_temperature': 0.7403809399320999, 'random_strength': 4.34244301163752, 'grow_policy': 'Lossguide', 'min_data_in_leaf': 491, 'max_leaves': 133}. Best is trial 684 with value: 198.81639474308358.[0m
[32m[I 2024-10-13 14:52:21,186][0m Trial 912 finished with value: 223.18593736042936 and parameters: {'depth': 7, 'learning_rate': 0.005641896651635264, 'iterations': 2907, 'l2_leaf_reg': 6.426377557295567, 'border_count': 131, 'bagging_temperature': 0.8139489010929656, 'random_strength': 4.521532654384749, 'grow_policy': 'Lossguide', 'min_data_in_leaf': 553, 'max_leaves': 137}. Best is trial 684 with value: 198.81639474308358.[0m
[32m[I 2024-10-13 14:52:23,861][0m Trial 913 finished with value: 223.14944963136222 and parameters: {'depth': 8, 'learning_rate': 0.005021873111006558, 'iterations': 2948, 'l2_leaf_reg': 2.3368934910807146, 'border_count': 36, 'bagging_temperature': 0.7835093222538089, 'random_strength': 5.082540181229016, 'grow_policy': 'Lossguide', 'min_data_in_leaf': 506, 'max_leaves': 123}. Best is trial 684 with value: 198.81639474308358.[0m
[32m[I 2024-10-13 14:52:26,537][0m Trial 914 finished with value: 206.58955776964834 and parameters: {'depth': 7, 'learning_rate': 0.0026407545417762796, 'iterations': 2870, 'l2_leaf_reg': 6.603052387015605, 'border_count': 41, 'bagging_temperature': 0.766104448615629, 'random_strength': 4.804509128919926, 'grow_policy': 'Lossguide', 'min_data_in_leaf': 475, 'max_leaves': 142}. Best is trial 684 with value: 198.81639474308358.[0m
[32m[I 2024-10-13 14:52:29,263][0m Trial 915 finished with value: 211.07308657315008 and parameters: {'depth': 7, 'learning_rate': 0.003932029198105, 'iterations': 2945, 'l2_leaf_reg': 3.4461416801461917, 'border_count': 32, 'bagging_temperature': 0.8469071954458907, 'random_strength': 4.209439638467193, 'grow_policy': 'Lossguide', 'min_data_in_leaf': 528, 'max_leaves': 129}. Best is trial 684 with value: 198.81639474308358.[0m
[32m[I 2024-10-13 14:52:31,822][0m Trial 916 finished with value: 201.24948464446146 and parameters: {'depth': 8, 'learning_rate': 0.003333197400785707, 'iterations': 2816, 'l2_leaf_reg': 9.915327992222466, 'border_count': 47, 'bagging_temperature': 0.7080767965245292, 'random_strength': 4.604342745070559, 'grow_policy': 'Lossguide', 'min_data_in_leaf': 453, 'max_leaves': 135}. Best is trial 684 with value: 198.81639474308358.[0m
[32m[I 2024-10-13 14:52:34,574][0m Trial 917 finished with value: 236.08729534548795 and parameters: {'depth': 7, 'learning_rate': 0.004357574128125103, 'iterations': 2902, 'l2_leaf_reg': 1.1953986965671313e-08, 'border_count': 38, 'bagging_temperature': 0.31983396613430126, 'random_strength': 4.429412849492358, 'grow_policy': 'Lossguide', 'min_data_in_leaf': 511, 'max_leaves': 146}. Best is trial 684 with value: 198.81639474308358.[0m
[32m[I 2024-10-13 14:52:36,702][0m Trial 918 finished with value: 209.71063289435568 and parameters: {'depth': 7, 'learning_rate': 0.003147430413689457, 'iterations': 2129, 'l2_leaf_reg': 4.776106812791063, 'border_count': 43, 'bagging_temperature': 0.8035522258857433, 'random_strength': 4.009264845839823, 'grow_policy': 'Lossguide', 'min_data_in_leaf': 488, 'max_leaves': 131}. Best is trial 684 with value: 198.81639474308358.[0m
[32m[I 2024-10-13 14:52:39,407][0m Trial 919 finished with value: 207.17946534972523 and parameters: {'depth': 7, 'learning_rate': 0.005005632593872546, 'iterations': 2998, 'l2_leaf_reg': 9.991782596227425, 'border_count': 52, 'bagging_temperature': 0.8317779344178605, 'random_strength': 4.809274210052644, 'grow_policy': 'Lossguide', 'min_data_in_leaf': 547, 'max_leaves': 139}. Best is trial 684 with value: 198.81639474308358.[0m
[32m[I 2024-10-13 14:52:40,516][0m Trial 920 finished with value: 311.9059964351616 and parameters: {'depth': 7, 'learning_rate': 0.0037368280945579146, 'iterations': 778, 'l2_leaf_reg': 6.788735784930197, 'border_count': 125, 'bagging_temperature': 0.7454149077236258, 'random_strength': 4.275586865390375, 'grow_policy': 'Lossguide', 'min_data_in_leaf': 527, 'max_leaves': 120}. Best is trial 684 with value: 198.81639474308358.[0m
[32m[I 2024-10-13 14:52:43,162][0m Trial 921 finished with value: 218.09015427595 and parameters: {'depth': 8, 'learning_rate': 0.0028401809556719013, 'iterations': 2952, 'l2_leaf_reg': 4.811566013520843, 'border_count': 106, 'bagging_temperature': 0.7710418710051511, 'random_strength': 5.097929455807419, 'grow_policy': 'Lossguide', 'min_data_in_leaf': 494, 'max_leaves': 126}. Best is trial 684 with value: 198.81639474308358.[0m
[32m[I 2024-10-13 14:52:45,786][0m Trial 922 finished with value: 227.13158664143634 and parameters: {'depth': 7, 'learning_rate': 0.004028857697289364, 'iterations': 2860, 'l2_leaf_reg': 8.37033513954623e-08, 'border_count': 32, 'bagging_temperature': 0.7277199260195079, 'random_strength': 4.534585400851743, 'grow_policy': 'Lossguide', 'min_data_in_leaf': 470, 'max_leaves': 135}. Best is trial 684 with value: 198.81639474308358.[0m
[32m[I 2024-10-13 14:52:47,161][0m Trial 923 finished with value: 227.7618809879436 and parameters: {'depth': 7, 'learning_rate': 0.006207402806553401, 'iterations': 1112, 'l2_leaf_reg': 6.6617466129055005, 'border_count': 37, 'bagging_temperature': 0.20773521924653415, 'random_strength': 4.110748354532021, 'grow_policy': 'Lossguide', 'min_data_in_leaf': 513, 'max_leaves': 144}. Best is trial 684 with value: 198.81639474308358.[0m
[32m[I 2024-10-13 14:52:49,869][0m Trial 924 finished with value: 200.40616776677948 and parameters: {'depth': 8, 'learning_rate': 0.003143139637672671, 'iterations': 2940, 'l2_leaf_reg': 9.94425840949942, 'border_count': 46, 'bagging_temperature': 0.79292696402532, 'random_strength': 4.670470517302331, 'grow_policy': 'Lossguide', 'min_data_in_leaf': 496, 'max_leaves': 149}. Best is trial 684 with value: 198.81639474308358.[0m
[32m[I 2024-10-13 14:52:52,617][0m Trial 925 finished with value: 222.778380251162 and parameters: {'depth': 9, 'learning_rate': 0.004461731831901, 'iterations': 3000, 'l2_leaf_reg': 3.2240866798951537, 'border_count': 56, 'bagging_temperature': 0.7502347556079031, 'random_strength': 4.373850298010241, 'grow_policy': 'Lossguide', 'min_data_in_leaf': 543, 'max_leaves': 129}. Best is trial 684 with value: 198.81639474308358.[0m
[32m[I 2024-10-13 14:52:55,283][0m Trial 926 finished with value: 200.67477535988056 and parameters: {'depth': 8, 'learning_rate': 0.0034390033243137507, 'iterations': 2900, 'l2_leaf_reg': 6.673532307871822, 'border_count': 41, 'bagging_temperature': 0.8521570487431098, 'random_strength': 4.9169222913085555, 'grow_policy': 'Lossguide', 'min_data_in_leaf': 471, 'max_leaves': 140}. Best is trial 684 with value: 198.81639474308358.[0m
[32m[I 2024-10-13 14:52:56,170][0m Trial 927 finished with value: 332.3080667585903 and parameters: {'depth': 7, 'learning_rate': 0.005049930311447125, 'iterations': 478, 'l2_leaf_reg': 4.013415786739317, 'border_count': 68, 'bagging_temperature': 0.8143967338660859, 'random_strength': 4.247798697880752, 'grow_policy': 'Lossguide', 'min_data_in_leaf': 521, 'max_leaves': 199}. Best is trial 684 with value: 198.81639474308358.[0m
[32m[I 2024-10-13 14:52:58,810][0m Trial 928 finished with value: 218.92136451963134 and parameters: {'depth': 7, 'learning_rate': 0.0026440798513279163, 'iterations': 2819, 'l2_leaf_reg': 6.572643484122, 'border_count': 217, 'bagging_temperature': 0.7815168557697194, 'random_strength': 4.720584782636354, 'grow_policy': 'Lossguide', 'min_data_in_leaf': 486, 'max_leaves': 133}. Best is trial 684 with value: 198.81639474308358.[0m
[32m[I 2024-10-13 14:52:59,529][0m Trial 929 finished with value: 590.3647479293361 and parameters: {'depth': 7, 'learning_rate': 0.0037393554819522, 'iterations': 204, 'l2_leaf_reg': 4.840452029285695, 'border_count': 33, 'bagging_temperature': 0.8294680468487362, 'random_strength': 4.507391085088135, 'grow_policy': 'Lossguide', 'min_data_in_leaf': 557, 'max_leaves': 122}. Best is trial 684 with value: 198.81639474308358.[0m
[32m[I 2024-10-13 14:53:23,452][0m Trial 930 finished with value: 296.2214242330634 and parameters: {'depth': 8, 'learning_rate': 0.004257724244555824, 'iterations': 2942, 'l2_leaf_reg': 2.2266680749407866, 'border_count': 49, 'bagging_temperature': 0.7567186431228321, 'random_strength': 4.039156615057778, 'grow_policy': 'SymmetricTree', 'min_data_in_leaf': 451}. Best is trial 684 with value: 198.81639474308358.[0m
[32m[I 2024-10-13 14:53:26,050][0m Trial 931 finished with value: 201.30411853034255 and parameters: {'depth': 7, 'learning_rate': 0.0033357364445727243, 'iterations': 2874, 'l2_leaf_reg': 9.958020198583872, 'border_count': 37, 'bagging_temperature': 0.7288659538893848, 'random_strength': 4.9735145265434255, 'grow_policy': 'Lossguide', 'min_data_in_leaf': 508, 'max_leaves': 153}. Best is trial 684 with value: 198.81639474308358.[0m
[32m[I 2024-10-13 14:53:28,797][0m Trial 932 finished with value: 206.0370355802479 and parameters: {'depth': 7, 'learning_rate': 0.002701634765175924, 'iterations': 2951, 'l2_leaf_reg': 9.992739095545918, 'border_count': 44, 'bagging_temperature': 0.8003431328392738, 'random_strength': 4.32223044651662, 'grow_policy': 'Lossguide', 'min_data_in_leaf': 535, 'max_leaves': 116}. Best is trial 684 with value: 198.81639474308358.[0m
[32m[I 2024-10-13 14:53:31,586][0m Trial 933 finished with value: 218.74288056863344 and parameters: {'depth': 8, 'learning_rate': 0.004828106110340865, 'iterations': 2999, 'l2_leaf_reg': 6.919091560545586, 'border_count': 31, 'bagging_temperature': 0.4240432460683215, 'random_strength': 4.597301553408971, 'grow_policy': 'Lossguide', 'min_data_in_leaf': 498, 'max_leaves': 137}. Best is trial 684 with value: 198.81639474308358.[0m
[32m[I 2024-10-13 14:53:34,298][0m Trial 934 finished with value: 536.6385409058984 and parameters: {'depth': 7, 'learning_rate': 0.0003130763554430415, 'iterations': 3000, 'l2_leaf_reg': 0.08630898509571683, 'border_count': 100, 'bagging_temperature': 0.8506279876922475, 'random_strength': 5.183973000249711, 'grow_policy': 'Lossguide', 'min_data_in_leaf': 470, 'max_leaves': 125}. Best is trial 684 with value: 198.81639474308358.[0m
[32m[I 2024-10-13 14:53:37,099][0m Trial 935 finished with value: 223.8190443394189 and parameters: {'depth': 9, 'learning_rate': 0.0038248170310239984, 'iterations': 2903, 'l2_leaf_reg': 3.611258281298959, 'border_count': 147, 'bagging_temperature': 0.7693828039526894, 'random_strength': 3.2801742680922756, 'grow_policy': 'Lossguide', 'min_data_in_leaf': 519, 'max_leaves': 143}. Best is trial 684 with value: 198.81639474308358.[0m
[32m[I 2024-10-13 14:53:39,733][0m Trial 936 finished with value: 207.8315502587458 and parameters: {'depth': 7, 'learning_rate': 0.003096631403631508, 'iterations': 2809, 'l2_leaf_reg': 6.837309321541763, 'border_count': 61, 'bagging_temperature': 0.7117589509094661, 'random_strength': 4.009390634307525, 'grow_policy': 'Lossguide', 'min_data_in_leaf': 487, 'max_leaves': 132}. Best is trial 684 with value: 198.81639474308358.[0m
[32m[I 2024-10-13 14:53:42,426][0m Trial 937 finished with value: 215.53110633622282 and parameters: {'depth': 8, 'learning_rate': 0.004107731055571987, 'iterations': 2907, 'l2_leaf_reg': 4.3311798421549454, 'border_count': 53, 'bagging_temperature': 0.8231443214058481, 'random_strength': 4.764935745996637, 'grow_policy': 'Lossguide', 'min_data_in_leaf': 528, 'max_leaves': 137}. Best is trial 684 with value: 198.81639474308358.[0m
[32m[I 2024-10-13 14:53:45,094][0m Trial 938 finished with value: 248.50594621665363 and parameters: {'depth': 7, 'learning_rate': 0.018078533974707992, 'iterations': 2858, 'l2_leaf_reg': 6.687159364961096, 'border_count': 41, 'bagging_temperature': 0.7877147448743006, 'random_strength': 4.4373458830877555, 'grow_policy': 'Lossguide', 'min_data_in_leaf': 450, 'max_leaves': 148}. Best is trial 684 with value: 198.81639474308358.[0m
[32m[I 2024-10-13 14:53:46,469][0m Trial 939 finished with value: 211.11019402644698 and parameters: {'depth': 7, 'learning_rate': 0.005508364646310262, 'iterations': 1188, 'l2_leaf_reg': 5.082096768534689, 'border_count': 36, 'bagging_temperature': 0.7447224853105252, 'random_strength': 4.218127819296243, 'grow_policy': 'Lossguide', 'min_data_in_leaf': 554, 'max_leaves': 127}. Best is trial 684 with value: 198.81639474308358.[0m
[32m[I 2024-10-13 14:53:49,130][0m Trial 940 finished with value: 200.43998392266693 and parameters: {'depth': 8, 'learning_rate': 0.0035066480349505895, 'iterations': 2941, 'l2_leaf_reg': 6.786606386274972, 'border_count': 47, 'bagging_temperature': 0.8486280325166558, 'random_strength': 4.5276227552742405, 'grow_policy': 'Lossguide', 'min_data_in_leaf': 503, 'max_leaves': 141}. Best is trial 684 with value: 198.81639474308358.[0m
[32m[I 2024-10-13 14:53:51,889][0m Trial 941 finished with value: 221.16535536937675 and parameters: {'depth': 7, 'learning_rate': 0.0025987500682278114, 'iterations': 2948, 'l2_leaf_reg': 0.03347504074668409, 'border_count': 31, 'bagging_temperature': 0.7595875801468466, 'random_strength': 4.875122835832746, 'grow_policy': 'Lossguide', 'min_data_in_leaf': 481, 'max_leaves': 134}. Best is trial 684 with value: 198.81639474308358.[0m
[32m[I 2024-10-13 14:53:52,668][0m Trial 942 finished with value: 457.96902406394435 and parameters: {'depth': 8, 'learning_rate': 0.00445143350580244, 'iterations': 305, 'l2_leaf_reg': 2.7023997147374352, 'border_count': 42, 'bagging_temperature': 0.8089461005258987, 'random_strength': 3.6445173398560393, 'grow_policy': 'Lossguide', 'min_data_in_leaf': 537, 'max_leaves': 114}. Best is trial 684 with value: 198.81639474308358.[0m
[32m[I 2024-10-13 14:53:55,377][0m Trial 943 finished with value: 208.95625975664726 and parameters: {'depth': 7, 'learning_rate': 0.0031143118314164394, 'iterations': 2864, 'l2_leaf_reg': 6.96278642494852, 'border_count': 51, 'bagging_temperature': 0.6921643782561508, 'random_strength': 3.8562138341616485, 'grow_policy': 'Lossguide', 'min_data_in_leaf': 512, 'max_leaves': 130}. Best is trial 684 with value: 198.81639474308358.[0m
[32m[I 2024-10-13 14:53:58,261][0m Trial 944 finished with value: 233.08646964192488 and parameters: {'depth': 7, 'learning_rate': 0.005979314025955277, 'iterations': 2948, 'l2_leaf_reg': 4.64387272538892, 'border_count': 37, 'bagging_temperature': 0.10253450396387975, 'random_strength': 4.231767623700514, 'grow_policy': 'Lossguide', 'min_data_in_leaf': 494, 'max_leaves': 139}. Best is trial 684 with value: 198.81639474308358.[0m
[32m[I 2024-10-13 14:54:01,102][0m Trial 945 finished with value: 204.17140878206501 and parameters: {'depth': 7, 'learning_rate': 0.0036599932654500598, 'iterations': 3000, 'l2_leaf_reg': 6.4379348959243154, 'border_count': 32, 'bagging_temperature': 0.7791480662138319, 'random_strength': 4.70894753810064, 'grow_policy': 'Lossguide', 'min_data_in_leaf': 473, 'max_leaves': 145}. Best is trial 684 with value: 198.81639474308358.[0m
[32m[I 2024-10-13 14:54:03,913][0m Trial 946 finished with value: 232.37590079263785 and parameters: {'depth': 7, 'learning_rate': 0.0042358282801154435, 'iterations': 2902, 'l2_leaf_reg': 1.4331923265332132, 'border_count': 56, 'bagging_temperature': 0.7284987620878329, 'random_strength': 3.9996197754898173, 'grow_policy': 'Lossguide', 'min_data_in_leaf': 514, 'max_leaves': 122}. Best is trial 684 with value: 198.81639474308358.[0m
[32m[I 2024-10-13 14:54:06,598][0m Trial 947 finished with value: 201.9632418243216 and parameters: {'depth': 8, 'learning_rate': 0.0029881211806104657, 'iterations': 2852, 'l2_leaf_reg': 9.913911208021627, 'border_count': 44, 'bagging_temperature': 0.8315795644535483, 'random_strength': 4.426413756272935, 'grow_policy': 'Lossguide', 'min_data_in_leaf': 451, 'max_leaves': 135}. Best is trial 684 with value: 198.81639474308358.[0m
[32m[I 2024-10-13 14:54:09,279][0m Trial 948 finished with value: 219.16877989768062 and parameters: {'depth': 7, 'learning_rate': 0.005086119456181373, 'iterations': 2803, 'l2_leaf_reg': 3.3941975077692663, 'border_count': 39, 'bagging_temperature': 0.7446964248149444, 'random_strength': 5.042713377984792, 'grow_policy': 'Lossguide', 'min_data_in_leaf': 558, 'max_leaves': 126}. Best is trial 684 with value: 198.81639474308358.[0m
[32m[I 2024-10-13 14:54:11,976][0m Trial 949 finished with value: 211.68216040584971 and parameters: {'depth': 8, 'learning_rate': 0.0035825516942439087, 'iterations': 2945, 'l2_leaf_reg': 9.974868572289548, 'border_count': 76, 'bagging_temperature': 0.7960612267652601, 'random_strength': 4.123302821122088, 'grow_policy': 'Lossguide', 'min_data_in_leaf': 536, 'max_leaves': 150}. Best is trial 684 with value: 198.81639474308358.[0m
[32m[I 2024-10-13 14:54:14,661][0m Trial 950 finished with value: 209.7761438119661 and parameters: {'depth': 7, 'learning_rate': 0.004473922637556074, 'iterations': 2903, 'l2_leaf_reg': 5.29054142122284, 'border_count': 48, 'bagging_temperature': 0.7605867136304573, 'random_strength': 4.578569231225841, 'grow_policy': 'Lossguide', 'min_data_in_leaf': 499, 'max_leaves': 131}. Best is trial 684 with value: 198.81639474308358.[0m
[32m[I 2024-10-13 14:54:35,679][0m Trial 951 finished with value: 292.9775493050099 and parameters: {'depth': 7, 'learning_rate': 0.0033823060420789274, 'iterations': 3000, 'l2_leaf_reg': 6.772200286166088, 'border_count': 31, 'bagging_temperature': 0.8565972849399939, 'random_strength': 4.351205526959819, 'grow_policy': 'SymmetricTree', 'min_data_in_leaf': 465}. Best is trial 684 with value: 198.81639474308358.[0m
[32m[I 2024-10-13 14:54:38,323][0m Trial 952 finished with value: 207.13479174124706 and parameters: {'depth': 8, 'learning_rate': 0.0026781670439648235, 'iterations': 2944, 'l2_leaf_reg': 4.55315422449189, 'border_count': 36, 'bagging_temperature': 0.7165158273382706, 'random_strength': 4.846341357858968, 'grow_policy': 'Lossguide', 'min_data_in_leaf': 521, 'max_leaves': 142}. Best is trial 684 with value: 198.81639474308358.[0m
