[32m[I 2024-10-13 14:45:15,263][0m Trial 803 finished with value: 215.06727829414902 and parameters: {'depth': 8, 'learning_rate': 0.004237981800148013, 'iterations': 2888, 'l2_leaf_reg': 3.133798903032383, 'border_count': 38, 'bagging_temperature': 0.7185899476599973, 'random_strength': 3.9965913758953255, 'grow_policy': 'Lossguide', 'min_data_in_leaf': 495, 'max_leaves': 125}. Best is trial 684 with value: 198.81639474308358.[0m
[32m[I 2024-10-13 14:45:36,033][0m Trial 804 finished with value: 298.70170856800036 and parameters: {'depth': 7, 'learning_rate': 0.0031571904184547884, 'iterations': 2860, 'l2_leaf_reg': 6.670228486367787, 'border_count': 44, 'bagging_temperature': 0.7973564111838615, 'random_strength': 4.234433007710371, 'grow_policy': 'SymmetricTree', 'min_data_in_leaf': 537}. Best is trial 684 with value: 198.81639474308358.[0m
[32m[I 2024-10-13 14:45:38,790][0m Trial 805 finished with value: 223.0603677332259 and parameters: {'depth': 7, 'learning_rate': 0.005375706805236606, 'iterations': 2938, 'l2_leaf_reg': 6.433078759735491, 'border_count': 80, 'bagging_temperature': 0.7557494065652369, 'random_strength': 3.2735456095353985, 'grow_policy': 'Lossguide', 'min_data_in_leaf': 475, 'max_leaves': 131}. Best is trial 684 with value: 198.81639474308358.[0m
[32m[I 2024-10-13 14:45:39,624][0m Trial 806 finished with value: 453.0586565342984 and parameters: {'depth': 7, 'learning_rate': 0.0036590341958350724, 'iterations': 397, 'l2_leaf_reg': 4.317036475511532, 'border_count': 113, 'bagging_temperature': 0.8243518397033587, 'random_strength': 4.422133025033771, 'grow_policy': 'Lossguide', 'min_data_in_leaf': 511, 'max_leaves': 146}. Best is trial 684 with value: 198.81639474308358.[0m
[32m[I 2024-10-13 14:45:42,415][0m Trial 807 finished with value: 221.3748148236172 and parameters: {'depth': 7, 'learning_rate': 0.0046395007724277775, 'iterations': 2999, 'l2_leaf_reg': 2.377422005589776, 'border_count': 37, 'bagging_temperature': 0.7783219430707192, 'random_strength': 4.76993915329719, 'grow_policy': 'Lossguide', 'min_data_in_leaf': 491, 'max_leaves': 151}. Best is trial 684 with value: 198.81639474308358.[0m
[32m[I 2024-10-13 14:45:45,224][0m Trial 808 finished with value: 407.66547280635837 and parameters: {'depth': 7, 'learning_rate': 0.0006633183344045534, 'iterations': 2997, 'l2_leaf_reg': 9.897036133334355, 'border_count': 47, 'bagging_temperature': 0.13697788796447685, 'random_strength': 3.603314466668381, 'grow_policy': 'Lossguide', 'min_data_in_leaf': 536, 'max_leaves': 139}. Best is trial 684 with value: 198.81639474308358.[0m
[32m[I 2024-10-13 14:45:47,948][0m Trial 809 finished with value: 201.37526321540545 and parameters: {'depth': 8, 'learning_rate': 0.0032152604854249396, 'iterations': 2905, 'l2_leaf_reg': 9.970576165579256, 'border_count': 39, 'bagging_temperature': 0.7387329447017399, 'random_strength': 5.068673875812364, 'grow_policy': 'Lossguide', 'min_data_in_leaf': 517, 'max_leaves': 175}. Best is trial 684 with value: 198.81639474308358.[0m
[32m[I 2024-10-13 14:45:50,563][0m Trial 810 finished with value: 206.46873962348 and parameters: {'depth': 8, 'learning_rate': 0.004037236355120215, 'iterations': 2860, 'l2_leaf_reg': 6.934259074327317, 'border_count': 60, 'bagging_temperature': 0.835217675932785, 'random_strength': 4.642590566313212, 'grow_policy': 'Lossguide', 'min_data_in_leaf': 463, 'max_leaves': 120}. Best is trial 684 with value: 198.81639474308358.[0m
[32m[I 2024-10-13 14:45:53,319][0m Trial 811 finished with value: 251.9355469093732 and parameters: {'depth': 7, 'learning_rate': 0.003577492333704224, 'iterations': 2945, 'l2_leaf_reg': 0.05676803723000505, 'border_count': 56, 'bagging_temperature': 0.39607030142690597, 'random_strength': 3.844023838808165, 'grow_policy': 'Lossguide', 'min_data_in_leaf': 500, 'max_leaves': 135}. Best is trial 684 with value: 198.81639474308358.[0m
[32m[I 2024-10-13 14:45:56,048][0m Trial 812 finished with value: 217.21479397765506 and parameters: {'depth': 7, 'learning_rate': 0.005081947328190028, 'iterations': 2943, 'l2_leaf_reg': 4.232063037707189, 'border_count': 42, 'bagging_temperature': 0.7979701123602709, 'random_strength': 4.246809507667034, 'grow_policy': 'Lossguide', 'min_data_in_leaf': 479, 'max_leaves': 128}. Best is trial 684 with value: 198.81639474308358.[0m
[32m[I 2024-10-13 14:45:57,380][0m Trial 813 finished with value: 292.9286026182054 and parameters: {'depth': 7, 'learning_rate': 0.0031104331999033136, 'iterations': 1003, 'l2_leaf_reg': 6.58487909043188, 'border_count': 36, 'bagging_temperature': 0.7681581726995852, 'random_strength': 4.450555713660858, 'grow_policy': 'Lossguide', 'min_data_in_leaf': 518, 'max_leaves': 143}. Best is trial 684 with value: 198.81639474308358.[0m
[32m[I 2024-10-13 14:46:00,008][0m Trial 814 finished with value: 212.08607729715885 and parameters: {'depth': 7, 'learning_rate': 0.004373305210051927, 'iterations': 2856, 'l2_leaf_reg': 4.6984821209427, 'border_count': 50, 'bagging_temperature': 0.7178805705964719, 'random_strength': 4.062100112738871, 'grow_policy': 'Lossguide', 'min_data_in_leaf': 487, 'max_leaves': 161}. Best is trial 684 with value: 198.81639474308358.[0m
[32m[I 2024-10-13 14:46:02,676][0m Trial 815 finished with value: 219.9671672209388 and parameters: {'depth': 9, 'learning_rate': 0.003726125282624678, 'iterations': 2947, 'l2_leaf_reg': 2.4783233852323807, 'border_count': 44, 'bagging_temperature': 0.7433663143060092, 'random_strength': 4.864784657133531, 'grow_policy': 'Lossguide', 'min_data_in_leaf': 460, 'max_leaves': 154}. Best is trial 684 with value: 198.81639474308358.[0m
[32m[I 2024-10-13 14:46:05,612][0m Trial 816 finished with value: 200.80537455363384 and parameters: {'depth': 7, 'learning_rate': 0.003064782911917992, 'iterations': 2996, 'l2_leaf_reg': 9.901248743370264, 'border_count': 38, 'bagging_temperature': 0.8153302641654481, 'random_strength': 4.5850508862974735, 'grow_policy': 'Lossguide', 'min_data_in_leaf': 539, 'max_leaves': 133}. Best is trial 684 with value: 198.81639474308358.[0m
[32m[I 2024-10-13 14:46:08,489][0m Trial 817 finished with value: 201.93019813498344 and parameters: {'depth': 8, 'learning_rate': 0.0044817413726068595, 'iterations': 3000, 'l2_leaf_reg': 9.892333035410818, 'border_count': 36, 'bagging_temperature': 0.7863047183565479, 'random_strength': 4.368810222533478, 'grow_policy': 'Lossguide', 'min_data_in_leaf': 503, 'max_leaves': 138}. Best is trial 684 with value: 198.81639474308358.[0m
[32m[I 2024-10-13 14:46:11,256][0m Trial 818 finished with value: 203.5981043316385 and parameters: {'depth': 7, 'learning_rate': 0.0036875490090494613, 'iterations': 2902, 'l2_leaf_reg': 6.489110306801518, 'border_count': 47, 'bagging_temperature': 0.6989835144604026, 'random_strength': 4.173321791493482, 'grow_policy': 'Lossguide', 'min_data_in_leaf': 521, 'max_leaves': 123}. Best is trial 684 with value: 198.81639474308358.[0m
[32m[I 2024-10-13 14:46:14,050][0m Trial 819 finished with value: 230.93084645796984 and parameters: {'depth': 7, 'learning_rate': 0.005195057082214483, 'iterations': 2999, 'l2_leaf_reg': 3.693987687977623, 'border_count': 225, 'bagging_temperature': 0.7605686396391521, 'random_strength': 4.672107621099073, 'grow_policy': 'Lossguide', 'min_data_in_leaf': 478, 'max_leaves': 146}. Best is trial 684 with value: 198.81639474308358.[0m
[32m[I 2024-10-13 14:46:16,660][0m Trial 820 finished with value: 201.63954277168372 and parameters: {'depth': 7, 'learning_rate': 0.003103391071566258, 'iterations': 2888, 'l2_leaf_reg': 6.25779959607263, 'border_count': 34, 'bagging_temperature': 0.8373188907987179, 'random_strength': 4.960481322665341, 'grow_policy': 'Lossguide', 'min_data_in_leaf': 498, 'max_leaves': 130}. Best is trial 684 with value: 198.81639474308358.[0m
[32m[I 2024-10-13 14:46:19,377][0m Trial 821 finished with value: 204.6482831085308 and parameters: {'depth': 8, 'learning_rate': 0.004102740719644762, 'iterations': 2938, 'l2_leaf_reg': 6.489251883738909, 'border_count': 42, 'bagging_temperature': 0.8045941989782206, 'random_strength': 3.9347178234461584, 'grow_policy': 'Lossguide', 'min_data_in_leaf': 455, 'max_leaves': 117}. Best is trial 684 with value: 198.81639474308358.[0m
[32m[I 2024-10-13 14:46:22,162][0m Trial 822 finished with value: 219.96410271833557 and parameters: {'depth': 8, 'learning_rate': 0.0035764767891693955, 'iterations': 3000, 'l2_leaf_reg': 4.5963632458518235, 'border_count': 177, 'bagging_temperature': 0.7712901514846345, 'random_strength': 4.435201494245691, 'grow_policy': 'Lossguide', 'min_data_in_leaf': 538, 'max_leaves': 140}. Best is trial 684 with value: 198.81639474308358.[0m
[32m[I 2024-10-13 14:46:24,920][0m Trial 823 finished with value: 213.2711656258019 and parameters: {'depth': 7, 'learning_rate': 0.004689100595677727, 'iterations': 2900, 'l2_leaf_reg': 6.860748383476685, 'border_count': 52, 'bagging_temperature': 0.7404956261356128, 'random_strength': 4.829024978452898, 'grow_policy': 'Lossguide', 'min_data_in_leaf': 512, 'max_leaves': 136}. Best is trial 684 with value: 198.81639474308358.[0m
[32m[I 2024-10-13 14:46:27,596][0m Trial 824 finished with value: 224.9276060094873 and parameters: {'depth': 8, 'learning_rate': 0.005543168432134522, 'iterations': 2845, 'l2_leaf_reg': 3.3444654517293744, 'border_count': 39, 'bagging_temperature': 0.5409766417505887, 'random_strength': 4.281655882414448, 'grow_policy': 'Lossguide', 'min_data_in_leaf': 478, 'max_leaves': 125}. Best is trial 684 with value: 198.81639474308358.[0m
[32m[I 2024-10-13 14:46:49,009][0m Trial 825 finished with value: 315.9162711603307 and parameters: {'depth': 7, 'learning_rate': 0.002910648697609375, 'iterations': 2932, 'l2_leaf_reg': 9.97910251716436, 'border_count': 35, 'bagging_temperature': 0.8309955662594934, 'random_strength': 4.593449221830576, 'grow_policy': 'SymmetricTree', 'min_data_in_leaf': 494}. Best is trial 684 with value: 198.81639474308358.[0m
[32m[I 2024-10-13 14:46:51,651][0m Trial 826 finished with value: 200.12839579323932 and parameters: {'depth': 7, 'learning_rate': 0.004062403391016243, 'iterations': 2951, 'l2_leaf_reg': 9.92733056571527, 'border_count': 46, 'bagging_temperature': 0.6637861174457528, 'random_strength': 3.774213126812743, 'grow_policy': 'Lossguide', 'min_data_in_leaf': 528, 'max_leaves': 144}. Best is trial 684 with value: 198.81639474308358.[0m
[32m[I 2024-10-13 14:46:54,341][0m Trial 827 finished with value: 201.5634474091789 and parameters: {'depth': 7, 'learning_rate': 0.004263549785493548, 'iterations': 2864, 'l2_leaf_reg': 9.935306884118868, 'border_count': 42, 'bagging_temperature': 0.6561224144096891, 'random_strength': 3.4327618787038454, 'grow_policy': 'Lossguide', 'min_data_in_leaf': 540, 'max_leaves': 147}. Best is trial 684 with value: 198.81639474308358.[0m
[32m[I 2024-10-13 14:46:57,054][0m Trial 828 finished with value: 217.81053773196524 and parameters: {'depth': 7, 'learning_rate': 0.005105038032610316, 'iterations': 2936, 'l2_leaf_reg': 4.89073027440718, 'border_count': 36, 'bagging_temperature': 0.6804517046361499, 'random_strength': 3.7811127665980737, 'grow_policy': 'Lossguide', 'min_data_in_leaf': 525, 'max_leaves': 153}. Best is trial 684 with value: 198.81639474308358.[0m
[32m[I 2024-10-13 14:46:59,760][0m Trial 829 finished with value: 216.69134207304123 and parameters: {'depth': 8, 'learning_rate': 0.004179112796163154, 'iterations': 2850, 'l2_leaf_reg': 6.329883530130974, 'border_count': 204, 'bagging_temperature': 0.6990767309279003, 'random_strength': 3.6347252523685167, 'grow_policy': 'Lossguide', 'min_data_in_leaf': 536, 'max_leaves': 142}. Best is trial 684 with value: 198.81639474308358.[0m
[32m[I 2024-10-13 14:47:02,470][0m Trial 830 finished with value: 235.2789253855259 and parameters: {'depth': 7, 'learning_rate': 0.005556209657085347, 'iterations': 2948, 'l2_leaf_reg': 2.2290524989747182, 'border_count': 45, 'bagging_temperature': 0.6150996292557335, 'random_strength': 4.031213939956573, 'grow_policy': 'Lossguide', 'min_data_in_leaf': 515, 'max_leaves': 150}. Best is trial 684 with value: 198.81639474308358.[0m
[32m[I 2024-10-13 14:47:05,163][0m Trial 831 finished with value: 210.78220464095347 and parameters: {'depth': 7, 'learning_rate': 0.00377138424131288, 'iterations': 2894, 'l2_leaf_reg': 4.839448693858463, 'border_count': 33, 'bagging_temperature': 0.5736095422578685, 'random_strength': 3.5340347215966874, 'grow_policy': 'Lossguide', 'min_data_in_leaf': 501, 'max_leaves': 145}. Best is trial 684 with value: 198.81639474308358.[0m
[32m[I 2024-10-13 14:47:07,950][0m Trial 832 finished with value: 214.52245287137822 and parameters: {'depth': 8, 'learning_rate': 0.004758537530340203, 'iterations': 3000, 'l2_leaf_reg': 6.584828908806962, 'border_count': 41, 'bagging_temperature': 0.4962174737924093, 'random_strength': 3.7834053626461133, 'grow_policy': 'Lossguide', 'min_data_in_leaf': 525, 'max_leaves': 158}. Best is trial 684 with value: 198.81639474308358.[0m
[32m[I 2024-10-13 14:47:10,680][0m Trial 833 finished with value: 210.91141404048622 and parameters: {'depth': 7, 'learning_rate': 0.0034467016884470706, 'iterations': 2907, 'l2_leaf_reg': 3.211750506831376, 'border_count': 33, 'bagging_temperature': 0.7140489921259531, 'random_strength': 3.224370324410583, 'grow_policy': 'Lossguide', 'min_data_in_leaf': 548, 'max_leaves': 139}. Best is trial 684 with value: 198.81639474308358.[0m
[32m[I 2024-10-13 14:47:13,443][0m Trial 834 finished with value: 199.59713091866524 and parameters: {'depth': 7, 'learning_rate': 0.004126674960176395, 'iterations': 2943, 'l2_leaf_reg': 9.879875923383828, 'border_count': 46, 'bagging_temperature': 0.7391942623049623, 'random_strength': 4.11205240920984, 'grow_policy': 'Lossguide', 'min_data_in_leaf': 509, 'max_leaves': 143}. Best is trial 684 with value: 198.81639474308358.[0m
[32m[I 2024-10-13 14:47:16,085][0m Trial 835 finished with value: 211.81138397187962 and parameters: {'depth': 9, 'learning_rate': 0.004690268125001851, 'iterations': 2852, 'l2_leaf_reg': 6.700717510319713, 'border_count': 58, 'bagging_temperature': 0.6688190568886803, 'random_strength': 3.9537984106392674, 'grow_policy': 'Lossguide', 'min_data_in_leaf': 517, 'max_leaves': 181}. Best is trial 684 with value: 198.81639474308358.[0m
[32m[I 2024-10-13 14:47:18,864][0m Trial 836 finished with value: 218.94722741129993 and parameters: {'depth': 7, 'learning_rate': 0.004271378173792006, 'iterations': 2940, 'l2_leaf_reg': 4.481826335433285, 'border_count': 54, 'bagging_temperature': 0.7243965292076064, 'random_strength': 3.693253592036197, 'grow_policy': 'Lossguide', 'min_data_in_leaf': 531, 'max_leaves': 135}. Best is trial 684 with value: 198.81639474308358.[0m
[32m[I 2024-10-13 14:47:21,562][0m Trial 837 finished with value: 204.8968067631209 and parameters: {'depth': 7, 'learning_rate': 0.005751276766762183, 'iterations': 2845, 'l2_leaf_reg': 9.88668255681369, 'border_count': 49, 'bagging_temperature': 0.831763768271053, 'random_strength': 4.076379066674474, 'grow_policy': 'Lossguide', 'min_data_in_leaf': 546, 'max_leaves': 128}. Best is trial 684 with value: 198.81639474308358.[0m
[32m[I 2024-10-13 14:47:24,250][0m Trial 838 finished with value: 205.05844712433355 and parameters: {'depth': 7, 'learning_rate': 0.00405705364862995, 'iterations': 2906, 'l2_leaf_reg': 6.341470687654177, 'border_count': 45, 'bagging_temperature': 0.7579936111181845, 'random_strength': 4.1404878746045135, 'grow_policy': 'Lossguide', 'min_data_in_leaf': 506, 'max_leaves': 140}. Best is trial 684 with value: 198.81639474308358.[0m
[32m[I 2024-10-13 14:47:26,999][0m Trial 839 finished with value: 203.1384294338673 and parameters: {'depth': 8, 'learning_rate': 0.0051007845511769215, 'iterations': 2946, 'l2_leaf_reg': 9.960019596734144, 'border_count': 48, 'bagging_temperature': 0.7254973039408033, 'random_strength': 5.170545892585713, 'grow_policy': 'Lossguide', 'min_data_in_leaf': 511, 'max_leaves': 134}. Best is trial 684 with value: 198.81639474308358.[0m
[32m[I 2024-10-13 14:47:29,867][0m Trial 840 finished with value: 205.40378632929273 and parameters: {'depth': 8, 'learning_rate': 0.003997649976059887, 'iterations': 2855, 'l2_leaf_reg': 9.990715004521775, 'border_count': 55, 'bagging_temperature': 0.8136519695309716, 'random_strength': 3.8246659309713555, 'grow_policy': 'Lossguide', 'min_data_in_leaf': 487, 'max_leaves': 142}. Best is trial 684 with value: 198.81639474308358.[0m
[32m[I 2024-10-13 14:47:32,593][0m Trial 841 finished with value: 215.3833885116488 and parameters: {'depth': 7, 'learning_rate': 0.004714195011291983, 'iterations': 2948, 'l2_leaf_reg': 3.957754050135009, 'border_count': 45, 'bagging_temperature': 0.8402406088782128, 'random_strength': 4.728235634662601, 'grow_policy': 'Lossguide', 'min_data_in_leaf': 531, 'max_leaves': 129}. Best is trial 684 with value: 198.81639474308358.[0m
[32m[I 2024-10-13 14:47:35,287][0m Trial 842 finished with value: 214.6087288980635 and parameters: {'depth': 7, 'learning_rate': 0.005711789767093299, 'iterations': 2894, 'l2_leaf_reg': 6.601009118732675, 'border_count': 63, 'bagging_temperature': 0.7956279753924898, 'random_strength': 4.25475687497029, 'grow_policy': 'Lossguide', 'min_data_in_leaf': 508, 'max_leaves': 137}. Best is trial 684 with value: 198.81639474308358.[0m
[32m[I 2024-10-13 14:47:38,114][0m Trial 843 finished with value: 208.90005759662031 and parameters: {'depth': 7, 'learning_rate': 0.0036140484077105198, 'iterations': 2999, 'l2_leaf_reg': 4.713286023550287, 'border_count': 40, 'bagging_temperature': 0.6473234469463348, 'random_strength': 5.010923752155419, 'grow_policy': 'Lossguide', 'min_data_in_leaf': 487, 'max_leaves': 121}. Best is trial 684 with value: 198.81639474308358.[0m
[32m[I 2024-10-13 14:47:40,813][0m Trial 844 finished with value: 221.19748064483244 and parameters: {'depth': 7, 'learning_rate': 0.00413120742924646, 'iterations': 2945, 'l2_leaf_reg': 2.7882129780134597, 'border_count': 49, 'bagging_temperature': 0.6958311588156534, 'random_strength': 4.594277591380373, 'grow_policy': 'Lossguide', 'min_data_in_leaf': 548, 'max_leaves': 148}. Best is trial 684 with value: 198.81639474308358.[0m
[32m[I 2024-10-13 14:47:43,448][0m Trial 845 finished with value: 202.33538475541815 and parameters: {'depth': 8, 'learning_rate': 0.003194323952255677, 'iterations': 2895, 'l2_leaf_reg': 6.444512163425405, 'border_count': 43, 'bagging_temperature': 0.7569599387209028, 'random_strength': 3.969172580615021, 'grow_policy': 'Lossguide', 'min_data_in_leaf': 461, 'max_leaves': 164}. Best is trial 684 with value: 198.81639474308358.[0m
[32m[I 2024-10-13 14:47:59,235][0m Trial 846 finished with value: 277.899464174629 and parameters: {'depth': 7, 'learning_rate': 0.004794699028293273, 'iterations': 2842, 'l2_leaf_reg': 0.009606596856675266, 'border_count': 52, 'bagging_temperature': 0.7366991949901107, 'random_strength': 4.162496174243836, 'grow_policy': 'SymmetricTree', 'min_data_in_leaf': 522}. Best is trial 684 with value: 198.81639474308358.[0m
[32m[I 2024-10-13 14:48:01,972][0m Trial 847 finished with value: 217.12430284432878 and parameters: {'depth': 8, 'learning_rate': 0.00299430494780088, 'iterations': 2940, 'l2_leaf_reg': 4.845386359660715, 'border_count': 243, 'bagging_temperature': 0.8180810135542862, 'random_strength': 4.49472005533253, 'grow_policy': 'Lossguide', 'min_data_in_leaf': 480, 'max_leaves': 126}. Best is trial 684 with value: 198.81639474308358.[0m
[32m[I 2024-10-13 14:48:04,684][0m Trial 848 finished with value: 202.64820856114366 and parameters: {'depth': 7, 'learning_rate': 0.0037686582657194393, 'iterations': 2950, 'l2_leaf_reg': 7.162230241852725, 'border_count': 39, 'bagging_temperature': 0.7793627943470149, 'random_strength': 3.552930893422198, 'grow_policy': 'Lossguide', 'min_data_in_leaf': 501, 'max_leaves': 133}. Best is trial 684 with value: 198.81639474308358.[0m
[32m[I 2024-10-13 14:48:07,390][0m Trial 849 finished with value: 223.73678138499878 and parameters: {'depth': 7, 'learning_rate': 0.0054837498154298265, 'iterations': 2899, 'l2_leaf_reg': 3.2171370306350466, 'border_count': 45, 'bagging_temperature': 0.802763408718896, 'random_strength': 4.886899195638146, 'grow_policy': 'Lossguide', 'min_data_in_leaf': 529, 'max_leaves': 143}. Best is trial 684 with value: 198.81639474308358.[0m
[32m[I 2024-10-13 14:48:10,150][0m Trial 850 finished with value: 205.38236608528518 and parameters: {'depth': 7, 'learning_rate': 0.0044226684109428165, 'iterations': 2998, 'l2_leaf_reg': 7.026939128286897, 'border_count': 38, 'bagging_temperature': 0.8302931343921869, 'random_strength': 4.352885738176496, 'grow_policy': 'Lossguide', 'min_data_in_leaf': 542, 'max_leaves': 137}. Best is trial 684 with value: 198.81639474308358.[0m
[32m[I 2024-10-13 14:48:12,818][0m Trial 851 finished with value: 203.91976001788123 and parameters: {'depth': 9, 'learning_rate': 0.0036041980124908173, 'iterations': 2844, 'l2_leaf_reg': 6.804465742685584, 'border_count': 33, 'bagging_temperature': 0.7069283602790472, 'random_strength': 4.736186531319475, 'grow_policy': 'Lossguide', 'min_data_in_leaf': 500, 'max_leaves': 131}. Best is trial 684 with value: 198.81639474308358.[0m
[32m[I 2024-10-13 14:48:15,645][0m Trial 852 finished with value: 208.8416589172261 and parameters: {'depth': 8, 'learning_rate': 0.0030406305299157024, 'iterations': 2999, 'l2_leaf_reg': 4.550535953666557, 'border_count': 57, 'bagging_temperature': 0.8434415809550174, 'random_strength': 4.124986968034793, 'grow_policy': 'Lossguide', 'min_data_in_leaf': 453, 'max_leaves': 155}. Best is trial 684 with value: 198.81639474308358.[0m
