[32m[I 2024-10-13 14:27:24,186][0m Trial 453 finished with value: 218.61327854597363 and parameters: {'depth': 4, 'learning_rate': 0.00236368580692891, 'iterations': 2779, 'l2_leaf_reg': 1.6251747752594968e-05, 'border_count': 33, 'bagging_temperature': 0.9798517997975991, 'random_strength': 7.660385541106287, 'grow_policy': 'Lossguide', 'min_data_in_leaf': 438, 'max_leaves': 65}. Best is trial 453 with value: 218.61327854597363.[0m
[32m[I 2024-10-13 14:27:26,802][0m Trial 454 finished with value: 235.46770527501653 and parameters: {'depth': 4, 'learning_rate': 0.0021207924300547356, 'iterations': 2904, 'l2_leaf_reg': 1.574724442330302e-05, 'border_count': 47, 'bagging_temperature': 0.9332841118138792, 'random_strength': 7.735532223721312, 'grow_policy': 'Lossguide', 'min_data_in_leaf': 440, 'max_leaves': 46}. Best is trial 453 with value: 218.61327854597363.[0m
[32m[I 2024-10-13 14:27:29,363][0m Trial 455 finished with value: 228.51704196327773 and parameters: {'depth': 3, 'learning_rate': 0.004634758192347736, 'iterations': 2807, 'l2_leaf_reg': 2.2702539982086152e-05, 'border_count': 40, 'bagging_temperature': 0.9615310187611263, 'random_strength': 7.582055259235788, 'grow_policy': 'Depthwise', 'min_data_in_leaf': 427}. Best is trial 453 with value: 218.61327854597363.[0m
[32m[I 2024-10-13 14:27:31,998][0m Trial 456 finished with value: 246.15347720369567 and parameters: {'depth': 4, 'learning_rate': 0.0031897740166720056, 'iterations': 2858, 'l2_leaf_reg': 1.0115281708241877e-05, 'border_count': 173, 'bagging_temperature': 0.9757536078384068, 'random_strength': 7.845339713785642, 'grow_policy': 'Lossguide', 'min_data_in_leaf': 397, 'max_leaves': 55}. Best is trial 453 with value: 218.61327854597363.[0m
[32m[I 2024-10-13 14:27:38,009][0m Trial 457 finished with value: 303.3821995554422 and parameters: {'depth': 5, 'learning_rate': 0.002719706182459136, 'iterations': 1381, 'l2_leaf_reg': 5.0955929258840235e-05, 'border_count': 33, 'bagging_temperature': 0.9302792447590335, 'random_strength': 7.643413787061033, 'grow_policy': 'SymmetricTree', 'min_data_in_leaf': 29}. Best is trial 453 with value: 218.61327854597363.[0m
[32m[I 2024-10-13 14:27:40,399][0m Trial 458 finished with value: 246.67673762255814 and parameters: {'depth': 4, 'learning_rate': 0.001500074303101165, 'iterations': 2472, 'l2_leaf_reg': 1.6771527343059315e-05, 'border_count': 37, 'bagging_temperature': 0.9511787062951047, 'random_strength': 6.441254706020651, 'grow_policy': 'Lossguide', 'min_data_in_leaf': 424, 'max_leaves': 60}. Best is trial 453 with value: 218.61327854597363.[0m
[32m[I 2024-10-13 14:27:42,820][0m Trial 459 finished with value: 397.2038936769764 and parameters: {'depth': 4, 'learning_rate': 0.2477506756655455, 'iterations': 2580, 'l2_leaf_reg': 3.0020162551497518e-05, 'border_count': 79, 'bagging_temperature': 0.9768063172167785, 'random_strength': 7.2059920747285275, 'grow_policy': 'Lossguide', 'min_data_in_leaf': 435, 'max_leaves': 67}. Best is trial 453 with value: 218.61327854597363.[0m
[32m[I 2024-10-13 14:27:45,150][0m Trial 460 finished with value: 251.16268325817012 and parameters: {'depth': 4, 'learning_rate': 0.0023997823675456164, 'iterations': 2370, 'l2_leaf_reg': 9.942045839257983e-06, 'border_count': 45, 'bagging_temperature': 0.06544317868128202, 'random_strength': 4.388026401504815, 'grow_policy': 'Depthwise', 'min_data_in_leaf': 410}. Best is trial 453 with value: 218.61327854597363.[0m
[32m[I 2024-10-13 14:27:47,470][0m Trial 461 finished with value: 220.78590542919738 and parameters: {'depth': 5, 'learning_rate': 0.0033137224495681833, 'iterations': 2433, 'l2_leaf_reg': 1.6985139120665272e-05, 'border_count': 31, 'bagging_temperature': 0.9155789269544078, 'random_strength': 7.457100744108405, 'grow_policy': 'Lossguide', 'min_data_in_leaf': 454, 'max_leaves': 52}. Best is trial 453 with value: 218.61327854597363.[0m
[32m[I 2024-10-13 14:27:49,852][0m Trial 462 finished with value: 403.7489984031374 and parameters: {'depth': 3, 'learning_rate': 0.0006388970809161759, 'iterations': 2532, 'l2_leaf_reg': 3.6367997087419506e-05, 'border_count': 35, 'bagging_temperature': 0.9539342740814519, 'random_strength': 6.937421634318506, 'grow_policy': 'Lossguide', 'min_data_in_leaf': 378, 'max_leaves': 75}. Best is trial 453 with value: 218.61327854597363.[0m
[32m[I 2024-10-13 14:27:52,329][0m Trial 463 finished with value: 238.03642365842515 and parameters: {'depth': 10, 'learning_rate': 0.001858652026026495, 'iterations': 2618, 'l2_leaf_reg': 6.922282220078119e-06, 'border_count': 43, 'bagging_temperature': 0.9823195056760546, 'random_strength': 7.744543501052914, 'grow_policy': 'Depthwise', 'min_data_in_leaf': 410}. Best is trial 453 with value: 218.61327854597363.[0m
[32m[I 2024-10-13 14:27:55,011][0m Trial 464 finished with value: 224.8875940588433 and parameters: {'depth': 4, 'learning_rate': 0.0037496487656081363, 'iterations': 2788, 'l2_leaf_reg': 2.426838557331272e-05, 'border_count': 31, 'bagging_temperature': 0.9376103885754608, 'random_strength': 7.145174747020904, 'grow_policy': 'Lossguide', 'min_data_in_leaf': 439, 'max_leaves': 63}. Best is trial 453 with value: 218.61327854597363.[0m
[32m[I 2024-10-13 14:27:57,193][0m Trial 465 finished with value: 237.6055685202334 and parameters: {'depth': 4, 'learning_rate': 0.0027302708477312653, 'iterations': 2331, 'l2_leaf_reg': 1.286304929209064e-05, 'border_count': 51, 'bagging_temperature': 0.9703913472738611, 'random_strength': 7.4516580477802465, 'grow_policy': 'Lossguide', 'min_data_in_leaf': 472, 'max_leaves': 67}. Best is trial 453 with value: 218.61327854597363.[0m
[32m[I 2024-10-13 14:27:59,541][0m Trial 466 finished with value: 229.0139354543654 and parameters: {'depth': 5, 'learning_rate': 0.0022037059482345744, 'iterations': 2497, 'l2_leaf_reg': 4.615130519159669e-05, 'border_count': 24, 'bagging_temperature': 0.9557206214834925, 'random_strength': 7.926933817963185, 'grow_policy': 'Lossguide', 'min_data_in_leaf': 393, 'max_leaves': 57}. Best is trial 453 with value: 218.61327854597363.[0m
[32m[I 2024-10-13 14:28:02,051][0m Trial 467 finished with value: 220.91759424846927 and parameters: {'depth': 4, 'learning_rate': 0.00303167672672739, 'iterations': 2642, 'l2_leaf_reg': 2.0955790178576927e-05, 'border_count': 39, 'bagging_temperature': 0.9851343469142693, 'random_strength': 6.7454254415249, 'grow_policy': 'Depthwise', 'min_data_in_leaf': 217}. Best is trial 453 with value: 218.61327854597363.[0m
[32m[I 2024-10-13 14:28:04,936][0m Trial 468 finished with value: 221.02368616398948 and parameters: {'depth': 4, 'learning_rate': 0.002538138219340103, 'iterations': 2946, 'l2_leaf_reg': 7.563464670059191e-05, 'border_count': 29, 'bagging_temperature': 0.9297139663388584, 'random_strength': 7.243402175045428, 'grow_policy': 'Lossguide', 'min_data_in_leaf': 360, 'max_leaves': 72}. Best is trial 453 with value: 218.61327854597363.[0m
[32m[I 2024-10-13 14:28:07,393][0m Trial 469 finished with value: 220.65504766075003 and parameters: {'depth': 3, 'learning_rate': 0.0036136328871660146, 'iterations': 2423, 'l2_leaf_reg': 1.0058468372136517e-05, 'border_count': 33, 'bagging_temperature': 0.9677023183716066, 'random_strength': 3.369183397690585, 'grow_policy': 'Lossguide', 'min_data_in_leaf': 443, 'max_leaves': 51}. Best is trial 453 with value: 218.61327854597363.[0m
[32m[I 2024-10-13 14:28:09,995][0m Trial 470 finished with value: 220.77769351902035 and parameters: {'depth': 5, 'learning_rate': 0.002227998826794433, 'iterations': 2566, 'l2_leaf_reg': 2.7916330701749556e-05, 'border_count': 41, 'bagging_temperature': 0.9992214941061438, 'random_strength': 7.604707738321442, 'grow_policy': 'Lossguide', 'min_data_in_leaf': 417, 'max_leaves': 78}. Best is trial 453 with value: 218.61327854597363.[0m
[32m[I 2024-10-13 14:28:12,700][0m Trial 471 finished with value: 228.94536478663088 and parameters: {'depth': 4, 'learning_rate': 0.004671171243825541, 'iterations': 2757, 'l2_leaf_reg': 1.5026204912600288e-05, 'border_count': 36, 'bagging_temperature': 0.904743008521453, 'random_strength': 7.33885699795779, 'grow_policy': 'Depthwise', 'min_data_in_leaf': 200}. Best is trial 453 with value: 218.61327854597363.[0m
[32m[I 2024-10-13 14:28:15,046][0m Trial 472 finished with value: 237.67535884066496 and parameters: {'depth': 4, 'learning_rate': 0.003030526558407129, 'iterations': 2471, 'l2_leaf_reg': 6.02703177387951e-06, 'border_count': 60, 'bagging_temperature': 0.9505920216412279, 'random_strength': 7.004612192660903, 'grow_policy': 'Lossguide', 'min_data_in_leaf': 466, 'max_leaves': 61}. Best is trial 453 with value: 218.61327854597363.[0m
[32m[I 2024-10-13 14:28:17,606][0m Trial 473 finished with value: 233.28864300372132 and parameters: {'depth': 5, 'learning_rate': 0.001873237780672201, 'iterations': 2665, 'l2_leaf_reg': 3.8239992678049256e-05, 'border_count': 23, 'bagging_temperature': 0.9787321689308418, 'random_strength': 7.534786247189222, 'grow_policy': 'Lossguide', 'min_data_in_leaf': 394, 'max_leaves': 66}. Best is trial 453 with value: 218.61327854597363.[0m
[32m[I 2024-10-13 14:28:20,125][0m Trial 474 finished with value: 221.08667550700736 and parameters: {'depth': 4, 'learning_rate': 0.0025653877617121427, 'iterations': 2529, 'l2_leaf_reg': 0.0013858353972990654, 'border_count': 28, 'bagging_temperature': 0.9377181662130909, 'random_strength': 5.817203374548326, 'grow_policy': 'Lossguide', 'min_data_in_leaf': 237, 'max_leaves': 37}. Best is trial 453 with value: 218.61327854597363.[0m
[32m[I 2024-10-13 14:28:22,568][0m Trial 475 finished with value: 236.33192112396176 and parameters: {'depth': 3, 'learning_rate': 0.003235196593708642, 'iterations': 2594, 'l2_leaf_reg': 6.159444403769967e-05, 'border_count': 46, 'bagging_temperature': 0.9998442060616347, 'random_strength': 0.01371492350910053, 'grow_policy': 'Depthwise', 'min_data_in_leaf': 370}. Best is trial 453 with value: 218.61327854597363.[0m
[32m[I 2024-10-13 14:28:24,204][0m Trial 476 finished with value: 235.83609269901655 and parameters: {'depth': 5, 'learning_rate': 0.0028057438950652644, 'iterations': 1496, 'l2_leaf_reg': 9.566969568078311e-06, 'border_count': 36, 'bagging_temperature': 0.9643348652563746, 'random_strength': 7.74347203035398, 'grow_policy': 'Lossguide', 'min_data_in_leaf': 424, 'max_leaves': 43}. Best is trial 453 with value: 218.61327854597363.[0m
[32m[I 2024-10-13 14:28:26,443][0m Trial 477 finished with value: 221.8813843214855 and parameters: {'depth': 4, 'learning_rate': 0.0037735957631784473, 'iterations': 2403, 'l2_leaf_reg': 1.7641888354479756e-05, 'border_count': 41, 'bagging_temperature': 0.9177825272250321, 'random_strength': 6.802604866277415, 'grow_policy': 'Lossguide', 'min_data_in_leaf': 454, 'max_leaves': 70}. Best is trial 453 with value: 218.61327854597363.[0m
[32m[I 2024-10-13 14:28:35,210][0m Trial 478 finished with value: 315.3392383821255 and parameters: {'depth': 4, 'learning_rate': 0.0021242156969978987, 'iterations': 2480, 'l2_leaf_reg': 2.864872910564244e-05, 'border_count': 16, 'bagging_temperature': 0.9795436560436163, 'random_strength': 7.3428997224742165, 'grow_policy': 'SymmetricTree', 'min_data_in_leaf': 255}. Best is trial 453 with value: 218.61327854597363.[0m
[32m[I 2024-10-13 14:28:37,454][0m Trial 479 finished with value: 228.36630439346797 and parameters: {'depth': 4, 'learning_rate': 0.00567968130800896, 'iterations': 2334, 'l2_leaf_reg': 0.00013957663792915986, 'border_count': 31, 'bagging_temperature': 0.9566327733866722, 'random_strength': 7.103951522631094, 'grow_policy': 'Depthwise', 'min_data_in_leaf': 178}. Best is trial 453 with value: 218.61327854597363.[0m
[32m[I 2024-10-13 14:28:40,004][0m Trial 480 finished with value: 219.66778809762928 and parameters: {'depth': 13, 'learning_rate': 0.00241720622816613, 'iterations': 2708, 'l2_leaf_reg': 1.3835182615498077e-05, 'border_count': 35, 'bagging_temperature': 0.9430442061647977, 'random_strength': 7.985751074917528, 'grow_policy': 'Lossguide', 'min_data_in_leaf': 387, 'max_leaves': 56}. Best is trial 453 with value: 218.61327854597363.[0m
[32m[I 2024-10-13 14:28:42,560][0m Trial 481 finished with value: 219.93705200990777 and parameters: {'depth': 14, 'learning_rate': 0.0023582336422408538, 'iterations': 2850, 'l2_leaf_reg': 1.5721717031104736e-05, 'border_count': 38, 'bagging_temperature': 0.876481201178836, 'random_strength': 7.97683382276592, 'grow_policy': 'Lossguide', 'min_data_in_leaf': 370, 'max_leaves': 55}. Best is trial 453 with value: 218.61327854597363.[0m
[32m[I 2024-10-13 14:28:45,075][0m Trial 482 finished with value: 242.14440833403435 and parameters: {'depth': 12, 'learning_rate': 0.0016486916880601938, 'iterations': 2692, 'l2_leaf_reg': 2.3270693188881484e-05, 'border_count': 47, 'bagging_temperature': 0.892705148911575, 'random_strength': 8.118922204077185, 'grow_policy': 'Lossguide', 'min_data_in_leaf': 395, 'max_leaves': 77}. Best is trial 453 with value: 218.61327854597363.[0m
[32m[I 2024-10-13 14:28:47,688][0m Trial 483 finished with value: 238.16555036955532 and parameters: {'depth': 5, 'learning_rate': 0.0018837295062051824, 'iterations': 2764, 'l2_leaf_reg': 4.349759882469571e-05, 'border_count': 43, 'bagging_temperature': 0.9315330650831867, 'random_strength': 6.127867908900445, 'grow_policy': 'Lossguide', 'min_data_in_leaf': 409, 'max_leaves': 48}. Best is trial 453 with value: 218.61327854597363.[0m
[32m[I 2024-10-13 14:28:50,462][0m Trial 484 finished with value: 240.44580389217856 and parameters: {'depth': 14, 'learning_rate': 0.002472382383689218, 'iterations': 2727, 'l2_leaf_reg': 7.576144449634667e-06, 'border_count': 54, 'bagging_temperature': 0.918777954414741, 'random_strength': 8.325648101077679, 'grow_policy': 'Depthwise', 'min_data_in_leaf': 382}. Best is trial 453 with value: 218.61327854597363.[0m
[32m[I 2024-10-13 14:28:53,034][0m Trial 485 finished with value: 221.1533761031086 and parameters: {'depth': 12, 'learning_rate': 0.002069797555437997, 'iterations': 2804, 'l2_leaf_reg': 1.2859021408963513e-05, 'border_count': 36, 'bagging_temperature': 0.9427424641079944, 'random_strength': 8.226704239648331, 'grow_policy': 'Lossguide', 'min_data_in_leaf': 439, 'max_leaves': 63}. Best is trial 453 with value: 218.61327854597363.[0m
[32m[I 2024-10-13 14:28:55,513][0m Trial 486 finished with value: 220.66554352728016 and parameters: {'depth': 6, 'learning_rate': 0.002905044845877302, 'iterations': 2687, 'l2_leaf_reg': 3.0391111373827953e-05, 'border_count': 26, 'bagging_temperature': 0.9511425710455393, 'random_strength': 8.010078583765809, 'grow_policy': 'Lossguide', 'min_data_in_leaf': 340, 'max_leaves': 43}. Best is trial 453 with value: 218.61327854597363.[0m
[32m[I 2024-10-13 14:28:56,563][0m Trial 487 finished with value: 308.8524930237342 and parameters: {'depth': 3, 'learning_rate': 0.0033653671130491054, 'iterations': 721, 'l2_leaf_reg': 5.6719737775308755e-06, 'border_count': 33, 'bagging_temperature': 0.9029057382493569, 'random_strength': 7.889080483585907, 'grow_policy': 'Lossguide', 'min_data_in_leaf': 354, 'max_leaves': 57}. Best is trial 453 with value: 218.61327854597363.[0m
[32m[I 2024-10-13 14:28:59,332][0m Trial 488 finished with value: 226.21685631340685 and parameters: {'depth': 13, 'learning_rate': 0.004303084393191594, 'iterations': 2743, 'l2_leaf_reg': 5.846523855230807e-05, 'border_count': 40, 'bagging_temperature': 0.9278119981273956, 'random_strength': 7.78358466121691, 'grow_policy': 'Depthwise', 'min_data_in_leaf': 414}. Best is trial 453 with value: 218.61327854597363.[0m
[32m[I 2024-10-13 14:29:01,799][0m Trial 489 finished with value: 220.00189048936838 and parameters: {'depth': 5, 'learning_rate': 0.00235666851110239, 'iterations': 2623, 'l2_leaf_reg': 1.946856336264357e-05, 'border_count': 35, 'bagging_temperature': 0.9519436196713964, 'random_strength': 7.644077454545842, 'grow_policy': 'Lossguide', 'min_data_in_leaf': 390, 'max_leaves': 73}. Best is trial 453 with value: 218.61327854597363.[0m
[32m[I 2024-10-13 14:29:04,393][0m Trial 490 finished with value: 243.02094670294747 and parameters: {'depth': 6, 'learning_rate': 0.001556534726615119, 'iterations': 2837, 'l2_leaf_reg': 9.915976986408985e-06, 'border_count': 50, 'bagging_temperature': 0.9725289877018197, 'random_strength': 7.4302783707668505, 'grow_policy': 'Lossguide', 'min_data_in_leaf': 433, 'max_leaves': 52}. Best is trial 453 with value: 218.61327854597363.[0m
[32m[I 2024-10-13 14:29:06,951][0m Trial 491 finished with value: 220.68780543463083 and parameters: {'depth': 5, 'learning_rate': 0.002647061417773409, 'iterations': 2662, 'l2_leaf_reg': 9.673010928925824e-05, 'border_count': 28, 'bagging_temperature': 0.9675616532475755, 'random_strength': 6.628846530688951, 'grow_policy': 'Depthwise', 'min_data_in_leaf': 373}. Best is trial 453 with value: 218.61327854597363.[0m
[32m[I 2024-10-13 14:29:09,403][0m Trial 492 finished with value: 263.83310485322784 and parameters: {'depth': 13, 'learning_rate': 0.0020084468650110477, 'iterations': 2570, 'l2_leaf_reg': 3.4923289711013044e-05, 'border_count': 21, 'bagging_temperature': 0.17530920708379505, 'random_strength': 7.122220031789166, 'grow_policy': 'Lossguide', 'min_data_in_leaf': 492, 'max_leaves': 82}. Best is trial 453 with value: 218.61327854597363.[0m
[32m[I 2024-10-13 14:29:11,889][0m Trial 493 finished with value: 236.61690537555563 and parameters: {'depth': 3, 'learning_rate': 0.0030858042825775865, 'iterations': 2613, 'l2_leaf_reg': 1.4947388778970956e-05, 'border_count': 44, 'bagging_temperature': 0.9424284005991047, 'random_strength': 7.726200717764888, 'grow_policy': 'Lossguide', 'min_data_in_leaf': 462, 'max_leaves': 69}. Best is trial 453 with value: 218.61327854597363.[0m
[32m[I 2024-10-13 14:29:14,424][0m Trial 494 finished with value: 224.60942987451816 and parameters: {'depth': 4, 'learning_rate': 0.003958429461635819, 'iterations': 2699, 'l2_leaf_reg': 4.313397314213421e-06, 'border_count': 34, 'bagging_temperature': 0.9129628392017357, 'random_strength': 6.892423742457145, 'grow_policy': 'Lossguide', 'min_data_in_leaf': 418, 'max_leaves': 64}. Best is trial 453 with value: 218.61327854597363.[0m
[32m[I 2024-10-13 14:29:17,023][0m Trial 495 finished with value: 220.1970096449143 and parameters: {'depth': 13, 'learning_rate': 0.002393347922436116, 'iterations': 2558, 'l2_leaf_reg': 0.00020858016842894447, 'border_count': 40, 'bagging_temperature': 0.9811289148377876, 'random_strength': 7.966878381059021, 'grow_policy': 'Depthwise', 'min_data_in_leaf': 400}. Best is trial 453 with value: 218.61327854597363.[0m
[32m[I 2024-10-13 14:29:19,580][0m Trial 496 finished with value: 223.45270275082578 and parameters: {'depth': 4, 'learning_rate': 0.0033713950275640384, 'iterations': 2768, 'l2_leaf_reg': 7.841139312176663e-06, 'border_count': 29, 'bagging_temperature': 0.9640150113755906, 'random_strength': 7.254275336106545, 'grow_policy': 'Lossguide', 'min_data_in_leaf': 448, 'max_leaves': 48}. Best is trial 453 with value: 218.61327854597363.[0m
[32m[I 2024-10-13 14:29:22,177][0m Trial 497 finished with value: 226.5235290975389 and parameters: {'depth': 15, 'learning_rate': 0.002784525671089304, 'iterations': 2879, 'l2_leaf_reg': 2.2363884384238008e-05, 'border_count': 24, 'bagging_temperature': 0.9358554768068742, 'random_strength': 8.232607433964732, 'grow_policy': 'Lossguide', 'min_data_in_leaf': 432, 'max_leaves': 59}. Best is trial 453 with value: 218.61327854597363.[0m
[32m[I 2024-10-13 14:29:24,709][0m Trial 498 finished with value: 232.97618833748615 and parameters: {'depth': 6, 'learning_rate': 0.0017702818365716553, 'iterations': 2446, 'l2_leaf_reg': 5.348309509979222e-05, 'border_count': 37, 'bagging_temperature': 0.9817247548945043, 'random_strength': 7.560886939657222, 'grow_policy': 'Lossguide', 'min_data_in_leaf': 349, 'max_leaves': 79}. Best is trial 453 with value: 218.61327854597363.[0m
[32m[I 2024-10-13 14:29:27,160][0m Trial 499 finished with value: 223.80614770714575 and parameters: {'depth': 4, 'learning_rate': 0.0021294242664055473, 'iterations': 2388, 'l2_leaf_reg': 1.2438879603095911e-05, 'border_count': 32, 'bagging_temperature': 0.9569004425999531, 'random_strength': 7.324336002053454, 'grow_policy': 'Depthwise', 'min_data_in_leaf': 477}. Best is trial 453 with value: 218.61327854597363.[0m
[32m[I 2024-10-13 14:29:29,595][0m Trial 500 finished with value: 235.42728543707102 and parameters: {'depth': 15, 'learning_rate': 0.002584281911139141, 'iterations': 2509, 'l2_leaf_reg': 2.170131860618955e-05, 'border_count': 43, 'bagging_temperature': 0.9255516472414209, 'random_strength': 6.423901189881594, 'grow_policy': 'Lossguide', 'min_data_in_leaf': 384, 'max_leaves': 73}. Best is trial 453 with value: 218.61327854597363.[0m
[32m[I 2024-10-13 14:29:40,776][0m Trial 501 finished with value: 720.4965721458839 and parameters: {'depth': 5, 'learning_rate': 0.00012980934741723928, 'iterations': 2643, 'l2_leaf_reg': 3.448868555334803e-05, 'border_count': 28, 'bagging_temperature': 0.6873063986495335, 'random_strength': 7.061366312946334, 'grow_policy': 'SymmetricTree', 'min_data_in_leaf': 409}. Best is trial 453 with value: 218.61327854597363.[0m
[32m[I 2024-10-13 14:29:43,352][0m Trial 502 finished with value: 237.47544599709562 and parameters: {'depth': 4, 'learning_rate': 0.0033439841384905714, 'iterations': 2579, 'l2_leaf_reg': 8.827268005552508e-06, 'border_count': 49, 'bagging_temperature': 0.9832800733584036, 'random_strength': 7.573639534871339, 'grow_policy': 'Lossguide', 'min_data_in_leaf': 424, 'max_leaves': 87}. Best is trial 453 with value: 218.61327854597363.[0m
