[32m[I 2024-10-13 14:12:17,880][0m Trial 151 finished with value: 222.01627940653432 and parameters: {'depth': 8, 'learning_rate': 0.004710853726362223, 'iterations': 1749, 'l2_leaf_reg': 6.737930147786148e-07, 'border_count': 29, 'bagging_temperature': 0.9505427799537514, 'random_strength': 3.655499965929386, 'grow_policy': 'Lossguide', 'min_data_in_leaf': 794, 'max_leaves': 79}. Best is trial 99 with value: 219.56324459923857.[0m
[32m[I 2024-10-13 14:12:21,125][0m Trial 152 finished with value: 223.27596192157796 and parameters: {'depth': 8, 'learning_rate': 0.002994285845359341, 'iterations': 1799, 'l2_leaf_reg': 3.1851414182971345e-07, 'border_count': 41, 'bagging_temperature': 0.9173293363311744, 'random_strength': 8.089129188896562, 'grow_policy': 'Lossguide', 'min_data_in_leaf': 768, 'max_leaves': 90}. Best is trial 99 with value: 219.56324459923857.[0m
[32m[I 2024-10-13 14:12:23,044][0m Trial 153 finished with value: 219.82083558881743 and parameters: {'depth': 7, 'learning_rate': 0.004182306814002366, 'iterations': 1874, 'l2_leaf_reg': 1.0305157334719514e-06, 'border_count': 35, 'bagging_temperature': 0.9981946017356766, 'random_strength': 8.590376765702567, 'grow_policy': 'Lossguide', 'min_data_in_leaf': 654, 'max_leaves': 100}. Best is trial 99 with value: 219.56324459923857.[0m
[32m[I 2024-10-13 14:12:25,080][0m Trial 154 finished with value: 220.7603625069522 and parameters: {'depth': 8, 'learning_rate': 0.00387561521971851, 'iterations': 2060, 'l2_leaf_reg': 1.9022490732314526e-06, 'border_count': 32, 'bagging_temperature': 0.9638549283966594, 'random_strength': 8.703280315761228, 'grow_policy': 'Lossguide', 'min_data_in_leaf': 659, 'max_leaves': 105}. Best is trial 99 with value: 219.56324459923857.[0m
[32m[I 2024-10-13 14:12:27,080][0m Trial 155 finished with value: 221.021525283888 and parameters: {'depth': 8, 'learning_rate': 0.0038922383711394518, 'iterations': 2058, 'l2_leaf_reg': 2.0148906096650637e-06, 'border_count': 32, 'bagging_temperature': 0.9661165837134489, 'random_strength': 8.389674768095768, 'grow_policy': 'Lossguide', 'min_data_in_leaf': 630, 'max_leaves': 131}. Best is trial 99 with value: 219.56324459923857.[0m
[32m[I 2024-10-13 14:12:29,049][0m Trial 156 finished with value: 236.58222979977344 and parameters: {'depth': 8, 'learning_rate': 0.00354220173209537, 'iterations': 2051, 'l2_leaf_reg': 3.678673725847639e-06, 'border_count': 44, 'bagging_temperature': 0.9755132899198832, 'random_strength': 7.795422767301044, 'grow_policy': 'Lossguide', 'min_data_in_leaf': 656, 'max_leaves': 115}. Best is trial 99 with value: 219.56324459923857.[0m
[32m[I 2024-10-13 14:12:31,016][0m Trial 157 finished with value: 233.8846278971442 and parameters: {'depth': 8, 'learning_rate': 0.005451850316935181, 'iterations': 2034, 'l2_leaf_reg': 2.4757779689873874e-06, 'border_count': 34, 'bagging_temperature': 0.33739762447818644, 'random_strength': 8.513733666571474, 'grow_policy': 'Lossguide', 'min_data_in_leaf': 665, 'max_leaves': 133}. Best is trial 99 with value: 219.56324459923857.[0m
[32m[I 2024-10-13 14:12:33,067][0m Trial 158 finished with value: 247.49721740254336 and parameters: {'depth': 8, 'learning_rate': 0.00727451065620509, 'iterations': 2100, 'l2_leaf_reg': 1.0709469253858782e-06, 'border_count': 53, 'bagging_temperature': 0.974671692619762, 'random_strength': 8.279849206293658, 'grow_policy': 'Lossguide', 'min_data_in_leaf': 617, 'max_leaves': 127}. Best is trial 99 with value: 219.56324459923857.[0m
[32m[I 2024-10-13 14:12:35,261][0m Trial 159 finished with value: 247.3138080387672 and parameters: {'depth': 7, 'learning_rate': 0.003157571489428135, 'iterations': 2331, 'l2_leaf_reg': 1.8298813086557788e-06, 'border_count': 143, 'bagging_temperature': 0.9956555623777426, 'random_strength': 8.632981362751059, 'grow_policy': 'Lossguide', 'min_data_in_leaf': 690, 'max_leaves': 173}. Best is trial 99 with value: 219.56324459923857.[0m
[32m[I 2024-10-13 14:12:37,127][0m Trial 160 finished with value: 224.66889687126422 and parameters: {'depth': 7, 'learning_rate': 0.0062392311299355584, 'iterations': 1855, 'l2_leaf_reg': 5.363713185505883e-06, 'border_count': 40, 'bagging_temperature': 0.9629470271459851, 'random_strength': 7.961215413789743, 'grow_policy': 'Lossguide', 'min_data_in_leaf': 723, 'max_leaves': 74}. Best is trial 99 with value: 219.56324459923857.[0m
[32m[I 2024-10-13 14:12:39,281][0m Trial 161 finished with value: 221.01554488872898 and parameters: {'depth': 7, 'learning_rate': 0.003778276465379915, 'iterations': 2236, 'l2_leaf_reg': 1.0368804113255638e-06, 'border_count': 32, 'bagging_temperature': 0.9393047980260946, 'random_strength': 8.711852523657711, 'grow_policy': 'Lossguide', 'min_data_in_leaf': 586, 'max_leaves': 105}. Best is trial 99 with value: 219.56324459923857.[0m
[32m[I 2024-10-13 14:12:41,371][0m Trial 162 finished with value: 221.6462376001092 and parameters: {'depth': 7, 'learning_rate': 0.004057159961966174, 'iterations': 2166, 'l2_leaf_reg': 1.1968562880409189e-06, 'border_count': 32, 'bagging_temperature': 0.9327406422378005, 'random_strength': 8.36376250741591, 'grow_policy': 'Lossguide', 'min_data_in_leaf': 651, 'max_leaves': 106}. Best is trial 99 with value: 219.56324459923857.[0m
[32m[I 2024-10-13 14:12:43,606][0m Trial 163 finished with value: 230.01484987058217 and parameters: {'depth': 8, 'learning_rate': 0.002332941462705719, 'iterations': 2241, 'l2_leaf_reg': 5.970444042190006e-07, 'border_count': 22, 'bagging_temperature': 0.9534071829856119, 'random_strength': 8.707006691172882, 'grow_policy': 'Lossguide', 'min_data_in_leaf': 594, 'max_leaves': 123}. Best is trial 99 with value: 219.56324459923857.[0m
[32m[I 2024-10-13 14:12:45,892][0m Trial 164 finished with value: 219.7031146258358 and parameters: {'depth': 7, 'learning_rate': 0.00274582953753513, 'iterations': 2383, 'l2_leaf_reg': 9.721948041022737e-07, 'border_count': 37, 'bagging_temperature': 0.9149979240670345, 'random_strength': 8.12006144377572, 'grow_policy': 'Lossguide', 'min_data_in_leaf': 563, 'max_leaves': 94}. Best is trial 99 with value: 219.56324459923857.[0m
[32m[I 2024-10-13 14:12:48,254][0m Trial 165 finished with value: 320.5352968740436 and parameters: {'depth': 7, 'learning_rate': 0.23000774402358745, 'iterations': 2510, 'l2_leaf_reg': 1.908750299408219e-06, 'border_count': 38, 'bagging_temperature': 0.9146573436860417, 'random_strength': 8.086246787301302, 'grow_policy': 'Lossguide', 'min_data_in_leaf': 556, 'max_leaves': 83}. Best is trial 99 with value: 219.56324459923857.[0m
[32m[I 2024-10-13 14:12:50,469][0m Trial 166 finished with value: 236.76682445373135 and parameters: {'depth': 8, 'learning_rate': 0.0027067042890386076, 'iterations': 2303, 'l2_leaf_reg': 9.415381361657292e-07, 'border_count': 48, 'bagging_temperature': 0.8836381486982062, 'random_strength': 7.612695909520486, 'grow_policy': 'Lossguide', 'min_data_in_leaf': 582, 'max_leaves': 111}. Best is trial 99 with value: 219.56324459923857.[0m
[32m[I 2024-10-13 14:12:52,837][0m Trial 167 finished with value: 221.41785860111372 and parameters: {'depth': 7, 'learning_rate': 0.003741458036229243, 'iterations': 2358, 'l2_leaf_reg': 3.926970000473843e-06, 'border_count': 33, 'bagging_temperature': 0.9143514783597477, 'random_strength': 8.129265780939635, 'grow_policy': 'Lossguide', 'min_data_in_leaf': 485, 'max_leaves': 105}. Best is trial 99 with value: 219.56324459923857.[0m
[32m[I 2024-10-13 14:12:55,356][0m Trial 168 finished with value: 273.7379427748922 and parameters: {'depth': 7, 'learning_rate': 0.0016627901136726216, 'iterations': 2441, 'l2_leaf_reg': 1.2175731920718734e-05, 'border_count': 17, 'bagging_temperature': 0.9636609136250727, 'random_strength': 8.440348968983994, 'grow_policy': 'Lossguide', 'min_data_in_leaf': 544, 'max_leaves': 116}. Best is trial 99 with value: 219.56324459923857.[0m
[32m[I 2024-10-13 14:13:05,897][0m Trial 169 finished with value: 288.8623165352318 and parameters: {'depth': 6, 'learning_rate': 0.003243530709812248, 'iterations': 2214, 'l2_leaf_reg': 1.3482239397382265e-06, 'border_count': 38, 'bagging_temperature': 0.16310194417067436, 'random_strength': 7.90515091957989, 'grow_policy': 'SymmetricTree', 'min_data_in_leaf': 747}. Best is trial 99 with value: 219.56324459923857.[0m
[32m[I 2024-10-13 14:13:08,342][0m Trial 170 finished with value: 251.75766350080832 and parameters: {'depth': 7, 'learning_rate': 0.0053396759644153274, 'iterations': 2391, 'l2_leaf_reg': 4.2771533511482346e-07, 'border_count': 44, 'bagging_temperature': 0.49353830171361424, 'random_strength': 8.60644514594528, 'grow_policy': 'Depthwise', 'min_data_in_leaf': 561}. Best is trial 99 with value: 219.56324459923857.[0m
[32m[I 2024-10-13 14:13:10,828][0m Trial 171 finished with value: 223.02638270855905 and parameters: {'depth': 7, 'learning_rate': 0.00395103711890877, 'iterations': 2505, 'l2_leaf_reg': 3.871827447259844e-06, 'border_count': 34, 'bagging_temperature': 0.9131841961224405, 'random_strength': 8.210048770487173, 'grow_policy': 'Lossguide', 'min_data_in_leaf': 437, 'max_leaves': 106}. Best is trial 99 with value: 219.56324459923857.[0m
[32m[I 2024-10-13 14:13:13,177][0m Trial 172 finished with value: 227.54863100481109 and parameters: {'depth': 7, 'learning_rate': 0.0035211387493196745, 'iterations': 2334, 'l2_leaf_reg': 2.2549463880428424e-06, 'border_count': 24, 'bagging_temperature': 0.8701332778125274, 'random_strength': 8.309552241587948, 'grow_policy': 'Lossguide', 'min_data_in_leaf': 513, 'max_leaves': 138}. Best is trial 99 with value: 219.56324459923857.[0m
[32m[I 2024-10-13 14:13:15,353][0m Trial 173 finished with value: 219.735086213117 and parameters: {'depth': 7, 'learning_rate': 0.0028479068320977833, 'iterations': 2268, 'l2_leaf_reg': 3.472662409524119e-06, 'border_count': 30, 'bagging_temperature': 0.9048601127401334, 'random_strength': 8.063140593598598, 'grow_policy': 'Lossguide', 'min_data_in_leaf': 480, 'max_leaves': 97}. Best is trial 99 with value: 219.56324459923857.[0m
[32m[I 2024-10-13 14:13:17,570][0m Trial 174 finished with value: 222.14495903720675 and parameters: {'depth': 7, 'learning_rate': 0.002673248805947, 'iterations': 2150, 'l2_leaf_reg': 8.115350090251978e-07, 'border_count': 31, 'bagging_temperature': 0.8932580201635333, 'random_strength': 7.731564086145136, 'grow_policy': 'Lossguide', 'min_data_in_leaf': 480, 'max_leaves': 89}. Best is trial 99 with value: 219.56324459923857.[0m
[32m[I 2024-10-13 14:13:19,713][0m Trial 175 finished with value: 232.5867101467566 and parameters: {'depth': 8, 'learning_rate': 0.002225443803130402, 'iterations': 2241, 'l2_leaf_reg': 8.421926594924894e-06, 'border_count': 23, 'bagging_temperature': 0.9368757758033956, 'random_strength': 9.109708638299168, 'grow_policy': 'Lossguide', 'min_data_in_leaf': 612, 'max_leaves': 96}. Best is trial 99 with value: 219.56324459923857.[0m
[32m[I 2024-10-13 14:13:21,731][0m Trial 176 finished with value: 220.6871084099618 and parameters: {'depth': 8, 'learning_rate': 0.0030862690142413086, 'iterations': 1969, 'l2_leaf_reg': 1.9812437129755715e-05, 'border_count': 39, 'bagging_temperature': 0.9995943043668082, 'random_strength': 7.979299318102982, 'grow_policy': 'Lossguide', 'min_data_in_leaf': 382, 'max_leaves': 97}. Best is trial 99 with value: 219.56324459923857.[0m
[32m[I 2024-10-13 14:13:23,672][0m Trial 177 finished with value: 280.4381762727453 and parameters: {'depth': 8, 'learning_rate': 0.0019462179389955073, 'iterations': 1952, 'l2_leaf_reg': 1.6455197302857423e-06, 'border_count': 18, 'bagging_temperature': 0.9996123722441735, 'random_strength': 7.599186370777299, 'grow_policy': 'Lossguide', 'min_data_in_leaf': 674, 'max_leaves': 100}. Best is trial 99 with value: 219.56324459923857.[0m
[32m[I 2024-10-13 14:13:25,707][0m Trial 178 finished with value: 221.6823794224184 and parameters: {'depth': 8, 'learning_rate': 0.0029196455334219718, 'iterations': 2119, 'l2_leaf_reg': 2.058989869318327e-05, 'border_count': 29, 'bagging_temperature': 0.9777237610370874, 'random_strength': 8.08985725092348, 'grow_policy': 'Lossguide', 'min_data_in_leaf': 324, 'max_leaves': 87}. Best is trial 99 with value: 219.56324459923857.[0m
[32m[I 2024-10-13 14:13:28,228][0m Trial 179 finished with value: 220.9215417950531 and parameters: {'depth': 6, 'learning_rate': 0.0031990641995422605, 'iterations': 2635, 'l2_leaf_reg': 4.759073788218785e-06, 'border_count': 40, 'bagging_temperature': 0.9585083264055826, 'random_strength': 7.4254252645550345, 'grow_policy': 'Lossguide', 'min_data_in_leaf': 259, 'max_leaves': 93}. Best is trial 99 with value: 219.56324459923857.[0m
[32m[I 2024-10-13 14:13:30,702][0m Trial 180 finished with value: 235.14345960926872 and parameters: {'depth': 6, 'learning_rate': 0.0023634048370683274, 'iterations': 2620, 'l2_leaf_reg': 9.716016690035735e-06, 'border_count': 44, 'bagging_temperature': 0.9573234071069094, 'random_strength': 7.435477645251902, 'grow_policy': 'Lossguide', 'min_data_in_leaf': 402, 'max_leaves': 93}. Best is trial 99 with value: 219.56324459923857.[0m
[32m[I 2024-10-13 14:13:33,248][0m Trial 181 finished with value: 220.77811467145813 and parameters: {'depth': 6, 'learning_rate': 0.003155673093420093, 'iterations': 2713, 'l2_leaf_reg': 5.555867752232967e-06, 'border_count': 38, 'bagging_temperature': 0.9816666065946555, 'random_strength': 7.889648717820239, 'grow_policy': 'Lossguide', 'min_data_in_leaf': 359, 'max_leaves': 98}. Best is trial 99 with value: 219.56324459923857.[0m
[32m[I 2024-10-13 14:13:35,742][0m Trial 182 finished with value: 220.748158941037 and parameters: {'depth': 6, 'learning_rate': 0.003227377128411962, 'iterations': 2759, 'l2_leaf_reg': 5.042740262250266e-06, 'border_count': 32, 'bagging_temperature': 0.9846610624859207, 'random_strength': 7.847672095911206, 'grow_policy': 'Lossguide', 'min_data_in_leaf': 361, 'max_leaves': 96}. Best is trial 99 with value: 219.56324459923857.[0m
[32m[I 2024-10-13 14:13:38,276][0m Trial 183 finished with value: 219.9119471916572 and parameters: {'depth': 6, 'learning_rate': 0.002990707415828855, 'iterations': 2731, 'l2_leaf_reg': 2.755413709955612e-06, 'border_count': 33, 'bagging_temperature': 0.9866022407077187, 'random_strength': 7.9261702103270535, 'grow_policy': 'Lossguide', 'min_data_in_leaf': 251, 'max_leaves': 97}. Best is trial 99 with value: 219.56324459923857.[0m
[32m[I 2024-10-13 14:13:40,894][0m Trial 184 finished with value: 220.20057101818296 and parameters: {'depth': 6, 'learning_rate': 0.002971970479928723, 'iterations': 2811, 'l2_leaf_reg': 1.5418856206938533e-05, 'border_count': 41, 'bagging_temperature': 0.987149134389052, 'random_strength': 7.756752718026184, 'grow_policy': 'Lossguide', 'min_data_in_leaf': 218, 'max_leaves': 97}. Best is trial 99 with value: 219.56324459923857.[0m
[32m[I 2024-10-13 14:13:43,453][0m Trial 185 finished with value: 236.15314160743833 and parameters: {'depth': 6, 'learning_rate': 0.0027699857769357106, 'iterations': 2802, 'l2_leaf_reg': 1.5948894157857023e-05, 'border_count': 50, 'bagging_temperature': 0.9875768929941436, 'random_strength': 7.878411190895448, 'grow_policy': 'Lossguide', 'min_data_in_leaf': 275, 'max_leaves': 83}. Best is trial 99 with value: 219.56324459923857.[0m
[32m[I 2024-10-13 14:13:45,966][0m Trial 186 finished with value: 236.41986154055235 and parameters: {'depth': 6, 'learning_rate': 0.002007443882817641, 'iterations': 2742, 'l2_leaf_reg': 5.597449911268468e-06, 'border_count': 42, 'bagging_temperature': 0.99997525304168, 'random_strength': 7.444579646782112, 'grow_policy': 'Lossguide', 'min_data_in_leaf': 199, 'max_leaves': 97}. Best is trial 99 with value: 219.56324459923857.[0m
[32m[I 2024-10-13 14:13:48,556][0m Trial 187 finished with value: 220.99506309226263 and parameters: {'depth': 6, 'learning_rate': 0.003083559027248402, 'iterations': 2804, 'l2_leaf_reg': 5.105861041521553e-06, 'border_count': 38, 'bagging_temperature': 0.9752321954575343, 'random_strength': 7.719053850442884, 'grow_policy': 'Lossguide', 'min_data_in_leaf': 229, 'max_leaves': 91}. Best is trial 99 with value: 219.56324459923857.[0m
[32m[I 2024-10-13 14:13:51,207][0m Trial 188 finished with value: 235.8410086720932 and parameters: {'depth': 6, 'learning_rate': 0.0023864207792374343, 'iterations': 2902, 'l2_leaf_reg': 3.2932823749828226e-05, 'border_count': 57, 'bagging_temperature': 0.9832894886859772, 'random_strength': 7.944792386971958, 'grow_policy': 'Lossguide', 'min_data_in_leaf': 370, 'max_leaves': 95}. Best is trial 99 with value: 219.56324459923857.[0m
[32m[I 2024-10-13 14:13:53,573][0m Trial 189 finished with value: 267.08217291355163 and parameters: {'depth': 6, 'learning_rate': 0.0012410618273951419, 'iterations': 2590, 'l2_leaf_reg': 2.688577873656923e-06, 'border_count': 47, 'bagging_temperature': 0.9610838954493574, 'random_strength': 7.366224514583776, 'grow_policy': 'Lossguide', 'min_data_in_leaf': 297, 'max_leaves': 88}. Best is trial 99 with value: 219.56324459923857.[0m
[32m[I 2024-10-13 14:13:56,118][0m Trial 190 finished with value: 222.00755182053425 and parameters: {'depth': 6, 'learning_rate': 0.003329190539697471, 'iterations': 2710, 'l2_leaf_reg': 1.0708174397444685e-05, 'border_count': 35, 'bagging_temperature': 0.9566184503297921, 'random_strength': 7.58344265659991, 'grow_policy': 'Lossguide', 'min_data_in_leaf': 146, 'max_leaves': 98}. Best is trial 99 with value: 219.56324459923857.[0m
[32m[I 2024-10-13 14:13:58,641][0m Trial 191 finished with value: 220.07933078395672 and parameters: {'depth': 6, 'learning_rate': 0.0028334745875915495, 'iterations': 2700, 'l2_leaf_reg': 3.8230376575134555e-06, 'border_count': 39, 'bagging_temperature': 0.9800922148606923, 'random_strength': 7.780877985267823, 'grow_policy': 'Lossguide', 'min_data_in_leaf': 238, 'max_leaves': 92}. Best is trial 99 with value: 219.56324459923857.[0m
[32m[I 2024-10-13 14:14:01,068][0m Trial 192 finished with value: 220.0954643561863 and parameters: {'depth': 6, 'learning_rate': 0.0030235545320387593, 'iterations': 2663, 'l2_leaf_reg': 4.807761026484598e-06, 'border_count': 40, 'bagging_temperature': 0.9994529179440533, 'random_strength': 7.826241320647986, 'grow_policy': 'Lossguide', 'min_data_in_leaf': 239, 'max_leaves': 85}. Best is trial 99 with value: 219.56324459923857.[0m
[32m[I 2024-10-13 14:14:03,519][0m Trial 193 finished with value: 219.83742385151993 and parameters: {'depth': 5, 'learning_rate': 0.002884245493491607, 'iterations': 2663, 'l2_leaf_reg': 3.230904015470899e-06, 'border_count': 40, 'bagging_temperature': 0.995548685063635, 'random_strength': 7.81040660711395, 'grow_policy': 'Lossguide', 'min_data_in_leaf': 232, 'max_leaves': 78}. Best is trial 99 with value: 219.56324459923857.[0m
[32m[I 2024-10-13 14:14:06,031][0m Trial 194 finished with value: 235.31539541057842 and parameters: {'depth': 5, 'learning_rate': 0.0025989188315903456, 'iterations': 2755, 'l2_leaf_reg': 3.21431608364875e-06, 'border_count': 44, 'bagging_temperature': 0.9937904387292997, 'random_strength': 7.7812986038153475, 'grow_policy': 'Lossguide', 'min_data_in_leaf': 240, 'max_leaves': 88}. Best is trial 99 with value: 219.56324459923857.[0m
[32m[I 2024-10-13 14:14:08,759][0m Trial 195 finished with value: 241.39387287200194 and parameters: {'depth': 5, 'learning_rate': 0.0016417375482271424, 'iterations': 2887, 'l2_leaf_reg': 6.949144265709399e-06, 'border_count': 51, 'bagging_temperature': 0.9835965740822884, 'random_strength': 8.015412291840045, 'grow_policy': 'Lossguide', 'min_data_in_leaf': 215, 'max_leaves': 81}. Best is trial 99 with value: 219.56324459923857.[0m
[32m[I 2024-10-13 14:14:11,306][0m Trial 196 finished with value: 223.17837870054342 and parameters: {'depth': 6, 'learning_rate': 0.0020320986820768256, 'iterations': 2655, 'l2_leaf_reg': 1.6384931194103683e-05, 'border_count': 36, 'bagging_temperature': 0.9974151862462629, 'random_strength': 7.761957804962475, 'grow_policy': 'Lossguide', 'min_data_in_leaf': 284, 'max_leaves': 77}. Best is trial 99 with value: 219.56324459923857.[0m
[32m[I 2024-10-13 14:14:13,760][0m Trial 197 finished with value: 222.6825079928168 and parameters: {'depth': 6, 'learning_rate': 0.0025691651542965135, 'iterations': 2772, 'l2_leaf_reg': 3.6068359599464204e-06, 'border_count': 25, 'bagging_temperature': 0.9725885514229599, 'random_strength': 8.08785485116023, 'grow_policy': 'Lossguide', 'min_data_in_leaf': 191, 'max_leaves': 68}. Best is trial 99 with value: 219.56324459923857.[0m
[32m[I 2024-10-13 14:14:16,336][0m Trial 198 finished with value: 245.3735824802915 and parameters: {'depth': 6, 'learning_rate': 0.0029624689540325654, 'iterations': 2847, 'l2_leaf_reg': 8.299328756237126e-06, 'border_count': 179, 'bagging_temperature': 0.9988648351586897, 'random_strength': 7.8486568709981785, 'grow_policy': 'Lossguide', 'min_data_in_leaf': 183, 'max_leaves': 74}. Best is trial 99 with value: 219.56324459923857.[0m
[32m[I 2024-10-13 14:14:18,821][0m Trial 199 finished with value: 235.78913628857367 and parameters: {'depth': 5, 'learning_rate': 0.00235392793343047, 'iterations': 2695, 'l2_leaf_reg': 1.5548753929422607e-06, 'border_count': 42, 'bagging_temperature': 0.9427501278568422, 'random_strength': 8.225820967651474, 'grow_policy': 'Lossguide', 'min_data_in_leaf': 367, 'max_leaves': 155}. Best is trial 99 with value: 219.56324459923857.[0m
[32m[I 2024-10-13 14:14:21,456][0m Trial 200 finished with value: 222.44335675889766 and parameters: {'depth': 5, 'learning_rate': 0.003366631126078223, 'iterations': 2965, 'l2_leaf_reg': 2.609925350893575e-06, 'border_count': 32, 'bagging_temperature': 0.9785366321787052, 'random_strength': 7.596057239271511, 'grow_policy': 'Lossguide', 'min_data_in_leaf': 339, 'max_leaves': 71}. Best is trial 99 with value: 219.56324459923857.[0m
