Optimizing CatBoost...
[32m[I 2024-10-13 13:58:48,314][0m Trial 0 finished with value: 237.5288482577166 and parameters: {'depth': 13, 'learning_rate': 0.0025743223860421336, 'iterations': 2567, 'l2_leaf_reg': 1.0607962379743399, 'border_count': 46, 'bagging_temperature': 0.6500632900020349, 'random_strength': 8.761809551473608, 'grow_policy': 'Depthwise', 'min_data_in_leaf': 789}. Best is trial 0 with value: 237.5288482577166.[0m
[32m[I 2024-10-13 13:58:50,592][0m Trial 1 finished with value: 357.19762947251786 and parameters: {'depth': 4, 'learning_rate': 0.16975262335932362, 'iterations': 2381, 'l2_leaf_reg': 0.36674195177375224, 'border_count': 89, 'bagging_temperature': 0.6576889590933678, 'random_strength': 3.613696945041861, 'grow_policy': 'Lossguide', 'min_data_in_leaf': 423, 'max_leaves': 156}. Best is trial 0 with value: 237.5288482577166.[0m
[32m[I 2024-10-13 13:58:52,819][0m Trial 2 finished with value: 766.1317280999132 and parameters: {'depth': 15, 'learning_rate': 0.00017739726910537176, 'iterations': 1457, 'l2_leaf_reg': 9.477830357026438e-07, 'border_count': 149, 'bagging_temperature': 0.9795144990844479, 'random_strength': 0.5051838253316476, 'grow_policy': 'Depthwise', 'min_data_in_leaf': 695}. Best is trial 0 with value: 237.5288482577166.[0m
[32m[I 2024-10-13 13:58:54,112][0m Trial 3 finished with value: 742.8583086029595 and parameters: {'depth': 11, 'learning_rate': 0.00028753867198048503, 'iterations': 1047, 'l2_leaf_reg': 9.17455934235898e-06, 'border_count': 160, 'bagging_temperature': 0.49545781728729865, 'random_strength': 5.538568552334224, 'grow_policy': 'Lossguide', 'min_data_in_leaf': 300, 'max_leaves': 77}. Best is trial 0 with value: 237.5288482577166.[0m
[32m[I 2024-10-13 13:59:00,907][0m Trial 4 finished with value: 249.73994783279613 and parameters: {'depth': 5, 'learning_rate': 0.09517696242722087, 'iterations': 1626, 'l2_leaf_reg': 2.3883308766206613e-08, 'border_count': 173, 'bagging_temperature': 0.08094530525713517, 'random_strength': 4.175542582436323, 'grow_policy': 'SymmetricTree', 'min_data_in_leaf': 73}. Best is trial 0 with value: 237.5288482577166.[0m
[32m[I 2024-10-13 13:59:07,188][0m Trial 5 finished with value: 681.5348578996919 and parameters: {'depth': 5, 'learning_rate': 0.00029497469559397834, 'iterations': 1385, 'l2_leaf_reg': 5.070483300040729e-08, 'border_count': 168, 'bagging_temperature': 0.6408301488384744, 'random_strength': 3.2965179104375486, 'grow_policy': 'SymmetricTree', 'min_data_in_leaf': 813}. Best is trial 0 with value: 237.5288482577166.[0m
[32m[I 2024-10-13 13:59:09,610][0m Trial 6 finished with value: 252.69300476444974 and parameters: {'depth': 12, 'learning_rate': 0.002506637600959458, 'iterations': 2549, 'l2_leaf_reg': 0.5590634730415913, 'border_count': 177, 'bagging_temperature': 0.13115851251930388, 'random_strength': 5.014878956914427, 'grow_policy': 'Lossguide', 'min_data_in_leaf': 789, 'max_leaves': 170}. Best is trial 0 with value: 237.5288482577166.[0m
[32m[I 2024-10-13 13:59:11,297][0m Trial 7 finished with value: 324.0062322507975 and parameters: {'depth': 10, 'learning_rate': 0.12170788941766485, 'iterations': 1477, 'l2_leaf_reg': 0.020918813276185708, 'border_count': 50, 'bagging_temperature': 0.6710650351843548, 'random_strength': 3.890201925372614, 'grow_policy': 'Depthwise', 'min_data_in_leaf': 344}. Best is trial 0 with value: 237.5288482577166.[0m
[32m[I 2024-10-13 13:59:12,779][0m Trial 8 finished with value: 748.1986808471612 and parameters: {'depth': 4, 'learning_rate': 0.00023161295151228708, 'iterations': 1265, 'l2_leaf_reg': 0.5248351677093083, 'border_count': 134, 'bagging_temperature': 0.1635454187304144, 'random_strength': 7.110897152440348, 'grow_policy': 'Depthwise', 'min_data_in_leaf': 257}. Best is trial 0 with value: 237.5288482577166.[0m
[32m[I 2024-10-13 13:59:14,608][0m Trial 9 finished with value: 576.8613884991132 and parameters: {'depth': 5, 'learning_rate': 0.00040746474205400365, 'iterations': 1850, 'l2_leaf_reg': 0.01642083103497969, 'border_count': 108, 'bagging_temperature': 0.05866244765421591, 'random_strength': 7.5953120803807295, 'grow_policy': 'Lossguide', 'min_data_in_leaf': 901, 'max_leaves': 32}. Best is trial 0 with value: 237.5288482577166.[0m
[32m[I 2024-10-13 13:59:15,451][0m Trial 10 finished with value: 271.41112104915055 and parameters: {'depth': 15, 'learning_rate': 0.012039844406046144, 'iterations': 256, 'l2_leaf_reg': 0.00023553072833078603, 'border_count': 242, 'bagging_temperature': 0.9319444705411657, 'random_strength': 9.961978558027587, 'grow_policy': 'Depthwise', 'min_data_in_leaf': 605}. Best is trial 0 with value: 237.5288482577166.[0m
[32m[I 2024-10-13 13:59:29,272][0m Trial 11 finished with value: 406.4651959395676 and parameters: {'depth': 8, 'learning_rate': 0.017208520690827196, 'iterations': 2989, 'l2_leaf_reg': 0.0003172568033130737, 'border_count': 9, 'bagging_temperature': 0.4120797279097152, 'random_strength': 9.797099599137985, 'grow_policy': 'SymmetricTree', 'min_data_in_leaf': 17}. Best is trial 0 with value: 237.5288482577166.[0m
[32m[I 2024-10-13 13:59:52,221][0m Trial 12 finished with value: 237.27740258631536 and parameters: {'depth': 8, 'learning_rate': 0.0025283532741258233, 'iterations': 2087, 'l2_leaf_reg': 8.07716179370797e-08, 'border_count': 205, 'bagging_temperature': 0.3004431584713052, 'random_strength': 0.11698349081517101, 'grow_policy': 'SymmetricTree', 'min_data_in_leaf': 9}. Best is trial 12 with value: 237.27740258631536.[0m
[32m[I 2024-10-13 14:00:17,143][0m Trial 13 finished with value: 304.73211845868354 and parameters: {'depth': 8, 'learning_rate': 0.002173202027754162, 'iterations': 2143, 'l2_leaf_reg': 8.66047754047047, 'border_count': 239, 'bagging_temperature': 0.3150739970266022, 'random_strength': 0.620831323678788, 'grow_policy': 'SymmetricTree', 'min_data_in_leaf': 542}. Best is trial 12 with value: 237.27740258631536.[0m
[32m[I 2024-10-13 14:00:19,654][0m Trial 14 finished with value: 370.83672667843564 and parameters: {'depth': 13, 'learning_rate': 0.0013749862556574673, 'iterations': 2662, 'l2_leaf_reg': 7.367930511475743e-05, 'border_count': 2, 'bagging_temperature': 0.31405226460386493, 'random_strength': 1.9521707758763527, 'grow_policy': 'Depthwise', 'min_data_in_leaf': 939}. Best is trial 12 with value: 237.27740258631536.[0m
[32m[I 2024-10-13 14:00:34,525][0m Trial 15 finished with value: 312.97409315197217 and parameters: {'depth': 7, 'learning_rate': 0.007593220306225346, 'iterations': 2047, 'l2_leaf_reg': 5.418557534156667e-07, 'border_count': 203, 'bagging_temperature': 0.8356939612219574, 'random_strength': 7.99982335402089, 'grow_policy': 'SymmetricTree', 'min_data_in_leaf': 168}. Best is trial 12 with value: 237.27740258631536.[0m
[32m[I 2024-10-13 14:00:37,521][0m Trial 16 finished with value: 286.743882507671 and parameters: {'depth': 13, 'learning_rate': 0.02526828785278249, 'iterations': 2994, 'l2_leaf_reg': 0.005595596969195697, 'border_count': 66, 'bagging_temperature': 0.7805751868114745, 'random_strength': 6.293971073804137, 'grow_policy': 'Depthwise', 'min_data_in_leaf': 665}. Best is trial 12 with value: 237.27740258631536.[0m
[32m[I 2024-10-13 14:01:02,506][0m Trial 17 finished with value: 651.5974014442114 and parameters: {'depth': 10, 'learning_rate': 0.0006480376173066425, 'iterations': 839, 'l2_leaf_reg': 4.0298915577431815e-06, 'border_count': 211, 'bagging_temperature': 0.5079315012827117, 'random_strength': 8.789831670707294, 'grow_policy': 'SymmetricTree', 'min_data_in_leaf': 995}. Best is trial 12 with value: 237.27740258631536.[0m
[32m[I 2024-10-13 14:01:04,637][0m Trial 18 finished with value: 254.67628341911657 and parameters: {'depth': 7, 'learning_rate': 0.0038371120836769865, 'iterations': 2265, 'l2_leaf_reg': 0.0009024922201476142, 'border_count': 42, 'bagging_temperature': 0.25079393144434226, 'random_strength': 1.9772038722115686, 'grow_policy': 'Depthwise', 'min_data_in_leaf': 460}. Best is trial 12 with value: 237.27740258631536.[0m
[32m[I 2024-10-13 14:01:48,914][0m Trial 19 finished with value: 294.3883654540632 and parameters: {'depth': 9, 'learning_rate': 0.0012033199825501979, 'iterations': 2676, 'l2_leaf_reg': 1.0303401099936254e-08, 'border_count': 106, 'bagging_temperature': 0.5168604439241146, 'random_strength': 1.7201816245642034, 'grow_policy': 'SymmetricTree', 'min_data_in_leaf': 160}. Best is trial 12 with value: 237.27740258631536.[0m
[32m[I 2024-10-13 14:01:50,878][0m Trial 20 finished with value: 271.043385115538 and parameters: {'depth': 13, 'learning_rate': 0.03236563630305472, 'iterations': 1836, 'l2_leaf_reg': 6.47290604926921, 'border_count': 207, 'bagging_temperature': 0.38436575511160104, 'random_strength': 6.196415346645455, 'grow_policy': 'Depthwise', 'min_data_in_leaf': 772}. Best is trial 12 with value: 237.27740258631536.[0m
[32m[I 2024-10-13 14:01:59,031][0m Trial 21 finished with value: 289.29410424798283 and parameters: {'depth': 6, 'learning_rate': 0.06986714808891493, 'iterations': 1765, 'l2_leaf_reg': 8.881772540344244e-08, 'border_count': 183, 'bagging_temperature': 0.0028068676468357145, 'random_strength': 4.081258579340851, 'grow_policy': 'SymmetricTree', 'min_data_in_leaf': 2}. Best is trial 12 with value: 237.27740258631536.[0m
[32m[I 2024-10-13 14:02:04,950][0m Trial 22 finished with value: 271.71026105520525 and parameters: {'depth': 3, 'learning_rate': 0.004839152770340334, 'iterations': 1715, 'l2_leaf_reg': 1.3064645142957019e-08, 'border_count': 135, 'bagging_temperature': 0.18605964458293134, 'random_strength': 2.7101620429744644, 'grow_policy': 'SymmetricTree', 'min_data_in_leaf': 131}. Best is trial 12 with value: 237.27740258631536.[0m
[32m[I 2024-10-13 14:02:15,896][0m Trial 23 finished with value: 295.87144009016896 and parameters: {'depth': 6, 'learning_rate': 0.05021488652906192, 'iterations': 2101, 'l2_leaf_reg': 2.4418137832284505e-07, 'border_count': 224, 'bagging_temperature': 0.08646834518910917, 'random_strength': 8.726348337018475, 'grow_policy': 'SymmetricTree', 'min_data_in_leaf': 87}. Best is trial 12 with value: 237.27740258631536.[0m
[32m[I 2024-10-13 14:02:57,986][0m Trial 24 finished with value: 388.06951031764214 and parameters: {'depth': 9, 'learning_rate': 0.000789672630356116, 'iterations': 2394, 'l2_leaf_reg': 1.7405651453434874e-05, 'border_count': 196, 'bagging_temperature': 0.22913088383958113, 'random_strength': 4.823155584510797, 'grow_policy': 'SymmetricTree', 'min_data_in_leaf': 264}. Best is trial 12 with value: 237.27740258631536.[0m
[32m[I 2024-10-13 14:03:21,740][0m Trial 25 finished with value: 307.80254527305317 and parameters: {'depth': 11, 'learning_rate': 0.28410084934808133, 'iterations': 718, 'l2_leaf_reg': 2.018638196345743e-06, 'border_count': 254, 'bagging_temperature': 0.0023361812302487017, 'random_strength': 1.1708164763802567, 'grow_policy': 'SymmetricTree', 'min_data_in_leaf': 85}. Best is trial 12 with value: 237.27740258631536.[0m
[32m[I 2024-10-13 14:03:30,800][0m Trial 26 finished with value: 274.1897805702277 and parameters: {'depth': 3, 'learning_rate': 0.00878114127901151, 'iterations': 2709, 'l2_leaf_reg': 6.27954763541869e-08, 'border_count': 111, 'bagging_temperature': 0.6047806268956645, 'random_strength': 6.503513935440158, 'grow_policy': 'SymmetricTree', 'min_data_in_leaf': 398}. Best is trial 12 with value: 237.27740258631536.[0m
[32m[I 2024-10-13 14:05:00,877][0m Trial 27 finished with value: 262.5138355884558 and parameters: {'depth': 14, 'learning_rate': 0.002572498462816194, 'iterations': 1948, 'l2_leaf_reg': 2.4826066732542495e-05, 'border_count': 21, 'bagging_temperature': 0.7333277314043893, 'random_strength': 0.140825598373596, 'grow_policy': 'SymmetricTree', 'min_data_in_leaf': 207}. Best is trial 12 with value: 237.27740258631536.[0m
[32m[I 2024-10-13 14:05:04,519][0m Trial 28 finished with value: 251.46428219006012 and parameters: {'depth': 7, 'learning_rate': 0.005219975087464066, 'iterations': 1673, 'l2_leaf_reg': 0.09772107216977648, 'border_count': 79, 'bagging_temperature': 0.38815286692400536, 'random_strength': 2.634679814269712, 'grow_policy': 'Depthwise', 'min_data_in_leaf': 550}. Best is trial 12 with value: 237.27740258631536.[0m
[32m[I 2024-10-13 14:05:09,389][0m Trial 29 finished with value: 267.30407977056547 and parameters: {'depth': 5, 'learning_rate': 0.0014205122347774736, 'iterations': 2317, 'l2_leaf_reg': 2.3244190110708312e-07, 'border_count': 189, 'bagging_temperature': 0.5437484507169865, 'random_strength': 4.265749882792072, 'grow_policy': 'Lossguide', 'min_data_in_leaf': 363, 'max_leaves': 255}. Best is trial 12 with value: 237.27740258631536.[0m
[32m[I 2024-10-13 14:05:12,854][0m Trial 30 finished with value: 323.1096882142864 and parameters: {'depth': 8, 'learning_rate': 0.1246650609727214, 'iterations': 1210, 'l2_leaf_reg': 0.0016937293307124214, 'border_count': 153, 'bagging_temperature': 0.30187553593257, 'random_strength': 3.1490373462640715, 'grow_policy': 'Lossguide', 'min_data_in_leaf': 63, 'max_leaves': 251}. Best is trial 12 with value: 237.27740258631536.[0m
[32m[I 2024-10-13 14:05:16,020][0m Trial 31 finished with value: 248.99907671951084 and parameters: {'depth': 7, 'learning_rate': 0.004023884946039841, 'iterations': 1609, 'l2_leaf_reg': 0.20253772502513767, 'border_count': 82, 'bagging_temperature': 0.37279951632898345, 'random_strength': 2.533266640137417, 'grow_policy': 'Depthwise', 'min_data_in_leaf': 552}. Best is trial 12 with value: 237.27740258631536.[0m
[32m[I 2024-10-13 14:05:19,618][0m Trial 32 finished with value: 251.60641869708635 and parameters: {'depth': 6, 'learning_rate': 0.00330801684059401, 'iterations': 1588, 'l2_leaf_reg': 1.848210222218541, 'border_count': 85, 'bagging_temperature': 0.4300037680270731, 'random_strength': 4.7431391642364344, 'grow_policy': 'Depthwise', 'min_data_in_leaf': 728}. Best is trial 12 with value: 237.27740258631536.[0m
[32m[I 2024-10-13 14:05:26,707][0m Trial 33 finished with value: 755.4289507625932 and parameters: {'depth': 4, 'learning_rate': 0.00010931687726892819, 'iterations': 2463, 'l2_leaf_reg': 0.11976041491052572, 'border_count': 38, 'bagging_temperature': 0.58850030685347, 'random_strength': 0.9293853141795703, 'grow_policy': 'Depthwise', 'min_data_in_leaf': 470}. Best is trial 12 with value: 237.27740258631536.[0m
[32m[I 2024-10-13 14:05:28,452][0m Trial 34 finished with value: 247.87933501438178 and parameters: {'depth': 10, 'learning_rate': 0.008605914182723638, 'iterations': 1046, 'l2_leaf_reg': 0.12031233866675264, 'border_count': 63, 'bagging_temperature': 0.46082144418104865, 'random_strength': 5.803961908627656, 'grow_policy': 'Depthwise', 'min_data_in_leaf': 634}. Best is trial 12 with value: 237.27740258631536.[0m
[32m[I 2024-10-13 14:05:30,427][0m Trial 35 finished with value: 242.92840352893458 and parameters: {'depth': 10, 'learning_rate': 0.008535556191174024, 'iterations': 928, 'l2_leaf_reg': 1.3269019979381595, 'border_count': 62, 'bagging_temperature': 0.4483375720242239, 'random_strength': 5.542158609292878, 'grow_policy': 'Depthwise', 'min_data_in_leaf': 607}. Best is trial 12 with value: 237.27740258631536.[0m
[32m[I 2024-10-13 14:05:32,269][0m Trial 36 finished with value: 243.75895170806785 and parameters: {'depth': 11, 'learning_rate': 0.014546078360256483, 'iterations': 542, 'l2_leaf_reg': 1.1388627767310442, 'border_count': 68, 'bagging_temperature': 0.45348446594269454, 'random_strength': 5.470852818673432, 'grow_policy': 'Depthwise', 'min_data_in_leaf': 649}. Best is trial 12 with value: 237.27740258631536.[0m
[32m[I 2024-10-13 14:05:33,524][0m Trial 37 finished with value: 226.5553977197405 and parameters: {'depth': 11, 'learning_rate': 0.014911301369982697, 'iterations': 352, 'l2_leaf_reg': 1.4276904168641371, 'border_count': 27, 'bagging_temperature': 0.6815116147171218, 'random_strength': 7.004065918795972, 'grow_policy': 'Depthwise', 'min_data_in_leaf': 855}. Best is trial 37 with value: 226.5553977197405.[0m
[32m[I 2024-10-13 14:05:34,257][0m Trial 38 finished with value: 260.9347698432742 and parameters: {'depth': 12, 'learning_rate': 0.020175015349117517, 'iterations': 171, 'l2_leaf_reg': 1.7119103967428233, 'border_count': 37, 'bagging_temperature': 0.7450172778938913, 'random_strength': 6.905159377912835, 'grow_policy': 'Depthwise', 'min_data_in_leaf': 859}. Best is trial 37 with value: 226.5553977197405.[0m
[32m[I 2024-10-13 14:05:35,346][0m Trial 39 finished with value: 250.6267693828339 and parameters: {'depth': 12, 'learning_rate': 0.03762447685415453, 'iterations': 403, 'l2_leaf_reg': 0.017102713785498876, 'border_count': 21, 'bagging_temperature': 0.6707085624389441, 'random_strength': 8.489314046087635, 'grow_policy': 'Depthwise', 'min_data_in_leaf': 739}. Best is trial 37 with value: 226.5553977197405.[0m
[32m[I 2024-10-13 14:05:37,043][0m Trial 40 finished with value: 234.5485635579136 and parameters: {'depth': 10, 'learning_rate': 0.007433254190193898, 'iterations': 806, 'l2_leaf_reg': 0.056868267763551, 'border_count': 50, 'bagging_temperature': 0.8786445198016903, 'random_strength': 7.406245825641769, 'grow_policy': 'Lossguide', 'min_data_in_leaf': 814, 'max_leaves': 105}. Best is trial 37 with value: 226.5553977197405.[0m
[32m[I 2024-10-13 14:05:40,402][0m Trial 41 finished with value: 231.71563019968704 and parameters: {'depth': 10, 'learning_rate': 0.0066677779875695025, 'iterations': 800, 'l2_leaf_reg': 0.39849052330614004, 'border_count': 57, 'bagging_temperature': 0.8828316453930044, 'random_strength': 7.3766715566781205, 'grow_policy': 'Lossguide', 'min_data_in_leaf': 835, 'max_leaves': 100}. Best is trial 37 with value: 226.5553977197405.[0m
[32m[I 2024-10-13 14:05:41,696][0m Trial 42 finished with value: 491.36029918033034 and parameters: {'depth': 11, 'learning_rate': 0.001867556551273314, 'iterations': 605, 'l2_leaf_reg': 0.06200568857364258, 'border_count': 26, 'bagging_temperature': 0.9960431520038003, 'random_strength': 7.428329117506358, 'grow_policy': 'Lossguide', 'min_data_in_leaf': 880, 'max_leaves': 88}. Best is trial 37 with value: 226.5553977197405.[0m
[32m[I 2024-10-13 14:05:42,668][0m Trial 43 finished with value: 350.98850437729817 and parameters: {'depth': 9, 'learning_rate': 0.0061324567384061675, 'iterations': 368, 'l2_leaf_reg': 4.372588492783337, 'border_count': 53, 'bagging_temperature': 0.9112125419536428, 'random_strength': 9.38433100261515, 'grow_policy': 'Lossguide', 'min_data_in_leaf': 814, 'max_leaves': 96}. Best is trial 37 with value: 226.5553977197405.[0m
[32m[I 2024-10-13 14:05:44,715][0m Trial 44 finished with value: 232.2964354069662 and parameters: {'depth': 14, 'learning_rate': 0.01273353191732091, 'iterations': 1225, 'l2_leaf_reg': 0.3897021131063224, 'border_count': 30, 'bagging_temperature': 0.8730420750407037, 'random_strength': 7.7501123404032075, 'grow_policy': 'Lossguide', 'min_data_in_leaf': 961, 'max_leaves': 125}. Best is trial 37 with value: 226.5553977197405.[0m
[32m[I 2024-10-13 14:05:49,182][0m Trial 45 finished with value: 248.5681115290424 and parameters: {'depth': 15, 'learning_rate': 0.011092246993221607, 'iterations': 1225, 'l2_leaf_reg': 0.03044099359778414, 'border_count': 97, 'bagging_temperature': 0.8369125239072485, 'random_strength': 8.149247674818447, 'grow_policy': 'Lossguide', 'min_data_in_leaf': 989, 'max_leaves': 122}. Best is trial 37 with value: 226.5553977197405.[0m
[32m[I 2024-10-13 14:05:50,896][0m Trial 46 finished with value: 227.09740863893413 and parameters: {'depth': 9, 'learning_rate': 0.016233949604500066, 'iterations': 829, 'l2_leaf_reg': 0.45581162601440883, 'border_count': 29, 'bagging_temperature': 0.9302870460312863, 'random_strength': 7.655571326753289, 'grow_policy': 'Lossguide', 'min_data_in_leaf': 843, 'max_leaves': 126}. Best is trial 37 with value: 226.5553977197405.[0m
[32m[I 2024-10-13 14:05:52,544][0m Trial 47 finished with value: 251.9459040234461 and parameters: {'depth': 14, 'learning_rate': 0.017544658538510123, 'iterations': 814, 'l2_leaf_reg': 0.42220426038112896, 'border_count': 14, 'bagging_temperature': 0.9258684927974002, 'random_strength': 6.937564156396712, 'grow_policy': 'Lossguide', 'min_data_in_leaf': 918, 'max_leaves': 121}. Best is trial 37 with value: 226.5553977197405.[0m
[32m[I 2024-10-13 14:05:54,830][0m Trial 48 finished with value: 233.91180577452084 and parameters: {'depth': 9, 'learning_rate': 0.02322147828022334, 'iterations': 608, 'l2_leaf_reg': 0.34020859610884935, 'border_count': 30, 'bagging_temperature': 0.8644071591996882, 'random_strength': 7.502683317606198, 'grow_policy': 'Lossguide', 'min_data_in_leaf': 829, 'max_leaves': 126}. Best is trial 37 with value: 226.5553977197405.[0m
[32m[I 2024-10-13 14:05:57,238][0m Trial 49 finished with value: 555.0486610145138 and parameters: {'depth': 9, 'learning_rate': 0.02621695513151886, 'iterations': 1069, 'l2_leaf_reg': 0.3373686619984766, 'border_count': 1, 'bagging_temperature': 0.8058329540212354, 'random_strength': 7.9031331613885545, 'grow_policy': 'Lossguide', 'min_data_in_leaf': 944, 'max_leaves': 150}. Best is trial 37 with value: 226.5553977197405.[0m
[32m[I 2024-10-13 14:05:58,682][0m Trial 50 finished with value: 248.17688396481628 and parameters: {'depth': 11, 'learning_rate': 0.04893455169247239, 'iterations': 627, 'l2_leaf_reg': 3.6074453918824454, 'border_count': 31, 'bagging_temperature': 0.9721591619085515, 'random_strength': 8.98436754867889, 'grow_policy': 'Lossguide', 'min_data_in_leaf': 855, 'max_leaves': 190}. Best is trial 37 with value: 226.5553977197405.[0m
