[32m[I 2024-10-13 14:36:22,625][0m Trial 653 finished with value: 214.0710804386026 and parameters: {'depth': 6, 'learning_rate': 0.005986282918543529, 'iterations': 2889, 'l2_leaf_reg': 6.769696908145505, 'border_count': 28, 'bagging_temperature': 0.8301571233048876, 'random_strength': 5.386403268648142, 'grow_policy': 'Lossguide', 'min_data_in_leaf': 617, 'max_leaves': 103}. Best is trial 557 with value: 199.73000305555982.[0m
[32m[I 2024-10-13 14:36:36,221][0m Trial 654 finished with value: 293.18669326709323 and parameters: {'depth': 6, 'learning_rate': 0.004870282690615071, 'iterations': 2937, 'l2_leaf_reg': 3.8606749511553033, 'border_count': 27, 'bagging_temperature': 0.7835446775079493, 'random_strength': 5.475950993485082, 'grow_policy': 'SymmetricTree', 'min_data_in_leaf': 564}. Best is trial 557 with value: 199.73000305555982.[0m
[32m[I 2024-10-13 14:36:38,861][0m Trial 655 finished with value: 204.20435839207798 and parameters: {'depth': 6, 'learning_rate': 0.005070984868513707, 'iterations': 2847, 'l2_leaf_reg': 9.781899081700699, 'border_count': 28, 'bagging_temperature': 0.8137578098015135, 'random_strength': 4.990536989462681, 'grow_policy': 'Lossguide', 'min_data_in_leaf': 596, 'max_leaves': 96}. Best is trial 557 with value: 199.73000305555982.[0m
[32m[I 2024-10-13 14:36:41,667][0m Trial 656 finished with value: 216.31497204103275 and parameters: {'depth': 6, 'learning_rate': 0.006597218594392321, 'iterations': 2957, 'l2_leaf_reg': 9.41310232170573, 'border_count': 28, 'bagging_temperature': 0.7936664064091637, 'random_strength': 4.587338356301654, 'grow_policy': 'Lossguide', 'min_data_in_leaf': 629, 'max_leaves': 100}. Best is trial 557 with value: 199.73000305555982.[0m
[32m[I 2024-10-13 14:36:44,419][0m Trial 657 finished with value: 218.36145064577616 and parameters: {'depth': 6, 'learning_rate': 0.005557814091267374, 'iterations': 2861, 'l2_leaf_reg': 4.540806676253668, 'border_count': 28, 'bagging_temperature': 0.7609675916992603, 'random_strength': 4.676734723086535, 'grow_policy': 'Lossguide', 'min_data_in_leaf': 604, 'max_leaves': 107}. Best is trial 557 with value: 199.73000305555982.[0m
[32m[I 2024-10-13 14:36:47,122][0m Trial 658 finished with value: 218.7415817174427 and parameters: {'depth': 6, 'learning_rate': 0.0038933934768779644, 'iterations': 2911, 'l2_leaf_reg': 1.6034961229826836, 'border_count': 28, 'bagging_temperature': 0.8064542021085161, 'random_strength': 6.146992269711195, 'grow_policy': 'Lossguide', 'min_data_in_leaf': 576, 'max_leaves': 96}. Best is trial 557 with value: 199.73000305555982.[0m
[32m[I 2024-10-13 14:36:49,832][0m Trial 659 finished with value: 216.29303388583284 and parameters: {'depth': 6, 'learning_rate': 0.004724017033139406, 'iterations': 2843, 'l2_leaf_reg': 5.553375380155368, 'border_count': 23, 'bagging_temperature': 0.8125957750726547, 'random_strength': 6.539984945381766, 'grow_policy': 'Lossguide', 'min_data_in_leaf': 661, 'max_leaves': 95}. Best is trial 557 with value: 199.73000305555982.[0m
[32m[I 2024-10-13 14:36:52,484][0m Trial 660 finished with value: 214.5015671851214 and parameters: {'depth': 6, 'learning_rate': 0.007247730214989894, 'iterations': 2802, 'l2_leaf_reg': 9.97878289332145, 'border_count': 28, 'bagging_temperature': 0.8239407778945288, 'random_strength': 4.977541079125456, 'grow_policy': 'Lossguide', 'min_data_in_leaf': 603, 'max_leaves': 99}. Best is trial 557 with value: 199.73000305555982.[0m
[32m[I 2024-10-13 14:36:55,194][0m Trial 661 finished with value: 243.95787589798408 and parameters: {'depth': 6, 'learning_rate': 0.00871358105035403, 'iterations': 2909, 'l2_leaf_reg': 3.4265607669054368, 'border_count': 134, 'bagging_temperature': 0.7328661295037154, 'random_strength': 5.088805434748395, 'grow_policy': 'Lossguide', 'min_data_in_leaf': 570, 'max_leaves': 93}. Best is trial 557 with value: 199.73000305555982.[0m
[32m[I 2024-10-13 14:36:57,778][0m Trial 662 finished with value: 241.72945229755086 and parameters: {'depth': 6, 'learning_rate': 0.005453259481616927, 'iterations': 2805, 'l2_leaf_reg': 2.136524569062165, 'border_count': 18, 'bagging_temperature': 0.849370792317618, 'random_strength': 6.229343593964892, 'grow_policy': 'Lossguide', 'min_data_in_leaf': 625, 'max_leaves': 103}. Best is trial 557 with value: 199.73000305555982.[0m
[32m[I 2024-10-13 14:37:00,270][0m Trial 663 finished with value: 216.82607418989053 and parameters: {'depth': 6, 'learning_rate': 0.003941412570514292, 'iterations': 2628, 'l2_leaf_reg': 5.147881674769547, 'border_count': 103, 'bagging_temperature': 0.8362185876449666, 'random_strength': 6.380182257584484, 'grow_policy': 'Lossguide', 'min_data_in_leaf': 595, 'max_leaves': 93}. Best is trial 557 with value: 199.73000305555982.[0m
[32m[I 2024-10-13 14:37:03,051][0m Trial 664 finished with value: 206.25987937463609 and parameters: {'depth': 6, 'learning_rate': 0.004364823378016435, 'iterations': 2850, 'l2_leaf_reg': 9.93946351662468, 'border_count': 23, 'bagging_temperature': 0.8198980937035811, 'random_strength': 5.716148249547916, 'grow_policy': 'Lossguide', 'min_data_in_leaf': 555, 'max_leaves': 98}. Best is trial 557 with value: 199.73000305555982.[0m
[32m[I 2024-10-13 14:37:05,868][0m Trial 665 finished with value: 237.07706103183418 and parameters: {'depth': 6, 'learning_rate': 0.006156759808505048, 'iterations': 2857, 'l2_leaf_reg': 7.242310979671994, 'border_count': 14, 'bagging_temperature': 0.7972389053456855, 'random_strength': 5.665503910508946, 'grow_policy': 'Lossguide', 'min_data_in_leaf': 645, 'max_leaves': 100}. Best is trial 557 with value: 199.73000305555982.[0m
[32m[I 2024-10-13 14:37:08,496][0m Trial 666 finished with value: 213.98401762165403 and parameters: {'depth': 6, 'learning_rate': 0.004591769021743874, 'iterations': 2862, 'l2_leaf_reg': 7.62752619670902, 'border_count': 151, 'bagging_temperature': 0.8170636411782817, 'random_strength': 5.229890903711587, 'grow_policy': 'Lossguide', 'min_data_in_leaf': 578, 'max_leaves': 106}. Best is trial 557 with value: 199.73000305555982.[0m
[32m[I 2024-10-13 14:37:11,174][0m Trial 667 finished with value: 217.5236209937709 and parameters: {'depth': 6, 'learning_rate': 0.005423255351496766, 'iterations': 2902, 'l2_leaf_reg': 5.413107631617545, 'border_count': 29, 'bagging_temperature': 0.7666182076540139, 'random_strength': 5.7326788298428495, 'grow_policy': 'Lossguide', 'min_data_in_leaf': 560, 'max_leaves': 116}. Best is trial 557 with value: 199.73000305555982.[0m
[32m[I 2024-10-13 14:37:13,917][0m Trial 668 finished with value: 227.00439769759387 and parameters: {'depth': 6, 'learning_rate': 0.00449603569257264, 'iterations': 2969, 'l2_leaf_reg': 9.874221396371832, 'border_count': 21, 'bagging_temperature': 0.8258121778377654, 'random_strength': 5.062899574746909, 'grow_policy': 'Lossguide', 'min_data_in_leaf': 616, 'max_leaves': 97}. Best is trial 557 with value: 199.73000305555982.[0m
[32m[I 2024-10-13 14:37:16,633][0m Trial 669 finished with value: 210.68683204269223 and parameters: {'depth': 6, 'learning_rate': 0.006701875464943996, 'iterations': 2821, 'l2_leaf_reg': 9.952379441137435, 'border_count': 28, 'bagging_temperature': 0.8970133210957612, 'random_strength': 5.309059999951758, 'grow_policy': 'Lossguide', 'min_data_in_leaf': 521, 'max_leaves': 109}. Best is trial 557 with value: 199.73000305555982.[0m
[32m[I 2024-10-13 14:37:19,326][0m Trial 670 finished with value: 212.47260143400374 and parameters: {'depth': 6, 'learning_rate': 0.004862646599235468, 'iterations': 2948, 'l2_leaf_reg': 4.768741159558821, 'border_count': 28, 'bagging_temperature': 0.8955459853687686, 'random_strength': 4.934508301033602, 'grow_policy': 'Lossguide', 'min_data_in_leaf': 517, 'max_leaves': 106}. Best is trial 557 with value: 199.73000305555982.[0m
[32m[I 2024-10-13 14:37:22,131][0m Trial 671 finished with value: 233.19142826566872 and parameters: {'depth': 6, 'learning_rate': 0.00740550740922062, 'iterations': 2974, 'l2_leaf_reg': 9.52720599824546, 'border_count': 19, 'bagging_temperature': 0.8968087140070783, 'random_strength': 4.734036065416841, 'grow_policy': 'Lossguide', 'min_data_in_leaf': 505, 'max_leaves': 112}. Best is trial 557 with value: 199.73000305555982.[0m
[32m[I 2024-10-13 14:37:24,783][0m Trial 672 finished with value: 205.75100350506003 and parameters: {'depth': 6, 'learning_rate': 0.003903231827398456, 'iterations': 2932, 'l2_leaf_reg': 5.079925229183089, 'border_count': 28, 'bagging_temperature': 0.8992266182559856, 'random_strength': 5.318628805787722, 'grow_policy': 'Lossguide', 'min_data_in_leaf': 531, 'max_leaves': 108}. Best is trial 557 with value: 199.73000305555982.[0m
[32m[I 2024-10-13 14:37:27,528][0m Trial 673 finished with value: 206.13423981439215 and parameters: {'depth': 6, 'learning_rate': 0.004032925565295169, 'iterations': 2995, 'l2_leaf_reg': 6.187636120111964, 'border_count': 29, 'bagging_temperature': 0.8908416128568768, 'random_strength': 4.891030428236731, 'grow_policy': 'Lossguide', 'min_data_in_leaf': 508, 'max_leaves': 122}. Best is trial 557 with value: 199.73000305555982.[0m
[32m[I 2024-10-13 14:37:30,288][0m Trial 674 finished with value: 243.02528307477021 and parameters: {'depth': 6, 'learning_rate': 0.010969960070418165, 'iterations': 2946, 'l2_leaf_reg': 7.054295691240012, 'border_count': 85, 'bagging_temperature': 0.8986526854309259, 'random_strength': 5.173892483331937, 'grow_policy': 'Lossguide', 'min_data_in_leaf': 502, 'max_leaves': 112}. Best is trial 557 with value: 199.73000305555982.[0m
[32m[I 2024-10-13 14:37:33,082][0m Trial 675 finished with value: 200.20338928311938 and parameters: {'depth': 7, 'learning_rate': 0.003927152515565316, 'iterations': 2991, 'l2_leaf_reg': 9.61595297521477, 'border_count': 29, 'bagging_temperature': 0.8939658634444605, 'random_strength': 4.812148181745324, 'grow_policy': 'Lossguide', 'min_data_in_leaf': 540, 'max_leaves': 108}. Best is trial 557 with value: 199.73000305555982.[0m
[32m[I 2024-10-13 14:37:35,891][0m Trial 676 finished with value: 214.28445867188384 and parameters: {'depth': 7, 'learning_rate': 0.00388748096019375, 'iterations': 2986, 'l2_leaf_reg': 6.356143339660442, 'border_count': 118, 'bagging_temperature': 0.8998747187037255, 'random_strength': 4.4593781754352415, 'grow_policy': 'Lossguide', 'min_data_in_leaf': 522, 'max_leaves': 119}. Best is trial 557 with value: 199.73000305555982.[0m
[32m[I 2024-10-13 14:37:38,662][0m Trial 677 finished with value: 201.34845759551928 and parameters: {'depth': 7, 'learning_rate': 0.004059682755963717, 'iterations': 2994, 'l2_leaf_reg': 9.540965618549889, 'border_count': 29, 'bagging_temperature': 0.8549914806918721, 'random_strength': 4.801968299312578, 'grow_policy': 'Lossguide', 'min_data_in_leaf': 528, 'max_leaves': 112}. Best is trial 557 with value: 199.73000305555982.[0m
[32m[I 2024-10-13 14:37:41,440][0m Trial 678 finished with value: 199.31736483969848 and parameters: {'depth': 7, 'learning_rate': 0.0038375157197012644, 'iterations': 2993, 'l2_leaf_reg': 9.729683488658853, 'border_count': 30, 'bagging_temperature': 0.8703446632163757, 'random_strength': 4.899785009456487, 'grow_policy': 'Lossguide', 'min_data_in_leaf': 508, 'max_leaves': 125}. Best is trial 678 with value: 199.31736483969848.[0m
[32m[I 2024-10-13 14:37:44,276][0m Trial 679 finished with value: 199.23083843209966 and parameters: {'depth': 7, 'learning_rate': 0.0038762315134004775, 'iterations': 2975, 'l2_leaf_reg': 9.832059616069268, 'border_count': 28, 'bagging_temperature': 0.8550169949788402, 'random_strength': 4.773014147792867, 'grow_policy': 'Lossguide', 'min_data_in_leaf': 504, 'max_leaves': 125}. Best is trial 679 with value: 199.23083843209966.[0m
[32m[I 2024-10-13 14:38:05,843][0m Trial 680 finished with value: 294.8019618541878 and parameters: {'depth': 7, 'learning_rate': 0.0037753166990297806, 'iterations': 2996, 'l2_leaf_reg': 9.358538415382228, 'border_count': 30, 'bagging_temperature': 0.8569432332161385, 'random_strength': 4.129055460279507, 'grow_policy': 'SymmetricTree', 'min_data_in_leaf': 513}. Best is trial 679 with value: 199.23083843209966.[0m
[32m[I 2024-10-13 14:38:08,625][0m Trial 681 finished with value: 206.00423428162154 and parameters: {'depth': 7, 'learning_rate': 0.0038619980954727557, 'iterations': 2989, 'l2_leaf_reg': 5.584178834095698, 'border_count': 31, 'bagging_temperature': 0.8727897728813546, 'random_strength': 4.820327264163881, 'grow_policy': 'Lossguide', 'min_data_in_leaf': 499, 'max_leaves': 130}. Best is trial 679 with value: 199.23083843209966.[0m
[32m[I 2024-10-13 14:38:11,362][0m Trial 682 finished with value: 228.86112363158125 and parameters: {'depth': 7, 'learning_rate': 0.003776266797491948, 'iterations': 2967, 'l2_leaf_reg': 9.195638922182438, 'border_count': 21, 'bagging_temperature': 0.877275572402652, 'random_strength': 4.776985727279783, 'grow_policy': 'Lossguide', 'min_data_in_leaf': 513, 'max_leaves': 127}. Best is trial 679 with value: 199.23083843209966.[0m
[32m[I 2024-10-13 14:38:14,114][0m Trial 683 finished with value: 199.05635761658297 and parameters: {'depth': 7, 'learning_rate': 0.0039008578431701736, 'iterations': 2997, 'l2_leaf_reg': 9.665098609154674, 'border_count': 30, 'bagging_temperature': 0.8997375808779258, 'random_strength': 4.45414560772667, 'grow_policy': 'Lossguide', 'min_data_in_leaf': 493, 'max_leaves': 132}. Best is trial 683 with value: 199.05635761658297.[0m
[32m[I 2024-10-13 14:38:16,952][0m Trial 684 finished with value: 198.81639474308358 and parameters: {'depth': 7, 'learning_rate': 0.0036950921382785146, 'iterations': 2994, 'l2_leaf_reg': 9.825609435885493, 'border_count': 32, 'bagging_temperature': 0.8491579855514851, 'random_strength': 4.505546177176717, 'grow_policy': 'Lossguide', 'min_data_in_leaf': 492, 'max_leaves': 135}. Best is trial 684 with value: 198.81639474308358.[0m
[32m[I 2024-10-13 14:38:19,745][0m Trial 685 finished with value: 199.8272625548564 and parameters: {'depth': 7, 'learning_rate': 0.003488038046656118, 'iterations': 2984, 'l2_leaf_reg': 9.436908876441228, 'border_count': 30, 'bagging_temperature': 0.8467422499333574, 'random_strength': 4.494417142846707, 'grow_policy': 'Lossguide', 'min_data_in_leaf': 501, 'max_leaves': 133}. Best is trial 684 with value: 198.81639474308358.[0m
[32m[I 2024-10-13 14:38:22,505][0m Trial 686 finished with value: 199.68949101371803 and parameters: {'depth': 7, 'learning_rate': 0.0037389075944696893, 'iterations': 2978, 'l2_leaf_reg': 9.257972089697267, 'border_count': 31, 'bagging_temperature': 0.8535335667357649, 'random_strength': 4.3160014961128805, 'grow_policy': 'Lossguide', 'min_data_in_leaf': 495, 'max_leaves': 139}. Best is trial 684 with value: 198.81639474308358.[0m
[32m[I 2024-10-13 14:38:25,258][0m Trial 687 finished with value: 200.0185409155369 and parameters: {'depth': 7, 'learning_rate': 0.0036273717913928648, 'iterations': 2989, 'l2_leaf_reg': 8.685512562757363, 'border_count': 31, 'bagging_temperature': 0.8462386033266074, 'random_strength': 4.360408302291934, 'grow_policy': 'Lossguide', 'min_data_in_leaf': 493, 'max_leaves': 136}. Best is trial 684 with value: 198.81639474308358.[0m
[32m[I 2024-10-13 14:38:28,068][0m Trial 688 finished with value: 199.16629856245123 and parameters: {'depth': 7, 'learning_rate': 0.003706318976286262, 'iterations': 2989, 'l2_leaf_reg': 9.431064542992813, 'border_count': 32, 'bagging_temperature': 0.8434223747179828, 'random_strength': 4.324992434723172, 'grow_policy': 'Lossguide', 'min_data_in_leaf': 492, 'max_leaves': 136}. Best is trial 684 with value: 198.81639474308358.[0m
[32m[I 2024-10-13 14:38:30,871][0m Trial 689 finished with value: 199.64386074800623 and parameters: {'depth': 7, 'learning_rate': 0.003727065417748638, 'iterations': 2973, 'l2_leaf_reg': 9.786146312838964, 'border_count': 32, 'bagging_temperature': 0.801705335652525, 'random_strength': 4.3842821631213065, 'grow_policy': 'Lossguide', 'min_data_in_leaf': 496, 'max_leaves': 136}. Best is trial 684 with value: 198.81639474308358.[0m
[32m[I 2024-10-13 14:38:33,767][0m Trial 690 finished with value: 200.18643310245844 and parameters: {'depth': 7, 'learning_rate': 0.0037641016103931928, 'iterations': 2988, 'l2_leaf_reg': 9.421423966222816, 'border_count': 31, 'bagging_temperature': 0.8042435485791053, 'random_strength': 4.305113562553999, 'grow_policy': 'Lossguide', 'min_data_in_leaf': 489, 'max_leaves': 137}. Best is trial 684 with value: 198.81639474308358.[0m
[32m[I 2024-10-13 14:38:36,576][0m Trial 691 finished with value: 200.5052559555025 and parameters: {'depth': 7, 'learning_rate': 0.003722023309670145, 'iterations': 2990, 'l2_leaf_reg': 9.327737908221076, 'border_count': 32, 'bagging_temperature': 0.769884310410622, 'random_strength': 4.30649622751427, 'grow_policy': 'Lossguide', 'min_data_in_leaf': 494, 'max_leaves': 136}. Best is trial 684 with value: 198.81639474308358.[0m
[32m[I 2024-10-13 14:38:39,310][0m Trial 692 finished with value: 200.6441371714324 and parameters: {'depth': 7, 'learning_rate': 0.003705601515024882, 'iterations': 2977, 'l2_leaf_reg': 9.455896531649234, 'border_count': 33, 'bagging_temperature': 0.7727021791220444, 'random_strength': 3.86123913187211, 'grow_policy': 'Lossguide', 'min_data_in_leaf': 493, 'max_leaves': 135}. Best is trial 684 with value: 198.81639474308358.[0m
[32m[I 2024-10-13 14:38:42,053][0m Trial 693 finished with value: 201.78042568237092 and parameters: {'depth': 7, 'learning_rate': 0.0037129161658716304, 'iterations': 2998, 'l2_leaf_reg': 8.372712484253888, 'border_count': 33, 'bagging_temperature': 0.7758818469516242, 'random_strength': 3.792411667633789, 'grow_policy': 'Lossguide', 'min_data_in_leaf': 494, 'max_leaves': 136}. Best is trial 684 with value: 198.81639474308358.[0m
[32m[I 2024-10-13 14:38:44,818][0m Trial 694 finished with value: 200.69771481417018 and parameters: {'depth': 7, 'learning_rate': 0.0036932107499641777, 'iterations': 2980, 'l2_leaf_reg': 9.945222645664117, 'border_count': 33, 'bagging_temperature': 0.7569650891482721, 'random_strength': 3.956227362455701, 'grow_policy': 'Lossguide', 'min_data_in_leaf': 488, 'max_leaves': 139}. Best is trial 684 with value: 198.81639474308358.[0m
[32m[I 2024-10-13 14:38:47,651][0m Trial 695 finished with value: 212.21379100539997 and parameters: {'depth': 7, 'learning_rate': 0.0035732300201750987, 'iterations': 2989, 'l2_leaf_reg': 7.774477266824706, 'border_count': 162, 'bagging_temperature': 0.7513524229539644, 'random_strength': 3.829686420169522, 'grow_policy': 'Lossguide', 'min_data_in_leaf': 487, 'max_leaves': 139}. Best is trial 684 with value: 198.81639474308358.[0m
[32m[I 2024-10-13 14:38:50,421][0m Trial 696 finished with value: 200.92828849554897 and parameters: {'depth': 7, 'learning_rate': 0.0037838558625308497, 'iterations': 2982, 'l2_leaf_reg': 8.908001387113421, 'border_count': 34, 'bagging_temperature': 0.7438550928966061, 'random_strength': 4.3256688916913895, 'grow_policy': 'Lossguide', 'min_data_in_leaf': 492, 'max_leaves': 134}. Best is trial 684 with value: 198.81639474308358.[0m
[32m[I 2024-10-13 14:39:12,107][0m Trial 697 finished with value: 294.425508303862 and parameters: {'depth': 7, 'learning_rate': 0.0035675515376216976, 'iterations': 2997, 'l2_leaf_reg': 7.9822258903966725, 'border_count': 34, 'bagging_temperature': 0.7234852177895753, 'random_strength': 3.9138076770976427, 'grow_policy': 'SymmetricTree', 'min_data_in_leaf': 495}. Best is trial 684 with value: 198.81639474308358.[0m
[32m[I 2024-10-13 14:39:14,803][0m Trial 698 finished with value: 200.5145526656284 and parameters: {'depth': 7, 'learning_rate': 0.0038011189919588293, 'iterations': 2993, 'l2_leaf_reg': 9.819586977387454, 'border_count': 33, 'bagging_temperature': 0.7704986140197086, 'random_strength': 4.2801857058987895, 'grow_policy': 'Lossguide', 'min_data_in_leaf': 493, 'max_leaves': 146}. Best is trial 684 with value: 198.81639474308358.[0m
[32m[I 2024-10-13 14:39:17,692][0m Trial 699 finished with value: 199.73620754575995 and parameters: {'depth': 7, 'learning_rate': 0.00361335607614583, 'iterations': 2999, 'l2_leaf_reg': 9.728606001757012, 'border_count': 35, 'bagging_temperature': 0.7698378674528958, 'random_strength': 4.317026864473311, 'grow_policy': 'Lossguide', 'min_data_in_leaf': 483, 'max_leaves': 144}. Best is trial 684 with value: 198.81639474308358.[0m
[32m[I 2024-10-13 14:39:20,450][0m Trial 700 finished with value: 200.58786400511028 and parameters: {'depth': 7, 'learning_rate': 0.003601637877510343, 'iterations': 2996, 'l2_leaf_reg': 9.818210818739553, 'border_count': 35, 'bagging_temperature': 0.7419659317060845, 'random_strength': 4.252092943767288, 'grow_policy': 'Lossguide', 'min_data_in_leaf': 492, 'max_leaves': 146}. Best is trial 684 with value: 198.81639474308358.[0m
[32m[I 2024-10-13 14:39:23,187][0m Trial 701 finished with value: 200.6692121375818 and parameters: {'depth': 7, 'learning_rate': 0.003542740734651454, 'iterations': 2988, 'l2_leaf_reg': 8.743137652089258, 'border_count': 35, 'bagging_temperature': 0.7462666273638066, 'random_strength': 4.253501347099443, 'grow_policy': 'Lossguide', 'min_data_in_leaf': 495, 'max_leaves': 145}. Best is trial 684 with value: 198.81639474308358.[0m
[32m[I 2024-10-13 14:39:25,931][0m Trial 702 finished with value: 200.45305759327744 and parameters: {'depth': 7, 'learning_rate': 0.003609467672446786, 'iterations': 2984, 'l2_leaf_reg': 9.827833523938544, 'border_count': 36, 'bagging_temperature': 0.7406925001953818, 'random_strength': 4.291378300235394, 'grow_policy': 'Lossguide', 'min_data_in_leaf': 485, 'max_leaves': 147}. Best is trial 684 with value: 198.81639474308358.[0m
