[32m[I 2024-10-13 14:14:23,885][0m Trial 201 finished with value: 219.91960952704522 and parameters: {'depth': 6, 'learning_rate': 0.0029681232749542, 'iterations': 2647, 'l2_leaf_reg': 5.617205463932992e-06, 'border_count': 41, 'bagging_temperature': 0.959587030520378, 'random_strength': 7.207080844001565, 'grow_policy': 'Lossguide', 'min_data_in_leaf': 242, 'max_leaves': 85}. Best is trial 99 with value: 219.56324459923857.[0m
[32m[I 2024-10-13 14:14:26,387][0m Trial 202 finished with value: 219.4534454038468 and parameters: {'depth': 6, 'learning_rate': 0.0028253858898720547, 'iterations': 2696, 'l2_leaf_reg': 4.329151855927997e-06, 'border_count': 38, 'bagging_temperature': 0.9722480775617369, 'random_strength': 7.237668493384059, 'grow_policy': 'Lossguide', 'min_data_in_leaf': 385, 'max_leaves': 86}. Best is trial 202 with value: 219.4534454038468.[0m
[32m[I 2024-10-13 14:14:29,048][0m Trial 203 finished with value: 219.79803987480125 and parameters: {'depth': 6, 'learning_rate': 0.002710201220644391, 'iterations': 2657, 'l2_leaf_reg': 1.0576387134486787e-05, 'border_count': 38, 'bagging_temperature': 0.9532431261032299, 'random_strength': 7.224563467924575, 'grow_policy': 'Lossguide', 'min_data_in_leaf': 411, 'max_leaves': 84}. Best is trial 202 with value: 219.4534454038468.[0m
[32m[I 2024-10-13 14:14:33,745][0m Trial 204 finished with value: 238.20149769049777 and parameters: {'depth': 6, 'learning_rate': 0.0019062813796340112, 'iterations': 2674, 'l2_leaf_reg': 9.449177408024034e-06, 'border_count': 48, 'bagging_temperature': 0.9298246682204762, 'random_strength': 7.126849813730277, 'grow_policy': 'Lossguide', 'min_data_in_leaf': 245, 'max_leaves': 84}. Best is trial 202 with value: 219.4534454038468.[0m
[32m[I 2024-10-13 14:14:37,405][0m Trial 205 finished with value: 219.7664185815149 and parameters: {'depth': 6, 'learning_rate': 0.0027554862829227826, 'iterations': 2581, 'l2_leaf_reg': 1.4036077415716064e-05, 'border_count': 39, 'bagging_temperature': 0.9723421942312591, 'random_strength': 6.949743641486482, 'grow_policy': 'Lossguide', 'min_data_in_leaf': 401, 'max_leaves': 85}. Best is trial 202 with value: 219.4534454038468.[0m
[32m[I 2024-10-13 14:14:41,282][0m Trial 206 finished with value: 221.1224025291761 and parameters: {'depth': 6, 'learning_rate': 0.0022095352651501934, 'iterations': 2563, 'l2_leaf_reg': 1.9423538979964467e-05, 'border_count': 40, 'bagging_temperature': 0.9728355989363434, 'random_strength': 6.90502512078225, 'grow_policy': 'Lossguide', 'min_data_in_leaf': 391, 'max_leaves': 87}. Best is trial 202 with value: 219.4534454038468.[0m
[32m[I 2024-10-13 14:14:47,412][0m Trial 207 finished with value: 236.14923856057337 and parameters: {'depth': 6, 'learning_rate': 0.0028712108207778206, 'iterations': 2541, 'l2_leaf_reg': 4.892403552014222e-06, 'border_count': 46, 'bagging_temperature': 0.9516335560244463, 'random_strength': 7.335442707899668, 'grow_policy': 'Depthwise', 'min_data_in_leaf': 417}. Best is trial 202 with value: 219.4534454038468.[0m
[32m[I 2024-10-13 14:15:16,254][0m Trial 208 finished with value: 299.1180375199876 and parameters: {'depth': 6, 'learning_rate': 0.0026975332642303566, 'iterations': 2702, 'l2_leaf_reg': 2.722508869297747e-05, 'border_count': 55, 'bagging_temperature': 0.9792358035627339, 'random_strength': 7.236511738915569, 'grow_policy': 'SymmetricTree', 'min_data_in_leaf': 350}. Best is trial 202 with value: 219.4534454038468.[0m
[32m[I 2024-10-13 14:15:20,792][0m Trial 209 finished with value: 229.99413124232302 and parameters: {'depth': 6, 'learning_rate': 0.0017412982789324837, 'iterations': 2607, 'l2_leaf_reg': 1.3256860983618329e-05, 'border_count': 38, 'bagging_temperature': 0.9952046393118414, 'random_strength': 7.046762852125494, 'grow_policy': 'Lossguide', 'min_data_in_leaf': 317, 'max_leaves': 85}. Best is trial 202 with value: 219.4534454038468.[0m
[32m[I 2024-10-13 14:15:26,329][0m Trial 210 finished with value: 237.06865927298787 and parameters: {'depth': 5, 'learning_rate': 0.0022129323689417395, 'iterations': 2662, 'l2_leaf_reg': 8.69644729982772e-06, 'border_count': 62, 'bagging_temperature': 0.9626469530733847, 'random_strength': 7.574868541903032, 'grow_policy': 'Lossguide', 'min_data_in_leaf': 379, 'max_leaves': 95}. Best is trial 202 with value: 219.4534454038468.[0m
[32m[I 2024-10-13 14:15:31,926][0m Trial 211 finished with value: 224.24542963744508 and parameters: {'depth': 6, 'learning_rate': 0.003797711745122008, 'iterations': 2773, 'l2_leaf_reg': 5.594997703201989e-06, 'border_count': 37, 'bagging_temperature': 0.9998813080792385, 'random_strength': 7.735868569230382, 'grow_policy': 'Lossguide', 'min_data_in_leaf': 430, 'max_leaves': 91}. Best is trial 202 with value: 219.4534454038468.[0m
[32m[I 2024-10-13 14:15:37,390][0m Trial 212 finished with value: 237.28780860736217 and parameters: {'depth': 6, 'learning_rate': 0.0029106063202114572, 'iterations': 2715, 'l2_leaf_reg': 4.1117066531639935e-06, 'border_count': 42, 'bagging_temperature': 0.9299352532447892, 'random_strength': 7.460243143512497, 'grow_policy': 'Lossguide', 'min_data_in_leaf': 221, 'max_leaves': 167}. Best is trial 202 with value: 219.4534454038468.[0m
[32m[I 2024-10-13 14:15:42,659][0m Trial 213 finished with value: 220.5926520258636 and parameters: {'depth': 6, 'learning_rate': 0.003295893643988971, 'iterations': 2447, 'l2_leaf_reg': 3.472995381223692e-05, 'border_count': 34, 'bagging_temperature': 0.9451777052315025, 'random_strength': 7.8372345570181645, 'grow_policy': 'Lossguide', 'min_data_in_leaf': 406, 'max_leaves': 82}. Best is trial 202 with value: 219.4534454038468.[0m
[32m[I 2024-10-13 14:15:49,179][0m Trial 214 finished with value: 220.087571887187 and parameters: {'depth': 6, 'learning_rate': 0.0025622137976792077, 'iterations': 2478, 'l2_leaf_reg': 4.1507435213718174e-05, 'border_count': 36, 'bagging_temperature': 0.94898399718197, 'random_strength': 7.860316906347364, 'grow_policy': 'Lossguide', 'min_data_in_leaf': 416, 'max_leaves': 76}. Best is trial 202 with value: 219.4534454038468.[0m
[32m[I 2024-10-13 14:15:54,862][0m Trial 215 finished with value: 220.29651288485522 and parameters: {'depth': 6, 'learning_rate': 0.0025322827778257884, 'iterations': 2440, 'l2_leaf_reg': 3.6579511753752313e-05, 'border_count': 35, 'bagging_temperature': 0.9514062929050991, 'random_strength': 7.199978508824788, 'grow_policy': 'Lossguide', 'min_data_in_leaf': 400, 'max_leaves': 78}. Best is trial 202 with value: 219.4534454038468.[0m
[32m[I 2024-10-13 14:16:00,592][0m Trial 216 finished with value: 247.58233706221307 and parameters: {'depth': 6, 'learning_rate': 0.0025324842894157823, 'iterations': 2432, 'l2_leaf_reg': 4.096859718702171e-05, 'border_count': 104, 'bagging_temperature': 0.9432634462563547, 'random_strength': 7.202612421031642, 'grow_policy': 'Lossguide', 'min_data_in_leaf': 409, 'max_leaves': 76}. Best is trial 202 with value: 219.4534454038468.[0m
[32m[I 2024-10-13 14:16:05,462][0m Trial 217 finished with value: 257.99966824076284 and parameters: {'depth': 6, 'learning_rate': 0.0014100221454785866, 'iterations': 2478, 'l2_leaf_reg': 2.7344136220927124e-05, 'border_count': 45, 'bagging_temperature': 0.2653485685726305, 'random_strength': 6.959954083265352, 'grow_policy': 'Lossguide', 'min_data_in_leaf': 403, 'max_leaves': 61}. Best is trial 202 with value: 219.4534454038468.[0m
[32m[I 2024-10-13 14:16:09,750][0m Trial 218 finished with value: 221.3770230760474 and parameters: {'depth': 5, 'learning_rate': 0.0022152087868522337, 'iterations': 2556, 'l2_leaf_reg': 5.267926985427527e-05, 'border_count': 35, 'bagging_temperature': 0.9298659609005511, 'random_strength': 7.573657681579934, 'grow_policy': 'Lossguide', 'min_data_in_leaf': 454, 'max_leaves': 78}. Best is trial 202 with value: 219.4534454038468.[0m
[32m[I 2024-10-13 14:16:15,304][0m Trial 219 finished with value: 718.0487950557249 and parameters: {'depth': 6, 'learning_rate': 0.00015173660082598434, 'iterations': 2441, 'l2_leaf_reg': 1.6233751546531858e-05, 'border_count': 52, 'bagging_temperature': 0.9490913335095771, 'random_strength': 6.519023440768791, 'grow_policy': 'Lossguide', 'min_data_in_leaf': 392, 'max_leaves': 81}. Best is trial 202 with value: 219.4534454038468.[0m
[32m[I 2024-10-13 14:16:20,604][0m Trial 220 finished with value: 219.41594761077803 and parameters: {'depth': 6, 'learning_rate': 0.002701509857136243, 'iterations': 2605, 'l2_leaf_reg': 3.0008045903956907e-05, 'border_count': 41, 'bagging_temperature': 0.9660023845244267, 'random_strength': 7.3058102177893005, 'grow_policy': 'Lossguide', 'min_data_in_leaf': 426, 'max_leaves': 72}. Best is trial 220 with value: 219.41594761077803.[0m
[32m[I 2024-10-13 14:16:25,010][0m Trial 221 finished with value: 219.43974362188132 and parameters: {'depth': 6, 'learning_rate': 0.0026946527845317226, 'iterations': 2606, 'l2_leaf_reg': 4.1674004965791275e-05, 'border_count': 41, 'bagging_temperature': 0.9672523600106222, 'random_strength': 7.325761003532574, 'grow_policy': 'Lossguide', 'min_data_in_leaf': 434, 'max_leaves': 84}. Best is trial 220 with value: 219.41594761077803.[0m
[32m[I 2024-10-13 14:16:28,995][0m Trial 222 finished with value: 234.9781211746376 and parameters: {'depth': 6, 'learning_rate': 0.002582418487742057, 'iterations': 2591, 'l2_leaf_reg': 7.058037519610532e-05, 'border_count': 42, 'bagging_temperature': 0.9720325040030807, 'random_strength': 7.331235363105236, 'grow_policy': 'Lossguide', 'min_data_in_leaf': 430, 'max_leaves': 70}. Best is trial 220 with value: 219.41594761077803.[0m
[32m[I 2024-10-13 14:16:36,544][0m Trial 223 finished with value: 236.82383715043636 and parameters: {'depth': 6, 'learning_rate': 0.0020230116350218783, 'iterations': 2521, 'l2_leaf_reg': 4.267498994413815e-05, 'border_count': 47, 'bagging_temperature': 0.9610977621746961, 'random_strength': 6.833819005573911, 'grow_policy': 'Lossguide', 'min_data_in_leaf': 443, 'max_leaves': 82}. Best is trial 220 with value: 219.41594761077803.[0m
[32m[I 2024-10-13 14:16:43,672][0m Trial 224 finished with value: 219.32688418459782 and parameters: {'depth': 5, 'learning_rate': 0.002865306468316086, 'iterations': 2620, 'l2_leaf_reg': 2.1921417185849555e-05, 'border_count': 37, 'bagging_temperature': 0.9796048796765578, 'random_strength': 7.134081057300458, 'grow_policy': 'Lossguide', 'min_data_in_leaf': 419, 'max_leaves': 77}. Best is trial 224 with value: 219.32688418459782.[0m
[32m[I 2024-10-13 14:16:50,216][0m Trial 225 finished with value: 220.4385506361783 and parameters: {'depth': 5, 'learning_rate': 0.002730995803210818, 'iterations': 2640, 'l2_leaf_reg': 2.5634186644364175e-05, 'border_count': 39, 'bagging_temperature': 0.9491472684955636, 'random_strength': 7.172322961048297, 'grow_policy': 'Lossguide', 'min_data_in_leaf': 464, 'max_leaves': 71}. Best is trial 224 with value: 219.32688418459782.[0m
[32m[I 2024-10-13 14:16:55,998][0m Trial 226 finished with value: 235.62099147570126 and parameters: {'depth': 5, 'learning_rate': 0.002567239160502822, 'iterations': 2637, 'l2_leaf_reg': 3.8254962299375814e-05, 'border_count': 42, 'bagging_temperature': 0.9486845217164752, 'random_strength': 7.118476753600879, 'grow_policy': 'Lossguide', 'min_data_in_leaf': 461, 'max_leaves': 74}. Best is trial 224 with value: 219.32688418459782.[0m
[32m[I 2024-10-13 14:17:00,905][0m Trial 227 finished with value: 220.20402228971037 and parameters: {'depth': 5, 'learning_rate': 0.0023851452681053014, 'iterations': 2584, 'l2_leaf_reg': 3.562307398331228e-05, 'border_count': 36, 'bagging_temperature': 0.9218499437988806, 'random_strength': 7.183546842095774, 'grow_policy': 'Lossguide', 'min_data_in_leaf': 483, 'max_leaves': 70}. Best is trial 224 with value: 219.32688418459782.[0m
[32m[I 2024-10-13 14:17:06,468][0m Trial 228 finished with value: 238.56734352160038 and parameters: {'depth': 5, 'learning_rate': 0.001910538929035611, 'iterations': 2569, 'l2_leaf_reg': 2.479532297386159e-05, 'border_count': 48, 'bagging_temperature': 0.9186816807528381, 'random_strength': 7.04642650563806, 'grow_policy': 'Lossguide', 'min_data_in_leaf': 471, 'max_leaves': 63}. Best is trial 224 with value: 219.32688418459782.[0m
[32m[I 2024-10-13 14:17:13,074][0m Trial 229 finished with value: 219.90321549631136 and parameters: {'depth': 5, 'learning_rate': 0.002278731414523038, 'iterations': 2627, 'l2_leaf_reg': 7.003021303070945e-05, 'border_count': 37, 'bagging_temperature': 0.9701546937941953, 'random_strength': 7.208765258891857, 'grow_policy': 'Lossguide', 'min_data_in_leaf': 499, 'max_leaves': 77}. Best is trial 224 with value: 219.32688418459782.[0m
[32m[I 2024-10-13 14:17:17,853][0m Trial 230 finished with value: 220.15051486600376 and parameters: {'depth': 5, 'learning_rate': 0.0022455762047517243, 'iterations': 2622, 'l2_leaf_reg': 7.768824044395142e-05, 'border_count': 38, 'bagging_temperature': 0.973979999269001, 'random_strength': 7.214877176014619, 'grow_policy': 'Lossguide', 'min_data_in_leaf': 490, 'max_leaves': 68}. Best is trial 224 with value: 219.32688418459782.[0m
[32m[I 2024-10-13 14:17:22,880][0m Trial 231 finished with value: 239.950793140634 and parameters: {'depth': 5, 'learning_rate': 0.0016733878240713458, 'iterations': 2622, 'l2_leaf_reg': 5.7135323838326714e-05, 'border_count': 37, 'bagging_temperature': 0.03328702503463232, 'random_strength': 7.291850427774714, 'grow_policy': 'Lossguide', 'min_data_in_leaf': 499, 'max_leaves': 70}. Best is trial 224 with value: 219.32688418459782.[0m
[32m[I 2024-10-13 14:17:29,654][0m Trial 232 finished with value: 234.88831912060658 and parameters: {'depth': 5, 'learning_rate': 0.0022501951608670545, 'iterations': 2517, 'l2_leaf_reg': 7.195130476366739e-05, 'border_count': 42, 'bagging_temperature': 0.972759380002583, 'random_strength': 6.684870596105719, 'grow_policy': 'Lossguide', 'min_data_in_leaf': 492, 'max_leaves': 58}. Best is trial 224 with value: 219.32688418459782.[0m
[32m[I 2024-10-13 14:17:34,576][0m Trial 233 finished with value: 219.249808929861 and parameters: {'depth': 5, 'learning_rate': 0.0023826629010286105, 'iterations': 2660, 'l2_leaf_reg': 2.515785638050457e-05, 'border_count': 37, 'bagging_temperature': 0.9651694046585139, 'random_strength': 7.1574156654899435, 'grow_policy': 'Lossguide', 'min_data_in_leaf': 527, 'max_leaves': 66}. Best is trial 233 with value: 219.249808929861.[0m
[32m[I 2024-10-13 14:17:37,034][0m Trial 234 finished with value: 235.31508796297103 and parameters: {'depth': 5, 'learning_rate': 0.0023723773934733955, 'iterations': 2656, 'l2_leaf_reg': 2.330785031427503e-05, 'border_count': 45, 'bagging_temperature': 0.9683113579857525, 'random_strength': 7.078850087698614, 'grow_policy': 'Lossguide', 'min_data_in_leaf': 533, 'max_leaves': 77}. Best is trial 233 with value: 219.249808929861.[0m
[32m[I 2024-10-13 14:17:39,434][0m Trial 235 finished with value: 226.3490774645765 and parameters: {'depth': 5, 'learning_rate': 0.0018815094085038338, 'iterations': 2585, 'l2_leaf_reg': 8.779440783500339e-05, 'border_count': 38, 'bagging_temperature': 0.9594332126630075, 'random_strength': 6.829428019065196, 'grow_policy': 'Lossguide', 'min_data_in_leaf': 515, 'max_leaves': 67}. Best is trial 233 with value: 219.249808929861.[0m
[32m[I 2024-10-13 14:17:41,962][0m Trial 236 finished with value: 237.77157303268652 and parameters: {'depth': 5, 'learning_rate': 0.002711833337705658, 'iterations': 2669, 'l2_leaf_reg': 3.4664267777507896e-05, 'border_count': 51, 'bagging_temperature': 0.9777877219492899, 'random_strength': 7.247843447077502, 'grow_policy': 'Lossguide', 'min_data_in_leaf': 468, 'max_leaves': 73}. Best is trial 233 with value: 219.249808929861.[0m
[32m[I 2024-10-13 14:17:44,404][0m Trial 237 finished with value: 220.31347150440496 and parameters: {'depth': 5, 'learning_rate': 0.0022572762420355543, 'iterations': 2617, 'l2_leaf_reg': 1.537363063231243e-05, 'border_count': 38, 'bagging_temperature': 0.9482885192758751, 'random_strength': 7.360864439120444, 'grow_policy': 'Lossguide', 'min_data_in_leaf': 446, 'max_leaves': 56}. Best is trial 233 with value: 219.249808929861.[0m
[32m[I 2024-10-13 14:17:46,989][0m Trial 238 finished with value: 251.2939855951639 and parameters: {'depth': 5, 'learning_rate': 0.001588074204650258, 'iterations': 2836, 'l2_leaf_reg': 1.310169197708082e-05, 'border_count': 243, 'bagging_temperature': 0.9486422603884767, 'random_strength': 7.436155024052631, 'grow_policy': 'Lossguide', 'min_data_in_leaf': 492, 'max_leaves': 65}. Best is trial 233 with value: 219.249808929861.[0m
[32m[I 2024-10-13 14:17:49,422][0m Trial 239 finished with value: 220.98969784508495 and parameters: {'depth': 5, 'learning_rate': 0.0021817632773332915, 'iterations': 2606, 'l2_leaf_reg': 1.844604847693148e-05, 'border_count': 41, 'bagging_temperature': 0.9760532262710787, 'random_strength': 6.963950089406753, 'grow_policy': 'Lossguide', 'min_data_in_leaf': 427, 'max_leaves': 55}. Best is trial 233 with value: 219.249808929861.[0m
[32m[I 2024-10-13 14:17:51,940][0m Trial 240 finished with value: 219.83586093494935 and parameters: {'depth': 4, 'learning_rate': 0.0026253834318696015, 'iterations': 2548, 'l2_leaf_reg': 1.2248488182603072e-05, 'border_count': 36, 'bagging_temperature': 0.9601268230971199, 'random_strength': 7.296281965856985, 'grow_policy': 'Lossguide', 'min_data_in_leaf': 448, 'max_leaves': 71}. Best is trial 233 with value: 219.249808929861.[0m
[32m[I 2024-10-13 14:17:54,469][0m Trial 241 finished with value: 219.70660311586082 and parameters: {'depth': 4, 'learning_rate': 0.0027232357615076352, 'iterations': 2518, 'l2_leaf_reg': 2.8053779959171163e-05, 'border_count': 35, 'bagging_temperature': 0.9614394021168763, 'random_strength': 7.2074000556060716, 'grow_policy': 'Lossguide', 'min_data_in_leaf': 463, 'max_leaves': 71}. Best is trial 233 with value: 219.249808929861.[0m
[32m[I 2024-10-13 14:17:56,765][0m Trial 242 finished with value: 219.66279934707984 and parameters: {'depth': 4, 'learning_rate': 0.0024249839397547687, 'iterations': 2534, 'l2_leaf_reg': 1.4971258558056009e-05, 'border_count': 34, 'bagging_temperature': 0.985485966056395, 'random_strength': 7.401702408437104, 'grow_policy': 'Lossguide', 'min_data_in_leaf': 443, 'max_leaves': 68}. Best is trial 233 with value: 219.249808929861.[0m
[32m[I 2024-10-13 14:17:59,143][0m Trial 243 finished with value: 219.613617255491 and parameters: {'depth': 4, 'learning_rate': 0.0026279806362846836, 'iterations': 2512, 'l2_leaf_reg': 1.1304368593555641e-05, 'border_count': 35, 'bagging_temperature': 0.9841886785611521, 'random_strength': 7.511208310243821, 'grow_policy': 'Lossguide', 'min_data_in_leaf': 250, 'max_leaves': 63}. Best is trial 233 with value: 219.249808929861.[0m
[32m[I 2024-10-13 14:18:01,684][0m Trial 244 finished with value: 219.08127901639878 and parameters: {'depth': 4, 'learning_rate': 0.002842918758120157, 'iterations': 2524, 'l2_leaf_reg': 1.4558084372547775e-05, 'border_count': 32, 'bagging_temperature': 0.9973795310910487, 'random_strength': 7.480127134808302, 'grow_policy': 'Lossguide', 'min_data_in_leaf': 241, 'max_leaves': 63}. Best is trial 244 with value: 219.08127901639878.[0m
[32m[I 2024-10-13 14:18:03,976][0m Trial 245 finished with value: 219.66919645462588 and parameters: {'depth': 4, 'learning_rate': 0.00287942576430545, 'iterations': 2504, 'l2_leaf_reg': 1.1523137296676528e-05, 'border_count': 30, 'bagging_temperature': 0.9868517295835038, 'random_strength': 7.521463343135363, 'grow_policy': 'Lossguide', 'min_data_in_leaf': 250, 'max_leaves': 60}. Best is trial 244 with value: 219.08127901639878.[0m
[32m[I 2024-10-13 14:18:06,280][0m Trial 246 finished with value: 228.35307587055163 and parameters: {'depth': 4, 'learning_rate': 0.0019065740628771285, 'iterations': 2502, 'l2_leaf_reg': 1.134954032604515e-05, 'border_count': 29, 'bagging_temperature': 0.9981605162170148, 'random_strength': 7.529563807809496, 'grow_policy': 'Lossguide', 'min_data_in_leaf': 249, 'max_leaves': 62}. Best is trial 244 with value: 219.08127901639878.[0m
[32m[I 2024-10-13 14:18:08,682][0m Trial 247 finished with value: 219.3458400779327 and parameters: {'depth': 4, 'learning_rate': 0.0027760616945544272, 'iterations': 2539, 'l2_leaf_reg': 8.242632786265142e-06, 'border_count': 31, 'bagging_temperature': 0.9814331721576804, 'random_strength': 7.4957667702768385, 'grow_policy': 'Lossguide', 'min_data_in_leaf': 270, 'max_leaves': 66}. Best is trial 244 with value: 219.08127901639878.[0m
[32m[I 2024-10-13 14:18:11,049][0m Trial 248 finished with value: 220.32369227787177 and parameters: {'depth': 4, 'learning_rate': 0.002755642436274514, 'iterations': 2537, 'l2_leaf_reg': 8.167488610625128e-06, 'border_count': 29, 'bagging_temperature': 0.9980686282892184, 'random_strength': 7.450629838985997, 'grow_policy': 'Lossguide', 'min_data_in_leaf': 270, 'max_leaves': 63}. Best is trial 244 with value: 219.08127901639878.[0m
[32m[I 2024-10-13 14:18:13,450][0m Trial 249 finished with value: 218.928091082675 and parameters: {'depth': 4, 'learning_rate': 0.0028164207860752843, 'iterations': 2488, 'l2_leaf_reg': 1.1072320040283702e-05, 'border_count': 32, 'bagging_temperature': 0.97930031836533, 'random_strength': 7.643291229458604, 'grow_policy': 'Depthwise', 'min_data_in_leaf': 235}. Best is trial 249 with value: 218.928091082675.[0m
[32m[I 2024-10-13 14:18:15,766][0m Trial 250 finished with value: 220.60117611049648 and parameters: {'depth': 4, 'learning_rate': 0.0025858537563976085, 'iterations': 2391, 'l2_leaf_reg': 1.0953085101920948e-05, 'border_count': 31, 'bagging_temperature': 0.9748745737975789, 'random_strength': 7.5671953823110645, 'grow_policy': 'Depthwise', 'min_data_in_leaf': 259}. Best is trial 249 with value: 218.928091082675.[0m
