[32m[I 2024-10-13 14:31:50,620][0m Trial 553 finished with value: 208.06730589735167 and parameters: {'depth': 5, 'learning_rate': 0.004427782253233421, 'iterations': 2609, 'l2_leaf_reg': 5.351541608007416, 'border_count': 25, 'bagging_temperature': 0.8380266991402446, 'random_strength': 6.246041633862725, 'grow_policy': 'Lossguide', 'min_data_in_leaf': 548, 'max_leaves': 84}. Best is trial 535 with value: 203.81678525386107.[0m
[32m[I 2024-10-13 14:31:53,038][0m Trial 554 finished with value: 238.90157834151861 and parameters: {'depth': 5, 'learning_rate': 0.005320582472349322, 'iterations': 2687, 'l2_leaf_reg': 5.163837156733088, 'border_count': 14, 'bagging_temperature': 0.8443288012114504, 'random_strength': 6.440574179342693, 'grow_policy': 'Lossguide', 'min_data_in_leaf': 577, 'max_leaves': 84}. Best is trial 535 with value: 203.81678525386107.[0m
[32m[I 2024-10-13 14:31:55,522][0m Trial 555 finished with value: 242.4727765669495 and parameters: {'depth': 5, 'learning_rate': 0.004826663537723692, 'iterations': 2612, 'l2_leaf_reg': 1.4643976006360455, 'border_count': 20, 'bagging_temperature': 0.8581245849883515, 'random_strength': 6.113056517025527, 'grow_policy': 'Lossguide', 'min_data_in_leaf': 554, 'max_leaves': 93}. Best is trial 535 with value: 203.81678525386107.[0m
[32m[I 2024-10-13 14:31:57,941][0m Trial 556 finished with value: 586.5062037189881 and parameters: {'depth': 5, 'learning_rate': 0.00031998900898684254, 'iterations': 2545, 'l2_leaf_reg': 6.055811936221991, 'border_count': 24, 'bagging_temperature': 0.8258523392254271, 'random_strength': 6.077104212067185, 'grow_policy': 'Lossguide', 'min_data_in_leaf': 539, 'max_leaves': 100}. Best is trial 535 with value: 203.81678525386107.[0m
[32m[I 2024-10-13 14:32:00,290][0m Trial 557 finished with value: 199.73000305555982 and parameters: {'depth': 5, 'learning_rate': 0.004048880468433055, 'iterations': 2508, 'l2_leaf_reg': 9.947499124493913, 'border_count': 26, 'bagging_temperature': 0.8562432339658433, 'random_strength': 5.651300337040005, 'grow_policy': 'Lossguide', 'min_data_in_leaf': 531, 'max_leaves': 88}. Best is trial 557 with value: 199.73000305555982.[0m
[32m[I 2024-10-13 14:32:01,483][0m Trial 558 finished with value: 261.25269819846903 and parameters: {'depth': 5, 'learning_rate': 0.005930224739927696, 'iterations': 868, 'l2_leaf_reg': 9.070186543401626, 'border_count': 16, 'bagging_temperature': 0.863426953731888, 'random_strength': 5.819743102867575, 'grow_policy': 'Lossguide', 'min_data_in_leaf': 521, 'max_leaves': 93}. Best is trial 557 with value: 199.73000305555982.[0m
[32m[I 2024-10-13 14:32:03,784][0m Trial 559 finished with value: 213.30598297212742 and parameters: {'depth': 5, 'learning_rate': 0.0036858692134488077, 'iterations': 2498, 'l2_leaf_reg': 3.5091719745327232, 'border_count': 24, 'bagging_temperature': 0.8487931904904592, 'random_strength': 6.30728117959456, 'grow_policy': 'Lossguide', 'min_data_in_leaf': 554, 'max_leaves': 89}. Best is trial 557 with value: 199.73000305555982.[0m
[32m[I 2024-10-13 14:32:06,073][0m Trial 560 finished with value: 279.87659256248725 and parameters: {'depth': 5, 'learning_rate': 0.004602133136664459, 'iterations': 2509, 'l2_leaf_reg': 4.282456383179532, 'border_count': 8, 'bagging_temperature': 0.844718281326559, 'random_strength': 6.120460218122465, 'grow_policy': 'Lossguide', 'min_data_in_leaf': 562, 'max_leaves': 88}. Best is trial 557 with value: 199.73000305555982.[0m
[32m[I 2024-10-13 14:32:08,469][0m Trial 561 finished with value: 239.54189401346676 and parameters: {'depth': 5, 'learning_rate': 0.0046865062766584115, 'iterations': 2498, 'l2_leaf_reg': 2.2233192074452104, 'border_count': 21, 'bagging_temperature': 0.8192930853987964, 'random_strength': 5.71868516263682, 'grow_policy': 'Lossguide', 'min_data_in_leaf': 583, 'max_leaves': 88}. Best is trial 557 with value: 199.73000305555982.[0m
[32m[I 2024-10-13 14:32:10,862][0m Trial 562 finished with value: 240.05373676898478 and parameters: {'depth': 5, 'learning_rate': 0.004319343576096899, 'iterations': 2557, 'l2_leaf_reg': 2.7522022578573164, 'border_count': 16, 'bagging_temperature': 0.8340336119650658, 'random_strength': 6.262885634407435, 'grow_policy': 'Lossguide', 'min_data_in_leaf': 610, 'max_leaves': 99}. Best is trial 557 with value: 199.73000305555982.[0m
[32m[I 2024-10-13 14:32:13,205][0m Trial 563 finished with value: 210.47212371056978 and parameters: {'depth': 5, 'learning_rate': 0.00407773871835229, 'iterations': 2478, 'l2_leaf_reg': 3.7564440448739913, 'border_count': 25, 'bagging_temperature': 0.8588631625158437, 'random_strength': 5.884248644672513, 'grow_policy': 'Lossguide', 'min_data_in_leaf': 538, 'max_leaves': 83}. Best is trial 557 with value: 199.73000305555982.[0m
[32m[I 2024-10-13 14:32:15,546][0m Trial 564 finished with value: 233.35184592559608 and parameters: {'depth': 5, 'learning_rate': 0.006476794917436321, 'iterations': 2488, 'l2_leaf_reg': 5.003878973584548, 'border_count': 13, 'bagging_temperature': 0.8639610376432316, 'random_strength': 5.718618200560042, 'grow_policy': 'Lossguide', 'min_data_in_leaf': 532, 'max_leaves': 83}. Best is trial 557 with value: 199.73000305555982.[0m
[32m[I 2024-10-13 14:32:17,908][0m Trial 565 finished with value: 219.91864494983432 and parameters: {'depth': 5, 'learning_rate': 0.0050480378137772305, 'iterations': 2469, 'l2_leaf_reg': 3.6873543087291045, 'border_count': 23, 'bagging_temperature': 0.8114785111869626, 'random_strength': 6.158089310954589, 'grow_policy': 'Lossguide', 'min_data_in_leaf': 554, 'max_leaves': 88}. Best is trial 557 with value: 199.73000305555982.[0m
[32m[I 2024-10-13 14:32:20,225][0m Trial 566 finished with value: 231.61282185500417 and parameters: {'depth': 5, 'learning_rate': 0.005391889199337666, 'iterations': 2504, 'l2_leaf_reg': 6.6719992215421655, 'border_count': 18, 'bagging_temperature': 0.8508550035303403, 'random_strength': 5.294944294785686, 'grow_policy': 'Lossguide', 'min_data_in_leaf': 529, 'max_leaves': 92}. Best is trial 557 with value: 199.73000305555982.[0m
[32m[I 2024-10-13 14:32:22,593][0m Trial 567 finished with value: 259.80333302605135 and parameters: {'depth': 5, 'learning_rate': 0.02017362322409892, 'iterations': 2589, 'l2_leaf_reg': 1.2154250560604098, 'border_count': 26, 'bagging_temperature': 0.8047114204825843, 'random_strength': 5.4930040523908055, 'grow_policy': 'Lossguide', 'min_data_in_leaf': 563, 'max_leaves': 80}. Best is trial 557 with value: 199.73000305555982.[0m
[32m[I 2024-10-13 14:32:24,893][0m Trial 568 finished with value: 222.9934938999386 and parameters: {'depth': 5, 'learning_rate': 0.004220227804043717, 'iterations': 2452, 'l2_leaf_reg': 3.414231378570637, 'border_count': 187, 'bagging_temperature': 0.8683306176426571, 'random_strength': 5.856528070357762, 'grow_policy': 'Lossguide', 'min_data_in_leaf': 516, 'max_leaves': 84}. Best is trial 557 with value: 199.73000305555982.[0m
[32m[I 2024-10-13 14:32:27,495][0m Trial 569 finished with value: 205.63860515067665 and parameters: {'depth': 5, 'learning_rate': 0.004115519599135458, 'iterations': 2639, 'l2_leaf_reg': 8.766215778072194, 'border_count': 23, 'bagging_temperature': 0.8821810981583464, 'random_strength': 6.315511024911757, 'grow_policy': 'Lossguide', 'min_data_in_leaf': 545, 'max_leaves': 96}. Best is trial 557 with value: 199.73000305555982.[0m
[32m[I 2024-10-13 14:32:30,059][0m Trial 570 finished with value: 277.676291201641 and parameters: {'depth': 5, 'learning_rate': 0.005730251065708635, 'iterations': 2710, 'l2_leaf_reg': 6.056803414390467, 'border_count': 8, 'bagging_temperature': 0.8461073488267451, 'random_strength': 6.3603298626640825, 'grow_policy': 'Lossguide', 'min_data_in_leaf': 546, 'max_leaves': 95}. Best is trial 557 with value: 199.73000305555982.[0m
[32m[I 2024-10-13 14:32:32,556][0m Trial 571 finished with value: 232.4375624017052 and parameters: {'depth': 5, 'learning_rate': 0.004322010690823912, 'iterations': 2654, 'l2_leaf_reg': 6.461540001763826, 'border_count': 16, 'bagging_temperature': 0.7897826218590308, 'random_strength': 5.917955767711748, 'grow_policy': 'Lossguide', 'min_data_in_leaf': 573, 'max_leaves': 90}. Best is trial 557 with value: 199.73000305555982.[0m
[32m[I 2024-10-13 14:32:34,966][0m Trial 572 finished with value: 227.35527040746962 and parameters: {'depth': 5, 'learning_rate': 0.004594917474807427, 'iterations': 2615, 'l2_leaf_reg': 9.837856376126462, 'border_count': 20, 'bagging_temperature': 0.8373374824592915, 'random_strength': 6.10394340158804, 'grow_policy': 'Lossguide', 'min_data_in_leaf': 602, 'max_leaves': 86}. Best is trial 557 with value: 199.73000305555982.[0m
[32m[I 2024-10-13 14:32:37,439][0m Trial 573 finished with value: 214.7081977925552 and parameters: {'depth': 5, 'learning_rate': 0.003996059152478468, 'iterations': 2674, 'l2_leaf_reg': 2.8689092441471065, 'border_count': 25, 'bagging_temperature': 0.8763888736740727, 'random_strength': 5.944875442436194, 'grow_policy': 'Lossguide', 'min_data_in_leaf': 532, 'max_leaves': 81}. Best is trial 557 with value: 199.73000305555982.[0m
[32m[I 2024-10-13 14:32:39,964][0m Trial 574 finished with value: 237.60473667956683 and parameters: {'depth': 5, 'learning_rate': 0.005067319205130382, 'iterations': 2745, 'l2_leaf_reg': 2.7101533763000036, 'border_count': 13, 'bagging_temperature': 0.8647578002897172, 'random_strength': 5.484330071411757, 'grow_policy': 'Lossguide', 'min_data_in_leaf': 529, 'max_leaves': 103}. Best is trial 557 with value: 199.73000305555982.[0m
[32m[I 2024-10-13 14:32:42,423][0m Trial 575 finished with value: 214.28430868651571 and parameters: {'depth': 5, 'learning_rate': 0.00416824818867582, 'iterations': 2722, 'l2_leaf_reg': 4.156012685376358, 'border_count': 22, 'bagging_temperature': 0.8665987592746974, 'random_strength': 5.904074254161657, 'grow_policy': 'Lossguide', 'min_data_in_leaf': 547, 'max_leaves': 82}. Best is trial 557 with value: 199.73000305555982.[0m
[32m[I 2024-10-13 14:32:44,978][0m Trial 576 finished with value: 237.07890612757083 and parameters: {'depth': 5, 'learning_rate': 0.00536136587443818, 'iterations': 2780, 'l2_leaf_reg': 3.7046606458069467, 'border_count': 18, 'bagging_temperature': 0.8842389903826327, 'random_strength': 5.6012714128700445, 'grow_policy': 'Lossguide', 'min_data_in_leaf': 549, 'max_leaves': 92}. Best is trial 557 with value: 199.73000305555982.[0m
[32m[I 2024-10-13 14:32:47,571][0m Trial 577 finished with value: 226.8129235660714 and parameters: {'depth': 5, 'learning_rate': 0.004446681320459163, 'iterations': 2726, 'l2_leaf_reg': 1.585272265424877, 'border_count': 24, 'bagging_temperature': 0.8820201609512793, 'random_strength': 6.0951574071420325, 'grow_policy': 'Lossguide', 'min_data_in_leaf': 526, 'max_leaves': 85}. Best is trial 557 with value: 199.73000305555982.[0m
[32m[I 2024-10-13 14:32:50,048][0m Trial 578 finished with value: 279.06008399326043 and parameters: {'depth': 5, 'learning_rate': 0.006091136423327608, 'iterations': 2689, 'l2_leaf_reg': 4.454005688034685, 'border_count': 5, 'bagging_temperature': 0.8536685164008831, 'random_strength': 5.957321905014541, 'grow_policy': 'Lossguide', 'min_data_in_leaf': 580, 'max_leaves': 80}. Best is trial 557 with value: 199.73000305555982.[0m
[32m[I 2024-10-13 14:32:52,725][0m Trial 579 finished with value: 238.96190745027317 and parameters: {'depth': 5, 'learning_rate': 0.00405331783609804, 'iterations': 2770, 'l2_leaf_reg': 2.195220769865642, 'border_count': 19, 'bagging_temperature': 0.8825952219679633, 'random_strength': 5.841484364055484, 'grow_policy': 'Lossguide', 'min_data_in_leaf': 560, 'max_leaves': 88}. Best is trial 557 with value: 199.73000305555982.[0m
[32m[I 2024-10-13 14:32:55,170][0m Trial 580 finished with value: 223.41285701876984 and parameters: {'depth': 5, 'learning_rate': 0.00792340755251745, 'iterations': 2647, 'l2_leaf_reg': 9.782977216548465, 'border_count': 23, 'bagging_temperature': 0.8725898079010037, 'random_strength': 5.9858770085061614, 'grow_policy': 'Lossguide', 'min_data_in_leaf': 509, 'max_leaves': 97}. Best is trial 557 with value: 199.73000305555982.[0m
[32m[I 2024-10-13 14:32:57,793][0m Trial 581 finished with value: 235.18823404901042 and parameters: {'depth': 5, 'learning_rate': 0.004909796092675476, 'iterations': 2720, 'l2_leaf_reg': 5.619358844658484, 'border_count': 16, 'bagging_temperature': 0.8522453762482942, 'random_strength': 6.372493035768825, 'grow_policy': 'Lossguide', 'min_data_in_leaf': 537, 'max_leaves': 82}. Best is trial 557 with value: 199.73000305555982.[0m
[32m[I 2024-10-13 14:33:00,440][0m Trial 582 finished with value: 288.79241195119124 and parameters: {'depth': 5, 'learning_rate': 0.00400640739628981, 'iterations': 2673, 'l2_leaf_reg': 3.349573402133407, 'border_count': 12, 'bagging_temperature': 0.8248176056817481, 'random_strength': 6.268453649944183, 'grow_policy': 'Lossguide', 'min_data_in_leaf': 548, 'max_leaves': 90}. Best is trial 557 with value: 199.73000305555982.[0m
[32m[I 2024-10-13 14:33:03,060][0m Trial 583 finished with value: 201.99737986730574 and parameters: {'depth': 5, 'learning_rate': 0.0038220817790019274, 'iterations': 2731, 'l2_leaf_reg': 6.408660057810627, 'border_count': 26, 'bagging_temperature': 0.882623704259157, 'random_strength': 5.961268460387885, 'grow_policy': 'Lossguide', 'min_data_in_leaf': 590, 'max_leaves': 84}. Best is trial 557 with value: 199.73000305555982.[0m
[32m[I 2024-10-13 14:33:05,696][0m Trial 584 finished with value: 212.79174804030535 and parameters: {'depth': 5, 'learning_rate': 0.006428737921164605, 'iterations': 2721, 'l2_leaf_reg': 7.426187896716648, 'border_count': 26, 'bagging_temperature': 0.8835029984065219, 'random_strength': 5.863476227774957, 'grow_policy': 'Lossguide', 'min_data_in_leaf': 585, 'max_leaves': 85}. Best is trial 557 with value: 199.73000305555982.[0m
[32m[I 2024-10-13 14:33:08,441][0m Trial 585 finished with value: 213.42937399136915 and parameters: {'depth': 5, 'learning_rate': 0.004952826806292212, 'iterations': 2791, 'l2_leaf_reg': 7.042153454015608, 'border_count': 22, 'bagging_temperature': 0.8812647339589883, 'random_strength': 5.577735495348004, 'grow_policy': 'Lossguide', 'min_data_in_leaf': 586, 'max_leaves': 84}. Best is trial 557 with value: 199.73000305555982.[0m
[32m[I 2024-10-13 14:33:11,079][0m Trial 586 finished with value: 277.5329862699399 and parameters: {'depth': 5, 'learning_rate': 0.005635370662487728, 'iterations': 2805, 'l2_leaf_reg': 7.56055969854784, 'border_count': 12, 'bagging_temperature': 0.8817679824558005, 'random_strength': 5.2084963273387554, 'grow_policy': 'Lossguide', 'min_data_in_leaf': 628, 'max_leaves': 85}. Best is trial 557 with value: 199.73000305555982.[0m
[32m[I 2024-10-13 14:33:13,816][0m Trial 587 finished with value: 240.23660342823584 and parameters: {'depth': 5, 'learning_rate': 0.007404685170058933, 'iterations': 2816, 'l2_leaf_reg': 5.247649189232665, 'border_count': 21, 'bagging_temperature': 0.8657695366360106, 'random_strength': 5.63177399574645, 'grow_policy': 'Lossguide', 'min_data_in_leaf': 604, 'max_leaves': 94}. Best is trial 557 with value: 199.73000305555982.[0m
[32m[I 2024-10-13 14:33:16,510][0m Trial 588 finished with value: 236.25186263380465 and parameters: {'depth': 5, 'learning_rate': 0.006537970849479317, 'iterations': 2774, 'l2_leaf_reg': 6.642591485025086, 'border_count': 16, 'bagging_temperature': 0.8344545871185234, 'random_strength': 5.55445690480149, 'grow_policy': 'Lossguide', 'min_data_in_leaf': 591, 'max_leaves': 83}. Best is trial 557 with value: 199.73000305555982.[0m
[32m[I 2024-10-13 14:33:19,220][0m Trial 589 finished with value: 240.47983786693902 and parameters: {'depth': 5, 'learning_rate': 0.005599126824988625, 'iterations': 2827, 'l2_leaf_reg': 3.1581307901534026, 'border_count': 21, 'bagging_temperature': 0.8771603025516295, 'random_strength': 5.935757466960972, 'grow_policy': 'Lossguide', 'min_data_in_leaf': 619, 'max_leaves': 89}. Best is trial 557 with value: 199.73000305555982.[0m
[32m[I 2024-10-13 14:33:21,876][0m Trial 590 finished with value: 275.6203359857688 and parameters: {'depth': 5, 'learning_rate': 0.005072667328236133, 'iterations': 2757, 'l2_leaf_reg': 9.782331209321697, 'border_count': 8, 'bagging_temperature': 0.8542594504710281, 'random_strength': 5.329048481432456, 'grow_policy': 'Lossguide', 'min_data_in_leaf': 582, 'max_leaves': 81}. Best is trial 557 with value: 199.73000305555982.[0m
[32m[I 2024-10-13 14:33:24,472][0m Trial 591 finished with value: 244.12022711630857 and parameters: {'depth': 5, 'learning_rate': 0.00917383574534648, 'iterations': 2729, 'l2_leaf_reg': 4.4753017524523075, 'border_count': 24, 'bagging_temperature': 0.8821915509299952, 'random_strength': 5.663572844384894, 'grow_policy': 'Lossguide', 'min_data_in_leaf': 601, 'max_leaves': 87}. Best is trial 557 with value: 199.73000305555982.[0m
[32m[I 2024-10-13 14:33:27,208][0m Trial 592 finished with value: 247.0786715401816 and parameters: {'depth': 5, 'learning_rate': 0.007299336293186485, 'iterations': 2800, 'l2_leaf_reg': 2.588877391203132, 'border_count': 18, 'bagging_temperature': 0.8515425214811722, 'random_strength': 5.867526828882858, 'grow_policy': 'Lossguide', 'min_data_in_leaf': 585, 'max_leaves': 92}. Best is trial 557 with value: 199.73000305555982.[0m
[32m[I 2024-10-13 14:33:29,960][0m Trial 593 finished with value: 232.31787360346988 and parameters: {'depth': 5, 'learning_rate': 0.005996024722225428, 'iterations': 2889, 'l2_leaf_reg': 1.8654224184317552, 'border_count': 25, 'bagging_temperature': 0.8714411199680574, 'random_strength': 5.020908896291104, 'grow_policy': 'Lossguide', 'min_data_in_leaf': 567, 'max_leaves': 79}. Best is trial 557 with value: 199.73000305555982.[0m
[32m[I 2024-10-13 14:33:40,336][0m Trial 594 finished with value: 437.9474549104208 and parameters: {'depth': 5, 'learning_rate': 0.004802617920385638, 'iterations': 2694, 'l2_leaf_reg': 9.858219110419961, 'border_count': 3, 'bagging_temperature': 0.8299635896156358, 'random_strength': 5.932542170624327, 'grow_policy': 'SymmetricTree', 'min_data_in_leaf': 568}. Best is trial 557 with value: 199.73000305555982.[0m
[32m[I 2024-10-13 14:33:42,987][0m Trial 595 finished with value: 282.2081597725387 and parameters: {'depth': 5, 'learning_rate': 0.004614562542367157, 'iterations': 2756, 'l2_leaf_reg': 5.325402158952278, 'border_count': 12, 'bagging_temperature': 0.8820686331992853, 'random_strength': 6.0185864193554455, 'grow_policy': 'Lossguide', 'min_data_in_leaf': 550, 'max_leaves': 96}. Best is trial 557 with value: 199.73000305555982.[0m
[32m[I 2024-10-13 14:33:45,658][0m Trial 596 finished with value: 242.99530062521555 and parameters: {'depth': 6, 'learning_rate': 0.0071221801559289925, 'iterations': 2739, 'l2_leaf_reg': 3.792206957132825, 'border_count': 21, 'bagging_temperature': 0.8534646600271363, 'random_strength': 5.4139968068817605, 'grow_policy': 'Lossguide', 'min_data_in_leaf': 637, 'max_leaves': 84}. Best is trial 557 with value: 199.73000305555982.[0m
[32m[I 2024-10-13 14:33:48,299][0m Trial 597 finished with value: 226.38940970446595 and parameters: {'depth': 5, 'learning_rate': 0.00527723731817278, 'iterations': 2822, 'l2_leaf_reg': 1.053215207762343, 'border_count': 26, 'bagging_temperature': 0.8851635312012469, 'random_strength': 5.747609925514686, 'grow_policy': 'Lossguide', 'min_data_in_leaf': 581, 'max_leaves': 80}. Best is trial 557 with value: 199.73000305555982.[0m
[32m[I 2024-10-13 14:33:50,954][0m Trial 598 finished with value: 236.6009406459583 and parameters: {'depth': 5, 'learning_rate': 0.006351909614670395, 'iterations': 2697, 'l2_leaf_reg': 6.446317167335577, 'border_count': 16, 'bagging_temperature': 0.8091859400366539, 'random_strength': 6.212430515827982, 'grow_policy': 'Lossguide', 'min_data_in_leaf': 557, 'max_leaves': 102}. Best is trial 557 with value: 199.73000305555982.[0m
[32m[I 2024-10-13 14:33:53,564][0m Trial 599 finished with value: 214.35172836452003 and parameters: {'depth': 5, 'learning_rate': 0.004326049644755723, 'iterations': 2674, 'l2_leaf_reg': 2.5848603514118818, 'border_count': 26, 'bagging_temperature': 0.8621383754482517, 'random_strength': 6.323994786925514, 'grow_policy': 'Lossguide', 'min_data_in_leaf': 613, 'max_leaves': 88}. Best is trial 557 with value: 199.73000305555982.[0m
[32m[I 2024-10-13 14:33:56,277][0m Trial 600 finished with value: 248.11492233749388 and parameters: {'depth': 5, 'learning_rate': 0.006656993413236314, 'iterations': 2773, 'l2_leaf_reg': 1.537087696669302, 'border_count': 21, 'bagging_temperature': 0.8582484889482008, 'random_strength': 6.077765986919857, 'grow_policy': 'Lossguide', 'min_data_in_leaf': 610, 'max_leaves': 88}. Best is trial 557 with value: 199.73000305555982.[0m
[32m[I 2024-10-13 14:33:58,843][0m Trial 601 finished with value: 220.46446109488502 and parameters: {'depth': 5, 'learning_rate': 0.004618398138610302, 'iterations': 2727, 'l2_leaf_reg': 2.4625547503308343, 'border_count': 25, 'bagging_temperature': 0.8350722948209631, 'random_strength': 6.392180376610883, 'grow_policy': 'Lossguide', 'min_data_in_leaf': 624, 'max_leaves': 86}. Best is trial 557 with value: 199.73000305555982.[0m
[32m[I 2024-10-13 14:34:01,339][0m Trial 602 finished with value: 252.21915402256587 and parameters: {'depth': 5, 'learning_rate': 0.005933446876181085, 'iterations': 2659, 'l2_leaf_reg': 0.503075434395238, 'border_count': 15, 'bagging_temperature': 0.8684812754797311, 'random_strength': 5.6951763019784245, 'grow_policy': 'Lossguide', 'min_data_in_leaf': 642, 'max_leaves': 94}. Best is trial 557 with value: 199.73000305555982.[0m
