[32m[I 2024-10-13 14:25:08,069][0m Trial 403 finished with value: 235.1542630705934 and parameters: {'depth': 3, 'learning_rate': 0.0025974183882152006, 'iterations': 2469, 'l2_leaf_reg': 6.49852378034682e-06, 'border_count': 50, 'bagging_temperature': 0.9802386723634732, 'random_strength': 7.769404401032743, 'grow_policy': 'Lossguide', 'min_data_in_leaf': 261, 'max_leaves': 69}. Best is trial 249 with value: 218.928091082675.[0m
[32m[I 2024-10-13 14:25:10,535][0m Trial 404 finished with value: 229.1653380979221 and parameters: {'depth': 4, 'learning_rate': 0.0018427475084569149, 'iterations': 2514, 'l2_leaf_reg': 3.634006716493719e-06, 'border_count': 36, 'bagging_temperature': 0.9291607380003689, 'random_strength': 7.193259249627944, 'grow_policy': 'Lossguide', 'min_data_in_leaf': 289, 'max_leaves': 45}. Best is trial 249 with value: 218.928091082675.[0m
[32m[I 2024-10-13 14:25:12,986][0m Trial 405 finished with value: 237.57746636242294 and parameters: {'depth': 14, 'learning_rate': 0.0029417933463311164, 'iterations': 2588, 'l2_leaf_reg': 8.888389452377554e-05, 'border_count': 68, 'bagging_temperature': 0.9648780007558551, 'random_strength': 5.463080984882091, 'grow_policy': 'Lossguide', 'min_data_in_leaf': 166, 'max_leaves': 80}. Best is trial 249 with value: 218.928091082675.[0m
[32m[I 2024-10-13 14:25:15,302][0m Trial 406 finished with value: 221.97167922805596 and parameters: {'depth': 5, 'learning_rate': 0.0023210109823276048, 'iterations': 2417, 'l2_leaf_reg': 2.3444008639125644e-05, 'border_count': 39, 'bagging_temperature': 0.9109626976253511, 'random_strength': 7.436364653200162, 'grow_policy': 'Lossguide', 'min_data_in_leaf': 429, 'max_leaves': 59}. Best is trial 249 with value: 218.928091082675.[0m
[32m[I 2024-10-13 14:25:17,797][0m Trial 407 finished with value: 222.5287797869058 and parameters: {'depth': 4, 'learning_rate': 0.0034837252647359905, 'iterations': 2666, 'l2_leaf_reg': 1.33635809842816e-05, 'border_count': 28, 'bagging_temperature': 0.9466538140714771, 'random_strength': 6.791505269908711, 'grow_policy': 'Depthwise', 'min_data_in_leaf': 243}. Best is trial 249 with value: 218.928091082675.[0m
[32m[I 2024-10-13 14:25:20,030][0m Trial 408 finished with value: 250.59355919503145 and parameters: {'depth': 5, 'learning_rate': 0.002033146211457722, 'iterations': 2288, 'l2_leaf_reg': 9.429325301355527e-06, 'border_count': 127, 'bagging_temperature': 0.9823228231465482, 'random_strength': 7.030412414853429, 'grow_policy': 'Lossguide', 'min_data_in_leaf': 371, 'max_leaves': 50}. Best is trial 249 with value: 218.928091082675.[0m
[32m[I 2024-10-13 14:25:22,383][0m Trial 409 finished with value: 235.46212426394268 and parameters: {'depth': 10, 'learning_rate': 0.0026653819994698373, 'iterations': 2534, 'l2_leaf_reg': 5.353926579605096e-05, 'border_count': 43, 'bagging_temperature': 0.963404364306144, 'random_strength': 7.3239234494123195, 'grow_policy': 'Lossguide', 'min_data_in_leaf': 455, 'max_leaves': 66}. Best is trial 249 with value: 218.928091082675.[0m
[32m[I 2024-10-13 14:25:31,297][0m Trial 410 finished with value: 299.9172986068335 and parameters: {'depth': 3, 'learning_rate': 0.0015114589325669681, 'iterations': 2769, 'l2_leaf_reg': 2.529076988525351e-05, 'border_count': 31, 'bagging_temperature': 0.9831434568487482, 'random_strength': 7.608873469698317, 'grow_policy': 'SymmetricTree', 'min_data_in_leaf': 409}. Best is trial 249 with value: 218.928091082675.[0m
[32m[I 2024-10-13 14:25:33,661][0m Trial 411 finished with value: 248.28539079987743 and parameters: {'depth': 4, 'learning_rate': 0.005162890538585114, 'iterations': 2459, 'l2_leaf_reg': 0.00019697071253893961, 'border_count': 21, 'bagging_temperature': 0.3499435465410563, 'random_strength': 7.842132266693657, 'grow_policy': 'Lossguide', 'min_data_in_leaf': 484, 'max_leaves': 74}. Best is trial 249 with value: 218.928091082675.[0m
[32m[I 2024-10-13 14:25:34,417][0m Trial 412 finished with value: 550.5456545453369 and parameters: {'depth': 4, 'learning_rate': 0.003677408939295912, 'iterations': 235, 'l2_leaf_reg': 1.398216669250424e-05, 'border_count': 37, 'bagging_temperature': 0.8925742228781923, 'random_strength': 8.122420873670396, 'grow_policy': 'Depthwise', 'min_data_in_leaf': 277}. Best is trial 249 with value: 218.928091082675.[0m
[32m[I 2024-10-13 14:25:36,580][0m Trial 413 finished with value: 236.18125537832628 and parameters: {'depth': 4, 'learning_rate': 0.0030668899338621163, 'iterations': 2348, 'l2_leaf_reg': 5.609180340669372e-06, 'border_count': 46, 'bagging_temperature': 0.9414895677911286, 'random_strength': 7.186528316831421, 'grow_policy': 'Lossguide', 'min_data_in_leaf': 219, 'max_leaves': 62}. Best is trial 249 with value: 218.928091082675.[0m
[32m[I 2024-10-13 14:25:39,040][0m Trial 414 finished with value: 221.45309301514425 and parameters: {'depth': 9, 'learning_rate': 0.0022424527637071074, 'iterations': 2625, 'l2_leaf_reg': 1.4167613503826095e-08, 'border_count': 26, 'bagging_temperature': 0.9976667532824288, 'random_strength': 7.544579628203476, 'grow_policy': 'Lossguide', 'min_data_in_leaf': 510, 'max_leaves': 82}. Best is trial 249 with value: 218.928091082675.[0m
[32m[I 2024-10-13 14:25:41,416][0m Trial 415 finished with value: 223.97976622391022 and parameters: {'depth': 5, 'learning_rate': 0.004136125857288246, 'iterations': 2566, 'l2_leaf_reg': 0.000574280173756736, 'border_count': 35, 'bagging_temperature': 0.9605722108214366, 'random_strength': 6.946113345173729, 'grow_policy': 'Lossguide', 'min_data_in_leaf': 557, 'max_leaves': 70}. Best is trial 249 with value: 218.928091082675.[0m
[32m[I 2024-10-13 14:25:44,153][0m Trial 416 finished with value: 219.49711414916544 and parameters: {'depth': 4, 'learning_rate': 0.0026551440218395106, 'iterations': 2860, 'l2_leaf_reg': 3.183127175673678e-05, 'border_count': 32, 'bagging_temperature': 0.9160918476330319, 'random_strength': 8.244838981998424, 'grow_policy': 'Depthwise', 'min_data_in_leaf': 438}. Best is trial 249 with value: 218.928091082675.[0m
[32m[I 2024-10-13 14:25:47,085][0m Trial 417 finished with value: 235.78400937122575 and parameters: {'depth': 4, 'learning_rate': 0.002558629307933166, 'iterations': 2915, 'l2_leaf_reg': 5.051205134408446e-05, 'border_count': 43, 'bagging_temperature': 0.929887620262155, 'random_strength': 6.542269579510883, 'grow_policy': 'Depthwise', 'min_data_in_leaf': 404}. Best is trial 249 with value: 218.928091082675.[0m
[32m[I 2024-10-13 14:25:49,887][0m Trial 418 finished with value: 224.0963255009056 and parameters: {'depth': 12, 'learning_rate': 0.00172422373499578, 'iterations': 2885, 'l2_leaf_reg': 3.6053485713207015e-05, 'border_count': 32, 'bagging_temperature': 0.9705094785348265, 'random_strength': 7.370390396453299, 'grow_policy': 'Depthwise', 'min_data_in_leaf': 432}. Best is trial 249 with value: 218.928091082675.[0m
[32m[I 2024-10-13 14:25:52,589][0m Trial 419 finished with value: 221.08416010214847 and parameters: {'depth': 3, 'learning_rate': 0.003083018741063474, 'iterations': 2820, 'l2_leaf_reg': 7.476437350555585e-05, 'border_count': 39, 'bagging_temperature': 0.9997676404858868, 'random_strength': 7.171396072701164, 'grow_policy': 'Depthwise', 'min_data_in_leaf': 424}. Best is trial 249 with value: 218.928091082675.[0m
[32m[I 2024-10-13 14:25:55,248][0m Trial 420 finished with value: 246.80756592043147 and parameters: {'depth': 4, 'learning_rate': 0.0021813930006193702, 'iterations': 2855, 'l2_leaf_reg': 0.0037886337425150213, 'border_count': 252, 'bagging_temperature': 0.9486931941940732, 'random_strength': 6.779121090254206, 'grow_policy': 'Depthwise', 'min_data_in_leaf': 394}. Best is trial 249 with value: 218.928091082675.[0m
[32m[I 2024-10-13 14:25:57,849][0m Trial 421 finished with value: 220.67806657344784 and parameters: {'depth': 4, 'learning_rate': 0.002481246825194789, 'iterations': 2793, 'l2_leaf_reg': 0.033187390867863355, 'border_count': 26, 'bagging_temperature': 0.9218685110503461, 'random_strength': 7.311289527856818, 'grow_policy': 'Depthwise', 'min_data_in_leaf': 248}. Best is trial 249 with value: 218.928091082675.[0m
[32m[I 2024-10-13 14:26:00,458][0m Trial 422 finished with value: 242.71642743702517 and parameters: {'depth': 4, 'learning_rate': 0.0035039537778841705, 'iterations': 2695, 'l2_leaf_reg': 1.9409361580966994e-05, 'border_count': 54, 'bagging_temperature': 0.980042768920597, 'random_strength': 7.689810664548431, 'grow_policy': 'Depthwise', 'min_data_in_leaf': 446}. Best is trial 249 with value: 218.928091082675.[0m
[32m[I 2024-10-13 14:26:03,152][0m Trial 423 finished with value: 305.220613244975 and parameters: {'depth': 4, 'learning_rate': 0.002007448903108524, 'iterations': 2856, 'l2_leaf_reg': 3.110742869806836e-05, 'border_count': 8, 'bagging_temperature': 0.9591054124983197, 'random_strength': 7.021786150648309, 'grow_policy': 'Depthwise', 'min_data_in_leaf': 312}. Best is trial 249 with value: 218.928091082675.[0m
[32m[I 2024-10-13 14:26:05,711][0m Trial 424 finished with value: 247.87280372642877 and parameters: {'depth': 4, 'learning_rate': 0.0027355182076601817, 'iterations': 2735, 'l2_leaf_reg': 2.1317625069064585e-05, 'border_count': 18, 'bagging_temperature': 0.9445499429018098, 'random_strength': 7.497158939683815, 'grow_policy': 'Depthwise', 'min_data_in_leaf': 266}. Best is trial 249 with value: 218.928091082675.[0m
[32m[I 2024-10-13 14:26:08,459][0m Trial 425 finished with value: 220.69193246176783 and parameters: {'depth': 5, 'learning_rate': 0.003083716414992266, 'iterations': 2933, 'l2_leaf_reg': 0.00013371480768982504, 'border_count': 33, 'bagging_temperature': 0.9819822674581521, 'random_strength': 7.159413099198098, 'grow_policy': 'Depthwise', 'min_data_in_leaf': 383}. Best is trial 249 with value: 218.928091082675.[0m
[32m[I 2024-10-13 14:26:10,854][0m Trial 426 finished with value: 224.28788494319627 and parameters: {'depth': 3, 'learning_rate': 0.0041289272974237195, 'iterations': 2511, 'l2_leaf_reg': 4.127239729520522e-05, 'border_count': 39, 'bagging_temperature': 0.9648931148648844, 'random_strength': 8.337852385194878, 'grow_policy': 'Depthwise', 'min_data_in_leaf': 237}. Best is trial 249 with value: 218.928091082675.[0m
[32m[I 2024-10-13 14:26:13,298][0m Trial 427 finished with value: 235.36727659105728 and parameters: {'depth': 4, 'learning_rate': 0.0024644222404426952, 'iterations': 2618, 'l2_leaf_reg': 1.4907888684607135e-05, 'border_count': 48, 'bagging_temperature': 0.9191371767948839, 'random_strength': 7.369993439411308, 'grow_policy': 'Lossguide', 'min_data_in_leaf': 338, 'max_leaves': 54}. Best is trial 249 with value: 218.928091082675.[0m
[32m[I 2024-10-13 14:26:15,797][0m Trial 428 finished with value: 220.69845651823888 and parameters: {'depth': 4, 'learning_rate': 0.003291415936770569, 'iterations': 2672, 'l2_leaf_reg': 2.8463347927524453e-05, 'border_count': 31, 'bagging_temperature': 0.9990472204546772, 'random_strength': 7.862114204046612, 'grow_policy': 'Depthwise', 'min_data_in_leaf': 413}. Best is trial 249 with value: 218.928091082675.[0m
[32m[I 2024-10-13 14:26:18,190][0m Trial 429 finished with value: 227.47463198590577 and parameters: {'depth': 5, 'learning_rate': 0.0020146478730888756, 'iterations': 2571, 'l2_leaf_reg': 7.148647177273434e-05, 'border_count': 25, 'bagging_temperature': 0.9437194504500864, 'random_strength': 7.608488999441672, 'grow_policy': 'Lossguide', 'min_data_in_leaf': 452, 'max_leaves': 222}. Best is trial 249 with value: 218.928091082675.[0m
[32m[I 2024-10-13 14:26:20,589][0m Trial 430 finished with value: 219.23549857659754 and parameters: {'depth': 4, 'learning_rate': 0.0027777875195524903, 'iterations': 2465, 'l2_leaf_reg': 8.689590209682784e-06, 'border_count': 36, 'bagging_temperature': 0.9722241152831252, 'random_strength': 6.884159809483993, 'grow_policy': 'Lossguide', 'min_data_in_leaf': 430, 'max_leaves': 48}. Best is trial 249 with value: 218.928091082675.[0m
[32m[I 2024-10-13 14:26:22,221][0m Trial 431 finished with value: 235.13345092372995 and parameters: {'depth': 4, 'learning_rate': 0.0048739012805614585, 'iterations': 1448, 'l2_leaf_reg': 1.0599565765425314e-05, 'border_count': 43, 'bagging_temperature': 0.9707536362307794, 'random_strength': 0.8576439732755201, 'grow_policy': 'Lossguide', 'min_data_in_leaf': 581, 'max_leaves': 35}. Best is trial 249 with value: 218.928091082675.[0m
[32m[I 2024-10-13 14:26:24,477][0m Trial 432 finished with value: 218.92237000803334 and parameters: {'depth': 5, 'learning_rate': 0.002858463380144092, 'iterations': 2399, 'l2_leaf_reg': 7.926316185971348e-06, 'border_count': 38, 'bagging_temperature': 0.9852078609095074, 'random_strength': 6.743137508464807, 'grow_policy': 'Lossguide', 'min_data_in_leaf': 362, 'max_leaves': 50}. Best is trial 432 with value: 218.92237000803334.[0m
[32m[I 2024-10-13 14:26:26,887][0m Trial 433 finished with value: 223.00877369194686 and parameters: {'depth': 5, 'learning_rate': 0.0037855522723523063, 'iterations': 2439, 'l2_leaf_reg': 7.633735130427367e-06, 'border_count': 39, 'bagging_temperature': 0.9797661360522448, 'random_strength': 6.653782802734707, 'grow_policy': 'Depthwise', 'min_data_in_leaf': 378}. Best is trial 432 with value: 218.92237000803334.[0m
[32m[I 2024-10-13 14:26:37,844][0m Trial 434 finished with value: 279.4888107054668 and parameters: {'depth': 5, 'learning_rate': 0.003020729530008112, 'iterations': 2800, 'l2_leaf_reg': 8.72525680018307e-06, 'border_count': 31, 'bagging_temperature': 0.9830712294075478, 'random_strength': 6.565540916730171, 'grow_policy': 'SymmetricTree', 'min_data_in_leaf': 358}. Best is trial 432 with value: 218.92237000803334.[0m
[32m[I 2024-10-13 14:26:40,635][0m Trial 435 finished with value: 249.75112297402373 and parameters: {'depth': 5, 'learning_rate': 0.0022281182534634185, 'iterations': 3000, 'l2_leaf_reg': 4.6257263651488705e-06, 'border_count': 21, 'bagging_temperature': 0.9840834597817815, 'random_strength': 6.006124707400856, 'grow_policy': 'Lossguide', 'min_data_in_leaf': 343, 'max_leaves': 41}. Best is trial 432 with value: 218.92237000803334.[0m
[32m[I 2024-10-13 14:26:43,089][0m Trial 436 finished with value: 234.94933045997251 and parameters: {'depth': 3, 'learning_rate': 0.0025384362106317493, 'iterations': 2494, 'l2_leaf_reg': 1.240145756718476e-05, 'border_count': 46, 'bagging_temperature': 0.9972032794019107, 'random_strength': 6.784410335298802, 'grow_policy': 'Lossguide', 'min_data_in_leaf': 367, 'max_leaves': 46}. Best is trial 432 with value: 218.92237000803334.[0m
[32m[I 2024-10-13 14:26:45,517][0m Trial 437 finished with value: 267.26318909143595 and parameters: {'depth': 5, 'learning_rate': 0.0013055546986788893, 'iterations': 2414, 'l2_leaf_reg': 6.584132536503432e-06, 'border_count': 35, 'bagging_temperature': 0.960737070775483, 'random_strength': 6.35091592396506, 'grow_policy': 'Lossguide', 'min_data_in_leaf': 403, 'max_leaves': 50}. Best is trial 432 with value: 218.92237000803334.[0m
[32m[I 2024-10-13 14:26:48,204][0m Trial 438 finished with value: 231.27857148127694 and parameters: {'depth': 4, 'learning_rate': 0.0016924150135381364, 'iterations': 2738, 'l2_leaf_reg': 1.540325770580649e-05, 'border_count': 27, 'bagging_temperature': 0.9997883734562036, 'random_strength': 6.276766959031938, 'grow_policy': 'Depthwise', 'min_data_in_leaf': 381}. Best is trial 432 with value: 218.92237000803334.[0m
[32m[I 2024-10-13 14:26:50,570][0m Trial 439 finished with value: 220.151470111428 and parameters: {'depth': 5, 'learning_rate': 0.003085626217931424, 'iterations': 2603, 'l2_leaf_reg': 9.253492979600532e-06, 'border_count': 40, 'bagging_temperature': 0.9680237329505755, 'random_strength': 6.930178763433405, 'grow_policy': 'Lossguide', 'min_data_in_leaf': 330, 'max_leaves': 46}. Best is trial 432 with value: 218.92237000803334.[0m
[32m[I 2024-10-13 14:26:53,023][0m Trial 440 finished with value: 223.653134647008 and parameters: {'depth': 4, 'learning_rate': 0.00420724178280282, 'iterations': 2486, 'l2_leaf_reg': 1.822550438750546e-05, 'border_count': 33, 'bagging_temperature': 0.9493045724410993, 'random_strength': 6.533837435506874, 'grow_policy': 'Lossguide', 'min_data_in_leaf': 399, 'max_leaves': 49}. Best is trial 432 with value: 218.92237000803334.[0m
[32m[I 2024-10-13 14:26:55,446][0m Trial 441 finished with value: 238.54358734535518 and parameters: {'depth': 4, 'learning_rate': 0.0023852422341156003, 'iterations': 2535, 'l2_leaf_reg': 6.179617419850658e-06, 'border_count': 52, 'bagging_temperature': 0.981778151218061, 'random_strength': 6.750882576219602, 'grow_policy': 'Lossguide', 'min_data_in_leaf': 357, 'max_leaves': 31}. Best is trial 432 with value: 218.92237000803334.[0m
[32m[I 2024-10-13 14:26:57,756][0m Trial 442 finished with value: 223.33943147616338 and parameters: {'depth': 4, 'learning_rate': 0.0035385240303611367, 'iterations': 2443, 'l2_leaf_reg': 0.00030922700598488937, 'border_count': 27, 'bagging_temperature': 0.7122810758616533, 'random_strength': 6.917124496442267, 'grow_policy': 'Depthwise', 'min_data_in_leaf': 292}. Best is trial 432 with value: 218.92237000803334.[0m
[32m[I 2024-10-13 14:27:00,208][0m Trial 443 finished with value: 249.41606073601451 and parameters: {'depth': 3, 'learning_rate': 0.002840247237604278, 'iterations': 2645, 'l2_leaf_reg': 0.14994996984510292, 'border_count': 17, 'bagging_temperature': 0.9695822423931423, 'random_strength': 7.018494225865222, 'grow_policy': 'Lossguide', 'min_data_in_leaf': 429, 'max_leaves': 56}. Best is trial 432 with value: 218.92237000803334.[0m
[32m[I 2024-10-13 14:27:02,735][0m Trial 444 finished with value: 222.9118592892833 and parameters: {'depth': 4, 'learning_rate': 0.0020133978862508658, 'iterations': 2697, 'l2_leaf_reg': 1.1562529580651586e-05, 'border_count': 36, 'bagging_temperature': 0.941762496363513, 'random_strength': 7.077290529098641, 'grow_policy': 'Lossguide', 'min_data_in_leaf': 393, 'max_leaves': 43}. Best is trial 432 with value: 218.92237000803334.[0m
[32m[I 2024-10-13 14:27:05,084][0m Trial 445 finished with value: 253.79226930052005 and parameters: {'depth': 4, 'learning_rate': 0.0035872388039056525, 'iterations': 2546, 'l2_leaf_reg': 1.9432134324584007e-05, 'border_count': 43, 'bagging_temperature': 0.295648842447935, 'random_strength': 6.680634475737565, 'grow_policy': 'Lossguide', 'min_data_in_leaf': 213, 'max_leaves': 58}. Best is trial 432 with value: 218.92237000803334.[0m
[32m[I 2024-10-13 14:27:07,332][0m Trial 446 finished with value: 246.86621654379425 and parameters: {'depth': 5, 'learning_rate': 0.0027272039970087925, 'iterations': 2373, 'l2_leaf_reg': 4.354758941761804e-06, 'border_count': 112, 'bagging_temperature': 0.9818345486416504, 'random_strength': 7.324272613853929, 'grow_policy': 'Depthwise', 'min_data_in_leaf': 258}. Best is trial 432 with value: 218.92237000803334.[0m
[32m[I 2024-10-13 14:27:09,621][0m Trial 447 finished with value: 220.9129549819177 and parameters: {'depth': 4, 'learning_rate': 0.00231577485654948, 'iterations': 2465, 'l2_leaf_reg': 7.998126100413362e-06, 'border_count': 30, 'bagging_temperature': 0.9592905602523776, 'random_strength': 4.878604692164988, 'grow_policy': 'Lossguide', 'min_data_in_leaf': 416, 'max_leaves': 50}. Best is trial 432 with value: 218.92237000803334.[0m
[32m[I 2024-10-13 14:27:11,997][0m Trial 448 finished with value: 228.08680866064861 and parameters: {'depth': 5, 'learning_rate': 0.003261303443786297, 'iterations': 2566, 'l2_leaf_reg': 1.2436636094093128e-05, 'border_count': 23, 'bagging_temperature': 0.9375561787674487, 'random_strength': 6.8781217603269935, 'grow_policy': 'Lossguide', 'min_data_in_leaf': 319, 'max_leaves': 54}. Best is trial 432 with value: 218.92237000803334.[0m
[32m[I 2024-10-13 14:27:14,456][0m Trial 449 finished with value: 245.867851283317 and parameters: {'depth': 3, 'learning_rate': 0.0027904784971309713, 'iterations': 2615, 'l2_leaf_reg': 0.0008135077093575475, 'border_count': 160, 'bagging_temperature': 0.9977630491359105, 'random_strength': 7.238959961501813, 'grow_policy': 'Lossguide', 'min_data_in_leaf': 238, 'max_leaves': 39}. Best is trial 432 with value: 218.92237000803334.[0m
[32m[I 2024-10-13 14:27:16,730][0m Trial 450 finished with value: 289.2578982364161 and parameters: {'depth': 4, 'learning_rate': 0.03719602642894397, 'iterations': 2406, 'l2_leaf_reg': 3.9017009290001774e-05, 'border_count': 232, 'bagging_temperature': 0.967683604703473, 'random_strength': 7.488110684936292, 'grow_policy': 'Depthwise', 'min_data_in_leaf': 133}. Best is trial 432 with value: 218.92237000803334.[0m
[32m[I 2024-10-13 14:27:19,107][0m Trial 451 finished with value: 245.6812572459366 and parameters: {'depth': 11, 'learning_rate': 0.003960017877416453, 'iterations': 2512, 'l2_leaf_reg': 2.4421631441329717e-05, 'border_count': 93, 'bagging_temperature': 0.9992335266150073, 'random_strength': 7.054110760703199, 'grow_policy': 'Lossguide', 'min_data_in_leaf': 188, 'max_leaves': 63}. Best is trial 432 with value: 218.92237000803334.[0m
[32m[I 2024-10-13 14:27:21,675][0m Trial 452 finished with value: 225.94678509591597 and parameters: {'depth': 5, 'learning_rate': 0.0018334648966367845, 'iterations': 2691, 'l2_leaf_reg': 9.990679416654538e-05, 'border_count': 38, 'bagging_temperature': 0.9514700812152187, 'random_strength': 7.411727488773443, 'grow_policy': 'Lossguide', 'min_data_in_leaf': 274, 'max_leaves': 59}. Best is trial 432 with value: 218.92237000803334.[0m
