[32m[I 2024-10-13 06:40:26,783][0m Trial 201 finished with value: 1692.272346770311 and parameters: {'depth': 12, 'learning_rate': 0.017034803873232696, 'iterations': 2103, 'l2_leaf_reg': 0.007108067053547418, 'border_count': 90, 'bagging_temperature': 0.6827261557453318, 'random_strength': 4.326739134115392, 'grow_policy': 'Lossguide', 'min_data_in_leaf': 780, 'max_leaves': 84}. Best is trial 14 with value: 1609.1448261457704.[0m
[32m[I 2024-10-13 06:40:28,900][0m Trial 202 finished with value: 1673.4980541642465 and parameters: {'depth': 13, 'learning_rate': 0.025426423857028833, 'iterations': 2243, 'l2_leaf_reg': 0.03890576946460152, 'border_count': 82, 'bagging_temperature': 0.6677619838357605, 'random_strength': 4.447014447085934, 'grow_policy': 'Lossguide', 'min_data_in_leaf': 842, 'max_leaves': 90}. Best is trial 14 with value: 1609.1448261457704.[0m
[32m[I 2024-10-13 06:40:31,126][0m Trial 203 finished with value: 1677.226411309461 and parameters: {'depth': 14, 'learning_rate': 0.028187327011332048, 'iterations': 2306, 'l2_leaf_reg': 0.10116274035338489, 'border_count': 102, 'bagging_temperature': 0.6969689271748979, 'random_strength': 2.289140664544851, 'grow_policy': 'Lossguide', 'min_data_in_leaf': 761, 'max_leaves': 79}. Best is trial 14 with value: 1609.1448261457704.[0m
[32m[I 2024-10-13 06:40:33,203][0m Trial 204 finished with value: 1687.5970826140979 and parameters: {'depth': 13, 'learning_rate': 0.24894327791798954, 'iterations': 2161, 'l2_leaf_reg': 0.003108123244228082, 'border_count': 88, 'bagging_temperature': 0.6290307407143628, 'random_strength': 4.7406015813160245, 'grow_policy': 'Lossguide', 'min_data_in_leaf': 797, 'max_leaves': 97}. Best is trial 14 with value: 1609.1448261457704.[0m
[32m[I 2024-10-13 06:40:35,496][0m Trial 205 finished with value: 1699.6377749848582 and parameters: {'depth': 11, 'learning_rate': 0.020228359379678502, 'iterations': 2362, 'l2_leaf_reg': 0.014191767200752095, 'border_count': 93, 'bagging_temperature': 0.7370573409305278, 'random_strength': 3.8303302705592426, 'grow_policy': 'Lossguide', 'min_data_in_leaf': 858, 'max_leaves': 92}. Best is trial 14 with value: 1609.1448261457704.[0m
[32m[I 2024-10-13 06:40:36,762][0m Trial 206 finished with value: 1682.5734961635403 and parameters: {'depth': 12, 'learning_rate': 0.03386818222553662, 'iterations': 996, 'l2_leaf_reg': 0.016314539408018407, 'border_count': 76, 'bagging_temperature': 0.6436956550078651, 'random_strength': 4.088754186359326, 'grow_policy': 'Lossguide', 'min_data_in_leaf': 765, 'max_leaves': 84}. Best is trial 14 with value: 1609.1448261457704.[0m
[32m[I 2024-10-13 06:41:49,560][0m Trial 207 finished with value: 1917.9819161036314 and parameters: {'depth': 12, 'learning_rate': 0.029176736792258687, 'iterations': 2274, 'l2_leaf_reg': 0.050570384164106634, 'border_count': 84, 'bagging_temperature': 0.7140203714392185, 'random_strength': 4.5903186270832, 'grow_policy': 'SymmetricTree', 'min_data_in_leaf': 745}. Best is trial 14 with value: 1609.1448261457704.[0m
[32m[I 2024-10-13 06:41:51,599][0m Trial 208 finished with value: 1682.3653945555234 and parameters: {'depth': 13, 'learning_rate': 0.02258862251270384, 'iterations': 2192, 'l2_leaf_reg': 0.0013288038896231299, 'border_count': 98, 'bagging_temperature': 0.6781820278985043, 'random_strength': 4.318708590163837, 'grow_policy': 'Lossguide', 'min_data_in_leaf': 801, 'max_leaves': 101}. Best is trial 14 with value: 1609.1448261457704.[0m
[32m[I 2024-10-13 06:41:53,665][0m Trial 209 finished with value: 1774.9618038073431 and parameters: {'depth': 11, 'learning_rate': 0.031994258709606115, 'iterations': 2069, 'l2_leaf_reg': 0.0058966116851986265, 'border_count': 69, 'bagging_temperature': 0.6598714324157864, 'random_strength': 3.556904249386138, 'grow_policy': 'Lossguide', 'min_data_in_leaf': 818, 'max_leaves': 69}. Best is trial 14 with value: 1609.1448261457704.[0m
[32m[I 2024-10-13 06:41:55,969][0m Trial 210 finished with value: 1665.4537824720112 and parameters: {'depth': 12, 'learning_rate': 0.018779222185789916, 'iterations': 2319, 'l2_leaf_reg': 0.04165326617538084, 'border_count': 89, 'bagging_temperature': 0.6186623616354567, 'random_strength': 4.8654752317684915, 'grow_policy': 'Lossguide', 'min_data_in_leaf': 387, 'max_leaves': 87}. Best is trial 14 with value: 1609.1448261457704.[0m
[32m[I 2024-10-13 06:41:58,312][0m Trial 211 finished with value: 1660.8781229758445 and parameters: {'depth': 14, 'learning_rate': 0.03585875272787211, 'iterations': 2393, 'l2_leaf_reg': 0.03142017145294778, 'border_count': 85, 'bagging_temperature': 0.6268129907131281, 'random_strength': 4.405612272689427, 'grow_policy': 'Lossguide', 'min_data_in_leaf': 781, 'max_leaves': 74}. Best is trial 14 with value: 1609.1448261457704.[0m
[32m[I 2024-10-13 06:42:00,688][0m Trial 212 finished with value: 1652.9959953174089 and parameters: {'depth': 15, 'learning_rate': 0.03536699288222511, 'iterations': 2411, 'l2_leaf_reg': 0.027208507871032708, 'border_count': 80, 'bagging_temperature': 0.6369149005146573, 'random_strength': 4.3728775444595716, 'grow_policy': 'Lossguide', 'min_data_in_leaf': 764, 'max_leaves': 79}. Best is trial 14 with value: 1609.1448261457704.[0m
[32m[I 2024-10-13 06:42:03,097][0m Trial 213 finished with value: 1661.8611708779943 and parameters: {'depth': 15, 'learning_rate': 0.02621675030590248, 'iterations': 2419, 'l2_leaf_reg': 0.031432300673654094, 'border_count': 80, 'bagging_temperature': 0.6380789058892066, 'random_strength': 4.180960201124025, 'grow_policy': 'Lossguide', 'min_data_in_leaf': 791, 'max_leaves': 76}. Best is trial 14 with value: 1609.1448261457704.[0m
[32m[I 2024-10-13 06:42:05,414][0m Trial 214 finished with value: 1765.6983613597235 and parameters: {'depth': 14, 'learning_rate': 0.0236003569590773, 'iterations': 2374, 'l2_leaf_reg': 0.022674399485528678, 'border_count': 74, 'bagging_temperature': 0.6528473844390987, 'random_strength': 4.433089261722052, 'grow_policy': 'Lossguide', 'min_data_in_leaf': 769, 'max_leaves': 81}. Best is trial 14 with value: 1609.1448261457704.[0m
[32m[I 2024-10-13 06:42:07,909][0m Trial 215 finished with value: 1661.0344775397086 and parameters: {'depth': 14, 'learning_rate': 0.0316503898841646, 'iterations': 2496, 'l2_leaf_reg': 0.08580158126783055, 'border_count': 83, 'bagging_temperature': 0.6835833729467927, 'random_strength': 4.0893535791837685, 'grow_policy': 'Lossguide', 'min_data_in_leaf': 780, 'max_leaves': 31}. Best is trial 14 with value: 1609.1448261457704.[0m
[32m[I 2024-10-13 06:42:10,115][0m Trial 216 finished with value: 1656.5849633543166 and parameters: {'depth': 15, 'learning_rate': 0.036488839954125885, 'iterations': 2265, 'l2_leaf_reg': 0.01048179065247008, 'border_count': 79, 'bagging_temperature': 0.6286253633691703, 'random_strength': 3.876310185640597, 'grow_policy': 'Lossguide', 'min_data_in_leaf': 748, 'max_leaves': 75}. Best is trial 14 with value: 1609.1448261457704.[0m
[32m[I 2024-10-13 06:42:12,319][0m Trial 217 finished with value: 1679.6836482138278 and parameters: {'depth': 15, 'learning_rate': 0.028253372871655424, 'iterations': 2259, 'l2_leaf_reg': 0.01220055317537161, 'border_count': 76, 'bagging_temperature': 0.7075102910179978, 'random_strength': 3.9224683694279827, 'grow_policy': 'Lossguide', 'min_data_in_leaf': 755, 'max_leaves': 80}. Best is trial 14 with value: 1609.1448261457704.[0m
[32m[I 2024-10-13 06:42:14,558][0m Trial 218 finished with value: 1790.0179968572206 and parameters: {'depth': 15, 'learning_rate': 0.02261947033713976, 'iterations': 2319, 'l2_leaf_reg': 0.00352505081333518, 'border_count': 71, 'bagging_temperature': 0.6194879705680725, 'random_strength': 3.2865012995282217, 'grow_policy': 'Lossguide', 'min_data_in_leaf': 549, 'max_leaves': 85}. Best is trial 14 with value: 1609.1448261457704.[0m
[32m[I 2024-10-13 06:42:16,777][0m Trial 219 finished with value: 1749.878379002895 and parameters: {'depth': 15, 'learning_rate': 0.009834695181544123, 'iterations': 2272, 'l2_leaf_reg': 0.01047993106665593, 'border_count': 94, 'bagging_temperature': 0.6654966464988264, 'random_strength': 3.873352299145831, 'grow_policy': 'Lossguide', 'min_data_in_leaf': 732, 'max_leaves': 91}. Best is trial 14 with value: 1609.1448261457704.[0m
[32m[I 2024-10-13 06:43:05,297][0m Trial 220 finished with value: 1949.560189850586 and parameters: {'depth': 10, 'learning_rate': 0.015828173908538128, 'iterations': 2221, 'l2_leaf_reg': 0.0064003637960159745, 'border_count': 79, 'bagging_temperature': 0.5800286374174589, 'random_strength': 4.575965370377109, 'grow_policy': 'SymmetricTree', 'min_data_in_leaf': 743}. Best is trial 14 with value: 1609.1448261457704.[0m
[32m[I 2024-10-13 06:43:07,529][0m Trial 221 finished with value: 1645.1538856628713 and parameters: {'depth': 14, 'learning_rate': 0.03364693996523549, 'iterations': 2384, 'l2_leaf_reg': 0.037773034555530126, 'border_count': 86, 'bagging_temperature': 0.6320762399369576, 'random_strength': 4.2904094816134535, 'grow_policy': 'Lossguide', 'min_data_in_leaf': 790, 'max_leaves': 71}. Best is trial 14 with value: 1609.1448261457704.[0m
[32m[I 2024-10-13 06:43:08,940][0m Trial 222 finished with value: 1873.2030545466798 and parameters: {'depth': 15, 'learning_rate': 0.04027290432036855, 'iterations': 1087, 'l2_leaf_reg': 0.07398790494333166, 'border_count': 9, 'bagging_temperature': 0.6460283153875321, 'random_strength': 4.237468640884928, 'grow_policy': 'Lossguide', 'min_data_in_leaf': 808, 'max_leaves': 236}. Best is trial 14 with value: 1609.1448261457704.[0m
[32m[I 2024-10-13 06:43:11,305][0m Trial 223 finished with value: 1655.5301145128483 and parameters: {'depth': 14, 'learning_rate': 0.030207998428741008, 'iterations': 2346, 'l2_leaf_reg': 0.022279334196967922, 'border_count': 89, 'bagging_temperature': 0.6882514964527874, 'random_strength': 4.095921015919262, 'grow_policy': 'Lossguide', 'min_data_in_leaf': 583, 'max_leaves': 64}. Best is trial 14 with value: 1609.1448261457704.[0m
[32m[I 2024-10-13 06:43:12,489][0m Trial 224 finished with value: 1766.0162591662406 and parameters: {'depth': 14, 'learning_rate': 0.029317547849792853, 'iterations': 864, 'l2_leaf_reg': 0.01675702642569505, 'border_count': 92, 'bagging_temperature': 0.6821747616735488, 'random_strength': 3.7174318746720116, 'grow_policy': 'Lossguide', 'min_data_in_leaf': 581, 'max_leaves': 71}. Best is trial 14 with value: 1609.1448261457704.[0m
[32m[I 2024-10-13 06:43:14,765][0m Trial 225 finished with value: 1674.8169424593586 and parameters: {'depth': 14, 'learning_rate': 0.025844768792565864, 'iterations': 2374, 'l2_leaf_reg': 0.0452887830298178, 'border_count': 87, 'bagging_temperature': 0.6988157148777808, 'random_strength': 4.0573975366978505, 'grow_policy': 'Lossguide', 'min_data_in_leaf': 606, 'max_leaves': 74}. Best is trial 14 with value: 1609.1448261457704.[0m
[32m[I 2024-10-13 06:43:17,024][0m Trial 226 finished with value: 6555.12762690201 and parameters: {'depth': 15, 'learning_rate': 0.00010117519518081696, 'iterations': 2314, 'l2_leaf_reg': 0.02260890849011577, 'border_count': 87, 'bagging_temperature': 0.7608920065909661, 'random_strength': 4.617606966286571, 'grow_policy': 'Lossguide', 'min_data_in_leaf': 826, 'max_leaves': 59}. Best is trial 14 with value: 1609.1448261457704.[0m
[32m[I 2024-10-13 06:43:19,225][0m Trial 227 finished with value: 1687.2021725545214 and parameters: {'depth': 14, 'learning_rate': 0.03376801616100702, 'iterations': 2241, 'l2_leaf_reg': 0.11532871499655142, 'border_count': 98, 'bagging_temperature': 0.662922990361886, 'random_strength': 3.998683049854051, 'grow_policy': 'Lossguide', 'min_data_in_leaf': 587, 'max_leaves': 64}. Best is trial 14 with value: 1609.1448261457704.[0m
[32m[I 2024-10-13 06:43:21,424][0m Trial 228 finished with value: 1702.4888103769379 and parameters: {'depth': 15, 'learning_rate': 0.020047914325634734, 'iterations': 2137, 'l2_leaf_reg': 0.010382442183258513, 'border_count': 92, 'bagging_temperature': 0.6267416867634923, 'random_strength': 4.272236518899822, 'grow_policy': 'Lossguide', 'min_data_in_leaf': 839, 'max_leaves': 79}. Best is trial 14 with value: 1609.1448261457704.[0m
[32m[I 2024-10-13 06:43:23,660][0m Trial 229 finished with value: 1688.4816755145519 and parameters: {'depth': 13, 'learning_rate': 0.1687751773585668, 'iterations': 2319, 'l2_leaf_reg': 0.03183533196690774, 'border_count': 81, 'bagging_temperature': 0.7266351246589193, 'random_strength': 7.211850962670043, 'grow_policy': 'Lossguide', 'min_data_in_leaf': 556, 'max_leaves': 71}. Best is trial 14 with value: 1609.1448261457704.[0m
[32m[I 2024-10-13 06:43:25,836][0m Trial 230 finished with value: 1668.5321240938742 and parameters: {'depth': 14, 'learning_rate': 0.029563811319354177, 'iterations': 2204, 'l2_leaf_reg': 0.0005950687102739861, 'border_count': 85, 'bagging_temperature': 0.6489378804036156, 'random_strength': 3.553135786047946, 'grow_policy': 'Lossguide', 'min_data_in_leaf': 797, 'max_leaves': 64}. Best is trial 14 with value: 1609.1448261457704.[0m
[32m[I 2024-10-13 06:43:28,187][0m Trial 231 finished with value: 1665.6027863535917 and parameters: {'depth': 15, 'learning_rate': 0.03698061667639278, 'iterations': 2430, 'l2_leaf_reg': 0.019263183370879684, 'border_count': 79, 'bagging_temperature': 0.6132473627790386, 'random_strength': 4.349651804473653, 'grow_policy': 'Lossguide', 'min_data_in_leaf': 758, 'max_leaves': 85}. Best is trial 14 with value: 1609.1448261457704.[0m
[32m[I 2024-10-13 06:43:30,437][0m Trial 232 finished with value: 1683.5972973390965 and parameters: {'depth': 14, 'learning_rate': 0.041944142242813814, 'iterations': 2353, 'l2_leaf_reg': 0.01370259610766228, 'border_count': 90, 'bagging_temperature': 0.6914173414566044, 'random_strength': 4.140452048636594, 'grow_policy': 'Lossguide', 'min_data_in_leaf': 574, 'max_leaves': 95}. Best is trial 14 with value: 1609.1448261457704.[0m
[32m[I 2024-10-13 06:43:32,679][0m Trial 233 finished with value: 1650.6797631271845 and parameters: {'depth': 11, 'learning_rate': 0.02445215946201595, 'iterations': 2275, 'l2_leaf_reg': 0.0021353831684968716, 'border_count': 83, 'bagging_temperature': 0.635488628433694, 'random_strength': 4.488872481439049, 'grow_policy': 'Lossguide', 'min_data_in_leaf': 605, 'max_leaves': 39}. Best is trial 14 with value: 1609.1448261457704.[0m
[32m[I 2024-10-13 06:43:34,904][0m Trial 234 finished with value: 1675.1013708966402 and parameters: {'depth': 13, 'learning_rate': 0.02442270082081606, 'iterations': 2251, 'l2_leaf_reg': 0.001717321342296762, 'border_count': 84, 'bagging_temperature': 0.2802700714307604, 'random_strength': 1.7585676994910853, 'grow_policy': 'Lossguide', 'min_data_in_leaf': 603, 'max_leaves': 41}. Best is trial 14 with value: 1609.1448261457704.[0m
[32m[I 2024-10-13 06:43:37,130][0m Trial 235 finished with value: 1652.606987041228 and parameters: {'depth': 11, 'learning_rate': 0.0261527501776409, 'iterations': 2292, 'l2_leaf_reg': 0.0025862280368877085, 'border_count': 93, 'bagging_temperature': 0.6375967783405101, 'random_strength': 4.64486717528855, 'grow_policy': 'Lossguide', 'min_data_in_leaf': 607, 'max_leaves': 77}. Best is trial 14 with value: 1609.1448261457704.[0m
[32m[I 2024-10-13 06:43:39,373][0m Trial 236 finished with value: 1671.9293397543397 and parameters: {'depth': 11, 'learning_rate': 0.022505479358253654, 'iterations': 2328, 'l2_leaf_reg': 0.002254622357278367, 'border_count': 95, 'bagging_temperature': 0.6683007380210396, 'random_strength': 4.684635631919675, 'grow_policy': 'Lossguide', 'min_data_in_leaf': 624, 'max_leaves': 78}. Best is trial 14 with value: 1609.1448261457704.[0m
[32m[I 2024-10-13 06:43:41,549][0m Trial 237 finished with value: 1685.599090386368 and parameters: {'depth': 11, 'learning_rate': 0.0258458160689215, 'iterations': 2186, 'l2_leaf_reg': 0.0008814970425579719, 'border_count': 104, 'bagging_temperature': 0.6374485570169907, 'random_strength': 4.6064078841675276, 'grow_policy': 'Lossguide', 'min_data_in_leaf': 610, 'max_leaves': 88}. Best is trial 14 with value: 1609.1448261457704.[0m
[32m[I 2024-10-13 06:44:24,805][0m Trial 238 finished with value: 2098.1925087623063 and parameters: {'depth': 11, 'learning_rate': 0.26983962071325246, 'iterations': 1851, 'l2_leaf_reg': 0.0036283542482841175, 'border_count': 91, 'bagging_temperature': 0.651947060156178, 'random_strength': 3.8521738166944752, 'grow_policy': 'SymmetricTree', 'min_data_in_leaf': 777}. Best is trial 14 with value: 1609.1448261457704.[0m
[32m[I 2024-10-13 06:44:27,019][0m Trial 239 finished with value: 1694.7772696996547 and parameters: {'depth': 11, 'learning_rate': 0.018767770136863583, 'iterations': 2364, 'l2_leaf_reg': 0.005858704274085149, 'border_count': 99, 'bagging_temperature': 0.6304576919521288, 'random_strength': 4.4902995485944155, 'grow_policy': 'Lossguide', 'min_data_in_leaf': 637, 'max_leaves': 73}. Best is trial 14 with value: 1609.1448261457704.[0m
[32m[I 2024-10-13 06:44:29,220][0m Trial 240 finished with value: 1652.603014999563 and parameters: {'depth': 10, 'learning_rate': 0.03238442793822394, 'iterations': 2284, 'l2_leaf_reg': 0.008117518118544218, 'border_count': 94, 'bagging_temperature': 0.6737323261280064, 'random_strength': 7.039015590711267, 'grow_policy': 'Lossguide', 'min_data_in_leaf': 564, 'max_leaves': 67}. Best is trial 14 with value: 1609.1448261457704.[0m
[32m[I 2024-10-13 06:44:31,445][0m Trial 241 finished with value: 1675.6180578002122 and parameters: {'depth': 10, 'learning_rate': 0.03157516407097933, 'iterations': 2233, 'l2_leaf_reg': 0.002796791864476965, 'border_count': 94, 'bagging_temperature': 0.6692572572862078, 'random_strength': 4.108857888406647, 'grow_policy': 'Lossguide', 'min_data_in_leaf': 550, 'max_leaves': 68}. Best is trial 14 with value: 1609.1448261457704.[0m
[32m[I 2024-10-13 06:44:33,663][0m Trial 242 finished with value: 1688.1563630730793 and parameters: {'depth': 10, 'learning_rate': 0.02753156523618216, 'iterations': 2292, 'l2_leaf_reg': 0.005147864513416213, 'border_count': 89, 'bagging_temperature': 0.6890931763363494, 'random_strength': 7.3835564329145935, 'grow_policy': 'Lossguide', 'min_data_in_leaf': 577, 'max_leaves': 83}. Best is trial 14 with value: 1609.1448261457704.[0m
[32m[I 2024-10-13 06:44:35,888][0m Trial 243 finished with value: 1645.9399901780614 and parameters: {'depth': 11, 'learning_rate': 0.03363036609217047, 'iterations': 2286, 'l2_leaf_reg': 0.008219976914296342, 'border_count': 84, 'bagging_temperature': 0.6449841530709428, 'random_strength': 7.219288996391298, 'grow_policy': 'Lossguide', 'min_data_in_leaf': 616, 'max_leaves': 77}. Best is trial 14 with value: 1609.1448261457704.[0m
[32m[I 2024-10-13 06:44:38,022][0m Trial 244 finished with value: 1643.2377483884927 and parameters: {'depth': 11, 'learning_rate': 0.03385066449504833, 'iterations': 2139, 'l2_leaf_reg': 0.006562336473788318, 'border_count': 85, 'bagging_temperature': 0.646455450789102, 'random_strength': 7.045072656785375, 'grow_policy': 'Lossguide', 'min_data_in_leaf': 724, 'max_leaves': 68}. Best is trial 14 with value: 1609.1448261457704.[0m
[32m[I 2024-10-13 06:44:40,307][0m Trial 245 finished with value: 1701.8509693364397 and parameters: {'depth': 11, 'learning_rate': 0.0213548994623554, 'iterations': 2408, 'l2_leaf_reg': 0.006641191824548227, 'border_count': 95, 'bagging_temperature': 0.6640433421693626, 'random_strength': 7.203297599681877, 'grow_policy': 'Lossguide', 'min_data_in_leaf': 743, 'max_leaves': 79}. Best is trial 14 with value: 1609.1448261457704.[0m
[32m[I 2024-10-13 06:44:42,608][0m Trial 246 finished with value: 1659.1912505563098 and parameters: {'depth': 11, 'learning_rate': 0.02452725812583655, 'iterations': 2292, 'l2_leaf_reg': 0.0043102416408467206, 'border_count': 89, 'bagging_temperature': 0.7063155377849184, 'random_strength': 6.901720885168561, 'grow_policy': 'Lossguide', 'min_data_in_leaf': 763, 'max_leaves': 75}. Best is trial 14 with value: 1609.1448261457704.[0m
[32m[I 2024-10-13 06:44:44,781][0m Trial 247 finished with value: 1729.6425255070724 and parameters: {'depth': 11, 'learning_rate': 0.203341372464891, 'iterations': 2222, 'l2_leaf_reg': 0.008957241387546692, 'border_count': 100, 'bagging_temperature': 0.6774112227536115, 'random_strength': 7.465454924919187, 'grow_policy': 'Lossguide', 'min_data_in_leaf': 724, 'max_leaves': 71}. Best is trial 14 with value: 1609.1448261457704.[0m
[32m[I 2024-10-13 06:44:45,868][0m Trial 248 finished with value: 1703.646337663437 and parameters: {'depth': 11, 'learning_rate': 0.03465712088270078, 'iterations': 726, 'l2_leaf_reg': 0.008188363962921072, 'border_count': 85, 'bagging_temperature': 0.6485078104324911, 'random_strength': 7.056040994657735, 'grow_policy': 'Depthwise', 'min_data_in_leaf': 808}. Best is trial 14 with value: 1609.1448261457704.[0m
[32m[I 2024-10-13 06:44:47,967][0m Trial 249 finished with value: 1726.226694384154 and parameters: {'depth': 12, 'learning_rate': 0.044869539042493, 'iterations': 2120, 'l2_leaf_reg': 0.012193759910974544, 'border_count': 92, 'bagging_temperature': 0.6193279473160058, 'random_strength': 7.04958714737369, 'grow_policy': 'Lossguide', 'min_data_in_leaf': 556, 'max_leaves': 83}. Best is trial 14 with value: 1609.1448261457704.[0m
[32m[I 2024-10-13 06:44:50,219][0m Trial 250 finished with value: 1672.0894818113175 and parameters: {'depth': 11, 'learning_rate': 0.028186741747578646, 'iterations': 2322, 'l2_leaf_reg': 0.0081223651685642, 'border_count': 84, 'bagging_temperature': 0.6432787166522336, 'random_strength': 7.308666482502114, 'grow_policy': 'Lossguide', 'min_data_in_leaf': 725, 'max_leaves': 90}. Best is trial 14 with value: 1609.1448261457704.[0m
