[32m[I 2024-10-13 07:04:36,326][0m Trial 551 finished with value: 1793.466729138793 and parameters: {'depth': 5, 'learning_rate': 0.01768829859084632, 'iterations': 2710, 'l2_leaf_reg': 0.00017645426858013932, 'border_count': 63, 'bagging_temperature': 0.6897278003331953, 'random_strength': 5.2147349644964, 'grow_policy': 'Lossguide', 'min_data_in_leaf': 843, 'max_leaves': 136}. Best is trial 14 with value: 1609.1448261457704.[0m
[32m[I 2024-10-13 07:04:38,330][0m Trial 552 finished with value: 1692.7646400562244 and parameters: {'depth': 3, 'learning_rate': 0.049141086540461086, 'iterations': 1974, 'l2_leaf_reg': 0.44367748106562993, 'border_count': 96, 'bagging_temperature': 0.6652965785979955, 'random_strength': 6.034305847288996, 'grow_policy': 'Lossguide', 'min_data_in_leaf': 817, 'max_leaves': 159}. Best is trial 14 with value: 1609.1448261457704.[0m
[32m[I 2024-10-13 07:04:56,657][0m Trial 553 finished with value: 1774.81962873766 and parameters: {'depth': 7, 'learning_rate': 0.02333763698520042, 'iterations': 2818, 'l2_leaf_reg': 0.003902030245291864, 'border_count': 69, 'bagging_temperature': 0.3153238086187587, 'random_strength': 5.691873996657016, 'grow_policy': 'SymmetricTree', 'min_data_in_leaf': 864}. Best is trial 14 with value: 1609.1448261457704.[0m
[32m[I 2024-10-13 07:04:59,328][0m Trial 554 finished with value: 1684.4575289047834 and parameters: {'depth': 4, 'learning_rate': 0.04180355370268015, 'iterations': 2911, 'l2_leaf_reg': 0.010846890607848832, 'border_count': 82, 'bagging_temperature': 0.6051826710698199, 'random_strength': 6.1593397424966945, 'grow_policy': 'Lossguide', 'min_data_in_leaf': 388, 'max_leaves': 166}. Best is trial 14 with value: 1609.1448261457704.[0m
[32m[I 2024-10-13 07:05:01,845][0m Trial 555 finished with value: 1686.7064148003017 and parameters: {'depth': 3, 'learning_rate': 0.03352403002383651, 'iterations': 2648, 'l2_leaf_reg': 2.148051193271429e-05, 'border_count': 92, 'bagging_temperature': 0.6761239058362397, 'random_strength': 5.108576254006044, 'grow_policy': 'Lossguide', 'min_data_in_leaf': 416, 'max_leaves': 174}. Best is trial 14 with value: 1609.1448261457704.[0m
[32m[I 2024-10-13 07:05:04,580][0m Trial 556 finished with value: 1651.6252560331764 and parameters: {'depth': 9, 'learning_rate': 0.028487453186667667, 'iterations': 2993, 'l2_leaf_reg': 0.0008496348007763427, 'border_count': 87, 'bagging_temperature': 0.6496015916079607, 'random_strength': 5.809941834296639, 'grow_policy': 'Lossguide', 'min_data_in_leaf': 373, 'max_leaves': 170}. Best is trial 14 with value: 1609.1448261457704.[0m
[32m[I 2024-10-13 07:05:07,327][0m Trial 557 finished with value: 1737.5494261921922 and parameters: {'depth': 4, 'learning_rate': 0.058772009630206165, 'iterations': 2874, 'l2_leaf_reg': 0.003019610670493648, 'border_count': 75, 'bagging_temperature': 0.6375520072213131, 'random_strength': 5.4649559532388015, 'grow_policy': 'Lossguide', 'min_data_in_leaf': 759, 'max_leaves': 154}. Best is trial 14 with value: 1609.1448261457704.[0m
[32m[I 2024-10-13 07:05:09,877][0m Trial 558 finished with value: 1745.6882328062675 and parameters: {'depth': 9, 'learning_rate': 0.14675199851859272, 'iterations': 2770, 'l2_leaf_reg': 0.006507306853964457, 'border_count': 80, 'bagging_temperature': 0.6894488303366516, 'random_strength': 6.289471343422656, 'grow_policy': 'Lossguide', 'min_data_in_leaf': 775, 'max_leaves': 162}. Best is trial 14 with value: 1609.1448261457704.[0m
[32m[I 2024-10-13 07:05:12,364][0m Trial 559 finished with value: 1670.3453692527642 and parameters: {'depth': 3, 'learning_rate': 0.037661861109155, 'iterations': 2590, 'l2_leaf_reg': 0.0004533659396759423, 'border_count': 102, 'bagging_temperature': 0.6602882758732818, 'random_strength': 4.910358452919774, 'grow_policy': 'Lossguide', 'min_data_in_leaf': 406, 'max_leaves': 147}. Best is trial 14 with value: 1609.1448261457704.[0m
[32m[I 2024-10-13 07:05:15,142][0m Trial 560 finished with value: 1672.9716045878838 and parameters: {'depth': 3, 'learning_rate': 0.014733038012599129, 'iterations': 2943, 'l2_leaf_reg': 0.000666824843787464, 'border_count': 90, 'bagging_temperature': 0.6991887062724425, 'random_strength': 6.056020480222866, 'grow_policy': 'Lossguide', 'min_data_in_leaf': 838, 'max_leaves': 207}. Best is trial 14 with value: 1609.1448261457704.[0m
[32m[I 2024-10-13 07:05:17,758][0m Trial 561 finished with value: 1679.1934639186063 and parameters: {'depth': 9, 'learning_rate': 0.020253935700646958, 'iterations': 2844, 'l2_leaf_reg': 0.2736601341533546, 'border_count': 98, 'bagging_temperature': 0.6734799407820542, 'random_strength': 5.036539968828736, 'grow_policy': 'Lossguide', 'min_data_in_leaf': 797, 'max_leaves': 182}. Best is trial 14 with value: 1609.1448261457704.[0m
[32m[I 2024-10-13 07:05:20,348][0m Trial 562 finished with value: 1664.8221713313646 and parameters: {'depth': 3, 'learning_rate': 0.024208368153943217, 'iterations': 2713, 'l2_leaf_reg': 1.369378135488176, 'border_count': 84, 'bagging_temperature': 0.6295866037612148, 'random_strength': 6.2555704889714585, 'grow_policy': 'Lossguide', 'min_data_in_leaf': 818, 'max_leaves': 157}. Best is trial 14 with value: 1609.1448261457704.[0m
[32m[I 2024-10-13 07:05:22,910][0m Trial 563 finished with value: 1649.3694972664327 and parameters: {'depth': 11, 'learning_rate': 0.030525950367841864, 'iterations': 2787, 'l2_leaf_reg': 0.0001105762189334272, 'border_count': 76, 'bagging_temperature': 0.9644459358091657, 'random_strength': 6.409783557952956, 'grow_policy': 'Lossguide', 'min_data_in_leaf': 390, 'max_leaves': 175}. Best is trial 14 with value: 1609.1448261457704.[0m
[32m[I 2024-10-13 07:05:25,596][0m Trial 564 finished with value: 1810.7735607331056 and parameters: {'depth': 9, 'learning_rate': 0.04320258664901902, 'iterations': 2894, 'l2_leaf_reg': 0.00024717083909930903, 'border_count': 68, 'bagging_temperature': 0.5981444117227741, 'random_strength': 5.58214745487264, 'grow_policy': 'Lossguide', 'min_data_in_leaf': 424, 'max_leaves': 56}. Best is trial 14 with value: 1609.1448261457704.[0m
[32m[I 2024-10-13 07:05:34,120][0m Trial 565 finished with value: 1698.7079672123866 and parameters: {'depth': 3, 'learning_rate': 0.03652994310140066, 'iterations': 2676, 'l2_leaf_reg': 0.022552574698074365, 'border_count': 85, 'bagging_temperature': 0.5623703546518352, 'random_strength': 5.229376703759201, 'grow_policy': 'SymmetricTree', 'min_data_in_leaf': 377}. Best is trial 14 with value: 1609.1448261457704.[0m
[32m[I 2024-10-13 07:05:36,501][0m Trial 566 finished with value: 1688.7683740954465 and parameters: {'depth': 9, 'learning_rate': 0.028553963787917202, 'iterations': 2552, 'l2_leaf_reg': 0.0011360410317620012, 'border_count': 79, 'bagging_temperature': 0.6588629123042848, 'random_strength': 5.974144436486492, 'grow_policy': 'Lossguide', 'min_data_in_leaf': 865, 'max_leaves': 167}. Best is trial 14 with value: 1609.1448261457704.[0m
[32m[I 2024-10-13 07:05:39,173][0m Trial 567 finished with value: 1676.2944867214908 and parameters: {'depth': 10, 'learning_rate': 0.04962844656482099, 'iterations': 2830, 'l2_leaf_reg': 0.0003752536185858316, 'border_count': 93, 'bagging_temperature': 0.6841358095017828, 'random_strength': 6.509656528285017, 'grow_policy': 'Lossguide', 'min_data_in_leaf': 468, 'max_leaves': 119}. Best is trial 14 with value: 1609.1448261457704.[0m
[32m[I 2024-10-13 07:05:41,989][0m Trial 568 finished with value: 1834.1409230740558 and parameters: {'depth': 7, 'learning_rate': 0.09319485710374537, 'iterations': 2953, 'l2_leaf_reg': 0.23637903425282353, 'border_count': 72, 'bagging_temperature': 0.6443115284372957, 'random_strength': 5.812617024552387, 'grow_policy': 'Lossguide', 'min_data_in_leaf': 400, 'max_leaves': 151}. Best is trial 14 with value: 1609.1448261457704.[0m
[32m[I 2024-10-13 07:05:44,547][0m Trial 569 finished with value: 1642.0242181942813 and parameters: {'depth': 9, 'learning_rate': 0.03346610732853109, 'iterations': 2730, 'l2_leaf_reg': 0.00736956520633035, 'border_count': 87, 'bagging_temperature': 0.7156572004322524, 'random_strength': 6.625832620015494, 'grow_policy': 'Lossguide', 'min_data_in_leaf': 448, 'max_leaves': 142}. Best is trial 14 with value: 1609.1448261457704.[0m
[32m[I 2024-10-13 07:05:47,048][0m Trial 570 finished with value: 1667.3238485391114 and parameters: {'depth': 9, 'learning_rate': 0.0708503008405692, 'iterations': 2730, 'l2_leaf_reg': 0.010416835688703061, 'border_count': 90, 'bagging_temperature': 0.7374365072192112, 'random_strength': 6.2885946587861685, 'grow_policy': 'Lossguide', 'min_data_in_leaf': 462, 'max_leaves': 131}. Best is trial 14 with value: 1609.1448261457704.[0m
[32m[I 2024-10-13 07:05:47,843][0m Trial 571 finished with value: 2017.3706797926982 and parameters: {'depth': 6, 'learning_rate': 0.02391643249828974, 'iterations': 342, 'l2_leaf_reg': 0.003951588798833697, 'border_count': 96, 'bagging_temperature': 0.7167239287219433, 'random_strength': 6.6121773033629285, 'grow_policy': 'Lossguide', 'min_data_in_leaf': 453, 'max_leaves': 140}. Best is trial 14 with value: 1609.1448261457704.[0m
[32m[I 2024-10-13 07:05:50,382][0m Trial 572 finished with value: 1660.5702034583555 and parameters: {'depth': 9, 'learning_rate': 0.032758012109609096, 'iterations': 2681, 'l2_leaf_reg': 4.828607280983617e-05, 'border_count': 81, 'bagging_temperature': 0.7478862040568162, 'random_strength': 6.443661295100119, 'grow_policy': 'Depthwise', 'min_data_in_leaf': 439}. Best is trial 14 with value: 1609.1448261457704.[0m
[32m[I 2024-10-13 07:05:53,025][0m Trial 573 finished with value: 1671.9928344679859 and parameters: {'depth': 9, 'learning_rate': 0.040401306359179004, 'iterations': 2763, 'l2_leaf_reg': 0.01682123994562605, 'border_count': 86, 'bagging_temperature': 0.7085547818213359, 'random_strength': 6.550786037228847, 'grow_policy': 'Lossguide', 'min_data_in_leaf': 424, 'max_leaves': 135}. Best is trial 14 with value: 1609.1448261457704.[0m
[32m[I 2024-10-13 07:05:55,483][0m Trial 574 finished with value: 1667.348813024822 and parameters: {'depth': 9, 'learning_rate': 0.02636045118079378, 'iterations': 2628, 'l2_leaf_reg': 2.9995893675750502, 'border_count': 90, 'bagging_temperature': 0.7263188778423819, 'random_strength': 6.197455204316631, 'grow_policy': 'Lossguide', 'min_data_in_leaf': 447, 'max_leaves': 143}. Best is trial 14 with value: 1609.1448261457704.[0m
[32m[I 2024-10-13 07:05:58,305][0m Trial 575 finished with value: 1696.4856531638864 and parameters: {'depth': 9, 'learning_rate': 0.020935276366318513, 'iterations': 2999, 'l2_leaf_reg': 0.6936199445504931, 'border_count': 76, 'bagging_temperature': 0.05968455783229021, 'random_strength': 6.668637303655898, 'grow_policy': 'Lossguide', 'min_data_in_leaf': 482, 'max_leaves': 145}. Best is trial 14 with value: 1609.1448261457704.[0m
[32m[I 2024-10-13 07:06:00,937][0m Trial 576 finished with value: 1630.8820831916696 and parameters: {'depth': 9, 'learning_rate': 0.032726044689664675, 'iterations': 2784, 'l2_leaf_reg': 0.0007722269393449606, 'border_count': 100, 'bagging_temperature': 0.7013283098663365, 'random_strength': 6.006043288909587, 'grow_policy': 'Lossguide', 'min_data_in_leaf': 301, 'max_leaves': 138}. Best is trial 14 with value: 1609.1448261457704.[0m
[32m[I 2024-10-13 07:06:03,640][0m Trial 577 finished with value: 1665.2707251258485 and parameters: {'depth': 9, 'learning_rate': 0.02856458953521254, 'iterations': 2789, 'l2_leaf_reg': 0.0005965908493500465, 'border_count': 104, 'bagging_temperature': 0.7384915477056253, 'random_strength': 5.9770389240421355, 'grow_policy': 'Lossguide', 'min_data_in_leaf': 255, 'max_leaves': 131}. Best is trial 14 with value: 1609.1448261457704.[0m
[32m[I 2024-10-13 07:06:06,213][0m Trial 578 finished with value: 1691.240770390756 and parameters: {'depth': 9, 'learning_rate': 0.01720295248357568, 'iterations': 2737, 'l2_leaf_reg': 0.0021134727835291907, 'border_count': 98, 'bagging_temperature': 0.7009138735896683, 'random_strength': 5.700291477492767, 'grow_policy': 'Lossguide', 'min_data_in_leaf': 272, 'max_leaves': 140}. Best is trial 14 with value: 1609.1448261457704.[0m
[32m[I 2024-10-13 07:06:47,125][0m Trial 579 finished with value: 1882.7432948892877 and parameters: {'depth': 9, 'learning_rate': 0.010730039323297443, 'iterations': 2842, 'l2_leaf_reg': 0.0011746241985133674, 'border_count': 82, 'bagging_temperature': 0.7181346564590275, 'random_strength': 5.89786420428329, 'grow_policy': 'SymmetricTree', 'min_data_in_leaf': 294}. Best is trial 14 with value: 1609.1448261457704.[0m
[32m[I 2024-10-13 07:06:49,691][0m Trial 580 finished with value: 1669.203275335795 and parameters: {'depth': 9, 'learning_rate': 0.040010506569124124, 'iterations': 2772, 'l2_leaf_reg': 0.0007760548262300063, 'border_count': 116, 'bagging_temperature': 0.7077013146091987, 'random_strength': 6.137391922702181, 'grow_policy': 'Lossguide', 'min_data_in_leaf': 301, 'max_leaves': 135}. Best is trial 14 with value: 1609.1448261457704.[0m
[32m[I 2024-10-13 07:06:52,385][0m Trial 581 finished with value: 1838.6164272019157 and parameters: {'depth': 9, 'learning_rate': 0.1748837988638714, 'iterations': 2877, 'l2_leaf_reg': 0.0009251412890016128, 'border_count': 73, 'bagging_temperature': 0.6869547785569088, 'random_strength': 5.526967775404902, 'grow_policy': 'Lossguide', 'min_data_in_leaf': 290, 'max_leaves': 138}. Best is trial 14 with value: 1609.1448261457704.[0m
[32m[I 2024-10-13 07:06:54,933][0m Trial 582 finished with value: 1667.3482518390083 and parameters: {'depth': 9, 'learning_rate': 0.03344952933430255, 'iterations': 2692, 'l2_leaf_reg': 0.0002738463355233957, 'border_count': 94, 'bagging_temperature': 0.7277775626433446, 'random_strength': 6.096286059464697, 'grow_policy': 'Lossguide', 'min_data_in_leaf': 329, 'max_leaves': 144}. Best is trial 14 with value: 1609.1448261457704.[0m
[32m[I 2024-10-13 07:06:57,518][0m Trial 583 finished with value: 1661.245998216299 and parameters: {'depth': 9, 'learning_rate': 0.04757212558939965, 'iterations': 2822, 'l2_leaf_reg': 0.0004635043168569879, 'border_count': 87, 'bagging_temperature': 0.7739424788151891, 'random_strength': 6.308736894308867, 'grow_policy': 'Lossguide', 'min_data_in_leaf': 318, 'max_leaves': 149}. Best is trial 14 with value: 1609.1448261457704.[0m
[32m[I 2024-10-13 07:07:00,244][0m Trial 584 finished with value: 1649.2320450798486 and parameters: {'depth': 9, 'learning_rate': 0.023080909644369367, 'iterations': 2928, 'l2_leaf_reg': 0.40751038575194204, 'border_count': 79, 'bagging_temperature': 0.7528678145186933, 'random_strength': 5.759583842230381, 'grow_policy': 'Lossguide', 'min_data_in_leaf': 227, 'max_leaves': 126}. Best is trial 14 with value: 1609.1448261457704.[0m
[32m[I 2024-10-13 07:07:02,827][0m Trial 585 finished with value: 1869.4829064305864 and parameters: {'depth': 9, 'learning_rate': 0.02895981880267722, 'iterations': 2736, 'l2_leaf_reg': 0.0005697251541684918, 'border_count': 67, 'bagging_temperature': 0.03436884073784097, 'random_strength': 6.435210560512472, 'grow_policy': 'Lossguide', 'min_data_in_leaf': 336, 'max_leaves': 214}. Best is trial 14 with value: 1609.1448261457704.[0m
[32m[I 2024-10-13 07:07:05,445][0m Trial 586 finished with value: 1664.147606268328 and parameters: {'depth': 9, 'learning_rate': 0.03560815086742616, 'iterations': 2867, 'l2_leaf_reg': 0.0011793465410555395, 'border_count': 84, 'bagging_temperature': 0.6984767036682068, 'random_strength': 6.261262783201285, 'grow_policy': 'Lossguide', 'min_data_in_leaf': 514, 'max_leaves': 137}. Best is trial 14 with value: 1609.1448261457704.[0m
[32m[I 2024-10-13 07:07:07,952][0m Trial 587 finished with value: 1665.807860496798 and parameters: {'depth': 9, 'learning_rate': 0.04359079160123406, 'iterations': 2652, 'l2_leaf_reg': 0.002556566964517665, 'border_count': 91, 'bagging_temperature': 0.6838955012380159, 'random_strength': 4.909011563422555, 'grow_policy': 'Lossguide', 'min_data_in_leaf': 309, 'max_leaves': 145}. Best is trial 14 with value: 1609.1448261457704.[0m
[32m[I 2024-10-13 07:07:10,556][0m Trial 588 finished with value: 1682.8844020607844 and parameters: {'depth': 8, 'learning_rate': 0.11464254297600039, 'iterations': 2810, 'l2_leaf_reg': 0.0003453368643797918, 'border_count': 99, 'bagging_temperature': 0.6759859225502021, 'random_strength': 6.000144331396349, 'grow_policy': 'Lossguide', 'min_data_in_leaf': 411, 'max_leaves': 147}. Best is trial 14 with value: 1609.1448261457704.[0m
[32m[I 2024-10-13 07:07:13,214][0m Trial 589 finished with value: 1644.0645509765934 and parameters: {'depth': 9, 'learning_rate': 0.05384540664680932, 'iterations': 2878, 'l2_leaf_reg': 0.0006991103262831974, 'border_count': 78, 'bagging_temperature': 0.8690376916090423, 'random_strength': 6.695613476097356, 'grow_policy': 'Lossguide', 'min_data_in_leaf': 367, 'max_leaves': 153}. Best is trial 14 with value: 1609.1448261457704.[0m
[32m[I 2024-10-13 07:07:15,891][0m Trial 590 finished with value: 1667.8256162848768 and parameters: {'depth': 3, 'learning_rate': 0.026109982036490873, 'iterations': 2929, 'l2_leaf_reg': 0.0018860604053744616, 'border_count': 86, 'bagging_temperature': 0.7077633230363479, 'random_strength': 5.164400943354834, 'grow_policy': 'Lossguide', 'min_data_in_leaf': 276, 'max_leaves': 143}. Best is trial 14 with value: 1609.1448261457704.[0m
[32m[I 2024-10-13 07:07:24,914][0m Trial 591 finished with value: 1724.6000180028254 and parameters: {'depth': 3, 'learning_rate': 0.020524712680799174, 'iterations': 2776, 'l2_leaf_reg': 0.00019128689445479884, 'border_count': 71, 'bagging_temperature': 0.740493869432429, 'random_strength': 5.832079270758747, 'grow_policy': 'SymmetricTree', 'min_data_in_leaf': 420}. Best is trial 14 with value: 1609.1448261457704.[0m
[32m[I 2024-10-13 07:07:27,398][0m Trial 592 finished with value: 1895.1346894050557 and parameters: {'depth': 4, 'learning_rate': 0.03655224907398781, 'iterations': 2708, 'l2_leaf_reg': 1.0339158460278968, 'border_count': 60, 'bagging_temperature': 0.6934746986172398, 'random_strength': 6.44835798089862, 'grow_policy': 'Lossguide', 'min_data_in_leaf': 347, 'max_leaves': 187}. Best is trial 14 with value: 1609.1448261457704.[0m
[32m[I 2024-10-13 07:07:29,993][0m Trial 593 finished with value: 1672.1378176754808 and parameters: {'depth': 9, 'learning_rate': 0.031083690500032967, 'iterations': 2811, 'l2_leaf_reg': 0.004351966652220166, 'border_count': 110, 'bagging_temperature': 0.6703725165427014, 'random_strength': 5.612097808601411, 'grow_policy': 'Lossguide', 'min_data_in_leaf': 392, 'max_leaves': 149}. Best is trial 14 with value: 1609.1448261457704.[0m
[32m[I 2024-10-13 07:07:32,686][0m Trial 594 finished with value: 1670.9597772037055 and parameters: {'depth': 8, 'learning_rate': 0.02542827378417116, 'iterations': 2919, 'l2_leaf_reg': 0.0009766541549383698, 'border_count': 80, 'bagging_temperature': 0.7199951043681928, 'random_strength': 5.373685138969489, 'grow_policy': 'Depthwise', 'min_data_in_leaf': 475}. Best is trial 14 with value: 1609.1448261457704.[0m
[32m[I 2024-10-13 07:07:35,150][0m Trial 595 finished with value: 1685.5635460476117 and parameters: {'depth': 4, 'learning_rate': 0.04075022206639829, 'iterations': 2618, 'l2_leaf_reg': 0.0004186166238625708, 'border_count': 94, 'bagging_temperature': 0.6698903201953526, 'random_strength': 6.675580250147316, 'grow_policy': 'Lossguide', 'min_data_in_leaf': 426, 'max_leaves': 140}. Best is trial 14 with value: 1609.1448261457704.[0m
[32m[I 2024-10-13 07:07:37,794][0m Trial 596 finished with value: 1734.3006458666575 and parameters: {'depth': 9, 'learning_rate': 0.060273756126033994, 'iterations': 2750, 'l2_leaf_reg': 1.047526936725661e-05, 'border_count': 75, 'bagging_temperature': 0.7028838680008372, 'random_strength': 4.74307932922721, 'grow_policy': 'Lossguide', 'min_data_in_leaf': 451, 'max_leaves': 131}. Best is trial 14 with value: 1609.1448261457704.[0m
[32m[I 2024-10-13 07:07:40,429][0m Trial 597 finished with value: 1628.2807069098599 and parameters: {'depth': 3, 'learning_rate': 0.03226182205889729, 'iterations': 2852, 'l2_leaf_reg': 0.006021940778098043, 'border_count': 89, 'bagging_temperature': 0.6864793880217752, 'random_strength': 6.130072535395401, 'grow_policy': 'Lossguide', 'min_data_in_leaf': 373, 'max_leaves': 200}. Best is trial 14 with value: 1609.1448261457704.[0m
[32m[I 2024-10-13 07:07:43,147][0m Trial 598 finished with value: 1708.0339271484568 and parameters: {'depth': 3, 'learning_rate': 0.04880840197281834, 'iterations': 2948, 'l2_leaf_reg': 0.004956003762936388, 'border_count': 101, 'bagging_temperature': 0.664031047709442, 'random_strength': 6.050418576790443, 'grow_policy': 'Lossguide', 'min_data_in_leaf': 337, 'max_leaves': 214}. Best is trial 14 with value: 1609.1448261457704.[0m
[32m[I 2024-10-13 07:07:45,914][0m Trial 599 finished with value: 1637.2936643584342 and parameters: {'depth': 3, 'learning_rate': 0.035911284468519586, 'iterations': 2996, 'l2_leaf_reg': 0.0022655069302020313, 'border_count': 90, 'bagging_temperature': 0.6857523538766254, 'random_strength': 5.869669149381575, 'grow_policy': 'Lossguide', 'min_data_in_leaf': 369, 'max_leaves': 233}. Best is trial 14 with value: 1609.1448261457704.[0m
[32m[I 2024-10-13 07:07:48,632][0m Trial 600 finished with value: 1673.043571029402 and parameters: {'depth': 3, 'learning_rate': 0.0322080821235391, 'iterations': 2979, 'l2_leaf_reg': 0.0013653930345262283, 'border_count': 122, 'bagging_temperature': 0.7248539709939604, 'random_strength': 5.814182720855334, 'grow_policy': 'Lossguide', 'min_data_in_leaf': 310, 'max_leaves': 231}. Best is trial 14 with value: 1609.1448261457704.[0m
