[32m[I 2024-10-13 06:56:56,321][0m Trial 451 finished with value: 1645.529843967973 and parameters: {'depth': 9, 'learning_rate': 0.0199021633411737, 'iterations': 2879, 'l2_leaf_reg': 0.0016396103616845871, 'border_count': 85, 'bagging_temperature': 0.6820076626393692, 'random_strength': 6.8676729589924985, 'grow_policy': 'Lossguide', 'min_data_in_leaf': 821, 'max_leaves': 154}. Best is trial 14 with value: 1609.1448261457704.[0m
[32m[I 2024-10-13 06:56:57,801][0m Trial 452 finished with value: 1700.8314324707019 and parameters: {'depth': 9, 'learning_rate': 0.04493162921331628, 'iterations': 1430, 'l2_leaf_reg': 0.001702962439258656, 'border_count': 104, 'bagging_temperature': 0.747704741192486, 'random_strength': 6.765156419277005, 'grow_policy': 'Lossguide', 'min_data_in_leaf': 826, 'max_leaves': 61}. Best is trial 14 with value: 1609.1448261457704.[0m
[32m[I 2024-10-13 06:57:00,418][0m Trial 453 finished with value: 1644.5978875009166 and parameters: {'depth': 9, 'learning_rate': 0.030781280499106584, 'iterations': 2853, 'l2_leaf_reg': 0.0015776415513628695, 'border_count': 87, 'bagging_temperature': 0.6696998048380971, 'random_strength': 6.541486594978602, 'grow_policy': 'Lossguide', 'min_data_in_leaf': 851, 'max_leaves': 152}. Best is trial 14 with value: 1609.1448261457704.[0m
[32m[I 2024-10-13 06:57:03,061][0m Trial 454 finished with value: 1639.0437331661433 and parameters: {'depth': 9, 'learning_rate': 0.03564869103478463, 'iterations': 2842, 'l2_leaf_reg': 0.0019146755546999774, 'border_count': 86, 'bagging_temperature': 0.6701566774497919, 'random_strength': 6.526133946118518, 'grow_policy': 'Lossguide', 'min_data_in_leaf': 825, 'max_leaves': 154}. Best is trial 14 with value: 1609.1448261457704.[0m
[32m[I 2024-10-13 06:57:05,660][0m Trial 455 finished with value: 1760.968549837975 and parameters: {'depth': 9, 'learning_rate': 0.03744773443039031, 'iterations': 2821, 'l2_leaf_reg': 0.002046029804940198, 'border_count': 72, 'bagging_temperature': 0.7041077112269323, 'random_strength': 6.136017932830056, 'grow_policy': 'Lossguide', 'min_data_in_leaf': 841, 'max_leaves': 148}. Best is trial 14 with value: 1609.1448261457704.[0m
[32m[I 2024-10-13 06:57:08,228][0m Trial 456 finished with value: 1639.7532045280286 and parameters: {'depth': 9, 'learning_rate': 0.04252158985204205, 'iterations': 2738, 'l2_leaf_reg': 1.4405681370796712, 'border_count': 77, 'bagging_temperature': 0.6766781633327584, 'random_strength': 6.441843014897287, 'grow_policy': 'Lossguide', 'min_data_in_leaf': 860, 'max_leaves': 142}. Best is trial 14 with value: 1609.1448261457704.[0m
[32m[I 2024-10-13 06:57:10,785][0m Trial 457 finished with value: 1673.0907959508504 and parameters: {'depth': 9, 'learning_rate': 0.06426489435969433, 'iterations': 2697, 'l2_leaf_reg': 0.0012871778825496803, 'border_count': 76, 'bagging_temperature': 0.7336395263151991, 'random_strength': 6.365749615688487, 'grow_policy': 'Lossguide', 'min_data_in_leaf': 863, 'max_leaves': 152}. Best is trial 14 with value: 1609.1448261457704.[0m
[32m[I 2024-10-13 06:57:13,350][0m Trial 458 finished with value: 1760.048911021993 and parameters: {'depth': 9, 'learning_rate': 0.042612415942926626, 'iterations': 2722, 'l2_leaf_reg': 9.89472648136696, 'border_count': 68, 'bagging_temperature': 0.6811682200229512, 'random_strength': 6.371012622511866, 'grow_policy': 'Depthwise', 'min_data_in_leaf': 837}. Best is trial 14 with value: 1609.1448261457704.[0m
[32m[I 2024-10-13 06:57:15,969][0m Trial 459 finished with value: 3795.722903335607 and parameters: {'depth': 9, 'learning_rate': 0.050493626468243534, 'iterations': 2782, 'l2_leaf_reg': 0.0018417771232594263, 'border_count': 1, 'bagging_temperature': 0.7009899609172298, 'random_strength': 5.926819419103958, 'grow_policy': 'Lossguide', 'min_data_in_leaf': 865, 'max_leaves': 223}. Best is trial 14 with value: 1609.1448261457704.[0m
[32m[I 2024-10-13 06:57:18,521][0m Trial 460 finished with value: 1641.044776476107 and parameters: {'depth': 9, 'learning_rate': 0.04609289578625224, 'iterations': 2757, 'l2_leaf_reg': 0.46054591958459634, 'border_count': 78, 'bagging_temperature': 0.6739433125611128, 'random_strength': 6.383069484770757, 'grow_policy': 'Lossguide', 'min_data_in_leaf': 822, 'max_leaves': 146}. Best is trial 14 with value: 1609.1448261457704.[0m
[32m[I 2024-10-13 06:57:21,073][0m Trial 461 finished with value: 1761.0758318708035 and parameters: {'depth': 9, 'learning_rate': 0.060510317738032365, 'iterations': 2734, 'l2_leaf_reg': 3.3510455217487594, 'border_count': 74, 'bagging_temperature': 0.6786448581269593, 'random_strength': 6.077780697455468, 'grow_policy': 'Lossguide', 'min_data_in_leaf': 814, 'max_leaves': 141}. Best is trial 14 with value: 1609.1448261457704.[0m
[32m[I 2024-10-13 06:57:23,556][0m Trial 462 finished with value: 1674.2623722940027 and parameters: {'depth': 9, 'learning_rate': 0.04932205669176638, 'iterations': 2631, 'l2_leaf_reg': 0.001010789163285032, 'border_count': 78, 'bagging_temperature': 0.7212939236746065, 'random_strength': 6.258518311595151, 'grow_policy': 'Lossguide', 'min_data_in_leaf': 874, 'max_leaves': 137}. Best is trial 14 with value: 1609.1448261457704.[0m
[32m[I 2024-10-13 06:57:26,116][0m Trial 463 finished with value: 1802.6933216049433 and parameters: {'depth': 9, 'learning_rate': 0.042063413851345224, 'iterations': 2760, 'l2_leaf_reg': 1.4868766045215938, 'border_count': 65, 'bagging_temperature': 0.699509389320524, 'random_strength': 6.441874097799539, 'grow_policy': 'Lossguide', 'min_data_in_leaf': 822, 'max_leaves': 145}. Best is trial 14 with value: 1609.1448261457704.[0m
[32m[I 2024-10-13 06:58:08,033][0m Trial 464 finished with value: 2057.8367173235306 and parameters: {'depth': 9, 'learning_rate': 0.0356367997412709, 'iterations': 2851, 'l2_leaf_reg': 0.6344341476053427, 'border_count': 71, 'bagging_temperature': 0.6787750454493218, 'random_strength': 6.530289734450485, 'grow_policy': 'SymmetricTree', 'min_data_in_leaf': 841}. Best is trial 14 with value: 1609.1448261457704.[0m
[32m[I 2024-10-13 06:58:10,629][0m Trial 465 finished with value: 1705.0396817215765 and parameters: {'depth': 9, 'learning_rate': 0.05475440469756372, 'iterations': 2824, 'l2_leaf_reg': 0.6552577374472741, 'border_count': 80, 'bagging_temperature': 0.6716374477645451, 'random_strength': 6.526421340096534, 'grow_policy': 'Lossguide', 'min_data_in_leaf': 845, 'max_leaves': 148}. Best is trial 14 with value: 1609.1448261457704.[0m
[32m[I 2024-10-13 06:58:13,160][0m Trial 466 finished with value: 1682.0744973290086 and parameters: {'depth': 9, 'learning_rate': 0.046098571608924964, 'iterations': 2677, 'l2_leaf_reg': 0.9617610665703745, 'border_count': 85, 'bagging_temperature': 0.4572446945799838, 'random_strength': 6.1311892427263555, 'grow_policy': 'Lossguide', 'min_data_in_leaf': 860, 'max_leaves': 143}. Best is trial 14 with value: 1609.1448261457704.[0m
[32m[I 2024-10-13 06:58:15,787][0m Trial 467 finished with value: 1675.3321674097608 and parameters: {'depth': 9, 'learning_rate': 0.038729015344010846, 'iterations': 2664, 'l2_leaf_reg': 1.6017101249358539, 'border_count': 78, 'bagging_temperature': 0.7100272579492247, 'random_strength': 6.484138066097909, 'grow_policy': 'Lossguide', 'min_data_in_leaf': 808, 'max_leaves': 248}. Best is trial 14 with value: 1609.1448261457704.[0m
[32m[I 2024-10-13 06:58:18,330][0m Trial 468 finished with value: 1659.7925481553802 and parameters: {'depth': 9, 'learning_rate': 0.031829107975355264, 'iterations': 2736, 'l2_leaf_reg': 2.1749847195993675, 'border_count': 86, 'bagging_temperature': 0.667549869088111, 'random_strength': 6.710012517722684, 'grow_policy': 'Lossguide', 'min_data_in_leaf': 821, 'max_leaves': 121}. Best is trial 14 with value: 1609.1448261457704.[0m
[32m[I 2024-10-13 06:58:21,016][0m Trial 469 finished with value: 1765.572739900967 and parameters: {'depth': 9, 'learning_rate': 0.03795760773703308, 'iterations': 2892, 'l2_leaf_reg': 3.045933841219669, 'border_count': 73, 'bagging_temperature': 0.693347004198533, 'random_strength': 6.264860923511507, 'grow_policy': 'Lossguide', 'min_data_in_leaf': 880, 'max_leaves': 155}. Best is trial 14 with value: 1609.1448261457704.[0m
[32m[I 2024-10-13 06:58:23,617][0m Trial 470 finished with value: 1655.9925332353957 and parameters: {'depth': 9, 'learning_rate': 0.03091436748966795, 'iterations': 2790, 'l2_leaf_reg': 0.8787580514123191, 'border_count': 80, 'bagging_temperature': 0.7299044562075832, 'random_strength': 6.591934002310668, 'grow_policy': 'Lossguide', 'min_data_in_leaf': 890, 'max_leaves': 151}. Best is trial 14 with value: 1609.1448261457704.[0m
[32m[I 2024-10-13 06:58:26,257][0m Trial 471 finished with value: 1801.2433630125731 and parameters: {'depth': 9, 'learning_rate': 0.04544755726518271, 'iterations': 2866, 'l2_leaf_reg': 4.62827105364449, 'border_count': 63, 'bagging_temperature': 0.6651122968466194, 'random_strength': 6.4154492803432985, 'grow_policy': 'Lossguide', 'min_data_in_leaf': 847, 'max_leaves': 156}. Best is trial 14 with value: 1609.1448261457704.[0m
[32m[I 2024-10-13 06:58:29,001][0m Trial 472 finished with value: 1640.9611233329933 and parameters: {'depth': 9, 'learning_rate': 0.03443436827594009, 'iterations': 2909, 'l2_leaf_reg': 0.3506445544049656, 'border_count': 86, 'bagging_temperature': 0.6891124093339022, 'random_strength': 5.938132211993673, 'grow_policy': 'Lossguide', 'min_data_in_leaf': 798, 'max_leaves': 147}. Best is trial 14 with value: 1609.1448261457704.[0m
[32m[I 2024-10-13 06:58:31,809][0m Trial 473 finished with value: 1737.4344480553755 and parameters: {'depth': 9, 'learning_rate': 0.03624164350544373, 'iterations': 2943, 'l2_leaf_reg': 0.48474995204902865, 'border_count': 75, 'bagging_temperature': 0.7479874296523469, 'random_strength': 6.108763380133673, 'grow_policy': 'Lossguide', 'min_data_in_leaf': 792, 'max_leaves': 132}. Best is trial 14 with value: 1609.1448261457704.[0m
[32m[I 2024-10-13 06:58:34,343][0m Trial 474 finished with value: 1649.490519710201 and parameters: {'depth': 9, 'learning_rate': 0.04195098081886678, 'iterations': 2703, 'l2_leaf_reg': 0.3022244169589531, 'border_count': 88, 'bagging_temperature': 0.7086666371647588, 'random_strength': 5.731637948244861, 'grow_policy': 'Lossguide', 'min_data_in_leaf': 802, 'max_leaves': 138}. Best is trial 14 with value: 1609.1448261457704.[0m
[32m[I 2024-10-13 06:58:36,948][0m Trial 475 finished with value: 1695.753946757537 and parameters: {'depth': 9, 'learning_rate': 0.05728865267713782, 'iterations': 2815, 'l2_leaf_reg': 0.4877924514678121, 'border_count': 82, 'bagging_temperature': 0.696404767288371, 'random_strength': 5.926194872766343, 'grow_policy': 'Lossguide', 'min_data_in_leaf': 859, 'max_leaves': 144}. Best is trial 14 with value: 1609.1448261457704.[0m
[32m[I 2024-10-13 06:59:17,622][0m Trial 476 finished with value: 1858.6072330834274 and parameters: {'depth': 9, 'learning_rate': 0.03297689532367061, 'iterations': 2761, 'l2_leaf_reg': 2.110947028694055, 'border_count': 70, 'bagging_temperature': 0.6666623752142113, 'random_strength': 5.982472001507327, 'grow_policy': 'SymmetricTree', 'min_data_in_leaf': 826}. Best is trial 14 with value: 1609.1448261457704.[0m
[32m[I 2024-10-13 06:59:20,299][0m Trial 477 finished with value: 1673.951236933236 and parameters: {'depth': 9, 'learning_rate': 0.05182538566806636, 'iterations': 2996, 'l2_leaf_reg': 0.20730452833344526, 'border_count': 94, 'bagging_temperature': 0.7712031864053207, 'random_strength': 6.2451641999761325, 'grow_policy': 'Lossguide', 'min_data_in_leaf': 910, 'max_leaves': 150}. Best is trial 14 with value: 1609.1448261457704.[0m
[32m[I 2024-10-13 06:59:22,794][0m Trial 478 finished with value: 1628.2503894974318 and parameters: {'depth': 9, 'learning_rate': 0.03804251616745302, 'iterations': 2655, 'l2_leaf_reg': 0.359090116952509, 'border_count': 78, 'bagging_temperature': 0.7240881321319269, 'random_strength': 6.653326285094289, 'grow_policy': 'Lossguide', 'min_data_in_leaf': 802, 'max_leaves': 144}. Best is trial 14 with value: 1609.1448261457704.[0m
[32m[I 2024-10-13 06:59:25,289][0m Trial 479 finished with value: 1656.8907680820794 and parameters: {'depth': 9, 'learning_rate': 0.06597184889794253, 'iterations': 2625, 'l2_leaf_reg': 1.1172838659298714, 'border_count': 76, 'bagging_temperature': 0.7342506713274451, 'random_strength': 6.6213128210596714, 'grow_policy': 'Lossguide', 'min_data_in_leaf': 803, 'max_leaves': 146}. Best is trial 14 with value: 1609.1448261457704.[0m
[32m[I 2024-10-13 06:59:27,790][0m Trial 480 finished with value: 1744.020004394626 and parameters: {'depth': 9, 'learning_rate': 0.041412442529729185, 'iterations': 2663, 'l2_leaf_reg': 0.2009067288022442, 'border_count': 68, 'bagging_temperature': 0.760359293736435, 'random_strength': 6.420482914513566, 'grow_policy': 'Lossguide', 'min_data_in_leaf': 848, 'max_leaves': 141}. Best is trial 14 with value: 1609.1448261457704.[0m
[32m[I 2024-10-13 06:59:28,794][0m Trial 481 finished with value: 1741.778181879955 and parameters: {'depth': 9, 'learning_rate': 0.04906265349661768, 'iterations': 616, 'l2_leaf_reg': 0.14666444760279157, 'border_count': 80, 'bagging_temperature': 0.7255181455291796, 'random_strength': 6.618638846252623, 'grow_policy': 'Lossguide', 'min_data_in_leaf': 786, 'max_leaves': 135}. Best is trial 14 with value: 1609.1448261457704.[0m
[32m[I 2024-10-13 06:59:31,444][0m Trial 482 finished with value: 1738.0034804683553 and parameters: {'depth': 9, 'learning_rate': 0.0364666747148008, 'iterations': 2750, 'l2_leaf_reg': 0.5179724683035345, 'border_count': 72, 'bagging_temperature': 0.7142133336643084, 'random_strength': 6.288228041527802, 'grow_policy': 'Depthwise', 'min_data_in_leaf': 853}. Best is trial 14 with value: 1609.1448261457704.[0m
[32m[I 2024-10-13 06:59:33,850][0m Trial 483 finished with value: 1659.122354756764 and parameters: {'depth': 9, 'learning_rate': 0.029223316088558767, 'iterations': 2609, 'l2_leaf_reg': 0.2590376259874511, 'border_count': 78, 'bagging_temperature': 0.6954028236354424, 'random_strength': 6.725124464188139, 'grow_policy': 'Lossguide', 'min_data_in_leaf': 827, 'max_leaves': 151}. Best is trial 14 with value: 1609.1448261457704.[0m
[32m[I 2024-10-13 06:59:36,402][0m Trial 484 finished with value: 1657.4154405831912 and parameters: {'depth': 9, 'learning_rate': 0.04222296967841149, 'iterations': 2692, 'l2_leaf_reg': 0.26214688641377787, 'border_count': 83, 'bagging_temperature': 0.7360513002460702, 'random_strength': 6.467810673738226, 'grow_policy': 'Lossguide', 'min_data_in_leaf': 807, 'max_leaves': 235}. Best is trial 14 with value: 1609.1448261457704.[0m
[32m[I 2024-10-13 06:59:39,115][0m Trial 485 finished with value: 1677.6262799164228 and parameters: {'depth': 9, 'learning_rate': 0.03020947510857156, 'iterations': 2906, 'l2_leaf_reg': 0.39755149048064764, 'border_count': 90, 'bagging_temperature': 0.7104684062716139, 'random_strength': 5.873410846443103, 'grow_policy': 'Lossguide', 'min_data_in_leaf': 900, 'max_leaves': 147}. Best is trial 14 with value: 1609.1448261457704.[0m
[32m[I 2024-10-13 06:59:41,777][0m Trial 486 finished with value: 1981.4007746875916 and parameters: {'depth': 8, 'learning_rate': 0.03499983179372475, 'iterations': 2810, 'l2_leaf_reg': 0.8496368981705988, 'border_count': 58, 'bagging_temperature': 0.6836993094554995, 'random_strength': 6.639814645648753, 'grow_policy': 'Lossguide', 'min_data_in_leaf': 877, 'max_leaves': 140}. Best is trial 14 with value: 1609.1448261457704.[0m
[32m[I 2024-10-13 06:59:44,194][0m Trial 487 finished with value: 1698.4836102844315 and parameters: {'depth': 9, 'learning_rate': 0.04586967936448578, 'iterations': 2572, 'l2_leaf_reg': 0.39818580967831235, 'border_count': 74, 'bagging_temperature': 0.6882615749640355, 'random_strength': 6.856008532693367, 'grow_policy': 'Lossguide', 'min_data_in_leaf': 811, 'max_leaves': 128}. Best is trial 14 with value: 1609.1448261457704.[0m
[32m[I 2024-10-13 06:59:46,981][0m Trial 488 finished with value: 1644.9454695485242 and parameters: {'depth': 6, 'learning_rate': 0.037065276128474496, 'iterations': 3000, 'l2_leaf_reg': 9.203248423386383e-06, 'border_count': 83, 'bagging_temperature': 0.6581984699189373, 'random_strength': 6.344983223122661, 'grow_policy': 'Lossguide', 'min_data_in_leaf': 778, 'max_leaves': 146}. Best is trial 14 with value: 1609.1448261457704.[0m
[32m[I 2024-10-13 07:00:14,254][0m Trial 489 finished with value: 1900.9930597279129 and parameters: {'depth': 8, 'learning_rate': 0.028390816962422915, 'iterations': 2848, 'l2_leaf_reg': 0.7390438364555115, 'border_count': 65, 'bagging_temperature': 0.8121570510708503, 'random_strength': 6.525339025463799, 'grow_policy': 'SymmetricTree', 'min_data_in_leaf': 841}. Best is trial 14 with value: 1609.1448261457704.[0m
[32m[I 2024-10-13 07:00:16,904][0m Trial 490 finished with value: 1654.786592449608 and parameters: {'depth': 7, 'learning_rate': 0.032602964973929026, 'iterations': 2904, 'l2_leaf_reg': 1.0871856324714264, 'border_count': 79, 'bagging_temperature': 0.7194861951371022, 'random_strength': 6.086952557813087, 'grow_policy': 'Lossguide', 'min_data_in_leaf': 459, 'max_leaves': 158}. Best is trial 14 with value: 1609.1448261457704.[0m
[32m[I 2024-10-13 07:00:19,427][0m Trial 491 finished with value: 1673.3434135465207 and parameters: {'depth': 9, 'learning_rate': 0.14582443588199484, 'iterations': 2723, 'l2_leaf_reg': 0.3546659779099902, 'border_count': 89, 'bagging_temperature': 0.19598069256854894, 'random_strength': 6.75632677886992, 'grow_policy': 'Lossguide', 'min_data_in_leaf': 823, 'max_leaves': 141}. Best is trial 14 with value: 1609.1448261457704.[0m
[32m[I 2024-10-13 07:00:22,001][0m Trial 492 finished with value: 1768.1825376175957 and parameters: {'depth': 8, 'learning_rate': 0.04062730095730694, 'iterations': 2653, 'l2_leaf_reg': 0.13523712062009288, 'border_count': 72, 'bagging_temperature': 0.6935625234057681, 'random_strength': 6.79141519076097, 'grow_policy': 'Lossguide', 'min_data_in_leaf': 793, 'max_leaves': 153}. Best is trial 14 with value: 1609.1448261457704.[0m
[32m[I 2024-10-13 07:00:24,636][0m Trial 493 finished with value: 1709.9050254843703 and parameters: {'depth': 9, 'learning_rate': 0.08673246577394521, 'iterations': 2810, 'l2_leaf_reg': 1.6493598431677992, 'border_count': 97, 'bagging_temperature': 0.670411435665749, 'random_strength': 5.636193922482633, 'grow_policy': 'Lossguide', 'min_data_in_leaf': 426, 'max_leaves': 167}. Best is trial 14 with value: 1609.1448261457704.[0m
[32m[I 2024-10-13 07:00:27,395][0m Trial 494 finished with value: 1653.1442226956553 and parameters: {'depth': 9, 'learning_rate': 0.02882773716485509, 'iterations': 2938, 'l2_leaf_reg': 0.6441745142106408, 'border_count': 86, 'bagging_temperature': 0.7426356237201789, 'random_strength': 6.3050894770349855, 'grow_policy': 'Lossguide', 'min_data_in_leaf': 402, 'max_leaves': 178}. Best is trial 14 with value: 1609.1448261457704.[0m
[32m[I 2024-10-13 07:00:29,970][0m Trial 495 finished with value: 1677.1662011250446 and parameters: {'depth': 8, 'learning_rate': 0.055752558562370054, 'iterations': 2754, 'l2_leaf_reg': 0.2819345939770043, 'border_count': 77, 'bagging_temperature': 0.6541484256194362, 'random_strength': 6.5623874139173495, 'grow_policy': 'Lossguide', 'min_data_in_leaf': 833, 'max_leaves': 157}. Best is trial 14 with value: 1609.1448261457704.[0m
[32m[I 2024-10-13 07:00:32,654][0m Trial 496 finished with value: 1655.6219028241217 and parameters: {'depth': 9, 'learning_rate': 0.03534608691925715, 'iterations': 2852, 'l2_leaf_reg': 0.0011678533499193118, 'border_count': 83, 'bagging_temperature': 0.711766429176968, 'random_strength': 6.8357748000711345, 'grow_policy': 'Lossguide', 'min_data_in_leaf': 435, 'max_leaves': 148}. Best is trial 14 with value: 1609.1448261457704.[0m
[32m[I 2024-10-13 07:00:35,359][0m Trial 497 finished with value: 1674.3523899155198 and parameters: {'depth': 9, 'learning_rate': 0.04897156356114816, 'iterations': 2913, 'l2_leaf_reg': 0.0008552251378629987, 'border_count': 93, 'bagging_temperature': 0.08120985427811114, 'random_strength': 6.158323917978461, 'grow_policy': 'Lossguide', 'min_data_in_leaf': 412, 'max_leaves': 202}. Best is trial 14 with value: 1609.1448261457704.[0m
[32m[I 2024-10-13 07:00:37,823][0m Trial 498 finished with value: 1749.3761868705285 and parameters: {'depth': 9, 'learning_rate': 0.028247963761434333, 'iterations': 2619, 'l2_leaf_reg': 0.20626618595179383, 'border_count': 70, 'bagging_temperature': 0.6817075915875378, 'random_strength': 6.94470317535112, 'grow_policy': 'Lossguide', 'min_data_in_leaf': 279, 'max_leaves': 163}. Best is trial 14 with value: 1609.1448261457704.[0m
[32m[I 2024-10-13 07:00:40,373][0m Trial 499 finished with value: 1675.2778111353202 and parameters: {'depth': 9, 'learning_rate': 0.041376559174815926, 'iterations': 2710, 'l2_leaf_reg': 0.0019230140179807452, 'border_count': 87, 'bagging_temperature': 0.6569825875785509, 'random_strength': 5.433361027779096, 'grow_policy': 'Lossguide', 'min_data_in_leaf': 865, 'max_leaves': 188}. Best is trial 14 with value: 1609.1448261457704.[0m
[32m[I 2024-10-13 07:00:43,024][0m Trial 500 finished with value: 1717.7674864316493 and parameters: {'depth': 9, 'learning_rate': 0.10936145173355562, 'iterations': 2804, 'l2_leaf_reg': 0.0025229632674661695, 'border_count': 79, 'bagging_temperature': 0.7011110560325405, 'random_strength': 6.61279251395994, 'grow_policy': 'Lossguide', 'min_data_in_leaf': 378, 'max_leaves': 159}. Best is trial 14 with value: 1609.1448261457704.[0m
