[32m[I 2024-10-13 07:10:44,439][0m Trial 651 finished with value: 1661.480399502971 and parameters: {'depth': 8, 'learning_rate': 0.0498888278865542, 'iterations': 2989, 'l2_leaf_reg': 0.00014260174255450027, 'border_count': 100, 'bagging_temperature': 0.22688246011209634, 'random_strength': 6.604097645790478, 'grow_policy': 'Lossguide', 'min_data_in_leaf': 324, 'max_leaves': 234}. Best is trial 14 with value: 1609.1448261457704.[0m
[32m[I 2024-10-13 07:10:47,240][0m Trial 652 finished with value: 1676.0067588443549 and parameters: {'depth': 8, 'learning_rate': 0.026108473681212364, 'iterations': 2999, 'l2_leaf_reg': 6.557932994194302e-05, 'border_count': 95, 'bagging_temperature': 0.7730690227308683, 'random_strength': 5.961436040623293, 'grow_policy': 'Lossguide', 'min_data_in_leaf': 343, 'max_leaves': 232}. Best is trial 14 with value: 1609.1448261457704.[0m
[32m[I 2024-10-13 07:10:49,914][0m Trial 653 finished with value: 1647.5830090014883 and parameters: {'depth': 8, 'learning_rate': 0.03231970488530386, 'iterations': 2900, 'l2_leaf_reg': 1.2206719061594361e-06, 'border_count': 91, 'bagging_temperature': 0.708548693779913, 'random_strength': 6.4976197546864265, 'grow_policy': 'Lossguide', 'min_data_in_leaf': 358, 'max_leaves': 143}. Best is trial 14 with value: 1609.1448261457704.[0m
[32m[I 2024-10-13 07:10:52,617][0m Trial 654 finished with value: 1673.5449122722723 and parameters: {'depth': 7, 'learning_rate': 0.022790787986662692, 'iterations': 2922, 'l2_leaf_reg': 6.434374195923699e-07, 'border_count': 109, 'bagging_temperature': 0.7490645265395846, 'random_strength': 6.796832890315072, 'grow_policy': 'Lossguide', 'min_data_in_leaf': 337, 'max_leaves': 236}. Best is trial 14 with value: 1609.1448261457704.[0m
[32m[I 2024-10-13 07:11:20,479][0m Trial 655 finished with value: 1819.680943048655 and parameters: {'depth': 8, 'learning_rate': 0.0416818206706691, 'iterations': 2852, 'l2_leaf_reg': 0.4060758900624238, 'border_count': 86, 'bagging_temperature': 0.6525223973941839, 'random_strength': 6.115639043784712, 'grow_policy': 'SymmetricTree', 'min_data_in_leaf': 370}. Best is trial 14 with value: 1609.1448261457704.[0m
[32m[I 2024-10-13 07:11:23,178][0m Trial 656 finished with value: 1784.2370612411337 and parameters: {'depth': 7, 'learning_rate': 0.005513911800783853, 'iterations': 2950, 'l2_leaf_reg': 0.0009082913574532235, 'border_count': 87, 'bagging_temperature': 0.6756277038411969, 'random_strength': 5.727418292458847, 'grow_policy': 'Lossguide', 'min_data_in_leaf': 305, 'max_leaves': 230}. Best is trial 14 with value: 1609.1448261457704.[0m
[32m[I 2024-10-13 07:11:25,843][0m Trial 657 finished with value: 1670.7698512789766 and parameters: {'depth': 4, 'learning_rate': 0.029055464570910353, 'iterations': 2892, 'l2_leaf_reg': 5.254406752582626e-05, 'border_count': 95, 'bagging_temperature': 0.6985635904944054, 'random_strength': 7.008914973076321, 'grow_policy': 'Lossguide', 'min_data_in_leaf': 853, 'max_leaves': 241}. Best is trial 14 with value: 1609.1448261457704.[0m
[32m[I 2024-10-13 07:11:28,553][0m Trial 658 finished with value: 1645.2145211325922 and parameters: {'depth': 3, 'learning_rate': 0.035151885905966435, 'iterations': 2999, 'l2_leaf_reg': 2.0836471483950445e-06, 'border_count': 84, 'bagging_temperature': 0.729266081053488, 'random_strength': 6.2636412588882155, 'grow_policy': 'Lossguide', 'min_data_in_leaf': 362, 'max_leaves': 139}. Best is trial 14 with value: 1609.1448261457704.[0m
[32m[I 2024-10-13 07:11:31,211][0m Trial 659 finished with value: 1665.4393299777105 and parameters: {'depth': 8, 'learning_rate': 0.016832316149059046, 'iterations': 2844, 'l2_leaf_reg': 2.385808416278628e-06, 'border_count': 89, 'bagging_temperature': 0.6234140143129834, 'random_strength': 6.617449947817416, 'grow_policy': 'Lossguide', 'min_data_in_leaf': 375, 'max_leaves': 165}. Best is trial 14 with value: 1609.1448261457704.[0m
[32m[I 2024-10-13 07:11:34,021][0m Trial 660 finished with value: 1689.9861915240333 and parameters: {'depth': 3, 'learning_rate': 0.0529420887252627, 'iterations': 2998, 'l2_leaf_reg': 0.00026408287798480976, 'border_count': 98, 'bagging_temperature': 0.6622122005580051, 'random_strength': 5.88675991253362, 'grow_policy': 'Lossguide', 'min_data_in_leaf': 834, 'max_leaves': 223}. Best is trial 14 with value: 1609.1448261457704.[0m
[32m[I 2024-10-13 07:11:36,630][0m Trial 661 finished with value: 1684.8624825358854 and parameters: {'depth': 3, 'learning_rate': 0.04381977869505097, 'iterations': 2773, 'l2_leaf_reg': 1.90577462623397e-06, 'border_count': 81, 'bagging_temperature': 0.6433012321428438, 'random_strength': 6.801587715392655, 'grow_policy': 'Depthwise', 'min_data_in_leaf': 283}. Best is trial 14 with value: 1609.1448261457704.[0m
[32m[I 2024-10-13 07:11:39,305][0m Trial 662 finished with value: 1737.8130105362222 and parameters: {'depth': 8, 'learning_rate': 0.1490249570596117, 'iterations': 2902, 'l2_leaf_reg': 7.935917952548484e-07, 'border_count': 91, 'bagging_temperature': 0.6839417970580676, 'random_strength': 6.436196967356661, 'grow_policy': 'Lossguide', 'min_data_in_leaf': 332, 'max_leaves': 247}. Best is trial 14 with value: 1609.1448261457704.[0m
[32m[I 2024-10-13 07:11:42,007][0m Trial 663 finished with value: 1664.756658950819 and parameters: {'depth': 5, 'learning_rate': 0.027660382140428357, 'iterations': 2939, 'l2_leaf_reg': 0.00040591966669228273, 'border_count': 84, 'bagging_temperature': 0.7165797822332217, 'random_strength': 7.449159074036502, 'grow_policy': 'Lossguide', 'min_data_in_leaf': 803, 'max_leaves': 227}. Best is trial 14 with value: 1609.1448261457704.[0m
[32m[I 2024-10-13 07:11:44,700][0m Trial 664 finished with value: 1771.936156667547 and parameters: {'depth': 3, 'learning_rate': 0.23259025608974943, 'iterations': 2836, 'l2_leaf_reg': 4.829545911236286e-06, 'border_count': 102, 'bagging_temperature': 0.6959842458909936, 'random_strength': 6.106715940955964, 'grow_policy': 'Lossguide', 'min_data_in_leaf': 397, 'max_leaves': 128}. Best is trial 14 with value: 1609.1448261457704.[0m
[32m[I 2024-10-13 07:11:47,292][0m Trial 665 finished with value: 1764.0548865989686 and parameters: {'depth': 3, 'learning_rate': 0.03556045877069398, 'iterations': 2738, 'l2_leaf_reg': 8.898926515351674, 'border_count': 74, 'bagging_temperature': 0.6642142659619658, 'random_strength': 7.2107621525975665, 'grow_policy': 'Lossguide', 'min_data_in_leaf': 354, 'max_leaves': 217}. Best is trial 14 with value: 1609.1448261457704.[0m
[32m[I 2024-10-13 07:11:49,972][0m Trial 666 finished with value: 1684.6531923371028 and parameters: {'depth': 8, 'learning_rate': 0.020098265415552385, 'iterations': 2888, 'l2_leaf_reg': 1.4176374731737534e-06, 'border_count': 93, 'bagging_temperature': 0.6385804925591293, 'random_strength': 6.3783493395081905, 'grow_policy': 'Lossguide', 'min_data_in_leaf': 821, 'max_leaves': 155}. Best is trial 14 with value: 1609.1448261457704.[0m
[32m[I 2024-10-13 07:11:52,633][0m Trial 667 finished with value: 1650.58941167779 and parameters: {'depth': 4, 'learning_rate': 0.03144655577658951, 'iterations': 2789, 'l2_leaf_reg': 0.0010865328663771166, 'border_count': 87, 'bagging_temperature': 0.7287801424575301, 'random_strength': 6.956686746820861, 'grow_policy': 'Lossguide', 'min_data_in_leaf': 387, 'max_leaves': 147}. Best is trial 14 with value: 1609.1448261457704.[0m
[32m[I 2024-10-13 07:12:01,778][0m Trial 668 finished with value: 1725.8679131314823 and parameters: {'depth': 3, 'learning_rate': 0.023373807285252925, 'iterations': 2851, 'l2_leaf_reg': 2.6910606998530344e-07, 'border_count': 79, 'bagging_temperature': 0.6048955948832516, 'random_strength': 7.724125931774376, 'grow_policy': 'SymmetricTree', 'min_data_in_leaf': 361}. Best is trial 14 with value: 1609.1448261457704.[0m
[32m[I 2024-10-13 07:12:04,471][0m Trial 669 finished with value: 1637.5397548340768 and parameters: {'depth': 10, 'learning_rate': 0.038273756321820944, 'iterations': 2945, 'l2_leaf_reg': 5.150784940245298e-07, 'border_count': 83, 'bagging_temperature': 0.6787440456858053, 'random_strength': 5.674405122540265, 'grow_policy': 'Lossguide', 'min_data_in_leaf': 314, 'max_leaves': 135}. Best is trial 14 with value: 1609.1448261457704.[0m
[32m[I 2024-10-13 07:12:07,178][0m Trial 670 finished with value: 1774.8871889107056 and parameters: {'depth': 10, 'learning_rate': 0.05429958904327666, 'iterations': 2951, 'l2_leaf_reg': 2.851774284031701e-07, 'border_count': 69, 'bagging_temperature': 0.6746612661135805, 'random_strength': 5.652687474843171, 'grow_policy': 'Lossguide', 'min_data_in_leaf': 302, 'max_leaves': 134}. Best is trial 14 with value: 1609.1448261457704.[0m
[32m[I 2024-10-13 07:12:09,854][0m Trial 671 finished with value: 1653.9331572968783 and parameters: {'depth': 10, 'learning_rate': 0.046326123633473756, 'iterations': 2922, 'l2_leaf_reg': 7.684982611180283e-07, 'border_count': 78, 'bagging_temperature': 0.6521175840939959, 'random_strength': 5.47643146555082, 'grow_policy': 'Lossguide', 'min_data_in_leaf': 251, 'max_leaves': 130}. Best is trial 14 with value: 1609.1448261457704.[0m
[32m[I 2024-10-13 07:12:12,665][0m Trial 672 finished with value: 1701.4954154281131 and parameters: {'depth': 10, 'learning_rate': 0.07456278512447913, 'iterations': 2995, 'l2_leaf_reg': 1.485607079320372e-06, 'border_count': 72, 'bagging_temperature': 0.6295258816434496, 'random_strength': 5.812730772722696, 'grow_policy': 'Lossguide', 'min_data_in_leaf': 290, 'max_leaves': 196}. Best is trial 14 with value: 1609.1448261457704.[0m
[32m[I 2024-10-13 07:12:15,381][0m Trial 673 finished with value: 1646.2757605063462 and parameters: {'depth': 3, 'learning_rate': 0.0397927747982548, 'iterations': 2928, 'l2_leaf_reg': 6.177319402156208e-07, 'border_count': 82, 'bagging_temperature': 0.6669543968339908, 'random_strength': 5.607100721338008, 'grow_policy': 'Lossguide', 'min_data_in_leaf': 325, 'max_leaves': 161}. Best is trial 14 with value: 1609.1448261457704.[0m
[32m[I 2024-10-13 07:12:18,097][0m Trial 674 finished with value: 1791.545318411213 and parameters: {'depth': 10, 'learning_rate': 0.04356811085631687, 'iterations': 2946, 'l2_leaf_reg': 0.00016556604164098061, 'border_count': 64, 'bagging_temperature': 0.6814893212563714, 'random_strength': 5.870742567360912, 'grow_policy': 'Lossguide', 'min_data_in_leaf': 323, 'max_leaves': 165}. Best is trial 14 with value: 1609.1448261457704.[0m
[32m[I 2024-10-13 07:12:20,699][0m Trial 675 finished with value: 1675.0958476133724 and parameters: {'depth': 10, 'learning_rate': 0.05985758652977529, 'iterations': 2882, 'l2_leaf_reg': 4.0031271434089854e-07, 'border_count': 78, 'bagging_temperature': 0.6500025227010767, 'random_strength': 5.349216308994566, 'grow_policy': 'Lossguide', 'min_data_in_leaf': 308, 'max_leaves': 153}. Best is trial 14 with value: 1609.1448261457704.[0m
[32m[I 2024-10-13 07:12:23,450][0m Trial 676 finished with value: 1658.6364804227437 and parameters: {'depth': 10, 'learning_rate': 0.03577111045105009, 'iterations': 2955, 'l2_leaf_reg': 5.404176759397113e-07, 'border_count': 84, 'bagging_temperature': 0.6185151933406801, 'random_strength': 5.941620628330446, 'grow_policy': 'Lossguide', 'min_data_in_leaf': 337, 'max_leaves': 169}. Best is trial 14 with value: 1609.1448261457704.[0m
[32m[I 2024-10-13 07:12:26,109][0m Trial 677 finished with value: 1668.972170561601 and parameters: {'depth': 7, 'learning_rate': 0.0273948102257976, 'iterations': 2885, 'l2_leaf_reg': 0.1578838325884847, 'border_count': 90, 'bagging_temperature': 0.68796351708269, 'random_strength': 5.61889065392374, 'grow_policy': 'Lossguide', 'min_data_in_leaf': 284, 'max_leaves': 159}. Best is trial 14 with value: 1609.1448261457704.[0m
[32m[I 2024-10-13 07:12:28,704][0m Trial 678 finished with value: 1755.0636616489091 and parameters: {'depth': 10, 'learning_rate': 0.0478092811810707, 'iterations': 2837, 'l2_leaf_reg': 0.0005184444490731793, 'border_count': 74, 'bagging_temperature': 0.6615957872111289, 'random_strength': 5.730749975171442, 'grow_policy': 'Lossguide', 'min_data_in_leaf': 340, 'max_leaves': 221}. Best is trial 14 with value: 1609.1448261457704.[0m
[32m[I 2024-10-13 07:12:31,428][0m Trial 679 finished with value: 1712.6932504325327 and parameters: {'depth': 3, 'learning_rate': 0.11709369543713359, 'iterations': 2954, 'l2_leaf_reg': 0.0017184285607487815, 'border_count': 96, 'bagging_temperature': 0.6347245897781452, 'random_strength': 5.355529253675483, 'grow_policy': 'Lossguide', 'min_data_in_leaf': 317, 'max_leaves': 137}. Best is trial 14 with value: 1609.1448261457704.[0m
[32m[I 2024-10-13 07:12:34,213][0m Trial 680 finished with value: 1647.377344965934 and parameters: {'depth': 4, 'learning_rate': 0.030233344364304852, 'iterations': 2999, 'l2_leaf_reg': 8.797697759944014e-07, 'border_count': 82, 'bagging_temperature': 0.6984432137142982, 'random_strength': 5.999094835127179, 'grow_policy': 'Lossguide', 'min_data_in_leaf': 358, 'max_leaves': 47}. Best is trial 14 with value: 1609.1448261457704.[0m
[32m[I 2024-10-13 07:12:46,165][0m Trial 681 finished with value: 1729.2855797201887 and parameters: {'depth': 5, 'learning_rate': 0.03839764988725798, 'iterations': 2887, 'l2_leaf_reg': 0.3282215261338038, 'border_count': 92, 'bagging_temperature': 0.6745583669934138, 'random_strength': 1.2781281879966233, 'grow_policy': 'SymmetricTree', 'min_data_in_leaf': 864}. Best is trial 14 with value: 1609.1448261457704.[0m
[32m[I 2024-10-13 07:12:48,702][0m Trial 682 finished with value: 1684.8122534280703 and parameters: {'depth': 3, 'learning_rate': 0.18141569109545513, 'iterations': 2829, 'l2_leaf_reg': 0.0007166820039667135, 'border_count': 86, 'bagging_temperature': 0.6528287361900165, 'random_strength': 0.39623535825488077, 'grow_policy': 'Lossguide', 'min_data_in_leaf': 273, 'max_leaves': 148}. Best is trial 14 with value: 1609.1448261457704.[0m
[32m[I 2024-10-13 07:12:51,482][0m Trial 683 finished with value: 1661.0166863158563 and parameters: {'depth': 6, 'learning_rate': 0.025549569254148523, 'iterations': 2907, 'l2_leaf_reg': 0.9262544407931754, 'border_count': 76, 'bagging_temperature': 0.6964972422891045, 'random_strength': 6.198388322554189, 'grow_policy': 'Depthwise', 'min_data_in_leaf': 375}. Best is trial 14 with value: 1609.1448261457704.[0m
[32m[I 2024-10-13 07:12:52,947][0m Trial 684 finished with value: 1713.9321064272337 and parameters: {'depth': 3, 'learning_rate': 0.038627927298090454, 'iterations': 1223, 'l2_leaf_reg': 3.588160892393336e-07, 'border_count': 100, 'bagging_temperature': 0.6194897177177179, 'random_strength': 5.92454928592436, 'grow_policy': 'Lossguide', 'min_data_in_leaf': 782, 'max_leaves': 172}. Best is trial 14 with value: 1609.1448261457704.[0m
[32m[I 2024-10-13 07:12:55,666][0m Trial 685 finished with value: 1647.5338136014643 and parameters: {'depth': 10, 'learning_rate': 0.03219658136803469, 'iterations': 2936, 'l2_leaf_reg': 3.090727721623489e-05, 'border_count': 80, 'bagging_temperature': 0.6741292508852927, 'random_strength': 5.46767294236808, 'grow_policy': 'Lossguide', 'min_data_in_leaf': 811, 'max_leaves': 156}. Best is trial 14 with value: 1609.1448261457704.[0m
[32m[I 2024-10-13 07:12:58,266][0m Trial 686 finished with value: 1804.3925414619077 and parameters: {'depth': 3, 'learning_rate': 0.01880527031892804, 'iterations': 2805, 'l2_leaf_reg': 2.078655144657534e-07, 'border_count': 70, 'bagging_temperature': 0.639649291180319, 'random_strength': 5.824155207335414, 'grow_policy': 'Lossguide', 'min_data_in_leaf': 905, 'max_leaves': 162}. Best is trial 14 with value: 1609.1448261457704.[0m
[32m[I 2024-10-13 07:13:00,855][0m Trial 687 finished with value: 1661.1863880721264 and parameters: {'depth': 4, 'learning_rate': 0.04825032277099658, 'iterations': 2858, 'l2_leaf_reg': 1.4613182930359907e-07, 'border_count': 88, 'bagging_temperature': 0.7038744745215618, 'random_strength': 6.101635245309142, 'grow_policy': 'Lossguide', 'min_data_in_leaf': 310, 'max_leaves': 233}. Best is trial 14 with value: 1609.1448261457704.[0m
[32m[I 2024-10-13 07:13:03,585][0m Trial 688 finished with value: 1695.383305240463 and parameters: {'depth': 8, 'learning_rate': 0.02310735840860572, 'iterations': 2940, 'l2_leaf_reg': 3.141711205584037, 'border_count': 93, 'bagging_temperature': 0.525406672521203, 'random_strength': 5.585221790523969, 'grow_policy': 'Lossguide', 'min_data_in_leaf': 342, 'max_leaves': 138}. Best is trial 14 with value: 1609.1448261457704.[0m
[32m[I 2024-10-13 07:13:06,446][0m Trial 689 finished with value: 1647.4257872141138 and parameters: {'depth': 3, 'learning_rate': 0.030537417444628494, 'iterations': 2993, 'l2_leaf_reg': 0.0002860334620751442, 'border_count': 84, 'bagging_temperature': 0.6633652169846558, 'random_strength': 6.2857505763858486, 'grow_policy': 'Lossguide', 'min_data_in_leaf': 368, 'max_leaves': 145}. Best is trial 14 with value: 1609.1448261457704.[0m
[32m[I 2024-10-13 07:13:08,994][0m Trial 690 finished with value: 1660.5446295830016 and parameters: {'depth': 10, 'learning_rate': 0.025315618875684277, 'iterations': 2778, 'l2_leaf_reg': 9.99452660309541e-05, 'border_count': 77, 'bagging_temperature': 0.6001213812267044, 'random_strength': 5.194855931447379, 'grow_policy': 'Lossguide', 'min_data_in_leaf': 838, 'max_leaves': 166}. Best is trial 14 with value: 1609.1448261457704.[0m
[32m[I 2024-10-13 07:13:11,765][0m Trial 691 finished with value: 1676.1517090153156 and parameters: {'depth': 3, 'learning_rate': 0.040681074249974004, 'iterations': 2996, 'l2_leaf_reg': 0.0008676053734414058, 'border_count': 97, 'bagging_temperature': 0.6870647418558266, 'random_strength': 7.089125714958443, 'grow_policy': 'Lossguide', 'min_data_in_leaf': 393, 'max_leaves': 102}. Best is trial 14 with value: 1609.1448261457704.[0m
[32m[I 2024-10-13 07:13:14,539][0m Trial 692 finished with value: 1678.5961355208858 and parameters: {'depth': 3, 'learning_rate': 0.03356835271119082, 'iterations': 2999, 'l2_leaf_reg': 1.4348485411115093, 'border_count': 89, 'bagging_temperature': 0.380988826768754, 'random_strength': 6.075282957528731, 'grow_policy': 'Lossguide', 'min_data_in_leaf': 353, 'max_leaves': 150}. Best is trial 14 with value: 1609.1448261457704.[0m
[32m[I 2024-10-13 07:13:23,790][0m Trial 693 finished with value: 1864.040941638079 and parameters: {'depth': 3, 'learning_rate': 0.0578633304880926, 'iterations': 2864, 'l2_leaf_reg': 0.5674845647833328, 'border_count': 105, 'bagging_temperature': 0.6466008023289264, 'random_strength': 5.701680628290471, 'grow_policy': 'SymmetricTree', 'min_data_in_leaf': 333}. Best is trial 14 with value: 1609.1448261457704.[0m
[32m[I 2024-10-13 07:13:26,491][0m Trial 694 finished with value: 1656.4695399487762 and parameters: {'depth': 8, 'learning_rate': 0.03671733260766615, 'iterations': 2910, 'l2_leaf_reg': 0.0013882315062340343, 'border_count': 82, 'bagging_temperature': 0.6806611565600731, 'random_strength': 6.769657909165163, 'grow_policy': 'Lossguide', 'min_data_in_leaf': 826, 'max_leaves': 132}. Best is trial 14 with value: 1609.1448261457704.[0m
[32m[I 2024-10-13 07:13:29,098][0m Trial 695 finished with value: 1777.1582788187523 and parameters: {'depth': 3, 'learning_rate': 0.028134450453190997, 'iterations': 2807, 'l2_leaf_reg': 0.00037927089198436817, 'border_count': 73, 'bagging_temperature': 0.7127858518517332, 'random_strength': 7.519624031681141, 'grow_policy': 'Lossguide', 'min_data_in_leaf': 802, 'max_leaves': 175}. Best is trial 14 with value: 1609.1448261457704.[0m
[32m[I 2024-10-13 07:13:31,665][0m Trial 696 finished with value: 1701.5621988305518 and parameters: {'depth': 4, 'learning_rate': 0.015231202346679414, 'iterations': 2714, 'l2_leaf_reg': 0.0006245991262637512, 'border_count': 92, 'bagging_temperature': 0.6577748736514416, 'random_strength': 6.505859286250032, 'grow_policy': 'Lossguide', 'min_data_in_leaf': 405, 'max_leaves': 238}. Best is trial 14 with value: 1609.1448261457704.[0m
[32m[I 2024-10-13 07:13:34,351][0m Trial 697 finished with value: 1671.5095471065506 and parameters: {'depth': 8, 'learning_rate': 0.04610975200362615, 'iterations': 2894, 'l2_leaf_reg': 7.827596638544165e-06, 'border_count': 81, 'bagging_temperature': 0.6199282957627462, 'random_strength': 7.274414650787923, 'grow_policy': 'Lossguide', 'min_data_in_leaf': 261, 'max_leaves': 53}. Best is trial 14 with value: 1609.1448261457704.[0m
[32m[I 2024-10-13 07:13:37,017][0m Trial 698 finished with value: 1646.0645660178777 and parameters: {'depth': 7, 'learning_rate': 0.022174743028280552, 'iterations': 2844, 'l2_leaf_reg': 0.00021092382501758543, 'border_count': 86, 'bagging_temperature': 0.688074336855463, 'random_strength': 6.24099662420223, 'grow_policy': 'Lossguide', 'min_data_in_leaf': 383, 'max_leaves': 157}. Best is trial 14 with value: 1609.1448261457704.[0m
[32m[I 2024-10-13 07:13:39,609][0m Trial 699 finished with value: 1936.5955263760636 and parameters: {'depth': 3, 'learning_rate': 0.04010421268959535, 'iterations': 2772, 'l2_leaf_reg': 1.2704152070630459e-06, 'border_count': 65, 'bagging_temperature': 0.006144988138787277, 'random_strength': 5.384041699872094, 'grow_policy': 'Lossguide', 'min_data_in_leaf': 847, 'max_leaves': 142}. Best is trial 14 with value: 1609.1448261457704.[0m
[32m[I 2024-10-13 07:13:42,345][0m Trial 700 finished with value: 1648.0054293116978 and parameters: {'depth': 10, 'learning_rate': 0.029547063754965186, 'iterations': 2938, 'l2_leaf_reg': 0.0020506099493132223, 'border_count': 77, 'bagging_temperature': 0.6428796455828416, 'random_strength': 6.99460561120126, 'grow_policy': 'Lossguide', 'min_data_in_leaf': 296, 'max_leaves': 201}. Best is trial 14 with value: 1609.1448261457704.[0m
