[32m[I 2024-10-13 06:31:58,063][0m Trial 101 finished with value: 1700.0307335442521 and parameters: {'depth': 10, 'learning_rate': 0.034841308024221515, 'iterations': 1704, 'l2_leaf_reg': 1.892553477669557e-08, 'border_count': 129, 'bagging_temperature': 0.9394078397489585, 'random_strength': 8.994437475457524, 'grow_policy': 'Lossguide', 'min_data_in_leaf': 339, 'max_leaves': 53}. Best is trial 14 with value: 1609.1448261457704.[0m
[32m[I 2024-10-13 06:31:59,797][0m Trial 102 finished with value: 1664.241899766404 and parameters: {'depth': 8, 'learning_rate': 0.06029894642135953, 'iterations': 1652, 'l2_leaf_reg': 7.853415543808375e-08, 'border_count': 118, 'bagging_temperature': 0.9927967571618117, 'random_strength': 9.264194254452054, 'grow_policy': 'Lossguide', 'min_data_in_leaf': 254, 'max_leaves': 39}. Best is trial 14 with value: 1609.1448261457704.[0m
[32m[I 2024-10-13 06:32:01,649][0m Trial 103 finished with value: 1686.4627553148614 and parameters: {'depth': 7, 'learning_rate': 0.05064486228211266, 'iterations': 1857, 'l2_leaf_reg': 2.0800841295290296e-07, 'border_count': 81, 'bagging_temperature': 0.8941235280453232, 'random_strength': 9.5003921822612, 'grow_policy': 'Lossguide', 'min_data_in_leaf': 258, 'max_leaves': 31}. Best is trial 14 with value: 1609.1448261457704.[0m
[32m[I 2024-10-13 06:32:03,138][0m Trial 104 finished with value: 1733.7930105215103 and parameters: {'depth': 9, 'learning_rate': 0.06627759596240357, 'iterations': 1328, 'l2_leaf_reg': 3.422095837827179e-06, 'border_count': 121, 'bagging_temperature': 0.7152866914985974, 'random_strength': 9.259941021709643, 'grow_policy': 'Lossguide', 'min_data_in_leaf': 204, 'max_leaves': 41}. Best is trial 14 with value: 1609.1448261457704.[0m
[32m[I 2024-10-13 06:32:05,184][0m Trial 105 finished with value: 2178.6105650839418 and parameters: {'depth': 6, 'learning_rate': 0.10965837070503467, 'iterations': 2042, 'l2_leaf_reg': 1.33967479155036e-06, 'border_count': 42, 'bagging_temperature': 0.024845184575539747, 'random_strength': 8.698353428387227, 'grow_policy': 'Lossguide', 'min_data_in_leaf': 236, 'max_leaves': 39}. Best is trial 14 with value: 1609.1448261457704.[0m
[32m[I 2024-10-13 06:32:11,541][0m Trial 106 finished with value: 1923.2019600410636 and parameters: {'depth': 5, 'learning_rate': 0.15657652765241648, 'iterations': 1522, 'l2_leaf_reg': 4.255597919238424e-07, 'border_count': 100, 'bagging_temperature': 0.6330656061998642, 'random_strength': 7.5482401387949905, 'grow_policy': 'SymmetricTree', 'min_data_in_leaf': 433}. Best is trial 14 with value: 1609.1448261457704.[0m
[32m[I 2024-10-13 06:32:13,284][0m Trial 107 finished with value: 1685.89350119938 and parameters: {'depth': 3, 'learning_rate': 0.05850989088616441, 'iterations': 1608, 'l2_leaf_reg': 1.7917048053688068e-08, 'border_count': 112, 'bagging_temperature': 0.6926457050653989, 'random_strength': 6.566709977614254, 'grow_policy': 'Depthwise', 'min_data_in_leaf': 972}. Best is trial 14 with value: 1609.1448261457704.[0m
[32m[I 2024-10-13 06:32:15,000][0m Trial 108 finished with value: 1708.2795906343401 and parameters: {'depth': 3, 'learning_rate': 0.05821561637209426, 'iterations': 1612, 'l2_leaf_reg': 1.8586152631807067e-08, 'border_count': 134, 'bagging_temperature': 0.6886154996329988, 'random_strength': 6.973619001348502, 'grow_policy': 'Depthwise', 'min_data_in_leaf': 952}. Best is trial 14 with value: 1609.1448261457704.[0m
[32m[I 2024-10-13 06:32:16,400][0m Trial 109 finished with value: 1736.8184996527314 and parameters: {'depth': 3, 'learning_rate': 0.026024877118508247, 'iterations': 1100, 'l2_leaf_reg': 3.2710019468898245e-08, 'border_count': 105, 'bagging_temperature': 0.39957988077872064, 'random_strength': 6.4654855020160475, 'grow_policy': 'Depthwise', 'min_data_in_leaf': 909}. Best is trial 14 with value: 1609.1448261457704.[0m
[32m[I 2024-10-13 06:32:17,674][0m Trial 110 finished with value: 1723.5958583290708 and parameters: {'depth': 3, 'learning_rate': 0.04735948203879385, 'iterations': 944, 'l2_leaf_reg': 9.166781946329342e-08, 'border_count': 113, 'bagging_temperature': 0.33860221398240636, 'random_strength': 7.174986887343902, 'grow_policy': 'Depthwise', 'min_data_in_leaf': 977}. Best is trial 14 with value: 1609.1448261457704.[0m
[32m[I 2024-10-13 06:32:19,521][0m Trial 111 finished with value: 1698.6485444012044 and parameters: {'depth': 3, 'learning_rate': 0.07518547666501293, 'iterations': 1714, 'l2_leaf_reg': 2.3657729566112596e-08, 'border_count': 71, 'bagging_temperature': 0.6627743648671294, 'random_strength': 6.582371048776663, 'grow_policy': 'Depthwise', 'min_data_in_leaf': 876}. Best is trial 14 with value: 1609.1448261457704.[0m
[32m[I 2024-10-13 06:32:21,388][0m Trial 112 finished with value: 1758.6552231582195 and parameters: {'depth': 4, 'learning_rate': 0.20843792037599793, 'iterations': 1778, 'l2_leaf_reg': 1.054785730013688e-08, 'border_count': 87, 'bagging_temperature': 0.7476787218161374, 'random_strength': 6.250506262097871, 'grow_policy': 'Depthwise', 'min_data_in_leaf': 491}. Best is trial 14 with value: 1609.1448261457704.[0m
[32m[I 2024-10-13 06:32:23,063][0m Trial 113 finished with value: 1689.26940270135 and parameters: {'depth': 5, 'learning_rate': 0.09004804538154257, 'iterations': 1560, 'l2_leaf_reg': 7.326428662534025e-08, 'border_count': 92, 'bagging_temperature': 0.6018363359481991, 'random_strength': 7.828354096697864, 'grow_policy': 'Lossguide', 'min_data_in_leaf': 293, 'max_leaves': 205}. Best is trial 14 with value: 1609.1448261457704.[0m
[32m[I 2024-10-13 06:32:25,607][0m Trial 114 finished with value: 1746.8137803075788 and parameters: {'depth': 4, 'learning_rate': 0.13307872074747354, 'iterations': 1227, 'l2_leaf_reg': 2.8390507824849685e-08, 'border_count': 98, 'bagging_temperature': 0.8153317498176332, 'random_strength': 9.866282277594975, 'grow_policy': 'Lossguide', 'min_data_in_leaf': 835, 'max_leaves': 62}. Best is trial 14 with value: 1609.1448261457704.[0m
[32m[I 2024-10-13 06:32:33,829][0m Trial 115 finished with value: 1870.8911647607545 and parameters: {'depth': 6, 'learning_rate': 0.11317955009570115, 'iterations': 1644, 'l2_leaf_reg': 9.583612898240518e-06, 'border_count': 119, 'bagging_temperature': 0.7661421047467074, 'random_strength': 9.373052788002472, 'grow_policy': 'SymmetricTree', 'min_data_in_leaf': 747}. Best is trial 14 with value: 1609.1448261457704.[0m
[32m[I 2024-10-13 06:32:35,768][0m Trial 116 finished with value: 1670.8220642484423 and parameters: {'depth': 4, 'learning_rate': 0.04103398468302504, 'iterations': 1950, 'l2_leaf_reg': 1.6248720813645032e-07, 'border_count': 78, 'bagging_temperature': 0.5562035690051832, 'random_strength': 6.84344166373361, 'grow_policy': 'Lossguide', 'min_data_in_leaf': 661, 'max_leaves': 50}. Best is trial 14 with value: 1609.1448261457704.[0m
[32m[I 2024-10-13 06:32:37,912][0m Trial 117 finished with value: 1666.550074106732 and parameters: {'depth': 4, 'learning_rate': 0.042921379364756755, 'iterations': 2207, 'l2_leaf_reg': 1.9915695204108668e-07, 'border_count': 77, 'bagging_temperature': 0.5586307310994586, 'random_strength': 6.718471742586867, 'grow_policy': 'Lossguide', 'min_data_in_leaf': 671, 'max_leaves': 49}. Best is trial 14 with value: 1609.1448261457704.[0m
[32m[I 2024-10-13 06:32:40,272][0m Trial 118 finished with value: 1795.874064103471 and parameters: {'depth': 4, 'learning_rate': 0.04291626332915228, 'iterations': 2439, 'l2_leaf_reg': 2.2682419692947786e-07, 'border_count': 68, 'bagging_temperature': 0.4851925672464905, 'random_strength': 6.826640211998798, 'grow_policy': 'Lossguide', 'min_data_in_leaf': 662, 'max_leaves': 48}. Best is trial 14 with value: 1609.1448261457704.[0m
[32m[I 2024-10-13 06:32:42,480][0m Trial 119 finished with value: 1660.4260320949886 and parameters: {'depth': 4, 'learning_rate': 0.030941849225933016, 'iterations': 2317, 'l2_leaf_reg': 1.673048127600744e-07, 'border_count': 79, 'bagging_temperature': 0.549879242778773, 'random_strength': 5.755615541316818, 'grow_policy': 'Lossguide', 'min_data_in_leaf': 602, 'max_leaves': 37}. Best is trial 14 with value: 1609.1448261457704.[0m
[32m[I 2024-10-13 06:32:44,689][0m Trial 120 finished with value: 1679.6960644936903 and parameters: {'depth': 4, 'learning_rate': 0.021531060352367966, 'iterations': 2229, 'l2_leaf_reg': 1.583249276733091e-07, 'border_count': 77, 'bagging_temperature': 0.5584511908992055, 'random_strength': 5.706880803392385, 'grow_policy': 'Lossguide', 'min_data_in_leaf': 565, 'max_leaves': 255}. Best is trial 14 with value: 1609.1448261457704.[0m
[32m[I 2024-10-13 06:32:46,848][0m Trial 121 finished with value: 1687.0225812095493 and parameters: {'depth': 4, 'learning_rate': 0.02070913216319014, 'iterations': 2171, 'l2_leaf_reg': 1.912239738395505e-07, 'border_count': 79, 'bagging_temperature': 0.5508897017025738, 'random_strength': 5.6255081705242045, 'grow_policy': 'Lossguide', 'min_data_in_leaf': 612, 'max_leaves': 204}. Best is trial 14 with value: 1609.1448261457704.[0m
[32m[I 2024-10-13 06:32:49,595][0m Trial 122 finished with value: 1746.4632474027342 and parameters: {'depth': 4, 'learning_rate': 0.028180977654875566, 'iterations': 2994, 'l2_leaf_reg': 1.299692531112711e-07, 'border_count': 75, 'bagging_temperature': 0.5401189683846875, 'random_strength': 6.308342740027248, 'grow_policy': 'Lossguide', 'min_data_in_leaf': 545, 'max_leaves': 252}. Best is trial 14 with value: 1609.1448261457704.[0m
[32m[I 2024-10-13 06:32:51,850][0m Trial 123 finished with value: 1667.46778120244 and parameters: {'depth': 4, 'learning_rate': 0.02926888527902203, 'iterations': 2311, 'l2_leaf_reg': 4.979588459124215e-08, 'border_count': 87, 'bagging_temperature': 0.5714908859722428, 'random_strength': 4.830677218107185, 'grow_policy': 'Lossguide', 'min_data_in_leaf': 665, 'max_leaves': 98}. Best is trial 14 with value: 1609.1448261457704.[0m
[32m[I 2024-10-13 06:32:54,069][0m Trial 124 finished with value: 1671.114334297432 and parameters: {'depth': 4, 'learning_rate': 0.029437560402501433, 'iterations': 2274, 'l2_leaf_reg': 5.4941914686879315e-08, 'border_count': 90, 'bagging_temperature': 0.594611616091387, 'random_strength': 5.929253316835627, 'grow_policy': 'Lossguide', 'min_data_in_leaf': 653, 'max_leaves': 103}. Best is trial 14 with value: 1609.1448261457704.[0m
[32m[I 2024-10-13 06:32:56,276][0m Trial 125 finished with value: 1812.9465653333975 and parameters: {'depth': 4, 'learning_rate': 0.01574349841866264, 'iterations': 2279, 'l2_leaf_reg': 5.5289868956335434e-08, 'border_count': 65, 'bagging_temperature': 0.5840113022462343, 'random_strength': 5.387160897173047, 'grow_policy': 'Lossguide', 'min_data_in_leaf': 677, 'max_leaves': 122}. Best is trial 14 with value: 1609.1448261457704.[0m
[32m[I 2024-10-13 06:32:58,595][0m Trial 126 finished with value: 1675.222732528903 and parameters: {'depth': 4, 'learning_rate': 0.03755665873190492, 'iterations': 2390, 'l2_leaf_reg': 6.493913576320479e-07, 'border_count': 87, 'bagging_temperature': 0.573290172236355, 'random_strength': 4.80405686305136, 'grow_policy': 'Lossguide', 'min_data_in_leaf': 654, 'max_leaves': 49}. Best is trial 14 with value: 1609.1448261457704.[0m
[32m[I 2024-10-13 06:33:00,988][0m Trial 127 finished with value: 1765.5933017718219 and parameters: {'depth': 3, 'learning_rate': 0.03213192196889937, 'iterations': 2512, 'l2_leaf_reg': 3.1660178040858494e-07, 'border_count': 71, 'bagging_temperature': 0.5204000149133018, 'random_strength': 5.329642537141489, 'grow_policy': 'Lossguide', 'min_data_in_leaf': 721, 'max_leaves': 101}. Best is trial 14 with value: 1609.1448261457704.[0m
[32m[I 2024-10-13 06:33:03,212][0m Trial 128 finished with value: 1663.4567578290805 and parameters: {'depth': 5, 'learning_rate': 0.029114274854987365, 'iterations': 2277, 'l2_leaf_reg': 9.518532440938964e-08, 'border_count': 90, 'bagging_temperature': 0.5092306504471826, 'random_strength': 4.76491777594273, 'grow_policy': 'Lossguide', 'min_data_in_leaf': 695, 'max_leaves': 94}. Best is trial 14 with value: 1609.1448261457704.[0m
[32m[I 2024-10-13 06:33:05,463][0m Trial 129 finished with value: 1684.1442806353607 and parameters: {'depth': 4, 'learning_rate': 0.018084936116199705, 'iterations': 2347, 'l2_leaf_reg': 5.9135189014685206e-08, 'border_count': 81, 'bagging_temperature': 0.5030533923657067, 'random_strength': 5.918493623504751, 'grow_policy': 'Lossguide', 'min_data_in_leaf': 696, 'max_leaves': 111}. Best is trial 14 with value: 1609.1448261457704.[0m
[32m[I 2024-10-13 06:33:07,689][0m Trial 130 finished with value: 1649.641763224305 and parameters: {'depth': 4, 'learning_rate': 0.02442467635626335, 'iterations': 2286, 'l2_leaf_reg': 9.522569677429572e-08, 'border_count': 89, 'bagging_temperature': 0.5950071504531487, 'random_strength': 3.896026363758691, 'grow_policy': 'Lossguide', 'min_data_in_leaf': 611, 'max_leaves': 91}. Best is trial 14 with value: 1609.1448261457704.[0m
[32m[I 2024-10-13 06:33:09,898][0m Trial 131 finished with value: 1647.146379889834 and parameters: {'depth': 4, 'learning_rate': 0.025325777868227664, 'iterations': 2287, 'l2_leaf_reg': 7.948069654752837e-08, 'border_count': 89, 'bagging_temperature': 0.5914662577828057, 'random_strength': 4.264502742040204, 'grow_policy': 'Lossguide', 'min_data_in_leaf': 643, 'max_leaves': 88}. Best is trial 14 with value: 1609.1448261457704.[0m
[32m[I 2024-10-13 06:33:12,376][0m Trial 132 finished with value: 1713.097309976147 and parameters: {'depth': 3, 'learning_rate': 0.012119561668267097, 'iterations': 2582, 'l2_leaf_reg': 9.483126992691319e-08, 'border_count': 85, 'bagging_temperature': 0.4760256259129092, 'random_strength': 3.8779976329617147, 'grow_policy': 'Lossguide', 'min_data_in_leaf': 579, 'max_leaves': 93}. Best is trial 14 with value: 1609.1448261457704.[0m
[32m[I 2024-10-13 06:33:14,709][0m Trial 133 finished with value: 1691.3288744167562 and parameters: {'depth': 5, 'learning_rate': 0.02351143652029554, 'iterations': 2427, 'l2_leaf_reg': 4.254009419228771e-08, 'border_count': 99, 'bagging_temperature': 0.6242715962072153, 'random_strength': 4.285874872361422, 'grow_policy': 'Lossguide', 'min_data_in_leaf': 613, 'max_leaves': 88}. Best is trial 14 with value: 1609.1448261457704.[0m
[32m[I 2024-10-13 06:33:16,934][0m Trial 134 finished with value: 1815.243438686783 and parameters: {'depth': 5, 'learning_rate': 0.044173236582458995, 'iterations': 2302, 'l2_leaf_reg': 1.150243274735816e-07, 'border_count': 63, 'bagging_temperature': 0.5310523562935882, 'random_strength': 4.987859992961457, 'grow_policy': 'Lossguide', 'min_data_in_leaf': 640, 'max_leaves': 95}. Best is trial 14 with value: 1609.1448261457704.[0m
[32m[I 2024-10-13 06:33:19,016][0m Trial 135 finished with value: 1832.230811009278 and parameters: {'depth': 4, 'learning_rate': 0.0073545758936127865, 'iterations': 2096, 'l2_leaf_reg': 8.525693338851e-08, 'border_count': 94, 'bagging_temperature': 0.4542247790964297, 'random_strength': 3.4190571974088555, 'grow_policy': 'Lossguide', 'min_data_in_leaf': 620, 'max_leaves': 111}. Best is trial 14 with value: 1609.1448261457704.[0m
[32m[I 2024-10-13 06:33:21,146][0m Trial 136 finished with value: 1761.9647738825724 and parameters: {'depth': 4, 'learning_rate': 0.025902552085096436, 'iterations': 2210, 'l2_leaf_reg': 4.136918773483031e-07, 'border_count': 73, 'bagging_temperature': 0.5629538522313093, 'random_strength': 4.317972583781728, 'grow_policy': 'Lossguide', 'min_data_in_leaf': 679, 'max_leaves': 78}. Best is trial 14 with value: 1609.1448261457704.[0m
[32m[I 2024-10-13 06:33:23,175][0m Trial 137 finished with value: 1715.1607649380853 and parameters: {'depth': 5, 'learning_rate': 0.24914105862014457, 'iterations': 1971, 'l2_leaf_reg': 1.4686432091840837e-07, 'border_count': 81, 'bagging_temperature': 0.5047181120949691, 'random_strength': 4.262989047711603, 'grow_policy': 'Lossguide', 'min_data_in_leaf': 592, 'max_leaves': 83}. Best is trial 14 with value: 1609.1448261457704.[0m
[32m[I 2024-10-13 06:33:25,294][0m Trial 138 finished with value: 1660.946284594833 and parameters: {'depth': 3, 'learning_rate': 0.03692913195949585, 'iterations': 2176, 'l2_leaf_reg': 2.8577067211226515e-05, 'border_count': 89, 'bagging_temperature': 0.6004787645528605, 'random_strength': 4.845613212898751, 'grow_policy': 'Lossguide', 'min_data_in_leaf': 704, 'max_leaves': 67}. Best is trial 14 with value: 1609.1448261457704.[0m
[32m[I 2024-10-13 06:33:27,404][0m Trial 139 finished with value: 1713.2704816245684 and parameters: {'depth': 3, 'learning_rate': 0.037739688992452045, 'iterations': 2173, 'l2_leaf_reg': 4.996862051305993e-05, 'border_count': 105, 'bagging_temperature': 0.6411963340457758, 'random_strength': 4.100833974641415, 'grow_policy': 'Lossguide', 'min_data_in_leaf': 706, 'max_leaves': 67}. Best is trial 14 with value: 1609.1448261457704.[0m
[32m[I 2024-10-13 06:33:29,487][0m Trial 140 finished with value: 1953.0233451672882 and parameters: {'depth': 3, 'learning_rate': 0.030823914095710097, 'iterations': 2040, 'l2_leaf_reg': 0.0266209133980419, 'border_count': 55, 'bagging_temperature': 0.5924335472222917, 'random_strength': 5.119026301439727, 'grow_policy': 'Lossguide', 'min_data_in_leaf': 518, 'max_leaves': 71}. Best is trial 14 with value: 1609.1448261457704.[0m
[32m[I 2024-10-13 06:33:31,764][0m Trial 141 finished with value: 1691.7305490274664 and parameters: {'depth': 3, 'learning_rate': 0.04050432638423541, 'iterations': 2384, 'l2_leaf_reg': 2.567345545212774e-05, 'border_count': 90, 'bagging_temperature': 0.5491999325141173, 'random_strength': 3.502433303926959, 'grow_policy': 'Lossguide', 'min_data_in_leaf': 679, 'max_leaves': 38}. Best is trial 14 with value: 1609.1448261457704.[0m
[32m[I 2024-10-13 06:33:33,897][0m Trial 142 finished with value: 1711.8233678205493 and parameters: {'depth': 4, 'learning_rate': 0.047421114735870136, 'iterations': 2143, 'l2_leaf_reg': 3.6432619892898266e-08, 'border_count': 85, 'bagging_temperature': 0.6187126429547728, 'random_strength': 4.825552819221451, 'grow_policy': 'Lossguide', 'min_data_in_leaf': 778, 'max_leaves': 98}. Best is trial 14 with value: 1609.1448261457704.[0m
[32m[I 2024-10-13 06:33:36,191][0m Trial 143 finished with value: 1705.5842943375344 and parameters: {'depth': 3, 'learning_rate': 0.0701623634641734, 'iterations': 2323, 'l2_leaf_reg': 0.00013522189249600192, 'border_count': 97, 'bagging_temperature': 0.5762759797996408, 'random_strength': 4.025015259729176, 'grow_policy': 'Lossguide', 'min_data_in_leaf': 629, 'max_leaves': 45}. Best is trial 14 with value: 1609.1448261457704.[0m
[32m[I 2024-10-13 06:33:38,382][0m Trial 144 finished with value: 1685.5015378876099 and parameters: {'depth': 4, 'learning_rate': 0.024257799261126672, 'iterations': 2231, 'l2_leaf_reg': 7.469346959798943e-05, 'border_count': 77, 'bagging_temperature': 0.5301501509489078, 'random_strength': 4.52288742364427, 'grow_policy': 'Lossguide', 'min_data_in_leaf': 549, 'max_leaves': 87}. Best is trial 14 with value: 1609.1448261457704.[0m
[32m[I 2024-10-13 06:33:40,728][0m Trial 145 finished with value: 1661.4045229518947 and parameters: {'depth': 4, 'learning_rate': 0.062240929544668616, 'iterations': 2479, 'l2_leaf_reg': 2.1464891457959507e-05, 'border_count': 87, 'bagging_temperature': 0.6030072823403337, 'random_strength': 5.025974747421125, 'grow_policy': 'Lossguide', 'min_data_in_leaf': 647, 'max_leaves': 36}. Best is trial 14 with value: 1609.1448261457704.[0m
[32m[I 2024-10-13 06:33:43,160][0m Trial 146 finished with value: 1770.2719419849307 and parameters: {'depth': 4, 'learning_rate': 0.03442013959332529, 'iterations': 2471, 'l2_leaf_reg': 2.2071261035614799e-07, 'border_count': 68, 'bagging_temperature': 0.6073320634498586, 'random_strength': 4.837469670204894, 'grow_policy': 'Lossguide', 'min_data_in_leaf': 658, 'max_leaves': 51}. Best is trial 14 with value: 1609.1448261457704.[0m
[32m[I 2024-10-13 06:33:45,562][0m Trial 147 finished with value: 1689.9326571601825 and parameters: {'depth': 3, 'learning_rate': 0.06081701934376784, 'iterations': 2590, 'l2_leaf_reg': 3.5369621730150165e-05, 'border_count': 83, 'bagging_temperature': 0.5679787519684545, 'random_strength': 5.214298633655831, 'grow_policy': 'Lossguide', 'min_data_in_leaf': 700, 'max_leaves': 62}. Best is trial 14 with value: 1609.1448261457704.[0m
[32m[I 2024-10-13 06:33:47,894][0m Trial 148 finished with value: 1654.3658784817383 and parameters: {'depth': 11, 'learning_rate': 0.02992822318613572, 'iterations': 2408, 'l2_leaf_reg': 2.0227752154151545e-05, 'border_count': 88, 'bagging_temperature': 0.6481794828306697, 'random_strength': 4.6516504383578186, 'grow_policy': 'Lossguide', 'min_data_in_leaf': 573, 'max_leaves': 36}. Best is trial 14 with value: 1609.1448261457704.[0m
[32m[I 2024-10-13 06:33:50,178][0m Trial 149 finished with value: 1685.5915053894141 and parameters: {'depth': 13, 'learning_rate': 0.017574500514473658, 'iterations': 2323, 'l2_leaf_reg': 3.0358233934459484e-05, 'border_count': 96, 'bagging_temperature': 0.6314772075009452, 'random_strength': 4.62132266911772, 'grow_policy': 'Lossguide', 'min_data_in_leaf': 530, 'max_leaves': 36}. Best is trial 14 with value: 1609.1448261457704.[0m
[32m[I 2024-10-13 06:33:52,521][0m Trial 150 finished with value: 1725.959729490082 and parameters: {'depth': 10, 'learning_rate': 0.18438068338413308, 'iterations': 2402, 'l2_leaf_reg': 2.220696609239565e-05, 'border_count': 102, 'bagging_temperature': 0.6633757616497025, 'random_strength': 3.686152605585972, 'grow_policy': 'Lossguide', 'min_data_in_leaf': 566, 'max_leaves': 117}. Best is trial 14 with value: 1609.1448261457704.[0m
