[32m[I 2024-10-13 06:51:27,322][0m Trial 351 finished with value: 1702.120668761317 and parameters: {'depth': 3, 'learning_rate': 0.13273431277355752, 'iterations': 2937, 'l2_leaf_reg': 0.006379375589482861, 'border_count': 86, 'bagging_temperature': 0.6128310816055148, 'random_strength': 3.573422690458046, 'grow_policy': 'Lossguide', 'min_data_in_leaf': 413, 'max_leaves': 157}. Best is trial 14 with value: 1609.1448261457704.[0m
[32m[I 2024-10-13 06:51:29,628][0m Trial 352 finished with value: 1760.721319898723 and parameters: {'depth': 9, 'learning_rate': 0.024161102142086683, 'iterations': 2344, 'l2_leaf_reg': 8.019234444177136e-05, 'border_count': 72, 'bagging_temperature': 0.6370319236808498, 'random_strength': 4.262784077701349, 'grow_policy': 'Lossguide', 'min_data_in_leaf': 436, 'max_leaves': 181}. Best is trial 14 with value: 1609.1448261457704.[0m
[32m[I 2024-10-13 06:51:31,920][0m Trial 353 finished with value: 1700.6409618723142 and parameters: {'depth': 10, 'learning_rate': 0.04436688558257385, 'iterations': 2376, 'l2_leaf_reg': 0.0005444994667438908, 'border_count': 221, 'bagging_temperature': 0.6660799878887522, 'random_strength': 6.8914313266102205, 'grow_policy': 'Lossguide', 'min_data_in_leaf': 499, 'max_leaves': 147}. Best is trial 14 with value: 1609.1448261457704.[0m
[32m[I 2024-10-13 06:51:34,674][0m Trial 354 finished with value: 1642.8036593181587 and parameters: {'depth': 4, 'learning_rate': 0.02992596242291003, 'iterations': 2860, 'l2_leaf_reg': 0.018382091793723455, 'border_count': 79, 'bagging_temperature': 0.6864920045148456, 'random_strength': 4.441742523342343, 'grow_policy': 'Lossguide', 'min_data_in_leaf': 392, 'max_leaves': 192}. Best is trial 14 with value: 1609.1448261457704.[0m
[32m[I 2024-10-13 06:51:37,400][0m Trial 355 finished with value: 1717.816578737747 and parameters: {'depth': 3, 'learning_rate': 0.009541573005571685, 'iterations': 2965, 'l2_leaf_reg': 0.017778274443152664, 'border_count': 80, 'bagging_temperature': 0.7086432389877931, 'random_strength': 7.3218201332652875, 'grow_policy': 'Lossguide', 'min_data_in_leaf': 404, 'max_leaves': 194}. Best is trial 14 with value: 1609.1448261457704.[0m
[32m[I 2024-10-13 06:51:40,058][0m Trial 356 finished with value: 1677.793180844027 and parameters: {'depth': 4, 'learning_rate': 0.027361534226430236, 'iterations': 2845, 'l2_leaf_reg': 0.03292213196063205, 'border_count': 87, 'bagging_temperature': 0.6861890456642391, 'random_strength': 5.0324587514683, 'grow_policy': 'Lossguide', 'min_data_in_leaf': 384, 'max_leaves': 189}. Best is trial 14 with value: 1609.1448261457704.[0m
[32m[I 2024-10-13 06:51:42,726][0m Trial 357 finished with value: 1667.889472602173 and parameters: {'depth': 4, 'learning_rate': 0.030732318479747705, 'iterations': 2887, 'l2_leaf_reg': 0.012232900774490692, 'border_count': 80, 'bagging_temperature': 0.7317006621210399, 'random_strength': 7.519660220674254, 'grow_policy': 'Lossguide', 'min_data_in_leaf': 367, 'max_leaves': 198}. Best is trial 14 with value: 1609.1448261457704.[0m
[32m[I 2024-10-13 06:51:45,468][0m Trial 358 finished with value: 2259.236575910616 and parameters: {'depth': 4, 'learning_rate': 0.002075011867735687, 'iterations': 2883, 'l2_leaf_reg': 0.06741133553703857, 'border_count': 91, 'bagging_temperature': 0.6718332174401836, 'random_strength': 4.444506149705589, 'grow_policy': 'Lossguide', 'min_data_in_leaf': 401, 'max_leaves': 184}. Best is trial 14 with value: 1609.1448261457704.[0m
[32m[I 2024-10-13 06:51:55,351][0m Trial 359 finished with value: 1786.2577026990643 and parameters: {'depth': 4, 'learning_rate': 0.022144867379779967, 'iterations': 2787, 'l2_leaf_reg': 0.0215664052753878, 'border_count': 86, 'bagging_temperature': 0.6971818944951359, 'random_strength': 6.507161003904292, 'grow_policy': 'SymmetricTree', 'min_data_in_leaf': 382}. Best is trial 14 with value: 1609.1448261457704.[0m
[32m[I 2024-10-13 06:51:58,030][0m Trial 360 finished with value: 1795.504709856402 and parameters: {'depth': 9, 'learning_rate': 0.018719828960945394, 'iterations': 2922, 'l2_leaf_reg': 0.04996171172187699, 'border_count': 73, 'bagging_temperature': 0.648412596103443, 'random_strength': 3.7918383510126024, 'grow_policy': 'Lossguide', 'min_data_in_leaf': 332, 'max_leaves': 165}. Best is trial 14 with value: 1609.1448261457704.[0m
[32m[I 2024-10-13 06:52:00,603][0m Trial 361 finished with value: 1679.510347747277 and parameters: {'depth': 8, 'learning_rate': 0.02544739755298358, 'iterations': 2815, 'l2_leaf_reg': 0.2625939481985503, 'border_count': 81, 'bagging_temperature': 0.37491657700729053, 'random_strength': 4.796321984872892, 'grow_policy': 'Lossguide', 'min_data_in_leaf': 350, 'max_leaves': 208}. Best is trial 14 with value: 1609.1448261457704.[0m
[32m[I 2024-10-13 06:52:03,104][0m Trial 362 finished with value: 1640.6299975798647 and parameters: {'depth': 7, 'learning_rate': 0.03220561161569671, 'iterations': 2695, 'l2_leaf_reg': 0.0037775711280596653, 'border_count': 90, 'bagging_temperature': 0.6825888001809605, 'random_strength': 4.12686460280545, 'grow_policy': 'Lossguide', 'min_data_in_leaf': 422, 'max_leaves': 169}. Best is trial 14 with value: 1609.1448261457704.[0m
[32m[I 2024-10-13 06:52:05,642][0m Trial 363 finished with value: 1655.9628780263358 and parameters: {'depth': 9, 'learning_rate': 0.032982766112877204, 'iterations': 2708, 'l2_leaf_reg': 0.003413365247932371, 'border_count': 85, 'bagging_temperature': 0.7133199288402758, 'random_strength': 3.9613247400075844, 'grow_policy': 'Lossguide', 'min_data_in_leaf': 419, 'max_leaves': 193}. Best is trial 14 with value: 1609.1448261457704.[0m
[32m[I 2024-10-13 06:52:08,172][0m Trial 364 finished with value: 1644.206677287168 and parameters: {'depth': 8, 'learning_rate': 0.039638216640115874, 'iterations': 2722, 'l2_leaf_reg': 0.00149357357294105, 'border_count': 77, 'bagging_temperature': 0.6561938523084725, 'random_strength': 7.114440574560099, 'grow_policy': 'Lossguide', 'min_data_in_leaf': 439, 'max_leaves': 172}. Best is trial 14 with value: 1609.1448261457704.[0m
[32m[I 2024-10-13 06:52:10,828][0m Trial 365 finished with value: 1728.235187945781 and parameters: {'depth': 8, 'learning_rate': 0.24597815095684558, 'iterations': 2732, 'l2_leaf_reg': 0.0012574231434384334, 'border_count': 173, 'bagging_temperature': 0.6277492371341964, 'random_strength': 7.092824440033764, 'grow_policy': 'Depthwise', 'min_data_in_leaf': 425}. Best is trial 14 with value: 1609.1448261457704.[0m
[32m[I 2024-10-13 06:52:13,443][0m Trial 366 finished with value: 1686.678094520201 and parameters: {'depth': 8, 'learning_rate': 0.05917326476802301, 'iterations': 2694, 'l2_leaf_reg': 0.0018978920883023968, 'border_count': 76, 'bagging_temperature': 0.659678910866095, 'random_strength': 6.832006303533561, 'grow_policy': 'Lossguide', 'min_data_in_leaf': 446, 'max_leaves': 169}. Best is trial 14 with value: 1609.1448261457704.[0m
[32m[I 2024-10-13 06:52:16,015][0m Trial 367 finished with value: 1757.983695875779 and parameters: {'depth': 7, 'learning_rate': 0.03859107034518843, 'iterations': 2759, 'l2_leaf_reg': 0.0027331908971318297, 'border_count': 69, 'bagging_temperature': 0.643198881365903, 'random_strength': 7.268075264845099, 'grow_policy': 'Lossguide', 'min_data_in_leaf': 395, 'max_leaves': 172}. Best is trial 14 with value: 1609.1448261457704.[0m
[32m[I 2024-10-13 06:52:18,492][0m Trial 368 finished with value: 1968.4963695076983 and parameters: {'depth': 7, 'learning_rate': 0.030185880031659132, 'iterations': 2627, 'l2_leaf_reg': 0.004044321326154767, 'border_count': 56, 'bagging_temperature': 0.6681438010051121, 'random_strength': 7.688440052296967, 'grow_policy': 'Lossguide', 'min_data_in_leaf': 428, 'max_leaves': 162}. Best is trial 14 with value: 1609.1448261457704.[0m
[32m[I 2024-10-13 06:52:21,060][0m Trial 369 finished with value: 1670.4515050907328 and parameters: {'depth': 8, 'learning_rate': 0.04464556390617741, 'iterations': 2779, 'l2_leaf_reg': 0.0014120068288116727, 'border_count': 97, 'bagging_temperature': 0.43134645533998284, 'random_strength': 6.942759002764293, 'grow_policy': 'Lossguide', 'min_data_in_leaf': 454, 'max_leaves': 167}. Best is trial 14 with value: 1609.1448261457704.[0m
[32m[I 2024-10-13 06:52:23,626][0m Trial 370 finished with value: 1633.5473771874015 and parameters: {'depth': 8, 'learning_rate': 0.033085264714654776, 'iterations': 2654, 'l2_leaf_reg': 0.0007872470132860917, 'border_count': 77, 'bagging_temperature': 0.619368940751516, 'random_strength': 6.711310333679559, 'grow_policy': 'Lossguide', 'min_data_in_leaf': 409, 'max_leaves': 157}. Best is trial 14 with value: 1609.1448261457704.[0m
[32m[I 2024-10-13 06:52:26,143][0m Trial 371 finished with value: 3527.558032809225 and parameters: {'depth': 8, 'learning_rate': 0.0007779256323942052, 'iterations': 2649, 'l2_leaf_reg': 0.0011422833761490683, 'border_count': 62, 'bagging_temperature': 0.6105074332040912, 'random_strength': 6.79457034054142, 'grow_policy': 'Lossguide', 'min_data_in_leaf': 411, 'max_leaves': 151}. Best is trial 14 with value: 1609.1448261457704.[0m
[32m[I 2024-10-13 06:52:31,536][0m Trial 372 finished with value: 1855.9837568616117 and parameters: {'depth': 7, 'learning_rate': 0.11648349351266642, 'iterations': 784, 'l2_leaf_reg': 0.0007216641739273502, 'border_count': 73, 'bagging_temperature': 0.6173256004926326, 'random_strength': 6.352937866541309, 'grow_policy': 'SymmetricTree', 'min_data_in_leaf': 383}. Best is trial 14 with value: 1609.1448261457704.[0m
[32m[I 2024-10-13 06:52:34,055][0m Trial 373 finished with value: 1935.557774979706 and parameters: {'depth': 8, 'learning_rate': 0.20486698369466022, 'iterations': 2695, 'l2_leaf_reg': 0.0003379908322921169, 'border_count': 67, 'bagging_temperature': 0.6296881392449802, 'random_strength': 6.62409266921611, 'grow_policy': 'Lossguide', 'min_data_in_leaf': 433, 'max_leaves': 158}. Best is trial 14 with value: 1609.1448261457704.[0m
[32m[I 2024-10-13 06:52:36,713][0m Trial 374 finished with value: 1673.2153432319024 and parameters: {'depth': 8, 'learning_rate': 0.03854601270055655, 'iterations': 2831, 'l2_leaf_reg': 0.0004643534679666388, 'border_count': 79, 'bagging_temperature': 0.5908094960462635, 'random_strength': 7.140499618721677, 'grow_policy': 'Lossguide', 'min_data_in_leaf': 401, 'max_leaves': 165}. Best is trial 14 with value: 1609.1448261457704.[0m
[32m[I 2024-10-13 06:52:39,288][0m Trial 375 finished with value: 1679.150584074082 and parameters: {'depth': 8, 'learning_rate': 0.027233653607248543, 'iterations': 2608, 'l2_leaf_reg': 0.0016704268725944115, 'border_count': 76, 'bagging_temperature': 0.6470745225895015, 'random_strength': 6.68879729771966, 'grow_policy': 'Lossguide', 'min_data_in_leaf': 366, 'max_leaves': 156}. Best is trial 14 with value: 1609.1448261457704.[0m
[32m[I 2024-10-13 06:52:41,901][0m Trial 376 finished with value: 1950.9113872597102 and parameters: {'depth': 8, 'learning_rate': 0.04960243272318952, 'iterations': 2749, 'l2_leaf_reg': 0.0009161566576631204, 'border_count': 47, 'bagging_temperature': 0.6286430331196917, 'random_strength': 6.999824206711418, 'grow_policy': 'Lossguide', 'min_data_in_leaf': 467, 'max_leaves': 171}. Best is trial 14 with value: 1609.1448261457704.[0m
[32m[I 2024-10-13 06:52:44,399][0m Trial 377 finished with value: 1763.9682991652878 and parameters: {'depth': 8, 'learning_rate': 0.03202049447858463, 'iterations': 2667, 'l2_leaf_reg': 0.002407981571501033, 'border_count': 71, 'bagging_temperature': 0.6595748060322933, 'random_strength': 7.5072001979873395, 'grow_policy': 'Lossguide', 'min_data_in_leaf': 437, 'max_leaves': 161}. Best is trial 14 with value: 1609.1448261457704.[0m
[32m[I 2024-10-13 06:52:46,875][0m Trial 378 finished with value: 1660.3327182233647 and parameters: {'depth': 8, 'learning_rate': 0.041278429664302736, 'iterations': 2555, 'l2_leaf_reg': 0.001453297410196237, 'border_count': 78, 'bagging_temperature': 0.6095140916159375, 'random_strength': 7.195512412459727, 'grow_policy': 'Lossguide', 'min_data_in_leaf': 416, 'max_leaves': 175}. Best is trial 14 with value: 1609.1448261457704.[0m
[32m[I 2024-10-13 06:52:49,526][0m Trial 379 finished with value: 1659.9180337627686 and parameters: {'depth': 8, 'learning_rate': 0.028584894437564564, 'iterations': 2810, 'l2_leaf_reg': 0.000789360287984186, 'border_count': 86, 'bagging_temperature': 0.6471166008451504, 'random_strength': 7.3961869087284375, 'grow_policy': 'Lossguide', 'min_data_in_leaf': 397, 'max_leaves': 109}. Best is trial 14 with value: 1609.1448261457704.[0m
[32m[I 2024-10-13 06:52:51,996][0m Trial 380 finished with value: 1680.4665331384354 and parameters: {'depth': 9, 'learning_rate': 0.08673955389843581, 'iterations': 2599, 'l2_leaf_reg': 0.002602318242052699, 'border_count': 81, 'bagging_temperature': 0.6694077834856457, 'random_strength': 6.486076319503471, 'grow_policy': 'Lossguide', 'min_data_in_leaf': 380, 'max_leaves': 114}. Best is trial 14 with value: 1609.1448261457704.[0m
[32m[I 2024-10-13 06:52:54,602][0m Trial 381 finished with value: 1689.6380316622162 and parameters: {'depth': 4, 'learning_rate': 0.035926783993547144, 'iterations': 2767, 'l2_leaf_reg': 0.0037784189088158246, 'border_count': 92, 'bagging_temperature': 0.6308725178491493, 'random_strength': 6.738004057210356, 'grow_policy': 'Lossguide', 'min_data_in_leaf': 313, 'max_leaves': 156}. Best is trial 14 with value: 1609.1448261457704.[0m
[32m[I 2024-10-13 06:52:57,152][0m Trial 382 finished with value: 1666.6945506689283 and parameters: {'depth': 3, 'learning_rate': 0.025234449844652545, 'iterations': 2673, 'l2_leaf_reg': 0.0015577761268945937, 'border_count': 133, 'bagging_temperature': 0.5973048976964765, 'random_strength': 6.984770487603565, 'grow_policy': 'Lossguide', 'min_data_in_leaf': 455, 'max_leaves': 148}. Best is trial 14 with value: 1609.1448261457704.[0m
[32m[I 2024-10-13 06:52:59,728][0m Trial 383 finished with value: 1651.5048941281443 and parameters: {'depth': 7, 'learning_rate': 0.03391236143226517, 'iterations': 2712, 'l2_leaf_reg': 0.0021990282755062736, 'border_count': 76, 'bagging_temperature': 0.6504674194622164, 'random_strength': 7.888955235921696, 'grow_policy': 'Lossguide', 'min_data_in_leaf': 411, 'max_leaves': 167}. Best is trial 14 with value: 1609.1448261457704.[0m
[32m[I 2024-10-13 06:53:17,657][0m Trial 384 finished with value: 1950.4477393799125 and parameters: {'depth': 7, 'learning_rate': 0.29875343383321823, 'iterations': 2854, 'l2_leaf_reg': 0.004962234486504497, 'border_count': 83, 'bagging_temperature': 0.676534509908234, 'random_strength': 7.150031418021712, 'grow_policy': 'SymmetricTree', 'min_data_in_leaf': 439}. Best is trial 14 with value: 1609.1448261457704.[0m
[32m[I 2024-10-13 06:53:20,079][0m Trial 385 finished with value: 1768.6958807725525 and parameters: {'depth': 9, 'learning_rate': 0.2458135784036216, 'iterations': 2591, 'l2_leaf_reg': 0.0032548713823031604, 'border_count': 89, 'bagging_temperature': 0.620619127740196, 'random_strength': 7.278243860088342, 'grow_policy': 'Lossguide', 'min_data_in_leaf': 345, 'max_leaves': 174}. Best is trial 14 with value: 1609.1448261457704.[0m
[32m[I 2024-10-13 06:53:22,481][0m Trial 386 finished with value: 1693.7347695146786 and parameters: {'depth': 9, 'learning_rate': 0.04446849985387943, 'iterations': 2526, 'l2_leaf_reg': 0.00594033310725988, 'border_count': 165, 'bagging_temperature': 0.6417944267703353, 'random_strength': 6.800236649023377, 'grow_policy': 'Lossguide', 'min_data_in_leaf': 372, 'max_leaves': 162}. Best is trial 14 with value: 1609.1448261457704.[0m
[32m[I 2024-10-13 06:53:25,200][0m Trial 387 finished with value: 1858.1069553223417 and parameters: {'depth': 3, 'learning_rate': 0.15332292524203203, 'iterations': 2957, 'l2_leaf_reg': 5.748401610761245e-06, 'border_count': 71, 'bagging_temperature': 0.5840988768191374, 'random_strength': 6.983330067990313, 'grow_policy': 'Lossguide', 'min_data_in_leaf': 419, 'max_leaves': 171}. Best is trial 14 with value: 1609.1448261457704.[0m
[32m[I 2024-10-13 06:53:27,683][0m Trial 388 finished with value: 1895.467146917612 and parameters: {'depth': 8, 'learning_rate': 0.02734434870447265, 'iterations': 2638, 'l2_leaf_reg': 0.0009517859831233086, 'border_count': 62, 'bagging_temperature': 0.6797909438298078, 'random_strength': 6.167129163611685, 'grow_policy': 'Depthwise', 'min_data_in_leaf': 395}. Best is trial 14 with value: 1609.1448261457704.[0m
[32m[I 2024-10-13 06:53:30,387][0m Trial 389 finished with value: 1693.2565673708975 and parameters: {'depth': 4, 'learning_rate': 0.0561015407790309, 'iterations': 2889, 'l2_leaf_reg': 0.002472174362594783, 'border_count': 83, 'bagging_temperature': 0.6110802878924264, 'random_strength': 7.5732447038109605, 'grow_policy': 'Lossguide', 'min_data_in_leaf': 427, 'max_leaves': 152}. Best is trial 14 with value: 1609.1448261457704.[0m
[32m[I 2024-10-13 06:53:31,666][0m Trial 390 finished with value: 1956.036752409171 and parameters: {'depth': 9, 'learning_rate': 0.015002351221134682, 'iterations': 977, 'l2_leaf_reg': 0.004861408924289158, 'border_count': 22, 'bagging_temperature': 0.6622421769151764, 'random_strength': 4.791360994286378, 'grow_policy': 'Lossguide', 'min_data_in_leaf': 467, 'max_leaves': 178}. Best is trial 14 with value: 1609.1448261457704.[0m
[32m[I 2024-10-13 06:53:34,286][0m Trial 391 finished with value: 1668.518207755579 and parameters: {'depth': 8, 'learning_rate': 0.022582571869934374, 'iterations': 2763, 'l2_leaf_reg': 5.840592966402196e-07, 'border_count': 95, 'bagging_temperature': 0.6956509385490788, 'random_strength': 7.3525454824706715, 'grow_policy': 'Lossguide', 'min_data_in_leaf': 656, 'max_leaves': 158}. Best is trial 14 with value: 1609.1448261457704.[0m
[32m[I 2024-10-13 06:53:36,827][0m Trial 392 finished with value: 1697.2307599598755 and parameters: {'depth': 7, 'learning_rate': 0.038574284352381256, 'iterations': 2699, 'l2_leaf_reg': 0.13070205616905345, 'border_count': 196, 'bagging_temperature': 0.6375510917814657, 'random_strength': 4.210633936242686, 'grow_policy': 'Lossguide', 'min_data_in_leaf': 390, 'max_leaves': 165}. Best is trial 14 with value: 1609.1448261457704.[0m
[32m[I 2024-10-13 06:53:39,446][0m Trial 393 finished with value: 1636.5476104317725 and parameters: {'depth': 3, 'learning_rate': 0.033219352489424564, 'iterations': 2840, 'l2_leaf_reg': 0.0004827105973241129, 'border_count': 77, 'bagging_temperature': 0.6652944313251188, 'random_strength': 6.964928411422912, 'grow_policy': 'Lossguide', 'min_data_in_leaf': 362, 'max_leaves': 180}. Best is trial 14 with value: 1609.1448261457704.[0m
[32m[I 2024-10-13 06:53:42,094][0m Trial 394 finished with value: 1678.431067926722 and parameters: {'depth': 3, 'learning_rate': 0.029998821353382363, 'iterations': 2822, 'l2_leaf_reg': 0.000628006864669737, 'border_count': 239, 'bagging_temperature': 0.6794654539000323, 'random_strength': 6.554150958648696, 'grow_policy': 'Lossguide', 'min_data_in_leaf': 345, 'max_leaves': 145}. Best is trial 14 with value: 1609.1448261457704.[0m
[32m[I 2024-10-13 06:53:44,925][0m Trial 395 finished with value: 1635.0952507614509 and parameters: {'depth': 3, 'learning_rate': 0.02001955818249762, 'iterations': 2983, 'l2_leaf_reg': 0.00046257169045864425, 'border_count': 89, 'bagging_temperature': 0.7157736464902393, 'random_strength': 5.3356446126451536, 'grow_policy': 'Lossguide', 'min_data_in_leaf': 357, 'max_leaves': 55}. Best is trial 14 with value: 1609.1448261457704.[0m
[32m[I 2024-10-13 06:53:47,657][0m Trial 396 finished with value: 1669.7976053625707 and parameters: {'depth': 3, 'learning_rate': 0.02082359932923197, 'iterations': 2996, 'l2_leaf_reg': 0.00038919030691113077, 'border_count': 100, 'bagging_temperature': 0.7468896294117902, 'random_strength': 5.298348060005981, 'grow_policy': 'Lossguide', 'min_data_in_leaf': 363, 'max_leaves': 58}. Best is trial 14 with value: 1609.1448261457704.[0m
[32m[I 2024-10-13 06:53:50,349][0m Trial 397 finished with value: 1750.9980825303228 and parameters: {'depth': 3, 'learning_rate': 0.20844731788713747, 'iterations': 2892, 'l2_leaf_reg': 0.00027677897711438006, 'border_count': 91, 'bagging_temperature': 0.7278157666780934, 'random_strength': 5.544638369404509, 'grow_policy': 'Lossguide', 'min_data_in_leaf': 319, 'max_leaves': 53}. Best is trial 14 with value: 1609.1448261457704.[0m
[32m[I 2024-10-13 06:54:00,019][0m Trial 398 finished with value: 1800.5533761819358 and parameters: {'depth': 3, 'learning_rate': 0.04071995042792392, 'iterations': 2975, 'l2_leaf_reg': 0.00021381383768510204, 'border_count': 202, 'bagging_temperature': 0.7084540360971718, 'random_strength': 6.018763248998354, 'grow_policy': 'SymmetricTree', 'min_data_in_leaf': 342}. Best is trial 14 with value: 1609.1448261457704.[0m
[32m[I 2024-10-13 06:54:02,778][0m Trial 399 finished with value: 1644.081186824063 and parameters: {'depth': 3, 'learning_rate': 0.03063042162668117, 'iterations': 2935, 'l2_leaf_reg': 0.0005549682628934903, 'border_count': 88, 'bagging_temperature': 0.7164596760494051, 'random_strength': 6.841031134175756, 'grow_policy': 'Lossguide', 'min_data_in_leaf': 358, 'max_leaves': 171}. Best is trial 14 with value: 1609.1448261457704.[0m
[32m[I 2024-10-13 06:54:05,368][0m Trial 400 finished with value: 1685.5149332014814 and parameters: {'depth': 3, 'learning_rate': 0.02632592953949738, 'iterations': 2888, 'l2_leaf_reg': 0.0004703147802900627, 'border_count': 95, 'bagging_temperature': 0.7560808276884585, 'random_strength': 6.422521200126537, 'grow_policy': 'Lossguide', 'min_data_in_leaf': 293, 'max_leaves': 171}. Best is trial 14 with value: 1609.1448261457704.[0m
