[32m[I 2024-10-13 07:07:51,409][0m Trial 601 finished with value: 1678.375995828861 and parameters: {'depth': 3, 'learning_rate': 0.04464472315558172, 'iterations': 2956, 'l2_leaf_reg': 0.0009046091487648878, 'border_count': 97, 'bagging_temperature': 0.6990923625106497, 'random_strength': 6.016017970186489, 'grow_policy': 'Lossguide', 'min_data_in_leaf': 358, 'max_leaves': 229}. Best is trial 14 with value: 1609.1448261457704.[0m
[32m[I 2024-10-13 07:07:54,109][0m Trial 602 finished with value: 1777.1843296504396 and parameters: {'depth': 3, 'learning_rate': 0.20969562343050502, 'iterations': 2999, 'l2_leaf_reg': 0.0019123385661670184, 'border_count': 92, 'bagging_temperature': 0.6848110448211799, 'random_strength': 5.5854236848125485, 'grow_policy': 'Lossguide', 'min_data_in_leaf': 327, 'max_leaves': 244}. Best is trial 14 with value: 1609.1448261457704.[0m
[32m[I 2024-10-13 07:07:56,771][0m Trial 603 finished with value: 1650.3113792750955 and parameters: {'depth': 3, 'learning_rate': 0.037927004332157885, 'iterations': 2908, 'l2_leaf_reg': 0.0025594397449517693, 'border_count': 97, 'bagging_temperature': 0.7434471819026303, 'random_strength': 5.824877632980106, 'grow_policy': 'Lossguide', 'min_data_in_leaf': 364, 'max_leaves': 134}. Best is trial 14 with value: 1609.1448261457704.[0m
[32m[I 2024-10-13 07:07:59,477][0m Trial 604 finished with value: 1648.1439741875824 and parameters: {'depth': 3, 'learning_rate': 0.018756866852563395, 'iterations': 2998, 'l2_leaf_reg': 0.0005811287672272269, 'border_count': 90, 'bagging_temperature': 0.7028940036452666, 'random_strength': 6.176517032055022, 'grow_policy': 'Lossguide', 'min_data_in_leaf': 376, 'max_leaves': 242}. Best is trial 14 with value: 1609.1448261457704.[0m
[32m[I 2024-10-13 07:08:08,789][0m Trial 605 finished with value: 1771.1957124399833 and parameters: {'depth': 3, 'learning_rate': 0.028775281330230325, 'iterations': 2886, 'l2_leaf_reg': 0.0014523124094458046, 'border_count': 105, 'bagging_temperature': 0.7647168185922953, 'random_strength': 5.970858875015156, 'grow_policy': 'SymmetricTree', 'min_data_in_leaf': 356}. Best is trial 14 with value: 1609.1448261457704.[0m
[32m[I 2024-10-13 07:08:11,411][0m Trial 606 finished with value: 5634.289993755074 and parameters: {'depth': 3, 'learning_rate': 0.0001867499299842476, 'iterations': 3000, 'l2_leaf_reg': 0.0027669065467576318, 'border_count': 89, 'bagging_temperature': 0.7277463760422594, 'random_strength': 5.522035818267182, 'grow_policy': 'Lossguide', 'min_data_in_leaf': 374, 'max_leaves': 220}. Best is trial 14 with value: 1609.1448261457704.[0m
[32m[I 2024-10-13 07:08:14,038][0m Trial 607 finished with value: 1680.7277865932742 and parameters: {'depth': 3, 'learning_rate': 0.03382741087120256, 'iterations': 2869, 'l2_leaf_reg': 0.4843425093845878, 'border_count': 102, 'bagging_temperature': 0.6559378134389559, 'random_strength': 6.190610774941126, 'grow_policy': 'Lossguide', 'min_data_in_leaf': 342, 'max_leaves': 225}. Best is trial 14 with value: 1609.1448261457704.[0m
[32m[I 2024-10-13 07:08:16,712][0m Trial 608 finished with value: 1696.920536187257 and parameters: {'depth': 3, 'learning_rate': 0.023843540021774842, 'iterations': 2924, 'l2_leaf_reg': 2.1444654098790927, 'border_count': 92, 'bagging_temperature': 0.6807746124364152, 'random_strength': 5.869358468860474, 'grow_policy': 'Lossguide', 'min_data_in_leaf': 298, 'max_leaves': 158}. Best is trial 14 with value: 1609.1448261457704.[0m
[32m[I 2024-10-13 07:08:17,817][0m Trial 609 finished with value: 1674.6229159123973 and parameters: {'depth': 3, 'learning_rate': 0.07898237821570443, 'iterations': 676, 'l2_leaf_reg': 0.00022057845176113856, 'border_count': 87, 'bagging_temperature': 0.7140836886060188, 'random_strength': 5.646990077125775, 'grow_policy': 'Lossguide', 'min_data_in_leaf': 321, 'max_leaves': 201}. Best is trial 14 with value: 1609.1448261457704.[0m
[32m[I 2024-10-13 07:08:20,389][0m Trial 610 finished with value: 1715.6873160862708 and parameters: {'depth': 3, 'learning_rate': 0.04022136652413255, 'iterations': 2813, 'l2_leaf_reg': 0.0007445665673576637, 'border_count': 94, 'bagging_temperature': 0.6545056447797114, 'random_strength': 6.235195512733025, 'grow_policy': 'Lossguide', 'min_data_in_leaf': 889, 'max_leaves': 250}. Best is trial 14 with value: 1609.1448261457704.[0m
[32m[I 2024-10-13 07:08:23,074][0m Trial 611 finished with value: 1680.8086132416106 and parameters: {'depth': 3, 'learning_rate': 0.027354768130699203, 'iterations': 2940, 'l2_leaf_reg': 0.001555048615627012, 'border_count': 85, 'bagging_temperature': 0.6918518108839544, 'random_strength': 6.3600066814335685, 'grow_policy': 'Lossguide', 'min_data_in_leaf': 387, 'max_leaves': 238}. Best is trial 14 with value: 1609.1448261457704.[0m
[32m[I 2024-10-13 07:08:25,721][0m Trial 612 finished with value: 1686.5509841512187 and parameters: {'depth': 6, 'learning_rate': 0.0541257099740328, 'iterations': 2865, 'l2_leaf_reg': 0.0003553303543273906, 'border_count': 96, 'bagging_temperature': 0.667742267990634, 'random_strength': 5.939086298387905, 'grow_policy': 'Lossguide', 'min_data_in_leaf': 919, 'max_leaves': 162}. Best is trial 14 with value: 1609.1448261457704.[0m
[32m[I 2024-10-13 07:08:28,323][0m Trial 613 finished with value: 1679.480668672385 and parameters: {'depth': 3, 'learning_rate': 0.015133677592686214, 'iterations': 2836, 'l2_leaf_reg': 3.137367073719867e-05, 'border_count': 89, 'bagging_temperature': 0.7109731597208104, 'random_strength': 6.096730921544459, 'grow_policy': 'Lossguide', 'min_data_in_leaf': 999, 'max_leaves': 171}. Best is trial 14 with value: 1609.1448261457704.[0m
[32m[I 2024-10-13 07:08:31,068][0m Trial 614 finished with value: 1657.1155900905405 and parameters: {'depth': 3, 'learning_rate': 0.0317891722385706, 'iterations': 2913, 'l2_leaf_reg': 0.0010308147881904327, 'border_count': 84, 'bagging_temperature': 0.6769484563674482, 'random_strength': 5.714263292817221, 'grow_policy': 'Lossguide', 'min_data_in_leaf': 351, 'max_leaves': 253}. Best is trial 14 with value: 1609.1448261457704.[0m
[32m[I 2024-10-13 07:08:33,632][0m Trial 615 finished with value: 2063.8738684393147 and parameters: {'depth': 3, 'learning_rate': 0.0027989313383504086, 'iterations': 2788, 'l2_leaf_reg': 0.0005724579500153339, 'border_count': 97, 'bagging_temperature': 0.6474145901872338, 'random_strength': 5.328172078732503, 'grow_policy': 'Lossguide', 'min_data_in_leaf': 158, 'max_leaves': 179}. Best is trial 14 with value: 1609.1448261457704.[0m
[32m[I 2024-10-13 07:08:36,377][0m Trial 616 finished with value: 1673.5967052983074 and parameters: {'depth': 3, 'learning_rate': 0.02252855476022979, 'iterations': 2932, 'l2_leaf_reg': 0.00011789350235809671, 'border_count': 89, 'bagging_temperature': 0.35702794566448326, 'random_strength': 6.288927642702262, 'grow_policy': 'Depthwise', 'min_data_in_leaf': 407}. Best is trial 14 with value: 1609.1448261457704.[0m
[32m[I 2024-10-13 07:08:39,088][0m Trial 617 finished with value: 1673.5554765560128 and parameters: {'depth': 8, 'learning_rate': 0.04291403992298467, 'iterations': 2849, 'l2_leaf_reg': 7.59378036247929e-05, 'border_count': 102, 'bagging_temperature': 0.7354683949235212, 'random_strength': 6.460617436280638, 'grow_policy': 'Lossguide', 'min_data_in_leaf': 273, 'max_leaves': 138}. Best is trial 14 with value: 1609.1448261457704.[0m
[32m[I 2024-10-13 07:08:40,662][0m Trial 618 finished with value: 1662.5307944538729 and parameters: {'depth': 3, 'learning_rate': 0.03608822738481664, 'iterations': 1371, 'l2_leaf_reg': 0.002868937309815998, 'border_count': 83, 'bagging_temperature': 0.6954456519637296, 'random_strength': 5.436029094004626, 'grow_policy': 'Lossguide', 'min_data_in_leaf': 375, 'max_leaves': 107}. Best is trial 14 with value: 1609.1448261457704.[0m
[32m[I 2024-10-13 07:09:09,667][0m Trial 619 finished with value: 1878.117670194277 and parameters: {'depth': 8, 'learning_rate': 0.02688319194449788, 'iterations': 2742, 'l2_leaf_reg': 1.1448612022773614, 'border_count': 93, 'bagging_temperature': 0.6331977594964365, 'random_strength': 6.042241921118893, 'grow_policy': 'SymmetricTree', 'min_data_in_leaf': 494}. Best is trial 14 with value: 1609.1448261457704.[0m
[32m[I 2024-10-13 07:09:12,307][0m Trial 620 finished with value: 1658.9336934724868 and parameters: {'depth': 3, 'learning_rate': 0.031038116282620255, 'iterations': 2943, 'l2_leaf_reg': 4.8948514310536115, 'border_count': 86, 'bagging_temperature': 0.6791176802750968, 'random_strength': 5.767910092251909, 'grow_policy': 'Lossguide', 'min_data_in_leaf': 442, 'max_leaves': 219}. Best is trial 14 with value: 1609.1448261457704.[0m
[32m[I 2024-10-13 07:09:14,947][0m Trial 621 finished with value: 1705.0166237917022 and parameters: {'depth': 3, 'learning_rate': 0.047013690749367065, 'iterations': 2805, 'l2_leaf_reg': 0.00044410773704258485, 'border_count': 81, 'bagging_temperature': 0.6583660260320752, 'random_strength': 6.371558791694255, 'grow_policy': 'Lossguide', 'min_data_in_leaf': 389, 'max_leaves': 164}. Best is trial 14 with value: 1609.1448261457704.[0m
[32m[I 2024-10-13 07:09:17,596][0m Trial 622 finished with value: 1673.8845202334462 and parameters: {'depth': 9, 'learning_rate': 0.038992297447143, 'iterations': 2852, 'l2_leaf_reg': 0.6073143764468248, 'border_count': 89, 'bagging_temperature': 0.7104926847060024, 'random_strength': 6.55423867130713, 'grow_policy': 'Lossguide', 'min_data_in_leaf': 337, 'max_leaves': 155}. Best is trial 14 with value: 1609.1448261457704.[0m
[32m[I 2024-10-13 07:09:18,311][0m Trial 623 finished with value: 2551.1482688862325 and parameters: {'depth': 3, 'learning_rate': 0.02102179922689582, 'iterations': 209, 'l2_leaf_reg': 0.1805268474001038, 'border_count': 94, 'bagging_temperature': 0.6891592626288805, 'random_strength': 6.198298339201927, 'grow_policy': 'Lossguide', 'min_data_in_leaf': 852, 'max_leaves': 175}. Best is trial 14 with value: 1609.1448261457704.[0m
[32m[I 2024-10-13 07:09:19,455][0m Trial 624 finished with value: 1678.9815843312729 and parameters: {'depth': 8, 'learning_rate': 0.1322517014916893, 'iterations': 780, 'l2_leaf_reg': 0.3205733197097288, 'border_count': 83, 'bagging_temperature': 0.6563932304712403, 'random_strength': 5.582069801414106, 'grow_policy': 'Lossguide', 'min_data_in_leaf': 465, 'max_leaves': 142}. Best is trial 14 with value: 1609.1448261457704.[0m
[32m[I 2024-10-13 07:09:22,120][0m Trial 625 finished with value: 1682.545720751044 and parameters: {'depth': 9, 'learning_rate': 0.03431045170254022, 'iterations': 2902, 'l2_leaf_reg': 0.001720197033103758, 'border_count': 107, 'bagging_temperature': 0.7251628101372605, 'random_strength': 5.82018716994903, 'grow_policy': 'Lossguide', 'min_data_in_leaf': 365, 'max_leaves': 205}. Best is trial 14 with value: 1609.1448261457704.[0m
[32m[I 2024-10-13 07:09:24,677][0m Trial 626 finished with value: 1669.863301976078 and parameters: {'depth': 7, 'learning_rate': 0.1675946356730482, 'iterations': 2695, 'l2_leaf_reg': 0.0068036700249277, 'border_count': 76, 'bagging_temperature': 0.43520054460564667, 'random_strength': 5.156643757326544, 'grow_policy': 'Lossguide', 'min_data_in_leaf': 416, 'max_leaves': 168}. Best is trial 14 with value: 1609.1448261457704.[0m
[32m[I 2024-10-13 07:09:27,403][0m Trial 627 finished with value: 1670.711866455928 and parameters: {'depth': 3, 'learning_rate': 0.025068584663887398, 'iterations': 2954, 'l2_leaf_reg': 0.0002996301886150512, 'border_count': 88, 'bagging_temperature': 0.7608194110919219, 'random_strength': 6.575967374479203, 'grow_policy': 'Lossguide', 'min_data_in_leaf': 442, 'max_leaves': 183}. Best is trial 14 with value: 1609.1448261457704.[0m
[32m[I 2024-10-13 07:09:30,037][0m Trial 628 finished with value: 1679.861067721285 and parameters: {'depth': 9, 'learning_rate': 0.06671481868622005, 'iterations': 2754, 'l2_leaf_reg': 0.0006685436616944504, 'border_count': 99, 'bagging_temperature': 0.6346826496705247, 'random_strength': 5.417518952867979, 'grow_policy': 'Lossguide', 'min_data_in_leaf': 960, 'max_leaves': 159}. Best is trial 14 with value: 1609.1448261457704.[0m
[32m[I 2024-10-13 07:09:32,835][0m Trial 629 finished with value: 1642.9649887378184 and parameters: {'depth': 4, 'learning_rate': 0.029680006148099052, 'iterations': 2999, 'l2_leaf_reg': 0.0011772120857400051, 'border_count': 80, 'bagging_temperature': 0.6755903711093996, 'random_strength': 5.957965793373482, 'grow_policy': 'Lossguide', 'min_data_in_leaf': 324, 'max_leaves': 173}. Best is trial 14 with value: 1609.1448261457704.[0m
[32m[I 2024-10-13 07:09:42,107][0m Trial 630 finished with value: 1856.257009136499 and parameters: {'depth': 3, 'learning_rate': 0.044087546823424105, 'iterations': 2867, 'l2_leaf_reg': 0.002884658266307492, 'border_count': 85, 'bagging_temperature': 0.7014035010600416, 'random_strength': 6.299663377834829, 'grow_policy': 'SymmetricTree', 'min_data_in_leaf': 402}. Best is trial 14 with value: 1609.1448261457704.[0m
[32m[I 2024-10-13 07:09:44,681][0m Trial 631 finished with value: 1857.5606148659376 and parameters: {'depth': 9, 'learning_rate': 0.017648378103265354, 'iterations': 2798, 'l2_leaf_reg': 6.109185181763551e-06, 'border_count': 8, 'bagging_temperature': 0.6686001817797474, 'random_strength': 6.90465244020938, 'grow_policy': 'Lossguide', 'min_data_in_leaf': 346, 'max_leaves': 146}. Best is trial 14 with value: 1609.1448261457704.[0m
[32m[I 2024-10-13 07:09:47,365][0m Trial 632 finished with value: 1660.3336097613628 and parameters: {'depth': 8, 'learning_rate': 0.03471426068504343, 'iterations': 2891, 'l2_leaf_reg': 0.00018635065568438532, 'border_count': 92, 'bagging_temperature': 0.6436246442185317, 'random_strength': 6.682505031658996, 'grow_policy': 'Lossguide', 'min_data_in_leaf': 380, 'max_leaves': 153}. Best is trial 14 with value: 1609.1448261457704.[0m
[32m[I 2024-10-13 07:09:49,865][0m Trial 633 finished with value: 1765.823776482646 and parameters: {'depth': 6, 'learning_rate': 0.05392100149886669, 'iterations': 2716, 'l2_leaf_reg': 0.004329578421001674, 'border_count': 72, 'bagging_temperature': 0.6928102968800303, 'random_strength': 6.4264671493043855, 'grow_policy': 'Lossguide', 'min_data_in_leaf': 409, 'max_leaves': 212}. Best is trial 14 with value: 1609.1448261457704.[0m
[32m[I 2024-10-13 07:09:52,617][0m Trial 634 finished with value: 1694.3887269447466 and parameters: {'depth': 3, 'learning_rate': 0.0132988360671643, 'iterations': 2946, 'l2_leaf_reg': 0.0008846621819715714, 'border_count': 83, 'bagging_temperature': 0.5010719229620748, 'random_strength': 6.100944537736104, 'grow_policy': 'Lossguide', 'min_data_in_leaf': 834, 'max_leaves': 116}. Best is trial 14 with value: 1609.1448261457704.[0m
[32m[I 2024-10-13 07:09:55,299][0m Trial 635 finished with value: 1687.3488992505768 and parameters: {'depth': 10, 'learning_rate': 0.026957818172303905, 'iterations': 2812, 'l2_leaf_reg': 3.4540678936062037e-06, 'border_count': 88, 'bagging_temperature': 0.7232505316791564, 'random_strength': 5.274498115966303, 'grow_policy': 'Lossguide', 'min_data_in_leaf': 432, 'max_leaves': 123}. Best is trial 14 with value: 1609.1448261457704.[0m
[32m[I 2024-10-13 07:09:57,776][0m Trial 636 finished with value: 2640.9631381743943 and parameters: {'depth': 3, 'learning_rate': 0.001529127005923133, 'iterations': 2675, 'l2_leaf_reg': 0.0020075778505033986, 'border_count': 96, 'bagging_temperature': 0.7460427743397048, 'random_strength': 6.925542193607227, 'grow_policy': 'Lossguide', 'min_data_in_leaf': 211, 'max_leaves': 179}. Best is trial 14 with value: 1609.1448261457704.[0m
[32m[I 2024-10-13 07:10:00,587][0m Trial 637 finished with value: 1650.8314618818981 and parameters: {'depth': 9, 'learning_rate': 0.04009783618645818, 'iterations': 2996, 'l2_leaf_reg': 1.4862587642270381e-05, 'border_count': 77, 'bagging_temperature': 0.6287869187821953, 'random_strength': 5.718815780664106, 'grow_policy': 'Lossguide', 'min_data_in_leaf': 367, 'max_leaves': 164}. Best is trial 14 with value: 1609.1448261457704.[0m
[32m[I 2024-10-13 07:10:03,144][0m Trial 638 finished with value: 1784.4886995190038 and parameters: {'depth': 7, 'learning_rate': 0.023708642979981678, 'iterations': 2748, 'l2_leaf_reg': 0.0003919602407332305, 'border_count': 67, 'bagging_temperature': 0.6650168075043904, 'random_strength': 7.353357310895912, 'grow_policy': 'Lossguide', 'min_data_in_leaf': 291, 'max_leaves': 150}. Best is trial 14 with value: 1609.1448261457704.[0m
[32m[I 2024-10-13 07:10:05,754][0m Trial 639 finished with value: 1659.8864879478783 and parameters: {'depth': 3, 'learning_rate': 0.03179510362360011, 'iterations': 2874, 'l2_leaf_reg': 0.00776886150173216, 'border_count': 82, 'bagging_temperature': 0.290462604146732, 'random_strength': 6.727774653338126, 'grow_policy': 'Lossguide', 'min_data_in_leaf': 817, 'max_leaves': 134}. Best is trial 14 with value: 1609.1448261457704.[0m
[32m[I 2024-10-13 07:10:08,273][0m Trial 640 finished with value: 1687.3619036031314 and parameters: {'depth': 9, 'learning_rate': 0.19901026364831778, 'iterations': 2598, 'l2_leaf_reg': 0.0004903551166814885, 'border_count': 90, 'bagging_temperature': 0.6880866296448653, 'random_strength': 2.041715374466172, 'grow_policy': 'Depthwise', 'min_data_in_leaf': 381}. Best is trial 14 with value: 1609.1448261457704.[0m
[32m[I 2024-10-13 07:10:10,869][0m Trial 641 finished with value: 1785.0746461273898 and parameters: {'depth': 8, 'learning_rate': 0.009063443365195501, 'iterations': 2817, 'l2_leaf_reg': 0.7632015205291793, 'border_count': 75, 'bagging_temperature': 0.7130690991548809, 'random_strength': 7.169595566486292, 'grow_policy': 'Lossguide', 'min_data_in_leaf': 472, 'max_leaves': 141}. Best is trial 14 with value: 1609.1448261457704.[0m
[32m[I 2024-10-13 07:10:20,253][0m Trial 642 finished with value: 2047.7248262107425 and parameters: {'depth': 3, 'learning_rate': 0.09573203060235969, 'iterations': 2908, 'l2_leaf_reg': 1.8704729534589304, 'border_count': 99, 'bagging_temperature': 0.1812968781088427, 'random_strength': 6.500917295974496, 'grow_policy': 'SymmetricTree', 'min_data_in_leaf': 877}. Best is trial 14 with value: 1609.1448261457704.[0m
[32m[I 2024-10-13 07:10:22,950][0m Trial 643 finished with value: 1664.2825512145923 and parameters: {'depth': 4, 'learning_rate': 0.020289638419072966, 'iterations': 2945, 'l2_leaf_reg': 0.0012452084317865657, 'border_count': 84, 'bagging_temperature': 0.7946743028820338, 'random_strength': 6.145973625015483, 'grow_policy': 'Lossguide', 'min_data_in_leaf': 318, 'max_leaves': 170}. Best is trial 14 with value: 1609.1448261457704.[0m
[32m[I 2024-10-13 07:10:25,558][0m Trial 644 finished with value: 1692.1864102889642 and parameters: {'depth': 10, 'learning_rate': 0.03790604911206595, 'iterations': 2775, 'l2_leaf_reg': 0.0002615788128303805, 'border_count': 94, 'bagging_temperature': 0.6167257692985788, 'random_strength': 5.976894172110022, 'grow_policy': 'Lossguide', 'min_data_in_leaf': 430, 'max_leaves': 160}. Best is trial 14 with value: 1609.1448261457704.[0m
[32m[I 2024-10-13 07:10:28,041][0m Trial 645 finished with value: 1679.6203722263865 and parameters: {'depth': 9, 'learning_rate': 0.02954829749140718, 'iterations': 2669, 'l2_leaf_reg': 0.0007403302044531235, 'border_count': 136, 'bagging_temperature': 0.6530122669082552, 'random_strength': 5.057263261277366, 'grow_policy': 'Lossguide', 'min_data_in_leaf': 390, 'max_leaves': 156}. Best is trial 14 with value: 1609.1448261457704.[0m
[32m[I 2024-10-13 07:10:30,701][0m Trial 646 finished with value: 1691.080522759367 and parameters: {'depth': 3, 'learning_rate': 0.04674821432266799, 'iterations': 2831, 'l2_leaf_reg': 0.22028413003518843, 'border_count': 79, 'bagging_temperature': 0.6786167447183858, 'random_strength': 5.517538769817839, 'grow_policy': 'Lossguide', 'min_data_in_leaf': 788, 'max_leaves': 149}. Best is trial 14 with value: 1609.1448261457704.[0m
[32m[I 2024-10-13 07:10:33,503][0m Trial 647 finished with value: 1641.192230070847 and parameters: {'depth': 8, 'learning_rate': 0.03603764310875124, 'iterations': 2997, 'l2_leaf_reg': 2.244294738406736e-06, 'border_count': 88, 'bagging_temperature': 0.6984393335836343, 'random_strength': 6.343291326934546, 'grow_policy': 'Lossguide', 'min_data_in_leaf': 350, 'max_leaves': 232}. Best is trial 14 with value: 1609.1448261457704.[0m
[32m[I 2024-10-13 07:10:36,245][0m Trial 648 finished with value: 1707.0694781217335 and parameters: {'depth': 8, 'learning_rate': 0.06184424443030068, 'iterations': 2957, 'l2_leaf_reg': 3.5670090341629406e-06, 'border_count': 92, 'bagging_temperature': 0.7352194370233844, 'random_strength': 6.363943902770677, 'grow_policy': 'Lossguide', 'min_data_in_leaf': 343, 'max_leaves': 227}. Best is trial 14 with value: 1609.1448261457704.[0m
[32m[I 2024-10-13 07:10:38,979][0m Trial 649 finished with value: 1681.4083748488238 and parameters: {'depth': 8, 'learning_rate': 0.04083924807209487, 'iterations': 2966, 'l2_leaf_reg': 0.000557462017740173, 'border_count': 104, 'bagging_temperature': 0.7136625051091748, 'random_strength': 6.332234953742965, 'grow_policy': 'Lossguide', 'min_data_in_leaf': 308, 'max_leaves': 237}. Best is trial 14 with value: 1609.1448261457704.[0m
[32m[I 2024-10-13 07:10:41,686][0m Trial 650 finished with value: 1655.2856351462003 and parameters: {'depth': 8, 'learning_rate': 0.03688709534745468, 'iterations': 2896, 'l2_leaf_reg': 3.0054775052080714e-06, 'border_count': 88, 'bagging_temperature': 0.6965429507604282, 'random_strength': 6.19395964641608, 'grow_policy': 'Lossguide', 'min_data_in_leaf': 352, 'max_leaves': 242}. Best is trial 14 with value: 1609.1448261457704.[0m
