[32m[I 2024-10-13 06:28:41,352][0m Trial 51 finished with value: 1745.481491247059 and parameters: {'depth': 4, 'learning_rate': 0.047419240825358165, 'iterations': 2077, 'l2_leaf_reg': 1.3243711176256798e-07, 'border_count': 140, 'bagging_temperature': 0.5347921874552937, 'random_strength': 9.80892319300701, 'grow_policy': 'Lossguide', 'min_data_in_leaf': 796, 'max_leaves': 90}. Best is trial 14 with value: 1609.1448261457704.[0m
[32m[I 2024-10-13 06:28:43,479][0m Trial 52 finished with value: 1717.1397236108728 and parameters: {'depth': 3, 'learning_rate': 0.04486202147605887, 'iterations': 2133, 'l2_leaf_reg': 9.510944462219609e-08, 'border_count': 118, 'bagging_temperature': 0.6259382305916912, 'random_strength': 8.91244462308056, 'grow_policy': 'Lossguide', 'min_data_in_leaf': 998, 'max_leaves': 76}. Best is trial 14 with value: 1609.1448261457704.[0m
[32m[I 2024-10-13 06:28:45,956][0m Trial 53 finished with value: 1772.5264385686307 and parameters: {'depth': 4, 'learning_rate': 0.10308168747014727, 'iterations': 2525, 'l2_leaf_reg': 1.952696490178656e-08, 'border_count': 138, 'bagging_temperature': 0.7513464464920699, 'random_strength': 9.631344813982425, 'grow_policy': 'Lossguide', 'min_data_in_leaf': 887, 'max_leaves': 128}. Best is trial 14 with value: 1609.1448261457704.[0m
[32m[I 2024-10-13 06:28:47,785][0m Trial 54 finished with value: 1671.873551593816 and parameters: {'depth': 5, 'learning_rate': 0.034322915063896814, 'iterations': 1675, 'l2_leaf_reg': 3.051605502396408e-07, 'border_count': 101, 'bagging_temperature': 0.6661360443844488, 'random_strength': 9.362151392749695, 'grow_policy': 'Lossguide', 'min_data_in_leaf': 744, 'max_leaves': 37}. Best is trial 14 with value: 1609.1448261457704.[0m
[32m[I 2024-10-13 06:28:49,468][0m Trial 55 finished with value: 1692.5982785541273 and parameters: {'depth': 5, 'learning_rate': 0.030430123503536948, 'iterations': 1617, 'l2_leaf_reg': 9.455455898868165e-07, 'border_count': 100, 'bagging_temperature': 0.7364725213769108, 'random_strength': 8.579744474836737, 'grow_policy': 'Lossguide', 'min_data_in_leaf': 717, 'max_leaves': 40}. Best is trial 14 with value: 1609.1448261457704.[0m
[32m[I 2024-10-13 06:28:51,152][0m Trial 56 finished with value: 1704.2096452010576 and parameters: {'depth': 5, 'learning_rate': 0.031129148966289554, 'iterations': 1583, 'l2_leaf_reg': 8.689127315059139e-07, 'border_count': 102, 'bagging_temperature': 0.7297587911178619, 'random_strength': 8.590818926338105, 'grow_policy': 'Lossguide', 'min_data_in_leaf': 731, 'max_leaves': 32}. Best is trial 14 with value: 1609.1448261457704.[0m
[32m[I 2024-10-13 06:28:52,761][0m Trial 57 finished with value: 1704.797868343149 and parameters: {'depth': 7, 'learning_rate': 0.07886031030300512, 'iterations': 1365, 'l2_leaf_reg': 2.8345396824658714e-06, 'border_count': 77, 'bagging_temperature': 0.881990991522781, 'random_strength': 9.30513445216241, 'grow_policy': 'Lossguide', 'min_data_in_leaf': 774, 'max_leaves': 53}. Best is trial 14 with value: 1609.1448261457704.[0m
[32m[I 2024-10-13 06:28:54,554][0m Trial 58 finished with value: 1658.9235173760992 and parameters: {'depth': 5, 'learning_rate': 0.12061634512549699, 'iterations': 1702, 'l2_leaf_reg': 2.651496188455542e-05, 'border_count': 88, 'bagging_temperature': 0.6644953609541608, 'random_strength': 7.940262050434039, 'grow_policy': 'Lossguide', 'min_data_in_leaf': 518, 'max_leaves': 31}. Best is trial 14 with value: 1609.1448261457704.[0m
[32m[I 2024-10-13 06:28:55,868][0m Trial 59 finished with value: 1650.400416495683 and parameters: {'depth': 3, 'learning_rate': 0.2855291677228181, 'iterations': 1087, 'l2_leaf_reg': 3.80584949988641e-05, 'border_count': 90, 'bagging_temperature': 0.6801641676343517, 'random_strength': 7.327806647055423, 'grow_policy': 'Lossguide', 'min_data_in_leaf': 412, 'max_leaves': 33}. Best is trial 14 with value: 1609.1448261457704.[0m
[32m[I 2024-10-13 06:28:57,287][0m Trial 60 finished with value: 1638.6490728394422 and parameters: {'depth': 3, 'learning_rate': 0.21298993757531506, 'iterations': 1158, 'l2_leaf_reg': 2.3927190383974746e-05, 'border_count': 87, 'bagging_temperature': 0.6726991386746543, 'random_strength': 7.320307844472897, 'grow_policy': 'Lossguide', 'min_data_in_leaf': 391, 'max_leaves': 69}. Best is trial 14 with value: 1609.1448261457704.[0m
[32m[I 2024-10-13 06:28:58,695][0m Trial 61 finished with value: 1819.396769890484 and parameters: {'depth': 3, 'learning_rate': 0.23129952055809047, 'iterations': 1114, 'l2_leaf_reg': 5.877914979019241e-05, 'border_count': 89, 'bagging_temperature': 0.6928448640246607, 'random_strength': 7.950086471178739, 'grow_policy': 'Lossguide', 'min_data_in_leaf': 347, 'max_leaves': 67}. Best is trial 14 with value: 1609.1448261457704.[0m
[32m[I 2024-10-13 06:28:59,946][0m Trial 62 finished with value: 2086.0936991303497 and parameters: {'depth': 3, 'learning_rate': 0.2858059024871718, 'iterations': 944, 'l2_leaf_reg': 1.9180451535587887e-05, 'border_count': 59, 'bagging_temperature': 0.638188258679763, 'random_strength': 7.440471332310407, 'grow_policy': 'Lossguide', 'min_data_in_leaf': 421, 'max_leaves': 33}. Best is trial 14 with value: 1609.1448261457704.[0m
[32m[I 2024-10-13 06:29:01,088][0m Trial 63 finished with value: 1815.6381160319938 and parameters: {'depth': 3, 'learning_rate': 0.1870590495162428, 'iterations': 831, 'l2_leaf_reg': 0.0009188594968632497, 'border_count': 70, 'bagging_temperature': 0.7963820250547283, 'random_strength': 7.302795860015874, 'grow_policy': 'Lossguide', 'min_data_in_leaf': 274, 'max_leaves': 64}. Best is trial 14 with value: 1609.1448261457704.[0m
[32m[I 2024-10-13 06:29:02,474][0m Trial 64 finished with value: 1701.933549201454 and parameters: {'depth': 4, 'learning_rate': 0.12612437839144566, 'iterations': 1142, 'l2_leaf_reg': 0.0001543543999191202, 'border_count': 90, 'bagging_temperature': 0.5910161843948079, 'random_strength': 8.242604768807006, 'grow_policy': 'Lossguide', 'min_data_in_leaf': 518, 'max_leaves': 95}. Best is trial 14 with value: 1609.1448261457704.[0m
[32m[I 2024-10-13 06:29:04,236][0m Trial 65 finished with value: 2006.058869754487 and parameters: {'depth': 4, 'learning_rate': 0.16680020985368618, 'iterations': 1699, 'l2_leaf_reg': 0.00312862446423911, 'border_count': 50, 'bagging_temperature': 0.5470067370429037, 'random_strength': 6.408925102230453, 'grow_policy': 'Lossguide', 'min_data_in_leaf': 309, 'max_leaves': 48}. Best is trial 14 with value: 1609.1448261457704.[0m
[32m[I 2024-10-13 06:29:05,131][0m Trial 66 finished with value: 1722.1585221544235 and parameters: {'depth': 15, 'learning_rate': 0.12484511711929888, 'iterations': 489, 'l2_leaf_reg': 2.66374208708736e-05, 'border_count': 110, 'bagging_temperature': 0.6746447941648182, 'random_strength': 0.5914750930780581, 'grow_policy': 'Lossguide', 'min_data_in_leaf': 431, 'max_leaves': 71}. Best is trial 14 with value: 1609.1448261457704.[0m
[32m[I 2024-10-13 06:29:06,748][0m Trial 67 finished with value: 1755.0312405906698 and parameters: {'depth': 3, 'learning_rate': 0.197198004611507, 'iterations': 1501, 'l2_leaf_reg': 1.1516125719183773e-05, 'border_count': 86, 'bagging_temperature': 0.7995283376886605, 'random_strength': 5.945147576449639, 'grow_policy': 'Lossguide', 'min_data_in_leaf': 246, 'max_leaves': 48}. Best is trial 14 with value: 1609.1448261457704.[0m
[32m[I 2024-10-13 06:29:09,476][0m Trial 68 finished with value: 1697.4855820149996 and parameters: {'depth': 5, 'learning_rate': 0.2674907889918525, 'iterations': 2978, 'l2_leaf_reg': 5.358419921919469e-06, 'border_count': 80, 'bagging_temperature': 0.7082941818519853, 'random_strength': 7.093869172928383, 'grow_policy': 'Lossguide', 'min_data_in_leaf': 413, 'max_leaves': 31}. Best is trial 14 with value: 1609.1448261457704.[0m
[32m[I 2024-10-13 06:29:10,515][0m Trial 69 finished with value: 1833.7106151200935 and parameters: {'depth': 4, 'learning_rate': 0.06836530548142913, 'iterations': 648, 'l2_leaf_reg': 0.00028022394348527734, 'border_count': 24, 'bagging_temperature': 0.49632044359889455, 'random_strength': 7.6998303789703115, 'grow_policy': 'Lossguide', 'min_data_in_leaf': 137, 'max_leaves': 155}. Best is trial 14 with value: 1609.1448261457704.[0m
[32m[I 2024-10-13 06:29:11,767][0m Trial 70 finished with value: 1837.2069259406746 and parameters: {'depth': 5, 'learning_rate': 0.11006999056037384, 'iterations': 883, 'l2_leaf_reg': 0.0006577377394486828, 'border_count': 67, 'bagging_temperature': 0.6098137376501656, 'random_strength': 5.429291467973372, 'grow_policy': 'Depthwise', 'min_data_in_leaf': 537}. Best is trial 14 with value: 1609.1448261457704.[0m
[32m[I 2024-10-13 06:29:13,481][0m Trial 71 finished with value: 1767.6213836947095 and parameters: {'depth': 5, 'learning_rate': 0.1412523048526629, 'iterations': 1646, 'l2_leaf_reg': 9.921306286297901e-05, 'border_count': 96, 'bagging_temperature': 0.8387917786400241, 'random_strength': 8.904998461276714, 'grow_policy': 'Lossguide', 'min_data_in_leaf': 492, 'max_leaves': 45}. Best is trial 14 with value: 1609.1448261457704.[0m
[32m[I 2024-10-13 06:29:15,375][0m Trial 72 finished with value: 1695.9188745676472 and parameters: {'depth': 6, 'learning_rate': 0.038319637439609366, 'iterations': 1818, 'l2_leaf_reg': 3.481119385414607, 'border_count': 98, 'bagging_temperature': 0.7639804667060808, 'random_strength': 8.453090940023719, 'grow_policy': 'Lossguide', 'min_data_in_leaf': 634, 'max_leaves': 42}. Best is trial 14 with value: 1609.1448261457704.[0m
[32m[I 2024-10-13 06:29:16,939][0m Trial 73 finished with value: 5959.509806756863 and parameters: {'depth': 4, 'learning_rate': 0.0003158735978762047, 'iterations': 1373, 'l2_leaf_reg': 2.549685286773449e-07, 'border_count': 106, 'bagging_temperature': 0.6797545605963786, 'random_strength': 8.022171576942114, 'grow_policy': 'Lossguide', 'min_data_in_leaf': 391, 'max_leaves': 181}. Best is trial 14 with value: 1609.1448261457704.[0m
[32m[I 2024-10-13 06:29:18,860][0m Trial 74 finished with value: 1705.6979877703134 and parameters: {'depth': 5, 'learning_rate': 0.05901454128572992, 'iterations': 1868, 'l2_leaf_reg': 2.089447360655951e-06, 'border_count': 113, 'bagging_temperature': 0.6652508510912215, 'random_strength': 8.250305823062765, 'grow_policy': 'Lossguide', 'min_data_in_leaf': 454, 'max_leaves': 61}. Best is trial 14 with value: 1609.1448261457704.[0m
[32m[I 2024-10-13 06:29:20,528][0m Trial 75 finished with value: 1671.1074312160488 and parameters: {'depth': 6, 'learning_rate': 0.08021566010548595, 'iterations': 1546, 'l2_leaf_reg': 1.3214982731234315e-05, 'border_count': 90, 'bagging_temperature': 0.4555524101538866, 'random_strength': 7.547576220168934, 'grow_policy': 'Lossguide', 'min_data_in_leaf': 319, 'max_leaves': 37}. Best is trial 14 with value: 1609.1448261457704.[0m
[32m[I 2024-10-13 06:30:16,686][0m Trial 76 finished with value: 2206.7444047453378 and parameters: {'depth': 12, 'learning_rate': 0.07752046701210535, 'iterations': 1231, 'l2_leaf_reg': 3.951968228352898e-05, 'border_count': 76, 'bagging_temperature': 0.40256137147362764, 'random_strength': 6.539439940342917, 'grow_policy': 'SymmetricTree', 'min_data_in_leaf': 319}. Best is trial 14 with value: 1609.1448261457704.[0m
[32m[I 2024-10-13 06:30:19,260][0m Trial 77 finished with value: 1702.42224658948 and parameters: {'depth': 6, 'learning_rate': 0.226245870769376, 'iterations': 2893, 'l2_leaf_reg': 1.2214137959243864e-05, 'border_count': 127, 'bagging_temperature': 0.4680962412709332, 'random_strength': 7.471201798266551, 'grow_policy': 'Lossguide', 'min_data_in_leaf': 187, 'max_leaves': 57}. Best is trial 14 with value: 1609.1448261457704.[0m
[32m[I 2024-10-13 06:30:35,336][0m Trial 78 finished with value: 1735.9585265990634 and parameters: {'depth': 7, 'learning_rate': 0.1643854898257728, 'iterations': 2641, 'l2_leaf_reg': 7.83620653681501e-05, 'border_count': 91, 'bagging_temperature': 0.5621467686054424, 'random_strength': 6.985954581851505, 'grow_policy': 'SymmetricTree', 'min_data_in_leaf': 323}. Best is trial 14 with value: 1609.1448261457704.[0m
[32m[I 2024-10-13 06:30:36,636][0m Trial 79 finished with value: 1949.8178508823742 and parameters: {'depth': 6, 'learning_rate': 0.0979597052793098, 'iterations': 1053, 'l2_leaf_reg': 2.2176251786135265e-05, 'border_count': 52, 'bagging_temperature': 0.4540421434239012, 'random_strength': 3.3564514901125215, 'grow_policy': 'Lossguide', 'min_data_in_leaf': 399, 'max_leaves': 79}. Best is trial 14 with value: 1609.1448261457704.[0m
[32m[I 2024-10-13 06:30:41,951][0m Trial 80 finished with value: 1804.505664510604 and parameters: {'depth': 4, 'learning_rate': 0.03934717655918817, 'iterations': 1398, 'l2_leaf_reg': 0.002258181957893062, 'border_count': 116, 'bagging_temperature': 0.5108075121418593, 'random_strength': 7.820948794121881, 'grow_policy': 'SymmetricTree', 'min_data_in_leaf': 375}. Best is trial 14 with value: 1609.1448261457704.[0m
[32m[I 2024-10-13 06:30:43,616][0m Trial 81 finished with value: 1708.6031686226652 and parameters: {'depth': 5, 'learning_rate': 0.02485115718750669, 'iterations': 1522, 'l2_leaf_reg': 8.963489055827591e-07, 'border_count': 103, 'bagging_temperature': 0.7381242796576094, 'random_strength': 7.238872165738095, 'grow_policy': 'Lossguide', 'min_data_in_leaf': 600, 'max_leaves': 40}. Best is trial 14 with value: 1609.1448261457704.[0m
[32m[I 2024-10-13 06:30:45,368][0m Trial 82 finished with value: 1681.5634889097705 and parameters: {'depth': 6, 'learning_rate': 0.0534726852745808, 'iterations': 1668, 'l2_leaf_reg': 6.000893946034285e-06, 'border_count': 83, 'bagging_temperature': 0.7049931274562272, 'random_strength': 8.760687491932789, 'grow_policy': 'Lossguide', 'min_data_in_leaf': 278, 'max_leaves': 33}. Best is trial 14 with value: 1609.1448261457704.[0m
[32m[I 2024-10-13 06:30:47,176][0m Trial 83 finished with value: 1706.1819832187311 and parameters: {'depth': 6, 'learning_rate': 0.05321378779525208, 'iterations': 1742, 'l2_leaf_reg': 4.854661870910693e-06, 'border_count': 80, 'bagging_temperature': 0.607067175510009, 'random_strength': 8.881902983952655, 'grow_policy': 'Lossguide', 'min_data_in_leaf': 264, 'max_leaves': 33}. Best is trial 14 with value: 1609.1448261457704.[0m
[32m[I 2024-10-13 06:30:48,952][0m Trial 84 finished with value: 1686.3401650309418 and parameters: {'depth': 6, 'learning_rate': 0.08375877065285245, 'iterations': 1689, 'l2_leaf_reg': 1.024278795546145e-05, 'border_count': 93, 'bagging_temperature': 0.8326107247665826, 'random_strength': 9.462118284036343, 'grow_policy': 'Lossguide', 'min_data_in_leaf': 349, 'max_leaves': 58}. Best is trial 14 with value: 1609.1448261457704.[0m
[32m[I 2024-10-13 06:30:51,501][0m Trial 85 finished with value: 1863.432440705555 and parameters: {'depth': 7, 'learning_rate': 0.12382930217082341, 'iterations': 2786, 'l2_leaf_reg': 4.527987508714462e-05, 'border_count': 66, 'bagging_temperature': 0.6495882116840167, 'random_strength': 9.099721379729722, 'grow_policy': 'Lossguide', 'min_data_in_leaf': 230, 'max_leaves': 46}. Best is trial 14 with value: 1609.1448261457704.[0m
[32m[I 2024-10-13 06:30:59,573][0m Trial 86 finished with value: 1937.3086545729673 and parameters: {'depth': 5, 'learning_rate': 0.2977687848723002, 'iterations': 1967, 'l2_leaf_reg': 0.00010727530046617378, 'border_count': 84, 'bagging_temperature': 0.6942223772430982, 'random_strength': 7.6361426302414745, 'grow_policy': 'SymmetricTree', 'min_data_in_leaf': 304}. Best is trial 14 with value: 1609.1448261457704.[0m
[32m[I 2024-10-13 06:31:01,192][0m Trial 87 finished with value: 1792.0160449564519 and parameters: {'depth': 14, 'learning_rate': 0.06661793871234425, 'iterations': 1185, 'l2_leaf_reg': 0.007640329723060549, 'border_count': 73, 'bagging_temperature': 0.42261193966118477, 'random_strength': 4.591792779806061, 'grow_policy': 'Depthwise', 'min_data_in_leaf': 447}. Best is trial 14 with value: 1609.1448261457704.[0m
[32m[I 2024-10-13 06:31:17,175][0m Trial 88 finished with value: 2211.3512187407423 and parameters: {'depth': 8, 'learning_rate': 0.0023957269856633464, 'iterations': 1559, 'l2_leaf_reg': 0.00023169481711977414, 'border_count': 108, 'bagging_temperature': 0.3218293749033788, 'random_strength': 6.818224150829405, 'grow_policy': 'SymmetricTree', 'min_data_in_leaf': 169}. Best is trial 14 with value: 1609.1448261457704.[0m
[32m[I 2024-10-13 06:31:18,684][0m Trial 89 finished with value: 1726.921771030652 and parameters: {'depth': 3, 'learning_rate': 0.18090551421387505, 'iterations': 1290, 'l2_leaf_reg': 0.20450623581754632, 'border_count': 123, 'bagging_temperature': 0.3773356110109223, 'random_strength': 9.991185060242628, 'grow_policy': 'Lossguide', 'min_data_in_leaf': 292, 'max_leaves': 68}. Best is trial 14 with value: 1609.1448261457704.[0m
[32m[I 2024-10-13 06:31:20,535][0m Trial 90 finished with value: 1863.8649220556088 and parameters: {'depth': 6, 'learning_rate': 0.019665402628944284, 'iterations': 1821, 'l2_leaf_reg': 2.9293113747617772e-05, 'border_count': 61, 'bagging_temperature': 0.5269442656313456, 'random_strength': 8.171968837443474, 'grow_policy': 'Lossguide', 'min_data_in_leaf': 348, 'max_leaves': 128}. Best is trial 14 with value: 1609.1448261457704.[0m
[32m[I 2024-10-13 06:31:22,342][0m Trial 91 finished with value: 1730.6105296974545 and parameters: {'depth': 6, 'learning_rate': 0.08535396683946218, 'iterations': 1740, 'l2_leaf_reg': 8.451404396602016e-06, 'border_count': 94, 'bagging_temperature': 0.8260894150925366, 'random_strength': 9.45673220336388, 'grow_policy': 'Lossguide', 'min_data_in_leaf': 348, 'max_leaves': 57}. Best is trial 14 with value: 1609.1448261457704.[0m
[32m[I 2024-10-13 06:31:25,088][0m Trial 92 finished with value: 1699.2698335133555 and parameters: {'depth': 6, 'learning_rate': 0.09879036167575894, 'iterations': 1674, 'l2_leaf_reg': 1.457546661193014e-05, 'border_count': 93, 'bagging_temperature': 0.9185140551717565, 'random_strength': 9.613775569554534, 'grow_policy': 'Lossguide', 'min_data_in_leaf': 41, 'max_leaves': 40}. Best is trial 14 with value: 1609.1448261457704.[0m
[32m[I 2024-10-13 06:31:26,717][0m Trial 93 finished with value: 1787.9676044122168 and parameters: {'depth': 5, 'learning_rate': 0.13962234882381697, 'iterations': 1455, 'l2_leaf_reg': 8.03146361159564e-06, 'border_count': 84, 'bagging_temperature': 0.7750974646215945, 'random_strength': 8.72432286298253, 'grow_policy': 'Lossguide', 'min_data_in_leaf': 977, 'max_leaves': 56}. Best is trial 14 with value: 1609.1448261457704.[0m
[32m[I 2024-10-13 06:31:28,612][0m Trial 94 finished with value: 1722.4022466559177 and parameters: {'depth': 7, 'learning_rate': 0.07609401280699353, 'iterations': 1909, 'l2_leaf_reg': 2.1799293974583985e-06, 'border_count': 102, 'bagging_temperature': 0.5781645864218425, 'random_strength': 9.25539941993668, 'grow_policy': 'Lossguide', 'min_data_in_leaf': 474, 'max_leaves': 32}. Best is trial 14 with value: 1609.1448261457704.[0m
[32m[I 2024-10-13 06:31:39,602][0m Trial 95 finished with value: 1796.39391698624 and parameters: {'depth': 7, 'learning_rate': 0.055350297252494296, 'iterations': 1578, 'l2_leaf_reg': 4.225735597203511e-06, 'border_count': 88, 'bagging_temperature': 0.719781510891836, 'random_strength': 7.920839070735056, 'grow_policy': 'SymmetricTree', 'min_data_in_leaf': 933}. Best is trial 14 with value: 1609.1448261457704.[0m
[32m[I 2024-10-13 06:31:40,875][0m Trial 96 finished with value: 1703.1705816489402 and parameters: {'depth': 6, 'learning_rate': 0.04292349067816056, 'iterations': 1027, 'l2_leaf_reg': 5.89471866983756e-05, 'border_count': 76, 'bagging_temperature': 0.6203337711733048, 'random_strength': 9.760161206653661, 'grow_policy': 'Lossguide', 'min_data_in_leaf': 281, 'max_leaves': 42}. Best is trial 14 with value: 1609.1448261457704.[0m
[32m[I 2024-10-13 06:31:41,551][0m Trial 97 finished with value: 1740.2688553721234 and parameters: {'depth': 4, 'learning_rate': 0.23287870826785753, 'iterations': 141, 'l2_leaf_reg': 1.6277875822516104e-05, 'border_count': 108, 'bagging_temperature': 0.8487299343893209, 'random_strength': 8.424669895586696, 'grow_policy': 'Lossguide', 'min_data_in_leaf': 374, 'max_leaves': 82}. Best is trial 14 with value: 1609.1448261457704.[0m
[32m[I 2024-10-13 06:31:52,924][0m Trial 98 finished with value: 1810.1075087756687 and parameters: {'depth': 5, 'learning_rate': 0.011562332477993814, 'iterations': 2906, 'l2_leaf_reg': 1.2011995800921008e-08, 'border_count': 56, 'bagging_temperature': 0.650819267353034, 'random_strength': 7.325082242128186, 'grow_policy': 'SymmetricTree', 'min_data_in_leaf': 223}. Best is trial 14 with value: 1609.1448261457704.[0m
[32m[I 2024-10-13 06:31:54,656][0m Trial 99 finished with value: 1688.199652692539 and parameters: {'depth': 8, 'learning_rate': 0.03536994782906328, 'iterations': 1668, 'l2_leaf_reg': 6.331815358440146e-08, 'border_count': 116, 'bagging_temperature': 0.9661280141673239, 'random_strength': 9.014272411494142, 'grow_policy': 'Lossguide', 'min_data_in_leaf': 340, 'max_leaves': 53}. Best is trial 14 with value: 1609.1448261457704.[0m
[32m[I 2024-10-13 06:31:56,224][0m Trial 100 finished with value: 1697.0052802711623 and parameters: {'depth': 6, 'learning_rate': 0.08697028565263769, 'iterations': 1441, 'l2_leaf_reg': 0.0004683363335875547, 'border_count': 95, 'bagging_temperature': 0.8823820560410665, 'random_strength': 6.03450733166284, 'grow_policy': 'Lossguide', 'min_data_in_leaf': 399, 'max_leaves': 73}. Best is trial 14 with value: 1609.1448261457704.[0m
