[32m[I 2024-10-13 07:01:39,616][0m Trial 501 finished with value: 1985.0991097368421 and parameters: {'depth': 10, 'learning_rate': 0.034675879191639065, 'iterations': 2864, 'l2_leaf_reg': 0.0008999951975977071, 'border_count': 81, 'bagging_temperature': 0.6745319767450106, 'random_strength': 6.453495227453533, 'grow_policy': 'SymmetricTree', 'min_data_in_leaf': 182}. Best is trial 14 with value: 1609.1448261457704.[0m
[32m[I 2024-10-13 07:01:42,054][0m Trial 502 finished with value: 1711.9215164806642 and parameters: {'depth': 8, 'learning_rate': 0.06767574438962393, 'iterations': 2739, 'l2_leaf_reg': 0.10205476420475372, 'border_count': 75, 'bagging_temperature': 0.729218293881504, 'random_strength': 6.867437663510896, 'grow_policy': 'Lossguide', 'min_data_in_leaf': 447, 'max_leaves': 181}. Best is trial 14 with value: 1609.1448261457704.[0m
[32m[I 2024-10-13 07:01:44,846][0m Trial 503 finished with value: 1752.94042765625 and parameters: {'depth': 8, 'learning_rate': 0.006492225331754807, 'iterations': 2945, 'l2_leaf_reg': 0.0012225459745790906, 'border_count': 89, 'bagging_temperature': 0.7600656782954491, 'random_strength': 6.711068727171627, 'grow_policy': 'Depthwise', 'min_data_in_leaf': 804}. Best is trial 14 with value: 1609.1448261457704.[0m
[32m[I 2024-10-13 07:01:47,370][0m Trial 504 finished with value: 1678.3359463425418 and parameters: {'depth': 9, 'learning_rate': 0.029502394604564285, 'iterations': 2666, 'l2_leaf_reg': 0.38801729309687516, 'border_count': 100, 'bagging_temperature': 0.6453228937062444, 'random_strength': 6.312231297749727, 'grow_policy': 'Lossguide', 'min_data_in_leaf': 469, 'max_leaves': 144}. Best is trial 14 with value: 1609.1448261457704.[0m
[32m[I 2024-10-13 07:01:49,948][0m Trial 505 finished with value: 1677.3281025046165 and parameters: {'depth': 3, 'learning_rate': 0.0391959725445617, 'iterations': 2777, 'l2_leaf_reg': 1.2062561449734852, 'border_count': 85, 'bagging_temperature': 0.6908752626527325, 'random_strength': 6.938668240235493, 'grow_policy': 'Lossguide', 'min_data_in_leaf': 885, 'max_leaves': 170}. Best is trial 14 with value: 1609.1448261457704.[0m
[32m[I 2024-10-13 07:01:52,363][0m Trial 506 finished with value: 1779.2573342501205 and parameters: {'depth': 9, 'learning_rate': 0.026135977615031777, 'iterations': 2592, 'l2_leaf_reg': 1.318267119864058e-05, 'border_count': 64, 'bagging_temperature': 0.6693820615389681, 'random_strength': 6.6539908786376225, 'grow_policy': 'Lossguide', 'min_data_in_leaf': 381, 'max_leaves': 176}. Best is trial 14 with value: 1609.1448261457704.[0m
[32m[I 2024-10-13 07:01:55,057][0m Trial 507 finished with value: 3119.8485652134887 and parameters: {'depth': 7, 'learning_rate': 0.0009757529880501003, 'iterations': 2856, 'l2_leaf_reg': 0.0005179111513658822, 'border_count': 95, 'bagging_temperature': 0.7083985624669731, 'random_strength': 5.84721782554847, 'grow_policy': 'Lossguide', 'min_data_in_leaf': 413, 'max_leaves': 151}. Best is trial 14 with value: 1609.1448261457704.[0m
[32m[I 2024-10-13 07:01:57,841][0m Trial 508 finished with value: 1693.1474793608973 and parameters: {'depth': 10, 'learning_rate': 0.047942813510627375, 'iterations': 2957, 'l2_leaf_reg': 7.191373190222713e-06, 'border_count': 77, 'bagging_temperature': 0.6481040094643722, 'random_strength': 5.220671764526562, 'grow_policy': 'Lossguide', 'min_data_in_leaf': 853, 'max_leaves': 166}. Best is trial 14 with value: 1609.1448261457704.[0m
[32m[I 2024-10-13 07:02:00,526][0m Trial 509 finished with value: 1656.0843153580752 and parameters: {'depth': 3, 'learning_rate': 0.032437774153049284, 'iterations': 2900, 'l2_leaf_reg': 0.0025931615594963642, 'border_count': 82, 'bagging_temperature': 0.6810190324643391, 'random_strength': 6.989985664821887, 'grow_policy': 'Lossguide', 'min_data_in_leaf': 249, 'max_leaves': 154}. Best is trial 14 with value: 1609.1448261457704.[0m
[32m[I 2024-10-13 07:02:03,170][0m Trial 510 finished with value: 1790.3939949683547 and parameters: {'depth': 3, 'learning_rate': 0.03802224334348068, 'iterations': 2805, 'l2_leaf_reg': 0.0008018392197209919, 'border_count': 69, 'bagging_temperature': 0.3940863744512886, 'random_strength': 6.521059383901156, 'grow_policy': 'Lossguide', 'min_data_in_leaf': 434, 'max_leaves': 160}. Best is trial 14 with value: 1609.1448261457704.[0m
[32m[I 2024-10-13 07:02:04,806][0m Trial 511 finished with value: 1887.622625338077 and parameters: {'depth': 9, 'learning_rate': 0.03241949412524172, 'iterations': 1491, 'l2_leaf_reg': 0.6232821979078876, 'border_count': 53, 'bagging_temperature': 0.7237273996094766, 'random_strength': 6.1659104477099556, 'grow_policy': 'Lossguide', 'min_data_in_leaf': 776, 'max_leaves': 148}. Best is trial 14 with value: 1609.1448261457704.[0m
[32m[I 2024-10-13 07:02:07,259][0m Trial 512 finished with value: 1639.1525256249881 and parameters: {'depth': 8, 'learning_rate': 0.026143515325068933, 'iterations': 2677, 'l2_leaf_reg': 0.07504204959918755, 'border_count': 91, 'bagging_temperature': 0.6622028756739804, 'random_strength': 6.826148280123555, 'grow_policy': 'Lossguide', 'min_data_in_leaf': 815, 'max_leaves': 138}. Best is trial 14 with value: 1609.1448261457704.[0m
[32m[I 2024-10-13 07:02:09,660][0m Trial 513 finished with value: 1678.854809154588 and parameters: {'depth': 8, 'learning_rate': 0.02614684197863437, 'iterations': 2564, 'l2_leaf_reg': 0.057284546999681704, 'border_count': 92, 'bagging_temperature': 0.6491028659492117, 'random_strength': 7.025534299080993, 'grow_policy': 'Lossguide', 'min_data_in_leaf': 792, 'max_leaves': 135}. Best is trial 14 with value: 1609.1448261457704.[0m
[32m[I 2024-10-13 07:02:33,772][0m Trial 514 finished with value: 1799.9212444078867 and parameters: {'depth': 8, 'learning_rate': 0.025772194868536207, 'iterations': 2661, 'l2_leaf_reg': 0.09550161131358305, 'border_count': 100, 'bagging_temperature': 0.7026099973103915, 'random_strength': 6.825033489633812, 'grow_policy': 'SymmetricTree', 'min_data_in_leaf': 819}. Best is trial 14 with value: 1609.1448261457704.[0m
[32m[I 2024-10-13 07:02:36,275][0m Trial 515 finished with value: 1691.7700014065842 and parameters: {'depth': 8, 'learning_rate': 0.07713206900297385, 'iterations': 2700, 'l2_leaf_reg': 0.06422557631511315, 'border_count': 92, 'bagging_temperature': 0.6881631307932484, 'random_strength': 7.027164025856789, 'grow_policy': 'Lossguide', 'min_data_in_leaf': 394, 'max_leaves': 142}. Best is trial 14 with value: 1609.1448261457704.[0m
[32m[I 2024-10-13 07:02:38,823][0m Trial 516 finished with value: 1895.7122087264331 and parameters: {'depth': 7, 'learning_rate': 0.16624569741945086, 'iterations': 2684, 'l2_leaf_reg': 0.07665492696705095, 'border_count': 75, 'bagging_temperature': 0.6373905994108171, 'random_strength': 6.843007765121092, 'grow_policy': 'Lossguide', 'min_data_in_leaf': 778, 'max_leaves': 130}. Best is trial 14 with value: 1609.1448261457704.[0m
[32m[I 2024-10-13 07:02:41,289][0m Trial 517 finished with value: 1680.1100346692554 and parameters: {'depth': 8, 'learning_rate': 0.044944185824237766, 'iterations': 2618, 'l2_leaf_reg': 0.11695771695238281, 'border_count': 82, 'bagging_temperature': 0.7838866871926293, 'random_strength': 7.111504303927353, 'grow_policy': 'Lossguide', 'min_data_in_leaf': 808, 'max_leaves': 140}. Best is trial 14 with value: 1609.1448261457704.[0m
[32m[I 2024-10-13 07:02:41,932][0m Trial 518 finished with value: 3029.7882959143285 and parameters: {'depth': 8, 'learning_rate': 0.02520590457790297, 'iterations': 118, 'l2_leaf_reg': 0.28628857348029674, 'border_count': 87, 'bagging_temperature': 0.665819650966869, 'random_strength': 6.793037804436736, 'grow_policy': 'Lossguide', 'min_data_in_leaf': 418, 'max_leaves': 176}. Best is trial 14 with value: 1609.1448261457704.[0m
[32m[I 2024-10-13 07:02:44,469][0m Trial 519 finished with value: 1999.1242545860898 and parameters: {'depth': 8, 'learning_rate': 0.053767773546332415, 'iterations': 2739, 'l2_leaf_reg': 0.03697675138086361, 'border_count': 39, 'bagging_temperature': 0.7514364887764687, 'random_strength': 7.129663913483598, 'grow_policy': 'Lossguide', 'min_data_in_leaf': 392, 'max_leaves': 170}. Best is trial 14 with value: 1609.1448261457704.[0m
[32m[I 2024-10-13 07:02:46,869][0m Trial 520 finished with value: 1665.150008393155 and parameters: {'depth': 3, 'learning_rate': 0.036849865556518785, 'iterations': 2568, 'l2_leaf_reg': 0.15282262527835733, 'border_count': 78, 'bagging_temperature': 0.6601885768498285, 'random_strength': 6.386621920595977, 'grow_policy': 'Lossguide', 'min_data_in_leaf': 831, 'max_leaves': 191}. Best is trial 14 with value: 1609.1448261457704.[0m
[32m[I 2024-10-13 07:02:49,333][0m Trial 521 finished with value: 1677.74760503452 and parameters: {'depth': 7, 'learning_rate': 0.030944266880093337, 'iterations': 2637, 'l2_leaf_reg': 0.18765447019237252, 'border_count': 96, 'bagging_temperature': 0.27204767524206136, 'random_strength': 6.8859314820624915, 'grow_policy': 'Lossguide', 'min_data_in_leaf': 378, 'max_leaves': 138}. Best is trial 14 with value: 1609.1448261457704.[0m
[32m[I 2024-10-13 07:02:51,964][0m Trial 522 finished with value: 1759.2859696676521 and parameters: {'depth': 3, 'learning_rate': 0.044210827305462275, 'iterations': 2768, 'l2_leaf_reg': 0.051938032319672436, 'border_count': 71, 'bagging_temperature': 0.7022920006563224, 'random_strength': 6.686142441924485, 'grow_policy': 'Lossguide', 'min_data_in_leaf': 484, 'max_leaves': 182}. Best is trial 14 with value: 1609.1448261457704.[0m
[32m[I 2024-10-13 07:02:54,636][0m Trial 523 finished with value: 1632.4051011638737 and parameters: {'depth': 8, 'learning_rate': 0.023709513499028757, 'iterations': 2955, 'l2_leaf_reg': 0.000357602476090601, 'border_count': 89, 'bagging_temperature': 0.6374321603671719, 'random_strength': 5.9752888738123735, 'grow_policy': 'Lossguide', 'min_data_in_leaf': 456, 'max_leaves': 164}. Best is trial 14 with value: 1609.1448261457704.[0m
[32m[I 2024-10-13 07:02:57,330][0m Trial 524 finished with value: 1675.9548004958426 and parameters: {'depth': 8, 'learning_rate': 0.037961707676454334, 'iterations': 2950, 'l2_leaf_reg': 5.805185330236296, 'border_count': 91, 'bagging_temperature': 0.635874072651501, 'random_strength': 5.650384413398414, 'grow_policy': 'Lossguide', 'min_data_in_leaf': 462, 'max_leaves': 164}. Best is trial 14 with value: 1609.1448261457704.[0m
[32m[I 2024-10-13 07:03:00,197][0m Trial 525 finished with value: 1667.1435286270998 and parameters: {'depth': 8, 'learning_rate': 0.019302664297661584, 'iterations': 2995, 'l2_leaf_reg': 0.0004461827886585666, 'border_count': 95, 'bagging_temperature': 0.620455688596295, 'random_strength': 6.12247972033464, 'grow_policy': 'Depthwise', 'min_data_in_leaf': 453}. Best is trial 14 with value: 1609.1448261457704.[0m
[32m[I 2024-10-13 07:03:02,957][0m Trial 526 finished with value: 1663.6315303230947 and parameters: {'depth': 8, 'learning_rate': 0.025016112835591756, 'iterations': 2998, 'l2_leaf_reg': 0.000295678743413027, 'border_count': 99, 'bagging_temperature': 0.6439217230118726, 'random_strength': 5.757563217771269, 'grow_policy': 'Lossguide', 'min_data_in_leaf': 798, 'max_leaves': 168}. Best is trial 14 with value: 1609.1448261457704.[0m
[32m[I 2024-10-13 07:03:03,943][0m Trial 527 finished with value: 1721.9584567211173 and parameters: {'depth': 8, 'learning_rate': 0.12687184760421522, 'iterations': 518, 'l2_leaf_reg': 0.00033993485298768094, 'border_count': 88, 'bagging_temperature': 0.6188812208112255, 'random_strength': 5.887887849443571, 'grow_policy': 'Lossguide', 'min_data_in_leaf': 403, 'max_leaves': 165}. Best is trial 14 with value: 1609.1448261457704.[0m
[32m[I 2024-10-13 07:03:06,606][0m Trial 528 finished with value: 1692.8961178742115 and parameters: {'depth': 8, 'learning_rate': 0.02327665886327284, 'iterations': 2894, 'l2_leaf_reg': 0.00036376345477955795, 'border_count': 104, 'bagging_temperature': 0.47674084805568506, 'random_strength': 5.978423258042936, 'grow_policy': 'Lossguide', 'min_data_in_leaf': 490, 'max_leaves': 198}. Best is trial 14 with value: 1609.1448261457704.[0m
[32m[I 2024-10-13 07:03:32,891][0m Trial 529 finished with value: 1864.5179664868785 and parameters: {'depth': 8, 'learning_rate': 0.06110606331949287, 'iterations': 2925, 'l2_leaf_reg': 0.0001316569143234033, 'border_count': 83, 'bagging_temperature': 0.6538647691293841, 'random_strength': 5.309292129435962, 'grow_policy': 'SymmetricTree', 'min_data_in_leaf': 433}. Best is trial 14 with value: 1609.1448261457704.[0m
[32m[I 2024-10-13 07:03:35,453][0m Trial 530 finished with value: 1763.5427233392975 and parameters: {'depth': 7, 'learning_rate': 0.03115753790630775, 'iterations': 2836, 'l2_leaf_reg': 0.00029179930726184295, 'border_count': 73, 'bagging_temperature': 0.720663092344518, 'random_strength': 6.421800358066391, 'grow_policy': 'Lossguide', 'min_data_in_leaf': 770, 'max_leaves': 173}. Best is trial 14 with value: 1609.1448261457704.[0m
[32m[I 2024-10-13 07:03:37,984][0m Trial 531 finished with value: 2290.6983095708792 and parameters: {'depth': 4, 'learning_rate': 0.002080132006542958, 'iterations': 2773, 'l2_leaf_reg': 0.0006458713142419948, 'border_count': 79, 'bagging_temperature': 0.6860642382515134, 'random_strength': 6.688912364123118, 'grow_policy': 'Lossguide', 'min_data_in_leaf': 311, 'max_leaves': 50}. Best is trial 14 with value: 1609.1448261457704.[0m
[32m[I 2024-10-13 07:03:40,677][0m Trial 532 finished with value: 1641.63511139391 and parameters: {'depth': 3, 'learning_rate': 0.03454435913921404, 'iterations': 2902, 'l2_leaf_reg': 0.0004830454989311074, 'border_count': 90, 'bagging_temperature': 0.6305949963182647, 'random_strength': 5.551314168076018, 'grow_policy': 'Lossguide', 'min_data_in_leaf': 373, 'max_leaves': 176}. Best is trial 14 with value: 1609.1448261457704.[0m
[32m[I 2024-10-13 07:03:43,454][0m Trial 533 finished with value: 1665.465723192114 and parameters: {'depth': 3, 'learning_rate': 0.022687204099286117, 'iterations': 2952, 'l2_leaf_reg': 0.0004852862630658822, 'border_count': 93, 'bagging_temperature': 0.6202829271166479, 'random_strength': 5.5396681737916555, 'grow_policy': 'Lossguide', 'min_data_in_leaf': 332, 'max_leaves': 178}. Best is trial 14 with value: 1609.1448261457704.[0m
[32m[I 2024-10-13 07:03:46,279][0m Trial 534 finished with value: 1693.5685371263255 and parameters: {'depth': 3, 'learning_rate': 0.028806266472366317, 'iterations': 2904, 'l2_leaf_reg': 0.0006369658477142834, 'border_count': 101, 'bagging_temperature': 0.6281070165963678, 'random_strength': 5.477171308554492, 'grow_policy': 'Lossguide', 'min_data_in_leaf': 364, 'max_leaves': 187}. Best is trial 14 with value: 1609.1448261457704.[0m
[32m[I 2024-10-13 07:03:48,854][0m Trial 535 finished with value: 1670.2084264721298 and parameters: {'depth': 3, 'learning_rate': 0.03330638763925277, 'iterations': 2880, 'l2_leaf_reg': 0.00017379562556261755, 'border_count': 90, 'bagging_temperature': 0.3419721822458061, 'random_strength': 5.660035577148417, 'grow_policy': 'Lossguide', 'min_data_in_leaf': 354, 'max_leaves': 160}. Best is trial 14 with value: 1609.1448261457704.[0m
[32m[I 2024-10-13 07:03:50,674][0m Trial 536 finished with value: 1704.1196326139952 and parameters: {'depth': 3, 'learning_rate': 0.02726054068744795, 'iterations': 1802, 'l2_leaf_reg': 2.164848850300401, 'border_count': 97, 'bagging_temperature': 0.6376486385950874, 'random_strength': 5.2914812288664494, 'grow_policy': 'Lossguide', 'min_data_in_leaf': 378, 'max_leaves': 184}. Best is trial 14 with value: 1609.1448261457704.[0m
[32m[I 2024-10-13 07:03:53,423][0m Trial 537 finished with value: 1854.4328691424328 and parameters: {'depth': 3, 'learning_rate': 0.021285240323789874, 'iterations': 2942, 'l2_leaf_reg': 0.0004648281163905042, 'border_count': 28, 'bagging_temperature': 0.6720543630700244, 'random_strength': 5.991179600684138, 'grow_policy': 'Lossguide', 'min_data_in_leaf': 347, 'max_leaves': 169}. Best is trial 14 with value: 1609.1448261457704.[0m
[32m[I 2024-10-13 07:03:56,241][0m Trial 538 finished with value: 1641.2178980094782 and parameters: {'depth': 3, 'learning_rate': 0.03552833804385534, 'iterations': 2998, 'l2_leaf_reg': 0.00019060961755829, 'border_count': 86, 'bagging_temperature': 0.6029325344450658, 'random_strength': 5.784662940946839, 'grow_policy': 'Lossguide', 'min_data_in_leaf': 815, 'max_leaves': 175}. Best is trial 14 with value: 1609.1448261457704.[0m
[32m[I 2024-10-13 07:03:59,033][0m Trial 539 finished with value: 1679.4411947042756 and parameters: {'depth': 3, 'learning_rate': 0.0463100697474765, 'iterations': 2972, 'l2_leaf_reg': 0.00021933992055190153, 'border_count': 106, 'bagging_temperature': 0.6022075401478317, 'random_strength': 5.620213489051397, 'grow_policy': 'Lossguide', 'min_data_in_leaf': 815, 'max_leaves': 181}. Best is trial 14 with value: 1609.1448261457704.[0m
[32m[I 2024-10-13 07:04:09,666][0m Trial 540 finished with value: 1805.5129476682866 and parameters: {'depth': 4, 'learning_rate': 0.03879701742997949, 'iterations': 2997, 'l2_leaf_reg': 1.5211909105285979e-05, 'border_count': 84, 'bagging_temperature': 0.5957564350391225, 'random_strength': 5.95553197719214, 'grow_policy': 'SymmetricTree', 'min_data_in_leaf': 836}. Best is trial 14 with value: 1609.1448261457704.[0m
[32m[I 2024-10-13 07:04:12,284][0m Trial 541 finished with value: 1649.9392669047802 and parameters: {'depth': 3, 'learning_rate': 0.03484722187961674, 'iterations': 2838, 'l2_leaf_reg': 0.47705116841089545, 'border_count': 89, 'bagging_temperature': 0.6128742414207228, 'random_strength': 5.492891303645868, 'grow_policy': 'Lossguide', 'min_data_in_leaf': 815, 'max_leaves': 177}. Best is trial 14 with value: 1609.1448261457704.[0m
[32m[I 2024-10-13 07:04:15,028][0m Trial 542 finished with value: 4025.8580475475183 and parameters: {'depth': 4, 'learning_rate': 0.0005049526112307394, 'iterations': 2999, 'l2_leaf_reg': 8.232367788810369e-05, 'border_count': 94, 'bagging_temperature': 0.5829033794121821, 'random_strength': 5.8043789173612845, 'grow_policy': 'Lossguide', 'min_data_in_leaf': 794, 'max_leaves': 175}. Best is trial 14 with value: 1609.1448261457704.[0m
[32m[I 2024-10-13 07:04:17,729][0m Trial 543 finished with value: 1681.8183438055262 and parameters: {'depth': 3, 'learning_rate': 0.052189270562544854, 'iterations': 2899, 'l2_leaf_reg': 0.0001336583595313086, 'border_count': 84, 'bagging_temperature': 0.6251785272779087, 'random_strength': 5.882477464296127, 'grow_policy': 'Lossguide', 'min_data_in_leaf': 827, 'max_leaves': 156}. Best is trial 14 with value: 1609.1448261457704.[0m
[32m[I 2024-10-13 07:04:20,320][0m Trial 544 finished with value: 1696.1417552229739 and parameters: {'depth': 4, 'learning_rate': 0.039789611068128464, 'iterations': 2830, 'l2_leaf_reg': 0.008442913124877488, 'border_count': 81, 'bagging_temperature': 0.6446682794423945, 'random_strength': 5.322166663378789, 'grow_policy': 'Lossguide', 'min_data_in_leaf': 787, 'max_leaves': 186}. Best is trial 14 with value: 1609.1448261457704.[0m
[32m[I 2024-10-13 07:04:23,038][0m Trial 545 finished with value: 1675.532627271272 and parameters: {'depth': 5, 'learning_rate': 0.034998683530225734, 'iterations': 2905, 'l2_leaf_reg': 0.0003493073530177729, 'border_count': 111, 'bagging_temperature': 0.6194827395601281, 'random_strength': 5.771706472475961, 'grow_policy': 'Lossguide', 'min_data_in_leaf': 808, 'max_leaves': 125}. Best is trial 14 with value: 1609.1448261457704.[0m
[32m[I 2024-10-13 07:04:25,604][0m Trial 546 finished with value: 1660.5518255908928 and parameters: {'depth': 3, 'learning_rate': 0.04406403681956106, 'iterations': 2789, 'l2_leaf_reg': 5.200618402706881e-06, 'border_count': 87, 'bagging_temperature': 0.6435253710671255, 'random_strength': 5.639756394100342, 'grow_policy': 'Lossguide', 'min_data_in_leaf': 766, 'max_leaves': 192}. Best is trial 14 with value: 1609.1448261457704.[0m
[32m[I 2024-10-13 07:04:26,836][0m Trial 547 finished with value: 1804.0671061767614 and parameters: {'depth': 6, 'learning_rate': 0.18920809400314645, 'iterations': 891, 'l2_leaf_reg': 0.00025167185947832556, 'border_count': 92, 'bagging_temperature': 0.6591685846498075, 'random_strength': 6.09896886967649, 'grow_policy': 'Lossguide', 'min_data_in_leaf': 837, 'max_leaves': 163}. Best is trial 14 with value: 1609.1448261457704.[0m
[32m[I 2024-10-13 07:04:28,289][0m Trial 548 finished with value: 1712.6739178293014 and parameters: {'depth': 3, 'learning_rate': 0.029566241708811093, 'iterations': 1282, 'l2_leaf_reg': 0.7981990066597091, 'border_count': 80, 'bagging_temperature': 0.5707406259263562, 'random_strength': 5.367135122700909, 'grow_policy': 'Lossguide', 'min_data_in_leaf': 795, 'max_leaves': 179}. Best is trial 14 with value: 1609.1448261457704.[0m
[32m[I 2024-10-13 07:04:30,991][0m Trial 549 finished with value: 1745.2184005715935 and parameters: {'depth': 3, 'learning_rate': 0.026407696513951282, 'iterations': 2868, 'l2_leaf_reg': 8.999341750300562e-06, 'border_count': 75, 'bagging_temperature': 0.6115577598523326, 'random_strength': 6.243351410078981, 'grow_policy': 'Depthwise', 'min_data_in_leaf': 506}. Best is trial 14 with value: 1609.1448261457704.[0m
[32m[I 2024-10-13 07:04:33,743][0m Trial 550 finished with value: 1656.5472154126303 and parameters: {'depth': 3, 'learning_rate': 0.03388436349856318, 'iterations': 2949, 'l2_leaf_reg': 0.005267014646622428, 'border_count': 86, 'bagging_temperature': 0.6328073936759423, 'random_strength': 5.440726869703505, 'grow_policy': 'Lossguide', 'min_data_in_leaf': 402, 'max_leaves': 145}. Best is trial 14 with value: 1609.1448261457704.[0m
