[32m[I 2024-10-13 07:13:45,119][0m Trial 701 finished with value: 4880.550492737161 and parameters: {'depth': 8, 'learning_rate': 0.0003079372223563093, 'iterations': 2999, 'l2_leaf_reg': 0.23403410427260984, 'border_count': 88, 'bagging_temperature': 0.6680157320382202, 'random_strength': 5.844660038745908, 'grow_policy': 'Lossguide', 'min_data_in_leaf': 777, 'max_leaves': 169}. Best is trial 14 with value: 1609.1448261457704.[0m
[32m[I 2024-10-13 07:13:47,602][0m Trial 702 finished with value: 1974.9884682281806 and parameters: {'depth': 3, 'learning_rate': 0.00352956132751669, 'iterations': 2634, 'l2_leaf_reg': 2.4804281132277996e-06, 'border_count': 95, 'bagging_temperature': 0.7396459538769002, 'random_strength': 6.708229945903515, 'grow_policy': 'Lossguide', 'min_data_in_leaf': 369, 'max_leaves': 255}. Best is trial 14 with value: 1609.1448261457704.[0m
[32m[I 2024-10-13 07:13:50,294][0m Trial 703 finished with value: 1658.4634221853157 and parameters: {'depth': 9, 'learning_rate': 0.033406916702751845, 'iterations': 2889, 'l2_leaf_reg': 0.0009335675353428354, 'border_count': 82, 'bagging_temperature': 0.7012663164865239, 'random_strength': 6.35801317137981, 'grow_policy': 'Lossguide', 'min_data_in_leaf': 321, 'max_leaves': 188}. Best is trial 14 with value: 1609.1448261457704.[0m
[32m[I 2024-10-13 07:13:52,905][0m Trial 704 finished with value: 1783.656606361998 and parameters: {'depth': 3, 'learning_rate': 0.019747677465869216, 'iterations': 2793, 'l2_leaf_reg': 0.0005205951884602124, 'border_count': 71, 'bagging_temperature': 0.7182089017564656, 'random_strength': 6.091237920896903, 'grow_policy': 'Lossguide', 'min_data_in_leaf': 354, 'max_leaves': 180}. Best is trial 14 with value: 1609.1448261457704.[0m
[32m[I 2024-10-13 07:13:55,714][0m Trial 705 finished with value: 1647.981718978349 and parameters: {'depth': 8, 'learning_rate': 0.02617476691762816, 'iterations': 2940, 'l2_leaf_reg': 4.629446025565579e-06, 'border_count': 89, 'bagging_temperature': 0.5823828915428548, 'random_strength': 6.541701768225391, 'grow_policy': 'Lossguide', 'min_data_in_leaf': 877, 'max_leaves': 151}. Best is trial 14 with value: 1609.1448261457704.[0m
[32m[I 2024-10-13 07:13:58,354][0m Trial 706 finished with value: 1682.2261467793971 and parameters: {'depth': 10, 'learning_rate': 0.06758917678579497, 'iterations': 2685, 'l2_leaf_reg': 0.00031428692350452686, 'border_count': 100, 'bagging_temperature': 0.9095232382134398, 'random_strength': 5.672819977668452, 'grow_policy': 'Depthwise', 'min_data_in_leaf': 400}. Best is trial 14 with value: 1609.1448261457704.[0m
[32m[I 2024-10-13 07:14:01,964][0m Trial 707 finished with value: 1866.8146599650674 and parameters: {'depth': 4, 'learning_rate': 0.08518324571319241, 'iterations': 891, 'l2_leaf_reg': 0.11332710296592512, 'border_count': 77, 'bagging_temperature': 0.6685633099387681, 'random_strength': 6.836177704900617, 'grow_policy': 'SymmetricTree', 'min_data_in_leaf': 799}. Best is trial 14 with value: 1609.1448261457704.[0m
[32m[I 2024-10-13 07:14:04,583][0m Trial 708 finished with value: 1678.749326226584 and parameters: {'depth': 7, 'learning_rate': 0.05101059391121332, 'iterations': 2866, 'l2_leaf_reg': 0.0012550574541669555, 'border_count': 84, 'bagging_temperature': 0.6319820866270381, 'random_strength': 7.095513110837736, 'grow_policy': 'Lossguide', 'min_data_in_leaf': 340, 'max_leaves': 209}. Best is trial 14 with value: 1609.1448261457704.[0m
[32m[I 2024-10-13 07:14:07,318][0m Trial 709 finished with value: 1647.1169931370382 and parameters: {'depth': 9, 'learning_rate': 0.03580802530330804, 'iterations': 3000, 'l2_leaf_reg': 0.3354204080656543, 'border_count': 94, 'bagging_temperature': 0.6892607520453908, 'random_strength': 5.92857199642405, 'grow_policy': 'Lossguide', 'min_data_in_leaf': 381, 'max_leaves': 161}. Best is trial 14 with value: 1609.1448261457704.[0m
[32m[I 2024-10-13 07:14:09,868][0m Trial 710 finished with value: 1683.4615053941661 and parameters: {'depth': 3, 'learning_rate': 0.04396049162754265, 'iterations': 2745, 'l2_leaf_reg': 0.0006824575171400783, 'border_count': 81, 'bagging_temperature': 0.6509267101889066, 'random_strength': 5.497333399040236, 'grow_policy': 'Lossguide', 'min_data_in_leaf': 827, 'max_leaves': 174}. Best is trial 14 with value: 1609.1448261457704.[0m
[32m[I 2024-10-13 07:14:12,503][0m Trial 711 finished with value: 2152.4370988476862 and parameters: {'depth': 9, 'learning_rate': 0.1966315632567604, 'iterations': 2831, 'l2_leaf_reg': 9.371589558640634e-05, 'border_count': 59, 'bagging_temperature': 0.7036563042518106, 'random_strength': 7.273159352669212, 'grow_policy': 'Lossguide', 'min_data_in_leaf': 764, 'max_leaves': 166}. Best is trial 14 with value: 1609.1448261457704.[0m
[32m[I 2024-10-13 07:14:15,151][0m Trial 712 finished with value: 1667.3092355838046 and parameters: {'depth': 6, 'learning_rate': 0.030583437685920218, 'iterations': 2929, 'l2_leaf_reg': 0.001871192021182718, 'border_count': 114, 'bagging_temperature': 0.671415768065692, 'random_strength': 6.350078621176974, 'grow_policy': 'Lossguide', 'min_data_in_leaf': 415, 'max_leaves': 154}. Best is trial 14 with value: 1609.1448261457704.[0m
[32m[I 2024-10-13 07:14:17,838][0m Trial 713 finished with value: 1776.384692165457 and parameters: {'depth': 3, 'learning_rate': 0.1479941941575787, 'iterations': 2891, 'l2_leaf_reg': 2.301639250535633e-05, 'border_count': 92, 'bagging_temperature': 0.6044219906893266, 'random_strength': 5.212182623715083, 'grow_policy': 'Lossguide', 'min_data_in_leaf': 368, 'max_leaves': 227}. Best is trial 14 with value: 1609.1448261457704.[0m
[32m[I 2024-10-13 07:14:20,405][0m Trial 714 finished with value: 1824.1897513048223 and parameters: {'depth': 9, 'learning_rate': 0.10789827780157761, 'iterations': 2807, 'l2_leaf_reg': 0.7402121495563949, 'border_count': 73, 'bagging_temperature': 0.7205373418002995, 'random_strength': 6.58308692706681, 'grow_policy': 'Lossguide', 'min_data_in_leaf': 310, 'max_leaves': 137}. Best is trial 14 with value: 1609.1448261457704.[0m
[32m[I 2024-10-13 07:14:23,245][0m Trial 715 finished with value: 1662.1638011804412 and parameters: {'depth': 3, 'learning_rate': 0.02238292598210774, 'iterations': 2700, 'l2_leaf_reg': 0.0004993649032170104, 'border_count': 86, 'bagging_temperature': 0.6827763029685046, 'random_strength': 6.910573969096843, 'grow_policy': 'Lossguide', 'min_data_in_leaf': 66, 'max_leaves': 127}. Best is trial 14 with value: 1609.1448261457704.[0m
[32m[I 2024-10-13 07:14:25,688][0m Trial 716 finished with value: 1712.4762335827124 and parameters: {'depth': 3, 'learning_rate': 0.04069016693235916, 'iterations': 2633, 'l2_leaf_reg': 4.378892745394309e-05, 'border_count': 98, 'bagging_temperature': 0.6342282920417336, 'random_strength': 6.120782580621869, 'grow_policy': 'Lossguide', 'min_data_in_leaf': 386, 'max_leaves': 184}. Best is trial 14 with value: 1609.1448261457704.[0m
[32m[I 2024-10-13 07:14:28,417][0m Trial 717 finished with value: 1661.891491070567 and parameters: {'depth': 10, 'learning_rate': 0.02570789818985214, 'iterations': 2942, 'l2_leaf_reg': 0.00015036330295247448, 'border_count': 80, 'bagging_temperature': 0.6577693549611661, 'random_strength': 5.830726900573849, 'grow_policy': 'Lossguide', 'min_data_in_leaf': 855, 'max_leaves': 145}. Best is trial 14 with value: 1609.1448261457704.[0m
[32m[I 2024-10-13 07:14:43,683][0m Trial 718 finished with value: 1838.1475655686918 and parameters: {'depth': 8, 'learning_rate': 0.03387086406413898, 'iterations': 1573, 'l2_leaf_reg': 0.0010174541860870404, 'border_count': 88, 'bagging_temperature': 0.7005840907329126, 'random_strength': 6.728564153659925, 'grow_policy': 'SymmetricTree', 'min_data_in_leaf': 943}. Best is trial 14 with value: 1609.1448261457704.[0m
[32m[I 2024-10-13 07:14:44,520][0m Trial 719 finished with value: 1927.455970971332 and parameters: {'depth': 9, 'learning_rate': 0.24109480058826555, 'iterations': 417, 'l2_leaf_reg': 0.00029701337414472616, 'border_count': 68, 'bagging_temperature': 0.24675604217199065, 'random_strength': 6.432553518486831, 'grow_policy': 'Lossguide', 'min_data_in_leaf': 239, 'max_leaves': 160}. Best is trial 14 with value: 1609.1448261457704.[0m
[32m[I 2024-10-13 07:14:47,120][0m Trial 720 finished with value: 1854.675521735268 and parameters: {'depth': 3, 'learning_rate': 0.017036753747240542, 'iterations': 2850, 'l2_leaf_reg': 0.0016658566306140985, 'border_count': 46, 'bagging_temperature': 0.7476929831790025, 'random_strength': 7.441342387494242, 'grow_policy': 'Lossguide', 'min_data_in_leaf': 349, 'max_leaves': 176}. Best is trial 14 with value: 1609.1448261457704.[0m
[32m[I 2024-10-13 07:14:48,694][0m Trial 721 finished with value: 1687.3212347635397 and parameters: {'depth': 4, 'learning_rate': 0.02878180370814654, 'iterations': 1411, 'l2_leaf_reg': 0.0028170741872812198, 'border_count': 76, 'bagging_temperature': 0.6742271970222287, 'random_strength': 5.54781461853948, 'grow_policy': 'Lossguide', 'min_data_in_leaf': 407, 'max_leaves': 171}. Best is trial 14 with value: 1609.1448261457704.[0m
[32m[I 2024-10-13 07:14:51,236][0m Trial 722 finished with value: 1707.756365506001 and parameters: {'depth': 8, 'learning_rate': 0.054546030679318624, 'iterations': 2752, 'l2_leaf_reg': 0.15119423981907795, 'border_count': 106, 'bagging_temperature': 0.6168120628966594, 'random_strength': 6.175641392370458, 'grow_policy': 'Lossguide', 'min_data_in_leaf': 786, 'max_leaves': 149}. Best is trial 14 with value: 1609.1448261457704.[0m
[32m[I 2024-10-13 07:14:53,937][0m Trial 723 finished with value: 5894.240193475962 and parameters: {'depth': 3, 'learning_rate': 0.00015433094711027125, 'iterations': 3000, 'l2_leaf_reg': 0.5004714604427214, 'border_count': 85, 'bagging_temperature': 0.6476431003208603, 'random_strength': 5.725738978475119, 'grow_policy': 'Lossguide', 'min_data_in_leaf': 330, 'max_leaves': 140}. Best is trial 14 with value: 1609.1448261457704.[0m
[32m[I 2024-10-13 07:14:56,572][0m Trial 724 finished with value: 1678.07517111775 and parameters: {'depth': 9, 'learning_rate': 0.04057056933271278, 'iterations': 2904, 'l2_leaf_reg': 0.0007443175256741754, 'border_count': 93, 'bagging_temperature': 0.7224601577279797, 'random_strength': 7.1512531211813135, 'grow_policy': 'Lossguide', 'min_data_in_leaf': 812, 'max_leaves': 167}. Best is trial 14 with value: 1609.1448261457704.[0m
[32m[I 2024-10-13 07:14:59,070][0m Trial 725 finished with value: 1653.6549619646282 and parameters: {'depth': 10, 'learning_rate': 0.034781125109441424, 'iterations': 2570, 'l2_leaf_reg': 0.0004225588834315601, 'border_count': 80, 'bagging_temperature': 0.6812368275240687, 'random_strength': 5.925064407826199, 'grow_policy': 'Lossguide', 'min_data_in_leaf': 299, 'max_leaves': 156}. Best is trial 14 with value: 1609.1448261457704.[0m
[32m[I 2024-10-13 07:15:01,689][0m Trial 726 finished with value: 1739.3540474940694 and parameters: {'depth': 7, 'learning_rate': 0.00761433360439164, 'iterations': 2809, 'l2_leaf_reg': 0.0014206863051363827, 'border_count': 90, 'bagging_temperature': 0.6600734950327851, 'random_strength': 6.5694390108910525, 'grow_policy': 'Lossguide', 'min_data_in_leaf': 741, 'max_leaves': 146}. Best is trial 14 with value: 1609.1448261457704.[0m
[32m[I 2024-10-13 07:15:04,395][0m Trial 727 finished with value: 1809.9922414660537 and parameters: {'depth': 3, 'learning_rate': 0.047129589369475436, 'iterations': 2942, 'l2_leaf_reg': 0.00023700611999556942, 'border_count': 73, 'bagging_temperature': 0.6987858280029688, 'random_strength': 6.891296873088518, 'grow_policy': 'Lossguide', 'min_data_in_leaf': 391, 'max_leaves': 134}. Best is trial 14 with value: 1609.1448261457704.[0m
[32m[I 2024-10-13 07:15:05,805][0m Trial 728 finished with value: 1719.2917277141698 and parameters: {'depth': 9, 'learning_rate': 0.025376434463933433, 'iterations': 1109, 'l2_leaf_reg': 0.003071793308965888, 'border_count': 101, 'bagging_temperature': 0.6343936790436218, 'random_strength': 5.332629755058395, 'grow_policy': 'Depthwise', 'min_data_in_leaf': 837}. Best is trial 14 with value: 1609.1448261457704.[0m
[32m[I 2024-10-13 07:15:08,425][0m Trial 729 finished with value: 1655.917759872686 and parameters: {'depth': 9, 'learning_rate': 0.020474119971072447, 'iterations': 2853, 'l2_leaf_reg': 1.1666981107078267, 'border_count': 84, 'bagging_temperature': 0.7347680277930976, 'random_strength': 6.268481279232499, 'grow_policy': 'Lossguide', 'min_data_in_leaf': 364, 'max_leaves': 162}. Best is trial 14 with value: 1609.1448261457704.[0m
[32m[I 2024-10-13 07:15:11,034][0m Trial 730 finished with value: 1669.2575954034573 and parameters: {'depth': 3, 'learning_rate': 0.036523067445656775, 'iterations': 2733, 'l2_leaf_reg': 0.00044801124251947006, 'border_count': 96, 'bagging_temperature': 0.6885510278369363, 'random_strength': 5.976314001158016, 'grow_policy': 'Lossguide', 'min_data_in_leaf': 417, 'max_leaves': 152}. Best is trial 14 with value: 1609.1448261457704.[0m
[32m[I 2024-10-13 07:15:35,154][0m Trial 731 finished with value: 1905.2324880326996 and parameters: {'depth': 8, 'learning_rate': 0.02941484518080767, 'iterations': 2659, 'l2_leaf_reg': 0.0009952891186672606, 'border_count': 89, 'bagging_temperature': 0.6637458684649618, 'random_strength': 5.137097780731037, 'grow_policy': 'SymmetricTree', 'min_data_in_leaf': 121}. Best is trial 14 with value: 1609.1448261457704.[0m
[32m[I 2024-10-13 07:15:37,837][0m Trial 732 finished with value: 1683.2013402811908 and parameters: {'depth': 3, 'learning_rate': 0.04387353648637105, 'iterations': 2893, 'l2_leaf_reg': 0.0023525271431247266, 'border_count': 78, 'bagging_temperature': 0.7039556305339613, 'random_strength': 6.983091438770104, 'grow_policy': 'Lossguide', 'min_data_in_leaf': 814, 'max_leaves': 181}. Best is trial 14 with value: 1609.1448261457704.[0m
[32m[I 2024-10-13 07:15:40,421][0m Trial 733 finished with value: 1646.1470252784331 and parameters: {'depth': 4, 'learning_rate': 0.03309234469749184, 'iterations': 2781, 'l2_leaf_reg': 0.2281257372746159, 'border_count': 84, 'bagging_temperature': 0.6124262073442471, 'random_strength': 6.6653206721681, 'grow_policy': 'Lossguide', 'min_data_in_leaf': 321, 'max_leaves': 142}. Best is trial 14 with value: 1609.1448261457704.[0m
[32m[I 2024-10-13 07:15:43,214][0m Trial 734 finished with value: 1713.6396782779927 and parameters: {'depth': 9, 'learning_rate': 0.01180097002835451, 'iterations': 2948, 'l2_leaf_reg': 0.0007044468202067867, 'border_count': 130, 'bagging_temperature': 0.6445146955274311, 'random_strength': 6.337083787242777, 'grow_policy': 'Lossguide', 'min_data_in_leaf': 268, 'max_leaves': 171}. Best is trial 14 with value: 1609.1448261457704.[0m
[32m[I 2024-10-13 07:15:45,066][0m Trial 735 finished with value: 1771.420583649896 and parameters: {'depth': 5, 'learning_rate': 0.023523386912991783, 'iterations': 1758, 'l2_leaf_reg': 2.3393550272654995, 'border_count': 69, 'bagging_temperature': 0.7645684097650737, 'random_strength': 7.747741635446257, 'grow_policy': 'Lossguide', 'min_data_in_leaf': 348, 'max_leaves': 190}. Best is trial 14 with value: 1609.1448261457704.[0m
[32m[I 2024-10-13 07:15:47,746][0m Trial 736 finished with value: 1655.6036234888932 and parameters: {'depth': 3, 'learning_rate': 0.02841477083514683, 'iterations': 2846, 'l2_leaf_reg': 0.00033863643726858247, 'border_count': 91, 'bagging_temperature': 0.6772697048512659, 'random_strength': 5.74353903776761, 'grow_policy': 'Lossguide', 'min_data_in_leaf': 381, 'max_leaves': 163}. Best is trial 14 with value: 1609.1448261457704.[0m
[32m[I 2024-10-13 07:15:50,324][0m Trial 737 finished with value: 1656.1265731429437 and parameters: {'depth': 10, 'learning_rate': 0.037682474985821966, 'iterations': 2705, 'l2_leaf_reg': 0.0012777959036280606, 'border_count': 79, 'bagging_temperature': 0.414037637814061, 'random_strength': 6.045972630491364, 'grow_policy': 'Lossguide', 'min_data_in_leaf': 852, 'max_leaves': 158}. Best is trial 14 with value: 1609.1448261457704.[0m
[32m[I 2024-10-13 07:15:53,117][0m Trial 738 finished with value: 1676.9408813720584 and parameters: {'depth': 9, 'learning_rate': 0.059203449400833066, 'iterations': 2895, 'l2_leaf_reg': 0.36785663739875124, 'border_count': 86, 'bagging_temperature': 0.5442599428236828, 'random_strength': 7.225691112676324, 'grow_policy': 'Lossguide', 'min_data_in_leaf': 407, 'max_leaves': 246}. Best is trial 14 with value: 1609.1448261457704.[0m
[32m[I 2024-10-13 07:15:55,699][0m Trial 739 finished with value: 1676.6917612178474 and parameters: {'depth': 3, 'learning_rate': 0.03149290427732164, 'iterations': 2789, 'l2_leaf_reg': 0.00017201916358015648, 'border_count': 97, 'bagging_temperature': 0.5861982222518822, 'random_strength': 5.469142955902361, 'grow_policy': 'Lossguide', 'min_data_in_leaf': 367, 'max_leaves': 152}. Best is trial 14 with value: 1609.1448261457704.[0m
[32m[I 2024-10-13 07:15:58,409][0m Trial 740 finished with value: 1758.5311129147356 and parameters: {'depth': 8, 'learning_rate': 0.04867230471089032, 'iterations': 2951, 'l2_leaf_reg': 1.7067157647076589e-06, 'border_count': 74, 'bagging_temperature': 0.7020545683601541, 'random_strength': 6.526674965559538, 'grow_policy': 'Lossguide', 'min_data_in_leaf': 887, 'max_leaves': 176}. Best is trial 14 with value: 1609.1448261457704.[0m
[32m[I 2024-10-13 07:16:01,035][0m Trial 741 finished with value: 1788.7051213683253 and parameters: {'depth': 7, 'learning_rate': 0.018118418132467236, 'iterations': 2846, 'l2_leaf_reg': 0.0005685757254871647, 'border_count': 65, 'bagging_temperature': 0.7224345856164395, 'random_strength': 6.789231024104355, 'grow_policy': 'Lossguide', 'min_data_in_leaf': 290, 'max_leaves': 239}. Best is trial 14 with value: 1609.1448261457704.[0m
[32m[I 2024-10-13 07:16:03,770][0m Trial 742 finished with value: 1669.2906023129603 and parameters: {'depth': 9, 'learning_rate': 0.03964098512091369, 'iterations': 3000, 'l2_leaf_reg': 9.867078642099982e-06, 'border_count': 82, 'bagging_temperature': 0.6574208545427583, 'random_strength': 7.985782886130848, 'grow_policy': 'Lossguide', 'min_data_in_leaf': 794, 'max_leaves': 137}. Best is trial 14 with value: 1609.1448261457704.[0m
[32m[I 2024-10-13 07:16:10,367][0m Trial 743 finished with value: 1868.1324360073363 and parameters: {'depth': 4, 'learning_rate': 0.02481226380625951, 'iterations': 1859, 'l2_leaf_reg': 1.0751026119034967e-06, 'border_count': 92, 'bagging_temperature': 0.09142447965212208, 'random_strength': 6.214329142942636, 'grow_policy': 'SymmetricTree', 'min_data_in_leaf': 392}. Best is trial 14 with value: 1609.1448261457704.[0m
[32m[I 2024-10-13 07:16:12,806][0m Trial 744 finished with value: 1673.3492750571734 and parameters: {'depth': 3, 'learning_rate': 0.22221038125299591, 'iterations': 2599, 'l2_leaf_reg': 3.938360710941607, 'border_count': 87, 'bagging_temperature': 0.6263809109113447, 'random_strength': 7.529317123476765, 'grow_policy': 'Lossguide', 'min_data_in_leaf': 420, 'max_leaves': 122}. Best is trial 14 with value: 1609.1448261457704.[0m
[32m[I 2024-10-13 07:16:15,488][0m Trial 745 finished with value: 1679.4642663885816 and parameters: {'depth': 8, 'learning_rate': 0.03267311675926395, 'iterations': 2910, 'l2_leaf_reg': 0.6258121645540475, 'border_count': 76, 'bagging_temperature': 0.15687039461422925, 'random_strength': 2.6416379910819754, 'grow_policy': 'Lossguide', 'min_data_in_leaf': 344, 'max_leaves': 168}. Best is trial 14 with value: 1609.1448261457704.[0m
[32m[I 2024-10-13 07:16:18,064][0m Trial 746 finished with value: 1683.1168263166314 and parameters: {'depth': 3, 'learning_rate': 0.027307904472691387, 'iterations': 2738, 'l2_leaf_reg': 0.0021464535124272187, 'border_count': 82, 'bagging_temperature': 0.6833601899843245, 'random_strength': 6.430433064310671, 'grow_policy': 'Lossguide', 'min_data_in_leaf': 829, 'max_leaves': 231}. Best is trial 14 with value: 1609.1448261457704.[0m
[32m[I 2024-10-13 07:16:20,792][0m Trial 747 finished with value: 1693.9904131159044 and parameters: {'depth': 10, 'learning_rate': 0.044916642094659794, 'iterations': 2947, 'l2_leaf_reg': 1.630869425086274e-05, 'border_count': 101, 'bagging_temperature': 0.6649393308756216, 'random_strength': 6.99784728387454, 'grow_policy': 'Lossguide', 'min_data_in_leaf': 519, 'max_leaves': 131}. Best is trial 14 with value: 1609.1448261457704.[0m
[32m[I 2024-10-13 07:16:23,595][0m Trial 748 finished with value: 1677.5768175053095 and parameters: {'depth': 9, 'learning_rate': 0.021465278554171612, 'iterations': 3000, 'l2_leaf_reg': 5.077441277867758e-07, 'border_count': 94, 'bagging_temperature': 0.7116278722237608, 'random_strength': 5.635165741587961, 'grow_policy': 'Lossguide', 'min_data_in_leaf': 868, 'max_leaves': 145}. Best is trial 14 with value: 1609.1448261457704.[0m
[32m[I 2024-10-13 07:16:26,250][0m Trial 749 finished with value: 1712.559800416673 and parameters: {'depth': 8, 'learning_rate': 0.16291644584208523, 'iterations': 2805, 'l2_leaf_reg': 6.371811590615588, 'border_count': 89, 'bagging_temperature': 0.4817030143413298, 'random_strength': 6.712763530745095, 'grow_policy': 'Depthwise', 'min_data_in_leaf': 760}. Best is trial 14 with value: 1609.1448261457704.[0m
[32m[I 2024-10-13 07:16:28,975][0m Trial 750 finished with value: 1640.693792973524 and parameters: {'depth': 7, 'learning_rate': 0.03632197863931364, 'iterations': 2856, 'l2_leaf_reg': 6.298342343862014e-06, 'border_count': 77, 'bagging_temperature': 0.6874122995773613, 'random_strength': 6.020831487323354, 'grow_policy': 'Lossguide', 'min_data_in_leaf': 331, 'max_leaves': 165}. Best is trial 14 with value: 1609.1448261457704.[0m
