[32m[I 2024-10-13 07:29:11,472][0m Trial 951 finished with value: 2026.4053196394452 and parameters: {'depth': 5, 'learning_rate': 0.056136179487303664, 'iterations': 2773, 'l2_leaf_reg': 0.001065625161790424, 'border_count': 58, 'bagging_temperature': 0.70802524302838, 'random_strength': 6.534848698859918, 'grow_policy': 'Lossguide', 'min_data_in_leaf': 335, 'max_leaves': 49}. Best is trial 14 with value: 1609.1448261457704.[0m
[32m[I 2024-10-13 07:29:15,783][0m Trial 952 finished with value: 1601.161645470865 and parameters: {'depth': 4, 'learning_rate': 0.039735103699803334, 'iterations': 2711, 'l2_leaf_reg': 3.342934398186416e-07, 'border_count': 79, 'bagging_temperature': 0.6756718242933649, 'random_strength': 6.753066802433239, 'grow_policy': 'Lossguide', 'min_data_in_leaf': 20, 'max_leaves': 170}. Best is trial 952 with value: 1601.161645470865.[0m
[32m[I 2024-10-13 07:29:20,710][0m Trial 953 finished with value: 1736.921868605782 and parameters: {'depth': 4, 'learning_rate': 0.050027425144254685, 'iterations': 2667, 'l2_leaf_reg': 2.097229540378109e-07, 'border_count': 87, 'bagging_temperature': 0.6224511382505064, 'random_strength': 6.836220399370569, 'grow_policy': 'Lossguide', 'min_data_in_leaf': 7, 'max_leaves': 171}. Best is trial 952 with value: 1601.161645470865.[0m
[32m[I 2024-10-13 07:29:23,285][0m Trial 954 finished with value: 1656.4238708225394 and parameters: {'depth': 4, 'learning_rate': 0.041972225079543735, 'iterations': 2569, 'l2_leaf_reg': 2.90803132582512e-07, 'border_count': 96, 'bagging_temperature': 0.6492846178934636, 'random_strength': 8.128406460139317, 'grow_policy': 'Lossguide', 'min_data_in_leaf': 88, 'max_leaves': 176}. Best is trial 952 with value: 1601.161645470865.[0m
[32m[I 2024-10-13 07:29:25,772][0m Trial 955 finished with value: 1693.7230935244554 and parameters: {'depth': 5, 'learning_rate': 0.015782984146886885, 'iterations': 2613, 'l2_leaf_reg': 8.99281708827581e-08, 'border_count': 82, 'bagging_temperature': 0.6682165501552794, 'random_strength': 6.950544651758943, 'grow_policy': 'Lossguide', 'min_data_in_leaf': 511, 'max_leaves': 179}. Best is trial 952 with value: 1601.161645470865.[0m
[32m[I 2024-10-13 07:29:28,429][0m Trial 956 finished with value: 1671.6994330691564 and parameters: {'depth': 4, 'learning_rate': 0.019464970964571067, 'iterations': 2701, 'l2_leaf_reg': 4.2762150875788017e-07, 'border_count': 91, 'bagging_temperature': 0.6363051888122492, 'random_strength': 6.741097089488689, 'grow_policy': 'Lossguide', 'min_data_in_leaf': 97, 'max_leaves': 188}. Best is trial 952 with value: 1601.161645470865.[0m
[32m[I 2024-10-13 07:29:30,902][0m Trial 957 finished with value: 1741.0274420491987 and parameters: {'depth': 5, 'learning_rate': 0.06438087502608356, 'iterations': 2656, 'l2_leaf_reg': 2.7841622854522897e-07, 'border_count': 105, 'bagging_temperature': 0.4958530540180704, 'random_strength': 7.085747638551013, 'grow_policy': 'Lossguide', 'min_data_in_leaf': 93, 'max_leaves': 172}. Best is trial 952 with value: 1601.161645470865.[0m
[32m[I 2024-10-13 07:29:40,724][0m Trial 958 finished with value: 1768.8705514715305 and parameters: {'depth': 4, 'learning_rate': 0.03155463400740769, 'iterations': 2721, 'l2_leaf_reg': 2.1801204798687016e-07, 'border_count': 86, 'bagging_temperature': 0.6070447097413643, 'random_strength': 7.483608564806217, 'grow_policy': 'SymmetricTree', 'min_data_in_leaf': 178}. Best is trial 952 with value: 1601.161645470865.[0m
[32m[I 2024-10-13 07:29:43,202][0m Trial 959 finished with value: 1705.9429834227547 and parameters: {'depth': 4, 'learning_rate': 0.09430012429562955, 'iterations': 2692, 'l2_leaf_reg': 3.320762963317234e-07, 'border_count': 80, 'bagging_temperature': 0.6711079434832878, 'random_strength': 7.193179835522099, 'grow_policy': 'Lossguide', 'min_data_in_leaf': 547, 'max_leaves': 135}. Best is trial 952 with value: 1601.161645470865.[0m
[32m[I 2024-10-13 07:29:45,560][0m Trial 960 finished with value: 1707.6699593016897 and parameters: {'depth': 4, 'learning_rate': 0.040178653935598795, 'iterations': 2511, 'l2_leaf_reg': 1.784705882111053e-07, 'border_count': 98, 'bagging_temperature': 0.6551012485612769, 'random_strength': 8.603462876727061, 'grow_policy': 'Lossguide', 'min_data_in_leaf': 191, 'max_leaves': 33}. Best is trial 952 with value: 1601.161645470865.[0m
[32m[I 2024-10-13 07:29:48,023][0m Trial 961 finished with value: 1699.8837242146017 and parameters: {'depth': 5, 'learning_rate': 0.028089718832129865, 'iterations': 2590, 'l2_leaf_reg': 4.677951723049653e-07, 'border_count': 160, 'bagging_temperature': 0.6234486324997466, 'random_strength': 6.670989891177596, 'grow_policy': 'Lossguide', 'min_data_in_leaf': 137, 'max_leaves': 182}. Best is trial 952 with value: 1601.161645470865.[0m
[32m[I 2024-10-13 07:29:51,991][0m Trial 962 finished with value: 1538.6926608910835 and parameters: {'depth': 3, 'learning_rate': 0.05047906694130267, 'iterations': 2742, 'l2_leaf_reg': 1.2163572846286836e-07, 'border_count': 74, 'bagging_temperature': 0.6869226846473089, 'random_strength': 6.894647587995953, 'grow_policy': 'Lossguide', 'min_data_in_leaf': 12, 'max_leaves': 174}. Best is trial 962 with value: 1538.6926608910835.[0m
[32m[I 2024-10-13 07:29:55,770][0m Trial 963 finished with value: 1617.0490503378273 and parameters: {'depth': 3, 'learning_rate': 0.05748129710399813, 'iterations': 2765, 'l2_leaf_reg': 1.2480013413419505e-07, 'border_count': 66, 'bagging_temperature': 0.7555497673031941, 'random_strength': 6.901970205335613, 'grow_policy': 'Lossguide', 'min_data_in_leaf': 20, 'max_leaves': 174}. Best is trial 962 with value: 1538.6926608910835.[0m
[32m[I 2024-10-13 07:29:59,275][0m Trial 964 finished with value: 1738.4072291806633 and parameters: {'depth': 3, 'learning_rate': 0.07283819838627996, 'iterations': 2771, 'l2_leaf_reg': 7.15837184540348e-08, 'border_count': 63, 'bagging_temperature': 0.7656459792899907, 'random_strength': 7.246776681012113, 'grow_policy': 'Lossguide', 'min_data_in_leaf': 41, 'max_leaves': 183}. Best is trial 962 with value: 1538.6926608910835.[0m
[32m[I 2024-10-13 07:30:01,932][0m Trial 965 finished with value: 1949.8230430651663 and parameters: {'depth': 3, 'learning_rate': 0.08086873684695296, 'iterations': 2773, 'l2_leaf_reg': 5.37639233411434e-08, 'border_count': 61, 'bagging_temperature': 0.7593405224660298, 'random_strength': 7.014145193301802, 'grow_policy': 'Lossguide', 'min_data_in_leaf': 112, 'max_leaves': 173}. Best is trial 962 with value: 1538.6926608910835.[0m
[32m[I 2024-10-13 07:30:06,032][0m Trial 966 finished with value: 1801.6622596177967 and parameters: {'depth': 3, 'learning_rate': 0.060362684060695844, 'iterations': 2761, 'l2_leaf_reg': 1.6144894983764383e-07, 'border_count': 60, 'bagging_temperature': 0.7514618347088274, 'random_strength': 7.0486907095210025, 'grow_policy': 'Lossguide', 'min_data_in_leaf': 6, 'max_leaves': 177}. Best is trial 962 with value: 1538.6926608910835.[0m
[32m[I 2024-10-13 07:30:09,619][0m Trial 967 finished with value: 1732.0195882179046 and parameters: {'depth': 3, 'learning_rate': 0.05741563293769696, 'iterations': 2824, 'l2_leaf_reg': 1.6275857177457392e-07, 'border_count': 66, 'bagging_temperature': 0.7466396659816895, 'random_strength': 7.350018788976595, 'grow_policy': 'Lossguide', 'min_data_in_leaf': 36, 'max_leaves': 179}. Best is trial 962 with value: 1538.6926608910835.[0m
[32m[I 2024-10-13 07:30:13,506][0m Trial 968 finished with value: 1893.9184266596205 and parameters: {'depth': 3, 'learning_rate': 0.06487286990045119, 'iterations': 2828, 'l2_leaf_reg': 2.157942110235996e-07, 'border_count': 59, 'bagging_temperature': 0.7742533004068782, 'random_strength': 6.916632255890875, 'grow_policy': 'Lossguide', 'min_data_in_leaf': 19, 'max_leaves': 179}. Best is trial 962 with value: 1538.6926608910835.[0m
[32m[I 2024-10-13 07:30:17,299][0m Trial 969 finished with value: 1708.067910665576 and parameters: {'depth': 4, 'learning_rate': 0.050458862898013594, 'iterations': 2743, 'l2_leaf_reg': 1.0306644276298532e-07, 'border_count': 65, 'bagging_temperature': 0.7648589020738175, 'random_strength': 6.831761764716225, 'grow_policy': 'Lossguide', 'min_data_in_leaf': 47, 'max_leaves': 184}. Best is trial 962 with value: 1538.6926608910835.[0m
[32m[I 2024-10-13 07:30:20,814][0m Trial 970 finished with value: 1695.3335310311406 and parameters: {'depth': 3, 'learning_rate': 0.11073234593073351, 'iterations': 2794, 'l2_leaf_reg': 1.0335336075068909e-07, 'border_count': 67, 'bagging_temperature': 0.7825359978784652, 'random_strength': 7.165049284227738, 'grow_policy': 'Lossguide', 'min_data_in_leaf': 34, 'max_leaves': 189}. Best is trial 962 with value: 1538.6926608910835.[0m
[32m[I 2024-10-13 07:30:30,040][0m Trial 971 finished with value: 1983.4058949222672 and parameters: {'depth': 3, 'learning_rate': 0.05931601816215853, 'iterations': 2843, 'l2_leaf_reg': 9.727678533651029e-08, 'border_count': 71, 'bagging_temperature': 0.7371108325508239, 'random_strength': 7.143800240369082, 'grow_policy': 'SymmetricTree', 'min_data_in_leaf': 77}. Best is trial 962 with value: 1538.6926608910835.[0m
[32m[I 2024-10-13 07:30:34,502][0m Trial 972 finished with value: 1901.9607610243834 and parameters: {'depth': 4, 'learning_rate': 0.052557971144052675, 'iterations': 2730, 'l2_leaf_reg': 1.1980777385788308e-07, 'border_count': 55, 'bagging_temperature': 0.727700369845178, 'random_strength': 6.813662213884597, 'grow_policy': 'Lossguide', 'min_data_in_leaf': 15, 'max_leaves': 174}. Best is trial 962 with value: 1538.6926608910835.[0m
[32m[I 2024-10-13 07:30:37,252][0m Trial 973 finished with value: 1771.922198159976 and parameters: {'depth': 3, 'learning_rate': 0.07972007820952409, 'iterations': 2800, 'l2_leaf_reg': 1.7727423102206833e-08, 'border_count': 69, 'bagging_temperature': 0.7440548919571388, 'random_strength': 6.946397031039231, 'grow_policy': 'Lossguide', 'min_data_in_leaf': 482, 'max_leaves': 185}. Best is trial 962 with value: 1538.6926608910835.[0m
[32m[I 2024-10-13 07:30:41,296][0m Trial 974 finished with value: 1619.132746480861 and parameters: {'depth': 3, 'learning_rate': 0.0512533100990054, 'iterations': 2742, 'l2_leaf_reg': 6.132682677740007e-07, 'border_count': 68, 'bagging_temperature': 0.7227601008179009, 'random_strength': 6.764349274317914, 'grow_policy': 'Depthwise', 'min_data_in_leaf': 26}. Best is trial 962 with value: 1538.6926608910835.[0m
[32m[I 2024-10-13 07:30:45,299][0m Trial 975 finished with value: 2130.9340804493 and parameters: {'depth': 3, 'learning_rate': 0.06850012247365747, 'iterations': 2837, 'l2_leaf_reg': 1.5877163558559677e-07, 'border_count': 53, 'bagging_temperature': 0.7412324708900817, 'random_strength': 6.924261076308305, 'grow_policy': 'Depthwise', 'min_data_in_leaf': 6}. Best is trial 962 with value: 1538.6926608910835.[0m
[32m[I 2024-10-13 07:30:48,889][0m Trial 976 finished with value: 1851.313793911196 and parameters: {'depth': 3, 'learning_rate': 0.0664114363617566, 'iterations': 2762, 'l2_leaf_reg': 3.2085296806091266e-08, 'border_count': 54, 'bagging_temperature': 0.7960894237217977, 'random_strength': 6.729332306645454, 'grow_policy': 'Depthwise', 'min_data_in_leaf': 48}. Best is trial 962 with value: 1538.6926608910835.[0m
[32m[I 2024-10-13 07:30:52,592][0m Trial 977 finished with value: 1766.7369955628865 and parameters: {'depth': 3, 'learning_rate': 0.06104879028119914, 'iterations': 2743, 'l2_leaf_reg': 5.4098900669505835e-08, 'border_count': 63, 'bagging_temperature': 0.8048021268098517, 'random_strength': 6.997010076900379, 'grow_policy': 'Depthwise', 'min_data_in_leaf': 35}. Best is trial 962 with value: 1538.6926608910835.[0m
[32m[I 2024-10-13 07:30:56,431][0m Trial 978 finished with value: 1765.260095424722 and parameters: {'depth': 3, 'learning_rate': 0.05357794547291026, 'iterations': 2849, 'l2_leaf_reg': 3.0900924462167273e-07, 'border_count': 62, 'bagging_temperature': 0.780831917967693, 'random_strength': 6.725787419076096, 'grow_policy': 'Lossguide', 'min_data_in_leaf': 23, 'max_leaves': 125}. Best is trial 962 with value: 1538.6926608910835.[0m
[32m[I 2024-10-13 07:31:00,558][0m Trial 979 finished with value: 1612.7086101735315 and parameters: {'depth': 3, 'learning_rate': 0.055807934496184076, 'iterations': 2797, 'l2_leaf_reg': 1.3410102110765213e-07, 'border_count': 64, 'bagging_temperature': 0.7590329480297024, 'random_strength': 7.371799485098868, 'grow_policy': 'Depthwise', 'min_data_in_leaf': 14}. Best is trial 962 with value: 1538.6926608910835.[0m
[32m[I 2024-10-13 07:31:02,427][0m Trial 980 finished with value: 1660.0699058631594 and parameters: {'depth': 3, 'learning_rate': 0.06192493484139094, 'iterations': 965, 'l2_leaf_reg': 1.555901130741868e-07, 'border_count': 64, 'bagging_temperature': 0.7408828807263278, 'random_strength': 7.769393313449847, 'grow_policy': 'Depthwise', 'min_data_in_leaf': 20}. Best is trial 962 with value: 1538.6926608910835.[0m
[32m[I 2024-10-13 07:31:06,557][0m Trial 981 finished with value: 1869.9801845226652 and parameters: {'depth': 3, 'learning_rate': 0.08622494254156514, 'iterations': 2860, 'l2_leaf_reg': 1.8371105115525513e-07, 'border_count': 56, 'bagging_temperature': 0.7787831693791599, 'random_strength': 7.378860868130873, 'grow_policy': 'Depthwise', 'min_data_in_leaf': 30}. Best is trial 962 with value: 1538.6926608910835.[0m
[32m[I 2024-10-13 07:31:10,846][0m Trial 982 finished with value: 1723.6088126393415 and parameters: {'depth': 3, 'learning_rate': 0.053456119584397194, 'iterations': 2796, 'l2_leaf_reg': 7.085136487574956e-08, 'border_count': 61, 'bagging_temperature': 0.8102579264521244, 'random_strength': 7.65133697657488, 'grow_policy': 'Depthwise', 'min_data_in_leaf': 12}. Best is trial 962 with value: 1538.6926608910835.[0m
[32m[I 2024-10-13 07:31:14,211][0m Trial 983 finished with value: 2056.187870387107 and parameters: {'depth': 3, 'learning_rate': 0.06525921191967003, 'iterations': 2860, 'l2_leaf_reg': 1.1037590105280888e-07, 'border_count': 48, 'bagging_temperature': 0.7642073741930099, 'random_strength': 7.366177168321165, 'grow_policy': 'Depthwise', 'min_data_in_leaf': 72}. Best is trial 962 with value: 1538.6926608910835.[0m
[32m[I 2024-10-13 07:31:18,786][0m Trial 984 finished with value: 1696.8844516344975 and parameters: {'depth': 3, 'learning_rate': 0.08121039199879183, 'iterations': 2806, 'l2_leaf_reg': 3.966788605788809e-08, 'border_count': 60, 'bagging_temperature': 0.7981332591926916, 'random_strength': 7.365283876594223, 'grow_policy': 'Depthwise', 'min_data_in_leaf': 1}. Best is trial 962 with value: 1538.6926608910835.[0m
[32m[I 2024-10-13 07:31:22,891][0m Trial 985 finished with value: 1857.546272345798 and parameters: {'depth': 3, 'learning_rate': 0.056847772629456034, 'iterations': 2883, 'l2_leaf_reg': 1.6964162432661425e-07, 'border_count': 57, 'bagging_temperature': 0.7842164936455976, 'random_strength': 7.097615123227549, 'grow_policy': 'Depthwise', 'min_data_in_leaf': 32}. Best is trial 962 with value: 1538.6926608910835.[0m
[32m[I 2024-10-13 07:31:26,830][0m Trial 986 finished with value: 1680.4179830637843 and parameters: {'depth': 3, 'learning_rate': 0.07547665536616809, 'iterations': 2794, 'l2_leaf_reg': 1.310704856872823e-07, 'border_count': 65, 'bagging_temperature': 0.7532589254568087, 'random_strength': 7.5532799163171855, 'grow_policy': 'Depthwise', 'min_data_in_leaf': 54}. Best is trial 962 with value: 1538.6926608910835.[0m
[32m[I 2024-10-13 07:31:31,372][0m Trial 987 finished with value: 1706.8973921377924 and parameters: {'depth': 4, 'learning_rate': 0.0704203437901405, 'iterations': 2739, 'l2_leaf_reg': 8.863855115340987e-08, 'border_count': 65, 'bagging_temperature': 0.7474649354522489, 'random_strength': 7.521472263451747, 'grow_policy': 'Depthwise', 'min_data_in_leaf': 27}. Best is trial 962 with value: 1538.6926608910835.[0m
[32m[I 2024-10-13 07:31:35,182][0m Trial 988 finished with value: 1702.8547579205049 and parameters: {'depth': 3, 'learning_rate': 0.050219673153568636, 'iterations': 2870, 'l2_leaf_reg': 7.188284702887512e-08, 'border_count': 67, 'bagging_temperature': 0.7704845045862108, 'random_strength': 7.953162286074173, 'grow_policy': 'Depthwise', 'min_data_in_leaf': 44}. Best is trial 962 with value: 1538.6926608910835.[0m
[32m[I 2024-10-13 07:31:38,613][0m Trial 989 finished with value: 1717.8782855548368 and parameters: {'depth': 3, 'learning_rate': 0.0566427805229563, 'iterations': 2804, 'l2_leaf_reg': 1.119951126340263e-07, 'border_count': 66, 'bagging_temperature': 0.7333088533296257, 'random_strength': 7.2174800625968825, 'grow_policy': 'Depthwise', 'min_data_in_leaf': 63}. Best is trial 962 with value: 1538.6926608910835.[0m
[32m[I 2024-10-13 07:31:43,059][0m Trial 990 finished with value: 2082.6474546797713 and parameters: {'depth': 3, 'learning_rate': 0.04804569716947, 'iterations': 2886, 'l2_leaf_reg': 3.852964363816848e-08, 'border_count': 52, 'bagging_temperature': 0.8192963289343012, 'random_strength': 7.171264514442798, 'grow_policy': 'Depthwise', 'min_data_in_leaf': 2}. Best is trial 962 with value: 1538.6926608910835.[0m
[32m[I 2024-10-13 07:31:53,674][0m Trial 991 finished with value: 1967.9558081686612 and parameters: {'depth': 4, 'learning_rate': 0.04956407248438792, 'iterations': 2727, 'l2_leaf_reg': 3.047472106464246e-07, 'border_count': 69, 'bagging_temperature': 0.776960520689796, 'random_strength': 7.367855844901764, 'grow_policy': 'SymmetricTree', 'min_data_in_leaf': 49}. Best is trial 962 with value: 1538.6926608910835.[0m
[32m[I 2024-10-13 07:31:57,584][0m Trial 992 finished with value: 1807.5293133962682 and parameters: {'depth': 3, 'learning_rate': 0.07131010599734981, 'iterations': 2817, 'l2_leaf_reg': 9.146953887107487e-08, 'border_count': 60, 'bagging_temperature': 0.7608303374405335, 'random_strength': 7.77487106377734, 'grow_policy': 'Depthwise', 'min_data_in_leaf': 24}. Best is trial 962 with value: 1538.6926608910835.[0m
[32m[I 2024-10-13 07:32:01,071][0m Trial 993 finished with value: 1879.80875341773 and parameters: {'depth': 3, 'learning_rate': 0.04759149277887628, 'iterations': 2760, 'l2_leaf_reg': 6.662215490874895e-08, 'border_count': 57, 'bagging_temperature': 0.7519061315203204, 'random_strength': 7.04524168934961, 'grow_policy': 'Depthwise', 'min_data_in_leaf': 52}. Best is trial 962 with value: 1538.6926608910835.[0m
[32m[I 2024-10-13 07:32:04,404][0m Trial 994 finished with value: 1593.5677726379975 and parameters: {'depth': 3, 'learning_rate': 0.09339406046892548, 'iterations': 2876, 'l2_leaf_reg': 2.8739321598496045e-07, 'border_count': 70, 'bagging_temperature': 0.726047894329233, 'random_strength': 7.476083373755795, 'grow_policy': 'Depthwise', 'min_data_in_leaf': 62}. Best is trial 962 with value: 1538.6926608910835.[0m
[32m[I 2024-10-13 07:32:08,475][0m Trial 995 finished with value: 1598.5403327172266 and parameters: {'depth': 3, 'learning_rate': 0.09512803346501311, 'iterations': 2914, 'l2_leaf_reg': 2.4186260154818615e-07, 'border_count': 68, 'bagging_temperature': 0.7606990402746944, 'random_strength': 7.776399550665523, 'grow_policy': 'Depthwise', 'min_data_in_leaf': 4}. Best is trial 962 with value: 1538.6926608910835.[0m
[32m[I 2024-10-13 07:32:12,519][0m Trial 996 finished with value: 1764.7480281849175 and parameters: {'depth': 3, 'learning_rate': 0.12557099073178818, 'iterations': 2930, 'l2_leaf_reg': 3.812120224507581e-07, 'border_count': 58, 'bagging_temperature': 0.804040195181686, 'random_strength': 7.949633914638488, 'grow_policy': 'Depthwise', 'min_data_in_leaf': 18}. Best is trial 962 with value: 1538.6926608910835.[0m
[32m[I 2024-10-13 07:32:15,777][0m Trial 997 finished with value: 1733.684871863266 and parameters: {'depth': 3, 'learning_rate': 0.10310293780819729, 'iterations': 2882, 'l2_leaf_reg': 2.3748687082808749e-07, 'border_count': 63, 'bagging_temperature': 0.7932254905862534, 'random_strength': 8.018742302129537, 'grow_policy': 'Depthwise', 'min_data_in_leaf': 63}. Best is trial 962 with value: 1538.6926608910835.[0m
[32m[I 2024-10-13 07:32:19,630][0m Trial 998 finished with value: 1616.249799494959 and parameters: {'depth': 3, 'learning_rate': 0.09038282931872624, 'iterations': 2902, 'l2_leaf_reg': 2.1475704425685048e-07, 'border_count': 68, 'bagging_temperature': 0.7446477919490095, 'random_strength': 7.855635141031314, 'grow_policy': 'Depthwise', 'min_data_in_leaf': 20}. Best is trial 962 with value: 1538.6926608910835.[0m
[32m[I 2024-10-13 07:32:23,591][0m Trial 999 finished with value: 1607.543172140232 and parameters: {'depth': 3, 'learning_rate': 0.09627337899569187, 'iterations': 2878, 'l2_leaf_reg': 1.4224521868324543e-07, 'border_count': 65, 'bagging_temperature': 0.7895635767318795, 'random_strength': 7.775064486433029, 'grow_policy': 'Depthwise', 'min_data_in_leaf': 6}. Best is trial 962 with value: 1538.6926608910835.[0m
CatBoost: RMSE = 1538.6927
      Model         RMSE
0  CatBoost  1538.692661

Best hyperparameters for CatBoost:
{'depth': 3, 'learning_rate': 0.05047906694130267, 'iterations': 2742, 'l2_leaf_reg': 1.2163572846286836e-07, 'border_count': 74, 'bagging_temperature': 0.6869226846473089, 'random_strength': 6.894647587995953, 'grow_policy': 'Lossguide', 'min_data_in_leaf': 12, 'max_leaves': 174}
