[32m[I 2024-10-13 07:23:26,990][0m Trial 851 finished with value: 5315.4682274686875 and parameters: {'depth': 8, 'learning_rate': 0.0002413540323032215, 'iterations': 2896, 'l2_leaf_reg': 4.036741739701502e-06, 'border_count': 84, 'bagging_temperature': 0.6996352951919459, 'random_strength': 6.8645095917102275, 'grow_policy': 'Lossguide', 'min_data_in_leaf': 810, 'max_leaves': 137}. Best is trial 14 with value: 1609.1448261457704.[0m
[32m[I 2024-10-13 07:23:29,584][0m Trial 852 finished with value: 4067.843896691046 and parameters: {'depth': 8, 'learning_rate': 0.000523218901763106, 'iterations': 2822, 'l2_leaf_reg': 1.176213930324997e-05, 'border_count': 73, 'bagging_temperature': 0.6451398065780287, 'random_strength': 6.503888458889717, 'grow_policy': 'Lossguide', 'min_data_in_leaf': 429, 'max_leaves': 148}. Best is trial 14 with value: 1609.1448261457704.[0m
[32m[I 2024-10-13 07:23:32,386][0m Trial 853 finished with value: 1655.9414074942947 and parameters: {'depth': 9, 'learning_rate': 0.10429448336604569, 'iterations': 2946, 'l2_leaf_reg': 0.834347858539791, 'border_count': 90, 'bagging_temperature': 0.684361762119764, 'random_strength': 5.923391442188276, 'grow_policy': 'Lossguide', 'min_data_in_leaf': 858, 'max_leaves': 111}. Best is trial 14 with value: 1609.1448261457704.[0m
[32m[I 2024-10-13 07:23:34,910][0m Trial 854 finished with value: 1648.596971405299 and parameters: {'depth': 9, 'learning_rate': 0.2954004882579772, 'iterations': 2652, 'l2_leaf_reg': 0.002536315175465223, 'border_count': 81, 'bagging_temperature': 0.7237047518543005, 'random_strength': 0.7398763095290235, 'grow_policy': 'Lossguide', 'min_data_in_leaf': 368, 'max_leaves': 224}. Best is trial 14 with value: 1609.1448261457704.[0m
[32m[I 2024-10-13 07:23:37,587][0m Trial 855 finished with value: 1696.1915768471126 and parameters: {'depth': 10, 'learning_rate': 0.02778022197782313, 'iterations': 2869, 'l2_leaf_reg': 0.0022463712184044755, 'border_count': 95, 'bagging_temperature': 0.6644979393368036, 'random_strength': 6.298824219035816, 'grow_policy': 'Lossguide', 'min_data_in_leaf': 341, 'max_leaves': 144}. Best is trial 14 with value: 1609.1448261457704.[0m
[32m[I 2024-10-13 07:24:15,716][0m Trial 856 finished with value: 2005.462866148543 and parameters: {'depth': 9, 'learning_rate': 0.03416055636264544, 'iterations': 2764, 'l2_leaf_reg': 2.736263358567086e-05, 'border_count': 87, 'bagging_temperature': 0.7041534702219244, 'random_strength': 5.692227096992121, 'grow_policy': 'SymmetricTree', 'min_data_in_leaf': 286}. Best is trial 14 with value: 1609.1448261457704.[0m
[32m[I 2024-10-13 07:24:18,064][0m Trial 857 finished with value: 1668.5774470236763 and parameters: {'depth': 7, 'learning_rate': 0.019704015896161324, 'iterations': 2529, 'l2_leaf_reg': 0.0012379840204115296, 'border_count': 77, 'bagging_temperature': 0.6282063718794462, 'random_strength': 4.626045525059462, 'grow_policy': 'Lossguide', 'min_data_in_leaf': 769, 'max_leaves': 153}. Best is trial 14 with value: 1609.1448261457704.[0m
[32m[I 2024-10-13 07:24:20,788][0m Trial 858 finished with value: 1707.778327629078 and parameters: {'depth': 8, 'learning_rate': 0.011991788558992765, 'iterations': 2947, 'l2_leaf_reg': 0.17513130921553896, 'border_count': 102, 'bagging_temperature': 0.6530313698302029, 'random_strength': 4.8389179748891005, 'grow_policy': 'Lossguide', 'min_data_in_leaf': 318, 'max_leaves': 250}. Best is trial 14 with value: 1609.1448261457704.[0m
[32m[I 2024-10-13 07:24:23,273][0m Trial 859 finished with value: 1902.0133180488856 and parameters: {'depth': 6, 'learning_rate': 0.025752994590756313, 'iterations': 2718, 'l2_leaf_reg': 0.003674156762704383, 'border_count': 62, 'bagging_temperature': 0.6805798601285842, 'random_strength': 5.451404137409754, 'grow_policy': 'Lossguide', 'min_data_in_leaf': 825, 'max_leaves': 160}. Best is trial 14 with value: 1609.1448261457704.[0m
[32m[I 2024-10-13 07:24:25,926][0m Trial 860 finished with value: 1703.6745671254998 and parameters: {'depth': 9, 'learning_rate': 0.12185861384920996, 'iterations': 2819, 'l2_leaf_reg': 2.2278779907005914e-07, 'border_count': 83, 'bagging_temperature': 0.7015280966764924, 'random_strength': 6.972093126143767, 'grow_policy': 'Lossguide', 'min_data_in_leaf': 410, 'max_leaves': 235}. Best is trial 14 with value: 1609.1448261457704.[0m
[32m[I 2024-10-13 07:24:28,848][0m Trial 861 finished with value: 1782.21175271018 and parameters: {'depth': 9, 'learning_rate': 0.04360124584528025, 'iterations': 3000, 'l2_leaf_reg': 0.04925729450407621, 'border_count': 69, 'bagging_temperature': 0.6682943830193212, 'random_strength': 7.4409044880552795, 'grow_policy': 'Depthwise', 'min_data_in_leaf': 391}. Best is trial 14 with value: 1609.1448261457704.[0m
[32m[I 2024-10-13 07:24:31,527][0m Trial 862 finished with value: 1772.3082494500368 and parameters: {'depth': 8, 'learning_rate': 0.16213773450821736, 'iterations': 2895, 'l2_leaf_reg': 1.7236894358719876, 'border_count': 90, 'bagging_temperature': 0.7290696468642498, 'random_strength': 6.638561198106251, 'grow_policy': 'Lossguide', 'min_data_in_leaf': 351, 'max_leaves': 61}. Best is trial 14 with value: 1609.1448261457704.[0m
[32m[I 2024-10-13 07:24:34,187][0m Trial 863 finished with value: 1642.6371370298157 and parameters: {'depth': 4, 'learning_rate': 0.034916678288811676, 'iterations': 2854, 'l2_leaf_reg': 2.998637987263552e-06, 'border_count': 76, 'bagging_temperature': 0.647472824256852, 'random_strength': 7.16526286415828, 'grow_policy': 'Lossguide', 'min_data_in_leaf': 375, 'max_leaves': 165}. Best is trial 14 with value: 1609.1448261457704.[0m
[32m[I 2024-10-13 07:24:36,863][0m Trial 864 finished with value: 1660.4895916036303 and parameters: {'depth': 8, 'learning_rate': 0.031092651027254312, 'iterations': 2942, 'l2_leaf_reg': 4.4732794492661664e-07, 'border_count': 97, 'bagging_temperature': 0.6912756059833424, 'random_strength': 2.896664052849132, 'grow_policy': 'Lossguide', 'min_data_in_leaf': 439, 'max_leaves': 154}. Best is trial 14 with value: 1609.1448261457704.[0m
[32m[I 2024-10-13 07:24:39,402][0m Trial 865 finished with value: 1666.0411552176843 and parameters: {'depth': 10, 'learning_rate': 0.04071907112114193, 'iterations': 2617, 'l2_leaf_reg': 7.58146077690823e-06, 'border_count': 86, 'bagging_temperature': 0.7680171166929949, 'random_strength': 6.155440668406059, 'grow_policy': 'Lossguide', 'min_data_in_leaf': 329, 'max_leaves': 120}. Best is trial 14 with value: 1609.1448261457704.[0m
[32m[I 2024-10-13 07:24:42,021][0m Trial 866 finished with value: 1658.9037042303355 and parameters: {'depth': 10, 'learning_rate': 0.0626458215236046, 'iterations': 2772, 'l2_leaf_reg': 0.2678074765955227, 'border_count': 80, 'bagging_temperature': 0.6229154487247074, 'random_strength': 5.17671566157349, 'grow_policy': 'Lossguide', 'min_data_in_leaf': 840, 'max_leaves': 215}. Best is trial 14 with value: 1609.1448261457704.[0m
[32m[I 2024-10-13 07:24:42,951][0m Trial 867 finished with value: 1777.2903298106642 and parameters: {'depth': 9, 'learning_rate': 0.05107233443925888, 'iterations': 476, 'l2_leaf_reg': 0.0009185774562829363, 'border_count': 93, 'bagging_temperature': 0.7140134323027083, 'random_strength': 5.889340656876528, 'grow_policy': 'Lossguide', 'min_data_in_leaf': 800, 'max_leaves': 206}. Best is trial 14 with value: 1609.1448261457704.[0m
[32m[I 2024-10-13 07:24:45,429][0m Trial 868 finished with value: 1640.5044126405294 and parameters: {'depth': 3, 'learning_rate': 0.023331072169758618, 'iterations': 2676, 'l2_leaf_reg': 0.0005966370098516737, 'border_count': 87, 'bagging_temperature': 0.6671816657848871, 'random_strength': 6.364918039268386, 'grow_policy': 'Lossguide', 'min_data_in_leaf': 368, 'max_leaves': 168}. Best is trial 14 with value: 1609.1448261457704.[0m
[32m[I 2024-10-13 07:24:53,732][0m Trial 869 finished with value: 1781.2636554389223 and parameters: {'depth': 3, 'learning_rate': 0.027638176709295526, 'iterations': 2562, 'l2_leaf_reg': 0.0001361917044833, 'border_count': 72, 'bagging_temperature': 0.6833560250261891, 'random_strength': 6.385170846980903, 'grow_policy': 'SymmetricTree', 'min_data_in_leaf': 384}. Best is trial 14 with value: 1609.1448261457704.[0m
[32m[I 2024-10-13 07:24:56,238][0m Trial 870 finished with value: 1658.6349600348292 and parameters: {'depth': 6, 'learning_rate': 0.03533643510428377, 'iterations': 2657, 'l2_leaf_reg': 2.0252994894532984e-05, 'border_count': 81, 'bagging_temperature': 0.7034158948274452, 'random_strength': 6.466505160606351, 'grow_policy': 'Lossguide', 'min_data_in_leaf': 416, 'max_leaves': 170}. Best is trial 14 with value: 1609.1448261457704.[0m
[32m[I 2024-10-13 07:24:58,690][0m Trial 871 finished with value: 1660.0720391958341 and parameters: {'depth': 5, 'learning_rate': 0.024687548756301202, 'iterations': 2613, 'l2_leaf_reg': 0.481819663232236, 'border_count': 76, 'bagging_temperature': 0.7404083443131882, 'random_strength': 6.258136405454952, 'grow_policy': 'Lossguide', 'min_data_in_leaf': 397, 'max_leaves': 168}. Best is trial 14 with value: 1609.1448261457704.[0m
[32m[I 2024-10-13 07:25:00,454][0m Trial 872 finished with value: 1648.1594007535134 and parameters: {'depth': 9, 'learning_rate': 0.21248163726364827, 'iterations': 1705, 'l2_leaf_reg': 0.000547739757711241, 'border_count': 85, 'bagging_temperature': 0.675336079767781, 'random_strength': 6.622865994782486, 'grow_policy': 'Lossguide', 'min_data_in_leaf': 367, 'max_leaves': 171}. Best is trial 14 with value: 1609.1448261457704.[0m
[32m[I 2024-10-13 07:25:02,850][0m Trial 873 finished with value: 1675.2188332144897 and parameters: {'depth': 8, 'learning_rate': 0.030588657516949815, 'iterations': 2511, 'l2_leaf_reg': 0.0002672407309780912, 'border_count': 80, 'bagging_temperature': 0.635379049962868, 'random_strength': 6.066497277603784, 'grow_policy': 'Lossguide', 'min_data_in_leaf': 359, 'max_leaves': 167}. Best is trial 14 with value: 1609.1448261457704.[0m
[32m[I 2024-10-13 07:25:05,385][0m Trial 874 finished with value: 1639.0674175395568 and parameters: {'depth': 7, 'learning_rate': 0.03841395761690726, 'iterations': 2678, 'l2_leaf_reg': 1.095656289692327e-06, 'border_count': 86, 'bagging_temperature': 0.6646560800620326, 'random_strength': 6.364122607821928, 'grow_policy': 'Lossguide', 'min_data_in_leaf': 378, 'max_leaves': 166}. Best is trial 14 with value: 1609.1448261457704.[0m
[32m[I 2024-10-13 07:25:07,894][0m Trial 875 finished with value: 1678.3055910345936 and parameters: {'depth': 7, 'learning_rate': 0.04387977891096149, 'iterations': 2662, 'l2_leaf_reg': 1.3794967103948893e-06, 'border_count': 88, 'bagging_temperature': 0.6908206915278806, 'random_strength': 6.481311520658956, 'grow_policy': 'Lossguide', 'min_data_in_leaf': 392, 'max_leaves': 200}. Best is trial 14 with value: 1609.1448261457704.[0m
[32m[I 2024-10-13 07:25:10,303][0m Trial 876 finished with value: 1781.8718073055113 and parameters: {'depth': 7, 'learning_rate': 0.05662253902863746, 'iterations': 2572, 'l2_leaf_reg': 9.365318409558165e-07, 'border_count': 73, 'bagging_temperature': 0.6655829529663482, 'random_strength': 6.352199539600136, 'grow_policy': 'Lossguide', 'min_data_in_leaf': 372, 'max_leaves': 165}. Best is trial 14 with value: 1609.1448261457704.[0m
[32m[I 2024-10-13 07:25:12,800][0m Trial 877 finished with value: 1791.0822425580243 and parameters: {'depth': 7, 'learning_rate': 0.048292076472862266, 'iterations': 2661, 'l2_leaf_reg': 6.449137954807446e-07, 'border_count': 67, 'bagging_temperature': 0.7179062654033714, 'random_strength': 6.645254492446865, 'grow_policy': 'Lossguide', 'min_data_in_leaf': 398, 'max_leaves': 161}. Best is trial 14 with value: 1609.1448261457704.[0m
[32m[I 2024-10-13 07:25:15,315][0m Trial 878 finished with value: 1693.8006759772745 and parameters: {'depth': 7, 'learning_rate': 0.04188275623198008, 'iterations': 2685, 'l2_leaf_reg': 5.275018258570871e-07, 'border_count': 83, 'bagging_temperature': 0.6869222100312704, 'random_strength': 6.83164845228461, 'grow_policy': 'Lossguide', 'min_data_in_leaf': 375, 'max_leaves': 162}. Best is trial 14 with value: 1609.1448261457704.[0m
[32m[I 2024-10-13 07:25:17,761][0m Trial 879 finished with value: 1651.7674520248597 and parameters: {'depth': 7, 'learning_rate': 0.037694856840736375, 'iterations': 2608, 'l2_leaf_reg': 9.481276001155542e-07, 'border_count': 79, 'bagging_temperature': 0.30406688139036414, 'random_strength': 6.447348890563662, 'grow_policy': 'Lossguide', 'min_data_in_leaf': 361, 'max_leaves': 166}. Best is trial 14 with value: 1609.1448261457704.[0m
[32m[I 2024-10-13 07:25:20,350][0m Trial 880 finished with value: 1668.3398057666486 and parameters: {'depth': 6, 'learning_rate': 0.03130151461739535, 'iterations': 2721, 'l2_leaf_reg': 1.7811336986808818e-06, 'border_count': 125, 'bagging_temperature': 0.6679874850962355, 'random_strength': 6.251770510593539, 'grow_policy': 'Lossguide', 'min_data_in_leaf': 421, 'max_leaves': 130}. Best is trial 14 with value: 1609.1448261457704.[0m
[32m[I 2024-10-13 07:25:40,093][0m Trial 881 finished with value: 1789.3311236704906 and parameters: {'depth': 7, 'learning_rate': 0.022555926612734797, 'iterations': 2701, 'l2_leaf_reg': 7.686840275338359e-07, 'border_count': 89, 'bagging_temperature': 0.7050139494357881, 'random_strength': 6.466441487017269, 'grow_policy': 'SymmetricTree', 'min_data_in_leaf': 389}. Best is trial 14 with value: 1609.1448261457704.[0m
[32m[I 2024-10-13 07:25:42,491][0m Trial 882 finished with value: 1681.7112444599622 and parameters: {'depth': 7, 'learning_rate': 0.0182991495322901, 'iterations': 2592, 'l2_leaf_reg': 1.204097977608221e-06, 'border_count': 94, 'bagging_temperature': 0.6576051883490377, 'random_strength': 6.740528803205581, 'grow_policy': 'Lossguide', 'min_data_in_leaf': 349, 'max_leaves': 159}. Best is trial 14 with value: 1609.1448261457704.[0m
[32m[I 2024-10-13 07:25:44,822][0m Trial 883 finished with value: 1674.826580025779 and parameters: {'depth': 7, 'learning_rate': 0.026954902491156327, 'iterations': 2496, 'l2_leaf_reg': 9.52760671019897e-07, 'border_count': 76, 'bagging_temperature': 0.7429398420748057, 'random_strength': 6.248450393415781, 'grow_policy': 'Lossguide', 'min_data_in_leaf': 412, 'max_leaves': 47}. Best is trial 14 with value: 1609.1448261457704.[0m
[32m[I 2024-10-13 07:25:47,452][0m Trial 884 finished with value: 1679.0584921438735 and parameters: {'depth': 7, 'learning_rate': 0.07109296082089143, 'iterations': 2689, 'l2_leaf_reg': 2.5433727331427235e-06, 'border_count': 84, 'bagging_temperature': 0.6927136222142216, 'random_strength': 6.619775450674435, 'grow_policy': 'Depthwise', 'min_data_in_leaf': 379}. Best is trial 14 with value: 1609.1448261457704.[0m
[32m[I 2024-10-13 07:25:49,936][0m Trial 885 finished with value: 2524.6232545410817 and parameters: {'depth': 7, 'learning_rate': 0.001733603314417194, 'iterations': 2630, 'l2_leaf_reg': 4.5178786863547667e-07, 'border_count': 90, 'bagging_temperature': 0.7189888422772313, 'random_strength': 6.815974174601125, 'grow_policy': 'Lossguide', 'min_data_in_leaf': 353, 'max_leaves': 165}. Best is trial 14 with value: 1609.1448261457704.[0m
[32m[I 2024-10-13 07:25:52,474][0m Trial 886 finished with value: 1757.2307017117748 and parameters: {'depth': 8, 'learning_rate': 0.037614223639825924, 'iterations': 2720, 'l2_leaf_reg': 1.949431174511578e-06, 'border_count': 71, 'bagging_temperature': 0.6749444271700057, 'random_strength': 6.977836579119158, 'grow_policy': 'Lossguide', 'min_data_in_leaf': 399, 'max_leaves': 194}. Best is trial 14 with value: 1609.1448261457704.[0m
[32m[I 2024-10-13 07:25:54,945][0m Trial 887 finished with value: 1659.2779776093687 and parameters: {'depth': 7, 'learning_rate': 0.05042372434115579, 'iterations': 2640, 'l2_leaf_reg': 2.7406758753354807e-07, 'border_count': 80, 'bagging_temperature': 0.6479492749536993, 'random_strength': 6.149962695008288, 'grow_policy': 'Lossguide', 'min_data_in_leaf': 458, 'max_leaves': 168}. Best is trial 14 with value: 1609.1448261457704.[0m
[32m[I 2024-10-13 07:25:57,517][0m Trial 888 finished with value: 1662.6518182269842 and parameters: {'depth': 7, 'learning_rate': 0.0310785092663011, 'iterations': 2737, 'l2_leaf_reg': 1.47678706562242e-06, 'border_count': 86, 'bagging_temperature': 0.686908612573858, 'random_strength': 6.396766033701917, 'grow_policy': 'Lossguide', 'min_data_in_leaf': 425, 'max_leaves': 159}. Best is trial 14 with value: 1609.1448261457704.[0m
[32m[I 2024-10-13 07:25:59,980][0m Trial 889 finished with value: 1672.1005112773878 and parameters: {'depth': 8, 'learning_rate': 0.03992352549342029, 'iterations': 2566, 'l2_leaf_reg': 3.436453278877549e-06, 'border_count': 99, 'bagging_temperature': 0.7107244309227201, 'random_strength': 6.302962643442049, 'grow_policy': 'Lossguide', 'min_data_in_leaf': 365, 'max_leaves': 137}. Best is trial 14 with value: 1609.1448261457704.[0m
[32m[I 2024-10-13 07:26:02,019][0m Trial 890 finished with value: 1635.027908732929 and parameters: {'depth': 6, 'learning_rate': 0.03362074152421606, 'iterations': 1940, 'l2_leaf_reg': 8.419234555995311e-07, 'border_count': 76, 'bagging_temperature': 0.6646465335002046, 'random_strength': 6.581699372928105, 'grow_policy': 'Lossguide', 'min_data_in_leaf': 381, 'max_leaves': 162}. Best is trial 14 with value: 1609.1448261457704.[0m
[32m[I 2024-10-13 07:26:04,414][0m Trial 891 finished with value: 1901.1718514463062 and parameters: {'depth': 6, 'learning_rate': 0.026895152791666557, 'iterations': 2539, 'l2_leaf_reg': 4.264016127658728e-07, 'border_count': 60, 'bagging_temperature': 0.6456927835299896, 'random_strength': 7.066952500384174, 'grow_policy': 'Lossguide', 'min_data_in_leaf': 411, 'max_leaves': 163}. Best is trial 14 with value: 1609.1448261457704.[0m
[32m[I 2024-10-13 07:26:06,825][0m Trial 892 finished with value: 1789.859757701968 and parameters: {'depth': 6, 'learning_rate': 0.02242301503592511, 'iterations': 2483, 'l2_leaf_reg': 5.837541207387129e-07, 'border_count': 66, 'bagging_temperature': 0.6645489053724196, 'random_strength': 6.771476738106666, 'grow_policy': 'Lossguide', 'min_data_in_leaf': 446, 'max_leaves': 157}. Best is trial 14 with value: 1609.1448261457704.[0m
[32m[I 2024-10-13 07:26:08,671][0m Trial 893 finished with value: 1764.8616955428643 and parameters: {'depth': 6, 'learning_rate': 0.031677136639826395, 'iterations': 1807, 'l2_leaf_reg': 1.9146712305837306e-07, 'border_count': 70, 'bagging_temperature': 0.6404889221673837, 'random_strength': 6.5653190142426, 'grow_policy': 'Lossguide', 'min_data_in_leaf': 405, 'max_leaves': 163}. Best is trial 14 with value: 1609.1448261457704.[0m
[32m[I 2024-10-13 07:26:10,364][0m Trial 894 finished with value: 1727.712889754074 and parameters: {'depth': 5, 'learning_rate': 0.18337522327077135, 'iterations': 1586, 'l2_leaf_reg': 3.93042103750443e-07, 'border_count': 76, 'bagging_temperature': 0.6606356573000582, 'random_strength': 7.29829888683911, 'grow_policy': 'Lossguide', 'min_data_in_leaf': 380, 'max_leaves': 170}. Best is trial 14 with value: 1609.1448261457704.[0m
[32m[I 2024-10-13 07:26:21,273][0m Trial 895 finished with value: 1721.4382233051674 and parameters: {'depth': 5, 'learning_rate': 0.025390779759956628, 'iterations': 2667, 'l2_leaf_reg': 4.137776376121316e-07, 'border_count': 64, 'bagging_temperature': 0.6713499511487168, 'random_strength': 6.761189197014111, 'grow_policy': 'SymmetricTree', 'min_data_in_leaf': 432}. Best is trial 14 with value: 1609.1448261457704.[0m
[32m[I 2024-10-13 07:26:23,788][0m Trial 896 finished with value: 1795.9554323128652 and parameters: {'depth': 7, 'learning_rate': 0.02045320525597969, 'iterations': 2735, 'l2_leaf_reg': 7.593864319134499e-07, 'border_count': 73, 'bagging_temperature': 0.3869918873051804, 'random_strength': 6.933602210173171, 'grow_policy': 'Lossguide', 'min_data_in_leaf': 389, 'max_leaves': 157}. Best is trial 14 with value: 1609.1448261457704.[0m
[32m[I 2024-10-13 07:26:26,236][0m Trial 897 finished with value: 1731.3536163200922 and parameters: {'depth': 6, 'learning_rate': 0.02921581167777589, 'iterations': 2606, 'l2_leaf_reg': 1.2009797107078739e-07, 'border_count': 74, 'bagging_temperature': 0.6416543170381314, 'random_strength': 6.538202424997294, 'grow_policy': 'Lossguide', 'min_data_in_leaf': 386, 'max_leaves': 165}. Best is trial 14 with value: 1609.1448261457704.[0m
[32m[I 2024-10-13 07:26:28,233][0m Trial 898 finished with value: 1682.8831600833905 and parameters: {'depth': 6, 'learning_rate': 0.04640365138712374, 'iterations': 1989, 'l2_leaf_reg': 2.9068154820810436e-07, 'border_count': 78, 'bagging_temperature': 0.6593953110954583, 'random_strength': 7.080670748818735, 'grow_policy': 'Lossguide', 'min_data_in_leaf': 416, 'max_leaves': 160}. Best is trial 14 with value: 1609.1448261457704.[0m
[32m[I 2024-10-13 07:26:30,719][0m Trial 899 finished with value: 1761.7434213103734 and parameters: {'depth': 7, 'learning_rate': 0.0350567920799421, 'iterations': 2653, 'l2_leaf_reg': 5.85777629165107e-07, 'border_count': 69, 'bagging_temperature': 0.6803694894399757, 'random_strength': 6.676395459756115, 'grow_policy': 'Lossguide', 'min_data_in_leaf': 398, 'max_leaves': 172}. Best is trial 14 with value: 1609.1448261457704.[0m
[32m[I 2024-10-13 07:26:33,267][0m Trial 900 finished with value: 1630.2441882966702 and parameters: {'depth': 6, 'learning_rate': 0.03330579538260385, 'iterations': 2763, 'l2_leaf_reg': 7.054591756253078e-07, 'border_count': 80, 'bagging_temperature': 0.6517834166349782, 'random_strength': 6.89843722329963, 'grow_policy': 'Lossguide', 'min_data_in_leaf': 373, 'max_leaves': 104}. Best is trial 14 with value: 1609.1448261457704.[0m
