Optimizing CatBoost...
[32m[I 2024-10-13 06:16:54,798][0m Trial 0 finished with value: 2044.3472820249738 and parameters: {'depth': 13, 'learning_rate': 0.02298873577265282, 'iterations': 1012, 'l2_leaf_reg': 5.569428364127911e-07, 'border_count': 65, 'bagging_temperature': 0.11992384925792365, 'random_strength': 3.778793968510784, 'grow_policy': 'SymmetricTree', 'min_data_in_leaf': 983}. Best is trial 0 with value: 2044.3472820249738.[0m
[32m[I 2024-10-13 06:16:55,667][0m Trial 1 finished with value: 6997.3407966354625 and parameters: {'depth': 9, 'learning_rate': 0.00019242702868255682, 'iterations': 556, 'l2_leaf_reg': 0.09099723607126917, 'border_count': 203, 'bagging_temperature': 0.13348562932729502, 'random_strength': 1.7069112053962587, 'grow_policy': 'Depthwise', 'min_data_in_leaf': 120}. Best is trial 0 with value: 2044.3472820249738.[0m
[32m[I 2024-10-13 06:20:54,950][0m Trial 2 finished with value: 4006.802712477605 and parameters: {'depth': 13, 'learning_rate': 0.0004940496569080095, 'iterations': 1922, 'l2_leaf_reg': 0.14759603776000432, 'border_count': 165, 'bagging_temperature': 0.6530381842855804, 'random_strength': 3.896640258270639, 'grow_policy': 'SymmetricTree', 'min_data_in_leaf': 2}. Best is trial 0 with value: 2044.3472820249738.[0m
[32m[I 2024-10-13 06:20:55,256][0m Trial 3 finished with value: 1954.1821542850425 and parameters: {'depth': 9, 'learning_rate': 0.08766822700441994, 'iterations': 102, 'l2_leaf_reg': 6.491432117526511e-07, 'border_count': 193, 'bagging_temperature': 0.48418749324859445, 'random_strength': 5.110538309152334, 'grow_policy': 'Depthwise', 'min_data_in_leaf': 476}. Best is trial 3 with value: 1954.1821542850425.[0m
[32m[I 2024-10-13 06:21:07,355][0m Trial 4 finished with value: 1769.7935608534378 and parameters: {'depth': 6, 'learning_rate': 0.01974132731835971, 'iterations': 2482, 'l2_leaf_reg': 9.355772132927425e-05, 'border_count': 148, 'bagging_temperature': 0.09693834815364233, 'random_strength': 9.59625312655707, 'grow_policy': 'SymmetricTree', 'min_data_in_leaf': 874}. Best is trial 4 with value: 1769.7935608534378.[0m
[32m[I 2024-10-13 06:21:08,203][0m Trial 5 finished with value: 4450.270570356181 and parameters: {'depth': 13, 'learning_rate': 0.0030437816140872556, 'iterations': 404, 'l2_leaf_reg': 1.6723203940948935e-06, 'border_count': 16, 'bagging_temperature': 0.17828450696651243, 'random_strength': 7.829874514919537, 'grow_policy': 'Lossguide', 'min_data_in_leaf': 592, 'max_leaves': 173}. Best is trial 4 with value: 1769.7935608534378.[0m
[32m[I 2024-10-13 06:21:10,420][0m Trial 6 finished with value: 6068.917281717669 and parameters: {'depth': 4, 'learning_rate': 0.0001795154513301433, 'iterations': 2196, 'l2_leaf_reg': 0.003216535068180419, 'border_count': 228, 'bagging_temperature': 0.7551131120477976, 'random_strength': 3.9245495984506085, 'grow_policy': 'Depthwise', 'min_data_in_leaf': 194}. Best is trial 4 with value: 1769.7935608534378.[0m
[32m[I 2024-10-13 06:21:12,732][0m Trial 7 finished with value: 2284.712368294002 and parameters: {'depth': 3, 'learning_rate': 0.0029633353529708644, 'iterations': 2375, 'l2_leaf_reg': 1.0301141527619628, 'border_count': 245, 'bagging_temperature': 0.5165843727150671, 'random_strength': 9.512468690805377, 'grow_policy': 'Depthwise', 'min_data_in_leaf': 213}. Best is trial 4 with value: 1769.7935608534378.[0m
[32m[I 2024-10-13 06:21:14,471][0m Trial 8 finished with value: 2703.9100357741067 and parameters: {'depth': 5, 'learning_rate': 0.002432114965217358, 'iterations': 1637, 'l2_leaf_reg': 0.5704522663190776, 'border_count': 125, 'bagging_temperature': 0.5682401424683158, 'random_strength': 8.329463806686352, 'grow_policy': 'Lossguide', 'min_data_in_leaf': 518, 'max_leaves': 196}. Best is trial 4 with value: 1769.7935608534378.[0m
[32m[I 2024-10-13 06:21:16,393][0m Trial 9 finished with value: 4675.534695841374 and parameters: {'depth': 8, 'learning_rate': 0.0006495587045697765, 'iterations': 1062, 'l2_leaf_reg': 0.00044017742674718136, 'border_count': 34, 'bagging_temperature': 0.9956979664719334, 'random_strength': 4.641290745246947, 'grow_policy': 'Depthwise', 'min_data_in_leaf': 29}. Best is trial 4 with value: 1769.7935608534378.[0m
[32m[I 2024-10-13 06:21:30,457][0m Trial 10 finished with value: 1678.8606404049797 and parameters: {'depth': 6, 'learning_rate': 0.026117569169414802, 'iterations': 2951, 'l2_leaf_reg': 1.174745051189056e-08, 'border_count': 110, 'bagging_temperature': 0.32136846260220175, 'random_strength': 7.234798743735522, 'grow_policy': 'SymmetricTree', 'min_data_in_leaf': 985}. Best is trial 10 with value: 1678.8606404049797.[0m
[32m[I 2024-10-13 06:21:44,890][0m Trial 11 finished with value: 1716.5981540193723 and parameters: {'depth': 6, 'learning_rate': 0.027236095254613183, 'iterations': 2958, 'l2_leaf_reg': 1.2232730653085975e-08, 'border_count': 122, 'bagging_temperature': 0.25783187293343, 'random_strength': 7.80796999746392, 'grow_policy': 'SymmetricTree', 'min_data_in_leaf': 982}. Best is trial 10 with value: 1678.8606404049797.[0m
[32m[I 2024-10-13 06:22:02,050][0m Trial 12 finished with value: 1811.0482892649056 and parameters: {'depth': 7, 'learning_rate': 0.24001584120046254, 'iterations': 2916, 'l2_leaf_reg': 1.9388357208518137e-08, 'border_count': 96, 'bagging_temperature': 0.3553087623859411, 'random_strength': 6.685880550731148, 'grow_policy': 'SymmetricTree', 'min_data_in_leaf': 735}. Best is trial 10 with value: 1678.8606404049797.[0m
[32m[I 2024-10-13 06:23:12,669][0m Trial 13 finished with value: 2017.0467754674241 and parameters: {'depth': 11, 'learning_rate': 0.019718545232938856, 'iterations': 2679, 'l2_leaf_reg': 1.0338867044784177e-08, 'border_count': 107, 'bagging_temperature': 0.32436321225104303, 'random_strength': 6.506213928930101, 'grow_policy': 'SymmetricTree', 'min_data_in_leaf': 997}. Best is trial 10 with value: 1678.8606404049797.[0m
[32m[I 2024-10-13 06:23:25,043][0m Trial 14 finished with value: 1609.1448261457704 and parameters: {'depth': 5, 'learning_rate': 0.10697913326965215, 'iterations': 2997, 'l2_leaf_reg': 1.2853946893771481e-05, 'border_count': 79, 'bagging_temperature': 0.3130248643194158, 'random_strength': 6.546540209772072, 'grow_policy': 'SymmetricTree', 'min_data_in_leaf': 784}. Best is trial 14 with value: 1609.1448261457704.[0m
[32m[I 2024-10-13 06:23:31,523][0m Trial 15 finished with value: 2057.427502481897 and parameters: {'depth': 3, 'learning_rate': 0.09604276403837393, 'iterations': 1971, 'l2_leaf_reg': 9.923171430405378e-06, 'border_count': 63, 'bagging_temperature': 0.0025914087294628407, 'random_strength': 0.0751447895019659, 'grow_policy': 'SymmetricTree', 'min_data_in_leaf': 718}. Best is trial 14 with value: 1609.1448261457704.[0m
[32m[I 2024-10-13 06:23:33,994][0m Trial 16 finished with value: 1888.9018740788824 and parameters: {'depth': 5, 'learning_rate': 0.28861032479361726, 'iterations': 2718, 'l2_leaf_reg': 0.005518996167003763, 'border_count': 72, 'bagging_temperature': 0.36736731394033173, 'random_strength': 6.228514711616736, 'grow_policy': 'Lossguide', 'min_data_in_leaf': 797, 'max_leaves': 31}. Best is trial 14 with value: 1609.1448261457704.[0m
[32m[I 2024-10-13 06:24:09,897][0m Trial 17 finished with value: 1935.429576634498 and parameters: {'depth': 10, 'learning_rate': 0.06900277827385635, 'iterations': 1493, 'l2_leaf_reg': 1.5336186009684655e-05, 'border_count': 90, 'bagging_temperature': 0.2563263936843897, 'random_strength': 5.6574839903849385, 'grow_policy': 'SymmetricTree', 'min_data_in_leaf': 371}. Best is trial 14 with value: 1609.1448261457704.[0m
[32m[I 2024-10-13 06:24:24,081][0m Trial 18 finished with value: 1727.2126642984945 and parameters: {'depth': 7, 'learning_rate': 0.007878294349081385, 'iterations': 2454, 'l2_leaf_reg': 1.3756044218663758e-07, 'border_count': 43, 'bagging_temperature': 0.43206454115489096, 'random_strength': 2.3481169302112566, 'grow_policy': 'SymmetricTree', 'min_data_in_leaf': 837}. Best is trial 14 with value: 1609.1448261457704.[0m
[32m[I 2024-10-13 06:24:33,525][0m Trial 19 finished with value: 3409.673393791885 and parameters: {'depth': 5, 'learning_rate': 0.008630992826779918, 'iterations': 2955, 'l2_leaf_reg': 6.836144395631684, 'border_count': 1, 'bagging_temperature': 0.7915055835744012, 'random_strength': 7.18506844637125, 'grow_policy': 'SymmetricTree', 'min_data_in_leaf': 640}. Best is trial 14 with value: 1609.1448261457704.[0m
[32m[I 2024-10-13 06:24:35,689][0m Trial 20 finished with value: 1711.6285348668825 and parameters: {'depth': 7, 'learning_rate': 0.04816068182269649, 'iterations': 2209, 'l2_leaf_reg': 7.7225337905047e-06, 'border_count': 153, 'bagging_temperature': 0.2490623943106853, 'random_strength': 8.691439132535677, 'grow_policy': 'Lossguide', 'min_data_in_leaf': 892, 'max_leaves': 63}. Best is trial 14 with value: 1609.1448261457704.[0m
[32m[I 2024-10-13 06:24:37,848][0m Trial 21 finished with value: 1699.3681059788792 and parameters: {'depth': 7, 'learning_rate': 0.04766568481487802, 'iterations': 2115, 'l2_leaf_reg': 8.236369367400737e-06, 'border_count': 154, 'bagging_temperature': 0.25838373206188336, 'random_strength': 8.660821957734782, 'grow_policy': 'Lossguide', 'min_data_in_leaf': 893, 'max_leaves': 53}. Best is trial 14 with value: 1609.1448261457704.[0m
[32m[I 2024-10-13 06:24:40,420][0m Trial 22 finished with value: 1720.1315478365343 and parameters: {'depth': 15, 'learning_rate': 0.11580842210632214, 'iterations': 2729, 'l2_leaf_reg': 0.00013839377005606023, 'border_count': 179, 'bagging_temperature': 0.4107266858218739, 'random_strength': 8.808149244541715, 'grow_policy': 'Lossguide', 'min_data_in_leaf': 891, 'max_leaves': 106}. Best is trial 14 with value: 1609.1448261457704.[0m
[32m[I 2024-10-13 06:24:42,364][0m Trial 23 finished with value: 1715.0539074278988 and parameters: {'depth': 8, 'learning_rate': 0.034405655728951, 'iterations': 1903, 'l2_leaf_reg': 1.410707402812505e-07, 'border_count': 145, 'bagging_temperature': 0.0063812898149147035, 'random_strength': 7.376634610370586, 'grow_policy': 'Lossguide', 'min_data_in_leaf': 758, 'max_leaves': 109}. Best is trial 14 with value: 1609.1448261457704.[0m
[32m[I 2024-10-13 06:24:43,988][0m Trial 24 finished with value: 1727.933068654161 and parameters: {'depth': 4, 'learning_rate': 0.1457100288761568, 'iterations': 1468, 'l2_leaf_reg': 0.0011484318508208306, 'border_count': 112, 'bagging_temperature': 0.2964417733328173, 'random_strength': 5.8024458545131115, 'grow_policy': 'Lossguide', 'min_data_in_leaf': 664, 'max_leaves': 247}. Best is trial 14 with value: 1609.1448261457704.[0m
[32m[I 2024-10-13 06:24:57,719][0m Trial 25 finished with value: 1808.1722874968184 and parameters: {'depth': 6, 'learning_rate': 0.009893132542944485, 'iterations': 2721, 'l2_leaf_reg': 1.9866171375929716e-05, 'border_count': 84, 'bagging_temperature': 0.18288468538078595, 'random_strength': 7.144552599347758, 'grow_policy': 'SymmetricTree', 'min_data_in_leaf': 916}. Best is trial 14 with value: 1609.1448261457704.[0m
[32m[I 2024-10-13 06:24:59,827][0m Trial 26 finished with value: 1702.3314688201117 and parameters: {'depth': 4, 'learning_rate': 0.04500256445275832, 'iterations': 2150, 'l2_leaf_reg': 1.0618122398680534e-07, 'border_count': 139, 'bagging_temperature': 0.5847268875449332, 'random_strength': 9.714557613685859, 'grow_policy': 'Lossguide', 'min_data_in_leaf': 811, 'max_leaves': 85}. Best is trial 14 with value: 1609.1448261457704.[0m
[32m[I 2024-10-13 06:25:13,877][0m Trial 27 finished with value: 2135.095266487861 and parameters: {'depth': 8, 'learning_rate': 0.165224724995157, 'iterations': 2598, 'l2_leaf_reg': 1.5641023912175544e-06, 'border_count': 50, 'bagging_temperature': 0.43808591206402314, 'random_strength': 8.250695563046985, 'grow_policy': 'SymmetricTree', 'min_data_in_leaf': 926}. Best is trial 14 with value: 1609.1448261457704.[0m
[32m[I 2024-10-13 06:25:15,356][0m Trial 28 finished with value: 1885.0190285683072 and parameters: {'depth': 11, 'learning_rate': 0.011907302778518397, 'iterations': 1220, 'l2_leaf_reg': 7.679928141623195e-05, 'border_count': 170, 'bagging_temperature': 0.2068096085370329, 'random_strength': 5.162272824777407, 'grow_policy': 'Lossguide', 'min_data_in_leaf': 363, 'max_leaves': 148}. Best is trial 14 with value: 1609.1448261457704.[0m
[32m[I 2024-10-13 06:25:23,212][0m Trial 29 finished with value: 1656.0544345619846 and parameters: {'depth': 6, 'learning_rate': 0.04691419496039824, 'iterations': 1694, 'l2_leaf_reg': 0.013614920209205775, 'border_count': 105, 'bagging_temperature': 0.10543008010313115, 'random_strength': 9.06478707137567, 'grow_policy': 'SymmetricTree', 'min_data_in_leaf': 962}. Best is trial 14 with value: 1609.1448261457704.[0m
[32m[I 2024-10-13 06:25:26,537][0m Trial 30 finished with value: 2173.782639577631 and parameters: {'depth': 5, 'learning_rate': 0.005347602626115028, 'iterations': 692, 'l2_leaf_reg': 0.04039678012673325, 'border_count': 73, 'bagging_temperature': 0.08487490413965959, 'random_strength': 9.065711921565812, 'grow_policy': 'SymmetricTree', 'min_data_in_leaf': 994}. Best is trial 14 with value: 1609.1448261457704.[0m
[32m[I 2024-10-13 06:25:34,809][0m Trial 31 finished with value: 1876.936367816716 and parameters: {'depth': 6, 'learning_rate': 0.062382255100120194, 'iterations': 1619, 'l2_leaf_reg': 0.013273202780785694, 'border_count': 104, 'bagging_temperature': 0.0808394126375806, 'random_strength': 9.96945301712482, 'grow_policy': 'SymmetricTree', 'min_data_in_leaf': 942}. Best is trial 14 with value: 1609.1448261457704.[0m
[32m[I 2024-10-13 06:25:43,217][0m Trial 32 finished with value: 1888.4198141309266 and parameters: {'depth': 7, 'learning_rate': 0.021340810352297773, 'iterations': 1288, 'l2_leaf_reg': 0.0003966086206353034, 'border_count': 129, 'bagging_temperature': 0.14527233827029112, 'random_strength': 8.046011834994541, 'grow_policy': 'SymmetricTree', 'min_data_in_leaf': 808}. Best is trial 14 with value: 1609.1448261457704.[0m
[32m[I 2024-10-13 06:26:00,483][0m Trial 33 finished with value: 1866.6661248462035 and parameters: {'depth': 8, 'learning_rate': 0.037455411416250015, 'iterations': 1772, 'l2_leaf_reg': 3.8038124382148714e-06, 'border_count': 83, 'bagging_temperature': 0.32413460923319387, 'random_strength': 9.111767598557863, 'grow_policy': 'SymmetricTree', 'min_data_in_leaf': 858}. Best is trial 14 with value: 1609.1448261457704.[0m
[32m[I 2024-10-13 06:26:30,643][0m Trial 34 finished with value: 2013.7374919941296 and parameters: {'depth': 9, 'learning_rate': 0.06519053133060988, 'iterations': 2359, 'l2_leaf_reg': 4.006831864710373e-05, 'border_count': 113, 'bagging_temperature': 0.22759457566879449, 'random_strength': 7.518922984603656, 'grow_policy': 'SymmetricTree', 'min_data_in_leaf': 927}. Best is trial 14 with value: 1609.1448261457704.[0m
[32m[I 2024-10-13 06:26:41,071][0m Trial 35 finished with value: 1700.9502253349092 and parameters: {'depth': 6, 'learning_rate': 0.014518320706404943, 'iterations': 1996, 'l2_leaf_reg': 3.699315581962711e-07, 'border_count': 194, 'bagging_temperature': 0.13712558573554795, 'random_strength': 6.850134261432614, 'grow_policy': 'SymmetricTree', 'min_data_in_leaf': 689}. Best is trial 14 with value: 1609.1448261457704.[0m
[32m[I 2024-10-13 06:26:42,167][0m Trial 36 finished with value: 1735.798029761206 and parameters: {'depth': 10, 'learning_rate': 0.1442723033672031, 'iterations': 762, 'l2_leaf_reg': 0.0013075342897731282, 'border_count': 160, 'bagging_temperature': 0.053109366380289735, 'random_strength': 6.119184440711162, 'grow_policy': 'Depthwise', 'min_data_in_leaf': 761}. Best is trial 14 with value: 1609.1448261457704.[0m
[32m[I 2024-10-13 06:26:52,098][0m Trial 37 finished with value: 1849.220540021079 and parameters: {'depth': 4, 'learning_rate': 0.2047613804414903, 'iterations': 2837, 'l2_leaf_reg': 0.028624811345198276, 'border_count': 133, 'bagging_temperature': 0.3753798662388456, 'random_strength': 4.502616367896032, 'grow_policy': 'SymmetricTree', 'min_data_in_leaf': 853}. Best is trial 14 with value: 1609.1448261457704.[0m
[32m[I 2024-10-13 06:26:54,500][0m Trial 38 finished with value: 1720.3786412868265 and parameters: {'depth': 5, 'learning_rate': 0.09384525618259397, 'iterations': 2526, 'l2_leaf_reg': 6.550985818390383e-07, 'border_count': 219, 'bagging_temperature': 0.28476976826565276, 'random_strength': 8.56996945171012, 'grow_policy': 'Depthwise', 'min_data_in_leaf': 563}. Best is trial 14 with value: 1609.1448261457704.[0m
[32m[I 2024-10-13 06:27:01,952][0m Trial 39 finished with value: 6301.217216677521 and parameters: {'depth': 3, 'learning_rate': 0.00011500281906137776, 'iterations': 2255, 'l2_leaf_reg': 5.0690799066458204e-08, 'border_count': 182, 'bagging_temperature': 0.4798937128037788, 'random_strength': 9.20097706863977, 'grow_policy': 'SymmetricTree', 'min_data_in_leaf': 959}. Best is trial 14 with value: 1609.1448261457704.[0m
[32m[I 2024-10-13 06:27:03,814][0m Trial 40 finished with value: 2084.752592531762 and parameters: {'depth': 7, 'learning_rate': 0.005519582677064918, 'iterations': 1798, 'l2_leaf_reg': 0.571981122326196, 'border_count': 60, 'bagging_temperature': 0.14417491845633973, 'random_strength': 2.6693508299321285, 'grow_policy': 'Lossguide', 'min_data_in_leaf': 465, 'max_leaves': 50}. Best is trial 14 with value: 1609.1448261457704.[0m
[32m[I 2024-10-13 06:27:13,987][0m Trial 41 finished with value: 1716.8650721583667 and parameters: {'depth': 6, 'learning_rate': 0.014550278958455634, 'iterations': 2029, 'l2_leaf_reg': 4.7583207988429617e-07, 'border_count': 205, 'bagging_temperature': 0.11715001098963593, 'random_strength': 6.709420206996747, 'grow_policy': 'SymmetricTree', 'min_data_in_leaf': 686}. Best is trial 14 with value: 1609.1448261457704.[0m
[32m[I 2024-10-13 06:27:22,956][0m Trial 42 finished with value: 1750.0581621007336 and parameters: {'depth': 6, 'learning_rate': 0.027878698147077045, 'iterations': 1740, 'l2_leaf_reg': 3.031130882828236e-06, 'border_count': 198, 'bagging_temperature': 0.20128270078399627, 'random_strength': 7.001139092598712, 'grow_policy': 'SymmetricTree', 'min_data_in_leaf': 861}. Best is trial 14 with value: 1609.1448261457704.[0m
[32m[I 2024-10-13 06:27:32,005][0m Trial 43 finished with value: 1803.493873747374 and parameters: {'depth': 5, 'learning_rate': 0.015494604274292518, 'iterations': 2115, 'l2_leaf_reg': 2.9258933769527273e-07, 'border_count': 248, 'bagging_temperature': 0.15060994822035098, 'random_strength': 7.7039656823198355, 'grow_policy': 'SymmetricTree', 'min_data_in_leaf': 588}. Best is trial 14 with value: 1609.1448261457704.[0m
[32m[I 2024-10-13 06:27:39,322][0m Trial 44 finished with value: 2964.8984431282556 and parameters: {'depth': 6, 'learning_rate': 0.001263452054079449, 'iterations': 1292, 'l2_leaf_reg': 3.807581100497353e-08, 'border_count': 121, 'bagging_temperature': 0.05200416010638527, 'random_strength': 8.059331514462938, 'grow_policy': 'SymmetricTree', 'min_data_in_leaf': 770}. Best is trial 14 with value: 1609.1448261457704.[0m
[32m[I 2024-10-13 06:27:40,051][0m Trial 45 finished with value: 1890.0432296229835 and parameters: {'depth': 7, 'learning_rate': 0.05406783726339781, 'iterations': 268, 'l2_leaf_reg': 1.3548146971813773e-06, 'border_count': 97, 'bagging_temperature': 0.17638019413897865, 'random_strength': 5.580083049711217, 'grow_policy': 'Depthwise', 'min_data_in_leaf': 706}. Best is trial 14 with value: 1609.1448261457704.[0m
[32m[I 2024-10-13 06:28:00,112][0m Trial 46 finished with value: 1804.7943465928001 and parameters: {'depth': 8, 'learning_rate': 0.03190871287759422, 'iterations': 2336, 'l2_leaf_reg': 3.739804245554501e-05, 'border_count': 231, 'bagging_temperature': 0.3079005671995773, 'random_strength': 6.744815242244098, 'grow_policy': 'SymmetricTree', 'min_data_in_leaf': 633}. Best is trial 14 with value: 1609.1448261457704.[0m
[32m[I 2024-10-13 06:28:26,384][0m Trial 47 finished with value: 1893.6100960889034 and parameters: {'depth': 9, 'learning_rate': 0.02373853251492589, 'iterations': 1911, 'l2_leaf_reg': 3.6978812632246425e-08, 'border_count': 186, 'bagging_temperature': 0.2408584670493642, 'random_strength': 8.369888738974547, 'grow_policy': 'SymmetricTree', 'min_data_in_leaf': 949}. Best is trial 14 with value: 1609.1448261457704.[0m
[32m[I 2024-10-13 06:28:36,452][0m Trial 48 finished with value: 1727.3873559058952 and parameters: {'depth': 4, 'learning_rate': 0.017642540561637072, 'iterations': 2833, 'l2_leaf_reg': 6.372694708695231e-06, 'border_count': 209, 'bagging_temperature': 0.3583620364420753, 'random_strength': 9.418561242566765, 'grow_policy': 'SymmetricTree', 'min_data_in_leaf': 824}. Best is trial 14 with value: 1609.1448261457704.[0m
[32m[I 2024-10-13 06:28:38,030][0m Trial 49 finished with value: 1703.1201994863338 and parameters: {'depth': 5, 'learning_rate': 0.08274561858817205, 'iterations': 1441, 'l2_leaf_reg': 0.0994590778991681, 'border_count': 168, 'bagging_temperature': 0.9813681608774352, 'random_strength': 6.2721730071782344, 'grow_policy': 'Lossguide', 'min_data_in_leaf': 903, 'max_leaves': 226}. Best is trial 14 with value: 1609.1448261457704.[0m
[32m[I 2024-10-13 06:28:39,294][0m Trial 50 finished with value: 2322.8323772178946 and parameters: {'depth': 6, 'learning_rate': 0.0057465954718350755, 'iterations': 981, 'l2_leaf_reg': 0.00019595564924356352, 'border_count': 154, 'bagging_temperature': 0.2780719579057267, 'random_strength': 7.694834139829859, 'grow_policy': 'Depthwise', 'min_data_in_leaf': 963}. Best is trial 14 with value: 1609.1448261457704.[0m
