[32m[I 2024-10-13 07:16:31,625][0m Trial 751 finished with value: 1749.7251952022857 and parameters: {'depth': 6, 'learning_rate': 0.03711776492075382, 'iterations': 2891, 'l2_leaf_reg': 1.075257536335489e-05, 'border_count': 72, 'bagging_temperature': 0.7414199526566976, 'random_strength': 5.983028480931089, 'grow_policy': 'Lossguide', 'min_data_in_leaf': 329, 'max_leaves': 177}. Best is trial 14 with value: 1609.1448261457704.[0m
[32m[I 2024-10-13 07:16:34,342][0m Trial 752 finished with value: 1696.3605632925683 and parameters: {'depth': 7, 'learning_rate': 0.0636482039792176, 'iterations': 2944, 'l2_leaf_reg': 4.451149194305795e-06, 'border_count': 155, 'bagging_temperature': 0.6412357874878772, 'random_strength': 5.834955898720388, 'grow_policy': 'Lossguide', 'min_data_in_leaf': 308, 'max_leaves': 171}. Best is trial 14 with value: 1609.1448261457704.[0m
[32m[I 2024-10-13 07:16:35,541][0m Trial 753 finished with value: 1704.4091553302528 and parameters: {'depth': 7, 'learning_rate': 0.031248783131887652, 'iterations': 834, 'l2_leaf_reg': 1.0727027187540863e-05, 'border_count': 86, 'bagging_temperature': 0.44826399629729885, 'random_strength': 6.113335220469393, 'grow_policy': 'Lossguide', 'min_data_in_leaf': 329, 'max_leaves': 197}. Best is trial 14 with value: 1609.1448261457704.[0m
[32m[I 2024-10-13 07:16:38,029][0m Trial 754 finished with value: 1679.4213573226655 and parameters: {'depth': 7, 'learning_rate': 0.014549264992608316, 'iterations': 2666, 'l2_leaf_reg': 0.0009285063899547424, 'border_count': 79, 'bagging_temperature': 0.6881628168023913, 'random_strength': 5.780507580118906, 'grow_policy': 'Lossguide', 'min_data_in_leaf': 353, 'max_leaves': 185}. Best is trial 14 with value: 1609.1448261457704.[0m
[32m[I 2024-10-13 07:16:40,630][0m Trial 755 finished with value: 1680.2401145049844 and parameters: {'depth': 6, 'learning_rate': 0.039504726238953104, 'iterations': 2861, 'l2_leaf_reg': 1.0043251921226513e-05, 'border_count': 93, 'bagging_temperature': 0.7094256567703326, 'random_strength': 6.1545871559541485, 'grow_policy': 'Lossguide', 'min_data_in_leaf': 307, 'max_leaves': 149}. Best is trial 14 with value: 1609.1448261457704.[0m
[32m[I 2024-10-13 07:16:49,331][0m Trial 756 finished with value: 1766.4542974940643 and parameters: {'depth': 6, 'learning_rate': 0.051333827866680275, 'iterations': 1630, 'l2_leaf_reg': 1.0910366686899353e-05, 'border_count': 68, 'bagging_temperature': 0.7269635863542947, 'random_strength': 5.601890431056411, 'grow_policy': 'SymmetricTree', 'min_data_in_leaf': 282}. Best is trial 14 with value: 1609.1448261457704.[0m
[32m[I 2024-10-13 07:16:51,856][0m Trial 757 finished with value: 1676.2531332108897 and parameters: {'depth': 8, 'learning_rate': 0.02610773422387582, 'iterations': 2764, 'l2_leaf_reg': 5.176419147422529e-06, 'border_count': 107, 'bagging_temperature': 0.6071186559583447, 'random_strength': 5.986630577631874, 'grow_policy': 'Lossguide', 'min_data_in_leaf': 323, 'max_leaves': 45}. Best is trial 14 with value: 1609.1448261457704.[0m
[32m[I 2024-10-13 07:16:54,523][0m Trial 758 finished with value: 1681.7025478051341 and parameters: {'depth': 7, 'learning_rate': 0.044079225794090564, 'iterations': 2888, 'l2_leaf_reg': 2.1174046102747714e-06, 'border_count': 83, 'bagging_temperature': 0.6674577868592447, 'random_strength': 6.287308996874529, 'grow_policy': 'Lossguide', 'min_data_in_leaf': 339, 'max_leaves': 165}. Best is trial 14 with value: 1609.1448261457704.[0m
[32m[I 2024-10-13 07:16:56,905][0m Trial 759 finished with value: 1885.3196279476854 and parameters: {'depth': 8, 'learning_rate': 0.004532622764026487, 'iterations': 2543, 'l2_leaf_reg': 6.162867683832089e-06, 'border_count': 97, 'bagging_temperature': 0.6984620917084076, 'random_strength': 5.283326391338674, 'grow_policy': 'Lossguide', 'min_data_in_leaf': 366, 'max_leaves': 114}. Best is trial 14 with value: 1609.1448261457704.[0m
[32m[I 2024-10-13 07:16:59,593][0m Trial 760 finished with value: 1656.7380457521751 and parameters: {'depth': 7, 'learning_rate': 0.030965109978964928, 'iterations': 2946, 'l2_leaf_reg': 1.5500919691690877e-05, 'border_count': 88, 'bagging_temperature': 0.6451474510466979, 'random_strength': 5.848867933976969, 'grow_policy': 'Lossguide', 'min_data_in_leaf': 357, 'max_leaves': 156}. Best is trial 14 with value: 1609.1448261457704.[0m
[32m[I 2024-10-13 07:17:02,152][0m Trial 761 finished with value: 1669.9714758406526 and parameters: {'depth': 6, 'learning_rate': 0.13029159354294662, 'iterations': 2805, 'l2_leaf_reg': 2.2552858245771943e-05, 'border_count': 76, 'bagging_temperature': 0.6755232946513295, 'random_strength': 5.495274712879104, 'grow_policy': 'Lossguide', 'min_data_in_leaf': 301, 'max_leaves': 223}. Best is trial 14 with value: 1609.1448261457704.[0m
[32m[I 2024-10-13 07:17:04,932][0m Trial 762 finished with value: 1683.1177714455619 and parameters: {'depth': 5, 'learning_rate': 0.022735915501217688, 'iterations': 2999, 'l2_leaf_reg': 7.688554845916841e-06, 'border_count': 82, 'bagging_temperature': 0.8463116992829001, 'random_strength': 6.36917834945885, 'grow_policy': 'Lossguide', 'min_data_in_leaf': 376, 'max_leaves': 140}. Best is trial 14 with value: 1609.1448261457704.[0m
[32m[I 2024-10-13 07:17:07,576][0m Trial 763 finished with value: 1766.2607507913287 and parameters: {'depth': 3, 'learning_rate': 0.03651588145561135, 'iterations': 2849, 'l2_leaf_reg': 2.5002254245678464e-05, 'border_count': 72, 'bagging_temperature': 0.6259602840868344, 'random_strength': 6.052135441516536, 'grow_policy': 'Lossguide', 'min_data_in_leaf': 326, 'max_leaves': 160}. Best is trial 14 with value: 1609.1448261457704.[0m
[32m[I 2024-10-13 07:17:10,160][0m Trial 764 finished with value: 1674.0564246689892 and parameters: {'depth': 4, 'learning_rate': 0.029835099925305145, 'iterations': 2727, 'l2_leaf_reg': 3.903156816912271e-06, 'border_count': 88, 'bagging_temperature': 0.20968109024621637, 'random_strength': 6.218818441117909, 'grow_policy': 'Lossguide', 'min_data_in_leaf': 352, 'max_leaves': 173}. Best is trial 14 with value: 1609.1448261457704.[0m
[32m[I 2024-10-13 07:17:12,807][0m Trial 765 finished with value: 1664.3416329181885 and parameters: {'depth': 7, 'learning_rate': 0.055544641750237676, 'iterations': 2905, 'l2_leaf_reg': 1.615683822174372e-05, 'border_count': 77, 'bagging_temperature': 0.6870361990391187, 'random_strength': 5.106524019057852, 'grow_policy': 'Lossguide', 'min_data_in_leaf': 375, 'max_leaves': 181}. Best is trial 14 with value: 1609.1448261457704.[0m
[32m[I 2024-10-13 07:17:15,312][0m Trial 766 finished with value: 1708.901437237826 and parameters: {'depth': 3, 'learning_rate': 0.04289376789066254, 'iterations': 2684, 'l2_leaf_reg': 3.28837074553654e-06, 'border_count': 141, 'bagging_temperature': 0.6570270681597549, 'random_strength': 5.770903814074761, 'grow_policy': 'Lossguide', 'min_data_in_leaf': 814, 'max_leaves': 145}. Best is trial 14 with value: 1609.1448261457704.[0m
[32m[I 2024-10-13 07:17:17,762][0m Trial 767 finished with value: 1682.5556058329648 and parameters: {'depth': 8, 'learning_rate': 0.03586426016809777, 'iterations': 2618, 'l2_leaf_reg': 0.11236931196440705, 'border_count': 101, 'bagging_temperature': 0.7574549634117653, 'random_strength': 6.491539245279677, 'grow_policy': 'Lossguide', 'min_data_in_leaf': 341, 'max_leaves': 150}. Best is trial 14 with value: 1609.1448261457704.[0m
[32m[I 2024-10-13 07:17:38,378][0m Trial 768 finished with value: 1798.9344557530198 and parameters: {'depth': 7, 'learning_rate': 0.018397906557705568, 'iterations': 2948, 'l2_leaf_reg': 6.99545100778672e-06, 'border_count': 92, 'bagging_temperature': 0.7140761203185364, 'random_strength': 5.552851493307912, 'grow_policy': 'SymmetricTree', 'min_data_in_leaf': 783}. Best is trial 14 with value: 1609.1448261457704.[0m
[32m[I 2024-10-13 07:17:39,640][0m Trial 769 finished with value: 1709.8252458841714 and parameters: {'depth': 3, 'learning_rate': 0.027326553428699146, 'iterations': 1019, 'l2_leaf_reg': 6.206109032230109e-06, 'border_count': 84, 'bagging_temperature': 0.734297447280517, 'random_strength': 4.96271946337421, 'grow_policy': 'Lossguide', 'min_data_in_leaf': 391, 'max_leaves': 167}. Best is trial 14 with value: 1609.1448261457704.[0m
[32m[I 2024-10-13 07:17:42,275][0m Trial 770 finished with value: 1892.8890855442708 and parameters: {'depth': 3, 'learning_rate': 0.02121158102334649, 'iterations': 2816, 'l2_leaf_reg': 0.00034729852769763847, 'border_count': 62, 'bagging_temperature': 0.691995489819201, 'random_strength': 5.979314150318969, 'grow_policy': 'Lossguide', 'min_data_in_leaf': 266, 'max_leaves': 204}. Best is trial 14 with value: 1609.1448261457704.[0m
[32m[I 2024-10-13 07:17:44,927][0m Trial 771 finished with value: 1697.591341257274 and parameters: {'depth': 8, 'learning_rate': 0.07325681591623281, 'iterations': 2900, 'l2_leaf_reg': 0.0006704001798491558, 'border_count': 96, 'bagging_temperature': 0.6479117692243964, 'random_strength': 6.33548256105801, 'grow_policy': 'Lossguide', 'min_data_in_leaf': 313, 'max_leaves': 134}. Best is trial 14 with value: 1609.1448261457704.[0m
[32m[I 2024-10-13 07:17:47,642][0m Trial 772 finished with value: 1694.4202162579575 and parameters: {'depth': 3, 'learning_rate': 0.19401128118109204, 'iterations': 2763, 'l2_leaf_reg': 0.0012809474563262467, 'border_count': 80, 'bagging_temperature': 0.6735576309146183, 'random_strength': 6.161334960338869, 'grow_policy': 'Depthwise', 'min_data_in_leaf': 367}. Best is trial 14 with value: 1609.1448261457704.[0m
[32m[I 2024-10-13 07:17:50,269][0m Trial 773 finished with value: 1646.1429286646185 and parameters: {'depth': 5, 'learning_rate': 0.034994406894010024, 'iterations': 2863, 'l2_leaf_reg': 1.051477885688606, 'border_count': 89, 'bagging_temperature': 0.6290529826185207, 'random_strength': 5.34682308682095, 'grow_policy': 'Lossguide', 'min_data_in_leaf': 393, 'max_leaves': 157}. Best is trial 14 with value: 1609.1448261457704.[0m
[32m[I 2024-10-13 07:17:53,038][0m Trial 774 finished with value: 1757.0574328444927 and parameters: {'depth': 3, 'learning_rate': 0.051388245123114344, 'iterations': 2941, 'l2_leaf_reg': 0.0005157484780807739, 'border_count': 72, 'bagging_temperature': 0.7087530687144741, 'random_strength': 5.802038230133356, 'grow_policy': 'Lossguide', 'min_data_in_leaf': 846, 'max_leaves': 142}. Best is trial 14 with value: 1609.1448261457704.[0m
[32m[I 2024-10-13 07:17:55,679][0m Trial 775 finished with value: 1719.8479981123385 and parameters: {'depth': 10, 'learning_rate': 0.10105221419752923, 'iterations': 2825, 'l2_leaf_reg': 0.4249982705922762, 'border_count': 84, 'bagging_temperature': 0.6621244041823542, 'random_strength': 6.462095338399074, 'grow_policy': 'Lossguide', 'min_data_in_leaf': 291, 'max_leaves': 59}. Best is trial 14 with value: 1609.1448261457704.[0m
[32m[I 2024-10-13 07:17:58,253][0m Trial 776 finished with value: 1654.849823843551 and parameters: {'depth': 4, 'learning_rate': 0.02544364148221106, 'iterations': 2692, 'l2_leaf_reg': 2.8992101747510188e-06, 'border_count': 77, 'bagging_temperature': 0.6057654051100623, 'random_strength': 6.065470110281237, 'grow_policy': 'Lossguide', 'min_data_in_leaf': 348, 'max_leaves': 153}. Best is trial 14 with value: 1609.1448261457704.[0m
[32m[I 2024-10-13 07:17:59,392][0m Trial 777 finished with value: 1745.2750027771565 and parameters: {'depth': 8, 'learning_rate': 0.04088856353512995, 'iterations': 724, 'l2_leaf_reg': 0.00024237640702904376, 'border_count': 91, 'bagging_temperature': 0.6908197331309885, 'random_strength': 5.627849575411672, 'grow_policy': 'Lossguide', 'min_data_in_leaf': 808, 'max_leaves': 193}. Best is trial 14 with value: 1609.1448261457704.[0m
[32m[I 2024-10-13 07:18:02,053][0m Trial 778 finished with value: 1663.1043759758352 and parameters: {'depth': 3, 'learning_rate': 0.03206397911248868, 'iterations': 2952, 'l2_leaf_reg': 0.19314502891126675, 'border_count': 96, 'bagging_temperature': 0.7269063627777251, 'random_strength': 6.653083724758715, 'grow_policy': 'Lossguide', 'min_data_in_leaf': 830, 'max_leaves': 163}. Best is trial 14 with value: 1609.1448261457704.[0m
[32m[I 2024-10-13 07:18:03,472][0m Trial 779 finished with value: 1709.2558520360535 and parameters: {'depth': 3, 'learning_rate': 0.028037043437898493, 'iterations': 1161, 'l2_leaf_reg': 0.0009138736441655015, 'border_count': 83, 'bagging_temperature': 0.6456703723388179, 'random_strength': 5.906387780397804, 'grow_policy': 'Lossguide', 'min_data_in_leaf': 325, 'max_leaves': 175}. Best is trial 14 with value: 1609.1448261457704.[0m
[32m[I 2024-10-13 07:18:06,070][0m Trial 780 finished with value: 1700.3463995241939 and parameters: {'depth': 6, 'learning_rate': 0.04456337344078245, 'iterations': 2769, 'l2_leaf_reg': 1.608694478999485, 'border_count': 102, 'bagging_temperature': 0.5734524506606515, 'random_strength': 6.254419324820478, 'grow_policy': 'Lossguide', 'min_data_in_leaf': 375, 'max_leaves': 169}. Best is trial 14 with value: 1609.1448261457704.[0m
[32m[I 2024-10-13 07:18:08,717][0m Trial 781 finished with value: 1779.7227514455592 and parameters: {'depth': 3, 'learning_rate': 0.02293603504920533, 'iterations': 2888, 'l2_leaf_reg': 0.00038037854466486996, 'border_count': 68, 'bagging_temperature': 0.6739043408315494, 'random_strength': 6.506408661423282, 'grow_policy': 'Lossguide', 'min_data_in_leaf': 792, 'max_leaves': 179}. Best is trial 14 with value: 1609.1448261457704.[0m
[32m[I 2024-10-13 07:18:24,082][0m Trial 782 finished with value: 1937.6041033310187 and parameters: {'depth': 8, 'learning_rate': 0.034596137156377944, 'iterations': 2849, 'l2_leaf_reg': 0.0017748402105481783, 'border_count': 54, 'bagging_temperature': 0.7118869986687102, 'random_strength': 5.397195018231661, 'grow_policy': 'SymmetricTree', 'min_data_in_leaf': 409}. Best is trial 14 with value: 1609.1448261457704.[0m
[32m[I 2024-10-13 07:18:26,559][0m Trial 783 finished with value: 1661.4744456827468 and parameters: {'depth': 7, 'learning_rate': 0.030283516475643497, 'iterations': 2645, 'l2_leaf_reg': 0.28897104189034106, 'border_count': 87, 'bagging_temperature': 0.6922079334132317, 'random_strength': 5.7103155754762, 'grow_policy': 'Lossguide', 'min_data_in_leaf': 900, 'max_leaves': 147}. Best is trial 14 with value: 1609.1448261457704.[0m
[32m[I 2024-10-13 07:18:29,279][0m Trial 784 finished with value: 1653.8913851860414 and parameters: {'depth': 4, 'learning_rate': 0.03907546397545298, 'iterations': 2947, 'l2_leaf_reg': 1.3132501978422045e-05, 'border_count': 79, 'bagging_temperature': 0.6680466353905857, 'random_strength': 6.066010681755056, 'grow_policy': 'Lossguide', 'min_data_in_leaf': 770, 'max_leaves': 137}. Best is trial 14 with value: 1609.1448261457704.[0m
[32m[I 2024-10-13 07:18:31,860][0m Trial 785 finished with value: 1690.6676826524072 and parameters: {'depth': 8, 'learning_rate': 0.01685184125462404, 'iterations': 2727, 'l2_leaf_reg': 0.0007489555601000509, 'border_count': 92, 'bagging_temperature': 0.6266375546451283, 'random_strength': 6.62279858278279, 'grow_policy': 'Lossguide', 'min_data_in_leaf': 355, 'max_leaves': 126}. Best is trial 14 with value: 1609.1448261457704.[0m
[32m[I 2024-10-13 07:18:34,539][0m Trial 786 finished with value: 1734.9541546856592 and parameters: {'depth': 10, 'learning_rate': 0.04856620176347344, 'iterations': 2899, 'l2_leaf_reg': 1.924117296441829e-05, 'border_count': 74, 'bagging_temperature': 0.7519546064639525, 'random_strength': 6.273614332970891, 'grow_policy': 'Lossguide', 'min_data_in_leaf': 857, 'max_leaves': 159}. Best is trial 14 with value: 1609.1448261457704.[0m
[32m[I 2024-10-13 07:18:37,238][0m Trial 787 finished with value: 1808.035380068932 and parameters: {'depth': 6, 'learning_rate': 0.25488645030494256, 'iterations': 3000, 'l2_leaf_reg': 4.427116140491793e-05, 'border_count': 84, 'bagging_temperature': 0.6495809267983139, 'random_strength': 6.817373999966055, 'grow_policy': 'Lossguide', 'min_data_in_leaf': 392, 'max_leaves': 184}. Best is trial 14 with value: 1609.1448261457704.[0m
[32m[I 2024-10-13 07:18:39,924][0m Trial 788 finished with value: 1667.5196595408947 and parameters: {'depth': 3, 'learning_rate': 0.025344112375516037, 'iterations': 2797, 'l2_leaf_reg': 0.0005264950029701157, 'border_count': 97, 'bagging_temperature': 0.5939181108379389, 'random_strength': 5.896318869641375, 'grow_policy': 'Lossguide', 'min_data_in_leaf': 331, 'max_leaves': 234}. Best is trial 14 with value: 1609.1448261457704.[0m
[32m[I 2024-10-13 07:18:42,626][0m Trial 789 finished with value: 1781.713786188914 and parameters: {'depth': 3, 'learning_rate': 0.006379338647076993, 'iterations': 2853, 'l2_leaf_reg': 0.00021538735106660278, 'border_count': 119, 'bagging_temperature': 0.7835145730557078, 'random_strength': 5.111577728513775, 'grow_policy': 'Lossguide', 'min_data_in_leaf': 288, 'max_leaves': 153}. Best is trial 14 with value: 1609.1448261457704.[0m
[32m[I 2024-10-13 07:18:44,157][0m Trial 790 finished with value: 1661.145887097965 and parameters: {'depth': 3, 'learning_rate': 0.03205925477710959, 'iterations': 1492, 'l2_leaf_reg': 0.0012877620823979212, 'border_count': 88, 'bagging_temperature': 0.6892610735000612, 'random_strength': 6.439198221409667, 'grow_policy': 'Lossguide', 'min_data_in_leaf': 827, 'max_leaves': 218}. Best is trial 14 with value: 1609.1448261457704.[0m
[32m[I 2024-10-13 07:18:46,889][0m Trial 791 finished with value: 1715.0013147500058 and parameters: {'depth': 3, 'learning_rate': 0.019527905089793088, 'iterations': 3000, 'l2_leaf_reg': 0.7123550838926765, 'border_count': 80, 'bagging_temperature': 0.12318852302449226, 'random_strength': 5.629934704538314, 'grow_policy': 'Lossguide', 'min_data_in_leaf': 372, 'max_leaves': 164}. Best is trial 14 with value: 1609.1448261457704.[0m
[32m[I 2024-10-13 07:18:49,521][0m Trial 792 finished with value: 1724.0739212221686 and parameters: {'depth': 8, 'learning_rate': 0.040008436629776746, 'iterations': 2908, 'l2_leaf_reg': 0.00038516980575728873, 'border_count': 75, 'bagging_temperature': 0.6608402950999773, 'random_strength': 6.749809297306175, 'grow_policy': 'Lossguide', 'min_data_in_leaf': 314, 'max_leaves': 172}. Best is trial 14 with value: 1609.1448261457704.[0m
[32m[I 2024-10-13 07:19:34,422][0m Trial 793 finished with value: 2126.2953076797703 and parameters: {'depth': 10, 'learning_rate': 0.16451074307996247, 'iterations': 2564, 'l2_leaf_reg': 0.0008517279439843274, 'border_count': 91, 'bagging_temperature': 0.7105485508995828, 'random_strength': 6.19088660308108, 'grow_policy': 'SymmetricTree', 'min_data_in_leaf': 804}. Best is trial 14 with value: 1609.1448261457704.[0m
[32m[I 2024-10-13 07:19:36,978][0m Trial 794 finished with value: 1653.812114354582 and parameters: {'depth': 3, 'learning_rate': 0.027554668122309337, 'iterations': 2766, 'l2_leaf_reg': 0.09059834049087472, 'border_count': 86, 'bagging_temperature': 0.6388985379974532, 'random_strength': 5.306284481255429, 'grow_policy': 'Depthwise', 'min_data_in_leaf': 342}. Best is trial 14 with value: 1609.1448261457704.[0m
[32m[I 2024-10-13 07:19:39,701][0m Trial 795 finished with value: 1745.143299822419 and parameters: {'depth': 7, 'learning_rate': 0.03465624372257915, 'iterations': 2942, 'l2_leaf_reg': 6.763376323516744e-06, 'border_count': 65, 'bagging_temperature': 0.6761785060588883, 'random_strength': 4.944478477482437, 'grow_policy': 'Lossguide', 'min_data_in_leaf': 410, 'max_leaves': 52}. Best is trial 14 with value: 1609.1448261457704.[0m
[32m[I 2024-10-13 07:19:42,289][0m Trial 796 finished with value: 1684.352728072758 and parameters: {'depth': 4, 'learning_rate': 0.08832456248957513, 'iterations': 2820, 'l2_leaf_reg': 1.2132647634225602e-06, 'border_count': 108, 'bagging_temperature': 0.7362614761997975, 'random_strength': 5.913391316893416, 'grow_policy': 'Lossguide', 'min_data_in_leaf': 363, 'max_leaves': 143}. Best is trial 14 with value: 1609.1448261457704.[0m
[32m[I 2024-10-13 07:19:44,781][0m Trial 797 finished with value: 1686.7962391186559 and parameters: {'depth': 8, 'learning_rate': 0.058231983028998284, 'iterations': 2688, 'l2_leaf_reg': 0.14783174434659288, 'border_count': 81, 'bagging_temperature': 0.2700498002909694, 'random_strength': 6.372832378731296, 'grow_policy': 'Lossguide', 'min_data_in_leaf': 399, 'max_leaves': 168}. Best is trial 14 with value: 1609.1448261457704.[0m
[32m[I 2024-10-13 07:19:47,532][0m Trial 798 finished with value: 1674.1128186359042 and parameters: {'depth': 3, 'learning_rate': 0.023311848767626306, 'iterations': 2880, 'l2_leaf_reg': 0.00011512082061175038, 'border_count': 93, 'bagging_temperature': 0.6999118208825914, 'random_strength': 5.491243382298738, 'grow_policy': 'Lossguide', 'min_data_in_leaf': 874, 'max_leaves': 211}. Best is trial 14 with value: 1609.1448261457704.[0m
[32m[I 2024-10-13 07:19:50,007][0m Trial 799 finished with value: 1705.5486667722787 and parameters: {'depth': 10, 'learning_rate': 0.047319328029073064, 'iterations': 2614, 'l2_leaf_reg': 2.83099558217115e-05, 'border_count': 86, 'bagging_temperature': 0.6106390872970857, 'random_strength': 6.589529293123848, 'grow_policy': 'Lossguide', 'min_data_in_leaf': 381, 'max_leaves': 148}. Best is trial 14 with value: 1609.1448261457704.[0m
[32m[I 2024-10-13 07:19:51,534][0m Trial 800 finished with value: 1790.0465920563763 and parameters: {'depth': 3, 'learning_rate': 0.03868805728001922, 'iterations': 1269, 'l2_leaf_reg': 0.0015647689815870497, 'border_count': 72, 'bagging_temperature': 0.6790416118452277, 'random_strength': 6.035123452234292, 'grow_policy': 'Lossguide', 'min_data_in_leaf': 836, 'max_leaves': 178}. Best is trial 14 with value: 1609.1448261457704.[0m
