[32m[I 2024-10-13 07:26:35,814][0m Trial 901 finished with value: 1657.7855103572726 and parameters: {'depth': 6, 'learning_rate': 0.024557040724625327, 'iterations': 2702, 'l2_leaf_reg': 8.218722003126838e-07, 'border_count': 81, 'bagging_temperature': 0.6133786336842522, 'random_strength': 7.237806335185261, 'grow_policy': 'Lossguide', 'min_data_in_leaf': 372, 'max_leaves': 52}. Best is trial 14 with value: 1609.1448261457704.[0m
[32m[I 2024-10-13 07:26:38,364][0m Trial 902 finished with value: 1653.6979164028587 and parameters: {'depth': 6, 'learning_rate': 0.029005764159005888, 'iterations': 2751, 'l2_leaf_reg': 6.066158760492795e-07, 'border_count': 83, 'bagging_temperature': 0.9458533349930451, 'random_strength': 6.944232076061077, 'grow_policy': 'Lossguide', 'min_data_in_leaf': 370, 'max_leaves': 66}. Best is trial 14 with value: 1609.1448261457704.[0m
[32m[I 2024-10-13 07:26:40,926][0m Trial 903 finished with value: 1778.823196625581 and parameters: {'depth': 6, 'learning_rate': 0.014958479303553554, 'iterations': 2786, 'l2_leaf_reg': 3.7904725998904083e-07, 'border_count': 75, 'bagging_temperature': 0.6235181718367666, 'random_strength': 7.2999459390111765, 'grow_policy': 'Lossguide', 'min_data_in_leaf': 398, 'max_leaves': 72}. Best is trial 14 with value: 1609.1448261457704.[0m
[32m[I 2024-10-13 07:26:43,333][0m Trial 904 finished with value: 1646.6042860421323 and parameters: {'depth': 6, 'learning_rate': 0.023175880841011343, 'iterations': 2545, 'l2_leaf_reg': 1.0089506442352707e-06, 'border_count': 82, 'bagging_temperature': 0.6375505171172345, 'random_strength': 7.61918229063422, 'grow_policy': 'Lossguide', 'min_data_in_leaf': 356, 'max_leaves': 55}. Best is trial 14 with value: 1609.1448261457704.[0m
[32m[I 2024-10-13 07:26:44,692][0m Trial 905 finished with value: 1774.6380948263184 and parameters: {'depth': 5, 'learning_rate': 0.017618115382803397, 'iterations': 1083, 'l2_leaf_reg': 1.042108861842021e-06, 'border_count': 237, 'bagging_temperature': 0.6498063172550469, 'random_strength': 7.082668854797463, 'grow_policy': 'Depthwise', 'min_data_in_leaf': 381}. Best is trial 14 with value: 1609.1448261457704.[0m
[32m[I 2024-10-13 07:26:47,244][0m Trial 906 finished with value: 1681.9505980356323 and parameters: {'depth': 7, 'learning_rate': 0.031023914600668, 'iterations': 2685, 'l2_leaf_reg': 5.566304489611097e-07, 'border_count': 149, 'bagging_temperature': 0.6368903657864012, 'random_strength': 6.813808839566566, 'grow_policy': 'Lossguide', 'min_data_in_leaf': 423, 'max_leaves': 95}. Best is trial 14 with value: 1609.1448261457704.[0m
[32m[I 2024-10-13 07:26:49,692][0m Trial 907 finished with value: 1985.7090643434358 and parameters: {'depth': 6, 'learning_rate': 0.026809322826399567, 'iterations': 2590, 'l2_leaf_reg': 1.7739623335590504e-07, 'border_count': 55, 'bagging_temperature': 0.6600088193319533, 'random_strength': 6.923134103363846, 'grow_policy': 'Lossguide', 'min_data_in_leaf': 343, 'max_leaves': 125}. Best is trial 14 with value: 1609.1448261457704.[0m
[32m[I 2024-10-13 07:26:52,254][0m Trial 908 finished with value: 1627.8679231030249 and parameters: {'depth': 6, 'learning_rate': 0.03330652366500991, 'iterations': 2766, 'l2_leaf_reg': 6.566209531811216e-07, 'border_count': 78, 'bagging_temperature': 0.6314030751633841, 'random_strength': 7.4356014100441365, 'grow_policy': 'Lossguide', 'min_data_in_leaf': 368, 'max_leaves': 107}. Best is trial 14 with value: 1609.1448261457704.[0m
[32m[I 2024-10-13 07:27:05,869][0m Trial 909 finished with value: 1791.4798301770666 and parameters: {'depth': 6, 'learning_rate': 0.02127997777633175, 'iterations': 2711, 'l2_leaf_reg': 5.259919772788146e-07, 'border_count': 65, 'bagging_temperature': 0.6014908258392512, 'random_strength': 7.586888295900121, 'grow_policy': 'SymmetricTree', 'min_data_in_leaf': 362}. Best is trial 14 with value: 1609.1448261457704.[0m
[32m[I 2024-10-13 07:27:07,406][0m Trial 910 finished with value: 1776.9627119308805 and parameters: {'depth': 6, 'learning_rate': 0.03241638620546564, 'iterations': 1409, 'l2_leaf_reg': 3.140668805671311e-07, 'border_count': 73, 'bagging_temperature': 0.6245957085121288, 'random_strength': 7.4233370284361, 'grow_policy': 'Lossguide', 'min_data_in_leaf': 385, 'max_leaves': 106}. Best is trial 14 with value: 1609.1448261457704.[0m
[32m[I 2024-10-13 07:27:09,945][0m Trial 911 finished with value: 1766.5173416145299 and parameters: {'depth': 5, 'learning_rate': 0.027310704467528528, 'iterations': 2757, 'l2_leaf_reg': 5.366545325125142e-07, 'border_count': 69, 'bagging_temperature': 0.6208311340394377, 'random_strength': 7.503311844989728, 'grow_policy': 'Lossguide', 'min_data_in_leaf': 368, 'max_leaves': 104}. Best is trial 14 with value: 1609.1448261457704.[0m
[32m[I 2024-10-13 07:27:12,463][0m Trial 912 finished with value: 1796.482577707857 and parameters: {'depth': 6, 'learning_rate': 0.2276281238480618, 'iterations': 2650, 'l2_leaf_reg': 8.366923031813684e-07, 'border_count': 77, 'bagging_temperature': 0.6111752519602531, 'random_strength': 7.609282817903184, 'grow_policy': 'Lossguide', 'min_data_in_leaf': 343, 'max_leaves': 124}. Best is trial 14 with value: 1609.1448261457704.[0m
[32m[I 2024-10-13 07:27:15,018][0m Trial 913 finished with value: 1789.7285051967594 and parameters: {'depth': 6, 'learning_rate': 0.034614406672006985, 'iterations': 2710, 'l2_leaf_reg': 4.079084491355589e-07, 'border_count': 72, 'bagging_temperature': 0.5931640522121914, 'random_strength': 7.261333386080409, 'grow_policy': 'Lossguide', 'min_data_in_leaf': 401, 'max_leaves': 98}. Best is trial 14 with value: 1609.1448261457704.[0m
[32m[I 2024-10-13 07:27:17,469][0m Trial 914 finished with value: 1662.2046766204044 and parameters: {'depth': 6, 'learning_rate': 0.019650712378040034, 'iterations': 2623, 'l2_leaf_reg': 1.4023979871582907e-06, 'border_count': 76, 'bagging_temperature': 0.6385845045426549, 'random_strength': 7.2033139685417655, 'grow_policy': 'Lossguide', 'min_data_in_leaf': 376, 'max_leaves': 86}. Best is trial 14 with value: 1609.1448261457704.[0m
[32m[I 2024-10-13 07:27:19,522][0m Trial 915 finished with value: 1666.1369353735238 and parameters: {'depth': 6, 'learning_rate': 0.024145511839893857, 'iterations': 2048, 'l2_leaf_reg': 2.93339610129342e-07, 'border_count': 80, 'bagging_temperature': 0.6301406639613354, 'random_strength': 7.1367243929938065, 'grow_policy': 'Lossguide', 'min_data_in_leaf': 353, 'max_leaves': 129}. Best is trial 14 with value: 1609.1448261457704.[0m
[32m[I 2024-10-13 07:27:22,144][0m Trial 916 finished with value: 1790.4680420640386 and parameters: {'depth': 6, 'learning_rate': 0.03798705689466762, 'iterations': 2786, 'l2_leaf_reg': 1.1428574423026736e-06, 'border_count': 68, 'bagging_temperature': 0.6483944526674605, 'random_strength': 7.805991162901999, 'grow_policy': 'Lossguide', 'min_data_in_leaf': 400, 'max_leaves': 91}. Best is trial 14 with value: 1609.1448261457704.[0m
[32m[I 2024-10-13 07:27:24,668][0m Trial 917 finished with value: 1766.4075007848162 and parameters: {'depth': 6, 'learning_rate': 0.009863819729650319, 'iterations': 2678, 'l2_leaf_reg': 3.362714858729762e-07, 'border_count': 80, 'bagging_temperature': 0.03913781923858184, 'random_strength': 7.87201892899393, 'grow_policy': 'Lossguide', 'min_data_in_leaf': 335, 'max_leaves': 122}. Best is trial 14 with value: 1609.1448261457704.[0m
[32m[I 2024-10-13 07:27:27,422][0m Trial 918 finished with value: 6321.148202946034 and parameters: {'depth': 5, 'learning_rate': 0.00011255092465324519, 'iterations': 2738, 'l2_leaf_reg': 7.547497269311114e-07, 'border_count': 62, 'bagging_temperature': 0.6263705338206098, 'random_strength': 7.427179620184319, 'grow_policy': 'Lossguide', 'min_data_in_leaf': 441, 'max_leaves': 104}. Best is trial 14 with value: 1609.1448261457704.[0m
[32m[I 2024-10-13 07:27:30,058][0m Trial 919 finished with value: 1978.9277476825246 and parameters: {'depth': 6, 'learning_rate': 0.03040361925785783, 'iterations': 2773, 'l2_leaf_reg': 6.692070509831969e-07, 'border_count': 32, 'bagging_temperature': 0.6541423632132021, 'random_strength': 7.346273806310825, 'grow_policy': 'Lossguide', 'min_data_in_leaf': 375, 'max_leaves': 75}. Best is trial 14 with value: 1609.1448261457704.[0m
[32m[I 2024-10-13 07:27:38,226][0m Trial 920 finished with value: 1694.7216276406227 and parameters: {'depth': 5, 'learning_rate': 0.026128250382789736, 'iterations': 1746, 'l2_leaf_reg': 1.2458476688929992e-06, 'border_count': 84, 'bagging_temperature': 0.6596600564842897, 'random_strength': 7.076524904643872, 'grow_policy': 'SymmetricTree', 'min_data_in_leaf': 420}. Best is trial 14 with value: 1609.1448261457704.[0m
[32m[I 2024-10-13 07:27:40,354][0m Trial 921 finished with value: 1767.0699122782817 and parameters: {'depth': 7, 'learning_rate': 0.0387558204670439, 'iterations': 1898, 'l2_leaf_reg': 7.21318648361507e-07, 'border_count': 75, 'bagging_temperature': 0.6013774026927139, 'random_strength': 7.645948873146194, 'grow_policy': 'Lossguide', 'min_data_in_leaf': 391, 'max_leaves': 119}. Best is trial 14 with value: 1609.1448261457704.[0m
[32m[I 2024-10-13 07:27:42,980][0m Trial 922 finished with value: 1671.6379716123463 and parameters: {'depth': 6, 'learning_rate': 0.030872767339004285, 'iterations': 2642, 'l2_leaf_reg': 2.3785758403159847e-07, 'border_count': 85, 'bagging_temperature': 0.6348136442505818, 'random_strength': 6.979027017325453, 'grow_policy': 'Lossguide', 'min_data_in_leaf': 362, 'max_leaves': 168}. Best is trial 14 with value: 1609.1448261457704.[0m
[32m[I 2024-10-13 07:27:45,600][0m Trial 923 finished with value: 1675.5488678716326 and parameters: {'depth': 7, 'learning_rate': 0.131882013967259, 'iterations': 2788, 'l2_leaf_reg': 1.0164326186222817e-06, 'border_count': 78, 'bagging_temperature': 0.6715352724002495, 'random_strength': 6.811160265421291, 'grow_policy': 'Lossguide', 'min_data_in_leaf': 340, 'max_leaves': 81}. Best is trial 14 with value: 1609.1448261457704.[0m
[32m[I 2024-10-13 07:27:48,156][0m Trial 924 finished with value: 1677.5424232604194 and parameters: {'depth': 7, 'learning_rate': 0.022808905463741758, 'iterations': 2697, 'l2_leaf_reg': 1.6247924550522195e-06, 'border_count': 224, 'bagging_temperature': 0.6468697634541068, 'random_strength': 7.977568994554369, 'grow_policy': 'Lossguide', 'min_data_in_leaf': 408, 'max_leaves': 111}. Best is trial 14 with value: 1609.1448261457704.[0m
[32m[I 2024-10-13 07:27:50,549][0m Trial 925 finished with value: 1923.2072550184942 and parameters: {'depth': 6, 'learning_rate': 0.15151574522539193, 'iterations': 2566, 'l2_leaf_reg': 5.098129648509075e-07, 'border_count': 72, 'bagging_temperature': 0.6103996832921627, 'random_strength': 7.330442664485771, 'grow_policy': 'Lossguide', 'min_data_in_leaf': 380, 'max_leaves': 171}. Best is trial 14 with value: 1609.1448261457704.[0m
[32m[I 2024-10-13 07:27:52,522][0m Trial 926 finished with value: 1642.305044729796 and parameters: {'depth': 7, 'learning_rate': 0.03457548724346059, 'iterations': 1919, 'l2_leaf_reg': 6.269160453077234e-07, 'border_count': 91, 'bagging_temperature': 0.6731672670470613, 'random_strength': 7.058595236429673, 'grow_policy': 'Lossguide', 'min_data_in_leaf': 333, 'max_leaves': 60}. Best is trial 14 with value: 1609.1448261457704.[0m
[32m[I 2024-10-13 07:27:55,211][0m Trial 927 finished with value: 1656.0716258700393 and parameters: {'depth': 5, 'learning_rate': 0.027528185353930625, 'iterations': 2798, 'l2_leaf_reg': 8.727873398887474e-07, 'border_count': 82, 'bagging_temperature': 0.5736290989749584, 'random_strength': 7.719861716788302, 'grow_policy': 'Depthwise', 'min_data_in_leaf': 365}. Best is trial 14 with value: 1609.1448261457704.[0m
[32m[I 2024-10-13 07:27:57,040][0m Trial 928 finished with value: 1756.6006351217084 and parameters: {'depth': 6, 'learning_rate': 0.25704237994137036, 'iterations': 1665, 'l2_leaf_reg': 4.317476508156618e-07, 'border_count': 88, 'bagging_temperature': 0.6561783699681085, 'random_strength': 6.793412021832991, 'grow_policy': 'Lossguide', 'min_data_in_leaf': 394, 'max_leaves': 100}. Best is trial 14 with value: 1609.1448261457704.[0m
[32m[I 2024-10-13 07:27:59,577][0m Trial 929 finished with value: 1659.4586816543078 and parameters: {'depth': 7, 'learning_rate': 0.04196085877615407, 'iterations': 2728, 'l2_leaf_reg': 1.6218874677318048e-06, 'border_count': 78, 'bagging_temperature': 0.35803779061231933, 'random_strength': 3.3932670320118605, 'grow_policy': 'Lossguide', 'min_data_in_leaf': 435, 'max_leaves': 166}. Best is trial 14 with value: 1609.1448261457704.[0m
[32m[I 2024-10-13 07:28:00,693][0m Trial 930 finished with value: 3955.553034963913 and parameters: {'depth': 6, 'learning_rate': 0.002478519536729277, 'iterations': 635, 'l2_leaf_reg': 1.5412915363475528e-07, 'border_count': 94, 'bagging_temperature': 0.6275548397597965, 'random_strength': 7.127686969423064, 'grow_policy': 'Lossguide', 'min_data_in_leaf': 349, 'max_leaves': 117}. Best is trial 14 with value: 1609.1448261457704.[0m
[32m[I 2024-10-13 07:28:03,148][0m Trial 931 finished with value: 1723.5495984073093 and parameters: {'depth': 5, 'learning_rate': 0.03374879762130312, 'iterations': 2607, 'l2_leaf_reg': 1.0413565648195119e-06, 'border_count': 69, 'bagging_temperature': 0.6840732729851481, 'random_strength': 6.650314735653444, 'grow_policy': 'Lossguide', 'min_data_in_leaf': 412, 'max_leaves': 162}. Best is trial 14 with value: 1609.1448261457704.[0m
[32m[I 2024-10-13 07:28:04,825][0m Trial 932 finished with value: 1710.1827655761379 and parameters: {'depth': 7, 'learning_rate': 0.01749279892339446, 'iterations': 1502, 'l2_leaf_reg': 1.210939613634525e-08, 'border_count': 85, 'bagging_temperature': 0.6484718477300143, 'random_strength': 6.846384473778512, 'grow_policy': 'Lossguide', 'min_data_in_leaf': 380, 'max_leaves': 110}. Best is trial 14 with value: 1609.1448261457704.[0m
[32m[I 2024-10-13 07:28:11,434][0m Trial 933 finished with value: 1738.237809249329 and parameters: {'depth': 6, 'learning_rate': 0.02778320459366824, 'iterations': 1184, 'l2_leaf_reg': 2.519139932124343e-07, 'border_count': 75, 'bagging_temperature': 0.46897814721022457, 'random_strength': 7.415240432375615, 'grow_policy': 'SymmetricTree', 'min_data_in_leaf': 359}. Best is trial 14 with value: 1609.1448261457704.[0m
[32m[I 2024-10-13 07:28:13,782][0m Trial 934 finished with value: 1681.7636961862356 and parameters: {'depth': 7, 'learning_rate': 0.040946284704371616, 'iterations': 2471, 'l2_leaf_reg': 0.001662169489163787, 'border_count': 90, 'bagging_temperature': 0.6730444859490157, 'random_strength': 6.676969248930871, 'grow_policy': 'Lossguide', 'min_data_in_leaf': 460, 'max_leaves': 172}. Best is trial 14 with value: 1609.1448261457704.[0m
[32m[I 2024-10-13 07:28:15,317][0m Trial 935 finished with value: 1661.9163134541295 and parameters: {'depth': 5, 'learning_rate': 0.03339240648218141, 'iterations': 1327, 'l2_leaf_reg': 0.0022644349885726322, 'border_count': 81, 'bagging_temperature': 0.6958512152922325, 'random_strength': 6.9314263966819, 'grow_policy': 'Lossguide', 'min_data_in_leaf': 325, 'max_leaves': 65}. Best is trial 14 with value: 1609.1448261457704.[0m
[32m[I 2024-10-13 07:28:17,808][0m Trial 936 finished with value: 1677.66543856098 and parameters: {'depth': 7, 'learning_rate': 0.022653990004117507, 'iterations': 2677, 'l2_leaf_reg': 3.665859585713281e-07, 'border_count': 86, 'bagging_temperature': 0.7820861633314395, 'random_strength': 7.202027898015694, 'grow_policy': 'Lossguide', 'min_data_in_leaf': 397, 'max_leaves': 113}. Best is trial 14 with value: 1609.1448261457704.[0m
[32m[I 2024-10-13 07:28:20,395][0m Trial 937 finished with value: 1662.456174473693 and parameters: {'depth': 6, 'learning_rate': 0.028541370561722144, 'iterations': 2756, 'l2_leaf_reg': 0.0037651754941836224, 'border_count': 95, 'bagging_temperature': 0.6348415154343116, 'random_strength': 6.931823050706913, 'grow_policy': 'Lossguide', 'min_data_in_leaf': 355, 'max_leaves': 177}. Best is trial 14 with value: 1609.1448261457704.[0m
[32m[I 2024-10-13 07:28:22,827][0m Trial 938 finished with value: 1777.4985328506089 and parameters: {'depth': 7, 'learning_rate': 0.037541614708560454, 'iterations': 2631, 'l2_leaf_reg': 0.0012124876004997647, 'border_count': 72, 'bagging_temperature': 0.42835936744054204, 'random_strength': 6.5616843608649695, 'grow_policy': 'Lossguide', 'min_data_in_leaf': 428, 'max_leaves': 166}. Best is trial 14 with value: 1609.1448261457704.[0m
[32m[I 2024-10-13 07:28:25,429][0m Trial 939 finished with value: 1910.9703306252056 and parameters: {'depth': 6, 'learning_rate': 0.020061792615597488, 'iterations': 2819, 'l2_leaf_reg': 0.0005542574945972926, 'border_count': 50, 'bagging_temperature': 0.6648591867653425, 'random_strength': 6.628938799302395, 'grow_policy': 'Lossguide', 'min_data_in_leaf': 380, 'max_leaves': 161}. Best is trial 14 with value: 1609.1448261457704.[0m
[32m[I 2024-10-13 07:28:27,964][0m Trial 940 finished with value: 1665.4968121789243 and parameters: {'depth': 7, 'learning_rate': 0.04430028963201436, 'iterations': 2748, 'l2_leaf_reg': 8.310606956139209e-07, 'border_count': 79, 'bagging_temperature': 0.6806885421355194, 'random_strength': 7.298263038509471, 'grow_policy': 'Lossguide', 'min_data_in_leaf': 413, 'max_leaves': 39}. Best is trial 14 with value: 1609.1448261457704.[0m
[32m[I 2024-10-13 07:28:30,664][0m Trial 941 finished with value: 1713.952337860322 and parameters: {'depth': 6, 'learning_rate': 0.013107205221102414, 'iterations': 2803, 'l2_leaf_reg': 0.0007831081067213864, 'border_count': 102, 'bagging_temperature': 0.6519244455804774, 'random_strength': 6.7914396251300815, 'grow_policy': 'Lossguide', 'min_data_in_leaf': 367, 'max_leaves': 169}. Best is trial 14 with value: 1609.1448261457704.[0m
[32m[I 2024-10-13 07:28:33,097][0m Trial 942 finished with value: 1694.8026931558413 and parameters: {'depth': 4, 'learning_rate': 0.2010553514764408, 'iterations': 2514, 'l2_leaf_reg': 5.84020946543705e-07, 'border_count': 90, 'bagging_temperature': 0.6142847715232844, 'random_strength': 7.065468844970742, 'grow_policy': 'Lossguide', 'min_data_in_leaf': 339, 'max_leaves': 131}. Best is trial 14 with value: 1609.1448261457704.[0m
[32m[I 2024-10-13 07:28:35,631][0m Trial 943 finished with value: 1662.2861504145426 and parameters: {'depth': 5, 'learning_rate': 0.02427054215333752, 'iterations': 2669, 'l2_leaf_reg': 0.00028940496394224893, 'border_count': 83, 'bagging_temperature': 0.6980703964235697, 'random_strength': 6.595528028886403, 'grow_policy': 'Lossguide', 'min_data_in_leaf': 395, 'max_leaves': 175}. Best is trial 14 with value: 1609.1448261457704.[0m
[32m[I 2024-10-13 07:28:38,073][0m Trial 944 finished with value: 1778.8102525319696 and parameters: {'depth': 7, 'learning_rate': 0.03120524029196646, 'iterations': 2576, 'l2_leaf_reg': 0.0004179954341338889, 'border_count': 66, 'bagging_temperature': 0.5872549131030744, 'random_strength': 6.499324147873436, 'grow_policy': 'Lossguide', 'min_data_in_leaf': 443, 'max_leaves': 164}. Best is trial 14 with value: 1609.1448261457704.[0m
[32m[I 2024-10-13 07:28:56,889][0m Trial 945 finished with value: 1808.4765677046537 and parameters: {'depth': 7, 'learning_rate': 0.008053411637822508, 'iterations': 2734, 'l2_leaf_reg': 0.0014221631676679207, 'border_count': 77, 'bagging_temperature': 0.669851861166367, 'random_strength': 6.883038746954551, 'grow_policy': 'SymmetricTree', 'min_data_in_leaf': 486}. Best is trial 14 with value: 1609.1448261457704.[0m
[32m[I 2024-10-13 07:28:59,468][0m Trial 946 finished with value: 1668.202802989065 and parameters: {'depth': 6, 'learning_rate': 0.03737957705836476, 'iterations': 2815, 'l2_leaf_reg': 0.0006666715945725197, 'border_count': 86, 'bagging_temperature': 0.6380212219113162, 'random_strength': 7.575740445072442, 'grow_policy': 'Lossguide', 'min_data_in_leaf': 320, 'max_leaves': 159}. Best is trial 14 with value: 1609.1448261457704.[0m
[32m[I 2024-10-13 07:29:01,985][0m Trial 947 finished with value: 1692.7532909220365 and parameters: {'depth': 4, 'learning_rate': 0.027280624468314245, 'iterations': 2699, 'l2_leaf_reg': 4.047526265702226, 'border_count': 95, 'bagging_temperature': 0.8694367045682296, 'random_strength': 7.233534488971559, 'grow_policy': 'Lossguide', 'min_data_in_leaf': 377, 'max_leaves': 107}. Best is trial 14 with value: 1609.1448261457704.[0m
[32m[I 2024-10-13 07:29:04,661][0m Trial 948 finished with value: 1669.4503246406177 and parameters: {'depth': 6, 'learning_rate': 0.03306679551439694, 'iterations': 2817, 'l2_leaf_reg': 0.004313034467307338, 'border_count': 82, 'bagging_temperature': 0.7264451235095537, 'random_strength': 6.731721731307186, 'grow_policy': 'Lossguide', 'min_data_in_leaf': 353, 'max_leaves': 91}. Best is trial 14 with value: 1609.1448261457704.[0m
[32m[I 2024-10-13 07:29:07,168][0m Trial 949 finished with value: 1775.962912296197 and parameters: {'depth': 7, 'learning_rate': 0.04592889953663081, 'iterations': 2630, 'l2_leaf_reg': 1.4228379353523117e-06, 'border_count': 72, 'bagging_temperature': 0.6878101349651541, 'random_strength': 7.022245860195809, 'grow_policy': 'Lossguide', 'min_data_in_leaf': 405, 'max_leaves': 166}. Best is trial 14 with value: 1609.1448261457704.[0m
[32m[I 2024-10-13 07:29:08,880][0m Trial 950 finished with value: 1675.9072920263982 and parameters: {'depth': 7, 'learning_rate': 0.02487060601590553, 'iterations': 1547, 'l2_leaf_reg': 0.002295664878917569, 'border_count': 90, 'bagging_temperature': 0.6561018189729957, 'random_strength': 6.427125910108203, 'grow_policy': 'Depthwise', 'min_data_in_leaf': 388}. Best is trial 14 with value: 1609.1448261457704.[0m
