[32m[I 2024-10-13 06:33:54,812][0m Trial 151 finished with value: 1654.1981931772452 and parameters: {'depth': 12, 'learning_rate': 0.029923587999206615, 'iterations': 2290, 'l2_leaf_reg': 7.832513102719678e-08, 'border_count': 87, 'bagging_temperature': 0.6471557572924056, 'random_strength': 2.966423833947121, 'grow_policy': 'Lossguide', 'min_data_in_leaf': 580, 'max_leaves': 45}. Best is trial 14 with value: 1609.1448261457704.[0m
[32m[I 2024-10-13 06:33:57,006][0m Trial 152 finished with value: 1660.8305006214653 and parameters: {'depth': 14, 'learning_rate': 0.029064463757616843, 'iterations': 2268, 'l2_leaf_reg': 1.7759444988666026e-05, 'border_count': 86, 'bagging_temperature': 0.601040987162953, 'random_strength': 4.405874752069023, 'grow_policy': 'Lossguide', 'min_data_in_leaf': 584, 'max_leaves': 43}. Best is trial 14 with value: 1609.1448261457704.[0m
[32m[I 2024-10-13 06:33:59,206][0m Trial 153 finished with value: 3879.1535088258493 and parameters: {'depth': 11, 'learning_rate': 0.0007404347394708057, 'iterations': 2238, 'l2_leaf_reg': 1.356228195484108e-05, 'border_count': 92, 'bagging_temperature': 0.642569595617974, 'random_strength': 2.6876192985184426, 'grow_policy': 'Lossguide', 'min_data_in_leaf': 598, 'max_leaves': 44}. Best is trial 14 with value: 1609.1448261457704.[0m
[32m[I 2024-10-13 06:34:01,798][0m Trial 154 finished with value: 1698.8198503586443 and parameters: {'depth': 14, 'learning_rate': 0.021716699992523632, 'iterations': 2670, 'l2_leaf_reg': 1.7347387695108546e-05, 'border_count': 87, 'bagging_temperature': 0.11581886048130281, 'random_strength': 2.113545251549539, 'grow_policy': 'Lossguide', 'min_data_in_leaf': 581, 'max_leaves': 35}. Best is trial 14 with value: 1609.1448261457704.[0m
[32m[I 2024-10-13 06:34:04,185][0m Trial 155 finished with value: 1681.305366430906 and parameters: {'depth': 12, 'learning_rate': 0.02759003579872479, 'iterations': 2485, 'l2_leaf_reg': 5.087484387120941e-05, 'border_count': 80, 'bagging_temperature': 0.6101923002207567, 'random_strength': 3.7212428870574694, 'grow_policy': 'Lossguide', 'min_data_in_leaf': 608, 'max_leaves': 31}. Best is trial 14 with value: 1609.1448261457704.[0m
[32m[I 2024-10-13 06:34:06,408][0m Trial 156 finished with value: 1772.208960748519 and parameters: {'depth': 12, 'learning_rate': 0.0328475497312626, 'iterations': 2187, 'l2_leaf_reg': 6.902799114809339e-06, 'border_count': 73, 'bagging_temperature': 0.6756882590461741, 'random_strength': 3.2141385590471847, 'grow_policy': 'Lossguide', 'min_data_in_leaf': 508, 'max_leaves': 41}. Best is trial 14 with value: 1609.1448261457704.[0m
[32m[I 2024-10-13 06:34:08,719][0m Trial 157 finished with value: 1679.7034999346938 and parameters: {'depth': 14, 'learning_rate': 0.01843029104611752, 'iterations': 2384, 'l2_leaf_reg': 9.792121252519872e-05, 'border_count': 108, 'bagging_temperature': 0.5955683685299943, 'random_strength': 4.461790740350706, 'grow_policy': 'Lossguide', 'min_data_in_leaf': 565, 'max_leaves': 55}. Best is trial 14 with value: 1609.1448261457704.[0m
[32m[I 2024-10-13 06:34:10,810][0m Trial 158 finished with value: 1691.3538877741023 and parameters: {'depth': 9, 'learning_rate': 0.05132850196509135, 'iterations': 2088, 'l2_leaf_reg': 2.3799944658567296e-05, 'border_count': 94, 'bagging_temperature': 0.646714919151698, 'random_strength': 4.111553660104081, 'grow_policy': 'Lossguide', 'min_data_in_leaf': 628, 'max_leaves': 46}. Best is trial 14 with value: 1609.1448261457704.[0m
[32m[I 2024-10-13 06:36:45,978][0m Trial 159 finished with value: 1810.8771202074104 and parameters: {'depth': 13, 'learning_rate': 0.022910862810716456, 'iterations': 2544, 'l2_leaf_reg': 0.1983761467189498, 'border_count': 100, 'bagging_temperature': 0.6214737808019938, 'random_strength': 1.3351886004166214, 'grow_policy': 'SymmetricTree', 'min_data_in_leaf': 583}. Best is trial 14 with value: 1609.1448261457704.[0m
[32m[I 2024-10-13 06:36:47,989][0m Trial 160 finished with value: 1696.2860341515695 and parameters: {'depth': 15, 'learning_rate': 0.014248763429291954, 'iterations': 2285, 'l2_leaf_reg': 0.00017977728638630784, 'border_count': 84, 'bagging_temperature': 0.6587302689783594, 'random_strength': 2.83503300182495, 'grow_policy': 'Lossguide', 'min_data_in_leaf': 530, 'max_leaves': 37}. Best is trial 14 with value: 1609.1448261457704.[0m
[32m[I 2024-10-13 06:36:50,299][0m Trial 161 finished with value: 1679.0299157435627 and parameters: {'depth': 11, 'learning_rate': 0.0292582582109328, 'iterations': 2355, 'l2_leaf_reg': 7.443030458307013e-08, 'border_count': 89, 'bagging_temperature': 0.5956845271599839, 'random_strength': 4.720552860153772, 'grow_policy': 'Lossguide', 'min_data_in_leaf': 641, 'max_leaves': 44}. Best is trial 14 with value: 1609.1448261457704.[0m
[32m[I 2024-10-13 06:36:52,533][0m Trial 162 finished with value: 1675.0646569281723 and parameters: {'depth': 14, 'learning_rate': 0.29701789298253434, 'iterations': 2275, 'l2_leaf_reg': 5.111031555685653e-08, 'border_count': 88, 'bagging_temperature': 0.5738487595101024, 'random_strength': 4.981085259118783, 'grow_policy': 'Lossguide', 'min_data_in_leaf': 557, 'max_leaves': 76}. Best is trial 14 with value: 1609.1448261457704.[0m
[32m[I 2024-10-13 06:36:54,860][0m Trial 163 finished with value: 1652.240656369733 and parameters: {'depth': 5, 'learning_rate': 0.03722006013601008, 'iterations': 2457, 'l2_leaf_reg': 3.73979900590948e-05, 'border_count': 76, 'bagging_temperature': 0.541540717421203, 'random_strength': 4.396960990100025, 'grow_policy': 'Lossguide', 'min_data_in_leaf': 489, 'max_leaves': 37}. Best is trial 14 with value: 1609.1448261457704.[0m
[32m[I 2024-10-13 06:36:57,202][0m Trial 164 finished with value: 1660.8711526022266 and parameters: {'depth': 5, 'learning_rate': 0.036864899040338114, 'iterations': 2456, 'l2_leaf_reg': 3.6678391299763205e-05, 'border_count': 79, 'bagging_temperature': 0.5399880287586416, 'random_strength': 4.325549151687608, 'grow_policy': 'Lossguide', 'min_data_in_leaf': 471, 'max_leaves': 36}. Best is trial 14 with value: 1609.1448261457704.[0m
[32m[I 2024-10-13 06:36:59,855][0m Trial 165 finished with value: 1816.2039666931385 and parameters: {'depth': 12, 'learning_rate': 0.03528066466546029, 'iterations': 2759, 'l2_leaf_reg': 3.685407731866537e-05, 'border_count': 72, 'bagging_temperature': 0.19577138866641677, 'random_strength': 4.443078209702213, 'grow_policy': 'Lossguide', 'min_data_in_leaf': 493, 'max_leaves': 36}. Best is trial 14 with value: 1609.1448261457704.[0m
[32m[I 2024-10-13 06:37:02,171][0m Trial 166 finished with value: 1674.261614287165 and parameters: {'depth': 5, 'learning_rate': 0.04755391107398181, 'iterations': 2457, 'l2_leaf_reg': 6.283459509343798e-05, 'border_count': 81, 'bagging_temperature': 0.5075699617328757, 'random_strength': 4.235746054583776, 'grow_policy': 'Lossguide', 'min_data_in_leaf': 476, 'max_leaves': 31}. Best is trial 14 with value: 1609.1448261457704.[0m
[32m[I 2024-10-13 06:37:04,605][0m Trial 167 finished with value: 2045.1688515533988 and parameters: {'depth': 11, 'learning_rate': 0.0031572602563677706, 'iterations': 2564, 'l2_leaf_reg': 1.7464090912053223e-05, 'border_count': 96, 'bagging_temperature': 0.5370274022394497, 'random_strength': 5.0272758909390465, 'grow_policy': 'Lossguide', 'min_data_in_leaf': 447, 'max_leaves': 39}. Best is trial 14 with value: 1609.1448261457704.[0m
[32m[I 2024-10-13 06:37:06,981][0m Trial 168 finished with value: 1823.538460935218 and parameters: {'depth': 5, 'learning_rate': 0.025610093335634982, 'iterations': 2431, 'l2_leaf_reg': 3.441184920537585e-05, 'border_count': 68, 'bagging_temperature': 0.16917713164187204, 'random_strength': 4.669285276592004, 'grow_policy': 'Lossguide', 'min_data_in_leaf': 504, 'max_leaves': 163}. Best is trial 14 with value: 1609.1448261457704.[0m
[32m[I 2024-10-13 06:37:17,104][0m Trial 169 finished with value: 1768.1573400654388 and parameters: {'depth': 5, 'learning_rate': 0.0384930329482595, 'iterations': 2453, 'l2_leaf_reg': 1.1195640335771763e-05, 'border_count': 92, 'bagging_temperature': 0.49196729329213085, 'random_strength': 3.9233065748119422, 'grow_policy': 'SymmetricTree', 'min_data_in_leaf': 536}. Best is trial 14 with value: 1609.1448261457704.[0m
[32m[I 2024-10-13 06:37:20,391][0m Trial 170 finished with value: 1677.7955275313834 and parameters: {'depth': 5, 'learning_rate': 0.050251762400428925, 'iterations': 2523, 'l2_leaf_reg': 2.1040185200976074e-05, 'border_count': 83, 'bagging_temperature': 0.6274034977795587, 'random_strength': 3.044610429418338, 'grow_policy': 'Lossguide', 'min_data_in_leaf': 60, 'max_leaves': 137}. Best is trial 14 with value: 1609.1448261457704.[0m
[32m[I 2024-10-13 06:37:22,881][0m Trial 171 finished with value: 1677.8381280166147 and parameters: {'depth': 13, 'learning_rate': 0.04289368778008913, 'iterations': 2622, 'l2_leaf_reg': 6.730933503814193e-05, 'border_count': 76, 'bagging_temperature': 0.5249161389762131, 'random_strength': 4.3944454828294575, 'grow_policy': 'Lossguide', 'min_data_in_leaf': 477, 'max_leaves': 59}. Best is trial 14 with value: 1609.1448261457704.[0m
[32m[I 2024-10-13 06:37:25,140][0m Trial 172 finished with value: 1893.50366418748 and parameters: {'depth': 10, 'learning_rate': 0.03264899036662454, 'iterations': 2214, 'l2_leaf_reg': 4.299977567249589e-05, 'border_count': 62, 'bagging_temperature': 0.6102787997473137, 'random_strength': 5.466869104673274, 'grow_policy': 'Lossguide', 'min_data_in_leaf': 601, 'max_leaves': 50}. Best is trial 14 with value: 1609.1448261457704.[0m
[32m[I 2024-10-13 06:37:27,401][0m Trial 173 finished with value: 1678.4963320487027 and parameters: {'depth': 5, 'learning_rate': 0.06425960519499563, 'iterations': 2379, 'l2_leaf_reg': 1.654511728322586e-05, 'border_count': 79, 'bagging_temperature': 0.5866039014648476, 'random_strength': 4.052241608613625, 'grow_policy': 'Lossguide', 'min_data_in_leaf': 412, 'max_leaves': 42}. Best is trial 14 with value: 1609.1448261457704.[0m
[32m[I 2024-10-13 06:37:29,508][0m Trial 174 finished with value: 1753.0179374276831 and parameters: {'depth': 5, 'learning_rate': 0.040083671723979176, 'iterations': 2120, 'l2_leaf_reg': 3.274111007825438, 'border_count': 75, 'bagging_temperature': 0.5474628533095739, 'random_strength': 4.639127270288291, 'grow_policy': 'Lossguide', 'min_data_in_leaf': 732, 'max_leaves': 36}. Best is trial 14 with value: 1609.1448261457704.[0m
[32m[I 2024-10-13 06:37:31,693][0m Trial 175 finished with value: 1680.1201573720434 and parameters: {'depth': 3, 'learning_rate': 0.05565846757345184, 'iterations': 2266, 'l2_leaf_reg': 2.8143108840784304e-05, 'border_count': 86, 'bagging_temperature': 0.6721358111798119, 'random_strength': 5.25571340737349, 'grow_policy': 'Lossguide', 'min_data_in_leaf': 622, 'max_leaves': 44}. Best is trial 14 with value: 1609.1448261457704.[0m
[32m[I 2024-10-13 06:37:33,928][0m Trial 176 finished with value: 1707.0655343329263 and parameters: {'depth': 5, 'learning_rate': 0.026223292032751602, 'iterations': 2341, 'l2_leaf_reg': 1.0603517370616297e-07, 'border_count': 104, 'bagging_temperature': 0.06947920600480328, 'random_strength': 3.7350973598207498, 'grow_policy': 'Lossguide', 'min_data_in_leaf': 577, 'max_leaves': 53}. Best is trial 14 with value: 1609.1448261457704.[0m
[32m[I 2024-10-13 06:37:36,489][0m Trial 177 finished with value: 1722.2033965253083 and parameters: {'depth': 4, 'learning_rate': 0.21578491953001935, 'iterations': 2704, 'l2_leaf_reg': 0.000111312654520771, 'border_count': 92, 'bagging_temperature': 0.7040468815248591, 'random_strength': 4.938045112368332, 'grow_policy': 'Lossguide', 'min_data_in_leaf': 463, 'max_leaves': 48}. Best is trial 14 with value: 1609.1448261457704.[0m
[32m[I 2024-10-13 06:37:38,645][0m Trial 178 finished with value: 1659.1382594920076 and parameters: {'depth': 9, 'learning_rate': 0.033912743633549874, 'iterations': 2159, 'l2_leaf_reg': 0.00031664755196076364, 'border_count': 80, 'bagging_temperature': 0.641719179197381, 'random_strength': 4.250892374929825, 'grow_policy': 'Lossguide', 'min_data_in_leaf': 636, 'max_leaves': 66}. Best is trial 14 with value: 1609.1448261457704.[0m
[32m[I 2024-10-13 06:38:03,770][0m Trial 179 finished with value: 2052.212868795035 and parameters: {'depth': 10, 'learning_rate': 0.032295207931452755, 'iterations': 1146, 'l2_leaf_reg': 0.009651353225044403, 'border_count': 84, 'bagging_temperature': 0.6327741578101158, 'random_strength': 4.185108142322857, 'grow_policy': 'SymmetricTree', 'min_data_in_leaf': 600}. Best is trial 14 with value: 1609.1448261457704.[0m
[32m[I 2024-10-13 06:38:05,920][0m Trial 180 finished with value: 1728.2570700279523 and parameters: {'depth': 8, 'learning_rate': 0.02155670905415458, 'iterations': 2171, 'l2_leaf_reg': 0.001909935057733763, 'border_count': 98, 'bagging_temperature': 0.22334433210774765, 'random_strength': 4.4393959998532075, 'grow_policy': 'Lossguide', 'min_data_in_leaf': 519, 'max_leaves': 64}. Best is trial 14 with value: 1609.1448261457704.[0m
[32m[I 2024-10-13 06:38:08,207][0m Trial 181 finished with value: 1737.8446303207984 and parameters: {'depth': 9, 'learning_rate': 0.03844166957974002, 'iterations': 2308, 'l2_leaf_reg': 1.2773296598649247e-05, 'border_count': 75, 'bagging_temperature': 0.6500783567766606, 'random_strength': 4.68460411595759, 'grow_policy': 'Lossguide', 'min_data_in_leaf': 643, 'max_leaves': 35}. Best is trial 14 with value: 1609.1448261457704.[0m
[32m[I 2024-10-13 06:38:10,392][0m Trial 182 finished with value: 1696.0962791155398 and parameters: {'depth': 8, 'learning_rate': 0.02847600174665448, 'iterations': 2204, 'l2_leaf_reg': 0.00033426054316020406, 'border_count': 80, 'bagging_temperature': 0.6858750330171588, 'random_strength': 4.340729934572569, 'grow_policy': 'Lossguide', 'min_data_in_leaf': 627, 'max_leaves': 72}. Best is trial 14 with value: 1609.1448261457704.[0m
[32m[I 2024-10-13 06:38:12,391][0m Trial 183 finished with value: 1696.5684259332863 and parameters: {'depth': 4, 'learning_rate': 0.04627103491531831, 'iterations': 2039, 'l2_leaf_reg': 8.88949510926693e-06, 'border_count': 87, 'bagging_temperature': 0.5543671951232544, 'random_strength': 3.897586169131945, 'grow_policy': 'Lossguide', 'min_data_in_leaf': 694, 'max_leaves': 41}. Best is trial 14 with value: 1609.1448261457704.[0m
[32m[I 2024-10-13 06:38:14,999][0m Trial 184 finished with value: 1773.2695182175767 and parameters: {'depth': 3, 'learning_rate': 0.031145247976630198, 'iterations': 2835, 'l2_leaf_reg': 5.622339124145083e-05, 'border_count': 71, 'bagging_temperature': 0.5905421207342305, 'random_strength': 3.589616670822535, 'grow_policy': 'Lossguide', 'min_data_in_leaf': 673, 'max_leaves': 67}. Best is trial 14 with value: 1609.1448261457704.[0m
[32m[I 2024-10-13 06:38:17,166][0m Trial 185 finished with value: 1663.9104642577765 and parameters: {'depth': 11, 'learning_rate': 0.03595764560856634, 'iterations': 2140, 'l2_leaf_reg': 0.0042581777319320524, 'border_count': 91, 'bagging_temperature': 0.6088678796787735, 'random_strength': 4.551281639396779, 'grow_policy': 'Lossguide', 'min_data_in_leaf': 716, 'max_leaves': 81}. Best is trial 14 with value: 1609.1448261457704.[0m
[32m[I 2024-10-13 06:38:19,292][0m Trial 186 finished with value: 1657.6259318408881 and parameters: {'depth': 11, 'learning_rate': 0.0243917282519759, 'iterations': 2108, 'l2_leaf_reg': 0.003788434568833838, 'border_count': 91, 'bagging_temperature': 0.6177040787867817, 'random_strength': 4.501895221893889, 'grow_policy': 'Lossguide', 'min_data_in_leaf': 801, 'max_leaves': 90}. Best is trial 14 with value: 1609.1448261457704.[0m
[32m[I 2024-10-13 06:38:21,409][0m Trial 187 finished with value: 1653.1361264515476 and parameters: {'depth': 11, 'learning_rate': 0.024461267676066715, 'iterations': 2120, 'l2_leaf_reg': 0.004841334206139613, 'border_count': 91, 'bagging_temperature': 0.6590104611068798, 'random_strength': 4.585867457043356, 'grow_policy': 'Lossguide', 'min_data_in_leaf': 718, 'max_leaves': 83}. Best is trial 14 with value: 1609.1448261457704.[0m
[32m[I 2024-10-13 06:38:23,517][0m Trial 188 finished with value: 1698.5435064612736 and parameters: {'depth': 11, 'learning_rate': 0.020088920954777222, 'iterations': 2079, 'l2_leaf_reg': 0.005066969366803109, 'border_count': 96, 'bagging_temperature': 0.659726310553733, 'random_strength': 5.136959170665529, 'grow_policy': 'Lossguide', 'min_data_in_leaf': 430, 'max_leaves': 93}. Best is trial 14 with value: 1609.1448261457704.[0m
[32m[I 2024-10-13 06:38:25,688][0m Trial 189 finished with value: 1653.0952557331464 and parameters: {'depth': 12, 'learning_rate': 0.02371280216672931, 'iterations': 2254, 'l2_leaf_reg': 0.011999159359425051, 'border_count': 89, 'bagging_temperature': 0.71854144359779, 'random_strength': 4.059338251567682, 'grow_policy': 'Lossguide', 'min_data_in_leaf': 777, 'max_leaves': 89}. Best is trial 14 with value: 1609.1448261457704.[0m
[32m[I 2024-10-13 06:40:02,734][0m Trial 190 finished with value: 1932.4403538123138 and parameters: {'depth': 12, 'learning_rate': 0.01640763392683097, 'iterations': 2016, 'l2_leaf_reg': 0.015859897479519217, 'border_count': 85, 'bagging_temperature': 0.7163819482972362, 'random_strength': 3.997483165751359, 'grow_policy': 'SymmetricTree', 'min_data_in_leaf': 801}. Best is trial 14 with value: 1609.1448261457704.[0m
[32m[I 2024-10-13 06:40:04,794][0m Trial 191 finished with value: 1652.0131370041217 and parameters: {'depth': 12, 'learning_rate': 0.023244498070774326, 'iterations': 2254, 'l2_leaf_reg': 0.013398432753234286, 'border_count': 91, 'bagging_temperature': 0.6797246807739901, 'random_strength': 4.191237576148968, 'grow_policy': 'Lossguide', 'min_data_in_leaf': 755, 'max_leaves': 86}. Best is trial 14 with value: 1609.1448261457704.[0m
[32m[I 2024-10-13 06:40:06,994][0m Trial 192 finished with value: 1689.7095925994872 and parameters: {'depth': 12, 'learning_rate': 0.025123271749991107, 'iterations': 2241, 'l2_leaf_reg': 0.018009082077657203, 'border_count': 81, 'bagging_temperature': 0.7380259407294241, 'random_strength': 4.223207667321043, 'grow_policy': 'Lossguide', 'min_data_in_leaf': 758, 'max_leaves': 86}. Best is trial 14 with value: 1609.1448261457704.[0m
[32m[I 2024-10-13 06:40:09,287][0m Trial 193 finished with value: 1665.2212335916051 and parameters: {'depth': 11, 'learning_rate': 0.02363021920169286, 'iterations': 2379, 'l2_leaf_reg': 0.05821530692932986, 'border_count': 90, 'bagging_temperature': 0.6855262263143413, 'random_strength': 3.8304462369115373, 'grow_policy': 'Lossguide', 'min_data_in_leaf': 775, 'max_leaves': 77}. Best is trial 14 with value: 1609.1448261457704.[0m
[32m[I 2024-10-13 06:40:11,394][0m Trial 194 finished with value: 1718.1317469329372 and parameters: {'depth': 12, 'learning_rate': 0.018689141341487872, 'iterations': 2133, 'l2_leaf_reg': 0.00839127241085369, 'border_count': 100, 'bagging_temperature': 0.7033253803630654, 'random_strength': 4.45146286771152, 'grow_policy': 'Lossguide', 'min_data_in_leaf': 825, 'max_leaves': 82}. Best is trial 14 with value: 1609.1448261457704.[0m
[32m[I 2024-10-13 06:40:13,687][0m Trial 195 finished with value: 1687.8493340245889 and parameters: {'depth': 12, 'learning_rate': 0.020644854125023558, 'iterations': 2326, 'l2_leaf_reg': 0.01131131926171943, 'border_count': 95, 'bagging_temperature': 0.6718778921590458, 'random_strength': 4.17370428939624, 'grow_policy': 'Lossguide', 'min_data_in_leaf': 749, 'max_leaves': 89}. Best is trial 14 with value: 1609.1448261457704.[0m
[32m[I 2024-10-13 06:40:16,014][0m Trial 196 finished with value: 1688.215648344732 and parameters: {'depth': 11, 'learning_rate': 0.013547508274327838, 'iterations': 2430, 'l2_leaf_reg': 0.022230769790125726, 'border_count': 84, 'bagging_temperature': 0.6415000770298462, 'random_strength': 4.5533796547600325, 'grow_policy': 'Lossguide', 'min_data_in_leaf': 816, 'max_leaves': 75}. Best is trial 14 with value: 1609.1448261457704.[0m
[32m[I 2024-10-13 06:40:18,189][0m Trial 197 finished with value: 1656.9838122213116 and parameters: {'depth': 13, 'learning_rate': 0.026010800961350247, 'iterations': 2239, 'l2_leaf_reg': 0.04128176937299609, 'border_count': 88, 'bagging_temperature': 0.6517502268869361, 'random_strength': 4.340864543963386, 'grow_policy': 'Lossguide', 'min_data_in_leaf': 782, 'max_leaves': 85}. Best is trial 14 with value: 1609.1448261457704.[0m
[32m[I 2024-10-13 06:40:20,356][0m Trial 198 finished with value: 1671.0368176193183 and parameters: {'depth': 13, 'learning_rate': 0.025815488918030587, 'iterations': 2179, 'l2_leaf_reg': 0.06279816619547887, 'border_count': 79, 'bagging_temperature': 0.6533264204446904, 'random_strength': 4.0216712927212335, 'grow_policy': 'Lossguide', 'min_data_in_leaf': 732, 'max_leaves': 105}. Best is trial 14 with value: 1609.1448261457704.[0m
[32m[I 2024-10-13 06:40:22,533][0m Trial 199 finished with value: 1654.6780941470392 and parameters: {'depth': 13, 'learning_rate': 0.02214565276254533, 'iterations': 2247, 'l2_leaf_reg': 0.035198080233854276, 'border_count': 91, 'bagging_temperature': 0.7195147066086182, 'random_strength': 4.306336015576357, 'grow_policy': 'Lossguide', 'min_data_in_leaf': 802, 'max_leaves': 88}. Best is trial 14 with value: 1609.1448261457704.[0m
[32m[I 2024-10-13 06:40:24,707][0m Trial 200 finished with value: 1674.6329651528738 and parameters: {'depth': 13, 'learning_rate': 0.022398969228323403, 'iterations': 2240, 'l2_leaf_reg': 0.025239399990049233, 'border_count': 95, 'bagging_temperature': 0.7220097583027956, 'random_strength': 4.211943686063842, 'grow_policy': 'Lossguide', 'min_data_in_leaf': 791, 'max_leaves': 89}. Best is trial 14 with value: 1609.1448261457704.[0m
