[32m[I 2024-10-13 06:54:08,195][0m Trial 401 finished with value: 1699.94637673477 and parameters: {'depth': 3, 'learning_rate': 0.0295699002891576, 'iterations': 2947, 'l2_leaf_reg': 0.0011520612606349366, 'border_count': 180, 'bagging_temperature': 0.7196797792774994, 'random_strength': 6.656634353642875, 'grow_policy': 'Lossguide', 'min_data_in_leaf': 365, 'max_leaves': 62}. Best is trial 14 with value: 1609.1448261457704.[0m
[32m[I 2024-10-13 06:54:12,800][0m Trial 402 finished with value: 4294.501112217616 and parameters: {'depth': 3, 'learning_rate': 0.0002629523471313855, 'iterations': 2930, 'l2_leaf_reg': 0.0003089113509955693, 'border_count': 102, 'bagging_temperature': 0.740437335134109, 'random_strength': 6.878962797399069, 'grow_policy': 'Lossguide', 'min_data_in_leaf': 4, 'max_leaves': 177}. Best is trial 14 with value: 1609.1448261457704.[0m
[32m[I 2024-10-13 06:54:15,589][0m Trial 403 finished with value: 1654.5833837585444 and parameters: {'depth': 3, 'learning_rate': 0.01790090244664492, 'iterations': 2995, 'l2_leaf_reg': 0.0005433234086992309, 'border_count': 90, 'bagging_temperature': 0.7089706236093185, 'random_strength': 6.898622449742887, 'grow_policy': 'Lossguide', 'min_data_in_leaf': 333, 'max_leaves': 167}. Best is trial 14 with value: 1609.1448261457704.[0m
[32m[I 2024-10-13 06:54:18,171][0m Trial 404 finished with value: 1651.092311737424 and parameters: {'depth': 3, 'learning_rate': 0.04998635887514069, 'iterations': 2835, 'l2_leaf_reg': 0.00018700175517878982, 'border_count': 88, 'bagging_temperature': 0.77130055396592, 'random_strength': 6.2766259403409865, 'grow_policy': 'Lossguide', 'min_data_in_leaf': 347, 'max_leaves': 173}. Best is trial 14 with value: 1609.1448261457704.[0m
[32m[I 2024-10-13 06:54:20,823][0m Trial 405 finished with value: 1661.0975880714961 and parameters: {'depth': 3, 'learning_rate': 0.03465782327834584, 'iterations': 2880, 'l2_leaf_reg': 0.0004310755697256158, 'border_count': 96, 'bagging_temperature': 0.6960458943209368, 'random_strength': 7.062679595194132, 'grow_policy': 'Lossguide', 'min_data_in_leaf': 359, 'max_leaves': 71}. Best is trial 14 with value: 1609.1448261457704.[0m
[32m[I 2024-10-13 06:54:23,541][0m Trial 406 finished with value: 1781.6735863466042 and parameters: {'depth': 4, 'learning_rate': 0.25799081050558065, 'iterations': 2933, 'l2_leaf_reg': 0.00011666040950052416, 'border_count': 79, 'bagging_temperature': 0.7255699753324379, 'random_strength': 6.7547549278895636, 'grow_policy': 'Lossguide', 'min_data_in_leaf': 377, 'max_leaves': 179}. Best is trial 14 with value: 1609.1448261457704.[0m
[32m[I 2024-10-13 06:54:26,232][0m Trial 407 finished with value: 1639.5346429881874 and parameters: {'depth': 3, 'learning_rate': 0.022021909092706682, 'iterations': 2845, 'l2_leaf_reg': 0.0006496021953162401, 'border_count': 87, 'bagging_temperature': 0.6926094434316196, 'random_strength': 7.095534876012173, 'grow_policy': 'Lossguide', 'min_data_in_leaf': 400, 'max_leaves': 164}. Best is trial 14 with value: 1609.1448261457704.[0m
[32m[I 2024-10-13 06:54:28,858][0m Trial 408 finished with value: 1652.4915363547425 and parameters: {'depth': 3, 'learning_rate': 0.02093520673767243, 'iterations': 2824, 'l2_leaf_reg': 0.0007111716539321669, 'border_count': 86, 'bagging_temperature': 0.73956673819545, 'random_strength': 6.6173664079348855, 'grow_policy': 'Lossguide', 'min_data_in_leaf': 316, 'max_leaves': 172}. Best is trial 14 with value: 1609.1448261457704.[0m
[32m[I 2024-10-13 06:54:31,525][0m Trial 409 finished with value: 1783.4995690001626 and parameters: {'depth': 3, 'learning_rate': 0.015111995619749926, 'iterations': 2908, 'l2_leaf_reg': 0.0004556489263493885, 'border_count': 74, 'bagging_temperature': 0.7050208078606867, 'random_strength': 6.991832514502229, 'grow_policy': 'Lossguide', 'min_data_in_leaf': 394, 'max_leaves': 162}. Best is trial 14 with value: 1609.1448261457704.[0m
[32m[I 2024-10-13 06:54:34,168][0m Trial 410 finished with value: 1654.5238138599752 and parameters: {'depth': 3, 'learning_rate': 0.02146211810999802, 'iterations': 2856, 'l2_leaf_reg': 0.0007546807792373828, 'border_count': 80, 'bagging_temperature': 0.6928857959630925, 'random_strength': 7.097200210492061, 'grow_policy': 'Lossguide', 'min_data_in_leaf': 363, 'max_leaves': 167}. Best is trial 14 with value: 1609.1448261457704.[0m
[32m[I 2024-10-13 06:54:44,775][0m Trial 411 finished with value: 1879.0649920476062 and parameters: {'depth': 4, 'learning_rate': 0.02547540454088438, 'iterations': 2995, 'l2_leaf_reg': 0.0010105770499146698, 'border_count': 66, 'bagging_temperature': 0.7170599741806394, 'random_strength': 6.787827039725525, 'grow_policy': 'SymmetricTree', 'min_data_in_leaf': 409}. Best is trial 14 with value: 1609.1448261457704.[0m
[32m[I 2024-10-13 06:54:47,269][0m Trial 412 finished with value: 1658.2068028592728 and parameters: {'depth': 3, 'learning_rate': 0.01863672569316619, 'iterations': 2786, 'l2_leaf_reg': 0.00038150497786225245, 'border_count': 87, 'bagging_temperature': 0.6848508938711119, 'random_strength': 5.72381167613027, 'grow_policy': 'Lossguide', 'min_data_in_leaf': 380, 'max_leaves': 164}. Best is trial 14 with value: 1609.1448261457704.[0m
[32m[I 2024-10-13 06:54:50,103][0m Trial 413 finished with value: 1690.5485294720554 and parameters: {'depth': 4, 'learning_rate': 0.029238789958311598, 'iterations': 3000, 'l2_leaf_reg': 0.0005389735901793677, 'border_count': 93, 'bagging_temperature': 0.6628518911607534, 'random_strength': 6.458128916767082, 'grow_policy': 'Depthwise', 'min_data_in_leaf': 333}. Best is trial 14 with value: 1609.1448261457704.[0m
[32m[I 2024-10-13 06:54:52,834][0m Trial 414 finished with value: 1654.2498227779881 and parameters: {'depth': 3, 'learning_rate': 0.025547043991822598, 'iterations': 2911, 'l2_leaf_reg': 0.0008105968823057655, 'border_count': 82, 'bagging_temperature': 0.6860813373185227, 'random_strength': 7.204060639360753, 'grow_policy': 'Lossguide', 'min_data_in_leaf': 396, 'max_leaves': 159}. Best is trial 14 with value: 1609.1448261457704.[0m
[32m[I 2024-10-13 06:54:55,471][0m Trial 415 finished with value: 1755.9000865798398 and parameters: {'depth': 4, 'learning_rate': 0.039368082361956214, 'iterations': 2812, 'l2_leaf_reg': 0.00031614343792438335, 'border_count': 72, 'bagging_temperature': 0.7283013703626473, 'random_strength': 6.870529453705998, 'grow_policy': 'Lossguide', 'min_data_in_leaf': 366, 'max_leaves': 169}. Best is trial 14 with value: 1609.1448261457704.[0m
[32m[I 2024-10-13 06:54:57,997][0m Trial 416 finished with value: 1655.4432784466899 and parameters: {'depth': 6, 'learning_rate': 0.03157866511162829, 'iterations': 2742, 'l2_leaf_reg': 0.00015237259608837138, 'border_count': 78, 'bagging_temperature': 0.6632704035994944, 'random_strength': 7.0450890246176385, 'grow_policy': 'Lossguide', 'min_data_in_leaf': 839, 'max_leaves': 180}. Best is trial 14 with value: 1609.1448261457704.[0m
[32m[I 2024-10-13 06:55:00,629][0m Trial 417 finished with value: 1725.553741899958 and parameters: {'depth': 3, 'learning_rate': 0.008058818430105554, 'iterations': 2848, 'l2_leaf_reg': 0.0005428757650009136, 'border_count': 86, 'bagging_temperature': 0.6994727803269598, 'random_strength': 6.690655656397244, 'grow_policy': 'Lossguide', 'min_data_in_leaf': 411, 'max_leaves': 173}. Best is trial 14 with value: 1609.1448261457704.[0m
[32m[I 2024-10-13 06:55:03,291][0m Trial 418 finished with value: 1646.2556218513023 and parameters: {'depth': 3, 'learning_rate': 0.023326719017297173, 'iterations': 2884, 'l2_leaf_reg': 0.0002392438225200328, 'border_count': 91, 'bagging_temperature': 0.6540770333257779, 'random_strength': 7.2913212181949225, 'grow_policy': 'Lossguide', 'min_data_in_leaf': 351, 'max_leaves': 155}. Best is trial 14 with value: 1609.1448261457704.[0m
[32m[I 2024-10-13 06:55:06,066][0m Trial 419 finished with value: 1693.5542787512559 and parameters: {'depth': 3, 'learning_rate': 0.017191106367531062, 'iterations': 2926, 'l2_leaf_reg': 0.00020116108933572636, 'border_count': 100, 'bagging_temperature': 0.6813796094901666, 'random_strength': 7.296837387023199, 'grow_policy': 'Lossguide', 'min_data_in_leaf': 340, 'max_leaves': 154}. Best is trial 14 with value: 1609.1448261457704.[0m
[32m[I 2024-10-13 06:55:08,775][0m Trial 420 finished with value: 1641.285955466739 and parameters: {'depth': 3, 'learning_rate': 0.022162789073509128, 'iterations': 2863, 'l2_leaf_reg': 0.0007377921147917333, 'border_count': 91, 'bagging_temperature': 0.6602276713568193, 'random_strength': 5.105412952312463, 'grow_policy': 'Lossguide', 'min_data_in_leaf': 313, 'max_leaves': 153}. Best is trial 14 with value: 1609.1448261457704.[0m
[32m[I 2024-10-13 06:55:11,359][0m Trial 421 finished with value: 1681.8341194787326 and parameters: {'depth': 3, 'learning_rate': 0.022146754341166683, 'iterations': 2857, 'l2_leaf_reg': 0.0006792535985539465, 'border_count': 107, 'bagging_temperature': 0.6531837923667154, 'random_strength': 5.179485498532133, 'grow_policy': 'Lossguide', 'min_data_in_leaf': 303, 'max_leaves': 154}. Best is trial 14 with value: 1609.1448261457704.[0m
[32m[I 2024-10-13 06:55:13,934][0m Trial 422 finished with value: 1711.9951361745743 and parameters: {'depth': 3, 'learning_rate': 0.013390937739786618, 'iterations': 2796, 'l2_leaf_reg': 0.001017005165729981, 'border_count': 93, 'bagging_temperature': 0.6727220692450758, 'random_strength': 7.270228031973415, 'grow_policy': 'Lossguide', 'min_data_in_leaf': 288, 'max_leaves': 159}. Best is trial 14 with value: 1609.1448261457704.[0m
[32m[I 2024-10-13 06:55:16,662][0m Trial 423 finished with value: 1649.978273118213 and parameters: {'depth': 3, 'learning_rate': 0.01918149456959692, 'iterations': 2908, 'l2_leaf_reg': 0.0003351769983941839, 'border_count': 90, 'bagging_temperature': 0.7103107741210651, 'random_strength': 5.440696774025942, 'grow_policy': 'Lossguide', 'min_data_in_leaf': 319, 'max_leaves': 149}. Best is trial 14 with value: 1609.1448261457704.[0m
[32m[I 2024-10-13 06:55:25,952][0m Trial 424 finished with value: 1661.6530922133054 and parameters: {'depth': 3, 'learning_rate': 0.023247661519780145, 'iterations': 2874, 'l2_leaf_reg': 0.0011654964895731115, 'border_count': 99, 'bagging_temperature': 0.6566610263791522, 'random_strength': 5.095881705372091, 'grow_policy': 'SymmetricTree', 'min_data_in_leaf': 330}. Best is trial 14 with value: 1609.1448261457704.[0m
[32m[I 2024-10-13 06:55:28,646][0m Trial 425 finished with value: 1647.868344081608 and parameters: {'depth': 3, 'learning_rate': 0.020909951051042246, 'iterations': 2941, 'l2_leaf_reg': 0.0006460107421922855, 'border_count': 83, 'bagging_temperature': 0.6852177383484435, 'random_strength': 4.997741308756711, 'grow_policy': 'Lossguide', 'min_data_in_leaf': 363, 'max_leaves': 162}. Best is trial 14 with value: 1609.1448261457704.[0m
[32m[I 2024-10-13 06:55:31,364][0m Trial 426 finished with value: 1685.3640793535285 and parameters: {'depth': 3, 'learning_rate': 0.019858347873565007, 'iterations': 2956, 'l2_leaf_reg': 0.0009722289078626077, 'border_count': 77, 'bagging_temperature': 0.22866507566438432, 'random_strength': 4.845801393765231, 'grow_policy': 'Lossguide', 'min_data_in_leaf': 265, 'max_leaves': 155}. Best is trial 14 with value: 1609.1448261457704.[0m
[32m[I 2024-10-13 06:55:34,024][0m Trial 427 finished with value: 1658.2368758722519 and parameters: {'depth': 3, 'learning_rate': 0.01782338537013604, 'iterations': 2919, 'l2_leaf_reg': 0.0005936748270857483, 'border_count': 83, 'bagging_temperature': 0.6951547588794432, 'random_strength': 5.320404173140114, 'grow_policy': 'Lossguide', 'min_data_in_leaf': 311, 'max_leaves': 157}. Best is trial 14 with value: 1609.1448261457704.[0m
[32m[I 2024-10-13 06:55:36,911][0m Trial 428 finished with value: 1738.5330730700769 and parameters: {'depth': 3, 'learning_rate': 0.013109122476639947, 'iterations': 2830, 'l2_leaf_reg': 0.00030099112045873296, 'border_count': 68, 'bagging_temperature': 0.7539692366266574, 'random_strength': 5.084674845227095, 'grow_policy': 'Lossguide', 'min_data_in_leaf': 90, 'max_leaves': 163}. Best is trial 14 with value: 1609.1448261457704.[0m
[32m[I 2024-10-13 06:55:39,608][0m Trial 429 finished with value: 1675.4986849665213 and parameters: {'depth': 3, 'learning_rate': 0.015558310483619636, 'iterations': 2944, 'l2_leaf_reg': 0.0003648086729110661, 'border_count': 82, 'bagging_temperature': 0.6602220068085632, 'random_strength': 4.793986296128102, 'grow_policy': 'Lossguide', 'min_data_in_leaf': 345, 'max_leaves': 163}. Best is trial 14 with value: 1609.1448261457704.[0m
[32m[I 2024-10-13 06:55:42,194][0m Trial 430 finished with value: 1700.1793874512773 and parameters: {'depth': 3, 'learning_rate': 0.011043346333612298, 'iterations': 2772, 'l2_leaf_reg': 0.0006907962950925235, 'border_count': 77, 'bagging_temperature': 0.7103671856392608, 'random_strength': 4.991616773955093, 'grow_policy': 'Lossguide', 'min_data_in_leaf': 362, 'max_leaves': 152}. Best is trial 14 with value: 1609.1448261457704.[0m
[32m[I 2024-10-13 06:55:44,936][0m Trial 431 finished with value: 1686.4135987024536 and parameters: {'depth': 3, 'learning_rate': 0.021716721317163977, 'iterations': 2865, 'l2_leaf_reg': 0.00024750428441810507, 'border_count': 86, 'bagging_temperature': 0.15800700062672823, 'random_strength': 5.157424259803129, 'grow_policy': 'Lossguide', 'min_data_in_leaf': 350, 'max_leaves': 159}. Best is trial 14 with value: 1609.1448261457704.[0m
[32m[I 2024-10-13 06:55:47,675][0m Trial 432 finished with value: 1784.2726066581743 and parameters: {'depth': 3, 'learning_rate': 0.02462233049673969, 'iterations': 2998, 'l2_leaf_reg': 0.00047786694204413353, 'border_count': 71, 'bagging_temperature': 0.6803967625829784, 'random_strength': 4.996903042189423, 'grow_policy': 'Lossguide', 'min_data_in_leaf': 373, 'max_leaves': 150}. Best is trial 14 with value: 1609.1448261457704.[0m
[32m[I 2024-10-13 06:55:50,259][0m Trial 433 finished with value: 1684.0845621178046 and parameters: {'depth': 3, 'learning_rate': 0.016312981632877938, 'iterations': 2786, 'l2_leaf_reg': 0.0014636674859101096, 'border_count': 82, 'bagging_temperature': 0.7291472105500776, 'random_strength': 7.165311768707939, 'grow_policy': 'Lossguide', 'min_data_in_leaf': 298, 'max_leaves': 139}. Best is trial 14 with value: 1609.1448261457704.[0m
[32m[I 2024-10-13 06:55:53,037][0m Trial 434 finished with value: 1688.0533027695992 and parameters: {'depth': 3, 'learning_rate': 0.027652607187781134, 'iterations': 2888, 'l2_leaf_reg': 0.0006980280112994384, 'border_count': 95, 'bagging_temperature': 0.6476511583543808, 'random_strength': 7.577763623659605, 'grow_policy': 'Depthwise', 'min_data_in_leaf': 354}. Best is trial 14 with value: 1609.1448261457704.[0m
[32m[I 2024-10-13 06:55:55,803][0m Trial 435 finished with value: 1652.1544262477391 and parameters: {'depth': 3, 'learning_rate': 0.020196303684012158, 'iterations': 2934, 'l2_leaf_reg': 0.0004633018828712966, 'border_count': 88, 'bagging_temperature': 0.6919389817870193, 'random_strength': 5.446620320390874, 'grow_policy': 'Lossguide', 'min_data_in_leaf': 330, 'max_leaves': 65}. Best is trial 14 with value: 1609.1448261457704.[0m
[32m[I 2024-10-13 06:55:58,397][0m Trial 436 finished with value: 1746.7536558651811 and parameters: {'depth': 3, 'learning_rate': 0.022837063839754177, 'iterations': 2741, 'l2_leaf_reg': 0.0009314083309502669, 'border_count': 74, 'bagging_temperature': 0.6679208006989271, 'random_strength': 0.9934999652244789, 'grow_policy': 'Lossguide', 'min_data_in_leaf': 387, 'max_leaves': 161}. Best is trial 14 with value: 1609.1448261457704.[0m
[32m[I 2024-10-13 06:56:01,062][0m Trial 437 finished with value: 1683.8351579383975 and parameters: {'depth': 3, 'learning_rate': 0.04525548093435274, 'iterations': 2825, 'l2_leaf_reg': 0.001568909644717453, 'border_count': 127, 'bagging_temperature': 0.7932612951887732, 'random_strength': 5.262826075266721, 'grow_policy': 'Lossguide', 'min_data_in_leaf': 427, 'max_leaves': 164}. Best is trial 14 with value: 1609.1448261457704.[0m
[32m[I 2024-10-13 06:56:15,310][0m Trial 438 finished with value: 1817.2016279364927 and parameters: {'depth': 6, 'learning_rate': 0.09840530824912777, 'iterations': 2869, 'l2_leaf_reg': 0.00020237214289264713, 'border_count': 79, 'bagging_temperature': 0.6416684134217127, 'random_strength': 4.748451376809649, 'grow_policy': 'SymmetricTree', 'min_data_in_leaf': 374}. Best is trial 14 with value: 1609.1448261457704.[0m
[32m[I 2024-10-13 06:56:17,950][0m Trial 439 finished with value: 1663.6430830696147 and parameters: {'depth': 3, 'learning_rate': 0.027095056878040907, 'iterations': 2943, 'l2_leaf_reg': 0.0004931550380921352, 'border_count': 91, 'bagging_temperature': 0.6758427760107316, 'random_strength': 7.3942357391991385, 'grow_policy': 'Lossguide', 'min_data_in_leaf': 403, 'max_leaves': 155}. Best is trial 14 with value: 1609.1448261457704.[0m
[32m[I 2024-10-13 06:56:20,483][0m Trial 440 finished with value: 1701.8344848628471 and parameters: {'depth': 3, 'learning_rate': 0.07465037877777814, 'iterations': 2739, 'l2_leaf_reg': 0.00077546445340149, 'border_count': 85, 'bagging_temperature': 0.13015800205723305, 'random_strength': 6.917460662595126, 'grow_policy': 'Lossguide', 'min_data_in_leaf': 357, 'max_leaves': 170}. Best is trial 14 with value: 1609.1448261457704.[0m
[32m[I 2024-10-13 06:56:23,209][0m Trial 441 finished with value: 1720.8314495997795 and parameters: {'depth': 4, 'learning_rate': 0.03611546602365378, 'iterations': 2823, 'l2_leaf_reg': 0.001217480139694116, 'border_count': 75, 'bagging_temperature': 0.7165441523334105, 'random_strength': 5.580428158006191, 'grow_policy': 'Lossguide', 'min_data_in_leaf': 422, 'max_leaves': 56}. Best is trial 14 with value: 1609.1448261457704.[0m
[32m[I 2024-10-13 06:56:24,814][0m Trial 442 finished with value: 1719.6261268647843 and parameters: {'depth': 3, 'learning_rate': 0.028130044492306307, 'iterations': 1341, 'l2_leaf_reg': 0.10060564816925271, 'border_count': 113, 'bagging_temperature': 0.6546110158774598, 'random_strength': 6.277320719268103, 'grow_policy': 'Lossguide', 'min_data_in_leaf': 448, 'max_leaves': 167}. Best is trial 14 with value: 1609.1448261457704.[0m
[32m[I 2024-10-13 06:56:27,508][0m Trial 443 finished with value: 1672.8963918568652 and parameters: {'depth': 3, 'learning_rate': 0.023490936596398334, 'iterations': 2921, 'l2_leaf_reg': 0.0001560327277702771, 'border_count': 97, 'bagging_temperature': 0.691909103955749, 'random_strength': 6.56423467846788, 'grow_policy': 'Lossguide', 'min_data_in_leaf': 320, 'max_leaves': 159}. Best is trial 14 with value: 1609.1448261457704.[0m
[32m[I 2024-10-13 06:56:30,262][0m Trial 444 finished with value: 1692.6449307982818 and parameters: {'depth': 4, 'learning_rate': 0.12429635964924228, 'iterations': 2998, 'l2_leaf_reg': 0.07319358969727816, 'border_count': 148, 'bagging_temperature': 0.4110200302109464, 'random_strength': 5.780821219961464, 'grow_policy': 'Lossguide', 'min_data_in_leaf': 386, 'max_leaves': 68}. Best is trial 14 with value: 1609.1448261457704.[0m
[32m[I 2024-10-13 06:56:32,890][0m Trial 445 finished with value: 1686.3931567222041 and parameters: {'depth': 3, 'learning_rate': 0.05442195288871522, 'iterations': 2847, 'l2_leaf_reg': 3.767609063321097e-06, 'border_count': 82, 'bagging_temperature': 0.6411595394669624, 'random_strength': 4.964065136377572, 'grow_policy': 'Lossguide', 'min_data_in_leaf': 480, 'max_leaves': 144}. Best is trial 14 with value: 1609.1448261457704.[0m
[32m[I 2024-10-13 06:56:35,538][0m Trial 446 finished with value: 1688.791129639628 and parameters: {'depth': 9, 'learning_rate': 0.040122658339902056, 'iterations': 2774, 'l2_leaf_reg': 0.0015225856093513575, 'border_count': 89, 'bagging_temperature': 0.6690227277503126, 'random_strength': 7.077921773861539, 'grow_policy': 'Lossguide', 'min_data_in_leaf': 407, 'max_leaves': 150}. Best is trial 14 with value: 1609.1448261457704.[0m
[32m[I 2024-10-13 06:56:38,210][0m Trial 447 finished with value: 1760.2455900515495 and parameters: {'depth': 4, 'learning_rate': 0.032661576065641004, 'iterations': 2877, 'l2_leaf_reg': 0.00028845440283150963, 'border_count': 67, 'bagging_temperature': 0.7148148424342533, 'random_strength': 4.670531176549419, 'grow_policy': 'Lossguide', 'min_data_in_leaf': 339, 'max_leaves': 210}. Best is trial 14 with value: 1609.1448261457704.[0m
[32m[I 2024-10-13 06:56:40,703][0m Trial 448 finished with value: 2028.9707859434297 and parameters: {'depth': 3, 'learning_rate': 0.00485361376859369, 'iterations': 2711, 'l2_leaf_reg': 0.0007123527292272165, 'border_count': 59, 'bagging_temperature': 0.6949963599142123, 'random_strength': 7.289250247450527, 'grow_policy': 'Lossguide', 'min_data_in_leaf': 361, 'max_leaves': 167}. Best is trial 14 with value: 1609.1448261457704.[0m
[32m[I 2024-10-13 06:56:43,456][0m Trial 449 finished with value: 1684.4450307421353 and parameters: {'depth': 3, 'learning_rate': 0.016754597324140676, 'iterations': 2950, 'l2_leaf_reg': 0.17238212551778104, 'border_count': 79, 'bagging_temperature': 0.6562345479448026, 'random_strength': 6.7312899680526055, 'grow_policy': 'Lossguide', 'min_data_in_leaf': 441, 'max_leaves': 161}. Best is trial 14 with value: 1609.1448261457704.[0m
[32m[I 2024-10-13 06:56:53,556][0m Trial 450 finished with value: 1702.9895845470273 and parameters: {'depth': 4, 'learning_rate': 0.025490087850780954, 'iterations': 2787, 'l2_leaf_reg': 0.0004117844467365144, 'border_count': 93, 'bagging_temperature': 0.6298858168400218, 'random_strength': 7.037508826126265, 'grow_policy': 'SymmetricTree', 'min_data_in_leaf': 394}. Best is trial 14 with value: 1609.1448261457704.[0m
