[32m[I 2024-10-13 06:49:19,860][0m Trial 301 finished with value: 4411.203691417851 and parameters: {'depth': 9, 'learning_rate': 0.00041147476309482333, 'iterations': 2957, 'l2_leaf_reg': 0.3641061893910451, 'border_count': 77, 'bagging_temperature': 0.6761408416610292, 'random_strength': 6.988861081477728, 'grow_policy': 'Lossguide', 'min_data_in_leaf': 434, 'max_leaves': 160}. Best is trial 14 with value: 1609.1448261457704.[0m
[32m[I 2024-10-13 06:49:22,149][0m Trial 302 finished with value: 1756.2753920009338 and parameters: {'depth': 9, 'learning_rate': 0.03742376903219152, 'iterations': 2412, 'l2_leaf_reg': 0.00272325342875462, 'border_count': 71, 'bagging_temperature': 0.696797984611388, 'random_strength': 7.590991571893346, 'grow_policy': 'Lossguide', 'min_data_in_leaf': 414, 'max_leaves': 178}. Best is trial 14 with value: 1609.1448261457704.[0m
[32m[I 2024-10-13 06:49:24,627][0m Trial 303 finished with value: 1642.2419451555236 and parameters: {'depth': 9, 'learning_rate': 0.03603199844546083, 'iterations': 2661, 'l2_leaf_reg': 0.004254968976053653, 'border_count': 80, 'bagging_temperature': 0.6707135673325435, 'random_strength': 6.843310535841763, 'grow_policy': 'Lossguide', 'min_data_in_leaf': 401, 'max_leaves': 152}. Best is trial 14 with value: 1609.1448261457704.[0m
[32m[I 2024-10-13 06:49:27,270][0m Trial 304 finished with value: 1686.798711996776 and parameters: {'depth': 9, 'learning_rate': 0.04415595941859252, 'iterations': 2886, 'l2_leaf_reg': 0.011871583129123786, 'border_count': 79, 'bagging_temperature': 0.6776044562883323, 'random_strength': 6.925030374792359, 'grow_policy': 'Lossguide', 'min_data_in_leaf': 390, 'max_leaves': 152}. Best is trial 14 with value: 1609.1448261457704.[0m
[32m[I 2024-10-13 06:49:29,902][0m Trial 305 finished with value: 1756.5657531375318 and parameters: {'depth': 10, 'learning_rate': 0.035650134393968656, 'iterations': 2786, 'l2_leaf_reg': 0.31822856690839263, 'border_count': 66, 'bagging_temperature': 0.7168340048472934, 'random_strength': 6.423879928021636, 'grow_policy': 'Lossguide', 'min_data_in_leaf': 440, 'max_leaves': 160}. Best is trial 14 with value: 1609.1448261457704.[0m
[32m[I 2024-10-13 06:49:32,475][0m Trial 306 finished with value: 1676.929661635891 and parameters: {'depth': 9, 'learning_rate': 0.04027215862519285, 'iterations': 2677, 'l2_leaf_reg': 0.004263367251512105, 'border_count': 82, 'bagging_temperature': 0.6941756614463134, 'random_strength': 6.8797238930618985, 'grow_policy': 'Lossguide', 'min_data_in_leaf': 402, 'max_leaves': 169}. Best is trial 14 with value: 1609.1448261457704.[0m
[32m[I 2024-10-13 06:49:35,264][0m Trial 307 finished with value: 1738.8240034716202 and parameters: {'depth': 9, 'learning_rate': 0.032778903204608134, 'iterations': 2993, 'l2_leaf_reg': 0.00877747743564724, 'border_count': 74, 'bagging_temperature': 0.6293340957648108, 'random_strength': 6.793707201767631, 'grow_policy': 'Lossguide', 'min_data_in_leaf': 399, 'max_leaves': 147}. Best is trial 14 with value: 1609.1448261457704.[0m
[32m[I 2024-10-13 06:49:37,940][0m Trial 308 finished with value: 1677.9769631952151 and parameters: {'depth': 10, 'learning_rate': 0.04837029131506175, 'iterations': 2853, 'l2_leaf_reg': 0.013313035981769927, 'border_count': 215, 'bagging_temperature': 0.6655932273660132, 'random_strength': 6.53937972911037, 'grow_policy': 'Lossguide', 'min_data_in_leaf': 488, 'max_leaves': 167}. Best is trial 14 with value: 1609.1448261457704.[0m
[32m[I 2024-10-13 06:49:40,507][0m Trial 309 finished with value: 1665.3191752386156 and parameters: {'depth': 8, 'learning_rate': 0.03764346968301168, 'iterations': 2733, 'l2_leaf_reg': 0.017058169384920552, 'border_count': 78, 'bagging_temperature': 0.6083364598748584, 'random_strength': 3.5630681539766753, 'grow_policy': 'Lossguide', 'min_data_in_leaf': 420, 'max_leaves': 141}. Best is trial 14 with value: 1609.1448261457704.[0m
[32m[I 2024-10-13 06:49:42,956][0m Trial 310 finished with value: 1670.0061497081874 and parameters: {'depth': 9, 'learning_rate': 0.02751404437830668, 'iterations': 2526, 'l2_leaf_reg': 0.006251470799424885, 'border_count': 81, 'bagging_temperature': 0.7264222952836549, 'random_strength': 7.263270126948694, 'grow_policy': 'Lossguide', 'min_data_in_leaf': 332, 'max_leaves': 157}. Best is trial 14 with value: 1609.1448261457704.[0m
[32m[I 2024-10-13 06:49:45,465][0m Trial 311 finished with value: 2015.3823897665 and parameters: {'depth': 10, 'learning_rate': 0.031728153597524, 'iterations': 2596, 'l2_leaf_reg': 0.002071292350592129, 'border_count': 59, 'bagging_temperature': 0.6802781523286302, 'random_strength': 3.8675790664891974, 'grow_policy': 'Lossguide', 'min_data_in_leaf': 450, 'max_leaves': 172}. Best is trial 14 with value: 1609.1448261457704.[0m
[32m[I 2024-10-13 06:49:48,243][0m Trial 312 finished with value: 1671.6262508552284 and parameters: {'depth': 3, 'learning_rate': 0.042244130258232135, 'iterations': 2988, 'l2_leaf_reg': 0.058804918579139914, 'border_count': 83, 'bagging_temperature': 0.6543452141748342, 'random_strength': 6.983015209515811, 'grow_policy': 'Lossguide', 'min_data_in_leaf': 379, 'max_leaves': 178}. Best is trial 14 with value: 1609.1448261457704.[0m
[32m[I 2024-10-13 06:49:50,818][0m Trial 313 finished with value: 1645.6249335893638 and parameters: {'depth': 9, 'learning_rate': 0.28891667448261704, 'iterations': 2804, 'l2_leaf_reg': 0.0038689911895354373, 'border_count': 177, 'bagging_temperature': 0.6319417190746355, 'random_strength': 7.117975778002917, 'grow_policy': 'Lossguide', 'min_data_in_leaf': 418, 'max_leaves': 172}. Best is trial 14 with value: 1609.1448261457704.[0m
[32m[I 2024-10-13 06:49:53,434][0m Trial 314 finished with value: 1756.6562250758564 and parameters: {'depth': 9, 'learning_rate': 0.049697028491717844, 'iterations': 2813, 'l2_leaf_reg': 0.003020965123898996, 'border_count': 71, 'bagging_temperature': 0.575589402170277, 'random_strength': 7.059835275222091, 'grow_policy': 'Lossguide', 'min_data_in_leaf': 424, 'max_leaves': 163}. Best is trial 14 with value: 1609.1448261457704.[0m
[32m[I 2024-10-13 06:49:56,119][0m Trial 315 finished with value: 1655.9660324751337 and parameters: {'depth': 9, 'learning_rate': 0.27285679888286174, 'iterations': 2873, 'l2_leaf_reg': 0.004511487625819464, 'border_count': 84, 'bagging_temperature': 0.6247695307299593, 'random_strength': 6.740331025392452, 'grow_policy': 'Lossguide', 'min_data_in_leaf': 401, 'max_leaves': 170}. Best is trial 14 with value: 1609.1448261457704.[0m
[32m[I 2024-10-13 06:49:58,627][0m Trial 316 finished with value: 1651.2249833007359 and parameters: {'depth': 8, 'learning_rate': 0.033935086852955806, 'iterations': 2673, 'l2_leaf_reg': 0.0032305168353223648, 'border_count': 76, 'bagging_temperature': 0.6318333884213019, 'random_strength': 7.4599536142609, 'grow_policy': 'Lossguide', 'min_data_in_leaf': 439, 'max_leaves': 184}. Best is trial 14 with value: 1609.1448261457704.[0m
[32m[I 2024-10-13 06:50:01,111][0m Trial 317 finished with value: 1734.7264105945549 and parameters: {'depth': 8, 'learning_rate': 0.28417917146121857, 'iterations': 2657, 'l2_leaf_reg': 0.0020418000655114017, 'border_count': 141, 'bagging_temperature': 0.599550688022735, 'random_strength': 7.480067755386855, 'grow_policy': 'Lossguide', 'min_data_in_leaf': 458, 'max_leaves': 187}. Best is trial 14 with value: 1609.1448261457704.[0m
[32m[I 2024-10-13 06:50:03,696][0m Trial 318 finished with value: 1796.7599700716205 and parameters: {'depth': 9, 'learning_rate': 0.16653110343720237, 'iterations': 2728, 'l2_leaf_reg': 0.0013169847128383094, 'border_count': 156, 'bagging_temperature': 0.6166061739022328, 'random_strength': 7.178387375336074, 'grow_policy': 'Lossguide', 'min_data_in_leaf': 430, 'max_leaves': 177}. Best is trial 14 with value: 1609.1448261457704.[0m
[32m[I 2024-10-13 06:50:06,280][0m Trial 319 finished with value: 1680.1787563184598 and parameters: {'depth': 8, 'learning_rate': 0.21834008108136616, 'iterations': 2810, 'l2_leaf_reg': 0.0026621839217145916, 'border_count': 198, 'bagging_temperature': 0.6580024644883927, 'random_strength': 7.434470860285713, 'grow_policy': 'Lossguide', 'min_data_in_leaf': 357, 'max_leaves': 183}. Best is trial 14 with value: 1609.1448261457704.[0m
[32m[I 2024-10-13 06:50:08,972][0m Trial 320 finished with value: 1739.4304205337344 and parameters: {'depth': 9, 'learning_rate': 0.05724021236589879, 'iterations': 2846, 'l2_leaf_reg': 0.004761657415055646, 'border_count': 71, 'bagging_temperature': 0.6397701469813102, 'random_strength': 7.639620339639179, 'grow_policy': 'Lossguide', 'min_data_in_leaf': 432, 'max_leaves': 194}. Best is trial 14 with value: 1609.1448261457704.[0m
[32m[I 2024-10-13 06:50:11,733][0m Trial 321 finished with value: 1793.6602012979354 and parameters: {'depth': 9, 'learning_rate': 0.2324125570080519, 'iterations': 2911, 'l2_leaf_reg': 0.0035482169844746705, 'border_count': 164, 'bagging_temperature': 0.6683717093433891, 'random_strength': 7.747147684743943, 'grow_policy': 'Depthwise', 'min_data_in_leaf': 479}. Best is trial 14 with value: 1609.1448261457704.[0m
[32m[I 2024-10-13 06:50:14,308][0m Trial 322 finished with value: 1989.577579491904 and parameters: {'depth': 10, 'learning_rate': 0.2475162747201736, 'iterations': 2753, 'l2_leaf_reg': 0.0006785469957610249, 'border_count': 75, 'bagging_temperature': 0.5690428522914, 'random_strength': 7.311465504170237, 'grow_policy': 'Lossguide', 'min_data_in_leaf': 441, 'max_leaves': 182}. Best is trial 14 with value: 1609.1448261457704.[0m
[32m[I 2024-10-13 06:50:16,825][0m Trial 323 finished with value: 1667.9185375022807 and parameters: {'depth': 10, 'learning_rate': 0.02860951991697557, 'iterations': 2699, 'l2_leaf_reg': 0.00707471372469725, 'border_count': 85, 'bagging_temperature': 0.5919048238658706, 'random_strength': 7.080672660402111, 'grow_policy': 'Lossguide', 'min_data_in_leaf': 393, 'max_leaves': 171}. Best is trial 14 with value: 1609.1448261457704.[0m
[32m[I 2024-10-13 06:50:17,602][0m Trial 324 finished with value: 1763.8744180273093 and parameters: {'depth': 9, 'learning_rate': 0.29304164217744194, 'iterations': 287, 'l2_leaf_reg': 0.00550238620601397, 'border_count': 175, 'bagging_temperature': 0.6300749151360764, 'random_strength': 6.686239518264699, 'grow_policy': 'Lossguide', 'min_data_in_leaf': 469, 'max_leaves': 163}. Best is trial 14 with value: 1609.1448261457704.[0m
[32m[I 2024-10-13 06:50:20,119][0m Trial 325 finished with value: 1663.3644788338634 and parameters: {'depth': 10, 'learning_rate': 0.03756015532175616, 'iterations': 2763, 'l2_leaf_reg': 0.0032679974615235736, 'border_count': 77, 'bagging_temperature': 0.6888953072014226, 'random_strength': 7.321810058670671, 'grow_policy': 'Lossguide', 'min_data_in_leaf': 414, 'max_leaves': 174}. Best is trial 14 with value: 1609.1448261457704.[0m
[32m[I 2024-10-13 06:50:22,593][0m Trial 326 finished with value: 1638.9893222512687 and parameters: {'depth': 3, 'learning_rate': 0.1996868163015869, 'iterations': 2617, 'l2_leaf_reg': 0.0019617477763367946, 'border_count': 86, 'bagging_temperature': 0.6468724910083423, 'random_strength': 7.0513696191078825, 'grow_policy': 'Lossguide', 'min_data_in_leaf': 373, 'max_leaves': 180}. Best is trial 14 with value: 1609.1448261457704.[0m
[32m[I 2024-10-13 06:50:25,135][0m Trial 327 finished with value: 1927.9154558625992 and parameters: {'depth': 3, 'learning_rate': 0.2997079945140384, 'iterations': 2710, 'l2_leaf_reg': 0.008366681351182606, 'border_count': 67, 'bagging_temperature': 0.6597851550569727, 'random_strength': 0.1510229797685394, 'grow_policy': 'Lossguide', 'min_data_in_leaf': 367, 'max_leaves': 180}. Best is trial 14 with value: 1609.1448261457704.[0m
[32m[I 2024-10-13 06:50:27,605][0m Trial 328 finished with value: 1727.4352029859745 and parameters: {'depth': 3, 'learning_rate': 0.1496917026884538, 'iterations': 2609, 'l2_leaf_reg': 0.006333241586281568, 'border_count': 80, 'bagging_temperature': 0.6752362195403095, 'random_strength': 7.2185747348164515, 'grow_policy': 'Lossguide', 'min_data_in_leaf': 406, 'max_leaves': 152}. Best is trial 14 with value: 1609.1448261457704.[0m
[32m[I 2024-10-13 06:50:30,121][0m Trial 329 finished with value: 1787.6545620462998 and parameters: {'depth': 3, 'learning_rate': 0.17389169093985266, 'iterations': 2631, 'l2_leaf_reg': 0.001536863937880056, 'border_count': 181, 'bagging_temperature': 0.7026850233782541, 'random_strength': 6.811853249906841, 'grow_policy': 'Lossguide', 'min_data_in_leaf': 383, 'max_leaves': 187}. Best is trial 14 with value: 1609.1448261457704.[0m
[32m[I 2024-10-13 06:50:32,486][0m Trial 330 finished with value: 1649.8820533920884 and parameters: {'depth': 8, 'learning_rate': 0.033304201522060754, 'iterations': 2503, 'l2_leaf_reg': 0.003803941088655647, 'border_count': 188, 'bagging_temperature': 0.6172771904579666, 'random_strength': 6.959080276845811, 'grow_policy': 'Lossguide', 'min_data_in_leaf': 390, 'max_leaves': 174}. Best is trial 14 with value: 1609.1448261457704.[0m
[32m[I 2024-10-13 06:50:34,863][0m Trial 331 finished with value: 1727.5672848521917 and parameters: {'depth': 8, 'learning_rate': 0.18023123214908054, 'iterations': 2551, 'l2_leaf_reg': 0.0032581031312968753, 'border_count': 184, 'bagging_temperature': 0.6111629410448364, 'random_strength': 6.368059576000855, 'grow_policy': 'Lossguide', 'min_data_in_leaf': 359, 'max_leaves': 176}. Best is trial 14 with value: 1609.1448261457704.[0m
[32m[I 2024-10-13 06:50:37,354][0m Trial 332 finished with value: 1912.9500358814248 and parameters: {'depth': 3, 'learning_rate': 0.22641169763790342, 'iterations': 2631, 'l2_leaf_reg': 0.0044093257501608765, 'border_count': 74, 'bagging_temperature': 0.5831795118462225, 'random_strength': 7.482322604761219, 'grow_policy': 'Lossguide', 'min_data_in_leaf': 384, 'max_leaves': 171}. Best is trial 14 with value: 1609.1448261457704.[0m
[32m[I 2024-10-13 06:50:39,896][0m Trial 333 finished with value: 1775.3530250488736 and parameters: {'depth': 9, 'learning_rate': 0.10243466774685189, 'iterations': 2579, 'l2_leaf_reg': 0.001935546896719404, 'border_count': 188, 'bagging_temperature': 0.6169767915962415, 'random_strength': 6.8756865795872315, 'grow_policy': 'Lossguide', 'min_data_in_leaf': 418, 'max_leaves': 182}. Best is trial 14 with value: 1609.1448261457704.[0m
[32m[I 2024-10-13 06:50:42,231][0m Trial 334 finished with value: 1691.7019476361966 and parameters: {'depth': 7, 'learning_rate': 0.25291011892475984, 'iterations': 2496, 'l2_leaf_reg': 0.08174346676071352, 'border_count': 86, 'bagging_temperature': 0.6474720104397301, 'random_strength': 7.216884681423892, 'grow_policy': 'Lossguide', 'min_data_in_leaf': 353, 'max_leaves': 190}. Best is trial 14 with value: 1609.1448261457704.[0m
[32m[I 2024-10-13 06:50:44,722][0m Trial 335 finished with value: 1783.5124416730646 and parameters: {'depth': 8, 'learning_rate': 0.22542787565280037, 'iterations': 2493, 'l2_leaf_reg': 0.0011466602957002088, 'border_count': 187, 'bagging_temperature': 0.60054098751961, 'random_strength': 6.159578376286767, 'grow_policy': 'Lossguide', 'min_data_in_leaf': 456, 'max_leaves': 166}. Best is trial 14 with value: 1609.1448261457704.[0m
[32m[I 2024-10-13 06:50:47,277][0m Trial 336 finished with value: 1674.7026796074526 and parameters: {'depth': 3, 'learning_rate': 0.18618069366887538, 'iterations': 2686, 'l2_leaf_reg': 2.930635042805437e-06, 'border_count': 77, 'bagging_temperature': 0.6292062985938369, 'random_strength': 8.102801705585062, 'grow_policy': 'Lossguide', 'min_data_in_leaf': 397, 'max_leaves': 177}. Best is trial 14 with value: 1609.1448261457704.[0m
[32m[I 2024-10-13 06:50:49,718][0m Trial 337 finished with value: 1661.8954457652446 and parameters: {'depth': 9, 'learning_rate': 0.18929958478200123, 'iterations': 2553, 'l2_leaf_reg': 0.00022911024515049464, 'border_count': 84, 'bagging_temperature': 0.33994226128982924, 'random_strength': 6.591679348827262, 'grow_policy': 'Lossguide', 'min_data_in_leaf': 436, 'max_leaves': 173}. Best is trial 14 with value: 1609.1448261457704.[0m
[32m[I 2024-10-13 06:50:52,286][0m Trial 338 finished with value: 1725.8768975605497 and parameters: {'depth': 8, 'learning_rate': 0.012224235271235694, 'iterations': 2647, 'l2_leaf_reg': 0.0009397353645205262, 'border_count': 191, 'bagging_temperature': 0.6485700275223022, 'random_strength': 6.97127642669459, 'grow_policy': 'Lossguide', 'min_data_in_leaf': 420, 'max_leaves': 151}. Best is trial 14 with value: 1609.1448261457704.[0m
[32m[I 2024-10-13 06:50:54,870][0m Trial 339 finished with value: 1709.2901313267455 and parameters: {'depth': 3, 'learning_rate': 0.04352388179639984, 'iterations': 2804, 'l2_leaf_reg': 0.002061559207906229, 'border_count': 254, 'bagging_temperature': 0.6250363451333312, 'random_strength': 7.095320168955283, 'grow_policy': 'Lossguide', 'min_data_in_leaf': 373, 'max_leaves': 185}. Best is trial 14 with value: 1609.1448261457704.[0m
[32m[I 2024-10-13 06:50:57,219][0m Trial 340 finished with value: 1670.4242908439717 and parameters: {'depth': 7, 'learning_rate': 0.0342918215097777, 'iterations': 2459, 'l2_leaf_reg': 0.12035077455600081, 'border_count': 192, 'bagging_temperature': 0.6608022664626128, 'random_strength': 7.832810410137499, 'grow_policy': 'Lossguide', 'min_data_in_leaf': 451, 'max_leaves': 179}. Best is trial 14 with value: 1609.1448261457704.[0m
[32m[I 2024-10-13 06:50:59,865][0m Trial 341 finished with value: 1772.8801076107977 and parameters: {'depth': 9, 'learning_rate': 0.29745887406986055, 'iterations': 2880, 'l2_leaf_reg': 0.004620236004650374, 'border_count': 176, 'bagging_temperature': 0.691739820286281, 'random_strength': 7.654292498705848, 'grow_policy': 'Lossguide', 'min_data_in_leaf': 398, 'max_leaves': 126}. Best is trial 14 with value: 1609.1448261457704.[0m
[32m[I 2024-10-13 06:51:01,272][0m Trial 342 finished with value: 1716.4741534101665 and parameters: {'depth': 3, 'learning_rate': 0.04099185458429522, 'iterations': 1121, 'l2_leaf_reg': 0.0463012399032301, 'border_count': 198, 'bagging_temperature': 0.571722778719495, 'random_strength': 7.4105851257496616, 'grow_policy': 'Depthwise', 'min_data_in_leaf': 381}. Best is trial 14 with value: 1609.1448261457704.[0m
[32m[I 2024-10-13 06:51:03,705][0m Trial 343 finished with value: 1906.1323632529823 and parameters: {'depth': 9, 'learning_rate': 0.20286299743464872, 'iterations': 2563, 'l2_leaf_reg': 0.016396190540894966, 'border_count': 69, 'bagging_temperature': 0.638851616726976, 'random_strength': 7.070026733968259, 'grow_policy': 'Lossguide', 'min_data_in_leaf': 493, 'max_leaves': 143}. Best is trial 14 with value: 1609.1448261457704.[0m
[32m[I 2024-10-13 06:51:06,039][0m Trial 344 finished with value: 1691.6830183646987 and parameters: {'depth': 10, 'learning_rate': 0.03053448730705035, 'iterations': 2462, 'l2_leaf_reg': 0.009621285557647295, 'border_count': 206, 'bagging_temperature': 0.6032183439826647, 'random_strength': 3.7199798800403565, 'grow_policy': 'Lossguide', 'min_data_in_leaf': 423, 'max_leaves': 162}. Best is trial 14 with value: 1609.1448261457704.[0m
[32m[I 2024-10-13 06:51:07,516][0m Trial 345 finished with value: 1682.929545457833 and parameters: {'depth': 9, 'learning_rate': 0.03686158699948157, 'iterations': 1197, 'l2_leaf_reg': 1.8967755123397607e-06, 'border_count': 80, 'bagging_temperature': 0.6801865759480592, 'random_strength': 6.640405182709224, 'grow_policy': 'Lossguide', 'min_data_in_leaf': 401, 'max_leaves': 197}. Best is trial 14 with value: 1609.1448261457704.[0m
[32m[I 2024-10-13 06:51:10,119][0m Trial 346 finished with value: 1916.6472237919402 and parameters: {'depth': 10, 'learning_rate': 0.0042406732477442205, 'iterations': 2741, 'l2_leaf_reg': 0.0032547195023075602, 'border_count': 86, 'bagging_temperature': 0.2561372826734988, 'random_strength': 6.818635597294279, 'grow_policy': 'Lossguide', 'min_data_in_leaf': 351, 'max_leaves': 216}. Best is trial 14 with value: 1609.1448261457704.[0m
[32m[I 2024-10-13 06:51:18,627][0m Trial 347 finished with value: 1809.7952767831218 and parameters: {'depth': 3, 'learning_rate': 0.050530454888671084, 'iterations': 2647, 'l2_leaf_reg': 0.005299154879968489, 'border_count': 76, 'bagging_temperature': 0.6540526843811885, 'random_strength': 3.3147993265246103, 'grow_policy': 'SymmetricTree', 'min_data_in_leaf': 471}. Best is trial 14 with value: 1609.1448261457704.[0m
[32m[I 2024-10-13 06:51:20,917][0m Trial 348 finished with value: 1796.4884561431818 and parameters: {'depth': 8, 'learning_rate': 0.027982162667070324, 'iterations': 2416, 'l2_leaf_reg': 0.010458707929223716, 'border_count': 65, 'bagging_temperature': 0.5920540529740118, 'random_strength': 7.37262252877019, 'grow_policy': 'Lossguide', 'min_data_in_leaf': 446, 'max_leaves': 168}. Best is trial 14 with value: 1609.1448261457704.[0m
[32m[I 2024-10-13 06:51:22,335][0m Trial 349 finished with value: 1691.8315030019153 and parameters: {'depth': 10, 'learning_rate': 0.03377489213597278, 'iterations': 1044, 'l2_leaf_reg': 1.017905753871577e-06, 'border_count': 230, 'bagging_temperature': 0.5576940154527673, 'random_strength': 7.137069382177759, 'grow_policy': 'Lossguide', 'min_data_in_leaf': 330, 'max_leaves': 175}. Best is trial 14 with value: 1609.1448261457704.[0m
[32m[I 2024-10-13 06:51:24,669][0m Trial 350 finished with value: 1689.0009883997031 and parameters: {'depth': 10, 'learning_rate': 0.07112940242697388, 'iterations': 2508, 'l2_leaf_reg': 0.002236609936630489, 'border_count': 83, 'bagging_temperature': 0.7030072627230721, 'random_strength': 3.9658360168450013, 'grow_policy': 'Lossguide', 'min_data_in_leaf': 369, 'max_leaves': 133}. Best is trial 14 with value: 1609.1448261457704.[0m
