[32m[I 2024-10-13 06:44:52,225][0m Trial 251 finished with value: 6330.766130480452 and parameters: {'depth': 11, 'learning_rate': 0.00015229184350678906, 'iterations': 2001, 'l2_leaf_reg': 0.004427353134465738, 'border_count': 237, 'bagging_temperature': 0.6981392419518851, 'random_strength': 7.0364065786148124, 'grow_policy': 'Lossguide', 'min_data_in_leaf': 531, 'max_leaves': 77}. Best is trial 14 with value: 1609.1448261457704.[0m
[32m[I 2024-10-13 06:45:25,252][0m Trial 252 finished with value: 2070.0966374523277 and parameters: {'depth': 10, 'learning_rate': 0.039363327046355846, 'iterations': 2276, 'l2_leaf_reg': 0.01804668159906654, 'border_count': 97, 'bagging_temperature': 0.6733615173077282, 'random_strength': 6.697532313477132, 'grow_policy': 'SymmetricTree', 'min_data_in_leaf': 780}. Best is trial 14 with value: 1609.1448261457704.[0m
[32m[I 2024-10-13 06:45:27,145][0m Trial 253 finished with value: 1684.3929153398565 and parameters: {'depth': 12, 'learning_rate': 0.022648810951474446, 'iterations': 1917, 'l2_leaf_reg': 0.035602902047585684, 'border_count': 88, 'bagging_temperature': 0.7250428802414228, 'random_strength': 7.593924389441593, 'grow_policy': 'Lossguide', 'min_data_in_leaf': 368, 'max_leaves': 60}. Best is trial 14 with value: 1609.1448261457704.[0m
[32m[I 2024-10-13 06:45:29,402][0m Trial 254 finished with value: 1734.4395908837416 and parameters: {'depth': 11, 'learning_rate': 0.032923276887730335, 'iterations': 2363, 'l2_leaf_reg': 0.0024740190193432753, 'border_count': 75, 'bagging_temperature': 0.608456252117972, 'random_strength': 7.63274998644455, 'grow_policy': 'Lossguide', 'min_data_in_leaf': 594, 'max_leaves': 100}. Best is trial 14 with value: 1609.1448261457704.[0m
[32m[I 2024-10-13 06:45:30,279][0m Trial 255 finished with value: 1851.399577911196 and parameters: {'depth': 12, 'learning_rate': 0.026895058694161443, 'iterations': 440, 'l2_leaf_reg': 0.012204209036230694, 'border_count': 83, 'bagging_temperature': 0.6334678631446612, 'random_strength': 4.835099550639989, 'grow_policy': 'Lossguide', 'min_data_in_leaf': 713, 'max_leaves': 94}. Best is trial 14 with value: 1609.1448261457704.[0m
[32m[I 2024-10-13 06:45:31,684][0m Trial 256 finished with value: 1717.3105033723457 and parameters: {'depth': 11, 'learning_rate': 0.14511670495642043, 'iterations': 1161, 'l2_leaf_reg': 0.02272898645112067, 'border_count': 106, 'bagging_temperature': 0.6552579555800779, 'random_strength': 7.436205439983769, 'grow_policy': 'Lossguide', 'min_data_in_leaf': 564, 'max_leaves': 68}. Best is trial 14 with value: 1609.1448261457704.[0m
[32m[I 2024-10-13 06:45:33,832][0m Trial 257 finished with value: 1735.7535042730713 and parameters: {'depth': 12, 'learning_rate': 0.01939859635539138, 'iterations': 2187, 'l2_leaf_reg': 0.0014462305719768363, 'border_count': 92, 'bagging_temperature': 0.020494512998518732, 'random_strength': 7.8558768764926805, 'grow_policy': 'Lossguide', 'min_data_in_leaf': 406, 'max_leaves': 87}. Best is trial 14 with value: 1609.1448261457704.[0m
[32m[I 2024-10-13 06:45:36,017][0m Trial 258 finished with value: 1651.2336319149092 and parameters: {'depth': 10, 'learning_rate': 0.032015080408899686, 'iterations': 2270, 'l2_leaf_reg': 0.007448837180080684, 'border_count': 88, 'bagging_temperature': 0.687394064015169, 'random_strength': 4.460183144456402, 'grow_policy': 'Lossguide', 'min_data_in_leaf': 757, 'max_leaves': 185}. Best is trial 14 with value: 1609.1448261457704.[0m
[32m[I 2024-10-13 06:45:38,311][0m Trial 259 finished with value: 1680.604995998807 and parameters: {'depth': 10, 'learning_rate': 0.03142649286750649, 'iterations': 2266, 'l2_leaf_reg': 0.0055329904145679605, 'border_count': 101, 'bagging_temperature': 0.6877636106807964, 'random_strength': 4.441722404145726, 'grow_policy': 'Lossguide', 'min_data_in_leaf': 755, 'max_leaves': 82}. Best is trial 14 with value: 1609.1448261457704.[0m
[32m[I 2024-10-13 06:45:39,275][0m Trial 260 finished with value: 1687.3927576589037 and parameters: {'depth': 11, 'learning_rate': 0.039027408184201064, 'iterations': 583, 'l2_leaf_reg': 0.008463179106214285, 'border_count': 87, 'bagging_temperature': 0.7132376212428996, 'random_strength': 4.772011459737969, 'grow_policy': 'Lossguide', 'min_data_in_leaf': 789, 'max_leaves': 178}. Best is trial 14 with value: 1609.1448261457704.[0m
[32m[I 2024-10-13 06:45:40,540][0m Trial 261 finished with value: 1715.6976871869374 and parameters: {'depth': 11, 'learning_rate': 0.026112001472193443, 'iterations': 1043, 'l2_leaf_reg': 0.0032811891373038513, 'border_count': 82, 'bagging_temperature': 0.622516768242283, 'random_strength': 4.557424339824725, 'grow_policy': 'Lossguide', 'min_data_in_leaf': 750, 'max_leaves': 153}. Best is trial 14 with value: 1609.1448261457704.[0m
[32m[I 2024-10-13 06:46:14,007][0m Trial 262 finished with value: 2093.555392522611 and parameters: {'depth': 10, 'learning_rate': 0.04560828113005495, 'iterations': 2100, 'l2_leaf_reg': 0.05214588085600005, 'border_count': 95, 'bagging_temperature': 0.7427862308476657, 'random_strength': 4.362276738457099, 'grow_policy': 'SymmetricTree', 'min_data_in_leaf': 769}. Best is trial 14 with value: 1609.1448261457704.[0m
[32m[I 2024-10-13 06:46:16,265][0m Trial 263 finished with value: 1785.0942424408786 and parameters: {'depth': 12, 'learning_rate': 0.01658562985240027, 'iterations': 2416, 'l2_leaf_reg': 0.013763633398980114, 'border_count': 75, 'bagging_temperature': 0.6669043515154759, 'random_strength': 3.943976364007434, 'grow_policy': 'Lossguide', 'min_data_in_leaf': 735, 'max_leaves': 201}. Best is trial 14 with value: 1609.1448261457704.[0m
[32m[I 2024-10-13 06:46:18,424][0m Trial 264 finished with value: 1643.086336786899 and parameters: {'depth': 11, 'learning_rate': 0.03361651816981454, 'iterations': 2232, 'l2_leaf_reg': 0.02980798131833337, 'border_count': 90, 'bagging_temperature': 0.5918662087493685, 'random_strength': 3.705416242310239, 'grow_policy': 'Lossguide', 'min_data_in_leaf': 804, 'max_leaves': 168}. Best is trial 14 with value: 1609.1448261457704.[0m
[32m[I 2024-10-13 06:46:20,575][0m Trial 265 finished with value: 1651.6667764160927 and parameters: {'depth': 10, 'learning_rate': 0.036246933964805425, 'iterations': 2233, 'l2_leaf_reg': 0.030909432582607716, 'border_count': 82, 'bagging_temperature': 0.695021142393121, 'random_strength': 3.727008664152127, 'grow_policy': 'Lossguide', 'min_data_in_leaf': 877, 'max_leaves': 184}. Best is trial 14 with value: 1609.1448261457704.[0m
[32m[I 2024-10-13 06:46:22,853][0m Trial 266 finished with value: 1659.6771089160488 and parameters: {'depth': 10, 'learning_rate': 0.04064463503670041, 'iterations': 2354, 'l2_leaf_reg': 0.027669156987602753, 'border_count': 79, 'bagging_temperature': 0.6976732156884831, 'random_strength': 3.11482243651949, 'grow_policy': 'Lossguide', 'min_data_in_leaf': 882, 'max_leaves': 191}. Best is trial 14 with value: 1609.1448261457704.[0m
[32m[I 2024-10-13 06:46:25,016][0m Trial 267 finished with value: 1754.7074864836623 and parameters: {'depth': 10, 'learning_rate': 0.035320390991095386, 'iterations': 2205, 'l2_leaf_reg': 0.019232431276704057, 'border_count': 70, 'bagging_temperature': 0.5914350303907224, 'random_strength': 3.462807779697867, 'grow_policy': 'Lossguide', 'min_data_in_leaf': 849, 'max_leaves': 189}. Best is trial 14 with value: 1609.1448261457704.[0m
[32m[I 2024-10-13 06:46:27,419][0m Trial 268 finished with value: 1682.0430043994606 and parameters: {'depth': 10, 'learning_rate': 0.04929448112896721, 'iterations': 2492, 'l2_leaf_reg': 0.00958344101219777, 'border_count': 83, 'bagging_temperature': 0.7131220604067414, 'random_strength': 3.676020703084207, 'grow_policy': 'Lossguide', 'min_data_in_leaf': 865, 'max_leaves': 165}. Best is trial 14 with value: 1609.1448261457704.[0m
[32m[I 2024-10-13 06:47:18,194][0m Trial 269 finished with value: 1874.8144436873622 and parameters: {'depth': 11, 'learning_rate': 0.0322394649180071, 'iterations': 2268, 'l2_leaf_reg': 0.032750603250871764, 'border_count': 77, 'bagging_temperature': 0.6823731344550917, 'random_strength': 3.666437573971936, 'grow_policy': 'SymmetricTree', 'min_data_in_leaf': 607}. Best is trial 14 with value: 1609.1448261457704.[0m
[32m[I 2024-10-13 06:47:20,371][0m Trial 270 finished with value: 1996.7846598160145 and parameters: {'depth': 9, 'learning_rate': 0.0037309816640179907, 'iterations': 2314, 'l2_leaf_reg': 0.014407945157434902, 'border_count': 85, 'bagging_temperature': 0.7398426644210766, 'random_strength': 3.804109893141014, 'grow_policy': 'Lossguide', 'min_data_in_leaf': 824, 'max_leaves': 189}. Best is trial 14 with value: 1609.1448261457704.[0m
[32m[I 2024-10-13 06:47:22,555][0m Trial 271 finished with value: 1691.0686294625377 and parameters: {'depth': 11, 'learning_rate': 0.03670802712230678, 'iterations': 2164, 'l2_leaf_reg': 0.020914081454873668, 'border_count': 95, 'bagging_temperature': 0.5965273129047364, 'random_strength': 3.375407921499034, 'grow_policy': 'Lossguide', 'min_data_in_leaf': 906, 'max_leaves': 180}. Best is trial 14 with value: 1609.1448261457704.[0m
[32m[I 2024-10-13 06:47:24,856][0m Trial 272 finished with value: 1648.859925776822 and parameters: {'depth': 10, 'learning_rate': 0.030142377823073236, 'iterations': 2412, 'l2_leaf_reg': 0.006675809377125831, 'border_count': 90, 'bagging_temperature': 0.6780150914922508, 'random_strength': 3.9860017266305157, 'grow_policy': 'Lossguide', 'min_data_in_leaf': 718, 'max_leaves': 175}. Best is trial 14 with value: 1609.1448261457704.[0m
[32m[I 2024-10-13 06:47:27,308][0m Trial 273 finished with value: 2781.804976257393 and parameters: {'depth': 10, 'learning_rate': 0.0014949855456484744, 'iterations': 2456, 'l2_leaf_reg': 0.005333735134312185, 'border_count': 103, 'bagging_temperature': 0.7018133111433269, 'random_strength': 4.046517723089605, 'grow_policy': 'Depthwise', 'min_data_in_leaf': 942}. Best is trial 14 with value: 1609.1448261457704.[0m
[32m[I 2024-10-13 06:47:29,608][0m Trial 274 finished with value: 1659.9891614855653 and parameters: {'depth': 10, 'learning_rate': 0.0303708210172174, 'iterations': 2390, 'l2_leaf_reg': 0.05873623158291147, 'border_count': 90, 'bagging_temperature': 0.6809991730215377, 'random_strength': 4.152242998990602, 'grow_policy': 'Lossguide', 'min_data_in_leaf': 719, 'max_leaves': 173}. Best is trial 14 with value: 1609.1448261457704.[0m
[32m[I 2024-10-13 06:47:31,951][0m Trial 275 finished with value: 1693.7002333997561 and parameters: {'depth': 9, 'learning_rate': 0.02950402528896509, 'iterations': 2409, 'l2_leaf_reg': 0.006821966778696836, 'border_count': 98, 'bagging_temperature': 0.7820039698591028, 'random_strength': 2.5035174782204934, 'grow_policy': 'Lossguide', 'min_data_in_leaf': 695, 'max_leaves': 175}. Best is trial 14 with value: 1609.1448261457704.[0m
[32m[I 2024-10-13 06:47:34,193][0m Trial 276 finished with value: 1704.5000889593227 and parameters: {'depth': 10, 'learning_rate': 0.04494977132250644, 'iterations': 2347, 'l2_leaf_reg': 0.02426270169833282, 'border_count': 93, 'bagging_temperature': 0.662263194137773, 'random_strength': 3.024813606241541, 'grow_policy': 'Lossguide', 'min_data_in_leaf': 623, 'max_leaves': 169}. Best is trial 14 with value: 1609.1448261457704.[0m
[32m[I 2024-10-13 06:47:36,553][0m Trial 277 finished with value: 1701.4299890463649 and parameters: {'depth': 10, 'learning_rate': 0.021330069192585434, 'iterations': 2448, 'l2_leaf_reg': 0.014660163241364944, 'border_count': 88, 'bagging_temperature': 0.10610027022396225, 'random_strength': 6.886378293472572, 'grow_policy': 'Lossguide', 'min_data_in_leaf': 923, 'max_leaves': 174}. Best is trial 14 with value: 1609.1448261457704.[0m
[32m[I 2024-10-13 06:47:38,995][0m Trial 278 finished with value: 1676.331908730743 and parameters: {'depth': 10, 'learning_rate': 0.03112492931466804, 'iterations': 2510, 'l2_leaf_reg': 0.04124836602638218, 'border_count': 108, 'bagging_temperature': 0.7306695136218653, 'random_strength': 4.196150739508496, 'grow_policy': 'Lossguide', 'min_data_in_leaf': 596, 'max_leaves': 185}. Best is trial 14 with value: 1609.1448261457704.[0m
[32m[I 2024-10-13 06:48:26,079][0m Trial 279 finished with value: 1938.0167323236449 and parameters: {'depth': 11, 'learning_rate': 0.024244738786976004, 'iterations': 1251, 'l2_leaf_reg': 0.0074544605153466625, 'border_count': 83, 'bagging_temperature': 0.6941278249440944, 'random_strength': 3.935521553179427, 'grow_policy': 'SymmetricTree', 'min_data_in_leaf': 657}. Best is trial 14 with value: 1609.1448261457704.[0m
[32m[I 2024-10-13 06:48:27,267][0m Trial 280 finished with value: 1699.6571647527155 and parameters: {'depth': 11, 'learning_rate': 0.035797717509005164, 'iterations': 949, 'l2_leaf_reg': 0.0025519081330719184, 'border_count': 98, 'bagging_temperature': 0.6553931718625101, 'random_strength': 7.196704265264261, 'grow_policy': 'Lossguide', 'min_data_in_leaf': 576, 'max_leaves': 195}. Best is trial 14 with value: 1609.1448261457704.[0m
[32m[I 2024-10-13 06:48:29,483][0m Trial 281 finished with value: 1672.4425828694007 and parameters: {'depth': 12, 'learning_rate': 0.0288136995096787, 'iterations': 2307, 'l2_leaf_reg': 0.0010116912155738649, 'border_count': 88, 'bagging_temperature': 0.714809877693709, 'random_strength': 3.714246343047917, 'grow_policy': 'Lossguide', 'min_data_in_leaf': 819, 'max_leaves': 133}. Best is trial 14 with value: 1609.1448261457704.[0m
[32m[I 2024-10-13 06:48:31,665][0m Trial 282 finished with value: 1692.6867440542355 and parameters: {'depth': 11, 'learning_rate': 0.04139244189130671, 'iterations': 2213, 'l2_leaf_reg': 0.004541631589915558, 'border_count': 94, 'bagging_temperature': 0.30169234490688784, 'random_strength': 4.998065950411921, 'grow_policy': 'Lossguide', 'min_data_in_leaf': 713, 'max_leaves': 181}. Best is trial 14 with value: 1609.1448261457704.[0m
[32m[I 2024-10-13 06:48:34,160][0m Trial 283 finished with value: 1718.7088728061087 and parameters: {'depth': 12, 'learning_rate': 0.265634910337525, 'iterations': 2578, 'l2_leaf_reg': 0.16712077521004592, 'border_count': 82, 'bagging_temperature': 0.6405868903612887, 'random_strength': 4.682581729238238, 'grow_policy': 'Lossguide', 'min_data_in_leaf': 616, 'max_leaves': 169}. Best is trial 14 with value: 1609.1448261457704.[0m
[32m[I 2024-10-13 06:48:36,502][0m Trial 284 finished with value: 1660.9660974965761 and parameters: {'depth': 11, 'learning_rate': 0.021999938208344776, 'iterations': 2389, 'l2_leaf_reg': 0.010117833454992566, 'border_count': 90, 'bagging_temperature': 0.7580443265724491, 'random_strength': 4.19455323885683, 'grow_policy': 'Lossguide', 'min_data_in_leaf': 684, 'max_leaves': 185}. Best is trial 14 with value: 1609.1448261457704.[0m
[32m[I 2024-10-13 06:48:38,710][0m Trial 285 finished with value: 1754.6749924107717 and parameters: {'depth': 9, 'learning_rate': 0.0505950322681225, 'iterations': 2278, 'l2_leaf_reg': 0.027463950349182562, 'border_count': 75, 'bagging_temperature': 0.6779101394108182, 'random_strength': 4.049604605514817, 'grow_policy': 'Lossguide', 'min_data_in_leaf': 797, 'max_leaves': 183}. Best is trial 14 with value: 1609.1448261457704.[0m
[32m[I 2024-10-13 06:48:40,978][0m Trial 286 finished with value: 1650.6256789770243 and parameters: {'depth': 10, 'learning_rate': 0.03308755068709882, 'iterations': 2354, 'l2_leaf_reg': 0.01819652696727041, 'border_count': 84, 'bagging_temperature': 0.6678528244444109, 'random_strength': 4.341519828988961, 'grow_policy': 'Lossguide', 'min_data_in_leaf': 384, 'max_leaves': 144}. Best is trial 14 with value: 1609.1448261457704.[0m
[32m[I 2024-10-13 06:48:43,295][0m Trial 287 finished with value: 1644.3717466492246 and parameters: {'depth': 10, 'learning_rate': 0.02668297356905546, 'iterations': 2356, 'l2_leaf_reg': 0.06662352071561004, 'border_count': 85, 'bagging_temperature': 0.6738709205607473, 'random_strength': 4.366251177207593, 'grow_policy': 'Lossguide', 'min_data_in_leaf': 431, 'max_leaves': 149}. Best is trial 14 with value: 1609.1448261457704.[0m
[32m[I 2024-10-13 06:48:45,589][0m Trial 288 finished with value: 1676.1319030126392 and parameters: {'depth': 10, 'learning_rate': 0.025513877569630163, 'iterations': 2349, 'l2_leaf_reg': 0.06105625752273246, 'border_count': 148, 'bagging_temperature': 0.6663174120624809, 'random_strength': 4.521844353233559, 'grow_policy': 'Lossguide', 'min_data_in_leaf': 383, 'max_leaves': 148}. Best is trial 14 with value: 1609.1448261457704.[0m
[32m[I 2024-10-13 06:48:47,981][0m Trial 289 finished with value: 1788.8314755943563 and parameters: {'depth': 10, 'learning_rate': 0.019101813652904826, 'iterations': 2529, 'l2_leaf_reg': 0.03647177332207691, 'border_count': 72, 'bagging_temperature': 0.6455361780839785, 'random_strength': 4.294372801421493, 'grow_policy': 'Lossguide', 'min_data_in_leaf': 425, 'max_leaves': 140}. Best is trial 14 with value: 1609.1448261457704.[0m
[32m[I 2024-10-13 06:48:50,717][0m Trial 290 finished with value: 1628.9719839311972 and parameters: {'depth': 10, 'learning_rate': 0.033252715768213016, 'iterations': 2943, 'l2_leaf_reg': 0.09820780805044081, 'border_count': 80, 'bagging_temperature': 0.6726004433334715, 'random_strength': 4.815572197039975, 'grow_policy': 'Lossguide', 'min_data_in_leaf': 399, 'max_leaves': 170}. Best is trial 14 with value: 1609.1448261457704.[0m
[32m[I 2024-10-13 06:48:53,393][0m Trial 291 finished with value: 1764.4368076284543 and parameters: {'depth': 10, 'learning_rate': 0.034426406133788126, 'iterations': 2862, 'l2_leaf_reg': 0.08230438545740079, 'border_count': 66, 'bagging_temperature': 0.6702166351675568, 'random_strength': 4.842558546318955, 'grow_policy': 'Lossguide', 'min_data_in_leaf': 413, 'max_leaves': 159}. Best is trial 14 with value: 1609.1448261457704.[0m
[32m[I 2024-10-13 06:48:56,127][0m Trial 292 finished with value: 1674.1978375120905 and parameters: {'depth': 10, 'learning_rate': 0.027762923024587275, 'iterations': 2942, 'l2_leaf_reg': 0.12244471099586457, 'border_count': 79, 'bagging_temperature': 0.636920426191382, 'random_strength': 4.617564231235399, 'grow_policy': 'Lossguide', 'min_data_in_leaf': 359, 'max_leaves': 144}. Best is trial 14 with value: 1609.1448261457704.[0m
[32m[I 2024-10-13 06:48:58,817][0m Trial 293 finished with value: 2018.9210652549316 and parameters: {'depth': 10, 'learning_rate': 0.03995063711964362, 'iterations': 2934, 'l2_leaf_reg': 0.0897675588404092, 'border_count': 36, 'bagging_temperature': 0.609011035743079, 'random_strength': 5.127220970210182, 'grow_policy': 'Lossguide', 'min_data_in_leaf': 439, 'max_leaves': 147}. Best is trial 14 with value: 1609.1448261457704.[0m
[32m[I 2024-10-13 06:49:01,555][0m Trial 294 finished with value: 1844.0025770636835 and parameters: {'depth': 10, 'learning_rate': 0.006611432816121449, 'iterations': 2913, 'l2_leaf_reg': 0.16365357167678563, 'border_count': 73, 'bagging_temperature': 0.6552642166787014, 'random_strength': 7.379234870661704, 'grow_policy': 'Lossguide', 'min_data_in_leaf': 411, 'max_leaves': 155}. Best is trial 14 with value: 1609.1448261457704.[0m
[32m[I 2024-10-13 06:49:04,340][0m Trial 295 finished with value: 1832.3896041283065 and parameters: {'depth': 10, 'learning_rate': 0.22891398009113942, 'iterations': 2987, 'l2_leaf_reg': 0.0017082598490448825, 'border_count': 82, 'bagging_temperature': 0.5823630491642162, 'random_strength': 4.892263802083695, 'grow_policy': 'Lossguide', 'min_data_in_leaf': 373, 'max_leaves': 136}. Best is trial 14 with value: 1609.1448261457704.[0m
[32m[I 2024-10-13 06:49:06,645][0m Trial 296 finished with value: 1642.1139104814902 and parameters: {'depth': 9, 'learning_rate': 0.033578461999837175, 'iterations': 2433, 'l2_leaf_reg': 0.006457219385828438, 'border_count': 78, 'bagging_temperature': 0.6804230031038679, 'random_strength': 4.745909859346376, 'grow_policy': 'Lossguide', 'min_data_in_leaf': 430, 'max_leaves': 178}. Best is trial 14 with value: 1609.1448261457704.[0m
[32m[I 2024-10-13 06:49:08,987][0m Trial 297 finished with value: 1762.7521104896236 and parameters: {'depth': 9, 'learning_rate': 0.03317663147027342, 'iterations': 2460, 'l2_leaf_reg': 0.0036411741806771, 'border_count': 63, 'bagging_temperature': 0.6954280948486807, 'random_strength': 7.237903065934378, 'grow_policy': 'Lossguide', 'min_data_in_leaf': 387, 'max_leaves': 175}. Best is trial 14 with value: 1609.1448261457704.[0m
[32m[I 2024-10-13 06:49:11,697][0m Trial 298 finished with value: 1641.8755496084789 and parameters: {'depth': 9, 'learning_rate': 0.035712991533826614, 'iterations': 2832, 'l2_leaf_reg': 0.006009049795591589, 'border_count': 78, 'bagging_temperature': 0.6794447605496392, 'random_strength': 7.052015763241659, 'grow_policy': 'Lossguide', 'min_data_in_leaf': 447, 'max_leaves': 164}. Best is trial 14 with value: 1609.1448261457704.[0m
[32m[I 2024-10-13 06:49:14,373][0m Trial 299 finished with value: 1795.924609524096 and parameters: {'depth': 10, 'learning_rate': 0.053119939250405014, 'iterations': 2931, 'l2_leaf_reg': 0.005989620592199292, 'border_count': 68, 'bagging_temperature': 0.681802267435196, 'random_strength': 6.653485090525821, 'grow_policy': 'Lossguide', 'min_data_in_leaf': 454, 'max_leaves': 166}. Best is trial 14 with value: 1609.1448261457704.[0m
[32m[I 2024-10-13 06:49:17,099][0m Trial 300 finished with value: 1757.41958815001 and parameters: {'depth': 9, 'learning_rate': 0.0434914879529949, 'iterations': 2791, 'l2_leaf_reg': 0.0073290118053017175, 'border_count': 75, 'bagging_temperature': 0.7067763458374151, 'random_strength': 7.143820798857275, 'grow_policy': 'Depthwise', 'min_data_in_leaf': 459}. Best is trial 14 with value: 1609.1448261457704.[0m
