[32m[I 2024-10-13 07:19:54,058][0m Trial 801 finished with value: 1663.7138014611508 and parameters: {'depth': 8, 'learning_rate': 0.028279763327306813, 'iterations': 2739, 'l2_leaf_reg': 0.0006695116384817724, 'border_count': 97, 'bagging_temperature': 0.6574081561522032, 'random_strength': 6.896746289891021, 'grow_policy': 'Lossguide', 'min_data_in_leaf': 340, 'max_leaves': 156}. Best is trial 14 with value: 1609.1448261457704.[0m
[32m[I 2024-10-13 07:19:56,787][0m Trial 802 finished with value: 1642.7958386717357 and parameters: {'depth': 3, 'learning_rate': 0.03184807358918839, 'iterations': 2957, 'l2_leaf_reg': 0.0025799474146343338, 'border_count': 78, 'bagging_temperature': 0.6297736354348873, 'random_strength': 7.377469020579206, 'grow_policy': 'Lossguide', 'min_data_in_leaf': 311, 'max_leaves': 139}. Best is trial 14 with value: 1609.1448261457704.[0m
[32m[I 2024-10-13 07:19:59,377][0m Trial 803 finished with value: 1736.270926486745 and parameters: {'depth': 3, 'learning_rate': 0.21987479054999462, 'iterations': 2821, 'l2_leaf_reg': 0.0002892661490849502, 'border_count': 103, 'bagging_temperature': 0.7200181691711875, 'random_strength': 5.715793162036768, 'grow_policy': 'Lossguide', 'min_data_in_leaf': 746, 'max_leaves': 189}. Best is trial 14 with value: 1609.1448261457704.[0m
[32m[I 2024-10-13 07:20:02,110][0m Trial 804 finished with value: 2981.5608476919615 and parameters: {'depth': 4, 'learning_rate': 0.0010750168405210545, 'iterations': 2903, 'l2_leaf_reg': 0.0010993767303450835, 'border_count': 82, 'bagging_temperature': 0.6977289113134835, 'random_strength': 7.095217797115137, 'grow_policy': 'Lossguide', 'min_data_in_leaf': 424, 'max_leaves': 163}. Best is trial 14 with value: 1609.1448261457704.[0m
[32m[I 2024-10-13 07:20:04,825][0m Trial 805 finished with value: 1646.58915197068 and parameters: {'depth': 4, 'learning_rate': 0.04354845255667466, 'iterations': 2941, 'l2_leaf_reg': 0.47199349137699476, 'border_count': 90, 'bagging_temperature': 0.6599353988458458, 'random_strength': 6.296857872337226, 'grow_policy': 'Lossguide', 'min_data_in_leaf': 787, 'max_leaves': 174}. Best is trial 14 with value: 1609.1448261457704.[0m
[32m[I 2024-10-13 07:20:31,795][0m Trial 806 finished with value: 1922.2529878513124 and parameters: {'depth': 8, 'learning_rate': 0.020726195852357954, 'iterations': 2858, 'l2_leaf_reg': 3.4478881978554943e-07, 'border_count': 69, 'bagging_temperature': 0.6800725727203847, 'random_strength': 6.502472708668607, 'grow_policy': 'SymmetricTree', 'min_data_in_leaf': 385}. Best is trial 14 with value: 1609.1448261457704.[0m
[32m[I 2024-10-13 07:20:34,440][0m Trial 807 finished with value: 1654.3687672122437 and parameters: {'depth': 3, 'learning_rate': 0.03691496862493507, 'iterations': 2999, 'l2_leaf_reg': 0.0005383246538306355, 'border_count': 76, 'bagging_temperature': 0.6469196141948782, 'random_strength': 6.145954892757694, 'grow_policy': 'Lossguide', 'min_data_in_leaf': 364, 'max_leaves': 151}. Best is trial 14 with value: 1609.1448261457704.[0m
[32m[I 2024-10-13 07:20:36,989][0m Trial 808 finished with value: 1661.9946564379115 and parameters: {'depth': 7, 'learning_rate': 0.02520058057530854, 'iterations': 2795, 'l2_leaf_reg': 0.28600032059256864, 'border_count': 86, 'bagging_temperature': 0.7274147151413731, 'random_strength': 5.86276223969038, 'grow_policy': 'Lossguide', 'min_data_in_leaf': 823, 'max_leaves': 160}. Best is trial 14 with value: 1609.1448261457704.[0m
[32m[I 2024-10-13 07:20:39,481][0m Trial 809 finished with value: 1666.6195238584558 and parameters: {'depth': 10, 'learning_rate': 0.05201518141278157, 'iterations': 2705, 'l2_leaf_reg': 2.6688063378894487e-06, 'border_count': 96, 'bagging_temperature': 0.7018814911686396, 'random_strength': 6.742033917002143, 'grow_policy': 'Lossguide', 'min_data_in_leaf': 343, 'max_leaves': 142}. Best is trial 14 with value: 1609.1448261457704.[0m
[32m[I 2024-10-13 07:20:42,200][0m Trial 810 finished with value: 1716.9515548086224 and parameters: {'depth': 5, 'learning_rate': 0.013794401365479868, 'iterations': 2892, 'l2_leaf_reg': 0.0032865270161767488, 'border_count': 84, 'bagging_temperature': 0.325463605752267, 'random_strength': 5.577455889146219, 'grow_policy': 'Lossguide', 'min_data_in_leaf': 401, 'max_leaves': 168}. Best is trial 14 with value: 1609.1448261457704.[0m
[32m[I 2024-10-13 07:20:45,027][0m Trial 811 finished with value: 1684.776183556636 and parameters: {'depth': 3, 'learning_rate': 0.13685884926020883, 'iterations': 2999, 'l2_leaf_reg': 0.0004324057446579426, 'border_count': 91, 'bagging_temperature': 0.6191888167261616, 'random_strength': 5.292328223011572, 'grow_policy': 'Lossguide', 'min_data_in_leaf': 280, 'max_leaves': 228}. Best is trial 14 with value: 1609.1448261457704.[0m
[32m[I 2024-10-13 07:20:45,986][0m Trial 812 finished with value: 1796.2078443810074 and parameters: {'depth': 7, 'learning_rate': 0.02946595691570941, 'iterations': 565, 'l2_leaf_reg': 4.425532751237734e-06, 'border_count': 79, 'bagging_temperature': 0.8110789796737821, 'random_strength': 6.935296646135152, 'grow_policy': 'Lossguide', 'min_data_in_leaf': 357, 'max_leaves': 132}. Best is trial 14 with value: 1609.1448261457704.[0m
[32m[I 2024-10-13 07:20:48,564][0m Trial 813 finished with value: 1891.7384863748605 and parameters: {'depth': 3, 'learning_rate': 0.034874858276863985, 'iterations': 2765, 'l2_leaf_reg': 0.0018445546957975808, 'border_count': 61, 'bagging_temperature': 0.6689293661725186, 'random_strength': 6.058783377354196, 'grow_policy': 'Lossguide', 'min_data_in_leaf': 317, 'max_leaves': 182}. Best is trial 14 with value: 1609.1448261457704.[0m
[32m[I 2024-10-13 07:20:51,041][0m Trial 814 finished with value: 1679.6651952913069 and parameters: {'depth': 8, 'learning_rate': 0.044585671878884355, 'iterations': 2624, 'l2_leaf_reg': 0.9561592238724114, 'border_count': 88, 'bagging_temperature': 0.6883021059208247, 'random_strength': 6.415621315621306, 'grow_policy': 'Lossguide', 'min_data_in_leaf': 807, 'max_leaves': 145}. Best is trial 14 with value: 1609.1448261457704.[0m
[32m[I 2024-10-13 07:20:53,762][0m Trial 815 finished with value: 1767.5475650636054 and parameters: {'depth': 10, 'learning_rate': 0.023509715302446943, 'iterations': 2846, 'l2_leaf_reg': 0.0010155682028606765, 'border_count': 74, 'bagging_temperature': 0.6378073629287183, 'random_strength': 3.1968603324793876, 'grow_policy': 'Depthwise', 'min_data_in_leaf': 383}. Best is trial 14 with value: 1609.1448261457704.[0m
[32m[I 2024-10-13 07:20:56,463][0m Trial 816 finished with value: 1730.627877259666 and parameters: {'depth': 9, 'learning_rate': 0.07047886602574718, 'iterations': 2941, 'l2_leaf_reg': 0.00019082270589978066, 'border_count': 100, 'bagging_temperature': 0.558904662737737, 'random_strength': 7.221957229748037, 'grow_policy': 'Lossguide', 'min_data_in_leaf': 427, 'max_leaves': 154}. Best is trial 14 with value: 1609.1448261457704.[0m
[32m[I 2024-10-13 07:20:59,020][0m Trial 817 finished with value: 1674.0470687199718 and parameters: {'depth': 3, 'learning_rate': 0.031678235875330814, 'iterations': 2677, 'l2_leaf_reg': 1.4398990905817648, 'border_count': 80, 'bagging_temperature': 0.7484656060102343, 'random_strength': 5.749162084936713, 'grow_policy': 'Lossguide', 'min_data_in_leaf': 338, 'max_leaves': 172}. Best is trial 14 with value: 1609.1448261457704.[0m
[32m[I 2024-10-13 07:21:01,646][0m Trial 818 finished with value: 1670.6943880514593 and parameters: {'depth': 8, 'learning_rate': 0.03872359985055512, 'iterations': 2791, 'l2_leaf_reg': 0.00035294422939547316, 'border_count': 93, 'bagging_temperature': 0.7133258612003799, 'random_strength': 6.675074273394987, 'grow_policy': 'Lossguide', 'min_data_in_leaf': 845, 'max_leaves': 164}. Best is trial 14 with value: 1609.1448261457704.[0m
[32m[I 2024-10-13 07:21:11,870][0m Trial 819 finished with value: 1740.0421151437058 and parameters: {'depth': 4, 'learning_rate': 0.02594402724066166, 'iterations': 2895, 'l2_leaf_reg': 0.0007677230393912692, 'border_count': 214, 'bagging_temperature': 0.6613879083061732, 'random_strength': 6.273047426650863, 'grow_policy': 'SymmetricTree', 'min_data_in_leaf': 409}. Best is trial 14 with value: 1609.1448261457704.[0m
[32m[I 2024-10-13 07:21:13,067][0m Trial 820 finished with value: 1749.4760572913478 and parameters: {'depth': 3, 'learning_rate': 0.020137392586226665, 'iterations': 940, 'l2_leaf_reg': 0.0014416274197521803, 'border_count': 84, 'bagging_temperature': 0.6772831694484979, 'random_strength': 5.86305128874416, 'grow_policy': 'Lossguide', 'min_data_in_leaf': 782, 'max_leaves': 128}. Best is trial 14 with value: 1609.1448261457704.[0m
[32m[I 2024-10-13 07:21:15,456][0m Trial 821 finished with value: 1640.2967146169226 and parameters: {'depth': 9, 'learning_rate': 0.033503511438025414, 'iterations': 2535, 'l2_leaf_reg': 7.904210225313585e-06, 'border_count': 88, 'bagging_temperature': 0.6457166093519504, 'random_strength': 5.12523090014075, 'grow_policy': 'Lossguide', 'min_data_in_leaf': 363, 'max_leaves': 148}. Best is trial 14 with value: 1609.1448261457704.[0m
[32m[I 2024-10-13 07:21:17,945][0m Trial 822 finished with value: 1779.616981583947 and parameters: {'depth': 9, 'learning_rate': 0.02852794879577006, 'iterations': 2526, 'l2_leaf_reg': 7.496822608626753e-06, 'border_count': 75, 'bagging_temperature': 0.6938705596655056, 'random_strength': 4.77768307509636, 'grow_policy': 'Lossguide', 'min_data_in_leaf': 326, 'max_leaves': 147}. Best is trial 14 with value: 1609.1448261457704.[0m
[32m[I 2024-10-13 07:21:20,374][0m Trial 823 finished with value: 1798.4804993111716 and parameters: {'depth': 9, 'learning_rate': 0.017373425761626565, 'iterations': 2609, 'l2_leaf_reg': 6.903794963282468e-05, 'border_count': 68, 'bagging_temperature': 0.6552661502355891, 'random_strength': 5.00280268935366, 'grow_policy': 'Lossguide', 'min_data_in_leaf': 869, 'max_leaves': 149}. Best is trial 14 with value: 1609.1448261457704.[0m
[32m[I 2024-10-13 07:21:22,812][0m Trial 824 finished with value: 1642.306746761363 and parameters: {'depth': 9, 'learning_rate': 0.03893456736956803, 'iterations': 2607, 'l2_leaf_reg': 9.678198804508696e-06, 'border_count': 82, 'bagging_temperature': 0.6827132215717616, 'random_strength': 8.326964925886568, 'grow_policy': 'Lossguide', 'min_data_in_leaf': 354, 'max_leaves': 143}. Best is trial 14 with value: 1609.1448261457704.[0m
[32m[I 2024-10-13 07:21:25,228][0m Trial 825 finished with value: 1659.0800978634625 and parameters: {'depth': 9, 'learning_rate': 0.0324574634164672, 'iterations': 2523, 'l2_leaf_reg': 1.5058931892778582e-05, 'border_count': 87, 'bagging_temperature': 0.7132289981315797, 'random_strength': 4.9826984307295605, 'grow_policy': 'Lossguide', 'min_data_in_leaf': 305, 'max_leaves': 152}. Best is trial 14 with value: 1609.1448261457704.[0m
[32m[I 2024-10-13 07:21:27,693][0m Trial 826 finished with value: 1673.4923759852782 and parameters: {'depth': 9, 'learning_rate': 0.05444861385249727, 'iterations': 2573, 'l2_leaf_reg': 5.29972579686201e-06, 'border_count': 78, 'bagging_temperature': 0.7343499273105022, 'random_strength': 4.938529663220828, 'grow_policy': 'Lossguide', 'min_data_in_leaf': 250, 'max_leaves': 137}. Best is trial 14 with value: 1609.1448261457704.[0m
[32m[I 2024-10-13 07:21:30,214][0m Trial 827 finished with value: 1685.8594681182465 and parameters: {'depth': 9, 'learning_rate': 0.04352053608168075, 'iterations': 2656, 'l2_leaf_reg': 8.601957872331415e-06, 'border_count': 95, 'bagging_temperature': 0.6677241767720967, 'random_strength': 5.254856356472626, 'grow_policy': 'Lossguide', 'min_data_in_leaf': 923, 'max_leaves': 157}. Best is trial 14 with value: 1609.1448261457704.[0m
[32m[I 2024-10-13 07:21:32,734][0m Trial 828 finished with value: 1790.2901956618666 and parameters: {'depth': 9, 'learning_rate': 0.02275412355229177, 'iterations': 2649, 'l2_leaf_reg': 1.200298645421176e-05, 'border_count': 71, 'bagging_temperature': 0.6479083216996125, 'random_strength': 5.153810251582042, 'grow_policy': 'Lossguide', 'min_data_in_leaf': 974, 'max_leaves': 149}. Best is trial 14 with value: 1609.1448261457704.[0m
[32m[I 2024-10-13 07:21:35,120][0m Trial 829 finished with value: 1686.1898636031892 and parameters: {'depth': 9, 'learning_rate': 0.029271186040451987, 'iterations': 2513, 'l2_leaf_reg': 4.047087724789986e-06, 'border_count': 82, 'bagging_temperature': 0.6969151371620748, 'random_strength': 7.087030537551768, 'grow_policy': 'Lossguide', 'min_data_in_leaf': 802, 'max_leaves': 140}. Best is trial 14 with value: 1609.1448261457704.[0m
[32m[I 2024-10-13 07:21:37,697][0m Trial 830 finished with value: 1651.0498420052086 and parameters: {'depth': 9, 'learning_rate': 0.03550056999867504, 'iterations': 2683, 'l2_leaf_reg': 2.0930933089291225e-05, 'border_count': 87, 'bagging_temperature': 0.6762405356386114, 'random_strength': 6.576864209239497, 'grow_policy': 'Lossguide', 'min_data_in_leaf': 820, 'max_leaves': 146}. Best is trial 14 with value: 1609.1448261457704.[0m
[32m[I 2024-10-13 07:22:13,204][0m Trial 831 finished with value: 1871.03119936422 and parameters: {'depth': 9, 'learning_rate': 0.026042600147303058, 'iterations': 2584, 'l2_leaf_reg': 9.933160013448505e-06, 'border_count': 111, 'bagging_temperature': 0.6397514488171999, 'random_strength': 6.75817740475772, 'grow_policy': 'SymmetricTree', 'min_data_in_leaf': 769}. Best is trial 14 with value: 1609.1448261457704.[0m
[32m[I 2024-10-13 07:22:15,659][0m Trial 832 finished with value: 1701.1967733150918 and parameters: {'depth': 9, 'learning_rate': 0.04488281044635679, 'iterations': 2711, 'l2_leaf_reg': 5.922336981058388e-06, 'border_count': 92, 'bagging_temperature': 0.7105796600046707, 'random_strength': 6.901795696113598, 'grow_policy': 'Lossguide', 'min_data_in_leaf': 358, 'max_leaves': 154}. Best is trial 14 with value: 1609.1448261457704.[0m
[32m[I 2024-10-13 07:22:18,222][0m Trial 833 finished with value: 1673.206454249067 and parameters: {'depth': 9, 'learning_rate': 0.06132379012591812, 'iterations': 2725, 'l2_leaf_reg': 3.48722613765977e-05, 'border_count': 79, 'bagging_temperature': 0.6626501983497577, 'random_strength': 6.420427724604204, 'grow_policy': 'Lossguide', 'min_data_in_leaf': 294, 'max_leaves': 134}. Best is trial 14 with value: 1609.1448261457704.[0m
[32m[I 2024-10-13 07:22:20,610][0m Trial 834 finished with value: 1670.870838408679 and parameters: {'depth': 9, 'learning_rate': 0.032394722195016455, 'iterations': 2563, 'l2_leaf_reg': 3.3645199809151185e-06, 'border_count': 85, 'bagging_temperature': 0.9975595714441062, 'random_strength': 4.783861421513586, 'grow_policy': 'Lossguide', 'min_data_in_leaf': 892, 'max_leaves': 243}. Best is trial 14 with value: 1609.1448261457704.[0m
[32m[I 2024-10-13 07:22:23,118][0m Trial 835 finished with value: 1765.398591143902 and parameters: {'depth': 9, 'learning_rate': 0.02072678361377116, 'iterations': 2644, 'l2_leaf_reg': 1.6029610500249002e-05, 'border_count': 75, 'bagging_temperature': 0.7618217758500331, 'random_strength': 6.18332325853019, 'grow_policy': 'Lossguide', 'min_data_in_leaf': 386, 'max_leaves': 157}. Best is trial 14 with value: 1609.1448261457704.[0m
[32m[I 2024-10-13 07:22:25,688][0m Trial 836 finished with value: 1726.7833079944623 and parameters: {'depth': 9, 'learning_rate': 0.1878061294899072, 'iterations': 2766, 'l2_leaf_reg': 7.390907441549669e-06, 'border_count': 99, 'bagging_temperature': 0.6905041513503529, 'random_strength': 5.189191438153644, 'grow_policy': 'Lossguide', 'min_data_in_leaf': 852, 'max_leaves': 143}. Best is trial 14 with value: 1609.1448261457704.[0m
[32m[I 2024-10-13 07:22:28,281][0m Trial 837 finished with value: 1647.0502594186632 and parameters: {'depth': 10, 'learning_rate': 0.03740325983943964, 'iterations': 2722, 'l2_leaf_reg': 0.2251682867676153, 'border_count': 90, 'bagging_temperature': 0.7277498957539862, 'random_strength': 7.333150295454967, 'grow_policy': 'Lossguide', 'min_data_in_leaf': 331, 'max_leaves': 150}. Best is trial 14 with value: 1609.1448261457704.[0m
[32m[I 2024-10-13 07:22:30,872][0m Trial 838 finished with value: 1775.2065390032446 and parameters: {'depth': 8, 'learning_rate': 0.25051133058200636, 'iterations': 2804, 'l2_leaf_reg': 2.6537697472809136, 'border_count': 81, 'bagging_temperature': 0.6121126410036399, 'random_strength': 6.625138153391989, 'grow_policy': 'Depthwise', 'min_data_in_leaf': 368}. Best is trial 14 with value: 1609.1448261457704.[0m
[32m[I 2024-10-13 07:22:33,430][0m Trial 839 finished with value: 1752.3527931287551 and parameters: {'depth': 9, 'learning_rate': 0.028341916713352535, 'iterations': 2667, 'l2_leaf_reg': 1.6539560713776824e-06, 'border_count': 71, 'bagging_temperature': 0.6520001873162751, 'random_strength': 7.599565644932299, 'grow_policy': 'Lossguide', 'min_data_in_leaf': 268, 'max_leaves': 160}. Best is trial 14 with value: 1609.1448261457704.[0m
[32m[I 2024-10-13 07:22:36,132][0m Trial 840 finished with value: 1666.0231992712263 and parameters: {'depth': 8, 'learning_rate': 0.04968399114246516, 'iterations': 2946, 'l2_leaf_reg': 2.1199355342548923e-06, 'border_count': 86, 'bagging_temperature': 0.5168219653471866, 'random_strength': 6.0716242523234945, 'grow_policy': 'Lossguide', 'min_data_in_leaf': 403, 'max_leaves': 98}. Best is trial 14 with value: 1609.1448261457704.[0m
[32m[I 2024-10-13 07:22:38,716][0m Trial 841 finished with value: 1682.6317847837165 and parameters: {'depth': 10, 'learning_rate': 0.024863085463944015, 'iterations': 2750, 'l2_leaf_reg': 2.680814786918827e-08, 'border_count': 94, 'bagging_temperature': 0.6831306895867355, 'random_strength': 6.424109394228124, 'grow_policy': 'Lossguide', 'min_data_in_leaf': 429, 'max_leaves': 141}. Best is trial 14 with value: 1609.1448261457704.[0m
[32m[I 2024-10-13 07:22:40,258][0m Trial 842 finished with value: 1696.6632409420722 and parameters: {'depth': 9, 'learning_rate': 0.04067070902083671, 'iterations': 1327, 'l2_leaf_reg': 1.4672529526529988e-05, 'border_count': 83, 'bagging_temperature': 0.6994322935871228, 'random_strength': 6.932276231800473, 'grow_policy': 'Lossguide', 'min_data_in_leaf': 342, 'max_leaves': 155}. Best is trial 14 with value: 1609.1448261457704.[0m
[32m[I 2024-10-13 07:22:42,992][0m Trial 843 finished with value: 1682.8056791499419 and parameters: {'depth': 9, 'learning_rate': 0.03001119023412515, 'iterations': 2999, 'l2_leaf_reg': 0.532129159410283, 'border_count': 105, 'bagging_temperature': 0.636455523715237, 'random_strength': 6.296681412086262, 'grow_policy': 'Lossguide', 'min_data_in_leaf': 303, 'max_leaves': 42}. Best is trial 14 with value: 1609.1448261457704.[0m
[32m[I 2024-10-13 07:23:08,646][0m Trial 844 finished with value: 1865.2466448872876 and parameters: {'depth': 8, 'learning_rate': 0.03670754052409921, 'iterations': 2840, 'l2_leaf_reg': 5.651444376298669e-06, 'border_count': 66, 'bagging_temperature': 0.6587556089781922, 'random_strength': 5.420782925200555, 'grow_policy': 'SymmetricTree', 'min_data_in_leaf': 833}. Best is trial 14 with value: 1609.1448261457704.[0m
[32m[I 2024-10-13 07:23:11,180][0m Trial 845 finished with value: 1676.5297881709355 and parameters: {'depth': 6, 'learning_rate': 0.015975180639772782, 'iterations': 2849, 'l2_leaf_reg': 0.003574567143777192, 'border_count': 76, 'bagging_temperature': 0.7155193542302856, 'random_strength': 7.1397967923486245, 'grow_policy': 'Lossguide', 'min_data_in_leaf': 378, 'max_leaves': 138}. Best is trial 14 with value: 1609.1448261457704.[0m
[32m[I 2024-10-13 07:23:13,922][0m Trial 846 finished with value: 1714.1160683685532 and parameters: {'depth': 9, 'learning_rate': 0.08242431679455665, 'iterations': 3000, 'l2_leaf_reg': 0.13253932531613039, 'border_count': 92, 'bagging_temperature': 0.677926429295525, 'random_strength': 6.74941269207051, 'grow_policy': 'Lossguide', 'min_data_in_leaf': 355, 'max_leaves': 146}. Best is trial 14 with value: 1609.1448261457704.[0m
[32m[I 2024-10-13 07:23:16,623][0m Trial 847 finished with value: 1646.1196824080907 and parameters: {'depth': 5, 'learning_rate': 0.0322117334088288, 'iterations': 2932, 'l2_leaf_reg': 0.0018804927740447971, 'border_count': 88, 'bagging_temperature': 0.5916156003497186, 'random_strength': 5.065311065715414, 'grow_policy': 'Lossguide', 'min_data_in_leaf': 794, 'max_leaves': 151}. Best is trial 14 with value: 1609.1448261457704.[0m
[32m[I 2024-10-13 07:23:19,147][0m Trial 848 finished with value: 1664.5161594612666 and parameters: {'depth': 9, 'learning_rate': 0.02291445568178756, 'iterations': 2703, 'l2_leaf_reg': 8.427302230925393e-07, 'border_count': 79, 'bagging_temperature': 0.6194033094674907, 'random_strength': 5.99007657560925, 'grow_policy': 'Lossguide', 'min_data_in_leaf': 323, 'max_leaves': 159}. Best is trial 14 with value: 1609.1448261457704.[0m
[32m[I 2024-10-13 07:23:21,680][0m Trial 849 finished with value: 1684.8057933214307 and parameters: {'depth': 10, 'learning_rate': 0.04142611649041318, 'iterations': 2600, 'l2_leaf_reg': 0.08623370982493556, 'border_count': 98, 'bagging_temperature': 0.742343124552245, 'random_strength': 6.573599397863815, 'grow_policy': 'Lossguide', 'min_data_in_leaf': 388, 'max_leaves': 133}. Best is trial 14 with value: 1609.1448261457704.[0m
[32m[I 2024-10-13 07:23:24,282][0m Trial 850 finished with value: 1695.9980703278359 and parameters: {'depth': 9, 'learning_rate': 0.05000139216028628, 'iterations': 2771, 'l2_leaf_reg': 0.3616904634179768, 'border_count': 249, 'bagging_temperature': 0.6708122096223591, 'random_strength': 6.163992228640312, 'grow_policy': 'Lossguide', 'min_data_in_leaf': 405, 'max_leaves': 163}. Best is trial 14 with value: 1609.1448261457704.[0m
