[32m[I 2024-10-13 12:50:36,963][0m Trial 405 finished with value: 1760.2475274647747 and parameters: {'depth': 5, 'learning_rate': 0.0008921532174648837, 'iterations': 1960, 'l2_leaf_reg': 5.4415688611598335e-08, 'border_count': 28, 'bagging_temperature': 0.07769810764064357, 'random_strength': 5.554915345035154, 'grow_policy': 'Depthwise', 'min_data_in_leaf': 42}. Best is trial 249 with value: 1695.0689015039372.[0m
[32m[I 2024-10-13 12:50:39,133][0m Trial 406 finished with value: 2125.217555075505 and parameters: {'depth': 10, 'learning_rate': 0.0029339213646369143, 'iterations': 2251, 'l2_leaf_reg': 3.955313912786462e-07, 'border_count': 17, 'bagging_temperature': 0.020178877164134804, 'random_strength': 6.703815016609149, 'grow_policy': 'Depthwise', 'min_data_in_leaf': 134}. Best is trial 249 with value: 1695.0689015039372.[0m
[32m[I 2024-10-13 12:50:41,371][0m Trial 407 finished with value: 1741.2256834871537 and parameters: {'depth': 4, 'learning_rate': 0.0012882422166559959, 'iterations': 1794, 'l2_leaf_reg': 1.6383670610282025e-07, 'border_count': 34, 'bagging_temperature': 0.11171694816408165, 'random_strength': 6.993915048340673, 'grow_policy': 'Depthwise', 'min_data_in_leaf': 83}. Best is trial 249 with value: 1695.0689015039372.[0m
[32m[I 2024-10-13 12:50:43,593][0m Trial 408 finished with value: 1776.4889980308506 and parameters: {'depth': 11, 'learning_rate': 0.006504074519282166, 'iterations': 2192, 'l2_leaf_reg': 2.428687308820379e-07, 'border_count': 9, 'bagging_temperature': 0.05878392787286883, 'random_strength': 7.51080910641726, 'grow_policy': 'Depthwise', 'min_data_in_leaf': 196}. Best is trial 249 with value: 1695.0689015039372.[0m
[32m[I 2024-10-13 12:50:45,852][0m Trial 409 finished with value: 1737.8561062931783 and parameters: {'depth': 3, 'learning_rate': 0.0018322559470712457, 'iterations': 2315, 'l2_leaf_reg': 7.269509357677239e-08, 'border_count': 25, 'bagging_temperature': 0.03707823397423232, 'random_strength': 8.121750146317495, 'grow_policy': 'Depthwise', 'min_data_in_leaf': 390}. Best is trial 249 with value: 1695.0689015039372.[0m
[32m[I 2024-10-13 12:50:51,675][0m Trial 410 finished with value: 2008.674715117768 and parameters: {'depth': 8, 'learning_rate': 0.2504268041435061, 'iterations': 1627, 'l2_leaf_reg': 3.3873597878955386e-08, 'border_count': 52, 'bagging_temperature': 0.08027755874253104, 'random_strength': 7.229013693453092, 'grow_policy': 'SymmetricTree', 'min_data_in_leaf': 368}. Best is trial 249 with value: 1695.0689015039372.[0m
[32m[I 2024-10-13 12:50:53,770][0m Trial 411 finished with value: 1719.7199229049093 and parameters: {'depth': 7, 'learning_rate': 0.0014595214945706777, 'iterations': 2139, 'l2_leaf_reg': 1.2350595098961323e-07, 'border_count': 30, 'bagging_temperature': 0.035950906995163914, 'random_strength': 5.826399267517299, 'grow_policy': 'Depthwise', 'min_data_in_leaf': 126}. Best is trial 249 with value: 1695.0689015039372.[0m
[32m[I 2024-10-13 12:50:55,819][0m Trial 412 finished with value: 1919.7048111827924 and parameters: {'depth': 10, 'learning_rate': 0.0012645603618526415, 'iterations': 2049, 'l2_leaf_reg': 1.8791760815698783e-08, 'border_count': 20, 'bagging_temperature': 0.0008630580743439406, 'random_strength': 8.70574355211677, 'grow_policy': 'Depthwise', 'min_data_in_leaf': 109}. Best is trial 249 with value: 1695.0689015039372.[0m
[32m[I 2024-10-13 12:50:57,719][0m Trial 413 finished with value: 1798.587206580207 and parameters: {'depth': 9, 'learning_rate': 0.0010105160539223869, 'iterations': 1862, 'l2_leaf_reg': 4.98093202215279e-08, 'border_count': 40, 'bagging_temperature': 0.05974153834581583, 'random_strength': 7.768471414550607, 'grow_policy': 'Depthwise', 'min_data_in_leaf': 166}. Best is trial 249 with value: 1695.0689015039372.[0m
[32m[I 2024-10-13 12:51:10,552][0m Trial 414 finished with value: 1969.1019293777822 and parameters: {'depth': 11, 'learning_rate': 0.0015606523125674544, 'iterations': 2297, 'l2_leaf_reg': 7.762655115837774e-08, 'border_count': 25, 'bagging_temperature': 0.01701786338952379, 'random_strength': 6.807473266946695, 'grow_policy': 'Lossguide', 'min_data_in_leaf': 6, 'max_leaves': 95}. Best is trial 249 with value: 1695.0689015039372.[0m
[32m[I 2024-10-13 12:51:13,589][0m Trial 415 finished with value: 2429.295359802565 and parameters: {'depth': 10, 'learning_rate': 0.0021502208907660824, 'iterations': 1998, 'l2_leaf_reg': 2.974864042557455e-07, 'border_count': 185, 'bagging_temperature': 0.043920649565840755, 'random_strength': 5.272667364963187, 'grow_policy': 'Depthwise', 'min_data_in_leaf': 64}. Best is trial 249 with value: 1695.0689015039372.[0m
[32m[I 2024-10-13 12:51:14,833][0m Trial 416 finished with value: 2131.727710640321 and parameters: {'depth': 9, 'learning_rate': 0.001127299756816498, 'iterations': 972, 'l2_leaf_reg': 0.000734602069997882, 'border_count': 14, 'bagging_temperature': 0.08787970908873563, 'random_strength': 2.2484800964795806, 'grow_policy': 'Depthwise', 'min_data_in_leaf': 228}. Best is trial 249 with value: 1695.0689015039372.[0m
[32m[I 2024-10-13 12:51:17,126][0m Trial 417 finished with value: 1736.3099573993443 and parameters: {'depth': 6, 'learning_rate': 0.001809048997609304, 'iterations': 2364, 'l2_leaf_reg': 1.494107148291023e-07, 'border_count': 6, 'bagging_temperature': 0.020456416290676203, 'random_strength': 6.49172678015383, 'grow_policy': 'Depthwise', 'min_data_in_leaf': 353}. Best is trial 249 with value: 1695.0689015039372.[0m
[32m[I 2024-10-13 12:51:18,906][0m Trial 418 finished with value: 1985.8847656629941 and parameters: {'depth': 9, 'learning_rate': 0.0007340199216799817, 'iterations': 1673, 'l2_leaf_reg': 2.3793685691129985e-08, 'border_count': 35, 'bagging_temperature': 0.0670242038836824, 'random_strength': 6.048070983032261, 'grow_policy': 'Depthwise', 'min_data_in_leaf': 320}. Best is trial 249 with value: 1695.0689015039372.[0m
[32m[I 2024-10-13 12:51:21,110][0m Trial 419 finished with value: 2038.4914329883616 and parameters: {'depth': 10, 'learning_rate': 0.0013814238145202697, 'iterations': 2236, 'l2_leaf_reg': 1.0183780002267868e-07, 'border_count': 99, 'bagging_temperature': 0.33530944849774186, 'random_strength': 5.5170710881485325, 'grow_policy': 'Depthwise', 'min_data_in_leaf': 145}. Best is trial 249 with value: 1695.0689015039372.[0m
[32m[I 2024-10-13 12:51:22,959][0m Trial 420 finished with value: 1817.9842055963031 and parameters: {'depth': 8, 'learning_rate': 0.0009382600688956987, 'iterations': 1812, 'l2_leaf_reg': 0.002377946807073476, 'border_count': 29, 'bagging_temperature': 0.03460627856292766, 'random_strength': 7.456747353017167, 'grow_policy': 'Lossguide', 'min_data_in_leaf': 103, 'max_leaves': 243}. Best is trial 249 with value: 1695.0689015039372.[0m
[32m[I 2024-10-13 12:51:25,019][0m Trial 421 finished with value: 1917.2781546399128 and parameters: {'depth': 11, 'learning_rate': 0.00116475008105294, 'iterations': 2127, 'l2_leaf_reg': 4.182868819843643e-08, 'border_count': 20, 'bagging_temperature': 0.05606692475417745, 'random_strength': 6.295727349962738, 'grow_policy': 'Depthwise', 'min_data_in_leaf': 434}. Best is trial 249 with value: 1695.0689015039372.[0m
[32m[I 2024-10-13 12:51:27,120][0m Trial 422 finished with value: 1754.360211132247 and parameters: {'depth': 9, 'learning_rate': 0.0015542064968206832, 'iterations': 2192, 'l2_leaf_reg': 2.1892837620742585e-07, 'border_count': 24, 'bagging_temperature': 0.016502396848121065, 'random_strength': 7.140700721463762, 'grow_policy': 'Depthwise', 'min_data_in_leaf': 171}. Best is trial 249 with value: 1695.0689015039372.[0m
[32m[I 2024-10-13 12:51:29,103][0m Trial 423 finished with value: 1735.34748975234 and parameters: {'depth': 10, 'learning_rate': 0.0018710929380255487, 'iterations': 1911, 'l2_leaf_reg': 6.825403930235597e-08, 'border_count': 31, 'bagging_temperature': 0.00031604266048306656, 'random_strength': 5.675036964910882, 'grow_policy': 'Depthwise', 'min_data_in_leaf': 210}. Best is trial 249 with value: 1695.0689015039372.[0m
[32m[I 2024-10-13 12:51:31,146][0m Trial 424 finished with value: 1929.710950328579 and parameters: {'depth': 9, 'learning_rate': 0.0012588894794624927, 'iterations': 2055, 'l2_leaf_reg': 1.2432296318295098e-07, 'border_count': 16, 'bagging_temperature': 0.1109680493974603, 'random_strength': 6.94317764707138, 'grow_policy': 'Depthwise', 'min_data_in_leaf': 126}. Best is trial 249 with value: 1695.0689015039372.[0m
[32m[I 2024-10-13 12:51:33,173][0m Trial 425 finished with value: 1853.7026457670627 and parameters: {'depth': 10, 'learning_rate': 0.002601927410376157, 'iterations': 1573, 'l2_leaf_reg': 3.6601819052407336e-07, 'border_count': 38, 'bagging_temperature': 0.03986822553432083, 'random_strength': 7.982533073359252, 'grow_policy': 'Depthwise', 'min_data_in_leaf': 85}. Best is trial 249 with value: 1695.0689015039372.[0m
[32m[I 2024-10-13 12:51:34,779][0m Trial 426 finished with value: 1870.1508729959653 and parameters: {'depth': 9, 'learning_rate': 0.0010396596716902677, 'iterations': 1457, 'l2_leaf_reg': 4.8792631890824865e-08, 'border_count': 28, 'bagging_temperature': 0.07507888282854894, 'random_strength': 7.650009673225287, 'grow_policy': 'Lossguide', 'min_data_in_leaf': 145, 'max_leaves': 225}. Best is trial 249 with value: 1695.0689015039372.[0m
[32m[I 2024-10-13 12:51:36,965][0m Trial 427 finished with value: 1854.5575206400504 and parameters: {'depth': 5, 'learning_rate': 0.001498160872366827, 'iterations': 2272, 'l2_leaf_reg': 8.605114268961327e-08, 'border_count': 46, 'bagging_temperature': 0.05427712829508377, 'random_strength': 6.659778158369804, 'grow_policy': 'Depthwise', 'min_data_in_leaf': 391}. Best is trial 249 with value: 1695.0689015039372.[0m
[32m[I 2024-10-13 12:51:39,250][0m Trial 428 finished with value: 2046.9814606108228 and parameters: {'depth': 9, 'learning_rate': 0.0021753323328231704, 'iterations': 2378, 'l2_leaf_reg': 1.7127822508404822e-07, 'border_count': 21, 'bagging_temperature': 0.09315159481733823, 'random_strength': 5.918826964628862, 'grow_policy': 'Depthwise', 'min_data_in_leaf': 182}. Best is trial 249 with value: 1695.0689015039372.[0m
[32m[I 2024-10-13 12:51:40,798][0m Trial 429 finished with value: 2066.6498197330134 and parameters: {'depth': 11, 'learning_rate': 0.0008951832720007506, 'iterations': 1353, 'l2_leaf_reg': 3.284015227039165e-08, 'border_count': 12, 'bagging_temperature': 0.02743986883895388, 'random_strength': 7.411573518947397, 'grow_policy': 'Depthwise', 'min_data_in_leaf': 305}. Best is trial 249 with value: 1695.0689015039372.[0m
[32m[I 2024-10-13 12:51:57,396][0m Trial 430 finished with value: 2014.7874702862848 and parameters: {'depth': 8, 'learning_rate': 0.001695425347746121, 'iterations': 1982, 'l2_leaf_reg': 6.453923723403432e-08, 'border_count': 33, 'bagging_temperature': 0.016861353308571612, 'random_strength': 8.399125618316198, 'grow_policy': 'SymmetricTree', 'min_data_in_leaf': 343}. Best is trial 249 with value: 1695.0689015039372.[0m
[32m[I 2024-10-13 12:51:59,621][0m Trial 431 finished with value: 1699.7342231673874 and parameters: {'depth': 9, 'learning_rate': 0.001339274817490258, 'iterations': 2327, 'l2_leaf_reg': 9.825732463763654e-08, 'border_count': 25, 'bagging_temperature': 0.046809843408923496, 'random_strength': 7.178712190244393, 'grow_policy': 'Depthwise', 'min_data_in_leaf': 114}. Best is trial 249 with value: 1695.0689015039372.[0m
[32m[I 2024-10-13 12:52:01,829][0m Trial 432 finished with value: 1937.7658187437135 and parameters: {'depth': 9, 'learning_rate': 0.0014010257678796461, 'iterations': 2191, 'l2_leaf_reg': 2.3708666513675001e-07, 'border_count': 19, 'bagging_temperature': 0.06857322719630501, 'random_strength': 7.352729329816953, 'grow_policy': 'Depthwise', 'min_data_in_leaf': 112}. Best is trial 249 with value: 1695.0689015039372.[0m
[32m[I 2024-10-13 12:52:04,141][0m Trial 433 finished with value: 2527.4940993166697 and parameters: {'depth': 8, 'learning_rate': 0.19083249873724, 'iterations': 2234, 'l2_leaf_reg': 1.4100147341861302e-08, 'border_count': 25, 'bagging_temperature': 0.055589307301929174, 'random_strength': 4.11562491789121, 'grow_policy': 'Depthwise', 'min_data_in_leaf': 92}. Best is trial 249 with value: 1695.0689015039372.[0m
[32m[I 2024-10-13 12:52:06,373][0m Trial 434 finished with value: 1737.133947944561 and parameters: {'depth': 9, 'learning_rate': 0.001833203119638095, 'iterations': 2311, 'l2_leaf_reg': 6.638946301163044e-05, 'border_count': 8, 'bagging_temperature': 0.097330277314679, 'random_strength': 7.12604860967449, 'grow_policy': 'Lossguide', 'min_data_in_leaf': 132, 'max_leaves': 218}. Best is trial 249 with value: 1695.0689015039372.[0m
[32m[I 2024-10-13 12:52:07,851][0m Trial 435 finished with value: 1977.6191480418847 and parameters: {'depth': 7, 'learning_rate': 0.001067497849679608, 'iterations': 1240, 'l2_leaf_reg': 1.2246555146168684e-07, 'border_count': 23, 'bagging_temperature': 0.04198442182633175, 'random_strength': 7.195996626959367, 'grow_policy': 'Depthwise', 'min_data_in_leaf': 150}. Best is trial 249 with value: 1695.0689015039372.[0m
[32m[I 2024-10-13 12:52:10,442][0m Trial 436 finished with value: 2120.4538171809995 and parameters: {'depth': 9, 'learning_rate': 0.0015659553121385686, 'iterations': 2107, 'l2_leaf_reg': 2.582960089021568e-08, 'border_count': 16, 'bagging_temperature': 0.07936314673636499, 'random_strength': 7.476571902735453, 'grow_policy': 'Depthwise', 'min_data_in_leaf': 72}. Best is trial 249 with value: 1695.0689015039372.[0m
[32m[I 2024-10-13 12:52:12,356][0m Trial 437 finished with value: 1737.9924939054329 and parameters: {'depth': 10, 'learning_rate': 0.001197908765433013, 'iterations': 1830, 'l2_leaf_reg': 4.791135676902903e-07, 'border_count': 36, 'bagging_temperature': 0.032001720601922024, 'random_strength': 7.845609575600494, 'grow_policy': 'Depthwise', 'min_data_in_leaf': 110}. Best is trial 249 with value: 1695.0689015039372.[0m
[32m[I 2024-10-13 12:52:14,173][0m Trial 438 finished with value: 1754.1444337590922 and parameters: {'depth': 9, 'learning_rate': 0.002257240994239061, 'iterations': 1730, 'l2_leaf_reg': 2.4974606253334594e-05, 'border_count': 29, 'bagging_temperature': 0.11559956243514273, 'random_strength': 6.966310067722418, 'grow_policy': 'Depthwise', 'min_data_in_leaf': 141}. Best is trial 249 with value: 1695.0689015039372.[0m
[32m[I 2024-10-13 12:52:16,353][0m Trial 439 finished with value: 1762.9009942988268 and parameters: {'depth': 10, 'learning_rate': 0.0013718121235477645, 'iterations': 2038, 'l2_leaf_reg': 1.9386221753928757e-07, 'border_count': 23, 'bagging_temperature': 0.05393247732514144, 'random_strength': 7.25368142484467, 'grow_policy': 'Depthwise', 'min_data_in_leaf': 100}. Best is trial 249 with value: 1695.0689015039372.[0m
[32m[I 2024-10-13 12:52:18,309][0m Trial 440 finished with value: 1752.4468807476628 and parameters: {'depth': 9, 'learning_rate': 0.0020216466556139726, 'iterations': 1949, 'l2_leaf_reg': 1.0638189513335489e-07, 'border_count': 32, 'bagging_temperature': 0.01574774154767007, 'random_strength': 7.647505034097553, 'grow_policy': 'Lossguide', 'min_data_in_leaf': 129, 'max_leaves': 77}. Best is trial 249 with value: 1695.0689015039372.[0m
[32m[I 2024-10-13 12:52:20,595][0m Trial 441 finished with value: 2110.0364455978997 and parameters: {'depth': 8, 'learning_rate': 0.002844427737272341, 'iterations': 2341, 'l2_leaf_reg': 5.248854309427022e-08, 'border_count': 19, 'bagging_temperature': 0.07669072172331587, 'random_strength': 5.312526541781956, 'grow_policy': 'Depthwise', 'min_data_in_leaf': 172}. Best is trial 249 with value: 1695.0689015039372.[0m
[32m[I 2024-10-13 12:52:22,819][0m Trial 442 finished with value: 1918.1827793838095 and parameters: {'depth': 9, 'learning_rate': 0.0008186793686657614, 'iterations': 2288, 'l2_leaf_reg': 2.881938280762069e-07, 'border_count': 12, 'bagging_temperature': 0.04285025250051027, 'random_strength': 6.8950628102239175, 'grow_policy': 'Depthwise', 'min_data_in_leaf': 455}. Best is trial 249 with value: 1695.0689015039372.[0m
[32m[I 2024-10-13 12:52:24,149][0m Trial 443 finished with value: 1813.2441830203659 and parameters: {'depth': 10, 'learning_rate': 0.0016563468643460292, 'iterations': 1038, 'l2_leaf_reg': 1.469320658347392e-07, 'border_count': 27, 'bagging_temperature': 0.014996240249554713, 'random_strength': 4.848852722029339, 'grow_policy': 'Depthwise', 'min_data_in_leaf': 522}. Best is trial 249 with value: 1695.0689015039372.[0m
[32m[I 2024-10-13 12:52:26,289][0m Trial 444 finished with value: 1773.0656683253853 and parameters: {'depth': 9, 'learning_rate': 0.0010419302178676117, 'iterations': 2168, 'l2_leaf_reg': 3.7145905040758187e-08, 'border_count': 42, 'bagging_temperature': 0.06207847273201285, 'random_strength': 5.545445699555096, 'grow_policy': 'Depthwise', 'min_data_in_leaf': 375}. Best is trial 249 with value: 1695.0689015039372.[0m
[32m[I 2024-10-13 12:52:28,802][0m Trial 445 finished with value: 2425.3845603952745 and parameters: {'depth': 9, 'learning_rate': 0.0012954034443647315, 'iterations': 2247, 'l2_leaf_reg': 7.603854763928374e-08, 'border_count': 4, 'bagging_temperature': 0.0008495927993241217, 'random_strength': 7.2636378591677415, 'grow_policy': 'Depthwise', 'min_data_in_leaf': 58}. Best is trial 249 with value: 1695.0689015039372.[0m
[32m[I 2024-10-13 12:52:30,713][0m Trial 446 finished with value: 1713.3045180707177 and parameters: {'depth': 8, 'learning_rate': 0.001497457222209985, 'iterations': 1890, 'l2_leaf_reg': 5.430172156753488e-08, 'border_count': 37, 'bagging_temperature': 0.03110768054605329, 'random_strength': 8.183757648502704, 'grow_policy': 'Lossguide', 'min_data_in_leaf': 116, 'max_leaves': 56}. Best is trial 249 with value: 1695.0689015039372.[0m
[32m[I 2024-10-13 12:52:32,845][0m Trial 447 finished with value: 1786.4126452822834 and parameters: {'depth': 7, 'learning_rate': 0.0019429592998623938, 'iterations': 1864, 'l2_leaf_reg': 2.2658960609579948e-08, 'border_count': 38, 'bagging_temperature': 0.027607385305074117, 'random_strength': 8.53240227604204, 'grow_policy': 'Lossguide', 'min_data_in_leaf': 94, 'max_leaves': 52}. Best is trial 249 with value: 1695.0689015039372.[0m
[32m[I 2024-10-13 12:52:35,268][0m Trial 448 finished with value: 2098.9553547117484 and parameters: {'depth': 8, 'learning_rate': 0.0016449620113004586, 'iterations': 1901, 'l2_leaf_reg': 4.517231838412633e-08, 'border_count': 47, 'bagging_temperature': 0.03165154544199291, 'random_strength': 8.17708406225521, 'grow_policy': 'Lossguide', 'min_data_in_leaf': 73, 'max_leaves': 33}. Best is trial 249 with value: 1695.0689015039372.[0m
[32m[I 2024-10-13 12:52:37,149][0m Trial 449 finished with value: 2111.538286897315 and parameters: {'depth': 8, 'learning_rate': 0.003537796481202811, 'iterations': 1780, 'l2_leaf_reg': 3.655648324737401e-08, 'border_count': 17, 'bagging_temperature': 0.015708843194964416, 'random_strength': 8.290046882796107, 'grow_policy': 'Lossguide', 'min_data_in_leaf': 107, 'max_leaves': 59}. Best is trial 249 with value: 1695.0689015039372.[0m
[32m[I 2024-10-13 12:52:38,992][0m Trial 450 finished with value: 1764.9276682197997 and parameters: {'depth': 8, 'learning_rate': 0.0024033064955420354, 'iterations': 1844, 'l2_leaf_reg': 0.010283074579915487, 'border_count': 25, 'bagging_temperature': 0.4061801352747825, 'random_strength': 7.981016797384585, 'grow_policy': 'Lossguide', 'min_data_in_leaf': 120, 'max_leaves': 43}. Best is trial 249 with value: 1695.0689015039372.[0m
[32m[I 2024-10-13 12:52:40,977][0m Trial 451 finished with value: 1713.934958268365 and parameters: {'depth': 8, 'learning_rate': 0.0014579745741384632, 'iterations': 1957, 'l2_leaf_reg': 6.086500069347728e-08, 'border_count': 37, 'bagging_temperature': 0.04344663177061043, 'random_strength': 8.164112564940755, 'grow_policy': 'Lossguide', 'min_data_in_leaf': 119, 'max_leaves': 254}. Best is trial 249 with value: 1695.0689015039372.[0m
[32m[I 2024-10-13 12:52:43,001][0m Trial 452 finished with value: 1869.3011488294528 and parameters: {'depth': 8, 'learning_rate': 0.0017984898145847676, 'iterations': 1964, 'l2_leaf_reg': 5.591868268786142e-08, 'border_count': 51, 'bagging_temperature': 0.09600702694640181, 'random_strength': 8.147716648106357, 'grow_policy': 'Lossguide', 'min_data_in_leaf': 122, 'max_leaves': 252}. Best is trial 249 with value: 1695.0689015039372.[0m
[32m[I 2024-10-13 12:52:45,022][0m Trial 453 finished with value: 2283.2119210681153 and parameters: {'depth': 7, 'learning_rate': 0.05230543492074008, 'iterations': 1951, 'l2_leaf_reg': 2.6262338330727918e-08, 'border_count': 57, 'bagging_temperature': 0.000518289762154335, 'random_strength': 8.469379718437516, 'grow_policy': 'Lossguide', 'min_data_in_leaf': 102, 'max_leaves': 245}. Best is trial 249 with value: 1695.0689015039372.[0m
[32m[I 2024-10-13 12:52:47,480][0m Trial 454 finished with value: 2061.3829540555034 and parameters: {'depth': 8, 'learning_rate': 0.0014551184719321635, 'iterations': 1924, 'l2_leaf_reg': 1.693466385815293e-08, 'border_count': 43, 'bagging_temperature': 0.04289119602455591, 'random_strength': 8.099141110697389, 'grow_policy': 'Lossguide', 'min_data_in_leaf': 82, 'max_leaves': 231}. Best is trial 249 with value: 1695.0689015039372.[0m
[32m[I 2024-10-13 12:52:50,425][0m Trial 455 finished with value: 2022.067250769664 and parameters: {'depth': 8, 'learning_rate': 0.0011929847341620628, 'iterations': 2009, 'l2_leaf_reg': 5.8176386147297794e-08, 'border_count': 68, 'bagging_temperature': 0.06497267845325186, 'random_strength': 8.731935428165, 'grow_policy': 'Lossguide', 'min_data_in_leaf': 43, 'max_leaves': 205}. Best is trial 249 with value: 1695.0689015039372.[0m
