[32m[I 2024-10-13 13:09:32,811][0m Trial 710 finished with value: 2360.1816639843933 and parameters: {'depth': 10, 'learning_rate': 0.001194321577726019, 'iterations': 2102, 'l2_leaf_reg': 8.63906195068017e-05, 'border_count': 24, 'bagging_temperature': 0.08646899177031024, 'random_strength': 8.642041241512928, 'grow_policy': 'Depthwise', 'min_data_in_leaf': 1}. Best is trial 568 with value: 1659.4433932934307.[0m
[32m[I 2024-10-13 13:09:34,779][0m Trial 711 finished with value: 2346.5374618528463 and parameters: {'depth': 9, 'learning_rate': 0.0003583706369805094, 'iterations': 1975, 'l2_leaf_reg': 1.3022804955679733e-07, 'border_count': 178, 'bagging_temperature': 0.044743855632017625, 'random_strength': 7.522390171399351, 'grow_policy': 'Depthwise', 'min_data_in_leaf': 192}. Best is trial 568 with value: 1659.4433932934307.[0m
[32m[I 2024-10-13 13:09:38,265][0m Trial 712 finished with value: 2150.195457274663 and parameters: {'depth': 8, 'learning_rate': 0.001749274548958066, 'iterations': 2267, 'l2_leaf_reg': 2.08228084507659e-07, 'border_count': 10, 'bagging_temperature': 5.7847059978240883e-05, 'random_strength': 7.195306718088549, 'grow_policy': 'Depthwise', 'min_data_in_leaf': 44}. Best is trial 568 with value: 1659.4433932934307.[0m
[32m[I 2024-10-13 13:09:40,819][0m Trial 713 finished with value: 1714.4185788481261 and parameters: {'depth': 11, 'learning_rate': 0.0010718471949072517, 'iterations': 2738, 'l2_leaf_reg': 0.03693370377825394, 'border_count': 29, 'bagging_temperature': 0.019739682841840068, 'random_strength': 8.161740063391003, 'grow_policy': 'Depthwise', 'min_data_in_leaf': 116}. Best is trial 568 with value: 1659.4433932934307.[0m
[32m[I 2024-10-13 13:09:43,129][0m Trial 714 finished with value: 1951.1171948219828 and parameters: {'depth': 9, 'learning_rate': 0.001394669625877784, 'iterations': 2377, 'l2_leaf_reg': 1.7220503833342826e-08, 'border_count': 21, 'bagging_temperature': 0.06418293811523548, 'random_strength': 6.163368452683914, 'grow_policy': 'Lossguide', 'min_data_in_leaf': 394, 'max_leaves': 159}. Best is trial 568 with value: 1659.4433932934307.[0m
[32m[I 2024-10-13 13:09:45,286][0m Trial 715 finished with value: 1910.3436202177406 and parameters: {'depth': 10, 'learning_rate': 0.0021579050003556373, 'iterations': 2155, 'l2_leaf_reg': 1.6301673703578134, 'border_count': 44, 'bagging_temperature': 0.033823608379841594, 'random_strength': 6.502995372179605, 'grow_policy': 'Depthwise', 'min_data_in_leaf': 362}. Best is trial 568 with value: 1659.4433932934307.[0m
[32m[I 2024-10-13 13:09:47,529][0m Trial 716 finished with value: 1752.8453034124207 and parameters: {'depth': 9, 'learning_rate': 0.0009309580729047906, 'iterations': 2221, 'l2_leaf_reg': 7.181382499447857e-08, 'border_count': 27, 'bagging_temperature': 0.019514962132465296, 'random_strength': 7.709077656825333, 'grow_policy': 'Depthwise', 'min_data_in_leaf': 142}. Best is trial 568 with value: 1659.4433932934307.[0m
[32m[I 2024-10-13 13:09:49,639][0m Trial 717 finished with value: 1964.247166177048 and parameters: {'depth': 8, 'learning_rate': 0.0016051630484660857, 'iterations': 2082, 'l2_leaf_reg': 1.0594937849417525e-06, 'border_count': 16, 'bagging_temperature': 0.0452180360636357, 'random_strength': 5.798920852897231, 'grow_policy': 'Depthwise', 'min_data_in_leaf': 438}. Best is trial 568 with value: 1659.4433932934307.[0m
[32m[I 2024-10-13 13:09:52,292][0m Trial 718 finished with value: 1739.4845595329386 and parameters: {'depth': 6, 'learning_rate': 0.0012778862515720178, 'iterations': 2809, 'l2_leaf_reg': 1.3846889096399697e-08, 'border_count': 34, 'bagging_temperature': 0.07833063278684176, 'random_strength': 5.06507104236254, 'grow_policy': 'Lossguide', 'min_data_in_leaf': 171, 'max_leaves': 222}. Best is trial 568 with value: 1659.4433932934307.[0m
[32m[I 2024-10-13 13:09:54,572][0m Trial 719 finished with value: 1931.1770445480533 and parameters: {'depth': 7, 'learning_rate': 0.0006341850901500284, 'iterations': 1850, 'l2_leaf_reg': 5.206836264381441e-08, 'border_count': 20, 'bagging_temperature': 0.015499664173937961, 'random_strength': 7.3984909048618, 'grow_policy': 'Depthwise', 'min_data_in_leaf': 66}. Best is trial 568 with value: 1659.4433932934307.[0m
[32m[I 2024-10-13 13:09:56,920][0m Trial 720 finished with value: 1769.2709122982178 and parameters: {'depth': 11, 'learning_rate': 0.0027087283158495562, 'iterations': 2335, 'l2_leaf_reg': 2.776106696386506e-08, 'border_count': 5, 'bagging_temperature': 0.03496246926658079, 'random_strength': 2.0302323715687534, 'grow_policy': 'Depthwise', 'min_data_in_leaf': 96}. Best is trial 568 with value: 1659.4433932934307.[0m
[32m[I 2024-10-13 13:09:59,002][0m Trial 721 finished with value: 1756.5588724132976 and parameters: {'depth': 9, 'learning_rate': 0.0010950663531316752, 'iterations': 2013, 'l2_leaf_reg': 1.5264172304525456e-07, 'border_count': 40, 'bagging_temperature': 0.054089345267691324, 'random_strength': 7.951351720004364, 'grow_policy': 'Depthwise', 'min_data_in_leaf': 330}. Best is trial 568 with value: 1659.4433932934307.[0m
[32m[I 2024-10-13 13:10:03,658][0m Trial 722 finished with value: 2226.1305527412687 and parameters: {'depth': 9, 'learning_rate': 0.0018824239075173597, 'iterations': 2201, 'l2_leaf_reg': 9.036614148303243e-08, 'border_count': 27, 'bagging_temperature': 0.2782712985928381, 'random_strength': 8.420412077189015, 'grow_policy': 'Depthwise', 'min_data_in_leaf': 25}. Best is trial 568 with value: 1659.4433932934307.[0m
[32m[I 2024-10-13 13:10:05,925][0m Trial 723 finished with value: 1732.9457712113733 and parameters: {'depth': 13, 'learning_rate': 0.0015187530867275477, 'iterations': 2310, 'l2_leaf_reg': 0.01144283563826206, 'border_count': 31, 'bagging_temperature': 0.021329779362467157, 'random_strength': 6.85797603644222, 'grow_policy': 'Lossguide', 'min_data_in_leaf': 122, 'max_leaves': 130}. Best is trial 568 with value: 1659.4433932934307.[0m
[32m[I 2024-10-13 13:10:26,854][0m Trial 724 finished with value: 2104.7478498279406 and parameters: {'depth': 9, 'learning_rate': 0.0013292480841264956, 'iterations': 2115, 'l2_leaf_reg': 0.004536015488408791, 'border_count': 16, 'bagging_temperature': 0.10222351006200059, 'random_strength': 5.500913890130921, 'grow_policy': 'SymmetricTree', 'min_data_in_leaf': 145}. Best is trial 568 with value: 1659.4433932934307.[0m
[32m[I 2024-10-13 13:10:28,937][0m Trial 725 finished with value: 1969.3680582038173 and parameters: {'depth': 8, 'learning_rate': 0.0008243937574189282, 'iterations': 2001, 'l2_leaf_reg': 6.137328924497582e-07, 'border_count': 21, 'bagging_temperature': 0.06461779574104759, 'random_strength': 4.115716663920073, 'grow_policy': 'Depthwise', 'min_data_in_leaf': 119}. Best is trial 568 with value: 1659.4433932934307.[0m
[32m[I 2024-10-13 13:10:31,140][0m Trial 726 finished with value: 1753.8306350874118 and parameters: {'depth': 7, 'learning_rate': 0.0009832240338493795, 'iterations': 2059, 'l2_leaf_reg': 2.5804747034251883e-07, 'border_count': 25, 'bagging_temperature': 0.03626769071118793, 'random_strength': 4.869236333916136, 'grow_policy': 'Depthwise', 'min_data_in_leaf': 307}. Best is trial 568 with value: 1659.4433932934307.[0m
[32m[I 2024-10-13 13:10:33,314][0m Trial 727 finished with value: 1731.8465114440148 and parameters: {'depth': 10, 'learning_rate': 0.0011782708251360235, 'iterations': 1919, 'l2_leaf_reg': 4.4407819212086576e-08, 'border_count': 35, 'bagging_temperature': 0.015207216048011618, 'random_strength': 4.399073857638529, 'grow_policy': 'Depthwise', 'min_data_in_leaf': 371}. Best is trial 568 with value: 1659.4433932934307.[0m
[32m[I 2024-10-13 13:10:35,558][0m Trial 728 finished with value: 1948.3005874674875 and parameters: {'depth': 9, 'learning_rate': 0.0017116117742803098, 'iterations': 2251, 'l2_leaf_reg': 1.0722690480966488e-07, 'border_count': 10, 'bagging_temperature': 0.0020619810734565057, 'random_strength': 7.229766197212971, 'grow_policy': 'Lossguide', 'min_data_in_leaf': 180, 'max_leaves': 179}. Best is trial 568 with value: 1659.4433932934307.[0m
[32m[I 2024-10-13 13:10:38,347][0m Trial 729 finished with value: 1897.5184211537496 and parameters: {'depth': 8, 'learning_rate': 0.00222735954199416, 'iterations': 2419, 'l2_leaf_reg': 0.0007132211693261931, 'border_count': 29, 'bagging_temperature': 0.04786010774835488, 'random_strength': 7.071641611723745, 'grow_policy': 'Depthwise', 'min_data_in_leaf': 90}. Best is trial 568 with value: 1659.4433932934307.[0m
[32m[I 2024-10-13 13:10:39,667][0m Trial 730 finished with value: 1750.0916555204305 and parameters: {'depth': 10, 'learning_rate': 0.003308524177567372, 'iterations': 979, 'l2_leaf_reg': 0.06703402729409125, 'border_count': 23, 'bagging_temperature': 0.03148775988704029, 'random_strength': 5.274528933816769, 'grow_policy': 'Depthwise', 'min_data_in_leaf': 158}. Best is trial 568 with value: 1659.4433932934307.[0m
[32m[I 2024-10-13 13:10:41,811][0m Trial 731 finished with value: 1952.9654458358327 and parameters: {'depth': 9, 'learning_rate': 0.001446986106817246, 'iterations': 2136, 'l2_leaf_reg': 3.846727903611434e-07, 'border_count': 14, 'bagging_temperature': 0.07093942038510152, 'random_strength': 5.68796084196098, 'grow_policy': 'Depthwise', 'min_data_in_leaf': 207}. Best is trial 568 with value: 1659.4433932934307.[0m
[32m[I 2024-10-13 13:10:43,853][0m Trial 732 finished with value: 1722.3404955470505 and parameters: {'depth': 9, 'learning_rate': 0.001208265525646682, 'iterations': 1978, 'l2_leaf_reg': 1.0139759347958065e-08, 'border_count': 39, 'bagging_temperature': 0.016197329727552924, 'random_strength': 7.714899282724577, 'grow_policy': 'Lossguide', 'min_data_in_leaf': 128, 'max_leaves': 208}. Best is trial 568 with value: 1659.4433932934307.[0m
[32m[I 2024-10-13 13:10:46,964][0m Trial 733 finished with value: 2312.4717204896197 and parameters: {'depth': 9, 'learning_rate': 0.007522093597253864, 'iterations': 2166, 'l2_leaf_reg': 6.852415631462684e-08, 'border_count': 19, 'bagging_temperature': 0.0015459650406748175, 'random_strength': 8.246917145404318, 'grow_policy': 'Depthwise', 'min_data_in_leaf': 56}. Best is trial 568 with value: 1659.4433932934307.[0m
[32m[I 2024-10-13 13:10:48,392][0m Trial 734 finished with value: 1759.2804962693294 and parameters: {'depth': 12, 'learning_rate': 0.0019651941334647466, 'iterations': 1121, 'l2_leaf_reg': 3.2775002317596256e-08, 'border_count': 85, 'bagging_temperature': 0.000749801420073453, 'random_strength': 7.4736387516542235, 'grow_policy': 'Depthwise', 'min_data_in_leaf': 346}. Best is trial 568 with value: 1659.4433932934307.[0m
[32m[I 2024-10-13 13:10:51,104][0m Trial 735 finished with value: 2023.6152343742424 and parameters: {'depth': 8, 'learning_rate': 0.0010042003773719785, 'iterations': 2861, 'l2_leaf_reg': 1.696573853710432e-07, 'border_count': 111, 'bagging_temperature': 0.05234024461609033, 'random_strength': 6.5983048145445915, 'grow_policy': 'Depthwise', 'min_data_in_leaf': 108}. Best is trial 568 with value: 1659.4433932934307.[0m
[32m[I 2024-10-13 13:10:53,404][0m Trial 736 finished with value: 1738.589589730189 and parameters: {'depth': 11, 'learning_rate': 0.001589246973687269, 'iterations': 2280, 'l2_leaf_reg': 9.746150538894589e-08, 'border_count': 32, 'bagging_temperature': 0.033808693255228575, 'random_strength': 7.9847499138407025, 'grow_policy': 'Depthwise', 'min_data_in_leaf': 145}. Best is trial 568 with value: 1659.4433932934307.[0m
[32m[I 2024-10-13 13:10:56,056][0m Trial 737 finished with value: 1732.0655450390025 and parameters: {'depth': 8, 'learning_rate': 0.0007479858606243218, 'iterations': 2941, 'l2_leaf_reg': 5.87481621069632e-08, 'border_count': 25, 'bagging_temperature': 0.08690639108654932, 'random_strength': 5.952271254180088, 'grow_policy': 'Lossguide', 'min_data_in_leaf': 164, 'max_leaves': 230}. Best is trial 568 with value: 1659.4433932934307.[0m
[32m[I 2024-10-13 13:10:58,555][0m Trial 738 finished with value: 1946.0276552553232 and parameters: {'depth': 10, 'learning_rate': 0.0012862209052662756, 'iterations': 2534, 'l2_leaf_reg': 0.015196459912220893, 'border_count': 19, 'bagging_temperature': 0.03369862110110747, 'random_strength': 6.36093600762852, 'grow_policy': 'Depthwise', 'min_data_in_leaf': 312}. Best is trial 568 with value: 1659.4433932934307.[0m
[32m[I 2024-10-13 13:11:02,311][0m Trial 739 finished with value: 1896.8303375336632 and parameters: {'depth': 9, 'learning_rate': 0.0010896010863727672, 'iterations': 2059, 'l2_leaf_reg': 2.4587118691924317e-07, 'border_count': 29, 'bagging_temperature': 0.0592670226122462, 'random_strength': 0.8845718981862758, 'grow_policy': 'Depthwise', 'min_data_in_leaf': 30}. Best is trial 568 with value: 1659.4433932934307.[0m
[32m[I 2024-10-13 13:11:04,299][0m Trial 740 finished with value: 1714.5058606139942 and parameters: {'depth': 9, 'learning_rate': 0.0013802095339457184, 'iterations': 1867, 'l2_leaf_reg': 4.3047154068244607e-07, 'border_count': 34, 'bagging_temperature': 0.00013843265134039218, 'random_strength': 5.1645317990109945, 'grow_policy': 'Depthwise', 'min_data_in_leaf': 390}. Best is trial 568 with value: 1659.4433932934307.[0m
[32m[I 2024-10-13 13:11:06,669][0m Trial 741 finished with value: 1902.059971008758 and parameters: {'depth': 15, 'learning_rate': 0.0024230340179458997, 'iterations': 2367, 'l2_leaf_reg': 1.9645939913980466e-08, 'border_count': 24, 'bagging_temperature': 0.9654213856137224, 'random_strength': 7.8343866080364055, 'grow_policy': 'Lossguide', 'min_data_in_leaf': 101, 'max_leaves': 240}. Best is trial 568 with value: 1659.4433932934307.[0m
[32m[I 2024-10-13 13:11:08,891][0m Trial 742 finished with value: 1725.7178357585044 and parameters: {'depth': 7, 'learning_rate': 0.0017540047254537734, 'iterations': 2206, 'l2_leaf_reg': 1.3480218269090878e-07, 'border_count': 6, 'bagging_temperature': 0.020373162603336707, 'random_strength': 6.934219046152311, 'grow_policy': 'Depthwise', 'min_data_in_leaf': 245}. Best is trial 568 with value: 1659.4433932934307.[0m
[32m[I 2024-10-13 13:11:11,234][0m Trial 743 finished with value: 1948.2798355691268 and parameters: {'depth': 4, 'learning_rate': 0.0009108630832718865, 'iterations': 2118, 'l2_leaf_reg': 3.891515320848916e-08, 'border_count': 14, 'bagging_temperature': 0.04729599916022338, 'random_strength': 5.418558101281813, 'grow_policy': 'Depthwise', 'min_data_in_leaf': 136}. Best is trial 568 with value: 1659.4433932934307.[0m
[32m[I 2024-10-13 13:11:12,798][0m Trial 744 finished with value: 1758.7844246511347 and parameters: {'depth': 9, 'learning_rate': 0.0014738259973048316, 'iterations': 1413, 'l2_leaf_reg': 0.33972206372788677, 'border_count': 27, 'bagging_temperature': 0.0726849183720501, 'random_strength': 7.52345921572677, 'grow_policy': 'Depthwise', 'min_data_in_leaf': 290}. Best is trial 568 with value: 1659.4433932934307.[0m
[32m[I 2024-10-13 13:11:14,760][0m Trial 745 finished with value: 1728.5268574979136 and parameters: {'depth': 6, 'learning_rate': 0.0011866197102840933, 'iterations': 1939, 'l2_leaf_reg': 2.8064347389808987e-08, 'border_count': 38, 'bagging_temperature': 0.02918781295893788, 'random_strength': 7.137205890854046, 'grow_policy': 'Lossguide', 'min_data_in_leaf': 424, 'max_leaves': 172}. Best is trial 568 with value: 1659.4433932934307.[0m
[32m[I 2024-10-13 13:11:17,305][0m Trial 746 finished with value: 2060.1975807035606 and parameters: {'depth': 11, 'learning_rate': 0.0020440289401171424, 'iterations': 2677, 'l2_leaf_reg': 7.440425222143103e-06, 'border_count': 20, 'bagging_temperature': 0.10316845543666836, 'random_strength': 7.313756453477303, 'grow_policy': 'Depthwise', 'min_data_in_leaf': 187}. Best is trial 568 with value: 1659.4433932934307.[0m
[32m[I 2024-10-13 13:11:50,814][0m Trial 747 finished with value: 2028.7250964886134 and parameters: {'depth': 9, 'learning_rate': 0.0016401157780319814, 'iterations': 2247, 'l2_leaf_reg': 6.702762197033914e-08, 'border_count': 163, 'bagging_temperature': 0.016215886118820116, 'random_strength': 5.659622107241016, 'grow_policy': 'SymmetricTree', 'min_data_in_leaf': 83}. Best is trial 568 with value: 1659.4433932934307.[0m
[32m[I 2024-10-13 13:11:52,858][0m Trial 748 finished with value: 1765.538878553134 and parameters: {'depth': 10, 'learning_rate': 0.0010196248884522473, 'iterations': 2027, 'l2_leaf_reg': 6.707648919740864e-07, 'border_count': 31, 'bagging_temperature': 0.31012623305832354, 'random_strength': 4.6864483309700775, 'grow_policy': 'Depthwise', 'min_data_in_leaf': 764}. Best is trial 568 with value: 1659.4433932934307.[0m
[32m[I 2024-10-13 13:11:55,451][0m Trial 749 finished with value: 1762.0399332712207 and parameters: {'depth': 8, 'learning_rate': 0.0012632989490091921, 'iterations': 2781, 'l2_leaf_reg': 1.6701780084352068e-07, 'border_count': 24, 'bagging_temperature': 0.05622449343438397, 'random_strength': 6.7011345874112305, 'grow_policy': 'Depthwise', 'min_data_in_leaf': 477}. Best is trial 568 with value: 1659.4433932934307.[0m
[32m[I 2024-10-13 13:11:57,689][0m Trial 750 finished with value: 1968.4037597444838 and parameters: {'depth': 9, 'learning_rate': 0.001469291640608938, 'iterations': 2306, 'l2_leaf_reg': 3.07600232863566e-07, 'border_count': 16, 'bagging_temperature': 0.039504659875346806, 'random_strength': 8.100127339866408, 'grow_policy': 'Depthwise', 'min_data_in_leaf': 117}. Best is trial 568 with value: 1659.4433932934307.[0m
[32m[I 2024-10-13 13:11:59,781][0m Trial 751 finished with value: 1819.9337446433226 and parameters: {'depth': 9, 'learning_rate': 0.0008503941195810872, 'iterations': 2061, 'l2_leaf_reg': 1.0510245255553694e-07, 'border_count': 43, 'bagging_temperature': 0.0180672528881232, 'random_strength': 7.614550743331291, 'grow_policy': 'Lossguide', 'min_data_in_leaf': 154, 'max_leaves': 217}. Best is trial 568 with value: 1659.4433932934307.[0m
[32m[I 2024-10-13 13:12:01,017][0m Trial 752 finished with value: 1760.0339724782857 and parameters: {'depth': 10, 'learning_rate': 0.0026229193397828737, 'iterations': 879, 'l2_leaf_reg': 3.987680949020477e-08, 'border_count': 53, 'bagging_temperature': 0.00018337536292565085, 'random_strength': 7.270087454865066, 'grow_policy': 'Depthwise', 'min_data_in_leaf': 366}. Best is trial 568 with value: 1659.4433932934307.[0m
[32m[I 2024-10-13 13:12:03,100][0m Trial 753 finished with value: 1797.926262301041 and parameters: {'depth': 11, 'learning_rate': 0.006309473729574671, 'iterations': 2140, 'l2_leaf_reg': 2.3318629302322106e-08, 'border_count': 34, 'bagging_temperature': 0.07808291792059353, 'random_strength': 5.368214041613932, 'grow_policy': 'Depthwise', 'min_data_in_leaf': 334}. Best is trial 568 with value: 1659.4433932934307.[0m
[32m[I 2024-10-13 13:12:06,219][0m Trial 754 finished with value: 2067.2715929005385 and parameters: {'depth': 8, 'learning_rate': 0.0018883148618636031, 'iterations': 2180, 'l2_leaf_reg': 6.33110349983558e-08, 'border_count': 28, 'bagging_temperature': 0.043167809786482346, 'random_strength': 6.027350759001137, 'grow_policy': 'Depthwise', 'min_data_in_leaf': 65}. Best is trial 568 with value: 1659.4433932934307.[0m
[32m[I 2024-10-13 13:12:08,194][0m Trial 755 finished with value: 1893.9050779340953 and parameters: {'depth': 7, 'learning_rate': 0.0011291793653110088, 'iterations': 1981, 'l2_leaf_reg': 9.468916169478238e-08, 'border_count': 10, 'bagging_temperature': 0.02986158805258292, 'random_strength': 8.363355639945622, 'grow_policy': 'Lossguide', 'min_data_in_leaf': 130, 'max_leaves': 116}. Best is trial 568 with value: 1659.4433932934307.[0m
[32m[I 2024-10-13 13:12:14,060][0m Trial 756 finished with value: 1728.1270194278598 and parameters: {'depth': 9, 'learning_rate': 0.0014351249266835765, 'iterations': 1519, 'l2_leaf_reg': 1.6277063780252285e-07, 'border_count': 22, 'bagging_temperature': 0.05901690647689649, 'random_strength': 7.871416107675463, 'grow_policy': 'Depthwise', 'min_data_in_leaf': 2}. Best is trial 568 with value: 1659.4433932934307.[0m
[32m[I 2024-10-13 13:12:16,071][0m Trial 757 finished with value: 2046.5386125945884 and parameters: {'depth': 9, 'learning_rate': 0.0006312330213877569, 'iterations': 1884, 'l2_leaf_reg': 4.755611874271499e-08, 'border_count': 17, 'bagging_temperature': 1.0249586950839267e-05, 'random_strength': 5.092441139766495, 'grow_policy': 'Depthwise', 'min_data_in_leaf': 96}. Best is trial 568 with value: 1659.4433932934307.[0m
[32m[I 2024-10-13 13:12:17,660][0m Trial 758 finished with value: 1838.1451035603175 and parameters: {'depth': 12, 'learning_rate': 0.0012524608206891561, 'iterations': 1300, 'l2_leaf_reg': 2.3582796874929244e-07, 'border_count': 31, 'bagging_temperature': 0.020579339482258544, 'random_strength': 8.794337755990037, 'grow_policy': 'Depthwise', 'min_data_in_leaf': 265}. Best is trial 568 with value: 1659.4433932934307.[0m
[32m[I 2024-10-13 13:12:19,119][0m Trial 759 finished with value: 1782.7953939758847 and parameters: {'depth': 8, 'learning_rate': 0.0017552183228014965, 'iterations': 1189, 'l2_leaf_reg': 1.0847863609832588e-06, 'border_count': 24, 'bagging_temperature': 0.04443278554407952, 'random_strength': 6.291885177775211, 'grow_policy': 'Depthwise', 'min_data_in_leaf': 133}. Best is trial 568 with value: 1659.4433932934307.[0m
[32m[I 2024-10-13 13:12:21,425][0m Trial 760 finished with value: 2292.9339177215847 and parameters: {'depth': 10, 'learning_rate': 0.0003043551637794358, 'iterations': 2453, 'l2_leaf_reg': 4.496214081520665e-07, 'border_count': 35, 'bagging_temperature': 3.2397005948398006e-05, 'random_strength': 6.829858899009198, 'grow_policy': 'Lossguide', 'min_data_in_leaf': 172, 'max_leaves': 107}. Best is trial 568 with value: 1659.4433932934307.[0m
