[32m[I 2024-10-13 13:06:31,506][0m Trial 659 finished with value: 1899.706368697414 and parameters: {'depth': 15, 'learning_rate': 0.0008825285121229542, 'iterations': 2396, 'l2_leaf_reg': 4.065155393308278e-08, 'border_count': 12, 'bagging_temperature': 0.057850622984729455, 'random_strength': 7.763354164352033, 'grow_policy': 'Lossguide', 'min_data_in_leaf': 329, 'max_leaves': 157}. Best is trial 568 with value: 1659.4433932934307.[0m
[32m[I 2024-10-13 13:06:40,805][0m Trial 660 finished with value: 2231.765401151016 and parameters: {'depth': 9, 'learning_rate': 0.0016256512922004154, 'iterations': 2194, 'l2_leaf_reg': 1.2250298284435544e-06, 'border_count': 19, 'bagging_temperature': 3.2273733401307764e-05, 'random_strength': 8.031679226724322, 'grow_policy': 'Depthwise', 'min_data_in_leaf': 1}. Best is trial 568 with value: 1659.4433932934307.[0m
[32m[I 2024-10-13 13:06:43,250][0m Trial 661 finished with value: 1749.0736346119809 and parameters: {'depth': 6, 'learning_rate': 0.0011937877636089011, 'iterations': 2055, 'l2_leaf_reg': 2.3431296937470115e-07, 'border_count': 28, 'bagging_temperature': 0.03041287683551739, 'random_strength': 5.127919888730735, 'grow_policy': 'Depthwise', 'min_data_in_leaf': 80}. Best is trial 568 with value: 1659.4433932934307.[0m
[32m[I 2024-10-13 13:06:46,047][0m Trial 662 finished with value: 1841.6281746554941 and parameters: {'depth': 8, 'learning_rate': 0.0007331896314845953, 'iterations': 1985, 'l2_leaf_reg': 2.6275183737625816, 'border_count': 34, 'bagging_temperature': 0.019260390197583264, 'random_strength': 5.84636024751347, 'grow_policy': 'Depthwise', 'min_data_in_leaf': 44}. Best is trial 568 with value: 1659.4433932934307.[0m
[32m[I 2024-10-13 13:06:48,306][0m Trial 663 finished with value: 2047.0194901169402 and parameters: {'depth': 9, 'learning_rate': 0.0021203874370434948, 'iterations': 2288, 'l2_leaf_reg': 3.008988024237504e-08, 'border_count': 16, 'bagging_temperature': 0.1761722470958456, 'random_strength': 7.197449336297402, 'grow_policy': 'Depthwise', 'min_data_in_leaf': 551}. Best is trial 568 with value: 1659.4433932934307.[0m
[32m[I 2024-10-13 13:06:50,432][0m Trial 664 finished with value: 1796.7529028627055 and parameters: {'depth': 11, 'learning_rate': 0.0009501691523951645, 'iterations': 2144, 'l2_leaf_reg': 7.322318870220708e-08, 'border_count': 24, 'bagging_temperature': 0.20946214901172, 'random_strength': 7.419319219059677, 'grow_policy': 'Lossguide', 'min_data_in_leaf': 389, 'max_leaves': 151}. Best is trial 568 with value: 1659.4433932934307.[0m
[32m[I 2024-10-13 13:06:53,144][0m Trial 665 finished with value: 1746.9375488346589 and parameters: {'depth': 12, 'learning_rate': 0.0013939911032420503, 'iterations': 2726, 'l2_leaf_reg': 1.5491311561929384e-07, 'border_count': 38, 'bagging_temperature': 0.04490946284487649, 'random_strength': 5.37261903936567, 'grow_policy': 'Depthwise', 'min_data_in_leaf': 107}. Best is trial 568 with value: 1659.4433932934307.[0m
[32m[I 2024-10-13 13:06:55,350][0m Trial 666 finished with value: 1760.5819946674694 and parameters: {'depth': 9, 'learning_rate': 0.0018461113517320702, 'iterations': 2213, 'l2_leaf_reg': 4.9416792019032954e-08, 'border_count': 30, 'bagging_temperature': 0.08090159607297245, 'random_strength': 5.564633540527209, 'grow_policy': 'Depthwise', 'min_data_in_leaf': 181}. Best is trial 568 with value: 1659.4433932934307.[0m
[32m[I 2024-10-13 13:06:58,115][0m Trial 667 finished with value: 2033.9420469617376 and parameters: {'depth': 8, 'learning_rate': 0.0015642493620496936, 'iterations': 2939, 'l2_leaf_reg': 1.5038225149761785e-08, 'border_count': 22, 'bagging_temperature': 0.019029512432288655, 'random_strength': 6.594541318482078, 'grow_policy': 'Depthwise', 'min_data_in_leaf': 278}. Best is trial 568 with value: 1659.4433932934307.[0m
[32m[I 2024-10-13 13:07:00,498][0m Trial 668 finished with value: 2546.376394169805 and parameters: {'depth': 9, 'learning_rate': 0.2939077809025621, 'iterations': 2330, 'l2_leaf_reg': 4.651913040969293e-07, 'border_count': 102, 'bagging_temperature': 0.05749188582119632, 'random_strength': 7.644659938084946, 'grow_policy': 'Lossguide', 'min_data_in_leaf': 135, 'max_leaves': 194}. Best is trial 568 with value: 1659.4433932934307.[0m
[32m[I 2024-10-13 13:07:02,478][0m Trial 669 finished with value: 1935.3697988842355 and parameters: {'depth': 4, 'learning_rate': 0.0010867025316624495, 'iterations': 1954, 'l2_leaf_reg': 9.148172300804876e-08, 'border_count': 14, 'bagging_temperature': 0.03737273378456311, 'random_strength': 7.910809844418392, 'grow_policy': 'Depthwise', 'min_data_in_leaf': 153}. Best is trial 568 with value: 1659.4433932934307.[0m
[32m[I 2024-10-13 13:07:03,691][0m Trial 670 finished with value: 1732.6748514985964 and parameters: {'depth': 7, 'learning_rate': 0.0026794704389489685, 'iterations': 842, 'l2_leaf_reg': 0.023647183526586395, 'border_count': 26, 'bagging_temperature': 0.017454611590610437, 'random_strength': 6.968786306258567, 'grow_policy': 'Depthwise', 'min_data_in_leaf': 235}. Best is trial 568 with value: 1659.4433932934307.[0m
[32m[I 2024-10-13 13:07:05,724][0m Trial 671 finished with value: 1716.147125496632 and parameters: {'depth': 10, 'learning_rate': 0.0012934581483814783, 'iterations': 2029, 'l2_leaf_reg': 0.0016178012722825798, 'border_count': 31, 'bagging_temperature': 0.075877184572019, 'random_strength': 6.005899902253031, 'grow_policy': 'Depthwise', 'min_data_in_leaf': 710}. Best is trial 568 with value: 1659.4433932934307.[0m
[32m[I 2024-10-13 13:07:08,077][0m Trial 672 finished with value: 2686.006331250946 and parameters: {'depth': 14, 'learning_rate': 0.00014702483896667098, 'iterations': 2446, 'l2_leaf_reg': 2.9403597147405184e-07, 'border_count': 45, 'bagging_temperature': 0.00046264409370287696, 'random_strength': 4.899976445145826, 'grow_policy': 'Lossguide', 'min_data_in_leaf': 351, 'max_leaves': 203}. Best is trial 568 with value: 1659.4433932934307.[0m
[32m[I 2024-10-13 13:07:10,256][0m Trial 673 finished with value: 1951.7965757412044 and parameters: {'depth': 8, 'learning_rate': 0.001730869856507683, 'iterations': 2102, 'l2_leaf_reg': 3.451979503756694e-08, 'border_count': 19, 'bagging_temperature': 0.8122408282035972, 'random_strength': 8.215820526257845, 'grow_policy': 'Depthwise', 'min_data_in_leaf': 643}. Best is trial 568 with value: 1659.4433932934307.[0m
[32m[I 2024-10-13 13:07:13,076][0m Trial 674 finished with value: 1734.6484229176529 and parameters: {'depth': 9, 'learning_rate': 0.000963472427520159, 'iterations': 2823, 'l2_leaf_reg': 1.8687224135641871e-07, 'border_count': 37, 'bagging_temperature': 0.03703084275700988, 'random_strength': 7.296555256621093, 'grow_policy': 'Depthwise', 'min_data_in_leaf': 102}. Best is trial 568 with value: 1659.4433932934307.[0m
[32m[I 2024-10-13 13:07:15,340][0m Trial 675 finished with value: 2457.6833077482493 and parameters: {'depth': 11, 'learning_rate': 0.0002519766633802547, 'iterations': 2267, 'l2_leaf_reg': 5.772818001660219e-08, 'border_count': 26, 'bagging_temperature': 0.06054369547864794, 'random_strength': 6.317260284131333, 'grow_policy': 'Depthwise', 'min_data_in_leaf': 371}. Best is trial 568 with value: 1659.4433932934307.[0m
[32m[I 2024-10-13 13:07:17,523][0m Trial 676 finished with value: 1938.6063770722592 and parameters: {'depth': 9, 'learning_rate': 0.0014278811403898011, 'iterations': 2150, 'l2_leaf_reg': 1.0598906296767544e-07, 'border_count': 21, 'bagging_temperature': 0.017680329489265165, 'random_strength': 5.1446643974532025, 'grow_policy': 'Depthwise', 'min_data_in_leaf': 127}. Best is trial 568 with value: 1659.4433932934307.[0m
[32m[I 2024-10-13 13:07:19,473][0m Trial 677 finished with value: 1891.5365710204164 and parameters: {'depth': 10, 'learning_rate': 0.0011603212511290396, 'iterations': 1987, 'l2_leaf_reg': 2.1248470230137317e-08, 'border_count': 11, 'bagging_temperature': 0.04359649053147292, 'random_strength': 7.4653713863274955, 'grow_policy': 'Lossguide', 'min_data_in_leaf': 301, 'max_leaves': 133}. Best is trial 568 with value: 1659.4433932934307.[0m
[32m[I 2024-10-13 13:07:22,405][0m Trial 678 finished with value: 2039.5742074367852 and parameters: {'depth': 9, 'learning_rate': 0.0023085237667940877, 'iterations': 2371, 'l2_leaf_reg': 1.2218465055904188e-07, 'border_count': 33, 'bagging_temperature': 0.019906795477618783, 'random_strength': 7.125816146180629, 'grow_policy': 'Depthwise', 'min_data_in_leaf': 78}. Best is trial 568 with value: 1659.4433932934307.[0m
[32m[I 2024-10-13 13:07:40,912][0m Trial 679 finished with value: 2190.4752083230014 and parameters: {'depth': 8, 'learning_rate': 0.0005510083199529776, 'iterations': 2067, 'l2_leaf_reg': 3.054390317258136e-07, 'border_count': 27, 'bagging_temperature': 0.05132621550598125, 'random_strength': 8.498704934798626, 'grow_policy': 'SymmetricTree', 'min_data_in_leaf': 170}. Best is trial 568 with value: 1659.4433932934307.[0m
[32m[I 2024-10-13 13:07:44,243][0m Trial 680 finished with value: 1978.6310535341343 and parameters: {'depth': 6, 'learning_rate': 0.0004599239159378222, 'iterations': 2181, 'l2_leaf_reg': 6.392277557213898e-07, 'border_count': 16, 'bagging_temperature': 0.03558153805623713, 'random_strength': 7.796620805968248, 'grow_policy': 'Depthwise', 'min_data_in_leaf': 29}. Best is trial 568 with value: 1659.4433932934307.[0m
[32m[I 2024-10-13 13:07:47,029][0m Trial 681 finished with value: 1942.759312680217 and parameters: {'depth': 7, 'learning_rate': 0.0008646916768603594, 'iterations': 2996, 'l2_leaf_reg': 6.8171177044818e-08, 'border_count': 22, 'bagging_temperature': 0.08877892129988647, 'random_strength': 5.707228113511441, 'grow_policy': 'Depthwise', 'min_data_in_leaf': 144}. Best is trial 568 with value: 1659.4433932934307.[0m
[32m[I 2024-10-13 13:07:49,296][0m Trial 682 finished with value: 1759.6819073966076 and parameters: {'depth': 8, 'learning_rate': 0.0018674654247581724, 'iterations': 2234, 'l2_leaf_reg': 3.8320900969820694e-08, 'border_count': 31, 'bagging_temperature': 0.0009169611146067347, 'random_strength': 5.368252917816313, 'grow_policy': 'Lossguide', 'min_data_in_leaf': 327, 'max_leaves': 139}. Best is trial 568 with value: 1659.4433932934307.[0m
[32m[I 2024-10-13 13:07:51,456][0m Trial 683 finished with value: 1732.1785431071066 and parameters: {'depth': 10, 'learning_rate': 0.0012921311110296828, 'iterations': 1934, 'l2_leaf_reg': 2.0900641107409936e-07, 'border_count': 38, 'bagging_temperature': 0.018783958047741366, 'random_strength': 6.732373305537415, 'grow_policy': 'Depthwise', 'min_data_in_leaf': 95}. Best is trial 568 with value: 1659.4433932934307.[0m
[32m[I 2024-10-13 13:07:53,725][0m Trial 684 finished with value: 1825.810088957702 and parameters: {'depth': 11, 'learning_rate': 0.01285965631221601, 'iterations': 2304, 'l2_leaf_reg': 2.5474120768202333e-08, 'border_count': 25, 'bagging_temperature': 0.031748014281144606, 'random_strength': 8.11985143518019, 'grow_policy': 'Depthwise', 'min_data_in_leaf': 198}. Best is trial 568 with value: 1659.4433932934307.[0m
[32m[I 2024-10-13 13:07:55,085][0m Trial 685 finished with value: 1971.863290698902 and parameters: {'depth': 9, 'learning_rate': 0.0015254099248300016, 'iterations': 1078, 'l2_leaf_reg': 7.798469189849343e-08, 'border_count': 18, 'bagging_temperature': 0.06693174446106627, 'random_strength': 8.968634341624073, 'grow_policy': 'Depthwise', 'min_data_in_leaf': 128}. Best is trial 568 with value: 1659.4433932934307.[0m
[32m[I 2024-10-13 13:07:57,258][0m Trial 686 finished with value: 1772.377338180787 and parameters: {'depth': 8, 'learning_rate': 0.0010546679377655911, 'iterations': 2020, 'l2_leaf_reg': 1.472505241216261e-07, 'border_count': 8, 'bagging_temperature': 0.04836844983752496, 'random_strength': 7.626977550354702, 'grow_policy': 'Depthwise', 'min_data_in_leaf': 156}. Best is trial 568 with value: 1659.4433932934307.[0m
[32m[I 2024-10-13 13:08:00,533][0m Trial 687 finished with value: 2240.868211596177 and parameters: {'depth': 12, 'learning_rate': 0.0029905642335959215, 'iterations': 2095, 'l2_leaf_reg': 4.70271926719534e-07, 'border_count': 31, 'bagging_temperature': 0.016255609946361167, 'random_strength': 4.660984499939723, 'grow_policy': 'Lossguide', 'min_data_in_leaf': 50, 'max_leaves': 184}. Best is trial 568 with value: 1659.4433932934307.[0m
[32m[I 2024-10-13 13:08:02,712][0m Trial 688 finished with value: 2017.033790229037 and parameters: {'depth': 9, 'learning_rate': 0.0006890831090070823, 'iterations': 2143, 'l2_leaf_reg': 4.934001566539692e-08, 'border_count': 22, 'bagging_temperature': 0.03254709033111382, 'random_strength': 5.572936649652477, 'grow_policy': 'Depthwise', 'min_data_in_leaf': 119}. Best is trial 568 with value: 1659.4433932934307.[0m
[32m[I 2024-10-13 13:08:04,988][0m Trial 689 finished with value: 1715.7086504266128 and parameters: {'depth': 3, 'learning_rate': 0.0012797329239402615, 'iterations': 2211, 'l2_leaf_reg': 1.9018816258112707e-06, 'border_count': 27, 'bagging_temperature': 0.06590914132154141, 'random_strength': 6.395308437186708, 'grow_policy': 'Depthwise', 'min_data_in_leaf': 380}. Best is trial 568 with value: 1659.4433932934307.[0m
[32m[I 2024-10-13 13:08:06,215][0m Trial 690 finished with value: 1985.5148635752603 and parameters: {'depth': 9, 'learning_rate': 0.001695117216755971, 'iterations': 940, 'l2_leaf_reg': 1.1281507544408733e-07, 'border_count': 16, 'bagging_temperature': 0.6465358064076145, 'random_strength': 6.979010306273772, 'grow_policy': 'Depthwise', 'min_data_in_leaf': 349}. Best is trial 568 with value: 1659.4433932934307.[0m
[32m[I 2024-10-13 13:08:07,796][0m Trial 691 finished with value: 1959.761447844811 and parameters: {'depth': 10, 'learning_rate': 0.0011109720495394576, 'iterations': 1238, 'l2_leaf_reg': 1.7686406746820672e-08, 'border_count': 147, 'bagging_temperature': 0.0012647911279953516, 'random_strength': 6.130142190879243, 'grow_policy': 'Lossguide', 'min_data_in_leaf': 97, 'max_leaves': 198}. Best is trial 568 with value: 1659.4433932934307.[0m
[32m[I 2024-10-13 13:08:10,445][0m Trial 692 finished with value: 2438.7643331311324 and parameters: {'depth': 9, 'learning_rate': 0.0037067375082546626, 'iterations': 2664, 'l2_leaf_reg': 2.3076958010437424e-07, 'border_count': 131, 'bagging_temperature': 9.774488422791537e-05, 'random_strength': 7.281455279975868, 'grow_policy': 'Depthwise', 'min_data_in_leaf': 962}. Best is trial 568 with value: 1659.4433932934307.[0m
[32m[I 2024-10-13 13:08:12,483][0m Trial 693 finished with value: 1756.085390890735 and parameters: {'depth': 8, 'learning_rate': 0.0014282283533926543, 'iterations': 1888, 'l2_leaf_reg': 8.810588080763011e-07, 'border_count': 35, 'bagging_temperature': 0.8379777219999488, 'random_strength': 7.535006415182795, 'grow_policy': 'Depthwise', 'min_data_in_leaf': 179}. Best is trial 568 with value: 1659.4433932934307.[0m
[32m[I 2024-10-13 13:08:14,770][0m Trial 694 finished with value: 1783.8451788513673 and parameters: {'depth': 9, 'learning_rate': 0.0020916720597801072, 'iterations': 2356, 'l2_leaf_reg': 1.1358803218394359e-05, 'border_count': 41, 'bagging_temperature': 0.04993690080662253, 'random_strength': 5.837752974265203, 'grow_policy': 'Depthwise', 'min_data_in_leaf': 141}. Best is trial 568 with value: 1659.4433932934307.[0m
[32m[I 2024-10-13 13:08:20,655][0m Trial 695 finished with value: 2085.4304323720794 and parameters: {'depth': 10, 'learning_rate': 0.000832819838634392, 'iterations': 2507, 'l2_leaf_reg': 0.00018734100383453148, 'border_count': 22, 'bagging_temperature': 0.03178928137043454, 'random_strength': 5.20642305721843, 'grow_policy': 'Lossguide', 'min_data_in_leaf': 18, 'max_leaves': 213}. Best is trial 568 with value: 1659.4433932934307.[0m
[32m[I 2024-10-13 13:08:22,715][0m Trial 696 finished with value: 1762.4916437105728 and parameters: {'depth': 9, 'learning_rate': 0.000980598522422422, 'iterations': 2035, 'l2_leaf_reg': 3.479358199606156e-08, 'border_count': 29, 'bagging_temperature': 0.017637101076281133, 'random_strength': 7.900212189917411, 'grow_policy': 'Depthwise', 'min_data_in_leaf': 120}. Best is trial 568 with value: 1659.4433932934307.[0m
[32m[I 2024-10-13 13:08:26,156][0m Trial 697 finished with value: 2129.09592100239 and parameters: {'depth': 11, 'learning_rate': 0.0012020122956322165, 'iterations': 2892, 'l2_leaf_reg': 0.14584827124356564, 'border_count': 14, 'bagging_temperature': 0.08766370205260504, 'random_strength': 8.339990478636288, 'grow_policy': 'Depthwise', 'min_data_in_leaf': 73}. Best is trial 568 with value: 1659.4433932934307.[0m
[32m[I 2024-10-13 13:08:28,484][0m Trial 698 finished with value: 2125.213738096925 and parameters: {'depth': 9, 'learning_rate': 0.001609283028638812, 'iterations': 2243, 'l2_leaf_reg': 6.084987613748698e-08, 'border_count': 241, 'bagging_temperature': 0.05396622455190114, 'random_strength': 6.624504480300472, 'grow_policy': 'Depthwise', 'min_data_in_leaf': 295}. Best is trial 568 with value: 1659.4433932934307.[0m
[32m[I 2024-10-13 13:08:30,476][0m Trial 699 finished with value: 1747.8916208329376 and parameters: {'depth': 7, 'learning_rate': 0.0019528724415491946, 'iterations': 1960, 'l2_leaf_reg': 3.2290085152495113e-07, 'border_count': 33, 'bagging_temperature': 0.03130296753108881, 'random_strength': 5.460111448462886, 'grow_policy': 'Depthwise', 'min_data_in_leaf': 221}. Best is trial 568 with value: 1659.4433932934307.[0m
[32m[I 2024-10-13 13:08:31,781][0m Trial 700 finished with value: 1905.6863457166085 and parameters: {'depth': 5, 'learning_rate': 0.0013789357529784946, 'iterations': 1040, 'l2_leaf_reg': 1.3299713969240611e-07, 'border_count': 26, 'bagging_temperature': 0.07411349296487918, 'random_strength': 4.990130653665876, 'grow_policy': 'Lossguide', 'min_data_in_leaf': 409, 'max_leaves': 189}. Best is trial 568 with value: 1659.4433932934307.[0m
[32m[I 2024-10-13 13:08:33,964][0m Trial 701 finished with value: 2033.4307205097944 and parameters: {'depth': 14, 'learning_rate': 0.0023570483872066214, 'iterations': 2106, 'l2_leaf_reg': 7.968369729396666e-08, 'border_count': 20, 'bagging_temperature': 0.01566269703521242, 'random_strength': 7.144124062281403, 'grow_policy': 'Depthwise', 'min_data_in_leaf': 156}. Best is trial 568 with value: 1659.4433932934307.[0m
[32m[I 2024-10-13 13:09:08,667][0m Trial 702 finished with value: 2076.4123609618127 and parameters: {'depth': 11, 'learning_rate': 0.0011618646900739052, 'iterations': 2301, 'l2_leaf_reg': 5.094379289931286e-08, 'border_count': 12, 'bagging_temperature': 0.04607449791926693, 'random_strength': 6.828413043763607, 'grow_policy': 'SymmetricTree', 'min_data_in_leaf': 321}. Best is trial 568 with value: 1659.4433932934307.[0m
[32m[I 2024-10-13 13:09:11,002][0m Trial 703 finished with value: 1748.8974657385836 and parameters: {'depth': 8, 'learning_rate': 0.0015764950017449653, 'iterations': 2446, 'l2_leaf_reg': 5.487288931882672e-07, 'border_count': 29, 'bagging_temperature': 0.018483591837702085, 'random_strength': 7.705375109130766, 'grow_policy': 'Depthwise', 'min_data_in_leaf': 107}. Best is trial 568 with value: 1659.4433932934307.[0m
[32m[I 2024-10-13 13:09:13,294][0m Trial 704 finished with value: 1761.5606710705545 and parameters: {'depth': 13, 'learning_rate': 0.0010407981773400167, 'iterations': 2182, 'l2_leaf_reg': 1.9034720461243876e-07, 'border_count': 24, 'bagging_temperature': 0.037892957153286055, 'random_strength': 7.990747386167961, 'grow_policy': 'Depthwise', 'min_data_in_leaf': 136}. Best is trial 568 with value: 1659.4433932934307.[0m
[32m[I 2024-10-13 13:09:15,328][0m Trial 705 finished with value: 1775.322176407163 and parameters: {'depth': 9, 'learning_rate': 0.0013301348588087387, 'iterations': 2036, 'l2_leaf_reg': 2.7102721476901928e-08, 'border_count': 48, 'bagging_temperature': 3.4952428460757745e-05, 'random_strength': 7.394935156322172, 'grow_policy': 'Lossguide', 'min_data_in_leaf': 278, 'max_leaves': 169}. Best is trial 568 with value: 1659.4433932934307.[0m
[32m[I 2024-10-13 13:09:18,007][0m Trial 706 finished with value: 2240.6680262792033 and parameters: {'depth': 12, 'learning_rate': 0.0018188648374192636, 'iterations': 2606, 'l2_leaf_reg': 9.128609696955757e-08, 'border_count': 194, 'bagging_temperature': 0.06628857444145587, 'random_strength': 5.307147693019401, 'grow_policy': 'Depthwise', 'min_data_in_leaf': 258}. Best is trial 568 with value: 1659.4433932934307.[0m
[32m[I 2024-10-13 13:09:19,131][0m Trial 707 finished with value: 2461.4713637376844 and parameters: {'depth': 9, 'learning_rate': 0.0007701730471915834, 'iterations': 724, 'l2_leaf_reg': 4.042214638896583e-08, 'border_count': 37, 'bagging_temperature': 0.03137371465130243, 'random_strength': 6.965741067775188, 'grow_policy': 'Depthwise', 'min_data_in_leaf': 347}. Best is trial 568 with value: 1659.4433932934307.[0m
[32m[I 2024-10-13 13:09:21,033][0m Trial 708 finished with value: 1911.158956540949 and parameters: {'depth': 10, 'learning_rate': 0.0009044241357861331, 'iterations': 1460, 'l2_leaf_reg': 0.007134588393295123, 'border_count': 18, 'bagging_temperature': 0.055811112795722796, 'random_strength': 5.950527886123023, 'grow_policy': 'Depthwise', 'min_data_in_leaf': 84}. Best is trial 568 with value: 1659.4433932934307.[0m
[32m[I 2024-10-13 13:09:22,956][0m Trial 709 finished with value: 1712.9279908248175 and parameters: {'depth': 8, 'learning_rate': 0.0014636930135681137, 'iterations': 1928, 'l2_leaf_reg': 3.3302921636183805e-07, 'border_count': 33, 'bagging_temperature': 0.018420718820356063, 'random_strength': 5.573006872637356, 'grow_policy': 'Lossguide', 'min_data_in_leaf': 160, 'max_leaves': 141}. Best is trial 568 with value: 1659.4433932934307.[0m
