[32m[I 2024-10-13 12:46:03,590][0m Trial 303 finished with value: 2557.505252314268 and parameters: {'depth': 3, 'learning_rate': 0.045365353415555316, 'iterations': 1421, 'l2_leaf_reg': 1.7937052378471738e-07, 'border_count': 14, 'bagging_temperature': 0.0007403357187981477, 'random_strength': 5.48405419182422, 'grow_policy': 'Depthwise', 'min_data_in_leaf': 145}. Best is trial 249 with value: 1695.0689015039372.[0m
[32m[I 2024-10-13 12:46:17,542][0m Trial 304 finished with value: 1998.4235846752451 and parameters: {'depth': 8, 'learning_rate': 0.001294407837878702, 'iterations': 1673, 'l2_leaf_reg': 5.731648750143293e-08, 'border_count': 27, 'bagging_temperature': 0.06716399959778054, 'random_strength': 6.149097484156477, 'grow_policy': 'SymmetricTree', 'min_data_in_leaf': 421}. Best is trial 249 with value: 1695.0689015039372.[0m
[32m[I 2024-10-13 12:46:19,394][0m Trial 305 finished with value: 1985.547051273544 and parameters: {'depth': 10, 'learning_rate': 0.0022911004108437947, 'iterations': 1794, 'l2_leaf_reg': 1.055874961397105e-07, 'border_count': 20, 'bagging_temperature': 0.08421520364870132, 'random_strength': 7.048869103926207, 'grow_policy': 'Depthwise', 'min_data_in_leaf': 155}. Best is trial 249 with value: 1695.0689015039372.[0m
[32m[I 2024-10-13 12:46:21,463][0m Trial 306 finished with value: 1741.8594922861298 and parameters: {'depth': 10, 'learning_rate': 0.0017980678300751752, 'iterations': 2063, 'l2_leaf_reg': 1.8415896568257351e-07, 'border_count': 32, 'bagging_temperature': 0.03575240199127257, 'random_strength': 7.517604239026063, 'grow_policy': 'Depthwise', 'min_data_in_leaf': 126}. Best is trial 249 with value: 1695.0689015039372.[0m
[32m[I 2024-10-13 12:46:23,455][0m Trial 307 finished with value: 1973.9439077374107 and parameters: {'depth': 9, 'learning_rate': 0.0006755847054739075, 'iterations': 1997, 'l2_leaf_reg': 8.054552612920851e-08, 'border_count': 24, 'bagging_temperature': 0.3581316154345642, 'random_strength': 7.955287742986805, 'grow_policy': 'Depthwise', 'min_data_in_leaf': 336}. Best is trial 249 with value: 1695.0689015039372.[0m
[32m[I 2024-10-13 12:46:25,640][0m Trial 308 finished with value: 1926.959128309153 and parameters: {'depth': 9, 'learning_rate': 0.0012336339911385458, 'iterations': 2219, 'l2_leaf_reg': 1.232850026870794e-07, 'border_count': 18, 'bagging_temperature': 0.06052961163663015, 'random_strength': 6.06745111269779, 'grow_policy': 'Depthwise', 'min_data_in_leaf': 369}. Best is trial 249 with value: 1695.0689015039372.[0m
[32m[I 2024-10-13 12:46:27,725][0m Trial 309 finished with value: 1754.7322016206128 and parameters: {'depth': 10, 'learning_rate': 0.0008161033697051717, 'iterations': 1926, 'l2_leaf_reg': 5.2643934939483745e-08, 'border_count': 28, 'bagging_temperature': 0.02071138636088532, 'random_strength': 5.697372696257797, 'grow_policy': 'Depthwise', 'min_data_in_leaf': 102}. Best is trial 249 with value: 1695.0689015039372.[0m
[32m[I 2024-10-13 12:46:29,873][0m Trial 310 finished with value: 1736.410336700557 and parameters: {'depth': 8, 'learning_rate': 0.0010298245343647887, 'iterations': 2171, 'l2_leaf_reg': 4.0508133583355605e-05, 'border_count': 34, 'bagging_temperature': 0.08806051068349091, 'random_strength': 6.7509399643973405, 'grow_policy': 'Depthwise', 'min_data_in_leaf': 162}. Best is trial 249 with value: 1695.0689015039372.[0m
[32m[I 2024-10-13 12:46:31,933][0m Trial 311 finished with value: 2203.0872977005342 and parameters: {'depth': 4, 'learning_rate': 0.005103759636447403, 'iterations': 2003, 'l2_leaf_reg': 1.9907417742004187e-07, 'border_count': 13, 'bagging_temperature': 0.046051142361858526, 'random_strength': 5.910001001118312, 'grow_policy': 'Depthwise', 'min_data_in_leaf': 176}. Best is trial 249 with value: 1695.0689015039372.[0m
[32m[I 2024-10-13 12:46:34,100][0m Trial 312 finished with value: 1959.1606169766353 and parameters: {'depth': 10, 'learning_rate': 0.0014810359073345843, 'iterations': 2113, 'l2_leaf_reg': 9.14026110684678e-08, 'border_count': 22, 'bagging_temperature': 0.01411129541789732, 'random_strength': 6.224602425805761, 'grow_policy': 'Depthwise', 'min_data_in_leaf': 355}. Best is trial 249 with value: 1695.0689015039372.[0m
[32m[I 2024-10-13 12:46:36,292][0m Trial 313 finished with value: 1712.2334200598038 and parameters: {'depth': 10, 'learning_rate': 0.001245532312025174, 'iterations': 2235, 'l2_leaf_reg': 3.250873937380776e-08, 'border_count': 39, 'bagging_temperature': 0.0002880425049868532, 'random_strength': 5.427852790371894, 'grow_policy': 'Depthwise', 'min_data_in_leaf': 401}. Best is trial 249 with value: 1695.0689015039372.[0m
[32m[I 2024-10-13 12:46:38,485][0m Trial 314 finished with value: 2216.2043444665474 and parameters: {'depth': 9, 'learning_rate': 0.0019998791063979707, 'iterations': 2225, 'l2_leaf_reg': 1.4344334485406822e-08, 'border_count': 169, 'bagging_temperature': 0.0014806271909784119, 'random_strength': 5.380101322594295, 'grow_policy': 'Depthwise', 'min_data_in_leaf': 393}. Best is trial 249 with value: 1695.0689015039372.[0m
[32m[I 2024-10-13 12:46:40,678][0m Trial 315 finished with value: 1716.305516159418 and parameters: {'depth': 9, 'learning_rate': 0.0013803453655447746, 'iterations': 2167, 'l2_leaf_reg': 2.3136088120270302e-08, 'border_count': 38, 'bagging_temperature': 0.02744430466757768, 'random_strength': 5.0739369159880505, 'grow_policy': 'Depthwise', 'min_data_in_leaf': 490}. Best is trial 249 with value: 1695.0689015039372.[0m
[32m[I 2024-10-13 12:46:42,880][0m Trial 316 finished with value: 1885.5016357934444 and parameters: {'depth': 9, 'learning_rate': 0.0015766662773217634, 'iterations': 2239, 'l2_leaf_reg': 2.319604950664136e-08, 'border_count': 42, 'bagging_temperature': 0.03325338418956337, 'random_strength': 4.981528972598179, 'grow_policy': 'Depthwise', 'min_data_in_leaf': 444}. Best is trial 249 with value: 1695.0689015039372.[0m
[32m[I 2024-10-13 12:46:45,130][0m Trial 317 finished with value: 1738.6119211620348 and parameters: {'depth': 9, 'learning_rate': 0.0014139789297829349, 'iterations': 2178, 'l2_leaf_reg': 1.7272992223562692e-08, 'border_count': 41, 'bagging_temperature': 0.05324611371698858, 'random_strength': 4.747915963473626, 'grow_policy': 'Depthwise', 'min_data_in_leaf': 461}. Best is trial 249 with value: 1695.0689015039372.[0m
[32m[I 2024-10-13 12:46:47,406][0m Trial 318 finished with value: 1750.1481980989995 and parameters: {'depth': 9, 'learning_rate': 0.001708986333318694, 'iterations': 2274, 'l2_leaf_reg': 2.8419248810972525e-08, 'border_count': 37, 'bagging_temperature': 0.02955901864800619, 'random_strength': 5.114190934716565, 'grow_policy': 'Depthwise', 'min_data_in_leaf': 431}. Best is trial 249 with value: 1695.0689015039372.[0m
[32m[I 2024-10-13 12:46:49,509][0m Trial 319 finished with value: 2068.6658227021476 and parameters: {'depth': 10, 'learning_rate': 0.0013036505436667088, 'iterations': 1544, 'l2_leaf_reg': 3.219906171129237e-08, 'border_count': 123, 'bagging_temperature': 0.0010298447711737156, 'random_strength': 5.253340174974634, 'grow_policy': 'Depthwise', 'min_data_in_leaf': 73}. Best is trial 249 with value: 1695.0689015039372.[0m
[32m[I 2024-10-13 12:46:51,687][0m Trial 320 finished with value: 1764.2839781148477 and parameters: {'depth': 9, 'learning_rate': 0.0021816694427960037, 'iterations': 2089, 'l2_leaf_reg': 1.1579159586772105e-08, 'border_count': 38, 'bagging_temperature': 0.06316622094151536, 'random_strength': 5.058070947811563, 'grow_policy': 'Depthwise', 'min_data_in_leaf': 487}. Best is trial 249 with value: 1695.0689015039372.[0m
[32m[I 2024-10-13 12:46:53,648][0m Trial 321 finished with value: 1723.2082648463447 and parameters: {'depth': 9, 'learning_rate': 0.0012648663650021556, 'iterations': 1898, 'l2_leaf_reg': 3.664851899735447e-08, 'border_count': 32, 'bagging_temperature': 0.038533970925346946, 'random_strength': 5.462012236069402, 'grow_policy': 'Depthwise', 'min_data_in_leaf': 619}. Best is trial 249 with value: 1695.0689015039372.[0m
[32m[I 2024-10-13 12:46:55,497][0m Trial 322 finished with value: 1821.7320457523297 and parameters: {'depth': 9, 'learning_rate': 0.0009732613046648766, 'iterations': 1758, 'l2_leaf_reg': 5.064112090412608e-08, 'border_count': 26, 'bagging_temperature': 0.015948730829992513, 'random_strength': 5.585340842994214, 'grow_policy': 'Depthwise', 'min_data_in_leaf': 409}. Best is trial 249 with value: 1695.0689015039372.[0m
[32m[I 2024-10-13 12:46:57,558][0m Trial 323 finished with value: 1733.5773155387296 and parameters: {'depth': 10, 'learning_rate': 0.0028459712902853635, 'iterations': 2046, 'l2_leaf_reg': 2.0698476918744445e-08, 'border_count': 6, 'bagging_temperature': 0.047514220682697304, 'random_strength': 5.231522530348591, 'grow_policy': 'Depthwise', 'min_data_in_leaf': 133}. Best is trial 249 with value: 1695.0689015039372.[0m
[32m[I 2024-10-13 12:46:59,837][0m Trial 324 finished with value: 2030.5735793611386 and parameters: {'depth': 10, 'learning_rate': 0.0015186006067886028, 'iterations': 2141, 'l2_leaf_reg': 4.7136991385764626e-08, 'border_count': 19, 'bagging_temperature': 0.06910632146777808, 'random_strength': 7.41382289903603, 'grow_policy': 'Depthwise', 'min_data_in_leaf': 94}. Best is trial 249 with value: 1695.0689015039372.[0m
[32m[I 2024-10-13 12:47:02,010][0m Trial 325 finished with value: 1807.7188350218983 and parameters: {'depth': 9, 'learning_rate': 0.0011052258716842806, 'iterations': 2220, 'l2_leaf_reg': 3.208344408953769, 'border_count': 49, 'bagging_temperature': 0.03103966695764522, 'random_strength': 7.2293774015373025, 'grow_policy': 'Depthwise', 'min_data_in_leaf': 543}. Best is trial 249 with value: 1695.0689015039372.[0m
[32m[I 2024-10-13 12:47:03,908][0m Trial 326 finished with value: 1726.2336064187662 and parameters: {'depth': 10, 'learning_rate': 0.0018274819770399274, 'iterations': 1825, 'l2_leaf_reg': 6.958039807649582e-08, 'border_count': 31, 'bagging_temperature': 0.015341738736405083, 'random_strength': 5.451047136574064, 'grow_policy': 'Depthwise', 'min_data_in_leaf': 158}. Best is trial 249 with value: 1695.0689015039372.[0m
[32m[I 2024-10-13 12:47:06,195][0m Trial 327 finished with value: 1701.4510137172429 and parameters: {'depth': 8, 'learning_rate': 0.0013788489251806537, 'iterations': 2298, 'l2_leaf_reg': 0.0032070142273060843, 'border_count': 25, 'bagging_temperature': 0.05468533981053816, 'random_strength': 7.018052569110195, 'grow_policy': 'Depthwise', 'min_data_in_leaf': 119}. Best is trial 249 with value: 1695.0689015039372.[0m
[32m[I 2024-10-13 12:47:22,817][0m Trial 328 finished with value: 2122.98047354667 and parameters: {'depth': 8, 'learning_rate': 0.0014242526653998908, 'iterations': 2257, 'l2_leaf_reg': 2.5664128964768428e-08, 'border_count': 14, 'bagging_temperature': 0.44028411296639886, 'random_strength': 7.121085609721178, 'grow_policy': 'SymmetricTree', 'min_data_in_leaf': 498}. Best is trial 249 with value: 1695.0689015039372.[0m
[32m[I 2024-10-13 12:47:24,997][0m Trial 329 finished with value: 2007.5457297614123 and parameters: {'depth': 9, 'learning_rate': 0.0017475771687128175, 'iterations': 2286, 'l2_leaf_reg': 0.23743149464014976, 'border_count': 22, 'bagging_temperature': 0.08430396437697492, 'random_strength': 6.9262527078717575, 'grow_policy': 'Depthwise', 'min_data_in_leaf': 115}. Best is trial 249 with value: 1695.0689015039372.[0m
[32m[I 2024-10-13 12:47:27,257][0m Trial 330 finished with value: 1764.9324528116065 and parameters: {'depth': 8, 'learning_rate': 0.002099865746333233, 'iterations': 2197, 'l2_leaf_reg': 0.019337770811894663, 'border_count': 39, 'bagging_temperature': 0.06190254429637668, 'random_strength': 7.654264700230265, 'grow_policy': 'Depthwise', 'min_data_in_leaf': 135}. Best is trial 249 with value: 1695.0689015039372.[0m
[32m[I 2024-10-13 12:47:29,132][0m Trial 331 finished with value: 1769.4680456147398 and parameters: {'depth': 9, 'learning_rate': 0.0008951358532293472, 'iterations': 1662, 'l2_leaf_reg': 0.0037277275713580396, 'border_count': 46, 'bagging_temperature': 0.000770608277763575, 'random_strength': 7.384781020501585, 'grow_policy': 'Depthwise', 'min_data_in_leaf': 93}. Best is trial 249 with value: 1695.0689015039372.[0m
[32m[I 2024-10-13 12:47:31,273][0m Trial 332 finished with value: 1697.760052005697 and parameters: {'depth': 9, 'learning_rate': 0.0013672526394351626, 'iterations': 1977, 'l2_leaf_reg': 4.151276716155887e-08, 'border_count': 25, 'bagging_temperature': 0.04697163461306325, 'random_strength': 7.152481602355707, 'grow_policy': 'Depthwise', 'min_data_in_leaf': 180}. Best is trial 249 with value: 1695.0689015039372.[0m
[32m[I 2024-10-13 12:47:33,190][0m Trial 333 finished with value: 1934.782789821017 and parameters: {'depth': 8, 'learning_rate': 0.0015741250467082022, 'iterations': 1940, 'l2_leaf_reg': 0.04467572042083701, 'border_count': 19, 'bagging_temperature': 0.07851601465157503, 'random_strength': 7.06970565650628, 'grow_policy': 'Depthwise', 'min_data_in_leaf': 141}. Best is trial 249 with value: 1695.0689015039372.[0m
[32m[I 2024-10-13 12:47:35,275][0m Trial 334 finished with value: 1892.0547200368158 and parameters: {'depth': 9, 'learning_rate': 0.0011369235507610348, 'iterations': 2020, 'l2_leaf_reg': 4.397061376883179e-08, 'border_count': 11, 'bagging_temperature': 0.053747735989761174, 'random_strength': 7.244187807440201, 'grow_policy': 'Depthwise', 'min_data_in_leaf': 191}. Best is trial 249 with value: 1695.0689015039372.[0m
[32m[I 2024-10-13 12:47:37,259][0m Trial 335 finished with value: 1796.9601118496062 and parameters: {'depth': 9, 'learning_rate': 0.001010017151554249, 'iterations': 1962, 'l2_leaf_reg': 6.468116963511597e-08, 'border_count': 24, 'bagging_temperature': 0.045776165390413334, 'random_strength': 6.812476208715557, 'grow_policy': 'Depthwise', 'min_data_in_leaf': 179}. Best is trial 249 with value: 1695.0689015039372.[0m
[32m[I 2024-10-13 12:47:39,250][0m Trial 336 finished with value: 1720.4988115098192 and parameters: {'depth': 10, 'learning_rate': 0.0013188634475665264, 'iterations': 1869, 'l2_leaf_reg': 0.0015946800209753734, 'border_count': 27, 'bagging_temperature': 0.0871431223614191, 'random_strength': 7.052692320373327, 'grow_policy': 'Depthwise', 'min_data_in_leaf': 162}. Best is trial 249 with value: 1695.0689015039372.[0m
[32m[I 2024-10-13 12:47:41,059][0m Trial 337 finished with value: 2033.3551955292157 and parameters: {'depth': 9, 'learning_rate': 0.0007973625414091436, 'iterations': 1724, 'l2_leaf_reg': 1.4382804962078116e-07, 'border_count': 18, 'bagging_temperature': 0.06717951787190973, 'random_strength': 7.4898119567374435, 'grow_policy': 'Depthwise', 'min_data_in_leaf': 116}. Best is trial 249 with value: 1695.0689015039372.[0m
[32m[I 2024-10-13 12:47:43,145][0m Trial 338 finished with value: 1741.8270775759445 and parameters: {'depth': 8, 'learning_rate': 0.0017860862575896238, 'iterations': 2077, 'l2_leaf_reg': 0.013461104652014224, 'border_count': 31, 'bagging_temperature': 0.04414337119630502, 'random_strength': 7.829920742392404, 'grow_policy': 'Depthwise', 'min_data_in_leaf': 193}. Best is trial 249 with value: 1695.0689015039372.[0m
[32m[I 2024-10-13 12:47:45,169][0m Trial 339 finished with value: 1757.9048818953174 and parameters: {'depth': 9, 'learning_rate': 0.001183823009202128, 'iterations': 1982, 'l2_leaf_reg': 0.0005278762244856089, 'border_count': 24, 'bagging_temperature': 0.07431520618503577, 'random_strength': 6.880404071959474, 'grow_policy': 'Depthwise', 'min_data_in_leaf': 152}. Best is trial 249 with value: 1695.0689015039372.[0m
[32m[I 2024-10-13 12:47:47,077][0m Trial 340 finished with value: 1783.707471724057 and parameters: {'depth': 10, 'learning_rate': 0.0014532120724300246, 'iterations': 1800, 'l2_leaf_reg': 0.06672492192458948, 'border_count': 81, 'bagging_temperature': 0.26528834964407744, 'random_strength': 7.270055883658364, 'grow_policy': 'Depthwise', 'min_data_in_leaf': 179}. Best is trial 249 with value: 1695.0689015039372.[0m
[32m[I 2024-10-13 12:47:49,297][0m Trial 341 finished with value: 1896.7496222600587 and parameters: {'depth': 10, 'learning_rate': 0.0009458389793371558, 'iterations': 2299, 'l2_leaf_reg': 7.493576010373738e-08, 'border_count': 12, 'bagging_temperature': 0.03381171560268406, 'random_strength': 7.530101006271086, 'grow_policy': 'Depthwise', 'min_data_in_leaf': 132}. Best is trial 249 with value: 1695.0689015039372.[0m
[32m[I 2024-10-13 12:47:50,633][0m Trial 342 finished with value: 1745.7583360430094 and parameters: {'depth': 9, 'learning_rate': 0.00161004938345856, 'iterations': 1002, 'l2_leaf_reg': 0.0001421509126550151, 'border_count': 28, 'bagging_temperature': 0.05368962056878234, 'random_strength': 5.673311952671581, 'grow_policy': 'Depthwise', 'min_data_in_leaf': 96}. Best is trial 249 with value: 1695.0689015039372.[0m
[32m[I 2024-10-13 12:47:52,576][0m Trial 343 finished with value: 1907.0791735593898 and parameters: {'depth': 10, 'learning_rate': 0.0011910559974454284, 'iterations': 1929, 'l2_leaf_reg': 0.0022018913271947215, 'border_count': 20, 'bagging_temperature': 0.5443597431007793, 'random_strength': 7.074183402800296, 'grow_policy': 'Depthwise', 'min_data_in_leaf': 408}. Best is trial 249 with value: 1695.0689015039372.[0m
[32m[I 2024-10-13 12:47:54,288][0m Trial 344 finished with value: 1723.3074257826654 and parameters: {'depth': 9, 'learning_rate': 0.00197345796102283, 'iterations': 1598, 'l2_leaf_reg': 1.2032078574601376e-07, 'border_count': 33, 'bagging_temperature': 0.09199728282743325, 'random_strength': 6.674490778330258, 'grow_policy': 'Depthwise', 'min_data_in_leaf': 117}. Best is trial 249 with value: 1695.0689015039372.[0m
[32m[I 2024-10-13 12:48:09,950][0m Trial 345 finished with value: 2014.888311819317 and parameters: {'depth': 9, 'learning_rate': 0.0010510481835783844, 'iterations': 2111, 'l2_leaf_reg': 3.9290638841575476e-08, 'border_count': 7, 'bagging_temperature': 0.014827973788439027, 'random_strength': 7.364417513867034, 'grow_policy': 'SymmetricTree', 'min_data_in_leaf': 47}. Best is trial 249 with value: 1695.0689015039372.[0m
[32m[I 2024-10-13 12:48:12,582][0m Trial 346 finished with value: 1851.3260395366697 and parameters: {'depth': 9, 'learning_rate': 0.001348893526796994, 'iterations': 2026, 'l2_leaf_reg': 8.21266146068786e-08, 'border_count': 23, 'bagging_temperature': 0.03522687585041315, 'random_strength': 7.189824024861028, 'grow_policy': 'Depthwise', 'min_data_in_leaf': 70}. Best is trial 249 with value: 1695.0689015039372.[0m
[32m[I 2024-10-13 12:48:14,809][0m Trial 347 finished with value: 2001.5994326542846 and parameters: {'depth': 10, 'learning_rate': 0.0006606388634104319, 'iterations': 2313, 'l2_leaf_reg': 1.7697161652062236e-07, 'border_count': 16, 'bagging_temperature': 0.2262536856137335, 'random_strength': 7.741055500540715, 'grow_policy': 'Depthwise', 'min_data_in_leaf': 383}. Best is trial 249 with value: 1695.0689015039372.[0m
[32m[I 2024-10-13 12:48:16,987][0m Trial 348 finished with value: 1770.3466573564021 and parameters: {'depth': 8, 'learning_rate': 0.0008787860139342364, 'iterations': 2206, 'l2_leaf_reg': 0.0067846901093132714, 'border_count': 28, 'bagging_temperature': 0.05134039405342049, 'random_strength': 6.6032973376969775, 'grow_policy': 'Depthwise', 'min_data_in_leaf': 153}. Best is trial 249 with value: 1695.0689015039372.[0m
[32m[I 2024-10-13 12:48:18,961][0m Trial 349 finished with value: 1716.5056062252784 and parameters: {'depth': 10, 'learning_rate': 0.0015779427690575075, 'iterations': 1856, 'l2_leaf_reg': 0.0009899226424510041, 'border_count': 33, 'bagging_temperature': 0.06681219169884296, 'random_strength': 6.909907048835654, 'grow_policy': 'Depthwise', 'min_data_in_leaf': 362}. Best is trial 249 with value: 1695.0689015039372.[0m
[32m[I 2024-10-13 12:48:20,441][0m Trial 350 finished with value: 1696.042602549871 and parameters: {'depth': 9, 'learning_rate': 0.0023047296824821057, 'iterations': 1302, 'l2_leaf_reg': 5.5077548232327367e-08, 'border_count': 25, 'bagging_temperature': 0.020191533357547406, 'random_strength': 8.224586381054879, 'grow_policy': 'Depthwise', 'min_data_in_leaf': 135}. Best is trial 249 with value: 1695.0689015039372.[0m
[32m[I 2024-10-13 12:48:21,993][0m Trial 351 finished with value: 2067.761898059396 and parameters: {'depth': 9, 'learning_rate': 0.004059872453261996, 'iterations': 1395, 'l2_leaf_reg': 4.1434173783021474e-08, 'border_count': 21, 'bagging_temperature': 0.0021206725351163858, 'random_strength': 8.33006687050918, 'grow_policy': 'Depthwise', 'min_data_in_leaf': 132}. Best is trial 249 with value: 1695.0689015039372.[0m
[32m[I 2024-10-13 12:48:23,452][0m Trial 352 finished with value: 2158.7543098392293 and parameters: {'depth': 9, 'learning_rate': 0.0027160278651322577, 'iterations': 1205, 'l2_leaf_reg': 5.5525350304399635e-08, 'border_count': 209, 'bagging_temperature': 0.01619830300637201, 'random_strength': 8.05849333344289, 'grow_policy': 'Depthwise', 'min_data_in_leaf': 103}. Best is trial 249 with value: 1695.0689015039372.[0m
[32m[I 2024-10-13 12:48:25,699][0m Trial 353 finished with value: 2045.807770110158 and parameters: {'depth': 9, 'learning_rate': 0.0021457257638768453, 'iterations': 2264, 'l2_leaf_reg': 6.35375205267039e-08, 'border_count': 15, 'bagging_temperature': 0.00043855661479104034, 'random_strength': 5.803226680348433, 'grow_policy': 'Depthwise', 'min_data_in_leaf': 173}. Best is trial 249 with value: 1695.0689015039372.[0m
