[32m[I 2024-10-13 13:12:24,401][0m Trial 761 finished with value: 1909.8827375951118 and parameters: {'depth': 11, 'learning_rate': 0.0005298232678967726, 'iterations': 2233, 'l2_leaf_reg': 1.1170666699138154e-07, 'border_count': 20, 'bagging_temperature': 0.09217983814925367, 'random_strength': 7.065926258525, 'grow_policy': 'Depthwise', 'min_data_in_leaf': 46}. Best is trial 568 with value: 1659.4433932934307.[0m
[32m[I 2024-10-13 13:12:26,461][0m Trial 762 finished with value: 1741.1079546619778 and parameters: {'depth': 9, 'learning_rate': 0.0010373054071228687, 'iterations': 2080, 'l2_leaf_reg': 0.002871124509094306, 'border_count': 27, 'bagging_temperature': 0.028924292646788387, 'random_strength': 8.49475065328011, 'grow_policy': 'Depthwise', 'min_data_in_leaf': 111}. Best is trial 568 with value: 1659.4433932934307.[0m
[32m[I 2024-10-13 13:12:29,443][0m Trial 763 finished with value: 1724.9592038387882 and parameters: {'depth': 14, 'learning_rate': 0.0008618585222065706, 'iterations': 2348, 'l2_leaf_reg': 1.8609897415440378e-08, 'border_count': 39, 'bagging_temperature': 0.06744467487800737, 'random_strength': 7.420659678042949, 'grow_policy': 'Depthwise', 'min_data_in_leaf': 75}. Best is trial 568 with value: 1659.4433932934307.[0m
[32m[I 2024-10-13 13:12:30,707][0m Trial 764 finished with value: 1961.3181865744737 and parameters: {'depth': 8, 'learning_rate': 0.0015241476673787855, 'iterations': 1039, 'l2_leaf_reg': 7.577208142230565e-08, 'border_count': 12, 'bagging_temperature': 0.019807577612800296, 'random_strength': 3.548402545838288, 'grow_policy': 'Lossguide', 'min_data_in_leaf': 201, 'max_leaves': 247}. Best is trial 568 with value: 1659.4433932934307.[0m
[32m[I 2024-10-13 13:12:32,935][0m Trial 765 finished with value: 1715.4801691001817 and parameters: {'depth': 9, 'learning_rate': 0.0012673336414906367, 'iterations': 2289, 'l2_leaf_reg': 3.4139423200150065e-08, 'border_count': 29, 'bagging_temperature': 0.049010130651655576, 'random_strength': 4.87643602255788, 'grow_policy': 'Depthwise', 'min_data_in_leaf': 151}. Best is trial 568 with value: 1659.4433932934307.[0m
[32m[I 2024-10-13 13:12:34,948][0m Trial 766 finished with value: 1784.7189839201246 and parameters: {'depth': 9, 'learning_rate': 0.002093529365802291, 'iterations': 1945, 'l2_leaf_reg': 2.7958233925611034e-07, 'border_count': 23, 'bagging_temperature': 0.03213227601056906, 'random_strength': 5.709293694704703, 'grow_policy': 'Depthwise', 'min_data_in_leaf': 396}. Best is trial 568 with value: 1659.4433932934307.[0m
[32m[I 2024-10-13 13:13:10,046][0m Trial 767 finished with value: 2118.694302756511 and parameters: {'depth': 10, 'learning_rate': 0.0010166337679285314, 'iterations': 2586, 'l2_leaf_reg': 2.028568922270465e-07, 'border_count': 17, 'bagging_temperature': 0.015375852218275077, 'random_strength': 7.742717944918991, 'grow_policy': 'SymmetricTree', 'min_data_in_leaf': 229}. Best is trial 568 with value: 1659.4433932934307.[0m
[32m[I 2024-10-13 13:13:13,987][0m Trial 768 finished with value: 2009.9316230890652 and parameters: {'depth': 6, 'learning_rate': 0.0016708517246814504, 'iterations': 2011, 'l2_leaf_reg': 6.685341326107564e-07, 'border_count': 31, 'bagging_temperature': 0.3998047689578351, 'random_strength': 8.174298816319219, 'grow_policy': 'Depthwise', 'min_data_in_leaf': 19}. Best is trial 568 with value: 1659.4433932934307.[0m
[32m[I 2024-10-13 13:13:16,293][0m Trial 769 finished with value: 1703.6223973669998 and parameters: {'depth': 5, 'learning_rate': 0.001333037179713459, 'iterations': 2400, 'l2_leaf_reg': 5.3482657888676716e-08, 'border_count': 25, 'bagging_temperature': 0.059747679255939115, 'random_strength': 5.500882488195109, 'grow_policy': 'Lossguide', 'min_data_in_leaf': 315, 'max_leaves': 163}. Best is trial 568 with value: 1659.4433932934307.[0m
[32m[I 2024-10-13 13:13:18,756][0m Trial 770 finished with value: 2154.802686748929 and parameters: {'depth': 5, 'learning_rate': 0.0030611075763214797, 'iterations': 2517, 'l2_leaf_reg': 5.372456606756013e-08, 'border_count': 14, 'bagging_temperature': 0.1120373175476528, 'random_strength': 5.230687461284428, 'grow_policy': 'Lossguide', 'min_data_in_leaf': 311, 'max_leaves': 163}. Best is trial 568 with value: 1659.4433932934307.[0m
[32m[I 2024-10-13 13:13:20,996][0m Trial 771 finished with value: 2083.2576477066036 and parameters: {'depth': 5, 'learning_rate': 0.0024480474433464473, 'iterations': 2415, 'l2_leaf_reg': 2.796993163849277e-08, 'border_count': 21, 'bagging_temperature': 0.08901046543519908, 'random_strength': 5.415239597749225, 'grow_policy': 'Lossguide', 'min_data_in_leaf': 265, 'max_leaves': 144}. Best is trial 568 with value: 1659.4433932934307.[0m
[32m[I 2024-10-13 13:13:23,256][0m Trial 772 finished with value: 3010.1474621322222 and parameters: {'depth': 5, 'learning_rate': 0.10230453880774738, 'iterations': 2374, 'l2_leaf_reg': 4.650494591240473e-08, 'border_count': 9, 'bagging_temperature': 0.08053193935768474, 'random_strength': 5.013575022325906, 'grow_policy': 'Lossguide', 'min_data_in_leaf': 304, 'max_leaves': 151}. Best is trial 568 with value: 1659.4433932934307.[0m
[32m[I 2024-10-13 13:13:25,615][0m Trial 773 finished with value: 1715.175247031692 and parameters: {'depth': 6, 'learning_rate': 0.0013820333771802696, 'iterations': 2449, 'l2_leaf_reg': 8.091857206778816e-08, 'border_count': 25, 'bagging_temperature': 0.12521602600643844, 'random_strength': 4.570743162855102, 'grow_policy': 'Lossguide', 'min_data_in_leaf': 276, 'max_leaves': 136}. Best is trial 568 with value: 1659.4433932934307.[0m
[32m[I 2024-10-13 13:13:27,874][0m Trial 774 finished with value: 1991.3163979996107 and parameters: {'depth': 8, 'learning_rate': 0.0017330406203874922, 'iterations': 2360, 'l2_leaf_reg': 5.202493867169896e-08, 'border_count': 18, 'bagging_temperature': 0.07016418490194462, 'random_strength': 5.248367467684373, 'grow_policy': 'Lossguide', 'min_data_in_leaf': 291, 'max_leaves': 155}. Best is trial 568 with value: 1659.4433932934307.[0m
[32m[I 2024-10-13 13:13:28,705][0m Trial 775 finished with value: 2699.2553421588855 and parameters: {'depth': 5, 'learning_rate': 0.001152961518601959, 'iterations': 317, 'l2_leaf_reg': 1.4193183408429499e-08, 'border_count': 24, 'bagging_temperature': 0.09885225180060156, 'random_strength': 5.5364329956594815, 'grow_policy': 'Lossguide', 'min_data_in_leaf': 327, 'max_leaves': 166}. Best is trial 568 with value: 1659.4433932934307.[0m
[32m[I 2024-10-13 13:13:31,008][0m Trial 776 finished with value: 2183.3002624905034 and parameters: {'depth': 8, 'learning_rate': 0.0003977497005048977, 'iterations': 2474, 'l2_leaf_reg': 3.297123452572462e-08, 'border_count': 231, 'bagging_temperature': 0.06410277270412323, 'random_strength': 7.350727507851021, 'grow_policy': 'Lossguide', 'min_data_in_leaf': 294, 'max_leaves': 128}. Best is trial 568 with value: 1659.4433932934307.[0m
[32m[I 2024-10-13 13:13:33,244][0m Trial 777 finished with value: 1952.47615130895 and parameters: {'depth': 5, 'learning_rate': 0.0019807335987415335, 'iterations': 2334, 'l2_leaf_reg': 7.416244886018714e-08, 'border_count': 71, 'bagging_temperature': 0.05999629875963772, 'random_strength': 7.624178674400818, 'grow_policy': 'Lossguide', 'min_data_in_leaf': 325, 'max_leaves': 197}. Best is trial 568 with value: 1659.4433932934307.[0m
[32m[I 2024-10-13 13:13:35,527][0m Trial 778 finished with value: 1957.684616133741 and parameters: {'depth': 4, 'learning_rate': 0.0007302292720461332, 'iterations': 2403, 'l2_leaf_reg': 1.1720697789006133e-07, 'border_count': 18, 'bagging_temperature': 0.08139108030970277, 'random_strength': 7.998450507777319, 'grow_policy': 'Lossguide', 'min_data_in_leaf': 303, 'max_leaves': 173}. Best is trial 568 with value: 1659.4433932934307.[0m
[32m[I 2024-10-13 13:13:37,553][0m Trial 779 finished with value: 1721.7037231719323 and parameters: {'depth': 5, 'learning_rate': 0.0014060300093367126, 'iterations': 1828, 'l2_leaf_reg': 2.2812346270233944e-08, 'border_count': 27, 'bagging_temperature': 0.14930243263682472, 'random_strength': 7.024769099796833, 'grow_policy': 'Lossguide', 'min_data_in_leaf': 175, 'max_leaves': 187}. Best is trial 568 with value: 1659.4433932934307.[0m
[32m[I 2024-10-13 13:13:39,479][0m Trial 780 finished with value: 1949.189862980645 and parameters: {'depth': 5, 'learning_rate': 0.001560864292381993, 'iterations': 1936, 'l2_leaf_reg': 5.3881953162922176e-08, 'border_count': 14, 'bagging_temperature': 0.049322824288696346, 'random_strength': 5.36934053810838, 'grow_policy': 'Lossguide', 'min_data_in_leaf': 115, 'max_leaves': 179}. Best is trial 568 with value: 1659.4433932934307.[0m
[32m[I 2024-10-13 13:13:40,423][0m Trial 781 finished with value: 2553.188000356018 and parameters: {'depth': 5, 'learning_rate': 0.000948446677344105, 'iterations': 516, 'l2_leaf_reg': 8.500885997241109e-08, 'border_count': 20, 'bagging_temperature': 0.04875522527076245, 'random_strength': 2.7969815080802123, 'grow_policy': 'Lossguide', 'min_data_in_leaf': 137, 'max_leaves': 159}. Best is trial 568 with value: 1659.4433932934307.[0m
[32m[I 2024-10-13 13:13:42,708][0m Trial 782 finished with value: 1741.2517138432127 and parameters: {'depth': 5, 'learning_rate': 0.0012218206801311955, 'iterations': 2430, 'l2_leaf_reg': 3.915746063247265e-08, 'border_count': 5, 'bagging_temperature': 0.0694899171132572, 'random_strength': 6.688171093692913, 'grow_policy': 'Lossguide', 'min_data_in_leaf': 611, 'max_leaves': 203}. Best is trial 568 with value: 1659.4433932934307.[0m
[32m[I 2024-10-13 13:13:45,429][0m Trial 783 finished with value: 1711.8478226105437 and parameters: {'depth': 7, 'learning_rate': 0.0010992826434382472, 'iterations': 2917, 'l2_leaf_reg': 1.1910765983560771e-07, 'border_count': 26, 'bagging_temperature': 0.04343497830525132, 'random_strength': 4.997086458179719, 'grow_policy': 'Lossguide', 'min_data_in_leaf': 277, 'max_leaves': 148}. Best is trial 568 with value: 1659.4433932934307.[0m
[32m[I 2024-10-13 13:13:48,055][0m Trial 784 finished with value: 1939.212070361278 and parameters: {'depth': 7, 'learning_rate': 0.0008057327062770432, 'iterations': 2909, 'l2_leaf_reg': 8.369215300071255e-08, 'border_count': 22, 'bagging_temperature': 0.0828757271828615, 'random_strength': 4.88577310052627, 'grow_policy': 'Lossguide', 'min_data_in_leaf': 278, 'max_leaves': 143}. Best is trial 568 with value: 1659.4433932934307.[0m
[32m[I 2024-10-13 13:13:50,715][0m Trial 785 finished with value: 2493.0829252363483 and parameters: {'depth': 7, 'learning_rate': 0.0001895924204873765, 'iterations': 2861, 'l2_leaf_reg': 5.676078213237831e-08, 'border_count': 11, 'bagging_temperature': 0.10381435096003894, 'random_strength': 4.792696000567641, 'grow_policy': 'Lossguide', 'min_data_in_leaf': 241, 'max_leaves': 154}. Best is trial 568 with value: 1659.4433932934307.[0m
[32m[I 2024-10-13 13:13:53,509][0m Trial 786 finished with value: 1943.808865091315 and parameters: {'depth': 7, 'learning_rate': 0.000967003113420361, 'iterations': 2999, 'l2_leaf_reg': 2.9569985029398305e-08, 'border_count': 15, 'bagging_temperature': 0.060603415762749885, 'random_strength': 4.979282213439283, 'grow_policy': 'Lossguide', 'min_data_in_leaf': 281, 'max_leaves': 148}. Best is trial 568 with value: 1659.4433932934307.[0m
[32m[I 2024-10-13 13:13:56,225][0m Trial 787 finished with value: 1704.3229165381213 and parameters: {'depth': 6, 'learning_rate': 0.0011117117693481631, 'iterations': 2948, 'l2_leaf_reg': 1.1532726569778519e-07, 'border_count': 25, 'bagging_temperature': 0.051394625709847895, 'random_strength': 4.28688270096317, 'grow_policy': 'Lossguide', 'min_data_in_leaf': 262, 'max_leaves': 167}. Best is trial 568 with value: 1659.4433932934307.[0m
[32m[I 2024-10-13 13:13:58,921][0m Trial 788 finished with value: 1916.4864735757828 and parameters: {'depth': 6, 'learning_rate': 0.0008484429790673234, 'iterations': 2946, 'l2_leaf_reg': 1.3257394091296038e-07, 'border_count': 20, 'bagging_temperature': 0.09412417073921737, 'random_strength': 4.378634147016301, 'grow_policy': 'Lossguide', 'min_data_in_leaf': 263, 'max_leaves': 166}. Best is trial 568 with value: 1659.4433932934307.[0m
[32m[I 2024-10-13 13:14:01,584][0m Trial 789 finished with value: 1705.539217585736 and parameters: {'depth': 7, 'learning_rate': 0.0011154521214203727, 'iterations': 2889, 'l2_leaf_reg': 1.2548292666819648e-07, 'border_count': 25, 'bagging_temperature': 0.08330404322675172, 'random_strength': 4.365065716353583, 'grow_policy': 'Lossguide', 'min_data_in_leaf': 239, 'max_leaves': 162}. Best is trial 568 with value: 1659.4433932934307.[0m
[32m[I 2024-10-13 13:14:04,230][0m Trial 790 finished with value: 1942.9209836818611 and parameters: {'depth': 6, 'learning_rate': 0.0007016118183184248, 'iterations': 2848, 'l2_leaf_reg': 1.3039813916457085e-07, 'border_count': 16, 'bagging_temperature': 0.09994417517016764, 'random_strength': 4.136907124088378, 'grow_policy': 'Lossguide', 'min_data_in_leaf': 252, 'max_leaves': 161}. Best is trial 568 with value: 1659.4433932934307.[0m
[32m[I 2024-10-13 13:14:06,973][0m Trial 791 finished with value: 1952.889476005623 and parameters: {'depth': 6, 'learning_rate': 0.00096322636044106, 'iterations': 2958, 'l2_leaf_reg': 9.436101501839787e-08, 'border_count': 22, 'bagging_temperature': 0.13221156171793072, 'random_strength': 4.257865329014282, 'grow_policy': 'Lossguide', 'min_data_in_leaf': 232, 'max_leaves': 170}. Best is trial 568 with value: 1659.4433932934307.[0m
[32m[I 2024-10-13 13:14:09,573][0m Trial 792 finished with value: 2790.5096652873444 and parameters: {'depth': 5, 'learning_rate': 0.00010476373064499688, 'iterations': 2824, 'l2_leaf_reg': 1.5848763265975682e-07, 'border_count': 8, 'bagging_temperature': 0.12847958470341372, 'random_strength': 3.9439096617721803, 'grow_policy': 'Lossguide', 'min_data_in_leaf': 272, 'max_leaves': 184}. Best is trial 568 with value: 1659.4433932934307.[0m
[32m[I 2024-10-13 13:14:12,216][0m Trial 793 finished with value: 1752.0412536434203 and parameters: {'depth': 6, 'learning_rate': 0.0010690346237494908, 'iterations': 2922, 'l2_leaf_reg': 7.645552593174615e-08, 'border_count': 24, 'bagging_temperature': 0.08638008984108682, 'random_strength': 3.8193812097686077, 'grow_policy': 'Lossguide', 'min_data_in_leaf': 237, 'max_leaves': 177}. Best is trial 568 with value: 1659.4433932934307.[0m
[32m[I 2024-10-13 13:14:14,892][0m Trial 794 finished with value: 2118.091248310647 and parameters: {'depth': 5, 'learning_rate': 0.0023373837992764082, 'iterations': 2871, 'l2_leaf_reg': 1.5452784422189167e-07, 'border_count': 18, 'bagging_temperature': 0.1156382868116498, 'random_strength': 4.310900247290222, 'grow_policy': 'Lossguide', 'min_data_in_leaf': 246, 'max_leaves': 163}. Best is trial 568 with value: 1659.4433932934307.[0m
[32m[I 2024-10-13 13:14:17,480][0m Trial 795 finished with value: 1994.4797387790447 and parameters: {'depth': 7, 'learning_rate': 0.0013571453283108279, 'iterations': 2859, 'l2_leaf_reg': 9.869474452454745e-08, 'border_count': 13, 'bagging_temperature': 0.08110930775508998, 'random_strength': 4.171856703670132, 'grow_policy': 'Lossguide', 'min_data_in_leaf': 258, 'max_leaves': 190}. Best is trial 568 with value: 1659.4433932934307.[0m
[32m[I 2024-10-13 13:14:20,322][0m Trial 796 finished with value: 1720.7904258313908 and parameters: {'depth': 6, 'learning_rate': 0.000847699840233245, 'iterations': 2961, 'l2_leaf_reg': 0.001767400058123505, 'border_count': 27, 'bagging_temperature': 0.0785170532727871, 'random_strength': 4.379101569602255, 'grow_policy': 'Lossguide', 'min_data_in_leaf': 219, 'max_leaves': 157}. Best is trial 568 with value: 1659.4433932934307.[0m
[32m[I 2024-10-13 13:14:23,056][0m Trial 797 finished with value: 2052.2459200401654 and parameters: {'depth': 5, 'learning_rate': 0.001809963841859377, 'iterations': 2991, 'l2_leaf_reg': 6.705036359256623e-08, 'border_count': 21, 'bagging_temperature': 0.42436934276875066, 'random_strength': 4.169523871299016, 'grow_policy': 'Lossguide', 'min_data_in_leaf': 216, 'max_leaves': 134}. Best is trial 568 with value: 1659.4433932934307.[0m
[32m[I 2024-10-13 13:14:25,808][0m Trial 798 finished with value: 2390.878330536146 and parameters: {'depth': 7, 'learning_rate': 0.0011567530304087564, 'iterations': 2917, 'l2_leaf_reg': 1.741147289862013e-07, 'border_count': 3, 'bagging_temperature': 0.10723892948315208, 'random_strength': 4.537296171399391, 'grow_policy': 'Lossguide', 'min_data_in_leaf': 295, 'max_leaves': 140}. Best is trial 568 with value: 1659.4433932934307.[0m
[32m[I 2024-10-13 13:14:28,415][0m Trial 799 finished with value: 1782.2109976852196 and parameters: {'depth': 6, 'learning_rate': 0.00924134496801137, 'iterations': 2798, 'l2_leaf_reg': 5.442624782552734e-05, 'border_count': 28, 'bagging_temperature': 0.06775863635178023, 'random_strength': 3.988555671218394, 'grow_policy': 'Lossguide', 'min_data_in_leaf': 256, 'max_leaves': 175}. Best is trial 568 with value: 1659.4433932934307.[0m
[32m[I 2024-10-13 13:14:31,032][0m Trial 800 finished with value: 2018.7439880830711 and parameters: {'depth': 5, 'learning_rate': 0.0015326752685157273, 'iterations': 2901, 'l2_leaf_reg': 8.617604789572759e-08, 'border_count': 17, 'bagging_temperature': 0.06766190811747529, 'random_strength': 4.467393865665851, 'grow_policy': 'Lossguide', 'min_data_in_leaf': 286, 'max_leaves': 152}. Best is trial 568 with value: 1659.4433932934307.[0m
[32m[I 2024-10-13 13:14:33,576][0m Trial 801 finished with value: 1748.3533450788173 and parameters: {'depth': 6, 'learning_rate': 0.0010616955500277157, 'iterations': 2776, 'l2_leaf_reg': 1.2228302448847894e-07, 'border_count': 24, 'bagging_temperature': 0.09606796107166571, 'random_strength': 4.0552067669424225, 'grow_policy': 'Lossguide', 'min_data_in_leaf': 307, 'max_leaves': 180}. Best is trial 568 with value: 1659.4433932934307.[0m
[32m[I 2024-10-13 13:14:36,176][0m Trial 802 finished with value: 1778.9721180872214 and parameters: {'depth': 7, 'learning_rate': 0.0013475876691609742, 'iterations': 2868, 'l2_leaf_reg': 5.5132583705167605e-08, 'border_count': 31, 'bagging_temperature': 0.7095421689357624, 'random_strength': 4.193416984238597, 'grow_policy': 'Lossguide', 'min_data_in_leaf': 250, 'max_leaves': 171}. Best is trial 568 with value: 1659.4433932934307.[0m
[32m[I 2024-10-13 13:14:53,681][0m Trial 803 finished with value: 2056.745534494883 and parameters: {'depth': 7, 'learning_rate': 0.0007414314995963828, 'iterations': 2922, 'l2_leaf_reg': 1.1935463865514887e-07, 'border_count': 11, 'bagging_temperature': 0.06302233242315984, 'random_strength': 4.423886011478327, 'grow_policy': 'SymmetricTree', 'min_data_in_leaf': 206}. Best is trial 568 with value: 1659.4433932934307.[0m
[32m[I 2024-10-13 13:14:56,327][0m Trial 804 finished with value: 2184.9855724624167 and parameters: {'depth': 7, 'learning_rate': 0.004448810762818756, 'iterations': 2948, 'l2_leaf_reg': 1.957269473686109e-07, 'border_count': 19, 'bagging_temperature': 0.05265570511492594, 'random_strength': 3.8456803223950984, 'grow_policy': 'Lossguide', 'min_data_in_leaf': 287, 'max_leaves': 147}. Best is trial 568 with value: 1659.4433932934307.[0m
[32m[I 2024-10-13 13:14:58,842][0m Trial 805 finished with value: 1749.8166364356828 and parameters: {'depth': 5, 'learning_rate': 0.0019774504597484728, 'iterations': 2752, 'l2_leaf_reg': 0.04582358418006103, 'border_count': 25, 'bagging_temperature': 0.07489749177446547, 'random_strength': 4.610963655328618, 'grow_policy': 'Lossguide', 'min_data_in_leaf': 223, 'max_leaves': 167}. Best is trial 568 with value: 1659.4433932934307.[0m
[32m[I 2024-10-13 13:15:01,612][0m Trial 806 finished with value: 1947.2111643387468 and parameters: {'depth': 7, 'learning_rate': 0.0009364452798825406, 'iterations': 2991, 'l2_leaf_reg': 5.461738834845683e-08, 'border_count': 22, 'bagging_temperature': 0.052449735462694554, 'random_strength': 4.520134796780862, 'grow_policy': 'Lossguide', 'min_data_in_leaf': 274, 'max_leaves': 195}. Best is trial 568 with value: 1659.4433932934307.[0m
[32m[I 2024-10-13 13:15:04,264][0m Trial 807 finished with value: 1769.8069464176501 and parameters: {'depth': 6, 'learning_rate': 0.0015747685377989359, 'iterations': 2834, 'l2_leaf_reg': 7.827672017891151e-08, 'border_count': 30, 'bagging_temperature': 0.09294044869325505, 'random_strength': 4.31407489607572, 'grow_policy': 'Lossguide', 'min_data_in_leaf': 233, 'max_leaves': 126}. Best is trial 568 with value: 1659.4433932934307.[0m
[32m[I 2024-10-13 13:15:06,910][0m Trial 808 finished with value: 1940.1608844643251 and parameters: {'depth': 5, 'learning_rate': 0.0006111781911656868, 'iterations': 2851, 'l2_leaf_reg': 3.0703892842139144e-05, 'border_count': 12, 'bagging_temperature': 0.4882687873581819, 'random_strength': 4.621484133154735, 'grow_policy': 'Lossguide', 'min_data_in_leaf': 314, 'max_leaves': 161}. Best is trial 568 with value: 1659.4433932934307.[0m
[32m[I 2024-10-13 13:15:09,459][0m Trial 809 finished with value: 1965.1535202847579 and parameters: {'depth': 7, 'learning_rate': 0.0011900467999877433, 'iterations': 2810, 'l2_leaf_reg': 4.156137022602333e-08, 'border_count': 16, 'bagging_temperature': 0.16151678872009806, 'random_strength': 4.669509989201238, 'grow_policy': 'Lossguide', 'min_data_in_leaf': 199, 'max_leaves': 136}. Best is trial 568 with value: 1659.4433932934307.[0m
[32m[I 2024-10-13 13:15:12,219][0m Trial 810 finished with value: 1759.9448741888564 and parameters: {'depth': 6, 'learning_rate': 0.002886297920281343, 'iterations': 2879, 'l2_leaf_reg': 0.0003045464214879501, 'border_count': 26, 'bagging_temperature': 0.04808875425524256, 'random_strength': 4.129947616416276, 'grow_policy': 'Depthwise', 'min_data_in_leaf': 185}. Best is trial 568 with value: 1659.4433932934307.[0m
