[32m[I 2024-10-13 12:43:38,902][0m Trial 252 finished with value: 1979.2446717557375 and parameters: {'depth': 5, 'learning_rate': 0.0011194060367683853, 'iterations': 2231, 'l2_leaf_reg': 1.2052858628802274e-07, 'border_count': 15, 'bagging_temperature': 0.05048222656543501, 'random_strength': 5.951859737032297, 'grow_policy': 'Depthwise', 'min_data_in_leaf': 89}. Best is trial 249 with value: 1695.0689015039372.[0m
[32m[I 2024-10-13 12:43:41,140][0m Trial 253 finished with value: 1970.3948097245761 and parameters: {'depth': 6, 'learning_rate': 0.001624609955789733, 'iterations': 2313, 'l2_leaf_reg': 9.325240486845229e-05, 'border_count': 19, 'bagging_temperature': 0.03730383954880699, 'random_strength': 6.064978582912237, 'grow_policy': 'Depthwise', 'min_data_in_leaf': 139}. Best is trial 249 with value: 1695.0689015039372.[0m
[32m[I 2024-10-13 12:43:43,558][0m Trial 254 finished with value: 1722.1849873750857 and parameters: {'depth': 5, 'learning_rate': 0.0012970793061137936, 'iterations': 2486, 'l2_leaf_reg': 2.047413471380271e-07, 'border_count': 28, 'bagging_temperature': 0.013545489574405186, 'random_strength': 5.760323377563966, 'grow_policy': 'Depthwise', 'min_data_in_leaf': 128}. Best is trial 249 with value: 1695.0689015039372.[0m
[32m[I 2024-10-13 12:43:45,665][0m Trial 255 finished with value: 1829.043207255481 and parameters: {'depth': 4, 'learning_rate': 0.0007725109003062379, 'iterations': 2139, 'l2_leaf_reg': 9.669804648604045e-08, 'border_count': 38, 'bagging_temperature': 0.07145453818182519, 'random_strength': 5.437584500724483, 'grow_policy': 'Depthwise', 'min_data_in_leaf': 567}. Best is trial 249 with value: 1695.0689015039372.[0m
[32m[I 2024-10-13 12:43:47,926][0m Trial 256 finished with value: 1940.7516150712356 and parameters: {'depth': 5, 'learning_rate': 0.0009141460870797806, 'iterations': 2357, 'l2_leaf_reg': 3.87501642953166e-08, 'border_count': 22, 'bagging_temperature': 0.05203268365376579, 'random_strength': 6.2463658822150645, 'grow_policy': 'Depthwise', 'min_data_in_leaf': 153}. Best is trial 249 with value: 1695.0689015039372.[0m
[32m[I 2024-10-13 12:43:50,976][0m Trial 257 finished with value: 1786.7470484062676 and parameters: {'depth': 5, 'learning_rate': 0.0011881815083356082, 'iterations': 2542, 'l2_leaf_reg': 2.649593759146279e-07, 'border_count': 31, 'bagging_temperature': 0.0867925007900931, 'random_strength': 6.05229121039947, 'grow_policy': 'Depthwise', 'min_data_in_leaf': 83}. Best is trial 249 with value: 1695.0689015039372.[0m
[32m[I 2024-10-13 12:43:52,832][0m Trial 258 finished with value: 1715.553131569665 and parameters: {'depth': 9, 'learning_rate': 0.0014482932905155433, 'iterations': 1775, 'l2_leaf_reg': 1.6401389322128316e-07, 'border_count': 27, 'bagging_temperature': 0.02608169619895434, 'random_strength': 7.366087188124671, 'grow_policy': 'Depthwise', 'min_data_in_leaf': 194}. Best is trial 249 with value: 1695.0689015039372.[0m
[32m[I 2024-10-13 12:43:54,812][0m Trial 259 finished with value: 1707.5757019365144 and parameters: {'depth': 9, 'learning_rate': 0.0015107805444637894, 'iterations': 1968, 'l2_leaf_reg': 1.811471930035265e-07, 'border_count': 26, 'bagging_temperature': 0.03652579756475662, 'random_strength': 7.511814589452723, 'grow_policy': 'Depthwise', 'min_data_in_leaf': 157}. Best is trial 249 with value: 1695.0689015039372.[0m
[32m[I 2024-10-13 12:43:56,809][0m Trial 260 finished with value: 1948.5939128037166 and parameters: {'depth': 9, 'learning_rate': 0.0015459150992013769, 'iterations': 1945, 'l2_leaf_reg': 2.444977799479985e-07, 'border_count': 15, 'bagging_temperature': 0.03346409332719523, 'random_strength': 7.633629385826387, 'grow_policy': 'Depthwise', 'min_data_in_leaf': 169}. Best is trial 249 with value: 1695.0689015039372.[0m
[32m[I 2024-10-13 12:43:58,667][0m Trial 261 finished with value: 1933.1683527079012 and parameters: {'depth': 9, 'learning_rate': 0.0017203824736456363, 'iterations': 1729, 'l2_leaf_reg': 1.5541179460829095e-07, 'border_count': 21, 'bagging_temperature': 0.015760459776626577, 'random_strength': 7.551825506570001, 'grow_policy': 'Depthwise', 'min_data_in_leaf': 187}. Best is trial 249 with value: 1695.0689015039372.[0m
[32m[I 2024-10-13 12:44:00,695][0m Trial 262 finished with value: 1713.5933802340523 and parameters: {'depth': 9, 'learning_rate': 0.001409561335028066, 'iterations': 1975, 'l2_leaf_reg': 6.626409027565118e-08, 'border_count': 27, 'bagging_temperature': 0.038083158118288524, 'random_strength': 7.344488893227916, 'grow_policy': 'Depthwise', 'min_data_in_leaf': 155}. Best is trial 249 with value: 1695.0689015039372.[0m
[32m[I 2024-10-13 12:44:20,004][0m Trial 263 finished with value: 2068.674797651967 and parameters: {'depth': 9, 'learning_rate': 0.002038817210750207, 'iterations': 1979, 'l2_leaf_reg': 5.959833050593572e-08, 'border_count': 24, 'bagging_temperature': 0.0013249331962705557, 'random_strength': 7.730169138053574, 'grow_policy': 'SymmetricTree', 'min_data_in_leaf': 170}. Best is trial 249 with value: 1695.0689015039372.[0m
[32m[I 2024-10-13 12:44:22,077][0m Trial 264 finished with value: 1715.9501811148762 and parameters: {'depth': 9, 'learning_rate': 0.001417286725560365, 'iterations': 2106, 'l2_leaf_reg': 4.596119464873227e-08, 'border_count': 27, 'bagging_temperature': 0.03749543589196758, 'random_strength': 6.233037736923892, 'grow_policy': 'Depthwise', 'min_data_in_leaf': 157}. Best is trial 249 with value: 1695.0689015039372.[0m
[32m[I 2024-10-13 12:44:24,081][0m Trial 265 finished with value: 1930.5918801480211 and parameters: {'depth': 9, 'learning_rate': 0.001417390201142568, 'iterations': 1887, 'l2_leaf_reg': 3.6738211734632826e-08, 'border_count': 17, 'bagging_temperature': 0.037141424952441035, 'random_strength': 7.377930138047134, 'grow_policy': 'Depthwise', 'min_data_in_leaf': 125}. Best is trial 249 with value: 1695.0689015039372.[0m
[32m[I 2024-10-13 12:44:26,255][0m Trial 266 finished with value: 2062.2607662085597 and parameters: {'depth': 9, 'learning_rate': 0.0018329729575265804, 'iterations': 1810, 'l2_leaf_reg': 5.979239902580368e-08, 'border_count': 10, 'bagging_temperature': 0.026715477532676633, 'random_strength': 7.536448343096363, 'grow_policy': 'Depthwise', 'min_data_in_leaf': 85}. Best is trial 249 with value: 1695.0689015039372.[0m
[32m[I 2024-10-13 12:44:28,342][0m Trial 267 finished with value: 1701.7834533196249 and parameters: {'depth': 9, 'learning_rate': 0.0015367841596512497, 'iterations': 2075, 'l2_leaf_reg': 4.0991804696309156e-08, 'border_count': 25, 'bagging_temperature': 0.04417966629451704, 'random_strength': 7.405227217772332, 'grow_policy': 'Depthwise', 'min_data_in_leaf': 147}. Best is trial 249 with value: 1695.0689015039372.[0m
[32m[I 2024-10-13 12:44:30,393][0m Trial 268 finished with value: 2072.072421551367 and parameters: {'depth': 9, 'learning_rate': 0.0015729327586514268, 'iterations': 2049, 'l2_leaf_reg': 3.673201397049251e-08, 'border_count': 137, 'bagging_temperature': 0.0520827655831299, 'random_strength': 7.345073881681966, 'grow_policy': 'Depthwise', 'min_data_in_leaf': 155}. Best is trial 249 with value: 1695.0689015039372.[0m
[32m[I 2024-10-13 12:44:32,437][0m Trial 269 finished with value: 2415.8896000638415 and parameters: {'depth': 9, 'learning_rate': 0.02805333657671417, 'iterations': 2020, 'l2_leaf_reg': 2.8966740860995806e-08, 'border_count': 20, 'bagging_temperature': 0.060408443142034196, 'random_strength': 7.8816799068910015, 'grow_policy': 'Depthwise', 'min_data_in_leaf': 149}. Best is trial 249 with value: 1695.0689015039372.[0m
[32m[I 2024-10-13 12:44:34,585][0m Trial 270 finished with value: 1731.7344211083007 and parameters: {'depth': 9, 'learning_rate': 0.0019401820645653918, 'iterations': 2120, 'l2_leaf_reg': 4.422628503509523e-08, 'border_count': 25, 'bagging_temperature': 0.013275449093881106, 'random_strength': 7.287954132767837, 'grow_policy': 'Depthwise', 'min_data_in_leaf': 112}. Best is trial 249 with value: 1695.0689015039372.[0m
[32m[I 2024-10-13 12:44:36,570][0m Trial 271 finished with value: 1704.6964100394994 and parameters: {'depth': 9, 'learning_rate': 0.0014607176889485391, 'iterations': 1943, 'l2_leaf_reg': 6.453365971683375e-08, 'border_count': 26, 'bagging_temperature': 0.0005813522283734038, 'random_strength': 7.290062838918887, 'grow_policy': 'Depthwise', 'min_data_in_leaf': 130}. Best is trial 249 with value: 1695.0689015039372.[0m
[32m[I 2024-10-13 12:44:38,569][0m Trial 272 finished with value: 1945.6242576453258 and parameters: {'depth': 9, 'learning_rate': 0.0016649306167475465, 'iterations': 1959, 'l2_leaf_reg': 5.667253241532674e-08, 'border_count': 20, 'bagging_temperature': 0.001629047472697345, 'random_strength': 7.541026978241557, 'grow_policy': 'Depthwise', 'min_data_in_leaf': 111}. Best is trial 249 with value: 1695.0689015039372.[0m
[32m[I 2024-10-13 12:44:40,519][0m Trial 273 finished with value: 1898.465207334476 and parameters: {'depth': 9, 'learning_rate': 0.001448201745601928, 'iterations': 1887, 'l2_leaf_reg': 6.959834087484275e-08, 'border_count': 12, 'bagging_temperature': 0.023334115093682353, 'random_strength': 7.213919802344379, 'grow_policy': 'Depthwise', 'min_data_in_leaf': 142}. Best is trial 249 with value: 1695.0689015039372.[0m
[32m[I 2024-10-13 12:44:42,244][0m Trial 274 finished with value: 1734.8242793643233 and parameters: {'depth': 9, 'learning_rate': 0.0013887249627127338, 'iterations': 1605, 'l2_leaf_reg': 8.652529253160875e-08, 'border_count': 26, 'bagging_temperature': 0.0002540995436950688, 'random_strength': 7.42592597585073, 'grow_policy': 'Depthwise', 'min_data_in_leaf': 156}. Best is trial 249 with value: 1695.0689015039372.[0m
[32m[I 2024-10-13 12:44:44,355][0m Trial 275 finished with value: 1954.7956911277279 and parameters: {'depth': 9, 'learning_rate': 0.0023168434103347747, 'iterations': 2084, 'l2_leaf_reg': 4.53764668637128e-08, 'border_count': 91, 'bagging_temperature': 0.042354053287071064, 'random_strength': 7.71105583069847, 'grow_policy': 'Depthwise', 'min_data_in_leaf': 141}. Best is trial 249 with value: 1695.0689015039372.[0m
[32m[I 2024-10-13 12:44:46,432][0m Trial 276 finished with value: 1969.790547231684 and parameters: {'depth': 9, 'learning_rate': 0.0018461995762370233, 'iterations': 1981, 'l2_leaf_reg': 2.7077465924600205e-08, 'border_count': 17, 'bagging_temperature': 0.3023948826613795, 'random_strength': 7.097275055591579, 'grow_policy': 'Depthwise', 'min_data_in_leaf': 129}. Best is trial 249 with value: 1695.0689015039372.[0m
[32m[I 2024-10-13 12:44:48,812][0m Trial 277 finished with value: 1751.3747494689217 and parameters: {'depth': 9, 'learning_rate': 0.0015764951906913696, 'iterations': 2043, 'l2_leaf_reg': 9.101956876879339e-08, 'border_count': 26, 'bagging_temperature': 0.06041635485788491, 'random_strength': 7.399280601622243, 'grow_policy': 'Depthwise', 'min_data_in_leaf': 94}. Best is trial 249 with value: 1695.0689015039372.[0m
[32m[I 2024-10-13 12:44:50,959][0m Trial 278 finished with value: 2462.844991947228 and parameters: {'depth': 9, 'learning_rate': 0.11115001085269807, 'iterations': 2122, 'l2_leaf_reg': 1.0658068596885553e-07, 'border_count': 22, 'bagging_temperature': 0.03651506850949543, 'random_strength': 6.5301130192727, 'grow_policy': 'Depthwise', 'min_data_in_leaf': 170}. Best is trial 249 with value: 1695.0689015039372.[0m
[32m[I 2024-10-13 12:44:52,858][0m Trial 279 finished with value: 1720.5440718565753 and parameters: {'depth': 9, 'learning_rate': 0.00127390015181315, 'iterations': 1904, 'l2_leaf_reg': 5.2004511951792474e-08, 'border_count': 28, 'bagging_temperature': 0.020466254565879975, 'random_strength': 6.394519330243849, 'grow_policy': 'Depthwise', 'min_data_in_leaf': 118}. Best is trial 249 with value: 1695.0689015039372.[0m
[32m[I 2024-10-13 12:44:54,733][0m Trial 280 finished with value: 1931.9514207720258 and parameters: {'depth': 9, 'learning_rate': 0.0014117272603733975, 'iterations': 1843, 'l2_leaf_reg': 8.018176829186479e-08, 'border_count': 16, 'bagging_temperature': 0.04629750067222958, 'random_strength': 6.146336660144486, 'grow_policy': 'Depthwise', 'min_data_in_leaf': 180}. Best is trial 249 with value: 1695.0689015039372.[0m
[32m[I 2024-10-13 12:45:17,722][0m Trial 281 finished with value: 2053.2400425898795 and parameters: {'depth': 9, 'learning_rate': 0.0010250816478931247, 'iterations': 2012, 'l2_leaf_reg': 1.2620142848149828e-07, 'border_count': 29, 'bagging_temperature': 0.0647525764853689, 'random_strength': 7.236445732146874, 'grow_policy': 'SymmetricTree', 'min_data_in_leaf': 143}. Best is trial 249 with value: 1695.0689015039372.[0m
[32m[I 2024-10-13 12:45:19,745][0m Trial 282 finished with value: 1923.1107324103516 and parameters: {'depth': 9, 'learning_rate': 0.0013187149965661908, 'iterations': 2083, 'l2_leaf_reg': 2.0949566537698106e-08, 'border_count': 21, 'bagging_temperature': 0.017887751556139225, 'random_strength': 6.515699192295695, 'grow_policy': 'Depthwise', 'min_data_in_leaf': 160}. Best is trial 249 with value: 1695.0689015039372.[0m
[32m[I 2024-10-13 12:45:21,568][0m Trial 283 finished with value: 1697.7343019828668 and parameters: {'depth': 9, 'learning_rate': 0.001713923867048231, 'iterations': 1743, 'l2_leaf_reg': 1.7401258837171742e-07, 'border_count': 25, 'bagging_temperature': 0.036607064314396795, 'random_strength': 6.9530599782718046, 'grow_policy': 'Depthwise', 'min_data_in_leaf': 131}. Best is trial 249 with value: 1695.0689015039372.[0m
[32m[I 2024-10-13 12:45:23,244][0m Trial 284 finished with value: 1751.1872892853698 and parameters: {'depth': 8, 'learning_rate': 0.0022229048562480347, 'iterations': 1513, 'l2_leaf_reg': 1.36227709093628e-07, 'border_count': 24, 'bagging_temperature': 0.00023253877757851982, 'random_strength': 6.969087377981308, 'grow_policy': 'Depthwise', 'min_data_in_leaf': 125}. Best is trial 249 with value: 1695.0689015039372.[0m
[32m[I 2024-10-13 12:45:25,341][0m Trial 285 finished with value: 1713.3924077088293 and parameters: {'depth': 9, 'learning_rate': 0.0017888034894957179, 'iterations': 1740, 'l2_leaf_reg': 7.43425348032551e-08, 'border_count': 9, 'bagging_temperature': 0.07022661516622863, 'random_strength': 7.299020885741576, 'grow_policy': 'Depthwise', 'min_data_in_leaf': 68}. Best is trial 249 with value: 1695.0689015039372.[0m
[32m[I 2024-10-13 12:45:27,170][0m Trial 286 finished with value: 1713.581607983661 and parameters: {'depth': 9, 'learning_rate': 0.0018968360578170429, 'iterations': 1736, 'l2_leaf_reg': 7.396692718588433e-08, 'border_count': 8, 'bagging_temperature': 0.052769747131773126, 'random_strength': 7.731076341670553, 'grow_policy': 'Depthwise', 'min_data_in_leaf': 99}. Best is trial 249 with value: 1695.0689015039372.[0m
[32m[I 2024-10-13 12:45:29,472][0m Trial 287 finished with value: 1887.3624510672928 and parameters: {'depth': 9, 'learning_rate': 0.002513725061638885, 'iterations': 1698, 'l2_leaf_reg': 3.683773332208395e-08, 'border_count': 8, 'bagging_temperature': 0.07185878154308833, 'random_strength': 7.6660917218511075, 'grow_policy': 'Depthwise', 'min_data_in_leaf': 54}. Best is trial 249 with value: 1695.0689015039372.[0m
[32m[I 2024-10-13 12:45:31,798][0m Trial 288 finished with value: 1784.4769078457712 and parameters: {'depth': 9, 'learning_rate': 0.0019701800549434528, 'iterations': 1879, 'l2_leaf_reg': 8.42714459648232e-08, 'border_count': 8, 'bagging_temperature': 0.05389151231427887, 'random_strength': 7.863255816467353, 'grow_policy': 'Depthwise', 'min_data_in_leaf': 65}. Best is trial 249 with value: 1695.0689015039372.[0m
[32m[I 2024-10-13 12:45:33,878][0m Trial 289 finished with value: 2034.6989101354113 and parameters: {'depth': 8, 'learning_rate': 0.0018163961479765753, 'iterations': 1646, 'l2_leaf_reg': 5.072581215544392e-08, 'border_count': 10, 'bagging_temperature': 0.07478420646321231, 'random_strength': 7.491339883455396, 'grow_policy': 'Depthwise', 'min_data_in_leaf': 79}. Best is trial 249 with value: 1695.0689015039372.[0m
[32m[I 2024-10-13 12:45:37,109][0m Trial 290 finished with value: 1876.0212119883988 and parameters: {'depth': 9, 'learning_rate': 0.0016650303142803017, 'iterations': 1728, 'l2_leaf_reg': 6.053650972669266e-08, 'border_count': 7, 'bagging_temperature': 0.04590886498307424, 'random_strength': 7.292222550014361, 'grow_policy': 'Depthwise', 'min_data_in_leaf': 24}. Best is trial 249 with value: 1695.0689015039372.[0m
[32m[I 2024-10-13 12:45:38,960][0m Trial 291 finished with value: 1977.5652674102644 and parameters: {'depth': 9, 'learning_rate': 0.002056115416891156, 'iterations': 1748, 'l2_leaf_reg': 3.1399882840400175e-08, 'border_count': 14, 'bagging_temperature': 0.021410530664462718, 'random_strength': 7.470742445454171, 'grow_policy': 'Depthwise', 'min_data_in_leaf': 104}. Best is trial 249 with value: 1695.0689015039372.[0m
[32m[I 2024-10-13 12:45:40,798][0m Trial 292 finished with value: 2384.3962300629923 and parameters: {'depth': 9, 'learning_rate': 0.0017196939390702467, 'iterations': 1792, 'l2_leaf_reg': 1.1171412338958005e-07, 'border_count': 4, 'bagging_temperature': 0.06268648171655501, 'random_strength': 7.744684221115726, 'grow_policy': 'Depthwise', 'min_data_in_leaf': 100}. Best is trial 249 with value: 1695.0689015039372.[0m
[32m[I 2024-10-13 12:45:42,651][0m Trial 293 finished with value: 1933.9314435953186 and parameters: {'depth': 8, 'learning_rate': 0.0014396889846374967, 'iterations': 1851, 'l2_leaf_reg': 6.80742957406787e-08, 'border_count': 16, 'bagging_temperature': 0.04196571477958327, 'random_strength': 7.130693003039423, 'grow_policy': 'Depthwise', 'min_data_in_leaf': 124}. Best is trial 249 with value: 1695.0689015039372.[0m
[32m[I 2024-10-13 12:45:44,611][0m Trial 294 finished with value: 1933.597631061578 and parameters: {'depth': 9, 'learning_rate': 0.0015380261673361914, 'iterations': 1958, 'l2_leaf_reg': 7.816778481361212e-08, 'border_count': 19, 'bagging_temperature': 0.018708134863483963, 'random_strength': 7.2715725360580015, 'grow_policy': 'Depthwise', 'min_data_in_leaf': 106}. Best is trial 249 with value: 1695.0689015039372.[0m
[32m[I 2024-10-13 12:45:46,994][0m Trial 295 finished with value: 2570.4369571237135 and parameters: {'depth': 9, 'learning_rate': 0.0019339420590303417, 'iterations': 2182, 'l2_leaf_reg': 1.7611225970139312e-07, 'border_count': 2, 'bagging_temperature': 0.08212604365519499, 'random_strength': 8.106240668208411, 'grow_policy': 'Depthwise', 'min_data_in_leaf': 79}. Best is trial 249 with value: 1695.0689015039372.[0m
[32m[I 2024-10-13 12:45:48,886][0m Trial 296 finished with value: 2023.894018209606 and parameters: {'depth': 9, 'learning_rate': 0.002523680197274267, 'iterations': 1763, 'l2_leaf_reg': 1.0575930544481899e-07, 'border_count': 16, 'bagging_temperature': 0.054116082723195943, 'random_strength': 5.809240591777284, 'grow_policy': 'Depthwise', 'min_data_in_leaf': 144}. Best is trial 249 with value: 1695.0689015039372.[0m
[32m[I 2024-10-13 12:45:51,521][0m Trial 297 finished with value: 2815.8899388880595 and parameters: {'depth': 8, 'learning_rate': 0.001635362941977066, 'iterations': 1818, 'l2_leaf_reg': 3.558036722172476e-08, 'border_count': 1, 'bagging_temperature': 0.03368073977698194, 'random_strength': 7.581153666664626, 'grow_policy': 'Depthwise', 'min_data_in_leaf': 35}. Best is trial 249 with value: 1695.0689015039372.[0m
[32m[I 2024-10-13 12:45:53,321][0m Trial 298 finished with value: 2082.543821035342 and parameters: {'depth': 9, 'learning_rate': 0.003250095351720936, 'iterations': 1663, 'l2_leaf_reg': 4.864802486926584e-08, 'border_count': 22, 'bagging_temperature': 0.07621458621768579, 'random_strength': 6.974447193654114, 'grow_policy': 'Depthwise', 'min_data_in_leaf': 130}. Best is trial 249 with value: 1695.0689015039372.[0m
[32m[I 2024-10-13 12:45:55,054][0m Trial 299 finished with value: 1893.6753454375398 and parameters: {'depth': 9, 'learning_rate': 0.0014134984914168, 'iterations': 1604, 'l2_leaf_reg': 1.4055174388035448e-07, 'border_count': 11, 'bagging_temperature': 0.02196159042834425, 'random_strength': 5.8941126979174365, 'grow_policy': 'Depthwise', 'min_data_in_leaf': 172}. Best is trial 249 with value: 1695.0689015039372.[0m
[32m[I 2024-10-13 12:45:57,190][0m Trial 300 finished with value: 1964.748759573728 and parameters: {'depth': 9, 'learning_rate': 0.0009118900114120282, 'iterations': 2063, 'l2_leaf_reg': 2.3334092075113603e-08, 'border_count': 107, 'bagging_temperature': 0.05083116753687854, 'random_strength': 7.781621134942979, 'grow_policy': 'Depthwise', 'min_data_in_leaf': 355}. Best is trial 249 with value: 1695.0689015039372.[0m
[32m[I 2024-10-13 12:45:59,215][0m Trial 301 finished with value: 1744.1868611850607 and parameters: {'depth': 9, 'learning_rate': 0.0015825803827420072, 'iterations': 1948, 'l2_leaf_reg': 7.841047710846217e-08, 'border_count': 24, 'bagging_temperature': 0.012031064873880788, 'random_strength': 5.729999276588609, 'grow_policy': 'Depthwise', 'min_data_in_leaf': 112}. Best is trial 249 with value: 1695.0689015039372.[0m
[32m[I 2024-10-13 12:46:01,887][0m Trial 302 finished with value: 1770.6566458358855 and parameters: {'depth': 9, 'learning_rate': 0.001004690689671382, 'iterations': 2125, 'l2_leaf_reg': 0.00038110496868664425, 'border_count': 32, 'bagging_temperature': 0.037994857859535894, 'random_strength': 7.30961856605146, 'grow_policy': 'Depthwise', 'min_data_in_leaf': 65}. Best is trial 249 with value: 1695.0689015039372.[0m
