[32m[I 2024-10-13 13:03:18,734][0m Trial 608 finished with value: 1759.8776613611562 and parameters: {'depth': 9, 'learning_rate': 0.0011270947560807335, 'iterations': 2408, 'l2_leaf_reg': 1.5333067112981956e-07, 'border_count': 95, 'bagging_temperature': 0.03496800908774142, 'random_strength': 5.222739546446801, 'grow_policy': 'Depthwise', 'min_data_in_leaf': 193}. Best is trial 568 with value: 1659.4433932934307.[0m
[32m[I 2024-10-13 13:03:22,566][0m Trial 609 finished with value: 1794.978483531453 and parameters: {'depth': 8, 'learning_rate': 0.0009166394766731316, 'iterations': 1962, 'l2_leaf_reg': 6.014661485570368e-08, 'border_count': 32, 'bagging_temperature': 0.04413932197532941, 'random_strength': 6.976697507555103, 'grow_policy': 'Lossguide', 'min_data_in_leaf': 359, 'max_leaves': 192}. Best is trial 568 with value: 1659.4433932934307.[0m
[32m[I 2024-10-13 13:03:27,658][0m Trial 610 finished with value: 1990.3507569084259 and parameters: {'depth': 10, 'learning_rate': 0.0013580582214586827, 'iterations': 2819, 'l2_leaf_reg': 2.043889100829082e-08, 'border_count': 22, 'bagging_temperature': 0.000584267821085227, 'random_strength': 5.757766305224923, 'grow_policy': 'Depthwise', 'min_data_in_leaf': 164}. Best is trial 568 with value: 1659.4433932934307.[0m
[32m[I 2024-10-13 13:03:29,597][0m Trial 611 finished with value: 1997.7164347798573 and parameters: {'depth': 10, 'learning_rate': 0.001753252831297013, 'iterations': 886, 'l2_leaf_reg': 3.884459577977754e-08, 'border_count': 14, 'bagging_temperature': 0.07310723072580858, 'random_strength': 6.526471585922877, 'grow_policy': 'Depthwise', 'min_data_in_leaf': 115}. Best is trial 568 with value: 1659.4433932934307.[0m
[32m[I 2024-10-13 13:04:00,612][0m Trial 612 finished with value: 1994.1054485037503 and parameters: {'depth': 9, 'learning_rate': 0.001231564417803104, 'iterations': 2134, 'l2_leaf_reg': 2.748131228504126e-07, 'border_count': 40, 'bagging_temperature': 0.030658504075662132, 'random_strength': 5.614501570602816, 'grow_policy': 'SymmetricTree', 'min_data_in_leaf': 412}. Best is trial 568 with value: 1659.4433932934307.[0m
[32m[I 2024-10-13 13:04:02,609][0m Trial 613 finished with value: 1745.3215231099505 and parameters: {'depth': 9, 'learning_rate': 0.0010409224742541072, 'iterations': 2042, 'l2_leaf_reg': 9.952065924659115e-08, 'border_count': 29, 'bagging_temperature': 0.05369200642144893, 'random_strength': 8.577808101806422, 'grow_policy': 'Depthwise', 'min_data_in_leaf': 130}. Best is trial 568 with value: 1659.4433932934307.[0m
[32m[I 2024-10-13 13:04:04,811][0m Trial 614 finished with value: 1706.637913763045 and parameters: {'depth': 8, 'learning_rate': 0.0015618501981258057, 'iterations': 2191, 'l2_leaf_reg': 0.011679382814843495, 'border_count': 25, 'bagging_temperature': 0.02170384150246325, 'random_strength': 8.106476899755533, 'grow_policy': 'Lossguide', 'min_data_in_leaf': 330, 'max_leaves': 156}. Best is trial 568 with value: 1659.4433932934307.[0m
[32m[I 2024-10-13 13:04:07,014][0m Trial 615 finished with value: 2143.8978018908715 and parameters: {'depth': 3, 'learning_rate': 0.0033819149779127176, 'iterations': 2202, 'l2_leaf_reg': 0.004961753702135137, 'border_count': 17, 'bagging_temperature': 0.01629709721148228, 'random_strength': 7.868413991972892, 'grow_policy': 'Depthwise', 'min_data_in_leaf': 310}. Best is trial 568 with value: 1659.4433932934307.[0m
[32m[I 2024-10-13 13:04:09,284][0m Trial 616 finished with value: 2013.9537449735456 and parameters: {'depth': 11, 'learning_rate': 0.001666620870255704, 'iterations': 2241, 'l2_leaf_reg': 0.0015535176360081553, 'border_count': 22, 'bagging_temperature': 0.5232531156170909, 'random_strength': 5.949811744398355, 'grow_policy': 'Depthwise', 'min_data_in_leaf': 347}. Best is trial 568 with value: 1659.4433932934307.[0m
[32m[I 2024-10-13 13:04:11,577][0m Trial 617 finished with value: 1694.749635346758 and parameters: {'depth': 8, 'learning_rate': 0.001292609166179184, 'iterations': 2282, 'l2_leaf_reg': 6.7633815290384e-07, 'border_count': 25, 'bagging_temperature': 0.02001723075063249, 'random_strength': 5.3204123263937, 'grow_policy': 'Depthwise', 'min_data_in_leaf': 313}. Best is trial 568 with value: 1659.4433932934307.[0m
[32m[I 2024-10-13 13:04:13,795][0m Trial 618 finished with value: 1942.6755373015815 and parameters: {'depth': 8, 'learning_rate': 0.0013911871996989487, 'iterations': 2255, 'l2_leaf_reg': 1.9842427331887968e-06, 'border_count': 18, 'bagging_temperature': 0.018756580436134304, 'random_strength': 5.046177117238637, 'grow_policy': 'Lossguide', 'min_data_in_leaf': 329, 'max_leaves': 147}. Best is trial 568 with value: 1659.4433932934307.[0m
[32m[I 2024-10-13 13:04:15,971][0m Trial 619 finished with value: 1786.9504374973797 and parameters: {'depth': 8, 'learning_rate': 0.0019386673737377524, 'iterations': 2185, 'l2_leaf_reg': 0.013071556007559009, 'border_count': 24, 'bagging_temperature': 0.00041399106050681153, 'random_strength': 9.572216613951054, 'grow_policy': 'Depthwise', 'min_data_in_leaf': 287}. Best is trial 568 with value: 1659.4433932934307.[0m
[32m[I 2024-10-13 13:04:18,139][0m Trial 620 finished with value: 2003.4885648624543 and parameters: {'depth': 8, 'learning_rate': 0.0012811555318938768, 'iterations': 2121, 'l2_leaf_reg': 0.032186250140906134, 'border_count': 160, 'bagging_temperature': 0.0226548290158425, 'random_strength': 5.290361097393168, 'grow_policy': 'Depthwise', 'min_data_in_leaf': 308}. Best is trial 568 with value: 1659.4433932934307.[0m
[32m[I 2024-10-13 13:04:20,410][0m Trial 621 finished with value: 1982.721098892669 and parameters: {'depth': 8, 'learning_rate': 0.0016224484612961663, 'iterations': 2267, 'l2_leaf_reg': 0.019024571024318832, 'border_count': 13, 'bagging_temperature': 0.03505533717656345, 'random_strength': 4.969739146118991, 'grow_policy': 'Depthwise', 'min_data_in_leaf': 306}. Best is trial 568 with value: 1659.4433932934307.[0m
[32m[I 2024-10-13 13:04:22,545][0m Trial 622 finished with value: 1976.4407699881103 and parameters: {'depth': 7, 'learning_rate': 0.033192149489708694, 'iterations': 2176, 'l2_leaf_reg': 5.925488904329017e-07, 'border_count': 25, 'bagging_temperature': 0.01805929613303618, 'random_strength': 0.1850216514568439, 'grow_policy': 'Lossguide', 'min_data_in_leaf': 318, 'max_leaves': 154}. Best is trial 568 with value: 1659.4433932934307.[0m
[32m[I 2024-10-13 13:04:24,662][0m Trial 623 finished with value: 1725.2104171639378 and parameters: {'depth': 8, 'learning_rate': 0.0011030732092247165, 'iterations': 2137, 'l2_leaf_reg': 1.3529868116415679e-06, 'border_count': 29, 'bagging_temperature': 0.04774722085476223, 'random_strength': 5.188456299801993, 'grow_policy': 'Depthwise', 'min_data_in_leaf': 336}. Best is trial 568 with value: 1659.4433932934307.[0m
[32m[I 2024-10-13 13:04:28,291][0m Trial 624 finished with value: 2165.1033109156087 and parameters: {'depth': 8, 'learning_rate': 0.004170807121840884, 'iterations': 2313, 'l2_leaf_reg': 7.702475610525644e-07, 'border_count': 19, 'bagging_temperature': 0.017663840092359172, 'random_strength': 8.006345365660389, 'grow_policy': 'Depthwise', 'min_data_in_leaf': 283}. Best is trial 568 with value: 1659.4433932934307.[0m
[32m[I 2024-10-13 13:04:32,547][0m Trial 625 finished with value: 2060.6027561954243 and parameters: {'depth': 8, 'learning_rate': 0.0024103796612013027, 'iterations': 2102, 'l2_leaf_reg': 0.022548071729308252, 'border_count': 22, 'bagging_temperature': 0.036102014924896376, 'random_strength': 4.679625010954526, 'grow_policy': 'Depthwise', 'min_data_in_leaf': 311}. Best is trial 568 with value: 1659.4433932934307.[0m
[32m[I 2024-10-13 13:04:36,943][0m Trial 626 finished with value: 1971.5467684536734 and parameters: {'depth': 8, 'learning_rate': 0.0007866901686179327, 'iterations': 2209, 'l2_leaf_reg': 0.005744423759274957, 'border_count': 15, 'bagging_temperature': 0.015287576726119963, 'random_strength': 6.750003775743129, 'grow_policy': 'Depthwise', 'min_data_in_leaf': 295}. Best is trial 568 with value: 1659.4433932934307.[0m
[32m[I 2024-10-13 13:04:41,335][0m Trial 627 finished with value: 1719.917257202233 and parameters: {'depth': 8, 'learning_rate': 0.001489447569617601, 'iterations': 2157, 'l2_leaf_reg': 0.22893242896947436, 'border_count': 28, 'bagging_temperature': 0.0538245221301209, 'random_strength': 5.472023306395183, 'grow_policy': 'Lossguide', 'min_data_in_leaf': 320, 'max_leaves': 128}. Best is trial 568 with value: 1659.4433932934307.[0m
[32m[I 2024-10-13 13:04:44,728][0m Trial 628 finished with value: 1762.331825256925 and parameters: {'depth': 7, 'learning_rate': 0.0019193613143299502, 'iterations': 2272, 'l2_leaf_reg': 0.011398245866494433, 'border_count': 32, 'bagging_temperature': 0.03398140751269279, 'random_strength': 6.997582507311694, 'grow_policy': 'Depthwise', 'min_data_in_leaf': 264}. Best is trial 568 with value: 1659.4433932934307.[0m
[32m[I 2024-10-13 13:04:46,605][0m Trial 629 finished with value: 2093.747627866935 and parameters: {'depth': 8, 'learning_rate': 0.000910958793034107, 'iterations': 1148, 'l2_leaf_reg': 0.0034664524910335615, 'border_count': 25, 'bagging_temperature': 0.0010096636084877444, 'random_strength': 4.881420017794149, 'grow_policy': 'Depthwise', 'min_data_in_leaf': 342}. Best is trial 568 with value: 1659.4433932934307.[0m
[32m[I 2024-10-13 13:04:48,316][0m Trial 630 finished with value: 2045.4076660565531 and parameters: {'depth': 12, 'learning_rate': 0.0013002012150898903, 'iterations': 1019, 'l2_leaf_reg': 5.4769405644659175e-06, 'border_count': 20, 'bagging_temperature': 0.018261774457145476, 'random_strength': 7.612929276916544, 'grow_policy': 'Depthwise', 'min_data_in_leaf': 279}. Best is trial 568 with value: 1659.4433932934307.[0m
[32m[I 2024-10-13 13:04:51,018][0m Trial 631 finished with value: 2045.145625120896 and parameters: {'depth': 8, 'learning_rate': 0.0016509584637180417, 'iterations': 2927, 'l2_leaf_reg': 6.092280299841341e-07, 'border_count': 13, 'bagging_temperature': 0.0012441890551372846, 'random_strength': 8.116617830668588, 'grow_policy': 'Lossguide', 'min_data_in_leaf': 333, 'max_leaves': 182}. Best is trial 568 with value: 1659.4433932934307.[0m
[32m[I 2024-10-13 13:04:53,196][0m Trial 632 finished with value: 1725.5572265647945 and parameters: {'depth': 8, 'learning_rate': 0.001114821378763242, 'iterations': 2097, 'l2_leaf_reg': 8.856387351183244e-07, 'border_count': 29, 'bagging_temperature': 0.04854987994083854, 'random_strength': 5.287579565902702, 'grow_policy': 'Depthwise', 'min_data_in_leaf': 369}. Best is trial 568 with value: 1659.4433932934307.[0m
[32m[I 2024-10-13 13:04:55,483][0m Trial 633 finished with value: 1795.9788104847464 and parameters: {'depth': 4, 'learning_rate': 0.0022397102884110895, 'iterations': 2327, 'l2_leaf_reg': 3.834456867111497e-07, 'border_count': 24, 'bagging_temperature': 0.03389872316518551, 'random_strength': 7.160584910942478, 'grow_policy': 'Depthwise', 'min_data_in_leaf': 339}. Best is trial 568 with value: 1659.4433932934307.[0m
[32m[I 2024-10-13 13:04:57,710][0m Trial 634 finished with value: 1923.0938199321113 and parameters: {'depth': 7, 'learning_rate': 0.0013609689094669555, 'iterations': 2191, 'l2_leaf_reg': 0.00790295174477337, 'border_count': 19, 'bagging_temperature': 0.44079190194404694, 'random_strength': 7.454673349124552, 'grow_policy': 'Depthwise', 'min_data_in_leaf': 314}. Best is trial 568 with value: 1659.4433932934307.[0m
[32m[I 2024-10-13 13:05:14,687][0m Trial 635 finished with value: 2031.4529347170796 and parameters: {'depth': 9, 'learning_rate': 0.0017563599112857603, 'iterations': 1368, 'l2_leaf_reg': 0.06926116563031988, 'border_count': 33, 'bagging_temperature': 0.05250735725079335, 'random_strength': 8.327289145238561, 'grow_policy': 'SymmetricTree', 'min_data_in_leaf': 670}. Best is trial 568 with value: 1659.4433932934307.[0m
[32m[I 2024-10-13 13:05:16,820][0m Trial 636 finished with value: 1755.8570346666747 and parameters: {'depth': 9, 'learning_rate': 0.0009853614889431196, 'iterations': 2066, 'l2_leaf_reg': 8.379599331059171e-07, 'border_count': 27, 'bagging_temperature': 0.018296840906358358, 'random_strength': 8.00018462933728, 'grow_policy': 'Depthwise', 'min_data_in_leaf': 357}. Best is trial 568 with value: 1659.4433932934307.[0m
[32m[I 2024-10-13 13:05:19,006][0m Trial 637 finished with value: 1933.7384410292323 and parameters: {'depth': 13, 'learning_rate': 0.0012045209765022971, 'iterations': 2238, 'l2_leaf_reg': 4.53101757695188e-07, 'border_count': 17, 'bagging_temperature': 0.03148211086339778, 'random_strength': 7.652244856250385, 'grow_policy': 'Lossguide', 'min_data_in_leaf': 303, 'max_leaves': 143}. Best is trial 568 with value: 1659.4433932934307.[0m
[32m[I 2024-10-13 13:05:21,182][0m Trial 638 finished with value: 1968.1148653112407 and parameters: {'depth': 7, 'learning_rate': 0.0015472813498469257, 'iterations': 2151, 'l2_leaf_reg': 0.0030983695193044776, 'border_count': 22, 'bagging_temperature': 0.000911764713787927, 'random_strength': 5.1021921586513646, 'grow_policy': 'Depthwise', 'min_data_in_leaf': 155}. Best is trial 568 with value: 1659.4433932934307.[0m
[32m[I 2024-10-13 13:05:25,614][0m Trial 639 finished with value: 1796.4117752615155 and parameters: {'depth': 8, 'learning_rate': 0.0006126005656038936, 'iterations': 2385, 'l2_leaf_reg': 4.1784823491619943e-07, 'border_count': 31, 'bagging_temperature': 0.24721659995614315, 'random_strength': 6.569080683761942, 'grow_policy': 'Depthwise', 'min_data_in_leaf': 25}. Best is trial 568 with value: 1659.4433932934307.[0m
[32m[I 2024-10-13 13:05:28,080][0m Trial 640 finished with value: 1910.4327357338311 and parameters: {'depth': 9, 'learning_rate': 0.0013268171023614447, 'iterations': 2277, 'l2_leaf_reg': 2.743889029566704e-07, 'border_count': 11, 'bagging_temperature': 0.06357591599082012, 'random_strength': 6.84401899753321, 'grow_policy': 'Depthwise', 'min_data_in_leaf': 246}. Best is trial 568 with value: 1659.4433932934307.[0m
[32m[I 2024-10-13 13:05:30,187][0m Trial 641 finished with value: 1801.2409002278507 and parameters: {'depth': 6, 'learning_rate': 0.0008859567322243825, 'iterations': 2026, 'l2_leaf_reg': 1.316216243087616e-06, 'border_count': 26, 'bagging_temperature': 0.03640222491217486, 'random_strength': 7.131270450321467, 'grow_policy': 'Lossguide', 'min_data_in_leaf': 326, 'max_leaves': 165}. Best is trial 568 with value: 1659.4433932934307.[0m
[32m[I 2024-10-13 13:05:34,531][0m Trial 642 finished with value: 2242.9400678697198 and parameters: {'depth': 9, 'learning_rate': 0.00198621039161193, 'iterations': 2767, 'l2_leaf_reg': 0.008942286621065549, 'border_count': 35, 'bagging_temperature': 0.016499140425501893, 'random_strength': 7.34727629395689, 'grow_policy': 'Depthwise', 'min_data_in_leaf': 61}. Best is trial 568 with value: 1659.4433932934307.[0m
[32m[I 2024-10-13 13:05:36,037][0m Trial 643 finished with value: 2003.4301066414882 and parameters: {'depth': 9, 'learning_rate': 0.001146492157350111, 'iterations': 1311, 'l2_leaf_reg': 1.0029822224162855e-08, 'border_count': 17, 'bagging_temperature': 0.06835852001415288, 'random_strength': 5.475077082287952, 'grow_policy': 'Depthwise', 'min_data_in_leaf': 182}. Best is trial 568 with value: 1659.4433932934307.[0m
[32m[I 2024-10-13 13:05:38,395][0m Trial 644 finished with value: 1761.2323449953499 and parameters: {'depth': 8, 'learning_rate': 0.0014688882857161357, 'iterations': 2469, 'l2_leaf_reg': 8.985604964406314e-07, 'border_count': 23, 'bagging_temperature': 4.6342508279433514e-05, 'random_strength': 6.400914851817135, 'grow_policy': 'Depthwise', 'min_data_in_leaf': 142}. Best is trial 568 with value: 1659.4433932934307.[0m
[32m[I 2024-10-13 13:05:42,574][0m Trial 645 finished with value: 1890.130256203806 and parameters: {'depth': 9, 'learning_rate': 0.001030347982407283, 'iterations': 2083, 'l2_leaf_reg': 2.2958649928394973e-07, 'border_count': 29, 'bagging_temperature': 0.04775669185801157, 'random_strength': 7.809913007017935, 'grow_policy': 'Lossguide', 'min_data_in_leaf': 26, 'max_leaves': 174}. Best is trial 568 with value: 1659.4433932934307.[0m
[32m[I 2024-10-13 13:05:44,839][0m Trial 646 finished with value: 2332.9839154253705 and parameters: {'depth': 11, 'learning_rate': 0.0028114840881067137, 'iterations': 2202, 'l2_leaf_reg': 3.2700297390940325e-06, 'border_count': 139, 'bagging_temperature': 0.034185694869035506, 'random_strength': 8.209947625011216, 'grow_policy': 'Depthwise', 'min_data_in_leaf': 376}. Best is trial 568 with value: 1659.4433932934307.[0m
[32m[I 2024-10-13 13:05:47,427][0m Trial 647 finished with value: 1761.377078365598 and parameters: {'depth': 8, 'learning_rate': 0.0017430939909018402, 'iterations': 2657, 'l2_leaf_reg': 0.0003354118106479946, 'border_count': 34, 'bagging_temperature': 0.00042694675919121086, 'random_strength': 3.938115381358402, 'grow_policy': 'Depthwise', 'min_data_in_leaf': 265}. Best is trial 568 with value: 1659.4433932934307.[0m
[32m[I 2024-10-13 13:05:48,617][0m Trial 648 finished with value: 2402.552618537296 and parameters: {'depth': 13, 'learning_rate': 0.0007764306742776525, 'iterations': 797, 'l2_leaf_reg': 2.3235455392832934e-05, 'border_count': 62, 'bagging_temperature': 0.023403198334359603, 'random_strength': 4.452949754373868, 'grow_policy': 'Depthwise', 'min_data_in_leaf': 296}. Best is trial 568 with value: 1659.4433932934307.[0m
[32m[I 2024-10-13 13:05:50,886][0m Trial 649 finished with value: 1951.4505430011768 and parameters: {'depth': 9, 'learning_rate': 0.0012322399826325606, 'iterations': 2341, 'l2_leaf_reg': 3.575347037804664e-07, 'border_count': 22, 'bagging_temperature': 0.05167204074397017, 'random_strength': 6.194734628753443, 'grow_policy': 'Depthwise', 'min_data_in_leaf': 167}. Best is trial 568 with value: 1659.4433932934307.[0m
[32m[I 2024-10-13 13:06:00,513][0m Trial 650 finished with value: 2007.799264146619 and parameters: {'depth': 12, 'learning_rate': 0.002259819206796891, 'iterations': 970, 'l2_leaf_reg': 1.583853513295937e-08, 'border_count': 13, 'bagging_temperature': 0.06693529251154672, 'random_strength': 7.314126031306708, 'grow_policy': 'Lossguide', 'min_data_in_leaf': 3, 'max_leaves': 101}. Best is trial 568 with value: 1659.4433932934307.[0m
[32m[I 2024-10-13 13:06:03,189][0m Trial 651 finished with value: 1790.718693930613 and parameters: {'depth': 9, 'learning_rate': 0.004905200803739439, 'iterations': 2876, 'l2_leaf_reg': 6.271794649013296e-07, 'border_count': 29, 'bagging_temperature': 0.0193410314665982, 'random_strength': 5.312926923999821, 'grow_policy': 'Depthwise', 'min_data_in_leaf': 355}. Best is trial 568 with value: 1659.4433932934307.[0m
[32m[I 2024-10-13 13:06:05,415][0m Trial 652 finished with value: 1943.3893369100722 and parameters: {'depth': 7, 'learning_rate': 0.0014639176253846173, 'iterations': 2146, 'l2_leaf_reg': 1.8083924118368372e-07, 'border_count': 18, 'bagging_temperature': 0.0353522639372703, 'random_strength': 6.995783175029921, 'grow_policy': 'Depthwise', 'min_data_in_leaf': 135}. Best is trial 568 with value: 1659.4433932934307.[0m
[32m[I 2024-10-13 13:06:07,575][0m Trial 653 finished with value: 1755.0952030040773 and parameters: {'depth': 11, 'learning_rate': 0.001028649125394681, 'iterations': 2007, 'l2_leaf_reg': 3.102973413754876e-08, 'border_count': 26, 'bagging_temperature': 0.0005684534426857006, 'random_strength': 8.756924465352613, 'grow_policy': 'Depthwise', 'min_data_in_leaf': 110}. Best is trial 568 with value: 1659.4433932934307.[0m
[32m[I 2024-10-13 13:06:09,813][0m Trial 654 finished with value: 1998.9770259889249 and parameters: {'depth': 8, 'learning_rate': 0.0018877678302068475, 'iterations': 2260, 'l2_leaf_reg': 2.2122215783927087e-08, 'border_count': 21, 'bagging_temperature': 0.049668073813852076, 'random_strength': 8.442874803271023, 'grow_policy': 'Lossguide', 'min_data_in_leaf': 205, 'max_leaves': 234}. Best is trial 568 with value: 1659.4433932934307.[0m
[32m[I 2024-10-13 13:06:11,946][0m Trial 655 finished with value: 1756.9435063982994 and parameters: {'depth': 9, 'learning_rate': 0.0012473196659469963, 'iterations': 2089, 'l2_leaf_reg': 1.6262873388825778e-07, 'border_count': 36, 'bagging_temperature': 0.8734429751201211, 'random_strength': 5.676919984053248, 'grow_policy': 'Depthwise', 'min_data_in_leaf': 147}. Best is trial 568 with value: 1659.4433932934307.[0m
[32m[I 2024-10-13 13:06:13,718][0m Trial 656 finished with value: 1747.8138011896333 and parameters: {'depth': 9, 'learning_rate': 0.0015659237924572247, 'iterations': 1198, 'l2_leaf_reg': 7.932815043228646e-08, 'border_count': 31, 'bagging_temperature': 0.07534561271877432, 'random_strength': 4.822716657605886, 'grow_policy': 'Depthwise', 'min_data_in_leaf': 60}. Best is trial 568 with value: 1659.4433932934307.[0m
[32m[I 2024-10-13 13:06:16,159][0m Trial 657 finished with value: 1750.6287375977972 and parameters: {'depth': 8, 'learning_rate': 0.0013614401739433931, 'iterations': 2564, 'l2_leaf_reg': 3.719814363205684e-07, 'border_count': 41, 'bagging_temperature': 0.019243231419665878, 'random_strength': 7.5413053222355115, 'grow_policy': 'Depthwise', 'min_data_in_leaf': 121}. Best is trial 568 with value: 1659.4433932934307.[0m
[32m[I 2024-10-13 13:06:29,233][0m Trial 658 finished with value: 2144.6948608215484 and parameters: {'depth': 9, 'learning_rate': 0.001108292687242653, 'iterations': 1107, 'l2_leaf_reg': 1.1769723580699429e-07, 'border_count': 25, 'bagging_temperature': 0.03358749459528134, 'random_strength': 6.792027779454875, 'grow_policy': 'SymmetricTree', 'min_data_in_leaf': 164}. Best is trial 568 with value: 1659.4433932934307.[0m
