Optimizing CatBoost...
[32m[I 2024-10-13 12:01:40,016][0m Trial 0 finished with value: 2094.0216540159513 and parameters: {'depth': 3, 'learning_rate': 0.021540439588727946, 'iterations': 1181, 'l2_leaf_reg': 0.00034148391622204816, 'border_count': 93, 'bagging_temperature': 0.9963602930215677, 'random_strength': 9.990025115273, 'grow_policy': 'Depthwise', 'min_data_in_leaf': 213}. Best is trial 0 with value: 2094.0216540159513.[0m
[32m[I 2024-10-13 12:01:43,332][0m Trial 1 finished with value: 2653.2073300870497 and parameters: {'depth': 15, 'learning_rate': 0.25195608315736884, 'iterations': 2467, 'l2_leaf_reg': 0.0039514362188510345, 'border_count': 141, 'bagging_temperature': 0.8844355260313252, 'random_strength': 0.15882039700436446, 'grow_policy': 'Depthwise', 'min_data_in_leaf': 512}. Best is trial 0 with value: 2094.0216540159513.[0m
[32m[I 2024-10-13 12:01:45,210][0m Trial 2 finished with value: 1993.7626037514647 and parameters: {'depth': 6, 'learning_rate': 0.0014665908648097993, 'iterations': 1785, 'l2_leaf_reg': 4.0751181339982135e-07, 'border_count': 145, 'bagging_temperature': 0.1454536698485559, 'random_strength': 1.5479584012509573, 'grow_policy': 'Depthwise', 'min_data_in_leaf': 607}. Best is trial 2 with value: 1993.7626037514647.[0m
[32m[I 2024-10-13 12:01:46,060][0m Trial 3 finished with value: 1943.2373975246735 and parameters: {'depth': 11, 'learning_rate': 0.010340754860454817, 'iterations': 420, 'l2_leaf_reg': 0.2200110621278358, 'border_count': 49, 'bagging_temperature': 0.6607284137668358, 'random_strength': 5.795061180389678, 'grow_policy': 'Depthwise', 'min_data_in_leaf': 674}. Best is trial 3 with value: 1943.2373975246735.[0m
[32m[I 2024-10-13 12:01:47,416][0m Trial 4 finished with value: 2490.272589183506 and parameters: {'depth': 8, 'learning_rate': 0.028681924877747716, 'iterations': 1110, 'l2_leaf_reg': 0.706876886362946, 'border_count': 100, 'bagging_temperature': 0.3051286388372204, 'random_strength': 0.6256267314415109, 'grow_policy': 'Lossguide', 'min_data_in_leaf': 194, 'max_leaves': 56}. Best is trial 3 with value: 1943.2373975246735.[0m
[32m[I 2024-10-13 12:01:49,672][0m Trial 5 finished with value: 2390.982981225322 and parameters: {'depth': 3, 'learning_rate': 0.004098255000594659, 'iterations': 2253, 'l2_leaf_reg': 0.11285231411016823, 'border_count': 188, 'bagging_temperature': 0.134908801375204, 'random_strength': 5.21749160300455, 'grow_policy': 'Depthwise', 'min_data_in_leaf': 158}. Best is trial 3 with value: 1943.2373975246735.[0m
[32m[I 2024-10-13 12:14:51,844][0m Trial 6 finished with value: 2017.2421629993623 and parameters: {'depth': 15, 'learning_rate': 0.023615632087091075, 'iterations': 2068, 'l2_leaf_reg': 0.45945866898352883, 'border_count': 115, 'bagging_temperature': 0.7783218805833925, 'random_strength': 7.788777119743923, 'grow_policy': 'SymmetricTree', 'min_data_in_leaf': 247}. Best is trial 3 with value: 1943.2373975246735.[0m
[32m[I 2024-10-13 12:16:44,876][0m Trial 7 finished with value: 2287.3174481660444 and parameters: {'depth': 12, 'learning_rate': 0.0005878213856843838, 'iterations': 1651, 'l2_leaf_reg': 0.0005252454752354119, 'border_count': 186, 'bagging_temperature': 0.6823577080937929, 'random_strength': 7.651471086861421, 'grow_policy': 'SymmetricTree', 'min_data_in_leaf': 451}. Best is trial 3 with value: 1943.2373975246735.[0m
[32m[I 2024-10-13 12:16:46,718][0m Trial 8 finished with value: 2612.6374918266756 and parameters: {'depth': 9, 'learning_rate': 0.19156915954327355, 'iterations': 2016, 'l2_leaf_reg': 2.5657791518863465e-08, 'border_count': 182, 'bagging_temperature': 0.27250872396531267, 'random_strength': 2.63922347210761, 'grow_policy': 'Lossguide', 'min_data_in_leaf': 336, 'max_leaves': 170}. Best is trial 3 with value: 1943.2373975246735.[0m
[32m[I 2024-10-13 12:16:48,901][0m Trial 9 finished with value: 2388.4206728576505 and parameters: {'depth': 5, 'learning_rate': 0.0045673550221890695, 'iterations': 2190, 'l2_leaf_reg': 0.0006284264056676967, 'border_count': 135, 'bagging_temperature': 0.9352372452968574, 'random_strength': 1.7766255438803225, 'grow_policy': 'Lossguide', 'min_data_in_leaf': 103, 'max_leaves': 117}. Best is trial 3 with value: 1943.2373975246735.[0m
[32m[I 2024-10-13 12:16:49,634][0m Trial 10 finished with value: 3227.8833832225223 and parameters: {'depth': 12, 'learning_rate': 0.00012356121953871322, 'iterations': 252, 'l2_leaf_reg': 9.606249694562312, 'border_count': 2, 'bagging_temperature': 0.5422158552328322, 'random_strength': 4.524400792199223, 'grow_policy': 'Depthwise', 'min_data_in_leaf': 911}. Best is trial 3 with value: 1943.2373975246735.[0m
[32m[I 2024-10-13 12:16:52,366][0m Trial 11 finished with value: 1717.8539248499665 and parameters: {'depth': 7, 'learning_rate': 0.0010333133301099553, 'iterations': 2942, 'l2_leaf_reg': 6.185197740820411e-07, 'border_count': 39, 'bagging_temperature': 0.04367701489952991, 'random_strength': 5.22826353746842, 'grow_policy': 'Depthwise', 'min_data_in_leaf': 751}. Best is trial 11 with value: 1717.8539248499665.[0m
[32m[I 2024-10-13 12:16:55,200][0m Trial 12 finished with value: 1867.0253946593853 and parameters: {'depth': 11, 'learning_rate': 0.0005670853148998729, 'iterations': 2855, 'l2_leaf_reg': 1.692053044299827e-06, 'border_count': 42, 'bagging_temperature': 0.5590879929158691, 'random_strength': 5.870479798188164, 'grow_policy': 'Depthwise', 'min_data_in_leaf': 815}. Best is trial 11 with value: 1717.8539248499665.[0m
[32m[I 2024-10-13 12:16:57,926][0m Trial 13 finished with value: 2188.7299361703126 and parameters: {'depth': 7, 'learning_rate': 0.000320128484646078, 'iterations': 2990, 'l2_leaf_reg': 5.330406674712684e-06, 'border_count': 252, 'bagging_temperature': 0.40926524546626775, 'random_strength': 3.9543655878418553, 'grow_policy': 'Depthwise', 'min_data_in_leaf': 862}. Best is trial 11 with value: 1717.8539248499665.[0m
[32m[I 2024-10-13 12:17:00,726][0m Trial 14 finished with value: 1725.4611258784616 and parameters: {'depth': 10, 'learning_rate': 0.001114319977539679, 'iterations': 2979, 'l2_leaf_reg': 5.64311712205438e-06, 'border_count': 30, 'bagging_temperature': 0.00704561759365252, 'random_strength': 6.683834140722465, 'grow_policy': 'Depthwise', 'min_data_in_leaf': 800}. Best is trial 11 with value: 1717.8539248499665.[0m
[32m[I 2024-10-13 12:17:18,485][0m Trial 15 finished with value: 2480.709405499041 and parameters: {'depth': 9, 'learning_rate': 0.0017401950720474025, 'iterations': 2622, 'l2_leaf_reg': 1.9053412565604332e-05, 'border_count': 4, 'bagging_temperature': 0.0638446190868292, 'random_strength': 7.687479580704796, 'grow_policy': 'SymmetricTree', 'min_data_in_leaf': 733}. Best is trial 11 with value: 1717.8539248499665.[0m
[32m[I 2024-10-13 12:17:20,947][0m Trial 16 finished with value: 2751.054443888121 and parameters: {'depth': 5, 'learning_rate': 0.00011880710810462421, 'iterations': 2616, 'l2_leaf_reg': 1.864063627820533e-08, 'border_count': 62, 'bagging_temperature': 0.007502641947567147, 'random_strength': 6.674902151384759, 'grow_policy': 'Depthwise', 'min_data_in_leaf': 770}. Best is trial 11 with value: 1717.8539248499665.[0m
[32m[I 2024-10-13 12:17:22,405][0m Trial 17 finished with value: 1786.878300005655 and parameters: {'depth': 10, 'learning_rate': 0.0015708425150921753, 'iterations': 1193, 'l2_leaf_reg': 2.0323563283001317e-07, 'border_count': 27, 'bagging_temperature': 0.22461935272827682, 'random_strength': 3.5102583564744627, 'grow_policy': 'Depthwise', 'min_data_in_leaf': 952}. Best is trial 11 with value: 1717.8539248499665.[0m
[32m[I 2024-10-13 12:21:50,742][0m Trial 18 finished with value: 2401.0229903023014 and parameters: {'depth': 13, 'learning_rate': 0.0002751913967481182, 'iterations': 2964, 'l2_leaf_reg': 1.2063247799504828e-05, 'border_count': 68, 'bagging_temperature': 0.3887170229572158, 'random_strength': 9.389470973747724, 'grow_policy': 'SymmetricTree', 'min_data_in_leaf': 607}. Best is trial 11 with value: 1717.8539248499665.[0m
[32m[I 2024-10-13 12:21:51,608][0m Trial 19 finished with value: 2277.6781889278477 and parameters: {'depth': 7, 'learning_rate': 0.0009243738408265702, 'iterations': 828, 'l2_leaf_reg': 6.133351165138789e-05, 'border_count': 80, 'bagging_temperature': 4.324626140964245e-05, 'random_strength': 8.502900418940689, 'grow_policy': 'Lossguide', 'min_data_in_leaf': 992, 'max_leaves': 240}. Best is trial 11 with value: 1717.8539248499665.[0m
[32m[I 2024-10-13 12:21:53,977][0m Trial 20 finished with value: 1782.5484565718716 and parameters: {'depth': 8, 'learning_rate': 0.003191707722687691, 'iterations': 2460, 'l2_leaf_reg': 1.7779773847783944e-07, 'border_count': 27, 'bagging_temperature': 0.150364761089265, 'random_strength': 6.622594256590521, 'grow_policy': 'Depthwise', 'min_data_in_leaf': 484}. Best is trial 11 with value: 1717.8539248499665.[0m
[32m[I 2024-10-13 12:21:56,590][0m Trial 21 finished with value: 1783.585326306879 and parameters: {'depth': 8, 'learning_rate': 0.0031590826473346977, 'iterations': 2690, 'l2_leaf_reg': 2.0679626086085098e-07, 'border_count': 31, 'bagging_temperature': 0.13480124186939166, 'random_strength': 6.575797357442088, 'grow_policy': 'Depthwise', 'min_data_in_leaf': 431}. Best is trial 11 with value: 1717.8539248499665.[0m
[32m[I 2024-10-13 12:21:59,103][0m Trial 22 finished with value: 2143.2913306290607 and parameters: {'depth': 10, 'learning_rate': 0.0028325412169721274, 'iterations': 2407, 'l2_leaf_reg': 1.2906617559159258e-06, 'border_count': 22, 'bagging_temperature': 0.1938852011404586, 'random_strength': 6.674051940947566, 'grow_policy': 'Depthwise', 'min_data_in_leaf': 569}. Best is trial 11 with value: 1717.8539248499665.[0m
[32m[I 2024-10-13 12:22:01,848][0m Trial 23 finished with value: 2117.4003865791487 and parameters: {'depth': 7, 'learning_rate': 0.007474951275394792, 'iterations': 2768, 'l2_leaf_reg': 7.591463417063628e-08, 'border_count': 56, 'bagging_temperature': 0.07444633922568576, 'random_strength': 5.034413362435719, 'grow_policy': 'Depthwise', 'min_data_in_leaf': 696}. Best is trial 11 with value: 1717.8539248499665.[0m
[32m[I 2024-10-13 12:22:04,221][0m Trial 24 finished with value: 1934.6254801584655 and parameters: {'depth': 8, 'learning_rate': 0.0008767097760318537, 'iterations': 2437, 'l2_leaf_reg': 1.057107667324073e-06, 'border_count': 16, 'bagging_temperature': 0.33530391036055157, 'random_strength': 6.08326345029501, 'grow_policy': 'Depthwise', 'min_data_in_leaf': 356}. Best is trial 11 with value: 1717.8539248499665.[0m
[32m[I 2024-10-13 12:22:08,999][0m Trial 25 finished with value: 2017.4858016470548 and parameters: {'depth': 5, 'learning_rate': 0.010580321357288307, 'iterations': 2750, 'l2_leaf_reg': 3.483946647594432e-05, 'border_count': 41, 'bagging_temperature': 0.0730393894815291, 'random_strength': 4.2733872282577225, 'grow_policy': 'Depthwise', 'min_data_in_leaf': 15}. Best is trial 11 with value: 1717.8539248499665.[0m
[32m[I 2024-10-13 12:22:11,002][0m Trial 26 finished with value: 2598.252990105982 and parameters: {'depth': 10, 'learning_rate': 0.0002295196490926363, 'iterations': 1881, 'l2_leaf_reg': 5.984850129212408e-06, 'border_count': 76, 'bagging_temperature': 0.21444174698517265, 'random_strength': 8.56456967467498, 'grow_policy': 'Depthwise', 'min_data_in_leaf': 834}. Best is trial 11 with value: 1717.8539248499665.[0m
[32m[I 2024-10-13 12:22:13,868][0m Trial 27 finished with value: 2006.908039616823 and parameters: {'depth': 6, 'learning_rate': 0.002471833396135848, 'iterations': 2958, 'l2_leaf_reg': 6.329310848991085e-08, 'border_count': 95, 'bagging_temperature': 0.005466955207198421, 'random_strength': 3.303684447241629, 'grow_policy': 'Depthwise', 'min_data_in_leaf': 657}. Best is trial 11 with value: 1717.8539248499665.[0m
[32m[I 2024-10-13 12:22:21,967][0m Trial 28 finished with value: 2575.146412100932 and parameters: {'depth': 9, 'learning_rate': 0.08493140121475709, 'iterations': 2493, 'l2_leaf_reg': 8.51197541634602e-05, 'border_count': 2, 'bagging_temperature': 0.42492954985047005, 'random_strength': 7.184059268241524, 'grow_policy': 'SymmetricTree', 'min_data_in_leaf': 539}. Best is trial 11 with value: 1717.8539248499665.[0m
[32m[I 2024-10-13 12:22:23,489][0m Trial 29 finished with value: 2379.642761948073 and parameters: {'depth': 3, 'learning_rate': 0.00048266368568662714, 'iterations': 1376, 'l2_leaf_reg': 0.003711115698541742, 'border_count': 114, 'bagging_temperature': 0.1012980963560598, 'random_strength': 9.911809317410693, 'grow_policy': 'Lossguide', 'min_data_in_leaf': 435, 'max_leaves': 40}. Best is trial 11 with value: 1717.8539248499665.[0m
[32m[I 2024-10-13 12:22:25,925][0m Trial 30 finished with value: 1975.8439846771994 and parameters: {'depth': 13, 'learning_rate': 0.0011012464831886277, 'iterations': 2210, 'l2_leaf_reg': 1.7157872159501199e-06, 'border_count': 251, 'bagging_temperature': 0.19571385463022536, 'random_strength': 5.603847893122663, 'grow_policy': 'Depthwise', 'min_data_in_leaf': 758}. Best is trial 11 with value: 1717.8539248499665.[0m
[32m[I 2024-10-13 12:22:28,462][0m Trial 31 finished with value: 1783.0826019682152 and parameters: {'depth': 8, 'learning_rate': 0.0029419032733592016, 'iterations': 2697, 'l2_leaf_reg': 2.5851189239387e-07, 'border_count': 32, 'bagging_temperature': 0.15939799053701897, 'random_strength': 6.727935393614245, 'grow_policy': 'Depthwise', 'min_data_in_leaf': 389}. Best is trial 11 with value: 1717.8539248499665.[0m
[32m[I 2024-10-13 12:22:31,039][0m Trial 32 finished with value: 1774.6856662935545 and parameters: {'depth': 8, 'learning_rate': 0.008208471376961651, 'iterations': 2783, 'l2_leaf_reg': 7.254850417906218e-08, 'border_count': 38, 'bagging_temperature': 0.2473645671780038, 'random_strength': 7.14461246967889, 'grow_policy': 'Depthwise', 'min_data_in_leaf': 318}. Best is trial 11 with value: 1717.8539248499665.[0m
[32m[I 2024-10-13 12:22:33,470][0m Trial 33 finished with value: 2088.677326078787 and parameters: {'depth': 6, 'learning_rate': 0.006340456797514683, 'iterations': 2524, 'l2_leaf_reg': 5.6003460769404214e-08, 'border_count': 51, 'bagging_temperature': 0.25129925423924276, 'random_strength': 8.6774853444746, 'grow_policy': 'Depthwise', 'min_data_in_leaf': 282}. Best is trial 11 with value: 1717.8539248499665.[0m
[32m[I 2024-10-13 12:22:36,157][0m Trial 34 finished with value: 2122.8135487796635 and parameters: {'depth': 9, 'learning_rate': 0.014178643890224985, 'iterations': 2838, 'l2_leaf_reg': 1.1403979746725887e-08, 'border_count': 82, 'bagging_temperature': 0.07143220528771843, 'random_strength': 6.1125787280963975, 'grow_policy': 'Depthwise', 'min_data_in_leaf': 501}. Best is trial 11 with value: 1717.8539248499665.[0m
[32m[I 2024-10-13 12:22:38,421][0m Trial 35 finished with value: 2607.0006086521366 and parameters: {'depth': 7, 'learning_rate': 0.04251389621119936, 'iterations': 2317, 'l2_leaf_reg': 4.7122328745651526e-07, 'border_count': 16, 'bagging_temperature': 0.3380132682355348, 'random_strength': 7.391854311651856, 'grow_policy': 'Depthwise', 'min_data_in_leaf': 300}. Best is trial 11 with value: 1717.8539248499665.[0m
[32m[I 2024-10-13 12:22:41,236][0m Trial 36 finished with value: 2287.13425423974 and parameters: {'depth': 11, 'learning_rate': 0.0018584261015446948, 'iterations': 2879, 'l2_leaf_reg': 4.492793266367515e-06, 'border_count': 158, 'bagging_temperature': 0.14290953132766415, 'random_strength': 5.368322457466215, 'grow_policy': 'Depthwise', 'min_data_in_leaf': 593}. Best is trial 11 with value: 1717.8539248499665.[0m
[32m[I 2024-10-13 12:22:43,673][0m Trial 37 finished with value: 2146.6938209739674 and parameters: {'depth': 4, 'learning_rate': 0.017526463938753407, 'iterations': 2559, 'l2_leaf_reg': 5.206608678058423e-07, 'border_count': 50, 'bagging_temperature': 0.037371566796679356, 'random_strength': 4.721785431754012, 'grow_policy': 'Depthwise', 'min_data_in_leaf': 645}. Best is trial 11 with value: 1717.8539248499665.[0m
[32m[I 2024-10-13 12:22:44,795][0m Trial 38 finished with value: 2022.4657645108284 and parameters: {'depth': 10, 'learning_rate': 0.007902627052043493, 'iterations': 696, 'l2_leaf_reg': 1.5409901754469027e-07, 'border_count': 68, 'bagging_temperature': 0.46717284968635353, 'random_strength': 8.25167425733287, 'grow_policy': 'Depthwise', 'min_data_in_leaf': 478}. Best is trial 11 with value: 1717.8539248499665.[0m
[32m[I 2024-10-13 12:22:46,671][0m Trial 39 finished with value: 2387.223911255805 and parameters: {'depth': 8, 'learning_rate': 0.00486467488758174, 'iterations': 1883, 'l2_leaf_reg': 0.00015361249008636612, 'border_count': 109, 'bagging_temperature': 0.28855177434124235, 'random_strength': 7.085763884446061, 'grow_policy': 'Lossguide', 'min_data_in_leaf': 208, 'max_leaves': 249}. Best is trial 11 with value: 1717.8539248499665.[0m
[32m[I 2024-10-13 12:22:53,251][0m Trial 40 finished with value: 1908.4923753138874 and parameters: {'depth': 6, 'learning_rate': 0.03281577759552882, 'iterations': 1584, 'l2_leaf_reg': 4.932718117965257e-08, 'border_count': 39, 'bagging_temperature': 0.1270725956734176, 'random_strength': 8.046801820856906, 'grow_policy': 'SymmetricTree', 'min_data_in_leaf': 384}. Best is trial 11 with value: 1717.8539248499665.[0m
[32m[I 2024-10-13 12:22:55,836][0m Trial 41 finished with value: 1788.338939429482 and parameters: {'depth': 8, 'learning_rate': 0.003429048182821847, 'iterations': 2718, 'l2_leaf_reg': 3.719038229393565e-07, 'border_count': 28, 'bagging_temperature': 0.17418294330341944, 'random_strength': 6.402034961184541, 'grow_policy': 'Depthwise', 'min_data_in_leaf': 373}. Best is trial 11 with value: 1717.8539248499665.[0m
[32m[I 2024-10-13 12:22:58,151][0m Trial 42 finished with value: 1940.0428851893823 and parameters: {'depth': 8, 'learning_rate': 0.0011879337082569316, 'iterations': 2380, 'l2_leaf_reg': 1.0374795429765299e-07, 'border_count': 14, 'bagging_temperature': 0.11424701405815331, 'random_strength': 7.045057151624707, 'grow_policy': 'Depthwise', 'min_data_in_leaf': 409}. Best is trial 11 with value: 1717.8539248499665.[0m
[32m[I 2024-10-13 12:23:00,842][0m Trial 43 finished with value: 1781.8989222884873 and parameters: {'depth': 9, 'learning_rate': 0.00215947828107237, 'iterations': 2826, 'l2_leaf_reg': 2.7928085418997372e-08, 'border_count': 36, 'bagging_temperature': 0.1762162983811179, 'random_strength': 5.472075750578004, 'grow_policy': 'Depthwise', 'min_data_in_leaf': 294}. Best is trial 11 with value: 1717.8539248499665.[0m
[32m[I 2024-10-13 12:23:03,550][0m Trial 44 finished with value: 1782.5759939823697 and parameters: {'depth': 9, 'learning_rate': 0.0007064893573227799, 'iterations': 2847, 'l2_leaf_reg': 1.038491193446161e-08, 'border_count': 47, 'bagging_temperature': 0.24921460396690553, 'random_strength': 5.591034169984995, 'grow_policy': 'Depthwise', 'min_data_in_leaf': 124}. Best is trial 11 with value: 1717.8539248499665.[0m
[32m[I 2024-10-13 12:23:06,482][0m Trial 45 finished with value: 2359.39547925986 and parameters: {'depth': 11, 'learning_rate': 0.002353604134607816, 'iterations': 2933, 'l2_leaf_reg': 8.185568828304752e-07, 'border_count': 226, 'bagging_temperature': 0.04148594827115905, 'random_strength': 4.965366685108318, 'grow_policy': 'Depthwise', 'min_data_in_leaf': 256}. Best is trial 11 with value: 1717.8539248499665.[0m
[32m[I 2024-10-13 12:23:08,495][0m Trial 46 finished with value: 2198.296592710926 and parameters: {'depth': 7, 'learning_rate': 0.0004582421186353235, 'iterations': 2082, 'l2_leaf_reg': 2.692764252187434e-08, 'border_count': 13, 'bagging_temperature': 0.10389736595332519, 'random_strength': 5.965188053460586, 'grow_policy': 'Depthwise', 'min_data_in_leaf': 313}. Best is trial 11 with value: 1717.8539248499665.[0m
[32m[I 2024-10-13 12:23:10,989][0m Trial 47 finished with value: 2131.423309774725 and parameters: {'depth': 10, 'learning_rate': 0.004726834993800314, 'iterations': 2625, 'l2_leaf_reg': 2.8046539999569013e-06, 'border_count': 60, 'bagging_temperature': 0.9954485668656841, 'random_strength': 4.126392699588254, 'grow_policy': 'Depthwise', 'min_data_in_leaf': 904}. Best is trial 11 with value: 1717.8539248499665.[0m
[32m[I 2024-10-13 12:23:13,542][0m Trial 48 finished with value: 1781.0808428051917 and parameters: {'depth': 12, 'learning_rate': 0.001436162556153442, 'iterations': 2797, 'l2_leaf_reg': 2.696609670260371e-08, 'border_count': 36, 'bagging_temperature': 0.6969975872903961, 'random_strength': 7.554799301343267, 'grow_policy': 'Lossguide', 'min_data_in_leaf': 183, 'max_leaves': 164}. Best is trial 11 with value: 1717.8539248499665.[0m
[32m[I 2024-10-13 12:23:16,151][0m Trial 49 finished with value: 1926.1847303753898 and parameters: {'depth': 14, 'learning_rate': 0.0014008651819976813, 'iterations': 2807, 'l2_leaf_reg': 4.132411869168026e-08, 'border_count': 84, 'bagging_temperature': 0.7506724918647221, 'random_strength': 7.6605448207073294, 'grow_policy': 'Lossguide', 'min_data_in_leaf': 112, 'max_leaves': 170}. Best is trial 11 with value: 1717.8539248499665.[0m
[32m[I 2024-10-13 12:23:18,448][0m Trial 50 finished with value: 1965.952072386407 and parameters: {'depth': 12, 'learning_rate': 0.0019104421162437564, 'iterations': 2293, 'l2_leaf_reg': 0.0021328373153653535, 'border_count': 73, 'bagging_temperature': 0.5883511918232625, 'random_strength': 0.005239985274631209, 'grow_policy': 'Lossguide', 'min_data_in_leaf': 163, 'max_leaves': 119}. Best is trial 11 with value: 1717.8539248499665.[0m
