[32m[I 2024-10-13 13:23:37,332][0m Trial 964 finished with value: 1726.2484858104347 and parameters: {'depth': 6, 'learning_rate': 0.0011583179028436987, 'iterations': 2014, 'l2_leaf_reg': 2.027253816690905e-08, 'border_count': 29, 'bagging_temperature': 0.016984745384919356, 'random_strength': 4.355863557957051, 'grow_policy': 'Depthwise', 'min_data_in_leaf': 229}. Best is trial 568 with value: 1659.4433932934307.[0m
[32m[I 2024-10-13 13:23:39,402][0m Trial 965 finished with value: 2046.2493853971082 and parameters: {'depth': 14, 'learning_rate': 0.0023972651515175576, 'iterations': 1989, 'l2_leaf_reg': 6.805030521427435e-08, 'border_count': 22, 'bagging_temperature': 0.04403237704767612, 'random_strength': 3.8067227217426653, 'grow_policy': 'Depthwise', 'min_data_in_leaf': 237}. Best is trial 568 with value: 1659.4433932934307.[0m
[32m[I 2024-10-13 13:23:40,071][0m Trial 966 finished with value: 2767.0833732346487 and parameters: {'depth': 7, 'learning_rate': 0.001397178992969751, 'iterations': 214, 'l2_leaf_reg': 4.881928446047145e-08, 'border_count': 38, 'bagging_temperature': 0.07335336237227404, 'random_strength': 8.541470414172547, 'grow_policy': 'Depthwise', 'min_data_in_leaf': 290}. Best is trial 568 with value: 1659.4433932934307.[0m
[32m[I 2024-10-13 13:23:41,483][0m Trial 967 finished with value: 1770.463572661004 and parameters: {'depth': 8, 'learning_rate': 0.001641690254587817, 'iterations': 1182, 'l2_leaf_reg': 2.97731656311732e-06, 'border_count': 28, 'bagging_temperature': 0.019654370359979703, 'random_strength': 8.35647053103175, 'grow_policy': 'Depthwise', 'min_data_in_leaf': 230}. Best is trial 568 with value: 1659.4433932934307.[0m
[32m[I 2024-10-13 13:23:42,724][0m Trial 968 finished with value: 1951.0369358980863 and parameters: {'depth': 13, 'learning_rate': 0.0018704881172263953, 'iterations': 947, 'l2_leaf_reg': 7.246670232167383e-08, 'border_count': 21, 'bagging_temperature': 0.046324233317592084, 'random_strength': 6.913001746710265, 'grow_policy': 'Depthwise', 'min_data_in_leaf': 288}. Best is trial 568 with value: 1659.4433932934307.[0m
[32m[I 2024-10-13 13:23:45,142][0m Trial 969 finished with value: 1811.6051873534789 and parameters: {'depth': 8, 'learning_rate': 0.0007555542342762117, 'iterations': 2508, 'l2_leaf_reg': 3.3657833149960704e-08, 'border_count': 34, 'bagging_temperature': 0.7958448900831231, 'random_strength': 4.205719049216111, 'grow_policy': 'Depthwise', 'min_data_in_leaf': 689}. Best is trial 568 with value: 1659.4433932934307.[0m
[32m[I 2024-10-13 13:23:47,098][0m Trial 970 finished with value: 2448.5192268799506 and parameters: {'depth': 4, 'learning_rate': 0.00030363065983945764, 'iterations': 1880, 'l2_leaf_reg': 1.5353473721342354e-08, 'border_count': 27, 'bagging_temperature': 0.01702503970201683, 'random_strength': 4.985961021447463, 'grow_policy': 'Depthwise', 'min_data_in_leaf': 264}. Best is trial 568 with value: 1659.4433932934307.[0m
[32m[I 2024-10-13 13:23:49,159][0m Trial 971 finished with value: 1919.1392917987787 and parameters: {'depth': 8, 'learning_rate': 0.001133474212107259, 'iterations': 2043, 'l2_leaf_reg': 7.977013354244104e-08, 'border_count': 19, 'bagging_temperature': 5.1302471848289205e-05, 'random_strength': 7.202818396234759, 'grow_policy': 'Depthwise', 'min_data_in_leaf': 250}. Best is trial 568 with value: 1659.4433932934307.[0m
[32m[I 2024-10-13 13:23:54,339][0m Trial 972 finished with value: 2198.2719036223116 and parameters: {'depth': 6, 'learning_rate': 0.0014228421665124732, 'iterations': 2676, 'l2_leaf_reg': 4.81969586777459e-08, 'border_count': 24, 'bagging_temperature': 0.10720436381445497, 'random_strength': 6.582396769301449, 'grow_policy': 'Depthwise', 'min_data_in_leaf': 18}. Best is trial 568 with value: 1659.4433932934307.[0m
[32m[I 2024-10-13 13:24:08,527][0m Trial 973 finished with value: 2058.0405453462986 and parameters: {'depth': 7, 'learning_rate': 0.0009761759917777641, 'iterations': 2062, 'l2_leaf_reg': 0.9034175111293389, 'border_count': 32, 'bagging_temperature': 0.06038469942596364, 'random_strength': 6.834664345691063, 'grow_policy': 'SymmetricTree', 'min_data_in_leaf': 3}. Best is trial 568 with value: 1659.4433932934307.[0m
[32m[I 2024-10-13 13:24:11,775][0m Trial 974 finished with value: 2232.211968454238 and parameters: {'depth': 5, 'learning_rate': 0.0017117109204804661, 'iterations': 2464, 'l2_leaf_reg': 2.3086822152729384e-08, 'border_count': 42, 'bagging_temperature': 0.03380911113733359, 'random_strength': 7.109891562977899, 'grow_policy': 'Depthwise', 'min_data_in_leaf': 68}. Best is trial 568 with value: 1659.4433932934307.[0m
[32m[I 2024-10-13 13:24:12,883][0m Trial 975 finished with value: 2169.173334456942 and parameters: {'depth': 7, 'learning_rate': 0.0012826293128400774, 'iterations': 783, 'l2_leaf_reg': 1.0082711544533991e-07, 'border_count': 19, 'bagging_temperature': 0.03288153714194291, 'random_strength': 4.722731039731788, 'grow_policy': 'Depthwise', 'min_data_in_leaf': 114}. Best is trial 568 with value: 1659.4433932934307.[0m
[32m[I 2024-10-13 13:24:14,849][0m Trial 976 finished with value: 1716.3767410385133 and parameters: {'depth': 8, 'learning_rate': 0.0014709375996755083, 'iterations': 1945, 'l2_leaf_reg': 3.7072132480181845e-08, 'border_count': 28, 'bagging_temperature': 0.08043681881658823, 'random_strength': 8.704591426872765, 'grow_policy': 'Depthwise', 'min_data_in_leaf': 217}. Best is trial 568 with value: 1659.4433932934307.[0m
[32m[I 2024-10-13 13:24:19,242][0m Trial 977 finished with value: 2404.367911293331 and parameters: {'depth': 5, 'learning_rate': 0.03859181000228412, 'iterations': 2819, 'l2_leaf_reg': 6.347487181334e-08, 'border_count': 114, 'bagging_temperature': 0.3173610526807553, 'random_strength': 7.252586701782391, 'grow_policy': 'Depthwise', 'min_data_in_leaf': 45}. Best is trial 568 with value: 1659.4433932934307.[0m
[32m[I 2024-10-13 13:24:21,036][0m Trial 978 finished with value: 1751.191842180228 and parameters: {'depth': 8, 'learning_rate': 0.0010599541950258931, 'iterations': 1492, 'l2_leaf_reg': 9.853839979608463e-08, 'border_count': 36, 'bagging_temperature': 0.049339968670393454, 'random_strength': 5.103557517373949, 'grow_policy': 'Depthwise', 'min_data_in_leaf': 94}. Best is trial 568 with value: 1659.4433932934307.[0m
[32m[I 2024-10-13 13:24:23,029][0m Trial 979 finished with value: 2195.777713366226 and parameters: {'depth': 7, 'learning_rate': 0.0021771607580573704, 'iterations': 1941, 'l2_leaf_reg': 2.7386542911246295e-08, 'border_count': 187, 'bagging_temperature': 0.016393969972299985, 'random_strength': 8.26106229845381, 'grow_policy': 'Depthwise', 'min_data_in_leaf': 293}. Best is trial 568 with value: 1659.4433932934307.[0m
[32m[I 2024-10-13 13:24:25,130][0m Trial 980 finished with value: 2277.6787611946534 and parameters: {'depth': 8, 'learning_rate': 0.0026003628028602134, 'iterations': 2009, 'l2_leaf_reg': 4.728951117460244e-08, 'border_count': 136, 'bagging_temperature': 0.06318116962911552, 'random_strength': 5.309982284702807, 'grow_policy': 'Depthwise', 'min_data_in_leaf': 120}. Best is trial 568 with value: 1659.4433932934307.[0m
[32m[I 2024-10-13 13:24:27,485][0m Trial 981 finished with value: 1696.9277756425574 and parameters: {'depth': 8, 'learning_rate': 0.0012368330001030331, 'iterations': 2401, 'l2_leaf_reg': 0.005684843531622363, 'border_count': 25, 'bagging_temperature': 0.031131244232940294, 'random_strength': 6.894984818387039, 'grow_policy': 'Depthwise', 'min_data_in_leaf': 104}. Best is trial 568 with value: 1659.4433932934307.[0m
[32m[I 2024-10-13 13:24:30,239][0m Trial 982 finished with value: 1932.3505221764515 and parameters: {'depth': 6, 'learning_rate': 0.0008187005253172346, 'iterations': 2466, 'l2_leaf_reg': 0.007555208379060886, 'border_count': 16, 'bagging_temperature': 0.08417079433910961, 'random_strength': 6.648836422186634, 'grow_policy': 'Depthwise', 'min_data_in_leaf': 79}. Best is trial 568 with value: 1659.4433932934307.[0m
[32m[I 2024-10-13 13:24:32,795][0m Trial 983 finished with value: 1924.0275735466826 and parameters: {'depth': 8, 'learning_rate': 0.0009272962887821606, 'iterations': 2426, 'l2_leaf_reg': 0.006905908900045782, 'border_count': 21, 'bagging_temperature': 0.061136395556256315, 'random_strength': 6.4320545981031465, 'grow_policy': 'Depthwise', 'min_data_in_leaf': 98}. Best is trial 568 with value: 1659.4433932934307.[0m
[32m[I 2024-10-13 13:24:35,630][0m Trial 984 finished with value: 1778.9410286753382 and parameters: {'depth': 7, 'learning_rate': 0.00107812746756739, 'iterations': 2372, 'l2_leaf_reg': 0.006213310228926401, 'border_count': 32, 'bagging_temperature': 0.094620582487393, 'random_strength': 6.794662483743148, 'grow_policy': 'Depthwise', 'min_data_in_leaf': 74}. Best is trial 568 with value: 1659.4433932934307.[0m
[32m[I 2024-10-13 13:24:38,186][0m Trial 985 finished with value: 1745.5645998313928 and parameters: {'depth': 13, 'learning_rate': 0.0011756573769801247, 'iterations': 2549, 'l2_leaf_reg': 0.00375736217218491, 'border_count': 24, 'bagging_temperature': 0.047804262120953164, 'random_strength': 6.5338024401181904, 'grow_policy': 'Depthwise', 'min_data_in_leaf': 107}. Best is trial 568 with value: 1659.4433932934307.[0m
[32m[I 2024-10-13 13:24:40,771][0m Trial 986 finished with value: 1712.965491032031 and parameters: {'depth': 15, 'learning_rate': 0.0008944695683552918, 'iterations': 2408, 'l2_leaf_reg': 0.008597784276467024, 'border_count': 29, 'bagging_temperature': 0.07277296023975381, 'random_strength': 4.4022143810804035, 'grow_policy': 'Lossguide', 'min_data_in_leaf': 97, 'max_leaves': 181}. Best is trial 568 with value: 1659.4433932934307.[0m
[32m[I 2024-10-13 13:24:43,527][0m Trial 987 finished with value: 1885.3889866677291 and parameters: {'depth': 4, 'learning_rate': 0.0006409046230038963, 'iterations': 2328, 'l2_leaf_reg': 0.01876775203033005, 'border_count': 17, 'bagging_temperature': 0.3676296983557291, 'random_strength': 4.848505572490553, 'grow_policy': 'Depthwise', 'min_data_in_leaf': 58}. Best is trial 568 with value: 1659.4433932934307.[0m
[32m[I 2024-10-13 13:24:45,984][0m Trial 988 finished with value: 1745.2592173559915 and parameters: {'depth': 14, 'learning_rate': 0.0012629520768328735, 'iterations': 2398, 'l2_leaf_reg': 0.0038078403183587923, 'border_count': 23, 'bagging_temperature': 0.04254457768844085, 'random_strength': 8.010706270855993, 'grow_policy': 'Depthwise', 'min_data_in_leaf': 124}. Best is trial 568 with value: 1659.4433932934307.[0m
[32m[I 2024-10-13 13:24:48,761][0m Trial 989 finished with value: 2335.909576037468 and parameters: {'depth': 5, 'learning_rate': 0.011640426176032639, 'iterations': 2397, 'l2_leaf_reg': 0.024663730638896618, 'border_count': 17, 'bagging_temperature': 0.9213800625045724, 'random_strength': 8.325473713925046, 'grow_policy': 'Depthwise', 'min_data_in_leaf': 85}. Best is trial 568 with value: 1659.4433932934307.[0m
[32m[I 2024-10-13 13:24:51,002][0m Trial 990 finished with value: 1717.6919543874444 and parameters: {'depth': 8, 'learning_rate': 0.0010984565379701695, 'iterations': 2331, 'l2_leaf_reg': 0.00409906651202363, 'border_count': 31, 'bagging_temperature': 0.05711355654997313, 'random_strength': 3.981672994735303, 'grow_policy': 'Lossguide', 'min_data_in_leaf': 129, 'max_leaves': 140}. Best is trial 568 with value: 1659.4433932934307.[0m
[32m[I 2024-10-13 13:24:53,338][0m Trial 991 finished with value: 1787.9469351777504 and parameters: {'depth': 5, 'learning_rate': 0.0007442697823571527, 'iterations': 2478, 'l2_leaf_reg': 0.010998480955354559, 'border_count': 37, 'bagging_temperature': 0.11671615078162695, 'random_strength': 6.950347553090681, 'grow_policy': 'Depthwise', 'min_data_in_leaf': 142}. Best is trial 568 with value: 1659.4433932934307.[0m
[32m[I 2024-10-13 13:25:08,604][0m Trial 992 finished with value: 2085.6642687322515 and parameters: {'depth': 7, 'learning_rate': 0.0013017483424202004, 'iterations': 2441, 'l2_leaf_reg': 0.0023224697717538815, 'border_count': 24, 'bagging_temperature': 0.45114413901002787, 'random_strength': 6.828585013848436, 'grow_policy': 'SymmetricTree', 'min_data_in_leaf': 110}. Best is trial 568 with value: 1659.4433932934307.[0m
[32m[I 2024-10-13 13:25:11,667][0m Trial 993 finished with value: 1752.2378119533323 and parameters: {'depth': 12, 'learning_rate': 0.0009986705754997508, 'iterations': 2521, 'l2_leaf_reg': 0.009577687719570594, 'border_count': 28, 'bagging_temperature': 0.03175476032056515, 'random_strength': 9.006341799025382, 'grow_policy': 'Depthwise', 'min_data_in_leaf': 81}. Best is trial 568 with value: 1659.4433932934307.[0m
[32m[I 2024-10-13 13:25:15,018][0m Trial 994 finished with value: 2095.632073659217 and parameters: {'depth': 8, 'learning_rate': 0.001311371680326629, 'iterations': 2335, 'l2_leaf_reg': 0.016871865042712486, 'border_count': 21, 'bagging_temperature': 0.08051197310863781, 'random_strength': 5.143931383138287, 'grow_policy': 'Depthwise', 'min_data_in_leaf': 48}. Best is trial 568 with value: 1659.4433932934307.[0m
[32m[I 2024-10-13 13:25:16,387][0m Trial 995 finished with value: 2215.5220572966773 and parameters: {'depth': 7, 'learning_rate': 0.0008399449524118432, 'iterations': 1100, 'l2_leaf_reg': 0.005062362483510732, 'border_count': 15, 'bagging_temperature': 0.0352519085295491, 'random_strength': 5.392073844985611, 'grow_policy': 'Depthwise', 'min_data_in_leaf': 107}. Best is trial 568 with value: 1659.4433932934307.[0m
[32m[I 2024-10-13 13:25:18,809][0m Trial 996 finished with value: 1716.8290540499834 and parameters: {'depth': 8, 'learning_rate': 0.0011212540674384068, 'iterations': 2615, 'l2_leaf_reg': 0.012635125859976276, 'border_count': 33, 'bagging_temperature': 0.05876117257905446, 'random_strength': 7.414975011987123, 'grow_policy': 'Lossguide', 'min_data_in_leaf': 131, 'max_leaves': 191}. Best is trial 568 with value: 1659.4433932934307.[0m
[32m[I 2024-10-13 13:25:21,925][0m Trial 997 finished with value: 1845.6194414539589 and parameters: {'depth': 8, 'learning_rate': 0.0013772665397856576, 'iterations': 2270, 'l2_leaf_reg': 0.006253019149153842, 'border_count': 26, 'bagging_temperature': 0.03230839745639072, 'random_strength': 4.496198910414011, 'grow_policy': 'Depthwise', 'min_data_in_leaf': 66}. Best is trial 568 with value: 1659.4433932934307.[0m
[32m[I 2024-10-13 13:25:24,222][0m Trial 998 finished with value: 2164.33933285094 and parameters: {'depth': 6, 'learning_rate': 0.004054666200777251, 'iterations': 2335, 'l2_leaf_reg': 0.005180115734496455, 'border_count': 20, 'bagging_temperature': 0.04923319988566501, 'random_strength': 6.609202499964335, 'grow_policy': 'Depthwise', 'min_data_in_leaf': 120}. Best is trial 568 with value: 1659.4433932934307.[0m
[32m[I 2024-10-13 13:25:27,727][0m Trial 999 finished with value: 1779.6584107160238 and parameters: {'depth': 5, 'learning_rate': 0.0005251001811396854, 'iterations': 2490, 'l2_leaf_reg': 0.005621376907973294, 'border_count': 28, 'bagging_temperature': 0.0698684807707797, 'random_strength': 7.758129101848395, 'grow_policy': 'Depthwise', 'min_data_in_leaf': 37}. Best is trial 568 with value: 1659.4433932934307.[0m
CatBoost: RMSE = 1659.4434
      Model         RMSE
0  CatBoost  1659.443393

Best hyperparameters for CatBoost:
{'depth': 12, 'learning_rate': 0.0005042075029092138, 'iterations': 1991, 'l2_leaf_reg': 2.3630877708007642e-07, 'border_count': 24, 'bagging_temperature': 0.00105956666927301, 'random_strength': 5.235525610482856, 'grow_policy': 'Depthwise', 'min_data_in_leaf': 9}
