[32m[I 2024-10-13 13:15:15,088][0m Trial 811 finished with value: 1774.3865818382783 and parameters: {'depth': 7, 'learning_rate': 0.002160500249596661, 'iterations': 2958, 'l2_leaf_reg': 1.4695032430930976e-07, 'border_count': 31, 'bagging_temperature': 0.07620786640394525, 'random_strength': 6.886799347428312, 'grow_policy': 'Depthwise', 'min_data_in_leaf': 298}. Best is trial 568 with value: 1659.4433932934307.[0m
[32m[I 2024-10-13 13:16:39,269][0m Trial 812 finished with value: 2091.873393395519 and parameters: {'depth': 13, 'learning_rate': 0.0013756124678971284, 'iterations': 2757, 'l2_leaf_reg': 2.364617480165281e-07, 'border_count': 20, 'bagging_temperature': 0.043972953898416677, 'random_strength': 8.694162012563252, 'grow_policy': 'SymmetricTree', 'min_data_in_leaf': 267}. Best is trial 568 with value: 1659.4433932934307.[0m
[32m[I 2024-10-13 13:16:41,958][0m Trial 813 finished with value: 1943.6170384230418 and parameters: {'depth': 7, 'learning_rate': 0.0004494268412766827, 'iterations': 2992, 'l2_leaf_reg': 1.0134251384481079e-07, 'border_count': 25, 'bagging_temperature': 0.0599697472166546, 'random_strength': 4.453595638883451, 'grow_policy': 'Depthwise', 'min_data_in_leaf': 252}. Best is trial 568 with value: 1659.4433932934307.[0m
[32m[I 2024-10-13 13:16:44,501][0m Trial 814 finished with value: 1764.0006113496322 and parameters: {'depth': 6, 'learning_rate': 0.0016473288723034547, 'iterations': 2719, 'l2_leaf_reg': 6.024912929971524e-08, 'border_count': 33, 'bagging_temperature': 0.037685610604443746, 'random_strength': 3.1509596982732284, 'grow_policy': 'Lossguide', 'min_data_in_leaf': 319, 'max_leaves': 184}. Best is trial 568 with value: 1659.4433932934307.[0m
[32m[I 2024-10-13 13:16:47,161][0m Trial 815 finished with value: 1948.7322561055003 and parameters: {'depth': 7, 'learning_rate': 0.0011299066645606244, 'iterations': 2923, 'l2_leaf_reg': 1.9484667875007594e-07, 'border_count': 20, 'bagging_temperature': 0.0635808186974758, 'random_strength': 8.957455624591704, 'grow_policy': 'Depthwise', 'min_data_in_leaf': 177}. Best is trial 568 with value: 1659.4433932934307.[0m
[32m[I 2024-10-13 13:16:49,896][0m Trial 816 finished with value: 1765.3324340577833 and parameters: {'depth': 5, 'learning_rate': 0.001814023547296595, 'iterations': 2884, 'l2_leaf_reg': 7.36645678032767e-08, 'border_count': 7, 'bagging_temperature': 0.037443596321358845, 'random_strength': 6.487543051934219, 'grow_policy': 'Depthwise', 'min_data_in_leaf': 284}. Best is trial 568 with value: 1659.4433932934307.[0m
[32m[I 2024-10-13 13:16:52,486][0m Trial 817 finished with value: 1720.4748406189356 and parameters: {'depth': 4, 'learning_rate': 0.0009156006307008485, 'iterations': 2809, 'l2_leaf_reg': 4.322068035646301e-08, 'border_count': 28, 'bagging_temperature': 0.09314091986178381, 'random_strength': 4.717344859958469, 'grow_policy': 'Lossguide', 'min_data_in_leaf': 160, 'max_leaves': 192}. Best is trial 568 with value: 1659.4433932934307.[0m
[32m[I 2024-10-13 13:16:53,737][0m Trial 818 finished with value: 2062.0902096557816 and parameters: {'depth': 7, 'learning_rate': 0.0012920356750775585, 'iterations': 994, 'l2_leaf_reg': 1.330475289095277e-07, 'border_count': 16, 'bagging_temperature': 0.1283813715600674, 'random_strength': 3.7424713407718397, 'grow_policy': 'Depthwise', 'min_data_in_leaf': 209}. Best is trial 568 with value: 1659.4433932934307.[0m
[32m[I 2024-10-13 13:16:55,710][0m Trial 819 finished with value: 1951.4193053177714 and parameters: {'depth': 5, 'learning_rate': 0.0015125745177832208, 'iterations': 1882, 'l2_leaf_reg': 0.0232115189863445, 'border_count': 22, 'bagging_temperature': 0.11417724077144341, 'random_strength': 7.134862855415159, 'grow_policy': 'Depthwise', 'min_data_in_leaf': 318}. Best is trial 568 with value: 1659.4433932934307.[0m
[32m[I 2024-10-13 13:16:57,812][0m Trial 820 finished with value: 1743.8621643315403 and parameters: {'depth': 14, 'learning_rate': 0.0010714682244476722, 'iterations': 1987, 'l2_leaf_reg': 0.0005306337897194538, 'border_count': 33, 'bagging_temperature': 0.036812436269595544, 'random_strength': 4.271797284202891, 'grow_policy': 'Depthwise', 'min_data_in_leaf': 295}. Best is trial 568 with value: 1659.4433932934307.[0m
[32m[I 2024-10-13 13:17:00,562][0m Trial 821 finished with value: 1775.90457258742 and parameters: {'depth': 4, 'learning_rate': 0.0024100875891117893, 'iterations': 2904, 'l2_leaf_reg': 9.087320182928909e-08, 'border_count': 27, 'bagging_temperature': 0.06113973354959433, 'random_strength': 6.7026597134209025, 'grow_policy': 'Lossguide', 'min_data_in_leaf': 191, 'max_leaves': 155}. Best is trial 568 with value: 1659.4433932934307.[0m
[32m[I 2024-10-13 13:17:03,086][0m Trial 822 finished with value: 1935.343968112319 and parameters: {'depth': 6, 'learning_rate': 0.0007915659945661501, 'iterations': 2694, 'l2_leaf_reg': 2.8018514197684945e-07, 'border_count': 13, 'bagging_temperature': 0.07649459249912195, 'random_strength': 6.876264098373528, 'grow_policy': 'Depthwise', 'min_data_in_leaf': 161}. Best is trial 568 with value: 1659.4433932934307.[0m
[32m[I 2024-10-13 13:17:04,419][0m Trial 823 finished with value: 1949.4584879585436 and parameters: {'depth': 7, 'learning_rate': 0.0013380639048062716, 'iterations': 1073, 'l2_leaf_reg': 0.005309540401007771, 'border_count': 23, 'bagging_temperature': 0.45805425550909795, 'random_strength': 7.106288618877662, 'grow_policy': 'Depthwise', 'min_data_in_leaf': 259}. Best is trial 568 with value: 1659.4433932934307.[0m
[32m[I 2024-10-13 13:17:06,392][0m Trial 824 finished with value: 1785.9213373377036 and parameters: {'depth': 13, 'learning_rate': 0.0009642722929950349, 'iterations': 1912, 'l2_leaf_reg': 0.001248986292380607, 'border_count': 29, 'bagging_temperature': 0.03718085082830629, 'random_strength': 3.970919867977357, 'grow_policy': 'Lossguide', 'min_data_in_leaf': 147, 'max_leaves': 143}. Best is trial 568 with value: 1659.4433932934307.[0m
[32m[I 2024-10-13 13:17:09,035][0m Trial 825 finished with value: 2042.939933050124 and parameters: {'depth': 6, 'learning_rate': 0.0018005551053516412, 'iterations': 2803, 'l2_leaf_reg': 4.145779378411406e-08, 'border_count': 18, 'bagging_temperature': 0.05096695833911841, 'random_strength': 7.257538503464385, 'grow_policy': 'Depthwise', 'min_data_in_leaf': 169}. Best is trial 568 with value: 1659.4433932934307.[0m
[32m[I 2024-10-13 13:17:11,069][0m Trial 826 finished with value: 1724.2639406844255 and parameters: {'depth': 5, 'learning_rate': 0.0011673966935168128, 'iterations': 2026, 'l2_leaf_reg': 1.1550186573872603e-07, 'border_count': 34, 'bagging_temperature': 0.03201679716257549, 'random_strength': 8.367946393559263, 'grow_policy': 'Depthwise', 'min_data_in_leaf': 227}. Best is trial 568 with value: 1659.4433932934307.[0m
[32m[I 2024-10-13 13:17:14,885][0m Trial 827 finished with value: 2119.5275148769992 and parameters: {'depth': 7, 'learning_rate': 0.0015689174614486833, 'iterations': 1961, 'l2_leaf_reg': 2.140254219693411e-08, 'border_count': 23, 'bagging_temperature': 0.05615782521312997, 'random_strength': 6.696242916343547, 'grow_policy': 'Lossguide', 'min_data_in_leaf': 25, 'max_leaves': 176}. Best is trial 568 with value: 1659.4433932934307.[0m
[32m[I 2024-10-13 13:17:18,561][0m Trial 828 finished with value: 2331.32999211252 and parameters: {'depth': 15, 'learning_rate': 0.0021478567766077556, 'iterations': 2894, 'l2_leaf_reg': 6.595835719120525e-08, 'border_count': 208, 'bagging_temperature': 0.07857452855553168, 'random_strength': 4.768272267327533, 'grow_policy': 'Depthwise', 'min_data_in_leaf': 305}. Best is trial 568 with value: 1659.4433932934307.[0m
[32m[I 2024-10-13 13:17:21,295][0m Trial 829 finished with value: 1721.5314948312405 and parameters: {'depth': 7, 'learning_rate': 0.0013489883121699305, 'iterations': 2984, 'l2_leaf_reg': 1.9473515457971274e-07, 'border_count': 9, 'bagging_temperature': 0.03243722263586483, 'random_strength': 6.968824836006997, 'grow_policy': 'Depthwise', 'min_data_in_leaf': 131}. Best is trial 568 with value: 1659.4433932934307.[0m
[32m[I 2024-10-13 13:17:22,740][0m Trial 830 finished with value: 1976.3057787920732 and parameters: {'depth': 9, 'learning_rate': 0.0010933995560756093, 'iterations': 1162, 'l2_leaf_reg': 2.790497399823306e-08, 'border_count': 26, 'bagging_temperature': 0.23848234503877028, 'random_strength': 8.631593593822936, 'grow_policy': 'Depthwise', 'min_data_in_leaf': 275}. Best is trial 568 with value: 1659.4433932934307.[0m
[32m[I 2024-10-13 13:17:24,442][0m Trial 831 finished with value: 1930.812673039469 and parameters: {'depth': 14, 'learning_rate': 0.001542829142535432, 'iterations': 1580, 'l2_leaf_reg': 5.5793150154983184e-08, 'border_count': 16, 'bagging_temperature': 0.02912964900836054, 'random_strength': 6.418236148586126, 'grow_policy': 'Lossguide', 'min_data_in_leaf': 148, 'max_leaves': 168}. Best is trial 568 with value: 1659.4433932934307.[0m
[32m[I 2024-10-13 13:17:26,488][0m Trial 832 finished with value: 1787.0680737440443 and parameters: {'depth': 12, 'learning_rate': 0.0009021610813175918, 'iterations': 2042, 'l2_leaf_reg': 9.990406671005891e-08, 'border_count': 35, 'bagging_temperature': 0.10502943545268587, 'random_strength': 7.339554334107774, 'grow_policy': 'Depthwise', 'min_data_in_leaf': 333}. Best is trial 568 with value: 1659.4433932934307.[0m
[32m[I 2024-10-13 13:17:28,344][0m Trial 833 finished with value: 2123.825827573487 and parameters: {'depth': 7, 'learning_rate': 0.0038287222794964877, 'iterations': 1838, 'l2_leaf_reg': 1.5201457054279656e-07, 'border_count': 20, 'bagging_temperature': 0.05306890584426962, 'random_strength': 7.138061187645133, 'grow_policy': 'Depthwise', 'min_data_in_leaf': 176}. Best is trial 568 with value: 1659.4433932934307.[0m
[32m[I 2024-10-13 13:17:29,867][0m Trial 834 finished with value: 1812.2447708497962 and parameters: {'depth': 5, 'learning_rate': 0.001252616014983536, 'iterations': 1370, 'l2_leaf_reg': 2.945525169214036e-07, 'border_count': 30, 'bagging_temperature': 0.07880953920978792, 'random_strength': 9.898501179924335, 'grow_policy': 'Lossguide', 'min_data_in_leaf': 131, 'max_leaves': 117}. Best is trial 568 with value: 1659.4433932934307.[0m
[32m[I 2024-10-13 13:17:31,159][0m Trial 835 finished with value: 2415.333211196538 and parameters: {'depth': 9, 'learning_rate': 0.0006759345414943575, 'iterations': 911, 'l2_leaf_reg': 3.8565845633254666e-08, 'border_count': 25, 'bagging_temperature': 0.024012096216850423, 'random_strength': 4.492031565793095, 'grow_policy': 'Depthwise', 'min_data_in_leaf': 191}. Best is trial 568 with value: 1659.4433932934307.[0m
[32m[I 2024-10-13 13:17:39,238][0m Trial 836 finished with value: 2926.240640724213 and parameters: {'depth': 9, 'learning_rate': 0.0019852365560927023, 'iterations': 1980, 'l2_leaf_reg': 1.3255185292882112e-08, 'border_count': 1, 'bagging_temperature': 0.045150184541090106, 'random_strength': 6.886658119269277, 'grow_policy': 'SymmetricTree', 'min_data_in_leaf': 154}. Best is trial 568 with value: 1659.4433932934307.[0m
[32m[I 2024-10-13 13:17:43,117][0m Trial 837 finished with value: 2161.6820622273176 and parameters: {'depth': 6, 'learning_rate': 0.0026895575038364656, 'iterations': 2400, 'l2_leaf_reg': 0.0095265360064241, 'border_count': 17, 'bagging_temperature': 0.5781099506686301, 'random_strength': 8.554424061782619, 'grow_policy': 'Depthwise', 'min_data_in_leaf': 39}. Best is trial 568 with value: 1659.4433932934307.[0m
[32m[I 2024-10-13 13:17:45,806][0m Trial 838 finished with value: 1769.9491516844719 and parameters: {'depth': 9, 'learning_rate': 0.0017284728007758313, 'iterations': 2848, 'l2_leaf_reg': 6.933761398688398e-08, 'border_count': 29, 'bagging_temperature': 0.06492919844585428, 'random_strength': 6.166830517157969, 'grow_policy': 'Depthwise', 'min_data_in_leaf': 244}. Best is trial 568 with value: 1659.4433932934307.[0m
[32m[I 2024-10-13 13:17:48,365][0m Trial 839 finished with value: 1952.6335525512657 and parameters: {'depth': 9, 'learning_rate': 0.0011142716565168609, 'iterations': 2776, 'l2_leaf_reg': 1.7081027246124153e-07, 'border_count': 13, 'bagging_temperature': 0.18880262629871186, 'random_strength': 6.552240561667914, 'grow_policy': 'Lossguide', 'min_data_in_leaf': 295, 'max_leaves': 158}. Best is trial 568 with value: 1659.4433932934307.[0m
[32m[I 2024-10-13 13:17:51,167][0m Trial 840 finished with value: 1993.5455289958095 and parameters: {'depth': 7, 'learning_rate': 0.0012926367475776443, 'iterations': 2936, 'l2_leaf_reg': 9.83255476274063e-08, 'border_count': 22, 'bagging_temperature': 0.03259100093534287, 'random_strength': 5.17409414218978, 'grow_policy': 'Depthwise', 'min_data_in_leaf': 114}. Best is trial 568 with value: 1659.4433932934307.[0m
[32m[I 2024-10-13 13:17:53,146][0m Trial 841 finished with value: 1779.3860844054302 and parameters: {'depth': 9, 'learning_rate': 0.0009850741337692635, 'iterations': 1917, 'l2_leaf_reg': 3.2886983692048107e-07, 'border_count': 36, 'bagging_temperature': 0.019059504628267162, 'random_strength': 9.24373685107773, 'grow_policy': 'Depthwise', 'min_data_in_leaf': 577}. Best is trial 568 with value: 1659.4433932934307.[0m
[32m[I 2024-10-13 13:17:55,565][0m Trial 842 finished with value: 1742.6806644242072 and parameters: {'depth': 6, 'learning_rate': 0.0014709599612315264, 'iterations': 2524, 'l2_leaf_reg': 0.00012480575431512934, 'border_count': 29, 'bagging_temperature': 0.050532372095791894, 'random_strength': 7.477248575143211, 'grow_policy': 'Lossguide', 'min_data_in_leaf': 330, 'max_leaves': 82}. Best is trial 568 with value: 1659.4433932934307.[0m
[32m[I 2024-10-13 13:17:57,708][0m Trial 843 finished with value: 1770.940085401945 and parameters: {'depth': 13, 'learning_rate': 0.0017828557074298034, 'iterations': 2054, 'l2_leaf_reg': 3.4128875264994195e-08, 'border_count': 23, 'bagging_temperature': 0.08773338822509619, 'random_strength': 7.259920001695704, 'grow_policy': 'Depthwise', 'min_data_in_leaf': 218}. Best is trial 568 with value: 1659.4433932934307.[0m
[32m[I 2024-10-13 13:18:01,054][0m Trial 844 finished with value: 1762.5274699277857 and parameters: {'depth': 5, 'learning_rate': 0.0007922186948722161, 'iterations': 1794, 'l2_leaf_reg': 5.593339817743921e-08, 'border_count': 18, 'bagging_temperature': 0.032383515659907325, 'random_strength': 4.2849166494754005, 'grow_policy': 'Depthwise', 'min_data_in_leaf': 17}. Best is trial 568 with value: 1659.4433932934307.[0m
[32m[I 2024-10-13 13:18:03,093][0m Trial 845 finished with value: 2077.3015548849016 and parameters: {'depth': 9, 'learning_rate': 0.003226664098884082, 'iterations': 1994, 'l2_leaf_reg': 8.80274131688449e-08, 'border_count': 10, 'bagging_temperature': 0.06172185140828055, 'random_strength': 8.200324567902143, 'grow_policy': 'Lossguide', 'min_data_in_leaf': 310, 'max_leaves': 185}. Best is trial 568 with value: 1659.4433932934307.[0m
[32m[I 2024-10-13 13:18:05,606][0m Trial 846 finished with value: 2135.6615828146946 and parameters: {'depth': 9, 'learning_rate': 0.0013988001635966989, 'iterations': 2644, 'l2_leaf_reg': 2.060150557334833e-08, 'border_count': 125, 'bagging_temperature': 0.01856040512207961, 'random_strength': 5.589146505138097, 'grow_policy': 'Depthwise', 'min_data_in_leaf': 135}. Best is trial 568 with value: 1659.4433932934307.[0m
[32m[I 2024-10-13 13:18:07,074][0m Trial 847 finished with value: 1943.9810061673495 and parameters: {'depth': 7, 'learning_rate': 0.001077242141957018, 'iterations': 1226, 'l2_leaf_reg': 1.543255171105797e-07, 'border_count': 32, 'bagging_temperature': 0.05248437301557467, 'random_strength': 7.111539700415289, 'grow_policy': 'Depthwise', 'min_data_in_leaf': 163}. Best is trial 568 with value: 1659.4433932934307.[0m
[32m[I 2024-10-13 13:18:08,961][0m Trial 848 finished with value: 1718.5977101534593 and parameters: {'depth': 9, 'learning_rate': 0.001217894625644261, 'iterations': 1886, 'l2_leaf_reg': 4.4299285748536654e-08, 'border_count': 25, 'bagging_temperature': 0.017378499752850798, 'random_strength': 7.489599345785935, 'grow_policy': 'Lossguide', 'min_data_in_leaf': 270, 'max_leaves': 150}. Best is trial 568 with value: 1659.4433932934307.[0m
[32m[I 2024-10-13 13:18:10,385][0m Trial 849 finished with value: 2415.5448792051707 and parameters: {'depth': 15, 'learning_rate': 0.0005621047988733439, 'iterations': 1113, 'l2_leaf_reg': 2.3697464965704027e-07, 'border_count': 21, 'bagging_temperature': 0.0724060502041325, 'random_strength': 4.82150700946839, 'grow_policy': 'Depthwise', 'min_data_in_leaf': 99}. Best is trial 568 with value: 1659.4433932934307.[0m
[32m[I 2024-10-13 13:18:13,409][0m Trial 850 finished with value: 2225.3673424313833 and parameters: {'depth': 13, 'learning_rate': 0.001584111995806344, 'iterations': 2999, 'l2_leaf_reg': 1.2858675145568783e-07, 'border_count': 255, 'bagging_temperature': 0.5459126485700645, 'random_strength': 5.1758565405549755, 'grow_policy': 'Depthwise', 'min_data_in_leaf': 188}. Best is trial 568 with value: 1659.4433932934307.[0m
[32m[I 2024-10-13 13:18:15,826][0m Trial 851 finished with value: 1769.7244618819577 and parameters: {'depth': 9, 'learning_rate': 0.002152153141845162, 'iterations': 2470, 'l2_leaf_reg': 6.002228109406486e-08, 'border_count': 36, 'bagging_temperature': 0.039700260955711386, 'random_strength': 3.6386718869760064, 'grow_policy': 'Depthwise', 'min_data_in_leaf': 140}. Best is trial 568 with value: 1659.4433932934307.[0m
[32m[I 2024-10-13 13:18:18,818][0m Trial 852 finished with value: 2004.2763770309523 and parameters: {'depth': 9, 'learning_rate': 0.0009073243194374885, 'iterations': 2730, 'l2_leaf_reg': 3.9600540817197715e-07, 'border_count': 14, 'bagging_temperature': 0.10805725547686491, 'random_strength': 8.400354659931232, 'grow_policy': 'Lossguide', 'min_data_in_leaf': 68, 'max_leaves': 200}. Best is trial 568 with value: 1659.4433932934307.[0m
[32m[I 2024-10-13 13:18:20,936][0m Trial 853 finished with value: 1719.5767985747157 and parameters: {'depth': 8, 'learning_rate': 0.0014192720383063887, 'iterations': 2081, 'l2_leaf_reg': 2.748517378284097e-08, 'border_count': 27, 'bagging_temperature': 0.14110401784745125, 'random_strength': 6.938767250838414, 'grow_policy': 'Depthwise', 'min_data_in_leaf': 119}. Best is trial 568 with value: 1659.4433932934307.[0m
[32m[I 2024-10-13 13:18:22,927][0m Trial 854 finished with value: 1728.934071227429 and parameters: {'depth': 4, 'learning_rate': 0.0011855430918135635, 'iterations': 1944, 'l2_leaf_reg': 8.793051975344462e-08, 'border_count': 31, 'bagging_temperature': 0.019349296754126742, 'random_strength': 5.778436401758143, 'grow_policy': 'Depthwise', 'min_data_in_leaf': 292}. Best is trial 568 with value: 1659.4433932934307.[0m
[32m[I 2024-10-13 13:18:25,534][0m Trial 855 finished with value: 2047.3701036243856 and parameters: {'depth': 6, 'learning_rate': 0.0018471912370422523, 'iterations': 2833, 'l2_leaf_reg': 2.106403256584062e-07, 'border_count': 19, 'bagging_temperature': 0.04040707109607727, 'random_strength': 6.315470621345028, 'grow_policy': 'Lossguide', 'min_data_in_leaf': 155, 'max_leaves': 132}. Best is trial 568 with value: 1659.4433932934307.[0m
[32m[I 2024-10-13 13:18:28,054][0m Trial 856 finished with value: 1705.7299990638105 and parameters: {'depth': 8, 'learning_rate': 0.0010683334826809355, 'iterations': 2030, 'l2_leaf_reg': 1.1013356663263043e-07, 'border_count': 25, 'bagging_temperature': 0.26326996323242735, 'random_strength': 6.769878043214132, 'grow_policy': 'Depthwise', 'min_data_in_leaf': 87}. Best is trial 568 with value: 1659.4433932934307.[0m
[32m[I 2024-10-13 13:18:30,331][0m Trial 857 finished with value: 2334.087362613326 and parameters: {'depth': 8, 'learning_rate': 0.017901449228291653, 'iterations': 2010, 'l2_leaf_reg': 1.235802602407576e-07, 'border_count': 26, 'bagging_temperature': 0.34739206397423883, 'random_strength': 6.807526338660063, 'grow_policy': 'Depthwise', 'min_data_in_leaf': 78}. Best is trial 568 with value: 1659.4433932934307.[0m
[32m[I 2024-10-13 13:18:32,999][0m Trial 858 finished with value: 1958.6915611171444 and parameters: {'depth': 8, 'learning_rate': 0.001050052641951055, 'iterations': 2047, 'l2_leaf_reg': 1.452051083359771e-08, 'border_count': 22, 'bagging_temperature': 0.3323164382574194, 'random_strength': 6.576323833369354, 'grow_policy': 'Depthwise', 'min_data_in_leaf': 55}. Best is trial 568 with value: 1659.4433932934307.[0m
[32m[I 2024-10-13 13:18:35,204][0m Trial 859 finished with value: 1725.1269918929518 and parameters: {'depth': 8, 'learning_rate': 0.0015562884399675878, 'iterations': 2011, 'l2_leaf_reg': 2.4085066028737805e-06, 'border_count': 6, 'bagging_temperature': 0.01915596417725845, 'random_strength': 6.706965564001627, 'grow_policy': 'Depthwise', 'min_data_in_leaf': 90}. Best is trial 568 with value: 1659.4433932934307.[0m
[32m[I 2024-10-13 13:18:37,412][0m Trial 860 finished with value: 1959.6333650420372 and parameters: {'depth': 8, 'learning_rate': 0.001293342699583444, 'iterations': 2097, 'l2_leaf_reg': 2.2577597899993896e-07, 'border_count': 14, 'bagging_temperature': 0.263107947714929, 'random_strength': 6.848093210122758, 'grow_policy': 'Depthwise', 'min_data_in_leaf': 93}. Best is trial 568 with value: 1659.4433932934307.[0m
[32m[I 2024-10-13 13:18:41,050][0m Trial 861 finished with value: 2225.0948609755874 and parameters: {'depth': 8, 'learning_rate': 0.002513721623923294, 'iterations': 1992, 'l2_leaf_reg': 6.79677089183008e-08, 'border_count': 32, 'bagging_temperature': 0.2836731167611469, 'random_strength': 6.578165698867339, 'grow_policy': 'Depthwise', 'min_data_in_leaf': 38}. Best is trial 568 with value: 1659.4433932934307.[0m
