[32m[I 2024-10-13 13:18:43,139][0m Trial 862 finished with value: 1765.1935185796756 and parameters: {'depth': 8, 'learning_rate': 0.000810303572592804, 'iterations': 1926, 'l2_leaf_reg': 3.427788965568847e-07, 'border_count': 38, 'bagging_temperature': 0.20839294711709097, 'random_strength': 6.680280459638916, 'grow_policy': 'Depthwise', 'min_data_in_leaf': 102}. Best is trial 568 with value: 1659.4433932934307.[0m
[32m[I 2024-10-13 13:18:45,232][0m Trial 863 finished with value: 1759.0860225599997 and parameters: {'depth': 8, 'learning_rate': 0.0009721286867695976, 'iterations': 2083, 'l2_leaf_reg': 4.181682194216062e-08, 'border_count': 26, 'bagging_temperature': 0.044681618272719686, 'random_strength': 7.03727895315827, 'grow_policy': 'Depthwise', 'min_data_in_leaf': 119}. Best is trial 568 with value: 1659.4433932934307.[0m
[32m[I 2024-10-13 13:18:47,199][0m Trial 864 finished with value: 2158.513078081505 and parameters: {'depth': 7, 'learning_rate': 0.024288584871259712, 'iterations': 1958, 'l2_leaf_reg': 0.08004999012861998, 'border_count': 66, 'bagging_temperature': 0.018384067070590343, 'random_strength': 6.34602160028744, 'grow_policy': 'Depthwise', 'min_data_in_leaf': 903}. Best is trial 568 with value: 1659.4433932934307.[0m
[32m[I 2024-10-13 13:18:50,006][0m Trial 865 finished with value: 2153.0933606556996 and parameters: {'depth': 8, 'learning_rate': 0.002012349238556665, 'iterations': 2039, 'l2_leaf_reg': 1.4618445399983415e-07, 'border_count': 19, 'bagging_temperature': 0.06307081755248513, 'random_strength': 6.4345589364669475, 'grow_policy': 'Depthwise', 'min_data_in_leaf': 57}. Best is trial 568 with value: 1659.4433932934307.[0m
[32m[I 2024-10-13 13:18:51,895][0m Trial 866 finished with value: 1716.1949330907687 and parameters: {'depth': 8, 'learning_rate': 0.0016443461792812377, 'iterations': 1836, 'l2_leaf_reg': 9.969722519209616e-08, 'border_count': 30, 'bagging_temperature': 0.03272182019721018, 'random_strength': 6.9977948629523965, 'grow_policy': 'Depthwise', 'min_data_in_leaf': 120}. Best is trial 568 with value: 1659.4433932934307.[0m
[32m[I 2024-10-13 13:18:54,470][0m Trial 867 finished with value: 1816.688361128462 and parameters: {'depth': 9, 'learning_rate': 0.0012877651140925203, 'iterations': 2110, 'l2_leaf_reg': 2.4961734208893717e-08, 'border_count': 24, 'bagging_temperature': 0.3034805786492042, 'random_strength': 6.752245926604317, 'grow_policy': 'Depthwise', 'min_data_in_leaf': 78}. Best is trial 568 with value: 1659.4433932934307.[0m
[32m[I 2024-10-13 13:18:58,752][0m Trial 868 finished with value: 2408.3071206129093 and parameters: {'depth': 8, 'learning_rate': 0.001440552637686536, 'iterations': 1904, 'l2_leaf_reg': 0.013338671126239508, 'border_count': 17, 'bagging_temperature': 0.050075164021538596, 'random_strength': 7.260339032581029, 'grow_policy': 'Depthwise', 'min_data_in_leaf': 18}. Best is trial 568 with value: 1659.4433932934307.[0m
[32m[I 2024-10-13 13:19:00,738][0m Trial 869 finished with value: 1894.9512395190989 and parameters: {'depth': 9, 'learning_rate': 0.0011193944294412307, 'iterations': 1998, 'l2_leaf_reg': 6.90138845377072e-08, 'border_count': 10, 'bagging_temperature': 0.017969945217173964, 'random_strength': 6.921766890362245, 'grow_policy': 'Depthwise', 'min_data_in_leaf': 104}. Best is trial 568 with value: 1659.4433932934307.[0m
[32m[I 2024-10-13 13:19:02,837][0m Trial 870 finished with value: 1738.8646552513844 and parameters: {'depth': 9, 'learning_rate': 0.0017374218918642873, 'iterations': 2075, 'l2_leaf_reg': 1.7828217200068927e-07, 'border_count': 35, 'bagging_temperature': 0.07963278332770964, 'random_strength': 7.340620519873196, 'grow_policy': 'Depthwise', 'min_data_in_leaf': 136}. Best is trial 568 with value: 1659.4433932934307.[0m
[32m[I 2024-10-13 13:19:05,110][0m Trial 871 finished with value: 1829.8923283278025 and parameters: {'depth': 8, 'learning_rate': 0.0006932889883809104, 'iterations': 2388, 'l2_leaf_reg': 4.6686270628444913e-07, 'border_count': 28, 'bagging_temperature': 0.03285807149019803, 'random_strength': 6.47766347591719, 'grow_policy': 'Depthwise', 'min_data_in_leaf': 141}. Best is trial 568 with value: 1659.4433932934307.[0m
[32m[I 2024-10-13 13:19:07,303][0m Trial 872 finished with value: 1901.3672883238892 and parameters: {'depth': 7, 'learning_rate': 0.0009278420610808306, 'iterations': 1940, 'l2_leaf_reg': 4.2329254745559846e-08, 'border_count': 21, 'bagging_temperature': 0.05974796148139232, 'random_strength': 7.196259448813269, 'grow_policy': 'Depthwise', 'min_data_in_leaf': 87}. Best is trial 568 with value: 1659.4433932934307.[0m
[32m[I 2024-10-13 13:19:09,318][0m Trial 873 finished with value: 1929.9095634474972 and parameters: {'depth': 5, 'learning_rate': 0.001198225946374911, 'iterations': 2038, 'l2_leaf_reg': 1.1535247578673539e-07, 'border_count': 16, 'bagging_temperature': 0.01747378423793402, 'random_strength': 6.129198861928524, 'grow_policy': 'Depthwise', 'min_data_in_leaf': 112}. Best is trial 568 with value: 1659.4433932934307.[0m
[32m[I 2024-10-13 13:19:29,552][0m Trial 874 finished with value: 2070.057968616399 and parameters: {'depth': 9, 'learning_rate': 0.002320689884808151, 'iterations': 2332, 'l2_leaf_reg': 0.03245244123665141, 'border_count': 24, 'bagging_temperature': 0.03859371677870545, 'random_strength': 6.7482853553968685, 'grow_policy': 'SymmetricTree', 'min_data_in_leaf': 7}. Best is trial 568 with value: 1659.4433932934307.[0m
[32m[I 2024-10-13 13:19:30,725][0m Trial 875 finished with value: 1908.6760444518036 and parameters: {'depth': 8, 'learning_rate': 0.0014826499377157557, 'iterations': 945, 'l2_leaf_reg': 2.6361282929620113e-07, 'border_count': 32, 'bagging_temperature': 0.08017080442334862, 'random_strength': 6.954472976836591, 'grow_policy': 'Depthwise', 'min_data_in_leaf': 735}. Best is trial 568 with value: 1659.4433932934307.[0m
[32m[I 2024-10-13 13:19:38,615][0m Trial 876 finished with value: 2245.898708375706 and parameters: {'depth': 9, 'learning_rate': 0.0010337178821183475, 'iterations': 2121, 'l2_leaf_reg': 5.6279087648327305e-08, 'border_count': 28, 'bagging_temperature': 0.22756288261672675, 'random_strength': 7.092861405181953, 'grow_policy': 'Depthwise', 'min_data_in_leaf': 2}. Best is trial 568 with value: 1659.4433932934307.[0m
[32m[I 2024-10-13 13:19:41,375][0m Trial 877 finished with value: 2165.2677281154074 and parameters: {'depth': 7, 'learning_rate': 0.001973492143126746, 'iterations': 1877, 'l2_leaf_reg': 1.8502520139520213e-08, 'border_count': 21, 'bagging_temperature': 0.018473590001560753, 'random_strength': 3.9511724367309924, 'grow_policy': 'Depthwise', 'min_data_in_leaf': 45}. Best is trial 568 with value: 1659.4433932934307.[0m
[32m[I 2024-10-13 13:19:43,032][0m Trial 878 finished with value: 1766.2766191842802 and parameters: {'depth': 9, 'learning_rate': 0.0013464859013464225, 'iterations': 1451, 'l2_leaf_reg': 3.4893750868461744e-08, 'border_count': 37, 'bagging_temperature': 0.052659242349134064, 'random_strength': 7.513390745032642, 'grow_policy': 'Depthwise', 'min_data_in_leaf': 127}. Best is trial 568 with value: 1659.4433932934307.[0m
[32m[I 2024-10-13 13:19:44,340][0m Trial 879 finished with value: 1969.547867078252 and parameters: {'depth': 8, 'learning_rate': 0.001678214694121263, 'iterations': 1039, 'l2_leaf_reg': 8.55542864310662e-08, 'border_count': 13, 'bagging_temperature': 0.016428292752243015, 'random_strength': 2.368856272561769, 'grow_policy': 'Depthwise', 'min_data_in_leaf': 170}. Best is trial 568 with value: 1659.4433932934307.[0m
[32m[I 2024-10-13 13:19:46,460][0m Trial 880 finished with value: 1825.7271980386943 and parameters: {'depth': 12, 'learning_rate': 0.0008521708298177707, 'iterations': 1991, 'l2_leaf_reg': 1.6833410180119256e-07, 'border_count': 25, 'bagging_temperature': 0.0010902559862062955, 'random_strength': 8.235391267207907, 'grow_policy': 'Depthwise', 'min_data_in_leaf': 852}. Best is trial 568 with value: 1659.4433932934307.[0m
[32m[I 2024-10-13 13:19:48,778][0m Trial 881 finished with value: 1934.60791929258 and parameters: {'depth': 9, 'learning_rate': 0.0012058402909230959, 'iterations': 2430, 'l2_leaf_reg': 7.206357716258663e-08, 'border_count': 18, 'bagging_temperature': 0.0379230808678675, 'random_strength': 6.593411098520889, 'grow_policy': 'Depthwise', 'min_data_in_leaf': 155}. Best is trial 568 with value: 1659.4433932934307.[0m
[32m[I 2024-10-13 13:19:51,186][0m Trial 882 finished with value: 1770.0689012208636 and parameters: {'depth': 14, 'learning_rate': 0.001466602851136961, 'iterations': 2144, 'l2_leaf_reg': 0.0026480201144793263, 'border_count': 32, 'bagging_temperature': 0.3797412547304799, 'random_strength': 7.1647062667649095, 'grow_policy': 'Depthwise', 'min_data_in_leaf': 97}. Best is trial 568 with value: 1659.4433932934307.[0m
[32m[I 2024-10-13 13:19:53,635][0m Trial 883 finished with value: 1717.009606983475 and parameters: {'depth': 6, 'learning_rate': 0.0011186433420125417, 'iterations': 2573, 'l2_leaf_reg': 3.271066686401643e-07, 'border_count': 6, 'bagging_temperature': 0.06772965307325825, 'random_strength': 7.63433031754746, 'grow_policy': 'Depthwise', 'min_data_in_leaf': 131}. Best is trial 568 with value: 1659.4433932934307.[0m
[32m[I 2024-10-13 13:19:55,702][0m Trial 884 finished with value: 2075.7459236825907 and parameters: {'depth': 5, 'learning_rate': 0.0005138033759832833, 'iterations': 2063, 'l2_leaf_reg': 1.3010733637940693e-07, 'border_count': 41, 'bagging_temperature': 0.00042219622216942105, 'random_strength': 7.343363745479262, 'grow_policy': 'Depthwise', 'min_data_in_leaf': 114}. Best is trial 568 with value: 1659.4433932934307.[0m
[32m[I 2024-10-13 13:19:59,673][0m Trial 885 finished with value: 2211.363743157562 and parameters: {'depth': 9, 'learning_rate': 0.001804390672386251, 'iterations': 1978, 'l2_leaf_reg': 2.8837056272087464e-08, 'border_count': 28, 'bagging_temperature': 0.03613093577921488, 'random_strength': 6.214343093089118, 'grow_policy': 'Depthwise', 'min_data_in_leaf': 30}. Best is trial 568 with value: 1659.4433932934307.[0m
[32m[I 2024-10-13 13:20:02,605][0m Trial 886 finished with value: 2044.696399901797 and parameters: {'depth': 8, 'learning_rate': 0.002889986104695383, 'iterations': 2297, 'l2_leaf_reg': 5.022461930453011e-08, 'border_count': 22, 'bagging_temperature': 0.08507475749142751, 'random_strength': 8.765246397878792, 'grow_policy': 'Depthwise', 'min_data_in_leaf': 66}. Best is trial 568 with value: 1659.4433932934307.[0m
[32m[I 2024-10-13 13:20:04,501][0m Trial 887 finished with value: 1970.1549269309373 and parameters: {'depth': 9, 'learning_rate': 0.0009660706878461807, 'iterations': 1787, 'l2_leaf_reg': 1.025014142414484e-07, 'border_count': 15, 'bagging_temperature': 0.05636789039194959, 'random_strength': 6.841249616568653, 'grow_policy': 'Depthwise', 'min_data_in_leaf': 150}. Best is trial 568 with value: 1659.4433932934307.[0m
[32m[I 2024-10-13 13:20:06,823][0m Trial 888 finished with value: 2087.081800948385 and parameters: {'depth': 9, 'learning_rate': 0.0013340369541024414, 'iterations': 2501, 'l2_leaf_reg': 1.7974753720485176e-07, 'border_count': 219, 'bagging_temperature': 0.029099906621841806, 'random_strength': 8.08199396398218, 'grow_policy': 'Depthwise', 'min_data_in_leaf': 176}. Best is trial 568 with value: 1659.4433932934307.[0m
[32m[I 2024-10-13 13:20:08,893][0m Trial 889 finished with value: 1851.0671145411407 and parameters: {'depth': 7, 'learning_rate': 0.0007716596116701333, 'iterations': 2036, 'l2_leaf_reg': 2.466569049944339e-07, 'border_count': 34, 'bagging_temperature': 0.09646339071899417, 'random_strength': 4.332050541160548, 'grow_policy': 'Depthwise', 'min_data_in_leaf': 259}. Best is trial 568 with value: 1659.4433932934307.[0m
[32m[I 2024-10-13 13:20:22,987][0m Trial 890 finished with value: 1940.8100679681013 and parameters: {'depth': 7, 'learning_rate': 0.0020255641954304657, 'iterations': 2346, 'l2_leaf_reg': 1.0802685714693773e-08, 'border_count': 26, 'bagging_temperature': 0.04838984237073128, 'random_strength': 8.452993627775314, 'grow_policy': 'SymmetricTree', 'min_data_in_leaf': 80}. Best is trial 568 with value: 1659.4433932934307.[0m
[32m[I 2024-10-13 13:20:24,465][0m Trial 891 finished with value: 1931.9931669255764 and parameters: {'depth': 9, 'learning_rate': 0.0015919341538275225, 'iterations': 1252, 'l2_leaf_reg': 4.377581092333153e-08, 'border_count': 21, 'bagging_temperature': 0.00031340408435773237, 'random_strength': 7.931463147955789, 'grow_policy': 'Depthwise', 'min_data_in_leaf': 204}. Best is trial 568 with value: 1659.4433932934307.[0m
[32m[I 2024-10-13 13:20:26,504][0m Trial 892 finished with value: 1735.505580322039 and parameters: {'depth': 8, 'learning_rate': 0.001209321782714662, 'iterations': 1930, 'l2_leaf_reg': 2.1566755301986276e-08, 'border_count': 9, 'bagging_temperature': 0.06595584244037449, 'random_strength': 7.036644986032894, 'grow_policy': 'Depthwise', 'min_data_in_leaf': 128}. Best is trial 568 with value: 1659.4433932934307.[0m
[32m[I 2024-10-13 13:20:28,664][0m Trial 893 finished with value: 1756.4293920639132 and parameters: {'depth': 5, 'learning_rate': 0.0010815336702794485, 'iterations': 2126, 'l2_leaf_reg': 7.560143678424296e-08, 'border_count': 29, 'bagging_temperature': 0.5127035638950895, 'random_strength': 4.091934918165867, 'grow_policy': 'Depthwise', 'min_data_in_leaf': 142}. Best is trial 568 with value: 1659.4433932934307.[0m
[32m[I 2024-10-13 13:20:30,589][0m Trial 894 finished with value: 2000.7403121410473 and parameters: {'depth': 8, 'learning_rate': 0.002351946582164558, 'iterations': 1853, 'l2_leaf_reg': 4.938099202469184e-07, 'border_count': 20, 'bagging_temperature': 0.024657152630895296, 'random_strength': 6.4523844067027, 'grow_policy': 'Depthwise', 'min_data_in_leaf': 277}. Best is trial 568 with value: 1659.4433932934307.[0m
[32m[I 2024-10-13 13:20:32,640][0m Trial 895 finished with value: 1947.4812595948013 and parameters: {'depth': 9, 'learning_rate': 0.0014330083997774862, 'iterations': 2092, 'l2_leaf_reg': 0.007812082627776996, 'border_count': 14, 'bagging_temperature': 0.043885383327545754, 'random_strength': 4.518459619916587, 'grow_policy': 'Depthwise', 'min_data_in_leaf': 169}. Best is trial 568 with value: 1659.4433932934307.[0m
[32m[I 2024-10-13 13:20:33,904][0m Trial 896 finished with value: 2139.878012773819 and parameters: {'depth': 8, 'learning_rate': 0.0009673899116904163, 'iterations': 990, 'l2_leaf_reg': 1.207517919088931e-07, 'border_count': 38, 'bagging_temperature': 0.0183644931773119, 'random_strength': 7.742729450574803, 'grow_policy': 'Depthwise', 'min_data_in_leaf': 103}. Best is trial 568 with value: 1659.4433932934307.[0m
[32m[I 2024-10-13 13:20:36,611][0m Trial 897 finished with value: 1785.0163708348916 and parameters: {'depth': 4, 'learning_rate': 0.0012882247228907825, 'iterations': 1952, 'l2_leaf_reg': 6.511532140380223e-08, 'border_count': 26, 'bagging_temperature': 0.06428975990998012, 'random_strength': 7.5518165263719395, 'grow_policy': 'Depthwise', 'min_data_in_leaf': 53}. Best is trial 568 with value: 1659.4433932934307.[0m
[32m[I 2024-10-13 13:20:39,003][0m Trial 898 finished with value: 2382.070304683348 and parameters: {'depth': 9, 'learning_rate': 0.0002671533327852214, 'iterations': 2399, 'l2_leaf_reg': 3.070348064444316e-08, 'border_count': 32, 'bagging_temperature': 0.0352047963986134, 'random_strength': 7.338799701627808, 'grow_policy': 'Depthwise', 'min_data_in_leaf': 114}. Best is trial 568 with value: 1659.4433932934307.[0m
[32m[I 2024-10-13 13:20:41,069][0m Trial 899 finished with value: 2133.4912605466043 and parameters: {'depth': 9, 'learning_rate': 0.003437128402633754, 'iterations': 2022, 'l2_leaf_reg': 2.3576480369939605e-07, 'border_count': 17, 'bagging_temperature': 0.016919120545457078, 'random_strength': 3.4152566271925755, 'grow_policy': 'Depthwise', 'min_data_in_leaf': 140}. Best is trial 568 with value: 1659.4433932934307.[0m
[32m[I 2024-10-13 13:20:43,231][0m Trial 900 finished with value: 1771.0504835382158 and parameters: {'depth': 8, 'learning_rate': 0.0016752454796408198, 'iterations': 2164, 'l2_leaf_reg': 1.0333986075126042e-07, 'border_count': 24, 'bagging_temperature': 0.09541175244219824, 'random_strength': 6.670018107141381, 'grow_policy': 'Depthwise', 'min_data_in_leaf': 309}. Best is trial 568 with value: 1659.4433932934307.[0m
[32m[I 2024-10-13 13:20:44,938][0m Trial 901 finished with value: 1718.533116973544 and parameters: {'depth': 7, 'learning_rate': 0.0019869391176148866, 'iterations': 1530, 'l2_leaf_reg': 4.455649818519029e-08, 'border_count': 29, 'bagging_temperature': 0.050305096054519605, 'random_strength': 5.932864820378882, 'grow_policy': 'Depthwise', 'min_data_in_leaf': 245}. Best is trial 568 with value: 1659.4433932934307.[0m
[32m[I 2024-10-13 13:20:45,991][0m Trial 902 finished with value: 2137.7369305032157 and parameters: {'depth': 12, 'learning_rate': 0.001408420653452229, 'iterations': 689, 'l2_leaf_reg': 1.5910650132499194e-07, 'border_count': 21, 'bagging_temperature': 0.25644906349022667, 'random_strength': 6.878892414636983, 'grow_policy': 'Depthwise', 'min_data_in_leaf': 95}. Best is trial 568 with value: 1659.4433932934307.[0m
[32m[I 2024-10-13 13:20:47,494][0m Trial 903 finished with value: 2253.372068814297 and parameters: {'depth': 9, 'learning_rate': 0.0006443488594823121, 'iterations': 821, 'l2_leaf_reg': 3.833104280125846e-07, 'border_count': 11, 'bagging_temperature': 0.07498956493702208, 'random_strength': 7.147052505261197, 'grow_policy': 'Depthwise', 'min_data_in_leaf': 33}. Best is trial 568 with value: 1659.4433932934307.[0m
[32m[I 2024-10-13 13:20:50,078][0m Trial 904 finished with value: 1729.7139236828352 and parameters: {'depth': 7, 'learning_rate': 0.0008558035967524206, 'iterations': 2679, 'l2_leaf_reg': 1.7051129710510112e-08, 'border_count': 34, 'bagging_temperature': 0.016573980764191545, 'random_strength': 7.405856326073136, 'grow_policy': 'Depthwise', 'min_data_in_leaf': 154}. Best is trial 568 with value: 1659.4433932934307.[0m
[32m[I 2024-10-13 13:21:02,453][0m Trial 905 finished with value: 2106.239310522599 and parameters: {'depth': 6, 'learning_rate': 0.0011146257218552242, 'iterations': 2277, 'l2_leaf_reg': 1.3916956198636213e-06, 'border_count': 150, 'bagging_temperature': 0.03490014594624308, 'random_strength': 8.102554399170806, 'grow_policy': 'SymmetricTree', 'min_data_in_leaf': 196}. Best is trial 568 with value: 1659.4433932934307.[0m
[32m[I 2024-10-13 13:21:04,252][0m Trial 906 finished with value: 1699.2975363001535 and parameters: {'depth': 5, 'learning_rate': 0.0016785443853713122, 'iterations': 1703, 'l2_leaf_reg': 8.050967316103791e-07, 'border_count': 25, 'bagging_temperature': 0.05333938085340771, 'random_strength': 8.556882012611483, 'grow_policy': 'Depthwise', 'min_data_in_leaf': 128}. Best is trial 568 with value: 1659.4433932934307.[0m
[32m[I 2024-10-13 13:21:06,004][0m Trial 907 finished with value: 1727.7754156621024 and parameters: {'depth': 5, 'learning_rate': 0.002366319329513617, 'iterations': 1671, 'l2_leaf_reg': 2.356428714180261e-06, 'border_count': 25, 'bagging_temperature': 0.0439384364476664, 'random_strength': 8.97947813406384, 'grow_policy': 'Depthwise', 'min_data_in_leaf': 125}. Best is trial 568 with value: 1659.4433932934307.[0m
[32m[I 2024-10-13 13:21:07,806][0m Trial 908 finished with value: 1965.5631517218433 and parameters: {'depth': 5, 'learning_rate': 0.0019396753751976515, 'iterations': 1730, 'l2_leaf_reg': 1.2424765764330917e-06, 'border_count': 16, 'bagging_temperature': 0.0006601765176211111, 'random_strength': 8.42844723032275, 'grow_policy': 'Depthwise', 'min_data_in_leaf': 112}. Best is trial 568 with value: 1659.4433932934307.[0m
[32m[I 2024-10-13 13:21:09,778][0m Trial 909 finished with value: 2155.1678026831964 and parameters: {'depth': 5, 'learning_rate': 0.0026357097423676348, 'iterations': 1502, 'l2_leaf_reg': 5.416571436809648e-07, 'border_count': 42, 'bagging_temperature': 0.02749019758284755, 'random_strength': 8.600441671809149, 'grow_policy': 'Depthwise', 'min_data_in_leaf': 86}. Best is trial 568 with value: 1659.4433932934307.[0m
[32m[I 2024-10-13 13:21:11,548][0m Trial 910 finished with value: 1716.476370650314 and parameters: {'depth': 5, 'learning_rate': 0.0018300441618887674, 'iterations': 1593, 'l2_leaf_reg': 1.7310268758509526e-06, 'border_count': 30, 'bagging_temperature': 0.053734854704773585, 'random_strength': 8.56277397292914, 'grow_policy': 'Depthwise', 'min_data_in_leaf': 152}. Best is trial 568 with value: 1659.4433932934307.[0m
[32m[I 2024-10-13 13:21:13,224][0m Trial 911 finished with value: 1919.094813406307 and parameters: {'depth': 5, 'learning_rate': 0.0016322387491866698, 'iterations': 1562, 'l2_leaf_reg': 1.0503376649794453e-06, 'border_count': 20, 'bagging_temperature': 0.0001963813780760462, 'random_strength': 8.62786774991495, 'grow_policy': 'Depthwise', 'min_data_in_leaf': 129}. Best is trial 568 with value: 1659.4433932934307.[0m
[32m[I 2024-10-13 13:21:15,017][0m Trial 912 finished with value: 1770.4186733238969 and parameters: {'depth': 5, 'learning_rate': 0.002244297680296637, 'iterations': 1676, 'l2_leaf_reg': 7.686934954867266e-07, 'border_count': 24, 'bagging_temperature': 0.03342697515729513, 'random_strength': 8.314473537615616, 'grow_policy': 'Depthwise', 'min_data_in_leaf': 182}. Best is trial 568 with value: 1659.4433932934307.[0m
