[32m[I 2024-10-13 12:23:32,391][0m Trial 51 finished with value: 1765.050194325909 and parameters: {'depth': 9, 'learning_rate': 0.0012563381160774435, 'iterations': 3000, 'l2_leaf_reg': 2.353640240811179e-08, 'border_count': 37, 'bagging_temperature': 0.7882014239196908, 'random_strength': 9.045033839562052, 'grow_policy': 'Lossguide', 'min_data_in_leaf': 6, 'max_leaves': 188}. Best is trial 11 with value: 1717.8539248499665.[0m
[32m[I 2024-10-13 12:23:35,156][0m Trial 52 finished with value: 1760.2483350303526 and parameters: {'depth': 11, 'learning_rate': 0.0008401478617798884, 'iterations': 2996, 'l2_leaf_reg': 2.0358845761896575e-08, 'border_count': 38, 'bagging_temperature': 0.8458278443798658, 'random_strength': 9.07034298602126, 'grow_policy': 'Lossguide', 'min_data_in_leaf': 224, 'max_leaves': 200}. Best is trial 11 with value: 1717.8539248499665.[0m
[32m[I 2024-10-13 12:24:07,224][0m Trial 53 finished with value: 1947.329673185481 and parameters: {'depth': 12, 'learning_rate': 0.00018761637547426766, 'iterations': 2975, 'l2_leaf_reg': 1.952199676118767e-08, 'border_count': 62, 'bagging_temperature': 0.8189316085789626, 'random_strength': 9.10278590689228, 'grow_policy': 'Lossguide', 'min_data_in_leaf': 2, 'max_leaves': 199}. Best is trial 11 with value: 1717.8539248499665.[0m
[32m[I 2024-10-13 12:24:10,507][0m Trial 54 finished with value: 1829.846355024905 and parameters: {'depth': 13, 'learning_rate': 0.0003736146683043996, 'iterations': 2985, 'l2_leaf_reg': 1.1926442465871635e-07, 'border_count': 49, 'bagging_temperature': 0.8703406590364603, 'random_strength': 9.133371222906046, 'grow_policy': 'Lossguide', 'min_data_in_leaf': 60, 'max_leaves': 199}. Best is trial 11 with value: 1717.8539248499665.[0m
[32m[I 2024-10-13 12:24:12,943][0m Trial 55 finished with value: 1809.9616105471346 and parameters: {'depth': 11, 'learning_rate': 0.0007511982263398232, 'iterations': 2599, 'l2_leaf_reg': 0.10716693141774997, 'border_count': 39, 'bagging_temperature': 0.6776442518467389, 'random_strength': 9.837017521446022, 'grow_policy': 'Lossguide', 'min_data_in_leaf': 162, 'max_leaves': 202}. Best is trial 11 with value: 1717.8539248499665.[0m
[32m[I 2024-10-13 12:24:15,450][0m Trial 56 finished with value: 1976.9427729028478 and parameters: {'depth': 11, 'learning_rate': 0.000599243982856739, 'iterations': 2702, 'l2_leaf_reg': 1.05037503407983e-08, 'border_count': 20, 'bagging_temperature': 0.7473437176050486, 'random_strength': 9.491608899103696, 'grow_policy': 'Lossguide', 'min_data_in_leaf': 240, 'max_leaves': 160}. Best is trial 11 with value: 1717.8539248499665.[0m
[32m[I 2024-10-13 12:24:18,043][0m Trial 57 finished with value: 1744.6142653418117 and parameters: {'depth': 10, 'learning_rate': 0.0010443991906817613, 'iterations': 2860, 'l2_leaf_reg': 0.027848013307878037, 'border_count': 5, 'bagging_temperature': 0.6269580211394354, 'random_strength': 8.069084822826309, 'grow_policy': 'Lossguide', 'min_data_in_leaf': 794, 'max_leaves': 129}. Best is trial 11 with value: 1717.8539248499665.[0m
[32m[I 2024-10-13 12:24:20,768][0m Trial 58 finished with value: 1828.3526281232694 and parameters: {'depth': 10, 'learning_rate': 0.0010562531136185532, 'iterations': 2989, 'l2_leaf_reg': 5.7596282439490345, 'border_count': 11, 'bagging_temperature': 0.6222659394587753, 'random_strength': 8.198766652563148, 'grow_policy': 'Lossguide', 'min_data_in_leaf': 717, 'max_leaves': 125}. Best is trial 11 with value: 1717.8539248499665.[0m
[32m[I 2024-10-13 12:24:23,395][0m Trial 59 finished with value: 2081.0160707492128 and parameters: {'depth': 10, 'learning_rate': 0.0003824174301561208, 'iterations': 2866, 'l2_leaf_reg': 0.01593859442881654, 'border_count': 5, 'bagging_temperature': 0.8532993392172921, 'random_strength': 8.792434124232699, 'grow_policy': 'Lossguide', 'min_data_in_leaf': 837, 'max_leaves': 217}. Best is trial 11 with value: 1717.8539248499665.[0m
[32m[I 2024-10-13 12:24:25,918][0m Trial 60 finished with value: 2586.266716421307 and parameters: {'depth': 9, 'learning_rate': 0.00017102846032948527, 'iterations': 2635, 'l2_leaf_reg': 0.03835032219436506, 'border_count': 159, 'bagging_temperature': 0.5197137825147118, 'random_strength': 9.00186438976373, 'grow_policy': 'Lossguide', 'min_data_in_leaf': 769, 'max_leaves': 102}. Best is trial 11 with value: 1717.8539248499665.[0m
[32m[I 2024-10-13 12:24:29,586][0m Trial 61 finished with value: 1899.9731644986596 and parameters: {'depth': 12, 'learning_rate': 0.0013225657508074435, 'iterations': 2796, 'l2_leaf_reg': 1.0798884434182584e-07, 'border_count': 23, 'bagging_temperature': 0.7228712511717982, 'random_strength': 7.914863220527066, 'grow_policy': 'Lossguide', 'min_data_in_leaf': 51, 'max_leaves': 153}. Best is trial 11 with value: 1717.8539248499665.[0m
[32m[I 2024-10-13 12:24:32,223][0m Trial 62 finished with value: 1797.8983150997794 and parameters: {'depth': 13, 'learning_rate': 0.0008340938262039118, 'iterations': 2884, 'l2_leaf_reg': 2.130070117232364, 'border_count': 42, 'bagging_temperature': 0.8004394965429354, 'random_strength': 7.308454892447792, 'grow_policy': 'Lossguide', 'min_data_in_leaf': 800, 'max_leaves': 181}. Best is trial 11 with value: 1717.8539248499665.[0m
[32m[I 2024-10-13 12:24:34,787][0m Trial 63 finished with value: 1856.6849951014065 and parameters: {'depth': 9, 'learning_rate': 0.000607821377727923, 'iterations': 2771, 'l2_leaf_reg': 3.139472512257289e-08, 'border_count': 31, 'bagging_temperature': 0.9079024598528678, 'random_strength': 8.366568034663667, 'grow_policy': 'Lossguide', 'min_data_in_leaf': 923, 'max_leaves': 134}. Best is trial 11 with value: 1717.8539248499665.[0m
[32m[I 2024-10-13 12:24:37,211][0m Trial 64 finished with value: 2844.9384201522453 and parameters: {'depth': 11, 'learning_rate': 0.0016258862949376125, 'iterations': 2688, 'l2_leaf_reg': 6.445988384235538e-07, 'border_count': 1, 'bagging_temperature': 0.6380553543733373, 'random_strength': 9.444620505204284, 'grow_policy': 'Lossguide', 'min_data_in_leaf': 879, 'max_leaves': 83}. Best is trial 11 with value: 1717.8539248499665.[0m
[32m[I 2024-10-13 12:31:46,827][0m Trial 65 finished with value: 1875.190919350571 and parameters: {'depth': 14, 'learning_rate': 0.0010039186176854164, 'iterations': 2994, 'l2_leaf_reg': 0.0006815374084199829, 'border_count': 126, 'bagging_temperature': 0.8356711607353741, 'random_strength': 0.593144112114504, 'grow_policy': 'SymmetricTree', 'min_data_in_leaf': 85}. Best is trial 11 with value: 1717.8539248499665.[0m
[32m[I 2024-10-13 12:31:49,017][0m Trial 66 finished with value: 2129.9740482905345 and parameters: {'depth': 10, 'learning_rate': 0.010446825520847235, 'iterations': 2534, 'l2_leaf_reg': 1.726533235575836e-05, 'border_count': 53, 'bagging_temperature': 0.5645747024018996, 'random_strength': 7.625412621885176, 'grow_policy': 'Lossguide', 'min_data_in_leaf': 188, 'max_leaves': 222}. Best is trial 11 with value: 1717.8539248499665.[0m
[32m[I 2024-10-13 12:31:51,703][0m Trial 67 finished with value: 2287.9250448332923 and parameters: {'depth': 12, 'learning_rate': 0.00027876679237566113, 'iterations': 2890, 'l2_leaf_reg': 2.2683865392762688e-07, 'border_count': 10, 'bagging_temperature': 0.7328167808683608, 'random_strength': 6.851278683609433, 'grow_policy': 'Lossguide', 'min_data_in_leaf': 256, 'max_leaves': 184}. Best is trial 11 with value: 1717.8539248499665.[0m
[32m[I 2024-10-13 12:31:52,404][0m Trial 68 finished with value: 2773.5784583567865 and parameters: {'depth': 9, 'learning_rate': 0.0014289018356867923, 'iterations': 222, 'l2_leaf_reg': 5.725934785960524e-08, 'border_count': 24, 'bagging_temperature': 0.7811574131480572, 'random_strength': 6.314583232383553, 'grow_policy': 'Lossguide', 'min_data_in_leaf': 136, 'max_leaves': 138}. Best is trial 11 with value: 1717.8539248499665.[0m
[32m[I 2024-10-13 12:31:54,991][0m Trial 69 finished with value: 2112.5165292423594 and parameters: {'depth': 11, 'learning_rate': 0.0034979086499290434, 'iterations': 2741, 'l2_leaf_reg': 8.714143091880721e-06, 'border_count': 64, 'bagging_temperature': 0.6982830811963125, 'random_strength': 1.7611580811616587, 'grow_policy': 'Lossguide', 'min_data_in_leaf': 798, 'max_leaves': 145}. Best is trial 11 with value: 1717.8539248499665.[0m
[32m[I 2024-10-13 12:32:02,454][0m Trial 70 finished with value: 2238.3869733795855 and parameters: {'depth': 7, 'learning_rate': 0.0007481831095017307, 'iterations': 1021, 'l2_leaf_reg': 2.791541357740026e-06, 'border_count': 32, 'bagging_temperature': 0.9399347873126641, 'random_strength': 2.572052124815867, 'grow_policy': 'SymmetricTree', 'min_data_in_leaf': 965}. Best is trial 11 with value: 1717.8539248499665.[0m
[32m[I 2024-10-13 12:32:05,046][0m Trial 71 finished with value: 1773.97549391497 and parameters: {'depth': 8, 'learning_rate': 0.0021141810230778, 'iterations': 2797, 'l2_leaf_reg': 2.0831482189019708e-08, 'border_count': 38, 'bagging_temperature': 0.04308047117043645, 'random_strength': 7.84190706496187, 'grow_policy': 'Depthwise', 'min_data_in_leaf': 333}. Best is trial 11 with value: 1717.8539248499665.[0m
[32m[I 2024-10-13 12:32:07,707][0m Trial 72 finished with value: 2049.2637517170874 and parameters: {'depth': 7, 'learning_rate': 0.00242999675038228, 'iterations': 2920, 'l2_leaf_reg': 1.7889787924485387e-08, 'border_count': 47, 'bagging_temperature': 0.03137537203221106, 'random_strength': 7.823204459551668, 'grow_policy': 'Lossguide', 'min_data_in_leaf': 328, 'max_leaves': 182}. Best is trial 11 with value: 1717.8539248499665.[0m
[32m[I 2024-10-13 12:32:10,324][0m Trial 73 finished with value: 2051.3097509511226 and parameters: {'depth': 8, 'learning_rate': 0.00046969414894064713, 'iterations': 2789, 'l2_leaf_reg': 8.580902584218829e-08, 'border_count': 20, 'bagging_temperature': 0.4668287974417543, 'random_strength': 8.814358055890334, 'grow_policy': 'Depthwise', 'min_data_in_leaf': 211}. Best is trial 11 with value: 1717.8539248499665.[0m
[32m[I 2024-10-13 12:32:12,956][0m Trial 74 finished with value: 1825.1934959389366 and parameters: {'depth': 10, 'learning_rate': 0.0011984540722932114, 'iterations': 2656, 'l2_leaf_reg': 2.952512110976373e-07, 'border_count': 56, 'bagging_temperature': 0.0014161596317668335, 'random_strength': 7.48811446193637, 'grow_policy': 'Depthwise', 'min_data_in_leaf': 347}. Best is trial 11 with value: 1717.8539248499665.[0m
[32m[I 2024-10-13 12:32:15,289][0m Trial 75 finished with value: 1767.1931084425414 and parameters: {'depth': 8, 'learning_rate': 0.0018497491879589404, 'iterations': 2437, 'l2_leaf_reg': 4.1563012647083094e-08, 'border_count': 35, 'bagging_temperature': 0.0841077005051572, 'random_strength': 8.482191983430226, 'grow_policy': 'Lossguide', 'min_data_in_leaf': 682, 'max_leaves': 96}. Best is trial 11 with value: 1717.8539248499665.[0m
[32m[I 2024-10-13 12:32:17,721][0m Trial 76 finished with value: 2091.541182301586 and parameters: {'depth': 7, 'learning_rate': 0.004170285187820893, 'iterations': 2518, 'l2_leaf_reg': 4.526346797521874e-08, 'border_count': 43, 'bagging_temperature': 0.08679135076259803, 'random_strength': 8.562123184222932, 'grow_policy': 'Depthwise', 'min_data_in_leaf': 663}. Best is trial 11 with value: 1717.8539248499665.[0m
[32m[I 2024-10-13 12:32:35,398][0m Trial 77 finished with value: 1990.847307988286 and parameters: {'depth': 8, 'learning_rate': 0.0019035856162978185, 'iterations': 2369, 'l2_leaf_reg': 1.69806499528725e-08, 'border_count': 28, 'bagging_temperature': 0.04274414815488516, 'random_strength': 8.105251870569349, 'grow_policy': 'SymmetricTree', 'min_data_in_leaf': 732}. Best is trial 11 with value: 1717.8539248499665.[0m
[32m[I 2024-10-13 12:32:38,046][0m Trial 78 finished with value: 1813.6800346972293 and parameters: {'depth': 9, 'learning_rate': 0.0068709735982999155, 'iterations': 2913, 'l2_leaf_reg': 1.393017820675073e-07, 'border_count': 9, 'bagging_temperature': 0.06661865287327548, 'random_strength': 9.246763966674756, 'grow_policy': 'Depthwise', 'min_data_in_leaf': 636}. Best is trial 11 with value: 1717.8539248499665.[0m
[32m[I 2024-10-13 12:32:38,897][0m Trial 79 finished with value: 2725.0249414951 and parameters: {'depth': 6, 'learning_rate': 0.0008717971408905072, 'iterations': 396, 'l2_leaf_reg': 7.148175983663307e-08, 'border_count': 20, 'bagging_temperature': 0.027522218411099864, 'random_strength': 9.776525845289989, 'grow_policy': 'Lossguide', 'min_data_in_leaf': 550, 'max_leaves': 87}. Best is trial 11 with value: 1717.8539248499665.[0m
[32m[I 2024-10-13 12:32:41,243][0m Trial 80 finished with value: 2637.6606256108585 and parameters: {'depth': 8, 'learning_rate': 0.22806311447826152, 'iterations': 2461, 'l2_leaf_reg': 1.0584465561397064e-06, 'border_count': 203, 'bagging_temperature': 0.10361330849210296, 'random_strength': 8.471169006037394, 'grow_policy': 'Depthwise', 'min_data_in_leaf': 859}. Best is trial 11 with value: 1717.8539248499665.[0m
[32m[I 2024-10-13 12:32:43,847][0m Trial 81 finished with value: 1797.680775648904 and parameters: {'depth': 8, 'learning_rate': 0.0016054616718334258, 'iterations': 2750, 'l2_leaf_reg': 1.7182069570336827e-08, 'border_count': 39, 'bagging_temperature': 0.6318126336035378, 'random_strength': 6.9940484128267615, 'grow_policy': 'Lossguide', 'min_data_in_leaf': 687, 'max_leaves': 103}. Best is trial 11 with value: 1717.8539248499665.[0m
[32m[I 2024-10-13 12:32:46,449][0m Trial 82 finished with value: 1762.4154881311517 and parameters: {'depth': 9, 'learning_rate': 0.001143385225180492, 'iterations': 2861, 'l2_leaf_reg': 2.849758621072997e-08, 'border_count': 33, 'bagging_temperature': 0.7855995563659269, 'random_strength': 8.020751650251988, 'grow_policy': 'Lossguide', 'min_data_in_leaf': 277, 'max_leaves': 65}. Best is trial 11 with value: 1717.8539248499665.[0m
[32m[I 2024-10-13 12:32:49,072][0m Trial 83 finished with value: 1814.8313034047385 and parameters: {'depth': 9, 'learning_rate': 0.0009809547163561188, 'iterations': 2913, 'l2_leaf_reg': 3.378481816285434e-07, 'border_count': 56, 'bagging_temperature': 0.32749049716999945, 'random_strength': 7.9356926980600875, 'grow_policy': 'Lossguide', 'min_data_in_leaf': 273, 'max_leaves': 62}. Best is trial 11 with value: 1717.8539248499665.[0m
[32m[I 2024-10-13 12:32:51,681][0m Trial 84 finished with value: 1806.7911609483422 and parameters: {'depth': 10, 'learning_rate': 0.0021169484626106278, 'iterations': 2852, 'l2_leaf_reg': 3.679847020713566e-08, 'border_count': 33, 'bagging_temperature': 0.9030867882530419, 'random_strength': 8.918677878018807, 'grow_policy': 'Lossguide', 'min_data_in_leaf': 462, 'max_leaves': 65}. Best is trial 11 with value: 1717.8539248499665.[0m
[32m[I 2024-10-13 12:32:53,450][0m Trial 85 finished with value: 1987.8005175915923 and parameters: {'depth': 9, 'learning_rate': 0.0028310693653902995, 'iterations': 1708, 'l2_leaf_reg': 0.000273039785290799, 'border_count': 45, 'bagging_temperature': 0.7811849041925342, 'random_strength': 8.283861039650587, 'grow_policy': 'Lossguide', 'min_data_in_leaf': 405, 'max_leaves': 82}. Best is trial 11 with value: 1717.8539248499665.[0m
[32m[I 2024-10-13 12:32:55,973][0m Trial 86 finished with value: 1897.3854054469098 and parameters: {'depth': 7, 'learning_rate': 0.0005412191298331355, 'iterations': 2610, 'l2_leaf_reg': 1.7916085149606473e-07, 'border_count': 71, 'bagging_temperature': 0.05597387293277417, 'random_strength': 7.239625712994534, 'grow_policy': 'Depthwise', 'min_data_in_leaf': 750}. Best is trial 11 with value: 1717.8539248499665.[0m
[32m[I 2024-10-13 12:32:58,718][0m Trial 87 finished with value: 1755.8094334862708 and parameters: {'depth': 8, 'learning_rate': 0.0012297120386981207, 'iterations': 3000, 'l2_leaf_reg': 1.3967142896662956e-08, 'border_count': 26, 'bagging_temperature': 0.39509302909911226, 'random_strength': 3.7374730362918065, 'grow_policy': 'Lossguide', 'min_data_in_leaf': 785, 'max_leaves': 47}. Best is trial 11 with value: 1717.8539248499665.[0m
[32m[I 2024-10-13 12:33:01,444][0m Trial 88 finished with value: 1778.6229314475538 and parameters: {'depth': 9, 'learning_rate': 0.0006892479362515278, 'iterations': 2998, 'l2_leaf_reg': 1.545521630523284e-08, 'border_count': 7, 'bagging_temperature': 0.3787228316824405, 'random_strength': 3.606989111880195, 'grow_policy': 'Lossguide', 'min_data_in_leaf': 721, 'max_leaves': 46}. Best is trial 11 with value: 1717.8539248499665.[0m
[32m[I 2024-10-13 12:33:04,076][0m Trial 89 finished with value: 1960.2107781923835 and parameters: {'depth': 10, 'learning_rate': 0.0011980601995197739, 'iterations': 2912, 'l2_leaf_reg': 1.1985883919977714e-08, 'border_count': 18, 'bagging_temperature': 0.8103417484111667, 'random_strength': 3.8188811923741963, 'grow_policy': 'Lossguide', 'min_data_in_leaf': 819, 'max_leaves': 33}. Best is trial 11 with value: 1717.8539248499665.[0m
[32m[I 2024-10-13 12:33:06,627][0m Trial 90 finished with value: 1789.0697554413093 and parameters: {'depth': 6, 'learning_rate': 0.0008886267830016786, 'iterations': 2714, 'l2_leaf_reg': 0.0012488799760974505, 'border_count': 87, 'bagging_temperature': 0.5960192957618915, 'random_strength': 4.500814539992601, 'grow_policy': 'Lossguide', 'min_data_in_leaf': 608, 'max_leaves': 70}. Best is trial 11 with value: 1717.8539248499665.[0m
[32m[I 2024-10-13 12:33:08,178][0m Trial 91 finished with value: 1796.4096278654647 and parameters: {'depth': 8, 'learning_rate': 0.013546653904054197, 'iterations': 1353, 'l2_leaf_reg': 2.8701219472805225e-08, 'border_count': 25, 'bagging_temperature': 0.46141421460793003, 'random_strength': 3.0246225944691547, 'grow_policy': 'Lossguide', 'min_data_in_leaf': 787, 'max_leaves': 49}. Best is trial 11 with value: 1717.8539248499665.[0m
[32m[I 2024-10-13 12:33:10,799][0m Trial 92 finished with value: 1797.6223835877347 and parameters: {'depth': 7, 'learning_rate': 0.005783781459700977, 'iterations': 2820, 'l2_leaf_reg': 7.509711441730467e-08, 'border_count': 36, 'bagging_temperature': 0.21832753423756235, 'random_strength': 8.536310109743921, 'grow_policy': 'Depthwise', 'min_data_in_leaf': 700}. Best is trial 11 with value: 1717.8539248499665.[0m
[32m[I 2024-10-13 12:33:13,497][0m Trial 93 finished with value: 1789.940078627045 and parameters: {'depth': 8, 'learning_rate': 0.0016696263924937148, 'iterations': 3000, 'l2_leaf_reg': 4.355296677045238e-08, 'border_count': 28, 'bagging_temperature': 0.3697232713780817, 'random_strength': 2.1736128333018483, 'grow_policy': 'Lossguide', 'min_data_in_leaf': 226, 'max_leaves': 97}. Best is trial 11 with value: 1717.8539248499665.[0m
[32m[I 2024-10-13 12:33:16,021][0m Trial 94 finished with value: 1828.3176597371757 and parameters: {'depth': 8, 'learning_rate': 0.0011953801666533688, 'iterations': 2570, 'l2_leaf_reg': 3.240546407479619e-05, 'border_count': 44, 'bagging_temperature': 0.01658052780247571, 'random_strength': 9.661823567296356, 'grow_policy': 'Depthwise', 'min_data_in_leaf': 318}. Best is trial 11 with value: 1717.8539248499665.[0m
[32m[I 2024-10-13 12:33:18,704][0m Trial 95 finished with value: 2287.414941804035 and parameters: {'depth': 8, 'learning_rate': 0.009066473199001248, 'iterations': 2931, 'l2_leaf_reg': 0.43210348954581157, 'border_count': 16, 'bagging_temperature': 0.42830355332727166, 'random_strength': 8.033826794470304, 'grow_policy': 'Lossguide', 'min_data_in_leaf': 862, 'max_leaves': 71}. Best is trial 11 with value: 1717.8539248499665.[0m
[32m[I 2024-10-13 12:33:21,457][0m Trial 96 finished with value: 2080.6407663015216 and parameters: {'depth': 9, 'learning_rate': 0.00256575777932263, 'iterations': 2861, 'l2_leaf_reg': 2.1807817707758e-08, 'border_count': 54, 'bagging_temperature': 0.2542975497309718, 'random_strength': 6.338988098987013, 'grow_policy': 'Depthwise', 'min_data_in_leaf': 750}. Best is trial 11 with value: 1717.8539248499665.[0m
[32m[I 2024-10-13 12:33:24,022][0m Trial 97 finished with value: 1781.1066671672545 and parameters: {'depth': 10, 'learning_rate': 0.003886981657120936, 'iterations': 2684, 'l2_leaf_reg': 0.007081800220209872, 'border_count': 37, 'bagging_temperature': 0.1257082003308137, 'random_strength': 9.291312571172082, 'grow_policy': 'Lossguide', 'min_data_in_leaf': 828, 'max_leaves': 112}. Best is trial 11 with value: 1717.8539248499665.[0m
[32m[I 2024-10-13 12:34:46,162][0m Trial 98 finished with value: 2065.123979207347 and parameters: {'depth': 11, 'learning_rate': 0.0006610314553204821, 'iterations': 2765, 'l2_leaf_reg': 1.1868108779990274e-07, 'border_count': 64, 'bagging_temperature': 0.0828010503093989, 'random_strength': 5.120087722234988, 'grow_policy': 'SymmetricTree', 'min_data_in_leaf': 781}. Best is trial 11 with value: 1717.8539248499665.[0m
[32m[I 2024-10-13 12:34:48,208][0m Trial 99 finished with value: 1747.2722157953006 and parameters: {'depth': 9, 'learning_rate': 0.0019865032536734023, 'iterations': 2133, 'l2_leaf_reg': 5.8099672256433877e-08, 'border_count': 25, 'bagging_temperature': 0.15663082601105127, 'random_strength': 5.808494899585665, 'grow_policy': 'Lossguide', 'min_data_in_leaf': 375, 'max_leaves': 237}. Best is trial 11 with value: 1717.8539248499665.[0m
[32m[I 2024-10-13 12:34:50,325][0m Trial 100 finished with value: 2002.647275388931 and parameters: {'depth': 9, 'learning_rate': 0.001995095802509198, 'iterations': 2061, 'l2_leaf_reg': 3.439136225870111e-08, 'border_count': 14, 'bagging_temperature': 0.17504797935170813, 'random_strength': 4.8728641370620025, 'grow_policy': 'Lossguide', 'min_data_in_leaf': 432, 'max_leaves': 250}. Best is trial 11 with value: 1717.8539248499665.[0m
