[32m[I 2024-10-13 12:52:52,449][0m Trial 456 finished with value: 1759.8942274211922 and parameters: {'depth': 8, 'learning_rate': 0.001966421253749062, 'iterations': 2003, 'l2_leaf_reg': 3.4740226834148105e-08, 'border_count': 39, 'bagging_temperature': 0.15608276960752673, 'random_strength': 8.432664443136291, 'grow_policy': 'Lossguide', 'min_data_in_leaf': 414, 'max_leaves': 89}. Best is trial 249 with value: 1695.0689015039372.[0m
[32m[I 2024-10-13 12:52:54,570][0m Trial 457 finished with value: 1751.005784790015 and parameters: {'depth': 7, 'learning_rate': 0.001440603484937331, 'iterations': 1887, 'l2_leaf_reg': 7.45691896357763e-08, 'border_count': 34, 'bagging_temperature': 0.6959999715278296, 'random_strength': 8.913213162938314, 'grow_policy': 'Lossguide', 'min_data_in_leaf': 89, 'max_leaves': 217}. Best is trial 249 with value: 1695.0689015039372.[0m
[32m[I 2024-10-13 12:52:56,499][0m Trial 458 finished with value: 1967.3388954856669 and parameters: {'depth': 8, 'learning_rate': 0.0009603769038435805, 'iterations': 1945, 'l2_leaf_reg': 4.501240424241171e-08, 'border_count': 193, 'bagging_temperature': 0.04961421998809981, 'random_strength': 7.884366515566262, 'grow_policy': 'Lossguide', 'min_data_in_leaf': 118, 'max_leaves': 74}. Best is trial 249 with value: 1695.0689015039372.[0m
[32m[I 2024-10-13 12:52:58,542][0m Trial 459 finished with value: 1732.7561554865774 and parameters: {'depth': 8, 'learning_rate': 0.0016496556165658115, 'iterations': 2064, 'l2_leaf_reg': 9.406784074514279e-08, 'border_count': 39, 'bagging_temperature': 0.12287391081744586, 'random_strength': 8.205894462458529, 'grow_policy': 'Lossguide', 'min_data_in_leaf': 136, 'max_leaves': 195}. Best is trial 249 with value: 1695.0689015039372.[0m
[32m[I 2024-10-13 12:53:01,230][0m Trial 460 finished with value: 1826.0095140537794 and parameters: {'depth': 8, 'learning_rate': 0.0012936459808368347, 'iterations': 2001, 'l2_leaf_reg': 6.556683981923127e-08, 'border_count': 33, 'bagging_temperature': 0.08194590303210676, 'random_strength': 7.933745460946014, 'grow_policy': 'Lossguide', 'min_data_in_leaf': 57, 'max_leaves': 229}. Best is trial 249 with value: 1695.0689015039372.[0m
[32m[I 2024-10-13 12:53:02,623][0m Trial 461 finished with value: 2524.632180947763 and parameters: {'depth': 10, 'learning_rate': 0.0005754984553967923, 'iterations': 1163, 'l2_leaf_reg': 8.490492103926874, 'border_count': 44, 'bagging_temperature': 0.03789364572885373, 'random_strength': 8.316681485977686, 'grow_policy': 'Lossguide', 'min_data_in_leaf': 361, 'max_leaves': 235}. Best is trial 249 with value: 1695.0689015039372.[0m
[32m[I 2024-10-13 12:53:04,512][0m Trial 462 finished with value: 1755.4818111471232 and parameters: {'depth': 10, 'learning_rate': 0.002125616211040815, 'iterations': 1868, 'l2_leaf_reg': 3.805423131584203e-08, 'border_count': 30, 'bagging_temperature': 0.06918718311366105, 'random_strength': 8.553505694576183, 'grow_policy': 'Lossguide', 'min_data_in_leaf': 122, 'max_leaves': 255}. Best is trial 249 with value: 1695.0689015039372.[0m
[32m[I 2024-10-13 12:53:05,520][0m Trial 463 finished with value: 2368.8408674480083 and parameters: {'depth': 9, 'learning_rate': 0.0011057814769337988, 'iterations': 612, 'l2_leaf_reg': 2.4290190133506718e-08, 'border_count': 153, 'bagging_temperature': 0.0008723150505646968, 'random_strength': 7.66896570691453, 'grow_policy': 'Lossguide', 'min_data_in_leaf': 399, 'max_leaves': 222}. Best is trial 249 with value: 1695.0689015039372.[0m
[32m[I 2024-10-13 12:53:08,347][0m Trial 464 finished with value: 2128.219987762339 and parameters: {'depth': 9, 'learning_rate': 0.0015754176435184713, 'iterations': 2711, 'l2_leaf_reg': 9.953778177280181e-08, 'border_count': 21, 'bagging_temperature': 0.029874278425510173, 'random_strength': 8.080833346161397, 'grow_policy': 'Lossguide', 'min_data_in_leaf': 87, 'max_leaves': 247}. Best is trial 249 with value: 1695.0689015039372.[0m
[32m[I 2024-10-13 12:53:17,392][0m Trial 465 finished with value: 2169.743517173654 and parameters: {'depth': 8, 'learning_rate': 0.0014180198705333663, 'iterations': 949, 'l2_leaf_reg': 1.4613461428160689e-08, 'border_count': 36, 'bagging_temperature': 0.04984813898172909, 'random_strength': 7.779851522840874, 'grow_policy': 'SymmetricTree', 'min_data_in_leaf': 585}. Best is trial 249 with value: 1695.0689015039372.[0m
[32m[I 2024-10-13 12:53:19,407][0m Trial 466 finished with value: 2064.930593058689 and parameters: {'depth': 10, 'learning_rate': 0.0025510425743850524, 'iterations': 2068, 'l2_leaf_reg': 0.12043497019114108, 'border_count': 15, 'bagging_temperature': 0.09824774786419242, 'random_strength': 5.051732454288161, 'grow_policy': 'Lossguide', 'min_data_in_leaf': 146, 'max_leaves': 66}. Best is trial 249 with value: 1695.0689015039372.[0m
[32m[I 2024-10-13 12:53:21,620][0m Trial 467 finished with value: 2853.408590979601 and parameters: {'depth': 7, 'learning_rate': 0.0018186767565295271, 'iterations': 2346, 'l2_leaf_reg': 1.3473796413491366e-07, 'border_count': 1, 'bagging_temperature': 0.019241989168972507, 'random_strength': 8.274160496550614, 'grow_policy': 'Lossguide', 'min_data_in_leaf': 104, 'max_leaves': 99}. Best is trial 249 with value: 1695.0689015039372.[0m
[32m[I 2024-10-13 12:53:23,616][0m Trial 468 finished with value: 1728.987448529839 and parameters: {'depth': 9, 'learning_rate': 0.0011807871273283878, 'iterations': 1954, 'l2_leaf_reg': 6.030960644166551e-08, 'border_count': 27, 'bagging_temperature': 0.06995432736094481, 'random_strength': 5.319232705022564, 'grow_policy': 'Lossguide', 'min_data_in_leaf': 939, 'max_leaves': 198}. Best is trial 249 with value: 1695.0689015039372.[0m
[32m[I 2024-10-13 12:53:25,676][0m Trial 469 finished with value: 1967.3039680471406 and parameters: {'depth': 10, 'learning_rate': 0.0009010708962250339, 'iterations': 2038, 'l2_leaf_reg': 8.944661404108454e-08, 'border_count': 223, 'bagging_temperature': 0.04822556073784262, 'random_strength': 7.056172009632271, 'grow_policy': 'Depthwise', 'min_data_in_leaf': 375}. Best is trial 249 with value: 1695.0689015039372.[0m
[32m[I 2024-10-13 12:53:27,827][0m Trial 470 finished with value: 1709.4734790793239 and parameters: {'depth': 9, 'learning_rate': 0.001320906502267561, 'iterations': 2098, 'l2_leaf_reg': 3.705747532461061e-07, 'border_count': 9, 'bagging_temperature': 0.01879414753749045, 'random_strength': 7.51648806706542, 'grow_policy': 'Depthwise', 'min_data_in_leaf': 155}. Best is trial 249 with value: 1695.0689015039372.[0m
[32m[I 2024-10-13 12:53:29,945][0m Trial 471 finished with value: 1931.0171946815228 and parameters: {'depth': 9, 'learning_rate': 0.0016894294960522467, 'iterations': 2054, 'l2_leaf_reg': 5.48895814116665e-07, 'border_count': 10, 'bagging_temperature': 0.018252561144547243, 'random_strength': 7.593055904013268, 'grow_policy': 'Lossguide', 'min_data_in_leaf': 165, 'max_leaves': 39}. Best is trial 249 with value: 1695.0689015039372.[0m
[32m[I 2024-10-13 12:53:32,040][0m Trial 472 finished with value: 1716.6899863946617 and parameters: {'depth': 9, 'learning_rate': 0.001359154163323389, 'iterations': 2104, 'l2_leaf_reg': 3.738966835425674e-07, 'border_count': 6, 'bagging_temperature': 0.031412066540286054, 'random_strength': 7.819675946251959, 'grow_policy': 'Depthwise', 'min_data_in_leaf': 154}. Best is trial 249 with value: 1695.0689015039372.[0m
[32m[I 2024-10-13 12:53:34,245][0m Trial 473 finished with value: 2234.8979884694404 and parameters: {'depth': 9, 'learning_rate': 0.002211590925078234, 'iterations': 2115, 'l2_leaf_reg': 3.067883489769095e-08, 'border_count': 174, 'bagging_temperature': 0.014202767952781074, 'random_strength': 7.559956418931096, 'grow_policy': 'Depthwise', 'min_data_in_leaf': 130}. Best is trial 249 with value: 1695.0689015039372.[0m
[32m[I 2024-10-13 12:53:36,316][0m Trial 474 finished with value: 1716.5988924342835 and parameters: {'depth': 9, 'learning_rate': 0.0015428553278246367, 'iterations': 1988, 'l2_leaf_reg': 3.00840299695577e-07, 'border_count': 7, 'bagging_temperature': 0.03602996492256576, 'random_strength': 7.426469563955237, 'grow_policy': 'Depthwise', 'min_data_in_leaf': 155}. Best is trial 249 with value: 1695.0689015039372.[0m
[32m[I 2024-10-13 12:53:38,801][0m Trial 475 finished with value: 2148.5867205305626 and parameters: {'depth': 8, 'learning_rate': 0.0018671370650938384, 'iterations': 1919, 'l2_leaf_reg': 1.2871311668516517e-05, 'border_count': 14, 'bagging_temperature': 0.0498165597105249, 'random_strength': 7.917015734993855, 'grow_policy': 'Depthwise', 'min_data_in_leaf': 73}. Best is trial 249 with value: 1695.0689015039372.[0m
[32m[I 2024-10-13 12:53:41,045][0m Trial 476 finished with value: 1892.8760122022675 and parameters: {'depth': 9, 'learning_rate': 0.0012992005614548708, 'iterations': 2036, 'l2_leaf_reg': 6.237790560284308e-07, 'border_count': 11, 'bagging_temperature': 0.6585418560337359, 'random_strength': 7.099233484491824, 'grow_policy': 'Lossguide', 'min_data_in_leaf': 120, 'max_leaves': 213}. Best is trial 249 with value: 1695.0689015039372.[0m
[32m[I 2024-10-13 12:53:54,986][0m Trial 477 finished with value: 2007.3090041775022 and parameters: {'depth': 8, 'learning_rate': 0.001123994481239989, 'iterations': 2127, 'l2_leaf_reg': 5.726388808220348e-08, 'border_count': 5, 'bagging_temperature': 0.018126012911749825, 'random_strength': 6.8194362572301275, 'grow_policy': 'SymmetricTree', 'min_data_in_leaf': 142}. Best is trial 249 with value: 1695.0689015039372.[0m
[32m[I 2024-10-13 12:53:57,087][0m Trial 478 finished with value: 1933.198658328789 and parameters: {'depth': 9, 'learning_rate': 0.0009864353515920557, 'iterations': 1982, 'l2_leaf_reg': 4.753910648644241e-07, 'border_count': 21, 'bagging_temperature': 0.034861888175980786, 'random_strength': 7.714109601534268, 'grow_policy': 'Depthwise', 'min_data_in_leaf': 175}. Best is trial 249 with value: 1695.0689015039372.[0m
[32m[I 2024-10-13 12:53:58,628][0m Trial 479 finished with value: 1985.722219077468 and parameters: {'depth': 9, 'learning_rate': 0.0028561168619218847, 'iterations': 1323, 'l2_leaf_reg': 2.17567670734497e-07, 'border_count': 15, 'bagging_temperature': 0.0013996308305487242, 'random_strength': 7.307712304941, 'grow_policy': 'Depthwise', 'min_data_in_leaf': 103}. Best is trial 249 with value: 1695.0689015039372.[0m
[32m[I 2024-10-13 12:54:00,629][0m Trial 480 finished with value: 2317.234002768946 and parameters: {'depth': 9, 'learning_rate': 0.02027130698142281, 'iterations': 1870, 'l2_leaf_reg': 4.297678366520905e-08, 'border_count': 19, 'bagging_temperature': 0.286969952515017, 'random_strength': 8.182974648123952, 'grow_policy': 'Depthwise', 'min_data_in_leaf': 125}. Best is trial 249 with value: 1695.0689015039372.[0m
[32m[I 2024-10-13 12:54:02,802][0m Trial 481 finished with value: 1961.1979479791003 and parameters: {'depth': 9, 'learning_rate': 0.0007348757115545504, 'iterations': 2162, 'l2_leaf_reg': 1.1158766763855737e-06, 'border_count': 11, 'bagging_temperature': 0.0007655434863245783, 'random_strength': 8.630209251834664, 'grow_policy': 'Depthwise', 'min_data_in_leaf': 161}. Best is trial 249 with value: 1695.0689015039372.[0m
[32m[I 2024-10-13 12:54:05,229][0m Trial 482 finished with value: 1768.149251213099 and parameters: {'depth': 8, 'learning_rate': 0.0015464957364378236, 'iterations': 2087, 'l2_leaf_reg': 1.1581145267339517e-07, 'border_count': 33, 'bagging_temperature': 0.06029638223327809, 'random_strength': 7.569985622620096, 'grow_policy': 'Lossguide', 'min_data_in_leaf': 89, 'max_leaves': 54}. Best is trial 249 with value: 1695.0689015039372.[0m
[32m[I 2024-10-13 12:54:07,300][0m Trial 483 finished with value: 2820.300454259899 and parameters: {'depth': 9, 'learning_rate': 0.001320406236667607, 'iterations': 2010, 'l2_leaf_reg': 2.034055763075328e-08, 'border_count': 1, 'bagging_temperature': 0.032579901012732046, 'random_strength': 6.7618990621639465, 'grow_policy': 'Depthwise', 'min_data_in_leaf': 122}. Best is trial 249 with value: 1695.0689015039372.[0m
[32m[I 2024-10-13 12:54:08,671][0m Trial 484 finished with value: 1736.5744324213897 and parameters: {'depth': 9, 'learning_rate': 0.002035438183559687, 'iterations': 1080, 'l2_leaf_reg': 6.819071125075987e-08, 'border_count': 26, 'bagging_temperature': 0.05754122775251725, 'random_strength': 7.952634632670588, 'grow_policy': 'Depthwise', 'min_data_in_leaf': 136}. Best is trial 249 with value: 1695.0689015039372.[0m
[32m[I 2024-10-13 12:54:10,628][0m Trial 485 finished with value: 1958.3371468144 and parameters: {'depth': 9, 'learning_rate': 0.001704774194335451, 'iterations': 1831, 'l2_leaf_reg': 3.389291280122559e-08, 'border_count': 22, 'bagging_temperature': 0.016582092199784022, 'random_strength': 7.070616219613598, 'grow_policy': 'Depthwise', 'min_data_in_leaf': 188}. Best is trial 249 with value: 1695.0689015039372.[0m
[32m[I 2024-10-13 12:54:12,388][0m Trial 486 finished with value: 1884.8262016985168 and parameters: {'depth': 8, 'learning_rate': 0.0023913686457791216, 'iterations': 1521, 'l2_leaf_reg': 1.4167908695916216e-07, 'border_count': 47, 'bagging_temperature': 0.04513461273361218, 'random_strength': 7.41709321386438, 'grow_policy': 'Depthwise', 'min_data_in_leaf': 108}. Best is trial 249 with value: 1695.0689015039372.[0m
[32m[I 2024-10-13 12:54:13,712][0m Trial 487 finished with value: 1932.9684799843442 and parameters: {'depth': 12, 'learning_rate': 0.0010646429285144853, 'iterations': 830, 'l2_leaf_reg': 5.0709846307530193e-08, 'border_count': 30, 'bagging_temperature': 0.07570145310774791, 'random_strength': 7.195652727246215, 'grow_policy': 'Lossguide', 'min_data_in_leaf': 77, 'max_leaves': 132}. Best is trial 249 with value: 1695.0689015039372.[0m
[32m[I 2024-10-13 12:54:15,668][0m Trial 488 finished with value: 1732.233436320118 and parameters: {'depth': 7, 'learning_rate': 0.0014173982683812218, 'iterations': 1913, 'l2_leaf_reg': 3.3313901197380253e-07, 'border_count': 40, 'bagging_temperature': 0.028019966961167857, 'random_strength': 8.37864283857497, 'grow_policy': 'Depthwise', 'min_data_in_leaf': 159}. Best is trial 249 with value: 1695.0689015039372.[0m
[32m[I 2024-10-13 12:54:20,463][0m Trial 489 finished with value: 2122.2404668033387 and parameters: {'depth': 9, 'learning_rate': 0.010285582098953413, 'iterations': 2141, 'l2_leaf_reg': 8.009503565927868e-08, 'border_count': 17, 'bagging_temperature': 0.04922654382200749, 'random_strength': 9.16116639622126, 'grow_policy': 'Depthwise', 'min_data_in_leaf': 34}. Best is trial 249 with value: 1695.0689015039372.[0m
[32m[I 2024-10-13 12:54:22,650][0m Trial 490 finished with value: 2436.4007895660043 and parameters: {'depth': 9, 'learning_rate': 0.00028137952149313286, 'iterations': 2077, 'l2_leaf_reg': 0.033058061999043487, 'border_count': 36, 'bagging_temperature': 0.01676797706053528, 'random_strength': 6.885626801023054, 'grow_policy': 'Depthwise', 'min_data_in_leaf': 145}. Best is trial 249 with value: 1695.0689015039372.[0m
[32m[I 2024-10-13 12:54:24,762][0m Trial 491 finished with value: 1712.534260958359 and parameters: {'depth': 8, 'learning_rate': 0.0012478200582819196, 'iterations': 2205, 'l2_leaf_reg': 2.020551836189425e-07, 'border_count': 29, 'bagging_temperature': 0.00036613715606933356, 'random_strength': 7.7398490644504205, 'grow_policy': 'Lossguide', 'min_data_in_leaf': 107, 'max_leaves': 239}. Best is trial 249 with value: 1695.0689015039372.[0m
[32m[I 2024-10-13 12:54:27,286][0m Trial 492 finished with value: 1901.7425361229277 and parameters: {'depth': 8, 'learning_rate': 0.0018868239378318891, 'iterations': 2211, 'l2_leaf_reg': 1.9591652977966617e-07, 'border_count': 23, 'bagging_temperature': 0.0037164389966284294, 'random_strength': 7.845344825786292, 'grow_policy': 'Lossguide', 'min_data_in_leaf': 90, 'max_leaves': 236}. Best is trial 249 with value: 1695.0689015039372.[0m
[32m[I 2024-10-13 12:54:29,368][0m Trial 493 finished with value: 1727.6882540488812 and parameters: {'depth': 8, 'learning_rate': 0.001206077281951154, 'iterations': 2124, 'l2_leaf_reg': 9.84325992658595e-08, 'border_count': 29, 'bagging_temperature': 0.22948085687015518, 'random_strength': 7.731268112192742, 'grow_policy': 'Lossguide', 'min_data_in_leaf': 112, 'max_leaves': 248}. Best is trial 249 with value: 1695.0689015039372.[0m
[32m[I 2024-10-13 12:54:32,062][0m Trial 494 finished with value: 1928.6836395505404 and parameters: {'depth': 8, 'learning_rate': 0.0009364476161928344, 'iterations': 2177, 'l2_leaf_reg': 2.648480264475479e-08, 'border_count': 11, 'bagging_temperature': 0.0008170301312439149, 'random_strength': 7.53853715389693, 'grow_policy': 'Lossguide', 'min_data_in_leaf': 61, 'max_leaves': 205}. Best is trial 249 with value: 1695.0689015039372.[0m
[32m[I 2024-10-13 12:54:33,163][0m Trial 495 finished with value: 2134.8160447168625 and parameters: {'depth': 8, 'learning_rate': 0.0014662396783913579, 'iterations': 740, 'l2_leaf_reg': 4.891196602194725e-08, 'border_count': 17, 'bagging_temperature': 0.022283146543511982, 'random_strength': 8.009026545084621, 'grow_policy': 'Lossguide', 'min_data_in_leaf': 116, 'max_leaves': 241}. Best is trial 249 with value: 1695.0689015039372.[0m
[32m[I 2024-10-13 12:54:35,056][0m Trial 496 finished with value: 1777.0853467218071 and parameters: {'depth': 7, 'learning_rate': 0.0016543022531164612, 'iterations': 1689, 'l2_leaf_reg': 1.1786431092911437e-07, 'border_count': 23, 'bagging_temperature': 0.03918547338217704, 'random_strength': 8.097179262123664, 'grow_policy': 'Lossguide', 'min_data_in_leaf': 98, 'max_leaves': 225}. Best is trial 249 with value: 1695.0689015039372.[0m
[32m[I 2024-10-13 12:54:36,931][0m Trial 497 finished with value: 1790.3193165657144 and parameters: {'depth': 8, 'learning_rate': 0.0010371907886380898, 'iterations': 1783, 'l2_leaf_reg': 1.608573275678299e-07, 'border_count': 26, 'bagging_temperature': 0.07688716576048935, 'random_strength': 7.703405545731533, 'grow_policy': 'Lossguide', 'min_data_in_leaf': 137, 'max_leaves': 239}. Best is trial 249 with value: 1695.0689015039372.[0m
[32m[I 2024-10-13 12:54:39,409][0m Trial 498 finished with value: 2250.053787967485 and parameters: {'depth': 8, 'learning_rate': 0.0031440643042184957, 'iterations': 2022, 'l2_leaf_reg': 7.736556971748032e-08, 'border_count': 20, 'bagging_temperature': 0.01616939115127324, 'random_strength': 7.323605667727198, 'grow_policy': 'Lossguide', 'min_data_in_leaf': 73, 'max_leaves': 254}. Best is trial 249 with value: 1695.0689015039372.[0m
[32m[I 2024-10-13 12:54:42,187][0m Trial 499 finished with value: 1752.5973518078208 and parameters: {'depth': 8, 'learning_rate': 0.00132508218569499, 'iterations': 2946, 'l2_leaf_reg': 4.008683603656282e-08, 'border_count': 29, 'bagging_temperature': 0.058904851889830225, 'random_strength': 7.461027134366747, 'grow_policy': 'Lossguide', 'min_data_in_leaf': 127, 'max_leaves': 221}. Best is trial 249 with value: 1695.0689015039372.[0m
[32m[I 2024-10-13 12:54:44,366][0m Trial 500 finished with value: 1764.2323958913378 and parameters: {'depth': 7, 'learning_rate': 0.002111609340273814, 'iterations': 2217, 'l2_leaf_reg': 1.0568431681376987e-08, 'border_count': 33, 'bagging_temperature': 0.031115403638608208, 'random_strength': 7.824616535096444, 'grow_policy': 'Lossguide', 'min_data_in_leaf': 156, 'max_leaves': 83}. Best is trial 249 with value: 1695.0689015039372.[0m
[32m[I 2024-10-13 12:54:46,412][0m Trial 501 finished with value: 2004.306953890406 and parameters: {'depth': 9, 'learning_rate': 0.000792591234267365, 'iterations': 1938, 'l2_leaf_reg': 6.198775633119593e-08, 'border_count': 14, 'bagging_temperature': 0.0006603397635737349, 'random_strength': 8.370647947236813, 'grow_policy': 'Lossguide', 'min_data_in_leaf': 103, 'max_leaves': 182}. Best is trial 249 with value: 1695.0689015039372.[0m
[32m[I 2024-10-13 12:54:48,647][0m Trial 502 finished with value: 1754.2616599686578 and parameters: {'depth': 9, 'learning_rate': 0.0011511373627598482, 'iterations': 2088, 'l2_leaf_reg': 2.483272881515344e-07, 'border_count': 24, 'bagging_temperature': 0.08551277261203125, 'random_strength': 8.061227273717755, 'grow_policy': 'Lossguide', 'min_data_in_leaf': 172, 'max_leaves': 228}. Best is trial 249 with value: 1695.0689015039372.[0m
[32m[I 2024-10-13 12:54:50,723][0m Trial 503 finished with value: 2179.512792550285 and parameters: {'depth': 9, 'learning_rate': 0.005601673659312705, 'iterations': 2003, 'l2_leaf_reg': 0.00012021074939153745, 'border_count': 20, 'bagging_temperature': 0.05233453666260563, 'random_strength': 7.623687093100027, 'grow_policy': 'Lossguide', 'min_data_in_leaf': 137, 'max_leaves': 212}. Best is trial 249 with value: 1695.0689015039372.[0m
[32m[I 2024-10-13 12:55:07,128][0m Trial 504 finished with value: 1982.8497623237931 and parameters: {'depth': 9, 'learning_rate': 0.001643234268439632, 'iterations': 2172, 'l2_leaf_reg': 2.0486575072537166e-08, 'border_count': 6, 'bagging_temperature': 0.019574677837330284, 'random_strength': 7.385621837790917, 'grow_policy': 'SymmetricTree', 'min_data_in_leaf': 50}. Best is trial 249 with value: 1695.0689015039372.[0m
[32m[I 2024-10-13 12:55:09,421][0m Trial 505 finished with value: 1772.1110696968417 and parameters: {'depth': 8, 'learning_rate': 0.002462731237619697, 'iterations': 2258, 'l2_leaf_reg': 1.0921042897250632e-07, 'border_count': 30, 'bagging_temperature': 0.03912697596140332, 'random_strength': 7.927495274159403, 'grow_policy': 'Depthwise', 'min_data_in_leaf': 198}. Best is trial 249 with value: 1695.0689015039372.[0m
