[32m[I 2024-10-13 12:34:52,948][0m Trial 101 finished with value: 1783.9301180384334 and parameters: {'depth': 7, 'learning_rate': 0.0013588171740184828, 'iterations': 2836, 'l2_leaf_reg': 5.4226781139428425e-08, 'border_count': 30, 'bagging_temperature': 0.8465246761317992, 'random_strength': 5.817341078764242, 'grow_policy': 'Lossguide', 'min_data_in_leaf': 280, 'max_leaves': 232}. Best is trial 11 with value: 1717.8539248499665.[0m
[32m[I 2024-10-13 12:34:55,649][0m Trial 102 finished with value: 1709.8125025644367 and parameters: {'depth': 9, 'learning_rate': 0.0010592175750385334, 'iterations': 2942, 'l2_leaf_reg': 9.451935129486837e-08, 'border_count': 25, 'bagging_temperature': 0.15002703400279033, 'random_strength': 5.266992752036414, 'grow_policy': 'Lossguide', 'min_data_in_leaf': 371, 'max_leaves': 210}. Best is trial 102 with value: 1709.8125025644367.[0m
[32m[I 2024-10-13 12:34:57,534][0m Trial 103 finished with value: 1801.1700664912933 and parameters: {'depth': 10, 'learning_rate': 0.0010756156545742418, 'iterations': 1849, 'l2_leaf_reg': 1.1689593363476919e-08, 'border_count': 24, 'bagging_temperature': 0.15261749393977014, 'random_strength': 5.397944864751182, 'grow_policy': 'Lossguide', 'min_data_in_leaf': 362, 'max_leaves': 210}. Best is trial 102 with value: 1709.8125025644367.[0m
[32m[I 2024-10-13 12:34:59,687][0m Trial 104 finished with value: 1827.9224243557774 and parameters: {'depth': 9, 'learning_rate': 0.0008277151453879731, 'iterations': 2182, 'l2_leaf_reg': 4.5166839199850177e-07, 'border_count': 7, 'bagging_temperature': 0.09464518405490069, 'random_strength': 4.600490987076886, 'grow_policy': 'Lossguide', 'min_data_in_leaf': 512, 'max_leaves': 226}. Best is trial 102 with value: 1709.8125025644367.[0m
[32m[I 2024-10-13 12:35:02,441][0m Trial 105 finished with value: 1773.2391952159546 and parameters: {'depth': 9, 'learning_rate': 0.0016572976040353398, 'iterations': 2937, 'l2_leaf_reg': 1.6107424659628004e-07, 'border_count': 34, 'bagging_temperature': 0.11965286613847194, 'random_strength': 5.658713352880445, 'grow_policy': 'Lossguide', 'min_data_in_leaf': 405, 'max_leaves': 210}. Best is trial 102 with value: 1709.8125025644367.[0m
[32m[I 2024-10-13 12:35:05,134][0m Trial 106 finished with value: 1776.26186170983 and parameters: {'depth': 10, 'learning_rate': 0.0015723214595584404, 'iterations': 2950, 'l2_leaf_reg': 1.9875525116969725e-07, 'border_count': 33, 'bagging_temperature': 0.20510392559885754, 'random_strength': 5.628218357002623, 'grow_policy': 'Lossguide', 'min_data_in_leaf': 407, 'max_leaves': 209}. Best is trial 102 with value: 1709.8125025644367.[0m
[32m[I 2024-10-13 12:35:07,819][0m Trial 107 finished with value: 1884.2308775448162 and parameters: {'depth': 9, 'learning_rate': 0.0005418846068422496, 'iterations': 2939, 'l2_leaf_reg': 1.4791793211233884e-06, 'border_count': 23, 'bagging_temperature': 0.1401220504359671, 'random_strength': 5.211858291888369, 'grow_policy': 'Lossguide', 'min_data_in_leaf': 453, 'max_leaves': 236}. Best is trial 102 with value: 1709.8125025644367.[0m
[32m[I 2024-10-13 12:35:10,461][0m Trial 108 finished with value: 1828.3476346877128 and parameters: {'depth': 10, 'learning_rate': 0.0010164153641204997, 'iterations': 2865, 'l2_leaf_reg': 6.244396230241358e-07, 'border_count': 48, 'bagging_temperature': 0.7562793107483115, 'random_strength': 6.083832308002125, 'grow_policy': 'Lossguide', 'min_data_in_leaf': 480, 'max_leaves': 191}. Best is trial 102 with value: 1709.8125025644367.[0m
[32m[I 2024-10-13 12:35:12,977][0m Trial 109 finished with value: 2657.1257570106322 and parameters: {'depth': 9, 'learning_rate': 0.00038754795870664534, 'iterations': 2655, 'l2_leaf_reg': 9.209680509483905e-08, 'border_count': 1, 'bagging_temperature': 0.949284191849702, 'random_strength': 4.809393606079018, 'grow_policy': 'Lossguide', 'min_data_in_leaf': 388, 'max_leaves': 242}. Best is trial 102 with value: 1709.8125025644367.[0m
[32m[I 2024-10-13 12:35:15,125][0m Trial 110 finished with value: 1984.2702968981869 and parameters: {'depth': 9, 'learning_rate': 0.0017766103583162465, 'iterations': 2156, 'l2_leaf_reg': 1.203946729916691e-07, 'border_count': 14, 'bagging_temperature': 0.8812435040597585, 'random_strength': 5.753053901905744, 'grow_policy': 'Lossguide', 'min_data_in_leaf': 803, 'max_leaves': 214}. Best is trial 102 with value: 1709.8125025644367.[0m
[32m[I 2024-10-13 12:35:17,791][0m Trial 111 finished with value: 1944.0699691556244 and parameters: {'depth': 8, 'learning_rate': 0.0013892095897682483, 'iterations': 2948, 'l2_leaf_reg': 3.148496859408702e-08, 'border_count': 43, 'bagging_temperature': 0.11690240724231431, 'random_strength': 4.361139922353241, 'grow_policy': 'Lossguide', 'min_data_in_leaf': 336, 'max_leaves': 195}. Best is trial 102 with value: 1709.8125025644367.[0m
[32m[I 2024-10-13 12:35:20,431][0m Trial 112 finished with value: 1776.030230262158 and parameters: {'depth': 9, 'learning_rate': 0.002284276967029717, 'iterations': 2811, 'l2_leaf_reg': 1.9457913703251024e-08, 'border_count': 34, 'bagging_temperature': 0.04323232765738171, 'random_strength': 5.317384685149314, 'grow_policy': 'Lossguide', 'min_data_in_leaf': 370, 'max_leaves': 206}. Best is trial 102 with value: 1709.8125025644367.[0m
[32m[I 2024-10-13 12:35:23,089][0m Trial 113 finished with value: 1740.3937074868256 and parameters: {'depth': 8, 'learning_rate': 0.0012606940623625315, 'iterations': 2886, 'l2_leaf_reg': 6.352655579413473e-08, 'border_count': 28, 'bagging_temperature': 0.06051208370763517, 'random_strength': 5.988548790479449, 'grow_policy': 'Lossguide', 'min_data_in_leaf': 347, 'max_leaves': 170}. Best is trial 102 with value: 1709.8125025644367.[0m
[32m[I 2024-10-13 12:35:25,790][0m Trial 114 finished with value: 1739.9284363995807 and parameters: {'depth': 11, 'learning_rate': 0.0007553913142772559, 'iterations': 2888, 'l2_leaf_reg': 2.802327539068e-07, 'border_count': 27, 'bagging_temperature': 0.06271438949258694, 'random_strength': 6.46981224045457, 'grow_policy': 'Lossguide', 'min_data_in_leaf': 298, 'max_leaves': 189}. Best is trial 102 with value: 1709.8125025644367.[0m
[32m[I 2024-10-13 12:35:27,768][0m Trial 115 finished with value: 1925.9417796370738 and parameters: {'depth': 11, 'learning_rate': 0.0007090280997992003, 'iterations': 1930, 'l2_leaf_reg': 5.4498294132023284e-08, 'border_count': 27, 'bagging_temperature': 0.01623615357156294, 'random_strength': 6.46693407866692, 'grow_policy': 'Lossguide', 'min_data_in_leaf': 292, 'max_leaves': 173}. Best is trial 102 with value: 1709.8125025644367.[0m
[32m[I 2024-10-13 12:35:30,325][0m Trial 116 finished with value: 1919.2681952281457 and parameters: {'depth': 11, 'learning_rate': 0.0008203156224373625, 'iterations': 2734, 'l2_leaf_reg': 7.612236549276007e-08, 'border_count': 19, 'bagging_temperature': 0.0658191635184716, 'random_strength': 6.174905237731581, 'grow_policy': 'Lossguide', 'min_data_in_leaf': 244, 'max_leaves': 172}. Best is trial 102 with value: 1709.8125025644367.[0m
[32m[I 2024-10-13 12:35:35,042][0m Trial 117 finished with value: 2094.617703636695 and parameters: {'depth': 10, 'learning_rate': 0.0011850981056079149, 'iterations': 3000, 'l2_leaf_reg': 2.6667172118020683e-07, 'border_count': 10, 'bagging_temperature': 0.5138435232055313, 'random_strength': 5.907688457801105, 'grow_policy': 'Lossguide', 'min_data_in_leaf': 34, 'max_leaves': 193}. Best is trial 102 with value: 1709.8125025644367.[0m
[32m[I 2024-10-13 12:35:37,729][0m Trial 118 finished with value: 1716.1337586337017 and parameters: {'depth': 11, 'learning_rate': 0.0009858451724331031, 'iterations': 2882, 'l2_leaf_reg': 2.828037049301553e-06, 'border_count': 27, 'bagging_temperature': 0.059882414633408564, 'random_strength': 6.631500950700534, 'grow_policy': 'Lossguide', 'min_data_in_leaf': 267, 'max_leaves': 161}. Best is trial 102 with value: 1709.8125025644367.[0m
[32m[I 2024-10-13 12:35:40,403][0m Trial 119 finished with value: 1924.8920197915631 and parameters: {'depth': 11, 'learning_rate': 0.0009529327803633104, 'iterations': 2888, 'l2_leaf_reg': 2.638443133728372e-06, 'border_count': 21, 'bagging_temperature': 0.0574408186033571, 'random_strength': 6.6403333478159725, 'grow_policy': 'Lossguide', 'min_data_in_leaf': 304, 'max_leaves': 162}. Best is trial 102 with value: 1709.8125025644367.[0m
[32m[I 2024-10-13 12:35:43,111][0m Trial 120 finished with value: 1837.6156439025497 and parameters: {'depth': 11, 'learning_rate': 0.0006031589041693436, 'iterations': 2880, 'l2_leaf_reg': 5.6745094956653155e-06, 'border_count': 27, 'bagging_temperature': 0.6697797073302019, 'random_strength': 6.988699554947209, 'grow_policy': 'Lossguide', 'min_data_in_leaf': 258, 'max_leaves': 154}. Best is trial 102 with value: 1709.8125025644367.[0m
[32m[I 2024-10-13 12:35:45,744][0m Trial 121 finished with value: 1760.1964281643548 and parameters: {'depth': 12, 'learning_rate': 0.0012857214373753645, 'iterations': 2832, 'l2_leaf_reg': 2.306500193191044e-06, 'border_count': 40, 'bagging_temperature': 0.07595118211959222, 'random_strength': 6.249665345412318, 'grow_policy': 'Lossguide', 'min_data_in_leaf': 225, 'max_leaves': 185}. Best is trial 102 with value: 1709.8125025644367.[0m
[32m[I 2024-10-13 12:35:48,370][0m Trial 122 finished with value: 1752.1608874944961 and parameters: {'depth': 12, 'learning_rate': 0.0012608396381204863, 'iterations': 2817, 'l2_leaf_reg': 2.071530767282718e-06, 'border_count': 41, 'bagging_temperature': 0.0018225238368756794, 'random_strength': 6.784179378067651, 'grow_policy': 'Lossguide', 'min_data_in_leaf': 213, 'max_leaves': 188}. Best is trial 102 with value: 1709.8125025644367.[0m
[32m[I 2024-10-13 12:35:50,936][0m Trial 123 finished with value: 1784.730981332136 and parameters: {'depth': 12, 'learning_rate': 0.0010244730671148813, 'iterations': 2747, 'l2_leaf_reg': 1.0383161917116655e-06, 'border_count': 51, 'bagging_temperature': 0.002908866273657093, 'random_strength': 6.7902874907019575, 'grow_policy': 'Lossguide', 'min_data_in_leaf': 199, 'max_leaves': 179}. Best is trial 102 with value: 1709.8125025644367.[0m
[32m[I 2024-10-13 12:35:53,622][0m Trial 124 finished with value: 1774.226587527341 and parameters: {'depth': 13, 'learning_rate': 0.000794259051499038, 'iterations': 2822, 'l2_leaf_reg': 1.9444362081351573e-06, 'border_count': 43, 'bagging_temperature': 0.025417228232617724, 'random_strength': 6.24452894225546, 'grow_policy': 'Lossguide', 'min_data_in_leaf': 226, 'max_leaves': 201}. Best is trial 102 with value: 1709.8125025644367.[0m
[32m[I 2024-10-13 12:35:56,167][0m Trial 125 finished with value: 1982.0586436779483 and parameters: {'depth': 12, 'learning_rate': 0.001361685875775199, 'iterations': 2690, 'l2_leaf_reg': 9.486975024991212e-06, 'border_count': 16, 'bagging_temperature': 0.05065427247821798, 'random_strength': 6.572043602043151, 'grow_policy': 'Lossguide', 'min_data_in_leaf': 166, 'max_leaves': 178}. Best is trial 102 with value: 1709.8125025644367.[0m
[32m[I 2024-10-13 12:35:58,825][0m Trial 126 finished with value: 1925.1173481984083 and parameters: {'depth': 12, 'learning_rate': 0.0004726438222720018, 'iterations': 2894, 'l2_leaf_reg': 3.1239232190264333e-06, 'border_count': 29, 'bagging_temperature': 0.07755144643311335, 'random_strength': 5.967594815416713, 'grow_policy': 'Lossguide', 'min_data_in_leaf': 139, 'max_leaves': 186}. Best is trial 102 with value: 1709.8125025644367.[0m
[32m[I 2024-10-13 12:36:01,449][0m Trial 127 finished with value: 1751.8506255212938 and parameters: {'depth': 12, 'learning_rate': 0.0009218779565446672, 'iterations': 2780, 'l2_leaf_reg': 3.665092119155288e-06, 'border_count': 23, 'bagging_temperature': 0.10651115402017586, 'random_strength': 5.494206737587457, 'grow_policy': 'Lossguide', 'min_data_in_leaf': 231, 'max_leaves': 156}. Best is trial 102 with value: 1709.8125025644367.[0m
[32m[I 2024-10-13 12:36:04,034][0m Trial 128 finished with value: 1835.0456566084629 and parameters: {'depth': 12, 'learning_rate': 0.0006397097161429836, 'iterations': 2774, 'l2_leaf_reg': 4.032515486200467e-06, 'border_count': 6, 'bagging_temperature': 0.10529434523672129, 'random_strength': 5.508086429532384, 'grow_policy': 'Lossguide', 'min_data_in_leaf': 225, 'max_leaves': 166}. Best is trial 102 with value: 1709.8125025644367.[0m
[32m[I 2024-10-13 12:36:06,450][0m Trial 129 finished with value: 1981.5091253585122 and parameters: {'depth': 12, 'learning_rate': 0.0009255560653699686, 'iterations': 2621, 'l2_leaf_reg': 1.761373836179179e-06, 'border_count': 102, 'bagging_temperature': 0.16412196077298352, 'random_strength': 5.040007758426207, 'grow_policy': 'Lossguide', 'min_data_in_leaf': 254, 'max_leaves': 153}. Best is trial 102 with value: 1709.8125025644367.[0m
[32m[I 2024-10-13 12:37:51,220][0m Trial 130 finished with value: 2099.937263349142 and parameters: {'depth': 13, 'learning_rate': 0.0007248862410525135, 'iterations': 2944, 'l2_leaf_reg': 1.671656327338066e-05, 'border_count': 23, 'bagging_temperature': 0.192485291308635, 'random_strength': 6.483197610171085, 'grow_policy': 'SymmetricTree', 'min_data_in_leaf': 188}. Best is trial 102 with value: 1709.8125025644367.[0m
[32m[I 2024-10-13 12:37:53,723][0m Trial 131 finished with value: 1737.1457216714953 and parameters: {'depth': 11, 'learning_rate': 0.0010772410370025551, 'iterations': 2856, 'l2_leaf_reg': 9.179662458866992e-07, 'border_count': 40, 'bagging_temperature': 0.02257691260908848, 'random_strength': 6.800637399394292, 'grow_policy': 'Lossguide', 'min_data_in_leaf': 283, 'max_leaves': 146}. Best is trial 102 with value: 1709.8125025644367.[0m
[32m[I 2024-10-13 12:37:56,329][0m Trial 132 finished with value: 1737.9178103942097 and parameters: {'depth': 11, 'learning_rate': 0.0010717514702943513, 'iterations': 2824, 'l2_leaf_reg': 4.3886492997024086e-07, 'border_count': 40, 'bagging_temperature': 0.06517691709577038, 'random_strength': 5.988720211793929, 'grow_policy': 'Lossguide', 'min_data_in_leaf': 269, 'max_leaves': 138}. Best is trial 102 with value: 1709.8125025644367.[0m
[32m[I 2024-10-13 12:37:58,874][0m Trial 133 finished with value: 1769.3791939434134 and parameters: {'depth': 11, 'learning_rate': 0.0014047677474198967, 'iterations': 2799, 'l2_leaf_reg': 7.223669247857293e-07, 'border_count': 41, 'bagging_temperature': 0.026102507340589262, 'random_strength': 6.7916264409271, 'grow_policy': 'Lossguide', 'min_data_in_leaf': 348, 'max_leaves': 144}. Best is trial 102 with value: 1709.8125025644367.[0m
[32m[I 2024-10-13 12:38:01,417][0m Trial 134 finished with value: 1778.5815913503595 and parameters: {'depth': 12, 'learning_rate': 0.0009900464523712848, 'iterations': 2738, 'l2_leaf_reg': 1.0981611663777545e-06, 'border_count': 48, 'bagging_temperature': 0.06373412049531664, 'random_strength': 6.084945567820521, 'grow_policy': 'Lossguide', 'min_data_in_leaf': 273, 'max_leaves': 128}. Best is trial 102 with value: 1709.8125025644367.[0m
[32m[I 2024-10-13 12:38:04,059][0m Trial 135 finished with value: 1926.0371612331721 and parameters: {'depth': 12, 'learning_rate': 0.0011720155600727562, 'iterations': 2846, 'l2_leaf_reg': 5.812691958830303e-06, 'border_count': 12, 'bagging_temperature': 0.09710890218812698, 'random_strength': 5.875552876058086, 'grow_policy': 'Lossguide', 'min_data_in_leaf': 306, 'max_leaves': 149}. Best is trial 102 with value: 1709.8125025644367.[0m
[32m[I 2024-10-13 12:38:05,694][0m Trial 136 finished with value: 1760.8248143392457 and parameters: {'depth': 11, 'learning_rate': 0.0015198272531676855, 'iterations': 1482, 'l2_leaf_reg': 3.691489214501134e-07, 'border_count': 60, 'bagging_temperature': 0.0026022991027725567, 'random_strength': 6.245413974748711, 'grow_policy': 'Lossguide', 'min_data_in_leaf': 321, 'max_leaves': 159}. Best is trial 102 with value: 1709.8125025644367.[0m
[32m[I 2024-10-13 12:38:08,167][0m Trial 137 finished with value: 1917.5397182956342 and parameters: {'depth': 11, 'learning_rate': 0.0008701886257845708, 'iterations': 2664, 'l2_leaf_reg': 8.514094554052893e-06, 'border_count': 19, 'bagging_temperature': 0.04079428810199276, 'random_strength': 5.456994306192053, 'grow_policy': 'Lossguide', 'min_data_in_leaf': 244, 'max_leaves': 137}. Best is trial 102 with value: 1709.8125025644367.[0m
[32m[I 2024-10-13 12:38:10,543][0m Trial 138 finished with value: 1721.0008374779884 and parameters: {'depth': 13, 'learning_rate': 0.0011159942081612395, 'iterations': 2576, 'l2_leaf_reg': 2.2494941618464296e-06, 'border_count': 27, 'bagging_temperature': 0.13577349193810817, 'random_strength': 6.861448639161226, 'grow_policy': 'Lossguide', 'min_data_in_leaf': 283, 'max_leaves': 169}. Best is trial 102 with value: 1709.8125025644367.[0m
[32m[I 2024-10-13 12:38:12,902][0m Trial 139 finished with value: 2016.5190829410744 and parameters: {'depth': 13, 'learning_rate': 0.0005784329214804937, 'iterations': 2552, 'l2_leaf_reg': 5.222069742072322e-07, 'border_count': 152, 'bagging_temperature': 0.14371599555340844, 'random_strength': 7.311659421231486, 'grow_policy': 'Lossguide', 'min_data_in_leaf': 270, 'max_leaves': 167}. Best is trial 102 with value: 1709.8125025644367.[0m
[32m[I 2024-10-13 12:38:15,555][0m Trial 140 finished with value: 2322.724689027824 and parameters: {'depth': 14, 'learning_rate': 0.09012130601262681, 'iterations': 2903, 'l2_leaf_reg': 3.7337405876864697e-06, 'border_count': 28, 'bagging_temperature': 0.12223906289420429, 'random_strength': 6.965966437171338, 'grow_policy': 'Lossguide', 'min_data_in_leaf': 299, 'max_leaves': 159}. Best is trial 102 with value: 1709.8125025644367.[0m
[32m[I 2024-10-13 12:38:18,254][0m Trial 141 finished with value: 1751.4424807881735 and parameters: {'depth': 12, 'learning_rate': 0.0010939663637604357, 'iterations': 2845, 'l2_leaf_reg': 2.08733517934307e-06, 'border_count': 24, 'bagging_temperature': 0.07812588415199324, 'random_strength': 6.529085382848819, 'grow_policy': 'Lossguide', 'min_data_in_leaf': 232, 'max_leaves': 175}. Best is trial 102 with value: 1709.8125025644367.[0m
[32m[I 2024-10-13 12:38:20,831][0m Trial 142 finished with value: 1696.7707398855928 and parameters: {'depth': 11, 'learning_rate': 0.0010851089385781401, 'iterations': 2757, 'l2_leaf_reg': 8.801093665502444e-07, 'border_count': 25, 'bagging_temperature': 0.024507095187581145, 'random_strength': 6.519858403314139, 'grow_policy': 'Lossguide', 'min_data_in_leaf': 290, 'max_leaves': 176}. Best is trial 142 with value: 1696.7707398855928.[0m
[32m[I 2024-10-13 12:38:23,314][0m Trial 143 finished with value: 1932.3321963974997 and parameters: {'depth': 13, 'learning_rate': 0.00106095733518756, 'iterations': 2732, 'l2_leaf_reg': 8.727370903115484e-07, 'border_count': 18, 'bagging_temperature': 0.0292861386749539, 'random_strength': 6.616509621174336, 'grow_policy': 'Lossguide', 'min_data_in_leaf': 350, 'max_leaves': 175}. Best is trial 142 with value: 1696.7707398855928.[0m
[32m[I 2024-10-13 12:38:25,881][0m Trial 144 finished with value: 1899.329953933295 and parameters: {'depth': 11, 'learning_rate': 0.00074765508108645, 'iterations': 2807, 'l2_leaf_reg': 1.5877722429819278e-06, 'border_count': 11, 'bagging_temperature': 0.0544853660714195, 'random_strength': 6.449373224313785, 'grow_policy': 'Lossguide', 'min_data_in_leaf': 289, 'max_leaves': 169}. Best is trial 142 with value: 1696.7707398855928.[0m
[32m[I 2024-10-13 12:38:28,358][0m Trial 145 finished with value: 1981.203437445954 and parameters: {'depth': 15, 'learning_rate': 0.0009218043499253711, 'iterations': 2678, 'l2_leaf_reg': 1.2035404971131084e-06, 'border_count': 170, 'bagging_temperature': 0.07699318959986909, 'random_strength': 7.087088688483764, 'grow_policy': 'Lossguide', 'min_data_in_leaf': 331, 'max_leaves': 133}. Best is trial 142 with value: 1696.7707398855928.[0m
[32m[I 2024-10-13 12:38:30,817][0m Trial 146 finished with value: 1717.5905398169257 and parameters: {'depth': 11, 'learning_rate': 0.0010932888168616547, 'iterations': 2617, 'l2_leaf_reg': 6.611522104087804e-07, 'border_count': 30, 'bagging_temperature': 0.10193434250130542, 'random_strength': 6.833556662160424, 'grow_policy': 'Lossguide', 'min_data_in_leaf': 252, 'max_leaves': 119}. Best is trial 142 with value: 1696.7707398855928.[0m
[32m[I 2024-10-13 12:38:33,075][0m Trial 147 finished with value: 1721.961100296002 and parameters: {'depth': 11, 'learning_rate': 0.0010658186185475685, 'iterations': 2347, 'l2_leaf_reg': 4.809426986495032e-07, 'border_count': 31, 'bagging_temperature': 0.10011705405330312, 'random_strength': 5.740828188600596, 'grow_policy': 'Lossguide', 'min_data_in_leaf': 257, 'max_leaves': 123}. Best is trial 142 with value: 1696.7707398855928.[0m
[32m[I 2024-10-13 12:38:35,290][0m Trial 148 finished with value: 1754.564154444935 and parameters: {'depth': 11, 'learning_rate': 0.0016451143176024004, 'iterations': 2348, 'l2_leaf_reg': 4.0834385251308953e-07, 'border_count': 30, 'bagging_temperature': 0.1430742688950387, 'random_strength': 7.423613495712158, 'grow_policy': 'Lossguide', 'min_data_in_leaf': 267, 'max_leaves': 119}. Best is trial 142 with value: 1696.7707398855928.[0m
[32m[I 2024-10-13 12:38:37,685][0m Trial 149 finished with value: 1717.3473020587855 and parameters: {'depth': 10, 'learning_rate': 0.0010995137772031004, 'iterations': 2550, 'l2_leaf_reg': 7.56058357577011e-07, 'border_count': 32, 'bagging_temperature': 0.10018432424655269, 'random_strength': 6.02130637503654, 'grow_policy': 'Lossguide', 'min_data_in_leaf': 311, 'max_leaves': 113}. Best is trial 142 with value: 1696.7707398855928.[0m
