[32m[I 2024-10-13 12:48:27,063][0m Trial 354 finished with value: 1703.9069888661008 and parameters: {'depth': 7, 'learning_rate': 0.0024085107849832043, 'iterations': 1031, 'l2_leaf_reg': 9.20133336179459e-08, 'border_count': 25, 'bagging_temperature': 0.029050353146825685, 'random_strength': 8.206550708805192, 'grow_policy': 'Depthwise', 'min_data_in_leaf': 139}. Best is trial 249 with value: 1695.0689015039372.[0m
[32m[I 2024-10-13 12:48:28,496][0m Trial 355 finished with value: 1746.350927255777 and parameters: {'depth': 6, 'learning_rate': 0.0025887678864673917, 'iterations': 1211, 'l2_leaf_reg': 3.084214875397325e-08, 'border_count': 23, 'bagging_temperature': 0.025334600923833057, 'random_strength': 8.648024398226966, 'grow_policy': 'Depthwise', 'min_data_in_leaf': 148}. Best is trial 249 with value: 1695.0689015039372.[0m
[32m[I 2024-10-13 12:48:29,744][0m Trial 356 finished with value: 1741.5047528175626 and parameters: {'depth': 7, 'learning_rate': 0.0023846450319260676, 'iterations': 904, 'l2_leaf_reg': 9.210117240877813e-08, 'border_count': 34, 'bagging_temperature': 0.02773154911958132, 'random_strength': 8.131356053449373, 'grow_policy': 'Depthwise', 'min_data_in_leaf': 116}. Best is trial 249 with value: 1695.0689015039372.[0m
[32m[I 2024-10-13 12:48:30,780][0m Trial 357 finished with value: 1940.3376682463631 and parameters: {'depth': 8, 'learning_rate': 0.0031956223479801035, 'iterations': 593, 'l2_leaf_reg': 4.932351487886312e-08, 'border_count': 18, 'bagging_temperature': 0.03827994713855989, 'random_strength': 8.533806056709802, 'grow_policy': 'Depthwise', 'min_data_in_leaf': 144}. Best is trial 249 with value: 1695.0689015039372.[0m
[32m[I 2024-10-13 12:48:32,621][0m Trial 358 finished with value: 1775.0236244840876 and parameters: {'depth': 7, 'learning_rate': 0.0021065179738102586, 'iterations': 1318, 'l2_leaf_reg': 9.870611900593626e-08, 'border_count': 28, 'bagging_temperature': 0.00011695245217328842, 'random_strength': 8.244300624343625, 'grow_policy': 'Depthwise', 'min_data_in_leaf': 84}. Best is trial 249 with value: 1695.0689015039372.[0m
[32m[I 2024-10-13 12:48:34,082][0m Trial 359 finished with value: 1891.5360383628592 and parameters: {'depth': 8, 'learning_rate': 0.001983280947777573, 'iterations': 1263, 'l2_leaf_reg': 6.817098300693213e-08, 'border_count': 10, 'bagging_temperature': 0.02011857914384921, 'random_strength': 8.757903763532601, 'grow_policy': 'Depthwise', 'min_data_in_leaf': 168}. Best is trial 249 with value: 1695.0689015039372.[0m
[32m[I 2024-10-13 12:48:35,381][0m Trial 360 finished with value: 1706.6622594420298 and parameters: {'depth': 9, 'learning_rate': 0.0023964633472739597, 'iterations': 1032, 'l2_leaf_reg': 3.388664871725353e-08, 'border_count': 25, 'bagging_temperature': 0.047935277235738566, 'random_strength': 8.361482605135908, 'grow_policy': 'Depthwise', 'min_data_in_leaf': 120}. Best is trial 249 with value: 1695.0689015039372.[0m
[32m[I 2024-10-13 12:48:36,613][0m Trial 361 finished with value: 1972.3645450982342 and parameters: {'depth': 9, 'learning_rate': 0.0033816684915714042, 'iterations': 978, 'l2_leaf_reg': 2.8825532071411047e-08, 'border_count': 22, 'bagging_temperature': 0.04898226241068782, 'random_strength': 8.26638256297358, 'grow_policy': 'Depthwise', 'min_data_in_leaf': 120}. Best is trial 249 with value: 1695.0689015039372.[0m
[32m[I 2024-10-13 12:48:37,873][0m Trial 362 finished with value: 1931.080408653106 and parameters: {'depth': 7, 'learning_rate': 0.002255699823573332, 'iterations': 903, 'l2_leaf_reg': 1.7980114101504057e-08, 'border_count': 14, 'bagging_temperature': 0.021706687156404354, 'random_strength': 8.28930502684763, 'grow_policy': 'Depthwise', 'min_data_in_leaf': 99}. Best is trial 249 with value: 1695.0689015039372.[0m
[32m[I 2024-10-13 12:48:40,315][0m Trial 363 finished with value: 2029.6704831076086 and parameters: {'depth': 6, 'learning_rate': 0.00258055046736424, 'iterations': 1741, 'l2_leaf_reg': 1.3608548854579663e-07, 'border_count': 31, 'bagging_temperature': 0.06188036719770935, 'random_strength': 8.473606452947983, 'grow_policy': 'Depthwise', 'min_data_in_leaf': 73}. Best is trial 249 with value: 1695.0689015039372.[0m
[32m[I 2024-10-13 12:48:41,692][0m Trial 364 finished with value: 2083.8992440218512 and parameters: {'depth': 9, 'learning_rate': 0.0030835137468126906, 'iterations': 1073, 'l2_leaf_reg': 2.0509432575645965e-07, 'border_count': 145, 'bagging_temperature': 0.041071973361463995, 'random_strength': 8.046588827233206, 'grow_policy': 'Depthwise', 'min_data_in_leaf': 131}. Best is trial 249 with value: 1695.0689015039372.[0m
[32m[I 2024-10-13 12:48:43,034][0m Trial 365 finished with value: 2332.8064777394684 and parameters: {'depth': 9, 'learning_rate': 0.0018228357070658827, 'iterations': 1039, 'l2_leaf_reg': 3.3534104894494335e-08, 'border_count': 4, 'bagging_temperature': 0.01787958475228074, 'random_strength': 7.976829054933275, 'grow_policy': 'Depthwise', 'min_data_in_leaf': 103}. Best is trial 249 with value: 1695.0689015039372.[0m
[32m[I 2024-10-13 12:48:44,376][0m Trial 366 finished with value: 1721.8890542013075 and parameters: {'depth': 9, 'learning_rate': 0.0023137094520084525, 'iterations': 1055, 'l2_leaf_reg': 8.689118406022592e-08, 'border_count': 36, 'bagging_temperature': 0.070416617313083, 'random_strength': 8.407618106425193, 'grow_policy': 'Depthwise', 'min_data_in_leaf': 126}. Best is trial 249 with value: 1695.0689015039372.[0m
[32m[I 2024-10-13 12:48:45,732][0m Trial 367 finished with value: 1929.0201806570112 and parameters: {'depth': 9, 'learning_rate': 0.0018589165442455715, 'iterations': 1098, 'l2_leaf_reg': 1.3802994021521222e-07, 'border_count': 18, 'bagging_temperature': 0.04453065099214053, 'random_strength': 8.916831053625659, 'grow_policy': 'Depthwise', 'min_data_in_leaf': 187}. Best is trial 249 with value: 1695.0689015039372.[0m
[32m[I 2024-10-13 12:48:47,416][0m Trial 368 finished with value: 1749.61937260725 and parameters: {'depth': 8, 'learning_rate': 0.0016078870394672872, 'iterations': 1499, 'l2_leaf_reg': 5.930314953199985e-08, 'border_count': 24, 'bagging_temperature': 0.020310788288051523, 'random_strength': 7.557095650576212, 'grow_policy': 'Depthwise', 'min_data_in_leaf': 143}. Best is trial 249 with value: 1695.0689015039372.[0m
[32m[I 2024-10-13 12:48:49,037][0m Trial 369 finished with value: 1777.2717278365635 and parameters: {'depth': 9, 'learning_rate': 0.0025734936364401532, 'iterations': 937, 'l2_leaf_reg': 2.1987479476675e-07, 'border_count': 30, 'bagging_temperature': 9.691372426928052e-05, 'random_strength': 7.930224920136977, 'grow_policy': 'Depthwise', 'min_data_in_leaf': 49}. Best is trial 249 with value: 1695.0689015039372.[0m
[32m[I 2024-10-13 12:48:51,196][0m Trial 370 finished with value: 2223.2836170256214 and parameters: {'depth': 8, 'learning_rate': 0.0018085775639156017, 'iterations': 1783, 'l2_leaf_reg': 9.6697941920606e-08, 'border_count': 250, 'bagging_temperature': 0.04773851221250687, 'random_strength': 7.724612643736258, 'grow_policy': 'Depthwise', 'min_data_in_leaf': 95}. Best is trial 249 with value: 1695.0689015039372.[0m
[32m[I 2024-10-13 12:48:52,952][0m Trial 371 finished with value: 1852.0236813193394 and parameters: {'depth': 9, 'learning_rate': 0.0021296815125788925, 'iterations': 1632, 'l2_leaf_reg': 3.887763944157854e-08, 'border_count': 74, 'bagging_temperature': 0.09226647785079639, 'random_strength': 8.142041011458389, 'grow_policy': 'Depthwise', 'min_data_in_leaf': 113}. Best is trial 249 with value: 1695.0689015039372.[0m
[32m[I 2024-10-13 12:49:10,527][0m Trial 372 finished with value: 2070.3702104273175 and parameters: {'depth': 9, 'learning_rate': 0.0015914612558005237, 'iterations': 1704, 'l2_leaf_reg': 6.896100917962086e-08, 'border_count': 23, 'bagging_temperature': 0.06661483956200595, 'random_strength': 7.3935650970263485, 'grow_policy': 'SymmetricTree', 'min_data_in_leaf': 160}. Best is trial 249 with value: 1695.0689015039372.[0m
[32m[I 2024-10-13 12:49:12,366][0m Trial 373 finished with value: 1886.3447451549132 and parameters: {'depth': 9, 'learning_rate': 0.0028733366297274904, 'iterations': 1278, 'l2_leaf_reg': 1.2788391834552946e-07, 'border_count': 35, 'bagging_temperature': 0.03396960147826184, 'random_strength': 7.726602119882578, 'grow_policy': 'Depthwise', 'min_data_in_leaf': 76}. Best is trial 249 with value: 1695.0689015039372.[0m
[32m[I 2024-10-13 12:49:14,321][0m Trial 374 finished with value: 1921.0648891638227 and parameters: {'depth': 9, 'learning_rate': 0.0013237059854001418, 'iterations': 1911, 'l2_leaf_reg': 1.635183149762025e-08, 'border_count': 18, 'bagging_temperature': 0.020156339856956113, 'random_strength': 7.24930887013476, 'grow_policy': 'Depthwise', 'min_data_in_leaf': 136}. Best is trial 249 with value: 1695.0689015039372.[0m
[32m[I 2024-10-13 12:49:15,734][0m Trial 375 finished with value: 1758.7045123859657 and parameters: {'depth': 8, 'learning_rate': 0.003648503359744917, 'iterations': 1101, 'l2_leaf_reg': 1.007945634304866e-08, 'border_count': 27, 'bagging_temperature': 0.05227247704191661, 'random_strength': 7.873780652517627, 'grow_policy': 'Depthwise', 'min_data_in_leaf': 211}. Best is trial 249 with value: 1695.0689015039372.[0m
[32m[I 2024-10-13 12:49:16,797][0m Trial 376 finished with value: 2018.9582400804145 and parameters: {'depth': 9, 'learning_rate': 0.001748526240540585, 'iterations': 770, 'l2_leaf_reg': 1.8918802222177801e-07, 'border_count': 12, 'bagging_temperature': 0.07935680217171462, 'random_strength': 8.483544933642843, 'grow_policy': 'Depthwise', 'min_data_in_leaf': 333}. Best is trial 249 with value: 1695.0689015039372.[0m
[32m[I 2024-10-13 12:49:18,648][0m Trial 377 finished with value: 1785.6540469359988 and parameters: {'depth': 9, 'learning_rate': 0.0014453792212206368, 'iterations': 1824, 'l2_leaf_reg': 4.5751446865775735e-08, 'border_count': 42, 'bagging_temperature': 0.0330121748418948, 'random_strength': 8.663190678473741, 'grow_policy': 'Depthwise', 'min_data_in_leaf': 123}. Best is trial 249 with value: 1695.0689015039372.[0m
[32m[I 2024-10-13 12:49:20,624][0m Trial 378 finished with value: 1756.8999603440068 and parameters: {'depth': 4, 'learning_rate': 0.0012263678287897683, 'iterations': 2021, 'l2_leaf_reg': 0.7582057489021424, 'border_count': 30, 'bagging_temperature': 0.5906431070190798, 'random_strength': 7.01090925069753, 'grow_policy': 'Depthwise', 'min_data_in_leaf': 183}. Best is trial 249 with value: 1695.0689015039372.[0m
[32m[I 2024-10-13 12:49:22,222][0m Trial 379 finished with value: 1740.5065442100424 and parameters: {'depth': 7, 'learning_rate': 0.0019169492123160565, 'iterations': 1438, 'l2_leaf_reg': 9.37025396366792e-08, 'border_count': 23, 'bagging_temperature': 0.016829532481775406, 'random_strength': 7.569928971693607, 'grow_policy': 'Depthwise', 'min_data_in_leaf': 153}. Best is trial 249 with value: 1695.0689015039372.[0m
[32m[I 2024-10-13 12:49:24,457][0m Trial 380 finished with value: 2592.413577900719 and parameters: {'depth': 9, 'learning_rate': 0.00019117270541268582, 'iterations': 2283, 'l2_leaf_reg': 2.73716766414529e-08, 'border_count': 35, 'bagging_temperature': 0.059583176800179265, 'random_strength': 7.160326907564191, 'grow_policy': 'Depthwise', 'min_data_in_leaf': 373}. Best is trial 249 with value: 1695.0689015039372.[0m
[32m[I 2024-10-13 12:49:25,695][0m Trial 381 finished with value: 2187.3368531208484 and parameters: {'depth': 6, 'learning_rate': 0.014316053091153089, 'iterations': 866, 'l2_leaf_reg': 2.590645658122506e-07, 'border_count': 19, 'bagging_temperature': 0.09639552299522884, 'random_strength': 7.373899255295169, 'grow_policy': 'Depthwise', 'min_data_in_leaf': 346}. Best is trial 249 with value: 1695.0689015039372.[0m
[32m[I 2024-10-13 12:49:27,907][0m Trial 382 finished with value: 1719.795613649173 and parameters: {'depth': 10, 'learning_rate': 0.0023496208846212193, 'iterations': 1965, 'l2_leaf_reg': 6.273709315947934e-08, 'border_count': 8, 'bagging_temperature': 0.9856658940783165, 'random_strength': 8.236027435218377, 'grow_policy': 'Depthwise', 'min_data_in_leaf': 91}. Best is trial 249 with value: 1695.0689015039372.[0m
[32m[I 2024-10-13 12:49:29,308][0m Trial 383 finished with value: 1795.8478291407555 and parameters: {'depth': 8, 'learning_rate': 0.0015653419889239178, 'iterations': 1166, 'l2_leaf_reg': 1.4149107688597226e-07, 'border_count': 26, 'bagging_temperature': 0.00016996670465626099, 'random_strength': 6.804751189083843, 'grow_policy': 'Depthwise', 'min_data_in_leaf': 114}. Best is trial 249 with value: 1695.0689015039372.[0m
[32m[I 2024-10-13 12:49:30,667][0m Trial 384 finished with value: 2678.953869231198 and parameters: {'depth': 10, 'learning_rate': 0.0011846630936551707, 'iterations': 1121, 'l2_leaf_reg': 1.0305679712028168e-07, 'border_count': 1, 'bagging_temperature': 0.4965973607347372, 'random_strength': 0.5000551279966725, 'grow_policy': 'Depthwise', 'min_data_in_leaf': 172}. Best is trial 249 with value: 1695.0689015039372.[0m
[32m[I 2024-10-13 12:49:32,778][0m Trial 385 finished with value: 1718.5704303170241 and parameters: {'depth': 15, 'learning_rate': 0.001332714089649694, 'iterations': 1867, 'l2_leaf_reg': 4.18379514959058e-08, 'border_count': 31, 'bagging_temperature': 0.03829959198575894, 'random_strength': 7.628866598513903, 'grow_policy': 'Depthwise', 'min_data_in_leaf': 201}. Best is trial 249 with value: 1695.0689015039372.[0m
[32m[I 2024-10-13 12:49:33,883][0m Trial 386 finished with value: 2048.625855885717 and parameters: {'depth': 9, 'learning_rate': 0.0016570065445565586, 'iterations': 808, 'l2_leaf_reg': 2.0401077042152632e-07, 'border_count': 16, 'bagging_temperature': 0.06532716592248589, 'random_strength': 7.025327363293762, 'grow_policy': 'Depthwise', 'min_data_in_leaf': 139}. Best is trial 249 with value: 1695.0689015039372.[0m
[32m[I 2024-10-13 12:49:36,862][0m Trial 387 finished with value: 1777.787299842671 and parameters: {'depth': 9, 'learning_rate': 0.001071740809141424, 'iterations': 2306, 'l2_leaf_reg': 7.441667003874718e-08, 'border_count': 38, 'bagging_temperature': 0.02241873706871362, 'random_strength': 5.395585418511569, 'grow_policy': 'Depthwise', 'min_data_in_leaf': 64}. Best is trial 249 with value: 1695.0689015039372.[0m
[32m[I 2024-10-13 12:49:39,159][0m Trial 388 finished with value: 1745.3484385247955 and parameters: {'depth': 12, 'learning_rate': 0.0020122056536610246, 'iterations': 2226, 'l2_leaf_reg': 2.7891616000304197e-08, 'border_count': 25, 'bagging_temperature': 0.04845305320907076, 'random_strength': 7.359043244009393, 'grow_policy': 'Depthwise', 'min_data_in_leaf': 149}. Best is trial 249 with value: 1695.0689015039372.[0m
[32m[I 2024-10-13 12:49:40,075][0m Trial 389 finished with value: 2419.451941565328 and parameters: {'depth': 10, 'learning_rate': 0.0013691985684533704, 'iterations': 456, 'l2_leaf_reg': 1.4473165468911775e-07, 'border_count': 21, 'bagging_temperature': 0.07779669646884829, 'random_strength': 2.9241564513178164, 'grow_policy': 'Depthwise', 'min_data_in_leaf': 109}. Best is trial 249 with value: 1695.0689015039372.[0m
[32m[I 2024-10-13 12:50:04,344][0m Trial 390 finished with value: 2010.6981854991216 and parameters: {'depth': 9, 'learning_rate': 0.0011741337787335262, 'iterations': 2175, 'l2_leaf_reg': 3.6736914304769913e-07, 'border_count': 30, 'bagging_temperature': 0.014961537089050053, 'random_strength': 5.8856634982189275, 'grow_policy': 'SymmetricTree', 'min_data_in_leaf': 384}. Best is trial 249 with value: 1695.0689015039372.[0m
[32m[I 2024-10-13 12:50:06,310][0m Trial 391 finished with value: 1901.8050245537556 and parameters: {'depth': 8, 'learning_rate': 0.0014920387364104409, 'iterations': 1908, 'l2_leaf_reg': 5.208975250648467e-08, 'border_count': 12, 'bagging_temperature': 0.032208733955533676, 'random_strength': 7.821216116728705, 'grow_policy': 'Depthwise', 'min_data_in_leaf': 133}. Best is trial 249 with value: 1695.0689015039372.[0m
[32m[I 2024-10-13 12:50:08,596][0m Trial 392 finished with value: 1745.4627716109585 and parameters: {'depth': 10, 'learning_rate': 0.0018937692773834851, 'iterations': 2335, 'l2_leaf_reg': 9.781144080192066e-08, 'border_count': 26, 'bagging_temperature': 0.0006452344151766081, 'random_strength': 5.636003728356029, 'grow_policy': 'Depthwise', 'min_data_in_leaf': 162}. Best is trial 249 with value: 1695.0689015039372.[0m
[32m[I 2024-10-13 12:50:09,907][0m Trial 393 finished with value: 2118.7744455340835 and parameters: {'depth': 9, 'learning_rate': 0.0009862810907534292, 'iterations': 998, 'l2_leaf_reg': 0.00022545690067765072, 'border_count': 41, 'bagging_temperature': 0.09915793067638681, 'random_strength': 7.154351083167307, 'grow_policy': 'Depthwise', 'min_data_in_leaf': 359}. Best is trial 249 with value: 1695.0689015039372.[0m
[32m[I 2024-10-13 12:50:12,006][0m Trial 394 finished with value: 1731.0732078619176 and parameters: {'depth': 10, 'learning_rate': 0.00164921674525095, 'iterations': 2088, 'l2_leaf_reg': 2.7591620565792866e-07, 'border_count': 33, 'bagging_temperature': 0.055394869578105445, 'random_strength': 6.833987325979633, 'grow_policy': 'Depthwise', 'min_data_in_leaf': 335}. Best is trial 249 with value: 1695.0689015039372.[0m
[32m[I 2024-10-13 12:50:14,328][0m Trial 395 finished with value: 1988.1246535130263 and parameters: {'depth': 9, 'learning_rate': 0.001303893715587967, 'iterations': 1993, 'l2_leaf_reg': 1.9482241327057946e-08, 'border_count': 18, 'bagging_temperature': 0.0362556336755875, 'random_strength': 8.009110881578103, 'grow_policy': 'Depthwise', 'min_data_in_leaf': 89}. Best is trial 249 with value: 1695.0689015039372.[0m
[32m[I 2024-10-13 12:50:18,915][0m Trial 396 finished with value: 2022.7539629104908 and parameters: {'depth': 8, 'learning_rate': 0.0024735700584400428, 'iterations': 2245, 'l2_leaf_reg': 6.784006832789876e-08, 'border_count': 21, 'bagging_temperature': 0.0743510534750108, 'random_strength': 7.40702620093583, 'grow_policy': 'Depthwise', 'min_data_in_leaf': 24}. Best is trial 249 with value: 1695.0689015039372.[0m
[32m[I 2024-10-13 12:50:20,714][0m Trial 397 finished with value: 1782.8636252894537 and parameters: {'depth': 9, 'learning_rate': 0.0010714707308424468, 'iterations': 1745, 'l2_leaf_reg': 1.552989918104295e-07, 'border_count': 29, 'bagging_temperature': 0.01857156574749858, 'random_strength': 8.357972637935676, 'grow_policy': 'Depthwise', 'min_data_in_leaf': 183}. Best is trial 249 with value: 1695.0689015039372.[0m
[32m[I 2024-10-13 12:50:22,535][0m Trial 398 finished with value: 1722.1253216520834 and parameters: {'depth': 11, 'learning_rate': 0.001425031133250107, 'iterations': 1695, 'l2_leaf_reg': 0.006520987843896833, 'border_count': 37, 'bagging_temperature': 0.047797086448502245, 'random_strength': 5.333346172173005, 'grow_policy': 'Depthwise', 'min_data_in_leaf': 421}. Best is trial 249 with value: 1695.0689015039372.[0m
[32m[I 2024-10-13 12:50:23,897][0m Trial 399 finished with value: 2217.9607465088216 and parameters: {'depth': 9, 'learning_rate': 0.000802968935145518, 'iterations': 1144, 'l2_leaf_reg': 4.253491956795336e-08, 'border_count': 14, 'bagging_temperature': 0.061838812047700586, 'random_strength': 7.607012298004711, 'grow_policy': 'Depthwise', 'min_data_in_leaf': 125}. Best is trial 249 with value: 1695.0689015039372.[0m
[32m[I 2024-10-13 12:50:25,608][0m Trial 400 finished with value: 2472.160209251921 and parameters: {'depth': 9, 'learning_rate': 0.007842456367659869, 'iterations': 1555, 'l2_leaf_reg': 1.0891746288378142e-07, 'border_count': 117, 'bagging_temperature': 0.033973836824734815, 'random_strength': 6.53327780836284, 'grow_policy': 'Depthwise', 'min_data_in_leaf': 106}. Best is trial 249 with value: 1695.0689015039372.[0m
[32m[I 2024-10-13 12:50:27,703][0m Trial 401 finished with value: 1747.5801719328265 and parameters: {'depth': 10, 'learning_rate': 0.0021915310501175156, 'iterations': 2056, 'l2_leaf_reg': 7.257339089916007e-08, 'border_count': 25, 'bagging_temperature': 0.09572131195807526, 'random_strength': 5.744855313890905, 'grow_policy': 'Depthwise', 'min_data_in_leaf': 322}. Best is trial 249 with value: 1695.0689015039372.[0m
[32m[I 2024-10-13 12:50:29,844][0m Trial 402 finished with value: 2093.0772453713853 and parameters: {'depth': 9, 'learning_rate': 0.004468800692109228, 'iterations': 2143, 'l2_leaf_reg': 2.01366286884962e-07, 'border_count': 44, 'bagging_temperature': 0.0005290536629767445, 'random_strength': 7.020222587986009, 'grow_policy': 'Depthwise', 'min_data_in_leaf': 163}. Best is trial 249 with value: 1695.0689015039372.[0m
[32m[I 2024-10-13 12:50:31,894][0m Trial 403 finished with value: 1720.9615013525029 and parameters: {'depth': 12, 'learning_rate': 0.001668793404650532, 'iterations': 1910, 'l2_leaf_reg': 3.189944448546373e-08, 'border_count': 33, 'bagging_temperature': 0.021335645584624235, 'random_strength': 6.009526635901653, 'grow_policy': 'Depthwise', 'min_data_in_leaf': 152}. Best is trial 249 with value: 1695.0689015039372.[0m
[32m[I 2024-10-13 12:50:34,172][0m Trial 404 finished with value: 1945.4160617580267 and parameters: {'depth': 9, 'learning_rate': 0.0011729053167826512, 'iterations': 2348, 'l2_leaf_reg': 1.040183992802709e-07, 'border_count': 22, 'bagging_temperature': 0.04796637381193447, 'random_strength': 7.24763257498373, 'grow_policy': 'Depthwise', 'min_data_in_leaf': 405}. Best is trial 249 with value: 1695.0689015039372.[0m
