[32m[I 2024-10-13 12:39:16,870][0m Trial 150 finished with value: 2036.2269239579366 and parameters: {'depth': 10, 'learning_rate': 0.0007610666637685912, 'iterations': 2428, 'l2_leaf_reg': 6.850714960019221e-07, 'border_count': 32, 'bagging_temperature': 0.09937762524463944, 'random_strength': 5.750424658609067, 'grow_policy': 'SymmetricTree', 'min_data_in_leaf': 299}. Best is trial 142 with value: 1696.7707398855928.[0m
[32m[I 2024-10-13 12:39:19,037][0m Trial 151 finished with value: 1709.617527220757 and parameters: {'depth': 11, 'learning_rate': 0.0010698364810753, 'iterations': 2297, 'l2_leaf_reg': 2.7454476784167245e-07, 'border_count': 25, 'bagging_temperature': 0.08321281314123538, 'random_strength': 6.017031095855285, 'grow_policy': 'Lossguide', 'min_data_in_leaf': 368, 'max_leaves': 110}. Best is trial 142 with value: 1696.7707398855928.[0m
[32m[I 2024-10-13 12:39:21,279][0m Trial 152 finished with value: 1731.336028626977 and parameters: {'depth': 10, 'learning_rate': 0.0014501979991562253, 'iterations': 2279, 'l2_leaf_reg': 2.6977449930268836e-07, 'border_count': 37, 'bagging_temperature': 0.12816873050693642, 'random_strength': 5.9322860690055235, 'grow_policy': 'Lossguide', 'min_data_in_leaf': 364, 'max_leaves': 111}. Best is trial 142 with value: 1696.7707398855928.[0m
[32m[I 2024-10-13 12:39:23,756][0m Trial 153 finished with value: 2010.844566605259 and parameters: {'depth': 10, 'learning_rate': 0.0010971888854105403, 'iterations': 2490, 'l2_leaf_reg': 2.2739810720389796e-07, 'border_count': 128, 'bagging_temperature': 0.1272347484348175, 'random_strength': 6.346341063516924, 'grow_policy': 'Lossguide', 'min_data_in_leaf': 358, 'max_leaves': 112}. Best is trial 142 with value: 1696.7707398855928.[0m
[32m[I 2024-10-13 12:39:25,938][0m Trial 154 finished with value: 1726.4457581779966 and parameters: {'depth': 11, 'learning_rate': 0.0014561441959626642, 'iterations': 2249, 'l2_leaf_reg': 3.70922353445156e-07, 'border_count': 37, 'bagging_temperature': 0.0550340330988688, 'random_strength': 5.935731178443478, 'grow_policy': 'Lossguide', 'min_data_in_leaf': 314, 'max_leaves': 124}. Best is trial 142 with value: 1696.7707398855928.[0m
[32m[I 2024-10-13 12:39:28,147][0m Trial 155 finished with value: 1729.8249574990878 and parameters: {'depth': 11, 'learning_rate': 0.0014800684636143541, 'iterations': 2302, 'l2_leaf_reg': 3.139676564116831e-07, 'border_count': 38, 'bagging_temperature': 0.0523730687669135, 'random_strength': 6.0484631328237, 'grow_policy': 'Lossguide', 'min_data_in_leaf': 318, 'max_leaves': 121}. Best is trial 142 with value: 1696.7707398855928.[0m
[32m[I 2024-10-13 12:39:30,406][0m Trial 156 finished with value: 1733.1350779687052 and parameters: {'depth': 11, 'learning_rate': 0.0015318504051423506, 'iterations': 2274, 'l2_leaf_reg': 3.0113311180773634e-07, 'border_count': 36, 'bagging_temperature': 0.041735708882996964, 'random_strength': 6.1111221396972875, 'grow_policy': 'Lossguide', 'min_data_in_leaf': 309, 'max_leaves': 122}. Best is trial 142 with value: 1696.7707398855928.[0m
[32m[I 2024-10-13 12:39:32,598][0m Trial 157 finished with value: 1857.9283585396656 and parameters: {'depth': 11, 'learning_rate': 0.0015164981118977795, 'iterations': 2262, 'l2_leaf_reg': 4.978862443941622e-07, 'border_count': 47, 'bagging_temperature': 0.03766330147073202, 'random_strength': 6.0948035471620745, 'grow_policy': 'Lossguide', 'min_data_in_leaf': 317, 'max_leaves': 124}. Best is trial 142 with value: 1696.7707398855928.[0m
[32m[I 2024-10-13 12:39:34,758][0m Trial 158 finished with value: 1752.0095003217923 and parameters: {'depth': 11, 'learning_rate': 0.001724784335022658, 'iterations': 2228, 'l2_leaf_reg': 6.475960395959618e-07, 'border_count': 38, 'bagging_temperature': 0.0963974200865926, 'random_strength': 5.27629105230034, 'grow_policy': 'Lossguide', 'min_data_in_leaf': 324, 'max_leaves': 113}. Best is trial 142 with value: 1696.7707398855928.[0m
[32m[I 2024-10-13 12:39:36,991][0m Trial 159 finished with value: 2039.9237555168413 and parameters: {'depth': 4, 'learning_rate': 0.002498749482518622, 'iterations': 2301, 'l2_leaf_reg': 3.220499937178463e-07, 'border_count': 53, 'bagging_temperature': 0.022400536964060542, 'random_strength': 5.629809703786933, 'grow_policy': 'Lossguide', 'min_data_in_leaf': 387, 'max_leaves': 105}. Best is trial 142 with value: 1696.7707398855928.[0m
[32m[I 2024-10-13 12:39:39,275][0m Trial 160 finished with value: 1730.4071684656303 and parameters: {'depth': 11, 'learning_rate': 0.0014366788286269906, 'iterations': 2377, 'l2_leaf_reg': 1.0316634548832917e-06, 'border_count': 35, 'bagging_temperature': 0.040219225369942845, 'random_strength': 6.045981595813849, 'grow_policy': 'Lossguide', 'min_data_in_leaf': 283, 'max_leaves': 121}. Best is trial 142 with value: 1696.7707398855928.[0m
[32m[I 2024-10-13 12:39:41,553][0m Trial 161 finished with value: 1728.163945290175 and parameters: {'depth': 11, 'learning_rate': 0.0014090388437655024, 'iterations': 2372, 'l2_leaf_reg': 8.967890406833842e-07, 'border_count': 36, 'bagging_temperature': 0.046977815811953066, 'random_strength': 6.056143423600488, 'grow_policy': 'Lossguide', 'min_data_in_leaf': 275, 'max_leaves': 121}. Best is trial 142 with value: 1696.7707398855928.[0m
[32m[I 2024-10-13 12:39:43,826][0m Trial 162 finished with value: 1733.4416303375378 and parameters: {'depth': 11, 'learning_rate': 0.0014574332192501933, 'iterations': 2376, 'l2_leaf_reg': 1.2590381674632963e-06, 'border_count': 35, 'bagging_temperature': 0.04717569742300644, 'random_strength': 6.1801015159669035, 'grow_policy': 'Lossguide', 'min_data_in_leaf': 279, 'max_leaves': 121}. Best is trial 142 with value: 1696.7707398855928.[0m
[32m[I 2024-10-13 12:39:46,112][0m Trial 163 finished with value: 1770.3247882977043 and parameters: {'depth': 11, 'learning_rate': 0.0020470635724949, 'iterations': 2382, 'l2_leaf_reg': 1.34871639485982e-06, 'border_count': 34, 'bagging_temperature': 0.0923539415580781, 'random_strength': 6.165121839750903, 'grow_policy': 'Lossguide', 'min_data_in_leaf': 308, 'max_leaves': 121}. Best is trial 142 with value: 1696.7707398855928.[0m
[32m[I 2024-10-13 12:39:48,312][0m Trial 164 finished with value: 1727.6704054501854 and parameters: {'depth': 10, 'learning_rate': 0.0014600171867274804, 'iterations': 2284, 'l2_leaf_reg': 2.1150606800963995e-07, 'border_count': 33, 'bagging_temperature': 0.05159702917226027, 'random_strength': 5.785775782887621, 'grow_policy': 'Lossguide', 'min_data_in_leaf': 334, 'max_leaves': 108}. Best is trial 142 with value: 1696.7707398855928.[0m
[32m[I 2024-10-13 12:39:50,454][0m Trial 165 finished with value: 1917.4380090226443 and parameters: {'depth': 10, 'learning_rate': 0.0017512763249144182, 'iterations': 2251, 'l2_leaf_reg': 1.9360346831185315e-07, 'border_count': 46, 'bagging_temperature': 0.0815580812127589, 'random_strength': 5.76910999985515, 'grow_policy': 'Lossguide', 'min_data_in_leaf': 336, 'max_leaves': 106}. Best is trial 142 with value: 1696.7707398855928.[0m
[32m[I 2024-10-13 12:39:52,627][0m Trial 166 finished with value: 1728.9754984944636 and parameters: {'depth': 10, 'learning_rate': 0.001426890737300833, 'iterations': 2301, 'l2_leaf_reg': 7.663895514555884e-07, 'border_count': 33, 'bagging_temperature': 0.11876766306559301, 'random_strength': 5.2219907006585355, 'grow_policy': 'Lossguide', 'min_data_in_leaf': 371, 'max_leaves': 114}. Best is trial 142 with value: 1696.7707398855928.[0m
[32m[I 2024-10-13 12:39:54,897][0m Trial 167 finished with value: 1721.2887842609098 and parameters: {'depth': 10, 'learning_rate': 0.0013109290777452774, 'iterations': 2317, 'l2_leaf_reg': 7.22645605115367e-07, 'border_count': 31, 'bagging_temperature': 0.12011067681706446, 'random_strength': 5.159189282886038, 'grow_policy': 'Depthwise', 'min_data_in_leaf': 380}. Best is trial 142 with value: 1696.7707398855928.[0m
[32m[I 2024-10-13 12:39:57,274][0m Trial 168 finished with value: 1729.1213396254655 and parameters: {'depth': 10, 'learning_rate': 0.0013136723696264676, 'iterations': 2470, 'l2_leaf_reg': 7.827619820709988e-07, 'border_count': 31, 'bagging_temperature': 0.11328007156547636, 'random_strength': 5.186318406178397, 'grow_policy': 'Depthwise', 'min_data_in_leaf': 430}. Best is trial 142 with value: 1696.7707398855928.[0m
[32m[I 2024-10-13 12:39:59,709][0m Trial 169 finished with value: 1731.097678312613 and parameters: {'depth': 10, 'learning_rate': 0.001276458761561643, 'iterations': 2502, 'l2_leaf_reg': 6.64596111593364e-07, 'border_count': 30, 'bagging_temperature': 0.16358524833581872, 'random_strength': 5.068892331037424, 'grow_policy': 'Depthwise', 'min_data_in_leaf': 436}. Best is trial 142 with value: 1696.7707398855928.[0m
[32m[I 2024-10-13 12:40:02,159][0m Trial 170 finished with value: 2005.7107761608838 and parameters: {'depth': 10, 'learning_rate': 0.0018019605791351357, 'iterations': 2431, 'l2_leaf_reg': 5.002015985205847e-07, 'border_count': 19, 'bagging_temperature': 0.18526201739503056, 'random_strength': 4.672942883933866, 'grow_policy': 'Depthwise', 'min_data_in_leaf': 394}. Best is trial 142 with value: 1696.7707398855928.[0m
[32m[I 2024-10-13 12:40:04,485][0m Trial 171 finished with value: 1750.3123839821494 and parameters: {'depth': 10, 'learning_rate': 0.0009036513425750515, 'iterations': 2326, 'l2_leaf_reg': 8.975423330572492e-07, 'border_count': 31, 'bagging_temperature': 0.11490303914765629, 'random_strength': 5.083546882021941, 'grow_policy': 'Depthwise', 'min_data_in_leaf': 414}. Best is trial 142 with value: 1696.7707398855928.[0m
[32m[I 2024-10-13 12:40:06,732][0m Trial 172 finished with value: 1944.8808733118187 and parameters: {'depth': 10, 'learning_rate': 0.001293524607637804, 'iterations': 2103, 'l2_leaf_reg': 7.904217885511438e-07, 'border_count': 22, 'bagging_temperature': 0.09316098603333793, 'random_strength': 5.259003435639239, 'grow_policy': 'Depthwise', 'min_data_in_leaf': 360}. Best is trial 142 with value: 1696.7707398855928.[0m
[32m[I 2024-10-13 12:40:08,963][0m Trial 173 finished with value: 1772.5047313077744 and parameters: {'depth': 11, 'learning_rate': 0.002176228779626344, 'iterations': 2199, 'l2_leaf_reg': 4.310289198134537e-07, 'border_count': 32, 'bagging_temperature': 0.13334332763975823, 'random_strength': 4.886340277210635, 'grow_policy': 'Depthwise', 'min_data_in_leaf': 335}. Best is trial 142 with value: 1696.7707398855928.[0m
[32m[I 2024-10-13 12:40:11,403][0m Trial 174 finished with value: 2048.5570796536726 and parameters: {'depth': 10, 'learning_rate': 0.002848496305496942, 'iterations': 2472, 'l2_leaf_reg': 1.3764505419238238e-06, 'border_count': 45, 'bagging_temperature': 0.06843930123642757, 'random_strength': 5.406073468192883, 'grow_policy': 'Depthwise', 'min_data_in_leaf': 422}. Best is trial 142 with value: 1696.7707398855928.[0m
[32m[I 2024-10-13 12:40:13,672][0m Trial 175 finished with value: 1714.5907354906599 and parameters: {'depth': 10, 'learning_rate': 0.0011592872250804052, 'iterations': 2350, 'l2_leaf_reg': 1.7056582427091384e-07, 'border_count': 26, 'bagging_temperature': 0.11290142554616116, 'random_strength': 5.641747235966378, 'grow_policy': 'Depthwise', 'min_data_in_leaf': 384}. Best is trial 142 with value: 1696.7707398855928.[0m
[32m[I 2024-10-13 12:40:15,988][0m Trial 176 finished with value: 1712.980101671509 and parameters: {'depth': 10, 'learning_rate': 0.0011618411948509802, 'iterations': 2315, 'l2_leaf_reg': 1.2148948000110266e-07, 'border_count': 26, 'bagging_temperature': 0.11154598901437887, 'random_strength': 5.635977454397415, 'grow_policy': 'Depthwise', 'min_data_in_leaf': 371}. Best is trial 142 with value: 1696.7707398855928.[0m
[32m[I 2024-10-13 12:40:18,029][0m Trial 177 finished with value: 1837.9751030169375 and parameters: {'depth': 10, 'learning_rate': 0.0008810680488541262, 'iterations': 2015, 'l2_leaf_reg': 1.2366738897521698e-07, 'border_count': 24, 'bagging_temperature': 0.15069342210793638, 'random_strength': 5.574010175976883, 'grow_policy': 'Depthwise', 'min_data_in_leaf': 379}. Best is trial 142 with value: 1696.7707398855928.[0m
[32m[I 2024-10-13 12:40:20,465][0m Trial 178 finished with value: 1952.6744515865391 and parameters: {'depth': 10, 'learning_rate': 0.00120883403651424, 'iterations': 2571, 'l2_leaf_reg': 2.4243978043809496e-07, 'border_count': 15, 'bagging_temperature': 0.11151961032183726, 'random_strength': 5.2696978079505925, 'grow_policy': 'Depthwise', 'min_data_in_leaf': 387}. Best is trial 142 with value: 1696.7707398855928.[0m
[32m[I 2024-10-13 12:40:22,833][0m Trial 179 finished with value: 1729.0233455401506 and parameters: {'depth': 10, 'learning_rate': 0.0009844507555081376, 'iterations': 2435, 'l2_leaf_reg': 1.472926771676805e-07, 'border_count': 27, 'bagging_temperature': 0.11434214102543462, 'random_strength': 5.729153909434764, 'grow_policy': 'Depthwise', 'min_data_in_leaf': 364}. Best is trial 142 with value: 1696.7707398855928.[0m
[32m[I 2024-10-13 12:40:25,124][0m Trial 180 finished with value: 1916.0103239920797 and parameters: {'depth': 10, 'learning_rate': 0.0009750500125986528, 'iterations': 2339, 'l2_leaf_reg': 1.7886458952997255e-07, 'border_count': 19, 'bagging_temperature': 0.13659579040975073, 'random_strength': 5.797609072893942, 'grow_policy': 'Depthwise', 'min_data_in_leaf': 370}. Best is trial 142 with value: 1696.7707398855928.[0m
[32m[I 2024-10-13 12:40:27,567][0m Trial 181 finished with value: 1719.5498091189788 and parameters: {'depth': 10, 'learning_rate': 0.001131732458250252, 'iterations': 2433, 'l2_leaf_reg': 1.4320101964936643e-07, 'border_count': 28, 'bagging_temperature': 0.10952024070095633, 'random_strength': 5.607129746720673, 'grow_policy': 'Depthwise', 'min_data_in_leaf': 396}. Best is trial 142 with value: 1696.7707398855928.[0m
[32m[I 2024-10-13 12:40:29,951][0m Trial 182 finished with value: 1715.9857404233085 and parameters: {'depth': 10, 'learning_rate': 0.0010780839736850181, 'iterations': 2406, 'l2_leaf_reg': 1.3631534314103335e-07, 'border_count': 26, 'bagging_temperature': 0.08518589379257502, 'random_strength': 5.56324231538069, 'grow_policy': 'Depthwise', 'min_data_in_leaf': 399}. Best is trial 142 with value: 1696.7707398855928.[0m
[32m[I 2024-10-13 12:40:32,117][0m Trial 183 finished with value: 1749.2775182809203 and parameters: {'depth': 10, 'learning_rate': 0.0011469986661110667, 'iterations': 2204, 'l2_leaf_reg': 8.94993232465821e-08, 'border_count': 23, 'bagging_temperature': 0.07653737044832155, 'random_strength': 5.509876491936918, 'grow_policy': 'Depthwise', 'min_data_in_leaf': 394}. Best is trial 142 with value: 1696.7707398855928.[0m
[32m[I 2024-10-13 12:40:34,444][0m Trial 184 finished with value: 1967.9239173180943 and parameters: {'depth': 10, 'learning_rate': 0.0007263777025077285, 'iterations': 2397, 'l2_leaf_reg': 1.4486832941967986e-07, 'border_count': 16, 'bagging_temperature': 0.09075348114981395, 'random_strength': 4.9177481062595545, 'grow_policy': 'Depthwise', 'min_data_in_leaf': 344}. Best is trial 142 with value: 1696.7707398855928.[0m
[32m[I 2024-10-13 12:40:36,711][0m Trial 185 finished with value: 1760.9492791585903 and parameters: {'depth': 10, 'learning_rate': 0.0008577953981829599, 'iterations': 2328, 'l2_leaf_reg': 4.275198217596266e-07, 'border_count': 28, 'bagging_temperature': 0.07983688203056241, 'random_strength': 5.631383628370914, 'grow_policy': 'Depthwise', 'min_data_in_leaf': 445}. Best is trial 142 with value: 1696.7707398855928.[0m
[32m[I 2024-10-13 12:40:39,146][0m Trial 186 finished with value: 1951.6227091072892 and parameters: {'depth': 10, 'learning_rate': 0.001086131128037702, 'iterations': 2543, 'l2_leaf_reg': 2.3607081486283192e-07, 'border_count': 22, 'bagging_temperature': 0.1611351267702571, 'random_strength': 5.580319279713179, 'grow_policy': 'Depthwise', 'min_data_in_leaf': 408}. Best is trial 142 with value: 1696.7707398855928.[0m
[32m[I 2024-10-13 12:40:41,537][0m Trial 187 finished with value: 1859.0249977324906 and parameters: {'depth': 11, 'learning_rate': 0.000644024371661299, 'iterations': 2409, 'l2_leaf_reg': 6.026766276193605e-07, 'border_count': 31, 'bagging_temperature': 0.1017209609483174, 'random_strength': 5.317575836472135, 'grow_policy': 'Depthwise', 'min_data_in_leaf': 254}. Best is trial 142 with value: 1696.7707398855928.[0m
[32m[I 2024-10-13 12:40:43,745][0m Trial 188 finished with value: 1716.921097289102 and parameters: {'depth': 5, 'learning_rate': 0.001170830099724611, 'iterations': 2151, 'l2_leaf_reg': 3.60263514710947e-07, 'border_count': 28, 'bagging_temperature': 0.01951133263117706, 'random_strength': 6.38404298860098, 'grow_policy': 'Depthwise', 'min_data_in_leaf': 379}. Best is trial 142 with value: 1696.7707398855928.[0m
[32m[I 2024-10-13 12:40:46,080][0m Trial 189 finished with value: 1809.4961557341728 and parameters: {'depth': 14, 'learning_rate': 0.0008168423016863417, 'iterations': 2159, 'l2_leaf_reg': 1.1305843103640662e-07, 'border_count': 26, 'bagging_temperature': 0.018505532697225914, 'random_strength': 6.357293293464, 'grow_policy': 'Depthwise', 'min_data_in_leaf': 345}. Best is trial 142 with value: 1696.7707398855928.[0m
[32m[I 2024-10-13 12:40:48,533][0m Trial 190 finished with value: 1941.1034595487672 and parameters: {'depth': 3, 'learning_rate': 0.0011310287004354473, 'iterations': 2510, 'l2_leaf_reg': 1.816810242086656e-07, 'border_count': 13, 'bagging_temperature': 0.057042160253886996, 'random_strength': 6.585468467218009, 'grow_policy': 'Depthwise', 'min_data_in_leaf': 466}. Best is trial 142 with value: 1696.7707398855928.[0m
[32m[I 2024-10-13 12:40:50,733][0m Trial 191 finished with value: 1712.7485052813886 and parameters: {'depth': 10, 'learning_rate': 0.0012544210384174174, 'iterations': 2227, 'l2_leaf_reg': 5.184559120394454e-07, 'border_count': 33, 'bagging_temperature': 0.0023855791477818272, 'random_strength': 5.789518058755037, 'grow_policy': 'Depthwise', 'min_data_in_leaf': 374}. Best is trial 142 with value: 1696.7707398855928.[0m
[32m[I 2024-10-13 12:40:52,956][0m Trial 192 finished with value: 1740.0102266285778 and parameters: {'depth': 4, 'learning_rate': 0.00097638619409656, 'iterations': 2236, 'l2_leaf_reg': 3.5250238242070414e-07, 'border_count': 26, 'bagging_temperature': 0.013051226598066332, 'random_strength': 5.903906063545014, 'grow_policy': 'Depthwise', 'min_data_in_leaf': 399}. Best is trial 142 with value: 1696.7707398855928.[0m
[32m[I 2024-10-13 12:40:55,041][0m Trial 193 finished with value: 1916.8609924523996 and parameters: {'depth': 10, 'learning_rate': 0.0011982156204576313, 'iterations': 2021, 'l2_leaf_reg': 4.693604193879769e-07, 'border_count': 20, 'bagging_temperature': 0.03209484277428527, 'random_strength': 6.8588347593305805, 'grow_policy': 'Depthwise', 'min_data_in_leaf': 381}. Best is trial 142 with value: 1696.7707398855928.[0m
[32m[I 2024-10-13 12:40:57,335][0m Trial 194 finished with value: 2162.9540781464702 and parameters: {'depth': 10, 'learning_rate': 0.0017608225054573448, 'iterations': 2217, 'l2_leaf_reg': 1.9728438825396767e-07, 'border_count': 235, 'bagging_temperature': 0.007326579629961014, 'random_strength': 6.369065667074919, 'grow_policy': 'Depthwise', 'min_data_in_leaf': 418}. Best is trial 142 with value: 1696.7707398855928.[0m
[32m[I 2024-10-13 12:40:59,677][0m Trial 195 finished with value: 2833.3483152509234 and parameters: {'depth': 5, 'learning_rate': 0.00010748373184231994, 'iterations': 2355, 'l2_leaf_reg': 1.8167362731854965e-06, 'border_count': 30, 'bagging_temperature': 0.00014817884092951233, 'random_strength': 5.791480494277964, 'grow_policy': 'Depthwise', 'min_data_in_leaf': 330}. Best is trial 142 with value: 1696.7707398855928.[0m
[32m[I 2024-10-13 12:41:02,260][0m Trial 196 finished with value: 1791.4279689585876 and parameters: {'depth': 11, 'learning_rate': 0.001033567414977089, 'iterations': 2591, 'l2_leaf_reg': 9.352844639396435e-08, 'border_count': 42, 'bagging_temperature': 0.05613617276346223, 'random_strength': 5.455531236920188, 'grow_policy': 'Depthwise', 'min_data_in_leaf': 353}. Best is trial 142 with value: 1696.7707398855928.[0m
[32m[I 2024-10-13 12:41:04,650][0m Trial 197 finished with value: 1717.7494355657532 and parameters: {'depth': 10, 'learning_rate': 0.0012474338597257607, 'iterations': 2436, 'l2_leaf_reg': 2.947365426998838e-07, 'border_count': 36, 'bagging_temperature': 0.03109678183412725, 'random_strength': 6.656317937557598, 'grow_policy': 'Depthwise', 'min_data_in_leaf': 248}. Best is trial 142 with value: 1696.7707398855928.[0m
[32m[I 2024-10-13 12:41:07,157][0m Trial 198 finished with value: 1966.4339214213105 and parameters: {'depth': 10, 'learning_rate': 0.0007846258742486149, 'iterations': 2450, 'l2_leaf_reg': 3.1326279692422043e-07, 'border_count': 199, 'bagging_temperature': 0.025279519973377216, 'random_strength': 6.935235524647426, 'grow_policy': 'Depthwise', 'min_data_in_leaf': 248}. Best is trial 142 with value: 1696.7707398855928.[0m
[32m[I 2024-10-13 12:41:07,793][0m Trial 199 finished with value: 3098.4872062085137 and parameters: {'depth': 5, 'learning_rate': 0.0008979932702131471, 'iterations': 108, 'l2_leaf_reg': 1.5581338328570038e-07, 'border_count': 24, 'bagging_temperature': 0.08527306000979495, 'random_strength': 6.641280192243174, 'grow_policy': 'Depthwise', 'min_data_in_leaf': 377}. Best is trial 142 with value: 1696.7707398855928.[0m
[32m[I 2024-10-13 12:41:09,898][0m Trial 200 finished with value: 1926.097841935886 and parameters: {'depth': 10, 'learning_rate': 0.001183189020224414, 'iterations': 2123, 'l2_leaf_reg': 4.952257196360853e-07, 'border_count': 17, 'bagging_temperature': 0.06381609041308978, 'random_strength': 7.102143657525495, 'grow_policy': 'Depthwise', 'min_data_in_leaf': 523}. Best is trial 142 with value: 1696.7707398855928.[0m
