[32m[I 2024-10-13 12:41:12,241][0m Trial 201 finished with value: 1718.6603162216168 and parameters: {'depth': 11, 'learning_rate': 0.0012958794400687631, 'iterations': 2361, 'l2_leaf_reg': 2.6218878377172915e-07, 'border_count': 37, 'bagging_temperature': 0.032677872568489544, 'random_strength': 6.266286886496514, 'grow_policy': 'Depthwise', 'min_data_in_leaf': 290}. Best is trial 142 with value: 1696.7707398855928.[0m
[32m[I 2024-10-13 12:41:14,567][0m Trial 202 finished with value: 1714.1886584800784 and parameters: {'depth': 10, 'learning_rate': 0.001270426162724229, 'iterations': 2291, 'l2_leaf_reg': 2.5838920152810666e-07, 'border_count': 34, 'bagging_temperature': 0.03288927663285108, 'random_strength': 6.733328956155554, 'grow_policy': 'Depthwise', 'min_data_in_leaf': 294}. Best is trial 142 with value: 1696.7707398855928.[0m
[32m[I 2024-10-13 12:41:17,036][0m Trial 203 finished with value: 1735.3016236727747 and parameters: {'depth': 10, 'learning_rate': 0.001015337413676189, 'iterations': 2522, 'l2_leaf_reg': 3.357719199895134e-07, 'border_count': 40, 'bagging_temperature': 0.025807851109601723, 'random_strength': 6.728436447567379, 'grow_policy': 'Depthwise', 'min_data_in_leaf': 254}. Best is trial 142 with value: 1696.7707398855928.[0m
[32m[I 2024-10-13 12:41:19,434][0m Trial 204 finished with value: 1717.452838685581 and parameters: {'depth': 11, 'learning_rate': 0.0012536942762320328, 'iterations': 2407, 'l2_leaf_reg': 2.743244489811984e-07, 'border_count': 28, 'bagging_temperature': 0.035257463505767084, 'random_strength': 6.363249698987617, 'grow_policy': 'Depthwise', 'min_data_in_leaf': 289}. Best is trial 142 with value: 1696.7707398855928.[0m
[32m[I 2024-10-13 12:41:21,828][0m Trial 205 finished with value: 1716.6060452974968 and parameters: {'depth': 11, 'learning_rate': 0.0012267668557055947, 'iterations': 2427, 'l2_leaf_reg': 1.1072866042250347e-07, 'border_count': 27, 'bagging_temperature': 0.027048756077805325, 'random_strength': 6.376527922470524, 'grow_policy': 'Depthwise', 'min_data_in_leaf': 296}. Best is trial 142 with value: 1696.7707398855928.[0m
[32m[I 2024-10-13 12:41:24,153][0m Trial 206 finished with value: 1715.6960137353974 and parameters: {'depth': 11, 'learning_rate': 0.001230911244485643, 'iterations': 2404, 'l2_leaf_reg': 8.442753100799395e-08, 'border_count': 28, 'bagging_temperature': 0.03155414834147985, 'random_strength': 6.406515729500545, 'grow_policy': 'Depthwise', 'min_data_in_leaf': 293}. Best is trial 142 with value: 1696.7707398855928.[0m
[32m[I 2024-10-13 12:41:26,513][0m Trial 207 finished with value: 1696.3659778820509 and parameters: {'depth': 11, 'learning_rate': 0.0012062469346799537, 'iterations': 2466, 'l2_leaf_reg': 1.0265438924483992e-07, 'border_count': 25, 'bagging_temperature': 0.02750096409087725, 'random_strength': 6.453026130153343, 'grow_policy': 'Depthwise', 'min_data_in_leaf': 294}. Best is trial 207 with value: 1696.3659778820509.[0m
[32m[I 2024-10-13 12:41:28,855][0m Trial 208 finished with value: 1932.6974981629946 and parameters: {'depth': 11, 'learning_rate': 0.0011979495378594085, 'iterations': 2452, 'l2_leaf_reg': 1.0127578203324459e-07, 'border_count': 21, 'bagging_temperature': 0.03266733495681783, 'random_strength': 6.40980383783174, 'grow_policy': 'Depthwise', 'min_data_in_leaf': 290}. Best is trial 207 with value: 1696.3659778820509.[0m
[32m[I 2024-10-13 12:41:31,255][0m Trial 209 finished with value: 1742.476090443632 and parameters: {'depth': 11, 'learning_rate': 0.0008962523025461946, 'iterations': 2413, 'l2_leaf_reg': 1.2886706715177916e-07, 'border_count': 27, 'bagging_temperature': 0.0011844272232673717, 'random_strength': 6.653896303266918, 'grow_policy': 'Depthwise', 'min_data_in_leaf': 299}. Best is trial 207 with value: 1696.3659778820509.[0m
[32m[I 2024-10-13 12:41:33,849][0m Trial 210 finished with value: 1740.7852733852685 and parameters: {'depth': 11, 'learning_rate': 0.0016887497888791972, 'iterations': 2606, 'l2_leaf_reg': 7.645393734782134e-08, 'border_count': 25, 'bagging_temperature': 0.0196294209346716, 'random_strength': 6.296855119574596, 'grow_policy': 'Depthwise', 'min_data_in_leaf': 293}. Best is trial 207 with value: 1696.3659778820509.[0m
[32m[I 2024-10-13 12:41:36,265][0m Trial 211 finished with value: 1723.1536685601804 and parameters: {'depth': 11, 'learning_rate': 0.0012881346120294916, 'iterations': 2495, 'l2_leaf_reg': 1.8246474966468145e-07, 'border_count': 29, 'bagging_temperature': 0.039357424746789, 'random_strength': 6.516150489312315, 'grow_policy': 'Depthwise', 'min_data_in_leaf': 273}. Best is trial 207 with value: 1696.3659778820509.[0m
[32m[I 2024-10-13 12:41:38,554][0m Trial 212 finished with value: 1948.9778964868867 and parameters: {'depth': 11, 'learning_rate': 0.0012842754453468946, 'iterations': 2395, 'l2_leaf_reg': 6.746696675504091e-08, 'border_count': 17, 'bagging_temperature': 0.021653403136323385, 'random_strength': 6.750918767793777, 'grow_policy': 'Depthwise', 'min_data_in_leaf': 309}. Best is trial 207 with value: 1696.3659778820509.[0m
[32m[I 2024-10-13 12:41:40,985][0m Trial 213 finished with value: 1745.3085289992937 and parameters: {'depth': 6, 'learning_rate': 0.0011010649185073192, 'iterations': 2558, 'l2_leaf_reg': 1.1930546130335744e-07, 'border_count': 23, 'bagging_temperature': 0.07314825937314913, 'random_strength': 6.259649320294168, 'grow_policy': 'Depthwise', 'min_data_in_leaf': 244}. Best is trial 207 with value: 1696.3659778820509.[0m
[32m[I 2024-10-13 12:41:43,317][0m Trial 214 finished with value: 1729.8058736607934 and parameters: {'depth': 11, 'learning_rate': 0.0009798492596629089, 'iterations': 2326, 'l2_leaf_reg': 2.629595882077852e-07, 'border_count': 34, 'bagging_temperature': 0.04008770060905423, 'random_strength': 6.509395679546756, 'grow_policy': 'Depthwise', 'min_data_in_leaf': 286}. Best is trial 207 with value: 1696.3659778820509.[0m
[32m[I 2024-10-13 12:41:45,718][0m Trial 215 finished with value: 1724.6892687480388 and parameters: {'depth': 11, 'learning_rate': 0.0012950460700973969, 'iterations': 2467, 'l2_leaf_reg': 1.3537703895630148e-07, 'border_count': 29, 'bagging_temperature': 0.07089694207641391, 'random_strength': 6.967979663826583, 'grow_policy': 'Depthwise', 'min_data_in_leaf': 325}. Best is trial 207 with value: 1696.3659778820509.[0m
[32m[I 2024-10-13 12:41:48,069][0m Trial 216 finished with value: 1983.7602452012384 and parameters: {'depth': 11, 'learning_rate': 0.001685526312520968, 'iterations': 2420, 'l2_leaf_reg': 2.2653977763254486e-07, 'border_count': 20, 'bagging_temperature': 0.0007189987722978799, 'random_strength': 6.288612681329693, 'grow_policy': 'Depthwise', 'min_data_in_leaf': 265}. Best is trial 207 with value: 1696.3659778820509.[0m
[32m[I 2024-10-13 12:41:50,529][0m Trial 217 finished with value: 1749.2276670791614 and parameters: {'depth': 10, 'learning_rate': 0.0008287855204076024, 'iterations': 2517, 'l2_leaf_reg': 9.021221346938657e-08, 'border_count': 35, 'bagging_temperature': 0.03679766777537333, 'random_strength': 6.834627872322924, 'grow_policy': 'Depthwise', 'min_data_in_leaf': 354}. Best is trial 207 with value: 1696.3659778820509.[0m
[32m[I 2024-10-13 12:41:52,829][0m Trial 218 finished with value: 1897.5982681323778 and parameters: {'depth': 10, 'learning_rate': 0.001143887256684826, 'iterations': 2380, 'l2_leaf_reg': 4.1780962090706326e-08, 'border_count': 11, 'bagging_temperature': 0.057143026367526766, 'random_strength': 7.214669543050209, 'grow_policy': 'Depthwise', 'min_data_in_leaf': 311}. Best is trial 207 with value: 1696.3659778820509.[0m
[32m[I 2024-10-13 12:41:53,903][0m Trial 219 finished with value: 2180.7589225129286 and parameters: {'depth': 4, 'learning_rate': 0.0013163244161407941, 'iterations': 692, 'l2_leaf_reg': 1.7266767091036233e-07, 'border_count': 26, 'bagging_temperature': 0.02127868597725922, 'random_strength': 6.4445525981919465, 'grow_policy': 'Depthwise', 'min_data_in_leaf': 406}. Best is trial 207 with value: 1696.3659778820509.[0m
[32m[I 2024-10-13 12:41:56,238][0m Trial 220 finished with value: 1774.0544215178068 and parameters: {'depth': 6, 'learning_rate': 0.0009554006448566589, 'iterations': 2299, 'l2_leaf_reg': 2.8944542330902314e-07, 'border_count': 42, 'bagging_temperature': 0.08457748883763616, 'random_strength': 6.659877946802456, 'grow_policy': 'Depthwise', 'min_data_in_leaf': 290}. Best is trial 207 with value: 1696.3659778820509.[0m
[32m[I 2024-10-13 12:41:58,547][0m Trial 221 finished with value: 1725.7589412150521 and parameters: {'depth': 11, 'learning_rate': 0.0010308334465203236, 'iterations': 2339, 'l2_leaf_reg': 5.516923389915031e-07, 'border_count': 32, 'bagging_temperature': 0.10289145090446392, 'random_strength': 6.1879932482104865, 'grow_policy': 'Depthwise', 'min_data_in_leaf': 242}. Best is trial 207 with value: 1696.3659778820509.[0m
[32m[I 2024-10-13 12:42:00,871][0m Trial 222 finished with value: 1719.1831290981015 and parameters: {'depth': 11, 'learning_rate': 0.001120953606645055, 'iterations': 2459, 'l2_leaf_reg': 2.858175486558135e-07, 'border_count': 29, 'bagging_temperature': 0.10502128388212163, 'random_strength': 5.9731658707923465, 'grow_policy': 'Depthwise', 'min_data_in_leaf': 204}. Best is trial 207 with value: 1696.3659778820509.[0m
[32m[I 2024-10-13 12:42:03,166][0m Trial 223 finished with value: 1724.9758313324505 and parameters: {'depth': 11, 'learning_rate': 0.0014987725707732175, 'iterations': 2465, 'l2_leaf_reg': 2.3309407339875832e-07, 'border_count': 25, 'bagging_temperature': 0.12049001830145098, 'random_strength': 5.9699334202448195, 'grow_policy': 'Depthwise', 'min_data_in_leaf': 199}. Best is trial 207 with value: 1696.3659778820509.[0m
[32m[I 2024-10-13 12:42:05,507][0m Trial 224 finished with value: 1720.7639568659838 and parameters: {'depth': 11, 'learning_rate': 0.0011769025279889794, 'iterations': 2406, 'l2_leaf_reg': 1.379101241539967e-07, 'border_count': 31, 'bagging_temperature': 0.1307385103823203, 'random_strength': 6.374519185931847, 'grow_policy': 'Depthwise', 'min_data_in_leaf': 271}. Best is trial 207 with value: 1696.3659778820509.[0m
[32m[I 2024-10-13 12:42:07,959][0m Trial 225 finished with value: 1722.0674513550427 and parameters: {'depth': 11, 'learning_rate': 0.0011450363468635313, 'iterations': 2566, 'l2_leaf_reg': 9.154026400700879e-08, 'border_count': 38, 'bagging_temperature': 0.14247182042269585, 'random_strength': 6.397736264636407, 'grow_policy': 'Depthwise', 'min_data_in_leaf': 213}. Best is trial 207 with value: 1696.3659778820509.[0m
[32m[I 2024-10-13 12:42:10,439][0m Trial 226 finished with value: 1926.6923894454726 and parameters: {'depth': 12, 'learning_rate': 0.0008606916594909033, 'iterations': 2429, 'l2_leaf_reg': 7.114360549036271e-08, 'border_count': 21, 'bagging_temperature': 0.044721446164091364, 'random_strength': 6.21149581422394, 'grow_policy': 'Depthwise', 'min_data_in_leaf': 267}. Best is trial 207 with value: 1696.3659778820509.[0m
[32m[I 2024-10-13 12:42:13,034][0m Trial 227 finished with value: 1793.311516806558 and parameters: {'depth': 11, 'learning_rate': 0.0007210996073791606, 'iterations': 2505, 'l2_leaf_reg': 1.2934510893924823e-07, 'border_count': 29, 'bagging_temperature': 0.06599019283549522, 'random_strength': 6.51668655901229, 'grow_policy': 'Depthwise', 'min_data_in_leaf': 266}. Best is trial 207 with value: 1696.3659778820509.[0m
[32m[I 2024-10-13 12:42:15,376][0m Trial 228 finished with value: 1933.8118246278848 and parameters: {'depth': 11, 'learning_rate': 0.0011030915910557166, 'iterations': 2389, 'l2_leaf_reg': 1.5131180862631913e-07, 'border_count': 16, 'bagging_temperature': 0.08929074718345172, 'random_strength': 6.124127000211528, 'grow_policy': 'Depthwise', 'min_data_in_leaf': 174}. Best is trial 207 with value: 1696.3659778820509.[0m
[32m[I 2024-10-13 12:42:17,880][0m Trial 229 finished with value: 1760.3166234126295 and parameters: {'depth': 11, 'learning_rate': 0.001577848899648112, 'iterations': 2634, 'l2_leaf_reg': 5.270467074017606e-08, 'border_count': 35, 'bagging_temperature': 0.02066095443393426, 'random_strength': 6.666296497961141, 'grow_policy': 'Depthwise', 'min_data_in_leaf': 238}. Best is trial 207 with value: 1696.3659778820509.[0m
[32m[I 2024-10-13 12:42:20,315][0m Trial 230 finished with value: 1721.9647509727868 and parameters: {'depth': 12, 'learning_rate': 0.0009719771590159802, 'iterations': 2454, 'l2_leaf_reg': 3.3849223918708293e-07, 'border_count': 26, 'bagging_temperature': 0.0429624349389528, 'random_strength': 5.932810301656512, 'grow_policy': 'Depthwise', 'min_data_in_leaf': 292}. Best is trial 207 with value: 1696.3659778820509.[0m
[32m[I 2024-10-13 12:42:22,593][0m Trial 231 finished with value: 1722.3002788099918 and parameters: {'depth': 10, 'learning_rate': 0.0013018916738528315, 'iterations': 2273, 'l2_leaf_reg': 2.1609535000474508e-07, 'border_count': 31, 'bagging_temperature': 0.1301117894657973, 'random_strength': 5.575249847243797, 'grow_policy': 'Depthwise', 'min_data_in_leaf': 387}. Best is trial 207 with value: 1696.3659778820509.[0m
[32m[I 2024-10-13 12:42:24,872][0m Trial 232 finished with value: 1725.8654275170757 and parameters: {'depth': 11, 'learning_rate': 0.0013155265546069088, 'iterations': 2354, 'l2_leaf_reg': 6.353395302309813e-07, 'border_count': 29, 'bagging_temperature': 0.1439244592567181, 'random_strength': 6.932591789040638, 'grow_policy': 'Depthwise', 'min_data_in_leaf': 993}. Best is trial 207 with value: 1696.3659778820509.[0m
[32m[I 2024-10-13 12:42:27,190][0m Trial 233 finished with value: 1951.3691036820414 and parameters: {'depth': 10, 'learning_rate': 0.0012077722683037871, 'iterations': 2320, 'l2_leaf_reg': 3.5370776843761096e-07, 'border_count': 22, 'bagging_temperature': 0.10883214666407257, 'random_strength': 6.35889966363341, 'grow_policy': 'Depthwise', 'min_data_in_leaf': 320}. Best is trial 207 with value: 1696.3659778820509.[0m
[32m[I 2024-10-13 12:42:29,381][0m Trial 234 finished with value: 1735.2143808084732 and parameters: {'depth': 11, 'learning_rate': 0.0010386070316484002, 'iterations': 2234, 'l2_leaf_reg': 1.5893517274677657e-07, 'border_count': 36, 'bagging_temperature': 0.17458319701004693, 'random_strength': 1.1509946164608689, 'grow_policy': 'Depthwise', 'min_data_in_leaf': 369}. Best is trial 207 with value: 1696.3659778820509.[0m
[32m[I 2024-10-13 12:42:31,691][0m Trial 235 finished with value: 1741.7408669928698 and parameters: {'depth': 10, 'learning_rate': 0.0015131506216820136, 'iterations': 2392, 'l2_leaf_reg': 1.0878824156939649e-07, 'border_count': 31, 'bagging_temperature': 0.08293307850578213, 'random_strength': 5.386455426476234, 'grow_policy': 'Depthwise', 'min_data_in_leaf': 282}. Best is trial 207 with value: 1696.3659778820509.[0m
[32m[I 2024-10-13 12:42:34,145][0m Trial 236 finished with value: 1780.7346178953667 and parameters: {'depth': 11, 'learning_rate': 0.0008371537360665392, 'iterations': 2504, 'l2_leaf_reg': 2.877284953949831e-07, 'border_count': 24, 'bagging_temperature': 0.06301429518146397, 'random_strength': 6.603363639015567, 'grow_policy': 'Depthwise', 'min_data_in_leaf': 311}. Best is trial 207 with value: 1696.3659778820509.[0m
[32m[I 2024-10-13 12:42:36,467][0m Trial 237 finished with value: 1808.9514801810076 and parameters: {'depth': 10, 'learning_rate': 0.0011967855409055527, 'iterations': 2430, 'l2_leaf_reg': 6.191895678668738e-07, 'border_count': 42, 'bagging_temperature': 5.191720553535117e-06, 'random_strength': 6.1912528503018756, 'grow_policy': 'Depthwise', 'min_data_in_leaf': 343}. Best is trial 207 with value: 1696.3659778820509.[0m
[32m[I 2024-10-13 12:42:38,659][0m Trial 238 finished with value: 1720.3983664165623 and parameters: {'depth': 10, 'learning_rate': 0.001353500188714628, 'iterations': 2173, 'l2_leaf_reg': 3.9986651259248154e-07, 'border_count': 34, 'bagging_temperature': 0.1275874632258777, 'random_strength': 6.810603635924198, 'grow_policy': 'Depthwise', 'min_data_in_leaf': 259}. Best is trial 207 with value: 1696.3659778820509.[0m
[32m[I 2024-10-13 12:43:08,893][0m Trial 239 finished with value: 2007.9623254328812 and parameters: {'depth': 9, 'learning_rate': 0.0009722806115046911, 'iterations': 2578, 'l2_leaf_reg': 2.1849341425097927e-07, 'border_count': 36, 'bagging_temperature': 0.0977477203022669, 'random_strength': 7.132672247285395, 'grow_policy': 'SymmetricTree', 'min_data_in_leaf': 259}. Best is trial 207 with value: 1696.3659778820509.[0m
[32m[I 2024-10-13 12:43:10,963][0m Trial 240 finished with value: 2001.212319727334 and parameters: {'depth': 11, 'learning_rate': 0.002000354594384265, 'iterations': 2172, 'l2_leaf_reg': 3.8945051147352036e-07, 'border_count': 20, 'bagging_temperature': 0.032210031724226734, 'random_strength': 6.701709571175191, 'grow_policy': 'Depthwise', 'min_data_in_leaf': 246}. Best is trial 207 with value: 1696.3659778820509.[0m
[32m[I 2024-10-13 12:43:13,155][0m Trial 241 finished with value: 1726.64117502126 and parameters: {'depth': 10, 'learning_rate': 0.0013799365601592545, 'iterations': 2278, 'l2_leaf_reg': 4.785326324231998e-07, 'border_count': 28, 'bagging_temperature': 0.12972856156938894, 'random_strength': 6.447976464428928, 'grow_policy': 'Depthwise', 'min_data_in_leaf': 272}. Best is trial 207 with value: 1696.3659778820509.[0m
[32m[I 2024-10-13 12:43:15,465][0m Trial 242 finished with value: 1719.6371480787293 and parameters: {'depth': 10, 'learning_rate': 0.00115042871237051, 'iterations': 2342, 'l2_leaf_reg': 1.717668170622399e-07, 'border_count': 33, 'bagging_temperature': 0.12220635353290439, 'random_strength': 6.868563321395799, 'grow_policy': 'Depthwise', 'min_data_in_leaf': 221}. Best is trial 207 with value: 1696.3659778820509.[0m
[32m[I 2024-10-13 12:43:17,815][0m Trial 243 finished with value: 1722.866515401196 and parameters: {'depth': 10, 'learning_rate': 0.001100588705005174, 'iterations': 2363, 'l2_leaf_reg': 1.657641472082273e-07, 'border_count': 37, 'bagging_temperature': 0.1471239166240092, 'random_strength': 6.915402559100094, 'grow_policy': 'Depthwise', 'min_data_in_leaf': 213}. Best is trial 207 with value: 1696.3659778820509.[0m
[32m[I 2024-10-13 12:43:20,241][0m Trial 244 finished with value: 1719.8342023111138 and parameters: {'depth': 5, 'learning_rate': 0.0011441968249521115, 'iterations': 2479, 'l2_leaf_reg': 9.846672535848912e-08, 'border_count': 33, 'bagging_temperature': 0.10836601402178646, 'random_strength': 7.081333660473065, 'grow_policy': 'Depthwise', 'min_data_in_leaf': 196}. Best is trial 207 with value: 1696.3659778820509.[0m
[32m[I 2024-10-13 12:43:22,609][0m Trial 245 finished with value: 1750.5070867025272 and parameters: {'depth': 5, 'learning_rate': 0.0009474712908136344, 'iterations': 2467, 'l2_leaf_reg': 6.755619372529729e-08, 'border_count': 41, 'bagging_temperature': 0.1057098766600007, 'random_strength': 7.146659827542979, 'grow_policy': 'Depthwise', 'min_data_in_leaf': 207}. Best is trial 207 with value: 1696.3659778820509.[0m
[32m[I 2024-10-13 12:43:24,985][0m Trial 246 finished with value: 1742.0602581158753 and parameters: {'depth': 5, 'learning_rate': 0.0015057962149374064, 'iterations': 2408, 'l2_leaf_reg': 1.0804674992749902e-07, 'border_count': 34, 'bagging_temperature': 0.07480912348587276, 'random_strength': 6.681060922639283, 'grow_policy': 'Depthwise', 'min_data_in_leaf': 231}. Best is trial 207 with value: 1696.3659778820509.[0m
[32m[I 2024-10-13 12:43:27,168][0m Trial 247 finished with value: 1715.6091043254473 and parameters: {'depth': 5, 'learning_rate': 0.0012026498936917108, 'iterations': 2199, 'l2_leaf_reg': 9.546472895866108e-08, 'border_count': 32, 'bagging_temperature': 0.05569589900401537, 'random_strength': 6.056156249935182, 'grow_policy': 'Depthwise', 'min_data_in_leaf': 145}. Best is trial 207 with value: 1696.3659778820509.[0m
[32m[I 2024-10-13 12:43:29,385][0m Trial 248 finished with value: 1787.8205956249046 and parameters: {'depth': 5, 'learning_rate': 0.0008519078035796566, 'iterations': 2181, 'l2_leaf_reg': 5.007827822200139e-08, 'border_count': 45, 'bagging_temperature': 0.05174064020943715, 'random_strength': 5.876143344639905, 'grow_policy': 'Depthwise', 'min_data_in_leaf': 193}. Best is trial 207 with value: 1696.3659778820509.[0m
[32m[I 2024-10-13 12:43:31,501][0m Trial 249 finished with value: 1695.0689015039372 and parameters: {'depth': 5, 'learning_rate': 0.0013418560970370134, 'iterations': 2052, 'l2_leaf_reg': 8.40998547146833e-08, 'border_count': 25, 'bagging_temperature': 0.019655786104277276, 'random_strength': 5.6995462122315494, 'grow_policy': 'Depthwise', 'min_data_in_leaf': 110}. Best is trial 249 with value: 1695.0689015039372.[0m
[32m[I 2024-10-13 12:43:33,678][0m Trial 250 finished with value: 1780.8787064743813 and parameters: {'depth': 5, 'learning_rate': 0.0017841065898487082, 'iterations': 2255, 'l2_leaf_reg': 8.22029178217917e-08, 'border_count': 24, 'bagging_temperature': 0.023212457074237837, 'random_strength': 5.696416271882761, 'grow_policy': 'Depthwise', 'min_data_in_leaf': 109}. Best is trial 249 with value: 1695.0689015039372.[0m
[32m[I 2024-10-13 12:43:36,440][0m Trial 251 finished with value: 1736.8750108440292 and parameters: {'depth': 5, 'learning_rate': 0.0010147626299187547, 'iterations': 2080, 'l2_leaf_reg': 6.565853385285233e-08, 'border_count': 25, 'bagging_temperature': 0.020239988916119413, 'random_strength': 5.608475390885777, 'grow_policy': 'Depthwise', 'min_data_in_leaf': 54}. Best is trial 249 with value: 1695.0689015039372.[0m
