[32m[I 2024-10-13 13:21:17,517][0m Trial 913 finished with value: 1815.807452127304 and parameters: {'depth': 5, 'learning_rate': 0.0016703518286188327, 'iterations': 1829, 'l2_leaf_reg': 4.693232065351789e-06, 'border_count': 36, 'bagging_temperature': 0.015242778800748025, 'random_strength': 8.942031583514702, 'grow_policy': 'Depthwise', 'min_data_in_leaf': 70}. Best is trial 568 with value: 1659.4433932934307.[0m
[32m[I 2024-10-13 13:21:19,337][0m Trial 914 finished with value: 1744.0335459225207 and parameters: {'depth': 5, 'learning_rate': 0.002139861141044608, 'iterations': 1746, 'l2_leaf_reg': 1.7892118763117817e-05, 'border_count': 29, 'bagging_temperature': 0.05692618840226506, 'random_strength': 8.766694741346818, 'grow_policy': 'Depthwise', 'min_data_in_leaf': 160}. Best is trial 568 with value: 1659.4433932934307.[0m
[32m[I 2024-10-13 13:21:21,330][0m Trial 915 finished with value: 2374.869377859969 and parameters: {'depth': 4, 'learning_rate': 0.0015169458660226106, 'iterations': 1884, 'l2_leaf_reg': 9.041842161619579e-07, 'border_count': 4, 'bagging_temperature': 0.034991405572168656, 'random_strength': 8.294233610405772, 'grow_policy': 'Depthwise', 'min_data_in_leaf': 99}. Best is trial 568 with value: 1659.4433932934307.[0m
[32m[I 2024-10-13 13:21:23,196][0m Trial 916 finished with value: 1953.2679928755324 and parameters: {'depth': 5, 'learning_rate': 0.0018278517556977016, 'iterations': 1746, 'l2_leaf_reg': 0.004078645713735313, 'border_count': 17, 'bagging_temperature': 0.018210608985124655, 'random_strength': 9.24574802139259, 'grow_policy': 'Depthwise', 'min_data_in_leaf': 138}. Best is trial 568 with value: 1659.4433932934307.[0m
[32m[I 2024-10-13 13:21:25,074][0m Trial 917 finished with value: 3004.845103090063 and parameters: {'depth': 5, 'learning_rate': 0.12801913402710244, 'iterations': 1789, 'l2_leaf_reg': 3.321290008493955e-08, 'border_count': 12, 'bagging_temperature': 0.06804378746920901, 'random_strength': 8.492070114684397, 'grow_policy': 'Depthwise', 'min_data_in_leaf': 114}. Best is trial 568 with value: 1659.4433932934307.[0m
[32m[I 2024-10-13 13:21:26,842][0m Trial 918 finished with value: 1792.9257299496387 and parameters: {'depth': 6, 'learning_rate': 0.0015056581534561733, 'iterations': 1655, 'l2_leaf_reg': 8.739617561237191e-07, 'border_count': 23, 'bagging_temperature': 0.622590960041838, 'random_strength': 8.771253154450317, 'grow_policy': 'Depthwise', 'min_data_in_leaf': 125}. Best is trial 568 with value: 1659.4433932934307.[0m
[32m[I 2024-10-13 13:21:28,568][0m Trial 919 finished with value: 1722.618160418935 and parameters: {'depth': 4, 'learning_rate': 0.0018797604756818135, 'iterations': 1700, 'l2_leaf_reg': 5.566450173872397e-08, 'border_count': 32, 'bagging_temperature': 0.04507021755945993, 'random_strength': 8.290920413981986, 'grow_policy': 'Depthwise', 'min_data_in_leaf': 167}. Best is trial 568 with value: 1659.4433932934307.[0m
[32m[I 2024-10-13 13:21:30,100][0m Trial 920 finished with value: 1931.184613501949 and parameters: {'depth': 5, 'learning_rate': 0.0013462872477293841, 'iterations': 1379, 'l2_leaf_reg': 0.016337357609297422, 'border_count': 19, 'bagging_temperature': 0.6800443133625731, 'random_strength': 9.102402666233768, 'grow_policy': 'Depthwise', 'min_data_in_leaf': 147}. Best is trial 568 with value: 1659.4433932934307.[0m
[32m[I 2024-10-13 13:21:32,605][0m Trial 921 finished with value: 1991.197987215566 and parameters: {'depth': 5, 'learning_rate': 0.002599414285474957, 'iterations': 1977, 'l2_leaf_reg': 6.416511558529386e-07, 'border_count': 27, 'bagging_temperature': 0.026929090628390905, 'random_strength': 7.899560502563749, 'grow_policy': 'Depthwise', 'min_data_in_leaf': 81}. Best is trial 568 with value: 1659.4433932934307.[0m
[32m[I 2024-10-13 13:21:34,413][0m Trial 922 finished with value: 1742.477082983826 and parameters: {'depth': 6, 'learning_rate': 0.0016286755024742536, 'iterations': 1580, 'l2_leaf_reg': 0.0010050115585152077, 'border_count': 24, 'bagging_temperature': 0.016768779656915873, 'random_strength': 4.585122708094718, 'grow_policy': 'Depthwise', 'min_data_in_leaf': 110}. Best is trial 568 with value: 1659.4433932934307.[0m
[32m[I 2024-10-13 13:21:36,472][0m Trial 923 finished with value: 2331.9296554333496 and parameters: {'depth': 9, 'learning_rate': 0.0003659662392624038, 'iterations': 1905, 'l2_leaf_reg': 7.709763282199879e-08, 'border_count': 37, 'bagging_temperature': 0.05191591835657669, 'random_strength': 8.827841166550732, 'grow_policy': 'Depthwise', 'min_data_in_leaf': 141}. Best is trial 568 with value: 1659.4433932934307.[0m
[32m[I 2024-10-13 13:21:38,559][0m Trial 924 finished with value: 1715.7879138393996 and parameters: {'depth': 6, 'learning_rate': 0.001302633987964806, 'iterations': 2046, 'l2_leaf_reg': 2.4837899913882245e-08, 'border_count': 30, 'bagging_temperature': 0.06586791837907409, 'random_strength': 8.546271645531812, 'grow_policy': 'Depthwise', 'min_data_in_leaf': 185}. Best is trial 568 with value: 1659.4433932934307.[0m
[32m[I 2024-10-13 13:21:44,946][0m Trial 925 finished with value: 2585.003046187497 and parameters: {'depth': 9, 'learning_rate': 0.0021229816423612683, 'iterations': 1641, 'l2_leaf_reg': 1.9488876682474004e-06, 'border_count': 13, 'bagging_temperature': 0.040229957105502714, 'random_strength': 8.093443875066956, 'grow_policy': 'Depthwise', 'min_data_in_leaf': 1}. Best is trial 568 with value: 1659.4433932934307.[0m
[32m[I 2024-10-13 13:21:46,777][0m Trial 926 finished with value: 1921.573409323582 and parameters: {'depth': 4, 'learning_rate': 0.0015011600016957049, 'iterations': 1787, 'l2_leaf_reg': 4.8248319441732416e-08, 'border_count': 20, 'bagging_temperature': 0.017809014790828206, 'random_strength': 7.820185002599697, 'grow_policy': 'Depthwise', 'min_data_in_leaf': 228}. Best is trial 568 with value: 1659.4433932934307.[0m
[32m[I 2024-10-13 13:21:48,872][0m Trial 927 finished with value: 1964.115312925014 and parameters: {'depth': 9, 'learning_rate': 0.0017382482397336222, 'iterations': 1868, 'l2_leaf_reg': 8.42702105371154e-08, 'border_count': 93, 'bagging_temperature': 0.07648870236431482, 'random_strength': 7.557045625153529, 'grow_policy': 'Depthwise', 'min_data_in_leaf': 96}. Best is trial 568 with value: 1659.4433932934307.[0m
[32m[I 2024-10-13 13:21:50,911][0m Trial 928 finished with value: 2175.2684174218625 and parameters: {'depth': 8, 'learning_rate': 0.005327437756194649, 'iterations': 1306, 'l2_leaf_reg': 3.538832277106339e-08, 'border_count': 25, 'bagging_temperature': 0.03009771355925217, 'random_strength': 7.1974219895872915, 'grow_policy': 'Depthwise', 'min_data_in_leaf': 59}. Best is trial 568 with value: 1659.4433932934307.[0m
[32m[I 2024-10-13 13:21:52,923][0m Trial 929 finished with value: 1773.4522749463026 and parameters: {'depth': 5, 'learning_rate': 0.002998380226103744, 'iterations': 2007, 'l2_leaf_reg': 6.680607013262347e-08, 'border_count': 34, 'bagging_temperature': 0.001019292230454473, 'random_strength': 8.286000970543709, 'grow_policy': 'Depthwise', 'min_data_in_leaf': 127}. Best is trial 568 with value: 1659.4433932934307.[0m
[32m[I 2024-10-13 13:21:53,856][0m Trial 930 finished with value: 2340.5694533068295 and parameters: {'depth': 9, 'learning_rate': 0.001224449278126248, 'iterations': 574, 'l2_leaf_reg': 1.6561558383897617e-08, 'border_count': 7, 'bagging_temperature': 0.04776818284040717, 'random_strength': 4.3442986133789265, 'grow_policy': 'Depthwise', 'min_data_in_leaf': 169}. Best is trial 568 with value: 1659.4433932934307.[0m
[32m[I 2024-10-13 13:21:55,285][0m Trial 931 finished with value: 1982.2753215925486 and parameters: {'depth': 15, 'learning_rate': 0.0014251011223615686, 'iterations': 1141, 'l2_leaf_reg': 1.1852507519792422e-07, 'border_count': 17, 'bagging_temperature': 0.03237894780933015, 'random_strength': 6.995724861885423, 'grow_policy': 'Depthwise', 'min_data_in_leaf': 151}. Best is trial 568 with value: 1659.4433932934307.[0m
[32m[I 2024-10-13 13:22:00,107][0m Trial 932 finished with value: 2279.8971351666 and parameters: {'depth': 13, 'learning_rate': 0.001975375775740922, 'iterations': 2078, 'l2_leaf_reg': 5.324098091707239e-08, 'border_count': 28, 'bagging_temperature': 0.06514159002435381, 'random_strength': 4.806887802079903, 'grow_policy': 'Depthwise', 'min_data_in_leaf': 23}. Best is trial 568 with value: 1659.4433932934307.[0m
[32m[I 2024-10-13 13:22:02,084][0m Trial 933 finished with value: 1758.9867116007374 and parameters: {'depth': 8, 'learning_rate': 0.0012178504370799347, 'iterations': 1924, 'l2_leaf_reg': 9.258728586365628e-08, 'border_count': 46, 'bagging_temperature': 0.014776911486598833, 'random_strength': 7.3585088407703605, 'grow_policy': 'Depthwise', 'min_data_in_leaf': 112}. Best is trial 568 with value: 1659.4433932934307.[0m
[32m[I 2024-10-13 13:22:04,045][0m Trial 934 finished with value: 1961.8532209047253 and parameters: {'depth': 8, 'learning_rate': 0.0016286814457493984, 'iterations': 1967, 'l2_leaf_reg': 3.183130073015764e-08, 'border_count': 22, 'bagging_temperature': 0.00018259829021526552, 'random_strength': 7.973855579266803, 'grow_policy': 'Depthwise', 'min_data_in_leaf': 201}. Best is trial 568 with value: 1659.4433932934307.[0m
[32m[I 2024-10-13 13:22:05,651][0m Trial 935 finished with value: 1891.9558756361698 and parameters: {'depth': 9, 'learning_rate': 0.0010474491639443592, 'iterations': 1449, 'l2_leaf_reg': 0.15956368267776105, 'border_count': 40, 'bagging_temperature': 0.051481463583612275, 'random_strength': 7.602050649105575, 'grow_policy': 'Depthwise', 'min_data_in_leaf': 130}. Best is trial 568 with value: 1659.4433932934307.[0m
[32m[I 2024-10-13 13:22:07,760][0m Trial 936 finished with value: 1739.9986644172602 and parameters: {'depth': 6, 'learning_rate': 0.0013440602207125632, 'iterations': 1631, 'l2_leaf_reg': 1.430785340590443e-07, 'border_count': 32, 'bagging_temperature': 0.030451448980886083, 'random_strength': 7.1383797753005, 'grow_policy': 'Depthwise', 'min_data_in_leaf': 83}. Best is trial 568 with value: 1659.4433932934307.[0m
[32m[I 2024-10-13 13:22:09,101][0m Trial 937 finished with value: 1892.1723909587101 and parameters: {'depth': 7, 'learning_rate': 0.0023103854776015545, 'iterations': 1070, 'l2_leaf_reg': 1.2199431671373262e-06, 'border_count': 11, 'bagging_temperature': 0.00016424848491514155, 'random_strength': 7.757933136348148, 'grow_policy': 'Depthwise', 'min_data_in_leaf': 167}. Best is trial 568 with value: 1659.4433932934307.[0m
[32m[I 2024-10-13 13:22:28,810][0m Trial 938 finished with value: 2050.1579449519327 and parameters: {'depth': 9, 'learning_rate': 0.0017145671360150171, 'iterations': 2056, 'l2_leaf_reg': 6.073328660651396e-07, 'border_count': 18, 'bagging_temperature': 0.08156013811838704, 'random_strength': 4.094455003174223, 'grow_policy': 'SymmetricTree', 'min_data_in_leaf': 145}. Best is trial 568 with value: 1659.4433932934307.[0m
[32m[I 2024-10-13 13:22:31,419][0m Trial 939 finished with value: 1736.5896430413761 and parameters: {'depth': 7, 'learning_rate': 0.001191542530630887, 'iterations': 2616, 'l2_leaf_reg': 3.865500339402217e-06, 'border_count': 26, 'bagging_temperature': 0.047362335812868986, 'random_strength': 7.465891321495805, 'grow_policy': 'Depthwise', 'min_data_in_leaf': 102}. Best is trial 568 with value: 1659.4433932934307.[0m
[32m[I 2024-10-13 13:22:33,464][0m Trial 940 finished with value: 2848.760849546926 and parameters: {'depth': 8, 'learning_rate': 0.001501533264236724, 'iterations': 2124, 'l2_leaf_reg': 5.4393655284050775e-08, 'border_count': 1, 'bagging_temperature': 0.021279810239270995, 'random_strength': 4.666432710409963, 'grow_policy': 'Depthwise', 'min_data_in_leaf': 120}. Best is trial 568 with value: 1659.4433932934307.[0m
[32m[I 2024-10-13 13:22:35,941][0m Trial 941 finished with value: 1949.189972797772 and parameters: {'depth': 5, 'learning_rate': 0.001011104308457484, 'iterations': 1986, 'l2_leaf_reg': 8.436458904581336e-08, 'border_count': 22, 'bagging_temperature': 0.06169700710442051, 'random_strength': 8.165443761781983, 'grow_policy': 'Depthwise', 'min_data_in_leaf': 55}. Best is trial 568 with value: 1659.4433932934307.[0m
[32m[I 2024-10-13 13:22:39,831][0m Trial 942 finished with value: 2186.25442440322 and parameters: {'depth': 9, 'learning_rate': 0.0019038430572077176, 'iterations': 1845, 'l2_leaf_reg': 2.1395076289698402e-08, 'border_count': 30, 'bagging_temperature': 0.03633800657561124, 'random_strength': 8.459107665636585, 'grow_policy': 'Depthwise', 'min_data_in_leaf': 24}. Best is trial 568 with value: 1659.4433932934307.[0m
[32m[I 2024-10-13 13:22:41,883][0m Trial 943 finished with value: 1937.0640739771902 and parameters: {'depth': 9, 'learning_rate': 0.0013558352583514818, 'iterations': 2031, 'l2_leaf_reg': 1.065164602660499e-08, 'border_count': 14, 'bagging_temperature': 0.018041084448458172, 'random_strength': 6.949467762076278, 'grow_policy': 'Depthwise', 'min_data_in_leaf': 155}. Best is trial 568 with value: 1659.4433932934307.[0m
[32m[I 2024-10-13 13:22:43,088][0m Trial 944 finished with value: 2629.868147668628 and parameters: {'depth': 9, 'learning_rate': 0.0004594087772694051, 'iterations': 881, 'l2_leaf_reg': 1.768329152629325e-07, 'border_count': 36, 'bagging_temperature': 0.08819449377479435, 'random_strength': 7.262642292457227, 'grow_policy': 'Depthwise', 'min_data_in_leaf': 211}. Best is trial 568 with value: 1659.4433932934307.[0m
[32m[I 2024-10-13 13:22:45,484][0m Trial 945 finished with value: 1746.4172208429732 and parameters: {'depth': 8, 'learning_rate': 0.001171963068854167, 'iterations': 1922, 'l2_leaf_reg': 3.6235296010619956e-07, 'border_count': 25, 'bagging_temperature': 0.04849335557185369, 'random_strength': 9.450467978462623, 'grow_policy': 'Depthwise', 'min_data_in_leaf': 75}. Best is trial 568 with value: 1659.4433932934307.[0m
[32m[I 2024-10-13 13:22:48,153][0m Trial 946 finished with value: 1940.4518134867824 and parameters: {'depth': 7, 'learning_rate': 0.0015320960759651506, 'iterations': 2760, 'l2_leaf_reg': 4.922057207674962, 'border_count': 19, 'bagging_temperature': 0.17617813786465214, 'random_strength': 4.984812782024713, 'grow_policy': 'Depthwise', 'min_data_in_leaf': 135}. Best is trial 568 with value: 1659.4433932934307.[0m
[32m[I 2024-10-13 13:22:50,197][0m Trial 947 finished with value: 1760.7670152943313 and parameters: {'depth': 9, 'learning_rate': 0.0020142395719092558, 'iterations': 2087, 'l2_leaf_reg': 4.008937030547716e-08, 'border_count': 28, 'bagging_temperature': 0.06830629336543353, 'random_strength': 8.056590420225646, 'grow_policy': 'Depthwise', 'min_data_in_leaf': 175}. Best is trial 568 with value: 1659.4433932934307.[0m
[32m[I 2024-10-13 13:22:52,349][0m Trial 948 finished with value: 1769.569483046211 and parameters: {'depth': 5, 'learning_rate': 0.0025446968801035724, 'iterations': 2117, 'l2_leaf_reg': 1.1723039259645227e-07, 'border_count': 32, 'bagging_temperature': 0.016982942669885565, 'random_strength': 6.815945486332062, 'grow_policy': 'Depthwise', 'min_data_in_leaf': 236}. Best is trial 568 with value: 1659.4433932934307.[0m
[32m[I 2024-10-13 13:22:55,279][0m Trial 949 finished with value: 1908.3153156127985 and parameters: {'depth': 9, 'learning_rate': 0.0009357395617603446, 'iterations': 1959, 'l2_leaf_reg': 2.1254600678679543e-07, 'border_count': 81, 'bagging_temperature': 0.03444634072177237, 'random_strength': 8.767214227648621, 'grow_policy': 'Depthwise', 'min_data_in_leaf': 40}. Best is trial 568 with value: 1659.4433932934307.[0m
[32m[I 2024-10-13 13:22:57,502][0m Trial 950 finished with value: 1963.4705536100428 and parameters: {'depth': 6, 'learning_rate': 0.001280361647171073, 'iterations': 2162, 'l2_leaf_reg': 6.295289308399616e-08, 'border_count': 21, 'bagging_temperature': 0.04838800374284209, 'random_strength': 7.42264262407817, 'grow_policy': 'Depthwise', 'min_data_in_leaf': 95}. Best is trial 568 with value: 1659.4433932934307.[0m
[32m[I 2024-10-13 13:22:59,576][0m Trial 951 finished with value: 1708.8993756580976 and parameters: {'depth': 8, 'learning_rate': 0.0015946378446335637, 'iterations': 2009, 'l2_leaf_reg': 2.6849546031447713e-08, 'border_count': 26, 'bagging_temperature': 0.00037943453223311316, 'random_strength': 7.038503112853145, 'grow_policy': 'Depthwise', 'min_data_in_leaf': 262}. Best is trial 568 with value: 1659.4433932934307.[0m
[32m[I 2024-10-13 13:23:01,476][0m Trial 952 finished with value: 1748.5032699464155 and parameters: {'depth': 8, 'learning_rate': 0.0021256174919031413, 'iterations': 1820, 'l2_leaf_reg': 2.3954231756724675e-08, 'border_count': 39, 'bagging_temperature': 0.01621398706708558, 'random_strength': 6.769538666784337, 'grow_policy': 'Depthwise', 'min_data_in_leaf': 266}. Best is trial 568 with value: 1659.4433932934307.[0m
[32m[I 2024-10-13 13:23:03,385][0m Trial 953 finished with value: 1725.6468566809883 and parameters: {'depth': 8, 'learning_rate': 0.0017494749251695287, 'iterations': 1901, 'l2_leaf_reg': 1.225597859495185e-08, 'border_count': 33, 'bagging_temperature': 0.016496192185022376, 'random_strength': 7.002079353677617, 'grow_policy': 'Depthwise', 'min_data_in_leaf': 249}. Best is trial 568 with value: 1659.4433932934307.[0m
[32m[I 2024-10-13 13:23:05,412][0m Trial 954 finished with value: 1726.6626289942997 and parameters: {'depth': 8, 'learning_rate': 0.0016928587395758923, 'iterations': 1988, 'l2_leaf_reg': 1.9612577440779573e-08, 'border_count': 28, 'bagging_temperature': 0.002739405433924494, 'random_strength': 6.682011441803525, 'grow_policy': 'Depthwise', 'min_data_in_leaf': 271}. Best is trial 568 with value: 1659.4433932934307.[0m
[32m[I 2024-10-13 13:23:07,430][0m Trial 955 finished with value: 1769.971025759686 and parameters: {'depth': 8, 'learning_rate': 0.002842232347304377, 'iterations': 1934, 'l2_leaf_reg': 1.5950249881246402e-08, 'border_count': 36, 'bagging_temperature': 0.0006022936465925777, 'random_strength': 7.162983033827127, 'grow_policy': 'Depthwise', 'min_data_in_leaf': 250}. Best is trial 568 with value: 1659.4433932934307.[0m
[32m[I 2024-10-13 13:23:21,725][0m Trial 956 finished with value: 1963.2882916965407 and parameters: {'depth': 8, 'learning_rate': 0.0022084270717233445, 'iterations': 1860, 'l2_leaf_reg': 3.000264914387943e-08, 'border_count': 26, 'bagging_temperature': 0.00011172952956087917, 'random_strength': 7.050609102465508, 'grow_policy': 'SymmetricTree', 'min_data_in_leaf': 307}. Best is trial 568 with value: 1659.4433932934307.[0m
[32m[I 2024-10-13 13:23:23,617][0m Trial 957 finished with value: 2673.8102490345905 and parameters: {'depth': 7, 'learning_rate': 0.0002148634660977539, 'iterations': 1718, 'l2_leaf_reg': 3.494770044455654e-08, 'border_count': 30, 'bagging_temperature': 0.035189876167844865, 'random_strength': 6.80850419627197, 'grow_policy': 'Depthwise', 'min_data_in_leaf': 276}. Best is trial 568 with value: 1659.4433932934307.[0m
[32m[I 2024-10-13 13:23:25,602][0m Trial 958 finished with value: 1764.8299181134425 and parameters: {'depth': 7, 'learning_rate': 0.0018164604965713593, 'iterations': 2015, 'l2_leaf_reg': 2.7901065149933425e-08, 'border_count': 24, 'bagging_temperature': 0.03217845246401054, 'random_strength': 6.577794118938394, 'grow_policy': 'Depthwise', 'min_data_in_leaf': 259}. Best is trial 568 with value: 1659.4433932934307.[0m
[32m[I 2024-10-13 13:23:27,637][0m Trial 959 finished with value: 1821.3645062433268 and parameters: {'depth': 8, 'learning_rate': 0.0015500761243945017, 'iterations': 1951, 'l2_leaf_reg': 1.45385339533829e-08, 'border_count': 44, 'bagging_temperature': 0.06679459478752425, 'random_strength': 6.948868447182929, 'grow_policy': 'Depthwise', 'min_data_in_leaf': 283}. Best is trial 568 with value: 1659.4433932934307.[0m
[32m[I 2024-10-13 13:23:30,194][0m Trial 960 finished with value: 1761.1463841779553 and parameters: {'depth': 8, 'learning_rate': 0.0014796360177221986, 'iterations': 2731, 'l2_leaf_reg': 4.335872179709621e-08, 'border_count': 33, 'bagging_temperature': 0.09369475194532191, 'random_strength': 7.05209059206934, 'grow_policy': 'Depthwise', 'min_data_in_leaf': 982}. Best is trial 568 with value: 1659.4433932934307.[0m
[32m[I 2024-10-13 13:23:32,104][0m Trial 961 finished with value: 2297.022984868243 and parameters: {'depth': 8, 'learning_rate': 0.0035323718022560982, 'iterations': 1801, 'l2_leaf_reg': 5.0460039812497157e-08, 'border_count': 169, 'bagging_temperature': 0.41686058841878953, 'random_strength': 6.733321150360802, 'grow_policy': 'Depthwise', 'min_data_in_leaf': 264}. Best is trial 568 with value: 1659.4433932934307.[0m
[32m[I 2024-10-13 13:23:33,398][0m Trial 962 finished with value: 1785.0869859146915 and parameters: {'depth': 8, 'learning_rate': 0.0020519622026977983, 'iterations': 1003, 'l2_leaf_reg': 2.4239936738521035e-08, 'border_count': 24, 'bagging_temperature': 0.030908156841444934, 'random_strength': 4.572226406013603, 'grow_policy': 'Depthwise', 'min_data_in_leaf': 285}. Best is trial 568 with value: 1659.4433932934307.[0m
[32m[I 2024-10-13 13:23:35,325][0m Trial 963 finished with value: 2498.7423416536135 and parameters: {'depth': 7, 'learning_rate': 0.07615076891589452, 'iterations': 1895, 'l2_leaf_reg': 3.6657654136158725e-08, 'border_count': 100, 'bagging_temperature': 0.0575941678624908, 'random_strength': 7.2290591781160325, 'grow_policy': 'Depthwise', 'min_data_in_leaf': 808}. Best is trial 568 with value: 1659.4433932934307.[0m
