[32m[I 2024-10-13 12:57:34,815][0m Trial 557 finished with value: 1998.6262770507317 and parameters: {'depth': 10, 'learning_rate': 0.0014373445839311317, 'iterations': 2060, 'l2_leaf_reg': 2.8664528815035734e-07, 'border_count': 57, 'bagging_temperature': 0.733511778372133, 'random_strength': 4.644575076062739, 'grow_policy': 'Depthwise', 'min_data_in_leaf': 76}. Best is trial 545 with value: 1670.5692329857386.[0m
[32m[I 2024-10-13 12:57:37,072][0m Trial 558 finished with value: 1928.2771158908167 and parameters: {'depth': 11, 'learning_rate': 0.000952153410184886, 'iterations': 2203, 'l2_leaf_reg': 1.0295354998761088e-07, 'border_count': 18, 'bagging_temperature': 0.0360691066244536, 'random_strength': 4.774104160643776, 'grow_policy': 'Lossguide', 'min_data_in_leaf': 123, 'max_leaves': 138}. Best is trial 545 with value: 1670.5692329857386.[0m
[32m[I 2024-10-13 12:57:40,549][0m Trial 559 finished with value: 1879.0888629721712 and parameters: {'depth': 8, 'learning_rate': 0.001256228063991363, 'iterations': 2109, 'l2_leaf_reg': 1.6443849972493743e-08, 'border_count': 37, 'bagging_temperature': 0.020415474987499585, 'random_strength': 5.8308721497005, 'grow_policy': 'Depthwise', 'min_data_in_leaf': 41}. Best is trial 545 with value: 1670.5692329857386.[0m
[32m[I 2024-10-13 12:57:42,995][0m Trial 560 finished with value: 1762.305645510863 and parameters: {'depth': 10, 'learning_rate': 0.00172785713333478, 'iterations': 2408, 'l2_leaf_reg': 4.794918524311371e-07, 'border_count': 31, 'bagging_temperature': 0.055984127434913836, 'random_strength': 1.2577908759329226, 'grow_policy': 'Depthwise', 'min_data_in_leaf': 400}. Best is trial 545 with value: 1670.5692329857386.[0m
[32m[I 2024-10-13 12:57:45,246][0m Trial 561 finished with value: 1720.3509196344073 and parameters: {'depth': 9, 'learning_rate': 0.0010554850366065874, 'iterations': 2291, 'l2_leaf_reg': 1.738801588042836e-07, 'border_count': 27, 'bagging_temperature': 0.016154794563451487, 'random_strength': 6.239359913116191, 'grow_policy': 'Depthwise', 'min_data_in_leaf': 106}. Best is trial 545 with value: 1670.5692329857386.[0m
[32m[I 2024-10-13 12:57:47,854][0m Trial 562 finished with value: 1797.6455915128718 and parameters: {'depth': 8, 'learning_rate': 0.0007158304104574934, 'iterations': 2768, 'l2_leaf_reg': 3.22675132129986e-08, 'border_count': 23, 'bagging_temperature': 0.070276839989108, 'random_strength': 3.7238571274068235, 'grow_policy': 'Lossguide', 'min_data_in_leaf': 369, 'max_leaves': 149}. Best is trial 545 with value: 1670.5692329857386.[0m
[32m[I 2024-10-13 12:57:49,772][0m Trial 563 finished with value: 1734.9844092323474 and parameters: {'depth': 7, 'learning_rate': 0.002684399018307809, 'iterations': 1830, 'l2_leaf_reg': 5.3615594573750556e-08, 'border_count': 6, 'bagging_temperature': 0.11552391609359848, 'random_strength': 8.322523399202513, 'grow_policy': 'Depthwise', 'min_data_in_leaf': 221}. Best is trial 545 with value: 1670.5692329857386.[0m
[32m[I 2024-10-13 12:57:52,613][0m Trial 564 finished with value: 2005.444074196794 and parameters: {'depth': 9, 'learning_rate': 0.0014442909006089244, 'iterations': 2850, 'l2_leaf_reg': 1.1789374736189492e-07, 'border_count': 13, 'bagging_temperature': 0.03952760522229718, 'random_strength': 6.03943070346916, 'grow_policy': 'Depthwise', 'min_data_in_leaf': 139}. Best is trial 545 with value: 1670.5692329857386.[0m
[32m[I 2024-10-13 12:57:55,981][0m Trial 565 finished with value: 1922.4564618827364 and parameters: {'depth': 11, 'learning_rate': 0.0020627524709374407, 'iterations': 2643, 'l2_leaf_reg': 9.017132571705049e-07, 'border_count': 32, 'bagging_temperature': 0.09507098389825502, 'random_strength': 3.943927429466332, 'grow_policy': 'Depthwise', 'min_data_in_leaf': 88}. Best is trial 545 with value: 1670.5692329857386.[0m
[32m[I 2024-10-13 12:58:02,271][0m Trial 566 finished with value: 1706.1758507824038 and parameters: {'depth': 14, 'learning_rate': 0.0011708482719836595, 'iterations': 1999, 'l2_leaf_reg': 7.366715453455364e-08, 'border_count': 18, 'bagging_temperature': 0.01583336121189718, 'random_strength': 5.312817283856782, 'grow_policy': 'Depthwise', 'min_data_in_leaf': 10}. Best is trial 545 with value: 1670.5692329857386.[0m
[32m[I 2024-10-13 12:58:21,557][0m Trial 567 finished with value: 1802.4882109367313 and parameters: {'depth': 15, 'learning_rate': 0.0008393376582567744, 'iterations': 2024, 'l2_leaf_reg': 2.7413394954158142e-08, 'border_count': 20, 'bagging_temperature': 0.019024235528387334, 'random_strength': 5.077508384396264, 'grow_policy': 'Lossguide', 'min_data_in_leaf': 2, 'max_leaves': 60}. Best is trial 545 with value: 1670.5692329857386.[0m
[32m[I 2024-10-13 12:58:27,614][0m Trial 568 finished with value: 1659.4433932934307 and parameters: {'depth': 12, 'learning_rate': 0.0005042075029092138, 'iterations': 1991, 'l2_leaf_reg': 2.3630877708007642e-07, 'border_count': 24, 'bagging_temperature': 0.00105956666927301, 'random_strength': 5.235525610482856, 'grow_policy': 'Depthwise', 'min_data_in_leaf': 9}. Best is trial 568 with value: 1659.4433932934307.[0m
[32m[I 2024-10-13 12:58:32,706][0m Trial 569 finished with value: 1793.3567254639531 and parameters: {'depth': 15, 'learning_rate': 0.0011253039730876153, 'iterations': 1987, 'l2_leaf_reg': 3.798337893164895e-07, 'border_count': 26, 'bagging_temperature': 0.0009272367403849527, 'random_strength': 5.385454778959584, 'grow_policy': 'Depthwise', 'min_data_in_leaf': 18}. Best is trial 568 with value: 1659.4433932934307.[0m
[32m[I 2024-10-13 12:58:43,435][0m Trial 570 finished with value: 2054.172738064466 and parameters: {'depth': 14, 'learning_rate': 0.0006977498681987217, 'iterations': 2037, 'l2_leaf_reg': 2.4244691419187237e-07, 'border_count': 25, 'bagging_temperature': 0.0026839879215095966, 'random_strength': 5.198443627657934, 'grow_policy': 'Depthwise', 'min_data_in_leaf': 2}. Best is trial 568 with value: 1659.4433932934307.[0m
[32m[I 2024-10-13 12:58:49,082][0m Trial 571 finished with value: 1797.3246561866536 and parameters: {'depth': 14, 'learning_rate': 0.0009726918836619038, 'iterations': 1980, 'l2_leaf_reg': 4.5740929296409766e-07, 'border_count': 30, 'bagging_temperature': 0.38049456183564206, 'random_strength': 4.957809463570473, 'grow_policy': 'Depthwise', 'min_data_in_leaf': 12}. Best is trial 568 with value: 1659.4433932934307.[0m
[32m[I 2024-10-13 13:00:06,983][0m Trial 572 finished with value: 2548.243242475603 and parameters: {'depth': 13, 'learning_rate': 0.00030446791569527655, 'iterations': 1923, 'l2_leaf_reg': 2.3278028390807953e-07, 'border_count': 22, 'bagging_temperature': 0.001615150401874918, 'random_strength': 5.266550161998417, 'grow_policy': 'SymmetricTree', 'min_data_in_leaf': 24}. Best is trial 568 with value: 1659.4433932934307.[0m
[32m[I 2024-10-13 13:00:15,800][0m Trial 573 finished with value: 1939.7264288132112 and parameters: {'depth': 13, 'learning_rate': 0.0003441089515782779, 'iterations': 2050, 'l2_leaf_reg': 3.1265929631599055e-07, 'border_count': 34, 'bagging_temperature': 4.54812081125857e-05, 'random_strength': 5.264288005725093, 'grow_policy': 'Lossguide', 'min_data_in_leaf': 8, 'max_leaves': 200}. Best is trial 568 with value: 1659.4433932934307.[0m
[32m[I 2024-10-13 13:00:21,060][0m Trial 574 finished with value: 1809.188056434259 and parameters: {'depth': 12, 'learning_rate': 0.001216772473925684, 'iterations': 2071, 'l2_leaf_reg': 1.4120567193324852e-06, 'border_count': 27, 'bagging_temperature': 0.022737111224438725, 'random_strength': 5.542354130622565, 'grow_policy': 'Depthwise', 'min_data_in_leaf': 17}. Best is trial 568 with value: 1659.4433932934307.[0m
[32m[I 2024-10-13 13:00:30,878][0m Trial 575 finished with value: 1763.185556263069 and parameters: {'depth': 14, 'learning_rate': 0.000665282523299737, 'iterations': 2103, 'l2_leaf_reg': 1.7797091757271001e-07, 'border_count': 77, 'bagging_temperature': 0.01895156779579817, 'random_strength': 4.839356691315803, 'grow_policy': 'Depthwise', 'min_data_in_leaf': 3}. Best is trial 568 with value: 1659.4433932934307.[0m
[32m[I 2024-10-13 13:00:35,606][0m Trial 576 finished with value: 1974.3887640592952 and parameters: {'depth': 13, 'learning_rate': 0.0004916612703016663, 'iterations': 1970, 'l2_leaf_reg': 1.0197006800747044e-08, 'border_count': 17, 'bagging_temperature': 0.031104830453630987, 'random_strength': 5.664871001178957, 'grow_policy': 'Depthwise', 'min_data_in_leaf': 14}. Best is trial 568 with value: 1659.4433932934307.[0m
[32m[I 2024-10-13 13:00:38,190][0m Trial 577 finished with value: 2022.6855126046178 and parameters: {'depth': 12, 'learning_rate': 0.000398083242457189, 'iterations': 1923, 'l2_leaf_reg': 1.377469432003637e-07, 'border_count': 23, 'bagging_temperature': 0.015867067533710488, 'random_strength': 4.937686325952831, 'grow_policy': 'Lossguide', 'min_data_in_leaf': 48, 'max_leaves': 40}. Best is trial 568 with value: 1659.4433932934307.[0m
[32m[I 2024-10-13 13:00:47,002][0m Trial 578 finished with value: 1910.6988904583357 and parameters: {'depth': 13, 'learning_rate': 0.0006151544616093661, 'iterations': 2012, 'l2_leaf_reg': 7.992421151617295e-07, 'border_count': 30, 'bagging_temperature': 0.03297744125987821, 'random_strength': 5.189543379041191, 'grow_policy': 'Depthwise', 'min_data_in_leaf': 3}. Best is trial 568 with value: 1659.4433932934307.[0m
[32m[I 2024-10-13 13:00:49,890][0m Trial 579 finished with value: 2332.4596270823145 and parameters: {'depth': 14, 'learning_rate': 0.00023389239207908584, 'iterations': 2100, 'l2_leaf_reg': 4.2722199325040556e-07, 'border_count': 19, 'bagging_temperature': 0.017131021109597643, 'random_strength': 5.447907395131173, 'grow_policy': 'Depthwise', 'min_data_in_leaf': 44}. Best is trial 568 with value: 1659.4433932934307.[0m
[32m[I 2024-10-13 13:00:53,961][0m Trial 580 finished with value: 1919.4437771847226 and parameters: {'depth': 13, 'learning_rate': 0.0010574266680453404, 'iterations': 2165, 'l2_leaf_reg': 2.1608250772050806e-07, 'border_count': 40, 'bagging_temperature': 0.04155043541016456, 'random_strength': 4.351832580146889, 'grow_policy': 'Depthwise', 'min_data_in_leaf': 30}. Best is trial 568 with value: 1659.4433932934307.[0m
[32m[I 2024-10-13 13:00:56,016][0m Trial 581 finished with value: 2017.3748587859093 and parameters: {'depth': 12, 'learning_rate': 0.0005753939858193479, 'iterations': 2025, 'l2_leaf_reg': 0.00046224163719386647, 'border_count': 36, 'bagging_temperature': 0.35951569507509346, 'random_strength': 5.4173246684480985, 'grow_policy': 'Lossguide', 'min_data_in_leaf': 320, 'max_leaves': 93}. Best is trial 568 with value: 1659.4433932934307.[0m
[32m[I 2024-10-13 13:00:58,044][0m Trial 582 finished with value: 1718.383185122001 and parameters: {'depth': 12, 'learning_rate': 0.0012514931488095803, 'iterations': 1933, 'l2_leaf_reg': 1.4606474164495962e-07, 'border_count': 26, 'bagging_temperature': 0.0006884297881567941, 'random_strength': 5.752758133755199, 'grow_policy': 'Depthwise', 'min_data_in_leaf': 203}. Best is trial 568 with value: 1659.4433932934307.[0m
[32m[I 2024-10-13 13:01:00,337][0m Trial 583 finished with value: 2179.384589905361 and parameters: {'depth': 14, 'learning_rate': 0.00042339950633544984, 'iterations': 2125, 'l2_leaf_reg': 8.889709401298188e-08, 'border_count': 30, 'bagging_temperature': 0.03129108221709645, 'random_strength': 4.452897561791643, 'grow_policy': 'Depthwise', 'min_data_in_leaf': 176}. Best is trial 568 with value: 1659.4433932934307.[0m
[32m[I 2024-10-13 13:01:02,734][0m Trial 584 finished with value: 1941.3244193575536 and parameters: {'depth': 12, 'learning_rate': 0.0009400233626225904, 'iterations': 2246, 'l2_leaf_reg': 0.054065322768753935, 'border_count': 22, 'bagging_temperature': 0.018634071008269283, 'random_strength': 5.107714827309604, 'grow_policy': 'Depthwise', 'min_data_in_leaf': 349}. Best is trial 568 with value: 1659.4433932934307.[0m
[32m[I 2024-10-13 13:01:11,771][0m Trial 585 finished with value: 1995.8642100395182 and parameters: {'depth': 10, 'learning_rate': 0.0013229701608231826, 'iterations': 1997, 'l2_leaf_reg': 4.398442385144129e-08, 'border_count': 18, 'bagging_temperature': 0.04457893646083258, 'random_strength': 5.520690215262534, 'grow_policy': 'Depthwise', 'min_data_in_leaf': 1}. Best is trial 568 with value: 1659.4433932934307.[0m
[32m[I 2024-10-13 13:01:15,378][0m Trial 586 finished with value: 1758.0116122953234 and parameters: {'depth': 4, 'learning_rate': 0.0008179589044068215, 'iterations': 2367, 'l2_leaf_reg': 3.054519839407766e-07, 'border_count': 26, 'bagging_temperature': 0.0330671547219093, 'random_strength': 5.338263770273453, 'grow_policy': 'Lossguide', 'min_data_in_leaf': 31, 'max_leaves': 188}. Best is trial 568 with value: 1659.4433932934307.[0m
[32m[I 2024-10-13 13:01:16,777][0m Trial 587 finished with value: 2264.3107763653006 and parameters: {'depth': 15, 'learning_rate': 0.16397512805841394, 'iterations': 948, 'l2_leaf_reg': 1.1329482826254373e-07, 'border_count': 34, 'bagging_temperature': 0.000568788479050343, 'random_strength': 5.026581345607869, 'grow_policy': 'Depthwise', 'min_data_in_leaf': 179}. Best is trial 568 with value: 1659.4433932934307.[0m
[32m[I 2024-10-13 13:01:18,951][0m Trial 588 finished with value: 1740.4330041310477 and parameters: {'depth': 10, 'learning_rate': 0.0012373127111477552, 'iterations': 2181, 'l2_leaf_reg': 5.952610547848446e-07, 'border_count': 23, 'bagging_temperature': 0.01902028566069819, 'random_strength': 4.761643182004948, 'grow_policy': 'Depthwise', 'min_data_in_leaf': 386}. Best is trial 568 with value: 1659.4433932934307.[0m
[32m[I 2024-10-13 13:01:21,140][0m Trial 589 finished with value: 1745.2072432805085 and parameters: {'depth': 15, 'learning_rate': 0.001112696938008838, 'iterations': 1900, 'l2_leaf_reg': 0.0024562029032069916, 'border_count': 30, 'bagging_temperature': 0.04926653491253711, 'random_strength': 5.670664764363666, 'grow_policy': 'Depthwise', 'min_data_in_leaf': 237}. Best is trial 568 with value: 1659.4433932934307.[0m
[32m[I 2024-10-13 13:02:24,843][0m Trial 590 finished with value: 2080.7223541949475 and parameters: {'depth': 12, 'learning_rate': 0.0014434784201966865, 'iterations': 1079, 'l2_leaf_reg': 1.9969986445917768e-07, 'border_count': 215, 'bagging_temperature': 0.016941574479913925, 'random_strength': 6.086712107300839, 'grow_policy': 'SymmetricTree', 'min_data_in_leaf': 418}. Best is trial 568 with value: 1659.4433932934307.[0m
[32m[I 2024-10-13 13:02:26,809][0m Trial 591 finished with value: 2557.452721629196 and parameters: {'depth': 10, 'learning_rate': 0.00022536460248520773, 'iterations': 2072, 'l2_leaf_reg': 2.3698308852791336e-08, 'border_count': 39, 'bagging_temperature': 0.05042681791774472, 'random_strength': 8.623356946348705, 'grow_policy': 'Lossguide', 'min_data_in_leaf': 458, 'max_leaves': 77}. Best is trial 568 with value: 1659.4433932934307.[0m
[32m[I 2024-10-13 13:02:29,021][0m Trial 592 finished with value: 1931.6125829146235 and parameters: {'depth': 11, 'learning_rate': 0.0010078427340914262, 'iterations': 2278, 'l2_leaf_reg': 6.262763158662259e-08, 'border_count': 16, 'bagging_temperature': 0.02584618179438111, 'random_strength': 5.948815239394053, 'grow_policy': 'Depthwise', 'min_data_in_leaf': 163}. Best is trial 568 with value: 1659.4433932934307.[0m
[32m[I 2024-10-13 13:02:31,206][0m Trial 593 finished with value: 1723.2343399738324 and parameters: {'depth': 8, 'learning_rate': 0.001531244825914837, 'iterations': 2140, 'l2_leaf_reg': 3.507226066139687e-08, 'border_count': 27, 'bagging_temperature': 0.0006338817903085714, 'random_strength': 6.502644883099626, 'grow_policy': 'Depthwise', 'min_data_in_leaf': 359}. Best is trial 568 with value: 1659.4433932934307.[0m
[32m[I 2024-10-13 13:02:33,272][0m Trial 594 finished with value: 2108.790005694278 and parameters: {'depth': 6, 'learning_rate': 0.0005132859229177202, 'iterations': 1958, 'l2_leaf_reg': 1.687279658094823e-08, 'border_count': 33, 'bagging_temperature': 0.03707679509917218, 'random_strength': 5.715459100950733, 'grow_policy': 'Depthwise', 'min_data_in_leaf': 330}. Best is trial 568 with value: 1659.4433932934307.[0m
[32m[I 2024-10-13 13:02:35,693][0m Trial 595 finished with value: 1949.3247059056978 and parameters: {'depth': 13, 'learning_rate': 0.0012668485723360233, 'iterations': 2595, 'l2_leaf_reg': 9.838948584660262e-08, 'border_count': 19, 'bagging_temperature': 0.05745093412980773, 'random_strength': 5.42705146620499, 'grow_policy': 'Lossguide', 'min_data_in_leaf': 148, 'max_leaves': 208}. Best is trial 568 with value: 1659.4433932934307.[0m
[32m[I 2024-10-13 13:02:37,928][0m Trial 596 finished with value: 1804.7273750339434 and parameters: {'depth': 8, 'learning_rate': 0.0008803184160670172, 'iterations': 2204, 'l2_leaf_reg': 4.7666547564594784e-08, 'border_count': 24, 'bagging_temperature': 0.0003846030787559339, 'random_strength': 4.9241907579131405, 'grow_policy': 'Depthwise', 'min_data_in_leaf': 189}. Best is trial 568 with value: 1659.4433932934307.[0m
[32m[I 2024-10-13 13:02:40,313][0m Trial 597 finished with value: 1994.1100148321595 and parameters: {'depth': 11, 'learning_rate': 0.001104690116574759, 'iterations': 2349, 'l2_leaf_reg': 3.1568551856948824e-07, 'border_count': 247, 'bagging_temperature': 0.03699282134456783, 'random_strength': 5.324094976763956, 'grow_policy': 'Depthwise', 'min_data_in_leaf': 140}. Best is trial 568 with value: 1659.4433932934307.[0m
[32m[I 2024-10-13 13:02:42,330][0m Trial 598 finished with value: 2286.326296645281 and parameters: {'depth': 7, 'learning_rate': 0.06525861818794931, 'iterations': 2020, 'l2_leaf_reg': 1.5782855654448208e-07, 'border_count': 43, 'bagging_temperature': 0.021839309906372978, 'random_strength': 5.125042838395482, 'grow_policy': 'Depthwise', 'min_data_in_leaf': 167}. Best is trial 568 with value: 1659.4433932934307.[0m
[32m[I 2024-10-13 13:02:45,890][0m Trial 599 finished with value: 1978.2583960657182 and parameters: {'depth': 10, 'learning_rate': 0.0014063982739748258, 'iterations': 2076, 'l2_leaf_reg': 6.9128208329551e-08, 'border_count': 36, 'bagging_temperature': 0.06016863437828863, 'random_strength': 6.711088425220523, 'grow_policy': 'Depthwise', 'min_data_in_leaf': 36}. Best is trial 568 with value: 1659.4433932934307.[0m
[32m[I 2024-10-13 13:02:46,953][0m Trial 600 finished with value: 2164.3567295647777 and parameters: {'depth': 10, 'learning_rate': 0.0015519907120361753, 'iterations': 653, 'l2_leaf_reg': 0.0008413578969225452, 'border_count': 21, 'bagging_temperature': 0.018010194019056413, 'random_strength': 4.657469480716552, 'grow_policy': 'Lossguide', 'min_data_in_leaf': 125, 'max_leaves': 163}. Best is trial 568 with value: 1659.4433932934307.[0m
[32m[I 2024-10-13 13:02:49,389][0m Trial 601 finished with value: 2168.795469729752 and parameters: {'depth': 9, 'learning_rate': 0.0004856274359236889, 'iterations': 1882, 'l2_leaf_reg': 2.231982388725541e-07, 'border_count': 27, 'bagging_temperature': 0.04424577041521592, 'random_strength': 5.88418327952466, 'grow_policy': 'Depthwise', 'min_data_in_leaf': 216}. Best is trial 568 with value: 1659.4433932934307.[0m
[32m[I 2024-10-13 13:02:54,880][0m Trial 602 finished with value: 2202.4928186986585 and parameters: {'depth': 12, 'learning_rate': 0.00034759085410548745, 'iterations': 2715, 'l2_leaf_reg': 1.2138832047434022e-07, 'border_count': 119, 'bagging_temperature': 0.01754274808153966, 'random_strength': 6.170335495969462, 'grow_policy': 'Depthwise', 'min_data_in_leaf': 512}. Best is trial 568 with value: 1659.4433932934307.[0m
[32m[I 2024-10-13 13:02:55,732][0m Trial 603 finished with value: 3034.187673578405 and parameters: {'depth': 9, 'learning_rate': 0.0012002891035322555, 'iterations': 115, 'l2_leaf_reg': 2.63881168889418e-08, 'border_count': 14, 'bagging_temperature': 0.762891649487192, 'random_strength': 5.545353837319878, 'grow_policy': 'Depthwise', 'min_data_in_leaf': 391}. Best is trial 568 with value: 1659.4433932934307.[0m
[32m[I 2024-10-13 13:03:00,458][0m Trial 604 finished with value: 1769.4695057371473 and parameters: {'depth': 7, 'learning_rate': 0.0007789876964883238, 'iterations': 2520, 'l2_leaf_reg': 0.10884825739768482, 'border_count': 30, 'bagging_temperature': 0.0006219257603836195, 'random_strength': 8.161927795543104, 'grow_policy': 'Lossguide', 'min_data_in_leaf': 150, 'max_leaves': 177}. Best is trial 568 with value: 1659.4433932934307.[0m
[32m[I 2024-10-13 13:03:07,280][0m Trial 605 finished with value: 2028.8306678014303 and parameters: {'depth': 14, 'learning_rate': 0.0010009844306195427, 'iterations': 2236, 'l2_leaf_reg': 4.956358454629259e-08, 'border_count': 19, 'bagging_temperature': 0.06692305477439095, 'random_strength': 8.390230999266505, 'grow_policy': 'Depthwise', 'min_data_in_leaf': 30}. Best is trial 568 with value: 1659.4433932934307.[0m
[32m[I 2024-10-13 13:03:12,651][0m Trial 606 finished with value: 1807.6350313231424 and parameters: {'depth': 11, 'learning_rate': 0.0014087667826947626, 'iterations': 2316, 'l2_leaf_reg': 4.900498111799252e-07, 'border_count': 35, 'bagging_temperature': 0.611673683177517, 'random_strength': 6.822823635704875, 'grow_policy': 'Depthwise', 'min_data_in_leaf': 51}. Best is trial 568 with value: 1659.4433932934307.[0m
[32m[I 2024-10-13 13:03:13,977][0m Trial 607 finished with value: 2260.943238527888 and parameters: {'depth': 9, 'learning_rate': 0.001596230369024015, 'iterations': 493, 'l2_leaf_reg': 8.047849474805962e-08, 'border_count': 25, 'bagging_temperature': 0.32258752635739824, 'random_strength': 6.321433520687667, 'grow_policy': 'Depthwise', 'min_data_in_leaf': 135}. Best is trial 568 with value: 1659.4433932934307.[0m
