[32m[I 2024-10-13 12:55:10,952][0m Trial 506 finished with value: 1747.2227700781991 and parameters: {'depth': 8, 'learning_rate': 0.0014106231144434952, 'iterations': 1034, 'l2_leaf_reg': 1.79263573374346e-07, 'border_count': 88, 'bagging_temperature': 0.06856870410735218, 'random_strength': 7.18140495117222, 'grow_policy': 'Depthwise', 'min_data_in_leaf': 91}. Best is trial 249 with value: 1695.0689015039372.[0m
[32m[I 2024-10-13 12:55:12,932][0m Trial 507 finished with value: 1733.3368710376683 and parameters: {'depth': 9, 'learning_rate': 0.001857527667720999, 'iterations': 1901, 'l2_leaf_reg': 2.9026625413108436e-08, 'border_count': 36, 'bagging_temperature': 0.001156822788229931, 'random_strength': 8.242684805106975, 'grow_policy': 'Lossguide', 'min_data_in_leaf': 148, 'max_leaves': 218}. Best is trial 249 with value: 1695.0689015039372.[0m
[32m[I 2024-10-13 12:55:14,684][0m Trial 508 finished with value: 1777.3798467138388 and parameters: {'depth': 9, 'learning_rate': 0.0011886997893793075, 'iterations': 1611, 'l2_leaf_reg': 0.00021529087642045474, 'border_count': 26, 'bagging_temperature': 0.03924109044390662, 'random_strength': 7.52281081415392, 'grow_policy': 'Depthwise', 'min_data_in_leaf': 116}. Best is trial 249 with value: 1695.0689015039372.[0m
[32m[I 2024-10-13 12:55:17,953][0m Trial 509 finished with value: 2055.6259444989355 and parameters: {'depth': 9, 'learning_rate': 0.000987108038771294, 'iterations': 2661, 'l2_leaf_reg': 7.5317389136182e-08, 'border_count': 16, 'bagging_temperature': 0.021098856268476258, 'random_strength': 8.834531158757976, 'grow_policy': 'Depthwise', 'min_data_in_leaf': 74}. Best is trial 249 with value: 1695.0689015039372.[0m
[32m[I 2024-10-13 12:55:20,150][0m Trial 510 finished with value: 1740.1507430541437 and parameters: {'depth': 12, 'learning_rate': 0.0015269354575502608, 'iterations': 2082, 'l2_leaf_reg': 4.953904995689387e-08, 'border_count': 40, 'bagging_temperature': 0.06245660247339074, 'random_strength': 8.55307925729188, 'grow_policy': 'Depthwise', 'min_data_in_leaf': 115}. Best is trial 249 with value: 1695.0689015039372.[0m
[32m[I 2024-10-13 12:55:22,177][0m Trial 511 finished with value: 2833.8274819538283 and parameters: {'depth': 8, 'learning_rate': 0.0001342505068755914, 'iterations': 1976, 'l2_leaf_reg': 3.9807678766946903e-07, 'border_count': 11, 'bagging_temperature': 0.09160157240628677, 'random_strength': 7.7500367629807165, 'grow_policy': 'Lossguide', 'min_data_in_leaf': 175, 'max_leaves': 89}. Best is trial 249 with value: 1695.0689015039372.[0m
[32m[I 2024-10-13 12:55:24,481][0m Trial 512 finished with value: 2153.392561471314 and parameters: {'depth': 9, 'learning_rate': 0.0038928870630678077, 'iterations': 2256, 'l2_leaf_reg': 1.1500509582534684e-07, 'border_count': 21, 'bagging_temperature': 0.03235666815341384, 'random_strength': 7.350642138602864, 'grow_policy': 'Depthwise', 'min_data_in_leaf': 142}. Best is trial 249 with value: 1695.0689015039372.[0m
[32m[I 2024-10-13 12:55:26,498][0m Trial 513 finished with value: 1746.8860865774898 and parameters: {'depth': 11, 'learning_rate': 0.0012119646800052657, 'iterations': 1740, 'l2_leaf_reg': 9.006162908513418e-07, 'border_count': 30, 'bagging_temperature': 0.04923585659062102, 'random_strength': 5.198828496805966, 'grow_policy': 'Depthwise', 'min_data_in_leaf': 104}. Best is trial 249 with value: 1695.0689015039372.[0m
[32m[I 2024-10-13 12:55:29,323][0m Trial 514 finished with value: 1708.5675479508575 and parameters: {'depth': 9, 'learning_rate': 0.0008688115112122709, 'iterations': 2777, 'l2_leaf_reg': 4.079827014895049e-08, 'border_count': 25, 'bagging_temperature': 0.0007502728482232748, 'random_strength': 7.6127715278759265, 'grow_policy': 'Depthwise', 'min_data_in_leaf': 128}. Best is trial 249 with value: 1695.0689015039372.[0m
[32m[I 2024-10-13 12:55:32,176][0m Trial 515 finished with value: 1923.4990495637037 and parameters: {'depth': 9, 'learning_rate': 0.0007707423560417133, 'iterations': 2881, 'l2_leaf_reg': 1.8162474207904964e-08, 'border_count': 18, 'bagging_temperature': 0.0008408853508169861, 'random_strength': 7.574025201412481, 'grow_policy': 'Depthwise', 'min_data_in_leaf': 158}. Best is trial 249 with value: 1695.0689015039372.[0m
[32m[I 2024-10-13 12:55:35,117][0m Trial 516 finished with value: 1720.1111176495435 and parameters: {'depth': 9, 'learning_rate': 0.0008208235470267923, 'iterations': 2918, 'l2_leaf_reg': 3.73451704638019e-08, 'border_count': 26, 'bagging_temperature': 0.00048369708646209264, 'random_strength': 7.224026195801116, 'grow_policy': 'Depthwise', 'min_data_in_leaf': 185}. Best is trial 249 with value: 1695.0689015039372.[0m
[32m[I 2024-10-13 12:55:37,879][0m Trial 517 finished with value: 1740.0884889447614 and parameters: {'depth': 9, 'learning_rate': 0.0009810295706612427, 'iterations': 2783, 'l2_leaf_reg': 3.12660332792468e-08, 'border_count': 23, 'bagging_temperature': 0.018824610412295193, 'random_strength': 7.472883405743303, 'grow_policy': 'Depthwise', 'min_data_in_leaf': 138}. Best is trial 249 with value: 1695.0689015039372.[0m
[32m[I 2024-10-13 12:55:40,088][0m Trial 518 finished with value: 1972.9640410428826 and parameters: {'depth': 9, 'learning_rate': 0.0007149712813820683, 'iterations': 2150, 'l2_leaf_reg': 1.9136139555570903e-07, 'border_count': 10, 'bagging_temperature': 0.01976911201651729, 'random_strength': 7.0298139882277955, 'grow_policy': 'Depthwise', 'min_data_in_leaf': 212}. Best is trial 249 with value: 1695.0689015039372.[0m
[32m[I 2024-10-13 12:55:43,117][0m Trial 519 finished with value: 1997.698351548173 and parameters: {'depth': 9, 'learning_rate': 0.0009424294201356627, 'iterations': 2787, 'l2_leaf_reg': 7.851220089282453e-08, 'border_count': 18, 'bagging_temperature': 0.016770524748347684, 'random_strength': 7.751036324186539, 'grow_policy': 'Depthwise', 'min_data_in_leaf': 92}. Best is trial 249 with value: 1695.0689015039372.[0m
[32m[I 2024-10-13 12:55:45,719][0m Trial 520 finished with value: 2039.7471689575561 and parameters: {'depth': 3, 'learning_rate': 0.0004232192773347108, 'iterations': 2693, 'l2_leaf_reg': 5.672865320972122e-07, 'border_count': 25, 'bagging_temperature': 0.027967735724428136, 'random_strength': 7.264815321554819, 'grow_policy': 'Depthwise', 'min_data_in_leaf': 478}. Best is trial 249 with value: 1695.0689015039372.[0m
[32m[I 2024-10-13 12:55:48,290][0m Trial 521 finished with value: 1967.060688802808 and parameters: {'depth': 9, 'learning_rate': 0.0008601149732774146, 'iterations': 2627, 'l2_leaf_reg': 3.9280599943379816e-08, 'border_count': 130, 'bagging_temperature': 0.023734941704742395, 'random_strength': 7.615962943368843, 'grow_policy': 'Depthwise', 'min_data_in_leaf': 162}. Best is trial 249 with value: 1695.0689015039372.[0m
[32m[I 2024-10-13 12:55:50,893][0m Trial 522 finished with value: 2008.5129003105865 and parameters: {'depth': 9, 'learning_rate': 0.0005577136933330982, 'iterations': 2716, 'l2_leaf_reg': 1.434661972306074e-07, 'border_count': 14, 'bagging_temperature': 2.110588108235334e-05, 'random_strength': 5.473255368968918, 'grow_policy': 'Depthwise', 'min_data_in_leaf': 129}. Best is trial 249 with value: 1695.0689015039372.[0m
[32m[I 2024-10-13 12:55:52,159][0m Trial 523 finished with value: 2439.9963918637836 and parameters: {'depth': 11, 'learning_rate': 0.0006405274166827906, 'iterations': 904, 'l2_leaf_reg': 0.004413673804512099, 'border_count': 31, 'bagging_temperature': 0.06207891811242254, 'random_strength': 1.6160143038602248, 'grow_policy': 'Depthwise', 'min_data_in_leaf': 341}. Best is trial 249 with value: 1695.0689015039372.[0m
[32m[I 2024-10-13 12:55:54,853][0m Trial 524 finished with value: 1949.4534030732284 and parameters: {'depth': 9, 'learning_rate': 0.0010409283516372766, 'iterations': 2754, 'l2_leaf_reg': 1.4773567695165023e-08, 'border_count': 22, 'bagging_temperature': 0.03927039050657985, 'random_strength': 7.041363409868692, 'grow_policy': 'Depthwise', 'min_data_in_leaf': 135}. Best is trial 249 with value: 1695.0689015039372.[0m
[32m[I 2024-10-13 12:55:58,034][0m Trial 525 finished with value: 1720.077882354897 and parameters: {'depth': 9, 'learning_rate': 0.001181600735856797, 'iterations': 2949, 'l2_leaf_reg': 2.7064007909961337e-07, 'border_count': 8, 'bagging_temperature': 0.5679796760116752, 'random_strength': 7.414859805195693, 'grow_policy': 'Depthwise', 'min_data_in_leaf': 81}. Best is trial 249 with value: 1695.0689015039372.[0m
[32m[I 2024-10-13 12:56:00,259][0m Trial 526 finished with value: 1767.0411372440453 and parameters: {'depth': 6, 'learning_rate': 0.002046194438928727, 'iterations': 2217, 'l2_leaf_reg': 0.0011722179671338337, 'border_count': 28, 'bagging_temperature': 0.079044783445186, 'random_strength': 5.790504541883212, 'grow_policy': 'Depthwise', 'min_data_in_leaf': 440}. Best is trial 249 with value: 1695.0689015039372.[0m
[32m[I 2024-10-13 12:56:02,141][0m Trial 527 finished with value: 1930.807269840738 and parameters: {'depth': 9, 'learning_rate': 0.0013021995363945453, 'iterations': 1673, 'l2_leaf_reg': 2.529292781347061e-08, 'border_count': 17, 'bagging_temperature': 0.016919653859005433, 'random_strength': 7.807048129324984, 'grow_policy': 'Depthwise', 'min_data_in_leaf': 110}. Best is trial 249 with value: 1695.0689015039372.[0m
[32m[I 2024-10-13 12:56:04,363][0m Trial 528 finished with value: 1785.611277255465 and parameters: {'depth': 9, 'learning_rate': 0.0008994071734575693, 'iterations': 2293, 'l2_leaf_reg': 5.3954584067538273e-08, 'border_count': 23, 'bagging_temperature': 0.00020486866188601624, 'random_strength': 7.585957552431573, 'grow_policy': 'Depthwise', 'min_data_in_leaf': 155}. Best is trial 249 with value: 1695.0689015039372.[0m
[32m[I 2024-10-13 12:56:07,138][0m Trial 529 finished with value: 1790.6252976626995 and parameters: {'depth': 10, 'learning_rate': 0.0016679187614510433, 'iterations': 2830, 'l2_leaf_reg': 9.548152716750916e-08, 'border_count': 34, 'bagging_temperature': 0.47859569295128535, 'random_strength': 7.255508056963083, 'grow_policy': 'Depthwise', 'min_data_in_leaf': 189}. Best is trial 249 with value: 1695.0689015039372.[0m
[32m[I 2024-10-13 12:56:18,728][0m Trial 530 finished with value: 2987.762476248392 and parameters: {'depth': 11, 'learning_rate': 0.0026314163902899468, 'iterations': 2982, 'l2_leaf_reg': 4.032462556596657e-07, 'border_count': 1, 'bagging_temperature': 0.04689177026143875, 'random_strength': 7.044670111025431, 'grow_policy': 'SymmetricTree', 'min_data_in_leaf': 361}. Best is trial 249 with value: 1695.0689015039372.[0m
[32m[I 2024-10-13 12:56:21,058][0m Trial 531 finished with value: 1790.3716452838598 and parameters: {'depth': 9, 'learning_rate': 0.0006833082529471662, 'iterations': 1828, 'l2_leaf_reg': 5.3910146660033634e-08, 'border_count': 28, 'bagging_temperature': 0.9164911031128927, 'random_strength': 5.637247681847123, 'grow_policy': 'Depthwise', 'min_data_in_leaf': 60}. Best is trial 249 with value: 1695.0689015039372.[0m
[32m[I 2024-10-13 12:56:23,229][0m Trial 532 finished with value: 1919.9619114874652 and parameters: {'depth': 9, 'learning_rate': 0.0010394737574398406, 'iterations': 2139, 'l2_leaf_reg': 1.4282100324434263e-07, 'border_count': 20, 'bagging_temperature': 0.06470288762840452, 'random_strength': 7.4969758215340265, 'grow_policy': 'Depthwise', 'min_data_in_leaf': 125}. Best is trial 249 with value: 1695.0689015039372.[0m
[32m[I 2024-10-13 12:56:24,635][0m Trial 533 finished with value: 2005.8868064541718 and parameters: {'depth': 9, 'learning_rate': 0.001342674971943343, 'iterations': 1133, 'l2_leaf_reg': 8.342138147123031e-08, 'border_count': 14, 'bagging_temperature': 0.031123579235753367, 'random_strength': 4.945131013098543, 'grow_policy': 'Depthwise', 'min_data_in_leaf': 100}. Best is trial 249 with value: 1695.0689015039372.[0m
[32m[I 2024-10-13 12:56:26,273][0m Trial 534 finished with value: 1718.0109759777051 and parameters: {'depth': 10, 'learning_rate': 0.0022133645818934156, 'iterations': 1401, 'l2_leaf_reg': 2.2758090107066382e-07, 'border_count': 32, 'bagging_temperature': 0.04795225998737952, 'random_strength': 7.217828940095081, 'grow_policy': 'Depthwise', 'min_data_in_leaf': 397}. Best is trial 249 with value: 1695.0689015039372.[0m
[32m[I 2024-10-13 12:56:28,383][0m Trial 535 finished with value: 1714.1521816526422 and parameters: {'depth': 9, 'learning_rate': 0.001785876432005863, 'iterations': 2043, 'l2_leaf_reg': 2.5972122091227856e-08, 'border_count': 25, 'bagging_temperature': 0.017814282197580675, 'random_strength': 7.934175601325257, 'grow_policy': 'Depthwise', 'min_data_in_leaf': 170}. Best is trial 249 with value: 1695.0689015039372.[0m
[32m[I 2024-10-13 12:56:30,631][0m Trial 536 finished with value: 1915.9269444595723 and parameters: {'depth': 12, 'learning_rate': 0.0011000372084015977, 'iterations': 2184, 'l2_leaf_reg': 0.018308196885979827, 'border_count': 21, 'bagging_temperature': 0.10686717748755725, 'random_strength': 6.901692308371089, 'grow_policy': 'Depthwise', 'min_data_in_leaf': 130}. Best is trial 249 with value: 1695.0689015039372.[0m
[32m[I 2024-10-13 12:56:32,918][0m Trial 537 finished with value: 1778.1313615552174 and parameters: {'depth': 6, 'learning_rate': 0.0008202080223347841, 'iterations': 2296, 'l2_leaf_reg': 4.20487259312591e-08, 'border_count': 29, 'bagging_temperature': 0.08539342114036583, 'random_strength': 5.449166106099456, 'grow_policy': 'Depthwise', 'min_data_in_leaf': 146}. Best is trial 249 with value: 1695.0689015039372.[0m
[32m[I 2024-10-13 12:56:34,556][0m Trial 538 finished with value: 1923.7686829834731 and parameters: {'depth': 9, 'learning_rate': 0.0014998332699503916, 'iterations': 1273, 'l2_leaf_reg': 1.2623796231306114e-07, 'border_count': 14, 'bagging_temperature': 0.035031859262945934, 'random_strength': 7.799677896159893, 'grow_policy': 'Depthwise', 'min_data_in_leaf': 88}. Best is trial 249 with value: 1695.0689015039372.[0m
[32m[I 2024-10-13 12:56:35,365][0m Trial 539 finished with value: 2575.8939899436386 and parameters: {'depth': 10, 'learning_rate': 0.0012701012537686053, 'iterations': 368, 'l2_leaf_reg': 6.217441723792916e-08, 'border_count': 9, 'bagging_temperature': 0.001387163542650123, 'random_strength': 7.411578407359402, 'grow_policy': 'Depthwise', 'min_data_in_leaf': 424}. Best is trial 249 with value: 1695.0689015039372.[0m
[32m[I 2024-10-13 12:56:37,498][0m Trial 540 finished with value: 1720.0608622346533 and parameters: {'depth': 9, 'learning_rate': 0.0017409214493235125, 'iterations': 2097, 'l2_leaf_reg': 0.701304384715916, 'border_count': 26, 'bagging_temperature': 0.06423444451464365, 'random_strength': 6.623062856838975, 'grow_policy': 'Depthwise', 'min_data_in_leaf': 108}. Best is trial 249 with value: 1695.0689015039372.[0m
[32m[I 2024-10-13 12:56:39,758][0m Trial 541 finished with value: 1716.6876295374866 and parameters: {'depth': 11, 'learning_rate': 0.0011293099101465324, 'iterations': 2239, 'l2_leaf_reg': 8.640309784618503e-08, 'border_count': 33, 'bagging_temperature': 0.02005348671270036, 'random_strength': 5.169783968792424, 'grow_policy': 'Depthwise', 'min_data_in_leaf': 880}. Best is trial 249 with value: 1695.0689015039372.[0m
[32m[I 2024-10-13 12:56:41,652][0m Trial 542 finished with value: 2071.9199877300266 and parameters: {'depth': 10, 'learning_rate': 0.0030943966048392934, 'iterations': 1767, 'l2_leaf_reg': 2.9585675744293554e-07, 'border_count': 17, 'bagging_temperature': 0.0431199822731594, 'random_strength': 5.868653787623861, 'grow_policy': 'Depthwise', 'min_data_in_leaf': 152}. Best is trial 249 with value: 1695.0689015039372.[0m
[32m[I 2024-10-13 12:56:44,749][0m Trial 543 finished with value: 2212.7058503363955 and parameters: {'depth': 9, 'learning_rate': 0.002027702935878038, 'iterations': 2363, 'l2_leaf_reg': 1.7473928031354404e-07, 'border_count': 21, 'bagging_temperature': 0.06154330067044243, 'random_strength': 7.144036545180363, 'grow_policy': 'Depthwise', 'min_data_in_leaf': 66}. Best is trial 249 with value: 1695.0689015039372.[0m
[32m[I 2024-10-13 12:56:46,496][0m Trial 544 finished with value: 1728.4000458030782 and parameters: {'depth': 9, 'learning_rate': 0.0014861567502500517, 'iterations': 1560, 'l2_leaf_reg': 3.5899995436559066e-08, 'border_count': 28, 'bagging_temperature': 0.0006209790360978754, 'random_strength': 7.640652794751128, 'grow_policy': 'Depthwise', 'min_data_in_leaf': 376}. Best is trial 249 with value: 1695.0689015039372.[0m
[32m[I 2024-10-13 12:56:51,219][0m Trial 545 finished with value: 1670.5692329857386 and parameters: {'depth': 7, 'learning_rate': 0.0013208003205605117, 'iterations': 2028, 'l2_leaf_reg': 1.6431307353074125e-08, 'border_count': 36, 'bagging_temperature': 0.031226262956708484, 'random_strength': 4.544679885832516, 'grow_policy': 'Depthwise', 'min_data_in_leaf': 17}. Best is trial 545 with value: 1670.5692329857386.[0m
[32m[I 2024-10-13 12:56:53,971][0m Trial 546 finished with value: 1797.8050965635466 and parameters: {'depth': 6, 'learning_rate': 0.0009037844761720328, 'iterations': 2050, 'l2_leaf_reg': 1.1657972910722194e-08, 'border_count': 45, 'bagging_temperature': 0.02846454976766065, 'random_strength': 3.339944063828219, 'grow_policy': 'Depthwise', 'min_data_in_leaf': 62}. Best is trial 545 with value: 1670.5692329857386.[0m
[32m[I 2024-10-13 12:57:02,677][0m Trial 547 finished with value: 2131.339029207998 and parameters: {'depth': 7, 'learning_rate': 0.0011235600692273697, 'iterations': 1195, 'l2_leaf_reg': 1.4425257162365085e-08, 'border_count': 41, 'bagging_temperature': 0.19472126553236058, 'random_strength': 5.603381250049204, 'grow_policy': 'SymmetricTree', 'min_data_in_leaf': 32}. Best is trial 545 with value: 1670.5692329857386.[0m
[32m[I 2024-10-13 12:57:04,339][0m Trial 548 finished with value: 1745.762494850289 and parameters: {'depth': 7, 'learning_rate': 0.0013012463071367067, 'iterations': 1009, 'l2_leaf_reg': 1.574220404030926e-08, 'border_count': 38, 'bagging_temperature': 0.021230245310175783, 'random_strength': 4.157913849790532, 'grow_policy': 'Depthwise', 'min_data_in_leaf': 47}. Best is trial 545 with value: 1670.5692329857386.[0m
[32m[I 2024-10-13 12:57:09,379][0m Trial 549 finished with value: 2068.190756697001 and parameters: {'depth': 7, 'learning_rate': 0.001702180326464987, 'iterations': 2136, 'l2_leaf_reg': 2.130779513309317e-08, 'border_count': 34, 'bagging_temperature': 3.823731095639604e-05, 'random_strength': 4.228725109135608, 'grow_policy': 'Depthwise', 'min_data_in_leaf': 16}. Best is trial 545 with value: 1670.5692329857386.[0m
[32m[I 2024-10-13 12:57:13,130][0m Trial 550 finished with value: 2024.6621743552955 and parameters: {'depth': 7, 'learning_rate': 0.001014364656233456, 'iterations': 2228, 'l2_leaf_reg': 2.2494577152475676e-08, 'border_count': 50, 'bagging_temperature': 0.09198429399629733, 'random_strength': 4.545394678486063, 'grow_policy': 'Depthwise', 'min_data_in_leaf': 38}. Best is trial 545 with value: 1670.5692329857386.[0m
[32m[I 2024-10-13 12:57:16,085][0m Trial 551 finished with value: 1775.3497784305882 and parameters: {'depth': 6, 'learning_rate': 0.0023850906710092467, 'iterations': 2887, 'l2_leaf_reg': 6.431586444284264e-07, 'border_count': 36, 'bagging_temperature': 0.05156757009208748, 'random_strength': 5.407140756636895, 'grow_policy': 'Depthwise', 'min_data_in_leaf': 343}. Best is trial 545 with value: 1670.5692329857386.[0m
[32m[I 2024-10-13 12:57:18,124][0m Trial 552 finished with value: 1801.2877623687043 and parameters: {'depth': 7, 'learning_rate': 0.001302506878527085, 'iterations': 1647, 'l2_leaf_reg': 4.658709707455008e-05, 'border_count': 43, 'bagging_temperature': 0.07062174664810955, 'random_strength': 5.050212847793203, 'grow_policy': 'Depthwise', 'min_data_in_leaf': 100}. Best is trial 545 with value: 1670.5692329857386.[0m
[32m[I 2024-10-13 12:57:22,439][0m Trial 553 finished with value: 1864.8397854749892 and parameters: {'depth': 11, 'learning_rate': 0.0008522406702585937, 'iterations': 2165, 'l2_leaf_reg': 1.9908336071800634e-08, 'border_count': 31, 'bagging_temperature': 0.03269527292833408, 'random_strength': 4.316750350799841, 'grow_policy': 'Depthwise', 'min_data_in_leaf': 25}. Best is trial 545 with value: 1670.5692329857386.[0m
[32m[I 2024-10-13 12:57:26,130][0m Trial 554 finished with value: 2375.4631100190004 and parameters: {'depth': 8, 'learning_rate': 0.0015972330292052675, 'iterations': 2996, 'l2_leaf_reg': 2.9144424237257438e-08, 'border_count': 108, 'bagging_temperature': 0.017619650932245334, 'random_strength': 4.55077941932306, 'grow_policy': 'Depthwise', 'min_data_in_leaf': 87}. Best is trial 545 with value: 1670.5692329857386.[0m
[32m[I 2024-10-13 12:57:28,417][0m Trial 555 finished with value: 1743.425756143412 and parameters: {'depth': 6, 'learning_rate': 0.0011323901366597912, 'iterations': 2318, 'l2_leaf_reg': 1.1504010438314956e-08, 'border_count': 23, 'bagging_temperature': 0.04925896670997171, 'random_strength': 4.770558620622517, 'grow_policy': 'Depthwise', 'min_data_in_leaf': 121}. Best is trial 545 with value: 1670.5692329857386.[0m
[32m[I 2024-10-13 12:57:32,149][0m Trial 556 finished with value: 1998.2757517902833 and parameters: {'depth': 8, 'learning_rate': 0.0019664024830301718, 'iterations': 1480, 'l2_leaf_reg': 4.1200554588221484e-08, 'border_count': 8, 'bagging_temperature': 0.08235694299949421, 'random_strength': 7.95912682944535, 'grow_policy': 'Depthwise', 'min_data_in_leaf': 13}. Best is trial 545 with value: 1670.5692329857386.[0m
