Optimizing CatBoost...
[32m[I 2024-10-13 11:19:08,543][0m Trial 0 finished with value: 239.5378312158066 and parameters: {'depth': 7, 'learning_rate': 0.0011820248328107236, 'iterations': 1399, 'l2_leaf_reg': 9.796729496405862e-05, 'border_count': 175, 'bagging_temperature': 0.43090380828690933, 'random_strength': 2.735871363829099, 'grow_policy': 'Depthwise', 'min_data_in_leaf': 421}. Best is trial 0 with value: 239.5378312158066.[0m
[32m[I 2024-10-13 11:19:20,886][0m Trial 1 finished with value: 229.68046177013312 and parameters: {'depth': 5, 'learning_rate': 0.0035985949639935565, 'iterations': 2905, 'l2_leaf_reg': 1.622042470411846e-08, 'border_count': 93, 'bagging_temperature': 0.19471191685792988, 'random_strength': 4.669135909356604, 'grow_policy': 'SymmetricTree', 'min_data_in_leaf': 880}. Best is trial 1 with value: 229.68046177013312.[0m
[32m[I 2024-10-13 11:19:24,175][0m Trial 2 finished with value: 289.9596485938972 and parameters: {'depth': 15, 'learning_rate': 0.00026048177706529917, 'iterations': 2550, 'l2_leaf_reg': 1.713440276467451e-06, 'border_count': 200, 'bagging_temperature': 0.10989520551162224, 'random_strength': 5.167894956285254, 'grow_policy': 'Depthwise', 'min_data_in_leaf': 936}. Best is trial 1 with value: 229.68046177013312.[0m
[32m[I 2024-10-13 11:19:26,845][0m Trial 3 finished with value: 306.1320335921674 and parameters: {'depth': 10, 'learning_rate': 0.0001985911305770568, 'iterations': 2823, 'l2_leaf_reg': 1.5913269645626924, 'border_count': 243, 'bagging_temperature': 0.34195955847711346, 'random_strength': 4.864573381610921, 'grow_policy': 'Lossguide', 'min_data_in_leaf': 472, 'max_leaves': 152}. Best is trial 1 with value: 229.68046177013312.[0m
[32m[I 2024-10-13 11:19:28,909][0m Trial 4 finished with value: 215.78469951381825 and parameters: {'depth': 12, 'learning_rate': 0.005626909593959019, 'iterations': 2148, 'l2_leaf_reg': 2.0836718232933205, 'border_count': 93, 'bagging_temperature': 0.8852052089206203, 'random_strength': 3.011089121408679, 'grow_policy': 'Lossguide', 'min_data_in_leaf': 728, 'max_leaves': 173}. Best is trial 4 with value: 215.78469951381825.[0m
[32m[I 2024-10-13 11:19:31,575][0m Trial 5 finished with value: 244.33335113488104 and parameters: {'depth': 6, 'learning_rate': 0.13286013237389335, 'iterations': 2820, 'l2_leaf_reg': 5.4423669657296666e-05, 'border_count': 147, 'bagging_temperature': 0.6173657368863484, 'random_strength': 5.2919716051705015, 'grow_policy': 'Depthwise', 'min_data_in_leaf': 376}. Best is trial 4 with value: 215.78469951381825.[0m
[32m[I 2024-10-13 11:19:39,610][0m Trial 6 finished with value: 214.27673628362504 and parameters: {'depth': 3, 'learning_rate': 0.001756097188539082, 'iterations': 2392, 'l2_leaf_reg': 0.0017124608222517127, 'border_count': 255, 'bagging_temperature': 0.16884265758338957, 'random_strength': 0.1742154093496373, 'grow_policy': 'SymmetricTree', 'min_data_in_leaf': 790}. Best is trial 6 with value: 214.27673628362504.[0m
[32m[I 2024-10-13 11:19:42,165][0m Trial 7 finished with value: 266.0113240577178 and parameters: {'depth': 3, 'learning_rate': 0.01320164447908962, 'iterations': 1840, 'l2_leaf_reg': 6.742240472150528e-06, 'border_count': 219, 'bagging_temperature': 0.49963159686185554, 'random_strength': 8.673052720129771, 'grow_policy': 'Depthwise', 'min_data_in_leaf': 55}. Best is trial 6 with value: 214.27673628362504.[0m
[32m[I 2024-10-13 11:19:43,761][0m Trial 8 finished with value: 263.30948210673466 and parameters: {'depth': 11, 'learning_rate': 0.09421566185267706, 'iterations': 1288, 'l2_leaf_reg': 1.0860608768755464e-08, 'border_count': 173, 'bagging_temperature': 0.802897805474165, 'random_strength': 7.026039829962411, 'grow_policy': 'Lossguide', 'min_data_in_leaf': 401, 'max_leaves': 175}. Best is trial 6 with value: 214.27673628362504.[0m
[32m[I 2024-10-13 11:19:45,250][0m Trial 9 finished with value: 230.5799656161163 and parameters: {'depth': 6, 'learning_rate': 0.0020944747208394413, 'iterations': 1282, 'l2_leaf_reg': 4.848314155341232e-06, 'border_count': 99, 'bagging_temperature': 0.138336806461675, 'random_strength': 1.6824179710915843, 'grow_policy': 'Depthwise', 'min_data_in_leaf': 710}. Best is trial 6 with value: 214.27673628362504.[0m
[32m[I 2024-10-13 11:19:46,149][0m Trial 10 finished with value: 239.53996178001805 and parameters: {'depth': 3, 'learning_rate': 0.025857432495893097, 'iterations': 431, 'l2_leaf_reg': 0.021315605399680512, 'border_count': 30, 'bagging_temperature': 0.30357784921604736, 'random_strength': 0.2615290728364763, 'grow_policy': 'SymmetricTree', 'min_data_in_leaf': 666}. Best is trial 6 with value: 214.27673628362504.[0m
[32m[I 2024-10-13 11:21:24,116][0m Trial 11 finished with value: 245.74295198083053 and parameters: {'depth': 13, 'learning_rate': 0.0009143584550310976, 'iterations': 2168, 'l2_leaf_reg': 7.031678062637827, 'border_count': 35, 'bagging_temperature': 0.8506430145313959, 'random_strength': 0.2919559174673914, 'grow_policy': 'SymmetricTree', 'min_data_in_leaf': 707}. Best is trial 6 with value: 214.27673628362504.[0m
[32m[I 2024-10-13 11:21:26,135][0m Trial 12 finished with value: 214.8058969790356 and parameters: {'depth': 12, 'learning_rate': 0.009284989797963378, 'iterations': 2145, 'l2_leaf_reg': 0.02365269892730492, 'border_count': 76, 'bagging_temperature': 0.9883047840784795, 'random_strength': 2.505156665245191, 'grow_policy': 'Lossguide', 'min_data_in_leaf': 808, 'max_leaves': 62}. Best is trial 6 with value: 214.27673628362504.[0m
[32m[I 2024-10-13 11:21:44,884][0m Trial 13 finished with value: 229.79008162089048 and parameters: {'depth': 8, 'learning_rate': 0.02070331755989067, 'iterations': 2121, 'l2_leaf_reg': 0.0052500110233001315, 'border_count': 59, 'bagging_temperature': 0.6551826286739522, 'random_strength': 2.6586996877075526, 'grow_policy': 'SymmetricTree', 'min_data_in_leaf': 973}. Best is trial 6 with value: 214.27673628362504.[0m
[32m[I 2024-10-13 11:21:46,686][0m Trial 14 finished with value: 299.9575424085559 and parameters: {'depth': 14, 'learning_rate': 0.0005900516910500582, 'iterations': 1713, 'l2_leaf_reg': 0.01894668581808366, 'border_count': 1, 'bagging_temperature': 0.949797775253929, 'random_strength': 1.579507438812245, 'grow_policy': 'Lossguide', 'min_data_in_leaf': 808, 'max_leaves': 49}. Best is trial 6 with value: 214.27673628362504.[0m
[32m[I 2024-10-13 11:22:03,070][0m Trial 15 finished with value: 228.42160867365763 and parameters: {'depth': 10, 'learning_rate': 0.007466839350554107, 'iterations': 753, 'l2_leaf_reg': 0.002441425848111471, 'border_count': 254, 'bagging_temperature': 0.6830309898735956, 'random_strength': 1.4696376351302174, 'grow_policy': 'SymmetricTree', 'min_data_in_leaf': 556}. Best is trial 6 with value: 214.27673628362504.[0m
[32m[I 2024-10-13 11:22:05,472][0m Trial 16 finished with value: 271.05876447623825 and parameters: {'depth': 9, 'learning_rate': 0.05375999265124454, 'iterations': 2439, 'l2_leaf_reg': 0.09792285518619753, 'border_count': 131, 'bagging_temperature': 0.2647623666503665, 'random_strength': 0.0016435955589053086, 'grow_policy': 'Lossguide', 'min_data_in_leaf': 555, 'max_leaves': 39}. Best is trial 6 with value: 214.27673628362504.[0m
[32m[I 2024-10-13 11:23:23,706][0m Trial 17 finished with value: 230.4945628699123 and parameters: {'depth': 12, 'learning_rate': 0.002535784030470186, 'iterations': 2469, 'l2_leaf_reg': 0.0009525800009069311, 'border_count': 70, 'bagging_temperature': 0.021775935854020795, 'random_strength': 3.6317531630286606, 'grow_policy': 'SymmetricTree', 'min_data_in_leaf': 228}. Best is trial 6 with value: 214.27673628362504.[0m
[32m[I 2024-10-13 11:23:25,598][0m Trial 18 finished with value: 287.57483600398695 and parameters: {'depth': 4, 'learning_rate': 0.2812154693360489, 'iterations': 1838, 'l2_leaf_reg': 0.2119348788830676, 'border_count': 156, 'bagging_temperature': 0.985373405566128, 'random_strength': 1.2668185257886733, 'grow_policy': 'Lossguide', 'min_data_in_leaf': 844, 'max_leaves': 247}. Best is trial 6 with value: 214.27673628362504.[0m
[32m[I 2024-10-13 11:23:35,803][0m Trial 19 finished with value: 224.7241102091424 and parameters: {'depth': 8, 'learning_rate': 0.009153174751154507, 'iterations': 964, 'l2_leaf_reg': 0.00029036002536509374, 'border_count': 115, 'bagging_temperature': 0.7547693218423359, 'random_strength': 6.6780452068511975, 'grow_policy': 'SymmetricTree', 'min_data_in_leaf': 999}. Best is trial 6 with value: 214.27673628362504.[0m
[32m[I 2024-10-13 11:23:37,853][0m Trial 20 finished with value: 261.96378248929676 and parameters: {'depth': 15, 'learning_rate': 0.03054998465547878, 'iterations': 2076, 'l2_leaf_reg': 0.20323927710763104, 'border_count': 217, 'bagging_temperature': 0.5483798968917666, 'random_strength': 3.7614110740723703, 'grow_policy': 'Lossguide', 'min_data_in_leaf': 602, 'max_leaves': 97}. Best is trial 6 with value: 214.27673628362504.[0m
[32m[I 2024-10-13 11:23:40,083][0m Trial 21 finished with value: 210.39567200062407 and parameters: {'depth': 12, 'learning_rate': 0.004956320856914543, 'iterations': 2264, 'l2_leaf_reg': 1.2623656090695194, 'border_count': 78, 'bagging_temperature': 0.8843815130620158, 'random_strength': 2.7483627148480854, 'grow_policy': 'Lossguide', 'min_data_in_leaf': 788, 'max_leaves': 202}. Best is trial 21 with value: 210.39567200062407.[0m
[32m[I 2024-10-13 11:23:42,501][0m Trial 22 finished with value: 257.7488352689219 and parameters: {'depth': 13, 'learning_rate': 0.00044067602567564914, 'iterations': 2416, 'l2_leaf_reg': 0.03271793467132323, 'border_count': 52, 'bagging_temperature': 0.9957496449288227, 'random_strength': 2.3131074078804454, 'grow_policy': 'Lossguide', 'min_data_in_leaf': 823, 'max_leaves': 227}. Best is trial 21 with value: 210.39567200062407.[0m
[32m[I 2024-10-13 11:23:45,059][0m Trial 23 finished with value: 214.8680114876846 and parameters: {'depth': 11, 'learning_rate': 0.0016436654635201644, 'iterations': 2637, 'l2_leaf_reg': 0.940485522627358, 'border_count': 78, 'bagging_temperature': 0.7470598954206742, 'random_strength': 3.7518817667819135, 'grow_policy': 'Lossguide', 'min_data_in_leaf': 785, 'max_leaves': 99}. Best is trial 21 with value: 210.39567200062407.[0m
[32m[I 2024-10-13 11:23:46,879][0m Trial 24 finished with value: 243.1627724470377 and parameters: {'depth': 13, 'learning_rate': 0.004265809638020656, 'iterations': 1666, 'l2_leaf_reg': 0.005906694819996051, 'border_count': 127, 'bagging_temperature': 0.897320279633871, 'random_strength': 1.0790656095038007, 'grow_policy': 'Lossguide', 'min_data_in_leaf': 888, 'max_leaves': 212}. Best is trial 21 with value: 210.39567200062407.[0m
[32m[I 2024-10-13 11:23:49,128][0m Trial 25 finished with value: 204.55395627750818 and parameters: {'depth': 10, 'learning_rate': 0.011340123263131512, 'iterations': 2295, 'l2_leaf_reg': 0.45267936028727185, 'border_count': 13, 'bagging_temperature': 0.451040326887128, 'random_strength': 9.956856505237505, 'grow_policy': 'Lossguide', 'min_data_in_leaf': 655, 'max_leaves': 103}. Best is trial 25 with value: 204.55395627750818.[0m
[32m[I 2024-10-13 11:24:06,892][0m Trial 26 finished with value: 218.04727129873567 and parameters: {'depth': 10, 'learning_rate': 0.015975859303842134, 'iterations': 2296, 'l2_leaf_reg': 5.165298356414198, 'border_count': 10, 'bagging_temperature': 0.408322561780088, 'random_strength': 9.98202921917707, 'grow_policy': 'SymmetricTree', 'min_data_in_leaf': 613}. Best is trial 25 with value: 204.55395627750818.[0m
[32m[I 2024-10-13 11:24:08,808][0m Trial 27 finished with value: 362.50757881699684 and parameters: {'depth': 9, 'learning_rate': 0.00010474436639205228, 'iterations': 1922, 'l2_leaf_reg': 0.42041644840728404, 'border_count': 30, 'bagging_temperature': 0.5321425782937247, 'random_strength': 6.583334222954003, 'grow_policy': 'Lossguide', 'min_data_in_leaf': 751, 'max_leaves': 114}. Best is trial 25 with value: 204.55395627750818.[0m
[32m[I 2024-10-13 11:24:11,532][0m Trial 28 finished with value: 218.01261905724186 and parameters: {'depth': 8, 'learning_rate': 0.003081338033414915, 'iterations': 2746, 'l2_leaf_reg': 0.0802650570775222, 'border_count': 43, 'bagging_temperature': 0.22865818707801644, 'random_strength': 7.600632482270596, 'grow_policy': 'Lossguide', 'min_data_in_leaf': 299, 'max_leaves': 201}. Best is trial 25 with value: 204.55395627750818.[0m
[32m[I 2024-10-13 11:24:29,249][0m Trial 29 finished with value: 204.0494831652534 and parameters: {'depth': 7, 'learning_rate': 0.0012727511192194587, 'iterations': 2988, 'l2_leaf_reg': 5.6148949004885145e-05, 'border_count': 19, 'bagging_temperature': 0.4099667137611752, 'random_strength': 9.728890208911317, 'grow_policy': 'SymmetricTree', 'min_data_in_leaf': 654}. Best is trial 29 with value: 204.0494831652534.[0m
[32m[I 2024-10-13 11:24:30,948][0m Trial 30 finished with value: 235.90532531055035 and parameters: {'depth': 7, 'learning_rate': 0.0009591424553169149, 'iterations': 1412, 'l2_leaf_reg': 3.654971878088389e-07, 'border_count': 19, 'bagging_temperature': 0.4066577308232988, 'random_strength': 9.912761857285089, 'grow_policy': 'Depthwise', 'min_data_in_leaf': 645}. Best is trial 29 with value: 204.0494831652534.[0m
[32m[I 2024-10-13 11:24:42,075][0m Trial 31 finished with value: 204.97039413580296 and parameters: {'depth': 5, 'learning_rate': 0.0015192266303434327, 'iterations': 2660, 'l2_leaf_reg': 7.746209189464987e-05, 'border_count': 11, 'bagging_temperature': 0.46495081072823935, 'random_strength': 9.114329069879574, 'grow_policy': 'SymmetricTree', 'min_data_in_leaf': 496}. Best is trial 29 with value: 204.0494831652534.[0m
[32m[I 2024-10-13 11:24:54,551][0m Trial 32 finished with value: 202.06637007366703 and parameters: {'depth': 5, 'learning_rate': 0.0011373833687799268, 'iterations': 2987, 'l2_leaf_reg': 5.0217594840855037e-05, 'border_count': 18, 'bagging_temperature': 0.44124230354828103, 'random_strength': 8.823135887997664, 'grow_policy': 'SymmetricTree', 'min_data_in_leaf': 505}. Best is trial 32 with value: 202.06637007366703.[0m
[32m[I 2024-10-13 11:25:07,167][0m Trial 33 finished with value: 223.31877214447255 and parameters: {'depth': 5, 'learning_rate': 0.0006088928293037431, 'iterations': 2998, 'l2_leaf_reg': 5.410124048868803e-05, 'border_count': 19, 'bagging_temperature': 0.45731589743572604, 'random_strength': 8.995802183252279, 'grow_policy': 'SymmetricTree', 'min_data_in_leaf': 494}. Best is trial 32 with value: 202.06637007366703.[0m
[32m[I 2024-10-13 11:25:17,661][0m Trial 34 finished with value: 286.7709750250683 and parameters: {'depth': 5, 'learning_rate': 0.00032067023217005315, 'iterations': 2651, 'l2_leaf_reg': 0.0002304636731688742, 'border_count': 2, 'bagging_temperature': 0.37285803272028395, 'random_strength': 9.028166199023765, 'grow_policy': 'SymmetricTree', 'min_data_in_leaf': 520}. Best is trial 32 with value: 202.06637007366703.[0m
[32m[I 2024-10-13 11:25:33,073][0m Trial 35 finished with value: 226.21559679827175 and parameters: {'depth': 6, 'learning_rate': 0.0008573638033432211, 'iterations': 2995, 'l2_leaf_reg': 4.5248694214240495e-07, 'border_count': 50, 'bagging_temperature': 0.5675174621946866, 'random_strength': 8.09860023525273, 'grow_policy': 'SymmetricTree', 'min_data_in_leaf': 459}. Best is trial 32 with value: 202.06637007366703.[0m
[32m[I 2024-10-13 11:25:49,877][0m Trial 36 finished with value: 205.99964995080856 and parameters: {'depth': 7, 'learning_rate': 0.0012714684264864945, 'iterations': 2799, 'l2_leaf_reg': 2.0959022284417384e-05, 'border_count': 21, 'bagging_temperature': 0.47464964293938094, 'random_strength': 9.508084811579094, 'grow_policy': 'SymmetricTree', 'min_data_in_leaf': 345}. Best is trial 32 with value: 202.06637007366703.[0m
[32m[I 2024-10-13 11:25:59,587][0m Trial 37 finished with value: 324.4000110576926 and parameters: {'depth': 4, 'learning_rate': 0.00017511405705907278, 'iterations': 2611, 'l2_leaf_reg': 1.2564465939533652e-05, 'border_count': 63, 'bagging_temperature': 0.34145383644670385, 'random_strength': 8.378211866702472, 'grow_policy': 'SymmetricTree', 'min_data_in_leaf': 435}. Best is trial 32 with value: 202.06637007366703.[0m
[32m[I 2024-10-13 11:26:11,490][0m Trial 38 finished with value: 215.82585387985498 and parameters: {'depth': 5, 'learning_rate': 0.003150196849640174, 'iterations': 2852, 'l2_leaf_reg': 6.808628139323338e-07, 'border_count': 40, 'bagging_temperature': 0.6046526906477925, 'random_strength': 7.800369942810115, 'grow_policy': 'SymmetricTree', 'min_data_in_leaf': 227}. Best is trial 32 with value: 202.06637007366703.[0m
[32m[I 2024-10-13 11:26:21,217][0m Trial 39 finished with value: 207.9027375920397 and parameters: {'depth': 4, 'learning_rate': 0.001200531821763015, 'iterations': 2659, 'l2_leaf_reg': 9.439476092306477e-05, 'border_count': 13, 'bagging_temperature': 0.43800137526468264, 'random_strength': 9.377394510508516, 'grow_policy': 'SymmetricTree', 'min_data_in_leaf': 555}. Best is trial 32 with value: 202.06637007366703.[0m
[32m[I 2024-10-13 11:26:23,912][0m Trial 40 finished with value: 206.73922865602566 and parameters: {'depth': 7, 'learning_rate': 0.0018545993720340732, 'iterations': 2845, 'l2_leaf_reg': 0.000672735836716674, 'border_count': 30, 'bagging_temperature': 0.3167169241796819, 'random_strength': 7.333031385014019, 'grow_policy': 'Depthwise', 'min_data_in_leaf': 673}. Best is trial 32 with value: 202.06637007366703.[0m
[32m[I 2024-10-13 11:26:41,132][0m Trial 41 finished with value: 227.77226343937127 and parameters: {'depth': 7, 'learning_rate': 0.0006077079777600799, 'iterations': 2769, 'l2_leaf_reg': 2.0318983328808642e-05, 'border_count': 17, 'bagging_temperature': 0.4876099116029992, 'random_strength': 9.468423931652218, 'grow_policy': 'SymmetricTree', 'min_data_in_leaf': 253}. Best is trial 32 with value: 202.06637007366703.[0m
[32m[I 2024-10-13 11:26:52,425][0m Trial 42 finished with value: 251.60109171616878 and parameters: {'depth': 6, 'learning_rate': 0.0012868229952648718, 'iterations': 2948, 'l2_leaf_reg': 2.6493494837177167e-06, 'border_count': 1, 'bagging_temperature': 0.5041202510151541, 'random_strength': 8.621424205294026, 'grow_policy': 'SymmetricTree', 'min_data_in_leaf': 347}. Best is trial 32 with value: 202.06637007366703.[0m
[32m[I 2024-10-13 11:27:03,211][0m Trial 43 finished with value: 269.8514426977836 and parameters: {'depth': 5, 'learning_rate': 0.0003507253136355487, 'iterations': 2538, 'l2_leaf_reg': 3.694733040606116e-05, 'border_count': 22, 'bagging_temperature': 0.36872497848292546, 'random_strength': 9.48013350541135, 'grow_policy': 'SymmetricTree', 'min_data_in_leaf': 138}. Best is trial 32 with value: 202.06637007366703.[0m
[32m[I 2024-10-13 11:27:16,785][0m Trial 44 finished with value: 219.15485277525335 and parameters: {'depth': 6, 'learning_rate': 0.00617069218930673, 'iterations': 2750, 'l2_leaf_reg': 0.0001653272423512843, 'border_count': 46, 'bagging_temperature': 0.4607615834618596, 'random_strength': 8.984265776160951, 'grow_policy': 'SymmetricTree', 'min_data_in_leaf': 387}. Best is trial 32 with value: 202.06637007366703.[0m
[32m[I 2024-10-13 11:27:32,596][0m Trial 45 finished with value: 217.8702003892076 and parameters: {'depth': 7, 'learning_rate': 0.002398436857615255, 'iterations': 2879, 'l2_leaf_reg': 7.471136323877866e-08, 'border_count': 30, 'bagging_temperature': 0.2697987631357166, 'random_strength': 5.908697766555015, 'grow_policy': 'SymmetricTree', 'min_data_in_leaf': 592}. Best is trial 32 with value: 202.06637007366703.[0m
[32m[I 2024-10-13 11:27:56,405][0m Trial 46 finished with value: 227.9128339190314 and parameters: {'depth': 8, 'learning_rate': 0.0014986090920764614, 'iterations': 2336, 'l2_leaf_reg': 1.2567986960879053e-05, 'border_count': 94, 'bagging_temperature': 0.5927494930454581, 'random_strength': 8.144228330157379, 'grow_policy': 'SymmetricTree', 'min_data_in_leaf': 321}. Best is trial 32 with value: 202.06637007366703.[0m
[32m[I 2024-10-13 11:27:58,765][0m Trial 47 finished with value: 211.9827329562704 and parameters: {'depth': 4, 'learning_rate': 0.0007852833807811812, 'iterations': 2564, 'l2_leaf_reg': 5.025691753975112e-06, 'border_count': 10, 'bagging_temperature': 0.3860499674977367, 'random_strength': 9.647965192467385, 'grow_policy': 'Depthwise', 'min_data_in_leaf': 509}. Best is trial 32 with value: 202.06637007366703.[0m
[32m[I 2024-10-13 11:28:38,550][0m Trial 48 finished with value: 308.9689249494905 and parameters: {'depth': 9, 'learning_rate': 0.00022803456286676056, 'iterations': 2764, 'l2_leaf_reg': 9.512965669458133e-05, 'border_count': 185, 'bagging_temperature': 0.653873755770324, 'random_strength': 8.874986660152102, 'grow_policy': 'SymmetricTree', 'min_data_in_leaf': 429}. Best is trial 32 with value: 202.06637007366703.[0m
[32m[I 2024-10-13 11:28:52,353][0m Trial 49 finished with value: 218.7627148298358 and parameters: {'depth': 6, 'learning_rate': 0.0036199316035961443, 'iterations': 2997, 'l2_leaf_reg': 1.5607616262670747e-06, 'border_count': 38, 'bagging_temperature': 0.5017735705321226, 'random_strength': 8.44942816786267, 'grow_policy': 'SymmetricTree', 'min_data_in_leaf': 689}. Best is trial 32 with value: 202.06637007366703.[0m
[32m[I 2024-10-13 11:29:25,820][0m Trial 50 finished with value: 261.29104639271765 and parameters: {'depth': 10, 'learning_rate': 0.00046713227718149264, 'iterations': 2514, 'l2_leaf_reg': 0.000589203111268215, 'border_count': 26, 'bagging_temperature': 0.4496747243467748, 'random_strength': 9.289747282582052, 'grow_policy': 'SymmetricTree', 'min_data_in_leaf': 737}. Best is trial 32 with value: 202.06637007366703.[0m
