[32m[I 2024-10-13 11:56:36,018][0m Trial 867 finished with value: 179.8620388062256 and parameters: {'depth': 3, 'learning_rate': 0.017918211675999125, 'iterations': 2339, 'l2_leaf_reg': 3.3929474854228676, 'border_count': 9, 'bagging_temperature': 0.12204660407736531, 'random_strength': 2.111879715355196, 'grow_policy': 'Lossguide', 'min_data_in_leaf': 963, 'max_leaves': 160}. Best is trial 306 with value: 170.64979827273262.[0m
[32m[I 2024-10-13 11:56:38,481][0m Trial 868 finished with value: 225.61888277341234 and parameters: {'depth': 3, 'learning_rate': 0.03108125874566911, 'iterations': 2591, 'l2_leaf_reg': 2.1239014984811906, 'border_count': 15, 'bagging_temperature': 0.11947064373579142, 'random_strength': 2.2134908862851654, 'grow_policy': 'Lossguide', 'min_data_in_leaf': 986, 'max_leaves': 168}. Best is trial 306 with value: 170.64979827273262.[0m
[32m[I 2024-10-13 11:56:40,652][0m Trial 869 finished with value: 172.28633781659693 and parameters: {'depth': 3, 'learning_rate': 0.02491897780507328, 'iterations': 2284, 'l2_leaf_reg': 4.496612353998799, 'border_count': 5, 'bagging_temperature': 0.11728088126463593, 'random_strength': 1.7603993659973383, 'grow_policy': 'Lossguide', 'min_data_in_leaf': 947, 'max_leaves': 148}. Best is trial 306 with value: 170.64979827273262.[0m
[32m[I 2024-10-13 11:56:42,913][0m Trial 870 finished with value: 203.2474115483796 and parameters: {'depth': 3, 'learning_rate': 0.016947376131999953, 'iterations': 2434, 'l2_leaf_reg': 3.7080482061350253, 'border_count': 12, 'bagging_temperature': 0.1413544297840751, 'random_strength': 1.9310947598973485, 'grow_policy': 'Lossguide', 'min_data_in_leaf': 931, 'max_leaves': 137}. Best is trial 306 with value: 170.64979827273262.[0m
[32m[I 2024-10-13 11:56:45,289][0m Trial 871 finished with value: 170.57272342910278 and parameters: {'depth': 3, 'learning_rate': 0.020281300361115254, 'iterations': 2524, 'l2_leaf_reg': 9.285806534214332, 'border_count': 5, 'bagging_temperature': 0.11433477301623875, 'random_strength': 1.8841314995852882, 'grow_policy': 'Lossguide', 'min_data_in_leaf': 991, 'max_leaves': 156}. Best is trial 871 with value: 170.57272342910278.[0m
[32m[I 2024-10-13 11:56:47,697][0m Trial 872 finished with value: 255.37576042021377 and parameters: {'depth': 3, 'learning_rate': 0.0268180716303207, 'iterations': 2526, 'l2_leaf_reg': 5.951644840022884, 'border_count': 1, 'bagging_temperature': 0.10348467361615615, 'random_strength': 2.0501582996648677, 'grow_policy': 'Lossguide', 'min_data_in_leaf': 972, 'max_leaves': 162}. Best is trial 871 with value: 170.57272342910278.[0m
[32m[I 2024-10-13 11:56:50,032][0m Trial 873 finished with value: 254.50845729412322 and parameters: {'depth': 3, 'learning_rate': 0.021828543796661375, 'iterations': 2480, 'l2_leaf_reg': 9.432981266485674, 'border_count': 1, 'bagging_temperature': 0.12126049127270122, 'random_strength': 2.5310546873637114, 'grow_policy': 'Lossguide', 'min_data_in_leaf': 997, 'max_leaves': 173}. Best is trial 871 with value: 170.57272342910278.[0m
[32m[I 2024-10-13 11:56:52,442][0m Trial 874 finished with value: 175.23102420323073 and parameters: {'depth': 3, 'learning_rate': 0.029032363922542544, 'iterations': 2511, 'l2_leaf_reg': 6.553377224729342, 'border_count': 6, 'bagging_temperature': 0.06137256553803103, 'random_strength': 2.2665163316934622, 'grow_policy': 'Lossguide', 'min_data_in_leaf': 964, 'max_leaves': 154}. Best is trial 871 with value: 170.57272342910278.[0m
[32m[I 2024-10-13 11:56:54,885][0m Trial 875 finished with value: 176.0051982174307 and parameters: {'depth': 3, 'learning_rate': 0.03594588064943744, 'iterations': 2636, 'l2_leaf_reg': 9.823827129287897, 'border_count': 8, 'bagging_temperature': 0.1614380689044341, 'random_strength': 1.8755730873578425, 'grow_policy': 'Lossguide', 'min_data_in_leaf': 955, 'max_leaves': 142}. Best is trial 871 with value: 170.57272342910278.[0m
[32m[I 2024-10-13 11:56:57,225][0m Trial 876 finished with value: 171.73949712256055 and parameters: {'depth': 3, 'learning_rate': 0.02087915215315944, 'iterations': 2436, 'l2_leaf_reg': 6.5173789118655945, 'border_count': 5, 'bagging_temperature': 0.1303406958222732, 'random_strength': 1.7778819296927435, 'grow_policy': 'Lossguide', 'min_data_in_leaf': 949, 'max_leaves': 157}. Best is trial 871 with value: 170.57272342910278.[0m
[32m[I 2024-10-13 11:56:59,433][0m Trial 877 finished with value: 207.30129252129922 and parameters: {'depth': 3, 'learning_rate': 0.024287142971500877, 'iterations': 2245, 'l2_leaf_reg': 2.272652715777516, 'border_count': 12, 'bagging_temperature': 0.11762269817205445, 'random_strength': 1.7270724605729662, 'grow_policy': 'Lossguide', 'min_data_in_leaf': 991, 'max_leaves': 177}. Best is trial 871 with value: 170.57272342910278.[0m
[32m[I 2024-10-13 11:57:01,617][0m Trial 878 finished with value: 254.23046040857307 and parameters: {'depth': 3, 'learning_rate': 0.019202082818970026, 'iterations': 2325, 'l2_leaf_reg': 4.880459250861013, 'border_count': 1, 'bagging_temperature': 0.1455406670472353, 'random_strength': 1.8636939161963633, 'grow_policy': 'Lossguide', 'min_data_in_leaf': 982, 'max_leaves': 124}. Best is trial 871 with value: 170.57272342910278.[0m
[32m[I 2024-10-13 11:57:04,012][0m Trial 879 finished with value: 204.34875509509084 and parameters: {'depth': 3, 'learning_rate': 0.019402739277005043, 'iterations': 2571, 'l2_leaf_reg': 3.7087134277362424, 'border_count': 17, 'bagging_temperature': 0.13540914249191682, 'random_strength': 2.052575084028429, 'grow_policy': 'Lossguide', 'min_data_in_leaf': 976, 'max_leaves': 149}. Best is trial 871 with value: 170.57272342910278.[0m
[32m[I 2024-10-13 11:57:06,278][0m Trial 880 finished with value: 201.73021206344305 and parameters: {'depth': 3, 'learning_rate': 0.022750979542659873, 'iterations': 2288, 'l2_leaf_reg': 6.391796451048443, 'border_count': 10, 'bagging_temperature': 0.11172667840622799, 'random_strength': 1.6084362281666866, 'grow_policy': 'Lossguide', 'min_data_in_leaf': 990, 'max_leaves': 167}. Best is trial 871 with value: 170.57272342910278.[0m
[32m[I 2024-10-13 11:57:08,563][0m Trial 881 finished with value: 212.54062637779944 and parameters: {'depth': 3, 'learning_rate': 0.016887305905132752, 'iterations': 2386, 'l2_leaf_reg': 3.140425777744559, 'border_count': 24, 'bagging_temperature': 0.08369745493738279, 'random_strength': 2.1260513602613, 'grow_policy': 'Lossguide', 'min_data_in_leaf': 915, 'max_leaves': 163}. Best is trial 871 with value: 170.57272342910278.[0m
[32m[I 2024-10-13 11:57:10,802][0m Trial 882 finished with value: 171.25176710488756 and parameters: {'depth': 3, 'learning_rate': 0.019486649542219056, 'iterations': 2362, 'l2_leaf_reg': 9.702299922208752, 'border_count': 5, 'bagging_temperature': 0.13032313647876573, 'random_strength': 1.724986675352193, 'grow_policy': 'Lossguide', 'min_data_in_leaf': 927, 'max_leaves': 157}. Best is trial 871 with value: 170.57272342910278.[0m
[32m[I 2024-10-13 11:57:13,089][0m Trial 883 finished with value: 171.68530640138982 and parameters: {'depth': 3, 'learning_rate': 0.026197529107895585, 'iterations': 2421, 'l2_leaf_reg': 9.751238306987183, 'border_count': 5, 'bagging_temperature': 0.11103274445452072, 'random_strength': 1.8570942018321384, 'grow_policy': 'Lossguide', 'min_data_in_leaf': 932, 'max_leaves': 156}. Best is trial 871 with value: 170.57272342910278.[0m
[32m[I 2024-10-13 11:57:15,374][0m Trial 884 finished with value: 216.62218778501165 and parameters: {'depth': 3, 'learning_rate': 0.03159226460086074, 'iterations': 2353, 'l2_leaf_reg': 6.810516333944184, 'border_count': 13, 'bagging_temperature': 0.13885678432737553, 'random_strength': 1.7178506084703846, 'grow_policy': 'Lossguide', 'min_data_in_leaf': 951, 'max_leaves': 145}. Best is trial 871 with value: 170.57272342910278.[0m
[32m[I 2024-10-13 11:57:17,548][0m Trial 885 finished with value: 254.413197689343 and parameters: {'depth': 3, 'learning_rate': 0.02367140947687629, 'iterations': 2231, 'l2_leaf_reg': 9.901402183717442, 'border_count': 1, 'bagging_temperature': 0.13636868181759593, 'random_strength': 2.3667232761791337, 'grow_policy': 'Lossguide', 'min_data_in_leaf': 933, 'max_leaves': 170}. Best is trial 871 with value: 170.57272342910278.[0m
[32m[I 2024-10-13 11:57:19,833][0m Trial 886 finished with value: 173.1352819425083 and parameters: {'depth': 3, 'learning_rate': 0.020061543409718795, 'iterations': 2407, 'l2_leaf_reg': 4.388330883913659, 'border_count': 7, 'bagging_temperature': 0.1366839927018578, 'random_strength': 1.9845735055507403, 'grow_policy': 'Lossguide', 'min_data_in_leaf': 977, 'max_leaves': 150}. Best is trial 871 with value: 170.57272342910278.[0m
[32m[I 2024-10-13 11:57:22,076][0m Trial 887 finished with value: 201.92284836837186 and parameters: {'depth': 3, 'learning_rate': 0.020401423962652498, 'iterations': 2337, 'l2_leaf_reg': 6.01081201488571, 'border_count': 18, 'bagging_temperature': 0.12121199322648149, 'random_strength': 1.6432366575582056, 'grow_policy': 'Lossguide', 'min_data_in_leaf': 905, 'max_leaves': 139}. Best is trial 871 with value: 170.57272342910278.[0m
[32m[I 2024-10-13 11:57:24,243][0m Trial 888 finished with value: 204.6244542644964 and parameters: {'depth': 3, 'learning_rate': 0.02568220250793595, 'iterations': 2295, 'l2_leaf_reg': 2.7238802911732543, 'border_count': 10, 'bagging_temperature': 0.10134429385187342, 'random_strength': 1.6295757223801846, 'grow_policy': 'Lossguide', 'min_data_in_leaf': 964, 'max_leaves': 159}. Best is trial 871 with value: 170.57272342910278.[0m
[32m[I 2024-10-13 11:57:26,621][0m Trial 889 finished with value: 218.0261649520183 and parameters: {'depth': 3, 'learning_rate': 0.018819970909664793, 'iterations': 2507, 'l2_leaf_reg': 0.07307080504401767, 'border_count': 13, 'bagging_temperature': 0.1651368640096869, 'random_strength': 1.8522119440892715, 'grow_policy': 'Lossguide', 'min_data_in_leaf': 918, 'max_leaves': 175}. Best is trial 871 with value: 170.57272342910278.[0m
[32m[I 2024-10-13 11:57:28,919][0m Trial 890 finished with value: 174.96267338720673 and parameters: {'depth': 3, 'learning_rate': 0.04352869066036534, 'iterations': 2469, 'l2_leaf_reg': 9.927479952502694, 'border_count': 5, 'bagging_temperature': 0.0981421506607863, 'random_strength': 2.172681958412004, 'grow_policy': 'Lossguide', 'min_data_in_leaf': 949, 'max_leaves': 153}. Best is trial 871 with value: 170.57272342910278.[0m
[32m[I 2024-10-13 11:57:31,210][0m Trial 891 finished with value: 216.0618108553571 and parameters: {'depth': 3, 'learning_rate': 0.002478118506440042, 'iterations': 2377, 'l2_leaf_reg': 6.453574733784717, 'border_count': 49, 'bagging_temperature': 0.17446469048051222, 'random_strength': 1.6450962957205435, 'grow_policy': 'Lossguide', 'min_data_in_leaf': 909, 'max_leaves': 182}. Best is trial 871 with value: 170.57272342910278.[0m
[32m[I 2024-10-13 11:57:33,462][0m Trial 892 finished with value: 181.472109813578 and parameters: {'depth': 3, 'learning_rate': 0.01663667636449974, 'iterations': 2238, 'l2_leaf_reg': 0.15503362021098196, 'border_count': 9, 'bagging_temperature': 0.11563912240710672, 'random_strength': 1.9986404568920573, 'grow_policy': 'Lossguide', 'min_data_in_leaf': 998, 'max_leaves': 212}. Best is trial 871 with value: 170.57272342910278.[0m
[32m[I 2024-10-13 11:57:35,763][0m Trial 893 finished with value: 255.18336065392526 and parameters: {'depth': 3, 'learning_rate': 0.02332762941799666, 'iterations': 2439, 'l2_leaf_reg': 1.538375315874347, 'border_count': 1, 'bagging_temperature': 0.08501300714434093, 'random_strength': 1.8391028179463715, 'grow_policy': 'Lossguide', 'min_data_in_leaf': 945, 'max_leaves': 191}. Best is trial 871 with value: 170.57272342910278.[0m
[32m[I 2024-10-13 11:57:37,940][0m Trial 894 finished with value: 198.55269424652317 and parameters: {'depth': 3, 'learning_rate': 0.015501312030914814, 'iterations': 2300, 'l2_leaf_reg': 5.189784877690166, 'border_count': 16, 'bagging_temperature': 0.1542490322654974, 'random_strength': 1.6440209405838289, 'grow_policy': 'Lossguide', 'min_data_in_leaf': 894, 'max_leaves': 165}. Best is trial 871 with value: 170.57272342910278.[0m
[32m[I 2024-10-13 11:57:40,198][0m Trial 895 finished with value: 219.89576129269062 and parameters: {'depth': 3, 'learning_rate': 0.018730469187013078, 'iterations': 2343, 'l2_leaf_reg': 4.075872355829756, 'border_count': 21, 'bagging_temperature': 0.1296407593290951, 'random_strength': 1.578903268383293, 'grow_policy': 'Lossguide', 'min_data_in_leaf': 929, 'max_leaves': 219}. Best is trial 871 with value: 170.57272342910278.[0m
[32m[I 2024-10-13 11:57:42,407][0m Trial 896 finished with value: 174.863988589222 and parameters: {'depth': 3, 'learning_rate': 0.0281692767395048, 'iterations': 2197, 'l2_leaf_reg': 2.5266720066220953, 'border_count': 8, 'bagging_temperature': 0.07514168076209264, 'random_strength': 2.1580208433207644, 'grow_policy': 'Lossguide', 'min_data_in_leaf': 967, 'max_leaves': 130}. Best is trial 871 with value: 170.57272342910278.[0m
[32m[I 2024-10-13 11:57:44,834][0m Trial 897 finished with value: 173.65467056669286 and parameters: {'depth': 3, 'learning_rate': 0.021994888000350033, 'iterations': 2565, 'l2_leaf_reg': 0.2861436504376832, 'border_count': 5, 'bagging_temperature': 0.08828998463373844, 'random_strength': 2.3327549940083756, 'grow_policy': 'Lossguide', 'min_data_in_leaf': 981, 'max_leaves': 161}. Best is trial 871 with value: 170.57272342910278.[0m
[32m[I 2024-10-13 11:57:47,146][0m Trial 898 finished with value: 206.92433907212967 and parameters: {'depth': 3, 'learning_rate': 0.01529363639053456, 'iterations': 2404, 'l2_leaf_reg': 6.799285762157439, 'border_count': 13, 'bagging_temperature': 0.10253384228881433, 'random_strength': 1.8411807741076087, 'grow_policy': 'Lossguide', 'min_data_in_leaf': 911, 'max_leaves': 144}. Best is trial 871 with value: 170.57272342910278.[0m
[32m[I 2024-10-13 11:57:49,367][0m Trial 899 finished with value: 178.874908822599 and parameters: {'depth': 3, 'learning_rate': 0.017335564314768428, 'iterations': 2234, 'l2_leaf_reg': 4.248446950473125, 'border_count': 9, 'bagging_temperature': 0.08587202100173993, 'random_strength': 1.503581228860262, 'grow_policy': 'Lossguide', 'min_data_in_leaf': 930, 'max_leaves': 186}. Best is trial 871 with value: 170.57272342910278.[0m
[32m[I 2024-10-13 11:57:51,577][0m Trial 900 finished with value: 254.05175426915451 and parameters: {'depth': 3, 'learning_rate': 0.020152748788218936, 'iterations': 2330, 'l2_leaf_reg': 6.732318028704384, 'border_count': 1, 'bagging_temperature': 0.18774007044741195, 'random_strength': 1.9509824585208855, 'grow_policy': 'Lossguide', 'min_data_in_leaf': 866, 'max_leaves': 172}. Best is trial 871 with value: 170.57272342910278.[0m
[32m[I 2024-10-13 11:57:53,710][0m Trial 901 finished with value: 198.55442996115548 and parameters: {'depth': 3, 'learning_rate': 0.014064511645093425, 'iterations': 2171, 'l2_leaf_reg': 4.062074899681646, 'border_count': 16, 'bagging_temperature': 0.12488874855032077, 'random_strength': 2.534082505594301, 'grow_policy': 'Lossguide', 'min_data_in_leaf': 891, 'max_leaves': 44}. Best is trial 871 with value: 170.57272342910278.[0m
[32m[I 2024-10-13 11:57:55,920][0m Trial 902 finished with value: 171.93377014764084 and parameters: {'depth': 3, 'learning_rate': 0.01644565136840054, 'iterations': 2278, 'l2_leaf_reg': 9.36176050573231, 'border_count': 6, 'bagging_temperature': 0.10322099044650626, 'random_strength': 1.6809267651116386, 'grow_policy': 'Lossguide', 'min_data_in_leaf': 940, 'max_leaves': 135}. Best is trial 871 with value: 170.57272342910278.[0m
[32m[I 2024-10-13 11:57:58,238][0m Trial 903 finished with value: 199.51896431022487 and parameters: {'depth': 3, 'learning_rate': 0.018447872738896164, 'iterations': 2432, 'l2_leaf_reg': 6.419516134578759, 'border_count': 10, 'bagging_temperature': 0.20740971375202527, 'random_strength': 1.474277235508646, 'grow_policy': 'Lossguide', 'min_data_in_leaf': 853, 'max_leaves': 156}. Best is trial 871 with value: 170.57272342910278.[0m
[32m[I 2024-10-13 11:58:00,597][0m Trial 904 finished with value: 253.89825337450173 and parameters: {'depth': 3, 'learning_rate': 0.031629213825688035, 'iterations': 2518, 'l2_leaf_reg': 1.9203306821426325, 'border_count': 116, 'bagging_temperature': 0.07937883200092191, 'random_strength': 2.041177853842223, 'grow_policy': 'Lossguide', 'min_data_in_leaf': 911, 'max_leaves': 150}. Best is trial 871 with value: 170.57272342910278.[0m
[32m[I 2024-10-13 11:58:02,848][0m Trial 905 finished with value: 171.75155082425516 and parameters: {'depth': 3, 'learning_rate': 0.014327168999584809, 'iterations': 2372, 'l2_leaf_reg': 9.9733359633981, 'border_count': 5, 'bagging_temperature': 0.1511915943902579, 'random_strength': 1.7914124800316313, 'grow_policy': 'Lossguide', 'min_data_in_leaf': 966, 'max_leaves': 81}. Best is trial 871 with value: 170.57272342910278.[0m
[32m[I 2024-10-13 11:58:05,291][0m Trial 906 finished with value: 215.38889710923178 and parameters: {'depth': 3, 'learning_rate': 0.023129446743373767, 'iterations': 2672, 'l2_leaf_reg': 4.035701652346509, 'border_count': 27, 'bagging_temperature': 0.08778365665428757, 'random_strength': 2.2765616446174053, 'grow_policy': 'Lossguide', 'min_data_in_leaf': 889, 'max_leaves': 168}. Best is trial 871 with value: 170.57272342910278.[0m
[32m[I 2024-10-13 11:58:07,507][0m Trial 907 finished with value: 254.1905320244782 and parameters: {'depth': 3, 'learning_rate': 0.017918626543120406, 'iterations': 2297, 'l2_leaf_reg': 3.0033009783477445, 'border_count': 1, 'bagging_temperature': 0.10928252469953502, 'random_strength': 1.4615994252628997, 'grow_policy': 'Lossguide', 'min_data_in_leaf': 868, 'max_leaves': 139}. Best is trial 871 with value: 170.57272342910278.[0m
[32m[I 2024-10-13 11:58:09,674][0m Trial 908 finished with value: 199.86389009920757 and parameters: {'depth': 3, 'learning_rate': 0.0030979768994012988, 'iterations': 2208, 'l2_leaf_reg': 0.5947132920228739, 'border_count': 13, 'bagging_temperature': 0.07869797521679253, 'random_strength': 1.6870229075739926, 'grow_policy': 'Lossguide', 'min_data_in_leaf': 942, 'max_leaves': 198}. Best is trial 871 with value: 170.57272342910278.[0m
[32m[I 2024-10-13 11:58:11,932][0m Trial 909 finished with value: 202.1101583715668 and parameters: {'depth': 3, 'learning_rate': 0.015046454901280685, 'iterations': 2359, 'l2_leaf_reg': 1.0908718341278083, 'border_count': 20, 'bagging_temperature': 0.0810074329838055, 'random_strength': 1.8277170461285488, 'grow_policy': 'Lossguide', 'min_data_in_leaf': 854, 'max_leaves': 180}. Best is trial 871 with value: 170.57272342910278.[0m
[32m[I 2024-10-13 11:58:14,034][0m Trial 910 finished with value: 178.40254946704863 and parameters: {'depth': 3, 'learning_rate': 0.026387896907095403, 'iterations': 2152, 'l2_leaf_reg': 6.3675026735605105, 'border_count': 9, 'bagging_temperature': 0.13162272952736856, 'random_strength': 2.061095906480266, 'grow_policy': 'Lossguide', 'min_data_in_leaf': 921, 'max_leaves': 163}. Best is trial 871 with value: 170.57272342910278.[0m
[32m[I 2024-10-13 11:58:16,353][0m Trial 911 finished with value: 225.38417484970824 and parameters: {'depth': 3, 'learning_rate': 0.019954691537626718, 'iterations': 2469, 'l2_leaf_reg': 9.963923611030397, 'border_count': 41, 'bagging_temperature': 0.06910914470087903, 'random_strength': 1.3828791223267587, 'grow_policy': 'Lossguide', 'min_data_in_leaf': 892, 'max_leaves': 60}. Best is trial 871 with value: 170.57272342910278.[0m
[32m[I 2024-10-13 11:58:18,529][0m Trial 912 finished with value: 204.74983894254103 and parameters: {'depth': 3, 'learning_rate': 0.014152323646794397, 'iterations': 2256, 'l2_leaf_reg': 4.991592381791197, 'border_count': 15, 'bagging_temperature': 0.07831567641564924, 'random_strength': 1.4349750370143441, 'grow_policy': 'Lossguide', 'min_data_in_leaf': 989, 'max_leaves': 147}. Best is trial 871 with value: 170.57272342910278.[0m
[32m[I 2024-10-13 11:58:20,802][0m Trial 913 finished with value: 172.08060652867002 and parameters: {'depth': 3, 'learning_rate': 0.01672357648651794, 'iterations': 2380, 'l2_leaf_reg': 2.396190584465529, 'border_count': 5, 'bagging_temperature': 0.09927385359056938, 'random_strength': 1.6196658851266856, 'grow_policy': 'Lossguide', 'min_data_in_leaf': 963, 'max_leaves': 175}. Best is trial 871 with value: 170.57272342910278.[0m
[32m[I 2024-10-13 11:58:23,113][0m Trial 914 finished with value: 202.13222844817508 and parameters: {'depth': 3, 'learning_rate': 0.02138899560763745, 'iterations': 2468, 'l2_leaf_reg': 6.685904718474365, 'border_count': 10, 'bagging_temperature': 0.1151937333957422, 'random_strength': 1.9417954435877738, 'grow_policy': 'Lossguide', 'min_data_in_leaf': 854, 'max_leaves': 156}. Best is trial 871 with value: 170.57272342910278.[0m
[32m[I 2024-10-13 11:58:25,346][0m Trial 915 finished with value: 253.8132216969354 and parameters: {'depth': 3, 'learning_rate': 0.014024814355082396, 'iterations': 2310, 'l2_leaf_reg': 3.54253339232611, 'border_count': 1, 'bagging_temperature': 0.06806829157704705, 'random_strength': 1.5911088714550046, 'grow_policy': 'Lossguide', 'min_data_in_leaf': 980, 'max_leaves': 165}. Best is trial 871 with value: 170.57272342910278.[0m
[32m[I 2024-10-13 11:58:27,756][0m Trial 916 finished with value: 176.61153570498374 and parameters: {'depth': 3, 'learning_rate': 0.003813558718792947, 'iterations': 2545, 'l2_leaf_reg': 5.22540185386969, 'border_count': 6, 'bagging_temperature': 0.06688822047822988, 'random_strength': 1.8247856092857984, 'grow_policy': 'Lossguide', 'min_data_in_leaf': 878, 'max_leaves': 126}. Best is trial 871 with value: 170.57272342910278.[0m
