[32m[I 2024-10-13 11:40:19,732][0m Trial 409 finished with value: 198.63927958766078 and parameters: {'depth': 5, 'learning_rate': 0.01780388560295951, 'iterations': 1557, 'l2_leaf_reg': 6.463890810062577e-07, 'border_count': 17, 'bagging_temperature': 0.974385359765953, 'random_strength': 0.3106846488059671, 'grow_policy': 'Depthwise', 'min_data_in_leaf': 766}. Best is trial 306 with value: 170.64979827273262.[0m
[32m[I 2024-10-13 11:40:21,433][0m Trial 410 finished with value: 199.01777198337652 and parameters: {'depth': 5, 'learning_rate': 0.012244826105633488, 'iterations': 1643, 'l2_leaf_reg': 4.240762046530533e-06, 'border_count': 10, 'bagging_temperature': 0.04882957018246703, 'random_strength': 1.1442040036257564, 'grow_policy': 'Depthwise', 'min_data_in_leaf': 647}. Best is trial 306 with value: 170.64979827273262.[0m
[32m[I 2024-10-13 11:40:27,595][0m Trial 411 finished with value: 243.52125821930457 and parameters: {'depth': 4, 'learning_rate': 0.03565399561895965, 'iterations': 1827, 'l2_leaf_reg': 1.6068478392311718e-06, 'border_count': 1, 'bagging_temperature': 0.07845004611811904, 'random_strength': 0.5847300691429291, 'grow_policy': 'SymmetricTree', 'min_data_in_leaf': 557}. Best is trial 306 with value: 170.64979827273262.[0m
[32m[I 2024-10-13 11:40:29,434][0m Trial 412 finished with value: 219.50128252743838 and parameters: {'depth': 6, 'learning_rate': 0.0285243494539977, 'iterations': 1728, 'l2_leaf_reg': 3.3593315375962637e-07, 'border_count': 23, 'bagging_temperature': 0.034185457658567356, 'random_strength': 0.9566729785056991, 'grow_policy': 'Depthwise', 'min_data_in_leaf': 598}. Best is trial 306 with value: 170.64979827273262.[0m
[32m[I 2024-10-13 11:40:31,170][0m Trial 413 finished with value: 173.88674142837067 and parameters: {'depth': 6, 'learning_rate': 0.02339101563050407, 'iterations': 1589, 'l2_leaf_reg': 2.4523803397798213e-06, 'border_count': 6, 'bagging_temperature': 0.057471162882000326, 'random_strength': 0.21141241222232293, 'grow_policy': 'Depthwise', 'min_data_in_leaf': 663}. Best is trial 306 with value: 170.64979827273262.[0m
[32m[I 2024-10-13 11:40:33,173][0m Trial 414 finished with value: 204.39887841671631 and parameters: {'depth': 5, 'learning_rate': 0.017203630943856577, 'iterations': 1875, 'l2_leaf_reg': 1.1928022944436353e-06, 'border_count': 13, 'bagging_temperature': 0.7475896527321102, 'random_strength': 0.6741665831039069, 'grow_policy': 'Depthwise', 'min_data_in_leaf': 709}. Best is trial 306 with value: 170.64979827273262.[0m
[32m[I 2024-10-13 11:40:35,124][0m Trial 415 finished with value: 170.93776193432845 and parameters: {'depth': 4, 'learning_rate': 0.01487393466948924, 'iterations': 1788, 'l2_leaf_reg': 1.991308543553842e-06, 'border_count': 8, 'bagging_temperature': 0.017692734808316887, 'random_strength': 0.3999137069030583, 'grow_policy': 'Depthwise', 'min_data_in_leaf': 619}. Best is trial 306 with value: 170.64979827273262.[0m
[32m[I 2024-10-13 11:40:37,094][0m Trial 416 finished with value: 196.16459079816082 and parameters: {'depth': 4, 'learning_rate': 0.011806195358013584, 'iterations': 1928, 'l2_leaf_reg': 5.9371915941272695e-06, 'border_count': 19, 'bagging_temperature': 0.8105362802281898, 'random_strength': 0.3680241689126162, 'grow_policy': 'Depthwise', 'min_data_in_leaf': 632}. Best is trial 306 with value: 170.64979827273262.[0m
[32m[I 2024-10-13 11:40:39,006][0m Trial 417 finished with value: 204.25831342645841 and parameters: {'depth': 4, 'learning_rate': 0.013858258478088031, 'iterations': 1808, 'l2_leaf_reg': 1.8200404055839867e-06, 'border_count': 11, 'bagging_temperature': 0.01762895489203224, 'random_strength': 0.15890113235314451, 'grow_policy': 'Depthwise', 'min_data_in_leaf': 618}. Best is trial 306 with value: 170.64979827273262.[0m
[32m[I 2024-10-13 11:40:40,840][0m Trial 418 finished with value: 201.92256495484668 and parameters: {'depth': 4, 'learning_rate': 0.010251747102603768, 'iterations': 1673, 'l2_leaf_reg': 2.4451910403885455e-06, 'border_count': 15, 'bagging_temperature': 0.0035060648770949727, 'random_strength': 0.8426963274054701, 'grow_policy': 'Depthwise', 'min_data_in_leaf': 677}. Best is trial 306 with value: 170.64979827273262.[0m
[32m[I 2024-10-13 11:40:42,570][0m Trial 419 finished with value: 198.7425219137401 and parameters: {'depth': 4, 'learning_rate': 0.0064330703510302335, 'iterations': 1553, 'l2_leaf_reg': 6.796447374268446e-07, 'border_count': 38, 'bagging_temperature': 0.019984229595556638, 'random_strength': 0.348839168433992, 'grow_policy': 'Depthwise', 'min_data_in_leaf': 952}. Best is trial 306 with value: 170.64979827273262.[0m
[32m[I 2024-10-13 11:40:44,344][0m Trial 420 finished with value: 172.9382877749707 and parameters: {'depth': 4, 'learning_rate': 0.014505072895796845, 'iterations': 1636, 'l2_leaf_reg': 4.19278915458357e-06, 'border_count': 7, 'bagging_temperature': 0.07697989815817004, 'random_strength': 1.2013183287511093, 'grow_policy': 'Depthwise', 'min_data_in_leaf': 658}. Best is trial 306 with value: 170.64979827273262.[0m
[32m[I 2024-10-13 11:40:46,168][0m Trial 421 finished with value: 253.9698197418024 and parameters: {'depth': 4, 'learning_rate': 0.01623182943726559, 'iterations': 1709, 'l2_leaf_reg': 3.2253712345997837e-06, 'border_count': 1, 'bagging_temperature': 0.0008102013130005734, 'random_strength': 0.6882425552418585, 'grow_policy': 'Depthwise', 'min_data_in_leaf': 821}. Best is trial 306 with value: 170.64979827273262.[0m
[32m[I 2024-10-13 11:40:48,125][0m Trial 422 finished with value: 179.94813682230736 and parameters: {'depth': 4, 'learning_rate': 0.01367367382245703, 'iterations': 1805, 'l2_leaf_reg': 1.7706757368023563e-06, 'border_count': 9, 'bagging_temperature': 0.031056610649139258, 'random_strength': 1.0166938223293311, 'grow_policy': 'Depthwise', 'min_data_in_leaf': 612}. Best is trial 306 with value: 170.64979827273262.[0m
[32m[I 2024-10-13 11:40:49,860][0m Trial 423 finished with value: 208.75755799028727 and parameters: {'depth': 3, 'learning_rate': 0.018304030010531144, 'iterations': 1586, 'l2_leaf_reg': 8.406829032437607e-07, 'border_count': 15, 'bagging_temperature': 0.058734629786788776, 'random_strength': 0.5052770426310546, 'grow_policy': 'Depthwise', 'min_data_in_leaf': 645}. Best is trial 306 with value: 170.64979827273262.[0m
[32m[I 2024-10-13 11:40:51,797][0m Trial 424 finished with value: 177.23145909716703 and parameters: {'depth': 5, 'learning_rate': 0.02188842072335572, 'iterations': 1891, 'l2_leaf_reg': 1.4672035996798872e-06, 'border_count': 6, 'bagging_temperature': 0.34948019510253336, 'random_strength': 0.12369621307157758, 'grow_policy': 'Depthwise', 'min_data_in_leaf': 691}. Best is trial 306 with value: 170.64979827273262.[0m
[32m[I 2024-10-13 11:40:53,523][0m Trial 425 finished with value: 200.32669411929578 and parameters: {'depth': 5, 'learning_rate': 0.002818389755771472, 'iterations': 1530, 'l2_leaf_reg': 3.08028872751397e-06, 'border_count': 20, 'bagging_temperature': 0.04068824516034667, 'random_strength': 0.7486334611425184, 'grow_policy': 'Depthwise', 'min_data_in_leaf': 641}. Best is trial 306 with value: 170.64979827273262.[0m
[32m[I 2024-10-13 11:40:55,478][0m Trial 426 finished with value: 205.5131140552359 and parameters: {'depth': 4, 'learning_rate': 0.02872053102937326, 'iterations': 1752, 'l2_leaf_reg': 4.410943490341433e-07, 'border_count': 10, 'bagging_temperature': 0.019112848171315068, 'random_strength': 0.3505020543387427, 'grow_policy': 'Depthwise', 'min_data_in_leaf': 604}. Best is trial 306 with value: 170.64979827273262.[0m
[32m[I 2024-10-13 11:40:57,396][0m Trial 427 finished with value: 172.8674740446629 and parameters: {'depth': 4, 'learning_rate': 0.016103380737956596, 'iterations': 1642, 'l2_leaf_reg': 1.057142696032677e-05, 'border_count': 5, 'bagging_temperature': 0.08889343948979934, 'random_strength': 0.008077224535868607, 'grow_policy': 'Depthwise', 'min_data_in_leaf': 628}. Best is trial 306 with value: 170.64979827273262.[0m
[32m[I 2024-10-13 11:40:58,844][0m Trial 428 finished with value: 201.63753478338626 and parameters: {'depth': 3, 'learning_rate': 0.00460742331293734, 'iterations': 1190, 'l2_leaf_reg': 9.006497508139646e-07, 'border_count': 14, 'bagging_temperature': 0.059378375813958266, 'random_strength': 0.9563531994302105, 'grow_policy': 'Depthwise', 'min_data_in_leaf': 668}. Best is trial 306 with value: 170.64979827273262.[0m
[32m[I 2024-10-13 11:41:00,641][0m Trial 429 finished with value: 172.16320512237914 and parameters: {'depth': 4, 'learning_rate': 0.024853812945173394, 'iterations': 1690, 'l2_leaf_reg': 0.0003897265404326693, 'border_count': 5, 'bagging_temperature': 0.03165595941144999, 'random_strength': 0.589494471736524, 'grow_policy': 'Depthwise', 'min_data_in_leaf': 629}. Best is trial 306 with value: 170.64979827273262.[0m
[32m[I 2024-10-13 11:41:02,460][0m Trial 430 finished with value: 256.06654049709556 and parameters: {'depth': 4, 'learning_rate': 0.041306095246225666, 'iterations': 1714, 'l2_leaf_reg': 0.00033934853792359993, 'border_count': 1, 'bagging_temperature': 0.0005486910076247936, 'random_strength': 0.5206658624463018, 'grow_policy': 'Depthwise', 'min_data_in_leaf': 868}. Best is trial 306 with value: 170.64979827273262.[0m
[32m[I 2024-10-13 11:41:04,361][0m Trial 431 finished with value: 176.02820072365998 and parameters: {'depth': 4, 'learning_rate': 0.02569850515681647, 'iterations': 1781, 'l2_leaf_reg': 0.0002722524328445057, 'border_count': 9, 'bagging_temperature': 0.02506503671948271, 'random_strength': 0.3371827296044847, 'grow_policy': 'Depthwise', 'min_data_in_leaf': 620}. Best is trial 306 with value: 170.64979827273262.[0m
[32m[I 2024-10-13 11:41:06,230][0m Trial 432 finished with value: 258.7690836133751 and parameters: {'depth': 4, 'learning_rate': 0.03333170791511291, 'iterations': 1676, 'l2_leaf_reg': 0.9254174554727598, 'border_count': 146, 'bagging_temperature': 0.03526351872942518, 'random_strength': 0.6004530115260232, 'grow_policy': 'Depthwise', 'min_data_in_leaf': 595}. Best is trial 306 with value: 170.64979827273262.[0m
[32m[I 2024-10-13 11:41:08,148][0m Trial 433 finished with value: 227.89103393797265 and parameters: {'depth': 3, 'learning_rate': 0.008001715711466741, 'iterations': 1847, 'l2_leaf_reg': 0.0004771934428264267, 'border_count': 75, 'bagging_temperature': 0.016141036957743795, 'random_strength': 0.23889092355435654, 'grow_policy': 'Depthwise', 'min_data_in_leaf': 629}. Best is trial 306 with value: 170.64979827273262.[0m
[32m[I 2024-10-13 11:41:09,933][0m Trial 434 finished with value: 253.8683314899864 and parameters: {'depth': 4, 'learning_rate': 0.020060425554885773, 'iterations': 1622, 'l2_leaf_reg': 0.000488562438247942, 'border_count': 1, 'bagging_temperature': 0.04082847259075811, 'random_strength': 0.7505598973675767, 'grow_policy': 'Depthwise', 'min_data_in_leaf': 650}. Best is trial 306 with value: 170.64979827273262.[0m
[32m[I 2024-10-13 11:41:11,904][0m Trial 435 finished with value: 200.38614479072916 and parameters: {'depth': 5, 'learning_rate': 0.012106622872097223, 'iterations': 1978, 'l2_leaf_reg': 0.00021730917444456253, 'border_count': 10, 'bagging_temperature': 0.00039320394616569956, 'random_strength': 0.4880744205124551, 'grow_policy': 'Depthwise', 'min_data_in_leaf': 608}. Best is trial 306 with value: 170.64979827273262.[0m
[32m[I 2024-10-13 11:41:13,856][0m Trial 436 finished with value: 253.64627191465775 and parameters: {'depth': 4, 'learning_rate': 0.024324457183190776, 'iterations': 1726, 'l2_leaf_reg': 2.6485617431982296e-07, 'border_count': 155, 'bagging_temperature': 0.06959886749866614, 'random_strength': 0.6868646412743558, 'grow_policy': 'Depthwise', 'min_data_in_leaf': 585}. Best is trial 306 with value: 170.64979827273262.[0m
[32m[I 2024-10-13 11:41:15,598][0m Trial 437 finished with value: 172.04877313124635 and parameters: {'depth': 5, 'learning_rate': 0.01746804549396427, 'iterations': 1580, 'l2_leaf_reg': 0.0010212106011168668, 'border_count': 5, 'bagging_temperature': 0.04431732646067977, 'random_strength': 0.14733972429874387, 'grow_policy': 'Depthwise', 'min_data_in_leaf': 627}. Best is trial 306 with value: 170.64979827273262.[0m
[32m[I 2024-10-13 11:41:17,374][0m Trial 438 finished with value: 234.1958260755063 and parameters: {'depth': 5, 'learning_rate': 0.0007933379272702732, 'iterations': 1605, 'l2_leaf_reg': 0.0012319906349418368, 'border_count': 5, 'bagging_temperature': 0.031009674715553437, 'random_strength': 0.01110814801595672, 'grow_policy': 'Depthwise', 'min_data_in_leaf': 650}. Best is trial 306 with value: 170.64979827273262.[0m
[32m[I 2024-10-13 11:41:19,076][0m Trial 439 finished with value: 253.57052854374137 and parameters: {'depth': 5, 'learning_rate': 0.019152965501953997, 'iterations': 1534, 'l2_leaf_reg': 0.00081011152603659, 'border_count': 1, 'bagging_temperature': 0.048348869096245, 'random_strength': 0.32296427681604023, 'grow_policy': 'Depthwise', 'min_data_in_leaf': 630}. Best is trial 306 with value: 170.64979827273262.[0m
[32m[I 2024-10-13 11:41:20,849][0m Trial 440 finished with value: 218.2478847097324 and parameters: {'depth': 5, 'learning_rate': 0.02980956435359952, 'iterations': 1670, 'l2_leaf_reg': 0.0004696722884750542, 'border_count': 14, 'bagging_temperature': 0.01955321256022618, 'random_strength': 0.285791395446435, 'grow_policy': 'Depthwise', 'min_data_in_leaf': 606}. Best is trial 306 with value: 170.64979827273262.[0m
[32m[I 2024-10-13 11:41:22,581][0m Trial 441 finished with value: 173.77123201278485 and parameters: {'depth': 5, 'learning_rate': 0.022981215992705327, 'iterations': 1596, 'l2_leaf_reg': 0.0015583863522232219, 'border_count': 6, 'bagging_temperature': 0.048166474124633124, 'random_strength': 0.2560551432048592, 'grow_policy': 'Depthwise', 'min_data_in_leaf': 671}. Best is trial 306 with value: 170.64979827273262.[0m
[32m[I 2024-10-13 11:41:24,423][0m Trial 442 finished with value: 201.331701822004 and parameters: {'depth': 5, 'learning_rate': 0.01727042637897438, 'iterations': 1681, 'l2_leaf_reg': 0.0008843697070123449, 'border_count': 17, 'bagging_temperature': 0.020268421289771094, 'random_strength': 0.15466410870744352, 'grow_policy': 'Depthwise', 'min_data_in_leaf': 650}. Best is trial 306 with value: 170.64979827273262.[0m
[32m[I 2024-10-13 11:41:26,255][0m Trial 443 finished with value: 218.33361969692348 and parameters: {'depth': 4, 'learning_rate': 0.02651724813716576, 'iterations': 1769, 'l2_leaf_reg': 0.00042639967951988014, 'border_count': 26, 'bagging_temperature': 0.03739181836826786, 'random_strength': 6.801214462913967, 'grow_policy': 'Depthwise', 'min_data_in_leaf': 618}. Best is trial 306 with value: 170.64979827273262.[0m
[32m[I 2024-10-13 11:41:28,045][0m Trial 444 finished with value: 203.45145725451448 and parameters: {'depth': 3, 'learning_rate': 0.02122405183909427, 'iterations': 1557, 'l2_leaf_reg': 0.001767817612703453, 'border_count': 10, 'bagging_temperature': 0.059044120566431615, 'random_strength': 0.4902468997891078, 'grow_policy': 'Depthwise', 'min_data_in_leaf': 589}. Best is trial 306 with value: 170.64979827273262.[0m
[32m[I 2024-10-13 11:41:29,905][0m Trial 445 finished with value: 171.5430234729675 and parameters: {'depth': 5, 'learning_rate': 0.016427626287447643, 'iterations': 1632, 'l2_leaf_reg': 0.0006726603637755965, 'border_count': 5, 'bagging_temperature': 0.017264020141289416, 'random_strength': 0.14755982765886783, 'grow_policy': 'Depthwise', 'min_data_in_leaf': 630}. Best is trial 306 with value: 170.64979827273262.[0m
[32m[I 2024-10-13 11:41:31,773][0m Trial 446 finished with value: 263.68517946566874 and parameters: {'depth': 5, 'learning_rate': 0.0005625348186580971, 'iterations': 1639, 'l2_leaf_reg': 0.0007023705391891154, 'border_count': 5, 'bagging_temperature': 0.015583773942895956, 'random_strength': 0.03286477653592529, 'grow_policy': 'Depthwise', 'min_data_in_leaf': 660}. Best is trial 306 with value: 170.64979827273262.[0m
[32m[I 2024-10-13 11:41:33,584][0m Trial 447 finished with value: 203.5923345630771 and parameters: {'depth': 5, 'learning_rate': 0.014956518149785589, 'iterations': 1586, 'l2_leaf_reg': 0.00026568160716493956, 'border_count': 11, 'bagging_temperature': 0.002906791633111659, 'random_strength': 0.142542360026723, 'grow_policy': 'Depthwise', 'min_data_in_leaf': 636}. Best is trial 306 with value: 170.64979827273262.[0m
[32m[I 2024-10-13 11:41:35,494][0m Trial 448 finished with value: 252.59887047911923 and parameters: {'depth': 5, 'learning_rate': 0.016607105739998816, 'iterations': 1692, 'l2_leaf_reg': 0.0008456181014960658, 'border_count': 1, 'bagging_temperature': 0.5174164299933924, 'random_strength': 0.4735017635846464, 'grow_policy': 'Depthwise', 'min_data_in_leaf': 684}. Best is trial 306 with value: 170.64979827273262.[0m
[32m[I 2024-10-13 11:41:37,413][0m Trial 449 finished with value: 200.53000516969286 and parameters: {'depth': 5, 'learning_rate': 0.014848140110992895, 'iterations': 1726, 'l2_leaf_reg': 0.0012609422930293657, 'border_count': 18, 'bagging_temperature': 0.023870571129679496, 'random_strength': 0.1677005853172625, 'grow_policy': 'Depthwise', 'min_data_in_leaf': 640}. Best is trial 306 with value: 170.64979827273262.[0m
[32m[I 2024-10-13 11:41:39,274][0m Trial 450 finished with value: 171.58316272612583 and parameters: {'depth': 5, 'learning_rate': 0.011277778493689874, 'iterations': 1621, 'l2_leaf_reg': 0.00036889283638291996, 'border_count': 8, 'bagging_temperature': 0.001067036643429395, 'random_strength': 0.00043537386386177657, 'grow_policy': 'Depthwise', 'min_data_in_leaf': 621}. Best is trial 306 with value: 170.64979827273262.[0m
[32m[I 2024-10-13 11:41:41,025][0m Trial 451 finished with value: 212.47753211346975 and parameters: {'depth': 5, 'learning_rate': 0.010519362134858823, 'iterations': 1524, 'l2_leaf_reg': 0.0003871201837464898, 'border_count': 22, 'bagging_temperature': 0.0008778735880285125, 'random_strength': 0.10832999997821172, 'grow_policy': 'Depthwise', 'min_data_in_leaf': 618}. Best is trial 306 with value: 170.64979827273262.[0m
[32m[I 2024-10-13 11:41:42,768][0m Trial 452 finished with value: 205.75869600080776 and parameters: {'depth': 5, 'learning_rate': 0.011728168791318466, 'iterations': 1622, 'l2_leaf_reg': 0.0005160091481172163, 'border_count': 13, 'bagging_temperature': 0.0007907694121273984, 'random_strength': 0.2630678200509235, 'grow_policy': 'Depthwise', 'min_data_in_leaf': 745}. Best is trial 306 with value: 170.64979827273262.[0m
[32m[I 2024-10-13 11:41:44,488][0m Trial 453 finished with value: 180.07790303784134 and parameters: {'depth': 5, 'learning_rate': 0.013288676656402066, 'iterations': 1568, 'l2_leaf_reg': 0.001143091023685399, 'border_count': 9, 'bagging_temperature': 0.02201711475901042, 'random_strength': 0.11989724004653815, 'grow_policy': 'Depthwise', 'min_data_in_leaf': 629}. Best is trial 306 with value: 170.64979827273262.[0m
[32m[I 2024-10-13 11:41:46,273][0m Trial 454 finished with value: 249.06164616808942 and parameters: {'depth': 5, 'learning_rate': 0.008954437472848418, 'iterations': 1643, 'l2_leaf_reg': 0.0005157846312420553, 'border_count': 170, 'bagging_temperature': 0.3101787077345629, 'random_strength': 0.36997035957962593, 'grow_policy': 'Depthwise', 'min_data_in_leaf': 659}. Best is trial 306 with value: 170.64979827273262.[0m
[32m[I 2024-10-13 11:41:51,893][0m Trial 455 finished with value: 178.78665998850738 and parameters: {'depth': 5, 'learning_rate': 0.0129685546328674, 'iterations': 1574, 'l2_leaf_reg': 2.332280068704367e-08, 'border_count': 6, 'bagging_temperature': 0.02057528145135237, 'random_strength': 0.04422915541702255, 'grow_policy': 'SymmetricTree', 'min_data_in_leaf': 717}. Best is trial 306 with value: 170.64979827273262.[0m
[32m[I 2024-10-13 11:41:53,569][0m Trial 456 finished with value: 203.48730320356 and parameters: {'depth': 5, 'learning_rate': 0.018001394916799352, 'iterations': 1504, 'l2_leaf_reg': 0.0006985889649770908, 'border_count': 14, 'bagging_temperature': 0.5544272855226371, 'random_strength': 0.33329510729689943, 'grow_policy': 'Depthwise', 'min_data_in_leaf': 606}. Best is trial 306 with value: 170.64979827273262.[0m
[32m[I 2024-10-13 11:41:55,372][0m Trial 457 finished with value: 179.5974581137065 and parameters: {'depth': 5, 'learning_rate': 0.015900234045963094, 'iterations': 1640, 'l2_leaf_reg': 0.006281223408008535, 'border_count': 9, 'bagging_temperature': 0.03858980706123246, 'random_strength': 0.5232177398678, 'grow_policy': 'Depthwise', 'min_data_in_leaf': 639}. Best is trial 306 with value: 170.64979827273262.[0m
[32m[I 2024-10-13 11:41:57,199][0m Trial 458 finished with value: 253.92395548230607 and parameters: {'depth': 5, 'learning_rate': 0.010800933336422621, 'iterations': 1696, 'l2_leaf_reg': 0.0010346717668926842, 'border_count': 1, 'bagging_temperature': 0.016017356354616936, 'random_strength': 0.040335774390886925, 'grow_policy': 'Depthwise', 'min_data_in_leaf': 672}. Best is trial 306 with value: 170.64979827273262.[0m
[32m[I 2024-10-13 11:41:58,925][0m Trial 459 finished with value: 199.11507425682484 and parameters: {'depth': 4, 'learning_rate': 0.014161653799950264, 'iterations': 1589, 'l2_leaf_reg': 0.016990875021205214, 'border_count': 18, 'bagging_temperature': 0.0010184722490322578, 'random_strength': 0.3578276306742194, 'grow_policy': 'Depthwise', 'min_data_in_leaf': 582}. Best is trial 306 with value: 170.64979827273262.[0m
