[32m[I 2024-10-13 11:45:34,043][0m Trial 562 finished with value: 196.9343278712078 and parameters: {'depth': 5, 'learning_rate': 0.010473541544958135, 'iterations': 1828, 'l2_leaf_reg': 0.00014171483318679617, 'border_count': 20, 'bagging_temperature': 0.021641262666107292, 'random_strength': 0.18454204238055344, 'grow_policy': 'Depthwise', 'min_data_in_leaf': 421}. Best is trial 306 with value: 170.64979827273262.[0m
[32m[I 2024-10-13 11:45:39,818][0m Trial 563 finished with value: 181.32728937983137 and parameters: {'depth': 4, 'learning_rate': 0.016900495602342823, 'iterations': 1756, 'l2_leaf_reg': 0.0006759012518167569, 'border_count': 5, 'bagging_temperature': 0.05658067113341338, 'random_strength': 0.5875357595745925, 'grow_policy': 'SymmetricTree', 'min_data_in_leaf': 346}. Best is trial 306 with value: 170.64979827273262.[0m
[32m[I 2024-10-13 11:45:41,820][0m Trial 564 finished with value: 253.96375510619845 and parameters: {'depth': 6, 'learning_rate': 0.01405549973020642, 'iterations': 1898, 'l2_leaf_reg': 0.00032888859441569304, 'border_count': 1, 'bagging_temperature': 1.1022555403551469e-05, 'random_strength': 0.3964342383972184, 'grow_policy': 'Depthwise', 'min_data_in_leaf': 409}. Best is trial 306 with value: 170.64979827273262.[0m
[32m[I 2024-10-13 11:45:43,580][0m Trial 565 finished with value: 178.95991714876112 and parameters: {'depth': 5, 'learning_rate': 0.017022606641730484, 'iterations': 1699, 'l2_leaf_reg': 0.00023458852237004868, 'border_count': 9, 'bagging_temperature': 0.03363283427284137, 'random_strength': 0.16042502491443217, 'grow_policy': 'Depthwise', 'min_data_in_leaf': 547}. Best is trial 306 with value: 170.64979827273262.[0m
[32m[I 2024-10-13 11:45:45,424][0m Trial 566 finished with value: 198.83700769152117 and parameters: {'depth': 4, 'learning_rate': 0.011981734806178515, 'iterations': 1810, 'l2_leaf_reg': 0.0007701678712526558, 'border_count': 17, 'bagging_temperature': 0.01587065535536808, 'random_strength': 0.6017266906216006, 'grow_policy': 'Depthwise', 'min_data_in_leaf': 323}. Best is trial 306 with value: 170.64979827273262.[0m
[32m[I 2024-10-13 11:45:47,240][0m Trial 567 finished with value: 201.08894980917574 and parameters: {'depth': 4, 'learning_rate': 0.014211645050391982, 'iterations': 1664, 'l2_leaf_reg': 0.0004695700756114133, 'border_count': 12, 'bagging_temperature': 0.051884970998883215, 'random_strength': 0.1670675395270883, 'grow_policy': 'Depthwise', 'min_data_in_leaf': 317}. Best is trial 306 with value: 170.64979827273262.[0m
[32m[I 2024-10-13 11:45:49,109][0m Trial 568 finished with value: 179.48060687638088 and parameters: {'depth': 5, 'learning_rate': 0.01766792330491046, 'iterations': 1735, 'l2_leaf_reg': 1.1090071271901616e-07, 'border_count': 6, 'bagging_temperature': 0.7927349620967924, 'random_strength': 0.366322308346095, 'grow_policy': 'Depthwise', 'min_data_in_leaf': 614}. Best is trial 306 with value: 170.64979827273262.[0m
[32m[I 2024-10-13 11:45:51,171][0m Trial 569 finished with value: 253.73327327689512 and parameters: {'depth': 4, 'learning_rate': 0.016653454838502092, 'iterations': 1847, 'l2_leaf_reg': 0.00010939391288927176, 'border_count': 1, 'bagging_temperature': 0.03184579402223581, 'random_strength': 0.41951776099100235, 'grow_policy': 'Depthwise', 'min_data_in_leaf': 397}. Best is trial 306 with value: 170.64979827273262.[0m
[32m[I 2024-10-13 11:45:53,070][0m Trial 570 finished with value: 207.15847549043787 and parameters: {'depth': 5, 'learning_rate': 0.010999157371048219, 'iterations': 1763, 'l2_leaf_reg': 2.913964457823387e-07, 'border_count': 24, 'bagging_temperature': 0.019382553782194483, 'random_strength': 0.589926926162168, 'grow_policy': 'Depthwise', 'min_data_in_leaf': 518}. Best is trial 306 with value: 170.64979827273262.[0m
[32m[I 2024-10-13 11:45:55,221][0m Trial 571 finished with value: 202.95391004803196 and parameters: {'depth': 6, 'learning_rate': 0.014331998390195248, 'iterations': 2025, 'l2_leaf_reg': 0.000778912378972716, 'border_count': 10, 'bagging_temperature': 0.04516946972548623, 'random_strength': 0.00325054078364323, 'grow_policy': 'Depthwise', 'min_data_in_leaf': 569}. Best is trial 306 with value: 170.64979827273262.[0m
[32m[I 2024-10-13 11:45:57,005][0m Trial 572 finished with value: 173.01435082407198 and parameters: {'depth': 4, 'learning_rate': 0.009675931838774483, 'iterations': 1641, 'l2_leaf_reg': 1.494947083978297e-07, 'border_count': 5, 'bagging_temperature': 0.001360000328755634, 'random_strength': 0.680158892003546, 'grow_policy': 'Depthwise', 'min_data_in_leaf': 597}. Best is trial 306 with value: 170.64979827273262.[0m
[32m[I 2024-10-13 11:45:59,117][0m Trial 573 finished with value: 203.88733907022245 and parameters: {'depth': 5, 'learning_rate': 0.018228596330474904, 'iterations': 1941, 'l2_leaf_reg': 7.007205868498042e-08, 'border_count': 16, 'bagging_temperature': 0.24294990657026044, 'random_strength': 0.2961806020772014, 'grow_policy': 'Depthwise', 'min_data_in_leaf': 617}. Best is trial 306 with value: 170.64979827273262.[0m
[32m[I 2024-10-13 11:46:01,078][0m Trial 574 finished with value: 226.94562753167597 and parameters: {'depth': 4, 'learning_rate': 0.013485719855293888, 'iterations': 1692, 'l2_leaf_reg': 0.0003928771713718015, 'border_count': 60, 'bagging_temperature': 0.020225859155573286, 'random_strength': 0.18306924757950493, 'grow_policy': 'Depthwise', 'min_data_in_leaf': 785}. Best is trial 306 with value: 170.64979827273262.[0m
[32m[I 2024-10-13 11:46:02,894][0m Trial 575 finished with value: 235.60916937971152 and parameters: {'depth': 5, 'learning_rate': 0.0739443011697419, 'iterations': 1796, 'l2_leaf_reg': 3.370156453746937e-08, 'border_count': 30, 'bagging_temperature': 0.05251318598542037, 'random_strength': 0.5044255502939137, 'grow_policy': 'Depthwise', 'min_data_in_leaf': 583}. Best is trial 306 with value: 170.64979827273262.[0m
[32m[I 2024-10-13 11:46:04,853][0m Trial 576 finished with value: 203.90639748655587 and parameters: {'depth': 6, 'learning_rate': 0.019061925559775147, 'iterations': 1875, 'l2_leaf_reg': 0.00025762349164886415, 'border_count': 10, 'bagging_temperature': 0.03324113019500503, 'random_strength': 6.292763112760422, 'grow_policy': 'Depthwise', 'min_data_in_leaf': 552}. Best is trial 306 with value: 170.64979827273262.[0m
[32m[I 2024-10-13 11:46:05,763][0m Trial 577 finished with value: 177.7812109317674 and parameters: {'depth': 4, 'learning_rate': 0.01578487340060404, 'iterations': 480, 'l2_leaf_reg': 0.0005707483886750345, 'border_count': 6, 'bagging_temperature': 0.05893240436656285, 'random_strength': 0.32799474038372506, 'grow_policy': 'Depthwise', 'min_data_in_leaf': 616}. Best is trial 306 with value: 170.64979827273262.[0m
[32m[I 2024-10-13 11:46:07,496][0m Trial 578 finished with value: 267.6379438786547 and parameters: {'depth': 5, 'learning_rate': 0.0015597624532973622, 'iterations': 1633, 'l2_leaf_reg': 5.3420577605897834e-08, 'border_count': 1, 'bagging_temperature': 0.014711019205148631, 'random_strength': 0.16923158068472066, 'grow_policy': 'Depthwise', 'min_data_in_leaf': 450}. Best is trial 306 with value: 170.64979827273262.[0m
[32m[I 2024-10-13 11:46:09,289][0m Trial 579 finished with value: 280.5781846358493 and parameters: {'depth': 4, 'learning_rate': 0.00042661842961894933, 'iterations': 1725, 'l2_leaf_reg': 2.0352739649045076e-07, 'border_count': 13, 'bagging_temperature': 0.037586563858383895, 'random_strength': 8.209780899919524, 'grow_policy': 'Depthwise', 'min_data_in_leaf': 503}. Best is trial 306 with value: 170.64979827273262.[0m
[32m[I 2024-10-13 11:46:11,846][0m Trial 580 finished with value: 200.69495105859878 and parameters: {'depth': 6, 'learning_rate': 0.011214940469830908, 'iterations': 2617, 'l2_leaf_reg': 0.0010371965491664875, 'border_count': 19, 'bagging_temperature': 0.018082633298916514, 'random_strength': 0.6865438542577125, 'grow_policy': 'Depthwise', 'min_data_in_leaf': 539}. Best is trial 306 with value: 170.64979827273262.[0m
[32m[I 2024-10-13 11:46:13,708][0m Trial 581 finished with value: 173.04589147855478 and parameters: {'depth': 4, 'learning_rate': 0.01986732995647818, 'iterations': 1799, 'l2_leaf_reg': 0.0003700353481569609, 'border_count': 6, 'bagging_temperature': 0.0011146192179439587, 'random_strength': 0.5041303956705494, 'grow_policy': 'Depthwise', 'min_data_in_leaf': 586}. Best is trial 306 with value: 170.64979827273262.[0m
[32m[I 2024-10-13 11:46:15,460][0m Trial 582 finished with value: 178.57320364008712 and parameters: {'depth': 5, 'learning_rate': 0.022283829479070556, 'iterations': 1690, 'l2_leaf_reg': 0.0006240414419646071, 'border_count': 9, 'bagging_temperature': 0.05232435111102344, 'random_strength': 0.19745959593352058, 'grow_policy': 'Depthwise', 'min_data_in_leaf': 208}. Best is trial 306 with value: 170.64979827273262.[0m
[32m[I 2024-10-13 11:46:16,776][0m Trial 583 finished with value: 250.6830657449701 and parameters: {'depth': 5, 'learning_rate': 0.01254525485590855, 'iterations': 1051, 'l2_leaf_reg': 0.0009043230765107146, 'border_count': 161, 'bagging_temperature': 0.034506973215909405, 'random_strength': 0.007445183037470937, 'grow_policy': 'Depthwise', 'min_data_in_leaf': 628}. Best is trial 306 with value: 170.64979827273262.[0m
[32m[I 2024-10-13 11:46:22,804][0m Trial 584 finished with value: 214.03397791549716 and parameters: {'depth': 7, 'learning_rate': 0.016088411298130743, 'iterations': 1614, 'l2_leaf_reg': 8.531452329717166e-08, 'border_count': 14, 'bagging_temperature': 0.00046576841798067273, 'random_strength': 0.7654876235506634, 'grow_policy': 'SymmetricTree', 'min_data_in_leaf': 600}. Best is trial 306 with value: 170.64979827273262.[0m
[32m[I 2024-10-13 11:46:24,681][0m Trial 585 finished with value: 253.6566973214152 and parameters: {'depth': 4, 'learning_rate': 0.006902872995944126, 'iterations': 1842, 'l2_leaf_reg': 2.9807907149741936e-07, 'border_count': 1, 'bagging_temperature': 0.06239139033148644, 'random_strength': 0.4042484518790275, 'grow_policy': 'Depthwise', 'min_data_in_leaf': 568}. Best is trial 306 with value: 170.64979827273262.[0m
[32m[I 2024-10-13 11:46:26,517][0m Trial 586 finished with value: 241.45462964286497 and parameters: {'depth': 5, 'learning_rate': 0.008987022356016677, 'iterations': 1745, 'l2_leaf_reg': 0.00016306550548383884, 'border_count': 140, 'bagging_temperature': 0.8372561975376528, 'random_strength': 0.409151991865162, 'grow_policy': 'Depthwise', 'min_data_in_leaf': 619}. Best is trial 306 with value: 170.64979827273262.[0m
[32m[I 2024-10-13 11:46:28,216][0m Trial 587 finished with value: 177.2975650172433 and parameters: {'depth': 4, 'learning_rate': 0.035979287548206805, 'iterations': 1653, 'l2_leaf_reg': 1.3420804386828175e-07, 'border_count': 9, 'bagging_temperature': 0.028340967081214637, 'random_strength': 0.18973540361930066, 'grow_policy': 'Depthwise', 'min_data_in_leaf': 362}. Best is trial 306 with value: 170.64979827273262.[0m
[32m[I 2024-10-13 11:46:28,951][0m Trial 588 finished with value: 189.40771842565977 and parameters: {'depth': 4, 'learning_rate': 0.014841544633132923, 'iterations': 260, 'l2_leaf_reg': 0.00040775364683286674, 'border_count': 5, 'bagging_temperature': 0.6185901397787232, 'random_strength': 0.6666619902971129, 'grow_policy': 'Depthwise', 'min_data_in_leaf': 285}. Best is trial 306 with value: 170.64979827273262.[0m
[32m[I 2024-10-13 11:46:30,945][0m Trial 589 finished with value: 255.90174884316272 and parameters: {'depth': 5, 'learning_rate': 0.017592247794691682, 'iterations': 1922, 'l2_leaf_reg': 0.0009830445884547606, 'border_count': 114, 'bagging_temperature': 0.07089227710729376, 'random_strength': 4.959628002284315, 'grow_policy': 'Depthwise', 'min_data_in_leaf': 595}. Best is trial 306 with value: 170.64979827273262.[0m
[32m[I 2024-10-13 11:46:32,872][0m Trial 590 finished with value: 214.72279113536285 and parameters: {'depth': 5, 'learning_rate': 0.02201583883061265, 'iterations': 1787, 'l2_leaf_reg': 0.00028175329574766305, 'border_count': 14, 'bagging_temperature': 0.04129571809782451, 'random_strength': 0.013789586425141115, 'grow_policy': 'Depthwise', 'min_data_in_leaf': 419}. Best is trial 306 with value: 170.64979827273262.[0m
[32m[I 2024-10-13 11:46:34,638][0m Trial 591 finished with value: 266.27829656912115 and parameters: {'depth': 4, 'learning_rate': 0.027480569856565155, 'iterations': 1714, 'l2_leaf_reg': 0.000583422410494973, 'border_count': 130, 'bagging_temperature': 0.01879737424844236, 'random_strength': 0.364560755098406, 'grow_policy': 'Depthwise', 'min_data_in_leaf': 631}. Best is trial 306 with value: 170.64979827273262.[0m
[32m[I 2024-10-13 11:46:36,322][0m Trial 592 finished with value: 206.6166695667698 and parameters: {'depth': 6, 'learning_rate': 0.012194308198586391, 'iterations': 1605, 'l2_leaf_reg': 2.1457388462480822e-08, 'border_count': 24, 'bagging_temperature': 0.0006755472823223169, 'random_strength': 0.8105681699101556, 'grow_policy': 'Depthwise', 'min_data_in_leaf': 635}. Best is trial 306 with value: 170.64979827273262.[0m
[32m[I 2024-10-13 11:46:38,158][0m Trial 593 finished with value: 172.26040727228096 and parameters: {'depth': 4, 'learning_rate': 0.018711679549158432, 'iterations': 1776, 'l2_leaf_reg': 0.0012257818516676667, 'border_count': 5, 'bagging_temperature': 0.04532515220869203, 'random_strength': 0.5285518521583062, 'grow_policy': 'Depthwise', 'min_data_in_leaf': 486}. Best is trial 306 with value: 170.64979827273262.[0m
[32m[I 2024-10-13 11:46:40,027][0m Trial 594 finished with value: 200.72819452146848 and parameters: {'depth': 6, 'learning_rate': 0.014081132040570593, 'iterations': 1859, 'l2_leaf_reg': 2.6966173418012317e-05, 'border_count': 17, 'bagging_temperature': 0.022867488983621866, 'random_strength': 0.1684733305302154, 'grow_policy': 'Depthwise', 'min_data_in_leaf': 523}. Best is trial 306 with value: 170.64979827273262.[0m
[32m[I 2024-10-13 11:46:41,809][0m Trial 595 finished with value: 197.26921247497367 and parameters: {'depth': 3, 'learning_rate': 0.010267874462453032, 'iterations': 1694, 'l2_leaf_reg': 4.644963727871837e-05, 'border_count': 10, 'bagging_temperature': 0.0649189133003707, 'random_strength': 0.8770546619591137, 'grow_policy': 'Depthwise', 'min_data_in_leaf': 606}. Best is trial 306 with value: 170.64979827273262.[0m
[32m[I 2024-10-13 11:46:43,568][0m Trial 596 finished with value: 254.4001919322472 and parameters: {'depth': 4, 'learning_rate': 0.02485528756132229, 'iterations': 1602, 'l2_leaf_reg': 4.63984811601125e-08, 'border_count': 1, 'bagging_temperature': 0.020432938472022825, 'random_strength': 0.31033798969530885, 'grow_policy': 'Depthwise', 'min_data_in_leaf': 577}. Best is trial 306 with value: 170.64979827273262.[0m
[32m[I 2024-10-13 11:46:45,425][0m Trial 597 finished with value: 178.98000917610486 and parameters: {'depth': 5, 'learning_rate': 0.016386956016841443, 'iterations': 1830, 'l2_leaf_reg': 0.0007012304068498681, 'border_count': 9, 'bagging_temperature': 0.0396058777301671, 'random_strength': 0.5880821325011045, 'grow_policy': 'Depthwise', 'min_data_in_leaf': 556}. Best is trial 306 with value: 170.64979827273262.[0m
[32m[I 2024-10-13 11:46:47,460][0m Trial 598 finished with value: 255.69438805564528 and parameters: {'depth': 5, 'learning_rate': 0.021557339645887744, 'iterations': 1986, 'l2_leaf_reg': 1.079409821284334e-07, 'border_count': 121, 'bagging_temperature': 0.05205358276943993, 'random_strength': 0.01356627981996511, 'grow_policy': 'Depthwise', 'min_data_in_leaf': 630}. Best is trial 306 with value: 170.64979827273262.[0m
[32m[I 2024-10-13 11:46:49,348][0m Trial 599 finished with value: 172.08511170197497 and parameters: {'depth': 3, 'learning_rate': 0.01281560244347792, 'iterations': 1729, 'l2_leaf_reg': 3.1528620403028493e-07, 'border_count': 5, 'bagging_temperature': 0.016397826510667096, 'random_strength': 0.38196666434330284, 'grow_policy': 'Depthwise', 'min_data_in_leaf': 764}. Best is trial 306 with value: 170.64979827273262.[0m
[32m[I 2024-10-13 11:46:51,191][0m Trial 600 finished with value: 195.1690301737019 and parameters: {'depth': 3, 'learning_rate': 0.00783594162642767, 'iterations': 1752, 'l2_leaf_reg': 2.1376206590213895e-07, 'border_count': 19, 'bagging_temperature': 0.01661622478788064, 'random_strength': 0.3129267056954993, 'grow_policy': 'Depthwise', 'min_data_in_leaf': 792}. Best is trial 306 with value: 170.64979827273262.[0m
[32m[I 2024-10-13 11:46:53,110][0m Trial 601 finished with value: 202.85328742306217 and parameters: {'depth': 3, 'learning_rate': 0.011108852434697919, 'iterations': 1891, 'l2_leaf_reg': 0.6967122346595932, 'border_count': 13, 'bagging_temperature': 0.4231724610994433, 'random_strength': 0.19504164266887594, 'grow_policy': 'Depthwise', 'min_data_in_leaf': 767}. Best is trial 306 with value: 170.64979827273262.[0m
[32m[I 2024-10-13 11:46:54,919][0m Trial 602 finished with value: 172.90421623219763 and parameters: {'depth': 3, 'learning_rate': 0.012229770413971244, 'iterations': 1801, 'l2_leaf_reg': 1.938884802015416e-07, 'border_count': 6, 'bagging_temperature': 0.01547240745316082, 'random_strength': 0.4568512800327187, 'grow_policy': 'Depthwise', 'min_data_in_leaf': 475}. Best is trial 306 with value: 170.64979827273262.[0m
[32m[I 2024-10-13 11:46:56,798][0m Trial 603 finished with value: 253.94127901675762 and parameters: {'depth': 3, 'learning_rate': 0.013667658617794698, 'iterations': 1724, 'l2_leaf_reg': 4.064996544648105e-07, 'border_count': 1, 'bagging_temperature': 0.001627560841670414, 'random_strength': 0.1866733725145553, 'grow_policy': 'Depthwise', 'min_data_in_leaf': 765}. Best is trial 306 with value: 170.64979827273262.[0m
[32m[I 2024-10-13 11:46:58,777][0m Trial 604 finished with value: 205.51198031964634 and parameters: {'depth': 3, 'learning_rate': 0.010006203995453123, 'iterations': 1831, 'l2_leaf_reg': 3.110535223377245e-07, 'border_count': 13, 'bagging_temperature': 0.00018866043268405005, 'random_strength': 0.007247964555094022, 'grow_policy': 'Depthwise', 'min_data_in_leaf': 761}. Best is trial 306 with value: 170.64979827273262.[0m
[32m[I 2024-10-13 11:47:08,019][0m Trial 605 finished with value: 183.66838198380424 and parameters: {'depth': 3, 'learning_rate': 0.008783734346556254, 'iterations': 2895, 'l2_leaf_reg': 0.12771131649482564, 'border_count': 9, 'bagging_temperature': 0.03082189027122818, 'random_strength': 0.4598650969108503, 'grow_policy': 'SymmetricTree', 'min_data_in_leaf': 758}. Best is trial 306 with value: 170.64979827273262.[0m
[32m[I 2024-10-13 11:47:09,935][0m Trial 606 finished with value: 179.24579540425782 and parameters: {'depth': 3, 'learning_rate': 0.011958551692988038, 'iterations': 1753, 'l2_leaf_reg': 3.531260500861352e-07, 'border_count': 6, 'bagging_temperature': 0.670260150893135, 'random_strength': 8.783513909028269, 'grow_policy': 'Depthwise', 'min_data_in_leaf': 797}. Best is trial 306 with value: 170.64979827273262.[0m
[32m[I 2024-10-13 11:47:11,768][0m Trial 607 finished with value: 255.98575473171417 and parameters: {'depth': 3, 'learning_rate': 0.014479454324527477, 'iterations': 1666, 'l2_leaf_reg': 2.0142394266525726e-07, 'border_count': 211, 'bagging_temperature': 0.07734758786854787, 'random_strength': 0.344529275939519, 'grow_policy': 'Depthwise', 'min_data_in_leaf': 821}. Best is trial 306 with value: 170.64979827273262.[0m
[32m[I 2024-10-13 11:47:13,580][0m Trial 608 finished with value: 257.8398294120814 and parameters: {'depth': 4, 'learning_rate': 0.11122331225993999, 'iterations': 1708, 'l2_leaf_reg': 1.490803874803682e-07, 'border_count': 1, 'bagging_temperature': 0.03400780946668194, 'random_strength': 0.6216778725125158, 'grow_policy': 'Depthwise', 'min_data_in_leaf': 728}. Best is trial 306 with value: 170.64979827273262.[0m
[32m[I 2024-10-13 11:47:15,455][0m Trial 609 finished with value: 201.58670656330747 and parameters: {'depth': 4, 'learning_rate': 0.015837422315544313, 'iterations': 1883, 'l2_leaf_reg': 2.3650885079422452e-07, 'border_count': 18, 'bagging_temperature': 0.020342813766360855, 'random_strength': 0.2879294812799197, 'grow_policy': 'Depthwise', 'min_data_in_leaf': 779}. Best is trial 306 with value: 170.64979827273262.[0m
[32m[I 2024-10-13 11:47:17,289][0m Trial 610 finished with value: 206.82984538257892 and parameters: {'depth': 4, 'learning_rate': 0.01085059315601599, 'iterations': 1792, 'l2_leaf_reg': 0.00021632307287718615, 'border_count': 13, 'bagging_temperature': 0.05225054966603517, 'random_strength': 8.512352398501601, 'grow_policy': 'Depthwise', 'min_data_in_leaf': 532}. Best is trial 306 with value: 170.64979827273262.[0m
[32m[I 2024-10-13 11:47:19,030][0m Trial 611 finished with value: 176.9804860308751 and parameters: {'depth': 3, 'learning_rate': 0.013297845065478164, 'iterations': 1566, 'l2_leaf_reg': 4.398902049299754e-07, 'border_count': 6, 'bagging_temperature': 0.36999451464786903, 'random_strength': 0.19030704514915078, 'grow_policy': 'Depthwise', 'min_data_in_leaf': 801}. Best is trial 306 with value: 170.64979827273262.[0m
[32m[I 2024-10-13 11:47:20,992][0m Trial 612 finished with value: 204.30685744922482 and parameters: {'depth': 3, 'learning_rate': 0.01740884560276486, 'iterations': 1950, 'l2_leaf_reg': 8.993762553510536e-08, 'border_count': 10, 'bagging_temperature': 0.022884106636530867, 'random_strength': 0.5291812710071666, 'grow_policy': 'Depthwise', 'min_data_in_leaf': 747}. Best is trial 306 with value: 170.64979827273262.[0m
