[32m[I 2024-10-13 11:58:29,822][0m Trial 917 finished with value: 204.67055369325934 and parameters: {'depth': 3, 'learning_rate': 0.016929243107152398, 'iterations': 2156, 'l2_leaf_reg': 9.82353527692061, 'border_count': 13, 'bagging_temperature': 0.09509991354150235, 'random_strength': 2.1379888084170946, 'grow_policy': 'Lossguide', 'min_data_in_leaf': 911, 'max_leaves': 153}. Best is trial 871 with value: 170.57272342910278.[0m
[32m[I 2024-10-13 11:58:32,099][0m Trial 918 finished with value: 202.65432516345447 and parameters: {'depth': 3, 'learning_rate': 0.0017849216142633358, 'iterations': 2418, 'l2_leaf_reg': 1.6638844172550598, 'border_count': 22, 'bagging_temperature': 0.14189852030200872, 'random_strength': 1.3002242755401134, 'grow_policy': 'Lossguide', 'min_data_in_leaf': 955, 'max_leaves': 187}. Best is trial 871 with value: 170.57272342910278.[0m
[32m[I 2024-10-13 11:58:34,367][0m Trial 919 finished with value: 184.01148459441728 and parameters: {'depth': 3, 'learning_rate': 0.024329325962750382, 'iterations': 2254, 'l2_leaf_reg': 4.756350598382716, 'border_count': 9, 'bagging_temperature': 0.348370469643802, 'random_strength': 1.5146340793204098, 'grow_policy': 'Lossguide', 'min_data_in_leaf': 936, 'max_leaves': 143}. Best is trial 871 with value: 170.57272342910278.[0m
[32m[I 2024-10-13 11:58:36,634][0m Trial 920 finished with value: 253.7696476600766 and parameters: {'depth': 3, 'learning_rate': 0.013284199384344789, 'iterations': 2342, 'l2_leaf_reg': 2.63495644326349, 'border_count': 1, 'bagging_temperature': 0.0581775666465727, 'random_strength': 2.7139185915567547, 'grow_policy': 'Lossguide', 'min_data_in_leaf': 901, 'max_leaves': 159}. Best is trial 871 with value: 170.57272342910278.[0m
[32m[I 2024-10-13 11:58:38,868][0m Trial 921 finished with value: 198.54603027030856 and parameters: {'depth': 3, 'learning_rate': 0.019892797234522433, 'iterations': 2265, 'l2_leaf_reg': 6.748324000157429, 'border_count': 16, 'bagging_temperature': 0.08213499825870157, 'random_strength': 1.3449491201952402, 'grow_policy': 'Lossguide', 'min_data_in_leaf': 870, 'max_leaves': 171}. Best is trial 871 with value: 170.57272342910278.[0m
[32m[I 2024-10-13 11:58:41,052][0m Trial 922 finished with value: 173.15759247487625 and parameters: {'depth': 3, 'learning_rate': 0.01604237312965072, 'iterations': 2210, 'l2_leaf_reg': 3.6892824059095752, 'border_count': 6, 'bagging_temperature': 0.12292753617774559, 'random_strength': 1.7757436212710775, 'grow_policy': 'Lossguide', 'min_data_in_leaf': 853, 'max_leaves': 207}. Best is trial 871 with value: 170.57272342910278.[0m
[32m[I 2024-10-13 11:58:43,347][0m Trial 923 finished with value: 208.6492296227781 and parameters: {'depth': 3, 'learning_rate': 0.027725741632439425, 'iterations': 2448, 'l2_leaf_reg': 5.107755896429403, 'border_count': 12, 'bagging_temperature': 0.06475977746944771, 'random_strength': 2.2629557983231696, 'grow_policy': 'Lossguide', 'min_data_in_leaf': 936, 'max_leaves': 31}. Best is trial 871 with value: 170.57272342910278.[0m
[32m[I 2024-10-13 11:58:45,562][0m Trial 924 finished with value: 169.86064328905624 and parameters: {'depth': 3, 'learning_rate': 0.018165628391568156, 'iterations': 2327, 'l2_leaf_reg': 9.952970330404854, 'border_count': 5, 'bagging_temperature': 0.05750575462786251, 'random_strength': 1.9933309113463908, 'grow_policy': 'Lossguide', 'min_data_in_leaf': 995, 'max_leaves': 178}. Best is trial 924 with value: 169.86064328905624.[0m
[32m[I 2024-10-13 11:58:47,846][0m Trial 925 finished with value: 202.73420437911952 and parameters: {'depth': 3, 'learning_rate': 0.022508670106308293, 'iterations': 2389, 'l2_leaf_reg': 6.286434089716579, 'border_count': 18, 'bagging_temperature': 0.10102567565225411, 'random_strength': 2.4903864072104764, 'grow_policy': 'Lossguide', 'min_data_in_leaf': 994, 'max_leaves': 179}. Best is trial 924 with value: 169.86064328905624.[0m
[32m[I 2024-10-13 11:58:50,080][0m Trial 926 finished with value: 171.96521257299233 and parameters: {'depth': 3, 'learning_rate': 0.03466068575338846, 'iterations': 2316, 'l2_leaf_reg': 9.778682441051071, 'border_count': 5, 'bagging_temperature': 0.08951160103362399, 'random_strength': 2.0845529010617025, 'grow_policy': 'Lossguide', 'min_data_in_leaf': 998, 'max_leaves': 182}. Best is trial 924 with value: 169.86064328905624.[0m
[32m[I 2024-10-13 11:58:52,331][0m Trial 927 finished with value: 205.16323183274224 and parameters: {'depth': 3, 'learning_rate': 0.02152198667591643, 'iterations': 2343, 'l2_leaf_reg': 0.03749073585972896, 'border_count': 10, 'bagging_temperature': 0.0730584876113416, 'random_strength': 2.057339793379942, 'grow_policy': 'Lossguide', 'min_data_in_leaf': 957, 'max_leaves': 175}. Best is trial 924 with value: 169.86064328905624.[0m
[32m[I 2024-10-13 11:58:54,647][0m Trial 928 finished with value: 170.82901020796555 and parameters: {'depth': 8, 'learning_rate': 0.01862099301817509, 'iterations': 2402, 'l2_leaf_reg': 6.976202007703752, 'border_count': 5, 'bagging_temperature': 0.0667620627100874, 'random_strength': 2.3297193801830383, 'grow_policy': 'Lossguide', 'min_data_in_leaf': 979, 'max_leaves': 192}. Best is trial 924 with value: 169.86064328905624.[0m
[32m[I 2024-10-13 11:58:57,016][0m Trial 929 finished with value: 213.29122678457446 and parameters: {'depth': 8, 'learning_rate': 0.023309499760352334, 'iterations': 2603, 'l2_leaf_reg': 6.968531145426422, 'border_count': 13, 'bagging_temperature': 0.11258986119684983, 'random_strength': 2.4173910696772527, 'grow_policy': 'Lossguide', 'min_data_in_leaf': 999, 'max_leaves': 201}. Best is trial 924 with value: 169.86064328905624.[0m
[32m[I 2024-10-13 11:58:59,299][0m Trial 930 finished with value: 255.16158531323964 and parameters: {'depth': 8, 'learning_rate': 0.02706246158253206, 'iterations': 2417, 'l2_leaf_reg': 9.833558198769186, 'border_count': 1, 'bagging_temperature': 0.08910240564026173, 'random_strength': 2.4537759568737303, 'grow_policy': 'Lossguide', 'min_data_in_leaf': 979, 'max_leaves': 188}. Best is trial 924 with value: 169.86064328905624.[0m
[32m[I 2024-10-13 11:59:01,684][0m Trial 931 finished with value: 203.59158602271174 and parameters: {'depth': 10, 'learning_rate': 0.01944977540266367, 'iterations': 2471, 'l2_leaf_reg': 3.003392149974914, 'border_count': 10, 'bagging_temperature': 0.08867667103968903, 'random_strength': 2.238831042439324, 'grow_policy': 'Lossguide', 'min_data_in_leaf': 999, 'max_leaves': 193}. Best is trial 924 with value: 169.86064328905624.[0m
[32m[I 2024-10-13 11:59:04,066][0m Trial 932 finished with value: 203.27316914810862 and parameters: {'depth': 9, 'learning_rate': 0.019442581355814566, 'iterations': 2528, 'l2_leaf_reg': 4.3687839061811164, 'border_count': 17, 'bagging_temperature': 0.07125920232429855, 'random_strength': 2.279061173192973, 'grow_policy': 'Lossguide', 'min_data_in_leaf': 974, 'max_leaves': 197}. Best is trial 924 with value: 169.86064328905624.[0m
[32m[I 2024-10-13 11:59:06,310][0m Trial 933 finished with value: 173.81570609487673 and parameters: {'depth': 7, 'learning_rate': 0.024521456491496223, 'iterations': 2381, 'l2_leaf_reg': 6.623289505601267, 'border_count': 6, 'bagging_temperature': 0.06598169760529848, 'random_strength': 1.9884129404294115, 'grow_policy': 'Lossguide', 'min_data_in_leaf': 974, 'max_leaves': 167}. Best is trial 924 with value: 169.86064328905624.[0m
[32m[I 2024-10-13 11:59:08,561][0m Trial 934 finished with value: 254.40972776265045 and parameters: {'depth': 3, 'learning_rate': 0.021213868525061127, 'iterations': 2307, 'l2_leaf_reg': 6.317900290235608, 'border_count': 1, 'bagging_temperature': 0.11388521283718957, 'random_strength': 3.0137609883957914, 'grow_policy': 'Lossguide', 'min_data_in_leaf': 972, 'max_leaves': 171}. Best is trial 924 with value: 169.86064328905624.[0m
[32m[I 2024-10-13 11:59:10,822][0m Trial 935 finished with value: 218.02582276879093 and parameters: {'depth': 10, 'learning_rate': 0.028700753040648896, 'iterations': 2360, 'l2_leaf_reg': 4.140678676811596, 'border_count': 24, 'bagging_temperature': 0.07572335722083787, 'random_strength': 2.216472368621667, 'grow_policy': 'Lossguide', 'min_data_in_leaf': 958, 'max_leaves': 184}. Best is trial 924 with value: 169.86064328905624.[0m
[32m[I 2024-10-13 11:59:13,062][0m Trial 936 finished with value: 201.888247400717 and parameters: {'depth': 8, 'learning_rate': 0.01713225071411495, 'iterations': 2245, 'l2_leaf_reg': 9.915045812316878, 'border_count': 11, 'bagging_temperature': 0.061737892063870495, 'random_strength': 2.517746385921839, 'grow_policy': 'Lossguide', 'min_data_in_leaf': 950, 'max_leaves': 160}. Best is trial 924 with value: 169.86064328905624.[0m
[32m[I 2024-10-13 11:59:15,380][0m Trial 937 finished with value: 174.37271575878628 and parameters: {'depth': 9, 'learning_rate': 0.018859630209705103, 'iterations': 2414, 'l2_leaf_reg': 2.1740547026424837, 'border_count': 6, 'bagging_temperature': 0.10099903361938065, 'random_strength': 1.9319890705633609, 'grow_policy': 'Lossguide', 'min_data_in_leaf': 979, 'max_leaves': 190}. Best is trial 924 with value: 169.86064328905624.[0m
[32m[I 2024-10-13 11:59:17,547][0m Trial 938 finished with value: 210.1928842260795 and parameters: {'depth': 8, 'learning_rate': 0.023304064641367042, 'iterations': 2282, 'l2_leaf_reg': 6.072236684932568, 'border_count': 15, 'bagging_temperature': 0.13531409530116725, 'random_strength': 2.7285183846600107, 'grow_policy': 'Lossguide', 'min_data_in_leaf': 980, 'max_leaves': 178}. Best is trial 924 with value: 169.86064328905624.[0m
[32m[I 2024-10-13 11:59:19,832][0m Trial 939 finished with value: 204.38471012326661 and parameters: {'depth': 7, 'learning_rate': 0.018034900126219253, 'iterations': 2461, 'l2_leaf_reg': 1.3719030430040844, 'border_count': 10, 'bagging_temperature': 0.05620084112401197, 'random_strength': 2.1757965365409278, 'grow_policy': 'Lossguide', 'min_data_in_leaf': 958, 'max_leaves': 151}. Best is trial 924 with value: 169.86064328905624.[0m
[32m[I 2024-10-13 11:59:22,090][0m Trial 940 finished with value: 170.76065141653598 and parameters: {'depth': 3, 'learning_rate': 0.0214377365632522, 'iterations': 2336, 'l2_leaf_reg': 9.781828466200947, 'border_count': 5, 'bagging_temperature': 0.09172693461881017, 'random_strength': 1.8474401926912993, 'grow_policy': 'Lossguide', 'min_data_in_leaf': 943, 'max_leaves': 162}. Best is trial 924 with value: 169.86064328905624.[0m
[32m[I 2024-10-13 11:59:24,324][0m Trial 941 finished with value: 254.908496167847 and parameters: {'depth': 3, 'learning_rate': 0.02617998606922934, 'iterations': 2335, 'l2_leaf_reg': 7.08552750817234, 'border_count': 1, 'bagging_temperature': 0.1636183706386386, 'random_strength': 1.9855090370611626, 'grow_policy': 'Lossguide', 'min_data_in_leaf': 941, 'max_leaves': 164}. Best is trial 924 with value: 169.86064328905624.[0m
[32m[I 2024-10-13 11:59:26,608][0m Trial 942 finished with value: 206.41684303204764 and parameters: {'depth': 8, 'learning_rate': 0.02690993433215705, 'iterations': 2387, 'l2_leaf_reg': 3.516900180293109, 'border_count': 20, 'bagging_temperature': 0.08947453465833953, 'random_strength': 2.0554359900729273, 'grow_policy': 'Lossguide', 'min_data_in_leaf': 1000, 'max_leaves': 156}. Best is trial 924 with value: 169.86064328905624.[0m
[32m[I 2024-10-13 11:59:28,952][0m Trial 943 finished with value: 225.65541068835674 and parameters: {'depth': 3, 'learning_rate': 0.030308975571873994, 'iterations': 2501, 'l2_leaf_reg': 9.626835235091363, 'border_count': 88, 'bagging_temperature': 0.12553740289123402, 'random_strength': 2.4217601854436737, 'grow_policy': 'Lossguide', 'min_data_in_leaf': 918, 'max_leaves': 168}. Best is trial 924 with value: 169.86064328905624.[0m
[32m[I 2024-10-13 11:59:31,142][0m Trial 944 finished with value: 179.29212033995407 and parameters: {'depth': 3, 'learning_rate': 0.03581704767160731, 'iterations': 2219, 'l2_leaf_reg': 4.993675672427172, 'border_count': 9, 'bagging_temperature': 0.11720123144180114, 'random_strength': 2.2671782101092077, 'grow_policy': 'Lossguide', 'min_data_in_leaf': 939, 'max_leaves': 147}. Best is trial 924 with value: 169.86064328905624.[0m
[32m[I 2024-10-13 11:59:33,344][0m Trial 945 finished with value: 206.9809931662998 and parameters: {'depth': 10, 'learning_rate': 0.02321938497855191, 'iterations': 2280, 'l2_leaf_reg': 9.879182416766271, 'border_count': 15, 'bagging_temperature': 0.10337047241384213, 'random_strength': 1.8330893452924706, 'grow_policy': 'Lossguide', 'min_data_in_leaf': 963, 'max_leaves': 161}. Best is trial 924 with value: 169.86064328905624.[0m
[32m[I 2024-10-13 11:59:35,553][0m Trial 946 finished with value: 175.26659081346784 and parameters: {'depth': 3, 'learning_rate': 0.03175251226154044, 'iterations': 2325, 'l2_leaf_reg': 6.739058820489027, 'border_count': 6, 'bagging_temperature': 0.08947018411206825, 'random_strength': 1.9328944960681087, 'grow_policy': 'Lossguide', 'min_data_in_leaf': 934, 'max_leaves': 175}. Best is trial 924 with value: 169.86064328905624.[0m
[32m[I 2024-10-13 11:59:37,879][0m Trial 947 finished with value: 254.70358490229677 and parameters: {'depth': 3, 'learning_rate': 0.021114258189421423, 'iterations': 2418, 'l2_leaf_reg': 3.2981511102760903, 'border_count': 1, 'bagging_temperature': 0.10841136644555836, 'random_strength': 2.5956725536016787, 'grow_policy': 'Lossguide', 'min_data_in_leaf': 980, 'max_leaves': 152}. Best is trial 924 with value: 169.86064328905624.[0m
[32m[I 2024-10-13 11:59:40,113][0m Trial 948 finished with value: 202.65858725668872 and parameters: {'depth': 9, 'learning_rate': 0.022115503407671655, 'iterations': 2230, 'l2_leaf_reg': 4.841053315210512, 'border_count': 10, 'bagging_temperature': 0.0813480389990976, 'random_strength': 2.137047219085305, 'grow_policy': 'Lossguide', 'min_data_in_leaf': 918, 'max_leaves': 158}. Best is trial 924 with value: 169.86064328905624.[0m
[32m[I 2024-10-13 11:59:42,230][0m Trial 949 finished with value: 207.57592674059063 and parameters: {'depth': 3, 'learning_rate': 0.01890907673682642, 'iterations': 2175, 'l2_leaf_reg': 6.8804121458850025, 'border_count': 14, 'bagging_temperature': 0.15326892435426412, 'random_strength': 1.7163289207740646, 'grow_policy': 'Lossguide', 'min_data_in_leaf': 954, 'max_leaves': 166}. Best is trial 924 with value: 169.86064328905624.[0m
[32m[I 2024-10-13 11:59:44,473][0m Trial 950 finished with value: 176.01371317958967 and parameters: {'depth': 3, 'learning_rate': 0.026530713308893086, 'iterations': 2361, 'l2_leaf_reg': 2.5366713361323097, 'border_count': 6, 'bagging_temperature': 0.0728055811659149, 'random_strength': 1.8797945715651525, 'grow_policy': 'Lossguide', 'min_data_in_leaf': 970, 'max_leaves': 184}. Best is trial 924 with value: 169.86064328905624.[0m
[32m[I 2024-10-13 11:59:46,623][0m Trial 951 finished with value: 173.32715889070852 and parameters: {'depth': 3, 'learning_rate': 0.020318811777171313, 'iterations': 2287, 'l2_leaf_reg': 4.4576004400093945, 'border_count': 6, 'bagging_temperature': 0.09992577644170104, 'random_strength': 2.0305674404973924, 'grow_policy': 'Lossguide', 'min_data_in_leaf': 946, 'max_leaves': 203}. Best is trial 924 with value: 169.86064328905624.[0m
[32m[I 2024-10-13 11:59:49,024][0m Trial 952 finished with value: 234.27027597527513 and parameters: {'depth': 3, 'learning_rate': 0.023823787831762942, 'iterations': 2498, 'l2_leaf_reg': 6.758114590362321, 'border_count': 163, 'bagging_temperature': 0.1332064062146337, 'random_strength': 1.7792307320435699, 'grow_policy': 'Lossguide', 'min_data_in_leaf': 999, 'max_leaves': 141}. Best is trial 924 with value: 169.86064328905624.[0m
[32m[I 2024-10-13 11:59:51,334][0m Trial 953 finished with value: 207.9111795083984 and parameters: {'depth': 3, 'learning_rate': 0.03929446171297765, 'iterations': 2430, 'l2_leaf_reg': 7.203483801281653, 'border_count': 20, 'bagging_temperature': 0.0718212477825951, 'random_strength': 1.6755130103590479, 'grow_policy': 'Lossguide', 'min_data_in_leaf': 901, 'max_leaves': 195}. Best is trial 924 with value: 169.86064328905624.[0m
[32m[I 2024-10-13 11:59:53,634][0m Trial 954 finished with value: 210.44031887770382 and parameters: {'depth': 3, 'learning_rate': 0.017831621022040257, 'iterations': 2363, 'l2_leaf_reg': 3.63282326147088, 'border_count': 31, 'bagging_temperature': 0.061358647231202115, 'random_strength': 2.3487529231536466, 'grow_policy': 'Lossguide', 'min_data_in_leaf': 934, 'max_leaves': 170}. Best is trial 924 with value: 169.86064328905624.[0m
[32m[I 2024-10-13 11:59:55,733][0m Trial 955 finished with value: 254.29025169131705 and parameters: {'depth': 3, 'learning_rate': 0.020914990878660777, 'iterations': 2150, 'l2_leaf_reg': 9.409145303939729, 'border_count': 1, 'bagging_temperature': 0.09026470062408967, 'random_strength': 2.062442309879799, 'grow_policy': 'Lossguide', 'min_data_in_leaf': 923, 'max_leaves': 148}. Best is trial 924 with value: 169.86064328905624.[0m
[32m[I 2024-10-13 11:59:57,877][0m Trial 956 finished with value: 199.84376121750154 and parameters: {'depth': 3, 'learning_rate': 0.017113428307345555, 'iterations': 2315, 'l2_leaf_reg': 2.237679932764019, 'border_count': 12, 'bagging_temperature': 0.45234548990827383, 'random_strength': 1.9056651516258258, 'grow_policy': 'Lossguide', 'min_data_in_leaf': 981, 'max_leaves': 162}. Best is trial 924 with value: 169.86064328905624.[0m
[32m[I 2024-10-13 12:00:00,068][0m Trial 957 finished with value: 179.84172202251827 and parameters: {'depth': 3, 'learning_rate': 0.029543082743749127, 'iterations': 2251, 'l2_leaf_reg': 9.717583481692452, 'border_count': 9, 'bagging_temperature': 0.23325226393618312, 'random_strength': 2.265220141525906, 'grow_policy': 'Lossguide', 'min_data_in_leaf': 960, 'max_leaves': 173}. Best is trial 924 with value: 169.86064328905624.[0m
[32m[I 2024-10-13 12:00:02,338][0m Trial 958 finished with value: 230.35646334523386 and parameters: {'depth': 3, 'learning_rate': 0.019094337731829076, 'iterations': 2388, 'l2_leaf_reg': 4.421263750173457, 'border_count': 61, 'bagging_temperature': 0.12225954194182326, 'random_strength': 1.7964635028799183, 'grow_policy': 'Lossguide', 'min_data_in_leaf': 918, 'max_leaves': 155}. Best is trial 924 with value: 169.86064328905624.[0m
[32m[I 2024-10-13 12:00:04,681][0m Trial 959 finished with value: 201.6982909373815 and parameters: {'depth': 3, 'learning_rate': 0.02472698795653997, 'iterations': 2462, 'l2_leaf_reg': 9.968452816636542, 'border_count': 17, 'bagging_temperature': 0.06074175237054784, 'random_strength': 1.6196330843377758, 'grow_policy': 'Lossguide', 'min_data_in_leaf': 901, 'max_leaves': 177}. Best is trial 924 with value: 169.86064328905624.[0m
[32m[I 2024-10-13 12:00:06,847][0m Trial 960 finished with value: 196.9146175590267 and parameters: {'depth': 3, 'learning_rate': 0.0013813981666666955, 'iterations': 2196, 'l2_leaf_reg': 4.682467404732186, 'border_count': 5, 'bagging_temperature': 0.8246883632287781, 'random_strength': 3.2791145475094656, 'grow_policy': 'Lossguide', 'min_data_in_leaf': 1000, 'max_leaves': 133}. Best is trial 924 with value: 169.86064328905624.[0m
[32m[I 2024-10-13 12:00:08,990][0m Trial 961 finished with value: 200.66245069127947 and parameters: {'depth': 3, 'learning_rate': 0.016217504301211032, 'iterations': 2287, 'l2_leaf_reg': 6.022208077451536, 'border_count': 12, 'bagging_temperature': 0.08647539398653713, 'random_strength': 1.9980119388498552, 'grow_policy': 'Lossguide', 'min_data_in_leaf': 954, 'max_leaves': 180}. Best is trial 924 with value: 169.86064328905624.[0m
[32m[I 2024-10-13 12:00:11,442][0m Trial 962 finished with value: 253.73797261666542 and parameters: {'depth': 3, 'learning_rate': 0.021761422985355154, 'iterations': 2571, 'l2_leaf_reg': 1.2829437195776094, 'border_count': 1, 'bagging_temperature': 0.6018037722038343, 'random_strength': 1.684060617566247, 'grow_policy': 'Lossguide', 'min_data_in_leaf': 974, 'max_leaves': 254}. Best is trial 924 with value: 169.86064328905624.[0m
[32m[I 2024-10-13 12:00:13,725][0m Trial 963 finished with value: 173.31459559732318 and parameters: {'depth': 7, 'learning_rate': 0.01718486020093504, 'iterations': 2405, 'l2_leaf_reg': 2.9284322964011587, 'border_count': 6, 'bagging_temperature': 0.056871812912724334, 'random_strength': 2.1789018650205367, 'grow_policy': 'Lossguide', 'min_data_in_leaf': 927, 'max_leaves': 144}. Best is trial 924 with value: 169.86064328905624.[0m
[32m[I 2024-10-13 12:00:15,924][0m Trial 964 finished with value: 202.0532284013957 and parameters: {'depth': 3, 'learning_rate': 0.020806630483375534, 'iterations': 2323, 'l2_leaf_reg': 5.442577091949549, 'border_count': 10, 'bagging_temperature': 0.10736481174471336, 'random_strength': 7.19368434130252, 'grow_policy': 'Lossguide', 'min_data_in_leaf': 887, 'max_leaves': 163}. Best is trial 924 with value: 169.86064328905624.[0m
[32m[I 2024-10-13 12:00:18,095][0m Trial 965 finished with value: 212.97164225277285 and parameters: {'depth': 9, 'learning_rate': 0.015370158137777833, 'iterations': 2210, 'l2_leaf_reg': 0.8758773940738385, 'border_count': 24, 'bagging_temperature': 0.07521732044085266, 'random_strength': 1.8105181939221489, 'grow_policy': 'Lossguide', 'min_data_in_leaf': 946, 'max_leaves': 153}. Best is trial 924 with value: 169.86064328905624.[0m
[32m[I 2024-10-13 12:00:20,419][0m Trial 966 finished with value: 199.6054405259171 and parameters: {'depth': 3, 'learning_rate': 0.018346984487859784, 'iterations': 2346, 'l2_leaf_reg': 7.1882010608694396, 'border_count': 17, 'bagging_temperature': 0.05653381265886842, 'random_strength': 2.3567877629604106, 'grow_policy': 'Lossguide', 'min_data_in_leaf': 970, 'max_leaves': 159}. Best is trial 924 with value: 169.86064328905624.[0m
