[32m[I 2024-10-13 11:31:11,926][0m Trial 103 finished with value: 230.252348330419 and parameters: {'depth': 8, 'learning_rate': 0.021263557820266937, 'iterations': 2222, 'l2_leaf_reg': 6.54440282293489e-08, 'border_count': 21, 'bagging_temperature': 0.1351160430873501, 'random_strength': 4.116664086223654, 'grow_policy': 'Depthwise', 'min_data_in_leaf': 615}. Best is trial 77 with value: 171.4904345158229.[0m
[32m[I 2024-10-13 11:31:14,203][0m Trial 104 finished with value: 205.0168277323377 and parameters: {'depth': 9, 'learning_rate': 0.007964674062814087, 'iterations': 2366, 'l2_leaf_reg': 7.478375015444986e-07, 'border_count': 13, 'bagging_temperature': 0.1626751333963955, 'random_strength': 0.5258901559603331, 'grow_policy': 'Depthwise', 'min_data_in_leaf': 449}. Best is trial 77 with value: 171.4904345158229.[0m
[32m[I 2024-10-13 11:31:16,353][0m Trial 105 finished with value: 255.66732559854668 and parameters: {'depth': 9, 'learning_rate': 0.018029771218631474, 'iterations': 2120, 'l2_leaf_reg': 1.1082192139650604e-07, 'border_count': 172, 'bagging_temperature': 0.047148648980697934, 'random_strength': 4.816919613275661, 'grow_policy': 'Depthwise', 'min_data_in_leaf': 488}. Best is trial 77 with value: 171.4904345158229.[0m
[32m[I 2024-10-13 11:31:18,126][0m Trial 106 finished with value: 175.2001599246831 and parameters: {'depth': 8, 'learning_rate': 0.03138469834018648, 'iterations': 1608, 'l2_leaf_reg': 1.7413791627060299e-06, 'border_count': 5, 'bagging_temperature': 0.1977080906071454, 'random_strength': 5.6190202274096555, 'grow_policy': 'Depthwise', 'min_data_in_leaf': 555}. Best is trial 77 with value: 171.4904345158229.[0m
[32m[I 2024-10-13 11:31:19,643][0m Trial 107 finished with value: 214.6671016452448 and parameters: {'depth': 8, 'learning_rate': 0.031709779455306834, 'iterations': 1378, 'l2_leaf_reg': 2.0096464822119993e-06, 'border_count': 2, 'bagging_temperature': 0.21035789588897572, 'random_strength': 5.469495526010613, 'grow_policy': 'Lossguide', 'min_data_in_leaf': 423, 'max_leaves': 73}. Best is trial 77 with value: 171.4904345158229.[0m
[32m[I 2024-10-13 11:31:21,084][0m Trial 108 finished with value: 200.5909422278444 and parameters: {'depth': 8, 'learning_rate': 0.010952206920036017, 'iterations': 1167, 'l2_leaf_reg': 1.8083499886185805e-07, 'border_count': 14, 'bagging_temperature': 0.2394464473481334, 'random_strength': 6.277913976206581, 'grow_policy': 'Depthwise', 'min_data_in_leaf': 592}. Best is trial 77 with value: 171.4904345158229.[0m
[32m[I 2024-10-13 11:31:22,864][0m Trial 109 finished with value: 174.10922634582224 and parameters: {'depth': 10, 'learning_rate': 0.02541981193029842, 'iterations': 1633, 'l2_leaf_reg': 1.0623006399616254e-06, 'border_count': 5, 'bagging_temperature': 0.17853658963338376, 'random_strength': 5.21451238056893, 'grow_policy': 'Depthwise', 'min_data_in_leaf': 565}. Best is trial 77 with value: 171.4904345158229.[0m
[32m[I 2024-10-13 11:31:24,557][0m Trial 110 finished with value: 217.95947169562706 and parameters: {'depth': 10, 'learning_rate': 0.013397818863615454, 'iterations': 1621, 'l2_leaf_reg': 3.5156809006163544e-06, 'border_count': 21, 'bagging_temperature': 0.1853163954499329, 'random_strength': 5.082474889958229, 'grow_policy': 'Depthwise', 'min_data_in_leaf': 517}. Best is trial 77 with value: 171.4904345158229.[0m
[32m[I 2024-10-13 11:31:26,316][0m Trial 111 finished with value: 174.84055526947935 and parameters: {'depth': 10, 'learning_rate': 0.025450664610237896, 'iterations': 1533, 'l2_leaf_reg': 1.2086103043339007e-06, 'border_count': 6, 'bagging_temperature': 0.13052674196182135, 'random_strength': 5.439542619876995, 'grow_policy': 'Depthwise', 'min_data_in_leaf': 676}. Best is trial 77 with value: 171.4904345158229.[0m
[32m[I 2024-10-13 11:31:27,984][0m Trial 112 finished with value: 254.3608537704752 and parameters: {'depth': 9, 'learning_rate': 0.025728679581931865, 'iterations': 1538, 'l2_leaf_reg': 1.463360811395872e-06, 'border_count': 1, 'bagging_temperature': 0.14593796780249754, 'random_strength': 5.361244475875261, 'grow_policy': 'Depthwise', 'min_data_in_leaf': 680}. Best is trial 77 with value: 171.4904345158229.[0m
[32m[I 2024-10-13 11:31:29,544][0m Trial 113 finished with value: 173.11303121276273 and parameters: {'depth': 10, 'learning_rate': 0.02197651957214067, 'iterations': 1461, 'l2_leaf_reg': 9.520488468025092e-07, 'border_count': 7, 'bagging_temperature': 0.08036302845370624, 'random_strength': 4.836132846748095, 'grow_policy': 'Depthwise', 'min_data_in_leaf': 655}. Best is trial 77 with value: 171.4904345158229.[0m
[32m[I 2024-10-13 11:31:31,169][0m Trial 114 finished with value: 173.6505116570654 and parameters: {'depth': 10, 'learning_rate': 0.019378852238314603, 'iterations': 1431, 'l2_leaf_reg': 9.844848022915227e-07, 'border_count': 6, 'bagging_temperature': 0.07248158106463073, 'random_strength': 5.673845072909359, 'grow_policy': 'Depthwise', 'min_data_in_leaf': 650}. Best is trial 77 with value: 171.4904345158229.[0m
[32m[I 2024-10-13 11:31:32,753][0m Trial 115 finished with value: 210.04565005684998 and parameters: {'depth': 10, 'learning_rate': 0.019638277855738608, 'iterations': 1410, 'l2_leaf_reg': 8.982565646232355e-07, 'border_count': 13, 'bagging_temperature': 0.07512479495323991, 'random_strength': 5.9073578311282, 'grow_policy': 'Depthwise', 'min_data_in_leaf': 697}. Best is trial 77 with value: 171.4904345158229.[0m
[32m[I 2024-10-13 11:31:34,390][0m Trial 116 finished with value: 211.03886912466933 and parameters: {'depth': 10, 'learning_rate': 0.015984645687968688, 'iterations': 1457, 'l2_leaf_reg': 3.754292340823226e-06, 'border_count': 28, 'bagging_temperature': 0.17782803132161348, 'random_strength': 4.944236835266744, 'grow_policy': 'Depthwise', 'min_data_in_leaf': 661}. Best is trial 77 with value: 171.4904345158229.[0m
[32m[I 2024-10-13 11:31:35,889][0m Trial 117 finished with value: 195.98222772388854 and parameters: {'depth': 10, 'learning_rate': 0.01068134349050253, 'iterations': 1210, 'l2_leaf_reg': 5.038648703346874e-07, 'border_count': 18, 'bagging_temperature': 0.0984562127423779, 'random_strength': 5.800132694484651, 'grow_policy': 'Depthwise', 'min_data_in_leaf': 633}. Best is trial 77 with value: 171.4904345158229.[0m
[32m[I 2024-10-13 11:31:37,544][0m Trial 118 finished with value: 254.02516273165898 and parameters: {'depth': 8, 'learning_rate': 0.022819196029927467, 'iterations': 1521, 'l2_leaf_reg': 1.5901690634651555e-06, 'border_count': 1, 'bagging_temperature': 0.12704478115604878, 'random_strength': 4.7392001089854086, 'grow_policy': 'Depthwise', 'min_data_in_leaf': 712}. Best is trial 77 with value: 171.4904345158229.[0m
[32m[I 2024-10-13 11:31:39,176][0m Trial 119 finished with value: 175.59493003937715 and parameters: {'depth': 9, 'learning_rate': 0.013109443339517015, 'iterations': 1385, 'l2_leaf_reg': 6.336713206094747e-06, 'border_count': 6, 'bagging_temperature': 0.2156476615090044, 'random_strength': 4.482704019550505, 'grow_policy': 'Depthwise', 'min_data_in_leaf': 652}. Best is trial 77 with value: 171.4904345158229.[0m
[32m[I 2024-10-13 11:31:40,988][0m Trial 120 finished with value: 219.70546576000066 and parameters: {'depth': 10, 'learning_rate': 0.028127693044337997, 'iterations': 1740, 'l2_leaf_reg': 1.0392974105464793e-06, 'border_count': 23, 'bagging_temperature': 0.1593491555788064, 'random_strength': 6.137949246191227, 'grow_policy': 'Depthwise', 'min_data_in_leaf': 725}. Best is trial 77 with value: 171.4904345158229.[0m
[32m[I 2024-10-13 11:31:42,714][0m Trial 121 finished with value: 174.34144939781828 and parameters: {'depth': 9, 'learning_rate': 0.023377344867437023, 'iterations': 1655, 'l2_leaf_reg': 5.087017480263105e-07, 'border_count': 6, 'bagging_temperature': 0.06936217457752317, 'random_strength': 5.2643044846318805, 'grow_policy': 'Depthwise', 'min_data_in_leaf': 562}. Best is trial 77 with value: 171.4904345158229.[0m
[32m[I 2024-10-13 11:31:44,429][0m Trial 122 finished with value: 202.2342148676215 and parameters: {'depth': 9, 'learning_rate': 0.017642636987063094, 'iterations': 1647, 'l2_leaf_reg': 6.026888383053332e-07, 'border_count': 10, 'bagging_temperature': 0.08172320368141373, 'random_strength': 5.172314692295808, 'grow_policy': 'Depthwise', 'min_data_in_leaf': 563}. Best is trial 77 with value: 171.4904345158229.[0m
[32m[I 2024-10-13 11:31:46,183][0m Trial 123 finished with value: 231.57663861908767 and parameters: {'depth': 8, 'learning_rate': 0.02134729943556658, 'iterations': 1566, 'l2_leaf_reg': 1.6630827056358325e-06, 'border_count': 86, 'bagging_temperature': 0.10711859593178509, 'random_strength': 5.581386711989138, 'grow_policy': 'Depthwise', 'min_data_in_leaf': 624}. Best is trial 77 with value: 171.4904345158229.[0m
[32m[I 2024-10-13 11:31:47,961][0m Trial 124 finished with value: 207.87787893937676 and parameters: {'depth': 10, 'learning_rate': 0.025597959022121874, 'iterations': 1683, 'l2_leaf_reg': 4.471987381703778e-07, 'border_count': 16, 'bagging_temperature': 0.13488559281859874, 'random_strength': 5.348339675596814, 'grow_policy': 'Depthwise', 'min_data_in_leaf': 599}. Best is trial 77 with value: 171.4904345158229.[0m
[32m[I 2024-10-13 11:31:49,512][0m Trial 125 finished with value: 173.078836737502 and parameters: {'depth': 7, 'learning_rate': 0.014597104352081053, 'iterations': 1339, 'l2_leaf_reg': 2.7939237890005834e-06, 'border_count': 5, 'bagging_temperature': 0.07044258007370502, 'random_strength': 5.668887049546566, 'grow_policy': 'Depthwise', 'min_data_in_leaf': 575}. Best is trial 77 with value: 171.4904345158229.[0m
[32m[I 2024-10-13 11:31:50,779][0m Trial 126 finished with value: 174.53798979599358 and parameters: {'depth': 11, 'learning_rate': 0.014808958497553211, 'iterations': 1045, 'l2_leaf_reg': 8.167117840879998e-07, 'border_count': 6, 'bagging_temperature': 0.06192901537430515, 'random_strength': 6.015807177587828, 'grow_policy': 'Lossguide', 'min_data_in_leaf': 680, 'max_leaves': 131}. Best is trial 77 with value: 171.4904345158229.[0m
[32m[I 2024-10-13 11:31:52,101][0m Trial 127 finished with value: 195.5018650024861 and parameters: {'depth': 11, 'learning_rate': 0.01355878955931601, 'iterations': 1020, 'l2_leaf_reg': 3.7476477766873194e-06, 'border_count': 12, 'bagging_temperature': 0.07393200799628374, 'random_strength': 4.5503291543530935, 'grow_policy': 'Lossguide', 'min_data_in_leaf': 679, 'max_leaves': 132}. Best is trial 77 with value: 171.4904345158229.[0m
[32m[I 2024-10-13 11:31:53,750][0m Trial 128 finished with value: 210.64079734996278 and parameters: {'depth': 11, 'learning_rate': 0.007061275242081508, 'iterations': 1458, 'l2_leaf_reg': 1.049526123922698e-06, 'border_count': 21, 'bagging_temperature': 0.0001562518432254162, 'random_strength': 6.151048567554165, 'grow_policy': 'Lossguide', 'min_data_in_leaf': 775, 'max_leaves': 144}. Best is trial 77 with value: 171.4904345158229.[0m
[32m[I 2024-10-13 11:31:55,061][0m Trial 129 finished with value: 253.39198066501365 and parameters: {'depth': 11, 'learning_rate': 0.015092661498127316, 'iterations': 956, 'l2_leaf_reg': 7.999816474457396e-07, 'border_count': 1, 'bagging_temperature': 0.08897184211963532, 'random_strength': 6.328621375100391, 'grow_policy': 'Lossguide', 'min_data_in_leaf': 644, 'max_leaves': 173}. Best is trial 77 with value: 171.4904345158229.[0m
[32m[I 2024-10-13 11:31:56,245][0m Trial 130 finished with value: 192.1362532584381 and parameters: {'depth': 10, 'learning_rate': 0.009832141016538298, 'iterations': 858, 'l2_leaf_reg': 2.095695604341215e-07, 'border_count': 12, 'bagging_temperature': 0.062490932986307667, 'random_strength': 5.949723733216668, 'grow_policy': 'Lossguide', 'min_data_in_leaf': 573, 'max_leaves': 78}. Best is trial 77 with value: 171.4904345158229.[0m
[32m[I 2024-10-13 11:31:57,800][0m Trial 131 finished with value: 253.0162220343118 and parameters: {'depth': 7, 'learning_rate': 0.018303855130327683, 'iterations': 1226, 'l2_leaf_reg': 6.714954891725665e-07, 'border_count': 205, 'bagging_temperature': 0.11042246134492908, 'random_strength': 5.18878272977699, 'grow_policy': 'Depthwise', 'min_data_in_leaf': 611}. Best is trial 77 with value: 171.4904345158229.[0m
[32m[I 2024-10-13 11:31:59,426][0m Trial 132 finished with value: 172.4961804283841 and parameters: {'depth': 9, 'learning_rate': 0.021702938942715657, 'iterations': 1357, 'l2_leaf_reg': 2.935859287657608e-06, 'border_count': 7, 'bagging_temperature': 0.055930590446783, 'random_strength': 0.9442096544067278, 'grow_policy': 'Lossguide', 'min_data_in_leaf': 692, 'max_leaves': 123}. Best is trial 77 with value: 171.4904345158229.[0m
[32m[I 2024-10-13 11:32:00,886][0m Trial 133 finished with value: 195.0900771104629 and parameters: {'depth': 10, 'learning_rate': 0.008731435942893839, 'iterations': 1077, 'l2_leaf_reg': 2.8488842947550853e-06, 'border_count': 17, 'bagging_temperature': 0.056880716087487224, 'random_strength': 0.5877405307984348, 'grow_policy': 'Lossguide', 'min_data_in_leaf': 739, 'max_leaves': 125}. Best is trial 77 with value: 171.4904345158229.[0m
[32m[I 2024-10-13 11:32:02,404][0m Trial 134 finished with value: 174.82564035747149 and parameters: {'depth': 9, 'learning_rate': 0.011532352657019868, 'iterations': 1317, 'l2_leaf_reg': 1.001280384236124e-05, 'border_count': 6, 'bagging_temperature': 0.08961365319863349, 'random_strength': 3.1172843765033273, 'grow_policy': 'Lossguide', 'min_data_in_leaf': 695, 'max_leaves': 156}. Best is trial 77 with value: 171.4904345158229.[0m
[32m[I 2024-10-13 11:32:03,949][0m Trial 135 finished with value: 200.26036860664192 and parameters: {'depth': 9, 'learning_rate': 0.012378759688690061, 'iterations': 1361, 'l2_leaf_reg': 2.596517687553243e-05, 'border_count': 11, 'bagging_temperature': 0.08065081410317751, 'random_strength': 2.951096308307288, 'grow_policy': 'Lossguide', 'min_data_in_leaf': 711, 'max_leaves': 157}. Best is trial 77 with value: 171.4904345158229.[0m
[32m[I 2024-10-13 11:32:05,448][0m Trial 136 finished with value: 254.70709463522118 and parameters: {'depth': 9, 'learning_rate': 0.006819156634222701, 'iterations': 1307, 'l2_leaf_reg': 5.3918581668933285e-06, 'border_count': 1, 'bagging_temperature': 0.012974632950332951, 'random_strength': 3.4306363961449757, 'grow_policy': 'Lossguide', 'min_data_in_leaf': 694, 'max_leaves': 129}. Best is trial 77 with value: 171.4904345158229.[0m
[32m[I 2024-10-13 11:32:06,495][0m Trial 137 finished with value: 213.46464106171425 and parameters: {'depth': 9, 'learning_rate': 0.004413601994011185, 'iterations': 690, 'l2_leaf_reg': 9.72627396552174e-06, 'border_count': 26, 'bagging_temperature': 0.050071340082096454, 'random_strength': 1.557592856164102, 'grow_policy': 'Lossguide', 'min_data_in_leaf': 583, 'max_leaves': 161}. Best is trial 77 with value: 171.4904345158229.[0m
[32m[I 2024-10-13 11:32:07,874][0m Trial 138 finished with value: 200.13336240001934 and parameters: {'depth': 9, 'learning_rate': 0.02117186137466208, 'iterations': 1216, 'l2_leaf_reg': 2.3282867660029933e-06, 'border_count': 17, 'bagging_temperature': 0.09079458050086096, 'random_strength': 0.8787916139211086, 'grow_policy': 'Lossguide', 'min_data_in_leaf': 667, 'max_leaves': 113}. Best is trial 77 with value: 171.4904345158229.[0m
[32m[I 2024-10-13 11:32:09,401][0m Trial 139 finished with value: 180.9529673292514 and parameters: {'depth': 10, 'learning_rate': 0.014832048646313267, 'iterations': 1319, 'l2_leaf_reg': 0.0059000310801430355, 'border_count': 9, 'bagging_temperature': 0.058857522111071245, 'random_strength': 0.025847374192348394, 'grow_policy': 'Lossguide', 'min_data_in_leaf': 755, 'max_leaves': 187}. Best is trial 77 with value: 171.4904345158229.[0m
[32m[I 2024-10-13 11:32:10,962][0m Trial 140 finished with value: 173.51211717743877 and parameters: {'depth': 11, 'learning_rate': 0.012063321117835353, 'iterations': 1452, 'l2_leaf_reg': 8.115126401670644e-06, 'border_count': 6, 'bagging_temperature': 0.0165042707396547, 'random_strength': 2.3157799244426016, 'grow_policy': 'Lossguide', 'min_data_in_leaf': 621, 'max_leaves': 144}. Best is trial 77 with value: 171.4904345158229.[0m
[32m[I 2024-10-13 11:32:12,388][0m Trial 141 finished with value: 174.32080101268608 and parameters: {'depth': 11, 'learning_rate': 0.011831997718076664, 'iterations': 1265, 'l2_leaf_reg': 7.089426306613244e-06, 'border_count': 6, 'bagging_temperature': 0.029738279559087116, 'random_strength': 1.8353060998220607, 'grow_policy': 'Lossguide', 'min_data_in_leaf': 635, 'max_leaves': 145}. Best is trial 77 with value: 171.4904345158229.[0m
[32m[I 2024-10-13 11:32:14,073][0m Trial 142 finished with value: 209.7093256964589 and parameters: {'depth': 11, 'learning_rate': 0.017381963529594965, 'iterations': 1486, 'l2_leaf_reg': 4.758726181985617e-06, 'border_count': 13, 'bagging_temperature': 0.018487684813824, 'random_strength': 1.7446130625749376, 'grow_policy': 'Lossguide', 'min_data_in_leaf': 623, 'max_leaves': 140}. Best is trial 77 with value: 171.4904345158229.[0m
[32m[I 2024-10-13 11:32:15,505][0m Trial 143 finished with value: 173.6226266175742 and parameters: {'depth': 12, 'learning_rate': 0.015142480863987381, 'iterations': 1249, 'l2_leaf_reg': 2.482273762691489e-06, 'border_count': 6, 'bagging_temperature': 0.0491752868308746, 'random_strength': 1.0454682517523226, 'grow_policy': 'Lossguide', 'min_data_in_leaf': 647, 'max_leaves': 117}. Best is trial 77 with value: 171.4904345158229.[0m
[32m[I 2024-10-13 11:32:17,121][0m Trial 144 finished with value: 194.70711396939842 and parameters: {'depth': 13, 'learning_rate': 0.008472265889782891, 'iterations': 1436, 'l2_leaf_reg': 2.3417989180893402e-06, 'border_count': 20, 'bagging_temperature': 0.03106456293913994, 'random_strength': 0.9464316626538687, 'grow_policy': 'Lossguide', 'min_data_in_leaf': 637, 'max_leaves': 86}. Best is trial 77 with value: 171.4904345158229.[0m
[32m[I 2024-10-13 11:32:18,470][0m Trial 145 finished with value: 253.66109563385814 and parameters: {'depth': 12, 'learning_rate': 0.022840198037974505, 'iterations': 1151, 'l2_leaf_reg': 1.7145442443356135e-05, 'border_count': 1, 'bagging_temperature': 0.03990448752291584, 'random_strength': 1.3147857943850032, 'grow_policy': 'Lossguide', 'min_data_in_leaf': 601, 'max_leaves': 121}. Best is trial 77 with value: 171.4904345158229.[0m
[32m[I 2024-10-13 11:32:20,026][0m Trial 146 finished with value: 204.63094186882327 and parameters: {'depth': 12, 'learning_rate': 0.010316301164699051, 'iterations': 1372, 'l2_leaf_reg': 8.133883059041895e-06, 'border_count': 31, 'bagging_temperature': 0.016770363839217553, 'random_strength': 0.5300473112755313, 'grow_policy': 'Lossguide', 'min_data_in_leaf': 657, 'max_leaves': 145}. Best is trial 77 with value: 171.4904345158229.[0m
[32m[I 2024-10-13 11:32:21,468][0m Trial 147 finished with value: 193.54568302063623 and parameters: {'depth': 12, 'learning_rate': 0.00520127072843703, 'iterations': 1230, 'l2_leaf_reg': 3.5441932318856598e-06, 'border_count': 11, 'bagging_temperature': 0.7819817184154146, 'random_strength': 2.2305128714085356, 'grow_policy': 'Lossguide', 'min_data_in_leaf': 577, 'max_leaves': 166}. Best is trial 77 with value: 171.4904345158229.[0m
[32m[I 2024-10-13 11:32:22,928][0m Trial 148 finished with value: 172.5659857666798 and parameters: {'depth': 11, 'learning_rate': 0.017815884877454818, 'iterations': 1253, 'l2_leaf_reg': 1.6145148767334957e-06, 'border_count': 6, 'bagging_temperature': 0.00046422244804884133, 'random_strength': 1.2828538841364043, 'grow_policy': 'Lossguide', 'min_data_in_leaf': 611, 'max_leaves': 183}. Best is trial 77 with value: 171.4904345158229.[0m
[32m[I 2024-10-13 11:32:24,412][0m Trial 149 finished with value: 198.8706516638403 and parameters: {'depth': 11, 'learning_rate': 0.017690444500981624, 'iterations': 1248, 'l2_leaf_reg': 1.4643563422412787e-06, 'border_count': 16, 'bagging_temperature': 0.04018051531624736, 'random_strength': 1.1868881239201365, 'grow_policy': 'Lossguide', 'min_data_in_leaf': 532, 'max_leaves': 189}. Best is trial 77 with value: 171.4904345158229.[0m
[32m[I 2024-10-13 11:32:25,840][0m Trial 150 finished with value: 209.16586118347595 and parameters: {'depth': 11, 'learning_rate': 0.01960172721649247, 'iterations': 1285, 'l2_leaf_reg': 5.103675854918463e-06, 'border_count': 24, 'bagging_temperature': 0.001333044373669226, 'random_strength': 1.7861090552680432, 'grow_policy': 'Lossguide', 'min_data_in_leaf': 563, 'max_leaves': 180}. Best is trial 77 with value: 171.4904345158229.[0m
[32m[I 2024-10-13 11:32:27,448][0m Trial 151 finished with value: 174.25345744491918 and parameters: {'depth': 13, 'learning_rate': 0.012512817570628693, 'iterations': 1406, 'l2_leaf_reg': 5.431085189953932e-07, 'border_count': 6, 'bagging_temperature': 0.07184329687404056, 'random_strength': 0.871604838265148, 'grow_policy': 'Lossguide', 'min_data_in_leaf': 609, 'max_leaves': 112}. Best is trial 77 with value: 171.4904345158229.[0m
[32m[I 2024-10-13 11:32:28,982][0m Trial 152 finished with value: 172.48138821501564 and parameters: {'depth': 13, 'learning_rate': 0.013645431779355134, 'iterations': 1348, 'l2_leaf_reg': 1.124426492605821e-06, 'border_count': 8, 'bagging_temperature': 0.06845992393218794, 'random_strength': 1.8779956090388652, 'grow_policy': 'Lossguide', 'min_data_in_leaf': 628, 'max_leaves': 114}. Best is trial 77 with value: 171.4904345158229.[0m
