[32m[I 2024-10-13 11:49:07,742][0m Trial 664 finished with value: 253.73759822301668 and parameters: {'depth': 4, 'learning_rate': 0.013738386410071088, 'iterations': 2026, 'l2_leaf_reg': 6.094093607136547e-08, 'border_count': 1, 'bagging_temperature': 0.015589003702752655, 'random_strength': 1.6026370953640283, 'grow_policy': 'Depthwise', 'min_data_in_leaf': 834}. Best is trial 306 with value: 170.64979827273262.[0m
[32m[I 2024-10-13 11:49:09,745][0m Trial 665 finished with value: 171.31185041403117 and parameters: {'depth': 4, 'learning_rate': 0.010715439713428419, 'iterations': 1992, 'l2_leaf_reg': 9.147125557315362e-08, 'border_count': 8, 'bagging_temperature': 0.003136095624547794, 'random_strength': 1.5412021609936906, 'grow_policy': 'Depthwise', 'min_data_in_leaf': 804}. Best is trial 306 with value: 170.64979827273262.[0m
[32m[I 2024-10-13 11:49:11,822][0m Trial 666 finished with value: 198.5956519748909 and parameters: {'depth': 4, 'learning_rate': 0.007696691693262673, 'iterations': 2083, 'l2_leaf_reg': 8.349445951505551e-08, 'border_count': 15, 'bagging_temperature': 0.5785571093685542, 'random_strength': 1.9801920526701815, 'grow_policy': 'Depthwise', 'min_data_in_leaf': 784}. Best is trial 306 with value: 170.64979827273262.[0m
[32m[I 2024-10-13 11:49:13,920][0m Trial 667 finished with value: 250.93147134474648 and parameters: {'depth': 4, 'learning_rate': 0.008954547930844742, 'iterations': 2015, 'l2_leaf_reg': 1.7996377069036582e-08, 'border_count': 251, 'bagging_temperature': 0.00231054655038908, 'random_strength': 1.5798413120131354, 'grow_policy': 'Depthwise', 'min_data_in_leaf': 829}. Best is trial 306 with value: 170.64979827273262.[0m
[32m[I 2024-10-13 11:49:15,963][0m Trial 668 finished with value: 206.39068296350723 and parameters: {'depth': 4, 'learning_rate': 0.009528038636372266, 'iterations': 1998, 'l2_leaf_reg': 5.747864187235207e-08, 'border_count': 23, 'bagging_temperature': 0.4680244158895231, 'random_strength': 1.7309134281951777, 'grow_policy': 'Depthwise', 'min_data_in_leaf': 880}. Best is trial 306 with value: 170.64979827273262.[0m
[32m[I 2024-10-13 11:49:18,073][0m Trial 669 finished with value: 198.3186296998582 and parameters: {'depth': 4, 'learning_rate': 0.009235971452827804, 'iterations': 2054, 'l2_leaf_reg': 8.873301767860823e-08, 'border_count': 10, 'bagging_temperature': 0.0005883297033433543, 'random_strength': 1.43293710106177, 'grow_policy': 'Depthwise', 'min_data_in_leaf': 811}. Best is trial 306 with value: 170.64979827273262.[0m
[32m[I 2024-10-13 11:49:25,367][0m Trial 670 finished with value: 218.85316212219934 and parameters: {'depth': 4, 'learning_rate': 0.011022987967013238, 'iterations': 2140, 'l2_leaf_reg': 3.6239949400504394e-08, 'border_count': 16, 'bagging_temperature': 0.017773695245728482, 'random_strength': 1.5787777380519072, 'grow_policy': 'SymmetricTree', 'min_data_in_leaf': 818}. Best is trial 306 with value: 170.64979827273262.[0m
[32m[I 2024-10-13 11:49:27,409][0m Trial 671 finished with value: 178.80533783436735 and parameters: {'depth': 4, 'learning_rate': 0.011149720090471545, 'iterations': 1978, 'l2_leaf_reg': 9.919433872773197e-08, 'border_count': 9, 'bagging_temperature': 0.0004308644428807731, 'random_strength': 1.8021909038873072, 'grow_policy': 'Depthwise', 'min_data_in_leaf': 856}. Best is trial 306 with value: 170.64979827273262.[0m
[32m[I 2024-10-13 11:49:29,352][0m Trial 672 finished with value: 174.5802801730359 and parameters: {'depth': 4, 'learning_rate': 0.007372533627145928, 'iterations': 1918, 'l2_leaf_reg': 2.252358313896292e-08, 'border_count': 6, 'bagging_temperature': 0.031978573696331405, 'random_strength': 1.5225928096359602, 'grow_policy': 'Depthwise', 'min_data_in_leaf': 818}. Best is trial 306 with value: 170.64979827273262.[0m
[32m[I 2024-10-13 11:49:31,520][0m Trial 673 finished with value: 208.66844611638408 and parameters: {'depth': 4, 'learning_rate': 0.012218116587105678, 'iterations': 1952, 'l2_leaf_reg': 5.333188185539179e-08, 'border_count': 30, 'bagging_temperature': 0.0006040671351182983, 'random_strength': 1.3209162261757168, 'grow_policy': 'Depthwise', 'min_data_in_leaf': 782}. Best is trial 306 with value: 170.64979827273262.[0m
[32m[I 2024-10-13 11:49:33,563][0m Trial 674 finished with value: 206.74451709548208 and parameters: {'depth': 4, 'learning_rate': 0.009805956018042709, 'iterations': 2074, 'l2_leaf_reg': 7.43138875870912e-08, 'border_count': 13, 'bagging_temperature': 0.022837901289107253, 'random_strength': 1.37385795195893, 'grow_policy': 'Depthwise', 'min_data_in_leaf': 840}. Best is trial 306 with value: 170.64979827273262.[0m
[32m[I 2024-10-13 11:49:35,564][0m Trial 675 finished with value: 199.31878568547504 and parameters: {'depth': 4, 'learning_rate': 0.013478599193477173, 'iterations': 1929, 'l2_leaf_reg': 9.31287093545068e-08, 'border_count': 20, 'bagging_temperature': 0.03523074629882897, 'random_strength': 1.9514719183537002, 'grow_policy': 'Depthwise', 'min_data_in_leaf': 805}. Best is trial 306 with value: 170.64979827273262.[0m
[32m[I 2024-10-13 11:49:37,557][0m Trial 676 finished with value: 179.66004830600093 and parameters: {'depth': 4, 'learning_rate': 0.010963260037684674, 'iterations': 1989, 'l2_leaf_reg': 2.9626274445255837e-08, 'border_count': 9, 'bagging_temperature': 0.01815720255793233, 'random_strength': 2.1227417940725006, 'grow_policy': 'Depthwise', 'min_data_in_leaf': 816}. Best is trial 306 with value: 170.64979827273262.[0m
[32m[I 2024-10-13 11:49:39,552][0m Trial 677 finished with value: 172.17574159958107 and parameters: {'depth': 4, 'learning_rate': 0.014286195679339567, 'iterations': 1933, 'l2_leaf_reg': 1.2199826354783834e-07, 'border_count': 7, 'bagging_temperature': 0.04158979022733185, 'random_strength': 1.3223303624726506, 'grow_policy': 'Depthwise', 'min_data_in_leaf': 839}. Best is trial 306 with value: 170.64979827273262.[0m
[32m[I 2024-10-13 11:49:41,466][0m Trial 678 finished with value: 253.74270116897853 and parameters: {'depth': 4, 'learning_rate': 0.012814682516004854, 'iterations': 1899, 'l2_leaf_reg': 1.2663159456419439e-08, 'border_count': 1, 'bagging_temperature': 0.01752689260964475, 'random_strength': 1.4666306671126428, 'grow_policy': 'Depthwise', 'min_data_in_leaf': 791}. Best is trial 306 with value: 170.64979827273262.[0m
[32m[I 2024-10-13 11:49:43,616][0m Trial 679 finished with value: 225.9975789199892 and parameters: {'depth': 5, 'learning_rate': 0.008581711120101289, 'iterations': 2009, 'l2_leaf_reg': 4.1371254468106963e-08, 'border_count': 55, 'bagging_temperature': 0.04455055725634062, 'random_strength': 1.8275178518289614, 'grow_policy': 'Depthwise', 'min_data_in_leaf': 802}. Best is trial 306 with value: 170.64979827273262.[0m
[32m[I 2024-10-13 11:49:45,662][0m Trial 680 finished with value: 205.79319577931923 and parameters: {'depth': 5, 'learning_rate': 0.011312925369993558, 'iterations': 2175, 'l2_leaf_reg': 6.004869143328745e-08, 'border_count': 15, 'bagging_temperature': 0.00041904961586044023, 'random_strength': 1.1126658692291356, 'grow_policy': 'Depthwise', 'min_data_in_leaf': 872}. Best is trial 306 with value: 170.64979827273262.[0m
[32m[I 2024-10-13 11:49:47,696][0m Trial 681 finished with value: 206.3476542174025 and parameters: {'depth': 4, 'learning_rate': 0.014674827485190667, 'iterations': 2052, 'l2_leaf_reg': 9.435691394348078e-08, 'border_count': 11, 'bagging_temperature': 0.024231790128277517, 'random_strength': 1.7114354910270395, 'grow_policy': 'Depthwise', 'min_data_in_leaf': 781}. Best is trial 306 with value: 170.64979827273262.[0m
[32m[I 2024-10-13 11:49:49,637][0m Trial 682 finished with value: 181.60839060874184 and parameters: {'depth': 4, 'learning_rate': 0.010580267828002676, 'iterations': 1917, 'l2_leaf_reg': 5.437674341252044e-08, 'border_count': 5, 'bagging_temperature': 0.8961859574013508, 'random_strength': 2.350641284562109, 'grow_policy': 'Depthwise', 'min_data_in_leaf': 818}. Best is trial 306 with value: 170.64979827273262.[0m
[32m[I 2024-10-13 11:49:51,743][0m Trial 683 finished with value: 195.0667642889218 and parameters: {'depth': 5, 'learning_rate': 0.006293175862364245, 'iterations': 1990, 'l2_leaf_reg': 1.050509546373516e-07, 'border_count': 19, 'bagging_temperature': 0.05143359474660127, 'random_strength': 1.2460947440498942, 'grow_policy': 'Depthwise', 'min_data_in_leaf': 999}. Best is trial 306 with value: 170.64979827273262.[0m
[32m[I 2024-10-13 11:49:53,775][0m Trial 684 finished with value: 171.5104313869642 and parameters: {'depth': 4, 'learning_rate': 0.015124044172941041, 'iterations': 1894, 'l2_leaf_reg': 2.779550191405934e-08, 'border_count': 5, 'bagging_temperature': 0.0006840037632811699, 'random_strength': 1.5222658180379474, 'grow_policy': 'Depthwise', 'min_data_in_leaf': 837}. Best is trial 306 with value: 170.64979827273262.[0m
[32m[I 2024-10-13 11:49:55,736][0m Trial 685 finished with value: 253.82281411130975 and parameters: {'depth': 4, 'learning_rate': 0.012396973583038092, 'iterations': 1896, 'l2_leaf_reg': 1.7906852444592148e-08, 'border_count': 1, 'bagging_temperature': 0.017389828084713052, 'random_strength': 1.6304351655120688, 'grow_policy': 'Depthwise', 'min_data_in_leaf': 833}. Best is trial 306 with value: 170.64979827273262.[0m
[32m[I 2024-10-13 11:49:57,744][0m Trial 686 finished with value: 210.33913035305207 and parameters: {'depth': 4, 'learning_rate': 0.015358570874954847, 'iterations': 1934, 'l2_leaf_reg': 2.7513730893228553e-08, 'border_count': 13, 'bagging_temperature': 0.0015213630597259546, 'random_strength': 1.5242731873359894, 'grow_policy': 'Depthwise', 'min_data_in_leaf': 858}. Best is trial 306 with value: 170.64979827273262.[0m
[32m[I 2024-10-13 11:49:59,720][0m Trial 687 finished with value: 245.43741378270033 and parameters: {'depth': 5, 'learning_rate': 0.013971411479635163, 'iterations': 1966, 'l2_leaf_reg': 1.037678803999021e-08, 'border_count': 231, 'bagging_temperature': 0.5058151820517723, 'random_strength': 1.2853778736818802, 'grow_policy': 'Depthwise', 'min_data_in_leaf': 829}. Best is trial 306 with value: 170.64979827273262.[0m
[32m[I 2024-10-13 11:50:01,646][0m Trial 688 finished with value: 171.6743150738037 and parameters: {'depth': 5, 'learning_rate': 0.009291901334806263, 'iterations': 1880, 'l2_leaf_reg': 2.575577132647364e-08, 'border_count': 8, 'bagging_temperature': 0.0001768511227710698, 'random_strength': 1.4752078293907793, 'grow_policy': 'Depthwise', 'min_data_in_leaf': 881}. Best is trial 306 with value: 170.64979827273262.[0m
[32m[I 2024-10-13 11:50:03,520][0m Trial 689 finished with value: 213.76873813726257 and parameters: {'depth': 5, 'learning_rate': 0.00799385575934232, 'iterations': 1885, 'l2_leaf_reg': 2.2029440323544844e-08, 'border_count': 21, 'bagging_temperature': 0.0035147679551550065, 'random_strength': 1.0748892705392683, 'grow_policy': 'Depthwise', 'min_data_in_leaf': 898}. Best is trial 306 with value: 170.64979827273262.[0m
[32m[I 2024-10-13 11:50:05,574][0m Trial 690 finished with value: 178.91604658329155 and parameters: {'depth': 5, 'learning_rate': 0.009280818011999118, 'iterations': 2082, 'l2_leaf_reg': 1.4921791247665825e-08, 'border_count': 9, 'bagging_temperature': 0.0009035903181709267, 'random_strength': 1.6480070705276124, 'grow_policy': 'Depthwise', 'min_data_in_leaf': 899}. Best is trial 306 with value: 170.64979827273262.[0m
[32m[I 2024-10-13 11:50:07,549][0m Trial 691 finished with value: 198.98993965445177 and parameters: {'depth': 5, 'learning_rate': 0.005359255839835233, 'iterations': 1991, 'l2_leaf_reg': 1.9921947580571808e-08, 'border_count': 15, 'bagging_temperature': 0.002520619763694329, 'random_strength': 1.868757989308242, 'grow_policy': 'Depthwise', 'min_data_in_leaf': 816}. Best is trial 306 with value: 170.64979827273262.[0m
[32m[I 2024-10-13 11:50:14,159][0m Trial 692 finished with value: 199.69093639548808 and parameters: {'depth': 5, 'learning_rate': 0.007310451191008465, 'iterations': 1886, 'l2_leaf_reg': 4.020216738960201e-08, 'border_count': 9, 'bagging_temperature': 0.0015443951154479362, 'random_strength': 1.5366814869402403, 'grow_policy': 'SymmetricTree', 'min_data_in_leaf': 942}. Best is trial 306 with value: 170.64979827273262.[0m
[32m[I 2024-10-13 11:50:16,102][0m Trial 693 finished with value: 206.541927695646 and parameters: {'depth': 5, 'learning_rate': 0.010322125547784484, 'iterations': 1940, 'l2_leaf_reg': 2.6701984654637547e-08, 'border_count': 25, 'bagging_temperature': 0.020108824475140865, 'random_strength': 1.8346353705558667, 'grow_policy': 'Depthwise', 'min_data_in_leaf': 879}. Best is trial 306 with value: 170.64979827273262.[0m
[32m[I 2024-10-13 11:50:17,171][0m Trial 694 finished with value: 177.9398500277573 and parameters: {'depth': 5, 'learning_rate': 0.008589864007897012, 'iterations': 669, 'l2_leaf_reg': 3.575429621411406e-08, 'border_count': 5, 'bagging_temperature': 0.019877838215841433, 'random_strength': 1.3769031986997267, 'grow_policy': 'Depthwise', 'min_data_in_leaf': 897}. Best is trial 306 with value: 170.64979827273262.[0m
[32m[I 2024-10-13 11:50:19,062][0m Trial 695 finished with value: 195.96869846761243 and parameters: {'depth': 5, 'learning_rate': 0.006584776369549704, 'iterations': 1877, 'l2_leaf_reg': 1.5914938771178302e-08, 'border_count': 17, 'bagging_temperature': 0.18980997860015247, 'random_strength': 2.1270698733087308, 'grow_policy': 'Depthwise', 'min_data_in_leaf': 865}. Best is trial 306 with value: 170.64979827273262.[0m
[32m[I 2024-10-13 11:50:21,189][0m Trial 696 finished with value: 199.49039361600026 and parameters: {'depth': 5, 'learning_rate': 0.010165658105957256, 'iterations': 1980, 'l2_leaf_reg': 4.338452597296718e-08, 'border_count': 12, 'bagging_temperature': 0.020000517185775318, 'random_strength': 1.6689427286098506, 'grow_policy': 'Depthwise', 'min_data_in_leaf': 910}. Best is trial 306 with value: 170.64979827273262.[0m
[32m[I 2024-10-13 11:50:23,207][0m Trial 697 finished with value: 172.51822843647258 and parameters: {'depth': 5, 'learning_rate': 0.011839057731080795, 'iterations': 2022, 'l2_leaf_reg': 5.669072870472365e-08, 'border_count': 6, 'bagging_temperature': 0.0008264161345340285, 'random_strength': 1.3670180733274835, 'grow_policy': 'Depthwise', 'min_data_in_leaf': 848}. Best is trial 306 with value: 170.64979827273262.[0m
[32m[I 2024-10-13 11:50:25,133][0m Trial 698 finished with value: 201.2377900227173 and parameters: {'depth': 5, 'learning_rate': 0.00980629278961879, 'iterations': 1872, 'l2_leaf_reg': 2.6932870130015734e-08, 'border_count': 11, 'bagging_temperature': 0.028534355685226668, 'random_strength': 1.460562958829579, 'grow_policy': 'Depthwise', 'min_data_in_leaf': 829}. Best is trial 306 with value: 170.64979827273262.[0m
[32m[I 2024-10-13 11:50:27,016][0m Trial 699 finished with value: 253.71594814996968 and parameters: {'depth': 5, 'learning_rate': 0.012459013768089739, 'iterations': 1861, 'l2_leaf_reg': 5.520983606676441e-08, 'border_count': 1, 'bagging_temperature': 0.030616136395198168, 'random_strength': 1.7612389104701212, 'grow_policy': 'Depthwise', 'min_data_in_leaf': 866}. Best is trial 306 with value: 170.64979827273262.[0m
[32m[I 2024-10-13 11:50:28,961][0m Trial 700 finished with value: 199.11079842650298 and parameters: {'depth': 5, 'learning_rate': 0.011586906464867326, 'iterations': 1947, 'l2_leaf_reg': 7.435601372307395e-08, 'border_count': 17, 'bagging_temperature': 0.01938329604277028, 'random_strength': 1.3507462713589689, 'grow_policy': 'Depthwise', 'min_data_in_leaf': 794}. Best is trial 306 with value: 170.64979827273262.[0m
[32m[I 2024-10-13 11:50:31,015][0m Trial 701 finished with value: 234.12706415676186 and parameters: {'depth': 4, 'learning_rate': 0.008996035863314674, 'iterations': 2048, 'l2_leaf_reg': 1.013887987725419e-08, 'border_count': 91, 'bagging_temperature': 0.03528981419768839, 'random_strength': 1.4820793088953437, 'grow_policy': 'Depthwise', 'min_data_in_leaf': 917}. Best is trial 306 with value: 170.64979827273262.[0m
[32m[I 2024-10-13 11:50:33,055][0m Trial 702 finished with value: 172.54705909103396 and parameters: {'depth': 5, 'learning_rate': 0.0136706538902617, 'iterations': 1915, 'l2_leaf_reg': 2.878758628593745e-08, 'border_count': 6, 'bagging_temperature': 0.016588382172720614, 'random_strength': 1.1917249543589175, 'grow_policy': 'Depthwise', 'min_data_in_leaf': 881}. Best is trial 306 with value: 170.64979827273262.[0m
[32m[I 2024-10-13 11:50:35,112][0m Trial 703 finished with value: 198.70051441730973 and parameters: {'depth': 4, 'learning_rate': 0.010708735056409471, 'iterations': 1874, 'l2_leaf_reg': 1.5877978639701048e-08, 'border_count': 10, 'bagging_temperature': 0.000633901749327335, 'random_strength': 1.187306158787545, 'grow_policy': 'Depthwise', 'min_data_in_leaf': 850}. Best is trial 306 with value: 170.64979827273262.[0m
[32m[I 2024-10-13 11:50:37,124][0m Trial 704 finished with value: 253.98128599945875 and parameters: {'depth': 5, 'learning_rate': 0.01299131212862491, 'iterations': 1937, 'l2_leaf_reg': 7.608039053807534e-08, 'border_count': 1, 'bagging_temperature': 0.00019806014606918443, 'random_strength': 1.6322698152280501, 'grow_policy': 'Depthwise', 'min_data_in_leaf': 845}. Best is trial 306 with value: 170.64979827273262.[0m
[32m[I 2024-10-13 11:50:39,016][0m Trial 705 finished with value: 208.70480614834804 and parameters: {'depth': 4, 'learning_rate': 0.014669505543929873, 'iterations': 1831, 'l2_leaf_reg': 4.938280250499346e-08, 'border_count': 14, 'bagging_temperature': 2.489673004877832e-05, 'random_strength': 2.009762936313809, 'grow_policy': 'Depthwise', 'min_data_in_leaf': 941}. Best is trial 306 with value: 170.64979827273262.[0m
[32m[I 2024-10-13 11:50:41,000][0m Trial 706 finished with value: 174.34455745693856 and parameters: {'depth': 4, 'learning_rate': 0.008275477784395337, 'iterations': 2022, 'l2_leaf_reg': 3.252039146655244e-08, 'border_count': 6, 'bagging_temperature': 0.0418122313742275, 'random_strength': 9.377711605014607, 'grow_policy': 'Depthwise', 'min_data_in_leaf': 850}. Best is trial 306 with value: 170.64979827273262.[0m
[32m[I 2024-10-13 11:50:42,893][0m Trial 707 finished with value: 355.32780497534503 and parameters: {'depth': 4, 'learning_rate': 0.00012538504245577156, 'iterations': 1862, 'l2_leaf_reg': 1.183755490962752e-07, 'border_count': 21, 'bagging_temperature': 0.03147977905257824, 'random_strength': 1.4268796748884571, 'grow_policy': 'Depthwise', 'min_data_in_leaf': 454}. Best is trial 306 with value: 170.64979827273262.[0m
[32m[I 2024-10-13 11:50:44,782][0m Trial 708 finished with value: 178.8280080559491 and parameters: {'depth': 5, 'learning_rate': 0.011424862659684013, 'iterations': 1928, 'l2_leaf_reg': 4.2108751016195105e-08, 'border_count': 9, 'bagging_temperature': 0.0007634943853566389, 'random_strength': 1.1990314249043357, 'grow_policy': 'Depthwise', 'min_data_in_leaf': 875}. Best is trial 306 with value: 170.64979827273262.[0m
[32m[I 2024-10-13 11:50:46,663][0m Trial 709 finished with value: 172.30597068018486 and parameters: {'depth': 5, 'learning_rate': 0.015099301196047731, 'iterations': 1848, 'l2_leaf_reg': 7.979183051574173e-08, 'border_count': 5, 'bagging_temperature': 0.051071827868203315, 'random_strength': 1.211109314759453, 'grow_policy': 'Depthwise', 'min_data_in_leaf': 840}. Best is trial 306 with value: 170.64979827273262.[0m
[32m[I 2024-10-13 11:50:48,596][0m Trial 710 finished with value: 205.70633326724368 and parameters: {'depth': 4, 'learning_rate': 0.009659237955353422, 'iterations': 1969, 'l2_leaf_reg': 2.6508077417808897e-08, 'border_count': 14, 'bagging_temperature': 0.02251899341366989, 'random_strength': 1.613570171798959, 'grow_policy': 'Depthwise', 'min_data_in_leaf': 816}. Best is trial 306 with value: 170.64979827273262.[0m
[32m[I 2024-10-13 11:50:50,641][0m Trial 711 finished with value: 178.80335327556605 and parameters: {'depth': 5, 'learning_rate': 0.012835692276462014, 'iterations': 2065, 'l2_leaf_reg': 1.1623423687784372e-07, 'border_count': 9, 'bagging_temperature': 0.02138962814570984, 'random_strength': 3.60183964162759, 'grow_policy': 'Depthwise', 'min_data_in_leaf': 868}. Best is trial 306 with value: 170.64979827273262.[0m
[32m[I 2024-10-13 11:50:52,516][0m Trial 712 finished with value: 253.6619273802007 and parameters: {'depth': 4, 'learning_rate': 0.01530359431462864, 'iterations': 1896, 'l2_leaf_reg': 1.3442565393744378e-05, 'border_count': 1, 'bagging_temperature': 0.048260356780140096, 'random_strength': 4.380754991113738, 'grow_policy': 'Depthwise', 'min_data_in_leaf': 800}. Best is trial 306 with value: 170.64979827273262.[0m
[32m[I 2024-10-13 11:51:01,858][0m Trial 713 finished with value: 224.39618421444857 and parameters: {'depth': 4, 'learning_rate': 0.012272426557636044, 'iterations': 2800, 'l2_leaf_reg': 1.4109184228336012e-07, 'border_count': 27, 'bagging_temperature': 0.0348956604212171, 'random_strength': 1.1590034443225812, 'grow_policy': 'SymmetricTree', 'min_data_in_leaf': 810}. Best is trial 306 with value: 170.64979827273262.[0m
[32m[I 2024-10-13 11:51:03,719][0m Trial 714 finished with value: 197.63302847959463 and parameters: {'depth': 4, 'learning_rate': 0.01031580402486296, 'iterations': 1829, 'l2_leaf_reg': 7.34899530642556e-08, 'border_count': 18, 'bagging_temperature': 0.00017642206263103694, 'random_strength': 1.4280122109882336, 'grow_policy': 'Depthwise', 'min_data_in_leaf': 833}. Best is trial 306 with value: 170.64979827273262.[0m
