[32m[I 2024-10-13 11:51:05,722][0m Trial 715 finished with value: 171.7583366736742 and parameters: {'depth': 5, 'learning_rate': 0.015999007682934153, 'iterations': 1960, 'l2_leaf_reg': 1.70705836648743e-08, 'border_count': 5, 'bagging_temperature': 0.018664110214413516, 'random_strength': 1.9209891505246661, 'grow_policy': 'Depthwise', 'min_data_in_leaf': 782}. Best is trial 306 with value: 170.64979827273262.[0m
[32m[I 2024-10-13 11:51:07,701][0m Trial 716 finished with value: 202.39373669241346 and parameters: {'depth': 4, 'learning_rate': 0.01380954750422178, 'iterations': 2014, 'l2_leaf_reg': 1.7537190434866455e-08, 'border_count': 12, 'bagging_temperature': 0.0006345046592347746, 'random_strength': 2.0144703119529628, 'grow_policy': 'Depthwise', 'min_data_in_leaf': 787}. Best is trial 306 with value: 170.64979827273262.[0m
[32m[I 2024-10-13 11:51:09,716][0m Trial 717 finished with value: 172.03278624993538 and parameters: {'depth': 5, 'learning_rate': 0.011620815649448309, 'iterations': 1927, 'l2_leaf_reg': 3.512292545477935e-08, 'border_count': 5, 'bagging_temperature': 0.0199066857861548, 'random_strength': 1.5206506858442232, 'grow_policy': 'Depthwise', 'min_data_in_leaf': 776}. Best is trial 306 with value: 170.64979827273262.[0m
[32m[I 2024-10-13 11:51:11,801][0m Trial 718 finished with value: 172.10933811108347 and parameters: {'depth': 5, 'learning_rate': 0.00774193567816607, 'iterations': 2104, 'l2_leaf_reg': 1.4039400418187418e-08, 'border_count': 8, 'bagging_temperature': 0.02270474302977524, 'random_strength': 2.4126044039281758, 'grow_policy': 'Depthwise', 'min_data_in_leaf': 770}. Best is trial 306 with value: 170.64979827273262.[0m
[32m[I 2024-10-13 11:51:13,825][0m Trial 719 finished with value: 206.79415874667416 and parameters: {'depth': 5, 'learning_rate': 0.010670011491369855, 'iterations': 1972, 'l2_leaf_reg': 1.923612684452845e-08, 'border_count': 14, 'bagging_temperature': 0.020877009468723277, 'random_strength': 1.7364046156546593, 'grow_policy': 'Depthwise', 'min_data_in_leaf': 808}. Best is trial 306 with value: 170.64979827273262.[0m
[32m[I 2024-10-13 11:51:15,777][0m Trial 720 finished with value: 253.8622814589693 and parameters: {'depth': 4, 'learning_rate': 0.008982810758395294, 'iterations': 1970, 'l2_leaf_reg': 1.3358684245767722e-08, 'border_count': 1, 'bagging_temperature': 0.02157091253017951, 'random_strength': 1.8703766203445022, 'grow_policy': 'Depthwise', 'min_data_in_leaf': 779}. Best is trial 306 with value: 170.64979827273262.[0m
[32m[I 2024-10-13 11:51:17,846][0m Trial 721 finished with value: 172.88729344803988 and parameters: {'depth': 4, 'learning_rate': 0.010167519910532453, 'iterations': 2137, 'l2_leaf_reg': 2.455059929015159e-08, 'border_count': 6, 'bagging_temperature': 0.018288058090536605, 'random_strength': 1.7407537831563382, 'grow_policy': 'Depthwise', 'min_data_in_leaf': 780}. Best is trial 306 with value: 170.64979827273262.[0m
[32m[I 2024-10-13 11:51:19,746][0m Trial 722 finished with value: 198.6588929867637 and parameters: {'depth': 4, 'learning_rate': 0.012500997383060066, 'iterations': 1915, 'l2_leaf_reg': 3.649247196552776e-08, 'border_count': 19, 'bagging_temperature': 0.01934399933354604, 'random_strength': 2.185522020729172, 'grow_policy': 'Depthwise', 'min_data_in_leaf': 794}. Best is trial 306 with value: 170.64979827273262.[0m
[32m[I 2024-10-13 11:51:21,774][0m Trial 723 finished with value: 203.4335504476278 and parameters: {'depth': 8, 'learning_rate': 0.011558236321280432, 'iterations': 1998, 'l2_leaf_reg': 2.504672983497907e-08, 'border_count': 11, 'bagging_temperature': 0.0404746947263089, 'random_strength': 1.6530054249465904, 'grow_policy': 'Depthwise', 'min_data_in_leaf': 774}. Best is trial 306 with value: 170.64979827273262.[0m
[32m[I 2024-10-13 11:51:23,883][0m Trial 724 finished with value: 173.6919038356393 and parameters: {'depth': 5, 'learning_rate': 0.007137959561776055, 'iterations': 2087, 'l2_leaf_reg': 4.069243051150901e-08, 'border_count': 5, 'bagging_temperature': 0.018752881164511837, 'random_strength': 2.014690991939016, 'grow_policy': 'Depthwise', 'min_data_in_leaf': 817}. Best is trial 306 with value: 170.64979827273262.[0m
[32m[I 2024-10-13 11:51:25,925][0m Trial 725 finished with value: 253.9627920993661 and parameters: {'depth': 5, 'learning_rate': 0.014007681285938156, 'iterations': 1923, 'l2_leaf_reg': 1.7845236686019506e-08, 'border_count': 1, 'bagging_temperature': 0.0006060687111505684, 'random_strength': 1.5677248912303974, 'grow_policy': 'Depthwise', 'min_data_in_leaf': 802}. Best is trial 306 with value: 170.64979827273262.[0m
[32m[I 2024-10-13 11:51:27,944][0m Trial 726 finished with value: 207.79532700223672 and parameters: {'depth': 4, 'learning_rate': 0.01120621455363408, 'iterations': 2055, 'l2_leaf_reg': 3.7217833723757174e-08, 'border_count': 13, 'bagging_temperature': 0.0006095578011600237, 'random_strength': 1.44681580265729, 'grow_policy': 'Depthwise', 'min_data_in_leaf': 762}. Best is trial 306 with value: 170.64979827273262.[0m
[32m[I 2024-10-13 11:51:29,919][0m Trial 727 finished with value: 179.63816297529087 and parameters: {'depth': 4, 'learning_rate': 0.015263953717454, 'iterations': 1966, 'l2_leaf_reg': 1.054476485331628e-08, 'border_count': 9, 'bagging_temperature': 0.05068345691107844, 'random_strength': 1.9349278423674325, 'grow_policy': 'Depthwise', 'min_data_in_leaf': 793}. Best is trial 306 with value: 170.64979827273262.[0m
[32m[I 2024-10-13 11:51:31,804][0m Trial 728 finished with value: 205.3265808194264 and parameters: {'depth': 5, 'learning_rate': 0.009204085413746132, 'iterations': 1870, 'l2_leaf_reg': 2.3475646903781363e-08, 'border_count': 24, 'bagging_temperature': 0.00024219910716928063, 'random_strength': 1.7138157462159183, 'grow_policy': 'Depthwise', 'min_data_in_leaf': 824}. Best is trial 306 with value: 170.64979827273262.[0m
[32m[I 2024-10-13 11:51:33,839][0m Trial 729 finished with value: 270.1377047575737 and parameters: {'depth': 4, 'learning_rate': 0.21442690040492182, 'iterations': 2030, 'l2_leaf_reg': 5.9280801936435646e-08, 'border_count': 18, 'bagging_temperature': 0.036603710748366464, 'random_strength': 1.4771989781108639, 'grow_policy': 'Depthwise', 'min_data_in_leaf': 853}. Best is trial 306 with value: 170.64979827273262.[0m
[32m[I 2024-10-13 11:51:35,756][0m Trial 730 finished with value: 172.7598116794097 and parameters: {'depth': 4, 'learning_rate': 0.01254614270702038, 'iterations': 1917, 'l2_leaf_reg': 4.497605252481303e-08, 'border_count': 6, 'bagging_temperature': 0.03073033259527705, 'random_strength': 1.3527635480944387, 'grow_policy': 'Depthwise', 'min_data_in_leaf': 758}. Best is trial 306 with value: 170.64979827273262.[0m
[32m[I 2024-10-13 11:51:37,784][0m Trial 731 finished with value: 210.3286683055038 and parameters: {'depth': 5, 'learning_rate': 0.015058984197922608, 'iterations': 1958, 'l2_leaf_reg': 3.6000804911782015e-08, 'border_count': 13, 'bagging_temperature': 0.0002961105715738113, 'random_strength': 1.2616106337960344, 'grow_policy': 'Depthwise', 'min_data_in_leaf': 791}. Best is trial 306 with value: 170.64979827273262.[0m
[32m[I 2024-10-13 11:51:39,733][0m Trial 732 finished with value: 172.59418898409754 and parameters: {'depth': 4, 'learning_rate': 0.012079835899783625, 'iterations': 1861, 'l2_leaf_reg': 2.4647827394022447e-08, 'border_count': 5, 'bagging_temperature': 0.06266999323449213, 'random_strength': 1.8747720348953052, 'grow_policy': 'Depthwise', 'min_data_in_leaf': 469}. Best is trial 306 with value: 170.64979827273262.[0m
[32m[I 2024-10-13 11:51:41,685][0m Trial 733 finished with value: 253.83528854190365 and parameters: {'depth': 5, 'learning_rate': 0.008823670933740287, 'iterations': 1898, 'l2_leaf_reg': 6.035937628823648e-08, 'border_count': 1, 'bagging_temperature': 0.018259921313466564, 'random_strength': 1.0847823591269492, 'grow_policy': 'Depthwise', 'min_data_in_leaf': 919}. Best is trial 306 with value: 170.64979827273262.[0m
[32m[I 2024-10-13 11:51:43,706][0m Trial 734 finished with value: 179.77923456716388 and parameters: {'depth': 3, 'learning_rate': 0.015722774185524868, 'iterations': 2029, 'l2_leaf_reg': 9.14449438604174e-08, 'border_count': 9, 'bagging_temperature': 0.0551659189360078, 'random_strength': 1.5463983033120456, 'grow_policy': 'Depthwise', 'min_data_in_leaf': 776}. Best is trial 306 with value: 170.64979827273262.[0m
[32m[I 2024-10-13 11:51:46,239][0m Trial 735 finished with value: 201.87459300475643 and parameters: {'depth': 4, 'learning_rate': 0.01071193805029635, 'iterations': 2710, 'l2_leaf_reg': 5.421243029353837e-08, 'border_count': 16, 'bagging_temperature': 0.034055215109617634, 'random_strength': 1.3642465349518393, 'grow_policy': 'Depthwise', 'min_data_in_leaf': 837}. Best is trial 306 with value: 170.64979827273262.[0m
[32m[I 2024-10-13 11:51:52,639][0m Trial 736 finished with value: 212.35703884476197 and parameters: {'depth': 5, 'learning_rate': 0.013349137010790232, 'iterations': 1839, 'l2_leaf_reg': 1.4820566259768823e-08, 'border_count': 9, 'bagging_temperature': 6.767522618109784e-05, 'random_strength': 1.8577318880206768, 'grow_policy': 'SymmetricTree', 'min_data_in_leaf': 805}. Best is trial 306 with value: 170.64979827273262.[0m
[32m[I 2024-10-13 11:51:54,607][0m Trial 737 finished with value: 254.84945998354226 and parameters: {'depth': 4, 'learning_rate': 0.004304540193536296, 'iterations': 1935, 'l2_leaf_reg': 3.235483779678939e-08, 'border_count': 1, 'bagging_temperature': 0.03474394254365817, 'random_strength': 1.601449230700419, 'grow_policy': 'Depthwise', 'min_data_in_leaf': 816}. Best is trial 306 with value: 170.64979827273262.[0m
[32m[I 2024-10-13 11:51:56,536][0m Trial 738 finished with value: 211.40166906009958 and parameters: {'depth': 3, 'learning_rate': 0.016353698232764138, 'iterations': 1886, 'l2_leaf_reg': 2.1997642560305255e-08, 'border_count': 13, 'bagging_temperature': 0.018661441695908887, 'random_strength': 1.2177400482133833, 'grow_policy': 'Depthwise', 'min_data_in_leaf': 853}. Best is trial 306 with value: 170.64979827273262.[0m
[32m[I 2024-10-13 11:51:58,391][0m Trial 739 finished with value: 173.37009517160172 and parameters: {'depth': 4, 'learning_rate': 0.012933997263173996, 'iterations': 1820, 'l2_leaf_reg': 1.464412486704606e-07, 'border_count': 6, 'bagging_temperature': 0.06437631058139254, 'random_strength': 1.0496984232899231, 'grow_policy': 'Depthwise', 'min_data_in_leaf': 775}. Best is trial 306 with value: 170.64979827273262.[0m
[32m[I 2024-10-13 11:51:59,675][0m Trial 740 finished with value: 210.9161394354024 and parameters: {'depth': 5, 'learning_rate': 0.009722323843782132, 'iterations': 912, 'l2_leaf_reg': 7.884720162427979e-08, 'border_count': 22, 'bagging_temperature': 0.04589949708622283, 'random_strength': 2.247031230235663, 'grow_policy': 'Depthwise', 'min_data_in_leaf': 431}. Best is trial 306 with value: 170.64979827273262.[0m
[32m[I 2024-10-13 11:52:01,629][0m Trial 741 finished with value: 200.03772331502046 and parameters: {'depth': 3, 'learning_rate': 0.01156781046395851, 'iterations': 1991, 'l2_leaf_reg': 4.330858052846434e-08, 'border_count': 10, 'bagging_temperature': 0.02162610381134731, 'random_strength': 1.7464991463514556, 'grow_policy': 'Depthwise', 'min_data_in_leaf': 886}. Best is trial 306 with value: 170.64979827273262.[0m
[32m[I 2024-10-13 11:52:02,857][0m Trial 742 finished with value: 173.80699258701188 and parameters: {'depth': 4, 'learning_rate': 0.014206932831266436, 'iterations': 988, 'l2_leaf_reg': 4.0071458541323194e-05, 'border_count': 5, 'bagging_temperature': 0.017257424386651895, 'random_strength': 1.4930194181422463, 'grow_policy': 'Depthwise', 'min_data_in_leaf': 798}. Best is trial 306 with value: 170.64979827273262.[0m
[32m[I 2024-10-13 11:52:04,812][0m Trial 743 finished with value: 199.5424410336865 and parameters: {'depth': 5, 'learning_rate': 0.006169099952717396, 'iterations': 1904, 'l2_leaf_reg': 1.14875038082505e-07, 'border_count': 15, 'bagging_temperature': 0.04035197682954315, 'random_strength': 1.0162003505405364, 'grow_policy': 'Depthwise', 'min_data_in_leaf': 825}. Best is trial 306 with value: 170.64979827273262.[0m
[32m[I 2024-10-13 11:52:05,943][0m Trial 744 finished with value: 226.4504923094838 and parameters: {'depth': 4, 'learning_rate': 0.016709874125631907, 'iterations': 822, 'l2_leaf_reg': 3.035927994528446e-08, 'border_count': 81, 'bagging_temperature': 0.017928851931322935, 'random_strength': 1.3304525231993891, 'grow_policy': 'Depthwise', 'min_data_in_leaf': 838}. Best is trial 306 with value: 170.64979827273262.[0m
[32m[I 2024-10-13 11:52:07,798][0m Trial 745 finished with value: 253.20503109674462 and parameters: {'depth': 5, 'learning_rate': 0.010454295527579533, 'iterations': 1827, 'l2_leaf_reg': 6.178277441281725e-08, 'border_count': 125, 'bagging_temperature': 0.05786030335395529, 'random_strength': 1.6244534527671357, 'grow_policy': 'Depthwise', 'min_data_in_leaf': 489}. Best is trial 306 with value: 170.64979827273262.[0m
[32m[I 2024-10-13 11:52:09,885][0m Trial 746 finished with value: 253.73074711157415 and parameters: {'depth': 3, 'learning_rate': 0.008098142582482688, 'iterations': 2090, 'l2_leaf_reg': 1.7849684174073936e-08, 'border_count': 1, 'bagging_temperature': 0.03822415631140254, 'random_strength': 1.180703593357847, 'grow_policy': 'Depthwise', 'min_data_in_leaf': 454}. Best is trial 306 with value: 170.64979827273262.[0m
[32m[I 2024-10-13 11:52:11,918][0m Trial 747 finished with value: 178.89821764717135 and parameters: {'depth': 4, 'learning_rate': 0.013714765895824828, 'iterations': 1956, 'l2_leaf_reg': 7.464735360228225e-08, 'border_count': 9, 'bagging_temperature': 0.02182296113365179, 'random_strength': 0.9344711110232284, 'grow_policy': 'Depthwise', 'min_data_in_leaf': 762}. Best is trial 306 with value: 170.64979827273262.[0m
[32m[I 2024-10-13 11:52:13,809][0m Trial 748 finished with value: 201.5431529260404 and parameters: {'depth': 5, 'learning_rate': 0.016344563264546794, 'iterations': 1801, 'l2_leaf_reg': 1.0296444999460592e-07, 'border_count': 17, 'bagging_temperature': 0.018657488177680134, 'random_strength': 1.3843155721010385, 'grow_policy': 'Depthwise', 'min_data_in_leaf': 783}. Best is trial 306 with value: 170.64979827273262.[0m
[32m[I 2024-10-13 11:52:15,719][0m Trial 749 finished with value: 173.26814293423553 and parameters: {'depth': 4, 'learning_rate': 0.011673097525725372, 'iterations': 1861, 'l2_leaf_reg': 4.7029164413662334e-08, 'border_count': 6, 'bagging_temperature': 0.05003470237530138, 'random_strength': 5.828222765531574, 'grow_policy': 'Depthwise', 'min_data_in_leaf': 811}. Best is trial 306 with value: 170.64979827273262.[0m
[32m[I 2024-10-13 11:52:17,725][0m Trial 750 finished with value: 244.9387445489409 and parameters: {'depth': 3, 'learning_rate': 0.013997479520431084, 'iterations': 2023, 'l2_leaf_reg': 1.635673450070525e-07, 'border_count': 195, 'bagging_temperature': 5.6654977372089244e-05, 'random_strength': 9.020971743206129, 'grow_policy': 'Depthwise', 'min_data_in_leaf': 880}. Best is trial 306 with value: 170.64979827273262.[0m
[32m[I 2024-10-13 11:52:19,622][0m Trial 751 finished with value: 242.05374604704107 and parameters: {'depth': 4, 'learning_rate': 0.016694307080213928, 'iterations': 1931, 'l2_leaf_reg': 3.302182210214907e-08, 'border_count': 240, 'bagging_temperature': 0.8630349728124318, 'random_strength': 1.8667629189196566, 'grow_policy': 'Depthwise', 'min_data_in_leaf': 501}. Best is trial 306 with value: 170.64979827273262.[0m
[32m[I 2024-10-13 11:52:21,490][0m Trial 752 finished with value: 198.34731779633924 and parameters: {'depth': 5, 'learning_rate': 0.009511781095417378, 'iterations': 1855, 'l2_leaf_reg': 1.7036521594571788e-08, 'border_count': 12, 'bagging_temperature': 0.03646693442806058, 'random_strength': 6.9751364151915105, 'grow_policy': 'Depthwise', 'min_data_in_leaf': 858}. Best is trial 306 with value: 170.64979827273262.[0m
[32m[I 2024-10-13 11:52:23,323][0m Trial 753 finished with value: 253.992632420842 and parameters: {'depth': 4, 'learning_rate': 0.011619096678696613, 'iterations': 1803, 'l2_leaf_reg': 4.87243411319454e-08, 'border_count': 1, 'bagging_temperature': 0.0009135728970877405, 'random_strength': 1.1700125826511552, 'grow_policy': 'Depthwise', 'min_data_in_leaf': 797}. Best is trial 306 with value: 170.64979827273262.[0m
[32m[I 2024-10-13 11:52:25,300][0m Trial 754 finished with value: 180.85769472074506 and parameters: {'depth': 10, 'learning_rate': 0.007917430944483729, 'iterations': 1981, 'l2_leaf_reg': 1.0199270744764134e-08, 'border_count': 9, 'bagging_temperature': 0.0699822879346062, 'random_strength': 1.5687726643745983, 'grow_policy': 'Depthwise', 'min_data_in_leaf': 471}. Best is trial 306 with value: 170.64979827273262.[0m
[32m[I 2024-10-13 11:52:27,259][0m Trial 755 finished with value: 200.82029022327316 and parameters: {'depth': 3, 'learning_rate': 0.014291809603571603, 'iterations': 1901, 'l2_leaf_reg': 7.444854868640289e-08, 'border_count': 17, 'bagging_temperature': 0.01825593802883544, 'random_strength': 5.4148923340594655, 'grow_policy': 'Depthwise', 'min_data_in_leaf': 840}. Best is trial 306 with value: 170.64979827273262.[0m
[32m[I 2024-10-13 11:52:33,510][0m Trial 756 finished with value: 173.36628584868907 and parameters: {'depth': 5, 'learning_rate': 0.012306709122196143, 'iterations': 1852, 'l2_leaf_reg': 2.337604121340107e-08, 'border_count': 5, 'bagging_temperature': 0.036295497809879465, 'random_strength': 1.005472097984926, 'grow_policy': 'SymmetricTree', 'min_data_in_leaf': 393}. Best is trial 306 with value: 170.64979827273262.[0m
[32m[I 2024-10-13 11:52:35,631][0m Trial 757 finished with value: 197.15223726768548 and parameters: {'depth': 4, 'learning_rate': 0.016397238520932327, 'iterations': 2195, 'l2_leaf_reg': 1.5198575195191743e-07, 'border_count': 12, 'bagging_temperature': 0.761728684557746, 'random_strength': 1.3183103696446343, 'grow_policy': 'Depthwise', 'min_data_in_leaf': 822}. Best is trial 306 with value: 170.64979827273262.[0m
[32m[I 2024-10-13 11:52:37,480][0m Trial 758 finished with value: 249.94652339451596 and parameters: {'depth': 5, 'learning_rate': 0.010443527178384154, 'iterations': 1783, 'l2_leaf_reg': 3.149382037132433e-08, 'border_count': 108, 'bagging_temperature': 0.0006004774121183658, 'random_strength': 1.5191115069015273, 'grow_policy': 'Depthwise', 'min_data_in_leaf': 769}. Best is trial 306 with value: 170.64979827273262.[0m
[32m[I 2024-10-13 11:52:39,423][0m Trial 759 finished with value: 255.39727763375814 and parameters: {'depth': 3, 'learning_rate': 0.013410305945973732, 'iterations': 1947, 'l2_leaf_reg': 1.1450206154206012e-07, 'border_count': 176, 'bagging_temperature': 0.05682551104055548, 'random_strength': 0.9961133090965668, 'grow_policy': 'Depthwise', 'min_data_in_leaf': 755}. Best is trial 306 with value: 170.64979827273262.[0m
[32m[I 2024-10-13 11:52:41,408][0m Trial 760 finished with value: 222.2644919461255 and parameters: {'depth': 6, 'learning_rate': 0.01686446580388259, 'iterations': 2045, 'l2_leaf_reg': 6.034966769145419e-08, 'border_count': 21, 'bagging_temperature': 0.03039578886701826, 'random_strength': 1.762322753248672, 'grow_policy': 'Depthwise', 'min_data_in_leaf': 902}. Best is trial 306 with value: 170.64979827273262.[0m
[32m[I 2024-10-13 11:52:43,549][0m Trial 761 finished with value: 173.59121503321373 and parameters: {'depth': 4, 'learning_rate': 0.009102334619031432, 'iterations': 1902, 'l2_leaf_reg': 8.124965041337814e-08, 'border_count': 6, 'bagging_temperature': 0.018092791807683323, 'random_strength': 0.9379222824038618, 'grow_policy': 'Depthwise', 'min_data_in_leaf': 789}. Best is trial 306 with value: 170.64979827273262.[0m
[32m[I 2024-10-13 11:52:45,400][0m Trial 762 finished with value: 199.4853713173806 and parameters: {'depth': 4, 'learning_rate': 0.01127484172564537, 'iterations': 1780, 'l2_leaf_reg': 2.2636463312274683e-05, 'border_count': 12, 'bagging_temperature': 0.04843915265665717, 'random_strength': 1.2882879649741328, 'grow_policy': 'Depthwise', 'min_data_in_leaf': 829}. Best is trial 306 with value: 170.64979827273262.[0m
[32m[I 2024-10-13 11:52:47,400][0m Trial 763 finished with value: 210.4607913269141 and parameters: {'depth': 4, 'learning_rate': 0.014566395877551229, 'iterations': 1990, 'l2_leaf_reg': 4.724548293104762e-08, 'border_count': 28, 'bagging_temperature': 0.01817775927891319, 'random_strength': 1.7351560713450926, 'grow_policy': 'Depthwise', 'min_data_in_leaf': 516}. Best is trial 306 with value: 170.64979827273262.[0m
[32m[I 2024-10-13 11:52:49,529][0m Trial 764 finished with value: 172.47610314472797 and parameters: {'depth': 5, 'learning_rate': 0.012478814231856894, 'iterations': 2139, 'l2_leaf_reg': 0.0067313427416686895, 'border_count': 5, 'bagging_temperature': 0.0733449970446271, 'random_strength': 0.8794414874129607, 'grow_policy': 'Depthwise', 'min_data_in_leaf': 809}. Best is trial 306 with value: 170.64979827273262.[0m
[32m[I 2024-10-13 11:52:51,395][0m Trial 765 finished with value: 253.77409447512343 and parameters: {'depth': 3, 'learning_rate': 0.017210877483312483, 'iterations': 1852, 'l2_leaf_reg': 1.641312959826763e-07, 'border_count': 1, 'bagging_temperature': 0.029701168250395857, 'random_strength': 1.2215874987137956, 'grow_policy': 'Depthwise', 'min_data_in_leaf': 451}. Best is trial 306 with value: 170.64979827273262.[0m
