[32m[I 2024-10-13 11:29:28,463][0m Trial 51 finished with value: 219.42557810927548 and parameters: {'depth': 7, 'learning_rate': 0.0018943722343602446, 'iterations': 2856, 'l2_leaf_reg': 0.0010970473761726088, 'border_count': 58, 'bagging_temperature': 0.32042039446332876, 'random_strength': 7.367806553707432, 'grow_policy': 'Depthwise', 'min_data_in_leaf': 637}. Best is trial 32 with value: 202.06637007366703.[0m
[32m[I 2024-10-13 11:29:31,097][0m Trial 52 finished with value: 204.6406793057592 and parameters: {'depth': 8, 'learning_rate': 0.0021591124699817795, 'iterations': 2717, 'l2_leaf_reg': 2.1622891335493187e-05, 'border_count': 33, 'bagging_temperature': 0.27417772514231803, 'random_strength': 9.965641124683176, 'grow_policy': 'Depthwise', 'min_data_in_leaf': 671}. Best is trial 32 with value: 202.06637007366703.[0m
[32m[I 2024-10-13 11:29:33,657][0m Trial 53 finished with value: 188.20309462163738 and parameters: {'depth': 9, 'learning_rate': 0.0011347383854479081, 'iterations': 2713, 'l2_leaf_reg': 1.3385595107441814e-05, 'border_count': 7, 'bagging_temperature': 0.18511080873998687, 'random_strength': 9.932463924549578, 'grow_policy': 'Depthwise', 'min_data_in_leaf': 579}. Best is trial 53 with value: 188.20309462163738.[0m
[32m[I 2024-10-13 11:29:35,662][0m Trial 54 finished with value: 181.10721665412913 and parameters: {'depth': 11, 'learning_rate': 0.002566231921698811, 'iterations': 2004, 'l2_leaf_reg': 9.185988988595748e-06, 'border_count': 7, 'bagging_temperature': 0.09964444768791975, 'random_strength': 9.161379011180196, 'grow_policy': 'Depthwise', 'min_data_in_leaf': 570}. Best is trial 54 with value: 181.10721665412913.[0m
[32m[I 2024-10-13 11:29:37,698][0m Trial 55 finished with value: 173.68642597110383 and parameters: {'depth': 11, 'learning_rate': 0.013547848466482491, 'iterations': 2010, 'l2_leaf_reg': 1.8961810558424007e-06, 'border_count': 6, 'bagging_temperature': 0.082641867135035, 'random_strength': 9.85861929117579, 'grow_policy': 'Depthwise', 'min_data_in_leaf': 574}. Best is trial 55 with value: 173.68642597110383.[0m
[32m[I 2024-10-13 11:29:39,698][0m Trial 56 finished with value: 199.14985357607014 and parameters: {'depth': 11, 'learning_rate': 0.03962649580277788, 'iterations': 1982, 'l2_leaf_reg': 7.828660656506096e-08, 'border_count': 4, 'bagging_temperature': 0.09064167210223802, 'random_strength': 8.599149613889004, 'grow_policy': 'Depthwise', 'min_data_in_leaf': 578}. Best is trial 55 with value: 173.68642597110383.[0m
[32m[I 2024-10-13 11:29:41,750][0m Trial 57 finished with value: 201.07321243766435 and parameters: {'depth': 11, 'learning_rate': 0.056257937640609317, 'iterations': 2014, 'l2_leaf_reg': 3.4643738318679555e-08, 'border_count': 4, 'bagging_temperature': 0.07238100178867941, 'random_strength': 8.719957052627256, 'grow_policy': 'Depthwise', 'min_data_in_leaf': 563}. Best is trial 55 with value: 173.68642597110383.[0m
[32m[I 2024-10-13 11:29:43,776][0m Trial 58 finished with value: 182.92358009600184 and parameters: {'depth': 11, 'learning_rate': 0.050952190834744074, 'iterations': 1989, 'l2_leaf_reg': 2.4591793358114422e-08, 'border_count': 6, 'bagging_temperature': 0.06680417911638142, 'random_strength': 8.064232281253531, 'grow_policy': 'Depthwise', 'min_data_in_leaf': 565}. Best is trial 55 with value: 173.68642597110383.[0m
[32m[I 2024-10-13 11:29:45,836][0m Trial 59 finished with value: 257.14750869563926 and parameters: {'depth': 11, 'learning_rate': 0.06046997641289672, 'iterations': 2050, 'l2_leaf_reg': 3.632326163379532e-08, 'border_count': 1, 'bagging_temperature': 0.07193745299837256, 'random_strength': 8.058956636691216, 'grow_policy': 'Depthwise', 'min_data_in_leaf': 561}. Best is trial 55 with value: 173.68642597110383.[0m
[32m[I 2024-10-13 11:29:47,804][0m Trial 60 finished with value: 178.33542564637992 and parameters: {'depth': 11, 'learning_rate': 0.038133400902353135, 'iterations': 1948, 'l2_leaf_reg': 1.4738791142879562e-07, 'border_count': 7, 'bagging_temperature': 0.11812204714722879, 'random_strength': 8.521859604576095, 'grow_policy': 'Depthwise', 'min_data_in_leaf': 583}. Best is trial 55 with value: 173.68642597110383.[0m
[32m[I 2024-10-13 11:29:49,851][0m Trial 61 finished with value: 256.22110576726 and parameters: {'depth': 11, 'learning_rate': 0.044120664969643716, 'iterations': 1962, 'l2_leaf_reg': 9.460135091746416e-08, 'border_count': 1, 'bagging_temperature': 0.11580201704693566, 'random_strength': 8.55048374413814, 'grow_policy': 'Depthwise', 'min_data_in_leaf': 580}. Best is trial 55 with value: 173.68642597110383.[0m
[32m[I 2024-10-13 11:29:51,673][0m Trial 62 finished with value: 194.58713488973734 and parameters: {'depth': 12, 'learning_rate': 0.1096328280945814, 'iterations': 1771, 'l2_leaf_reg': 1.6561960148184652e-08, 'border_count': 9, 'bagging_temperature': 0.00319281667585454, 'random_strength': 7.818694839967366, 'grow_policy': 'Depthwise', 'min_data_in_leaf': 541}. Best is trial 55 with value: 173.68642597110383.[0m
[32m[I 2024-10-13 11:29:53,465][0m Trial 63 finished with value: 219.19516310771218 and parameters: {'depth': 12, 'learning_rate': 0.13259031965769044, 'iterations': 1641, 'l2_leaf_reg': 1.0214639190144714e-08, 'border_count': 12, 'bagging_temperature': 0.008759528513225624, 'random_strength': 6.968042447113438, 'grow_policy': 'Depthwise', 'min_data_in_leaf': 539}. Best is trial 55 with value: 173.68642597110383.[0m
[32m[I 2024-10-13 11:29:55,400][0m Trial 64 finished with value: 229.82075602807006 and parameters: {'depth': 13, 'learning_rate': 0.09250461959911406, 'iterations': 1802, 'l2_leaf_reg': 1.75059154033664e-07, 'border_count': 26, 'bagging_temperature': 0.1654356163474157, 'random_strength': 7.801940579477925, 'grow_policy': 'Depthwise', 'min_data_in_leaf': 612}. Best is trial 55 with value: 173.68642597110383.[0m
[32m[I 2024-10-13 11:29:57,155][0m Trial 65 finished with value: 177.43019858917478 and parameters: {'depth': 10, 'learning_rate': 0.034961999759574966, 'iterations': 1570, 'l2_leaf_reg': 3.7025459932225496e-08, 'border_count': 9, 'bagging_temperature': 0.04490113254054136, 'random_strength': 5.486048296973116, 'grow_policy': 'Depthwise', 'min_data_in_leaf': 466}. Best is trial 55 with value: 173.68642597110383.[0m
[32m[I 2024-10-13 11:29:58,808][0m Trial 66 finished with value: 226.7908672374724 and parameters: {'depth': 10, 'learning_rate': 0.02831190354090809, 'iterations': 1453, 'l2_leaf_reg': 2.690117456744563e-08, 'border_count': 41, 'bagging_temperature': 0.031516350737212984, 'random_strength': 4.477282160480758, 'grow_policy': 'Depthwise', 'min_data_in_leaf': 457}. Best is trial 55 with value: 173.68642597110383.[0m
[32m[I 2024-10-13 11:30:00,216][0m Trial 67 finished with value: 230.04240817751437 and parameters: {'depth': 14, 'learning_rate': 0.22697501519028349, 'iterations': 1134, 'l2_leaf_reg': 2.212565497921088e-07, 'border_count': 10, 'bagging_temperature': 0.19774728901306404, 'random_strength': 6.144093555712894, 'grow_policy': 'Depthwise', 'min_data_in_leaf': 624}. Best is trial 55 with value: 173.68642597110383.[0m
[32m[I 2024-10-13 11:30:02,014][0m Trial 68 finished with value: 243.5451878964727 and parameters: {'depth': 12, 'learning_rate': 0.018553054530447106, 'iterations': 1563, 'l2_leaf_reg': 1.3145067222843971e-06, 'border_count': 154, 'bagging_temperature': 0.1409513061979698, 'random_strength': 5.126960850461464, 'grow_policy': 'Depthwise', 'min_data_in_leaf': 479}. Best is trial 55 with value: 173.68642597110383.[0m
[32m[I 2024-10-13 11:30:04,100][0m Trial 69 finished with value: 274.344647962145 and parameters: {'depth': 10, 'learning_rate': 0.09449839932278932, 'iterations': 1797, 'l2_leaf_reg': 1.9653781655836794e-08, 'border_count': 234, 'bagging_temperature': 0.044631958979311596, 'random_strength': 5.703008941942806, 'grow_policy': 'Depthwise', 'min_data_in_leaf': 525}. Best is trial 55 with value: 173.68642597110383.[0m
[32m[I 2024-10-13 11:30:06,408][0m Trial 70 finished with value: 232.81062303339922 and parameters: {'depth': 11, 'learning_rate': 0.011593027083312472, 'iterations': 2145, 'l2_leaf_reg': 1.5415974729799057e-07, 'border_count': 52, 'bagging_temperature': 0.11570527186884531, 'random_strength': 4.242328060128487, 'grow_policy': 'Depthwise', 'min_data_in_leaf': 709}. Best is trial 55 with value: 173.68642597110383.[0m
[32m[I 2024-10-13 11:30:08,394][0m Trial 71 finished with value: 181.31666613209694 and parameters: {'depth': 11, 'learning_rate': 0.04702874336733691, 'iterations': 1887, 'l2_leaf_reg': 7.231656432065722e-08, 'border_count': 8, 'bagging_temperature': 0.07740527742173449, 'random_strength': 8.352245579401234, 'grow_policy': 'Depthwise', 'min_data_in_leaf': 588}. Best is trial 55 with value: 173.68642597110383.[0m
[32m[I 2024-10-13 11:30:10,329][0m Trial 72 finished with value: 239.21032183750356 and parameters: {'depth': 9, 'learning_rate': 0.08798936873302701, 'iterations': 1757, 'l2_leaf_reg': 4.311141863862825e-08, 'border_count': 25, 'bagging_temperature': 0.049003534244179164, 'random_strength': 9.280908744315576, 'grow_policy': 'Depthwise', 'min_data_in_leaf': 597}. Best is trial 55 with value: 173.68642597110383.[0m
[32m[I 2024-10-13 11:30:11,860][0m Trial 73 finished with value: 204.92497528283775 and parameters: {'depth': 12, 'learning_rate': 0.03550870211315013, 'iterations': 1295, 'l2_leaf_reg': 1.2512265755977195e-08, 'border_count': 10, 'bagging_temperature': 0.00340630719424162, 'random_strength': 8.202861195199322, 'grow_policy': 'Depthwise', 'min_data_in_leaf': 529}. Best is trial 55 with value: 173.68642597110383.[0m
[32m[I 2024-10-13 11:30:14,150][0m Trial 74 finished with value: 268.35352055937364 and parameters: {'depth': 10, 'learning_rate': 0.07311770709284704, 'iterations': 2222, 'l2_leaf_reg': 6.364104234080798e-07, 'border_count': 108, 'bagging_temperature': 0.14935374773992705, 'random_strength': 6.522656349301773, 'grow_policy': 'Depthwise', 'min_data_in_leaf': 408}. Best is trial 55 with value: 173.68642597110383.[0m
[32m[I 2024-10-13 11:30:16,258][0m Trial 75 finished with value: 208.74904580095978 and parameters: {'depth': 12, 'learning_rate': 0.02429181939709264, 'iterations': 1894, 'l2_leaf_reg': 3.6086437930153038e-06, 'border_count': 16, 'bagging_temperature': 0.21318508522626423, 'random_strength': 7.713748664107387, 'grow_policy': 'Depthwise', 'min_data_in_leaf': 467}. Best is trial 55 with value: 173.68642597110383.[0m
[32m[I 2024-10-13 11:30:17,991][0m Trial 76 finished with value: 237.93863342223145 and parameters: {'depth': 11, 'learning_rate': 0.16193735650739066, 'iterations': 1512, 'l2_leaf_reg': 6.468424577087336e-08, 'border_count': 33, 'bagging_temperature': 0.09145587129167158, 'random_strength': 7.028128975911918, 'grow_policy': 'Depthwise', 'min_data_in_leaf': 628}. Best is trial 55 with value: 173.68642597110383.[0m
[32m[I 2024-10-13 11:30:19,818][0m Trial 77 finished with value: 171.4904345158229 and parameters: {'depth': 9, 'learning_rate': 0.01500652317920016, 'iterations': 1696, 'l2_leaf_reg': 2.4412835404115136e-07, 'border_count': 8, 'bagging_temperature': 0.054889148276491884, 'random_strength': 9.68489976620868, 'grow_policy': 'Depthwise', 'min_data_in_leaf': 534}. Best is trial 77 with value: 171.4904345158229.[0m
[32m[I 2024-10-13 11:30:21,586][0m Trial 78 finished with value: 210.57610589150443 and parameters: {'depth': 9, 'learning_rate': 0.014533554218232882, 'iterations': 1651, 'l2_leaf_reg': 1.0826178973738488e-06, 'border_count': 25, 'bagging_temperature': 0.18319187506624224, 'random_strength': 9.767831968040214, 'grow_policy': 'Depthwise', 'min_data_in_leaf': 434}. Best is trial 77 with value: 171.4904345158229.[0m
[32m[I 2024-10-13 11:30:22,275][0m Trial 79 finished with value: 239.03307091370306 and parameters: {'depth': 10, 'learning_rate': 0.007716712482639256, 'iterations': 181, 'l2_leaf_reg': 4.485860411341319e-07, 'border_count': 36, 'bagging_temperature': 0.0588847043098422, 'random_strength': 9.581042012119466, 'grow_policy': 'Depthwise', 'min_data_in_leaf': 756}. Best is trial 77 with value: 171.4904345158229.[0m
[32m[I 2024-10-13 11:30:24,222][0m Trial 80 finished with value: 173.66684197340024 and parameters: {'depth': 9, 'learning_rate': 0.021495429609919424, 'iterations': 1907, 'l2_leaf_reg': 1.4302676335853599e-07, 'border_count': 7, 'bagging_temperature': 0.10817549859853057, 'random_strength': 9.179973864288842, 'grow_policy': 'Depthwise', 'min_data_in_leaf': 503}. Best is trial 77 with value: 171.4904345158229.[0m
[32m[I 2024-10-13 11:30:26,132][0m Trial 81 finished with value: 172.69380622060976 and parameters: {'depth': 9, 'learning_rate': 0.019781851180328727, 'iterations': 1891, 'l2_leaf_reg': 2.757099758448006e-07, 'border_count': 8, 'bagging_temperature': 0.09635174807085518, 'random_strength': 9.16139290210319, 'grow_policy': 'Depthwise', 'min_data_in_leaf': 487}. Best is trial 77 with value: 171.4904345158229.[0m
[32m[I 2024-10-13 11:30:28,034][0m Trial 82 finished with value: 204.71579944147285 and parameters: {'depth': 10, 'learning_rate': 0.018783824653669342, 'iterations': 1908, 'l2_leaf_reg': 2.1799609113592063e-07, 'border_count': 17, 'bagging_temperature': 0.09785833879962305, 'random_strength': 9.078620985437679, 'grow_policy': 'Depthwise', 'min_data_in_leaf': 495}. Best is trial 77 with value: 171.4904345158229.[0m
[32m[I 2024-10-13 11:30:30,129][0m Trial 83 finished with value: 229.67954154542647 and parameters: {'depth': 11, 'learning_rate': 0.022732733855279005, 'iterations': 2083, 'l2_leaf_reg': 1.3959519127922264e-07, 'border_count': 21, 'bagging_temperature': 0.12613324065532638, 'random_strength': 9.271027350960233, 'grow_policy': 'Depthwise', 'min_data_in_leaf': 458}. Best is trial 77 with value: 171.4904345158229.[0m
[32m[I 2024-10-13 11:30:32,062][0m Trial 84 finished with value: 175.47739706250505 and parameters: {'depth': 9, 'learning_rate': 0.03120120684118504, 'iterations': 1864, 'l2_leaf_reg': 2.9197624241716883e-07, 'border_count': 7, 'bagging_temperature': 0.0320579184008713, 'random_strength': 8.34497112040815, 'grow_policy': 'Depthwise', 'min_data_in_leaf': 490}. Best is trial 77 with value: 171.4904345158229.[0m
[32m[I 2024-10-13 11:30:34,047][0m Trial 85 finished with value: 221.79221761844244 and parameters: {'depth': 9, 'learning_rate': 0.03216458669911369, 'iterations': 1869, 'l2_leaf_reg': 2.8709279412180544e-07, 'border_count': 14, 'bagging_temperature': 0.03262107661725429, 'random_strength': 3.31768164847197, 'grow_policy': 'Depthwise', 'min_data_in_leaf': 483}. Best is trial 77 with value: 171.4904345158229.[0m
[32m[I 2024-10-13 11:30:35,813][0m Trial 86 finished with value: 212.0381898262831 and parameters: {'depth': 9, 'learning_rate': 0.0162295323643486, 'iterations': 1708, 'l2_leaf_reg': 1.032530042911921e-06, 'border_count': 27, 'bagging_temperature': 0.15161876762983412, 'random_strength': 8.76164779119896, 'grow_policy': 'Depthwise', 'min_data_in_leaf': 372}. Best is trial 77 with value: 171.4904345158229.[0m
[32m[I 2024-10-13 11:30:37,564][0m Trial 87 finished with value: 221.02893872849643 and parameters: {'depth': 8, 'learning_rate': 0.009436588682399572, 'iterations': 1588, 'l2_leaf_reg': 1.2790123964827356e-07, 'border_count': 46, 'bagging_temperature': 0.0823227075967986, 'random_strength': 8.312301179466836, 'grow_policy': 'Depthwise', 'min_data_in_leaf': 516}. Best is trial 77 with value: 171.4904345158229.[0m
[32m[I 2024-10-13 11:30:39,779][0m Trial 88 finished with value: 200.47041923586534 and parameters: {'depth': 10, 'learning_rate': 0.012128540398394094, 'iterations': 2171, 'l2_leaf_reg': 2.3604783714364817e-06, 'border_count': 16, 'bagging_temperature': 0.23931826966866449, 'random_strength': 9.165311327056925, 'grow_policy': 'Depthwise', 'min_data_in_leaf': 407}. Best is trial 77 with value: 171.4904345158229.[0m
[32m[I 2024-10-13 11:30:41,588][0m Trial 89 finished with value: 175.00580657373948 and parameters: {'depth': 8, 'learning_rate': 0.02839609753711316, 'iterations': 1725, 'l2_leaf_reg': 3.8670221938740666e-07, 'border_count': 7, 'bagging_temperature': 0.11527607006432328, 'random_strength': 9.568994330887598, 'grow_policy': 'Depthwise', 'min_data_in_leaf': 544}. Best is trial 77 with value: 171.4904345158229.[0m
[32m[I 2024-10-13 11:30:43,168][0m Trial 90 finished with value: 254.09336992846204 and parameters: {'depth': 8, 'learning_rate': 0.02580824557599515, 'iterations': 1320, 'l2_leaf_reg': 5.854882281625894e-07, 'border_count': 1, 'bagging_temperature': 0.11388505423017731, 'random_strength': 9.782924263129358, 'grow_policy': 'Depthwise', 'min_data_in_leaf': 444}. Best is trial 77 with value: 171.4904345158229.[0m
[32m[I 2024-10-13 11:30:45,105][0m Trial 91 finished with value: 179.30569583792493 and parameters: {'depth': 9, 'learning_rate': 0.04271154575360282, 'iterations': 1838, 'l2_leaf_reg': 3.2306555782265314e-07, 'border_count': 8, 'bagging_temperature': 0.030193044849773032, 'random_strength': 9.536997353910545, 'grow_policy': 'Depthwise', 'min_data_in_leaf': 544}. Best is trial 77 with value: 171.4904345158229.[0m
[32m[I 2024-10-13 11:30:46,864][0m Trial 92 finished with value: 203.1472406034524 and parameters: {'depth': 9, 'learning_rate': 0.020676180643124643, 'iterations': 1710, 'l2_leaf_reg': 3.1955016773825983e-07, 'border_count': 20, 'bagging_temperature': 0.02535643286420862, 'random_strength': 9.581505422629336, 'grow_policy': 'Depthwise', 'min_data_in_leaf': 533}. Best is trial 77 with value: 171.4904345158229.[0m
[32m[I 2024-10-13 11:30:52,543][0m Trial 93 finished with value: 264.0609061302698 and parameters: {'depth': 9, 'learning_rate': 0.03624233385158854, 'iterations': 1485, 'l2_leaf_reg': 2.3155833406897097e-06, 'border_count': 7, 'bagging_temperature': 0.05244458599869253, 'random_strength': 8.909418642869042, 'grow_policy': 'Depthwise', 'min_data_in_leaf': 1}. Best is trial 77 with value: 171.4904345158229.[0m
[32m[I 2024-10-13 11:30:54,422][0m Trial 94 finished with value: 262.5274373353818 and parameters: {'depth': 8, 'learning_rate': 0.06540280031581844, 'iterations': 1851, 'l2_leaf_reg': 7.489691579188085e-07, 'border_count': 136, 'bagging_temperature': 0.16498892540749277, 'random_strength': 2.0312019893320055, 'grow_policy': 'Depthwise', 'min_data_in_leaf': 502}. Best is trial 77 with value: 171.4904345158229.[0m
[32m[I 2024-10-13 11:30:56,144][0m Trial 95 finished with value: 214.480202473507 and parameters: {'depth': 8, 'learning_rate': 0.028447558549898996, 'iterations': 1591, 'l2_leaf_reg': 4.676219689769024e-08, 'border_count': 34, 'bagging_temperature': 0.1339376319975348, 'random_strength': 9.369298136263232, 'grow_policy': 'Depthwise', 'min_data_in_leaf': 540}. Best is trial 77 with value: 171.4904345158229.[0m
[32m[I 2024-10-13 11:30:58,189][0m Trial 96 finished with value: 213.8580379287168 and parameters: {'depth': 9, 'learning_rate': 0.01626928618092309, 'iterations': 1935, 'l2_leaf_reg': 6.65544209524985e-06, 'border_count': 24, 'bagging_temperature': 0.11039777985286331, 'random_strength': 9.708224549381951, 'grow_policy': 'Depthwise', 'min_data_in_leaf': 478}. Best is trial 77 with value: 171.4904345158229.[0m
[32m[I 2024-10-13 11:31:00,241][0m Trial 97 finished with value: 202.67948830046382 and parameters: {'depth': 10, 'learning_rate': 0.006060983610988862, 'iterations': 2054, 'l2_leaf_reg': 3.092390504978724e-07, 'border_count': 13, 'bagging_temperature': 0.035001826655414806, 'random_strength': 9.179790855427228, 'grow_policy': 'Depthwise', 'min_data_in_leaf': 548}. Best is trial 77 with value: 171.4904345158229.[0m
[32m[I 2024-10-13 11:31:02,040][0m Trial 98 finished with value: 174.51628181834823 and parameters: {'depth': 10, 'learning_rate': 0.009939540960438942, 'iterations': 1739, 'l2_leaf_reg': 1.0677023541166055e-07, 'border_count': 5, 'bagging_temperature': 0.10395677892715316, 'random_strength': 0.7780745997403136, 'grow_policy': 'Depthwise', 'min_data_in_leaf': 606}. Best is trial 77 with value: 171.4904345158229.[0m
[32m[I 2024-10-13 11:31:03,892][0m Trial 99 finished with value: 197.5098395486301 and parameters: {'depth': 9, 'learning_rate': 0.009728215874955653, 'iterations': 1748, 'l2_leaf_reg': 1.1479690746075446e-07, 'border_count': 16, 'bagging_temperature': 0.0627920854234194, 'random_strength': 9.537032081169007, 'grow_policy': 'Depthwise', 'min_data_in_leaf': 606}. Best is trial 77 with value: 171.4904345158229.[0m
[32m[I 2024-10-13 11:31:05,660][0m Trial 100 finished with value: 209.71818412644734 and parameters: {'depth': 10, 'learning_rate': 0.014074064780185474, 'iterations': 1686, 'l2_leaf_reg': 2.28013542498098e-07, 'border_count': 30, 'bagging_temperature': 0.021837386926146916, 'random_strength': 8.885129446411096, 'grow_policy': 'Depthwise', 'min_data_in_leaf': 646}. Best is trial 77 with value: 171.4904345158229.[0m
[32m[I 2024-10-13 11:31:07,588][0m Trial 101 finished with value: 198.9687098512814 and parameters: {'depth': 10, 'learning_rate': 0.041829325744811525, 'iterations': 1819, 'l2_leaf_reg': 4.1393279147444297e-07, 'border_count': 4, 'bagging_temperature': 0.09417270995893329, 'random_strength': 8.664697674405927, 'grow_policy': 'Depthwise', 'min_data_in_leaf': 511}. Best is trial 77 with value: 171.4904345158229.[0m
[32m[I 2024-10-13 11:31:09,806][0m Trial 102 finished with value: 173.7141026294377 and parameters: {'depth': 9, 'learning_rate': 0.019442512761387216, 'iterations': 2214, 'l2_leaf_reg': 8.639371868448617e-07, 'border_count': 7, 'bagging_temperature': 0.126792868310276, 'random_strength': 5.500769481407115, 'grow_policy': 'Depthwise', 'min_data_in_leaf': 567}. Best is trial 77 with value: 171.4904345158229.[0m
