[32m[I 2024-10-13 11:43:43,843][0m Trial 511 finished with value: 172.8437048382709 and parameters: {'depth': 3, 'learning_rate': 0.010327402501802623, 'iterations': 1949, 'l2_leaf_reg': 4.477746629804095e-07, 'border_count': 6, 'bagging_temperature': 0.0023260383079682923, 'random_strength': 0.01629896284211818, 'grow_policy': 'Depthwise', 'min_data_in_leaf': 568}. Best is trial 306 with value: 170.64979827273262.[0m
[32m[I 2024-10-13 11:43:45,980][0m Trial 512 finished with value: 203.44779511059699 and parameters: {'depth': 3, 'learning_rate': 0.0073063875632594, 'iterations': 1989, 'l2_leaf_reg': 1.6691609236297826e-07, 'border_count': 14, 'bagging_temperature': 0.017880970633175848, 'random_strength': 0.027947076355949715, 'grow_policy': 'Depthwise', 'min_data_in_leaf': 591}. Best is trial 306 with value: 170.64979827273262.[0m
[32m[I 2024-10-13 11:43:47,947][0m Trial 513 finished with value: 253.8476207666118 and parameters: {'depth': 3, 'learning_rate': 0.010055590404041276, 'iterations': 1897, 'l2_leaf_reg': 1.2091331976142755e-07, 'border_count': 1, 'bagging_temperature': 0.019528055484176802, 'random_strength': 0.16326110703385022, 'grow_policy': 'Depthwise', 'min_data_in_leaf': 610}. Best is trial 306 with value: 170.64979827273262.[0m
[32m[I 2024-10-13 11:43:49,857][0m Trial 514 finished with value: 197.22865985313138 and parameters: {'depth': 3, 'learning_rate': 0.009139578645591152, 'iterations': 1866, 'l2_leaf_reg': 5.0482116415685765e-08, 'border_count': 10, 'bagging_temperature': 0.017307361733883354, 'random_strength': 0.23540647374650964, 'grow_policy': 'Depthwise', 'min_data_in_leaf': 588}. Best is trial 306 with value: 170.64979827273262.[0m
[32m[I 2024-10-13 11:43:51,742][0m Trial 515 finished with value: 171.91938288562298 and parameters: {'depth': 3, 'learning_rate': 0.011586861763997107, 'iterations': 1823, 'l2_leaf_reg': 0.0002201229123551375, 'border_count': 5, 'bagging_temperature': 6.0460185295145574e-05, 'random_strength': 0.21338293246849138, 'grow_policy': 'Depthwise', 'min_data_in_leaf': 513}. Best is trial 306 with value: 170.64979827273262.[0m
[32m[I 2024-10-13 11:43:53,693][0m Trial 516 finished with value: 197.32669323675643 and parameters: {'depth': 3, 'learning_rate': 0.01118737044336514, 'iterations': 1834, 'l2_leaf_reg': 2.2649987128147107e-07, 'border_count': 19, 'bagging_temperature': 0.004291266169505283, 'random_strength': 0.008351175197395228, 'grow_policy': 'Depthwise', 'min_data_in_leaf': 504}. Best is trial 306 with value: 170.64979827273262.[0m
[32m[I 2024-10-13 11:43:55,704][0m Trial 517 finished with value: 173.41614952130547 and parameters: {'depth': 3, 'learning_rate': 0.0075364609044789735, 'iterations': 1930, 'l2_leaf_reg': 2.0996982316309142e-07, 'border_count': 5, 'bagging_temperature': 0.004379048617665651, 'random_strength': 0.16693283814160156, 'grow_policy': 'Depthwise', 'min_data_in_leaf': 517}. Best is trial 306 with value: 170.64979827273262.[0m
[32m[I 2024-10-13 11:43:57,648][0m Trial 518 finished with value: 198.8061461528894 and parameters: {'depth': 3, 'learning_rate': 0.00948651855955701, 'iterations': 1884, 'l2_leaf_reg': 1.0158108426159586e-07, 'border_count': 12, 'bagging_temperature': 0.003542488324099393, 'random_strength': 0.30892860324501376, 'grow_policy': 'Depthwise', 'min_data_in_leaf': 532}. Best is trial 306 with value: 170.64979827273262.[0m
[32m[I 2024-10-13 11:43:59,514][0m Trial 519 finished with value: 178.3955581666651 and parameters: {'depth': 3, 'learning_rate': 0.0052659706599461524, 'iterations': 1808, 'l2_leaf_reg': 1.4828101794962744e-07, 'border_count': 9, 'bagging_temperature': 0.00031365941816969764, 'random_strength': 0.21154169625677777, 'grow_policy': 'Depthwise', 'min_data_in_leaf': 501}. Best is trial 306 with value: 170.64979827273262.[0m
[32m[I 2024-10-13 11:44:01,511][0m Trial 520 finished with value: 253.8273360597615 and parameters: {'depth': 3, 'learning_rate': 0.008285298619965733, 'iterations': 2007, 'l2_leaf_reg': 0.0001225240398603491, 'border_count': 1, 'bagging_temperature': 0.025654721037609546, 'random_strength': 0.0006365188816543077, 'grow_policy': 'Depthwise', 'min_data_in_leaf': 485}. Best is trial 306 with value: 170.64979827273262.[0m
[32m[I 2024-10-13 11:44:07,804][0m Trial 521 finished with value: 211.71770146776726 and parameters: {'depth': 3, 'learning_rate': 0.011233177888446903, 'iterations': 1835, 'l2_leaf_reg': 0.00018335334443107354, 'border_count': 15, 'bagging_temperature': 0.029989494259633463, 'random_strength': 0.3037573286030035, 'grow_policy': 'SymmetricTree', 'min_data_in_leaf': 560}. Best is trial 306 with value: 170.64979827273262.[0m
[32m[I 2024-10-13 11:44:09,625][0m Trial 522 finished with value: 172.6556786675345 and parameters: {'depth': 3, 'learning_rate': 0.0123659364149192, 'iterations': 1782, 'l2_leaf_reg': 9.61882436524889e-08, 'border_count': 6, 'bagging_temperature': 0.001776847349691784, 'random_strength': 0.3346684720510561, 'grow_policy': 'Depthwise', 'min_data_in_leaf': 526}. Best is trial 306 with value: 170.64979827273262.[0m
[32m[I 2024-10-13 11:44:11,516][0m Trial 523 finished with value: 200.04115817346394 and parameters: {'depth': 3, 'learning_rate': 0.012024400041643466, 'iterations': 1912, 'l2_leaf_reg': 1.9327184711083343e-07, 'border_count': 10, 'bagging_temperature': 0.027465036027675326, 'random_strength': 0.010413854475636974, 'grow_policy': 'Depthwise', 'min_data_in_leaf': 555}. Best is trial 306 with value: 170.64979827273262.[0m
[32m[I 2024-10-13 11:44:13,417][0m Trial 524 finished with value: 171.63773992352645 and parameters: {'depth': 3, 'learning_rate': 0.013460832022908467, 'iterations': 1854, 'l2_leaf_reg': 7.951050233263595e-08, 'border_count': 5, 'bagging_temperature': 0.022173620437248277, 'random_strength': 0.33563244720965385, 'grow_policy': 'Depthwise', 'min_data_in_leaf': 604}. Best is trial 306 with value: 170.64979827273262.[0m
[32m[I 2024-10-13 11:44:15,436][0m Trial 525 finished with value: 200.10550236336425 and parameters: {'depth': 3, 'learning_rate': 0.012674894381678651, 'iterations': 1965, 'l2_leaf_reg': 0.0002103660744533973, 'border_count': 17, 'bagging_temperature': 0.02162718891963135, 'random_strength': 0.23853100811586672, 'grow_policy': 'Depthwise', 'min_data_in_leaf': 580}. Best is trial 306 with value: 170.64979827273262.[0m
[32m[I 2024-10-13 11:44:17,370][0m Trial 526 finished with value: 172.8536812983036 and parameters: {'depth': 3, 'learning_rate': 0.009605706136346396, 'iterations': 1872, 'l2_leaf_reg': 6.782600146298313e-08, 'border_count': 5, 'bagging_temperature': 0.025499972010631918, 'random_strength': 0.38560476917871406, 'grow_policy': 'Depthwise', 'min_data_in_leaf': 529}. Best is trial 306 with value: 170.64979827273262.[0m
[32m[I 2024-10-13 11:44:19,498][0m Trial 527 finished with value: 198.80992287008993 and parameters: {'depth': 3, 'learning_rate': 0.008843772942381489, 'iterations': 2052, 'l2_leaf_reg': 3.409842086511905e-08, 'border_count': 12, 'bagging_temperature': 0.0019431291037123443, 'random_strength': 0.00628809305539807, 'grow_policy': 'Depthwise', 'min_data_in_leaf': 550}. Best is trial 306 with value: 170.64979827273262.[0m
[32m[I 2024-10-13 11:44:20,813][0m Trial 528 finished with value: 174.89920968365493 and parameters: {'depth': 3, 'learning_rate': 0.011164587697489969, 'iterations': 1018, 'l2_leaf_reg': 5.713148820505689e-08, 'border_count': 6, 'bagging_temperature': 0.00019165116212888772, 'random_strength': 7.628175895280293, 'grow_policy': 'Depthwise', 'min_data_in_leaf': 600}. Best is trial 306 with value: 170.64979827273262.[0m
[32m[I 2024-10-13 11:44:21,995][0m Trial 529 finished with value: 211.51227523962734 and parameters: {'depth': 3, 'learning_rate': 0.012863880387857043, 'iterations': 886, 'l2_leaf_reg': 1.5300659980247525e-07, 'border_count': 21, 'bagging_temperature': 0.029170061646757593, 'random_strength': 0.1892931894585396, 'grow_policy': 'Depthwise', 'min_data_in_leaf': 573}. Best is trial 306 with value: 170.64979827273262.[0m
[32m[I 2024-10-13 11:44:23,909][0m Trial 530 finished with value: 253.54502631301636 and parameters: {'depth': 3, 'learning_rate': 0.01380021624365979, 'iterations': 1835, 'l2_leaf_reg': 1.0042686411761015e-07, 'border_count': 1, 'bagging_temperature': 0.019271920442016238, 'random_strength': 0.4060409893391679, 'grow_policy': 'Depthwise', 'min_data_in_leaf': 607}. Best is trial 306 with value: 170.64979827273262.[0m
[32m[I 2024-10-13 11:44:25,828][0m Trial 531 finished with value: 198.86149584351048 and parameters: {'depth': 3, 'learning_rate': 0.010524566365061787, 'iterations': 1906, 'l2_leaf_reg': 2.7905587351822823e-07, 'border_count': 10, 'bagging_temperature': 0.03619312969629587, 'random_strength': 0.20672397558397895, 'grow_policy': 'Depthwise', 'min_data_in_leaf': 585}. Best is trial 306 with value: 170.64979827273262.[0m
[32m[I 2024-10-13 11:44:27,712][0m Trial 532 finished with value: 208.9519593485264 and parameters: {'depth': 3, 'learning_rate': 0.014290232401955065, 'iterations': 1796, 'l2_leaf_reg': 4.536468206730155e-08, 'border_count': 14, 'bagging_temperature': 0.025380029357303824, 'random_strength': 0.4604524781521698, 'grow_policy': 'Depthwise', 'min_data_in_leaf': 612}. Best is trial 306 with value: 170.64979827273262.[0m
[32m[I 2024-10-13 11:44:29,548][0m Trial 533 finished with value: 253.50089827463924 and parameters: {'depth': 3, 'learning_rate': 0.012268313345378383, 'iterations': 1751, 'l2_leaf_reg': 1.314602416347109e-07, 'border_count': 1, 'bagging_temperature': 0.04378995340158158, 'random_strength': 0.4232130275988284, 'grow_policy': 'Depthwise', 'min_data_in_leaf': 546}. Best is trial 306 with value: 170.64979827273262.[0m
[32m[I 2024-10-13 11:44:31,530][0m Trial 534 finished with value: 170.95482053443953 and parameters: {'depth': 4, 'learning_rate': 0.013788715019203314, 'iterations': 1855, 'l2_leaf_reg': 8.228089522934904e-08, 'border_count': 8, 'bagging_temperature': 0.014937799303624977, 'random_strength': 0.17797651161902808, 'grow_policy': 'Depthwise', 'min_data_in_leaf': 476}. Best is trial 306 with value: 170.64979827273262.[0m
[32m[I 2024-10-13 11:44:33,510][0m Trial 535 finished with value: 250.79787591366937 and parameters: {'depth': 4, 'learning_rate': 0.010407270581624077, 'iterations': 1953, 'l2_leaf_reg': 9.82891656683127e-08, 'border_count': 102, 'bagging_temperature': 0.0012132824253867497, 'random_strength': 0.1552268264528752, 'grow_policy': 'Depthwise', 'min_data_in_leaf': 536}. Best is trial 306 with value: 170.64979827273262.[0m
[32m[I 2024-10-13 11:44:35,403][0m Trial 536 finished with value: 199.8127558074382 and parameters: {'depth': 4, 'learning_rate': 0.013044204900285515, 'iterations': 1869, 'l2_leaf_reg': 3.016129054724475e-08, 'border_count': 17, 'bagging_temperature': 0.0009572068369944985, 'random_strength': 0.018441572284448746, 'grow_policy': 'Depthwise', 'min_data_in_leaf': 437}. Best is trial 306 with value: 170.64979827273262.[0m
[32m[I 2024-10-13 11:44:37,312][0m Trial 537 finished with value: 179.00233991865622 and parameters: {'depth': 4, 'learning_rate': 0.00624594467430669, 'iterations': 1851, 'l2_leaf_reg': 6.164718011075391e-08, 'border_count': 9, 'bagging_temperature': 0.017102675360694486, 'random_strength': 0.19068747464590124, 'grow_policy': 'Depthwise', 'min_data_in_leaf': 470}. Best is trial 306 with value: 170.64979827273262.[0m
[32m[I 2024-10-13 11:44:39,156][0m Trial 538 finished with value: 207.59921986238712 and parameters: {'depth': 4, 'learning_rate': 0.012272547749233271, 'iterations': 1742, 'l2_leaf_reg': 7.263631648887528e-08, 'border_count': 27, 'bagging_temperature': 0.04075060478528939, 'random_strength': 0.3511835648448547, 'grow_policy': 'Depthwise', 'min_data_in_leaf': 483}. Best is trial 306 with value: 170.64979827273262.[0m
[32m[I 2024-10-13 11:44:40,250][0m Trial 539 finished with value: 201.50295149593785 and parameters: {'depth': 3, 'learning_rate': 0.013563407491147171, 'iterations': 759, 'l2_leaf_reg': 8.684116513013087e-08, 'border_count': 13, 'bagging_temperature': 0.0005088831352359179, 'random_strength': 0.18930798843613533, 'grow_policy': 'Depthwise', 'min_data_in_leaf': 573}. Best is trial 306 with value: 170.64979827273262.[0m
[32m[I 2024-10-13 11:44:42,066][0m Trial 540 finished with value: 234.60896030106954 and parameters: {'depth': 4, 'learning_rate': 0.008552917504673541, 'iterations': 1786, 'l2_leaf_reg': 1.5453683380228894e-07, 'border_count': 92, 'bagging_temperature': 0.02227202651458582, 'random_strength': 0.3809453296810136, 'grow_policy': 'Depthwise', 'min_data_in_leaf': 451}. Best is trial 306 with value: 170.64979827273262.[0m
[32m[I 2024-10-13 11:44:54,982][0m Trial 541 finished with value: 279.73988168396755 and parameters: {'depth': 7, 'learning_rate': 0.01444495203356723, 'iterations': 1933, 'l2_leaf_reg': 7.423956200396856e-08, 'border_count': 179, 'bagging_temperature': 0.04509576772488145, 'random_strength': 0.02517316176004014, 'grow_policy': 'SymmetricTree', 'min_data_in_leaf': 518}. Best is trial 306 with value: 170.64979827273262.[0m
[32m[I 2024-10-13 11:44:56,822][0m Trial 542 finished with value: 171.9919537714142 and parameters: {'depth': 4, 'learning_rate': 0.010999066652046537, 'iterations': 1738, 'l2_leaf_reg': 1.3828830663152193e-07, 'border_count': 8, 'bagging_temperature': 0.028162404996991776, 'random_strength': 0.2098312169392491, 'grow_policy': 'Depthwise', 'min_data_in_leaf': 473}. Best is trial 306 with value: 170.64979827273262.[0m
[32m[I 2024-10-13 11:44:58,615][0m Trial 543 finished with value: 216.63364686504133 and parameters: {'depth': 4, 'learning_rate': 0.014630591951862513, 'iterations': 1722, 'l2_leaf_reg': 3.630066090574953e-08, 'border_count': 22, 'bagging_temperature': 0.04525015607635111, 'random_strength': 0.4632171239174124, 'grow_policy': 'Depthwise', 'min_data_in_leaf': 501}. Best is trial 306 with value: 170.64979827273262.[0m
[32m[I 2024-10-13 11:45:00,510][0m Trial 544 finished with value: 200.43544387219404 and parameters: {'depth': 4, 'learning_rate': 0.015594008346277556, 'iterations': 1753, 'l2_leaf_reg': 4.976628875786306e-08, 'border_count': 17, 'bagging_temperature': 0.28163688692719563, 'random_strength': 0.3337285208104871, 'grow_policy': 'Depthwise', 'min_data_in_leaf': 454}. Best is trial 306 with value: 170.64979827273262.[0m
[32m[I 2024-10-13 11:45:02,319][0m Trial 545 finished with value: 198.24503295433772 and parameters: {'depth': 4, 'learning_rate': 0.01106610289582907, 'iterations': 1721, 'l2_leaf_reg': 0.00023575798028450148, 'border_count': 10, 'bagging_temperature': 0.029603883938984547, 'random_strength': 0.4903004062975566, 'grow_policy': 'Depthwise', 'min_data_in_leaf': 488}. Best is trial 306 with value: 170.64979827273262.[0m
[32m[I 2024-10-13 11:45:04,204][0m Trial 546 finished with value: 252.58606146614625 and parameters: {'depth': 4, 'learning_rate': 0.008486292756418401, 'iterations': 1789, 'l2_leaf_reg': 0.0003073592555017979, 'border_count': 191, 'bagging_temperature': 0.04993918012542388, 'random_strength': 0.18656112800623384, 'grow_policy': 'Depthwise', 'min_data_in_leaf': 458}. Best is trial 306 with value: 170.64979827273262.[0m
[32m[I 2024-10-13 11:45:05,957][0m Trial 547 finished with value: 179.45954308583362 and parameters: {'depth': 4, 'learning_rate': 0.015226593711664385, 'iterations': 1705, 'l2_leaf_reg': 4.476444307668789, 'border_count': 9, 'bagging_temperature': 0.01627717963216437, 'random_strength': 0.5109194217981733, 'grow_policy': 'Depthwise', 'min_data_in_leaf': 468}. Best is trial 306 with value: 170.64979827273262.[0m
[32m[I 2024-10-13 11:45:07,857][0m Trial 548 finished with value: 205.50133339277784 and parameters: {'depth': 4, 'learning_rate': 0.012637816456689108, 'iterations': 1795, 'l2_leaf_reg': 1.1687778300177892e-07, 'border_count': 15, 'bagging_temperature': 0.03490516212885921, 'random_strength': 0.29983095558299655, 'grow_policy': 'Depthwise', 'min_data_in_leaf': 474}. Best is trial 306 with value: 170.64979827273262.[0m
[32m[I 2024-10-13 11:45:09,682][0m Trial 549 finished with value: 172.431568693625 and parameters: {'depth': 4, 'learning_rate': 0.015701991290031487, 'iterations': 1680, 'l2_leaf_reg': 0.0004986648650881929, 'border_count': 7, 'bagging_temperature': 0.057625076323824395, 'random_strength': 0.21195733612022394, 'grow_policy': 'Depthwise', 'min_data_in_leaf': 502}. Best is trial 306 with value: 170.64979827273262.[0m
[32m[I 2024-10-13 11:45:11,450][0m Trial 550 finished with value: 254.05657761291633 and parameters: {'depth': 4, 'learning_rate': 0.010144752248025754, 'iterations': 1746, 'l2_leaf_reg': 1.7464981398258122e-08, 'border_count': 1, 'bagging_temperature': 0.000570367245473484, 'random_strength': 7.153764745438238, 'grow_policy': 'Depthwise', 'min_data_in_leaf': 439}. Best is trial 306 with value: 170.64979827273262.[0m
[32m[I 2024-10-13 11:45:13,303][0m Trial 551 finished with value: 217.9865901465669 and parameters: {'depth': 4, 'learning_rate': 0.013436117408820848, 'iterations': 1824, 'l2_leaf_reg': 7.196233781688676e-08, 'border_count': 21, 'bagging_temperature': 0.02392246553565258, 'random_strength': 0.48130559663610584, 'grow_policy': 'Depthwise', 'min_data_in_leaf': 482}. Best is trial 306 with value: 170.64979827273262.[0m
[32m[I 2024-10-13 11:45:15,096][0m Trial 552 finished with value: 209.0567874256321 and parameters: {'depth': 7, 'learning_rate': 0.01566528766847025, 'iterations': 1673, 'l2_leaf_reg': 2.120860198506051e-07, 'border_count': 13, 'bagging_temperature': 0.00027019434424684075, 'random_strength': 0.3370097845643335, 'grow_policy': 'Depthwise', 'min_data_in_leaf': 521}. Best is trial 306 with value: 170.64979827273262.[0m
[32m[I 2024-10-13 11:45:16,897][0m Trial 553 finished with value: 173.6382089918136 and parameters: {'depth': 4, 'learning_rate': 0.011605352119579465, 'iterations': 1729, 'l2_leaf_reg': 8.141806590429939e-05, 'border_count': 6, 'bagging_temperature': 0.0533931151465769, 'random_strength': 0.49101240983310557, 'grow_policy': 'Depthwise', 'min_data_in_leaf': 467}. Best is trial 306 with value: 170.64979827273262.[0m
[32m[I 2024-10-13 11:45:18,665][0m Trial 554 finished with value: 202.2524478528632 and parameters: {'depth': 6, 'learning_rate': 0.01671803999971158, 'iterations': 1634, 'l2_leaf_reg': 0.00017836877568909343, 'border_count': 10, 'bagging_temperature': 0.03630735141946004, 'random_strength': 0.003646997832822352, 'grow_policy': 'Depthwise', 'min_data_in_leaf': 509}. Best is trial 306 with value: 170.64979827273262.[0m
[32m[I 2024-10-13 11:45:20,602][0m Trial 555 finished with value: 171.6425377355419 and parameters: {'depth': 4, 'learning_rate': 0.014415163770409415, 'iterations': 1778, 'l2_leaf_reg': 0.00041351601000663566, 'border_count': 5, 'bagging_temperature': 0.017353146816511948, 'random_strength': 0.23326890490181745, 'grow_policy': 'Depthwise', 'min_data_in_leaf': 402}. Best is trial 306 with value: 170.64979827273262.[0m
[32m[I 2024-10-13 11:45:22,661][0m Trial 556 finished with value: 173.78987922853418 and parameters: {'depth': 4, 'learning_rate': 0.007547461788474412, 'iterations': 1899, 'l2_leaf_reg': 0.0003331483664371622, 'border_count': 5, 'bagging_temperature': 0.019288598020081576, 'random_strength': 0.21901886370477552, 'grow_policy': 'Depthwise', 'min_data_in_leaf': 390}. Best is trial 306 with value: 170.64979827273262.[0m
[32m[I 2024-10-13 11:45:24,596][0m Trial 557 finished with value: 197.4337089999502 and parameters: {'depth': 4, 'learning_rate': 0.0091328424195476, 'iterations': 1808, 'l2_leaf_reg': 0.0006129890065645547, 'border_count': 16, 'bagging_temperature': 0.019918082717479007, 'random_strength': 0.19697994918456746, 'grow_policy': 'Depthwise', 'min_data_in_leaf': 410}. Best is trial 306 with value: 170.64979827273262.[0m
[32m[I 2024-10-13 11:45:26,488][0m Trial 558 finished with value: 203.13861894324975 and parameters: {'depth': 4, 'learning_rate': 0.012534714679286905, 'iterations': 1768, 'l2_leaf_reg': 0.0004403739455976409, 'border_count': 11, 'bagging_temperature': 0.0174498870448805, 'random_strength': 0.000523553884058614, 'grow_policy': 'Depthwise', 'min_data_in_leaf': 383}. Best is trial 306 with value: 170.64979827273262.[0m
[32m[I 2024-10-13 11:45:28,473][0m Trial 559 finished with value: 177.99213180210123 and parameters: {'depth': 4, 'learning_rate': 0.003685203239546956, 'iterations': 1860, 'l2_leaf_reg': 0.0003446749261681207, 'border_count': 7, 'bagging_temperature': 0.03842697220489452, 'random_strength': 0.30361096570225343, 'grow_policy': 'Depthwise', 'min_data_in_leaf': 369}. Best is trial 306 with value: 170.64979827273262.[0m
[32m[I 2024-10-13 11:45:30,298][0m Trial 560 finished with value: 254.0078221065749 and parameters: {'depth': 4, 'learning_rate': 0.012937684950956235, 'iterations': 1770, 'l2_leaf_reg': 0.00022470596910023746, 'border_count': 1, 'bagging_temperature': 0.000749424473494107, 'random_strength': 0.5838090341491289, 'grow_policy': 'Depthwise', 'min_data_in_leaf': 429}. Best is trial 306 with value: 170.64979827273262.[0m
[32m[I 2024-10-13 11:45:32,092][0m Trial 561 finished with value: 209.36125013969632 and parameters: {'depth': 4, 'learning_rate': 0.014547797496897948, 'iterations': 1708, 'l2_leaf_reg': 0.0005112596793018534, 'border_count': 13, 'bagging_temperature': 0.03740350268437016, 'random_strength': 0.35090751342648696, 'grow_policy': 'Depthwise', 'min_data_in_leaf': 490}. Best is trial 306 with value: 170.64979827273262.[0m
