[32m[I 2024-10-13 11:37:06,104][0m Trial 307 finished with value: 221.1469709326269 and parameters: {'depth': 6, 'learning_rate': 0.04410652765694424, 'iterations': 1315, 'l2_leaf_reg': 0.00031512346823298, 'border_count': 25, 'bagging_temperature': 0.030316847764745525, 'random_strength': 1.209662017661776, 'grow_policy': 'Depthwise', 'min_data_in_leaf': 598}. Best is trial 306 with value: 170.64979827273262.[0m
[32m[I 2024-10-13 11:37:07,564][0m Trial 308 finished with value: 232.92535617804515 and parameters: {'depth': 6, 'learning_rate': 0.02852854422767627, 'iterations': 1294, 'l2_leaf_reg': 0.0005320930474555539, 'border_count': 58, 'bagging_temperature': 0.016971906767602324, 'random_strength': 0.9990002462237588, 'grow_policy': 'Depthwise', 'min_data_in_leaf': 588}. Best is trial 306 with value: 170.64979827273262.[0m
[32m[I 2024-10-13 11:37:09,134][0m Trial 309 finished with value: 200.19566092539347 and parameters: {'depth': 5, 'learning_rate': 0.018662335385711715, 'iterations': 1386, 'l2_leaf_reg': 0.0007360206119441085, 'border_count': 18, 'bagging_temperature': 0.03919890742391555, 'random_strength': 0.8594724191834782, 'grow_policy': 'Depthwise', 'min_data_in_leaf': 636}. Best is trial 306 with value: 170.64979827273262.[0m
[32m[I 2024-10-13 11:37:10,573][0m Trial 310 finished with value: 212.61640965086016 and parameters: {'depth': 5, 'learning_rate': 0.02619298479496234, 'iterations': 1228, 'l2_leaf_reg': 2.19902865930148e-07, 'border_count': 13, 'bagging_temperature': 0.04981345656367546, 'random_strength': 7.18274305807528, 'grow_policy': 'Depthwise', 'min_data_in_leaf': 614}. Best is trial 306 with value: 170.64979827273262.[0m
[32m[I 2024-10-13 11:37:12,100][0m Trial 311 finished with value: 177.7710160030151 and parameters: {'depth': 5, 'learning_rate': 0.01978032287595589, 'iterations': 1308, 'l2_leaf_reg': 3.310860037923328e-05, 'border_count': 9, 'bagging_temperature': 0.0011749491228552275, 'random_strength': 1.3709273348557087, 'grow_policy': 'Depthwise', 'min_data_in_leaf': 593}. Best is trial 306 with value: 170.64979827273262.[0m
[32m[I 2024-10-13 11:37:13,519][0m Trial 312 finished with value: 172.88070503126954 and parameters: {'depth': 15, 'learning_rate': 0.024766367641025935, 'iterations': 1179, 'l2_leaf_reg': 3.633963284027108e-07, 'border_count': 6, 'bagging_temperature': 0.027882233302065206, 'random_strength': 0.7492995143417447, 'grow_policy': 'Depthwise', 'min_data_in_leaf': 658}. Best is trial 306 with value: 170.64979827273262.[0m
[32m[I 2024-10-13 11:37:15,077][0m Trial 313 finished with value: 253.39644609606822 and parameters: {'depth': 6, 'learning_rate': 0.016650867477692184, 'iterations': 1327, 'l2_leaf_reg': 1.1835682967154506e-06, 'border_count': 1, 'bagging_temperature': 0.053619566474841826, 'random_strength': 1.1034806312255128, 'grow_policy': 'Depthwise', 'min_data_in_leaf': 636}. Best is trial 306 with value: 170.64979827273262.[0m
[32m[I 2024-10-13 11:37:16,617][0m Trial 314 finished with value: 250.4773640476341 and parameters: {'depth': 9, 'learning_rate': 0.020772324364824377, 'iterations': 1414, 'l2_leaf_reg': 0.000992112464709103, 'border_count': 251, 'bagging_temperature': 0.036650047773088036, 'random_strength': 0.9840492677241199, 'grow_policy': 'Depthwise', 'min_data_in_leaf': 671}. Best is trial 306 with value: 170.64979827273262.[0m
[32m[I 2024-10-13 11:37:18,088][0m Trial 315 finished with value: 214.0411377720931 and parameters: {'depth': 5, 'learning_rate': 0.030695324013079155, 'iterations': 1265, 'l2_leaf_reg': 0.0005494377564520455, 'border_count': 15, 'bagging_temperature': 0.056341012280732836, 'random_strength': 1.6041596320980644, 'grow_policy': 'Depthwise', 'min_data_in_leaf': 611}. Best is trial 306 with value: 170.64979827273262.[0m
[32m[I 2024-10-13 11:37:19,648][0m Trial 316 finished with value: 201.63206594474715 and parameters: {'depth': 4, 'learning_rate': 0.01836361767386651, 'iterations': 1445, 'l2_leaf_reg': 0.0017122941211285085, 'border_count': 10, 'bagging_temperature': 0.017748695683755186, 'random_strength': 0.6790862954873841, 'grow_policy': 'Depthwise', 'min_data_in_leaf': 639}. Best is trial 306 with value: 170.64979827273262.[0m
[32m[I 2024-10-13 11:37:21,193][0m Trial 317 finished with value: 217.13088009189497 and parameters: {'depth': 7, 'learning_rate': 0.015394976477481349, 'iterations': 1333, 'l2_leaf_reg': 6.022471625062036e-07, 'border_count': 21, 'bagging_temperature': 0.06113233509895555, 'random_strength': 0.8159354439649342, 'grow_policy': 'Depthwise', 'min_data_in_leaf': 606}. Best is trial 306 with value: 170.64979827273262.[0m
[32m[I 2024-10-13 11:37:22,774][0m Trial 318 finished with value: 172.9579649858229 and parameters: {'depth': 9, 'learning_rate': 0.02181213995582738, 'iterations': 1371, 'l2_leaf_reg': 1.5293612164319498e-06, 'border_count': 6, 'bagging_temperature': 0.03493523170521723, 'random_strength': 7.471837787267995, 'grow_policy': 'Depthwise', 'min_data_in_leaf': 580}. Best is trial 306 with value: 170.64979827273262.[0m
[32m[I 2024-10-13 11:37:24,376][0m Trial 319 finished with value: 202.9912387777812 and parameters: {'depth': 5, 'learning_rate': 0.0034525092933949345, 'iterations': 1492, 'l2_leaf_reg': 0.00034017579941676354, 'border_count': 13, 'bagging_temperature': 0.06980673406536538, 'random_strength': 1.9178006879009164, 'grow_policy': 'Depthwise', 'min_data_in_leaf': 656}. Best is trial 306 with value: 170.64979827273262.[0m
[32m[I 2024-10-13 11:37:30,528][0m Trial 320 finished with value: 243.17847570634905 and parameters: {'depth': 4, 'learning_rate': 0.016759842906692204, 'iterations': 1929, 'l2_leaf_reg': 0.00025251641509019344, 'border_count': 1, 'bagging_temperature': 0.018421883262560782, 'random_strength': 1.25474581603279, 'grow_policy': 'SymmetricTree', 'min_data_in_leaf': 628}. Best is trial 306 with value: 170.64979827273262.[0m
[32m[I 2024-10-13 11:37:32,196][0m Trial 321 finished with value: 177.3841669570517 and parameters: {'depth': 9, 'learning_rate': 0.026279845595676157, 'iterations': 1577, 'l2_leaf_reg': 0.0009873688556488274, 'border_count': 9, 'bagging_temperature': 0.04558395479652497, 'random_strength': 0.6122899982190215, 'grow_policy': 'Depthwise', 'min_data_in_leaf': 684}. Best is trial 306 with value: 170.64979827273262.[0m
[32m[I 2024-10-13 11:37:33,653][0m Trial 322 finished with value: 195.2059705094535 and parameters: {'depth': 6, 'learning_rate': 0.013318755800109768, 'iterations': 1201, 'l2_leaf_reg': 0.44172220451378047, 'border_count': 17, 'bagging_temperature': 0.7009020120287707, 'random_strength': 1.0337829910228802, 'grow_policy': 'Depthwise', 'min_data_in_leaf': 647}. Best is trial 306 with value: 170.64979827273262.[0m
[32m[I 2024-10-13 11:37:35,407][0m Trial 323 finished with value: 173.70683763061788 and parameters: {'depth': 15, 'learning_rate': 0.019761031475128126, 'iterations': 1600, 'l2_leaf_reg': 0.0017518512182212484, 'border_count': 6, 'bagging_temperature': 0.06316183672076249, 'random_strength': 0.5185621660089133, 'grow_policy': 'Depthwise', 'min_data_in_leaf': 605}. Best is trial 306 with value: 170.64979827273262.[0m
[32m[I 2024-10-13 11:37:36,998][0m Trial 324 finished with value: 255.2120685583105 and parameters: {'depth': 4, 'learning_rate': 0.0367998025381153, 'iterations': 1445, 'l2_leaf_reg': 9.225695485372297e-07, 'border_count': 1, 'bagging_temperature': 0.0386071472511861, 'random_strength': 0.8493784184539606, 'grow_policy': 'Depthwise', 'min_data_in_leaf': 670}. Best is trial 306 with value: 170.64979827273262.[0m
[32m[I 2024-10-13 11:37:38,432][0m Trial 325 finished with value: 204.231997320916 and parameters: {'depth': 4, 'learning_rate': 0.02228128258740415, 'iterations': 1268, 'l2_leaf_reg': 0.003000888107687844, 'border_count': 11, 'bagging_temperature': 0.10096325466764866, 'random_strength': 0.7108074374178295, 'grow_policy': 'Depthwise', 'min_data_in_leaf': 631}. Best is trial 306 with value: 170.64979827273262.[0m
[32m[I 2024-10-13 11:37:40,378][0m Trial 326 finished with value: 174.77792904860777 and parameters: {'depth': 8, 'learning_rate': 0.02732296059319079, 'iterations': 1881, 'l2_leaf_reg': 9.595136899447515e-08, 'border_count': 6, 'bagging_temperature': 0.015681010105055654, 'random_strength': 1.3330085193891898, 'grow_policy': 'Depthwise', 'min_data_in_leaf': 286}. Best is trial 306 with value: 170.64979827273262.[0m
[32m[I 2024-10-13 11:37:42,039][0m Trial 327 finished with value: 205.95098665140677 and parameters: {'depth': 5, 'learning_rate': 0.015681831872905592, 'iterations': 1522, 'l2_leaf_reg': 0.0006112469277343853, 'border_count': 15, 'bagging_temperature': 0.06361054001722762, 'random_strength': 0.5408274094227581, 'grow_policy': 'Depthwise', 'min_data_in_leaf': 719}. Best is trial 306 with value: 170.64979827273262.[0m
[32m[I 2024-10-13 11:37:43,568][0m Trial 328 finished with value: 179.6157331826199 and parameters: {'depth': 4, 'learning_rate': 0.018321851002113997, 'iterations': 1385, 'l2_leaf_reg': 1.398040807741958e-06, 'border_count': 9, 'bagging_temperature': 0.03274306127649612, 'random_strength': 0.9557280658045069, 'grow_policy': 'Depthwise', 'min_data_in_leaf': 695}. Best is trial 306 with value: 170.64979827273262.[0m
[32m[I 2024-10-13 11:37:45,363][0m Trial 329 finished with value: 253.29202133131503 and parameters: {'depth': 9, 'learning_rate': 0.011535966644757327, 'iterations': 1767, 'l2_leaf_reg': 6.994832372436117e-07, 'border_count': 1, 'bagging_temperature': 0.07499285232664238, 'random_strength': 0.3787413618986945, 'grow_policy': 'Depthwise', 'min_data_in_leaf': 917}. Best is trial 306 with value: 170.64979827273262.[0m
[32m[I 2024-10-13 11:37:47,121][0m Trial 330 finished with value: 224.31987130346474 and parameters: {'depth': 4, 'learning_rate': 0.023401712200604097, 'iterations': 1619, 'l2_leaf_reg': 4.0112058097002946e-07, 'border_count': 21, 'bagging_temperature': 0.04871021073169403, 'random_strength': 1.1176305706881347, 'grow_policy': 'Depthwise', 'min_data_in_leaf': 486}. Best is trial 306 with value: 170.64979827273262.[0m
[32m[I 2024-10-13 11:37:48,932][0m Trial 331 finished with value: 175.92530100666264 and parameters: {'depth': 7, 'learning_rate': 0.03099398841715003, 'iterations': 1683, 'l2_leaf_reg': 0.001563778815114165, 'border_count': 6, 'bagging_temperature': 0.11417594146046829, 'random_strength': 0.7299507893957755, 'grow_policy': 'Depthwise', 'min_data_in_leaf': 580}. Best is trial 306 with value: 170.64979827273262.[0m
[32m[I 2024-10-13 11:37:50,600][0m Trial 332 finished with value: 207.566783188582 and parameters: {'depth': 3, 'learning_rate': 0.013776744187504285, 'iterations': 1556, 'l2_leaf_reg': 0.0007831389333162513, 'border_count': 13, 'bagging_temperature': 0.06329929615058662, 'random_strength': 0.4603455348785781, 'grow_policy': 'Depthwise', 'min_data_in_leaf': 623}. Best is trial 306 with value: 170.64979827273262.[0m
[32m[I 2024-10-13 11:37:52,233][0m Trial 333 finished with value: 185.49941644962607 and parameters: {'depth': 4, 'learning_rate': 0.01951954073069737, 'iterations': 1436, 'l2_leaf_reg': 0.002598250503600094, 'border_count': 9, 'bagging_temperature': 0.4114639809584933, 'random_strength': 1.6457997338441046, 'grow_policy': 'Depthwise', 'min_data_in_leaf': 677}. Best is trial 306 with value: 170.64979827273262.[0m
[32m[I 2024-10-13 11:37:53,741][0m Trial 334 finished with value: 206.7662617158276 and parameters: {'depth': 5, 'learning_rate': 0.0162487500783798, 'iterations': 1352, 'l2_leaf_reg': 0.0043962935015950414, 'border_count': 28, 'bagging_temperature': 0.0005446931677579245, 'random_strength': 2.7071868260505036, 'grow_policy': 'Depthwise', 'min_data_in_leaf': 654}. Best is trial 306 with value: 170.64979827273262.[0m
[32m[I 2024-10-13 11:37:55,705][0m Trial 335 finished with value: 173.93015153863894 and parameters: {'depth': 4, 'learning_rate': 0.0251779245226798, 'iterations': 1979, 'l2_leaf_reg': 0.00013461430754666364, 'border_count': 5, 'bagging_temperature': 0.09256727300487473, 'random_strength': 0.9227104780157884, 'grow_policy': 'Depthwise', 'min_data_in_leaf': 614}. Best is trial 306 with value: 170.64979827273262.[0m
[32m[I 2024-10-13 11:37:57,352][0m Trial 336 finished with value: 202.14607096243301 and parameters: {'depth': 3, 'learning_rate': 0.020492543297347555, 'iterations': 1492, 'l2_leaf_reg': 2.3396340241814387e-07, 'border_count': 16, 'bagging_temperature': 0.031248347429016443, 'random_strength': 0.676271847534281, 'grow_policy': 'Depthwise', 'min_data_in_leaf': 970}. Best is trial 306 with value: 170.64979827273262.[0m
[32m[I 2024-10-13 11:37:59,240][0m Trial 337 finished with value: 253.437767887004 and parameters: {'depth': 14, 'learning_rate': 0.012915662079901285, 'iterations': 1818, 'l2_leaf_reg': 0.0010204376347929427, 'border_count': 1, 'bagging_temperature': 0.05208858880130056, 'random_strength': 1.4730486905739513, 'grow_policy': 'Depthwise', 'min_data_in_leaf': 740}. Best is trial 306 with value: 170.64979827273262.[0m
[32m[I 2024-10-13 11:38:01,040][0m Trial 338 finished with value: 204.9255598581199 and parameters: {'depth': 9, 'learning_rate': 0.016714234173697547, 'iterations': 1720, 'l2_leaf_reg': 1.568988730923416e-06, 'border_count': 11, 'bagging_temperature': 0.07914693888757669, 'random_strength': 0.01383656672731537, 'grow_policy': 'Depthwise', 'min_data_in_leaf': 651}. Best is trial 306 with value: 170.64979827273262.[0m
[32m[I 2024-10-13 11:38:06,581][0m Trial 339 finished with value: 179.33329940200395 and parameters: {'depth': 4, 'learning_rate': 0.02205831846014608, 'iterations': 1630, 'l2_leaf_reg': 5.870270737370718e-07, 'border_count': 6, 'bagging_temperature': 0.02048489707267187, 'random_strength': 0.544055179919002, 'grow_policy': 'SymmetricTree', 'min_data_in_leaf': 703}. Best is trial 306 with value: 170.64979827273262.[0m
[32m[I 2024-10-13 11:38:08,256][0m Trial 340 finished with value: 205.63159243200633 and parameters: {'depth': 4, 'learning_rate': 0.02762608142051079, 'iterations': 1550, 'l2_leaf_reg': 0.0003712801305599782, 'border_count': 20, 'bagging_temperature': 0.043584967051095276, 'random_strength': 1.228022727952064, 'grow_policy': 'Depthwise', 'min_data_in_leaf': 444}. Best is trial 306 with value: 170.64979827273262.[0m
[32m[I 2024-10-13 11:38:09,749][0m Trial 341 finished with value: 202.65059614751107 and parameters: {'depth': 3, 'learning_rate': 0.010675487162510894, 'iterations': 1263, 'l2_leaf_reg': 1.09996345988055e-06, 'border_count': 13, 'bagging_temperature': 0.00020777543431089313, 'random_strength': 0.37327142569633975, 'grow_policy': 'Depthwise', 'min_data_in_leaf': 595}. Best is trial 306 with value: 170.64979827273262.[0m
[32m[I 2024-10-13 11:38:10,404][0m Trial 342 finished with value: 192.24990360120566 and parameters: {'depth': 5, 'learning_rate': 0.014825384296485953, 'iterations': 167, 'l2_leaf_reg': 0.0032992538277691226, 'border_count': 5, 'bagging_temperature': 0.10088050988912539, 'random_strength': 0.7881872144473139, 'grow_policy': 'Depthwise', 'min_data_in_leaf': 640}. Best is trial 306 with value: 170.64979827273262.[0m
[32m[I 2024-10-13 11:38:11,844][0m Trial 343 finished with value: 182.39428577941874 and parameters: {'depth': 15, 'learning_rate': 0.0511635206726321, 'iterations': 1144, 'l2_leaf_reg': 0.001619714614797099, 'border_count': 9, 'bagging_temperature': 0.12836057832555464, 'random_strength': 1.0829951925415526, 'grow_policy': 'Depthwise', 'min_data_in_leaf': 663}. Best is trial 306 with value: 170.64979827273262.[0m
[32m[I 2024-10-13 11:38:13,496][0m Trial 344 finished with value: 246.8197566392967 and parameters: {'depth': 9, 'learning_rate': 0.018508072126297764, 'iterations': 1464, 'l2_leaf_reg': 9.311502280847301e-05, 'border_count': 111, 'bagging_temperature': 0.06976473778947885, 'random_strength': 0.9356137071345443, 'grow_policy': 'Depthwise', 'min_data_in_leaf': 623}. Best is trial 306 with value: 170.64979827273262.[0m
[32m[I 2024-10-13 11:38:15,178][0m Trial 345 finished with value: 255.23918564744855 and parameters: {'depth': 3, 'learning_rate': 0.03428953539553485, 'iterations': 1595, 'l2_leaf_reg': 0.0005021166951895168, 'border_count': 1, 'bagging_temperature': 0.027972369008963917, 'random_strength': 0.23271762761866158, 'grow_policy': 'Depthwise', 'min_data_in_leaf': 680}. Best is trial 306 with value: 170.64979827273262.[0m
[32m[I 2024-10-13 11:38:16,964][0m Trial 346 finished with value: 215.7055245851831 and parameters: {'depth': 4, 'learning_rate': 0.024768017994895735, 'iterations': 1703, 'l2_leaf_reg': 0.00018932316558526824, 'border_count': 15, 'bagging_temperature': 0.05611901990104372, 'random_strength': 0.5858258862301967, 'grow_policy': 'Lossguide', 'min_data_in_leaf': 571, 'max_leaves': 38}. Best is trial 306 with value: 170.64979827273262.[0m
[32m[I 2024-10-13 11:38:17,789][0m Trial 347 finished with value: 177.8295026048112 and parameters: {'depth': 6, 'learning_rate': 0.017755577292786706, 'iterations': 315, 'l2_leaf_reg': 1.9469810923565274e-06, 'border_count': 9, 'bagging_temperature': 0.08967376785624906, 'random_strength': 0.4001631951590361, 'grow_policy': 'Depthwise', 'min_data_in_leaf': 718}. Best is trial 306 with value: 170.64979827273262.[0m
[32m[I 2024-10-13 11:38:19,380][0m Trial 348 finished with value: 172.54012184481752 and parameters: {'depth': 8, 'learning_rate': 0.020929467646195386, 'iterations': 1393, 'l2_leaf_reg': 0.0007270280297114273, 'border_count': 5, 'bagging_temperature': 0.07346391030503459, 'random_strength': 0.6883900752026404, 'grow_policy': 'Depthwise', 'min_data_in_leaf': 596}. Best is trial 306 with value: 170.64979827273262.[0m
[32m[I 2024-10-13 11:38:20,948][0m Trial 349 finished with value: 202.37162896004324 and parameters: {'depth': 8, 'learning_rate': 0.022306405265631622, 'iterations': 1383, 'l2_leaf_reg': 0.0008875358392207677, 'border_count': 18, 'bagging_temperature': 0.040875193578386156, 'random_strength': 0.4588596365750114, 'grow_policy': 'Depthwise', 'min_data_in_leaf': 602}. Best is trial 306 with value: 170.64979827273262.[0m
[32m[I 2024-10-13 11:38:22,448][0m Trial 350 finished with value: 257.5031368379527 and parameters: {'depth': 7, 'learning_rate': 0.014275299614470278, 'iterations': 1335, 'l2_leaf_reg': 0.0010487686510118363, 'border_count': 98, 'bagging_temperature': 0.06966384571244531, 'random_strength': 9.687108422480705, 'grow_policy': 'Lossguide', 'min_data_in_leaf': 564, 'max_leaves': 170}. Best is trial 306 with value: 170.64979827273262.[0m
[32m[I 2024-10-13 11:38:24,060][0m Trial 351 finished with value: 209.81362442835626 and parameters: {'depth': 8, 'learning_rate': 0.02993507399329481, 'iterations': 1423, 'l2_leaf_reg': 0.0020896189202895266, 'border_count': 11, 'bagging_temperature': 0.013882404934567733, 'random_strength': 0.16619921392030756, 'grow_policy': 'Depthwise', 'min_data_in_leaf': 591}. Best is trial 306 with value: 170.64979827273262.[0m
[32m[I 2024-10-13 11:38:25,568][0m Trial 352 finished with value: 253.26078621595786 and parameters: {'depth': 3, 'learning_rate': 0.016245825684212085, 'iterations': 1316, 'l2_leaf_reg': 0.0014629619164838853, 'border_count': 1, 'bagging_temperature': 0.052361188841058705, 'random_strength': 1.1690252984559848, 'grow_policy': 'Depthwise', 'min_data_in_leaf': 621}. Best is trial 306 with value: 170.64979827273262.[0m
[32m[I 2024-10-13 11:38:27,220][0m Trial 353 finished with value: 206.03282020303368 and parameters: {'depth': 9, 'learning_rate': 0.012250764817572826, 'iterations': 1492, 'l2_leaf_reg': 0.000715818587469964, 'border_count': 23, 'bagging_temperature': 0.03314497334553274, 'random_strength': 0.8126595946653141, 'grow_policy': 'Depthwise', 'min_data_in_leaf': 634}. Best is trial 306 with value: 170.64979827273262.[0m
[32m[I 2024-10-13 11:38:28,672][0m Trial 354 finished with value: 178.04283953231896 and parameters: {'depth': 5, 'learning_rate': 0.021641683674007147, 'iterations': 1221, 'l2_leaf_reg': 0.0006014904979572533, 'border_count': 6, 'bagging_temperature': 0.4796980389446494, 'random_strength': 0.6353711293766786, 'grow_policy': 'Lossguide', 'min_data_in_leaf': 607, 'max_leaves': 68}. Best is trial 306 with value: 170.64979827273262.[0m
[32m[I 2024-10-13 11:38:30,247][0m Trial 355 finished with value: 214.6052678404386 and parameters: {'depth': 6, 'learning_rate': 0.02615887995184119, 'iterations': 1416, 'l2_leaf_reg': 1.7068877835428454e-07, 'border_count': 13, 'bagging_temperature': 0.07292312791638218, 'random_strength': 1.4100083628805706, 'grow_policy': 'Depthwise', 'min_data_in_leaf': 539}. Best is trial 306 with value: 170.64979827273262.[0m
[32m[I 2024-10-13 11:38:31,756][0m Trial 356 finished with value: 173.00312437939508 and parameters: {'depth': 9, 'learning_rate': 0.018435629424350737, 'iterations': 1274, 'l2_leaf_reg': 8.98906654812568e-07, 'border_count': 7, 'bagging_temperature': 0.053559398500332756, 'random_strength': 0.9599913677575969, 'grow_policy': 'Depthwise', 'min_data_in_leaf': 583}. Best is trial 306 with value: 170.64979827273262.[0m
[32m[I 2024-10-13 11:38:33,298][0m Trial 357 finished with value: 202.46483361237958 and parameters: {'depth': 3, 'learning_rate': 0.023432295517291826, 'iterations': 1369, 'l2_leaf_reg': 4.5273766566817926e-07, 'border_count': 17, 'bagging_temperature': 0.019481402432918522, 'random_strength': 0.30464578393912645, 'grow_policy': 'Depthwise', 'min_data_in_leaf': 646}. Best is trial 306 with value: 170.64979827273262.[0m
