[32m[I 2024-10-13 11:35:23,318][0m Trial 255 finished with value: 172.45660711219892 and parameters: {'depth': 4, 'learning_rate': 0.02123614624135764, 'iterations': 1809, 'l2_leaf_reg': 0.00016868761129409785, 'border_count': 5, 'bagging_temperature': 0.04020513456498968, 'random_strength': 0.9447171541683632, 'grow_policy': 'Depthwise', 'min_data_in_leaf': 837}. Best is trial 77 with value: 171.4904345158229.[0m
[32m[I 2024-10-13 11:35:25,152][0m Trial 256 finished with value: 206.28148501466163 and parameters: {'depth': 3, 'learning_rate': 0.02118582771787364, 'iterations': 1815, 'l2_leaf_reg': 0.00021104891274687683, 'border_count': 12, 'bagging_temperature': 0.016775073134051688, 'random_strength': 0.9203475596828432, 'grow_policy': 'Depthwise', 'min_data_in_leaf': 835}. Best is trial 77 with value: 171.4904345158229.[0m
[32m[I 2024-10-13 11:35:27,053][0m Trial 257 finished with value: 363.3960968463455 and parameters: {'depth': 4, 'learning_rate': 0.00010491689213915083, 'iterations': 1857, 'l2_leaf_reg': 0.00011941233484241741, 'border_count': 18, 'bagging_temperature': 0.03944451367886149, 'random_strength': 1.2626950037039837, 'grow_policy': 'Depthwise', 'min_data_in_leaf': 921}. Best is trial 77 with value: 171.4904345158229.[0m
[32m[I 2024-10-13 11:35:28,845][0m Trial 258 finished with value: 173.5258865385819 and parameters: {'depth': 4, 'learning_rate': 0.0252141225587766, 'iterations': 1731, 'l2_leaf_reg': 0.00025585227708539954, 'border_count': 5, 'bagging_temperature': 0.10118111605201542, 'random_strength': 0.8579148050046798, 'grow_policy': 'Depthwise', 'min_data_in_leaf': 877}. Best is trial 77 with value: 171.4904345158229.[0m
[32m[I 2024-10-13 11:35:30,799][0m Trial 259 finished with value: 204.57106973296936 and parameters: {'depth': 3, 'learning_rate': 0.02248644723493846, 'iterations': 1713, 'l2_leaf_reg': 0.00010935647415302015, 'border_count': 10, 'bagging_temperature': 0.02325870270713231, 'random_strength': 1.1193183024455091, 'grow_policy': 'Depthwise', 'min_data_in_leaf': 742}. Best is trial 77 with value: 171.4904345158229.[0m
[32m[I 2024-10-13 11:35:32,749][0m Trial 260 finished with value: 210.7930612531674 and parameters: {'depth': 4, 'learning_rate': 0.017935153037676593, 'iterations': 1819, 'l2_leaf_reg': 0.00027210359414138056, 'border_count': 15, 'bagging_temperature': 0.06414588885027184, 'random_strength': 0.2708011154226226, 'grow_policy': 'Depthwise', 'min_data_in_leaf': 664}. Best is trial 77 with value: 171.4904345158229.[0m
[32m[I 2024-10-13 11:35:34,566][0m Trial 261 finished with value: 174.8661762195838 and parameters: {'depth': 3, 'learning_rate': 0.030165783711557738, 'iterations': 1783, 'l2_leaf_reg': 4.843754459054317e-05, 'border_count': 8, 'bagging_temperature': 0.08581344078841782, 'random_strength': 0.6102609839076575, 'grow_policy': 'Depthwise', 'min_data_in_leaf': 846}. Best is trial 77 with value: 171.4904345158229.[0m
[32m[I 2024-10-13 11:35:36,317][0m Trial 262 finished with value: 253.90793165266143 and parameters: {'depth': 4, 'learning_rate': 0.020271772164378112, 'iterations': 1622, 'l2_leaf_reg': 0.004349912643150882, 'border_count': 1, 'bagging_temperature': 0.0006634750982142806, 'random_strength': 0.14938587429892963, 'grow_policy': 'Depthwise', 'min_data_in_leaf': 638}. Best is trial 77 with value: 171.4904345158229.[0m
[32m[I 2024-10-13 11:35:38,309][0m Trial 263 finished with value: 221.08229348671009 and parameters: {'depth': 3, 'learning_rate': 0.016345587028927046, 'iterations': 1897, 'l2_leaf_reg': 0.0003807932906483034, 'border_count': 21, 'bagging_temperature': 0.04376866251687667, 'random_strength': 0.8915635253660359, 'grow_policy': 'Depthwise', 'min_data_in_leaf': 697}. Best is trial 77 with value: 171.4904345158229.[0m
[32m[I 2024-10-13 11:35:40,143][0m Trial 264 finished with value: 172.5833614292612 and parameters: {'depth': 4, 'learning_rate': 0.024271550886899244, 'iterations': 1689, 'l2_leaf_reg': 0.002721814665994488, 'border_count': 5, 'bagging_temperature': 0.06552916435051334, 'random_strength': 0.4341053356181611, 'grow_policy': 'Depthwise', 'min_data_in_leaf': 670}. Best is trial 77 with value: 171.4904345158229.[0m
[32m[I 2024-10-13 11:35:41,928][0m Trial 265 finished with value: 208.34558762593525 and parameters: {'depth': 4, 'learning_rate': 0.02596278575523694, 'iterations': 1713, 'l2_leaf_reg': 0.003909092706696327, 'border_count': 12, 'bagging_temperature': 0.02171143380810074, 'random_strength': 0.7238509757159978, 'grow_policy': 'Depthwise', 'min_data_in_leaf': 734}. Best is trial 77 with value: 171.4904345158229.[0m
[32m[I 2024-10-13 11:35:43,712][0m Trial 266 finished with value: 175.6840578802946 and parameters: {'depth': 4, 'learning_rate': 0.024378881192411824, 'iterations': 1660, 'l2_leaf_reg': 0.010766585642405412, 'border_count': 5, 'bagging_temperature': 0.2932854882375545, 'random_strength': 1.4087855354118706, 'grow_policy': 'Depthwise', 'min_data_in_leaf': 863}. Best is trial 77 with value: 171.4904345158229.[0m
[32m[I 2024-10-13 11:35:45,522][0m Trial 267 finished with value: 206.10289827833597 and parameters: {'depth': 4, 'learning_rate': 0.03181813560970175, 'iterations': 1789, 'l2_leaf_reg': 7.317247672021027e-05, 'border_count': 10, 'bagging_temperature': 0.10048802291751846, 'random_strength': 0.5529104265537851, 'grow_policy': 'Depthwise', 'min_data_in_leaf': 810}. Best is trial 77 with value: 171.4904345158229.[0m
[32m[I 2024-10-13 11:35:51,499][0m Trial 268 finished with value: 225.3798065044199 and parameters: {'depth': 4, 'learning_rate': 0.022103488812250827, 'iterations': 1747, 'l2_leaf_reg': 0.06602091079458847, 'border_count': 16, 'bagging_temperature': 0.0584922818446408, 'random_strength': 1.0137451755058913, 'grow_policy': 'SymmetricTree', 'min_data_in_leaf': 676}. Best is trial 77 with value: 171.4904345158229.[0m
[32m[I 2024-10-13 11:35:53,250][0m Trial 269 finished with value: 253.81877112968343 and parameters: {'depth': 5, 'learning_rate': 0.019281022366484848, 'iterations': 1668, 'l2_leaf_reg': 0.002037339042330061, 'border_count': 1, 'bagging_temperature': 0.035282807323883725, 'random_strength': 0.14550634901916343, 'grow_policy': 'Depthwise', 'min_data_in_leaf': 705}. Best is trial 77 with value: 171.4904345158229.[0m
[32m[I 2024-10-13 11:35:54,951][0m Trial 270 finished with value: 172.60286166808203 and parameters: {'depth': 4, 'learning_rate': 0.027436584220208074, 'iterations': 1509, 'l2_leaf_reg': 0.0008386783857993782, 'border_count': 8, 'bagging_temperature': 0.08075284330111276, 'random_strength': 0.40498185594669867, 'grow_policy': 'Depthwise', 'min_data_in_leaf': 637}. Best is trial 77 with value: 171.4904345158229.[0m
[32m[I 2024-10-13 11:35:56,604][0m Trial 271 finished with value: 208.18229811875077 and parameters: {'depth': 4, 'learning_rate': 0.03260381273358007, 'iterations': 1488, 'l2_leaf_reg': 0.0007160065838650698, 'border_count': 12, 'bagging_temperature': 0.07672340941049224, 'random_strength': 1.190233028639986, 'grow_policy': 'Depthwise', 'min_data_in_leaf': 635}. Best is trial 77 with value: 171.4904345158229.[0m
[32m[I 2024-10-13 11:35:58,201][0m Trial 272 finished with value: 206.09788611649194 and parameters: {'depth': 5, 'learning_rate': 0.027445002148718076, 'iterations': 1434, 'l2_leaf_reg': 0.000559369808850202, 'border_count': 18, 'bagging_temperature': 0.11596427715984624, 'random_strength': 0.7459057876652009, 'grow_policy': 'Depthwise', 'min_data_in_leaf': 784}. Best is trial 77 with value: 171.4904345158229.[0m
[32m[I 2024-10-13 11:36:00,021][0m Trial 273 finished with value: 180.09131479957207 and parameters: {'depth': 4, 'learning_rate': 0.023908003118121583, 'iterations': 1708, 'l2_leaf_reg': 0.0011067570427999148, 'border_count': 9, 'bagging_temperature': 0.08858753025403943, 'random_strength': 0.46614479951511734, 'grow_policy': 'Depthwise', 'min_data_in_leaf': 684}. Best is trial 77 with value: 171.4904345158229.[0m
[32m[I 2024-10-13 11:36:01,915][0m Trial 274 finished with value: 172.84192177724756 and parameters: {'depth': 5, 'learning_rate': 0.020579279536560323, 'iterations': 1847, 'l2_leaf_reg': 0.0003571563942072225, 'border_count': 5, 'bagging_temperature': 0.0628273694022685, 'random_strength': 0.03835806577776525, 'grow_policy': 'Depthwise', 'min_data_in_leaf': 628}. Best is trial 77 with value: 171.4904345158229.[0m
[32m[I 2024-10-13 11:36:03,531][0m Trial 275 finished with value: 245.57062148416617 and parameters: {'depth': 4, 'learning_rate': 0.03925908857357477, 'iterations': 1508, 'l2_leaf_reg': 0.00014889188592231916, 'border_count': 85, 'bagging_temperature': 0.10006315716277348, 'random_strength': 0.8653365794031114, 'grow_policy': 'Depthwise', 'min_data_in_leaf': 762}. Best is trial 77 with value: 171.4904345158229.[0m
[32m[I 2024-10-13 11:36:05,306][0m Trial 276 finished with value: 218.05957773451584 and parameters: {'depth': 4, 'learning_rate': 0.02875270009907428, 'iterations': 1612, 'l2_leaf_reg': 0.0007685571410756367, 'border_count': 14, 'bagging_temperature': 0.07848097353894432, 'random_strength': 0.5994321797180486, 'grow_policy': 'Depthwise', 'min_data_in_leaf': 645}. Best is trial 77 with value: 171.4904345158229.[0m
[32m[I 2024-10-13 11:36:06,990][0m Trial 277 finished with value: 217.71648256292218 and parameters: {'depth': 4, 'learning_rate': 0.017549311774826257, 'iterations': 1556, 'l2_leaf_reg': 7.79557436293929e-05, 'border_count': 22, 'bagging_temperature': 0.049981361276568895, 'random_strength': 0.35494760365341693, 'grow_policy': 'Depthwise', 'min_data_in_leaf': 800}. Best is trial 77 with value: 171.4904345158229.[0m
[32m[I 2024-10-13 11:36:08,860][0m Trial 278 finished with value: 254.34668178242066 and parameters: {'depth': 4, 'learning_rate': 0.023289842444701427, 'iterations': 1668, 'l2_leaf_reg': 0.00021821206911190323, 'border_count': 1, 'bagging_temperature': 0.10623471062128359, 'random_strength': 1.000122442415532, 'grow_policy': 'Depthwise', 'min_data_in_leaf': 718}. Best is trial 77 with value: 171.4904345158229.[0m
[32m[I 2024-10-13 11:36:10,417][0m Trial 279 finished with value: 180.82933512838258 and parameters: {'depth': 6, 'learning_rate': 0.01949037805030712, 'iterations': 1399, 'l2_leaf_reg': 0.002084961446491251, 'border_count': 9, 'bagging_temperature': 0.07321527771077375, 'random_strength': 0.6952132892870959, 'grow_policy': 'Depthwise', 'min_data_in_leaf': 666}. Best is trial 77 with value: 171.4904345158229.[0m
[32m[I 2024-10-13 11:36:12,052][0m Trial 280 finished with value: 256.543586617909 and parameters: {'depth': 4, 'learning_rate': 0.01645329998087431, 'iterations': 1457, 'l2_leaf_reg': 0.007647786511031549, 'border_count': 163, 'bagging_temperature': 0.0419469435418766, 'random_strength': 0.492604557309862, 'grow_policy': 'Depthwise', 'min_data_in_leaf': 686}. Best is trial 77 with value: 171.4904345158229.[0m
[32m[I 2024-10-13 11:36:13,904][0m Trial 281 finished with value: 174.78346850975322 and parameters: {'depth': 3, 'learning_rate': 0.021487997505528995, 'iterations': 1765, 'l2_leaf_reg': 0.0013859787357195508, 'border_count': 6, 'bagging_temperature': 0.08835125714803627, 'random_strength': 0.004666246052977774, 'grow_policy': 'Depthwise', 'min_data_in_leaf': 615}. Best is trial 77 with value: 171.4904345158229.[0m
[32m[I 2024-10-13 11:36:15,596][0m Trial 282 finished with value: 216.22321086343553 and parameters: {'depth': 4, 'learning_rate': 0.026563653610839167, 'iterations': 1581, 'l2_leaf_reg': 0.0004436223925412744, 'border_count': 14, 'bagging_temperature': 0.055821839841408774, 'random_strength': 1.2359384462105765, 'grow_policy': 'Depthwise', 'min_data_in_leaf': 635}. Best is trial 77 with value: 171.4904345158229.[0m
[32m[I 2024-10-13 11:36:17,237][0m Trial 283 finished with value: 173.1077749987858 and parameters: {'depth': 15, 'learning_rate': 0.015589749635431319, 'iterations': 1504, 'l2_leaf_reg': 0.002451659184453215, 'border_count': 5, 'bagging_temperature': 0.113132367181315, 'random_strength': 0.24859969468165172, 'grow_policy': 'Depthwise', 'min_data_in_leaf': 746}. Best is trial 77 with value: 171.4904345158229.[0m
[32m[I 2024-10-13 11:36:19,031][0m Trial 284 finished with value: 257.03318830426514 and parameters: {'depth': 4, 'learning_rate': 0.017544345082452836, 'iterations': 1647, 'l2_leaf_reg': 0.0009275444531598413, 'border_count': 224, 'bagging_temperature': 0.07205030354502455, 'random_strength': 0.7952519809632368, 'grow_policy': 'Depthwise', 'min_data_in_leaf': 700}. Best is trial 77 with value: 171.4904345158229.[0m
[32m[I 2024-10-13 11:36:25,360][0m Trial 285 finished with value: 236.04726559765606 and parameters: {'depth': 4, 'learning_rate': 0.03599625212846748, 'iterations': 1910, 'l2_leaf_reg': 0.001744605911865411, 'border_count': 10, 'bagging_temperature': 0.030031092398518505, 'random_strength': 0.44001865030576626, 'grow_policy': 'SymmetricTree', 'min_data_in_leaf': 656}. Best is trial 77 with value: 171.4904345158229.[0m
[32m[I 2024-10-13 11:36:26,879][0m Trial 286 finished with value: 253.6803637088644 and parameters: {'depth': 3, 'learning_rate': 0.020549137959204426, 'iterations': 1372, 'l2_leaf_reg': 0.0006565122088587872, 'border_count': 1, 'bagging_temperature': 0.0539235060742801, 'random_strength': 1.0300805419039354, 'grow_policy': 'Depthwise', 'min_data_in_leaf': 675}. Best is trial 77 with value: 171.4904345158229.[0m
[32m[I 2024-10-13 11:36:28,544][0m Trial 287 finished with value: 203.90367546119106 and parameters: {'depth': 5, 'learning_rate': 0.02628916831812128, 'iterations': 1556, 'l2_leaf_reg': 2.550283811939568, 'border_count': 18, 'bagging_temperature': 0.08792835970254499, 'random_strength': 1.5153806304383628, 'grow_policy': 'Depthwise', 'min_data_in_leaf': 726}. Best is trial 77 with value: 171.4904345158229.[0m
[32m[I 2024-10-13 11:36:30,395][0m Trial 288 finished with value: 171.36140114561928 and parameters: {'depth': 3, 'learning_rate': 0.014909568753557563, 'iterations': 1721, 'l2_leaf_reg': 0.0035516876084253786, 'border_count': 8, 'bagging_temperature': 0.03332433663303017, 'random_strength': 0.665782265134934, 'grow_policy': 'Depthwise', 'min_data_in_leaf': 613}. Best is trial 288 with value: 171.36140114561928.[0m
[32m[I 2024-10-13 11:36:32,212][0m Trial 289 finished with value: 204.5504648160776 and parameters: {'depth': 3, 'learning_rate': 0.014654352721942186, 'iterations': 1740, 'l2_leaf_reg': 0.0036409831550460433, 'border_count': 11, 'bagging_temperature': 0.02854105765842363, 'random_strength': 0.3058047715058957, 'grow_policy': 'Depthwise', 'min_data_in_leaf': 601}. Best is trial 288 with value: 171.36140114561928.[0m
[32m[I 2024-10-13 11:36:34,072][0m Trial 290 finished with value: 201.1426466461899 and parameters: {'depth': 3, 'learning_rate': 0.01528418029171331, 'iterations': 1819, 'l2_leaf_reg': 0.005768074624345941, 'border_count': 16, 'bagging_temperature': 0.044673219703699266, 'random_strength': 0.6224289515455825, 'grow_policy': 'Depthwise', 'min_data_in_leaf': 621}. Best is trial 288 with value: 171.36140114561928.[0m
[32m[I 2024-10-13 11:36:35,696][0m Trial 291 finished with value: 185.0578564117982 and parameters: {'depth': 3, 'learning_rate': 0.017517100628324282, 'iterations': 1471, 'l2_leaf_reg': 0.003628309022017063, 'border_count': 9, 'bagging_temperature': 0.34202626627230565, 'random_strength': 0.18685444348937885, 'grow_policy': 'Depthwise', 'min_data_in_leaf': 971}. Best is trial 288 with value: 171.36140114561928.[0m
[32m[I 2024-10-13 11:36:37,306][0m Trial 292 finished with value: 173.42262945255752 and parameters: {'depth': 3, 'learning_rate': 0.03133810124278014, 'iterations': 1428, 'l2_leaf_reg': 0.0013693374945550761, 'border_count': 5, 'bagging_temperature': 0.06218512753141552, 'random_strength': 0.5360165025125806, 'grow_policy': 'Depthwise', 'min_data_in_leaf': 646}. Best is trial 288 with value: 171.36140114561928.[0m
[32m[I 2024-10-13 11:36:39,076][0m Trial 293 finished with value: 214.46399707474856 and parameters: {'depth': 3, 'learning_rate': 0.02296815157616349, 'iterations': 1706, 'l2_leaf_reg': 0.0026419801973261796, 'border_count': 23, 'bagging_temperature': 0.024459941912673255, 'random_strength': 0.3770287656377151, 'grow_policy': 'Depthwise', 'min_data_in_leaf': 601}. Best is trial 288 with value: 171.36140114561928.[0m
[32m[I 2024-10-13 11:36:40,019][0m Trial 294 finished with value: 254.88101659770916 and parameters: {'depth': 3, 'learning_rate': 0.014804131815410425, 'iterations': 551, 'l2_leaf_reg': 0.0021425499928430496, 'border_count': 1, 'bagging_temperature': 0.04044803516124262, 'random_strength': 0.6975526574295585, 'grow_policy': 'Depthwise', 'min_data_in_leaf': 624}. Best is trial 288 with value: 171.36140114561928.[0m
[32m[I 2024-10-13 11:36:41,718][0m Trial 295 finished with value: 210.74874598850414 and parameters: {'depth': 4, 'learning_rate': 0.018001905214984876, 'iterations': 1534, 'l2_leaf_reg': 0.007930816723393705, 'border_count': 13, 'bagging_temperature': 0.06970519958655336, 'random_strength': 0.1952917738231552, 'grow_policy': 'Depthwise', 'min_data_in_leaf': 467}. Best is trial 288 with value: 171.36140114561928.[0m
[32m[I 2024-10-13 11:36:43,445][0m Trial 296 finished with value: 171.11045974657117 and parameters: {'depth': 5, 'learning_rate': 0.022200275589023453, 'iterations': 1610, 'l2_leaf_reg': 0.0008844329508397604, 'border_count': 8, 'bagging_temperature': 0.02235478445797153, 'random_strength': 1.1677876023614282, 'grow_policy': 'Depthwise', 'min_data_in_leaf': 643}. Best is trial 296 with value: 171.11045974657117.[0m
[32m[I 2024-10-13 11:36:45,205][0m Trial 297 finished with value: 204.481573789546 and parameters: {'depth': 4, 'learning_rate': 0.02398403447617294, 'iterations': 1619, 'l2_leaf_reg': 0.0005872719614382748, 'border_count': 10, 'bagging_temperature': 0.01733860289767514, 'random_strength': 1.3599233854816382, 'grow_policy': 'Depthwise', 'min_data_in_leaf': 647}. Best is trial 296 with value: 171.11045974657117.[0m
[32m[I 2024-10-13 11:36:47,116][0m Trial 298 finished with value: 205.2572853031278 and parameters: {'depth': 5, 'learning_rate': 0.02143001904649666, 'iterations': 1852, 'l2_leaf_reg': 0.0012165343392177414, 'border_count': 17, 'bagging_temperature': 0.018729065835462397, 'random_strength': 1.1797934074236192, 'grow_policy': 'Depthwise', 'min_data_in_leaf': 676}. Best is trial 296 with value: 171.11045974657117.[0m
[32m[I 2024-10-13 11:36:48,973][0m Trial 299 finished with value: 176.59673063013832 and parameters: {'depth': 5, 'learning_rate': 0.029071608909421003, 'iterations': 1748, 'l2_leaf_reg': 0.0012168495010230428, 'border_count': 8, 'bagging_temperature': 0.5879946503339804, 'random_strength': 0.9704240513080745, 'grow_policy': 'Depthwise', 'min_data_in_leaf': 669}. Best is trial 296 with value: 171.11045974657117.[0m
[32m[I 2024-10-13 11:36:50,514][0m Trial 300 finished with value: 253.61835937475718 and parameters: {'depth': 4, 'learning_rate': 0.020117097590966436, 'iterations': 1383, 'l2_leaf_reg': 0.0009612832590374426, 'border_count': 1, 'bagging_temperature': 0.03888496614389449, 'random_strength': 1.1530927016700714, 'grow_policy': 'Depthwise', 'min_data_in_leaf': 645}. Best is trial 296 with value: 171.11045974657117.[0m
[32m[I 2024-10-13 11:36:52,258][0m Trial 301 finished with value: 208.17163714705947 and parameters: {'depth': 9, 'learning_rate': 0.02480617185084434, 'iterations': 1671, 'l2_leaf_reg': 0.0008340350829787681, 'border_count': 14, 'bagging_temperature': 0.6539367817495513, 'random_strength': 1.7508003235056089, 'grow_policy': 'Depthwise', 'min_data_in_leaf': 706}. Best is trial 296 with value: 171.11045974657117.[0m
[32m[I 2024-10-13 11:36:58,159][0m Trial 302 finished with value: 193.04063063018637 and parameters: {'depth': 4, 'learning_rate': 0.017291884752062402, 'iterations': 1789, 'l2_leaf_reg': 0.017053414215100895, 'border_count': 8, 'bagging_temperature': 0.01345353755705151, 'random_strength': 0.8797360024544534, 'grow_policy': 'SymmetricTree', 'min_data_in_leaf': 690}. Best is trial 296 with value: 171.11045974657117.[0m
[32m[I 2024-10-13 11:36:59,858][0m Trial 303 finished with value: 206.87253401329357 and parameters: {'depth': 4, 'learning_rate': 0.03377756468275075, 'iterations': 1484, 'l2_leaf_reg': 0.00041232200625403767, 'border_count': 20, 'bagging_temperature': 0.0004474809454673434, 'random_strength': 0.5637932282952288, 'grow_policy': 'Depthwise', 'min_data_in_leaf': 657}. Best is trial 296 with value: 171.11045974657117.[0m
[32m[I 2024-10-13 11:37:01,619][0m Trial 304 finished with value: 205.54598029098796 and parameters: {'depth': 4, 'learning_rate': 0.022392944249447103, 'iterations': 1640, 'l2_leaf_reg': 0.00477482907821292, 'border_count': 12, 'bagging_temperature': 0.05135721954146709, 'random_strength': 1.4401935330605458, 'grow_policy': 'Depthwise', 'min_data_in_leaf': 629}. Best is trial 296 with value: 171.11045974657117.[0m
[32m[I 2024-10-13 11:37:03,120][0m Trial 305 finished with value: 172.40322386948102 and parameters: {'depth': 5, 'learning_rate': 0.019327338278217962, 'iterations': 1339, 'l2_leaf_reg': 0.0015679154607485114, 'border_count': 7, 'bagging_temperature': 0.036997022031876714, 'random_strength': 0.7630408877238304, 'grow_policy': 'Depthwise', 'min_data_in_leaf': 605}. Best is trial 296 with value: 171.11045974657117.[0m
[32m[I 2024-10-13 11:37:04,597][0m Trial 306 finished with value: 170.64979827273262 and parameters: {'depth': 6, 'learning_rate': 0.025049061417306548, 'iterations': 1264, 'l2_leaf_reg': 0.0007493777815964455, 'border_count': 8, 'bagging_temperature': 0.032828628871289685, 'random_strength': 0.978591164834927, 'grow_policy': 'Depthwise', 'min_data_in_leaf': 600}. Best is trial 306 with value: 170.64979827273262.[0m
