[32m[I 2024-10-13 12:00:22,493][0m Trial 967 finished with value: 174.3504933013911 and parameters: {'depth': 11, 'learning_rate': 0.02488777539235208, 'iterations': 2137, 'l2_leaf_reg': 0.08668138415292465, 'border_count': 5, 'bagging_temperature': 0.1438805066073106, 'random_strength': 1.5412397094012267, 'grow_policy': 'Lossguide', 'min_data_in_leaf': 901, 'max_leaves': 209}. Best is trial 924 with value: 169.86064328905624.[0m
[32m[I 2024-10-13 12:00:24,846][0m Trial 968 finished with value: 205.5692956140092 and parameters: {'depth': 3, 'learning_rate': 0.016806327961227635, 'iterations': 2534, 'l2_leaf_reg': 1.926100762901474, 'border_count': 12, 'bagging_temperature': 0.052302954072098604, 'random_strength': 2.0905965507306825, 'grow_policy': 'Lossguide', 'min_data_in_leaf': 979, 'max_leaves': 192}. Best is trial 924 with value: 169.86064328905624.[0m
[32m[I 2024-10-13 12:00:27,121][0m Trial 969 finished with value: 172.3281300105926 and parameters: {'depth': 10, 'learning_rate': 0.02002928360321719, 'iterations': 2443, 'l2_leaf_reg': 3.7382438756205083, 'border_count': 8, 'bagging_temperature': 0.07836300386149433, 'random_strength': 1.8659713111565208, 'grow_policy': 'Lossguide', 'min_data_in_leaf': 883, 'max_leaves': 171}. Best is trial 924 with value: 169.86064328905624.[0m
[32m[I 2024-10-13 12:00:29,329][0m Trial 970 finished with value: 204.02573735587953 and parameters: {'depth': 3, 'learning_rate': 0.01509252396267263, 'iterations': 2293, 'l2_leaf_reg': 6.722258560542242, 'border_count': 15, 'bagging_temperature': 0.11005780449100117, 'random_strength': 1.6839540634617736, 'grow_policy': 'Lossguide', 'min_data_in_leaf': 924, 'max_leaves': 75}. Best is trial 924 with value: 169.86064328905624.[0m
[32m[I 2024-10-13 12:00:31,480][0m Trial 971 finished with value: 255.6991175851184 and parameters: {'depth': 3, 'learning_rate': 0.030120314910233037, 'iterations': 2250, 'l2_leaf_reg': 3.301451003194061, 'border_count': 1, 'bagging_temperature': 0.053179878219139304, 'random_strength': 1.468926412458325, 'grow_policy': 'Lossguide', 'min_data_in_leaf': 948, 'max_leaves': 166}. Best is trial 924 with value: 169.86064328905624.[0m
[32m[I 2024-10-13 12:00:33,790][0m Trial 972 finished with value: 171.29839639178272 and parameters: {'depth': 3, 'learning_rate': 0.023711688821980048, 'iterations': 2406, 'l2_leaf_reg': 9.633837822721897, 'border_count': 5, 'bagging_temperature': 0.09343216618640277, 'random_strength': 1.8895948133102773, 'grow_policy': 'Lossguide', 'min_data_in_leaf': 966, 'max_leaves': 138}. Best is trial 924 with value: 169.86064328905624.[0m
[32m[I 2024-10-13 12:00:36,125][0m Trial 973 finished with value: 256.04417499935573 and parameters: {'depth': 3, 'learning_rate': 0.033651402156055235, 'iterations': 2470, 'l2_leaf_reg': 0.34527164332756477, 'border_count': 1, 'bagging_temperature': 0.1202964302062566, 'random_strength': 2.1258756615744794, 'grow_policy': 'Lossguide', 'min_data_in_leaf': 982, 'max_leaves': 140}. Best is trial 924 with value: 169.86064328905624.[0m
[32m[I 2024-10-13 12:00:38,609][0m Trial 974 finished with value: 175.06388788597198 and parameters: {'depth': 3, 'learning_rate': 0.03077800957117325, 'iterations': 2659, 'l2_leaf_reg': 9.831829293591564, 'border_count': 6, 'bagging_temperature': 0.13274169208735684, 'random_strength': 1.9278681162963498, 'grow_policy': 'Lossguide', 'min_data_in_leaf': 962, 'max_leaves': 149}. Best is trial 924 with value: 169.86064328905624.[0m
[32m[I 2024-10-13 12:00:40,815][0m Trial 975 finished with value: 183.3366537381286 and parameters: {'depth': 3, 'learning_rate': 0.023616903484627125, 'iterations': 2379, 'l2_leaf_reg': 6.5060449097040065, 'border_count': 9, 'bagging_temperature': 0.492202504058079, 'random_strength': 1.7781440548008682, 'grow_policy': 'Lossguide', 'min_data_in_leaf': 939, 'max_leaves': 132}. Best is trial 924 with value: 169.86064328905624.[0m
[32m[I 2024-10-13 12:00:43,209][0m Trial 976 finished with value: 255.61722304251444 and parameters: {'depth': 3, 'learning_rate': 0.02881977447131605, 'iterations': 2512, 'l2_leaf_reg': 5.399304276414971, 'border_count': 1, 'bagging_temperature': 0.09824452559791211, 'random_strength': 2.3454554312826215, 'grow_policy': 'Lossguide', 'min_data_in_leaf': 999, 'max_leaves': 146}. Best is trial 924 with value: 169.86064328905624.[0m
[32m[I 2024-10-13 12:00:45,486][0m Trial 977 finished with value: 171.42321589023828 and parameters: {'depth': 3, 'learning_rate': 0.026559972236585492, 'iterations': 2415, 'l2_leaf_reg': 9.987536239599034, 'border_count': 5, 'bagging_temperature': 0.09358141331198576, 'random_strength': 1.9888852131156278, 'grow_policy': 'Lossguide', 'min_data_in_leaf': 957, 'max_leaves': 139}. Best is trial 924 with value: 169.86064328905624.[0m
[32m[I 2024-10-13 12:00:47,829][0m Trial 978 finished with value: 172.94735732563552 and parameters: {'depth': 3, 'learning_rate': 0.035143096667896494, 'iterations': 2480, 'l2_leaf_reg': 9.799266214934981, 'border_count': 5, 'bagging_temperature': 0.1688283149569743, 'random_strength': 2.1756101442399194, 'grow_policy': 'Lossguide', 'min_data_in_leaf': 963, 'max_leaves': 141}. Best is trial 924 with value: 169.86064328905624.[0m
[32m[I 2024-10-13 12:00:50,120][0m Trial 979 finished with value: 209.55897039686727 and parameters: {'depth': 3, 'learning_rate': 0.0357913359320142, 'iterations': 2422, 'l2_leaf_reg': 4.580320724133809, 'border_count': 12, 'bagging_temperature': 0.11229723030441913, 'random_strength': 2.524670984278143, 'grow_policy': 'Lossguide', 'min_data_in_leaf': 983, 'max_leaves': 137}. Best is trial 924 with value: 169.86064328905624.[0m
[32m[I 2024-10-13 12:00:52,421][0m Trial 980 finished with value: 255.42205926684417 and parameters: {'depth': 3, 'learning_rate': 0.028251205005884877, 'iterations': 2413, 'l2_leaf_reg': 6.429566821523775, 'border_count': 1, 'bagging_temperature': 0.10353282206799864, 'random_strength': 1.9747401561726747, 'grow_policy': 'Lossguide', 'min_data_in_leaf': 956, 'max_leaves': 145}. Best is trial 924 with value: 169.86064328905624.[0m
[32m[I 2024-10-13 12:00:54,844][0m Trial 981 finished with value: 178.0836151328705 and parameters: {'depth': 3, 'learning_rate': 0.02619861733480165, 'iterations': 2573, 'l2_leaf_reg': 9.96451029303441, 'border_count': 9, 'bagging_temperature': 0.14909858335608533, 'random_strength': 2.1507441555195776, 'grow_policy': 'Lossguide', 'min_data_in_leaf': 979, 'max_leaves': 129}. Best is trial 924 with value: 169.86064328905624.[0m
[32m[I 2024-10-13 12:00:57,173][0m Trial 982 finished with value: 219.91689065014225 and parameters: {'depth': 3, 'learning_rate': 0.02672481838558218, 'iterations': 2497, 'l2_leaf_reg': 2.584695871228713, 'border_count': 15, 'bagging_temperature': 0.12781391095114877, 'random_strength': 1.9554746053727186, 'grow_policy': 'Lossguide', 'min_data_in_leaf': 948, 'max_leaves': 125}. Best is trial 924 with value: 169.86064328905624.[0m
[32m[I 2024-10-13 12:00:59,531][0m Trial 983 finished with value: 180.487360057365 and parameters: {'depth': 3, 'learning_rate': 0.03776905325563646, 'iterations': 2376, 'l2_leaf_reg': 0.2025563174000064, 'border_count': 6, 'bagging_temperature': 0.0952302283859727, 'random_strength': 2.334472594300172, 'grow_policy': 'Lossguide', 'min_data_in_leaf': 968, 'max_leaves': 121}. Best is trial 924 with value: 169.86064328905624.[0m
[32m[I 2024-10-13 12:01:01,817][0m Trial 984 finished with value: 205.61411424526923 and parameters: {'depth': 3, 'learning_rate': 0.026309785451927647, 'iterations': 2420, 'l2_leaf_reg': 4.661679176294792, 'border_count': 20, 'bagging_temperature': 0.12656109191508882, 'random_strength': 1.8478865252810222, 'grow_policy': 'Lossguide', 'min_data_in_leaf': 1000, 'max_leaves': 151}. Best is trial 924 with value: 169.86064328905624.[0m
[32m[I 2024-10-13 12:01:04,066][0m Trial 985 finished with value: 206.3119948053763 and parameters: {'depth': 3, 'learning_rate': 0.04049966647980201, 'iterations': 2442, 'l2_leaf_reg': 6.946974925898238, 'border_count': 10, 'bagging_temperature': 0.09442788246058106, 'random_strength': 2.679238166456552, 'grow_policy': 'Lossguide', 'min_data_in_leaf': 938, 'max_leaves': 136}. Best is trial 924 with value: 169.86064328905624.[0m
[32m[I 2024-10-13 12:01:06,350][0m Trial 986 finished with value: 254.9885621642461 and parameters: {'depth': 3, 'learning_rate': 0.02344607703396852, 'iterations': 2368, 'l2_leaf_reg': 3.760441723405901, 'border_count': 1, 'bagging_temperature': 0.11186551193390878, 'random_strength': 2.1220812494583585, 'grow_policy': 'Lossguide', 'min_data_in_leaf': 957, 'max_leaves': 135}. Best is trial 924 with value: 169.86064328905624.[0m
[32m[I 2024-10-13 12:01:08,626][0m Trial 987 finished with value: 253.3152944257782 and parameters: {'depth': 3, 'learning_rate': 0.030646166160024323, 'iterations': 2325, 'l2_leaf_reg': 1.746683778740535, 'border_count': 246, 'bagging_temperature': 0.08476243433275289, 'random_strength': 1.7038899098972318, 'grow_policy': 'Lossguide', 'min_data_in_leaf': 977, 'max_leaves': 187}. Best is trial 924 with value: 169.86064328905624.[0m
[32m[I 2024-10-13 12:01:11,053][0m Trial 988 finished with value: 174.30482810581475 and parameters: {'depth': 3, 'learning_rate': 0.024003111752370274, 'iterations': 2619, 'l2_leaf_reg': 6.02621572709365, 'border_count': 6, 'bagging_temperature': 0.08269099090087212, 'random_strength': 1.972393241261973, 'grow_policy': 'Lossguide', 'min_data_in_leaf': 942, 'max_leaves': 157}. Best is trial 924 with value: 169.86064328905624.[0m
[32m[I 2024-10-13 12:01:13,344][0m Trial 989 finished with value: 278.14626525789004 and parameters: {'depth': 3, 'learning_rate': 0.29772852376413494, 'iterations': 2367, 'l2_leaf_reg': 2.811198855420311, 'border_count': 14, 'bagging_temperature': 0.13612278095306615, 'random_strength': 2.3315141787828666, 'grow_policy': 'Lossguide', 'min_data_in_leaf': 984, 'max_leaves': 142}. Best is trial 924 with value: 169.86064328905624.[0m
[32m[I 2024-10-13 12:01:15,679][0m Trial 990 finished with value: 171.3573686721809 and parameters: {'depth': 3, 'learning_rate': 0.02118195348412616, 'iterations': 2529, 'l2_leaf_reg': 6.878471101973833, 'border_count': 5, 'bagging_temperature': 0.10211009876978153, 'random_strength': 1.7636488564397261, 'grow_policy': 'Lossguide', 'min_data_in_leaf': 926, 'max_leaves': 182}. Best is trial 924 with value: 169.86064328905624.[0m
[32m[I 2024-10-13 12:01:18,113][0m Trial 991 finished with value: 202.7387760107606 and parameters: {'depth': 3, 'learning_rate': 0.0204589650220277, 'iterations': 2621, 'l2_leaf_reg': 4.236556447458946, 'border_count': 10, 'bagging_temperature': 0.18127013632610361, 'random_strength': 1.6241617317105002, 'grow_policy': 'Lossguide', 'min_data_in_leaf': 916, 'max_leaves': 181}. Best is trial 924 with value: 169.86064328905624.[0m
[32m[I 2024-10-13 12:01:20,589][0m Trial 992 finished with value: 204.3556812207038 and parameters: {'depth': 3, 'learning_rate': 0.01922474462257004, 'iterations': 2545, 'l2_leaf_reg': 3.3551162432093427, 'border_count': 18, 'bagging_temperature': 0.10187381586153252, 'random_strength': 1.7708888580609248, 'grow_policy': 'Lossguide', 'min_data_in_leaf': 927, 'max_leaves': 197}. Best is trial 924 with value: 169.86064328905624.[0m
[32m[I 2024-10-13 12:01:22,942][0m Trial 993 finished with value: 171.22170500815625 and parameters: {'depth': 3, 'learning_rate': 0.01913946064154728, 'iterations': 2506, 'l2_leaf_reg': 7.060359030356572, 'border_count': 5, 'bagging_temperature': 0.12478166582136271, 'random_strength': 1.5965636557662444, 'grow_policy': 'Lossguide', 'min_data_in_leaf': 886, 'max_leaves': 202}. Best is trial 924 with value: 169.86064328905624.[0m
[32m[I 2024-10-13 12:01:25,324][0m Trial 994 finished with value: 211.76585139533105 and parameters: {'depth': 3, 'learning_rate': 0.021794065162734272, 'iterations': 2577, 'l2_leaf_reg': 6.565968322031633, 'border_count': 13, 'bagging_temperature': 0.1544323188276639, 'random_strength': 1.7113040644603306, 'grow_policy': 'Lossguide', 'min_data_in_leaf': 881, 'max_leaves': 214}. Best is trial 924 with value: 169.86064328905624.[0m
[32m[I 2024-10-13 12:01:27,690][0m Trial 995 finished with value: 254.75919758876506 and parameters: {'depth': 3, 'learning_rate': 0.02225126182471957, 'iterations': 2597, 'l2_leaf_reg': 4.375029106996767, 'border_count': 1, 'bagging_temperature': 0.14501394656927152, 'random_strength': 1.6173452556504126, 'grow_policy': 'Lossguide', 'min_data_in_leaf': 894, 'max_leaves': 200}. Best is trial 924 with value: 169.86064328905624.[0m
[32m[I 2024-10-13 12:01:30,008][0m Trial 996 finished with value: 178.58195579734257 and parameters: {'depth': 3, 'learning_rate': 0.018396201696441905, 'iterations': 2484, 'l2_leaf_reg': 6.722204973599505, 'border_count': 9, 'bagging_temperature': 0.13134459485367575, 'random_strength': 1.833900830466257, 'grow_policy': 'Lossguide', 'min_data_in_leaf': 925, 'max_leaves': 192}. Best is trial 924 with value: 169.86064328905624.[0m
[32m[I 2024-10-13 12:01:32,484][0m Trial 997 finished with value: 173.70042023485195 and parameters: {'depth': 3, 'learning_rate': 0.021099111930229484, 'iterations': 2561, 'l2_leaf_reg': 5.313875364256747, 'border_count': 6, 'bagging_temperature': 0.11896427478344873, 'random_strength': 1.6106270555760709, 'grow_policy': 'Lossguide', 'min_data_in_leaf': 894, 'max_leaves': 205}. Best is trial 924 with value: 169.86064328905624.[0m
[32m[I 2024-10-13 12:01:34,789][0m Trial 998 finished with value: 215.83110526377916 and parameters: {'depth': 3, 'learning_rate': 0.01819071663906967, 'iterations': 2501, 'l2_leaf_reg': 7.206025479927616, 'border_count': 21, 'bagging_temperature': 0.17592719501461754, 'random_strength': 1.895995269741343, 'grow_policy': 'Lossguide', 'min_data_in_leaf': 910, 'max_leaves': 187}. Best is trial 924 with value: 169.86064328905624.[0m
[32m[I 2024-10-13 12:01:37,136][0m Trial 999 finished with value: 217.39343024948388 and parameters: {'depth': 3, 'learning_rate': 0.022884364561645575, 'iterations': 2515, 'l2_leaf_reg': 2.300906488992737, 'border_count': 14, 'bagging_temperature': 0.14661410290145147, 'random_strength': 1.485850337802427, 'grow_policy': 'Lossguide', 'min_data_in_leaf': 933, 'max_leaves': 175}. Best is trial 924 with value: 169.86064328905624.[0m
CatBoost: RMSE = 169.8606
      Model        RMSE
0  CatBoost  169.860643

Best hyperparameters for CatBoost:
{'depth': 3, 'learning_rate': 0.018165628391568156, 'iterations': 2327, 'l2_leaf_reg': 9.952970330404854, 'border_count': 5, 'bagging_temperature': 0.05750575462786251, 'random_strength': 1.9933309113463908, 'grow_policy': 'Lossguide', 'min_data_in_leaf': 995, 'max_leaves': 178}
