[32m[I 2024-10-13 11:42:00,550][0m Trial 460 finished with value: 172.88028624897396 and parameters: {'depth': 5, 'learning_rate': 0.018283914161404, 'iterations': 1494, 'l2_leaf_reg': 0.002001136412857676, 'border_count': 6, 'bagging_temperature': 0.04171020605916828, 'random_strength': 0.6035675771477191, 'grow_policy': 'Depthwise', 'min_data_in_leaf': 626}. Best is trial 306 with value: 170.64979827273262.[0m
[32m[I 2024-10-13 11:42:02,344][0m Trial 461 finished with value: 210.21513850520012 and parameters: {'depth': 3, 'learning_rate': 0.01611089423333341, 'iterations': 1680, 'l2_leaf_reg': 0.0013987761564976501, 'border_count': 13, 'bagging_temperature': 0.027720278365327755, 'random_strength': 0.21949619890959315, 'grow_policy': 'Depthwise', 'min_data_in_leaf': 653}. Best is trial 306 with value: 170.64979827273262.[0m
[32m[I 2024-10-13 11:42:04,196][0m Trial 462 finished with value: 172.57974575602302 and parameters: {'depth': 6, 'learning_rate': 0.01887810457983932, 'iterations': 1737, 'l2_leaf_reg': 0.000630941365238989, 'border_count': 5, 'bagging_temperature': 0.056086642365883156, 'random_strength': 0.449034502062541, 'grow_policy': 'Depthwise', 'min_data_in_leaf': 608}. Best is trial 306 with value: 170.64979827273262.[0m
[32m[I 2024-10-13 11:42:05,944][0m Trial 463 finished with value: 253.62854731650518 and parameters: {'depth': 5, 'learning_rate': 0.012871244858320205, 'iterations': 1544, 'l2_leaf_reg': 0.002071346238753115, 'border_count': 1, 'bagging_temperature': 0.032806286494303595, 'random_strength': 0.02138457705287866, 'grow_policy': 'Depthwise', 'min_data_in_leaf': 510}. Best is trial 306 with value: 170.64979827273262.[0m
[32m[I 2024-10-13 11:42:07,666][0m Trial 464 finished with value: 200.82221474951075 and parameters: {'depth': 5, 'learning_rate': 0.01514787368513382, 'iterations': 1630, 'l2_leaf_reg': 0.00025649715848025264, 'border_count': 10, 'bagging_temperature': 0.016377721567978013, 'random_strength': 0.6611540964817701, 'grow_policy': 'Depthwise', 'min_data_in_leaf': 222}. Best is trial 306 with value: 170.64979827273262.[0m
[32m[I 2024-10-13 11:42:09,004][0m Trial 465 finished with value: 215.1572530197552 and parameters: {'depth': 4, 'learning_rate': 0.02113408541942947, 'iterations': 948, 'l2_leaf_reg': 0.00032628013333026103, 'border_count': 21, 'bagging_temperature': 0.0008765382570248108, 'random_strength': 0.3413267330484465, 'grow_policy': 'Depthwise', 'min_data_in_leaf': 692}. Best is trial 306 with value: 170.64979827273262.[0m
[32m[I 2024-10-13 11:42:10,952][0m Trial 466 finished with value: 212.03947344719313 and parameters: {'depth': 3, 'learning_rate': 0.017863887650165555, 'iterations': 1776, 'l2_leaf_reg': 0.0006673120565164423, 'border_count': 14, 'bagging_temperature': 0.05144095474072921, 'random_strength': 0.7834084578728522, 'grow_policy': 'Depthwise', 'min_data_in_leaf': 601}. Best is trial 306 with value: 170.64979827273262.[0m
[32m[I 2024-10-13 11:42:12,736][0m Trial 467 finished with value: 173.47681676098543 and parameters: {'depth': 4, 'learning_rate': 0.015879704579859787, 'iterations': 1603, 'l2_leaf_reg': 0.0010135641951642981, 'border_count': 6, 'bagging_temperature': 0.07220777286842298, 'random_strength': 0.006792359944469584, 'grow_policy': 'Depthwise', 'min_data_in_leaf': 641}. Best is trial 306 with value: 170.64979827273262.[0m
[32m[I 2024-10-13 11:42:14,538][0m Trial 468 finished with value: 198.8448106817781 and parameters: {'depth': 4, 'learning_rate': 0.011818537592894562, 'iterations': 1709, 'l2_leaf_reg': 0.003483131026621267, 'border_count': 10, 'bagging_temperature': 0.03369114327320691, 'random_strength': 0.5228632512357678, 'grow_policy': 'Depthwise', 'min_data_in_leaf': 659}. Best is trial 306 with value: 170.64979827273262.[0m
[32m[I 2024-10-13 11:42:16,172][0m Trial 469 finished with value: 253.5298691544997 and parameters: {'depth': 5, 'learning_rate': 0.02084696154892069, 'iterations': 1535, 'l2_leaf_reg': 7.959049170663549, 'border_count': 1, 'bagging_temperature': 0.05355872920063738, 'random_strength': 0.26871595100674145, 'grow_policy': 'Depthwise', 'min_data_in_leaf': 619}. Best is trial 306 with value: 170.64979827273262.[0m
[32m[I 2024-10-13 11:42:18,018][0m Trial 470 finished with value: 209.34979234452933 and parameters: {'depth': 5, 'learning_rate': 0.018364197173404727, 'iterations': 1649, 'l2_leaf_reg': 0.0003879307884570201, 'border_count': 15, 'bagging_temperature': 0.0290163257210749, 'random_strength': 0.6281140050428285, 'grow_policy': 'Depthwise', 'min_data_in_leaf': 730}. Best is trial 306 with value: 170.64979827273262.[0m
[32m[I 2024-10-13 11:42:19,952][0m Trial 471 finished with value: 172.62716854840934 and parameters: {'depth': 3, 'learning_rate': 0.013728831061870032, 'iterations': 1762, 'l2_leaf_reg': 0.0014588051014827487, 'border_count': 6, 'bagging_temperature': 0.019342145878466468, 'random_strength': 0.45818806174427273, 'grow_policy': 'Depthwise', 'min_data_in_leaf': 672}. Best is trial 306 with value: 170.64979827273262.[0m
[32m[I 2024-10-13 11:42:21,945][0m Trial 472 finished with value: 178.99674271629792 and parameters: {'depth': 4, 'learning_rate': 0.024060652532470674, 'iterations': 1830, 'l2_leaf_reg': 0.0009036994561274316, 'border_count': 9, 'bagging_temperature': 0.07526184587567232, 'random_strength': 0.7294133462993966, 'grow_policy': 'Depthwise', 'min_data_in_leaf': 593}. Best is trial 306 with value: 170.64979827273262.[0m
[32m[I 2024-10-13 11:42:23,663][0m Trial 473 finished with value: 253.4047200811683 and parameters: {'depth': 5, 'learning_rate': 0.015885355227051902, 'iterations': 1469, 'l2_leaf_reg': 0.029427887461472114, 'border_count': 1, 'bagging_temperature': 0.049388628641323595, 'random_strength': 0.23299868145744498, 'grow_policy': 'Depthwise', 'min_data_in_leaf': 576}. Best is trial 306 with value: 170.64979827273262.[0m
[32m[I 2024-10-13 11:42:25,548][0m Trial 474 finished with value: 211.53183585888556 and parameters: {'depth': 4, 'learning_rate': 0.020190201995895288, 'iterations': 1680, 'l2_leaf_reg': 0.0018143783972190627, 'border_count': 32, 'bagging_temperature': 0.014566241181143148, 'random_strength': 0.8581797705576043, 'grow_policy': 'Depthwise', 'min_data_in_leaf': 757}. Best is trial 306 with value: 170.64979827273262.[0m
[32m[I 2024-10-13 11:42:32,811][0m Trial 475 finished with value: 195.43737899871994 and parameters: {'depth': 6, 'learning_rate': 0.024468015088478803, 'iterations': 1585, 'l2_leaf_reg': 0.010377741809449328, 'border_count': 17, 'bagging_temperature': 0.910940566075217, 'random_strength': 0.4505662266834469, 'grow_policy': 'SymmetricTree', 'min_data_in_leaf': 705}. Best is trial 306 with value: 170.64979827273262.[0m
[32m[I 2024-10-13 11:42:34,554][0m Trial 476 finished with value: 201.6635003375044 and parameters: {'depth': 4, 'learning_rate': 0.01791385242760173, 'iterations': 1529, 'l2_leaf_reg': 0.0010651728874431024, 'border_count': 10, 'bagging_temperature': 0.06536862949742012, 'random_strength': 0.6295278630853991, 'grow_policy': 'Depthwise', 'min_data_in_leaf': 626}. Best is trial 306 with value: 170.64979827273262.[0m
[32m[I 2024-10-13 11:42:36,456][0m Trial 477 finished with value: 230.77608847369294 and parameters: {'depth': 5, 'learning_rate': 0.009910534976854821, 'iterations': 1720, 'l2_leaf_reg': 0.0005734406745160715, 'border_count': 84, 'bagging_temperature': 0.039602958439912184, 'random_strength': 0.20384750959098963, 'grow_policy': 'Depthwise', 'min_data_in_leaf': 648}. Best is trial 306 with value: 170.64979827273262.[0m
[32m[I 2024-10-13 11:42:38,223][0m Trial 478 finished with value: 208.79615465918397 and parameters: {'depth': 3, 'learning_rate': 0.013567463632372111, 'iterations': 1630, 'l2_leaf_reg': 1.1163949106128281e-07, 'border_count': 25, 'bagging_temperature': 0.09082248677224948, 'random_strength': 0.3720548976895277, 'grow_policy': 'Depthwise', 'min_data_in_leaf': 683}. Best is trial 306 with value: 170.64979827273262.[0m
[32m[I 2024-10-13 11:42:40,066][0m Trial 479 finished with value: 173.20938084476182 and parameters: {'depth': 4, 'learning_rate': 0.020805048081816935, 'iterations': 1788, 'l2_leaf_reg': 0.003914506621274279, 'border_count': 6, 'bagging_temperature': 0.002183624342569069, 'random_strength': 0.8104043949005965, 'grow_policy': 'Depthwise', 'min_data_in_leaf': 612}. Best is trial 306 with value: 170.64979827273262.[0m
[32m[I 2024-10-13 11:42:41,816][0m Trial 480 finished with value: 203.93008223864825 and parameters: {'depth': 5, 'learning_rate': 0.015737225401937317, 'iterations': 1495, 'l2_leaf_reg': 0.00037174133960547073, 'border_count': 13, 'bagging_temperature': 0.38970694642569353, 'random_strength': 0.5722029360916935, 'grow_policy': 'Depthwise', 'min_data_in_leaf': 539}. Best is trial 306 with value: 170.64979827273262.[0m
[32m[I 2024-10-13 11:42:43,578][0m Trial 481 finished with value: 172.92107739508558 and parameters: {'depth': 6, 'learning_rate': 0.0297746955164067, 'iterations': 1581, 'l2_leaf_reg': 2.1593732289418653e-05, 'border_count': 5, 'bagging_temperature': 0.04584913761675801, 'random_strength': 0.2056452045282363, 'grow_policy': 'Depthwise', 'min_data_in_leaf': 631}. Best is trial 306 with value: 170.64979827273262.[0m
[32m[I 2024-10-13 11:42:45,329][0m Trial 482 finished with value: 362.63476438524975 and parameters: {'depth': 4, 'learning_rate': 0.0001622996404633792, 'iterations': 1689, 'l2_leaf_reg': 0.0024031195142441867, 'border_count': 1, 'bagging_temperature': 0.02942406748826789, 'random_strength': 0.9825027607180411, 'grow_policy': 'Depthwise', 'min_data_in_leaf': 658}. Best is trial 306 with value: 170.64979827273262.[0m
[32m[I 2024-10-13 11:42:47,316][0m Trial 483 finished with value: 239.55742337582868 and parameters: {'depth': 3, 'learning_rate': 0.023501549690259263, 'iterations': 1871, 'l2_leaf_reg': 2.0874342864879733e-06, 'border_count': 51, 'bagging_temperature': 0.0003395859926188932, 'random_strength': 0.4603604175414424, 'grow_policy': 'Depthwise', 'min_data_in_leaf': 560}. Best is trial 306 with value: 170.64979827273262.[0m
[32m[I 2024-10-13 11:42:49,082][0m Trial 484 finished with value: 202.49591226136263 and parameters: {'depth': 5, 'learning_rate': 0.018540490975842, 'iterations': 1652, 'l2_leaf_reg': 1.3872184552774287e-06, 'border_count': 18, 'bagging_temperature': 0.06734050512706874, 'random_strength': 0.024124984921974763, 'grow_policy': 'Depthwise', 'min_data_in_leaf': 594}. Best is trial 306 with value: 170.64979827273262.[0m
[32m[I 2024-10-13 11:42:50,968][0m Trial 485 finished with value: 199.01078675907686 and parameters: {'depth': 5, 'learning_rate': 0.011602789371029125, 'iterations': 1756, 'l2_leaf_reg': 7.634350972673535e-08, 'border_count': 10, 'bagging_temperature': 0.021132533124962816, 'random_strength': 0.6897630953260159, 'grow_policy': 'Depthwise', 'min_data_in_leaf': 631}. Best is trial 306 with value: 170.64979827273262.[0m
[32m[I 2024-10-13 11:42:52,652][0m Trial 486 finished with value: 174.0199255015435 and parameters: {'depth': 6, 'learning_rate': 0.015238651903491385, 'iterations': 1557, 'l2_leaf_reg': 0.0013331438139525063, 'border_count': 6, 'bagging_temperature': 0.10900053435647998, 'random_strength': 0.39940503842942754, 'grow_policy': 'Depthwise', 'min_data_in_leaf': 676}. Best is trial 306 with value: 170.64979827273262.[0m
[32m[I 2024-10-13 11:42:54,454][0m Trial 487 finished with value: 205.13117178253592 and parameters: {'depth': 4, 'learning_rate': 0.021847850532776773, 'iterations': 1615, 'l2_leaf_reg': 0.0006549621962732003, 'border_count': 12, 'bagging_temperature': 0.05329762138556114, 'random_strength': 0.8464153155672052, 'grow_policy': 'Depthwise', 'min_data_in_leaf': 647}. Best is trial 306 with value: 170.64979827273262.[0m
[32m[I 2024-10-13 11:42:56,097][0m Trial 488 finished with value: 173.00725263703333 and parameters: {'depth': 3, 'learning_rate': 0.027777986485991304, 'iterations': 1479, 'l2_leaf_reg': 5.815288175149427e-07, 'border_count': 5, 'bagging_temperature': 0.08076714863681204, 'random_strength': 0.2146093472608695, 'grow_policy': 'Depthwise', 'min_data_in_leaf': 615}. Best is trial 306 with value: 170.64979827273262.[0m
[32m[I 2024-10-13 11:42:58,001][0m Trial 489 finished with value: 202.09134725267117 and parameters: {'depth': 4, 'learning_rate': 0.018015777652164725, 'iterations': 1827, 'l2_leaf_reg': 5.4759892417774494e-05, 'border_count': 20, 'bagging_temperature': 0.04048938354621827, 'random_strength': 0.0020010838427471766, 'grow_policy': 'Depthwise', 'min_data_in_leaf': 708}. Best is trial 306 with value: 170.64979827273262.[0m
[32m[I 2024-10-13 11:42:59,800][0m Trial 490 finished with value: 253.70434549262077 and parameters: {'depth': 5, 'learning_rate': 0.01399840322455747, 'iterations': 1712, 'l2_leaf_reg': 0.0008747802030297503, 'border_count': 1, 'bagging_temperature': 0.022372823139076597, 'random_strength': 0.6481290113477891, 'grow_policy': 'Depthwise', 'min_data_in_leaf': 569}. Best is trial 306 with value: 170.64979827273262.[0m
[32m[I 2024-10-13 11:43:01,620][0m Trial 491 finished with value: 212.9028989662203 and parameters: {'depth': 7, 'learning_rate': 0.020483443885809395, 'iterations': 1678, 'l2_leaf_reg': 0.002175091046401297, 'border_count': 14, 'bagging_temperature': 0.05799023966359485, 'random_strength': 0.36522597793594463, 'grow_policy': 'Depthwise', 'min_data_in_leaf': 774}. Best is trial 306 with value: 170.64979827273262.[0m
[32m[I 2024-10-13 11:43:03,446][0m Trial 492 finished with value: 172.4083736096204 and parameters: {'depth': 5, 'learning_rate': 0.02441707226283506, 'iterations': 1752, 'l2_leaf_reg': 1.971222781173871e-06, 'border_count': 8, 'bagging_temperature': 0.04087013197547079, 'random_strength': 0.8356918633253254, 'grow_policy': 'Depthwise', 'min_data_in_leaf': 663}. Best is trial 306 with value: 170.64979827273262.[0m
[32m[I 2024-10-13 11:43:05,312][0m Trial 493 finished with value: 204.26823075494195 and parameters: {'depth': 5, 'learning_rate': 0.033094375262731165, 'iterations': 1787, 'l2_leaf_reg': 4.47979933760746e-06, 'border_count': 10, 'bagging_temperature': 0.4422656924443528, 'random_strength': 1.2204423327555558, 'grow_policy': 'Depthwise', 'min_data_in_leaf': 696}. Best is trial 306 with value: 170.64979827273262.[0m
[32m[I 2024-10-13 11:43:07,142][0m Trial 494 finished with value: 207.60631186983906 and parameters: {'depth': 5, 'learning_rate': 0.02605401970551416, 'iterations': 1745, 'l2_leaf_reg': 2.1533850518917458e-06, 'border_count': 16, 'bagging_temperature': 0.019232657442806785, 'random_strength': 1.0042929938534408, 'grow_policy': 'Depthwise', 'min_data_in_leaf': 666}. Best is trial 306 with value: 170.64979827273262.[0m
[32m[I 2024-10-13 11:43:09,086][0m Trial 495 finished with value: 255.6605928357181 and parameters: {'depth': 6, 'learning_rate': 0.03820879822541482, 'iterations': 1817, 'l2_leaf_reg': 0.0005104180451425695, 'border_count': 225, 'bagging_temperature': 0.032210766897888404, 'random_strength': 1.0815019099732601, 'grow_policy': 'Depthwise', 'min_data_in_leaf': 724}. Best is trial 306 with value: 170.64979827273262.[0m
[32m[I 2024-10-13 11:43:11,112][0m Trial 496 finished with value: 172.94755745791298 and parameters: {'depth': 5, 'learning_rate': 0.02426727609206291, 'iterations': 1927, 'l2_leaf_reg': 1.1801114850135812e-08, 'border_count': 8, 'bagging_temperature': 0.04322361151973398, 'random_strength': 0.9360517636073158, 'grow_policy': 'Depthwise', 'min_data_in_leaf': 367}. Best is trial 306 with value: 170.64979827273262.[0m
[32m[I 2024-10-13 11:43:13,081][0m Trial 497 finished with value: 229.64320713090558 and parameters: {'depth': 5, 'learning_rate': 0.030260981798250153, 'iterations': 1858, 'l2_leaf_reg': 1.1994928772926831e-06, 'border_count': 21, 'bagging_temperature': 0.0163694576127199, 'random_strength': 0.8174137155446923, 'grow_policy': 'Depthwise', 'min_data_in_leaf': 682}. Best is trial 306 with value: 170.64979827273262.[0m
[32m[I 2024-10-13 11:43:19,738][0m Trial 498 finished with value: 210.86994033596332 and parameters: {'depth': 6, 'learning_rate': 0.026604921879132052, 'iterations': 1744, 'l2_leaf_reg': 0.004484416891878338, 'border_count': 13, 'bagging_temperature': 0.03487150047804557, 'random_strength': 0.5883959446613585, 'grow_policy': 'SymmetricTree', 'min_data_in_leaf': 660}. Best is trial 306 with value: 170.64979827273262.[0m
[32m[I 2024-10-13 11:43:21,544][0m Trial 499 finished with value: 173.97286514353468 and parameters: {'depth': 5, 'learning_rate': 0.022342236891931645, 'iterations': 1672, 'l2_leaf_reg': 0.007715262814419943, 'border_count': 6, 'bagging_temperature': 0.057533047723646896, 'random_strength': 0.7528533479707844, 'grow_policy': 'Depthwise', 'min_data_in_leaf': 645}. Best is trial 306 with value: 170.64979827273262.[0m
[32m[I 2024-10-13 11:43:23,364][0m Trial 500 finished with value: 254.12682614388007 and parameters: {'depth': 5, 'learning_rate': 0.020681110688594455, 'iterations': 1721, 'l2_leaf_reg': 0.0014661374314585693, 'border_count': 1, 'bagging_temperature': 0.01692715774670763, 'random_strength': 1.239913529824293, 'grow_policy': 'Depthwise', 'min_data_in_leaf': 741}. Best is trial 306 with value: 170.64979827273262.[0m
[32m[I 2024-10-13 11:43:25,098][0m Trial 501 finished with value: 202.48608617104713 and parameters: {'depth': 5, 'learning_rate': 0.017937064862787306, 'iterations': 1633, 'l2_leaf_reg': 0.0003159287592265787, 'border_count': 10, 'bagging_temperature': 0.00040067639725407944, 'random_strength': 0.2269477617117664, 'grow_policy': 'Depthwise', 'min_data_in_leaf': 594}. Best is trial 306 with value: 170.64979827273262.[0m
[32m[I 2024-10-13 11:43:27,001][0m Trial 502 finished with value: 204.1693119326899 and parameters: {'depth': 6, 'learning_rate': 0.024195198060806174, 'iterations': 1781, 'l2_leaf_reg': 2.8620282115418044e-06, 'border_count': 16, 'bagging_temperature': 0.7253551335763853, 'random_strength': 0.4986671464876215, 'grow_policy': 'Depthwise', 'min_data_in_leaf': 698}. Best is trial 306 with value: 170.64979827273262.[0m
[32m[I 2024-10-13 11:43:29,029][0m Trial 503 finished with value: 229.27677854274953 and parameters: {'depth': 5, 'learning_rate': 0.04710214480595221, 'iterations': 1885, 'l2_leaf_reg': 0.0010257842636744287, 'border_count': 25, 'bagging_temperature': 0.0389940345931019, 'random_strength': 0.7760944239188535, 'grow_policy': 'Depthwise', 'min_data_in_leaf': 625}. Best is trial 306 with value: 170.64979827273262.[0m
[32m[I 2024-10-13 11:43:30,802][0m Trial 504 finished with value: 175.3617328738582 and parameters: {'depth': 5, 'learning_rate': 0.03096027994210612, 'iterations': 1686, 'l2_leaf_reg': 7.772551731697732e-07, 'border_count': 6, 'bagging_temperature': 0.06493988201257711, 'random_strength': 0.5985952779046743, 'grow_policy': 'Depthwise', 'min_data_in_leaf': 671}. Best is trial 306 with value: 170.64979827273262.[0m
[32m[I 2024-10-13 11:43:32,522][0m Trial 505 finished with value: 206.23358758284553 and parameters: {'depth': 3, 'learning_rate': 0.020353259356611437, 'iterations': 1607, 'l2_leaf_reg': 7.1378836288556305e-06, 'border_count': 11, 'bagging_temperature': 0.04703267919025697, 'random_strength': 1.0773387302094717, 'grow_policy': 'Depthwise', 'min_data_in_leaf': 650}. Best is trial 306 with value: 170.64979827273262.[0m
[32m[I 2024-10-13 11:43:34,366][0m Trial 506 finished with value: 171.76833529170176 and parameters: {'depth': 5, 'learning_rate': 0.017373257994610623, 'iterations': 1743, 'l2_leaf_reg': 1.5260450247492088e-06, 'border_count': 5, 'bagging_temperature': 0.01782352109120016, 'random_strength': 0.31818096736396345, 'grow_policy': 'Depthwise', 'min_data_in_leaf': 610}. Best is trial 306 with value: 170.64979827273262.[0m
[32m[I 2024-10-13 11:43:36,159][0m Trial 507 finished with value: 253.73393108905466 and parameters: {'depth': 6, 'learning_rate': 0.01653169297123867, 'iterations': 1657, 'l2_leaf_reg': 2.7281437252590126e-07, 'border_count': 1, 'bagging_temperature': 0.013593856554843346, 'random_strength': 0.30923677641621383, 'grow_policy': 'Depthwise', 'min_data_in_leaf': 578}. Best is trial 306 with value: 170.64979827273262.[0m
[32m[I 2024-10-13 11:43:38,020][0m Trial 508 finished with value: 171.53051884832925 and parameters: {'depth': 3, 'learning_rate': 0.013759320412210748, 'iterations': 1806, 'l2_leaf_reg': 1.5541214417976883e-07, 'border_count': 5, 'bagging_temperature': 0.0012691194678002534, 'random_strength': 0.2965753877708561, 'grow_policy': 'Depthwise', 'min_data_in_leaf': 603}. Best is trial 306 with value: 170.64979827273262.[0m
[32m[I 2024-10-13 11:43:39,921][0m Trial 509 finished with value: 259.03096937174894 and parameters: {'depth': 3, 'learning_rate': 0.002076059960553332, 'iterations': 1820, 'l2_leaf_reg': 4.164382638683642e-07, 'border_count': 1, 'bagging_temperature': 0.0051301615996334, 'random_strength': 0.15455279842767938, 'grow_policy': 'Depthwise', 'min_data_in_leaf': 549}. Best is trial 306 with value: 170.64979827273262.[0m
[32m[I 2024-10-13 11:43:41,869][0m Trial 510 finished with value: 172.305255166279 and parameters: {'depth': 3, 'learning_rate': 0.011069763415492071, 'iterations': 1851, 'l2_leaf_reg': 1.6184161744666397e-07, 'border_count': 5, 'bagging_temperature': 0.016246353985687904, 'random_strength': 0.0003450818143794221, 'grow_policy': 'Depthwise', 'min_data_in_leaf': 600}. Best is trial 306 with value: 170.64979827273262.[0m
