[32m[I 2024-10-13 11:54:42,562][0m Trial 817 finished with value: 209.16582507665876 and parameters: {'depth': 3, 'learning_rate': 0.021211593778954756, 'iterations': 2224, 'l2_leaf_reg': 0.02308861580193555, 'border_count': 16, 'bagging_temperature': 0.25796979068739695, 'random_strength': 1.2833205308752467, 'grow_policy': 'Lossguide', 'min_data_in_leaf': 911, 'max_leaves': 166}. Best is trial 306 with value: 170.64979827273262.[0m
[32m[I 2024-10-13 11:54:44,536][0m Trial 818 finished with value: 174.4718193087243 and parameters: {'depth': 3, 'learning_rate': 0.025979329693588495, 'iterations': 2033, 'l2_leaf_reg': 8.633507553683888, 'border_count': 9, 'bagging_temperature': 0.014872946644970008, 'random_strength': 1.0328794991784571, 'grow_policy': 'Lossguide', 'min_data_in_leaf': 926, 'max_leaves': 54}. Best is trial 306 with value: 170.64979827273262.[0m
[32m[I 2024-10-13 11:54:46,801][0m Trial 819 finished with value: 173.90545838779315 and parameters: {'depth': 3, 'learning_rate': 0.019549787246536537, 'iterations': 2321, 'l2_leaf_reg': 1.0318695538840021, 'border_count': 6, 'bagging_temperature': 0.018115142044998363, 'random_strength': 1.512382837851849, 'grow_policy': 'Lossguide', 'min_data_in_leaf': 884, 'max_leaves': 139}. Best is trial 306 with value: 170.64979827273262.[0m
[32m[I 2024-10-13 11:54:48,957][0m Trial 820 finished with value: 250.1703075553744 and parameters: {'depth': 3, 'learning_rate': 0.02188562789794298, 'iterations': 2204, 'l2_leaf_reg': 1.7148416264338038, 'border_count': 169, 'bagging_temperature': 0.0005053215109440859, 'random_strength': 1.2461781063756348, 'grow_policy': 'Lossguide', 'min_data_in_leaf': 969, 'max_leaves': 190}. Best is trial 306 with value: 170.64979827273262.[0m
[32m[I 2024-10-13 11:54:51,049][0m Trial 821 finished with value: 207.84685892049822 and parameters: {'depth': 3, 'learning_rate': 0.024307350743074333, 'iterations': 2172, 'l2_leaf_reg': 9.930428806278798, 'border_count': 24, 'bagging_temperature': 0.0006585445289301051, 'random_strength': 1.0314804030506992, 'grow_policy': 'Lossguide', 'min_data_in_leaf': 913, 'max_leaves': 176}. Best is trial 306 with value: 170.64979827273262.[0m
[32m[I 2024-10-13 11:54:53,318][0m Trial 822 finished with value: 207.2678456833897 and parameters: {'depth': 3, 'learning_rate': 0.017766129378258357, 'iterations': 2411, 'l2_leaf_reg': 0.7239815783692874, 'border_count': 12, 'bagging_temperature': 0.03445579761380005, 'random_strength': 1.4694880638688748, 'grow_policy': 'Lossguide', 'min_data_in_leaf': 937, 'max_leaves': 148}. Best is trial 306 with value: 170.64979827273262.[0m
[32m[I 2024-10-13 11:54:55,518][0m Trial 823 finished with value: 171.38275077324545 and parameters: {'depth': 3, 'learning_rate': 0.016951558351433367, 'iterations': 2276, 'l2_leaf_reg': 2.5621362227576396, 'border_count': 5, 'bagging_temperature': 0.01923906287043881, 'random_strength': 1.6400124069496684, 'grow_policy': 'Lossguide', 'min_data_in_leaf': 894, 'max_leaves': 154}. Best is trial 306 with value: 170.64979827273262.[0m
[32m[I 2024-10-13 11:54:57,669][0m Trial 824 finished with value: 253.83385384516814 and parameters: {'depth': 3, 'learning_rate': 0.014995377510291978, 'iterations': 2236, 'l2_leaf_reg': 2.945529209849015, 'border_count': 1, 'bagging_temperature': 0.03328292928081116, 'random_strength': 1.661611233805393, 'grow_policy': 'Lossguide', 'min_data_in_leaf': 898, 'max_leaves': 153}. Best is trial 306 with value: 170.64979827273262.[0m
[32m[I 2024-10-13 11:54:59,837][0m Trial 825 finished with value: 202.69897507241123 and parameters: {'depth': 3, 'learning_rate': 0.01739406446305233, 'iterations': 2182, 'l2_leaf_reg': 1.8157343164716468, 'border_count': 18, 'bagging_temperature': 0.04609452728063587, 'random_strength': 1.7545563938026425, 'grow_policy': 'Lossguide', 'min_data_in_leaf': 929, 'max_leaves': 165}. Best is trial 306 with value: 170.64979827273262.[0m
[32m[I 2024-10-13 11:55:02,017][0m Trial 826 finished with value: 200.13669828053222 and parameters: {'depth': 3, 'learning_rate': 0.015835691903062343, 'iterations': 2310, 'l2_leaf_reg': 5.951656766011786, 'border_count': 10, 'bagging_temperature': 0.02058267426611003, 'random_strength': 1.5691620852049477, 'grow_policy': 'Lossguide', 'min_data_in_leaf': 896, 'max_leaves': 171}. Best is trial 306 with value: 170.64979827273262.[0m
[32m[I 2024-10-13 11:55:04,221][0m Trial 827 finished with value: 172.10231471996474 and parameters: {'depth': 3, 'learning_rate': 0.016807882917104812, 'iterations': 2261, 'l2_leaf_reg': 3.466043940611011, 'border_count': 6, 'bagging_temperature': 0.020412799875646467, 'random_strength': 1.7606796956839503, 'grow_policy': 'Lossguide', 'min_data_in_leaf': 893, 'max_leaves': 161}. Best is trial 306 with value: 170.64979827273262.[0m
[32m[I 2024-10-13 11:55:06,399][0m Trial 828 finished with value: 213.72394810094443 and parameters: {'depth': 3, 'learning_rate': 0.018869809226711443, 'iterations': 2182, 'l2_leaf_reg': 1.1013630970135924, 'border_count': 14, 'bagging_temperature': 0.04601305867721439, 'random_strength': 1.9224785012582037, 'grow_policy': 'Lossguide', 'min_data_in_leaf': 900, 'max_leaves': 184}. Best is trial 306 with value: 170.64979827273262.[0m
[32m[I 2024-10-13 11:55:08,634][0m Trial 829 finished with value: 182.8610389904208 and parameters: {'depth': 3, 'learning_rate': 0.014798612815840967, 'iterations': 2332, 'l2_leaf_reg': 2.431873322727831, 'border_count': 9, 'bagging_temperature': 0.29601341635040274, 'random_strength': 1.4848360136915943, 'grow_policy': 'Lossguide', 'min_data_in_leaf': 916, 'max_leaves': 142}. Best is trial 306 with value: 170.64979827273262.[0m
[32m[I 2024-10-13 11:55:10,918][0m Trial 830 finished with value: 171.0134294283177 and parameters: {'depth': 3, 'learning_rate': 0.016390027429712125, 'iterations': 2364, 'l2_leaf_reg': 3.797522921091222, 'border_count': 5, 'bagging_temperature': 0.020231799755555172, 'random_strength': 1.362809620506876, 'grow_policy': 'Lossguide', 'min_data_in_leaf': 948, 'max_leaves': 197}. Best is trial 306 with value: 170.64979827273262.[0m
[32m[I 2024-10-13 11:55:13,286][0m Trial 831 finished with value: 252.24073095898578 and parameters: {'depth': 3, 'learning_rate': 0.014550403234559391, 'iterations': 2485, 'l2_leaf_reg': 8.112855818463308, 'border_count': 1, 'bagging_temperature': 0.7085002049168987, 'random_strength': 1.5736998714631958, 'grow_policy': 'Lossguide', 'min_data_in_leaf': 963, 'max_leaves': 208}. Best is trial 306 with value: 170.64979827273262.[0m
[32m[I 2024-10-13 11:55:15,360][0m Trial 832 finished with value: 241.4929325004892 and parameters: {'depth': 3, 'learning_rate': 0.014548008675700087, 'iterations': 2118, 'l2_leaf_reg': 1.9115164652099954, 'border_count': 99, 'bagging_temperature': 0.056031978036500216, 'random_strength': 1.3434522990574307, 'grow_policy': 'Lossguide', 'min_data_in_leaf': 950, 'max_leaves': 203}. Best is trial 306 with value: 170.64979827273262.[0m
[32m[I 2024-10-13 11:55:17,629][0m Trial 833 finished with value: 198.75030716024838 and parameters: {'depth': 3, 'learning_rate': 0.016789524089562753, 'iterations': 2397, 'l2_leaf_reg': 5.052389789593411, 'border_count': 19, 'bagging_temperature': 0.033980713240510774, 'random_strength': 1.762259795861727, 'grow_policy': 'Lossguide', 'min_data_in_leaf': 956, 'max_leaves': 64}. Best is trial 306 with value: 170.64979827273262.[0m
[32m[I 2024-10-13 11:55:19,920][0m Trial 834 finished with value: 208.0725923978418 and parameters: {'depth': 3, 'learning_rate': 0.013760603782278901, 'iterations': 2294, 'l2_leaf_reg': 3.541469413859156, 'border_count': 13, 'bagging_temperature': 0.06281689630737297, 'random_strength': 1.4518287265915595, 'grow_policy': 'Lossguide', 'min_data_in_leaf': 949, 'max_leaves': 195}. Best is trial 306 with value: 170.64979827273262.[0m
[32m[I 2024-10-13 11:55:22,281][0m Trial 835 finished with value: 176.97662921079325 and parameters: {'depth': 3, 'learning_rate': 0.016874226522257858, 'iterations': 2371, 'l2_leaf_reg': 0.4894678989987199, 'border_count': 9, 'bagging_temperature': 0.03315689180925549, 'random_strength': 2.004736734320879, 'grow_policy': 'Lossguide', 'min_data_in_leaf': 923, 'max_leaves': 189}. Best is trial 306 with value: 170.64979827273262.[0m
[32m[I 2024-10-13 11:55:24,624][0m Trial 836 finished with value: 170.7091778261423 and parameters: {'depth': 3, 'learning_rate': 0.01445128901909558, 'iterations': 2292, 'l2_leaf_reg': 6.20315494247048, 'border_count': 5, 'bagging_temperature': 0.04636387830347609, 'random_strength': 2.2230110311532645, 'grow_policy': 'Lossguide', 'min_data_in_leaf': 865, 'max_leaves': 178}. Best is trial 306 with value: 170.64979827273262.[0m
[32m[I 2024-10-13 11:55:26,960][0m Trial 837 finished with value: 203.23563939489375 and parameters: {'depth': 3, 'learning_rate': 0.012897530572399729, 'iterations': 2326, 'l2_leaf_reg': 5.876160041672341, 'border_count': 15, 'bagging_temperature': 0.07574922123864883, 'random_strength': 2.1605432877524797, 'grow_policy': 'Lossguide', 'min_data_in_leaf': 979, 'max_leaves': 177}. Best is trial 306 with value: 170.64979827273262.[0m
[32m[I 2024-10-13 11:55:29,292][0m Trial 838 finished with value: 170.7256512617998 and parameters: {'depth': 3, 'learning_rate': 0.014276375567235525, 'iterations': 2335, 'l2_leaf_reg': 9.30743047032175, 'border_count': 5, 'bagging_temperature': 0.0481291975260683, 'random_strength': 1.926101266494547, 'grow_policy': 'Lossguide', 'min_data_in_leaf': 871, 'max_leaves': 170}. Best is trial 306 with value: 170.64979827273262.[0m
[32m[I 2024-10-13 11:55:31,762][0m Trial 839 finished with value: 226.55592164062904 and parameters: {'depth': 3, 'learning_rate': 0.013445084675831743, 'iterations': 2434, 'l2_leaf_reg': 7.36116374735235, 'border_count': 135, 'bagging_temperature': 0.09702491793877367, 'random_strength': 2.2157995945229216, 'grow_policy': 'Lossguide', 'min_data_in_leaf': 871, 'max_leaves': 169}. Best is trial 306 with value: 170.64979827273262.[0m
[32m[I 2024-10-13 11:55:34,070][0m Trial 840 finished with value: 253.82826604758677 and parameters: {'depth': 3, 'learning_rate': 0.014263793752587194, 'iterations': 2349, 'l2_leaf_reg': 4.121402847287807, 'border_count': 1, 'bagging_temperature': 0.0798005324840298, 'random_strength': 1.7537650883119826, 'grow_policy': 'Lossguide', 'min_data_in_leaf': 868, 'max_leaves': 198}. Best is trial 306 with value: 170.64979827273262.[0m
[32m[I 2024-10-13 11:55:36,580][0m Trial 841 finished with value: 201.6405190158555 and parameters: {'depth': 3, 'learning_rate': 0.013299717316406785, 'iterations': 2474, 'l2_leaf_reg': 7.065279382714088, 'border_count': 11, 'bagging_temperature': 0.06672605563492719, 'random_strength': 2.032170653887765, 'grow_policy': 'Lossguide', 'min_data_in_leaf': 932, 'max_leaves': 158}. Best is trial 306 with value: 170.64979827273262.[0m
[32m[I 2024-10-13 11:55:38,906][0m Trial 842 finished with value: 198.4379655596358 and parameters: {'depth': 3, 'learning_rate': 0.014755819113655684, 'iterations': 2382, 'l2_leaf_reg': 7.604579670443911, 'border_count': 10, 'bagging_temperature': 0.06330054478377622, 'random_strength': 2.4109290690060314, 'grow_policy': 'Lossguide', 'min_data_in_leaf': 877, 'max_leaves': 184}. Best is trial 306 with value: 170.64979827273262.[0m
[32m[I 2024-10-13 11:55:41,232][0m Trial 843 finished with value: 204.04692296997897 and parameters: {'depth': 3, 'learning_rate': 0.012371828825418209, 'iterations': 2294, 'l2_leaf_reg': 9.090195561432578, 'border_count': 23, 'bagging_temperature': 0.08832374402892637, 'random_strength': 1.754584743019158, 'grow_policy': 'Lossguide', 'min_data_in_leaf': 889, 'max_leaves': 193}. Best is trial 306 with value: 170.64979827273262.[0m
[32m[I 2024-10-13 11:55:43,569][0m Trial 844 finished with value: 171.00253498563555 and parameters: {'depth': 3, 'learning_rate': 0.016241928302154453, 'iterations': 2426, 'l2_leaf_reg': 4.833400574309537, 'border_count': 5, 'bagging_temperature': 0.05586630777138897, 'random_strength': 1.9271383917675662, 'grow_policy': 'Lossguide', 'min_data_in_leaf': 870, 'max_leaves': 172}. Best is trial 306 with value: 170.64979827273262.[0m
[32m[I 2024-10-13 11:55:45,961][0m Trial 845 finished with value: 202.81256908302538 and parameters: {'depth': 3, 'learning_rate': 0.017867610154598455, 'iterations': 2562, 'l2_leaf_reg': 4.099233045989331, 'border_count': 17, 'bagging_temperature': 0.08749579140116973, 'random_strength': 2.0551428359828257, 'grow_policy': 'Lossguide', 'min_data_in_leaf': 864, 'max_leaves': 180}. Best is trial 306 with value: 170.64979827273262.[0m
[32m[I 2024-10-13 11:55:48,250][0m Trial 846 finished with value: 224.76529972278922 and parameters: {'depth': 3, 'learning_rate': 0.01878089135928913, 'iterations': 2376, 'l2_leaf_reg': 5.164377659358458, 'border_count': 77, 'bagging_temperature': 0.17069557099643629, 'random_strength': 2.1331914439875037, 'grow_policy': 'Lossguide', 'min_data_in_leaf': 887, 'max_leaves': 155}. Best is trial 306 with value: 170.64979827273262.[0m
[32m[I 2024-10-13 11:55:50,654][0m Trial 847 finished with value: 211.87640157624506 and parameters: {'depth': 3, 'learning_rate': 0.016080278537480626, 'iterations': 2477, 'l2_leaf_reg': 4.475450394679629, 'border_count': 30, 'bagging_temperature': 0.10013689586878226, 'random_strength': 2.4358422562900373, 'grow_policy': 'Lossguide', 'min_data_in_leaf': 861, 'max_leaves': 172}. Best is trial 306 with value: 170.64979827273262.[0m
[32m[I 2024-10-13 11:55:52,905][0m Trial 848 finished with value: 172.3510677406086 and parameters: {'depth': 3, 'learning_rate': 0.01564899650769922, 'iterations': 2424, 'l2_leaf_reg': 5.581454783329959, 'border_count': 6, 'bagging_temperature': 0.06794565934674099, 'random_strength': 2.2190854421414654, 'grow_policy': 'Lossguide', 'min_data_in_leaf': 987, 'max_leaves': 163}. Best is trial 306 with value: 170.64979827273262.[0m
[32m[I 2024-10-13 11:55:55,183][0m Trial 849 finished with value: 254.55498033192592 and parameters: {'depth': 3, 'learning_rate': 0.019378588259576168, 'iterations': 2447, 'l2_leaf_reg': 3.0907971357143005, 'border_count': 1, 'bagging_temperature': 0.06759175058914374, 'random_strength': 1.8445308668906417, 'grow_policy': 'Lossguide', 'min_data_in_leaf': 895, 'max_leaves': 204}. Best is trial 306 with value: 170.64979827273262.[0m
[32m[I 2024-10-13 11:55:57,413][0m Trial 850 finished with value: 204.17962158040356 and parameters: {'depth': 3, 'learning_rate': 0.015232317524816416, 'iterations': 2320, 'l2_leaf_reg': 9.060872124644966, 'border_count': 14, 'bagging_temperature': 0.05203536343811656, 'random_strength': 2.7075844979756214, 'grow_policy': 'Lossguide', 'min_data_in_leaf': 873, 'max_leaves': 168}. Best is trial 306 with value: 170.64979827273262.[0m
[32m[I 2024-10-13 11:55:59,723][0m Trial 851 finished with value: 176.49861545709118 and parameters: {'depth': 3, 'learning_rate': 0.020305331683186253, 'iterations': 2368, 'l2_leaf_reg': 6.14094225631095, 'border_count': 9, 'bagging_temperature': 0.05370636662569291, 'random_strength': 1.6872845092349533, 'grow_policy': 'Lossguide', 'min_data_in_leaf': 923, 'max_leaves': 173}. Best is trial 306 with value: 170.64979827273262.[0m
[32m[I 2024-10-13 11:56:02,052][0m Trial 852 finished with value: 171.30556095737597 and parameters: {'depth': 3, 'learning_rate': 0.013714123893990368, 'iterations': 2368, 'l2_leaf_reg': 9.811034946419053, 'border_count': 5, 'bagging_temperature': 0.10873461026616942, 'random_strength': 1.9182723699450184, 'grow_policy': 'Lossguide', 'min_data_in_leaf': 957, 'max_leaves': 144}. Best is trial 306 with value: 170.64979827273262.[0m
[32m[I 2024-10-13 11:56:04,417][0m Trial 853 finished with value: 254.42158085469052 and parameters: {'depth': 3, 'learning_rate': 0.018170027189631486, 'iterations': 2530, 'l2_leaf_reg': 4.904335862643009, 'border_count': 1, 'bagging_temperature': 0.1098457113909635, 'random_strength': 2.0047142919055134, 'grow_policy': 'Lossguide', 'min_data_in_leaf': 945, 'max_leaves': 145}. Best is trial 306 with value: 170.64979827273262.[0m
[32m[I 2024-10-13 11:56:06,707][0m Trial 854 finished with value: 170.79218661787365 and parameters: {'depth': 3, 'learning_rate': 0.016300881500252738, 'iterations': 2403, 'l2_leaf_reg': 9.403118956278579, 'border_count': 5, 'bagging_temperature': 0.09164537043908083, 'random_strength': 1.921986372327134, 'grow_policy': 'Lossguide', 'min_data_in_leaf': 955, 'max_leaves': 147}. Best is trial 306 with value: 170.64979827273262.[0m
[32m[I 2024-10-13 11:56:08,952][0m Trial 855 finished with value: 173.07160637366167 and parameters: {'depth': 3, 'learning_rate': 0.02122691306240577, 'iterations': 2347, 'l2_leaf_reg': 8.715180047474027, 'border_count': 6, 'bagging_temperature': 0.15092666261878643, 'random_strength': 2.257195853790228, 'grow_policy': 'Lossguide', 'min_data_in_leaf': 962, 'max_leaves': 135}. Best is trial 306 with value: 170.64979827273262.[0m
[32m[I 2024-10-13 11:56:11,245][0m Trial 856 finished with value: 199.9397332313305 and parameters: {'depth': 3, 'learning_rate': 0.016647348891455454, 'iterations': 2454, 'l2_leaf_reg': 9.683184535751094, 'border_count': 12, 'bagging_temperature': 0.0935775641956709, 'random_strength': 2.3007304176457453, 'grow_policy': 'Lossguide', 'min_data_in_leaf': 998, 'max_leaves': 159}. Best is trial 306 with value: 170.64979827273262.[0m
[32m[I 2024-10-13 11:56:13,536][0m Trial 857 finished with value: 254.15821861165728 and parameters: {'depth': 3, 'learning_rate': 0.018548615271169428, 'iterations': 2413, 'l2_leaf_reg': 9.907084925982325, 'border_count': 1, 'bagging_temperature': 0.11714948381137213, 'random_strength': 2.6000413792348525, 'grow_policy': 'Lossguide', 'min_data_in_leaf': 964, 'max_leaves': 141}. Best is trial 306 with value: 170.64979827273262.[0m
[32m[I 2024-10-13 11:56:15,904][0m Trial 858 finished with value: 199.66150728875866 and parameters: {'depth': 3, 'learning_rate': 0.01589082735318901, 'iterations': 2374, 'l2_leaf_reg': 5.435376997067716, 'border_count': 18, 'bagging_temperature': 0.1360308349882876, 'random_strength': 2.343116154984875, 'grow_policy': 'Lossguide', 'min_data_in_leaf': 961, 'max_leaves': 146}. Best is trial 306 with value: 170.64979827273262.[0m
[32m[I 2024-10-13 11:56:18,137][0m Trial 859 finished with value: 182.02252452573592 and parameters: {'depth': 3, 'learning_rate': 0.057456267808986175, 'iterations': 2303, 'l2_leaf_reg': 3.112534473832173, 'border_count': 6, 'bagging_temperature': 0.10346474353198493, 'random_strength': 2.0794803854282993, 'grow_policy': 'Lossguide', 'min_data_in_leaf': 934, 'max_leaves': 154}. Best is trial 306 with value: 170.64979827273262.[0m
[32m[I 2024-10-13 11:56:20,304][0m Trial 860 finished with value: 207.88216887698658 and parameters: {'depth': 3, 'learning_rate': 0.02209602913608749, 'iterations': 2258, 'l2_leaf_reg': 2.0775466486704155, 'border_count': 11, 'bagging_temperature': 0.09020133204883962, 'random_strength': 1.936208562584271, 'grow_policy': 'Lossguide', 'min_data_in_leaf': 928, 'max_leaves': 165}. Best is trial 306 with value: 170.64979827273262.[0m
[32m[I 2024-10-13 11:56:22,544][0m Trial 861 finished with value: 171.39287660738142 and parameters: {'depth': 3, 'learning_rate': 0.018740529432796225, 'iterations': 2273, 'l2_leaf_reg': 5.967033479429564, 'border_count': 5, 'bagging_temperature': 0.11145644758276074, 'random_strength': 1.900766069467591, 'grow_policy': 'Lossguide', 'min_data_in_leaf': 977, 'max_leaves': 131}. Best is trial 306 with value: 170.64979827273262.[0m
[32m[I 2024-10-13 11:56:24,706][0m Trial 862 finished with value: 215.86519599265293 and parameters: {'depth': 3, 'learning_rate': 0.026611179508231733, 'iterations': 2282, 'l2_leaf_reg': 4.01822717915436, 'border_count': 14, 'bagging_temperature': 0.15360058834013068, 'random_strength': 1.9828098405471932, 'grow_policy': 'Lossguide', 'min_data_in_leaf': 979, 'max_leaves': 131}. Best is trial 306 with value: 170.64979827273262.[0m
[32m[I 2024-10-13 11:56:27,007][0m Trial 863 finished with value: 171.93947895229334 and parameters: {'depth': 3, 'learning_rate': 0.023306525757389025, 'iterations': 2365, 'l2_leaf_reg': 6.976140960781701, 'border_count': 5, 'bagging_temperature': 0.09804201367400009, 'random_strength': 2.200837779015766, 'grow_policy': 'Lossguide', 'min_data_in_leaf': 972, 'max_leaves': 48}. Best is trial 306 with value: 170.64979827273262.[0m
[32m[I 2024-10-13 11:56:29,333][0m Trial 864 finished with value: 178.23627179741538 and parameters: {'depth': 3, 'learning_rate': 0.02030308201403302, 'iterations': 2485, 'l2_leaf_reg': 5.924920053175323, 'border_count': 9, 'bagging_temperature': 0.1073370920517687, 'random_strength': 1.9247494922930182, 'grow_policy': 'Lossguide', 'min_data_in_leaf': 949, 'max_leaves': 151}. Best is trial 306 with value: 170.64979827273262.[0m
[32m[I 2024-10-13 11:56:31,541][0m Trial 865 finished with value: 197.0798104055581 and parameters: {'depth': 3, 'learning_rate': 0.018735107638146033, 'iterations': 2253, 'l2_leaf_reg': 9.728033868048872, 'border_count': 20, 'bagging_temperature': 0.09662364553610839, 'random_strength': 2.3903565705687333, 'grow_policy': 'Lossguide', 'min_data_in_leaf': 1000, 'max_leaves': 186}. Best is trial 306 with value: 170.64979827273262.[0m
[32m[I 2024-10-13 11:56:33,816][0m Trial 866 finished with value: 254.92954924759215 and parameters: {'depth': 3, 'learning_rate': 0.021755662516354767, 'iterations': 2392, 'l2_leaf_reg': 1.3883587588056938, 'border_count': 1, 'bagging_temperature': 0.08093517499649033, 'random_strength': 1.8945675409141192, 'grow_policy': 'Lossguide', 'min_data_in_leaf': 954, 'max_leaves': 179}. Best is trial 306 with value: 170.64979827273262.[0m
