[32m[I 2024-10-13 11:38:38,474][0m Trial 358 finished with value: 245.3204367699869 and parameters: {'depth': 6, 'learning_rate': 0.00939044806597714, 'iterations': 1527, 'l2_leaf_reg': 0.004481632532414254, 'border_count': 1, 'bagging_temperature': 0.07614722453818602, 'random_strength': 2.109033519265699, 'grow_policy': 'SymmetricTree', 'min_data_in_leaf': 663}. Best is trial 306 with value: 170.64979827273262.[0m
[32m[I 2024-10-13 11:38:40,067][0m Trial 359 finished with value: 269.03488996398204 and parameters: {'depth': 8, 'learning_rate': 0.26424596420504176, 'iterations': 1454, 'l2_leaf_reg': 0.0012807609670028868, 'border_count': 121, 'bagging_temperature': 0.04424847613602647, 'random_strength': 6.511762701181942, 'grow_policy': 'Lossguide', 'min_data_in_leaf': 624, 'max_leaves': 181}. Best is trial 306 with value: 170.64979827273262.[0m
[32m[I 2024-10-13 11:38:41,544][0m Trial 360 finished with value: 198.78408786577188 and parameters: {'depth': 4, 'learning_rate': 0.01514063504678684, 'iterations': 1313, 'l2_leaf_reg': 0.002685566870702337, 'border_count': 10, 'bagging_temperature': 0.09588310334633292, 'random_strength': 0.019792504095702212, 'grow_policy': 'Depthwise', 'min_data_in_leaf': 596}. Best is trial 306 with value: 170.64979827273262.[0m
[32m[I 2024-10-13 11:38:43,517][0m Trial 361 finished with value: 172.30688856613676 and parameters: {'depth': 5, 'learning_rate': 0.01982079490555351, 'iterations': 1803, 'l2_leaf_reg': 1.3169643173912256e-06, 'border_count': 5, 'bagging_temperature': 0.028692402187206884, 'random_strength': 0.6049634863022895, 'grow_policy': 'Depthwise', 'min_data_in_leaf': 651}. Best is trial 306 with value: 170.64979827273262.[0m
[32m[I 2024-10-13 11:38:45,449][0m Trial 362 finished with value: 171.8678056143846 and parameters: {'depth': 5, 'learning_rate': 0.02004538914361338, 'iterations': 1786, 'l2_leaf_reg': 1.4851858856347842e-06, 'border_count': 5, 'bagging_temperature': 0.00014841333941940232, 'random_strength': 0.6373732632042665, 'grow_policy': 'Depthwise', 'min_data_in_leaf': 647}. Best is trial 306 with value: 170.64979827273262.[0m
[32m[I 2024-10-13 11:38:47,369][0m Trial 363 finished with value: 253.48086940417477 and parameters: {'depth': 5, 'learning_rate': 0.02771752258162018, 'iterations': 1793, 'l2_leaf_reg': 1.357728987457183e-06, 'border_count': 135, 'bagging_temperature': 0.017823238597363823, 'random_strength': 0.642523222321995, 'grow_policy': 'Depthwise', 'min_data_in_leaf': 641}. Best is trial 306 with value: 170.64979827273262.[0m
[32m[I 2024-10-13 11:38:49,409][0m Trial 364 finished with value: 254.24761488988963 and parameters: {'depth': 5, 'learning_rate': 0.020315650846851083, 'iterations': 1849, 'l2_leaf_reg': 0.20845024038950605, 'border_count': 1, 'bagging_temperature': 0.003192335914893457, 'random_strength': 0.3842944488141818, 'grow_policy': 'Depthwise', 'min_data_in_leaf': 672}. Best is trial 306 with value: 170.64979827273262.[0m
[32m[I 2024-10-13 11:38:51,399][0m Trial 365 finished with value: 172.18423690570455 and parameters: {'depth': 5, 'learning_rate': 0.023045197170500475, 'iterations': 1712, 'l2_leaf_reg': 7.657922778653319e-07, 'border_count': 5, 'bagging_temperature': 0.001330519997543772, 'random_strength': 0.5499894294123873, 'grow_policy': 'Depthwise', 'min_data_in_leaf': 613}. Best is trial 306 with value: 170.64979827273262.[0m
[32m[I 2024-10-13 11:38:53,312][0m Trial 366 finished with value: 173.61710172473448 and parameters: {'depth': 5, 'learning_rate': 0.030250835546581173, 'iterations': 1742, 'l2_leaf_reg': 7.598094602223526e-07, 'border_count': 5, 'bagging_temperature': 0.01028006117899723, 'random_strength': 0.7531985486731858, 'grow_policy': 'Depthwise', 'min_data_in_leaf': 608}. Best is trial 306 with value: 170.64979827273262.[0m
[32m[I 2024-10-13 11:38:56,288][0m Trial 367 finished with value: 249.40282117279318 and parameters: {'depth': 5, 'learning_rate': 0.03872910435124151, 'iterations': 1786, 'l2_leaf_reg': 8.234715967282919e-07, 'border_count': 14, 'bagging_temperature': 0.0064531902654109755, 'random_strength': 0.570745829563709, 'grow_policy': 'Depthwise', 'min_data_in_leaf': 47}. Best is trial 306 with value: 170.64979827273262.[0m
[32m[I 2024-10-13 11:38:58,254][0m Trial 368 finished with value: 175.43761402143278 and parameters: {'depth': 5, 'learning_rate': 0.023994298954968317, 'iterations': 1750, 'l2_leaf_reg': 1.488577193114193e-06, 'border_count': 9, 'bagging_temperature': 0.0002243404671586624, 'random_strength': 0.8756522668850254, 'grow_policy': 'Depthwise', 'min_data_in_leaf': 567}. Best is trial 306 with value: 170.64979827273262.[0m
[32m[I 2024-10-13 11:39:00,117][0m Trial 369 finished with value: 172.04128340775873 and parameters: {'depth': 5, 'learning_rate': 0.024162935165043278, 'iterations': 1681, 'l2_leaf_reg': 1.0225281170219466e-06, 'border_count': 5, 'bagging_temperature': 0.02917857768503944, 'random_strength': 0.29672720047974066, 'grow_policy': 'Depthwise', 'min_data_in_leaf': 619}. Best is trial 306 with value: 170.64979827273262.[0m
[32m[I 2024-10-13 11:39:02,001][0m Trial 370 finished with value: 196.1789388121848 and parameters: {'depth': 5, 'learning_rate': 0.020925230641678436, 'iterations': 1706, 'l2_leaf_reg': 1.199674504140155e-06, 'border_count': 4, 'bagging_temperature': 0.025165834598108318, 'random_strength': 0.20032352950392043, 'grow_policy': 'Depthwise', 'min_data_in_leaf': 588}. Best is trial 306 with value: 170.64979827273262.[0m
[32m[I 2024-10-13 11:39:04,022][0m Trial 371 finished with value: 254.57854767593014 and parameters: {'depth': 5, 'learning_rate': 0.023436050719954974, 'iterations': 1829, 'l2_leaf_reg': 6.529887271206749e-07, 'border_count': 1, 'bagging_temperature': 0.028406497445658006, 'random_strength': 0.6375989629028083, 'grow_policy': 'Depthwise', 'min_data_in_leaf': 611}. Best is trial 306 with value: 170.64979827273262.[0m
[32m[I 2024-10-13 11:39:05,887][0m Trial 372 finished with value: 206.98289458882897 and parameters: {'depth': 5, 'learning_rate': 0.018596582019452225, 'iterations': 1759, 'l2_leaf_reg': 2.3211506996568477e-06, 'border_count': 11, 'bagging_temperature': 0.019986053273751133, 'random_strength': 0.3232581899619234, 'grow_policy': 'Depthwise', 'min_data_in_leaf': 620}. Best is trial 306 with value: 170.64979827273262.[0m
[32m[I 2024-10-13 11:39:07,744][0m Trial 373 finished with value: 175.3898164315835 and parameters: {'depth': 5, 'learning_rate': 0.03256891008180721, 'iterations': 1677, 'l2_leaf_reg': 1.1655624828156563e-06, 'border_count': 6, 'bagging_temperature': 0.0022191755814766757, 'random_strength': 0.9033353431814897, 'grow_policy': 'Depthwise', 'min_data_in_leaf': 580}. Best is trial 306 with value: 170.64979827273262.[0m
[32m[I 2024-10-13 11:39:09,748][0m Trial 374 finished with value: 214.46137657117262 and parameters: {'depth': 5, 'learning_rate': 0.02191053904072987, 'iterations': 1872, 'l2_leaf_reg': 5.107715108703712e-07, 'border_count': 15, 'bagging_temperature': 0.03223247328763962, 'random_strength': 0.5469651795109514, 'grow_policy': 'Depthwise', 'min_data_in_leaf': 688}. Best is trial 306 with value: 170.64979827273262.[0m
[32m[I 2024-10-13 11:39:11,588][0m Trial 375 finished with value: 254.7552070528395 and parameters: {'depth': 6, 'learning_rate': 0.025741483975713835, 'iterations': 1716, 'l2_leaf_reg': 1.9442432346032085e-06, 'border_count': 1, 'bagging_temperature': 0.031069114209735682, 'random_strength': 0.006481825206772485, 'grow_policy': 'Depthwise', 'min_data_in_leaf': 664}. Best is trial 306 with value: 170.64979827273262.[0m
[32m[I 2024-10-13 11:39:13,526][0m Trial 376 finished with value: 203.34977073727802 and parameters: {'depth': 5, 'learning_rate': 0.017814050015631248, 'iterations': 1801, 'l2_leaf_reg': 8.130049245044902e-07, 'border_count': 10, 'bagging_temperature': 0.002121303111609841, 'random_strength': 1.0737362156240189, 'grow_policy': 'Depthwise', 'min_data_in_leaf': 603}. Best is trial 306 with value: 170.64979827273262.[0m
[32m[I 2024-10-13 11:39:15,538][0m Trial 377 finished with value: 172.18718916150314 and parameters: {'depth': 6, 'learning_rate': 0.019019199042748056, 'iterations': 1659, 'l2_leaf_reg': 2.4914700318564545e-06, 'border_count': 5, 'bagging_temperature': 0.03528082427059502, 'random_strength': 0.7574788295511327, 'grow_policy': 'Depthwise', 'min_data_in_leaf': 647}. Best is trial 306 with value: 170.64979827273262.[0m
[32m[I 2024-10-13 11:39:17,450][0m Trial 378 finished with value: 200.40755403568994 and parameters: {'depth': 6, 'learning_rate': 0.016916622806933422, 'iterations': 1672, 'l2_leaf_reg': 3.124415546413944e-06, 'border_count': 20, 'bagging_temperature': 0.022531588248487014, 'random_strength': 0.8040627590789473, 'grow_policy': 'Depthwise', 'min_data_in_leaf': 847}. Best is trial 306 with value: 170.64979827273262.[0m
[32m[I 2024-10-13 11:39:19,272][0m Trial 379 finished with value: 212.1252293729016 and parameters: {'depth': 7, 'learning_rate': 0.01972745003564028, 'iterations': 1618, 'l2_leaf_reg': 2.5274765564090835e-06, 'border_count': 13, 'bagging_temperature': 0.03216631421935666, 'random_strength': 1.0521915154486212, 'grow_policy': 'Depthwise', 'min_data_in_leaf': 627}. Best is trial 306 with value: 170.64979827273262.[0m
[32m[I 2024-10-13 11:39:21,180][0m Trial 380 finished with value: 172.0702080425437 and parameters: {'depth': 6, 'learning_rate': 0.016602134992387753, 'iterations': 1742, 'l2_leaf_reg': 1.6494021529959746e-06, 'border_count': 5, 'bagging_temperature': 0.04173651482979244, 'random_strength': 0.7049304562080833, 'grow_policy': 'Depthwise', 'min_data_in_leaf': 556}. Best is trial 306 with value: 170.64979827273262.[0m
[32m[I 2024-10-13 11:39:23,158][0m Trial 381 finished with value: 253.82761204447962 and parameters: {'depth': 6, 'learning_rate': 0.016536411411623438, 'iterations': 1805, 'l2_leaf_reg': 3.615015738838115e-06, 'border_count': 208, 'bagging_temperature': 0.04541454652988523, 'random_strength': 0.7132904467051051, 'grow_policy': 'Depthwise', 'min_data_in_leaf': 546}. Best is trial 306 with value: 170.64979827273262.[0m
[32m[I 2024-10-13 11:39:25,020][0m Trial 382 finished with value: 172.4976956257774 and parameters: {'depth': 6, 'learning_rate': 0.01971687348748529, 'iterations': 1751, 'l2_leaf_reg': 1.1342066929546174e-06, 'border_count': 5, 'bagging_temperature': 0.04197092643816128, 'random_strength': 0.5163334795567428, 'grow_policy': 'Depthwise', 'min_data_in_leaf': 568}. Best is trial 306 with value: 170.64979827273262.[0m
[32m[I 2024-10-13 11:39:26,939][0m Trial 383 finished with value: 253.57848375982203 and parameters: {'depth': 6, 'learning_rate': 0.015490009386688203, 'iterations': 1760, 'l2_leaf_reg': 1.1421541087581303e-06, 'border_count': 1, 'bagging_temperature': 0.037259394409569394, 'random_strength': 0.4867044691342742, 'grow_policy': 'Depthwise', 'min_data_in_leaf': 532}. Best is trial 306 with value: 170.64979827273262.[0m
[32m[I 2024-10-13 11:39:28,887][0m Trial 384 finished with value: 250.3325528450764 and parameters: {'depth': 6, 'learning_rate': 0.01922915327005609, 'iterations': 1761, 'l2_leaf_reg': 1.7677398316649151e-06, 'border_count': 188, 'bagging_temperature': 0.04521697782649213, 'random_strength': 0.22817959375759989, 'grow_policy': 'Depthwise', 'min_data_in_leaf': 552}. Best is trial 306 with value: 170.64979827273262.[0m
[32m[I 2024-10-13 11:39:30,949][0m Trial 385 finished with value: 201.73840866510346 and parameters: {'depth': 6, 'learning_rate': 0.01404486696881134, 'iterations': 1902, 'l2_leaf_reg': 1.0118359798012374e-06, 'border_count': 10, 'bagging_temperature': 0.021360558263877616, 'random_strength': 3.469239602405553, 'grow_policy': 'Depthwise', 'min_data_in_leaf': 569}. Best is trial 306 with value: 170.64979827273262.[0m
[32m[I 2024-10-13 11:39:33,155][0m Trial 386 finished with value: 204.0554752286708 and parameters: {'depth': 6, 'learning_rate': 0.02161237326988949, 'iterations': 1846, 'l2_leaf_reg': 5.788317738048738e-06, 'border_count': 17, 'bagging_temperature': 0.6296809858272202, 'random_strength': 0.43886853138255333, 'grow_policy': 'Depthwise', 'min_data_in_leaf': 545}. Best is trial 306 with value: 170.64979827273262.[0m
[32m[I 2024-10-13 11:39:34,975][0m Trial 387 finished with value: 173.02795403137554 and parameters: {'depth': 6, 'learning_rate': 0.017169315868633975, 'iterations': 1719, 'l2_leaf_reg': 5.445910137063427e-07, 'border_count': 6, 'bagging_temperature': 0.04313397627123912, 'random_strength': 0.2063916083281821, 'grow_policy': 'Depthwise', 'min_data_in_leaf': 584}. Best is trial 306 with value: 170.64979827273262.[0m
[32m[I 2024-10-13 11:39:36,727][0m Trial 388 finished with value: 208.335306726449 and parameters: {'depth': 5, 'learning_rate': 0.027232736754117744, 'iterations': 1648, 'l2_leaf_reg': 1.4303468884505505e-06, 'border_count': 12, 'bagging_temperature': 0.022008974389235138, 'random_strength': 7.95182416945088, 'grow_policy': 'Depthwise', 'min_data_in_leaf': 517}. Best is trial 306 with value: 170.64979827273262.[0m
[32m[I 2024-10-13 11:39:38,537][0m Trial 389 finished with value: 176.07159810867114 and parameters: {'depth': 6, 'learning_rate': 0.019400382714373138, 'iterations': 1667, 'l2_leaf_reg': 4.38769979393731e-06, 'border_count': 6, 'bagging_temperature': 0.2566681332820453, 'random_strength': 0.8340504600949248, 'grow_policy': 'Depthwise', 'min_data_in_leaf': 561}. Best is trial 306 with value: 170.64979827273262.[0m
[32m[I 2024-10-13 11:39:40,499][0m Trial 390 finished with value: 254.5066116308678 and parameters: {'depth': 6, 'learning_rate': 0.023583671495514862, 'iterations': 1804, 'l2_leaf_reg': 2.5258267886996587e-06, 'border_count': 1, 'bagging_temperature': 0.05305857652782973, 'random_strength': 0.6209833843421158, 'grow_policy': 'Depthwise', 'min_data_in_leaf': 642}. Best is trial 306 with value: 170.64979827273262.[0m
[32m[I 2024-10-13 11:39:42,343][0m Trial 391 finished with value: 209.27234325815482 and parameters: {'depth': 7, 'learning_rate': 0.01338926483945453, 'iterations': 1746, 'l2_leaf_reg': 1.477416764281739e-05, 'border_count': 24, 'bagging_temperature': 0.03286587309433505, 'random_strength': 0.3606193841999018, 'grow_policy': 'Depthwise', 'min_data_in_leaf': 155}. Best is trial 306 with value: 170.64979827273262.[0m
[32m[I 2024-10-13 11:39:44,069][0m Trial 392 finished with value: 236.993096370291 and parameters: {'depth': 5, 'learning_rate': 0.01983673131037168, 'iterations': 1610, 'l2_leaf_reg': 8.865919917285263e-07, 'border_count': 65, 'bagging_temperature': 0.02192827186460166, 'random_strength': 0.9442723172316334, 'grow_policy': 'Depthwise', 'min_data_in_leaf': 563}. Best is trial 306 with value: 170.64979827273262.[0m
[32m[I 2024-10-13 11:39:50,208][0m Trial 393 finished with value: 213.84756895102643 and parameters: {'depth': 6, 'learning_rate': 0.016527506772270942, 'iterations': 1684, 'l2_leaf_reg': 1.8586625203813087e-06, 'border_count': 13, 'bagging_temperature': 0.053754866280030095, 'random_strength': 0.5559380484527043, 'grow_policy': 'SymmetricTree', 'min_data_in_leaf': 644}. Best is trial 306 with value: 170.64979827273262.[0m
[32m[I 2024-10-13 11:39:52,286][0m Trial 394 finished with value: 172.7719158084675 and parameters: {'depth': 5, 'learning_rate': 0.024616675508406946, 'iterations': 1937, 'l2_leaf_reg': 4.1695938014883144e-07, 'border_count': 8, 'bagging_temperature': 0.015650893372416853, 'random_strength': 0.7660587343965619, 'grow_policy': 'Depthwise', 'min_data_in_leaf': 576}. Best is trial 306 with value: 170.64979827273262.[0m
[32m[I 2024-10-13 11:39:54,196][0m Trial 395 finished with value: 213.1712656413152 and parameters: {'depth': 5, 'learning_rate': 0.03241234025481936, 'iterations': 1868, 'l2_leaf_reg': 6.757812638885125e-07, 'border_count': 16, 'bagging_temperature': 0.04186636409085354, 'random_strength': 0.14870364801395192, 'grow_policy': 'Depthwise', 'min_data_in_leaf': 689}. Best is trial 306 with value: 170.64979827273262.[0m
[32m[I 2024-10-13 11:39:55,972][0m Trial 396 finished with value: 192.01089559453695 and parameters: {'depth': 5, 'learning_rate': 0.15292017157631327, 'iterations': 1717, 'l2_leaf_reg': 1.1913397582866317e-06, 'border_count': 5, 'bagging_temperature': 0.06019062339832182, 'random_strength': 2.50179053715066, 'grow_policy': 'Depthwise', 'min_data_in_leaf': 894}. Best is trial 306 with value: 170.64979827273262.[0m
[32m[I 2024-10-13 11:39:57,708][0m Trial 397 finished with value: 200.9683992081671 and parameters: {'depth': 6, 'learning_rate': 0.015302473166693012, 'iterations': 1624, 'l2_leaf_reg': 1.6087000588908863e-06, 'border_count': 10, 'bagging_temperature': 0.017836988230637136, 'random_strength': 0.45141324331718885, 'grow_policy': 'Depthwise', 'min_data_in_leaf': 617}. Best is trial 306 with value: 170.64979827273262.[0m
[32m[I 2024-10-13 11:39:59,702][0m Trial 398 finished with value: 254.3508607712979 and parameters: {'depth': 5, 'learning_rate': 0.021716115548493065, 'iterations': 1791, 'l2_leaf_reg': 0.04925381094604496, 'border_count': 1, 'bagging_temperature': 0.0004077113508018925, 'random_strength': 0.6828069981264757, 'grow_policy': 'Depthwise', 'min_data_in_leaf': 655}. Best is trial 306 with value: 170.64979827273262.[0m
[32m[I 2024-10-13 11:40:01,452][0m Trial 399 finished with value: 304.3072686461767 and parameters: {'depth': 5, 'learning_rate': 0.0003377770621828741, 'iterations': 1586, 'l2_leaf_reg': 2.5146757894816466e-06, 'border_count': 19, 'bagging_temperature': 0.04940988670750135, 'random_strength': 0.932950562737646, 'grow_policy': 'Depthwise', 'min_data_in_leaf': 594}. Best is trial 306 with value: 170.64979827273262.[0m
[32m[I 2024-10-13 11:40:03,238][0m Trial 400 finished with value: 172.80244771925814 and parameters: {'depth': 5, 'learning_rate': 0.017931964832837217, 'iterations': 1658, 'l2_leaf_reg': 9.612341837532605e-07, 'border_count': 6, 'bagging_temperature': 0.03668718944410197, 'random_strength': 0.23018597397301033, 'grow_policy': 'Depthwise', 'min_data_in_leaf': 630}. Best is trial 306 with value: 170.64979827273262.[0m
[32m[I 2024-10-13 11:40:05,064][0m Trial 401 finished with value: 203.02263021789508 and parameters: {'depth': 6, 'learning_rate': 0.01289051205121806, 'iterations': 1721, 'l2_leaf_reg': 5.860859868607592e-07, 'border_count': 11, 'bagging_temperature': 0.06280793541031383, 'random_strength': 0.5126841000965595, 'grow_policy': 'Depthwise', 'min_data_in_leaf': 530}. Best is trial 306 with value: 170.64979827273262.[0m
[32m[I 2024-10-13 11:40:06,985][0m Trial 402 finished with value: 173.411583038601 and parameters: {'depth': 7, 'learning_rate': 0.028265315935171603, 'iterations': 1842, 'l2_leaf_reg': 9.858779758766213e-07, 'border_count': 5, 'bagging_temperature': 0.03601857832364659, 'random_strength': 1.0965000979141912, 'grow_policy': 'Depthwise', 'min_data_in_leaf': 661}. Best is trial 306 with value: 170.64979827273262.[0m
[32m[I 2024-10-13 11:40:08,895][0m Trial 403 finished with value: 229.80863279303443 and parameters: {'depth': 5, 'learning_rate': 0.01597280862926837, 'iterations': 1757, 'l2_leaf_reg': 1.7588402048081706e-06, 'border_count': 46, 'bagging_temperature': 0.06224203705848422, 'random_strength': 3.0961189672180702, 'grow_policy': 'Depthwise', 'min_data_in_leaf': 611}. Best is trial 306 with value: 170.64979827273262.[0m
[32m[I 2024-10-13 11:40:10,614][0m Trial 404 finished with value: 212.22620039269893 and parameters: {'depth': 6, 'learning_rate': 0.022256924442330288, 'iterations': 1573, 'l2_leaf_reg': 4.905025205775203e-08, 'border_count': 14, 'bagging_temperature': 0.016606988891705275, 'random_strength': 0.7851557068137034, 'grow_policy': 'Depthwise', 'min_data_in_leaf': 696}. Best is trial 306 with value: 170.64979827273262.[0m
[32m[I 2024-10-13 11:40:12,414][0m Trial 405 finished with value: 253.79500668949797 and parameters: {'depth': 7, 'learning_rate': 0.019087386036975355, 'iterations': 1667, 'l2_leaf_reg': 3.642166889558603e-07, 'border_count': 1, 'bagging_temperature': 0.03963562573700433, 'random_strength': 0.4012001040550721, 'grow_policy': 'Depthwise', 'min_data_in_leaf': 642}. Best is trial 306 with value: 170.64979827273262.[0m
[32m[I 2024-10-13 11:40:14,108][0m Trial 406 finished with value: 204.90946219006918 and parameters: {'depth': 5, 'learning_rate': 0.024943968322676317, 'iterations': 1614, 'l2_leaf_reg': 2.9214215284253167e-06, 'border_count': 10, 'bagging_temperature': 0.0007590889012270147, 'random_strength': 0.6326742700562854, 'grow_policy': 'Depthwise', 'min_data_in_leaf': 677}. Best is trial 306 with value: 170.64979827273262.[0m
[32m[I 2024-10-13 11:40:16,060][0m Trial 407 finished with value: 173.10356733094497 and parameters: {'depth': 6, 'learning_rate': 0.014992536091628069, 'iterations': 1704, 'l2_leaf_reg': 1.1590905582869217e-06, 'border_count': 6, 'bagging_temperature': 0.06622724498734728, 'random_strength': 0.008424646866974389, 'grow_policy': 'Depthwise', 'min_data_in_leaf': 625}. Best is trial 306 with value: 170.64979827273262.[0m
[32m[I 2024-10-13 11:40:17,980][0m Trial 408 finished with value: 216.02973318892273 and parameters: {'depth': 5, 'learning_rate': 0.020554152047395614, 'iterations': 1779, 'l2_leaf_reg': 0.12238123599132836, 'border_count': 29, 'bagging_temperature': 0.02429524357089953, 'random_strength': 0.8543707626686688, 'grow_policy': 'Depthwise', 'min_data_in_leaf': 582}. Best is trial 306 with value: 170.64979827273262.[0m
