[32m[I 2024-10-13 11:33:53,802][0m Trial 203 finished with value: 172.2974812123112 and parameters: {'depth': 3, 'learning_rate': 0.016411515148369055, 'iterations': 1575, 'l2_leaf_reg': 1.2422991668093128e-06, 'border_count': 5, 'bagging_temperature': 0.06805012300364566, 'random_strength': 0.5288227508585008, 'grow_policy': 'Depthwise', 'min_data_in_leaf': 661}. Best is trial 77 with value: 171.4904345158229.[0m
[32m[I 2024-10-13 11:33:55,468][0m Trial 204 finished with value: 253.49848312748637 and parameters: {'depth': 4, 'learning_rate': 0.016755661221162586, 'iterations': 1581, 'l2_leaf_reg': 1.3202043702792158e-06, 'border_count': 1, 'bagging_temperature': 0.06432499607158748, 'random_strength': 0.13526857484095545, 'grow_policy': 'Depthwise', 'min_data_in_leaf': 667}. Best is trial 77 with value: 171.4904345158229.[0m
[32m[I 2024-10-13 11:33:57,204][0m Trial 205 finished with value: 208.7155088323553 and parameters: {'depth': 14, 'learning_rate': 0.01554693469881723, 'iterations': 1528, 'l2_leaf_reg': 1.905529443232966e-06, 'border_count': 13, 'bagging_temperature': 0.035140129103912676, 'random_strength': 0.5408765249622666, 'grow_policy': 'Depthwise', 'min_data_in_leaf': 634}. Best is trial 77 with value: 171.4904345158229.[0m
[32m[I 2024-10-13 11:33:58,896][0m Trial 206 finished with value: 172.8728276499469 and parameters: {'depth': 3, 'learning_rate': 0.01362497291714358, 'iterations': 1601, 'l2_leaf_reg': 3.1322970336190335e-06, 'border_count': 5, 'bagging_temperature': 0.06874787226632832, 'random_strength': 0.3883710737596954, 'grow_policy': 'Depthwise', 'min_data_in_leaf': 654}. Best is trial 77 with value: 171.4904345158229.[0m
[32m[I 2024-10-13 11:34:00,633][0m Trial 207 finished with value: 253.79600563200643 and parameters: {'depth': 3, 'learning_rate': 0.010738891529187203, 'iterations': 1575, 'l2_leaf_reg': 4.095229074526777e-06, 'border_count': 1, 'bagging_temperature': 0.02532460702011491, 'random_strength': 0.33122882850161645, 'grow_policy': 'Depthwise', 'min_data_in_leaf': 700}. Best is trial 77 with value: 171.4904345158229.[0m
[32m[I 2024-10-13 11:34:02,300][0m Trial 208 finished with value: 193.04185348170233 and parameters: {'depth': 3, 'learning_rate': 0.013185101255533386, 'iterations': 1623, 'l2_leaf_reg': 2.354320135606118e-06, 'border_count': 12, 'bagging_temperature': 0.9438435574065408, 'random_strength': 0.69584050809988, 'grow_policy': 'Lossguide', 'min_data_in_leaf': 663, 'max_leaves': 133}. Best is trial 77 with value: 171.4904345158229.[0m
[32m[I 2024-10-13 11:34:03,962][0m Trial 209 finished with value: 172.63105008099882 and parameters: {'depth': 3, 'learning_rate': 0.014326155817095865, 'iterations': 1500, 'l2_leaf_reg': 0.002649629183145295, 'border_count': 5, 'bagging_temperature': 0.05816523824513979, 'random_strength': 0.49397718459524886, 'grow_policy': 'Depthwise', 'min_data_in_leaf': 637}. Best is trial 77 with value: 171.4904345158229.[0m
[32m[I 2024-10-13 11:34:05,592][0m Trial 210 finished with value: 180.93594221261964 and parameters: {'depth': 3, 'learning_rate': 0.011447935365135288, 'iterations': 1482, 'l2_leaf_reg': 8.15242646669996e-06, 'border_count': 9, 'bagging_temperature': 0.05063121253579571, 'random_strength': 0.4371653663549357, 'grow_policy': 'Depthwise', 'min_data_in_leaf': 635}. Best is trial 77 with value: 171.4904345158229.[0m
[32m[I 2024-10-13 11:34:07,220][0m Trial 211 finished with value: 172.75993969093773 and parameters: {'depth': 4, 'learning_rate': 0.014382670720425228, 'iterations': 1526, 'l2_leaf_reg': 0.0024285396274201015, 'border_count': 5, 'bagging_temperature': 0.08344181580008198, 'random_strength': 0.2340465729618051, 'grow_policy': 'Depthwise', 'min_data_in_leaf': 616}. Best is trial 77 with value: 171.4904345158229.[0m
[32m[I 2024-10-13 11:34:08,887][0m Trial 212 finished with value: 172.77981186769796 and parameters: {'depth': 3, 'learning_rate': 0.014050176522809585, 'iterations': 1570, 'l2_leaf_reg': 0.0022647032481461285, 'border_count': 5, 'bagging_temperature': 0.07794930032041993, 'random_strength': 0.20554615808857768, 'grow_policy': 'Depthwise', 'min_data_in_leaf': 619}. Best is trial 77 with value: 171.4904345158229.[0m
[32m[I 2024-10-13 11:34:10,588][0m Trial 213 finished with value: 253.3641973746092 and parameters: {'depth': 3, 'learning_rate': 0.013407944972607545, 'iterations': 1570, 'l2_leaf_reg': 0.002509190955193224, 'border_count': 1, 'bagging_temperature': 0.07936403902643707, 'random_strength': 0.21260274458639267, 'grow_policy': 'Depthwise', 'min_data_in_leaf': 621}. Best is trial 77 with value: 171.4904345158229.[0m
[32m[I 2024-10-13 11:34:12,276][0m Trial 214 finished with value: 203.64629090140278 and parameters: {'depth': 3, 'learning_rate': 0.00934446184587477, 'iterations': 1515, 'l2_leaf_reg': 0.0017187866617016147, 'border_count': 14, 'bagging_temperature': 0.08824770072357686, 'random_strength': 0.019187429500469977, 'grow_policy': 'Depthwise', 'min_data_in_leaf': 611}. Best is trial 77 with value: 171.4904345158229.[0m
[32m[I 2024-10-13 11:34:14,036][0m Trial 215 finished with value: 180.21155337972573 and parameters: {'depth': 4, 'learning_rate': 0.016609132112589787, 'iterations': 1624, 'l2_leaf_reg': 0.01068769356042398, 'border_count': 9, 'bagging_temperature': 0.06001757067804968, 'random_strength': 0.511809612411457, 'grow_policy': 'Depthwise', 'min_data_in_leaf': 631}. Best is trial 77 with value: 171.4904345158229.[0m
[32m[I 2024-10-13 11:34:15,700][0m Trial 216 finished with value: 172.81539242727962 and parameters: {'depth': 3, 'learning_rate': 0.013227094772174685, 'iterations': 1543, 'l2_leaf_reg': 0.002946115444070194, 'border_count': 6, 'bagging_temperature': 0.0024678371159128493, 'random_strength': 0.29844772566265426, 'grow_policy': 'Depthwise', 'min_data_in_leaf': 659}. Best is trial 77 with value: 171.4904345158229.[0m
[32m[I 2024-10-13 11:34:17,444][0m Trial 217 finished with value: 232.9414836729704 and parameters: {'depth': 3, 'learning_rate': 0.013859814014881372, 'iterations': 1683, 'l2_leaf_reg': 0.0021540195362886685, 'border_count': 70, 'bagging_temperature': 0.06711410846547199, 'random_strength': 0.27606398324425374, 'grow_policy': 'Depthwise', 'min_data_in_leaf': 663}. Best is trial 77 with value: 171.4904345158229.[0m
[32m[I 2024-10-13 11:34:19,110][0m Trial 218 finished with value: 253.5669765106177 and parameters: {'depth': 3, 'learning_rate': 0.018386715751774953, 'iterations': 1540, 'l2_leaf_reg': 0.002829638593212293, 'border_count': 240, 'bagging_temperature': 0.09560674612345742, 'random_strength': 0.6739495754128902, 'grow_policy': 'Depthwise', 'min_data_in_leaf': 688}. Best is trial 77 with value: 171.4904345158229.[0m
[32m[I 2024-10-13 11:34:20,829][0m Trial 219 finished with value: 199.71199988589234 and parameters: {'depth': 3, 'learning_rate': 0.015140390939561658, 'iterations': 1601, 'l2_leaf_reg': 0.000510167081428989, 'border_count': 16, 'bagging_temperature': 0.003142488383734837, 'random_strength': 0.3631551936409836, 'grow_policy': 'Depthwise', 'min_data_in_leaf': 652}. Best is trial 77 with value: 171.4904345158229.[0m
[32m[I 2024-10-13 11:34:22,462][0m Trial 220 finished with value: 172.06123956227495 and parameters: {'depth': 4, 'learning_rate': 0.01914311843165643, 'iterations': 1495, 'l2_leaf_reg': 0.0008878902281441365, 'border_count': 5, 'bagging_temperature': 0.036262225465978876, 'random_strength': 0.10722235772359295, 'grow_policy': 'Depthwise', 'min_data_in_leaf': 676}. Best is trial 77 with value: 171.4904345158229.[0m
[32m[I 2024-10-13 11:34:24,155][0m Trial 221 finished with value: 171.90713527088693 and parameters: {'depth': 4, 'learning_rate': 0.020136082361769954, 'iterations': 1514, 'l2_leaf_reg': 0.001383361794460388, 'border_count': 5, 'bagging_temperature': 0.039924485145249586, 'random_strength': 0.1271823184969167, 'grow_policy': 'Depthwise', 'min_data_in_leaf': 675}. Best is trial 77 with value: 171.4904345158229.[0m
[32m[I 2024-10-13 11:34:25,849][0m Trial 222 finished with value: 201.95754591189743 and parameters: {'depth': 4, 'learning_rate': 0.01792377673204628, 'iterations': 1518, 'l2_leaf_reg': 0.0034732119679963982, 'border_count': 10, 'bagging_temperature': 0.03965039165699348, 'random_strength': 0.053118535064854255, 'grow_policy': 'Depthwise', 'min_data_in_leaf': 703}. Best is trial 77 with value: 171.4904345158229.[0m
[32m[I 2024-10-13 11:34:27,541][0m Trial 223 finished with value: 253.62432851149075 and parameters: {'depth': 4, 'learning_rate': 0.01440313502155969, 'iterations': 1473, 'l2_leaf_reg': 0.0008898460948420391, 'border_count': 1, 'bagging_temperature': 0.021638660274120966, 'random_strength': 0.16279319454279212, 'grow_policy': 'Depthwise', 'min_data_in_leaf': 679}. Best is trial 77 with value: 171.4904345158229.[0m
[32m[I 2024-10-13 11:34:29,226][0m Trial 224 finished with value: 172.97840499923757 and parameters: {'depth': 4, 'learning_rate': 0.012410014011845319, 'iterations': 1575, 'l2_leaf_reg': 0.0013263414173490967, 'border_count': 5, 'bagging_temperature': 0.04932528276713596, 'random_strength': 0.4257015599037169, 'grow_policy': 'Depthwise', 'min_data_in_leaf': 722}. Best is trial 77 with value: 171.4904345158229.[0m
[32m[I 2024-10-13 11:34:30,903][0m Trial 225 finished with value: 172.1476289530892 and parameters: {'depth': 4, 'learning_rate': 0.018508935122450998, 'iterations': 1580, 'l2_leaf_reg': 0.0011176358131339363, 'border_count': 5, 'bagging_temperature': 0.04867036264625048, 'random_strength': 0.38599612539528166, 'grow_policy': 'Depthwise', 'min_data_in_leaf': 740}. Best is trial 77 with value: 171.4904345158229.[0m
[32m[I 2024-10-13 11:34:32,621][0m Trial 226 finished with value: 196.1325771844798 and parameters: {'depth': 4, 'learning_rate': 0.01721091266666194, 'iterations': 1673, 'l2_leaf_reg': 0.0012035827124984293, 'border_count': 4, 'bagging_temperature': 0.03889419167933355, 'random_strength': 0.4094142412419739, 'grow_policy': 'Depthwise', 'min_data_in_leaf': 724}. Best is trial 77 with value: 171.4904345158229.[0m
[32m[I 2024-10-13 11:34:34,287][0m Trial 227 finished with value: 206.7848002537215 and parameters: {'depth': 4, 'learning_rate': 0.01295144498833353, 'iterations': 1587, 'l2_leaf_reg': 0.0044068892709915874, 'border_count': 13, 'bagging_temperature': 0.0023320929549776595, 'random_strength': 0.21589255243725758, 'grow_policy': 'Depthwise', 'min_data_in_leaf': 749}. Best is trial 77 with value: 171.4904345158229.[0m
[32m[I 2024-10-13 11:34:36,072][0m Trial 228 finished with value: 253.80131167756693 and parameters: {'depth': 5, 'learning_rate': 0.019237471251166163, 'iterations': 1636, 'l2_leaf_reg': 0.0013388838112322564, 'border_count': 1, 'bagging_temperature': 0.05443561749811331, 'random_strength': 0.42704355228430935, 'grow_policy': 'Depthwise', 'min_data_in_leaf': 767}. Best is trial 77 with value: 171.4904345158229.[0m
[32m[I 2024-10-13 11:34:37,789][0m Trial 229 finished with value: 203.9450346851297 and parameters: {'depth': 3, 'learning_rate': 0.01521609593218765, 'iterations': 1557, 'l2_leaf_reg': 0.0004857374680236722, 'border_count': 11, 'bagging_temperature': 0.023687401372064508, 'random_strength': 0.004282562283500518, 'grow_policy': 'Depthwise', 'min_data_in_leaf': 729}. Best is trial 77 with value: 171.4904345158229.[0m
[32m[I 2024-10-13 11:34:39,448][0m Trial 230 finished with value: 173.73364297039214 and parameters: {'depth': 4, 'learning_rate': 0.010265438996635476, 'iterations': 1534, 'l2_leaf_reg': 0.0017431154467460158, 'border_count': 5, 'bagging_temperature': 0.0473588541502931, 'random_strength': 0.7749071216883792, 'grow_policy': 'Depthwise', 'min_data_in_leaf': 712}. Best is trial 77 with value: 171.4904345158229.[0m
[32m[I 2024-10-13 11:34:41,092][0m Trial 231 finished with value: 174.19153998750318 and parameters: {'depth': 4, 'learning_rate': 0.02284250270696114, 'iterations': 1476, 'l2_leaf_reg': 0.004377238642797056, 'border_count': 6, 'bagging_temperature': 0.07356435933459636, 'random_strength': 0.5088566998367784, 'grow_policy': 'Depthwise', 'min_data_in_leaf': 687}. Best is trial 77 with value: 171.4904345158229.[0m
[32m[I 2024-10-13 11:34:42,751][0m Trial 232 finished with value: 179.6730270340256 and parameters: {'depth': 3, 'learning_rate': 0.019547776963159822, 'iterations': 1586, 'l2_leaf_reg': 0.00029483959055393423, 'border_count': 9, 'bagging_temperature': 0.060966811182204456, 'random_strength': 0.24501917531457584, 'grow_policy': 'Depthwise', 'min_data_in_leaf': 819}. Best is trial 77 with value: 171.4904345158229.[0m
[32m[I 2024-10-13 11:34:44,345][0m Trial 233 finished with value: 206.1852037587607 and parameters: {'depth': 5, 'learning_rate': 0.01643561301404953, 'iterations': 1493, 'l2_leaf_reg': 0.0008008803821028222, 'border_count': 15, 'bagging_temperature': 0.035508298501841506, 'random_strength': 0.5978051657864099, 'grow_policy': 'Depthwise', 'min_data_in_leaf': 666}. Best is trial 77 with value: 171.4904345158229.[0m
[32m[I 2024-10-13 11:34:46,137][0m Trial 234 finished with value: 172.74973997559172 and parameters: {'depth': 3, 'learning_rate': 0.022747442504462298, 'iterations': 1703, 'l2_leaf_reg': 0.0013919503863446582, 'border_count': 5, 'bagging_temperature': 0.08474801120677788, 'random_strength': 0.3822706548774085, 'grow_policy': 'Depthwise', 'min_data_in_leaf': 702}. Best is trial 77 with value: 171.4904345158229.[0m
[32m[I 2024-10-13 11:34:47,957][0m Trial 235 finished with value: 253.36924823908038 and parameters: {'depth': 3, 'learning_rate': 0.012488619437900266, 'iterations': 1759, 'l2_leaf_reg': 0.0011904570917715281, 'border_count': 1, 'bagging_temperature': 0.08301056579683855, 'random_strength': 0.3353583232278694, 'grow_policy': 'Depthwise', 'min_data_in_leaf': 738}. Best is trial 77 with value: 171.4904345158229.[0m
[32m[I 2024-10-13 11:34:49,723][0m Trial 236 finished with value: 205.00353683178258 and parameters: {'depth': 3, 'learning_rate': 0.02627007775976373, 'iterations': 1673, 'l2_leaf_reg': 0.0017409443010051773, 'border_count': 10, 'bagging_temperature': 0.0186969891305041, 'random_strength': 0.7430081413399482, 'grow_policy': 'Depthwise', 'min_data_in_leaf': 681}. Best is trial 77 with value: 171.4904345158229.[0m
[32m[I 2024-10-13 11:34:51,448][0m Trial 237 finished with value: 253.88981290254677 and parameters: {'depth': 4, 'learning_rate': 0.014574797484510928, 'iterations': 1618, 'l2_leaf_reg': 0.0006442279930159652, 'border_count': 144, 'bagging_temperature': 0.054281120701499666, 'random_strength': 0.15647624699647472, 'grow_policy': 'Depthwise', 'min_data_in_leaf': 713}. Best is trial 77 with value: 171.4904345158229.[0m
[32m[I 2024-10-13 11:34:53,258][0m Trial 238 finished with value: 172.38955468646955 and parameters: {'depth': 4, 'learning_rate': 0.01966421337788169, 'iterations': 1686, 'l2_leaf_reg': 0.002856328276043981, 'border_count': 5, 'bagging_temperature': 0.07019588869188767, 'random_strength': 0.550575336783909, 'grow_policy': 'Depthwise', 'min_data_in_leaf': 698}. Best is trial 77 with value: 171.4904345158229.[0m
[32m[I 2024-10-13 11:34:55,052][0m Trial 239 finished with value: 204.02550234794504 and parameters: {'depth': 3, 'learning_rate': 0.022497936333462875, 'iterations': 1715, 'l2_leaf_reg': 0.003269973656587792, 'border_count': 19, 'bagging_temperature': 0.03459919197805805, 'random_strength': 0.47885487387007875, 'grow_policy': 'Depthwise', 'min_data_in_leaf': 706}. Best is trial 77 with value: 171.4904345158229.[0m
[32m[I 2024-10-13 11:34:56,763][0m Trial 240 finished with value: 172.70882931599036 and parameters: {'depth': 4, 'learning_rate': 0.019554835151402612, 'iterations': 1652, 'l2_leaf_reg': 0.00014708174519376563, 'border_count': 5, 'bagging_temperature': 0.09053282525419863, 'random_strength': 0.75796128953006, 'grow_policy': 'Depthwise', 'min_data_in_leaf': 732}. Best is trial 77 with value: 171.4904345158229.[0m
[32m[I 2024-10-13 11:34:58,528][0m Trial 241 finished with value: 172.78260333332395 and parameters: {'depth': 4, 'learning_rate': 0.019127174303497422, 'iterations': 1659, 'l2_leaf_reg': 0.00017262238383731928, 'border_count': 5, 'bagging_temperature': 0.08744548579181093, 'random_strength': 0.8065363208567171, 'grow_policy': 'Depthwise', 'min_data_in_leaf': 783}. Best is trial 77 with value: 171.4904345158229.[0m
[32m[I 2024-10-13 11:35:00,372][0m Trial 242 finished with value: 172.982681239405 and parameters: {'depth': 4, 'learning_rate': 0.018099177320156864, 'iterations': 1815, 'l2_leaf_reg': 0.001852777869366864, 'border_count': 5, 'bagging_temperature': 0.09088458281635872, 'random_strength': 0.8495821213775163, 'grow_policy': 'Depthwise', 'min_data_in_leaf': 760}. Best is trial 77 with value: 171.4904345158229.[0m
[32m[I 2024-10-13 11:35:02,156][0m Trial 243 finished with value: 206.0888644873983 and parameters: {'depth': 5, 'learning_rate': 0.019968114249301658, 'iterations': 1685, 'l2_leaf_reg': 0.00015678769662554553, 'border_count': 11, 'bagging_temperature': 0.06782705617638696, 'random_strength': 0.6141934445768964, 'grow_policy': 'Depthwise', 'min_data_in_leaf': 783}. Best is trial 77 with value: 171.4904345158229.[0m
[32m[I 2024-10-13 11:35:04,023][0m Trial 244 finished with value: 253.71308023753758 and parameters: {'depth': 4, 'learning_rate': 0.01725836990112903, 'iterations': 1765, 'l2_leaf_reg': 0.0012868484195063543, 'border_count': 1, 'bagging_temperature': 0.05022627635471803, 'random_strength': 0.38570715409585266, 'grow_policy': 'Depthwise', 'min_data_in_leaf': 727}. Best is trial 77 with value: 171.4904345158229.[0m
[32m[I 2024-10-13 11:35:05,765][0m Trial 245 finished with value: 180.89334955559596 and parameters: {'depth': 4, 'learning_rate': 0.02041143871213385, 'iterations': 1626, 'l2_leaf_reg': 0.0001598206265190538, 'border_count': 9, 'bagging_temperature': 0.09369221239352199, 'random_strength': 0.772724470009587, 'grow_policy': 'Depthwise', 'min_data_in_leaf': 805}. Best is trial 77 with value: 171.4904345158229.[0m
[32m[I 2024-10-13 11:35:07,441][0m Trial 246 finished with value: 173.37495593292164 and parameters: {'depth': 4, 'learning_rate': 0.016095101078512555, 'iterations': 1565, 'l2_leaf_reg': 0.00631769367810028, 'border_count': 6, 'bagging_temperature': 0.07464837618095767, 'random_strength': 0.5837331125883994, 'grow_policy': 'Depthwise', 'min_data_in_leaf': 695}. Best is trial 77 with value: 171.4904345158229.[0m
[32m[I 2024-10-13 11:35:09,203][0m Trial 247 finished with value: 207.9644118258772 and parameters: {'depth': 4, 'learning_rate': 0.013276427419427483, 'iterations': 1662, 'l2_leaf_reg': 0.0027359280113919728, 'border_count': 14, 'bagging_temperature': 0.05125893888634413, 'random_strength': 0.25018462319421286, 'grow_policy': 'Depthwise', 'min_data_in_leaf': 743}. Best is trial 77 with value: 171.4904345158229.[0m
[32m[I 2024-10-13 11:35:11,053][0m Trial 248 finished with value: 187.20131690225722 and parameters: {'depth': 3, 'learning_rate': 0.019472771505491024, 'iterations': 1708, 'l2_leaf_reg': 0.0004102678603762036, 'border_count': 9, 'bagging_temperature': 0.532306782555953, 'random_strength': 0.006342926101409407, 'grow_policy': 'Depthwise', 'min_data_in_leaf': 673}. Best is trial 77 with value: 171.4904345158229.[0m
[32m[I 2024-10-13 11:35:12,769][0m Trial 249 finished with value: 250.9181821130192 and parameters: {'depth': 5, 'learning_rate': 0.02349389841979367, 'iterations': 1593, 'l2_leaf_reg': 0.0010966537558964218, 'border_count': 186, 'bagging_temperature': 0.022855957428446483, 'random_strength': 0.8442586518874597, 'grow_policy': 'Depthwise', 'min_data_in_leaf': 711}. Best is trial 77 with value: 171.4904345158229.[0m
[32m[I 2024-10-13 11:35:14,420][0m Trial 250 finished with value: 253.44574900127054 and parameters: {'depth': 3, 'learning_rate': 0.015401265657094973, 'iterations': 1536, 'l2_leaf_reg': 0.0007925184999225091, 'border_count': 1, 'bagging_temperature': 0.08502364309267099, 'random_strength': 0.46272981276421465, 'grow_policy': 'Depthwise', 'min_data_in_leaf': 689}. Best is trial 77 with value: 171.4904345158229.[0m
[32m[I 2024-10-13 11:35:16,146][0m Trial 251 finished with value: 205.40531728318925 and parameters: {'depth': 4, 'learning_rate': 0.011593044563733598, 'iterations': 1641, 'l2_leaf_reg': 0.0063189804851638085, 'border_count': 14, 'bagging_temperature': 0.0010197770705310243, 'random_strength': 0.26312623166487087, 'grow_policy': 'Depthwise', 'min_data_in_leaf': 785}. Best is trial 77 with value: 171.4904345158229.[0m
[32m[I 2024-10-13 11:35:17,807][0m Trial 252 finished with value: 174.347312194613 and parameters: {'depth': 3, 'learning_rate': 0.02829035108020352, 'iterations': 1522, 'l2_leaf_reg': 0.0028491597007660728, 'border_count': 6, 'bagging_temperature': 0.06091523761333184, 'random_strength': 0.6094535075381532, 'grow_policy': 'Depthwise', 'min_data_in_leaf': 655}. Best is trial 77 with value: 171.4904345158229.[0m
[32m[I 2024-10-13 11:35:19,625][0m Trial 253 finished with value: 172.05306139138293 and parameters: {'depth': 4, 'learning_rate': 0.01828120637081756, 'iterations': 1782, 'l2_leaf_reg': 0.0002338189454602601, 'border_count': 5, 'bagging_temperature': 0.0378169326559049, 'random_strength': 0.9711242618887274, 'grow_policy': 'Depthwise', 'min_data_in_leaf': 743}. Best is trial 77 with value: 171.4904345158229.[0m
[32m[I 2024-10-13 11:35:21,450][0m Trial 254 finished with value: 253.76412821921124 and parameters: {'depth': 4, 'learning_rate': 0.018008315071578178, 'iterations': 1774, 'l2_leaf_reg': 0.0017927465805861972, 'border_count': 1, 'bagging_temperature': 0.03581020494386069, 'random_strength': 1.048939825199832, 'grow_policy': 'Depthwise', 'min_data_in_leaf': 762}. Best is trial 77 with value: 171.4904345158229.[0m
