[32m[I 2024-10-13 11:47:23,303][0m Trial 613 finished with value: 219.67995590658907 and parameters: {'depth': 4, 'learning_rate': 0.014293394965506977, 'iterations': 1661, 'l2_leaf_reg': 0.00042901637433953783, 'border_count': 5, 'bagging_temperature': 0.0009204815017616851, 'random_strength': 0.34345010233994916, 'grow_policy': 'Depthwise', 'min_data_in_leaf': 58}. Best is trial 306 with value: 170.64979827273262.[0m
[32m[I 2024-10-13 11:47:25,164][0m Trial 614 finished with value: 208.8549164400924 and parameters: {'depth': 4, 'learning_rate': 0.01204300265496147, 'iterations': 1757, 'l2_leaf_reg': 0.0008316827217845261, 'border_count': 24, 'bagging_temperature': 0.04856488557707927, 'random_strength': 7.894293640325364, 'grow_policy': 'Depthwise', 'min_data_in_leaf': 592}. Best is trial 306 with value: 170.64979827273262.[0m
[32m[I 2024-10-13 11:47:27,104][0m Trial 615 finished with value: 202.99188897084383 and parameters: {'depth': 3, 'learning_rate': 0.009938335741972523, 'iterations': 1845, 'l2_leaf_reg': 9.722585755433141e-05, 'border_count': 15, 'bagging_temperature': 0.0693590705848437, 'random_strength': 0.6205015769791268, 'grow_policy': 'Depthwise', 'min_data_in_leaf': 750}. Best is trial 306 with value: 170.64979827273262.[0m
[32m[I 2024-10-13 11:47:29,223][0m Trial 616 finished with value: 254.31270031533657 and parameters: {'depth': 5, 'learning_rate': 0.01867467478834397, 'iterations': 2095, 'l2_leaf_reg': 2.73464221496895e-07, 'border_count': 1, 'bagging_temperature': 0.03485475144988765, 'random_strength': 0.1667475294058135, 'grow_policy': 'Depthwise', 'min_data_in_leaf': 502}. Best is trial 306 with value: 170.64979827273262.[0m
[32m[I 2024-10-13 11:47:31,724][0m Trial 617 finished with value: 210.75834035953366 and parameters: {'depth': 5, 'learning_rate': 0.015390818611960297, 'iterations': 2535, 'l2_leaf_reg': 0.0013858885768852003, 'border_count': 35, 'bagging_temperature': 0.0192003327319875, 'random_strength': 0.42898128734995605, 'grow_policy': 'Depthwise', 'min_data_in_leaf': 613}. Best is trial 306 with value: 170.64979827273262.[0m
[32m[I 2024-10-13 11:47:33,457][0m Trial 618 finished with value: 177.6513671567507 and parameters: {'depth': 4, 'learning_rate': 0.031022399929090328, 'iterations': 1686, 'l2_leaf_reg': 5.916637217069254e-07, 'border_count': 9, 'bagging_temperature': 0.051640951903637586, 'random_strength': 2.813060627794195, 'grow_policy': 'Depthwise', 'min_data_in_leaf': 561}. Best is trial 306 with value: 170.64979827273262.[0m
[32m[I 2024-10-13 11:47:35,176][0m Trial 619 finished with value: 176.7565584503644 and parameters: {'depth': 4, 'learning_rate': 0.02327471082025072, 'iterations': 1589, 'l2_leaf_reg': 0.001830730026918376, 'border_count': 9, 'bagging_temperature': 0.018254347256557207, 'random_strength': 0.1486607174103291, 'grow_policy': 'Depthwise', 'min_data_in_leaf': 586}. Best is trial 306 with value: 170.64979827273262.[0m
[32m[I 2024-10-13 11:47:37,009][0m Trial 620 finished with value: 198.3497249826943 and parameters: {'depth': 3, 'learning_rate': 0.012851386338670834, 'iterations': 1783, 'l2_leaf_reg': 0.0003137714623735432, 'border_count': 19, 'bagging_temperature': 0.0002952247295177527, 'random_strength': 0.9225711570756251, 'grow_policy': 'Depthwise', 'min_data_in_leaf': 462}. Best is trial 306 with value: 170.64979827273262.[0m
[32m[I 2024-10-13 11:47:38,788][0m Trial 621 finished with value: 248.7246328478767 and parameters: {'depth': 5, 'learning_rate': 0.02020831441022754, 'iterations': 1716, 'l2_leaf_reg': 0.0005446157176465225, 'border_count': 200, 'bagging_temperature': 0.03941108810398721, 'random_strength': 6.611545960709791, 'grow_policy': 'Depthwise', 'min_data_in_leaf': 607}. Best is trial 306 with value: 170.64979827273262.[0m
[32m[I 2024-10-13 11:47:40,798][0m Trial 622 finished with value: 175.88432371185476 and parameters: {'depth': 4, 'learning_rate': 0.005864454168228262, 'iterations': 1882, 'l2_leaf_reg': 0.00016441203818114782, 'border_count': 5, 'bagging_temperature': 0.0722529568804045, 'random_strength': 0.6509874140021403, 'grow_policy': 'Depthwise', 'min_data_in_leaf': 539}. Best is trial 306 with value: 170.64979827273262.[0m
[32m[I 2024-10-13 11:47:42,624][0m Trial 623 finished with value: 210.7750558541785 and parameters: {'depth': 3, 'learning_rate': 0.017092622038353177, 'iterations': 1637, 'l2_leaf_reg': 1.4248130172916114e-07, 'border_count': 13, 'bagging_temperature': 0.032573350467654465, 'random_strength': 0.020171159385255058, 'grow_policy': 'Depthwise', 'min_data_in_leaf': 438}. Best is trial 306 with value: 170.64979827273262.[0m
[32m[I 2024-10-13 11:47:44,467][0m Trial 624 finished with value: 253.91928969764672 and parameters: {'depth': 5, 'learning_rate': 0.008679480597367777, 'iterations': 1754, 'l2_leaf_reg': 0.001060307639515884, 'border_count': 1, 'bagging_temperature': 0.017665118509544032, 'random_strength': 0.3929595076634451, 'grow_policy': 'Depthwise', 'min_data_in_leaf': 573}. Best is trial 306 with value: 170.64979827273262.[0m
[32m[I 2024-10-13 11:47:46,333][0m Trial 625 finished with value: 177.7388485817377 and parameters: {'depth': 4, 'learning_rate': 0.027131536057439107, 'iterations': 1827, 'l2_leaf_reg': 7.203035622579137e-08, 'border_count': 9, 'bagging_temperature': 0.058740036866836265, 'random_strength': 0.4885449521837374, 'grow_policy': 'Depthwise', 'min_data_in_leaf': 625}. Best is trial 306 with value: 170.64979827273262.[0m
[32m[I 2024-10-13 11:47:51,709][0m Trial 626 finished with value: 178.79336092818002 and parameters: {'depth': 4, 'learning_rate': 0.015587403218265827, 'iterations': 1565, 'l2_leaf_reg': 0.01448708665786117, 'border_count': 5, 'bagging_temperature': 0.08233574565240123, 'random_strength': 0.20355067862169382, 'grow_policy': 'SymmetricTree', 'min_data_in_leaf': 594}. Best is trial 306 with value: 170.64979827273262.[0m
[32m[I 2024-10-13 11:47:53,495][0m Trial 627 finished with value: 213.0313090854164 and parameters: {'depth': 5, 'learning_rate': 0.02261898350622833, 'iterations': 1652, 'l2_leaf_reg': 0.0007387689951179749, 'border_count': 15, 'bagging_temperature': 0.03812369282648259, 'random_strength': 4.649115256364243, 'grow_policy': 'Depthwise', 'min_data_in_leaf': 736}. Best is trial 306 with value: 170.64979827273262.[0m
[32m[I 2024-10-13 11:47:54,944][0m Trial 628 finished with value: 193.81951606927865 and parameters: {'depth': 3, 'learning_rate': 0.011221469699063829, 'iterations': 1106, 'l2_leaf_reg': 1.271145323346936e-07, 'border_count': 10, 'bagging_temperature': 0.01824380808396895, 'random_strength': 0.7463409839179199, 'grow_policy': 'Depthwise', 'min_data_in_leaf': 515}. Best is trial 306 with value: 170.64979827273262.[0m
[32m[I 2024-10-13 11:47:56,840][0m Trial 629 finished with value: 221.78393297389866 and parameters: {'depth': 5, 'learning_rate': 0.0010583878916253118, 'iterations': 1744, 'l2_leaf_reg': 0.00039955027193364307, 'border_count': 22, 'bagging_temperature': 0.052910333314247424, 'random_strength': 0.004487198832505146, 'grow_policy': 'Depthwise', 'min_data_in_leaf': 638}. Best is trial 306 with value: 170.64979827273262.[0m
[32m[I 2024-10-13 11:47:58,800][0m Trial 630 finished with value: 172.07483378899838 and parameters: {'depth': 3, 'learning_rate': 0.01888711256424004, 'iterations': 1814, 'l2_leaf_reg': 5.41874746398912e-07, 'border_count': 5, 'bagging_temperature': 0.017371423859450404, 'random_strength': 0.2933351933490612, 'grow_policy': 'Depthwise', 'min_data_in_leaf': 330}. Best is trial 306 with value: 170.64979827273262.[0m
[32m[I 2024-10-13 11:48:00,816][0m Trial 631 finished with value: 253.56616695514379 and parameters: {'depth': 3, 'learning_rate': 0.01316993902259821, 'iterations': 1887, 'l2_leaf_reg': 3.4727071957140856e-07, 'border_count': 1, 'bagging_temperature': 0.06454359544132526, 'random_strength': 0.2860463724695619, 'grow_policy': 'Depthwise', 'min_data_in_leaf': 332}. Best is trial 306 with value: 170.64979827273262.[0m
[32m[I 2024-10-13 11:48:02,869][0m Trial 632 finished with value: 211.14770729206006 and parameters: {'depth': 3, 'learning_rate': 0.015501791036604883, 'iterations': 1921, 'l2_leaf_reg': 4.3049896704825193e-07, 'border_count': 13, 'bagging_temperature': 0.03915434137417903, 'random_strength': 0.181396385729386, 'grow_policy': 'Depthwise', 'min_data_in_leaf': 345}. Best is trial 306 with value: 170.64979827273262.[0m
[32m[I 2024-10-13 11:48:04,872][0m Trial 633 finished with value: 173.60046945903827 and parameters: {'depth': 3, 'learning_rate': 0.018189789076228542, 'iterations': 1981, 'l2_leaf_reg': 1.579378757555489e-07, 'border_count': 6, 'bagging_temperature': 0.03261136379857956, 'random_strength': 0.2727897263887749, 'grow_policy': 'Depthwise', 'min_data_in_leaf': 255}. Best is trial 306 with value: 170.64979827273262.[0m
[32m[I 2024-10-13 11:48:06,777][0m Trial 634 finished with value: 200.46869059398307 and parameters: {'depth': 3, 'learning_rate': 0.013737737572660724, 'iterations': 1824, 'l2_leaf_reg': 0.0015319305163473977, 'border_count': 16, 'bagging_temperature': 0.08685658086942818, 'random_strength': 0.4467257743696198, 'grow_policy': 'Depthwise', 'min_data_in_leaf': 267}. Best is trial 306 with value: 170.64979827273262.[0m
[32m[I 2024-10-13 11:48:08,617][0m Trial 635 finished with value: 176.6555796180736 and parameters: {'depth': 3, 'learning_rate': 0.017504071428017492, 'iterations': 1791, 'l2_leaf_reg': 2.466507829327196e-07, 'border_count': 9, 'bagging_temperature': 0.0003764635111850635, 'random_strength': 0.014964497265453458, 'grow_policy': 'Depthwise', 'min_data_in_leaf': 405}. Best is trial 306 with value: 170.64979827273262.[0m
[32m[I 2024-10-13 11:48:10,527][0m Trial 636 finished with value: 234.82246154008436 and parameters: {'depth': 3, 'learning_rate': 0.019737929440589184, 'iterations': 1926, 'l2_leaf_reg': 0.0005115372231012597, 'border_count': 71, 'bagging_temperature': 0.3268343350084422, 'random_strength': 0.342474986857581, 'grow_policy': 'Depthwise', 'min_data_in_leaf': 345}. Best is trial 306 with value: 170.64979827273262.[0m
[32m[I 2024-10-13 11:48:12,460][0m Trial 637 finished with value: 253.50829208153465 and parameters: {'depth': 3, 'learning_rate': 0.009746344025922843, 'iterations': 1828, 'l2_leaf_reg': 0.00025944873167336796, 'border_count': 1, 'bagging_temperature': 0.05496598008937311, 'random_strength': 0.16411790038394264, 'grow_policy': 'Depthwise', 'min_data_in_leaf': 500}. Best is trial 306 with value: 170.64979827273262.[0m
[32m[I 2024-10-13 11:48:14,379][0m Trial 638 finished with value: 172.46763717218118 and parameters: {'depth': 3, 'learning_rate': 0.015018469825299155, 'iterations': 1879, 'l2_leaf_reg': 5.378942493331319e-07, 'border_count': 6, 'bagging_temperature': 0.020335723902079012, 'random_strength': 0.0036261888865170566, 'grow_policy': 'Depthwise', 'min_data_in_leaf': 382}. Best is trial 306 with value: 170.64979827273262.[0m
[32m[I 2024-10-13 11:48:16,253][0m Trial 639 finished with value: 199.71583248628434 and parameters: {'depth': 3, 'learning_rate': 0.011528751709804613, 'iterations': 1784, 'l2_leaf_reg': 0.0007785496880654753, 'border_count': 12, 'bagging_temperature': 0.03983575949996332, 'random_strength': 0.6288254116598693, 'grow_policy': 'Depthwise', 'min_data_in_leaf': 362}. Best is trial 306 with value: 170.64979827273262.[0m
[32m[I 2024-10-13 11:48:17,993][0m Trial 640 finished with value: 200.21137615166614 and parameters: {'depth': 4, 'learning_rate': 0.016956638061988223, 'iterations': 1685, 'l2_leaf_reg': 3.360540715977552e-07, 'border_count': 19, 'bagging_temperature': 0.020260480760896857, 'random_strength': 7.441233585739635, 'grow_policy': 'Depthwise', 'min_data_in_leaf': 310}. Best is trial 306 with value: 170.64979827273262.[0m
[32m[I 2024-10-13 11:48:19,772][0m Trial 641 finished with value: 174.96400384728906 and parameters: {'depth': 3, 'learning_rate': 0.013274946240243406, 'iterations': 1614, 'l2_leaf_reg': 0.047925865068267924, 'border_count': 5, 'bagging_temperature': 0.22061056306258675, 'random_strength': 0.4027733654285207, 'grow_policy': 'Depthwise', 'min_data_in_leaf': 427}. Best is trial 306 with value: 170.64979827273262.[0m
[32m[I 2024-10-13 11:48:21,659][0m Trial 642 finished with value: 206.76291775819965 and parameters: {'depth': 4, 'learning_rate': 0.020292745792077477, 'iterations': 1833, 'l2_leaf_reg': 0.001104468362928086, 'border_count': 11, 'bagging_temperature': 0.06667550671194564, 'random_strength': 0.4861214208658349, 'grow_policy': 'Depthwise', 'min_data_in_leaf': 292}. Best is trial 306 with value: 170.64979827273262.[0m
[32m[I 2024-10-13 11:48:23,492][0m Trial 643 finished with value: 253.6757118699763 and parameters: {'depth': 3, 'learning_rate': 0.015367187628124048, 'iterations': 1726, 'l2_leaf_reg': 0.0018660046752920784, 'border_count': 1, 'bagging_temperature': 0.04689168410983979, 'random_strength': 3.2434053682496504, 'grow_policy': 'Depthwise', 'min_data_in_leaf': 304}. Best is trial 306 with value: 170.64979827273262.[0m
[32m[I 2024-10-13 11:48:25,462][0m Trial 644 finished with value: 205.6384936811349 and parameters: {'depth': 4, 'learning_rate': 0.019820878270179403, 'iterations': 2040, 'l2_leaf_reg': 0.0004143284014312871, 'border_count': 17, 'bagging_temperature': 0.01613654939179884, 'random_strength': 6.047323722702666, 'grow_policy': 'Depthwise', 'min_data_in_leaf': 482}. Best is trial 306 with value: 170.64979827273262.[0m
[32m[I 2024-10-13 11:48:27,202][0m Trial 645 finished with value: 172.01835969408566 and parameters: {'depth': 4, 'learning_rate': 0.011812772628117401, 'iterations': 1534, 'l2_leaf_reg': 0.00013690893157366338, 'border_count': 8, 'bagging_temperature': 0.02712268566952112, 'random_strength': 0.7701293639197412, 'grow_policy': 'Depthwise', 'min_data_in_leaf': 783}. Best is trial 306 with value: 170.64979827273262.[0m
[32m[I 2024-10-13 11:48:28,901][0m Trial 646 finished with value: 210.77389736965193 and parameters: {'depth': 3, 'learning_rate': 0.0072430482213598595, 'iterations': 1501, 'l2_leaf_reg': 7.169023948685084e-05, 'border_count': 22, 'bagging_temperature': 0.017713543861046684, 'random_strength': 0.9686869415004032, 'grow_policy': 'Depthwise', 'min_data_in_leaf': 537}. Best is trial 306 with value: 170.64979827273262.[0m
[32m[I 2024-10-13 11:48:30,557][0m Trial 647 finished with value: 203.3863158242608 and parameters: {'depth': 4, 'learning_rate': 0.008785047623760419, 'iterations': 1522, 'l2_leaf_reg': 0.00018279659139658772, 'border_count': 13, 'bagging_temperature': 0.052933837093115235, 'random_strength': 1.4142671711138446, 'grow_policy': 'Depthwise', 'min_data_in_leaf': 786}. Best is trial 306 with value: 170.64979827273262.[0m
[32m[I 2024-10-13 11:48:36,049][0m Trial 648 finished with value: 230.26400790543263 and parameters: {'depth': 4, 'learning_rate': 0.010276410996602816, 'iterations': 1529, 'l2_leaf_reg': 0.0001351023826970271, 'border_count': 27, 'bagging_temperature': 0.0012309851955182342, 'random_strength': 1.063408428816654, 'grow_policy': 'SymmetricTree', 'min_data_in_leaf': 794}. Best is trial 306 with value: 170.64979827273262.[0m
[32m[I 2024-10-13 11:48:37,700][0m Trial 649 finished with value: 181.38827796435052 and parameters: {'depth': 3, 'learning_rate': 0.010073604683400494, 'iterations': 1458, 'l2_leaf_reg': 0.00010670577280457218, 'border_count': 9, 'bagging_temperature': 0.08398694456316762, 'random_strength': 0.8580968830356116, 'grow_policy': 'Depthwise', 'min_data_in_leaf': 809}. Best is trial 306 with value: 170.64979827273262.[0m
[32m[I 2024-10-13 11:48:39,493][0m Trial 650 finished with value: 197.65161627358117 and parameters: {'depth': 3, 'learning_rate': 0.012246796805554504, 'iterations': 1548, 'l2_leaf_reg': 0.00023526733447419378, 'border_count': 17, 'bagging_temperature': 0.032436062242038675, 'random_strength': 0.22475801114317454, 'grow_policy': 'Depthwise', 'min_data_in_leaf': 710}. Best is trial 306 with value: 170.64979827273262.[0m
[32m[I 2024-10-13 11:48:41,228][0m Trial 651 finished with value: 181.03372993969916 and parameters: {'depth': 4, 'learning_rate': 0.011262420705593018, 'iterations': 1597, 'l2_leaf_reg': 1.9406160109634782e-07, 'border_count': 9, 'bagging_temperature': 0.06466623961020945, 'random_strength': 0.7680397091449942, 'grow_policy': 'Depthwise', 'min_data_in_leaf': 769}. Best is trial 306 with value: 170.64979827273262.[0m
[32m[I 2024-10-13 11:48:43,215][0m Trial 652 finished with value: 171.5161573156326 and parameters: {'depth': 4, 'learning_rate': 0.012940265159147622, 'iterations': 1968, 'l2_leaf_reg': 6.488564697767006e-08, 'border_count': 5, 'bagging_temperature': 0.000367746650019124, 'random_strength': 1.3196282573122138, 'grow_policy': 'Depthwise', 'min_data_in_leaf': 812}. Best is trial 306 with value: 170.64979827273262.[0m
[32m[I 2024-10-13 11:48:45,264][0m Trial 653 finished with value: 206.3859849623001 and parameters: {'depth': 3, 'learning_rate': 0.009763587746667485, 'iterations': 1995, 'l2_leaf_reg': 4.3478583133448364e-08, 'border_count': 13, 'bagging_temperature': 0.016134596510581092, 'random_strength': 1.0557488654414584, 'grow_policy': 'Depthwise', 'min_data_in_leaf': 838}. Best is trial 306 with value: 170.64979827273262.[0m
[32m[I 2024-10-13 11:48:47,225][0m Trial 654 finished with value: 171.7396478089818 and parameters: {'depth': 4, 'learning_rate': 0.01229622006094182, 'iterations': 1943, 'l2_leaf_reg': 6.212077041297642e-08, 'border_count': 5, 'bagging_temperature': 0.012875494130941342, 'random_strength': 1.283821566940349, 'grow_policy': 'Depthwise', 'min_data_in_leaf': 806}. Best is trial 306 with value: 170.64979827273262.[0m
[32m[I 2024-10-13 11:48:49,322][0m Trial 655 finished with value: 178.89866025583265 and parameters: {'depth': 4, 'learning_rate': 0.008574541027583323, 'iterations': 2135, 'l2_leaf_reg': 3.753539992921172e-08, 'border_count': 9, 'bagging_temperature': 0.0013292584122991367, 'random_strength': 1.2825906644233207, 'grow_policy': 'Depthwise', 'min_data_in_leaf': 826}. Best is trial 306 with value: 170.64979827273262.[0m
[32m[I 2024-10-13 11:48:51,405][0m Trial 656 finished with value: 172.43221291059325 and parameters: {'depth': 4, 'learning_rate': 0.011356153885800907, 'iterations': 2066, 'l2_leaf_reg': 2.4289561554365994e-08, 'border_count': 6, 'bagging_temperature': 0.00017680028755980015, 'random_strength': 1.1646877028063827, 'grow_policy': 'Depthwise', 'min_data_in_leaf': 806}. Best is trial 306 with value: 170.64979827273262.[0m
[32m[I 2024-10-13 11:48:53,539][0m Trial 657 finished with value: 204.29264987558804 and parameters: {'depth': 4, 'learning_rate': 0.007909675423546848, 'iterations': 2010, 'l2_leaf_reg': 5.6040558984687623e-08, 'border_count': 14, 'bagging_temperature': 0.03225107759156892, 'random_strength': 1.304901022399485, 'grow_policy': 'Depthwise', 'min_data_in_leaf': 857}. Best is trial 306 with value: 170.64979827273262.[0m
[32m[I 2024-10-13 11:48:55,590][0m Trial 658 finished with value: 198.75690354111336 and parameters: {'depth': 4, 'learning_rate': 0.012233515068062358, 'iterations': 1972, 'l2_leaf_reg': 6.738087245480161e-08, 'border_count': 19, 'bagging_temperature': 0.01677214666818811, 'random_strength': 1.3117952574044718, 'grow_policy': 'Depthwise', 'min_data_in_leaf': 822}. Best is trial 306 with value: 170.64979827273262.[0m
[32m[I 2024-10-13 11:48:57,507][0m Trial 659 finished with value: 171.36255064210513 and parameters: {'depth': 4, 'learning_rate': 0.013959130170699536, 'iterations': 1957, 'l2_leaf_reg': 4.127358745858732e-08, 'border_count': 5, 'bagging_temperature': 8.012879118052957e-05, 'random_strength': 1.6852041037841814, 'grow_policy': 'Depthwise', 'min_data_in_leaf': 816}. Best is trial 306 with value: 170.64979827273262.[0m
[32m[I 2024-10-13 11:48:59,492][0m Trial 660 finished with value: 253.89327384004667 and parameters: {'depth': 4, 'learning_rate': 0.010238093092621066, 'iterations': 1955, 'l2_leaf_reg': 2.5354458198295343e-08, 'border_count': 1, 'bagging_temperature': 0.016488678285004464, 'random_strength': 1.1016760665135588, 'grow_policy': 'Depthwise', 'min_data_in_leaf': 802}. Best is trial 306 with value: 170.64979827273262.[0m
[32m[I 2024-10-13 11:49:01,589][0m Trial 661 finished with value: 252.677594807441 and parameters: {'depth': 4, 'learning_rate': 0.01389292540083597, 'iterations': 2034, 'l2_leaf_reg': 3.466990375570262e-08, 'border_count': 150, 'bagging_temperature': 0.002751695122770404, 'random_strength': 1.4665621254465069, 'grow_policy': 'Depthwise', 'min_data_in_leaf': 832}. Best is trial 306 with value: 170.64979827273262.[0m
[32m[I 2024-10-13 11:49:03,681][0m Trial 662 finished with value: 203.73786085117504 and parameters: {'depth': 4, 'learning_rate': 0.011373138726936582, 'iterations': 2114, 'l2_leaf_reg': 4.730625502794721e-08, 'border_count': 11, 'bagging_temperature': 0.034698091894913186, 'random_strength': 1.7815155260987643, 'grow_policy': 'Depthwise', 'min_data_in_leaf': 854}. Best is trial 306 with value: 170.64979827273262.[0m
[32m[I 2024-10-13 11:49:05,721][0m Trial 663 finished with value: 223.4570905375898 and parameters: {'depth': 4, 'learning_rate': 0.012763558884666173, 'iterations': 1950, 'l2_leaf_reg': 3.418203247152246e-08, 'border_count': 43, 'bagging_temperature': 0.03281046609548883, 'random_strength': 1.6222150492207785, 'grow_policy': 'Depthwise', 'min_data_in_leaf': 801}. Best is trial 306 with value: 170.64979827273262.[0m
