[32m[I 2024-10-13 11:52:53,204][0m Trial 766 finished with value: 202.15917623221205 and parameters: {'depth': 5, 'learning_rate': 0.01498498253872234, 'iterations': 1805, 'l2_leaf_reg': 3.440606432166925e-08, 'border_count': 10, 'bagging_temperature': 0.04750085158986897, 'random_strength': 2.0802689804874617, 'grow_policy': 'Depthwise', 'min_data_in_leaf': 870}. Best is trial 306 with value: 170.64979827273262.[0m
[32m[I 2024-10-13 11:52:55,150][0m Trial 767 finished with value: 197.90903060531195 and parameters: {'depth': 4, 'learning_rate': 0.010278421708726925, 'iterations': 1894, 'l2_leaf_reg': 9.586205896766404e-06, 'border_count': 17, 'bagging_temperature': 0.0004110043085337675, 'random_strength': 1.4392888055273376, 'grow_policy': 'Depthwise', 'min_data_in_leaf': 491}. Best is trial 306 with value: 170.64979827273262.[0m
[32m[I 2024-10-13 11:52:57,074][0m Trial 768 finished with value: 177.1299256755032 and parameters: {'depth': 4, 'learning_rate': 0.012809695228283841, 'iterations': 1960, 'l2_leaf_reg': 1.717256301180372e-08, 'border_count': 6, 'bagging_temperature': 0.3893403827710347, 'random_strength': 0.8818385734270324, 'grow_policy': 'Depthwise', 'min_data_in_leaf': 412}. Best is trial 306 with value: 170.64979827273262.[0m
[32m[I 2024-10-13 11:52:58,915][0m Trial 769 finished with value: 202.09544863238207 and parameters: {'depth': 5, 'learning_rate': 0.006560620421119374, 'iterations': 1814, 'l2_leaf_reg': 1.0135547426091953e-07, 'border_count': 13, 'bagging_temperature': 0.019956788198183976, 'random_strength': 1.9609227393519322, 'grow_policy': 'Depthwise', 'min_data_in_leaf': 752}. Best is trial 306 with value: 170.64979827273262.[0m
[32m[I 2024-10-13 11:53:00,699][0m Trial 770 finished with value: 251.67539268701617 and parameters: {'depth': 3, 'learning_rate': 0.008391609638083941, 'iterations': 1774, 'l2_leaf_reg': 2.4508337021624075e-08, 'border_count': 1, 'bagging_temperature': 0.5372892927549635, 'random_strength': 1.536316265292763, 'grow_policy': 'Depthwise', 'min_data_in_leaf': 792}. Best is trial 306 with value: 170.64979827273262.[0m
[32m[I 2024-10-13 11:53:02,768][0m Trial 771 finished with value: 177.75839753387487 and parameters: {'depth': 4, 'learning_rate': 0.01750375731623635, 'iterations': 2014, 'l2_leaf_reg': 6.227068376559375e-08, 'border_count': 9, 'bagging_temperature': 0.03218016837103237, 'random_strength': 1.0999400441585785, 'grow_policy': 'Depthwise', 'min_data_in_leaf': 579}. Best is trial 306 with value: 170.64979827273262.[0m
[32m[I 2024-10-13 11:53:04,687][0m Trial 772 finished with value: 200.32214075625018 and parameters: {'depth': 6, 'learning_rate': 0.014619487257764926, 'iterations': 1899, 'l2_leaf_reg': 1.3303235247187098e-08, 'border_count': 20, 'bagging_temperature': 0.058039521365309855, 'random_strength': 0.8140055737876702, 'grow_policy': 'Depthwise', 'min_data_in_leaf': 815}. Best is trial 306 with value: 170.64979827273262.[0m
[32m[I 2024-10-13 11:53:06,024][0m Trial 773 finished with value: 175.00180124610463 and parameters: {'depth': 4, 'learning_rate': 0.010621782290315669, 'iterations': 1096, 'l2_leaf_reg': 2.0115778678177088e-07, 'border_count': 6, 'bagging_temperature': 0.01600765191584864, 'random_strength': 3.84247546133813, 'grow_policy': 'Depthwise', 'min_data_in_leaf': 934}. Best is trial 306 with value: 170.64979827273262.[0m
[32m[I 2024-10-13 11:53:08,106][0m Trial 774 finished with value: 233.6319884824825 and parameters: {'depth': 3, 'learning_rate': 0.01244247012063495, 'iterations': 2090, 'l2_leaf_reg': 4.948753189555573e-08, 'border_count': 67, 'bagging_temperature': 0.036203161198989565, 'random_strength': 1.6671625363941474, 'grow_policy': 'Depthwise', 'min_data_in_leaf': 439}. Best is trial 306 with value: 170.64979827273262.[0m
[32m[I 2024-10-13 11:53:10,091][0m Trial 775 finished with value: 221.75524648813428 and parameters: {'depth': 5, 'learning_rate': 0.017584918577129592, 'iterations': 1860, 'l2_leaf_reg': 3.309747641072719e-08, 'border_count': 14, 'bagging_temperature': 0.0006608636396378542, 'random_strength': 1.3358357872265945, 'grow_policy': 'Depthwise', 'min_data_in_leaf': 91}. Best is trial 306 with value: 170.64979827273262.[0m
[32m[I 2024-10-13 11:53:12,033][0m Trial 776 finished with value: 180.76633090974548 and parameters: {'depth': 5, 'learning_rate': 0.015080361018843707, 'iterations': 1956, 'l2_leaf_reg': 7.514411764856567e-08, 'border_count': 9, 'bagging_temperature': 0.07416289176268409, 'random_strength': 1.1390590997508734, 'grow_policy': 'Depthwise', 'min_data_in_leaf': 846}. Best is trial 306 with value: 170.64979827273262.[0m
[32m[I 2024-10-13 11:53:13,807][0m Trial 777 finished with value: 253.97866321236506 and parameters: {'depth': 4, 'learning_rate': 0.009580030808404826, 'iterations': 1760, 'l2_leaf_reg': 9.776615480041605e-08, 'border_count': 1, 'bagging_temperature': 0.016547659695727884, 'random_strength': 2.5402379036961578, 'grow_policy': 'Depthwise', 'min_data_in_leaf': 596}. Best is trial 306 with value: 170.64979827273262.[0m
[32m[I 2024-10-13 11:53:20,178][0m Trial 778 finished with value: 182.78938552325815 and parameters: {'depth': 4, 'learning_rate': 0.011876857853984391, 'iterations': 1846, 'l2_leaf_reg': 2.3161211505694316e-08, 'border_count': 6, 'bagging_temperature': 0.9658114958784835, 'random_strength': 0.8951619432310571, 'grow_policy': 'SymmetricTree', 'min_data_in_leaf': 776}. Best is trial 306 with value: 170.64979827273262.[0m
[32m[I 2024-10-13 11:53:22,127][0m Trial 779 finished with value: 303.0177786328359 and parameters: {'depth': 3, 'learning_rate': 0.0002823955151511311, 'iterations': 1930, 'l2_leaf_reg': 1.253800795788034e-07, 'border_count': 16, 'bagging_temperature': 0.0007426681592559506, 'random_strength': 2.907941703589761, 'grow_policy': 'Depthwise', 'min_data_in_leaf': 517}. Best is trial 306 with value: 170.64979827273262.[0m
[32m[I 2024-10-13 11:53:23,977][0m Trial 780 finished with value: 204.27195193762847 and parameters: {'depth': 5, 'learning_rate': 0.013798502554878724, 'iterations': 1796, 'l2_leaf_reg': 4.3476816170063576e-08, 'border_count': 11, 'bagging_temperature': 0.04741574513381091, 'random_strength': 1.453800661295608, 'grow_policy': 'Depthwise', 'min_data_in_leaf': 567}. Best is trial 306 with value: 170.64979827273262.[0m
[32m[I 2024-10-13 11:53:25,790][0m Trial 781 finished with value: 212.36979270144815 and parameters: {'depth': 4, 'learning_rate': 0.01849710232824495, 'iterations': 1751, 'l2_leaf_reg': 1.7995978309358667e-07, 'border_count': 25, 'bagging_temperature': 0.03319738154195782, 'random_strength': 0.7034905711727464, 'grow_policy': 'Depthwise', 'min_data_in_leaf': 467}. Best is trial 306 with value: 170.64979827273262.[0m
[32m[I 2024-10-13 11:53:27,815][0m Trial 782 finished with value: 181.2153039952225 and parameters: {'depth': 5, 'learning_rate': 0.015829886485420396, 'iterations': 2004, 'l2_leaf_reg': 2.0045542214118976e-08, 'border_count': 5, 'bagging_temperature': 0.9388915297129452, 'random_strength': 1.889171603230015, 'grow_policy': 'Depthwise', 'min_data_in_leaf': 828}. Best is trial 306 with value: 170.64979827273262.[0m
[32m[I 2024-10-13 11:53:29,732][0m Trial 783 finished with value: 199.1393993777965 and parameters: {'depth': 3, 'learning_rate': 0.010968572794691402, 'iterations': 1917, 'l2_leaf_reg': 0.008803169419474205, 'border_count': 10, 'bagging_temperature': 0.018093447351256377, 'random_strength': 1.128535020351911, 'grow_policy': 'Depthwise', 'min_data_in_leaf': 607}. Best is trial 306 with value: 170.64979827273262.[0m
[32m[I 2024-10-13 11:53:31,581][0m Trial 784 finished with value: 254.1649574779266 and parameters: {'depth': 4, 'learning_rate': 0.007834950949459617, 'iterations': 1846, 'l2_leaf_reg': 6.598315409801445e-08, 'border_count': 1, 'bagging_temperature': 0.0008097408153608414, 'random_strength': 1.6783163184822874, 'grow_policy': 'Depthwise', 'min_data_in_leaf': 808}. Best is trial 306 with value: 170.64979827273262.[0m
[32m[I 2024-10-13 11:53:33,702][0m Trial 785 finished with value: 201.26481916415491 and parameters: {'depth': 5, 'learning_rate': 0.013303010521213385, 'iterations': 2065, 'l2_leaf_reg': 3.4072132436057536e-08, 'border_count': 16, 'bagging_temperature': 0.057998487924899374, 'random_strength': 0.7517375285867666, 'grow_policy': 'Depthwise', 'min_data_in_leaf': 784}. Best is trial 306 with value: 170.64979827273262.[0m
[32m[I 2024-10-13 11:53:35,559][0m Trial 786 finished with value: 172.51089730581933 and parameters: {'depth': 6, 'learning_rate': 0.00938322397926664, 'iterations': 1776, 'l2_leaf_reg': 1.5214070091331858e-05, 'border_count': 8, 'bagging_temperature': 0.0399813625253647, 'random_strength': 1.3174432401475946, 'grow_policy': 'Depthwise', 'min_data_in_leaf': 547}. Best is trial 306 with value: 170.64979827273262.[0m
[32m[I 2024-10-13 11:53:37,434][0m Trial 787 finished with value: 172.25432664219642 and parameters: {'depth': 4, 'learning_rate': 0.019219883379684003, 'iterations': 1848, 'l2_leaf_reg': 1.1329984214569978e-07, 'border_count': 5, 'bagging_temperature': 0.020483600265107843, 'random_strength': 0.9512154834054687, 'grow_policy': 'Depthwise', 'min_data_in_leaf': 888}. Best is trial 306 with value: 170.64979827273262.[0m
[32m[I 2024-10-13 11:53:39,454][0m Trial 788 finished with value: 203.4331173328947 and parameters: {'depth': 3, 'learning_rate': 0.015866871107303945, 'iterations': 1905, 'l2_leaf_reg': 1.5445043494517817e-08, 'border_count': 12, 'bagging_temperature': 0.07941920669674332, 'random_strength': 1.5439563050509437, 'grow_policy': 'Depthwise', 'min_data_in_leaf': 749}. Best is trial 306 with value: 170.64979827273262.[0m
[32m[I 2024-10-13 11:53:41,270][0m Trial 789 finished with value: 197.55418299983668 and parameters: {'depth': 4, 'learning_rate': 0.012137456864611615, 'iterations': 1737, 'l2_leaf_reg': 4.713895634331684e-08, 'border_count': 20, 'bagging_temperature': 0.03326398484259646, 'random_strength': 2.1369037168324287, 'grow_policy': 'Depthwise', 'min_data_in_leaf': 600}. Best is trial 306 with value: 170.64979827273262.[0m
[32m[I 2024-10-13 11:53:43,247][0m Trial 790 finished with value: 253.95551739598713 and parameters: {'depth': 5, 'learning_rate': 0.0140171144827358, 'iterations': 1999, 'l2_leaf_reg': 8.240590142906248e-08, 'border_count': 1, 'bagging_temperature': 0.0005984705806099136, 'random_strength': 6.386809735607952, 'grow_policy': 'Depthwise', 'min_data_in_leaf': 638}. Best is trial 306 with value: 170.64979827273262.[0m
[32m[I 2024-10-13 11:53:45,157][0m Trial 791 finished with value: 205.41566667460285 and parameters: {'depth': 4, 'learning_rate': 0.010024609334703243, 'iterations': 1821, 'l2_leaf_reg': 2.789127406440759e-08, 'border_count': 14, 'bagging_temperature': 0.05626873682198272, 'random_strength': 0.6592486231062882, 'grow_policy': 'Depthwise', 'min_data_in_leaf': 487}. Best is trial 306 with value: 170.64979827273262.[0m
[32m[I 2024-10-13 11:53:47,167][0m Trial 792 finished with value: 170.7221279802104 and parameters: {'depth': 3, 'learning_rate': 0.018539919921405832, 'iterations': 1952, 'l2_leaf_reg': 1.9945162250793912e-07, 'border_count': 8, 'bagging_temperature': 0.0003762822411960985, 'random_strength': 1.1423762400054898, 'grow_policy': 'Depthwise', 'min_data_in_leaf': 855}. Best is trial 306 with value: 170.64979827273262.[0m
[32m[I 2024-10-13 11:53:49,160][0m Trial 793 finished with value: 223.8615288268969 and parameters: {'depth': 3, 'learning_rate': 0.020608684378572748, 'iterations': 2037, 'l2_leaf_reg': 2.155626299495967e-07, 'border_count': 22, 'bagging_temperature': 0.0008206499157840646, 'random_strength': 0.9360941269812407, 'grow_policy': 'Depthwise', 'min_data_in_leaf': 865}. Best is trial 306 with value: 170.64979827273262.[0m
[32m[I 2024-10-13 11:53:51,132][0m Trial 794 finished with value: 204.52792974485308 and parameters: {'depth': 3, 'learning_rate': 0.019212080737315278, 'iterations': 1970, 'l2_leaf_reg': 2.0317228487754737e-07, 'border_count': 17, 'bagging_temperature': 0.018497560849049053, 'random_strength': 1.0516849252317346, 'grow_policy': 'Depthwise', 'min_data_in_leaf': 865}. Best is trial 306 with value: 170.64979827273262.[0m
[32m[I 2024-10-13 11:53:52,961][0m Trial 795 finished with value: 203.33316454361903 and parameters: {'depth': 3, 'learning_rate': 0.017571987365826717, 'iterations': 1772, 'l2_leaf_reg': 1.5387072349644889e-07, 'border_count': 10, 'bagging_temperature': 0.035218702417189524, 'random_strength': 5.072103799276163, 'grow_policy': 'Depthwise', 'min_data_in_leaf': 852}. Best is trial 306 with value: 170.64979827273262.[0m
[32m[I 2024-10-13 11:53:55,055][0m Trial 796 finished with value: 189.7880135139461 and parameters: {'depth': 3, 'learning_rate': 0.020345601911851256, 'iterations': 2127, 'l2_leaf_reg': 1.3844959424134548e-07, 'border_count': 9, 'bagging_temperature': 0.6335129675833595, 'random_strength': 0.7866154663907869, 'grow_policy': 'Depthwise', 'min_data_in_leaf': 874}. Best is trial 306 with value: 170.64979827273262.[0m
[32m[I 2024-10-13 11:53:57,030][0m Trial 797 finished with value: 210.30517850678214 and parameters: {'depth': 3, 'learning_rate': 0.01588934565351116, 'iterations': 1887, 'l2_leaf_reg': 2.59396782719955e-07, 'border_count': 14, 'bagging_temperature': 0.017771745751446206, 'random_strength': 1.1948237202259513, 'grow_policy': 'Depthwise', 'min_data_in_leaf': 841}. Best is trial 306 with value: 170.64979827273262.[0m
[32m[I 2024-10-13 11:54:02,769][0m Trial 798 finished with value: 184.6824082830484 and parameters: {'depth': 3, 'learning_rate': 0.017533244070485815, 'iterations': 1721, 'l2_leaf_reg': 0.020932510408238243, 'border_count': 6, 'bagging_temperature': 0.0006892804845262043, 'random_strength': 0.5559731763140652, 'grow_policy': 'SymmetricTree', 'min_data_in_leaf': 899}. Best is trial 306 with value: 170.64979827273262.[0m
[32m[I 2024-10-13 11:54:04,926][0m Trial 799 finished with value: 206.5728707501565 and parameters: {'depth': 3, 'learning_rate': 0.020949262733011374, 'iterations': 2287, 'l2_leaf_reg': 2.731252407802103e-07, 'border_count': 19, 'bagging_temperature': 0.0003451759479764366, 'random_strength': 0.0027510198897945926, 'grow_policy': 'Depthwise', 'min_data_in_leaf': 840}. Best is trial 306 with value: 170.64979827273262.[0m
[32m[I 2024-10-13 11:54:06,805][0m Trial 800 finished with value: 208.4908780417687 and parameters: {'depth': 3, 'learning_rate': 0.016282079898946207, 'iterations': 1830, 'l2_leaf_reg': 1.231116190325375e-07, 'border_count': 35, 'bagging_temperature': 0.03750642601296009, 'random_strength': 1.0706848407711345, 'grow_policy': 'Depthwise', 'min_data_in_leaf': 876}. Best is trial 306 with value: 170.64979827273262.[0m
[32m[I 2024-10-13 11:54:08,767][0m Trial 801 finished with value: 323.6880798301625 and parameters: {'depth': 3, 'learning_rate': 0.00021401067511854613, 'iterations': 1964, 'l2_leaf_reg': 0.005147020334242383, 'border_count': 12, 'bagging_temperature': 0.020394737380422363, 'random_strength': 0.8225322250310818, 'grow_policy': 'Depthwise', 'min_data_in_leaf': 888}. Best is trial 306 with value: 170.64979827273262.[0m
[32m[I 2024-10-13 11:54:10,560][0m Trial 802 finished with value: 172.39685445679163 and parameters: {'depth': 3, 'learning_rate': 0.018993764039396486, 'iterations': 1706, 'l2_leaf_reg': 9.227648542615068e-08, 'border_count': 7, 'bagging_temperature': 0.054426188094021104, 'random_strength': 0.6373568498850546, 'grow_policy': 'Depthwise', 'min_data_in_leaf': 923}. Best is trial 306 with value: 170.64979827273262.[0m
[32m[I 2024-10-13 11:54:12,680][0m Trial 803 finished with value: 171.9170935917498 and parameters: {'depth': 3, 'learning_rate': 0.014215157890422266, 'iterations': 2062, 'l2_leaf_reg': 1.7601386962475465e-07, 'border_count': 5, 'bagging_temperature': 0.03462271142288842, 'random_strength': 1.2377141113607977, 'grow_policy': 'Depthwise', 'min_data_in_leaf': 851}. Best is trial 306 with value: 170.64979827273262.[0m
[32m[I 2024-10-13 11:54:14,921][0m Trial 804 finished with value: 254.75339714749904 and parameters: {'depth': 3, 'learning_rate': 0.015811601504845767, 'iterations': 2122, 'l2_leaf_reg': 1.4602099805855544e-07, 'border_count': 216, 'bagging_temperature': 0.09436833973922704, 'random_strength': 1.2617578332919615, 'grow_policy': 'Depthwise', 'min_data_in_leaf': 860}. Best is trial 306 with value: 170.64979827273262.[0m
[32m[I 2024-10-13 11:54:17,106][0m Trial 805 finished with value: 254.79824218230453 and parameters: {'depth': 3, 'learning_rate': 0.022317736893682216, 'iterations': 2084, 'l2_leaf_reg': 2.707414216223641e-07, 'border_count': 1, 'bagging_temperature': 0.06817301361830322, 'random_strength': 1.3184157432129542, 'grow_policy': 'Depthwise', 'min_data_in_leaf': 903}. Best is trial 306 with value: 170.64979827273262.[0m
[32m[I 2024-10-13 11:54:19,301][0m Trial 806 finished with value: 254.31625693742214 and parameters: {'depth': 3, 'learning_rate': 0.01847820851340578, 'iterations': 2207, 'l2_leaf_reg': 1.6441875001009502e-07, 'border_count': 1, 'bagging_temperature': 0.04323857808330223, 'random_strength': 1.401126632601685, 'grow_policy': 'Depthwise', 'min_data_in_leaf': 833}. Best is trial 306 with value: 170.64979827273262.[0m
[32m[I 2024-10-13 11:54:21,366][0m Trial 807 finished with value: 171.39883769143586 and parameters: {'depth': 3, 'learning_rate': 0.01435742495469393, 'iterations': 2068, 'l2_leaf_reg': 0.3499670821382901, 'border_count': 5, 'bagging_temperature': 0.0002695058879742225, 'random_strength': 1.1335154551226951, 'grow_policy': 'Lossguide', 'min_data_in_leaf': 854, 'max_leaves': 45}. Best is trial 306 with value: 170.64979827273262.[0m
[32m[I 2024-10-13 11:54:23,451][0m Trial 808 finished with value: 170.83010259803947 and parameters: {'depth': 3, 'learning_rate': 0.01535193903457551, 'iterations': 2143, 'l2_leaf_reg': 3.0394921614388983, 'border_count': 5, 'bagging_temperature': 0.01712705179302916, 'random_strength': 1.2271028586542059, 'grow_policy': 'Lossguide', 'min_data_in_leaf': 889, 'max_leaves': 160}. Best is trial 306 with value: 170.64979827273262.[0m
[32m[I 2024-10-13 11:54:25,535][0m Trial 809 finished with value: 254.31189303122966 and parameters: {'depth': 3, 'learning_rate': 0.01766891897037164, 'iterations': 2192, 'l2_leaf_reg': 0.29835840603013314, 'border_count': 1, 'bagging_temperature': 0.014643537763420958, 'random_strength': 1.154142533506606, 'grow_policy': 'Lossguide', 'min_data_in_leaf': 885, 'max_leaves': 32}. Best is trial 306 with value: 170.64979827273262.[0m
[32m[I 2024-10-13 11:54:27,671][0m Trial 810 finished with value: 171.48588536310177 and parameters: {'depth': 3, 'learning_rate': 0.02164626751851474, 'iterations': 2179, 'l2_leaf_reg': 9.76336847278002, 'border_count': 6, 'bagging_temperature': 0.019890977908677443, 'random_strength': 1.2425960592216494, 'grow_policy': 'Lossguide', 'min_data_in_leaf': 913, 'max_leaves': 162}. Best is trial 306 with value: 170.64979827273262.[0m
[32m[I 2024-10-13 11:54:29,688][0m Trial 811 finished with value: 207.07777110864274 and parameters: {'depth': 3, 'learning_rate': 0.023562940965788575, 'iterations': 2121, 'l2_leaf_reg': 2.5730720851854523, 'border_count': 12, 'bagging_temperature': 0.01744792941760277, 'random_strength': 1.380473614034004, 'grow_policy': 'Lossguide', 'min_data_in_leaf': 977, 'max_leaves': 199}. Best is trial 306 with value: 170.64979827273262.[0m
[32m[I 2024-10-13 11:54:31,823][0m Trial 812 finished with value: 171.8947900756017 and parameters: {'depth': 3, 'learning_rate': 0.02285152376906779, 'iterations': 2231, 'l2_leaf_reg': 3.1950752658015773, 'border_count': 5, 'bagging_temperature': 0.01859035545745739, 'random_strength': 1.1245074758039604, 'grow_policy': 'Lossguide', 'min_data_in_leaf': 881, 'max_leaves': 162}. Best is trial 306 with value: 170.64979827273262.[0m
[32m[I 2024-10-13 11:54:34,074][0m Trial 813 finished with value: 212.2072530974784 and parameters: {'depth': 3, 'learning_rate': 0.02730293666047088, 'iterations': 2262, 'l2_leaf_reg': 5.683904289040902, 'border_count': 14, 'bagging_temperature': 0.0008325453587693585, 'random_strength': 1.1462170326724845, 'grow_policy': 'Lossguide', 'min_data_in_leaf': 909, 'max_leaves': 158}. Best is trial 306 with value: 170.64979827273262.[0m
[32m[I 2024-10-13 11:54:36,166][0m Trial 814 finished with value: 171.79253087544572 and parameters: {'depth': 3, 'learning_rate': 0.02214908625008428, 'iterations': 2183, 'l2_leaf_reg': 2.7180712179104725, 'border_count': 5, 'bagging_temperature': 0.00033627955498905307, 'random_strength': 1.1182487905723217, 'grow_policy': 'Lossguide', 'min_data_in_leaf': 909, 'max_leaves': 151}. Best is trial 306 with value: 170.64979827273262.[0m
[32m[I 2024-10-13 11:54:38,241][0m Trial 815 finished with value: 235.44250580026014 and parameters: {'depth': 3, 'learning_rate': 0.0006647003049820786, 'iterations': 2157, 'l2_leaf_reg': 4.697390959667137, 'border_count': 9, 'bagging_temperature': 0.0004585086076247559, 'random_strength': 1.380108690468153, 'grow_policy': 'Lossguide', 'min_data_in_leaf': 940, 'max_leaves': 152}. Best is trial 306 with value: 170.64979827273262.[0m
[32m[I 2024-10-13 11:54:40,411][0m Trial 816 finished with value: 254.8225368518396 and parameters: {'depth': 3, 'learning_rate': 0.02075161888089428, 'iterations': 2248, 'l2_leaf_reg': 1.4736249491211344, 'border_count': 1, 'bagging_temperature': 0.0008304445808314, 'random_strength': 1.088758180668324, 'grow_policy': 'Lossguide', 'min_data_in_leaf': 912, 'max_leaves': 176}. Best is trial 306 with value: 170.64979827273262.[0m
