[32m[I 2024-10-13 11:32:30,300][0m Trial 153 finished with value: 198.81624053788917 and parameters: {'depth': 14, 'learning_rate': 0.01327093337448136, 'iterations': 1118, 'l2_leaf_reg': 2.525527092405177e-06, 'border_count': 11, 'bagging_temperature': 0.048086632027581594, 'random_strength': 1.9780554880276031, 'grow_policy': 'Lossguide', 'min_data_in_leaf': 642, 'max_leaves': 108}. Best is trial 77 with value: 171.4904345158229.[0m
[32m[I 2024-10-13 11:32:31,826][0m Trial 154 finished with value: 198.5257400128055 and parameters: {'depth': 13, 'learning_rate': 0.0156823723896619, 'iterations': 1359, 'l2_leaf_reg': 1.2559040563466207e-06, 'border_count': 16, 'bagging_temperature': 0.017752175882372063, 'random_strength': 1.4043311386804889, 'grow_policy': 'Lossguide', 'min_data_in_leaf': 623, 'max_leaves': 89}. Best is trial 77 with value: 171.4904345158229.[0m
[32m[I 2024-10-13 11:32:33,440][0m Trial 155 finished with value: 172.98189087180458 and parameters: {'depth': 13, 'learning_rate': 0.011679672395235688, 'iterations': 1438, 'l2_leaf_reg': 1.8292424287179728e-06, 'border_count': 8, 'bagging_temperature': 0.07366762505572695, 'random_strength': 0.6939116177851465, 'grow_policy': 'Lossguide', 'min_data_in_leaf': 589, 'max_leaves': 117}. Best is trial 77 with value: 171.4904345158229.[0m
[32m[I 2024-10-13 11:32:35,063][0m Trial 156 finished with value: 253.543878596687 and parameters: {'depth': 13, 'learning_rate': 0.01964234889068091, 'iterations': 1454, 'l2_leaf_reg': 1.5135579371409416e-06, 'border_count': 1, 'bagging_temperature': 0.07370888248194184, 'random_strength': 1.0887946629055296, 'grow_policy': 'Lossguide', 'min_data_in_leaf': 597, 'max_leaves': 118}. Best is trial 77 with value: 171.4904345158229.[0m
[32m[I 2024-10-13 11:32:36,681][0m Trial 157 finished with value: 218.71256210704578 and parameters: {'depth': 14, 'learning_rate': 0.015970290497985377, 'iterations': 1433, 'l2_leaf_reg': 8.680602055195948e-07, 'border_count': 21, 'bagging_temperature': 0.10321893172664123, 'random_strength': 0.33054617874991943, 'grow_policy': 'Lossguide', 'min_data_in_leaf': 586, 'max_leaves': 103}. Best is trial 77 with value: 171.4904345158229.[0m
[32m[I 2024-10-13 11:32:38,277][0m Trial 158 finished with value: 200.3948566866751 and parameters: {'depth': 13, 'learning_rate': 0.013146552682230745, 'iterations': 1365, 'l2_leaf_reg': 3.041800497564451e-07, 'border_count': 11, 'bagging_temperature': 0.1204022875732049, 'random_strength': 0.9596570132986063, 'grow_policy': 'Lossguide', 'min_data_in_leaf': 522, 'max_leaves': 135}. Best is trial 77 with value: 171.4904345158229.[0m
[32m[I 2024-10-13 11:32:39,924][0m Trial 159 finished with value: 172.6629632210875 and parameters: {'depth': 15, 'learning_rate': 0.01145386773855401, 'iterations': 1416, 'l2_leaf_reg': 2.0249677633119908e-06, 'border_count': 8, 'bagging_temperature': 0.05123867534813413, 'random_strength': 1.4609105230466688, 'grow_policy': 'Lossguide', 'min_data_in_leaf': 656, 'max_leaves': 95}. Best is trial 77 with value: 171.4904345158229.[0m
[32m[I 2024-10-13 11:32:41,660][0m Trial 160 finished with value: 203.5784290562859 and parameters: {'depth': 14, 'learning_rate': 0.022011493912454314, 'iterations': 1508, 'l2_leaf_reg': 2.0363895450007058e-06, 'border_count': 16, 'bagging_temperature': 0.04835687298811674, 'random_strength': 2.5643202231161615, 'grow_policy': 'Lossguide', 'min_data_in_leaf': 669, 'max_leaves': 93}. Best is trial 77 with value: 171.4904345158229.[0m
[32m[I 2024-10-13 11:32:43,192][0m Trial 161 finished with value: 173.3324896764037 and parameters: {'depth': 13, 'learning_rate': 0.011168267288441006, 'iterations': 1345, 'l2_leaf_reg': 3.2321638650815047e-06, 'border_count': 8, 'bagging_temperature': 0.07153825937949343, 'random_strength': 0.6590737545100352, 'grow_policy': 'Lossguide', 'min_data_in_leaf': 615, 'max_leaves': 111}. Best is trial 77 with value: 171.4904345158229.[0m
[32m[I 2024-10-13 11:32:44,715][0m Trial 162 finished with value: 193.29461513721313 and parameters: {'depth': 15, 'learning_rate': 0.008753227626288787, 'iterations': 1338, 'l2_leaf_reg': 2.976381668899274e-06, 'border_count': 10, 'bagging_temperature': 0.0900615299983695, 'random_strength': 1.2586620083023738, 'grow_policy': 'Lossguide', 'min_data_in_leaf': 655, 'max_leaves': 100}. Best is trial 77 with value: 171.4904345158229.[0m
[32m[I 2024-10-13 11:32:46,287][0m Trial 163 finished with value: 174.35319038709255 and parameters: {'depth': 12, 'learning_rate': 0.011071462022434229, 'iterations': 1406, 'l2_leaf_reg': 4.384782570952449e-06, 'border_count': 7, 'bagging_temperature': 0.057249746429853074, 'random_strength': 1.5135951247351347, 'grow_policy': 'Lossguide', 'min_data_in_leaf': 621, 'max_leaves': 56}. Best is trial 77 with value: 171.4904345158229.[0m
[32m[I 2024-10-13 11:32:47,687][0m Trial 164 finished with value: 206.10511420598763 and parameters: {'depth': 15, 'learning_rate': 0.016760834825086293, 'iterations': 1172, 'l2_leaf_reg': 1.1177620067559483e-06, 'border_count': 14, 'bagging_temperature': 0.03155543750840752, 'random_strength': 0.6543640467747796, 'grow_policy': 'Lossguide', 'min_data_in_leaf': 548, 'max_leaves': 78}. Best is trial 77 with value: 171.4904345158229.[0m
[32m[I 2024-10-13 11:32:49,307][0m Trial 165 finished with value: 253.3220828640003 and parameters: {'depth': 13, 'learning_rate': 0.014804413876011809, 'iterations': 1485, 'l2_leaf_reg': 1.9145906518243497e-06, 'border_count': 1, 'bagging_temperature': 0.10270437501075275, 'random_strength': 0.4348706521713746, 'grow_policy': 'Lossguide', 'min_data_in_leaf': 583, 'max_leaves': 122}. Best is trial 77 with value: 171.4904345158229.[0m
[32m[I 2024-10-13 11:32:50,797][0m Trial 166 finished with value: 215.81996186085954 and parameters: {'depth': 14, 'learning_rate': 0.01925843902136799, 'iterations': 1285, 'l2_leaf_reg': 2.9611904284678067e-06, 'border_count': 22, 'bagging_temperature': 0.0016614711964774345, 'random_strength': 2.3351517141256513, 'grow_policy': 'Lossguide', 'min_data_in_leaf': 653, 'max_leaves': 253}. Best is trial 77 with value: 171.4904345158229.[0m
[32m[I 2024-10-13 11:32:52,528][0m Trial 167 finished with value: 179.25145344456314 and parameters: {'depth': 12, 'learning_rate': 0.028147700875497637, 'iterations': 1553, 'l2_leaf_reg': 1.230762458918867e-06, 'border_count': 9, 'bagging_temperature': 0.07404251658465127, 'random_strength': 0.7165013493937852, 'grow_policy': 'Lossguide', 'min_data_in_leaf': 632, 'max_leaves': 108}. Best is trial 77 with value: 171.4904345158229.[0m
[32m[I 2024-10-13 11:32:54,505][0m Trial 168 finished with value: 198.61640348960884 and parameters: {'depth': 12, 'learning_rate': 0.010162453260363313, 'iterations': 2022, 'l2_leaf_reg': 1.8839809031024969e-06, 'border_count': 18, 'bagging_temperature': 0.14270781711323324, 'random_strength': 0.26049592166884433, 'grow_policy': 'Lossguide', 'min_data_in_leaf': 507, 'max_leaves': 120}. Best is trial 77 with value: 171.4904345158229.[0m
[32m[I 2024-10-13 11:32:55,984][0m Trial 169 finished with value: 173.02149741497303 and parameters: {'depth': 13, 'learning_rate': 0.024268625687014343, 'iterations': 1263, 'l2_leaf_reg': 7.468348635407373e-07, 'border_count': 5, 'bagging_temperature': 0.12070553075392984, 'random_strength': 4.021615179898268, 'grow_policy': 'Lossguide', 'min_data_in_leaf': 606, 'max_leaves': 216}. Best is trial 77 with value: 171.4904345158229.[0m
[32m[I 2024-10-13 11:32:57,427][0m Trial 170 finished with value: 253.21529687505912 and parameters: {'depth': 13, 'learning_rate': 0.014206700480588327, 'iterations': 1206, 'l2_leaf_reg': 4.1504319555061063e-07, 'border_count': 1, 'bagging_temperature': 0.12357127069434726, 'random_strength': 1.4102319659745852, 'grow_policy': 'Lossguide', 'min_data_in_leaf': 723, 'max_leaves': 214}. Best is trial 77 with value: 171.4904345158229.[0m
[32m[I 2024-10-13 11:32:58,962][0m Trial 171 finished with value: 172.45798761298005 and parameters: {'depth': 14, 'learning_rate': 0.024864021508663528, 'iterations': 1290, 'l2_leaf_reg': 8.266469235756784e-07, 'border_count': 5, 'bagging_temperature': 0.08621665235369472, 'random_strength': 4.145394883247344, 'grow_policy': 'Lossguide', 'min_data_in_leaf': 601, 'max_leaves': 239}. Best is trial 77 with value: 171.4904345158229.[0m
[32m[I 2024-10-13 11:33:00,381][0m Trial 172 finished with value: 203.22728842661306 and parameters: {'depth': 14, 'learning_rate': 0.017689346440368067, 'iterations': 1255, 'l2_leaf_reg': 7.233708310708776e-07, 'border_count': 11, 'bagging_temperature': 0.061127169214887894, 'random_strength': 3.9686871075016907, 'grow_policy': 'Lossguide', 'min_data_in_leaf': 601, 'max_leaves': 226}. Best is trial 77 with value: 171.4904345158229.[0m
[32m[I 2024-10-13 11:33:01,916][0m Trial 173 finished with value: 174.69194688305873 and parameters: {'depth': 15, 'learning_rate': 0.034560059058377196, 'iterations': 1331, 'l2_leaf_reg': 2.258773966254933e-07, 'border_count': 6, 'bagging_temperature': 0.08803320872928244, 'random_strength': 1.1041374407175018, 'grow_policy': 'Lossguide', 'min_data_in_leaf': 617, 'max_leaves': 245}. Best is trial 77 with value: 171.4904345158229.[0m
[32m[I 2024-10-13 11:33:03,534][0m Trial 174 finished with value: 211.640870425532 and parameters: {'depth': 13, 'learning_rate': 0.02276791057935031, 'iterations': 1406, 'l2_leaf_reg': 3.3825515767832663e-06, 'border_count': 14, 'bagging_temperature': 0.05194711499587554, 'random_strength': 1.5752781114626524, 'grow_policy': 'Lossguide', 'min_data_in_leaf': 664, 'max_leaves': 239}. Best is trial 77 with value: 171.4904345158229.[0m
[32m[I 2024-10-13 11:33:04,866][0m Trial 175 finished with value: 174.15879795509213 and parameters: {'depth': 13, 'learning_rate': 0.020134475695204535, 'iterations': 1094, 'l2_leaf_reg': 6.057315826337307e-07, 'border_count': 6, 'bagging_temperature': 0.10628420155797899, 'random_strength': 4.389173117767646, 'grow_policy': 'Lossguide', 'min_data_in_leaf': 593, 'max_leaves': 207}. Best is trial 77 with value: 171.4904345158229.[0m
[32m[I 2024-10-13 11:33:06,293][0m Trial 176 finished with value: 199.35010336492064 and parameters: {'depth': 14, 'learning_rate': 0.011839211443820403, 'iterations': 1279, 'l2_leaf_reg': 1.6990238887914225e-06, 'border_count': 11, 'bagging_temperature': 0.02464815579861421, 'random_strength': 9.851181813291712, 'grow_policy': 'Lossguide', 'min_data_in_leaf': 898, 'max_leaves': 228}. Best is trial 77 with value: 171.4904345158229.[0m
[32m[I 2024-10-13 11:33:07,669][0m Trial 177 finished with value: 196.91437576584462 and parameters: {'depth': 15, 'learning_rate': 0.015779691400754466, 'iterations': 1189, 'l2_leaf_reg': 9.788604218242263e-07, 'border_count': 19, 'bagging_temperature': 0.07796450497720543, 'random_strength': 3.5846880396044565, 'grow_policy': 'Lossguide', 'min_data_in_leaf': 641, 'max_leaves': 128}. Best is trial 77 with value: 171.4904345158229.[0m
[32m[I 2024-10-13 11:33:09,212][0m Trial 178 finished with value: 264.13668216389516 and parameters: {'depth': 14, 'learning_rate': 0.02751896580358714, 'iterations': 1349, 'l2_leaf_reg': 3.772475157289763e-07, 'border_count': 105, 'bagging_temperature': 0.04245831056278484, 'random_strength': 2.0709797492981568, 'grow_policy': 'Lossguide', 'min_data_in_leaf': 693, 'max_leaves': 107}. Best is trial 77 with value: 171.4904345158229.[0m
[32m[I 2024-10-13 11:33:10,831][0m Trial 179 finished with value: 260.88752714244407 and parameters: {'depth': 13, 'learning_rate': 0.023576485335659758, 'iterations': 1479, 'l2_leaf_reg': 4.916798537487208e-06, 'border_count': 122, 'bagging_temperature': 0.1227289121947595, 'random_strength': 3.8076423243684, 'grow_policy': 'Lossguide', 'min_data_in_leaf': 576, 'max_leaves': 234}. Best is trial 77 with value: 171.4904345158229.[0m
[32m[I 2024-10-13 11:33:13,045][0m Trial 180 finished with value: 253.37873078636605 and parameters: {'depth': 13, 'learning_rate': 0.007907682863901788, 'iterations': 2309, 'l2_leaf_reg': 2.508132656244976e-06, 'border_count': 1, 'bagging_temperature': 0.09022877272076103, 'random_strength': 4.852484207011695, 'grow_policy': 'Lossguide', 'min_data_in_leaf': 618, 'max_leaves': 137}. Best is trial 77 with value: 171.4904345158229.[0m
[32m[I 2024-10-13 11:33:14,651][0m Trial 181 finished with value: 173.62502033179058 and parameters: {'depth': 12, 'learning_rate': 0.025165966308907953, 'iterations': 1415, 'l2_leaf_reg': 1.0586114426140656e-06, 'border_count': 5, 'bagging_temperature': 0.15264005778399875, 'random_strength': 4.099843632156152, 'grow_policy': 'Lossguide', 'min_data_in_leaf': 553, 'max_leaves': 97}. Best is trial 77 with value: 171.4904345158229.[0m
[32m[I 2024-10-13 11:33:16,210][0m Trial 182 finished with value: 174.54282309870743 and parameters: {'depth': 12, 'learning_rate': 0.01841127990792953, 'iterations': 1395, 'l2_leaf_reg': 1.378780832602322e-06, 'border_count': 6, 'bagging_temperature': 0.1550547785714358, 'random_strength': 4.118193894530036, 'grow_policy': 'Lossguide', 'min_data_in_leaf': 537, 'max_leaves': 93}. Best is trial 77 with value: 171.4904345158229.[0m
[32m[I 2024-10-13 11:33:17,685][0m Trial 183 finished with value: 205.78904305767708 and parameters: {'depth': 13, 'learning_rate': 0.013871621191376584, 'iterations': 1284, 'l2_leaf_reg': 7.741762991155661e-07, 'border_count': 13, 'bagging_temperature': 0.06338651696848485, 'random_strength': 3.87200563968178, 'grow_policy': 'Lossguide', 'min_data_in_leaf': 557, 'max_leaves': 82}. Best is trial 77 with value: 171.4904345158229.[0m
[32m[I 2024-10-13 11:33:19,304][0m Trial 184 finished with value: 177.39492871697482 and parameters: {'depth': 14, 'learning_rate': 0.030751511983946427, 'iterations': 1452, 'l2_leaf_reg': 5.005844865325209e-07, 'border_count': 8, 'bagging_temperature': 0.6980951592827882, 'random_strength': 4.355460084986687, 'grow_policy': 'Lossguide', 'min_data_in_leaf': 584, 'max_leaves': 221}. Best is trial 77 with value: 171.4904345158229.[0m
[32m[I 2024-10-13 11:33:21,451][0m Trial 185 finished with value: 173.33976228997653 and parameters: {'depth': 12, 'learning_rate': 0.02093152507780973, 'iterations': 2233, 'l2_leaf_reg': 2.0053320780485644e-06, 'border_count': 5, 'bagging_temperature': 0.10576353171840693, 'random_strength': 1.0170047642427147, 'grow_policy': 'Lossguide', 'min_data_in_leaf': 642, 'max_leaves': 114}. Best is trial 77 with value: 171.4904345158229.[0m
[32m[I 2024-10-13 11:33:22,947][0m Trial 186 finished with value: 253.59660213010542 and parameters: {'depth': 12, 'learning_rate': 0.021156042021622704, 'iterations': 1323, 'l2_leaf_reg': 2.1551983763396845e-06, 'border_count': 1, 'bagging_temperature': 0.07954272012329765, 'random_strength': 1.0509946593625115, 'grow_policy': 'Lossguide', 'min_data_in_leaf': 651, 'max_leaves': 115}. Best is trial 77 with value: 171.4904345158229.[0m
[32m[I 2024-10-13 11:33:24,582][0m Trial 187 finished with value: 214.78750907568156 and parameters: {'depth': 12, 'learning_rate': 0.02491293644350655, 'iterations': 1511, 'l2_leaf_reg': 5.8509246669523705e-06, 'border_count': 14, 'bagging_temperature': 0.09976830014751198, 'random_strength': 0.7763338678535847, 'grow_policy': 'Lossguide', 'min_data_in_leaf': 674, 'max_leaves': 100}. Best is trial 77 with value: 171.4904345158229.[0m
[32m[I 2024-10-13 11:33:26,133][0m Trial 188 finished with value: 179.22070161880555 and parameters: {'depth': 12, 'learning_rate': 0.03657947633608272, 'iterations': 1418, 'l2_leaf_reg': 2.924819564984994e-06, 'border_count': 5, 'bagging_temperature': 0.8540143655630142, 'random_strength': 1.1865957538896308, 'grow_policy': 'Lossguide', 'min_data_in_leaf': 631, 'max_leaves': 113}. Best is trial 77 with value: 171.4904345158229.[0m
[32m[I 2024-10-13 11:33:28,083][0m Trial 189 finished with value: 202.5749338288484 and parameters: {'depth': 12, 'learning_rate': 0.016130039024400945, 'iterations': 1955, 'l2_leaf_reg': 1.5353921954137249e-06, 'border_count': 18, 'bagging_temperature': 0.038063529734073405, 'random_strength': 6.787391618669283, 'grow_policy': 'Lossguide', 'min_data_in_leaf': 600, 'max_leaves': 194}. Best is trial 77 with value: 171.4904345158229.[0m
[32m[I 2024-10-13 11:33:29,501][0m Trial 190 finished with value: 198.90824228803865 and parameters: {'depth': 13, 'learning_rate': 0.01185851839243592, 'iterations': 1237, 'l2_leaf_reg': 3.6523197355023937e-06, 'border_count': 11, 'bagging_temperature': 0.0172506788075239, 'random_strength': 9.99408864740153, 'grow_policy': 'Lossguide', 'min_data_in_leaf': 617, 'max_leaves': 127}. Best is trial 77 with value: 171.4904345158229.[0m
[32m[I 2024-10-13 11:33:31,617][0m Trial 191 finished with value: 174.8170153195337 and parameters: {'depth': 13, 'learning_rate': 0.018042365170805364, 'iterations': 2215, 'l2_leaf_reg': 1.0304283579147473e-06, 'border_count': 6, 'bagging_temperature': 0.13911828559935444, 'random_strength': 4.1536383233675505, 'grow_policy': 'Lossguide', 'min_data_in_leaf': 552, 'max_leaves': 149}. Best is trial 77 with value: 171.4904345158229.[0m
[32m[I 2024-10-13 11:33:33,771][0m Trial 192 finished with value: 181.24124733733797 and parameters: {'depth': 11, 'learning_rate': 0.020424209098899745, 'iterations': 2138, 'l2_leaf_reg': 8.195848022157418e-07, 'border_count': 9, 'bagging_temperature': 0.11891960252456166, 'random_strength': 1.6362788897286462, 'grow_policy': 'Lossguide', 'min_data_in_leaf': 646, 'max_leaves': 96}. Best is trial 77 with value: 171.4904345158229.[0m
[32m[I 2024-10-13 11:33:36,062][0m Trial 193 finished with value: 197.94682676481804 and parameters: {'depth': 12, 'learning_rate': 0.02497456960964074, 'iterations': 2431, 'l2_leaf_reg': 1.3746035421559765e-06, 'border_count': 4, 'bagging_temperature': 0.0676129035690328, 'random_strength': 2.8744426238311966, 'grow_policy': 'Lossguide', 'min_data_in_leaf': 153, 'max_leaves': 118}. Best is trial 77 with value: 171.4904345158229.[0m
[32m[I 2024-10-13 11:33:38,219][0m Trial 194 finished with value: 210.12020123112043 and parameters: {'depth': 11, 'learning_rate': 0.014182506320457419, 'iterations': 2273, 'l2_leaf_reg': 3.0295019166452943e-07, 'border_count': 15, 'bagging_temperature': 0.1029303718598798, 'random_strength': 1.3030459463092976, 'grow_policy': 'Lossguide', 'min_data_in_leaf': 522, 'max_leaves': 105}. Best is trial 77 with value: 171.4904345158229.[0m
[32m[I 2024-10-13 11:33:40,287][0m Trial 195 finished with value: 255.65683378606687 and parameters: {'depth': 12, 'learning_rate': 0.02913237805293956, 'iterations': 2076, 'l2_leaf_reg': 2.1771147602358576e-06, 'border_count': 1, 'bagging_temperature': 0.05598823864339066, 'random_strength': 0.9344280340029705, 'grow_policy': 'Lossguide', 'min_data_in_leaf': 570, 'max_leaves': 88}. Best is trial 77 with value: 171.4904345158229.[0m
[32m[I 2024-10-13 11:33:41,876][0m Trial 196 finished with value: 200.26677631059832 and parameters: {'depth': 15, 'learning_rate': 0.016776268085464934, 'iterations': 1354, 'l2_leaf_reg': 7.248115935338235e-07, 'border_count': 10, 'bagging_temperature': 0.08536568115594065, 'random_strength': 5.698214875874001, 'grow_policy': 'Depthwise', 'min_data_in_leaf': 607}. Best is trial 77 with value: 171.4904345158229.[0m
[32m[I 2024-10-13 11:33:44,032][0m Trial 197 finished with value: 207.67278156637292 and parameters: {'depth': 14, 'learning_rate': 0.009677649172546456, 'iterations': 2190, 'l2_leaf_reg': 1.4890075460117764e-07, 'border_count': 26, 'bagging_temperature': 0.04209906909571112, 'random_strength': 3.2476942022921143, 'grow_policy': 'Lossguide', 'min_data_in_leaf': 683, 'max_leaves': 110}. Best is trial 77 with value: 171.4904345158229.[0m
[32m[I 2024-10-13 11:33:45,436][0m Trial 198 finished with value: 182.4879832382063 and parameters: {'depth': 9, 'learning_rate': 0.021933820262981622, 'iterations': 1146, 'l2_leaf_reg': 0.011775472018641311, 'border_count': 9, 'bagging_temperature': 0.13064804513516567, 'random_strength': 4.6418377954949905, 'grow_policy': 'Depthwise', 'min_data_in_leaf': 590}. Best is trial 77 with value: 171.4904345158229.[0m
[32m[I 2024-10-13 11:33:46,996][0m Trial 199 finished with value: 197.04167020892714 and parameters: {'depth': 13, 'learning_rate': 0.012316137994095035, 'iterations': 1407, 'l2_leaf_reg': 5.217741643549407e-07, 'border_count': 18, 'bagging_temperature': 0.10974334936059689, 'random_strength': 3.6970278492187965, 'grow_policy': 'Lossguide', 'min_data_in_leaf': 497, 'max_leaves': 71}. Best is trial 77 with value: 171.4904345158229.[0m
[32m[I 2024-10-13 11:33:48,800][0m Trial 200 finished with value: 172.4026422824891 and parameters: {'depth': 9, 'learning_rate': 0.0194986518606152, 'iterations': 1565, 'l2_leaf_reg': 1.2061483553920352e-06, 'border_count': 5, 'bagging_temperature': 0.07078003986676532, 'random_strength': 0.6654786035581252, 'grow_policy': 'Depthwise', 'min_data_in_leaf': 636}. Best is trial 77 with value: 171.4904345158229.[0m
[32m[I 2024-10-13 11:33:50,482][0m Trial 201 finished with value: 172.36752133117523 and parameters: {'depth': 3, 'learning_rate': 0.01803102193688869, 'iterations': 1497, 'l2_leaf_reg': 1.18713626493963e-06, 'border_count': 5, 'bagging_temperature': 0.0742540944081242, 'random_strength': 0.6535292708306734, 'grow_policy': 'Depthwise', 'min_data_in_leaf': 632}. Best is trial 77 with value: 171.4904345158229.[0m
[32m[I 2024-10-13 11:33:52,142][0m Trial 202 finished with value: 172.43035903384 and parameters: {'depth': 4, 'learning_rate': 0.01580121671364088, 'iterations': 1531, 'l2_leaf_reg': 1.7377881111348249e-06, 'border_count': 5, 'bagging_temperature': 0.07291865471268563, 'random_strength': 0.4657353206539222, 'grow_policy': 'Depthwise', 'min_data_in_leaf': 633}. Best is trial 77 with value: 171.4904345158229.[0m
