[32m[I 2024-10-13 13:43:02,667][0m Trial 101 finished with value: 87.04961717492873 and parameters: {'depth': 4, 'learning_rate': 0.010612277726825992, 'iterations': 1725, 'l2_leaf_reg': 1.1304664120706903e-05, 'border_count': 42, 'bagging_temperature': 0.4141698416854716, 'random_strength': 1.4300657837915831, 'grow_policy': 'Lossguide', 'min_data_in_leaf': 381, 'max_leaves': 119}. Best is trial 93 with value: 81.66708072018007.[0m
[32m[I 2024-10-13 13:43:04,675][0m Trial 102 finished with value: 85.66543605779931 and parameters: {'depth': 4, 'learning_rate': 0.006147782844736484, 'iterations': 1980, 'l2_leaf_reg': 2.8423531561072344e-06, 'border_count': 31, 'bagging_temperature': 0.49388244385973695, 'random_strength': 2.045676078862451, 'grow_policy': 'Lossguide', 'min_data_in_leaf': 419, 'max_leaves': 171}. Best is trial 93 with value: 81.66708072018007.[0m
[32m[I 2024-10-13 13:43:06,224][0m Trial 103 finished with value: 87.94823345200133 and parameters: {'depth': 3, 'learning_rate': 0.023060215449931164, 'iterations': 1330, 'l2_leaf_reg': 0.3792581277416952, 'border_count': 25, 'bagging_temperature': 0.46669452998006605, 'random_strength': 0.8400154594563274, 'grow_policy': 'Lossguide', 'min_data_in_leaf': 507, 'max_leaves': 94}. Best is trial 93 with value: 81.66708072018007.[0m
[32m[I 2024-10-13 13:43:08,112][0m Trial 104 finished with value: 98.01965280863635 and parameters: {'depth': 4, 'learning_rate': 0.01731059157948532, 'iterations': 1753, 'l2_leaf_reg': 2.900528034871621e-05, 'border_count': 52, 'bagging_temperature': 0.4039692496150521, 'random_strength': 1.5653204969227736, 'grow_policy': 'Lossguide', 'min_data_in_leaf': 215, 'max_leaves': 151}. Best is trial 93 with value: 81.66708072018007.[0m
[32m[I 2024-10-13 13:43:09,913][0m Trial 105 finished with value: 84.18891662008832 and parameters: {'depth': 3, 'learning_rate': 0.008597405841732617, 'iterations': 1659, 'l2_leaf_reg': 1.4660113637304936e-05, 'border_count': 40, 'bagging_temperature': 0.4342431418231336, 'random_strength': 1.8908376775144742, 'grow_policy': 'Lossguide', 'min_data_in_leaf': 488, 'max_leaves': 141}. Best is trial 93 with value: 81.66708072018007.[0m
[32m[I 2024-10-13 13:43:11,590][0m Trial 106 finished with value: 83.13650644492986 and parameters: {'depth': 3, 'learning_rate': 0.008088527510925293, 'iterations': 1551, 'l2_leaf_reg': 5.72038077465391e-06, 'border_count': 34, 'bagging_temperature': 0.4347755410116139, 'random_strength': 3.262926557595849, 'grow_policy': 'Lossguide', 'min_data_in_leaf': 491, 'max_leaves': 129}. Best is trial 93 with value: 81.66708072018007.[0m
[32m[I 2024-10-13 13:43:13,284][0m Trial 107 finished with value: 93.13498716718871 and parameters: {'depth': 3, 'learning_rate': 0.004792512098274615, 'iterations': 1559, 'l2_leaf_reg': 3.7677237895015153e-07, 'border_count': 21, 'bagging_temperature': 0.3401984708735744, 'random_strength': 3.1667390817541126, 'grow_policy': 'Lossguide', 'min_data_in_leaf': 530, 'max_leaves': 126}. Best is trial 93 with value: 81.66708072018007.[0m
[32m[I 2024-10-13 13:43:15,095][0m Trial 108 finished with value: 93.9395872364038 and parameters: {'depth': 3, 'learning_rate': 0.008273402075335745, 'iterations': 1653, 'l2_leaf_reg': 5.9323316201184074e-06, 'border_count': 15, 'bagging_temperature': 0.43638229628560055, 'random_strength': 4.41293588920491, 'grow_policy': 'Lossguide', 'min_data_in_leaf': 477, 'max_leaves': 144}. Best is trial 93 with value: 81.66708072018007.[0m
[32m[I 2024-10-13 13:43:17,130][0m Trial 109 finished with value: 90.22249684117979 and parameters: {'depth': 3, 'learning_rate': 0.0034157893849795667, 'iterations': 1856, 'l2_leaf_reg': 6.030464338740967e-05, 'border_count': 31, 'bagging_temperature': 0.36303075183401345, 'random_strength': 3.7136504339544043, 'grow_policy': 'Depthwise', 'min_data_in_leaf': 568}. Best is trial 93 with value: 81.66708072018007.[0m
[32m[I 2024-10-13 13:43:18,808][0m Trial 110 finished with value: 83.69917488811424 and parameters: {'depth': 4, 'learning_rate': 0.007029053650712388, 'iterations': 1447, 'l2_leaf_reg': 6.797991399499357e-07, 'border_count': 38, 'bagging_temperature': 0.1245610702700426, 'random_strength': 3.7823454861996355, 'grow_policy': 'Lossguide', 'min_data_in_leaf': 491, 'max_leaves': 138}. Best is trial 93 with value: 81.66708072018007.[0m
[32m[I 2024-10-13 13:43:20,433][0m Trial 111 finished with value: 104.49395308434401 and parameters: {'depth': 4, 'learning_rate': 0.0026443386941615824, 'iterations': 1433, 'l2_leaf_reg': 7.186836964260955e-07, 'border_count': 36, 'bagging_temperature': 0.036685587766869115, 'random_strength': 2.1951770537455793, 'grow_policy': 'Lossguide', 'min_data_in_leaf': 503, 'max_leaves': 138}. Best is trial 93 with value: 81.66708072018007.[0m
[32m[I 2024-10-13 13:43:21,926][0m Trial 112 finished with value: 87.24095446477196 and parameters: {'depth': 3, 'learning_rate': 0.007202083895739633, 'iterations': 1278, 'l2_leaf_reg': 1.6451249083284305e-06, 'border_count': 47, 'bagging_temperature': 0.24553217369577718, 'random_strength': 0.539212814240638, 'grow_policy': 'Lossguide', 'min_data_in_leaf': 454, 'max_leaves': 130}. Best is trial 93 with value: 81.66708072018007.[0m
[32m[I 2024-10-13 13:43:23,553][0m Trial 113 finished with value: 95.19674215580002 and parameters: {'depth': 5, 'learning_rate': 0.0040824210968216975, 'iterations': 1398, 'l2_leaf_reg': 1.0311892441648033e-06, 'border_count': 26, 'bagging_temperature': 0.15077868430888905, 'random_strength': 3.735136740464622, 'grow_policy': 'Lossguide', 'min_data_in_leaf': 496, 'max_leaves': 149}. Best is trial 93 with value: 81.66708072018007.[0m
[32m[I 2024-10-13 13:43:25,240][0m Trial 114 finished with value: 81.30722035004864 and parameters: {'depth': 4, 'learning_rate': 0.008847444402199103, 'iterations': 1535, 'l2_leaf_reg': 2.0553341588279803e-07, 'border_count': 34, 'bagging_temperature': 0.19413370882547942, 'random_strength': 3.378231679822953, 'grow_policy': 'Lossguide', 'min_data_in_leaf': 444, 'max_leaves': 141}. Best is trial 114 with value: 81.30722035004864.[0m
[32m[I 2024-10-13 13:43:26,952][0m Trial 115 finished with value: 82.01015508351989 and parameters: {'depth': 4, 'learning_rate': 0.012084929243859838, 'iterations': 1544, 'l2_leaf_reg': 2.142698420681934e-07, 'border_count': 37, 'bagging_temperature': 0.08821156170128702, 'random_strength': 4.793642663582668, 'grow_policy': 'Lossguide', 'min_data_in_leaf': 438, 'max_leaves': 142}. Best is trial 114 with value: 81.30722035004864.[0m
[32m[I 2024-10-13 13:43:28,702][0m Trial 116 finished with value: 93.53475508606832 and parameters: {'depth': 4, 'learning_rate': 0.012133829860506536, 'iterations': 1516, 'l2_leaf_reg': 2.0998666283712992e-07, 'border_count': 22, 'bagging_temperature': 0.05743803532106212, 'random_strength': 4.892932207513219, 'grow_policy': 'Lossguide', 'min_data_in_leaf': 442, 'max_leaves': 112}. Best is trial 114 with value: 81.30722035004864.[0m
[32m[I 2024-10-13 13:43:30,228][0m Trial 117 finished with value: 96.31885622342367 and parameters: {'depth': 4, 'learning_rate': 0.014623077783544129, 'iterations': 1367, 'l2_leaf_reg': 4.850530481167814e-08, 'border_count': 53, 'bagging_temperature': 0.09569133898077686, 'random_strength': 3.313424301658896, 'grow_policy': 'Lossguide', 'min_data_in_leaf': 397, 'max_leaves': 147}. Best is trial 114 with value: 81.30722035004864.[0m
[32m[I 2024-10-13 13:43:31,881][0m Trial 118 finished with value: 85.94538251751096 and parameters: {'depth': 5, 'learning_rate': 0.006018082023980468, 'iterations': 1463, 'l2_leaf_reg': 6.967185892320764e-08, 'border_count': 45, 'bagging_temperature': 0.12320747004379265, 'random_strength': 4.2764566572453315, 'grow_policy': 'Lossguide', 'min_data_in_leaf': 433, 'max_leaves': 154}. Best is trial 114 with value: 81.30722035004864.[0m
[32m[I 2024-10-13 13:43:33,692][0m Trial 119 finished with value: 85.37876897179277 and parameters: {'depth': 4, 'learning_rate': 0.005047891555065196, 'iterations': 1577, 'l2_leaf_reg': 2.4718970874398936e-08, 'border_count': 35, 'bagging_temperature': 0.15393001347045387, 'random_strength': 4.759504764614204, 'grow_policy': 'Lossguide', 'min_data_in_leaf': 522, 'max_leaves': 118}. Best is trial 114 with value: 81.30722035004864.[0m
[32m[I 2024-10-13 13:43:40,493][0m Trial 120 finished with value: 107.43136494473937 and parameters: {'depth': 6, 'learning_rate': 0.019086746753256643, 'iterations': 1205, 'l2_leaf_reg': 2.269138374492483e-07, 'border_count': 63, 'bagging_temperature': 0.18804402625465055, 'random_strength': 3.395936852840665, 'grow_policy': 'SymmetricTree', 'min_data_in_leaf': 625}. Best is trial 114 with value: 81.30722035004864.[0m
[32m[I 2024-10-13 13:43:42,313][0m Trial 121 finished with value: 82.88720170578749 and parameters: {'depth': 3, 'learning_rate': 0.009432223139791454, 'iterations': 1676, 'l2_leaf_reg': 4.530519813864384e-07, 'border_count': 39, 'bagging_temperature': 0.07660372019292826, 'random_strength': 3.8789238541769038, 'grow_policy': 'Lossguide', 'min_data_in_leaf': 484, 'max_leaves': 140}. Best is trial 114 with value: 81.30722035004864.[0m
[32m[I 2024-10-13 13:43:44,175][0m Trial 122 finished with value: 100.98265715014197 and parameters: {'depth': 4, 'learning_rate': 0.009695504240583824, 'iterations': 1704, 'l2_leaf_reg': 3.416725212266199e-07, 'border_count': 106, 'bagging_temperature': 0.005741760340286381, 'random_strength': 4.010075692518752, 'grow_policy': 'Lossguide', 'min_data_in_leaf': 668, 'max_leaves': 139}. Best is trial 114 with value: 81.30722035004864.[0m
[32m[I 2024-10-13 13:43:45,936][0m Trial 123 finished with value: 100.20596639189652 and parameters: {'depth': 7, 'learning_rate': 0.012326173802850213, 'iterations': 1623, 'l2_leaf_reg': 7.184472578401958e-07, 'border_count': 127, 'bagging_temperature': 0.07968077502810525, 'random_strength': 3.870684330723413, 'grow_policy': 'Lossguide', 'min_data_in_leaf': 542, 'max_leaves': 124}. Best is trial 114 with value: 81.30722035004864.[0m
[32m[I 2024-10-13 13:43:47,642][0m Trial 124 finished with value: 83.01290259320137 and parameters: {'depth': 3, 'learning_rate': 0.007116683723115625, 'iterations': 1542, 'l2_leaf_reg': 8.227030029709352e-08, 'border_count': 38, 'bagging_temperature': 0.12783852427316064, 'random_strength': 4.525706383813115, 'grow_policy': 'Lossguide', 'min_data_in_leaf': 466, 'max_leaves': 133}. Best is trial 114 with value: 81.30722035004864.[0m
[32m[I 2024-10-13 13:43:49,341][0m Trial 125 finished with value: 85.26589749434761 and parameters: {'depth': 4, 'learning_rate': 0.006305353231081304, 'iterations': 1524, 'l2_leaf_reg': 8.388147416078906e-08, 'border_count': 30, 'bagging_temperature': 0.10674105493907611, 'random_strength': 4.332087313289055, 'grow_policy': 'Lossguide', 'min_data_in_leaf': 597, 'max_leaves': 133}. Best is trial 114 with value: 81.30722035004864.[0m
[32m[I 2024-10-13 13:43:51,025][0m Trial 126 finished with value: 83.82344315222505 and parameters: {'depth': 4, 'learning_rate': 0.011221820592858818, 'iterations': 1464, 'l2_leaf_reg': 4.846873848273877e-07, 'border_count': 49, 'bagging_temperature': 0.18855789656259161, 'random_strength': 4.617388853830287, 'grow_policy': 'Lossguide', 'min_data_in_leaf': 464, 'max_leaves': 106}. Best is trial 114 with value: 81.30722035004864.[0m
[32m[I 2024-10-13 13:43:52,704][0m Trial 127 finished with value: 91.4506011574772 and parameters: {'depth': 3, 'learning_rate': 0.010158216248839494, 'iterations': 1439, 'l2_leaf_reg': 1.4204517098728287e-07, 'border_count': 17, 'bagging_temperature': 0.18326451899096796, 'random_strength': 4.575490819071796, 'grow_policy': 'Lossguide', 'min_data_in_leaf': 467, 'max_leaves': 97}. Best is trial 114 with value: 81.30722035004864.[0m
[32m[I 2024-10-13 13:43:54,256][0m Trial 128 finished with value: 83.20033357963806 and parameters: {'depth': 5, 'learning_rate': 0.014145527898125428, 'iterations': 1311, 'l2_leaf_reg': 1.495451346913437e-08, 'border_count': 50, 'bagging_temperature': 0.06542597279461573, 'random_strength': 5.592972394317482, 'grow_policy': 'Lossguide', 'min_data_in_leaf': 511, 'max_leaves': 102}. Best is trial 114 with value: 81.30722035004864.[0m
[32m[I 2024-10-13 13:43:55,795][0m Trial 129 finished with value: 80.56965157209301 and parameters: {'depth': 9, 'learning_rate': 0.014911888052632358, 'iterations': 1293, 'l2_leaf_reg': 1.116688549763415e-08, 'border_count': 24, 'bagging_temperature': 0.05641731427630322, 'random_strength': 6.211304460298116, 'grow_policy': 'Lossguide', 'min_data_in_leaf': 572, 'max_leaves': 111}. Best is trial 129 with value: 80.56965157209301.[0m
[32m[I 2024-10-13 13:43:57,217][0m Trial 130 finished with value: 118.36668648605509 and parameters: {'depth': 9, 'learning_rate': 0.01500088363790532, 'iterations': 1148, 'l2_leaf_reg': 3.646295044206244e-08, 'border_count': 9, 'bagging_temperature': 0.03820096799005726, 'random_strength': 6.179587296995749, 'grow_policy': 'Depthwise', 'min_data_in_leaf': 591}. Best is trial 129 with value: 80.56965157209301.[0m
[32m[I 2024-10-13 13:43:58,753][0m Trial 131 finished with value: 88.35782261881333 and parameters: {'depth': 3, 'learning_rate': 0.006976083921158437, 'iterations': 1294, 'l2_leaf_reg': 1.1489236849516086e-08, 'border_count': 25, 'bagging_temperature': 0.06419670037779479, 'random_strength': 5.638017593979897, 'grow_policy': 'Lossguide', 'min_data_in_leaf': 565, 'max_leaves': 113}. Best is trial 129 with value: 80.56965157209301.[0m
[32m[I 2024-10-13 13:44:00,104][0m Trial 132 finished with value: 83.21075829061121 and parameters: {'depth': 10, 'learning_rate': 0.023381181706806975, 'iterations': 1110, 'l2_leaf_reg': 1.7760259370915944e-08, 'border_count': 38, 'bagging_temperature': 0.12137538633103263, 'random_strength': 6.086046642598537, 'grow_policy': 'Lossguide', 'min_data_in_leaf': 514, 'max_leaves': 104}. Best is trial 129 with value: 80.56965157209301.[0m
[32m[I 2024-10-13 13:44:01,415][0m Trial 133 finished with value: 87.61149424959424 and parameters: {'depth': 11, 'learning_rate': 0.031657618995711304, 'iterations': 973, 'l2_leaf_reg': 2.4515185218362838e-08, 'border_count': 32, 'bagging_temperature': 0.09199339344138684, 'random_strength': 6.027352660515252, 'grow_policy': 'Lossguide', 'min_data_in_leaf': 519, 'max_leaves': 101}. Best is trial 129 with value: 80.56965157209301.[0m
[32m[I 2024-10-13 13:44:02,808][0m Trial 134 finished with value: 90.16831182048134 and parameters: {'depth': 10, 'learning_rate': 0.0245168195171097, 'iterations': 1083, 'l2_leaf_reg': 1.4002601853482383e-08, 'border_count': 27, 'bagging_temperature': 0.05612878631848399, 'random_strength': 6.444517154401463, 'grow_policy': 'Lossguide', 'min_data_in_leaf': 545, 'max_leaves': 107}. Best is trial 129 with value: 80.56965157209301.[0m
[32m[I 2024-10-13 13:44:03,960][0m Trial 135 finished with value: 83.25021092626159 and parameters: {'depth': 10, 'learning_rate': 0.01943115270424571, 'iterations': 812, 'l2_leaf_reg': 1.9389109310633932e-08, 'border_count': 46, 'bagging_temperature': 0.1415563846722648, 'random_strength': 5.5137157776271, 'grow_policy': 'Lossguide', 'min_data_in_leaf': 443, 'max_leaves': 90}. Best is trial 129 with value: 80.56965157209301.[0m
[32m[I 2024-10-13 13:44:05,155][0m Trial 136 finished with value: 98.37825106903622 and parameters: {'depth': 10, 'learning_rate': 0.017857936375768872, 'iterations': 804, 'l2_leaf_reg': 2.5588851366874507e-08, 'border_count': 159, 'bagging_temperature': 0.14764153625967633, 'random_strength': 5.1403303665991285, 'grow_policy': 'Lossguide', 'min_data_in_leaf': 575, 'max_leaves': 86}. Best is trial 129 with value: 80.56965157209301.[0m
[32m[I 2024-10-13 13:44:06,456][0m Trial 137 finished with value: 83.58345971376215 and parameters: {'depth': 10, 'learning_rate': 0.022721039815608236, 'iterations': 988, 'l2_leaf_reg': 6.940421446874005e-08, 'border_count': 45, 'bagging_temperature': 0.1090769049435319, 'random_strength': 5.499668481519217, 'grow_policy': 'Lossguide', 'min_data_in_leaf': 505, 'max_leaves': 80}. Best is trial 129 with value: 80.56965157209301.[0m
[32m[I 2024-10-13 13:44:07,693][0m Trial 138 finished with value: 95.74345587208653 and parameters: {'depth': 11, 'learning_rate': 0.019375438619113113, 'iterations': 854, 'l2_leaf_reg': 1.0067716919414022e-08, 'border_count': 57, 'bagging_temperature': 0.07282206721288795, 'random_strength': 7.041804877982512, 'grow_policy': 'Lossguide', 'min_data_in_leaf': 617, 'max_leaves': 91}. Best is trial 129 with value: 80.56965157209301.[0m
[32m[I 2024-10-13 13:44:08,795][0m Trial 139 finished with value: 93.75390041396439 and parameters: {'depth': 10, 'learning_rate': 0.013901058554019852, 'iterations': 710, 'l2_leaf_reg': 2.2426262916934023e-08, 'border_count': 19, 'bagging_temperature': 0.022211265819261854, 'random_strength': 5.9145166488272976, 'grow_policy': 'Lossguide', 'min_data_in_leaf': 444, 'max_leaves': 94}. Best is trial 129 with value: 80.56965157209301.[0m
[32m[I 2024-10-13 13:44:10,340][0m Trial 140 finished with value: 83.69468531191119 and parameters: {'depth': 9, 'learning_rate': 0.016410663113356667, 'iterations': 1204, 'l2_leaf_reg': 1.720346886682152e-08, 'border_count': 51, 'bagging_temperature': 0.17054091176109548, 'random_strength': 6.75132941369049, 'grow_policy': 'Lossguide', 'min_data_in_leaf': 480, 'max_leaves': 72}. Best is trial 129 with value: 80.56965157209301.[0m
[32m[I 2024-10-13 13:44:11,580][0m Trial 141 finished with value: 84.09332294914479 and parameters: {'depth': 9, 'learning_rate': 0.02305038468362968, 'iterations': 963, 'l2_leaf_reg': 4.611354908988499e-08, 'border_count': 43, 'bagging_temperature': 0.10330805419088818, 'random_strength': 5.384495676623949, 'grow_policy': 'Lossguide', 'min_data_in_leaf': 510, 'max_leaves': 76}. Best is trial 129 with value: 80.56965157209301.[0m
[32m[I 2024-10-13 13:44:12,901][0m Trial 142 finished with value: 83.80553141130973 and parameters: {'depth': 10, 'learning_rate': 0.037163440207408006, 'iterations': 1078, 'l2_leaf_reg': 1.0908406171891082e-07, 'border_count': 34, 'bagging_temperature': 0.12023554052781472, 'random_strength': 5.676329217167058, 'grow_policy': 'Lossguide', 'min_data_in_leaf': 553, 'max_leaves': 82}. Best is trial 129 with value: 80.56965157209301.[0m
[32m[I 2024-10-13 13:44:14,228][0m Trial 143 finished with value: 88.99032011532346 and parameters: {'depth': 11, 'learning_rate': 0.04896888820369534, 'iterations': 1067, 'l2_leaf_reg': 5.4458926681365903e-08, 'border_count': 45, 'bagging_temperature': 0.22568540556684857, 'random_strength': 5.0512457282062595, 'grow_policy': 'Lossguide', 'min_data_in_leaf': 530, 'max_leaves': 109}. Best is trial 129 with value: 80.56965157209301.[0m
[32m[I 2024-10-13 13:44:15,401][0m Trial 144 finished with value: 82.78774595599039 and parameters: {'depth': 9, 'learning_rate': 0.029309900402707922, 'iterations': 887, 'l2_leaf_reg': 2.2687101984370234e-07, 'border_count': 38, 'bagging_temperature': 0.08432697651144874, 'random_strength': 5.474905088731641, 'grow_policy': 'Lossguide', 'min_data_in_leaf': 491, 'max_leaves': 65}. Best is trial 129 with value: 80.56965157209301.[0m
[32m[I 2024-10-13 13:44:16,393][0m Trial 145 finished with value: 86.22012457314435 and parameters: {'depth': 8, 'learning_rate': 0.012219673973658344, 'iterations': 632, 'l2_leaf_reg': 2.7554431334272093e-07, 'border_count': 29, 'bagging_temperature': 0.08389326901103912, 'random_strength': 6.18993888613488, 'grow_policy': 'Lossguide', 'min_data_in_leaf': 431, 'max_leaves': 124}. Best is trial 129 with value: 80.56965157209301.[0m
[32m[I 2024-10-13 13:44:17,575][0m Trial 146 finished with value: 82.3352487034649 and parameters: {'depth': 8, 'learning_rate': 0.02830672119390503, 'iterations': 854, 'l2_leaf_reg': 3.2768405888340494e-08, 'border_count': 38, 'bagging_temperature': 0.04192624074682405, 'random_strength': 4.874127465763489, 'grow_policy': 'Lossguide', 'min_data_in_leaf': 493, 'max_leaves': 53}. Best is trial 129 with value: 80.56965157209301.[0m
[32m[I 2024-10-13 13:44:18,599][0m Trial 147 finished with value: 100.00314236160904 and parameters: {'depth': 9, 'learning_rate': 0.026482686273246684, 'iterations': 713, 'l2_leaf_reg': 1.7135483009869303e-08, 'border_count': 215, 'bagging_temperature': 0.04125594597764017, 'random_strength': 4.732510098074505, 'grow_policy': 'Lossguide', 'min_data_in_leaf': 477, 'max_leaves': 61}. Best is trial 129 with value: 80.56965157209301.[0m
[32m[I 2024-10-13 13:44:19,866][0m Trial 148 finished with value: 85.78848088310065 and parameters: {'depth': 8, 'learning_rate': 0.03478950126994997, 'iterations': 902, 'l2_leaf_reg': 3.302268166259222e-08, 'border_count': 39, 'bagging_temperature': 0.02353657245483936, 'random_strength': 4.927609106889662, 'grow_policy': 'Lossguide', 'min_data_in_leaf': 528, 'max_leaves': 46}. Best is trial 129 with value: 80.56965157209301.[0m
[32m[I 2024-10-13 13:44:25,030][0m Trial 149 finished with value: 87.28908777204401 and parameters: {'depth': 8, 'learning_rate': 0.05494554430817719, 'iterations': 860, 'l2_leaf_reg': 1.5652477291157358e-07, 'border_count': 22, 'bagging_temperature': 0.059268868689420315, 'random_strength': 5.564353387880489, 'grow_policy': 'SymmetricTree', 'min_data_in_leaf': 494}. Best is trial 129 with value: 80.56965157209301.[0m
[32m[I 2024-10-13 13:44:26,267][0m Trial 150 finished with value: 100.55520120332044 and parameters: {'depth': 9, 'learning_rate': 0.04407185876010495, 'iterations': 907, 'l2_leaf_reg': 9.887319495676644e-08, 'border_count': 70, 'bagging_temperature': 0.16080865832127605, 'random_strength': 5.894032138690684, 'grow_policy': 'Lossguide', 'min_data_in_leaf': 551, 'max_leaves': 49}. Best is trial 129 with value: 80.56965157209301.[0m
