[32m[I 2024-10-13 13:53:18,027][0m Trial 651 finished with value: 91.58306408799085 and parameters: {'depth': 5, 'learning_rate': 0.16957227335563232, 'iterations': 338, 'l2_leaf_reg': 0.2266074349698197, 'border_count': 32, 'bagging_temperature': 0.09988856477668341, 'random_strength': 9.43366307215416, 'grow_policy': 'Lossguide', 'min_data_in_leaf': 439, 'max_leaves': 132}. Best is trial 544 with value: 79.23314367466817.[0m
[32m[I 2024-10-13 13:53:20,637][0m Trial 652 finished with value: 91.27423521134317 and parameters: {'depth': 14, 'learning_rate': 0.1179947342191123, 'iterations': 2704, 'l2_leaf_reg': 5.6352428565593517e-08, 'border_count': 20, 'bagging_temperature': 0.07392251386664915, 'random_strength': 9.123999179562656, 'grow_policy': 'Lossguide', 'min_data_in_leaf': 512, 'max_leaves': 141}. Best is trial 544 with value: 79.23314367466817.[0m
[32m[I 2024-10-13 13:53:21,386][0m Trial 653 finished with value: 93.57007007190958 and parameters: {'depth': 6, 'learning_rate': 0.24630048249867711, 'iterations': 259, 'l2_leaf_reg': 2.9745225753503736e-08, 'border_count': 27, 'bagging_temperature': 0.1287279037100116, 'random_strength': 9.805715018908291, 'grow_policy': 'Lossguide', 'min_data_in_leaf': 531, 'max_leaves': 148}. Best is trial 544 with value: 79.23314367466817.[0m
[32m[I 2024-10-13 13:53:22,011][0m Trial 654 finished with value: 84.01813745725784 and parameters: {'depth': 7, 'learning_rate': 0.14029115902656566, 'iterations': 100, 'l2_leaf_reg': 1.0720258541634772e-08, 'border_count': 35, 'bagging_temperature': 0.9691907242075981, 'random_strength': 7.968181047617752, 'grow_policy': 'Lossguide', 'min_data_in_leaf': 472, 'max_leaves': 136}. Best is trial 544 with value: 79.23314367466817.[0m
[32m[I 2024-10-13 13:53:22,673][0m Trial 655 finished with value: 83.60045417330119 and parameters: {'depth': 7, 'learning_rate': 0.08785564761274232, 'iterations': 189, 'l2_leaf_reg': 0.02193675548734446, 'border_count': 24, 'bagging_temperature': 0.7245462865797916, 'random_strength': 9.609291485283732, 'grow_policy': 'Lossguide', 'min_data_in_leaf': 502, 'max_leaves': 110}. Best is trial 544 with value: 79.23314367466817.[0m
[32m[I 2024-10-13 13:53:23,394][0m Trial 656 finished with value: 91.59362081262334 and parameters: {'depth': 15, 'learning_rate': 0.07783437582488163, 'iterations': 222, 'l2_leaf_reg': 2.0413975285171593e-08, 'border_count': 17, 'bagging_temperature': 0.1788148358969723, 'random_strength': 9.202498454295393, 'grow_policy': 'Lossguide', 'min_data_in_leaf': 638, 'max_leaves': 127}. Best is trial 544 with value: 79.23314367466817.[0m
[32m[I 2024-10-13 13:53:24,181][0m Trial 657 finished with value: 85.7292060737542 and parameters: {'depth': 6, 'learning_rate': 0.10339476977204913, 'iterations': 342, 'l2_leaf_reg': 1.002402542920913e-08, 'border_count': 39, 'bagging_temperature': 0.09034396489597393, 'random_strength': 9.386355991015837, 'grow_policy': 'Lossguide', 'min_data_in_leaf': 695, 'max_leaves': 145}. Best is trial 544 with value: 79.23314367466817.[0m
[32m[I 2024-10-13 13:53:24,853][0m Trial 658 finished with value: 89.25899866991266 and parameters: {'depth': 14, 'learning_rate': 0.18542196034803096, 'iterations': 157, 'l2_leaf_reg': 7.541158728300087e-08, 'border_count': 30, 'bagging_temperature': 0.15724994672177722, 'random_strength': 8.87777776044858, 'grow_policy': 'Lossguide', 'min_data_in_leaf': 304, 'max_leaves': 154}. Best is trial 544 with value: 79.23314367466817.[0m
[32m[I 2024-10-13 13:53:25,615][0m Trial 659 finished with value: 88.5042969109307 and parameters: {'depth': 9, 'learning_rate': 0.12556007677826628, 'iterations': 277, 'l2_leaf_reg': 1.1711568365103615, 'border_count': 10, 'bagging_temperature': 0.049677245566378085, 'random_strength': 9.358663057929085, 'grow_policy': 'Lossguide', 'min_data_in_leaf': 424, 'max_leaves': 140}. Best is trial 544 with value: 79.23314367466817.[0m
[32m[I 2024-10-13 13:53:26,332][0m Trial 660 finished with value: 81.48365345489148 and parameters: {'depth': 8, 'learning_rate': 0.16527836263206283, 'iterations': 205, 'l2_leaf_reg': 3.684392741279279e-08, 'border_count': 23, 'bagging_temperature': 0.024686886157324117, 'random_strength': 9.609036422778095, 'grow_policy': 'Lossguide', 'min_data_in_leaf': 538, 'max_leaves': 149}. Best is trial 544 with value: 79.23314367466817.[0m
[32m[I 2024-10-13 13:53:26,990][0m Trial 661 finished with value: 89.47024314118329 and parameters: {'depth': 6, 'learning_rate': 0.218481339866824, 'iterations': 149, 'l2_leaf_reg': 1.9440536911986467e-08, 'border_count': 30, 'bagging_temperature': 0.11687570114635262, 'random_strength': 8.282738545845532, 'grow_policy': 'Lossguide', 'min_data_in_leaf': 377, 'max_leaves': 144}. Best is trial 544 with value: 79.23314367466817.[0m
[32m[I 2024-10-13 13:53:27,711][0m Trial 662 finished with value: 93.03632653475383 and parameters: {'depth': 9, 'learning_rate': 0.1461273255626703, 'iterations': 262, 'l2_leaf_reg': 2.292911434172904e-08, 'border_count': 19, 'bagging_temperature': 0.5804942700501186, 'random_strength': 9.835681252763338, 'grow_policy': 'Lossguide', 'min_data_in_leaf': 460, 'max_leaves': 134}. Best is trial 544 with value: 79.23314367466817.[0m
[32m[I 2024-10-13 13:53:28,511][0m Trial 663 finished with value: 85.38258643805099 and parameters: {'depth': 7, 'learning_rate': 0.09634421438613347, 'iterations': 331, 'l2_leaf_reg': 8.311872531801051e-06, 'border_count': 41, 'bagging_temperature': 0.1382252995654306, 'random_strength': 8.984460551552074, 'grow_policy': 'Lossguide', 'min_data_in_leaf': 799, 'max_leaves': 156}. Best is trial 544 with value: 79.23314367466817.[0m
[32m[I 2024-10-13 13:53:29,228][0m Trial 664 finished with value: 80.36013914800864 and parameters: {'depth': 14, 'learning_rate': 0.07630064253397861, 'iterations': 198, 'l2_leaf_reg': 4.71741575133379e-08, 'border_count': 34, 'bagging_temperature': 0.1885116266374102, 'random_strength': 9.32307163632065, 'grow_policy': 'Lossguide', 'min_data_in_leaf': 482, 'max_leaves': 103}. Best is trial 544 with value: 79.23314367466817.[0m
[32m[I 2024-10-13 13:53:29,886][0m Trial 665 finished with value: 86.87215694108977 and parameters: {'depth': 14, 'learning_rate': 0.0885368308731072, 'iterations': 157, 'l2_leaf_reg': 8.609644473610112e-08, 'border_count': 25, 'bagging_temperature': 0.18140493906389596, 'random_strength': 9.248718282904742, 'grow_policy': 'Lossguide', 'min_data_in_leaf': 442, 'max_leaves': 93}. Best is trial 544 with value: 79.23314367466817.[0m
[32m[I 2024-10-13 13:53:30,607][0m Trial 666 finished with value: 298.8307614785954 and parameters: {'depth': 15, 'learning_rate': 0.0006333940359989904, 'iterations': 223, 'l2_leaf_reg': 1.5582909323402465e-07, 'border_count': 32, 'bagging_temperature': 0.1636238182838519, 'random_strength': 9.99889471336652, 'grow_policy': 'Lossguide', 'min_data_in_leaf': 478, 'max_leaves': 102}. Best is trial 544 with value: 79.23314367466817.[0m
[32m[I 2024-10-13 13:53:31,860][0m Trial 667 finished with value: 93.31872468423813 and parameters: {'depth': 15, 'learning_rate': 0.1077271215308232, 'iterations': 901, 'l2_leaf_reg': 4.6191155808225755e-08, 'border_count': 14, 'bagging_temperature': 0.1716350317177594, 'random_strength': 9.432563452561471, 'grow_policy': 'Lossguide', 'min_data_in_leaf': 341, 'max_leaves': 95}. Best is trial 544 with value: 79.23314367466817.[0m
[32m[I 2024-10-13 13:53:32,465][0m Trial 668 finished with value: 100.78920398535139 and parameters: {'depth': 14, 'learning_rate': 0.2993680788127833, 'iterations': 102, 'l2_leaf_reg': 0.06679936065896475, 'border_count': 236, 'bagging_temperature': 0.18564569300364353, 'random_strength': 9.070981864694797, 'grow_policy': 'Lossguide', 'min_data_in_leaf': 415, 'max_leaves': 103}. Best is trial 544 with value: 79.23314367466817.[0m
[32m[I 2024-10-13 13:53:33,159][0m Trial 669 finished with value: 82.17735070689285 and parameters: {'depth': 14, 'learning_rate': 0.08585115040891814, 'iterations': 192, 'l2_leaf_reg': 5.659636074714746e-08, 'border_count': 36, 'bagging_temperature': 0.14771343361701092, 'random_strength': 9.533279578271213, 'grow_policy': 'Lossguide', 'min_data_in_leaf': 509, 'max_leaves': 116}. Best is trial 544 with value: 79.23314367466817.[0m
[32m[I 2024-10-13 13:53:33,818][0m Trial 670 finished with value: 88.4501324766053 and parameters: {'depth': 15, 'learning_rate': 0.08014090931236731, 'iterations': 159, 'l2_leaf_reg': 3.75386442246347e-08, 'border_count': 26, 'bagging_temperature': 0.18577924747626595, 'random_strength': 8.728595797656544, 'grow_policy': 'Lossguide', 'min_data_in_leaf': 454, 'max_leaves': 110}. Best is trial 544 with value: 79.23314367466817.[0m
[32m[I 2024-10-13 13:53:34,544][0m Trial 671 finished with value: 93.15222097972212 and parameters: {'depth': 14, 'learning_rate': 0.0771119160858629, 'iterations': 229, 'l2_leaf_reg': 3.017424208022961e-08, 'border_count': 18, 'bagging_temperature': 0.06730412599176208, 'random_strength': 9.260761012988425, 'grow_policy': 'Lossguide', 'min_data_in_leaf': 523, 'max_leaves': 98}. Best is trial 544 with value: 79.23314367466817.[0m
[32m[I 2024-10-13 13:53:40,291][0m Trial 672 finished with value: 104.4886382834302 and parameters: {'depth': 14, 'learning_rate': 0.11635090650810007, 'iterations': 150, 'l2_leaf_reg': 1.0012627116524932e-07, 'border_count': 29, 'bagging_temperature': 0.1286543054872011, 'random_strength': 9.654513488958914, 'grow_policy': 'SymmetricTree', 'min_data_in_leaf': 487}. Best is trial 544 with value: 79.23314367466817.[0m
[32m[I 2024-10-13 13:53:40,967][0m Trial 673 finished with value: 81.84901206834478 and parameters: {'depth': 6, 'learning_rate': 0.0753625529951109, 'iterations': 264, 'l2_leaf_reg': 1.5204940350309378e-08, 'border_count': 23, 'bagging_temperature': 0.15991167225131267, 'random_strength': 9.309570551572461, 'grow_policy': 'Lossguide', 'min_data_in_leaf': 550, 'max_leaves': 105}. Best is trial 544 with value: 79.23314367466817.[0m
[32m[I 2024-10-13 13:53:41,657][0m Trial 674 finished with value: 83.1637462607181 and parameters: {'depth': 15, 'learning_rate': 0.10546549252566174, 'iterations': 194, 'l2_leaf_reg': 5.8088211748874e-08, 'border_count': 41, 'bagging_temperature': 0.09760917140923736, 'random_strength': 9.085617873371199, 'grow_policy': 'Lossguide', 'min_data_in_leaf': 470, 'max_leaves': 108}. Best is trial 544 with value: 79.23314367466817.[0m
[32m[I 2024-10-13 13:53:42,259][0m Trial 675 finished with value: 171.31826997659152 and parameters: {'depth': 7, 'learning_rate': 0.07155229318033944, 'iterations': 101, 'l2_leaf_reg': 2.3115853045425112e-08, 'border_count': 4, 'bagging_temperature': 0.18927305418858414, 'random_strength': 9.761165570406986, 'grow_policy': 'Lossguide', 'min_data_in_leaf': 503, 'max_leaves': 112}. Best is trial 544 with value: 79.23314367466817.[0m
[32m[I 2024-10-13 13:53:42,995][0m Trial 676 finished with value: 80.87482213317196 and parameters: {'depth': 5, 'learning_rate': 0.09387469950190687, 'iterations': 247, 'l2_leaf_reg': 4.0081943124938345e-08, 'border_count': 34, 'bagging_temperature': 0.13898268807478703, 'random_strength': 8.569795764287878, 'grow_policy': 'Lossguide', 'min_data_in_leaf': 519, 'max_leaves': 131}. Best is trial 544 with value: 79.23314367466817.[0m
[32m[I 2024-10-13 13:53:43,730][0m Trial 677 finished with value: 86.79298081799064 and parameters: {'depth': 5, 'learning_rate': 0.12775671442699837, 'iterations': 188, 'l2_leaf_reg': 4.2983884198444724e-08, 'border_count': 33, 'bagging_temperature': 0.11542259058944287, 'random_strength': 8.670582225474494, 'grow_policy': 'Lossguide', 'min_data_in_leaf': 545, 'max_leaves': 123}. Best is trial 544 with value: 79.23314367466817.[0m
[32m[I 2024-10-13 13:53:44,380][0m Trial 678 finished with value: 92.46298893608076 and parameters: {'depth': 5, 'learning_rate': 0.09189222853436509, 'iterations': 151, 'l2_leaf_reg': 7.429535371572855e-08, 'border_count': 20, 'bagging_temperature': 0.12296221853590689, 'random_strength': 8.852305188266554, 'grow_policy': 'Lossguide', 'min_data_in_leaf': 525, 'max_leaves': 131}. Best is trial 544 with value: 79.23314367466817.[0m
[32m[I 2024-10-13 13:53:45,088][0m Trial 679 finished with value: 85.73218399898188 and parameters: {'depth': 7, 'learning_rate': 0.10245206799341602, 'iterations': 247, 'l2_leaf_reg': 3.724836844232657e-08, 'border_count': 29, 'bagging_temperature': 0.08687367797800702, 'random_strength': 8.553606671158699, 'grow_policy': 'Lossguide', 'min_data_in_leaf': 617, 'max_leaves': 99}. Best is trial 544 with value: 79.23314367466817.[0m
[32m[I 2024-10-13 13:53:45,815][0m Trial 680 finished with value: 91.6774917742273 and parameters: {'depth': 5, 'learning_rate': 0.15831354705036987, 'iterations': 198, 'l2_leaf_reg': 1.0551502193012814e-07, 'border_count': 12, 'bagging_temperature': 0.13935017224237728, 'random_strength': 8.774471924682345, 'grow_policy': 'Lossguide', 'min_data_in_leaf': 488, 'max_leaves': 128}. Best is trial 544 with value: 79.23314367466817.[0m
[32m[I 2024-10-13 13:53:46,460][0m Trial 681 finished with value: 81.54106716125494 and parameters: {'depth': 8, 'learning_rate': 0.11793008129404599, 'iterations': 142, 'l2_leaf_reg': 5.204421269660502e-08, 'border_count': 24, 'bagging_temperature': 0.10962447246131579, 'random_strength': 8.457387697463439, 'grow_policy': 'Lossguide', 'min_data_in_leaf': 438, 'max_leaves': 123}. Best is trial 544 with value: 79.23314367466817.[0m
[32m[I 2024-10-13 13:53:47,059][0m Trial 682 finished with value: 91.00623683141278 and parameters: {'depth': 5, 'learning_rate': 0.13172799643431504, 'iterations': 100, 'l2_leaf_reg': 2.3198956018430637e-08, 'border_count': 17, 'bagging_temperature': 0.14140220057532846, 'random_strength': 8.344493233399913, 'grow_policy': 'Lossguide', 'min_data_in_leaf': 559, 'max_leaves': 117}. Best is trial 544 with value: 79.23314367466817.[0m
[32m[I 2024-10-13 13:53:47,781][0m Trial 683 finished with value: 86.82816925139659 and parameters: {'depth': 4, 'learning_rate': 0.2006700735140376, 'iterations': 276, 'l2_leaf_reg': 1.45175701925033e-08, 'border_count': 34, 'bagging_temperature': 0.03885863992385301, 'random_strength': 9.00447802575987, 'grow_policy': 'Lossguide', 'min_data_in_leaf': 467, 'max_leaves': 126}. Best is trial 544 with value: 79.23314367466817.[0m
[32m[I 2024-10-13 13:53:48,495][0m Trial 684 finished with value: 88.44197525328494 and parameters: {'depth': 5, 'learning_rate': 0.09788674860054809, 'iterations': 230, 'l2_leaf_reg': 3.048237841530502e-08, 'border_count': 27, 'bagging_temperature': 0.07913975276771196, 'random_strength': 8.587874517843755, 'grow_policy': 'Lossguide', 'min_data_in_leaf': 863, 'max_leaves': 132}. Best is trial 544 with value: 79.23314367466817.[0m
[32m[I 2024-10-13 13:53:49,186][0m Trial 685 finished with value: 93.30092515886537 and parameters: {'depth': 5, 'learning_rate': 0.08538004305642134, 'iterations': 212, 'l2_leaf_reg': 6.57375967389608e-08, 'border_count': 22, 'bagging_temperature': 0.05798298821021205, 'random_strength': 8.894082163561103, 'grow_policy': 'Lossguide', 'min_data_in_leaf': 399, 'max_leaves': 102}. Best is trial 544 with value: 79.23314367466817.[0m
[32m[I 2024-10-13 13:53:49,837][0m Trial 686 finished with value: 85.64583772048772 and parameters: {'depth': 7, 'learning_rate': 0.24955733645124936, 'iterations': 158, 'l2_leaf_reg': 1.6096159945320243e-08, 'border_count': 30, 'bagging_temperature': 0.10039137921274507, 'random_strength': 8.144844541521303, 'grow_policy': 'Lossguide', 'min_data_in_leaf': 515, 'max_leaves': 120}. Best is trial 544 with value: 79.23314367466817.[0m
[32m[I 2024-10-13 13:53:50,598][0m Trial 687 finished with value: 90.01821819413553 and parameters: {'depth': 14, 'learning_rate': 0.29946060773869787, 'iterations': 296, 'l2_leaf_reg': 3.0245872657172653e-08, 'border_count': 36, 'bagging_temperature': 0.15685303399121642, 'random_strength': 9.417232198865419, 'grow_policy': 'Lossguide', 'min_data_in_leaf': 749, 'max_leaves': 90}. Best is trial 544 with value: 79.23314367466817.[0m
[32m[I 2024-10-13 13:53:51,207][0m Trial 688 finished with value: 291.8832121261322 and parameters: {'depth': 7, 'learning_rate': 0.001965152285463968, 'iterations': 101, 'l2_leaf_reg': 2.2374981227751725e-08, 'border_count': 16, 'bagging_temperature': 0.1256108061632803, 'random_strength': 2.0162083539335036, 'grow_policy': 'Lossguide', 'min_data_in_leaf': 317, 'max_leaves': 135}. Best is trial 544 with value: 79.23314367466817.[0m
[32m[I 2024-10-13 13:53:51,899][0m Trial 689 finished with value: 93.83972415018216 and parameters: {'depth': 5, 'learning_rate': 0.15023651037188618, 'iterations': 199, 'l2_leaf_reg': 1.0082055483112203e-08, 'border_count': 22, 'bagging_temperature': 0.021660732872112863, 'random_strength': 9.206695514261463, 'grow_policy': 'Lossguide', 'min_data_in_leaf': 773, 'max_leaves': 129}. Best is trial 544 with value: 79.23314367466817.[0m
[32m[I 2024-10-13 13:53:52,678][0m Trial 690 finished with value: 91.53206022371221 and parameters: {'depth': 8, 'learning_rate': 0.1111845756918388, 'iterations': 266, 'l2_leaf_reg': 3.604020075947678e-08, 'border_count': 27, 'bagging_temperature': 0.1409806803268806, 'random_strength': 9.549807844071605, 'grow_policy': 'Lossguide', 'min_data_in_leaf': 492, 'max_leaves': 107}. Best is trial 544 with value: 79.23314367466817.[0m
[32m[I 2024-10-13 13:53:53,332][0m Trial 691 finished with value: 99.52207850668898 and parameters: {'depth': 6, 'learning_rate': 0.08838974040261569, 'iterations': 157, 'l2_leaf_reg': 1.5861334689003002e-08, 'border_count': 207, 'bagging_temperature': 0.099585132685228, 'random_strength': 8.924303262191547, 'grow_policy': 'Lossguide', 'min_data_in_leaf': 535, 'max_leaves': 138}. Best is trial 544 with value: 79.23314367466817.[0m
[32m[I 2024-10-13 13:53:54,057][0m Trial 692 finished with value: 116.07819986137994 and parameters: {'depth': 14, 'learning_rate': 0.13600705134496807, 'iterations': 233, 'l2_leaf_reg': 9.147798196341454e-08, 'border_count': 9, 'bagging_temperature': 0.06450637423412427, 'random_strength': 9.778740642068906, 'grow_policy': 'Lossguide', 'min_data_in_leaf': 446, 'max_leaves': 138}. Best is trial 544 with value: 79.23314367466817.[0m
[32m[I 2024-10-13 13:53:55,294][0m Trial 693 finished with value: 108.05219869444151 and parameters: {'depth': 8, 'learning_rate': 0.19433772555791173, 'iterations': 307, 'l2_leaf_reg': 2.0906808031740788e-08, 'border_count': 33, 'bagging_temperature': 0.15378569971430045, 'random_strength': 9.413970486314167, 'grow_policy': 'SymmetricTree', 'min_data_in_leaf': 513}. Best is trial 544 with value: 79.23314367466817.[0m
[32m[I 2024-10-13 13:53:55,980][0m Trial 694 finished with value: 83.05592684913263 and parameters: {'depth': 7, 'learning_rate': 0.07807001660899245, 'iterations': 193, 'l2_leaf_reg': 4.250991513858448e-08, 'border_count': 42, 'bagging_temperature': 0.12149441883431755, 'random_strength': 9.997960146651632, 'grow_policy': 'Lossguide', 'min_data_in_leaf': 565, 'max_leaves': 131}. Best is trial 544 with value: 79.23314367466817.[0m
[32m[I 2024-10-13 13:53:56,703][0m Trial 695 finished with value: 98.62354153624823 and parameters: {'depth': 5, 'learning_rate': 0.11325589362947033, 'iterations': 157, 'l2_leaf_reg': 1.6630827513670585e-07, 'border_count': 64, 'bagging_temperature': 0.08490185999510189, 'random_strength': 9.267001808180215, 'grow_policy': 'Lossguide', 'min_data_in_leaf': 196, 'max_leaves': 141}. Best is trial 544 with value: 79.23314367466817.[0m
[32m[I 2024-10-13 13:53:57,439][0m Trial 696 finished with value: 93.78094568666562 and parameters: {'depth': 4, 'learning_rate': 0.17446332639486797, 'iterations': 241, 'l2_leaf_reg': 1.0314936075832244e-08, 'border_count': 19, 'bagging_temperature': 0.0388516260625258, 'random_strength': 8.560997195581066, 'grow_policy': 'Lossguide', 'min_data_in_leaf': 495, 'max_leaves': 114}. Best is trial 544 with value: 79.23314367466817.[0m
[32m[I 2024-10-13 13:53:58,209][0m Trial 697 finished with value: 97.33888174549367 and parameters: {'depth': 6, 'learning_rate': 0.09519182253704904, 'iterations': 315, 'l2_leaf_reg': 5.568062254098201e-08, 'border_count': 101, 'bagging_temperature': 0.6797627160168745, 'random_strength': 9.59319330800262, 'grow_policy': 'Lossguide', 'min_data_in_leaf': 542, 'max_leaves': 181}. Best is trial 544 with value: 79.23314367466817.[0m
[32m[I 2024-10-13 13:53:58,887][0m Trial 698 finished with value: 91.56044620433639 and parameters: {'depth': 9, 'learning_rate': 0.23827420659097112, 'iterations': 154, 'l2_leaf_reg': 1.713061550139325e-05, 'border_count': 27, 'bagging_temperature': 0.16835702201337932, 'random_strength': 9.436723712807073, 'grow_policy': 'Lossguide', 'min_data_in_leaf': 250, 'max_leaves': 135}. Best is trial 544 with value: 79.23314367466817.[0m
[32m[I 2024-10-13 13:53:59,502][0m Trial 699 finished with value: 83.0465662699598 and parameters: {'depth': 15, 'learning_rate': 0.13215669128993832, 'iterations': 102, 'l2_leaf_reg': 2.4491001163514034e-08, 'border_count': 37, 'bagging_temperature': 0.1297362252053072, 'random_strength': 9.128535080459182, 'grow_policy': 'Lossguide', 'min_data_in_leaf': 364, 'max_leaves': 127}. Best is trial 544 with value: 79.23314367466817.[0m
[32m[I 2024-10-13 13:54:00,239][0m Trial 700 finished with value: 80.51050217805933 and parameters: {'depth': 7, 'learning_rate': 0.07306447147318422, 'iterations': 265, 'l2_leaf_reg': 1.5327908840982793e-08, 'border_count': 23, 'bagging_temperature': 0.19378008360215856, 'random_strength': 9.74665009424037, 'grow_policy': 'Lossguide', 'min_data_in_leaf': 455, 'max_leaves': 141}. Best is trial 544 with value: 79.23314367466817.[0m
