[32m[I 2024-10-13 13:44:27,964][0m Trial 151 finished with value: 91.29921447094287 and parameters: {'depth': 9, 'learning_rate': 0.028578704760290063, 'iterations': 1578, 'l2_leaf_reg': 3.7766875577974056e-08, 'border_count': 31, 'bagging_temperature': 0.13447907851294416, 'random_strength': 5.137319560204572, 'grow_policy': 'Lossguide', 'min_data_in_leaf': 451, 'max_leaves': 57}. Best is trial 129 with value: 80.56965157209301.[0m
[32m[I 2024-10-13 13:44:29,508][0m Trial 152 finished with value: 83.23471388922363 and parameters: {'depth': 10, 'learning_rate': 0.018809963594105823, 'iterations': 1355, 'l2_leaf_reg': 1.4247162942809188e-08, 'border_count': 37, 'bagging_temperature': 0.1361579801868185, 'random_strength': 2.9034021777133434, 'grow_policy': 'Lossguide', 'min_data_in_leaf': 404, 'max_leaves': 37}. Best is trial 129 with value: 80.56965157209301.[0m
[32m[I 2024-10-13 13:44:30,998][0m Trial 153 finished with value: 85.36233922668698 and parameters: {'depth': 10, 'learning_rate': 0.03129914532698269, 'iterations': 1248, 'l2_leaf_reg': 1.6696755038308394e-08, 'border_count': 48, 'bagging_temperature': 0.08027498579340582, 'random_strength': 2.83065170131619, 'grow_policy': 'Lossguide', 'min_data_in_leaf': 395, 'max_leaves': 46}. Best is trial 129 with value: 80.56965157209301.[0m
[32m[I 2024-10-13 13:44:32,552][0m Trial 154 finished with value: 83.78303536075694 and parameters: {'depth': 7, 'learning_rate': 0.019793999349972637, 'iterations': 1387, 'l2_leaf_reg': 1.0388183600357336e-08, 'border_count': 37, 'bagging_temperature': 0.13704850875232807, 'random_strength': 3.1082971324528454, 'grow_policy': 'Lossguide', 'min_data_in_leaf': 416, 'max_leaves': 36}. Best is trial 129 with value: 80.56965157209301.[0m
[32m[I 2024-10-13 13:44:34,178][0m Trial 155 finished with value: 83.81525111983028 and parameters: {'depth': 10, 'learning_rate': 0.008946248889891258, 'iterations': 1333, 'l2_leaf_reg': 5.59399399141641e-08, 'border_count': 40, 'bagging_temperature': 0.21508097682773258, 'random_strength': 6.1718208365515, 'grow_policy': 'Lossguide', 'min_data_in_leaf': 354, 'max_leaves': 54}. Best is trial 129 with value: 80.56965157209301.[0m
[32m[I 2024-10-13 13:44:35,544][0m Trial 156 finished with value: 86.08790132895295 and parameters: {'depth': 9, 'learning_rate': 0.016558677027044073, 'iterations': 1005, 'l2_leaf_reg': 2.0392162793352847e-08, 'border_count': 25, 'bagging_temperature': 0.11434271031869381, 'random_strength': 3.4242917101437556, 'grow_policy': 'Lossguide', 'min_data_in_leaf': 370, 'max_leaves': 103}. Best is trial 129 with value: 80.56965157209301.[0m
[32m[I 2024-10-13 13:44:37,041][0m Trial 157 finished with value: 91.98565779927766 and parameters: {'depth': 10, 'learning_rate': 0.022543357677112203, 'iterations': 1153, 'l2_leaf_reg': 0.0075713457523246715, 'border_count': 14, 'bagging_temperature': 0.004560176631969386, 'random_strength': 4.097666917353458, 'grow_policy': 'Lossguide', 'min_data_in_leaf': 484, 'max_leaves': 42}. Best is trial 129 with value: 80.56965157209301.[0m
[32m[I 2024-10-13 13:44:38,258][0m Trial 158 finished with value: 96.28026102814192 and parameters: {'depth': 9, 'learning_rate': 0.02005957043806477, 'iterations': 787, 'l2_leaf_reg': 3.1390826794224265e-08, 'border_count': 52, 'bagging_temperature': 0.044462859241490696, 'random_strength': 2.940555733938113, 'grow_policy': 'Lossguide', 'min_data_in_leaf': 430, 'max_leaves': 115}. Best is trial 129 with value: 80.56965157209301.[0m
[32m[I 2024-10-13 13:44:39,761][0m Trial 159 finished with value: 83.08389712319081 and parameters: {'depth': 11, 'learning_rate': 0.010609336074507546, 'iterations': 1257, 'l2_leaf_reg': 1.8311635570560902e-07, 'border_count': 43, 'bagging_temperature': 0.0911203092072714, 'random_strength': 5.3345156849355435, 'grow_policy': 'Lossguide', 'min_data_in_leaf': 518, 'max_leaves': 133}. Best is trial 129 with value: 80.56965157209301.[0m
[32m[I 2024-10-13 13:44:41,345][0m Trial 160 finished with value: 84.10278301272861 and parameters: {'depth': 11, 'learning_rate': 0.010523806588933348, 'iterations': 1364, 'l2_leaf_reg': 2.6905609957980854e-07, 'border_count': 30, 'bagging_temperature': 0.09152858374968306, 'random_strength': 5.308253836787835, 'grow_policy': 'Depthwise', 'min_data_in_leaf': 513}. Best is trial 129 with value: 80.56965157209301.[0m
[32m[I 2024-10-13 13:44:42,832][0m Trial 161 finished with value: 83.93285599831725 and parameters: {'depth': 12, 'learning_rate': 0.013499795709302632, 'iterations': 1239, 'l2_leaf_reg': 1.6296692485378938e-07, 'border_count': 42, 'bagging_temperature': 0.13391273407074405, 'random_strength': 5.7493927158096, 'grow_policy': 'Lossguide', 'min_data_in_leaf': 492, 'max_leaves': 31}. Best is trial 129 with value: 80.56965157209301.[0m
[32m[I 2024-10-13 13:44:44,216][0m Trial 162 finished with value: 84.12019007183461 and parameters: {'depth': 11, 'learning_rate': 0.00867381304473884, 'iterations': 1141, 'l2_leaf_reg': 6.421038277782551e-08, 'border_count': 35, 'bagging_temperature': 0.07837641263786549, 'random_strength': 4.892277893976757, 'grow_policy': 'Lossguide', 'min_data_in_leaf': 584, 'max_leaves': 66}. Best is trial 129 with value: 80.56965157209301.[0m
[32m[I 2024-10-13 13:44:45,317][0m Trial 163 finished with value: 94.97449828827177 and parameters: {'depth': 11, 'learning_rate': 0.01157576564816337, 'iterations': 765, 'l2_leaf_reg': 1.484263386935969e-08, 'border_count': 56, 'bagging_temperature': 0.1026469412126867, 'random_strength': 5.468812228542165, 'grow_policy': 'Lossguide', 'min_data_in_leaf': 468, 'max_leaves': 39}. Best is trial 129 with value: 80.56965157209301.[0m
[32m[I 2024-10-13 13:44:46,826][0m Trial 164 finished with value: 83.37405336197895 and parameters: {'depth': 8, 'learning_rate': 0.015771776290881535, 'iterations': 1288, 'l2_leaf_reg': 1.0564268711770002e-07, 'border_count': 44, 'bagging_temperature': 0.060859014432864955, 'random_strength': 5.0441625329166255, 'grow_policy': 'Lossguide', 'min_data_in_leaf': 407, 'max_leaves': 129}. Best is trial 129 with value: 80.56965157209301.[0m
[32m[I 2024-10-13 13:44:47,767][0m Trial 165 finished with value: 81.88645084516709 and parameters: {'depth': 10, 'learning_rate': 0.02754691708152609, 'iterations': 479, 'l2_leaf_reg': 1.9828223158364513e-07, 'border_count': 38, 'bagging_temperature': 0.17130624735447778, 'random_strength': 4.392325207647671, 'grow_policy': 'Lossguide', 'min_data_in_leaf': 534, 'max_leaves': 132}. Best is trial 129 with value: 80.56965157209301.[0m
[32m[I 2024-10-13 13:44:49,508][0m Trial 166 finished with value: 82.56317382630344 and parameters: {'depth': 10, 'learning_rate': 0.026305484672374084, 'iterations': 1631, 'l2_leaf_reg': 2.783234279463375e-07, 'border_count': 24, 'bagging_temperature': 0.1704042278940739, 'random_strength': 4.488876305493008, 'grow_policy': 'Lossguide', 'min_data_in_leaf': 531, 'max_leaves': 134}. Best is trial 129 with value: 80.56965157209301.[0m
[32m[I 2024-10-13 13:44:51,303][0m Trial 167 finished with value: 89.02075847780749 and parameters: {'depth': 12, 'learning_rate': 0.06455023233134169, 'iterations': 1668, 'l2_leaf_reg': 1.964163337851209e-07, 'border_count': 24, 'bagging_temperature': 0.18144102371697596, 'random_strength': 4.425033412725692, 'grow_policy': 'Lossguide', 'min_data_in_leaf': 526, 'max_leaves': 133}. Best is trial 129 with value: 80.56965157209301.[0m
[32m[I 2024-10-13 13:44:53,213][0m Trial 168 finished with value: 93.10182522541007 and parameters: {'depth': 9, 'learning_rate': 0.02917231962218805, 'iterations': 1809, 'l2_leaf_reg': 2.7846784095797915e-07, 'border_count': 18, 'bagging_temperature': 0.022120517791790095, 'random_strength': 4.483610766157502, 'grow_policy': 'Lossguide', 'min_data_in_leaf': 567, 'max_leaves': 120}. Best is trial 129 with value: 80.56965157209301.[0m
[32m[I 2024-10-13 13:44:54,924][0m Trial 169 finished with value: 89.54259476289768 and parameters: {'depth': 5, 'learning_rate': 0.02477770729675261, 'iterations': 1583, 'l2_leaf_reg': 1.2950053147614317e-07, 'border_count': 29, 'bagging_temperature': 0.09809080846772544, 'random_strength': 4.812682434550636, 'grow_policy': 'Lossguide', 'min_data_in_leaf': 541, 'max_leaves': 134}. Best is trial 129 with value: 80.56965157209301.[0m
[32m[I 2024-10-13 13:44:55,784][0m Trial 170 finished with value: 82.06802122620896 and parameters: {'depth': 10, 'learning_rate': 0.039363406437821304, 'iterations': 364, 'l2_leaf_reg': 5.442625905057675e-07, 'border_count': 33, 'bagging_temperature': 0.07285320976367309, 'random_strength': 4.200481989457639, 'grow_policy': 'Lossguide', 'min_data_in_leaf': 512, 'max_leaves': 141}. Best is trial 129 with value: 80.56965157209301.[0m
[32m[I 2024-10-13 13:44:56,627][0m Trial 171 finished with value: 82.63352678479164 and parameters: {'depth': 10, 'learning_rate': 0.04162012380308607, 'iterations': 432, 'l2_leaf_reg': 8.86014617532152e-07, 'border_count': 33, 'bagging_temperature': 0.05095592130521523, 'random_strength': 4.121401826813242, 'grow_policy': 'Lossguide', 'min_data_in_leaf': 514, 'max_leaves': 143}. Best is trial 129 with value: 80.56965157209301.[0m
[32m[I 2024-10-13 13:44:57,506][0m Trial 172 finished with value: 84.63409506122206 and parameters: {'depth': 9, 'learning_rate': 0.0400231913764165, 'iterations': 468, 'l2_leaf_reg': 4.294790572195256e-07, 'border_count': 32, 'bagging_temperature': 0.0450635797504687, 'random_strength': 4.156000764876523, 'grow_policy': 'Lossguide', 'min_data_in_leaf': 503, 'max_leaves': 143}. Best is trial 129 with value: 80.56965157209301.[0m
[32m[I 2024-10-13 13:44:58,415][0m Trial 173 finished with value: 86.55778673140163 and parameters: {'depth': 11, 'learning_rate': 0.03710858675429472, 'iterations': 467, 'l2_leaf_reg': 4.860290137647735e-07, 'border_count': 26, 'bagging_temperature': 0.07890230382016951, 'random_strength': 4.300988715178334, 'grow_policy': 'Lossguide', 'min_data_in_leaf': 531, 'max_leaves': 138}. Best is trial 129 with value: 80.56965157209301.[0m
[32m[I 2024-10-13 13:44:59,246][0m Trial 174 finished with value: 92.82609534493668 and parameters: {'depth': 10, 'learning_rate': 0.07395469748078962, 'iterations': 333, 'l2_leaf_reg': 6.962024800674858e-07, 'border_count': 21, 'bagging_temperature': 0.06601467064619874, 'random_strength': 3.9032866389194707, 'grow_policy': 'Lossguide', 'min_data_in_leaf': 550, 'max_leaves': 127}. Best is trial 129 with value: 80.56965157209301.[0m
[32m[I 2024-10-13 13:44:59,949][0m Trial 175 finished with value: 85.060079355574 and parameters: {'depth': 3, 'learning_rate': 0.0436127929379689, 'iterations': 216, 'l2_leaf_reg': 3.7953754836697604e-07, 'border_count': 32, 'bagging_temperature': 0.025202169404998434, 'random_strength': 4.642800667210378, 'grow_policy': 'Lossguide', 'min_data_in_leaf': 580, 'max_leaves': 147}. Best is trial 129 with value: 80.56965157209301.[0m
[32m[I 2024-10-13 13:45:00,809][0m Trial 176 finished with value: 85.76264695245683 and parameters: {'depth': 10, 'learning_rate': 0.03270440703171069, 'iterations': 350, 'l2_leaf_reg': 1.1339623741204715e-06, 'border_count': 40, 'bagging_temperature': 0.5664848070229455, 'random_strength': 3.6648068686213247, 'grow_policy': 'Lossguide', 'min_data_in_leaf': 488, 'max_leaves': 141}. Best is trial 129 with value: 80.56965157209301.[0m
[32m[I 2024-10-13 13:45:01,795][0m Trial 177 finished with value: 91.5398504003705 and parameters: {'depth': 9, 'learning_rate': 0.054611663058672925, 'iterations': 615, 'l2_leaf_reg': 2.2287767806558845e-07, 'border_count': 28, 'bagging_temperature': 0.057957533022672855, 'random_strength': 4.083679286493336, 'grow_policy': 'Lossguide', 'min_data_in_leaf': 612, 'max_leaves': 133}. Best is trial 129 with value: 80.56965157209301.[0m
[32m[I 2024-10-13 13:45:02,452][0m Trial 178 finished with value: 199.2688970132634 and parameters: {'depth': 6, 'learning_rate': 0.009773741060426572, 'iterations': 120, 'l2_leaf_reg': 9.027408515269701e-07, 'border_count': 5, 'bagging_temperature': 0.172407159329693, 'random_strength': 4.499767735939015, 'grow_policy': 'Lossguide', 'min_data_in_leaf': 504, 'max_leaves': 150}. Best is trial 129 with value: 80.56965157209301.[0m
[32m[I 2024-10-13 13:45:03,195][0m Trial 179 finished with value: 131.28343022497705 and parameters: {'depth': 3, 'learning_rate': 0.007688942663495255, 'iterations': 223, 'l2_leaf_reg': 3.1806664594857906e-07, 'border_count': 34, 'bagging_temperature': 0.2522418682159801, 'random_strength': 4.683769262968627, 'grow_policy': 'SymmetricTree', 'min_data_in_leaf': 464}. Best is trial 129 with value: 80.56965157209301.[0m
[32m[I 2024-10-13 13:45:04,015][0m Trial 180 finished with value: 137.2750577415858 and parameters: {'depth': 11, 'learning_rate': 0.005707995763758567, 'iterations': 385, 'l2_leaf_reg': 8.688335613508724e-08, 'border_count': 17, 'bagging_temperature': 0.031715482357106736, 'random_strength': 3.9459584091821527, 'grow_policy': 'Lossguide', 'min_data_in_leaf': 555, 'max_leaves': 122}. Best is trial 129 with value: 80.56965157209301.[0m
[32m[I 2024-10-13 13:45:04,797][0m Trial 181 finished with value: 89.37916366815085 and parameters: {'depth': 10, 'learning_rate': 0.026304488082515145, 'iterations': 237, 'l2_leaf_reg': 2.146969620691468e-07, 'border_count': 37, 'bagging_temperature': 0.11856368130699484, 'random_strength': 4.353397460854194, 'grow_policy': 'Lossguide', 'min_data_in_leaf': 518, 'max_leaves': 130}. Best is trial 129 with value: 80.56965157209301.[0m
[32m[I 2024-10-13 13:45:05,614][0m Trial 182 finished with value: 81.88096150476122 and parameters: {'depth': 10, 'learning_rate': 0.03589291130337066, 'iterations': 446, 'l2_leaf_reg': 0.002406650864049095, 'border_count': 40, 'bagging_temperature': 0.20362844476569433, 'random_strength': 4.228644970599776, 'grow_policy': 'Lossguide', 'min_data_in_leaf': 522, 'max_leaves': 144}. Best is trial 129 with value: 80.56965157209301.[0m
[32m[I 2024-10-13 13:45:06,487][0m Trial 183 finished with value: 83.4258036052521 and parameters: {'depth': 10, 'learning_rate': 0.03919201941863131, 'iterations': 449, 'l2_leaf_reg': 0.0013598411022014685, 'border_count': 50, 'bagging_temperature': 0.19190677755986538, 'random_strength': 4.202045997850281, 'grow_policy': 'Lossguide', 'min_data_in_leaf': 481, 'max_leaves': 144}. Best is trial 129 with value: 80.56965157209301.[0m
[32m[I 2024-10-13 13:45:07,479][0m Trial 184 finished with value: 83.09054004516304 and parameters: {'depth': 10, 'learning_rate': 0.03163162780206052, 'iterations': 565, 'l2_leaf_reg': 0.0018866868105182045, 'border_count': 41, 'bagging_temperature': 0.16288610047810656, 'random_strength': 3.5297276816269836, 'grow_policy': 'Lossguide', 'min_data_in_leaf': 532, 'max_leaves': 141}. Best is trial 129 with value: 80.56965157209301.[0m
[32m[I 2024-10-13 13:45:08,407][0m Trial 185 finished with value: 84.34431229429686 and parameters: {'depth': 10, 'learning_rate': 0.047541788055864925, 'iterations': 506, 'l2_leaf_reg': 0.005305323414872672, 'border_count': 43, 'bagging_temperature': 0.2091621365912997, 'random_strength': 3.505838892763843, 'grow_policy': 'Lossguide', 'min_data_in_leaf': 537, 'max_leaves': 138}. Best is trial 129 with value: 80.56965157209301.[0m
[32m[I 2024-10-13 13:45:09,365][0m Trial 186 finished with value: 81.3129447051007 and parameters: {'depth': 10, 'learning_rate': 0.03429786252932486, 'iterations': 561, 'l2_leaf_reg': 0.000819076388186914, 'border_count': 24, 'bagging_temperature': 0.16560442132871803, 'random_strength': 3.592307990818879, 'grow_policy': 'Lossguide', 'min_data_in_leaf': 561, 'max_leaves': 155}. Best is trial 129 with value: 80.56965157209301.[0m
[32m[I 2024-10-13 13:45:10,267][0m Trial 187 finished with value: 86.1079193738557 and parameters: {'depth': 10, 'learning_rate': 0.033437925999112515, 'iterations': 521, 'l2_leaf_reg': 0.0029276827651420236, 'border_count': 25, 'bagging_temperature': 0.1561484396966386, 'random_strength': 3.6921450709267853, 'grow_policy': 'Lossguide', 'min_data_in_leaf': 570, 'max_leaves': 152}. Best is trial 129 with value: 80.56965157209301.[0m
[32m[I 2024-10-13 13:45:11,092][0m Trial 188 finished with value: 93.06634428229327 and parameters: {'depth': 10, 'learning_rate': 0.03173430861675239, 'iterations': 405, 'l2_leaf_reg': 0.0021469361571563234, 'border_count': 21, 'bagging_temperature': 0.2168005369069567, 'random_strength': 3.982110897897858, 'grow_policy': 'Lossguide', 'min_data_in_leaf': 497, 'max_leaves': 161}. Best is trial 129 with value: 80.56965157209301.[0m
[32m[I 2024-10-13 13:45:12,131][0m Trial 189 finished with value: 89.7411959052454 and parameters: {'depth': 9, 'learning_rate': 0.10164348908544646, 'iterations': 578, 'l2_leaf_reg': 0.000921290181499305, 'border_count': 10, 'bagging_temperature': 0.17163574123924513, 'random_strength': 3.5433020709381955, 'grow_policy': 'Lossguide', 'min_data_in_leaf': 542, 'max_leaves': 154}. Best is trial 129 with value: 80.56965157209301.[0m
[32m[I 2024-10-13 13:45:13,096][0m Trial 190 finished with value: 87.52148864165223 and parameters: {'depth': 11, 'learning_rate': 0.05187970214286284, 'iterations': 558, 'l2_leaf_reg': 0.0023914200203724147, 'border_count': 32, 'bagging_temperature': 0.15332689487360882, 'random_strength': 4.233183566327049, 'grow_policy': 'Lossguide', 'min_data_in_leaf': 524, 'max_leaves': 145}. Best is trial 129 with value: 80.56965157209301.[0m
[32m[I 2024-10-13 13:45:13,923][0m Trial 191 finished with value: 82.623785967297 and parameters: {'depth': 10, 'learning_rate': 0.026772630628533536, 'iterations': 427, 'l2_leaf_reg': 0.000874532113557614, 'border_count': 39, 'bagging_temperature': 0.10110255386483276, 'random_strength': 3.3095080741529244, 'grow_policy': 'Lossguide', 'min_data_in_leaf': 588, 'max_leaves': 135}. Best is trial 129 with value: 80.56965157209301.[0m
[32m[I 2024-10-13 13:45:14,763][0m Trial 192 finished with value: 87.78895343886228 and parameters: {'depth': 10, 'learning_rate': 0.02890251996737535, 'iterations': 324, 'l2_leaf_reg': 0.0004424441152715881, 'border_count': 28, 'bagging_temperature': 0.10577180545806555, 'random_strength': 3.2290016210297963, 'grow_policy': 'Lossguide', 'min_data_in_leaf': 561, 'max_leaves': 135}. Best is trial 129 with value: 80.56965157209301.[0m
[32m[I 2024-10-13 13:45:15,479][0m Trial 193 finished with value: 83.87302279287279 and parameters: {'depth': 10, 'learning_rate': 0.03754572935230778, 'iterations': 270, 'l2_leaf_reg': 0.0006422325936155591, 'border_count': 39, 'bagging_temperature': 0.09300972470370089, 'random_strength': 3.7876191310217497, 'grow_policy': 'Lossguide', 'min_data_in_leaf': 596, 'max_leaves': 141}. Best is trial 129 with value: 80.56965157209301.[0m
[32m[I 2024-10-13 13:45:16,313][0m Trial 194 finished with value: 82.57024211204907 and parameters: {'depth': 10, 'learning_rate': 0.027217511020341423, 'iterations': 385, 'l2_leaf_reg': 0.001389141164539022, 'border_count': 34, 'bagging_temperature': 0.23396809683430878, 'random_strength': 3.323964830963766, 'grow_policy': 'Lossguide', 'min_data_in_leaf': 476, 'max_leaves': 135}. Best is trial 129 with value: 80.56965157209301.[0m
[32m[I 2024-10-13 13:45:17,212][0m Trial 195 finished with value: 84.25002748722474 and parameters: {'depth': 10, 'learning_rate': 0.029450186930790163, 'iterations': 424, 'l2_leaf_reg': 0.0016296430693846526, 'border_count': 44, 'bagging_temperature': 0.20073829822781342, 'random_strength': 3.9005222379530395, 'grow_policy': 'Lossguide', 'min_data_in_leaf': 468, 'max_leaves': 135}. Best is trial 129 with value: 80.56965157209301.[0m
[32m[I 2024-10-13 13:45:18,289][0m Trial 196 finished with value: 80.36203499023102 and parameters: {'depth': 10, 'learning_rate': 0.03475012903979287, 'iterations': 658, 'l2_leaf_reg': 0.0010600819090316206, 'border_count': 34, 'bagging_temperature': 0.24142832274375853, 'random_strength': 3.5163865130897793, 'grow_policy': 'Lossguide', 'min_data_in_leaf': 516, 'max_leaves': 149}. Best is trial 196 with value: 80.36203499023102.[0m
[32m[I 2024-10-13 13:45:19,130][0m Trial 197 finished with value: 83.31337232122931 and parameters: {'depth': 10, 'learning_rate': 0.04209814023920897, 'iterations': 386, 'l2_leaf_reg': 0.0009573693627857783, 'border_count': 29, 'bagging_temperature': 0.23252154026618035, 'random_strength': 4.436137360365813, 'grow_policy': 'Depthwise', 'min_data_in_leaf': 454}. Best is trial 196 with value: 80.36203499023102.[0m
[32m[I 2024-10-13 13:45:20,167][0m Trial 198 finished with value: 82.24444008400111 and parameters: {'depth': 10, 'learning_rate': 0.03437522566004846, 'iterations': 674, 'l2_leaf_reg': 0.00032136432284214823, 'border_count': 24, 'bagging_temperature': 0.2860893755887777, 'random_strength': 3.403178507021073, 'grow_policy': 'Lossguide', 'min_data_in_leaf': 505, 'max_leaves': 148}. Best is trial 196 with value: 80.36203499023102.[0m
[32m[I 2024-10-13 13:45:21,100][0m Trial 199 finished with value: 93.90696969084344 and parameters: {'depth': 10, 'learning_rate': 0.03673253213506603, 'iterations': 487, 'l2_leaf_reg': 0.00038840685524273595, 'border_count': 15, 'bagging_temperature': 0.1944254240702579, 'random_strength': 3.300239190280277, 'grow_policy': 'Lossguide', 'min_data_in_leaf': 481, 'max_leaves': 148}. Best is trial 196 with value: 80.36203499023102.[0m
[32m[I 2024-10-13 13:45:22,254][0m Trial 200 finished with value: 81.73090184484727 and parameters: {'depth': 9, 'learning_rate': 0.048327957491178124, 'iterations': 659, 'l2_leaf_reg': 0.0008295157303990388, 'border_count': 24, 'bagging_temperature': 0.2686302734097342, 'random_strength': 3.131625659849886, 'grow_policy': 'Lossguide', 'min_data_in_leaf': 495, 'max_leaves': 153}. Best is trial 196 with value: 80.36203499023102.[0m
