[32m[I 2024-10-13 13:50:18,243][0m Trial 451 finished with value: 94.99820755240351 and parameters: {'depth': 11, 'learning_rate': 0.037169509839324245, 'iterations': 329, 'l2_leaf_reg': 0.0017457002669866095, 'border_count': 16, 'bagging_temperature': 0.1563821127203059, 'random_strength': 6.964737769324751, 'grow_policy': 'Lossguide', 'min_data_in_leaf': 119, 'max_leaves': 141}. Best is trial 280 with value: 79.877599423719.[0m
[32m[I 2024-10-13 13:50:19,220][0m Trial 452 finished with value: 90.46868204938913 and parameters: {'depth': 13, 'learning_rate': 0.059647002310970795, 'iterations': 607, 'l2_leaf_reg': 2.5526834258248918e-05, 'border_count': 26, 'bagging_temperature': 0.1342826614989378, 'random_strength': 3.1712330705211613, 'grow_policy': 'Lossguide', 'min_data_in_leaf': 513, 'max_leaves': 147}. Best is trial 280 with value: 79.877599423719.[0m
[32m[I 2024-10-13 13:50:20,120][0m Trial 453 finished with value: 88.22091630259722 and parameters: {'depth': 10, 'learning_rate': 0.09337796160106561, 'iterations': 430, 'l2_leaf_reg': 0.0007913734160917819, 'border_count': 11, 'bagging_temperature': 0.18589767149114736, 'random_strength': 6.542171651328955, 'grow_policy': 'Lossguide', 'min_data_in_leaf': 539, 'max_leaves': 88}. Best is trial 280 with value: 79.877599423719.[0m
[32m[I 2024-10-13 13:50:20,787][0m Trial 454 finished with value: 98.31798015587941 and parameters: {'depth': 11, 'learning_rate': 0.030967296072874392, 'iterations': 143, 'l2_leaf_reg': 0.0010804919076108147, 'border_count': 29, 'bagging_temperature': 0.1729333962251375, 'random_strength': 6.857137081084342, 'grow_policy': 'Lossguide', 'min_data_in_leaf': 949, 'max_leaves': 132}. Best is trial 280 with value: 79.877599423719.[0m
[32m[I 2024-10-13 13:50:21,859][0m Trial 455 finished with value: 81.63167366208674 and parameters: {'depth': 13, 'learning_rate': 0.04495941635654444, 'iterations': 724, 'l2_leaf_reg': 0.0006153028697717599, 'border_count': 23, 'bagging_temperature': 0.249536980632855, 'random_strength': 6.334729712894732, 'grow_policy': 'Lossguide', 'min_data_in_leaf': 543, 'max_leaves': 151}. Best is trial 280 with value: 79.877599423719.[0m
[32m[I 2024-10-13 13:50:22,638][0m Trial 456 finished with value: 98.11450506357751 and parameters: {'depth': 13, 'learning_rate': 0.04044263174398631, 'iterations': 250, 'l2_leaf_reg': 0.0002844434910465104, 'border_count': 112, 'bagging_temperature': 0.24389386333204663, 'random_strength': 6.29065932292713, 'grow_policy': 'Depthwise', 'min_data_in_leaf': 540}. Best is trial 280 with value: 79.877599423719.[0m
[32m[I 2024-10-13 13:50:23,425][0m Trial 457 finished with value: 94.18988631922122 and parameters: {'depth': 13, 'learning_rate': 0.024931015539349805, 'iterations': 289, 'l2_leaf_reg': 8.85143777805554e-05, 'border_count': 21, 'bagging_temperature': 0.21645875014069552, 'random_strength': 5.96050080088229, 'grow_policy': 'Lossguide', 'min_data_in_leaf': 220, 'max_leaves': 143}. Best is trial 280 with value: 79.877599423719.[0m
[32m[I 2024-10-13 13:50:24,865][0m Trial 458 finished with value: 128.82793258663858 and parameters: {'depth': 13, 'learning_rate': 0.17875423518159347, 'iterations': 1187, 'l2_leaf_reg': 0.0005758618844894494, 'border_count': 170, 'bagging_temperature': 0.19713996676853823, 'random_strength': 6.80005934368832, 'grow_policy': 'Lossguide', 'min_data_in_leaf': 556, 'max_leaves': 151}. Best is trial 280 with value: 79.877599423719.[0m
[32m[I 2024-10-13 13:50:25,795][0m Trial 459 finished with value: 91.88832675088149 and parameters: {'depth': 13, 'learning_rate': 0.12831706687498906, 'iterations': 489, 'l2_leaf_reg': 0.00018386123144457526, 'border_count': 33, 'bagging_temperature': 0.23329422598400074, 'random_strength': 6.493500398516567, 'grow_policy': 'Lossguide', 'min_data_in_leaf': 559, 'max_leaves': 140}. Best is trial 280 with value: 79.877599423719.[0m
[32m[I 2024-10-13 13:50:26,594][0m Trial 460 finished with value: 92.65215972093955 and parameters: {'depth': 13, 'learning_rate': 0.06747917345871753, 'iterations': 367, 'l2_leaf_reg': 0.00038081537055968765, 'border_count': 15, 'bagging_temperature': 0.1792487222867237, 'random_strength': 5.930752405339508, 'grow_policy': 'Lossguide', 'min_data_in_leaf': 606, 'max_leaves': 147}. Best is trial 280 with value: 79.877599423719.[0m
[32m[I 2024-10-13 13:50:27,714][0m Trial 461 finished with value: 89.61702683180926 and parameters: {'depth': 14, 'learning_rate': 0.04724052014395601, 'iterations': 718, 'l2_leaf_reg': 0.000621972581644831, 'border_count': 51, 'bagging_temperature': 0.6452235376926011, 'random_strength': 6.269124087548283, 'grow_policy': 'Lossguide', 'min_data_in_leaf': 584, 'max_leaves': 158}. Best is trial 280 with value: 79.877599423719.[0m
[32m[I 2024-10-13 13:50:30,148][0m Trial 462 finished with value: 114.51415562084718 and parameters: {'depth': 12, 'learning_rate': 0.0788173500465205, 'iterations': 183, 'l2_leaf_reg': 0.00030221214835179905, 'border_count': 25, 'bagging_temperature': 0.25424437381413867, 'random_strength': 6.451728663989077, 'grow_policy': 'SymmetricTree', 'min_data_in_leaf': 527}. Best is trial 280 with value: 79.877599423719.[0m
[32m[I 2024-10-13 13:50:30,706][0m Trial 463 finished with value: 105.39765011907004 and parameters: {'depth': 13, 'learning_rate': 0.0346278782239826, 'iterations': 106, 'l2_leaf_reg': 0.0001235244039291728, 'border_count': 39, 'bagging_temperature': 0.2057748616465402, 'random_strength': 6.169791772130765, 'grow_policy': 'Lossguide', 'min_data_in_leaf': 141, 'max_leaves': 153}. Best is trial 280 with value: 79.877599423719.[0m
[32m[I 2024-10-13 13:50:31,608][0m Trial 464 finished with value: 85.53517465557579 and parameters: {'depth': 13, 'learning_rate': 0.055621108956878856, 'iterations': 446, 'l2_leaf_reg': 0.0027616243172727097, 'border_count': 30, 'bagging_temperature': 0.146774423499243, 'random_strength': 6.318832845034961, 'grow_policy': 'Lossguide', 'min_data_in_leaf': 544, 'max_leaves': 122}. Best is trial 280 with value: 79.877599423719.[0m
[32m[I 2024-10-13 13:50:32,376][0m Trial 465 finished with value: 93.5180907730531 and parameters: {'depth': 11, 'learning_rate': 0.04276509922199965, 'iterations': 259, 'l2_leaf_reg': 0.00046232463406269196, 'border_count': 20, 'bagging_temperature': 0.2298039810087285, 'random_strength': 6.655247310356801, 'grow_policy': 'Lossguide', 'min_data_in_leaf': 565, 'max_leaves': 144}. Best is trial 280 with value: 79.877599423719.[0m
[32m[I 2024-10-13 13:50:33,264][0m Trial 466 finished with value: 127.17675802964771 and parameters: {'depth': 12, 'learning_rate': 0.022337357113525694, 'iterations': 364, 'l2_leaf_reg': 4.270139699439532e-05, 'border_count': 5, 'bagging_temperature': 0.28535937700695485, 'random_strength': 6.095144019253075, 'grow_policy': 'Lossguide', 'min_data_in_leaf': 858, 'max_leaves': 163}. Best is trial 280 with value: 79.877599423719.[0m
[32m[I 2024-10-13 13:50:34,065][0m Trial 467 finished with value: 83.4086310161211 and parameters: {'depth': 10, 'learning_rate': 0.028306070856202264, 'iterations': 321, 'l2_leaf_reg': 0.001382386230120637, 'border_count': 34, 'bagging_temperature': 0.20092836374837797, 'random_strength': 9.359990560152141, 'grow_policy': 'Lossguide', 'min_data_in_leaf': 430, 'max_leaves': 149}. Best is trial 280 with value: 79.877599423719.[0m
[32m[I 2024-10-13 13:50:34,759][0m Trial 468 finished with value: 87.09513413879378 and parameters: {'depth': 14, 'learning_rate': 0.060811025954443126, 'iterations': 213, 'l2_leaf_reg': 0.0007113023144560872, 'border_count': 45, 'bagging_temperature': 0.6163989051003269, 'random_strength': 7.120343305346203, 'grow_policy': 'Lossguide', 'min_data_in_leaf': 547, 'max_leaves': 136}. Best is trial 280 with value: 79.877599423719.[0m
[32m[I 2024-10-13 13:50:35,976][0m Trial 469 finished with value: 95.46290553699944 and parameters: {'depth': 11, 'learning_rate': 0.08604261422469132, 'iterations': 924, 'l2_leaf_reg': 0.00019649915423826936, 'border_count': 26, 'bagging_temperature': 0.25417023513105674, 'random_strength': 6.48715667658914, 'grow_policy': 'Lossguide', 'min_data_in_leaf': 591, 'max_leaves': 154}. Best is trial 280 with value: 79.877599423719.[0m
[32m[I 2024-10-13 13:50:36,851][0m Trial 470 finished with value: 83.38369632138169 and parameters: {'depth': 13, 'learning_rate': 0.049044149765556745, 'iterations': 410, 'l2_leaf_reg': 0.0010278397885279016, 'border_count': 40, 'bagging_temperature': 0.22425977951793205, 'random_strength': 2.1256174277939572, 'grow_policy': 'Depthwise', 'min_data_in_leaf': 522}. Best is trial 280 with value: 79.877599423719.[0m
[32m[I 2024-10-13 13:50:37,785][0m Trial 471 finished with value: 84.28761702036998 and parameters: {'depth': 10, 'learning_rate': 0.03742452133862541, 'iterations': 568, 'l2_leaf_reg': 0.0002519834888535494, 'border_count': 29, 'bagging_temperature': 0.17653599059966663, 'random_strength': 6.60168742224598, 'grow_policy': 'Lossguide', 'min_data_in_leaf': 572, 'max_leaves': 158}. Best is trial 280 with value: 79.877599423719.[0m
[32m[I 2024-10-13 13:50:38,513][0m Trial 472 finished with value: 81.97352467498703 and parameters: {'depth': 12, 'learning_rate': 0.07057144784784132, 'iterations': 283, 'l2_leaf_reg': 0.0019110124852956144, 'border_count': 35, 'bagging_temperature': 0.5070165665972474, 'random_strength': 3.899508693814245, 'grow_policy': 'Lossguide', 'min_data_in_leaf': 921, 'max_leaves': 151}. Best is trial 280 with value: 79.877599423719.[0m
[32m[I 2024-10-13 13:50:39,217][0m Trial 473 finished with value: 82.89940519674559 and parameters: {'depth': 13, 'learning_rate': 0.05409365934425773, 'iterations': 231, 'l2_leaf_reg': 0.00033662930704276623, 'border_count': 23, 'bagging_temperature': 0.2757152855916049, 'random_strength': 2.7487649220156847, 'grow_policy': 'Lossguide', 'min_data_in_leaf': 313, 'max_leaves': 142}. Best is trial 280 with value: 79.877599423719.[0m
[32m[I 2024-10-13 13:50:40,994][0m Trial 474 finished with value: 92.66374396634622 and parameters: {'depth': 10, 'learning_rate': 0.10169193457519028, 'iterations': 1631, 'l2_leaf_reg': 0.00047998984874652093, 'border_count': 16, 'bagging_temperature': 0.2415184103666085, 'random_strength': 3.6478418164773636, 'grow_policy': 'Lossguide', 'min_data_in_leaf': 635, 'max_leaves': 128}. Best is trial 280 with value: 79.877599423719.[0m
[32m[I 2024-10-13 13:50:41,749][0m Trial 475 finished with value: 85.11823000902095 and parameters: {'depth': 10, 'learning_rate': 0.03268928261324386, 'iterations': 325, 'l2_leaf_reg': 0.0007837325408815396, 'border_count': 31, 'bagging_temperature': 0.2094722235532638, 'random_strength': 6.090832982284708, 'grow_policy': 'Lossguide', 'min_data_in_leaf': 612, 'max_leaves': 161}. Best is trial 280 with value: 79.877599423719.[0m
[32m[I 2024-10-13 13:50:42,415][0m Trial 476 finished with value: 90.94550618651478 and parameters: {'depth': 12, 'learning_rate': 0.04387069805148771, 'iterations': 161, 'l2_leaf_reg': 0.003770326893812942, 'border_count': 43, 'bagging_temperature': 0.4122670278983747, 'random_strength': 2.405395494818497, 'grow_policy': 'Lossguide', 'min_data_in_leaf': 505, 'max_leaves': 155}. Best is trial 280 with value: 79.877599423719.[0m
[32m[I 2024-10-13 13:50:43,392][0m Trial 477 finished with value: 84.17952834640651 and parameters: {'depth': 11, 'learning_rate': 0.06398098280984331, 'iterations': 502, 'l2_leaf_reg': 0.00015316225806646323, 'border_count': 37, 'bagging_temperature': 0.1857720984981569, 'random_strength': 1.2119591041456164, 'grow_policy': 'Lossguide', 'min_data_in_leaf': 173, 'max_leaves': 147}. Best is trial 280 with value: 79.877599423719.[0m
[32m[I 2024-10-13 13:50:44,228][0m Trial 478 finished with value: 94.69665884785235 and parameters: {'depth': 7, 'learning_rate': 0.07745950492280095, 'iterations': 385, 'l2_leaf_reg': 9.262581793633694e-05, 'border_count': 22, 'bagging_temperature': 0.12283515414410251, 'random_strength': 4.040132179556544, 'grow_policy': 'Lossguide', 'min_data_in_leaf': 545, 'max_leaves': 138}. Best is trial 280 with value: 79.877599423719.[0m
[32m[I 2024-10-13 13:50:44,966][0m Trial 479 finished with value: 87.06244366777145 and parameters: {'depth': 10, 'learning_rate': 0.05570924472408311, 'iterations': 258, 'l2_leaf_reg': 0.0004994915381611217, 'border_count': 28, 'bagging_temperature': 0.25497435847274275, 'random_strength': 3.5522523536796284, 'grow_policy': 'Lossguide', 'min_data_in_leaf': 525, 'max_leaves': 170}. Best is trial 280 with value: 79.877599423719.[0m
[32m[I 2024-10-13 13:50:45,993][0m Trial 480 finished with value: 116.87281845495708 and parameters: {'depth': 13, 'learning_rate': 0.0480825916994341, 'iterations': 618, 'l2_leaf_reg': 0.0003121364637386431, 'border_count': 9, 'bagging_temperature': 0.310966001108767, 'random_strength': 3.8297253724493516, 'grow_policy': 'Lossguide', 'min_data_in_leaf': 570, 'max_leaves': 201}. Best is trial 280 with value: 79.877599423719.[0m
[32m[I 2024-10-13 13:50:46,828][0m Trial 481 finished with value: 82.84162376981593 and parameters: {'depth': 15, 'learning_rate': 0.06594334436217293, 'iterations': 308, 'l2_leaf_reg': 0.0008764308540633549, 'border_count': 49, 'bagging_temperature': 0.22753035345727707, 'random_strength': 1.6876690514348003, 'grow_policy': 'Depthwise', 'min_data_in_leaf': 589}. Best is trial 280 with value: 79.877599423719.[0m
[32m[I 2024-10-13 13:50:47,943][0m Trial 482 finished with value: 81.50525709434757 and parameters: {'depth': 11, 'learning_rate': 0.029578632635694456, 'iterations': 818, 'l2_leaf_reg': 6.272287792752362e-05, 'border_count': 34, 'bagging_temperature': 0.15354762364387203, 'random_strength': 7.621301833007253, 'grow_policy': 'Lossguide', 'min_data_in_leaf': 150, 'max_leaves': 150}. Best is trial 280 with value: 79.877599423719.[0m
[32m[I 2024-10-13 13:50:49,025][0m Trial 483 finished with value: 84.28695690950785 and parameters: {'depth': 11, 'learning_rate': 0.030900565428814235, 'iterations': 716, 'l2_leaf_reg': 0.000155784899531135, 'border_count': 41, 'bagging_temperature': 0.15986303032396035, 'random_strength': 7.823013320316093, 'grow_policy': 'Lossguide', 'min_data_in_leaf': 206, 'max_leaves': 151}. Best is trial 280 with value: 79.877599423719.[0m
[32m[I 2024-10-13 13:50:50,124][0m Trial 484 finished with value: 83.28182120866282 and parameters: {'depth': 11, 'learning_rate': 0.03790295928202613, 'iterations': 767, 'l2_leaf_reg': 0.0002026461462182172, 'border_count': 35, 'bagging_temperature': 0.14250110872287938, 'random_strength': 8.392951104738062, 'grow_policy': 'Lossguide', 'min_data_in_leaf': 158, 'max_leaves': 159}. Best is trial 280 with value: 79.877599423719.[0m
[32m[I 2024-10-13 13:50:51,243][0m Trial 485 finished with value: 84.8058352443843 and parameters: {'depth': 11, 'learning_rate': 0.02916520632192192, 'iterations': 769, 'l2_leaf_reg': 0.0014608201326377801, 'border_count': 46, 'bagging_temperature': 0.17110893040099767, 'random_strength': 8.560715041263053, 'grow_policy': 'Lossguide', 'min_data_in_leaf': 122, 'max_leaves': 166}. Best is trial 280 with value: 79.877599423719.[0m
[32m[I 2024-10-13 13:51:05,962][0m Trial 486 finished with value: 90.09049186017059 and parameters: {'depth': 11, 'learning_rate': 0.03837508787597063, 'iterations': 718, 'l2_leaf_reg': 0.000435710452591321, 'border_count': 38, 'bagging_temperature': 0.11813978460960672, 'random_strength': 8.11189316628965, 'grow_policy': 'SymmetricTree', 'min_data_in_leaf': 121}. Best is trial 280 with value: 79.877599423719.[0m
[32m[I 2024-10-13 13:51:07,146][0m Trial 487 finished with value: 104.18538601026775 and parameters: {'depth': 11, 'learning_rate': 0.08647321775755105, 'iterations': 657, 'l2_leaf_reg': 0.00026135365832210763, 'border_count': 32, 'bagging_temperature': 0.19663628321592622, 'random_strength': 8.032290468801094, 'grow_policy': 'Lossguide', 'min_data_in_leaf': 66, 'max_leaves': 243}. Best is trial 280 with value: 79.877599423719.[0m
[32m[I 2024-10-13 13:51:08,235][0m Trial 488 finished with value: 306.2961133701676 and parameters: {'depth': 12, 'learning_rate': 0.00012078918119554838, 'iterations': 809, 'l2_leaf_reg': 9.878948201909205e-05, 'border_count': 41, 'bagging_temperature': 0.15650692606509198, 'random_strength': 7.659980854198287, 'grow_policy': 'Lossguide', 'min_data_in_leaf': 185, 'max_leaves': 155}. Best is trial 280 with value: 79.877599423719.[0m
[32m[I 2024-10-13 13:51:09,283][0m Trial 489 finished with value: 116.98419783013328 and parameters: {'depth': 11, 'learning_rate': 0.004101903258839231, 'iterations': 662, 'l2_leaf_reg': 6.756319477826682e-05, 'border_count': 55, 'bagging_temperature': 0.18793395442901825, 'random_strength': 7.2359792846410835, 'grow_policy': 'Lossguide', 'min_data_in_leaf': 153, 'max_leaves': 148}. Best is trial 280 with value: 79.877599423719.[0m
[32m[I 2024-10-13 13:51:10,246][0m Trial 490 finished with value: 84.13988509212933 and parameters: {'depth': 14, 'learning_rate': 0.04443183729162664, 'iterations': 555, 'l2_leaf_reg': 0.0007053072674916858, 'border_count': 33, 'bagging_temperature': 0.20659491105461125, 'random_strength': 5.699957990737512, 'grow_policy': 'Lossguide', 'min_data_in_leaf': 561, 'max_leaves': 161}. Best is trial 280 with value: 79.877599423719.[0m
[32m[I 2024-10-13 13:51:11,111][0m Trial 491 finished with value: 88.3420237391237 and parameters: {'depth': 11, 'learning_rate': 0.05523180743395568, 'iterations': 431, 'l2_leaf_reg': 0.0011520118561375824, 'border_count': 27, 'bagging_temperature': 0.21825203328390338, 'random_strength': 7.456274885282758, 'grow_policy': 'Lossguide', 'min_data_in_leaf': 148, 'max_leaves': 151}. Best is trial 280 with value: 79.877599423719.[0m
[32m[I 2024-10-13 13:51:11,816][0m Trial 492 finished with value: 237.7070527862406 and parameters: {'depth': 10, 'learning_rate': 0.0027831663175616815, 'iterations': 217, 'l2_leaf_reg': 0.002185394218459779, 'border_count': 38, 'bagging_temperature': 0.2397344290791685, 'random_strength': 7.383539272723633, 'grow_policy': 'Lossguide', 'min_data_in_leaf': 192, 'max_leaves': 145}. Best is trial 280 with value: 79.877599423719.[0m
[32m[I 2024-10-13 13:51:12,603][0m Trial 493 finished with value: 84.67654025846872 and parameters: {'depth': 12, 'learning_rate': 0.03440845532498719, 'iterations': 342, 'l2_leaf_reg': 0.0005961009094961091, 'border_count': 32, 'bagging_temperature': 0.17296301286885812, 'random_strength': 3.378244521382309, 'grow_policy': 'Lossguide', 'min_data_in_leaf': 140, 'max_leaves': 156}. Best is trial 280 with value: 79.877599423719.[0m
[32m[I 2024-10-13 13:51:13,303][0m Trial 494 finished with value: 85.71647765193447 and parameters: {'depth': 10, 'learning_rate': 0.06708513223171421, 'iterations': 163, 'l2_leaf_reg': 0.00036373167103978657, 'border_count': 45, 'bagging_temperature': 0.2634103662113009, 'random_strength': 4.14305476716693, 'grow_policy': 'Depthwise', 'min_data_in_leaf': 964}. Best is trial 280 with value: 79.877599423719.[0m
[32m[I 2024-10-13 13:51:14,226][0m Trial 495 finished with value: 88.04920760325567 and parameters: {'depth': 11, 'learning_rate': 0.04292566345777232, 'iterations': 474, 'l2_leaf_reg': 0.0001418659703699655, 'border_count': 27, 'bagging_temperature': 0.14144140619349518, 'random_strength': 2.9087133458996686, 'grow_policy': 'Lossguide', 'min_data_in_leaf': 548, 'max_leaves': 152}. Best is trial 280 with value: 79.877599423719.[0m
[32m[I 2024-10-13 13:51:14,999][0m Trial 496 finished with value: 82.6553431133711 and parameters: {'depth': 13, 'learning_rate': 0.05282867568917269, 'iterations': 275, 'l2_leaf_reg': 0.00022147964189038032, 'border_count': 36, 'bagging_temperature': 0.18982005390454024, 'random_strength': 5.418636393870091, 'grow_policy': 'Lossguide', 'min_data_in_leaf': 524, 'max_leaves': 163}. Best is trial 280 with value: 79.877599423719.[0m
[32m[I 2024-10-13 13:51:16,168][0m Trial 497 finished with value: 85.79469927107873 and parameters: {'depth': 10, 'learning_rate': 0.026364734687252363, 'iterations': 864, 'l2_leaf_reg': 0.001163485355138904, 'border_count': 31, 'bagging_temperature': 0.21139591256879084, 'random_strength': 6.930297680360592, 'grow_policy': 'Lossguide', 'min_data_in_leaf': 111, 'max_leaves': 146}. Best is trial 280 with value: 79.877599423719.[0m
[32m[I 2024-10-13 13:51:17,177][0m Trial 498 finished with value: 94.26977958716992 and parameters: {'depth': 10, 'learning_rate': 0.07460526758076019, 'iterations': 594, 'l2_leaf_reg': 0.0005559808875686194, 'border_count': 18, 'bagging_temperature': 0.23618351574002702, 'random_strength': 5.071196929052157, 'grow_policy': 'Lossguide', 'min_data_in_leaf': 508, 'max_leaves': 157}. Best is trial 280 with value: 79.877599423719.[0m
[32m[I 2024-10-13 13:51:18,035][0m Trial 499 finished with value: 83.91175492171352 and parameters: {'depth': 13, 'learning_rate': 0.06069150562957532, 'iterations': 380, 'l2_leaf_reg': 0.00029026420724454107, 'border_count': 41, 'bagging_temperature': 0.2815839522327548, 'random_strength': 2.636194157466482, 'grow_policy': 'Lossguide', 'min_data_in_leaf': 601, 'max_leaves': 111}. Best is trial 280 with value: 79.877599423719.[0m
[32m[I 2024-10-13 13:51:18,711][0m Trial 500 finished with value: 81.04411077083404 and parameters: {'depth': 12, 'learning_rate': 0.09813678458051052, 'iterations': 194, 'l2_leaf_reg': 4.5274370369435436e-08, 'border_count': 23, 'bagging_temperature': 0.16263092984597916, 'random_strength': 7.725553350652184, 'grow_policy': 'Lossguide', 'min_data_in_leaf': 532, 'max_leaves': 150}. Best is trial 280 with value: 79.877599423719.[0m
