[32m[I 2024-10-13 13:56:35,563][0m Trial 851 finished with value: 92.04029808584663 and parameters: {'depth': 15, 'learning_rate': 0.2141908922763143, 'iterations': 152, 'l2_leaf_reg': 3.097139532215408e-08, 'border_count': 26, 'bagging_temperature': 0.05959727638786187, 'random_strength': 9.855232327785828, 'grow_policy': 'Lossguide', 'min_data_in_leaf': 481, 'max_leaves': 139}. Best is trial 738 with value: 78.71473735766027.[0m
[32m[I 2024-10-13 13:56:36,251][0m Trial 852 finished with value: 92.97625764178123 and parameters: {'depth': 14, 'learning_rate': 0.1095655125777031, 'iterations': 202, 'l2_leaf_reg': 4.8421262783649735e-08, 'border_count': 20, 'bagging_temperature': 0.12020085070885259, 'random_strength': 9.499378418188714, 'grow_policy': 'Lossguide', 'min_data_in_leaf': 948, 'max_leaves': 145}. Best is trial 738 with value: 78.71473735766027.[0m
[32m[I 2024-10-13 13:56:36,860][0m Trial 853 finished with value: 89.5113498367391 and parameters: {'depth': 9, 'learning_rate': 0.1723159341174594, 'iterations': 101, 'l2_leaf_reg': 1.5984313563644608e-08, 'border_count': 11, 'bagging_temperature': 0.014551453693511185, 'random_strength': 9.680063109415897, 'grow_policy': 'Lossguide', 'min_data_in_leaf': 167, 'max_leaves': 131}. Best is trial 738 with value: 78.71473735766027.[0m
[32m[I 2024-10-13 13:56:37,533][0m Trial 854 finished with value: 87.44150099095614 and parameters: {'depth': 14, 'learning_rate': 0.13244115187819067, 'iterations': 211, 'l2_leaf_reg': 2.6724122939926118e-08, 'border_count': 25, 'bagging_temperature': 0.1531047942692896, 'random_strength': 9.183403973925808, 'grow_policy': 'Lossguide', 'min_data_in_leaf': 536, 'max_leaves': 153}. Best is trial 738 with value: 78.71473735766027.[0m
[32m[I 2024-10-13 13:56:38,250][0m Trial 855 finished with value: 93.20394211352453 and parameters: {'depth': 15, 'learning_rate': 0.10851264347515137, 'iterations': 161, 'l2_leaf_reg': 1.4741577667400286e-08, 'border_count': 16, 'bagging_temperature': 0.18605065370843502, 'random_strength': 9.975158634817696, 'grow_policy': 'Lossguide', 'min_data_in_leaf': 497, 'max_leaves': 148}. Best is trial 738 with value: 78.71473735766027.[0m
[32m[I 2024-10-13 13:56:39,025][0m Trial 856 finished with value: 92.11816399000493 and parameters: {'depth': 9, 'learning_rate': 0.09242359248174067, 'iterations': 254, 'l2_leaf_reg': 5.53361670787327e-08, 'border_count': 21, 'bagging_temperature': 0.08804529508503724, 'random_strength': 9.498350540463578, 'grow_policy': 'Depthwise', 'min_data_in_leaf': 517}. Best is trial 738 with value: 78.71473735766027.[0m
[32m[I 2024-10-13 13:56:39,679][0m Trial 857 finished with value: 84.9089276191145 and parameters: {'depth': 9, 'learning_rate': 0.18919719566650045, 'iterations': 106, 'l2_leaf_reg': 8.867924587835915e-08, 'border_count': 29, 'bagging_temperature': 0.033214705717826705, 'random_strength': 9.351838034328221, 'grow_policy': 'Lossguide', 'min_data_in_leaf': 463, 'max_leaves': 138}. Best is trial 738 with value: 78.71473735766027.[0m
[32m[I 2024-10-13 13:56:40,697][0m Trial 858 finished with value: 107.31713797427055 and parameters: {'depth': 15, 'learning_rate': 0.15366105199583505, 'iterations': 206, 'l2_leaf_reg': 3.5299611730099384e-08, 'border_count': 25, 'bagging_temperature': 0.11239256307672203, 'random_strength': 9.088095895650088, 'grow_policy': 'Lossguide', 'min_data_in_leaf': 30, 'max_leaves': 143}. Best is trial 738 with value: 78.71473735766027.[0m
[32m[I 2024-10-13 13:56:42,009][0m Trial 859 finished with value: 92.65045232715018 and parameters: {'depth': 5, 'learning_rate': 0.13768875487440338, 'iterations': 1003, 'l2_leaf_reg': 2.0308780671528997e-08, 'border_count': 20, 'bagging_temperature': 0.16702656669048357, 'random_strength': 9.805299024319956, 'grow_policy': 'Lossguide', 'min_data_in_leaf': 434, 'max_leaves': 156}. Best is trial 738 with value: 78.71473735766027.[0m
[32m[I 2024-10-13 13:56:42,655][0m Trial 860 finished with value: 86.01710952375555 and parameters: {'depth': 14, 'learning_rate': 0.11695656769763958, 'iterations': 100, 'l2_leaf_reg': 1.3743410413578904e-08, 'border_count': 29, 'bagging_temperature': 0.748064115144439, 'random_strength': 9.996856522989516, 'grow_policy': 'Lossguide', 'min_data_in_leaf': 143, 'max_leaves': 125}. Best is trial 738 with value: 78.71473735766027.[0m
[32m[I 2024-10-13 13:56:43,440][0m Trial 861 finished with value: 91.824834242915 and parameters: {'depth': 4, 'learning_rate': 0.10117275002853955, 'iterations': 265, 'l2_leaf_reg': 0.005749285126192219, 'border_count': 13, 'bagging_temperature': 0.13135420405674925, 'random_strength': 9.47304184273963, 'grow_policy': 'Lossguide', 'min_data_in_leaf': 494, 'max_leaves': 133}. Best is trial 738 with value: 78.71473735766027.[0m
[32m[I 2024-10-13 13:56:44,948][0m Trial 862 finished with value: 114.31119172502054 and parameters: {'depth': 9, 'learning_rate': 0.21207817725365014, 'iterations': 1207, 'l2_leaf_reg': 2.871842241069823e-08, 'border_count': 32, 'bagging_temperature': 0.06874586610777975, 'random_strength': 9.693245549874907, 'grow_policy': 'Lossguide', 'min_data_in_leaf': 857, 'max_leaves': 150}. Best is trial 738 with value: 78.71473735766027.[0m
[32m[I 2024-10-13 13:56:45,612][0m Trial 863 finished with value: 92.3021904350889 and parameters: {'depth': 6, 'learning_rate': 0.08554949856594243, 'iterations': 161, 'l2_leaf_reg': 4.311254636400053e-08, 'border_count': 22, 'bagging_temperature': 0.14859839635757716, 'random_strength': 9.01472252593466, 'grow_policy': 'Lossguide', 'min_data_in_leaf': 236, 'max_leaves': 143}. Best is trial 738 with value: 78.71473735766027.[0m
[32m[I 2024-10-13 13:56:46,238][0m Trial 864 finished with value: 89.01980569737235 and parameters: {'depth': 14, 'learning_rate': 0.1230823506904216, 'iterations': 101, 'l2_leaf_reg': 2.0472930264652862e-08, 'border_count': 26, 'bagging_temperature': 0.09256186042734704, 'random_strength': 5.596353215584615, 'grow_policy': 'Lossguide', 'min_data_in_leaf': 473, 'max_leaves': 137}. Best is trial 738 with value: 78.71473735766027.[0m
[32m[I 2024-10-13 13:56:46,956][0m Trial 865 finished with value: 89.56021678692845 and parameters: {'depth': 7, 'learning_rate': 0.2305138657576595, 'iterations': 206, 'l2_leaf_reg': 1.2191527314308023e-05, 'border_count': 15, 'bagging_temperature': 0.17286421272695063, 'random_strength': 9.253041259920238, 'grow_policy': 'Lossguide', 'min_data_in_leaf': 403, 'max_leaves': 146}. Best is trial 738 with value: 78.71473735766027.[0m
[32m[I 2024-10-13 13:56:47,730][0m Trial 866 finished with value: 91.98693360253573 and parameters: {'depth': 10, 'learning_rate': 0.16761097729544647, 'iterations': 316, 'l2_leaf_reg': 1.0342091257918685e-08, 'border_count': 31, 'bagging_temperature': 0.0404941599527172, 'random_strength': 8.919382503884512, 'grow_policy': 'Lossguide', 'min_data_in_leaf': 529, 'max_leaves': 118}. Best is trial 738 with value: 78.71473735766027.[0m
[32m[I 2024-10-13 13:56:49,748][0m Trial 867 finished with value: 118.19884328399465 and parameters: {'depth': 9, 'learning_rate': 0.014392089611288494, 'iterations': 1931, 'l2_leaf_reg': 2.690973136501674e-08, 'border_count': 7, 'bagging_temperature': 0.11578683203884381, 'random_strength': 9.532102478642248, 'grow_policy': 'Lossguide', 'min_data_in_leaf': 109, 'max_leaves': 129}. Best is trial 738 with value: 78.71473735766027.[0m
[32m[I 2024-10-13 13:56:50,776][0m Trial 868 finished with value: 101.49587381205737 and parameters: {'depth': 7, 'learning_rate': 0.10289392597065104, 'iterations': 256, 'l2_leaf_reg': 1.4582086799737406e-08, 'border_count': 18, 'bagging_temperature': 0.13398552956421844, 'random_strength': 9.333840803834752, 'grow_policy': 'SymmetricTree', 'min_data_in_leaf': 784}. Best is trial 738 with value: 78.71473735766027.[0m
[32m[I 2024-10-13 13:56:51,398][0m Trial 869 finished with value: 152.34281250300754 and parameters: {'depth': 8, 'learning_rate': 0.011260590001631111, 'iterations': 163, 'l2_leaf_reg': 6.46460493244667e-08, 'border_count': 26, 'bagging_temperature': 0.1902675584225197, 'random_strength': 9.75228953789624, 'grow_policy': 'Lossguide', 'min_data_in_leaf': 453, 'max_leaves': 141}. Best is trial 738 with value: 78.71473735766027.[0m
[32m[I 2024-10-13 13:56:52,141][0m Trial 870 finished with value: 83.84156568576854 and parameters: {'depth': 6, 'learning_rate': 0.1448991063105145, 'iterations': 216, 'l2_leaf_reg': 3.879246236129473e-08, 'border_count': 36, 'bagging_temperature': 0.07733817581828548, 'random_strength': 9.5598209331564, 'grow_policy': 'Lossguide', 'min_data_in_leaf': 192, 'max_leaves': 158}. Best is trial 738 with value: 78.71473735766027.[0m
[32m[I 2024-10-13 13:56:52,900][0m Trial 871 finished with value: 93.81354303157673 and parameters: {'depth': 15, 'learning_rate': 0.087020009340779, 'iterations': 295, 'l2_leaf_reg': 2.0145303558208665e-08, 'border_count': 22, 'bagging_temperature': 0.04960069998659171, 'random_strength': 8.68251596187223, 'grow_policy': 'Lossguide', 'min_data_in_leaf': 510, 'max_leaves': 134}. Best is trial 738 with value: 78.71473735766027.[0m
[32m[I 2024-10-13 13:56:53,551][0m Trial 872 finished with value: 86.23478619554847 and parameters: {'depth': 8, 'learning_rate': 0.11453026179137957, 'iterations': 153, 'l2_leaf_reg': 1.0624882336881372e-06, 'border_count': 30, 'bagging_temperature': 0.5215376093421233, 'random_strength': 9.132344083530793, 'grow_policy': 'Lossguide', 'min_data_in_leaf': 429, 'max_leaves': 150}. Best is trial 738 with value: 78.71473735766027.[0m
[32m[I 2024-10-13 13:56:54,328][0m Trial 873 finished with value: 273.7889275552872 and parameters: {'depth': 5, 'learning_rate': 0.18262550831483224, 'iterations': 345, 'l2_leaf_reg': 1.542182631465343e-08, 'border_count': 1, 'bagging_temperature': 0.15588520854163437, 'random_strength': 9.817654667730471, 'grow_policy': 'Lossguide', 'min_data_in_leaf': 544, 'max_leaves': 139}. Best is trial 738 with value: 78.71473735766027.[0m
[32m[I 2024-10-13 13:56:55,038][0m Trial 874 finished with value: 199.30661669173207 and parameters: {'depth': 10, 'learning_rate': 0.004419103787099757, 'iterations': 229, 'l2_leaf_reg': 1.0108573646067847e-08, 'border_count': 18, 'bagging_temperature': 0.10278025840992637, 'random_strength': 9.99249371406844, 'grow_policy': 'Lossguide', 'min_data_in_leaf': 485, 'max_leaves': 122}. Best is trial 738 with value: 78.71473735766027.[0m
[32m[I 2024-10-13 13:56:55,687][0m Trial 875 finished with value: 86.25130974215614 and parameters: {'depth': 14, 'learning_rate': 0.13346245081359134, 'iterations': 101, 'l2_leaf_reg': 1.0331166862238242e-07, 'border_count': 25, 'bagging_temperature': 0.13495480348683328, 'random_strength': 9.30661448347327, 'grow_policy': 'Lossguide', 'min_data_in_leaf': 494, 'max_leaves': 145}. Best is trial 738 with value: 78.71473735766027.[0m
[32m[I 2024-10-13 13:56:56,557][0m Trial 876 finished with value: 97.50558565189093 and parameters: {'depth': 7, 'learning_rate': 0.2954228908010164, 'iterations': 415, 'l2_leaf_reg': 1.6647535072036794e-07, 'border_count': 35, 'bagging_temperature': 0.002453188508407887, 'random_strength': 9.638174281065254, 'grow_policy': 'Lossguide', 'min_data_in_leaf': 517, 'max_leaves': 155}. Best is trial 738 with value: 78.71473735766027.[0m
[32m[I 2024-10-13 13:56:57,214][0m Trial 877 finished with value: 85.44341937203566 and parameters: {'depth': 9, 'learning_rate': 0.0792924380485715, 'iterations': 171, 'l2_leaf_reg': 2.8647411550392222e-08, 'border_count': 29, 'bagging_temperature': 0.17332713192617616, 'random_strength': 8.896225482286603, 'grow_policy': 'Lossguide', 'min_data_in_leaf': 217, 'max_leaves': 134}. Best is trial 738 with value: 78.71473735766027.[0m
[32m[I 2024-10-13 13:56:57,982][0m Trial 878 finished with value: 88.8159354590076 and parameters: {'depth': 6, 'learning_rate': 0.26083728548518553, 'iterations': 285, 'l2_leaf_reg': 5.464471623469093e-08, 'border_count': 11, 'bagging_temperature': 0.1150806303764128, 'random_strength': 9.44337006948712, 'grow_policy': 'Depthwise', 'min_data_in_leaf': 886}. Best is trial 738 with value: 78.71473735766027.[0m
[32m[I 2024-10-13 13:56:58,700][0m Trial 879 finished with value: 93.5536429886551 and parameters: {'depth': 14, 'learning_rate': 0.08962933720721164, 'iterations': 198, 'l2_leaf_reg': 2.0682054693184537e-08, 'border_count': 22, 'bagging_temperature': 0.06598070310004671, 'random_strength': 9.125351415203829, 'grow_policy': 'Lossguide', 'min_data_in_leaf': 746, 'max_leaves': 150}. Best is trial 738 with value: 78.71473735766027.[0m
[32m[I 2024-10-13 13:56:59,351][0m Trial 880 finished with value: 84.24280126441548 and parameters: {'depth': 6, 'learning_rate': 0.15582798482851373, 'iterations': 149, 'l2_leaf_reg': 1.0040249485982314e-08, 'border_count': 41, 'bagging_temperature': 0.14914888802532258, 'random_strength': 9.443730995297399, 'grow_policy': 'Lossguide', 'min_data_in_leaf': 465, 'max_leaves': 141}. Best is trial 738 with value: 78.71473735766027.[0m
[32m[I 2024-10-13 13:57:00,098][0m Trial 881 finished with value: 79.50250630101517 and parameters: {'depth': 7, 'learning_rate': 0.07231525385536892, 'iterations': 256, 'l2_leaf_reg': 3.872045107329533e-08, 'border_count': 34, 'bagging_temperature': 0.08738764748675182, 'random_strength': 8.401018311260112, 'grow_policy': 'Lossguide', 'min_data_in_leaf': 448, 'max_leaves': 100}. Best is trial 738 with value: 78.71473735766027.[0m
[32m[I 2024-10-13 13:57:00,997][0m Trial 882 finished with value: 92.28310473795908 and parameters: {'depth': 7, 'learning_rate': 0.06303970828550073, 'iterations': 480, 'l2_leaf_reg': 2.6537754456008803e-08, 'border_count': 15, 'bagging_temperature': 0.060971217555167906, 'random_strength': 9.62532097958887, 'grow_policy': 'Lossguide', 'min_data_in_leaf': 400, 'max_leaves': 95}. Best is trial 738 with value: 78.71473735766027.[0m
[32m[I 2024-10-13 13:57:01,771][0m Trial 883 finished with value: 85.99818314895755 and parameters: {'depth': 7, 'learning_rate': 0.07228698341928486, 'iterations': 332, 'l2_leaf_reg': 1.5029635346348793e-08, 'border_count': 25, 'bagging_temperature': 0.05318263468331351, 'random_strength': 9.288042415888015, 'grow_policy': 'Lossguide', 'min_data_in_leaf': 440, 'max_leaves': 101}. Best is trial 738 with value: 78.71473735766027.[0m
[32m[I 2024-10-13 13:57:02,547][0m Trial 884 finished with value: 90.90813958230103 and parameters: {'depth': 7, 'learning_rate': 0.20063009238387852, 'iterations': 228, 'l2_leaf_reg': 1.9478057751253084e-08, 'border_count': 32, 'bagging_temperature': 0.09700037886265939, 'random_strength': 7.331613251186342, 'grow_policy': 'Lossguide', 'min_data_in_leaf': 422, 'max_leaves': 105}. Best is trial 738 with value: 78.71473735766027.[0m
[32m[I 2024-10-13 13:57:03,440][0m Trial 885 finished with value: 92.64516087763535 and parameters: {'depth': 7, 'learning_rate': 0.0685295884747718, 'iterations': 372, 'l2_leaf_reg': 3.5673515016136514e-08, 'border_count': 20, 'bagging_temperature': 0.08126747985445086, 'random_strength': 9.745893597781297, 'grow_policy': 'Lossguide', 'min_data_in_leaf': 442, 'max_leaves': 98}. Best is trial 738 with value: 78.71473735766027.[0m
[32m[I 2024-10-13 13:57:04,131][0m Trial 886 finished with value: 81.71276340972705 and parameters: {'depth': 7, 'learning_rate': 0.07572672559724829, 'iterations': 154, 'l2_leaf_reg': 0.05820587457548199, 'border_count': 38, 'bagging_temperature': 0.08140349533517, 'random_strength': 4.458455186172451, 'grow_policy': 'Lossguide', 'min_data_in_leaf': 421, 'max_leaves': 93}. Best is trial 738 with value: 78.71473735766027.[0m
[32m[I 2024-10-13 13:57:04,883][0m Trial 887 finished with value: 100.84245629763912 and parameters: {'depth': 6, 'learning_rate': 0.25235276316793787, 'iterations': 279, 'l2_leaf_reg': 7.346970330369569e-08, 'border_count': 28, 'bagging_temperature': 0.03295987085564102, 'random_strength': 8.973632152834973, 'grow_policy': 'Lossguide', 'min_data_in_leaf': 451, 'max_leaves': 88}. Best is trial 738 with value: 78.71473735766027.[0m
[32m[I 2024-10-13 13:57:05,574][0m Trial 888 finished with value: 104.66566503695132 and parameters: {'depth': 7, 'learning_rate': 0.01818524489625271, 'iterations': 206, 'l2_leaf_reg': 4.8858073272145724e-08, 'border_count': 46, 'bagging_temperature': 0.06433787123986234, 'random_strength': 9.21779619814708, 'grow_policy': 'Lossguide', 'min_data_in_leaf': 460, 'max_leaves': 102}. Best is trial 738 with value: 78.71473735766027.[0m
[32m[I 2024-10-13 13:57:06,292][0m Trial 889 finished with value: 92.76026737433624 and parameters: {'depth': 7, 'learning_rate': 0.1749300143112033, 'iterations': 161, 'l2_leaf_reg': 1.5291978812147487e-08, 'border_count': 17, 'bagging_temperature': 0.6580615915643662, 'random_strength': 9.483253108871235, 'grow_policy': 'Lossguide', 'min_data_in_leaf': 428, 'max_leaves': 107}. Best is trial 738 with value: 78.71473735766027.[0m
[32m[I 2024-10-13 13:57:10,570][0m Trial 890 finished with value: 91.84841915897928 and parameters: {'depth': 7, 'learning_rate': 0.06932788291698973, 'iterations': 915, 'l2_leaf_reg': 2.7842127148624394e-08, 'border_count': 25, 'bagging_temperature': 0.09067236753310681, 'random_strength': 9.748358188379127, 'grow_policy': 'SymmetricTree', 'min_data_in_leaf': 474}. Best is trial 738 with value: 78.71473735766027.[0m
[32m[I 2024-10-13 13:57:11,331][0m Trial 891 finished with value: 87.04484691594867 and parameters: {'depth': 6, 'learning_rate': 0.21794778015010025, 'iterations': 288, 'l2_leaf_reg': 2.0186181771297893e-08, 'border_count': 34, 'bagging_temperature': 0.023483508431368462, 'random_strength': 8.427260569653956, 'grow_policy': 'Lossguide', 'min_data_in_leaf': 397, 'max_leaves': 102}. Best is trial 738 with value: 78.71473735766027.[0m
[32m[I 2024-10-13 13:57:12,047][0m Trial 892 finished with value: 93.58470536252031 and parameters: {'depth': 8, 'learning_rate': 0.11879837441243905, 'iterations': 246, 'l2_leaf_reg': 0.2171822495243677, 'border_count': 21, 'bagging_temperature': 0.10045608992197289, 'random_strength': 4.909592185659654, 'grow_policy': 'Lossguide', 'min_data_in_leaf': 181, 'max_leaves': 98}. Best is trial 738 with value: 78.71473735766027.[0m
[32m[I 2024-10-13 13:57:14,698][0m Trial 893 finished with value: 92.76592663027338 and parameters: {'depth': 6, 'learning_rate': 0.0774890045963723, 'iterations': 2901, 'l2_leaf_reg': 1.3958703487923288e-08, 'border_count': 10, 'bagging_temperature': 0.07581212425255682, 'random_strength': 8.72496217620147, 'grow_policy': 'Lossguide', 'min_data_in_leaf': 436, 'max_leaves': 114}. Best is trial 738 with value: 78.71473735766027.[0m
[32m[I 2024-10-13 13:57:15,836][0m Trial 894 finished with value: 89.28931129716197 and parameters: {'depth': 7, 'learning_rate': 0.008124117925009644, 'iterations': 773, 'l2_leaf_reg': 1.0144838487101474e-08, 'border_count': 29, 'bagging_temperature': 0.034282447214313935, 'random_strength': 9.421192190710926, 'grow_policy': 'Lossguide', 'min_data_in_leaf': 414, 'max_leaves': 104}. Best is trial 738 with value: 78.71473735766027.[0m
[32m[I 2024-10-13 13:57:16,527][0m Trial 895 finished with value: 83.05246091296772 and parameters: {'depth': 8, 'learning_rate': 0.10340454544633942, 'iterations': 191, 'l2_leaf_reg': 3.389623700106779e-08, 'border_count': 40, 'bagging_temperature': 0.05821302664799628, 'random_strength': 9.649395562600516, 'grow_policy': 'Lossguide', 'min_data_in_leaf': 260, 'max_leaves': 109}. Best is trial 738 with value: 78.71473735766027.[0m
[32m[I 2024-10-13 13:57:17,175][0m Trial 896 finished with value: 80.81673058648978 and parameters: {'depth': 10, 'learning_rate': 0.1454858161754656, 'iterations': 143, 'l2_leaf_reg': 0.002589246246408039, 'border_count': 24, 'bagging_temperature': 0.11095110289741074, 'random_strength': 9.108687293031853, 'grow_policy': 'Lossguide', 'min_data_in_leaf': 462, 'max_leaves': 161}. Best is trial 738 with value: 78.71473735766027.[0m
[32m[I 2024-10-13 13:57:17,792][0m Trial 897 finished with value: 84.42633093644082 and parameters: {'depth': 10, 'learning_rate': 0.15173578835367268, 'iterations': 102, 'l2_leaf_reg': 0.005001004529777527, 'border_count': 30, 'bagging_temperature': 0.11451808445942224, 'random_strength': 8.953330898147646, 'grow_policy': 'Lossguide', 'min_data_in_leaf': 450, 'max_leaves': 165}. Best is trial 738 with value: 78.71473735766027.[0m
[32m[I 2024-10-13 13:57:18,444][0m Trial 898 finished with value: 92.2828965053259 and parameters: {'depth': 10, 'learning_rate': 0.13810521166382106, 'iterations': 143, 'l2_leaf_reg': 0.0037937645240387415, 'border_count': 16, 'bagging_temperature': 0.10045636468262344, 'random_strength': 8.76066493190896, 'grow_policy': 'Lossguide', 'min_data_in_leaf': 458, 'max_leaves': 162}. Best is trial 738 with value: 78.71473735766027.[0m
[32m[I 2024-10-13 13:57:19,063][0m Trial 899 finished with value: 80.07473016933845 and parameters: {'depth': 10, 'learning_rate': 0.1775782737807961, 'iterations': 101, 'l2_leaf_reg': 0.002161237324586371, 'border_count': 23, 'bagging_temperature': 0.08520730964947677, 'random_strength': 9.131778823118779, 'grow_policy': 'Lossguide', 'min_data_in_leaf': 449, 'max_leaves': 159}. Best is trial 738 with value: 78.71473735766027.[0m
[32m[I 2024-10-13 13:57:19,704][0m Trial 900 finished with value: 271.1171363741446 and parameters: {'depth': 10, 'learning_rate': 0.0024008279120420004, 'iterations': 145, 'l2_leaf_reg': 0.0029989745548127528, 'border_count': 20, 'bagging_temperature': 0.08111885277951786, 'random_strength': 9.13580885987631, 'grow_policy': 'Lossguide', 'min_data_in_leaf': 431, 'max_leaves': 111}. Best is trial 738 with value: 78.71473735766027.[0m
