Optimizing CatBoost...
[32m[I 2024-10-13 13:25:31,058][0m Trial 0 finished with value: 122.30645682635857 and parameters: {'depth': 5, 'learning_rate': 0.17735180949404722, 'iterations': 1677, 'l2_leaf_reg': 0.422017561577613, 'border_count': 199, 'bagging_temperature': 0.8531114333439398, 'random_strength': 9.643473223521724, 'grow_policy': 'Lossguide', 'min_data_in_leaf': 967, 'max_leaves': 167}. Best is trial 0 with value: 122.30645682635857.[0m
[32m[I 2024-10-13 13:25:32,219][0m Trial 1 finished with value: 236.04845193258663 and parameters: {'depth': 10, 'learning_rate': 0.0009225527266523018, 'iterations': 691, 'l2_leaf_reg': 1.4269363048641992, 'border_count': 40, 'bagging_temperature': 0.4685373204270018, 'random_strength': 3.073824160394393, 'grow_policy': 'Lossguide', 'min_data_in_leaf': 89, 'max_leaves': 236}. Best is trial 0 with value: 122.30645682635857.[0m
[32m[I 2024-10-13 13:30:45,617][0m Trial 2 finished with value: 123.43375749329564 and parameters: {'depth': 15, 'learning_rate': 0.0007956919176906347, 'iterations': 2431, 'l2_leaf_reg': 1.5367699968150434, 'border_count': 66, 'bagging_temperature': 0.2816121812409246, 'random_strength': 1.4494343618090755, 'grow_policy': 'SymmetricTree', 'min_data_in_leaf': 966}. Best is trial 0 with value: 122.30645682635857.[0m
[32m[I 2024-10-13 13:30:47,666][0m Trial 3 finished with value: 98.32121638475992 and parameters: {'depth': 12, 'learning_rate': 0.0068401989488998454, 'iterations': 2299, 'l2_leaf_reg': 0.14937937196486312, 'border_count': 234, 'bagging_temperature': 0.4792341142212577, 'random_strength': 3.597981346746825, 'grow_policy': 'Depthwise', 'min_data_in_leaf': 275}. Best is trial 3 with value: 98.32121638475992.[0m
[32m[I 2024-10-13 13:34:45,198][0m Trial 4 finished with value: 124.42268620852701 and parameters: {'depth': 13, 'learning_rate': 0.0009761605441571207, 'iterations': 2272, 'l2_leaf_reg': 1.7232089780822526, 'border_count': 144, 'bagging_temperature': 0.8606081428624917, 'random_strength': 1.656078347510107, 'grow_policy': 'SymmetricTree', 'min_data_in_leaf': 484}. Best is trial 3 with value: 98.32121638475992.[0m
[32m[I 2024-10-13 13:34:55,164][0m Trial 5 finished with value: 236.30535619965352 and parameters: {'depth': 13, 'learning_rate': 0.00011175273419854394, 'iterations': 2996, 'l2_leaf_reg': 3.2572704912625158e-06, 'border_count': 85, 'bagging_temperature': 0.5710722415447929, 'random_strength': 0.2815714772451461, 'grow_policy': 'Depthwise', 'min_data_in_leaf': 8}. Best is trial 3 with value: 98.32121638475992.[0m
[32m[I 2024-10-13 13:34:58,197][0m Trial 6 finished with value: 123.59966784439068 and parameters: {'depth': 15, 'learning_rate': 0.09554029450951951, 'iterations': 1529, 'l2_leaf_reg': 0.0007546667136408425, 'border_count': 210, 'bagging_temperature': 0.20280898507446454, 'random_strength': 6.3977525093211955, 'grow_policy': 'Depthwise', 'min_data_in_leaf': 74}. Best is trial 3 with value: 98.32121638475992.[0m
[32m[I 2024-10-13 13:35:10,388][0m Trial 7 finished with value: 95.15528891153771 and parameters: {'depth': 9, 'learning_rate': 0.16163572898959425, 'iterations': 1205, 'l2_leaf_reg': 5.026885326117, 'border_count': 28, 'bagging_temperature': 0.007143125339771128, 'random_strength': 2.222240188242708, 'grow_policy': 'SymmetricTree', 'min_data_in_leaf': 103}. Best is trial 7 with value: 95.15528891153771.[0m
[32m[I 2024-10-13 13:35:11,973][0m Trial 8 finished with value: 237.87832054978313 and parameters: {'depth': 6, 'learning_rate': 0.00044145094891700966, 'iterations': 1425, 'l2_leaf_reg': 0.4909723600314172, 'border_count': 18, 'bagging_temperature': 0.2670591371567924, 'random_strength': 7.586599327083774, 'grow_policy': 'Depthwise', 'min_data_in_leaf': 922}. Best is trial 7 with value: 95.15528891153771.[0m
[32m[I 2024-10-13 13:35:13,691][0m Trial 9 finished with value: 96.22214157311514 and parameters: {'depth': 8, 'learning_rate': 0.01964136321251858, 'iterations': 1626, 'l2_leaf_reg': 1.5129044920700485, 'border_count': 81, 'bagging_temperature': 0.81797220458153, 'random_strength': 4.944367725410328, 'grow_policy': 'Lossguide', 'min_data_in_leaf': 738, 'max_leaves': 226}. Best is trial 7 with value: 95.15528891153771.[0m
[32m[I 2024-10-13 13:35:14,436][0m Trial 10 finished with value: 111.78080833469626 and parameters: {'depth': 3, 'learning_rate': 0.03763300475006432, 'iterations': 142, 'l2_leaf_reg': 1.3378380622358973e-08, 'border_count': 143, 'bagging_temperature': 0.05950554121713483, 'random_strength': 3.4978857456468955, 'grow_policy': 'SymmetricTree', 'min_data_in_leaf': 338}. Best is trial 7 with value: 95.15528891153771.[0m
[32m[I 2024-10-13 13:35:15,786][0m Trial 11 finished with value: 95.99277649159609 and parameters: {'depth': 8, 'learning_rate': 0.01769711122844219, 'iterations': 867, 'l2_leaf_reg': 0.004990351367994971, 'border_count': 82, 'bagging_temperature': 0.6541419147250126, 'random_strength': 5.76832724394981, 'grow_policy': 'Lossguide', 'min_data_in_leaf': 763, 'max_leaves': 36}. Best is trial 7 with value: 95.15528891153771.[0m
[32m[I 2024-10-13 13:35:22,353][0m Trial 12 finished with value: 152.92633797830754 and parameters: {'depth': 9, 'learning_rate': 0.22988708546311976, 'iterations': 800, 'l2_leaf_reg': 0.0064619680472277835, 'border_count': 3, 'bagging_temperature': 0.6720871345868682, 'random_strength': 5.837696471864551, 'grow_policy': 'SymmetricTree', 'min_data_in_leaf': 700}. Best is trial 7 with value: 95.15528891153771.[0m
[32m[I 2024-10-13 13:35:24,329][0m Trial 13 finished with value: 97.48659498976971 and parameters: {'depth': 7, 'learning_rate': 0.008602012743080534, 'iterations': 953, 'l2_leaf_reg': 3.856854770454342e-05, 'border_count': 113, 'bagging_temperature': 0.993478686793211, 'random_strength': 8.236577797072023, 'grow_policy': 'Lossguide', 'min_data_in_leaf': 686, 'max_leaves': 50}. Best is trial 7 with value: 95.15528891153771.[0m
[32m[I 2024-10-13 13:35:26,395][0m Trial 14 finished with value: 102.88301408147143 and parameters: {'depth': 10, 'learning_rate': 0.054249202471299926, 'iterations': 220, 'l2_leaf_reg': 0.011372294222998227, 'border_count': 50, 'bagging_temperature': 0.023620365857210723, 'random_strength': 4.666038015010776, 'grow_policy': 'SymmetricTree', 'min_data_in_leaf': 544}. Best is trial 7 with value: 95.15528891153771.[0m
[32m[I 2024-10-13 13:35:28,741][0m Trial 15 finished with value: 99.00975951498228 and parameters: {'depth': 11, 'learning_rate': 0.018537240850836516, 'iterations': 1081, 'l2_leaf_reg': 2.5778945035074824e-06, 'border_count': 116, 'bagging_temperature': 0.6586407723603656, 'random_strength': 2.160647395444158, 'grow_policy': 'Lossguide', 'min_data_in_leaf': 283, 'max_leaves': 31}. Best is trial 7 with value: 95.15528891153771.[0m
[32m[I 2024-10-13 13:35:31,073][0m Trial 16 finished with value: 120.04917642500776 and parameters: {'depth': 8, 'learning_rate': 0.003751676181954643, 'iterations': 419, 'l2_leaf_reg': 0.020922596545557632, 'border_count': 30, 'bagging_temperature': 0.42152217755352456, 'random_strength': 6.558326762734836, 'grow_policy': 'SymmetricTree', 'min_data_in_leaf': 824}. Best is trial 7 with value: 95.15528891153771.[0m
[32m[I 2024-10-13 13:35:33,582][0m Trial 17 finished with value: 103.64218760539575 and parameters: {'depth': 5, 'learning_rate': 0.0030855061641694172, 'iterations': 1245, 'l2_leaf_reg': 9.965947526002542e-05, 'border_count': 176, 'bagging_temperature': 0.3668795427855777, 'random_strength': 4.945231676887396, 'grow_policy': 'Lossguide', 'min_data_in_leaf': 501, 'max_leaves': 100}. Best is trial 7 with value: 95.15528891153771.[0m
[32m[I 2024-10-13 13:35:42,868][0m Trial 18 finished with value: 106.81933702927897 and parameters: {'depth': 3, 'learning_rate': 0.10615158097419734, 'iterations': 2048, 'l2_leaf_reg': 9.438843266657857, 'border_count': 91, 'bagging_temperature': 0.1333101048509755, 'random_strength': 0.5308632607930899, 'grow_policy': 'SymmetricTree', 'min_data_in_leaf': 405}. Best is trial 7 with value: 95.15528891153771.[0m
[32m[I 2024-10-13 13:35:43,803][0m Trial 19 finished with value: 95.85522220890668 and parameters: {'depth': 7, 'learning_rate': 0.0223137023001429, 'iterations': 534, 'l2_leaf_reg': 0.0012167466416200612, 'border_count': 54, 'bagging_temperature': 0.603780209758971, 'random_strength': 2.56291072568485, 'grow_policy': 'Lossguide', 'min_data_in_leaf': 181, 'max_leaves': 104}. Best is trial 7 with value: 95.15528891153771.[0m
[32m[I 2024-10-13 13:35:44,719][0m Trial 20 finished with value: 172.68108072410814 and parameters: {'depth': 6, 'learning_rate': 0.06184134113441172, 'iterations': 528, 'l2_leaf_reg': 9.392978398511471e-08, 'border_count': 3, 'bagging_temperature': 0.3364843865381008, 'random_strength': 2.416783877853402, 'grow_policy': 'Lossguide', 'min_data_in_leaf': 155, 'max_leaves': 132}. Best is trial 7 with value: 95.15528891153771.[0m
[32m[I 2024-10-13 13:35:46,090][0m Trial 21 finished with value: 97.23653967642163 and parameters: {'depth': 8, 'learning_rate': 0.019028111438093104, 'iterations': 1183, 'l2_leaf_reg': 0.0010167624816044389, 'border_count': 57, 'bagging_temperature': 0.6009569430301763, 'random_strength': 3.9494906351590897, 'grow_policy': 'Lossguide', 'min_data_in_leaf': 187, 'max_leaves': 83}. Best is trial 7 with value: 95.15528891153771.[0m
[32m[I 2024-10-13 13:35:47,181][0m Trial 22 finished with value: 119.1826239434809 and parameters: {'depth': 9, 'learning_rate': 0.2915176754753586, 'iterations': 799, 'l2_leaf_reg': 0.058996329712494446, 'border_count': 67, 'bagging_temperature': 0.7322849507884734, 'random_strength': 2.5464628578612016, 'grow_policy': 'Lossguide', 'min_data_in_leaf': 592, 'max_leaves': 82}. Best is trial 7 with value: 95.15528891153771.[0m
[32m[I 2024-10-13 13:35:48,105][0m Trial 23 finished with value: 88.95510395783269 and parameters: {'depth': 7, 'learning_rate': 0.027630858452382053, 'iterations': 537, 'l2_leaf_reg': 0.002783673107978994, 'border_count': 27, 'bagging_temperature': 0.579827173539979, 'random_strength': 0.9839082009167637, 'grow_policy': 'Lossguide', 'min_data_in_leaf': 201, 'max_leaves': 175}. Best is trial 23 with value: 88.95510395783269.[0m
[32m[I 2024-10-13 13:35:49,014][0m Trial 24 finished with value: 88.55303103080877 and parameters: {'depth': 6, 'learning_rate': 0.03253582321004901, 'iterations': 540, 'l2_leaf_reg': 1.567438128449923e-05, 'border_count': 27, 'bagging_temperature': 0.5176182462999513, 'random_strength': 1.032912363550861, 'grow_policy': 'Lossguide', 'min_data_in_leaf': 199, 'max_leaves': 179}. Best is trial 24 with value: 88.55303103080877.[0m
[32m[I 2024-10-13 13:35:49,839][0m Trial 25 finished with value: 103.95845656481256 and parameters: {'depth': 4, 'learning_rate': 0.14072608223525052, 'iterations': 298, 'l2_leaf_reg': 1.4224810876394484e-05, 'border_count': 22, 'bagging_temperature': 0.5196824352617975, 'random_strength': 1.1650098404465126, 'grow_policy': 'SymmetricTree', 'min_data_in_leaf': 20}. Best is trial 24 with value: 88.55303103080877.[0m
[32m[I 2024-10-13 13:35:50,804][0m Trial 26 finished with value: 87.48395460956036 and parameters: {'depth': 6, 'learning_rate': 0.04431747056221911, 'iterations': 599, 'l2_leaf_reg': 5.28261884997297e-07, 'border_count': 31, 'bagging_temperature': 0.5178182036542175, 'random_strength': 0.01907529229672633, 'grow_policy': 'Lossguide', 'min_data_in_leaf': 249, 'max_leaves': 180}. Best is trial 26 with value: 87.48395460956036.[0m
[32m[I 2024-10-13 13:35:51,818][0m Trial 27 finished with value: 170.44089594462443 and parameters: {'depth': 5, 'learning_rate': 0.042762035209138, 'iterations': 622, 'l2_leaf_reg': 4.322912577154728e-07, 'border_count': 3, 'bagging_temperature': 0.7641358363588556, 'random_strength': 0.6298309294887012, 'grow_policy': 'Lossguide', 'min_data_in_leaf': 376, 'max_leaves': 192}. Best is trial 26 with value: 87.48395460956036.[0m
[32m[I 2024-10-13 13:35:52,617][0m Trial 28 finished with value: 119.56475011118152 and parameters: {'depth': 6, 'learning_rate': 0.0075768343841901955, 'iterations': 355, 'l2_leaf_reg': 6.610712385348484e-07, 'border_count': 104, 'bagging_temperature': 0.4032424212652549, 'random_strength': 1.152906075982128, 'grow_policy': 'Lossguide', 'min_data_in_leaf': 275, 'max_leaves': 189}. Best is trial 26 with value: 87.48395460956036.[0m
[32m[I 2024-10-13 13:35:54,394][0m Trial 29 finished with value: 84.0423008373164 and parameters: {'depth': 4, 'learning_rate': 0.01185008953664201, 'iterations': 1773, 'l2_leaf_reg': 0.0001513953355975941, 'border_count': 37, 'bagging_temperature': 0.5354782085852343, 'random_strength': 0.31053677320252526, 'grow_policy': 'Lossguide', 'min_data_in_leaf': 219, 'max_leaves': 157}. Best is trial 29 with value: 84.0423008373164.[0m
[32m[I 2024-10-13 13:35:56,279][0m Trial 30 finished with value: 87.26213471258455 and parameters: {'depth': 4, 'learning_rate': 0.012218006246696096, 'iterations': 1757, 'l2_leaf_reg': 0.00013510695937991353, 'border_count': 44, 'bagging_temperature': 0.5053642762253432, 'random_strength': 0.14692818424406706, 'grow_policy': 'Lossguide', 'min_data_in_leaf': 432, 'max_leaves': 144}. Best is trial 29 with value: 84.0423008373164.[0m
[32m[I 2024-10-13 13:35:58,179][0m Trial 31 finished with value: 84.64857489502747 and parameters: {'depth': 4, 'learning_rate': 0.011027909509063563, 'iterations': 1899, 'l2_leaf_reg': 0.00015594073546457916, 'border_count': 41, 'bagging_temperature': 0.5126549098131904, 'random_strength': 0.05344825092916984, 'grow_policy': 'Lossguide', 'min_data_in_leaf': 414, 'max_leaves': 153}. Best is trial 29 with value: 84.0423008373164.[0m
[32m[I 2024-10-13 13:36:00,039][0m Trial 32 finished with value: 87.41410767695393 and parameters: {'depth': 4, 'learning_rate': 0.011262781351236775, 'iterations': 1858, 'l2_leaf_reg': 0.0001813871387646743, 'border_count': 42, 'bagging_temperature': 0.4426483918015739, 'random_strength': 0.10135076965900011, 'grow_policy': 'Lossguide', 'min_data_in_leaf': 414, 'max_leaves': 141}. Best is trial 29 with value: 84.0423008373164.[0m
[32m[I 2024-10-13 13:36:01,923][0m Trial 33 finished with value: 86.86391755645332 and parameters: {'depth': 4, 'learning_rate': 0.01097661917156819, 'iterations': 1873, 'l2_leaf_reg': 0.00015144143357149418, 'border_count': 45, 'bagging_temperature': 0.413188197962804, 'random_strength': 0.13460785086286298, 'grow_policy': 'Lossguide', 'min_data_in_leaf': 444, 'max_leaves': 142}. Best is trial 29 with value: 84.0423008373164.[0m
[32m[I 2024-10-13 13:36:03,773][0m Trial 34 finished with value: 95.19573341313709 and parameters: {'depth': 4, 'learning_rate': 0.003783800139984198, 'iterations': 1831, 'l2_leaf_reg': 0.0002666306751767668, 'border_count': 66, 'bagging_temperature': 0.35160849786832105, 'random_strength': 0.0006352151463283745, 'grow_policy': 'Lossguide', 'min_data_in_leaf': 441, 'max_leaves': 127}. Best is trial 29 with value: 84.0423008373164.[0m
[32m[I 2024-10-13 13:36:05,793][0m Trial 35 finished with value: 97.01003006094103 and parameters: {'depth': 3, 'learning_rate': 0.002443953991035386, 'iterations': 2063, 'l2_leaf_reg': 5.6230767847202517e-05, 'border_count': 43, 'bagging_temperature': 0.2724167183611229, 'random_strength': 9.862417714871192, 'grow_policy': 'Lossguide', 'min_data_in_leaf': 606, 'max_leaves': 153}. Best is trial 29 with value: 84.0423008373164.[0m
[32m[I 2024-10-13 13:36:08,382][0m Trial 36 finished with value: 99.50969748791611 and parameters: {'depth': 5, 'learning_rate': 0.012400166075066388, 'iterations': 2668, 'l2_leaf_reg': 0.0004919295501958122, 'border_count': 70, 'bagging_temperature': 0.4652015644497117, 'random_strength': 1.5989062891799923, 'grow_policy': 'Depthwise', 'min_data_in_leaf': 336}. Best is trial 29 with value: 84.0423008373164.[0m
[32m[I 2024-10-13 13:36:10,310][0m Trial 37 finished with value: 118.65254464751905 and parameters: {'depth': 4, 'learning_rate': 0.001507762151886779, 'iterations': 1844, 'l2_leaf_reg': 7.142143655611613e-06, 'border_count': 181, 'bagging_temperature': 0.5356756738108465, 'random_strength': 1.821173984432349, 'grow_policy': 'Lossguide', 'min_data_in_leaf': 493, 'max_leaves': 157}. Best is trial 29 with value: 84.0423008373164.[0m
[32m[I 2024-10-13 13:36:12,380][0m Trial 38 finished with value: 97.42369753268363 and parameters: {'depth': 3, 'learning_rate': 0.005351789553451374, 'iterations': 2081, 'l2_leaf_reg': 4.042301266102691e-05, 'border_count': 94, 'bagging_temperature': 0.31480279733004835, 'random_strength': 0.6042809580253289, 'grow_policy': 'Lossguide', 'min_data_in_leaf': 344, 'max_leaves': 211}. Best is trial 29 with value: 84.0423008373164.[0m
[32m[I 2024-10-13 13:36:14,816][0m Trial 39 finished with value: 98.24503695758288 and parameters: {'depth': 4, 'learning_rate': 0.0053236778973120725, 'iterations': 2546, 'l2_leaf_reg': 0.00013591847523015838, 'border_count': 247, 'bagging_temperature': 0.20448600571798958, 'random_strength': 9.048870989129803, 'grow_policy': 'Depthwise', 'min_data_in_leaf': 568}. Best is trial 29 with value: 84.0423008373164.[0m
[32m[I 2024-10-13 13:36:16,352][0m Trial 40 finished with value: 95.6418682929871 and parameters: {'depth': 5, 'learning_rate': 0.011265725806961401, 'iterations': 1388, 'l2_leaf_reg': 0.0018230341860073745, 'border_count': 54, 'bagging_temperature': 0.39951682110919584, 'random_strength': 3.0478661973045544, 'grow_policy': 'Lossguide', 'min_data_in_leaf': 461, 'max_leaves': 116}. Best is trial 29 with value: 84.0423008373164.[0m
[32m[I 2024-10-13 13:36:18,190][0m Trial 41 finished with value: 84.75655302693818 and parameters: {'depth': 4, 'learning_rate': 0.012011104473523609, 'iterations': 1771, 'l2_leaf_reg': 0.0001765147042238729, 'border_count': 41, 'bagging_temperature': 0.47554330900507613, 'random_strength': 0.45778037103672964, 'grow_policy': 'Lossguide', 'min_data_in_leaf': 416, 'max_leaves': 149}. Best is trial 29 with value: 84.0423008373164.[0m
[32m[I 2024-10-13 13:36:19,957][0m Trial 42 finished with value: 93.45740313995533 and parameters: {'depth': 4, 'learning_rate': 0.009506022420569934, 'iterations': 1709, 'l2_leaf_reg': 0.00030726401786371915, 'border_count': 15, 'bagging_temperature': 0.4719001645012065, 'random_strength': 0.6687583436699074, 'grow_policy': 'Lossguide', 'min_data_in_leaf': 526, 'max_leaves': 151}. Best is trial 29 with value: 84.0423008373164.[0m
[32m[I 2024-10-13 13:36:21,581][0m Trial 43 finished with value: 84.41762358714496 and parameters: {'depth': 3, 'learning_rate': 0.01427240042134608, 'iterations': 1502, 'l2_leaf_reg': 1.6867919925809756e-05, 'border_count': 41, 'bagging_temperature': 0.47961513914188825, 'random_strength': 1.6890064212348967, 'grow_policy': 'Lossguide', 'min_data_in_leaf': 371, 'max_leaves': 132}. Best is trial 29 with value: 84.0423008373164.[0m
[32m[I 2024-10-13 13:36:23,737][0m Trial 44 finished with value: 95.50416762766535 and parameters: {'depth': 3, 'learning_rate': 0.0053722423402304195, 'iterations': 2257, 'l2_leaf_reg': 2.9523900339978023e-06, 'border_count': 76, 'bagging_temperature': 0.5573276066199482, 'random_strength': 1.5996729835118018, 'grow_policy': 'Lossguide', 'min_data_in_leaf': 313, 'max_leaves': 125}. Best is trial 29 with value: 84.0423008373164.[0m
[32m[I 2024-10-13 13:36:25,392][0m Trial 45 finished with value: 125.51694999612987 and parameters: {'depth': 5, 'learning_rate': 0.0017910926620834536, 'iterations': 1506, 'l2_leaf_reg': 1.8451756539622053e-05, 'border_count': 13, 'bagging_temperature': 0.6387775000704574, 'random_strength': 0.830044394972989, 'grow_policy': 'Lossguide', 'min_data_in_leaf': 382, 'max_leaves': 163}. Best is trial 29 with value: 84.0423008373164.[0m
[32m[I 2024-10-13 13:36:27,480][0m Trial 46 finished with value: 98.6972798804034 and parameters: {'depth': 3, 'learning_rate': 0.01484622515041831, 'iterations': 1965, 'l2_leaf_reg': 5.604554796475278e-05, 'border_count': 58, 'bagging_temperature': 0.4573573666651247, 'random_strength': 1.8036820099505335, 'grow_policy': 'Depthwise', 'min_data_in_leaf': 643}. Best is trial 29 with value: 84.0423008373164.[0m
[32m[I 2024-10-13 13:36:29,220][0m Trial 47 finished with value: 85.95299338732326 and parameters: {'depth': 14, 'learning_rate': 0.0068829958884548195, 'iterations': 1584, 'l2_leaf_reg': 7.559580455765547e-06, 'border_count': 36, 'bagging_temperature': 0.716801733511925, 'random_strength': 1.3039362638171437, 'grow_policy': 'Lossguide', 'min_data_in_leaf': 125, 'max_leaves': 165}. Best is trial 29 with value: 84.0423008373164.[0m
[32m[I 2024-10-13 13:36:30,913][0m Trial 48 finished with value: 97.43873960869743 and parameters: {'depth': 15, 'learning_rate': 0.007621525120716279, 'iterations': 1642, 'l2_leaf_reg': 5.077090202371388e-06, 'border_count': 135, 'bagging_temperature': 0.7028128890271427, 'random_strength': 3.167624271130632, 'grow_policy': 'Lossguide', 'min_data_in_leaf': 113, 'max_leaves': 167}. Best is trial 29 with value: 84.0423008373164.[0m
[32m[I 2024-10-13 13:36:33,449][0m Trial 49 finished with value: 92.89645404490443 and parameters: {'depth': 12, 'learning_rate': 0.026532007826614475, 'iterations': 1353, 'l2_leaf_reg': 2.1902316492382762e-05, 'border_count': 35, 'bagging_temperature': 0.9004484368688486, 'random_strength': 1.3785505616001215, 'grow_policy': 'Depthwise', 'min_data_in_leaf': 41}. Best is trial 29 with value: 84.0423008373164.[0m
[32m[I 2024-10-13 13:36:35,667][0m Trial 50 finished with value: 188.63901074244725 and parameters: {'depth': 13, 'learning_rate': 0.0005181054922840225, 'iterations': 2225, 'l2_leaf_reg': 0.00043685829419065153, 'border_count': 15, 'bagging_temperature': 0.7714973875493379, 'random_strength': 4.092241752670835, 'grow_policy': 'Lossguide', 'min_data_in_leaf': 242, 'max_leaves': 202}. Best is trial 29 with value: 84.0423008373164.[0m
