[32m[I 2024-10-13 13:55:01,620][0m Trial 751 finished with value: 237.0716642181077 and parameters: {'depth': 7, 'learning_rate': 0.0030932650370479775, 'iterations': 198, 'l2_leaf_reg': 8.413315102332977e-08, 'border_count': 42, 'bagging_temperature': 0.13629936635425677, 'random_strength': 9.684194809539575, 'grow_policy': 'Lossguide', 'min_data_in_leaf': 739, 'max_leaves': 124}. Best is trial 738 with value: 78.71473735766027.[0m
[32m[I 2024-10-13 13:55:03,045][0m Trial 752 finished with value: 109.53681476670499 and parameters: {'depth': 8, 'learning_rate': 0.11001424535747681, 'iterations': 1178, 'l2_leaf_reg': 5.860019755148501e-08, 'border_count': 58, 'bagging_temperature': 0.1581138699213216, 'random_strength': 8.836192063523162, 'grow_policy': 'Lossguide', 'min_data_in_leaf': 701, 'max_leaves': 101}. Best is trial 738 with value: 78.71473735766027.[0m
[32m[I 2024-10-13 13:55:03,690][0m Trial 753 finished with value: 100.948554770019 and parameters: {'depth': 14, 'learning_rate': 0.17009205328963548, 'iterations': 152, 'l2_leaf_reg': 1.597879381223978e-08, 'border_count': 192, 'bagging_temperature': 0.11633980869602314, 'random_strength': 9.30755276838683, 'grow_policy': 'Lossguide', 'min_data_in_leaf': 432, 'max_leaves': 139}. Best is trial 738 with value: 78.71473735766027.[0m
[32m[I 2024-10-13 13:55:04,595][0m Trial 754 finished with value: 100.6324257092358 and parameters: {'depth': 6, 'learning_rate': 0.08520727398770159, 'iterations': 410, 'l2_leaf_reg': 2.3887873478483493e-08, 'border_count': 73, 'bagging_temperature': 0.14171799865262974, 'random_strength': 9.502798016509654, 'grow_policy': 'Lossguide', 'min_data_in_leaf': 843, 'max_leaves': 135}. Best is trial 738 with value: 78.71473735766027.[0m
[32m[I 2024-10-13 13:55:06,821][0m Trial 755 finished with value: 95.91373645135442 and parameters: {'depth': 14, 'learning_rate': 0.06307496180949924, 'iterations': 2284, 'l2_leaf_reg': 1.387672710882744e-08, 'border_count': 35, 'bagging_temperature': 0.07060874190710754, 'random_strength': 8.693878904610937, 'grow_policy': 'Lossguide', 'min_data_in_leaf': 613, 'max_leaves': 114}. Best is trial 738 with value: 78.71473735766027.[0m
[32m[I 2024-10-13 13:55:07,625][0m Trial 756 finished with value: 94.3068964599133 and parameters: {'depth': 5, 'learning_rate': 0.29980689500300933, 'iterations': 294, 'l2_leaf_reg': 1.007582703264475e-08, 'border_count': 32, 'bagging_temperature': 0.17962479715826266, 'random_strength': 9.190243518917105, 'grow_policy': 'Lossguide', 'min_data_in_leaf': 550, 'max_leaves': 128}. Best is trial 738 with value: 78.71473735766027.[0m
[32m[I 2024-10-13 13:55:08,221][0m Trial 757 finished with value: 86.46981033995405 and parameters: {'depth': 13, 'learning_rate': 0.2071866930861577, 'iterations': 100, 'l2_leaf_reg': 9.733108714926141, 'border_count': 25, 'bagging_temperature': 0.036922581938881024, 'random_strength': 9.74660638262711, 'grow_policy': 'Lossguide', 'min_data_in_leaf': 457, 'max_leaves': 141}. Best is trial 738 with value: 78.71473735766027.[0m
[32m[I 2024-10-13 13:55:08,995][0m Trial 758 finished with value: 91.01208547409145 and parameters: {'depth': 7, 'learning_rate': 0.14243166583064842, 'iterations': 243, 'l2_leaf_reg': 3.0667134936287326e-08, 'border_count': 17, 'bagging_temperature': 0.11692228032248797, 'random_strength': 9.031889670923725, 'grow_policy': 'Lossguide', 'min_data_in_leaf': 522, 'max_leaves': 86}. Best is trial 738 with value: 78.71473735766027.[0m
[32m[I 2024-10-13 13:55:09,977][0m Trial 759 finished with value: 111.39374432915821 and parameters: {'depth': 6, 'learning_rate': 0.09345586821013602, 'iterations': 341, 'l2_leaf_reg': 4.857943363081933e-08, 'border_count': 23, 'bagging_temperature': 0.07923656138835997, 'random_strength': 9.31807925799391, 'grow_policy': 'SymmetricTree', 'min_data_in_leaf': 209}. Best is trial 738 with value: 78.71473735766027.[0m
[32m[I 2024-10-13 13:55:10,655][0m Trial 760 finished with value: 87.57061937256375 and parameters: {'depth': 15, 'learning_rate': 0.18591946250657385, 'iterations': 190, 'l2_leaf_reg': 1.966920368120138e-08, 'border_count': 40, 'bagging_temperature': 0.10323583926930856, 'random_strength': 9.60518177145003, 'grow_policy': 'Lossguide', 'min_data_in_leaf': 404, 'max_leaves': 145}. Best is trial 738 with value: 78.71473735766027.[0m
[32m[I 2024-10-13 13:55:12,816][0m Trial 761 finished with value: 106.5130113295219 and parameters: {'depth': 7, 'learning_rate': 0.07300771873809903, 'iterations': 2187, 'l2_leaf_reg': 1.0171773439193979e-08, 'border_count': 29, 'bagging_temperature': 0.15389774254616415, 'random_strength': 9.493833652970851, 'grow_policy': 'Lossguide', 'min_data_in_leaf': 482, 'max_leaves': 138}. Best is trial 738 with value: 78.71473735766027.[0m
[32m[I 2024-10-13 13:55:14,054][0m Trial 762 finished with value: 93.23204101634019 and parameters: {'depth': 9, 'learning_rate': 0.1126067591913872, 'iterations': 954, 'l2_leaf_reg': 7.2752686986977e-08, 'border_count': 35, 'bagging_temperature': 0.1300046286652399, 'random_strength': 9.984365222923136, 'grow_policy': 'Lossguide', 'min_data_in_leaf': 589, 'max_leaves': 108}. Best is trial 738 with value: 78.71473735766027.[0m
[32m[I 2024-10-13 13:55:14,700][0m Trial 763 finished with value: 89.0514854462505 and parameters: {'depth': 13, 'learning_rate': 0.05685444616423112, 'iterations': 148, 'l2_leaf_reg': 3.4905128321459765e-08, 'border_count': 27, 'bagging_temperature': 0.18519753438455355, 'random_strength': 9.784148976620617, 'grow_policy': 'Lossguide', 'min_data_in_leaf': 472, 'max_leaves': 131}. Best is trial 738 with value: 78.71473735766027.[0m
[32m[I 2024-10-13 13:55:15,493][0m Trial 764 finished with value: 94.85930276413542 and parameters: {'depth': 5, 'learning_rate': 0.2600366078805543, 'iterations': 277, 'l2_leaf_reg': 2.0312223615086112e-08, 'border_count': 20, 'bagging_temperature': 0.056018865425330605, 'random_strength': 8.359115734140028, 'grow_policy': 'Lossguide', 'min_data_in_leaf': 535, 'max_leaves': 96}. Best is trial 738 with value: 78.71473735766027.[0m
[32m[I 2024-10-13 13:55:16,208][0m Trial 765 finished with value: 87.76497351463975 and parameters: {'depth': 8, 'learning_rate': 0.12531751762317025, 'iterations': 212, 'l2_leaf_reg': 1.527504264396348e-08, 'border_count': 32, 'bagging_temperature': 0.16108316224274535, 'random_strength': 9.20825465785078, 'grow_policy': 'Lossguide', 'min_data_in_leaf': 506, 'max_leaves': 121}. Best is trial 738 with value: 78.71473735766027.[0m
[32m[I 2024-10-13 13:55:17,003][0m Trial 766 finished with value: 92.7246956632384 and parameters: {'depth': 14, 'learning_rate': 0.08050226749891945, 'iterations': 324, 'l2_leaf_reg': 0.6994262707053126, 'border_count': 14, 'bagging_temperature': 0.09075019582753487, 'random_strength': 8.83857059413981, 'grow_policy': 'Lossguide', 'min_data_in_leaf': 452, 'max_leaves': 147}. Best is trial 738 with value: 78.71473735766027.[0m
[32m[I 2024-10-13 13:55:17,603][0m Trial 767 finished with value: 85.55361897132026 and parameters: {'depth': 7, 'learning_rate': 0.09226426171928565, 'iterations': 100, 'l2_leaf_reg': 3.158967845319399e-08, 'border_count': 44, 'bagging_temperature': 0.020328994824549834, 'random_strength': 9.412736893406116, 'grow_policy': 'Lossguide', 'min_data_in_leaf': 181, 'max_leaves': 105}. Best is trial 738 with value: 78.71473735766027.[0m
[32m[I 2024-10-13 13:55:18,307][0m Trial 768 finished with value: 82.33385285354392 and parameters: {'depth': 6, 'learning_rate': 0.1510365231089638, 'iterations': 238, 'l2_leaf_reg': 1.217301256479898e-07, 'border_count': 24, 'bagging_temperature': 0.12453506769745554, 'random_strength': 9.65004934216434, 'grow_policy': 'Depthwise', 'min_data_in_leaf': 556}. Best is trial 738 with value: 78.71473735766027.[0m
[32m[I 2024-10-13 13:55:19,056][0m Trial 769 finished with value: 83.02592676677969 and parameters: {'depth': 9, 'learning_rate': 0.06961661331747399, 'iterations': 166, 'l2_leaf_reg': 2.175614166540785e-08, 'border_count': 37, 'bagging_temperature': 0.14547135961619392, 'random_strength': 9.10233380494445, 'grow_policy': 'Lossguide', 'min_data_in_leaf': 798, 'max_leaves': 142}. Best is trial 738 with value: 78.71473735766027.[0m
[32m[I 2024-10-13 13:55:19,735][0m Trial 770 finished with value: 91.47749488912073 and parameters: {'depth': 4, 'learning_rate': 0.1820619889506521, 'iterations': 190, 'l2_leaf_reg': 4.053039063881197e-08, 'border_count': 31, 'bagging_temperature': 0.1983274343072744, 'random_strength': 8.588197322037942, 'grow_policy': 'Lossguide', 'min_data_in_leaf': 483, 'max_leaves': 136}. Best is trial 738 with value: 78.71473735766027.[0m
[32m[I 2024-10-13 13:55:20,454][0m Trial 771 finished with value: 84.07029706450649 and parameters: {'depth': 6, 'learning_rate': 0.10329576508199848, 'iterations': 259, 'l2_leaf_reg': 1.0181009651009378e-08, 'border_count': 49, 'bagging_temperature': 0.1765824694168992, 'random_strength': 2.2673999340242124, 'grow_policy': 'Lossguide', 'min_data_in_leaf': 426, 'max_leaves': 149}. Best is trial 738 with value: 78.71473735766027.[0m
[32m[I 2024-10-13 13:55:21,304][0m Trial 772 finished with value: 93.3247165752904 and parameters: {'depth': 8, 'learning_rate': 0.12349782376115036, 'iterations': 378, 'l2_leaf_reg': 5.9019757575031206e-08, 'border_count': 19, 'bagging_temperature': 0.09423950376993145, 'random_strength': 9.4137998274492, 'grow_policy': 'Lossguide', 'min_data_in_leaf': 527, 'max_leaves': 113}. Best is trial 738 with value: 78.71473735766027.[0m
[32m[I 2024-10-13 13:55:21,967][0m Trial 773 finished with value: 319.525085022827 and parameters: {'depth': 13, 'learning_rate': 0.00018011689853525493, 'iterations': 159, 'l2_leaf_reg': 1.4982567136713864e-08, 'border_count': 25, 'bagging_temperature': 0.0683407621081418, 'random_strength': 9.759802874071356, 'grow_policy': 'Lossguide', 'min_data_in_leaf': 647, 'max_leaves': 132}. Best is trial 738 with value: 78.71473735766027.[0m
[32m[I 2024-10-13 13:55:22,736][0m Trial 774 finished with value: 82.65708670945119 and parameters: {'depth': 15, 'learning_rate': 0.06174470513663508, 'iterations': 293, 'l2_leaf_reg': 1.994102782867522e-07, 'border_count': 33, 'bagging_temperature': 0.11546721764745935, 'random_strength': 8.959281010328255, 'grow_policy': 'Lossguide', 'min_data_in_leaf': 503, 'max_leaves': 143}. Best is trial 738 with value: 78.71473735766027.[0m
[32m[I 2024-10-13 13:55:23,450][0m Trial 775 finished with value: 98.18745800345515 and parameters: {'depth': 14, 'learning_rate': 0.05475784281525176, 'iterations': 231, 'l2_leaf_reg': 2.4729507853778386e-08, 'border_count': 94, 'bagging_temperature': 0.9306948625949131, 'random_strength': 9.296115299645933, 'grow_policy': 'Lossguide', 'min_data_in_leaf': 871, 'max_leaves': 126}. Best is trial 738 with value: 78.71473735766027.[0m
[32m[I 2024-10-13 13:55:24,133][0m Trial 776 finished with value: 109.43356388374337 and parameters: {'depth': 7, 'learning_rate': 0.20727066725453286, 'iterations': 141, 'l2_leaf_reg': 8.57867111792016e-08, 'border_count': 178, 'bagging_temperature': 0.3869810419140315, 'random_strength': 9.586574848425242, 'grow_policy': 'Lossguide', 'min_data_in_leaf': 585, 'max_leaves': 138}. Best is trial 738 with value: 78.71473735766027.[0m
[32m[I 2024-10-13 13:55:24,905][0m Trial 777 finished with value: 85.6984081568286 and parameters: {'depth': 8, 'learning_rate': 0.0816828090558184, 'iterations': 327, 'l2_leaf_reg': 1.5108832561621807e-08, 'border_count': 40, 'bagging_temperature': 0.13934107237512208, 'random_strength': 9.518979723488139, 'grow_policy': 'Lossguide', 'min_data_in_leaf': 463, 'max_leaves': 119}. Best is trial 738 with value: 78.71473735766027.[0m
[32m[I 2024-10-13 13:55:25,522][0m Trial 778 finished with value: 86.24872003953426 and parameters: {'depth': 6, 'learning_rate': 0.14049906887541622, 'iterations': 101, 'l2_leaf_reg': 4.408406311556786e-08, 'border_count': 28, 'bagging_temperature': 0.45286811430407753, 'random_strength': 9.770159664876926, 'grow_policy': 'Lossguide', 'min_data_in_leaf': 444, 'max_leaves': 147}. Best is trial 738 with value: 78.71473735766027.[0m
[32m[I 2024-10-13 13:55:26,413][0m Trial 779 finished with value: 104.45612962930134 and parameters: {'depth': 7, 'learning_rate': 0.01634116482167905, 'iterations': 215, 'l2_leaf_reg': 2.797309888463922e-08, 'border_count': 20, 'bagging_temperature': 0.035064665893947675, 'random_strength': 9.981840869994944, 'grow_policy': 'SymmetricTree', 'min_data_in_leaf': 558}. Best is trial 738 with value: 78.71473735766027.[0m
[32m[I 2024-10-13 13:55:27,251][0m Trial 780 finished with value: 115.71240425081069 and parameters: {'depth': 5, 'learning_rate': 0.10717905818819931, 'iterations': 421, 'l2_leaf_reg': 2.14543436147891e-08, 'border_count': 8, 'bagging_temperature': 0.16402135774260584, 'random_strength': 2.4836415371568537, 'grow_policy': 'Lossguide', 'min_data_in_leaf': 487, 'max_leaves': 141}. Best is trial 738 with value: 78.71473735766027.[0m
[32m[I 2024-10-13 13:55:28,410][0m Trial 781 finished with value: 87.6805130342693 and parameters: {'depth': 9, 'learning_rate': 0.2608467827254322, 'iterations': 832, 'l2_leaf_reg': 1.5207558911459085e-08, 'border_count': 13, 'bagging_temperature': 0.10450924921343288, 'random_strength': 9.17774988840049, 'grow_policy': 'Lossguide', 'min_data_in_leaf': 677, 'max_leaves': 33}. Best is trial 738 with value: 78.71473735766027.[0m
[32m[I 2024-10-13 13:55:29,187][0m Trial 782 finished with value: 83.48042295504091 and parameters: {'depth': 9, 'learning_rate': 0.17345135131845246, 'iterations': 184, 'l2_leaf_reg': 1.0210166525134093e-08, 'border_count': 24, 'bagging_temperature': 0.19655338214826884, 'random_strength': 8.709028415673409, 'grow_policy': 'Lossguide', 'min_data_in_leaf': 521, 'max_leaves': 152}. Best is trial 738 with value: 78.71473735766027.[0m
[32m[I 2024-10-13 13:55:29,939][0m Trial 783 finished with value: 88.80365087289846 and parameters: {'depth': 13, 'learning_rate': 0.09680243098076632, 'iterations': 257, 'l2_leaf_reg': 4.310249971402468e-08, 'border_count': 36, 'bagging_temperature': 0.21575228626091403, 'random_strength': 9.01140073035158, 'grow_policy': 'Lossguide', 'min_data_in_leaf': 90, 'max_leaves': 136}. Best is trial 738 with value: 78.71473735766027.[0m
[32m[I 2024-10-13 13:55:30,591][0m Trial 784 finished with value: 89.01533856553965 and parameters: {'depth': 14, 'learning_rate': 0.06830474027482639, 'iterations': 157, 'l2_leaf_reg': 5.2265543912431855, 'border_count': 29, 'bagging_temperature': 0.13367850471628834, 'random_strength': 9.36161698272762, 'grow_policy': 'Lossguide', 'min_data_in_leaf': 503, 'max_leaves': 110}. Best is trial 738 with value: 78.71473735766027.[0m
[32m[I 2024-10-13 13:55:32,556][0m Trial 785 finished with value: 93.7515654606788 and parameters: {'depth': 7, 'learning_rate': 0.019929855267295352, 'iterations': 1872, 'l2_leaf_reg': 2.8374767428524913e-08, 'border_count': 19, 'bagging_temperature': 0.05533532242291722, 'random_strength': 9.62102999623211, 'grow_policy': 'Lossguide', 'min_data_in_leaf': 228, 'max_leaves': 145}. Best is trial 738 with value: 78.71473735766027.[0m
[32m[I 2024-10-13 13:55:33,351][0m Trial 786 finished with value: 92.09920387312775 and parameters: {'depth': 6, 'learning_rate': 0.2304809454298024, 'iterations': 320, 'l2_leaf_reg': 1.6915726840709422e-08, 'border_count': 33, 'bagging_temperature': 0.08534445504732797, 'random_strength': 9.803345062830475, 'grow_policy': 'Lossguide', 'min_data_in_leaf': 167, 'max_leaves': 129}. Best is trial 738 with value: 78.71473735766027.[0m
[32m[I 2024-10-13 13:55:33,959][0m Trial 787 finished with value: 83.27680546050837 and parameters: {'depth': 8, 'learning_rate': 0.11936023782516117, 'iterations': 101, 'l2_leaf_reg': 7.004165227208107e-08, 'border_count': 24, 'bagging_temperature': 0.17756739293007306, 'random_strength': 9.151348876022391, 'grow_policy': 'Lossguide', 'min_data_in_leaf': 198, 'max_leaves': 134}. Best is trial 738 with value: 78.71473735766027.[0m
[32m[I 2024-10-13 13:55:34,700][0m Trial 788 finished with value: 82.77347184658372 and parameters: {'depth': 15, 'learning_rate': 0.08540915286790712, 'iterations': 243, 'l2_leaf_reg': 2.0746087225745875e-08, 'border_count': 45, 'bagging_temperature': 0.14889159221278747, 'random_strength': 9.31189505394671, 'grow_policy': 'Lossguide', 'min_data_in_leaf': 471, 'max_leaves': 149}. Best is trial 738 with value: 78.71473735766027.[0m
[32m[I 2024-10-13 13:55:35,403][0m Trial 789 finished with value: 91.09904595815499 and parameters: {'depth': 6, 'learning_rate': 0.15224763396364646, 'iterations': 204, 'l2_leaf_reg': 1.0096618295939448e-08, 'border_count': 17, 'bagging_temperature': 0.114067419594964, 'random_strength': 8.840329150515347, 'grow_policy': 'Lossguide', 'min_data_in_leaf': 544, 'max_leaves': 117}. Best is trial 738 with value: 78.71473735766027.[0m
[32m[I 2024-10-13 13:55:36,271][0m Trial 790 finished with value: 81.45190262694615 and parameters: {'depth': 14, 'learning_rate': 0.05294799710270618, 'iterations': 367, 'l2_leaf_reg': 3.030681819550801e-08, 'border_count': 38, 'bagging_temperature': 0.0013252188345025395, 'random_strength': 1.9270438483737786, 'grow_policy': 'Depthwise', 'min_data_in_leaf': 603}. Best is trial 738 with value: 78.71473735766027.[0m
[32m[I 2024-10-13 13:55:37,466][0m Trial 791 finished with value: 95.69919430992839 and parameters: {'depth': 7, 'learning_rate': 0.07057759686059087, 'iterations': 883, 'l2_leaf_reg': 4.406022957822848e-08, 'border_count': 28, 'bagging_temperature': 0.2226859462822212, 'random_strength': 9.46830553996214, 'grow_policy': 'Lossguide', 'min_data_in_leaf': 408, 'max_leaves': 74}. Best is trial 738 with value: 78.71473735766027.[0m
[32m[I 2024-10-13 13:55:38,187][0m Trial 792 finished with value: 87.627989019522 and parameters: {'depth': 13, 'learning_rate': 0.10542698773866462, 'iterations': 273, 'l2_leaf_reg': 1.5689568843828894e-08, 'border_count': 31, 'bagging_temperature': 0.07390507817924748, 'random_strength': 9.845281278504476, 'grow_policy': 'Lossguide', 'min_data_in_leaf': 489, 'max_leaves': 103}. Best is trial 738 with value: 78.71473735766027.[0m
[32m[I 2024-10-13 13:55:38,847][0m Trial 793 finished with value: 92.72063547927436 and parameters: {'depth': 9, 'learning_rate': 0.13912251209278165, 'iterations': 160, 'l2_leaf_reg': 2.3119902542060276e-08, 'border_count': 22, 'bagging_temperature': 0.16546344640929475, 'random_strength': 8.478706875070293, 'grow_policy': 'Lossguide', 'min_data_in_leaf': 574, 'max_leaves': 143}. Best is trial 738 with value: 78.71473735766027.[0m
[32m[I 2024-10-13 13:55:39,622][0m Trial 794 finished with value: 92.80509372150696 and parameters: {'depth': 6, 'learning_rate': 0.07880163456864775, 'iterations': 201, 'l2_leaf_reg': 0.02885951550422222, 'border_count': 14, 'bagging_temperature': 0.12510631070797607, 'random_strength': 9.543794330515757, 'grow_policy': 'Lossguide', 'min_data_in_leaf': 430, 'max_leaves': 154}. Best is trial 738 with value: 78.71473735766027.[0m
[32m[I 2024-10-13 13:55:40,366][0m Trial 795 finished with value: 200.16854961042344 and parameters: {'depth': 7, 'learning_rate': 0.00373998885714345, 'iterations': 270, 'l2_leaf_reg': 9.767324580541089e-08, 'border_count': 27, 'bagging_temperature': 0.045458830728540275, 'random_strength': 8.997732831419858, 'grow_policy': 'Lossguide', 'min_data_in_leaf': 528, 'max_leaves': 140}. Best is trial 738 with value: 78.71473735766027.[0m
[32m[I 2024-10-13 13:55:41,055][0m Trial 796 finished with value: 88.53139549352579 and parameters: {'depth': 8, 'learning_rate': 0.1936979043503223, 'iterations': 149, 'l2_leaf_reg': 5.9546856164344936e-08, 'border_count': 40, 'bagging_temperature': 0.19515642556971385, 'random_strength': 9.279359493684114, 'grow_policy': 'Lossguide', 'min_data_in_leaf': 722, 'max_leaves': 122}. Best is trial 738 with value: 78.71473735766027.[0m
[32m[I 2024-10-13 13:55:41,835][0m Trial 797 finished with value: 81.56582403195327 and parameters: {'depth': 4, 'learning_rate': 0.06138608120004216, 'iterations': 318, 'l2_leaf_reg': 6.382284368940193e-07, 'border_count': 35, 'bagging_temperature': 0.14856449960915855, 'random_strength': 9.730672755065866, 'grow_policy': 'Lossguide', 'min_data_in_leaf': 444, 'max_leaves': 175}. Best is trial 738 with value: 78.71473735766027.[0m
[32m[I 2024-10-13 13:55:42,467][0m Trial 798 finished with value: 94.10978788029817 and parameters: {'depth': 13, 'learning_rate': 0.12250759096930576, 'iterations': 101, 'l2_leaf_reg': 1.4254518506429698e-08, 'border_count': 20, 'bagging_temperature': 0.10519087312387747, 'random_strength': 9.983556768207963, 'grow_policy': 'Lossguide', 'min_data_in_leaf': 149, 'max_leaves': 150}. Best is trial 738 with value: 78.71473735766027.[0m
[32m[I 2024-10-13 13:55:43,236][0m Trial 799 finished with value: 88.49316660910625 and parameters: {'depth': 5, 'learning_rate': 0.09609773721115282, 'iterations': 214, 'l2_leaf_reg': 3.205005614433166e-08, 'border_count': 27, 'bagging_temperature': 0.09358483343561845, 'random_strength': 9.598565772738356, 'grow_policy': 'Lossguide', 'min_data_in_leaf': 628, 'max_leaves': 132}. Best is trial 738 with value: 78.71473735766027.[0m
[32m[I 2024-10-13 13:55:44,063][0m Trial 800 finished with value: 115.3364949038357 and parameters: {'depth': 14, 'learning_rate': 0.16613379745585952, 'iterations': 406, 'l2_leaf_reg': 1.9372872512746488e-08, 'border_count': 7, 'bagging_temperature': 0.17930663197485808, 'random_strength': 5.281368437765777, 'grow_policy': 'Lossguide', 'min_data_in_leaf': 469, 'max_leaves': 139}. Best is trial 738 with value: 78.71473735766027.[0m
