[32m[I 2024-10-13 13:51:56,580][0m Trial 551 finished with value: 93.4448697002081 and parameters: {'depth': 7, 'learning_rate': 0.212331634007257, 'iterations': 239, 'l2_leaf_reg': 1.0762301086756763e-08, 'border_count': 25, 'bagging_temperature': 0.1305232121572249, 'random_strength': 9.225688935367854, 'grow_policy': 'Lossguide', 'min_data_in_leaf': 470, 'max_leaves': 135}. Best is trial 544 with value: 79.23314367466817.[0m
[32m[I 2024-10-13 13:51:57,264][0m Trial 552 finished with value: 91.25069185930958 and parameters: {'depth': 6, 'learning_rate': 0.2986484745356366, 'iterations': 204, 'l2_leaf_reg': 3.439410887313861e-08, 'border_count': 19, 'bagging_temperature': 0.06953993738961688, 'random_strength': 9.578742794653111, 'grow_policy': 'Lossguide', 'min_data_in_leaf': 485, 'max_leaves': 143}. Best is trial 544 with value: 79.23314367466817.[0m
[32m[I 2024-10-13 13:51:57,922][0m Trial 553 finished with value: 91.79652188894548 and parameters: {'depth': 5, 'learning_rate': 0.20307238052342025, 'iterations': 158, 'l2_leaf_reg': 1.7555033620986014e-08, 'border_count': 25, 'bagging_temperature': 0.14283039076981097, 'random_strength': 9.774369995977983, 'grow_policy': 'Lossguide', 'min_data_in_leaf': 493, 'max_leaves': 138}. Best is trial 544 with value: 79.23314367466817.[0m
[32m[I 2024-10-13 13:51:58,624][0m Trial 554 finished with value: 90.6858434132639 and parameters: {'depth': 8, 'learning_rate': 0.2522284638101145, 'iterations': 242, 'l2_leaf_reg': 2.3599757954136536e-08, 'border_count': 16, 'bagging_temperature': 0.1126236212165164, 'random_strength': 8.78188108963395, 'grow_policy': 'Lossguide', 'min_data_in_leaf': 481, 'max_leaves': 145}. Best is trial 544 with value: 79.23314367466817.[0m
[32m[I 2024-10-13 13:51:59,275][0m Trial 555 finished with value: 83.33840721914271 and parameters: {'depth': 6, 'learning_rate': 0.1772513980064079, 'iterations': 152, 'l2_leaf_reg': 4.873561672230257e-08, 'border_count': 23, 'bagging_temperature': 0.15712750890560356, 'random_strength': 9.150735476061312, 'grow_policy': 'Lossguide', 'min_data_in_leaf': 457, 'max_leaves': 105}. Best is trial 544 with value: 79.23314367466817.[0m
[32m[I 2024-10-13 13:51:59,957][0m Trial 556 finished with value: 90.89268989030643 and parameters: {'depth': 6, 'learning_rate': 0.2958575064046043, 'iterations': 216, 'l2_leaf_reg': 2.9248143482769017e-08, 'border_count': 12, 'bagging_temperature': 0.0877296904593304, 'random_strength': 9.496003742895676, 'grow_policy': 'Lossguide', 'min_data_in_leaf': 442, 'max_leaves': 135}. Best is trial 544 with value: 79.23314367466817.[0m
[32m[I 2024-10-13 13:52:00,679][0m Trial 557 finished with value: 91.49338693813867 and parameters: {'depth': 7, 'learning_rate': 0.24391953282878812, 'iterations': 263, 'l2_leaf_reg': 1.8526670166422703e-08, 'border_count': 19, 'bagging_temperature': 0.049800414595916685, 'random_strength': 8.3895146767413, 'grow_policy': 'Lossguide', 'min_data_in_leaf': 412, 'max_leaves': 140}. Best is trial 544 with value: 79.23314367466817.[0m
[32m[I 2024-10-13 13:52:01,316][0m Trial 558 finished with value: 79.35920814239007 and parameters: {'depth': 8, 'learning_rate': 0.13874681820638549, 'iterations': 159, 'l2_leaf_reg': 1.0683393710335817e-08, 'border_count': 24, 'bagging_temperature': 0.13922888090940228, 'random_strength': 9.35905285986459, 'grow_policy': 'Lossguide', 'min_data_in_leaf': 497, 'max_leaves': 119}. Best is trial 544 with value: 79.23314367466817.[0m
[32m[I 2024-10-13 13:52:01,963][0m Trial 559 finished with value: 88.46584276917089 and parameters: {'depth': 8, 'learning_rate': 0.13402076909286095, 'iterations': 154, 'l2_leaf_reg': 1.0832178303230512e-08, 'border_count': 26, 'bagging_temperature': 0.12674334668744947, 'random_strength': 9.317059348172364, 'grow_policy': 'Lossguide', 'min_data_in_leaf': 494, 'max_leaves': 116}. Best is trial 544 with value: 79.23314367466817.[0m
[32m[I 2024-10-13 13:52:02,623][0m Trial 560 finished with value: 91.72443111480712 and parameters: {'depth': 8, 'learning_rate': 0.15265589537698088, 'iterations': 200, 'l2_leaf_reg': 1.3838341496177469e-08, 'border_count': 28, 'bagging_temperature': 0.09981350531573038, 'random_strength': 8.962729758713731, 'grow_policy': 'Lossguide', 'min_data_in_leaf': 429, 'max_leaves': 110}. Best is trial 544 with value: 79.23314367466817.[0m
[32m[I 2024-10-13 13:52:03,256][0m Trial 561 finished with value: 92.6103415750199 and parameters: {'depth': 8, 'learning_rate': 0.1680199598152294, 'iterations': 106, 'l2_leaf_reg': 1.0255947593218356e-08, 'border_count': 20, 'bagging_temperature': 0.13856008774894663, 'random_strength': 9.539425907159496, 'grow_policy': 'Lossguide', 'min_data_in_leaf': 475, 'max_leaves': 145}. Best is trial 544 with value: 79.23314367466817.[0m
[32m[I 2024-10-13 13:52:03,940][0m Trial 562 finished with value: 87.99426042895665 and parameters: {'depth': 8, 'learning_rate': 0.13481353411587638, 'iterations': 156, 'l2_leaf_reg': 1.5886879874057176e-08, 'border_count': 26, 'bagging_temperature': 0.11463210949544493, 'random_strength': 9.664923456171351, 'grow_policy': 'Lossguide', 'min_data_in_leaf': 494, 'max_leaves': 146}. Best is trial 544 with value: 79.23314367466817.[0m
[32m[I 2024-10-13 13:52:04,916][0m Trial 563 finished with value: 116.9521635143734 and parameters: {'depth': 8, 'learning_rate': 0.21073180302508596, 'iterations': 195, 'l2_leaf_reg': 3.514496103135987e-08, 'border_count': 17, 'bagging_temperature': 0.07733702505248291, 'random_strength': 9.25531559358958, 'grow_policy': 'SymmetricTree', 'min_data_in_leaf': 459}. Best is trial 544 with value: 79.23314367466817.[0m
[32m[I 2024-10-13 13:52:05,516][0m Trial 564 finished with value: 82.97939985867548 and parameters: {'depth': 7, 'learning_rate': 0.15869886123290716, 'iterations': 102, 'l2_leaf_reg': 1.9444704479283394e-08, 'border_count': 29, 'bagging_temperature': 0.1350354708593448, 'random_strength': 8.686709514754645, 'grow_policy': 'Lossguide', 'min_data_in_leaf': 501, 'max_leaves': 117}. Best is trial 544 with value: 79.23314367466817.[0m
[32m[I 2024-10-13 13:52:06,178][0m Trial 565 finished with value: 88.47806782811686 and parameters: {'depth': 7, 'learning_rate': 0.1196436348649892, 'iterations': 168, 'l2_leaf_reg': 6.333071010787132e-08, 'border_count': 10, 'bagging_temperature': 0.10814721334149258, 'random_strength': 9.341063576255241, 'grow_policy': 'Lossguide', 'min_data_in_leaf': 473, 'max_leaves': 125}. Best is trial 544 with value: 79.23314367466817.[0m
[32m[I 2024-10-13 13:52:06,918][0m Trial 566 finished with value: 96.42008258517878 and parameters: {'depth': 6, 'learning_rate': 0.2601099424560916, 'iterations': 240, 'l2_leaf_reg': 2.4166926988931206e-08, 'border_count': 22, 'bagging_temperature': 0.14795260137085528, 'random_strength': 9.084753956770525, 'grow_policy': 'Lossguide', 'min_data_in_leaf': 502, 'max_leaves': 112}. Best is trial 544 with value: 79.23314367466817.[0m
[32m[I 2024-10-13 13:52:07,571][0m Trial 567 finished with value: 87.9374434231102 and parameters: {'depth': 7, 'learning_rate': 0.1968509491542278, 'iterations': 157, 'l2_leaf_reg': 1.5287580001771278e-08, 'border_count': 30, 'bagging_temperature': 0.08517489455429295, 'random_strength': 9.800892054702091, 'grow_policy': 'Lossguide', 'min_data_in_leaf': 429, 'max_leaves': 120}. Best is trial 544 with value: 79.23314367466817.[0m
[32m[I 2024-10-13 13:52:08,897][0m Trial 568 finished with value: 95.14365617526455 and parameters: {'depth': 8, 'learning_rate': 0.13784596259361379, 'iterations': 1115, 'l2_leaf_reg': 4.081888819203848e-08, 'border_count': 24, 'bagging_temperature': 0.1591832792594828, 'random_strength': 8.849335154030086, 'grow_policy': 'Lossguide', 'min_data_in_leaf': 483, 'max_leaves': 106}. Best is trial 544 with value: 79.23314367466817.[0m
[32m[I 2024-10-13 13:52:09,591][0m Trial 569 finished with value: 90.97236812328946 and parameters: {'depth': 5, 'learning_rate': 0.1822777390887024, 'iterations': 220, 'l2_leaf_reg': 1.0163535349032502e-08, 'border_count': 15, 'bagging_temperature': 0.12308302405598062, 'random_strength': 9.604021628748564, 'grow_policy': 'Lossguide', 'min_data_in_leaf': 457, 'max_leaves': 142}. Best is trial 544 with value: 79.23314367466817.[0m
[32m[I 2024-10-13 13:52:10,305][0m Trial 570 finished with value: 91.34979822069626 and parameters: {'depth': 8, 'learning_rate': 0.1698860470951068, 'iterations': 256, 'l2_leaf_reg': 2.627473780634432e-08, 'border_count': 30, 'bagging_temperature': 0.15771259394058257, 'random_strength': 9.388150765008536, 'grow_policy': 'Lossguide', 'min_data_in_leaf': 507, 'max_leaves': 131}. Best is trial 544 with value: 79.23314367466817.[0m
[32m[I 2024-10-13 13:52:10,975][0m Trial 571 finished with value: 80.54246276341053 and parameters: {'depth': 7, 'learning_rate': 0.11365054168903463, 'iterations': 168, 'l2_leaf_reg': 1.0403816985489705e-07, 'border_count': 24, 'bagging_temperature': 0.06152493273987095, 'random_strength': 9.970103129713259, 'grow_policy': 'Lossguide', 'min_data_in_leaf': 397, 'max_leaves': 147}. Best is trial 544 with value: 79.23314367466817.[0m
[32m[I 2024-10-13 13:52:11,603][0m Trial 572 finished with value: 119.17613627063449 and parameters: {'depth': 7, 'learning_rate': 0.12502293857219043, 'iterations': 103, 'l2_leaf_reg': 5.6059728301349394e-08, 'border_count': 8, 'bagging_temperature': 0.03464986444179967, 'random_strength': 9.896907355071374, 'grow_policy': 'Lossguide', 'min_data_in_leaf': 396, 'max_leaves': 148}. Best is trial 544 with value: 79.23314367466817.[0m
[32m[I 2024-10-13 13:52:12,252][0m Trial 573 finished with value: 93.43311540736185 and parameters: {'depth': 7, 'learning_rate': 0.12272143713955103, 'iterations': 166, 'l2_leaf_reg': 1.173463406401208e-07, 'border_count': 19, 'bagging_temperature': 0.05885812854940801, 'random_strength': 9.921335830090714, 'grow_policy': 'Lossguide', 'min_data_in_leaf': 482, 'max_leaves': 97}. Best is trial 544 with value: 79.23314367466817.[0m
[32m[I 2024-10-13 13:52:12,987][0m Trial 574 finished with value: 80.48678294506338 and parameters: {'depth': 6, 'learning_rate': 0.10106103769504568, 'iterations': 222, 'l2_leaf_reg': 1.5770555699647533e-08, 'border_count': 23, 'bagging_temperature': 0.03798019296802657, 'random_strength': 9.565088939366682, 'grow_policy': 'Lossguide', 'min_data_in_leaf': 509, 'max_leaves': 148}. Best is trial 544 with value: 79.23314367466817.[0m
[32m[I 2024-10-13 13:52:13,723][0m Trial 575 finished with value: 93.72744870917037 and parameters: {'depth': 6, 'learning_rate': 0.11256902662168211, 'iterations': 276, 'l2_leaf_reg': 1.358623582257685e-08, 'border_count': 18, 'bagging_temperature': 0.01598697300398131, 'random_strength': 9.673303593198513, 'grow_policy': 'Lossguide', 'min_data_in_leaf': 508, 'max_leaves': 148}. Best is trial 544 with value: 79.23314367466817.[0m
[32m[I 2024-10-13 13:52:14,330][0m Trial 576 finished with value: 94.36482884771328 and parameters: {'depth': 6, 'learning_rate': 0.10050157396562902, 'iterations': 100, 'l2_leaf_reg': 2.0268576822031848e-08, 'border_count': 15, 'bagging_temperature': 0.0516871150804286, 'random_strength': 9.734310190699981, 'grow_policy': 'Lossguide', 'min_data_in_leaf': 507, 'max_leaves': 142}. Best is trial 544 with value: 79.23314367466817.[0m
[32m[I 2024-10-13 13:52:15,050][0m Trial 577 finished with value: 80.44621832558688 and parameters: {'depth': 6, 'learning_rate': 0.10327081392158918, 'iterations': 221, 'l2_leaf_reg': 1.6921406246608554e-08, 'border_count': 23, 'bagging_temperature': 0.036365615540535426, 'random_strength': 9.5123873469829, 'grow_policy': 'Lossguide', 'min_data_in_leaf': 488, 'max_leaves': 108}. Best is trial 544 with value: 79.23314367466817.[0m
[32m[I 2024-10-13 13:52:15,782][0m Trial 578 finished with value: 88.6108554786371 and parameters: {'depth': 6, 'learning_rate': 0.10565011275795298, 'iterations': 287, 'l2_leaf_reg': 1.0558188062979887e-08, 'border_count': 11, 'bagging_temperature': 0.03919172411130994, 'random_strength': 9.59652827169132, 'grow_policy': 'Lossguide', 'min_data_in_leaf': 493, 'max_leaves': 106}. Best is trial 544 with value: 79.23314367466817.[0m
[32m[I 2024-10-13 13:52:16,491][0m Trial 579 finished with value: 93.371786320745 and parameters: {'depth': 6, 'learning_rate': 0.10575596525026566, 'iterations': 217, 'l2_leaf_reg': 1.724233466336829e-08, 'border_count': 19, 'bagging_temperature': 0.015579825232034872, 'random_strength': 9.872060370139394, 'grow_policy': 'Lossguide', 'min_data_in_leaf': 514, 'max_leaves': 114}. Best is trial 544 with value: 79.23314367466817.[0m
[32m[I 2024-10-13 13:52:17,217][0m Trial 580 finished with value: 87.22313783917123 and parameters: {'depth': 6, 'learning_rate': 0.09791279495814502, 'iterations': 274, 'l2_leaf_reg': 1.413477523360231e-08, 'border_count': 25, 'bagging_temperature': 0.04188663410134739, 'random_strength': 9.41038166375708, 'grow_policy': 'Lossguide', 'min_data_in_leaf': 491, 'max_leaves': 113}. Best is trial 544 with value: 79.23314367466817.[0m
[32m[I 2024-10-13 13:52:17,910][0m Trial 581 finished with value: 93.76965363574489 and parameters: {'depth': 6, 'learning_rate': 0.1117449410437008, 'iterations': 220, 'l2_leaf_reg': 4.018757669795006e-08, 'border_count': 22, 'bagging_temperature': 0.03600444800034693, 'random_strength': 9.907283842811088, 'grow_policy': 'Lossguide', 'min_data_in_leaf': 512, 'max_leaves': 101}. Best is trial 544 with value: 79.23314367466817.[0m
[32m[I 2024-10-13 13:52:18,611][0m Trial 582 finished with value: 91.89132537576475 and parameters: {'depth': 6, 'learning_rate': 0.14937364234752104, 'iterations': 221, 'l2_leaf_reg': 2.4490702192662145e-08, 'border_count': 14, 'bagging_temperature': 0.012477671174892194, 'random_strength': 9.192333629795375, 'grow_policy': 'Lossguide', 'min_data_in_leaf': 479, 'max_leaves': 108}. Best is trial 544 with value: 79.23314367466817.[0m
[32m[I 2024-10-13 13:52:19,362][0m Trial 583 finished with value: 105.9158719473676 and parameters: {'depth': 6, 'learning_rate': 0.12976779369492963, 'iterations': 304, 'l2_leaf_reg': 1.0614086911991607e-08, 'border_count': 165, 'bagging_temperature': 0.06425015529972818, 'random_strength': 9.670459696038273, 'grow_policy': 'Lossguide', 'min_data_in_leaf': 516, 'max_leaves': 109}. Best is trial 544 with value: 79.23314367466817.[0m
[32m[I 2024-10-13 13:52:20,147][0m Trial 584 finished with value: 89.46613191645898 and parameters: {'depth': 6, 'learning_rate': 0.0995718640220477, 'iterations': 270, 'l2_leaf_reg': 0.11440684601848149, 'border_count': 26, 'bagging_temperature': 0.026213253412803693, 'random_strength': 9.526597540008737, 'grow_policy': 'Lossguide', 'min_data_in_leaf': 378, 'max_leaves': 100}. Best is trial 544 with value: 79.23314367466817.[0m
[32m[I 2024-10-13 13:52:20,977][0m Trial 585 finished with value: 92.290508354708 and parameters: {'depth': 6, 'learning_rate': 0.14468026967176678, 'iterations': 200, 'l2_leaf_reg': 5.4416644278138775e-08, 'border_count': 20, 'bagging_temperature': 0.07769905181747214, 'random_strength': 9.109001892145036, 'grow_policy': 'Lossguide', 'min_data_in_leaf': 496, 'max_leaves': 150}. Best is trial 544 with value: 79.23314367466817.[0m
[32m[I 2024-10-13 13:52:21,724][0m Trial 586 finished with value: 91.28977986018728 and parameters: {'depth': 6, 'learning_rate': 0.1174641375322247, 'iterations': 304, 'l2_leaf_reg': 1.5447310772603446e-08, 'border_count': 28, 'bagging_temperature': 0.0570424931233266, 'random_strength': 9.994137938486242, 'grow_policy': 'Lossguide', 'min_data_in_leaf': 456, 'max_leaves': 149}. Best is trial 544 with value: 79.23314367466817.[0m
[32m[I 2024-10-13 13:52:22,494][0m Trial 587 finished with value: 123.29106790238467 and parameters: {'depth': 6, 'learning_rate': 0.16991539481689893, 'iterations': 163, 'l2_leaf_reg': 1.0093247902567312e-08, 'border_count': 15, 'bagging_temperature': 0.030160326370646938, 'random_strength': 9.70921782672421, 'grow_policy': 'SymmetricTree', 'min_data_in_leaf': 524}. Best is trial 544 with value: 79.23314367466817.[0m
[32m[I 2024-10-13 13:52:23,192][0m Trial 588 finished with value: 93.46736729865596 and parameters: {'depth': 6, 'learning_rate': 0.12078783266797434, 'iterations': 206, 'l2_leaf_reg': 9.759645449828566e-08, 'border_count': 22, 'bagging_temperature': 0.0481098120330349, 'random_strength': 9.992824520559349, 'grow_policy': 'Lossguide', 'min_data_in_leaf': 259, 'max_leaves': 119}. Best is trial 544 with value: 79.23314367466817.[0m
[32m[I 2024-10-13 13:52:23,952][0m Trial 589 finished with value: 117.44869387159999 and parameters: {'depth': 6, 'learning_rate': 0.10021683872600601, 'iterations': 238, 'l2_leaf_reg': 2.989947851496305e-08, 'border_count': 9, 'bagging_temperature': 0.06679170190741465, 'random_strength': 9.269743235602494, 'grow_policy': 'Lossguide', 'min_data_in_leaf': 409, 'max_leaves': 120}. Best is trial 544 with value: 79.23314367466817.[0m
[32m[I 2024-10-13 13:52:24,720][0m Trial 590 finished with value: 91.23240395311 and parameters: {'depth': 9, 'learning_rate': 0.14923877784566078, 'iterations': 300, 'l2_leaf_reg': 2.5311465335702358e-08, 'border_count': 29, 'bagging_temperature': 0.04619755403558484, 'random_strength': 9.369027678749799, 'grow_policy': 'Lossguide', 'min_data_in_leaf': 471, 'max_leaves': 108}. Best is trial 544 with value: 79.23314367466817.[0m
[32m[I 2024-10-13 13:52:25,339][0m Trial 591 finished with value: 88.15067755706093 and parameters: {'depth': 5, 'learning_rate': 0.09545111404023687, 'iterations': 101, 'l2_leaf_reg': 7.140681832889699e-08, 'border_count': 25, 'bagging_temperature': 0.07317018317813717, 'random_strength': 9.635012986572427, 'grow_policy': 'Lossguide', 'min_data_in_leaf': 506, 'max_leaves': 103}. Best is trial 544 with value: 79.23314367466817.[0m
[32m[I 2024-10-13 13:52:25,992][0m Trial 592 finished with value: 104.37314968611977 and parameters: {'depth': 6, 'learning_rate': 0.22593304584320176, 'iterations': 158, 'l2_leaf_reg': 0.012612219766525979, 'border_count': 77, 'bagging_temperature': 0.09292688719210272, 'random_strength': 8.984402781072337, 'grow_policy': 'Lossguide', 'min_data_in_leaf': 488, 'max_leaves': 152}. Best is trial 544 with value: 79.23314367466817.[0m
[32m[I 2024-10-13 13:52:28,311][0m Trial 593 finished with value: 93.51165451496668 and parameters: {'depth': 9, 'learning_rate': 0.19347584322523623, 'iterations': 2230, 'l2_leaf_reg': 3.533063197398686e-08, 'border_count': 19, 'bagging_temperature': 0.007803287291277831, 'random_strength': 9.465022577842829, 'grow_policy': 'Lossguide', 'min_data_in_leaf': 692, 'max_leaves': 145}. Best is trial 544 with value: 79.23314367466817.[0m
[32m[I 2024-10-13 13:52:29,066][0m Trial 594 finished with value: 88.68720834216238 and parameters: {'depth': 9, 'learning_rate': 0.13234251541619366, 'iterations': 261, 'l2_leaf_reg': 1.6303098468276767e-08, 'border_count': 30, 'bagging_temperature': 0.07381139412685753, 'random_strength': 9.166272849922892, 'grow_policy': 'Lossguide', 'min_data_in_leaf': 285, 'max_leaves': 148}. Best is trial 544 with value: 79.23314367466817.[0m
[32m[I 2024-10-13 13:52:29,725][0m Trial 595 finished with value: 95.19736158175294 and parameters: {'depth': 7, 'learning_rate': 0.173089559460579, 'iterations': 188, 'l2_leaf_reg': 1.395608176070854e-07, 'border_count': 22, 'bagging_temperature': 0.09500587856545509, 'random_strength': 9.763894714381111, 'grow_policy': 'Lossguide', 'min_data_in_leaf': 447, 'max_leaves': 139}. Best is trial 544 with value: 79.23314367466817.[0m
[32m[I 2024-10-13 13:52:30,366][0m Trial 596 finished with value: 94.3521862015978 and parameters: {'depth': 9, 'learning_rate': 0.09987821662550074, 'iterations': 149, 'l2_leaf_reg': 1.6171841818988017e-08, 'border_count': 12, 'bagging_temperature': 0.04295940754707536, 'random_strength': 9.507929718038717, 'grow_policy': 'Lossguide', 'min_data_in_leaf': 435, 'max_leaves': 125}. Best is trial 544 with value: 79.23314367466817.[0m
[32m[I 2024-10-13 13:52:31,095][0m Trial 597 finished with value: 92.73667650686218 and parameters: {'depth': 6, 'learning_rate': 0.21344227025679963, 'iterations': 241, 'l2_leaf_reg': 5.2376300400824006e-08, 'border_count': 25, 'bagging_temperature': 0.02630028404378189, 'random_strength': 9.32095022095562, 'grow_policy': 'Lossguide', 'min_data_in_leaf': 497, 'max_leaves': 152}. Best is trial 544 with value: 79.23314367466817.[0m
[32m[I 2024-10-13 13:52:31,861][0m Trial 598 finished with value: 91.479686166006 and parameters: {'depth': 6, 'learning_rate': 0.11306800909491485, 'iterations': 311, 'l2_leaf_reg': 2.2767058678315727e-08, 'border_count': 17, 'bagging_temperature': 0.08570740761872661, 'random_strength': 8.99601779379013, 'grow_policy': 'Lossguide', 'min_data_in_leaf': 338, 'max_leaves': 145}. Best is trial 544 with value: 79.23314367466817.[0m
[32m[I 2024-10-13 13:52:33,092][0m Trial 599 finished with value: 103.10843801938658 and parameters: {'depth': 9, 'learning_rate': 0.14823154725023863, 'iterations': 960, 'l2_leaf_reg': 1.5871353369856222e-08, 'border_count': 32, 'bagging_temperature': 0.06935794366058022, 'random_strength': 9.74456271733436, 'grow_policy': 'Lossguide', 'min_data_in_leaf': 525, 'max_leaves': 113}. Best is trial 544 with value: 79.23314367466817.[0m
[32m[I 2024-10-13 13:52:33,831][0m Trial 600 finished with value: 91.16323960356895 and parameters: {'depth': 8, 'learning_rate': 0.12428806708622621, 'iterations': 205, 'l2_leaf_reg': 4.292072731230334e-08, 'border_count': 27, 'bagging_temperature': 0.10287938915866522, 'random_strength': 9.523502007250418, 'grow_policy': 'Lossguide', 'min_data_in_leaf': 527, 'max_leaves': 95}. Best is trial 544 with value: 79.23314367466817.[0m
