[32m[I 2024-10-13 13:57:21,112][0m Trial 901 finished with value: 126.93098087128062 and parameters: {'depth': 10, 'learning_rate': 0.1858043760999492, 'iterations': 1119, 'l2_leaf_reg': 0.001954096737470243, 'border_count': 135, 'bagging_temperature': 0.05333712557325884, 'random_strength': 8.925105288579223, 'grow_policy': 'Lossguide', 'min_data_in_leaf': 391, 'max_leaves': 96}. Best is trial 738 with value: 78.71473735766027.[0m
[32m[I 2024-10-13 13:57:21,735][0m Trial 902 finished with value: 81.71727976342117 and parameters: {'depth': 10, 'learning_rate': 0.20380935505821382, 'iterations': 102, 'l2_leaf_reg': 0.0017373689368410572, 'border_count': 35, 'bagging_temperature': 0.06968235576557652, 'random_strength': 9.246516062777049, 'grow_policy': 'Depthwise', 'min_data_in_leaf': 476}. Best is trial 738 with value: 78.71473735766027.[0m
[32m[I 2024-10-13 13:57:22,391][0m Trial 903 finished with value: 92.03261483840122 and parameters: {'depth': 10, 'learning_rate': 0.17608600745931566, 'iterations': 154, 'l2_leaf_reg': 5.214094870623685e-08, 'border_count': 13, 'bagging_temperature': 0.0866986656364637, 'random_strength': 8.062178760025777, 'grow_policy': 'Lossguide', 'min_data_in_leaf': 441, 'max_leaves': 157}. Best is trial 738 with value: 78.71473735766027.[0m
[32m[I 2024-10-13 13:57:23,051][0m Trial 904 finished with value: 91.392663363721 and parameters: {'depth': 10, 'learning_rate': 0.2254585201544862, 'iterations': 104, 'l2_leaf_reg': 0.0026706664385017184, 'border_count': 28, 'bagging_temperature': 0.05049949867732221, 'random_strength': 9.317872751876179, 'grow_policy': 'Lossguide', 'min_data_in_leaf': 419, 'max_leaves': 99}. Best is trial 738 with value: 78.71473735766027.[0m
[32m[I 2024-10-13 13:57:23,675][0m Trial 905 finished with value: 126.1010181406164 and parameters: {'depth': 10, 'learning_rate': 0.1703515373364928, 'iterations': 102, 'l2_leaf_reg': 0.016813807572331838, 'border_count': 6, 'bagging_temperature': 0.07420826453575931, 'random_strength': 8.9740089596294, 'grow_policy': 'Lossguide', 'min_data_in_leaf': 451, 'max_leaves': 153}. Best is trial 738 with value: 78.71473735766027.[0m
[32m[I 2024-10-13 13:57:24,368][0m Trial 906 finished with value: 95.57288320658097 and parameters: {'depth': 9, 'learning_rate': 0.25083507550295053, 'iterations': 190, 'l2_leaf_reg': 0.002000405015182877, 'border_count': 22, 'bagging_temperature': 0.0968333685310769, 'random_strength': 9.37623764814213, 'grow_policy': 'Lossguide', 'min_data_in_leaf': 472, 'max_leaves': 107}. Best is trial 738 with value: 78.71473735766027.[0m
[32m[I 2024-10-13 13:57:25,071][0m Trial 907 finished with value: 86.46593050169356 and parameters: {'depth': 9, 'learning_rate': 0.1932620943612156, 'iterations': 202, 'l2_leaf_reg': 2.578095359305734e-08, 'border_count': 33, 'bagging_temperature': 0.11969286546766011, 'random_strength': 9.557248871353792, 'grow_policy': 'Lossguide', 'min_data_in_leaf': 406, 'max_leaves': 147}. Best is trial 738 with value: 78.71473735766027.[0m
[32m[I 2024-10-13 13:57:25,751][0m Trial 908 finished with value: 82.51600791187784 and parameters: {'depth': 10, 'learning_rate': 0.16353594856607523, 'iterations': 151, 'l2_leaf_reg': 1.94637427813569e-08, 'border_count': 44, 'bagging_temperature': 0.09401125404231703, 'random_strength': 9.158720738985599, 'grow_policy': 'Lossguide', 'min_data_in_leaf': 294, 'max_leaves': 145}. Best is trial 738 with value: 78.71473735766027.[0m
[32m[I 2024-10-13 13:57:26,493][0m Trial 909 finished with value: 95.3206423918915 and parameters: {'depth': 6, 'learning_rate': 0.2164357360953923, 'iterations': 195, 'l2_leaf_reg': 0.0034272759265285145, 'border_count': 27, 'bagging_temperature': 0.033526407926036506, 'random_strength': 9.84214183721712, 'grow_policy': 'Lossguide', 'min_data_in_leaf': 439, 'max_leaves': 114}. Best is trial 738 with value: 78.71473735766027.[0m
[32m[I 2024-10-13 13:57:29,045][0m Trial 910 finished with value: 132.02035376433236 and parameters: {'depth': 10, 'learning_rate': 0.1292673609303517, 'iterations': 2725, 'l2_leaf_reg': 2.0954330436289643e-06, 'border_count': 239, 'bagging_temperature': 0.08188001491122998, 'random_strength': 8.794709928656651, 'grow_policy': 'Lossguide', 'min_data_in_leaf': 475, 'max_leaves': 141}. Best is trial 738 with value: 78.71473735766027.[0m
[32m[I 2024-10-13 13:57:29,690][0m Trial 911 finished with value: 103.32612017418212 and parameters: {'depth': 7, 'learning_rate': 0.2566493947694579, 'iterations': 105, 'l2_leaf_reg': 1.376019682898207e-08, 'border_count': 167, 'bagging_temperature': 0.12073774805233113, 'random_strength': 9.507813937543562, 'grow_policy': 'Lossguide', 'min_data_in_leaf': 486, 'max_leaves': 90}. Best is trial 738 with value: 78.71473735766027.[0m
[32m[I 2024-10-13 13:57:30,307][0m Trial 912 finished with value: 87.79297156081971 and parameters: {'depth': 9, 'learning_rate': 0.29991421874078095, 'iterations': 102, 'l2_leaf_reg': 1.009582677754383e-07, 'border_count': 17, 'bagging_temperature': 0.053222475273341716, 'random_strength': 9.281177061898122, 'grow_policy': 'Lossguide', 'min_data_in_leaf': 423, 'max_leaves': 154}. Best is trial 738 with value: 78.71473735766027.[0m
[32m[I 2024-10-13 13:57:31,154][0m Trial 913 finished with value: 102.6729377128964 and parameters: {'depth': 6, 'learning_rate': 0.158769928168041, 'iterations': 217, 'l2_leaf_reg': 3.875625027437252e-08, 'border_count': 25, 'bagging_temperature': 0.10234315117380245, 'random_strength': 9.039286988391884, 'grow_policy': 'SymmetricTree', 'min_data_in_leaf': 460}. Best is trial 738 with value: 78.71473735766027.[0m
[32m[I 2024-10-13 13:57:31,811][0m Trial 914 finished with value: 81.62407005960412 and parameters: {'depth': 10, 'learning_rate': 0.12786649652208937, 'iterations': 159, 'l2_leaf_reg': 2.0846970155062674e-08, 'border_count': 37, 'bagging_temperature': 0.07559204051240369, 'random_strength': 9.99135708882091, 'grow_policy': 'Lossguide', 'min_data_in_leaf': 152, 'max_leaves': 162}. Best is trial 738 with value: 78.71473735766027.[0m
[32m[I 2024-10-13 13:57:32,511][0m Trial 915 finished with value: 93.91022359470384 and parameters: {'depth': 7, 'learning_rate': 0.18582862926264937, 'iterations': 204, 'l2_leaf_reg': 6.621128179505106e-08, 'border_count': 21, 'bagging_temperature': 0.011992209351354345, 'random_strength': 9.627793456025843, 'grow_policy': 'Lossguide', 'min_data_in_leaf': 491, 'max_leaves': 169}. Best is trial 738 with value: 78.71473735766027.[0m
[32m[I 2024-10-13 13:57:33,263][0m Trial 916 finished with value: 90.15665104915428 and parameters: {'depth': 9, 'learning_rate': 0.15095686860545027, 'iterations': 243, 'l2_leaf_reg': 1.4296195301114171e-08, 'border_count': 30, 'bagging_temperature': 0.04461613654868948, 'random_strength': 8.551657554355602, 'grow_policy': 'Lossguide', 'min_data_in_leaf': 451, 'max_leaves': 146}. Best is trial 738 with value: 78.71473735766027.[0m
[32m[I 2024-10-13 13:57:33,953][0m Trial 917 finished with value: 89.71700857414969 and parameters: {'depth': 9, 'learning_rate': 0.1262304617202121, 'iterations': 154, 'l2_leaf_reg': 2.7229135262803157e-08, 'border_count': 11, 'bagging_temperature': 0.13091626325988603, 'random_strength': 9.3915509187402, 'grow_policy': 'Lossguide', 'min_data_in_leaf': 702, 'max_leaves': 137}. Best is trial 738 with value: 78.71473735766027.[0m
[32m[I 2024-10-13 13:57:34,656][0m Trial 918 finished with value: 91.72739530749922 and parameters: {'depth': 6, 'learning_rate': 0.22823234538418627, 'iterations': 226, 'l2_leaf_reg': 3.961370919088364e-08, 'border_count': 18, 'bagging_temperature': 0.11226809740720832, 'random_strength': 9.998140105181323, 'grow_policy': 'Lossguide', 'min_data_in_leaf': 372, 'max_leaves': 158}. Best is trial 738 with value: 78.71473735766027.[0m
[32m[I 2024-10-13 13:57:35,275][0m Trial 919 finished with value: 83.36247600673077 and parameters: {'depth': 8, 'learning_rate': 0.11079587895547326, 'iterations': 103, 'l2_leaf_reg': 0.001766174060547015, 'border_count': 40, 'bagging_temperature': 0.06137683039347927, 'random_strength': 9.796546445340157, 'grow_policy': 'Lossguide', 'min_data_in_leaf': 480, 'max_leaves': 150}. Best is trial 738 with value: 78.71473735766027.[0m
[32m[I 2024-10-13 13:57:36,094][0m Trial 920 finished with value: 87.12570925040485 and parameters: {'depth': 10, 'learning_rate': 0.1934910784513026, 'iterations': 172, 'l2_leaf_reg': 1.4318412966395363e-08, 'border_count': 33, 'bagging_temperature': 0.08750804235661278, 'random_strength': 8.251487954023387, 'grow_policy': 'Lossguide', 'min_data_in_leaf': 464, 'max_leaves': 110}. Best is trial 738 with value: 78.71473735766027.[0m
[32m[I 2024-10-13 13:57:36,693][0m Trial 921 finished with value: 87.39609496323872 and parameters: {'depth': 7, 'learning_rate': 0.14148059923153808, 'iterations': 262, 'l2_leaf_reg': 2.2602407569991717e-08, 'border_count': 25, 'bagging_temperature': 0.13362751836325068, 'random_strength': 9.1468323067546, 'grow_policy': 'Lossguide', 'min_data_in_leaf': 438, 'max_leaves': 139}. Best is trial 738 with value: 78.71473735766027.[0m
[32m[I 2024-10-13 13:57:38,032][0m Trial 922 finished with value: 97.360619354922 and parameters: {'depth': 9, 'learning_rate': 0.10652729464951505, 'iterations': 1034, 'l2_leaf_reg': 5.8516295077497834e-08, 'border_count': 29, 'bagging_temperature': 0.16525222990743213, 'random_strength': 9.566070315792835, 'grow_policy': 'Lossguide', 'min_data_in_leaf': 491, 'max_leaves': 143}. Best is trial 738 with value: 78.71473735766027.[0m
[32m[I 2024-10-13 13:57:39,584][0m Trial 923 finished with value: 92.3961380034527 and parameters: {'depth': 8, 'learning_rate': 0.024006095748957863, 'iterations': 1279, 'l2_leaf_reg': 1.0220293731664728e-08, 'border_count': 14, 'bagging_temperature': 0.35794254963719974, 'random_strength': 8.82560225315517, 'grow_policy': 'Depthwise', 'min_data_in_leaf': 196}. Best is trial 738 with value: 78.71473735766027.[0m
[32m[I 2024-10-13 13:57:40,219][0m Trial 924 finished with value: 94.42761244151565 and parameters: {'depth': 7, 'learning_rate': 0.1729599675726191, 'iterations': 102, 'l2_leaf_reg': 3.1717709530578463e-08, 'border_count': 22, 'bagging_temperature': 0.1065925126403405, 'random_strength': 9.31386720447255, 'grow_policy': 'Lossguide', 'min_data_in_leaf': 419, 'max_leaves': 104}. Best is trial 738 with value: 78.71473735766027.[0m
[32m[I 2024-10-13 13:57:40,913][0m Trial 925 finished with value: 81.19306646630659 and parameters: {'depth': 10, 'learning_rate': 0.12010910757646405, 'iterations': 183, 'l2_leaf_reg': 1.8474289774028326e-08, 'border_count': 36, 'bagging_temperature': 0.6289769478052596, 'random_strength': 9.709174704781397, 'grow_policy': 'Lossguide', 'min_data_in_leaf': 810, 'max_leaves': 116}. Best is trial 738 with value: 78.71473735766027.[0m
[32m[I 2024-10-13 13:57:41,631][0m Trial 926 finished with value: 84.14876424279974 and parameters: {'depth': 6, 'learning_rate': 0.09328413663876776, 'iterations': 258, 'l2_leaf_reg': 1.0185564879620046e-08, 'border_count': 48, 'bagging_temperature': 0.024949783194199958, 'random_strength': 9.452387037391292, 'grow_policy': 'Lossguide', 'min_data_in_leaf': 166, 'max_leaves': 149}. Best is trial 738 with value: 78.71473735766027.[0m
[32m[I 2024-10-13 13:57:42,277][0m Trial 927 finished with value: 88.75460421981514 and parameters: {'depth': 7, 'learning_rate': 0.15191545016940539, 'iterations': 162, 'l2_leaf_reg': 0.0069809598678622214, 'border_count': 26, 'bagging_temperature': 0.15131444744700617, 'random_strength': 8.96999416614417, 'grow_policy': 'Lossguide', 'min_data_in_leaf': 450, 'max_leaves': 154}. Best is trial 738 with value: 78.71473735766027.[0m
[32m[I 2024-10-13 13:57:42,924][0m Trial 928 finished with value: 91.36794544618925 and parameters: {'depth': 10, 'learning_rate': 0.2317798551583734, 'iterations': 100, 'l2_leaf_reg': 8.21000587658119e-08, 'border_count': 19, 'bagging_temperature': 0.06649927299543712, 'random_strength': 9.105052432837683, 'grow_policy': 'Lossguide', 'min_data_in_leaf': 497, 'max_leaves': 136}. Best is trial 738 with value: 78.71473735766027.[0m
[32m[I 2024-10-13 13:57:43,684][0m Trial 929 finished with value: 94.06700299774757 and parameters: {'depth': 6, 'learning_rate': 0.20354718386186704, 'iterations': 292, 'l2_leaf_reg': 4.374574943320012e-08, 'border_count': 31, 'bagging_temperature': 0.12793692456833447, 'random_strength': 9.778972371387729, 'grow_policy': 'Lossguide', 'min_data_in_leaf': 473, 'max_leaves': 143}. Best is trial 738 with value: 78.71473735766027.[0m
[32m[I 2024-10-13 13:57:44,454][0m Trial 930 finished with value: 82.48011893310188 and parameters: {'depth': 7, 'learning_rate': 0.10070037979398345, 'iterations': 216, 'l2_leaf_reg': 2.3523716215063966e-08, 'border_count': 41, 'bagging_temperature': 0.19092808758134822, 'random_strength': 9.275933100588082, 'grow_policy': 'Lossguide', 'min_data_in_leaf': 495, 'max_leaves': 148}. Best is trial 738 with value: 78.71473735766027.[0m
[32m[I 2024-10-13 13:57:45,093][0m Trial 931 finished with value: 107.59293086485133 and parameters: {'depth': 8, 'learning_rate': 0.2587715081529849, 'iterations': 159, 'l2_leaf_reg': 2.6409232272194554e-07, 'border_count': 228, 'bagging_temperature': 0.0897852683048498, 'random_strength': 8.657947480344612, 'grow_policy': 'Lossguide', 'min_data_in_leaf': 836, 'max_leaves': 100}. Best is trial 738 with value: 78.71473735766027.[0m
[32m[I 2024-10-13 13:57:46,257][0m Trial 932 finished with value: 81.36558203024046 and parameters: {'depth': 10, 'learning_rate': 0.12620833940467027, 'iterations': 869, 'l2_leaf_reg': 1.5757625494956732e-08, 'border_count': 23, 'bagging_temperature': 0.03598525935928573, 'random_strength': 9.499218971655047, 'grow_policy': 'Lossguide', 'min_data_in_leaf': 222, 'max_leaves': 160}. Best is trial 738 with value: 78.71473735766027.[0m
[32m[I 2024-10-13 13:57:47,003][0m Trial 933 finished with value: 87.34432286396333 and parameters: {'depth': 8, 'learning_rate': 0.16523119392808824, 'iterations': 245, 'l2_leaf_reg': 1.318365262165234e-07, 'border_count': 33, 'bagging_temperature': 0.11021118266217866, 'random_strength': 9.83448144301209, 'grow_policy': 'Lossguide', 'min_data_in_leaf': 403, 'max_leaves': 140}. Best is trial 738 with value: 78.71473735766027.[0m
[32m[I 2024-10-13 13:57:47,804][0m Trial 934 finished with value: 92.30553255492057 and parameters: {'depth': 9, 'learning_rate': 0.08629371487477322, 'iterations': 308, 'l2_leaf_reg': 3.128332949311467e-08, 'border_count': 16, 'bagging_temperature': 0.14737490122787517, 'random_strength': 9.628532461846453, 'grow_policy': 'Lossguide', 'min_data_in_leaf': 439, 'max_leaves': 128}. Best is trial 738 with value: 78.71473735766027.[0m
[32m[I 2024-10-13 13:57:48,498][0m Trial 935 finished with value: 88.32158786476198 and parameters: {'depth': 9, 'learning_rate': 0.11377482840617692, 'iterations': 195, 'l2_leaf_reg': 4.949319820933419e-08, 'border_count': 27, 'bagging_temperature': 0.18034235337858545, 'random_strength': 9.28264030283208, 'grow_policy': 'Lossguide', 'min_data_in_leaf': 469, 'max_leaves': 152}. Best is trial 738 with value: 78.71473735766027.[0m
[32m[I 2024-10-13 13:57:49,288][0m Trial 936 finished with value: 108.70978585393641 and parameters: {'depth': 7, 'learning_rate': 0.14046491466960823, 'iterations': 153, 'l2_leaf_reg': 0.0026929505129284696, 'border_count': 19, 'bagging_temperature': 0.06969551148754419, 'random_strength': 7.0461617707060995, 'grow_policy': 'SymmetricTree', 'min_data_in_leaf': 504}. Best is trial 738 with value: 78.71473735766027.[0m
[32m[I 2024-10-13 13:57:50,017][0m Trial 937 finished with value: 116.71016636481873 and parameters: {'depth': 6, 'learning_rate': 0.20306367470465778, 'iterations': 220, 'l2_leaf_reg': 1.0015518319310979e-08, 'border_count': 7, 'bagging_temperature': 0.12497946090098246, 'random_strength': 8.9323829945503, 'grow_policy': 'Lossguide', 'min_data_in_leaf': 132, 'max_leaves': 145}. Best is trial 738 with value: 78.71473735766027.[0m
[32m[I 2024-10-13 13:57:52,331][0m Trial 938 finished with value: 100.2754393202131 and parameters: {'depth': 10, 'learning_rate': 0.0960997584183218, 'iterations': 2368, 'l2_leaf_reg': 2.062377752406099e-08, 'border_count': 37, 'bagging_temperature': 0.15837759663530324, 'random_strength': 9.560604078269684, 'grow_policy': 'Lossguide', 'min_data_in_leaf': 458, 'max_leaves': 119}. Best is trial 738 with value: 78.71473735766027.[0m
[32m[I 2024-10-13 13:57:54,413][0m Trial 939 finished with value: 155.72531787163007 and parameters: {'depth': 7, 'learning_rate': 0.000815339598696574, 'iterations': 2088, 'l2_leaf_reg': 3.2124668190383266e-08, 'border_count': 30, 'bagging_temperature': 0.04928485331359762, 'random_strength': 9.117605874228692, 'grow_policy': 'Lossguide', 'min_data_in_leaf': 180, 'max_leaves': 134}. Best is trial 738 with value: 78.71473735766027.[0m
[32m[I 2024-10-13 13:57:55,187][0m Trial 940 finished with value: 82.1484773857213 and parameters: {'depth': 9, 'learning_rate': 0.1625634255351567, 'iterations': 283, 'l2_leaf_reg': 1.4889217009515752e-08, 'border_count': 23, 'bagging_temperature': 0.08893020247858575, 'random_strength': 8.450433634617191, 'grow_policy': 'Lossguide', 'min_data_in_leaf': 388, 'max_leaves': 109}. Best is trial 738 with value: 78.71473735766027.[0m
[32m[I 2024-10-13 13:57:55,821][0m Trial 941 finished with value: 94.41812923918056 and parameters: {'depth': 10, 'learning_rate': 0.13782962606168053, 'iterations': 100, 'l2_leaf_reg': 6.93064000693549e-08, 'border_count': 15, 'bagging_temperature': 0.10127415413792147, 'random_strength': 9.416565673795946, 'grow_policy': 'Lossguide', 'min_data_in_leaf': 984, 'max_leaves': 140}. Best is trial 738 with value: 78.71473735766027.[0m
[32m[I 2024-10-13 13:57:56,683][0m Trial 942 finished with value: 93.14818245520736 and parameters: {'depth': 6, 'learning_rate': 0.11166966427781651, 'iterations': 339, 'l2_leaf_reg': 2.1681668730257265e-08, 'border_count': 27, 'bagging_temperature': 0.00012422379250724702, 'random_strength': 9.783141144702686, 'grow_policy': 'Lossguide', 'min_data_in_leaf': 484, 'max_leaves': 123}. Best is trial 738 with value: 78.71473735766027.[0m
[32m[I 2024-10-13 13:57:57,338][0m Trial 943 finished with value: 83.62406420179717 and parameters: {'depth': 6, 'learning_rate': 0.08914007799733452, 'iterations': 156, 'l2_leaf_reg': 3.944176546950989e-08, 'border_count': 33, 'bagging_temperature': 0.19567295102695223, 'random_strength': 8.759515856488965, 'grow_policy': 'Lossguide', 'min_data_in_leaf': 425, 'max_leaves': 156}. Best is trial 738 with value: 78.71473735766027.[0m
[32m[I 2024-10-13 13:57:58,058][0m Trial 944 finished with value: 87.03891942925715 and parameters: {'depth': 8, 'learning_rate': 0.17567014331287426, 'iterations': 250, 'l2_leaf_reg': 1.515576194702396e-08, 'border_count': 44, 'bagging_temperature': 0.13369794389000614, 'random_strength': 9.221166708512122, 'grow_policy': 'Lossguide', 'min_data_in_leaf': 917, 'max_leaves': 147}. Best is trial 738 with value: 78.71473735766027.[0m
[32m[I 2024-10-13 13:57:58,795][0m Trial 945 finished with value: 86.12845363572625 and parameters: {'depth': 10, 'learning_rate': 0.2672729035047681, 'iterations': 195, 'l2_leaf_reg': 0.001614663761700593, 'border_count': 10, 'bagging_temperature': 0.1654923860937406, 'random_strength': 9.597735763695683, 'grow_policy': 'Depthwise', 'min_data_in_leaf': 69}. Best is trial 738 with value: 78.71473735766027.[0m
[32m[I 2024-10-13 13:57:59,484][0m Trial 946 finished with value: 94.10375890016945 and parameters: {'depth': 9, 'learning_rate': 0.07402937414292152, 'iterations': 162, 'l2_leaf_reg': 4.339574615152159e-06, 'border_count': 21, 'bagging_temperature': 0.8730571062692138, 'random_strength': 9.83874290350398, 'grow_policy': 'Lossguide', 'min_data_in_leaf': 510, 'max_leaves': 136}. Best is trial 738 with value: 78.71473735766027.[0m
[32m[I 2024-10-13 13:58:00,101][0m Trial 947 finished with value: 83.01156742532523 and parameters: {'depth': 7, 'learning_rate': 0.12369474438604557, 'iterations': 100, 'l2_leaf_reg': 2.310807716814564e-08, 'border_count': 39, 'bagging_temperature': 0.07121391356840438, 'random_strength': 9.341675454148147, 'grow_policy': 'Lossguide', 'min_data_in_leaf': 476, 'max_leaves': 94}. Best is trial 738 with value: 78.71473735766027.[0m
[32m[I 2024-10-13 13:58:00,823][0m Trial 948 finished with value: 97.50406227648392 and parameters: {'depth': 6, 'learning_rate': 0.21443686966572317, 'iterations': 242, 'l2_leaf_reg': 3.0118029813338736e-08, 'border_count': 27, 'bagging_temperature': 0.11544770458844489, 'random_strength': 9.440410465119871, 'grow_policy': 'Lossguide', 'min_data_in_leaf': 437, 'max_leaves': 144}. Best is trial 738 with value: 78.71473735766027.[0m
[32m[I 2024-10-13 13:58:01,612][0m Trial 949 finished with value: 83.90800982056062 and parameters: {'depth': 7, 'learning_rate': 0.10603259182177847, 'iterations': 327, 'l2_leaf_reg': 1.4238765645945455e-08, 'border_count': 34, 'bagging_temperature': 0.14642399383566546, 'random_strength': 8.987506606803347, 'grow_policy': 'Lossguide', 'min_data_in_leaf': 331, 'max_leaves': 131}. Best is trial 738 with value: 78.71473735766027.[0m
[32m[I 2024-10-13 13:58:02,316][0m Trial 950 finished with value: 105.71866894129866 and parameters: {'depth': 8, 'learning_rate': 0.02158714808437536, 'iterations': 203, 'l2_leaf_reg': 1.7903481350167825, 'border_count': 18, 'bagging_temperature': 0.0904006821930892, 'random_strength': 9.597922587351068, 'grow_policy': 'Lossguide', 'min_data_in_leaf': 501, 'max_leaves': 151}. Best is trial 738 with value: 78.71473735766027.[0m
