[32m[I 2024-10-13 13:46:05,059][0m Trial 251 finished with value: 80.8198227944059 and parameters: {'depth': 13, 'learning_rate': 0.06815326042241009, 'iterations': 357, 'l2_leaf_reg': 0.00015587452333606607, 'border_count': 24, 'bagging_temperature': 0.2434753890556174, 'random_strength': 2.562114173991117, 'grow_policy': 'Lossguide', 'min_data_in_leaf': 573, 'max_leaves': 152}. Best is trial 221 with value: 79.98246884890459.[0m
[32m[I 2024-10-13 13:46:05,851][0m Trial 252 finished with value: 92.73661074890391 and parameters: {'depth': 13, 'learning_rate': 0.06516679512844487, 'iterations': 377, 'l2_leaf_reg': 0.00012727361054964018, 'border_count': 15, 'bagging_temperature': 0.2489349498882492, 'random_strength': 2.588537050334959, 'grow_policy': 'Lossguide', 'min_data_in_leaf': 579, 'max_leaves': 160}. Best is trial 221 with value: 79.98246884890459.[0m
[32m[I 2024-10-13 13:46:06,797][0m Trial 253 finished with value: 82.24117845462952 and parameters: {'depth': 13, 'learning_rate': 0.08327748041054055, 'iterations': 473, 'l2_leaf_reg': 0.00030109743447608755, 'border_count': 24, 'bagging_temperature': 0.31540945041076085, 'random_strength': 2.236409728991692, 'grow_policy': 'Lossguide', 'min_data_in_leaf': 620, 'max_leaves': 167}. Best is trial 221 with value: 79.98246884890459.[0m
[32m[I 2024-10-13 13:46:07,663][0m Trial 254 finished with value: 93.62472021824975 and parameters: {'depth': 13, 'learning_rate': 0.08237137393386591, 'iterations': 469, 'l2_leaf_reg': 0.00020618690318706831, 'border_count': 19, 'bagging_temperature': 0.2101394620906381, 'random_strength': 1.9488266893337018, 'grow_policy': 'Lossguide', 'min_data_in_leaf': 658, 'max_leaves': 170}. Best is trial 221 with value: 79.98246884890459.[0m
[32m[I 2024-10-13 13:46:08,523][0m Trial 255 finished with value: 92.44242460719228 and parameters: {'depth': 14, 'learning_rate': 0.10104295079188581, 'iterations': 414, 'l2_leaf_reg': 0.00014420255187700193, 'border_count': 28, 'bagging_temperature': 0.3303252649310429, 'random_strength': 2.22460990350633, 'grow_policy': 'Lossguide', 'min_data_in_leaf': 622, 'max_leaves': 164}. Best is trial 221 with value: 79.98246884890459.[0m
[32m[I 2024-10-13 13:46:09,352][0m Trial 256 finished with value: 84.48489748729348 and parameters: {'depth': 13, 'learning_rate': 0.07179656634491265, 'iterations': 351, 'l2_leaf_reg': 0.0001526215902230296, 'border_count': 29, 'bagging_temperature': 0.310156114850333, 'random_strength': 2.448822458828233, 'grow_policy': 'Lossguide', 'min_data_in_leaf': 597, 'max_leaves': 156}. Best is trial 221 with value: 79.98246884890459.[0m
[32m[I 2024-10-13 13:46:11,871][0m Trial 257 finished with value: 113.28479092857559 and parameters: {'depth': 13, 'learning_rate': 0.09191716500152151, 'iterations': 107, 'l2_leaf_reg': 8.8722680437385e-05, 'border_count': 12, 'bagging_temperature': 0.18397675079008755, 'random_strength': 2.2410857670814948, 'grow_policy': 'SymmetricTree', 'min_data_in_leaf': 639}. Best is trial 221 with value: 79.98246884890459.[0m
[32m[I 2024-10-13 13:46:12,786][0m Trial 258 finished with value: 308.01176645010213 and parameters: {'depth': 12, 'learning_rate': 0.00018257849837610956, 'iterations': 519, 'l2_leaf_reg': 0.0003529032555552773, 'border_count': 24, 'bagging_temperature': 0.25336964928874783, 'random_strength': 2.457914257589989, 'grow_policy': 'Lossguide', 'min_data_in_leaf': 609, 'max_leaves': 161}. Best is trial 221 with value: 79.98246884890459.[0m
[32m[I 2024-10-13 13:46:13,652][0m Trial 259 finished with value: 92.80454139578396 and parameters: {'depth': 14, 'learning_rate': 0.058866233036112464, 'iterations': 456, 'l2_leaf_reg': 0.0007753210105298469, 'border_count': 20, 'bagging_temperature': 0.21185407473478118, 'random_strength': 2.7633619286601587, 'grow_policy': 'Lossguide', 'min_data_in_leaf': 690, 'max_leaves': 153}. Best is trial 221 with value: 79.98246884890459.[0m
[32m[I 2024-10-13 13:46:14,463][0m Trial 260 finished with value: 98.2724985165109 and parameters: {'depth': 13, 'learning_rate': 0.04570760478010604, 'iterations': 309, 'l2_leaf_reg': 0.00025800409079833363, 'border_count': 152, 'bagging_temperature': 0.18965573458915785, 'random_strength': 3.10486386367062, 'grow_policy': 'Lossguide', 'min_data_in_leaf': 571, 'max_leaves': 148}. Best is trial 221 with value: 79.98246884890459.[0m
[32m[I 2024-10-13 13:46:15,276][0m Trial 261 finished with value: 85.29532869766793 and parameters: {'depth': 13, 'learning_rate': 0.06939771698315589, 'iterations': 409, 'l2_leaf_reg': 6.61018155326967e-05, 'border_count': 31, 'bagging_temperature': 0.2687529234145404, 'random_strength': 2.05837661823111, 'grow_policy': 'Lossguide', 'min_data_in_leaf': 557, 'max_leaves': 157}. Best is trial 221 with value: 79.98246884890459.[0m
[32m[I 2024-10-13 13:46:16,064][0m Trial 262 finished with value: 83.83428617659315 and parameters: {'depth': 12, 'learning_rate': 0.08054939499291415, 'iterations': 356, 'l2_leaf_reg': 0.002218689098241989, 'border_count': 46, 'bagging_temperature': 0.23863882524112986, 'random_strength': 2.55039630262657, 'grow_policy': 'Lossguide', 'min_data_in_leaf': 587, 'max_leaves': 166}. Best is trial 221 with value: 79.98246884890459.[0m
[32m[I 2024-10-13 13:46:16,818][0m Trial 263 finished with value: 83.33418618631832 and parameters: {'depth': 13, 'learning_rate': 0.06078859722026236, 'iterations': 249, 'l2_leaf_reg': 0.00036908776525256394, 'border_count': 41, 'bagging_temperature': 0.295974125115329, 'random_strength': 3.172190069287696, 'grow_policy': 'Lossguide', 'min_data_in_leaf': 529, 'max_leaves': 153}. Best is trial 221 with value: 79.98246884890459.[0m
[32m[I 2024-10-13 13:46:17,490][0m Trial 264 finished with value: 98.74581380862234 and parameters: {'depth': 13, 'learning_rate': 0.042401438983154134, 'iterations': 193, 'l2_leaf_reg': 0.09147811135440766, 'border_count': 232, 'bagging_temperature': 0.34113302105275645, 'random_strength': 2.8987836945228245, 'grow_policy': 'Lossguide', 'min_data_in_leaf': 568, 'max_leaves': 145}. Best is trial 221 with value: 79.98246884890459.[0m
[32m[I 2024-10-13 13:46:18,460][0m Trial 265 finished with value: 87.11961394659596 and parameters: {'depth': 13, 'learning_rate': 0.04956702072165368, 'iterations': 524, 'l2_leaf_reg': 0.0038595622203992735, 'border_count': 25, 'bagging_temperature': 0.2157523788391188, 'random_strength': 9.188535213005473, 'grow_policy': 'Lossguide', 'min_data_in_leaf': 616, 'max_leaves': 237}. Best is trial 221 with value: 79.98246884890459.[0m
[32m[I 2024-10-13 13:46:19,395][0m Trial 266 finished with value: 91.72565193764008 and parameters: {'depth': 11, 'learning_rate': 0.09044636105228604, 'iterations': 584, 'l2_leaf_reg': 0.000533119689474899, 'border_count': 17, 'bagging_temperature': 0.24894763299621403, 'random_strength': 2.7025915653414603, 'grow_policy': 'Lossguide', 'min_data_in_leaf': 544, 'max_leaves': 160}. Best is trial 221 with value: 79.98246884890459.[0m
[32m[I 2024-10-13 13:46:20,219][0m Trial 267 finished with value: 97.24393720790422 and parameters: {'depth': 13, 'learning_rate': 0.04127211975693939, 'iterations': 315, 'l2_leaf_reg': 0.0007804803881235155, 'border_count': 174, 'bagging_temperature': 0.26878718030432447, 'random_strength': 2.275125209087709, 'grow_policy': 'Depthwise', 'min_data_in_leaf': 524}. Best is trial 221 with value: 79.98246884890459.[0m
[32m[I 2024-10-13 13:46:21,038][0m Trial 268 finished with value: 99.3322591779245 and parameters: {'depth': 14, 'learning_rate': 0.05588047701881424, 'iterations': 403, 'l2_leaf_reg': 0.0002078812556987482, 'border_count': 100, 'bagging_temperature': 0.1947384187684298, 'random_strength': 1.773097243735189, 'grow_policy': 'Lossguide', 'min_data_in_leaf': 592, 'max_leaves': 149}. Best is trial 221 with value: 79.98246884890459.[0m
[32m[I 2024-10-13 13:46:21,967][0m Trial 269 finished with value: 83.19106041552618 and parameters: {'depth': 12, 'learning_rate': 0.03506049607465839, 'iterations': 446, 'l2_leaf_reg': 0.0016370228137158203, 'border_count': 31, 'bagging_temperature': 0.223600711155809, 'random_strength': 2.9913442823924017, 'grow_policy': 'Lossguide', 'min_data_in_leaf': 564, 'max_leaves': 212}. Best is trial 221 with value: 79.98246884890459.[0m
[32m[I 2024-10-13 13:46:22,686][0m Trial 270 finished with value: 81.05992088207432 and parameters: {'depth': 11, 'learning_rate': 0.0701548026155361, 'iterations': 285, 'l2_leaf_reg': 0.0003326730481935835, 'border_count': 38, 'bagging_temperature': 0.17570270528911816, 'random_strength': 3.7477314437832363, 'grow_policy': 'Lossguide', 'min_data_in_leaf': 514, 'max_leaves': 151}. Best is trial 221 with value: 79.98246884890459.[0m
[32m[I 2024-10-13 13:46:23,415][0m Trial 271 finished with value: 83.44181050815344 and parameters: {'depth': 11, 'learning_rate': 0.04838935425419394, 'iterations': 251, 'l2_leaf_reg': 0.0004387700001863857, 'border_count': 41, 'bagging_temperature': 0.17284690707422706, 'random_strength': 3.841779252135625, 'grow_policy': 'Lossguide', 'min_data_in_leaf': 520, 'max_leaves': 152}. Best is trial 221 with value: 79.98246884890459.[0m
[32m[I 2024-10-13 13:46:24,135][0m Trial 272 finished with value: 85.00944728335479 and parameters: {'depth': 11, 'learning_rate': 0.06524732808810274, 'iterations': 162, 'l2_leaf_reg': 0.00015396863174872412, 'border_count': 48, 'bagging_temperature': 0.17284200901457397, 'random_strength': 3.836875952580978, 'grow_policy': 'Lossguide', 'min_data_in_leaf': 504, 'max_leaves': 143}. Best is trial 221 with value: 79.98246884890459.[0m
[32m[I 2024-10-13 13:46:24,884][0m Trial 273 finished with value: 82.5279853804876 and parameters: {'depth': 12, 'learning_rate': 0.04285773496460924, 'iterations': 288, 'l2_leaf_reg': 0.0011025367304745143, 'border_count': 38, 'bagging_temperature': 0.20827351119757181, 'random_strength': 3.603175611143799, 'grow_policy': 'Lossguide', 'min_data_in_leaf': 554, 'max_leaves': 148}. Best is trial 221 with value: 79.98246884890459.[0m
[32m[I 2024-10-13 13:46:25,711][0m Trial 274 finished with value: 81.55026522922107 and parameters: {'depth': 11, 'learning_rate': 0.061893731220961534, 'iterations': 349, 'l2_leaf_reg': 0.000645197452432692, 'border_count': 35, 'bagging_temperature': 0.23508381958306268, 'random_strength': 3.19314591601845, 'grow_policy': 'Lossguide', 'min_data_in_leaf': 910, 'max_leaves': 155}. Best is trial 221 with value: 79.98246884890459.[0m
[32m[I 2024-10-13 13:46:26,488][0m Trial 275 finished with value: 86.31015335260402 and parameters: {'depth': 11, 'learning_rate': 0.07029650046400857, 'iterations': 348, 'l2_leaf_reg': 0.0008428988134266083, 'border_count': 30, 'bagging_temperature': 0.1906839039660629, 'random_strength': 3.1932465472885574, 'grow_policy': 'Lossguide', 'min_data_in_leaf': 874, 'max_leaves': 156}. Best is trial 221 with value: 79.98246884890459.[0m
[32m[I 2024-10-13 13:46:27,339][0m Trial 276 finished with value: 83.91328565390988 and parameters: {'depth': 11, 'learning_rate': 0.05996640995480269, 'iterations': 377, 'l2_leaf_reg': 0.0023560528607742006, 'border_count': 33, 'bagging_temperature': 0.248483174578245, 'random_strength': 3.2313099709003126, 'grow_policy': 'Lossguide', 'min_data_in_leaf': 829, 'max_leaves': 151}. Best is trial 221 with value: 79.98246884890459.[0m
[32m[I 2024-10-13 13:46:28,106][0m Trial 277 finished with value: 285.08884980925563 and parameters: {'depth': 11, 'learning_rate': 0.0009156935264512751, 'iterations': 252, 'l2_leaf_reg': 0.0005828927957220068, 'border_count': 45, 'bagging_temperature': 0.2132955343827358, 'random_strength': 4.089748902626795, 'grow_policy': 'Lossguide', 'min_data_in_leaf': 891, 'max_leaves': 140}. Best is trial 221 with value: 79.98246884890459.[0m
[32m[I 2024-10-13 13:46:28,824][0m Trial 278 finished with value: 87.63432410883343 and parameters: {'depth': 9, 'learning_rate': 0.03515341972534854, 'iterations': 200, 'l2_leaf_reg': 0.001264400151808381, 'border_count': 40, 'bagging_temperature': 0.2810901822629034, 'random_strength': 3.686800761121978, 'grow_policy': 'Lossguide', 'min_data_in_leaf': 804, 'max_leaves': 144}. Best is trial 221 with value: 79.98246884890459.[0m
[32m[I 2024-10-13 13:46:30,739][0m Trial 279 finished with value: 92.02840465432142 and parameters: {'depth': 10, 'learning_rate': 0.07507476978680391, 'iterations': 340, 'l2_leaf_reg': 2.4323058293563613, 'border_count': 28, 'bagging_temperature': 0.15802412782203876, 'random_strength': 3.4322981796915055, 'grow_policy': 'SymmetricTree', 'min_data_in_leaf': 533}. Best is trial 221 with value: 79.98246884890459.[0m
[32m[I 2024-10-13 13:46:31,742][0m Trial 280 finished with value: 79.877599423719 and parameters: {'depth': 10, 'learning_rate': 0.032013935764489736, 'iterations': 615, 'l2_leaf_reg': 0.0006919974986957365, 'border_count': 34, 'bagging_temperature': 0.2367139846496683, 'random_strength': 4.006791296181472, 'grow_policy': 'Lossguide', 'min_data_in_leaf': 973, 'max_leaves': 156}. Best is trial 280 with value: 79.877599423719.[0m
[32m[I 2024-10-13 13:46:32,571][0m Trial 281 finished with value: 82.27098506130035 and parameters: {'depth': 7, 'learning_rate': 0.03189333584355751, 'iterations': 405, 'l2_leaf_reg': 0.0006823544644296928, 'border_count': 36, 'bagging_temperature': 0.2284478195421677, 'random_strength': 4.041018624788843, 'grow_policy': 'Lossguide', 'min_data_in_leaf': 955, 'max_leaves': 161}. Best is trial 280 with value: 79.877599423719.[0m
[32m[I 2024-10-13 13:46:33,350][0m Trial 282 finished with value: 84.10335820755112 and parameters: {'depth': 11, 'learning_rate': 0.03337617642761189, 'iterations': 313, 'l2_leaf_reg': 0.001489141016204205, 'border_count': 43, 'bagging_temperature': 0.17890213329014976, 'random_strength': 3.9607176266030586, 'grow_policy': 'Lossguide', 'min_data_in_leaf': 273, 'max_leaves': 157}. Best is trial 280 with value: 79.877599423719.[0m
[32m[I 2024-10-13 13:46:34,257][0m Trial 283 finished with value: 81.34865898734851 and parameters: {'depth': 10, 'learning_rate': 0.03847822439428877, 'iterations': 505, 'l2_leaf_reg': 0.0004943543203366277, 'border_count': 37, 'bagging_temperature': 0.20228018282018315, 'random_strength': 2.9615286081465837, 'grow_policy': 'Lossguide', 'min_data_in_leaf': 975, 'max_leaves': 147}. Best is trial 280 with value: 79.877599423719.[0m
[32m[I 2024-10-13 13:46:35,209][0m Trial 284 finished with value: 84.28627967651991 and parameters: {'depth': 15, 'learning_rate': 0.04121219557962596, 'iterations': 562, 'l2_leaf_reg': 0.00829514287490292, 'border_count': 49, 'bagging_temperature': 0.2042283525742758, 'random_strength': 2.9580303064098716, 'grow_policy': 'Lossguide', 'min_data_in_leaf': 967, 'max_leaves': 147}. Best is trial 280 with value: 79.877599423719.[0m
[32m[I 2024-10-13 13:46:36,095][0m Trial 285 finished with value: 82.24961767262113 and parameters: {'depth': 10, 'learning_rate': 0.03888829047144951, 'iterations': 500, 'l2_leaf_reg': 0.0006910164121120137, 'border_count': 39, 'bagging_temperature': 0.19638846337024496, 'random_strength': 3.1419829284476295, 'grow_policy': 'Lossguide', 'min_data_in_leaf': 990, 'max_leaves': 140}. Best is trial 280 with value: 79.877599423719.[0m
[32m[I 2024-10-13 13:46:37,095][0m Trial 286 finished with value: 91.70556913593404 and parameters: {'depth': 10, 'learning_rate': 0.12042990816803853, 'iterations': 595, 'l2_leaf_reg': 0.003150270243715254, 'border_count': 32, 'bagging_temperature': 0.2259346444858832, 'random_strength': 4.293082531297625, 'grow_policy': 'Lossguide', 'min_data_in_leaf': 995, 'max_leaves': 150}. Best is trial 280 with value: 79.877599423719.[0m
[32m[I 2024-10-13 13:46:37,969][0m Trial 287 finished with value: 89.36483933998339 and parameters: {'depth': 10, 'learning_rate': 0.06017034643089613, 'iterations': 481, 'l2_leaf_reg': 0.0013566389398311845, 'border_count': 28, 'bagging_temperature': 0.17424657606076593, 'random_strength': 2.8563283249759905, 'grow_policy': 'Lossguide', 'min_data_in_leaf': 967, 'max_leaves': 145}. Best is trial 280 with value: 79.877599423719.[0m
[32m[I 2024-10-13 13:46:38,796][0m Trial 288 finished with value: 84.17541624726978 and parameters: {'depth': 11, 'learning_rate': 0.04807897509301476, 'iterations': 416, 'l2_leaf_reg': 0.0008224644973203543, 'border_count': 43, 'bagging_temperature': 0.24563950840245202, 'random_strength': 3.030194552507536, 'grow_policy': 'Lossguide', 'min_data_in_leaf': 933, 'max_leaves': 152}. Best is trial 280 with value: 79.877599423719.[0m
[32m[I 2024-10-13 13:46:39,740][0m Trial 289 finished with value: 84.04408703858428 and parameters: {'depth': 10, 'learning_rate': 0.057032940738712436, 'iterations': 540, 'l2_leaf_reg': 0.0005133749915152039, 'border_count': 36, 'bagging_temperature': 0.1973450078710331, 'random_strength': 3.2428639756881537, 'grow_policy': 'Lossguide', 'min_data_in_leaf': 918, 'max_leaves': 143}. Best is trial 280 with value: 79.877599423719.[0m
[32m[I 2024-10-13 13:46:40,540][0m Trial 290 finished with value: 84.09095756722198 and parameters: {'depth': 10, 'learning_rate': 0.03015794436584729, 'iterations': 360, 'l2_leaf_reg': 0.0010515999102024014, 'border_count': 33, 'bagging_temperature': 0.21695975544289933, 'random_strength': 2.713227198639996, 'grow_policy': 'Depthwise', 'min_data_in_leaf': 978}. Best is trial 280 with value: 79.877599423719.[0m
[32m[I 2024-10-13 13:46:41,231][0m Trial 291 finished with value: 92.56950628706622 and parameters: {'depth': 12, 'learning_rate': 0.10318399027416421, 'iterations': 217, 'l2_leaf_reg': 0.0019082399452033947, 'border_count': 22, 'bagging_temperature': 0.15932075299647477, 'random_strength': 3.71668291963242, 'grow_policy': 'Lossguide', 'min_data_in_leaf': 754, 'max_leaves': 139}. Best is trial 280 with value: 79.877599423719.[0m
[32m[I 2024-10-13 13:46:42,228][0m Trial 292 finished with value: 105.3077845770306 and parameters: {'depth': 10, 'learning_rate': 0.07129739289131307, 'iterations': 633, 'l2_leaf_reg': 0.0004144610184564243, 'border_count': 121, 'bagging_temperature': 0.238051510612909, 'random_strength': 7.190394406679961, 'grow_policy': 'Lossguide', 'min_data_in_leaf': 866, 'max_leaves': 149}. Best is trial 280 with value: 79.877599423719.[0m
[32m[I 2024-10-13 13:46:42,859][0m Trial 293 finished with value: 91.47660711733229 and parameters: {'depth': 11, 'learning_rate': 0.040361565256464074, 'iterations': 146, 'l2_leaf_reg': 0.0009550415597819243, 'border_count': 40, 'bagging_temperature': 0.18389615335805387, 'random_strength': 3.988117109364602, 'grow_policy': 'Lossguide', 'min_data_in_leaf': 323, 'max_leaves': 164}. Best is trial 280 with value: 79.877599423719.[0m
[32m[I 2024-10-13 13:46:43,755][0m Trial 294 finished with value: 117.77593271976595 and parameters: {'depth': 11, 'learning_rate': 0.04973224947568498, 'iterations': 415, 'l2_leaf_reg': 0.0003404164061337456, 'border_count': 8, 'bagging_temperature': 0.21819636218230093, 'random_strength': 3.416469448645085, 'grow_policy': 'Lossguide', 'min_data_in_leaf': 544, 'max_leaves': 158}. Best is trial 280 with value: 79.877599423719.[0m
[32m[I 2024-10-13 13:46:44,613][0m Trial 295 finished with value: 87.88235157776522 and parameters: {'depth': 10, 'learning_rate': 0.044168709880413735, 'iterations': 465, 'l2_leaf_reg': 0.000602045757995224, 'border_count': 28, 'bagging_temperature': 0.2566026086642521, 'random_strength': 3.0079557268104535, 'grow_policy': 'Lossguide', 'min_data_in_leaf': 960, 'max_leaves': 153}. Best is trial 280 with value: 79.877599423719.[0m
[32m[I 2024-10-13 13:46:45,450][0m Trial 296 finished with value: 83.6720036524835 and parameters: {'depth': 10, 'learning_rate': 0.058877585458788406, 'iterations': 346, 'l2_leaf_reg': 0.002549538441864599, 'border_count': 48, 'bagging_temperature': 0.2036127977844256, 'random_strength': 3.2209247595062123, 'grow_policy': 'Lossguide', 'min_data_in_leaf': 952, 'max_leaves': 147}. Best is trial 280 with value: 79.877599423719.[0m
[32m[I 2024-10-13 13:46:48,048][0m Trial 297 finished with value: 90.24450012775776 and parameters: {'depth': 12, 'learning_rate': 0.035868784595151464, 'iterations': 2829, 'l2_leaf_reg': 0.000468425788152901, 'border_count': 38, 'bagging_temperature': 0.23080213586795592, 'random_strength': 3.781558730033052, 'grow_policy': 'Lossguide', 'min_data_in_leaf': 517, 'max_leaves': 143}. Best is trial 280 with value: 79.877599423719.[0m
[32m[I 2024-10-13 13:46:48,821][0m Trial 298 finished with value: 95.88712619242216 and parameters: {'depth': 10, 'learning_rate': 0.022026301886191188, 'iterations': 255, 'l2_leaf_reg': 0.0015099124018368632, 'border_count': 19, 'bagging_temperature': 0.15351844749482385, 'random_strength': 4.186042027529637, 'grow_policy': 'Lossguide', 'min_data_in_leaf': 295, 'max_leaves': 160}. Best is trial 280 with value: 79.877599423719.[0m
[32m[I 2024-10-13 13:46:49,753][0m Trial 299 finished with value: 91.34941591692511 and parameters: {'depth': 10, 'learning_rate': 0.07641611887496837, 'iterations': 522, 'l2_leaf_reg': 0.0007141372240351048, 'border_count': 27, 'bagging_temperature': 0.25104997896268494, 'random_strength': 2.7101770415077477, 'grow_policy': 'Lossguide', 'min_data_in_leaf': 982, 'max_leaves': 154}. Best is trial 280 with value: 79.877599423719.[0m
[32m[I 2024-10-13 13:46:50,527][0m Trial 300 finished with value: 84.2071630750233 and parameters: {'depth': 12, 'learning_rate': 0.03069035919702997, 'iterations': 321, 'l2_leaf_reg': 9.35884570882626e-05, 'border_count': 35, 'bagging_temperature': 0.1867480459881723, 'random_strength': 3.5573421013431346, 'grow_policy': 'Lossguide', 'min_data_in_leaf': 898, 'max_leaves': 228}. Best is trial 280 with value: 79.877599423719.[0m
