[32m[I 2024-10-13 13:49:03,230][0m Trial 401 finished with value: 91.13169086018901 and parameters: {'depth': 12, 'learning_rate': 0.08442926803075235, 'iterations': 213, 'l2_leaf_reg': 0.00017740001463695756, 'border_count': 13, 'bagging_temperature': 0.24196444699224587, 'random_strength': 3.4354771853029566, 'grow_policy': 'Lossguide', 'min_data_in_leaf': 165, 'max_leaves': 162}. Best is trial 280 with value: 79.877599423719.[0m
[32m[I 2024-10-13 13:49:04,002][0m Trial 402 finished with value: 91.78549750524041 and parameters: {'depth': 15, 'learning_rate': 0.06343719031956788, 'iterations': 235, 'l2_leaf_reg': 9.114266359017152e-05, 'border_count': 30, 'bagging_temperature': 0.28712437131379365, 'random_strength': 3.2177716697500163, 'grow_policy': 'Depthwise', 'min_data_in_leaf': 98}. Best is trial 280 with value: 79.877599423719.[0m
[32m[I 2024-10-13 13:49:04,763][0m Trial 403 finished with value: 91.63270430937112 and parameters: {'depth': 12, 'learning_rate': 0.05791534444841166, 'iterations': 275, 'l2_leaf_reg': 0.00010437077388603915, 'border_count': 22, 'bagging_temperature': 0.2600689208054129, 'random_strength': 2.9408887725297856, 'grow_policy': 'Lossguide', 'min_data_in_leaf': 205, 'max_leaves': 157}. Best is trial 280 with value: 79.877599423719.[0m
[32m[I 2024-10-13 13:49:05,395][0m Trial 404 finished with value: 83.02273826268043 and parameters: {'depth': 12, 'learning_rate': 0.07835428814915188, 'iterations': 150, 'l2_leaf_reg': 0.00014396868389360208, 'border_count': 35, 'bagging_temperature': 0.235598150120392, 'random_strength': 3.4792855317968545, 'grow_policy': 'Lossguide', 'min_data_in_leaf': 189, 'max_leaves': 173}. Best is trial 280 with value: 79.877599423719.[0m
[32m[I 2024-10-13 13:49:06,164][0m Trial 405 finished with value: 87.74275940007597 and parameters: {'depth': 12, 'learning_rate': 0.0538505857802931, 'iterations': 276, 'l2_leaf_reg': 0.0002592522365470784, 'border_count': 28, 'bagging_temperature': 0.2560524126840872, 'random_strength': 2.6158323745596075, 'grow_policy': 'Lossguide', 'min_data_in_leaf': 159, 'max_leaves': 161}. Best is trial 280 with value: 79.877599423719.[0m
[32m[I 2024-10-13 13:49:06,840][0m Trial 406 finished with value: 82.64967047557177 and parameters: {'depth': 12, 'learning_rate': 0.06895052071892353, 'iterations': 196, 'l2_leaf_reg': 6.415263623681919e-05, 'border_count': 37, 'bagging_temperature': 0.2290378000158713, 'random_strength': 3.6859266562211914, 'grow_policy': 'Lossguide', 'min_data_in_leaf': 160, 'max_leaves': 167}. Best is trial 280 with value: 79.877599423719.[0m
[32m[I 2024-10-13 13:49:08,011][0m Trial 407 finished with value: 94.40421559763718 and parameters: {'depth': 14, 'learning_rate': 0.058162713859875516, 'iterations': 815, 'l2_leaf_reg': 0.00014115439045515624, 'border_count': 19, 'bagging_temperature': 0.21542875119524454, 'random_strength': 3.2867090269251946, 'grow_policy': 'Lossguide', 'min_data_in_leaf': 233, 'max_leaves': 220}. Best is trial 280 with value: 79.877599423719.[0m
[32m[I 2024-10-13 13:49:08,803][0m Trial 408 finished with value: 87.47346450821826 and parameters: {'depth': 12, 'learning_rate': 0.09424605630905057, 'iterations': 339, 'l2_leaf_reg': 0.0003478186300278475, 'border_count': 43, 'bagging_temperature': 0.369155220892185, 'random_strength': 3.0426795013367545, 'grow_policy': 'Lossguide', 'min_data_in_leaf': 188, 'max_leaves': 156}. Best is trial 280 with value: 79.877599423719.[0m
[32m[I 2024-10-13 13:49:09,511][0m Trial 409 finished with value: 86.28569101015471 and parameters: {'depth': 13, 'learning_rate': 0.07524196073072068, 'iterations': 225, 'l2_leaf_reg': 0.0005218825400552403, 'border_count': 25, 'bagging_temperature': 0.2798830336551982, 'random_strength': 3.579395205731864, 'grow_policy': 'Lossguide', 'min_data_in_leaf': 194, 'max_leaves': 152}. Best is trial 280 with value: 79.877599423719.[0m
[32m[I 2024-10-13 13:49:10,295][0m Trial 410 finished with value: 83.15940387779496 and parameters: {'depth': 12, 'learning_rate': 0.04995951240299947, 'iterations': 299, 'l2_leaf_reg': 0.00024187767072302295, 'border_count': 33, 'bagging_temperature': 0.25625336857417724, 'random_strength': 2.345113945444786, 'grow_policy': 'Lossguide', 'min_data_in_leaf': 180, 'max_leaves': 160}. Best is trial 280 with value: 79.877599423719.[0m
[32m[I 2024-10-13 13:49:10,954][0m Trial 411 finished with value: 85.90249280990567 and parameters: {'depth': 13, 'learning_rate': 0.06336663243660753, 'iterations': 152, 'l2_leaf_reg': 0.0008231679682260476, 'border_count': 29, 'bagging_temperature': 0.21116511614071443, 'random_strength': 3.273328595507232, 'grow_policy': 'Lossguide', 'min_data_in_leaf': 139, 'max_leaves': 155}. Best is trial 280 with value: 79.877599423719.[0m
[32m[I 2024-10-13 13:49:11,579][0m Trial 412 finished with value: 84.22691790948818 and parameters: {'depth': 11, 'learning_rate': 0.04727439772324182, 'iterations': 100, 'l2_leaf_reg': 0.00044587618216519314, 'border_count': 37, 'bagging_temperature': 0.24220352655388294, 'random_strength': 8.782778356693415, 'grow_policy': 'Lossguide', 'min_data_in_leaf': 85, 'max_leaves': 149}. Best is trial 280 with value: 79.877599423719.[0m
[32m[I 2024-10-13 13:49:12,427][0m Trial 413 finished with value: 95.29118636856963 and parameters: {'depth': 14, 'learning_rate': 0.10844080293201953, 'iterations': 265, 'l2_leaf_reg': 0.0006193776301304003, 'border_count': 46, 'bagging_temperature': 0.6941111883358813, 'random_strength': 2.8086011244608664, 'grow_policy': 'Lossguide', 'min_data_in_leaf': 73, 'max_leaves': 214}. Best is trial 280 with value: 79.877599423719.[0m
[32m[I 2024-10-13 13:49:13,235][0m Trial 414 finished with value: 92.49205679815253 and parameters: {'depth': 12, 'learning_rate': 0.056388424463232174, 'iterations': 351, 'l2_leaf_reg': 0.00015478655559515643, 'border_count': 15, 'bagging_temperature': 0.2230792501735309, 'random_strength': 3.4492294274389144, 'grow_policy': 'Lossguide', 'min_data_in_leaf': 215, 'max_leaves': 162}. Best is trial 280 with value: 79.877599423719.[0m
[32m[I 2024-10-13 13:49:13,912][0m Trial 415 finished with value: 91.50340135634426 and parameters: {'depth': 13, 'learning_rate': 0.07349069235529443, 'iterations': 188, 'l2_leaf_reg': 0.0002783889123890258, 'border_count': 22, 'bagging_temperature': 0.295028596263519, 'random_strength': 3.0719820992517493, 'grow_policy': 'Lossguide', 'min_data_in_leaf': 163, 'max_leaves': 158}. Best is trial 280 with value: 79.877599423719.[0m
[32m[I 2024-10-13 13:49:14,664][0m Trial 416 finished with value: 84.38804492920445 and parameters: {'depth': 11, 'learning_rate': 0.04559685351449875, 'iterations': 295, 'l2_leaf_reg': 0.000985082719827508, 'border_count': 31, 'bagging_temperature': 0.19454504923238, 'random_strength': 3.6756892626166464, 'grow_policy': 'Depthwise', 'min_data_in_leaf': 916}. Best is trial 280 with value: 79.877599423719.[0m
[32m[I 2024-10-13 13:49:19,052][0m Trial 417 finished with value: 109.11535563595162 and parameters: {'depth': 12, 'learning_rate': 0.08538038855063322, 'iterations': 375, 'l2_leaf_reg': 9.241091090889178e-05, 'border_count': 42, 'bagging_temperature': 0.2671411261596913, 'random_strength': 3.2965909165842437, 'grow_policy': 'SymmetricTree', 'min_data_in_leaf': 134}. Best is trial 280 with value: 79.877599423719.[0m
[32m[I 2024-10-13 13:49:19,667][0m Trial 418 finished with value: 81.3840612284918 and parameters: {'depth': 11, 'learning_rate': 0.06430283383849497, 'iterations': 223, 'l2_leaf_reg': 0.0004043293233124922, 'border_count': 37, 'bagging_temperature': 0.23438167572852367, 'random_strength': 3.811868097957701, 'grow_policy': 'Lossguide', 'min_data_in_leaf': 578, 'max_leaves': 151}. Best is trial 280 with value: 79.877599423719.[0m
[32m[I 2024-10-13 13:49:20,421][0m Trial 419 finished with value: 87.81382575433811 and parameters: {'depth': 11, 'learning_rate': 0.0664550448988405, 'iterations': 211, 'l2_leaf_reg': 0.00042005893573566046, 'border_count': 26, 'bagging_temperature': 0.315119659337087, 'random_strength': 3.917096292008719, 'grow_policy': 'Lossguide', 'min_data_in_leaf': 624, 'max_leaves': 146}. Best is trial 280 with value: 79.877599423719.[0m
[32m[I 2024-10-13 13:49:21,156][0m Trial 420 finished with value: 83.73234468040326 and parameters: {'depth': 11, 'learning_rate': 0.09281977569843819, 'iterations': 230, 'l2_leaf_reg': 0.0002038204505508824, 'border_count': 38, 'bagging_temperature': 0.23907762349549758, 'random_strength': 3.8574317319349873, 'grow_policy': 'Lossguide', 'min_data_in_leaf': 783, 'max_leaves': 150}. Best is trial 280 with value: 79.877599423719.[0m
[32m[I 2024-10-13 13:49:21,791][0m Trial 421 finished with value: 85.37927129968244 and parameters: {'depth': 11, 'learning_rate': 0.14184669246199708, 'iterations': 150, 'l2_leaf_reg': 0.0002645551528335072, 'border_count': 32, 'bagging_temperature': 0.20684404906807907, 'random_strength': 3.7484571683131658, 'grow_policy': 'Lossguide', 'min_data_in_leaf': 603, 'max_leaves': 153}. Best is trial 280 with value: 79.877599423719.[0m
[32m[I 2024-10-13 13:49:22,619][0m Trial 422 finished with value: 85.01644136181243 and parameters: {'depth': 11, 'learning_rate': 0.06106850243592241, 'iterations': 324, 'l2_leaf_reg': 0.0004656457499070221, 'border_count': 49, 'bagging_temperature': 0.25537244276086757, 'random_strength': 1.491211969141546, 'grow_policy': 'Lossguide', 'min_data_in_leaf': 973, 'max_leaves': 146}. Best is trial 280 with value: 79.877599423719.[0m
[32m[I 2024-10-13 13:49:23,336][0m Trial 423 finished with value: 82.48630225220198 and parameters: {'depth': 11, 'learning_rate': 0.07283551827848869, 'iterations': 243, 'l2_leaf_reg': 0.0001522630948243181, 'border_count': 40, 'bagging_temperature': 0.27142852600941947, 'random_strength': 7.263971382741768, 'grow_policy': 'Lossguide', 'min_data_in_leaf': 580, 'max_leaves': 229}. Best is trial 280 with value: 79.877599423719.[0m
[32m[I 2024-10-13 13:49:24,457][0m Trial 424 finished with value: 99.49073901669018 and parameters: {'depth': 14, 'learning_rate': 0.05529713516695652, 'iterations': 763, 'l2_leaf_reg': 4.9489656978755354e-05, 'border_count': 56, 'bagging_temperature': 0.23454508001916918, 'random_strength': 2.6141964784693035, 'grow_policy': 'Lossguide', 'min_data_in_leaf': 568, 'max_leaves': 153}. Best is trial 280 with value: 79.877599423719.[0m
[32m[I 2024-10-13 13:49:25,118][0m Trial 425 finished with value: 91.61102069204726 and parameters: {'depth': 9, 'learning_rate': 0.08079934966438086, 'iterations': 173, 'l2_leaf_reg': 0.00035753607567949895, 'border_count': 22, 'bagging_temperature': 0.21650325372480592, 'random_strength': 3.555490564338704, 'grow_policy': 'Lossguide', 'min_data_in_leaf': 939, 'max_leaves': 144}. Best is trial 280 with value: 79.877599423719.[0m
[32m[I 2024-10-13 13:49:25,964][0m Trial 426 finished with value: 89.32628780654181 and parameters: {'depth': 11, 'learning_rate': 0.06806188414122265, 'iterations': 390, 'l2_leaf_reg': 0.0005198341524244356, 'border_count': 28, 'bagging_temperature': 0.18859282231748933, 'random_strength': 4.046121531383215, 'grow_policy': 'Lossguide', 'min_data_in_leaf': 711, 'max_leaves': 150}. Best is trial 280 with value: 79.877599423719.[0m
[32m[I 2024-10-13 13:49:27,852][0m Trial 427 finished with value: 112.00155729877501 and parameters: {'depth': 13, 'learning_rate': 0.05378644532672262, 'iterations': 1745, 'l2_leaf_reg': 0.0006921879080286901, 'border_count': 221, 'bagging_temperature': 0.29707711032964756, 'random_strength': 2.9388231848459956, 'grow_policy': 'Lossguide', 'min_data_in_leaf': 178, 'max_leaves': 157}. Best is trial 280 with value: 79.877599423719.[0m
[32m[I 2024-10-13 13:49:28,643][0m Trial 428 finished with value: 94.05803956273513 and parameters: {'depth': 11, 'learning_rate': 0.0432739597319381, 'iterations': 290, 'l2_leaf_reg': 0.00011940920680572078, 'border_count': 16, 'bagging_temperature': 0.2390872833271089, 'random_strength': 2.2123972792407507, 'grow_policy': 'Lossguide', 'min_data_in_leaf': 889, 'max_leaves': 208}. Best is trial 280 with value: 79.877599423719.[0m
[32m[I 2024-10-13 13:49:29,630][0m Trial 429 finished with value: 84.61916236048448 and parameters: {'depth': 15, 'learning_rate': 0.06318722958773529, 'iterations': 608, 'l2_leaf_reg': 0.0002625463070373587, 'border_count': 34, 'bagging_temperature': 0.20596411138775977, 'random_strength': 1.8975863181902843, 'grow_policy': 'Lossguide', 'min_data_in_leaf': 588, 'max_leaves': 97}. Best is trial 280 with value: 79.877599423719.[0m
[32m[I 2024-10-13 13:49:30,355][0m Trial 430 finished with value: 89.30183169602634 and parameters: {'depth': 13, 'learning_rate': 0.11213442472399983, 'iterations': 220, 'l2_leaf_reg': 0.00035299729915602696, 'border_count': 42, 'bagging_temperature': 0.2555259006012011, 'random_strength': 3.6475123377775622, 'grow_policy': 'Depthwise', 'min_data_in_leaf': 623}. Best is trial 280 with value: 79.877599423719.[0m
[32m[I 2024-10-13 13:49:32,156][0m Trial 431 finished with value: 111.95303861409467 and parameters: {'depth': 10, 'learning_rate': 0.050282361609924525, 'iterations': 1682, 'l2_leaf_reg': 0.04083036759076633, 'border_count': 187, 'bagging_temperature': 0.27925320361948747, 'random_strength': 3.200091376256508, 'grow_policy': 'Lossguide', 'min_data_in_leaf': 562, 'max_leaves': 164}. Best is trial 280 with value: 79.877599423719.[0m
[32m[I 2024-10-13 13:49:32,991][0m Trial 432 finished with value: 89.26468287315734 and parameters: {'depth': 10, 'learning_rate': 0.0863263123091364, 'iterations': 344, 'l2_leaf_reg': 0.0008645854278064785, 'border_count': 26, 'bagging_temperature': 0.22542743922968186, 'random_strength': 3.473917398332943, 'grow_policy': 'Lossguide', 'min_data_in_leaf': 653, 'max_leaves': 235}. Best is trial 280 with value: 79.877599423719.[0m
[32m[I 2024-10-13 13:49:33,727][0m Trial 433 finished with value: 82.3222228136653 and parameters: {'depth': 13, 'learning_rate': 0.04118367552545765, 'iterations': 288, 'l2_leaf_reg': 0.0001916580615694943, 'border_count': 36, 'bagging_temperature': 0.17208195533911141, 'random_strength': 3.8534324661620145, 'grow_policy': 'Lossguide', 'min_data_in_leaf': 828, 'max_leaves': 178}. Best is trial 280 with value: 79.877599423719.[0m
[32m[I 2024-10-13 13:49:34,561][0m Trial 434 finished with value: 117.9385723999163 and parameters: {'depth': 11, 'learning_rate': 0.07242532650303632, 'iterations': 405, 'l2_leaf_reg': 0.000585186397171587, 'border_count': 7, 'bagging_temperature': 0.0013999596662306532, 'random_strength': 2.658465815555237, 'grow_policy': 'Lossguide', 'min_data_in_leaf': 480, 'max_leaves': 251}. Best is trial 280 with value: 79.877599423719.[0m
[32m[I 2024-10-13 13:49:35,277][0m Trial 435 finished with value: 92.31204223459656 and parameters: {'depth': 14, 'learning_rate': 0.05979397283766078, 'iterations': 239, 'l2_leaf_reg': 0.001301853298469466, 'border_count': 19, 'bagging_temperature': 0.1991366757137923, 'random_strength': 2.8593956145804516, 'grow_policy': 'Lossguide', 'min_data_in_leaf': 602, 'max_leaves': 71}. Best is trial 280 with value: 79.877599423719.[0m
[32m[I 2024-10-13 13:49:35,903][0m Trial 436 finished with value: 92.18506312175226 and parameters: {'depth': 9, 'learning_rate': 0.05245664963790779, 'iterations': 116, 'l2_leaf_reg': 7.028607177349422e-05, 'border_count': 46, 'bagging_temperature': 0.24708224688540362, 'random_strength': 2.3806531929314194, 'grow_policy': 'Lossguide', 'min_data_in_leaf': 555, 'max_leaves': 148}. Best is trial 280 with value: 79.877599423719.[0m
[32m[I 2024-10-13 13:49:37,024][0m Trial 437 finished with value: 86.25155382994163 and parameters: {'depth': 10, 'learning_rate': 0.03934280073305093, 'iterations': 669, 'l2_leaf_reg': 0.00036622470216589537, 'border_count': 32, 'bagging_temperature': 0.22124856090146747, 'random_strength': 3.086939227838546, 'grow_policy': 'Lossguide', 'min_data_in_leaf': 498, 'max_leaves': 140}. Best is trial 280 with value: 79.877599423719.[0m
[32m[I 2024-10-13 13:50:05,256][0m Trial 438 finished with value: 109.4363400455481 and parameters: {'depth': 11, 'learning_rate': 0.07748490629273591, 'iterations': 1030, 'l2_leaf_reg': 0.0007172262629009995, 'border_count': 106, 'bagging_temperature': 0.26876390583890086, 'random_strength': 5.792039505533117, 'grow_policy': 'SymmetricTree', 'min_data_in_leaf': 575}. Best is trial 280 with value: 79.877599423719.[0m
[32m[I 2024-10-13 13:50:06,036][0m Trial 439 finished with value: 88.50592324527342 and parameters: {'depth': 10, 'learning_rate': 0.06407934609049315, 'iterations': 331, 'l2_leaf_reg': 0.0002071635780791261, 'border_count': 27, 'bagging_temperature': 0.18707586603611778, 'random_strength': 3.7200385318085565, 'grow_policy': 'Lossguide', 'min_data_in_leaf': 1000, 'max_leaves': 155}. Best is trial 280 with value: 79.877599423719.[0m
[32m[I 2024-10-13 13:50:06,728][0m Trial 440 finished with value: 84.69787533070952 and parameters: {'depth': 9, 'learning_rate': 0.0464640266311628, 'iterations': 201, 'l2_leaf_reg': 0.0003503253924354007, 'border_count': 38, 'bagging_temperature': 0.2463242707489662, 'random_strength': 3.38848532122896, 'grow_policy': 'Lossguide', 'min_data_in_leaf': 542, 'max_leaves': 222}. Best is trial 280 with value: 79.877599423719.[0m
[32m[I 2024-10-13 13:50:07,507][0m Trial 441 finished with value: 83.02177502685811 and parameters: {'depth': 10, 'learning_rate': 0.057101933855670334, 'iterations': 258, 'l2_leaf_reg': 0.00011554191184592853, 'border_count': 23, 'bagging_temperature': 0.3345905625030598, 'random_strength': 3.5262885903133716, 'grow_policy': 'Lossguide', 'min_data_in_leaf': 744, 'max_leaves': 117}. Best is trial 280 with value: 79.877599423719.[0m
[32m[I 2024-10-13 13:50:08,314][0m Trial 442 finished with value: 88.48395927482723 and parameters: {'depth': 11, 'learning_rate': 0.10268616674267281, 'iterations': 359, 'l2_leaf_reg': 0.0009378214092779755, 'border_count': 32, 'bagging_temperature': 0.21997474119932442, 'random_strength': 3.21342817736359, 'grow_policy': 'Lossguide', 'min_data_in_leaf': 581, 'max_leaves': 152}. Best is trial 280 with value: 79.877599423719.[0m
[32m[I 2024-10-13 13:50:10,686][0m Trial 443 finished with value: 92.58665151987657 and parameters: {'depth': 7, 'learning_rate': 0.03547381435999168, 'iterations': 2449, 'l2_leaf_reg': 0.0006028870019687065, 'border_count': 43, 'bagging_temperature': 0.1527431099387048, 'random_strength': 2.811204096728103, 'grow_policy': 'Depthwise', 'min_data_in_leaf': 975}. Best is trial 280 with value: 79.877599423719.[0m
[32m[I 2024-10-13 13:50:11,525][0m Trial 444 finished with value: 94.36211167770935 and parameters: {'depth': 14, 'learning_rate': 0.04413103720792768, 'iterations': 297, 'l2_leaf_reg': 0.001525899380505356, 'border_count': 12, 'bagging_temperature': 0.20289211298338483, 'random_strength': 3.00681483910173, 'grow_policy': 'Lossguide', 'min_data_in_leaf': 288, 'max_leaves': 143}. Best is trial 280 with value: 79.877599423719.[0m
[32m[I 2024-10-13 13:50:12,208][0m Trial 445 finished with value: 82.53017390326492 and parameters: {'depth': 13, 'learning_rate': 0.07151538565028955, 'iterations': 172, 'l2_leaf_reg': 0.00023664300133238337, 'border_count': 37, 'bagging_temperature': 0.2973755923627599, 'random_strength': 4.0146426015648355, 'grow_policy': 'Lossguide', 'min_data_in_leaf': 164, 'max_leaves': 167}. Best is trial 280 with value: 79.877599423719.[0m
[32m[I 2024-10-13 13:50:13,111][0m Trial 446 finished with value: 83.9759444128726 and parameters: {'depth': 9, 'learning_rate': 0.05137202552861097, 'iterations': 391, 'l2_leaf_reg': 0.00045808340446097217, 'border_count': 29, 'bagging_temperature': 0.23155818648367343, 'random_strength': 3.740381395476095, 'grow_policy': 'Lossguide', 'min_data_in_leaf': 519, 'max_leaves': 157}. Best is trial 280 with value: 79.877599423719.[0m
[32m[I 2024-10-13 13:50:14,148][0m Trial 447 finished with value: 93.26850483606357 and parameters: {'depth': 10, 'learning_rate': 0.08655639641682135, 'iterations': 543, 'l2_leaf_reg': 0.00014733567967698455, 'border_count': 18, 'bagging_temperature': 0.26491156430847157, 'random_strength': 3.390085861944652, 'grow_policy': 'Lossguide', 'min_data_in_leaf': 251, 'max_leaves': 147}. Best is trial 280 with value: 79.877599423719.[0m
[32m[I 2024-10-13 13:50:14,880][0m Trial 448 finished with value: 81.30892541984585 and parameters: {'depth': 13, 'learning_rate': 0.058649891639593305, 'iterations': 260, 'l2_leaf_reg': 0.0009372703960823341, 'border_count': 23, 'bagging_temperature': 0.17151556214873104, 'random_strength': 6.557510855689354, 'grow_policy': 'Lossguide', 'min_data_in_leaf': 547, 'max_leaves': 136}. Best is trial 280 with value: 79.877599423719.[0m
[32m[I 2024-10-13 13:50:15,579][0m Trial 449 finished with value: 92.86404910112093 and parameters: {'depth': 8, 'learning_rate': 0.06387871292890826, 'iterations': 208, 'l2_leaf_reg': 0.001431653170161902, 'border_count': 20, 'bagging_temperature': 0.12676778598484495, 'random_strength': 2.5051320306847287, 'grow_policy': 'Lossguide', 'min_data_in_leaf': 470, 'max_leaves': 135}. Best is trial 280 with value: 79.877599423719.[0m
[32m[I 2024-10-13 13:50:17,467][0m Trial 450 finished with value: 82.29918175550189 and parameters: {'depth': 10, 'learning_rate': 0.07449611792041162, 'iterations': 1808, 'l2_leaf_reg': 0.0010099765609699997, 'border_count': 23, 'bagging_temperature': 0.1672008132510751, 'random_strength': 6.656528887530428, 'grow_policy': 'Lossguide', 'min_data_in_leaf': 489, 'max_leaves': 137}. Best is trial 280 with value: 79.877599423719.[0m
