[32m[I 2024-10-13 13:45:23,348][0m Trial 201 finished with value: 91.05075035861478 and parameters: {'depth': 9, 'learning_rate': 0.059527212474474234, 'iterations': 663, 'l2_leaf_reg': 0.0006843798899765757, 'border_count': 26, 'bagging_temperature': 0.25910957946312363, 'random_strength': 2.5527211797644807, 'grow_policy': 'Lossguide', 'min_data_in_leaf': 500, 'max_leaves': 158}. Best is trial 196 with value: 80.36203499023102.[0m
[32m[I 2024-10-13 13:45:24,357][0m Trial 202 finished with value: 82.16416837139208 and parameters: {'depth': 9, 'learning_rate': 0.048602941293271924, 'iterations': 670, 'l2_leaf_reg': 0.00023767849829436466, 'border_count': 24, 'bagging_temperature': 0.2948099602330775, 'random_strength': 3.6143880910786312, 'grow_policy': 'Lossguide', 'min_data_in_leaf': 470, 'max_leaves': 154}. Best is trial 196 with value: 80.36203499023102.[0m
[32m[I 2024-10-13 13:45:25,433][0m Trial 203 finished with value: 93.84010837170241 and parameters: {'depth': 9, 'learning_rate': 0.04674188324437665, 'iterations': 730, 'l2_leaf_reg': 0.00029886578643472007, 'border_count': 21, 'bagging_temperature': 0.2394516380966002, 'random_strength': 3.03012616777836, 'grow_policy': 'Lossguide', 'min_data_in_leaf': 469, 'max_leaves': 155}. Best is trial 196 with value: 80.36203499023102.[0m
[32m[I 2024-10-13 13:45:26,467][0m Trial 204 finished with value: 95.76912768362374 and parameters: {'depth': 9, 'learning_rate': 0.07932423538669697, 'iterations': 614, 'l2_leaf_reg': 0.0002741591710945613, 'border_count': 22, 'bagging_temperature': 0.2842035205411006, 'random_strength': 3.3529715897925527, 'grow_policy': 'Lossguide', 'min_data_in_leaf': 446, 'max_leaves': 168}. Best is trial 196 with value: 80.36203499023102.[0m
[32m[I 2024-10-13 13:45:27,503][0m Trial 205 finished with value: 91.47267995654887 and parameters: {'depth': 10, 'learning_rate': 0.0628755081130417, 'iterations': 653, 'l2_leaf_reg': 0.0006299572791220227, 'border_count': 12, 'bagging_temperature': 0.32163953518485194, 'random_strength': 3.640654169841055, 'grow_policy': 'Lossguide', 'min_data_in_leaf': 504, 'max_leaves': 151}. Best is trial 196 with value: 80.36203499023102.[0m
[32m[I 2024-10-13 13:45:28,558][0m Trial 206 finished with value: 84.66603309755418 and parameters: {'depth': 8, 'learning_rate': 0.0267514697322117, 'iterations': 686, 'l2_leaf_reg': 0.0011945640566488516, 'border_count': 31, 'bagging_temperature': 0.29027529738010316, 'random_strength': 3.469457589514289, 'grow_policy': 'Lossguide', 'min_data_in_leaf': 558, 'max_leaves': 146}. Best is trial 196 with value: 80.36203499023102.[0m
[32m[I 2024-10-13 13:45:29,479][0m Trial 207 finished with value: 94.31877417544949 and parameters: {'depth': 9, 'learning_rate': 0.03695932510648167, 'iterations': 529, 'l2_leaf_reg': 0.0009154132223049662, 'border_count': 15, 'bagging_temperature': 0.2659146623478257, 'random_strength': 3.795582288945316, 'grow_policy': 'Lossguide', 'min_data_in_leaf': 476, 'max_leaves': 163}. Best is trial 196 with value: 80.36203499023102.[0m
[32m[I 2024-10-13 13:45:30,307][0m Trial 208 finished with value: 81.16361290244612 and parameters: {'depth': 10, 'learning_rate': 0.0478492826554076, 'iterations': 403, 'l2_leaf_reg': 0.00020486649040658, 'border_count': 24, 'bagging_temperature': 0.274062420904757, 'random_strength': 3.1809431492287037, 'grow_policy': 'Lossguide', 'min_data_in_leaf': 518, 'max_leaves': 157}. Best is trial 196 with value: 80.36203499023102.[0m
[32m[I 2024-10-13 13:45:31,232][0m Trial 209 finished with value: 85.76096684125815 and parameters: {'depth': 10, 'learning_rate': 0.042274324772749346, 'iterations': 424, 'l2_leaf_reg': 0.0001843453265984355, 'border_count': 25, 'bagging_temperature': 0.2835849496295166, 'random_strength': 3.2169083893540713, 'grow_policy': 'Lossguide', 'min_data_in_leaf': 542, 'max_leaves': 158}. Best is trial 196 with value: 80.36203499023102.[0m
[32m[I 2024-10-13 13:45:32,143][0m Trial 210 finished with value: 92.54897772673353 and parameters: {'depth': 10, 'learning_rate': 0.0497671514867813, 'iterations': 498, 'l2_leaf_reg': 0.003819016728506639, 'border_count': 19, 'bagging_temperature': 0.3105306079943359, 'random_strength': 3.0546948470166906, 'grow_policy': 'Lossguide', 'min_data_in_leaf': 516, 'max_leaves': 150}. Best is trial 196 with value: 80.36203499023102.[0m
[32m[I 2024-10-13 13:45:32,946][0m Trial 211 finished with value: 81.10444984622083 and parameters: {'depth': 10, 'learning_rate': 0.035067862431709534, 'iterations': 367, 'l2_leaf_reg': 0.0004585040241441344, 'border_count': 34, 'bagging_temperature': 0.25970872036295806, 'random_strength': 3.4988285839809143, 'grow_policy': 'Lossguide', 'min_data_in_leaf': 494, 'max_leaves': 145}. Best is trial 196 with value: 80.36203499023102.[0m
[32m[I 2024-10-13 13:45:33,723][0m Trial 212 finished with value: 82.07671006916975 and parameters: {'depth': 10, 'learning_rate': 0.03455747877476793, 'iterations': 281, 'l2_leaf_reg': 0.0004038500947061322, 'border_count': 34, 'bagging_temperature': 0.26011478142122546, 'random_strength': 3.4535211055860087, 'grow_policy': 'Lossguide', 'min_data_in_leaf': 499, 'max_leaves': 155}. Best is trial 196 with value: 80.36203499023102.[0m
[32m[I 2024-10-13 13:45:34,487][0m Trial 213 finished with value: 84.85437697143423 and parameters: {'depth': 10, 'learning_rate': 0.03418386188650142, 'iterations': 316, 'l2_leaf_reg': 0.000440826322424567, 'border_count': 32, 'bagging_temperature': 0.2675539940309454, 'random_strength': 3.4693361844270174, 'grow_policy': 'Lossguide', 'min_data_in_leaf': 524, 'max_leaves': 154}. Best is trial 196 with value: 80.36203499023102.[0m
[32m[I 2024-10-13 13:45:35,163][0m Trial 214 finished with value: 88.53104810411028 and parameters: {'depth': 9, 'learning_rate': 0.04590653636477507, 'iterations': 179, 'l2_leaf_reg': 0.0002017406420022713, 'border_count': 25, 'bagging_temperature': 0.2353335976195628, 'random_strength': 3.6065300921640397, 'grow_policy': 'Lossguide', 'min_data_in_leaf': 502, 'max_leaves': 144}. Best is trial 196 with value: 80.36203499023102.[0m
[32m[I 2024-10-13 13:45:36,067][0m Trial 215 finished with value: 88.53025558102664 and parameters: {'depth': 10, 'learning_rate': 0.024883643155697455, 'iterations': 391, 'l2_leaf_reg': 0.0003292107392280059, 'border_count': 28, 'bagging_temperature': 0.24790786579199356, 'random_strength': 3.243826693980044, 'grow_policy': 'Lossguide', 'min_data_in_leaf': 583, 'max_leaves': 156}. Best is trial 196 with value: 80.36203499023102.[0m
[32m[I 2024-10-13 13:45:36,866][0m Trial 216 finished with value: 81.38745405955447 and parameters: {'depth': 10, 'learning_rate': 0.03980893438825549, 'iterations': 353, 'l2_leaf_reg': 0.0008071481947991045, 'border_count': 34, 'bagging_temperature': 0.2998834227062851, 'random_strength': 2.686675696839565, 'grow_policy': 'Lossguide', 'min_data_in_leaf': 542, 'max_leaves': 149}. Best is trial 196 with value: 80.36203499023102.[0m
[32m[I 2024-10-13 13:45:37,676][0m Trial 217 finished with value: 92.62813524693303 and parameters: {'depth': 10, 'learning_rate': 0.03910476098561617, 'iterations': 357, 'l2_leaf_reg': 0.00010557137702795429, 'border_count': 21, 'bagging_temperature': 0.298778516148479, 'random_strength': 2.871205108117185, 'grow_policy': 'Lossguide', 'min_data_in_leaf': 557, 'max_leaves': 147}. Best is trial 196 with value: 80.36203499023102.[0m
[32m[I 2024-10-13 13:45:38,503][0m Trial 218 finished with value: 84.30723780201464 and parameters: {'depth': 10, 'learning_rate': 0.05751695682946583, 'iterations': 278, 'l2_leaf_reg': 0.000553326164906009, 'border_count': 32, 'bagging_temperature': 0.25610187704034576, 'random_strength': 3.0845363302483766, 'grow_policy': 'Lossguide', 'min_data_in_leaf': 529, 'max_leaves': 165}. Best is trial 196 with value: 80.36203499023102.[0m
[32m[I 2024-10-13 13:45:40,841][0m Trial 219 finished with value: 90.63729145918204 and parameters: {'depth': 10, 'learning_rate': 0.0710050746757088, 'iterations': 456, 'l2_leaf_reg': 0.0008091276719296166, 'border_count': 27, 'bagging_temperature': 0.2773692356309656, 'random_strength': 2.80785874157269, 'grow_policy': 'SymmetricTree', 'min_data_in_leaf': 573}. Best is trial 196 with value: 80.36203499023102.[0m
[32m[I 2024-10-13 13:45:41,613][0m Trial 220 finished with value: 82.28677982889619 and parameters: {'depth': 11, 'learning_rate': 0.05236184613207383, 'iterations': 281, 'l2_leaf_reg': 0.0011924236778556106, 'border_count': 35, 'bagging_temperature': 0.22968613766341134, 'random_strength': 3.3732967190450798, 'grow_policy': 'Lossguide', 'min_data_in_leaf': 547, 'max_leaves': 151}. Best is trial 196 with value: 80.36203499023102.[0m
[32m[I 2024-10-13 13:45:42,367][0m Trial 221 finished with value: 79.98246884890459 and parameters: {'depth': 11, 'learning_rate': 0.05098280365454039, 'iterations': 302, 'l2_leaf_reg': 0.0013140222865709323, 'border_count': 34, 'bagging_temperature': 0.21510839281693667, 'random_strength': 3.359283475795704, 'grow_policy': 'Lossguide', 'min_data_in_leaf': 543, 'max_leaves': 151}. Best is trial 221 with value: 79.98246884890459.[0m
[32m[I 2024-10-13 13:45:43,115][0m Trial 222 finished with value: 81.75945041241535 and parameters: {'depth': 12, 'learning_rate': 0.04906444523571934, 'iterations': 286, 'l2_leaf_reg': 0.001060146236902357, 'border_count': 35, 'bagging_temperature': 0.22650839149526014, 'random_strength': 3.349319338284247, 'grow_policy': 'Lossguide', 'min_data_in_leaf': 544, 'max_leaves': 160}. Best is trial 221 with value: 79.98246884890459.[0m
[32m[I 2024-10-13 13:45:43,827][0m Trial 223 finished with value: 81.57256297149955 and parameters: {'depth': 12, 'learning_rate': 0.08541376768397206, 'iterations': 267, 'l2_leaf_reg': 0.0013452166111754679, 'border_count': 34, 'bagging_temperature': 0.22677007198072527, 'random_strength': 3.4427665655350337, 'grow_policy': 'Lossguide', 'min_data_in_leaf': 553, 'max_leaves': 226}. Best is trial 221 with value: 79.98246884890459.[0m
[32m[I 2024-10-13 13:45:44,471][0m Trial 224 finished with value: 91.23210424424063 and parameters: {'depth': 12, 'learning_rate': 0.09012864514199752, 'iterations': 164, 'l2_leaf_reg': 0.0025196729316090986, 'border_count': 19, 'bagging_temperature': 0.21767331027362494, 'random_strength': 7.857207851034414, 'grow_policy': 'Lossguide', 'min_data_in_leaf': 545, 'max_leaves': 232}. Best is trial 221 with value: 79.98246884890459.[0m
[32m[I 2024-10-13 13:45:45,239][0m Trial 225 finished with value: 87.43842733590289 and parameters: {'depth': 12, 'learning_rate': 0.12522210399598946, 'iterations': 276, 'l2_leaf_reg': 0.001163751248352743, 'border_count': 25, 'bagging_temperature': 0.2704180389111986, 'random_strength': 3.095028407227357, 'grow_policy': 'Lossguide', 'min_data_in_leaf': 541, 'max_leaves': 185}. Best is trial 221 with value: 79.98246884890459.[0m
[32m[I 2024-10-13 13:45:45,945][0m Trial 226 finished with value: 82.37967238935069 and parameters: {'depth': 11, 'learning_rate': 0.05268732888225225, 'iterations': 234, 'l2_leaf_reg': 0.00046980437281505724, 'border_count': 35, 'bagging_temperature': 0.21331367259423756, 'random_strength': 2.629075391745092, 'grow_policy': 'Lossguide', 'min_data_in_leaf': 569, 'max_leaves': 211}. Best is trial 221 with value: 79.98246884890459.[0m
[32m[I 2024-10-13 13:45:46,663][0m Trial 227 finished with value: 81.74167617192938 and parameters: {'depth': 13, 'learning_rate': 0.05295922584356335, 'iterations': 275, 'l2_leaf_reg': 0.0004859343939617358, 'border_count': 35, 'bagging_temperature': 0.2129251267618127, 'random_strength': 3.501085883963614, 'grow_policy': 'Lossguide', 'min_data_in_leaf': 567, 'max_leaves': 214}. Best is trial 221 with value: 79.98246884890459.[0m
[32m[I 2024-10-13 13:45:47,375][0m Trial 228 finished with value: 87.0050954183305 and parameters: {'depth': 13, 'learning_rate': 0.1887490138942256, 'iterations': 199, 'l2_leaf_reg': 0.000329030396562889, 'border_count': 33, 'bagging_temperature': 0.21020229269697685, 'random_strength': 2.6858729953466196, 'grow_policy': 'Lossguide', 'min_data_in_leaf': 604, 'max_leaves': 215}. Best is trial 221 with value: 79.98246884890459.[0m
[32m[I 2024-10-13 13:45:48,124][0m Trial 229 finished with value: 82.29366805490177 and parameters: {'depth': 13, 'learning_rate': 0.05397405159059346, 'iterations': 293, 'l2_leaf_reg': 0.000512910797111278, 'border_count': 36, 'bagging_temperature': 0.22927388601630513, 'random_strength': 3.528048912721476, 'grow_policy': 'Lossguide', 'min_data_in_leaf': 570, 'max_leaves': 197}. Best is trial 221 with value: 79.98246884890459.[0m
[32m[I 2024-10-13 13:45:49,009][0m Trial 230 finished with value: 88.84419943837673 and parameters: {'depth': 12, 'learning_rate': 0.06464524917812119, 'iterations': 299, 'l2_leaf_reg': 0.00059104932343389, 'border_count': 28, 'bagging_temperature': 0.24737719054168694, 'random_strength': 3.5318169119411245, 'grow_policy': 'Lossguide', 'min_data_in_leaf': 566, 'max_leaves': 195}. Best is trial 221 with value: 79.98246884890459.[0m
[32m[I 2024-10-13 13:45:49,719][0m Trial 231 finished with value: 80.9500071503719 and parameters: {'depth': 13, 'learning_rate': 0.05296217494173947, 'iterations': 255, 'l2_leaf_reg': 0.0004437305037110888, 'border_count': 34, 'bagging_temperature': 0.21566007280217242, 'random_strength': 2.39742364769469, 'grow_policy': 'Lossguide', 'min_data_in_leaf': 580, 'max_leaves': 222}. Best is trial 221 with value: 79.98246884890459.[0m
[32m[I 2024-10-13 13:45:50,487][0m Trial 232 finished with value: 82.2139514786893 and parameters: {'depth': 13, 'learning_rate': 0.05246149606323707, 'iterations': 288, 'l2_leaf_reg': 0.0002245630155937905, 'border_count': 37, 'bagging_temperature': 0.23559326603103323, 'random_strength': 2.3745077031092903, 'grow_policy': 'Lossguide', 'min_data_in_leaf': 613, 'max_leaves': 220}. Best is trial 221 with value: 79.98246884890459.[0m
[32m[I 2024-10-13 13:45:51,279][0m Trial 233 finished with value: 83.7271062166743 and parameters: {'depth': 13, 'learning_rate': 0.0551429885698961, 'iterations': 284, 'l2_leaf_reg': 0.00015410731171177605, 'border_count': 30, 'bagging_temperature': 0.22416874030074305, 'random_strength': 2.4350100618729553, 'grow_policy': 'Lossguide', 'min_data_in_leaf': 627, 'max_leaves': 220}. Best is trial 221 with value: 79.98246884890459.[0m
[32m[I 2024-10-13 13:45:52,107][0m Trial 234 finished with value: 84.43485099377455 and parameters: {'depth': 13, 'learning_rate': 0.08300079145811781, 'iterations': 329, 'l2_leaf_reg': 0.00025858525898062, 'border_count': 36, 'bagging_temperature': 0.25824006094210905, 'random_strength': 3.442444806523918, 'grow_policy': 'Lossguide', 'min_data_in_leaf': 653, 'max_leaves': 224}. Best is trial 221 with value: 79.98246884890459.[0m
[32m[I 2024-10-13 13:45:52,807][0m Trial 235 finished with value: 88.06103998276963 and parameters: {'depth': 13, 'learning_rate': 0.05066676143689423, 'iterations': 121, 'l2_leaf_reg': 0.00040470546100535373, 'border_count': 29, 'bagging_temperature': 0.23554687185741344, 'random_strength': 2.3573173483848073, 'grow_policy': 'Lossguide', 'min_data_in_leaf': 604, 'max_leaves': 228}. Best is trial 221 with value: 79.98246884890459.[0m
[32m[I 2024-10-13 13:45:53,536][0m Trial 236 finished with value: 83.09199477945627 and parameters: {'depth': 13, 'learning_rate': 0.07018322314202981, 'iterations': 264, 'l2_leaf_reg': 0.0008571314137670946, 'border_count': 36, 'bagging_temperature': 0.2011282833452989, 'random_strength': 3.634013014507383, 'grow_policy': 'Lossguide', 'min_data_in_leaf': 574, 'max_leaves': 201}. Best is trial 221 with value: 79.98246884890459.[0m
[32m[I 2024-10-13 13:45:54,325][0m Trial 237 finished with value: 84.08813637009618 and parameters: {'depth': 13, 'learning_rate': 0.06388630125251575, 'iterations': 332, 'l2_leaf_reg': 0.0016321726214987048, 'border_count': 44, 'bagging_temperature': 0.30424794557632123, 'random_strength': 3.0956674007396483, 'grow_policy': 'Lossguide', 'min_data_in_leaf': 554, 'max_leaves': 241}. Best is trial 221 with value: 79.98246884890459.[0m
[32m[I 2024-10-13 13:45:55,009][0m Trial 238 finished with value: 98.78806849520937 and parameters: {'depth': 13, 'learning_rate': 0.047018203426753793, 'iterations': 191, 'l2_leaf_reg': 0.0006227955523624575, 'border_count': 203, 'bagging_temperature': 0.22881129389683114, 'random_strength': 2.944830226080934, 'grow_policy': 'Lossguide', 'min_data_in_leaf': 589, 'max_leaves': 217}. Best is trial 221 with value: 79.98246884890459.[0m
[32m[I 2024-10-13 13:45:55,820][0m Trial 239 finished with value: 92.1476648773367 and parameters: {'depth': 14, 'learning_rate': 0.057168033751553285, 'iterations': 327, 'l2_leaf_reg': 0.001150981719141547, 'border_count': 22, 'bagging_temperature': 0.2738790399944476, 'random_strength': 3.354977591065553, 'grow_policy': 'Lossguide', 'min_data_in_leaf': 554, 'max_leaves': 221}. Best is trial 221 with value: 79.98246884890459.[0m
[32m[I 2024-10-13 13:45:56,561][0m Trial 240 finished with value: 84.89686107173058 and parameters: {'depth': 14, 'learning_rate': 0.04775816820721133, 'iterations': 259, 'l2_leaf_reg': 0.00020414886756588575, 'border_count': 30, 'bagging_temperature': 0.24987064965852765, 'random_strength': 2.1708249573424476, 'grow_policy': 'Depthwise', 'min_data_in_leaf': 615}. Best is trial 221 with value: 79.98246884890459.[0m
[32m[I 2024-10-13 13:45:57,347][0m Trial 241 finished with value: 82.54917861268352 and parameters: {'depth': 13, 'learning_rate': 0.04104053124437299, 'iterations': 359, 'l2_leaf_reg': 0.000366955966811287, 'border_count': 39, 'bagging_temperature': 0.20056021593643636, 'random_strength': 3.6753607882551718, 'grow_policy': 'Lossguide', 'min_data_in_leaf': 536, 'max_leaves': 231}. Best is trial 221 with value: 79.98246884890459.[0m
[32m[I 2024-10-13 13:45:58,033][0m Trial 242 finished with value: 84.95324673679515 and parameters: {'depth': 13, 'learning_rate': 0.035430522341051325, 'iterations': 226, 'l2_leaf_reg': 0.0006566517471800217, 'border_count': 36, 'bagging_temperature': 0.22246449530321905, 'random_strength': 3.253501134155926, 'grow_policy': 'Lossguide', 'min_data_in_leaf': 583, 'max_leaves': 206}. Best is trial 221 with value: 79.98246884890459.[0m
[32m[I 2024-10-13 13:45:58,835][0m Trial 243 finished with value: 83.57188815006263 and parameters: {'depth': 12, 'learning_rate': 0.05527625332668979, 'iterations': 302, 'l2_leaf_reg': 0.0016901658966923866, 'border_count': 42, 'bagging_temperature': 0.292528534013223, 'random_strength': 3.5162257770504617, 'grow_policy': 'Lossguide', 'min_data_in_leaf': 556, 'max_leaves': 160}. Best is trial 221 with value: 79.98246884890459.[0m
[32m[I 2024-10-13 13:45:59,768][0m Trial 244 finished with value: 85.16522194543374 and parameters: {'depth': 12, 'learning_rate': 0.04494566582720288, 'iterations': 576, 'l2_leaf_reg': 0.0009937433517337242, 'border_count': 33, 'bagging_temperature': 0.2599696072586351, 'random_strength': 3.792868920095259, 'grow_policy': 'Lossguide', 'min_data_in_leaf': 518, 'max_leaves': 151}. Best is trial 221 with value: 79.98246884890459.[0m
[32m[I 2024-10-13 13:46:00,616][0m Trial 245 finished with value: 87.45160414692339 and parameters: {'depth': 11, 'learning_rate': 0.03866198999446782, 'iterations': 371, 'l2_leaf_reg': 0.0004957360270183739, 'border_count': 27, 'bagging_temperature': 0.18728772850584482, 'random_strength': 3.3480828103111273, 'grow_policy': 'Lossguide', 'min_data_in_leaf': 540, 'max_leaves': 225}. Best is trial 221 with value: 79.98246884890459.[0m
[32m[I 2024-10-13 13:46:01,335][0m Trial 246 finished with value: 81.00034585845974 and parameters: {'depth': 13, 'learning_rate': 0.0617039603662789, 'iterations': 249, 'l2_leaf_reg': 0.00014613753499517337, 'border_count': 37, 'bagging_temperature': 0.2365024123445969, 'random_strength': 3.1047248255564526, 'grow_policy': 'Lossguide', 'min_data_in_leaf': 569, 'max_leaves': 157}. Best is trial 221 with value: 79.98246884890459.[0m
[32m[I 2024-10-13 13:46:02,011][0m Trial 247 finished with value: 84.05456761272163 and parameters: {'depth': 13, 'learning_rate': 0.0810251968574487, 'iterations': 160, 'l2_leaf_reg': 0.0002158983677740778, 'border_count': 33, 'bagging_temperature': 0.23326835233032062, 'random_strength': 2.7471641656194135, 'grow_policy': 'Lossguide', 'min_data_in_leaf': 605, 'max_leaves': 176}. Best is trial 221 with value: 79.98246884890459.[0m
[32m[I 2024-10-13 13:46:02,793][0m Trial 248 finished with value: 81.48282220043497 and parameters: {'depth': 13, 'learning_rate': 0.0692682108275275, 'iterations': 271, 'l2_leaf_reg': 0.00030483897936703537, 'border_count': 23, 'bagging_temperature': 0.21254424169584332, 'random_strength': 2.9284993293487833, 'grow_policy': 'Lossguide', 'min_data_in_leaf': 583, 'max_leaves': 156}. Best is trial 221 with value: 79.98246884890459.[0m
[32m[I 2024-10-13 13:46:03,473][0m Trial 249 finished with value: 92.56073047382273 and parameters: {'depth': 13, 'learning_rate': 0.0670968566872564, 'iterations': 201, 'l2_leaf_reg': 0.00025792517512543504, 'border_count': 16, 'bagging_temperature': 0.20253003686325982, 'random_strength': 3.0192119225746175, 'grow_policy': 'Lossguide', 'min_data_in_leaf': 594, 'max_leaves': 156}. Best is trial 221 with value: 79.98246884890459.[0m
[32m[I 2024-10-13 13:46:04,173][0m Trial 250 finished with value: 91.72827634818684 and parameters: {'depth': 12, 'learning_rate': 0.11379213493512533, 'iterations': 240, 'l2_leaf_reg': 0.00010536860099485828, 'border_count': 22, 'bagging_temperature': 0.2734442001545289, 'random_strength': 2.8499230991639943, 'grow_policy': 'Lossguide', 'min_data_in_leaf': 633, 'max_leaves': 255}. Best is trial 221 with value: 79.98246884890459.[0m
