[32m[I 2024-10-13 13:51:19,360][0m Trial 501 finished with value: 80.80826467886382 and parameters: {'depth': 6, 'learning_rate': 0.11021111367315121, 'iterations': 142, 'l2_leaf_reg': 4.4471135498956525e-08, 'border_count': 35, 'bagging_temperature': 0.13622159516659962, 'random_strength': 9.589738251911937, 'grow_policy': 'Lossguide', 'min_data_in_leaf': 173, 'max_leaves': 146}. Best is trial 280 with value: 79.877599423719.[0m
[32m[I 2024-10-13 13:51:20,004][0m Trial 502 finished with value: 85.1829604081056 and parameters: {'depth': 6, 'learning_rate': 0.08377016667612978, 'iterations': 102, 'l2_leaf_reg': 7.724109546007071e-08, 'border_count': 48, 'bagging_temperature': 0.1406094040622662, 'random_strength': 9.617041782546725, 'grow_policy': 'Lossguide', 'min_data_in_leaf': 99, 'max_leaves': 142}. Best is trial 280 with value: 79.877599423719.[0m
[32m[I 2024-10-13 13:51:20,663][0m Trial 503 finished with value: 81.23081171335271 and parameters: {'depth': 10, 'learning_rate': 0.13489879658170245, 'iterations': 167, 'l2_leaf_reg': 3.2150446932040754e-08, 'border_count': 37, 'bagging_temperature': 0.11588315534265586, 'random_strength': 8.467011790614482, 'grow_policy': 'Lossguide', 'min_data_in_leaf': 162, 'max_leaves': 146}. Best is trial 280 with value: 79.877599423719.[0m
[32m[I 2024-10-13 13:51:21,299][0m Trial 504 finished with value: 84.15366999213144 and parameters: {'depth': 10, 'learning_rate': 0.1634980283571191, 'iterations': 136, 'l2_leaf_reg': 7.109097440509583e-08, 'border_count': 43, 'bagging_temperature': 0.14471249786667964, 'random_strength': 8.71201033410243, 'grow_policy': 'Lossguide', 'min_data_in_leaf': 181, 'max_leaves': 137}. Best is trial 280 with value: 79.877599423719.[0m
[32m[I 2024-10-13 13:51:21,939][0m Trial 505 finished with value: 88.64159423725881 and parameters: {'depth': 8, 'learning_rate': 0.1306121378237128, 'iterations': 141, 'l2_leaf_reg': 3.2366731274280424e-08, 'border_count': 28, 'bagging_temperature': 0.09811264616799334, 'random_strength': 7.660694304965541, 'grow_policy': 'Lossguide', 'min_data_in_leaf': 161, 'max_leaves': 145}. Best is trial 280 with value: 79.877599423719.[0m
[32m[I 2024-10-13 13:51:23,243][0m Trial 506 finished with value: 110.11434573292948 and parameters: {'depth': 10, 'learning_rate': 0.13199264530046587, 'iterations': 183, 'l2_leaf_reg': 4.6161185446825426e-08, 'border_count': 151, 'bagging_temperature': 0.1417883157349307, 'random_strength': 9.188982046346256, 'grow_policy': 'SymmetricTree', 'min_data_in_leaf': 173}. Best is trial 280 with value: 79.877599423719.[0m
[32m[I 2024-10-13 13:51:23,919][0m Trial 507 finished with value: 82.11805708212562 and parameters: {'depth': 10, 'learning_rate': 0.1141981091241169, 'iterations': 175, 'l2_leaf_reg': 2.1207127309820753e-08, 'border_count': 38, 'bagging_temperature': 0.13323411610699343, 'random_strength': 8.868785140284965, 'grow_policy': 'Lossguide', 'min_data_in_leaf': 202, 'max_leaves': 140}. Best is trial 280 with value: 79.877599423719.[0m
[32m[I 2024-10-13 13:51:24,558][0m Trial 508 finished with value: 85.03957415497521 and parameters: {'depth': 10, 'learning_rate': 0.19638864075528709, 'iterations': 135, 'l2_leaf_reg': 1.4121916822695853e-08, 'border_count': 32, 'bagging_temperature': 0.12719624737838947, 'random_strength': 7.832039597433546, 'grow_policy': 'Depthwise', 'min_data_in_leaf': 222}. Best is trial 280 with value: 79.877599423719.[0m
[32m[I 2024-10-13 13:51:25,168][0m Trial 509 finished with value: 80.7048367141011 and parameters: {'depth': 9, 'learning_rate': 0.15900693054342355, 'iterations': 109, 'l2_leaf_reg': 4.1812373710129666e-08, 'border_count': 24, 'bagging_temperature': 0.11430908814472673, 'random_strength': 8.994689063325, 'grow_policy': 'Lossguide', 'min_data_in_leaf': 205, 'max_leaves': 133}. Best is trial 280 with value: 79.877599423719.[0m
[32m[I 2024-10-13 13:51:25,935][0m Trial 510 finished with value: 92.07548064053879 and parameters: {'depth': 9, 'learning_rate': 0.11427237690239658, 'iterations': 226, 'l2_leaf_reg': 4.5920233188884034e-08, 'border_count': 14, 'bagging_temperature': 0.11564643451830901, 'random_strength': 9.728679382217658, 'grow_policy': 'Lossguide', 'min_data_in_leaf': 130, 'max_leaves': 131}. Best is trial 280 with value: 79.877599423719.[0m
[32m[I 2024-10-13 13:51:26,599][0m Trial 511 finished with value: 89.4991162991238 and parameters: {'depth': 9, 'learning_rate': 0.231918434207621, 'iterations': 106, 'l2_leaf_reg': 2.43233554729637e-08, 'border_count': 21, 'bagging_temperature': 0.11261034939919284, 'random_strength': 9.310466302879693, 'grow_policy': 'Lossguide', 'min_data_in_leaf': 156, 'max_leaves': 129}. Best is trial 280 with value: 79.877599423719.[0m
[32m[I 2024-10-13 13:51:27,283][0m Trial 512 finished with value: 90.90638723649356 and parameters: {'depth': 9, 'learning_rate': 0.1585951825108015, 'iterations': 159, 'l2_leaf_reg': 4.167631579322989e-08, 'border_count': 17, 'bagging_temperature': 0.1060263962535586, 'random_strength': 9.706231926741129, 'grow_policy': 'Lossguide', 'min_data_in_leaf': 213, 'max_leaves': 134}. Best is trial 280 with value: 79.877599423719.[0m
[32m[I 2024-10-13 13:51:27,931][0m Trial 513 finished with value: 79.92311934248754 and parameters: {'depth': 10, 'learning_rate': 0.17799032239632306, 'iterations': 112, 'l2_leaf_reg': 5.502411720532239e-08, 'border_count': 24, 'bagging_temperature': 0.08951255992525226, 'random_strength': 8.90065854256183, 'grow_policy': 'Lossguide', 'min_data_in_leaf': 202, 'max_leaves': 143}. Best is trial 280 with value: 79.877599423719.[0m
[32m[I 2024-10-13 13:51:28,551][0m Trial 514 finished with value: 92.51486594121309 and parameters: {'depth': 6, 'learning_rate': 0.15450717354208632, 'iterations': 115, 'l2_leaf_reg': 7.105848533222791e-08, 'border_count': 13, 'bagging_temperature': 0.10169831371920465, 'random_strength': 9.018871193284436, 'grow_policy': 'Lossguide', 'min_data_in_leaf': 189, 'max_leaves': 138}. Best is trial 280 with value: 79.877599423719.[0m
[32m[I 2024-10-13 13:51:29,192][0m Trial 515 finished with value: 92.61731858049785 and parameters: {'depth': 9, 'learning_rate': 0.23453945001982884, 'iterations': 116, 'l2_leaf_reg': 3.177498984908448e-08, 'border_count': 22, 'bagging_temperature': 0.07585767553911939, 'random_strength': 8.721171628967067, 'grow_policy': 'Lossguide', 'min_data_in_leaf': 238, 'max_leaves': 133}. Best is trial 280 with value: 79.877599423719.[0m
[32m[I 2024-10-13 13:51:29,889][0m Trial 516 finished with value: 95.6500907502073 and parameters: {'depth': 8, 'learning_rate': 0.18773353774803336, 'iterations': 174, 'l2_leaf_reg': 5.7797978591182065e-08, 'border_count': 19, 'bagging_temperature': 0.08264838829431213, 'random_strength': 8.534529121097522, 'grow_policy': 'Lossguide', 'min_data_in_leaf': 241, 'max_leaves': 139}. Best is trial 280 with value: 79.877599423719.[0m
[32m[I 2024-10-13 13:51:30,510][0m Trial 517 finished with value: 81.21826132396596 and parameters: {'depth': 9, 'learning_rate': 0.1495114035949097, 'iterations': 124, 'l2_leaf_reg': 1.145796168171312e-07, 'border_count': 24, 'bagging_temperature': 0.11039598884638027, 'random_strength': 9.311670426276265, 'grow_policy': 'Lossguide', 'min_data_in_leaf': 209, 'max_leaves': 144}. Best is trial 280 with value: 79.877599423719.[0m
[32m[I 2024-10-13 13:51:31,163][0m Trial 518 finished with value: 87.07437997040836 and parameters: {'depth': 9, 'learning_rate': 0.15713716876042558, 'iterations': 122, 'l2_leaf_reg': 1.0766556633038107e-08, 'border_count': 25, 'bagging_temperature': 0.08888381390774358, 'random_strength': 8.917388379470673, 'grow_policy': 'Lossguide', 'min_data_in_leaf': 225, 'max_leaves': 142}. Best is trial 280 with value: 79.877599423719.[0m
[32m[I 2024-10-13 13:51:31,767][0m Trial 519 finished with value: 90.99579056627967 and parameters: {'depth': 9, 'learning_rate': 0.13893797140291841, 'iterations': 102, 'l2_leaf_reg': 1.362106936684081e-07, 'border_count': 10, 'bagging_temperature': 0.11349035082976631, 'random_strength': 9.297475337392703, 'grow_policy': 'Lossguide', 'min_data_in_leaf': 267, 'max_leaves': 123}. Best is trial 280 with value: 79.877599423719.[0m
[32m[I 2024-10-13 13:51:32,483][0m Trial 520 finished with value: 93.09191932343617 and parameters: {'depth': 9, 'learning_rate': 0.2137755548119227, 'iterations': 169, 'l2_leaf_reg': 8.723329044360394e-08, 'border_count': 26, 'bagging_temperature': 0.06834749020823615, 'random_strength': 9.524108712802487, 'grow_policy': 'Lossguide', 'min_data_in_leaf': 189, 'max_leaves': 135}. Best is trial 280 with value: 79.877599423719.[0m
[32m[I 2024-10-13 13:51:33,136][0m Trial 521 finished with value: 93.32730391021305 and parameters: {'depth': 9, 'learning_rate': 0.1768812526788709, 'iterations': 168, 'l2_leaf_reg': 2.935751433941571e-08, 'border_count': 18, 'bagging_temperature': 0.042455407554513436, 'random_strength': 9.321298902748241, 'grow_policy': 'Depthwise', 'min_data_in_leaf': 185}. Best is trial 280 with value: 79.877599423719.[0m
[32m[I 2024-10-13 13:51:33,799][0m Trial 522 finished with value: 88.88154185382994 and parameters: {'depth': 9, 'learning_rate': 0.1444748184348091, 'iterations': 171, 'l2_leaf_reg': 6.604212066673927e-08, 'border_count': 28, 'bagging_temperature': 0.10940861047555239, 'random_strength': 9.033275315986232, 'grow_policy': 'Lossguide', 'min_data_in_leaf': 223, 'max_leaves': 143}. Best is trial 280 with value: 79.877599423719.[0m
[32m[I 2024-10-13 13:51:34,466][0m Trial 523 finished with value: 93.62203952970273 and parameters: {'depth': 10, 'learning_rate': 0.126771282654635, 'iterations': 190, 'l2_leaf_reg': 4.770144118709379e-08, 'border_count': 22, 'bagging_temperature': 0.09553810433733702, 'random_strength': 9.440480645343127, 'grow_policy': 'Lossguide', 'min_data_in_leaf': 215, 'max_leaves': 140}. Best is trial 280 with value: 79.877599423719.[0m
[32m[I 2024-10-13 13:51:35,159][0m Trial 524 finished with value: 92.22678251026844 and parameters: {'depth': 9, 'learning_rate': 0.173283474087137, 'iterations': 194, 'l2_leaf_reg': 1.886189249761038e-08, 'border_count': 28, 'bagging_temperature': 0.058579915041293555, 'random_strength': 9.558630516825414, 'grow_policy': 'Lossguide', 'min_data_in_leaf': 174, 'max_leaves': 144}. Best is trial 280 with value: 79.877599423719.[0m
[32m[I 2024-10-13 13:51:35,843][0m Trial 525 finished with value: 90.69229238395313 and parameters: {'depth': 10, 'learning_rate': 0.12937006257438055, 'iterations': 189, 'l2_leaf_reg': 1.037200955962701e-07, 'border_count': 16, 'bagging_temperature': 0.08234851323811743, 'random_strength': 9.235466047805312, 'grow_policy': 'Lossguide', 'min_data_in_leaf': 243, 'max_leaves': 127}. Best is trial 280 with value: 79.877599423719.[0m
[32m[I 2024-10-13 13:51:38,428][0m Trial 526 finished with value: 113.45616158735898 and parameters: {'depth': 10, 'learning_rate': 0.1498833814217888, 'iterations': 2850, 'l2_leaf_reg': 2.5978311345953464e-08, 'border_count': 22, 'bagging_temperature': 0.11999476927405828, 'random_strength': 9.007368283247823, 'grow_policy': 'Lossguide', 'min_data_in_leaf': 205, 'max_leaves': 137}. Best is trial 280 with value: 79.877599423719.[0m
[32m[I 2024-10-13 13:51:39,070][0m Trial 527 finished with value: 87.02204043080664 and parameters: {'depth': 10, 'learning_rate': 0.2011801168080891, 'iterations': 124, 'l2_leaf_reg': 4.025904788624458e-08, 'border_count': 29, 'bagging_temperature': 0.12654394663164997, 'random_strength': 9.823682234409576, 'grow_policy': 'Lossguide', 'min_data_in_leaf': 192, 'max_leaves': 146}. Best is trial 280 with value: 79.877599423719.[0m
[32m[I 2024-10-13 13:51:39,683][0m Trial 528 finished with value: 86.93962277456798 and parameters: {'depth': 9, 'learning_rate': 0.11437020399031986, 'iterations': 107, 'l2_leaf_reg': 4.264362396242565e-08, 'border_count': 26, 'bagging_temperature': 0.06040697672881357, 'random_strength': 8.579424985494542, 'grow_policy': 'Lossguide', 'min_data_in_leaf': 211, 'max_leaves': 133}. Best is trial 280 with value: 79.877599423719.[0m
[32m[I 2024-10-13 13:51:40,371][0m Trial 529 finished with value: 89.14389185799585 and parameters: {'depth': 10, 'learning_rate': 0.16255280415225445, 'iterations': 220, 'l2_leaf_reg': 5.64486804031985e-08, 'border_count': 31, 'bagging_temperature': 0.10193784617320431, 'random_strength': 9.48648340261005, 'grow_policy': 'Lossguide', 'min_data_in_leaf': 199, 'max_leaves': 143}. Best is trial 280 with value: 79.877599423719.[0m
[32m[I 2024-10-13 13:51:41,112][0m Trial 530 finished with value: 114.04489658013881 and parameters: {'depth': 8, 'learning_rate': 0.23315972780062255, 'iterations': 100, 'l2_leaf_reg': 9.730559844498756e-08, 'border_count': 19, 'bagging_temperature': 0.09309364400237613, 'random_strength': 9.061413434302288, 'grow_policy': 'SymmetricTree', 'min_data_in_leaf': 154}. Best is trial 280 with value: 79.877599423719.[0m
[32m[I 2024-10-13 13:51:41,711][0m Trial 531 finished with value: 102.06549131001776 and parameters: {'depth': 10, 'learning_rate': 0.1475416525607087, 'iterations': 100, 'l2_leaf_reg': 3.60513879325181e-08, 'border_count': 195, 'bagging_temperature': 0.02062141639711887, 'random_strength': 9.011812268059488, 'grow_policy': 'Lossguide', 'min_data_in_leaf': 180, 'max_leaves': 147}. Best is trial 280 with value: 79.877599423719.[0m
[32m[I 2024-10-13 13:51:42,395][0m Trial 532 finished with value: 92.61459135458735 and parameters: {'depth': 9, 'learning_rate': 0.10938549213804574, 'iterations': 211, 'l2_leaf_reg': 1.687878175136362e-08, 'border_count': 12, 'bagging_temperature': 0.12808360189672058, 'random_strength': 9.984004938737327, 'grow_policy': 'Lossguide', 'min_data_in_leaf': 166, 'max_leaves': 115}. Best is trial 280 with value: 79.877599423719.[0m
[32m[I 2024-10-13 13:51:43,103][0m Trial 533 finished with value: 80.61143382709531 and parameters: {'depth': 10, 'learning_rate': 0.13626163857963644, 'iterations': 216, 'l2_leaf_reg': 1.0485115732638532e-08, 'border_count': 24, 'bagging_temperature': 0.16045065197846642, 'random_strength': 9.446766259113565, 'grow_policy': 'Lossguide', 'min_data_in_leaf': 486, 'max_leaves': 140}. Best is trial 280 with value: 79.877599423719.[0m
[32m[I 2024-10-13 13:51:43,871][0m Trial 534 finished with value: 81.21831258967431 and parameters: {'depth': 7, 'learning_rate': 0.2779216954784081, 'iterations': 166, 'l2_leaf_reg': 2.0787394335993277e-08, 'border_count': 24, 'bagging_temperature': 0.13354010526825716, 'random_strength': 9.44152867846665, 'grow_policy': 'Lossguide', 'min_data_in_leaf': 468, 'max_leaves': 142}. Best is trial 280 with value: 79.877599423719.[0m
[32m[I 2024-10-13 13:51:44,559][0m Trial 535 finished with value: 123.2191782144992 and parameters: {'depth': 7, 'learning_rate': 0.18268338792408473, 'iterations': 145, 'l2_leaf_reg': 1.1102669562757264e-08, 'border_count': 5, 'bagging_temperature': 0.13465801465643942, 'random_strength': 9.58014410472577, 'grow_policy': 'Lossguide', 'min_data_in_leaf': 456, 'max_leaves': 138}. Best is trial 280 with value: 79.877599423719.[0m
[32m[I 2024-10-13 13:51:45,254][0m Trial 536 finished with value: 88.99164334577462 and parameters: {'depth': 5, 'learning_rate': 0.2874039774862058, 'iterations': 177, 'l2_leaf_reg': 2.025704062982441e-08, 'border_count': 14, 'bagging_temperature': 0.15225611774155293, 'random_strength': 9.213963555129022, 'grow_policy': 'Lossguide', 'min_data_in_leaf': 471, 'max_leaves': 132}. Best is trial 280 with value: 79.877599423719.[0m
[32m[I 2024-10-13 13:51:45,881][0m Trial 537 finished with value: 93.38075147457313 and parameters: {'depth': 7, 'learning_rate': 0.20724490613019697, 'iterations': 103, 'l2_leaf_reg': 2.8241776642622907e-08, 'border_count': 20, 'bagging_temperature': 0.11585060418956605, 'random_strength': 9.46057032128302, 'grow_policy': 'Lossguide', 'min_data_in_leaf': 446, 'max_leaves': 81}. Best is trial 280 with value: 79.877599423719.[0m
[32m[I 2024-10-13 13:51:47,945][0m Trial 538 finished with value: 128.51014843839184 and parameters: {'depth': 8, 'learning_rate': 0.2617817886506995, 'iterations': 2125, 'l2_leaf_reg': 2.6576424248876404e-08, 'border_count': 69, 'bagging_temperature': 0.1577626541449213, 'random_strength': 9.827845206484888, 'grow_policy': 'Lossguide', 'min_data_in_leaf': 490, 'max_leaves': 137}. Best is trial 280 with value: 79.877599423719.[0m
[32m[I 2024-10-13 13:51:48,651][0m Trial 539 finished with value: 79.49128055039469 and parameters: {'depth': 8, 'learning_rate': 0.2536178237457048, 'iterations': 200, 'l2_leaf_reg': 1.182489198428708e-08, 'border_count': 23, 'bagging_temperature': 0.13504156705467546, 'random_strength': 9.228085040678785, 'grow_policy': 'Lossguide', 'min_data_in_leaf': 478, 'max_leaves': 141}. Best is trial 539 with value: 79.49128055039469.[0m
[32m[I 2024-10-13 13:51:49,293][0m Trial 540 finished with value: 88.57046253409295 and parameters: {'depth': 7, 'learning_rate': 0.280540323575832, 'iterations': 170, 'l2_leaf_reg': 1.155812386606408e-08, 'border_count': 11, 'bagging_temperature': 0.12773926493760987, 'random_strength': 9.17381382144814, 'grow_policy': 'Lossguide', 'min_data_in_leaf': 466, 'max_leaves': 141}. Best is trial 539 with value: 79.49128055039469.[0m
[32m[I 2024-10-13 13:51:49,963][0m Trial 541 finished with value: 91.83631207029299 and parameters: {'depth': 6, 'learning_rate': 0.2484720908641619, 'iterations': 164, 'l2_leaf_reg': 1.0097279267325973e-08, 'border_count': 18, 'bagging_temperature': 0.1089943889999894, 'random_strength': 8.857668341362466, 'grow_policy': 'Lossguide', 'min_data_in_leaf': 481, 'max_leaves': 135}. Best is trial 539 with value: 79.49128055039469.[0m
[32m[I 2024-10-13 13:51:50,578][0m Trial 542 finished with value: 80.6142496148692 and parameters: {'depth': 7, 'learning_rate': 0.2855769986085386, 'iterations': 102, 'l2_leaf_reg': 1.3187035399240301e-08, 'border_count': 24, 'bagging_temperature': 0.13951591385018797, 'random_strength': 9.391599049704224, 'grow_policy': 'Lossguide', 'min_data_in_leaf': 468, 'max_leaves': 141}. Best is trial 539 with value: 79.49128055039469.[0m
[32m[I 2024-10-13 13:51:51,231][0m Trial 543 finished with value: 91.21798850261254 and parameters: {'depth': 7, 'learning_rate': 0.2879388539656232, 'iterations': 154, 'l2_leaf_reg': 1.124990953734682e-08, 'border_count': 16, 'bagging_temperature': 0.14068682711187055, 'random_strength': 9.462832010060197, 'grow_policy': 'Lossguide', 'min_data_in_leaf': 448, 'max_leaves': 130}. Best is trial 539 with value: 79.49128055039469.[0m
[32m[I 2024-10-13 13:51:51,931][0m Trial 544 finished with value: 79.23314367466817 and parameters: {'depth': 6, 'learning_rate': 0.2291778217735691, 'iterations': 203, 'l2_leaf_reg': 2.447790257585473e-08, 'border_count': 23, 'bagging_temperature': 0.125682504774749, 'random_strength': 9.691056656751948, 'grow_policy': 'Lossguide', 'min_data_in_leaf': 457, 'max_leaves': 140}. Best is trial 544 with value: 79.23314367466817.[0m
[32m[I 2024-10-13 13:51:52,540][0m Trial 545 finished with value: 118.34269633655775 and parameters: {'depth': 6, 'learning_rate': 0.23534917178898665, 'iterations': 103, 'l2_leaf_reg': 1.890464665548103e-08, 'border_count': 7, 'bagging_temperature': 0.08222097502008403, 'random_strength': 9.706302248413165, 'grow_policy': 'Lossguide', 'min_data_in_leaf': 434, 'max_leaves': 134}. Best is trial 544 with value: 79.23314367466817.[0m
[32m[I 2024-10-13 13:51:53,141][0m Trial 546 finished with value: 93.34525994485448 and parameters: {'depth': 8, 'learning_rate': 0.2202511166140947, 'iterations': 100, 'l2_leaf_reg': 1.5333474070033446e-08, 'border_count': 22, 'bagging_temperature': 0.1198870144061371, 'random_strength': 9.387632358292581, 'grow_policy': 'Lossguide', 'min_data_in_leaf': 455, 'max_leaves': 139}. Best is trial 544 with value: 79.23314367466817.[0m
[32m[I 2024-10-13 13:51:53,834][0m Trial 547 finished with value: 96.43546448209791 and parameters: {'depth': 7, 'learning_rate': 0.2058700825405317, 'iterations': 203, 'l2_leaf_reg': 1.6795030969818018e-08, 'border_count': 22, 'bagging_temperature': 0.10643245986529518, 'random_strength': 9.131652921498484, 'grow_policy': 'Lossguide', 'min_data_in_leaf': 474, 'max_leaves': 129}. Best is trial 544 with value: 79.23314367466817.[0m
[32m[I 2024-10-13 13:51:54,543][0m Trial 548 finished with value: 89.49988616010728 and parameters: {'depth': 6, 'learning_rate': 0.27075619489840524, 'iterations': 210, 'l2_leaf_reg': 2.0833526452189188e-08, 'border_count': 14, 'bagging_temperature': 0.12711611213731172, 'random_strength': 9.674617158691644, 'grow_policy': 'Lossguide', 'min_data_in_leaf': 442, 'max_leaves': 140}. Best is trial 544 with value: 79.23314367466817.[0m
[32m[I 2024-10-13 13:51:55,202][0m Trial 549 finished with value: 99.42150473815047 and parameters: {'depth': 8, 'learning_rate': 0.2448340959830025, 'iterations': 152, 'l2_leaf_reg': 1.4475686126224308e-08, 'border_count': 255, 'bagging_temperature': 0.14784171568074922, 'random_strength': 9.406487263255608, 'grow_policy': 'Lossguide', 'min_data_in_leaf': 457, 'max_leaves': 142}. Best is trial 544 with value: 79.23314367466817.[0m
[32m[I 2024-10-13 13:51:55,819][0m Trial 550 finished with value: 273.14396232065747 and parameters: {'depth': 7, 'learning_rate': 0.18115835831060462, 'iterations': 100, 'l2_leaf_reg': 2.6220301857344352e-08, 'border_count': 1, 'bagging_temperature': 0.09758182733026043, 'random_strength': 9.923702738697212, 'grow_policy': 'Lossguide', 'min_data_in_leaf': 416, 'max_leaves': 125}. Best is trial 544 with value: 79.23314367466817.[0m
