[32m[I 2024-10-13 13:58:02,979][0m Trial 951 finished with value: 93.99739189552174 and parameters: {'depth': 10, 'learning_rate': 0.08507479968857533, 'iterations': 153, 'l2_leaf_reg': 5.2945618113038877e-08, 'border_count': 53, 'bagging_temperature': 0.045335038908010286, 'random_strength': 9.831748818935717, 'grow_policy': 'Lossguide', 'min_data_in_leaf': 458, 'max_leaves': 106}. Best is trial 738 with value: 78.71473735766027.[0m
[32m[I 2024-10-13 13:58:03,740][0m Trial 952 finished with value: 88.99810737016051 and parameters: {'depth': 7, 'learning_rate': 0.1408001184547141, 'iterations': 274, 'l2_leaf_reg': 9.725083626003065e-08, 'border_count': 25, 'bagging_temperature': 0.18035361936607316, 'random_strength': 9.146019280750068, 'grow_policy': 'Lossguide', 'min_data_in_leaf': 207, 'max_leaves': 141}. Best is trial 738 with value: 78.71473735766027.[0m
[32m[I 2024-10-13 13:58:04,451][0m Trial 953 finished with value: 92.43781804954716 and parameters: {'depth': 9, 'learning_rate': 0.2977459718206219, 'iterations': 204, 'l2_leaf_reg': 0.004629675917895289, 'border_count': 30, 'bagging_temperature': 0.1331061212368825, 'random_strength': 9.36250935786355, 'grow_policy': 'Lossguide', 'min_data_in_leaf': 477, 'max_leaves': 137}. Best is trial 738 with value: 78.71473735766027.[0m
[32m[I 2024-10-13 13:58:06,024][0m Trial 954 finished with value: 91.8828707742898 and parameters: {'depth': 15, 'learning_rate': 0.06505510530008016, 'iterations': 1447, 'l2_leaf_reg': 2.0094092443860776e-08, 'border_count': 14, 'bagging_temperature': 0.11339317728184585, 'random_strength': 8.849620660227838, 'grow_policy': 'Lossguide', 'min_data_in_leaf': 519, 'max_leaves': 165}. Best is trial 738 with value: 78.71473735766027.[0m
[32m[I 2024-10-13 13:58:06,851][0m Trial 955 finished with value: 253.76462439771583 and parameters: {'depth': 9, 'learning_rate': 0.0012069537926694, 'iterations': 398, 'l2_leaf_reg': 1.0299983706582436e-08, 'border_count': 23, 'bagging_temperature': 0.021284893816880077, 'random_strength': 9.975415294560822, 'grow_policy': 'Lossguide', 'min_data_in_leaf': 666, 'max_leaves': 113}. Best is trial 738 with value: 78.71473735766027.[0m
[32m[I 2024-10-13 13:58:07,513][0m Trial 956 finished with value: 83.7279801467168 and parameters: {'depth': 8, 'learning_rate': 0.18335615881187267, 'iterations': 151, 'l2_leaf_reg': 3.558771879325121e-08, 'border_count': 37, 'bagging_temperature': 0.06214490386377247, 'random_strength': 9.66690857323783, 'grow_policy': 'Lossguide', 'min_data_in_leaf': 412, 'max_leaves': 147}. Best is trial 738 with value: 78.71473735766027.[0m
[32m[I 2024-10-13 13:58:08,425][0m Trial 957 finished with value: 110.88855281441656 and parameters: {'depth': 6, 'learning_rate': 0.23548307744314553, 'iterations': 271, 'l2_leaf_reg': 4.4895533784495607e-07, 'border_count': 30, 'bagging_temperature': 0.1999416120729818, 'random_strength': 9.1246574696398, 'grow_policy': 'SymmetricTree', 'min_data_in_leaf': 356}. Best is trial 738 with value: 78.71473735766027.[0m
[32m[I 2024-10-13 13:58:09,288][0m Trial 958 finished with value: 91.49456344604188 and parameters: {'depth': 10, 'learning_rate': 0.10383191865305845, 'iterations': 340, 'l2_leaf_reg': 2.1051865393950004e-05, 'border_count': 21, 'bagging_temperature': 0.16518447199907296, 'random_strength': 8.631389635386888, 'grow_policy': 'Lossguide', 'min_data_in_leaf': 450, 'max_leaves': 126}. Best is trial 738 with value: 78.71473735766027.[0m
[32m[I 2024-10-13 13:58:09,879][0m Trial 959 finished with value: 86.78025496886207 and parameters: {'depth': 14, 'learning_rate': 0.15766073563234873, 'iterations': 101, 'l2_leaf_reg': 2.725625965664746e-08, 'border_count': 25, 'bagging_temperature': 0.08110566046704015, 'random_strength': 9.448015291953777, 'grow_policy': 'Lossguide', 'min_data_in_leaf': 485, 'max_leaves': 153}. Best is trial 738 with value: 78.71473735766027.[0m
[32m[I 2024-10-13 13:58:10,599][0m Trial 960 finished with value: 82.70181401257852 and parameters: {'depth': 7, 'learning_rate': 0.08214994947867421, 'iterations': 225, 'l2_leaf_reg': 1.0033761166087328e-08, 'border_count': 43, 'bagging_temperature': 0.10088578718248242, 'random_strength': 9.998219161697333, 'grow_policy': 'Lossguide', 'min_data_in_leaf': 156, 'max_leaves': 159}. Best is trial 738 with value: 78.71473735766027.[0m
[32m[I 2024-10-13 13:58:11,300][0m Trial 961 finished with value: 104.43776046417864 and parameters: {'depth': 6, 'learning_rate': 0.12262312130408914, 'iterations': 157, 'l2_leaf_reg': 1.787841866047307e-08, 'border_count': 185, 'bagging_temperature': 0.15277119738395892, 'random_strength': 9.622227176507307, 'grow_policy': 'Lossguide', 'min_data_in_leaf': 726, 'max_leaves': 117}. Best is trial 738 with value: 78.71473735766027.[0m
[32m[I 2024-10-13 13:58:12,058][0m Trial 962 finished with value: 90.39142393110363 and parameters: {'depth': 10, 'learning_rate': 0.0964235741564539, 'iterations': 306, 'l2_leaf_reg': 6.554338154868576e-08, 'border_count': 17, 'bagging_temperature': 0.12434864413244967, 'random_strength': 7.96174834564474, 'grow_policy': 'Lossguide', 'min_data_in_leaf': 512, 'max_leaves': 141}. Best is trial 738 with value: 78.71473735766027.[0m
[32m[I 2024-10-13 13:58:12,765][0m Trial 963 finished with value: 81.84026304930094 and parameters: {'depth': 9, 'learning_rate': 0.06078624037047187, 'iterations': 203, 'l2_leaf_reg': 4.6209711530565535e-08, 'border_count': 35, 'bagging_temperature': 0.04620232320676661, 'random_strength': 9.155696902422736, 'grow_policy': 'Lossguide', 'min_data_in_leaf': 459, 'max_leaves': 102}. Best is trial 738 with value: 78.71473735766027.[0m
[32m[I 2024-10-13 13:58:13,496][0m Trial 964 finished with value: 90.12948323877515 and parameters: {'depth': 7, 'learning_rate': 0.13855170079121062, 'iterations': 248, 'l2_leaf_reg': 1.628739813393333e-08, 'border_count': 11, 'bagging_temperature': 0.17533774098553723, 'random_strength': 9.356036332036107, 'grow_policy': 'Lossguide', 'min_data_in_leaf': 503, 'max_leaves': 134}. Best is trial 738 with value: 78.71473735766027.[0m
[32m[I 2024-10-13 13:58:14,151][0m Trial 965 finished with value: 95.61438535876145 and parameters: {'depth': 14, 'learning_rate': 0.07587790389094178, 'iterations': 143, 'l2_leaf_reg': 1.6422582314452298e-07, 'border_count': 79, 'bagging_temperature': 0.07356640037498274, 'random_strength': 8.966275061160367, 'grow_policy': 'Lossguide', 'min_data_in_leaf': 939, 'max_leaves': 85}. Best is trial 738 with value: 78.71473735766027.[0m
[32m[I 2024-10-13 13:58:14,776][0m Trial 966 finished with value: 86.6020442730461 and parameters: {'depth': 15, 'learning_rate': 0.18501959547813263, 'iterations': 101, 'l2_leaf_reg': 0.00140118993348939, 'border_count': 29, 'bagging_temperature': 0.20329596564663222, 'random_strength': 5.874423966782324, 'grow_policy': 'Lossguide', 'min_data_in_leaf': 764, 'max_leaves': 145}. Best is trial 738 with value: 78.71473735766027.[0m
[32m[I 2024-10-13 13:58:15,463][0m Trial 967 finished with value: 93.42575729324211 and parameters: {'depth': 9, 'learning_rate': 0.11990146171159777, 'iterations': 192, 'l2_leaf_reg': 2.9554166069108268e-08, 'border_count': 21, 'bagging_temperature': 0.14440718705733357, 'random_strength': 9.68051437917084, 'grow_policy': 'Lossguide', 'min_data_in_leaf': 243, 'max_leaves': 130}. Best is trial 738 with value: 78.71473735766027.[0m
[32m[I 2024-10-13 13:58:16,199][0m Trial 968 finished with value: 88.61180241240156 and parameters: {'depth': 6, 'learning_rate': 0.15420709000888252, 'iterations': 274, 'l2_leaf_reg': 1.8046018804682568e-08, 'border_count': 33, 'bagging_temperature': 0.10418122760519838, 'random_strength': 4.063534374460807, 'grow_policy': 'Lossguide', 'min_data_in_leaf': 874, 'max_leaves': 138}. Best is trial 738 with value: 78.71473735766027.[0m
[32m[I 2024-10-13 13:58:17,024][0m Trial 969 finished with value: 87.2596372219417 and parameters: {'depth': 10, 'learning_rate': 0.05314961504991675, 'iterations': 376, 'l2_leaf_reg': 4.3805351948059616e-08, 'border_count': 25, 'bagging_temperature': 0.4209579679879779, 'random_strength': 9.477499933350984, 'grow_policy': 'Depthwise', 'min_data_in_leaf': 484}. Best is trial 738 with value: 78.71473735766027.[0m
[32m[I 2024-10-13 13:58:17,707][0m Trial 970 finished with value: 92.44925479876139 and parameters: {'depth': 8, 'learning_rate': 0.09208650336276276, 'iterations': 155, 'l2_leaf_reg': 1.4207767512460757e-08, 'border_count': 18, 'bagging_temperature': 0.12143298392717103, 'random_strength': 9.248809193496065, 'grow_policy': 'Lossguide', 'min_data_in_leaf': 434, 'max_leaves': 150}. Best is trial 738 with value: 78.71473735766027.[0m
[32m[I 2024-10-13 13:58:18,567][0m Trial 971 finished with value: 91.79948385354363 and parameters: {'depth': 7, 'learning_rate': 0.2120447745301187, 'iterations': 448, 'l2_leaf_reg': 1.0023535004547647e-08, 'border_count': 38, 'bagging_temperature': 0.018374456821235216, 'random_strength': 9.65334506430294, 'grow_policy': 'Lossguide', 'min_data_in_leaf': 530, 'max_leaves': 143}. Best is trial 738 with value: 78.71473735766027.[0m
[32m[I 2024-10-13 13:58:19,267][0m Trial 972 finished with value: 85.96793384877911 and parameters: {'depth': 6, 'learning_rate': 0.10732101257176124, 'iterations': 223, 'l2_leaf_reg': 0.0024254467782863264, 'border_count': 29, 'bagging_temperature': 0.059771087689608766, 'random_strength': 9.791394991894318, 'grow_policy': 'Lossguide', 'min_data_in_leaf': 186, 'max_leaves': 156}. Best is trial 738 with value: 78.71473735766027.[0m
[32m[I 2024-10-13 13:58:19,998][0m Trial 973 finished with value: 83.23286467095515 and parameters: {'depth': 10, 'learning_rate': 0.06902278997467567, 'iterations': 298, 'l2_leaf_reg': 0.01038242959605648, 'border_count': 49, 'bagging_temperature': 0.08237599056344894, 'random_strength': 8.802094261107223, 'grow_policy': 'Lossguide', 'min_data_in_leaf': 794, 'max_leaves': 120}. Best is trial 738 with value: 78.71473735766027.[0m
[32m[I 2024-10-13 13:58:20,618][0m Trial 974 finished with value: 95.67363763748773 and parameters: {'depth': 7, 'learning_rate': 0.13646256513577718, 'iterations': 101, 'l2_leaf_reg': 2.555950660719987e-08, 'border_count': 13, 'bagging_temperature': 0.18718223878516566, 'random_strength': 9.482772909150023, 'grow_policy': 'Lossguide', 'min_data_in_leaf': 462, 'max_leaves': 149}. Best is trial 738 with value: 78.71473735766027.[0m
[32m[I 2024-10-13 13:58:21,355][0m Trial 975 finished with value: 82.6810203907651 and parameters: {'depth': 6, 'learning_rate': 0.2568589562655839, 'iterations': 198, 'l2_leaf_reg': 8.222143495787436e-08, 'border_count': 24, 'bagging_temperature': 0.13882275530892765, 'random_strength': 9.01394960097183, 'grow_policy': 'Lossguide', 'min_data_in_leaf': 490, 'max_leaves': 109}. Best is trial 738 with value: 78.71473735766027.[0m
[32m[I 2024-10-13 13:58:22,080][0m Trial 976 finished with value: 84.58790124452048 and parameters: {'depth': 14, 'learning_rate': 0.08633719102419025, 'iterations': 241, 'l2_leaf_reg': 2.5834139144002383e-08, 'border_count': 32, 'bagging_temperature': 0.16464510021058165, 'random_strength': 9.222725103542079, 'grow_policy': 'Lossguide', 'min_data_in_leaf': 446, 'max_leaves': 137}. Best is trial 738 with value: 78.71473735766027.[0m
[32m[I 2024-10-13 13:58:23,276][0m Trial 977 finished with value: 129.14116601668283 and parameters: {'depth': 9, 'learning_rate': 0.1570138476489464, 'iterations': 832, 'l2_leaf_reg': 4.219559548827453e-08, 'border_count': 6, 'bagging_temperature': 0.04222387364511379, 'random_strength': 8.426063414687453, 'grow_policy': 'Lossguide', 'min_data_in_leaf': 472, 'max_leaves': 144}. Best is trial 738 with value: 78.71473735766027.[0m
[32m[I 2024-10-13 13:58:23,923][0m Trial 978 finished with value: 128.01440062886175 and parameters: {'depth': 8, 'learning_rate': 0.01651397651836919, 'iterations': 152, 'l2_leaf_reg': 1.502832408847587e-08, 'border_count': 40, 'bagging_temperature': 0.10062603306719274, 'random_strength': 9.997974008821343, 'grow_policy': 'Lossguide', 'min_data_in_leaf': 411, 'max_leaves': 132}. Best is trial 738 with value: 78.71473735766027.[0m
[32m[I 2024-10-13 13:58:25,026][0m Trial 979 finished with value: 95.12556185215817 and parameters: {'depth': 7, 'learning_rate': 0.06011356289465654, 'iterations': 338, 'l2_leaf_reg': 2.019426533773522e-08, 'border_count': 198, 'bagging_temperature': 0.1213586369758414, 'random_strength': 9.443929049768181, 'grow_policy': 'SymmetricTree', 'min_data_in_leaf': 500}. Best is trial 738 with value: 78.71473735766027.[0m
[32m[I 2024-10-13 13:58:25,716][0m Trial 980 finished with value: 94.20552490234766 and parameters: {'depth': 10, 'learning_rate': 0.11370757713477186, 'iterations': 195, 'l2_leaf_reg': 5.7312474524481156e-08, 'border_count': 22, 'bagging_temperature': 0.08772206254699497, 'random_strength': 9.62800688246991, 'grow_policy': 'Lossguide', 'min_data_in_leaf': 690, 'max_leaves': 153}. Best is trial 738 with value: 78.71473735766027.[0m
[32m[I 2024-10-13 13:58:26,459][0m Trial 981 finished with value: 95.65631165819202 and parameters: {'depth': 15, 'learning_rate': 0.18971339462657252, 'iterations': 273, 'l2_leaf_reg': 3.4420428566018124e-08, 'border_count': 28, 'bagging_temperature': 0.20502963627718185, 'random_strength': 7.446803494359754, 'grow_policy': 'Lossguide', 'min_data_in_leaf': 535, 'max_leaves': 99}. Best is trial 738 with value: 78.71473735766027.[0m
[32m[I 2024-10-13 13:58:28,806][0m Trial 982 finished with value: 94.25031254907684 and parameters: {'depth': 6, 'learning_rate': 0.026233275314581864, 'iterations': 2527, 'l2_leaf_reg': 1.4532753868790822e-08, 'border_count': 18, 'bagging_temperature': 0.14905195003652658, 'random_strength': 9.790161667797308, 'grow_policy': 'Lossguide', 'min_data_in_leaf': 385, 'max_leaves': 126}. Best is trial 738 with value: 78.71473735766027.[0m
[32m[I 2024-10-13 13:58:29,471][0m Trial 983 finished with value: 81.26658855634105 and parameters: {'depth': 8, 'learning_rate': 0.2300814525984484, 'iterations': 146, 'l2_leaf_reg': 2.4868203177782852e-08, 'border_count': 34, 'bagging_temperature': 0.49560933676052565, 'random_strength': 9.295709355517682, 'grow_policy': 'Lossguide', 'min_data_in_leaf': 224, 'max_leaves': 140}. Best is trial 738 with value: 78.71473735766027.[0m
[32m[I 2024-10-13 13:58:30,153][0m Trial 984 finished with value: 88.29997107653836 and parameters: {'depth': 9, 'learning_rate': 0.07214383189523974, 'iterations': 196, 'l2_leaf_reg': 1.4754766947513406e-08, 'border_count': 26, 'bagging_temperature': 0.17818145874489927, 'random_strength': 8.602515147382173, 'grow_policy': 'Lossguide', 'min_data_in_leaf': 512, 'max_leaves': 149}. Best is trial 738 with value: 78.71473735766027.[0m
[32m[I 2024-10-13 13:58:31,003][0m Trial 985 finished with value: 107.48028788293414 and parameters: {'depth': 14, 'learning_rate': 0.010063867902831345, 'iterations': 313, 'l2_leaf_reg': 1.0418499059547349e-07, 'border_count': 62, 'bagging_temperature': 0.06848553351881852, 'random_strength': 8.940707778782219, 'grow_policy': 'Lossguide', 'min_data_in_leaf': 475, 'max_leaves': 114}. Best is trial 738 with value: 78.71473735766027.[0m
[32m[I 2024-10-13 13:58:31,663][0m Trial 986 finished with value: 99.10307020619719 and parameters: {'depth': 7, 'learning_rate': 0.1283430376620447, 'iterations': 102, 'l2_leaf_reg': 3.644113997785819e-08, 'border_count': 214, 'bagging_temperature': 0.029623182340834497, 'random_strength': 5.429880459943409, 'grow_policy': 'Lossguide', 'min_data_in_leaf': 173, 'max_leaves': 159}. Best is trial 738 with value: 78.71473735766027.[0m
[32m[I 2024-10-13 13:58:32,391][0m Trial 987 finished with value: 94.90525798800452 and parameters: {'depth': 9, 'learning_rate': 0.048603754624471814, 'iterations': 241, 'l2_leaf_reg': 2.184233322044665e-08, 'border_count': 15, 'bagging_temperature': 0.13043975521430287, 'random_strength': 9.130423335694779, 'grow_policy': 'Lossguide', 'min_data_in_leaf': 283, 'max_leaves': 135}. Best is trial 738 with value: 78.71473735766027.[0m
[32m[I 2024-10-13 13:58:33,763][0m Trial 988 finished with value: 89.37030163554358 and parameters: {'depth': 10, 'learning_rate': 0.0071752370572833925, 'iterations': 943, 'l2_leaf_reg': 5.2553782786694435e-08, 'border_count': 44, 'bagging_temperature': 0.09860113277078061, 'random_strength': 9.4425853921507, 'grow_policy': 'Lossguide', 'min_data_in_leaf': 428, 'max_leaves': 145}. Best is trial 738 with value: 78.71473735766027.[0m
[32m[I 2024-10-13 13:58:34,450][0m Trial 989 finished with value: 84.47571491407209 and parameters: {'depth': 7, 'learning_rate': 0.10251631124232115, 'iterations': 154, 'l2_leaf_reg': 0.0034574267860989724, 'border_count': 32, 'bagging_temperature': 0.054236215894565794, 'random_strength': 9.82530843559055, 'grow_policy': 'Lossguide', 'min_data_in_leaf': 999, 'max_leaves': 105}. Best is trial 738 with value: 78.71473735766027.[0m
[32m[I 2024-10-13 13:58:36,026][0m Trial 990 finished with value: 118.23196245014641 and parameters: {'depth': 10, 'learning_rate': 0.170390552609329, 'iterations': 1342, 'l2_leaf_reg': 1.3988751345937573e-08, 'border_count': 68, 'bagging_temperature': 0.11276501525789785, 'random_strength': 9.586964738173307, 'grow_policy': 'Depthwise', 'min_data_in_leaf': 206}. Best is trial 738 with value: 78.71473735766027.[0m
[32m[I 2024-10-13 13:58:36,839][0m Trial 991 finished with value: 225.2625729271139 and parameters: {'depth': 6, 'learning_rate': 0.002000878077500945, 'iterations': 365, 'l2_leaf_reg': 2.8227111101424725e-08, 'border_count': 21, 'bagging_temperature': 0.15840944354203051, 'random_strength': 9.288951562966806, 'grow_policy': 'Lossguide', 'min_data_in_leaf': 453, 'max_leaves': 141}. Best is trial 738 with value: 78.71473735766027.[0m
[32m[I 2024-10-13 13:58:37,556][0m Trial 992 finished with value: 87.99837601414255 and parameters: {'depth': 8, 'learning_rate': 0.08281626481553546, 'iterations': 242, 'l2_leaf_reg': 7.057376336928435e-08, 'border_count': 26, 'bagging_temperature': 0.08451884551577656, 'random_strength': 8.256075665314663, 'grow_policy': 'Lossguide', 'min_data_in_leaf': 117, 'max_leaves': 129}. Best is trial 738 with value: 78.71473735766027.[0m
[32m[I 2024-10-13 13:58:38,229][0m Trial 993 finished with value: 86.62596804751769 and parameters: {'depth': 9, 'learning_rate': 0.260833016630191, 'iterations': 190, 'l2_leaf_reg': 0.0015452713882270447, 'border_count': 37, 'bagging_temperature': 0.18846488695706792, 'random_strength': 3.9214699024647213, 'grow_policy': 'Lossguide', 'min_data_in_leaf': 494, 'max_leaves': 154}. Best is trial 738 with value: 78.71473735766027.[0m
[32m[I 2024-10-13 13:58:39,016][0m Trial 994 finished with value: 93.22415329021399 and parameters: {'depth': 14, 'learning_rate': 0.1385860492797967, 'iterations': 301, 'l2_leaf_reg': 2.062328364304057e-08, 'border_count': 19, 'bagging_temperature': 0.13454375968432666, 'random_strength': 8.804514549010065, 'grow_policy': 'Lossguide', 'min_data_in_leaf': 524, 'max_leaves': 122}. Best is trial 738 with value: 78.71473735766027.[0m
[32m[I 2024-10-13 13:58:40,363][0m Trial 995 finished with value: 90.865867249205 and parameters: {'depth': 7, 'learning_rate': 0.09693001190570058, 'iterations': 1073, 'l2_leaf_reg': 1.0172209558593394e-08, 'border_count': 11, 'bagging_temperature': 0.06409043551393126, 'random_strength': 9.787200008092226, 'grow_policy': 'Lossguide', 'min_data_in_leaf': 145, 'max_leaves': 148}. Best is trial 738 with value: 78.71473735766027.[0m
[32m[I 2024-10-13 13:58:41,016][0m Trial 996 finished with value: 177.3012105771392 and parameters: {'depth': 8, 'learning_rate': 0.013115209060860852, 'iterations': 100, 'l2_leaf_reg': 0.1601422640376609, 'border_count': 30, 'bagging_temperature': 0.20567752006971107, 'random_strength': 9.543401325940087, 'grow_policy': 'Lossguide', 'min_data_in_leaf': 440, 'max_leaves': 136}. Best is trial 738 with value: 78.71473735766027.[0m
[32m[I 2024-10-13 13:58:41,675][0m Trial 997 finished with value: 81.28154813159792 and parameters: {'depth': 10, 'learning_rate': 0.12160683403630103, 'iterations': 154, 'l2_leaf_reg': 3.93597179902727e-08, 'border_count': 23, 'bagging_temperature': 0.10892636884839865, 'random_strength': 9.029321384871709, 'grow_policy': 'Lossguide', 'min_data_in_leaf': 469, 'max_leaves': 142}. Best is trial 738 with value: 78.71473735766027.[0m
[32m[I 2024-10-13 13:58:42,561][0m Trial 998 finished with value: 91.59564072524178 and parameters: {'depth': 9, 'learning_rate': 0.20543816212993324, 'iterations': 436, 'l2_leaf_reg': 2.008804530568134e-08, 'border_count': 36, 'bagging_temperature': 0.16222060237731714, 'random_strength': 9.305754844777026, 'grow_policy': 'Lossguide', 'min_data_in_leaf': 498, 'max_leaves': 163}. Best is trial 738 with value: 78.71473735766027.[0m
[32m[I 2024-10-13 13:58:43,943][0m Trial 999 finished with value: 77.74211213032635 and parameters: {'depth': 15, 'learning_rate': 0.06141894711037887, 'iterations': 247, 'l2_leaf_reg': 1.4074554406929478e-08, 'border_count': 29, 'bagging_temperature': 0.038157817269630995, 'random_strength': 9.653938048362608, 'grow_policy': 'Lossguide', 'min_data_in_leaf': 10, 'max_leaves': 111}. Best is trial 999 with value: 77.74211213032635.[0m
CatBoost: RMSE = 77.7421
      Model       RMSE
0  CatBoost  77.742112

Best hyperparameters for CatBoost:
{'depth': 15, 'learning_rate': 0.06141894711037887, 'iterations': 247, 'l2_leaf_reg': 1.4074554406929478e-08, 'border_count': 29, 'bagging_temperature': 0.038157817269630995, 'random_strength': 9.653938048362608, 'grow_policy': 'Lossguide', 'min_data_in_leaf': 10, 'max_leaves': 111}
