[32m[I 2024-10-13 13:55:44,739][0m Trial 801 finished with value: 86.29935738578742 and parameters: {'depth': 7, 'learning_rate': 0.23539004095104232, 'iterations': 189, 'l2_leaf_reg': 1.3798958715968624e-08, 'border_count': 32, 'bagging_temperature': 0.2162518226612949, 'random_strength': 9.145677685627943, 'grow_policy': 'Lossguide', 'min_data_in_leaf': 511, 'max_leaves': 46}. Best is trial 738 with value: 78.71473735766027.[0m
[32m[I 2024-10-13 13:55:46,046][0m Trial 802 finished with value: 101.81433162834105 and parameters: {'depth': 9, 'learning_rate': 0.05048606862915901, 'iterations': 282, 'l2_leaf_reg': 4.1978665810355915e-08, 'border_count': 23, 'bagging_temperature': 0.12622858087562314, 'random_strength': 9.463206207302248, 'grow_policy': 'SymmetricTree', 'min_data_in_leaf': 544}. Best is trial 738 with value: 78.71473735766027.[0m
[32m[I 2024-10-13 13:55:46,720][0m Trial 803 finished with value: 83.55209786716024 and parameters: {'depth': 8, 'learning_rate': 0.07895556013395447, 'iterations': 155, 'l2_leaf_reg': 2.3480905719408567e-08, 'border_count': 43, 'bagging_temperature': 0.06520264892701677, 'random_strength': 8.9167203227992, 'grow_policy': 'Lossguide', 'min_data_in_leaf': 491, 'max_leaves': 92}. Best is trial 738 with value: 78.71473735766027.[0m
[32m[I 2024-10-13 13:55:47,451][0m Trial 804 finished with value: 91.5811790335995 and parameters: {'depth': 6, 'learning_rate': 0.13518578314723678, 'iterations': 240, 'l2_leaf_reg': 1.005654030991011e-08, 'border_count': 17, 'bagging_temperature': 0.02941329691303342, 'random_strength': 2.14608801051758, 'grow_policy': 'Lossguide', 'min_data_in_leaf': 463, 'max_leaves': 146}. Best is trial 738 with value: 78.71473735766027.[0m
[32m[I 2024-10-13 13:55:48,234][0m Trial 805 finished with value: 99.92813016584465 and parameters: {'depth': 14, 'learning_rate': 0.06287109477115461, 'iterations': 312, 'l2_leaf_reg': 3.1693846000472253e-07, 'border_count': 108, 'bagging_temperature': 0.1602132809756022, 'random_strength': 9.375374663017197, 'grow_policy': 'Lossguide', 'min_data_in_leaf': 766, 'max_leaves': 135}. Best is trial 738 with value: 78.71473735766027.[0m
[32m[I 2024-10-13 13:55:48,838][0m Trial 806 finished with value: 82.62456603733277 and parameters: {'depth': 15, 'learning_rate': 0.0893662929992191, 'iterations': 100, 'l2_leaf_reg': 0.00933846532977577, 'border_count': 34, 'bagging_temperature': 0.2008120379120645, 'random_strength': 8.67847927688344, 'grow_policy': 'Lossguide', 'min_data_in_leaf': 562, 'max_leaves': 98}. Best is trial 738 with value: 78.71473735766027.[0m
[32m[I 2024-10-13 13:55:49,645][0m Trial 807 finished with value: 99.54159490885836 and parameters: {'depth': 9, 'learning_rate': 0.2997746181758448, 'iterations': 364, 'l2_leaf_reg': 3.218972268053435e-08, 'border_count': 28, 'bagging_temperature': 0.14207857763755716, 'random_strength': 2.5244585914885027, 'grow_policy': 'Lossguide', 'min_data_in_leaf': 178, 'max_leaves': 153}. Best is trial 738 with value: 78.71473735766027.[0m
[32m[I 2024-10-13 13:55:50,339][0m Trial 808 finished with value: 87.93683933319555 and parameters: {'depth': 7, 'learning_rate': 0.11125764575451236, 'iterations': 207, 'l2_leaf_reg': 6.507559106020539e-08, 'border_count': 11, 'bagging_temperature': 0.47728560380429286, 'random_strength': 9.819918027503777, 'grow_policy': 'Lossguide', 'min_data_in_leaf': 248, 'max_leaves': 109}. Best is trial 738 with value: 78.71473735766027.[0m
[32m[I 2024-10-13 13:55:51,011][0m Trial 809 finished with value: 318.5628418772907 and parameters: {'depth': 6, 'learning_rate': 0.00022940378167434544, 'iterations': 148, 'l2_leaf_reg': 1.4570878221103395e-08, 'border_count': 23, 'bagging_temperature': 0.08787961173156983, 'random_strength': 9.60972534469684, 'grow_policy': 'Lossguide', 'min_data_in_leaf': 514, 'max_leaves': 66}. Best is trial 738 with value: 78.71473735766027.[0m
[32m[I 2024-10-13 13:55:51,766][0m Trial 810 finished with value: 85.82145863234153 and parameters: {'depth': 5, 'learning_rate': 0.1611940665730247, 'iterations': 264, 'l2_leaf_reg': 2.106682101700009e-08, 'border_count': 39, 'bagging_temperature': 0.11065813461450426, 'random_strength': 9.201546615188455, 'grow_policy': 'Lossguide', 'min_data_in_leaf': 212, 'max_leaves': 185}. Best is trial 738 with value: 78.71473735766027.[0m
[32m[I 2024-10-13 13:55:53,120][0m Trial 811 finished with value: 303.8901656617917 and parameters: {'depth': 13, 'learning_rate': 0.00010220980962868488, 'iterations': 1091, 'l2_leaf_reg': 4.294597452887893e-08, 'border_count': 52, 'bagging_temperature': 0.22737676258938172, 'random_strength': 8.258193499186254, 'grow_policy': 'Lossguide', 'min_data_in_leaf': 446, 'max_leaves': 247}. Best is trial 738 with value: 78.71473735766027.[0m
[32m[I 2024-10-13 13:55:53,807][0m Trial 812 finished with value: 98.1790357700875 and parameters: {'depth': 6, 'learning_rate': 0.07095082506382284, 'iterations': 200, 'l2_leaf_reg': 6.288775001713249e-06, 'border_count': 120, 'bagging_temperature': 0.18022077181085033, 'random_strength': 9.434952281062357, 'grow_policy': 'Depthwise', 'min_data_in_leaf': 128}. Best is trial 738 with value: 78.71473735766027.[0m
[32m[I 2024-10-13 13:55:54,466][0m Trial 813 finished with value: 89.44525064007406 and parameters: {'depth': 7, 'learning_rate': 0.21800033069534924, 'iterations': 155, 'l2_leaf_reg': 1.4965487330925214e-07, 'border_count': 31, 'bagging_temperature': 0.1294356837764231, 'random_strength': 9.69416439211369, 'grow_policy': 'Lossguide', 'min_data_in_leaf': 481, 'max_leaves': 124}. Best is trial 738 with value: 78.71473735766027.[0m
[32m[I 2024-10-13 13:55:55,227][0m Trial 814 finished with value: 93.64245069002241 and parameters: {'depth': 8, 'learning_rate': 0.05501560667009606, 'iterations': 244, 'l2_leaf_reg': 1.0101671371117114e-08, 'border_count': 19, 'bagging_temperature': 0.045219285315592384, 'random_strength': 9.040425163448486, 'grow_policy': 'Lossguide', 'min_data_in_leaf': 596, 'max_leaves': 146}. Best is trial 738 with value: 78.71473735766027.[0m
[32m[I 2024-10-13 13:55:55,987][0m Trial 815 finished with value: 80.25901878865459 and parameters: {'depth': 9, 'learning_rate': 0.09386532598750799, 'iterations': 303, 'l2_leaf_reg': 3.04988833406703e-08, 'border_count': 24, 'bagging_temperature': 0.07184046505217714, 'random_strength': 9.326786062295406, 'grow_policy': 'Lossguide', 'min_data_in_leaf': 500, 'max_leaves': 139}. Best is trial 738 with value: 78.71473735766027.[0m
[32m[I 2024-10-13 13:55:56,830][0m Trial 816 finished with value: 90.99805068073535 and parameters: {'depth': 9, 'learning_rate': 0.10277570276012717, 'iterations': 372, 'l2_leaf_reg': 5.184849860266843e-08, 'border_count': 17, 'bagging_temperature': 0.6015467198989941, 'random_strength': 9.285193272725186, 'grow_policy': 'Lossguide', 'min_data_in_leaf': 494, 'max_leaves': 137}. Best is trial 738 with value: 78.71473735766027.[0m
[32m[I 2024-10-13 13:55:57,673][0m Trial 817 finished with value: 90.73648393501018 and parameters: {'depth': 9, 'learning_rate': 0.0937246857977072, 'iterations': 438, 'l2_leaf_reg': 3.204958318783247e-08, 'border_count': 13, 'bagging_temperature': 0.06316993402836808, 'random_strength': 9.160209477725912, 'grow_policy': 'Lossguide', 'min_data_in_leaf': 500, 'max_leaves': 129}. Best is trial 738 with value: 78.71473735766027.[0m
[32m[I 2024-10-13 13:55:58,466][0m Trial 818 finished with value: 81.11861360585534 and parameters: {'depth': 9, 'learning_rate': 0.11760345815630249, 'iterations': 340, 'l2_leaf_reg': 2.512273164758012e-08, 'border_count': 23, 'bagging_temperature': 0.0653760433182856, 'random_strength': 4.690802784448657, 'grow_policy': 'Lossguide', 'min_data_in_leaf': 468, 'max_leaves': 139}. Best is trial 738 with value: 78.71473735766027.[0m
[32m[I 2024-10-13 13:55:59,191][0m Trial 819 finished with value: 81.62650440951043 and parameters: {'depth': 8, 'learning_rate': 0.11967672435321101, 'iterations': 291, 'l2_leaf_reg': 5.687291560413112e-08, 'border_count': 24, 'bagging_temperature': 0.07696276857709596, 'random_strength': 4.281984723585304, 'grow_policy': 'Lossguide', 'min_data_in_leaf': 515, 'max_leaves': 133}. Best is trial 738 with value: 78.71473735766027.[0m
[32m[I 2024-10-13 13:55:59,973][0m Trial 820 finished with value: 91.87076168202152 and parameters: {'depth': 9, 'learning_rate': 0.09188783125383308, 'iterations': 321, 'l2_leaf_reg': 2.0746716033796842e-08, 'border_count': 16, 'bagging_temperature': 0.04405601485013769, 'random_strength': 8.879507721000932, 'grow_policy': 'Lossguide', 'min_data_in_leaf': 929, 'max_leaves': 142}. Best is trial 738 with value: 78.71473735766027.[0m
[32m[I 2024-10-13 13:56:00,793][0m Trial 821 finished with value: 92.99924744647572 and parameters: {'depth': 9, 'learning_rate': 0.14100070299218656, 'iterations': 392, 'l2_leaf_reg': 1.0041432610802862e-07, 'border_count': 21, 'bagging_temperature': 0.08200311880629861, 'random_strength': 9.372826440265767, 'grow_policy': 'Lossguide', 'min_data_in_leaf': 475, 'max_leaves': 136}. Best is trial 738 with value: 78.71473735766027.[0m
[32m[I 2024-10-13 13:56:01,451][0m Trial 822 finished with value: 88.12719527852056 and parameters: {'depth': 8, 'learning_rate': 0.10975715851505692, 'iterations': 154, 'l2_leaf_reg': 3.09019298965435e-08, 'border_count': 27, 'bagging_temperature': 0.020675574764435187, 'random_strength': 0.9066762581129908, 'grow_policy': 'Lossguide', 'min_data_in_leaf': 489, 'max_leaves': 142}. Best is trial 738 with value: 78.71473735766027.[0m
[32m[I 2024-10-13 13:56:02,167][0m Trial 823 finished with value: 92.24223619449512 and parameters: {'depth': 8, 'learning_rate': 0.13536557486114803, 'iterations': 216, 'l2_leaf_reg': 1.489661434080414e-08, 'border_count': 13, 'bagging_temperature': 0.11043898556436137, 'random_strength': 1.3213290064768777, 'grow_policy': 'Lossguide', 'min_data_in_leaf': 416, 'max_leaves': 131}. Best is trial 738 with value: 78.71473735766027.[0m
[32m[I 2024-10-13 13:56:11,367][0m Trial 824 finished with value: 100.04791914864951 and parameters: {'depth': 9, 'learning_rate': 0.08400923364621858, 'iterations': 1398, 'l2_leaf_reg': 4.124640187666559e-08, 'border_count': 27, 'bagging_temperature': 0.09069091517168909, 'random_strength': 9.465430874804321, 'grow_policy': 'SymmetricTree', 'min_data_in_leaf': 457}. Best is trial 738 with value: 78.71473735766027.[0m
[32m[I 2024-10-13 13:56:11,971][0m Trial 825 finished with value: 118.34245436750086 and parameters: {'depth': 10, 'learning_rate': 0.18401111999715242, 'iterations': 103, 'l2_leaf_reg': 6.853929455151256e-08, 'border_count': 7, 'bagging_temperature': 0.04837720462788743, 'random_strength': 5.046693631072371, 'grow_policy': 'Lossguide', 'min_data_in_leaf': 485, 'max_leaves': 140}. Best is trial 738 with value: 78.71473735766027.[0m
[32m[I 2024-10-13 13:56:12,740][0m Trial 826 finished with value: 92.92785167288886 and parameters: {'depth': 7, 'learning_rate': 0.09691570586625543, 'iterations': 263, 'l2_leaf_reg': 1.9036931751610955e-08, 'border_count': 19, 'bagging_temperature': 0.06728931447611569, 'random_strength': 9.990313276523052, 'grow_policy': 'Lossguide', 'min_data_in_leaf': 521, 'max_leaves': 145}. Best is trial 738 with value: 78.71473735766027.[0m
[32m[I 2024-10-13 13:56:13,482][0m Trial 827 finished with value: 81.72782344845439 and parameters: {'depth': 7, 'learning_rate': 0.1202142191750666, 'iterations': 185, 'l2_leaf_reg': 3.380607138404406e-08, 'border_count': 23, 'bagging_temperature': 0.09540809433602734, 'random_strength': 1.805952985332726, 'grow_policy': 'Lossguide', 'min_data_in_leaf': 502, 'max_leaves': 126}. Best is trial 738 with value: 78.71473735766027.[0m
[32m[I 2024-10-13 13:56:15,942][0m Trial 828 finished with value: 93.09465298501183 and parameters: {'depth': 9, 'learning_rate': 0.022228445002357326, 'iterations': 2634, 'l2_leaf_reg': 1.458328652718166e-08, 'border_count': 30, 'bagging_temperature': 0.11230420258815223, 'random_strength': 9.630359577421263, 'grow_policy': 'Lossguide', 'min_data_in_leaf': 440, 'max_leaves': 136}. Best is trial 738 with value: 78.71473735766027.[0m
[32m[I 2024-10-13 13:56:16,751][0m Trial 829 finished with value: 89.68780030590324 and parameters: {'depth': 15, 'learning_rate': 0.2534754223711602, 'iterations': 305, 'l2_leaf_reg': 2.1687820988344967e-08, 'border_count': 16, 'bagging_temperature': 0.14136639334464976, 'random_strength': 9.090206550595543, 'grow_policy': 'Lossguide', 'min_data_in_leaf': 524, 'max_leaves': 239}. Best is trial 738 with value: 78.71473735766027.[0m
[32m[I 2024-10-13 13:56:17,473][0m Trial 830 finished with value: 86.79548084992253 and parameters: {'depth': 10, 'learning_rate': 0.07937828843194308, 'iterations': 231, 'l2_leaf_reg': 2.9127614816447567e-08, 'border_count': 26, 'bagging_temperature': 0.019545127487128403, 'random_strength': 9.309964654909543, 'grow_policy': 'Lossguide', 'min_data_in_leaf': 472, 'max_leaves': 142}. Best is trial 738 with value: 78.71473735766027.[0m
[32m[I 2024-10-13 13:56:18,355][0m Trial 831 finished with value: 260.01835005669966 and parameters: {'depth': 8, 'learning_rate': 0.0009691273498257241, 'iterations': 435, 'l2_leaf_reg': 0.004022587141008991, 'border_count': 32, 'bagging_temperature': 0.056301957957590396, 'random_strength': 9.753062231274606, 'grow_policy': 'Lossguide', 'min_data_in_leaf': 503, 'max_leaves': 115}. Best is trial 738 with value: 78.71473735766027.[0m
[32m[I 2024-10-13 13:56:19,031][0m Trial 832 finished with value: 82.1249117414183 and parameters: {'depth': 6, 'learning_rate': 0.16010002971057327, 'iterations': 155, 'l2_leaf_reg': 4.77559722322998e-08, 'border_count': 23, 'bagging_temperature': 0.09864014746284688, 'random_strength': 8.817478940526899, 'grow_policy': 'Lossguide', 'min_data_in_leaf': 452, 'max_leaves': 128}. Best is trial 738 with value: 78.71473735766027.[0m
[32m[I 2024-10-13 13:56:19,823][0m Trial 833 finished with value: 298.8824475277115 and parameters: {'depth': 10, 'learning_rate': 0.0004452717554807523, 'iterations': 343, 'l2_leaf_reg': 7.873674107813154e-08, 'border_count': 20, 'bagging_temperature': 0.07583970712741729, 'random_strength': 9.540991378271286, 'grow_policy': 'Depthwise', 'min_data_in_leaf': 538}. Best is trial 738 with value: 78.71473735766027.[0m
[32m[I 2024-10-13 13:56:20,607][0m Trial 834 finished with value: 88.61367150920385 and parameters: {'depth': 9, 'learning_rate': 0.09593276249462816, 'iterations': 268, 'l2_leaf_reg': 1.5706478420007834e-08, 'border_count': 11, 'bagging_temperature': 0.12561000947461398, 'random_strength': 9.215835180494883, 'grow_policy': 'Lossguide', 'min_data_in_leaf': 420, 'max_leaves': 106}. Best is trial 738 with value: 78.71473735766027.[0m
[32m[I 2024-10-13 13:56:21,282][0m Trial 835 finished with value: 95.94042751989637 and parameters: {'depth': 7, 'learning_rate': 0.20147001915741952, 'iterations': 196, 'l2_leaf_reg': 2.716924671811948e-08, 'border_count': 27, 'bagging_temperature': 0.03667037994550983, 'random_strength': 8.531559758000885, 'grow_policy': 'Lossguide', 'min_data_in_leaf': 497, 'max_leaves': 148}. Best is trial 738 with value: 78.71473735766027.[0m
[32m[I 2024-10-13 13:56:21,943][0m Trial 836 finished with value: 85.84194550065112 and parameters: {'depth': 5, 'learning_rate': 0.13047976668503214, 'iterations': 162, 'l2_leaf_reg': 1.3584823085640236e-08, 'border_count': 32, 'bagging_temperature': 0.1517902689205784, 'random_strength': 9.034616460240851, 'grow_policy': 'Lossguide', 'min_data_in_leaf': 473, 'max_leaves': 134}. Best is trial 738 with value: 78.71473735766027.[0m
[32m[I 2024-10-13 13:56:22,705][0m Trial 837 finished with value: 274.3821221750646 and parameters: {'depth': 6, 'learning_rate': 0.0013064502020476484, 'iterations': 237, 'l2_leaf_reg': 3.9638355541801546e-08, 'border_count': 35, 'bagging_temperature': 0.10432956660114602, 'random_strength': 9.598571445252805, 'grow_policy': 'Lossguide', 'min_data_in_leaf': 903, 'max_leaves': 144}. Best is trial 738 with value: 78.71473735766027.[0m
[32m[I 2024-10-13 13:56:23,510][0m Trial 838 finished with value: 90.50477665324085 and parameters: {'depth': 8, 'learning_rate': 0.10221309806300136, 'iterations': 378, 'l2_leaf_reg': 2.0948814142321852e-08, 'border_count': 17, 'bagging_temperature': 0.1645398837645344, 'random_strength': 9.339446589864979, 'grow_policy': 'Lossguide', 'min_data_in_leaf': 197, 'max_leaves': 140}. Best is trial 738 with value: 78.71473735766027.[0m
[32m[I 2024-10-13 13:56:24,271][0m Trial 839 finished with value: 92.16591363912084 and parameters: {'depth': 9, 'learning_rate': 0.16585403694269624, 'iterations': 298, 'l2_leaf_reg': 1.4791015385423031e-08, 'border_count': 27, 'bagging_temperature': 0.83727150694168, 'random_strength': 9.745140865661956, 'grow_policy': 'Lossguide', 'min_data_in_leaf': 510, 'max_leaves': 148}. Best is trial 738 with value: 78.71473735766027.[0m
[32m[I 2024-10-13 13:56:24,936][0m Trial 840 finished with value: 93.6643877042023 and parameters: {'depth': 7, 'learning_rate': 0.0797989941825815, 'iterations': 135, 'l2_leaf_reg': 1.1924706749842112e-07, 'border_count': 21, 'bagging_temperature': 0.12373838793414062, 'random_strength': 9.364756842669378, 'grow_policy': 'Lossguide', 'min_data_in_leaf': 386, 'max_leaves': 120}. Best is trial 738 with value: 78.71473735766027.[0m
[32m[I 2024-10-13 13:56:25,635][0m Trial 841 finished with value: 83.00631257736227 and parameters: {'depth': 10, 'learning_rate': 0.11222605418852105, 'iterations': 219, 'l2_leaf_reg': 5.2280690633116296e-08, 'border_count': 37, 'bagging_temperature': 0.08014910200777461, 'random_strength': 1.5379391500526884, 'grow_policy': 'Lossguide', 'min_data_in_leaf': 823, 'max_leaves': 112}. Best is trial 738 with value: 78.71473735766027.[0m
[32m[I 2024-10-13 13:56:26,280][0m Trial 842 finished with value: 81.53805864239055 and parameters: {'depth': 6, 'learning_rate': 0.26271605995517444, 'iterations': 144, 'l2_leaf_reg': 1.031990565646412e-08, 'border_count': 30, 'bagging_temperature': 0.14104362343041915, 'random_strength': 8.751450226973128, 'grow_policy': 'Lossguide', 'min_data_in_leaf': 447, 'max_leaves': 137}. Best is trial 738 with value: 78.71473735766027.[0m
[32m[I 2024-10-13 13:56:26,905][0m Trial 843 finished with value: 80.24565357679413 and parameters: {'depth': 14, 'learning_rate': 0.13786562975122843, 'iterations': 100, 'l2_leaf_reg': 2.433173476835109e-08, 'border_count': 23, 'bagging_temperature': 0.16832740457319775, 'random_strength': 9.85413332761895, 'grow_policy': 'Lossguide', 'min_data_in_leaf': 523, 'max_leaves': 132}. Best is trial 738 with value: 78.71473735766027.[0m
[32m[I 2024-10-13 13:56:27,559][0m Trial 844 finished with value: 123.38123897674932 and parameters: {'depth': 14, 'learning_rate': 0.1426075861943803, 'iterations': 140, 'l2_leaf_reg': 3.091989058377783e-08, 'border_count': 5, 'bagging_temperature': 0.16220707349604788, 'random_strength': 9.980525824479498, 'grow_policy': 'Lossguide', 'min_data_in_leaf': 524, 'max_leaves': 130}. Best is trial 738 with value: 78.71473735766027.[0m
[32m[I 2024-10-13 13:56:28,187][0m Trial 845 finished with value: 93.67417272955815 and parameters: {'depth': 14, 'learning_rate': 0.15255154023303727, 'iterations': 102, 'l2_leaf_reg': 2.3773487828133343e-08, 'border_count': 14, 'bagging_temperature': 0.146452389417938, 'random_strength': 9.891742230637911, 'grow_policy': 'Lossguide', 'min_data_in_leaf': 495, 'max_leaves': 132}. Best is trial 738 with value: 78.71473735766027.[0m
[32m[I 2024-10-13 13:56:32,299][0m Trial 846 finished with value: 203.4624935599366 and parameters: {'depth': 14, 'learning_rate': 0.006313638134359225, 'iterations': 101, 'l2_leaf_reg': 3.85015613881711e-08, 'border_count': 11, 'bagging_temperature': 0.16277655167200772, 'random_strength': 9.83620522400533, 'grow_policy': 'SymmetricTree', 'min_data_in_leaf': 515}. Best is trial 738 with value: 78.71473735766027.[0m
[32m[I 2024-10-13 13:56:32,826][0m Trial 847 finished with value: 93.924786358837 and parameters: {'depth': 14, 'learning_rate': 0.13070510595254325, 'iterations': 102, 'l2_leaf_reg': 1.0049294887776657e-08, 'border_count': 18, 'bagging_temperature': 0.12765847780850356, 'random_strength': 9.674615982817826, 'grow_policy': 'Lossguide', 'min_data_in_leaf': 480, 'max_leaves': 124}. Best is trial 738 with value: 78.71473735766027.[0m
[32m[I 2024-10-13 13:56:33,511][0m Trial 848 finished with value: 94.708406033941 and parameters: {'depth': 9, 'learning_rate': 0.18437654295649594, 'iterations': 178, 'l2_leaf_reg': 2.0331167813791896e-08, 'border_count': 22, 'bagging_temperature': 0.17733059733671241, 'random_strength': 9.800184156111138, 'grow_policy': 'Lossguide', 'min_data_in_leaf': 533, 'max_leaves': 127}. Best is trial 738 with value: 78.71473735766027.[0m
[32m[I 2024-10-13 13:56:34,170][0m Trial 849 finished with value: 92.4201966569191 and parameters: {'depth': 14, 'learning_rate': 0.1519656864564871, 'iterations': 162, 'l2_leaf_reg': 7.212551952165627e-08, 'border_count': 16, 'bagging_temperature': 0.100421480876113, 'random_strength': 9.535937942485711, 'grow_policy': 'Lossguide', 'min_data_in_leaf': 505, 'max_leaves': 151}. Best is trial 738 with value: 78.71473735766027.[0m
[32m[I 2024-10-13 13:56:34,904][0m Trial 850 finished with value: 81.08978091362408 and parameters: {'depth': 9, 'learning_rate': 0.12564657768591156, 'iterations': 187, 'l2_leaf_reg': 2.0028612797996134e-08, 'border_count': 23, 'bagging_temperature': 0.13963401145616472, 'random_strength': 9.632806923456942, 'grow_policy': 'Lossguide', 'min_data_in_leaf': 461, 'max_leaves': 135}. Best is trial 738 with value: 78.71473735766027.[0m
