[32m[I 2024-10-13 13:54:01,076][0m Trial 701 finished with value: 100.88324952686006 and parameters: {'depth': 7, 'learning_rate': 0.07327787402472921, 'iterations': 367, 'l2_leaf_reg': 1.5158234924206553e-08, 'border_count': 132, 'bagging_temperature': 0.19657197156927675, 'random_strength': 9.825460358234597, 'grow_policy': 'Lossguide', 'min_data_in_leaf': 428, 'max_leaves': 134}. Best is trial 544 with value: 79.23314367466817.[0m
[32m[I 2024-10-13 13:54:01,848][0m Trial 702 finished with value: 89.46830381011686 and parameters: {'depth': 7, 'learning_rate': 0.21433979361396305, 'iterations': 310, 'l2_leaf_reg': 1.808826814422855e-08, 'border_count': 13, 'bagging_temperature': 0.19219053435876768, 'random_strength': 9.734544116708983, 'grow_policy': 'Lossguide', 'min_data_in_leaf': 410, 'max_leaves': 140}. Best is trial 544 with value: 79.23314367466817.[0m
[32m[I 2024-10-13 13:54:02,573][0m Trial 703 finished with value: 89.0117640518588 and parameters: {'depth': 7, 'learning_rate': 0.07836127725765586, 'iterations': 268, 'l2_leaf_reg': 1.0338028093744136e-08, 'border_count': 31, 'bagging_temperature': 0.7909731003414789, 'random_strength': 9.598206990755749, 'grow_policy': 'Lossguide', 'min_data_in_leaf': 450, 'max_leaves': 137}. Best is trial 544 with value: 79.23314367466817.[0m
[32m[I 2024-10-13 13:54:04,088][0m Trial 704 finished with value: 94.8577206319124 and parameters: {'depth': 7, 'learning_rate': 0.07147897035047054, 'iterations': 1256, 'l2_leaf_reg': 1.4265753730624674e-08, 'border_count': 25, 'bagging_temperature': 0.0794928600033275, 'random_strength': 9.80989097828927, 'grow_policy': 'Lossguide', 'min_data_in_leaf': 423, 'max_leaves': 130}. Best is trial 544 with value: 79.23314367466817.[0m
[32m[I 2024-10-13 13:54:04,952][0m Trial 705 finished with value: 93.7574636540398 and parameters: {'depth': 7, 'learning_rate': 0.07146132811838281, 'iterations': 372, 'l2_leaf_reg': 2.4423479549749764e-08, 'border_count': 19, 'bagging_temperature': 0.01274980303832126, 'random_strength': 9.629768863221097, 'grow_policy': 'Lossguide', 'min_data_in_leaf': 461, 'max_leaves': 121}. Best is trial 544 with value: 79.23314367466817.[0m
[32m[I 2024-10-13 13:54:06,206][0m Trial 706 finished with value: 108.7763909271448 and parameters: {'depth': 8, 'learning_rate': 0.16634019934412705, 'iterations': 999, 'l2_leaf_reg': 1.001855514978178e-08, 'border_count': 30, 'bagging_temperature': 0.049157579592205236, 'random_strength': 2.250440272772562, 'grow_policy': 'Lossguide', 'min_data_in_leaf': 438, 'max_leaves': 192}. Best is trial 544 with value: 79.23314367466817.[0m
[32m[I 2024-10-13 13:54:06,971][0m Trial 707 finished with value: 90.3943977679337 and parameters: {'depth': 7, 'learning_rate': 0.24435166646013112, 'iterations': 249, 'l2_leaf_reg': 1.563354748833084e-08, 'border_count': 36, 'bagging_temperature': 0.10395140427514453, 'random_strength': 9.467260252533356, 'grow_policy': 'Lossguide', 'min_data_in_leaf': 472, 'max_leaves': 142}. Best is trial 544 with value: 79.23314367466817.[0m
[32m[I 2024-10-13 13:54:07,751][0m Trial 708 finished with value: 88.99630787652795 and parameters: {'depth': 7, 'learning_rate': 0.14595300928501595, 'iterations': 324, 'l2_leaf_reg': 2.724112846290981e-08, 'border_count': 46, 'bagging_temperature': 0.19171467062358294, 'random_strength': 9.858612370103922, 'grow_policy': 'Lossguide', 'min_data_in_leaf': 475, 'max_leaves': 134}. Best is trial 544 with value: 79.23314367466817.[0m
[32m[I 2024-10-13 13:54:08,472][0m Trial 709 finished with value: 86.48731847994219 and parameters: {'depth': 8, 'learning_rate': 0.08133850620338184, 'iterations': 219, 'l2_leaf_reg': 1.5573925885881905e-08, 'border_count': 25, 'bagging_temperature': 0.17855114978922357, 'random_strength': 9.167739346035589, 'grow_policy': 'Lossguide', 'min_data_in_leaf': 385, 'max_leaves': 197}. Best is trial 544 with value: 79.23314367466817.[0m
[32m[I 2024-10-13 13:54:09,214][0m Trial 710 finished with value: 91.22940607150002 and parameters: {'depth': 6, 'learning_rate': 0.09408255973283976, 'iterations': 277, 'l2_leaf_reg': 1.9759519108487803e-08, 'border_count': 17, 'bagging_temperature': 0.07044229818531425, 'random_strength': 9.617825036647035, 'grow_policy': 'Lossguide', 'min_data_in_leaf': 457, 'max_leaves': 144}. Best is trial 544 with value: 79.23314367466817.[0m
[32m[I 2024-10-13 13:54:09,935][0m Trial 711 finished with value: 84.73923501524104 and parameters: {'depth': 7, 'learning_rate': 0.12368147868057928, 'iterations': 193, 'l2_leaf_reg': 3.434755116140998e-08, 'border_count': 40, 'bagging_temperature': 0.11432708447612616, 'random_strength': 9.404157346437062, 'grow_policy': 'Lossguide', 'min_data_in_leaf': 474, 'max_leaves': 100}. Best is trial 544 with value: 79.23314367466817.[0m
[32m[I 2024-10-13 13:54:10,607][0m Trial 712 finished with value: 89.69037904364063 and parameters: {'depth': 9, 'learning_rate': 0.17636753972273672, 'iterations': 148, 'l2_leaf_reg': 1.57009956016548e-08, 'border_count': 31, 'bagging_temperature': 0.20002883128128507, 'random_strength': 9.735739085507895, 'grow_policy': 'Lossguide', 'min_data_in_leaf': 440, 'max_leaves': 141}. Best is trial 544 with value: 79.23314367466817.[0m
[32m[I 2024-10-13 13:54:11,419][0m Trial 713 finished with value: 81.05490494412338 and parameters: {'depth': 7, 'learning_rate': 0.07041492415467702, 'iterations': 363, 'l2_leaf_reg': 2.6464524846622652e-08, 'border_count': 23, 'bagging_temperature': 0.1489263621247901, 'random_strength': 9.254613454331112, 'grow_policy': 'Lossguide', 'min_data_in_leaf': 815, 'max_leaves': 106}. Best is trial 544 with value: 79.23314367466817.[0m
[32m[I 2024-10-13 13:54:28,972][0m Trial 714 finished with value: 122.18833064318957 and parameters: {'depth': 15, 'learning_rate': 0.10010985305744403, 'iterations': 249, 'l2_leaf_reg': 1.458797036292784e-08, 'border_count': 11, 'bagging_temperature': 0.0908244919435618, 'random_strength': 9.067329487687509, 'grow_policy': 'SymmetricTree', 'min_data_in_leaf': 457}. Best is trial 544 with value: 79.23314367466817.[0m
[32m[I 2024-10-13 13:54:29,595][0m Trial 715 finished with value: 98.01666381069622 and parameters: {'depth': 8, 'learning_rate': 0.204357105522276, 'iterations': 311, 'l2_leaf_reg': 2.6040197749647908e-06, 'border_count': 28, 'bagging_temperature': 0.04989052527632528, 'random_strength': 9.491457330261229, 'grow_policy': 'Lossguide', 'min_data_in_leaf': 486, 'max_leaves': 127}. Best is trial 544 with value: 79.23314367466817.[0m
[32m[I 2024-10-13 13:54:30,317][0m Trial 716 finished with value: 272.9360368352327 and parameters: {'depth': 6, 'learning_rate': 0.06653691148924298, 'iterations': 200, 'l2_leaf_reg': 1.4127943636804466e-06, 'border_count': 1, 'bagging_temperature': 0.002390656059297107, 'random_strength': 9.877666513444186, 'grow_policy': 'Lossguide', 'min_data_in_leaf': 496, 'max_leaves': 137}. Best is trial 544 with value: 79.23314367466817.[0m
[32m[I 2024-10-13 13:54:31,017][0m Trial 717 finished with value: 91.62610525118177 and parameters: {'depth': 6, 'learning_rate': 0.265154193502816, 'iterations': 157, 'l2_leaf_reg': 3.502764730090059e-08, 'border_count': 33, 'bagging_temperature': 0.20839677136576107, 'random_strength': 9.359519771656649, 'grow_policy': 'Lossguide', 'min_data_in_leaf': 418, 'max_leaves': 58}. Best is trial 544 with value: 79.23314367466817.[0m
[32m[I 2024-10-13 13:54:31,676][0m Trial 718 finished with value: 92.95487978282664 and parameters: {'depth': 7, 'learning_rate': 0.08564105033262709, 'iterations': 101, 'l2_leaf_reg': 2.2910429279151995e-08, 'border_count': 19, 'bagging_temperature': 0.1361592665584091, 'random_strength': 8.923449834795763, 'grow_policy': 'Lossguide', 'min_data_in_leaf': 227, 'max_leaves': 147}. Best is trial 544 with value: 79.23314367466817.[0m
[32m[I 2024-10-13 13:54:32,395][0m Trial 719 finished with value: 84.40786279390085 and parameters: {'depth': 9, 'learning_rate': 0.11529816649500269, 'iterations': 235, 'l2_leaf_reg': 1.3130207225006766e-08, 'border_count': 38, 'bagging_temperature': 0.16058159558137475, 'random_strength': 9.644184647042835, 'grow_policy': 'Lossguide', 'min_data_in_leaf': 922, 'max_leaves': 139}. Best is trial 544 with value: 79.23314367466817.[0m
[32m[I 2024-10-13 13:54:33,170][0m Trial 720 finished with value: 89.68386812147587 and parameters: {'depth': 9, 'learning_rate': 0.14526731076968882, 'iterations': 287, 'l2_leaf_reg': 1.8938249214772057e-08, 'border_count': 25, 'bagging_temperature': 0.11455364132218443, 'random_strength': 9.16693377262354, 'grow_policy': 'Lossguide', 'min_data_in_leaf': 480, 'max_leaves': 146}. Best is trial 544 with value: 79.23314367466817.[0m
[32m[I 2024-10-13 13:54:33,847][0m Trial 721 finished with value: 93.76232091404609 and parameters: {'depth': 7, 'learning_rate': 0.110006113033282, 'iterations': 197, 'l2_leaf_reg': 4.610078993016079e-08, 'border_count': 15, 'bagging_temperature': 0.17878523608939337, 'random_strength': 9.328495118838005, 'grow_policy': 'Lossguide', 'min_data_in_leaf': 599, 'max_leaves': 130}. Best is trial 544 with value: 79.23314367466817.[0m
[32m[I 2024-10-13 13:54:34,651][0m Trial 722 finished with value: 144.84559109848175 and parameters: {'depth': 14, 'learning_rate': 0.005247625575235366, 'iterations': 361, 'l2_leaf_reg': 1.0629171958875962e-08, 'border_count': 157, 'bagging_temperature': 0.06789448342303413, 'random_strength': 9.859226275053214, 'grow_policy': 'Lossguide', 'min_data_in_leaf': 661, 'max_leaves': 115}. Best is trial 544 with value: 79.23314367466817.[0m
[32m[I 2024-10-13 13:54:37,054][0m Trial 723 finished with value: 104.57505788684885 and parameters: {'depth': 8, 'learning_rate': 0.07680107024553691, 'iterations': 2479, 'l2_leaf_reg': 2.928669970619497e-08, 'border_count': 22, 'bagging_temperature': 0.02388675075991619, 'random_strength': 9.559933378229838, 'grow_policy': 'Depthwise', 'min_data_in_leaf': 464}. Best is trial 544 with value: 79.23314367466817.[0m
[32m[I 2024-10-13 13:54:37,733][0m Trial 724 finished with value: 82.96693658675449 and parameters: {'depth': 6, 'learning_rate': 0.16616362035440632, 'iterations': 153, 'l2_leaf_reg': 1.0219565588868987e-08, 'border_count': 34, 'bagging_temperature': 0.21509649249993595, 'random_strength': 9.993946888851461, 'grow_policy': 'Lossguide', 'min_data_in_leaf': 198, 'max_leaves': 123}. Best is trial 544 with value: 79.23314367466817.[0m
[32m[I 2024-10-13 13:54:40,444][0m Trial 725 finished with value: 136.91971784104416 and parameters: {'depth': 15, 'learning_rate': 0.29773033576596697, 'iterations': 2984, 'l2_leaf_reg': 5.902734063858515e-08, 'border_count': 28, 'bagging_temperature': 0.13921017939905608, 'random_strength': 8.733204303993357, 'grow_policy': 'Lossguide', 'min_data_in_leaf': 629, 'max_leaves': 143}. Best is trial 544 with value: 79.23314367466817.[0m
[32m[I 2024-10-13 13:54:41,189][0m Trial 726 finished with value: 84.67304977652648 and parameters: {'depth': 9, 'learning_rate': 0.09183234406847655, 'iterations': 252, 'l2_leaf_reg': 2.1415997730562394e-08, 'border_count': 41, 'bagging_temperature': 0.5485495299298043, 'random_strength': 9.070778645972048, 'grow_policy': 'Lossguide', 'min_data_in_leaf': 486, 'max_leaves': 111}. Best is trial 544 with value: 79.23314367466817.[0m
[32m[I 2024-10-13 13:54:41,802][0m Trial 727 finished with value: 99.96501087810142 and parameters: {'depth': 7, 'learning_rate': 0.13417648881931918, 'iterations': 102, 'l2_leaf_reg': 1.0015514877818003e-08, 'border_count': 221, 'bagging_temperature': 0.09338465057971479, 'random_strength': 9.615410144776849, 'grow_policy': 'Lossguide', 'min_data_in_leaf': 275, 'max_leaves': 134}. Best is trial 544 with value: 79.23314367466817.[0m
[32m[I 2024-10-13 13:54:42,605][0m Trial 728 finished with value: 114.57776079463062 and parameters: {'depth': 6, 'learning_rate': 0.19241603783621652, 'iterations': 295, 'l2_leaf_reg': 3.5741781747800916e-08, 'border_count': 8, 'bagging_temperature': 0.1933206938028063, 'random_strength': 9.384341522803426, 'grow_policy': 'Lossguide', 'min_data_in_leaf': 178, 'max_leaves': 148}. Best is trial 544 with value: 79.23314367466817.[0m
[32m[I 2024-10-13 13:54:43,283][0m Trial 729 finished with value: 91.23766941092225 and parameters: {'depth': 8, 'learning_rate': 0.06583170007631539, 'iterations': 205, 'l2_leaf_reg': 7.66122619380587e-08, 'border_count': 20, 'bagging_temperature': 0.1706624886997571, 'random_strength': 9.717228839672476, 'grow_policy': 'Lossguide', 'min_data_in_leaf': 511, 'max_leaves': 138}. Best is trial 544 with value: 79.23314367466817.[0m
[32m[I 2024-10-13 13:54:45,325][0m Trial 730 finished with value: 112.17052763366355 and parameters: {'depth': 5, 'learning_rate': 0.10931744636902015, 'iterations': 2044, 'l2_leaf_reg': 2.3421577437787146e-08, 'border_count': 30, 'bagging_temperature': 0.11521773208339166, 'random_strength': 9.25978456429515, 'grow_policy': 'Lossguide', 'min_data_in_leaf': 407, 'max_leaves': 151}. Best is trial 544 with value: 79.23314367466817.[0m
[32m[I 2024-10-13 13:54:45,959][0m Trial 731 finished with value: 96.73330601190698 and parameters: {'depth': 7, 'learning_rate': 0.23583379469914767, 'iterations': 144, 'l2_leaf_reg': 1.4879071070642338e-08, 'border_count': 53, 'bagging_temperature': 0.1446091581944166, 'random_strength': 8.994713801398822, 'grow_policy': 'Lossguide', 'min_data_in_leaf': 444, 'max_leaves': 142}. Best is trial 544 with value: 79.23314367466817.[0m
[32m[I 2024-10-13 13:54:47,500][0m Trial 732 finished with value: 117.69639867399705 and parameters: {'depth': 9, 'learning_rate': 0.08449075848978435, 'iterations': 1331, 'l2_leaf_reg': 3.669005555373717e-08, 'border_count': 146, 'bagging_temperature': 0.05341978378407556, 'random_strength': 9.413466005124489, 'grow_policy': 'Lossguide', 'min_data_in_leaf': 503, 'max_leaves': 158}. Best is trial 544 with value: 79.23314367466817.[0m
[32m[I 2024-10-13 13:54:48,211][0m Trial 733 finished with value: 88.28341354570689 and parameters: {'depth': 14, 'learning_rate': 0.14981476181779485, 'iterations': 237, 'l2_leaf_reg': 1.9727072308421126e-08, 'border_count': 35, 'bagging_temperature': 0.2108371356157141, 'random_strength': 2.0917568020448165, 'grow_policy': 'Lossguide', 'min_data_in_leaf': 897, 'max_leaves': 145}. Best is trial 544 with value: 79.23314367466817.[0m
[32m[I 2024-10-13 13:54:49,007][0m Trial 734 finished with value: 91.92183693540942 and parameters: {'depth': 6, 'learning_rate': 0.1257150941698476, 'iterations': 324, 'l2_leaf_reg': 5.640824136916398e-08, 'border_count': 14, 'bagging_temperature': 0.0331676465705928, 'random_strength': 2.3678375811047316, 'grow_policy': 'Lossguide', 'min_data_in_leaf': 571, 'max_leaves': 153}. Best is trial 544 with value: 79.23314367466817.[0m
[32m[I 2024-10-13 13:54:50,180][0m Trial 735 finished with value: 95.74451572661988 and parameters: {'depth': 7, 'learning_rate': 0.07155009583136905, 'iterations': 387, 'l2_leaf_reg': 1.510768838182613e-08, 'border_count': 25, 'bagging_temperature': 0.07646816051539164, 'random_strength': 9.758773349349738, 'grow_policy': 'SymmetricTree', 'min_data_in_leaf': 139}. Best is trial 544 with value: 79.23314367466817.[0m
[32m[I 2024-10-13 13:54:50,831][0m Trial 736 finished with value: 92.09881399576715 and parameters: {'depth': 8, 'learning_rate': 0.09941269271462036, 'iterations': 151, 'l2_leaf_reg': 2.9877177719277e-08, 'border_count': 21, 'bagging_temperature': 0.09993996904367372, 'random_strength': 8.884618652204875, 'grow_policy': 'Lossguide', 'min_data_in_leaf': 460, 'max_leaves': 105}. Best is trial 544 with value: 79.23314367466817.[0m
[32m[I 2024-10-13 13:54:51,499][0m Trial 737 finished with value: 91.35973472821868 and parameters: {'depth': 15, 'learning_rate': 0.19677255070013394, 'iterations': 202, 'l2_leaf_reg': 1.2336363584263988e-07, 'border_count': 29, 'bagging_temperature': 0.15878458716203753, 'random_strength': 9.986881810160167, 'grow_policy': 'Lossguide', 'min_data_in_leaf': 516, 'max_leaves': 133}. Best is trial 544 with value: 79.23314367466817.[0m
[32m[I 2024-10-13 13:54:52,248][0m Trial 738 finished with value: 78.71473735766027 and parameters: {'depth': 14, 'learning_rate': 0.06227516755714044, 'iterations': 272, 'l2_leaf_reg': 1.9296783876008976e-08, 'border_count': 34, 'bagging_temperature': 0.12200895454613324, 'random_strength': 9.533694347039422, 'grow_policy': 'Lossguide', 'min_data_in_leaf': 429, 'max_leaves': 118}. Best is trial 738 with value: 78.71473735766027.[0m
[32m[I 2024-10-13 13:54:53,023][0m Trial 739 finished with value: 82.29795455079628 and parameters: {'depth': 14, 'learning_rate': 0.060625971566585383, 'iterations': 246, 'l2_leaf_reg': 2.0589713015832553e-08, 'border_count': 46, 'bagging_temperature': 0.12739916065690263, 'random_strength': 9.51604013673312, 'grow_policy': 'Lossguide', 'min_data_in_leaf': 438, 'max_leaves': 120}. Best is trial 738 with value: 78.71473735766027.[0m
[32m[I 2024-10-13 13:54:53,703][0m Trial 740 finished with value: 83.05429319242069 and parameters: {'depth': 14, 'learning_rate': 0.16205697364789717, 'iterations': 153, 'l2_leaf_reg': 4.379203467015065e-08, 'border_count': 42, 'bagging_temperature': 0.10968285286409783, 'random_strength': 9.570616439237279, 'grow_policy': 'Lossguide', 'min_data_in_leaf': 423, 'max_leaves': 120}. Best is trial 738 with value: 78.71473735766027.[0m
[32m[I 2024-10-13 13:54:54,326][0m Trial 741 finished with value: 82.17924830309369 and parameters: {'depth': 14, 'learning_rate': 0.12426232119303965, 'iterations': 105, 'l2_leaf_reg': 1.461842765990473e-08, 'border_count': 38, 'bagging_temperature': 0.12466499694787496, 'random_strength': 9.250819904436225, 'grow_policy': 'Lossguide', 'min_data_in_leaf': 452, 'max_leaves': 124}. Best is trial 738 with value: 78.71473735766027.[0m
[32m[I 2024-10-13 13:54:55,028][0m Trial 742 finished with value: 90.03241783707213 and parameters: {'depth': 14, 'learning_rate': 0.2449994573174492, 'iterations': 204, 'l2_leaf_reg': 2.5818923161823305e-08, 'border_count': 35, 'bagging_temperature': 0.08825526997574124, 'random_strength': 9.74955659338618, 'grow_policy': 'Lossguide', 'min_data_in_leaf': 471, 'max_leaves': 116}. Best is trial 738 with value: 78.71473735766027.[0m
[32m[I 2024-10-13 13:54:55,763][0m Trial 743 finished with value: 85.15153473937877 and parameters: {'depth': 14, 'learning_rate': 0.08013259659195157, 'iterations': 276, 'l2_leaf_reg': 1.001319930588957e-08, 'border_count': 44, 'bagging_temperature': 0.13899542249144545, 'random_strength': 9.454872253185869, 'grow_policy': 'Lossguide', 'min_data_in_leaf': 428, 'max_leaves': 126}. Best is trial 738 with value: 78.71473735766027.[0m
[32m[I 2024-10-13 13:54:56,379][0m Trial 744 finished with value: 83.76302092216139 and parameters: {'depth': 14, 'learning_rate': 0.10633317791340818, 'iterations': 102, 'l2_leaf_reg': 2.0409293821235806e-08, 'border_count': 33, 'bagging_temperature': 0.10522240308384422, 'random_strength': 9.151767642816582, 'grow_policy': 'Lossguide', 'min_data_in_leaf': 445, 'max_leaves': 130}. Best is trial 738 with value: 78.71473735766027.[0m
[32m[I 2024-10-13 13:54:57,227][0m Trial 745 finished with value: 102.1701879907009 and parameters: {'depth': 14, 'learning_rate': 0.0615815458863875, 'iterations': 191, 'l2_leaf_reg': 3.099326222893892e-08, 'border_count': 49, 'bagging_temperature': 0.15149120441683256, 'random_strength': 9.823668748466263, 'grow_policy': 'Lossguide', 'min_data_in_leaf': 51, 'max_leaves': 116}. Best is trial 738 with value: 78.71473735766027.[0m
[32m[I 2024-10-13 13:54:58,015][0m Trial 746 finished with value: 86.46898336965522 and parameters: {'depth': 14, 'learning_rate': 0.09224085498364137, 'iterations': 303, 'l2_leaf_reg': 1.6679039534931382e-08, 'border_count': 39, 'bagging_temperature': 0.12685388502145856, 'random_strength': 9.621706582508683, 'grow_policy': 'Depthwise', 'min_data_in_leaf': 477}. Best is trial 738 with value: 78.71473735766027.[0m
[32m[I 2024-10-13 13:54:58,732][0m Trial 747 finished with value: 89.0127659369681 and parameters: {'depth': 15, 'learning_rate': 0.15003344987987852, 'iterations': 225, 'l2_leaf_reg': 4.557663597482613e-08, 'border_count': 31, 'bagging_temperature': 0.09863524923256303, 'random_strength': 9.347496875165508, 'grow_policy': 'Lossguide', 'min_data_in_leaf': 490, 'max_leaves': 204}. Best is trial 738 with value: 78.71473735766027.[0m
[32m[I 2024-10-13 13:54:59,400][0m Trial 748 finished with value: 85.05340664737122 and parameters: {'depth': 14, 'learning_rate': 0.224547193487324, 'iterations': 157, 'l2_leaf_reg': 1.462178145269868e-08, 'border_count': 37, 'bagging_temperature': 0.05629111406665771, 'random_strength': 9.082248913028506, 'grow_policy': 'Lossguide', 'min_data_in_leaf': 460, 'max_leaves': 119}. Best is trial 738 with value: 78.71473735766027.[0m
[32m[I 2024-10-13 13:55:00,195][0m Trial 749 finished with value: 89.95962529500648 and parameters: {'depth': 6, 'learning_rate': 0.12911373325986827, 'iterations': 350, 'l2_leaf_reg': 2.4765181686095346e-08, 'border_count': 29, 'bagging_temperature': 0.17064363680285893, 'random_strength': 9.491023498349772, 'grow_policy': 'Lossguide', 'min_data_in_leaf': 499, 'max_leaves': 110}. Best is trial 738 with value: 78.71473735766027.[0m
[32m[I 2024-10-13 13:55:00,936][0m Trial 750 finished with value: 87.78958030361422 and parameters: {'depth': 15, 'learning_rate': 0.07270373500873828, 'iterations': 259, 'l2_leaf_reg': 3.5495551766231386e-08, 'border_count': 27, 'bagging_temperature': 0.0795007102863301, 'random_strength': 9.971576674832344, 'grow_policy': 'Lossguide', 'min_data_in_leaf': 575, 'max_leaves': 112}. Best is trial 738 with value: 78.71473735766027.[0m
