[32m[I 2024-10-13 13:46:51,659][0m Trial 301 finished with value: 94.64949569497148 and parameters: {'depth': 11, 'learning_rate': 0.09113484100556356, 'iterations': 731, 'l2_leaf_reg': 0.0010056329623237355, 'border_count': 31, 'bagging_temperature': 0.21901611951820477, 'random_strength': 3.3206104360253326, 'grow_policy': 'Lossguide', 'min_data_in_leaf': 945, 'max_leaves': 172}. Best is trial 280 with value: 79.877599423719.[0m
[32m[I 2024-10-13 13:46:52,523][0m Trial 302 finished with value: 84.24769305107819 and parameters: {'depth': 14, 'learning_rate': 0.04794340150702048, 'iterations': 430, 'l2_leaf_reg': 0.005007204639743959, 'border_count': 44, 'bagging_temperature': 0.271399209707242, 'random_strength': 2.8703791045479794, 'grow_policy': 'Lossguide', 'min_data_in_leaf': 538, 'max_leaves': 149}. Best is trial 280 with value: 79.877599423719.[0m
[32m[I 2024-10-13 13:47:07,447][0m Trial 303 finished with value: 103.55934185619235 and parameters: {'depth': 10, 'learning_rate': 0.03847428996799976, 'iterations': 610, 'l2_leaf_reg': 0.0003195307605981698, 'border_count': 140, 'bagging_temperature': 0.7518027674162677, 'random_strength': 3.139630573233144, 'grow_policy': 'SymmetricTree', 'min_data_in_leaf': 570}. Best is trial 280 with value: 79.877599423719.[0m
[32m[I 2024-10-13 13:47:08,107][0m Trial 304 finished with value: 87.66822934622846 and parameters: {'depth': 10, 'learning_rate': 0.05879617194162303, 'iterations': 222, 'l2_leaf_reg': 0.000512168766247449, 'border_count': 26, 'bagging_temperature': 0.2039553561767981, 'random_strength': 3.9019747429035627, 'grow_policy': 'Lossguide', 'min_data_in_leaf': 937, 'max_leaves': 138}. Best is trial 280 with value: 79.877599423719.[0m
[32m[I 2024-10-13 13:47:08,995][0m Trial 305 finished with value: 90.43519310511292 and parameters: {'depth': 9, 'learning_rate': 0.1495599151586945, 'iterations': 373, 'l2_leaf_reg': 0.0019631232673496136, 'border_count': 34, 'bagging_temperature': 0.23685026670176718, 'random_strength': 3.6255512035896507, 'grow_policy': 'Lossguide', 'min_data_in_leaf': 552, 'max_leaves': 146}. Best is trial 280 with value: 79.877599423719.[0m
[32m[I 2024-10-13 13:47:09,707][0m Trial 306 finished with value: 92.06454566839822 and parameters: {'depth': 11, 'learning_rate': 0.06805369561638747, 'iterations': 315, 'l2_leaf_reg': 0.00012387161976487192, 'border_count': 21, 'bagging_temperature': 0.1788471327024661, 'random_strength': 2.598011554064385, 'grow_policy': 'Lossguide', 'min_data_in_leaf': 517, 'max_leaves': 157}. Best is trial 280 with value: 79.877599423719.[0m
[32m[I 2024-10-13 13:47:10,618][0m Trial 307 finished with value: 92.11779291307603 and parameters: {'depth': 10, 'learning_rate': 0.05135048019519015, 'iterations': 489, 'l2_leaf_reg': 0.000276614476984935, 'border_count': 13, 'bagging_temperature': 0.14253832069940667, 'random_strength': 3.449456739729522, 'grow_policy': 'Lossguide', 'min_data_in_leaf': 536, 'max_leaves': 164}. Best is trial 280 with value: 79.877599423719.[0m
[32m[I 2024-10-13 13:47:11,343][0m Trial 308 finished with value: 87.662389295665 and parameters: {'depth': 9, 'learning_rate': 0.04367794165664546, 'iterations': 170, 'l2_leaf_reg': 0.00107759175139403, 'border_count': 40, 'bagging_temperature': 0.26597228179294063, 'random_strength': 3.0673212763128674, 'grow_policy': 'Lossguide', 'min_data_in_leaf': 580, 'max_leaves': 152}. Best is trial 280 with value: 79.877599423719.[0m
[32m[I 2024-10-13 13:47:12,200][0m Trial 309 finished with value: 84.18223148363569 and parameters: {'depth': 12, 'learning_rate': 0.029128025167610552, 'iterations': 412, 'l2_leaf_reg': 4.56244338913458e-05, 'border_count': 30, 'bagging_temperature': 0.24664103394018888, 'random_strength': 4.290420963151549, 'grow_policy': 'Lossguide', 'min_data_in_leaf': 723, 'max_leaves': 142}. Best is trial 280 with value: 79.877599423719.[0m
[32m[I 2024-10-13 13:47:12,916][0m Trial 310 finished with value: 95.79401413359922 and parameters: {'depth': 11, 'learning_rate': 0.03503604156165714, 'iterations': 235, 'l2_leaf_reg': 0.0007231517772131482, 'border_count': 54, 'bagging_temperature': 0.2135329487159822, 'random_strength': 3.244116122947545, 'grow_policy': 'Lossguide', 'min_data_in_leaf': 508, 'max_leaves': 149}. Best is trial 280 with value: 79.877599423719.[0m
[32m[I 2024-10-13 13:47:13,709][0m Trial 311 finished with value: 81.01234746260701 and parameters: {'depth': 10, 'learning_rate': 0.06684926838854843, 'iterations': 285, 'l2_leaf_reg': 0.00017943005871475597, 'border_count': 23, 'bagging_temperature': 0.23254287100630774, 'random_strength': 3.6792244026614016, 'grow_policy': 'Lossguide', 'min_data_in_leaf': 375, 'max_leaves': 157}. Best is trial 280 with value: 79.877599423719.[0m
[32m[I 2024-10-13 13:47:14,444][0m Trial 312 finished with value: 90.76752564624941 and parameters: {'depth': 10, 'learning_rate': 0.07998869611833723, 'iterations': 274, 'l2_leaf_reg': 0.00023230309307715482, 'border_count': 17, 'bagging_temperature': 0.2377953957650783, 'random_strength': 3.636358217771061, 'grow_policy': 'Lossguide', 'min_data_in_leaf': 347, 'max_leaves': 161}. Best is trial 280 with value: 79.877599423719.[0m
[32m[I 2024-10-13 13:47:15,095][0m Trial 313 finished with value: 97.18960791881804 and parameters: {'depth': 9, 'learning_rate': 0.06601114077714475, 'iterations': 116, 'l2_leaf_reg': 7.960513130081546e-05, 'border_count': 22, 'bagging_temperature': 0.9796390655982676, 'random_strength': 3.804719495222661, 'grow_policy': 'Lossguide', 'min_data_in_leaf': 352, 'max_leaves': 157}. Best is trial 280 with value: 79.877599423719.[0m
[32m[I 2024-10-13 13:47:15,847][0m Trial 314 finished with value: 86.2327444642549 and parameters: {'depth': 13, 'learning_rate': 0.06333181998586304, 'iterations': 325, 'l2_leaf_reg': 0.020224330678944254, 'border_count': 25, 'bagging_temperature': 0.2005955445221576, 'random_strength': 3.3859872582121975, 'grow_policy': 'Lossguide', 'min_data_in_leaf': 369, 'max_leaves': 154}. Best is trial 280 with value: 79.877599423719.[0m
[32m[I 2024-10-13 13:47:16,514][0m Trial 315 finished with value: 94.89017075080454 and parameters: {'depth': 10, 'learning_rate': 0.0528805688678724, 'iterations': 195, 'l2_leaf_reg': 0.0001680604832451787, 'border_count': 12, 'bagging_temperature': 0.22594144613895775, 'random_strength': 2.9749539049033835, 'grow_policy': 'Depthwise', 'min_data_in_leaf': 421}. Best is trial 280 with value: 79.877599423719.[0m
[32m[I 2024-10-13 13:47:17,485][0m Trial 316 finished with value: 89.21325222652975 and parameters: {'depth': 13, 'learning_rate': 0.09414980087374508, 'iterations': 559, 'l2_leaf_reg': 0.0003762988986660617, 'border_count': 37, 'bagging_temperature': 0.27601314760833673, 'random_strength': 3.4926344323194876, 'grow_policy': 'Lossguide', 'min_data_in_leaf': 384, 'max_leaves': 167}. Best is trial 280 with value: 79.877599423719.[0m
[32m[I 2024-10-13 13:47:18,235][0m Trial 317 finished with value: 89.31133405205433 and parameters: {'depth': 11, 'learning_rate': 0.07204732802943353, 'iterations': 283, 'l2_leaf_reg': 0.00014838337298744204, 'border_count': 27, 'bagging_temperature': 0.16583880156398478, 'random_strength': 2.7855224029767305, 'grow_policy': 'Lossguide', 'min_data_in_leaf': 385, 'max_leaves': 159}. Best is trial 280 with value: 79.877599423719.[0m
[32m[I 2024-10-13 13:47:19,063][0m Trial 318 finished with value: 85.86220521007154 and parameters: {'depth': 10, 'learning_rate': 0.023767604585842497, 'iterations': 378, 'l2_leaf_reg': 0.0004885772522961073, 'border_count': 47, 'bagging_temperature': 0.25360634133185805, 'random_strength': 3.280730015202991, 'grow_policy': 'Lossguide', 'min_data_in_leaf': 997, 'max_leaves': 151}. Best is trial 280 with value: 79.877599423719.[0m
[32m[I 2024-10-13 13:47:19,961][0m Trial 319 finished with value: 123.75915082597552 and parameters: {'depth': 14, 'learning_rate': 0.05778559504845835, 'iterations': 460, 'l2_leaf_reg': 0.001413085199410165, 'border_count': 5, 'bagging_temperature': 0.19166936378852772, 'random_strength': 3.677381181566526, 'grow_policy': 'Lossguide', 'min_data_in_leaf': 559, 'max_leaves': 236}. Best is trial 280 with value: 79.877599423719.[0m
[32m[I 2024-10-13 13:47:22,610][0m Trial 320 finished with value: 167.93780678663245 and parameters: {'depth': 9, 'learning_rate': 0.00058578875025054, 'iterations': 2572, 'l2_leaf_reg': 0.2618937185069573, 'border_count': 18, 'bagging_temperature': 0.2217286595966872, 'random_strength': 2.5069029850231397, 'grow_policy': 'Lossguide', 'min_data_in_leaf': 321, 'max_leaves': 146}. Best is trial 280 with value: 79.877599423719.[0m
[32m[I 2024-10-13 13:47:23,719][0m Trial 321 finished with value: 92.5649444407751 and parameters: {'depth': 12, 'learning_rate': 0.08278729799797156, 'iterations': 658, 'l2_leaf_reg': 0.00030357961908371377, 'border_count': 32, 'bagging_temperature': 0.23316674017070757, 'random_strength': 3.9559541905960547, 'grow_policy': 'Lossguide', 'min_data_in_leaf': 572, 'max_leaves': 154}. Best is trial 280 with value: 79.877599423719.[0m
[32m[I 2024-10-13 13:47:24,459][0m Trial 322 finished with value: 84.88572255048989 and parameters: {'depth': 11, 'learning_rate': 0.0472991804978644, 'iterations': 252, 'l2_leaf_reg': 0.0007473288646266179, 'border_count': 42, 'bagging_temperature': 0.2607165798448805, 'random_strength': 3.096692613437567, 'grow_policy': 'Lossguide', 'min_data_in_leaf': 537, 'max_leaves': 163}. Best is trial 280 with value: 79.877599423719.[0m
[32m[I 2024-10-13 13:47:25,219][0m Trial 323 finished with value: 86.75107296733609 and parameters: {'depth': 10, 'learning_rate': 0.04149783106365779, 'iterations': 307, 'l2_leaf_reg': 0.0005141141559039578, 'border_count': 25, 'bagging_temperature': 0.20420054264976042, 'random_strength': 3.3818979880502527, 'grow_policy': 'Lossguide', 'min_data_in_leaf': 587, 'max_leaves': 147}. Best is trial 280 with value: 79.877599423719.[0m
[32m[I 2024-10-13 13:47:26,846][0m Trial 324 finished with value: 83.7368476089051 and parameters: {'depth': 10, 'learning_rate': 0.017371114423924354, 'iterations': 1496, 'l2_leaf_reg': 0.00018751668044661378, 'border_count': 36, 'bagging_temperature': 0.2816154514750701, 'random_strength': 2.9173341388094935, 'grow_policy': 'Lossguide', 'min_data_in_leaf': 539, 'max_leaves': 176}. Best is trial 280 with value: 79.877599423719.[0m
[32m[I 2024-10-13 13:47:29,341][0m Trial 325 finished with value: 102.33393623328196 and parameters: {'depth': 12, 'learning_rate': 0.05323648131231063, 'iterations': 187, 'l2_leaf_reg': 0.0010946963407740225, 'border_count': 29, 'bagging_temperature': 0.16945768415177417, 'random_strength': 3.5347423444416504, 'grow_policy': 'SymmetricTree', 'min_data_in_leaf': 557}. Best is trial 280 with value: 79.877599423719.[0m
[32m[I 2024-10-13 13:47:30,243][0m Trial 326 finished with value: 92.22530266800325 and parameters: {'depth': 13, 'learning_rate': 0.06802795961825583, 'iterations': 535, 'l2_leaf_reg': 0.0021748638299165443, 'border_count': 21, 'bagging_temperature': 0.24693280164817438, 'random_strength': 3.7801449445744804, 'grow_policy': 'Lossguide', 'min_data_in_leaf': 369, 'max_leaves': 155}. Best is trial 280 with value: 79.877599423719.[0m
[32m[I 2024-10-13 13:47:31,102][0m Trial 327 finished with value: 83.97636344764199 and parameters: {'depth': 6, 'learning_rate': 0.031225773367508293, 'iterations': 374, 'l2_leaf_reg': 0.0030474698450401283, 'border_count': 40, 'bagging_temperature': 0.2142700262311283, 'random_strength': 3.243386871108903, 'grow_policy': 'Lossguide', 'min_data_in_leaf': 332, 'max_leaves': 138}. Best is trial 280 with value: 79.877599423719.[0m
[32m[I 2024-10-13 13:47:31,802][0m Trial 328 finished with value: 85.0711274471067 and parameters: {'depth': 11, 'learning_rate': 0.10007030256707777, 'iterations': 245, 'l2_leaf_reg': 0.0003223068365448394, 'border_count': 33, 'bagging_temperature': 0.1855593885069742, 'random_strength': 2.819057037873809, 'grow_policy': 'Lossguide', 'min_data_in_leaf': 488, 'max_leaves': 149}. Best is trial 280 with value: 79.877599423719.[0m
[32m[I 2024-10-13 13:47:32,672][0m Trial 329 finished with value: 84.44253372370139 and parameters: {'depth': 10, 'learning_rate': 0.020606181593553225, 'iterations': 445, 'l2_leaf_reg': 0.00011461506650049919, 'border_count': 24, 'bagging_temperature': 0.23129186635507165, 'random_strength': 4.037525626296428, 'grow_policy': 'Lossguide', 'min_data_in_leaf': 402, 'max_leaves': 160}. Best is trial 280 with value: 79.877599423719.[0m
[32m[I 2024-10-13 13:47:33,801][0m Trial 330 finished with value: 105.30833092045422 and parameters: {'depth': 9, 'learning_rate': 0.06033125936411639, 'iterations': 763, 'l2_leaf_reg': 0.0007270945111844652, 'border_count': 88, 'bagging_temperature': 0.28980588140339747, 'random_strength': 3.1563814693353556, 'grow_policy': 'Lossguide', 'min_data_in_leaf': 523, 'max_leaves': 143}. Best is trial 280 with value: 79.877599423719.[0m
[32m[I 2024-10-13 13:47:34,944][0m Trial 331 finished with value: 84.06131822274702 and parameters: {'depth': 10, 'learning_rate': 0.044294515908586955, 'iterations': 619, 'l2_leaf_reg': 3.061613086398905e-06, 'border_count': 44, 'bagging_temperature': 0.14669312414214053, 'random_strength': 7.554330177929041, 'grow_policy': 'Lossguide', 'min_data_in_leaf': 433, 'max_leaves': 225}. Best is trial 280 with value: 79.877599423719.[0m
[32m[I 2024-10-13 13:47:35,727][0m Trial 332 finished with value: 83.74335039590486 and parameters: {'depth': 13, 'learning_rate': 0.03704582347798537, 'iterations': 335, 'l2_leaf_reg': 0.0014114281497628687, 'border_count': 30, 'bagging_temperature': 0.2002715103870278, 'random_strength': 3.5569018690315573, 'grow_policy': 'Lossguide', 'min_data_in_leaf': 558, 'max_leaves': 152}. Best is trial 280 with value: 79.877599423719.[0m
[32m[I 2024-10-13 13:47:36,586][0m Trial 333 finished with value: 92.15477255850395 and parameters: {'depth': 11, 'learning_rate': 0.050737996903394714, 'iterations': 420, 'l2_leaf_reg': 0.00041084261100817604, 'border_count': 14, 'bagging_temperature': 0.2584384863719258, 'random_strength': 2.5934982148892876, 'grow_policy': 'Lossguide', 'min_data_in_leaf': 580, 'max_leaves': 157}. Best is trial 280 with value: 79.877599423719.[0m
[32m[I 2024-10-13 13:47:37,539][0m Trial 334 finished with value: 82.7329828510987 and parameters: {'depth': 12, 'learning_rate': 0.025395002383657418, 'iterations': 504, 'l2_leaf_reg': 0.00019949207626546896, 'border_count': 37, 'bagging_temperature': 0.21712355801889266, 'random_strength': 2.9883103712124193, 'grow_policy': 'Lossguide', 'min_data_in_leaf': 503, 'max_leaves': 143}. Best is trial 280 with value: 79.877599423719.[0m
[32m[I 2024-10-13 13:47:39,288][0m Trial 335 finished with value: 93.61391511648388 and parameters: {'depth': 10, 'learning_rate': 0.07847328762581915, 'iterations': 1603, 'l2_leaf_reg': 0.0008972923950267516, 'border_count': 19, 'bagging_temperature': 0.1793202756880578, 'random_strength': 3.751814957474128, 'grow_policy': 'Depthwise', 'min_data_in_leaf': 533}. Best is trial 280 with value: 79.877599423719.[0m
[32m[I 2024-10-13 13:47:40,067][0m Trial 336 finished with value: 98.38946739288747 and parameters: {'depth': 13, 'learning_rate': 0.014587382676306345, 'iterations': 306, 'l2_leaf_reg': 6.685019855365881e-05, 'border_count': 29, 'bagging_temperature': 0.24676812437716872, 'random_strength': 3.3915467939774695, 'grow_policy': 'Lossguide', 'min_data_in_leaf': 551, 'max_leaves': 164}. Best is trial 280 with value: 79.877599423719.[0m
[32m[I 2024-10-13 13:47:40,785][0m Trial 337 finished with value: 98.26679793938617 and parameters: {'depth': 9, 'learning_rate': 0.032474119102965784, 'iterations': 222, 'l2_leaf_reg': 0.0005706036293321309, 'border_count': 182, 'bagging_temperature': 0.2369853073673116, 'random_strength': 4.696811015595448, 'grow_policy': 'Lossguide', 'min_data_in_leaf': 598, 'max_leaves': 150}. Best is trial 280 with value: 79.877599423719.[0m
[32m[I 2024-10-13 13:47:41,823][0m Trial 338 finished with value: 88.34340159925975 and parameters: {'depth': 10, 'learning_rate': 0.06154316842398925, 'iterations': 701, 'l2_leaf_reg': 0.001709980111962774, 'border_count': 48, 'bagging_temperature': 0.2680154665247729, 'random_strength': 3.1894506864823318, 'grow_policy': 'Lossguide', 'min_data_in_leaf': 908, 'max_leaves': 171}. Best is trial 280 with value: 79.877599423719.[0m
[32m[I 2024-10-13 13:47:42,479][0m Trial 339 finished with value: 87.3093361125692 and parameters: {'depth': 11, 'learning_rate': 0.04436726805849581, 'iterations': 153, 'l2_leaf_reg': 0.0002741532224563363, 'border_count': 35, 'bagging_temperature': 0.19558899408512204, 'random_strength': 3.5760062651235947, 'grow_policy': 'Lossguide', 'min_data_in_leaf': 517, 'max_leaves': 231}. Best is trial 280 with value: 79.877599423719.[0m
[32m[I 2024-10-13 13:47:43,355][0m Trial 340 finished with value: 82.07991850396321 and parameters: {'depth': 13, 'learning_rate': 0.039496765212732404, 'iterations': 383, 'l2_leaf_reg': 1.7427098987378398e-06, 'border_count': 24, 'bagging_temperature': 0.21734989345809724, 'random_strength': 3.9132766240988452, 'grow_policy': 'Lossguide', 'min_data_in_leaf': 573, 'max_leaves': 156}. Best is trial 280 with value: 79.877599423719.[0m
[32m[I 2024-10-13 13:47:44,064][0m Trial 341 finished with value: 83.83407624040096 and parameters: {'depth': 14, 'learning_rate': 0.05344134529470159, 'iterations': 260, 'l2_leaf_reg': 0.0009713777810907384, 'border_count': 40, 'bagging_temperature': 0.15568845440564216, 'random_strength': 2.7141990253561152, 'grow_policy': 'Lossguide', 'min_data_in_leaf': 489, 'max_leaves': 146}. Best is trial 280 with value: 79.877599423719.[0m
[32m[I 2024-10-13 13:47:44,929][0m Trial 342 finished with value: 88.03730888316275 and parameters: {'depth': 10, 'learning_rate': 0.0735975850371887, 'iterations': 345, 'l2_leaf_reg': 0.00044863127064966187, 'border_count': 33, 'bagging_temperature': 0.8369723783995372, 'random_strength': 3.0211463930466005, 'grow_policy': 'Lossguide', 'min_data_in_leaf': 976, 'max_leaves': 216}. Best is trial 280 with value: 79.877599423719.[0m
[32m[I 2024-10-13 13:47:45,800][0m Trial 343 finished with value: 93.41177274126731 and parameters: {'depth': 10, 'learning_rate': 0.027637490395926907, 'iterations': 467, 'l2_leaf_reg': 7.802267756791366, 'border_count': 27, 'bagging_temperature': 0.2364193585022336, 'random_strength': 3.3662903976301326, 'grow_policy': 'Lossguide', 'min_data_in_leaf': 458, 'max_leaves': 137}. Best is trial 280 with value: 79.877599423719.[0m
[32m[I 2024-10-13 13:47:46,782][0m Trial 344 finished with value: 87.42164757744935 and parameters: {'depth': 11, 'learning_rate': 0.08772550394251737, 'iterations': 576, 'l2_leaf_reg': 0.0006734803901908095, 'border_count': 43, 'bagging_temperature': 0.29004860276352007, 'random_strength': 4.131379667060568, 'grow_policy': 'Lossguide', 'min_data_in_leaf': 543, 'max_leaves': 221}. Best is trial 280 with value: 79.877599423719.[0m
[32m[I 2024-10-13 13:47:47,528][0m Trial 345 finished with value: 95.64777991300089 and parameters: {'depth': 7, 'learning_rate': 0.03655251235523458, 'iterations': 292, 'l2_leaf_reg': 0.00014706916763342466, 'border_count': 53, 'bagging_temperature': 0.20330969358854128, 'random_strength': 1.9837538117720017, 'grow_policy': 'Lossguide', 'min_data_in_leaf': 519, 'max_leaves': 153}. Best is trial 280 with value: 79.877599423719.[0m
[32m[I 2024-10-13 13:47:48,381][0m Trial 346 finished with value: 91.95578468627254 and parameters: {'depth': 10, 'learning_rate': 0.0650537358319525, 'iterations': 399, 'l2_leaf_reg': 0.0002758530719762675, 'border_count': 16, 'bagging_temperature': 0.1732533763312218, 'random_strength': 3.7479652407551542, 'grow_policy': 'Lossguide', 'min_data_in_leaf': 562, 'max_leaves': 187}. Best is trial 280 with value: 79.877599423719.[0m
[32m[I 2024-10-13 13:47:49,107][0m Trial 347 finished with value: 313.4959229871503 and parameters: {'depth': 13, 'learning_rate': 0.0002704860112190492, 'iterations': 215, 'l2_leaf_reg': 0.0041382345943586805, 'border_count': 36, 'bagging_temperature': 0.2663524466891777, 'random_strength': 4.406615383797527, 'grow_policy': 'Lossguide', 'min_data_in_leaf': 493, 'max_leaves': 160}. Best is trial 280 with value: 79.877599423719.[0m
[32m[I 2024-10-13 13:47:56,424][0m Trial 348 finished with value: 86.2254702474523 and parameters: {'depth': 10, 'learning_rate': 0.012269399038672907, 'iterations': 523, 'l2_leaf_reg': 0.0010907614670816923, 'border_count': 31, 'bagging_temperature': 0.3123919356108268, 'random_strength': 3.4300520427071164, 'grow_policy': 'SymmetricTree', 'min_data_in_leaf': 594}. Best is trial 280 with value: 79.877599423719.[0m
[32m[I 2024-10-13 13:47:58,262][0m Trial 349 finished with value: 99.01654087626474 and parameters: {'depth': 9, 'learning_rate': 0.1215339076137729, 'iterations': 1713, 'l2_leaf_reg': 0.002653852050146608, 'border_count': 24, 'bagging_temperature': 0.22323986175574073, 'random_strength': 2.88247685092975, 'grow_policy': 'Lossguide', 'min_data_in_leaf': 850, 'max_leaves': 148}. Best is trial 280 with value: 79.877599423719.[0m
[32m[I 2024-10-13 13:47:59,080][0m Trial 350 finished with value: 82.23947063315778 and parameters: {'depth': 12, 'learning_rate': 0.05272681818762105, 'iterations': 346, 'l2_leaf_reg': 0.0004533326189931686, 'border_count': 39, 'bagging_temperature': 0.18886701646032616, 'random_strength': 3.229259619897261, 'grow_policy': 'Lossguide', 'min_data_in_leaf': 527, 'max_leaves': 140}. Best is trial 280 with value: 79.877599423719.[0m
