[32m[I 2024-10-13 13:36:37,269][0m Trial 51 finished with value: 86.77161482628716 and parameters: {'depth': 14, 'learning_rate': 0.015087824984031691, 'iterations': 1517, 'l2_leaf_reg': 1.244038067596771e-06, 'border_count': 42, 'bagging_temperature': 0.38802885668231096, 'random_strength': 0.44494301886911525, 'grow_policy': 'Lossguide', 'min_data_in_leaf': 116, 'max_leaves': 142}. Best is trial 29 with value: 84.0423008373164.[0m
[32m[I 2024-10-13 13:36:38,916][0m Trial 52 finished with value: 95.55632732434101 and parameters: {'depth': 14, 'learning_rate': 0.006651271695446004, 'iterations': 1576, 'l2_leaf_reg': 1.4761105625923083e-06, 'border_count': 64, 'bagging_temperature': 0.38109070144438684, 'random_strength': 0.4229894819045632, 'grow_policy': 'Lossguide', 'min_data_in_leaf': 127, 'max_leaves': 164}. Best is trial 29 with value: 84.0423008373164.[0m
[32m[I 2024-10-13 13:36:40,533][0m Trial 53 finished with value: 296.3957744518295 and parameters: {'depth': 14, 'learning_rate': 0.00010437847452326639, 'iterations': 1498, 'l2_leaf_reg': 1.2807616403557925e-07, 'border_count': 36, 'bagging_temperature': 0.8531075456322532, 'random_strength': 2.0847012587170948, 'grow_policy': 'Lossguide', 'min_data_in_leaf': 98, 'max_leaves': 135}. Best is trial 29 with value: 84.0423008373164.[0m
[32m[I 2024-10-13 13:36:42,946][0m Trial 54 finished with value: 123.33788503020449 and parameters: {'depth': 14, 'learning_rate': 0.015734042940320627, 'iterations': 1326, 'l2_leaf_reg': 6.765014475014929e-06, 'border_count': 160, 'bagging_temperature': 0.23863353349639915, 'random_strength': 1.3392905741102403, 'grow_policy': 'Lossguide', 'min_data_in_leaf': 51, 'max_leaves': 115}. Best is trial 29 with value: 84.0423008373164.[0m
[32m[I 2024-10-13 13:36:44,266][0m Trial 55 finished with value: 104.08286277110714 and parameters: {'depth': 12, 'learning_rate': 0.0035675567801310795, 'iterations': 1035, 'l2_leaf_reg': 2.0424602151584516e-06, 'border_count': 75, 'bagging_temperature': 0.6174228339495066, 'random_strength': 0.4844231604062684, 'grow_policy': 'Lossguide', 'min_data_in_leaf': 154, 'max_leaves': 148}. Best is trial 29 with value: 84.0423008373164.[0m
[32m[I 2024-10-13 13:36:46,031][0m Trial 56 finished with value: 103.45306221603107 and parameters: {'depth': 11, 'learning_rate': 0.027206461353993176, 'iterations': 1692, 'l2_leaf_reg': 1.5570085762812468e-07, 'border_count': 90, 'bagging_temperature': 0.5546356280740549, 'random_strength': 0.9051844250476306, 'grow_policy': 'Lossguide', 'min_data_in_leaf': 238, 'max_leaves': 247}. Best is trial 29 with value: 84.0423008373164.[0m
[32m[I 2024-10-13 13:36:47,620][0m Trial 57 finished with value: 284.2377958894996 and parameters: {'depth': 13, 'learning_rate': 0.00016209452925828693, 'iterations': 1472, 'l2_leaf_reg': 3.546136716302562e-08, 'border_count': 213, 'bagging_temperature': 0.3232646097501673, 'random_strength': 2.890869689031475, 'grow_policy': 'Lossguide', 'min_data_in_leaf': 304, 'max_leaves': 115}. Best is trial 29 with value: 84.0423008373164.[0m
[32m[I 2024-10-13 13:41:28,450][0m Trial 58 finished with value: 105.80947911663453 and parameters: {'depth': 15, 'learning_rate': 0.015526449917857149, 'iterations': 1982, 'l2_leaf_reg': 1.0634272442164868e-06, 'border_count': 48, 'bagging_temperature': 0.4964557709787796, 'random_strength': 2.0519590094816635, 'grow_policy': 'SymmetricTree', 'min_data_in_leaf': 83}. Best is trial 29 with value: 84.0423008373164.[0m
[32m[I 2024-10-13 13:41:29,625][0m Trial 59 finished with value: 94.89015966033031 and parameters: {'depth': 10, 'learning_rate': 0.021721374056051488, 'iterations': 1268, 'l2_leaf_reg': 8.182109077803173e-05, 'border_count': 22, 'bagging_temperature': 0.9385807436236048, 'random_strength': 7.037557820297726, 'grow_policy': 'Lossguide', 'min_data_in_leaf': 365, 'max_leaves': 172}. Best is trial 29 with value: 84.0423008373164.[0m
[32m[I 2024-10-13 13:41:31,887][0m Trial 60 finished with value: 107.02468889425612 and parameters: {'depth': 14, 'learning_rate': 0.07524877446239028, 'iterations': 2174, 'l2_leaf_reg': 8.047704815203245e-06, 'border_count': 59, 'bagging_temperature': 0.695194931095746, 'random_strength': 1.289250428968317, 'grow_policy': 'Lossguide', 'min_data_in_leaf': 156, 'max_leaves': 157}. Best is trial 29 with value: 84.0423008373164.[0m
[32m[I 2024-10-13 13:41:33,836][0m Trial 61 finished with value: 83.59943309381977 and parameters: {'depth': 3, 'learning_rate': 0.00960764889596801, 'iterations': 1786, 'l2_leaf_reg': 2.594097238616688e-05, 'border_count': 37, 'bagging_temperature': 0.42602301370729506, 'random_strength': 0.3384668452837003, 'grow_policy': 'Lossguide', 'min_data_in_leaf': 456, 'max_leaves': 140}. Best is trial 61 with value: 83.59943309381977.[0m
[32m[I 2024-10-13 13:41:35,772][0m Trial 62 finished with value: 82.51408280238935 and parameters: {'depth': 3, 'learning_rate': 0.008075684950469208, 'iterations': 1744, 'l2_leaf_reg': 2.2708660269726277e-05, 'border_count': 34, 'bagging_temperature': 0.43827071794776695, 'random_strength': 0.38143181959927785, 'grow_policy': 'Lossguide', 'min_data_in_leaf': 477, 'max_leaves': 130}. Best is trial 62 with value: 82.51408280238935.[0m
[32m[I 2024-10-13 13:41:38,038][0m Trial 63 finished with value: 122.75936442951141 and parameters: {'depth': 3, 'learning_rate': 0.004693626160472453, 'iterations': 2394, 'l2_leaf_reg': 2.7239293966895356e-05, 'border_count': 8, 'bagging_temperature': 0.5780757890627317, 'random_strength': 0.8530890252320249, 'grow_policy': 'Lossguide', 'min_data_in_leaf': 527, 'max_leaves': 99}. Best is trial 62 with value: 82.51408280238935.[0m
[32m[I 2024-10-13 13:41:39,865][0m Trial 64 finished with value: 84.3106972396431 and parameters: {'depth': 3, 'learning_rate': 0.008433538179952894, 'iterations': 1769, 'l2_leaf_reg': 9.322465609025675e-06, 'border_count': 33, 'bagging_temperature': 0.4760533521536742, 'random_strength': 0.46284323668016714, 'grow_policy': 'Lossguide', 'min_data_in_leaf': 468, 'max_leaves': 129}. Best is trial 62 with value: 82.51408280238935.[0m
[32m[I 2024-10-13 13:41:41,800][0m Trial 65 finished with value: 87.49654607762857 and parameters: {'depth': 3, 'learning_rate': 0.00904559104927093, 'iterations': 1929, 'l2_leaf_reg': 6.792905487933306e-05, 'border_count': 26, 'bagging_temperature': 0.4366465081208188, 'random_strength': 0.3124339967279661, 'grow_policy': 'Lossguide', 'min_data_in_leaf': 471, 'max_leaves': 127}. Best is trial 62 with value: 82.51408280238935.[0m
[32m[I 2024-10-13 13:41:47,769][0m Trial 66 finished with value: 101.82453423671976 and parameters: {'depth': 3, 'learning_rate': 0.03564376363384018, 'iterations': 1766, 'l2_leaf_reg': 3.5612068140192935e-05, 'border_count': 51, 'bagging_temperature': 0.49346994504840846, 'random_strength': 0.959576188031898, 'grow_policy': 'SymmetricTree', 'min_data_in_leaf': 385}. Best is trial 62 with value: 82.51408280238935.[0m
[32m[I 2024-10-13 13:41:49,845][0m Trial 67 finished with value: 85.89732157517585 and parameters: {'depth': 4, 'learning_rate': 0.008932955608917813, 'iterations': 2120, 'l2_leaf_reg': 0.0006043384266037334, 'border_count': 32, 'bagging_temperature': 0.5391550449474719, 'random_strength': 5.40208348554573, 'grow_policy': 'Lossguide', 'min_data_in_leaf': 508, 'max_leaves': 107}. Best is trial 62 with value: 82.51408280238935.[0m
[32m[I 2024-10-13 13:41:51,710][0m Trial 68 finished with value: 93.10345685225086 and parameters: {'depth': 3, 'learning_rate': 0.0064294473386237875, 'iterations': 1768, 'l2_leaf_reg': 0.004275790778276938, 'border_count': 22, 'bagging_temperature': 0.42651497917419573, 'random_strength': 0.3220658367234388, 'grow_policy': 'Lossguide', 'min_data_in_leaf': 558, 'max_leaves': 134}. Best is trial 62 with value: 82.51408280238935.[0m
[32m[I 2024-10-13 13:41:53,460][0m Trial 69 finished with value: 184.278733062988 and parameters: {'depth': 5, 'learning_rate': 0.004277090950048597, 'iterations': 1648, 'l2_leaf_reg': 1.1347134226838428e-05, 'border_count': 2, 'bagging_temperature': 0.47969048276956927, 'random_strength': 0.700092288538454, 'grow_policy': 'Lossguide', 'min_data_in_leaf': 426, 'max_leaves': 120}. Best is trial 62 with value: 82.51408280238935.[0m
[32m[I 2024-10-13 13:41:55,506][0m Trial 70 finished with value: 95.32817799381036 and parameters: {'depth': 5, 'learning_rate': 0.003139402442059557, 'iterations': 1977, 'l2_leaf_reg': 0.0010668876954182177, 'border_count': 11, 'bagging_temperature': 0.30576447975710686, 'random_strength': 0.028131389361418624, 'grow_policy': 'Depthwise', 'min_data_in_leaf': 402}. Best is trial 62 with value: 82.51408280238935.[0m
[32m[I 2024-10-13 13:41:57,577][0m Trial 71 finished with value: 88.4443647542283 and parameters: {'depth': 4, 'learning_rate': 0.0089756604159693, 'iterations': 2100, 'l2_leaf_reg': 0.0006910569847162558, 'border_count': 28, 'bagging_temperature': 0.5445760755740537, 'random_strength': 5.212346309196868, 'grow_policy': 'Lossguide', 'min_data_in_leaf': 496, 'max_leaves': 91}. Best is trial 62 with value: 82.51408280238935.[0m
[32m[I 2024-10-13 13:41:59,812][0m Trial 72 finished with value: 87.38025361019048 and parameters: {'depth': 4, 'learning_rate': 0.02089133375727459, 'iterations': 2355, 'l2_leaf_reg': 0.00023580115019082609, 'border_count': 35, 'bagging_temperature': 0.5824572159285535, 'random_strength': 5.676108926650091, 'grow_policy': 'Lossguide', 'min_data_in_leaf': 516, 'max_leaves': 107}. Best is trial 62 with value: 82.51408280238935.[0m
[32m[I 2024-10-13 13:42:01,944][0m Trial 73 finished with value: 87.78314184893814 and parameters: {'depth': 3, 'learning_rate': 0.013206940478747535, 'iterations': 2151, 'l2_leaf_reg': 9.190137243054044e-05, 'border_count': 48, 'bagging_temperature': 0.4501490666463753, 'random_strength': 6.605400201113957, 'grow_policy': 'Lossguide', 'min_data_in_leaf': 461, 'max_leaves': 65}. Best is trial 62 with value: 82.51408280238935.[0m
[32m[I 2024-10-13 13:42:03,919][0m Trial 74 finished with value: 83.14238192886852 and parameters: {'depth': 4, 'learning_rate': 0.009547438373632908, 'iterations': 1890, 'l2_leaf_reg': 3.072363986130753e-05, 'border_count': 38, 'bagging_temperature': 0.5269691547392767, 'random_strength': 4.5896238707326145, 'grow_policy': 'Lossguide', 'min_data_in_leaf': 592, 'max_leaves': 107}. Best is trial 62 with value: 82.51408280238935.[0m
[32m[I 2024-10-13 13:42:05,786][0m Trial 75 finished with value: 97.94713376594537 and parameters: {'depth': 3, 'learning_rate': 0.0022853852909996467, 'iterations': 1911, 'l2_leaf_reg': 3.371513038318919e-05, 'border_count': 59, 'bagging_temperature': 0.35620613144841706, 'random_strength': 0.36062060622414044, 'grow_policy': 'Lossguide', 'min_data_in_leaf': 605, 'max_leaves': 136}. Best is trial 62 with value: 82.51408280238935.[0m
[32m[I 2024-10-13 13:42:07,603][0m Trial 76 finished with value: 93.37341323507968 and parameters: {'depth': 4, 'learning_rate': 0.010489051519342039, 'iterations': 1801, 'l2_leaf_reg': 3.619481271714782e-06, 'border_count': 20, 'bagging_temperature': 0.6355276709632036, 'random_strength': 1.0540149725739245, 'grow_policy': 'Lossguide', 'min_data_in_leaf': 646, 'max_leaves': 129}. Best is trial 62 with value: 82.51408280238935.[0m
[32m[I 2024-10-13 13:42:09,580][0m Trial 77 finished with value: 86.80415125084168 and parameters: {'depth': 5, 'learning_rate': 0.018388368339484824, 'iterations': 2020, 'l2_leaf_reg': 1.3674760312132678e-05, 'border_count': 40, 'bagging_temperature': 0.5103266232932593, 'random_strength': 4.2007310064443395, 'grow_policy': 'Lossguide', 'min_data_in_leaf': 581, 'max_leaves': 146}. Best is trial 62 with value: 82.51408280238935.[0m
[32m[I 2024-10-13 13:42:15,509][0m Trial 78 finished with value: 110.28185879673352 and parameters: {'depth': 3, 'learning_rate': 0.006678743417793858, 'iterations': 1718, 'l2_leaf_reg': 0.0001266164303510038, 'border_count': 52, 'bagging_temperature': 0.47497893543297376, 'random_strength': 8.50168287664766, 'grow_policy': 'SymmetricTree', 'min_data_in_leaf': 349}. Best is trial 62 with value: 82.51408280238935.[0m
[32m[I 2024-10-13 13:42:17,327][0m Trial 79 finished with value: 94.66640017380674 and parameters: {'depth': 4, 'learning_rate': 0.007852330316787764, 'iterations': 1612, 'l2_leaf_reg': 5.260595956451491e-05, 'border_count': 74, 'bagging_temperature': 0.4202115494265374, 'random_strength': 3.5495107338441754, 'grow_policy': 'Lossguide', 'min_data_in_leaf': 795, 'max_leaves': 121}. Best is trial 62 with value: 82.51408280238935.[0m
[32m[I 2024-10-13 13:42:19,003][0m Trial 80 finished with value: 99.95192719571914 and parameters: {'depth': 3, 'learning_rate': 0.025541971625415577, 'iterations': 1413, 'l2_leaf_reg': 2.6084685135738012e-05, 'border_count': 65, 'bagging_temperature': 0.5310507861839739, 'random_strength': 1.74122315263146, 'grow_policy': 'Lossguide', 'min_data_in_leaf': 315, 'max_leaves': 154}. Best is trial 62 with value: 82.51408280238935.[0m
[32m[I 2024-10-13 13:42:20,934][0m Trial 81 finished with value: 89.54466902808325 and parameters: {'depth': 4, 'learning_rate': 0.012722324038358818, 'iterations': 1860, 'l2_leaf_reg': 0.0004698131432824663, 'border_count': 28, 'bagging_temperature': 0.5923505237110156, 'random_strength': 5.280827444614678, 'grow_policy': 'Lossguide', 'min_data_in_leaf': 540, 'max_leaves': 137}. Best is trial 62 with value: 82.51408280238935.[0m
[32m[I 2024-10-13 13:42:22,929][0m Trial 82 finished with value: 83.02721134408485 and parameters: {'depth': 4, 'learning_rate': 0.009852640109519514, 'iterations': 1913, 'l2_leaf_reg': 0.0016813883883584494, 'border_count': 34, 'bagging_temperature': 0.5532945335079216, 'random_strength': 0.7766676431442476, 'grow_policy': 'Lossguide', 'min_data_in_leaf': 488, 'max_leaves': 110}. Best is trial 62 with value: 82.51408280238935.[0m
[32m[I 2024-10-13 13:42:24,905][0m Trial 83 finished with value: 85.27816629059093 and parameters: {'depth': 6, 'learning_rate': 0.005673303848423275, 'iterations': 1902, 'l2_leaf_reg': 0.001469231966943456, 'border_count': 38, 'bagging_temperature': 0.45330463743935523, 'random_strength': 0.6301154152357614, 'grow_policy': 'Lossguide', 'min_data_in_leaf': 480, 'max_leaves': 98}. Best is trial 62 with value: 82.51408280238935.[0m
[32m[I 2024-10-13 13:42:26,682][0m Trial 84 finished with value: 87.7684620576053 and parameters: {'depth': 4, 'learning_rate': 0.010241994037464853, 'iterations': 1699, 'l2_leaf_reg': 0.013404228257038764, 'border_count': 46, 'bagging_temperature': 0.5601570778537414, 'random_strength': 0.2601939012905614, 'grow_policy': 'Lossguide', 'min_data_in_leaf': 448, 'max_leaves': 87}. Best is trial 62 with value: 82.51408280238935.[0m
[32m[I 2024-10-13 13:42:28,580][0m Trial 85 finished with value: 119.47668847574262 and parameters: {'depth': 3, 'learning_rate': 0.016467900458186458, 'iterations': 1813, 'l2_leaf_reg': 0.033920596686647535, 'border_count': 7, 'bagging_temperature': 0.4994313643612085, 'random_strength': 1.114904147008747, 'grow_policy': 'Lossguide', 'min_data_in_leaf': 634, 'max_leaves': 112}. Best is trial 62 with value: 82.51408280238935.[0m
[32m[I 2024-10-13 13:42:31,341][0m Trial 86 finished with value: 93.54027884962653 and parameters: {'depth': 5, 'learning_rate': 0.0045934465697666065, 'iterations': 2970, 'l2_leaf_reg': 0.00023342382328396874, 'border_count': 19, 'bagging_temperature': 0.6133621665828387, 'random_strength': 0.7383723843468508, 'grow_policy': 'Lossguide', 'min_data_in_leaf': 397, 'max_leaves': 123}. Best is trial 62 with value: 82.51408280238935.[0m
[32m[I 2024-10-13 13:42:33,145][0m Trial 87 finished with value: 98.90977240532348 and parameters: {'depth': 4, 'learning_rate': 0.01310732842001797, 'iterations': 1581, 'l2_leaf_reg': 0.0033365249573134117, 'border_count': 116, 'bagging_temperature': 0.36625743173016156, 'random_strength': 0.21461131485843024, 'grow_policy': 'Depthwise', 'min_data_in_leaf': 714}. Best is trial 62 with value: 82.51408280238935.[0m
[32m[I 2024-10-13 13:42:35,183][0m Trial 88 finished with value: 84.08199531248708 and parameters: {'depth': 3, 'learning_rate': 0.007912701802575976, 'iterations': 2037, 'l2_leaf_reg': 1.2500071613420105e-05, 'border_count': 41, 'bagging_temperature': 0.40593543702952906, 'random_strength': 1.5004907974233799, 'grow_policy': 'Lossguide', 'min_data_in_leaf': 420, 'max_leaves': 146}. Best is trial 62 with value: 82.51408280238935.[0m
[32m[I 2024-10-13 13:42:37,267][0m Trial 89 finished with value: 95.59525651708807 and parameters: {'depth': 3, 'learning_rate': 0.00806865854977022, 'iterations': 2033, 'l2_leaf_reg': 4.743652708730961e-06, 'border_count': 55, 'bagging_temperature': 0.40142030633322706, 'random_strength': 2.386448217457843, 'grow_policy': 'Lossguide', 'min_data_in_leaf': 549, 'max_leaves': 75}. Best is trial 62 with value: 82.51408280238935.[0m
[32m[I 2024-10-13 13:42:39,557][0m Trial 90 finished with value: 95.35939358114179 and parameters: {'depth': 3, 'learning_rate': 0.005681244664226685, 'iterations': 2213, 'l2_leaf_reg': 2.1847691211788475e-05, 'border_count': 82, 'bagging_temperature': 0.6711017819484066, 'random_strength': 4.557678455757428, 'grow_policy': 'Lossguide', 'min_data_in_leaf': 435, 'max_leaves': 131}. Best is trial 62 with value: 82.51408280238935.[0m
[32m[I 2024-10-13 13:42:41,438][0m Trial 91 finished with value: 84.61161649573657 and parameters: {'depth': 4, 'learning_rate': 0.010826690056674679, 'iterations': 1759, 'l2_leaf_reg': 1.21367336310593e-05, 'border_count': 41, 'bagging_temperature': 0.47629082612559753, 'random_strength': 1.3921565910015203, 'grow_policy': 'Lossguide', 'min_data_in_leaf': 413, 'max_leaves': 159}. Best is trial 62 with value: 82.51408280238935.[0m
[32m[I 2024-10-13 13:42:43,417][0m Trial 92 finished with value: 85.68206413171542 and parameters: {'depth': 4, 'learning_rate': 0.009460085782629418, 'iterations': 1917, 'l2_leaf_reg': 1.106680521408329e-05, 'border_count': 31, 'bagging_temperature': 0.5245622760675341, 'random_strength': 1.501203443810411, 'grow_policy': 'Lossguide', 'min_data_in_leaf': 479, 'max_leaves': 182}. Best is trial 62 with value: 82.51408280238935.[0m
[32m[I 2024-10-13 13:42:45,243][0m Trial 93 finished with value: 81.66708072018007 and parameters: {'depth': 3, 'learning_rate': 0.018644625413786323, 'iterations': 1658, 'l2_leaf_reg': 4.602583586357165e-05, 'border_count': 24, 'bagging_temperature': 0.4366671528668787, 'random_strength': 1.8638805017749267, 'grow_policy': 'Lossguide', 'min_data_in_leaf': 360, 'max_leaves': 142}. Best is trial 93 with value: 81.66708072018007.[0m
[32m[I 2024-10-13 13:42:46,836][0m Trial 94 finished with value: 91.75333553028696 and parameters: {'depth': 3, 'learning_rate': 0.021362494831272786, 'iterations': 1457, 'l2_leaf_reg': 1.6881961233476292e-05, 'border_count': 17, 'bagging_temperature': 0.43521787013643054, 'random_strength': 1.9155388828185635, 'grow_policy': 'Lossguide', 'min_data_in_leaf': 358, 'max_leaves': 137}. Best is trial 93 with value: 81.66708072018007.[0m
[32m[I 2024-10-13 13:42:48,673][0m Trial 95 finished with value: 87.16829985855763 and parameters: {'depth': 3, 'learning_rate': 0.01731767322296452, 'iterations': 1666, 'l2_leaf_reg': 4.556709857138337e-05, 'border_count': 25, 'bagging_temperature': 0.33915630010801107, 'random_strength': 2.6405559604274287, 'grow_policy': 'Lossguide', 'min_data_in_leaf': 917, 'max_leaves': 160}. Best is trial 93 with value: 81.66708072018007.[0m
[32m[I 2024-10-13 13:42:50,341][0m Trial 96 finished with value: 83.4933620379384 and parameters: {'depth': 3, 'learning_rate': 0.01400786729166813, 'iterations': 1537, 'l2_leaf_reg': 5.746603799691081e-06, 'border_count': 35, 'bagging_temperature': 0.3926643644228177, 'random_strength': 1.6316360419542255, 'grow_policy': 'Lossguide', 'min_data_in_leaf': 458, 'max_leaves': 111}. Best is trial 93 with value: 81.66708072018007.[0m
[32m[I 2024-10-13 13:42:51,699][0m Trial 97 finished with value: 89.25892176966393 and parameters: {'depth': 3, 'learning_rate': 0.029877367443021538, 'iterations': 1150, 'l2_leaf_reg': 4.503686995218922e-06, 'border_count': 10, 'bagging_temperature': 0.38772716397043905, 'random_strength': 2.3215498794522986, 'grow_policy': 'Lossguide', 'min_data_in_leaf': 262, 'max_leaves': 143}. Best is trial 93 with value: 81.66708072018007.[0m
[32m[I 2024-10-13 13:42:53,329][0m Trial 98 finished with value: 89.19641722400857 and parameters: {'depth': 3, 'learning_rate': 0.04269541266593898, 'iterations': 1538, 'l2_leaf_reg': 1.992654629923203e-06, 'border_count': 35, 'bagging_temperature': 0.44844148592603167, 'random_strength': 1.6711976583411445, 'grow_policy': 'Lossguide', 'min_data_in_leaf': 327, 'max_leaves': 103}. Best is trial 93 with value: 81.66708072018007.[0m
[32m[I 2024-10-13 13:42:58,991][0m Trial 99 finished with value: 102.42378284603613 and parameters: {'depth': 3, 'learning_rate': 0.013939803953481681, 'iterations': 1617, 'l2_leaf_reg': 8.055545014206646e-06, 'border_count': 47, 'bagging_temperature': 0.28981560784829646, 'random_strength': 1.1826336420077646, 'grow_policy': 'SymmetricTree', 'min_data_in_leaf': 294}. Best is trial 93 with value: 81.66708072018007.[0m
[32m[I 2024-10-13 13:43:00,826][0m Trial 100 finished with value: 95.43969883167986 and parameters: {'depth': 5, 'learning_rate': 0.007364029305364996, 'iterations': 1833, 'l2_leaf_reg': 8.551139856669801e-05, 'border_count': 60, 'bagging_temperature': 0.3768491058312145, 'random_strength': 2.733112058752197, 'grow_policy': 'Lossguide', 'min_data_in_leaf': 458, 'max_leaves': 111}. Best is trial 93 with value: 81.66708072018007.[0m
