[32m[I 2024-10-13 13:52:34,471][0m Trial 601 finished with value: 90.94047308952813 and parameters: {'depth': 5, 'learning_rate': 0.22793678596992795, 'iterations': 153, 'l2_leaf_reg': 1.0055972108245237e-08, 'border_count': 21, 'bagging_temperature': 0.024880852838448687, 'random_strength': 9.221293027131932, 'grow_policy': 'Lossguide', 'min_data_in_leaf': 481, 'max_leaves': 151}. Best is trial 544 with value: 79.23314367466817.[0m
[32m[I 2024-10-13 13:52:35,441][0m Trial 602 finished with value: 96.96865435898529 and parameters: {'depth': 7, 'learning_rate': 0.09406288594320898, 'iterations': 262, 'l2_leaf_reg': 7.799274071410322e-08, 'border_count': 31, 'bagging_temperature': 0.05718281100055438, 'random_strength': 9.725196512094207, 'grow_policy': 'Lossguide', 'min_data_in_leaf': 19, 'max_leaves': 139}. Best is trial 544 with value: 79.23314367466817.[0m
[32m[I 2024-10-13 13:52:36,135][0m Trial 603 finished with value: 122.9201804554426 and parameters: {'depth': 9, 'learning_rate': 0.16010980497516286, 'iterations': 219, 'l2_leaf_reg': 2.2170842270130387e-08, 'border_count': 6, 'bagging_temperature': 0.16561769269336266, 'random_strength': 9.997460709167438, 'grow_policy': 'Lossguide', 'min_data_in_leaf': 231, 'max_leaves': 147}. Best is trial 544 with value: 79.23314367466817.[0m
[32m[I 2024-10-13 13:52:36,892][0m Trial 604 finished with value: 256.2483958222787 and parameters: {'depth': 6, 'learning_rate': 0.001536428050497539, 'iterations': 302, 'l2_leaf_reg': 3.4658451061559026e-08, 'border_count': 25, 'bagging_temperature': 0.10036776451599366, 'random_strength': 8.104517321615013, 'grow_policy': 'Lossguide', 'min_data_in_leaf': 462, 'max_leaves': 103}. Best is trial 544 with value: 79.23314367466817.[0m
[32m[I 2024-10-13 13:52:37,603][0m Trial 605 finished with value: 92.57950801985733 and parameters: {'depth': 9, 'learning_rate': 0.1801572461922533, 'iterations': 149, 'l2_leaf_reg': 1.4716806127024515e-08, 'border_count': 16, 'bagging_temperature': 0.0027231647915463356, 'random_strength': 9.3575615250883, 'grow_policy': 'Lossguide', 'min_data_in_leaf': 513, 'max_leaves': 143}. Best is trial 544 with value: 79.23314367466817.[0m
[32m[I 2024-10-13 13:52:38,831][0m Trial 606 finished with value: 91.3310639594612 and parameters: {'depth': 8, 'learning_rate': 0.10886006420177859, 'iterations': 331, 'l2_leaf_reg': 2.8156046139486492, 'border_count': 30, 'bagging_temperature': 0.12512333874047465, 'random_strength': 9.022350394281395, 'grow_policy': 'SymmetricTree', 'min_data_in_leaf': 398}. Best is trial 544 with value: 79.23314367466817.[0m
[32m[I 2024-10-13 13:52:39,503][0m Trial 607 finished with value: 79.77760061374474 and parameters: {'depth': 7, 'learning_rate': 0.13608161330154744, 'iterations': 107, 'l2_leaf_reg': 2.309803926706226e-08, 'border_count': 23, 'bagging_temperature': 0.1426096105674337, 'random_strength': 9.535818691300264, 'grow_policy': 'Lossguide', 'min_data_in_leaf': 803, 'max_leaves': 131}. Best is trial 544 with value: 79.23314367466817.[0m
[32m[I 2024-10-13 13:52:40,171][0m Trial 608 finished with value: 94.97377437478467 and parameters: {'depth': 7, 'learning_rate': 0.09042280045700408, 'iterations': 104, 'l2_leaf_reg': 2.544581404285994e-08, 'border_count': 14, 'bagging_temperature': 0.15191834726236078, 'random_strength': 9.56682381417567, 'grow_policy': 'Lossguide', 'min_data_in_leaf': 880, 'max_leaves': 132}. Best is trial 544 with value: 79.23314367466817.[0m
[32m[I 2024-10-13 13:52:40,854][0m Trial 609 finished with value: 92.65514955121608 and parameters: {'depth': 7, 'learning_rate': 0.1255948986621946, 'iterations': 214, 'l2_leaf_reg': 1.516851174304798e-08, 'border_count': 22, 'bagging_temperature': 0.16408974808772328, 'random_strength': 9.763050331366378, 'grow_policy': 'Lossguide', 'min_data_in_leaf': 757, 'max_leaves': 124}. Best is trial 544 with value: 79.23314367466817.[0m
[32m[I 2024-10-13 13:52:41,632][0m Trial 610 finished with value: 89.66239398616915 and parameters: {'depth': 7, 'learning_rate': 0.2520020371183287, 'iterations': 271, 'l2_leaf_reg': 1.0066089349488933e-08, 'border_count': 30, 'bagging_temperature': 0.1451259251636844, 'random_strength': 9.58643666671429, 'grow_policy': 'Lossguide', 'min_data_in_leaf': 717, 'max_leaves': 131}. Best is trial 544 with value: 79.23314367466817.[0m
[32m[I 2024-10-13 13:52:42,322][0m Trial 611 finished with value: 100.52997747881447 and parameters: {'depth': 7, 'learning_rate': 0.09225855200368019, 'iterations': 194, 'l2_leaf_reg': 3.0709747166122024e-08, 'border_count': 140, 'bagging_temperature': 0.16857432665236097, 'random_strength': 9.367897739272413, 'grow_policy': 'Lossguide', 'min_data_in_leaf': 670, 'max_leaves': 129}. Best is trial 544 with value: 79.23314367466817.[0m
[32m[I 2024-10-13 13:52:42,950][0m Trial 612 finished with value: 93.91784061062398 and parameters: {'depth': 7, 'learning_rate': 0.11072746787859941, 'iterations': 102, 'l2_leaf_reg': 2.3113425873404444e-08, 'border_count': 20, 'bagging_temperature': 0.14262478732389253, 'random_strength': 8.834127086005841, 'grow_policy': 'Lossguide', 'min_data_in_leaf': 526, 'max_leaves': 120}. Best is trial 544 with value: 79.23314367466817.[0m
[32m[I 2024-10-13 13:52:43,756][0m Trial 613 finished with value: 91.59571006583076 and parameters: {'depth': 6, 'learning_rate': 0.29668706302423226, 'iterations': 251, 'l2_leaf_reg': 1.438106217895219e-08, 'border_count': 32, 'bagging_temperature': 0.061386599761803884, 'random_strength': 9.511966568622642, 'grow_policy': 'Lossguide', 'min_data_in_leaf': 489, 'max_leaves': 136}. Best is trial 544 with value: 79.23314367466817.[0m
[32m[I 2024-10-13 13:52:44,522][0m Trial 614 finished with value: 97.10499120723887 and parameters: {'depth': 7, 'learning_rate': 0.1948264661283801, 'iterations': 330, 'l2_leaf_reg': 2.2345901468914576e-08, 'border_count': 26, 'bagging_temperature': 0.13058815802274376, 'random_strength': 9.739247443195847, 'grow_policy': 'Lossguide', 'min_data_in_leaf': 474, 'max_leaves': 188}. Best is trial 544 with value: 79.23314367466817.[0m
[32m[I 2024-10-13 13:52:45,170][0m Trial 615 finished with value: 89.65088238501397 and parameters: {'depth': 6, 'learning_rate': 0.1470559680042245, 'iterations': 186, 'l2_leaf_reg': 1.8550672404262028e-08, 'border_count': 10, 'bagging_temperature': 0.1594666938074182, 'random_strength': 9.842863387012217, 'grow_policy': 'Lossguide', 'min_data_in_leaf': 505, 'max_leaves': 128}. Best is trial 544 with value: 79.23314367466817.[0m
[32m[I 2024-10-13 13:52:45,823][0m Trial 616 finished with value: 92.1610659040646 and parameters: {'depth': 7, 'learning_rate': 0.1301541133104428, 'iterations': 145, 'l2_leaf_reg': 4.074312646502848e-08, 'border_count': 18, 'bagging_temperature': 0.17188811136405494, 'random_strength': 9.2374904573428, 'grow_policy': 'Lossguide', 'min_data_in_leaf': 734, 'max_leaves': 136}. Best is trial 544 with value: 79.23314367466817.[0m
[32m[I 2024-10-13 13:52:46,523][0m Trial 617 finished with value: 86.92213815051792 and parameters: {'depth': 6, 'learning_rate': 0.09075045439752404, 'iterations': 254, 'l2_leaf_reg': 3.199967558053221e-08, 'border_count': 32, 'bagging_temperature': 0.12116778264114259, 'random_strength': 9.133050535117693, 'grow_policy': 'Lossguide', 'min_data_in_leaf': 838, 'max_leaves': 118}. Best is trial 544 with value: 79.23314367466817.[0m
[32m[I 2024-10-13 13:52:47,195][0m Trial 618 finished with value: 109.99418411224684 and parameters: {'depth': 7, 'learning_rate': 0.22745527442895838, 'iterations': 197, 'l2_leaf_reg': 1.0358292065144096e-08, 'border_count': 123, 'bagging_temperature': 0.0811123634038951, 'random_strength': 9.815125220431112, 'grow_policy': 'Lossguide', 'min_data_in_leaf': 429, 'max_leaves': 154}. Best is trial 544 with value: 79.23314367466817.[0m
[32m[I 2024-10-13 13:52:47,976][0m Trial 619 finished with value: 90.77742328251247 and parameters: {'depth': 8, 'learning_rate': 0.10860733650137303, 'iterations': 313, 'l2_leaf_reg': 5.6851122481344256e-08, 'border_count': 26, 'bagging_temperature': 0.030512109883244213, 'random_strength': 9.522472955240632, 'grow_policy': 'Lossguide', 'min_data_in_leaf': 801, 'max_leaves': 132}. Best is trial 544 with value: 79.23314367466817.[0m
[32m[I 2024-10-13 13:52:48,620][0m Trial 620 finished with value: 92.93536827171063 and parameters: {'depth': 6, 'learning_rate': 0.16234716544705885, 'iterations': 156, 'l2_leaf_reg': 1.8630940420632496e-08, 'border_count': 19, 'bagging_temperature': 0.00021467301882866635, 'random_strength': 9.474296131928607, 'grow_policy': 'Lossguide', 'min_data_in_leaf': 530, 'max_leaves': 112}. Best is trial 544 with value: 79.23314367466817.[0m
[32m[I 2024-10-13 13:52:49,344][0m Trial 621 finished with value: 93.16225612085708 and parameters: {'depth': 5, 'learning_rate': 0.08671577767289437, 'iterations': 251, 'l2_leaf_reg': 1.0011025253688384e-08, 'border_count': 14, 'bagging_temperature': 0.14304764319687746, 'random_strength': 9.669280104601004, 'grow_policy': 'Lossguide', 'min_data_in_leaf': 455, 'max_leaves': 122}. Best is trial 544 with value: 79.23314367466817.[0m
[32m[I 2024-10-13 13:52:50,146][0m Trial 622 finished with value: 85.5717170369893 and parameters: {'depth': 7, 'learning_rate': 0.1286280642767953, 'iterations': 352, 'l2_leaf_reg': 3.907561287264147e-08, 'border_count': 34, 'bagging_temperature': 0.05534127297468752, 'random_strength': 9.063108299198754, 'grow_policy': 'Lossguide', 'min_data_in_leaf': 816, 'max_leaves': 255}. Best is trial 544 with value: 79.23314367466817.[0m
[32m[I 2024-10-13 13:52:50,831][0m Trial 623 finished with value: 80.80601890813361 and parameters: {'depth': 15, 'learning_rate': 0.10934219308686566, 'iterations': 203, 'l2_leaf_reg': 2.4587388867502228e-08, 'border_count': 24, 'bagging_temperature': 0.09104950397986367, 'random_strength': 8.683652346199468, 'grow_policy': 'Lossguide', 'min_data_in_leaf': 777, 'max_leaves': 140}. Best is trial 544 with value: 79.23314367466817.[0m
[32m[I 2024-10-13 13:52:51,438][0m Trial 624 finished with value: 88.01701186507165 and parameters: {'depth': 15, 'learning_rate': 0.11004125078868246, 'iterations': 104, 'l2_leaf_reg': 2.6709501704902687e-08, 'border_count': 26, 'bagging_temperature': 0.10092338740055873, 'random_strength': 9.01017228720401, 'grow_policy': 'Lossguide', 'min_data_in_leaf': 681, 'max_leaves': 138}. Best is trial 544 with value: 79.23314367466817.[0m
[32m[I 2024-10-13 13:52:52,079][0m Trial 625 finished with value: 91.65462528719664 and parameters: {'depth': 15, 'learning_rate': 0.09513008103877031, 'iterations': 100, 'l2_leaf_reg': 1.5972564690779595e-08, 'border_count': 21, 'bagging_temperature': 0.07427922557629278, 'random_strength': 8.68819019737956, 'grow_policy': 'Lossguide', 'min_data_in_leaf': 420, 'max_leaves': 133}. Best is trial 544 with value: 79.23314367466817.[0m
[32m[I 2024-10-13 13:52:52,820][0m Trial 626 finished with value: 86.11328824569762 and parameters: {'depth': 15, 'learning_rate': 0.11633605947632297, 'iterations': 202, 'l2_leaf_reg': 3.018583536259687e-08, 'border_count': 30, 'bagging_temperature': 0.09543379770237181, 'random_strength': 8.832373234489525, 'grow_policy': 'Lossguide', 'min_data_in_leaf': 762, 'max_leaves': 141}. Best is trial 544 with value: 79.23314367466817.[0m
[32m[I 2024-10-13 13:52:59,019][0m Trial 627 finished with value: 97.37423064841592 and parameters: {'depth': 14, 'learning_rate': 0.13955732526809173, 'iterations': 165, 'l2_leaf_reg': 2.1144897598392962e-08, 'border_count': 33, 'bagging_temperature': 0.04462720956645236, 'random_strength': 9.22534726051802, 'grow_policy': 'SymmetricTree', 'min_data_in_leaf': 362}. Best is trial 544 with value: 79.23314367466817.[0m
[32m[I 2024-10-13 13:52:59,571][0m Trial 628 finished with value: 81.30231247937384 and parameters: {'depth': 15, 'learning_rate': 0.08504949125098747, 'iterations': 193, 'l2_leaf_reg': 5.1967541870071206e-08, 'border_count': 23, 'bagging_temperature': 0.11188465527994892, 'random_strength': 8.842885678065302, 'grow_policy': 'Lossguide', 'min_data_in_leaf': 839, 'max_leaves': 136}. Best is trial 544 with value: 79.23314367466817.[0m
[32m[I 2024-10-13 13:53:00,373][0m Trial 629 finished with value: 308.7298884056793 and parameters: {'depth': 15, 'learning_rate': 0.00034335797946133525, 'iterations': 245, 'l2_leaf_reg': 1.7688443793880142e-08, 'border_count': 113, 'bagging_temperature': 0.1286968057231982, 'random_strength': 9.972671487290873, 'grow_policy': 'Lossguide', 'min_data_in_leaf': 783, 'max_leaves': 140}. Best is trial 544 with value: 79.23314367466817.[0m
[32m[I 2024-10-13 13:53:01,014][0m Trial 630 finished with value: 90.65566482611729 and parameters: {'depth': 14, 'learning_rate': 0.18517804334199092, 'iterations': 158, 'l2_leaf_reg': 4.9361501449062165e-08, 'border_count': 16, 'bagging_temperature': 0.08375584912226178, 'random_strength': 9.27425401102271, 'grow_policy': 'Lossguide', 'min_data_in_leaf': 782, 'max_leaves': 125}. Best is trial 544 with value: 79.23314367466817.[0m
[32m[I 2024-10-13 13:53:01,698][0m Trial 631 finished with value: 89.53622842486614 and parameters: {'depth': 15, 'learning_rate': 0.10160722078026058, 'iterations': 220, 'l2_leaf_reg': 3.1644021199071125e-08, 'border_count': 27, 'bagging_temperature': 0.11051549206620562, 'random_strength': 8.256336593394787, 'grow_policy': 'Lossguide', 'min_data_in_leaf': 478, 'max_leaves': 148}. Best is trial 544 with value: 79.23314367466817.[0m
[32m[I 2024-10-13 13:53:02,527][0m Trial 632 finished with value: 84.66697247658112 and parameters: {'depth': 8, 'learning_rate': 0.1399139574028597, 'iterations': 288, 'l2_leaf_reg': 1.522910369242689e-08, 'border_count': 34, 'bagging_temperature': 0.14855508501602752, 'random_strength': 8.647504285981533, 'grow_policy': 'Lossguide', 'min_data_in_leaf': 710, 'max_leaves': 128}. Best is trial 544 with value: 79.23314367466817.[0m
[32m[I 2024-10-13 13:53:03,127][0m Trial 633 finished with value: 125.31756087466772 and parameters: {'depth': 6, 'learning_rate': 0.11891849836058815, 'iterations': 101, 'l2_leaf_reg': 2.3365035894661523e-08, 'border_count': 5, 'bagging_temperature': 0.06849419714448256, 'random_strength': 8.900992978872647, 'grow_policy': 'Lossguide', 'min_data_in_leaf': 653, 'max_leaves': 144}. Best is trial 544 with value: 79.23314367466817.[0m
[32m[I 2024-10-13 13:53:03,776][0m Trial 634 finished with value: 91.43620021358598 and parameters: {'depth': 7, 'learning_rate': 0.2372067589846838, 'iterations': 154, 'l2_leaf_reg': 7.261660629825229e-08, 'border_count': 21, 'bagging_temperature': 0.08880997885598416, 'random_strength': 9.400268762995413, 'grow_policy': 'Lossguide', 'min_data_in_leaf': 473, 'max_leaves': 138}. Best is trial 544 with value: 79.23314367466817.[0m
[32m[I 2024-10-13 13:53:04,556][0m Trial 635 finished with value: 105.41895827671956 and parameters: {'depth': 14, 'learning_rate': 0.1650636047193912, 'iterations': 253, 'l2_leaf_reg': 1.3777272168269344e-08, 'border_count': 90, 'bagging_temperature': 0.17039640415640225, 'random_strength': 9.578324205457733, 'grow_policy': 'Lossguide', 'min_data_in_leaf': 442, 'max_leaves': 149}. Best is trial 544 with value: 79.23314367466817.[0m
[32m[I 2024-10-13 13:53:05,224][0m Trial 636 finished with value: 98.91047542468657 and parameters: {'depth': 8, 'learning_rate': 0.09867384761795771, 'iterations': 161, 'l2_leaf_reg': 3.551656505928754e-08, 'border_count': 84, 'bagging_temperature': 0.03961154125156008, 'random_strength': 9.992084544765792, 'grow_policy': 'Lossguide', 'min_data_in_leaf': 820, 'max_leaves': 143}. Best is trial 544 with value: 79.23314367466817.[0m
[32m[I 2024-10-13 13:53:05,989][0m Trial 637 finished with value: 95.19461884931262 and parameters: {'depth': 6, 'learning_rate': 0.206453473879776, 'iterations': 229, 'l2_leaf_reg': 1.5102465092118447e-08, 'border_count': 28, 'bagging_temperature': 0.12706697519689358, 'random_strength': 9.182220553609287, 'grow_policy': 'Lossguide', 'min_data_in_leaf': 874, 'max_leaves': 133}. Best is trial 544 with value: 79.23314367466817.[0m
[32m[I 2024-10-13 13:53:06,774][0m Trial 638 finished with value: 92.31017006489967 and parameters: {'depth': 6, 'learning_rate': 0.08288457832401318, 'iterations': 302, 'l2_leaf_reg': 2.2001318311503634e-08, 'border_count': 13, 'bagging_temperature': 0.05222472075125173, 'random_strength': 9.408272493432209, 'grow_policy': 'Lossguide', 'min_data_in_leaf': 504, 'max_leaves': 142}. Best is trial 544 with value: 79.23314367466817.[0m
[32m[I 2024-10-13 13:53:07,365][0m Trial 639 finished with value: 81.74477671473998 and parameters: {'depth': 8, 'learning_rate': 0.13211162508312235, 'iterations': 100, 'l2_leaf_reg': 4.392605593000603e-08, 'border_count': 23, 'bagging_temperature': 0.14245563975484665, 'random_strength': 9.01209224749569, 'grow_policy': 'Lossguide', 'min_data_in_leaf': 492, 'max_leaves': 146}. Best is trial 544 with value: 79.23314367466817.[0m
[32m[I 2024-10-13 13:53:08,119][0m Trial 640 finished with value: 82.11147202227586 and parameters: {'depth': 7, 'learning_rate': 0.1119857911965902, 'iterations': 202, 'l2_leaf_reg': 1.3336410869340739e-08, 'border_count': 29, 'bagging_temperature': 0.17331478992177063, 'random_strength': 9.649375762802464, 'grow_policy': 'Lossguide', 'min_data_in_leaf': 851, 'max_leaves': 151}. Best is trial 544 with value: 79.23314367466817.[0m
[32m[I 2024-10-13 13:53:08,924][0m Trial 641 finished with value: 88.47396347454215 and parameters: {'depth': 15, 'learning_rate': 0.15707042355081685, 'iterations': 286, 'l2_leaf_reg': 0.4070756151006, 'border_count': 33, 'bagging_temperature': 0.1121879270770161, 'random_strength': 8.45811971397265, 'grow_policy': 'Lossguide', 'min_data_in_leaf': 458, 'max_leaves': 107}. Best is trial 544 with value: 79.23314367466817.[0m
[32m[I 2024-10-13 13:53:09,579][0m Trial 642 finished with value: 93.21512616852567 and parameters: {'depth': 6, 'learning_rate': 0.08281671981295849, 'iterations': 164, 'l2_leaf_reg': 1.0395785151601125e-08, 'border_count': 20, 'bagging_temperature': 0.0865538224164633, 'random_strength': 8.635572709515607, 'grow_policy': 'Lossguide', 'min_data_in_leaf': 730, 'max_leaves': 247}. Best is trial 544 with value: 79.23314367466817.[0m
[32m[I 2024-10-13 13:53:10,261][0m Trial 643 finished with value: 91.37452105368017 and parameters: {'depth': 14, 'learning_rate': 0.18786801157749128, 'iterations': 212, 'l2_leaf_reg': 2.7457729587392417e-08, 'border_count': 17, 'bagging_temperature': 0.0286959750676428, 'random_strength': 9.31398225978111, 'grow_policy': 'Lossguide', 'min_data_in_leaf': 532, 'max_leaves': 136}. Best is trial 544 with value: 79.23314367466817.[0m
[32m[I 2024-10-13 13:53:11,022][0m Trial 644 finished with value: 89.07380301321629 and parameters: {'depth': 5, 'learning_rate': 0.09872193022288203, 'iterations': 259, 'l2_leaf_reg': 2.0557515818709144e-08, 'border_count': 10, 'bagging_temperature': 0.15805223429533818, 'random_strength': 9.733360229215338, 'grow_policy': 'Lossguide', 'min_data_in_leaf': 511, 'max_leaves': 116}. Best is trial 544 with value: 79.23314367466817.[0m
[32m[I 2024-10-13 13:53:11,664][0m Trial 645 finished with value: 91.7911785766487 and parameters: {'depth': 7, 'learning_rate': 0.2641611404087677, 'iterations': 147, 'l2_leaf_reg': 6.956161837801463e-08, 'border_count': 26, 'bagging_temperature': 0.13322697618437315, 'random_strength': 9.161835359253564, 'grow_policy': 'Lossguide', 'min_data_in_leaf': 488, 'max_leaves': 139}. Best is trial 544 with value: 79.23314367466817.[0m
[32m[I 2024-10-13 13:53:13,005][0m Trial 646 finished with value: 92.64186979416962 and parameters: {'depth': 6, 'learning_rate': 0.14167537221523827, 'iterations': 1050, 'l2_leaf_reg': 4.266930623270065e-08, 'border_count': 35, 'bagging_temperature': 0.8872866976313464, 'random_strength': 9.488341113767095, 'grow_policy': 'Lossguide', 'min_data_in_leaf': 464, 'max_leaves': 148}. Best is trial 544 with value: 79.23314367466817.[0m
[32m[I 2024-10-13 13:53:13,745][0m Trial 647 finished with value: 92.16411170127292 and parameters: {'depth': 7, 'learning_rate': 0.11984153424063508, 'iterations': 309, 'l2_leaf_reg': 3.9583567223530175e-06, 'border_count': 28, 'bagging_temperature': 0.061411957969251266, 'random_strength': 9.80329609160371, 'grow_policy': 'Lossguide', 'min_data_in_leaf': 395, 'max_leaves': 152}. Best is trial 544 with value: 79.23314367466817.[0m
[32m[I 2024-10-13 13:53:14,613][0m Trial 648 finished with value: 99.97942064861014 and parameters: {'depth': 6, 'learning_rate': 0.08245424060409443, 'iterations': 214, 'l2_leaf_reg': 2.9159079605463034e-08, 'border_count': 38, 'bagging_temperature': 0.17960714788729237, 'random_strength': 9.019262701884895, 'grow_policy': 'SymmetricTree', 'min_data_in_leaf': 531}. Best is trial 544 with value: 79.23314367466817.[0m
[32m[I 2024-10-13 13:53:16,589][0m Trial 649 finished with value: 95.29195357619112 and parameters: {'depth': 8, 'learning_rate': 0.21233754987631004, 'iterations': 1975, 'l2_leaf_reg': 1.6544343917261616e-08, 'border_count': 23, 'bagging_temperature': 0.11121437128035831, 'random_strength': 9.59837933766576, 'grow_policy': 'Lossguide', 'min_data_in_leaf': 493, 'max_leaves': 144}. Best is trial 544 with value: 79.23314367466817.[0m
[32m[I 2024-10-13 13:53:17,233][0m Trial 650 finished with value: 93.4057428894882 and parameters: {'depth': 8, 'learning_rate': 0.10003068622190647, 'iterations': 156, 'l2_leaf_reg': 1.3058911110102255e-08, 'border_count': 15, 'bagging_temperature': 0.1513508840300425, 'random_strength': 8.800587582482528, 'grow_policy': 'Lossguide', 'min_data_in_leaf': 897, 'max_leaves': 154}. Best is trial 544 with value: 79.23314367466817.[0m
