[32m[I 2024-10-13 13:47:59,964][0m Trial 351 finished with value: 92.79551715792775 and parameters: {'depth': 11, 'learning_rate': 0.04563536223833023, 'iterations': 435, 'l2_leaf_reg': 0.0007586256352482514, 'border_count': 21, 'bagging_temperature': 0.24819394797112262, 'random_strength': 8.286079797796639, 'grow_policy': 'Lossguide', 'min_data_in_leaf': 768, 'max_leaves': 152}. Best is trial 280 with value: 79.877599423719.[0m
[32m[I 2024-10-13 13:48:03,842][0m Trial 352 finished with value: 106.38107955216367 and parameters: {'depth': 13, 'learning_rate': 0.021596743291923265, 'iterations': 291, 'l2_leaf_reg': 0.0014795025405415912, 'border_count': 10, 'bagging_temperature': 0.13551682976937343, 'random_strength': 2.477344519871566, 'grow_policy': 'Lossguide', 'min_data_in_leaf': 2, 'max_leaves': 146}. Best is trial 280 with value: 79.877599423719.[0m
[32m[I 2024-10-13 13:48:05,676][0m Trial 353 finished with value: 273.64547991174305 and parameters: {'depth': 5, 'learning_rate': 0.030615447717661726, 'iterations': 1634, 'l2_leaf_reg': 0.00034447930322939154, 'border_count': 1, 'bagging_temperature': 0.21725213729872622, 'random_strength': 3.5647348103889667, 'grow_policy': 'Lossguide', 'min_data_in_leaf': 550, 'max_leaves': 158}. Best is trial 280 with value: 79.877599423719.[0m
[32m[I 2024-10-13 13:48:06,334][0m Trial 354 finished with value: 85.054630537178 and parameters: {'depth': 14, 'learning_rate': 0.0593155140209942, 'iterations': 160, 'l2_leaf_reg': 0.0001939224974611811, 'border_count': 46, 'bagging_temperature': 0.2367854001686306, 'random_strength': 3.12753648895455, 'grow_policy': 'Lossguide', 'min_data_in_leaf': 675, 'max_leaves': 242}. Best is trial 280 with value: 79.877599423719.[0m
[32m[I 2024-10-13 13:48:07,315][0m Trial 355 finished with value: 86.08869759667799 and parameters: {'depth': 9, 'learning_rate': 0.016663060165945175, 'iterations': 609, 'l2_leaf_reg': 0.00010644229530144043, 'border_count': 29, 'bagging_temperature': 0.2628836010548965, 'random_strength': 3.990137866246361, 'grow_policy': 'Lossguide', 'min_data_in_leaf': 936, 'max_leaves': 164}. Best is trial 280 with value: 79.877599423719.[0m
[32m[I 2024-10-13 13:48:08,175][0m Trial 356 finished with value: 82.21441489709039 and parameters: {'depth': 8, 'learning_rate': 0.03927105369423293, 'iterations': 368, 'l2_leaf_reg': 0.0005183467973816587, 'border_count': 35, 'bagging_temperature': 0.20392364852762773, 'random_strength': 3.730944425325702, 'grow_policy': 'Lossguide', 'min_data_in_leaf': 588, 'max_leaves': 142}. Best is trial 280 with value: 79.877599423719.[0m
[32m[I 2024-10-13 13:48:09,091][0m Trial 357 finished with value: 105.26180852602684 and parameters: {'depth': 10, 'learning_rate': 0.07268244808900981, 'iterations': 480, 'l2_leaf_reg': 0.0019554717419215393, 'border_count': 246, 'bagging_temperature': 0.16992824292353403, 'random_strength': 2.7690044665225684, 'grow_policy': 'Depthwise', 'min_data_in_leaf': 445}. Best is trial 280 with value: 79.877599423719.[0m
[32m[I 2024-10-13 13:48:09,824][0m Trial 358 finished with value: 84.9136058872266 and parameters: {'depth': 12, 'learning_rate': 0.04950981217915604, 'iterations': 251, 'l2_leaf_reg': 0.0009631220171912216, 'border_count': 31, 'bagging_temperature': 0.27823592504361355, 'random_strength': 2.9879093447323175, 'grow_policy': 'Lossguide', 'min_data_in_leaf': 572, 'max_leaves': 155}. Best is trial 280 with value: 79.877599423719.[0m
[32m[I 2024-10-13 13:48:10,613][0m Trial 359 finished with value: 83.62971079346761 and parameters: {'depth': 10, 'learning_rate': 0.03714498738356672, 'iterations': 323, 'l2_leaf_reg': 0.00022445735334634758, 'border_count': 40, 'bagging_temperature': 0.18921261381883503, 'random_strength': 3.350156902386397, 'grow_policy': 'Lossguide', 'min_data_in_leaf': 516, 'max_leaves': 168}. Best is trial 280 with value: 79.877599423719.[0m
[32m[I 2024-10-13 13:48:11,219][0m Trial 360 finished with value: 129.16075422309837 and parameters: {'depth': 10, 'learning_rate': 0.025552082111271985, 'iterations': 100, 'l2_leaf_reg': 0.0005383077061013268, 'border_count': 25, 'bagging_temperature': 0.24857190788901357, 'random_strength': 3.5479807566473265, 'grow_policy': 'Lossguide', 'min_data_in_leaf': 537, 'max_leaves': 150}. Best is trial 280 with value: 79.877599423719.[0m
[32m[I 2024-10-13 13:48:12,063][0m Trial 361 finished with value: 93.26958031256683 and parameters: {'depth': 11, 'learning_rate': 0.04501670762431897, 'iterations': 415, 'l2_leaf_reg': 0.0071408759784120784, 'border_count': 18, 'bagging_temperature': 0.22808684907621676, 'random_strength': 3.2831374217549567, 'grow_policy': 'Lossguide', 'min_data_in_leaf': 500, 'max_leaves': 130}. Best is trial 280 with value: 79.877599423719.[0m
[32m[I 2024-10-13 13:48:13,015][0m Trial 362 finished with value: 87.28273614665996 and parameters: {'depth': 12, 'learning_rate': 0.0863921803679195, 'iterations': 555, 'l2_leaf_reg': 5.4549556946894896e-05, 'border_count': 35, 'bagging_temperature': 0.29903164662475207, 'random_strength': 4.607347590241678, 'grow_policy': 'Lossguide', 'min_data_in_leaf': 412, 'max_leaves': 136}. Best is trial 280 with value: 79.877599423719.[0m
[32m[I 2024-10-13 13:48:13,746][0m Trial 363 finished with value: 83.4542318762031 and parameters: {'depth': 13, 'learning_rate': 0.06560307658171308, 'iterations': 219, 'l2_leaf_reg': 0.0003327214633119148, 'border_count': 45, 'bagging_temperature': 0.20744868340534675, 'random_strength': 4.190063416423355, 'grow_policy': 'Lossguide', 'min_data_in_leaf': 556, 'max_leaves': 207}. Best is trial 280 with value: 79.877599423719.[0m
[32m[I 2024-10-13 13:48:15,431][0m Trial 364 finished with value: 93.68566437108964 and parameters: {'depth': 10, 'learning_rate': 0.03398626603091436, 'iterations': 1545, 'l2_leaf_reg': 0.0007168631027829849, 'border_count': 28, 'bagging_temperature': 0.16043209109470485, 'random_strength': 3.827953874795993, 'grow_policy': 'Lossguide', 'min_data_in_leaf': 480, 'max_leaves': 146}. Best is trial 280 with value: 79.877599423719.[0m
[32m[I 2024-10-13 13:48:16,469][0m Trial 365 finished with value: 85.84411413748686 and parameters: {'depth': 11, 'learning_rate': 0.05487999946881647, 'iterations': 643, 'l2_leaf_reg': 0.0013553330742868618, 'border_count': 39, 'bagging_temperature': 0.35149217853811054, 'random_strength': 2.6159450429191002, 'grow_policy': 'Lossguide', 'min_data_in_leaf': 358, 'max_leaves': 160}. Best is trial 280 with value: 79.877599423719.[0m
[32m[I 2024-10-13 13:48:17,193][0m Trial 366 finished with value: 105.86555390292173 and parameters: {'depth': 13, 'learning_rate': 0.013296678047681521, 'iterations': 270, 'l2_leaf_reg': 0.00013424359560527846, 'border_count': 32, 'bagging_temperature': 0.22505068775113898, 'random_strength': 2.358668392681943, 'grow_policy': 'Lossguide', 'min_data_in_leaf': 532, 'max_leaves': 154}. Best is trial 280 with value: 79.877599423719.[0m
[32m[I 2024-10-13 13:48:18,053][0m Trial 367 finished with value: 90.90523192719279 and parameters: {'depth': 9, 'learning_rate': 0.11013869380735344, 'iterations': 363, 'l2_leaf_reg': 0.7954967872358458, 'border_count': 21, 'bagging_temperature': 0.25310421820795337, 'random_strength': 9.922040714295363, 'grow_policy': 'Lossguide', 'min_data_in_leaf': 575, 'max_leaves': 181}. Best is trial 280 with value: 79.877599423719.[0m
[32m[I 2024-10-13 13:48:19,668][0m Trial 368 finished with value: 88.00020221687646 and parameters: {'depth': 10, 'learning_rate': 0.0309459257506467, 'iterations': 1483, 'l2_leaf_reg': 0.0003657599805946036, 'border_count': 50, 'bagging_temperature': 0.17928483738646767, 'random_strength': 3.120566740785949, 'grow_policy': 'Lossguide', 'min_data_in_leaf': 233, 'max_leaves': 140}. Best is trial 280 with value: 79.877599423719.[0m
[32m[I 2024-10-13 13:48:22,103][0m Trial 369 finished with value: 87.85454522283754 and parameters: {'depth': 10, 'learning_rate': 0.04324568407033325, 'iterations': 493, 'l2_leaf_reg': 0.0006381724308640478, 'border_count': 26, 'bagging_temperature': 0.20563771201650538, 'random_strength': 3.4819610530158935, 'grow_policy': 'SymmetricTree', 'min_data_in_leaf': 1000}. Best is trial 280 with value: 79.877599423719.[0m
[32m[I 2024-10-13 13:48:22,739][0m Trial 370 finished with value: 88.06180286262791 and parameters: {'depth': 8, 'learning_rate': 0.28167294957867184, 'iterations': 185, 'l2_leaf_reg': 0.0030530524840163436, 'border_count': 42, 'bagging_temperature': 0.2689297620821144, 'random_strength': 6.743616112948638, 'grow_policy': 'Lossguide', 'min_data_in_leaf': 552, 'max_leaves': 151}. Best is trial 280 with value: 79.877599423719.[0m
[32m[I 2024-10-13 13:48:23,574][0m Trial 371 finished with value: 83.61426688665054 and parameters: {'depth': 13, 'learning_rate': 0.0565792039599518, 'iterations': 303, 'l2_leaf_reg': 0.0011112078585287875, 'border_count': 34, 'bagging_temperature': 0.8966840851079076, 'random_strength': 2.883596665744818, 'grow_policy': 'Lossguide', 'min_data_in_leaf': 509, 'max_leaves': 144}. Best is trial 280 with value: 79.877599423719.[0m
[32m[I 2024-10-13 13:48:24,401][0m Trial 372 finished with value: 91.72835099112974 and parameters: {'depth': 12, 'learning_rate': 0.07515151488045883, 'iterations': 412, 'l2_leaf_reg': 0.0002131737278782571, 'border_count': 14, 'bagging_temperature': 0.23326330178209526, 'random_strength': 4.790908565119147, 'grow_policy': 'Lossguide', 'min_data_in_leaf': 604, 'max_leaves': 157}. Best is trial 280 with value: 79.877599423719.[0m
[32m[I 2024-10-13 13:48:25,159][0m Trial 373 finished with value: 83.34718821416112 and parameters: {'depth': 11, 'learning_rate': 0.04834477029057966, 'iterations': 284, 'l2_leaf_reg': 1.2849356414000173e-07, 'border_count': 30, 'bagging_temperature': 0.19032448387805612, 'random_strength': 3.664263076939474, 'grow_policy': 'Lossguide', 'min_data_in_leaf': 341, 'max_leaves': 149}. Best is trial 280 with value: 79.877599423719.[0m
[32m[I 2024-10-13 13:48:26,232][0m Trial 374 finished with value: 93.47426606458379 and parameters: {'depth': 10, 'learning_rate': 0.06561654334525117, 'iterations': 720, 'l2_leaf_reg': 0.001746626266137567, 'border_count': 21, 'bagging_temperature': 0.2180566270314872, 'random_strength': 3.2902615499121484, 'grow_policy': 'Lossguide', 'min_data_in_leaf': 384, 'max_leaves': 126}. Best is trial 280 with value: 79.877599423719.[0m
[32m[I 2024-10-13 13:48:27,164][0m Trial 375 finished with value: 83.42346437348876 and parameters: {'depth': 9, 'learning_rate': 0.018580380275436743, 'iterations': 557, 'l2_leaf_reg': 0.0004821586434220404, 'border_count': 37, 'bagging_temperature': 0.24305490175471944, 'random_strength': 4.015134342048489, 'grow_policy': 'Lossguide', 'min_data_in_leaf': 461, 'max_leaves': 162}. Best is trial 280 with value: 79.877599423719.[0m
[32m[I 2024-10-13 13:48:27,988][0m Trial 376 finished with value: 86.48958909358292 and parameters: {'depth': 10, 'learning_rate': 0.0386082351234223, 'iterations': 370, 'l2_leaf_reg': 0.0008399652860597791, 'border_count': 26, 'bagging_temperature': 0.1450837754463093, 'random_strength': 3.0836919985008837, 'grow_policy': 'Lossguide', 'min_data_in_leaf': 532, 'max_leaves': 145}. Best is trial 280 with value: 79.877599423719.[0m
[32m[I 2024-10-13 13:48:28,848][0m Trial 377 finished with value: 84.41837899056301 and parameters: {'depth': 5, 'learning_rate': 0.02554163684872645, 'iterations': 448, 'l2_leaf_reg': 0.00025873980175934204, 'border_count': 43, 'bagging_temperature': 0.2846154493588507, 'random_strength': 4.4642372973123825, 'grow_policy': 'Lossguide', 'min_data_in_leaf': 305, 'max_leaves': 154}. Best is trial 280 with value: 79.877599423719.[0m
[32m[I 2024-10-13 13:48:30,449][0m Trial 378 finished with value: 89.02000740786303 and parameters: {'depth': 11, 'learning_rate': 0.03392060139003134, 'iterations': 1418, 'l2_leaf_reg': 0.00010991056345343754, 'border_count': 33, 'bagging_temperature': 0.32333844121188193, 'random_strength': 3.4306750816301586, 'grow_policy': 'Lossguide', 'min_data_in_leaf': 569, 'max_leaves': 139}. Best is trial 280 with value: 79.877599423719.[0m
[32m[I 2024-10-13 13:48:31,167][0m Trial 379 finished with value: 81.40583344491615 and parameters: {'depth': 10, 'learning_rate': 0.05488185436267413, 'iterations': 238, 'l2_leaf_reg': 0.0012101889384550483, 'border_count': 37, 'bagging_temperature': 0.20660937336507043, 'random_strength': 4.9489500053928435, 'grow_policy': 'Depthwise', 'min_data_in_leaf': 160}. Best is trial 280 with value: 79.877599423719.[0m
[32m[I 2024-10-13 13:48:31,973][0m Trial 380 finished with value: 91.92711799694251 and parameters: {'depth': 10, 'learning_rate': 0.052333648145193964, 'iterations': 159, 'l2_leaf_reg': 0.0013269250379574374, 'border_count': 29, 'bagging_temperature': 0.20115830870332074, 'random_strength': 3.6806867564466885, 'grow_policy': 'Depthwise', 'min_data_in_leaf': 35}. Best is trial 280 with value: 79.877599423719.[0m
[32m[I 2024-10-13 13:48:32,662][0m Trial 381 finished with value: 82.0223161298774 and parameters: {'depth': 10, 'learning_rate': 0.059563020059222094, 'iterations': 230, 'l2_leaf_reg': 0.002525510384476638, 'border_count': 23, 'bagging_temperature': 0.22455974686097907, 'random_strength': 1.7622860467817918, 'grow_policy': 'Depthwise', 'min_data_in_leaf': 637}. Best is trial 280 with value: 79.877599423719.[0m
[32m[I 2024-10-13 13:48:33,513][0m Trial 382 finished with value: 85.11980210849738 and parameters: {'depth': 10, 'learning_rate': 0.09456809449188701, 'iterations': 244, 'l2_leaf_reg': 0.0008992310841060052, 'border_count': 40, 'bagging_temperature': 0.17696299213850544, 'random_strength': 2.727481049304851, 'grow_policy': 'Depthwise', 'min_data_in_leaf': 205}. Best is trial 280 with value: 79.877599423719.[0m
[32m[I 2024-10-13 13:48:34,280][0m Trial 383 finished with value: 91.07601038087397 and parameters: {'depth': 10, 'learning_rate': 0.07768224615141853, 'iterations': 301, 'l2_leaf_reg': 0.005036656327783288, 'border_count': 17, 'bagging_temperature': 0.26080719085397136, 'random_strength': 6.34730376033573, 'grow_policy': 'Depthwise', 'min_data_in_leaf': 960}. Best is trial 280 with value: 79.877599423719.[0m
[32m[I 2024-10-13 13:48:34,939][0m Trial 384 finished with value: 86.11541579658048 and parameters: {'depth': 11, 'learning_rate': 0.04432170698123024, 'iterations': 170, 'l2_leaf_reg': 0.0019155780114592312, 'border_count': 35, 'bagging_temperature': 0.21157334365569777, 'random_strength': 2.958200344052095, 'grow_policy': 'Depthwise', 'min_data_in_leaf': 588}. Best is trial 280 with value: 79.877599423719.[0m
[32m[I 2024-10-13 13:48:35,776][0m Trial 385 finished with value: 85.63010145160428 and parameters: {'depth': 9, 'learning_rate': 0.029123920344184973, 'iterations': 336, 'l2_leaf_reg': 0.000564518376345144, 'border_count': 46, 'bagging_temperature': 0.24091593086680405, 'random_strength': 2.1002323600178445, 'grow_policy': 'Depthwise', 'min_data_in_leaf': 273}. Best is trial 280 with value: 79.877599423719.[0m
[32m[I 2024-10-13 13:48:36,511][0m Trial 386 finished with value: 276.53070725033956 and parameters: {'depth': 10, 'learning_rate': 0.0014775641923616533, 'iterations': 195, 'l2_leaf_reg': 0.0012036460591879985, 'border_count': 61, 'bagging_temperature': 0.7925162481123106, 'random_strength': 3.860049458397966, 'grow_policy': 'Depthwise', 'min_data_in_leaf': 550}. Best is trial 280 with value: 79.877599423719.[0m
[32m[I 2024-10-13 13:48:38,891][0m Trial 387 finished with value: 116.33451137905406 and parameters: {'depth': 13, 'learning_rate': 0.06174549360698377, 'iterations': 2339, 'l2_leaf_reg': 3.678466609724064e-05, 'border_count': 80, 'bagging_temperature': 0.18979930177174523, 'random_strength': 3.2448766282425554, 'grow_policy': 'Lossguide', 'min_data_in_leaf': 257, 'max_leaves': 167}. Best is trial 280 with value: 79.877599423719.[0m
[32m[I 2024-10-13 13:48:39,722][0m Trial 388 finished with value: 119.33189129816776 and parameters: {'depth': 10, 'learning_rate': 0.04136405526676825, 'iterations': 401, 'l2_leaf_reg': 0.00035552122223236806, 'border_count': 9, 'bagging_temperature': 0.22133830036268123, 'random_strength': 3.5262082949070757, 'grow_policy': 'Depthwise', 'min_data_in_leaf': 145}. Best is trial 280 with value: 79.877599423719.[0m
[32m[I 2024-10-13 13:48:40,601][0m Trial 389 finished with value: 101.87014768516532 and parameters: {'depth': 11, 'learning_rate': 0.04887069555853161, 'iterations': 259, 'l2_leaf_reg': 0.000743160939928348, 'border_count': 31, 'bagging_temperature': 0.1633238177144416, 'random_strength': 5.204372643675129, 'grow_policy': 'Lossguide', 'min_data_in_leaf': 51, 'max_leaves': 225}. Best is trial 280 with value: 79.877599423719.[0m
[32m[I 2024-10-13 13:48:41,552][0m Trial 390 finished with value: 88.22190232948904 and parameters: {'depth': 10, 'learning_rate': 0.07297513697823724, 'iterations': 507, 'l2_leaf_reg': 0.00017761008627768736, 'border_count': 25, 'bagging_temperature': 0.27483249738658594, 'random_strength': 2.5030260464664646, 'grow_policy': 'Lossguide', 'min_data_in_leaf': 507, 'max_leaves': 159}. Best is trial 280 with value: 79.877599423719.[0m
[32m[I 2024-10-13 13:48:42,307][0m Trial 391 finished with value: 82.16440106541876 and parameters: {'depth': 9, 'learning_rate': 0.056006945406750844, 'iterations': 310, 'l2_leaf_reg': 0.00040969551954959715, 'border_count': 39, 'bagging_temperature': 0.24718462611440617, 'random_strength': 3.14932592940528, 'grow_policy': 'Lossguide', 'min_data_in_leaf': 177, 'max_leaves': 164}. Best is trial 280 with value: 79.877599423719.[0m
[32m[I 2024-10-13 13:48:56,712][0m Trial 392 finished with value: 90.7269281461614 and parameters: {'depth': 13, 'learning_rate': 0.03327122166269256, 'iterations': 668, 'l2_leaf_reg': 0.0012497718487640224, 'border_count': 19, 'bagging_temperature': 0.1868489013121753, 'random_strength': 3.3669692925663792, 'grow_policy': 'SymmetricTree', 'min_data_in_leaf': 527}. Best is trial 280 with value: 79.877599423719.[0m
[32m[I 2024-10-13 13:48:57,551][0m Trial 393 finished with value: 85.30270047135626 and parameters: {'depth': 15, 'learning_rate': 0.040721682679465826, 'iterations': 447, 'l2_leaf_reg': 0.0006275267766308141, 'border_count': 51, 'bagging_temperature': 0.3038715252286595, 'random_strength': 2.824712991655907, 'grow_policy': 'Lossguide', 'min_data_in_leaf': 113, 'max_leaves': 232}. Best is trial 280 with value: 79.877599423719.[0m
[32m[I 2024-10-13 13:48:58,383][0m Trial 394 finished with value: 83.34769669988388 and parameters: {'depth': 6, 'learning_rate': 0.04931553135009599, 'iterations': 339, 'l2_leaf_reg': 0.0021201208060732707, 'border_count': 29, 'bagging_temperature': 0.20452106320604238, 'random_strength': 3.862196334091583, 'grow_policy': 'Lossguide', 'min_data_in_leaf': 567, 'max_leaves': 151}. Best is trial 280 with value: 79.877599423719.[0m
[32m[I 2024-10-13 13:48:59,079][0m Trial 395 finished with value: 80.51069076315946 and parameters: {'depth': 14, 'learning_rate': 0.06776608673280445, 'iterations': 207, 'l2_leaf_reg': 0.00024207066195372978, 'border_count': 35, 'bagging_temperature': 0.2294110583587219, 'random_strength': 3.621500764980224, 'grow_policy': 'Lossguide', 'min_data_in_leaf': 177, 'max_leaves': 148}. Best is trial 280 with value: 79.877599423719.[0m
[32m[I 2024-10-13 13:48:59,682][0m Trial 396 finished with value: 85.0429809390602 and parameters: {'depth': 14, 'learning_rate': 0.08297048621481722, 'iterations': 110, 'l2_leaf_reg': 0.00026733400726874673, 'border_count': 33, 'bagging_temperature': 0.23860748433398998, 'random_strength': 3.588551176593183, 'grow_policy': 'Lossguide', 'min_data_in_leaf': 588, 'max_leaves': 155}. Best is trial 280 with value: 79.877599423719.[0m
[32m[I 2024-10-13 13:49:00,416][0m Trial 397 finished with value: 87.74705393072246 and parameters: {'depth': 14, 'learning_rate': 0.06638321081752656, 'iterations': 189, 'l2_leaf_reg': 7.604942234982223e-05, 'border_count': 25, 'bagging_temperature': 0.2580601337798372, 'random_strength': 3.4015418780016367, 'grow_policy': 'Lossguide', 'min_data_in_leaf': 139, 'max_leaves': 170}. Best is trial 280 with value: 79.877599423719.[0m
[32m[I 2024-10-13 13:49:01,131][0m Trial 398 finished with value: 99.02332849962669 and parameters: {'depth': 14, 'learning_rate': 0.06865552158665238, 'iterations': 248, 'l2_leaf_reg': 0.0001980090319915927, 'border_count': 130, 'bagging_temperature': 0.22329573858650623, 'random_strength': 3.6888602947060027, 'grow_policy': 'Lossguide', 'min_data_in_leaf': 123, 'max_leaves': 149}. Best is trial 280 with value: 79.877599423719.[0m
[32m[I 2024-10-13 13:49:01,772][0m Trial 399 finished with value: 97.30566203192515 and parameters: {'depth': 15, 'learning_rate': 0.09864873806456818, 'iterations': 141, 'l2_leaf_reg': 0.00034087356893566377, 'border_count': 96, 'bagging_temperature': 0.2739480921404379, 'random_strength': 3.104130778149249, 'grow_policy': 'Lossguide', 'min_data_in_leaf': 605, 'max_leaves': 193}. Best is trial 280 with value: 79.877599423719.[0m
[32m[I 2024-10-13 13:49:02,527][0m Trial 400 finished with value: 81.52457482499524 and parameters: {'depth': 12, 'learning_rate': 0.06076562664880822, 'iterations': 239, 'l2_leaf_reg': 0.0001406922690662247, 'border_count': 36, 'bagging_temperature': 0.2382302138821205, 'random_strength': 3.536116573543559, 'grow_policy': 'Lossguide', 'min_data_in_leaf': 170, 'max_leaves': 159}. Best is trial 280 with value: 79.877599423719.[0m
