Optimizing CatBoost...
[32m[I 2024-10-13 04:51:34,268][0m Trial 0 finished with value: 14611.30251931124 and parameters: {'depth': 13, 'learning_rate': 0.0349017291733553, 'iterations': 1041, 'l2_leaf_reg': 4.6637035321333756e-05, 'border_count': 117, 'bagging_temperature': 0.4073389698597675, 'random_strength': 8.418888705538984, 'grow_policy': 'Depthwise', 'min_data_in_leaf': 517}. Best is trial 0 with value: 14611.30251931124.[0m
[32m[I 2024-10-13 04:51:35,351][0m Trial 1 finished with value: 21459.67382828904 and parameters: {'depth': 11, 'learning_rate': 0.0005374501009822005, 'iterations': 768, 'l2_leaf_reg': 3.1497883168555583, 'border_count': 189, 'bagging_temperature': 0.07218909238663707, 'random_strength': 7.892402738249741, 'grow_policy': 'Lossguide', 'min_data_in_leaf': 82, 'max_leaves': 155}. Best is trial 0 with value: 14611.30251931124.[0m
[32m[I 2024-10-13 04:51:37,000][0m Trial 2 finished with value: 16222.708662447696 and parameters: {'depth': 11, 'learning_rate': 0.01848353771089215, 'iterations': 172, 'l2_leaf_reg': 0.31170155451829173, 'border_count': 84, 'bagging_temperature': 0.30464560117665984, 'random_strength': 0.5635658834302837, 'grow_policy': 'SymmetricTree', 'min_data_in_leaf': 345}. Best is trial 0 with value: 14611.30251931124.[0m
[32m[I 2024-10-13 04:51:37,739][0m Trial 3 finished with value: 22813.65268108094 and parameters: {'depth': 10, 'learning_rate': 0.00022624046790849347, 'iterations': 290, 'l2_leaf_reg': 0.009645074813808684, 'border_count': 146, 'bagging_temperature': 0.18082165983329934, 'random_strength': 0.800957261089501, 'grow_policy': 'Depthwise', 'min_data_in_leaf': 636}. Best is trial 0 with value: 14611.30251931124.[0m
[32m[I 2024-10-13 04:51:38,884][0m Trial 4 finished with value: 14675.962855957214 and parameters: {'depth': 8, 'learning_rate': 0.01754575391368007, 'iterations': 756, 'l2_leaf_reg': 1.2210871119821955e-08, 'border_count': 208, 'bagging_temperature': 0.30731405344808294, 'random_strength': 7.544625129089817, 'grow_policy': 'Depthwise', 'min_data_in_leaf': 126}. Best is trial 0 with value: 14611.30251931124.[0m
[32m[I 2024-10-13 04:51:48,202][0m Trial 5 finished with value: 14058.617235001371 and parameters: {'depth': 3, 'learning_rate': 0.030818859794021543, 'iterations': 2901, 'l2_leaf_reg': 0.14460662956000922, 'border_count': 222, 'bagging_temperature': 0.6334498319049858, 'random_strength': 6.618728587084355, 'grow_policy': 'SymmetricTree', 'min_data_in_leaf': 504}. Best is trial 5 with value: 14058.617235001371.[0m
[32m[I 2024-10-13 04:51:51,791][0m Trial 6 finished with value: 11961.67903684056 and parameters: {'depth': 4, 'learning_rate': 0.09976987485969328, 'iterations': 886, 'l2_leaf_reg': 2.3127807284720266e-06, 'border_count': 217, 'bagging_temperature': 0.9465794687448766, 'random_strength': 0.9969029445716071, 'grow_policy': 'SymmetricTree', 'min_data_in_leaf': 277}. Best is trial 6 with value: 11961.67903684056.[0m
[32m[I 2024-10-13 04:52:15,668][0m Trial 7 finished with value: 17370.18010559833 and parameters: {'depth': 8, 'learning_rate': 0.0005211901804162223, 'iterations': 2298, 'l2_leaf_reg': 0.000434392475824428, 'border_count': 120, 'bagging_temperature': 0.9926154575976893, 'random_strength': 3.3011430972281888, 'grow_policy': 'SymmetricTree', 'min_data_in_leaf': 429}. Best is trial 6 with value: 11961.67903684056.[0m
[32m[I 2024-10-13 04:52:18,308][0m Trial 8 finished with value: 13487.809805531842 and parameters: {'depth': 14, 'learning_rate': 0.19468183770803887, 'iterations': 2500, 'l2_leaf_reg': 1.2367811657727193e-07, 'border_count': 20, 'bagging_temperature': 0.829061836090491, 'random_strength': 2.096440576389005, 'grow_policy': 'Lossguide', 'min_data_in_leaf': 74, 'max_leaves': 217}. Best is trial 6 with value: 11961.67903684056.[0m
[32m[I 2024-10-13 04:52:20,860][0m Trial 9 finished with value: 14885.185906309136 and parameters: {'depth': 5, 'learning_rate': 0.005957854551060955, 'iterations': 2697, 'l2_leaf_reg': 1.7141022460086992e-07, 'border_count': 223, 'bagging_temperature': 0.20877512608798143, 'random_strength': 0.23478741281102278, 'grow_policy': 'Depthwise', 'min_data_in_leaf': 240}. Best is trial 6 with value: 11961.67903684056.[0m
[32m[I 2024-10-13 04:52:28,275][0m Trial 10 finished with value: 14399.845117769177 and parameters: {'depth': 5, 'learning_rate': 0.2482597678164364, 'iterations': 1774, 'l2_leaf_reg': 2.2992743438138474e-06, 'border_count': 169, 'bagging_temperature': 0.6257001039365921, 'random_strength': 4.7039298250382595, 'grow_policy': 'SymmetricTree', 'min_data_in_leaf': 998}. Best is trial 6 with value: 11961.67903684056.[0m
[32m[I 2024-10-13 04:52:31,603][0m Trial 11 finished with value: 15944.88749362576 and parameters: {'depth': 6, 'learning_rate': 0.2281804112535651, 'iterations': 1642, 'l2_leaf_reg': 1.4692101373473755e-06, 'border_count': 7, 'bagging_temperature': 0.9732161444772155, 'random_strength': 2.824605694780165, 'grow_policy': 'Lossguide', 'min_data_in_leaf': 14, 'max_leaves': 238}. Best is trial 6 with value: 11961.67903684056.[0m
[32m[I 2024-10-13 04:52:33,768][0m Trial 12 finished with value: 14026.01754945199 and parameters: {'depth': 15, 'learning_rate': 0.10430014628392321, 'iterations': 2203, 'l2_leaf_reg': 1.9649800440358913e-08, 'border_count': 10, 'bagging_temperature': 0.797668669645148, 'random_strength': 2.489062925980783, 'grow_policy': 'Lossguide', 'min_data_in_leaf': 244, 'max_leaves': 235}. Best is trial 6 with value: 11961.67903684056.[0m
[32m[I 2024-10-13 04:52:35,196][0m Trial 13 finished with value: 15916.388799348737 and parameters: {'depth': 15, 'learning_rate': 0.09056187565636332, 'iterations': 1268, 'l2_leaf_reg': 2.6910450656468663e-05, 'border_count': 255, 'bagging_temperature': 0.7974188257272673, 'random_strength': 1.6530162605156509, 'grow_policy': 'Lossguide', 'min_data_in_leaf': 213, 'max_leaves': 37}. Best is trial 6 with value: 11961.67903684056.[0m
[32m[I 2024-10-13 04:52:42,011][0m Trial 14 finished with value: 14161.885647502755 and parameters: {'depth': 3, 'learning_rate': 0.005667885492031471, 'iterations': 2074, 'l2_leaf_reg': 7.917890178293854e-07, 'border_count': 60, 'bagging_temperature': 0.8260301560355259, 'random_strength': 4.7190764614410625, 'grow_policy': 'SymmetricTree', 'min_data_in_leaf': 673}. Best is trial 6 with value: 11961.67903684056.[0m
[32m[I 2024-10-13 04:53:06,068][0m Trial 15 finished with value: 16371.12438076929 and parameters: {'depth': 13, 'learning_rate': 0.07862964053372377, 'iterations': 1324, 'l2_leaf_reg': 1.5522427508455697e-05, 'border_count': 51, 'bagging_temperature': 0.60415093975307, 'random_strength': 9.680829624895415, 'grow_policy': 'Lossguide', 'min_data_in_leaf': 1, 'max_leaves': 164}. Best is trial 6 with value: 11961.67903684056.[0m
[32m[I 2024-10-13 04:53:08,469][0m Trial 16 finished with value: 16044.851230986656 and parameters: {'depth': 7, 'learning_rate': 0.29007799318673827, 'iterations': 2515, 'l2_leaf_reg': 0.0008010366879925625, 'border_count': 99, 'bagging_temperature': 0.8848932184443724, 'random_strength': 3.7588605163744866, 'grow_policy': 'Lossguide', 'min_data_in_leaf': 318, 'max_leaves': 71}. Best is trial 6 with value: 11961.67903684056.[0m
[32m[I 2024-10-13 04:53:34,900][0m Trial 17 finished with value: 18269.389638506484 and parameters: {'depth': 12, 'learning_rate': 0.0014967020652846847, 'iterations': 576, 'l2_leaf_reg': 1.2869401148751756e-07, 'border_count': 161, 'bagging_temperature': 0.7047026635953133, 'random_strength': 1.6547523459313784, 'grow_policy': 'SymmetricTree', 'min_data_in_leaf': 150}. Best is trial 6 with value: 11961.67903684056.[0m
[32m[I 2024-10-13 04:53:36,769][0m Trial 18 finished with value: 12992.670218261728 and parameters: {'depth': 9, 'learning_rate': 0.055651991155935956, 'iterations': 1875, 'l2_leaf_reg': 1.1451299097346674e-07, 'border_count': 44, 'bagging_temperature': 0.4606514058593961, 'random_strength': 5.956504350034611, 'grow_policy': 'Lossguide', 'min_data_in_leaf': 804, 'max_leaves': 197}. Best is trial 6 with value: 11961.67903684056.[0m
[32m[I 2024-10-13 04:53:59,412][0m Trial 19 finished with value: 13800.91472534902 and parameters: {'depth': 9, 'learning_rate': 0.002703940214475665, 'iterations': 1885, 'l2_leaf_reg': 7.765769313183876e-06, 'border_count': 46, 'bagging_temperature': 0.5053099622310389, 'random_strength': 5.728326784226632, 'grow_policy': 'SymmetricTree', 'min_data_in_leaf': 910}. Best is trial 6 with value: 11961.67903684056.[0m
[32m[I 2024-10-13 04:54:04,643][0m Trial 20 finished with value: 13199.727290293937 and parameters: {'depth': 4, 'learning_rate': 0.04896956485151362, 'iterations': 1388, 'l2_leaf_reg': 0.00013196161547558388, 'border_count': 250, 'bagging_temperature': 0.4617279309111987, 'random_strength': 5.753891164983381, 'grow_policy': 'SymmetricTree', 'min_data_in_leaf': 856}. Best is trial 6 with value: 11961.67903684056.[0m
[32m[I 2024-10-13 04:54:09,844][0m Trial 21 finished with value: 13936.761685067906 and parameters: {'depth': 4, 'learning_rate': 0.058200796440104896, 'iterations': 1371, 'l2_leaf_reg': 0.0025964006921779465, 'border_count': 249, 'bagging_temperature': 0.4186640308683133, 'random_strength': 5.963324586407753, 'grow_policy': 'SymmetricTree', 'min_data_in_leaf': 805}. Best is trial 6 with value: 11961.67903684056.[0m
[32m[I 2024-10-13 04:54:15,618][0m Trial 22 finished with value: 13826.07077085548 and parameters: {'depth': 6, 'learning_rate': 0.010312632443238443, 'iterations': 1041, 'l2_leaf_reg': 8.43116330359036e-05, 'border_count': 208, 'bagging_temperature': 0.5187247878306996, 'random_strength': 6.60482949154682, 'grow_policy': 'SymmetricTree', 'min_data_in_leaf': 782}. Best is trial 6 with value: 11961.67903684056.[0m
[32m[I 2024-10-13 04:54:21,331][0m Trial 23 finished with value: 13373.179284181344 and parameters: {'depth': 4, 'learning_rate': 0.04424924415238719, 'iterations': 1552, 'l2_leaf_reg': 5.651018759104716e-07, 'border_count': 236, 'bagging_temperature': 0.3933443733490101, 'random_strength': 4.030657930307432, 'grow_policy': 'SymmetricTree', 'min_data_in_leaf': 817}. Best is trial 6 with value: 11961.67903684056.[0m
[32m[I 2024-10-13 04:54:27,162][0m Trial 24 finished with value: 13123.471957291706 and parameters: {'depth': 6, 'learning_rate': 0.018601868653024385, 'iterations': 1093, 'l2_leaf_reg': 0.0001865867346952805, 'border_count': 188, 'bagging_temperature': 0.5384317800069869, 'random_strength': 5.554161711836122, 'grow_policy': 'SymmetricTree', 'min_data_in_leaf': 630}. Best is trial 6 with value: 11961.67903684056.[0m
[32m[I 2024-10-13 04:54:28,400][0m Trial 25 finished with value: 15844.62667678637 and parameters: {'depth': 7, 'learning_rate': 0.015557471601818739, 'iterations': 1005, 'l2_leaf_reg': 5.503028455100614e-06, 'border_count': 192, 'bagging_temperature': 0.7211993143376221, 'random_strength': 6.85753433283252, 'grow_policy': 'Lossguide', 'min_data_in_leaf': 654, 'max_leaves': 101}. Best is trial 6 with value: 11961.67903684056.[0m
[32m[I 2024-10-13 04:54:30,151][0m Trial 26 finished with value: 15844.064852768397 and parameters: {'depth': 9, 'learning_rate': 0.12011199606384929, 'iterations': 449, 'l2_leaf_reg': 0.014415934930432138, 'border_count': 176, 'bagging_temperature': 0.5606997320403717, 'random_strength': 5.194394338766709, 'grow_policy': 'SymmetricTree', 'min_data_in_leaf': 586}. Best is trial 6 with value: 11961.67903684056.[0m
[32m[I 2024-10-13 04:54:40,373][0m Trial 27 finished with value: 12073.427453376265 and parameters: {'depth': 6, 'learning_rate': 0.012667860551546567, 'iterations': 1955, 'l2_leaf_reg': 9.042117537507877e-08, 'border_count': 144, 'bagging_temperature': 0.023720116731283825, 'random_strength': 4.195158013561381, 'grow_policy': 'SymmetricTree', 'min_data_in_leaf': 729}. Best is trial 6 with value: 11961.67903684056.[0m
[32m[I 2024-10-13 04:54:42,318][0m Trial 28 finished with value: 15999.97346223185 and parameters: {'depth': 8, 'learning_rate': 0.0031885416602969955, 'iterations': 1971, 'l2_leaf_reg': 6.188317132606361e-08, 'border_count': 151, 'bagging_temperature': 0.08534832262212033, 'random_strength': 4.1487904040359105, 'grow_policy': 'Lossguide', 'min_data_in_leaf': 744, 'max_leaves': 187}. Best is trial 6 with value: 11961.67903684056.[0m
[32m[I 2024-10-13 04:54:44,208][0m Trial 29 finished with value: 15240.299637157186 and parameters: {'depth': 5, 'learning_rate': 0.026140805330080764, 'iterations': 1763, 'l2_leaf_reg': 3.208919847293583e-07, 'border_count': 100, 'bagging_temperature': 0.0088984575181122, 'random_strength': 3.158794928195057, 'grow_policy': 'Depthwise', 'min_data_in_leaf': 454}. Best is trial 6 with value: 11961.67903684056.[0m
[32m[I 2024-10-13 04:54:46,362][0m Trial 30 finished with value: 13316.330645828428 and parameters: {'depth': 7, 'learning_rate': 0.01082836821539146, 'iterations': 2230, 'l2_leaf_reg': 4.521822341371802e-08, 'border_count': 136, 'bagging_temperature': 0.32444583252425174, 'random_strength': 9.28459554548396, 'grow_policy': 'Depthwise', 'min_data_in_leaf': 926}. Best is trial 6 with value: 11961.67903684056.[0m
[32m[I 2024-10-13 04:54:51,887][0m Trial 31 finished with value: 13910.510716418115 and parameters: {'depth': 6, 'learning_rate': 0.02880907371314202, 'iterations': 970, 'l2_leaf_reg': 1.27962104090142e-06, 'border_count': 183, 'bagging_temperature': 0.1915109127532159, 'random_strength': 8.512398585442714, 'grow_policy': 'SymmetricTree', 'min_data_in_leaf': 732}. Best is trial 6 with value: 11961.67903684056.[0m
[32m[I 2024-10-13 04:55:08,785][0m Trial 32 finished with value: 13842.845648189366 and parameters: {'depth': 10, 'learning_rate': 0.00883307101971303, 'iterations': 709, 'l2_leaf_reg': 4.347493505702766e-06, 'border_count': 207, 'bagging_temperature': 0.9091142765951984, 'random_strength': 5.239733493102861, 'grow_policy': 'SymmetricTree', 'min_data_in_leaf': 539}. Best is trial 6 with value: 11961.67903684056.[0m
[32m[I 2024-10-13 04:55:13,478][0m Trial 33 finished with value: 13853.123011466896 and parameters: {'depth': 5, 'learning_rate': 0.0662401139388296, 'iterations': 1039, 'l2_leaf_reg': 3.100451068418112e-08, 'border_count': 132, 'bagging_temperature': 0.7233728551613027, 'random_strength': 7.025703936417444, 'grow_policy': 'SymmetricTree', 'min_data_in_leaf': 728}. Best is trial 6 with value: 11961.67903684056.[0m
[32m[I 2024-10-13 04:55:32,890][0m Trial 34 finished with value: 11932.803353705895 and parameters: {'depth': 10, 'learning_rate': 0.12396500234533596, 'iterations': 1193, 'l2_leaf_reg': 3.15941221330463e-07, 'border_count': 73, 'bagging_temperature': 0.11587166415859136, 'random_strength': 8.006727888129147, 'grow_policy': 'SymmetricTree', 'min_data_in_leaf': 593}. Best is trial 34 with value: 11932.803353705895.[0m
[32m[I 2024-10-13 04:56:17,321][0m Trial 35 finished with value: 12747.734098621277 and parameters: {'depth': 11, 'learning_rate': 0.14426152200475156, 'iterations': 1533, 'l2_leaf_reg': 3.369993346842481e-07, 'border_count': 74, 'bagging_temperature': 0.10834093552963582, 'random_strength': 8.206924605069009, 'grow_policy': 'SymmetricTree', 'min_data_in_leaf': 394}. Best is trial 34 with value: 11932.803353705895.[0m
[32m[I 2024-10-13 04:57:32,094][0m Trial 36 finished with value: 14126.315392512579 and parameters: {'depth': 12, 'learning_rate': 0.15105343599523602, 'iterations': 1514, 'l2_leaf_reg': 1.318478760287056e-08, 'border_count': 75, 'bagging_temperature': 0.11180672599653152, 'random_strength': 8.394263527982229, 'grow_policy': 'SymmetricTree', 'min_data_in_leaf': 368}. Best is trial 34 with value: 11932.803353705895.[0m
[32m[I 2024-10-13 04:58:22,524][0m Trial 37 finished with value: 12733.923631904872 and parameters: {'depth': 11, 'learning_rate': 0.13853964422992826, 'iterations': 1205, 'l2_leaf_reg': 2.2805119669527496e-07, 'border_count': 103, 'bagging_temperature': 0.24549451909336312, 'random_strength': 7.890708656357879, 'grow_policy': 'SymmetricTree', 'min_data_in_leaf': 415}. Best is trial 34 with value: 11932.803353705895.[0m
[32m[I 2024-10-13 04:58:38,168][0m Trial 38 finished with value: 20732.986242791696 and parameters: {'depth': 10, 'learning_rate': 0.0007755755751127867, 'iterations': 849, 'l2_leaf_reg': 2.4922918959810394, 'border_count': 102, 'bagging_temperature': 0.02160524940583311, 'random_strength': 7.472204622672236, 'grow_policy': 'SymmetricTree', 'min_data_in_leaf': 308}. Best is trial 34 with value: 11932.803353705895.[0m
[32m[I 2024-10-13 04:59:24,257][0m Trial 39 finished with value: 11909.084067980622 and parameters: {'depth': 11, 'learning_rate': 0.17377780067115345, 'iterations': 1201, 'l2_leaf_reg': 2.9766032021120316e-05, 'border_count': 120, 'bagging_temperature': 0.25903131885830866, 'random_strength': 8.954866566008963, 'grow_policy': 'SymmetricTree', 'min_data_in_leaf': 563}. Best is trial 39 with value: 11909.084067980622.[0m
[32m[I 2024-10-13 04:59:25,023][0m Trial 40 finished with value: 14297.326085567496 and parameters: {'depth': 12, 'learning_rate': 0.18442125385116967, 'iterations': 315, 'l2_leaf_reg': 1.3466080116295145e-05, 'border_count': 120, 'bagging_temperature': 0.26971794843827424, 'random_strength': 8.93508170457254, 'grow_policy': 'Depthwise', 'min_data_in_leaf': 542}. Best is trial 39 with value: 11909.084067980622.[0m
[32m[I 2024-10-13 05:00:01,983][0m Trial 41 finished with value: 22190.54424455268 and parameters: {'depth': 11, 'learning_rate': 0.00012630367503571428, 'iterations': 1219, 'l2_leaf_reg': 3.0663629722925736e-06, 'border_count': 109, 'bagging_temperature': 0.1553414418630479, 'random_strength': 9.73179751054699, 'grow_policy': 'SymmetricTree', 'min_data_in_leaf': 453}. Best is trial 39 with value: 11909.084067980622.[0m
[32m[I 2024-10-13 05:00:24,245][0m Trial 42 finished with value: 13562.048343331418 and parameters: {'depth': 10, 'learning_rate': 0.11198007815622636, 'iterations': 869, 'l2_leaf_reg': 5.7955865783602264e-05, 'border_count': 90, 'bagging_temperature': 0.2542279916148167, 'random_strength': 7.670842549103655, 'grow_policy': 'SymmetricTree', 'min_data_in_leaf': 594}. Best is trial 39 with value: 11909.084067980622.[0m
[32m[I 2024-10-13 05:01:37,253][0m Trial 43 finished with value: 11697.259560267383 and parameters: {'depth': 13, 'learning_rate': 0.17046371316574052, 'iterations': 1179, 'l2_leaf_reg': 3.697667581954917e-07, 'border_count': 146, 'bagging_temperature': 0.13615880968145386, 'random_strength': 1.1088190136202236, 'grow_policy': 'SymmetricTree', 'min_data_in_leaf': 431}. Best is trial 43 with value: 11697.259560267383.[0m
[32m[I 2024-10-13 05:02:39,083][0m Trial 44 finished with value: 12854.918445277946 and parameters: {'depth': 13, 'learning_rate': 0.21344428690288764, 'iterations': 1155, 'l2_leaf_reg': 7.948226252765231e-07, 'border_count': 146, 'bagging_temperature': 0.04471049322194125, 'random_strength': 0.10176424090554992, 'grow_policy': 'SymmetricTree', 'min_data_in_leaf': 494}. Best is trial 43 with value: 11697.259560267383.[0m
[32m[I 2024-10-13 05:03:09,028][0m Trial 45 finished with value: 12893.995767665992 and parameters: {'depth': 13, 'learning_rate': 0.29678394574531064, 'iterations': 811, 'l2_leaf_reg': 1.807597033575639e-06, 'border_count': 159, 'bagging_temperature': 0.13808952229731283, 'random_strength': 1.046525510208034, 'grow_policy': 'SymmetricTree', 'min_data_in_leaf': 596}. Best is trial 43 with value: 11697.259560267383.[0m
[32m[I 2024-10-13 05:05:04,347][0m Trial 46 finished with value: 11788.450053701486 and parameters: {'depth': 14, 'learning_rate': 0.08537892537423669, 'iterations': 560, 'l2_leaf_reg': 2.559448110120823e-05, 'border_count': 128, 'bagging_temperature': 0.3352435332586348, 'random_strength': 1.0635650924960391, 'grow_policy': 'SymmetricTree', 'min_data_in_leaf': 503}. Best is trial 43 with value: 11697.259560267383.[0m
[32m[I 2024-10-13 05:05:54,229][0m Trial 47 finished with value: 12658.51881552159 and parameters: {'depth': 14, 'learning_rate': 0.03780298167179048, 'iterations': 574, 'l2_leaf_reg': 3.640308524902983e-05, 'border_count': 29, 'bagging_temperature': 0.37468218927366703, 'random_strength': 0.8836420928039571, 'grow_policy': 'SymmetricTree', 'min_data_in_leaf': 482}. Best is trial 43 with value: 11697.259560267383.[0m
[32m[I 2024-10-13 05:05:55,291][0m Trial 48 finished with value: 13722.615111936797 and parameters: {'depth': 14, 'learning_rate': 0.08314271539634091, 'iterations': 666, 'l2_leaf_reg': 0.0007028603010867323, 'border_count': 124, 'bagging_temperature': 0.34669715369251247, 'random_strength': 1.6131520757951554, 'grow_policy': 'Depthwise', 'min_data_in_leaf': 267}. Best is trial 43 with value: 11697.259560267383.[0m
[32m[I 2024-10-13 05:05:57,847][0m Trial 49 finished with value: 17551.10021774654 and parameters: {'depth': 12, 'learning_rate': 0.17561773925536014, 'iterations': 193, 'l2_leaf_reg': 1.3483574665146958e-05, 'border_count': 113, 'bagging_temperature': 0.2972275982420215, 'random_strength': 2.252349701380904, 'grow_policy': 'SymmetricTree', 'min_data_in_leaf': 190}. Best is trial 43 with value: 11697.259560267383.[0m
[32m[I 2024-10-13 05:06:15,186][0m Trial 50 finished with value: 15621.400586031159 and parameters: {'depth': 14, 'learning_rate': 0.08977958915990894, 'iterations': 480, 'l2_leaf_reg': 3.368217905433697e-05, 'border_count': 67, 'bagging_temperature': 0.21381288947001545, 'random_strength': 0.4416894687241433, 'grow_policy': 'SymmetricTree', 'min_data_in_leaf': 346}. Best is trial 43 with value: 11697.259560267383.[0m
