[32m[I 2024-10-13 05:57:12,463][0m Trial 154 finished with value: 11274.303869781448 and parameters: {'depth': 4, 'learning_rate': 0.013235029390381674, 'iterations': 389, 'l2_leaf_reg': 4.721906830123159e-08, 'border_count': 21, 'bagging_temperature': 0.8109954444949398, 'random_strength': 2.145546814817163, 'grow_policy': 'SymmetricTree', 'min_data_in_leaf': 390}. Best is trial 92 with value: 9280.71396120231.[0m
[32m[I 2024-10-13 05:57:13,567][0m Trial 155 finished with value: 12934.822481565254 and parameters: {'depth': 5, 'learning_rate': 0.025847660233556585, 'iterations': 486, 'l2_leaf_reg': 2.110347036705295e-08, 'border_count': 43, 'bagging_temperature': 0.776047002058924, 'random_strength': 3.3483199709792553, 'grow_policy': 'SymmetricTree', 'min_data_in_leaf': 350}. Best is trial 92 with value: 9280.71396120231.[0m
[32m[I 2024-10-13 05:57:14,464][0m Trial 156 finished with value: 18529.87622125457 and parameters: {'depth': 5, 'learning_rate': 0.04903659872667052, 'iterations': 325, 'l2_leaf_reg': 6.042132249309969e-08, 'border_count': 1, 'bagging_temperature': 0.7054847744333258, 'random_strength': 3.1713929003289945, 'grow_policy': 'SymmetricTree', 'min_data_in_leaf': 403}. Best is trial 92 with value: 9280.71396120231.[0m
[32m[I 2024-10-13 05:57:15,245][0m Trial 157 finished with value: 13727.944121577759 and parameters: {'depth': 8, 'learning_rate': 0.014605789519921471, 'iterations': 110, 'l2_leaf_reg': 3.5105399624381616e-08, 'border_count': 11, 'bagging_temperature': 0.8640136575289837, 'random_strength': 1.9545707945240158, 'grow_policy': 'SymmetricTree', 'min_data_in_leaf': 430}. Best is trial 92 with value: 9280.71396120231.[0m
[32m[I 2024-10-13 05:57:17,625][0m Trial 158 finished with value: 13766.859236007602 and parameters: {'depth': 4, 'learning_rate': 0.02063071715359025, 'iterations': 544, 'l2_leaf_reg': 0.0004712731593596455, 'border_count': 50, 'bagging_temperature': 0.7382803114702361, 'random_strength': 2.288992878535668, 'grow_policy': 'SymmetricTree', 'min_data_in_leaf': 471}. Best is trial 92 with value: 9280.71396120231.[0m
[32m[I 2024-10-13 05:57:18,407][0m Trial 159 finished with value: 11560.572165256814 and parameters: {'depth': 4, 'learning_rate': 0.017575492248200406, 'iterations': 239, 'l2_leaf_reg': 1.7598711674925042e-08, 'border_count': 18, 'bagging_temperature': 0.8503105133486287, 'random_strength': 2.816637758540494, 'grow_policy': 'SymmetricTree', 'min_data_in_leaf': 415}. Best is trial 92 with value: 9280.71396120231.[0m
[32m[I 2024-10-13 05:57:19,506][0m Trial 160 finished with value: 13622.068256148486 and parameters: {'depth': 6, 'learning_rate': 0.004501103939621228, 'iterations': 425, 'l2_leaf_reg': 1.635538177404181e-07, 'border_count': 29, 'bagging_temperature': 0.9943919572381454, 'random_strength': 4.9719509331126535, 'grow_policy': 'SymmetricTree', 'min_data_in_leaf': 370}. Best is trial 92 with value: 9280.71396120231.[0m
[32m[I 2024-10-13 05:57:22,723][0m Trial 161 finished with value: 11753.60768276038 and parameters: {'depth': 6, 'learning_rate': 0.039002637852774386, 'iterations': 611, 'l2_leaf_reg': 1.0193761033769246e-07, 'border_count': 23, 'bagging_temperature': 0.8825161291960248, 'random_strength': 2.4944018936835577, 'grow_policy': 'SymmetricTree', 'min_data_in_leaf': 396}. Best is trial 92 with value: 9280.71396120231.[0m
[32m[I 2024-10-13 05:57:23,702][0m Trial 162 finished with value: 10205.725625553398 and parameters: {'depth': 3, 'learning_rate': 0.024392217422495605, 'iterations': 478, 'l2_leaf_reg': 2.8538312392923845e-08, 'border_count': 15, 'bagging_temperature': 0.9315196755110368, 'random_strength': 2.5299889966042017, 'grow_policy': 'SymmetricTree', 'min_data_in_leaf': 448}. Best is trial 92 with value: 9280.71396120231.[0m
[32m[I 2024-10-13 05:57:24,561][0m Trial 163 finished with value: 14438.839177528676 and parameters: {'depth': 3, 'learning_rate': 0.02656863768283744, 'iterations': 371, 'l2_leaf_reg': 2.6961066019809785e-08, 'border_count': 7, 'bagging_temperature': 0.9308975617244613, 'random_strength': 2.617627392661148, 'grow_policy': 'SymmetricTree', 'min_data_in_leaf': 449}. Best is trial 92 with value: 9280.71396120231.[0m
[32m[I 2024-10-13 05:57:25,872][0m Trial 164 finished with value: 9772.269036302892 and parameters: {'depth': 7, 'learning_rate': 0.021402031649123437, 'iterations': 472, 'l2_leaf_reg': 1.499404953556518e-08, 'border_count': 15, 'bagging_temperature': 0.9567464936923477, 'random_strength': 2.24734967464109, 'grow_policy': 'SymmetricTree', 'min_data_in_leaf': 486}. Best is trial 92 with value: 9280.71396120231.[0m
[32m[I 2024-10-13 05:57:26,901][0m Trial 165 finished with value: 10122.161544381914 and parameters: {'depth': 7, 'learning_rate': 0.03191419081387284, 'iterations': 283, 'l2_leaf_reg': 1.800370908071402e-08, 'border_count': 35, 'bagging_temperature': 0.9786538889579638, 'random_strength': 2.246981681806566, 'grow_policy': 'SymmetricTree', 'min_data_in_leaf': 505}. Best is trial 92 with value: 9280.71396120231.[0m
[32m[I 2024-10-13 05:57:27,894][0m Trial 166 finished with value: 10276.087324412707 and parameters: {'depth': 7, 'learning_rate': 0.03131215065645668, 'iterations': 280, 'l2_leaf_reg': 1.4682607447553932e-08, 'border_count': 36, 'bagging_temperature': 0.8214251384572407, 'random_strength': 2.1669957372586057, 'grow_policy': 'SymmetricTree', 'min_data_in_leaf': 511}. Best is trial 92 with value: 9280.71396120231.[0m
[32m[I 2024-10-13 05:57:28,823][0m Trial 167 finished with value: 10012.574192753866 and parameters: {'depth': 5, 'learning_rate': 0.02196477983336092, 'iterations': 318, 'l2_leaf_reg': 5.114596045174061e-08, 'border_count': 29, 'bagging_temperature': 0.9536268323985592, 'random_strength': 1.781863601249755, 'grow_policy': 'SymmetricTree', 'min_data_in_leaf': 491}. Best is trial 92 with value: 9280.71396120231.[0m
[32m[I 2024-10-13 05:57:29,599][0m Trial 168 finished with value: 9893.086537093279 and parameters: {'depth': 5, 'learning_rate': 0.03541114171073032, 'iterations': 220, 'l2_leaf_reg': 1.7578157559111275e-08, 'border_count': 31, 'bagging_temperature': 0.9493314870311567, 'random_strength': 1.8761985769466758, 'grow_policy': 'SymmetricTree', 'min_data_in_leaf': 527}. Best is trial 92 with value: 9280.71396120231.[0m
[32m[I 2024-10-13 05:57:30,373][0m Trial 169 finished with value: 9231.559953752558 and parameters: {'depth': 5, 'learning_rate': 0.045050083112783544, 'iterations': 177, 'l2_leaf_reg': 6.482436468126797e-08, 'border_count': 29, 'bagging_temperature': 0.9533160153644497, 'random_strength': 1.904608605522799, 'grow_policy': 'SymmetricTree', 'min_data_in_leaf': 532}. Best is trial 169 with value: 9231.559953752558.[0m
[32m[I 2024-10-13 05:57:31,183][0m Trial 170 finished with value: 10092.785925134476 and parameters: {'depth': 5, 'learning_rate': 0.04463116027412441, 'iterations': 201, 'l2_leaf_reg': 7.127964641087971e-08, 'border_count': 30, 'bagging_temperature': 0.9134990210144759, 'random_strength': 1.9033213150569617, 'grow_policy': 'SymmetricTree', 'min_data_in_leaf': 598}. Best is trial 169 with value: 9231.559953752558.[0m
[32m[I 2024-10-13 05:57:31,933][0m Trial 171 finished with value: 11253.266416609053 and parameters: {'depth': 5, 'learning_rate': 0.05597842907764318, 'iterations': 157, 'l2_leaf_reg': 7.259573291777865e-08, 'border_count': 42, 'bagging_temperature': 0.9129963716581112, 'random_strength': 1.9402333299039756, 'grow_policy': 'SymmetricTree', 'min_data_in_leaf': 602}. Best is trial 169 with value: 9231.559953752558.[0m
[32m[I 2024-10-13 05:57:32,719][0m Trial 172 finished with value: 9253.686747092435 and parameters: {'depth': 5, 'learning_rate': 0.04438884549321889, 'iterations': 210, 'l2_leaf_reg': 5.040102380799935e-08, 'border_count': 29, 'bagging_temperature': 0.9573541541706343, 'random_strength': 1.6217190807441926, 'grow_policy': 'SymmetricTree', 'min_data_in_leaf': 561}. Best is trial 169 with value: 9231.559953752558.[0m
[32m[I 2024-10-13 05:57:33,494][0m Trial 173 finished with value: 9685.839214512293 and parameters: {'depth': 5, 'learning_rate': 0.03664854248928507, 'iterations': 205, 'l2_leaf_reg': 4.206337752219449e-08, 'border_count': 28, 'bagging_temperature': 0.9564804187503609, 'random_strength': 1.6353315412423433, 'grow_policy': 'SymmetricTree', 'min_data_in_leaf': 562}. Best is trial 169 with value: 9231.559953752558.[0m
[32m[I 2024-10-13 05:57:34,167][0m Trial 174 finished with value: 9939.720331897692 and parameters: {'depth': 5, 'learning_rate': 0.0402906306193968, 'iterations': 107, 'l2_leaf_reg': 4.9644869673542197e-08, 'border_count': 28, 'bagging_temperature': 0.9581035511605952, 'random_strength': 1.5506505837384266, 'grow_policy': 'SymmetricTree', 'min_data_in_leaf': 568}. Best is trial 169 with value: 9231.559953752558.[0m
[32m[I 2024-10-13 05:57:34,877][0m Trial 175 finished with value: 9839.587401272856 and parameters: {'depth': 5, 'learning_rate': 0.04694636987468551, 'iterations': 103, 'l2_leaf_reg': 1.0143551445279841e-07, 'border_count': 24, 'bagging_temperature': 0.9647788586383811, 'random_strength': 1.480977027676082, 'grow_policy': 'SymmetricTree', 'min_data_in_leaf': 562}. Best is trial 169 with value: 9231.559953752558.[0m
[32m[I 2024-10-13 05:57:35,509][0m Trial 176 finished with value: 12450.277960780266 and parameters: {'depth': 5, 'learning_rate': 0.04812937318799085, 'iterations': 124, 'l2_leaf_reg': 2.3499140242530852e-07, 'border_count': 25, 'bagging_temperature': 0.9618365924582054, 'random_strength': 1.6078262329733057, 'grow_policy': 'Lossguide', 'min_data_in_leaf': 584, 'max_leaves': 139}. Best is trial 169 with value: 9231.559953752558.[0m
[32m[I 2024-10-13 05:57:36,279][0m Trial 177 finished with value: 9405.544742352966 and parameters: {'depth': 5, 'learning_rate': 0.041109303877768746, 'iterations': 197, 'l2_leaf_reg': 1.316120764304117e-07, 'border_count': 31, 'bagging_temperature': 0.9998329938476359, 'random_strength': 1.5619605322158587, 'grow_policy': 'SymmetricTree', 'min_data_in_leaf': 559}. Best is trial 169 with value: 9231.559953752558.[0m
[32m[I 2024-10-13 05:57:36,970][0m Trial 178 finished with value: 9155.456753562328 and parameters: {'depth': 5, 'learning_rate': 0.0642348990442989, 'iterations': 106, 'l2_leaf_reg': 1.3861670170297163e-07, 'border_count': 36, 'bagging_temperature': 0.994804496027079, 'random_strength': 1.3753243066671064, 'grow_policy': 'SymmetricTree', 'min_data_in_leaf': 562}. Best is trial 178 with value: 9155.456753562328.[0m
[32m[I 2024-10-13 05:57:37,647][0m Trial 179 finished with value: 9573.890297631628 and parameters: {'depth': 5, 'learning_rate': 0.0408389259170894, 'iterations': 113, 'l2_leaf_reg': 1.4123617946018897e-07, 'border_count': 27, 'bagging_temperature': 0.9961354856558616, 'random_strength': 1.408179459400011, 'grow_policy': 'SymmetricTree', 'min_data_in_leaf': 567}. Best is trial 178 with value: 9155.456753562328.[0m
[32m[I 2024-10-13 05:57:38,338][0m Trial 180 finished with value: 9912.919971315901 and parameters: {'depth': 5, 'learning_rate': 0.04063477731310855, 'iterations': 101, 'l2_leaf_reg': 1.3983551307605635e-07, 'border_count': 26, 'bagging_temperature': 0.9983991689138336, 'random_strength': 1.3337464275067803, 'grow_policy': 'SymmetricTree', 'min_data_in_leaf': 532}. Best is trial 178 with value: 9155.456753562328.[0m
[32m[I 2024-10-13 05:57:39,092][0m Trial 181 finished with value: 9644.36079479759 and parameters: {'depth': 5, 'learning_rate': 0.04100321297480201, 'iterations': 169, 'l2_leaf_reg': 1.6754363903410104e-07, 'border_count': 27, 'bagging_temperature': 0.9974773210621528, 'random_strength': 1.3679496165191223, 'grow_policy': 'SymmetricTree', 'min_data_in_leaf': 571}. Best is trial 178 with value: 9155.456753562328.[0m
[32m[I 2024-10-13 05:57:39,840][0m Trial 182 finished with value: 9237.911350963745 and parameters: {'depth': 5, 'learning_rate': 0.04506770768817254, 'iterations': 174, 'l2_leaf_reg': 2.7202579507073644e-07, 'border_count': 32, 'bagging_temperature': 0.998205823453529, 'random_strength': 1.3427394254489096, 'grow_policy': 'SymmetricTree', 'min_data_in_leaf': 539}. Best is trial 178 with value: 9155.456753562328.[0m
[32m[I 2024-10-13 05:57:40,583][0m Trial 183 finished with value: 8824.50164984993 and parameters: {'depth': 5, 'learning_rate': 0.06294910640345923, 'iterations': 177, 'l2_leaf_reg': 2.311992714595201e-07, 'border_count': 33, 'bagging_temperature': 0.9865214310059284, 'random_strength': 1.366876191148231, 'grow_policy': 'SymmetricTree', 'min_data_in_leaf': 554}. Best is trial 183 with value: 8824.50164984993.[0m
[32m[I 2024-10-13 05:57:41,308][0m Trial 184 finished with value: 8743.357111078776 and parameters: {'depth': 5, 'learning_rate': 0.06513024702341733, 'iterations': 154, 'l2_leaf_reg': 2.5535459421298014e-07, 'border_count': 32, 'bagging_temperature': 0.9882013992330907, 'random_strength': 1.358133177177406, 'grow_policy': 'SymmetricTree', 'min_data_in_leaf': 560}. Best is trial 184 with value: 8743.357111078776.[0m
[32m[I 2024-10-13 05:57:42,079][0m Trial 185 finished with value: 11435.90755383898 and parameters: {'depth': 5, 'learning_rate': 0.05921109612309829, 'iterations': 180, 'l2_leaf_reg': 3.1389322327897507e-07, 'border_count': 47, 'bagging_temperature': 0.9996108286449393, 'random_strength': 1.3633810519170968, 'grow_policy': 'SymmetricTree', 'min_data_in_leaf': 564}. Best is trial 184 with value: 8743.357111078776.[0m
[32m[I 2024-10-13 05:57:42,780][0m Trial 186 finished with value: 11316.341601260623 and parameters: {'depth': 5, 'learning_rate': 0.07320434264484899, 'iterations': 181, 'l2_leaf_reg': 2.291724130074235e-07, 'border_count': 36, 'bagging_temperature': 0.9799532391075685, 'random_strength': 1.1832507680069482, 'grow_policy': 'Depthwise', 'min_data_in_leaf': 639}. Best is trial 184 with value: 8743.357111078776.[0m
[32m[I 2024-10-13 05:57:43,536][0m Trial 187 finished with value: 8863.930765129839 and parameters: {'depth': 5, 'learning_rate': 0.048301803621319965, 'iterations': 160, 'l2_leaf_reg': 1.6089142681385408e-07, 'border_count': 40, 'bagging_temperature': 0.9828329112104633, 'random_strength': 1.5057510025526741, 'grow_policy': 'SymmetricTree', 'min_data_in_leaf': 584}. Best is trial 184 with value: 8743.357111078776.[0m
[32m[I 2024-10-13 05:57:44,287][0m Trial 188 finished with value: 11169.756685285112 and parameters: {'depth': 5, 'learning_rate': 0.05210284324707882, 'iterations': 155, 'l2_leaf_reg': 4.0441862563166403e-07, 'border_count': 42, 'bagging_temperature': 0.9827827655050927, 'random_strength': 1.2873251320491064, 'grow_policy': 'SymmetricTree', 'min_data_in_leaf': 580}. Best is trial 184 with value: 8743.357111078776.[0m
[32m[I 2024-10-13 05:57:44,979][0m Trial 189 finished with value: 9316.62328565324 and parameters: {'depth': 5, 'learning_rate': 0.06331518446234598, 'iterations': 100, 'l2_leaf_reg': 1.719127463741794e-07, 'border_count': 39, 'bagging_temperature': 0.9771941730813163, 'random_strength': 1.442540331541348, 'grow_policy': 'SymmetricTree', 'min_data_in_leaf': 552}. Best is trial 184 with value: 8743.357111078776.[0m
[32m[I 2024-10-13 05:57:45,746][0m Trial 190 finished with value: 12111.628312076178 and parameters: {'depth': 4, 'learning_rate': 0.06520810436398805, 'iterations': 217, 'l2_leaf_reg': 1.8708250203820053e-07, 'border_count': 53, 'bagging_temperature': 0.9703301134300836, 'random_strength': 1.675061043925254, 'grow_policy': 'SymmetricTree', 'min_data_in_leaf': 546}. Best is trial 184 with value: 8743.357111078776.[0m
[32m[I 2024-10-13 05:57:46,480][0m Trial 191 finished with value: 9000.048221523528 and parameters: {'depth': 5, 'learning_rate': 0.04954550909887213, 'iterations': 149, 'l2_leaf_reg': 1.1426875446361395e-07, 'border_count': 39, 'bagging_temperature': 0.996127996004775, 'random_strength': 1.4206330384551005, 'grow_policy': 'SymmetricTree', 'min_data_in_leaf': 557}. Best is trial 184 with value: 8743.357111078776.[0m
[32m[I 2024-10-13 05:57:47,172][0m Trial 192 finished with value: 9488.930023004192 and parameters: {'depth': 5, 'learning_rate': 0.04628715746101725, 'iterations': 105, 'l2_leaf_reg': 1.2947201292206696e-07, 'border_count': 41, 'bagging_temperature': 0.9938977675205158, 'random_strength': 1.5346944075884696, 'grow_policy': 'SymmetricTree', 'min_data_in_leaf': 589}. Best is trial 184 with value: 8743.357111078776.[0m
[32m[I 2024-10-13 05:57:47,899][0m Trial 193 finished with value: 8559.302107381483 and parameters: {'depth': 5, 'learning_rate': 0.06804173352750283, 'iterations': 168, 'l2_leaf_reg': 2.664286061741575e-07, 'border_count': 38, 'bagging_temperature': 0.9981509592560849, 'random_strength': 1.4089852607291669, 'grow_policy': 'SymmetricTree', 'min_data_in_leaf': 624}. Best is trial 193 with value: 8559.302107381483.[0m
[32m[I 2024-10-13 05:57:48,651][0m Trial 194 finished with value: 10364.624179230386 and parameters: {'depth': 5, 'learning_rate': 0.06470149287340902, 'iterations': 171, 'l2_leaf_reg': 2.7506938987938325e-07, 'border_count': 46, 'bagging_temperature': 0.9988760526309539, 'random_strength': 1.498840951231083, 'grow_policy': 'SymmetricTree', 'min_data_in_leaf': 607}. Best is trial 193 with value: 8559.302107381483.[0m
[32m[I 2024-10-13 05:57:49,383][0m Trial 195 finished with value: 8872.06942576312 and parameters: {'depth': 5, 'learning_rate': 0.05426328733536499, 'iterations': 157, 'l2_leaf_reg': 1.5184796686061574e-07, 'border_count': 34, 'bagging_temperature': 0.9997734262385479, 'random_strength': 1.205416257890485, 'grow_policy': 'SymmetricTree', 'min_data_in_leaf': 615}. Best is trial 193 with value: 8559.302107381483.[0m
[32m[I 2024-10-13 05:57:50,092][0m Trial 196 finished with value: 8564.757460180803 and parameters: {'depth': 5, 'learning_rate': 0.05243956415785147, 'iterations': 153, 'l2_leaf_reg': 1.551488541073531e-07, 'border_count': 39, 'bagging_temperature': 0.9807444813676918, 'random_strength': 1.294098115021527, 'grow_policy': 'SymmetricTree', 'min_data_in_leaf': 626}. Best is trial 193 with value: 8559.302107381483.[0m
[32m[I 2024-10-13 05:57:50,810][0m Trial 197 finished with value: 8853.340535194253 and parameters: {'depth': 5, 'learning_rate': 0.05551742525211563, 'iterations': 150, 'l2_leaf_reg': 1.814310707671935e-07, 'border_count': 38, 'bagging_temperature': 0.9995391927254013, 'random_strength': 1.1600321206660076, 'grow_policy': 'SymmetricTree', 'min_data_in_leaf': 624}. Best is trial 193 with value: 8559.302107381483.[0m
[32m[I 2024-10-13 05:57:51,536][0m Trial 198 finished with value: 8402.008628812016 and parameters: {'depth': 5, 'learning_rate': 0.0733782327334678, 'iterations': 156, 'l2_leaf_reg': 1.5353988654023853e-07, 'border_count': 39, 'bagging_temperature': 0.9987526699242377, 'random_strength': 0.8808454062799331, 'grow_policy': 'SymmetricTree', 'min_data_in_leaf': 631}. Best is trial 198 with value: 8402.008628812016.[0m
[32m[I 2024-10-13 05:57:52,254][0m Trial 199 finished with value: 8508.185268932268 and parameters: {'depth': 5, 'learning_rate': 0.05466724428411856, 'iterations': 160, 'l2_leaf_reg': 1.6628421999933634e-07, 'border_count': 40, 'bagging_temperature': 0.9855094646277837, 'random_strength': 0.8633018909486733, 'grow_policy': 'SymmetricTree', 'min_data_in_leaf': 637}. Best is trial 198 with value: 8402.008628812016.[0m
[32m[I 2024-10-13 05:57:52,949][0m Trial 200 finished with value: 12091.904727901006 and parameters: {'depth': 5, 'learning_rate': 0.05455209633743823, 'iterations': 109, 'l2_leaf_reg': 4.1261144430230424e-07, 'border_count': 60, 'bagging_temperature': 0.9813273760417768, 'random_strength': 0.8282581214030384, 'grow_policy': 'SymmetricTree', 'min_data_in_leaf': 661}. Best is trial 198 with value: 8402.008628812016.[0m
[32m[I 2024-10-13 05:57:53,672][0m Trial 201 finished with value: 8590.067087783866 and parameters: {'depth': 5, 'learning_rate': 0.07566778112996816, 'iterations': 149, 'l2_leaf_reg': 1.7570926265255453e-07, 'border_count': 41, 'bagging_temperature': 0.9996512599863202, 'random_strength': 1.1117156660189897, 'grow_policy': 'SymmetricTree', 'min_data_in_leaf': 640}. Best is trial 198 with value: 8402.008628812016.[0m
[32m[I 2024-10-13 05:57:54,407][0m Trial 202 finished with value: 8345.231169641762 and parameters: {'depth': 5, 'learning_rate': 0.07238221498624121, 'iterations': 160, 'l2_leaf_reg': 2.641326393697454e-07, 'border_count': 39, 'bagging_temperature': 0.9994592787124575, 'random_strength': 0.9603052735481481, 'grow_policy': 'SymmetricTree', 'min_data_in_leaf': 634}. Best is trial 202 with value: 8345.231169641762.[0m
[32m[I 2024-10-13 05:57:55,224][0m Trial 203 finished with value: 8485.641851444225 and parameters: {'depth': 5, 'learning_rate': 0.07450832450911926, 'iterations': 231, 'l2_leaf_reg': 2.7308969606134766e-07, 'border_count': 39, 'bagging_temperature': 0.9832853358980785, 'random_strength': 1.133785266877172, 'grow_policy': 'SymmetricTree', 'min_data_in_leaf': 629}. Best is trial 202 with value: 8345.231169641762.[0m
[32m[I 2024-10-13 05:57:55,999][0m Trial 204 finished with value: 11747.792068171464 and parameters: {'depth': 4, 'learning_rate': 0.07426881992772602, 'iterations': 228, 'l2_leaf_reg': 2.8148613380285945e-07, 'border_count': 50, 'bagging_temperature': 0.976205133705627, 'random_strength': 1.1410248103840814, 'grow_policy': 'SymmetricTree', 'min_data_in_leaf': 633}. Best is trial 202 with value: 8345.231169641762.[0m
