[32m[I 2024-10-13 06:14:20,942][0m Trial 925 finished with value: 10824.257452254089 and parameters: {'depth': 5, 'learning_rate': 0.2649322074306004, 'iterations': 251, 'l2_leaf_reg': 0.00013014285695415843, 'border_count': 31, 'bagging_temperature': 0.799254107774896, 'random_strength': 1.2244577244428692, 'grow_policy': 'SymmetricTree', 'min_data_in_leaf': 758}. Best is trial 894 with value: 5643.410092502591.[0m
[32m[I 2024-10-13 06:14:21,682][0m Trial 926 finished with value: 6238.917750088556 and parameters: {'depth': 5, 'learning_rate': 0.22958141561916262, 'iterations': 173, 'l2_leaf_reg': 0.00039803445757950675, 'border_count': 17, 'bagging_temperature': 0.8516721301064138, 'random_strength': 0.6064315877249185, 'grow_policy': 'SymmetricTree', 'min_data_in_leaf': 734}. Best is trial 894 with value: 5643.410092502591.[0m
[32m[I 2024-10-13 06:14:22,458][0m Trial 927 finished with value: 8079.785722600643 and parameters: {'depth': 5, 'learning_rate': 0.264005923630646, 'iterations': 149, 'l2_leaf_reg': 0.00037662024723732787, 'border_count': 11, 'bagging_temperature': 0.8264218924174623, 'random_strength': 0.9576052276658451, 'grow_policy': 'SymmetricTree', 'min_data_in_leaf': 729}. Best is trial 894 with value: 5643.410092502591.[0m
[32m[I 2024-10-13 06:14:23,170][0m Trial 928 finished with value: 6885.823705740757 and parameters: {'depth': 5, 'learning_rate': 0.22845815328268435, 'iterations': 140, 'l2_leaf_reg': 0.00023971271982561478, 'border_count': 15, 'bagging_temperature': 0.8026083300545996, 'random_strength': 0.778134511293431, 'grow_policy': 'SymmetricTree', 'min_data_in_leaf': 739}. Best is trial 894 with value: 5643.410092502591.[0m
[32m[I 2024-10-13 06:14:23,902][0m Trial 929 finished with value: 11485.866962771599 and parameters: {'depth': 6, 'learning_rate': 0.2552831302424045, 'iterations': 148, 'l2_leaf_reg': 0.0003688194132104186, 'border_count': 18, 'bagging_temperature': 0.8471272417007565, 'random_strength': 0.8261275104465511, 'grow_policy': 'SymmetricTree', 'min_data_in_leaf': 705}. Best is trial 894 with value: 5643.410092502591.[0m
[32m[I 2024-10-13 06:14:24,533][0m Trial 930 finished with value: 10947.531268433086 and parameters: {'depth': 4, 'learning_rate': 0.2963816013665661, 'iterations': 105, 'l2_leaf_reg': 0.0002937013496547326, 'border_count': 18, 'bagging_temperature': 0.8403661599574145, 'random_strength': 1.3079076501566642, 'grow_policy': 'SymmetricTree', 'min_data_in_leaf': 727}. Best is trial 894 with value: 5643.410092502591.[0m
[32m[I 2024-10-13 06:14:25,294][0m Trial 931 finished with value: 7419.478184667276 and parameters: {'depth': 5, 'learning_rate': 0.224842385686438, 'iterations': 195, 'l2_leaf_reg': 0.00019347763747319563, 'border_count': 11, 'bagging_temperature': 0.8196358046995396, 'random_strength': 1.0510040445774353, 'grow_policy': 'SymmetricTree', 'min_data_in_leaf': 712}. Best is trial 894 with value: 5643.410092502591.[0m
[32m[I 2024-10-13 06:14:26,063][0m Trial 932 finished with value: 15060.111606374316 and parameters: {'depth': 5, 'learning_rate': 0.2141206075456937, 'iterations': 201, 'l2_leaf_reg': 0.0009090609984636993, 'border_count': 8, 'bagging_temperature': 0.779868697229498, 'random_strength': 0.650922507551088, 'grow_policy': 'SymmetricTree', 'min_data_in_leaf': 748}. Best is trial 894 with value: 5643.410092502591.[0m
[32m[I 2024-10-13 06:14:26,710][0m Trial 933 finished with value: 6952.669978015134 and parameters: {'depth': 5, 'learning_rate': 0.25458121868225103, 'iterations': 101, 'l2_leaf_reg': 0.0003076334302407569, 'border_count': 13, 'bagging_temperature': 0.8491109190555284, 'random_strength': 0.6611435717575523, 'grow_policy': 'SymmetricTree', 'min_data_in_leaf': 703}. Best is trial 894 with value: 5643.410092502591.[0m
[32m[I 2024-10-13 06:14:27,487][0m Trial 934 finished with value: 7832.511121819275 and parameters: {'depth': 5, 'learning_rate': 0.1992008744776733, 'iterations': 179, 'l2_leaf_reg': 0.00019069037598102944, 'border_count': 20, 'bagging_temperature': 0.8508464210031413, 'random_strength': 0.5340063162480969, 'grow_policy': 'SymmetricTree', 'min_data_in_leaf': 724}. Best is trial 894 with value: 5643.410092502591.[0m
[32m[I 2024-10-13 06:14:28,296][0m Trial 935 finished with value: 6278.335196663523 and parameters: {'depth': 5, 'learning_rate': 0.23262079038854677, 'iterations': 226, 'l2_leaf_reg': 0.0006347351414547226, 'border_count': 17, 'bagging_temperature': 0.8269142357658752, 'random_strength': 0.8357083018273405, 'grow_policy': 'SymmetricTree', 'min_data_in_leaf': 747}. Best is trial 894 with value: 5643.410092502591.[0m
[32m[I 2024-10-13 06:14:38,018][0m Trial 936 finished with value: 10555.582355366416 and parameters: {'depth': 5, 'learning_rate': 0.19090638666416943, 'iterations': 2638, 'l2_leaf_reg': 9.483693839816992e-05, 'border_count': 14, 'bagging_temperature': 0.8155349294503502, 'random_strength': 1.0304344269099428, 'grow_policy': 'SymmetricTree', 'min_data_in_leaf': 755}. Best is trial 894 with value: 5643.410092502591.[0m
[32m[I 2024-10-13 06:14:38,667][0m Trial 937 finished with value: 17023.30715697636 and parameters: {'depth': 4, 'learning_rate': 0.22888479296510436, 'iterations': 154, 'l2_leaf_reg': 0.0005066746343104165, 'border_count': 9, 'bagging_temperature': 0.8134154863302245, 'random_strength': 5.013096345338145, 'grow_policy': 'Lossguide', 'min_data_in_leaf': 744, 'max_leaves': 74}. Best is trial 894 with value: 5643.410092502591.[0m
[32m[I 2024-10-13 06:14:39,484][0m Trial 938 finished with value: 14694.617605643218 and parameters: {'depth': 6, 'learning_rate': 0.19802629740887379, 'iterations': 210, 'l2_leaf_reg': 0.0004733242649594625, 'border_count': 7, 'bagging_temperature': 0.8027171599440565, 'random_strength': 0.8013301494683915, 'grow_policy': 'SymmetricTree', 'min_data_in_leaf': 749}. Best is trial 894 with value: 5643.410092502591.[0m
[32m[I 2024-10-13 06:14:40,201][0m Trial 939 finished with value: 7369.067481891127 and parameters: {'depth': 5, 'learning_rate': 0.26980571687759786, 'iterations': 157, 'l2_leaf_reg': 0.0016435215090633644, 'border_count': 16, 'bagging_temperature': 0.7812502014531809, 'random_strength': 0.8773773514094025, 'grow_policy': 'SymmetricTree', 'min_data_in_leaf': 730}. Best is trial 894 with value: 5643.410092502591.[0m
[32m[I 2024-10-13 06:14:41,003][0m Trial 940 finished with value: 6542.823849483059 and parameters: {'depth': 5, 'learning_rate': 0.22524075592130027, 'iterations': 232, 'l2_leaf_reg': 0.0005174790863932451, 'border_count': 18, 'bagging_temperature': 0.8361886465607659, 'random_strength': 0.7812482014069676, 'grow_policy': 'SymmetricTree', 'min_data_in_leaf': 725}. Best is trial 894 with value: 5643.410092502591.[0m
[32m[I 2024-10-13 06:14:41,853][0m Trial 941 finished with value: 7383.7690263953755 and parameters: {'depth': 5, 'learning_rate': 0.29543580324069846, 'iterations': 247, 'l2_leaf_reg': 0.0009031594802195131, 'border_count': 13, 'bagging_temperature': 0.798231705102594, 'random_strength': 1.365249960619481, 'grow_policy': 'SymmetricTree', 'min_data_in_leaf': 763}. Best is trial 894 with value: 5643.410092502591.[0m
[32m[I 2024-10-13 06:14:42,722][0m Trial 942 finished with value: 10396.657856250722 and parameters: {'depth': 6, 'learning_rate': 0.2320193069035411, 'iterations': 253, 'l2_leaf_reg': 0.0004226482120516239, 'border_count': 16, 'bagging_temperature': 0.8340755677604302, 'random_strength': 1.2445153701912028, 'grow_policy': 'SymmetricTree', 'min_data_in_leaf': 726}. Best is trial 894 with value: 5643.410092502591.[0m
[32m[I 2024-10-13 06:14:43,511][0m Trial 943 finished with value: 12760.04194968435 and parameters: {'depth': 4, 'learning_rate': 0.23397198788987844, 'iterations': 248, 'l2_leaf_reg': 0.0002901643155941172, 'border_count': 4, 'bagging_temperature': 0.8232664737552137, 'random_strength': 0.990635224557886, 'grow_policy': 'SymmetricTree', 'min_data_in_leaf': 739}. Best is trial 894 with value: 5643.410092502591.[0m
[32m[I 2024-10-13 06:14:44,212][0m Trial 944 finished with value: 12964.566102112018 and parameters: {'depth': 5, 'learning_rate': 0.2596660567388956, 'iterations': 220, 'l2_leaf_reg': 0.0010275518703062503, 'border_count': 17, 'bagging_temperature': 0.8300027898622448, 'random_strength': 1.1641497813645916, 'grow_policy': 'Depthwise', 'min_data_in_leaf': 714}. Best is trial 894 with value: 5643.410092502591.[0m
[32m[I 2024-10-13 06:14:52,272][0m Trial 945 finished with value: 11221.27110652093 and parameters: {'depth': 5, 'learning_rate': 0.21353833744557293, 'iterations': 2155, 'l2_leaf_reg': 0.0018607259693524509, 'border_count': 12, 'bagging_temperature': 0.8086854636058747, 'random_strength': 0.7984298488614082, 'grow_policy': 'SymmetricTree', 'min_data_in_leaf': 699}. Best is trial 894 with value: 5643.410092502591.[0m
[32m[I 2024-10-13 06:14:53,149][0m Trial 946 finished with value: 8646.410924741711 and parameters: {'depth': 5, 'learning_rate': 0.26696986554771485, 'iterations': 289, 'l2_leaf_reg': 0.00042620129215741796, 'border_count': 20, 'bagging_temperature': 0.8300183017351835, 'random_strength': 0.9203501464426709, 'grow_policy': 'SymmetricTree', 'min_data_in_leaf': 761}. Best is trial 894 with value: 5643.410092502591.[0m
[32m[I 2024-10-13 06:14:53,931][0m Trial 947 finished with value: 7191.941555118414 and parameters: {'depth': 5, 'learning_rate': 0.20770214422034905, 'iterations': 195, 'l2_leaf_reg': 0.00027065786077099137, 'border_count': 11, 'bagging_temperature': 0.7887142775611322, 'random_strength': 1.0860657264495095, 'grow_policy': 'SymmetricTree', 'min_data_in_leaf': 738}. Best is trial 894 with value: 5643.410092502591.[0m
[32m[I 2024-10-13 06:14:54,605][0m Trial 948 finished with value: 7509.015403534801 and parameters: {'depth': 5, 'learning_rate': 0.22988864536954853, 'iterations': 103, 'l2_leaf_reg': 0.0008093504904030941, 'border_count': 18, 'bagging_temperature': 0.8109453032428555, 'random_strength': 0.7460352480082844, 'grow_policy': 'SymmetricTree', 'min_data_in_leaf': 716}. Best is trial 894 with value: 5643.410092502591.[0m
[32m[I 2024-10-13 06:14:55,476][0m Trial 949 finished with value: 14275.510963322316 and parameters: {'depth': 5, 'learning_rate': 0.265771316213978, 'iterations': 289, 'l2_leaf_reg': 0.00036901318190765773, 'border_count': 8, 'bagging_temperature': 0.7640997341371939, 'random_strength': 1.0122110714243266, 'grow_policy': 'SymmetricTree', 'min_data_in_leaf': 699}. Best is trial 894 with value: 5643.410092502591.[0m
[32m[I 2024-10-13 06:14:56,259][0m Trial 950 finished with value: 10008.900243544003 and parameters: {'depth': 5, 'learning_rate': 0.2995745260425785, 'iterations': 219, 'l2_leaf_reg': 0.0020686436864489695, 'border_count': 22, 'bagging_temperature': 0.8385518267180706, 'random_strength': 0.7269484707209846, 'grow_policy': 'SymmetricTree', 'min_data_in_leaf': 732}. Best is trial 894 with value: 5643.410092502591.[0m
[32m[I 2024-10-13 06:14:57,075][0m Trial 951 finished with value: 10436.997481987353 and parameters: {'depth': 4, 'learning_rate': 0.1908411282484317, 'iterations': 189, 'l2_leaf_reg': 0.00016582676289618798, 'border_count': 17, 'bagging_temperature': 0.12822671383885742, 'random_strength': 0.8664449549956224, 'grow_policy': 'SymmetricTree', 'min_data_in_leaf': 768}. Best is trial 894 with value: 5643.410092502591.[0m
[32m[I 2024-10-13 06:14:57,981][0m Trial 952 finished with value: 18533.450986094726 and parameters: {'depth': 5, 'learning_rate': 0.229531304322682, 'iterations': 263, 'l2_leaf_reg': 0.0009502148951501365, 'border_count': 1, 'bagging_temperature': 0.8475223284173612, 'random_strength': 0.6464918279273705, 'grow_policy': 'SymmetricTree', 'min_data_in_leaf': 693}. Best is trial 894 with value: 5643.410092502591.[0m
[32m[I 2024-10-13 06:15:06,375][0m Trial 953 finished with value: 10790.206005813296 and parameters: {'depth': 6, 'learning_rate': 0.29984496926604287, 'iterations': 1699, 'l2_leaf_reg': 0.0005266018592360801, 'border_count': 21, 'bagging_temperature': 0.8322969319363069, 'random_strength': 0.5762726056420399, 'grow_policy': 'SymmetricTree', 'min_data_in_leaf': 749}. Best is trial 894 with value: 5643.410092502591.[0m
[32m[I 2024-10-13 06:15:07,069][0m Trial 954 finished with value: 8052.979941536136 and parameters: {'depth': 5, 'learning_rate': 0.18584102885579398, 'iterations': 148, 'l2_leaf_reg': 0.0006474278677367485, 'border_count': 13, 'bagging_temperature': 0.8026280232327645, 'random_strength': 0.6284816759755225, 'grow_policy': 'SymmetricTree', 'min_data_in_leaf': 715}. Best is trial 894 with value: 5643.410092502591.[0m
[32m[I 2024-10-13 06:15:07,779][0m Trial 955 finished with value: 8148.34201167458 and parameters: {'depth': 5, 'learning_rate': 0.2328976641955126, 'iterations': 151, 'l2_leaf_reg': 0.0009657261103064652, 'border_count': 22, 'bagging_temperature': 0.8499704879068049, 'random_strength': 0.8215427318553654, 'grow_policy': 'SymmetricTree', 'min_data_in_leaf': 774}. Best is trial 894 with value: 5643.410092502591.[0m
[32m[I 2024-10-13 06:15:08,623][0m Trial 956 finished with value: 16884.238538905054 and parameters: {'depth': 4, 'learning_rate': 0.20006372916917706, 'iterations': 315, 'l2_leaf_reg': 0.0014015689048312917, 'border_count': 8, 'bagging_temperature': 0.8190279756568474, 'random_strength': 0.5664709979525991, 'grow_policy': 'SymmetricTree', 'min_data_in_leaf': 722}. Best is trial 894 with value: 5643.410092502591.[0m
[32m[I 2024-10-13 06:15:09,458][0m Trial 957 finished with value: 11143.135379526544 and parameters: {'depth': 6, 'learning_rate': 0.25939927394200407, 'iterations': 223, 'l2_leaf_reg': 0.0007772243011020028, 'border_count': 16, 'bagging_temperature': 0.7847900988480283, 'random_strength': 1.1314565729742263, 'grow_policy': 'SymmetricTree', 'min_data_in_leaf': 688}. Best is trial 894 with value: 5643.410092502591.[0m
[32m[I 2024-10-13 06:15:10,316][0m Trial 958 finished with value: 11107.945875955327 and parameters: {'depth': 5, 'learning_rate': 0.1820433580139426, 'iterations': 272, 'l2_leaf_reg': 0.0005148247314175847, 'border_count': 24, 'bagging_temperature': 0.8520270001410987, 'random_strength': 3.1039716876569767, 'grow_policy': 'SymmetricTree', 'min_data_in_leaf': 741}. Best is trial 894 with value: 5643.410092502591.[0m
[32m[I 2024-10-13 06:15:10,981][0m Trial 959 finished with value: 7479.135280573987 and parameters: {'depth': 5, 'learning_rate': 0.2981188766275167, 'iterations': 101, 'l2_leaf_reg': 0.00022856574154714491, 'border_count': 20, 'bagging_temperature': 0.8526825178576983, 'random_strength': 0.5327287462593444, 'grow_policy': 'SymmetricTree', 'min_data_in_leaf': 706}. Best is trial 894 with value: 5643.410092502591.[0m
[32m[I 2024-10-13 06:15:11,790][0m Trial 960 finished with value: 13174.492368280065 and parameters: {'depth': 5, 'learning_rate': 0.22863298982494917, 'iterations': 327, 'l2_leaf_reg': 0.0006706702365512189, 'border_count': 11, 'bagging_temperature': 0.8318390363205161, 'random_strength': 0.9103587209233079, 'grow_policy': 'Lossguide', 'min_data_in_leaf': 686, 'max_leaves': 190}. Best is trial 894 with value: 5643.410092502591.[0m
[32m[I 2024-10-13 06:15:18,763][0m Trial 961 finished with value: 10385.005425525078 and parameters: {'depth': 4, 'learning_rate': 0.2062336318201519, 'iterations': 2000, 'l2_leaf_reg': 0.00046500375594774946, 'border_count': 23, 'bagging_temperature': 0.7633790971407062, 'random_strength': 0.6992641530765549, 'grow_policy': 'SymmetricTree', 'min_data_in_leaf': 755}. Best is trial 894 with value: 5643.410092502591.[0m
[32m[I 2024-10-13 06:15:19,551][0m Trial 962 finished with value: 7667.3482902073065 and parameters: {'depth': 5, 'learning_rate': 0.25285918407903346, 'iterations': 211, 'l2_leaf_reg': 0.00012073638180265413, 'border_count': 14, 'bagging_temperature': 0.8590175506841455, 'random_strength': 0.5372838198054408, 'grow_policy': 'SymmetricTree', 'min_data_in_leaf': 723}. Best is trial 894 with value: 5643.410092502591.[0m
[32m[I 2024-10-13 06:15:20,268][0m Trial 963 finished with value: 15727.85833476836 and parameters: {'depth': 5, 'learning_rate': 0.18000273208196726, 'iterations': 158, 'l2_leaf_reg': 0.00017953554084485627, 'border_count': 6, 'bagging_temperature': 0.8223435795617666, 'random_strength': 0.4554171401795865, 'grow_policy': 'SymmetricTree', 'min_data_in_leaf': 775}. Best is trial 894 with value: 5643.410092502591.[0m
[32m[I 2024-10-13 06:15:20,952][0m Trial 964 finished with value: 8208.603455024744 and parameters: {'depth': 6, 'learning_rate': 0.2299876938591592, 'iterations': 100, 'l2_leaf_reg': 0.0003297214288871488, 'border_count': 18, 'bagging_temperature': 0.8410705959562834, 'random_strength': 0.7450442911496232, 'grow_policy': 'SymmetricTree', 'min_data_in_leaf': 743}. Best is trial 894 with value: 5643.410092502591.[0m
[32m[I 2024-10-13 06:15:21,678][0m Trial 965 finished with value: 10063.65212991209 and parameters: {'depth': 5, 'learning_rate': 0.21298992743527334, 'iterations': 254, 'l2_leaf_reg': 0.00024755960104636806, 'border_count': 24, 'bagging_temperature': 0.8037153129770666, 'random_strength': 0.522453969928799, 'grow_policy': 'Depthwise', 'min_data_in_leaf': 704}. Best is trial 894 with value: 5643.410092502591.[0m
[32m[I 2024-10-13 06:15:22,438][0m Trial 966 finished with value: 8412.717995854004 and parameters: {'depth': 5, 'learning_rate': 0.17642422231635924, 'iterations': 187, 'l2_leaf_reg': 0.00018238593180620622, 'border_count': 16, 'bagging_temperature': 0.8598859342429857, 'random_strength': 1.019184779000076, 'grow_policy': 'SymmetricTree', 'min_data_in_leaf': 682}. Best is trial 894 with value: 5643.410092502591.[0m
[32m[I 2024-10-13 06:15:26,955][0m Trial 967 finished with value: 9582.262455076476 and parameters: {'depth': 5, 'learning_rate': 0.2582164350417643, 'iterations': 1124, 'l2_leaf_reg': 0.00014632985582144607, 'border_count': 23, 'bagging_temperature': 0.8641270107159932, 'random_strength': 0.42794564332587226, 'grow_policy': 'SymmetricTree', 'min_data_in_leaf': 725}. Best is trial 894 with value: 5643.410092502591.[0m
[32m[I 2024-10-13 06:15:27,900][0m Trial 968 finished with value: 15004.625604295454 and parameters: {'depth': 6, 'learning_rate': 0.20364042794433293, 'iterations': 312, 'l2_leaf_reg': 0.0004298182258749797, 'border_count': 9, 'bagging_temperature': 0.8356032058791919, 'random_strength': 0.7397840358385124, 'grow_policy': 'SymmetricTree', 'min_data_in_leaf': 704}. Best is trial 894 with value: 5643.410092502591.[0m
[32m[I 2024-10-13 06:15:28,689][0m Trial 969 finished with value: 10561.774100312208 and parameters: {'depth': 4, 'learning_rate': 0.25744013332065385, 'iterations': 239, 'l2_leaf_reg': 0.0006123035956002136, 'border_count': 24, 'bagging_temperature': 0.8174165687048341, 'random_strength': 3.7201524746932275, 'grow_policy': 'SymmetricTree', 'min_data_in_leaf': 746}. Best is trial 894 with value: 5643.410092502591.[0m
[32m[I 2024-10-13 06:15:29,423][0m Trial 970 finished with value: 13401.649632335071 and parameters: {'depth': 5, 'learning_rate': 0.01275611115212297, 'iterations': 168, 'l2_leaf_reg': 0.0012653763100009244, 'border_count': 15, 'bagging_temperature': 0.7924186992592525, 'random_strength': 6.087745796278689, 'grow_policy': 'SymmetricTree', 'min_data_in_leaf': 765}. Best is trial 894 with value: 5643.410092502591.[0m
[32m[I 2024-10-13 06:15:30,275][0m Trial 971 finished with value: 21344.546602474034 and parameters: {'depth': 5, 'learning_rate': 0.0005780190793247641, 'iterations': 283, 'l2_leaf_reg': 0.0006474214465003285, 'border_count': 19, 'bagging_temperature': 0.8648101195056215, 'random_strength': 0.41950996571883237, 'grow_policy': 'SymmetricTree', 'min_data_in_leaf': 683}. Best is trial 894 with value: 5643.410092502591.[0m
[32m[I 2024-10-13 06:15:39,410][0m Trial 972 finished with value: 8896.043233112297 and parameters: {'depth': 5, 'learning_rate': 0.179591108552909, 'iterations': 2301, 'l2_leaf_reg': 0.0002731101828623392, 'border_count': 26, 'bagging_temperature': 0.848080296954202, 'random_strength': 0.6912669790320886, 'grow_policy': 'SymmetricTree', 'min_data_in_leaf': 735}. Best is trial 894 with value: 5643.410092502591.[0m
[32m[I 2024-10-13 06:15:40,354][0m Trial 973 finished with value: 8379.301066581687 and parameters: {'depth': 5, 'learning_rate': 0.2257619715543031, 'iterations': 356, 'l2_leaf_reg': 0.0006605567638072085, 'border_count': 20, 'bagging_temperature': 0.867368770800721, 'random_strength': 0.4277512208532137, 'grow_policy': 'SymmetricTree', 'min_data_in_leaf': 697}. Best is trial 894 with value: 5643.410092502591.[0m
[32m[I 2024-10-13 06:15:41,195][0m Trial 974 finished with value: 9531.901540436136 and parameters: {'depth': 6, 'learning_rate': 0.2559815394661304, 'iterations': 223, 'l2_leaf_reg': 0.00025680198996823393, 'border_count': 12, 'bagging_temperature': 0.8296924191154026, 'random_strength': 0.38583223518848686, 'grow_policy': 'SymmetricTree', 'min_data_in_leaf': 720}. Best is trial 894 with value: 5643.410092502591.[0m
[32m[I 2024-10-13 06:15:41,919][0m Trial 975 finished with value: 15599.896531206594 and parameters: {'depth': 5, 'learning_rate': 0.20099061179613562, 'iterations': 152, 'l2_leaf_reg': 8.534676113181459e-05, 'border_count': 5, 'bagging_temperature': 0.8722489525312963, 'random_strength': 1.5578818007294863, 'grow_policy': 'SymmetricTree', 'min_data_in_leaf': 668}. Best is trial 894 with value: 5643.410092502591.[0m
