[32m[I 2024-10-13 06:05:21,402][0m Trial 565 finished with value: 10273.43465141599 and parameters: {'depth': 4, 'learning_rate': 0.2986930855154241, 'iterations': 209, 'l2_leaf_reg': 2.4013201987596496e-06, 'border_count': 19, 'bagging_temperature': 0.9230250435706654, 'random_strength': 0.0048206493302851705, 'grow_policy': 'SymmetricTree', 'min_data_in_leaf': 965}. Best is trial 374 with value: 6012.54835621459.[0m
[32m[I 2024-10-13 06:05:22,095][0m Trial 566 finished with value: 15661.722869794308 and parameters: {'depth': 4, 'learning_rate': 0.007342429038590461, 'iterations': 147, 'l2_leaf_reg': 1.050980670662962e-05, 'border_count': 34, 'bagging_temperature': 0.9631234597377997, 'random_strength': 0.5409710539696135, 'grow_policy': 'SymmetricTree', 'min_data_in_leaf': 736}. Best is trial 374 with value: 6012.54835621459.[0m
[32m[I 2024-10-13 06:05:22,757][0m Trial 567 finished with value: 8127.413600167415 and parameters: {'depth': 4, 'learning_rate': 0.2008509246914289, 'iterations': 104, 'l2_leaf_reg': 2.1114651988329456e-05, 'border_count': 37, 'bagging_temperature': 0.913676891041586, 'random_strength': 0.2901381732727607, 'grow_policy': 'SymmetricTree', 'min_data_in_leaf': 954}. Best is trial 374 with value: 6012.54835621459.[0m
[32m[I 2024-10-13 06:05:26,002][0m Trial 568 finished with value: 9050.191511116569 and parameters: {'depth': 4, 'learning_rate': 0.22977716411010354, 'iterations': 825, 'l2_leaf_reg': 3.3865211253431097e-06, 'border_count': 29, 'bagging_temperature': 0.9393461879933243, 'random_strength': 0.5846921422713746, 'grow_policy': 'SymmetricTree', 'min_data_in_leaf': 780}. Best is trial 374 with value: 6012.54835621459.[0m
[32m[I 2024-10-13 06:05:26,646][0m Trial 569 finished with value: 7328.020229064572 and parameters: {'depth': 4, 'learning_rate': 0.18222105430917448, 'iterations': 102, 'l2_leaf_reg': 6.250407227870461e-06, 'border_count': 41, 'bagging_temperature': 0.9960515398066447, 'random_strength': 0.005306753874486259, 'grow_policy': 'SymmetricTree', 'min_data_in_leaf': 708}. Best is trial 374 with value: 6012.54835621459.[0m
[32m[I 2024-10-13 06:05:27,432][0m Trial 570 finished with value: 8545.39107223861 and parameters: {'depth': 4, 'learning_rate': 0.21585561350034743, 'iterations': 223, 'l2_leaf_reg': 2.1530005045212904e-06, 'border_count': 35, 'bagging_temperature': 0.9686662873732704, 'random_strength': 0.3529147977828692, 'grow_policy': 'SymmetricTree', 'min_data_in_leaf': 923}. Best is trial 374 with value: 6012.54835621459.[0m
[32m[I 2024-10-13 06:05:28,159][0m Trial 571 finished with value: 8456.554527167755 and parameters: {'depth': 4, 'learning_rate': 0.2615324953210454, 'iterations': 179, 'l2_leaf_reg': 4.948393664751952e-06, 'border_count': 25, 'bagging_temperature': 0.9138245995625867, 'random_strength': 0.19849552302532306, 'grow_policy': 'SymmetricTree', 'min_data_in_leaf': 732}. Best is trial 374 with value: 6012.54835621459.[0m
[32m[I 2024-10-13 06:05:29,027][0m Trial 572 finished with value: 14242.537325626301 and parameters: {'depth': 3, 'learning_rate': 0.17456931857700025, 'iterations': 228, 'l2_leaf_reg': 1.5414748948235042e-05, 'border_count': 244, 'bagging_temperature': 0.9454379633951131, 'random_strength': 0.4921325434484277, 'grow_policy': 'SymmetricTree', 'min_data_in_leaf': 768}. Best is trial 374 with value: 6012.54835621459.[0m
[32m[I 2024-10-13 06:05:34,884][0m Trial 573 finished with value: 10937.21036970813 and parameters: {'depth': 4, 'learning_rate': 0.1854344501762448, 'iterations': 1666, 'l2_leaf_reg': 3.303581889739633e-06, 'border_count': 13, 'bagging_temperature': 0.9291428111593657, 'random_strength': 0.7998793719833094, 'grow_policy': 'SymmetricTree', 'min_data_in_leaf': 754}. Best is trial 374 with value: 6012.54835621459.[0m
[32m[I 2024-10-13 06:05:35,600][0m Trial 574 finished with value: 10003.639957177878 and parameters: {'depth': 4, 'learning_rate': 0.2244801703250749, 'iterations': 173, 'l2_leaf_reg': 9.237092834788074e-06, 'border_count': 31, 'bagging_temperature': 0.9998091158669683, 'random_strength': 0.1824739906027526, 'grow_policy': 'SymmetricTree', 'min_data_in_leaf': 690}. Best is trial 374 with value: 6012.54835621459.[0m
[32m[I 2024-10-13 06:05:36,319][0m Trial 575 finished with value: 12431.413315951831 and parameters: {'depth': 4, 'learning_rate': 0.2560451170884839, 'iterations': 231, 'l2_leaf_reg': 1.746309098038147e-06, 'border_count': 43, 'bagging_temperature': 0.9660501505971149, 'random_strength': 0.39342043462286835, 'grow_policy': 'Lossguide', 'min_data_in_leaf': 904, 'max_leaves': 44}. Best is trial 374 with value: 6012.54835621459.[0m
[32m[I 2024-10-13 06:05:37,222][0m Trial 576 finished with value: 13376.973078377521 and parameters: {'depth': 6, 'learning_rate': 0.16194567637302476, 'iterations': 259, 'l2_leaf_reg': 7.035009455831466e-06, 'border_count': 94, 'bagging_temperature': 0.9100444383674318, 'random_strength': 0.6561327145456748, 'grow_policy': 'SymmetricTree', 'min_data_in_leaf': 646}. Best is trial 374 with value: 6012.54835621459.[0m
[32m[I 2024-10-13 06:05:37,887][0m Trial 577 finished with value: 8145.468985791502 and parameters: {'depth': 3, 'learning_rate': 0.19953300899284432, 'iterations': 149, 'l2_leaf_reg': 4.024531619170463e-05, 'border_count': 37, 'bagging_temperature': 0.9473489357099, 'random_strength': 0.17839384670480699, 'grow_policy': 'SymmetricTree', 'min_data_in_leaf': 802}. Best is trial 374 with value: 6012.54835621459.[0m
[32m[I 2024-10-13 06:05:38,620][0m Trial 578 finished with value: 9718.444800196788 and parameters: {'depth': 4, 'learning_rate': 0.1626662854044472, 'iterations': 195, 'l2_leaf_reg': 2.830202784889718e-06, 'border_count': 22, 'bagging_temperature': 0.9814781416167712, 'random_strength': 0.471685153931623, 'grow_policy': 'SymmetricTree', 'min_data_in_leaf': 715}. Best is trial 374 with value: 6012.54835621459.[0m
[32m[I 2024-10-13 06:05:39,438][0m Trial 579 finished with value: 7207.541771542372 and parameters: {'depth': 4, 'learning_rate': 0.2221065911637921, 'iterations': 270, 'l2_leaf_reg': 4.756206428793628e-06, 'border_count': 30, 'bagging_temperature': 0.9276026921371534, 'random_strength': 0.3316213355157636, 'grow_policy': 'SymmetricTree', 'min_data_in_leaf': 751}. Best is trial 374 with value: 6012.54835621459.[0m
[32m[I 2024-10-13 06:05:40,394][0m Trial 580 finished with value: 8456.05638978842 and parameters: {'depth': 6, 'learning_rate': 0.18937693323723798, 'iterations': 300, 'l2_leaf_reg': 1.0643292844653181e-05, 'border_count': 27, 'bagging_temperature': 0.6271793425083356, 'random_strength': 0.0037159410589071296, 'grow_policy': 'SymmetricTree', 'min_data_in_leaf': 756}. Best is trial 374 with value: 6012.54835621459.[0m
[32m[I 2024-10-13 06:05:41,180][0m Trial 581 finished with value: 12862.676698587842 and parameters: {'depth': 9, 'learning_rate': 0.16434467002063197, 'iterations': 273, 'l2_leaf_reg': 5.312621605715935e-06, 'border_count': 17, 'bagging_temperature': 0.9056833203955097, 'random_strength': 0.8630347167680659, 'grow_policy': 'Depthwise', 'min_data_in_leaf': 733}. Best is trial 374 with value: 6012.54835621459.[0m
[32m[I 2024-10-13 06:05:42,059][0m Trial 582 finished with value: 12478.085702406372 and parameters: {'depth': 4, 'learning_rate': 0.22329236253196702, 'iterations': 315, 'l2_leaf_reg': 1.487100947013054e-05, 'border_count': 46, 'bagging_temperature': 0.9253221772953851, 'random_strength': 0.6267868716118501, 'grow_policy': 'SymmetricTree', 'min_data_in_leaf': 780}. Best is trial 374 with value: 6012.54835621459.[0m
[32m[I 2024-10-13 06:05:54,370][0m Trial 583 finished with value: 9089.932173816229 and parameters: {'depth': 5, 'learning_rate': 0.19363324441536808, 'iterations': 3000, 'l2_leaf_reg': 7.514993614411678e-06, 'border_count': 39, 'bagging_temperature': 0.8984438684531967, 'random_strength': 0.3389826805458547, 'grow_policy': 'SymmetricTree', 'min_data_in_leaf': 753}. Best is trial 374 with value: 6012.54835621459.[0m
[32m[I 2024-10-13 06:05:58,537][0m Trial 584 finished with value: 10584.979082012227 and parameters: {'depth': 5, 'learning_rate': 0.1541327163946166, 'iterations': 935, 'l2_leaf_reg': 4.205154436098564e-06, 'border_count': 63, 'bagging_temperature': 0.9262395436489359, 'random_strength': 0.5397114255773369, 'grow_policy': 'SymmetricTree', 'min_data_in_leaf': 723}. Best is trial 374 with value: 6012.54835621459.[0m
[32m[I 2024-10-13 06:05:59,377][0m Trial 585 finished with value: 10562.338869598982 and parameters: {'depth': 5, 'learning_rate': 0.2159063222775863, 'iterations': 243, 'l2_leaf_reg': 2.2273949628938593e-05, 'border_count': 82, 'bagging_temperature': 0.8786532702968981, 'random_strength': 0.13811347025575432, 'grow_policy': 'SymmetricTree', 'min_data_in_leaf': 787}. Best is trial 374 with value: 6012.54835621459.[0m
[32m[I 2024-10-13 06:06:00,236][0m Trial 586 finished with value: 9197.410375100897 and parameters: {'depth': 4, 'learning_rate': 0.14712118072757754, 'iterations': 337, 'l2_leaf_reg': 5.775861197957199e-06, 'border_count': 29, 'bagging_temperature': 0.9070347993057575, 'random_strength': 0.9693776583534055, 'grow_policy': 'SymmetricTree', 'min_data_in_leaf': 707}. Best is trial 374 with value: 6012.54835621459.[0m
[32m[I 2024-10-13 06:06:13,004][0m Trial 587 finished with value: 8923.003270372552 and parameters: {'depth': 6, 'learning_rate': 0.18512601869755782, 'iterations': 2501, 'l2_leaf_reg': 1.2702285590362809e-05, 'border_count': 35, 'bagging_temperature': 0.9337813542959164, 'random_strength': 0.684708092349497, 'grow_policy': 'SymmetricTree', 'min_data_in_leaf': 751}. Best is trial 374 with value: 6012.54835621459.[0m
[32m[I 2024-10-13 06:06:13,839][0m Trial 588 finished with value: 11095.495268348914 and parameters: {'depth': 5, 'learning_rate': 0.2526468441331564, 'iterations': 270, 'l2_leaf_reg': 3.4541044587257416e-06, 'border_count': 42, 'bagging_temperature': 0.9476608869268274, 'random_strength': 0.3456841393893617, 'grow_policy': 'SymmetricTree', 'min_data_in_leaf': 681}. Best is trial 374 with value: 6012.54835621459.[0m
[32m[I 2024-10-13 06:06:14,596][0m Trial 589 finished with value: 9397.739061927517 and parameters: {'depth': 4, 'learning_rate': 0.17228185269903318, 'iterations': 228, 'l2_leaf_reg': 8.580464510088682e-06, 'border_count': 25, 'bagging_temperature': 0.822450531274711, 'random_strength': 0.15225132059102248, 'grow_policy': 'SymmetricTree', 'min_data_in_leaf': 772}. Best is trial 374 with value: 6012.54835621459.[0m
[32m[I 2024-10-13 06:06:15,473][0m Trial 590 finished with value: 9265.517380738775 and parameters: {'depth': 5, 'learning_rate': 0.21805161226558245, 'iterations': 306, 'l2_leaf_reg': 4.179092536007732e-06, 'border_count': 20, 'bagging_temperature': 0.8565818293364159, 'random_strength': 0.008719372595610841, 'grow_policy': 'SymmetricTree', 'min_data_in_leaf': 667}. Best is trial 374 with value: 6012.54835621459.[0m
[32m[I 2024-10-13 06:06:16,350][0m Trial 591 finished with value: 13921.146274125651 and parameters: {'depth': 6, 'learning_rate': 0.14019851990688612, 'iterations': 250, 'l2_leaf_reg': 3.111213238372559e-05, 'border_count': 48, 'bagging_temperature': 0.888792224075903, 'random_strength': 0.49401325357005466, 'grow_policy': 'SymmetricTree', 'min_data_in_leaf': 740}. Best is trial 374 with value: 6012.54835621459.[0m
[32m[I 2024-10-13 06:06:17,418][0m Trial 592 finished with value: 10534.264189881547 and parameters: {'depth': 5, 'learning_rate': 0.29072468881361174, 'iterations': 355, 'l2_leaf_reg': 6.007743379647245e-06, 'border_count': 35, 'bagging_temperature': 0.7140920811014696, 'random_strength': 7.8923875934826135, 'grow_policy': 'SymmetricTree', 'min_data_in_leaf': 797}. Best is trial 374 with value: 6012.54835621459.[0m
[32m[I 2024-10-13 06:06:18,099][0m Trial 593 finished with value: 6870.55744422608 and parameters: {'depth': 5, 'learning_rate': 0.20292686364187196, 'iterations': 189, 'l2_leaf_reg': 9.383569669330681e-06, 'border_count': 29, 'bagging_temperature': 0.9170223001227734, 'random_strength': 0.311164652524844, 'grow_policy': 'SymmetricTree', 'min_data_in_leaf': 716}. Best is trial 374 with value: 6012.54835621459.[0m
[32m[I 2024-10-13 06:06:18,875][0m Trial 594 finished with value: 6752.3215054680795 and parameters: {'depth': 5, 'learning_rate': 0.21730315987993973, 'iterations': 185, 'l2_leaf_reg': 8.843693280002582e-06, 'border_count': 27, 'bagging_temperature': 0.9122285968562001, 'random_strength': 0.21050477715005744, 'grow_policy': 'SymmetricTree', 'min_data_in_leaf': 694}. Best is trial 374 with value: 6012.54835621459.[0m
[32m[I 2024-10-13 06:06:19,591][0m Trial 595 finished with value: 9434.466978229748 and parameters: {'depth': 4, 'learning_rate': 0.22645962759050264, 'iterations': 171, 'l2_leaf_reg': 1.5988084371383313e-05, 'border_count': 15, 'bagging_temperature': 0.87085735579282, 'random_strength': 0.23426538756766907, 'grow_policy': 'SymmetricTree', 'min_data_in_leaf': 700}. Best is trial 374 with value: 6012.54835621459.[0m
[32m[I 2024-10-13 06:06:20,335][0m Trial 596 finished with value: 8955.551927569599 and parameters: {'depth': 5, 'learning_rate': 0.2539586845650531, 'iterations': 183, 'l2_leaf_reg': 1.3010857280678248e-05, 'border_count': 22, 'bagging_temperature': 0.9069073587688936, 'random_strength': 9.92582980072739, 'grow_policy': 'SymmetricTree', 'min_data_in_leaf': 705}. Best is trial 374 with value: 6012.54835621459.[0m
[32m[I 2024-10-13 06:06:21,103][0m Trial 597 finished with value: 12254.445269767932 and parameters: {'depth': 6, 'learning_rate': 0.19740138357494943, 'iterations': 157, 'l2_leaf_reg': 1.0083688064542462e-05, 'border_count': 179, 'bagging_temperature': 0.8841615953080038, 'random_strength': 0.00016894194408584307, 'grow_policy': 'SymmetricTree', 'min_data_in_leaf': 725}. Best is trial 374 with value: 6012.54835621459.[0m
[32m[I 2024-10-13 06:06:21,879][0m Trial 598 finished with value: 6563.270452900793 and parameters: {'depth': 5, 'learning_rate': 0.21926669675863553, 'iterations': 204, 'l2_leaf_reg': 2.6925156621993167e-05, 'border_count': 27, 'bagging_temperature': 0.8990407117599876, 'random_strength': 0.23059480650562214, 'grow_policy': 'SymmetricTree', 'min_data_in_leaf': 688}. Best is trial 374 with value: 6012.54835621459.[0m
[32m[I 2024-10-13 06:06:22,654][0m Trial 599 finished with value: 7107.342567769191 and parameters: {'depth': 5, 'learning_rate': 0.199356526344559, 'iterations': 205, 'l2_leaf_reg': 2.621494438155375e-05, 'border_count': 23, 'bagging_temperature': 0.865608596560019, 'random_strength': 0.14799788643653572, 'grow_policy': 'SymmetricTree', 'min_data_in_leaf': 682}. Best is trial 374 with value: 6012.54835621459.[0m
[32m[I 2024-10-13 06:06:23,386][0m Trial 600 finished with value: 20468.566740701306 and parameters: {'depth': 5, 'learning_rate': 0.003573324058637404, 'iterations': 194, 'l2_leaf_reg': 4.584142017094787e-05, 'border_count': 9, 'bagging_temperature': 0.8647088261370659, 'random_strength': 0.16428340056642698, 'grow_policy': 'Lossguide', 'min_data_in_leaf': 684, 'max_leaves': 151}. Best is trial 374 with value: 6012.54835621459.[0m
[32m[I 2024-10-13 06:06:31,527][0m Trial 601 finished with value: 11139.592467738106 and parameters: {'depth': 5, 'learning_rate': 0.29888854989706143, 'iterations': 2288, 'l2_leaf_reg': 2.7357092619285758e-05, 'border_count': 12, 'bagging_temperature': 0.8364442418176286, 'random_strength': 0.17938533997866013, 'grow_policy': 'SymmetricTree', 'min_data_in_leaf': 680}. Best is trial 374 with value: 6012.54835621459.[0m
[32m[I 2024-10-13 06:06:32,263][0m Trial 602 finished with value: 8837.591780911755 and parameters: {'depth': 5, 'learning_rate': 0.20690197241869152, 'iterations': 155, 'l2_leaf_reg': 3.5108798404229845e-05, 'border_count': 18, 'bagging_temperature': 0.8671486447466825, 'random_strength': 0.011132447544498603, 'grow_policy': 'SymmetricTree', 'min_data_in_leaf': 656}. Best is trial 374 with value: 6012.54835621459.[0m
[32m[I 2024-10-13 06:06:36,846][0m Trial 603 finished with value: 12658.15319028324 and parameters: {'depth': 13, 'learning_rate': 0.20921085627658764, 'iterations': 224, 'l2_leaf_reg': 6.337074929037584e-05, 'border_count': 20, 'bagging_temperature': 0.8034989038512912, 'random_strength': 0.18834051413161687, 'grow_policy': 'SymmetricTree', 'min_data_in_leaf': 695}. Best is trial 374 with value: 6012.54835621459.[0m
[32m[I 2024-10-13 06:06:37,371][0m Trial 604 finished with value: 11056.171311899045 and parameters: {'depth': 5, 'learning_rate': 0.22846099886722615, 'iterations': 100, 'l2_leaf_reg': 2.413032534149736e-05, 'border_count': 23, 'bagging_temperature': 0.8464286276590041, 'random_strength': 0.3288759413095874, 'grow_policy': 'Depthwise', 'min_data_in_leaf': 699}. Best is trial 374 with value: 6012.54835621459.[0m
[32m[I 2024-10-13 06:06:38,140][0m Trial 605 finished with value: 12611.217105697284 and parameters: {'depth': 5, 'learning_rate': 0.1860356902525206, 'iterations': 208, 'l2_leaf_reg': 3.000962783644813e-05, 'border_count': 3, 'bagging_temperature': 0.8556109405958694, 'random_strength': 0.011718145453664175, 'grow_policy': 'SymmetricTree', 'min_data_in_leaf': 681}. Best is trial 374 with value: 6012.54835621459.[0m
[32m[I 2024-10-13 06:06:38,875][0m Trial 606 finished with value: 9881.355549644466 and parameters: {'depth': 5, 'learning_rate': 0.25291977629371265, 'iterations': 152, 'l2_leaf_reg': 2.2114065401813595e-05, 'border_count': 14, 'bagging_temperature': 0.8818041688893632, 'random_strength': 0.20236449421395158, 'grow_policy': 'SymmetricTree', 'min_data_in_leaf': 652}. Best is trial 374 with value: 6012.54835621459.[0m
[32m[I 2024-10-13 06:06:39,685][0m Trial 607 finished with value: 6367.2046736260145 and parameters: {'depth': 5, 'learning_rate': 0.18109302684002115, 'iterations': 221, 'l2_leaf_reg': 2.3459135187846808e-05, 'border_count': 27, 'bagging_temperature': 0.8874913953465059, 'random_strength': 0.36046944667310726, 'grow_policy': 'SymmetricTree', 'min_data_in_leaf': 708}. Best is trial 374 with value: 6012.54835621459.[0m
[32m[I 2024-10-13 06:06:40,503][0m Trial 608 finished with value: 8600.338296348747 and parameters: {'depth': 5, 'learning_rate': 0.17583467747400724, 'iterations': 246, 'l2_leaf_reg': 4.94098939460746e-05, 'border_count': 21, 'bagging_temperature': 0.8239440789692423, 'random_strength': 0.4348779545052033, 'grow_policy': 'SymmetricTree', 'min_data_in_leaf': 673}. Best is trial 374 with value: 6012.54835621459.[0m
[32m[I 2024-10-13 06:06:41,353][0m Trial 609 finished with value: 7837.710196822005 and parameters: {'depth': 5, 'learning_rate': 0.16453968621975837, 'iterations': 243, 'l2_leaf_reg': 6.79377870034166e-05, 'border_count': 25, 'bagging_temperature': 0.8730618355644201, 'random_strength': 0.17860146124742374, 'grow_policy': 'SymmetricTree', 'min_data_in_leaf': 709}. Best is trial 374 with value: 6012.54835621459.[0m
[32m[I 2024-10-13 06:06:42,171][0m Trial 610 finished with value: 9136.352743557218 and parameters: {'depth': 5, 'learning_rate': 0.19204218381846885, 'iterations': 241, 'l2_leaf_reg': 1.9237357778243584e-05, 'border_count': 18, 'bagging_temperature': 0.8590674534445666, 'random_strength': 4.594043880115484, 'grow_policy': 'SymmetricTree', 'min_data_in_leaf': 898}. Best is trial 374 with value: 6012.54835621459.[0m
[32m[I 2024-10-13 06:06:42,979][0m Trial 611 finished with value: 7276.505905855803 and parameters: {'depth': 5, 'learning_rate': 0.19545866259800884, 'iterations': 198, 'l2_leaf_reg': 4.0305088123479625e-05, 'border_count': 25, 'bagging_temperature': 0.8889235219418404, 'random_strength': 0.3390403547250114, 'grow_policy': 'SymmetricTree', 'min_data_in_leaf': 674}. Best is trial 374 with value: 6012.54835621459.[0m
[32m[I 2024-10-13 06:06:43,830][0m Trial 612 finished with value: 9579.916811246663 and parameters: {'depth': 5, 'learning_rate': 0.15825165679437045, 'iterations': 276, 'l2_leaf_reg': 2.957629178853193e-05, 'border_count': 17, 'bagging_temperature': 0.8939956349482072, 'random_strength': 0.45949261140016595, 'grow_policy': 'SymmetricTree', 'min_data_in_leaf': 638}. Best is trial 374 with value: 6012.54835621459.[0m
[32m[I 2024-10-13 06:06:44,614][0m Trial 613 finished with value: 6464.472555165327 and parameters: {'depth': 5, 'learning_rate': 0.21640298547349696, 'iterations': 210, 'l2_leaf_reg': 1.8774742447222466e-05, 'border_count': 27, 'bagging_temperature': 0.8485098249204428, 'random_strength': 0.15390666479567736, 'grow_policy': 'SymmetricTree', 'min_data_in_leaf': 712}. Best is trial 374 with value: 6012.54835621459.[0m
[32m[I 2024-10-13 06:06:49,190][0m Trial 614 finished with value: 10095.472371669586 and parameters: {'depth': 5, 'learning_rate': 0.2657690736181961, 'iterations': 1064, 'l2_leaf_reg': 2.3101852573794266e-05, 'border_count': 21, 'bagging_temperature': 0.8318423525353833, 'random_strength': 0.16632724277629882, 'grow_policy': 'SymmetricTree', 'min_data_in_leaf': 712}. Best is trial 374 with value: 6012.54835621459.[0m
[32m[I 2024-10-13 06:06:49,975][0m Trial 615 finished with value: 10041.705594403318 and parameters: {'depth': 5, 'learning_rate': 0.22163786362255247, 'iterations': 205, 'l2_leaf_reg': 1.830218132474153e-05, 'border_count': 13, 'bagging_temperature': 0.8368044950770797, 'random_strength': 0.010448916343802211, 'grow_policy': 'SymmetricTree', 'min_data_in_leaf': 917}. Best is trial 374 with value: 6012.54835621459.[0m
