[32m[I 2024-10-13 06:06:50,808][0m Trial 616 finished with value: 7342.1252706475625 and parameters: {'depth': 5, 'learning_rate': 0.182926158308982, 'iterations': 260, 'l2_leaf_reg': 4.277212686782433e-05, 'border_count': 26, 'bagging_temperature': 0.8082497991713251, 'random_strength': 0.1780421600654025, 'grow_policy': 'SymmetricTree', 'min_data_in_leaf': 690}. Best is trial 374 with value: 6012.54835621459.[0m
[32m[I 2024-10-13 06:06:51,524][0m Trial 617 finished with value: 7482.216634645595 and parameters: {'depth': 5, 'learning_rate': 0.2249965110795387, 'iterations': 154, 'l2_leaf_reg': 1.5172836715039849e-05, 'border_count': 27, 'bagging_temperature': 0.8507972825928675, 'random_strength': 0.0032913291617512885, 'grow_policy': 'SymmetricTree', 'min_data_in_leaf': 666}. Best is trial 374 with value: 6012.54835621459.[0m
[32m[I 2024-10-13 06:06:52,344][0m Trial 618 finished with value: 16265.636104467398 and parameters: {'depth': 6, 'learning_rate': 0.26163996083952157, 'iterations': 212, 'l2_leaf_reg': 8.236355742866004e-05, 'border_count': 9, 'bagging_temperature': 0.8451650251918755, 'random_strength': 0.3318999211939701, 'grow_policy': 'SymmetricTree', 'min_data_in_leaf': 879}. Best is trial 374 with value: 6012.54835621459.[0m
[32m[I 2024-10-13 06:06:58,824][0m Trial 619 finished with value: 10265.29424066523 and parameters: {'depth': 5, 'learning_rate': 0.18935284232216068, 'iterations': 1575, 'l2_leaf_reg': 2.415885270589261e-05, 'border_count': 21, 'bagging_temperature': 0.8667630541721582, 'random_strength': 0.23013190012942794, 'grow_policy': 'SymmetricTree', 'min_data_in_leaf': 691}. Best is trial 374 with value: 6012.54835621459.[0m
[32m[I 2024-10-13 06:06:59,679][0m Trial 620 finished with value: 7573.369431495914 and parameters: {'depth': 5, 'learning_rate': 0.20901453336795364, 'iterations': 258, 'l2_leaf_reg': 1.5906539335792986e-05, 'border_count': 27, 'bagging_temperature': 0.8615554340704373, 'random_strength': 0.012851119073419792, 'grow_policy': 'SymmetricTree', 'min_data_in_leaf': 636}. Best is trial 374 with value: 6012.54835621459.[0m
[32m[I 2024-10-13 06:07:00,412][0m Trial 621 finished with value: 8843.60490233095 and parameters: {'depth': 5, 'learning_rate': 0.16060710159186142, 'iterations': 167, 'l2_leaf_reg': 0.0001579393547383141, 'border_count': 19, 'bagging_temperature': 0.8358323966554304, 'random_strength': 0.3876119439002874, 'grow_policy': 'SymmetricTree', 'min_data_in_leaf': 720}. Best is trial 374 with value: 6012.54835621459.[0m
[32m[I 2024-10-13 06:07:01,189][0m Trial 622 finished with value: 9764.976957671952 and parameters: {'depth': 15, 'learning_rate': 0.2589629363188484, 'iterations': 292, 'l2_leaf_reg': 1.9438639064242384e-05, 'border_count': 27, 'bagging_temperature': 0.8778296934451358, 'random_strength': 0.18046920636970004, 'grow_policy': 'Lossguide', 'min_data_in_leaf': 720, 'max_leaves': 231}. Best is trial 374 with value: 6012.54835621459.[0m
[32m[I 2024-10-13 06:07:01,967][0m Trial 623 finished with value: 9173.888137282585 and parameters: {'depth': 5, 'learning_rate': 0.1856806042052235, 'iterations': 204, 'l2_leaf_reg': 3.615528883128653e-05, 'border_count': 23, 'bagging_temperature': 0.8588434449441577, 'random_strength': 0.43709863491739603, 'grow_policy': 'SymmetricTree', 'min_data_in_leaf': 667}. Best is trial 374 with value: 6012.54835621459.[0m
[32m[I 2024-10-13 06:07:02,688][0m Trial 624 finished with value: 8529.069764641483 and parameters: {'depth': 5, 'learning_rate': 0.2317135492335263, 'iterations': 156, 'l2_leaf_reg': 1.2574815367529217e-05, 'border_count': 15, 'bagging_temperature': 0.8143558022643301, 'random_strength': 0.23265701246288858, 'grow_policy': 'SymmetricTree', 'min_data_in_leaf': 891}. Best is trial 374 with value: 6012.54835621459.[0m
[32m[I 2024-10-13 06:07:03,576][0m Trial 625 finished with value: 10213.353654169261 and parameters: {'depth': 6, 'learning_rate': 0.2949472379463824, 'iterations': 265, 'l2_leaf_reg': 2.551070141565453e-05, 'border_count': 27, 'bagging_temperature': 0.8809349696361759, 'random_strength': 0.5015611941051128, 'grow_policy': 'SymmetricTree', 'min_data_in_leaf': 691}. Best is trial 374 with value: 6012.54835621459.[0m
[32m[I 2024-10-13 06:07:04,383][0m Trial 626 finished with value: 7844.46614189168 and parameters: {'depth': 5, 'learning_rate': 0.1607288203200738, 'iterations': 216, 'l2_leaf_reg': 1.3446566080311998e-05, 'border_count': 30, 'bagging_temperature': 0.8899624864152862, 'random_strength': 0.003191531994116953, 'grow_policy': 'SymmetricTree', 'min_data_in_leaf': 913}. Best is trial 374 with value: 6012.54835621459.[0m
[32m[I 2024-10-13 06:07:05,114][0m Trial 627 finished with value: 9874.771080225726 and parameters: {'depth': 5, 'learning_rate': 0.2175269179289103, 'iterations': 274, 'l2_leaf_reg': 1.168578260790367e-05, 'border_count': 23, 'bagging_temperature': 0.8968599774404571, 'random_strength': 0.302356479490335, 'grow_policy': 'Depthwise', 'min_data_in_leaf': 866}. Best is trial 374 with value: 6012.54835621459.[0m
[32m[I 2024-10-13 06:07:10,337][0m Trial 628 finished with value: 9302.36378267502 and parameters: {'depth': 5, 'learning_rate': 0.18236915948291324, 'iterations': 1229, 'l2_leaf_reg': 3.444739413991093e-05, 'border_count': 29, 'bagging_temperature': 0.8724684832835564, 'random_strength': 0.16793757969755663, 'grow_policy': 'SymmetricTree', 'min_data_in_leaf': 818}. Best is trial 374 with value: 6012.54835621459.[0m
[32m[I 2024-10-13 06:07:11,265][0m Trial 629 finished with value: 9189.870253071533 and parameters: {'depth': 8, 'learning_rate': 0.14308195413245442, 'iterations': 179, 'l2_leaf_reg': 1.8980367404567125e-05, 'border_count': 19, 'bagging_temperature': 0.8439497605270744, 'random_strength': 0.47746383094872996, 'grow_policy': 'SymmetricTree', 'min_data_in_leaf': 721}. Best is trial 374 with value: 6012.54835621459.[0m
[32m[I 2024-10-13 06:07:12,196][0m Trial 630 finished with value: 7774.43218696151 and parameters: {'depth': 6, 'learning_rate': 0.2047732793869941, 'iterations': 300, 'l2_leaf_reg': 1.0412316111810186e-05, 'border_count': 30, 'bagging_temperature': 0.7900577960033505, 'random_strength': 0.35601165806180485, 'grow_policy': 'SymmetricTree', 'min_data_in_leaf': 658}. Best is trial 374 with value: 6012.54835621459.[0m
[32m[I 2024-10-13 06:07:12,928][0m Trial 631 finished with value: 7963.781569809733 and parameters: {'depth': 5, 'learning_rate': 0.24401278902675538, 'iterations': 142, 'l2_leaf_reg': 9.78512843010381e-06, 'border_count': 25, 'bagging_temperature': 0.6555770799170602, 'random_strength': 0.18688986891268433, 'grow_policy': 'SymmetricTree', 'min_data_in_leaf': 700}. Best is trial 374 with value: 6012.54835621459.[0m
[32m[I 2024-10-13 06:07:13,754][0m Trial 632 finished with value: 14191.897415339403 and parameters: {'depth': 5, 'learning_rate': 0.16062248426887804, 'iterations': 221, 'l2_leaf_reg': 5.3803463274053485e-05, 'border_count': 9, 'bagging_temperature': 0.9019933576800847, 'random_strength': 0.5846562564076907, 'grow_policy': 'SymmetricTree', 'min_data_in_leaf': 939}. Best is trial 374 with value: 6012.54835621459.[0m
[32m[I 2024-10-13 06:07:14,698][0m Trial 633 finished with value: 6072.141599422284 and parameters: {'depth': 5, 'learning_rate': 0.20522038557513445, 'iterations': 352, 'l2_leaf_reg': 1.8094832525436464e-05, 'border_count': 31, 'bagging_temperature': 0.8800439967477998, 'random_strength': 0.31393446065924235, 'grow_policy': 'SymmetricTree', 'min_data_in_leaf': 682}. Best is trial 374 with value: 6012.54835621459.[0m
[32m[I 2024-10-13 06:07:15,692][0m Trial 634 finished with value: 7642.810402358231 and parameters: {'depth': 5, 'learning_rate': 0.24993726308534328, 'iterations': 389, 'l2_leaf_reg': 2.7796545632151863e-05, 'border_count': 16, 'bagging_temperature': 0.8691126533606288, 'random_strength': 0.5096389080214502, 'grow_policy': 'SymmetricTree', 'min_data_in_leaf': 678}. Best is trial 374 with value: 6012.54835621459.[0m
[32m[I 2024-10-13 06:07:16,624][0m Trial 635 finished with value: 7746.772704809527 and parameters: {'depth': 5, 'learning_rate': 0.296236890160233, 'iterations': 350, 'l2_leaf_reg': 2.282438886235133e-05, 'border_count': 23, 'bagging_temperature': 0.9014931690446945, 'random_strength': 0.16877332828572048, 'grow_policy': 'SymmetricTree', 'min_data_in_leaf': 649}. Best is trial 374 with value: 6012.54835621459.[0m
[32m[I 2024-10-13 06:07:17,619][0m Trial 636 finished with value: 13713.742576183411 and parameters: {'depth': 6, 'learning_rate': 0.22679053620365333, 'iterations': 341, 'l2_leaf_reg': 1.4883966947619206e-05, 'border_count': 155, 'bagging_temperature': 0.4569666471738344, 'random_strength': 0.6641368558401428, 'grow_policy': 'SymmetricTree', 'min_data_in_leaf': 692}. Best is trial 374 with value: 6012.54835621459.[0m
[32m[I 2024-10-13 06:07:18,720][0m Trial 637 finished with value: 6906.946219608882 and parameters: {'depth': 5, 'learning_rate': 0.19874883354351486, 'iterations': 462, 'l2_leaf_reg': 4.410009065229758e-05, 'border_count': 31, 'bagging_temperature': 0.8926763652611235, 'random_strength': 0.37586505278302473, 'grow_policy': 'SymmetricTree', 'min_data_in_leaf': 595}. Best is trial 374 with value: 6012.54835621459.[0m
[32m[I 2024-10-13 06:07:19,820][0m Trial 638 finished with value: 8316.735465430755 and parameters: {'depth': 5, 'learning_rate': 0.18552065834268114, 'iterations': 495, 'l2_leaf_reg': 9.334732742953528e-05, 'border_count': 28, 'bagging_temperature': 0.8519086849547906, 'random_strength': 0.005807178671882657, 'grow_policy': 'SymmetricTree', 'min_data_in_leaf': 642}. Best is trial 374 with value: 6012.54835621459.[0m
[32m[I 2024-10-13 06:07:22,127][0m Trial 639 finished with value: 11977.492756597063 and parameters: {'depth': 5, 'learning_rate': 0.20114471166747425, 'iterations': 503, 'l2_leaf_reg': 4.8719046130205937e-05, 'border_count': 22, 'bagging_temperature': 0.8236085730039239, 'random_strength': 0.4654985322869072, 'grow_policy': 'SymmetricTree', 'min_data_in_leaf': 601}. Best is trial 374 with value: 6012.54835621459.[0m
[32m[I 2024-10-13 06:07:23,263][0m Trial 640 finished with value: 7695.1689231114415 and parameters: {'depth': 5, 'learning_rate': 0.17608370701884224, 'iterations': 473, 'l2_leaf_reg': 4.523598895776112e-05, 'border_count': 29, 'bagging_temperature': 0.8780620051534358, 'random_strength': 0.6652304853272193, 'grow_policy': 'SymmetricTree', 'min_data_in_leaf': 618}. Best is trial 374 with value: 6012.54835621459.[0m
[32m[I 2024-10-13 06:07:24,330][0m Trial 641 finished with value: 7528.116732047037 and parameters: {'depth': 5, 'learning_rate': 0.2010491194696829, 'iterations': 436, 'l2_leaf_reg': 3.163699694873165e-05, 'border_count': 32, 'bagging_temperature': 0.8527252119947409, 'random_strength': 0.00011164445271599766, 'grow_policy': 'SymmetricTree', 'min_data_in_leaf': 632}. Best is trial 374 with value: 6012.54835621459.[0m
[32m[I 2024-10-13 06:07:25,350][0m Trial 642 finished with value: 7876.66179279395 and parameters: {'depth': 5, 'learning_rate': 0.2633178997781328, 'iterations': 386, 'l2_leaf_reg': 2.030737266054986e-05, 'border_count': 24, 'bagging_temperature': 0.8938274223472111, 'random_strength': 0.29660666248466483, 'grow_policy': 'SymmetricTree', 'min_data_in_leaf': 659}. Best is trial 374 with value: 6012.54835621459.[0m
[32m[I 2024-10-13 06:07:26,180][0m Trial 643 finished with value: 15706.058188808967 and parameters: {'depth': 6, 'learning_rate': 0.1618391460443618, 'iterations': 417, 'l2_leaf_reg': 3.3471719604518e-05, 'border_count': 198, 'bagging_temperature': 0.7562087362742129, 'random_strength': 0.4430087565550933, 'grow_policy': 'Lossguide', 'min_data_in_leaf': 612, 'max_leaves': 210}. Best is trial 374 with value: 6012.54835621459.[0m
[32m[I 2024-10-13 06:07:36,361][0m Trial 644 finished with value: 10827.854599288092 and parameters: {'depth': 5, 'learning_rate': 0.2323698596601651, 'iterations': 2586, 'l2_leaf_reg': 1.795543588484216e-05, 'border_count': 19, 'bagging_temperature': 0.8716230875870189, 'random_strength': 0.19484416341070615, 'grow_policy': 'SymmetricTree', 'min_data_in_leaf': 670}. Best is trial 374 with value: 6012.54835621459.[0m
[32m[I 2024-10-13 06:07:37,307][0m Trial 645 finished with value: 7443.782992488822 and parameters: {'depth': 5, 'learning_rate': 0.17756158764704963, 'iterations': 359, 'l2_leaf_reg': 0.00011665482988029027, 'border_count': 32, 'bagging_temperature': 0.9035482570548548, 'random_strength': 0.7543756578875713, 'grow_policy': 'SymmetricTree', 'min_data_in_leaf': 643}. Best is trial 374 with value: 6012.54835621459.[0m
[32m[I 2024-10-13 06:07:40,119][0m Trial 646 finished with value: 16606.332892396345 and parameters: {'depth': 5, 'learning_rate': 0.002158814362689678, 'iterations': 570, 'l2_leaf_reg': 5.877261320728206e-05, 'border_count': 27, 'bagging_temperature': 0.8416297046964774, 'random_strength': 0.3350226830195209, 'grow_policy': 'SymmetricTree', 'min_data_in_leaf': 675}. Best is trial 374 with value: 6012.54835621459.[0m
[32m[I 2024-10-13 06:07:41,041][0m Trial 647 finished with value: 6941.767007825381 and parameters: {'depth': 5, 'learning_rate': 0.21042918144176376, 'iterations': 327, 'l2_leaf_reg': 2.8163059745424585e-05, 'border_count': 14, 'bagging_temperature': 0.8869050460536981, 'random_strength': 0.4916607861516156, 'grow_policy': 'SymmetricTree', 'min_data_in_leaf': 660}. Best is trial 374 with value: 6012.54835621459.[0m
[32m[I 2024-10-13 06:07:42,163][0m Trial 648 finished with value: 8472.50881222346 and parameters: {'depth': 6, 'learning_rate': 0.26630018762532937, 'iterations': 449, 'l2_leaf_reg': 4.018007767796675e-05, 'border_count': 15, 'bagging_temperature': 0.8588520514111112, 'random_strength': 0.7285542260886081, 'grow_policy': 'SymmetricTree', 'min_data_in_leaf': 643}. Best is trial 374 with value: 6012.54835621459.[0m
[32m[I 2024-10-13 06:07:48,714][0m Trial 649 finished with value: 14972.108334943345 and parameters: {'depth': 5, 'learning_rate': 0.21052279100792964, 'iterations': 1846, 'l2_leaf_reg': 5.9213536835305854e-05, 'border_count': 9, 'bagging_temperature': 0.8845968893266947, 'random_strength': 0.5598805141904231, 'grow_policy': 'SymmetricTree', 'min_data_in_leaf': 630}. Best is trial 374 with value: 6012.54835621459.[0m
[32m[I 2024-10-13 06:07:49,567][0m Trial 650 finished with value: 17185.540885675295 and parameters: {'depth': 5, 'learning_rate': 0.297647008341709, 'iterations': 424, 'l2_leaf_reg': 1.9533812584988775e-05, 'border_count': 7, 'bagging_temperature': 0.868732166216936, 'random_strength': 0.8460047797949399, 'grow_policy': 'Depthwise', 'min_data_in_leaf': 600}. Best is trial 374 with value: 6012.54835621459.[0m
[32m[I 2024-10-13 06:07:50,537][0m Trial 651 finished with value: 9287.6856772382 and parameters: {'depth': 5, 'learning_rate': 0.23521550244009024, 'iterations': 360, 'l2_leaf_reg': 3.459916929413193e-05, 'border_count': 16, 'bagging_temperature': 0.8858275890803383, 'random_strength': 5.4421553259218856, 'grow_policy': 'SymmetricTree', 'min_data_in_leaf': 663}. Best is trial 374 with value: 6012.54835621459.[0m
[32m[I 2024-10-13 06:07:53,144][0m Trial 652 finished with value: 13780.935744119215 and parameters: {'depth': 6, 'learning_rate': 0.21734188852433714, 'iterations': 642, 'l2_leaf_reg': 2.3087646188364835e-05, 'border_count': 4, 'bagging_temperature': 0.8486540604011704, 'random_strength': 0.5559292011909214, 'grow_policy': 'SymmetricTree', 'min_data_in_leaf': 591}. Best is trial 374 with value: 6012.54835621459.[0m
[32m[I 2024-10-13 06:07:54,030][0m Trial 653 finished with value: 6570.045067296251 and parameters: {'depth': 5, 'learning_rate': 0.2551505588633186, 'iterations': 308, 'l2_leaf_reg': 1.615912244056513e-05, 'border_count': 12, 'bagging_temperature': 0.9000784118476257, 'random_strength': 0.6274732391773408, 'grow_policy': 'SymmetricTree', 'min_data_in_leaf': 655}. Best is trial 374 with value: 6012.54835621459.[0m
[32m[I 2024-10-13 06:07:55,097][0m Trial 654 finished with value: 8600.183057546574 and parameters: {'depth': 5, 'learning_rate': 0.19470677745148532, 'iterations': 446, 'l2_leaf_reg': 3.1438386383156196e-05, 'border_count': 13, 'bagging_temperature': 0.901990891972668, 'random_strength': 0.8602903320945836, 'grow_policy': 'SymmetricTree', 'min_data_in_leaf': 622}. Best is trial 374 with value: 6012.54835621459.[0m
[32m[I 2024-10-13 06:07:56,090][0m Trial 655 finished with value: 12580.882434773806 and parameters: {'depth': 5, 'learning_rate': 0.1495016164589836, 'iterations': 383, 'l2_leaf_reg': 2.5651392339498067e-05, 'border_count': 4, 'bagging_temperature': 0.8280799904261612, 'random_strength': 0.8115830060347379, 'grow_policy': 'SymmetricTree', 'min_data_in_leaf': 663}. Best is trial 374 with value: 6012.54835621459.[0m
[32m[I 2024-10-13 06:07:56,998][0m Trial 656 finished with value: 18550.389787120897 and parameters: {'depth': 5, 'learning_rate': 0.2521948847016994, 'iterations': 324, 'l2_leaf_reg': 7.08252711799069e-05, 'border_count': 1, 'bagging_temperature': 0.9098930203816853, 'random_strength': 0.6533241580926167, 'grow_policy': 'SymmetricTree', 'min_data_in_leaf': 648}. Best is trial 374 with value: 6012.54835621459.[0m
[32m[I 2024-10-13 06:07:57,907][0m Trial 657 finished with value: 7636.294697641461 and parameters: {'depth': 5, 'learning_rate': 0.2043201621805611, 'iterations': 329, 'l2_leaf_reg': 1.6671700628168336e-05, 'border_count': 13, 'bagging_temperature': 0.8645394757867227, 'random_strength': 0.5910535537830491, 'grow_policy': 'SymmetricTree', 'min_data_in_leaf': 631}. Best is trial 374 with value: 6012.54835621459.[0m
[32m[I 2024-10-13 06:07:58,970][0m Trial 658 finished with value: 8783.796008473693 and parameters: {'depth': 6, 'learning_rate': 0.17973345092800014, 'iterations': 390, 'l2_leaf_reg': 2.929135644266896e-05, 'border_count': 10, 'bagging_temperature': 0.15384025527257184, 'random_strength': 1.008011204564192, 'grow_policy': 'SymmetricTree', 'min_data_in_leaf': 684}. Best is trial 374 with value: 6012.54835621459.[0m
[32m[I 2024-10-13 06:08:00,053][0m Trial 659 finished with value: 8100.310462587403 and parameters: {'depth': 5, 'learning_rate': 0.2601192101937534, 'iterations': 478, 'l2_leaf_reg': 1.4640047393517972e-05, 'border_count': 15, 'bagging_temperature': 0.8945604505501671, 'random_strength': 8.998191393937406, 'grow_policy': 'SymmetricTree', 'min_data_in_leaf': 651}. Best is trial 374 with value: 6012.54835621459.[0m
[32m[I 2024-10-13 06:08:26,011][0m Trial 660 finished with value: 12841.11999859362 and parameters: {'depth': 11, 'learning_rate': 0.15179176921881601, 'iterations': 2859, 'l2_leaf_reg': 5.2810385199182e-05, 'border_count': 9, 'bagging_temperature': 0.9119311379511222, 'random_strength': 0.5338869051609478, 'grow_policy': 'SymmetricTree', 'min_data_in_leaf': 678}. Best is trial 374 with value: 6012.54835621459.[0m
[32m[I 2024-10-13 06:08:26,895][0m Trial 661 finished with value: 14174.798709687291 and parameters: {'depth': 5, 'learning_rate': 0.2087259627011714, 'iterations': 307, 'l2_leaf_reg': 2.5049358271782735e-05, 'border_count': 7, 'bagging_temperature': 0.8828018512949691, 'random_strength': 0.7463015682235847, 'grow_policy': 'SymmetricTree', 'min_data_in_leaf': 663}. Best is trial 374 with value: 6012.54835621459.[0m
[32m[I 2024-10-13 06:08:29,295][0m Trial 662 finished with value: 10524.786414837154 and parameters: {'depth': 5, 'learning_rate': 0.1790632012076214, 'iterations': 541, 'l2_leaf_reg': 1.328341210178412e-05, 'border_count': 18, 'bagging_temperature': 0.9014829011949695, 'random_strength': 0.45331208954438373, 'grow_policy': 'SymmetricTree', 'min_data_in_leaf': 688}. Best is trial 374 with value: 6012.54835621459.[0m
[32m[I 2024-10-13 06:08:30,212][0m Trial 663 finished with value: 8003.804531871098 and parameters: {'depth': 5, 'learning_rate': 0.22502054726916665, 'iterations': 312, 'l2_leaf_reg': 1.792881218139671e-05, 'border_count': 13, 'bagging_temperature': 0.8707186026455835, 'random_strength': 0.404754600976061, 'grow_policy': 'SymmetricTree', 'min_data_in_leaf': 613}. Best is trial 374 with value: 6012.54835621459.[0m
[32m[I 2024-10-13 06:08:31,264][0m Trial 664 finished with value: 8670.25362633673 and parameters: {'depth': 5, 'learning_rate': 0.14748702880566045, 'iterations': 413, 'l2_leaf_reg': 4.2116113125228147e-05, 'border_count': 21, 'bagging_temperature': 0.913978636586352, 'random_strength': 0.6913588631452303, 'grow_policy': 'SymmetricTree', 'min_data_in_leaf': 641}. Best is trial 374 with value: 6012.54835621459.[0m
[32m[I 2024-10-13 06:08:32,300][0m Trial 665 finished with value: 10193.579400460423 and parameters: {'depth': 6, 'learning_rate': 0.25832062272084894, 'iterations': 358, 'l2_leaf_reg': 1.0244394071271903e-05, 'border_count': 19, 'bagging_temperature': 0.8306602753984907, 'random_strength': 0.3959943087836483, 'grow_policy': 'SymmetricTree', 'min_data_in_leaf': 685}. Best is trial 374 with value: 6012.54835621459.[0m
[32m[I 2024-10-13 06:08:33,214][0m Trial 666 finished with value: 6508.854484525024 and parameters: {'depth': 5, 'learning_rate': 0.19963915367756263, 'iterations': 290, 'l2_leaf_reg': 8.712636312624021e-05, 'border_count': 10, 'bagging_temperature': 0.7813124426340975, 'random_strength': 0.5477273717019672, 'grow_policy': 'SymmetricTree', 'min_data_in_leaf': 658}. Best is trial 374 with value: 6012.54835621459.[0m
[32m[I 2024-10-13 06:08:34,262][0m Trial 667 finished with value: 13090.646029836029 and parameters: {'depth': 5, 'learning_rate': 0.2207113267974434, 'iterations': 370, 'l2_leaf_reg': 9.018626678543319e-05, 'border_count': 2, 'bagging_temperature': 0.8141544604962984, 'random_strength': 5.00565826406012, 'grow_policy': 'SymmetricTree', 'min_data_in_leaf': 598}. Best is trial 374 with value: 6012.54835621459.[0m
