[32m[I 2024-10-13 06:11:48,234][0m Trial 823 finished with value: 9447.122793960883 and parameters: {'depth': 5, 'learning_rate': 0.1866450307676468, 'iterations': 2411, 'l2_leaf_reg': 1.4231007304717791e-05, 'border_count': 34, 'bagging_temperature': 0.7498182646599092, 'random_strength': 0.3548649470928922, 'grow_policy': 'Lossguide', 'min_data_in_leaf': 540, 'max_leaves': 165}. Best is trial 374 with value: 6012.54835621459.[0m
[32m[I 2024-10-13 06:11:49,074][0m Trial 824 finished with value: 14498.886290217704 and parameters: {'depth': 6, 'learning_rate': 0.21955370733281046, 'iterations': 209, 'l2_leaf_reg': 2.7226236213210453e-05, 'border_count': 46, 'bagging_temperature': 0.7475760336966939, 'random_strength': 0.30554223615884213, 'grow_policy': 'SymmetricTree', 'min_data_in_leaf': 92}. Best is trial 374 with value: 6012.54835621459.[0m
[32m[I 2024-10-13 06:11:49,883][0m Trial 825 finished with value: 10185.6724484091 and parameters: {'depth': 4, 'learning_rate': 0.23467594651612028, 'iterations': 277, 'l2_leaf_reg': 1.6267899847051434e-05, 'border_count': 41, 'bagging_temperature': 0.7880501609018682, 'random_strength': 0.4638393170545648, 'grow_policy': 'SymmetricTree', 'min_data_in_leaf': 23}. Best is trial 374 with value: 6012.54835621459.[0m
[32m[I 2024-10-13 06:11:50,682][0m Trial 826 finished with value: 7176.012731014019 and parameters: {'depth': 5, 'learning_rate': 0.16131381284682525, 'iterations': 206, 'l2_leaf_reg': 3.700809767087567e-05, 'border_count': 34, 'bagging_temperature': 0.6166721243467687, 'random_strength': 0.6393411649020193, 'grow_policy': 'SymmetricTree', 'min_data_in_leaf': 54}. Best is trial 374 with value: 6012.54835621459.[0m
[32m[I 2024-10-13 06:11:51,575][0m Trial 827 finished with value: 7224.290673506054 and parameters: {'depth': 5, 'learning_rate': 0.19254718948956892, 'iterations': 287, 'l2_leaf_reg': 1.2620752100992941e-05, 'border_count': 38, 'bagging_temperature': 0.7257408686293503, 'random_strength': 0.18898184664182904, 'grow_policy': 'SymmetricTree', 'min_data_in_leaf': 112}. Best is trial 374 with value: 6012.54835621459.[0m
[32m[I 2024-10-13 06:11:52,343][0m Trial 828 finished with value: 12217.878070124503 and parameters: {'depth': 5, 'learning_rate': 0.25941834909756517, 'iterations': 200, 'l2_leaf_reg': 2.402368964880289e-05, 'border_count': 172, 'bagging_temperature': 0.7626017711368519, 'random_strength': 0.8630920188990426, 'grow_policy': 'SymmetricTree', 'min_data_in_leaf': 741}. Best is trial 374 with value: 6012.54835621459.[0m
[32m[I 2024-10-13 06:11:53,210][0m Trial 829 finished with value: 7428.840961317089 and parameters: {'depth': 5, 'learning_rate': 0.20642666402588122, 'iterations': 280, 'l2_leaf_reg': 5.0732000831081435e-05, 'border_count': 32, 'bagging_temperature': 0.7810710128830588, 'random_strength': 0.3965901147819102, 'grow_policy': 'SymmetricTree', 'min_data_in_leaf': 71}. Best is trial 374 with value: 6012.54835621459.[0m
[32m[I 2024-10-13 06:11:54,035][0m Trial 830 finished with value: 11188.257132482695 and parameters: {'depth': 4, 'learning_rate': 0.14700796448028328, 'iterations': 231, 'l2_leaf_reg': 1.1592856845352622e-05, 'border_count': 31, 'bagging_temperature': 0.8552109504748396, 'random_strength': 0.6236464705747828, 'grow_policy': 'Depthwise', 'min_data_in_leaf': 37}. Best is trial 374 with value: 6012.54835621459.[0m
[32m[I 2024-10-13 06:11:55,769][0m Trial 831 finished with value: 14525.29303687512 and parameters: {'depth': 10, 'learning_rate': 0.22947237205033322, 'iterations': 318, 'l2_leaf_reg': 1.8878451823267668e-05, 'border_count': 51, 'bagging_temperature': 0.07423715737209469, 'random_strength': 0.16502767308976457, 'grow_policy': 'SymmetricTree', 'min_data_in_leaf': 5}. Best is trial 374 with value: 6012.54835621459.[0m
[32m[I 2024-10-13 06:11:56,516][0m Trial 832 finished with value: 8152.339380520905 and parameters: {'depth': 6, 'learning_rate': 0.16764233576971793, 'iterations': 180, 'l2_leaf_reg': 2.6985921807065927e-05, 'border_count': 40, 'bagging_temperature': 0.8362104287705007, 'random_strength': 0.3856039159375072, 'grow_policy': 'SymmetricTree', 'min_data_in_leaf': 98}. Best is trial 374 with value: 6012.54835621459.[0m
[32m[I 2024-10-13 06:11:57,523][0m Trial 833 finished with value: 7456.115210895767 and parameters: {'depth': 5, 'learning_rate': 0.26365410177876736, 'iterations': 371, 'l2_leaf_reg': 6.8328161276079805e-06, 'border_count': 35, 'bagging_temperature': 0.7821073651190099, 'random_strength': 0.028074718921222652, 'grow_policy': 'SymmetricTree', 'min_data_in_leaf': 116}. Best is trial 374 with value: 6012.54835621459.[0m
[32m[I 2024-10-13 06:11:58,363][0m Trial 834 finished with value: 8661.484410733057 and parameters: {'depth': 5, 'learning_rate': 0.19020566571783076, 'iterations': 264, 'l2_leaf_reg': 6.824632357570212e-05, 'border_count': 46, 'bagging_temperature': 0.8996174321602524, 'random_strength': 0.015872561951681574, 'grow_policy': 'SymmetricTree', 'min_data_in_leaf': 320}. Best is trial 374 with value: 6012.54835621459.[0m
[32m[I 2024-10-13 06:11:59,156][0m Trial 835 finished with value: 8996.42322687246 and parameters: {'depth': 5, 'learning_rate': 0.22791985978478535, 'iterations': 182, 'l2_leaf_reg': 1.1654254708050994e-05, 'border_count': 29, 'bagging_temperature': 0.8507518475698846, 'random_strength': 0.5301137342231675, 'grow_policy': 'SymmetricTree', 'min_data_in_leaf': 44}. Best is trial 374 with value: 6012.54835621459.[0m
[32m[I 2024-10-13 06:12:00,058][0m Trial 836 finished with value: 6762.61520733505 and parameters: {'depth': 5, 'learning_rate': 0.14461747773550473, 'iterations': 309, 'l2_leaf_reg': 1.978936140719333e-05, 'border_count': 36, 'bagging_temperature': 0.8743714372092126, 'random_strength': 0.32919595119194267, 'grow_policy': 'SymmetricTree', 'min_data_in_leaf': 722}. Best is trial 374 with value: 6012.54835621459.[0m
[32m[I 2024-10-13 06:12:00,875][0m Trial 837 finished with value: 7077.796167399992 and parameters: {'depth': 5, 'learning_rate': 0.13460819518325554, 'iterations': 242, 'l2_leaf_reg': 1.1222877911214817e-05, 'border_count': 41, 'bagging_temperature': 0.8696357136358153, 'random_strength': 0.2812941401716832, 'grow_policy': 'SymmetricTree', 'min_data_in_leaf': 78}. Best is trial 374 with value: 6012.54835621459.[0m
[32m[I 2024-10-13 06:12:01,828][0m Trial 838 finished with value: 14277.536437458513 and parameters: {'depth': 6, 'learning_rate': 0.14202393664988885, 'iterations': 309, 'l2_leaf_reg': 1.6960300114834507e-05, 'border_count': 46, 'bagging_temperature': 0.8367284449124602, 'random_strength': 0.7778470629752767, 'grow_policy': 'SymmetricTree', 'min_data_in_leaf': 12}. Best is trial 374 with value: 6012.54835621459.[0m
[32m[I 2024-10-13 06:12:02,575][0m Trial 839 finished with value: 13536.25504493606 and parameters: {'depth': 4, 'learning_rate': 0.008524873526241993, 'iterations': 184, 'l2_leaf_reg': 6.671096716060358e-06, 'border_count': 38, 'bagging_temperature': 0.7315022479833924, 'random_strength': 0.17803348654254292, 'grow_policy': 'SymmetricTree', 'min_data_in_leaf': 159}. Best is trial 374 with value: 6012.54835621459.[0m
[32m[I 2024-10-13 06:12:03,403][0m Trial 840 finished with value: 7793.945671094006 and parameters: {'depth': 5, 'learning_rate': 0.15038859284277087, 'iterations': 238, 'l2_leaf_reg': 0.000908622417600572, 'border_count': 35, 'bagging_temperature': 0.857703213350893, 'random_strength': 0.575853844787868, 'grow_policy': 'SymmetricTree', 'min_data_in_leaf': 126}. Best is trial 374 with value: 6012.54835621459.[0m
[32m[I 2024-10-13 06:12:04,286][0m Trial 841 finished with value: 8510.562259157663 and parameters: {'depth': 5, 'learning_rate': 0.16984031042478676, 'iterations': 301, 'l2_leaf_reg': 1.0828203908255534e-05, 'border_count': 44, 'bagging_temperature': 0.8197316215283974, 'random_strength': 0.014506830467337695, 'grow_policy': 'SymmetricTree', 'min_data_in_leaf': 724}. Best is trial 374 with value: 6012.54835621459.[0m
[32m[I 2024-10-13 06:12:05,044][0m Trial 842 finished with value: 11099.648997468807 and parameters: {'depth': 5, 'learning_rate': 0.2979178851609782, 'iterations': 161, 'l2_leaf_reg': 1.6817133140133397e-05, 'border_count': 37, 'bagging_temperature': 0.7967775255472839, 'random_strength': 3.344638749080512, 'grow_policy': 'SymmetricTree', 'min_data_in_leaf': 730}. Best is trial 374 with value: 6012.54835621459.[0m
[32m[I 2024-10-13 06:12:05,913][0m Trial 843 finished with value: 12514.632419962918 and parameters: {'depth': 6, 'learning_rate': 0.1332244731772655, 'iterations': 229, 'l2_leaf_reg': 5.760407346686535e-06, 'border_count': 57, 'bagging_temperature': 0.8720439967008122, 'random_strength': 0.2854737073424828, 'grow_policy': 'SymmetricTree', 'min_data_in_leaf': 703}. Best is trial 374 with value: 6012.54835621459.[0m
[32m[I 2024-10-13 06:12:06,845][0m Trial 844 finished with value: 11093.685844543665 and parameters: {'depth': 5, 'learning_rate': 0.17210093167102775, 'iterations': 333, 'l2_leaf_reg': 8.651664284451421e-06, 'border_count': 51, 'bagging_temperature': 0.9118716550847573, 'random_strength': 0.48161731327479296, 'grow_policy': 'SymmetricTree', 'min_data_in_leaf': 91}. Best is trial 374 with value: 6012.54835621459.[0m
[32m[I 2024-10-13 06:12:07,662][0m Trial 845 finished with value: 6923.255865148637 and parameters: {'depth': 4, 'learning_rate': 0.2588542918571912, 'iterations': 269, 'l2_leaf_reg': 2.147034991650176e-05, 'border_count': 30, 'bagging_temperature': 0.7691277818898534, 'random_strength': 0.004823964926563062, 'grow_policy': 'SymmetricTree', 'min_data_in_leaf': 716}. Best is trial 374 with value: 6012.54835621459.[0m
[32m[I 2024-10-13 06:12:08,388][0m Trial 846 finished with value: 10163.222029323695 and parameters: {'depth': 5, 'learning_rate': 0.29924788994098894, 'iterations': 162, 'l2_leaf_reg': 1.4904251646721422e-05, 'border_count': 43, 'bagging_temperature': 0.8439343078129933, 'random_strength': 0.30236416645590936, 'grow_policy': 'SymmetricTree', 'min_data_in_leaf': 146}. Best is trial 374 with value: 6012.54835621459.[0m
[32m[I 2024-10-13 06:12:09,580][0m Trial 847 finished with value: 10952.401076467419 and parameters: {'depth': 7, 'learning_rate': 0.1993003869238673, 'iterations': 361, 'l2_leaf_reg': 7.356012654453337e-06, 'border_count': 33, 'bagging_temperature': 0.8762802593693195, 'random_strength': 0.9841432989245079, 'grow_policy': 'SymmetricTree', 'min_data_in_leaf': 237}. Best is trial 374 with value: 6012.54835621459.[0m
[32m[I 2024-10-13 06:12:10,279][0m Trial 848 finished with value: 10239.27474990508 and parameters: {'depth': 5, 'learning_rate': 0.15049257399201638, 'iterations': 212, 'l2_leaf_reg': 2.2980931535808123e-05, 'border_count': 27, 'bagging_temperature': 0.893589498465379, 'random_strength': 0.6879412617598575, 'grow_policy': 'Lossguide', 'min_data_in_leaf': 736, 'max_leaves': 42}. Best is trial 374 with value: 6012.54835621459.[0m
[32m[I 2024-10-13 06:12:11,116][0m Trial 849 finished with value: 8804.530756775208 and parameters: {'depth': 4, 'learning_rate': 0.23663681583359195, 'iterations': 283, 'l2_leaf_reg': 1.0658752490793267e-05, 'border_count': 37, 'bagging_temperature': 0.9069928476459317, 'random_strength': 0.4599492303938184, 'grow_policy': 'SymmetricTree', 'min_data_in_leaf': 721}. Best is trial 374 with value: 6012.54835621459.[0m
[32m[I 2024-10-13 06:12:11,843][0m Trial 850 finished with value: 7524.729166005756 and parameters: {'depth': 5, 'learning_rate': 0.18087209665373577, 'iterations': 158, 'l2_leaf_reg': 1.5160238043266878e-05, 'border_count': 27, 'bagging_temperature': 0.8611573735713195, 'random_strength': 0.22869541766692086, 'grow_policy': 'SymmetricTree', 'min_data_in_leaf': 341}. Best is trial 374 with value: 6012.54835621459.[0m
[32m[I 2024-10-13 06:12:12,659][0m Trial 851 finished with value: 8252.557846998367 and parameters: {'depth': 5, 'learning_rate': 0.21236700159040192, 'iterations': 227, 'l2_leaf_reg': 5.966414187534039e-06, 'border_count': 34, 'bagging_temperature': 0.5802368765854133, 'random_strength': 0.6883862922952184, 'grow_policy': 'SymmetricTree', 'min_data_in_leaf': 697}. Best is trial 374 with value: 6012.54835621459.[0m
[32m[I 2024-10-13 06:12:13,690][0m Trial 852 finished with value: 11127.639040281723 and parameters: {'depth': 6, 'learning_rate': 0.13724884683572872, 'iterations': 285, 'l2_leaf_reg': 2.9455253199055836e-05, 'border_count': 40, 'bagging_temperature': 0.8863401404896902, 'random_strength': 0.19455636605216087, 'grow_policy': 'Depthwise', 'min_data_in_leaf': 35}. Best is trial 374 with value: 6012.54835621459.[0m
[32m[I 2024-10-13 06:12:38,730][0m Trial 853 finished with value: 14374.177933835766 and parameters: {'depth': 15, 'learning_rate': 0.2350121731535022, 'iterations': 357, 'l2_leaf_reg': 1.0453332417502546e-05, 'border_count': 27, 'bagging_temperature': 0.9149732670112262, 'random_strength': 0.4362020410597276, 'grow_policy': 'SymmetricTree', 'min_data_in_leaf': 26}. Best is trial 374 with value: 6012.54835621459.[0m
[32m[I 2024-10-13 06:12:42,704][0m Trial 854 finished with value: 12378.689513089004 and parameters: {'depth': 5, 'learning_rate': 0.17778918618748726, 'iterations': 896, 'l2_leaf_reg': 1.8695542664576256e-05, 'border_count': 48, 'bagging_temperature': 0.8015971680182393, 'random_strength': 0.5766228597308651, 'grow_policy': 'SymmetricTree', 'min_data_in_leaf': 750}. Best is trial 374 with value: 6012.54835621459.[0m
[32m[I 2024-10-13 06:12:43,512][0m Trial 855 finished with value: 7749.159865691608 and parameters: {'depth': 5, 'learning_rate': 0.25755190710037534, 'iterations': 197, 'l2_leaf_reg': 0.0005919012790159719, 'border_count': 33, 'bagging_temperature': 0.8428613254488961, 'random_strength': 0.2933043235091295, 'grow_policy': 'SymmetricTree', 'min_data_in_leaf': 138}. Best is trial 374 with value: 6012.54835621459.[0m
[32m[I 2024-10-13 06:12:44,220][0m Trial 856 finished with value: 11275.834586369794 and parameters: {'depth': 5, 'learning_rate': 0.21112905042912564, 'iterations': 148, 'l2_leaf_reg': 8.077942869516667e-06, 'border_count': 79, 'bagging_temperature': 0.8780814582297463, 'random_strength': 0.9417319993687037, 'grow_policy': 'SymmetricTree', 'min_data_in_leaf': 707}. Best is trial 374 with value: 6012.54835621459.[0m
[32m[I 2024-10-13 06:12:45,039][0m Trial 857 finished with value: 7052.812875453683 and parameters: {'depth': 5, 'learning_rate': 0.15508031975094594, 'iterations': 256, 'l2_leaf_reg': 1.2573236197947136e-05, 'border_count': 40, 'bagging_temperature': 0.9501562241934696, 'random_strength': 0.19124801322409252, 'grow_policy': 'SymmetricTree', 'min_data_in_leaf': 187}. Best is trial 374 with value: 6012.54835621459.[0m
[32m[I 2024-10-13 06:12:45,914][0m Trial 858 finished with value: 9463.58783672325 and parameters: {'depth': 4, 'learning_rate': 0.1850663891099343, 'iterations': 326, 'l2_leaf_reg': 2.4026011549381985e-05, 'border_count': 26, 'bagging_temperature': 0.9193498028163124, 'random_strength': 0.4004326680710767, 'grow_policy': 'SymmetricTree', 'min_data_in_leaf': 737}. Best is trial 374 with value: 6012.54835621459.[0m
[32m[I 2024-10-13 06:12:46,944][0m Trial 859 finished with value: 9906.280648722148 and parameters: {'depth': 5, 'learning_rate': 0.2984290631574596, 'iterations': 409, 'l2_leaf_reg': 5.483475972246059e-06, 'border_count': 30, 'bagging_temperature': 0.6437753213730861, 'random_strength': 0.7783118985302759, 'grow_policy': 'SymmetricTree', 'min_data_in_leaf': 700}. Best is trial 374 with value: 6012.54835621459.[0m
[32m[I 2024-10-13 06:12:47,743][0m Trial 860 finished with value: 10400.025375356097 and parameters: {'depth': 6, 'learning_rate': 0.22866587397675844, 'iterations': 198, 'l2_leaf_reg': 1.6507509043235755e-05, 'border_count': 36, 'bagging_temperature': 0.8932288427398882, 'random_strength': 0.5498548520844941, 'grow_policy': 'SymmetricTree', 'min_data_in_leaf': 716}. Best is trial 374 with value: 6012.54835621459.[0m
[32m[I 2024-10-13 06:12:48,611][0m Trial 861 finished with value: 9713.759172709002 and parameters: {'depth': 5, 'learning_rate': 0.16296547770703637, 'iterations': 285, 'l2_leaf_reg': 3.878895911811526e-05, 'border_count': 44, 'bagging_temperature': 0.824187057423581, 'random_strength': 0.016281694519502843, 'grow_policy': 'SymmetricTree', 'min_data_in_leaf': 760}. Best is trial 374 with value: 6012.54835621459.[0m
[32m[I 2024-10-13 06:12:49,326][0m Trial 862 finished with value: 6544.448245277102 and parameters: {'depth': 5, 'learning_rate': 0.2508675303945069, 'iterations': 148, 'l2_leaf_reg': 8.72392752440472e-06, 'border_count': 25, 'bagging_temperature': 0.8696219875994544, 'random_strength': 0.3200891630733753, 'grow_policy': 'SymmetricTree', 'min_data_in_leaf': 691}. Best is trial 374 with value: 6012.54835621459.[0m
[32m[I 2024-10-13 06:12:50,017][0m Trial 863 finished with value: 9593.930940152342 and parameters: {'depth': 5, 'learning_rate': 0.2625725550888805, 'iterations': 100, 'l2_leaf_reg': 2.6463356012552182e-05, 'border_count': 22, 'bagging_temperature': 0.8487670818124211, 'random_strength': 0.6761246625134625, 'grow_policy': 'SymmetricTree', 'min_data_in_leaf': 689}. Best is trial 374 with value: 6012.54835621459.[0m
[32m[I 2024-10-13 06:12:50,726][0m Trial 864 finished with value: 16565.235796104393 and parameters: {'depth': 5, 'learning_rate': 0.005153523405356759, 'iterations': 143, 'l2_leaf_reg': 1.0583693602822838e-05, 'border_count': 23, 'bagging_temperature': 0.7000204969873098, 'random_strength': 0.42726712278062295, 'grow_policy': 'SymmetricTree', 'min_data_in_leaf': 688}. Best is trial 374 with value: 6012.54835621459.[0m
[32m[I 2024-10-13 06:12:51,410][0m Trial 865 finished with value: 13007.26990785664 and parameters: {'depth': 4, 'learning_rate': 0.29809474191245794, 'iterations': 144, 'l2_leaf_reg': 1.6218801942249317e-05, 'border_count': 68, 'bagging_temperature': 0.6716449830562139, 'random_strength': 5.829793840863481, 'grow_policy': 'SymmetricTree', 'min_data_in_leaf': 709}. Best is trial 374 with value: 6012.54835621459.[0m
[32m[I 2024-10-13 06:12:52,069][0m Trial 866 finished with value: 7725.976560482123 and parameters: {'depth': 5, 'learning_rate': 0.25411652333592843, 'iterations': 102, 'l2_leaf_reg': 3.198363640839008e-05, 'border_count': 20, 'bagging_temperature': 0.8674238275170593, 'random_strength': 0.3178592136999592, 'grow_policy': 'SymmetricTree', 'min_data_in_leaf': 694}. Best is trial 374 with value: 6012.54835621459.[0m
[32m[I 2024-10-13 06:12:53,730][0m Trial 867 finished with value: 14741.731730832571 and parameters: {'depth': 11, 'learning_rate': 0.2332758117545756, 'iterations': 181, 'l2_leaf_reg': 0.0003554536436536223, 'border_count': 140, 'bagging_temperature': 0.8403800858045987, 'random_strength': 0.6055571580170308, 'grow_policy': 'SymmetricTree', 'min_data_in_leaf': 672}. Best is trial 374 with value: 6012.54835621459.[0m
[32m[I 2024-10-13 06:13:01,610][0m Trial 868 finished with value: 12067.38368720131 and parameters: {'depth': 6, 'learning_rate': 0.21026229277762304, 'iterations': 1623, 'l2_leaf_reg': 1.0290869981158855e-05, 'border_count': 230, 'bagging_temperature': 0.8145323824204092, 'random_strength': 0.8815132341027949, 'grow_policy': 'SymmetricTree', 'min_data_in_leaf': 714}. Best is trial 374 with value: 6012.54835621459.[0m
[32m[I 2024-10-13 06:13:02,287][0m Trial 869 finished with value: 10865.742420417835 and parameters: {'depth': 5, 'learning_rate': 0.2614916051825463, 'iterations': 152, 'l2_leaf_reg': 2.2641641151743363e-05, 'border_count': 24, 'bagging_temperature': 0.8555810280955423, 'random_strength': 0.17877873849578385, 'grow_policy': 'Lossguide', 'min_data_in_leaf': 680, 'max_leaves': 239}. Best is trial 374 with value: 6012.54835621459.[0m
[32m[I 2024-10-13 06:13:03,110][0m Trial 870 finished with value: 8723.354946347506 and parameters: {'depth': 5, 'learning_rate': 0.26001464056049145, 'iterations': 208, 'l2_leaf_reg': 1.3178232522656164e-05, 'border_count': 28, 'bagging_temperature': 0.8650115948405557, 'random_strength': 0.49811646708772966, 'grow_policy': 'SymmetricTree', 'min_data_in_leaf': 63}. Best is trial 374 with value: 6012.54835621459.[0m
[32m[I 2024-10-13 06:13:03,883][0m Trial 871 finished with value: 12402.947127360962 and parameters: {'depth': 4, 'learning_rate': 0.208789128236774, 'iterations': 198, 'l2_leaf_reg': 0.0032238880684652004, 'border_count': 106, 'bagging_temperature': 0.8319869248095102, 'random_strength': 0.34407555819245833, 'grow_policy': 'SymmetricTree', 'min_data_in_leaf': 727}. Best is trial 374 with value: 6012.54835621459.[0m
[32m[I 2024-10-13 06:13:04,683][0m Trial 872 finished with value: 8861.558302935608 and parameters: {'depth': 5, 'learning_rate': 0.17995853238871637, 'iterations': 239, 'l2_leaf_reg': 5.183683066235422e-06, 'border_count': 17, 'bagging_temperature': 0.8776443223797573, 'random_strength': 4.425997980897689, 'grow_policy': 'SymmetricTree', 'min_data_in_leaf': 692}. Best is trial 374 with value: 6012.54835621459.[0m
[32m[I 2024-10-13 06:13:05,426][0m Trial 873 finished with value: 13388.574029441836 and parameters: {'depth': 6, 'learning_rate': 0.2990743436186333, 'iterations': 148, 'l2_leaf_reg': 0.0002161381057694526, 'border_count': 25, 'bagging_temperature': 0.7406914137181724, 'random_strength': 0.8233065947188849, 'grow_policy': 'SymmetricTree', 'min_data_in_leaf': 506}. Best is trial 374 with value: 6012.54835621459.[0m
