[32m[I 2024-10-13 05:08:46,773][0m Trial 51 finished with value: 10444.733368884461 and parameters: {'depth': 15, 'learning_rate': 0.11407982233758819, 'iterations': 889, 'l2_leaf_reg': 1.0363069633406939e-07, 'border_count': 132, 'bagging_temperature': 0.06518309413652146, 'random_strength': 1.289581537745728, 'grow_policy': 'SymmetricTree', 'min_data_in_leaf': 573}. Best is trial 51 with value: 10444.733368884461.[0m
[32m[I 2024-10-13 05:12:31,077][0m Trial 52 finished with value: 13990.40471376173 and parameters: {'depth': 15, 'learning_rate': 0.0762939189449897, 'iterations': 916, 'l2_leaf_reg': 5.403204257061743e-07, 'border_count': 131, 'bagging_temperature': 0.16443178305453948, 'random_strength': 1.3910327620320526, 'grow_policy': 'SymmetricTree', 'min_data_in_leaf': 530}. Best is trial 51 with value: 10444.733368884461.[0m
[32m[I 2024-10-13 05:15:49,794][0m Trial 53 finished with value: 14607.550297259651 and parameters: {'depth': 15, 'learning_rate': 0.21382955007947396, 'iterations': 1415, 'l2_leaf_reg': 7.712310907052726e-06, 'border_count': 90, 'bagging_temperature': 0.08381603853827563, 'random_strength': 1.22599503865357, 'grow_policy': 'SymmetricTree', 'min_data_in_leaf': 561}. Best is trial 51 with value: 10444.733368884461.[0m
[32m[I 2024-10-13 05:18:49,891][0m Trial 54 finished with value: 11260.59992706129 and parameters: {'depth': 14, 'learning_rate': 0.13062331803690483, 'iterations': 745, 'l2_leaf_reg': 1.8201484834424732e-06, 'border_count': 156, 'bagging_temperature': 0.23369362207867878, 'random_strength': 0.7325334454658594, 'grow_policy': 'SymmetricTree', 'min_data_in_leaf': 683}. Best is trial 51 with value: 10444.733368884461.[0m
[32m[I 2024-10-13 05:20:57,546][0m Trial 55 finished with value: 12662.05912037497 and parameters: {'depth': 14, 'learning_rate': 0.10826527941391731, 'iterations': 732, 'l2_leaf_reg': 1.4404493588848694e-06, 'border_count': 159, 'bagging_temperature': 0.2238928069882819, 'random_strength': 0.6261448002101718, 'grow_policy': 'SymmetricTree', 'min_data_in_leaf': 698}. Best is trial 51 with value: 10444.733368884461.[0m
[32m[I 2024-10-13 05:22:12,785][0m Trial 56 finished with value: 13883.506743808115 and parameters: {'depth': 13, 'learning_rate': 0.29835577939323926, 'iterations': 618, 'l2_leaf_reg': 3.086448639684641e-08, 'border_count': 168, 'bagging_temperature': 0.28805795012530055, 'random_strength': 2.1209078471838922, 'grow_policy': 'SymmetricTree', 'min_data_in_leaf': 623}. Best is trial 51 with value: 10444.733368884461.[0m
[32m[I 2024-10-13 05:22:41,122][0m Trial 57 finished with value: 17564.795705211647 and parameters: {'depth': 15, 'learning_rate': 0.06557059526534867, 'iterations': 401, 'l2_leaf_reg': 0.0002907989202887337, 'border_count': 153, 'bagging_temperature': 0.129809247301056, 'random_strength': 2.85493123018421, 'grow_policy': 'SymmetricTree', 'min_data_in_leaf': 682}. Best is trial 51 with value: 10444.733368884461.[0m
[32m[I 2024-10-13 05:26:26,352][0m Trial 58 finished with value: 13192.598445216501 and parameters: {'depth': 14, 'learning_rate': 0.04353678354999243, 'iterations': 1290, 'l2_leaf_reg': 1.0073958385696656e-08, 'border_count': 142, 'bagging_temperature': 0.054583784617551034, 'random_strength': 1.8241619446834716, 'grow_policy': 'SymmetricTree', 'min_data_in_leaf': 495}. Best is trial 51 with value: 10444.733368884461.[0m
[32m[I 2024-10-13 05:26:29,150][0m Trial 59 finished with value: 18938.710515577775 and parameters: {'depth': 13, 'learning_rate': 0.16458667670855084, 'iterations': 132, 'l2_leaf_reg': 1.8426030216292263e-07, 'border_count': 124, 'bagging_temperature': 0.17231567615626214, 'random_strength': 9.996538301849121, 'grow_policy': 'SymmetricTree', 'min_data_in_leaf': 451}. Best is trial 51 with value: 10444.733368884461.[0m
[32m[I 2024-10-13 05:28:07,643][0m Trial 60 finished with value: 14816.290800427718 and parameters: {'depth': 12, 'learning_rate': 0.12341649425172617, 'iterations': 1177, 'l2_leaf_reg': 1.976625770955038e-05, 'border_count': 167, 'bagging_temperature': 0.33995665469225994, 'random_strength': 8.935092603002115, 'grow_policy': 'SymmetricTree', 'min_data_in_leaf': 568}. Best is trial 51 with value: 10444.733368884461.[0m
[32m[I 2024-10-13 05:30:14,807][0m Trial 61 finished with value: 13706.684257382494 and parameters: {'depth': 14, 'learning_rate': 0.09885090075033597, 'iterations': 930, 'l2_leaf_reg': 3.096307566615878e-06, 'border_count': 218, 'bagging_temperature': 0.20140678938187812, 'random_strength': 0.4544070572426002, 'grow_policy': 'SymmetricTree', 'min_data_in_leaf': 633}. Best is trial 51 with value: 10444.733368884461.[0m
[32m[I 2024-10-13 05:30:32,382][0m Trial 62 finished with value: 12539.277718186368 and parameters: {'depth': 9, 'learning_rate': 0.022622098025995265, 'iterations': 1099, 'l2_leaf_reg': 8.623229506618938e-07, 'border_count': 114, 'bagging_temperature': 0.24036691305340324, 'random_strength': 0.043716701383646805, 'grow_policy': 'SymmetricTree', 'min_data_in_leaf': 59}. Best is trial 51 with value: 10444.733368884461.[0m
[32m[I 2024-10-13 05:37:08,718][0m Trial 63 finished with value: 14727.679526343234 and parameters: {'depth': 15, 'learning_rate': 0.23627412509726747, 'iterations': 819, 'l2_leaf_reg': 3.914117370354147e-07, 'border_count': 175, 'bagging_temperature': 0.44023323303484435, 'random_strength': 1.233258817858577, 'grow_policy': 'SymmetricTree', 'min_data_in_leaf': 505}. Best is trial 51 with value: 10444.733368884461.[0m
[32m[I 2024-10-13 05:38:09,501][0m Trial 64 finished with value: 12156.068075227819 and parameters: {'depth': 14, 'learning_rate': 0.06396880024618282, 'iterations': 577, 'l2_leaf_reg': 7.745115180687455e-06, 'border_count': 139, 'bagging_temperature': 0.07892541897666924, 'random_strength': 0.7945772687781216, 'grow_policy': 'SymmetricTree', 'min_data_in_leaf': 298}. Best is trial 51 with value: 10444.733368884461.[0m
[32m[I 2024-10-13 05:38:10,869][0m Trial 65 finished with value: 15765.504058096441 and parameters: {'depth': 13, 'learning_rate': 0.16908617566642373, 'iterations': 953, 'l2_leaf_reg': 1.0550455998127358e-07, 'border_count': 200, 'bagging_temperature': 0.12324579622183639, 'random_strength': 2.6973923911536852, 'grow_policy': 'Depthwise', 'min_data_in_leaf': 609}. Best is trial 51 with value: 10444.733368884461.[0m
[32m[I 2024-10-13 05:38:12,362][0m Trial 66 finished with value: 15859.767776680827 and parameters: {'depth': 15, 'learning_rate': 0.05240954904523779, 'iterations': 1419, 'l2_leaf_reg': 9.227466278260073e-05, 'border_count': 235, 'bagging_temperature': 0.17673470800360672, 'random_strength': 1.4540140414951623, 'grow_policy': 'Lossguide', 'min_data_in_leaf': 391, 'max_leaves': 119}. Best is trial 51 with value: 10444.733368884461.[0m
[32m[I 2024-10-13 05:38:30,874][0m Trial 67 finished with value: 12413.827352755077 and parameters: {'depth': 10, 'learning_rate': 0.033527850369529995, 'iterations': 1061, 'l2_leaf_reg': 0.0024282528811287703, 'border_count': 56, 'bagging_temperature': 0.2807347743469522, 'random_strength': 1.8106084956364041, 'grow_policy': 'SymmetricTree', 'min_data_in_leaf': 670}. Best is trial 51 with value: 10444.733368884461.[0m
[32m[I 2024-10-13 05:39:28,862][0m Trial 68 finished with value: 11929.706188252265 and parameters: {'depth': 11, 'learning_rate': 0.13234860885564392, 'iterations': 1673, 'l2_leaf_reg': 6.036370464661215e-08, 'border_count': 91, 'bagging_temperature': 0.3612744837015309, 'random_strength': 0.3586196944915453, 'grow_policy': 'SymmetricTree', 'min_data_in_leaf': 129}. Best is trial 51 with value: 10444.733368884461.[0m
[32m[I 2024-10-13 05:40:50,795][0m Trial 69 finished with value: 15604.221359242394 and parameters: {'depth': 11, 'learning_rate': 0.13350073855026595, 'iterations': 1655, 'l2_leaf_reg': 7.702308644672516e-08, 'border_count': 87, 'bagging_temperature': 0.3708580774871962, 'random_strength': 0.4735698588202799, 'grow_policy': 'SymmetricTree', 'min_data_in_leaf': 143}. Best is trial 51 with value: 10444.733368884461.[0m
[32m[I 2024-10-13 05:41:55,837][0m Trial 70 finished with value: 12462.152930464223 and parameters: {'depth': 12, 'learning_rate': 0.22293071707386536, 'iterations': 1712, 'l2_leaf_reg': 2.4857117252942074e-08, 'border_count': 82, 'bagging_temperature': 0.414624912838855, 'random_strength': 1.0208472843843863, 'grow_policy': 'SymmetricTree', 'min_data_in_leaf': 690}. Best is trial 51 with value: 10444.733368884461.[0m
[32m[I 2024-10-13 05:42:25,844][0m Trial 71 finished with value: 11769.847489772701 and parameters: {'depth': 11, 'learning_rate': 0.08556421096120843, 'iterations': 754, 'l2_leaf_reg': 1.9798731430993773e-07, 'border_count': 131, 'bagging_temperature': 0.9554203822718268, 'random_strength': 0.31519438106581865, 'grow_policy': 'SymmetricTree', 'min_data_in_leaf': 101}. Best is trial 51 with value: 10444.733368884461.[0m
[32m[I 2024-10-13 05:42:45,120][0m Trial 72 finished with value: 11586.343607022158 and parameters: {'depth': 10, 'learning_rate': 0.08164249868731845, 'iterations': 771, 'l2_leaf_reg': 1.981901970611309e-07, 'border_count': 127, 'bagging_temperature': 0.3142137121258385, 'random_strength': 0.3426932097960368, 'grow_policy': 'SymmetricTree', 'min_data_in_leaf': 66}. Best is trial 51 with value: 10444.733368884461.[0m
[32m[I 2024-10-13 05:42:48,598][0m Trial 73 finished with value: 14953.378493867434 and parameters: {'depth': 11, 'learning_rate': 0.07793864494513982, 'iterations': 490, 'l2_leaf_reg': 4.367336591433014e-08, 'border_count': 130, 'bagging_temperature': 0.4827622986664697, 'random_strength': 0.2822768191602929, 'grow_policy': 'SymmetricTree', 'min_data_in_leaf': 86}. Best is trial 51 with value: 10444.733368884461.[0m
[32m[I 2024-10-13 05:43:33,955][0m Trial 74 finished with value: 13725.722837804602 and parameters: {'depth': 12, 'learning_rate': 0.09228514050820953, 'iterations': 759, 'l2_leaf_reg': 1.4735696963176557e-07, 'border_count': 150, 'bagging_temperature': 0.3088244228166561, 'random_strength': 0.7900870168496954, 'grow_policy': 'SymmetricTree', 'min_data_in_leaf': 214}. Best is trial 51 with value: 10444.733368884461.[0m
[32m[I 2024-10-13 05:43:59,559][0m Trial 75 finished with value: 14128.95160845108 and parameters: {'depth': 8, 'learning_rate': 0.18337222047588136, 'iterations': 2980, 'l2_leaf_reg': 5.947354612424863e-08, 'border_count': 108, 'bagging_temperature': 0.37205760546455274, 'random_strength': 0.2706130421456838, 'grow_policy': 'SymmetricTree', 'min_data_in_leaf': 173}. Best is trial 51 with value: 10444.733368884461.[0m
[32m[I 2024-10-13 05:44:02,329][0m Trial 76 finished with value: 13570.821923062227 and parameters: {'depth': 11, 'learning_rate': 0.048166886530748916, 'iterations': 363, 'l2_leaf_reg': 2.3622975822791554e-07, 'border_count': 136, 'bagging_temperature': 0.32438222757481816, 'random_strength': 0.02732320581056591, 'grow_policy': 'SymmetricTree', 'min_data_in_leaf': 108}. Best is trial 51 with value: 10444.733368884461.[0m
[32m[I 2024-10-13 05:44:04,041][0m Trial 77 finished with value: 16092.900562234308 and parameters: {'depth': 9, 'learning_rate': 0.07081118588635403, 'iterations': 655, 'l2_leaf_reg': 9.492347036163601e-07, 'border_count': 123, 'bagging_temperature': 0.6560232901498799, 'random_strength': 0.5812389290068898, 'grow_policy': 'Lossguide', 'min_data_in_leaf': 30, 'max_leaves': 33}. Best is trial 51 with value: 10444.733368884461.[0m
[32m[I 2024-10-13 05:44:16,262][0m Trial 78 finished with value: 13285.554395625053 and parameters: {'depth': 10, 'learning_rate': 0.11426015110024211, 'iterations': 537, 'l2_leaf_reg': 2.0892904308016166e-08, 'border_count': 96, 'bagging_temperature': 0.23882283204487298, 'random_strength': 1.1664740130458031, 'grow_policy': 'SymmetricTree', 'min_data_in_leaf': 39}. Best is trial 51 with value: 10444.733368884461.[0m
[32m[I 2024-10-13 05:44:17,078][0m Trial 79 finished with value: 12970.427859719253 and parameters: {'depth': 13, 'learning_rate': 0.25237543435099363, 'iterations': 264, 'l2_leaf_reg': 6.19768547301474e-07, 'border_count': 120, 'bagging_temperature': 0.43368693901669547, 'random_strength': 0.7433432494971366, 'grow_policy': 'Depthwise', 'min_data_in_leaf': 95}. Best is trial 51 with value: 10444.733368884461.[0m
[32m[I 2024-10-13 05:44:45,487][0m Trial 80 finished with value: 13287.537113241628 and parameters: {'depth': 11, 'learning_rate': 0.03864761796789239, 'iterations': 786, 'l2_leaf_reg': 2.2189829016177953e-06, 'border_count': 149, 'bagging_temperature': 0.2727302778332279, 'random_strength': 1.9094645457346469, 'grow_policy': 'SymmetricTree', 'min_data_in_leaf': 111}. Best is trial 51 with value: 10444.733368884461.[0m
[32m[I 2024-10-13 05:45:16,541][0m Trial 81 finished with value: 12067.477031272409 and parameters: {'depth': 10, 'learning_rate': 0.1420392968022695, 'iterations': 1320, 'l2_leaf_reg': 1.7798058441547637e-07, 'border_count': 133, 'bagging_temperature': 0.19401990235875408, 'random_strength': 1.5368682497807753, 'grow_policy': 'SymmetricTree', 'min_data_in_leaf': 761}. Best is trial 51 with value: 10444.733368884461.[0m
[32m[I 2024-10-13 05:45:30,144][0m Trial 82 finished with value: 14981.569771782271 and parameters: {'depth': 10, 'learning_rate': 0.10034429206781183, 'iterations': 1126, 'l2_leaf_reg': 3.6134266340766886e-07, 'border_count': 80, 'bagging_temperature': 0.05049640727942156, 'random_strength': 0.30091692404898607, 'grow_policy': 'SymmetricTree', 'min_data_in_leaf': 572}. Best is trial 51 with value: 10444.733368884461.[0m
[32m[I 2024-10-13 05:45:58,397][0m Trial 83 finished with value: 13671.602050472511 and parameters: {'depth': 10, 'learning_rate': 0.1697743504773537, 'iterations': 1009, 'l2_leaf_reg': 9.081349169965512e-08, 'border_count': 115, 'bagging_temperature': 0.1458041455162213, 'random_strength': 8.855560840832906, 'grow_policy': 'SymmetricTree', 'min_data_in_leaf': 652}. Best is trial 51 with value: 10444.733368884461.[0m
[32m[I 2024-10-13 05:47:03,078][0m Trial 84 finished with value: 14583.897988940333 and parameters: {'depth': 11, 'learning_rate': 0.12755421973492492, 'iterations': 1476, 'l2_leaf_reg': 4.245671992808605e-07, 'border_count': 156, 'bagging_temperature': 0.39630283676731815, 'random_strength': 6.3055143198328, 'grow_policy': 'SymmetricTree', 'min_data_in_leaf': 529}. Best is trial 51 with value: 10444.733368884461.[0m
[32m[I 2024-10-13 05:47:27,676][0m Trial 85 finished with value: 14136.782684620814 and parameters: {'depth': 9, 'learning_rate': 0.05684169947546509, 'iterations': 1620, 'l2_leaf_reg': 2.511605166410756e-07, 'border_count': 142, 'bagging_temperature': 0.09948222858134165, 'random_strength': 3.5046703001997432, 'grow_policy': 'SymmetricTree', 'min_data_in_leaf': 131}. Best is trial 51 with value: 10444.733368884461.[0m
[32m[I 2024-10-13 05:48:26,806][0m Trial 86 finished with value: 21235.579805608566 and parameters: {'depth': 14, 'learning_rate': 0.00043816950521912806, 'iterations': 696, 'l2_leaf_reg': 4.543837104417152e-06, 'border_count': 105, 'bagging_temperature': 0.5760700149068647, 'random_strength': 4.49152265314523, 'grow_policy': 'SymmetricTree', 'min_data_in_leaf': 53}. Best is trial 51 with value: 10444.733368884461.[0m
[32m[I 2024-10-13 05:49:40,134][0m Trial 87 finished with value: 14591.079639972808 and parameters: {'depth': 11, 'learning_rate': 0.08031617895019921, 'iterations': 1841, 'l2_leaf_reg': 0.03857940239527041, 'border_count': 95, 'bagging_temperature': 0.345484680059211, 'random_strength': 0.9401592816588077, 'grow_policy': 'SymmetricTree', 'min_data_in_leaf': 6}. Best is trial 51 with value: 10444.733368884461.[0m
[32m[I 2024-10-13 05:54:03,155][0m Trial 88 finished with value: 12451.647257405095 and parameters: {'depth': 15, 'learning_rate': 0.14158088836880048, 'iterations': 872, 'l2_leaf_reg': 4.400786657476341e-08, 'border_count': 64, 'bagging_temperature': 0.9461142759664484, 'random_strength': 2.435389382427654, 'grow_policy': 'SymmetricTree', 'min_data_in_leaf': 472}. Best is trial 51 with value: 10444.733368884461.[0m
[32m[I 2024-10-13 05:54:18,452][0m Trial 89 finished with value: 14380.390859295643 and parameters: {'depth': 9, 'learning_rate': 0.004414424327804741, 'iterations': 982, 'l2_leaf_reg': 1.3228877165670237e-06, 'border_count': 127, 'bagging_temperature': 0.7705193329449164, 'random_strength': 9.351204736319623, 'grow_policy': 'SymmetricTree', 'min_data_in_leaf': 175}. Best is trial 51 with value: 10444.733368884461.[0m
[32m[I 2024-10-13 05:54:19,873][0m Trial 90 finished with value: 18258.51824011721 and parameters: {'depth': 13, 'learning_rate': 0.0014306098847966457, 'iterations': 1195, 'l2_leaf_reg': 1.4540399043250908e-08, 'border_count': 146, 'bagging_temperature': 0.20955096267984888, 'random_strength': 1.3248682507833924, 'grow_policy': 'Lossguide', 'min_data_in_leaf': 704, 'max_leaves': 114}. Best is trial 51 with value: 10444.733368884461.[0m
[32m[I 2024-10-13 05:54:40,780][0m Trial 91 finished with value: 10912.420388009243 and parameters: {'depth': 10, 'learning_rate': 0.09797320417074507, 'iterations': 880, 'l2_leaf_reg': 1.3236779866915584e-07, 'border_count': 31, 'bagging_temperature': 0.9876437534119082, 'random_strength': 1.022836118977584, 'grow_policy': 'SymmetricTree', 'min_data_in_leaf': 420}. Best is trial 51 with value: 10444.733368884461.[0m
[32m[I 2024-10-13 05:54:58,665][0m Trial 92 finished with value: 9280.71396120231 and parameters: {'depth': 10, 'learning_rate': 0.102236013500765, 'iterations': 760, 'l2_leaf_reg': 1.4029722083277114e-07, 'border_count': 31, 'bagging_temperature': 0.951848298389131, 'random_strength': 0.6246530129116247, 'grow_policy': 'SymmetricTree', 'min_data_in_leaf': 552}. Best is trial 92 with value: 9280.71396120231.[0m
[32m[I 2024-10-13 05:55:08,941][0m Trial 93 finished with value: 10784.429975276065 and parameters: {'depth': 10, 'learning_rate': 0.09637796341086671, 'iterations': 748, 'l2_leaf_reg': 1.178270813144067e-07, 'border_count': 16, 'bagging_temperature': 0.9392145676945998, 'random_strength': 0.5228412825708344, 'grow_policy': 'SymmetricTree', 'min_data_in_leaf': 436}. Best is trial 92 with value: 9280.71396120231.[0m
[32m[I 2024-10-13 05:55:11,774][0m Trial 94 finished with value: 14124.333256244061 and parameters: {'depth': 10, 'learning_rate': 0.06079462194258468, 'iterations': 767, 'l2_leaf_reg': 1.4146544530521663e-07, 'border_count': 2, 'bagging_temperature': 0.998054662383053, 'random_strength': 0.641113140274726, 'grow_policy': 'SymmetricTree', 'min_data_in_leaf': 424}. Best is trial 92 with value: 9280.71396120231.[0m
[32m[I 2024-10-13 05:55:24,562][0m Trial 95 finished with value: 10297.51363381347 and parameters: {'depth': 10, 'learning_rate': 0.09980020121568199, 'iterations': 635, 'l2_leaf_reg': 5.539271029563841e-07, 'border_count': 25, 'bagging_temperature': 0.886819050156395, 'random_strength': 1.0725041750514763, 'grow_policy': 'SymmetricTree', 'min_data_in_leaf': 397}. Best is trial 92 with value: 9280.71396120231.[0m
[32m[I 2024-10-13 05:55:29,839][0m Trial 96 finished with value: 11727.18342923502 and parameters: {'depth': 8, 'learning_rate': 0.0840054255514823, 'iterations': 653, 'l2_leaf_reg': 6.716198394902411e-07, 'border_count': 28, 'bagging_temperature': 0.8948208153679218, 'random_strength': 1.0481172639766323, 'grow_policy': 'SymmetricTree', 'min_data_in_leaf': 358}. Best is trial 92 with value: 9280.71396120231.[0m
[32m[I 2024-10-13 05:55:36,029][0m Trial 97 finished with value: 11900.047438577718 and parameters: {'depth': 8, 'learning_rate': 0.10115436990789986, 'iterations': 622, 'l2_leaf_reg': 6.347581941597456e-07, 'border_count': 33, 'bagging_temperature': 0.8763565497048842, 'random_strength': 0.9431263802169723, 'grow_policy': 'SymmetricTree', 'min_data_in_leaf': 370}. Best is trial 92 with value: 9280.71396120231.[0m
[32m[I 2024-10-13 05:55:44,285][0m Trial 98 finished with value: 11275.992640361284 and parameters: {'depth': 9, 'learning_rate': 0.04375117033468951, 'iterations': 869, 'l2_leaf_reg': 1.0638060650209242e-07, 'border_count': 16, 'bagging_temperature': 0.9627296854502976, 'random_strength': 1.6432802744329735, 'grow_policy': 'SymmetricTree', 'min_data_in_leaf': 338}. Best is trial 92 with value: 9280.71396120231.[0m
[32m[I 2024-10-13 05:55:45,472][0m Trial 99 finished with value: 12872.828058733772 and parameters: {'depth': 8, 'learning_rate': 0.042207233236001014, 'iterations': 868, 'l2_leaf_reg': 1.2161148724920655e-07, 'border_count': 16, 'bagging_temperature': 0.9171135637385763, 'random_strength': 1.7159170981499345, 'grow_policy': 'Depthwise', 'min_data_in_leaf': 333}. Best is trial 92 with value: 9280.71396120231.[0m
[32m[I 2024-10-13 05:55:46,680][0m Trial 100 finished with value: 11066.366515427924 and parameters: {'depth': 7, 'learning_rate': 0.06884859685886698, 'iterations': 421, 'l2_leaf_reg': 3.6241768506926376e-08, 'border_count': 24, 'bagging_temperature': 0.8625484993572293, 'random_strength': 2.0231408180182657, 'grow_policy': 'SymmetricTree', 'min_data_in_leaf': 441}. Best is trial 92 with value: 9280.71396120231.[0m
[32m[I 2024-10-13 05:55:47,897][0m Trial 101 finished with value: 9652.422208513202 and parameters: {'depth': 7, 'learning_rate': 0.06824340989269637, 'iterations': 404, 'l2_leaf_reg': 7.906730940720377e-08, 'border_count': 28, 'bagging_temperature': 0.8575462573017217, 'random_strength': 2.0063775623849747, 'grow_policy': 'SymmetricTree', 'min_data_in_leaf': 441}. Best is trial 92 with value: 9280.71396120231.[0m
