[32m[I 2024-10-13 06:09:47,297][0m Trial 720 finished with value: 9265.353367466503 and parameters: {'depth': 5, 'learning_rate': 0.206221406059208, 'iterations': 335, 'l2_leaf_reg': 3.887830828412263e-05, 'border_count': 16, 'bagging_temperature': 0.8822411354954486, 'random_strength': 0.2032137781802453, 'grow_policy': 'SymmetricTree', 'min_data_in_leaf': 927}. Best is trial 374 with value: 6012.54835621459.[0m
[32m[I 2024-10-13 06:09:48,419][0m Trial 721 finished with value: 9889.137906149519 and parameters: {'depth': 6, 'learning_rate': 0.1427074582146981, 'iterations': 428, 'l2_leaf_reg': 1.8967798965954987e-05, 'border_count': 27, 'bagging_temperature': 0.9067282349490557, 'random_strength': 0.6509088559390677, 'grow_policy': 'SymmetricTree', 'min_data_in_leaf': 169}. Best is trial 374 with value: 6012.54835621459.[0m
[32m[I 2024-10-13 06:09:49,331][0m Trial 722 finished with value: 7341.039599416325 and parameters: {'depth': 5, 'learning_rate': 0.23160975997624564, 'iterations': 283, 'l2_leaf_reg': 1.0667298483604591e-05, 'border_count': 20, 'bagging_temperature': 0.865851061767884, 'random_strength': 0.35224995924214275, 'grow_policy': 'SymmetricTree', 'min_data_in_leaf': 700}. Best is trial 374 with value: 6012.54835621459.[0m
[32m[I 2024-10-13 06:09:50,113][0m Trial 723 finished with value: 7965.546854088454 and parameters: {'depth': 5, 'learning_rate': 0.17502086420065455, 'iterations': 193, 'l2_leaf_reg': 5.73152499574471e-05, 'border_count': 10, 'bagging_temperature': 0.8381106471903109, 'random_strength': 0.8567877620432468, 'grow_policy': 'SymmetricTree', 'min_data_in_leaf': 899}. Best is trial 374 with value: 6012.54835621459.[0m
[32m[I 2024-10-13 06:09:51,092][0m Trial 724 finished with value: 8941.376183261964 and parameters: {'depth': 5, 'learning_rate': 0.20172286281705562, 'iterations': 377, 'l2_leaf_reg': 3.1333640626807664e-05, 'border_count': 22, 'bagging_temperature': 0.8053933463006306, 'random_strength': 0.15620058317397711, 'grow_policy': 'SymmetricTree', 'min_data_in_leaf': 643}. Best is trial 374 with value: 6012.54835621459.[0m
[32m[I 2024-10-13 06:09:51,941][0m Trial 725 finished with value: 9408.30732134265 and parameters: {'depth': 5, 'learning_rate': 0.2578064624575993, 'iterations': 273, 'l2_leaf_reg': 9.333667043591171e-06, 'border_count': 28, 'bagging_temperature': 0.8913425837946548, 'random_strength': 0.4823025007284812, 'grow_policy': 'SymmetricTree', 'min_data_in_leaf': 672}. Best is trial 374 with value: 6012.54835621459.[0m
[32m[I 2024-10-13 06:09:52,683][0m Trial 726 finished with value: 10297.476149288375 and parameters: {'depth': 6, 'learning_rate': 0.17281061291919675, 'iterations': 149, 'l2_leaf_reg': 1.4916954146310929e-05, 'border_count': 19, 'bagging_temperature': 0.7448211143093941, 'random_strength': 0.176168271406203, 'grow_policy': 'SymmetricTree', 'min_data_in_leaf': 701}. Best is trial 374 with value: 6012.54835621459.[0m
[32m[I 2024-10-13 06:09:55,322][0m Trial 727 finished with value: 17130.906737837468 and parameters: {'depth': 12, 'learning_rate': 0.010266009706794697, 'iterations': 227, 'l2_leaf_reg': 2.4910981294871096e-05, 'border_count': 6, 'bagging_temperature': 0.68812777699752, 'random_strength': 0.6640435654593031, 'grow_policy': 'SymmetricTree', 'min_data_in_leaf': 648}. Best is trial 374 with value: 6012.54835621459.[0m
[32m[I 2024-10-13 06:09:56,647][0m Trial 728 finished with value: 11168.360398646211 and parameters: {'depth': 9, 'learning_rate': 0.299127643981353, 'iterations': 300, 'l2_leaf_reg': 0.0001232240939790613, 'border_count': 30, 'bagging_temperature': 0.9140045183001628, 'random_strength': 0.32042482863173777, 'grow_policy': 'SymmetricTree', 'min_data_in_leaf': 594}. Best is trial 374 with value: 6012.54835621459.[0m
[32m[I 2024-10-13 06:09:57,586][0m Trial 729 finished with value: 9669.837644145658 and parameters: {'depth': 5, 'learning_rate': 0.21554042331283685, 'iterations': 358, 'l2_leaf_reg': 8.144262207094331e-06, 'border_count': 12, 'bagging_temperature': 0.8526731873853464, 'random_strength': 0.005760171383868723, 'grow_policy': 'SymmetricTree', 'min_data_in_leaf': 618}. Best is trial 374 with value: 6012.54835621459.[0m
[32m[I 2024-10-13 06:09:58,343][0m Trial 730 finished with value: 8652.084815759026 and parameters: {'depth': 5, 'learning_rate': 0.2397266723939112, 'iterations': 193, 'l2_leaf_reg': 8.38977814464259e-05, 'border_count': 27, 'bagging_temperature': 0.8737214213352422, 'random_strength': 0.48082311612512907, 'grow_policy': 'SymmetricTree', 'min_data_in_leaf': 913}. Best is trial 374 with value: 6012.54835621459.[0m
[32m[I 2024-10-13 06:09:59,952][0m Trial 731 finished with value: 13153.518201669016 and parameters: {'depth': 10, 'learning_rate': 0.1466893182191805, 'iterations': 274, 'l2_leaf_reg': 1.5589728590284705e-05, 'border_count': 89, 'bagging_temperature': 0.90920750430188, 'random_strength': 0.9211809895563661, 'grow_policy': 'SymmetricTree', 'min_data_in_leaf': 677}. Best is trial 374 with value: 6012.54835621459.[0m
[32m[I 2024-10-13 06:10:01,031][0m Trial 732 finished with value: 8606.421191020125 and parameters: {'depth': 5, 'learning_rate': 0.1933501362581714, 'iterations': 450, 'l2_leaf_reg': 3.495770462199489e-05, 'border_count': 18, 'bagging_temperature': 0.48435296872504213, 'random_strength': 0.32043181366375145, 'grow_policy': 'SymmetricTree', 'min_data_in_leaf': 714}. Best is trial 374 with value: 6012.54835621459.[0m
[32m[I 2024-10-13 06:10:01,786][0m Trial 733 finished with value: 10507.49048849129 and parameters: {'depth': 5, 'learning_rate': 0.1303143015343609, 'iterations': 237, 'l2_leaf_reg': 5.390002028534282e-05, 'border_count': 24, 'bagging_temperature': 0.826315735816283, 'random_strength': 0.5799051686051682, 'grow_policy': 'Lossguide', 'min_data_in_leaf': 660, 'max_leaves': 60}. Best is trial 374 with value: 6012.54835621459.[0m
[32m[I 2024-10-13 06:10:02,499][0m Trial 734 finished with value: 8659.865601473464 and parameters: {'depth': 5, 'learning_rate': 0.1640170384796757, 'iterations': 150, 'l2_leaf_reg': 1.218173927769274e-05, 'border_count': 32, 'bagging_temperature': 0.8925283777032664, 'random_strength': 0.789267193804565, 'grow_policy': 'SymmetricTree', 'min_data_in_leaf': 633}. Best is trial 374 with value: 6012.54835621459.[0m
[32m[I 2024-10-13 06:10:03,477][0m Trial 735 finished with value: 11645.561049520036 and parameters: {'depth': 6, 'learning_rate': 0.2962887967894633, 'iterations': 334, 'l2_leaf_reg': 0.012638517056076912, 'border_count': 16, 'bagging_temperature': 0.8681333365088263, 'random_strength': 0.2321328011999625, 'grow_policy': 'SymmetricTree', 'min_data_in_leaf': 690}. Best is trial 374 with value: 6012.54835621459.[0m
[32m[I 2024-10-13 06:10:04,247][0m Trial 736 finished with value: 18549.28522379416 and parameters: {'depth': 5, 'learning_rate': 0.22636555919499277, 'iterations': 207, 'l2_leaf_reg': 2.2690372712650993e-05, 'border_count': 1, 'bagging_temperature': 0.9123775261217024, 'random_strength': 0.4556652877802136, 'grow_policy': 'SymmetricTree', 'min_data_in_leaf': 660}. Best is trial 374 with value: 6012.54835621459.[0m
[32m[I 2024-10-13 06:10:04,947][0m Trial 737 finished with value: 7547.443254699389 and parameters: {'depth': 5, 'learning_rate': 0.19920991837406704, 'iterations': 102, 'l2_leaf_reg': 1.0644032005928334e-05, 'border_count': 24, 'bagging_temperature': 0.8492191191039402, 'random_strength': 0.0033773893451575776, 'grow_policy': 'SymmetricTree', 'min_data_in_leaf': 896}. Best is trial 374 with value: 6012.54835621459.[0m
[32m[I 2024-10-13 06:10:05,928][0m Trial 738 finished with value: 8198.769265423094 and parameters: {'depth': 5, 'learning_rate': 0.23425055721322047, 'iterations': 386, 'l2_leaf_reg': 7.242744399292117e-06, 'border_count': 30, 'bagging_temperature': 0.776513231116554, 'random_strength': 0.6762903883715122, 'grow_policy': 'SymmetricTree', 'min_data_in_leaf': 710}. Best is trial 374 with value: 6012.54835621459.[0m
[32m[I 2024-10-13 06:10:06,675][0m Trial 739 finished with value: 13285.207305287136 and parameters: {'depth': 4, 'learning_rate': 0.25227020539442496, 'iterations': 292, 'l2_leaf_reg': 2.5192080338011534e-05, 'border_count': 10, 'bagging_temperature': 0.8903315331153652, 'random_strength': 0.17244175500209105, 'grow_policy': 'Depthwise', 'min_data_in_leaf': 623}. Best is trial 374 with value: 6012.54835621459.[0m
[32m[I 2024-10-13 06:10:07,485][0m Trial 740 finished with value: 10781.723827183994 and parameters: {'depth': 5, 'learning_rate': 0.1649196589375596, 'iterations': 239, 'l2_leaf_reg': 0.0001725299449373791, 'border_count': 73, 'bagging_temperature': 0.8756125663045231, 'random_strength': 0.44184418278477733, 'grow_policy': 'SymmetricTree', 'min_data_in_leaf': 676}. Best is trial 374 with value: 6012.54835621459.[0m
[32m[I 2024-10-13 06:10:08,404][0m Trial 741 finished with value: 9735.675368119844 and parameters: {'depth': 5, 'learning_rate': 0.18799708250469685, 'iterations': 319, 'l2_leaf_reg': 4.233316339687286e-05, 'border_count': 217, 'bagging_temperature': 0.9011077601777776, 'random_strength': 0.32652416039149934, 'grow_policy': 'SymmetricTree', 'min_data_in_leaf': 953}. Best is trial 374 with value: 6012.54835621459.[0m
[32m[I 2024-10-13 06:10:09,195][0m Trial 742 finished with value: 21585.027375037804 and parameters: {'depth': 6, 'learning_rate': 0.0008401528768381775, 'iterations': 160, 'l2_leaf_reg': 1.7580910477208317e-05, 'border_count': 33, 'bagging_temperature': 0.8084050413647987, 'random_strength': 1.0077196509954562, 'grow_policy': 'SymmetricTree', 'min_data_in_leaf': 653}. Best is trial 374 with value: 6012.54835621459.[0m
[32m[I 2024-10-13 06:10:10,011][0m Trial 743 finished with value: 9106.52594531394 and parameters: {'depth': 5, 'learning_rate': 0.1432515911922739, 'iterations': 237, 'l2_leaf_reg': 9.04430469251442e-06, 'border_count': 20, 'bagging_temperature': 0.9215408143984289, 'random_strength': 0.5661650780813969, 'grow_policy': 'SymmetricTree', 'min_data_in_leaf': 699}. Best is trial 374 with value: 6012.54835621459.[0m
[32m[I 2024-10-13 06:10:10,971][0m Trial 744 finished with value: 7095.375740306715 and parameters: {'depth': 4, 'learning_rate': 0.2590219513924915, 'iterations': 393, 'l2_leaf_reg': 1.2644803805253289e-05, 'border_count': 26, 'bagging_temperature': 0.8394457040233085, 'random_strength': 0.003126839149962063, 'grow_policy': 'SymmetricTree', 'min_data_in_leaf': 73}. Best is trial 374 with value: 6012.54835621459.[0m
[32m[I 2024-10-13 06:10:11,739][0m Trial 745 finished with value: 15870.39922137359 and parameters: {'depth': 5, 'learning_rate': 0.29984507865081755, 'iterations': 188, 'l2_leaf_reg': 6.517619710587474e-05, 'border_count': 6, 'bagging_temperature': 0.8714779008851006, 'random_strength': 0.31356818335203507, 'grow_policy': 'SymmetricTree', 'min_data_in_leaf': 922}. Best is trial 374 with value: 6012.54835621459.[0m
[32m[I 2024-10-13 06:10:12,657][0m Trial 746 finished with value: 7396.591373024911 and parameters: {'depth': 5, 'learning_rate': 0.1998068280570993, 'iterations': 323, 'l2_leaf_reg': 0.0003319791751580846, 'border_count': 15, 'bagging_temperature': 0.89636165175444, 'random_strength': 0.8197449921799744, 'grow_policy': 'SymmetricTree', 'min_data_in_leaf': 599}. Best is trial 374 with value: 6012.54835621459.[0m
[32m[I 2024-10-13 06:10:13,777][0m Trial 747 finished with value: 8388.580372652252 and parameters: {'depth': 5, 'learning_rate': 0.21722351718131547, 'iterations': 483, 'l2_leaf_reg': 2.9478506161904804e-05, 'border_count': 34, 'bagging_temperature': 0.8514170478044055, 'random_strength': 0.18511859361355693, 'grow_policy': 'SymmetricTree', 'min_data_in_leaf': 578}. Best is trial 374 with value: 6012.54835621459.[0m
[32m[I 2024-10-13 06:10:23,183][0m Trial 748 finished with value: 8880.431104514086 and parameters: {'depth': 6, 'learning_rate': 0.17006538890939268, 'iterations': 1920, 'l2_leaf_reg': 8.212901227670613e-06, 'border_count': 29, 'bagging_temperature': 0.9205801626124128, 'random_strength': 0.5179507531321588, 'grow_policy': 'SymmetricTree', 'min_data_in_leaf': 678}. Best is trial 374 with value: 6012.54835621459.[0m
[32m[I 2024-10-13 06:10:23,924][0m Trial 749 finished with value: 9923.90490022699 and parameters: {'depth': 5, 'learning_rate': 0.12931636945641709, 'iterations': 155, 'l2_leaf_reg': 9.37293359440848e-05, 'border_count': 22, 'bagging_temperature': 0.8257604137168519, 'random_strength': 1.1940696028725908, 'grow_policy': 'SymmetricTree', 'min_data_in_leaf': 6}. Best is trial 374 with value: 6012.54835621459.[0m
[32m[I 2024-10-13 06:10:24,799][0m Trial 750 finished with value: 8754.746672333264 and parameters: {'depth': 5, 'learning_rate': 0.24936493275408886, 'iterations': 281, 'l2_leaf_reg': 1.4681108251549948e-05, 'border_count': 11, 'bagging_temperature': 0.22985570338704497, 'random_strength': 0.719444360961447, 'grow_policy': 'SymmetricTree', 'min_data_in_leaf': 637}. Best is trial 374 with value: 6012.54835621459.[0m
[32m[I 2024-10-13 06:10:25,635][0m Trial 751 finished with value: 6289.526540257662 and parameters: {'depth': 5, 'learning_rate': 0.19558067461857628, 'iterations': 234, 'l2_leaf_reg': 2.125349035941096e-05, 'border_count': 36, 'bagging_temperature': 0.8816111331641241, 'random_strength': 0.36625168740539993, 'grow_policy': 'SymmetricTree', 'min_data_in_leaf': 887}. Best is trial 374 with value: 6012.54835621459.[0m
[32m[I 2024-10-13 06:10:26,605][0m Trial 752 finished with value: 7306.2630729783505 and parameters: {'depth': 5, 'learning_rate': 0.19060801454733578, 'iterations': 345, 'l2_leaf_reg': 2.300409179901313e-05, 'border_count': 29, 'bagging_temperature': 0.8677556016415781, 'random_strength': 0.17268080912356282, 'grow_policy': 'SymmetricTree', 'min_data_in_leaf': 883}. Best is trial 374 with value: 6012.54835621459.[0m
[32m[I 2024-10-13 06:10:27,599][0m Trial 753 finished with value: 7106.184147246331 and parameters: {'depth': 4, 'learning_rate': 0.20404841530885917, 'iterations': 432, 'l2_leaf_reg': 5.119596717708128e-05, 'border_count': 34, 'bagging_temperature': 0.8885421515112553, 'random_strength': 0.3207462422757761, 'grow_policy': 'SymmetricTree', 'min_data_in_leaf': 858}. Best is trial 374 with value: 6012.54835621459.[0m
[32m[I 2024-10-13 06:10:28,438][0m Trial 754 finished with value: 11693.607120574037 and parameters: {'depth': 5, 'learning_rate': 0.22194490161351527, 'iterations': 253, 'l2_leaf_reg': 2.1328473636269653e-05, 'border_count': 164, 'bagging_temperature': 0.8587302077379383, 'random_strength': 0.43498266819525344, 'grow_policy': 'SymmetricTree', 'min_data_in_leaf': 881}. Best is trial 374 with value: 6012.54835621459.[0m
[32m[I 2024-10-13 06:10:29,210][0m Trial 755 finished with value: 22508.195481551087 and parameters: {'depth': 6, 'learning_rate': 0.0003960004569749351, 'iterations': 299, 'l2_leaf_reg': 3.752194154847798e-05, 'border_count': 24, 'bagging_temperature': 0.8754598254944971, 'random_strength': 0.15994426811235746, 'grow_policy': 'Lossguide', 'min_data_in_leaf': 897, 'max_leaves': 223}. Best is trial 374 with value: 6012.54835621459.[0m
[32m[I 2024-10-13 06:10:30,215][0m Trial 756 finished with value: 9061.471692289986 and parameters: {'depth': 5, 'learning_rate': 0.1664796720720145, 'iterations': 375, 'l2_leaf_reg': 1.9645047145182702e-05, 'border_count': 17, 'bagging_temperature': 0.5503320605580384, 'random_strength': 0.6099169706738742, 'grow_policy': 'SymmetricTree', 'min_data_in_leaf': 875}. Best is trial 374 with value: 6012.54835621459.[0m
[32m[I 2024-10-13 06:10:31,032][0m Trial 757 finished with value: 6454.07957687278 and parameters: {'depth': 5, 'learning_rate': 0.25965354548758324, 'iterations': 207, 'l2_leaf_reg': 1.3857402522883068e-05, 'border_count': 30, 'bagging_temperature': 0.8998628966949441, 'random_strength': 0.33492650403400603, 'grow_policy': 'SymmetricTree', 'min_data_in_leaf': 924}. Best is trial 374 with value: 6012.54835621459.[0m
[32m[I 2024-10-13 06:10:31,687][0m Trial 758 finished with value: 8798.62657142535 and parameters: {'depth': 5, 'learning_rate': 0.19898822652333076, 'iterations': 100, 'l2_leaf_reg': 1.7275077301888984e-05, 'border_count': 30, 'bagging_temperature': 0.19629859434612706, 'random_strength': 0.16043519302603965, 'grow_policy': 'SymmetricTree', 'min_data_in_leaf': 934}. Best is trial 374 with value: 6012.54835621459.[0m
[32m[I 2024-10-13 06:10:32,415][0m Trial 759 finished with value: 8285.876592502615 and parameters: {'depth': 4, 'learning_rate': 0.26205186991052287, 'iterations': 184, 'l2_leaf_reg': 1.247207814953166e-05, 'border_count': 36, 'bagging_temperature': 0.897499647927613, 'random_strength': 0.014620960451994042, 'grow_policy': 'SymmetricTree', 'min_data_in_leaf': 921}. Best is trial 374 with value: 6012.54835621459.[0m
[32m[I 2024-10-13 06:10:33,183][0m Trial 760 finished with value: 8603.980432874274 and parameters: {'depth': 5, 'learning_rate': 0.17429708123073337, 'iterations': 154, 'l2_leaf_reg': 2.908101861404387e-05, 'border_count': 36, 'bagging_temperature': 0.2571078433174151, 'random_strength': 0.32829424773525506, 'grow_policy': 'SymmetricTree', 'min_data_in_leaf': 956}. Best is trial 374 with value: 6012.54835621459.[0m
[32m[I 2024-10-13 06:10:34,010][0m Trial 761 finished with value: 6013.179658083622 and parameters: {'depth': 6, 'learning_rate': 0.2327878474535079, 'iterations': 212, 'l2_leaf_reg': 1.4586946858444104e-05, 'border_count': 29, 'bagging_temperature': 0.9050754173997414, 'random_strength': 0.3352179877254552, 'grow_policy': 'SymmetricTree', 'min_data_in_leaf': 919}. Best is trial 374 with value: 6012.54835621459.[0m
[32m[I 2024-10-13 06:10:34,798][0m Trial 762 finished with value: 7780.670077161734 and parameters: {'depth': 6, 'learning_rate': 0.2985980014982029, 'iterations': 193, 'l2_leaf_reg': 1.6827915231722003e-05, 'border_count': 29, 'bagging_temperature': 0.9141170056399317, 'random_strength': 0.00539346300469562, 'grow_policy': 'SymmetricTree', 'min_data_in_leaf': 953}. Best is trial 374 with value: 6012.54835621459.[0m
[32m[I 2024-10-13 06:10:35,466][0m Trial 763 finished with value: 10156.149879732455 and parameters: {'depth': 4, 'learning_rate': 0.2997867932320295, 'iterations': 144, 'l2_leaf_reg': 2.700504908755681e-05, 'border_count': 25, 'bagging_temperature': 0.9096281168651809, 'random_strength': 0.38924400027615813, 'grow_policy': 'Depthwise', 'min_data_in_leaf': 292}. Best is trial 374 with value: 6012.54835621459.[0m
[32m[I 2024-10-13 06:10:36,144][0m Trial 764 finished with value: 10350.569886926854 and parameters: {'depth': 6, 'learning_rate': 0.23284113823161626, 'iterations': 102, 'l2_leaf_reg': 1.47524677280338e-05, 'border_count': 26, 'bagging_temperature': 0.8954920181180634, 'random_strength': 0.1671822896796853, 'grow_policy': 'SymmetricTree', 'min_data_in_leaf': 924}. Best is trial 374 with value: 6012.54835621459.[0m
[32m[I 2024-10-13 06:10:36,906][0m Trial 765 finished with value: 10207.6485783616 and parameters: {'depth': 4, 'learning_rate': 0.23225460084750413, 'iterations': 209, 'l2_leaf_reg': 1.997666471266967e-05, 'border_count': 31, 'bagging_temperature': 0.9097706906591634, 'random_strength': 0.4728419400931754, 'grow_policy': 'SymmetricTree', 'min_data_in_leaf': 906}. Best is trial 374 with value: 6012.54835621459.[0m
[32m[I 2024-10-13 06:10:37,914][0m Trial 766 finished with value: 14507.965207681757 and parameters: {'depth': 8, 'learning_rate': 0.2548383518897355, 'iterations': 223, 'l2_leaf_reg': 1.1672535905685748e-05, 'border_count': 112, 'bagging_temperature': 0.8871187502379528, 'random_strength': 0.3189097012679988, 'grow_policy': 'SymmetricTree', 'min_data_in_leaf': 943}. Best is trial 374 with value: 6012.54835621459.[0m
[32m[I 2024-10-13 06:10:43,802][0m Trial 767 finished with value: 8972.946061293142 and parameters: {'depth': 6, 'learning_rate': 0.20668635579803155, 'iterations': 1175, 'l2_leaf_reg': 3.210798025070224e-05, 'border_count': 23, 'bagging_temperature': 0.9188256124776194, 'random_strength': 8.579445687771443, 'grow_policy': 'SymmetricTree', 'min_data_in_leaf': 922}. Best is trial 374 with value: 6012.54835621459.[0m
[32m[I 2024-10-13 06:10:44,527][0m Trial 768 finished with value: 8425.621429572162 and parameters: {'depth': 5, 'learning_rate': 0.22760900585062574, 'iterations': 147, 'l2_leaf_reg': 1.0768969492477832e-05, 'border_count': 32, 'bagging_temperature': 0.7169723059734038, 'random_strength': 0.5050113940406123, 'grow_policy': 'SymmetricTree', 'min_data_in_leaf': 940}. Best is trial 374 with value: 6012.54835621459.[0m
[32m[I 2024-10-13 06:10:45,365][0m Trial 769 finished with value: 8172.1533559194495 and parameters: {'depth': 5, 'learning_rate': 0.15713644455659426, 'iterations': 267, 'l2_leaf_reg': 1.8546123927481133e-05, 'border_count': 27, 'bagging_temperature': 0.8971750334466917, 'random_strength': 0.18104727326002265, 'grow_policy': 'SymmetricTree', 'min_data_in_leaf': 909}. Best is trial 374 with value: 6012.54835621459.[0m
[32m[I 2024-10-13 06:10:46,164][0m Trial 770 finished with value: 19857.74921560479 and parameters: {'depth': 5, 'learning_rate': 0.001550250405583799, 'iterations': 210, 'l2_leaf_reg': 3.810175895999384e-05, 'border_count': 22, 'bagging_temperature': 0.9222538549158235, 'random_strength': 0.34715819075404636, 'grow_policy': 'SymmetricTree', 'min_data_in_leaf': 909}. Best is trial 374 with value: 6012.54835621459.[0m
[32m[I 2024-10-13 06:10:46,967][0m Trial 771 finished with value: 15372.240200991608 and parameters: {'depth': 4, 'learning_rate': 0.0038036269504629935, 'iterations': 257, 'l2_leaf_reg': 8.853358831821195e-06, 'border_count': 33, 'bagging_temperature': 0.8832806543493092, 'random_strength': 0.006621735333987244, 'grow_policy': 'SymmetricTree', 'min_data_in_leaf': 930}. Best is trial 374 with value: 6012.54835621459.[0m
