[32m[I 2024-10-13 06:13:06,134][0m Trial 874 finished with value: 18529.064102134605 and parameters: {'depth': 5, 'learning_rate': 0.23369769412824512, 'iterations': 146, 'l2_leaf_reg': 7.535966815100777e-06, 'border_count': 1, 'bagging_temperature': 0.856870770034788, 'random_strength': 0.16128345494813512, 'grow_policy': 'SymmetricTree', 'min_data_in_leaf': 269}. Best is trial 374 with value: 6012.54835621459.[0m
[32m[I 2024-10-13 06:13:06,842][0m Trial 875 finished with value: 10286.612033786065 and parameters: {'depth': 5, 'learning_rate': 0.1324181770868568, 'iterations': 235, 'l2_leaf_reg': 2.0869166760814236e-05, 'border_count': 30, 'bagging_temperature': 0.8837454043633172, 'random_strength': 0.010454982115624872, 'grow_policy': 'Depthwise', 'min_data_in_leaf': 677}. Best is trial 374 with value: 6012.54835621459.[0m
[32m[I 2024-10-13 06:13:07,611][0m Trial 876 finished with value: 8134.048265131181 and parameters: {'depth': 5, 'learning_rate': 0.19695807452426167, 'iterations': 199, 'l2_leaf_reg': 3.149065711834545e-05, 'border_count': 20, 'bagging_temperature': 0.8917177472820091, 'random_strength': 1.0616719914314354, 'grow_policy': 'SymmetricTree', 'min_data_in_leaf': 701}. Best is trial 374 with value: 6012.54835621459.[0m
[32m[I 2024-10-13 06:13:15,718][0m Trial 877 finished with value: 9810.616433553503 and parameters: {'depth': 6, 'learning_rate': 0.2287550626679194, 'iterations': 1522, 'l2_leaf_reg': 1.589517421560349e-05, 'border_count': 31, 'bagging_temperature': 0.7999059767173282, 'random_strength': 0.5390963831578056, 'grow_policy': 'SymmetricTree', 'min_data_in_leaf': 676}. Best is trial 374 with value: 6012.54835621459.[0m
[32m[I 2024-10-13 06:13:16,583][0m Trial 878 finished with value: 6974.95768135607 and parameters: {'depth': 5, 'learning_rate': 0.26023236520495024, 'iterations': 243, 'l2_leaf_reg': 9.203564053523127e-06, 'border_count': 25, 'bagging_temperature': 0.8729816251193258, 'random_strength': 0.3498173178026625, 'grow_policy': 'SymmetricTree', 'min_data_in_leaf': 715}. Best is trial 374 with value: 6012.54835621459.[0m
[32m[I 2024-10-13 06:13:17,407][0m Trial 879 finished with value: 9086.101869608514 and parameters: {'depth': 7, 'learning_rate': 0.16234376714940416, 'iterations': 148, 'l2_leaf_reg': 0.0009466938062659933, 'border_count': 31, 'bagging_temperature': 0.8460280488642075, 'random_strength': 0.7509029459776309, 'grow_policy': 'SymmetricTree', 'min_data_in_leaf': 972}. Best is trial 374 with value: 6012.54835621459.[0m
[32m[I 2024-10-13 06:13:18,363][0m Trial 880 finished with value: 9951.312533229522 and parameters: {'depth': 8, 'learning_rate': 0.19618259317206224, 'iterations': 186, 'l2_leaf_reg': 4.716496918345243e-05, 'border_count': 17, 'bagging_temperature': 0.8633352035040216, 'random_strength': 0.01026857858297131, 'grow_policy': 'SymmetricTree', 'min_data_in_leaf': 478}. Best is trial 374 with value: 6012.54835621459.[0m
[32m[I 2024-10-13 06:13:19,047][0m Trial 881 finished with value: 8318.242433613643 and parameters: {'depth': 5, 'learning_rate': 0.22560526117069876, 'iterations': 111, 'l2_leaf_reg': 5.132705446008235e-06, 'border_count': 23, 'bagging_temperature': 0.7707978558558689, 'random_strength': 0.3475911032934077, 'grow_policy': 'SymmetricTree', 'min_data_in_leaf': 722}. Best is trial 374 with value: 6012.54835621459.[0m
[32m[I 2024-10-13 06:13:19,909][0m Trial 882 finished with value: 7258.13655317995 and parameters: {'depth': 5, 'learning_rate': 0.1317107789089851, 'iterations': 269, 'l2_leaf_reg': 1.393753410324297e-05, 'border_count': 35, 'bagging_temperature': 0.9017028165821704, 'random_strength': 0.5999571263621413, 'grow_policy': 'SymmetricTree', 'min_data_in_leaf': 861}. Best is trial 374 with value: 6012.54835621459.[0m
[32m[I 2024-10-13 06:13:20,595][0m Trial 883 finished with value: 7573.001613646878 and parameters: {'depth': 5, 'learning_rate': 0.26369964357143777, 'iterations': 106, 'l2_leaf_reg': 2.3103197040115563e-05, 'border_count': 10, 'bagging_temperature': 0.8189047155468108, 'random_strength': 0.1967875737859507, 'grow_policy': 'SymmetricTree', 'min_data_in_leaf': 694}. Best is trial 374 with value: 6012.54835621459.[0m
[32m[I 2024-10-13 06:13:21,343][0m Trial 884 finished with value: 10095.605217819026 and parameters: {'depth': 4, 'learning_rate': 0.17669695841453406, 'iterations': 208, 'l2_leaf_reg': 8.161604164500704e-06, 'border_count': 27, 'bagging_temperature': 0.9014140183674986, 'random_strength': 4.705192682574246, 'grow_policy': 'SymmetricTree', 'min_data_in_leaf': 659}. Best is trial 374 with value: 6012.54835621459.[0m
[32m[I 2024-10-13 06:13:22,219][0m Trial 885 finished with value: 7887.71593994235 and parameters: {'depth': 5, 'learning_rate': 0.15110936783093443, 'iterations': 293, 'l2_leaf_reg': 1.634459518260966e-05, 'border_count': 37, 'bagging_temperature': 0.8751179182023145, 'random_strength': 0.4693767004256982, 'grow_policy': 'SymmetricTree', 'min_data_in_leaf': 730}. Best is trial 374 with value: 6012.54835621459.[0m
[32m[I 2024-10-13 06:13:23,215][0m Trial 886 finished with value: 8536.053740246623 and parameters: {'depth': 6, 'learning_rate': 0.20992241431977782, 'iterations': 337, 'l2_leaf_reg': 0.7073852873936811, 'border_count': 41, 'bagging_temperature': 0.9330993994847008, 'random_strength': 0.0034642514388460166, 'grow_policy': 'SymmetricTree', 'min_data_in_leaf': 688}. Best is trial 374 with value: 6012.54835621459.[0m
[32m[I 2024-10-13 06:13:24,021][0m Trial 887 finished with value: 7649.594918092153 and parameters: {'depth': 5, 'learning_rate': 0.24984896841482065, 'iterations': 243, 'l2_leaf_reg': 4.184330985087979e-05, 'border_count': 30, 'bagging_temperature': 0.8377871132231176, 'random_strength': 0.27804248390400976, 'grow_policy': 'SymmetricTree', 'min_data_in_leaf': 929}. Best is trial 374 with value: 6012.54835621459.[0m
[32m[I 2024-10-13 06:13:24,788][0m Trial 888 finished with value: 9892.190298788526 and parameters: {'depth': 5, 'learning_rate': 0.2967791298074137, 'iterations': 182, 'l2_leaf_reg': 4.517833777242359e-06, 'border_count': 22, 'bagging_temperature': 0.9135224936401485, 'random_strength': 0.7260983961737002, 'grow_policy': 'SymmetricTree', 'min_data_in_leaf': 735}. Best is trial 374 with value: 6012.54835621459.[0m
[32m[I 2024-10-13 06:13:25,604][0m Trial 889 finished with value: 10204.978133174815 and parameters: {'depth': 4, 'learning_rate': 0.18492390895595376, 'iterations': 248, 'l2_leaf_reg': 1.1314278625807883e-05, 'border_count': 17, 'bagging_temperature': 0.8888124512095771, 'random_strength': 0.474278295982228, 'grow_policy': 'SymmetricTree', 'min_data_in_leaf': 663}. Best is trial 374 with value: 6012.54835621459.[0m
[32m[I 2024-10-13 06:13:26,248][0m Trial 890 finished with value: 10389.3198762484 and parameters: {'depth': 9, 'learning_rate': 0.2240344935599318, 'iterations': 160, 'l2_leaf_reg': 3.142068899573145e-05, 'border_count': 33, 'bagging_temperature': 0.9495934545799424, 'random_strength': 0.21524936963281294, 'grow_policy': 'Lossguide', 'min_data_in_leaf': 701, 'max_leaves': 133}. Best is trial 374 with value: 6012.54835621459.[0m
[32m[I 2024-10-13 06:13:27,207][0m Trial 891 finished with value: 8100.480784820527 and parameters: {'depth': 5, 'learning_rate': 0.1525585851742276, 'iterations': 319, 'l2_leaf_reg': 6.714160643458495e-06, 'border_count': 26, 'bagging_temperature': 0.8583142055331745, 'random_strength': 0.6113143894263509, 'grow_policy': 'SymmetricTree', 'min_data_in_leaf': 708}. Best is trial 374 with value: 6012.54835621459.[0m
[32m[I 2024-10-13 06:13:33,246][0m Trial 892 finished with value: 11194.974889213805 and parameters: {'depth': 5, 'learning_rate': 0.19315449166285953, 'iterations': 1381, 'l2_leaf_reg': 7.566827112138876e-05, 'border_count': 41, 'bagging_temperature': 0.8976395694118698, 'random_strength': 0.003102714758809022, 'grow_policy': 'SymmetricTree', 'min_data_in_leaf': 877}. Best is trial 374 with value: 6012.54835621459.[0m
[32m[I 2024-10-13 06:13:34,218][0m Trial 893 finished with value: 16186.566537970775 and parameters: {'depth': 5, 'learning_rate': 0.29883369009499194, 'iterations': 386, 'l2_leaf_reg': 1.0179545611884744e-05, 'border_count': 7, 'bagging_temperature': 0.9270284387891041, 'random_strength': 6.443858841568833, 'grow_policy': 'SymmetricTree', 'min_data_in_leaf': 679}. Best is trial 374 with value: 6012.54835621459.[0m
[32m[I 2024-10-13 06:13:35,009][0m Trial 894 finished with value: 5643.410092502591 and parameters: {'depth': 5, 'learning_rate': 0.23355620279889, 'iterations': 206, 'l2_leaf_reg': 2.072820795232817e-05, 'border_count': 33, 'bagging_temperature': 0.8854201124262071, 'random_strength': 0.3706926113413769, 'grow_policy': 'SymmetricTree', 'min_data_in_leaf': 741}. Best is trial 894 with value: 5643.410092502591.[0m
[32m[I 2024-10-13 06:13:35,675][0m Trial 895 finished with value: 7028.020573921798 and parameters: {'depth': 5, 'learning_rate': 0.2547633334701468, 'iterations': 108, 'l2_leaf_reg': 2.338244803996785e-05, 'border_count': 27, 'bagging_temperature': 0.8743205695538713, 'random_strength': 0.18661317359832638, 'grow_policy': 'SymmetricTree', 'min_data_in_leaf': 753}. Best is trial 894 with value: 5643.410092502591.[0m
[32m[I 2024-10-13 06:13:36,335][0m Trial 896 finished with value: 13678.670862698596 and parameters: {'depth': 4, 'learning_rate': 0.23314726408403819, 'iterations': 103, 'l2_leaf_reg': 3.539591131799001e-05, 'border_count': 101, 'bagging_temperature': 0.8537257878015809, 'random_strength': 0.37044814637730117, 'grow_policy': 'SymmetricTree', 'min_data_in_leaf': 739}. Best is trial 894 with value: 5643.410092502591.[0m
[32m[I 2024-10-13 06:13:37,067][0m Trial 897 finished with value: 12859.997870281002 and parameters: {'depth': 6, 'learning_rate': 0.26109066501707356, 'iterations': 190, 'l2_leaf_reg': 1.8376696086350186e-05, 'border_count': 21, 'bagging_temperature': 0.8770811816016426, 'random_strength': 0.19648544515826694, 'grow_policy': 'Depthwise', 'min_data_in_leaf': 744}. Best is trial 894 with value: 5643.410092502591.[0m
[32m[I 2024-10-13 06:13:37,719][0m Trial 898 finished with value: 10532.533673445067 and parameters: {'depth': 4, 'learning_rate': 0.2272968637041666, 'iterations': 101, 'l2_leaf_reg': 2.1287664432171132e-05, 'border_count': 31, 'bagging_temperature': 0.8322162168254353, 'random_strength': 0.44464926578583563, 'grow_policy': 'SymmetricTree', 'min_data_in_leaf': 725}. Best is trial 894 with value: 5643.410092502591.[0m
[32m[I 2024-10-13 06:13:41,922][0m Trial 899 finished with value: 9583.54081649089 and parameters: {'depth': 5, 'learning_rate': 0.19761035252677078, 'iterations': 990, 'l2_leaf_reg': 1.4464310346928572e-05, 'border_count': 14, 'bagging_temperature': 0.8914222542104985, 'random_strength': 0.18745852391798443, 'grow_policy': 'SymmetricTree', 'min_data_in_leaf': 763}. Best is trial 894 with value: 5643.410092502591.[0m
[32m[I 2024-10-13 06:13:42,688][0m Trial 900 finished with value: 8381.849577444666 and parameters: {'depth': 5, 'learning_rate': 0.22585721883346388, 'iterations': 199, 'l2_leaf_reg': 5.061542830444428e-05, 'border_count': 26, 'bagging_temperature': 0.8567793032521941, 'random_strength': 0.00361123053639556, 'grow_policy': 'SymmetricTree', 'min_data_in_leaf': 754}. Best is trial 894 with value: 5643.410092502591.[0m
[32m[I 2024-10-13 06:13:43,431][0m Trial 901 finished with value: 5852.495525351065 and parameters: {'depth': 5, 'learning_rate': 0.26280044176670897, 'iterations': 175, 'l2_leaf_reg': 3.4439333783032714e-05, 'border_count': 32, 'bagging_temperature': 0.8783914144981566, 'random_strength': 0.3562659254400607, 'grow_policy': 'SymmetricTree', 'min_data_in_leaf': 736}. Best is trial 894 with value: 5643.410092502591.[0m
[32m[I 2024-10-13 06:13:44,190][0m Trial 902 finished with value: 11602.833563510392 and parameters: {'depth': 6, 'learning_rate': 0.29774849760022215, 'iterations': 160, 'l2_leaf_reg': 6.371047152805408e-05, 'border_count': 35, 'bagging_temperature': 0.8530032390345955, 'random_strength': 0.6914184647148749, 'grow_policy': 'SymmetricTree', 'min_data_in_leaf': 738}. Best is trial 894 with value: 5643.410092502591.[0m
[32m[I 2024-10-13 06:13:44,872][0m Trial 903 finished with value: 11884.943849519814 and parameters: {'depth': 5, 'learning_rate': 0.2538473364941844, 'iterations': 100, 'l2_leaf_reg': 5.098058574570183e-05, 'border_count': 117, 'bagging_temperature': 0.8241718511013533, 'random_strength': 0.46012602206214703, 'grow_policy': 'SymmetricTree', 'min_data_in_leaf': 744}. Best is trial 894 with value: 5643.410092502591.[0m
[32m[I 2024-10-13 06:13:45,699][0m Trial 904 finished with value: 9652.815498689943 and parameters: {'depth': 5, 'learning_rate': 0.298853291721362, 'iterations': 235, 'l2_leaf_reg': 4.0244175210891724e-05, 'border_count': 33, 'bagging_temperature': 0.8728151136401627, 'random_strength': 0.9281365972776956, 'grow_policy': 'SymmetricTree', 'min_data_in_leaf': 775}. Best is trial 894 with value: 5643.410092502591.[0m
[32m[I 2024-10-13 06:13:46,509][0m Trial 905 finished with value: 6959.494531492975 and parameters: {'depth': 5, 'learning_rate': 0.2607043328658474, 'iterations': 235, 'l2_leaf_reg': 3.2069769783083204e-05, 'border_count': 37, 'bagging_temperature': 0.8413483530352331, 'random_strength': 0.32805429790398455, 'grow_policy': 'SymmetricTree', 'min_data_in_leaf': 756}. Best is trial 894 with value: 5643.410092502591.[0m
[32m[I 2024-10-13 06:13:49,960][0m Trial 906 finished with value: 13184.066699605071 and parameters: {'depth': 13, 'learning_rate': 0.2583219245247174, 'iterations': 157, 'l2_leaf_reg': 9.643845103949609e-05, 'border_count': 21, 'bagging_temperature': 0.8743150922118736, 'random_strength': 0.6068473704717211, 'grow_policy': 'SymmetricTree', 'min_data_in_leaf': 713}. Best is trial 894 with value: 5643.410092502591.[0m
[32m[I 2024-10-13 06:13:59,795][0m Trial 907 finished with value: 10991.655242528386 and parameters: {'depth': 14, 'learning_rate': 0.22864451011332676, 'iterations': 271, 'l2_leaf_reg': 3.425774184734078e-05, 'border_count': 31, 'bagging_temperature': 0.8143184987831343, 'random_strength': 0.4036407961960045, 'grow_policy': 'SymmetricTree', 'min_data_in_leaf': 732}. Best is trial 894 with value: 5643.410092502591.[0m
[32m[I 2024-10-13 06:14:00,360][0m Trial 908 finished with value: 8508.410988908327 and parameters: {'depth': 5, 'learning_rate': 0.29760882379923154, 'iterations': 186, 'l2_leaf_reg': 3.195709351867024e-05, 'border_count': 26, 'bagging_temperature': 0.8617613286920338, 'random_strength': 0.16719502553711976, 'grow_policy': 'SymmetricTree', 'min_data_in_leaf': 755}. Best is trial 894 with value: 5643.410092502591.[0m
[32m[I 2024-10-13 06:14:03,573][0m Trial 909 finished with value: 9292.272261747137 and parameters: {'depth': 4, 'learning_rate': 0.2531925482311877, 'iterations': 799, 'l2_leaf_reg': 7.85928854079851e-05, 'border_count': 37, 'bagging_temperature': 0.8876679702558378, 'random_strength': 0.5827213593488902, 'grow_policy': 'SymmetricTree', 'min_data_in_leaf': 734}. Best is trial 894 with value: 5643.410092502591.[0m
[32m[I 2024-10-13 06:14:04,431][0m Trial 910 finished with value: 15863.705938227815 and parameters: {'depth': 6, 'learning_rate': 0.21303995520036517, 'iterations': 227, 'l2_leaf_reg': 6.144348057226348e-05, 'border_count': 133, 'bagging_temperature': 0.8411305171573269, 'random_strength': 0.8227973743610895, 'grow_policy': 'SymmetricTree', 'min_data_in_leaf': 822}. Best is trial 894 with value: 5643.410092502591.[0m
[32m[I 2024-10-13 06:14:09,679][0m Trial 911 finished with value: 9880.752238982655 and parameters: {'depth': 5, 'learning_rate': 0.2547547879847201, 'iterations': 1284, 'l2_leaf_reg': 2.541994713098756e-05, 'border_count': 17, 'bagging_temperature': 0.8795162317909154, 'random_strength': 0.2953859392314425, 'grow_policy': 'SymmetricTree', 'min_data_in_leaf': 710}. Best is trial 894 with value: 5643.410092502591.[0m
[32m[I 2024-10-13 06:14:10,422][0m Trial 912 finished with value: 8867.27594516567 and parameters: {'depth': 5, 'learning_rate': 0.20592790661107138, 'iterations': 158, 'l2_leaf_reg': 2.266874844285931e-05, 'border_count': 12, 'bagging_temperature': 0.7878904122024684, 'random_strength': 1.0895302195952317, 'grow_policy': 'SymmetricTree', 'min_data_in_leaf': 774}. Best is trial 894 with value: 5643.410092502591.[0m
[32m[I 2024-10-13 06:14:11,316][0m Trial 913 finished with value: 8233.007775450918 and parameters: {'depth': 5, 'learning_rate': 0.1834614835045343, 'iterations': 280, 'l2_leaf_reg': 0.00011736681213693934, 'border_count': 32, 'bagging_temperature': 0.8977230597054092, 'random_strength': 0.1766000151198009, 'grow_policy': 'SymmetricTree', 'min_data_in_leaf': 905}. Best is trial 894 with value: 5643.410092502591.[0m
[32m[I 2024-10-13 06:14:12,047][0m Trial 914 finished with value: 10217.126800203583 and parameters: {'depth': 5, 'learning_rate': 0.2280865944019022, 'iterations': 217, 'l2_leaf_reg': 5.085694311264399e-05, 'border_count': 23, 'bagging_temperature': 0.8607652374397888, 'random_strength': 0.4895597503415736, 'grow_policy': 'Lossguide', 'min_data_in_leaf': 942, 'max_leaves': 149}. Best is trial 894 with value: 5643.410092502591.[0m
[32m[I 2024-10-13 06:14:12,891][0m Trial 915 finished with value: 14769.007904773962 and parameters: {'depth': 4, 'learning_rate': 0.2983494102915966, 'iterations': 296, 'l2_leaf_reg': 3.443308993909476e-05, 'border_count': 5, 'bagging_temperature': 0.8951535303068118, 'random_strength': 0.7372240461904558, 'grow_policy': 'SymmetricTree', 'min_data_in_leaf': 361}. Best is trial 894 with value: 5643.410092502591.[0m
[32m[I 2024-10-13 06:14:13,590][0m Trial 916 finished with value: 8073.683130744714 and parameters: {'depth': 5, 'learning_rate': 0.2547726249542278, 'iterations': 152, 'l2_leaf_reg': 1.9975648794405554e-05, 'border_count': 41, 'bagging_temperature': 0.8393648880875504, 'random_strength': 0.3481921983148148, 'grow_policy': 'SymmetricTree', 'min_data_in_leaf': 727}. Best is trial 894 with value: 5643.410092502591.[0m
[32m[I 2024-10-13 06:14:14,564][0m Trial 917 finished with value: 8583.074589928045 and parameters: {'depth': 5, 'learning_rate': 0.18385570367166731, 'iterations': 353, 'l2_leaf_reg': 2.4951783043313573e-05, 'border_count': 29, 'bagging_temperature': 0.8775597448269125, 'random_strength': 0.5370785642285545, 'grow_policy': 'SymmetricTree', 'min_data_in_leaf': 789}. Best is trial 894 with value: 5643.410092502591.[0m
[32m[I 2024-10-13 06:14:15,395][0m Trial 918 finished with value: 7068.100552850319 and parameters: {'depth': 5, 'learning_rate': 0.2227516029494288, 'iterations': 243, 'l2_leaf_reg': 1.6212873102195848e-05, 'border_count': 35, 'bagging_temperature': 0.8674262887253185, 'random_strength': 0.006032691562038672, 'grow_policy': 'SymmetricTree', 'min_data_in_leaf': 80}. Best is trial 894 with value: 5643.410092502591.[0m
[32m[I 2024-10-13 06:14:16,136][0m Trial 919 finished with value: 11077.589248375061 and parameters: {'depth': 6, 'learning_rate': 0.2620205402419405, 'iterations': 163, 'l2_leaf_reg': 4.4925184377029026e-05, 'border_count': 20, 'bagging_temperature': 0.9065859136541222, 'random_strength': 0.21145042776462838, 'grow_policy': 'SymmetricTree', 'min_data_in_leaf': 930}. Best is trial 894 with value: 5643.410092502591.[0m
[32m[I 2024-10-13 06:14:17,114][0m Trial 920 finished with value: 10071.873812012358 and parameters: {'depth': 6, 'learning_rate': 0.20764871735319318, 'iterations': 307, 'l2_leaf_reg': 1.7494824172619886e-05, 'border_count': 27, 'bagging_temperature': 0.42625917105311717, 'random_strength': 0.46036760306368646, 'grow_policy': 'SymmetricTree', 'min_data_in_leaf': 764}. Best is trial 894 with value: 5643.410092502591.[0m
[32m[I 2024-10-13 06:14:17,835][0m Trial 921 finished with value: 11064.343913738947 and parameters: {'depth': 4, 'learning_rate': 0.16920402707381857, 'iterations': 217, 'l2_leaf_reg': 3.162847579341528e-05, 'border_count': 46, 'bagging_temperature': 0.8138663125667351, 'random_strength': 0.7021339981344846, 'grow_policy': 'Depthwise', 'min_data_in_leaf': 891}. Best is trial 894 with value: 5643.410092502591.[0m
[32m[I 2024-10-13 06:14:18,494][0m Trial 922 finished with value: 7003.526048314648 and parameters: {'depth': 5, 'learning_rate': 0.22809983101814382, 'iterations': 101, 'l2_leaf_reg': 8.074161620341287e-05, 'border_count': 38, 'bagging_temperature': 0.8909360912746711, 'random_strength': 0.18167378329117342, 'grow_policy': 'SymmetricTree', 'min_data_in_leaf': 715}. Best is trial 894 with value: 5643.410092502591.[0m
[32m[I 2024-10-13 06:14:19,347][0m Trial 923 finished with value: 5976.05745495966 and parameters: {'depth': 5, 'learning_rate': 0.19353228436583203, 'iterations': 268, 'l2_leaf_reg': 0.0001338750567775493, 'border_count': 32, 'bagging_temperature': 0.8563356908964256, 'random_strength': 0.33681965653237345, 'grow_policy': 'SymmetricTree', 'min_data_in_leaf': 742}. Best is trial 894 with value: 5643.410092502591.[0m
[32m[I 2024-10-13 06:14:20,106][0m Trial 924 finished with value: 10481.805999862865 and parameters: {'depth': 5, 'learning_rate': 0.19740005893983856, 'iterations': 192, 'l2_leaf_reg': 0.0001306641037639977, 'border_count': 24, 'bagging_temperature': 0.8295724420989186, 'random_strength': 0.9187219309475424, 'grow_policy': 'SymmetricTree', 'min_data_in_leaf': 743}. Best is trial 894 with value: 5643.410092502591.[0m
