[32m[I 2024-10-13 05:58:49,557][0m Trial 256 finished with value: 7973.25986859169 and parameters: {'depth': 5, 'learning_rate': 0.12304698232802022, 'iterations': 316, 'l2_leaf_reg': 1.3318846987439479e-06, 'border_count': 34, 'bagging_temperature': 0.9447974187906532, 'random_strength': 0.15120194104368767, 'grow_policy': 'SymmetricTree', 'min_data_in_leaf': 737}. Best is trial 228 with value: 6892.65739148082.[0m
[32m[I 2024-10-13 05:58:50,483][0m Trial 257 finished with value: 8638.136681721315 and parameters: {'depth': 5, 'learning_rate': 0.12404848919779667, 'iterations': 321, 'l2_leaf_reg': 1.5583994242942974e-06, 'border_count': 33, 'bagging_temperature': 0.934044798279419, 'random_strength': 0.007155536697662279, 'grow_policy': 'SymmetricTree', 'min_data_in_leaf': 738}. Best is trial 228 with value: 6892.65739148082.[0m
[32m[I 2024-10-13 05:58:51,373][0m Trial 258 finished with value: 8766.806795163919 and parameters: {'depth': 4, 'learning_rate': 0.1592871618398559, 'iterations': 331, 'l2_leaf_reg': 3.213656428820993e-06, 'border_count': 35, 'bagging_temperature': 0.9457040444459762, 'random_strength': 0.4666161540112189, 'grow_policy': 'SymmetricTree', 'min_data_in_leaf': 716}. Best is trial 228 with value: 6892.65739148082.[0m
[32m[I 2024-10-13 05:58:52,310][0m Trial 259 finished with value: 8679.705487751091 and parameters: {'depth': 6, 'learning_rate': 0.11283907084688974, 'iterations': 292, 'l2_leaf_reg': 1.2208378589762778e-06, 'border_count': 33, 'bagging_temperature': 0.909065744954547, 'random_strength': 0.26627648244565155, 'grow_policy': 'SymmetricTree', 'min_data_in_leaf': 774}. Best is trial 228 with value: 6892.65739148082.[0m
[32m[I 2024-10-13 05:58:53,285][0m Trial 260 finished with value: 7474.161971090754 and parameters: {'depth': 5, 'learning_rate': 0.13506500215149744, 'iterations': 377, 'l2_leaf_reg': 2.103330552500208e-06, 'border_count': 34, 'bagging_temperature': 0.9463297054179018, 'random_strength': 0.48805955718843136, 'grow_policy': 'SymmetricTree', 'min_data_in_leaf': 711}. Best is trial 228 with value: 6892.65739148082.[0m
[32m[I 2024-10-13 05:58:54,248][0m Trial 261 finished with value: 7982.849721713291 and parameters: {'depth': 5, 'learning_rate': 0.13457172716558743, 'iterations': 379, 'l2_leaf_reg': 2.2234124401781323e-06, 'border_count': 32, 'bagging_temperature': 0.9294423315080396, 'random_strength': 0.5619051149617458, 'grow_policy': 'SymmetricTree', 'min_data_in_leaf': 702}. Best is trial 228 with value: 6892.65739148082.[0m
[32m[I 2024-10-13 05:58:55,203][0m Trial 262 finished with value: 9199.695059080337 and parameters: {'depth': 4, 'learning_rate': 0.13569415243006597, 'iterations': 385, 'l2_leaf_reg': 2.314322633034094e-06, 'border_count': 35, 'bagging_temperature': 0.9242860240004552, 'random_strength': 0.17364085464565976, 'grow_policy': 'SymmetricTree', 'min_data_in_leaf': 703}. Best is trial 228 with value: 6892.65739148082.[0m
[32m[I 2024-10-13 05:58:56,043][0m Trial 263 finished with value: 9783.842694530504 and parameters: {'depth': 6, 'learning_rate': 0.1970700580081861, 'iterations': 377, 'l2_leaf_reg': 4.979239538834013e-06, 'border_count': 32, 'bagging_temperature': 0.8938974755480298, 'random_strength': 0.5329926312842876, 'grow_policy': 'Depthwise', 'min_data_in_leaf': 735}. Best is trial 228 with value: 6892.65739148082.[0m
[32m[I 2024-10-13 05:58:57,081][0m Trial 264 finished with value: 8616.793224815377 and parameters: {'depth': 5, 'learning_rate': 0.16329844129910895, 'iterations': 375, 'l2_leaf_reg': 3.6167568302438516e-06, 'border_count': 33, 'bagging_temperature': 0.9416566014191246, 'random_strength': 0.3895621871649264, 'grow_policy': 'SymmetricTree', 'min_data_in_leaf': 802}. Best is trial 228 with value: 6892.65739148082.[0m
[32m[I 2024-10-13 05:58:57,947][0m Trial 265 finished with value: 9255.66800554245 and parameters: {'depth': 5, 'learning_rate': 0.127810345594564, 'iterations': 284, 'l2_leaf_reg': 1.1423268890408778e-05, 'border_count': 50, 'bagging_temperature': 0.9219710351230379, 'random_strength': 0.17401175908084027, 'grow_policy': 'SymmetricTree', 'min_data_in_leaf': 720}. Best is trial 228 with value: 6892.65739148082.[0m
[32m[I 2024-10-13 05:58:58,925][0m Trial 266 finished with value: 7598.150594484762 and parameters: {'depth': 5, 'learning_rate': 0.10154994131607525, 'iterations': 361, 'l2_leaf_reg': 1.973398077307915e-06, 'border_count': 35, 'bagging_temperature': 0.9420324932072216, 'random_strength': 0.6208384024218074, 'grow_policy': 'SymmetricTree', 'min_data_in_leaf': 757}. Best is trial 228 with value: 6892.65739148082.[0m
[32m[I 2024-10-13 05:58:59,840][0m Trial 267 finished with value: 10796.340482650003 and parameters: {'depth': 5, 'learning_rate': 0.10131844435469199, 'iterations': 327, 'l2_leaf_reg': 1.0930192785899159e-06, 'border_count': 45, 'bagging_temperature': 0.945659438361744, 'random_strength': 0.6272804436783432, 'grow_policy': 'SymmetricTree', 'min_data_in_leaf': 752}. Best is trial 228 with value: 6892.65739148082.[0m
[32m[I 2024-10-13 05:59:00,716][0m Trial 268 finished with value: 8297.462987683286 and parameters: {'depth': 5, 'learning_rate': 0.09300594742504867, 'iterations': 297, 'l2_leaf_reg': 6.598929066996406e-07, 'border_count': 68, 'bagging_temperature': 0.9063762518845652, 'random_strength': 0.2576775653964131, 'grow_policy': 'SymmetricTree', 'min_data_in_leaf': 737}. Best is trial 228 with value: 6892.65739148082.[0m
[32m[I 2024-10-13 05:59:01,650][0m Trial 269 finished with value: 7537.391236545465 and parameters: {'depth': 5, 'learning_rate': 0.09462945917411335, 'iterations': 332, 'l2_leaf_reg': 1.6652236464571077e-06, 'border_count': 35, 'bagging_temperature': 0.9525980083061567, 'random_strength': 0.022089341813286756, 'grow_policy': 'SymmetricTree', 'min_data_in_leaf': 786}. Best is trial 228 with value: 6892.65739148082.[0m
[32m[I 2024-10-13 05:59:02,703][0m Trial 270 finished with value: 9033.764284962766 and parameters: {'depth': 6, 'learning_rate': 0.10382841737688013, 'iterations': 373, 'l2_leaf_reg': 1.9709879818182306e-06, 'border_count': 37, 'bagging_temperature': 0.9555676592495435, 'random_strength': 0.4749331019212091, 'grow_policy': 'SymmetricTree', 'min_data_in_leaf': 762}. Best is trial 228 with value: 6892.65739148082.[0m
[32m[I 2024-10-13 05:59:03,516][0m Trial 271 finished with value: 11371.366909283946 and parameters: {'depth': 4, 'learning_rate': 0.09037421929625836, 'iterations': 262, 'l2_leaf_reg': 8.932859159378409e-07, 'border_count': 55, 'bagging_temperature': 0.9158990398546826, 'random_strength': 0.6746655079837078, 'grow_policy': 'SymmetricTree', 'min_data_in_leaf': 788}. Best is trial 228 with value: 6892.65739148082.[0m
[32m[I 2024-10-13 05:59:04,452][0m Trial 272 finished with value: 8749.947084217469 and parameters: {'depth': 5, 'learning_rate': 0.10639798600130251, 'iterations': 344, 'l2_leaf_reg': 3.540791221379863e-06, 'border_count': 44, 'bagging_temperature': 0.949055929463796, 'random_strength': 0.022641784215049032, 'grow_policy': 'SymmetricTree', 'min_data_in_leaf': 818}. Best is trial 228 with value: 6892.65739148082.[0m
[32m[I 2024-10-13 05:59:05,335][0m Trial 273 finished with value: 8335.254084771814 and parameters: {'depth': 5, 'learning_rate': 0.088253878210346, 'iterations': 272, 'l2_leaf_reg': 2.495036290322159e-06, 'border_count': 29, 'bagging_temperature': 0.9310190828684982, 'random_strength': 0.3756044664661372, 'grow_policy': 'SymmetricTree', 'min_data_in_leaf': 688}. Best is trial 228 with value: 6892.65739148082.[0m
[32m[I 2024-10-13 05:59:06,304][0m Trial 274 finished with value: 7322.852986068467 and parameters: {'depth': 5, 'learning_rate': 0.11169842217802223, 'iterations': 387, 'l2_leaf_reg': 7.071622338546424e-07, 'border_count': 38, 'bagging_temperature': 0.8935958955469816, 'random_strength': 0.6934924227789753, 'grow_policy': 'SymmetricTree', 'min_data_in_leaf': 705}. Best is trial 228 with value: 6892.65739148082.[0m
[32m[I 2024-10-13 05:59:07,281][0m Trial 275 finished with value: 10504.232275485543 and parameters: {'depth': 5, 'learning_rate': 0.11100973873613636, 'iterations': 390, 'l2_leaf_reg': 8.052383342223295e-07, 'border_count': 43, 'bagging_temperature': 0.9011494322028243, 'random_strength': 0.6494319974594792, 'grow_policy': 'SymmetricTree', 'min_data_in_leaf': 718}. Best is trial 228 with value: 6892.65739148082.[0m
[32m[I 2024-10-13 05:59:08,240][0m Trial 276 finished with value: 16379.11283053345 and parameters: {'depth': 6, 'learning_rate': 0.002256250308514774, 'iterations': 318, 'l2_leaf_reg': 1.3564108772544381e-06, 'border_count': 25, 'bagging_temperature': 0.8887329983267351, 'random_strength': 0.36692182236831206, 'grow_policy': 'SymmetricTree', 'min_data_in_leaf': 695}. Best is trial 228 with value: 6892.65739148082.[0m
[32m[I 2024-10-13 05:59:09,087][0m Trial 277 finished with value: 9829.935540335113 and parameters: {'depth': 5, 'learning_rate': 0.1578212553784009, 'iterations': 403, 'l2_leaf_reg': 6.942881853073981e-07, 'border_count': 36, 'bagging_temperature': 0.9577780006539894, 'random_strength': 0.6429930665988441, 'grow_policy': 'Lossguide', 'min_data_in_leaf': 844, 'max_leaves': 56}. Best is trial 228 with value: 6892.65739148082.[0m
[32m[I 2024-10-13 05:59:09,965][0m Trial 278 finished with value: 9561.044170653577 and parameters: {'depth': 5, 'learning_rate': 0.09040260448093218, 'iterations': 294, 'l2_leaf_reg': 6.049814005218579e-06, 'border_count': 51, 'bagging_temperature': 0.9169041948760897, 'random_strength': 0.19186248790547197, 'grow_policy': 'SymmetricTree', 'min_data_in_leaf': 771}. Best is trial 228 with value: 6892.65739148082.[0m
[32m[I 2024-10-13 05:59:10,967][0m Trial 279 finished with value: 8025.1714567580875 and parameters: {'depth': 5, 'learning_rate': 0.12046237012463742, 'iterations': 353, 'l2_leaf_reg': 1.9160546637666797e-06, 'border_count': 31, 'bagging_temperature': 0.9584222368633194, 'random_strength': 0.017356516595163386, 'grow_policy': 'SymmetricTree', 'min_data_in_leaf': 710}. Best is trial 228 with value: 6892.65739148082.[0m
[32m[I 2024-10-13 05:59:11,722][0m Trial 280 finished with value: 11287.806355080409 and parameters: {'depth': 4, 'learning_rate': 0.19462868258962965, 'iterations': 219, 'l2_leaf_reg': 1.2516972820228431e-06, 'border_count': 46, 'bagging_temperature': 0.932294264359337, 'random_strength': 0.45102437938674095, 'grow_policy': 'SymmetricTree', 'min_data_in_leaf': 675}. Best is trial 228 with value: 6892.65739148082.[0m
[32m[I 2024-10-13 05:59:12,550][0m Trial 281 finished with value: 7892.420250313075 and parameters: {'depth': 5, 'learning_rate': 0.09772455956858399, 'iterations': 260, 'l2_leaf_reg': 5.001250117187773e-07, 'border_count': 37, 'bagging_temperature': 0.9622688224948317, 'random_strength': 0.7161463754218238, 'grow_policy': 'SymmetricTree', 'min_data_in_leaf': 751}. Best is trial 228 with value: 6892.65739148082.[0m
[32m[I 2024-10-13 05:59:13,646][0m Trial 282 finished with value: 14189.231505385786 and parameters: {'depth': 6, 'learning_rate': 0.14484723268003422, 'iterations': 410, 'l2_leaf_reg': 6.266782828154304e-07, 'border_count': 42, 'bagging_temperature': 0.9130475508659928, 'random_strength': 0.724659801195824, 'grow_policy': 'SymmetricTree', 'min_data_in_leaf': 757}. Best is trial 228 with value: 6892.65739148082.[0m
[32m[I 2024-10-13 05:59:14,450][0m Trial 283 finished with value: 9155.224721760025 and parameters: {'depth': 4, 'learning_rate': 0.10463572806119675, 'iterations': 273, 'l2_leaf_reg': 2.9235632690766615e-06, 'border_count': 29, 'bagging_temperature': 0.9620922901195379, 'random_strength': 0.35280002154411844, 'grow_policy': 'SymmetricTree', 'min_data_in_leaf': 801}. Best is trial 228 with value: 6892.65739148082.[0m
[32m[I 2024-10-13 05:59:15,403][0m Trial 284 finished with value: 22591.905567821865 and parameters: {'depth': 5, 'learning_rate': 0.0001428635087370383, 'iterations': 335, 'l2_leaf_reg': 9.305685360206828e-07, 'border_count': 37, 'bagging_temperature': 0.8807547647950564, 'random_strength': 0.5566408288142588, 'grow_policy': 'SymmetricTree', 'min_data_in_leaf': 721}. Best is trial 228 with value: 6892.65739148082.[0m
[32m[I 2024-10-13 05:59:16,151][0m Trial 285 finished with value: 10363.784132749484 and parameters: {'depth': 5, 'learning_rate': 0.12102946059083641, 'iterations': 281, 'l2_leaf_reg': 4.993839569830832e-07, 'border_count': 25, 'bagging_temperature': 0.9422923179565983, 'random_strength': 0.7207170628568761, 'grow_policy': 'Depthwise', 'min_data_in_leaf': 744}. Best is trial 228 with value: 6892.65739148082.[0m
[32m[I 2024-10-13 05:59:17,172][0m Trial 286 finished with value: 8146.697255538455 and parameters: {'depth': 5, 'learning_rate': 0.08430950193555935, 'iterations': 412, 'l2_leaf_reg': 1.707022103606323e-06, 'border_count': 49, 'bagging_temperature': 0.9553065495038511, 'random_strength': 0.25230952800473844, 'grow_policy': 'SymmetricTree', 'min_data_in_leaf': 781}. Best is trial 228 with value: 6892.65739148082.[0m
[32m[I 2024-10-13 05:59:17,979][0m Trial 287 finished with value: 8291.310773459672 and parameters: {'depth': 5, 'learning_rate': 0.10618407383085847, 'iterations': 232, 'l2_leaf_reg': 4.611626700136879e-06, 'border_count': 33, 'bagging_temperature': 0.9154242241727705, 'random_strength': 0.4783578217769913, 'grow_policy': 'SymmetricTree', 'min_data_in_leaf': 703}. Best is trial 228 with value: 6892.65739148082.[0m
[32m[I 2024-10-13 05:59:18,949][0m Trial 288 finished with value: 10122.733247155436 and parameters: {'depth': 5, 'learning_rate': 0.08786023185195914, 'iterations': 357, 'l2_leaf_reg': 1.0472194847321802e-06, 'border_count': 42, 'bagging_temperature': 0.9313956305255962, 'random_strength': 0.7635471044580614, 'grow_policy': 'SymmetricTree', 'min_data_in_leaf': 683}. Best is trial 228 with value: 6892.65739148082.[0m
[32m[I 2024-10-13 05:59:19,806][0m Trial 289 finished with value: 9103.153507557412 and parameters: {'depth': 4, 'learning_rate': 0.12778561293298413, 'iterations': 315, 'l2_leaf_reg': 1.7809433235536253e-06, 'border_count': 38, 'bagging_temperature': 0.9654851923930261, 'random_strength': 0.26883013007869416, 'grow_policy': 'SymmetricTree', 'min_data_in_leaf': 755}. Best is trial 228 with value: 6892.65739148082.[0m
[32m[I 2024-10-13 05:59:20,641][0m Trial 290 finished with value: 13156.231822903825 and parameters: {'depth': 6, 'learning_rate': 0.10153706477981601, 'iterations': 217, 'l2_leaf_reg': 4.979444667724786e-07, 'border_count': 46, 'bagging_temperature': 0.8957963236072286, 'random_strength': 0.5359130583940848, 'grow_policy': 'SymmetricTree', 'min_data_in_leaf': 726}. Best is trial 228 with value: 6892.65739148082.[0m
[32m[I 2024-10-13 05:59:21,566][0m Trial 291 finished with value: 8056.842398940383 and parameters: {'depth': 5, 'learning_rate': 0.08466356889964169, 'iterations': 266, 'l2_leaf_reg': 2.8687095030197253e-06, 'border_count': 30, 'bagging_temperature': 0.9451708802723721, 'random_strength': 0.16849435218602357, 'grow_policy': 'SymmetricTree', 'min_data_in_leaf': 663}. Best is trial 228 with value: 6892.65739148082.[0m
[32m[I 2024-10-13 05:59:22,526][0m Trial 292 finished with value: 7804.955067641939 and parameters: {'depth': 5, 'learning_rate': 0.1771558995729778, 'iterations': 353, 'l2_leaf_reg': 7.379940824563007e-07, 'border_count': 36, 'bagging_temperature': 0.9654368585246091, 'random_strength': 0.747829735875507, 'grow_policy': 'SymmetricTree', 'min_data_in_leaf': 695}. Best is trial 228 with value: 6892.65739148082.[0m
[32m[I 2024-10-13 05:59:23,510][0m Trial 293 finished with value: 11448.654632596255 and parameters: {'depth': 5, 'learning_rate': 0.17455805080569717, 'iterations': 384, 'l2_leaf_reg': 7.88319938788746e-07, 'border_count': 57, 'bagging_temperature': 0.9268282322286727, 'random_strength': 0.7787976360541788, 'grow_policy': 'SymmetricTree', 'min_data_in_leaf': 692}. Best is trial 228 with value: 6892.65739148082.[0m
[32m[I 2024-10-13 05:59:24,554][0m Trial 294 finished with value: 8445.17599041147 and parameters: {'depth': 5, 'learning_rate': 0.1523779904009414, 'iterations': 436, 'l2_leaf_reg': 1.3763374452726117e-06, 'border_count': 24, 'bagging_temperature': 0.9511027466274936, 'random_strength': 0.4050046853983237, 'grow_policy': 'SymmetricTree', 'min_data_in_leaf': 740}. Best is trial 228 with value: 6892.65739148082.[0m
[32m[I 2024-10-13 05:59:25,555][0m Trial 295 finished with value: 14886.732347400719 and parameters: {'depth': 6, 'learning_rate': 0.2703817902524704, 'iterations': 336, 'l2_leaf_reg': 8.594441114955387e-07, 'border_count': 43, 'bagging_temperature': 0.5343264415859812, 'random_strength': 0.6794054428650727, 'grow_policy': 'SymmetricTree', 'min_data_in_leaf': 714}. Best is trial 228 with value: 6892.65739148082.[0m
[32m[I 2024-10-13 05:59:26,461][0m Trial 296 finished with value: 8481.661539234412 and parameters: {'depth': 5, 'learning_rate': 0.19363538545848352, 'iterations': 310, 'l2_leaf_reg': 2.1583785849876863e-06, 'border_count': 33, 'bagging_temperature': 0.9671179103523336, 'random_strength': 0.011194970419143524, 'grow_policy': 'SymmetricTree', 'min_data_in_leaf': 776}. Best is trial 228 with value: 6892.65739148082.[0m
[32m[I 2024-10-13 05:59:27,472][0m Trial 297 finished with value: 7629.34359396972 and parameters: {'depth': 5, 'learning_rate': 0.1353614912955842, 'iterations': 420, 'l2_leaf_reg': 1.1783324707709174e-06, 'border_count': 39, 'bagging_temperature': 0.9307331473334467, 'random_strength': 0.5125264548870974, 'grow_policy': 'SymmetricTree', 'min_data_in_leaf': 694}. Best is trial 228 with value: 6892.65739148082.[0m
[32m[I 2024-10-13 05:59:28,398][0m Trial 298 finished with value: 11395.680816425373 and parameters: {'depth': 4, 'learning_rate': 0.14181647984161386, 'iterations': 396, 'l2_leaf_reg': 1.3182159806557294e-06, 'border_count': 50, 'bagging_temperature': 0.9004312159508194, 'random_strength': 0.37860984748441184, 'grow_policy': 'SymmetricTree', 'min_data_in_leaf': 697}. Best is trial 228 with value: 6892.65739148082.[0m
[32m[I 2024-10-13 05:59:29,516][0m Trial 299 finished with value: 10318.099811046683 and parameters: {'depth': 5, 'learning_rate': 0.11789671971593964, 'iterations': 458, 'l2_leaf_reg': 6.442037744059961e-07, 'border_count': 42, 'bagging_temperature': 0.923259448222201, 'random_strength': 0.561486015915393, 'grow_policy': 'SymmetricTree', 'min_data_in_leaf': 730}. Best is trial 228 with value: 6892.65739148082.[0m
[32m[I 2024-10-13 05:59:30,489][0m Trial 300 finished with value: 7405.04221418295 and parameters: {'depth': 5, 'learning_rate': 0.16290722891711393, 'iterations': 368, 'l2_leaf_reg': 3.969480249342175e-06, 'border_count': 29, 'bagging_temperature': 0.8763641077447287, 'random_strength': 0.21261616893880422, 'grow_policy': 'SymmetricTree', 'min_data_in_leaf': 757}. Best is trial 228 with value: 6892.65739148082.[0m
[32m[I 2024-10-13 05:59:31,348][0m Trial 301 finished with value: 9352.318485902118 and parameters: {'depth': 5, 'learning_rate': 0.24363195401987203, 'iterations': 440, 'l2_leaf_reg': 3.487119008961329e-06, 'border_count': 26, 'bagging_temperature': 0.8945534771149677, 'random_strength': 0.5378965571953963, 'grow_policy': 'Lossguide', 'min_data_in_leaf': 683, 'max_leaves': 141}. Best is trial 228 with value: 6892.65739148082.[0m
[32m[I 2024-10-13 05:59:34,270][0m Trial 302 finished with value: 9851.896512740826 and parameters: {'depth': 6, 'learning_rate': 0.15997926589119707, 'iterations': 525, 'l2_leaf_reg': 4.696607681100741e-06, 'border_count': 29, 'bagging_temperature': 0.9060588790335213, 'random_strength': 0.3286746030616749, 'grow_policy': 'SymmetricTree', 'min_data_in_leaf': 718}. Best is trial 228 with value: 6892.65739148082.[0m
[32m[I 2024-10-13 05:59:35,216][0m Trial 303 finished with value: 8602.00923432481 and parameters: {'depth': 4, 'learning_rate': 0.17384589849256327, 'iterations': 370, 'l2_leaf_reg': 1.1537384000979937e-06, 'border_count': 39, 'bagging_temperature': 0.8756932794810041, 'random_strength': 0.6913846735891478, 'grow_policy': 'SymmetricTree', 'min_data_in_leaf': 707}. Best is trial 228 with value: 6892.65739148082.[0m
[32m[I 2024-10-13 05:59:36,125][0m Trial 304 finished with value: 9253.678405425255 and parameters: {'depth': 5, 'learning_rate': 0.13861109064220728, 'iterations': 299, 'l2_leaf_reg': 8.970445139902644e-06, 'border_count': 43, 'bagging_temperature': 0.5890561655179057, 'random_strength': 0.18137674405036003, 'grow_policy': 'SymmetricTree', 'min_data_in_leaf': 742}. Best is trial 228 with value: 6892.65739148082.[0m
[32m[I 2024-10-13 05:59:36,993][0m Trial 305 finished with value: 11042.438220089662 and parameters: {'depth': 5, 'learning_rate': 0.2249999204171856, 'iterations': 275, 'l2_leaf_reg': 2.419738762397242e-06, 'border_count': 48, 'bagging_temperature': 0.9298555918153987, 'random_strength': 0.7749708706636678, 'grow_policy': 'SymmetricTree', 'min_data_in_leaf': 794}. Best is trial 228 with value: 6892.65739148082.[0m
[32m[I 2024-10-13 05:59:38,029][0m Trial 306 finished with value: 11068.843367319636 and parameters: {'depth': 5, 'learning_rate': 0.13133600680316573, 'iterations': 417, 'l2_leaf_reg': 4.6435484884824755e-07, 'border_count': 238, 'bagging_temperature': 0.6419801002493852, 'random_strength': 0.4175616508010199, 'grow_policy': 'SymmetricTree', 'min_data_in_leaf': 676}. Best is trial 228 with value: 6892.65739148082.[0m
[32m[I 2024-10-13 05:59:40,540][0m Trial 307 finished with value: 9492.652122667174 and parameters: {'depth': 5, 'learning_rate': 0.209173638016699, 'iterations': 2736, 'l2_leaf_reg': 8.915152824517411e-07, 'border_count': 35, 'bagging_temperature': 0.8808201620222808, 'random_strength': 0.6096078751371165, 'grow_policy': 'Depthwise', 'min_data_in_leaf': 765}. Best is trial 228 with value: 6892.65739148082.[0m
