[32m[I 2024-10-13 05:57:56,765][0m Trial 205 finished with value: 7933.897227528752 and parameters: {'depth': 5, 'learning_rate': 0.0784303131781847, 'iterations': 171, 'l2_leaf_reg': 2.1822668430180083e-07, 'border_count': 37, 'bagging_temperature': 0.9793427838134754, 'random_strength': 0.8770572904747347, 'grow_policy': 'SymmetricTree', 'min_data_in_leaf': 623}. Best is trial 205 with value: 7933.897227528752.[0m
[32m[I 2024-10-13 05:57:57,494][0m Trial 206 finished with value: 11934.982932121718 and parameters: {'depth': 4, 'learning_rate': 0.08284370450134472, 'iterations': 156, 'l2_leaf_reg': 5.233416307300447e-07, 'border_count': 55, 'bagging_temperature': 0.9748876005555553, 'random_strength': 0.8657395729318661, 'grow_policy': 'SymmetricTree', 'min_data_in_leaf': 642}. Best is trial 205 with value: 7933.897227528752.[0m
[32m[I 2024-10-13 05:57:58,319][0m Trial 207 finished with value: 7967.419185175941 and parameters: {'depth': 5, 'learning_rate': 0.06994469878408159, 'iterations': 238, 'l2_leaf_reg': 2.601316935255465e-07, 'border_count': 38, 'bagging_temperature': 0.941044526819633, 'random_strength': 1.0036005210397936, 'grow_policy': 'SymmetricTree', 'min_data_in_leaf': 622}. Best is trial 205 with value: 7933.897227528752.[0m
[32m[I 2024-10-13 05:57:59,178][0m Trial 208 finished with value: 7805.257328644472 and parameters: {'depth': 5, 'learning_rate': 0.06723534478712816, 'iterations': 246, 'l2_leaf_reg': 9.6126307040605e-07, 'border_count': 38, 'bagging_temperature': 0.9775732803475435, 'random_strength': 0.6683196512011416, 'grow_policy': 'SymmetricTree', 'min_data_in_leaf': 621}. Best is trial 208 with value: 7805.257328644472.[0m
[32m[I 2024-10-13 05:58:00,020][0m Trial 209 finished with value: 10629.11341303409 and parameters: {'depth': 5, 'learning_rate': 0.07712906705111615, 'iterations': 255, 'l2_leaf_reg': 9.767868722085073e-07, 'border_count': 45, 'bagging_temperature': 0.9367304292627211, 'random_strength': 0.6668164056078637, 'grow_policy': 'SymmetricTree', 'min_data_in_leaf': 627}. Best is trial 208 with value: 7805.257328644472.[0m
[32m[I 2024-10-13 05:58:00,871][0m Trial 210 finished with value: 8318.396335922242 and parameters: {'depth': 5, 'learning_rate': 0.09093050009342343, 'iterations': 235, 'l2_leaf_reg': 3.063972202991109e-07, 'border_count': 36, 'bagging_temperature': 0.967894619779839, 'random_strength': 0.8955136825168002, 'grow_policy': 'SymmetricTree', 'min_data_in_leaf': 615}. Best is trial 208 with value: 7805.257328644472.[0m
[32m[I 2024-10-13 05:58:01,697][0m Trial 211 finished with value: 7697.738100954954 and parameters: {'depth': 5, 'learning_rate': 0.09008430826014655, 'iterations': 232, 'l2_leaf_reg': 3.0327526264647796e-07, 'border_count': 36, 'bagging_temperature': 0.9682924280806317, 'random_strength': 0.942468085700636, 'grow_policy': 'SymmetricTree', 'min_data_in_leaf': 620}. Best is trial 211 with value: 7697.738100954954.[0m
[32m[I 2024-10-13 05:58:02,514][0m Trial 212 finished with value: 7954.613700888325 and parameters: {'depth': 5, 'learning_rate': 0.06986831255606697, 'iterations': 243, 'l2_leaf_reg': 3.242663728851208e-07, 'border_count': 37, 'bagging_temperature': 0.9803197499076968, 'random_strength': 1.0170344071167847, 'grow_policy': 'SymmetricTree', 'min_data_in_leaf': 658}. Best is trial 211 with value: 7697.738100954954.[0m
[32m[I 2024-10-13 05:58:03,248][0m Trial 213 finished with value: 7956.900701589978 and parameters: {'depth': 5, 'learning_rate': 0.08993457549618664, 'iterations': 166, 'l2_leaf_reg': 3.2294139793916085e-07, 'border_count': 37, 'bagging_temperature': 0.9773277039112684, 'random_strength': 0.9784954036301282, 'grow_policy': 'SymmetricTree', 'min_data_in_leaf': 671}. Best is trial 211 with value: 7697.738100954954.[0m
[32m[I 2024-10-13 05:58:04,040][0m Trial 214 finished with value: 9541.977786872485 and parameters: {'depth': 4, 'learning_rate': 0.08884675368863007, 'iterations': 250, 'l2_leaf_reg': 4.4947946642694483e-07, 'border_count': 38, 'bagging_temperature': 0.977600565455405, 'random_strength': 0.946386193567551, 'grow_policy': 'SymmetricTree', 'min_data_in_leaf': 668}. Best is trial 211 with value: 7697.738100954954.[0m
[32m[I 2024-10-13 05:58:04,799][0m Trial 215 finished with value: 10991.082885788801 and parameters: {'depth': 5, 'learning_rate': 0.07133834839491686, 'iterations': 166, 'l2_leaf_reg': 3.2868085546329164e-07, 'border_count': 46, 'bagging_temperature': 0.974110354333313, 'random_strength': 1.0903106041088224, 'grow_policy': 'SymmetricTree', 'min_data_in_leaf': 654}. Best is trial 211 with value: 7697.738100954954.[0m
[32m[I 2024-10-13 05:58:05,532][0m Trial 216 finished with value: 11204.622105533283 and parameters: {'depth': 5, 'learning_rate': 0.059675299184019384, 'iterations': 237, 'l2_leaf_reg': 7.186136262596918e-07, 'border_count': 37, 'bagging_temperature': 0.9409512562619435, 'random_strength': 0.8963511790762551, 'grow_policy': 'Lossguide', 'min_data_in_leaf': 708, 'max_leaves': 81}. Best is trial 211 with value: 7697.738100954954.[0m
[32m[I 2024-10-13 05:58:06,266][0m Trial 217 finished with value: 10427.793085990199 and parameters: {'depth': 5, 'learning_rate': 0.08749642957693543, 'iterations': 155, 'l2_leaf_reg': 2.4667251978034557e-07, 'border_count': 44, 'bagging_temperature': 0.9806478815462651, 'random_strength': 0.7122844257400895, 'grow_policy': 'SymmetricTree', 'min_data_in_leaf': 623}. Best is trial 211 with value: 7697.738100954954.[0m
[32m[I 2024-10-13 05:58:07,102][0m Trial 218 finished with value: 8127.64392177186 and parameters: {'depth': 5, 'learning_rate': 0.07120002219144365, 'iterations': 254, 'l2_leaf_reg': 5.748315524419477e-07, 'border_count': 41, 'bagging_temperature': 0.9658268138795912, 'random_strength': 1.1070792790471393, 'grow_policy': 'SymmetricTree', 'min_data_in_leaf': 618}. Best is trial 211 with value: 7697.738100954954.[0m
[32m[I 2024-10-13 05:58:07,953][0m Trial 219 finished with value: 9599.66537674605 and parameters: {'depth': 5, 'learning_rate': 0.11440115668506654, 'iterations': 264, 'l2_leaf_reg': 5.232046925238752e-07, 'border_count': 49, 'bagging_temperature': 0.9997298884802404, 'random_strength': 1.1468763355581908, 'grow_policy': 'SymmetricTree', 'min_data_in_leaf': 616}. Best is trial 211 with value: 7697.738100954954.[0m
[32m[I 2024-10-13 05:58:08,785][0m Trial 220 finished with value: 7330.359611968157 and parameters: {'depth': 5, 'learning_rate': 0.07138917231393348, 'iterations': 239, 'l2_leaf_reg': 1.0183439246017753e-06, 'border_count': 41, 'bagging_temperature': 0.9699276301230028, 'random_strength': 0.5032738350919661, 'grow_policy': 'SymmetricTree', 'min_data_in_leaf': 682}. Best is trial 220 with value: 7330.359611968157.[0m
[32m[I 2024-10-13 05:58:09,587][0m Trial 221 finished with value: 8125.655782056418 and parameters: {'depth': 5, 'learning_rate': 0.0715929962733227, 'iterations': 222, 'l2_leaf_reg': 1.0263888299041294e-06, 'border_count': 40, 'bagging_temperature': 0.9710769354195695, 'random_strength': 0.9971603602732917, 'grow_policy': 'SymmetricTree', 'min_data_in_leaf': 649}. Best is trial 220 with value: 7330.359611968157.[0m
[32m[I 2024-10-13 05:58:10,405][0m Trial 222 finished with value: 7678.186924197363 and parameters: {'depth': 5, 'learning_rate': 0.07594776018109972, 'iterations': 247, 'l2_leaf_reg': 3.837684830303723e-07, 'border_count': 41, 'bagging_temperature': 0.9653479207464793, 'random_strength': 0.49146950530384337, 'grow_policy': 'SymmetricTree', 'min_data_in_leaf': 684}. Best is trial 220 with value: 7330.359611968157.[0m
[32m[I 2024-10-13 05:58:11,246][0m Trial 223 finished with value: 11740.965873823063 and parameters: {'depth': 4, 'learning_rate': 0.07611585067216164, 'iterations': 247, 'l2_leaf_reg': 1.2815313482500637e-06, 'border_count': 44, 'bagging_temperature': 0.9657339803970831, 'random_strength': 0.45743208483448766, 'grow_policy': 'SymmetricTree', 'min_data_in_leaf': 687}. Best is trial 220 with value: 7330.359611968157.[0m
[32m[I 2024-10-13 05:58:12,125][0m Trial 224 finished with value: 10510.986683346897 and parameters: {'depth': 5, 'learning_rate': 0.09277819786292403, 'iterations': 294, 'l2_leaf_reg': 7.778812753152126e-07, 'border_count': 53, 'bagging_temperature': 0.9388889349849777, 'random_strength': 0.5867897206345759, 'grow_policy': 'SymmetricTree', 'min_data_in_leaf': 649}. Best is trial 220 with value: 7330.359611968157.[0m
[32m[I 2024-10-13 05:58:12,949][0m Trial 225 finished with value: 7349.07808711738 and parameters: {'depth': 5, 'learning_rate': 0.07056549751712778, 'iterations': 230, 'l2_leaf_reg': 4.1330139865646125e-07, 'border_count': 41, 'bagging_temperature': 0.9686762318852785, 'random_strength': 0.8163945842038659, 'grow_policy': 'SymmetricTree', 'min_data_in_leaf': 671}. Best is trial 220 with value: 7330.359611968157.[0m
[32m[I 2024-10-13 05:58:13,792][0m Trial 226 finished with value: 10701.7222623524 and parameters: {'depth': 5, 'learning_rate': 0.0729095120075589, 'iterations': 242, 'l2_leaf_reg': 9.90959381462074e-07, 'border_count': 49, 'bagging_temperature': 0.9712831165214059, 'random_strength': 0.7899521026868466, 'grow_policy': 'SymmetricTree', 'min_data_in_leaf': 669}. Best is trial 220 with value: 7330.359611968157.[0m
[32m[I 2024-10-13 05:58:14,490][0m Trial 227 finished with value: 12316.799777444234 and parameters: {'depth': 5, 'learning_rate': 0.08551018140803066, 'iterations': 216, 'l2_leaf_reg': 4.246507951732548e-07, 'border_count': 42, 'bagging_temperature': 0.9403283558815564, 'random_strength': 0.9457158455948469, 'grow_policy': 'Depthwise', 'min_data_in_leaf': 725}. Best is trial 220 with value: 7330.359611968157.[0m
[32m[I 2024-10-13 05:58:15,385][0m Trial 228 finished with value: 6892.65739148082 and parameters: {'depth': 5, 'learning_rate': 0.10742859275144011, 'iterations': 287, 'l2_leaf_reg': 1.8932551496377965e-06, 'border_count': 40, 'bagging_temperature': 0.9623664640743923, 'random_strength': 0.49558971191351275, 'grow_policy': 'SymmetricTree', 'min_data_in_leaf': 644}. Best is trial 228 with value: 6892.65739148082.[0m
[32m[I 2024-10-13 05:58:16,219][0m Trial 229 finished with value: 9747.34301183606 and parameters: {'depth': 4, 'learning_rate': 0.1053828695146779, 'iterations': 288, 'l2_leaf_reg': 5.885188094384765e-07, 'border_count': 35, 'bagging_temperature': 0.9626252729054222, 'random_strength': 0.18883085595809262, 'grow_policy': 'SymmetricTree', 'min_data_in_leaf': 644}. Best is trial 228 with value: 6892.65739148082.[0m
[32m[I 2024-10-13 05:58:25,057][0m Trial 230 finished with value: 12205.811348176232 and parameters: {'depth': 5, 'learning_rate': 0.06745279839072818, 'iterations': 2124, 'l2_leaf_reg': 1.309389324619025e-06, 'border_count': 61, 'bagging_temperature': 0.9326994076737178, 'random_strength': 0.6331797713135171, 'grow_policy': 'SymmetricTree', 'min_data_in_leaf': 699}. Best is trial 228 with value: 6892.65739148082.[0m
[32m[I 2024-10-13 05:58:25,828][0m Trial 231 finished with value: 7057.196347672518 and parameters: {'depth': 5, 'learning_rate': 0.0827421077083133, 'iterations': 215, 'l2_leaf_reg': 3.0095507667221547e-06, 'border_count': 41, 'bagging_temperature': 0.9687966341961258, 'random_strength': 0.4674790026802739, 'grow_policy': 'SymmetricTree', 'min_data_in_leaf': 671}. Best is trial 228 with value: 6892.65739148082.[0m
[32m[I 2024-10-13 05:58:26,647][0m Trial 232 finished with value: 10816.256172871117 and parameters: {'depth': 5, 'learning_rate': 0.09376119837004729, 'iterations': 238, 'l2_leaf_reg': 3.348644752754978e-07, 'border_count': 44, 'bagging_temperature': 0.9675731274080869, 'random_strength': 0.46231797174123385, 'grow_policy': 'SymmetricTree', 'min_data_in_leaf': 676}. Best is trial 228 with value: 6892.65739148082.[0m
[32m[I 2024-10-13 05:58:27,539][0m Trial 233 finished with value: 7875.369795202868 and parameters: {'depth': 5, 'learning_rate': 0.07993757352589478, 'iterations': 291, 'l2_leaf_reg': 3.850653400454983e-07, 'border_count': 39, 'bagging_temperature': 0.9520080334561543, 'random_strength': 0.778616139105937, 'grow_policy': 'SymmetricTree', 'min_data_in_leaf': 657}. Best is trial 228 with value: 6892.65739148082.[0m
[32m[I 2024-10-13 05:58:28,492][0m Trial 234 finished with value: 13115.567955311879 and parameters: {'depth': 6, 'learning_rate': 0.11462602784649101, 'iterations': 303, 'l2_leaf_reg': 2.5963407860685995e-06, 'border_count': 46, 'bagging_temperature': 0.9479997438960333, 'random_strength': 0.7808019960432877, 'grow_policy': 'SymmetricTree', 'min_data_in_leaf': 650}. Best is trial 228 with value: 6892.65739148082.[0m
[32m[I 2024-10-13 05:58:29,272][0m Trial 235 finished with value: 8090.061747768503 and parameters: {'depth': 5, 'learning_rate': 0.07768236041543461, 'iterations': 218, 'l2_leaf_reg': 1.5953890286515157e-06, 'border_count': 41, 'bagging_temperature': 0.9602129959966088, 'random_strength': 0.9957363508875623, 'grow_policy': 'SymmetricTree', 'min_data_in_leaf': 675}. Best is trial 228 with value: 6892.65739148082.[0m
[32m[I 2024-10-13 05:58:30,137][0m Trial 236 finished with value: 9435.992202069176 and parameters: {'depth': 5, 'learning_rate': 0.07869820391935824, 'iterations': 269, 'l2_leaf_reg': 1.928510245666816e-06, 'border_count': 54, 'bagging_temperature': 0.9583719406591759, 'random_strength': 0.3383325869715404, 'grow_policy': 'SymmetricTree', 'min_data_in_leaf': 680}. Best is trial 228 with value: 6892.65739148082.[0m
[32m[I 2024-10-13 05:58:30,926][0m Trial 237 finished with value: 7226.898912931555 and parameters: {'depth': 5, 'learning_rate': 0.0983114619234473, 'iterations': 219, 'l2_leaf_reg': 3.0290922636023204e-06, 'border_count': 40, 'bagging_temperature': 0.9368797531884119, 'random_strength': 0.9977347995891533, 'grow_policy': 'SymmetricTree', 'min_data_in_leaf': 714}. Best is trial 228 with value: 6892.65739148082.[0m
[32m[I 2024-10-13 05:58:31,675][0m Trial 238 finished with value: 9156.897369846081 and parameters: {'depth': 4, 'learning_rate': 0.10159688323155246, 'iterations': 222, 'l2_leaf_reg': 3.5132107096043536e-06, 'border_count': 41, 'bagging_temperature': 0.9315577505770593, 'random_strength': 0.8777782598531233, 'grow_policy': 'SymmetricTree', 'min_data_in_leaf': 716}. Best is trial 228 with value: 6892.65739148082.[0m
[32m[I 2024-10-13 05:58:32,621][0m Trial 239 finished with value: 12255.11836013557 and parameters: {'depth': 6, 'learning_rate': 0.08446785858396824, 'iterations': 300, 'l2_leaf_reg': 1.7124079709123968e-06, 'border_count': 49, 'bagging_temperature': 0.9553629760812258, 'random_strength': 0.5305283152882708, 'grow_policy': 'SymmetricTree', 'min_data_in_leaf': 661}. Best is trial 228 with value: 6892.65739148082.[0m
[32m[I 2024-10-13 05:58:33,528][0m Trial 240 finished with value: 7774.652029947306 and parameters: {'depth': 5, 'learning_rate': 0.07664800708504985, 'iterations': 329, 'l2_leaf_reg': 9.344794938222953e-07, 'border_count': 41, 'bagging_temperature': 0.9291166249412194, 'random_strength': 0.9818943486912162, 'grow_policy': 'SymmetricTree', 'min_data_in_leaf': 691}. Best is trial 228 with value: 6892.65739148082.[0m
[32m[I 2024-10-13 05:58:34,336][0m Trial 241 finished with value: 7803.123118240346 and parameters: {'depth': 5, 'learning_rate': 0.0768058622282694, 'iterations': 225, 'l2_leaf_reg': 9.20664792496305e-07, 'border_count': 41, 'bagging_temperature': 0.923381123870558, 'random_strength': 0.9841061818710221, 'grow_policy': 'SymmetricTree', 'min_data_in_leaf': 688}. Best is trial 228 with value: 6892.65739148082.[0m
[32m[I 2024-10-13 05:58:35,272][0m Trial 242 finished with value: 7002.7356904102335 and parameters: {'depth': 5, 'learning_rate': 0.12255163762831513, 'iterations': 335, 'l2_leaf_reg': 9.074895113636535e-07, 'border_count': 39, 'bagging_temperature': 0.9219777746172244, 'random_strength': 0.7023477202104638, 'grow_policy': 'SymmetricTree', 'min_data_in_leaf': 686}. Best is trial 228 with value: 6892.65739148082.[0m
[32m[I 2024-10-13 05:58:36,164][0m Trial 243 finished with value: 10727.116290522861 and parameters: {'depth': 5, 'learning_rate': 0.1309247885821591, 'iterations': 308, 'l2_leaf_reg': 8.119637883829694e-07, 'border_count': 46, 'bagging_temperature': 0.928470866484735, 'random_strength': 0.7124660987963466, 'grow_policy': 'SymmetricTree', 'min_data_in_leaf': 692}. Best is trial 228 with value: 6892.65739148082.[0m
[32m[I 2024-10-13 05:58:37,132][0m Trial 244 finished with value: 7794.3129758234245 and parameters: {'depth': 5, 'learning_rate': 0.11623000487540769, 'iterations': 326, 'l2_leaf_reg': 1.0506931615556869e-06, 'border_count': 35, 'bagging_temperature': 0.9268702547191879, 'random_strength': 0.9731733825264963, 'grow_policy': 'SymmetricTree', 'min_data_in_leaf': 761}. Best is trial 228 with value: 6892.65739148082.[0m
[32m[I 2024-10-13 05:58:38,057][0m Trial 245 finished with value: 10075.543204481239 and parameters: {'depth': 5, 'learning_rate': 0.11173169125237878, 'iterations': 335, 'l2_leaf_reg': 1.0198549581400123e-06, 'border_count': 42, 'bagging_temperature': 0.9179039226887219, 'random_strength': 0.9436988060640527, 'grow_policy': 'SymmetricTree', 'min_data_in_leaf': 823}. Best is trial 228 with value: 6892.65739148082.[0m
[32m[I 2024-10-13 05:58:38,907][0m Trial 246 finished with value: 7464.0150506458585 and parameters: {'depth': 5, 'learning_rate': 0.14920818541247236, 'iterations': 266, 'l2_leaf_reg': 2.2848684104296387e-06, 'border_count': 35, 'bagging_temperature': 0.9417195264659434, 'random_strength': 0.05348304794694603, 'grow_policy': 'SymmetricTree', 'min_data_in_leaf': 743}. Best is trial 228 with value: 6892.65739148082.[0m
[32m[I 2024-10-13 05:58:39,877][0m Trial 247 finished with value: 9466.32867484803 and parameters: {'depth': 6, 'learning_rate': 0.1463265215072638, 'iterations': 337, 'l2_leaf_reg': 4.648165659397994e-06, 'border_count': 35, 'bagging_temperature': 0.9242720315848856, 'random_strength': 0.029051735750874507, 'grow_policy': 'SymmetricTree', 'min_data_in_leaf': 755}. Best is trial 228 with value: 6892.65739148082.[0m
[32m[I 2024-10-13 05:58:40,711][0m Trial 248 finished with value: 7679.992837279303 and parameters: {'depth': 5, 'learning_rate': 0.09633780332640454, 'iterations': 257, 'l2_leaf_reg': 1.4218624851805403e-06, 'border_count': 35, 'bagging_temperature': 0.9412652817038953, 'random_strength': 0.23186735062774977, 'grow_policy': 'SymmetricTree', 'min_data_in_leaf': 741}. Best is trial 228 with value: 6892.65739148082.[0m
[32m[I 2024-10-13 05:58:41,585][0m Trial 249 finished with value: 8973.751212648709 and parameters: {'depth': 5, 'learning_rate': 0.12231153372663611, 'iterations': 277, 'l2_leaf_reg': 2.8314689793290885e-06, 'border_count': 50, 'bagging_temperature': 0.9407728839101799, 'random_strength': 0.27651963654607514, 'grow_policy': 'SymmetricTree', 'min_data_in_leaf': 735}. Best is trial 228 with value: 6892.65739148082.[0m
[32m[I 2024-10-13 05:58:42,521][0m Trial 250 finished with value: 7846.967853769055 and parameters: {'depth': 5, 'learning_rate': 0.09603951405742799, 'iterations': 351, 'l2_leaf_reg': 2.0056646370017462e-06, 'border_count': 35, 'bagging_temperature': 0.9432722962921853, 'random_strength': 0.1532901325570344, 'grow_policy': 'SymmetricTree', 'min_data_in_leaf': 743}. Best is trial 228 with value: 6892.65739148082.[0m
[32m[I 2024-10-13 05:58:43,481][0m Trial 251 finished with value: 7902.327988193282 and parameters: {'depth': 5, 'learning_rate': 0.10728449318761103, 'iterations': 354, 'l2_leaf_reg': 1.88355787226637e-06, 'border_count': 33, 'bagging_temperature': 0.9460726177328146, 'random_strength': 0.1783083002704996, 'grow_policy': 'SymmetricTree', 'min_data_in_leaf': 757}. Best is trial 228 with value: 6892.65739148082.[0m
[32m[I 2024-10-13 05:58:44,482][0m Trial 252 finished with value: 7898.677186129917 and parameters: {'depth': 6, 'learning_rate': 0.09800145807343758, 'iterations': 357, 'l2_leaf_reg': 2.095755878584567e-06, 'border_count': 34, 'bagging_temperature': 0.9211623130208905, 'random_strength': 0.15051581185533758, 'grow_policy': 'SymmetricTree', 'min_data_in_leaf': 739}. Best is trial 228 with value: 6892.65739148082.[0m
[32m[I 2024-10-13 05:58:45,500][0m Trial 253 finished with value: 8831.3345894014 and parameters: {'depth': 6, 'learning_rate': 0.10605441175292007, 'iterations': 366, 'l2_leaf_reg': 1.6768513839126415e-06, 'border_count': 34, 'bagging_temperature': 0.9168151445141345, 'random_strength': 0.08129441758270328, 'grow_policy': 'SymmetricTree', 'min_data_in_leaf': 771}. Best is trial 228 with value: 6892.65739148082.[0m
[32m[I 2024-10-13 05:58:47,700][0m Trial 254 finished with value: 11184.356529111008 and parameters: {'depth': 5, 'learning_rate': 0.14827951302923484, 'iterations': 2347, 'l2_leaf_reg': 2.2775087706229445e-06, 'border_count': 46, 'bagging_temperature': 0.9426290358554333, 'random_strength': 0.24236141586651863, 'grow_policy': 'Lossguide', 'min_data_in_leaf': 751, 'max_leaves': 182}. Best is trial 228 with value: 6892.65739148082.[0m
[32m[I 2024-10-13 05:58:48,605][0m Trial 255 finished with value: 10632.799753109683 and parameters: {'depth': 4, 'learning_rate': 0.09684351451822835, 'iterations': 350, 'l2_leaf_reg': 6.9507539078110275e-06, 'border_count': 45, 'bagging_temperature': 0.9206293936285942, 'random_strength': 0.40809846977540687, 'grow_policy': 'SymmetricTree', 'min_data_in_leaf': 788}. Best is trial 228 with value: 6892.65739148082.[0m
