[32m[I 2024-10-13 05:59:41,479][0m Trial 308 finished with value: 7968.197773563793 and parameters: {'depth': 5, 'learning_rate': 0.11256422958606506, 'iterations': 328, 'l2_leaf_reg': 1.467552963644968e-06, 'border_count': 30, 'bagging_temperature': 0.9150437526072067, 'random_strength': 0.02471084260648937, 'grow_policy': 'SymmetricTree', 'min_data_in_leaf': 729}. Best is trial 228 with value: 6892.65739148082.[0m
[32m[I 2024-10-13 05:59:42,322][0m Trial 309 finished with value: 10161.043592595825 and parameters: {'depth': 6, 'learning_rate': 0.09713927435240001, 'iterations': 230, 'l2_leaf_reg': 6.305302955653537e-07, 'border_count': 39, 'bagging_temperature': 0.9411718979071462, 'random_strength': 6.97393510713981, 'grow_policy': 'SymmetricTree', 'min_data_in_leaf': 694}. Best is trial 228 with value: 6892.65739148082.[0m
[32m[I 2024-10-13 05:59:43,449][0m Trial 310 finished with value: 10942.792819450518 and parameters: {'depth': 5, 'learning_rate': 0.15464241588386357, 'iterations': 494, 'l2_leaf_reg': 3.0208902331937484e-06, 'border_count': 191, 'bagging_temperature': 0.9626871551351667, 'random_strength': 0.3581992231312279, 'grow_policy': 'SymmetricTree', 'min_data_in_leaf': 668}. Best is trial 228 with value: 6892.65739148082.[0m
[32m[I 2024-10-13 05:59:44,363][0m Trial 311 finished with value: 20787.050430101055 and parameters: {'depth': 4, 'learning_rate': 0.0006508786746453625, 'iterations': 382, 'l2_leaf_reg': 5.895473718530124e-06, 'border_count': 24, 'bagging_temperature': 0.927649924058831, 'random_strength': 0.7618086020531583, 'grow_policy': 'SymmetricTree', 'min_data_in_leaf': 714}. Best is trial 228 with value: 6892.65739148082.[0m
[32m[I 2024-10-13 05:59:45,239][0m Trial 312 finished with value: 10130.308796946105 and parameters: {'depth': 5, 'learning_rate': 0.12233864758453392, 'iterations': 284, 'l2_leaf_reg': 1.1541260224681725e-06, 'border_count': 54, 'bagging_temperature': 0.952635635991004, 'random_strength': 0.527242595094921, 'grow_policy': 'SymmetricTree', 'min_data_in_leaf': 747}. Best is trial 228 with value: 6892.65739148082.[0m
[32m[I 2024-10-13 05:59:46,031][0m Trial 313 finished with value: 7578.299400749589 and parameters: {'depth': 5, 'learning_rate': 0.0918929617409126, 'iterations': 216, 'l2_leaf_reg': 1.7775570168589645e-06, 'border_count': 34, 'bagging_temperature': 0.9078214957988866, 'random_strength': 0.16648502001313747, 'grow_policy': 'SymmetricTree', 'min_data_in_leaf': 694}. Best is trial 228 with value: 6892.65739148082.[0m
[32m[I 2024-10-13 05:59:46,857][0m Trial 314 finished with value: 12802.652664352185 and parameters: {'depth': 5, 'learning_rate': 0.1833025517722653, 'iterations': 228, 'l2_leaf_reg': 4.6050202764362727e-07, 'border_count': 46, 'bagging_temperature': 0.9017361821987058, 'random_strength': 7.325607980386143, 'grow_policy': 'SymmetricTree', 'min_data_in_leaf': 891}. Best is trial 228 with value: 6892.65739148082.[0m
[32m[I 2024-10-13 05:59:47,674][0m Trial 315 finished with value: 7883.302897434186 and parameters: {'depth': 5, 'learning_rate': 0.07982518573221156, 'iterations': 217, 'l2_leaf_reg': 9.713767993734195e-07, 'border_count': 40, 'bagging_temperature': 0.9697025151351686, 'random_strength': 0.8379402933004276, 'grow_policy': 'SymmetricTree', 'min_data_in_leaf': 690}. Best is trial 228 with value: 6892.65739148082.[0m
[32m[I 2024-10-13 05:59:48,475][0m Trial 316 finished with value: 10467.040674902453 and parameters: {'depth': 5, 'learning_rate': 0.08202388911701636, 'iterations': 217, 'l2_leaf_reg': 1.6295218977954022e-06, 'border_count': 42, 'bagging_temperature': 0.8849991612171694, 'random_strength': 0.8761690374721265, 'grow_policy': 'SymmetricTree', 'min_data_in_leaf': 660}. Best is trial 228 with value: 6892.65739148082.[0m
[32m[I 2024-10-13 05:59:49,335][0m Trial 317 finished with value: 10904.414683360135 and parameters: {'depth': 5, 'learning_rate': 0.082428155988428, 'iterations': 293, 'l2_leaf_reg': 8.702921751759392e-07, 'border_count': 31, 'bagging_temperature': 0.9413463835264472, 'random_strength': 6.297426393470664, 'grow_policy': 'SymmetricTree', 'min_data_in_leaf': 688}. Best is trial 228 with value: 6892.65739148082.[0m
[32m[I 2024-10-13 05:59:50,168][0m Trial 318 finished with value: 8926.702037747495 and parameters: {'depth': 5, 'learning_rate': 0.13946191950458786, 'iterations': 205, 'l2_leaf_reg': 4.050384362832878e-06, 'border_count': 47, 'bagging_temperature': 0.9635873688972848, 'random_strength': 0.2696750796795374, 'grow_policy': 'SymmetricTree', 'min_data_in_leaf': 699}. Best is trial 228 with value: 6892.65739148082.[0m
[32m[I 2024-10-13 05:59:58,213][0m Trial 319 finished with value: 10060.846689214797 and parameters: {'depth': 5, 'learning_rate': 0.06244924070229361, 'iterations': 1926, 'l2_leaf_reg': 1.0976261547948742e-06, 'border_count': 40, 'bagging_temperature': 0.8697965670571818, 'random_strength': 0.4864558847992928, 'grow_policy': 'SymmetricTree', 'min_data_in_leaf': 677}. Best is trial 228 with value: 6892.65739148082.[0m
[32m[I 2024-10-13 05:59:59,111][0m Trial 320 finished with value: 10636.712843265374 and parameters: {'depth': 4, 'learning_rate': 0.12046090827101226, 'iterations': 325, 'l2_leaf_reg': 2.386025860816352e-06, 'border_count': 35, 'bagging_temperature': 0.9118573016175108, 'random_strength': 5.4694604250653125, 'grow_policy': 'SymmetricTree', 'min_data_in_leaf': 656}. Best is trial 228 with value: 6892.65739148082.[0m
[32m[I 2024-10-13 05:59:59,878][0m Trial 321 finished with value: 21275.92363807206 and parameters: {'depth': 5, 'learning_rate': 0.0011240040243657668, 'iterations': 192, 'l2_leaf_reg': 1.5564631683896566e-06, 'border_count': 52, 'bagging_temperature': 0.9355627372070059, 'random_strength': 0.8134568672331386, 'grow_policy': 'SymmetricTree', 'min_data_in_leaf': 706}. Best is trial 228 with value: 6892.65739148082.[0m
[32m[I 2024-10-13 06:00:00,705][0m Trial 322 finished with value: 7471.568651409697 and parameters: {'depth': 5, 'learning_rate': 0.08297696458693259, 'iterations': 249, 'l2_leaf_reg': 7.733363294989033e-07, 'border_count': 28, 'bagging_temperature': 0.9719854576406728, 'random_strength': 0.28806302644093557, 'grow_policy': 'SymmetricTree', 'min_data_in_leaf': 682}. Best is trial 228 with value: 6892.65739148082.[0m
[32m[I 2024-10-13 06:00:01,448][0m Trial 323 finished with value: 12842.721976683113 and parameters: {'depth': 5, 'learning_rate': 0.10023629921549236, 'iterations': 277, 'l2_leaf_reg': 6.719114800482205e-07, 'border_count': 21, 'bagging_temperature': 0.9432948632973289, 'random_strength': 0.048605320092424645, 'grow_policy': 'Lossguide', 'min_data_in_leaf': 665, 'max_leaves': 204}. Best is trial 228 with value: 6892.65739148082.[0m
[32m[I 2024-10-13 06:00:02,407][0m Trial 324 finished with value: 9140.01072231325 and parameters: {'depth': 4, 'learning_rate': 0.09264956128288314, 'iterations': 429, 'l2_leaf_reg': 2.6190756185704745e-06, 'border_count': 27, 'bagging_temperature': 0.9075956491202175, 'random_strength': 0.30167537622338214, 'grow_policy': 'SymmetricTree', 'min_data_in_leaf': 722}. Best is trial 228 with value: 6892.65739148082.[0m
[32m[I 2024-10-13 06:00:03,404][0m Trial 325 finished with value: 8014.517505571978 and parameters: {'depth': 6, 'learning_rate': 0.1717168031538172, 'iterations': 352, 'l2_leaf_reg': 1.4684112101602334e-06, 'border_count': 28, 'bagging_temperature': 0.9638000252248419, 'random_strength': 0.003115145886096668, 'grow_policy': 'SymmetricTree', 'min_data_in_leaf': 683}. Best is trial 228 with value: 6892.65739148082.[0m
[32m[I 2024-10-13 06:00:04,259][0m Trial 326 finished with value: 8014.158242781819 and parameters: {'depth': 5, 'learning_rate': 0.1402099151473396, 'iterations': 265, 'l2_leaf_reg': 7.00670324789087e-07, 'border_count': 23, 'bagging_temperature': 0.9770898711203789, 'random_strength': 0.5202153816263877, 'grow_policy': 'SymmetricTree', 'min_data_in_leaf': 651}. Best is trial 228 with value: 6892.65739148082.[0m
[32m[I 2024-10-13 06:00:05,203][0m Trial 327 finished with value: 8708.610010029544 and parameters: {'depth': 5, 'learning_rate': 0.11249836502833702, 'iterations': 341, 'l2_leaf_reg': 3.815904231551718e-06, 'border_count': 33, 'bagging_temperature': 0.9281838701527846, 'random_strength': 0.24444137502711422, 'grow_policy': 'SymmetricTree', 'min_data_in_leaf': 703}. Best is trial 228 with value: 6892.65739148082.[0m
[32m[I 2024-10-13 06:00:05,979][0m Trial 328 finished with value: 7878.994795164567 and parameters: {'depth': 5, 'learning_rate': 0.08007038869400715, 'iterations': 207, 'l2_leaf_reg': 4.1183415041982656e-07, 'border_count': 30, 'bagging_temperature': 0.9544636506833124, 'random_strength': 0.4017129952865426, 'grow_policy': 'SymmetricTree', 'min_data_in_leaf': 775}. Best is trial 228 with value: 6892.65739148082.[0m
[32m[I 2024-10-13 06:00:06,795][0m Trial 329 finished with value: 10756.262839341063 and parameters: {'depth': 5, 'learning_rate': 0.06444288315448576, 'iterations': 393, 'l2_leaf_reg': 1.8377993410233415e-06, 'border_count': 36, 'bagging_temperature': 0.9387421548365329, 'random_strength': 0.6096421552238794, 'grow_policy': 'Depthwise', 'min_data_in_leaf': 719}. Best is trial 228 with value: 6892.65739148082.[0m
[32m[I 2024-10-13 06:00:07,737][0m Trial 330 finished with value: 9526.608211034347 and parameters: {'depth': 5, 'learning_rate': 0.11541854725177565, 'iterations': 307, 'l2_leaf_reg': 9.746927978639865e-07, 'border_count': 44, 'bagging_temperature': 0.8997293094859777, 'random_strength': 1.065376680237521, 'grow_policy': 'SymmetricTree', 'min_data_in_leaf': 673}. Best is trial 228 with value: 6892.65739148082.[0m
[32m[I 2024-10-13 06:00:08,527][0m Trial 331 finished with value: 22262.75632840911 and parameters: {'depth': 4, 'learning_rate': 0.0003196043694460949, 'iterations': 257, 'l2_leaf_reg': 6.825476593497728e-06, 'border_count': 37, 'bagging_temperature': 0.9727879207393736, 'random_strength': 0.21631405560927594, 'grow_policy': 'SymmetricTree', 'min_data_in_leaf': 693}. Best is trial 228 with value: 6892.65739148082.[0m
[32m[I 2024-10-13 06:00:09,565][0m Trial 332 finished with value: 8264.046275182005 and parameters: {'depth': 5, 'learning_rate': 0.08948518473334155, 'iterations': 418, 'l2_leaf_reg': 1.780974957416097e-05, 'border_count': 31, 'bagging_temperature': 0.9211980186513274, 'random_strength': 0.5672804814945751, 'grow_policy': 'SymmetricTree', 'min_data_in_leaf': 824}. Best is trial 228 with value: 6892.65739148082.[0m
[32m[I 2024-10-13 06:00:19,065][0m Trial 333 finished with value: 10752.372370084198 and parameters: {'depth': 6, 'learning_rate': 0.09955905556023957, 'iterations': 1796, 'l2_leaf_reg': 6.990350090805407e-07, 'border_count': 47, 'bagging_temperature': 0.9497465906880033, 'random_strength': 0.4092024438634212, 'grow_policy': 'SymmetricTree', 'min_data_in_leaf': 653}. Best is trial 228 with value: 6892.65739148082.[0m
[32m[I 2024-10-13 06:00:19,949][0m Trial 334 finished with value: 7953.451938323979 and parameters: {'depth': 5, 'learning_rate': 0.14492579697394142, 'iterations': 326, 'l2_leaf_reg': 1.2243218843131337e-06, 'border_count': 24, 'bagging_temperature': 0.9791960659999948, 'random_strength': 0.6873890780364242, 'grow_policy': 'SymmetricTree', 'min_data_in_leaf': 710}. Best is trial 228 with value: 6892.65739148082.[0m
[32m[I 2024-10-13 06:00:20,739][0m Trial 335 finished with value: 8668.683011427062 and parameters: {'depth': 5, 'learning_rate': 0.07642296300442884, 'iterations': 216, 'l2_leaf_reg': 2.871974138872964e-06, 'border_count': 58, 'bagging_temperature': 0.9250109293439829, 'random_strength': 0.2206126353151068, 'grow_policy': 'SymmetricTree', 'min_data_in_leaf': 676}. Best is trial 228 with value: 6892.65739148082.[0m
[32m[I 2024-10-13 06:00:21,845][0m Trial 336 finished with value: 12924.332745566324 and parameters: {'depth': 5, 'learning_rate': 0.12476357927837912, 'iterations': 497, 'l2_leaf_reg': 5.359753263012568e-05, 'border_count': 201, 'bagging_temperature': 0.8873211360294317, 'random_strength': 1.0170497404375265, 'grow_policy': 'SymmetricTree', 'min_data_in_leaf': 733}. Best is trial 228 with value: 6892.65739148082.[0m
[32m[I 2024-10-13 06:00:22,762][0m Trial 337 finished with value: 8711.195010227078 and parameters: {'depth': 6, 'learning_rate': 0.06011374477889195, 'iterations': 272, 'l2_leaf_reg': 1.677207845052574e-06, 'border_count': 41, 'bagging_temperature': 0.46906969922494696, 'random_strength': 0.5195496700558956, 'grow_policy': 'SymmetricTree', 'min_data_in_leaf': 766}. Best is trial 228 with value: 6892.65739148082.[0m
[32m[I 2024-10-13 06:00:23,643][0m Trial 338 finished with value: 10066.814650774595 and parameters: {'depth': 4, 'learning_rate': 0.10653867367926907, 'iterations': 362, 'l2_leaf_reg': 4.742220868315511e-07, 'border_count': 35, 'bagging_temperature': 0.9516184556711601, 'random_strength': 0.8202062577572371, 'grow_policy': 'SymmetricTree', 'min_data_in_leaf': 797}. Best is trial 228 with value: 6892.65739148082.[0m
[32m[I 2024-10-13 06:00:24,690][0m Trial 339 finished with value: 7438.24957953242 and parameters: {'depth': 5, 'learning_rate': 0.20363955142224602, 'iterations': 454, 'l2_leaf_reg': 9.187655873815355e-07, 'border_count': 29, 'bagging_temperature': 0.9771966580118935, 'random_strength': 0.16930804195688098, 'grow_policy': 'SymmetricTree', 'min_data_in_leaf': 726}. Best is trial 228 with value: 6892.65739148082.[0m
[32m[I 2024-10-13 06:00:25,773][0m Trial 340 finished with value: 8194.096611936075 and parameters: {'depth': 5, 'learning_rate': 0.1862011231787896, 'iterations': 472, 'l2_leaf_reg': 2.181511207294365e-06, 'border_count': 26, 'bagging_temperature': 0.9749431948254665, 'random_strength': 0.005527242409973071, 'grow_policy': 'SymmetricTree', 'min_data_in_leaf': 724}. Best is trial 228 with value: 6892.65739148082.[0m
[32m[I 2024-10-13 06:00:26,805][0m Trial 341 finished with value: 7607.197538657577 and parameters: {'depth': 5, 'learning_rate': 0.20083094210642166, 'iterations': 440, 'l2_leaf_reg': 9.989981298099826e-07, 'border_count': 29, 'bagging_temperature': 0.9786054674647459, 'random_strength': 0.24331968300388263, 'grow_policy': 'SymmetricTree', 'min_data_in_leaf': 748}. Best is trial 228 with value: 6892.65739148082.[0m
[32m[I 2024-10-13 06:00:27,899][0m Trial 342 finished with value: 7497.751137132317 and parameters: {'depth': 5, 'learning_rate': 0.190295568907319, 'iterations': 444, 'l2_leaf_reg': 8.34925829564877e-07, 'border_count': 23, 'bagging_temperature': 0.9724171039083822, 'random_strength': 0.3634958573791158, 'grow_policy': 'SymmetricTree', 'min_data_in_leaf': 763}. Best is trial 228 with value: 6892.65739148082.[0m
[32m[I 2024-10-13 06:00:30,491][0m Trial 343 finished with value: 10813.806561244923 and parameters: {'depth': 5, 'learning_rate': 0.22780204402824783, 'iterations': 539, 'l2_leaf_reg': 6.855210033610357e-07, 'border_count': 19, 'bagging_temperature': 0.9739230972806359, 'random_strength': 0.32077851760646475, 'grow_policy': 'SymmetricTree', 'min_data_in_leaf': 765}. Best is trial 228 with value: 6892.65739148082.[0m
[32m[I 2024-10-13 06:00:31,592][0m Trial 344 finished with value: 7119.208583479696 and parameters: {'depth': 5, 'learning_rate': 0.18627556729671366, 'iterations': 493, 'l2_leaf_reg': 1.1755675093869206e-06, 'border_count': 23, 'bagging_temperature': 0.9791774968890923, 'random_strength': 0.2053711453199502, 'grow_policy': 'SymmetricTree', 'min_data_in_leaf': 777}. Best is trial 228 with value: 6892.65739148082.[0m
[32m[I 2024-10-13 06:00:32,799][0m Trial 345 finished with value: 9832.333197120683 and parameters: {'depth': 6, 'learning_rate': 0.2679977836286697, 'iterations': 481, 'l2_leaf_reg': 1.2876416702283524e-06, 'border_count': 20, 'bagging_temperature': 0.9841295421167598, 'random_strength': 0.1826867033664727, 'grow_policy': 'SymmetricTree', 'min_data_in_leaf': 786}. Best is trial 228 with value: 6892.65739148082.[0m
[32m[I 2024-10-13 06:00:33,732][0m Trial 346 finished with value: 13353.867729798623 and parameters: {'depth': 5, 'learning_rate': 0.21483425803020398, 'iterations': 525, 'l2_leaf_reg': 1.1754770527190967e-06, 'border_count': 22, 'bagging_temperature': 0.9833492090015786, 'random_strength': 0.022954645988997213, 'grow_policy': 'Lossguide', 'min_data_in_leaf': 809, 'max_leaves': 97}. Best is trial 228 with value: 6892.65739148082.[0m
[32m[I 2024-10-13 06:00:36,209][0m Trial 347 finished with value: 10569.787179688145 and parameters: {'depth': 4, 'learning_rate': 0.21452723401287685, 'iterations': 603, 'l2_leaf_reg': 3.6143236948596534e-06, 'border_count': 27, 'bagging_temperature': 0.9119928528057114, 'random_strength': 0.3789291489618283, 'grow_policy': 'SymmetricTree', 'min_data_in_leaf': 991}. Best is trial 228 with value: 6892.65739148082.[0m
[32m[I 2024-10-13 06:00:37,261][0m Trial 348 finished with value: 9497.478199482144 and parameters: {'depth': 5, 'learning_rate': 0.245008304822538, 'iterations': 450, 'l2_leaf_reg': 9.567416799173108e-07, 'border_count': 20, 'bagging_temperature': 0.956912464503692, 'random_strength': 0.21480887405818255, 'grow_policy': 'SymmetricTree', 'min_data_in_leaf': 782}. Best is trial 228 with value: 6892.65739148082.[0m
[32m[I 2024-10-13 06:00:39,954][0m Trial 349 finished with value: 10589.371485041014 and parameters: {'depth': 5, 'learning_rate': 0.16494268650398453, 'iterations': 578, 'l2_leaf_reg': 1.7037668739218936e-06, 'border_count': 27, 'bagging_temperature': 0.5020088939232523, 'random_strength': 0.38523961921510685, 'grow_policy': 'SymmetricTree', 'min_data_in_leaf': 756}. Best is trial 228 with value: 6892.65739148082.[0m
[32m[I 2024-10-13 06:00:40,996][0m Trial 350 finished with value: 8449.30161695659 and parameters: {'depth': 5, 'learning_rate': 0.1966651780432116, 'iterations': 429, 'l2_leaf_reg': 5.087113474375306e-07, 'border_count': 17, 'bagging_temperature': 0.8691715315132543, 'random_strength': 0.17087692084954254, 'grow_policy': 'SymmetricTree', 'min_data_in_leaf': 742}. Best is trial 228 with value: 6892.65739148082.[0m
[32m[I 2024-10-13 06:00:42,031][0m Trial 351 finished with value: 8296.326346470685 and parameters: {'depth': 5, 'learning_rate': 0.16050885995428738, 'iterations': 446, 'l2_leaf_reg': 2.474784510235828e-06, 'border_count': 23, 'bagging_temperature': 0.936217785634352, 'random_strength': 0.4067738671318725, 'grow_policy': 'SymmetricTree', 'min_data_in_leaf': 769}. Best is trial 228 with value: 6892.65739148082.[0m
[32m[I 2024-10-13 06:00:44,548][0m Trial 352 finished with value: 11805.302736259033 and parameters: {'depth': 5, 'learning_rate': 0.20202986807344148, 'iterations': 542, 'l2_leaf_reg': 8.173627677796645e-07, 'border_count': 28, 'bagging_temperature': 0.9804196102051959, 'random_strength': 0.02540292647329434, 'grow_policy': 'SymmetricTree', 'min_data_in_leaf': 844}. Best is trial 228 with value: 6892.65739148082.[0m
[32m[I 2024-10-13 06:00:45,387][0m Trial 353 finished with value: 9729.531669596445 and parameters: {'depth': 6, 'learning_rate': 0.26582772726789305, 'iterations': 418, 'l2_leaf_reg': 1.41899526725578e-06, 'border_count': 31, 'bagging_temperature': 0.9598213826666765, 'random_strength': 0.45324536078821476, 'grow_policy': 'Depthwise', 'min_data_in_leaf': 725}. Best is trial 228 with value: 6892.65739148082.[0m
[32m[I 2024-10-13 06:00:46,382][0m Trial 354 finished with value: 9979.1451551877 and parameters: {'depth': 4, 'learning_rate': 0.2946391531947006, 'iterations': 465, 'l2_leaf_reg': 0.00016037597865475856, 'border_count': 30, 'bagging_temperature': 0.93161336038702, 'random_strength': 0.2513297053143497, 'grow_policy': 'SymmetricTree', 'min_data_in_leaf': 751}. Best is trial 228 with value: 6892.65739148082.[0m
[32m[I 2024-10-13 06:00:47,408][0m Trial 355 finished with value: 8762.583937123907 and parameters: {'depth': 5, 'learning_rate': 0.15602454487327752, 'iterations': 408, 'l2_leaf_reg': 4.940496367217314e-06, 'border_count': 24, 'bagging_temperature': 0.9024777777912719, 'random_strength': 0.5359167139001648, 'grow_policy': 'SymmetricTree', 'min_data_in_leaf': 709}. Best is trial 228 with value: 6892.65739148082.[0m
[32m[I 2024-10-13 06:00:49,951][0m Trial 356 finished with value: 10233.46920222445 and parameters: {'depth': 5, 'learning_rate': 0.1376380855754981, 'iterations': 517, 'l2_leaf_reg': 5.577017746758832e-07, 'border_count': 31, 'bagging_temperature': 0.9446428435682751, 'random_strength': 0.2777429513923995, 'grow_policy': 'SymmetricTree', 'min_data_in_leaf': 787}. Best is trial 228 with value: 6892.65739148082.[0m
[32m[I 2024-10-13 06:00:50,943][0m Trial 357 finished with value: 10201.67218791948 and parameters: {'depth': 5, 'learning_rate': 0.22696409413813867, 'iterations': 387, 'l2_leaf_reg': 9.54420161186524e-07, 'border_count': 23, 'bagging_temperature': 0.9785231104760843, 'random_strength': 0.638750153456137, 'grow_policy': 'SymmetricTree', 'min_data_in_leaf': 732}. Best is trial 228 with value: 6892.65739148082.[0m
[32m[I 2024-10-13 06:00:58,760][0m Trial 358 finished with value: 10383.201080289751 and parameters: {'depth': 6, 'learning_rate': 0.19255133042559774, 'iterations': 1565, 'l2_leaf_reg': 1.8288100041016823e-06, 'border_count': 43, 'bagging_temperature': 0.9147174516952885, 'random_strength': 0.004254232600974961, 'grow_policy': 'SymmetricTree', 'min_data_in_leaf': 764}. Best is trial 228 with value: 6892.65739148082.[0m
