[32m[I 2024-10-13 06:01:07,311][0m Trial 359 finished with value: 9140.15322736198 and parameters: {'depth': 4, 'learning_rate': 0.16434271913715276, 'iterations': 2408, 'l2_leaf_reg': 3.0319845468270108e-06, 'border_count': 52, 'bagging_temperature': 0.9601556189455496, 'random_strength': 0.4843143088221315, 'grow_policy': 'SymmetricTree', 'min_data_in_leaf': 707}. Best is trial 228 with value: 6892.65739148082.[0m
[32m[I 2024-10-13 06:01:08,438][0m Trial 360 finished with value: 10232.546832652599 and parameters: {'depth': 5, 'learning_rate': 0.13396375511065073, 'iterations': 492, 'l2_leaf_reg': 8.928640816702299e-06, 'border_count': 16, 'bagging_temperature': 0.8871765973254511, 'random_strength': 0.1902002144456728, 'grow_policy': 'SymmetricTree', 'min_data_in_leaf': 814}. Best is trial 228 with value: 6892.65739148082.[0m
[32m[I 2024-10-13 06:01:09,353][0m Trial 361 finished with value: 7282.652644497925 and parameters: {'depth': 5, 'learning_rate': 0.12024729506022826, 'iterations': 314, 'l2_leaf_reg': 1.4325374096271357e-06, 'border_count': 32, 'bagging_temperature': 0.9340612880522181, 'random_strength': 0.38034497171706505, 'grow_policy': 'SymmetricTree', 'min_data_in_leaf': 743}. Best is trial 228 with value: 6892.65739148082.[0m
[32m[I 2024-10-13 06:01:10,330][0m Trial 362 finished with value: 7986.827713585037 and parameters: {'depth': 5, 'learning_rate': 0.1443324391841516, 'iterations': 388, 'l2_leaf_reg': 1.301385756611574e-06, 'border_count': 28, 'bagging_temperature': 0.9503739150647033, 'random_strength': 0.39985968618317375, 'grow_policy': 'SymmetricTree', 'min_data_in_leaf': 744}. Best is trial 228 with value: 6892.65739148082.[0m
[32m[I 2024-10-13 06:01:11,247][0m Trial 363 finished with value: 8118.426743706282 and parameters: {'depth': 5, 'learning_rate': 0.1220785981838408, 'iterations': 328, 'l2_leaf_reg': 1.986470512509056e-06, 'border_count': 33, 'bagging_temperature': 0.9815877008460578, 'random_strength': 0.22689052936485649, 'grow_policy': 'SymmetricTree', 'min_data_in_leaf': 790}. Best is trial 228 with value: 6892.65739148082.[0m
[32m[I 2024-10-13 06:01:12,285][0m Trial 364 finished with value: 10040.764137004755 and parameters: {'depth': 6, 'learning_rate': 0.17359675573216762, 'iterations': 387, 'l2_leaf_reg': 3.0446120436157106e-06, 'border_count': 27, 'bagging_temperature': 0.9339382695127261, 'random_strength': 0.5512236022641175, 'grow_policy': 'SymmetricTree', 'min_data_in_leaf': 727}. Best is trial 228 with value: 6892.65739148082.[0m
[32m[I 2024-10-13 06:01:13,147][0m Trial 365 finished with value: 8417.260026456333 and parameters: {'depth': 4, 'learning_rate': 0.11894285502086262, 'iterations': 312, 'l2_leaf_reg': 4.1088486658155965e-07, 'border_count': 34, 'bagging_temperature': 0.9626255772092881, 'random_strength': 0.35518788964885817, 'grow_policy': 'SymmetricTree', 'min_data_in_leaf': 763}. Best is trial 228 with value: 6892.65739148082.[0m
[32m[I 2024-10-13 06:01:14,226][0m Trial 366 finished with value: 8154.867584690782 and parameters: {'depth': 5, 'learning_rate': 0.1464537343249213, 'iterations': 464, 'l2_leaf_reg': 6.559976755053413e-07, 'border_count': 24, 'bagging_temperature': 0.6121214276769888, 'random_strength': 0.17835724140030323, 'grow_policy': 'SymmetricTree', 'min_data_in_leaf': 751}. Best is trial 228 with value: 6892.65739148082.[0m
[32m[I 2024-10-13 06:01:14,999][0m Trial 367 finished with value: 7890.902682831255 and parameters: {'depth': 5, 'learning_rate': 0.11074795477662665, 'iterations': 191, 'l2_leaf_reg': 1.317251363347624e-06, 'border_count': 31, 'bagging_temperature': 0.9852997623594442, 'random_strength': 0.011501437463543263, 'grow_policy': 'SymmetricTree', 'min_data_in_leaf': 709}. Best is trial 228 with value: 6892.65739148082.[0m
[32m[I 2024-10-13 06:01:15,884][0m Trial 368 finished with value: 7234.149899443373 and parameters: {'depth': 5, 'learning_rate': 0.17133832938536903, 'iterations': 302, 'l2_leaf_reg': 2.2128582860831643e-06, 'border_count': 39, 'bagging_temperature': 0.9363299892825014, 'random_strength': 0.5952778477239413, 'grow_policy': 'SymmetricTree', 'min_data_in_leaf': 734}. Best is trial 228 with value: 6892.65739148082.[0m
[32m[I 2024-10-13 06:01:16,598][0m Trial 369 finished with value: 12097.558770398484 and parameters: {'depth': 6, 'learning_rate': 0.1877086771939284, 'iterations': 258, 'l2_leaf_reg': 4.095029998617699e-06, 'border_count': 46, 'bagging_temperature': 0.999641238846132, 'random_strength': 0.47295811776318253, 'grow_policy': 'Lossguide', 'min_data_in_leaf': 727, 'max_leaves': 176}. Best is trial 228 with value: 6892.65739148082.[0m
[32m[I 2024-10-13 06:01:19,697][0m Trial 370 finished with value: 9222.09701197731 and parameters: {'depth': 5, 'learning_rate': 0.23405658111346284, 'iterations': 689, 'l2_leaf_reg': 5.6584890288993395e-06, 'border_count': 38, 'bagging_temperature': 0.9611860880575692, 'random_strength': 0.6225534863037909, 'grow_policy': 'SymmetricTree', 'min_data_in_leaf': 684}. Best is trial 228 with value: 6892.65739148082.[0m
[32m[I 2024-10-13 06:01:20,721][0m Trial 371 finished with value: 10100.148379082531 and parameters: {'depth': 5, 'learning_rate': 0.18406003946312843, 'iterations': 391, 'l2_leaf_reg': 2.6850219509914693e-06, 'border_count': 77, 'bagging_temperature': 0.6731510916880514, 'random_strength': 0.3258364203955414, 'grow_policy': 'SymmetricTree', 'min_data_in_leaf': 738}. Best is trial 228 with value: 6892.65739148082.[0m
[32m[I 2024-10-13 06:01:21,477][0m Trial 372 finished with value: 7152.995103444995 and parameters: {'depth': 5, 'learning_rate': 0.15782239264056797, 'iterations': 193, 'l2_leaf_reg': 2.0361192489264578e-06, 'border_count': 41, 'bagging_temperature': 0.9425875632922917, 'random_strength': 0.584085335593407, 'grow_policy': 'SymmetricTree', 'min_data_in_leaf': 701}. Best is trial 228 with value: 6892.65739148082.[0m
[32m[I 2024-10-13 06:01:22,195][0m Trial 373 finished with value: 9255.041976143735 and parameters: {'depth': 4, 'learning_rate': 0.16675676148234095, 'iterations': 186, 'l2_leaf_reg': 1.9643499911102796e-06, 'border_count': 20, 'bagging_temperature': 0.9461060661373895, 'random_strength': 0.6047760860081189, 'grow_policy': 'SymmetricTree', 'min_data_in_leaf': 720}. Best is trial 228 with value: 6892.65739148082.[0m
[32m[I 2024-10-13 06:01:22,914][0m Trial 374 finished with value: 6012.54835621459 and parameters: {'depth': 5, 'learning_rate': 0.2075852692518764, 'iterations': 137, 'l2_leaf_reg': 3.2330001920511977e-06, 'border_count': 31, 'bagging_temperature': 0.9693674422121655, 'random_strength': 0.3495922714960325, 'grow_policy': 'SymmetricTree', 'min_data_in_leaf': 778}. Best is trial 374 with value: 6012.54835621459.[0m
[32m[I 2024-10-13 06:01:23,619][0m Trial 375 finished with value: 6294.258345057955 and parameters: {'depth': 5, 'learning_rate': 0.2290880519820636, 'iterations': 106, 'l2_leaf_reg': 3.9075678266074535e-06, 'border_count': 28, 'bagging_temperature': 0.9806883060015156, 'random_strength': 0.1868027112349864, 'grow_policy': 'SymmetricTree', 'min_data_in_leaf': 779}. Best is trial 374 with value: 6012.54835621459.[0m
[32m[I 2024-10-13 06:01:24,261][0m Trial 376 finished with value: 13111.351480104777 and parameters: {'depth': 5, 'learning_rate': 0.21200593459713704, 'iterations': 131, 'l2_leaf_reg': 1.2122042502013771e-05, 'border_count': 16, 'bagging_temperature': 0.9730596782237209, 'random_strength': 0.38920314585598903, 'grow_policy': 'Depthwise', 'min_data_in_leaf': 824}. Best is trial 374 with value: 6012.54835621459.[0m
[32m[I 2024-10-13 06:01:24,964][0m Trial 377 finished with value: 8621.256823896916 and parameters: {'depth': 4, 'learning_rate': 0.2578403892942378, 'iterations': 101, 'l2_leaf_reg': 6.616630259674752e-06, 'border_count': 25, 'bagging_temperature': 0.9851402264461593, 'random_strength': 0.1735319648264435, 'grow_policy': 'SymmetricTree', 'min_data_in_leaf': 796}. Best is trial 374 with value: 6012.54835621459.[0m
[32m[I 2024-10-13 06:01:30,294][0m Trial 378 finished with value: 11108.644051472047 and parameters: {'depth': 5, 'learning_rate': 0.23641793327162114, 'iterations': 1267, 'l2_leaf_reg': 4.893355733141311e-06, 'border_count': 30, 'bagging_temperature': 0.9852085941781576, 'random_strength': 0.0020501953302397846, 'grow_policy': 'SymmetricTree', 'min_data_in_leaf': 780}. Best is trial 374 with value: 6012.54835621459.[0m
[32m[I 2024-10-13 06:01:30,983][0m Trial 379 finished with value: 7719.201592928175 and parameters: {'depth': 5, 'learning_rate': 0.1991863909906736, 'iterations': 120, 'l2_leaf_reg': 4.203104768395467e-06, 'border_count': 20, 'bagging_temperature': 0.9591505356474032, 'random_strength': 0.3844570734232537, 'grow_policy': 'SymmetricTree', 'min_data_in_leaf': 801}. Best is trial 374 with value: 6012.54835621459.[0m
[32m[I 2024-10-13 06:01:31,744][0m Trial 380 finished with value: 9463.177052862336 and parameters: {'depth': 5, 'learning_rate': 0.28577783463718087, 'iterations': 177, 'l2_leaf_reg': 2.9919603551105803e-06, 'border_count': 27, 'bagging_temperature': 0.9692098655859824, 'random_strength': 0.5466714525227269, 'grow_policy': 'SymmetricTree', 'min_data_in_leaf': 840}. Best is trial 374 with value: 6012.54835621459.[0m
[32m[I 2024-10-13 06:01:32,493][0m Trial 381 finished with value: 8296.30282070019 and parameters: {'depth': 6, 'learning_rate': 0.1944279726887197, 'iterations': 157, 'l2_leaf_reg': 3.497253899171523e-06, 'border_count': 32, 'bagging_temperature': 0.996070727340258, 'random_strength': 0.18358429348227567, 'grow_policy': 'SymmetricTree', 'min_data_in_leaf': 777}. Best is trial 374 with value: 6012.54835621459.[0m
[32m[I 2024-10-13 06:01:33,166][0m Trial 382 finished with value: 10148.496288692157 and parameters: {'depth': 5, 'learning_rate': 0.22602722928508512, 'iterations': 115, 'l2_leaf_reg': 9.159917585198426e-06, 'border_count': 23, 'bagging_temperature': 0.9495181236253624, 'random_strength': 0.6770938300381043, 'grow_policy': 'SymmetricTree', 'min_data_in_leaf': 768}. Best is trial 374 with value: 6012.54835621459.[0m
[32m[I 2024-10-13 06:01:33,935][0m Trial 383 finished with value: 7778.0132320954535 and parameters: {'depth': 5, 'learning_rate': 0.15402520470797015, 'iterations': 193, 'l2_leaf_reg': 2.3738583018947087e-06, 'border_count': 40, 'bagging_temperature': 0.9179841436434178, 'random_strength': 0.4310016418632875, 'grow_policy': 'SymmetricTree', 'min_data_in_leaf': 746}. Best is trial 374 with value: 6012.54835621459.[0m
[32m[I 2024-10-13 06:01:34,750][0m Trial 384 finished with value: 14055.97018471844 and parameters: {'depth': 6, 'learning_rate': 0.17267635906388903, 'iterations': 206, 'l2_leaf_reg': 5.126627577323149e-06, 'border_count': 48, 'bagging_temperature': 0.968546806265731, 'random_strength': 0.2640101871279248, 'grow_policy': 'SymmetricTree', 'min_data_in_leaf': 705}. Best is trial 374 with value: 6012.54835621459.[0m
[32m[I 2024-10-13 06:01:37,358][0m Trial 385 finished with value: 8242.826443657985 and parameters: {'depth': 5, 'learning_rate': 0.21737502209978934, 'iterations': 559, 'l2_leaf_reg': 2.166265698526181e-06, 'border_count': 30, 'bagging_temperature': 0.9416011408186785, 'random_strength': 0.6038188377190984, 'grow_policy': 'SymmetricTree', 'min_data_in_leaf': 811}. Best is trial 374 with value: 6012.54835621459.[0m
[32m[I 2024-10-13 06:01:38,094][0m Trial 386 finished with value: 10223.413880582904 and parameters: {'depth': 5, 'learning_rate': 0.14485360986866416, 'iterations': 173, 'l2_leaf_reg': 9.275402771153877e-05, 'border_count': 17, 'bagging_temperature': 0.9827789144063366, 'random_strength': 0.1570954505182329, 'grow_policy': 'SymmetricTree', 'min_data_in_leaf': 779}. Best is trial 374 with value: 6012.54835621459.[0m
[32m[I 2024-10-13 06:01:38,973][0m Trial 387 finished with value: 8401.979378517613 and parameters: {'depth': 5, 'learning_rate': 0.18257468923035186, 'iterations': 285, 'l2_leaf_reg': 1.6809463464935695e-06, 'border_count': 43, 'bagging_temperature': 0.8977002575775759, 'random_strength': 0.3892322852329942, 'grow_policy': 'SymmetricTree', 'min_data_in_leaf': 725}. Best is trial 374 with value: 6012.54835621459.[0m
[32m[I 2024-10-13 06:01:39,681][0m Trial 388 finished with value: 7575.104710806025 and parameters: {'depth': 5, 'learning_rate': 0.16242585145842417, 'iterations': 123, 'l2_leaf_reg': 3.4418826157225705e-06, 'border_count': 35, 'bagging_temperature': 0.9559125788535338, 'random_strength': 0.023087294014053628, 'grow_policy': 'SymmetricTree', 'min_data_in_leaf': 748}. Best is trial 374 with value: 6012.54835621459.[0m
[32m[I 2024-10-13 06:01:40,338][0m Trial 389 finished with value: 8632.478089013546 and parameters: {'depth': 4, 'learning_rate': 0.16035276030334153, 'iterations': 125, 'l2_leaf_reg': 6.341113427997578e-06, 'border_count': 27, 'bagging_temperature': 0.9340147301549769, 'random_strength': 0.022913999290286424, 'grow_policy': 'SymmetricTree', 'min_data_in_leaf': 758}. Best is trial 374 with value: 6012.54835621459.[0m
[32m[I 2024-10-13 06:01:41,023][0m Trial 390 finished with value: 9375.768423607598 and parameters: {'depth': 5, 'learning_rate': 0.21112558545617893, 'iterations': 106, 'l2_leaf_reg': 4.057393740044674e-06, 'border_count': 34, 'bagging_temperature': 0.9997403621007389, 'random_strength': 8.61125897931967, 'grow_policy': 'SymmetricTree', 'min_data_in_leaf': 745}. Best is trial 374 with value: 6012.54835621459.[0m
[32m[I 2024-10-13 06:01:41,669][0m Trial 391 finished with value: 7788.230069246717 and parameters: {'depth': 5, 'learning_rate': 0.1384039958002329, 'iterations': 101, 'l2_leaf_reg': 3.044636509751774e-06, 'border_count': 24, 'bagging_temperature': 0.9132547115847917, 'random_strength': 0.1787502042906448, 'grow_policy': 'SymmetricTree', 'min_data_in_leaf': 794}. Best is trial 374 with value: 6012.54835621459.[0m
[32m[I 2024-10-13 06:01:42,453][0m Trial 392 finished with value: 7267.034213321337 and parameters: {'depth': 6, 'learning_rate': 0.24357730515088868, 'iterations': 188, 'l2_leaf_reg': 2.3759146209543928e-06, 'border_count': 37, 'bagging_temperature': 0.9534252783562633, 'random_strength': 0.2984686779529899, 'grow_policy': 'SymmetricTree', 'min_data_in_leaf': 769}. Best is trial 374 with value: 6012.54835621459.[0m
[32m[I 2024-10-13 06:01:43,174][0m Trial 393 finished with value: 10069.063789148422 and parameters: {'depth': 4, 'learning_rate': 0.28470469517363645, 'iterations': 208, 'l2_leaf_reg': 7.088572818728397e-06, 'border_count': 31, 'bagging_temperature': 0.9549969519156243, 'random_strength': 0.03318865526455003, 'grow_policy': 'Lossguide', 'min_data_in_leaf': 783, 'max_leaves': 127}. Best is trial 374 with value: 6012.54835621459.[0m
[32m[I 2024-10-13 06:01:44,003][0m Trial 394 finished with value: 7955.397822610045 and parameters: {'depth': 6, 'learning_rate': 0.21525247791166258, 'iterations': 180, 'l2_leaf_reg': 2.618612234837723e-06, 'border_count': 35, 'bagging_temperature': 0.9773685353706398, 'random_strength': 0.32267603583110993, 'grow_policy': 'SymmetricTree', 'min_data_in_leaf': 873}. Best is trial 374 with value: 6012.54835621459.[0m
[32m[I 2024-10-13 06:01:44,685][0m Trial 395 finished with value: 10762.564366768223 and parameters: {'depth': 6, 'learning_rate': 0.25748332331352475, 'iterations': 102, 'l2_leaf_reg': 4.8615672952623505e-06, 'border_count': 21, 'bagging_temperature': 0.9540928636670378, 'random_strength': 0.17677911646108813, 'grow_policy': 'SymmetricTree', 'min_data_in_leaf': 760}. Best is trial 374 with value: 6012.54835621459.[0m
[32m[I 2024-10-13 06:01:45,453][0m Trial 396 finished with value: 12165.06960406231 and parameters: {'depth': 5, 'learning_rate': 0.25924540598843104, 'iterations': 171, 'l2_leaf_reg': 2.12851684570082e-06, 'border_count': 173, 'bagging_temperature': 0.9675014970296307, 'random_strength': 0.29630541999760723, 'grow_policy': 'SymmetricTree', 'min_data_in_leaf': 808}. Best is trial 374 with value: 6012.54835621459.[0m
[32m[I 2024-10-13 06:01:46,171][0m Trial 397 finished with value: 14021.30876341412 and parameters: {'depth': 4, 'learning_rate': 0.18839385188290053, 'iterations': 169, 'l2_leaf_reg': 1.6256015714332902e-06, 'border_count': 86, 'bagging_temperature': 0.9419095474885163, 'random_strength': 0.7483021084469439, 'grow_policy': 'SymmetricTree', 'min_data_in_leaf': 770}. Best is trial 374 with value: 6012.54835621459.[0m
[32m[I 2024-10-13 06:01:46,997][0m Trial 398 finished with value: 8886.638264500063 and parameters: {'depth': 5, 'learning_rate': 0.23319266659741023, 'iterations': 236, 'l2_leaf_reg': 3.4818789146230885e-06, 'border_count': 10, 'bagging_temperature': 0.9720856164302266, 'random_strength': 0.02118036729845446, 'grow_policy': 'SymmetricTree', 'min_data_in_leaf': 749}. Best is trial 374 with value: 6012.54835621459.[0m
[32m[I 2024-10-13 06:01:49,056][0m Trial 399 finished with value: 12264.36187320119 and parameters: {'depth': 6, 'learning_rate': 0.0031654974780997457, 'iterations': 1999, 'l2_leaf_reg': 2.6043336318533564e-06, 'border_count': 29, 'bagging_temperature': 0.9849940003141814, 'random_strength': 0.325444876529506, 'grow_policy': 'Depthwise', 'min_data_in_leaf': 734}. Best is trial 374 with value: 6012.54835621459.[0m
[32m[I 2024-10-13 06:01:49,899][0m Trial 400 finished with value: 7194.322351951091 and parameters: {'depth': 5, 'learning_rate': 0.172475588046271, 'iterations': 269, 'l2_leaf_reg': 9.291740059465014e-06, 'border_count': 36, 'bagging_temperature': 0.9183910088721862, 'random_strength': 0.008850429561448825, 'grow_policy': 'SymmetricTree', 'min_data_in_leaf': 782}. Best is trial 374 with value: 6012.54835621459.[0m
[32m[I 2024-10-13 06:01:50,786][0m Trial 401 finished with value: 6808.353250605231 and parameters: {'depth': 5, 'learning_rate': 0.16542985367626092, 'iterations': 262, 'l2_leaf_reg': 9.416326432854073e-06, 'border_count': 37, 'bagging_temperature': 0.8964916934087239, 'random_strength': 0.13191325488831476, 'grow_policy': 'SymmetricTree', 'min_data_in_leaf': 797}. Best is trial 374 with value: 6012.54835621459.[0m
[32m[I 2024-10-13 06:01:51,517][0m Trial 402 finished with value: 7379.417175190676 and parameters: {'depth': 5, 'learning_rate': 0.1672936467501633, 'iterations': 199, 'l2_leaf_reg': 2.1444504827064968e-05, 'border_count': 39, 'bagging_temperature': 0.8775036380063258, 'random_strength': 0.009655479690902672, 'grow_policy': 'SymmetricTree', 'min_data_in_leaf': 823}. Best is trial 374 with value: 6012.54835621459.[0m
[32m[I 2024-10-13 06:01:52,216][0m Trial 403 finished with value: 9463.666177640402 and parameters: {'depth': 4, 'learning_rate': 0.1752269015308315, 'iterations': 166, 'l2_leaf_reg': 1.4615866058928347e-05, 'border_count': 50, 'bagging_temperature': 0.866743803204729, 'random_strength': 0.026930249028249614, 'grow_policy': 'SymmetricTree', 'min_data_in_leaf': 853}. Best is trial 374 with value: 6012.54835621459.[0m
[32m[I 2024-10-13 06:01:53,052][0m Trial 404 finished with value: 10031.824139202232 and parameters: {'depth': 5, 'learning_rate': 0.1766909328379738, 'iterations': 249, 'l2_leaf_reg': 0.0003109621785798384, 'border_count': 45, 'bagging_temperature': 0.9010951518273087, 'random_strength': 0.04520700258177785, 'grow_policy': 'SymmetricTree', 'min_data_in_leaf': 831}. Best is trial 374 with value: 6012.54835621459.[0m
[32m[I 2024-10-13 06:02:03,494][0m Trial 405 finished with value: 10134.304131234583 and parameters: {'depth': 5, 'learning_rate': 0.1573913078653789, 'iterations': 2609, 'l2_leaf_reg': 1.4833389395569678e-05, 'border_count': 66, 'bagging_temperature': 0.85644125384215, 'random_strength': 0.1757440214698191, 'grow_policy': 'SymmetricTree', 'min_data_in_leaf': 868}. Best is trial 374 with value: 6012.54835621459.[0m
[32m[I 2024-10-13 06:02:04,239][0m Trial 406 finished with value: 8868.486888755373 and parameters: {'depth': 6, 'learning_rate': 0.16420897648931562, 'iterations': 161, 'l2_leaf_reg': 1.2085199792113899e-05, 'border_count': 40, 'bagging_temperature': 0.8932137136702556, 'random_strength': 0.013174998884077804, 'grow_policy': 'SymmetricTree', 'min_data_in_leaf': 829}. Best is trial 374 with value: 6012.54835621459.[0m
[32m[I 2024-10-13 06:02:05,112][0m Trial 407 finished with value: 9227.433625012807 and parameters: {'depth': 5, 'learning_rate': 0.2344961010671296, 'iterations': 262, 'l2_leaf_reg': 5.440278302002111e-06, 'border_count': 39, 'bagging_temperature': 0.0006753121206898305, 'random_strength': 2.2414184284058614e-05, 'grow_policy': 'SymmetricTree', 'min_data_in_leaf': 808}. Best is trial 374 with value: 6012.54835621459.[0m
[32m[I 2024-10-13 06:02:05,879][0m Trial 408 finished with value: 8664.408412972234 and parameters: {'depth': 5, 'learning_rate': 0.18906243740560144, 'iterations': 200, 'l2_leaf_reg': 8.763775109366623e-06, 'border_count': 53, 'bagging_temperature': 0.8834551774143369, 'random_strength': 0.3608840763000274, 'grow_policy': 'SymmetricTree', 'min_data_in_leaf': 815}. Best is trial 374 with value: 6012.54835621459.[0m
[32m[I 2024-10-13 06:02:06,723][0m Trial 409 finished with value: 9109.014647413283 and parameters: {'depth': 5, 'learning_rate': 0.15269654086007659, 'iterations': 266, 'l2_leaf_reg': 9.119815164137224e-06, 'border_count': 47, 'bagging_temperature': 0.8681400244383681, 'random_strength': 0.4239757938939203, 'grow_policy': 'SymmetricTree', 'min_data_in_leaf': 791}. Best is trial 374 with value: 6012.54835621459.[0m
