[32m[I 2024-10-13 06:04:30,474][0m Trial 513 finished with value: 7819.058191013824 and parameters: {'depth': 5, 'learning_rate': 0.2613496185228605, 'iterations': 277, 'l2_leaf_reg': 6.937156847713587e-06, 'border_count': 37, 'bagging_temperature': 0.5322239001865227, 'random_strength': 0.838895454540061, 'grow_policy': 'SymmetricTree', 'min_data_in_leaf': 962}. Best is trial 374 with value: 6012.54835621459.[0m
[32m[I 2024-10-13 06:04:31,290][0m Trial 514 finished with value: 9932.617980161194 and parameters: {'depth': 6, 'learning_rate': 0.1459953173054564, 'iterations': 393, 'l2_leaf_reg': 1.6570798683375202e-06, 'border_count': 28, 'bagging_temperature': 0.8902070300532202, 'random_strength': 0.22003106487077506, 'grow_policy': 'Depthwise', 'min_data_in_leaf': 757}. Best is trial 374 with value: 6012.54835621459.[0m
[32m[I 2024-10-13 06:04:32,032][0m Trial 515 finished with value: 11198.57744657685 and parameters: {'depth': 4, 'learning_rate': 0.2123223122606436, 'iterations': 170, 'l2_leaf_reg': 1.678913573971186e-05, 'border_count': 42, 'bagging_temperature': 0.8445281112243967, 'random_strength': 0.4202998267110642, 'grow_policy': 'SymmetricTree', 'min_data_in_leaf': 796}. Best is trial 374 with value: 6012.54835621459.[0m
[32m[I 2024-10-13 06:04:33,007][0m Trial 516 finished with value: 7270.845131205327 and parameters: {'depth': 5, 'learning_rate': 0.11152969310872632, 'iterations': 327, 'l2_leaf_reg': 5.21088635240452e-06, 'border_count': 32, 'bagging_temperature': 0.9433602568249693, 'random_strength': 0.6077016234535699, 'grow_policy': 'SymmetricTree', 'min_data_in_leaf': 664}. Best is trial 374 with value: 6012.54835621459.[0m
[32m[I 2024-10-13 06:04:33,930][0m Trial 517 finished with value: 8215.628861244428 and parameters: {'depth': 5, 'learning_rate': 0.09880620882091393, 'iterations': 347, 'l2_leaf_reg': 0.00010447719982052612, 'border_count': 23, 'bagging_temperature': 0.9509600121353627, 'random_strength': 1.0934609079243516, 'grow_policy': 'SymmetricTree', 'min_data_in_leaf': 704}. Best is trial 374 with value: 6012.54835621459.[0m
[32m[I 2024-10-13 06:04:35,077][0m Trial 518 finished with value: 8507.050412730168 and parameters: {'depth': 6, 'learning_rate': 0.11201049517923696, 'iterations': 409, 'l2_leaf_reg': 4.675348238210457e-06, 'border_count': 32, 'bagging_temperature': 0.9315145162368466, 'random_strength': 0.18954515276311934, 'grow_policy': 'SymmetricTree', 'min_data_in_leaf': 872}. Best is trial 374 with value: 6012.54835621459.[0m
[32m[I 2024-10-13 06:04:36,013][0m Trial 519 finished with value: 8601.764018568509 and parameters: {'depth': 5, 'learning_rate': 0.10501352685725408, 'iterations': 340, 'l2_leaf_reg': 6.154149705402726e-06, 'border_count': 19, 'bagging_temperature': 0.9575354832146323, 'random_strength': 0.7650612595373498, 'grow_policy': 'SymmetricTree', 'min_data_in_leaf': 901}. Best is trial 374 with value: 6012.54835621459.[0m
[32m[I 2024-10-13 06:04:36,897][0m Trial 520 finished with value: 7426.472482348452 and parameters: {'depth': 5, 'learning_rate': 0.11543302803952028, 'iterations': 292, 'l2_leaf_reg': 9.714209248008198e-06, 'border_count': 27, 'bagging_temperature': 0.9135457421147574, 'random_strength': 0.007957724749109218, 'grow_policy': 'SymmetricTree', 'min_data_in_leaf': 729}. Best is trial 374 with value: 6012.54835621459.[0m
[32m[I 2024-10-13 06:04:37,823][0m Trial 521 finished with value: 9487.471785537211 and parameters: {'depth': 4, 'learning_rate': 0.12679528368924442, 'iterations': 389, 'l2_leaf_reg': 2.962120406137297e-06, 'border_count': 32, 'bagging_temperature': 0.03230099232493955, 'random_strength': 0.408848711249307, 'grow_policy': 'SymmetricTree', 'min_data_in_leaf': 819}. Best is trial 374 with value: 6012.54835621459.[0m
[32m[I 2024-10-13 06:04:38,699][0m Trial 522 finished with value: 7374.715241295353 and parameters: {'depth': 5, 'learning_rate': 0.09479634651513139, 'iterations': 291, 'l2_leaf_reg': 3.4491481114840775e-06, 'border_count': 35, 'bagging_temperature': 0.9366113141876562, 'random_strength': 0.9210778685863765, 'grow_policy': 'SymmetricTree', 'min_data_in_leaf': 665}. Best is trial 374 with value: 6012.54835621459.[0m
[32m[I 2024-10-13 06:04:39,510][0m Trial 523 finished with value: 21928.92220724754 and parameters: {'depth': 5, 'learning_rate': 0.00048557419605002854, 'iterations': 225, 'l2_leaf_reg': 5.49464871756612e-06, 'border_count': 25, 'bagging_temperature': 0.8746581829122011, 'random_strength': 0.6072112554662281, 'grow_policy': 'SymmetricTree', 'min_data_in_leaf': 692}. Best is trial 374 with value: 6012.54835621459.[0m
[32m[I 2024-10-13 06:04:40,231][0m Trial 524 finished with value: 8432.177671094352 and parameters: {'depth': 4, 'learning_rate': 0.15140497576012837, 'iterations': 153, 'l2_leaf_reg': 1.5816397300069153e-06, 'border_count': 32, 'bagging_temperature': 0.9014808301306021, 'random_strength': 0.3061429269147933, 'grow_policy': 'SymmetricTree', 'min_data_in_leaf': 771}. Best is trial 374 with value: 6012.54835621459.[0m
[32m[I 2024-10-13 06:04:41,261][0m Trial 525 finished with value: 9367.687161544205 and parameters: {'depth': 6, 'learning_rate': 0.12584105205049684, 'iterations': 348, 'l2_leaf_reg': 8.80802039595142e-06, 'border_count': 37, 'bagging_temperature': 0.9558035851540204, 'random_strength': 0.20456986299351002, 'grow_policy': 'SymmetricTree', 'min_data_in_leaf': 858}. Best is trial 374 with value: 6012.54835621459.[0m
[32m[I 2024-10-13 06:04:41,923][0m Trial 526 finished with value: 8645.455695827246 and parameters: {'depth': 5, 'learning_rate': 0.25236559381446255, 'iterations': 101, 'l2_leaf_reg': 2.5632200738326628e-06, 'border_count': 28, 'bagging_temperature': 0.9195435275395166, 'random_strength': 0.6864667667884542, 'grow_policy': 'SymmetricTree', 'min_data_in_leaf': 740}. Best is trial 374 with value: 6012.54835621459.[0m
[32m[I 2024-10-13 06:04:42,735][0m Trial 527 finished with value: 9636.473543434395 and parameters: {'depth': 5, 'learning_rate': 0.10174423187894792, 'iterations': 240, 'l2_leaf_reg': 1.5070471057659823e-05, 'border_count': 20, 'bagging_temperature': 0.9379139293008716, 'random_strength': 0.4585158103675232, 'grow_policy': 'SymmetricTree', 'min_data_in_leaf': 717}. Best is trial 374 with value: 6012.54835621459.[0m
[32m[I 2024-10-13 06:04:43,713][0m Trial 528 finished with value: 22786.346657206614 and parameters: {'depth': 6, 'learning_rate': 0.0001044775826945976, 'iterations': 333, 'l2_leaf_reg': 5.008497852066243e-06, 'border_count': 46, 'bagging_temperature': 0.9053358604167097, 'random_strength': 0.15524346264196, 'grow_policy': 'SymmetricTree', 'min_data_in_leaf': 794}. Best is trial 374 with value: 6012.54835621459.[0m
[32m[I 2024-10-13 06:04:44,487][0m Trial 529 finished with value: 14346.132898646389 and parameters: {'depth': 5, 'learning_rate': 0.005808459796886817, 'iterations': 198, 'l2_leaf_reg': 2.1964922293301384e-06, 'border_count': 36, 'bagging_temperature': 0.9560042150893587, 'random_strength': 0.482258394008385, 'grow_policy': 'SymmetricTree', 'min_data_in_leaf': 758}. Best is trial 374 with value: 6012.54835621459.[0m
[32m[I 2024-10-13 06:04:45,243][0m Trial 530 finished with value: 10217.07241404992 and parameters: {'depth': 5, 'learning_rate': 0.14751603804369612, 'iterations': 277, 'l2_leaf_reg': 3.811374089015891e-05, 'border_count': 32, 'bagging_temperature': 0.998343140315113, 'random_strength': 0.9674978380981046, 'grow_policy': 'Lossguide', 'min_data_in_leaf': 669, 'max_leaves': 95}. Best is trial 374 with value: 6012.54835621459.[0m
[32m[I 2024-10-13 06:04:46,283][0m Trial 531 finished with value: 9825.838702903675 and parameters: {'depth': 5, 'learning_rate': 0.21876296752567598, 'iterations': 422, 'l2_leaf_reg': 9.48541553449787e-06, 'border_count': 14, 'bagging_temperature': 0.8881144493648276, 'random_strength': 0.013259280622626768, 'grow_policy': 'SymmetricTree', 'min_data_in_leaf': 819}. Best is trial 374 with value: 6012.54835621459.[0m
[32m[I 2024-10-13 06:04:47,047][0m Trial 532 finished with value: 7533.248087403723 and parameters: {'depth': 5, 'learning_rate': 0.11585056016537078, 'iterations': 154, 'l2_leaf_reg': 1.3774603046365359e-06, 'border_count': 39, 'bagging_temperature': 0.9219406592412742, 'random_strength': 0.7313411220186172, 'grow_policy': 'SymmetricTree', 'min_data_in_leaf': 931}. Best is trial 374 with value: 6012.54835621459.[0m
[32m[I 2024-10-13 06:04:47,871][0m Trial 533 finished with value: 10371.081197239728 and parameters: {'depth': 3, 'learning_rate': 0.17936960263554527, 'iterations': 303, 'l2_leaf_reg': 3.7626619580214946e-06, 'border_count': 25, 'bagging_temperature': 0.9648464043781056, 'random_strength': 0.32227740970967056, 'grow_policy': 'SymmetricTree', 'min_data_in_leaf': 883}. Best is trial 374 with value: 6012.54835621459.[0m
[32m[I 2024-10-13 06:04:48,681][0m Trial 534 finished with value: 10136.082379984715 and parameters: {'depth': 5, 'learning_rate': 0.2578115044767115, 'iterations': 223, 'l2_leaf_reg': 7.475132764308342e-06, 'border_count': 56, 'bagging_temperature': 0.8633029000853961, 'random_strength': 0.5862745725926548, 'grow_policy': 'SymmetricTree', 'min_data_in_leaf': 702}. Best is trial 374 with value: 6012.54835621459.[0m
[32m[I 2024-10-13 06:04:49,650][0m Trial 535 finished with value: 12227.920442634173 and parameters: {'depth': 5, 'learning_rate': 0.09052236145801051, 'iterations': 358, 'l2_leaf_reg': 2.231883105360997e-06, 'border_count': 44, 'bagging_temperature': 0.9399998069063846, 'random_strength': 5.71165963068073, 'grow_policy': 'SymmetricTree', 'min_data_in_leaf': 789}. Best is trial 374 with value: 6012.54835621459.[0m
[32m[I 2024-10-13 06:04:50,448][0m Trial 536 finished with value: 8502.915850758789 and parameters: {'depth': 4, 'learning_rate': 0.1437267905304583, 'iterations': 248, 'l2_leaf_reg': 2.343977463946679e-05, 'border_count': 29, 'bagging_temperature': 0.8983488185838691, 'random_strength': 0.329492849193492, 'grow_policy': 'SymmetricTree', 'min_data_in_leaf': 741}. Best is trial 374 with value: 6012.54835621459.[0m
[32m[I 2024-10-13 06:04:51,207][0m Trial 537 finished with value: 10758.403618022507 and parameters: {'depth': 5, 'learning_rate': 0.1251969341262482, 'iterations': 184, 'l2_leaf_reg': 3.909272025164684e-06, 'border_count': 119, 'bagging_temperature': 0.9235675185560184, 'random_strength': 0.1798400144408647, 'grow_policy': 'SymmetricTree', 'min_data_in_leaf': 835}. Best is trial 374 with value: 6012.54835621459.[0m
[32m[I 2024-10-13 06:05:01,265][0m Trial 538 finished with value: 11693.083410179283 and parameters: {'depth': 6, 'learning_rate': 0.20532565011627207, 'iterations': 2131, 'l2_leaf_reg': 1.0876844700230609e-05, 'border_count': 37, 'bagging_temperature': 0.8748227541024083, 'random_strength': 0.004849329969469629, 'grow_policy': 'SymmetricTree', 'min_data_in_leaf': 901}. Best is trial 374 with value: 6012.54835621459.[0m
[32m[I 2024-10-13 06:05:02,036][0m Trial 539 finished with value: 14217.849135167375 and parameters: {'depth': 5, 'learning_rate': 0.1698427880333932, 'iterations': 311, 'l2_leaf_reg': 5.673443369826324e-06, 'border_count': 50, 'bagging_temperature': 0.9606066105265202, 'random_strength': 0.5027597539535953, 'grow_policy': 'Depthwise', 'min_data_in_leaf': 859}. Best is trial 374 with value: 6012.54835621459.[0m
[32m[I 2024-10-13 06:05:02,759][0m Trial 540 finished with value: 9766.577971454028 and parameters: {'depth': 5, 'learning_rate': 0.11047758289545995, 'iterations': 147, 'l2_leaf_reg': 1.4407350675792181e-06, 'border_count': 42, 'bagging_temperature': 0.981912162939108, 'random_strength': 1.1692730031191179, 'grow_policy': 'SymmetricTree', 'min_data_in_leaf': 685}. Best is trial 374 with value: 6012.54835621459.[0m
[32m[I 2024-10-13 06:05:03,772][0m Trial 541 finished with value: 9953.506092052405 and parameters: {'depth': 5, 'learning_rate': 0.2898241514787854, 'iterations': 411, 'l2_leaf_reg': 2.9418872151135944e-06, 'border_count': 32, 'bagging_temperature': 0.9436824786922082, 'random_strength': 0.8378473051445873, 'grow_policy': 'SymmetricTree', 'min_data_in_leaf': 779}. Best is trial 374 with value: 6012.54835621459.[0m
[32m[I 2024-10-13 06:05:04,611][0m Trial 542 finished with value: 9876.773743813737 and parameters: {'depth': 4, 'learning_rate': 0.15371108897126798, 'iterations': 261, 'l2_leaf_reg': 6.642191975267582e-05, 'border_count': 21, 'bagging_temperature': 0.9026546488688715, 'random_strength': 0.3455099435440042, 'grow_policy': 'SymmetricTree', 'min_data_in_leaf': 762}. Best is trial 374 with value: 6012.54835621459.[0m
[32m[I 2024-10-13 06:05:05,387][0m Trial 543 finished with value: 10144.025302219881 and parameters: {'depth': 5, 'learning_rate': 0.23881399015650384, 'iterations': 198, 'l2_leaf_reg': 1.7071042008894762e-05, 'border_count': 46, 'bagging_temperature': 0.8461915500051967, 'random_strength': 0.6654788419554432, 'grow_policy': 'SymmetricTree', 'min_data_in_leaf': 808}. Best is trial 374 with value: 6012.54835621459.[0m
[32m[I 2024-10-13 06:05:06,316][0m Trial 544 finished with value: 10118.633062435412 and parameters: {'depth': 5, 'learning_rate': 0.1959798991311389, 'iterations': 325, 'l2_leaf_reg': 6.635383812370668e-06, 'border_count': 136, 'bagging_temperature': 0.9228233788165193, 'random_strength': 0.16458524361606333, 'grow_policy': 'SymmetricTree', 'min_data_in_leaf': 920}. Best is trial 374 with value: 6012.54835621459.[0m
[32m[I 2024-10-13 06:05:07,023][0m Trial 545 finished with value: 11036.347220914102 and parameters: {'depth': 5, 'learning_rate': 0.12839350938326502, 'iterations': 104, 'l2_leaf_reg': 2.0142375418946835e-06, 'border_count': 104, 'bagging_temperature': 0.8846053933696842, 'random_strength': 0.4401105345412253, 'grow_policy': 'SymmetricTree', 'min_data_in_leaf': 722}. Best is trial 374 with value: 6012.54835621459.[0m
[32m[I 2024-10-13 06:05:07,934][0m Trial 546 finished with value: 8609.43563851793 and parameters: {'depth': 6, 'learning_rate': 0.09380148568433093, 'iterations': 264, 'l2_leaf_reg': 3.5513002502075807e-06, 'border_count': 38, 'bagging_temperature': 0.9450716095842033, 'random_strength': 0.6814563103882576, 'grow_policy': 'SymmetricTree', 'min_data_in_leaf': 838}. Best is trial 374 with value: 6012.54835621459.[0m
[32m[I 2024-10-13 06:05:08,968][0m Trial 547 finished with value: 7696.873533775507 and parameters: {'depth': 5, 'learning_rate': 0.1674062299725529, 'iterations': 390, 'l2_leaf_reg': 1.3430692952114105e-06, 'border_count': 28, 'bagging_temperature': 0.999850673415537, 'random_strength': 0.0015862440804650935, 'grow_policy': 'SymmetricTree', 'min_data_in_leaf': 881}. Best is trial 374 with value: 6012.54835621459.[0m
[32m[I 2024-10-13 06:05:09,723][0m Trial 548 finished with value: 7109.743050870733 and parameters: {'depth': 4, 'learning_rate': 0.21828546840520036, 'iterations': 206, 'l2_leaf_reg': 4.783946870643803e-06, 'border_count': 35, 'bagging_temperature': 0.9655706816103509, 'random_strength': 0.3405707773044942, 'grow_policy': 'SymmetricTree', 'min_data_in_leaf': 703}. Best is trial 374 with value: 6012.54835621459.[0m
[32m[I 2024-10-13 06:05:10,440][0m Trial 549 finished with value: 8947.45294214728 and parameters: {'depth': 4, 'learning_rate': 0.23228109494635182, 'iterations': 163, 'l2_leaf_reg': 4.29164023516008e-06, 'border_count': 24, 'bagging_temperature': 0.97579196558681, 'random_strength': 0.17590353194472402, 'grow_policy': 'SymmetricTree', 'min_data_in_leaf': 713}. Best is trial 374 with value: 6012.54835621459.[0m
[32m[I 2024-10-13 06:05:11,098][0m Trial 550 finished with value: 7307.808384745872 and parameters: {'depth': 4, 'learning_rate': 0.2541396263024655, 'iterations': 100, 'l2_leaf_reg': 2.2933986109797966e-06, 'border_count': 32, 'bagging_temperature': 0.9630939784332915, 'random_strength': 0.32257061381724456, 'grow_policy': 'SymmetricTree', 'min_data_in_leaf': 992}. Best is trial 374 with value: 6012.54835621459.[0m
[32m[I 2024-10-13 06:05:11,759][0m Trial 551 finished with value: 9659.64059505748 and parameters: {'depth': 4, 'learning_rate': 0.26770240881239626, 'iterations': 113, 'l2_leaf_reg': 2.475778617903018e-06, 'border_count': 15, 'bagging_temperature': 0.9601735780337037, 'random_strength': 0.26960108566576635, 'grow_policy': 'SymmetricTree', 'min_data_in_leaf': 748}. Best is trial 374 with value: 6012.54835621459.[0m
[32m[I 2024-10-13 06:05:12,374][0m Trial 552 finished with value: 10516.077758679352 and parameters: {'depth': 3, 'learning_rate': 0.29831543808908223, 'iterations': 106, 'l2_leaf_reg': 4.261376904084119e-06, 'border_count': 30, 'bagging_temperature': 0.9820693470040784, 'random_strength': 0.3168500242406343, 'grow_policy': 'Lossguide', 'min_data_in_leaf': 742, 'max_leaves': 171}. Best is trial 374 with value: 6012.54835621459.[0m
[32m[I 2024-10-13 06:05:13,103][0m Trial 553 finished with value: 13948.86049092544 and parameters: {'depth': 3, 'learning_rate': 0.22899959241748832, 'iterations': 200, 'l2_leaf_reg': 2.868645076924563e-06, 'border_count': 7, 'bagging_temperature': 0.9583998736779683, 'random_strength': 0.16732272313312502, 'grow_policy': 'SymmetricTree', 'min_data_in_leaf': 724}. Best is trial 374 with value: 6012.54835621459.[0m
[32m[I 2024-10-13 06:05:13,777][0m Trial 554 finished with value: 9125.094069354944 and parameters: {'depth': 3, 'learning_rate': 0.2507959037672748, 'iterations': 152, 'l2_leaf_reg': 1.793659255965351e-06, 'border_count': 23, 'bagging_temperature': 0.9363395698761535, 'random_strength': 0.40865156244862005, 'grow_policy': 'SymmetricTree', 'min_data_in_leaf': 987}. Best is trial 374 with value: 6012.54835621459.[0m
[32m[I 2024-10-13 06:05:14,444][0m Trial 555 finished with value: 8973.871461163551 and parameters: {'depth': 3, 'learning_rate': 0.20891985365156754, 'iterations': 146, 'l2_leaf_reg': 4.9202809618628775e-06, 'border_count': 33, 'bagging_temperature': 0.9472669076803834, 'random_strength': 0.18178505250838412, 'grow_policy': 'SymmetricTree', 'min_data_in_leaf': 986}. Best is trial 374 with value: 6012.54835621459.[0m
[32m[I 2024-10-13 06:05:15,179][0m Trial 556 finished with value: 8275.739880903937 and parameters: {'depth': 4, 'learning_rate': 0.2610917706456369, 'iterations': 194, 'l2_leaf_reg': 3.1469508429174196e-06, 'border_count': 29, 'bagging_temperature': 0.9830427622625793, 'random_strength': 0.008489875268961694, 'grow_policy': 'SymmetricTree', 'min_data_in_leaf': 979}. Best is trial 374 with value: 6012.54835621459.[0m
[32m[I 2024-10-13 06:05:15,913][0m Trial 557 finished with value: 10929.97558861196 and parameters: {'depth': 4, 'learning_rate': 0.2008031593176388, 'iterations': 157, 'l2_leaf_reg': 1.2764277461877753e-05, 'border_count': 18, 'bagging_temperature': 0.9669002240486226, 'random_strength': 7.366964975297175, 'grow_policy': 'SymmetricTree', 'min_data_in_leaf': 944}. Best is trial 374 with value: 6012.54835621459.[0m
[32m[I 2024-10-13 06:05:16,596][0m Trial 558 finished with value: 7229.094116421758 and parameters: {'depth': 4, 'learning_rate': 0.22382824870900916, 'iterations': 100, 'l2_leaf_reg': 6.863199295391213e-06, 'border_count': 34, 'bagging_temperature': 0.9228255046023144, 'random_strength': 0.33785184313753397, 'grow_policy': 'SymmetricTree', 'min_data_in_leaf': 700}. Best is trial 374 with value: 6012.54835621459.[0m
[32m[I 2024-10-13 06:05:17,222][0m Trial 559 finished with value: 10585.16085654781 and parameters: {'depth': 4, 'learning_rate': 0.299654990098944, 'iterations': 117, 'l2_leaf_reg': 7.61923089110553e-06, 'border_count': 25, 'bagging_temperature': 0.9409164965874096, 'random_strength': 0.31109285071306547, 'grow_policy': 'Depthwise', 'min_data_in_leaf': 768}. Best is trial 374 with value: 6012.54835621459.[0m
[32m[I 2024-10-13 06:05:17,889][0m Trial 560 finished with value: 10187.233999192069 and parameters: {'depth': 3, 'learning_rate': 0.22882928276182266, 'iterations': 139, 'l2_leaf_reg': 6.1256615188129865e-06, 'border_count': 33, 'bagging_temperature': 0.9222832809519909, 'random_strength': 0.17006429003125392, 'grow_policy': 'SymmetricTree', 'min_data_in_leaf': 942}. Best is trial 374 with value: 6012.54835621459.[0m
[32m[I 2024-10-13 06:05:18,551][0m Trial 561 finished with value: 10779.168385122279 and parameters: {'depth': 4, 'learning_rate': 0.20797063439889682, 'iterations': 118, 'l2_leaf_reg': 1.1320461666538515e-05, 'border_count': 27, 'bagging_temperature': 0.9609075134305964, 'random_strength': 0.3928917291051021, 'grow_policy': 'SymmetricTree', 'min_data_in_leaf': 669}. Best is trial 374 with value: 6012.54835621459.[0m
[32m[I 2024-10-13 06:05:19,283][0m Trial 562 finished with value: 9587.105494235497 and parameters: {'depth': 4, 'learning_rate': 0.25490996100651797, 'iterations': 189, 'l2_leaf_reg': 4.337856665575139e-06, 'border_count': 34, 'bagging_temperature': 0.9330933216646301, 'random_strength': 0.49624958388119683, 'grow_policy': 'SymmetricTree', 'min_data_in_leaf': 991}. Best is trial 374 with value: 6012.54835621459.[0m
[32m[I 2024-10-13 06:05:19,917][0m Trial 563 finished with value: 9489.996531338647 and parameters: {'depth': 4, 'learning_rate': 0.1854565036005156, 'iterations': 101, 'l2_leaf_reg': 7.832746024952208e-06, 'border_count': 23, 'bagging_temperature': 0.9812062447134426, 'random_strength': 0.19018620088540972, 'grow_policy': 'SymmetricTree', 'min_data_in_leaf': 999}. Best is trial 374 with value: 6012.54835621459.[0m
[32m[I 2024-10-13 06:05:20,651][0m Trial 564 finished with value: 7902.0422975312 and parameters: {'depth': 4, 'learning_rate': 0.23925616946877873, 'iterations': 193, 'l2_leaf_reg': 4.852012602886471e-06, 'border_count': 30, 'bagging_temperature': 0.9480777901662713, 'random_strength': 0.34770276052377824, 'grow_policy': 'SymmetricTree', 'min_data_in_leaf': 693}. Best is trial 374 with value: 6012.54835621459.[0m
