[32m[I 2024-10-13 06:15:42,800][0m Trial 976 finished with value: 16593.54838842992 and parameters: {'depth': 4, 'learning_rate': 0.0030299791916315205, 'iterations': 291, 'l2_leaf_reg': 0.0001698982585311326, 'border_count': 26, 'bagging_temperature': 0.8444864575933739, 'random_strength': 0.9173786973335711, 'grow_policy': 'SymmetricTree', 'min_data_in_leaf': 753}. Best is trial 894 with value: 5643.410092502591.[0m
[32m[I 2024-10-13 06:15:43,579][0m Trial 977 finished with value: 7976.787183952858 and parameters: {'depth': 5, 'learning_rate': 0.17418976726933968, 'iterations': 203, 'l2_leaf_reg': 9.105249225396641e-05, 'border_count': 18, 'bagging_temperature': 0.808755855757341, 'random_strength': 0.5801621857332339, 'grow_policy': 'SymmetricTree', 'min_data_in_leaf': 782}. Best is trial 894 with value: 5643.410092502591.[0m
[32m[I 2024-10-13 06:15:44,524][0m Trial 978 finished with value: 8959.333947847988 and parameters: {'depth': 5, 'learning_rate': 0.2639615502020403, 'iterations': 340, 'l2_leaf_reg': 0.00012513948974857182, 'border_count': 26, 'bagging_temperature': 0.8644848411547941, 'random_strength': 6.77555437225674, 'grow_policy': 'SymmetricTree', 'min_data_in_leaf': 714}. Best is trial 894 with value: 5643.410092502591.[0m
[32m[I 2024-10-13 06:15:45,357][0m Trial 979 finished with value: 6794.535853226125 and parameters: {'depth': 5, 'learning_rate': 0.2253120067648757, 'iterations': 250, 'l2_leaf_reg': 0.0005672178736007172, 'border_count': 12, 'bagging_temperature': 0.7392645151877951, 'random_strength': 0.6351325615871448, 'grow_policy': 'SymmetricTree', 'min_data_in_leaf': 682}. Best is trial 894 with value: 5643.410092502591.[0m
[32m[I 2024-10-13 06:15:46,089][0m Trial 980 finished with value: 10007.479303871576 and parameters: {'depth': 5, 'learning_rate': 0.2935430561037123, 'iterations': 156, 'l2_leaf_reg': 7.55819045016396e-05, 'border_count': 26, 'bagging_temperature': 0.7703243276948177, 'random_strength': 1.261491081689003, 'grow_policy': 'SymmetricTree', 'min_data_in_leaf': 737}. Best is trial 894 with value: 5643.410092502591.[0m
[32m[I 2024-10-13 06:15:46,839][0m Trial 981 finished with value: 9451.20873803403 and parameters: {'depth': 4, 'learning_rate': 0.2091654565326451, 'iterations': 202, 'l2_leaf_reg': 5.3622633682480386e-05, 'border_count': 21, 'bagging_temperature': 0.8304237482723612, 'random_strength': 0.3304963600228613, 'grow_policy': 'SymmetricTree', 'min_data_in_leaf': 306}. Best is trial 894 with value: 5643.410092502591.[0m
[32m[I 2024-10-13 06:15:47,583][0m Trial 982 finished with value: 17259.48105445372 and parameters: {'depth': 6, 'learning_rate': 0.2413110980022376, 'iterations': 263, 'l2_leaf_reg': 0.00044943293329167337, 'border_count': 5, 'bagging_temperature': 0.8685008687321308, 'random_strength': 0.8368965594613217, 'grow_policy': 'Lossguide', 'min_data_in_leaf': 708, 'max_leaves': 107}. Best is trial 894 with value: 5643.410092502591.[0m
[32m[I 2024-10-13 06:15:48,308][0m Trial 983 finished with value: 6724.007289755739 and parameters: {'depth': 5, 'learning_rate': 0.16675480334027162, 'iterations': 152, 'l2_leaf_reg': 0.00019211416042316752, 'border_count': 28, 'bagging_temperature': 0.7821026521523088, 'random_strength': 0.3712846437008404, 'grow_policy': 'SymmetricTree', 'min_data_in_leaf': 692}. Best is trial 894 with value: 5643.410092502591.[0m
[32m[I 2024-10-13 06:15:49,067][0m Trial 984 finished with value: 8532.833510900298 and parameters: {'depth': 5, 'learning_rate': 0.17383922179639924, 'iterations': 146, 'l2_leaf_reg': 0.0002590570726124585, 'border_count': 21, 'bagging_temperature': 0.7771515638243742, 'random_strength': 0.5767425677842393, 'grow_policy': 'SymmetricTree', 'min_data_in_leaf': 667}. Best is trial 894 with value: 5643.410092502591.[0m
[32m[I 2024-10-13 06:15:49,727][0m Trial 985 finished with value: 7107.559855209276 and parameters: {'depth': 5, 'learning_rate': 0.20019261761897178, 'iterations': 100, 'l2_leaf_reg': 0.00014693624100993935, 'border_count': 27, 'bagging_temperature': 0.7859265529135487, 'random_strength': 0.43376025196081214, 'grow_policy': 'SymmetricTree', 'min_data_in_leaf': 685}. Best is trial 894 with value: 5643.410092502591.[0m
[32m[I 2024-10-13 06:15:50,393][0m Trial 986 finished with value: 8032.114589307876 and parameters: {'depth': 5, 'learning_rate': 0.2955930502866864, 'iterations': 100, 'l2_leaf_reg': 0.00022358031732008112, 'border_count': 17, 'bagging_temperature': 0.7406528633863592, 'random_strength': 0.9039405476063611, 'grow_policy': 'SymmetricTree', 'min_data_in_leaf': 660}. Best is trial 894 with value: 5643.410092502591.[0m
[32m[I 2024-10-13 06:15:51,076][0m Trial 987 finished with value: 13141.194929144032 and parameters: {'depth': 9, 'learning_rate': 0.24131064040490272, 'iterations': 148, 'l2_leaf_reg': 0.0003239149287986973, 'border_count': 22, 'bagging_temperature': 0.792134912040931, 'random_strength': 0.6409311114964517, 'grow_policy': 'Depthwise', 'min_data_in_leaf': 691}. Best is trial 894 with value: 5643.410092502591.[0m
[32m[I 2024-10-13 06:15:51,755][0m Trial 988 finished with value: 18572.019043776123 and parameters: {'depth': 6, 'learning_rate': 0.20484507087312884, 'iterations': 101, 'l2_leaf_reg': 0.00018359800398297951, 'border_count': 1, 'bagging_temperature': 0.7532893523536179, 'random_strength': 9.095769743427583, 'grow_policy': 'SymmetricTree', 'min_data_in_leaf': 670}. Best is trial 894 with value: 5643.410092502591.[0m
[32m[I 2024-10-13 06:15:52,530][0m Trial 989 finished with value: 8790.40700548501 and parameters: {'depth': 5, 'learning_rate': 0.16995256540089645, 'iterations': 177, 'l2_leaf_reg': 0.0002248766518299954, 'border_count': 14, 'bagging_temperature': 0.8060393693144553, 'random_strength': 0.35216646494015386, 'grow_policy': 'SymmetricTree', 'min_data_in_leaf': 694}. Best is trial 894 with value: 5643.410092502591.[0m
[32m[I 2024-10-13 06:15:53,280][0m Trial 990 finished with value: 10425.482741524711 and parameters: {'depth': 4, 'learning_rate': 0.2586570308390489, 'iterations': 194, 'l2_leaf_reg': 0.00014073800531208997, 'border_count': 28, 'bagging_temperature': 0.7584708930332013, 'random_strength': 1.1344820573775372, 'grow_policy': 'SymmetricTree', 'min_data_in_leaf': 653}. Best is trial 894 with value: 5643.410092502591.[0m
[32m[I 2024-10-13 06:15:53,999][0m Trial 991 finished with value: 8180.27358734543 and parameters: {'depth': 5, 'learning_rate': 0.22901561752532204, 'iterations': 147, 'l2_leaf_reg': 0.00011311767435646201, 'border_count': 28, 'bagging_temperature': 0.7742425831860497, 'random_strength': 7.695226728834856, 'grow_policy': 'SymmetricTree', 'min_data_in_leaf': 678}. Best is trial 894 with value: 5643.410092502591.[0m
[32m[I 2024-10-13 06:15:54,824][0m Trial 992 finished with value: 6260.709382968831 and parameters: {'depth': 5, 'learning_rate': 0.2961228290113665, 'iterations': 212, 'l2_leaf_reg': 0.0003598894851631427, 'border_count': 10, 'bagging_temperature': 0.7863160594412413, 'random_strength': 0.7596772414292121, 'grow_policy': 'SymmetricTree', 'min_data_in_leaf': 704}. Best is trial 894 with value: 5643.410092502591.[0m
[32m[I 2024-10-13 06:15:55,616][0m Trial 993 finished with value: 15391.104831407978 and parameters: {'depth': 5, 'learning_rate': 0.29825463345260644, 'iterations': 221, 'l2_leaf_reg': 0.0005246326429722301, 'border_count': 8, 'bagging_temperature': 0.772141394534796, 'random_strength': 1.0560137562913332, 'grow_policy': 'SymmetricTree', 'min_data_in_leaf': 794}. Best is trial 894 with value: 5643.410092502591.[0m
[32m[I 2024-10-13 06:15:56,383][0m Trial 994 finished with value: 16578.42058386975 and parameters: {'depth': 4, 'learning_rate': 0.29434226892864074, 'iterations': 230, 'l2_leaf_reg': 0.00019532459656199084, 'border_count': 9, 'bagging_temperature': 0.7230836892673639, 'random_strength': 0.9218004294515301, 'grow_policy': 'SymmetricTree', 'min_data_in_leaf': 229}. Best is trial 894 with value: 5643.410092502591.[0m
[32m[I 2024-10-13 06:15:57,229][0m Trial 995 finished with value: 18537.535846300438 and parameters: {'depth': 5, 'learning_rate': 0.2547476600182319, 'iterations': 185, 'l2_leaf_reg': 0.00040196182778906787, 'border_count': 1, 'bagging_temperature': 0.7624901321293909, 'random_strength': 0.798448871237391, 'grow_policy': 'SymmetricTree', 'min_data_in_leaf': 717}. Best is trial 894 with value: 5643.410092502591.[0m
[32m[I 2024-10-13 06:15:58,060][0m Trial 996 finished with value: 14829.513622015096 and parameters: {'depth': 5, 'learning_rate': 0.2662046777307055, 'iterations': 253, 'l2_leaf_reg': 0.0003808024192855599, 'border_count': 6, 'bagging_temperature': 0.7889648447864935, 'random_strength': 1.196114096867985, 'grow_policy': 'SymmetricTree', 'min_data_in_leaf': 772}. Best is trial 894 with value: 5643.410092502591.[0m
[32m[I 2024-10-13 06:15:58,802][0m Trial 997 finished with value: 9832.901671523483 and parameters: {'depth': 6, 'learning_rate': 0.29808814581654736, 'iterations': 155, 'l2_leaf_reg': 0.04089179954339814, 'border_count': 11, 'bagging_temperature': 0.7785910978967516, 'random_strength': 1.3361887663512308, 'grow_policy': 'SymmetricTree', 'min_data_in_leaf': 735}. Best is trial 894 with value: 5643.410092502591.[0m
[32m[I 2024-10-13 06:15:59,611][0m Trial 998 finished with value: 7847.333657980849 and parameters: {'depth': 5, 'learning_rate': 0.2629668637085508, 'iterations': 237, 'l2_leaf_reg': 0.0012907645819722597, 'border_count': 10, 'bagging_temperature': 0.7436106883428958, 'random_strength': 0.8481625835111363, 'grow_policy': 'SymmetricTree', 'min_data_in_leaf': 756}. Best is trial 894 with value: 5643.410092502591.[0m
[32m[I 2024-10-13 06:16:00,269][0m Trial 999 finished with value: 16189.790825720034 and parameters: {'depth': 5, 'learning_rate': 0.23970937368629416, 'iterations': 101, 'l2_leaf_reg': 0.0008325192971878568, 'border_count': 6, 'bagging_temperature': 0.8001343893653244, 'random_strength': 0.7326892210153463, 'grow_policy': 'SymmetricTree', 'min_data_in_leaf': 712}. Best is trial 894 with value: 5643.410092502591.[0m
CatBoost: RMSE = 5643.4101
      Model         RMSE
0  CatBoost  5643.410093

Best hyperparameters for CatBoost:
{'depth': 5, 'learning_rate': 0.23355620279889, 'iterations': 206, 'l2_leaf_reg': 2.072820795232817e-05, 'border_count': 33, 'bagging_temperature': 0.8854201124262071, 'random_strength': 0.3706926113413769, 'grow_policy': 'SymmetricTree', 'min_data_in_leaf': 741}
