[32m[I 2024-10-13 06:08:34,946][0m Trial 668 finished with value: 17143.413071089162 and parameters: {'depth': 5, 'learning_rate': 0.19225194056079228, 'iterations': 312, 'l2_leaf_reg': 0.00014948334064042237, 'border_count': 8, 'bagging_temperature': 0.8006228804164287, 'random_strength': 0.3305850570457697, 'grow_policy': 'Lossguide', 'min_data_in_leaf': 656, 'max_leaves': 193}. Best is trial 374 with value: 6012.54835621459.[0m
[32m[I 2024-10-13 06:08:35,985][0m Trial 669 finished with value: 12874.450577769554 and parameters: {'depth': 5, 'learning_rate': 0.2947538904253834, 'iterations': 429, 'l2_leaf_reg': 5.291386693816971e-05, 'border_count': 4, 'bagging_temperature': 0.7982058289333929, 'random_strength': 6.262282640837809, 'grow_policy': 'SymmetricTree', 'min_data_in_leaf': 633}. Best is trial 374 with value: 6012.54835621459.[0m
[32m[I 2024-10-13 06:08:36,892][0m Trial 670 finished with value: 6117.130984629463 and parameters: {'depth': 5, 'learning_rate': 0.2356709163836581, 'iterations': 290, 'l2_leaf_reg': 7.788629687657618e-05, 'border_count': 12, 'bagging_temperature': 0.8332057350681268, 'random_strength': 0.51651186649402, 'grow_policy': 'SymmetricTree', 'min_data_in_leaf': 657}. Best is trial 374 with value: 6012.54835621459.[0m
[32m[I 2024-10-13 06:08:41,799][0m Trial 671 finished with value: 9451.56824936195 and parameters: {'depth': 5, 'learning_rate': 0.2955501439297147, 'iterations': 1333, 'l2_leaf_reg': 0.00010364018083610429, 'border_count': 10, 'bagging_temperature': 0.7614650505908682, 'random_strength': 0.6121517756232228, 'grow_policy': 'SymmetricTree', 'min_data_in_leaf': 611}. Best is trial 374 with value: 6012.54835621459.[0m
[32m[I 2024-10-13 06:08:52,122][0m Trial 672 finished with value: 13830.602354116721 and parameters: {'depth': 14, 'learning_rate': 0.2487680473981618, 'iterations': 282, 'l2_leaf_reg': 0.0001691618929923588, 'border_count': 16, 'bagging_temperature': 0.8076999817284111, 'random_strength': 0.8904730585820179, 'grow_policy': 'SymmetricTree', 'min_data_in_leaf': 651}. Best is trial 374 with value: 6012.54835621459.[0m
[32m[I 2024-10-13 06:08:52,658][0m Trial 673 finished with value: 13067.344255482843 and parameters: {'depth': 6, 'learning_rate': 0.23436562664133967, 'iterations': 294, 'l2_leaf_reg': 0.0002484543261331957, 'border_count': 13, 'bagging_temperature': 0.8263125849603502, 'random_strength': 1.0914622381836128, 'grow_policy': 'Depthwise', 'min_data_in_leaf': 627}. Best is trial 374 with value: 6012.54835621459.[0m
[32m[I 2024-10-13 06:08:53,527][0m Trial 674 finished with value: 18528.63140432616 and parameters: {'depth': 5, 'learning_rate': 0.2994055730133312, 'iterations': 264, 'l2_leaf_reg': 6.98190634125918e-05, 'border_count': 1, 'bagging_temperature': 0.7315444469916063, 'random_strength': 0.7219805841798876, 'grow_policy': 'SymmetricTree', 'min_data_in_leaf': 667}. Best is trial 374 with value: 6012.54835621459.[0m
[32m[I 2024-10-13 06:08:54,447][0m Trial 675 finished with value: 14682.88903822597 and parameters: {'depth': 5, 'learning_rate': 0.2344774203783092, 'iterations': 334, 'l2_leaf_reg': 7.853674269447265e-05, 'border_count': 6, 'bagging_temperature': 0.7915422048783195, 'random_strength': 0.8538831848417612, 'grow_policy': 'SymmetricTree', 'min_data_in_leaf': 643}. Best is trial 374 with value: 6012.54835621459.[0m
[32m[I 2024-10-13 06:08:55,364][0m Trial 676 finished with value: 15235.56917064621 and parameters: {'depth': 6, 'learning_rate': 0.20956355135607058, 'iterations': 278, 'l2_leaf_reg': 3.9628819126915494e-05, 'border_count': 8, 'bagging_temperature': 0.8375362868756607, 'random_strength': 0.5207498157272343, 'grow_policy': 'SymmetricTree', 'min_data_in_leaf': 657}. Best is trial 374 with value: 6012.54835621459.[0m
[32m[I 2024-10-13 06:08:56,306][0m Trial 677 finished with value: 20501.123266268845 and parameters: {'depth': 5, 'learning_rate': 0.0006764228826435338, 'iterations': 357, 'l2_leaf_reg': 6.425959607639523e-05, 'border_count': 11, 'bagging_temperature': 0.8194258982855994, 'random_strength': 0.42754725971208446, 'grow_policy': 'SymmetricTree', 'min_data_in_leaf': 678}. Best is trial 374 with value: 6012.54835621459.[0m
[32m[I 2024-10-13 06:08:57,123][0m Trial 678 finished with value: 7043.266892037171 and parameters: {'depth': 5, 'learning_rate': 0.2560925208172166, 'iterations': 234, 'l2_leaf_reg': 0.00011465373325950989, 'border_count': 12, 'bagging_temperature': 0.8435812292082725, 'random_strength': 0.6362859551367435, 'grow_policy': 'SymmetricTree', 'min_data_in_leaf': 630}. Best is trial 374 with value: 6012.54835621459.[0m
[32m[I 2024-10-13 06:08:58,015][0m Trial 679 finished with value: 7921.53464928656 and parameters: {'depth': 5, 'learning_rate': 0.2704962698673204, 'iterations': 308, 'l2_leaf_reg': 0.00012397697835221555, 'border_count': 11, 'bagging_temperature': 0.7876443450097562, 'random_strength': 1.2291622789490215, 'grow_policy': 'SymmetricTree', 'min_data_in_leaf': 588}. Best is trial 374 with value: 6012.54835621459.[0m
[32m[I 2024-10-13 06:08:58,824][0m Trial 680 finished with value: 22506.588717399347 and parameters: {'depth': 5, 'learning_rate': 0.000274364127930618, 'iterations': 247, 'l2_leaf_reg': 0.0003940811520017282, 'border_count': 8, 'bagging_temperature': 0.8409577929660774, 'random_strength': 1.0044972572072954, 'grow_policy': 'SymmetricTree', 'min_data_in_leaf': 605}. Best is trial 374 with value: 6012.54835621459.[0m
[32m[I 2024-10-13 06:08:59,776][0m Trial 681 finished with value: 8364.600188779212 and parameters: {'depth': 5, 'learning_rate': 0.26166998110184286, 'iterations': 360, 'l2_leaf_reg': 6.845195613249766e-05, 'border_count': 14, 'bagging_temperature': 0.8210065552965226, 'random_strength': 0.8185843018188035, 'grow_policy': 'SymmetricTree', 'min_data_in_leaf': 622}. Best is trial 374 with value: 6012.54835621459.[0m
[32m[I 2024-10-13 06:09:00,609][0m Trial 682 finished with value: 6312.901456576644 and parameters: {'depth': 5, 'learning_rate': 0.29941766037871637, 'iterations': 248, 'l2_leaf_reg': 0.00020724873820420107, 'border_count': 11, 'bagging_temperature': 0.7886428216439103, 'random_strength': 0.6300148926002777, 'grow_policy': 'SymmetricTree', 'min_data_in_leaf': 616}. Best is trial 374 with value: 6012.54835621459.[0m
[32m[I 2024-10-13 06:09:01,535][0m Trial 683 finished with value: 14154.923600343629 and parameters: {'depth': 5, 'learning_rate': 0.2661890617872619, 'iterations': 320, 'l2_leaf_reg': 0.0002926972101815733, 'border_count': 9, 'bagging_temperature': 0.7585681428175499, 'random_strength': 0.9785770776357356, 'grow_policy': 'SymmetricTree', 'min_data_in_leaf': 625}. Best is trial 374 with value: 6012.54835621459.[0m
[32m[I 2024-10-13 06:09:02,385][0m Trial 684 finished with value: 15865.14418480926 and parameters: {'depth': 5, 'learning_rate': 0.28822909743775016, 'iterations': 266, 'l2_leaf_reg': 0.00022211920089348658, 'border_count': 5, 'bagging_temperature': 0.7934701275528014, 'random_strength': 0.7602035367713291, 'grow_policy': 'SymmetricTree', 'min_data_in_leaf': 608}. Best is trial 374 with value: 6012.54835621459.[0m
[32m[I 2024-10-13 06:09:03,450][0m Trial 685 finished with value: 18549.40763300164 and parameters: {'depth': 5, 'learning_rate': 0.25897941695590454, 'iterations': 406, 'l2_leaf_reg': 0.00025877217583686026, 'border_count': 1, 'bagging_temperature': 0.7448404794846843, 'random_strength': 6.8419171017418705, 'grow_policy': 'SymmetricTree', 'min_data_in_leaf': 590}. Best is trial 374 with value: 6012.54835621459.[0m
[32m[I 2024-10-13 06:09:04,279][0m Trial 686 finished with value: 16017.349223559633 and parameters: {'depth': 5, 'learning_rate': 0.29397149827832664, 'iterations': 262, 'l2_leaf_reg': 5.132290641475023e-05, 'border_count': 5, 'bagging_temperature': 0.8032863137438836, 'random_strength': 1.1587844474987807, 'grow_policy': 'SymmetricTree', 'min_data_in_leaf': 639}. Best is trial 374 with value: 6012.54835621459.[0m
[32m[I 2024-10-13 06:09:05,196][0m Trial 687 finished with value: 7543.722913153396 and parameters: {'depth': 5, 'learning_rate': 0.23820167370812204, 'iterations': 316, 'l2_leaf_reg': 0.0001329124837458908, 'border_count': 16, 'bagging_temperature': 0.8276083285593038, 'random_strength': 0.7478663989183143, 'grow_policy': 'SymmetricTree', 'min_data_in_leaf': 650}. Best is trial 374 with value: 6012.54835621459.[0m
[32m[I 2024-10-13 06:09:06,164][0m Trial 688 finished with value: 15865.915633592702 and parameters: {'depth': 5, 'learning_rate': 0.2492107342512886, 'iterations': 381, 'l2_leaf_reg': 8.335125881045248e-05, 'border_count': 9, 'bagging_temperature': 0.7716157330975388, 'random_strength': 0.6740629280227892, 'grow_policy': 'SymmetricTree', 'min_data_in_leaf': 611}. Best is trial 374 with value: 6012.54835621459.[0m
[32m[I 2024-10-13 06:09:06,886][0m Trial 689 finished with value: 12895.798351327356 and parameters: {'depth': 5, 'learning_rate': 0.23346139002634647, 'iterations': 249, 'l2_leaf_reg': 0.000166238501067459, 'border_count': 12, 'bagging_temperature': 0.7975965379360038, 'random_strength': 0.6181012130804981, 'grow_policy': 'Lossguide', 'min_data_in_leaf': 628, 'max_leaves': 244}. Best is trial 374 with value: 6012.54835621459.[0m
[32m[I 2024-10-13 06:09:14,705][0m Trial 690 finished with value: 9993.658079014689 and parameters: {'depth': 5, 'learning_rate': 0.2866678250455316, 'iterations': 2048, 'l2_leaf_reg': 0.0001324422826750519, 'border_count': 13, 'bagging_temperature': 0.8435813575956334, 'random_strength': 0.9970093458396867, 'grow_policy': 'SymmetricTree', 'min_data_in_leaf': 594}. Best is trial 374 with value: 6012.54835621459.[0m
[32m[I 2024-10-13 06:09:15,624][0m Trial 691 finished with value: 15204.48484146861 and parameters: {'depth': 5, 'learning_rate': 0.2994458075845894, 'iterations': 328, 'l2_leaf_reg': 0.0001255679872504795, 'border_count': 7, 'bagging_temperature': 0.8484067453615334, 'random_strength': 0.8425073325885866, 'grow_policy': 'SymmetricTree', 'min_data_in_leaf': 619}. Best is trial 374 with value: 6012.54835621459.[0m
[32m[I 2024-10-13 06:09:16,508][0m Trial 692 finished with value: 7207.843937191146 and parameters: {'depth': 5, 'learning_rate': 0.20776976351360593, 'iterations': 280, 'l2_leaf_reg': 0.0004332454463777778, 'border_count': 15, 'bagging_temperature': 0.7893612553991356, 'random_strength': 0.6198128445617254, 'grow_policy': 'SymmetricTree', 'min_data_in_leaf': 640}. Best is trial 374 with value: 6012.54835621459.[0m
[32m[I 2024-10-13 06:09:17,351][0m Trial 693 finished with value: 10594.754354215793 and parameters: {'depth': 6, 'learning_rate': 0.23150496034253581, 'iterations': 233, 'l2_leaf_reg': 0.00011052775470369419, 'border_count': 17, 'bagging_temperature': 0.835250656442112, 'random_strength': 4.165305102591942, 'grow_policy': 'SymmetricTree', 'min_data_in_leaf': 655}. Best is trial 374 with value: 6012.54835621459.[0m
[32m[I 2024-10-13 06:09:18,312][0m Trial 694 finished with value: 7611.319538803393 and parameters: {'depth': 5, 'learning_rate': 0.18454321255717823, 'iterations': 362, 'l2_leaf_reg': 8.864978310613458e-05, 'border_count': 12, 'bagging_temperature': 0.7799144866951768, 'random_strength': 0.47665664343928676, 'grow_policy': 'SymmetricTree', 'min_data_in_leaf': 624}. Best is trial 374 with value: 6012.54835621459.[0m
[32m[I 2024-10-13 06:09:19,059][0m Trial 695 finished with value: 15648.273105557226 and parameters: {'depth': 5, 'learning_rate': 0.2492957343064028, 'iterations': 166, 'l2_leaf_reg': 0.00016919688713638, 'border_count': 6, 'bagging_temperature': 0.8153068338408738, 'random_strength': 0.5358601177567778, 'grow_policy': 'SymmetricTree', 'min_data_in_leaf': 634}. Best is trial 374 with value: 6012.54835621459.[0m
[32m[I 2024-10-13 06:09:19,818][0m Trial 696 finished with value: 16132.240698721223 and parameters: {'depth': 5, 'learning_rate': 0.20403949309681182, 'iterations': 240, 'l2_leaf_reg': 0.00020763850136725024, 'border_count': 225, 'bagging_temperature': 0.8522148997766693, 'random_strength': 0.7989722811924843, 'grow_policy': 'Depthwise', 'min_data_in_leaf': 574}. Best is trial 374 with value: 6012.54835621459.[0m
[32m[I 2024-10-13 06:09:20,790][0m Trial 697 finished with value: 13031.227138887058 and parameters: {'depth': 6, 'learning_rate': 0.1704139600885802, 'iterations': 302, 'l2_leaf_reg': 7.44386530826341e-05, 'border_count': 2, 'bagging_temperature': 0.7675381714189885, 'random_strength': 0.5225610386798341, 'grow_policy': 'SymmetricTree', 'min_data_in_leaf': 659}. Best is trial 374 with value: 6012.54835621459.[0m
[32m[I 2024-10-13 06:09:21,503][0m Trial 698 finished with value: 7871.795448815274 and parameters: {'depth': 5, 'learning_rate': 0.2580215126517635, 'iterations': 155, 'l2_leaf_reg': 8.633576380223475e-05, 'border_count': 19, 'bagging_temperature': 0.8233159565481636, 'random_strength': 0.37043896838902635, 'grow_policy': 'SymmetricTree', 'min_data_in_leaf': 606}. Best is trial 374 with value: 6012.54835621459.[0m
[32m[I 2024-10-13 06:09:22,515][0m Trial 699 finished with value: 19287.381505613146 and parameters: {'depth': 5, 'learning_rate': 0.001238069010651651, 'iterations': 403, 'l2_leaf_reg': 0.00017796220469278333, 'border_count': 12, 'bagging_temperature': 0.8558515492402584, 'random_strength': 3.8975761112425142, 'grow_policy': 'SymmetricTree', 'min_data_in_leaf': 660}. Best is trial 374 with value: 6012.54835621459.[0m
[32m[I 2024-10-13 06:09:23,314][0m Trial 700 finished with value: 8051.604042261229 and parameters: {'depth': 5, 'learning_rate': 0.21737675093557857, 'iterations': 229, 'l2_leaf_reg': 4.9476415620620634e-05, 'border_count': 17, 'bagging_temperature': 0.7746262442079624, 'random_strength': 0.9734744442700398, 'grow_policy': 'SymmetricTree', 'min_data_in_leaf': 638}. Best is trial 374 with value: 6012.54835621459.[0m
[32m[I 2024-10-13 06:09:24,300][0m Trial 701 finished with value: 7807.953257324914 and parameters: {'depth': 5, 'learning_rate': 0.17988174241294067, 'iterations': 343, 'l2_leaf_reg': 3.8142369161317436e-05, 'border_count': 18, 'bagging_temperature': 0.8106999560562158, 'random_strength': 0.6442644749279709, 'grow_policy': 'SymmetricTree', 'min_data_in_leaf': 576}. Best is trial 374 with value: 6012.54835621459.[0m
[32m[I 2024-10-13 06:09:25,207][0m Trial 702 finished with value: 15960.160119422635 and parameters: {'depth': 5, 'learning_rate': 0.2270244898757092, 'iterations': 286, 'l2_leaf_reg': 0.00012059423658119961, 'border_count': 8, 'bagging_temperature': 0.8632799645708134, 'random_strength': 0.3597022272633634, 'grow_policy': 'SymmetricTree', 'min_data_in_leaf': 669}. Best is trial 374 with value: 6012.54835621459.[0m
[32m[I 2024-10-13 06:09:25,983][0m Trial 703 finished with value: 14275.930291399933 and parameters: {'depth': 5, 'learning_rate': 0.2571547514458966, 'iterations': 201, 'l2_leaf_reg': 3.365184728612272e-05, 'border_count': 126, 'bagging_temperature': 0.8162243086349572, 'random_strength': 1.257740642816568, 'grow_policy': 'SymmetricTree', 'min_data_in_leaf': 641}. Best is trial 374 with value: 6012.54835621459.[0m
[32m[I 2024-10-13 06:09:26,725][0m Trial 704 finished with value: 12367.476807371395 and parameters: {'depth': 6, 'learning_rate': 0.20030216980455307, 'iterations': 144, 'l2_leaf_reg': 0.00010027835355642454, 'border_count': 144, 'bagging_temperature': 0.8757223462700695, 'random_strength': 0.5251272335181074, 'grow_policy': 'SymmetricTree', 'min_data_in_leaf': 677}. Best is trial 374 with value: 6012.54835621459.[0m
[32m[I 2024-10-13 06:09:27,618][0m Trial 705 finished with value: 18532.05159285267 and parameters: {'depth': 5, 'learning_rate': 0.16590131774461989, 'iterations': 307, 'l2_leaf_reg': 5.284007529149387e-05, 'border_count': 1, 'bagging_temperature': 0.8385753920588886, 'random_strength': 0.7902487369803587, 'grow_policy': 'SymmetricTree', 'min_data_in_leaf': 610}. Best is trial 374 with value: 6012.54835621459.[0m
[32m[I 2024-10-13 06:09:28,469][0m Trial 706 finished with value: 9144.981655689207 and parameters: {'depth': 5, 'learning_rate': 0.20040119276538146, 'iterations': 232, 'l2_leaf_reg': 0.0003537761082284747, 'border_count': 11, 'bagging_temperature': 0.594399192287386, 'random_strength': 0.30973867057118126, 'grow_policy': 'SymmetricTree', 'min_data_in_leaf': 644}. Best is trial 374 with value: 6012.54835621459.[0m
[32m[I 2024-10-13 06:09:34,449][0m Trial 707 finished with value: 11082.599082725397 and parameters: {'depth': 5, 'learning_rate': 0.26220103256044935, 'iterations': 1450, 'l2_leaf_reg': 2.4730634459712468e-05, 'border_count': 20, 'bagging_temperature': 0.85522545607916, 'random_strength': 0.6002476149107396, 'grow_policy': 'SymmetricTree', 'min_data_in_leaf': 668}. Best is trial 374 with value: 6012.54835621459.[0m
[32m[I 2024-10-13 06:09:35,422][0m Trial 708 finished with value: 9831.238885719662 and parameters: {'depth': 5, 'learning_rate': 0.14452154736900377, 'iterations': 375, 'l2_leaf_reg': 3.251114577128451e-05, 'border_count': 19, 'bagging_temperature': 0.8830890285149523, 'random_strength': 0.23905899235954875, 'grow_policy': 'SymmetricTree', 'min_data_in_leaf': 586}. Best is trial 374 with value: 6012.54835621459.[0m
[32m[I 2024-10-13 06:09:36,168][0m Trial 709 finished with value: 10062.64529830073 and parameters: {'depth': 6, 'learning_rate': 0.2191856910717195, 'iterations': 160, 'l2_leaf_reg': 0.0005985645806036602, 'border_count': 13, 'bagging_temperature': 0.8391534993887744, 'random_strength': 0.4212608121452265, 'grow_policy': 'SymmetricTree', 'min_data_in_leaf': 655}. Best is trial 374 with value: 6012.54835621459.[0m
[32m[I 2024-10-13 06:09:37,249][0m Trial 710 finished with value: 9262.816478912417 and parameters: {'depth': 5, 'learning_rate': 0.16956809012311766, 'iterations': 433, 'l2_leaf_reg': 0.00024525462439797113, 'border_count': 22, 'bagging_temperature': 0.0988864534898698, 'random_strength': 0.8800783239804708, 'grow_policy': 'SymmetricTree', 'min_data_in_leaf': 681}. Best is trial 374 with value: 6012.54835621459.[0m
[32m[I 2024-10-13 06:09:37,863][0m Trial 711 finished with value: 17105.043103377262 and parameters: {'depth': 5, 'learning_rate': 0.23400727370189117, 'iterations': 104, 'l2_leaf_reg': 1.5178193141222656e-05, 'border_count': 5, 'bagging_temperature': 0.7844463092616598, 'random_strength': 3.5791993879870403, 'grow_policy': 'Lossguide', 'min_data_in_leaf': 628, 'max_leaves': 86}. Best is trial 374 with value: 6012.54835621459.[0m
[32m[I 2024-10-13 06:09:40,833][0m Trial 712 finished with value: 10431.662146172634 and parameters: {'depth': 12, 'learning_rate': 0.291633894754356, 'iterations': 242, 'l2_leaf_reg': 6.851928690115534e-05, 'border_count': 23, 'bagging_temperature': 0.8733672437554525, 'random_strength': 0.20908290917733774, 'grow_policy': 'SymmetricTree', 'min_data_in_leaf': 697}. Best is trial 374 with value: 6012.54835621459.[0m
[32m[I 2024-10-13 06:09:41,641][0m Trial 713 finished with value: 7411.231974556853 and parameters: {'depth': 5, 'learning_rate': 0.190460031260609, 'iterations': 300, 'l2_leaf_reg': 1.8646467944658575e-05, 'border_count': 15, 'bagging_temperature': 0.8905326211161743, 'random_strength': 0.6319066659996198, 'grow_policy': 'SymmetricTree', 'min_data_in_leaf': 664}. Best is trial 374 with value: 6012.54835621459.[0m
[32m[I 2024-10-13 06:09:42,587][0m Trial 714 finished with value: 8208.462372292579 and parameters: {'depth': 5, 'learning_rate': 0.29583941932412827, 'iterations': 349, 'l2_leaf_reg': 4.2050936635451516e-05, 'border_count': 25, 'bagging_temperature': 0.8116274454782844, 'random_strength': 0.4550066871168882, 'grow_policy': 'SymmetricTree', 'min_data_in_leaf': 938}. Best is trial 374 with value: 6012.54835621459.[0m
[32m[I 2024-10-13 06:09:43,375][0m Trial 715 finished with value: 9792.149158776092 and parameters: {'depth': 5, 'learning_rate': 0.1392513529052142, 'iterations': 199, 'l2_leaf_reg': 9.778155400334413e-06, 'border_count': 16, 'bagging_temperature': 0.8551450650280563, 'random_strength': 0.20433834670809528, 'grow_policy': 'SymmetricTree', 'min_data_in_leaf': 632}. Best is trial 374 with value: 6012.54835621459.[0m
[32m[I 2024-10-13 06:09:44,278][0m Trial 716 finished with value: 10163.317914790263 and parameters: {'depth': 6, 'learning_rate': 0.23092227922419892, 'iterations': 264, 'l2_leaf_reg': 1.264227607354049e-05, 'border_count': 22, 'bagging_temperature': 0.8833785073094214, 'random_strength': 0.7189811122801344, 'grow_policy': 'SymmetricTree', 'min_data_in_leaf': 655}. Best is trial 374 with value: 6012.54835621459.[0m
[32m[I 2024-10-13 06:09:45,008][0m Trial 717 finished with value: 16121.386799043985 and parameters: {'depth': 5, 'learning_rate': 0.18308768864055402, 'iterations': 163, 'l2_leaf_reg': 2.321483028246094e-05, 'border_count': 6, 'bagging_temperature': 0.8599470720255822, 'random_strength': 0.3588768518452779, 'grow_policy': 'SymmetricTree', 'min_data_in_leaf': 691}. Best is trial 374 with value: 6012.54835621459.[0m
[32m[I 2024-10-13 06:09:45,700][0m Trial 718 finished with value: 13109.646201013426 and parameters: {'depth': 5, 'learning_rate': 0.16007710140479728, 'iterations': 228, 'l2_leaf_reg': 0.00010037513554030569, 'border_count': 12, 'bagging_temperature': 0.8993949980458769, 'random_strength': 1.0749837813655794, 'grow_policy': 'Depthwise', 'min_data_in_leaf': 609}. Best is trial 374 with value: 6012.54835621459.[0m
[32m[I 2024-10-13 06:09:46,359][0m Trial 719 finished with value: 9021.39959394588 and parameters: {'depth': 5, 'learning_rate': 0.2575099336102268, 'iterations': 102, 'l2_leaf_reg': 0.00018846222138824506, 'border_count': 26, 'bagging_temperature': 0.8314357350655155, 'random_strength': 0.48524296080162965, 'grow_policy': 'SymmetricTree', 'min_data_in_leaf': 675}. Best is trial 374 with value: 6012.54835621459.[0m
