[32m[I 2024-10-13 06:10:47,725][0m Trial 772 finished with value: 10325.4826098575 and parameters: {'depth': 6, 'learning_rate': 0.26130466779447226, 'iterations': 149, 'l2_leaf_reg': 2.3969570641773137e-05, 'border_count': 28, 'bagging_temperature': 0.904564741853575, 'random_strength': 0.6772779927223896, 'grow_policy': 'SymmetricTree', 'min_data_in_leaf': 897}. Best is trial 374 with value: 6012.54835621459.[0m
[32m[I 2024-10-13 06:10:48,485][0m Trial 773 finished with value: 7756.060289069779 and parameters: {'depth': 5, 'learning_rate': 0.18545904584733525, 'iterations': 193, 'l2_leaf_reg': 1.4584578622824374e-05, 'border_count': 20, 'bagging_temperature': 0.9210155422594626, 'random_strength': 8.328178040856525, 'grow_policy': 'SymmetricTree', 'min_data_in_leaf': 975}. Best is trial 374 with value: 6012.54835621459.[0m
[32m[I 2024-10-13 06:10:51,958][0m Trial 774 finished with value: 9613.650879398638 and parameters: {'depth': 5, 'learning_rate': 0.21819957179216423, 'iterations': 739, 'l2_leaf_reg': 8.203737968150473e-06, 'border_count': 36, 'bagging_temperature': 0.8838346871352311, 'random_strength': 0.4819034021703047, 'grow_policy': 'SymmetricTree', 'min_data_in_leaf': 957}. Best is trial 374 with value: 6012.54835621459.[0m
[32m[I 2024-10-13 06:10:52,839][0m Trial 775 finished with value: 6669.766824960835 and parameters: {'depth': 5, 'learning_rate': 0.25987389657207294, 'iterations': 291, 'l2_leaf_reg': 2.839478959932615e-05, 'border_count': 25, 'bagging_temperature': 0.9049889244981164, 'random_strength': 0.19695544654498165, 'grow_policy': 'SymmetricTree', 'min_data_in_leaf': 903}. Best is trial 374 with value: 6012.54835621459.[0m
[32m[I 2024-10-13 06:10:53,696][0m Trial 776 finished with value: 8301.784624602527 and parameters: {'depth': 5, 'learning_rate': 0.2638522196781815, 'iterations': 258, 'l2_leaf_reg': 4.654777592963888e-05, 'border_count': 20, 'bagging_temperature': 0.8761207444367305, 'random_strength': 0.16784160388746353, 'grow_policy': 'SymmetricTree', 'min_data_in_leaf': 908}. Best is trial 374 with value: 6012.54835621459.[0m
[32m[I 2024-10-13 06:10:54,395][0m Trial 777 finished with value: 10076.372998071174 and parameters: {'depth': 4, 'learning_rate': 0.26237284524816973, 'iterations': 155, 'l2_leaf_reg': 2.8117431568999086e-05, 'border_count': 26, 'bagging_temperature': 0.8901814665837432, 'random_strength': 0.1782023199684728, 'grow_policy': 'SymmetricTree', 'min_data_in_leaf': 891}. Best is trial 374 with value: 6012.54835621459.[0m
[32m[I 2024-10-13 06:10:55,087][0m Trial 778 finished with value: 9266.366885118272 and parameters: {'depth': 6, 'learning_rate': 0.224377649828177, 'iterations': 104, 'l2_leaf_reg': 2.2606165389514136e-05, 'border_count': 21, 'bagging_temperature': 0.9038177209424382, 'random_strength': 0.1567296997229481, 'grow_policy': 'SymmetricTree', 'min_data_in_leaf': 935}. Best is trial 374 with value: 6012.54835621459.[0m
[32m[I 2024-10-13 06:10:55,847][0m Trial 779 finished with value: 9863.341189125007 and parameters: {'depth': 5, 'learning_rate': 0.25095994848226816, 'iterations': 294, 'l2_leaf_reg': 4.238288325091027e-05, 'border_count': 26, 'bagging_temperature': 0.869029980068451, 'random_strength': 0.3294022797063634, 'grow_policy': 'Lossguide', 'min_data_in_leaf': 964, 'max_leaves': 128}. Best is trial 374 with value: 6012.54835621459.[0m
[32m[I 2024-10-13 06:10:56,615][0m Trial 780 finished with value: 7625.722493645075 and parameters: {'depth': 5, 'learning_rate': 0.29944899327775637, 'iterations': 193, 'l2_leaf_reg': 1.4537276082268656e-05, 'border_count': 19, 'bagging_temperature': 0.9005954444293132, 'random_strength': 0.30728423681900346, 'grow_policy': 'SymmetricTree', 'min_data_in_leaf': 925}. Best is trial 374 with value: 6012.54835621459.[0m
[32m[I 2024-10-13 06:10:57,432][0m Trial 781 finished with value: 8265.984112386956 and parameters: {'depth': 5, 'learning_rate': 0.2965334272708447, 'iterations': 243, 'l2_leaf_reg': 3.080406064707941e-05, 'border_count': 24, 'bagging_temperature': 0.920928054320523, 'random_strength': 0.15984528959912547, 'grow_policy': 'SymmetricTree', 'min_data_in_leaf': 908}. Best is trial 374 with value: 6012.54835621459.[0m
[32m[I 2024-10-13 06:10:58,300][0m Trial 782 finished with value: 7427.844847205273 and parameters: {'depth': 5, 'learning_rate': 0.2143729459785949, 'iterations': 302, 'l2_leaf_reg': 1.2895632667613288e-05, 'border_count': 29, 'bagging_temperature': 0.8812481364180518, 'random_strength': 0.36488612224435546, 'grow_policy': 'SymmetricTree', 'min_data_in_leaf': 890}. Best is trial 374 with value: 6012.54835621459.[0m
[32m[I 2024-10-13 06:10:59,117][0m Trial 783 finished with value: 9679.663864617682 and parameters: {'depth': 6, 'learning_rate': 0.24623222859201743, 'iterations': 192, 'l2_leaf_reg': 2.537721885518631e-05, 'border_count': 30, 'bagging_temperature': 0.9014497074106408, 'random_strength': 0.14833680627071552, 'grow_policy': 'SymmetricTree', 'min_data_in_leaf': 916}. Best is trial 374 with value: 6012.54835621459.[0m
[32m[I 2024-10-13 06:10:59,899][0m Trial 784 finished with value: 22739.76556860627 and parameters: {'depth': 4, 'learning_rate': 0.0001668350078075943, 'iterations': 241, 'l2_leaf_reg': 4.2598451087884806e-05, 'border_count': 18, 'bagging_temperature': 0.9228776916711819, 'random_strength': 0.4994402530363562, 'grow_policy': 'SymmetricTree', 'min_data_in_leaf': 861}. Best is trial 374 with value: 6012.54835621459.[0m
[32m[I 2024-10-13 06:11:00,709][0m Trial 785 finished with value: 9963.762452456309 and parameters: {'depth': 5, 'learning_rate': 0.18857684409488232, 'iterations': 338, 'l2_leaf_reg': 1.539805057517808e-05, 'border_count': 25, 'bagging_temperature': 0.869669740935544, 'random_strength': 0.005898611075729171, 'grow_policy': 'Depthwise', 'min_data_in_leaf': 941}. Best is trial 374 with value: 6012.54835621459.[0m
[32m[I 2024-10-13 06:11:01,477][0m Trial 786 finished with value: 6399.035713776191 and parameters: {'depth': 5, 'learning_rate': 0.22362855616453192, 'iterations': 185, 'l2_leaf_reg': 1.857075743677457e-05, 'border_count': 34, 'bagging_temperature': 0.8841628970258462, 'random_strength': 0.34130352385616247, 'grow_policy': 'SymmetricTree', 'min_data_in_leaf': 878}. Best is trial 374 with value: 6012.54835621459.[0m
[32m[I 2024-10-13 06:11:02,202][0m Trial 787 finished with value: 8442.207444463507 and parameters: {'depth': 5, 'learning_rate': 0.23762949170759756, 'iterations': 150, 'l2_leaf_reg': 2.080498701129825e-05, 'border_count': 33, 'bagging_temperature': 0.9036303758924475, 'random_strength': 0.5138263145812166, 'grow_policy': 'SymmetricTree', 'min_data_in_leaf': 890}. Best is trial 374 with value: 6012.54835621459.[0m
[32m[I 2024-10-13 06:11:02,877][0m Trial 788 finished with value: 8692.96815686861 and parameters: {'depth': 4, 'learning_rate': 0.29864031537920177, 'iterations': 138, 'l2_leaf_reg': 6.074487770221445e-05, 'border_count': 35, 'bagging_temperature': 0.9288952396861743, 'random_strength': 0.3309524901311607, 'grow_policy': 'SymmetricTree', 'min_data_in_leaf': 870}. Best is trial 374 with value: 6012.54835621459.[0m
[32m[I 2024-10-13 06:11:03,724][0m Trial 789 finished with value: 7180.949968448521 and parameters: {'depth': 5, 'learning_rate': 0.20877817524905376, 'iterations': 252, 'l2_leaf_reg': 3.7220702197814726e-05, 'border_count': 32, 'bagging_temperature': 0.8639398597072109, 'random_strength': 0.15565494382998593, 'grow_policy': 'SymmetricTree', 'min_data_in_leaf': 881}. Best is trial 374 with value: 6012.54835621459.[0m
[32m[I 2024-10-13 06:11:04,538][0m Trial 790 finished with value: 10148.641870204458 and parameters: {'depth': 5, 'learning_rate': 0.2554370168505523, 'iterations': 184, 'l2_leaf_reg': 9.35739932655195e-06, 'border_count': 15, 'bagging_temperature': 0.89236241777599, 'random_strength': 0.010324111521253676, 'grow_policy': 'SymmetricTree', 'min_data_in_leaf': 852}. Best is trial 374 with value: 6012.54835621459.[0m
[32m[I 2024-10-13 06:11:05,543][0m Trial 791 finished with value: 11322.087278482712 and parameters: {'depth': 6, 'learning_rate': 0.2087814273929322, 'iterations': 333, 'l2_leaf_reg': 2.623603686779978e-05, 'border_count': 37, 'bagging_temperature': 0.9268563454401791, 'random_strength': 0.5394760110132387, 'grow_policy': 'SymmetricTree', 'min_data_in_leaf': 871}. Best is trial 374 with value: 6012.54835621459.[0m
[32m[I 2024-10-13 06:11:06,220][0m Trial 792 finished with value: 7407.093940399581 and parameters: {'depth': 5, 'learning_rate': 0.18560049707073825, 'iterations': 101, 'l2_leaf_reg': 7.733676262703502e-06, 'border_count': 23, 'bagging_temperature': 0.8831163387031454, 'random_strength': 0.292446402024775, 'grow_policy': 'SymmetricTree', 'min_data_in_leaf': 911}. Best is trial 374 with value: 6012.54835621459.[0m
[32m[I 2024-10-13 06:11:07,075][0m Trial 793 finished with value: 8810.787375897493 and parameters: {'depth': 5, 'learning_rate': 0.2571064697115053, 'iterations': 280, 'l2_leaf_reg': 1.9175571120709033e-05, 'border_count': 31, 'bagging_temperature': 0.9094421059862305, 'random_strength': 0.6890835061989453, 'grow_policy': 'SymmetricTree', 'min_data_in_leaf': 932}. Best is trial 374 with value: 6012.54835621459.[0m
[32m[I 2024-10-13 06:11:07,723][0m Trial 794 finished with value: 10314.40042025625 and parameters: {'depth': 5, 'learning_rate': 0.2179109383239646, 'iterations': 100, 'l2_leaf_reg': 6.654251773390196e-05, 'border_count': 27, 'bagging_temperature': 0.8588602875274863, 'random_strength': 7.200120999325636, 'grow_policy': 'SymmetricTree', 'min_data_in_leaf': 955}. Best is trial 374 with value: 6012.54835621459.[0m
[32m[I 2024-10-13 06:11:08,785][0m Trial 795 finished with value: 11267.986203727429 and parameters: {'depth': 6, 'learning_rate': 0.22676576869997356, 'iterations': 396, 'l2_leaf_reg': 1.1646429516488096e-05, 'border_count': 37, 'bagging_temperature': 0.8885927345503154, 'random_strength': 0.3989663566458681, 'grow_policy': 'SymmetricTree', 'min_data_in_leaf': 845}. Best is trial 374 with value: 6012.54835621459.[0m
[32m[I 2024-10-13 06:11:09,543][0m Trial 796 finished with value: 9215.444375198744 and parameters: {'depth': 5, 'learning_rate': 0.18784368297006454, 'iterations': 215, 'l2_leaf_reg': 3.407520713883841e-05, 'border_count': 18, 'bagging_temperature': 0.9143253300628084, 'random_strength': 0.24255949332390436, 'grow_policy': 'SymmetricTree', 'min_data_in_leaf': 901}. Best is trial 374 with value: 6012.54835621459.[0m
[32m[I 2024-10-13 06:11:10,379][0m Trial 797 finished with value: 11775.105381186551 and parameters: {'depth': 4, 'learning_rate': 0.2665243273285075, 'iterations': 285, 'l2_leaf_reg': 1.7948710138305583e-05, 'border_count': 32, 'bagging_temperature': 0.9328748368720203, 'random_strength': 0.544069617048679, 'grow_policy': 'SymmetricTree', 'min_data_in_leaf': 877}. Best is trial 374 with value: 6012.54835621459.[0m
[32m[I 2024-10-13 06:11:21,405][0m Trial 798 finished with value: 10446.256485381935 and parameters: {'depth': 5, 'learning_rate': 0.17714043225099957, 'iterations': 2780, 'l2_leaf_reg': 1.0623609954494033e-05, 'border_count': 23, 'bagging_temperature': 0.8698209565301682, 'random_strength': 0.16354291758129355, 'grow_policy': 'SymmetricTree', 'min_data_in_leaf': 973}. Best is trial 374 with value: 6012.54835621459.[0m
[32m[I 2024-10-13 06:11:22,171][0m Trial 799 finished with value: 7682.483158464061 and parameters: {'depth': 5, 'learning_rate': 0.2158123338672252, 'iterations': 192, 'l2_leaf_reg': 4.8516574226843505e-05, 'border_count': 28, 'bagging_temperature': 0.9027850218826634, 'random_strength': 0.018860186775782495, 'grow_policy': 'SymmetricTree', 'min_data_in_leaf': 919}. Best is trial 374 with value: 6012.54835621459.[0m
[32m[I 2024-10-13 06:11:23,123][0m Trial 800 finished with value: 9317.56592715531 and parameters: {'depth': 5, 'learning_rate': 0.2505791019854829, 'iterations': 350, 'l2_leaf_reg': 7.593537553056291e-06, 'border_count': 38, 'bagging_temperature': 0.8806961468420589, 'random_strength': 0.7740480569265659, 'grow_policy': 'SymmetricTree', 'min_data_in_leaf': 938}. Best is trial 374 with value: 6012.54835621459.[0m
[32m[I 2024-10-13 06:11:23,931][0m Trial 801 finished with value: 9136.79065004151 and parameters: {'depth': 5, 'learning_rate': 0.29909987539510746, 'iterations': 244, 'l2_leaf_reg': 3.095367116803381e-05, 'border_count': 21, 'bagging_temperature': 0.9311037125919486, 'random_strength': 0.42830194222396883, 'grow_policy': 'SymmetricTree', 'min_data_in_leaf': 875}. Best is trial 374 with value: 6012.54835621459.[0m
[32m[I 2024-10-13 06:11:30,158][0m Trial 802 finished with value: 10453.28046569449 and parameters: {'depth': 4, 'learning_rate': 0.18978627973482687, 'iterations': 1780, 'l2_leaf_reg': 2.1118855537326452e-05, 'border_count': 15, 'bagging_temperature': 0.8569637521246161, 'random_strength': 0.32278585505262314, 'grow_policy': 'SymmetricTree', 'min_data_in_leaf': 900}. Best is trial 374 with value: 6012.54835621459.[0m
[32m[I 2024-10-13 06:11:30,812][0m Trial 803 finished with value: 10430.516718904886 and parameters: {'depth': 6, 'learning_rate': 0.22677408978500635, 'iterations': 162, 'l2_leaf_reg': 1.1643649566365755e-05, 'border_count': 34, 'bagging_temperature': 0.906245302175557, 'random_strength': 0.6421959106108927, 'grow_policy': 'Lossguide', 'min_data_in_leaf': 850, 'max_leaves': 110}. Best is trial 374 with value: 6012.54835621459.[0m
[32m[I 2024-10-13 06:11:31,700][0m Trial 804 finished with value: 8087.21878688328 and parameters: {'depth': 5, 'learning_rate': 0.17098718882896596, 'iterations': 302, 'l2_leaf_reg': 7.71889399514285e-06, 'border_count': 25, 'bagging_temperature': 0.888197595997718, 'random_strength': 0.011258854202747526, 'grow_policy': 'SymmetricTree', 'min_data_in_leaf': 718}. Best is trial 374 with value: 6012.54835621459.[0m
[32m[I 2024-10-13 06:11:32,492][0m Trial 805 finished with value: 8561.002023909832 and parameters: {'depth': 5, 'learning_rate': 0.2506526804628233, 'iterations': 221, 'l2_leaf_reg': 1.972725284900535e-05, 'border_count': 30, 'bagging_temperature': 0.920096631983312, 'random_strength': 0.5070244173261662, 'grow_policy': 'SymmetricTree', 'min_data_in_leaf': 920}. Best is trial 374 with value: 6012.54835621459.[0m
[32m[I 2024-10-13 06:11:33,511][0m Trial 806 finished with value: 7944.629054328582 and parameters: {'depth': 5, 'learning_rate': 0.20073415729512464, 'iterations': 398, 'l2_leaf_reg': 4.4111641860994705e-05, 'border_count': 13, 'bagging_temperature': 0.8574663347362351, 'random_strength': 0.2868493500800373, 'grow_policy': 'SymmetricTree', 'min_data_in_leaf': 521}. Best is trial 374 with value: 6012.54835621459.[0m
[32m[I 2024-10-13 06:11:34,436][0m Trial 807 finished with value: 8982.484317173634 and parameters: {'depth': 5, 'learning_rate': 0.26150050985620604, 'iterations': 336, 'l2_leaf_reg': 1.2176506662892829e-05, 'border_count': 39, 'bagging_temperature': 0.899156951551225, 'random_strength': 0.843396017533955, 'grow_policy': 'SymmetricTree', 'min_data_in_leaf': 890}. Best is trial 374 with value: 6012.54835621459.[0m
[32m[I 2024-10-13 06:11:35,127][0m Trial 808 finished with value: 21435.482608456863 and parameters: {'depth': 4, 'learning_rate': 0.0025210413136423897, 'iterations': 153, 'l2_leaf_reg': 6.744457858441469e-05, 'border_count': 7, 'bagging_temperature': 0.8723397614060301, 'random_strength': 0.18467984073860141, 'grow_policy': 'Depthwise', 'min_data_in_leaf': 727}. Best is trial 374 with value: 6012.54835621459.[0m
[32m[I 2024-10-13 06:11:35,999][0m Trial 809 finished with value: 9033.351633579468 and parameters: {'depth': 5, 'learning_rate': 0.29827980812783356, 'iterations': 265, 'l2_leaf_reg': 2.888860673720508e-05, 'border_count': 30, 'bagging_temperature': 0.9302121903085421, 'random_strength': 0.4720240244142721, 'grow_policy': 'SymmetricTree', 'min_data_in_leaf': 945}. Best is trial 374 with value: 6012.54835621459.[0m
[32m[I 2024-10-13 06:11:36,831][0m Trial 810 finished with value: 7504.756792576878 and parameters: {'depth': 6, 'learning_rate': 0.20899486176990983, 'iterations': 229, 'l2_leaf_reg': 1.5489893922035593e-05, 'border_count': 20, 'bagging_temperature': 0.8846669375146677, 'random_strength': 0.6900701779916865, 'grow_policy': 'SymmetricTree', 'min_data_in_leaf': 856}. Best is trial 374 with value: 6012.54835621459.[0m
[32m[I 2024-10-13 06:11:37,579][0m Trial 811 finished with value: 6766.634930423044 and parameters: {'depth': 5, 'learning_rate': 0.16310324269748397, 'iterations': 182, 'l2_leaf_reg': 7.169697813895158e-06, 'border_count': 34, 'bagging_temperature': 0.9104901471024796, 'random_strength': 0.31750935702270605, 'grow_policy': 'SymmetricTree', 'min_data_in_leaf': 44}. Best is trial 374 with value: 6012.54835621459.[0m
[32m[I 2024-10-13 06:11:38,240][0m Trial 812 finished with value: 6929.5363198366 and parameters: {'depth': 5, 'learning_rate': 0.16099400292272995, 'iterations': 100, 'l2_leaf_reg': 8.069942150787816e-06, 'border_count': 39, 'bagging_temperature': 0.9361138507271279, 'random_strength': 0.15496574123704174, 'grow_policy': 'SymmetricTree', 'min_data_in_leaf': 907}. Best is trial 374 with value: 6012.54835621459.[0m
[32m[I 2024-10-13 06:11:38,938][0m Trial 813 finished with value: 13091.997177158311 and parameters: {'depth': 5, 'learning_rate': 0.1477240368910647, 'iterations': 124, 'l2_leaf_reg': 8.799702363257347e-06, 'border_count': 42, 'bagging_temperature': 0.9434879869623538, 'random_strength': 9.517044132635677, 'grow_policy': 'SymmetricTree', 'min_data_in_leaf': 918}. Best is trial 374 with value: 6012.54835621459.[0m
[32m[I 2024-10-13 06:11:39,735][0m Trial 814 finished with value: 10210.862270856554 and parameters: {'depth': 4, 'learning_rate': 0.16048651077094203, 'iterations': 135, 'l2_leaf_reg': 7.453201487929469e-06, 'border_count': 43, 'bagging_temperature': 0.9370905002822403, 'random_strength': 0.020989340265172463, 'grow_policy': 'SymmetricTree', 'min_data_in_leaf': 249}. Best is trial 374 with value: 6012.54835621459.[0m
[32m[I 2024-10-13 06:11:40,323][0m Trial 815 finished with value: 7989.750599960713 and parameters: {'depth': 5, 'learning_rate': 0.1587642641094212, 'iterations': 150, 'l2_leaf_reg': 6.28680306255115e-06, 'border_count': 38, 'bagging_temperature': 0.932982503476011, 'random_strength': 0.1647699525121541, 'grow_policy': 'SymmetricTree', 'min_data_in_leaf': 952}. Best is trial 374 with value: 6012.54835621459.[0m
[32m[I 2024-10-13 06:11:41,107][0m Trial 816 finished with value: 8399.149518638205 and parameters: {'depth': 5, 'learning_rate': 0.15394962914162125, 'iterations': 179, 'l2_leaf_reg': 1.2934403871076581e-05, 'border_count': 44, 'bagging_temperature': 0.9188162128338239, 'random_strength': 0.20313130074630795, 'grow_policy': 'SymmetricTree', 'min_data_in_leaf': 202}. Best is trial 374 with value: 6012.54835621459.[0m
[32m[I 2024-10-13 06:11:41,808][0m Trial 817 finished with value: 13779.956180970683 and parameters: {'depth': 6, 'learning_rate': 0.17084048097371501, 'iterations': 116, 'l2_leaf_reg': 8.806019912510902e-06, 'border_count': 149, 'bagging_temperature': 0.9477603251638874, 'random_strength': 0.1770930116952214, 'grow_policy': 'SymmetricTree', 'min_data_in_leaf': 838}. Best is trial 374 with value: 6012.54835621459.[0m
[32m[I 2024-10-13 06:11:42,466][0m Trial 818 finished with value: 7191.559457468963 and parameters: {'depth': 5, 'learning_rate': 0.17175942768448269, 'iterations': 101, 'l2_leaf_reg': 6.850570312659961e-06, 'border_count': 38, 'bagging_temperature': 0.9154457123840015, 'random_strength': 0.016187465451544814, 'grow_policy': 'SymmetricTree', 'min_data_in_leaf': 43}. Best is trial 374 with value: 6012.54835621459.[0m
[32m[I 2024-10-13 06:11:43,227][0m Trial 819 finished with value: 8091.647000377904 and parameters: {'depth': 5, 'learning_rate': 0.13863747075912836, 'iterations': 191, 'l2_leaf_reg': 1.163317927924724e-05, 'border_count': 36, 'bagging_temperature': 0.9333341383350039, 'random_strength': 0.2996620722156733, 'grow_policy': 'SymmetricTree', 'min_data_in_leaf': 886}. Best is trial 374 with value: 6012.54835621459.[0m
[32m[I 2024-10-13 06:11:44,052][0m Trial 820 finished with value: 6646.619622202051 and parameters: {'depth': 5, 'learning_rate': 0.18346712832918669, 'iterations': 215, 'l2_leaf_reg': 1.7077798845483594e-05, 'border_count': 41, 'bagging_temperature': 0.7368091804847133, 'random_strength': 0.30112636405490345, 'grow_policy': 'SymmetricTree', 'min_data_in_leaf': 109}. Best is trial 374 with value: 6012.54835621459.[0m
[32m[I 2024-10-13 06:11:44,878][0m Trial 821 finished with value: 7949.049320247917 and parameters: {'depth': 5, 'learning_rate': 0.1907024043558116, 'iterations': 247, 'l2_leaf_reg': 1.8170111722942916e-05, 'border_count': 34, 'bagging_temperature': 0.756717153624905, 'random_strength': 0.38595374173997, 'grow_policy': 'SymmetricTree', 'min_data_in_leaf': 174}. Best is trial 374 with value: 6012.54835621459.[0m
[32m[I 2024-10-13 06:11:45,938][0m Trial 822 finished with value: 10841.375109955663 and parameters: {'depth': 8, 'learning_rate': 0.18656365751814896, 'iterations': 242, 'l2_leaf_reg': 1.919374310762768e-05, 'border_count': 42, 'bagging_temperature': 0.7142456932498563, 'random_strength': 0.5690277726876178, 'grow_policy': 'SymmetricTree', 'min_data_in_leaf': 56}. Best is trial 374 with value: 6012.54835621459.[0m
