[32m[I 2024-10-13 05:55:49,693][0m Trial 102 finished with value: 11057.050368391723 and parameters: {'depth': 9, 'learning_rate': 0.052638799269282, 'iterations': 471, 'l2_leaf_reg': 3.542427945890739e-08, 'border_count': 39, 'bagging_temperature': 0.870511574071476, 'random_strength': 2.070386080472894, 'grow_policy': 'SymmetricTree', 'min_data_in_leaf': 414}. Best is trial 92 with value: 9280.71396120231.[0m
[32m[I 2024-10-13 05:55:50,678][0m Trial 103 finished with value: 9838.121586736941 and parameters: {'depth': 7, 'learning_rate': 0.02923212635607132, 'iterations': 284, 'l2_leaf_reg': 3.84845832554346e-08, 'border_count': 41, 'bagging_temperature': 0.862308807751226, 'random_strength': 2.0487968199261855, 'grow_policy': 'SymmetricTree', 'min_data_in_leaf': 388}. Best is trial 92 with value: 9280.71396120231.[0m
[32m[I 2024-10-13 05:55:51,696][0m Trial 104 finished with value: 10085.382802669788 and parameters: {'depth': 7, 'learning_rate': 0.025518697264167476, 'iterations': 282, 'l2_leaf_reg': 3.443306921654823e-08, 'border_count': 40, 'bagging_temperature': 0.8454641713471721, 'random_strength': 2.06875170826985, 'grow_policy': 'SymmetricTree', 'min_data_in_leaf': 396}. Best is trial 92 with value: 9280.71396120231.[0m
[32m[I 2024-10-13 05:55:52,646][0m Trial 105 finished with value: 13281.371034550939 and parameters: {'depth': 7, 'learning_rate': 0.00741273022136722, 'iterations': 256, 'l2_leaf_reg': 1.6346524032868086e-08, 'border_count': 41, 'bagging_temperature': 0.8623478006483036, 'random_strength': 1.9844975718470474, 'grow_policy': 'SymmetricTree', 'min_data_in_leaf': 394}. Best is trial 92 with value: 9280.71396120231.[0m
[32m[I 2024-10-13 05:55:53,869][0m Trial 106 finished with value: 9946.532078951019 and parameters: {'depth': 7, 'learning_rate': 0.05832601184721692, 'iterations': 424, 'l2_leaf_reg': 3.71202962454566e-08, 'border_count': 37, 'bagging_temperature': 0.8203434221115675, 'random_strength': 2.288686847088315, 'grow_policy': 'SymmetricTree', 'min_data_in_leaf': 405}. Best is trial 92 with value: 9280.71396120231.[0m
[32m[I 2024-10-13 05:55:55,017][0m Trial 107 finished with value: 10493.90208427325 and parameters: {'depth': 7, 'learning_rate': 0.02255975365010118, 'iterations': 383, 'l2_leaf_reg': 3.6415384937651386e-08, 'border_count': 41, 'bagging_temperature': 0.8310420458183825, 'random_strength': 2.6894380362427155, 'grow_policy': 'SymmetricTree', 'min_data_in_leaf': 465}. Best is trial 92 with value: 9280.71396120231.[0m
[32m[I 2024-10-13 05:55:55,751][0m Trial 108 finished with value: 10693.900238053935 and parameters: {'depth': 6, 'learning_rate': 0.022110843109208078, 'iterations': 154, 'l2_leaf_reg': 2.991963821139379e-08, 'border_count': 37, 'bagging_temperature': 0.8011810855164299, 'random_strength': 2.307452286523991, 'grow_policy': 'SymmetricTree', 'min_data_in_leaf': 406}. Best is trial 92 with value: 9280.71396120231.[0m
[32m[I 2024-10-13 05:55:56,782][0m Trial 109 finished with value: 13777.534965377572 and parameters: {'depth': 6, 'learning_rate': 0.02435759773443565, 'iterations': 343, 'l2_leaf_reg': 1.8416331114883152e-08, 'border_count': 49, 'bagging_temperature': 0.8245382775909145, 'random_strength': 3.0889971910042218, 'grow_policy': 'SymmetricTree', 'min_data_in_leaf': 381}. Best is trial 92 with value: 9280.71396120231.[0m
[32m[I 2024-10-13 05:55:57,648][0m Trial 110 finished with value: 15436.873514232206 and parameters: {'depth': 7, 'learning_rate': 0.017467011608113057, 'iterations': 209, 'l2_leaf_reg': 6.202040241580015e-08, 'border_count': 8, 'bagging_temperature': 0.7907948034408107, 'random_strength': 2.3917392226743526, 'grow_policy': 'SymmetricTree', 'min_data_in_leaf': 476}. Best is trial 92 with value: 9280.71396120231.[0m
[32m[I 2024-10-13 05:55:58,372][0m Trial 111 finished with value: 11058.619052699214 and parameters: {'depth': 7, 'learning_rate': 0.029522984299994018, 'iterations': 111, 'l2_leaf_reg': 2.715898337541455e-08, 'border_count': 38, 'bagging_temperature': 0.9313778714462485, 'random_strength': 2.2618292175919037, 'grow_policy': 'SymmetricTree', 'min_data_in_leaf': 407}. Best is trial 92 with value: 9280.71396120231.[0m
[32m[I 2024-10-13 05:55:59,595][0m Trial 112 finished with value: 9953.074357801619 and parameters: {'depth': 6, 'learning_rate': 0.01436782865898718, 'iterations': 495, 'l2_leaf_reg': 3.541034463820192e-08, 'border_count': 32, 'bagging_temperature': 0.841832091989038, 'random_strength': 2.747922541751675, 'grow_policy': 'SymmetricTree', 'min_data_in_leaf': 413}. Best is trial 92 with value: 9280.71396120231.[0m
[32m[I 2024-10-13 05:56:00,516][0m Trial 113 finished with value: 11202.893514735333 and parameters: {'depth': 5, 'learning_rate': 0.012712403097915746, 'iterations': 304, 'l2_leaf_reg': 7.457606801341631e-08, 'border_count': 33, 'bagging_temperature': 0.8405577948325135, 'random_strength': 2.635735587639921, 'grow_policy': 'SymmetricTree', 'min_data_in_leaf': 467}. Best is trial 92 with value: 9280.71396120231.[0m
[32m[I 2024-10-13 05:56:01,578][0m Trial 114 finished with value: 13874.533969908878 and parameters: {'depth': 6, 'learning_rate': 0.01875379593230852, 'iterations': 396, 'l2_leaf_reg': 5.0775923886185036e-08, 'border_count': 51, 'bagging_temperature': 0.7503839428409633, 'random_strength': 2.888790467836718, 'grow_policy': 'SymmetricTree', 'min_data_in_leaf': 442}. Best is trial 92 with value: 9280.71396120231.[0m
[32m[I 2024-10-13 05:56:02,442][0m Trial 115 finished with value: 10795.30515019229 and parameters: {'depth': 6, 'learning_rate': 0.014291953278681553, 'iterations': 248, 'l2_leaf_reg': 1.353477067661325e-08, 'border_count': 19, 'bagging_temperature': 0.8300951696309624, 'random_strength': 3.416815467417753, 'grow_policy': 'SymmetricTree', 'min_data_in_leaf': 513}. Best is trial 92 with value: 9280.71396120231.[0m
[32m[I 2024-10-13 05:56:03,207][0m Trial 116 finished with value: 12593.799024601693 and parameters: {'depth': 6, 'learning_rate': 0.013382281576809124, 'iterations': 183, 'l2_leaf_reg': 1.0574832657178468e-08, 'border_count': 22, 'bagging_temperature': 0.8378329161642879, 'random_strength': 3.5339844014028126, 'grow_policy': 'SymmetricTree', 'min_data_in_leaf': 319}. Best is trial 92 with value: 9280.71396120231.[0m
[32m[I 2024-10-13 05:56:04,026][0m Trial 117 finished with value: 10529.827119806929 and parameters: {'depth': 6, 'learning_rate': 0.019594800630457026, 'iterations': 211, 'l2_leaf_reg': 2.410262089647474e-08, 'border_count': 15, 'bagging_temperature': 0.8009589265170731, 'random_strength': 3.038989952642107, 'grow_policy': 'SymmetricTree', 'min_data_in_leaf': 515}. Best is trial 92 with value: 9280.71396120231.[0m
[32m[I 2024-10-13 05:56:04,934][0m Trial 118 finished with value: 19127.33442213673 and parameters: {'depth': 5, 'learning_rate': 0.022216446613950554, 'iterations': 499, 'l2_leaf_reg': 2.5295567816543716e-08, 'border_count': 1, 'bagging_temperature': 0.8031670002165869, 'random_strength': 3.0466189022600285, 'grow_policy': 'Lossguide', 'min_data_in_leaf': 287, 'max_leaves': 255}. Best is trial 92 with value: 9280.71396120231.[0m
[32m[I 2024-10-13 05:56:06,033][0m Trial 119 finished with value: 9944.16028282893 and parameters: {'depth': 7, 'learning_rate': 0.01992855958939265, 'iterations': 351, 'l2_leaf_reg': 2.0904700347692372e-08, 'border_count': 13, 'bagging_temperature': 0.897496796698063, 'random_strength': 2.61149643055949, 'grow_policy': 'SymmetricTree', 'min_data_in_leaf': 461}. Best is trial 92 with value: 9280.71396120231.[0m
[32m[I 2024-10-13 05:56:07,127][0m Trial 120 finished with value: 9961.832257694425 and parameters: {'depth': 7, 'learning_rate': 0.03284989731733385, 'iterations': 350, 'l2_leaf_reg': 2.160260741172707e-08, 'border_count': 12, 'bagging_temperature': 0.8958441190088043, 'random_strength': 2.5708184795194993, 'grow_policy': 'SymmetricTree', 'min_data_in_leaf': 551}. Best is trial 92 with value: 9280.71396120231.[0m
[32m[I 2024-10-13 05:56:08,193][0m Trial 121 finished with value: 9757.93627278131 and parameters: {'depth': 7, 'learning_rate': 0.03312822656461021, 'iterations': 339, 'l2_leaf_reg': 2.234550786078106e-08, 'border_count': 12, 'bagging_temperature': 0.9023797754919849, 'random_strength': 2.5559962207493223, 'grow_policy': 'SymmetricTree', 'min_data_in_leaf': 488}. Best is trial 92 with value: 9280.71396120231.[0m
[32m[I 2024-10-13 05:56:09,378][0m Trial 122 finished with value: 10481.686319697052 and parameters: {'depth': 7, 'learning_rate': 0.030421560508878242, 'iterations': 363, 'l2_leaf_reg': 1.863050621277238e-08, 'border_count': 26, 'bagging_temperature': 0.901056563911616, 'random_strength': 2.6051047609446147, 'grow_policy': 'SymmetricTree', 'min_data_in_leaf': 535}. Best is trial 92 with value: 9280.71396120231.[0m
[32m[I 2024-10-13 05:56:10,513][0m Trial 123 finished with value: 10389.917157972312 and parameters: {'depth': 7, 'learning_rate': 0.0327278417024783, 'iterations': 356, 'l2_leaf_reg': 1.0298053523788895e-08, 'border_count': 26, 'bagging_temperature': 0.9022408528413122, 'random_strength': 2.616287771465148, 'grow_policy': 'SymmetricTree', 'min_data_in_leaf': 553}. Best is trial 92 with value: 9280.71396120231.[0m
[32m[I 2024-10-13 05:56:11,523][0m Trial 124 finished with value: 10643.38669759666 and parameters: {'depth': 7, 'learning_rate': 0.03356925724905094, 'iterations': 306, 'l2_leaf_reg': 1.7399042212651733e-08, 'border_count': 26, 'bagging_temperature': 0.8981664815184959, 'random_strength': 2.6477738668286928, 'grow_policy': 'SymmetricTree', 'min_data_in_leaf': 550}. Best is trial 92 with value: 9280.71396120231.[0m
[32m[I 2024-10-13 05:56:12,429][0m Trial 125 finished with value: 13355.94356005375 and parameters: {'depth': 7, 'learning_rate': 0.02842695737649874, 'iterations': 447, 'l2_leaf_reg': 5.250637363340179e-08, 'border_count': 13, 'bagging_temperature': 0.9167611092490274, 'random_strength': 3.8932079203088357, 'grow_policy': 'Depthwise', 'min_data_in_leaf': 489}. Best is trial 92 with value: 9280.71396120231.[0m
[32m[I 2024-10-13 05:56:13,575][0m Trial 126 finished with value: 15676.195388469234 and parameters: {'depth': 7, 'learning_rate': 0.03625535148364389, 'iterations': 361, 'l2_leaf_reg': 1.7289706524919106e-08, 'border_count': 9, 'bagging_temperature': 0.8554084904075624, 'random_strength': 3.262962343180973, 'grow_policy': 'SymmetricTree', 'min_data_in_leaf': 579}. Best is trial 92 with value: 9280.71396120231.[0m
[32m[I 2024-10-13 05:56:19,073][0m Trial 127 finished with value: 14131.717604625594 and parameters: {'depth': 8, 'learning_rate': 0.009952249709506023, 'iterations': 548, 'l2_leaf_reg': 1.1185501085592077e-08, 'border_count': 57, 'bagging_temperature': 0.8915186962643287, 'random_strength': 2.5380874219254563, 'grow_policy': 'SymmetricTree', 'min_data_in_leaf': 541}. Best is trial 92 with value: 9280.71396120231.[0m
[32m[I 2024-10-13 05:56:22,818][0m Trial 128 finished with value: 12658.86253577689 and parameters: {'depth': 7, 'learning_rate': 0.03080327126670904, 'iterations': 525, 'l2_leaf_reg': 7.205577885970845e-08, 'border_count': 46, 'bagging_temperature': 0.9254120657520625, 'random_strength': 2.1752589195080785, 'grow_policy': 'SymmetricTree', 'min_data_in_leaf': 614}. Best is trial 92 with value: 9280.71396120231.[0m
[32m[I 2024-10-13 05:56:23,832][0m Trial 129 finished with value: 10452.445671224332 and parameters: {'depth': 7, 'learning_rate': 0.015681542467812216, 'iterations': 290, 'l2_leaf_reg': 2.173490572780875e-08, 'border_count': 21, 'bagging_temperature': 0.9719313730031706, 'random_strength': 2.918775665987606, 'grow_policy': 'SymmetricTree', 'min_data_in_leaf': 519}. Best is trial 92 with value: 9280.71396120231.[0m
[32m[I 2024-10-13 05:56:25,302][0m Trial 130 finished with value: 10196.973033621638 and parameters: {'depth': 8, 'learning_rate': 0.01594887855784913, 'iterations': 448, 'l2_leaf_reg': 1.195734908843616, 'border_count': 20, 'bagging_temperature': 0.9757883299582351, 'random_strength': 2.833408940055487, 'grow_policy': 'SymmetricTree', 'min_data_in_leaf': 380}. Best is trial 92 with value: 9280.71396120231.[0m
[32m[I 2024-10-13 05:56:26,747][0m Trial 131 finished with value: 10514.47761224286 and parameters: {'depth': 8, 'learning_rate': 0.015601217885143044, 'iterations': 431, 'l2_leaf_reg': 1.619337281910888, 'border_count': 20, 'bagging_temperature': 0.9661957692574441, 'random_strength': 2.8962146742235744, 'grow_policy': 'SymmetricTree', 'min_data_in_leaf': 376}. Best is trial 92 with value: 9280.71396120231.[0m
[32m[I 2024-10-13 05:56:27,881][0m Trial 132 finished with value: 12571.605495923448 and parameters: {'depth': 8, 'learning_rate': 0.008089122421414323, 'iterations': 295, 'l2_leaf_reg': 0.33372542248839465, 'border_count': 33, 'bagging_temperature': 0.976246222342203, 'random_strength': 1.849429772401412, 'grow_policy': 'SymmetricTree', 'min_data_in_leaf': 361}. Best is trial 92 with value: 9280.71396120231.[0m
[32m[I 2024-10-13 05:56:29,013][0m Trial 133 finished with value: 15749.755052953302 and parameters: {'depth': 8, 'learning_rate': 0.025771561147751303, 'iterations': 258, 'l2_leaf_reg': 4.204619056838635e-08, 'border_count': 7, 'bagging_temperature': 0.8804474180713354, 'random_strength': 2.416659183457734, 'grow_policy': 'SymmetricTree', 'min_data_in_leaf': 497}. Best is trial 92 with value: 9280.71396120231.[0m
[32m[I 2024-10-13 05:56:30,307][0m Trial 134 finished with value: 10100.989181657244 and parameters: {'depth': 7, 'learning_rate': 0.015851120298846152, 'iterations': 456, 'l2_leaf_reg': 1.0541313692740323e-08, 'border_count': 21, 'bagging_temperature': 0.9502771027062709, 'random_strength': 3.6945990456174123, 'grow_policy': 'SymmetricTree', 'min_data_in_leaf': 457}. Best is trial 92 with value: 9280.71396120231.[0m
[32m[I 2024-10-13 05:56:33,637][0m Trial 135 finished with value: 11791.845921818807 and parameters: {'depth': 7, 'learning_rate': 0.019205281157285963, 'iterations': 593, 'l2_leaf_reg': 1.0517781309429038e-08, 'border_count': 11, 'bagging_temperature': 0.9276353504951341, 'random_strength': 1.4926998447764523, 'grow_policy': 'SymmetricTree', 'min_data_in_leaf': 454}. Best is trial 92 with value: 9280.71396120231.[0m
[32m[I 2024-10-13 05:56:34,812][0m Trial 136 finished with value: 9892.073296451896 and parameters: {'depth': 6, 'learning_rate': 0.011764456671029292, 'iterations': 471, 'l2_leaf_reg': 0.004619396999494943, 'border_count': 28, 'bagging_temperature': 0.9091029608041636, 'random_strength': 2.1550220091807555, 'grow_policy': 'SymmetricTree', 'min_data_in_leaf': 395}. Best is trial 92 with value: 9280.71396120231.[0m
[32m[I 2024-10-13 05:56:35,980][0m Trial 137 finished with value: 10740.102862456206 and parameters: {'depth': 6, 'learning_rate': 0.01035171769759872, 'iterations': 466, 'l2_leaf_reg': 0.004090357641892707, 'border_count': 35, 'bagging_temperature': 0.9503341929652908, 'random_strength': 3.629830610561204, 'grow_policy': 'SymmetricTree', 'min_data_in_leaf': 403}. Best is trial 92 with value: 9280.71396120231.[0m
[32m[I 2024-10-13 05:56:37,079][0m Trial 138 finished with value: 11845.003503309541 and parameters: {'depth': 6, 'learning_rate': 0.006575203872535642, 'iterations': 413, 'l2_leaf_reg': 0.10963604517853254, 'border_count': 27, 'bagging_temperature': 0.8537715073043172, 'random_strength': 3.2979415178142437, 'grow_policy': 'SymmetricTree', 'min_data_in_leaf': 351}. Best is trial 92 with value: 9280.71396120231.[0m
[32m[I 2024-10-13 05:56:39,639][0m Trial 139 finished with value: 14894.371429909545 and parameters: {'depth': 7, 'learning_rate': 0.01653493592506166, 'iterations': 505, 'l2_leaf_reg': 0.026558875293594547, 'border_count': 5, 'bagging_temperature': 0.9022736140954576, 'random_strength': 2.0694768426991157, 'grow_policy': 'SymmetricTree', 'min_data_in_leaf': 386}. Best is trial 92 with value: 9280.71396120231.[0m
[32m[I 2024-10-13 05:56:40,417][0m Trial 140 finished with value: 15714.315492111313 and parameters: {'depth': 7, 'learning_rate': 0.011580491243819364, 'iterations': 341, 'l2_leaf_reg': 2.746640620882119e-08, 'border_count': 45, 'bagging_temperature': 0.8804650261457808, 'random_strength': 2.2690404089982827, 'grow_policy': 'Lossguide', 'min_data_in_leaf': 429, 'max_leaves': 73}. Best is trial 92 with value: 9280.71396120231.[0m
[32m[I 2024-10-13 05:56:56,647][0m Trial 141 finished with value: 11314.860993262695 and parameters: {'depth': 7, 'learning_rate': 0.026873931830633885, 'iterations': 2715, 'l2_leaf_reg': 0.45438622247394117, 'border_count': 24, 'bagging_temperature': 0.9434676571661674, 'random_strength': 1.7269648251183802, 'grow_policy': 'SymmetricTree', 'min_data_in_leaf': 480}. Best is trial 92 with value: 9280.71396120231.[0m
[32m[I 2024-10-13 05:57:00,019][0m Trial 142 finished with value: 10691.259946015052 and parameters: {'depth': 6, 'learning_rate': 0.037637717896626066, 'iterations': 578, 'l2_leaf_reg': 8.931314351626092, 'border_count': 30, 'bagging_temperature': 0.9108316684807106, 'random_strength': 2.4688789713348283, 'grow_policy': 'SymmetricTree', 'min_data_in_leaf': 456}. Best is trial 92 with value: 9280.71396120231.[0m
[32m[I 2024-10-13 05:57:01,065][0m Trial 143 finished with value: 9375.803936936845 and parameters: {'depth': 5, 'learning_rate': 0.021151050719843932, 'iterations': 423, 'l2_leaf_reg': 7.639939783419498e-08, 'border_count': 19, 'bagging_temperature': 0.8478462634505716, 'random_strength': 2.744313712941839, 'grow_policy': 'SymmetricTree', 'min_data_in_leaf': 558}. Best is trial 92 with value: 9280.71396120231.[0m
[32m[I 2024-10-13 05:57:02,099][0m Trial 144 finished with value: 9877.789323469431 and parameters: {'depth': 5, 'learning_rate': 0.021059981300641278, 'iterations': 408, 'l2_leaf_reg': 4.759618519731679e-08, 'border_count': 19, 'bagging_temperature': 0.7729123219451729, 'random_strength': 2.7689375999688406, 'grow_policy': 'SymmetricTree', 'min_data_in_leaf': 426}. Best is trial 92 with value: 9280.71396120231.[0m
[32m[I 2024-10-13 05:57:03,139][0m Trial 145 finished with value: 9907.82233210405 and parameters: {'depth': 4, 'learning_rate': 0.02055311495615328, 'iterations': 457, 'l2_leaf_reg': 5.965487009362045e-08, 'border_count': 19, 'bagging_temperature': 0.7788843768966944, 'random_strength': 2.7514075036357353, 'grow_policy': 'SymmetricTree', 'min_data_in_leaf': 425}. Best is trial 92 with value: 9280.71396120231.[0m
[32m[I 2024-10-13 05:57:04,056][0m Trial 146 finished with value: 10192.772485353777 and parameters: {'depth': 3, 'learning_rate': 0.021723076577828557, 'iterations': 439, 'l2_leaf_reg': 4.4489209603770656e-08, 'border_count': 13, 'bagging_temperature': 0.7671391405018351, 'random_strength': 2.784203351749687, 'grow_policy': 'SymmetricTree', 'min_data_in_leaf': 422}. Best is trial 92 with value: 9280.71396120231.[0m
[32m[I 2024-10-13 05:57:04,797][0m Trial 147 finished with value: 12125.01278751415 and parameters: {'depth': 3, 'learning_rate': 0.021601256004152088, 'iterations': 230, 'l2_leaf_reg': 8.014462393869056e-08, 'border_count': 12, 'bagging_temperature': 0.7522498783824791, 'random_strength': 3.137447978496108, 'grow_policy': 'SymmetricTree', 'min_data_in_leaf': 432}. Best is trial 92 with value: 9280.71396120231.[0m
[32m[I 2024-10-13 05:57:07,035][0m Trial 148 finished with value: 14914.043406347886 and parameters: {'depth': 4, 'learning_rate': 0.02459779714276646, 'iterations': 520, 'l2_leaf_reg': 4.240914306310035e-08, 'border_count': 5, 'bagging_temperature': 0.6787667221248384, 'random_strength': 2.765665019718216, 'grow_policy': 'SymmetricTree', 'min_data_in_leaf': 455}. Best is trial 92 with value: 9280.71396120231.[0m
[32m[I 2024-10-13 05:57:07,698][0m Trial 149 finished with value: 15079.569708826833 and parameters: {'depth': 5, 'learning_rate': 0.019364495447564092, 'iterations': 169, 'l2_leaf_reg': 5.8750147817275e-08, 'border_count': 17, 'bagging_temperature': 0.7282072551688372, 'random_strength': 3.7581602034523094, 'grow_policy': 'Depthwise', 'min_data_in_leaf': 418}. Best is trial 92 with value: 9280.71396120231.[0m
[32m[I 2024-10-13 05:57:08,710][0m Trial 150 finished with value: 10898.822549082113 and parameters: {'depth': 4, 'learning_rate': 0.012081376033518705, 'iterations': 432, 'l2_leaf_reg': 3.220665046300214e-08, 'border_count': 12, 'bagging_temperature': 0.8191247975016903, 'random_strength': 2.413743644382694, 'grow_policy': 'SymmetricTree', 'min_data_in_leaf': 491}. Best is trial 92 with value: 9280.71396120231.[0m
[32m[I 2024-10-13 05:57:09,679][0m Trial 151 finished with value: 10934.190124045403 and parameters: {'depth': 3, 'learning_rate': 0.015469046422359226, 'iterations': 465, 'l2_leaf_reg': 0.0014132073322371253, 'border_count': 20, 'bagging_temperature': 0.7635001210805079, 'random_strength': 2.7510136903049336, 'grow_policy': 'SymmetricTree', 'min_data_in_leaf': 374}. Best is trial 92 with value: 9280.71396120231.[0m
[32m[I 2024-10-13 05:57:10,579][0m Trial 152 finished with value: 12125.43190709312 and parameters: {'depth': 3, 'learning_rate': 0.00917473285528681, 'iterations': 413, 'l2_leaf_reg': 8.612574074550435e-08, 'border_count': 37, 'bagging_temperature': 0.7867693580872944, 'random_strength': 4.286657222924826, 'grow_policy': 'SymmetricTree', 'min_data_in_leaf': 323}. Best is trial 92 with value: 9280.71396120231.[0m
[32m[I 2024-10-13 05:57:11,533][0m Trial 153 finished with value: 10352.298618110653 and parameters: {'depth': 5, 'learning_rate': 0.0183146008005742, 'iterations': 322, 'l2_leaf_reg': 0.007105206056721167, 'border_count': 31, 'bagging_temperature': 0.8459282214037933, 'random_strength': 2.956331350881628, 'grow_policy': 'SymmetricTree', 'min_data_in_leaf': 437}. Best is trial 92 with value: 9280.71396120231.[0m
