[32m[I 2024-10-13 06:02:07,429][0m Trial 410 finished with value: 11998.869428460808 and parameters: {'depth': 4, 'learning_rate': 0.2991442843424099, 'iterations': 158, 'l2_leaf_reg': 2.9941063217570024e-05, 'border_count': 38, 'bagging_temperature': 0.8821604855607984, 'random_strength': 0.22156749233039666, 'grow_policy': 'SymmetricTree', 'min_data_in_leaf': 799}. Best is trial 374 with value: 6012.54835621459.[0m
[32m[I 2024-10-13 06:02:08,123][0m Trial 411 finished with value: 10805.790408407214 and parameters: {'depth': 5, 'learning_rate': 0.1406644376958038, 'iterations': 102, 'l2_leaf_reg': 1.924189261242658e-05, 'border_count': 43, 'bagging_temperature': 0.9206097485544624, 'random_strength': 0.5172736786846615, 'grow_policy': 'SymmetricTree', 'min_data_in_leaf': 785}. Best is trial 374 with value: 6012.54835621459.[0m
[32m[I 2024-10-13 06:02:09,075][0m Trial 412 finished with value: 6901.546772824857 and parameters: {'depth': 5, 'learning_rate': 0.20272469216183764, 'iterations': 296, 'l2_leaf_reg': 7.260477109290235e-06, 'border_count': 35, 'bagging_temperature': 0.9141957917988742, 'random_strength': 0.23667234779926782, 'grow_policy': 'SymmetricTree', 'min_data_in_leaf': 775}. Best is trial 374 with value: 6012.54835621459.[0m
[32m[I 2024-10-13 06:02:09,959][0m Trial 413 finished with value: 14170.337583695647 and parameters: {'depth': 5, 'learning_rate': 0.24370637364375808, 'iterations': 300, 'l2_leaf_reg': 8.914581602579888e-06, 'border_count': 226, 'bagging_temperature': 0.8690430625246132, 'random_strength': 4.827864004553599, 'grow_policy': 'SymmetricTree', 'min_data_in_leaf': 823}. Best is trial 374 with value: 6012.54835621459.[0m
[32m[I 2024-10-13 06:02:10,859][0m Trial 414 finished with value: 10631.708661148716 and parameters: {'depth': 4, 'learning_rate': 0.19873641143487966, 'iterations': 297, 'l2_leaf_reg': 2.2125865210078295e-05, 'border_count': 44, 'bagging_temperature': 0.9012445589764918, 'random_strength': 0.3611748330276491, 'grow_policy': 'SymmetricTree', 'min_data_in_leaf': 776}. Best is trial 374 with value: 6012.54835621459.[0m
[32m[I 2024-10-13 06:02:11,753][0m Trial 415 finished with value: 10527.227639194785 and parameters: {'depth': 5, 'learning_rate': 0.2137542009170006, 'iterations': 309, 'l2_leaf_reg': 7.08201141562032e-06, 'border_count': 60, 'bagging_temperature': 0.9162589869095883, 'random_strength': 0.697517411585493, 'grow_policy': 'SymmetricTree', 'min_data_in_leaf': 776}. Best is trial 374 with value: 6012.54835621459.[0m
[32m[I 2024-10-13 06:02:12,470][0m Trial 416 finished with value: 10052.320093873555 and parameters: {'depth': 6, 'learning_rate': 0.1860423933963955, 'iterations': 243, 'l2_leaf_reg': 1.4353046217033706e-05, 'border_count': 32, 'bagging_temperature': 0.8452194826546878, 'random_strength': 0.5378911443282364, 'grow_policy': 'Lossguide', 'min_data_in_leaf': 802, 'max_leaves': 214}. Best is trial 374 with value: 6012.54835621459.[0m
[32m[I 2024-10-13 06:02:13,269][0m Trial 417 finished with value: 7223.349281669385 and parameters: {'depth': 5, 'learning_rate': 0.1395340536607361, 'iterations': 221, 'l2_leaf_reg': 5.688637295936881e-06, 'border_count': 39, 'bagging_temperature': 0.8814578055759485, 'random_strength': 0.2911104618803982, 'grow_policy': 'SymmetricTree', 'min_data_in_leaf': 807}. Best is trial 374 with value: 6012.54835621459.[0m
[32m[I 2024-10-13 06:02:14,161][0m Trial 418 finished with value: 10309.960915170182 and parameters: {'depth': 6, 'learning_rate': 0.13812658068155573, 'iterations': 200, 'l2_leaf_reg': 9.806743466327404e-06, 'border_count': 40, 'bagging_temperature': 0.8791900324653952, 'random_strength': 0.8106832479199262, 'grow_policy': 'SymmetricTree', 'min_data_in_leaf': 859}. Best is trial 374 with value: 6012.54835621459.[0m
[32m[I 2024-10-13 06:02:14,896][0m Trial 419 finished with value: 12945.846766918228 and parameters: {'depth': 5, 'learning_rate': 0.2406625639742694, 'iterations': 243, 'l2_leaf_reg': 5.1482463078902355e-06, 'border_count': 49, 'bagging_temperature': 0.8517955596018234, 'random_strength': 4.371012779629157, 'grow_policy': 'SymmetricTree', 'min_data_in_leaf': 826}. Best is trial 374 with value: 6012.54835621459.[0m
[32m[I 2024-10-13 06:02:15,679][0m Trial 420 finished with value: 8953.01262524199 and parameters: {'depth': 5, 'learning_rate': 0.1680766895890492, 'iterations': 212, 'l2_leaf_reg': 4.187957767884655e-05, 'border_count': 44, 'bagging_temperature': 0.87714224788443, 'random_strength': 0.37266863597699096, 'grow_policy': 'SymmetricTree', 'min_data_in_leaf': 812}. Best is trial 374 with value: 6012.54835621459.[0m
[32m[I 2024-10-13 06:02:16,540][0m Trial 421 finished with value: 7341.389881059399 and parameters: {'depth': 5, 'learning_rate': 0.12936451831148246, 'iterations': 280, 'l2_leaf_reg': 7.509236140370839e-06, 'border_count': 38, 'bagging_temperature': 0.8932415469467805, 'random_strength': 0.5332595022279776, 'grow_policy': 'SymmetricTree', 'min_data_in_leaf': 840}. Best is trial 374 with value: 6012.54835621459.[0m
[32m[I 2024-10-13 06:02:17,355][0m Trial 422 finished with value: 8874.19568699147 and parameters: {'depth': 4, 'learning_rate': 0.13455659752514768, 'iterations': 269, 'l2_leaf_reg': 7.319180997774493e-06, 'border_count': 38, 'bagging_temperature': 0.8904701527540934, 'random_strength': 0.6542810289496962, 'grow_policy': 'SymmetricTree', 'min_data_in_leaf': 843}. Best is trial 374 with value: 6012.54835621459.[0m
[32m[I 2024-10-13 06:02:18,047][0m Trial 423 finished with value: 13811.631476838824 and parameters: {'depth': 5, 'learning_rate': 0.12952390647390308, 'iterations': 211, 'l2_leaf_reg': 1.3993843759523137e-05, 'border_count': 56, 'bagging_temperature': 0.8512100748446098, 'random_strength': 0.5653473842707091, 'grow_policy': 'Depthwise', 'min_data_in_leaf': 261}. Best is trial 374 with value: 6012.54835621459.[0m
[32m[I 2024-10-13 06:02:24,088][0m Trial 424 finished with value: 11899.89806162699 and parameters: {'depth': 5, 'learning_rate': 0.15755039206301677, 'iterations': 1371, 'l2_leaf_reg': 2.706049700709244e-05, 'border_count': 47, 'bagging_temperature': 0.8929613948101497, 'random_strength': 0.7265138952961222, 'grow_policy': 'SymmetricTree', 'min_data_in_leaf': 844}. Best is trial 374 with value: 6012.54835621459.[0m
[32m[I 2024-10-13 06:02:24,971][0m Trial 425 finished with value: 6819.587675609324 and parameters: {'depth': 5, 'learning_rate': 0.12715392056234756, 'iterations': 288, 'l2_leaf_reg': 6.340552295462971e-06, 'border_count': 40, 'bagging_temperature': 0.8688235529510835, 'random_strength': 0.23893924599142533, 'grow_policy': 'SymmetricTree', 'min_data_in_leaf': 877}. Best is trial 374 with value: 6012.54835621459.[0m
[32m[I 2024-10-13 06:02:36,882][0m Trial 426 finished with value: 12067.689820157597 and parameters: {'depth': 5, 'learning_rate': 0.12342977008124104, 'iterations': 2858, 'l2_leaf_reg': 6.78948390226918e-06, 'border_count': 51, 'bagging_temperature': 0.8346939886444541, 'random_strength': 0.2101418495480086, 'grow_policy': 'SymmetricTree', 'min_data_in_leaf': 845}. Best is trial 374 with value: 6012.54835621459.[0m
[32m[I 2024-10-13 06:02:37,763][0m Trial 427 finished with value: 14017.198219825146 and parameters: {'depth': 6, 'learning_rate': 0.15258707150479223, 'iterations': 266, 'l2_leaf_reg': 8.218628922722113e-06, 'border_count': 44, 'bagging_temperature': 0.8761060607590359, 'random_strength': 0.28352458114525564, 'grow_policy': 'SymmetricTree', 'min_data_in_leaf': 930}. Best is trial 374 with value: 6012.54835621459.[0m
[32m[I 2024-10-13 06:02:38,646][0m Trial 428 finished with value: 7016.822191855444 and parameters: {'depth': 5, 'learning_rate': 0.1965173408156936, 'iterations': 301, 'l2_leaf_reg': 5.391750920640584e-06, 'border_count': 40, 'bagging_temperature': 0.8231640868205881, 'random_strength': 0.2827595553665202, 'grow_policy': 'SymmetricTree', 'min_data_in_leaf': 883}. Best is trial 374 with value: 6012.54835621459.[0m
[32m[I 2024-10-13 06:02:39,478][0m Trial 429 finished with value: 11304.710422613798 and parameters: {'depth': 4, 'learning_rate': 0.20582259802663566, 'iterations': 284, 'l2_leaf_reg': 5.350515055887964e-06, 'border_count': 42, 'bagging_temperature': 0.8376029799897575, 'random_strength': 4.033453456008461, 'grow_policy': 'SymmetricTree', 'min_data_in_leaf': 902}. Best is trial 374 with value: 6012.54835621459.[0m
[32m[I 2024-10-13 06:02:40,224][0m Trial 430 finished with value: 13019.805932236282 and parameters: {'depth': 5, 'learning_rate': 0.2960325956832959, 'iterations': 171, 'l2_leaf_reg': 1.1262412750342515e-05, 'border_count': 254, 'bagging_temperature': 0.8128940946199608, 'random_strength': 0.5479920154931114, 'grow_policy': 'SymmetricTree', 'min_data_in_leaf': 885}. Best is trial 374 with value: 6012.54835621459.[0m
[32m[I 2024-10-13 06:02:41,156][0m Trial 431 finished with value: 9755.782317625419 and parameters: {'depth': 5, 'learning_rate': 0.23756048089235068, 'iterations': 327, 'l2_leaf_reg': 1.1449590658586562e-05, 'border_count': 52, 'bagging_temperature': 0.8645157098924725, 'random_strength': 0.20425899070592773, 'grow_policy': 'SymmetricTree', 'min_data_in_leaf': 947}. Best is trial 374 with value: 6012.54835621459.[0m
[32m[I 2024-10-13 06:02:41,947][0m Trial 432 finished with value: 7809.289110809757 and parameters: {'depth': 5, 'learning_rate': 0.18419588951150792, 'iterations': 207, 'l2_leaf_reg': 4.486323733677965e-06, 'border_count': 38, 'bagging_temperature': 0.8687030738691455, 'random_strength': 0.4497479956313587, 'grow_policy': 'SymmetricTree', 'min_data_in_leaf': 890}. Best is trial 374 with value: 6012.54835621459.[0m
[32m[I 2024-10-13 06:02:42,858][0m Trial 433 finished with value: 10541.450780672523 and parameters: {'depth': 5, 'learning_rate': 0.21452201056046008, 'iterations': 314, 'l2_leaf_reg': 1.983357079547986e-05, 'border_count': 47, 'bagging_temperature': 0.851648187350698, 'random_strength': 0.8367803724418725, 'grow_policy': 'SymmetricTree', 'min_data_in_leaf': 858}. Best is trial 374 with value: 6012.54835621459.[0m
[32m[I 2024-10-13 06:02:43,666][0m Trial 434 finished with value: 8658.666088918111 and parameters: {'depth': 6, 'learning_rate': 0.157721556220531, 'iterations': 206, 'l2_leaf_reg': 5.733128192932882e-06, 'border_count': 40, 'bagging_temperature': 0.8932263191213025, 'random_strength': 0.17749067148244502, 'grow_policy': 'SymmetricTree', 'min_data_in_leaf': 874}. Best is trial 374 with value: 6012.54835621459.[0m
[32m[I 2024-10-13 06:02:44,508][0m Trial 435 finished with value: 9222.710811279472 and parameters: {'depth': 4, 'learning_rate': 0.17331670245588604, 'iterations': 306, 'l2_leaf_reg': 4.611418719275533e-06, 'border_count': 38, 'bagging_temperature': 0.8258007716061722, 'random_strength': 0.4340729657015182, 'grow_policy': 'SymmetricTree', 'min_data_in_leaf': 900}. Best is trial 374 with value: 6012.54835621459.[0m
[32m[I 2024-10-13 06:02:45,236][0m Trial 436 finished with value: 10759.455076198343 and parameters: {'depth': 5, 'learning_rate': 0.12908200719279495, 'iterations': 161, 'l2_leaf_reg': 8.316272571622533e-06, 'border_count': 45, 'bagging_temperature': 0.8827856254754375, 'random_strength': 0.7976243575576023, 'grow_policy': 'SymmetricTree', 'min_data_in_leaf': 935}. Best is trial 374 with value: 6012.54835621459.[0m
[32m[I 2024-10-13 06:02:46,170][0m Trial 437 finished with value: 16043.195485380169 and parameters: {'depth': 6, 'learning_rate': 0.24841265395928375, 'iterations': 263, 'l2_leaf_reg': 3.7470823022400373e-06, 'border_count': 110, 'bagging_temperature': 0.9012935401954784, 'random_strength': 0.24189063634689595, 'grow_policy': 'SymmetricTree', 'min_data_in_leaf': 858}. Best is trial 374 with value: 6012.54835621459.[0m
[32m[I 2024-10-13 06:02:47,169][0m Trial 438 finished with value: 10024.665328809017 and parameters: {'depth': 5, 'learning_rate': 0.19417667573356773, 'iterations': 349, 'l2_leaf_reg': 6.104679308380239e-06, 'border_count': 42, 'bagging_temperature': 0.8590987254713082, 'random_strength': 0.6152465125218876, 'grow_policy': 'SymmetricTree', 'min_data_in_leaf': 832}. Best is trial 374 with value: 6012.54835621459.[0m
[32m[I 2024-10-13 06:02:47,874][0m Trial 439 finished with value: 10233.295103092247 and parameters: {'depth': 5, 'learning_rate': 0.15407893046372237, 'iterations': 232, 'l2_leaf_reg': 1.0114090512254577e-05, 'border_count': 37, 'bagging_temperature': 0.9113413629310623, 'random_strength': 0.3771267765464426, 'grow_policy': 'Lossguide', 'min_data_in_leaf': 914, 'max_leaves': 55}. Best is trial 374 with value: 6012.54835621459.[0m
[32m[I 2024-10-13 06:02:48,823][0m Trial 440 finished with value: 10463.446647610488 and parameters: {'depth': 5, 'learning_rate': 0.14255288887000173, 'iterations': 303, 'l2_leaf_reg': 1.7864027037235786e-05, 'border_count': 98, 'bagging_temperature': 0.8715739758149678, 'random_strength': 0.1719954423021548, 'grow_policy': 'SymmetricTree', 'min_data_in_leaf': 884}. Best is trial 374 with value: 6012.54835621459.[0m
[32m[I 2024-10-13 06:02:58,082][0m Trial 441 finished with value: 11566.201990136578 and parameters: {'depth': 5, 'learning_rate': 0.1221841381640509, 'iterations': 2219, 'l2_leaf_reg': 0.0007340119468771079, 'border_count': 49, 'bagging_temperature': 0.9009791920645549, 'random_strength': 0.007742653376314967, 'grow_policy': 'SymmetricTree', 'min_data_in_leaf': 872}. Best is trial 374 with value: 6012.54835621459.[0m
[32m[I 2024-10-13 06:02:58,792][0m Trial 442 finished with value: 10119.998063382054 and parameters: {'depth': 4, 'learning_rate': 0.20843077533178764, 'iterations': 179, 'l2_leaf_reg': 3.860772031607144e-06, 'border_count': 33, 'bagging_temperature': 0.9145597002375803, 'random_strength': 0.5630381519298788, 'grow_policy': 'SymmetricTree', 'min_data_in_leaf': 810}. Best is trial 374 with value: 6012.54835621459.[0m
[32m[I 2024-10-13 06:02:59,505][0m Trial 443 finished with value: 9136.230678676717 and parameters: {'depth': 5, 'learning_rate': 0.16802157399446674, 'iterations': 150, 'l2_leaf_reg': 7.2476467664564825e-06, 'border_count': 42, 'bagging_temperature': 0.892728033621726, 'random_strength': 0.360260330302344, 'grow_policy': 'SymmetricTree', 'min_data_in_leaf': 828}. Best is trial 374 with value: 6012.54835621459.[0m
[32m[I 2024-10-13 06:03:00,450][0m Trial 444 finished with value: 8364.262281270372 and parameters: {'depth': 5, 'learning_rate': 0.25624009586830676, 'iterations': 353, 'l2_leaf_reg': 4.038661768886786e-06, 'border_count': 34, 'bagging_temperature': 0.8417952387508871, 'random_strength': 0.8221018608740235, 'grow_policy': 'SymmetricTree', 'min_data_in_leaf': 795}. Best is trial 374 with value: 6012.54835621459.[0m
[32m[I 2024-10-13 06:03:01,215][0m Trial 445 finished with value: 11779.480432186607 and parameters: {'depth': 6, 'learning_rate': 0.17594316342509483, 'iterations': 101, 'l2_leaf_reg': 9.393880359293867e-06, 'border_count': 53, 'bagging_temperature': 0.9135478170786203, 'random_strength': 0.2031752148691377, 'grow_policy': 'SymmetricTree', 'min_data_in_leaf': 853}. Best is trial 374 with value: 6012.54835621459.[0m
[32m[I 2024-10-13 06:03:01,951][0m Trial 446 finished with value: 10441.696091582837 and parameters: {'depth': 5, 'learning_rate': 0.1155369773320157, 'iterations': 261, 'l2_leaf_reg': 5.578884944679822e-06, 'border_count': 38, 'bagging_temperature': 0.8648983538448158, 'random_strength': 0.5587826763105787, 'grow_policy': 'Depthwise', 'min_data_in_leaf': 808}. Best is trial 374 with value: 6012.54835621459.[0m
[32m[I 2024-10-13 06:03:07,436][0m Trial 447 finished with value: 13536.16219596934 and parameters: {'depth': 4, 'learning_rate': 0.2234236011653545, 'iterations': 1480, 'l2_leaf_reg': 3.201250872332486e-06, 'border_count': 163, 'bagging_temperature': 0.8863512011524299, 'random_strength': 0.3639604179642188, 'grow_policy': 'SymmetricTree', 'min_data_in_leaf': 779}. Best is trial 374 with value: 6012.54835621459.[0m
[32m[I 2024-10-13 06:03:08,235][0m Trial 448 finished with value: 11069.090476403022 and parameters: {'depth': 5, 'learning_rate': 0.13973112795245343, 'iterations': 219, 'l2_leaf_reg': 1.3330931564844061e-05, 'border_count': 46, 'bagging_temperature': 0.9166447708019242, 'random_strength': 0.6691206151393438, 'grow_policy': 'SymmetricTree', 'min_data_in_leaf': 799}. Best is trial 374 with value: 6012.54835621459.[0m
[32m[I 2024-10-13 06:03:09,135][0m Trial 449 finished with value: 17436.903210500463 and parameters: {'depth': 5, 'learning_rate': 0.0018113024756828294, 'iterations': 313, 'l2_leaf_reg': 3.2770042654815643e-06, 'border_count': 31, 'bagging_temperature': 0.9272654165667512, 'random_strength': 0.0033253695192289306, 'grow_policy': 'SymmetricTree', 'min_data_in_leaf': 834}. Best is trial 374 with value: 6012.54835621459.[0m
[32m[I 2024-10-13 06:03:10,012][0m Trial 450 finished with value: 11269.5496817409 and parameters: {'depth': 5, 'learning_rate': 0.18359351013673889, 'iterations': 281, 'l2_leaf_reg': 4.450852473074647e-06, 'border_count': 41, 'bagging_temperature': 0.8867139105067767, 'random_strength': 6.056821227403728, 'grow_policy': 'SymmetricTree', 'min_data_in_leaf': 769}. Best is trial 374 with value: 6012.54835621459.[0m
[32m[I 2024-10-13 06:03:10,794][0m Trial 451 finished with value: 10521.540984509324 and parameters: {'depth': 5, 'learning_rate': 0.12378942376874566, 'iterations': 207, 'l2_leaf_reg': 7.218619729528193e-06, 'border_count': 36, 'bagging_temperature': 0.9241889407238939, 'random_strength': 8.147218698116028, 'grow_policy': 'SymmetricTree', 'min_data_in_leaf': 798}. Best is trial 374 with value: 6012.54835621459.[0m
[32m[I 2024-10-13 06:03:11,809][0m Trial 452 finished with value: 11978.532709401672 and parameters: {'depth': 6, 'learning_rate': 0.004844462917705731, 'iterations': 367, 'l2_leaf_reg': 2.819550284526392e-06, 'border_count': 30, 'bagging_temperature': 0.9041425163250789, 'random_strength': 0.22555679652103738, 'grow_policy': 'SymmetricTree', 'min_data_in_leaf': 822}. Best is trial 374 with value: 6012.54835621459.[0m
[32m[I 2024-10-13 06:03:12,528][0m Trial 453 finished with value: 13148.951281576701 and parameters: {'depth': 4, 'learning_rate': 0.15195464918487167, 'iterations': 147, 'l2_leaf_reg': 6.141703895536358e-06, 'border_count': 45, 'bagging_temperature': 0.435631070774613, 'random_strength': 0.47929448464497326, 'grow_policy': 'SymmetricTree', 'min_data_in_leaf': 876}. Best is trial 374 with value: 6012.54835621459.[0m
[32m[I 2024-10-13 06:03:13,390][0m Trial 454 finished with value: 11225.718101595541 and parameters: {'depth': 5, 'learning_rate': 0.1969766667100718, 'iterations': 248, 'l2_leaf_reg': 1.1633407709353365e-05, 'border_count': 55, 'bagging_temperature': 0.8614471202297481, 'random_strength': 0.9014270136066966, 'grow_policy': 'SymmetricTree', 'min_data_in_leaf': 780}. Best is trial 374 with value: 6012.54835621459.[0m
[32m[I 2024-10-13 06:03:14,342][0m Trial 455 finished with value: 6787.2809007029755 and parameters: {'depth': 5, 'learning_rate': 0.2494698796601315, 'iterations': 344, 'l2_leaf_reg': 2.1635368405918885e-05, 'border_count': 36, 'bagging_temperature': 0.927629923646574, 'random_strength': 0.1697722967388893, 'grow_policy': 'SymmetricTree', 'min_data_in_leaf': 915}. Best is trial 374 with value: 6012.54835621459.[0m
[32m[I 2024-10-13 06:03:15,301][0m Trial 456 finished with value: 11862.576470292539 and parameters: {'depth': 5, 'learning_rate': 0.24630583434418493, 'iterations': 356, 'l2_leaf_reg': 5.8300246285985896e-05, 'border_count': 185, 'bagging_temperature': 0.9284171510798831, 'random_strength': 0.6738105700515358, 'grow_policy': 'SymmetricTree', 'min_data_in_leaf': 926}. Best is trial 374 with value: 6012.54835621459.[0m
[32m[I 2024-10-13 06:03:16,287][0m Trial 457 finished with value: 10891.996921555217 and parameters: {'depth': 6, 'learning_rate': 0.28285308259736097, 'iterations': 332, 'l2_leaf_reg': 2.2166139305283872e-05, 'border_count': 41, 'bagging_temperature': 0.900605784489972, 'random_strength': 9.723640763263875, 'grow_policy': 'SymmetricTree', 'min_data_in_leaf': 949}. Best is trial 374 with value: 6012.54835621459.[0m
[32m[I 2024-10-13 06:03:17,293][0m Trial 458 finished with value: 12952.948676500744 and parameters: {'depth': 5, 'learning_rate': 0.222784042226468, 'iterations': 372, 'l2_leaf_reg': 2.1912335933456863e-05, 'border_count': 49, 'bagging_temperature': 0.8296935681018233, 'random_strength': 0.4237467052891025, 'grow_policy': 'SymmetricTree', 'min_data_in_leaf': 952}. Best is trial 374 with value: 6012.54835621459.[0m
[32m[I 2024-10-13 06:03:18,067][0m Trial 459 finished with value: 7160.279435513418 and parameters: {'depth': 5, 'learning_rate': 0.2520439664051106, 'iterations': 193, 'l2_leaf_reg': 1.5594584269643653e-05, 'border_count': 33, 'bagging_temperature': 0.8860477047773422, 'random_strength': 0.2315765078586211, 'grow_policy': 'SymmetricTree', 'min_data_in_leaf': 869}. Best is trial 374 with value: 6012.54835621459.[0m
[32m[I 2024-10-13 06:03:18,820][0m Trial 460 finished with value: 10238.906770335341 and parameters: {'depth': 5, 'learning_rate': 0.2985892581209002, 'iterations': 151, 'l2_leaf_reg': 3.0202620912604078e-05, 'border_count': 37, 'bagging_temperature': 0.8855450768756211, 'random_strength': 6.61143774966975, 'grow_policy': 'SymmetricTree', 'min_data_in_leaf': 899}. Best is trial 374 with value: 6012.54835621459.[0m
