[32m[I 2024-10-13 06:03:19,567][0m Trial 461 finished with value: 12714.837660107189 and parameters: {'depth': 4, 'learning_rate': 0.2507317717003094, 'iterations': 200, 'l2_leaf_reg': 1.839763091364289e-05, 'border_count': 42, 'bagging_temperature': 0.8679395812791387, 'random_strength': 0.8001106853840714, 'grow_policy': 'SymmetricTree', 'min_data_in_leaf': 858}. Best is trial 374 with value: 6012.54835621459.[0m
[32m[I 2024-10-13 06:03:20,386][0m Trial 462 finished with value: 10898.89763318094 and parameters: {'depth': 5, 'learning_rate': 0.2651049967708406, 'iterations': 234, 'l2_leaf_reg': 4.730864018964781e-05, 'border_count': 33, 'bagging_temperature': 0.8726596203211853, 'random_strength': 5.206245437649033, 'grow_policy': 'SymmetricTree', 'min_data_in_leaf': 914}. Best is trial 374 with value: 6012.54835621459.[0m
[32m[I 2024-10-13 06:03:21,068][0m Trial 463 finished with value: 8924.346072909442 and parameters: {'depth': 5, 'learning_rate': 0.23329216732699112, 'iterations': 101, 'l2_leaf_reg': 1.1267716361440954e-05, 'border_count': 38, 'bagging_temperature': 0.8990819862487389, 'random_strength': 1.1589704451452971, 'grow_policy': 'SymmetricTree', 'min_data_in_leaf': 924}. Best is trial 374 with value: 6012.54835621459.[0m
[32m[I 2024-10-13 06:03:21,811][0m Trial 464 finished with value: 13320.069693626503 and parameters: {'depth': 6, 'learning_rate': 0.20673309802674725, 'iterations': 288, 'l2_leaf_reg': 3.0142261707838425e-05, 'border_count': 46, 'bagging_temperature': 0.8542610468411543, 'random_strength': 9.293756401868446, 'grow_policy': 'Lossguide', 'min_data_in_leaf': 884, 'max_leaves': 255}. Best is trial 374 with value: 6012.54835621459.[0m
[32m[I 2024-10-13 06:03:22,546][0m Trial 465 finished with value: 8098.162058490243 and parameters: {'depth': 5, 'learning_rate': 0.18110025188570075, 'iterations': 164, 'l2_leaf_reg': 1.2540675258154746e-05, 'border_count': 33, 'bagging_temperature': 0.8034674480958444, 'random_strength': 0.52608633996237, 'grow_policy': 'SymmetricTree', 'min_data_in_leaf': 860}. Best is trial 374 with value: 6012.54835621459.[0m
[32m[I 2024-10-13 06:03:23,381][0m Trial 466 finished with value: 6992.425882079025 and parameters: {'depth': 5, 'learning_rate': 0.1135915521042822, 'iterations': 207, 'l2_leaf_reg': 1.571216825265696e-05, 'border_count': 28, 'bagging_temperature': 0.8821771867182978, 'random_strength': 0.34821699848780674, 'grow_policy': 'SymmetricTree', 'min_data_in_leaf': 895}. Best is trial 374 with value: 6012.54835621459.[0m
[32m[I 2024-10-13 06:03:24,157][0m Trial 467 finished with value: 10976.734701441583 and parameters: {'depth': 5, 'learning_rate': 0.10950427745808422, 'iterations': 195, 'l2_leaf_reg': 1.955773392347341e-05, 'border_count': 60, 'bagging_temperature': 0.9098643840597103, 'random_strength': 0.6503018081664789, 'grow_policy': 'SymmetricTree', 'min_data_in_leaf': 912}. Best is trial 374 with value: 6012.54835621459.[0m
[32m[I 2024-10-13 06:03:24,801][0m Trial 468 finished with value: 22099.754158891377 and parameters: {'depth': 4, 'learning_rate': 0.0010091439466329974, 'iterations': 100, 'l2_leaf_reg': 1.592005077645226e-05, 'border_count': 26, 'bagging_temperature': 0.9252766817939079, 'random_strength': 0.3709557962965655, 'grow_policy': 'SymmetricTree', 'min_data_in_leaf': 889}. Best is trial 374 with value: 6012.54835621459.[0m
[32m[I 2024-10-13 06:03:25,490][0m Trial 469 finished with value: 13831.97741389286 and parameters: {'depth': 5, 'learning_rate': 0.11564059266837459, 'iterations': 163, 'l2_leaf_reg': 3.331622244488985e-05, 'border_count': 49, 'bagging_temperature': 0.8886436941854735, 'random_strength': 0.9116542644638349, 'grow_policy': 'Depthwise', 'min_data_in_leaf': 913}. Best is trial 374 with value: 6012.54835621459.[0m
[32m[I 2024-10-13 06:03:26,301][0m Trial 470 finished with value: 11641.076456224644 and parameters: {'depth': 5, 'learning_rate': 0.2959922212232528, 'iterations': 236, 'l2_leaf_reg': 9.563276290863707e-06, 'border_count': 42, 'bagging_temperature': 0.8438101605008238, 'random_strength': 0.4666437693249584, 'grow_policy': 'SymmetricTree', 'min_data_in_leaf': 893}. Best is trial 374 with value: 6012.54835621459.[0m
[32m[I 2024-10-13 06:03:27,101][0m Trial 471 finished with value: 7349.764862527996 and parameters: {'depth': 5, 'learning_rate': 0.13070533131878218, 'iterations': 207, 'l2_leaf_reg': 8.277445780582616e-06, 'border_count': 36, 'bagging_temperature': 0.9111738644248475, 'random_strength': 0.699053414174357, 'grow_policy': 'SymmetricTree', 'min_data_in_leaf': 862}. Best is trial 374 with value: 6012.54835621459.[0m
[32m[I 2024-10-13 06:03:27,901][0m Trial 472 finished with value: 8794.23102108439 and parameters: {'depth': 4, 'learning_rate': 0.11423459458310314, 'iterations': 261, 'l2_leaf_reg': 7.243982260404318e-06, 'border_count': 34, 'bagging_temperature': 0.9263651015823267, 'random_strength': 0.9394557548775619, 'grow_policy': 'SymmetricTree', 'min_data_in_leaf': 883}. Best is trial 374 with value: 6012.54835621459.[0m
[32m[I 2024-10-13 06:03:28,800][0m Trial 473 finished with value: 8427.307347740762 and parameters: {'depth': 5, 'learning_rate': 0.13632459149596834, 'iterations': 286, 'l2_leaf_reg': 0.0013974279811657844, 'border_count': 27, 'bagging_temperature': 0.9054414235834567, 'random_strength': 1.1107387432613627, 'grow_policy': 'SymmetricTree', 'min_data_in_leaf': 868}. Best is trial 374 with value: 6012.54835621459.[0m
[32m[I 2024-10-13 06:03:33,611][0m Trial 474 finished with value: 8261.770041990843 and parameters: {'depth': 5, 'learning_rate': 0.11475485712773537, 'iterations': 1113, 'l2_leaf_reg': 1.4544501262500556e-05, 'border_count': 35, 'bagging_temperature': 0.9353840890404893, 'random_strength': 0.7321378305858705, 'grow_policy': 'SymmetricTree', 'min_data_in_leaf': 872}. Best is trial 374 with value: 6012.54835621459.[0m
[32m[I 2024-10-13 06:03:34,413][0m Trial 475 finished with value: 12674.162502970254 and parameters: {'depth': 6, 'learning_rate': 0.11032599701584593, 'iterations': 205, 'l2_leaf_reg': 9.568181513092599e-06, 'border_count': 44, 'bagging_temperature': 0.9228217178144708, 'random_strength': 0.67364890349518, 'grow_policy': 'SymmetricTree', 'min_data_in_leaf': 973}. Best is trial 374 with value: 6012.54835621459.[0m
[32m[I 2024-10-13 06:03:35,112][0m Trial 476 finished with value: 7474.506970751491 and parameters: {'depth': 5, 'learning_rate': 0.14357136223021483, 'iterations': 147, 'l2_leaf_reg': 8.953577744926345e-06, 'border_count': 31, 'bagging_temperature': 0.9084966720088052, 'random_strength': 0.8449033016789823, 'grow_policy': 'SymmetricTree', 'min_data_in_leaf': 897}. Best is trial 374 with value: 6012.54835621459.[0m
[32m[I 2024-10-13 06:03:35,930][0m Trial 477 finished with value: 7729.714215397025 and parameters: {'depth': 5, 'learning_rate': 0.1275521980328078, 'iterations': 250, 'l2_leaf_reg': 5.907398012491949e-06, 'border_count': 38, 'bagging_temperature': 0.93765595400316, 'random_strength': 0.5499071358297118, 'grow_policy': 'SymmetricTree', 'min_data_in_leaf': 850}. Best is trial 374 with value: 6012.54835621459.[0m
[32m[I 2024-10-13 06:03:36,656][0m Trial 478 finished with value: 6930.335456606125 and parameters: {'depth': 5, 'learning_rate': 0.2276919800108402, 'iterations': 156, 'l2_leaf_reg': 5.369405982815252e-06, 'border_count': 25, 'bagging_temperature': 0.9062067591420702, 'random_strength': 0.34788304185304075, 'grow_policy': 'SymmetricTree', 'min_data_in_leaf': 904}. Best is trial 374 with value: 6012.54835621459.[0m
[32m[I 2024-10-13 06:03:37,348][0m Trial 479 finished with value: 11571.206037306833 and parameters: {'depth': 6, 'learning_rate': 0.2702572615810445, 'iterations': 101, 'l2_leaf_reg': 4.566685413845044e-06, 'border_count': 17, 'bagging_temperature': 0.8925874014703401, 'random_strength': 0.3222951208867222, 'grow_policy': 'SymmetricTree', 'min_data_in_leaf': 942}. Best is trial 374 with value: 6012.54835621459.[0m
[32m[I 2024-10-13 06:03:38,039][0m Trial 480 finished with value: 8685.477521511308 and parameters: {'depth': 4, 'learning_rate': 0.2343329809519585, 'iterations': 151, 'l2_leaf_reg': 5.747629166627752e-06, 'border_count': 23, 'bagging_temperature': 0.93485157211211, 'random_strength': 0.3411160561065558, 'grow_policy': 'SymmetricTree', 'min_data_in_leaf': 910}. Best is trial 374 with value: 6012.54835621459.[0m
[32m[I 2024-10-13 06:03:38,943][0m Trial 481 finished with value: 9560.419268243188 and parameters: {'depth': 5, 'learning_rate': 0.21973308414074114, 'iterations': 303, 'l2_leaf_reg': 3.134144354762304e-06, 'border_count': 24, 'bagging_temperature': 0.9193119131289978, 'random_strength': 0.4600551267599663, 'grow_policy': 'SymmetricTree', 'min_data_in_leaf': 928}. Best is trial 374 with value: 6012.54835621459.[0m
[32m[I 2024-10-13 06:03:39,676][0m Trial 482 finished with value: 10479.092129075812 and parameters: {'depth': 5, 'learning_rate': 0.20959915872226206, 'iterations': 170, 'l2_leaf_reg': 1.2957789634368448e-05, 'border_count': 72, 'bagging_temperature': 0.886819324221174, 'random_strength': 0.26209824841444923, 'grow_policy': 'SymmetricTree', 'min_data_in_leaf': 893}. Best is trial 374 with value: 6012.54835621459.[0m
[32m[I 2024-10-13 06:03:40,519][0m Trial 483 finished with value: 9654.683554624642 and parameters: {'depth': 5, 'learning_rate': 0.2586469394285567, 'iterations': 246, 'l2_leaf_reg': 4.254014435712871e-06, 'border_count': 27, 'bagging_temperature': 0.9427056375690085, 'random_strength': 0.5611211320352831, 'grow_policy': 'SymmetricTree', 'min_data_in_leaf': 913}. Best is trial 374 with value: 6012.54835621459.[0m
[32m[I 2024-10-13 06:03:41,472][0m Trial 484 finished with value: 9580.143547637617 and parameters: {'depth': 6, 'learning_rate': 0.2481409498671108, 'iterations': 303, 'l2_leaf_reg': 5.821879617580647e-06, 'border_count': 30, 'bagging_temperature': 0.9065921716867363, 'random_strength': 0.20124204308873522, 'grow_policy': 'SymmetricTree', 'min_data_in_leaf': 870}. Best is trial 374 with value: 6012.54835621459.[0m
[32m[I 2024-10-13 06:03:42,116][0m Trial 485 finished with value: 22993.692470352733 and parameters: {'depth': 5, 'learning_rate': 0.00020526616174933545, 'iterations': 149, 'l2_leaf_reg': 2.855433497379599e-06, 'border_count': 16, 'bagging_temperature': 0.943188376265507, 'random_strength': 0.46048544461134433, 'grow_policy': 'Lossguide', 'min_data_in_leaf': 839, 'max_leaves': 157}. Best is trial 374 with value: 6012.54835621459.[0m
[32m[I 2024-10-13 06:03:42,870][0m Trial 486 finished with value: 9862.546822676592 and parameters: {'depth': 4, 'learning_rate': 0.29477794089297027, 'iterations': 218, 'l2_leaf_reg': 6.80750627888493e-06, 'border_count': 22, 'bagging_temperature': 0.8608803901759112, 'random_strength': 0.30008434680991225, 'grow_policy': 'SymmetricTree', 'min_data_in_leaf': 965}. Best is trial 374 with value: 6012.54835621459.[0m
[32m[I 2024-10-13 06:03:43,780][0m Trial 487 finished with value: 11355.463309040271 and parameters: {'depth': 5, 'learning_rate': 0.194316998515415, 'iterations': 322, 'l2_leaf_reg': 3.702671376378526e-06, 'border_count': 52, 'bagging_temperature': 0.9244370767355324, 'random_strength': 0.6779378441581644, 'grow_policy': 'SymmetricTree', 'min_data_in_leaf': 911}. Best is trial 374 with value: 6012.54835621459.[0m
[32m[I 2024-10-13 06:03:44,605][0m Trial 488 finished with value: 7768.313788363606 and parameters: {'depth': 5, 'learning_rate': 0.1747796152683063, 'iterations': 251, 'l2_leaf_reg': 1.567508821021876e-05, 'border_count': 32, 'bagging_temperature': 0.8941887153037589, 'random_strength': 0.20153548734271173, 'grow_policy': 'SymmetricTree', 'min_data_in_leaf': 897}. Best is trial 374 with value: 6012.54835621459.[0m
[32m[I 2024-10-13 06:03:45,399][0m Trial 489 finished with value: 13119.568757109602 and parameters: {'depth': 6, 'learning_rate': 0.22141203808445206, 'iterations': 194, 'l2_leaf_reg': 2.3675815282385257e-06, 'border_count': 42, 'bagging_temperature': 0.5625751353300219, 'random_strength': 0.5167044270216693, 'grow_policy': 'SymmetricTree', 'min_data_in_leaf': 665}. Best is trial 374 with value: 6012.54835621459.[0m
[32m[I 2024-10-13 06:03:46,265][0m Trial 490 finished with value: 8050.574203370706 and parameters: {'depth': 5, 'learning_rate': 0.10287357889437063, 'iterations': 294, 'l2_leaf_reg': 7.475613285432947e-06, 'border_count': 26, 'bagging_temperature': 0.9529869490708925, 'random_strength': 0.9827259641392836, 'grow_policy': 'SymmetricTree', 'min_data_in_leaf': 935}. Best is trial 374 with value: 6012.54835621459.[0m
[32m[I 2024-10-13 06:03:46,938][0m Trial 491 finished with value: 13693.61593061089 and parameters: {'depth': 5, 'learning_rate': 0.16167370321725286, 'iterations': 164, 'l2_leaf_reg': 4.420066571253059e-06, 'border_count': 47, 'bagging_temperature': 0.8789020106137476, 'random_strength': 0.3797308242659987, 'grow_policy': 'Depthwise', 'min_data_in_leaf': 845}. Best is trial 374 with value: 6012.54835621459.[0m
[32m[I 2024-10-13 06:03:47,599][0m Trial 492 finished with value: 9289.926389190703 and parameters: {'depth': 4, 'learning_rate': 0.1983061423741924, 'iterations': 105, 'l2_leaf_reg': 1.2676489446267548e-05, 'border_count': 38, 'bagging_temperature': 0.694022792271484, 'random_strength': 0.7849219111740138, 'grow_policy': 'SymmetricTree', 'min_data_in_leaf': 868}. Best is trial 374 with value: 6012.54835621459.[0m
[32m[I 2024-10-13 06:03:54,946][0m Trial 493 finished with value: 11817.613790442712 and parameters: {'depth': 5, 'learning_rate': 0.2565559287172659, 'iterations': 1736, 'l2_leaf_reg': 2.5665592454764653e-06, 'border_count': 31, 'bagging_temperature': 0.9266822424626486, 'random_strength': 0.13124765121267631, 'grow_policy': 'SymmetricTree', 'min_data_in_leaf': 812}. Best is trial 374 with value: 6012.54835621459.[0m
[32m[I 2024-10-13 06:03:55,760][0m Trial 494 finished with value: 7348.933075547449 and parameters: {'depth': 5, 'learning_rate': 0.17739206229460378, 'iterations': 237, 'l2_leaf_reg': 0.18685476118802563, 'border_count': 41, 'bagging_temperature': 0.40847151579824903, 'random_strength': 0.5555386215344362, 'grow_policy': 'SymmetricTree', 'min_data_in_leaf': 649}. Best is trial 374 with value: 6012.54835621459.[0m
[32m[I 2024-10-13 06:03:56,687][0m Trial 495 finished with value: 8641.328936760096 and parameters: {'depth': 5, 'learning_rate': 0.17788350915899334, 'iterations': 338, 'l2_leaf_reg': 0.000503220819752522, 'border_count': 36, 'bagging_temperature': 0.40194005902572943, 'random_strength': 0.49819973215478197, 'grow_policy': 'SymmetricTree', 'min_data_in_leaf': 651}. Best is trial 374 with value: 6012.54835621459.[0m
[32m[I 2024-10-13 06:03:57,528][0m Trial 496 finished with value: 8709.463243612128 and parameters: {'depth': 5, 'learning_rate': 0.1535550713783467, 'iterations': 250, 'l2_leaf_reg': 0.0725808333433815, 'border_count': 19, 'bagging_temperature': 0.34562672927410354, 'random_strength': 0.2842822728062705, 'grow_policy': 'SymmetricTree', 'min_data_in_leaf': 789}. Best is trial 374 with value: 6012.54835621459.[0m
[32m[I 2024-10-13 06:03:58,260][0m Trial 497 finished with value: 11626.241662436254 and parameters: {'depth': 4, 'learning_rate': 0.21858616960914323, 'iterations': 204, 'l2_leaf_reg': 0.6405175243377849, 'border_count': 43, 'bagging_temperature': 0.9122877112048984, 'random_strength': 0.5877497244556293, 'grow_policy': 'SymmetricTree', 'min_data_in_leaf': 888}. Best is trial 374 with value: 6012.54835621459.[0m
[32m[I 2024-10-13 06:03:59,163][0m Trial 498 finished with value: 8401.825015555656 and parameters: {'depth': 5, 'learning_rate': 0.29909917597107316, 'iterations': 282, 'l2_leaf_reg': 0.001366331602855119, 'border_count': 27, 'bagging_temperature': 0.28381694065821894, 'random_strength': 0.16669004678540061, 'grow_policy': 'SymmetricTree', 'min_data_in_leaf': 838}. Best is trial 374 with value: 6012.54835621459.[0m
[32m[I 2024-10-13 06:04:00,141][0m Trial 499 finished with value: 11120.727443245367 and parameters: {'depth': 5, 'learning_rate': 0.1893485755190403, 'iterations': 384, 'l2_leaf_reg': 3.8102556135190184, 'border_count': 48, 'bagging_temperature': 0.8846103724091771, 'random_strength': 0.3784351669250192, 'grow_policy': 'SymmetricTree', 'min_data_in_leaf': 926}. Best is trial 374 with value: 6012.54835621459.[0m
[32m[I 2024-10-13 06:04:00,846][0m Trial 500 finished with value: 8106.087477192615 and parameters: {'depth': 5, 'learning_rate': 0.14039441772458272, 'iterations': 151, 'l2_leaf_reg': 9.013666873109514e-06, 'border_count': 33, 'bagging_temperature': 0.8563263439219951, 'random_strength': 0.16142628403266082, 'grow_policy': 'SymmetricTree', 'min_data_in_leaf': 806}. Best is trial 374 with value: 6012.54835621459.[0m
[32m[I 2024-10-13 06:04:01,810][0m Trial 501 finished with value: 10149.752452696235 and parameters: {'depth': 6, 'learning_rate': 0.23465306278719278, 'iterations': 330, 'l2_leaf_reg': 0.00025242788387932385, 'border_count': 40, 'bagging_temperature': 0.8972758404399624, 'random_strength': 0.6320847077592744, 'grow_policy': 'SymmetricTree', 'min_data_in_leaf': 642}. Best is trial 374 with value: 6012.54835621459.[0m
[32m[I 2024-10-13 06:04:02,682][0m Trial 502 finished with value: 8279.640795335008 and parameters: {'depth': 5, 'learning_rate': 0.1619078289504083, 'iterations': 258, 'l2_leaf_reg': 0.02198827671860216, 'border_count': 54, 'bagging_temperature': 0.8257572435546842, 'random_strength': 0.377274991067583, 'grow_policy': 'SymmetricTree', 'min_data_in_leaf': 908}. Best is trial 374 with value: 6012.54835621459.[0m
[32m[I 2024-10-13 06:04:03,443][0m Trial 503 finished with value: 8424.485827478504 and parameters: {'depth': 5, 'learning_rate': 0.19978685276436892, 'iterations': 192, 'l2_leaf_reg': 0.2705127561856242, 'border_count': 12, 'bagging_temperature': 0.9369884897032408, 'random_strength': 0.02482668423827561, 'grow_policy': 'SymmetricTree', 'min_data_in_leaf': 772}. Best is trial 374 with value: 6012.54835621459.[0m
[32m[I 2024-10-13 06:04:04,378][0m Trial 504 finished with value: 9257.274892282223 and parameters: {'depth': 6, 'learning_rate': 0.13787604577381585, 'iterations': 298, 'l2_leaf_reg': 8.35966941815942, 'border_count': 37, 'bagging_temperature': 0.9079208618988274, 'random_strength': 0.002288847626843893, 'grow_policy': 'SymmetricTree', 'min_data_in_leaf': 824}. Best is trial 374 with value: 6012.54835621459.[0m
[32m[I 2024-10-13 06:04:05,083][0m Trial 505 finished with value: 8824.092252502782 and parameters: {'depth': 4, 'learning_rate': 0.17559977860464754, 'iterations': 147, 'l2_leaf_reg': 5.8488575397107905e-06, 'border_count': 31, 'bagging_temperature': 0.951098660188379, 'random_strength': 0.4933316724417036, 'grow_policy': 'SymmetricTree', 'min_data_in_leaf': 788}. Best is trial 374 with value: 6012.54835621459.[0m
[32m[I 2024-10-13 06:04:21,816][0m Trial 506 finished with value: 10802.060874745908 and parameters: {'depth': 9, 'learning_rate': 0.23837660182538994, 'iterations': 1002, 'l2_leaf_reg': 3.497619778410352e-06, 'border_count': 210, 'bagging_temperature': 0.5124026699971089, 'random_strength': 0.3055100267611345, 'grow_policy': 'SymmetricTree', 'min_data_in_leaf': 880}. Best is trial 374 with value: 6012.54835621459.[0m
[32m[I 2024-10-13 06:04:22,615][0m Trial 507 finished with value: 13077.600873209665 and parameters: {'depth': 5, 'learning_rate': 0.1254318477373398, 'iterations': 380, 'l2_leaf_reg': 1.966244746491763e-06, 'border_count': 44, 'bagging_temperature': 0.3698629505838773, 'random_strength': 0.7488615601561648, 'grow_policy': 'Lossguide', 'min_data_in_leaf': 710, 'max_leaves': 228}. Best is trial 374 with value: 6012.54835621459.[0m
[32m[I 2024-10-13 06:04:23,403][0m Trial 508 finished with value: 9665.12284768161 and parameters: {'depth': 5, 'learning_rate': 0.15798344234039075, 'iterations': 218, 'l2_leaf_reg': 0.005488493847640715, 'border_count': 22, 'bagging_temperature': 0.31375696715995227, 'random_strength': 0.5104097103919949, 'grow_policy': 'SymmetricTree', 'min_data_in_leaf': 220}. Best is trial 374 with value: 6012.54835621459.[0m
[32m[I 2024-10-13 06:04:27,335][0m Trial 509 finished with value: 10368.63218685384 and parameters: {'depth': 12, 'learning_rate': 0.10268154965132613, 'iterations': 333, 'l2_leaf_reg': 1.1880310882794117e-05, 'border_count': 27, 'bagging_temperature': 0.8715254112622648, 'random_strength': 0.20358389855573578, 'grow_policy': 'SymmetricTree', 'min_data_in_leaf': 767}. Best is trial 374 with value: 6012.54835621459.[0m
[32m[I 2024-10-13 06:04:27,961][0m Trial 510 finished with value: 8546.459431033762 and parameters: {'depth': 5, 'learning_rate': 0.20643762114058747, 'iterations': 102, 'l2_leaf_reg': 4.2401484990283164e-06, 'border_count': 34, 'bagging_temperature': 0.9147043831733858, 'random_strength': 0.6296613357858781, 'grow_policy': 'SymmetricTree', 'min_data_in_leaf': 677}. Best is trial 374 with value: 6012.54835621459.[0m
[32m[I 2024-10-13 06:04:28,813][0m Trial 511 finished with value: 8404.107401975214 and parameters: {'depth': 5, 'learning_rate': 0.1284920286326049, 'iterations': 264, 'l2_leaf_reg': 2.5837409975218925e-05, 'border_count': 40, 'bagging_temperature': 0.39114168135846195, 'random_strength': 0.35373347176669045, 'grow_policy': 'SymmetricTree', 'min_data_in_leaf': 728}. Best is trial 374 with value: 6012.54835621459.[0m
[32m[I 2024-10-13 06:04:29,615][0m Trial 512 finished with value: 12261.529903615941 and parameters: {'depth': 5, 'learning_rate': 0.18157007279330037, 'iterations': 203, 'l2_leaf_reg': 2.5903314379076534e-06, 'border_count': 49, 'bagging_temperature': 0.9316004815815252, 'random_strength': 7.651648393312804, 'grow_policy': 'SymmetricTree', 'min_data_in_leaf': 845}. Best is trial 374 with value: 6012.54835621459.[0m
