Optimizing CatBoost...
[32m[I 2024-10-13 07:32:54,172][0m Trial 0 finished with value: 4787.763367522526 and parameters: {'depth': 13, 'learning_rate': 0.1794211792044382, 'iterations': 1639, 'l2_leaf_reg': 1.6418222233946848e-07, 'border_count': 176, 'bagging_temperature': 0.10063246574206508, 'random_strength': 5.859188038887149, 'grow_policy': 'SymmetricTree', 'min_data_in_leaf': 394}. Best is trial 0 with value: 4787.763367522526.[0m
[32m[I 2024-10-13 07:32:58,299][0m Trial 1 finished with value: 4915.605242081118 and parameters: {'depth': 3, 'learning_rate': 0.026372915658127594, 'iterations': 1267, 'l2_leaf_reg': 0.0001617463741664612, 'border_count': 19, 'bagging_temperature': 0.9589001743041154, 'random_strength': 9.779422160605062, 'grow_policy': 'SymmetricTree', 'min_data_in_leaf': 665}. Best is trial 0 with value: 4787.763367522526.[0m
[32m[I 2024-10-13 07:33:52,739][0m Trial 2 finished with value: 16391.018379023102 and parameters: {'depth': 10, 'learning_rate': 0.000317288467687206, 'iterations': 2494, 'l2_leaf_reg': 1.018739183003408, 'border_count': 139, 'bagging_temperature': 0.7358996387151806, 'random_strength': 4.878474783396306, 'grow_policy': 'SymmetricTree', 'min_data_in_leaf': 110}. Best is trial 0 with value: 4787.763367522526.[0m
[32m[I 2024-10-13 07:33:53,548][0m Trial 3 finished with value: 5180.248148080635 and parameters: {'depth': 8, 'learning_rate': 0.25843455005676974, 'iterations': 427, 'l2_leaf_reg': 1.8370566291650872e-07, 'border_count': 106, 'bagging_temperature': 0.20679044763206567, 'random_strength': 0.5246101697620731, 'grow_policy': 'Lossguide', 'min_data_in_leaf': 333, 'max_leaves': 220}. Best is trial 0 with value: 4787.763367522526.[0m
[32m[I 2024-10-13 07:33:55,022][0m Trial 4 finished with value: 4403.278841688138 and parameters: {'depth': 13, 'learning_rate': 0.1480185873203199, 'iterations': 1220, 'l2_leaf_reg': 0.0003614487803895568, 'border_count': 63, 'bagging_temperature': 0.2833785563990845, 'random_strength': 6.615922383125321, 'grow_policy': 'Lossguide', 'min_data_in_leaf': 789, 'max_leaves': 45}. Best is trial 4 with value: 4403.278841688138.[0m
[32m[I 2024-10-13 07:33:56,035][0m Trial 5 finished with value: 26109.173385615442 and parameters: {'depth': 5, 'learning_rate': 0.0004165120227273627, 'iterations': 415, 'l2_leaf_reg': 0.004905537853877714, 'border_count': 181, 'bagging_temperature': 0.5092669616568017, 'random_strength': 0.5732300911814581, 'grow_policy': 'SymmetricTree', 'min_data_in_leaf': 964}. Best is trial 4 with value: 4403.278841688138.[0m
[32m[I 2024-10-13 07:33:56,852][0m Trial 6 finished with value: 7613.858465790588 and parameters: {'depth': 7, 'learning_rate': 0.019988683263490303, 'iterations': 102, 'l2_leaf_reg': 0.42438726603135224, 'border_count': 251, 'bagging_temperature': 0.23910277003014335, 'random_strength': 7.902899851590165, 'grow_policy': 'Depthwise', 'min_data_in_leaf': 2}. Best is trial 4 with value: 4403.278841688138.[0m
[32m[I 2024-10-13 07:33:59,835][0m Trial 7 finished with value: 3064.1480611469387 and parameters: {'depth': 15, 'learning_rate': 0.20233552833482707, 'iterations': 2301, 'l2_leaf_reg': 0.9058120467894848, 'border_count': 57, 'bagging_temperature': 0.5198438276995909, 'random_strength': 6.486858839396289, 'grow_policy': 'Lossguide', 'min_data_in_leaf': 47, 'max_leaves': 40}. Best is trial 7 with value: 3064.1480611469387.[0m
[32m[I 2024-10-13 07:35:20,070][0m Trial 8 finished with value: 5830.514921636563 and parameters: {'depth': 13, 'learning_rate': 0.006959060626266638, 'iterations': 724, 'l2_leaf_reg': 5.845878831279387e-08, 'border_count': 230, 'bagging_temperature': 0.9065731969441434, 'random_strength': 7.317744019541436, 'grow_policy': 'SymmetricTree', 'min_data_in_leaf': 227}. Best is trial 7 with value: 3064.1480611469387.[0m
[32m[I 2024-10-13 07:35:21,996][0m Trial 9 finished with value: 17025.138548927833 and parameters: {'depth': 5, 'learning_rate': 0.0005278739678696196, 'iterations': 1995, 'l2_leaf_reg': 0.18440874524137846, 'border_count': 203, 'bagging_temperature': 0.365993927877051, 'random_strength': 6.969237767321937, 'grow_policy': 'Depthwise', 'min_data_in_leaf': 287}. Best is trial 7 with value: 3064.1480611469387.[0m
[32m[I 2024-10-13 07:35:24,677][0m Trial 10 finished with value: 9554.647618804931 and parameters: {'depth': 15, 'learning_rate': 0.001576088059846751, 'iterations': 2927, 'l2_leaf_reg': 0.01137260965846273, 'border_count': 3, 'bagging_temperature': 0.5548451733879963, 'random_strength': 3.308133052459953, 'grow_policy': 'Lossguide', 'min_data_in_leaf': 554, 'max_leaves': 31}. Best is trial 7 with value: 3064.1480611469387.[0m
[32m[I 2024-10-13 07:35:26,152][0m Trial 11 finished with value: 5374.643415869169 and parameters: {'depth': 15, 'learning_rate': 0.07650380166270684, 'iterations': 1230, 'l2_leaf_reg': 3.823686925295229e-05, 'border_count': 70, 'bagging_temperature': 0.3816149723630368, 'random_strength': 4.059540554445652, 'grow_policy': 'Lossguide', 'min_data_in_leaf': 817, 'max_leaves': 36}. Best is trial 7 with value: 3064.1480611469387.[0m
[32m[I 2024-10-13 07:35:28,330][0m Trial 12 finished with value: 3896.802616279651 and parameters: {'depth': 11, 'learning_rate': 0.05751722363208755, 'iterations': 2229, 'l2_leaf_reg': 7.8679719725047805, 'border_count': 57, 'bagging_temperature': 0.6623598971968953, 'random_strength': 9.184162683774284, 'grow_policy': 'Lossguide', 'min_data_in_leaf': 690, 'max_leaves': 100}. Best is trial 7 with value: 3064.1480611469387.[0m
[32m[I 2024-10-13 07:35:30,500][0m Trial 13 finished with value: 3972.818288579052 and parameters: {'depth': 10, 'learning_rate': 0.03931611475633092, 'iterations': 2208, 'l2_leaf_reg': 6.588368261363896, 'border_count': 52, 'bagging_temperature': 0.6700467051464152, 'random_strength': 9.963176714871446, 'grow_policy': 'Lossguide', 'min_data_in_leaf': 527, 'max_leaves': 126}. Best is trial 7 with value: 3064.1480611469387.[0m
[32m[I 2024-10-13 07:35:32,903][0m Trial 14 finished with value: 5364.010861693783 and parameters: {'depth': 12, 'learning_rate': 0.0075301568032346035, 'iterations': 2566, 'l2_leaf_reg': 3.852649351460739, 'border_count': 101, 'bagging_temperature': 0.7544400999986799, 'random_strength': 8.672838946393124, 'grow_policy': 'Lossguide', 'min_data_in_leaf': 652, 'max_leaves': 112}. Best is trial 7 with value: 3064.1480611469387.[0m
[32m[I 2024-10-13 07:35:34,840][0m Trial 15 finished with value: 4930.619043003487 and parameters: {'depth': 11, 'learning_rate': 0.06890446417338517, 'iterations': 1860, 'l2_leaf_reg': 0.0360304013544214, 'border_count': 35, 'bagging_temperature': 0.6118705883222303, 'random_strength': 2.6585613196923514, 'grow_policy': 'Lossguide', 'min_data_in_leaf': 431, 'max_leaves': 88}. Best is trial 7 with value: 3064.1480611469387.[0m
[32m[I 2024-10-13 07:35:38,417][0m Trial 16 finished with value: 6594.8625308069995 and parameters: {'depth': 15, 'learning_rate': 0.0025801612473562974, 'iterations': 2969, 'l2_leaf_reg': 8.388097961681238, 'border_count': 92, 'bagging_temperature': 0.8337710455095214, 'random_strength': 8.789998558937324, 'grow_policy': 'Depthwise', 'min_data_in_leaf': 165}. Best is trial 7 with value: 3064.1480611469387.[0m
[32m[I 2024-10-13 07:35:40,714][0m Trial 17 finished with value: 5553.660536672101 and parameters: {'depth': 9, 'learning_rate': 0.015320042394387338, 'iterations': 2377, 'l2_leaf_reg': 0.1353137420879421, 'border_count': 144, 'bagging_temperature': 0.40821774673012234, 'random_strength': 5.308906141098186, 'grow_policy': 'Lossguide', 'min_data_in_leaf': 830, 'max_leaves': 193}. Best is trial 7 with value: 3064.1480611469387.[0m
[32m[I 2024-10-13 07:35:42,797][0m Trial 18 finished with value: 4360.935640000059 and parameters: {'depth': 12, 'learning_rate': 0.07714050462823806, 'iterations': 2047, 'l2_leaf_reg': 2.1850649106684628e-06, 'border_count': 38, 'bagging_temperature': 0.007949744918410717, 'random_strength': 8.26459662033104, 'grow_policy': 'Lossguide', 'min_data_in_leaf': 650, 'max_leaves': 87}. Best is trial 7 with value: 3064.1480611469387.[0m
[32m[I 2024-10-13 07:35:45,307][0m Trial 19 finished with value: 25666.649035655595 and parameters: {'depth': 14, 'learning_rate': 0.00010692826160814414, 'iterations': 2666, 'l2_leaf_reg': 0.0018133725331847183, 'border_count': 80, 'bagging_temperature': 0.44723665460607975, 'random_strength': 6.476757527911792, 'grow_policy': 'Lossguide', 'min_data_in_leaf': 962, 'max_leaves': 173}. Best is trial 7 with value: 3064.1480611469387.[0m