[32m[I 2024-10-13 10:56:52,985][0m Trial 816 finished with value: 3069.826245474664 and parameters: {'depth': 10, 'learning_rate': 0.0005377673177147783, 'iterations': 897, 'l2_leaf_reg': 9.533443766752081e-08, 'border_count': 36, 'bagging_temperature': 0.09072700326303336, 'random_strength': 1.493721290986993, 'grow_policy': 'Depthwise', 'min_data_in_leaf': 22}. Best is trial 814 with value: 2060.357404924192.[0m
[32m[I 2024-10-13 10:56:59,252][0m Trial 817 finished with value: 2485.7866515690725 and parameters: {'depth': 10, 'learning_rate': 0.0006395491881690033, 'iterations': 2917, 'l2_leaf_reg': 1.107611667511825e-07, 'border_count': 42, 'bagging_temperature': 0.08042982545107205, 'random_strength': 1.7199769117662695, 'grow_policy': 'Depthwise', 'min_data_in_leaf': 19}. Best is trial 814 with value: 2060.357404924192.[0m
[32m[I 2024-10-13 10:57:03,489][0m Trial 818 finished with value: 2178.692556010272 and parameters: {'depth': 10, 'learning_rate': 0.00048036623824152967, 'iterations': 2906, 'l2_leaf_reg': 7.552117620027932e-08, 'border_count': 34, 'bagging_temperature': 0.05815950096393851, 'random_strength': 1.6601900196350552, 'grow_policy': 'Lossguide', 'min_data_in_leaf': 35, 'max_leaves': 222}. Best is trial 814 with value: 2060.357404924192.[0m
[32m[I 2024-10-13 10:57:06,318][0m Trial 819 finished with value: 2210.285077415149 and parameters: {'depth': 9, 'learning_rate': 0.0007193361803447441, 'iterations': 2994, 'l2_leaf_reg': 2.0365863785220137e-07, 'border_count': 28, 'bagging_temperature': 0.044621501002552244, 'random_strength': 1.5386061165511022, 'grow_policy': 'Depthwise', 'min_data_in_leaf': 663}. Best is trial 814 with value: 2060.357404924192.[0m
[32m[I 2024-10-13 10:57:12,361][0m Trial 820 finished with value: 2379.003341416032 and parameters: {'depth': 10, 'learning_rate': 0.0005603376710108462, 'iterations': 2886, 'l2_leaf_reg': 5.505565161199381e-08, 'border_count': 31, 'bagging_temperature': 0.0712476148196263, 'random_strength': 1.1829938165573892, 'grow_policy': 'Depthwise', 'min_data_in_leaf': 19}. Best is trial 814 with value: 2060.357404924192.[0m
[32m[I 2024-10-13 10:57:16,737][0m Trial 821 finished with value: 2175.955976903548 and parameters: {'depth': 10, 'learning_rate': 0.0004565348934328713, 'iterations': 3000, 'l2_leaf_reg': 6.899280429473458e-08, 'border_count': 34, 'bagging_temperature': 0.04006748851577017, 'random_strength': 1.7761306104424004, 'grow_policy': 'Depthwise', 'min_data_in_leaf': 41}. Best is trial 814 with value: 2060.357404924192.[0m
[32m[I 2024-10-13 10:57:22,472][0m Trial 822 finished with value: 2335.3785289160664 and parameters: {'depth': 10, 'learning_rate': 0.0005914821690911049, 'iterations': 2815, 'l2_leaf_reg': 4.979625262391989e-08, 'border_count': 24, 'bagging_temperature': 0.10908320426405049, 'random_strength': 1.8425845740336935, 'grow_policy': 'Depthwise', 'min_data_in_leaf': 20}. Best is trial 814 with value: 2060.357404924192.[0m
[32m[I 2024-10-13 10:57:26,359][0m Trial 823 finished with value: 2250.133798969244 and parameters: {'depth': 10, 'learning_rate': 0.00036291974025054675, 'iterations': 2949, 'l2_leaf_reg': 0.0004697788911001969, 'border_count': 30, 'bagging_temperature': 0.04618369538366471, 'random_strength': 1.3239641613320163, 'grow_policy': 'Depthwise', 'min_data_in_leaf': 47}. Best is trial 814 with value: 2060.357404924192.[0m
[32m[I 2024-10-13 10:57:32,237][0m Trial 824 finished with value: 2595.1050183990446 and parameters: {'depth': 10, 'learning_rate': 0.0008247083937038904, 'iterations': 2652, 'l2_leaf_reg': 4.3914334202750676e-08, 'border_count': 14, 'bagging_temperature': 0.08751312764754926, 'random_strength': 2.951766701572548, 'grow_policy': 'Depthwise', 'min_data_in_leaf': 15}. Best is trial 814 with value: 2060.357404924192.[0m
[32m[I 2024-10-13 10:57:37,174][0m Trial 825 finished with value: 2315.094820590584 and parameters: {'depth': 10, 'learning_rate': 0.000508692085228503, 'iterations': 2859, 'l2_leaf_reg': 1.0268549343407543e-07, 'border_count': 102, 'bagging_temperature': 0.06317558850318114, 'random_strength': 1.9519543072918468, 'grow_policy': 'Depthwise', 'min_data_in_leaf': 34}. Best is trial 814 with value: 2060.357404924192.[0m
[32m[I 2024-10-13 10:57:49,863][0m Trial 826 finished with value: 2518.0500948380604 and parameters: {'depth': 10, 'learning_rate': 0.0006609759707057684, 'iterations': 2750, 'l2_leaf_reg': 7.142855376025121e-08, 'border_count': 44, 'bagging_temperature': 0.03251008684198929, 'random_strength': 1.67558212652011, 'grow_policy': 'Depthwise', 'min_data_in_leaf': 1}. Best is trial 814 with value: 2060.357404924192.[0m
[32m[I 2024-10-13 10:57:53,256][0m Trial 827 finished with value: 2223.4446830075567 and parameters: {'depth': 9, 'learning_rate': 0.00041907273541621576, 'iterations': 2699, 'l2_leaf_reg': 1.7530203207384312e-07, 'border_count': 25, 'bagging_temperature': 0.02669394940566914, 'random_strength': 2.156015053340753, 'grow_policy': 'Depthwise', 'min_data_in_leaf': 55}. Best is trial 814 with value: 2060.357404924192.[0m
[32m[I 2024-10-13 10:57:58,432][0m Trial 828 finished with value: 2320.424917985165 and parameters: {'depth': 10, 'learning_rate': 0.0005435107731421734, 'iterations': 2909, 'l2_leaf_reg': 3.7289005991007964e-08, 'border_count': 210, 'bagging_temperature': 0.0642438656599901, 'random_strength': 2.8167842836878694, 'grow_policy': 'Depthwise', 'min_data_in_leaf': 33}. Best is trial 814 with value: 2060.357404924192.[0m
[32m[I 2024-10-13 10:58:01,958][0m Trial 829 finished with value: 2388.659289130824 and parameters: {'depth': 10, 'learning_rate': 0.00031189307766344186, 'iterations': 2801, 'l2_leaf_reg': 3.992725895091932e-05, 'border_count': 20, 'bagging_temperature': 0.04446427517165065, 'random_strength': 1.889690955366761, 'grow_policy': 'Depthwise', 'min_data_in_leaf': 58}. Best is trial 814 with value: 2060.357404924192.[0m
[32m[I 2024-10-13 10:58:07,300][0m Trial 830 finished with value: 3247.6596188023864 and parameters: {'depth': 11, 'learning_rate': 0.0004526936480449582, 'iterations': 2572, 'l2_leaf_reg': 1.4174322874783299e-08, 'border_count': 9, 'bagging_temperature': 0.016609140393809424, 'random_strength': 2.433709070355346, 'grow_policy': 'Depthwise', 'min_data_in_leaf': 17}. Best is trial 814 with value: 2060.357404924192.[0m
[32m[I 2024-10-13 10:58:21,151][0m Trial 831 finished with value: 2991.0310467419513 and parameters: {'depth': 11, 'learning_rate': 0.0006429599260023266, 'iterations': 2849, 'l2_leaf_reg': 1.4102702197425775e-07, 'border_count': 15, 'bagging_temperature': 0.08393635110945144, 'random_strength': 1.4980648691658325, 'grow_policy': 'Depthwise', 'min_data_in_leaf': 1}. Best is trial 814 with value: 2060.357404924192.[0m
[32m[I 2024-10-13 10:58:26,186][0m Trial 832 finished with value: 2770.50250883285 and parameters: {'depth': 10, 'learning_rate': 0.038602160441433754, 'iterations': 2772, 'l2_leaf_reg': 0.017269986438523764, 'border_count': 66, 'bagging_temperature': 0.018050987189712014, 'random_strength': 2.6770198937461553, 'grow_policy': 'Depthwise', 'min_data_in_leaf': 41}. Best is trial 814 with value: 2060.357404924192.[0m
[32m[I 2024-10-13 10:58:31,280][0m Trial 833 finished with value: 2149.198954530272 and parameters: {'depth': 9, 'learning_rate': 0.0005304513588093464, 'iterations': 2952, 'l2_leaf_reg': 2.940740486600702e-08, 'border_count': 29, 'bagging_temperature': 0.050791412167406416, 'random_strength': 2.088007230680313, 'grow_policy': 'Depthwise', 'min_data_in_leaf': 30}. Best is trial 814 with value: 2060.357404924192.[0m
[32m[I 2024-10-13 10:59:03,838][0m Trial 834 finished with value: 2696.459103427639 and parameters: {'depth': 9, 'learning_rate': 0.0009031939253792974, 'iterations': 2961, 'l2_leaf_reg': 6.879153388814634e-08, 'border_count': 31, 'bagging_temperature': 0.033523595169071836, 'random_strength': 1.0149995146943276, 'grow_policy': 'SymmetricTree', 'min_data_in_leaf': 18}. Best is trial 814 with value: 2060.357404924192.[0m
[32m[I 2024-10-13 10:59:09,006][0m Trial 835 finished with value: 2283.151893428792 and parameters: {'depth': 9, 'learning_rate': 0.0007163593210859114, 'iterations': 2954, 'l2_leaf_reg': 4.454666867776431e-08, 'border_count': 40, 'bagging_temperature': 0.017906225231549194, 'random_strength': 1.8036115551913336, 'grow_policy': 'Depthwise', 'min_data_in_leaf': 33}. Best is trial 814 with value: 2060.357404924192.[0m
[32m[I 2024-10-13 10:59:15,128][0m Trial 836 finished with value: 2403.6688098355175 and parameters: {'depth': 10, 'learning_rate': 0.0005858578190933337, 'iterations': 2954, 'l2_leaf_reg': 3.528467786491785e-08, 'border_count': 38, 'bagging_temperature': 0.0714259770012772, 'random_strength': 1.9999584853072938, 'grow_policy': 'Depthwise', 'min_data_in_leaf': 18}. Best is trial 814 with value: 2060.357404924192.[0m
[32m[I 2024-10-13 10:59:19,566][0m Trial 837 finished with value: 2312.558209092822 and parameters: {'depth': 9, 'learning_rate': 0.00038095499642035435, 'iterations': 2995, 'l2_leaf_reg': 0.002891654068131438, 'border_count': 54, 'bagging_temperature': 0.04587192224034549, 'random_strength': 1.6760103549264314, 'grow_policy': 'Depthwise', 'min_data_in_leaf': 36}. Best is trial 814 with value: 2060.357404924192.[0m
[32m[I 2024-10-13 10:59:30,897][0m Trial 838 finished with value: 3222.941558860267 and parameters: {'depth': 9, 'learning_rate': 0.0005238887180507945, 'iterations': 2896, 'l2_leaf_reg': 6.675996513524141e-08, 'border_count': 35, 'bagging_temperature': 0.0002728547878742662, 'random_strength': 2.129020028624157, 'grow_policy': 'Depthwise', 'min_data_in_leaf': 1}. Best is trial 814 with value: 2060.357404924192.[0m
[32m[I 2024-10-13 10:59:34,970][0m Trial 839 finished with value: 2221.547637880506 and parameters: {'depth': 9, 'learning_rate': 0.0006759811684114699, 'iterations': 3000, 'l2_leaf_reg': 2.8758178341948523e-08, 'border_count': 29, 'bagging_temperature': 0.10620246133991047, 'random_strength': 1.9492744974726712, 'grow_policy': 'Depthwise', 'min_data_in_leaf': 51}. Best is trial 814 with value: 2060.357404924192.[0m
[32m[I 2024-10-13 10:59:39,887][0m Trial 840 finished with value: 2309.54457168916 and parameters: {'depth': 9, 'learning_rate': 0.0004405671814794872, 'iterations': 2887, 'l2_leaf_reg': 5.2100472043671273e-08, 'border_count': 245, 'bagging_temperature': 0.13987240298589582, 'random_strength': 2.1887026266225327, 'grow_policy': 'Depthwise', 'min_data_in_leaf': 31}. Best is trial 814 with value: 2060.357404924192.[0m
[32m[I 2024-10-13 11:00:16,874][0m Trial 841 finished with value: 3585.052059811124 and parameters: {'depth': 9, 'learning_rate': 0.0007791148336802312, 'iterations': 2919, 'l2_leaf_reg': 2.522893065863265e-08, 'border_count': 113, 'bagging_temperature': 0.034593786440632476, 'random_strength': 1.8790981031847669, 'grow_policy': 'Lossguide', 'min_data_in_leaf': 1, 'max_leaves': 178}. Best is trial 814 with value: 2060.357404924192.[0m
[32m[I 2024-10-13 11:00:22,102][0m Trial 842 finished with value: 2107.7063145683273 and parameters: {'depth': 9, 'learning_rate': 0.0005875860107196868, 'iterations': 2930, 'l2_leaf_reg': 3.830940594322783e-08, 'border_count': 26, 'bagging_temperature': 0.0620161976474141, 'random_strength': 1.4591373482677072, 'grow_policy': 'Depthwise', 'min_data_in_leaf': 26}. Best is trial 814 with value: 2060.357404924192.[0m
[32m[I 2024-10-13 11:00:28,493][0m Trial 843 finished with value: 2505.1250047130147 and parameters: {'depth': 8, 'learning_rate': 0.0006127196319870684, 'iterations': 2946, 'l2_leaf_reg': 0.1371817821707636, 'border_count': 47, 'bagging_temperature': 0.0737209134487433, 'random_strength': 1.1089035151297644, 'grow_policy': 'Depthwise', 'min_data_in_leaf': 17}. Best is trial 814 with value: 2060.357404924192.[0m
[32m[I 2024-10-13 11:00:38,627][0m Trial 844 finished with value: 2667.391442432805 and parameters: {'depth': 8, 'learning_rate': 0.0008319663365892897, 'iterations': 2906, 'l2_leaf_reg': 0.005637103360173857, 'border_count': 35, 'bagging_temperature': 0.09816170161571904, 'random_strength': 1.533699954053409, 'grow_policy': 'Depthwise', 'min_data_in_leaf': 1}. Best is trial 814 with value: 2060.357404924192.[0m
[32m[I 2024-10-13 11:00:44,507][0m Trial 845 finished with value: 2423.763682898769 and parameters: {'depth': 9, 'learning_rate': 0.0010181272989533794, 'iterations': 2955, 'l2_leaf_reg': 2.0984633612852972e-08, 'border_count': 32, 'bagging_temperature': 0.12264199935840353, 'random_strength': 1.221549144899229, 'grow_policy': 'Depthwise', 'min_data_in_leaf': 24}. Best is trial 814 with value: 2060.357404924192.[0m
[32m[I 2024-10-13 11:00:47,186][0m Trial 846 finished with value: 2209.880377108419 and parameters: {'depth': 7, 'learning_rate': 0.0007307183167847878, 'iterations': 2904, 'l2_leaf_reg': 3.237780083930677e-08, 'border_count': 28, 'bagging_temperature': 0.09105007750627449, 'random_strength': 1.5377335427167655, 'grow_policy': 'Depthwise', 'min_data_in_leaf': 712}. Best is trial 814 with value: 2060.357404924192.[0m
[32m[I 2024-10-13 11:00:52,295][0m Trial 847 finished with value: 2174.8232880186865 and parameters: {'depth': 9, 'learning_rate': 0.0006035779277077514, 'iterations': 2864, 'l2_leaf_reg': 1.529468288208392e-08, 'border_count': 39, 'bagging_temperature': 0.06505229693013896, 'random_strength': 1.1646111851988061, 'grow_policy': 'Depthwise', 'min_data_in_leaf': 29}. Best is trial 814 with value: 2060.357404924192.[0m
[32m[I 2024-10-13 11:00:55,072][0m Trial 848 finished with value: 2348.630833903929 and parameters: {'depth': 9, 'learning_rate': 0.00048131225252170576, 'iterations': 2955, 'l2_leaf_reg': 1.0011943008932683e-08, 'border_count': 153, 'bagging_temperature': 0.07903027895880362, 'random_strength': 0.8884278855186301, 'grow_policy': 'Depthwise', 'min_data_in_leaf': 548}. Best is trial 814 with value: 2060.357404924192.[0m
[32m[I 2024-10-13 11:00:59,059][0m Trial 849 finished with value: 2209.5888229337666 and parameters: {'depth': 12, 'learning_rate': 0.00040826877541950615, 'iterations': 2906, 'l2_leaf_reg': 2.6737460623526907e-08, 'border_count': 26, 'bagging_temperature': 0.054901016624638574, 'random_strength': 1.5523490678693457, 'grow_policy': 'Depthwise', 'min_data_in_leaf': 41}. Best is trial 814 with value: 2060.357404924192.[0m
[32m[I 2024-10-13 11:01:05,349][0m Trial 850 finished with value: 2295.8524499955975 and parameters: {'depth': 8, 'learning_rate': 0.000645728850883988, 'iterations': 2855, 'l2_leaf_reg': 1.8879043111609207e-08, 'border_count': 34, 'bagging_temperature': 0.08472544701805573, 'random_strength': 1.4505403373527788, 'grow_policy': 'Depthwise', 'min_data_in_leaf': 15}. Best is trial 814 with value: 2060.357404924192.[0m
[32m[I 2024-10-13 11:01:17,323][0m Trial 851 finished with value: 2920.232963175733 and parameters: {'depth': 9, 'learning_rate': 0.0005380734486007719, 'iterations': 3000, 'l2_leaf_reg': 3.6744445393578624e-08, 'border_count': 27, 'bagging_temperature': 0.06101326618973613, 'random_strength': 1.4598276242671417, 'grow_policy': 'Depthwise', 'min_data_in_leaf': 1}. Best is trial 814 with value: 2060.357404924192.[0m
[32m[I 2024-10-13 11:01:21,925][0m Trial 852 finished with value: 2169.20754976076 and parameters: {'depth': 9, 'learning_rate': 0.0004536266334911908, 'iterations': 2929, 'l2_leaf_reg': 0.0703435189844451, 'border_count': 30, 'bagging_temperature': 0.055938178628497856, 'random_strength': 1.3420536069713145, 'grow_policy': 'Depthwise', 'min_data_in_leaf': 32}. Best is trial 814 with value: 2060.357404924192.[0m
[32m[I 2024-10-13 11:01:25,686][0m Trial 853 finished with value: 2324.306056286876 and parameters: {'depth': 8, 'learning_rate': 0.0003369874129722712, 'iterations': 2861, 'l2_leaf_reg': 1.5298371854013384e-08, 'border_count': 24, 'bagging_temperature': 0.09574195726243633, 'random_strength': 1.666290139665247, 'grow_policy': 'Depthwise', 'min_data_in_leaf': 46}. Best is trial 814 with value: 2060.357404924192.[0m
[32m[I 2024-10-13 11:01:32,050][0m Trial 854 finished with value: 2347.7238303662925 and parameters: {'depth': 9, 'learning_rate': 0.0007216973408045433, 'iterations': 2947, 'l2_leaf_reg': 2.418039774371568e-08, 'border_count': 33, 'bagging_temperature': 0.047029326907723656, 'random_strength': 1.7090126130532752, 'grow_policy': 'Depthwise', 'min_data_in_leaf': 19}. Best is trial 814 with value: 2060.357404924192.[0m
[32m[I 2024-10-13 11:01:55,746][0m Trial 855 finished with value: 2384.494400733516 and parameters: {'depth': 8, 'learning_rate': 0.0005808892017856069, 'iterations': 2996, 'l2_leaf_reg': 4.165859720747927e-08, 'border_count': 23, 'bagging_temperature': 0.11192187857489508, 'random_strength': 1.370519520393217, 'grow_policy': 'SymmetricTree', 'min_data_in_leaf': 46}. Best is trial 814 with value: 2060.357404924192.[0m
[32m[I 2024-10-13 11:02:01,774][0m Trial 856 finished with value: 2446.9721637029447 and parameters: {'depth': 9, 'learning_rate': 0.000937099991091354, 'iterations': 2841, 'l2_leaf_reg': 1.4200348611093771e-08, 'border_count': 27, 'bagging_temperature': 0.0391477033494506, 'random_strength': 1.9075159412967584, 'grow_policy': 'Depthwise', 'min_data_in_leaf': 20}. Best is trial 814 with value: 2060.357404924192.[0m
[32m[I 2024-10-13 11:02:13,664][0m Trial 857 finished with value: 2835.623365653774 and parameters: {'depth': 9, 'learning_rate': 0.0004983878811031172, 'iterations': 2895, 'l2_leaf_reg': 2.026674844357972e-08, 'border_count': 20, 'bagging_temperature': 0.0737222562550219, 'random_strength': 2.305290294658643, 'grow_policy': 'Depthwise', 'min_data_in_leaf': 1}. Best is trial 814 with value: 2060.357404924192.[0m
[32m[I 2024-10-13 11:02:18,271][0m Trial 858 finished with value: 2221.091315378443 and parameters: {'depth': 12, 'learning_rate': 0.00041308982729299317, 'iterations': 2906, 'l2_leaf_reg': 3.0700454661106975e-08, 'border_count': 39, 'bagging_temperature': 0.06529989242910492, 'random_strength': 1.784271523444232, 'grow_policy': 'Depthwise', 'min_data_in_leaf': 33}. Best is trial 814 with value: 2060.357404924192.[0m
[32m[I 2024-10-13 11:02:22,118][0m Trial 859 finished with value: 2207.918990593664 and parameters: {'depth': 12, 'learning_rate': 0.0006514321367956522, 'iterations': 2824, 'l2_leaf_reg': 1.0098001761296996e-08, 'border_count': 31, 'bagging_temperature': 0.03496190102297265, 'random_strength': 2.1280769544572014, 'grow_policy': 'Depthwise', 'min_data_in_leaf': 55}. Best is trial 814 with value: 2060.357404924192.[0m
[32m[I 2024-10-13 11:02:27,979][0m Trial 860 finished with value: 2326.4010415354883 and parameters: {'depth': 8, 'learning_rate': 0.0005496319528833071, 'iterations': 2943, 'l2_leaf_reg': 9.6954486126989e-08, 'border_count': 25, 'bagging_temperature': 0.052653001066104946, 'random_strength': 2.3711810827302537, 'grow_policy': 'Depthwise', 'min_data_in_leaf': 20}. Best is trial 814 with value: 2060.357404924192.[0m
[32m[I 2024-10-13 11:02:31,960][0m Trial 861 finished with value: 2259.775144944888 and parameters: {'depth': 9, 'learning_rate': 0.00037464682061425766, 'iterations': 2837, 'l2_leaf_reg': 4.620911241307318e-08, 'border_count': 20, 'bagging_temperature': 0.08577632519714118, 'random_strength': 1.2826155290345884, 'grow_policy': 'Depthwise', 'min_data_in_leaf': 39}. Best is trial 814 with value: 2060.357404924192.[0m
[32m[I 2024-10-13 11:02:34,205][0m Trial 862 finished with value: 3642.5973855682955 and parameters: {'depth': 11, 'learning_rate': 0.0004663053078501197, 'iterations': 980, 'l2_leaf_reg': 1.8956284442480693e-08, 'border_count': 19, 'bagging_temperature': 0.029714956058192504, 'random_strength': 1.7106220079848953, 'grow_policy': 'Lossguide', 'min_data_in_leaf': 19, 'max_leaves': 41}. Best is trial 814 with value: 2060.357404924192.[0m
[32m[I 2024-10-13 11:02:37,781][0m Trial 863 finished with value: 2386.411996394085 and parameters: {'depth': 11, 'learning_rate': 0.0002895000833033684, 'iterations': 3000, 'l2_leaf_reg': 2.962961484187679e-08, 'border_count': 26, 'bagging_temperature': 0.04967206357363653, 'random_strength': 2.0333684482360845, 'grow_policy': 'Depthwise', 'min_data_in_leaf': 61}. Best is trial 814 with value: 2060.357404924192.[0m
[32m[I 2024-10-13 11:02:42,138][0m Trial 864 finished with value: 2244.180242611275 and parameters: {'depth': 11, 'learning_rate': 0.0007605796364519254, 'iterations': 2871, 'l2_leaf_reg': 6.459348878248577e-08, 'border_count': 30, 'bagging_temperature': 0.020359340041292327, 'random_strength': 2.2219295927789737, 'grow_policy': 'Depthwise', 'min_data_in_leaf': 44}. Best is trial 814 with value: 2060.357404924192.[0m
[32m[I 2024-10-13 11:02:49,568][0m Trial 865 finished with value: 3383.5987371768188 and parameters: {'depth': 9, 'learning_rate': 0.0006305530032279951, 'iterations': 2911, 'l2_leaf_reg': 1.413093755851651e-08, 'border_count': 1, 'bagging_temperature': 0.0734994042218608, 'random_strength': 1.8819100443562018, 'grow_policy': 'Depthwise', 'min_data_in_leaf': 18}. Best is trial 814 with value: 2060.357404924192.[0m
[32m[I 2024-10-13 11:02:53,009][0m Trial 866 finished with value: 2241.3806315984716 and parameters: {'depth': 12, 'learning_rate': 0.0005093210837445557, 'iterations': 2814, 'l2_leaf_reg': 4.129802264818749e-08, 'border_count': 43, 'bagging_temperature': 0.04031015241437313, 'random_strength': 2.287362661156743, 'grow_policy': 'Depthwise', 'min_data_in_leaf': 64}. Best is trial 814 with value: 2060.357404924192.[0m
