Optimizing CatBoost...
[32m[I 2024-10-13 09:07:32,860][0m Trial 0 finished with value: 4170.106748874777 and parameters: {'depth': 10, 'learning_rate': 0.00020012642476189855, 'iterations': 902, 'l2_leaf_reg': 0.010036397229248666, 'border_count': 172, 'bagging_temperature': 0.7640958051713646, 'random_strength': 7.6895624887519, 'grow_policy': 'Depthwise', 'min_data_in_leaf': 737}. Best is trial 0 with value: 4170.106748874777.[0m
[32m[I 2024-10-13 09:07:37,157][0m Trial 1 finished with value: 3205.16964454453 and parameters: {'depth': 8, 'learning_rate': 0.06971706015607267, 'iterations': 2435, 'l2_leaf_reg': 0.0001731924354531738, 'border_count': 201, 'bagging_temperature': 0.043881417785432086, 'random_strength': 8.109852473353833, 'grow_policy': 'Lossguide', 'min_data_in_leaf': 527, 'max_leaves': 111}. Best is trial 1 with value: 3205.16964454453.[0m
[32m[I 2024-10-13 09:07:39,808][0m Trial 2 finished with value: 3489.357140247597 and parameters: {'depth': 14, 'learning_rate': 0.0003178425262146292, 'iterations': 1267, 'l2_leaf_reg': 0.0006194207173274163, 'border_count': 228, 'bagging_temperature': 0.4366786293957666, 'random_strength': 9.636374680331336, 'grow_policy': 'Lossguide', 'min_data_in_leaf': 179, 'max_leaves': 103}. Best is trial 1 with value: 3205.16964454453.[0m
[32m[I 2024-10-13 09:07:47,697][0m Trial 3 finished with value: 2571.115131767192 and parameters: {'depth': 10, 'learning_rate': 0.0004932906111691336, 'iterations': 1872, 'l2_leaf_reg': 0.09460068413581998, 'border_count': 182, 'bagging_temperature': 0.5304518192118125, 'random_strength': 3.786121197995267, 'grow_policy': 'Depthwise', 'min_data_in_leaf': 22}. Best is trial 3 with value: 2571.115131767192.[0m
[32m[I 2024-10-13 09:08:02,507][0m Trial 4 finished with value: 2870.4264655286706 and parameters: {'depth': 8, 'learning_rate': 0.0009485621756129495, 'iterations': 1231, 'l2_leaf_reg': 0.0005305858717365583, 'border_count': 65, 'bagging_temperature': 0.17985181302973596, 'random_strength': 1.1926018774239844, 'grow_policy': 'SymmetricTree', 'min_data_in_leaf': 895}. Best is trial 3 with value: 2571.115131767192.[0m
[32m[I 2024-10-13 09:08:32,684][0m Trial 5 finished with value: 2446.7819793543244 and parameters: {'depth': 14, 'learning_rate': 0.016968212535948334, 'iterations': 622, 'l2_leaf_reg': 6.84433739520265e-06, 'border_count': 23, 'bagging_temperature': 0.6792360799796218, 'random_strength': 3.1621962934287904, 'grow_policy': 'SymmetricTree', 'min_data_in_leaf': 173}. Best is trial 5 with value: 2446.7819793543244.[0m
[32m[I 2024-10-13 09:08:33,699][0m Trial 6 finished with value: 2382.4208831993924 and parameters: {'depth': 8, 'learning_rate': 0.013851200504194172, 'iterations': 303, 'l2_leaf_reg': 0.006675124370238801, 'border_count': 76, 'bagging_temperature': 0.1724272914156968, 'random_strength': 5.3080554696533735, 'grow_policy': 'Lossguide', 'min_data_in_leaf': 612, 'max_leaves': 85}. Best is trial 6 with value: 2382.4208831993924.[0m
[32m[I 2024-10-13 09:16:10,197][0m Trial 7 finished with value: 2610.3446197822022 and parameters: {'depth': 15, 'learning_rate': 0.003862555283093751, 'iterations': 2138, 'l2_leaf_reg': 2.607838450234403e-06, 'border_count': 223, 'bagging_temperature': 0.5460038328566283, 'random_strength': 8.527908931534277, 'grow_policy': 'SymmetricTree', 'min_data_in_leaf': 803}. Best is trial 6 with value: 2382.4208831993924.[0m
[32m[I 2024-10-13 09:17:45,370][0m Trial 8 finished with value: 2611.4837118892265 and parameters: {'depth': 10, 'learning_rate': 0.014675778533625892, 'iterations': 2624, 'l2_leaf_reg': 6.789873975127942e-05, 'border_count': 128, 'bagging_temperature': 0.9603986577872673, 'random_strength': 3.1120818301891697, 'grow_policy': 'SymmetricTree', 'min_data_in_leaf': 10}. Best is trial 6 with value: 2382.4208831993924.[0m
[32m[I 2024-10-13 09:17:47,590][0m Trial 9 finished with value: 2873.3359840573144 and parameters: {'depth': 4, 'learning_rate': 0.07099393210737745, 'iterations': 1169, 'l2_leaf_reg': 0.007856448981432475, 'border_count': 227, 'bagging_temperature': 0.9839779894838078, 'random_strength': 5.7094476966852366, 'grow_policy': 'Depthwise', 'min_data_in_leaf': 774}. Best is trial 6 with value: 2382.4208831993924.[0m
[32m[I 2024-10-13 09:17:48,162][0m Trial 10 finished with value: 3109.9513892901073 and parameters: {'depth': 4, 'learning_rate': 0.005827883985955293, 'iterations': 136, 'l2_leaf_reg': 7.878452585285388, 'border_count': 98, 'bagging_temperature': 0.28131178378694427, 'random_strength': 5.93095828778004, 'grow_policy': 'Lossguide', 'min_data_in_leaf': 510, 'max_leaves': 253}. Best is trial 6 with value: 2382.4208831993924.[0m
[32m[I 2024-10-13 09:17:49,146][0m Trial 11 finished with value: 4185.903306286337 and parameters: {'depth': 13, 'learning_rate': 0.020284367965494605, 'iterations': 206, 'l2_leaf_reg': 2.2723908798150434e-08, 'border_count': 1, 'bagging_temperature': 0.6696063366955901, 'random_strength': 0.4272353011492971, 'grow_policy': 'SymmetricTree', 'min_data_in_leaf': 299}. Best is trial 6 with value: 2382.4208831993924.[0m
[32m[I 2024-10-13 09:17:50,503][0m Trial 12 finished with value: 2399.5178395981306 and parameters: {'depth': 6, 'learning_rate': 0.0024987362187179297, 'iterations': 448, 'l2_leaf_reg': 1.5854257811068525e-06, 'border_count': 27, 'bagging_temperature': 0.2989232919030632, 'random_strength': 2.9590869192419698, 'grow_policy': 'Lossguide', 'min_data_in_leaf': 355, 'max_leaves': 32}. Best is trial 6 with value: 2382.4208831993924.[0m
[32m[I 2024-10-13 09:17:52,180][0m Trial 13 finished with value: 2409.30330559197 and parameters: {'depth': 6, 'learning_rate': 0.0018982958885121889, 'iterations': 662, 'l2_leaf_reg': 5.445585520208761e-08, 'border_count': 57, 'bagging_temperature': 0.29051313035946, 'random_strength': 4.8044979412471776, 'grow_policy': 'Lossguide', 'min_data_in_leaf': 388, 'max_leaves': 32}. Best is trial 6 with value: 2382.4208831993924.[0m
[32m[I 2024-10-13 09:17:53,631][0m Trial 14 finished with value: 3082.305876831827 and parameters: {'depth': 6, 'learning_rate': 0.21614298798319664, 'iterations': 535, 'l2_leaf_reg': 1.1248495337946577e-06, 'border_count': 59, 'bagging_temperature': 0.0466972390954562, 'random_strength': 2.3143458184238295, 'grow_policy': 'Lossguide', 'min_data_in_leaf': 614, 'max_leaves': 34}. Best is trial 6 with value: 2382.4208831993924.[0m
[32m[I 2024-10-13 09:17:59,198][0m Trial 15 finished with value: 2602.283833507976 and parameters: {'depth': 6, 'learning_rate': 0.004490975959989238, 'iterations': 2946, 'l2_leaf_reg': 0.8974091595067651, 'border_count': 99, 'bagging_temperature': 0.2124510944223853, 'random_strength': 4.755733401999296, 'grow_policy': 'Lossguide', 'min_data_in_leaf': 366, 'max_leaves': 74}. Best is trial 6 with value: 2382.4208831993924.[0m
[32m[I 2024-10-13 09:18:02,624][0m Trial 16 finished with value: 4141.669422428939 and parameters: {'depth': 3, 'learning_rate': 0.00010654900371915721, 'iterations': 1674, 'l2_leaf_reg': 3.019616195545975e-07, 'border_count': 29, 'bagging_temperature': 0.3944656439558505, 'random_strength': 6.715093737874859, 'grow_policy': 'Lossguide', 'min_data_in_leaf': 688, 'max_leaves': 182}. Best is trial 6 with value: 2382.4208831993924.[0m
[32m[I 2024-10-13 09:18:03,760][0m Trial 17 finished with value: 3179.8906068764772 and parameters: {'depth': 8, 'learning_rate': 0.0014653729248819448, 'iterations': 363, 'l2_leaf_reg': 1.776033942007027e-05, 'border_count': 128, 'bagging_temperature': 0.1739679950872398, 'random_strength': 2.1099132987679803, 'grow_policy': 'Lossguide', 'min_data_in_leaf': 991, 'max_leaves': 69}. Best is trial 6 with value: 2382.4208831993924.[0m
[32m[I 2024-10-13 09:18:05,746][0m Trial 18 finished with value: 2480.937667398894 and parameters: {'depth': 11, 'learning_rate': 0.009799728676175293, 'iterations': 857, 'l2_leaf_reg': 0.05891350517457665, 'border_count': 88, 'bagging_temperature': 0.3283500078999715, 'random_strength': 4.0550484019320745, 'grow_policy': 'Lossguide', 'min_data_in_leaf': 577, 'max_leaves': 160}. Best is trial 6 with value: 2382.4208831993924.[0m
[32m[I 2024-10-13 09:18:07,664][0m Trial 19 finished with value: 2733.527048044176 and parameters: {'depth': 7, 'learning_rate': 0.02840577474702308, 'iterations': 967, 'l2_leaf_reg': 0.0032135600429650515, 'border_count': 132, 'bagging_temperature': 0.09686186276886016, 'random_strength': 6.041767979283321, 'grow_policy': 'Lossguide', 'min_data_in_leaf': 416, 'max_leaves': 74}. Best is trial 6 with value: 2382.4208831993924.[0m
[32m[I 2024-10-13 09:18:08,885][0m Trial 20 finished with value: 2521.645749115898 and parameters: {'depth': 12, 'learning_rate': 0.04065944738429154, 'iterations': 405, 'l2_leaf_reg': 3.187230766455529e-05, 'border_count': 35, 'bagging_temperature': 0.4423493079735762, 'random_strength': 0.028012683169519548, 'grow_policy': 'Depthwise', 'min_data_in_leaf': 221}. Best is trial 6 with value: 2382.4208831993924.[0m
[32m[I 2024-10-13 09:18:10,380][0m Trial 21 finished with value: 2374.089272121217 and parameters: {'depth': 6, 'learning_rate': 0.0020869308910589184, 'iterations': 646, 'l2_leaf_reg': 1.3395412104824378e-08, 'border_count': 61, 'bagging_temperature': 0.31049526881452155, 'random_strength': 4.809241546889765, 'grow_policy': 'Lossguide', 'min_data_in_leaf': 428, 'max_leaves': 38}. Best is trial 21 with value: 2374.089272121217.[0m
[32m[I 2024-10-13 09:18:11,115][0m Trial 22 finished with value: 3672.246815011193 and parameters: {'depth': 5, 'learning_rate': 0.002366477142036464, 'iterations': 140, 'l2_leaf_reg': 1.2465594061180866e-07, 'border_count': 77, 'bagging_temperature': 0.22507177099488176, 'random_strength': 6.981585392955811, 'grow_policy': 'Lossguide', 'min_data_in_leaf': 426, 'max_leaves': 33}. Best is trial 21 with value: 2374.089272121217.[0m
[32m[I 2024-10-13 09:18:12,291][0m Trial 23 finished with value: 4222.002036063191 and parameters: {'depth': 5, 'learning_rate': 0.0007111956873393186, 'iterations': 740, 'l2_leaf_reg': 1.1586162165469715e-08, 'border_count': 1, 'bagging_temperature': 0.35890099880063153, 'random_strength': 4.450699645728004, 'grow_policy': 'Lossguide', 'min_data_in_leaf': 648, 'max_leaves': 63}. Best is trial 21 with value: 2374.089272121217.[0m
[32m[I 2024-10-13 09:18:13,544][0m Trial 24 finished with value: 2366.1380784479684 and parameters: {'depth': 7, 'learning_rate': 0.0076005115422592235, 'iterations': 355, 'l2_leaf_reg': 6.150797896430272e-07, 'border_count': 43, 'bagging_temperature': 0.1222305848451325, 'random_strength': 2.952271664005768, 'grow_policy': 'Lossguide', 'min_data_in_leaf': 261, 'max_leaves': 107}. Best is trial 24 with value: 2366.1380784479684.[0m
[32m[I 2024-10-13 09:18:16,764][0m Trial 25 finished with value: 2436.995085356312 and parameters: {'depth': 9, 'learning_rate': 0.007533275269186315, 'iterations': 1534, 'l2_leaf_reg': 3.7187215298344393e-07, 'border_count': 45, 'bagging_temperature': 0.11998701769366735, 'random_strength': 5.631288364627016, 'grow_policy': 'Lossguide', 'min_data_in_leaf': 262, 'max_leaves': 115}. Best is trial 24 with value: 2366.1380784479684.[0m
[32m[I 2024-10-13 09:18:17,776][0m Trial 26 finished with value: 2449.9728192982348 and parameters: {'depth': 7, 'learning_rate': 0.010065637385741727, 'iterations': 327, 'l2_leaf_reg': 1.1213115874050732e-08, 'border_count': 108, 'bagging_temperature': 0.1314900412707134, 'random_strength': 1.7522595345221892, 'grow_policy': 'Lossguide', 'min_data_in_leaf': 106, 'max_leaves': 132}. Best is trial 24 with value: 2366.1380784479684.[0m
[32m[I 2024-10-13 09:18:18,223][0m Trial 27 finished with value: 2572.6088475511915 and parameters: {'depth': 9, 'learning_rate': 0.18703215649239857, 'iterations': 101, 'l2_leaf_reg': 2.043177533807491e-07, 'border_count': 79, 'bagging_temperature': 0.0008725277511651974, 'random_strength': 3.6957995876278305, 'grow_policy': 'Lossguide', 'min_data_in_leaf': 476, 'max_leaves': 88}. Best is trial 24 with value: 2366.1380784479684.[0m
[32m[I 2024-10-13 09:18:19,443][0m Trial 28 finished with value: 2704.1349716953514 and parameters: {'depth': 9, 'learning_rate': 0.04820618480821971, 'iterations': 565, 'l2_leaf_reg': 0.0014526529737799647, 'border_count': 113, 'bagging_temperature': 0.24854117413651788, 'random_strength': 5.346701520962901, 'grow_policy': 'Lossguide', 'min_data_in_leaf': 290, 'max_leaves': 144}. Best is trial 24 with value: 2366.1380784479684.[0m
[32m[I 2024-10-13 09:18:21,332][0m Trial 29 finished with value: 2463.8845278287754 and parameters: {'depth': 7, 'learning_rate': 0.0037392118497990576, 'iterations': 997, 'l2_leaf_reg': 0.05741724055546992, 'border_count': 142, 'bagging_temperature': 0.8654577214428462, 'random_strength': 6.481081188488834, 'grow_policy': 'Depthwise', 'min_data_in_leaf': 480}. Best is trial 24 with value: 2366.1380784479684.[0m
[32m[I 2024-10-13 09:18:23,150][0m Trial 30 finished with value: 2554.8433920608404 and parameters: {'depth': 5, 'learning_rate': 0.0012097914727357301, 'iterations': 854, 'l2_leaf_reg': 6.310283043644022e-08, 'border_count': 152, 'bagging_temperature': 0.5954485576119314, 'random_strength': 7.239939367814735, 'grow_policy': 'Depthwise', 'min_data_in_leaf': 116}. Best is trial 24 with value: 2366.1380784479684.[0m
[32m[I 2024-10-13 09:18:24,253][0m Trial 31 finished with value: 2346.7291236463825 and parameters: {'depth': 7, 'learning_rate': 0.002640640121800682, 'iterations': 458, 'l2_leaf_reg': 4.710010602530322e-06, 'border_count': 24, 'bagging_temperature': 0.33023153129377175, 'random_strength': 3.0041460030191716, 'grow_policy': 'Lossguide', 'min_data_in_leaf': 340, 'max_leaves': 53}. Best is trial 31 with value: 2346.7291236463825.[0m
[32m[I 2024-10-13 09:18:24,867][0m Trial 32 finished with value: 2604.1614016677677 and parameters: {'depth': 8, 'learning_rate': 0.0030088444590118907, 'iterations': 320, 'l2_leaf_reg': 0.00012468370870581544, 'border_count': 47, 'bagging_temperature': 0.4063229065163121, 'random_strength': 4.253262003826229, 'grow_policy': 'Lossguide', 'min_data_in_leaf': 324, 'max_leaves': 57}. Best is trial 31 with value: 2346.7291236463825.[0m
[32m[I 2024-10-13 09:18:26,296][0m Trial 33 finished with value: 2242.6962834508477 and parameters: {'depth': 7, 'learning_rate': 0.0061082674395053545, 'iterations': 672, 'l2_leaf_reg': 7.810404267990376e-06, 'border_count': 20, 'bagging_temperature': 0.0850727619832538, 'random_strength': 2.628608602761882, 'grow_policy': 'Lossguide', 'min_data_in_leaf': 559, 'max_leaves': 92}. Best is trial 33 with value: 2242.6962834508477.[0m
[32m[I 2024-10-13 09:18:28,310][0m Trial 34 finished with value: 3528.429043073021 and parameters: {'depth': 7, 'learning_rate': 0.0003459969135116269, 'iterations': 1070, 'l2_leaf_reg': 6.264275632603275e-06, 'border_count': 20, 'bagging_temperature': 0.06462832993080259, 'random_strength': 2.4390332936607018, 'grow_policy': 'Lossguide', 'min_data_in_leaf': 535, 'max_leaves': 97}. Best is trial 33 with value: 2242.6962834508477.[0m
[32m[I 2024-10-13 09:18:29,837][0m Trial 35 finished with value: 2868.132470523132 and parameters: {'depth': 4, 'learning_rate': 0.006267031747889012, 'iterations': 722, 'l2_leaf_reg': 4.4576037297457585e-07, 'border_count': 11, 'bagging_temperature': 0.461026996531555, 'random_strength': 1.1807913143304347, 'grow_policy': 'Lossguide', 'min_data_in_leaf': 219, 'max_leaves': 54}. Best is trial 33 with value: 2242.6962834508477.[0m
[32m[I 2024-10-13 09:18:32,654][0m Trial 36 finished with value: 2496.764728758558 and parameters: {'depth': 7, 'learning_rate': 0.0007430802057996239, 'iterations': 1407, 'l2_leaf_reg': 9.777609497974834e-06, 'border_count': 42, 'bagging_temperature': 0.0023781194211022205, 'random_strength': 3.5858523892111727, 'grow_policy': 'Lossguide', 'min_data_in_leaf': 434, 'max_leaves': 49}. Best is trial 33 with value: 2242.6962834508477.[0m
[32m[I 2024-10-13 09:18:34,301][0m Trial 37 finished with value: 2331.371941104028 and parameters: {'depth': 10, 'learning_rate': 0.0015823223233966293, 'iterations': 777, 'l2_leaf_reg': 1.0146578926907682e-06, 'border_count': 14, 'bagging_temperature': 0.34846640194828876, 'random_strength': 1.4115713748521983, 'grow_policy': 'Lossguide', 'min_data_in_leaf': 563, 'max_leaves': 127}. Best is trial 33 with value: 2242.6962834508477.[0m
[32m[I 2024-10-13 09:18:43,988][0m Trial 38 finished with value: 2686.826103949826 and parameters: {'depth': 10, 'learning_rate': 0.0013676613272721853, 'iterations': 810, 'l2_leaf_reg': 3.08719744875113e-06, 'border_count': 15, 'bagging_temperature': 0.5104642938577438, 'random_strength': 1.1927324461085023, 'grow_policy': 'SymmetricTree', 'min_data_in_leaf': 560}. Best is trial 33 with value: 2242.6962834508477.[0m
[32m[I 2024-10-13 09:18:46,233][0m Trial 39 finished with value: 2937.6552227129177 and parameters: {'depth': 11, 'learning_rate': 0.0005050871042780147, 'iterations': 1317, 'l2_leaf_reg': 8.395175312882147e-07, 'border_count': 197, 'bagging_temperature': 0.1441506017127352, 'random_strength': 1.6743945083413658, 'grow_policy': 'Lossguide', 'min_data_in_leaf': 725, 'max_leaves': 127}. Best is trial 33 with value: 2242.6962834508477.[0m
[32m[I 2024-10-13 09:18:47,431][0m Trial 40 finished with value: 2330.3056467513215 and parameters: {'depth': 11, 'learning_rate': 0.00921166386858012, 'iterations': 505, 'l2_leaf_reg': 4.767229292660023e-05, 'border_count': 37, 'bagging_temperature': 0.35765489571955494, 'random_strength': 2.721463826999294, 'grow_policy': 'Depthwise', 'min_data_in_leaf': 813}. Best is trial 33 with value: 2242.6962834508477.[0m
[32m[I 2024-10-13 09:18:48,791][0m Trial 41 finished with value: 2368.234411664905 and parameters: {'depth': 11, 'learning_rate': 0.009869191921126563, 'iterations': 584, 'l2_leaf_reg': 0.0002188938299799983, 'border_count': 38, 'bagging_temperature': 0.3840834245642043, 'random_strength': 2.6338854555543336, 'grow_policy': 'Depthwise', 'min_data_in_leaf': 938}. Best is trial 33 with value: 2242.6962834508477.[0m
[32m[I 2024-10-13 09:18:49,849][0m Trial 42 finished with value: 2186.4122490727964 and parameters: {'depth': 12, 'learning_rate': 0.004718163276919063, 'iterations': 443, 'l2_leaf_reg': 4.223746463676842e-05, 'border_count': 14, 'bagging_temperature': 0.5894101945480292, 'random_strength': 0.7874523153773221, 'grow_policy': 'Depthwise', 'min_data_in_leaf': 846}. Best is trial 42 with value: 2186.4122490727964.[0m
[32m[I 2024-10-13 09:18:50,730][0m Trial 43 finished with value: 2809.519346603283 and parameters: {'depth': 12, 'learning_rate': 0.0045101631146130606, 'iterations': 487, 'l2_leaf_reg': 2.2682399816302655e-05, 'border_count': 11, 'bagging_temperature': 0.575839934604101, 'random_strength': 0.7448899791847543, 'grow_policy': 'Depthwise', 'min_data_in_leaf': 833}. Best is trial 42 with value: 2186.4122490727964.[0m
[32m[I 2024-10-13 09:18:53,105][0m Trial 44 finished with value: 3666.9982611969285 and parameters: {'depth': 13, 'learning_rate': 0.00317750569881906, 'iterations': 1140, 'l2_leaf_reg': 0.000557477052836668, 'border_count': 1, 'bagging_temperature': 0.6451386368800479, 'random_strength': 1.6462022939038272, 'grow_policy': 'Depthwise', 'min_data_in_leaf': 850}. Best is trial 42 with value: 2186.4122490727964.[0m
[32m[I 2024-10-13 09:18:56,870][0m Trial 45 finished with value: 2496.330787389935 and parameters: {'depth': 13, 'learning_rate': 0.020850396802907754, 'iterations': 1958, 'l2_leaf_reg': 5.7579513637479336e-05, 'border_count': 24, 'bagging_temperature': 0.7414050551104987, 'random_strength': 0.8444057249439176, 'grow_policy': 'Depthwise', 'min_data_in_leaf': 744}. Best is trial 42 with value: 2186.4122490727964.[0m
[32m[I 2024-10-13 09:18:57,627][0m Trial 46 finished with value: 2391.1081653481347 and parameters: {'depth': 12, 'learning_rate': 0.013691338406089364, 'iterations': 250, 'l2_leaf_reg': 3.986527429767878e-06, 'border_count': 52, 'bagging_temperature': 0.4802629228798767, 'random_strength': 3.3380909807028933, 'grow_policy': 'Depthwise', 'min_data_in_leaf': 896}. Best is trial 42 with value: 2186.4122490727964.[0m
[32m[I 2024-10-13 09:18:58,951][0m Trial 47 finished with value: 2414.7045971468388 and parameters: {'depth': 10, 'learning_rate': 0.005188330717527597, 'iterations': 489, 'l2_leaf_reg': 1.3066379826986227e-05, 'border_count': 251, 'bagging_temperature': 0.538429592075741, 'random_strength': 9.321547765616387, 'grow_policy': 'Depthwise', 'min_data_in_leaf': 656}. Best is trial 42 with value: 2186.4122490727964.[0m
[32m[I 2024-10-13 09:19:33,995][0m Trial 48 finished with value: 2516.9062891455287 and parameters: {'depth': 15, 'learning_rate': 0.001648305869110554, 'iterations': 759, 'l2_leaf_reg': 7.836895619012489e-05, 'border_count': 31, 'bagging_temperature': 0.7391461090076098, 'random_strength': 1.911567723373606, 'grow_policy': 'SymmetricTree', 'min_data_in_leaf': 763}. Best is trial 42 with value: 2186.4122490727964.[0m
[32m[I 2024-10-13 09:19:36,293][0m Trial 49 finished with value: 2576.2634123176554 and parameters: {'depth': 9, 'learning_rate': 0.000966065592410526, 'iterations': 940, 'l2_leaf_reg': 2.2232084108869536e-06, 'border_count': 18, 'bagging_temperature': 0.2679889664112334, 'random_strength': 0.09526961396661537, 'grow_policy': 'Depthwise', 'min_data_in_leaf': 699}. Best is trial 42 with value: 2186.4122490727964.[0m
[32m[I 2024-10-13 09:19:41,223][0m Trial 50 finished with value: 2391.742613584823 and parameters: {'depth': 11, 'learning_rate': 0.0028238667286690174, 'iterations': 2413, 'l2_leaf_reg': 0.000291153174087194, 'border_count': 71, 'bagging_temperature': 0.6117970061140086, 'random_strength': 2.6631307429025055, 'grow_policy': 'Depthwise', 'min_data_in_leaf': 803}. Best is trial 42 with value: 2186.4122490727964.[0m
