[32m[I 2024-10-13 09:49:23,040][0m Trial 357 finished with value: 2316.5587679683763 and parameters: {'depth': 11, 'learning_rate': 0.00042728646670419317, 'iterations': 2857, 'l2_leaf_reg': 1.3994996182034108e-08, 'border_count': 13, 'bagging_temperature': 0.036281635753195284, 'random_strength': 2.364354472083793, 'grow_policy': 'Depthwise', 'min_data_in_leaf': 93}. Best is trial 349 with value: 2072.137476888861.[0m
[32m[I 2024-10-13 09:49:37,427][0m Trial 358 finished with value: 2672.659998051752 and parameters: {'depth': 11, 'learning_rate': 0.00030069817428674987, 'iterations': 2939, 'l2_leaf_reg': 2.485619556513041e-08, 'border_count': 20, 'bagging_temperature': 0.0005591847266888661, 'random_strength': 2.5152223671971576, 'grow_policy': 'Depthwise', 'min_data_in_leaf': 6}. Best is trial 349 with value: 2072.137476888861.[0m
[32m[I 2024-10-13 09:49:51,039][0m Trial 359 finished with value: 2861.9579268269454 and parameters: {'depth': 12, 'learning_rate': 0.0005199615362595543, 'iterations': 2791, 'l2_leaf_reg': 3.1846357784342164e-08, 'border_count': 10, 'bagging_temperature': 0.04255461343238304, 'random_strength': 2.098345517691134, 'grow_policy': 'Depthwise', 'min_data_in_leaf': 71}. Best is trial 349 with value: 2072.137476888861.[0m
[32m[I 2024-10-13 09:50:14,291][0m Trial 360 finished with value: 2166.387277642903 and parameters: {'depth': 11, 'learning_rate': 0.0004645592913809227, 'iterations': 2906, 'l2_leaf_reg': 1.4221205113692e-08, 'border_count': 20, 'bagging_temperature': 0.016250825006448033, 'random_strength': 2.3080570643944065, 'grow_policy': 'Depthwise', 'min_data_in_leaf': 41}. Best is trial 349 with value: 2072.137476888861.[0m
[32m[I 2024-10-13 09:50:32,110][0m Trial 361 finished with value: 2266.0180875623905 and parameters: {'depth': 11, 'learning_rate': 0.0003541127417632977, 'iterations': 2911, 'l2_leaf_reg': 1.5109965500668026e-08, 'border_count': 19, 'bagging_temperature': 0.021721260018045786, 'random_strength': 2.3242336544419206, 'grow_policy': 'Depthwise', 'min_data_in_leaf': 38}. Best is trial 349 with value: 2072.137476888861.[0m
[32m[I 2024-10-13 09:50:36,911][0m Trial 362 finished with value: 2170.052358326349 and parameters: {'depth': 11, 'learning_rate': 0.00045938575718670427, 'iterations': 2783, 'l2_leaf_reg': 1.0048652981356717e-08, 'border_count': 14, 'bagging_temperature': 0.020775464356136843, 'random_strength': 2.4889418739419655, 'grow_policy': 'Depthwise', 'min_data_in_leaf': 61}. Best is trial 349 with value: 2072.137476888861.[0m
[32m[I 2024-10-13 09:50:43,435][0m Trial 363 finished with value: 2873.2276340140393 and parameters: {'depth': 11, 'learning_rate': 0.00044828719751469423, 'iterations': 2779, 'l2_leaf_reg': 1.001386562156984e-08, 'border_count': 8, 'bagging_temperature': 0.02059683770594427, 'random_strength': 2.5137884632193974, 'grow_policy': 'Depthwise', 'min_data_in_leaf': 55}. Best is trial 349 with value: 2072.137476888861.[0m
[32m[I 2024-10-13 09:50:52,619][0m Trial 364 finished with value: 2748.537579086616 and parameters: {'depth': 12, 'learning_rate': 0.00021445568135735794, 'iterations': 2990, 'l2_leaf_reg': 1.9965865253725776e-08, 'border_count': 13, 'bagging_temperature': 0.04126549183956291, 'random_strength': 2.330331353502502, 'grow_policy': 'Depthwise', 'min_data_in_leaf': 33}. Best is trial 349 with value: 2072.137476888861.[0m
[32m[I 2024-10-13 09:50:57,943][0m Trial 365 finished with value: 2164.4224972132592 and parameters: {'depth': 11, 'learning_rate': 0.0005057268544897324, 'iterations': 2628, 'l2_leaf_reg': 3.81823238657064e-08, 'border_count': 14, 'bagging_temperature': 0.016589317422006214, 'random_strength': 2.168428776584372, 'grow_policy': 'Depthwise', 'min_data_in_leaf': 79}. Best is trial 349 with value: 2072.137476888861.[0m
[32m[I 2024-10-13 09:51:02,150][0m Trial 366 finished with value: 2768.0767363648697 and parameters: {'depth': 11, 'learning_rate': 0.0005303487040345583, 'iterations': 2852, 'l2_leaf_reg': 3.207792002334571e-08, 'border_count': 7, 'bagging_temperature': 0.002782622214347611, 'random_strength': 2.5145494708030776, 'grow_policy': 'Depthwise', 'min_data_in_leaf': 82}. Best is trial 349 with value: 2072.137476888861.[0m
[32m[I 2024-10-13 09:51:08,822][0m Trial 367 finished with value: 2243.689050941361 and parameters: {'depth': 11, 'learning_rate': 0.00040128630462858835, 'iterations': 2635, 'l2_leaf_reg': 1.503137751500979e-08, 'border_count': 14, 'bagging_temperature': 0.03785658321178709, 'random_strength': 2.1926271531445103, 'grow_policy': 'Depthwise', 'min_data_in_leaf': 60}. Best is trial 349 with value: 2072.137476888861.[0m
[32m[I 2024-10-13 09:51:13,655][0m Trial 368 finished with value: 2279.710749467328 and parameters: {'depth': 11, 'learning_rate': 0.000475998908014433, 'iterations': 2728, 'l2_leaf_reg': 2.2364296384136025e-08, 'border_count': 18, 'bagging_temperature': 0.01973484310051507, 'random_strength': 2.074533466681605, 'grow_policy': 'Depthwise', 'min_data_in_leaf': 103}. Best is trial 349 with value: 2072.137476888861.[0m
[32m[I 2024-10-13 09:51:44,380][0m Trial 369 finished with value: 3078.309721926197 and parameters: {'depth': 11, 'learning_rate': 0.0005490259198880682, 'iterations': 2868, 'l2_leaf_reg': 3.9519563628761215e-08, 'border_count': 12, 'bagging_temperature': 0.04087567297774608, 'random_strength': 2.3047053948506355, 'grow_policy': 'Depthwise', 'min_data_in_leaf': 1}. Best is trial 349 with value: 2072.137476888861.[0m
[32m[I 2024-10-13 09:51:51,673][0m Trial 370 finished with value: 2307.8477527704217 and parameters: {'depth': 11, 'learning_rate': 0.0003417335349639078, 'iterations': 2802, 'l2_leaf_reg': 1.4603825502135064e-08, 'border_count': 20, 'bagging_temperature': 0.0011586255313163416, 'random_strength': 2.4787246170679023, 'grow_policy': 'Depthwise', 'min_data_in_leaf': 45}. Best is trial 349 with value: 2072.137476888861.[0m
[32m[I 2024-10-13 09:51:57,378][0m Trial 371 finished with value: 2834.6431568271128 and parameters: {'depth': 11, 'learning_rate': 0.00041887038094879324, 'iterations': 2690, 'l2_leaf_reg': 2.1979975894860862e-08, 'border_count': 5, 'bagging_temperature': 0.051053432116902865, 'random_strength': 2.1208263753357084, 'grow_policy': 'Depthwise', 'min_data_in_leaf': 80}. Best is trial 349 with value: 2072.137476888861.[0m
[32m[I 2024-10-13 09:52:07,804][0m Trial 372 finished with value: 2161.978081190371 and parameters: {'depth': 11, 'learning_rate': 0.0004629842680378106, 'iterations': 2927, 'l2_leaf_reg': 4.0209377915093246e-08, 'border_count': 14, 'bagging_temperature': 0.022372242634909348, 'random_strength': 2.266702882147104, 'grow_policy': 'Depthwise', 'min_data_in_leaf': 27}. Best is trial 349 with value: 2072.137476888861.[0m
[32m[I 2024-10-13 09:52:19,242][0m Trial 373 finished with value: 2126.951463444655 and parameters: {'depth': 11, 'learning_rate': 0.00047294901436972, 'iterations': 2948, 'l2_leaf_reg': 4.05168521892857e-08, 'border_count': 13, 'bagging_temperature': 0.02071381670220941, 'random_strength': 2.5370102279664666, 'grow_policy': 'Depthwise', 'min_data_in_leaf': 25}. Best is trial 349 with value: 2072.137476888861.[0m
[32m[I 2024-10-13 09:52:30,333][0m Trial 374 finished with value: 3249.184322313725 and parameters: {'depth': 12, 'learning_rate': 0.0004682477787629218, 'iterations': 2946, 'l2_leaf_reg': 1.0125974932120268e-08, 'border_count': 9, 'bagging_temperature': 0.02448522699478955, 'random_strength': 2.549789966471005, 'grow_policy': 'Depthwise', 'min_data_in_leaf': 23}. Best is trial 349 with value: 2072.137476888861.[0m
[32m[I 2024-10-13 09:53:02,537][0m Trial 375 finished with value: 2814.8704684547774 and parameters: {'depth': 11, 'learning_rate': 0.00036177545672424897, 'iterations': 2619, 'l2_leaf_reg': 4.148219180298443e-08, 'border_count': 14, 'bagging_temperature': 0.04820034031632611, 'random_strength': 2.5238592512379467, 'grow_policy': 'SymmetricTree', 'min_data_in_leaf': 37}. Best is trial 349 with value: 2072.137476888861.[0m
[32m[I 2024-10-13 09:53:08,589][0m Trial 376 finished with value: 3021.394043967995 and parameters: {'depth': 11, 'learning_rate': 0.0003095923363192831, 'iterations': 2775, 'l2_leaf_reg': 1.7087913778263222e-08, 'border_count': 9, 'bagging_temperature': 0.0013437071749508901, 'random_strength': 2.339393691618495, 'grow_policy': 'Depthwise', 'min_data_in_leaf': 66}. Best is trial 349 with value: 2072.137476888861.[0m
[32m[I 2024-10-13 09:53:14,525][0m Trial 377 finished with value: 2907.6531584182694 and parameters: {'depth': 12, 'learning_rate': 0.00040934473423896283, 'iterations': 2915, 'l2_leaf_reg': 3.570021743269204e-08, 'border_count': 4, 'bagging_temperature': 0.020299421069518264, 'random_strength': 2.0801934881783692, 'grow_policy': 'Depthwise', 'min_data_in_leaf': 53}. Best is trial 349 with value: 2072.137476888861.[0m
[32m[I 2024-10-13 09:53:25,377][0m Trial 378 finished with value: 2460.212953548925 and parameters: {'depth': 11, 'learning_rate': 0.0005075272192460247, 'iterations': 2844, 'l2_leaf_reg': 2.2072261664415084e-08, 'border_count': 15, 'bagging_temperature': 0.05204620318720017, 'random_strength': 2.5526562295220057, 'grow_policy': 'Depthwise', 'min_data_in_leaf': 20}. Best is trial 349 with value: 2072.137476888861.[0m
[32m[I 2024-10-13 09:53:28,440][0m Trial 379 finished with value: 2289.962945577371 and parameters: {'depth': 11, 'learning_rate': 0.00045715353293232074, 'iterations': 2735, 'l2_leaf_reg': 1.003900810045126e-08, 'border_count': 18, 'bagging_temperature': 0.020613411405993664, 'random_strength': 2.313039646918529, 'grow_policy': 'Depthwise', 'min_data_in_leaf': 92}. Best is trial 349 with value: 2072.137476888861.[0m
[32m[I 2024-10-13 09:53:35,622][0m Trial 380 finished with value: 2795.944796486379 and parameters: {'depth': 11, 'learning_rate': 0.0005528493860283695, 'iterations': 2964, 'l2_leaf_reg': 1.548813485983523e-08, 'border_count': 12, 'bagging_temperature': 0.03568114362962931, 'random_strength': 2.113759667258165, 'grow_policy': 'Depthwise', 'min_data_in_leaf': 72}. Best is trial 349 with value: 2072.137476888861.[0m
[32m[I 2024-10-13 09:53:44,271][0m Trial 381 finished with value: 2220.800576498444 and parameters: {'depth': 11, 'learning_rate': 0.0003827386934016567, 'iterations': 2799, 'l2_leaf_reg': 2.8758234878164648e-08, 'border_count': 19, 'bagging_temperature': 0.01734000920367024, 'random_strength': 2.297273984543902, 'grow_policy': 'Depthwise', 'min_data_in_leaf': 28}. Best is trial 349 with value: 2072.137476888861.[0m
[32m[I 2024-10-13 09:53:52,100][0m Trial 382 finished with value: 2309.230504072244 and parameters: {'depth': 12, 'learning_rate': 0.0004754304411561938, 'iterations': 2711, 'l2_leaf_reg': 4.080107398490932e-08, 'border_count': 136, 'bagging_temperature': 0.0021274732224279115, 'random_strength': 2.6240354296002577, 'grow_policy': 'Depthwise', 'min_data_in_leaf': 42}. Best is trial 349 with value: 2072.137476888861.[0m
[32m[I 2024-10-13 09:53:59,583][0m Trial 383 finished with value: 2653.86524349533 and parameters: {'depth': 11, 'learning_rate': 0.00023888122488085383, 'iterations': 2868, 'l2_leaf_reg': 1.6413819701031482e-08, 'border_count': 13, 'bagging_temperature': 0.05017941535680973, 'random_strength': 2.02977113228232, 'grow_policy': 'Depthwise', 'min_data_in_leaf': 58}. Best is trial 349 with value: 2072.137476888861.[0m
[32m[I 2024-10-13 09:54:19,012][0m Trial 384 finished with value: 5680.503998828561 and parameters: {'depth': 11, 'learning_rate': 0.16303948960380446, 'iterations': 2569, 'l2_leaf_reg': 2.395220427313476e-08, 'border_count': 3, 'bagging_temperature': 0.03488263481402489, 'random_strength': 2.369870454528442, 'grow_policy': 'Depthwise', 'min_data_in_leaf': 3}. Best is trial 349 with value: 2072.137476888861.[0m
[32m[I 2024-10-13 09:54:22,463][0m Trial 385 finished with value: 2514.8265236938173 and parameters: {'depth': 11, 'learning_rate': 0.00034406385637574725, 'iterations': 2777, 'l2_leaf_reg': 1.3786977231670313e-08, 'border_count': 19, 'bagging_temperature': 0.0531998097332672, 'random_strength': 2.8584146660041676, 'grow_policy': 'Depthwise', 'min_data_in_leaf': 102}. Best is trial 349 with value: 2072.137476888861.[0m
[32m[I 2024-10-13 09:54:28,441][0m Trial 386 finished with value: 2887.5721847583645 and parameters: {'depth': 11, 'learning_rate': 0.0005623384168293837, 'iterations': 2998, 'l2_leaf_reg': 3.768364448232549e-08, 'border_count': 10, 'bagging_temperature': 0.017041919969697325, 'random_strength': 2.024878237886906, 'grow_policy': 'Depthwise', 'min_data_in_leaf': 77}. Best is trial 349 with value: 2072.137476888861.[0m
[32m[I 2024-10-13 09:54:38,778][0m Trial 387 finished with value: 3080.3143139605017 and parameters: {'depth': 12, 'learning_rate': 0.0001657263321912418, 'iterations': 2920, 'l2_leaf_reg': 2.088607361240942e-08, 'border_count': 16, 'bagging_temperature': 0.038219336163820505, 'random_strength': 2.2163822763190346, 'grow_policy': 'Depthwise', 'min_data_in_leaf': 21}. Best is trial 349 with value: 2072.137476888861.[0m
[32m[I 2024-10-13 09:54:45,511][0m Trial 388 finished with value: 2220.2034295267285 and parameters: {'depth': 11, 'learning_rate': 0.0004173061510346015, 'iterations': 2663, 'l2_leaf_reg': 3.1070629102488404e-08, 'border_count': 21, 'bagging_temperature': 0.019278632561242286, 'random_strength': 2.5749007081145265, 'grow_policy': 'Depthwise', 'min_data_in_leaf': 46}. Best is trial 349 with value: 2072.137476888861.[0m
[32m[I 2024-10-13 09:54:51,954][0m Trial 389 finished with value: 2862.3345640310404 and parameters: {'depth': 11, 'learning_rate': 0.0005090111181280093, 'iterations': 2847, 'l2_leaf_reg': 1.0307672517803632e-08, 'border_count': 8, 'bagging_temperature': 0.05998243396229201, 'random_strength': 2.3523446224397544, 'grow_policy': 'Depthwise', 'min_data_in_leaf': 66}. Best is trial 349 with value: 2072.137476888861.[0m
[32m[I 2024-10-13 09:54:59,966][0m Trial 390 finished with value: 2218.4887758788827 and parameters: {'depth': 11, 'learning_rate': 0.0004102272853463812, 'iterations': 2814, 'l2_leaf_reg': 1.8177732940055372e-08, 'border_count': 15, 'bagging_temperature': 0.0009628241108760663, 'random_strength': 2.100973779224088, 'grow_policy': 'Depthwise', 'min_data_in_leaf': 31}. Best is trial 349 with value: 2072.137476888861.[0m
[32m[I 2024-10-13 09:55:05,274][0m Trial 391 finished with value: 2280.48990852354 and parameters: {'depth': 11, 'learning_rate': 0.0006018919113050425, 'iterations': 2907, 'l2_leaf_reg': 4.474993552923974e-08, 'border_count': 72, 'bagging_temperature': 0.03552438459332859, 'random_strength': 2.56691680662984, 'grow_policy': 'Depthwise', 'min_data_in_leaf': 88}. Best is trial 349 with value: 2072.137476888861.[0m
[32m[I 2024-10-13 09:55:10,655][0m Trial 392 finished with value: 2365.8553027936027 and parameters: {'depth': 11, 'learning_rate': 0.0003199057684018898, 'iterations': 2747, 'l2_leaf_reg': 2.558877784682658e-08, 'border_count': 21, 'bagging_temperature': 0.020232666809188067, 'random_strength': 2.401537305074758, 'grow_policy': 'Depthwise', 'min_data_in_leaf': 59}. Best is trial 349 with value: 2072.137476888861.[0m
[32m[I 2024-10-13 09:55:21,790][0m Trial 393 finished with value: 2359.2465459914242 and parameters: {'depth': 12, 'learning_rate': 0.0004837984789967464, 'iterations': 2841, 'l2_leaf_reg': 1.3283439413896793e-08, 'border_count': 15, 'bagging_temperature': 0.0001710030220991969, 'random_strength': 1.98287102699293, 'grow_policy': 'Depthwise', 'min_data_in_leaf': 16}. Best is trial 349 with value: 2072.137476888861.[0m
[32m[I 2024-10-13 09:55:29,230][0m Trial 394 finished with value: 3455.8796862403665 and parameters: {'depth': 11, 'learning_rate': 0.0003945382393232546, 'iterations': 2713, 'l2_leaf_reg': 1.927066242778289e-08, 'border_count': 1, 'bagging_temperature': 0.057668190566117175, 'random_strength': 2.213024384618855, 'grow_policy': 'Depthwise', 'min_data_in_leaf': 40}. Best is trial 349 with value: 2072.137476888861.[0m
[32m[I 2024-10-13 09:55:34,420][0m Trial 395 finished with value: 2192.561247522953 and parameters: {'depth': 11, 'learning_rate': 0.0005884853446868071, 'iterations': 2942, 'l2_leaf_reg': 4.7450828670250247e-08, 'border_count': 22, 'bagging_temperature': 0.03684466670296541, 'random_strength': 2.6261442549094625, 'grow_policy': 'Depthwise', 'min_data_in_leaf': 113}. Best is trial 349 with value: 2072.137476888861.[0m
[32m[I 2024-10-13 09:56:14,048][0m Trial 396 finished with value: 2557.648143584803 and parameters: {'depth': 11, 'learning_rate': 0.0005241371138318946, 'iterations': 2944, 'l2_leaf_reg': 4.298718472070955e-08, 'border_count': 20, 'bagging_temperature': 0.027650072524988065, 'random_strength': 2.692256680359251, 'grow_policy': 'SymmetricTree', 'min_data_in_leaf': 54}. Best is trial 349 with value: 2072.137476888861.[0m
[32m[I 2024-10-13 09:56:40,282][0m Trial 397 finished with value: 3445.9351633232054 and parameters: {'depth': 12, 'learning_rate': 0.0004360168522053074, 'iterations': 2887, 'l2_leaf_reg': 0.00010978438909464877, 'border_count': 9, 'bagging_temperature': 0.03796585911391244, 'random_strength': 2.8002535206826042, 'grow_policy': 'Depthwise', 'min_data_in_leaf': 3}. Best is trial 349 with value: 2072.137476888861.[0m
[32m[I 2024-10-13 09:56:53,108][0m Trial 398 finished with value: 2403.0845510729537 and parameters: {'depth': 11, 'learning_rate': 0.0003654185646199046, 'iterations': 2948, 'l2_leaf_reg': 3.134979718915181e-08, 'border_count': 15, 'bagging_temperature': 0.01730890816982429, 'random_strength': 2.9049466487348115, 'grow_policy': 'Depthwise', 'min_data_in_leaf': 110}. Best is trial 349 with value: 2072.137476888861.[0m
[32m[I 2024-10-13 09:57:07,264][0m Trial 399 finished with value: 2161.103894582845 and parameters: {'depth': 11, 'learning_rate': 0.0005755816288403132, 'iterations': 2800, 'l2_leaf_reg': 5.386936937567934e-08, 'border_count': 21, 'bagging_temperature': 0.0002229757544215047, 'random_strength': 2.529912005044814, 'grow_policy': 'Depthwise', 'min_data_in_leaf': 77}. Best is trial 349 with value: 2072.137476888861.[0m
[32m[I 2024-10-13 09:57:15,929][0m Trial 400 finished with value: 2170.2392488447986 and parameters: {'depth': 11, 'learning_rate': 0.0006144879790994774, 'iterations': 2813, 'l2_leaf_reg': 4.9695424092607295e-08, 'border_count': 18, 'bagging_temperature': 0.00043559951711690664, 'random_strength': 2.5335322398021267, 'grow_policy': 'Depthwise', 'min_data_in_leaf': 37}. Best is trial 349 with value: 2072.137476888861.[0m
[32m[I 2024-10-13 09:57:24,816][0m Trial 401 finished with value: 2829.730509793625 and parameters: {'depth': 11, 'learning_rate': 0.0005198749811630875, 'iterations': 2797, 'l2_leaf_reg': 1.0099419508083295e-08, 'border_count': 11, 'bagging_temperature': 0.0005496955402950979, 'random_strength': 2.4387904324420986, 'grow_policy': 'Depthwise', 'min_data_in_leaf': 30}. Best is trial 349 with value: 2072.137476888861.[0m
[32m[I 2024-10-13 09:57:31,385][0m Trial 402 finished with value: 3917.762630031253 and parameters: {'depth': 11, 'learning_rate': 0.00010181662473105583, 'iterations': 2866, 'l2_leaf_reg': 5.8271499866874154e-08, 'border_count': 7, 'bagging_temperature': 0.016728954368964162, 'random_strength': 2.458857444221201, 'grow_policy': 'Depthwise', 'min_data_in_leaf': 41}. Best is trial 349 with value: 2072.137476888861.[0m
[32m[I 2024-10-13 09:57:37,410][0m Trial 403 finished with value: 2296.4957051353404 and parameters: {'depth': 12, 'learning_rate': 0.0005831886999356095, 'iterations': 2815, 'l2_leaf_reg': 3.0220526096534893e-08, 'border_count': 246, 'bagging_temperature': 0.0009750362858346648, 'random_strength': 2.6431940244587, 'grow_policy': 'Depthwise', 'min_data_in_leaf': 79}. Best is trial 349 with value: 2072.137476888861.[0m
[32m[I 2024-10-13 09:57:47,119][0m Trial 404 finished with value: 2130.965875390434 and parameters: {'depth': 11, 'learning_rate': 0.00048021885667595514, 'iterations': 2589, 'l2_leaf_reg': 1.4030867798645188e-08, 'border_count': 16, 'bagging_temperature': 0.01571513332634988, 'random_strength': 2.935316663707585, 'grow_policy': 'Depthwise', 'min_data_in_leaf': 21}. Best is trial 349 with value: 2072.137476888861.[0m
[32m[I 2024-10-13 09:57:59,145][0m Trial 405 finished with value: 2339.794271900833 and parameters: {'depth': 11, 'learning_rate': 0.0006244324320485716, 'iterations': 2613, 'l2_leaf_reg': 1.4614172437405347e-08, 'border_count': 15, 'bagging_temperature': 0.020061704229422286, 'random_strength': 2.9356205591460554, 'grow_policy': 'Depthwise', 'min_data_in_leaf': 16}. Best is trial 349 with value: 2072.137476888861.[0m
[32m[I 2024-10-13 09:58:06,483][0m Trial 406 finished with value: 2169.4887956278785 and parameters: {'depth': 11, 'learning_rate': 0.0005026152583691387, 'iterations': 2667, 'l2_leaf_reg': 1.561986679686452e-08, 'border_count': 16, 'bagging_temperature': 0.019741150186739262, 'random_strength': 2.887812591437627, 'grow_policy': 'Depthwise', 'min_data_in_leaf': 52}. Best is trial 349 with value: 2072.137476888861.[0m
[32m[I 2024-10-13 09:58:14,549][0m Trial 407 finished with value: 2175.5445307585705 and parameters: {'depth': 11, 'learning_rate': 0.00048699542403732516, 'iterations': 2673, 'l2_leaf_reg': 1.4337689736244862e-08, 'border_count': 16, 'bagging_temperature': 0.0016849699617312378, 'random_strength': 2.9105009459939453, 'grow_policy': 'Depthwise', 'min_data_in_leaf': 51}. Best is trial 349 with value: 2072.137476888861.[0m
