[32m[I 2024-10-13 09:41:44,921][0m Trial 306 finished with value: 2224.541339163269 and parameters: {'depth': 9, 'learning_rate': 0.0009731122613260004, 'iterations': 2357, 'l2_leaf_reg': 8.49942153800578e-08, 'border_count': 25, 'bagging_temperature': 0.06078591967920341, 'random_strength': 1.4714863143127541, 'grow_policy': 'Depthwise', 'min_data_in_leaf': 139}. Best is trial 52 with value: 2182.908535006516.[0m
[32m[I 2024-10-13 09:41:47,870][0m Trial 307 finished with value: 2321.5106096532345 and parameters: {'depth': 11, 'learning_rate': 0.000685549576674019, 'iterations': 2216, 'l2_leaf_reg': 5.181354721633465e-08, 'border_count': 110, 'bagging_temperature': 0.001949202531213834, 'random_strength': 0.3662213698067067, 'grow_policy': 'Depthwise', 'min_data_in_leaf': 173}. Best is trial 52 with value: 2182.908535006516.[0m
[32m[I 2024-10-13 09:41:51,650][0m Trial 308 finished with value: 2311.3278318069665 and parameters: {'depth': 9, 'learning_rate': 0.0009150851461837605, 'iterations': 2073, 'l2_leaf_reg': 4.3888193471576065e-08, 'border_count': 123, 'bagging_temperature': 0.10239308267649434, 'random_strength': 1.8253343055893312, 'grow_policy': 'Depthwise', 'min_data_in_leaf': 187}. Best is trial 52 with value: 2182.908535006516.[0m
[32m[I 2024-10-13 09:42:18,777][0m Trial 309 finished with value: 2550.76922560172 and parameters: {'depth': 9, 'learning_rate': 0.0007785174074413403, 'iterations': 2168, 'l2_leaf_reg': 1.6047908095745064e-07, 'border_count': 28, 'bagging_temperature': 0.07598218814934087, 'random_strength': 0.9455620244634757, 'grow_policy': 'SymmetricTree', 'min_data_in_leaf': 61}. Best is trial 52 with value: 2182.908535006516.[0m
[32m[I 2024-10-13 09:42:22,607][0m Trial 310 finished with value: 2206.5428171911103 and parameters: {'depth': 9, 'learning_rate': 0.000930988369661928, 'iterations': 2191, 'l2_leaf_reg': 9.689029125342358e-08, 'border_count': 26, 'bagging_temperature': 0.11578675707492123, 'random_strength': 0.4897308706746691, 'grow_policy': 'Depthwise', 'min_data_in_leaf': 215}. Best is trial 52 with value: 2182.908535006516.[0m
[32m[I 2024-10-13 09:42:26,594][0m Trial 311 finished with value: 2229.833074284824 and parameters: {'depth': 9, 'learning_rate': 0.0006377925367343318, 'iterations': 2312, 'l2_leaf_reg': 1.008883215929959e-08, 'border_count': 32, 'bagging_temperature': 0.05001445615079918, 'random_strength': 1.512420214317919, 'grow_policy': 'Depthwise', 'min_data_in_leaf': 95}. Best is trial 52 with value: 2182.908535006516.[0m
[32m[I 2024-10-13 09:42:30,271][0m Trial 312 finished with value: 2292.8560049662174 and parameters: {'depth': 10, 'learning_rate': 0.0009834196347663752, 'iterations': 2126, 'l2_leaf_reg': 2.0893999939433697e-07, 'border_count': 42, 'bagging_temperature': 0.09047845628734497, 'random_strength': 1.7122122829598296, 'grow_policy': 'Depthwise', 'min_data_in_leaf': 119}. Best is trial 52 with value: 2182.908535006516.[0m
[32m[I 2024-10-13 09:42:34,657][0m Trial 313 finished with value: 2200.3625364501154 and parameters: {'depth': 8, 'learning_rate': 0.0007932541886323883, 'iterations': 2250, 'l2_leaf_reg': 1.338408411990596e-07, 'border_count': 27, 'bagging_temperature': 0.12269563253842464, 'random_strength': 0.8302720475715188, 'grow_policy': 'Depthwise', 'min_data_in_leaf': 155}. Best is trial 52 with value: 2182.908535006516.[0m
[32m[I 2024-10-13 09:42:39,107][0m Trial 314 finished with value: 2306.13068749751 and parameters: {'depth': 8, 'learning_rate': 0.0005641489717476814, 'iterations': 2241, 'l2_leaf_reg': 1.4177080050041332e-07, 'border_count': 33, 'bagging_temperature': 0.11540834455937575, 'random_strength': 0.7473559750436027, 'grow_policy': 'Depthwise', 'min_data_in_leaf': 151}. Best is trial 52 with value: 2182.908535006516.[0m
[32m[I 2024-10-13 09:42:43,487][0m Trial 315 finished with value: 2204.693274472712 and parameters: {'depth': 8, 'learning_rate': 0.0007637277840705544, 'iterations': 2254, 'l2_leaf_reg': 6.966360018864374e-08, 'border_count': 25, 'bagging_temperature': 0.14223827539524464, 'random_strength': 0.8790060559211035, 'grow_policy': 'Depthwise', 'min_data_in_leaf': 211}. Best is trial 52 with value: 2182.908535006516.[0m
[32m[I 2024-10-13 09:42:48,022][0m Trial 316 finished with value: 2205.6507444343274 and parameters: {'depth': 8, 'learning_rate': 0.0008583570879078911, 'iterations': 2398, 'l2_leaf_reg': 1.2078765151716037e-07, 'border_count': 33, 'bagging_temperature': 0.0913278999997628, 'random_strength': 1.4129724097189156, 'grow_policy': 'Depthwise', 'min_data_in_leaf': 194}. Best is trial 52 with value: 2182.908535006516.[0m
[32m[I 2024-10-13 09:42:50,997][0m Trial 317 finished with value: 2336.7361236546744 and parameters: {'depth': 8, 'learning_rate': 0.000711014277001125, 'iterations': 2047, 'l2_leaf_reg': 2.6004087470516764e-08, 'border_count': 94, 'bagging_temperature': 0.06472821480100431, 'random_strength': 0.1681471211202864, 'grow_policy': 'Depthwise', 'min_data_in_leaf': 232}. Best is trial 52 with value: 2182.908535006516.[0m
[32m[I 2024-10-13 09:42:54,942][0m Trial 318 finished with value: 2284.5919834908195 and parameters: {'depth': 10, 'learning_rate': 0.0009180765365332516, 'iterations': 2146, 'l2_leaf_reg': 2.7125659673671087e-07, 'border_count': 47, 'bagging_temperature': 0.12240224287705916, 'random_strength': 1.8997804086483825, 'grow_policy': 'Depthwise', 'min_data_in_leaf': 142}. Best is trial 52 with value: 2182.908535006516.[0m
[32m[I 2024-10-13 09:42:58,783][0m Trial 319 finished with value: 2549.0255435407794 and parameters: {'depth': 7, 'learning_rate': 0.0005034220564226533, 'iterations': 1974, 'l2_leaf_reg': 3.994567309790531e-08, 'border_count': 42, 'bagging_temperature': 0.034668456763341265, 'random_strength': 1.6333280284887821, 'grow_policy': 'Depthwise', 'min_data_in_leaf': 130}. Best is trial 52 with value: 2182.908535006516.[0m
[32m[I 2024-10-13 09:43:03,103][0m Trial 320 finished with value: 2199.2576580302034 and parameters: {'depth': 10, 'learning_rate': 0.0007721037965109695, 'iterations': 2471, 'l2_leaf_reg': 3.2692229937714983e-07, 'border_count': 25, 'bagging_temperature': 0.10082637000736272, 'random_strength': 2.191115355389846, 'grow_policy': 'Depthwise', 'min_data_in_leaf': 167}. Best is trial 52 with value: 2182.908535006516.[0m
[32m[I 2024-10-13 09:43:07,799][0m Trial 321 finished with value: 2198.253536060346 and parameters: {'depth': 10, 'learning_rate': 0.0006131382866816342, 'iterations': 2679, 'l2_leaf_reg': 3.3833527673930673e-07, 'border_count': 24, 'bagging_temperature': 0.07829766900905333, 'random_strength': 2.163358228712107, 'grow_policy': 'Depthwise', 'min_data_in_leaf': 155}. Best is trial 52 with value: 2182.908535006516.[0m
[32m[I 2024-10-13 09:43:11,919][0m Trial 322 finished with value: 2198.6506582947973 and parameters: {'depth': 10, 'learning_rate': 0.000597667558136333, 'iterations': 2737, 'l2_leaf_reg': 1.1412361033262704e-07, 'border_count': 24, 'bagging_temperature': 0.07988025277375871, 'random_strength': 1.9192692028331624, 'grow_policy': 'Depthwise', 'min_data_in_leaf': 168}. Best is trial 52 with value: 2182.908535006516.[0m
[32m[I 2024-10-13 09:43:15,583][0m Trial 323 finished with value: 2438.688530529105 and parameters: {'depth': 11, 'learning_rate': 0.0004279968927031595, 'iterations': 2419, 'l2_leaf_reg': 9.240434269852652e-08, 'border_count': 23, 'bagging_temperature': 0.06512319928674769, 'random_strength': 2.3139964160259154, 'grow_policy': 'Depthwise', 'min_data_in_leaf': 171}. Best is trial 52 with value: 2182.908535006516.[0m
[32m[I 2024-10-13 09:43:20,961][0m Trial 324 finished with value: 2195.0740641244274 and parameters: {'depth': 10, 'learning_rate': 0.0005842030983426871, 'iterations': 2888, 'l2_leaf_reg': 6.066226439946526e-08, 'border_count': 24, 'bagging_temperature': 0.08763407561141116, 'random_strength': 2.213817021297537, 'grow_policy': 'Depthwise', 'min_data_in_leaf': 154}. Best is trial 52 with value: 2182.908535006516.[0m
[32m[I 2024-10-13 09:43:26,312][0m Trial 325 finished with value: 2217.420421518363 and parameters: {'depth': 10, 'learning_rate': 0.0005269680852314876, 'iterations': 2876, 'l2_leaf_reg': 6.336382728315939e-08, 'border_count': 23, 'bagging_temperature': 0.08570276919701506, 'random_strength': 2.1788958375536183, 'grow_policy': 'Depthwise', 'min_data_in_leaf': 161}. Best is trial 52 with value: 2182.908535006516.[0m
[32m[I 2024-10-13 09:43:31,230][0m Trial 326 finished with value: 2176.5472610082375 and parameters: {'depth': 10, 'learning_rate': 0.0006275414841718306, 'iterations': 2751, 'l2_leaf_reg': 2.2536528427169482e-08, 'border_count': 25, 'bagging_temperature': 0.046611588560134025, 'random_strength': 2.238514063039458, 'grow_policy': 'Depthwise', 'min_data_in_leaf': 82}. Best is trial 326 with value: 2176.5472610082375.[0m
[32m[I 2024-10-13 09:43:35,630][0m Trial 327 finished with value: 2193.1099539987536 and parameters: {'depth': 10, 'learning_rate': 0.0006190363863709406, 'iterations': 2734, 'l2_leaf_reg': 2.0884773288799237e-08, 'border_count': 24, 'bagging_temperature': 0.05591275440343176, 'random_strength': 2.126380656741978, 'grow_policy': 'Depthwise', 'min_data_in_leaf': 91}. Best is trial 326 with value: 2176.5472610082375.[0m
[32m[I 2024-10-13 09:43:40,973][0m Trial 328 finished with value: 2158.791075126696 and parameters: {'depth': 11, 'learning_rate': 0.0005900044285989432, 'iterations': 2728, 'l2_leaf_reg': 1.4717419092412601e-08, 'border_count': 23, 'bagging_temperature': 0.02470480579226606, 'random_strength': 2.2072126712926763, 'grow_policy': 'Depthwise', 'min_data_in_leaf': 75}. Best is trial 328 with value: 2158.791075126696.[0m
[32m[I 2024-10-13 09:43:47,795][0m Trial 329 finished with value: 2192.8068147658682 and parameters: {'depth': 11, 'learning_rate': 0.00043507811029684987, 'iterations': 2738, 'l2_leaf_reg': 2.188763948963786e-08, 'border_count': 22, 'bagging_temperature': 0.03827538032604694, 'random_strength': 2.214158884634395, 'grow_policy': 'Depthwise', 'min_data_in_leaf': 65}. Best is trial 328 with value: 2158.791075126696.[0m
[32m[I 2024-10-13 09:43:53,717][0m Trial 330 finished with value: 2376.1614713764448 and parameters: {'depth': 11, 'learning_rate': 0.00033000719889741584, 'iterations': 2731, 'l2_leaf_reg': 1.4992817241805687e-08, 'border_count': 23, 'bagging_temperature': 0.00861449129562765, 'random_strength': 2.1223191420028806, 'grow_policy': 'Depthwise', 'min_data_in_leaf': 73}. Best is trial 328 with value: 2158.791075126696.[0m
[32m[I 2024-10-13 09:44:01,450][0m Trial 331 finished with value: 2177.190450649153 and parameters: {'depth': 11, 'learning_rate': 0.00046820203813518167, 'iterations': 2768, 'l2_leaf_reg': 3.300144914807433e-08, 'border_count': 24, 'bagging_temperature': 0.02651097762951271, 'random_strength': 2.238708541576432, 'grow_policy': 'Depthwise', 'min_data_in_leaf': 42}. Best is trial 328 with value: 2158.791075126696.[0m
[32m[I 2024-10-13 09:44:43,464][0m Trial 332 finished with value: 2505.907671638516 and parameters: {'depth': 11, 'learning_rate': 0.00040480029766639877, 'iterations': 2751, 'l2_leaf_reg': 1.0639967216803459e-08, 'border_count': 22, 'bagging_temperature': 0.03204163824839307, 'random_strength': 2.238964452819102, 'grow_policy': 'SymmetricTree', 'min_data_in_leaf': 30}. Best is trial 328 with value: 2158.791075126696.[0m
[32m[I 2024-10-13 09:44:49,169][0m Trial 333 finished with value: 2161.4529809383207 and parameters: {'depth': 11, 'learning_rate': 0.0004960706219720876, 'iterations': 2713, 'l2_leaf_reg': 2.2127768680625996e-08, 'border_count': 23, 'bagging_temperature': 0.049030925593959045, 'random_strength': 2.2655959133462003, 'grow_policy': 'Depthwise', 'min_data_in_leaf': 74}. Best is trial 328 with value: 2158.791075126696.[0m
[32m[I 2024-10-13 09:44:55,318][0m Trial 334 finished with value: 2181.486756268829 and parameters: {'depth': 11, 'learning_rate': 0.0004527983411991086, 'iterations': 2763, 'l2_leaf_reg': 2.0008027091454364e-08, 'border_count': 23, 'bagging_temperature': 0.04500704523664993, 'random_strength': 2.229800489857312, 'grow_policy': 'Depthwise', 'min_data_in_leaf': 73}. Best is trial 328 with value: 2158.791075126696.[0m
[32m[I 2024-10-13 09:45:01,894][0m Trial 335 finished with value: 2268.52997312833 and parameters: {'depth': 11, 'learning_rate': 0.00036839660510012414, 'iterations': 2754, 'l2_leaf_reg': 2.7017050175436643e-08, 'border_count': 22, 'bagging_temperature': 0.04521909490228332, 'random_strength': 2.2827439881248526, 'grow_policy': 'Depthwise', 'min_data_in_leaf': 66}. Best is trial 328 with value: 2158.791075126696.[0m
[32m[I 2024-10-13 09:45:07,272][0m Trial 336 finished with value: 2264.9916571839667 and parameters: {'depth': 11, 'learning_rate': 0.00046157568845683634, 'iterations': 2825, 'l2_leaf_reg': 1.9958531138716646e-08, 'border_count': 23, 'bagging_temperature': 0.016735748504900696, 'random_strength': 2.303816462355115, 'grow_policy': 'Depthwise', 'min_data_in_leaf': 86}. Best is trial 328 with value: 2158.791075126696.[0m
[32m[I 2024-10-13 09:45:14,950][0m Trial 337 finished with value: 2164.696740959547 and parameters: {'depth': 11, 'learning_rate': 0.0005321457926887161, 'iterations': 2690, 'l2_leaf_reg': 2.175954807696875e-08, 'border_count': 24, 'bagging_temperature': 0.040533718937506374, 'random_strength': 2.1807259015635903, 'grow_policy': 'Depthwise', 'min_data_in_leaf': 49}. Best is trial 328 with value: 2158.791075126696.[0m
[32m[I 2024-10-13 09:45:32,780][0m Trial 338 finished with value: 3216.897987965016 and parameters: {'depth': 11, 'learning_rate': 0.000266309637670148, 'iterations': 2688, 'l2_leaf_reg': 1.7981424049850917e-08, 'border_count': 21, 'bagging_temperature': 0.04130006074707331, 'random_strength': 2.20302322701909, 'grow_policy': 'Depthwise', 'min_data_in_leaf': 4}. Best is trial 328 with value: 2158.791075126696.[0m
[32m[I 2024-10-13 09:45:41,444][0m Trial 339 finished with value: 2167.3795296904764 and parameters: {'depth': 11, 'learning_rate': 0.00045522943943762754, 'iterations': 2803, 'l2_leaf_reg': 2.3516916167705527e-08, 'border_count': 21, 'bagging_temperature': 0.02611756547902245, 'random_strength': 2.125518501881138, 'grow_policy': 'Depthwise', 'min_data_in_leaf': 33}. Best is trial 328 with value: 2158.791075126696.[0m
[32m[I 2024-10-13 09:45:50,139][0m Trial 340 finished with value: 2173.3650237734523 and parameters: {'depth': 11, 'learning_rate': 0.00048073208208252843, 'iterations': 2832, 'l2_leaf_reg': 2.3614579253614735e-08, 'border_count': 24, 'bagging_temperature': 0.003152181378593716, 'random_strength': 2.1255906806327025, 'grow_policy': 'Depthwise', 'min_data_in_leaf': 39}. Best is trial 328 with value: 2158.791075126696.[0m
[32m[I 2024-10-13 09:45:56,344][0m Trial 341 finished with value: 2175.8558642632806 and parameters: {'depth': 11, 'learning_rate': 0.0004589948300421849, 'iterations': 2837, 'l2_leaf_reg': 2.2400222691454773e-08, 'border_count': 22, 'bagging_temperature': 0.018155379137586018, 'random_strength': 2.12107963494364, 'grow_policy': 'Depthwise', 'min_data_in_leaf': 47}. Best is trial 328 with value: 2158.791075126696.[0m
[32m[I 2024-10-13 09:46:05,019][0m Trial 342 finished with value: 2299.8976530893806 and parameters: {'depth': 11, 'learning_rate': 0.00046232520120536804, 'iterations': 2820, 'l2_leaf_reg': 2.197983812100006e-08, 'border_count': 83, 'bagging_temperature': 0.007343630632069151, 'random_strength': 2.094299835121008, 'grow_policy': 'Depthwise', 'min_data_in_leaf': 43}. Best is trial 328 with value: 2158.791075126696.[0m
[32m[I 2024-10-13 09:46:12,397][0m Trial 343 finished with value: 2263.4360841055945 and parameters: {'depth': 12, 'learning_rate': 0.00038674259458369216, 'iterations': 2670, 'l2_leaf_reg': 2.7948986502082796e-08, 'border_count': 23, 'bagging_temperature': 0.02471089651856699, 'random_strength': 2.0083640297945036, 'grow_policy': 'Depthwise', 'min_data_in_leaf': 57}. Best is trial 328 with value: 2158.791075126696.[0m
[32m[I 2024-10-13 09:46:20,154][0m Trial 344 finished with value: 2424.7776808035296 and parameters: {'depth': 11, 'learning_rate': 0.00027930821915255627, 'iterations': 2996, 'l2_leaf_reg': 1.3466533173214624e-08, 'border_count': 20, 'bagging_temperature': 0.030455471818469738, 'random_strength': 2.3754260240154808, 'grow_policy': 'Depthwise', 'min_data_in_leaf': 47}. Best is trial 328 with value: 2158.791075126696.[0m
[32m[I 2024-10-13 09:46:31,751][0m Trial 345 finished with value: 2085.17272468082 and parameters: {'depth': 11, 'learning_rate': 0.000507861187223271, 'iterations': 2825, 'l2_leaf_reg': 2.310420131790012e-08, 'border_count': 20, 'bagging_temperature': 0.050880797720942256, 'random_strength': 2.143290681329005, 'grow_policy': 'Depthwise', 'min_data_in_leaf': 21}. Best is trial 345 with value: 2085.17272468082.[0m
[32m[I 2024-10-13 09:46:37,896][0m Trial 346 finished with value: 2157.80657148577 and parameters: {'depth': 11, 'learning_rate': 0.0004924408459078567, 'iterations': 2842, 'l2_leaf_reg': 2.336563361457683e-08, 'border_count': 21, 'bagging_temperature': 0.005955127844337412, 'random_strength': 2.1306470567591074, 'grow_policy': 'Depthwise', 'min_data_in_leaf': 81}. Best is trial 345 with value: 2085.17272468082.[0m
[32m[I 2024-10-13 09:46:47,295][0m Trial 347 finished with value: 2089.9373869447886 and parameters: {'depth': 11, 'learning_rate': 0.0004967091654415697, 'iterations': 2816, 'l2_leaf_reg': 2.2460401150169048e-08, 'border_count': 20, 'bagging_temperature': 0.0007181642408839416, 'random_strength': 2.136433065303896, 'grow_policy': 'Depthwise', 'min_data_in_leaf': 21}. Best is trial 345 with value: 2085.17272468082.[0m
[32m[I 2024-10-13 09:47:10,217][0m Trial 348 finished with value: 2374.3914577475757 and parameters: {'depth': 12, 'learning_rate': 0.00048509485742094917, 'iterations': 2829, 'l2_leaf_reg': 2.3074181236223874e-08, 'border_count': 20, 'bagging_temperature': 0.0029122513580069633, 'random_strength': 2.224007272351643, 'grow_policy': 'Depthwise', 'min_data_in_leaf': 19}. Best is trial 345 with value: 2085.17272468082.[0m
[32m[I 2024-10-13 09:47:28,655][0m Trial 349 finished with value: 2072.137476888861 and parameters: {'depth': 11, 'learning_rate': 0.000546253568843453, 'iterations': 2896, 'l2_leaf_reg': 1.3188097077916031e-08, 'border_count': 19, 'bagging_temperature': 0.0008631611051571411, 'random_strength': 2.3766112268320296, 'grow_policy': 'Depthwise', 'min_data_in_leaf': 24}. Best is trial 349 with value: 2072.137476888861.[0m
[32m[I 2024-10-13 09:47:38,338][0m Trial 350 finished with value: 2156.56707119016 and parameters: {'depth': 11, 'learning_rate': 0.00048583953096123213, 'iterations': 2898, 'l2_leaf_reg': 1.3316314752838527e-08, 'border_count': 21, 'bagging_temperature': 0.01881809878283434, 'random_strength': 2.396767761155574, 'grow_policy': 'Depthwise', 'min_data_in_leaf': 81}. Best is trial 349 with value: 2072.137476888861.[0m
[32m[I 2024-10-13 09:47:44,267][0m Trial 351 finished with value: 2168.4404472818383 and parameters: {'depth': 11, 'learning_rate': 0.00044912888674398263, 'iterations': 2908, 'l2_leaf_reg': 1.2546029483452678e-08, 'border_count': 19, 'bagging_temperature': 0.019353850259094477, 'random_strength': 2.3931149581911515, 'grow_policy': 'Depthwise', 'min_data_in_leaf': 83}. Best is trial 349 with value: 2072.137476888861.[0m
[32m[I 2024-10-13 09:47:49,752][0m Trial 352 finished with value: 2819.1514027636686 and parameters: {'depth': 11, 'learning_rate': 0.00043185301237873985, 'iterations': 2903, 'l2_leaf_reg': 1.4784165849140688e-08, 'border_count': 11, 'bagging_temperature': 0.001793738135161085, 'random_strength': 2.421804225572348, 'grow_policy': 'Depthwise', 'min_data_in_leaf': 80}. Best is trial 349 with value: 2072.137476888861.[0m
[32m[I 2024-10-13 09:48:53,442][0m Trial 353 finished with value: 2871.613432335249 and parameters: {'depth': 11, 'learning_rate': 0.0003337957219933953, 'iterations': 2801, 'l2_leaf_reg': 1.0691175332272876e-08, 'border_count': 19, 'bagging_temperature': 0.02300473972492151, 'random_strength': 2.397876502333522, 'grow_policy': 'SymmetricTree', 'min_data_in_leaf': 18}. Best is trial 349 with value: 2072.137476888861.[0m
[32m[I 2024-10-13 09:49:02,262][0m Trial 354 finished with value: 2794.527520976496 and parameters: {'depth': 11, 'learning_rate': 0.0004998479839005251, 'iterations': 2887, 'l2_leaf_reg': 1.9530008140951443e-08, 'border_count': 12, 'bagging_temperature': 0.0024213258736704886, 'random_strength': 2.198132340657891, 'grow_policy': 'Depthwise', 'min_data_in_leaf': 49}. Best is trial 349 with value: 2072.137476888861.[0m
[32m[I 2024-10-13 09:49:09,511][0m Trial 355 finished with value: 2191.4625708061367 and parameters: {'depth': 11, 'learning_rate': 0.00040032329090414383, 'iterations': 2976, 'l2_leaf_reg': 3.248011679606525e-08, 'border_count': 20, 'bagging_temperature': 0.03527440875302124, 'random_strength': 2.4900482417085463, 'grow_policy': 'Depthwise', 'min_data_in_leaf': 32}. Best is trial 349 with value: 2072.137476888861.[0m
[32m[I 2024-10-13 09:49:19,252][0m Trial 356 finished with value: 2201.167888109313 and parameters: {'depth': 11, 'learning_rate': 0.0003778990949141853, 'iterations': 2958, 'l2_leaf_reg': 3.2799543907556614e-08, 'border_count': 19, 'bagging_temperature': 0.026184841431891332, 'random_strength': 2.4668937113660334, 'grow_policy': 'Depthwise', 'min_data_in_leaf': 28}. Best is trial 349 with value: 2072.137476888861.[0m
