[32m[I 2024-10-13 09:58:20,613][0m Trial 408 finished with value: 2315.366387014901 and parameters: {'depth': 11, 'learning_rate': 0.00047632974448249806, 'iterations': 2566, 'l2_leaf_reg': 1.411789604289132e-08, 'border_count': 149, 'bagging_temperature': 0.013588734882185224, 'random_strength': 2.898963180531488, 'grow_policy': 'Depthwise', 'min_data_in_leaf': 50}. Best is trial 349 with value: 2072.137476888861.[0m
[32m[I 2024-10-13 09:58:27,315][0m Trial 409 finished with value: 2160.88771606152 and parameters: {'depth': 11, 'learning_rate': 0.0005115502912280675, 'iterations': 2647, 'l2_leaf_reg': 1.40142853729126e-08, 'border_count': 18, 'bagging_temperature': 0.01900081045814366, 'random_strength': 2.306879821396309, 'grow_policy': 'Depthwise', 'min_data_in_leaf': 71}. Best is trial 349 with value: 2072.137476888861.[0m
[32m[I 2024-10-13 09:58:38,824][0m Trial 410 finished with value: 2370.567494072301 and parameters: {'depth': 11, 'learning_rate': 0.000538388932543153, 'iterations': 2638, 'l2_leaf_reg': 1.3671728842158561e-08, 'border_count': 15, 'bagging_temperature': 0.0026049732075789193, 'random_strength': 2.693008822930466, 'grow_policy': 'Depthwise', 'min_data_in_leaf': 20}. Best is trial 349 with value: 2072.137476888861.[0m
[32m[I 2024-10-13 09:58:45,989][0m Trial 411 finished with value: 2164.950976084611 and parameters: {'depth': 11, 'learning_rate': 0.0005383492858171378, 'iterations': 2670, 'l2_leaf_reg': 1.0039057052356402e-08, 'border_count': 18, 'bagging_temperature': 0.019911032056355093, 'random_strength': 1.9555195307586501, 'grow_policy': 'Depthwise', 'min_data_in_leaf': 53}. Best is trial 349 with value: 2072.137476888861.[0m
[32m[I 2024-10-13 09:58:49,728][0m Trial 412 finished with value: 2767.4134784214616 and parameters: {'depth': 11, 'learning_rate': 0.0006275691443840935, 'iterations': 2650, 'l2_leaf_reg': 1.051095689010074e-08, 'border_count': 6, 'bagging_temperature': 0.017126059098835, 'random_strength': 2.918313097192004, 'grow_policy': 'Depthwise', 'min_data_in_leaf': 86}. Best is trial 349 with value: 2072.137476888861.[0m
[32m[I 2024-10-13 09:59:02,564][0m Trial 413 finished with value: 2787.854181166111 and parameters: {'depth': 11, 'learning_rate': 0.0005236447202659405, 'iterations': 2659, 'l2_leaf_reg': 1.536502140895671e-08, 'border_count': 12, 'bagging_temperature': 0.0012366775316796457, 'random_strength': 1.9677245522040603, 'grow_policy': 'Depthwise', 'min_data_in_leaf': 62}. Best is trial 349 with value: 2072.137476888861.[0m
[32m[I 2024-10-13 09:59:40,722][0m Trial 414 finished with value: 3112.766667746045 and parameters: {'depth': 11, 'learning_rate': 0.0006207144733948885, 'iterations': 2564, 'l2_leaf_reg': 2.0132760747235428e-08, 'border_count': 11, 'bagging_temperature': 0.00047279447052642914, 'random_strength': 1.9852968079574849, 'grow_policy': 'Depthwise', 'min_data_in_leaf': 1}. Best is trial 349 with value: 2072.137476888861.[0m
[32m[I 2024-10-13 09:59:48,107][0m Trial 415 finished with value: 2435.988843264351 and parameters: {'depth': 11, 'learning_rate': 0.0003071736555791617, 'iterations': 2692, 'l2_leaf_reg': 1.0516537213313322e-08, 'border_count': 18, 'bagging_temperature': 0.02746319758577523, 'random_strength': 2.4376643536141316, 'grow_policy': 'Depthwise', 'min_data_in_leaf': 51}. Best is trial 349 with value: 2072.137476888861.[0m
[32m[I 2024-10-13 09:59:51,926][0m Trial 416 finished with value: 2248.342017724718 and parameters: {'depth': 11, 'learning_rate': 0.0005349211834083534, 'iterations': 2595, 'l2_leaf_reg': 1.6346356129044127e-08, 'border_count': 18, 'bagging_temperature': 0.057139944901431525, 'random_strength': 2.6333685844173993, 'grow_policy': 'Depthwise', 'min_data_in_leaf': 99}. Best is trial 349 with value: 2072.137476888861.[0m
[32m[I 2024-10-13 09:59:56,705][0m Trial 417 finished with value: 2347.1026839937203 and parameters: {'depth': 11, 'learning_rate': 0.0003710964663112598, 'iterations': 2519, 'l2_leaf_reg': 2.2986111392498108e-08, 'border_count': 17, 'bagging_temperature': 0.021722747449699986, 'random_strength': 2.3388397509312506, 'grow_policy': 'Depthwise', 'min_data_in_leaf': 79}. Best is trial 349 with value: 2072.137476888861.[0m
[32m[I 2024-10-13 10:00:02,499][0m Trial 418 finished with value: 2893.523290451267 and parameters: {'depth': 12, 'learning_rate': 0.0004577301206251988, 'iterations': 2681, 'l2_leaf_reg': 1.43319646758683e-08, 'border_count': 8, 'bagging_temperature': 0.04175205661515033, 'random_strength': 1.9242199069500634, 'grow_policy': 'Depthwise', 'min_data_in_leaf': 30}. Best is trial 349 with value: 2072.137476888861.[0m
[32m[I 2024-10-13 10:00:09,467][0m Trial 419 finished with value: 2201.5620306336573 and parameters: {'depth': 11, 'learning_rate': 0.0006454799771172281, 'iterations': 2820, 'l2_leaf_reg': 2.4407225101247493e-08, 'border_count': 13, 'bagging_temperature': 0.018992099681389478, 'random_strength': 2.091446513808056, 'grow_policy': 'Depthwise', 'min_data_in_leaf': 64}. Best is trial 349 with value: 2072.137476888861.[0m
[32m[I 2024-10-13 10:00:18,227][0m Trial 420 finished with value: 2165.327519979739 and parameters: {'depth': 11, 'learning_rate': 0.0005385246633505428, 'iterations': 2883, 'l2_leaf_reg': 1.0050286257916755e-08, 'border_count': 20, 'bagging_temperature': 0.0001307742562423965, 'random_strength': 2.8375369646693143, 'grow_policy': 'Depthwise', 'min_data_in_leaf': 38}. Best is trial 349 with value: 2072.137476888861.[0m
[32m[I 2024-10-13 10:00:30,682][0m Trial 421 finished with value: 2715.1905878827833 and parameters: {'depth': 11, 'learning_rate': 0.0004945878013674908, 'iterations': 2861, 'l2_leaf_reg': 1.0350137463048796e-08, 'border_count': 4, 'bagging_temperature': 0.0014926917143240417, 'random_strength': 2.861213379413584, 'grow_policy': 'Depthwise', 'min_data_in_leaf': 19}. Best is trial 349 with value: 2072.137476888861.[0m
[32m[I 2024-10-13 10:00:38,136][0m Trial 422 finished with value: 2231.9991132018235 and parameters: {'depth': 11, 'learning_rate': 0.00037328139273249067, 'iterations': 2906, 'l2_leaf_reg': 1.4557860590880382e-08, 'border_count': 19, 'bagging_temperature': 0.0003189869439512716, 'random_strength': 3.0705900389702974, 'grow_policy': 'Depthwise', 'min_data_in_leaf': 47}. Best is trial 349 with value: 2072.137476888861.[0m
[32m[I 2024-10-13 10:00:46,438][0m Trial 423 finished with value: 2817.325829257967 and parameters: {'depth': 12, 'learning_rate': 0.00043622896895831055, 'iterations': 2797, 'l2_leaf_reg': 1.0179428167467131e-08, 'border_count': 12, 'bagging_temperature': 0.027246079457943165, 'random_strength': 2.730134104243967, 'grow_policy': 'Depthwise', 'min_data_in_leaf': 37}. Best is trial 349 with value: 2072.137476888861.[0m
[32m[I 2024-10-13 10:00:58,232][0m Trial 424 finished with value: 2354.02095585131 and parameters: {'depth': 11, 'learning_rate': 0.0005433505751176033, 'iterations': 2885, 'l2_leaf_reg': 4.013143624655832e-08, 'border_count': 18, 'bagging_temperature': 0.018728694370384318, 'random_strength': 2.5301026788936887, 'grow_policy': 'Depthwise', 'min_data_in_leaf': 17}. Best is trial 349 with value: 2072.137476888861.[0m
[32m[I 2024-10-13 10:01:43,665][0m Trial 425 finished with value: 2607.26381314853 and parameters: {'depth': 11, 'learning_rate': 0.0003300906197751067, 'iterations': 2708, 'l2_leaf_reg': 1.7622203796874047e-08, 'border_count': 24, 'bagging_temperature': 0.06255319215632293, 'random_strength': 2.8401270979821094, 'grow_policy': 'SymmetricTree', 'min_data_in_leaf': 1}. Best is trial 349 with value: 2072.137476888861.[0m
[32m[I 2024-10-13 10:01:50,261][0m Trial 426 finished with value: 2877.2455898216845 and parameters: {'depth': 11, 'learning_rate': 0.00043272276590570504, 'iterations': 2835, 'l2_leaf_reg': 5.190070895562215e-08, 'border_count': 9, 'bagging_temperature': 0.03870229926389611, 'random_strength': 3.0537455712335397, 'grow_policy': 'Depthwise', 'min_data_in_leaf': 55}. Best is trial 349 with value: 2072.137476888861.[0m
[32m[I 2024-10-13 10:01:57,587][0m Trial 427 finished with value: 2173.7504661080397 and parameters: {'depth': 11, 'learning_rate': 0.0005528873444572849, 'iterations': 2997, 'l2_leaf_reg': 2.5146394174575567e-08, 'border_count': 16, 'bagging_temperature': 0.02033651236905759, 'random_strength': 2.475071692985339, 'grow_policy': 'Depthwise', 'min_data_in_leaf': 71}. Best is trial 349 with value: 2072.137476888861.[0m
[32m[I 2024-10-13 10:02:04,397][0m Trial 428 finished with value: 2178.213377807375 and parameters: {'depth': 11, 'learning_rate': 0.0005712866307727386, 'iterations': 2921, 'l2_leaf_reg': 2.8729706910246532e-08, 'border_count': 15, 'bagging_temperature': 0.0007253848565432771, 'random_strength': 2.6364934349083047, 'grow_policy': 'Depthwise', 'min_data_in_leaf': 69}. Best is trial 349 with value: 2072.137476888861.[0m
[32m[I 2024-10-13 10:02:09,944][0m Trial 429 finished with value: 2933.4872264009387 and parameters: {'depth': 12, 'learning_rate': 0.0006574156940887474, 'iterations': 2984, 'l2_leaf_reg': 1.5204739426456977e-08, 'border_count': 4, 'bagging_temperature': 0.034650031618627716, 'random_strength': 2.436745668102792, 'grow_policy': 'Depthwise', 'min_data_in_leaf': 105}. Best is trial 349 with value: 2072.137476888861.[0m
[32m[I 2024-10-13 10:02:19,023][0m Trial 430 finished with value: 3132.2008089787546 and parameters: {'depth': 11, 'learning_rate': 0.0005400244606822208, 'iterations': 2678, 'l2_leaf_reg': 1.0152667428385055e-08, 'border_count': 11, 'bagging_temperature': 0.06086711772323947, 'random_strength': 2.7883123585260217, 'grow_policy': 'Depthwise', 'min_data_in_leaf': 26}. Best is trial 349 with value: 2072.137476888861.[0m
[32m[I 2024-10-13 10:02:25,770][0m Trial 431 finished with value: 2213.1445924919735 and parameters: {'depth': 11, 'learning_rate': 0.00038527804860998287, 'iterations': 2901, 'l2_leaf_reg': 3.050354163628193e-08, 'border_count': 17, 'bagging_temperature': 0.020453892612536842, 'random_strength': 2.377727857763511, 'grow_policy': 'Depthwise', 'min_data_in_leaf': 71}. Best is trial 349 with value: 2072.137476888861.[0m
[32m[I 2024-10-13 10:02:31,136][0m Trial 432 finished with value: 2223.914466747063 and parameters: {'depth': 11, 'learning_rate': 0.000495889768671465, 'iterations': 2994, 'l2_leaf_reg': 4.7620690715653446e-08, 'border_count': 21, 'bagging_temperature': 0.0002455872308063968, 'random_strength': 2.577115532298021, 'grow_policy': 'Depthwise', 'min_data_in_leaf': 94}. Best is trial 349 with value: 2072.137476888861.[0m
[32m[I 2024-10-13 10:02:40,449][0m Trial 433 finished with value: 2164.221337720775 and parameters: {'depth': 12, 'learning_rate': 0.0006609755154088195, 'iterations': 2772, 'l2_leaf_reg': 1.6177957607904466e-08, 'border_count': 15, 'bagging_temperature': 0.04307015053609546, 'random_strength': 2.9704720577348196, 'grow_policy': 'Depthwise', 'min_data_in_leaf': 33}. Best is trial 349 with value: 2072.137476888861.[0m
[32m[I 2024-10-13 10:02:50,311][0m Trial 434 finished with value: 2937.792558665226 and parameters: {'depth': 12, 'learning_rate': 0.0006568297159152641, 'iterations': 2779, 'l2_leaf_reg': 2.1707136858917462e-08, 'border_count': 8, 'bagging_temperature': 0.0508927687144059, 'random_strength': 3.151752608060005, 'grow_policy': 'Depthwise', 'min_data_in_leaf': 33}. Best is trial 349 with value: 2072.137476888861.[0m
[32m[I 2024-10-13 10:03:03,384][0m Trial 435 finished with value: 2326.1911692695235 and parameters: {'depth': 12, 'learning_rate': 0.0005553777802410629, 'iterations': 2876, 'l2_leaf_reg': 3.253610689922444e-08, 'border_count': 26, 'bagging_temperature': 0.03822994850388724, 'random_strength': 2.5285295975464916, 'grow_policy': 'Depthwise', 'min_data_in_leaf': 20}. Best is trial 349 with value: 2072.137476888861.[0m
[32m[I 2024-10-13 10:03:11,437][0m Trial 436 finished with value: 2831.931134381117 and parameters: {'depth': 12, 'learning_rate': 0.0006613006804717007, 'iterations': 2765, 'l2_leaf_reg': 1.614245750478606e-08, 'border_count': 12, 'bagging_temperature': 0.05225008714147756, 'random_strength': 2.251304338596222, 'grow_policy': 'Depthwise', 'min_data_in_leaf': 42}. Best is trial 349 with value: 2072.137476888861.[0m
[32m[I 2024-10-13 10:03:17,978][0m Trial 437 finished with value: 2184.4082791259584 and parameters: {'depth': 11, 'learning_rate': 0.0004152046329836119, 'iterations': 2926, 'l2_leaf_reg': 1.0079667164375938e-08, 'border_count': 20, 'bagging_temperature': 0.03193251162032959, 'random_strength': 2.338914310031007, 'grow_policy': 'Depthwise', 'min_data_in_leaf': 72}. Best is trial 349 with value: 2072.137476888861.[0m
[32m[I 2024-10-13 10:03:24,234][0m Trial 438 finished with value: 2815.6646562084798 and parameters: {'depth': 11, 'learning_rate': 0.0005664167897666977, 'iterations': 2830, 'l2_leaf_reg': 5.007456717380932e-08, 'border_count': 2, 'bagging_temperature': 0.06430546195713104, 'random_strength': 1.9202499309252972, 'grow_policy': 'Depthwise', 'min_data_in_leaf': 58}. Best is trial 349 with value: 2072.137476888861.[0m
[32m[I 2024-10-13 10:03:35,394][0m Trial 439 finished with value: 2881.6098815845553 and parameters: {'depth': 12, 'learning_rate': 0.00029990897854299624, 'iterations': 2730, 'l2_leaf_reg': 2.2630444741614606e-08, 'border_count': 25, 'bagging_temperature': 0.02163248817730537, 'random_strength': 2.704571003117207, 'grow_policy': 'Depthwise', 'min_data_in_leaf': 16}. Best is trial 349 with value: 2072.137476888861.[0m
[32m[I 2024-10-13 10:03:40,531][0m Trial 440 finished with value: 2541.969662612434 and parameters: {'depth': 11, 'learning_rate': 0.00036758828471246684, 'iterations': 2781, 'l2_leaf_reg': 1.631907392787473e-08, 'border_count': 205, 'bagging_temperature': 0.03563006874181037, 'random_strength': 2.0738706565549596, 'grow_policy': 'Depthwise', 'min_data_in_leaf': 90}. Best is trial 349 with value: 2072.137476888861.[0m
[32m[I 2024-10-13 10:03:49,116][0m Trial 441 finished with value: 2318.1142678054875 and parameters: {'depth': 11, 'learning_rate': 0.0004762731794306485, 'iterations': 2616, 'l2_leaf_reg': 2.95084599164275e-08, 'border_count': 104, 'bagging_temperature': 0.018293060394907388, 'random_strength': 9.198343673853149, 'grow_policy': 'Depthwise', 'min_data_in_leaf': 34}. Best is trial 349 with value: 2072.137476888861.[0m
[32m[I 2024-10-13 10:03:53,724][0m Trial 442 finished with value: 2184.7423052174663 and parameters: {'depth': 11, 'learning_rate': 0.0006121971721907044, 'iterations': 2863, 'l2_leaf_reg': 5.5167126204709123e-08, 'border_count': 15, 'bagging_temperature': 0.05946646836820625, 'random_strength': 2.3834061102946125, 'grow_policy': 'Depthwise', 'min_data_in_leaf': 65}. Best is trial 349 with value: 2072.137476888861.[0m
[32m[I 2024-10-13 10:03:57,597][0m Trial 443 finished with value: 2287.8623015152893 and parameters: {'depth': 11, 'learning_rate': 0.0004360865249620203, 'iterations': 2936, 'l2_leaf_reg': 1.72095106803961e-08, 'border_count': 19, 'bagging_temperature': 0.01984324153072114, 'random_strength': 2.5600402004353255, 'grow_policy': 'Depthwise', 'min_data_in_leaf': 114}. Best is trial 349 with value: 2072.137476888861.[0m
[32m[I 2024-10-13 10:04:04,559][0m Trial 444 finished with value: 2870.5172102789575 and parameters: {'depth': 11, 'learning_rate': 0.0005363203943405667, 'iterations': 2711, 'l2_leaf_reg': 1.0013820431706348e-08, 'border_count': 9, 'bagging_temperature': 0.04236244818841043, 'random_strength': 2.211350449616875, 'grow_policy': 'Depthwise', 'min_data_in_leaf': 39}. Best is trial 349 with value: 2072.137476888861.[0m
[32m[I 2024-10-13 10:04:19,654][0m Trial 445 finished with value: 2362.745930487669 and parameters: {'depth': 11, 'learning_rate': 0.0006808626947941789, 'iterations': 2811, 'l2_leaf_reg': 2.7645172830310736e-08, 'border_count': 26, 'bagging_temperature': 0.018666968399514296, 'random_strength': 2.75794803856243, 'grow_policy': 'Depthwise', 'min_data_in_leaf': 11}. Best is trial 349 with value: 2072.137476888861.[0m
[32m[I 2024-10-13 10:05:19,600][0m Trial 446 finished with value: 2749.3967115823957 and parameters: {'depth': 11, 'learning_rate': 0.0003477070787320566, 'iterations': 2997, 'l2_leaf_reg': 3.745385057180651e-08, 'border_count': 15, 'bagging_temperature': 0.0679665947524225, 'random_strength': 3.0186517547659224, 'grow_policy': 'SymmetricTree', 'min_data_in_leaf': 82}. Best is trial 349 with value: 2072.137476888861.[0m
[32m[I 2024-10-13 10:05:42,835][0m Trial 447 finished with value: 2597.7405770847563 and parameters: {'depth': 12, 'learning_rate': 0.0004820197087324955, 'iterations': 2890, 'l2_leaf_reg': 2.000020588629072e-08, 'border_count': 21, 'bagging_temperature': 0.03687620812659226, 'random_strength': 1.903070616614667, 'grow_policy': 'Depthwise', 'min_data_in_leaf': 3}. Best is trial 349 with value: 2072.137476888861.[0m
[32m[I 2024-10-13 10:05:47,032][0m Trial 448 finished with value: 2779.4233488581885 and parameters: {'depth': 12, 'learning_rate': 0.0005784893336195653, 'iterations': 2528, 'l2_leaf_reg': 1.5594492360426947e-08, 'border_count': 6, 'bagging_temperature': 0.0003841018426298144, 'random_strength': 2.3634376759482083, 'grow_policy': 'Depthwise', 'min_data_in_leaf': 53}. Best is trial 349 with value: 2072.137476888861.[0m
[32m[I 2024-10-13 10:05:55,369][0m Trial 449 finished with value: 2254.8156418106505 and parameters: {'depth': 11, 'learning_rate': 0.00041396094176474757, 'iterations': 2635, 'l2_leaf_reg': 2.582738673263809e-08, 'border_count': 13, 'bagging_temperature': 0.045905904213264154, 'random_strength': 2.0897971228788914, 'grow_policy': 'Depthwise', 'min_data_in_leaf': 31}. Best is trial 349 with value: 2072.137476888861.[0m
[32m[I 2024-10-13 10:06:02,001][0m Trial 450 finished with value: 2612.898827955925 and parameters: {'depth': 11, 'learning_rate': 0.0002533019270790798, 'iterations': 2772, 'l2_leaf_reg': 4.051630387609205e-08, 'border_count': 27, 'bagging_temperature': 0.020114930618467544, 'random_strength': 2.5201155815522496, 'grow_policy': 'Depthwise', 'min_data_in_leaf': 71}. Best is trial 349 with value: 2072.137476888861.[0m
[32m[I 2024-10-13 10:06:06,829][0m Trial 451 finished with value: 2188.8868879228667 and parameters: {'depth': 11, 'learning_rate': 0.0006524224376333832, 'iterations': 2848, 'l2_leaf_reg': 1.0111287548977851e-08, 'border_count': 19, 'bagging_temperature': 0.032042195021087225, 'random_strength': 2.26027736623639, 'grow_policy': 'Depthwise', 'min_data_in_leaf': 93}. Best is trial 349 with value: 2072.137476888861.[0m
[32m[I 2024-10-13 10:06:12,425][0m Trial 452 finished with value: 2177.948662664672 and parameters: {'depth': 11, 'learning_rate': 0.0004815028680267579, 'iterations': 2717, 'l2_leaf_reg': 1.4959108770816105e-08, 'border_count': 22, 'bagging_temperature': 0.0009571702565752819, 'random_strength': 2.656948994013033, 'grow_policy': 'Depthwise', 'min_data_in_leaf': 48}. Best is trial 349 with value: 2072.137476888861.[0m
[32m[I 2024-10-13 10:06:37,360][0m Trial 453 finished with value: 2152.8751728518473 and parameters: {'depth': 11, 'learning_rate': 0.0005508200464586099, 'iterations': 2949, 'l2_leaf_reg': 2.3314635914850786e-08, 'border_count': 13, 'bagging_temperature': 0.06612335562053032, 'random_strength': 1.9981397571558839, 'grow_policy': 'Depthwise', 'min_data_in_leaf': 27}. Best is trial 349 with value: 2072.137476888861.[0m
[32m[I 2024-10-13 10:07:00,734][0m Trial 454 finished with value: 2224.9212989117786 and parameters: {'depth': 11, 'learning_rate': 0.0004010657104831804, 'iterations': 2913, 'l2_leaf_reg': 6.394844001944758e-08, 'border_count': 13, 'bagging_temperature': 0.06580005693859975, 'random_strength': 1.8903771394424915, 'grow_policy': 'Depthwise', 'min_data_in_leaf': 23}. Best is trial 349 with value: 2072.137476888861.[0m
[32m[I 2024-10-13 10:07:10,572][0m Trial 455 finished with value: 3790.262458594327 and parameters: {'depth': 11, 'learning_rate': 0.00012652214695934322, 'iterations': 2788, 'l2_leaf_reg': 1.4732482725882026e-08, 'border_count': 8, 'bagging_temperature': 0.048601260145221245, 'random_strength': 1.8419878635873492, 'grow_policy': 'Depthwise', 'min_data_in_leaf': 35}. Best is trial 349 with value: 2072.137476888861.[0m
[32m[I 2024-10-13 10:07:19,831][0m Trial 456 finished with value: 2718.6742113961627 and parameters: {'depth': 12, 'learning_rate': 0.00034406242097740307, 'iterations': 2850, 'l2_leaf_reg': 2.1197461930750374e-08, 'border_count': 27, 'bagging_temperature': 0.06955494632323478, 'random_strength': 2.057292655664185, 'grow_policy': 'Depthwise', 'min_data_in_leaf': 15}. Best is trial 349 with value: 2072.137476888861.[0m
[32m[I 2024-10-13 10:07:25,059][0m Trial 457 finished with value: 2181.253547746024 and parameters: {'depth': 11, 'learning_rate': 0.0004924744658424267, 'iterations': 2624, 'l2_leaf_reg': 3.6441690100341075e-08, 'border_count': 21, 'bagging_temperature': 0.03752804178384495, 'random_strength': 2.0583953801928176, 'grow_policy': 'Depthwise', 'min_data_in_leaf': 57}. Best is trial 349 with value: 2072.137476888861.[0m
[32m[I 2024-10-13 10:07:31,407][0m Trial 458 finished with value: 2875.0646132380534 and parameters: {'depth': 11, 'learning_rate': 0.0006769612393919406, 'iterations': 2921, 'l2_leaf_reg': 1.394930393149101e-08, 'border_count': 11, 'bagging_temperature': 0.016037895088766813, 'random_strength': 2.2303996360633693, 'grow_policy': 'Depthwise', 'min_data_in_leaf': 39}. Best is trial 349 with value: 2072.137476888861.[0m
