[32m[I 2024-10-13 10:40:34,164][0m Trial 714 finished with value: 2189.995601093332 and parameters: {'depth': 12, 'learning_rate': 0.0006332021847907672, 'iterations': 2751, 'l2_leaf_reg': 5.0426804708440956e-08, 'border_count': 13, 'bagging_temperature': 0.0028610702255953586, 'random_strength': 2.4288728243652136, 'grow_policy': 'Depthwise', 'min_data_in_leaf': 63}. Best is trial 349 with value: 2072.137476888861.[0m
[32m[I 2024-10-13 10:40:39,900][0m Trial 715 finished with value: 2764.361088515083 and parameters: {'depth': 12, 'learning_rate': 0.0006424970190761691, 'iterations': 2679, 'l2_leaf_reg': 3.4087166564303295e-08, 'border_count': 6, 'bagging_temperature': 0.5020470540059471, 'random_strength': 2.257452892529624, 'grow_policy': 'Depthwise', 'min_data_in_leaf': 33}. Best is trial 349 with value: 2072.137476888861.[0m
[32m[I 2024-10-13 10:40:53,381][0m Trial 716 finished with value: 2672.1155996637226 and parameters: {'depth': 12, 'learning_rate': 0.0007603139890810387, 'iterations': 2489, 'l2_leaf_reg': 6.429544767524471e-08, 'border_count': 16, 'bagging_temperature': 0.018833022459000898, 'random_strength': 1.9582417938174395, 'grow_policy': 'Depthwise', 'min_data_in_leaf': 1}. Best is trial 349 with value: 2072.137476888861.[0m
[32m[I 2024-10-13 10:40:58,790][0m Trial 717 finished with value: 2406.938109212994 and parameters: {'depth': 12, 'learning_rate': 0.0008547149221155111, 'iterations': 2736, 'l2_leaf_reg': 3.369086712507985e-08, 'border_count': 168, 'bagging_temperature': 0.016412378363725957, 'random_strength': 2.450126704175519, 'grow_policy': 'Depthwise', 'min_data_in_leaf': 86}. Best is trial 349 with value: 2072.137476888861.[0m
[32m[I 2024-10-13 10:41:03,607][0m Trial 718 finished with value: 2160.8618474764316 and parameters: {'depth': 12, 'learning_rate': 0.0005721501459406065, 'iterations': 2632, 'l2_leaf_reg': 4.60284431804738e-08, 'border_count': 19, 'bagging_temperature': 0.0022722812205942227, 'random_strength': 2.1065652587451047, 'grow_policy': 'Depthwise', 'min_data_in_leaf': 62}. Best is trial 349 with value: 2072.137476888861.[0m
[32m[I 2024-10-13 10:41:08,361][0m Trial 719 finished with value: 2834.2909814764844 and parameters: {'depth': 12, 'learning_rate': 0.0004594404986184199, 'iterations': 2549, 'l2_leaf_reg': 3.5039437265498994e-08, 'border_count': 7, 'bagging_temperature': 0.0005119876953446172, 'random_strength': 1.8681608458925143, 'grow_policy': 'Depthwise', 'min_data_in_leaf': 47}. Best is trial 349 with value: 2072.137476888861.[0m
[32m[I 2024-10-13 10:41:13,344][0m Trial 720 finished with value: 2155.986469215487 and parameters: {'depth': 12, 'learning_rate': 0.0006157352238138371, 'iterations': 2592, 'l2_leaf_reg': 4.1947640316928426e-08, 'border_count': 14, 'bagging_temperature': 9.316691801949347e-05, 'random_strength': 2.0820574466567368, 'grow_policy': 'Depthwise', 'min_data_in_leaf': 30}. Best is trial 349 with value: 2072.137476888861.[0m
[32m[I 2024-10-13 10:41:17,537][0m Trial 721 finished with value: 3401.0378737074934 and parameters: {'depth': 12, 'learning_rate': 0.0007332503845208307, 'iterations': 2592, 'l2_leaf_reg': 9.016217490470208, 'border_count': 12, 'bagging_temperature': 0.03487612532247512, 'random_strength': 1.820668854384633, 'grow_policy': 'Depthwise', 'min_data_in_leaf': 20}. Best is trial 349 with value: 2072.137476888861.[0m
[32m[I 2024-10-13 10:41:21,887][0m Trial 722 finished with value: 2888.1436951265696 and parameters: {'depth': 12, 'learning_rate': 0.0008878457031249168, 'iterations': 2471, 'l2_leaf_reg': 1.3246649276492629e-07, 'border_count': 5, 'bagging_temperature': 0.017303278235029182, 'random_strength': 2.0394034432702046, 'grow_policy': 'Depthwise', 'min_data_in_leaf': 31}. Best is trial 349 with value: 2072.137476888861.[0m
[32m[I 2024-10-13 10:41:24,411][0m Trial 723 finished with value: 2202.6317552734886 and parameters: {'depth': 12, 'learning_rate': 0.0006036940122104584, 'iterations': 2657, 'l2_leaf_reg': 7.640786299757436e-08, 'border_count': 13, 'bagging_temperature': 0.03996725291309226, 'random_strength': 2.0690588304222906, 'grow_policy': 'Depthwise', 'min_data_in_leaf': 732}. Best is trial 349 with value: 2072.137476888861.[0m
[32m[I 2024-10-13 10:41:29,370][0m Trial 724 finished with value: 3220.788210875197 and parameters: {'depth': 12, 'learning_rate': 0.0006935570807928231, 'iterations': 2429, 'l2_leaf_reg': 5.2534830795338486e-08, 'border_count': 9, 'bagging_temperature': 0.0015905983306509221, 'random_strength': 1.6790738594958097, 'grow_policy': 'Depthwise', 'min_data_in_leaf': 17}. Best is trial 349 with value: 2072.137476888861.[0m
[32m[I 2024-10-13 10:41:58,635][0m Trial 725 finished with value: 2595.4178685415723 and parameters: {'depth': 12, 'learning_rate': 0.0005911870587576792, 'iterations': 2519, 'l2_leaf_reg': 4.524282672454624e-08, 'border_count': 19, 'bagging_temperature': 0.035530653418085936, 'random_strength': 1.9488620906383134, 'grow_policy': 'SymmetricTree', 'min_data_in_leaf': 35}. Best is trial 349 with value: 2072.137476888861.[0m
[32m[I 2024-10-13 10:42:04,538][0m Trial 726 finished with value: 2416.040755045326 and parameters: {'depth': 12, 'learning_rate': 0.0006502110561902937, 'iterations': 2579, 'l2_leaf_reg': 6.772675489186321e-08, 'border_count': 201, 'bagging_temperature': 0.0017165234638519978, 'random_strength': 2.1319854406868797, 'grow_policy': 'Depthwise', 'min_data_in_leaf': 16}. Best is trial 349 with value: 2072.137476888861.[0m
[32m[I 2024-10-13 10:42:05,755][0m Trial 727 finished with value: 3526.0789892659277 and parameters: {'depth': 12, 'learning_rate': 0.0007499837103508067, 'iterations': 634, 'l2_leaf_reg': 3.297190842619097e-08, 'border_count': 2, 'bagging_temperature': 0.12410327119596562, 'random_strength': 1.830007433908935, 'grow_policy': 'Depthwise', 'min_data_in_leaf': 49}. Best is trial 349 with value: 2072.137476888861.[0m
[32m[I 2024-10-13 10:42:09,716][0m Trial 728 finished with value: 2330.5562942272704 and parameters: {'depth': 7, 'learning_rate': 0.00036776393312619866, 'iterations': 2531, 'l2_leaf_reg': 1.0219543517004552e-07, 'border_count': 17, 'bagging_temperature': 0.0334652647678997, 'random_strength': 8.632942950676231, 'grow_policy': 'Depthwise', 'min_data_in_leaf': 32}. Best is trial 349 with value: 2072.137476888861.[0m
[32m[I 2024-10-13 10:42:15,397][0m Trial 729 finished with value: 2388.486835110948 and parameters: {'depth': 12, 'learning_rate': 0.0005227692868236029, 'iterations': 2632, 'l2_leaf_reg': 3.795320141968258e-08, 'border_count': 14, 'bagging_temperature': 0.01921826386115134, 'random_strength': 2.1271603307985605, 'grow_policy': 'Depthwise', 'min_data_in_leaf': 14}. Best is trial 349 with value: 2072.137476888861.[0m
[32m[I 2024-10-13 10:42:19,093][0m Trial 730 finished with value: 2259.90547290202 and parameters: {'depth': 12, 'learning_rate': 0.0009475746954442963, 'iterations': 2591, 'l2_leaf_reg': 4.753564653389066e-08, 'border_count': 22, 'bagging_temperature': 0.000499713033040354, 'random_strength': 1.7992006767353284, 'grow_policy': 'Depthwise', 'min_data_in_leaf': 55}. Best is trial 349 with value: 2072.137476888861.[0m
[32m[I 2024-10-13 10:42:35,364][0m Trial 731 finished with value: 3061.6464779158764 and parameters: {'depth': 12, 'learning_rate': 0.0004385742188396025, 'iterations': 2687, 'l2_leaf_reg': 2.755043020853084e-08, 'border_count': 27, 'bagging_temperature': 0.05140250960154933, 'random_strength': 2.2438828446731174, 'grow_policy': 'Depthwise', 'min_data_in_leaf': 1}. Best is trial 349 with value: 2072.137476888861.[0m
[32m[I 2024-10-13 10:42:40,359][0m Trial 732 finished with value: 3046.236326484188 and parameters: {'depth': 12, 'learning_rate': 0.00030410422791097083, 'iterations': 2721, 'l2_leaf_reg': 2.6190137702200487e-08, 'border_count': 9, 'bagging_temperature': 0.00011078091967050018, 'random_strength': 2.020449011817078, 'grow_policy': 'Depthwise', 'min_data_in_leaf': 43}. Best is trial 349 with value: 2072.137476888861.[0m
[32m[I 2024-10-13 10:42:57,716][0m Trial 733 finished with value: 2724.2171219813717 and parameters: {'depth': 12, 'learning_rate': 0.0005828966837825672, 'iterations': 2998, 'l2_leaf_reg': 5.948440287137774e-08, 'border_count': 20, 'bagging_temperature': 0.05173933035948707, 'random_strength': 1.6291111761661403, 'grow_policy': 'Depthwise', 'min_data_in_leaf': 1}. Best is trial 349 with value: 2072.137476888861.[0m
[32m[I 2024-10-13 10:43:01,859][0m Trial 734 finished with value: 2183.6893793882496 and parameters: {'depth': 12, 'learning_rate': 0.0004882565453800269, 'iterations': 2604, 'l2_leaf_reg': 9.721065079767073e-06, 'border_count': 15, 'bagging_temperature': 0.029230292916267685, 'random_strength': 1.936418388606738, 'grow_policy': 'Depthwise', 'min_data_in_leaf': 31}. Best is trial 349 with value: 2072.137476888861.[0m
[32m[I 2024-10-13 10:43:05,309][0m Trial 735 finished with value: 3049.598913410236 and parameters: {'depth': 12, 'learning_rate': 0.00020299412701331825, 'iterations': 2658, 'l2_leaf_reg': 4.1020987094870575e-08, 'border_count': 138, 'bagging_temperature': 0.0780611528971321, 'random_strength': 2.2444699533421097, 'grow_policy': 'Depthwise', 'min_data_in_leaf': 54}. Best is trial 349 with value: 2072.137476888861.[0m
[32m[I 2024-10-13 10:43:10,762][0m Trial 736 finished with value: 3155.7718813231168 and parameters: {'depth': 12, 'learning_rate': 0.0006746995542489537, 'iterations': 2936, 'l2_leaf_reg': 2.3093123038521424e-08, 'border_count': 10, 'bagging_temperature': 0.11303471675802294, 'random_strength': 1.727916638020044, 'grow_policy': 'Depthwise', 'min_data_in_leaf': 24}. Best is trial 349 with value: 2072.137476888861.[0m
[32m[I 2024-10-13 10:43:13,308][0m Trial 737 finished with value: 3917.1392892393114 and parameters: {'depth': 12, 'learning_rate': 0.0004077553652988743, 'iterations': 2761, 'l2_leaf_reg': 7.923533960370768e-08, 'border_count': 1, 'bagging_temperature': 0.03609577665801037, 'random_strength': 2.1409925493949618, 'grow_policy': 'Depthwise', 'min_data_in_leaf': 61}. Best is trial 349 with value: 2072.137476888861.[0m
[32m[I 2024-10-13 10:43:17,171][0m Trial 738 finished with value: 2180.2789115982073 and parameters: {'depth': 12, 'learning_rate': 0.0005345082637285434, 'iterations': 2531, 'l2_leaf_reg': 1.995790202907583e-08, 'border_count': 24, 'bagging_temperature': 0.3589253122929062, 'random_strength': 1.9076563487206526, 'grow_policy': 'Depthwise', 'min_data_in_leaf': 36}. Best is trial 349 with value: 2072.137476888861.[0m
[32m[I 2024-10-13 10:43:19,678][0m Trial 739 finished with value: 2423.910613058674 and parameters: {'depth': 12, 'learning_rate': 0.1537862800531023, 'iterations': 805, 'l2_leaf_reg': 3.462293288434695e-08, 'border_count': 16, 'bagging_temperature': 0.00012782759604913687, 'random_strength': 2.357380527226092, 'grow_policy': 'Depthwise', 'min_data_in_leaf': 18}. Best is trial 349 with value: 2072.137476888861.[0m
[32m[I 2024-10-13 10:43:23,036][0m Trial 740 finished with value: 2182.4494007729586 and parameters: {'depth': 11, 'learning_rate': 0.0006210926503825205, 'iterations': 2829, 'l2_leaf_reg': 0.04024313467585823, 'border_count': 20, 'bagging_temperature': 0.06322135667976445, 'random_strength': 2.149764945263008, 'grow_policy': 'Depthwise', 'min_data_in_leaf': 70}. Best is trial 349 with value: 2072.137476888861.[0m
[32m[I 2024-10-13 10:43:35,828][0m Trial 741 finished with value: 3045.250983553711 and parameters: {'depth': 11, 'learning_rate': 0.0007520596318183388, 'iterations': 2713, 'l2_leaf_reg': 1.526109944089296e-08, 'border_count': 29, 'bagging_temperature': 0.024835746611091482, 'random_strength': 2.399234261409897, 'grow_policy': 'Depthwise', 'min_data_in_leaf': 1}. Best is trial 349 with value: 2072.137476888861.[0m
[32m[I 2024-10-13 10:43:39,690][0m Trial 742 finished with value: 2793.978445806367 and parameters: {'depth': 11, 'learning_rate': 0.0004821087703028915, 'iterations': 2893, 'l2_leaf_reg': 2.7672215725283237e-08, 'border_count': 12, 'bagging_temperature': 0.04733238030799082, 'random_strength': 2.004789736024361, 'grow_policy': 'Depthwise', 'min_data_in_leaf': 53}. Best is trial 349 with value: 2072.137476888861.[0m
[32m[I 2024-10-13 10:43:44,131][0m Trial 743 finished with value: 2278.7330034516376 and parameters: {'depth': 10, 'learning_rate': 0.00036356284348983245, 'iterations': 2781, 'l2_leaf_reg': 5.143386075354719e-08, 'border_count': 24, 'bagging_temperature': 0.018509735675590493, 'random_strength': 1.6303047889704332, 'grow_policy': 'Depthwise', 'min_data_in_leaf': 34}. Best is trial 349 with value: 2072.137476888861.[0m
[32m[I 2024-10-13 10:43:48,648][0m Trial 744 finished with value: 2820.0052577978076 and parameters: {'depth': 11, 'learning_rate': 0.0008507724354634, 'iterations': 2951, 'l2_leaf_reg': 2.1779508361010775e-08, 'border_count': 7, 'bagging_temperature': 0.0654061951742948, 'random_strength': 2.2757521519239106, 'grow_policy': 'Depthwise', 'min_data_in_leaf': 42}. Best is trial 349 with value: 2072.137476888861.[0m
[32m[I 2024-10-13 10:43:52,058][0m Trial 745 finished with value: 2161.8431640774033 and parameters: {'depth': 12, 'learning_rate': 0.0005664424032228438, 'iterations': 2642, 'l2_leaf_reg': 1.3552874926872882e-08, 'border_count': 19, 'bagging_temperature': 0.09512733479031571, 'random_strength': 2.617044980256398, 'grow_policy': 'Depthwise', 'min_data_in_leaf': 65}. Best is trial 349 with value: 2072.137476888861.[0m
[32m[I 2024-10-13 10:43:58,290][0m Trial 746 finished with value: 2539.9996766646304 and parameters: {'depth': 10, 'learning_rate': 0.00041832715843758057, 'iterations': 2859, 'l2_leaf_reg': 1.2610822368205835e-07, 'border_count': 232, 'bagging_temperature': 0.04025594131327381, 'random_strength': 1.920170764608423, 'grow_policy': 'Depthwise', 'min_data_in_leaf': 19}. Best is trial 349 with value: 2072.137476888861.[0m
[32m[I 2024-10-13 10:44:24,798][0m Trial 747 finished with value: 2780.362812348195 and parameters: {'depth': 11, 'learning_rate': 0.000489254168164856, 'iterations': 2701, 'l2_leaf_reg': 2.641804350858577, 'border_count': 17, 'bagging_temperature': 0.000352854281429317, 'random_strength': 2.150194752997742, 'grow_policy': 'SymmetricTree', 'min_data_in_leaf': 96}. Best is trial 349 with value: 2072.137476888861.[0m
[32m[I 2024-10-13 10:44:28,669][0m Trial 748 finished with value: 2174.482316488364 and parameters: {'depth': 11, 'learning_rate': 0.000645945937617818, 'iterations': 2578, 'l2_leaf_reg': 3.78468600693353e-08, 'border_count': 36, 'bagging_temperature': 0.02170783988554312, 'random_strength': 2.4421598501049284, 'grow_policy': 'Depthwise', 'min_data_in_leaf': 44}. Best is trial 349 with value: 2072.137476888861.[0m
[32m[I 2024-10-13 10:44:41,070][0m Trial 749 finished with value: 2908.699835181077 and parameters: {'depth': 10, 'learning_rate': 0.000574430174007142, 'iterations': 2776, 'l2_leaf_reg': 1.017580821264538e-08, 'border_count': 28, 'bagging_temperature': 0.06860163777823872, 'random_strength': 1.7686614761321848, 'grow_policy': 'Depthwise', 'min_data_in_leaf': 1}. Best is trial 349 with value: 2072.137476888861.[0m
[32m[I 2024-10-13 10:44:44,823][0m Trial 750 finished with value: 2422.132965728224 and parameters: {'depth': 11, 'learning_rate': 0.0007476795260776561, 'iterations': 2896, 'l2_leaf_reg': 2.0910277247050615e-08, 'border_count': 254, 'bagging_temperature': 0.0510629481922981, 'random_strength': 2.2872471741070215, 'grow_policy': 'Depthwise', 'min_data_in_leaf': 69}. Best is trial 349 with value: 2072.137476888861.[0m
[32m[I 2024-10-13 10:44:50,096][0m Trial 751 finished with value: 2175.667805107627 and parameters: {'depth': 12, 'learning_rate': 0.0004399055934891243, 'iterations': 2819, 'l2_leaf_reg': 8.044008521842079e-08, 'border_count': 13, 'bagging_temperature': 0.01962007884133389, 'random_strength': 2.7208995710007624, 'grow_policy': 'Depthwise', 'min_data_in_leaf': 21}. Best is trial 349 with value: 2072.137476888861.[0m
[32m[I 2024-10-13 10:44:57,020][0m Trial 752 finished with value: 2297.2983286740496 and parameters: {'depth': 11, 'learning_rate': 0.000370654414730937, 'iterations': 2727, 'l2_leaf_reg': 1.0069438686730938e-08, 'border_count': 22, 'bagging_temperature': 0.08916338601539207, 'random_strength': 2.002234256317736, 'grow_policy': 'Depthwise', 'min_data_in_leaf': 31}. Best is trial 349 with value: 2072.137476888861.[0m
[32m[I 2024-10-13 10:45:03,272][0m Trial 753 finished with value: 2971.762398813939 and parameters: {'depth': 11, 'learning_rate': 0.00029750622600487975, 'iterations': 2997, 'l2_leaf_reg': 3.0239594952311276e-08, 'border_count': 6, 'bagging_temperature': 0.040889416201899384, 'random_strength': 1.7623308833790785, 'grow_policy': 'Depthwise', 'min_data_in_leaf': 83}. Best is trial 349 with value: 2072.137476888861.[0m
[32m[I 2024-10-13 10:45:09,816][0m Trial 754 finished with value: 2167.6038543547375 and parameters: {'depth': 11, 'learning_rate': 0.0005521162240722684, 'iterations': 2492, 'l2_leaf_reg': 0.00014527919722040432, 'border_count': 15, 'bagging_temperature': 0.0179096834579213, 'random_strength': 2.4367016828780015, 'grow_policy': 'Depthwise', 'min_data_in_leaf': 56}. Best is trial 349 with value: 2072.137476888861.[0m
[32m[I 2024-10-13 10:45:18,256][0m Trial 755 finished with value: 2092.2930805603896 and parameters: {'depth': 11, 'learning_rate': 0.00048556213451254415, 'iterations': 2654, 'l2_leaf_reg': 1.7152942510447637e-08, 'border_count': 25, 'bagging_temperature': 0.055860959066124746, 'random_strength': 2.145007647404181, 'grow_policy': 'Depthwise', 'min_data_in_leaf': 21}. Best is trial 349 with value: 2072.137476888861.[0m
[32m[I 2024-10-13 10:45:28,822][0m Trial 756 finished with value: 2612.5836056105054 and parameters: {'depth': 12, 'learning_rate': 0.00042843828253197406, 'iterations': 2604, 'l2_leaf_reg': 1.4201961839191748e-08, 'border_count': 35, 'bagging_temperature': 0.044629305887254764, 'random_strength': 2.8870516677841946, 'grow_policy': 'Depthwise', 'min_data_in_leaf': 20}. Best is trial 349 with value: 2072.137476888861.[0m
[32m[I 2024-10-13 10:45:33,732][0m Trial 757 finished with value: 2537.1973075774767 and parameters: {'depth': 11, 'learning_rate': 0.0003639378220840933, 'iterations': 2563, 'l2_leaf_reg': 1.6952452883902525e-08, 'border_count': 30, 'bagging_temperature': 0.03273577671916911, 'random_strength': 2.5872479571049682, 'grow_policy': 'Depthwise', 'min_data_in_leaf': 474}. Best is trial 349 with value: 2072.137476888861.[0m
[32m[I 2024-10-13 10:45:41,634][0m Trial 758 finished with value: 2185.5755211203164 and parameters: {'depth': 10, 'learning_rate': 0.0004924744328501557, 'iterations': 2652, 'l2_leaf_reg': 4.4732715045598946e-08, 'border_count': 26, 'bagging_temperature': 0.06260180326322766, 'random_strength': 2.0413089706109715, 'grow_policy': 'Depthwise', 'min_data_in_leaf': 45}. Best is trial 349 with value: 2072.137476888861.[0m
[32m[I 2024-10-13 10:45:53,900][0m Trial 759 finished with value: 2768.283595991628 and parameters: {'depth': 12, 'learning_rate': 0.0003313131779785114, 'iterations': 2930, 'l2_leaf_reg': 2.614435551505173e-08, 'border_count': 29, 'bagging_temperature': 0.018125210332686534, 'random_strength': 1.5586516285553849, 'grow_policy': 'Depthwise', 'min_data_in_leaf': 20}. Best is trial 349 with value: 2072.137476888861.[0m
[32m[I 2024-10-13 10:46:00,880][0m Trial 760 finished with value: 2181.7031943448583 and parameters: {'depth': 11, 'learning_rate': 0.0004343060304790839, 'iterations': 2861, 'l2_leaf_reg': 1.648016221719895e-08, 'border_count': 23, 'bagging_temperature': 0.052932212777240126, 'random_strength': 2.26661469198612, 'grow_policy': 'Depthwise', 'min_data_in_leaf': 65}. Best is trial 349 with value: 2072.137476888861.[0m
[32m[I 2024-10-13 10:46:08,945][0m Trial 761 finished with value: 2172.141404959374 and parameters: {'depth': 11, 'learning_rate': 0.0005098014212472949, 'iterations': 2794, 'l2_leaf_reg': 1.3409984667703685e-08, 'border_count': 34, 'bagging_temperature': 0.03348886619619166, 'random_strength': 5.140941372062702, 'grow_policy': 'Depthwise', 'min_data_in_leaf': 44}. Best is trial 349 with value: 2072.137476888861.[0m
[32m[I 2024-10-13 10:46:14,572][0m Trial 762 finished with value: 2344.1216922172475 and parameters: {'depth': 12, 'learning_rate': 0.0003925071943638438, 'iterations': 2943, 'l2_leaf_reg': 1.0018243600276403e-08, 'border_count': 26, 'bagging_temperature': 0.018527958212402718, 'random_strength': 1.9489951673681707, 'grow_policy': 'Depthwise', 'min_data_in_leaf': 89}. Best is trial 349 with value: 2072.137476888861.[0m
[32m[I 2024-10-13 10:46:38,545][0m Trial 763 finished with value: 2897.34735252529 and parameters: {'depth': 11, 'learning_rate': 0.0004933783598659551, 'iterations': 2650, 'l2_leaf_reg': 5.966315054296835e-08, 'border_count': 21, 'bagging_temperature': 0.06947146683538886, 'random_strength': 2.5018701960726633, 'grow_policy': 'Depthwise', 'min_data_in_leaf': 1}. Best is trial 349 with value: 2072.137476888861.[0m
[32m[I 2024-10-13 10:46:46,496][0m Trial 764 finished with value: 2158.041793108189 and parameters: {'depth': 11, 'learning_rate': 0.0006386004377204315, 'iterations': 2742, 'l2_leaf_reg': 2.7928191615284996e-08, 'border_count': 31, 'bagging_temperature': 0.0010143268937424688, 'random_strength': 2.180143433886914, 'grow_policy': 'Depthwise', 'min_data_in_leaf': 32}. Best is trial 349 with value: 2072.137476888861.[0m
