[32m[I 2024-10-13 10:15:51,938][0m Trial 510 finished with value: 2167.2765899332503 and parameters: {'depth': 10, 'learning_rate': 0.0006937008253616504, 'iterations': 2816, 'l2_leaf_reg': 3.589670822941973e-08, 'border_count': 14, 'bagging_temperature': 0.09535937946479194, 'random_strength': 2.2399952157271903, 'grow_policy': 'Depthwise', 'min_data_in_leaf': 28}. Best is trial 349 with value: 2072.137476888861.[0m
[32m[I 2024-10-13 10:15:55,603][0m Trial 511 finished with value: 2165.126909452765 and parameters: {'depth': 11, 'learning_rate': 0.0005726713698498555, 'iterations': 2680, 'l2_leaf_reg': 2.0677048663517402e-08, 'border_count': 21, 'bagging_temperature': 0.05532256981906349, 'random_strength': 1.641988381609599, 'grow_policy': 'Depthwise', 'min_data_in_leaf': 49}. Best is trial 349 with value: 2072.137476888861.[0m
[32m[I 2024-10-13 10:16:41,423][0m Trial 512 finished with value: 2578.5160937161268 and parameters: {'depth': 11, 'learning_rate': 0.00040400331449308706, 'iterations': 3000, 'l2_leaf_reg': 1.3883373938766964e-08, 'border_count': 29, 'bagging_temperature': 0.03452295030102025, 'random_strength': 1.861116355260783, 'grow_policy': 'SymmetricTree', 'min_data_in_leaf': 70}. Best is trial 349 with value: 2072.137476888861.[0m
[32m[I 2024-10-13 10:16:46,926][0m Trial 513 finished with value: 3275.07770751306 and parameters: {'depth': 11, 'learning_rate': 0.00033766817803694056, 'iterations': 2758, 'l2_leaf_reg': 7.364938215631696e-08, 'border_count': 11, 'bagging_temperature': 0.07343264441227217, 'random_strength': 2.1135455348105, 'grow_policy': 'Depthwise', 'min_data_in_leaf': 15}. Best is trial 349 with value: 2072.137476888861.[0m
[32m[I 2024-10-13 10:16:51,451][0m Trial 514 finished with value: 3408.2812532608073 and parameters: {'depth': 10, 'learning_rate': 0.0004910318428467191, 'iterations': 2863, 'l2_leaf_reg': 2.7693326750193685e-08, 'border_count': 1, 'bagging_temperature': 0.038229780610243125, 'random_strength': 2.444430729265009, 'grow_policy': 'Depthwise', 'min_data_in_leaf': 35}. Best is trial 349 with value: 2072.137476888861.[0m
[32m[I 2024-10-13 10:17:04,794][0m Trial 515 finished with value: 2675.683430185171 and parameters: {'depth': 11, 'learning_rate': 0.0007157032412825448, 'iterations': 2794, 'l2_leaf_reg': 5.0427645028598674e-08, 'border_count': 18, 'bagging_temperature': 0.060122465984819996, 'random_strength': 2.5752276938568612, 'grow_policy': 'Depthwise', 'min_data_in_leaf': 1}. Best is trial 349 with value: 2072.137476888861.[0m
[32m[I 2024-10-13 10:17:07,460][0m Trial 516 finished with value: 2204.894697265311 and parameters: {'depth': 11, 'learning_rate': 0.0005899000038312578, 'iterations': 2599, 'l2_leaf_reg': 1.4766743251985248e-08, 'border_count': 24, 'bagging_temperature': 0.03246351845765736, 'random_strength': 2.30528203719242, 'grow_policy': 'Depthwise', 'min_data_in_leaf': 88}. Best is trial 349 with value: 2072.137476888861.[0m
[32m[I 2024-10-13 10:17:11,268][0m Trial 517 finished with value: 2292.38156311242 and parameters: {'depth': 12, 'learning_rate': 0.0004388642103256573, 'iterations': 2941, 'l2_leaf_reg': 2.126452712362355e-08, 'border_count': 169, 'bagging_temperature': 0.08040642770449116, 'random_strength': 1.8284181368851042, 'grow_policy': 'Depthwise', 'min_data_in_leaf': 62}. Best is trial 349 with value: 2072.137476888861.[0m
[32m[I 2024-10-13 10:17:16,399][0m Trial 518 finished with value: 2877.0713190660463 and parameters: {'depth': 11, 'learning_rate': 0.11492878154228472, 'iterations': 2850, 'l2_leaf_reg': 3.5578736565488763e-08, 'border_count': 77, 'bagging_temperature': 0.028816253533541086, 'random_strength': 2.061052569757701, 'grow_policy': 'Depthwise', 'min_data_in_leaf': 45}. Best is trial 349 with value: 2072.137476888861.[0m
[32m[I 2024-10-13 10:17:21,123][0m Trial 519 finished with value: 2795.9160311886794 and parameters: {'depth': 11, 'learning_rate': 0.0004926382720245253, 'iterations': 2700, 'l2_leaf_reg': 1.0107181829326847e-08, 'border_count': 6, 'bagging_temperature': 0.05262025817324429, 'random_strength': 2.3907462932376617, 'grow_policy': 'Depthwise', 'min_data_in_leaf': 27}. Best is trial 349 with value: 2072.137476888861.[0m
[32m[I 2024-10-13 10:17:24,156][0m Trial 520 finished with value: 2659.3391590938636 and parameters: {'depth': 11, 'learning_rate': 0.018112811646814633, 'iterations': 2762, 'l2_leaf_reg': 2.135262285894187e-08, 'border_count': 17, 'bagging_temperature': 0.023888206118554776, 'random_strength': 2.1764317825801656, 'grow_policy': 'Depthwise', 'min_data_in_leaf': 109}. Best is trial 349 with value: 2072.137476888861.[0m
[32m[I 2024-10-13 10:17:27,544][0m Trial 521 finished with value: 2242.5064982167464 and parameters: {'depth': 11, 'learning_rate': 0.00037228836388972957, 'iterations': 2900, 'l2_leaf_reg': 4.5263535735157466e-08, 'border_count': 25, 'bagging_temperature': 0.0005582234927754837, 'random_strength': 2.664254871890342, 'grow_policy': 'Depthwise', 'min_data_in_leaf': 76}. Best is trial 349 with value: 2072.137476888861.[0m
[32m[I 2024-10-13 10:17:33,941][0m Trial 522 finished with value: 2397.834144126963 and parameters: {'depth': 10, 'learning_rate': 0.0006016038517230807, 'iterations': 2645, 'l2_leaf_reg': 1.3709403097406782e-08, 'border_count': 119, 'bagging_temperature': 0.052849012189154596, 'random_strength': 1.9407117728627674, 'grow_policy': 'Depthwise', 'min_data_in_leaf': 18}. Best is trial 349 with value: 2072.137476888861.[0m
[32m[I 2024-10-13 10:17:37,248][0m Trial 523 finished with value: 2841.2511310717846 and parameters: {'depth': 12, 'learning_rate': 0.000728808991347105, 'iterations': 2547, 'l2_leaf_reg': 8.780519215203248e-08, 'border_count': 12, 'bagging_temperature': 0.0748329897767976, 'random_strength': 2.4007470294208324, 'grow_policy': 'Depthwise', 'min_data_in_leaf': 51}. Best is trial 349 with value: 2072.137476888861.[0m
[32m[I 2024-10-13 10:17:41,921][0m Trial 524 finished with value: 2321.410606782702 and parameters: {'depth': 11, 'learning_rate': 0.000529547370090827, 'iterations': 2837, 'l2_leaf_reg': 2.8826963768882526e-08, 'border_count': 189, 'bagging_temperature': 0.03676605139743097, 'random_strength': 1.659502869421046, 'grow_policy': 'Depthwise', 'min_data_in_leaf': 38}. Best is trial 349 with value: 2072.137476888861.[0m
[32m[I 2024-10-13 10:17:45,186][0m Trial 525 finished with value: 2437.4149798181425 and parameters: {'depth': 11, 'learning_rate': 0.0003012426221584015, 'iterations': 2783, 'l2_leaf_reg': 1.6839977585273502e-08, 'border_count': 22, 'bagging_temperature': 0.09572988653536499, 'random_strength': 2.204020919857324, 'grow_policy': 'Depthwise', 'min_data_in_leaf': 67}. Best is trial 349 with value: 2072.137476888861.[0m
[32m[I 2024-10-13 10:17:59,141][0m Trial 526 finished with value: 3067.8648569258494 and parameters: {'depth': 11, 'learning_rate': 0.0004485520361814564, 'iterations': 2945, 'l2_leaf_reg': 2.181306917498526e-08, 'border_count': 31, 'bagging_temperature': 0.0232439507329896, 'random_strength': 2.574075447458904, 'grow_policy': 'Depthwise', 'min_data_in_leaf': 1}. Best is trial 349 with value: 2072.137476888861.[0m
[32m[I 2024-10-13 10:18:01,628][0m Trial 527 finished with value: 2191.8800837251115 and parameters: {'depth': 10, 'learning_rate': 0.0006256655279355192, 'iterations': 2738, 'l2_leaf_reg': 3.840419664589739e-08, 'border_count': 16, 'bagging_temperature': 0.05682614999629107, 'random_strength': 2.0329470925779636, 'grow_policy': 'Depthwise', 'min_data_in_leaf': 99}. Best is trial 349 with value: 2072.137476888861.[0m
[32m[I 2024-10-13 10:18:06,606][0m Trial 528 finished with value: 3533.4965694849634 and parameters: {'depth': 11, 'learning_rate': 0.00022027060904428132, 'iterations': 2486, 'l2_leaf_reg': 1.3374069694974605e-08, 'border_count': 9, 'bagging_temperature': 0.015937044835707917, 'random_strength': 1.8357308735320088, 'grow_policy': 'Depthwise', 'min_data_in_leaf': 25}. Best is trial 349 with value: 2072.137476888861.[0m
[32m[I 2024-10-13 10:18:10,448][0m Trial 529 finished with value: 2208.246088886021 and parameters: {'depth': 11, 'learning_rate': 0.0004115228245624991, 'iterations': 2852, 'l2_leaf_reg': 6.03718501377524e-08, 'border_count': 18, 'bagging_temperature': 0.03863666231555267, 'random_strength': 2.328612925126576, 'grow_policy': 'Depthwise', 'min_data_in_leaf': 55}. Best is trial 349 with value: 2072.137476888861.[0m
[32m[I 2024-10-13 10:18:13,132][0m Trial 530 finished with value: 2249.853379590415 and parameters: {'depth': 11, 'learning_rate': 0.0005246675385988403, 'iterations': 2672, 'l2_leaf_reg': 2.933677188182228e-08, 'border_count': 27, 'bagging_temperature': 0.06824607928242113, 'random_strength': 2.5095684039508073, 'grow_policy': 'Depthwise', 'min_data_in_leaf': 126}. Best is trial 349 with value: 2072.137476888861.[0m
[32m[I 2024-10-13 10:18:16,080][0m Trial 531 finished with value: 2429.7489451639267 and parameters: {'depth': 12, 'learning_rate': 0.00035918325727836236, 'iterations': 2893, 'l2_leaf_reg': 1.824304856415845e-08, 'border_count': 20, 'bagging_temperature': 0.017380877206145538, 'random_strength': 2.160313967293591, 'grow_policy': 'Depthwise', 'min_data_in_leaf': 86}. Best is trial 349 with value: 2072.137476888861.[0m
[32m[I 2024-10-13 10:18:47,685][0m Trial 532 finished with value: 2823.2321116403905 and parameters: {'depth': 11, 'learning_rate': 0.0007335707918609743, 'iterations': 2799, 'l2_leaf_reg': 2.8295927309931282e-08, 'border_count': 12, 'bagging_temperature': 0.0011327514503862018, 'random_strength': 2.7063886992069404, 'grow_policy': 'SymmetricTree', 'min_data_in_leaf': 41}. Best is trial 349 with value: 2072.137476888861.[0m
[32m[I 2024-10-13 10:18:53,029][0m Trial 533 finished with value: 2429.6805265542844 and parameters: {'depth': 11, 'learning_rate': 0.00047891144439280564, 'iterations': 2706, 'l2_leaf_reg': 1.3348490024572795e-08, 'border_count': 24, 'bagging_temperature': 0.04394638068926258, 'random_strength': 2.0066444624205526, 'grow_policy': 'Depthwise', 'min_data_in_leaf': 18}. Best is trial 349 with value: 2072.137476888861.[0m
[32m[I 2024-10-13 10:18:56,608][0m Trial 534 finished with value: 2199.8948177138022 and parameters: {'depth': 12, 'learning_rate': 0.0005878503591804536, 'iterations': 2952, 'l2_leaf_reg': 1.0020143862057325e-08, 'border_count': 30, 'bagging_temperature': 0.09674958560020984, 'random_strength': 2.3182341453179607, 'grow_policy': 'Depthwise', 'min_data_in_leaf': 62}. Best is trial 349 with value: 2072.137476888861.[0m
[32m[I 2024-10-13 10:18:59,772][0m Trial 535 finished with value: 2849.3812005070067 and parameters: {'depth': 10, 'learning_rate': 0.0004200559780711199, 'iterations': 2595, 'l2_leaf_reg': 4.705910420183022e-08, 'border_count': 6, 'bagging_temperature': 0.0757710237723428, 'random_strength': 1.7743627338877737, 'grow_policy': 'Depthwise', 'min_data_in_leaf': 78}. Best is trial 349 with value: 2072.137476888861.[0m
[32m[I 2024-10-13 10:19:04,206][0m Trial 536 finished with value: 2161.1465268199163 and parameters: {'depth': 13, 'learning_rate': 0.0005272169080823491, 'iterations': 2822, 'l2_leaf_reg': 1.958375934052919e-08, 'border_count': 16, 'bagging_temperature': 0.0322055095397244, 'random_strength': 1.5511416282457393, 'grow_policy': 'Depthwise', 'min_data_in_leaf': 37}. Best is trial 349 with value: 2072.137476888861.[0m
[32m[I 2024-10-13 10:19:09,266][0m Trial 537 finished with value: 2155.458317689514 and parameters: {'depth': 12, 'learning_rate': 0.00061812654490429, 'iterations': 2835, 'l2_leaf_reg': 6.831500739580481e-08, 'border_count': 14, 'bagging_temperature': 0.05110717625530279, 'random_strength': 2.787751713398575, 'grow_policy': 'Depthwise', 'min_data_in_leaf': 30}. Best is trial 349 with value: 2072.137476888861.[0m
[32m[I 2024-10-13 10:19:24,294][0m Trial 538 finished with value: 3404.5082303160434 and parameters: {'depth': 12, 'learning_rate': 0.0006703851178033299, 'iterations': 2880, 'l2_leaf_reg': 8.517369888913011e-08, 'border_count': 9, 'bagging_temperature': 0.06024112348263713, 'random_strength': 3.0084951173180903, 'grow_policy': 'Depthwise', 'min_data_in_leaf': 1}. Best is trial 349 with value: 2072.137476888861.[0m
[32m[I 2024-10-13 10:19:29,313][0m Trial 539 finished with value: 3748.4569017474473 and parameters: {'depth': 12, 'learning_rate': 0.0001805715739638772, 'iterations': 2836, 'l2_leaf_reg': 5.368539148982246e-08, 'border_count': 1, 'bagging_temperature': 0.09482761545591137, 'random_strength': 3.1727507692225836, 'grow_policy': 'Depthwise', 'min_data_in_leaf': 28}. Best is trial 349 with value: 2072.137476888861.[0m
[32m[I 2024-10-13 10:19:34,992][0m Trial 540 finished with value: 2211.7306053253265 and parameters: {'depth': 13, 'learning_rate': 0.0007542554309926543, 'iterations': 2940, 'l2_leaf_reg': 8.295223398753207e-08, 'border_count': 13, 'bagging_temperature': 0.05184099042718719, 'random_strength': 2.8770714445255776, 'grow_policy': 'Depthwise', 'min_data_in_leaf': 21}. Best is trial 349 with value: 2072.137476888861.[0m
[32m[I 2024-10-13 10:19:49,380][0m Trial 541 finished with value: 2964.6115580197666 and parameters: {'depth': 12, 'learning_rate': 0.0006161358045649863, 'iterations': 2893, 'l2_leaf_reg': 3.877086377776858e-08, 'border_count': 7, 'bagging_temperature': 0.4617858970927614, 'random_strength': 1.5056967351184265, 'grow_policy': 'Depthwise', 'min_data_in_leaf': 1}. Best is trial 349 with value: 2072.137476888861.[0m
[32m[I 2024-10-13 10:19:53,655][0m Trial 542 finished with value: 2193.967773790576 and parameters: {'depth': 12, 'learning_rate': 0.0004690186629512953, 'iterations': 2799, 'l2_leaf_reg': 5.926390679827252e-08, 'border_count': 15, 'bagging_temperature': 0.07658486061442324, 'random_strength': 2.8120651839859776, 'grow_policy': 'Depthwise', 'min_data_in_leaf': 33}. Best is trial 349 with value: 2072.137476888861.[0m
[32m[I 2024-10-13 10:19:57,652][0m Trial 543 finished with value: 2348.522952988706 and parameters: {'depth': 13, 'learning_rate': 0.00032014720132083696, 'iterations': 2847, 'l2_leaf_reg': 3.312405450936085e-08, 'border_count': 13, 'bagging_temperature': 0.03515843578727125, 'random_strength': 2.6896696887682534, 'grow_policy': 'Depthwise', 'min_data_in_leaf': 39}. Best is trial 349 with value: 2072.137476888861.[0m
[32m[I 2024-10-13 10:20:03,528][0m Trial 544 finished with value: 2341.985247663536 and parameters: {'depth': 13, 'learning_rate': 0.0006022347910022638, 'iterations': 2965, 'l2_leaf_reg': 2.3301687149163837e-08, 'border_count': 19, 'bagging_temperature': 0.013702371103462027, 'random_strength': 2.5451722325799033, 'grow_policy': 'Depthwise', 'min_data_in_leaf': 20}. Best is trial 349 with value: 2072.137476888861.[0m
[32m[I 2024-10-13 10:20:06,818][0m Trial 545 finished with value: 2837.481727537521 and parameters: {'depth': 13, 'learning_rate': 0.00041086913379211114, 'iterations': 2774, 'l2_leaf_reg': 8.840804788421938e-08, 'border_count': 6, 'bagging_temperature': 0.05597509929031771, 'random_strength': 3.051541466554878, 'grow_policy': 'Depthwise', 'min_data_in_leaf': 60}. Best is trial 349 with value: 2072.137476888861.[0m
[32m[I 2024-10-13 10:20:11,125][0m Trial 546 finished with value: 2161.8603821653483 and parameters: {'depth': 13, 'learning_rate': 0.0005032010780019907, 'iterations': 2873, 'l2_leaf_reg': 4.267497433664859e-08, 'border_count': 15, 'bagging_temperature': 0.033001668804033754, 'random_strength': 2.7464060988662498, 'grow_policy': 'Depthwise', 'min_data_in_leaf': 37}. Best is trial 349 with value: 2072.137476888861.[0m
[32m[I 2024-10-13 10:20:17,196][0m Trial 547 finished with value: 2387.4935929017847 and parameters: {'depth': 13, 'learning_rate': 0.000709905015748534, 'iterations': 2896, 'l2_leaf_reg': 6.111009786445172e-08, 'border_count': 20, 'bagging_temperature': 0.07650066932038217, 'random_strength': 2.8989452571649577, 'grow_policy': 'Depthwise', 'min_data_in_leaf': 17}. Best is trial 349 with value: 2072.137476888861.[0m
[32m[I 2024-10-13 10:20:21,185][0m Trial 548 finished with value: 2867.044425879983 and parameters: {'depth': 13, 'learning_rate': 0.0003793508320473445, 'iterations': 2830, 'l2_leaf_reg': 1.9306175203892822e-08, 'border_count': 11, 'bagging_temperature': 0.03747544135719473, 'random_strength': 3.0962131467737573, 'grow_policy': 'Depthwise', 'min_data_in_leaf': 37}. Best is trial 349 with value: 2072.137476888861.[0m
[32m[I 2024-10-13 10:20:25,260][0m Trial 549 finished with value: 2164.698803971813 and parameters: {'depth': 12, 'learning_rate': 0.0004894150793318175, 'iterations': 2991, 'l2_leaf_reg': 3.0609575702993434e-08, 'border_count': 16, 'bagging_temperature': 0.05922796810790928, 'random_strength': 3.3719507669734137, 'grow_policy': 'Depthwise', 'min_data_in_leaf': 40}. Best is trial 349 with value: 2072.137476888861.[0m
[32m[I 2024-10-13 10:20:31,106][0m Trial 550 finished with value: 2318.8771393803886 and parameters: {'depth': 13, 'learning_rate': 0.0005647789053737005, 'iterations': 2907, 'l2_leaf_reg': 4.310241001371872e-08, 'border_count': 24, 'bagging_temperature': 0.09251591823829798, 'random_strength': 2.775556235353912, 'grow_policy': 'Depthwise', 'min_data_in_leaf': 19}. Best is trial 349 with value: 2072.137476888861.[0m
[32m[I 2024-10-13 10:20:43,552][0m Trial 551 finished with value: 3908.8078976574147 and parameters: {'depth': 13, 'learning_rate': 0.0007441707426245671, 'iterations': 2844, 'l2_leaf_reg': 1.9586751267176256e-08, 'border_count': 9, 'bagging_temperature': 0.034285918357088684, 'random_strength': 2.6973467430422238, 'grow_policy': 'Depthwise', 'min_data_in_leaf': 2}. Best is trial 349 with value: 2072.137476888861.[0m
[32m[I 2024-10-13 10:20:47,209][0m Trial 552 finished with value: 2508.452609610416 and parameters: {'depth': 13, 'learning_rate': 0.00026841662815368635, 'iterations': 2913, 'l2_leaf_reg': 9.524306645688464e-08, 'border_count': 20, 'bagging_temperature': 0.06501113529212071, 'random_strength': 2.570065624138395, 'grow_policy': 'Depthwise', 'min_data_in_leaf': 51}. Best is trial 349 with value: 2072.137476888861.[0m
[32m[I 2024-10-13 10:20:51,657][0m Trial 553 finished with value: 2192.200990385195 and parameters: {'depth': 13, 'learning_rate': 0.00044833988473740407, 'iterations': 2816, 'l2_leaf_reg': 2.7511961978443196e-08, 'border_count': 14, 'bagging_temperature': 0.04639735555699319, 'random_strength': 2.871472000637024, 'grow_policy': 'Depthwise', 'min_data_in_leaf': 33}. Best is trial 349 with value: 2072.137476888861.[0m
[32m[I 2024-10-13 10:22:12,329][0m Trial 554 finished with value: 2500.960624711155 and parameters: {'depth': 13, 'learning_rate': 0.0006520078361590076, 'iterations': 2768, 'l2_leaf_reg': 1.5149579998714497e-08, 'border_count': 29, 'bagging_temperature': 0.016509215172628086, 'random_strength': 2.4975224343472173, 'grow_policy': 'SymmetricTree', 'min_data_in_leaf': 71}. Best is trial 349 with value: 2072.137476888861.[0m
[32m[I 2024-10-13 10:22:18,023][0m Trial 555 finished with value: 2310.79605985295 and parameters: {'depth': 12, 'learning_rate': 0.0005549006067401154, 'iterations': 2946, 'l2_leaf_reg': 5.703888063929495e-08, 'border_count': 22, 'bagging_temperature': 0.0007512413708281318, 'random_strength': 9.546387548862345, 'grow_policy': 'Depthwise', 'min_data_in_leaf': 20}. Best is trial 349 with value: 2072.137476888861.[0m
[32m[I 2024-10-13 10:22:21,591][0m Trial 556 finished with value: 2884.8018550914344 and parameters: {'depth': 13, 'learning_rate': 0.00035908269569021647, 'iterations': 2870, 'l2_leaf_reg': 4.0709455336696384e-08, 'border_count': 5, 'bagging_temperature': 0.07894548707873592, 'random_strength': 2.3988375691149595, 'grow_policy': 'Depthwise', 'min_data_in_leaf': 53}. Best is trial 349 with value: 2072.137476888861.[0m
[32m[I 2024-10-13 10:22:36,149][0m Trial 557 finished with value: 2893.5824248280855 and parameters: {'depth': 13, 'learning_rate': 0.0004584138897969029, 'iterations': 2798, 'l2_leaf_reg': 2.0947847305315158e-08, 'border_count': 16, 'bagging_temperature': 0.03612301316673633, 'random_strength': 2.6475305289496394, 'grow_policy': 'Depthwise', 'min_data_in_leaf': 1}. Best is trial 349 with value: 2072.137476888861.[0m
[32m[I 2024-10-13 10:22:40,291][0m Trial 558 finished with value: 2182.6800869784065 and parameters: {'depth': 10, 'learning_rate': 0.000600594471115313, 'iterations': 2876, 'l2_leaf_reg': 1.5359237108827605e-08, 'border_count': 25, 'bagging_temperature': 0.05257137625786142, 'random_strength': 3.159329081833301, 'grow_policy': 'Depthwise', 'min_data_in_leaf': 41}. Best is trial 349 with value: 2072.137476888861.[0m
[32m[I 2024-10-13 10:22:43,449][0m Trial 559 finished with value: 2786.8232234365123 and parameters: {'depth': 11, 'learning_rate': 0.0005315551453764838, 'iterations': 2745, 'l2_leaf_reg': 3.1273587961479595e-08, 'border_count': 12, 'bagging_temperature': 0.027665258230487953, 'random_strength': 1.4918581362129577, 'grow_policy': 'Depthwise', 'min_data_in_leaf': 64}. Best is trial 349 with value: 2072.137476888861.[0m
[32m[I 2024-10-13 10:22:46,277][0m Trial 560 finished with value: 2260.0766741672737 and parameters: {'depth': 12, 'learning_rate': 0.000460321391590581, 'iterations': 2954, 'l2_leaf_reg': 6.719101857045702e-08, 'border_count': 21, 'bagging_temperature': 0.09797686202229883, 'random_strength': 2.9163311239822773, 'grow_policy': 'Depthwise', 'min_data_in_leaf': 99}. Best is trial 349 with value: 2072.137476888861.[0m
