[32m[I 2024-10-13 09:23:43,317][0m Trial 101 finished with value: 2239.5698598625727 and parameters: {'depth': 14, 'learning_rate': 0.0012159918578183366, 'iterations': 1384, 'l2_leaf_reg': 0.08267412322094543, 'border_count': 21, 'bagging_temperature': 0.8754623829937165, 'random_strength': 6.3255546149873485, 'grow_policy': 'Lossguide', 'min_data_in_leaf': 901, 'max_leaves': 84}. Best is trial 52 with value: 2182.908535006516.[0m
[32m[I 2024-10-13 09:23:46,563][0m Trial 102 finished with value: 2238.4827037478267 and parameters: {'depth': 13, 'learning_rate': 0.0010166900010824093, 'iterations': 1722, 'l2_leaf_reg': 0.2916964773177164, 'border_count': 19, 'bagging_temperature': 0.9021599304443261, 'random_strength': 7.628464798003529, 'grow_policy': 'Lossguide', 'min_data_in_leaf': 839, 'max_leaves': 80}. Best is trial 52 with value: 2182.908535006516.[0m
[32m[I 2024-10-13 09:23:50,188][0m Trial 103 finished with value: 2293.78403087443 and parameters: {'depth': 13, 'learning_rate': 0.00128773825988967, 'iterations': 1721, 'l2_leaf_reg': 1.112744122751024, 'border_count': 31, 'bagging_temperature': 0.87895143408195, 'random_strength': 7.712597856180618, 'grow_policy': 'Lossguide', 'min_data_in_leaf': 839, 'max_leaves': 80}. Best is trial 52 with value: 2182.908535006516.[0m
[32m[I 2024-10-13 09:23:53,616][0m Trial 104 finished with value: 2839.923909409644 and parameters: {'depth': 13, 'learning_rate': 0.0008368947954911817, 'iterations': 1756, 'l2_leaf_reg': 0.41832359488395415, 'border_count': 12, 'bagging_temperature': 0.8495246145060613, 'random_strength': 6.729864998213592, 'grow_policy': 'Lossguide', 'min_data_in_leaf': 986, 'max_leaves': 69}. Best is trial 52 with value: 2182.908535006516.[0m
[32m[I 2024-10-13 09:25:20,696][0m Trial 105 finished with value: 3326.95471357319 and parameters: {'depth': 13, 'learning_rate': 0.000333775277391791, 'iterations': 1861, 'l2_leaf_reg': 2.1812742069658206, 'border_count': 33, 'bagging_temperature': 0.9765986434817411, 'random_strength': 9.897511903788237, 'grow_policy': 'SymmetricTree', 'min_data_in_leaf': 894}. Best is trial 52 with value: 2182.908535006516.[0m
[32m[I 2024-10-13 09:25:28,978][0m Trial 106 finished with value: 2800.665653692241 and parameters: {'depth': 14, 'learning_rate': 0.0009375059891242459, 'iterations': 1647, 'l2_leaf_reg': 0.18753327716231577, 'border_count': 6, 'bagging_temperature': 0.9079262993317406, 'random_strength': 8.552468885177959, 'grow_policy': 'Lossguide', 'min_data_in_leaf': 942, 'max_leaves': 59}. Best is trial 52 with value: 2182.908535006516.[0m
[32m[I 2024-10-13 09:25:44,281][0m Trial 107 finished with value: 2670.086244216705 and parameters: {'depth': 13, 'learning_rate': 0.0005205185386544022, 'iterations': 1515, 'l2_leaf_reg': 0.5347975794893821, 'border_count': 26, 'bagging_temperature': 0.6240335918322778, 'random_strength': 8.458540140672483, 'grow_policy': 'Lossguide', 'min_data_in_leaf': 33, 'max_leaves': 89}. Best is trial 52 with value: 2182.908535006516.[0m
[32m[I 2024-10-13 09:25:54,716][0m Trial 108 finished with value: 2385.076752631057 and parameters: {'depth': 14, 'learning_rate': 0.0010964605946183201, 'iterations': 2206, 'l2_leaf_reg': 0.014368916553468268, 'border_count': 196, 'bagging_temperature': 0.5616736208904393, 'random_strength': 7.530734971677794, 'grow_policy': 'Lossguide', 'min_data_in_leaf': 808, 'max_leaves': 163}. Best is trial 52 with value: 2182.908535006516.[0m
[32m[I 2024-10-13 09:25:58,141][0m Trial 109 finished with value: 2313.009443807732 and parameters: {'depth': 8, 'learning_rate': 0.008494984606073978, 'iterations': 1859, 'l2_leaf_reg': 0.07718404506338473, 'border_count': 16, 'bagging_temperature': 0.042188041903845036, 'random_strength': 7.020083751082558, 'grow_policy': 'Lossguide', 'min_data_in_leaf': 759, 'max_leaves': 103}. Best is trial 52 with value: 2182.908535006516.[0m
[32m[I 2024-10-13 09:26:00,964][0m Trial 110 finished with value: 2314.066026103572 and parameters: {'depth': 3, 'learning_rate': 0.009327314766034418, 'iterations': 1374, 'l2_leaf_reg': 9.773165467698555e-06, 'border_count': 20, 'bagging_temperature': 0.5926970846649446, 'random_strength': 9.173573979316746, 'grow_policy': 'Lossguide', 'min_data_in_leaf': 917, 'max_leaves': 112}. Best is trial 52 with value: 2182.908535006516.[0m
[32m[I 2024-10-13 09:26:04,414][0m Trial 111 finished with value: 2290.7834041039955 and parameters: {'depth': 15, 'learning_rate': 0.002357487008651513, 'iterations': 1622, 'l2_leaf_reg': 0.021958079635352696, 'border_count': 18, 'bagging_temperature': 0.9435407109118431, 'random_strength': 3.8668020199042377, 'grow_policy': 'Lossguide', 'min_data_in_leaf': 870, 'max_leaves': 89}. Best is trial 52 with value: 2182.908535006516.[0m
[32m[I 2024-10-13 09:26:07,605][0m Trial 112 finished with value: 2301.763154173198 and parameters: {'depth': 15, 'learning_rate': 0.0016895237134170724, 'iterations': 1450, 'l2_leaf_reg': 0.26132490614830783, 'border_count': 26, 'bagging_temperature': 0.8636607328421432, 'random_strength': 5.846928613437024, 'grow_policy': 'Lossguide', 'min_data_in_leaf': 860, 'max_leaves': 81}. Best is trial 52 with value: 2182.908535006516.[0m
[32m[I 2024-10-13 09:26:09,839][0m Trial 113 finished with value: 3182.1747534644505 and parameters: {'depth': 15, 'learning_rate': 0.0005895374021904079, 'iterations': 1299, 'l2_leaf_reg': 0.04183797924278374, 'border_count': 5, 'bagging_temperature': 0.7244002129072782, 'random_strength': 5.48531998772849, 'grow_policy': 'Lossguide', 'min_data_in_leaf': 954, 'max_leaves': 94}. Best is trial 52 with value: 2182.908535006516.[0m
[32m[I 2024-10-13 09:26:11,974][0m Trial 114 finished with value: 4230.129064184656 and parameters: {'depth': 5, 'learning_rate': 0.00015594306527313322, 'iterations': 1027, 'l2_leaf_reg': 0.11542863807763269, 'border_count': 13, 'bagging_temperature': 0.8246601863119176, 'random_strength': 4.116812775619229, 'grow_policy': 'Lossguide', 'min_data_in_leaf': 396, 'max_leaves': 149}. Best is trial 52 with value: 2182.908535006516.[0m
[32m[I 2024-10-13 09:26:14,618][0m Trial 115 finished with value: 2272.2284806674834 and parameters: {'depth': 14, 'learning_rate': 0.005954655357188726, 'iterations': 1171, 'l2_leaf_reg': 0.0023292316380748228, 'border_count': 20, 'bagging_temperature': 0.8911697809177049, 'random_strength': 5.020490263557217, 'grow_policy': 'Lossguide', 'min_data_in_leaf': 836, 'max_leaves': 70}. Best is trial 52 with value: 2182.908535006516.[0m
[32m[I 2024-10-13 09:26:17,570][0m Trial 116 finished with value: 2390.4554461360517 and parameters: {'depth': 14, 'learning_rate': 0.0050032044784176135, 'iterations': 1532, 'l2_leaf_reg': 0.08404249867592499, 'border_count': 36, 'bagging_temperature': 0.6576675249507938, 'random_strength': 6.399170490187998, 'grow_policy': 'Lossguide', 'min_data_in_leaf': 896, 'max_leaves': 169}. Best is trial 52 with value: 2182.908535006516.[0m
[32m[I 2024-10-13 09:26:22,913][0m Trial 117 finished with value: 2509.555212342449 and parameters: {'depth': 13, 'learning_rate': 0.0073390626362293595, 'iterations': 2936, 'l2_leaf_reg': 0.008921775541609073, 'border_count': 57, 'bagging_temperature': 0.971858374920803, 'random_strength': 7.91069795238355, 'grow_policy': 'Lossguide', 'min_data_in_leaf': 923, 'max_leaves': 76}. Best is trial 52 with value: 2182.908535006516.[0m
[32m[I 2024-10-13 09:26:24,922][0m Trial 118 finished with value: 2941.3544067472944 and parameters: {'depth': 15, 'learning_rate': 0.0025964109059525594, 'iterations': 1356, 'l2_leaf_reg': 0.03077733296601836, 'border_count': 9, 'bagging_temperature': 0.7695221872014658, 'random_strength': 2.033749329326298, 'grow_policy': 'Lossguide', 'min_data_in_leaf': 980, 'max_leaves': 99}. Best is trial 52 with value: 2182.908535006516.[0m
[32m[I 2024-10-13 09:31:42,696][0m Trial 119 finished with value: 2676.011196725903 and parameters: {'depth': 15, 'learning_rate': 0.0014431583885920643, 'iterations': 1722, 'l2_leaf_reg': 0.2542625924103341, 'border_count': 101, 'bagging_temperature': 0.14876314717921912, 'random_strength': 2.85660758967825, 'grow_policy': 'SymmetricTree', 'min_data_in_leaf': 731}. Best is trial 52 with value: 2182.908535006516.[0m
[32m[I 2024-10-13 09:31:45,722][0m Trial 120 finished with value: 2341.739104245609 and parameters: {'depth': 14, 'learning_rate': 0.002063802984930976, 'iterations': 1582, 'l2_leaf_reg': 0.0007369277332282834, 'border_count': 27, 'bagging_temperature': 0.8063905655803583, 'random_strength': 3.69685791909198, 'grow_policy': 'Depthwise', 'min_data_in_leaf': 467}. Best is trial 52 with value: 2182.908535006516.[0m
[32m[I 2024-10-13 09:31:48,688][0m Trial 121 finished with value: 2254.9989495949208 and parameters: {'depth': 14, 'learning_rate': 0.0011259882148286014, 'iterations': 1435, 'l2_leaf_reg': 0.05108661739408732, 'border_count': 23, 'bagging_temperature': 0.8965356712003768, 'random_strength': 6.163154016272978, 'grow_policy': 'Lossguide', 'min_data_in_leaf': 906, 'max_leaves': 84}. Best is trial 52 with value: 2182.908535006516.[0m
[32m[I 2024-10-13 09:31:51,310][0m Trial 122 finished with value: 2449.550756135687 and parameters: {'depth': 14, 'learning_rate': 0.0007238796222182658, 'iterations': 1498, 'l2_leaf_reg': 0.059090984231062356, 'border_count': 21, 'bagging_temperature': 0.9215051777607234, 'random_strength': 6.670261895675289, 'grow_policy': 'Lossguide', 'min_data_in_leaf': 879, 'max_leaves': 87}. Best is trial 52 with value: 2182.908535006516.[0m
[32m[I 2024-10-13 09:31:53,900][0m Trial 123 finished with value: 2322.8308158396358 and parameters: {'depth': 13, 'learning_rate': 0.0010905726851946215, 'iterations': 1195, 'l2_leaf_reg': 1.412059921941205e-05, 'border_count': 14, 'bagging_temperature': 0.8691413195601574, 'random_strength': 4.803333584378355, 'grow_policy': 'Lossguide', 'min_data_in_leaf': 940, 'max_leaves': 67}. Best is trial 52 with value: 2182.908535006516.[0m
[32m[I 2024-10-13 09:31:57,244][0m Trial 124 finished with value: 2401.181651863715 and parameters: {'depth': 15, 'learning_rate': 0.003735225003595943, 'iterations': 1698, 'l2_leaf_reg': 0.0018038709860757082, 'border_count': 34, 'bagging_temperature': 0.9010486649908129, 'random_strength': 5.638541149180815, 'grow_policy': 'Lossguide', 'min_data_in_leaf': 912, 'max_leaves': 103}. Best is trial 52 with value: 2182.908535006516.[0m
[32m[I 2024-10-13 09:32:00,580][0m Trial 125 finished with value: 2394.570627006883 and parameters: {'depth': 12, 'learning_rate': 0.004355396634956419, 'iterations': 1620, 'l2_leaf_reg': 0.0036426338116854074, 'border_count': 40, 'bagging_temperature': 0.8296006117002223, 'random_strength': 7.245399022754348, 'grow_policy': 'Lossguide', 'min_data_in_leaf': 815, 'max_leaves': 83}. Best is trial 52 with value: 2182.908535006516.[0m
[32m[I 2024-10-13 09:32:03,211][0m Trial 126 finished with value: 3666.4675131307627 and parameters: {'depth': 6, 'learning_rate': 0.006204503375022854, 'iterations': 1441, 'l2_leaf_reg': 0.011711859930676097, 'border_count': 1, 'bagging_temperature': 0.932291653565492, 'random_strength': 4.3121406145323595, 'grow_policy': 'Lossguide', 'min_data_in_leaf': 997, 'max_leaves': 188}. Best is trial 52 with value: 2182.908535006516.[0m
[32m[I 2024-10-13 09:32:05,911][0m Trial 127 finished with value: 2237.63860396752 and parameters: {'depth': 15, 'learning_rate': 0.0032360608046158195, 'iterations': 1317, 'l2_leaf_reg': 3.737265517760008e-06, 'border_count': 16, 'bagging_temperature': 0.5943007511436248, 'random_strength': 6.2566639636661865, 'grow_policy': 'Lossguide', 'min_data_in_leaf': 850, 'max_leaves': 240}. Best is trial 52 with value: 2182.908535006516.[0m
[32m[I 2024-10-13 09:32:09,151][0m Trial 128 finished with value: 3201.1312790899565 and parameters: {'depth': 14, 'learning_rate': 0.000437973426856475, 'iterations': 1795, 'l2_leaf_reg': 7.532026894433864e-06, 'border_count': 8, 'bagging_temperature': 0.5454738100271432, 'random_strength': 6.07670504280768, 'grow_policy': 'Lossguide', 'min_data_in_leaf': 787, 'max_leaves': 240}. Best is trial 52 with value: 2182.908535006516.[0m
[32m[I 2024-10-13 09:32:11,288][0m Trial 129 finished with value: 2330.1678680775185 and parameters: {'depth': 13, 'learning_rate': 0.005207951633763793, 'iterations': 933, 'l2_leaf_reg': 3.7771156204342676e-06, 'border_count': 26, 'bagging_temperature': 0.6166632823992262, 'random_strength': 0.30309353441802456, 'grow_policy': 'Lossguide', 'min_data_in_leaf': 852, 'max_leaves': 212}. Best is trial 52 with value: 2182.908535006516.[0m
[32m[I 2024-10-13 09:32:14,459][0m Trial 130 finished with value: 2302.67759365582 and parameters: {'depth': 14, 'learning_rate': 0.010234455849748693, 'iterations': 1581, 'l2_leaf_reg': 1.4731106426682785e-06, 'border_count': 14, 'bagging_temperature': 0.5875820458092241, 'random_strength': 6.345881491315577, 'grow_policy': 'Depthwise', 'min_data_in_leaf': 672}. Best is trial 52 with value: 2182.908535006516.[0m
[32m[I 2024-10-13 09:32:17,425][0m Trial 131 finished with value: 2265.0335001261947 and parameters: {'depth': 15, 'learning_rate': 0.0026981939222168643, 'iterations': 1319, 'l2_leaf_reg': 2.1931343170330335e-05, 'border_count': 21, 'bagging_temperature': 0.5154436189238227, 'random_strength': 5.319325971906125, 'grow_policy': 'Lossguide', 'min_data_in_leaf': 884, 'max_leaves': 93}. Best is trial 52 with value: 2182.908535006516.[0m
[32m[I 2024-10-13 09:32:19,907][0m Trial 132 finished with value: 2285.5592123062615 and parameters: {'depth': 15, 'learning_rate': 0.002889260529971069, 'iterations': 1242, 'l2_leaf_reg': 6.030807256435192e-06, 'border_count': 23, 'bagging_temperature': 0.5262044865699129, 'random_strength': 5.347783080624284, 'grow_policy': 'Lossguide', 'min_data_in_leaf': 966, 'max_leaves': 248}. Best is trial 52 with value: 2182.908535006516.[0m
[32m[I 2024-10-13 09:32:22,502][0m Trial 133 finished with value: 2326.8107642250015 and parameters: {'depth': 15, 'learning_rate': 0.003483737453065511, 'iterations': 1363, 'l2_leaf_reg': 1.9798504055914493e-05, 'border_count': 30, 'bagging_temperature': 0.4734897766846315, 'random_strength': 6.230953201592058, 'grow_policy': 'Lossguide', 'min_data_in_leaf': 910, 'max_leaves': 231}. Best is trial 52 with value: 2182.908535006516.[0m
[32m[I 2024-10-13 09:32:25,459][0m Trial 134 finished with value: 2296.4195233601486 and parameters: {'depth': 14, 'learning_rate': 0.007695443591754736, 'iterations': 1907, 'l2_leaf_reg': 2.34566290770354e-05, 'border_count': 16, 'bagging_temperature': 0.5029075139270656, 'random_strength': 6.61536144931292, 'grow_policy': 'Lossguide', 'min_data_in_leaf': 937, 'max_leaves': 90}. Best is trial 52 with value: 2182.908535006516.[0m
[32m[I 2024-10-13 09:32:27,367][0m Trial 135 finished with value: 2979.5510078799316 and parameters: {'depth': 15, 'learning_rate': 0.004263409665020796, 'iterations': 1121, 'l2_leaf_reg': 1.1764008239189395e-05, 'border_count': 9, 'bagging_temperature': 0.5497571967652258, 'random_strength': 5.8401402849006345, 'grow_policy': 'Lossguide', 'min_data_in_leaf': 884, 'max_leaves': 77}. Best is trial 52 with value: 2182.908535006516.[0m
[32m[I 2024-10-13 09:32:29,629][0m Trial 136 finished with value: 2293.5092834371517 and parameters: {'depth': 9, 'learning_rate': 0.0058535776429788165, 'iterations': 1419, 'l2_leaf_reg': 7.766843358873462e-05, 'border_count': 22, 'bagging_temperature': 0.6386587602717998, 'random_strength': 4.595271674968053, 'grow_policy': 'Lossguide', 'min_data_in_leaf': 833, 'max_leaves': 130}. Best is trial 52 with value: 2182.908535006516.[0m
[32m[I 2024-10-13 09:32:31,324][0m Trial 137 finished with value: 2470.6948920604145 and parameters: {'depth': 15, 'learning_rate': 0.00475629831235613, 'iterations': 1024, 'l2_leaf_reg': 1.6452764785254093, 'border_count': 247, 'bagging_temperature': 0.59865833086441, 'random_strength': 4.041818079379961, 'grow_policy': 'Lossguide', 'min_data_in_leaf': 898, 'max_leaves': 48}. Best is trial 52 with value: 2182.908535006516.[0m
[32m[I 2024-10-13 09:32:34,532][0m Trial 138 finished with value: 2869.8146492720934 and parameters: {'depth': 14, 'learning_rate': 0.0015204152182239285, 'iterations': 1664, 'l2_leaf_reg': 0.6533235629516866, 'border_count': 3, 'bagging_temperature': 0.5562455293584943, 'random_strength': 6.995611800131137, 'grow_policy': 'Lossguide', 'min_data_in_leaf': 957, 'max_leaves': 63}. Best is trial 52 with value: 2182.908535006516.[0m
[32m[I 2024-10-13 09:32:37,072][0m Trial 139 finished with value: 2306.954681104709 and parameters: {'depth': 15, 'learning_rate': 0.0031783765169390256, 'iterations': 1529, 'l2_leaf_reg': 3.643598496705826e-05, 'border_count': 32, 'bagging_temperature': 0.029956443802775207, 'random_strength': 5.691705322676847, 'grow_policy': 'Lossguide', 'min_data_in_leaf': 853, 'max_leaves': 137}. Best is trial 52 with value: 2182.908535006516.[0m
[32m[I 2024-10-13 09:32:39,475][0m Trial 140 finished with value: 2346.0979736400222 and parameters: {'depth': 11, 'learning_rate': 0.0012066598094548555, 'iterations': 1326, 'l2_leaf_reg': 0.1721001855292733, 'border_count': 46, 'bagging_temperature': 0.5298314733993175, 'random_strength': 5.2608067863464205, 'grow_policy': 'Lossguide', 'min_data_in_leaf': 927, 'max_leaves': 109}. Best is trial 52 with value: 2182.908535006516.[0m
[32m[I 2024-10-13 09:32:42,134][0m Trial 141 finished with value: 2266.5613420154355 and parameters: {'depth': 15, 'learning_rate': 0.002351146436785675, 'iterations': 1292, 'l2_leaf_reg': 0.10289056630223092, 'border_count': 19, 'bagging_temperature': 0.6721724807235563, 'random_strength': 4.984903504317768, 'grow_policy': 'Lossguide', 'min_data_in_leaf': 869, 'max_leaves': 97}. Best is trial 52 with value: 2182.908535006516.[0m
[32m[I 2024-10-13 09:32:44,211][0m Trial 142 finished with value: 2226.714557891161 and parameters: {'depth': 15, 'learning_rate': 0.0019175883156016993, 'iterations': 1265, 'l2_leaf_reg': 0.3391594915372813, 'border_count': 16, 'bagging_temperature': 0.6645646794381279, 'random_strength': 4.898476668293725, 'grow_policy': 'Lossguide', 'min_data_in_leaf': 882, 'max_leaves': 114}. Best is trial 52 with value: 2182.908535006516.[0m
[32m[I 2024-10-13 09:32:46,580][0m Trial 143 finished with value: 2847.443679886429 and parameters: {'depth': 15, 'learning_rate': 0.002812035128597982, 'iterations': 1195, 'l2_leaf_reg': 0.0002075173173390237, 'border_count': 11, 'bagging_temperature': 0.6272450941817354, 'random_strength': 4.779484667902233, 'grow_policy': 'Lossguide', 'min_data_in_leaf': 900, 'max_leaves': 104}. Best is trial 52 with value: 2182.908535006516.[0m
[32m[I 2024-10-13 09:32:47,643][0m Trial 144 finished with value: 3920.8400155458608 and parameters: {'depth': 14, 'learning_rate': 0.0009477916465344938, 'iterations': 266, 'l2_leaf_reg': 0.25799333631931787, 'border_count': 15, 'bagging_temperature': 0.7077844444584389, 'random_strength': 4.430977824861811, 'grow_policy': 'Lossguide', 'min_data_in_leaf': 821, 'max_leaves': 73}. Best is trial 52 with value: 2182.908535006516.[0m
[32m[I 2024-10-13 09:32:48,539][0m Trial 145 finished with value: 2819.521522551639 and parameters: {'depth': 15, 'learning_rate': 0.003938707461220102, 'iterations': 182, 'l2_leaf_reg': 7.893653689610297e-06, 'border_count': 26, 'bagging_temperature': 0.5708186932355606, 'random_strength': 3.9510921654439337, 'grow_policy': 'Lossguide', 'min_data_in_leaf': 516, 'max_leaves': 86}. Best is trial 52 with value: 2182.908535006516.[0m
[32m[I 2024-10-13 09:32:49,829][0m Trial 146 finished with value: 3305.5908303428696 and parameters: {'depth': 14, 'learning_rate': 0.0018666290577336135, 'iterations': 357, 'l2_leaf_reg': 0.3516780330118626, 'border_count': 6, 'bagging_temperature': 0.6454548530170277, 'random_strength': 3.3112682531409154, 'grow_policy': 'Lossguide', 'min_data_in_leaf': 882, 'max_leaves': 80}. Best is trial 52 with value: 2182.908535006516.[0m
[32m[I 2024-10-13 09:32:52,002][0m Trial 147 finished with value: 2515.7290354743636 and parameters: {'depth': 8, 'learning_rate': 0.008361230178710276, 'iterations': 1409, 'l2_leaf_reg': 0.6215124792917962, 'border_count': 140, 'bagging_temperature': 0.9967154012836605, 'random_strength': 5.927004552634036, 'grow_policy': 'Depthwise', 'min_data_in_leaf': 802}. Best is trial 52 with value: 2182.908535006516.[0m
[32m[I 2024-10-13 09:32:54,942][0m Trial 148 finished with value: 2297.405494407155 and parameters: {'depth': 15, 'learning_rate': 0.006694270389115627, 'iterations': 1491, 'l2_leaf_reg': 2.9755293307685024e-06, 'border_count': 18, 'bagging_temperature': 0.9670583314018196, 'random_strength': 4.286906354442678, 'grow_policy': 'Lossguide', 'min_data_in_leaf': 923, 'max_leaves': 116}. Best is trial 52 with value: 2182.908535006516.[0m
[32m[I 2024-10-13 09:33:37,124][0m Trial 149 finished with value: 2830.620082371833 and parameters: {'depth': 15, 'learning_rate': 0.0013497359805424024, 'iterations': 1819, 'l2_leaf_reg': 0.006935779456694897, 'border_count': 12, 'bagging_temperature': 0.6044881146390628, 'random_strength': 0.9735472483820785, 'grow_policy': 'SymmetricTree', 'min_data_in_leaf': 844}. Best is trial 52 with value: 2182.908535006516.[0m
[32m[I 2024-10-13 09:33:38,936][0m Trial 150 finished with value: 2805.0214373225426 and parameters: {'depth': 12, 'learning_rate': 0.0008307225571700334, 'iterations': 879, 'l2_leaf_reg': 0.14875899364481168, 'border_count': 29, 'bagging_temperature': 0.09469942332000439, 'random_strength': 5.461154753524545, 'grow_policy': 'Lossguide', 'min_data_in_leaf': 947, 'max_leaves': 92}. Best is trial 52 with value: 2182.908535006516.[0m
