[32m[I 2024-10-13 09:19:43,329][0m Trial 51 finished with value: 2404.712483121764 and parameters: {'depth': 8, 'learning_rate': 0.011488040568293709, 'iterations': 418, 'l2_leaf_reg': 9.979477750967386e-07, 'border_count': 36, 'bagging_temperature': 0.35426860548444744, 'random_strength': 3.057732181015778, 'grow_policy': 'SymmetricTree', 'min_data_in_leaf': 997}. Best is trial 42 with value: 2186.4122490727964.[0m
[32m[I 2024-10-13 09:19:44,239][0m Trial 52 finished with value: 2182.908535006516 and parameters: {'depth': 10, 'learning_rate': 0.007453973057216416, 'iterations': 244, 'l2_leaf_reg': 6.662285530050633e-06, 'border_count': 13, 'bagging_temperature': 0.20304649998361096, 'random_strength': 2.7423718146297587, 'grow_policy': 'Lossguide', 'min_data_in_leaf': 887, 'max_leaves': 164}. Best is trial 52 with value: 2182.908535006516.[0m
[32m[I 2024-10-13 09:19:45,129][0m Trial 53 finished with value: 2890.692665636789 and parameters: {'depth': 10, 'learning_rate': 0.006994630643466742, 'iterations': 219, 'l2_leaf_reg': 3.827220334527474e-05, 'border_count': 9, 'bagging_temperature': 0.20511806755070025, 'random_strength': 1.3971272402016415, 'grow_policy': 'Depthwise', 'min_data_in_leaf': 910}. Best is trial 52 with value: 2182.908535006516.[0m
[32m[I 2024-10-13 09:19:46,801][0m Trial 54 finished with value: 2382.121306653602 and parameters: {'depth': 12, 'learning_rate': 0.02516608597559403, 'iterations': 644, 'l2_leaf_reg': 5.486159664292903e-06, 'border_count': 24, 'bagging_temperature': 0.23443971917649742, 'random_strength': 2.1028566872475607, 'grow_policy': 'Lossguide', 'min_data_in_leaf': 803, 'max_leaves': 187}. Best is trial 52 with value: 2182.908535006516.[0m
[32m[I 2024-10-13 09:19:47,990][0m Trial 55 finished with value: 2794.104993370722 and parameters: {'depth': 11, 'learning_rate': 0.003987847553300759, 'iterations': 497, 'l2_leaf_reg': 9.525103797863755e-06, 'border_count': 5, 'bagging_temperature': 0.3426861525683264, 'random_strength': 0.5850477420493045, 'grow_policy': 'Lossguide', 'min_data_in_leaf': 856, 'max_leaves': 170}. Best is trial 52 with value: 2182.908535006516.[0m
[32m[I 2024-10-13 09:19:49,048][0m Trial 56 finished with value: 3315.557163387946 and parameters: {'depth': 9, 'learning_rate': 0.001969083026980936, 'iterations': 245, 'l2_leaf_reg': 1.8909036569807963e-06, 'border_count': 54, 'bagging_temperature': 0.41274515453689764, 'random_strength': 2.3091637691824216, 'grow_policy': 'Depthwise', 'min_data_in_leaf': 938}. Best is trial 52 with value: 2182.908535006516.[0m
[32m[I 2024-10-13 09:19:50,581][0m Trial 57 finished with value: 2467.359465756168 and parameters: {'depth': 10, 'learning_rate': 0.01567793831994795, 'iterations': 636, 'l2_leaf_reg': 0.001288025145649282, 'border_count': 28, 'bagging_temperature': 0.18691491055621412, 'random_strength': 1.125476066447927, 'grow_policy': 'Lossguide', 'min_data_in_leaf': 643, 'max_leaves': 210}. Best is trial 52 with value: 2182.908535006516.[0m
[32m[I 2024-10-13 09:19:59,708][0m Trial 58 finished with value: 2658.7283130817555 and parameters: {'depth': 13, 'learning_rate': 0.005495977739019182, 'iterations': 417, 'l2_leaf_reg': 0.00011682177403505099, 'border_count': 14, 'bagging_temperature': 0.2867683253532335, 'random_strength': 2.6979241848934654, 'grow_policy': 'SymmetricTree', 'min_data_in_leaf': 609}. Best is trial 52 with value: 2182.908535006516.[0m
[32m[I 2024-10-13 09:20:00,649][0m Trial 59 finished with value: 2249.641271287267 and parameters: {'depth': 12, 'learning_rate': 0.008937020519993523, 'iterations': 192, 'l2_leaf_reg': 1.973310419942149e-05, 'border_count': 31, 'bagging_temperature': 0.5022532534603728, 'random_strength': 3.993448428579734, 'grow_policy': 'Lossguide', 'min_data_in_leaf': 933, 'max_leaves': 149}. Best is trial 52 with value: 2182.908535006516.[0m
[32m[I 2024-10-13 09:20:01,861][0m Trial 60 finished with value: 2431.9938636405036 and parameters: {'depth': 14, 'learning_rate': 0.008224131601731879, 'iterations': 152, 'l2_leaf_reg': 2.8560006787670277e-05, 'border_count': 49, 'bagging_temperature': 0.49329756077422193, 'random_strength': 3.4017511770255853, 'grow_policy': 'Lossguide', 'min_data_in_leaf': 965, 'max_leaves': 144}. Best is trial 52 with value: 2182.908535006516.[0m
[32m[I 2024-10-13 09:20:03,020][0m Trial 61 finished with value: 2436.8915131898057 and parameters: {'depth': 12, 'learning_rate': 0.0037334408678270483, 'iterations': 288, 'l2_leaf_reg': 1.413721545363818e-05, 'border_count': 32, 'bagging_temperature': 0.4614143891652288, 'random_strength': 3.9202445969771436, 'grow_policy': 'Lossguide', 'min_data_in_leaf': 866, 'max_leaves': 161}. Best is trial 52 with value: 2182.908535006516.[0m
[32m[I 2024-10-13 09:20:04,609][0m Trial 62 finished with value: 2284.366280033426 and parameters: {'depth': 12, 'learning_rate': 0.011656193111517025, 'iterations': 568, 'l2_leaf_reg': 1.560088363601128e-06, 'border_count': 19, 'bagging_temperature': 0.4362398971420981, 'random_strength': 4.504044093520309, 'grow_policy': 'Lossguide', 'min_data_in_leaf': 918, 'max_leaves': 119}. Best is trial 52 with value: 2182.908535006516.[0m
[32m[I 2024-10-13 09:20:08,241][0m Trial 63 finished with value: 2272.106676736976 and parameters: {'depth': 14, 'learning_rate': 0.01309738779664593, 'iterations': 721, 'l2_leaf_reg': 4.873371347323096e-05, 'border_count': 17, 'bagging_temperature': 0.43081143846991615, 'random_strength': 4.2411544489269115, 'grow_policy': 'Lossguide', 'min_data_in_leaf': 922, 'max_leaves': 123}. Best is trial 52 with value: 2182.908535006516.[0m
[32m[I 2024-10-13 09:20:11,770][0m Trial 64 finished with value: 2544.280536242024 and parameters: {'depth': 14, 'learning_rate': 0.035193467787529575, 'iterations': 593, 'l2_leaf_reg': 5.273605749686783e-05, 'border_count': 62, 'bagging_temperature': 0.4346225954004742, 'random_strength': 5.1425578823133655, 'grow_policy': 'Lossguide', 'min_data_in_leaf': 930, 'max_leaves': 111}. Best is trial 52 with value: 2182.908535006516.[0m
[32m[I 2024-10-13 09:20:13,781][0m Trial 65 finished with value: 2350.685483545585 and parameters: {'depth': 14, 'learning_rate': 0.012862393578102371, 'iterations': 365, 'l2_leaf_reg': 0.00015093943392381127, 'border_count': 37, 'bagging_temperature': 0.5451118672362133, 'random_strength': 4.540108601902919, 'grow_policy': 'Lossguide', 'min_data_in_leaf': 878, 'max_leaves': 151}. Best is trial 52 with value: 2182.908535006516.[0m
[32m[I 2024-10-13 09:20:15,571][0m Trial 66 finished with value: 2851.1414159600376 and parameters: {'depth': 13, 'learning_rate': 0.02192416193464587, 'iterations': 204, 'l2_leaf_reg': 2.0113020531750347e-05, 'border_count': 6, 'bagging_temperature': 0.08716983972106808, 'random_strength': 4.1443655469526, 'grow_policy': 'Lossguide', 'min_data_in_leaf': 967, 'max_leaves': 91}. Best is trial 52 with value: 2182.908535006516.[0m
[32m[I 2024-10-13 09:20:18,597][0m Trial 67 finished with value: 2396.7473275761536 and parameters: {'depth': 11, 'learning_rate': 0.008858573204224106, 'iterations': 708, 'l2_leaf_reg': 0.00032999062523632816, 'border_count': 69, 'bagging_temperature': 0.698710040508283, 'random_strength': 3.794018970562502, 'grow_policy': 'Lossguide', 'min_data_in_leaf': 828, 'max_leaves': 206}. Best is trial 52 with value: 2182.908535006516.[0m
[32m[I 2024-10-13 09:20:23,830][0m Trial 68 finished with value: 2546.5459186574526 and parameters: {'depth': 12, 'learning_rate': 0.014978224268410023, 'iterations': 854, 'l2_leaf_reg': 7.690437064565698e-05, 'border_count': 85, 'bagging_temperature': 0.5137279863155255, 'random_strength': 4.278717111944907, 'grow_policy': 'Depthwise', 'min_data_in_leaf': 900}. Best is trial 52 with value: 2182.908535006516.[0m
[32m[I 2024-10-13 09:20:25,061][0m Trial 69 finished with value: 2308.1833607908097 and parameters: {'depth': 14, 'learning_rate': 0.06610001038110322, 'iterations': 108, 'l2_leaf_reg': 0.001118700404666211, 'border_count': 22, 'bagging_temperature': 0.4251343285752449, 'random_strength': 4.734470101534326, 'grow_policy': 'Lossguide', 'min_data_in_leaf': 979, 'max_leaves': 120}. Best is trial 52 with value: 2182.908535006516.[0m
[32m[I 2024-10-13 09:20:27,193][0m Trial 70 finished with value: 2701.4068899228782 and parameters: {'depth': 15, 'learning_rate': 0.10554150345408413, 'iterations': 199, 'l2_leaf_reg': 0.0026132138768396257, 'border_count': 175, 'bagging_temperature': 0.5770808725349434, 'random_strength': 4.877269477159132, 'grow_policy': 'Lossguide', 'min_data_in_leaf': 976, 'max_leaves': 120}. Best is trial 52 with value: 2182.908535006516.[0m
[32m[I 2024-10-13 09:20:28,434][0m Trial 71 finished with value: 2385.174104089843 and parameters: {'depth': 14, 'learning_rate': 0.0789199102069131, 'iterations': 307, 'l2_leaf_reg': 0.0009309189453012332, 'border_count': 17, 'bagging_temperature': 0.382235555229003, 'random_strength': 5.188352995253056, 'grow_policy': 'Lossguide', 'min_data_in_leaf': 928, 'max_leaves': 137}. Best is trial 52 with value: 2182.908535006516.[0m
[32m[I 2024-10-13 09:20:32,388][0m Trial 72 finished with value: 2863.4755229067546 and parameters: {'depth': 13, 'learning_rate': 0.27916927809859454, 'iterations': 532, 'l2_leaf_reg': 0.01724338432606531, 'border_count': 24, 'bagging_temperature': 0.48340922337163206, 'random_strength': 5.509157566791014, 'grow_policy': 'Lossguide', 'min_data_in_leaf': 954, 'max_leaves': 100}. Best is trial 52 with value: 2182.908535006516.[0m
[32m[I 2024-10-13 09:20:33,773][0m Trial 73 finished with value: 2353.4324166803312 and parameters: {'depth': 12, 'learning_rate': 0.01799345406551581, 'iterations': 135, 'l2_leaf_reg': 0.00041125038335118223, 'border_count': 43, 'bagging_temperature': 0.41499819861129805, 'random_strength': 4.592170517450082, 'grow_policy': 'Lossguide', 'min_data_in_leaf': 881, 'max_leaves': 118}. Best is trial 52 with value: 2182.908535006516.[0m
[32m[I 2024-10-13 09:20:36,604][0m Trial 74 finished with value: 3696.9428789252474 and parameters: {'depth': 11, 'learning_rate': 0.0060984084807807135, 'iterations': 406, 'l2_leaf_reg': 3.467244408641103e-05, 'border_count': 1, 'bagging_temperature': 0.4418259666212533, 'random_strength': 3.5723077021520426, 'grow_policy': 'Lossguide', 'min_data_in_leaf': 778, 'max_leaves': 155}. Best is trial 52 with value: 2182.908535006516.[0m
[32m[I 2024-10-13 09:20:39,139][0m Trial 75 finished with value: 2406.0083152258594 and parameters: {'depth': 15, 'learning_rate': 0.029558992942170802, 'iterations': 313, 'l2_leaf_reg': 6.764190294724348e-06, 'border_count': 29, 'bagging_temperature': 0.3144188384470232, 'random_strength': 5.804007522628353, 'grow_policy': 'Lossguide', 'min_data_in_leaf': 998, 'max_leaves': 174}. Best is trial 52 with value: 2182.908535006516.[0m
[32m[I 2024-10-13 09:20:41,328][0m Trial 76 finished with value: 2492.035867333629 and parameters: {'depth': 14, 'learning_rate': 0.059038745193945016, 'iterations': 558, 'l2_leaf_reg': 4.947198379670141, 'border_count': 20, 'bagging_temperature': 0.636948311846341, 'random_strength': 3.271451404363315, 'grow_policy': 'Lossguide', 'min_data_in_leaf': 828, 'max_leaves': 138}. Best is trial 52 with value: 2182.908535006516.[0m
[32m[I 2024-10-13 09:20:42,630][0m Trial 77 finished with value: 2952.6587659528313 and parameters: {'depth': 13, 'learning_rate': 0.011243322056864851, 'iterations': 104, 'l2_leaf_reg': 3.0251903841661935e-06, 'border_count': 10, 'bagging_temperature': 0.5227437199197497, 'random_strength': 6.398636055820424, 'grow_policy': 'Lossguide', 'min_data_in_leaf': 915, 'max_leaves': 77}. Best is trial 52 with value: 2182.908535006516.[0m
[32m[I 2024-10-13 09:20:44,093][0m Trial 78 finished with value: 2298.963197463486 and parameters: {'depth': 12, 'learning_rate': 0.006951771562832928, 'iterations': 438, 'l2_leaf_reg': 0.0046222928897806, 'border_count': 36, 'bagging_temperature': 0.37552823772988003, 'random_strength': 4.099684809685756, 'grow_policy': 'Depthwise', 'min_data_in_leaf': 953}. Best is trial 52 with value: 2182.908535006516.[0m
[32m[I 2024-10-13 09:20:49,129][0m Trial 79 finished with value: 2254.729872386016 and parameters: {'depth': 15, 'learning_rate': 0.004680873426024906, 'iterations': 1015, 'l2_leaf_reg': 0.0048498625619621495, 'border_count': 19, 'bagging_temperature': 0.5625600159659776, 'random_strength': 3.9516276879955896, 'grow_policy': 'Lossguide', 'min_data_in_leaf': 949, 'max_leaves': 106}. Best is trial 52 with value: 2182.908535006516.[0m
[32m[I 2024-10-13 09:22:14,827][0m Trial 80 finished with value: 2581.6918923091935 and parameters: {'depth': 15, 'learning_rate': 0.0050542362921528455, 'iterations': 690, 'l2_leaf_reg': 0.012866511995303932, 'border_count': 43, 'bagging_temperature': 0.5672330973136867, 'random_strength': 4.003641772587049, 'grow_policy': 'SymmetricTree', 'min_data_in_leaf': 886}. Best is trial 52 with value: 2182.908535006516.[0m
[32m[I 2024-10-13 09:22:17,648][0m Trial 81 finished with value: 2286.975576970892 and parameters: {'depth': 15, 'learning_rate': 0.00759198408002759, 'iterations': 1710, 'l2_leaf_reg': 0.004832053607409267, 'border_count': 16, 'bagging_temperature': 0.6107909996395395, 'random_strength': 4.446740762053895, 'grow_policy': 'Lossguide', 'min_data_in_leaf': 966, 'max_leaves': 98}. Best is trial 52 with value: 2182.908535006516.[0m
[32m[I 2024-10-13 09:22:21,780][0m Trial 82 finished with value: 2248.5945861880696 and parameters: {'depth': 15, 'learning_rate': 0.0066231811206535094, 'iterations': 1536, 'l2_leaf_reg': 0.004199240611975139, 'border_count': 16, 'bagging_temperature': 0.631876080929097, 'random_strength': 4.425818245944792, 'grow_policy': 'Lossguide', 'min_data_in_leaf': 947, 'max_leaves': 81}. Best is trial 52 with value: 2182.908535006516.[0m
[32m[I 2024-10-13 09:22:25,969][0m Trial 83 finished with value: 3037.200004112047 and parameters: {'depth': 15, 'learning_rate': 0.004438717132346758, 'iterations': 1997, 'l2_leaf_reg': 0.024867185668051673, 'border_count': 8, 'bagging_temperature': 0.7965335218000673, 'random_strength': 4.37579709773958, 'grow_policy': 'Lossguide', 'min_data_in_leaf': 906, 'max_leaves': 84}. Best is trial 52 with value: 2182.908535006516.[0m
[32m[I 2024-10-13 09:22:32,889][0m Trial 84 finished with value: 2247.2166968355 and parameters: {'depth': 15, 'learning_rate': 0.0035243507595970644, 'iterations': 1811, 'l2_leaf_reg': 0.005440923035251704, 'border_count': 16, 'bagging_temperature': 0.6884129792732226, 'random_strength': 3.657907282948927, 'grow_policy': 'Lossguide', 'min_data_in_leaf': 950, 'max_leaves': 102}. Best is trial 52 with value: 2182.908535006516.[0m
[32m[I 2024-10-13 09:22:42,268][0m Trial 85 finished with value: 2361.743816162662 and parameters: {'depth': 15, 'learning_rate': 0.0033526216002432007, 'iterations': 1807, 'l2_leaf_reg': 0.008637537098318526, 'border_count': 30, 'bagging_temperature': 0.6608904956306056, 'random_strength': 3.570094186115268, 'grow_policy': 'Lossguide', 'min_data_in_leaf': 845, 'max_leaves': 108}. Best is trial 52 with value: 2182.908535006516.[0m
[32m[I 2024-10-13 09:22:46,504][0m Trial 86 finished with value: 2894.726077945378 and parameters: {'depth': 14, 'learning_rate': 0.011502302700263325, 'iterations': 1463, 'l2_leaf_reg': 0.04557102826081322, 'border_count': 5, 'bagging_temperature': 0.6859489360895066, 'random_strength': 3.789452736696556, 'grow_policy': 'Lossguide', 'min_data_in_leaf': 933, 'max_leaves': 84}. Best is trial 52 with value: 2182.908535006516.[0m
[32m[I 2024-10-13 09:22:53,413][0m Trial 87 finished with value: 2268.0513523454138 and parameters: {'depth': 15, 'learning_rate': 0.002272522285250739, 'iterations': 1312, 'l2_leaf_reg': 0.030466590979583166, 'border_count': 19, 'bagging_temperature': 0.7983358324899146, 'random_strength': 5.074519123592085, 'grow_policy': 'Lossguide', 'min_data_in_leaf': 869, 'max_leaves': 95}. Best is trial 52 with value: 2182.908535006516.[0m
[32m[I 2024-10-13 09:22:59,953][0m Trial 88 finished with value: 2852.1025817405725 and parameters: {'depth': 15, 'learning_rate': 0.0021797886598949, 'iterations': 1563, 'l2_leaf_reg': 0.4637658383770461, 'border_count': 12, 'bagging_temperature': 0.8234712910346869, 'random_strength': 4.963157871322114, 'grow_policy': 'Lossguide', 'min_data_in_leaf': 870, 'max_leaves': 66}. Best is trial 52 with value: 2182.908535006516.[0m
[32m[I 2024-10-13 09:23:07,288][0m Trial 89 finished with value: 3664.3878586255782 and parameters: {'depth': 15, 'learning_rate': 0.005977239729590346, 'iterations': 1271, 'l2_leaf_reg': 0.0024623058678934673, 'border_count': 1, 'bagging_temperature': 0.6967083209272001, 'random_strength': 2.985278544851664, 'grow_policy': 'Lossguide', 'min_data_in_leaf': 950, 'max_leaves': 93}. Best is trial 52 with value: 2182.908535006516.[0m
[32m[I 2024-10-13 09:23:09,441][0m Trial 90 finished with value: 2324.122691804361 and parameters: {'depth': 14, 'learning_rate': 0.0025674325678129322, 'iterations': 1094, 'l2_leaf_reg': 0.2930742892845492, 'border_count': 25, 'bagging_temperature': 0.8473065942254903, 'random_strength': 6.055191289814308, 'grow_policy': 'Lossguide', 'min_data_in_leaf': 781, 'max_leaves': 104}. Best is trial 52 with value: 2182.908535006516.[0m
[32m[I 2024-10-13 09:23:12,196][0m Trial 91 finished with value: 2256.9882800593577 and parameters: {'depth': 14, 'learning_rate': 0.004587389309903368, 'iterations': 1643, 'l2_leaf_reg': 0.09175940535770725, 'border_count': 17, 'bagging_temperature': 0.9062417053051682, 'random_strength': 4.646435717189913, 'grow_policy': 'Lossguide', 'min_data_in_leaf': 861, 'max_leaves': 78}. Best is trial 52 with value: 2182.908535006516.[0m
[32m[I 2024-10-13 09:23:15,315][0m Trial 92 finished with value: 2255.901209361457 and parameters: {'depth': 15, 'learning_rate': 0.004760762860630497, 'iterations': 1664, 'l2_leaf_reg': 0.1919013174776138, 'border_count': 14, 'bagging_temperature': 0.9523524795799304, 'random_strength': 5.365266110784598, 'grow_policy': 'Lossguide', 'min_data_in_leaf': 855, 'max_leaves': 76}. Best is trial 52 with value: 2182.908535006516.[0m
[32m[I 2024-10-13 09:23:18,457][0m Trial 93 finished with value: 2496.657255525288 and parameters: {'depth': 15, 'learning_rate': 0.004593270756378762, 'iterations': 1651, 'l2_leaf_reg': 0.17853230818873972, 'border_count': 161, 'bagging_temperature': 0.9199078870653864, 'random_strength': 5.285328690139264, 'grow_policy': 'Lossguide', 'min_data_in_leaf': 850, 'max_leaves': 74}. Best is trial 52 with value: 2182.908535006516.[0m
[32m[I 2024-10-13 09:23:21,444][0m Trial 94 finished with value: 2398.500621563006 and parameters: {'depth': 15, 'learning_rate': 0.0036996843767416647, 'iterations': 1789, 'l2_leaf_reg': 0.10962525872639611, 'border_count': 30, 'bagging_temperature': 0.9542143760223429, 'random_strength': 5.493359815405367, 'grow_policy': 'Lossguide', 'min_data_in_leaf': 749, 'max_leaves': 79}. Best is trial 52 with value: 2182.908535006516.[0m
[32m[I 2024-10-13 09:23:24,547][0m Trial 95 finished with value: 2858.373393858538 and parameters: {'depth': 15, 'learning_rate': 0.003003824537282115, 'iterations': 1591, 'l2_leaf_reg': 0.027281558638728488, 'border_count': 12, 'bagging_temperature': 0.7877726620377775, 'random_strength': 5.012053292177514, 'grow_policy': 'Lossguide', 'min_data_in_leaf': 708, 'max_leaves': 62}. Best is trial 52 with value: 2182.908535006516.[0m
[32m[I 2024-10-13 09:23:28,221][0m Trial 96 finished with value: 2873.9130649457343 and parameters: {'depth': 14, 'learning_rate': 0.005105360797826867, 'iterations': 1936, 'l2_leaf_reg': 0.9391185372566101, 'border_count': 7, 'bagging_temperature': 0.9207882828611991, 'random_strength': 4.692778869153599, 'grow_policy': 'Lossguide', 'min_data_in_leaf': 792, 'max_leaves': 72}. Best is trial 52 with value: 2182.908535006516.[0m
[32m[I 2024-10-13 09:23:31,014][0m Trial 97 finished with value: 2269.769085643177 and parameters: {'depth': 14, 'learning_rate': 0.0018134796027032601, 'iterations': 1390, 'l2_leaf_reg': 0.07293405134385746, 'border_count': 23, 'bagging_temperature': 0.8920891123477683, 'random_strength': 6.154001097136102, 'grow_policy': 'Lossguide', 'min_data_in_leaf': 899, 'max_leaves': 85}. Best is trial 52 with value: 2182.908535006516.[0m
[32m[I 2024-10-13 09:23:34,785][0m Trial 98 finished with value: 2477.1065161664515 and parameters: {'depth': 15, 'learning_rate': 0.006591081772406061, 'iterations': 2075, 'l2_leaf_reg': 0.005970436787398746, 'border_count': 40, 'bagging_temperature': 0.9978903520738294, 'random_strength': 3.452169775004954, 'grow_policy': 'Lossguide', 'min_data_in_leaf': 818, 'max_leaves': 42}. Best is trial 52 with value: 2182.908535006516.[0m
[32m[I 2024-10-13 09:23:37,648][0m Trial 99 finished with value: 2371.9902634071486 and parameters: {'depth': 15, 'learning_rate': 0.004110957500335632, 'iterations': 1474, 'l2_leaf_reg': 0.04093677281550622, 'border_count': 49, 'bagging_temperature': 0.7407212555574297, 'random_strength': 3.1427835698552142, 'grow_policy': 'Lossguide', 'min_data_in_leaf': 859, 'max_leaves': 95}. Best is trial 52 with value: 2182.908535006516.[0m
[32m[I 2024-10-13 09:23:40,383][0m Trial 100 finished with value: 2470.7797945014936 and parameters: {'depth': 14, 'learning_rate': 0.0033649634349981407, 'iterations': 1232, 'l2_leaf_reg': 0.1402015505941124, 'border_count': 120, 'bagging_temperature': 0.9482349849495445, 'random_strength': 2.4234880147336555, 'grow_policy': 'Lossguide', 'min_data_in_leaf': 882, 'max_leaves': 255}. Best is trial 52 with value: 2182.908535006516.[0m
