[32m[I 2024-10-13 10:34:04,266][0m Trial 663 finished with value: 2199.4117541138467 and parameters: {'depth': 10, 'learning_rate': 0.0007079153779962147, 'iterations': 2653, 'l2_leaf_reg': 1.453779340454533e-08, 'border_count': 22, 'bagging_temperature': 0.029359978008636958, 'random_strength': 2.0609228976181573, 'grow_policy': 'Depthwise', 'min_data_in_leaf': 88}. Best is trial 349 with value: 2072.137476888861.[0m
[32m[I 2024-10-13 10:34:06,861][0m Trial 664 finished with value: 2436.470720170628 and parameters: {'depth': 11, 'learning_rate': 0.00038302331037490803, 'iterations': 2710, 'l2_leaf_reg': 1.9966434693939207e-08, 'border_count': 25, 'bagging_temperature': 0.051375595592212595, 'random_strength': 2.3648629384011697, 'grow_policy': 'Depthwise', 'min_data_in_leaf': 132}. Best is trial 349 with value: 2072.137476888861.[0m
[32m[I 2024-10-13 10:34:09,925][0m Trial 665 finished with value: 2205.1804833720425 and parameters: {'depth': 11, 'learning_rate': 0.0005998519874746724, 'iterations': 2732, 'l2_leaf_reg': 0.0008610147227482599, 'border_count': 32, 'bagging_temperature': 0.42111461462475025, 'random_strength': 1.623092905337805, 'grow_policy': 'Depthwise', 'min_data_in_leaf': 76}. Best is trial 349 with value: 2072.137476888861.[0m
[32m[I 2024-10-13 10:34:12,559][0m Trial 666 finished with value: 2314.3500566886096 and parameters: {'depth': 11, 'learning_rate': 0.00045662064383473284, 'iterations': 2759, 'l2_leaf_reg': 2.11736307554799e-08, 'border_count': 21, 'bagging_temperature': 0.286568678377127, 'random_strength': 2.0636928053620918, 'grow_policy': 'Depthwise', 'min_data_in_leaf': 116}. Best is trial 349 with value: 2072.137476888861.[0m
[32m[I 2024-10-13 10:34:16,215][0m Trial 667 finished with value: 2268.7293000196883 and parameters: {'depth': 11, 'learning_rate': 0.0008041849220634056, 'iterations': 2665, 'l2_leaf_reg': 0.025927967958911884, 'border_count': 27, 'bagging_temperature': 0.07835868259591616, 'random_strength': 2.2608213284378778, 'grow_policy': 'Depthwise', 'min_data_in_leaf': 64}. Best is trial 349 with value: 2072.137476888861.[0m
[32m[I 2024-10-13 10:34:23,918][0m Trial 668 finished with value: 2266.4084128917834 and parameters: {'depth': 11, 'learning_rate': 0.0005306121996111913, 'iterations': 2453, 'l2_leaf_reg': 1.3393989119568477e-08, 'border_count': 20, 'bagging_temperature': 0.016563972743109532, 'random_strength': 6.886870756896936, 'grow_policy': 'Depthwise', 'min_data_in_leaf': 88}. Best is trial 349 with value: 2072.137476888861.[0m
[32m[I 2024-10-13 10:34:33,506][0m Trial 669 finished with value: 2237.092639571664 and parameters: {'depth': 10, 'learning_rate': 0.0004181928712951649, 'iterations': 2591, 'l2_leaf_reg': 5.329799074890581e-05, 'border_count': 17, 'bagging_temperature': 0.03872849609901488, 'random_strength': 1.781112114194603, 'grow_policy': 'Depthwise', 'min_data_in_leaf': 53}. Best is trial 349 with value: 2072.137476888861.[0m
[32m[I 2024-10-13 10:34:41,058][0m Trial 670 finished with value: 2190.8071615798917 and parameters: {'depth': 11, 'learning_rate': 0.0006452585976023492, 'iterations': 2779, 'l2_leaf_reg': 1.0016616535480824e-08, 'border_count': 24, 'bagging_temperature': 0.017453783855651765, 'random_strength': 2.444206692610689, 'grow_policy': 'Depthwise', 'min_data_in_leaf': 492}. Best is trial 349 with value: 2072.137476888861.[0m
[32m[I 2024-10-13 10:34:50,834][0m Trial 671 finished with value: 2863.4300724570944 and parameters: {'depth': 11, 'learning_rate': 0.0004982444488253251, 'iterations': 2700, 'l2_leaf_reg': 2.8221134196046925e-08, 'border_count': 8, 'bagging_temperature': 0.05299321502743036, 'random_strength': 2.02445566132762, 'grow_policy': 'Depthwise', 'min_data_in_leaf': 77}. Best is trial 349 with value: 2072.137476888861.[0m
[32m[I 2024-10-13 10:35:07,595][0m Trial 672 finished with value: 2736.076022681239 and parameters: {'depth': 11, 'learning_rate': 0.0003288663258514649, 'iterations': 2801, 'l2_leaf_reg': 1.7141204051817386e-08, 'border_count': 29, 'bagging_temperature': 0.10688548752457919, 'random_strength': 2.2265528935663323, 'grow_policy': 'Depthwise', 'min_data_in_leaf': 16}. Best is trial 349 with value: 2072.137476888861.[0m
[32m[I 2024-10-13 10:35:16,799][0m Trial 673 finished with value: 2169.079252553238 and parameters: {'depth': 10, 'learning_rate': 0.0006063291745557868, 'iterations': 2531, 'l2_leaf_reg': 2.760330312985672e-08, 'border_count': 13, 'bagging_temperature': 0.0858376636888863, 'random_strength': 2.486941447198282, 'grow_policy': 'Depthwise', 'min_data_in_leaf': 54}. Best is trial 349 with value: 2072.137476888861.[0m
[32m[I 2024-10-13 10:35:20,611][0m Trial 674 finished with value: 2316.1554147106162 and parameters: {'depth': 11, 'learning_rate': 0.0004440640929918055, 'iterations': 2749, 'l2_leaf_reg': 1.0061910327954301e-08, 'border_count': 19, 'bagging_temperature': 0.034773260444540266, 'random_strength': 1.9244509756599795, 'grow_policy': 'Depthwise', 'min_data_in_leaf': 103}. Best is trial 349 with value: 2072.137476888861.[0m
[32m[I 2024-10-13 10:35:26,237][0m Trial 675 finished with value: 2617.1327401012945 and parameters: {'depth': 11, 'learning_rate': 0.01465370821423118, 'iterations': 2644, 'l2_leaf_reg': 2.0679935237240723e-08, 'border_count': 33, 'bagging_temperature': 0.0626165571698594, 'random_strength': 1.5518495965619774, 'grow_policy': 'Depthwise', 'min_data_in_leaf': 37}. Best is trial 349 with value: 2072.137476888861.[0m
[32m[I 2024-10-13 10:35:29,026][0m Trial 676 finished with value: 2205.7332447605445 and parameters: {'depth': 12, 'learning_rate': 0.0007742959368431443, 'iterations': 2824, 'l2_leaf_reg': 3.288959658476803e-08, 'border_count': 23, 'bagging_temperature': 0.018794499198693596, 'random_strength': 2.2202766508449425, 'grow_policy': 'Depthwise', 'min_data_in_leaf': 138}. Best is trial 349 with value: 2072.137476888861.[0m
[32m[I 2024-10-13 10:35:34,447][0m Trial 677 finished with value: 3210.4823085764788 and parameters: {'depth': 11, 'learning_rate': 0.0005284855187964074, 'iterations': 2704, 'l2_leaf_reg': 1.5153440766490508e-08, 'border_count': 11, 'bagging_temperature': 0.04466273551701838, 'random_strength': 1.7816264684826406, 'grow_policy': 'Depthwise', 'min_data_in_leaf': 16}. Best is trial 349 with value: 2072.137476888861.[0m
[32m[I 2024-10-13 10:35:37,756][0m Trial 678 finished with value: 2253.749840798088 and parameters: {'depth': 11, 'learning_rate': 0.0003804916958513301, 'iterations': 2764, 'l2_leaf_reg': 2.4902905069730046e-08, 'border_count': 18, 'bagging_temperature': 0.06789813842672554, 'random_strength': 2.428090507581274, 'grow_policy': 'Depthwise', 'min_data_in_leaf': 67}. Best is trial 349 with value: 2072.137476888861.[0m
[32m[I 2024-10-13 10:35:41,009][0m Trial 679 finished with value: 2209.4069076998094 and parameters: {'depth': 11, 'learning_rate': 0.0006854893733599873, 'iterations': 2866, 'l2_leaf_reg': 1.6137818405439573e-08, 'border_count': 24, 'bagging_temperature': 0.017182095819877147, 'random_strength': 2.039134743437776, 'grow_policy': 'Depthwise', 'min_data_in_leaf': 84}. Best is trial 349 with value: 2072.137476888861.[0m
[32m[I 2024-10-13 10:35:54,968][0m Trial 680 finished with value: 3395.5424377544045 and parameters: {'depth': 10, 'learning_rate': 0.0004926050293195289, 'iterations': 2999, 'l2_leaf_reg': 3.219010131591472e-08, 'border_count': 107, 'bagging_temperature': 0.03495704386720898, 'random_strength': 2.6055527187748564, 'grow_policy': 'Depthwise', 'min_data_in_leaf': 1}. Best is trial 349 with value: 2072.137476888861.[0m
[32m[I 2024-10-13 10:35:58,121][0m Trial 681 finished with value: 3048.4776379680548 and parameters: {'depth': 12, 'learning_rate': 0.00030336469326420183, 'iterations': 2610, 'l2_leaf_reg': 1.3895690444407563e-08, 'border_count': 7, 'bagging_temperature': 0.0018544363637810783, 'random_strength': 1.0389507155711621, 'grow_policy': 'Depthwise', 'min_data_in_leaf': 50}. Best is trial 349 with value: 2072.137476888861.[0m
[32m[I 2024-10-13 10:36:44,221][0m Trial 682 finished with value: 2531.1186699588025 and parameters: {'depth': 11, 'learning_rate': 0.000579507445661295, 'iterations': 2839, 'l2_leaf_reg': 2.223938875320761e-08, 'border_count': 29, 'bagging_temperature': 0.07707633436342057, 'random_strength': 1.2716760178580633, 'grow_policy': 'SymmetricTree', 'min_data_in_leaf': 34}. Best is trial 349 with value: 2072.137476888861.[0m
[32m[I 2024-10-13 10:36:47,719][0m Trial 683 finished with value: 2223.568604047351 and parameters: {'depth': 11, 'learning_rate': 0.00040735967365069966, 'iterations': 2784, 'l2_leaf_reg': 3.456034961056267e-08, 'border_count': 15, 'bagging_temperature': 0.048488384952031595, 'random_strength': 2.2385479829472996, 'grow_policy': 'Depthwise', 'min_data_in_leaf': 57}. Best is trial 349 with value: 2072.137476888861.[0m
[32m[I 2024-10-13 10:36:53,266][0m Trial 684 finished with value: 2524.7553811374764 and parameters: {'depth': 11, 'learning_rate': 0.0004800254159246181, 'iterations': 2691, 'l2_leaf_reg': 1.0102801484901913e-08, 'border_count': 20, 'bagging_temperature': 0.12010394656159662, 'random_strength': 2.4001447406769514, 'grow_policy': 'Depthwise', 'min_data_in_leaf': 17}. Best is trial 349 with value: 2072.137476888861.[0m
[32m[I 2024-10-13 10:36:57,993][0m Trial 685 finished with value: 2164.6228884330485 and parameters: {'depth': 12, 'learning_rate': 0.0005941991270761759, 'iterations': 2909, 'l2_leaf_reg': 2.0189064355953685e-08, 'border_count': 13, 'bagging_temperature': 0.00045330532443812327, 'random_strength': 1.773995632555552, 'grow_policy': 'Depthwise', 'min_data_in_leaf': 33}. Best is trial 349 with value: 2072.137476888861.[0m
[32m[I 2024-10-13 10:37:28,203][0m Trial 686 finished with value: 3164.340968414017 and parameters: {'depth': 11, 'learning_rate': 0.00035515503417481013, 'iterations': 2735, 'l2_leaf_reg': 4.688117881192491e-08, 'border_count': 27, 'bagging_temperature': 0.09743981233847457, 'random_strength': 2.123097968912278, 'grow_policy': 'Depthwise', 'min_data_in_leaf': 1}. Best is trial 349 with value: 2072.137476888861.[0m
[32m[I 2024-10-13 10:37:38,539][0m Trial 687 finished with value: 2251.7478604305384 and parameters: {'depth': 10, 'learning_rate': 0.0008613939311896613, 'iterations': 2821, 'l2_leaf_reg': 1.5362709360481182e-05, 'border_count': 18, 'bagging_temperature': 0.029688648819370583, 'random_strength': 2.637675939207395, 'grow_policy': 'Depthwise', 'min_data_in_leaf': 78}. Best is trial 349 with value: 2072.137476888861.[0m
[32m[I 2024-10-13 10:37:51,425][0m Trial 688 finished with value: 2277.5642045188497 and parameters: {'depth': 11, 'learning_rate': 0.0006896641842288438, 'iterations': 2894, 'l2_leaf_reg': 1.4773814160515211e-08, 'border_count': 72, 'bagging_temperature': 0.0603768105511729, 'random_strength': 1.9218874545547429, 'grow_policy': 'Depthwise', 'min_data_in_leaf': 113}. Best is trial 349 with value: 2072.137476888861.[0m
[32m[I 2024-10-13 10:38:01,171][0m Trial 689 finished with value: 2196.732825296534 and parameters: {'depth': 11, 'learning_rate': 0.0004517937084446186, 'iterations': 2658, 'l2_leaf_reg': 2.7325892346028204e-08, 'border_count': 23, 'bagging_temperature': 0.026091416519401046, 'random_strength': 2.3312462401851097, 'grow_policy': 'Depthwise', 'min_data_in_leaf': 47}. Best is trial 349 with value: 2072.137476888861.[0m
[32m[I 2024-10-13 10:38:12,678][0m Trial 690 finished with value: 2177.050190969392 and parameters: {'depth': 12, 'learning_rate': 0.000543776258305428, 'iterations': 2938, 'l2_leaf_reg': 1.875446292531484e-08, 'border_count': 33, 'bagging_temperature': 0.04737034472221535, 'random_strength': 1.501345968602511, 'grow_policy': 'Depthwise', 'min_data_in_leaf': 65}. Best is trial 349 with value: 2072.137476888861.[0m
[32m[I 2024-10-13 10:38:19,157][0m Trial 691 finished with value: 2978.3919134615703 and parameters: {'depth': 11, 'learning_rate': 0.0004133381124963805, 'iterations': 2779, 'l2_leaf_reg': 4.010081810732023, 'border_count': 9, 'bagging_temperature': 0.07934536038960543, 'random_strength': 2.136634997776945, 'grow_policy': 'Depthwise', 'min_data_in_leaf': 30}. Best is trial 349 with value: 2072.137476888861.[0m
[32m[I 2024-10-13 10:38:23,008][0m Trial 692 finished with value: 2194.8422203764067 and parameters: {'depth': 11, 'learning_rate': 0.0006966894404976539, 'iterations': 2552, 'l2_leaf_reg': 4.38526147359732e-08, 'border_count': 16, 'bagging_temperature': 0.02013712174851511, 'random_strength': 2.815970520839242, 'grow_policy': 'Depthwise', 'min_data_in_leaf': 90}. Best is trial 349 with value: 2072.137476888861.[0m
[32m[I 2024-10-13 10:38:25,687][0m Trial 693 finished with value: 2216.582574245924 and parameters: {'depth': 11, 'learning_rate': 0.0005325563846313142, 'iterations': 2860, 'l2_leaf_reg': 1.5770352423983667e-08, 'border_count': 23, 'bagging_temperature': 0.0003633518323273862, 'random_strength': 2.451573637550636, 'grow_policy': 'Depthwise', 'min_data_in_leaf': 694}. Best is trial 349 with value: 2072.137476888861.[0m
[32m[I 2024-10-13 10:38:31,207][0m Trial 694 finished with value: 2423.5749593276414 and parameters: {'depth': 11, 'learning_rate': 0.0005822257116997807, 'iterations': 2726, 'l2_leaf_reg': 2.9671748797379854e-08, 'border_count': 28, 'bagging_temperature': 0.061569976954093386, 'random_strength': 1.6856093844238504, 'grow_policy': 'Depthwise', 'min_data_in_leaf': 18}. Best is trial 349 with value: 2072.137476888861.[0m
[32m[I 2024-10-13 10:38:35,308][0m Trial 695 finished with value: 2878.57329551155 and parameters: {'depth': 10, 'learning_rate': 0.0004645258146639647, 'iterations': 2798, 'l2_leaf_reg': 1.4093790808706599e-08, 'border_count': 4, 'bagging_temperature': 0.0379474083537021, 'random_strength': 1.9406964954172772, 'grow_policy': 'Depthwise', 'min_data_in_leaf': 44}. Best is trial 349 with value: 2072.137476888861.[0m
[32m[I 2024-10-13 10:38:38,391][0m Trial 696 finished with value: 2841.728380124015 and parameters: {'depth': 11, 'learning_rate': 0.0007803464368953566, 'iterations': 2622, 'l2_leaf_reg': 6.364323873756447e-08, 'border_count': 12, 'bagging_temperature': 0.097372036206448, 'random_strength': 2.5894235678010586, 'grow_policy': 'Depthwise', 'min_data_in_leaf': 69}. Best is trial 349 with value: 2072.137476888861.[0m
[32m[I 2024-10-13 10:38:44,548][0m Trial 697 finished with value: 2690.5362788574744 and parameters: {'depth': 12, 'learning_rate': 0.19799264629359592, 'iterations': 2901, 'l2_leaf_reg': 1.0139530958911492e-08, 'border_count': 18, 'bagging_temperature': 0.021365075240868055, 'random_strength': 2.1929335833780876, 'grow_policy': 'Depthwise', 'min_data_in_leaf': 32}. Best is trial 349 with value: 2072.137476888861.[0m
[32m[I 2024-10-13 10:38:47,328][0m Trial 698 finished with value: 2435.2642575541827 and parameters: {'depth': 10, 'learning_rate': 0.00034620902410914447, 'iterations': 3000, 'l2_leaf_reg': 2.4683221152633492e-08, 'border_count': 22, 'bagging_temperature': 0.04839011896038615, 'random_strength': 2.0026393303788783, 'grow_policy': 'Depthwise', 'min_data_in_leaf': 103}. Best is trial 349 with value: 2072.137476888861.[0m
[32m[I 2024-10-13 10:38:59,110][0m Trial 699 finished with value: 3051.874606638925 and parameters: {'depth': 11, 'learning_rate': 0.2600706633977545, 'iterations': 2836, 'l2_leaf_reg': 4.126733279249642e-08, 'border_count': 13, 'bagging_temperature': 0.07324296398828518, 'random_strength': 2.3481741367269717, 'grow_policy': 'Depthwise', 'min_data_in_leaf': 1}. Best is trial 349 with value: 2072.137476888861.[0m
[32m[I 2024-10-13 10:39:02,691][0m Trial 700 finished with value: 2177.3551016941215 and parameters: {'depth': 11, 'learning_rate': 0.0006147438565447722, 'iterations': 2689, 'l2_leaf_reg': 2.0697571187977956e-08, 'border_count': 27, 'bagging_temperature': 0.0360142200808746, 'random_strength': 1.727590415387434, 'grow_policy': 'Depthwise', 'min_data_in_leaf': 53}. Best is trial 349 with value: 2072.137476888861.[0m
[32m[I 2024-10-13 10:39:08,639][0m Trial 701 finished with value: 2579.3867023674347 and parameters: {'depth': 12, 'learning_rate': 0.0003975099655044645, 'iterations': 2949, 'l2_leaf_reg': 3.204556374651884e-08, 'border_count': 33, 'bagging_temperature': 0.018922725800407318, 'random_strength': 2.636945229220569, 'grow_policy': 'Depthwise', 'min_data_in_leaf': 20}. Best is trial 349 with value: 2072.137476888861.[0m
[32m[I 2024-10-13 10:39:11,350][0m Trial 702 finished with value: 3146.2951796778702 and parameters: {'depth': 11, 'learning_rate': 0.00025863064389079695, 'iterations': 2750, 'l2_leaf_reg': 1.4710491442670999e-08, 'border_count': 7, 'bagging_temperature': 0.05836941655541096, 'random_strength': 2.2460508765041536, 'grow_policy': 'Depthwise', 'min_data_in_leaf': 80}. Best is trial 349 with value: 2072.137476888861.[0m
[32m[I 2024-10-13 10:39:41,967][0m Trial 703 finished with value: 2597.483414689985 and parameters: {'depth': 11, 'learning_rate': 0.000490422969869781, 'iterations': 2865, 'l2_leaf_reg': 0.004046112989102073, 'border_count': 18, 'bagging_temperature': 0.08648344592686447, 'random_strength': 2.9856025155440458, 'grow_policy': 'SymmetricTree', 'min_data_in_leaf': 44}. Best is trial 349 with value: 2072.137476888861.[0m
[32m[I 2024-10-13 10:39:44,601][0m Trial 704 finished with value: 2191.0879457690735 and parameters: {'depth': 11, 'learning_rate': 0.0006630675824703723, 'iterations': 2793, 'l2_leaf_reg': 2.216121084590097e-08, 'border_count': 23, 'bagging_temperature': 0.001125836272464091, 'random_strength': 1.3337235109537087, 'grow_policy': 'Depthwise', 'min_data_in_leaf': 129}. Best is trial 349 with value: 2072.137476888861.[0m
[32m[I 2024-10-13 10:39:47,859][0m Trial 705 finished with value: 2156.617844223819 and parameters: {'depth': 10, 'learning_rate': 0.0005347268080167285, 'iterations': 2686, 'l2_leaf_reg': 5.2870056318939874e-08, 'border_count': 14, 'bagging_temperature': 6.941809767623745e-05, 'random_strength': 2.040894900772515, 'grow_policy': 'Depthwise', 'min_data_in_leaf': 61}. Best is trial 349 with value: 2072.137476888861.[0m
[32m[I 2024-10-13 10:39:52,746][0m Trial 706 finished with value: 2879.5499280348017 and parameters: {'depth': 10, 'learning_rate': 0.0005628404851788156, 'iterations': 2570, 'l2_leaf_reg': 7.969356542034477e-08, 'border_count': 5, 'bagging_temperature': 0.00103748886751996, 'random_strength': 1.6082825582062512, 'grow_policy': 'Depthwise', 'min_data_in_leaf': 20}. Best is trial 349 with value: 2072.137476888861.[0m
[32m[I 2024-10-13 10:39:55,221][0m Trial 707 finished with value: 3714.980273059789 and parameters: {'depth': 10, 'learning_rate': 0.0008407847737612607, 'iterations': 2660, 'l2_leaf_reg': 5.449516770089604e-08, 'border_count': 1, 'bagging_temperature': 0.025925357555333928, 'random_strength': 1.8611314950064402, 'grow_policy': 'Depthwise', 'min_data_in_leaf': 59}. Best is trial 349 with value: 2072.137476888861.[0m
[32m[I 2024-10-13 10:40:07,917][0m Trial 708 finished with value: 3342.48566965883 and parameters: {'depth': 10, 'learning_rate': 0.0006996987524163109, 'iterations': 2942, 'l2_leaf_reg': 1.0430701849281832e-07, 'border_count': 10, 'bagging_temperature': 0.018438507317093605, 'random_strength': 2.017023639087324, 'grow_policy': 'Depthwise', 'min_data_in_leaf': 1}. Best is trial 349 with value: 2072.137476888861.[0m
[32m[I 2024-10-13 10:40:11,971][0m Trial 709 finished with value: 2814.545703179753 and parameters: {'depth': 10, 'learning_rate': 0.0004395700780383801, 'iterations': 2889, 'l2_leaf_reg': 6.611137346682316e-08, 'border_count': 11, 'bagging_temperature': 0.002546309903392295, 'random_strength': 1.832285238604411, 'grow_policy': 'Depthwise', 'min_data_in_leaf': 35}. Best is trial 349 with value: 2072.137476888861.[0m
[32m[I 2024-10-13 10:40:15,473][0m Trial 710 finished with value: 2162.575901281673 and parameters: {'depth': 10, 'learning_rate': 0.0005339611287784586, 'iterations': 2627, 'l2_leaf_reg': 4.629332539098638e-08, 'border_count': 17, 'bagging_temperature': 0.01904460811053826, 'random_strength': 1.452301476636948, 'grow_policy': 'Depthwise', 'min_data_in_leaf': 49}. Best is trial 349 with value: 2072.137476888861.[0m
[32m[I 2024-10-13 10:40:20,054][0m Trial 711 finished with value: 2153.0738470478914 and parameters: {'depth': 12, 'learning_rate': 0.00064150219069469, 'iterations': 2734, 'l2_leaf_reg': 3.418016450859556e-08, 'border_count': 14, 'bagging_temperature': 0.0005195070853260403, 'random_strength': 2.0125382764778585, 'grow_policy': 'Depthwise', 'min_data_in_leaf': 28}. Best is trial 349 with value: 2072.137476888861.[0m
[32m[I 2024-10-13 10:40:25,546][0m Trial 712 finished with value: 3285.4783983218285 and parameters: {'depth': 12, 'learning_rate': 0.0009350206502745855, 'iterations': 2698, 'l2_leaf_reg': 7.92905215546103e-08, 'border_count': 8, 'bagging_temperature': 0.00212300302059815, 'random_strength': 2.123688037438539, 'grow_policy': 'Depthwise', 'min_data_in_leaf': 19}. Best is trial 349 with value: 2072.137476888861.[0m
[32m[I 2024-10-13 10:40:30,766][0m Trial 713 finished with value: 3117.075763364537 and parameters: {'depth': 12, 'learning_rate': 0.0007687489222623782, 'iterations': 2614, 'l2_leaf_reg': 1.0797292068771219e-07, 'border_count': 12, 'bagging_temperature': 0.02016129804160007, 'random_strength': 2.0688322852356396, 'grow_policy': 'Depthwise', 'min_data_in_leaf': 18}. Best is trial 349 with value: 2072.137476888861.[0m
