[32m[I 2024-10-13 10:07:49,475][0m Trial 459 finished with value: 3450.926427643893 and parameters: {'depth': 12, 'learning_rate': 0.0004302290286454566, 'iterations': 2709, 'l2_leaf_reg': 2.159493532570557e-08, 'border_count': 6, 'bagging_temperature': 0.05686019547905826, 'random_strength': 1.789127059438037, 'grow_policy': 'Depthwise', 'min_data_in_leaf': 3}. Best is trial 349 with value: 2072.137476888861.[0m
[32m[I 2024-10-13 10:07:55,493][0m Trial 460 finished with value: 2162.472523367246 and parameters: {'depth': 11, 'learning_rate': 0.0005588102605832903, 'iterations': 2809, 'l2_leaf_reg': 5.1483148596271556e-08, 'border_count': 17, 'bagging_temperature': 0.030641313167015585, 'random_strength': 2.293146034253615, 'grow_policy': 'Depthwise', 'min_data_in_leaf': 51}. Best is trial 349 with value: 2072.137476888861.[0m
[32m[I 2024-10-13 10:07:59,355][0m Trial 461 finished with value: 3780.6103365740846 and parameters: {'depth': 11, 'learning_rate': 0.0006095664246834621, 'iterations': 2756, 'l2_leaf_reg': 6.179871661537503e-08, 'border_count': 1, 'bagging_temperature': 0.042914897595818256, 'random_strength': 2.9484500626015873, 'grow_policy': 'Depthwise', 'min_data_in_leaf': 100}. Best is trial 349 with value: 2072.137476888861.[0m
[32m[I 2024-10-13 10:08:03,336][0m Trial 462 finished with value: 2219.0234815222816 and parameters: {'depth': 11, 'learning_rate': 0.0005800135515646994, 'iterations': 2585, 'l2_leaf_reg': 3.954213694827891e-08, 'border_count': 15, 'bagging_temperature': 0.06662743400346108, 'random_strength': 2.3814543685543983, 'grow_policy': 'Depthwise', 'min_data_in_leaf': 120}. Best is trial 349 with value: 2072.137476888861.[0m
[32m[I 2024-10-13 10:08:08,730][0m Trial 463 finished with value: 2833.186131844352 and parameters: {'depth': 11, 'learning_rate': 0.0006668598209726885, 'iterations': 2877, 'l2_leaf_reg': 1.0280043368899823e-08, 'border_count': 12, 'bagging_temperature': 0.027895927105366574, 'random_strength': 2.7616234496856595, 'grow_policy': 'Depthwise', 'min_data_in_leaf': 58}. Best is trial 349 with value: 2072.137476888861.[0m
[32m[I 2024-10-13 10:08:17,020][0m Trial 464 finished with value: 2089.86570649117 and parameters: {'depth': 11, 'learning_rate': 0.0005309082463018309, 'iterations': 2792, 'l2_leaf_reg': 6.70101049948713e-08, 'border_count': 18, 'bagging_temperature': 0.04777364795445692, 'random_strength': 2.2565524768837357, 'grow_policy': 'Depthwise', 'min_data_in_leaf': 23}. Best is trial 349 with value: 2072.137476888861.[0m
[32m[I 2024-10-13 10:08:37,220][0m Trial 465 finished with value: 3313.548477462569 and parameters: {'depth': 12, 'learning_rate': 0.0003917337700977482, 'iterations': 2648, 'l2_leaf_reg': 2.9924779601782946e-08, 'border_count': 182, 'bagging_temperature': 0.0717219378212646, 'random_strength': 2.2686645656000506, 'grow_policy': 'Depthwise', 'min_data_in_leaf': 2}. Best is trial 349 with value: 2072.137476888861.[0m
[32m[I 2024-10-13 10:08:44,908][0m Trial 466 finished with value: 2973.6549264295218 and parameters: {'depth': 11, 'learning_rate': 0.0005191407037835818, 'iterations': 2711, 'l2_leaf_reg': 1.5236660694997197e-08, 'border_count': 7, 'bagging_temperature': 0.3011483346141476, 'random_strength': 1.9637103309640245, 'grow_policy': 'Depthwise', 'min_data_in_leaf': 21}. Best is trial 349 with value: 2072.137476888861.[0m
[32m[I 2024-10-13 10:08:50,273][0m Trial 467 finished with value: 2427.186497390761 and parameters: {'depth': 11, 'learning_rate': 0.00032922706522575706, 'iterations': 2940, 'l2_leaf_reg': 6.432685865208727e-08, 'border_count': 235, 'bagging_temperature': 0.04764746306063049, 'random_strength': 3.243510812267427, 'grow_policy': 'Depthwise', 'min_data_in_leaf': 70}. Best is trial 349 with value: 2072.137476888861.[0m
[32m[I 2024-10-13 10:09:25,400][0m Trial 468 finished with value: 2660.088072205346 and parameters: {'depth': 11, 'learning_rate': 0.00044963849884529833, 'iterations': 2787, 'l2_leaf_reg': 1.8486108201644844e-08, 'border_count': 18, 'bagging_temperature': 0.05182103724924805, 'random_strength': 2.171770535263646, 'grow_policy': 'SymmetricTree', 'min_data_in_leaf': 80}. Best is trial 349 with value: 2072.137476888861.[0m
[32m[I 2024-10-13 10:09:33,209][0m Trial 469 finished with value: 2804.1396661116733 and parameters: {'depth': 11, 'learning_rate': 0.0005402268054169669, 'iterations': 2873, 'l2_leaf_reg': 1.0000502816305075e-08, 'border_count': 11, 'bagging_temperature': 0.03694427087729827, 'random_strength': 1.8295881255953288, 'grow_policy': 'Depthwise', 'min_data_in_leaf': 53}. Best is trial 349 with value: 2072.137476888861.[0m
[32m[I 2024-10-13 10:09:44,586][0m Trial 470 finished with value: 2151.6852008236733 and parameters: {'depth': 11, 'learning_rate': 0.0004063501543466311, 'iterations': 2741, 'l2_leaf_reg': 3.352929488760533e-08, 'border_count': 24, 'bagging_temperature': 0.06920778104253161, 'random_strength': 2.3031492217038774, 'grow_policy': 'Depthwise', 'min_data_in_leaf': 22}. Best is trial 349 with value: 2072.137476888861.[0m
[32m[I 2024-10-13 10:09:55,390][0m Trial 471 finished with value: 2508.711263760505 and parameters: {'depth': 12, 'learning_rate': 0.00027508759465600264, 'iterations': 2677, 'l2_leaf_reg': 8.1291421463206e-08, 'border_count': 28, 'bagging_temperature': 0.07043220981106359, 'random_strength': 2.0652153318744015, 'grow_policy': 'Depthwise', 'min_data_in_leaf': 22}. Best is trial 349 with value: 2072.137476888861.[0m
[32m[I 2024-10-13 10:10:01,158][0m Trial 472 finished with value: 2213.3684109713054 and parameters: {'depth': 11, 'learning_rate': 0.0003697256751085295, 'iterations': 2735, 'l2_leaf_reg': 4.164636580310073e-08, 'border_count': 24, 'bagging_temperature': 0.07531453988064475, 'random_strength': 2.274318444784603, 'grow_policy': 'Depthwise', 'min_data_in_leaf': 25}. Best is trial 349 with value: 2072.137476888861.[0m
[32m[I 2024-10-13 10:10:09,960][0m Trial 473 finished with value: 2693.60236672328 and parameters: {'depth': 11, 'learning_rate': 0.046221935856481586, 'iterations': 2570, 'l2_leaf_reg': 3.0795583734849173e-08, 'border_count': 23, 'bagging_temperature': 0.05386244267905012, 'random_strength': 1.96465958210125, 'grow_policy': 'Depthwise', 'min_data_in_leaf': 43}. Best is trial 349 with value: 2072.137476888861.[0m
[32m[I 2024-10-13 10:10:21,553][0m Trial 474 finished with value: 2367.4658136299395 and parameters: {'depth': 11, 'learning_rate': 0.0005328955638263541, 'iterations': 2944, 'l2_leaf_reg': 5.47532226562259e-08, 'border_count': 19, 'bagging_temperature': 0.03054323983974145, 'random_strength': 2.3666568042262957, 'grow_policy': 'Depthwise', 'min_data_in_leaf': 19}. Best is trial 349 with value: 2072.137476888861.[0m
[32m[I 2024-10-13 10:10:42,157][0m Trial 475 finished with value: 2688.236536381976 and parameters: {'depth': 11, 'learning_rate': 0.00041298814961096184, 'iterations': 2876, 'l2_leaf_reg': 2.8016449424600115e-08, 'border_count': 26, 'bagging_temperature': 0.046081664330338695, 'random_strength': 1.7905515806216001, 'grow_policy': 'Depthwise', 'min_data_in_leaf': 2}. Best is trial 349 with value: 2072.137476888861.[0m
[32m[I 2024-10-13 10:10:47,450][0m Trial 476 finished with value: 2201.3927875999875 and parameters: {'depth': 11, 'learning_rate': 0.0006719014288849839, 'iterations': 2821, 'l2_leaf_reg': 4.139342324756257e-08, 'border_count': 20, 'bagging_temperature': 0.02135012608901667, 'random_strength': 2.1764996619528136, 'grow_policy': 'Depthwise', 'min_data_in_leaf': 88}. Best is trial 349 with value: 2072.137476888861.[0m
[32m[I 2024-10-13 10:10:55,397][0m Trial 477 finished with value: 2467.636479038906 and parameters: {'depth': 11, 'learning_rate': 0.00030747387330383837, 'iterations': 2671, 'l2_leaf_reg': 2.0030517437779553e-08, 'border_count': 28, 'bagging_temperature': 0.06984362275829563, 'random_strength': 2.388457588519185, 'grow_policy': 'Depthwise', 'min_data_in_leaf': 38}. Best is trial 349 with value: 2072.137476888861.[0m
[32m[I 2024-10-13 10:11:01,275][0m Trial 478 finished with value: 2175.747228536403 and parameters: {'depth': 12, 'learning_rate': 0.00048545565318554963, 'iterations': 2753, 'l2_leaf_reg': 7.322175674894703e-08, 'border_count': 17, 'bagging_temperature': 0.034426900058892596, 'random_strength': 2.08593686160576, 'grow_policy': 'Depthwise', 'min_data_in_leaf': 56}. Best is trial 349 with value: 2072.137476888861.[0m
[32m[I 2024-10-13 10:11:32,238][0m Trial 479 finished with value: 3252.4801134743066 and parameters: {'depth': 11, 'learning_rate': 0.0003910000298979655, 'iterations': 2823, 'l2_leaf_reg': 2.509529106045546e-08, 'border_count': 23, 'bagging_temperature': 0.016587284951346287, 'random_strength': 2.542457849755617, 'grow_policy': 'Depthwise', 'min_data_in_leaf': 1}. Best is trial 349 with value: 2072.137476888861.[0m
[32m[I 2024-10-13 10:11:40,842][0m Trial 480 finished with value: 2152.6442166982297 and parameters: {'depth': 11, 'learning_rate': 0.0005326793711313798, 'iterations': 2927, 'l2_leaf_reg': 1.7040937241717832e-08, 'border_count': 14, 'bagging_temperature': 0.05562617729951452, 'random_strength': 2.7274275051797865, 'grow_policy': 'Depthwise', 'min_data_in_leaf': 28}. Best is trial 349 with value: 2072.137476888861.[0m
[32m[I 2024-10-13 10:11:48,134][0m Trial 481 finished with value: 2937.1779483681707 and parameters: {'depth': 11, 'learning_rate': 0.0005944298446976873, 'iterations': 2945, 'l2_leaf_reg': 3.7168208288724805e-08, 'border_count': 9, 'bagging_temperature': 0.07628652366561298, 'random_strength': 2.285489186479542, 'grow_policy': 'Depthwise', 'min_data_in_leaf': 27}. Best is trial 349 with value: 2072.137476888861.[0m
[32m[I 2024-10-13 10:12:00,420][0m Trial 482 finished with value: 2394.9792700722974 and parameters: {'depth': 11, 'learning_rate': 0.0006844661527343052, 'iterations': 2908, 'l2_leaf_reg': 1.98692956654597e-08, 'border_count': 15, 'bagging_temperature': 0.3382929320675689, 'random_strength': 2.705077691147541, 'grow_policy': 'Depthwise', 'min_data_in_leaf': 18}. Best is trial 349 with value: 2072.137476888861.[0m
[32m[I 2024-10-13 10:12:07,690][0m Trial 483 finished with value: 2799.008617992672 and parameters: {'depth': 13, 'learning_rate': 0.0004208313260882902, 'iterations': 2994, 'l2_leaf_reg': 3.070656010227104e-08, 'border_count': 6, 'bagging_temperature': 0.05402217110770164, 'random_strength': 1.9325930840349932, 'grow_policy': 'Depthwise', 'min_data_in_leaf': 36}. Best is trial 349 with value: 2072.137476888861.[0m
[32m[I 2024-10-13 10:12:12,702][0m Trial 484 finished with value: 2162.771116199356 and parameters: {'depth': 11, 'learning_rate': 0.0005423994227144121, 'iterations': 2868, 'l2_leaf_reg': 1.562600518432374e-08, 'border_count': 28, 'bagging_temperature': 0.05654129578849648, 'random_strength': 2.2150191530028804, 'grow_policy': 'Depthwise', 'min_data_in_leaf': 77}. Best is trial 349 with value: 2072.137476888861.[0m
[32m[I 2024-10-13 10:12:19,114][0m Trial 485 finished with value: 2180.4169005439626 and parameters: {'depth': 12, 'learning_rate': 0.0005710818813060239, 'iterations': 2853, 'l2_leaf_reg': 5.28988823072279e-08, 'border_count': 27, 'bagging_temperature': 0.07793124353272592, 'random_strength': 1.752076353413405, 'grow_policy': 'Depthwise', 'min_data_in_leaf': 67}. Best is trial 349 with value: 2072.137476888861.[0m
[32m[I 2024-10-13 10:12:26,503][0m Trial 486 finished with value: 2128.607370519734 and parameters: {'depth': 11, 'learning_rate': 0.000667832125595908, 'iterations': 2795, 'l2_leaf_reg': 2.0955513003194472e-08, 'border_count': 28, 'bagging_temperature': 0.05853651854849242, 'random_strength': 2.1185101944787013, 'grow_policy': 'Depthwise', 'min_data_in_leaf': 26}. Best is trial 349 with value: 2072.137476888861.[0m
[32m[I 2024-10-13 10:12:35,805][0m Trial 487 finished with value: 2422.272700801276 and parameters: {'depth': 11, 'learning_rate': 0.0007144829353552556, 'iterations': 2747, 'l2_leaf_reg': 1.5723886983015268e-08, 'border_count': 28, 'bagging_temperature': 0.400242481981743, 'random_strength': 1.998213434337078, 'grow_policy': 'Depthwise', 'min_data_in_leaf': 17}. Best is trial 349 with value: 2072.137476888861.[0m
[32m[I 2024-10-13 10:12:40,018][0m Trial 488 finished with value: 2199.7269676240658 and parameters: {'depth': 11, 'learning_rate': 0.000692620976506208, 'iterations': 2869, 'l2_leaf_reg': 3.930427407875002e-08, 'border_count': 29, 'bagging_temperature': 0.06197010820312249, 'random_strength': 2.22388594382827, 'grow_policy': 'Depthwise', 'min_data_in_leaf': 114}. Best is trial 349 with value: 2072.137476888861.[0m
[32m[I 2024-10-13 10:12:46,328][0m Trial 489 finished with value: 2179.647990430653 and parameters: {'depth': 11, 'learning_rate': 0.0005768181702601957, 'iterations': 2949, 'l2_leaf_reg': 2.6284735038474647e-08, 'border_count': 22, 'bagging_temperature': 0.07579399979150411, 'random_strength': 2.6579637093946618, 'grow_policy': 'Depthwise', 'min_data_in_leaf': 50}. Best is trial 349 with value: 2072.137476888861.[0m
[32m[I 2024-10-13 10:14:02,515][0m Trial 490 finished with value: 2489.26304378967 and parameters: {'depth': 11, 'learning_rate': 0.0005614343216955196, 'iterations': 2834, 'l2_leaf_reg': 1.584243113174796e-08, 'border_count': 29, 'bagging_temperature': 0.05275386661974743, 'random_strength': 2.396595551060877, 'grow_policy': 'SymmetricTree', 'min_data_in_leaf': 21}. Best is trial 349 with value: 2072.137476888861.[0m
[32m[I 2024-10-13 10:14:07,065][0m Trial 491 finished with value: 2805.9623601650455 and parameters: {'depth': 12, 'learning_rate': 0.000640212495245619, 'iterations': 2775, 'l2_leaf_reg': 8.11201125304225e-08, 'border_count': 12, 'bagging_temperature': 0.04764372586962262, 'random_strength': 1.797427608341605, 'grow_policy': 'Depthwise', 'min_data_in_leaf': 74}. Best is trial 349 with value: 2072.137476888861.[0m
[32m[I 2024-10-13 10:14:12,537][0m Trial 492 finished with value: 3446.278660738053 and parameters: {'depth': 11, 'learning_rate': 0.0005227891968900772, 'iterations': 2713, 'l2_leaf_reg': 2.2520029614889392e-08, 'border_count': 1, 'bagging_temperature': 0.07527760058110244, 'random_strength': 2.130725745664287, 'grow_policy': 'Depthwise', 'min_data_in_leaf': 43}. Best is trial 349 with value: 2072.137476888861.[0m
[32m[I 2024-10-13 10:14:16,903][0m Trial 493 finished with value: 2194.763322121342 and parameters: {'depth': 11, 'learning_rate': 0.0007093884187969618, 'iterations': 2900, 'l2_leaf_reg': 4.950802538735794e-08, 'border_count': 24, 'bagging_temperature': 0.051048074350966394, 'random_strength': 2.563511434600747, 'grow_policy': 'Depthwise', 'min_data_in_leaf': 102}. Best is trial 349 with value: 2072.137476888861.[0m
[32m[I 2024-10-13 10:14:22,346][0m Trial 494 finished with value: 2163.2351742821174 and parameters: {'depth': 11, 'learning_rate': 0.0004990960613663839, 'iterations': 2813, 'l2_leaf_reg': 1.4800713901244031e-08, 'border_count': 17, 'bagging_temperature': 0.09026409025959384, 'random_strength': 1.9707095495861378, 'grow_policy': 'Depthwise', 'min_data_in_leaf': 61}. Best is trial 349 with value: 2072.137476888861.[0m
[32m[I 2024-10-13 10:14:45,070][0m Trial 495 finished with value: 2970.5822982444993 and parameters: {'depth': 12, 'learning_rate': 0.0005772876905563993, 'iterations': 2798, 'l2_leaf_reg': 2.9507390614677307e-08, 'border_count': 11, 'bagging_temperature': 0.3690169864129802, 'random_strength': 1.9103903381895275, 'grow_policy': 'Depthwise', 'min_data_in_leaf': 1}. Best is trial 349 with value: 2072.137476888861.[0m
[32m[I 2024-10-13 10:14:48,482][0m Trial 496 finished with value: 2255.955398171889 and parameters: {'depth': 11, 'learning_rate': 0.0005106447385885215, 'iterations': 2614, 'l2_leaf_reg': 1.8462740349247706e-08, 'border_count': 16, 'bagging_temperature': 0.09466747948061835, 'random_strength': 1.6609242451247253, 'grow_policy': 'Depthwise', 'min_data_in_leaf': 92}. Best is trial 349 with value: 2072.137476888861.[0m
[32m[I 2024-10-13 10:14:52,269][0m Trial 497 finished with value: 2787.206603982962 and parameters: {'depth': 11, 'learning_rate': 0.0007092155028458334, 'iterations': 2741, 'l2_leaf_reg': 3.741392954915635e-08, 'border_count': 6, 'bagging_temperature': 0.08192575531669152, 'random_strength': 2.0420889135997684, 'grow_policy': 'Depthwise', 'min_data_in_leaf': 65}. Best is trial 349 with value: 2072.137476888861.[0m
[32m[I 2024-10-13 10:14:56,267][0m Trial 498 finished with value: 2283.4338612146344 and parameters: {'depth': 12, 'learning_rate': 0.0003516919223342299, 'iterations': 2840, 'l2_leaf_reg': 1.49886772456026e-08, 'border_count': 23, 'bagging_temperature': 0.06519922587151457, 'random_strength': 1.7801031117849813, 'grow_policy': 'Depthwise', 'min_data_in_leaf': 59}. Best is trial 349 with value: 2072.137476888861.[0m
[32m[I 2024-10-13 10:15:01,518][0m Trial 499 finished with value: 2160.8792318005385 and parameters: {'depth': 11, 'learning_rate': 0.0006129887479057251, 'iterations': 2699, 'l2_leaf_reg': 2.2172870674232265e-08, 'border_count': 15, 'bagging_temperature': 0.09512264563803051, 'random_strength': 2.146982574094867, 'grow_policy': 'Depthwise', 'min_data_in_leaf': 28}. Best is trial 349 with value: 2072.137476888861.[0m
[32m[I 2024-10-13 10:15:06,424][0m Trial 500 finished with value: 3164.5796645884343 and parameters: {'depth': 11, 'learning_rate': 0.0006564191265055406, 'iterations': 2690, 'l2_leaf_reg': 4.340888230082556e-08, 'border_count': 12, 'bagging_temperature': 0.09838054205560218, 'random_strength': 1.958289695615402, 'grow_policy': 'Depthwise', 'min_data_in_leaf': 21}. Best is trial 349 with value: 2072.137476888861.[0m
[32m[I 2024-10-13 10:15:09,215][0m Trial 501 finished with value: 2349.3349265260276 and parameters: {'depth': 11, 'learning_rate': 0.0004405514511203719, 'iterations': 2535, 'l2_leaf_reg': 5.838278579590453e-08, 'border_count': 95, 'bagging_temperature': 0.08321064559211588, 'random_strength': 2.1907256675658577, 'grow_policy': 'Depthwise', 'min_data_in_leaf': 79}. Best is trial 349 with value: 2072.137476888861.[0m
[32m[I 2024-10-13 10:15:11,767][0m Trial 502 finished with value: 2199.0303226780347 and parameters: {'depth': 11, 'learning_rate': 0.000614895130616857, 'iterations': 2650, 'l2_leaf_reg': 2.7547947944942226e-08, 'border_count': 15, 'bagging_temperature': 0.06087221373827298, 'random_strength': 2.0187414669293644, 'grow_policy': 'Depthwise', 'min_data_in_leaf': 121}. Best is trial 349 with value: 2072.137476888861.[0m
[32m[I 2024-10-13 10:15:18,227][0m Trial 503 finished with value: 2956.8861653667677 and parameters: {'depth': 11, 'learning_rate': 0.030708553520730833, 'iterations': 2745, 'l2_leaf_reg': 7.728187435766097e-08, 'border_count': 9, 'bagging_temperature': 0.08647314262597239, 'random_strength': 1.6984113015887354, 'grow_policy': 'Depthwise', 'min_data_in_leaf': 21}. Best is trial 349 with value: 2072.137476888861.[0m
[32m[I 2024-10-13 10:15:30,764][0m Trial 504 finished with value: 2862.7293514170524 and parameters: {'depth': 10, 'learning_rate': 0.0005070628203736775, 'iterations': 2774, 'l2_leaf_reg': 2.1779145846006568e-08, 'border_count': 17, 'bagging_temperature': 0.06613389378661419, 'random_strength': 2.20888143250666, 'grow_policy': 'Depthwise', 'min_data_in_leaf': 1}. Best is trial 349 with value: 2072.137476888861.[0m
[32m[I 2024-10-13 10:15:34,153][0m Trial 505 finished with value: 2303.4344075219287 and parameters: {'depth': 12, 'learning_rate': 0.00038449439379991643, 'iterations': 2597, 'l2_leaf_reg': 3.429052493797444e-08, 'border_count': 29, 'bagging_temperature': 0.09109722166875067, 'random_strength': 1.935892377634751, 'grow_policy': 'Depthwise', 'min_data_in_leaf': 50}. Best is trial 349 with value: 2072.137476888861.[0m
[32m[I 2024-10-13 10:15:36,976][0m Trial 506 finished with value: 2787.4816343794296 and parameters: {'depth': 11, 'learning_rate': 0.0006898922558172029, 'iterations': 2718, 'l2_leaf_reg': 2.19298764559248e-08, 'border_count': 5, 'bagging_temperature': 0.04408155407990315, 'random_strength': 2.358615767737386, 'grow_policy': 'Depthwise', 'min_data_in_leaf': 80}. Best is trial 349 with value: 2072.137476888861.[0m
[32m[I 2024-10-13 10:15:41,182][0m Trial 507 finished with value: 2896.309812001773 and parameters: {'depth': 11, 'learning_rate': 0.0005872265738594219, 'iterations': 2808, 'l2_leaf_reg': 5.296723091526142e-08, 'border_count': 10, 'bagging_temperature': 0.04252230327985979, 'random_strength': 2.2074132767274652, 'grow_policy': 'Depthwise', 'min_data_in_leaf': 35}. Best is trial 349 with value: 2072.137476888861.[0m
[32m[I 2024-10-13 10:15:43,737][0m Trial 508 finished with value: 2319.9200490567314 and parameters: {'depth': 12, 'learning_rate': 0.00044793101713811286, 'iterations': 2710, 'l2_leaf_reg': 2.9519150964349382e-08, 'border_count': 16, 'bagging_temperature': 0.03774843179978295, 'random_strength': 2.4726104114693026, 'grow_policy': 'Depthwise', 'min_data_in_leaf': 99}. Best is trial 349 with value: 2072.137476888861.[0m
[32m[I 2024-10-13 10:15:47,133][0m Trial 509 finished with value: 2177.239679106547 and parameters: {'depth': 11, 'learning_rate': 0.0005105687251527263, 'iterations': 2641, 'l2_leaf_reg': 1.620054283240681e-08, 'border_count': 23, 'bagging_temperature': 0.0634181447951621, 'random_strength': 2.0333416790570378, 'grow_policy': 'Depthwise', 'min_data_in_leaf': 58}. Best is trial 349 with value: 2072.137476888861.[0m
