[32m[I 2024-10-13 10:46:56,178][0m Trial 765 finished with value: 2415.4022872376395 and parameters: {'depth': 11, 'learning_rate': 0.000699886910890047, 'iterations': 2757, 'l2_leaf_reg': 2.087017991253762e-08, 'border_count': 39, 'bagging_temperature': 0.041442562421803636, 'random_strength': 2.738089417475089, 'grow_policy': 'Depthwise', 'min_data_in_leaf': 17}. Best is trial 349 with value: 2072.137476888861.[0m
[32m[I 2024-10-13 10:47:05,044][0m Trial 766 finished with value: 2258.0105222266284 and parameters: {'depth': 10, 'learning_rate': 0.0008493169037507006, 'iterations': 2847, 'l2_leaf_reg': 2.6256739651175356e-08, 'border_count': 34, 'bagging_temperature': 0.017880090273614924, 'random_strength': 2.304171360637689, 'grow_policy': 'Depthwise', 'min_data_in_leaf': 32}. Best is trial 349 with value: 2072.137476888861.[0m
[32m[I 2024-10-13 10:48:17,215][0m Trial 767 finished with value: 2431.8152373228727 and parameters: {'depth': 11, 'learning_rate': 0.0006694636792857593, 'iterations': 2825, 'l2_leaf_reg': 1.7118909045908908e-08, 'border_count': 32, 'bagging_temperature': 0.05498967248893718, 'random_strength': 3.122303408962729, 'grow_policy': 'SymmetricTree', 'min_data_in_leaf': 1}. Best is trial 349 with value: 2072.137476888861.[0m
[32m[I 2024-10-13 10:48:21,454][0m Trial 768 finished with value: 2190.313708905292 and parameters: {'depth': 11, 'learning_rate': 0.0004569216024739242, 'iterations': 2770, 'l2_leaf_reg': 3.0179373099896794e-08, 'border_count': 30, 'bagging_temperature': 0.034507514288326824, 'random_strength': 1.7809738532812227, 'grow_policy': 'Depthwise', 'min_data_in_leaf': 35}. Best is trial 349 with value: 2072.137476888861.[0m
[32m[I 2024-10-13 10:48:27,613][0m Trial 769 finished with value: 2459.036272136453 and parameters: {'depth': 11, 'learning_rate': 0.0005521803548450791, 'iterations': 2892, 'l2_leaf_reg': 1.4359697869050924e-08, 'border_count': 36, 'bagging_temperature': 0.07517052135395655, 'random_strength': 2.450629218706027, 'grow_policy': 'Depthwise', 'min_data_in_leaf': 17}. Best is trial 349 with value: 2072.137476888861.[0m
[32m[I 2024-10-13 10:48:31,297][0m Trial 770 finished with value: 2247.753465608191 and parameters: {'depth': 10, 'learning_rate': 0.00038830396309651123, 'iterations': 2727, 'l2_leaf_reg': 2.143371997655783e-08, 'border_count': 39, 'bagging_temperature': 0.018994836558337884, 'random_strength': 2.202562890265922, 'grow_policy': 'Depthwise', 'min_data_in_leaf': 47}. Best is trial 349 with value: 2072.137476888861.[0m
[32m[I 2024-10-13 10:48:37,381][0m Trial 771 finished with value: 2390.3430985306586 and parameters: {'depth': 11, 'learning_rate': 0.0009650781939495164, 'iterations': 2810, 'l2_leaf_reg': 3.250833321217911e-08, 'border_count': 26, 'bagging_temperature': 0.3814766226120779, 'random_strength': 2.5857305039475467, 'grow_policy': 'Depthwise', 'min_data_in_leaf': 18}. Best is trial 349 with value: 2072.137476888861.[0m
[32m[I 2024-10-13 10:48:41,563][0m Trial 772 finished with value: 2392.312063468132 and parameters: {'depth': 6, 'learning_rate': 0.0002981341163224496, 'iterations': 2910, 'l2_leaf_reg': 0.00029355338528250365, 'border_count': 29, 'bagging_temperature': 3.180692540536573e-05, 'random_strength': 1.8845184107222912, 'grow_policy': 'Depthwise', 'min_data_in_leaf': 37}. Best is trial 349 with value: 2072.137476888861.[0m
[32m[I 2024-10-13 10:48:48,205][0m Trial 773 finished with value: 2312.0741997639007 and parameters: {'depth': 11, 'learning_rate': 0.0006469809392796996, 'iterations': 2997, 'l2_leaf_reg': 1.4575217951289057e-08, 'border_count': 26, 'bagging_temperature': 0.05047582418288088, 'random_strength': 2.840359423232063, 'grow_policy': 'Depthwise', 'min_data_in_leaf': 16}. Best is trial 349 with value: 2072.137476888861.[0m
[32m[I 2024-10-13 10:48:52,111][0m Trial 774 finished with value: 2164.964953807122 and parameters: {'depth': 11, 'learning_rate': 0.0004939295539592515, 'iterations': 2867, 'l2_leaf_reg': 2.1145157534666763e-08, 'border_count': 21, 'bagging_temperature': 0.03382758357671671, 'random_strength': 1.4811875603516278, 'grow_policy': 'Depthwise', 'min_data_in_leaf': 52}. Best is trial 349 with value: 2072.137476888861.[0m
[32m[I 2024-10-13 10:49:04,168][0m Trial 775 finished with value: 2826.911817805998 and parameters: {'depth': 10, 'learning_rate': 0.0007923660116915636, 'iterations': 2741, 'l2_leaf_reg': 1.0131304979247932e-08, 'border_count': 24, 'bagging_temperature': 0.06646133696566917, 'random_strength': 2.3285222620158845, 'grow_policy': 'Depthwise', 'min_data_in_leaf': 1}. Best is trial 349 with value: 2072.137476888861.[0m
[32m[I 2024-10-13 10:49:08,576][0m Trial 776 finished with value: 2208.697238399069 and parameters: {'depth': 11, 'learning_rate': 0.000427546241137344, 'iterations': 2692, 'l2_leaf_reg': 3.5188681893680685e-08, 'border_count': 32, 'bagging_temperature': 0.021172718155197126, 'random_strength': 2.065310925330164, 'grow_policy': 'Depthwise', 'min_data_in_leaf': 32}. Best is trial 349 with value: 2072.137476888861.[0m
[32m[I 2024-10-13 10:49:12,238][0m Trial 777 finished with value: 2319.1485021082362 and parameters: {'depth': 11, 'learning_rate': 0.0005803544914398493, 'iterations': 2947, 'l2_leaf_reg': 1.9333329926730338e-08, 'border_count': 192, 'bagging_temperature': 0.0009318351055754657, 'random_strength': 5.618075734124277, 'grow_policy': 'Depthwise', 'min_data_in_leaf': 72}. Best is trial 349 with value: 2072.137476888861.[0m
[32m[I 2024-10-13 10:49:17,377][0m Trial 778 finished with value: 2286.8966396344154 and parameters: {'depth': 11, 'learning_rate': 0.0003542447631304311, 'iterations': 2817, 'l2_leaf_reg': 4.01150458429429e-08, 'border_count': 20, 'bagging_temperature': 0.05028352840872823, 'random_strength': 1.6666640638484398, 'grow_policy': 'Depthwise', 'min_data_in_leaf': 49}. Best is trial 349 with value: 2072.137476888861.[0m
[32m[I 2024-10-13 10:49:26,116][0m Trial 779 finished with value: 2149.062796892951 and parameters: {'depth': 10, 'learning_rate': 0.0005254068444604725, 'iterations': 2767, 'l2_leaf_reg': 1.4278939751084291e-08, 'border_count': 25, 'bagging_temperature': 0.0003635572353665739, 'random_strength': 2.186755812632943, 'grow_policy': 'Depthwise', 'min_data_in_leaf': 31}. Best is trial 349 with value: 2072.137476888861.[0m
[32m[I 2024-10-13 10:49:46,087][0m Trial 780 finished with value: 2522.348417921851 and parameters: {'depth': 10, 'learning_rate': 0.0004818718396814674, 'iterations': 2867, 'l2_leaf_reg': 2.6210868850912692e-08, 'border_count': 89, 'bagging_temperature': 0.017171909119438524, 'random_strength': 3.354610752569053, 'grow_policy': 'Depthwise', 'min_data_in_leaf': 18}. Best is trial 349 with value: 2072.137476888861.[0m
[32m[I 2024-10-13 10:49:48,480][0m Trial 781 finished with value: 3741.076635138503 and parameters: {'depth': 10, 'learning_rate': 0.0004056324552846349, 'iterations': 725, 'l2_leaf_reg': 1.5919543348738767e-08, 'border_count': 40, 'bagging_temperature': 0.01613982247558891, 'random_strength': 1.9115119210257199, 'grow_policy': 'Depthwise', 'min_data_in_leaf': 767}. Best is trial 349 with value: 2072.137476888861.[0m
[32m[I 2024-10-13 10:50:26,180][0m Trial 782 finished with value: 2950.0284278696136 and parameters: {'depth': 10, 'learning_rate': 0.000507160693281466, 'iterations': 2794, 'l2_leaf_reg': 5.866251685735779e-08, 'border_count': 31, 'bagging_temperature': 0.03724743219223024, 'random_strength': 2.4671896325973455, 'grow_policy': 'Depthwise', 'min_data_in_leaf': 1}. Best is trial 349 with value: 2072.137476888861.[0m
[32m[I 2024-10-13 10:50:40,760][0m Trial 783 finished with value: 2605.296840731345 and parameters: {'depth': 10, 'learning_rate': 0.00024587361716575694, 'iterations': 2906, 'l2_leaf_reg': 2.704199758381553e-08, 'border_count': 25, 'bagging_temperature': 0.0005754711514853336, 'random_strength': 2.127888036210799, 'grow_policy': 'Depthwise', 'min_data_in_leaf': 31}. Best is trial 349 with value: 2072.137476888861.[0m
[32m[I 2024-10-13 10:50:55,500][0m Trial 784 finished with value: 2186.9042307130157 and parameters: {'depth': 10, 'learning_rate': 0.0004449662984442349, 'iterations': 2827, 'l2_leaf_reg': 1.0039653081010449e-08, 'border_count': 15, 'bagging_temperature': 0.0337119480291932, 'random_strength': 2.6261516410192423, 'grow_policy': 'Depthwise', 'min_data_in_leaf': 31}. Best is trial 349 with value: 2072.137476888861.[0m
[32m[I 2024-10-13 10:51:16,408][0m Trial 785 finished with value: 2715.69061987572 and parameters: {'depth': 10, 'learning_rate': 0.0003324083515203166, 'iterations': 2758, 'l2_leaf_reg': 1.5632599515523935e-08, 'border_count': 19, 'bagging_temperature': 0.07792928037032879, 'random_strength': 2.2690180907570694, 'grow_policy': 'Depthwise', 'min_data_in_leaf': 16}. Best is trial 349 with value: 2072.137476888861.[0m
[32m[I 2024-10-13 10:51:29,714][0m Trial 786 finished with value: 2872.590247381851 and parameters: {'depth': 10, 'learning_rate': 0.0006334114710909961, 'iterations': 2947, 'l2_leaf_reg': 4.073346795041903e-08, 'border_count': 10, 'bagging_temperature': 0.48334044871464804, 'random_strength': 1.8600659996540678, 'grow_policy': 'Depthwise', 'min_data_in_leaf': 46}. Best is trial 349 with value: 2072.137476888861.[0m
[32m[I 2024-10-13 10:51:46,355][0m Trial 787 finished with value: 2069.5126241767625 and parameters: {'depth': 10, 'learning_rate': 0.0005359854953324754, 'iterations': 2870, 'l2_leaf_reg': 2.2537174435673836e-08, 'border_count': 29, 'bagging_temperature': 0.001487806488798853, 'random_strength': 2.389978624954462, 'grow_policy': 'Depthwise', 'min_data_in_leaf': 25}. Best is trial 787 with value: 2069.5126241767625.[0m
[32m[I 2024-10-13 10:52:01,903][0m Trial 788 finished with value: 2665.009908730177 and parameters: {'depth': 10, 'learning_rate': 0.00037111875044460027, 'iterations': 2898, 'l2_leaf_reg': 1.9431059900058427e-08, 'border_count': 27, 'bagging_temperature': 0.0006931842055915489, 'random_strength': 2.89443576018879, 'grow_policy': 'Depthwise', 'min_data_in_leaf': 18}. Best is trial 787 with value: 2069.5126241767625.[0m
[32m[I 2024-10-13 10:53:12,699][0m Trial 789 finished with value: 2562.685724456945 and parameters: {'depth': 10, 'learning_rate': 0.00044635450861666787, 'iterations': 2935, 'l2_leaf_reg': 1.4519084185512403e-08, 'border_count': 18, 'bagging_temperature': 0.833773571313316, 'random_strength': 2.7105697330736245, 'grow_policy': 'SymmetricTree', 'min_data_in_leaf': 2}. Best is trial 787 with value: 2069.5126241767625.[0m
[32m[I 2024-10-13 10:53:24,841][0m Trial 790 finished with value: 2170.1432741404133 and parameters: {'depth': 10, 'learning_rate': 0.0005135196478005744, 'iterations': 2881, 'l2_leaf_reg': 1.418734481925927e-08, 'border_count': 23, 'bagging_temperature': 0.053990451307268685, 'random_strength': 2.506177710156503, 'grow_policy': 'Depthwise', 'min_data_in_leaf': 48}. Best is trial 787 with value: 2069.5126241767625.[0m
[32m[I 2024-10-13 10:53:39,562][0m Trial 791 finished with value: 2859.751068764338 and parameters: {'depth': 10, 'learning_rate': 0.0004123245091688574, 'iterations': 2861, 'l2_leaf_reg': 2.2343949789138882e-08, 'border_count': 11, 'bagging_temperature': 0.020689468717332342, 'random_strength': 2.4173033138279925, 'grow_policy': 'Depthwise', 'min_data_in_leaf': 30}. Best is trial 787 with value: 2069.5126241767625.[0m
[32m[I 2024-10-13 10:54:01,672][0m Trial 792 finished with value: 2522.480931202429 and parameters: {'depth': 10, 'learning_rate': 0.00054489267647189, 'iterations': 2998, 'l2_leaf_reg': 3.693230352319394e-08, 'border_count': 60, 'bagging_temperature': 0.037447171131507424, 'random_strength': 2.9980365006708505, 'grow_policy': 'Depthwise', 'min_data_in_leaf': 19}. Best is trial 787 with value: 2069.5126241767625.[0m
[32m[I 2024-10-13 10:54:14,292][0m Trial 793 finished with value: 2300.353726811042 and parameters: {'depth': 10, 'learning_rate': 0.00033319000343940244, 'iterations': 2944, 'l2_leaf_reg': 2.1469658594385416e-08, 'border_count': 34, 'bagging_temperature': 0.07820798952449223, 'random_strength': 2.7236330008751044, 'grow_policy': 'Depthwise', 'min_data_in_leaf': 60}. Best is trial 787 with value: 2069.5126241767625.[0m
[32m[I 2024-10-13 10:54:25,123][0m Trial 794 finished with value: 2170.9473980926264 and parameters: {'depth': 10, 'learning_rate': 0.00046377396535893527, 'iterations': 2843, 'l2_leaf_reg': 1.041345271756987e-08, 'border_count': 16, 'bagging_temperature': 0.02214228028511651, 'random_strength': 2.396156870731132, 'grow_policy': 'Depthwise', 'min_data_in_leaf': 38}. Best is trial 787 with value: 2069.5126241767625.[0m
[32m[I 2024-10-13 10:54:38,305][0m Trial 795 finished with value: 2478.450780451288 and parameters: {'depth': 10, 'learning_rate': 0.000538322812305094, 'iterations': 2888, 'l2_leaf_reg': 5.835188286716489e-08, 'border_count': 24, 'bagging_temperature': 0.00010672763922691536, 'random_strength': 1.3512725537431294, 'grow_policy': 'Depthwise', 'min_data_in_leaf': 13}. Best is trial 787 with value: 2069.5126241767625.[0m
[32m[I 2024-10-13 10:54:43,717][0m Trial 796 finished with value: 3077.7392408603787 and parameters: {'depth': 10, 'learning_rate': 0.05484584959469575, 'iterations': 2793, 'l2_leaf_reg': 9.76128736293859e-08, 'border_count': 6, 'bagging_temperature': 0.449266116305464, 'random_strength': 2.04635430969822, 'grow_policy': 'Depthwise', 'min_data_in_leaf': 59}. Best is trial 787 with value: 2069.5126241767625.[0m
[32m[I 2024-10-13 10:54:47,937][0m Trial 797 finished with value: 2820.9251014557917 and parameters: {'depth': 10, 'learning_rate': 0.0004089732002378308, 'iterations': 2941, 'l2_leaf_reg': 1.0031303892978434e-08, 'border_count': 12, 'bagging_temperature': 0.058128591989578954, 'random_strength': 2.6114976486782715, 'grow_policy': 'Depthwise', 'min_data_in_leaf': 38}. Best is trial 787 with value: 2069.5126241767625.[0m
[32m[I 2024-10-13 10:55:01,619][0m Trial 798 finished with value: 3290.8190968856647 and parameters: {'depth': 10, 'learning_rate': 0.0002776423850714172, 'iterations': 2998, 'l2_leaf_reg': 3.2807391581246224e-08, 'border_count': 20, 'bagging_temperature': 0.034004007409572726, 'random_strength': 1.6592969667395017, 'grow_policy': 'Depthwise', 'min_data_in_leaf': 1}. Best is trial 787 with value: 2069.5126241767625.[0m
[32m[I 2024-10-13 10:55:05,598][0m Trial 799 finished with value: 2175.158857435188 and parameters: {'depth': 10, 'learning_rate': 0.0005691398278580682, 'iterations': 2848, 'l2_leaf_reg': 2.0071118458854248e-08, 'border_count': 28, 'bagging_temperature': 0.00014094035278084175, 'random_strength': 2.3534580344643623, 'grow_policy': 'Depthwise', 'min_data_in_leaf': 51}. Best is trial 787 with value: 2069.5126241767625.[0m
[32m[I 2024-10-13 10:55:18,406][0m Trial 800 finished with value: 3140.844691487974 and parameters: {'depth': 10, 'learning_rate': 0.000464241253726551, 'iterations': 2809, 'l2_leaf_reg': 1.5892044557047845e-08, 'border_count': 15, 'bagging_temperature': 0.09841856043718811, 'random_strength': 2.0235589063912407, 'grow_policy': 'Depthwise', 'min_data_in_leaf': 1}. Best is trial 787 with value: 2069.5126241767625.[0m
[32m[I 2024-10-13 10:55:23,403][0m Trial 801 finished with value: 2211.7127001415224 and parameters: {'depth': 9, 'learning_rate': 0.0003809683284236794, 'iterations': 2903, 'l2_leaf_reg': 2.7289912728304997e-08, 'border_count': 22, 'bagging_temperature': 0.05127098996033988, 'random_strength': 2.1586243844850155, 'grow_policy': 'Depthwise', 'min_data_in_leaf': 27}. Best is trial 787 with value: 2069.5126241767625.[0m
[32m[I 2024-10-13 10:55:26,459][0m Trial 802 finished with value: 2231.46306114731 and parameters: {'depth': 11, 'learning_rate': 0.0007140067936702196, 'iterations': 2827, 'l2_leaf_reg': 5.2483974595403924e-08, 'border_count': 37, 'bagging_temperature': 0.020229984510022312, 'random_strength': 2.3261548692633154, 'grow_policy': 'Depthwise', 'min_data_in_leaf': 74}. Best is trial 787 with value: 2069.5126241767625.[0m
[32m[I 2024-10-13 10:55:31,298][0m Trial 803 finished with value: 2881.505129167413 and parameters: {'depth': 11, 'learning_rate': 0.0005121325465490576, 'iterations': 2689, 'l2_leaf_reg': 1.4308119781933919e-08, 'border_count': 8, 'bagging_temperature': 0.07084750988505586, 'random_strength': 6.568360280333323, 'grow_policy': 'Depthwise', 'min_data_in_leaf': 33}. Best is trial 787 with value: 2069.5126241767625.[0m
[32m[I 2024-10-13 10:55:35,114][0m Trial 804 finished with value: 2197.817500799375 and parameters: {'depth': 11, 'learning_rate': 0.0006094700974566, 'iterations': 2938, 'l2_leaf_reg': 4.11661368366663e-08, 'border_count': 27, 'bagging_temperature': 0.03727628226322258, 'random_strength': 1.7945670083817424, 'grow_policy': 'Depthwise', 'min_data_in_leaf': 58}. Best is trial 787 with value: 2069.5126241767625.[0m
[32m[I 2024-10-13 10:55:40,758][0m Trial 805 finished with value: 2457.1413625431455 and parameters: {'depth': 10, 'learning_rate': 0.00046368483311150314, 'iterations': 2768, 'l2_leaf_reg': 0.0015409794988681376, 'border_count': 18, 'bagging_temperature': 0.020533065095455067, 'random_strength': 2.5610817760308415, 'grow_policy': 'Depthwise', 'min_data_in_leaf': 19}. Best is trial 787 with value: 2069.5126241767625.[0m
[32m[I 2024-10-13 10:55:44,734][0m Trial 806 finished with value: 2215.6750856834533 and parameters: {'depth': 11, 'learning_rate': 0.0007146068848912638, 'iterations': 2872, 'l2_leaf_reg': 7.720814925686933e-08, 'border_count': 13, 'bagging_temperature': 0.08163493194455701, 'random_strength': 2.7724518922841352, 'grow_policy': 'Depthwise', 'min_data_in_leaf': 46}. Best is trial 787 with value: 2069.5126241767625.[0m
[32m[I 2024-10-13 10:55:58,117][0m Trial 807 finished with value: 2754.3576731285298 and parameters: {'depth': 11, 'learning_rate': 0.0005534565887839849, 'iterations': 2795, 'l2_leaf_reg': 2.671719831489743e-08, 'border_count': 22, 'bagging_temperature': 0.05174912016778882, 'random_strength': 1.9526865085216187, 'grow_policy': 'Depthwise', 'min_data_in_leaf': 1}. Best is trial 787 with value: 2069.5126241767625.[0m
[32m[I 2024-10-13 10:56:01,244][0m Trial 808 finished with value: 2330.7210641354777 and parameters: {'depth': 11, 'learning_rate': 0.0003260442367690481, 'iterations': 2945, 'l2_leaf_reg': 1.4329575949348241e-08, 'border_count': 30, 'bagging_temperature': 0.034562191933708505, 'random_strength': 3.1759009028321636, 'grow_policy': 'Depthwise', 'min_data_in_leaf': 80}. Best is trial 787 with value: 2069.5126241767625.[0m
[32m[I 2024-10-13 10:56:05,314][0m Trial 809 finished with value: 2907.872117624847 and parameters: {'depth': 10, 'learning_rate': 0.00041903239559412295, 'iterations': 2697, 'l2_leaf_reg': 2.0675665811734975e-08, 'border_count': 4, 'bagging_temperature': 0.8035412166721339, 'random_strength': 2.222913697189481, 'grow_policy': 'Depthwise', 'min_data_in_leaf': 29}. Best is trial 787 with value: 2069.5126241767625.[0m
[32m[I 2024-10-13 10:56:24,482][0m Trial 810 finished with value: 2631.46742746944 and parameters: {'depth': 11, 'learning_rate': 0.01199180197068331, 'iterations': 2857, 'l2_leaf_reg': 3.740178603111898e-08, 'border_count': 19, 'bagging_temperature': 0.0006013878217876328, 'random_strength': 1.552454415962302, 'grow_policy': 'SymmetricTree', 'min_data_in_leaf': 62}. Best is trial 787 with value: 2069.5126241767625.[0m
[32m[I 2024-10-13 10:56:27,077][0m Trial 811 finished with value: 2804.451227236539 and parameters: {'depth': 11, 'learning_rate': 0.0006238867580666681, 'iterations': 2754, 'l2_leaf_reg': 1.025479371989061e-08, 'border_count': 11, 'bagging_temperature': 0.05876921651591913, 'random_strength': 2.3234004269570567, 'grow_policy': 'Depthwise', 'min_data_in_leaf': 102}. Best is trial 787 with value: 2069.5126241767625.[0m
[32m[I 2024-10-13 10:56:31,929][0m Trial 812 finished with value: 4030.2749972128286 and parameters: {'depth': 11, 'learning_rate': 0.0001199626894705549, 'iterations': 2405, 'l2_leaf_reg': 2.150020434806189e-08, 'border_count': 25, 'bagging_temperature': 0.01908873210482565, 'random_strength': 2.020727611563803, 'grow_policy': 'Depthwise', 'min_data_in_leaf': 16}. Best is trial 787 with value: 2069.5126241767625.[0m
[32m[I 2024-10-13 10:56:32,992][0m Trial 813 finished with value: 4062.330228214333 and parameters: {'depth': 10, 'learning_rate': 0.00038205662016976074, 'iterations': 476, 'l2_leaf_reg': 2.927184862578895e-08, 'border_count': 17, 'bagging_temperature': 0.10763496630460964, 'random_strength': 2.5476869606986834, 'grow_policy': 'Depthwise', 'min_data_in_leaf': 42}. Best is trial 787 with value: 2069.5126241767625.[0m
[32m[I 2024-10-13 10:56:38,808][0m Trial 814 finished with value: 2060.357404924192 and parameters: {'depth': 10, 'learning_rate': 0.0005223469739458939, 'iterations': 2903, 'l2_leaf_reg': 1.352409718656662e-07, 'border_count': 33, 'bagging_temperature': 0.04071483786461014, 'random_strength': 1.7488754021349995, 'grow_policy': 'Depthwise', 'min_data_in_leaf': 21}. Best is trial 814 with value: 2060.357404924192.[0m
[32m[I 2024-10-13 10:56:51,036][0m Trial 815 finished with value: 2620.3795480267854 and parameters: {'depth': 9, 'learning_rate': 0.0007852207317966943, 'iterations': 2969, 'l2_leaf_reg': 1.3404788272575822e-07, 'border_count': 40, 'bagging_temperature': 0.06520509038223359, 'random_strength': 1.3108866243916366, 'grow_policy': 'Depthwise', 'min_data_in_leaf': 1}. Best is trial 814 with value: 2060.357404924192.[0m
