[32m[I 2024-10-13 09:33:41,101][0m Trial 151 finished with value: 2259.9883085581046 and parameters: {'depth': 15, 'learning_rate': 0.0023040050329369063, 'iterations': 1260, 'l2_leaf_reg': 0.09183551619913972, 'border_count': 19, 'bagging_temperature': 0.6624252192212114, 'random_strength': 4.837098957045409, 'grow_policy': 'Lossguide', 'min_data_in_leaf': 875, 'max_leaves': 98}. Best is trial 52 with value: 2182.908535006516.[0m
[32m[I 2024-10-13 09:33:43,260][0m Trial 152 finished with value: 2232.8563852249135 and parameters: {'depth': 4, 'learning_rate': 0.0017350377978920853, 'iterations': 1253, 'l2_leaf_reg': 0.21316768255706092, 'border_count': 22, 'bagging_temperature': 0.6731891693322614, 'random_strength': 4.652304281675979, 'grow_policy': 'Lossguide', 'min_data_in_leaf': 867, 'max_leaves': 101}. Best is trial 52 with value: 2182.908535006516.[0m
[32m[I 2024-10-13 09:33:45,714][0m Trial 153 finished with value: 2867.9014707789374 and parameters: {'depth': 4, 'learning_rate': 0.0016579061331222194, 'iterations': 1241, 'l2_leaf_reg': 0.05572382040854233, 'border_count': 9, 'bagging_temperature': 0.9409049353804929, 'random_strength': 4.643095911114885, 'grow_policy': 'Lossguide', 'min_data_in_leaf': 866, 'max_leaves': 113}. Best is trial 52 with value: 2182.908535006516.[0m
[32m[I 2024-10-13 09:33:48,080][0m Trial 154 finished with value: 2290.504797989172 and parameters: {'depth': 5, 'learning_rate': 0.0012047479874511256, 'iterations': 1172, 'l2_leaf_reg': 0.21446430276293219, 'border_count': 23, 'bagging_temperature': 0.6796026333903299, 'random_strength': 4.483673548667201, 'grow_policy': 'Lossguide', 'min_data_in_leaf': 910, 'max_leaves': 125}. Best is trial 52 with value: 2182.908535006516.[0m
[32m[I 2024-10-13 09:33:49,866][0m Trial 155 finished with value: 2261.9158212972648 and parameters: {'depth': 6, 'learning_rate': 0.001910387438984855, 'iterations': 1114, 'l2_leaf_reg': 0.10842453035612254, 'border_count': 35, 'bagging_temperature': 0.6539020544070271, 'random_strength': 4.82251732655878, 'grow_policy': 'Lossguide', 'min_data_in_leaf': 832, 'max_leaves': 99}. Best is trial 52 with value: 2182.908535006516.[0m
[32m[I 2024-10-13 09:33:52,595][0m Trial 156 finished with value: 2241.6559868815334 and parameters: {'depth': 4, 'learning_rate': 0.003178823457432924, 'iterations': 1376, 'l2_leaf_reg': 0.3835779024029246, 'border_count': 16, 'bagging_temperature': 0.7156000729834667, 'random_strength': 3.5757747699765106, 'grow_policy': 'Lossguide', 'min_data_in_leaf': 854, 'max_leaves': 105}. Best is trial 52 with value: 2182.908535006516.[0m
[32m[I 2024-10-13 09:33:54,879][0m Trial 157 finished with value: 2237.803682354195 and parameters: {'depth': 3, 'learning_rate': 0.005574527932501719, 'iterations': 1404, 'l2_leaf_reg': 0.41107005026208, 'border_count': 16, 'bagging_temperature': 0.705140816209547, 'random_strength': 3.6045951250298756, 'grow_policy': 'Lossguide', 'min_data_in_leaf': 601, 'max_leaves': 105}. Best is trial 52 with value: 2182.908535006516.[0m
[32m[I 2024-10-13 09:33:57,706][0m Trial 158 finished with value: 2246.462129335957 and parameters: {'depth': 3, 'learning_rate': 0.005599685957410848, 'iterations': 1440, 'l2_leaf_reg': 1.0097459922990872, 'border_count': 13, 'bagging_temperature': 0.7152429404870131, 'random_strength': 3.7059520043527607, 'grow_policy': 'Lossguide', 'min_data_in_leaf': 970, 'max_leaves': 107}. Best is trial 52 with value: 2182.908535006516.[0m
[32m[I 2024-10-13 09:34:00,016][0m Trial 159 finished with value: 2881.894991686736 and parameters: {'depth': 4, 'learning_rate': 0.009548709570055646, 'iterations': 1380, 'l2_leaf_reg': 2.9205651256382885, 'border_count': 5, 'bagging_temperature': 0.7210853959521886, 'random_strength': 3.7581322218404813, 'grow_policy': 'Lossguide', 'min_data_in_leaf': 585, 'max_leaves': 106}. Best is trial 52 with value: 2182.908535006516.[0m
[32m[I 2024-10-13 09:34:02,876][0m Trial 160 finished with value: 3664.409004176714 and parameters: {'depth': 3, 'learning_rate': 0.005545040513808247, 'iterations': 1457, 'l2_leaf_reg': 1.4656851085414593, 'border_count': 1, 'bagging_temperature': 0.7152812455312536, 'random_strength': 3.467373348635859, 'grow_policy': 'Depthwise', 'min_data_in_leaf': 555}. Best is trial 52 with value: 2182.908535006516.[0m
[32m[I 2024-10-13 09:34:04,455][0m Trial 161 finished with value: 2247.1468579426178 and parameters: {'depth': 3, 'learning_rate': 0.006928973794257823, 'iterations': 1347, 'l2_leaf_reg': 0.7826665556165644, 'border_count': 13, 'bagging_temperature': 0.6898561966625595, 'random_strength': 3.2234754923380757, 'grow_policy': 'Lossguide', 'min_data_in_leaf': 968, 'max_leaves': 108}. Best is trial 52 with value: 2182.908535006516.[0m
[32m[I 2024-10-13 09:34:07,898][0m Trial 162 finished with value: 2898.5264174022554 and parameters: {'depth': 3, 'learning_rate': 0.007477112430909624, 'iterations': 1406, 'l2_leaf_reg': 0.7352062990586787, 'border_count': 12, 'bagging_temperature': 0.7430377431646638, 'random_strength': 3.1563512960580247, 'grow_policy': 'Lossguide', 'min_data_in_leaf': 975, 'max_leaves': 109}. Best is trial 52 with value: 2182.908535006516.[0m
[32m[I 2024-10-13 09:34:11,136][0m Trial 163 finished with value: 2330.7696638600514 and parameters: {'depth': 3, 'learning_rate': 0.006968197812957455, 'iterations': 1334, 'l2_leaf_reg': 0.5900654967284916, 'border_count': 24, 'bagging_temperature': 0.6947665687618573, 'random_strength': 2.8580428857900086, 'grow_policy': 'Lossguide', 'min_data_in_leaf': 998, 'max_leaves': 122}. Best is trial 52 with value: 2182.908535006516.[0m
[32m[I 2024-10-13 09:34:14,344][0m Trial 164 finished with value: 2254.904010031758 and parameters: {'depth': 4, 'learning_rate': 0.005862294898546326, 'iterations': 1541, 'l2_leaf_reg': 0.9237674168343045, 'border_count': 16, 'bagging_temperature': 0.7507532487235152, 'random_strength': 3.527644991577928, 'grow_policy': 'Lossguide', 'min_data_in_leaf': 963, 'max_leaves': 112}. Best is trial 52 with value: 2182.908535006516.[0m
[32m[I 2024-10-13 09:34:16,207][0m Trial 165 finished with value: 2961.810972099064 and parameters: {'depth': 4, 'learning_rate': 0.005824379868718106, 'iterations': 812, 'l2_leaf_reg': 2.8117769972074, 'border_count': 9, 'bagging_temperature': 0.7568246334859858, 'random_strength': 3.7340844948491374, 'grow_policy': 'Lossguide', 'min_data_in_leaf': 970, 'max_leaves': 117}. Best is trial 52 with value: 2182.908535006516.[0m
[32m[I 2024-10-13 09:34:18,787][0m Trial 166 finished with value: 2246.585944618336 and parameters: {'depth': 3, 'learning_rate': 0.0037410127192311227, 'iterations': 1279, 'l2_leaf_reg': 1.30699226493526, 'border_count': 15, 'bagging_temperature': 0.6902609255257048, 'random_strength': 3.533410693830356, 'grow_policy': 'Lossguide', 'min_data_in_leaf': 620, 'max_leaves': 106}. Best is trial 52 with value: 2182.908535006516.[0m
[32m[I 2024-10-13 09:34:21,574][0m Trial 167 finished with value: 2338.1358918572887 and parameters: {'depth': 3, 'learning_rate': 0.003427592892782274, 'iterations': 1256, 'l2_leaf_reg': 0.42147103729868723, 'border_count': 28, 'bagging_temperature': 0.6735232229705417, 'random_strength': 3.324612561833661, 'grow_policy': 'Lossguide', 'min_data_in_leaf': 625, 'max_leaves': 103}. Best is trial 52 with value: 2182.908535006516.[0m
[32m[I 2024-10-13 09:34:28,071][0m Trial 168 finished with value: 2252.9794787089704 and parameters: {'depth': 3, 'learning_rate': 0.004039728782934823, 'iterations': 1074, 'l2_leaf_reg': 1.1611187708690156, 'border_count': 15, 'bagging_temperature': 0.7757976282088245, 'random_strength': 3.9116579473025634, 'grow_policy': 'Lossguide', 'min_data_in_leaf': 610, 'max_leaves': 107}. Best is trial 52 with value: 2182.908535006516.[0m
[32m[I 2024-10-13 09:34:30,180][0m Trial 169 finished with value: 2952.268364098709 and parameters: {'depth': 3, 'learning_rate': 0.0030867991437240807, 'iterations': 1212, 'l2_leaf_reg': 1.6820129718192345, 'border_count': 8, 'bagging_temperature': 0.7769216379658743, 'random_strength': 2.488507309148263, 'grow_policy': 'Lossguide', 'min_data_in_leaf': 613, 'max_leaves': 109}. Best is trial 52 with value: 2182.908535006516.[0m
[32m[I 2024-10-13 09:34:32,143][0m Trial 170 finished with value: 2292.5732249268767 and parameters: {'depth': 3, 'learning_rate': 0.003913187479301603, 'iterations': 1360, 'l2_leaf_reg': 7.206838656417001, 'border_count': 14, 'bagging_temperature': 0.7275103173775377, 'random_strength': 3.0971227625075315, 'grow_policy': 'Lossguide', 'min_data_in_leaf': 563, 'max_leaves': 102}. Best is trial 52 with value: 2182.908535006516.[0m
[32m[I 2024-10-13 09:34:34,448][0m Trial 171 finished with value: 2270.757908307447 and parameters: {'depth': 4, 'learning_rate': 0.004798464971082281, 'iterations': 1102, 'l2_leaf_reg': 1.230677477579338, 'border_count': 18, 'bagging_temperature': 0.6958640211920206, 'random_strength': 3.9528121856508527, 'grow_policy': 'Lossguide', 'min_data_in_leaf': 589, 'max_leaves': 107}. Best is trial 52 with value: 2182.908535006516.[0m
[32m[I 2024-10-13 09:34:36,568][0m Trial 172 finished with value: 2867.45871529984 and parameters: {'depth': 3, 'learning_rate': 0.00400221407844216, 'iterations': 1012, 'l2_leaf_reg': 0.3600006277370872, 'border_count': 11, 'bagging_temperature': 0.6796888425106234, 'random_strength': 3.700901923073836, 'grow_policy': 'Lossguide', 'min_data_in_leaf': 652, 'max_leaves': 115}. Best is trial 52 with value: 2182.908535006516.[0m
[32m[I 2024-10-13 09:34:38,768][0m Trial 173 finished with value: 2268.0620895458287 and parameters: {'depth': 3, 'learning_rate': 0.005377821059560955, 'iterations': 1297, 'l2_leaf_reg': 0.8774069402665418, 'border_count': 21, 'bagging_temperature': 0.7089698321360105, 'random_strength': 4.138815036637642, 'grow_policy': 'Lossguide', 'min_data_in_leaf': 545, 'max_leaves': 100}. Best is trial 52 with value: 2182.908535006516.[0m
[32m[I 2024-10-13 09:34:41,475][0m Trial 174 finished with value: 2880.594420839498 and parameters: {'depth': 4, 'learning_rate': 0.008128869945925927, 'iterations': 1361, 'l2_leaf_reg': 0.45267542695551694, 'border_count': 5, 'bagging_temperature': 0.6333040198433152, 'random_strength': 3.570222813919847, 'grow_policy': 'Lossguide', 'min_data_in_leaf': 492, 'max_leaves': 197}. Best is trial 52 with value: 2182.908535006516.[0m
[32m[I 2024-10-13 09:34:43,689][0m Trial 175 finished with value: 2332.0453441346813 and parameters: {'depth': 3, 'learning_rate': 0.0034012601236298448, 'iterations': 1052, 'l2_leaf_reg': 2.0177193911975886, 'border_count': 29, 'bagging_temperature': 0.6872349364508008, 'random_strength': 3.26345261922266, 'grow_policy': 'Lossguide', 'min_data_in_leaf': 680, 'max_leaves': 95}. Best is trial 52 with value: 2182.908535006516.[0m
[32m[I 2024-10-13 09:34:45,608][0m Trial 176 finished with value: 2277.2814533625105 and parameters: {'depth': 3, 'learning_rate': 0.006449999567222336, 'iterations': 1150, 'l2_leaf_reg': 3.6346194684192836, 'border_count': 14, 'bagging_temperature': 0.6522478563145306, 'random_strength': 3.99839708287905, 'grow_policy': 'Lossguide', 'min_data_in_leaf': 600, 'max_leaves': 130}. Best is trial 52 with value: 2182.908535006516.[0m
[32m[I 2024-10-13 09:34:54,241][0m Trial 177 finished with value: 2672.9630227697075 and parameters: {'depth': 3, 'learning_rate': 0.010393804950270044, 'iterations': 1485, 'l2_leaf_reg': 1.14360230607039, 'border_count': 25, 'bagging_temperature': 0.6195418334302636, 'random_strength': 2.794661279731954, 'grow_policy': 'SymmetricTree', 'min_data_in_leaf': 534}. Best is trial 52 with value: 2182.908535006516.[0m
[32m[I 2024-10-13 09:34:56,266][0m Trial 178 finished with value: 2245.558909155017 and parameters: {'depth': 4, 'learning_rate': 0.004465478247661464, 'iterations': 946, 'l2_leaf_reg': 0.3300232226649771, 'border_count': 17, 'bagging_temperature': 0.7309813646572596, 'random_strength': 3.8169478442210267, 'grow_policy': 'Lossguide', 'min_data_in_leaf': 951, 'max_leaves': 107}. Best is trial 52 with value: 2182.908535006516.[0m
[32m[I 2024-10-13 09:34:59,118][0m Trial 179 finished with value: 2238.995549051197 and parameters: {'depth': 5, 'learning_rate': 0.004233898398262461, 'iterations': 1404, 'l2_leaf_reg': 0.34549106343675084, 'border_count': 16, 'bagging_temperature': 0.7283729159515693, 'random_strength': 3.5781945215150155, 'grow_policy': 'Depthwise', 'min_data_in_leaf': 631}. Best is trial 52 with value: 2182.908535006516.[0m
[32m[I 2024-10-13 09:35:01,544][0m Trial 180 finished with value: 2860.9689117590556 and parameters: {'depth': 4, 'learning_rate': 0.005344527304342755, 'iterations': 1407, 'l2_leaf_reg': 0.3558809615838398, 'border_count': 6, 'bagging_temperature': 0.730103930180768, 'random_strength': 3.4712962987024487, 'grow_policy': 'Depthwise', 'min_data_in_leaf': 934}. Best is trial 52 with value: 2182.908535006516.[0m
[32m[I 2024-10-13 09:35:04,120][0m Trial 181 finished with value: 2243.0207188732998 and parameters: {'depth': 5, 'learning_rate': 0.004019541746569075, 'iterations': 1278, 'l2_leaf_reg': 0.6965391132638271, 'border_count': 16, 'bagging_temperature': 0.7648089227420476, 'random_strength': 3.790078321675003, 'grow_policy': 'Depthwise', 'min_data_in_leaf': 627}. Best is trial 52 with value: 2182.908535006516.[0m
[32m[I 2024-10-13 09:35:06,821][0m Trial 182 finished with value: 2262.4493197100187 and parameters: {'depth': 5, 'learning_rate': 0.004444388159452492, 'iterations': 1294, 'l2_leaf_reg': 0.6126458917524111, 'border_count': 21, 'bagging_temperature': 0.7051466308561601, 'random_strength': 3.0048347987840245, 'grow_policy': 'Depthwise', 'min_data_in_leaf': 635}. Best is trial 52 with value: 2182.908535006516.[0m
[32m[I 2024-10-13 09:35:09,265][0m Trial 183 finished with value: 2879.890837787573 and parameters: {'depth': 5, 'learning_rate': 0.006899196849565405, 'iterations': 1444, 'l2_leaf_reg': 0.254854315906148, 'border_count': 11, 'bagging_temperature': 0.764282606377398, 'random_strength': 3.5892207530745117, 'grow_policy': 'Depthwise', 'min_data_in_leaf': 619}. Best is trial 52 with value: 2182.908535006516.[0m
[32m[I 2024-10-13 09:35:11,809][0m Trial 184 finished with value: 2252.475419467311 and parameters: {'depth': 5, 'learning_rate': 0.0029458106653593584, 'iterations': 1241, 'l2_leaf_reg': 0.7036079020232723, 'border_count': 16, 'bagging_temperature': 0.7398147861518833, 'random_strength': 3.2988936960377147, 'grow_policy': 'Depthwise', 'min_data_in_leaf': 582}. Best is trial 52 with value: 2182.908535006516.[0m
[32m[I 2024-10-13 09:35:14,152][0m Trial 185 finished with value: 2342.1792559865585 and parameters: {'depth': 4, 'learning_rate': 0.003451549445258547, 'iterations': 1322, 'l2_leaf_reg': 4.490489731824946e-06, 'border_count': 27, 'bagging_temperature': 0.6657055565261073, 'random_strength': 4.244675720841234, 'grow_policy': 'Depthwise', 'min_data_in_leaf': 671}. Best is trial 52 with value: 2182.908535006516.[0m
[32m[I 2024-10-13 09:35:16,964][0m Trial 186 finished with value: 2259.70424363568 and parameters: {'depth': 4, 'learning_rate': 0.0050261943434927, 'iterations': 1372, 'l2_leaf_reg': 0.28915929828856257, 'border_count': 21, 'bagging_temperature': 0.7151720766937542, 'random_strength': 3.7422042593907743, 'grow_policy': 'Depthwise', 'min_data_in_leaf': 573}. Best is trial 52 with value: 2182.908535006516.[0m
[32m[I 2024-10-13 09:35:19,874][0m Trial 187 finished with value: 2441.9703443140797 and parameters: {'depth': 4, 'learning_rate': 0.008817377611039394, 'iterations': 1507, 'l2_leaf_reg': 0.4663040088823516, 'border_count': 33, 'bagging_temperature': 0.7038101984602537, 'random_strength': 8.2521184559695, 'grow_policy': 'Depthwise', 'min_data_in_leaf': 944}. Best is trial 52 with value: 2182.908535006516.[0m
[32m[I 2024-10-13 09:35:21,613][0m Trial 188 finished with value: 3453.926884264906 and parameters: {'depth': 7, 'learning_rate': 0.0026446191412707234, 'iterations': 219, 'l2_leaf_reg': 0.19405942355811961, 'border_count': 9, 'bagging_temperature': 0.6854889844323134, 'random_strength': 3.4553976195767744, 'grow_policy': 'Depthwise', 'min_data_in_leaf': 979}. Best is trial 52 with value: 2182.908535006516.[0m
[32m[I 2024-10-13 09:35:27,858][0m Trial 189 finished with value: 2244.24019593906 and parameters: {'depth': 4, 'learning_rate': 0.004224503034666472, 'iterations': 1556, 'l2_leaf_reg': 2.3650530784912523e-06, 'border_count': 17, 'bagging_temperature': 0.642295572758109, 'random_strength': 3.1664701107675524, 'grow_policy': 'Depthwise', 'min_data_in_leaf': 450}. Best is trial 52 with value: 2182.908535006516.[0m
[32m[I 2024-10-13 09:35:30,543][0m Trial 190 finished with value: 3662.9149620620806 and parameters: {'depth': 5, 'learning_rate': 0.004103231253830413, 'iterations': 1558, 'l2_leaf_reg': 6.554148684285351e-07, 'border_count': 1, 'bagging_temperature': 0.6402931340635323, 'random_strength': 2.582364626076022, 'grow_policy': 'Depthwise', 'min_data_in_leaf': 444}. Best is trial 52 with value: 2182.908535006516.[0m
[32m[I 2024-10-13 09:35:33,045][0m Trial 191 finished with value: 2237.904657547247 and parameters: {'depth': 4, 'learning_rate': 0.0046409403495237134, 'iterations': 1422, 'l2_leaf_reg': 2.559660335023296e-06, 'border_count': 17, 'bagging_temperature': 0.6665310647015057, 'random_strength': 3.0144163967206645, 'grow_policy': 'Depthwise', 'min_data_in_leaf': 370}. Best is trial 52 with value: 2182.908535006516.[0m
[32m[I 2024-10-13 09:35:35,664][0m Trial 192 finished with value: 2238.308294131671 and parameters: {'depth': 4, 'learning_rate': 0.003805406418004769, 'iterations': 1417, 'l2_leaf_reg': 1.9593066841355936e-06, 'border_count': 17, 'bagging_temperature': 0.681271614732252, 'random_strength': 3.041590455269713, 'grow_policy': 'Depthwise', 'min_data_in_leaf': 397}. Best is trial 52 with value: 2182.908535006516.[0m
[32m[I 2024-10-13 09:35:37,487][0m Trial 193 finished with value: 2238.7866155058687 and parameters: {'depth': 4, 'learning_rate': 0.003483811953169417, 'iterations': 1418, 'l2_leaf_reg': 2.581114236792777e-06, 'border_count': 17, 'bagging_temperature': 0.6711335728469393, 'random_strength': 3.0454044897624977, 'grow_policy': 'Depthwise', 'min_data_in_leaf': 373}. Best is trial 52 with value: 2182.908535006516.[0m
[32m[I 2024-10-13 09:35:40,499][0m Trial 194 finished with value: 2255.2847005738436 and parameters: {'depth': 4, 'learning_rate': 0.004328628279671644, 'iterations': 1402, 'l2_leaf_reg': 2.0577072405873816e-06, 'border_count': 19, 'bagging_temperature': 0.6635621755491541, 'random_strength': 3.011315692333387, 'grow_policy': 'Depthwise', 'min_data_in_leaf': 354}. Best is trial 52 with value: 2182.908535006516.[0m
[32m[I 2024-10-13 09:35:43,575][0m Trial 195 finished with value: 2860.9906740007777 and parameters: {'depth': 4, 'learning_rate': 0.00317180303383084, 'iterations': 1472, 'l2_leaf_reg': 1.447377043876644e-06, 'border_count': 12, 'bagging_temperature': 0.7308464480686282, 'random_strength': 2.8347971696868224, 'grow_policy': 'Depthwise', 'min_data_in_leaf': 381}. Best is trial 52 with value: 2182.908535006516.[0m
[32m[I 2024-10-13 09:35:46,594][0m Trial 196 finished with value: 2311.6165427620213 and parameters: {'depth': 4, 'learning_rate': 0.005047218246071221, 'iterations': 1338, 'l2_leaf_reg': 1.2721267797154696e-06, 'border_count': 24, 'bagging_temperature': 0.6830002146889395, 'random_strength': 3.1257517625711073, 'grow_policy': 'Depthwise', 'min_data_in_leaf': 318}. Best is trial 52 with value: 2182.908535006516.[0m
[32m[I 2024-10-13 09:35:49,401][0m Trial 197 finished with value: 2838.5350601390674 and parameters: {'depth': 4, 'learning_rate': 0.0036253300219329597, 'iterations': 1276, 'l2_leaf_reg': 2.233987428052233e-06, 'border_count': 7, 'bagging_temperature': 0.6509027919001269, 'random_strength': 2.65089629611184, 'grow_policy': 'Depthwise', 'min_data_in_leaf': 401}. Best is trial 52 with value: 2182.908535006516.[0m
[32m[I 2024-10-13 09:35:52,319][0m Trial 198 finished with value: 2251.588845608005 and parameters: {'depth': 4, 'learning_rate': 0.0021983817132974178, 'iterations': 1459, 'l2_leaf_reg': 4.248439341098089e-07, 'border_count': 16, 'bagging_temperature': 0.7138180903079918, 'random_strength': 2.2655905914825967, 'grow_policy': 'Depthwise', 'min_data_in_leaf': 445}. Best is trial 52 with value: 2182.908535006516.[0m
[32m[I 2024-10-13 09:35:55,336][0m Trial 199 finished with value: 2291.7405942327273 and parameters: {'depth': 5, 'learning_rate': 0.0026149179151226387, 'iterations': 1386, 'l2_leaf_reg': 3.1860776910967277e-06, 'border_count': 23, 'bagging_temperature': 0.7574316142454695, 'random_strength': 3.321340700354175, 'grow_policy': 'Depthwise', 'min_data_in_leaf': 372}. Best is trial 52 with value: 2182.908535006516.[0m
[32m[I 2024-10-13 09:35:57,972][0m Trial 200 finished with value: 2868.394200738228 and parameters: {'depth': 4, 'learning_rate': 0.004624288760020572, 'iterations': 1331, 'l2_leaf_reg': 7.666382933441903e-07, 'border_count': 12, 'bagging_temperature': 0.6732417212783897, 'random_strength': 3.1520653907741947, 'grow_policy': 'Depthwise', 'min_data_in_leaf': 358}. Best is trial 52 with value: 2182.908535006516.[0m
[32m[I 2024-10-13 09:36:00,597][0m Trial 201 finished with value: 2261.8391615254527 and parameters: {'depth': 5, 'learning_rate': 0.0037069577080440373, 'iterations': 1203, 'l2_leaf_reg': 2.488314794826398e-06, 'border_count': 18, 'bagging_temperature': 0.694709690270127, 'random_strength': 2.8760333934597306, 'grow_policy': 'Depthwise', 'min_data_in_leaf': 331}. Best is trial 52 with value: 2182.908535006516.[0m
