[32m[I 2024-10-13 10:28:13,062][0m Trial 612 finished with value: 2786.3607719959264 and parameters: {'depth': 11, 'learning_rate': 0.0006641618135670956, 'iterations': 2778, 'l2_leaf_reg': 1.9759204130556312e-08, 'border_count': 5, 'bagging_temperature': 0.07319374108881194, 'random_strength': 2.4608742640389, 'grow_policy': 'Depthwise', 'min_data_in_leaf': 61}. Best is trial 349 with value: 2072.137476888861.[0m
[32m[I 2024-10-13 10:28:17,059][0m Trial 613 finished with value: 2186.0288397671234 and parameters: {'depth': 14, 'learning_rate': 0.00044859488982067414, 'iterations': 2738, 'l2_leaf_reg': 2.8205822105821865e-08, 'border_count': 15, 'bagging_temperature': 0.01727006790342616, 'random_strength': 2.855721880670013, 'grow_policy': 'Depthwise', 'min_data_in_leaf': 40}. Best is trial 349 with value: 2072.137476888861.[0m
[32m[I 2024-10-13 10:28:22,930][0m Trial 614 finished with value: 2312.765955770738 and parameters: {'depth': 12, 'learning_rate': 0.0005569561246744146, 'iterations': 2670, 'l2_leaf_reg': 6.603783226152503e-08, 'border_count': 24, 'bagging_temperature': 0.001407325380991642, 'random_strength': 2.6472097403380404, 'grow_policy': 'Depthwise', 'min_data_in_leaf': 19}. Best is trial 349 with value: 2072.137476888861.[0m
[32m[I 2024-10-13 10:28:37,064][0m Trial 615 finished with value: 3290.8808528497866 and parameters: {'depth': 11, 'learning_rate': 0.0003483943402036984, 'iterations': 2840, 'l2_leaf_reg': 1.7546679781453405e-08, 'border_count': 11, 'bagging_temperature': 0.03524838242200298, 'random_strength': 2.369436849845453, 'grow_policy': 'Depthwise', 'min_data_in_leaf': 1}. Best is trial 349 with value: 2072.137476888861.[0m
[32m[I 2024-10-13 10:28:39,713][0m Trial 616 finished with value: 2699.1771294568744 and parameters: {'depth': 11, 'learning_rate': 0.0002726201596291334, 'iterations': 2938, 'l2_leaf_reg': 1.3570103717409338e-08, 'border_count': 18, 'bagging_temperature': 0.05551524608599707, 'random_strength': 1.5836283970794698, 'grow_policy': 'Depthwise', 'min_data_in_leaf': 99}. Best is trial 349 with value: 2072.137476888861.[0m
[32m[I 2024-10-13 10:28:43,444][0m Trial 617 finished with value: 2172.2272933979352 and parameters: {'depth': 11, 'learning_rate': 0.0005147754365541322, 'iterations': 2792, 'l2_leaf_reg': 3.5165248125332564e-08, 'border_count': 23, 'bagging_temperature': 0.08610524678780924, 'random_strength': 2.988744726363354, 'grow_policy': 'Depthwise', 'min_data_in_leaf': 51}. Best is trial 349 with value: 2072.137476888861.[0m
[32m[I 2024-10-13 10:28:46,514][0m Trial 618 finished with value: 2185.2748367654935 and parameters: {'depth': 10, 'learning_rate': 0.0006328258458522513, 'iterations': 2893, 'l2_leaf_reg': 2.4557494657025866e-08, 'border_count': 16, 'bagging_temperature': 0.03135546429738981, 'random_strength': 1.947543241387487, 'grow_policy': 'Depthwise', 'min_data_in_leaf': 74}. Best is trial 349 with value: 2072.137476888861.[0m
[32m[I 2024-10-13 10:28:50,635][0m Trial 619 finished with value: 2917.0319126740783 and parameters: {'depth': 11, 'learning_rate': 0.0004124911406393782, 'iterations': 2737, 'l2_leaf_reg': 4.5008230683752956e-08, 'border_count': 8, 'bagging_temperature': 0.058895496262586985, 'random_strength': 2.486593459011918, 'grow_policy': 'Depthwise', 'min_data_in_leaf': 34}. Best is trial 349 with value: 2072.137476888861.[0m
[32m[I 2024-10-13 10:29:14,055][0m Trial 620 finished with value: 2627.0105654896856 and parameters: {'depth': 11, 'learning_rate': 0.0004821940970928109, 'iterations': 2631, 'l2_leaf_reg': 1.3987472646606249e-08, 'border_count': 13, 'bagging_temperature': 0.019954131439211344, 'random_strength': 2.1717791452489164, 'grow_policy': 'SymmetricTree', 'min_data_in_leaf': 58}. Best is trial 349 with value: 2072.137476888861.[0m
[32m[I 2024-10-13 10:29:19,067][0m Trial 621 finished with value: 2214.268762253735 and parameters: {'depth': 12, 'learning_rate': 0.0007787166881669988, 'iterations': 2822, 'l2_leaf_reg': 2.1190182574398176e-08, 'border_count': 23, 'bagging_temperature': 0.04245905158510904, 'random_strength': 1.258622732025968, 'grow_policy': 'Depthwise', 'min_data_in_leaf': 28}. Best is trial 349 with value: 2072.137476888861.[0m
[32m[I 2024-10-13 10:29:21,829][0m Trial 622 finished with value: 2202.1669233507673 and parameters: {'depth': 11, 'learning_rate': 0.0005867807039931587, 'iterations': 2958, 'l2_leaf_reg': 7.138591682205021e-08, 'border_count': 31, 'bagging_temperature': 0.10891459928912159, 'random_strength': 1.849173193832923, 'grow_policy': 'Depthwise', 'min_data_in_leaf': 111}. Best is trial 349 with value: 2072.137476888861.[0m
[32m[I 2024-10-13 10:29:25,678][0m Trial 623 finished with value: 2372.470975059095 and parameters: {'depth': 11, 'learning_rate': 0.0003729351119567027, 'iterations': 2864, 'l2_leaf_reg': 3.189496752754639e-08, 'border_count': 116, 'bagging_temperature': 0.07584341870263177, 'random_strength': 2.286060382736985, 'grow_policy': 'Depthwise', 'min_data_in_leaf': 43}. Best is trial 349 with value: 2072.137476888861.[0m
[32m[I 2024-10-13 10:29:38,264][0m Trial 624 finished with value: 2984.3836448327615 and parameters: {'depth': 11, 'learning_rate': 0.0004593862249727361, 'iterations': 2706, 'l2_leaf_reg': 1.3227700974373475e-08, 'border_count': 19, 'bagging_temperature': 0.0015107243423472042, 'random_strength': 2.610882962638948, 'grow_policy': 'Depthwise', 'min_data_in_leaf': 1}. Best is trial 349 with value: 2072.137476888861.[0m
[32m[I 2024-10-13 10:29:41,495][0m Trial 625 finished with value: 2203.775463836255 and parameters: {'depth': 10, 'learning_rate': 0.0006537343976955336, 'iterations': 2791, 'l2_leaf_reg': 5.004014182843544e-08, 'border_count': 26, 'bagging_temperature': 0.04907464979367574, 'random_strength': 1.378382901957512, 'grow_policy': 'Depthwise', 'min_data_in_leaf': 71}. Best is trial 349 with value: 2072.137476888861.[0m
[32m[I 2024-10-13 10:29:44,199][0m Trial 626 finished with value: 2815.408939013008 and parameters: {'depth': 13, 'learning_rate': 0.0005354122099827106, 'iterations': 2900, 'l2_leaf_reg': 1.1011692609957566e-07, 'border_count': 5, 'bagging_temperature': 0.01936597883966971, 'random_strength': 2.7471265116093573, 'grow_policy': 'Depthwise', 'min_data_in_leaf': 127}. Best is trial 349 with value: 2072.137476888861.[0m
[32m[I 2024-10-13 10:29:49,371][0m Trial 627 finished with value: 2807.1946669776594 and parameters: {'depth': 11, 'learning_rate': 0.0003284907381854316, 'iterations': 2840, 'l2_leaf_reg': 2.2127527444199787e-08, 'border_count': 14, 'bagging_temperature': 0.06597301310504218, 'random_strength': 1.9652573115751057, 'grow_policy': 'Depthwise', 'min_data_in_leaf': 20}. Best is trial 349 with value: 2072.137476888861.[0m
[32m[I 2024-10-13 10:29:52,009][0m Trial 628 finished with value: 2343.2743606290564 and parameters: {'depth': 12, 'learning_rate': 0.0004202831676562125, 'iterations': 2751, 'l2_leaf_reg': 3.530747705618625e-08, 'border_count': 19, 'bagging_temperature': 0.03323847669434591, 'random_strength': 2.4108879642288605, 'grow_policy': 'Depthwise', 'min_data_in_leaf': 88}. Best is trial 349 with value: 2072.137476888861.[0m
[32m[I 2024-10-13 10:29:55,617][0m Trial 629 finished with value: 2840.6155092247795 and parameters: {'depth': 11, 'learning_rate': 0.0006942744390745107, 'iterations': 2931, 'l2_leaf_reg': 0.00019611350505350923, 'border_count': 11, 'bagging_temperature': 0.08623871185006587, 'random_strength': 2.164184732446967, 'grow_policy': 'Depthwise', 'min_data_in_leaf': 54}. Best is trial 349 with value: 2072.137476888861.[0m
[32m[I 2024-10-13 10:30:00,395][0m Trial 630 finished with value: 2174.81187209281 and parameters: {'depth': 10, 'learning_rate': 0.0005428732236536804, 'iterations': 2996, 'l2_leaf_reg': 1.3826030705370284e-08, 'border_count': 23, 'bagging_temperature': 0.017259563949961323, 'random_strength': 3.230188380401614, 'grow_policy': 'Depthwise', 'min_data_in_leaf': 35}. Best is trial 349 with value: 2072.137476888861.[0m
[32m[I 2024-10-13 10:30:05,618][0m Trial 631 finished with value: 2125.3363631729408 and parameters: {'depth': 11, 'learning_rate': 0.00047795224291408134, 'iterations': 2687, 'l2_leaf_reg': 1.0178255626359982e-08, 'border_count': 16, 'bagging_temperature': 0.05333804413112256, 'random_strength': 1.8109083252797078, 'grow_policy': 'Depthwise', 'min_data_in_leaf': 22}. Best is trial 349 with value: 2072.137476888861.[0m
[32m[I 2024-10-13 10:30:11,596][0m Trial 632 finished with value: 3137.934005822011 and parameters: {'depth': 11, 'learning_rate': 0.00035932401153191215, 'iterations': 2614, 'l2_leaf_reg': 1.1707298287726325e-08, 'border_count': 5, 'bagging_temperature': 0.10618581466385786, 'random_strength': 1.6577209610403831, 'grow_policy': 'Depthwise', 'min_data_in_leaf': 17}. Best is trial 349 with value: 2072.137476888861.[0m
[32m[I 2024-10-13 10:30:17,846][0m Trial 633 finished with value: 2495.2192747892464 and parameters: {'depth': 10, 'learning_rate': 0.00044600919163733304, 'iterations': 2660, 'l2_leaf_reg': 1.0565697623951774e-08, 'border_count': 28, 'bagging_temperature': 0.06667036655625524, 'random_strength': 1.5049634180538742, 'grow_policy': 'Depthwise', 'min_data_in_leaf': 16}. Best is trial 349 with value: 2072.137476888861.[0m
[32m[I 2024-10-13 10:30:31,296][0m Trial 634 finished with value: 3384.258488041855 and parameters: {'depth': 11, 'learning_rate': 0.00027928536463584435, 'iterations': 2691, 'l2_leaf_reg': 1.7227875975574737e-08, 'border_count': 16, 'bagging_temperature': 0.05180965124224113, 'random_strength': 1.7068323392328661, 'grow_policy': 'Depthwise', 'min_data_in_leaf': 1}. Best is trial 349 with value: 2072.137476888861.[0m
[32m[I 2024-10-13 10:30:35,240][0m Trial 635 finished with value: 2932.370687892558 and parameters: {'depth': 11, 'learning_rate': 0.0004007492111586751, 'iterations': 2552, 'l2_leaf_reg': 1.0405572471244135e-08, 'border_count': 11, 'bagging_temperature': 0.0843726684139327, 'random_strength': 1.8260475717619624, 'grow_policy': 'Depthwise', 'min_data_in_leaf': 33}. Best is trial 349 with value: 2072.137476888861.[0m
[32m[I 2024-10-13 10:30:39,633][0m Trial 636 finished with value: 2184.889578129372 and parameters: {'depth': 12, 'learning_rate': 0.0004741295658407028, 'iterations': 2636, 'l2_leaf_reg': 1.0097931780121851e-08, 'border_count': 21, 'bagging_temperature': 0.0487862754135897, 'random_strength': 1.480435692591632, 'grow_policy': 'Depthwise', 'min_data_in_leaf': 33}. Best is trial 349 with value: 2072.137476888861.[0m
[32m[I 2024-10-13 10:30:43,195][0m Trial 637 finished with value: 2290.1106845871013 and parameters: {'depth': 11, 'learning_rate': 0.0005014906260360475, 'iterations': 2711, 'l2_leaf_reg': 1.805169388193552e-08, 'border_count': 173, 'bagging_temperature': 0.00048184118424245137, 'random_strength': 1.9565627940408183, 'grow_policy': 'Depthwise', 'min_data_in_leaf': 67}. Best is trial 349 with value: 2072.137476888861.[0m
[32m[I 2024-10-13 10:30:49,491][0m Trial 638 finished with value: 2437.2428771450454 and parameters: {'depth': 11, 'learning_rate': 0.0006104402817950189, 'iterations': 2775, 'l2_leaf_reg': 2.120138934083792e-08, 'border_count': 32, 'bagging_temperature': 0.07051051044931, 'random_strength': 1.7281670138889416, 'grow_policy': 'Depthwise', 'min_data_in_leaf': 17}. Best is trial 349 with value: 2072.137476888861.[0m
[32m[I 2024-10-13 10:30:53,359][0m Trial 639 finished with value: 2903.224114700821 and parameters: {'depth': 12, 'learning_rate': 0.0003826648605268254, 'iterations': 2899, 'l2_leaf_reg': 1.5101948573957693e-08, 'border_count': 9, 'bagging_temperature': 0.036172102949632155, 'random_strength': 2.10375379312042, 'grow_policy': 'Depthwise', 'min_data_in_leaf': 46}. Best is trial 349 with value: 2072.137476888861.[0m
[32m[I 2024-10-13 10:31:38,627][0m Trial 640 finished with value: 2847.2529413325174 and parameters: {'depth': 11, 'learning_rate': 0.06674770794329893, 'iterations': 2740, 'l2_leaf_reg': 2.632960499551858e-08, 'border_count': 26, 'bagging_temperature': 0.0939938681836031, 'random_strength': 1.1200982798405288, 'grow_policy': 'SymmetricTree', 'min_data_in_leaf': 1}. Best is trial 349 with value: 2072.137476888861.[0m
[32m[I 2024-10-13 10:31:46,319][0m Trial 641 finished with value: 3431.752119825804 and parameters: {'depth': 10, 'learning_rate': 0.00032854030412973176, 'iterations': 2841, 'l2_leaf_reg': 1.8385446821633452e-08, 'border_count': 1, 'bagging_temperature': 0.05201126058953827, 'random_strength': 2.985127521341343, 'grow_policy': 'Depthwise', 'min_data_in_leaf': 26}. Best is trial 349 with value: 2072.137476888861.[0m
[32m[I 2024-10-13 10:31:50,436][0m Trial 642 finished with value: 2171.9285296855924 and parameters: {'depth': 11, 'learning_rate': 0.00044638778245660517, 'iterations': 2960, 'l2_leaf_reg': 2.749923047712916e-08, 'border_count': 16, 'bagging_temperature': 0.020760422295679294, 'random_strength': 1.3788604683521866, 'grow_policy': 'Depthwise', 'min_data_in_leaf': 49}. Best is trial 349 with value: 2072.137476888861.[0m
[32m[I 2024-10-13 10:31:53,516][0m Trial 643 finished with value: 2132.4623488490633 and parameters: {'depth': 11, 'learning_rate': 0.0008101687648119921, 'iterations': 2660, 'l2_leaf_reg': 9.98230879059358, 'border_count': 21, 'bagging_temperature': 0.0005170625626619509, 'random_strength': 2.03795906300462, 'grow_policy': 'Depthwise', 'min_data_in_leaf': 80}. Best is trial 349 with value: 2072.137476888861.[0m
[32m[I 2024-10-13 10:31:56,364][0m Trial 644 finished with value: 2204.596488867239 and parameters: {'depth': 14, 'learning_rate': 0.0006276440447851144, 'iterations': 2589, 'l2_leaf_reg': 1.475841558178839e-08, 'border_count': 33, 'bagging_temperature': 0.014557878676597693, 'random_strength': 1.7688557382737733, 'grow_policy': 'Depthwise', 'min_data_in_leaf': 95}. Best is trial 349 with value: 2072.137476888861.[0m
[32m[I 2024-10-13 10:31:58,938][0m Trial 645 finished with value: 2212.2486197297244 and parameters: {'depth': 11, 'learning_rate': 0.0008042010402718092, 'iterations': 2499, 'l2_leaf_reg': 0.014472773457173724, 'border_count': 23, 'bagging_temperature': 0.0008057291246855742, 'random_strength': 1.596234223099111, 'grow_policy': 'Depthwise', 'min_data_in_leaf': 87}. Best is trial 349 with value: 2072.137476888861.[0m
[32m[I 2024-10-13 10:32:02,120][0m Trial 646 finished with value: 2218.4401306135487 and parameters: {'depth': 13, 'learning_rate': 0.0007629868764229933, 'iterations': 2644, 'l2_leaf_reg': 1.3683317220223976e-08, 'border_count': 25, 'bagging_temperature': 0.03546115623722752, 'random_strength': 1.9351926445642662, 'grow_policy': 'Depthwise', 'min_data_in_leaf': 73}. Best is trial 349 with value: 2072.137476888861.[0m
[32m[I 2024-10-13 10:32:04,825][0m Trial 647 finished with value: 2191.822006599466 and parameters: {'depth': 12, 'learning_rate': 0.0007140212825363868, 'iterations': 2678, 'l2_leaf_reg': 0.008613674663387378, 'border_count': 20, 'bagging_temperature': 0.0008187336935662552, 'random_strength': 2.039231926709688, 'grow_policy': 'Depthwise', 'min_data_in_leaf': 95}. Best is trial 349 with value: 2072.137476888861.[0m
[32m[I 2024-10-13 10:32:07,438][0m Trial 648 finished with value: 2229.136137277925 and parameters: {'depth': 11, 'learning_rate': 0.000576528999667452, 'iterations': 2569, 'l2_leaf_reg': 8.36182629352374e-05, 'border_count': 29, 'bagging_temperature': 0.06836392267677402, 'random_strength': 1.8561434291615986, 'grow_policy': 'Depthwise', 'min_data_in_leaf': 106}. Best is trial 349 with value: 2072.137476888861.[0m
[32m[I 2024-10-13 10:32:10,133][0m Trial 649 finished with value: 2211.1225206881913 and parameters: {'depth': 11, 'learning_rate': 0.0008428454142661699, 'iterations': 2676, 'l2_leaf_reg': 1.9377528508252755e-08, 'border_count': 20, 'bagging_temperature': 0.041929473757262734, 'random_strength': 1.612207446740182, 'grow_policy': 'Depthwise', 'min_data_in_leaf': 130}. Best is trial 349 with value: 2072.137476888861.[0m
[32m[I 2024-10-13 10:32:13,447][0m Trial 650 finished with value: 2230.1386658617307 and parameters: {'depth': 11, 'learning_rate': 0.0007025246482187045, 'iterations': 2741, 'l2_leaf_reg': 2.880082824387653e-05, 'border_count': 27, 'bagging_temperature': 0.02283772201063708, 'random_strength': 2.114148730544499, 'grow_policy': 'Depthwise', 'min_data_in_leaf': 71}. Best is trial 349 with value: 2072.137476888861.[0m
[32m[I 2024-10-13 10:32:16,115][0m Trial 651 finished with value: 2341.497561649472 and parameters: {'depth': 11, 'learning_rate': 0.0005500516794693075, 'iterations': 2639, 'l2_leaf_reg': 1.0324241987864327e-08, 'border_count': 82, 'bagging_temperature': 0.08743232680622684, 'random_strength': 2.5055693528665133, 'grow_policy': 'Depthwise', 'min_data_in_leaf': 515}. Best is trial 349 with value: 2072.137476888861.[0m
[32m[I 2024-10-13 10:32:19,557][0m Trial 652 finished with value: 2184.3076416364897 and parameters: {'depth': 12, 'learning_rate': 0.0006575257943576262, 'iterations': 2705, 'l2_leaf_reg': 2.6056660293711838e-08, 'border_count': 15, 'bagging_temperature': 0.11572485140523944, 'random_strength': 1.9993825234351252, 'grow_policy': 'Depthwise', 'min_data_in_leaf': 61}. Best is trial 349 with value: 2072.137476888861.[0m
[32m[I 2024-10-13 10:32:22,239][0m Trial 653 finished with value: 2334.2946968720607 and parameters: {'depth': 10, 'learning_rate': 0.0005287019846707607, 'iterations': 2776, 'l2_leaf_reg': 1.8028552983220197e-08, 'border_count': 125, 'bagging_temperature': 0.05214156604461299, 'random_strength': 2.758704802530228, 'grow_policy': 'Depthwise', 'min_data_in_leaf': 115}. Best is trial 349 with value: 2072.137476888861.[0m
[32m[I 2024-10-13 10:32:25,889][0m Trial 654 finished with value: 2205.248640349106 and parameters: {'depth': 11, 'learning_rate': 0.0006015391976693344, 'iterations': 2584, 'l2_leaf_reg': 7.116697019851115, 'border_count': 22, 'bagging_temperature': 0.01712338130354985, 'random_strength': 2.3268869862984225, 'grow_policy': 'Depthwise', 'min_data_in_leaf': 48}. Best is trial 349 with value: 2072.137476888861.[0m
[32m[I 2024-10-13 10:32:29,036][0m Trial 655 finished with value: 2170.730112041832 and parameters: {'depth': 11, 'learning_rate': 0.00048075679825556797, 'iterations': 2728, 'l2_leaf_reg': 1.0067610902657053e-08, 'border_count': 32, 'bagging_temperature': 0.0012068673332828778, 'random_strength': 1.3830266170696908, 'grow_policy': 'Depthwise', 'min_data_in_leaf': 77}. Best is trial 349 with value: 2072.137476888861.[0m
[32m[I 2024-10-13 10:32:33,985][0m Trial 656 finished with value: 2194.3992716991065 and parameters: {'depth': 12, 'learning_rate': 0.0008460924217085321, 'iterations': 2798, 'l2_leaf_reg': 2.488672112122431e-08, 'border_count': 19, 'bagging_temperature': 0.07175281843722027, 'random_strength': 1.8159248177625162, 'grow_policy': 'Depthwise', 'min_data_in_leaf': 31}. Best is trial 349 with value: 2072.137476888861.[0m
[32m[I 2024-10-13 10:32:37,177][0m Trial 657 finished with value: 2814.8206122583315 and parameters: {'depth': 11, 'learning_rate': 0.0006792138975461818, 'iterations': 2629, 'l2_leaf_reg': 0.0021367753942460226, 'border_count': 11, 'bagging_temperature': 0.03381118389371548, 'random_strength': 2.5649604428269672, 'grow_policy': 'Depthwise', 'min_data_in_leaf': 63}. Best is trial 349 with value: 2072.137476888861.[0m
[32m[I 2024-10-13 10:32:44,696][0m Trial 658 finished with value: 2422.641415211434 and parameters: {'depth': 13, 'learning_rate': 0.08670730002447603, 'iterations': 2531, 'l2_leaf_reg': 1.5028204406095814e-08, 'border_count': 26, 'bagging_temperature': 0.05433130561616054, 'random_strength': 9.98227142348067, 'grow_policy': 'Depthwise', 'min_data_in_leaf': 42}. Best is trial 349 with value: 2072.137476888861.[0m
[32m[I 2024-10-13 10:32:58,134][0m Trial 659 finished with value: 2568.194880416539 and parameters: {'depth': 10, 'learning_rate': 0.00041644906112078774, 'iterations': 2844, 'l2_leaf_reg': 3.323689818351383e-08, 'border_count': 15, 'bagging_temperature': 0.09748640619240569, 'random_strength': 2.1336974247018965, 'grow_policy': 'Depthwise', 'min_data_in_leaf': 17}. Best is trial 349 with value: 2072.137476888861.[0m
[32m[I 2024-10-13 10:33:06,863][0m Trial 660 finished with value: 2156.439069124426 and parameters: {'depth': 11, 'learning_rate': 0.000519495459465172, 'iterations': 2697, 'l2_leaf_reg': 1.794864586345153e-08, 'border_count': 22, 'bagging_temperature': 0.03233402103333524, 'random_strength': 2.3270998185267007, 'grow_policy': 'Depthwise', 'min_data_in_leaf': 84}. Best is trial 349 with value: 2072.137476888861.[0m
[32m[I 2024-10-13 10:33:59,011][0m Trial 661 finished with value: 2461.8806526219673 and parameters: {'depth': 11, 'learning_rate': 0.0005965282940663931, 'iterations': 2683, 'l2_leaf_reg': 1.0228165012825566e-08, 'border_count': 33, 'bagging_temperature': 0.06504104806774048, 'random_strength': 2.2546277917030246, 'grow_policy': 'SymmetricTree', 'min_data_in_leaf': 108}. Best is trial 349 with value: 2072.137476888861.[0m
[32m[I 2024-10-13 10:34:01,513][0m Trial 662 finished with value: 2253.4799070546887 and parameters: {'depth': 11, 'learning_rate': 0.0005273207501428704, 'iterations': 2605, 'l2_leaf_reg': 1.781679893131544e-08, 'border_count': 28, 'bagging_temperature': 0.0009000059411000075, 'random_strength': 1.879485072104094, 'grow_policy': 'Depthwise', 'min_data_in_leaf': 98}. Best is trial 349 with value: 2072.137476888861.[0m
