[32m[I 2024-10-13 09:38:28,850][0m Trial 254 finished with value: 2301.9622482992418 and parameters: {'depth': 10, 'learning_rate': 0.0012057575797825024, 'iterations': 1763, 'l2_leaf_reg': 6.23931326940462e-07, 'border_count': 49, 'bagging_temperature': 0.14350835013768587, 'random_strength': 1.2991847319595713, 'grow_policy': 'Depthwise', 'min_data_in_leaf': 317}. Best is trial 52 with value: 2182.908535006516.[0m
[32m[I 2024-10-13 09:38:31,365][0m Trial 255 finished with value: 2202.328779964381 and parameters: {'depth': 10, 'learning_rate': 0.001140882568019627, 'iterations': 1757, 'l2_leaf_reg': 3.762635171569618e-07, 'border_count': 38, 'bagging_temperature': 0.12187710008504704, 'random_strength': 1.0806133764168426, 'grow_policy': 'Depthwise', 'min_data_in_leaf': 325}. Best is trial 52 with value: 2182.908535006516.[0m
[32m[I 2024-10-13 09:38:33,897][0m Trial 256 finished with value: 2267.555343447845 and parameters: {'depth': 10, 'learning_rate': 0.0007655138327835515, 'iterations': 1768, 'l2_leaf_reg': 3.989775245678899e-07, 'border_count': 38, 'bagging_temperature': 0.10946072406150087, 'random_strength': 0.955543845812495, 'grow_policy': 'Depthwise', 'min_data_in_leaf': 326}. Best is trial 52 with value: 2182.908535006516.[0m
[32m[I 2024-10-13 09:38:37,596][0m Trial 257 finished with value: 2291.4053257851792 and parameters: {'depth': 10, 'learning_rate': 0.0010807544995615123, 'iterations': 1862, 'l2_leaf_reg': 6.217039182486678e-07, 'border_count': 45, 'bagging_temperature': 0.1251450003770724, 'random_strength': 1.0794501176300242, 'grow_policy': 'Depthwise', 'min_data_in_leaf': 310}. Best is trial 52 with value: 2182.908535006516.[0m
[32m[I 2024-10-13 09:38:41,169][0m Trial 258 finished with value: 2206.8680465594116 and parameters: {'depth': 9, 'learning_rate': 0.0012114149481637438, 'iterations': 1725, 'l2_leaf_reg': 4.583998941909035e-07, 'border_count': 38, 'bagging_temperature': 0.11419444358213793, 'random_strength': 1.5583718710996934, 'grow_policy': 'Depthwise', 'min_data_in_leaf': 334}. Best is trial 52 with value: 2182.908535006516.[0m
[32m[I 2024-10-13 09:38:44,139][0m Trial 259 finished with value: 2317.496121196525 and parameters: {'depth': 9, 'learning_rate': 0.0008344645184004718, 'iterations': 1730, 'l2_leaf_reg': 3.810324090954225e-07, 'border_count': 42, 'bagging_temperature': 0.06128090103448188, 'random_strength': 0.7423515525330648, 'grow_policy': 'Depthwise', 'min_data_in_leaf': 333}. Best is trial 52 with value: 2182.908535006516.[0m
[32m[I 2024-10-13 09:38:47,159][0m Trial 260 finished with value: 2207.003407057349 and parameters: {'depth': 10, 'learning_rate': 0.001137582657454735, 'iterations': 1789, 'l2_leaf_reg': 3.294586716761524e-07, 'border_count': 38, 'bagging_temperature': 0.15939558896136527, 'random_strength': 1.2397143713012306, 'grow_policy': 'Depthwise', 'min_data_in_leaf': 308}. Best is trial 52 with value: 2182.908535006516.[0m
[32m[I 2024-10-13 09:38:50,228][0m Trial 261 finished with value: 2207.846102276631 and parameters: {'depth': 10, 'learning_rate': 0.0011327577317100496, 'iterations': 1834, 'l2_leaf_reg': 4.939101997213724e-07, 'border_count': 36, 'bagging_temperature': 0.1334189189704434, 'random_strength': 1.2409319185854746, 'grow_policy': 'Depthwise', 'min_data_in_leaf': 348}. Best is trial 52 with value: 2182.908535006516.[0m
[32m[I 2024-10-13 09:38:53,197][0m Trial 262 finished with value: 2299.5320901926116 and parameters: {'depth': 10, 'learning_rate': 0.0011329240672440788, 'iterations': 1830, 'l2_leaf_reg': 5.562644783912002e-07, 'border_count': 49, 'bagging_temperature': 0.16156918617374605, 'random_strength': 1.244342299466895, 'grow_policy': 'Depthwise', 'min_data_in_leaf': 349}. Best is trial 52 with value: 2182.908535006516.[0m
[32m[I 2024-10-13 09:38:56,034][0m Trial 263 finished with value: 2205.435235532307 and parameters: {'depth': 10, 'learning_rate': 0.0008949900124600275, 'iterations': 1924, 'l2_leaf_reg': 9.19865185692783e-07, 'border_count': 36, 'bagging_temperature': 0.1380485195334646, 'random_strength': 1.6981591507863707, 'grow_policy': 'Depthwise', 'min_data_in_leaf': 318}. Best is trial 52 with value: 2182.908535006516.[0m
[32m[I 2024-10-13 09:38:59,518][0m Trial 264 finished with value: 2202.564929507598 and parameters: {'depth': 10, 'learning_rate': 0.0008940129572291875, 'iterations': 2042, 'l2_leaf_reg': 4.379952867334465e-07, 'border_count': 36, 'bagging_temperature': 0.1322232875758963, 'random_strength': 1.6517332041746802, 'grow_policy': 'Depthwise', 'min_data_in_leaf': 320}. Best is trial 52 with value: 2182.908535006516.[0m
[32m[I 2024-10-13 09:39:03,872][0m Trial 265 finished with value: 2203.4499230784686 and parameters: {'depth': 9, 'learning_rate': 0.0008663401083596399, 'iterations': 2202, 'l2_leaf_reg': 3.536352285258604e-07, 'border_count': 36, 'bagging_temperature': 0.13788823936186745, 'random_strength': 1.357711666602841, 'grow_policy': 'Depthwise', 'min_data_in_leaf': 327}. Best is trial 52 with value: 2182.908535006516.[0m
[32m[I 2024-10-13 09:39:08,063][0m Trial 266 finished with value: 2336.7485047285245 and parameters: {'depth': 10, 'learning_rate': 0.0007068277811485248, 'iterations': 2017, 'l2_leaf_reg': 3.3155535400407626e-07, 'border_count': 43, 'bagging_temperature': 0.1366604661235752, 'random_strength': 1.2185990613178863, 'grow_policy': 'Depthwise', 'min_data_in_leaf': 335}. Best is trial 52 with value: 2182.908535006516.[0m
[32m[I 2024-10-13 09:39:11,803][0m Trial 267 finished with value: 2199.697898112609 and parameters: {'depth': 9, 'learning_rate': 0.0008811172053960247, 'iterations': 2223, 'l2_leaf_reg': 9.451509220348503e-07, 'border_count': 36, 'bagging_temperature': 0.08752593226992811, 'random_strength': 1.3909873890289968, 'grow_policy': 'Depthwise', 'min_data_in_leaf': 355}. Best is trial 52 with value: 2182.908535006516.[0m
[32m[I 2024-10-13 09:39:16,230][0m Trial 268 finished with value: 2209.192421307459 and parameters: {'depth': 9, 'learning_rate': 0.0009267934053606348, 'iterations': 2277, 'l2_leaf_reg': 8.299305831400507e-07, 'border_count': 36, 'bagging_temperature': 0.08866428991373643, 'random_strength': 1.619778478628641, 'grow_policy': 'Depthwise', 'min_data_in_leaf': 357}. Best is trial 52 with value: 2182.908535006516.[0m
[32m[I 2024-10-13 09:39:19,679][0m Trial 269 finished with value: 2281.101135036533 and parameters: {'depth': 9, 'learning_rate': 0.0008644182027061285, 'iterations': 2215, 'l2_leaf_reg': 1.0399778809135795e-06, 'border_count': 56, 'bagging_temperature': 0.08457943673712484, 'random_strength': 1.5346249506724496, 'grow_policy': 'Depthwise', 'min_data_in_leaf': 353}. Best is trial 52 with value: 2182.908535006516.[0m
[32m[I 2024-10-13 09:39:24,607][0m Trial 270 finished with value: 2254.125757982407 and parameters: {'depth': 9, 'learning_rate': 0.0005809033439946481, 'iterations': 2403, 'l2_leaf_reg': 7.516224874076348e-07, 'border_count': 35, 'bagging_temperature': 0.09740673431374544, 'random_strength': 1.3367257649764155, 'grow_policy': 'Depthwise', 'min_data_in_leaf': 326}. Best is trial 52 with value: 2182.908535006516.[0m
[32m[I 2024-10-13 09:39:28,340][0m Trial 271 finished with value: 2283.4721921015157 and parameters: {'depth': 9, 'learning_rate': 0.0009047266609138285, 'iterations': 2168, 'l2_leaf_reg': 7.256334086552049e-07, 'border_count': 47, 'bagging_temperature': 0.12112582318942386, 'random_strength': 0.6199572540935074, 'grow_policy': 'Depthwise', 'min_data_in_leaf': 317}. Best is trial 52 with value: 2182.908535006516.[0m
[32m[I 2024-10-13 09:39:32,869][0m Trial 272 finished with value: 2222.9025987830264 and parameters: {'depth': 10, 'learning_rate': 0.0006831161236485782, 'iterations': 2277, 'l2_leaf_reg': 3.408259809525092e-07, 'border_count': 38, 'bagging_temperature': 0.14422348839903382, 'random_strength': 1.7207321872224588, 'grow_policy': 'Depthwise', 'min_data_in_leaf': 358}. Best is trial 52 with value: 2182.908535006516.[0m
[32m[I 2024-10-13 09:39:36,855][0m Trial 273 finished with value: 2284.326591988105 and parameters: {'depth': 10, 'learning_rate': 0.0008106274314848099, 'iterations': 2301, 'l2_leaf_reg': 3.3115574923600005e-07, 'border_count': 43, 'bagging_temperature': 0.10412816532517849, 'random_strength': 1.0670476593245177, 'grow_policy': 'Depthwise', 'min_data_in_leaf': 308}. Best is trial 52 with value: 2182.908535006516.[0m
[32m[I 2024-10-13 09:39:40,948][0m Trial 274 finished with value: 2199.007703665614 and parameters: {'depth': 10, 'learning_rate': 0.0009260828944750144, 'iterations': 2089, 'l2_leaf_reg': 9.497203938465562e-07, 'border_count': 36, 'bagging_temperature': 0.0817388221300821, 'random_strength': 1.9012795313494841, 'grow_policy': 'Depthwise', 'min_data_in_leaf': 337}. Best is trial 52 with value: 2182.908535006516.[0m
[32m[I 2024-10-13 09:39:44,491][0m Trial 275 finished with value: 2196.8205259693373 and parameters: {'depth': 9, 'learning_rate': 0.0009104169784080161, 'iterations': 2070, 'l2_leaf_reg': 1.0324537464903059e-06, 'border_count': 35, 'bagging_temperature': 0.05776976795607722, 'random_strength': 1.6105300452933575, 'grow_policy': 'Depthwise', 'min_data_in_leaf': 346}. Best is trial 52 with value: 2182.908535006516.[0m
[32m[I 2024-10-13 09:39:48,485][0m Trial 276 finished with value: 2289.813431921758 and parameters: {'depth': 10, 'learning_rate': 0.000756950171328864, 'iterations': 2036, 'l2_leaf_reg': 1.214128517241675e-06, 'border_count': 50, 'bagging_temperature': 0.05386652835557283, 'random_strength': 1.95136096112623, 'grow_policy': 'Depthwise', 'min_data_in_leaf': 332}. Best is trial 52 with value: 2182.908535006516.[0m
[32m[I 2024-10-13 09:39:51,090][0m Trial 277 finished with value: 2267.9302525576422 and parameters: {'depth': 11, 'learning_rate': 0.0009397799276294197, 'iterations': 1943, 'l2_leaf_reg': 5.669683396101394e-07, 'border_count': 43, 'bagging_temperature': 0.023257666673491356, 'random_strength': 1.375131290815295, 'grow_policy': 'Depthwise', 'min_data_in_leaf': 341}. Best is trial 52 with value: 2182.908535006516.[0m
[32m[I 2024-10-13 09:39:55,304][0m Trial 278 finished with value: 2227.716143202053 and parameters: {'depth': 10, 'learning_rate': 0.0010745587708041481, 'iterations': 2154, 'l2_leaf_reg': 9.910491074007e-07, 'border_count': 35, 'bagging_temperature': 0.07304619735189483, 'random_strength': 1.8206558169033988, 'grow_policy': 'Depthwise', 'min_data_in_leaf': 299}. Best is trial 52 with value: 2182.908535006516.[0m
[32m[I 2024-10-13 09:39:58,981][0m Trial 279 finished with value: 2213.0466994872877 and parameters: {'depth': 9, 'learning_rate': 0.0008619868138574552, 'iterations': 1897, 'l2_leaf_reg': 6.090549529234951e-07, 'border_count': 35, 'bagging_temperature': 0.16006518908695852, 'random_strength': 0.8789480268471213, 'grow_policy': 'Depthwise', 'min_data_in_leaf': 332}. Best is trial 52 with value: 2182.908535006516.[0m
[32m[I 2024-10-13 09:40:02,629][0m Trial 280 finished with value: 2322.4783312931067 and parameters: {'depth': 10, 'learning_rate': 0.0010790879899629964, 'iterations': 2099, 'l2_leaf_reg': 2.6885872314540804e-07, 'border_count': 45, 'bagging_temperature': 0.1403382011089394, 'random_strength': 1.5649560832442284, 'grow_policy': 'Depthwise', 'min_data_in_leaf': 312}. Best is trial 52 with value: 2182.908535006516.[0m
[32m[I 2024-10-13 09:40:06,787][0m Trial 281 finished with value: 2203.5150469655923 and parameters: {'depth': 9, 'learning_rate': 0.0009567862198653905, 'iterations': 2079, 'l2_leaf_reg': 1.2966936598819476e-06, 'border_count': 36, 'bagging_temperature': 0.11054393480447432, 'random_strength': 1.9760212932565107, 'grow_policy': 'Depthwise', 'min_data_in_leaf': 369}. Best is trial 52 with value: 2182.908535006516.[0m
[32m[I 2024-10-13 09:40:10,421][0m Trial 282 finished with value: 2272.1124392631555 and parameters: {'depth': 9, 'learning_rate': 0.0006523274828000547, 'iterations': 2072, 'l2_leaf_reg': 1.4028029894470033e-06, 'border_count': 40, 'bagging_temperature': 0.11061356016109054, 'random_strength': 1.9302781306397334, 'grow_policy': 'Depthwise', 'min_data_in_leaf': 360}. Best is trial 52 with value: 2182.908535006516.[0m
[32m[I 2024-10-13 09:40:14,934][0m Trial 283 finished with value: 2204.3368611858855 and parameters: {'depth': 8, 'learning_rate': 0.0007870391875361861, 'iterations': 2110, 'l2_leaf_reg': 1.41872053294609e-07, 'border_count': 33, 'bagging_temperature': 0.07974433897204106, 'random_strength': 2.042219778540775, 'grow_policy': 'Depthwise', 'min_data_in_leaf': 302}. Best is trial 52 with value: 2182.908535006516.[0m
[32m[I 2024-10-13 09:40:18,788][0m Trial 284 finished with value: 2434.646165272785 and parameters: {'depth': 9, 'learning_rate': 0.0005445051165703109, 'iterations': 2113, 'l2_leaf_reg': 1.5018377195817146e-07, 'border_count': 53, 'bagging_temperature': 0.069932725191821, 'random_strength': 1.7363494477149957, 'grow_policy': 'Depthwise', 'min_data_in_leaf': 261}. Best is trial 52 with value: 2182.908535006516.[0m
[32m[I 2024-10-13 09:40:22,669][0m Trial 285 finished with value: 2572.0257880564395 and parameters: {'depth': 9, 'learning_rate': 0.00045456134868487505, 'iterations': 2001, 'l2_leaf_reg': 2.5543096602191053e-07, 'border_count': 31, 'bagging_temperature': 0.16059096447934532, 'random_strength': 1.9934631837686112, 'grow_policy': 'Depthwise', 'min_data_in_leaf': 296}. Best is trial 52 with value: 2182.908535006516.[0m
[32m[I 2024-10-13 09:40:25,988][0m Trial 286 finished with value: 2283.8279198226064 and parameters: {'depth': 11, 'learning_rate': 0.0007765341911462094, 'iterations': 2223, 'l2_leaf_reg': 4.440064739044418e-08, 'border_count': 43, 'bagging_temperature': 0.09001452022215965, 'random_strength': 2.035294252712432, 'grow_policy': 'Depthwise', 'min_data_in_leaf': 280}. Best is trial 52 with value: 2182.908535006516.[0m
[32m[I 2024-10-13 09:40:28,900][0m Trial 287 finished with value: 2202.5714354081074 and parameters: {'depth': 8, 'learning_rate': 0.0009497140544405721, 'iterations': 2061, 'l2_leaf_reg': 1.5025071576931885e-07, 'border_count': 33, 'bagging_temperature': 0.11785422666944412, 'random_strength': 1.5869439473069922, 'grow_policy': 'Depthwise', 'min_data_in_leaf': 339}. Best is trial 52 with value: 2182.908535006516.[0m
[32m[I 2024-10-13 09:40:32,435][0m Trial 288 finished with value: 2201.961899588137 and parameters: {'depth': 9, 'learning_rate': 0.0008640337544813404, 'iterations': 2049, 'l2_leaf_reg': 1.6239004671124784e-07, 'border_count': 29, 'bagging_temperature': 0.12093724429698591, 'random_strength': 1.653970203327856, 'grow_policy': 'Depthwise', 'min_data_in_leaf': 373}. Best is trial 52 with value: 2182.908535006516.[0m
[32m[I 2024-10-13 09:40:50,876][0m Trial 289 finished with value: 2541.277364928484 and parameters: {'depth': 8, 'learning_rate': 0.0009028301721248861, 'iterations': 1973, 'l2_leaf_reg': 1.1774857682153117e-07, 'border_count': 28, 'bagging_temperature': 0.04350715063519193, 'random_strength': 1.668900382251906, 'grow_policy': 'SymmetricTree', 'min_data_in_leaf': 365}. Best is trial 52 with value: 2182.908535006516.[0m
[32m[I 2024-10-13 09:40:53,221][0m Trial 290 finished with value: 2230.7556500991036 and parameters: {'depth': 8, 'learning_rate': 0.000725388966086176, 'iterations': 2069, 'l2_leaf_reg': 1.0125453138519237e-06, 'border_count': 32, 'bagging_temperature': 0.12280868572170345, 'random_strength': 1.4766989088050275, 'grow_policy': 'Depthwise', 'min_data_in_leaf': 375}. Best is trial 52 with value: 2182.908535006516.[0m
[32m[I 2024-10-13 09:40:55,948][0m Trial 291 finished with value: 2198.766446583574 and parameters: {'depth': 9, 'learning_rate': 0.0008198848100992903, 'iterations': 2146, 'l2_leaf_reg': 1.486075858627555e-07, 'border_count': 29, 'bagging_temperature': 0.08333514941800022, 'random_strength': 1.8292406915049917, 'grow_policy': 'Depthwise', 'min_data_in_leaf': 123}. Best is trial 52 with value: 2182.908535006516.[0m
[32m[I 2024-10-13 09:40:58,600][0m Trial 292 finished with value: 2271.0730611394515 and parameters: {'depth': 9, 'learning_rate': 0.0006300542719094072, 'iterations': 2132, 'l2_leaf_reg': 8.86250450123431e-08, 'border_count': 27, 'bagging_temperature': 0.07889200071146574, 'random_strength': 1.7794124946428178, 'grow_policy': 'Depthwise', 'min_data_in_leaf': 112}. Best is trial 52 with value: 2182.908535006516.[0m
[32m[I 2024-10-13 09:41:01,123][0m Trial 293 finished with value: 2201.740122477252 and parameters: {'depth': 9, 'learning_rate': 0.0007964238330062478, 'iterations': 2159, 'l2_leaf_reg': 1.574895692202037e-07, 'border_count': 30, 'bagging_temperature': 0.09538085616893599, 'random_strength': 1.895809306235055, 'grow_policy': 'Depthwise', 'min_data_in_leaf': 178}. Best is trial 52 with value: 2182.908535006516.[0m
[32m[I 2024-10-13 09:41:04,148][0m Trial 294 finished with value: 2198.8964031827527 and parameters: {'depth': 9, 'learning_rate': 0.0007901478807095803, 'iterations': 2176, 'l2_leaf_reg': 1.2892185932891971e-07, 'border_count': 28, 'bagging_temperature': 0.05729668519278483, 'random_strength': 1.8878264260011455, 'grow_policy': 'Depthwise', 'min_data_in_leaf': 152}. Best is trial 52 with value: 2182.908535006516.[0m
[32m[I 2024-10-13 09:41:06,670][0m Trial 295 finished with value: 2200.180048238409 and parameters: {'depth': 9, 'learning_rate': 0.0007805747953697082, 'iterations': 2183, 'l2_leaf_reg': 5.212010175052086e-08, 'border_count': 27, 'bagging_temperature': 0.06802217242744069, 'random_strength': 0.4265316003094428, 'grow_policy': 'Depthwise', 'min_data_in_leaf': 140}. Best is trial 52 with value: 2182.908535006516.[0m
[32m[I 2024-10-13 09:41:10,657][0m Trial 296 finished with value: 2195.534789703747 and parameters: {'depth': 9, 'learning_rate': 0.0007803153801146658, 'iterations': 2360, 'l2_leaf_reg': 2.6442504163261976e-08, 'border_count': 26, 'bagging_temperature': 0.0271183329550031, 'random_strength': 0.24985133420267758, 'grow_policy': 'Depthwise', 'min_data_in_leaf': 206}. Best is trial 52 with value: 2182.908535006516.[0m
[32m[I 2024-10-13 09:41:14,632][0m Trial 297 finished with value: 2364.9081877549893 and parameters: {'depth': 9, 'learning_rate': 0.0005105792799341239, 'iterations': 2224, 'l2_leaf_reg': 3.4780527332177844e-08, 'border_count': 25, 'bagging_temperature': 0.029861044896654074, 'random_strength': 1.866661534368722, 'grow_policy': 'Depthwise', 'min_data_in_leaf': 151}. Best is trial 52 with value: 2182.908535006516.[0m
[32m[I 2024-10-13 09:41:17,281][0m Trial 298 finished with value: 2222.449622966091 and parameters: {'depth': 8, 'learning_rate': 0.0006439654755869394, 'iterations': 2342, 'l2_leaf_reg': 5.223996139000606e-08, 'border_count': 27, 'bagging_temperature': 0.05057311988490577, 'random_strength': 0.7099731295205296, 'grow_policy': 'Depthwise', 'min_data_in_leaf': 158}. Best is trial 52 with value: 2182.908535006516.[0m
[32m[I 2024-10-13 09:41:20,678][0m Trial 299 finished with value: 2195.6527491981938 and parameters: {'depth': 9, 'learning_rate': 0.0007553890405363753, 'iterations': 2489, 'l2_leaf_reg': 7.487481423023638e-08, 'border_count': 26, 'bagging_temperature': 0.01749477087137468, 'random_strength': 0.15806681244442444, 'grow_policy': 'Depthwise', 'min_data_in_leaf': 166}. Best is trial 52 with value: 2182.908535006516.[0m
[32m[I 2024-10-13 09:41:24,068][0m Trial 300 finished with value: 2469.3364721716266 and parameters: {'depth': 9, 'learning_rate': 0.00038883420719605736, 'iterations': 2565, 'l2_leaf_reg': 2.9524139416331915e-08, 'border_count': 29, 'bagging_temperature': 0.031027901070327032, 'random_strength': 0.5719316145461879, 'grow_policy': 'Depthwise', 'min_data_in_leaf': 174}. Best is trial 52 with value: 2182.908535006516.[0m
[32m[I 2024-10-13 09:41:27,436][0m Trial 301 finished with value: 2308.8192573945976 and parameters: {'depth': 9, 'learning_rate': 0.0007021445437938756, 'iterations': 2611, 'l2_leaf_reg': 1.6847669015374614e-08, 'border_count': 160, 'bagging_temperature': 0.01815042799409619, 'random_strength': 0.22007439472039686, 'grow_policy': 'Depthwise', 'min_data_in_leaf': 139}. Best is trial 52 with value: 2182.908535006516.[0m
[32m[I 2024-10-13 09:41:30,809][0m Trial 302 finished with value: 2901.6319249208555 and parameters: {'depth': 9, 'learning_rate': 0.00027013557628512635, 'iterations': 2451, 'l2_leaf_reg': 6.535315268766309e-08, 'border_count': 32, 'bagging_temperature': 0.012917359325560637, 'random_strength': 0.10246124435357909, 'grow_policy': 'Depthwise', 'min_data_in_leaf': 198}. Best is trial 52 with value: 2182.908535006516.[0m
[32m[I 2024-10-13 09:41:33,799][0m Trial 303 finished with value: 2273.769430109413 and parameters: {'depth': 9, 'learning_rate': 0.0008251445361706268, 'iterations': 2157, 'l2_leaf_reg': 7.659123526292811e-08, 'border_count': 65, 'bagging_temperature': 0.04593322202336682, 'random_strength': 0.4435611958590944, 'grow_policy': 'Depthwise', 'min_data_in_leaf': 130}. Best is trial 52 with value: 2182.908535006516.[0m
[32m[I 2024-10-13 09:41:37,203][0m Trial 304 finished with value: 2233.030197012277 and parameters: {'depth': 9, 'learning_rate': 0.0005833493339272331, 'iterations': 2509, 'l2_leaf_reg': 1.886631369220794e-08, 'border_count': 25, 'bagging_temperature': 0.06498313144503105, 'random_strength': 0.3471196871830491, 'grow_policy': 'Depthwise', 'min_data_in_leaf': 104}. Best is trial 52 with value: 2182.908535006516.[0m
[32m[I 2024-10-13 09:41:40,856][0m Trial 305 finished with value: 2315.476369302053 and parameters: {'depth': 9, 'learning_rate': 0.0007847559688299624, 'iterations': 2032, 'l2_leaf_reg': 1.3821960230029003e-07, 'border_count': 184, 'bagging_temperature': 0.08956745330506886, 'random_strength': 0.039338163942196636, 'grow_policy': 'Depthwise', 'min_data_in_leaf': 162}. Best is trial 52 with value: 2182.908535006516.[0m
