[32m[I 2024-10-13 10:22:51,554][0m Trial 561 finished with value: 3149.8778900269804 and parameters: {'depth': 11, 'learning_rate': 0.0007442921466600487, 'iterations': 2822, 'l2_leaf_reg': 0.0003536919588111349, 'border_count': 9, 'bagging_temperature': 0.06798092669815776, 'random_strength': 2.422234754012619, 'grow_policy': 'Depthwise', 'min_data_in_leaf': 21}. Best is trial 349 with value: 2072.137476888861.[0m
[32m[I 2024-10-13 10:22:55,728][0m Trial 562 finished with value: 2220.4744030486363 and parameters: {'depth': 11, 'learning_rate': 0.0003903650185301059, 'iterations': 2882, 'l2_leaf_reg': 2.3261700695884967e-08, 'border_count': 16, 'bagging_temperature': 0.019679922310100104, 'random_strength': 2.749374230948236, 'grow_policy': 'Depthwise', 'min_data_in_leaf': 36}. Best is trial 349 with value: 2072.137476888861.[0m
[32m[I 2024-10-13 10:22:58,705][0m Trial 563 finished with value: 2182.9576892250607 and parameters: {'depth': 11, 'learning_rate': 0.0006309135350276864, 'iterations': 2753, 'l2_leaf_reg': 1.3910403915904428e-08, 'border_count': 28, 'bagging_temperature': 0.00022207457116772689, 'random_strength': 2.477166614372478, 'grow_policy': 'Depthwise', 'min_data_in_leaf': 78}. Best is trial 349 with value: 2072.137476888861.[0m
[32m[I 2024-10-13 10:23:02,536][0m Trial 564 finished with value: 2167.4359406184712 and parameters: {'depth': 12, 'learning_rate': 0.0005181021922471983, 'iterations': 2932, 'l2_leaf_reg': 4.267525982790512e-08, 'border_count': 19, 'bagging_temperature': 0.04680263514686232, 'random_strength': 2.2950198272588094, 'grow_policy': 'Depthwise', 'min_data_in_leaf': 53}. Best is trial 349 with value: 2072.137476888861.[0m
[32m[I 2024-10-13 10:23:08,032][0m Trial 565 finished with value: 3264.978740123248 and parameters: {'depth': 11, 'learning_rate': 0.00030504991420657134, 'iterations': 2996, 'l2_leaf_reg': 2.71903147265811e-08, 'border_count': 12, 'bagging_temperature': 0.026933998837867634, 'random_strength': 2.697059487841947, 'grow_policy': 'Depthwise', 'min_data_in_leaf': 17}. Best is trial 349 with value: 2072.137476888861.[0m
[32m[I 2024-10-13 10:23:12,019][0m Trial 566 finished with value: 2929.0082111253146 and parameters: {'depth': 11, 'learning_rate': 0.0003925291606583369, 'iterations': 2819, 'l2_leaf_reg': 1.8121219006637295e-08, 'border_count': 4, 'bagging_temperature': 0.07978551106596225, 'random_strength': 2.5666954419414663, 'grow_policy': 'Depthwise', 'min_data_in_leaf': 39}. Best is trial 349 with value: 2072.137476888861.[0m
[32m[I 2024-10-13 10:23:15,288][0m Trial 567 finished with value: 2262.5319287470384 and parameters: {'depth': 10, 'learning_rate': 0.0007870186554012181, 'iterations': 2763, 'l2_leaf_reg': 1.0057042179030022e-08, 'border_count': 30, 'bagging_temperature': 0.05436046863136623, 'random_strength': 7.352964055420391, 'grow_policy': 'Depthwise', 'min_data_in_leaf': 69}. Best is trial 349 with value: 2072.137476888861.[0m
[32m[I 2024-10-13 10:23:30,004][0m Trial 568 finished with value: 2902.2318761506504 and parameters: {'depth': 12, 'learning_rate': 0.0006311731219297034, 'iterations': 2854, 'l2_leaf_reg': 3.8489086522475765e-08, 'border_count': 62, 'bagging_temperature': 0.030929473821658386, 'random_strength': 2.277296214768589, 'grow_policy': 'Depthwise', 'min_data_in_leaf': 1}. Best is trial 349 with value: 2072.137476888861.[0m
[32m[I 2024-10-13 10:23:34,800][0m Trial 569 finished with value: 2150.879642367918 and parameters: {'depth': 11, 'learning_rate': 0.00048356974550813444, 'iterations': 2909, 'l2_leaf_reg': 2.081589995941376e-08, 'border_count': 24, 'bagging_temperature': 0.10634862213770897, 'random_strength': 1.7866837202252197, 'grow_policy': 'Depthwise', 'min_data_in_leaf': 31}. Best is trial 349 with value: 2072.137476888861.[0m
[32m[I 2024-10-13 10:23:37,624][0m Trial 570 finished with value: 2580.8755767743996 and parameters: {'depth': 11, 'learning_rate': 0.0003357943514917435, 'iterations': 2913, 'l2_leaf_reg': 9.153486384956864e-08, 'border_count': 131, 'bagging_temperature': 0.10912017381438072, 'random_strength': 1.579123448504067, 'grow_policy': 'Depthwise', 'min_data_in_leaf': 91}. Best is trial 349 with value: 2072.137476888861.[0m
[32m[I 2024-10-13 10:23:41,457][0m Trial 571 finished with value: 2185.0784358726287 and parameters: {'depth': 10, 'learning_rate': 0.0004276118617123958, 'iterations': 2994, 'l2_leaf_reg': 5.7309926933593254e-08, 'border_count': 24, 'bagging_temperature': 0.10298436718534176, 'random_strength': 1.7414182145841108, 'grow_policy': 'Depthwise', 'min_data_in_leaf': 53}. Best is trial 349 with value: 2072.137476888861.[0m
[32m[I 2024-10-13 10:23:47,415][0m Trial 572 finished with value: 2411.906478208841 and parameters: {'depth': 11, 'learning_rate': 0.0004959339883131213, 'iterations': 2937, 'l2_leaf_reg': 2.7138162172912095e-08, 'border_count': 145, 'bagging_temperature': 0.09312076033553965, 'random_strength': 1.4355223134850936, 'grow_policy': 'Depthwise', 'min_data_in_leaf': 20}. Best is trial 349 with value: 2072.137476888861.[0m
[32m[I 2024-10-13 10:23:50,180][0m Trial 573 finished with value: 2312.4541095522186 and parameters: {'depth': 11, 'learning_rate': 0.0004320082742642341, 'iterations': 2874, 'l2_leaf_reg': 2.1895928439761278e-08, 'border_count': 31, 'bagging_temperature': 0.07844271339921162, 'random_strength': 1.6810326813771495, 'grow_policy': 'Depthwise', 'min_data_in_leaf': 111}. Best is trial 349 with value: 2072.137476888861.[0m
[32m[I 2024-10-13 10:23:53,687][0m Trial 574 finished with value: 2169.214465005047 and parameters: {'depth': 11, 'learning_rate': 0.0005179963622672109, 'iterations': 2913, 'l2_leaf_reg': 3.8606543471172995e-08, 'border_count': 26, 'bagging_temperature': 0.06582461319908066, 'random_strength': 1.8746165714936758, 'grow_policy': 'Depthwise', 'min_data_in_leaf': 68}. Best is trial 349 with value: 2072.137476888861.[0m
[32m[I 2024-10-13 10:24:21,850][0m Trial 575 finished with value: 2772.4064476481913 and parameters: {'depth': 11, 'learning_rate': 0.00037810978846736703, 'iterations': 2833, 'l2_leaf_reg': 0.0005751449431105167, 'border_count': 19, 'bagging_temperature': 0.018620128792280803, 'random_strength': 2.02385620153193, 'grow_policy': 'SymmetricTree', 'min_data_in_leaf': 44}. Best is trial 349 with value: 2072.137476888861.[0m
[32m[I 2024-10-13 10:24:27,476][0m Trial 576 finished with value: 2074.268272997397 and parameters: {'depth': 10, 'learning_rate': 0.0005437876293619989, 'iterations': 2998, 'l2_leaf_reg': 1.6062828010817164e-08, 'border_count': 23, 'bagging_temperature': 0.08346811976446715, 'random_strength': 1.569538165179694, 'grow_policy': 'Depthwise', 'min_data_in_leaf': 22}. Best is trial 349 with value: 2072.137476888861.[0m
[32m[I 2024-10-13 10:24:40,353][0m Trial 577 finished with value: 3165.3268795024637 and parameters: {'depth': 10, 'learning_rate': 0.0005735983364941346, 'iterations': 2950, 'l2_leaf_reg': 5.977797550528351e-08, 'border_count': 31, 'bagging_temperature': 0.0018055125683060615, 'random_strength': 1.4395554228859968, 'grow_policy': 'Depthwise', 'min_data_in_leaf': 1}. Best is trial 349 with value: 2072.137476888861.[0m
[32m[I 2024-10-13 10:24:46,083][0m Trial 578 finished with value: 2421.7819083051477 and parameters: {'depth': 10, 'learning_rate': 0.00045433678777592344, 'iterations': 2983, 'l2_leaf_reg': 2.6803645563500675e-08, 'border_count': 26, 'bagging_temperature': 0.05366837722322109, 'random_strength': 1.172508820140184, 'grow_policy': 'Depthwise', 'min_data_in_leaf': 20}. Best is trial 349 with value: 2072.137476888861.[0m
[32m[I 2024-10-13 10:24:53,133][0m Trial 579 finished with value: 2922.4754787193306 and parameters: {'depth': 10, 'learning_rate': 0.023563320156996914, 'iterations': 2996, 'l2_leaf_reg': 4.120322412487979e-08, 'border_count': 224, 'bagging_temperature': 0.03585301258884664, 'random_strength': 1.4393300117854015, 'grow_policy': 'Depthwise', 'min_data_in_leaf': 27}. Best is trial 349 with value: 2072.137476888861.[0m
[32m[I 2024-10-13 10:24:59,338][0m Trial 580 finished with value: 2389.310230334836 and parameters: {'depth': 11, 'learning_rate': 0.0005424339360978617, 'iterations': 2933, 'l2_leaf_reg': 1.7709837897566323e-08, 'border_count': 214, 'bagging_temperature': 0.01727651685279224, 'random_strength': 8.947459148746491, 'grow_policy': 'Depthwise', 'min_data_in_leaf': 20}. Best is trial 349 with value: 2072.137476888861.[0m
[32m[I 2024-10-13 10:25:03,126][0m Trial 581 finished with value: 2414.5991848493168 and parameters: {'depth': 10, 'learning_rate': 0.00034517713467831733, 'iterations': 2901, 'l2_leaf_reg': 2.893977767729926e-08, 'border_count': 90, 'bagging_temperature': 0.06620497376043595, 'random_strength': 1.7253586934082419, 'grow_policy': 'Depthwise', 'min_data_in_leaf': 40}. Best is trial 349 with value: 2072.137476888861.[0m
[32m[I 2024-10-13 10:25:09,002][0m Trial 582 finished with value: 2474.046778343956 and parameters: {'depth': 11, 'learning_rate': 0.000427787305201364, 'iterations': 2881, 'l2_leaf_reg': 1.3389150133944728e-08, 'border_count': 23, 'bagging_temperature': 0.04703608376577477, 'random_strength': 1.601621214592829, 'grow_policy': 'Depthwise', 'min_data_in_leaf': 17}. Best is trial 349 with value: 2072.137476888861.[0m
[32m[I 2024-10-13 10:25:23,358][0m Trial 583 finished with value: 3173.301522241652 and parameters: {'depth': 11, 'learning_rate': 0.0006124067749668448, 'iterations': 3000, 'l2_leaf_reg': 9.186764524771179e-08, 'border_count': 31, 'bagging_temperature': 0.00042754903807577793, 'random_strength': 2.177112188909743, 'grow_policy': 'Depthwise', 'min_data_in_leaf': 1}. Best is trial 349 with value: 2072.137476888861.[0m
[32m[I 2024-10-13 10:25:27,327][0m Trial 584 finished with value: 2168.8141109109615 and parameters: {'depth': 11, 'learning_rate': 0.0004930522958085566, 'iterations': 2943, 'l2_leaf_reg': 4.6861930508437685e-08, 'border_count': 22, 'bagging_temperature': 0.10858021728441042, 'random_strength': 1.8470350490838248, 'grow_policy': 'Depthwise', 'min_data_in_leaf': 44}. Best is trial 349 with value: 2072.137476888861.[0m
[32m[I 2024-10-13 10:25:32,261][0m Trial 585 finished with value: 2185.029776629741 and parameters: {'depth': 11, 'learning_rate': 0.0006773484249593537, 'iterations': 2875, 'l2_leaf_reg': 1.0076208366246315e-08, 'border_count': 27, 'bagging_temperature': 0.08024951488129145, 'random_strength': 1.6494769198787986, 'grow_policy': 'Depthwise', 'min_data_in_leaf': 32}. Best is trial 349 with value: 2072.137476888861.[0m
[32m[I 2024-10-13 10:25:34,954][0m Trial 586 finished with value: 2660.1412010706545 and parameters: {'depth': 10, 'learning_rate': 0.0002923001098771589, 'iterations': 2839, 'l2_leaf_reg': 2.0962127354899274e-08, 'border_count': 20, 'bagging_temperature': 0.031531927700438486, 'random_strength': 2.33878342832177, 'grow_policy': 'Depthwise', 'min_data_in_leaf': 86}. Best is trial 349 with value: 2072.137476888861.[0m
[32m[I 2024-10-13 10:25:39,007][0m Trial 587 finished with value: 2176.6427366581247 and parameters: {'depth': 11, 'learning_rate': 0.0005629325573347472, 'iterations': 2938, 'l2_leaf_reg': 2.892696560503028e-08, 'border_count': 25, 'bagging_temperature': 0.0180163287309758, 'random_strength': 2.048456197553498, 'grow_policy': 'Depthwise', 'min_data_in_leaf': 53}. Best is trial 349 with value: 2072.137476888861.[0m
[32m[I 2024-10-13 10:25:44,166][0m Trial 588 finished with value: 2193.476082381127 and parameters: {'depth': 10, 'learning_rate': 0.0003838587711579455, 'iterations': 2808, 'l2_leaf_reg': 1.9100816152897965e-08, 'border_count': 18, 'bagging_temperature': 0.06459707678499124, 'random_strength': 2.162414451757538, 'grow_policy': 'Depthwise', 'min_data_in_leaf': 21}. Best is trial 349 with value: 2072.137476888861.[0m
[32m[I 2024-10-13 10:25:47,750][0m Trial 589 finished with value: 2386.6693289664795 and parameters: {'depth': 11, 'learning_rate': 0.0007456629731670641, 'iterations': 2719, 'l2_leaf_reg': 6.410385969091876e-08, 'border_count': 157, 'bagging_temperature': 0.045855460829704806, 'random_strength': 2.3952444438068565, 'grow_policy': 'Depthwise', 'min_data_in_leaf': 71}. Best is trial 349 with value: 2072.137476888861.[0m
[32m[I 2024-10-13 10:25:51,513][0m Trial 590 finished with value: 2168.086517106253 and parameters: {'depth': 11, 'learning_rate': 0.00046015442358063324, 'iterations': 2900, 'l2_leaf_reg': 3.268150203660206e-08, 'border_count': 13, 'bagging_temperature': 0.021931665604730415, 'random_strength': 1.2659243487828746, 'grow_policy': 'Depthwise', 'min_data_in_leaf': 40}. Best is trial 349 with value: 2072.137476888861.[0m
[32m[I 2024-10-13 10:25:55,497][0m Trial 591 finished with value: 2183.670908769889 and parameters: {'depth': 11, 'learning_rate': 0.000574522032848857, 'iterations': 2997, 'l2_leaf_reg': 1.499177617349251e-08, 'border_count': 32, 'bagging_temperature': 0.08390768133133819, 'random_strength': 1.8051396231567312, 'grow_policy': 'Depthwise', 'min_data_in_leaf': 53}. Best is trial 349 with value: 2072.137476888861.[0m
[32m[I 2024-10-13 10:25:59,712][0m Trial 592 finished with value: 2211.137045014039 and parameters: {'depth': 12, 'learning_rate': 0.0004224154480192617, 'iterations': 2772, 'l2_leaf_reg': 4.251688566771183e-08, 'border_count': 22, 'bagging_temperature': 0.036656107202464344, 'random_strength': 2.466868741425314, 'grow_policy': 'Depthwise', 'min_data_in_leaf': 35}. Best is trial 349 with value: 2072.137476888861.[0m
[32m[I 2024-10-13 10:26:05,555][0m Trial 593 finished with value: 3226.847812741064 and parameters: {'depth': 11, 'learning_rate': 0.0005155219575300957, 'iterations': 2865, 'l2_leaf_reg': 2.0703435396653568e-08, 'border_count': 8, 'bagging_temperature': 0.06003059631807498, 'random_strength': 2.112977193673728, 'grow_policy': 'Depthwise', 'min_data_in_leaf': 18}. Best is trial 349 with value: 2072.137476888861.[0m
[32m[I 2024-10-13 10:26:08,729][0m Trial 594 finished with value: 2199.8603908646414 and parameters: {'depth': 11, 'learning_rate': 0.0006525747274914569, 'iterations': 2936, 'l2_leaf_reg': 1.4861865237220642e-08, 'border_count': 18, 'bagging_temperature': 0.01470864434469504, 'random_strength': 1.9131351661341758, 'grow_policy': 'Depthwise', 'min_data_in_leaf': 77}. Best is trial 349 with value: 2072.137476888861.[0m
[32m[I 2024-10-13 10:26:21,206][0m Trial 595 finished with value: 3158.112982922825 and parameters: {'depth': 10, 'learning_rate': 0.0003496153690202835, 'iterations': 2833, 'l2_leaf_reg': 2.8445464094524126e-08, 'border_count': 27, 'bagging_temperature': 0.1010353865353266, 'random_strength': 1.557848696838485, 'grow_policy': 'Depthwise', 'min_data_in_leaf': 1}. Best is trial 349 with value: 2072.137476888861.[0m
[32m[I 2024-10-13 10:26:24,392][0m Trial 596 finished with value: 2243.4834603911486 and parameters: {'depth': 11, 'learning_rate': 0.0007836712673589632, 'iterations': 2741, 'l2_leaf_reg': 9.859253648775286e-08, 'border_count': 14, 'bagging_temperature': 0.047298913446960175, 'random_strength': 2.339668705982357, 'grow_policy': 'Depthwise', 'min_data_in_leaf': 59}. Best is trial 349 with value: 2072.137476888861.[0m
[32m[I 2024-10-13 10:27:00,953][0m Trial 597 finished with value: 2379.1851766558525 and parameters: {'depth': 11, 'learning_rate': 0.00048223037210333024, 'iterations': 2883, 'l2_leaf_reg': 5.732531063340169e-08, 'border_count': 22, 'bagging_temperature': 0.001523269339892195, 'random_strength': 2.568908390898816, 'grow_policy': 'SymmetricTree', 'min_data_in_leaf': 124}. Best is trial 349 with value: 2072.137476888861.[0m
[32m[I 2024-10-13 10:27:05,818][0m Trial 598 finished with value: 2897.4197308450052 and parameters: {'depth': 12, 'learning_rate': 0.0005868522882970819, 'iterations': 2800, 'l2_leaf_reg': 1.0145527861582042e-08, 'border_count': 10, 'bagging_temperature': 0.06884080781502272, 'random_strength': 2.1141489580306345, 'grow_policy': 'Depthwise', 'min_data_in_leaf': 31}. Best is trial 349 with value: 2072.137476888861.[0m
[32m[I 2024-10-13 10:27:08,730][0m Trial 599 finished with value: 3453.653621538405 and parameters: {'depth': 11, 'learning_rate': 0.00013576931068131658, 'iterations': 2936, 'l2_leaf_reg': 2.2637776575156298e-08, 'border_count': 32, 'bagging_temperature': 0.03265452893586052, 'random_strength': 2.2583336143604154, 'grow_policy': 'Depthwise', 'min_data_in_leaf': 105}. Best is trial 349 with value: 2072.137476888861.[0m
[32m[I 2024-10-13 10:27:14,355][0m Trial 600 finished with value: 2546.09307316377 and parameters: {'depth': 10, 'learning_rate': 0.0004020220721242989, 'iterations': 2715, 'l2_leaf_reg': 3.514896387023955e-08, 'border_count': 17, 'bagging_temperature': 0.0008678727372958357, 'random_strength': 2.611733519588781, 'grow_policy': 'Depthwise', 'min_data_in_leaf': 18}. Best is trial 349 with value: 2072.137476888861.[0m
[32m[I 2024-10-13 10:27:17,174][0m Trial 601 finished with value: 3816.228826988321 and parameters: {'depth': 11, 'learning_rate': 0.0005252692497823304, 'iterations': 2851, 'l2_leaf_reg': 1.4990307106032344e-08, 'border_count': 1, 'bagging_temperature': 0.049366808729618225, 'random_strength': 1.935696707420363, 'grow_policy': 'Depthwise', 'min_data_in_leaf': 89}. Best is trial 349 with value: 2072.137476888861.[0m
[32m[I 2024-10-13 10:27:21,635][0m Trial 602 finished with value: 2223.4282964467693 and parameters: {'depth': 11, 'learning_rate': 0.0006751502770193018, 'iterations': 2998, 'l2_leaf_reg': 4.787676880266336e-08, 'border_count': 25, 'bagging_temperature': 0.02621182538984344, 'random_strength': 7.956050363627343, 'grow_policy': 'Depthwise', 'min_data_in_leaf': 51}. Best is trial 349 with value: 2072.137476888861.[0m
[32m[I 2024-10-13 10:27:25,197][0m Trial 603 finished with value: 2173.8028761244154 and parameters: {'depth': 12, 'learning_rate': 0.0004668908343573904, 'iterations': 2790, 'l2_leaf_reg': 2.2352957232933013e-08, 'border_count': 20, 'bagging_temperature': 0.08320825926727485, 'random_strength': 2.384566097443558, 'grow_policy': 'Depthwise', 'min_data_in_leaf': 67}. Best is trial 349 with value: 2072.137476888861.[0m
[32m[I 2024-10-13 10:27:29,696][0m Trial 604 finished with value: 2165.7074134648133 and parameters: {'depth': 11, 'learning_rate': 0.0005868303072723377, 'iterations': 2881, 'l2_leaf_reg': 0.001227227031303756, 'border_count': 13, 'bagging_temperature': 0.3162560230773414, 'random_strength': 1.7443266649159241, 'grow_policy': 'Depthwise', 'min_data_in_leaf': 36}. Best is trial 349 with value: 2072.137476888861.[0m
[32m[I 2024-10-13 10:27:43,268][0m Trial 605 finished with value: 3246.5772726367527 and parameters: {'depth': 11, 'learning_rate': 0.000324256998050691, 'iterations': 2727, 'l2_leaf_reg': 1.001796344462098e-08, 'border_count': 28, 'bagging_temperature': 0.06401560181685786, 'random_strength': 2.0843206005592356, 'grow_policy': 'Depthwise', 'min_data_in_leaf': 1}. Best is trial 349 with value: 2072.137476888861.[0m
[32m[I 2024-10-13 10:27:49,237][0m Trial 606 finished with value: 3189.4542920536364 and parameters: {'depth': 10, 'learning_rate': 0.00042023904732099834, 'iterations': 2928, 'l2_leaf_reg': 3.453722805383401e-08, 'border_count': 8, 'bagging_temperature': 0.018532246157493097, 'random_strength': 2.7911918491042664, 'grow_policy': 'Depthwise', 'min_data_in_leaf': 19}. Best is trial 349 with value: 2072.137476888861.[0m
[32m[I 2024-10-13 10:27:53,221][0m Trial 607 finished with value: 2238.057582220192 and parameters: {'depth': 11, 'learning_rate': 0.0007918980427425652, 'iterations': 2817, 'l2_leaf_reg': 6.401143138137067e-08, 'border_count': 16, 'bagging_temperature': 0.03842692578440775, 'random_strength': 2.2452096377278137, 'grow_policy': 'Depthwise', 'min_data_in_leaf': 52}. Best is trial 349 with value: 2072.137476888861.[0m
[32m[I 2024-10-13 10:27:56,337][0m Trial 608 finished with value: 2157.312198583083 and parameters: {'depth': 11, 'learning_rate': 0.0005024760611625882, 'iterations': 2767, 'l2_leaf_reg': 1.8412409801228864e-08, 'border_count': 22, 'bagging_temperature': 0.05291776844908112, 'random_strength': 2.51897954324431, 'grow_policy': 'Depthwise', 'min_data_in_leaf': 84}. Best is trial 349 with value: 2072.137476888861.[0m
[32m[I 2024-10-13 10:28:00,726][0m Trial 609 finished with value: 2254.5801764657203 and parameters: {'depth': 13, 'learning_rate': 0.0003925850376623451, 'iterations': 2677, 'l2_leaf_reg': 2.4744180094640316e-08, 'border_count': 21, 'bagging_temperature': 0.01778874711124085, 'random_strength': 2.6190988099763732, 'grow_policy': 'Depthwise', 'min_data_in_leaf': 34}. Best is trial 349 with value: 2072.137476888861.[0m
[32m[I 2024-10-13 10:28:03,513][0m Trial 610 finished with value: 3274.953562316263 and parameters: {'depth': 11, 'learning_rate': 0.00023566628699480383, 'iterations': 2712, 'l2_leaf_reg': 9.646594488343732e-08, 'border_count': 11, 'bagging_temperature': 0.03953218760987012, 'random_strength': 2.7780930810004674, 'grow_policy': 'Depthwise', 'min_data_in_leaf': 88}. Best is trial 349 with value: 2072.137476888861.[0m
[32m[I 2024-10-13 10:28:09,341][0m Trial 611 finished with value: 2502.5744854286118 and parameters: {'depth': 12, 'learning_rate': 0.0004793295103134245, 'iterations': 2771, 'l2_leaf_reg': 4.194471797964043e-08, 'border_count': 19, 'bagging_temperature': 0.10198604199027225, 'random_strength': 2.523085618027579, 'grow_policy': 'Depthwise', 'min_data_in_leaf': 17}. Best is trial 349 with value: 2072.137476888861.[0m
