[32m[I 2024-10-13 11:02:57,424][0m Trial 867 finished with value: 2207.7435849704607 and parameters: {'depth': 11, 'learning_rate': 0.00041239858932269467, 'iterations': 2934, 'l2_leaf_reg': 2.338195383766771e-08, 'border_count': 23, 'bagging_temperature': 0.10536330057397846, 'random_strength': 2.5102870687362193, 'grow_policy': 'Depthwise', 'min_data_in_leaf': 36}. Best is trial 814 with value: 2060.357404924192.[0m
[32m[I 2024-10-13 11:03:11,381][0m Trial 868 finished with value: 2561.0551023325957 and parameters: {'depth': 11, 'learning_rate': 0.0005397402066744183, 'iterations': 2812, 'l2_leaf_reg': 1.3884450781495798e-08, 'border_count': 36, 'bagging_temperature': 0.5420162011571912, 'random_strength': 1.710599211624331, 'grow_policy': 'Depthwise', 'min_data_in_leaf': 1}. Best is trial 814 with value: 2060.357404924192.[0m
[32m[I 2024-10-13 11:03:16,605][0m Trial 869 finished with value: 2194.5012076082353 and parameters: {'depth': 12, 'learning_rate': 0.0008004257360001067, 'iterations': 2894, 'l2_leaf_reg': 1.010840007778224e-08, 'border_count': 17, 'bagging_temperature': 0.022209215072774957, 'random_strength': 1.0687103921195238, 'grow_policy': 'Depthwise', 'min_data_in_leaf': 27}. Best is trial 814 with value: 2060.357404924192.[0m
[32m[I 2024-10-13 11:03:20,681][0m Trial 870 finished with value: 2180.1546660893805 and parameters: {'depth': 11, 'learning_rate': 0.0005888052301154026, 'iterations': 2954, 'l2_leaf_reg': 3.006907922081998e-08, 'border_count': 21, 'bagging_temperature': 0.06828067377439437, 'random_strength': 2.0847312246105147, 'grow_policy': 'Depthwise', 'min_data_in_leaf': 50}. Best is trial 814 with value: 2060.357404924192.[0m
[32m[I 2024-10-13 11:03:26,048][0m Trial 871 finished with value: 3350.7316950510813 and parameters: {'depth': 11, 'learning_rate': 0.0003464262470841051, 'iterations': 2841, 'l2_leaf_reg': 1.945841143061087e-08, 'border_count': 9, 'bagging_temperature': 0.05440106938753803, 'random_strength': 1.4036802315476333, 'grow_policy': 'Depthwise', 'min_data_in_leaf': 20}. Best is trial 814 with value: 2060.357404924192.[0m
[32m[I 2024-10-13 11:03:38,410][0m Trial 872 finished with value: 2858.8665318071917 and parameters: {'depth': 9, 'learning_rate': 0.00047030734918527433, 'iterations': 2999, 'l2_leaf_reg': 7.71175368113527e-08, 'border_count': 16, 'bagging_temperature': 0.02605250156796085, 'random_strength': 2.338627924495566, 'grow_policy': 'Depthwise', 'min_data_in_leaf': 1}. Best is trial 814 with value: 2060.357404924192.[0m
[32m[I 2024-10-13 11:03:41,772][0m Trial 873 finished with value: 2241.497369130094 and parameters: {'depth': 11, 'learning_rate': 0.0006838692158789411, 'iterations': 2873, 'l2_leaf_reg': 5.026544635578721e-08, 'border_count': 27, 'bagging_temperature': 0.08420453772237198, 'random_strength': 1.8632774509517722, 'grow_policy': 'Depthwise', 'min_data_in_leaf': 63}. Best is trial 814 with value: 2060.357404924192.[0m
[32m[I 2024-10-13 11:03:45,949][0m Trial 874 finished with value: 2336.308376637075 and parameters: {'depth': 12, 'learning_rate': 0.0004188532905970686, 'iterations': 2789, 'l2_leaf_reg': 5.076494464663505, 'border_count': 30, 'bagging_temperature': 0.041419841997039915, 'random_strength': 2.117847712005421, 'grow_policy': 'Depthwise', 'min_data_in_leaf': 37}. Best is trial 814 with value: 2060.357404924192.[0m
[32m[I 2024-10-13 11:03:49,856][0m Trial 875 finished with value: 2177.0637309788344 and parameters: {'depth': 11, 'learning_rate': 0.0005915300824629542, 'iterations': 2899, 'l2_leaf_reg': 3.10024449388069e-08, 'border_count': 23, 'bagging_temperature': 0.1295600793642781, 'random_strength': 2.6437181176011144, 'grow_policy': 'Depthwise', 'min_data_in_leaf': 48}. Best is trial 814 with value: 2060.357404924192.[0m
[32m[I 2024-10-13 11:03:54,964][0m Trial 876 finished with value: 2143.0389926258827 and parameters: {'depth': 10, 'learning_rate': 0.0004916300741546208, 'iterations': 2791, 'l2_leaf_reg': 1.8825300054402535e-08, 'border_count': 14, 'bagging_temperature': 0.0218294931463604, 'random_strength': 1.5962555428463907, 'grow_policy': 'Depthwise', 'min_data_in_leaf': 22}. Best is trial 814 with value: 2060.357404924192.[0m
[32m[I 2024-10-13 11:04:00,349][0m Trial 877 finished with value: 2860.5536947570417 and parameters: {'depth': 10, 'learning_rate': 0.0006983382036599945, 'iterations': 2752, 'l2_leaf_reg': 1.186745492247712e-07, 'border_count': 6, 'bagging_temperature': 0.05638309554701667, 'random_strength': 1.243057041001205, 'grow_policy': 'Depthwise', 'min_data_in_leaf': 18}. Best is trial 814 with value: 2060.357404924192.[0m
[32m[I 2024-10-13 11:04:26,281][0m Trial 878 finished with value: 2821.75402138122 and parameters: {'depth': 10, 'learning_rate': 0.0009160408267324069, 'iterations': 2727, 'l2_leaf_reg': 3.372446712018068e-08, 'border_count': 11, 'bagging_temperature': 0.016187928001075914, 'random_strength': 1.568729239096281, 'grow_policy': 'SymmetricTree', 'min_data_in_leaf': 18}. Best is trial 814 with value: 2060.357404924192.[0m
[32m[I 2024-10-13 11:04:30,735][0m Trial 879 finished with value: 2172.316324145266 and parameters: {'depth': 10, 'learning_rate': 0.0005323537621833823, 'iterations': 2779, 'l2_leaf_reg': 5.1775296726995104e-08, 'border_count': 13, 'bagging_temperature': 0.08760862450670454, 'random_strength': 1.417651886455613, 'grow_policy': 'Depthwise', 'min_data_in_leaf': 31}. Best is trial 814 with value: 2060.357404924192.[0m
[32m[I 2024-10-13 11:04:36,283][0m Trial 880 finished with value: 3020.557536281676 and parameters: {'depth': 9, 'learning_rate': 0.00045509171992395733, 'iterations': 2793, 'l2_leaf_reg': 2.143845012526219e-08, 'border_count': 6, 'bagging_temperature': 0.03325836688780933, 'random_strength': 1.5827185999350355, 'grow_policy': 'Depthwise', 'min_data_in_leaf': 16}. Best is trial 814 with value: 2060.357404924192.[0m
[32m[I 2024-10-13 11:04:40,797][0m Trial 881 finished with value: 2294.350295744489 and parameters: {'depth': 10, 'learning_rate': 0.00038273256103633723, 'iterations': 2722, 'l2_leaf_reg': 4.1177484286103054e-08, 'border_count': 16, 'bagging_temperature': 0.06315942755873097, 'random_strength': 1.3551690319421947, 'grow_policy': 'Depthwise', 'min_data_in_leaf': 28}. Best is trial 814 with value: 2060.357404924192.[0m
[32m[I 2024-10-13 11:04:44,666][0m Trial 882 finished with value: 3391.986112914577 and parameters: {'depth': 10, 'learning_rate': 0.0006135528642735236, 'iterations': 2627, 'l2_leaf_reg': 2.3142994232739804e-08, 'border_count': 1, 'bagging_temperature': 0.020756197016865027, 'random_strength': 1.098535979956654, 'grow_policy': 'Depthwise', 'min_data_in_leaf': 40}. Best is trial 814 with value: 2060.357404924192.[0m
[32m[I 2024-10-13 11:04:50,630][0m Trial 883 finished with value: 2543.8037981626057 and parameters: {'depth': 10, 'learning_rate': 0.0005014614246457226, 'iterations': 2823, 'l2_leaf_reg': 7.370596247762342e-08, 'border_count': 13, 'bagging_temperature': 0.044176747010247576, 'random_strength': 1.680170304906142, 'grow_policy': 'Depthwise', 'min_data_in_leaf': 18}. Best is trial 814 with value: 2060.357404924192.[0m
[32m[I 2024-10-13 11:04:55,187][0m Trial 884 finished with value: 2887.4737184626865 and parameters: {'depth': 9, 'learning_rate': 0.027745638358937758, 'iterations': 2696, 'l2_leaf_reg': 1.8171631853807567e-08, 'border_count': 9, 'bagging_temperature': 0.000925273240041146, 'random_strength': 1.5438330605409043, 'grow_policy': 'Lossguide', 'min_data_in_leaf': 46, 'max_leaves': 158}. Best is trial 814 with value: 2060.357404924192.[0m
[32m[I 2024-10-13 11:05:08,642][0m Trial 885 finished with value: 2554.3169749804597 and parameters: {'depth': 10, 'learning_rate': 0.0008119396986316745, 'iterations': 2795, 'l2_leaf_reg': 3.351251376422814e-08, 'border_count': 18, 'bagging_temperature': 0.10463394402338425, 'random_strength': 5.957563873190995, 'grow_policy': 'Depthwise', 'min_data_in_leaf': 1}. Best is trial 814 with value: 2060.357404924192.[0m
[32m[I 2024-10-13 11:05:18,771][0m Trial 886 finished with value: 3895.511491069287 and parameters: {'depth': 10, 'learning_rate': 0.00015074970184311438, 'iterations': 2492, 'l2_leaf_reg': 4.75140974655841e-08, 'border_count': 18, 'bagging_temperature': 0.06441935004065225, 'random_strength': 1.79268514003697, 'grow_policy': 'Depthwise', 'min_data_in_leaf': 2}. Best is trial 814 with value: 2060.357404924192.[0m
[32m[I 2024-10-13 11:05:23,359][0m Trial 887 finished with value: 2974.4425966123463 and parameters: {'depth': 10, 'learning_rate': 0.0003271796444024983, 'iterations': 2847, 'l2_leaf_reg': 1.519716154920997e-08, 'border_count': 10, 'bagging_temperature': 0.03818014041271838, 'random_strength': 0.9253864580438638, 'grow_policy': 'Depthwise', 'min_data_in_leaf': 31}. Best is trial 814 with value: 2060.357404924192.[0m
[32m[I 2024-10-13 11:05:27,318][0m Trial 888 finished with value: 2170.1246257334233 and parameters: {'depth': 10, 'learning_rate': 0.0005657338403155346, 'iterations': 2752, 'l2_leaf_reg': 2.5484527229996105e-08, 'border_count': 34, 'bagging_temperature': 0.020239455118823333, 'random_strength': 1.8518526692407233, 'grow_policy': 'Depthwise', 'min_data_in_leaf': 50}. Best is trial 814 with value: 2060.357404924192.[0m
[32m[I 2024-10-13 11:05:33,136][0m Trial 889 finished with value: 2335.315488083382 and parameters: {'depth': 10, 'learning_rate': 0.0007135512136274381, 'iterations': 2668, 'l2_leaf_reg': 8.6353218550156e-08, 'border_count': 24, 'bagging_temperature': 0.31652119985910965, 'random_strength': 1.3870280709909364, 'grow_policy': 'Depthwise', 'min_data_in_leaf': 18}. Best is trial 814 with value: 2060.357404924192.[0m
[32m[I 2024-10-13 11:05:37,614][0m Trial 890 finished with value: 2572.00451561903 and parameters: {'depth': 7, 'learning_rate': 0.0002661941465504915, 'iterations': 2851, 'l2_leaf_reg': 1.989637893947446e-08, 'border_count': 16, 'bagging_temperature': 0.07963786121524388, 'random_strength': 1.6705428423372914, 'grow_policy': 'Depthwise', 'min_data_in_leaf': 33}. Best is trial 814 with value: 2060.357404924192.[0m
[32m[I 2024-10-13 11:05:49,763][0m Trial 891 finished with value: 2985.6505272148247 and parameters: {'depth': 10, 'learning_rate': 0.00043657846414643404, 'iterations': 2599, 'l2_leaf_reg': 3.1816301706401475e-08, 'border_count': 22, 'bagging_temperature': 0.05060571534405105, 'random_strength': 1.9608008807435195, 'grow_policy': 'Depthwise', 'min_data_in_leaf': 1}. Best is trial 814 with value: 2060.357404924192.[0m
[32m[I 2024-10-13 11:05:53,062][0m Trial 892 finished with value: 2795.284795685373 and parameters: {'depth': 9, 'learning_rate': 0.0005020314737319258, 'iterations': 2739, 'l2_leaf_reg': 5.668421349835295e-08, 'border_count': 5, 'bagging_temperature': 0.022747802244908192, 'random_strength': 1.759310559947024, 'grow_policy': 'Depthwise', 'min_data_in_leaf': 60}. Best is trial 814 with value: 2060.357404924192.[0m
[32m[I 2024-10-13 11:06:08,210][0m Trial 893 finished with value: 3004.6438320300817 and parameters: {'depth': 12, 'learning_rate': 0.0006238304954261814, 'iterations': 2939, 'l2_leaf_reg': 1.5857864031726148e-07, 'border_count': 14, 'bagging_temperature': 0.03969414405747012, 'random_strength': 1.9658899171068593, 'grow_policy': 'Depthwise', 'min_data_in_leaf': 1}. Best is trial 814 with value: 2060.357404924192.[0m
[32m[I 2024-10-13 11:06:12,538][0m Trial 894 finished with value: 2363.7601170802614 and parameters: {'depth': 8, 'learning_rate': 0.0003704147301531908, 'iterations': 2805, 'l2_leaf_reg': 1.0090199602997496e-08, 'border_count': 28, 'bagging_temperature': 0.5690002470250612, 'random_strength': 1.5313346128510443, 'grow_policy': 'Depthwise', 'min_data_in_leaf': 34}. Best is trial 814 with value: 2060.357404924192.[0m
[32m[I 2024-10-13 11:06:15,771][0m Trial 895 finished with value: 2221.9151696757663 and parameters: {'depth': 10, 'learning_rate': 0.00045066331656977665, 'iterations': 2541, 'l2_leaf_reg': 1.659085314245133e-08, 'border_count': 20, 'bagging_temperature': 0.07086332003175053, 'random_strength': 2.05314143083186, 'grow_policy': 'Depthwise', 'min_data_in_leaf': 54}. Best is trial 814 with value: 2060.357404924192.[0m
[32m[I 2024-10-13 11:06:21,180][0m Trial 896 finished with value: 2133.060200947923 and parameters: {'depth': 9, 'learning_rate': 0.000556861654827195, 'iterations': 2859, 'l2_leaf_reg': 2.6648645975365412e-08, 'border_count': 15, 'bagging_temperature': 9.630102098404092e-05, 'random_strength': 1.27898581354972, 'grow_policy': 'Depthwise', 'min_data_in_leaf': 22}. Best is trial 814 with value: 2060.357404924192.[0m
[32m[I 2024-10-13 11:06:26,947][0m Trial 897 finished with value: 2844.6302797844533 and parameters: {'depth': 9, 'learning_rate': 0.0008479834885440651, 'iterations': 2883, 'l2_leaf_reg': 5.068276273362337e-08, 'border_count': 6, 'bagging_temperature': 0.018076950141360733, 'random_strength': 0.9300973713424875, 'grow_policy': 'Depthwise', 'min_data_in_leaf': 19}. Best is trial 814 with value: 2060.357404924192.[0m
[32m[I 2024-10-13 11:06:32,267][0m Trial 898 finished with value: 3046.3021063913448 and parameters: {'depth': 9, 'learning_rate': 0.0006881285035317816, 'iterations': 2954, 'l2_leaf_reg': 7.968428122015724e-08, 'border_count': 11, 'bagging_temperature': 0.0006907926650971776, 'random_strength': 1.4487195497890442, 'grow_policy': 'Depthwise', 'min_data_in_leaf': 25}. Best is trial 814 with value: 2060.357404924192.[0m
[32m[I 2024-10-13 11:06:38,494][0m Trial 899 finished with value: 3220.8991249752735 and parameters: {'depth': 9, 'learning_rate': 0.0006022130402770006, 'iterations': 2874, 'l2_leaf_reg': 3.743180888653489e-08, 'border_count': 9, 'bagging_temperature': 0.014685681025570923, 'random_strength': 1.2539231282652041, 'grow_policy': 'Depthwise', 'min_data_in_leaf': 17}. Best is trial 814 with value: 2060.357404924192.[0m
[32m[I 2024-10-13 11:07:02,586][0m Trial 900 finished with value: 2666.146648701829 and parameters: {'depth': 9, 'learning_rate': 0.000992468902045918, 'iterations': 2909, 'l2_leaf_reg': 9.360496844457183e-05, 'border_count': 15, 'bagging_temperature': 0.023026240065942394, 'random_strength': 1.117874915768059, 'grow_policy': 'SymmetricTree', 'min_data_in_leaf': 34}. Best is trial 814 with value: 2060.357404924192.[0m
[32m[I 2024-10-13 11:07:09,845][0m Trial 901 finished with value: 3391.390411240078 and parameters: {'depth': 9, 'learning_rate': 0.0007081733507254448, 'iterations': 2836, 'l2_leaf_reg': 2.6847329386953027e-08, 'border_count': 1, 'bagging_temperature': 0.0026832528710025623, 'random_strength': 1.1624635267951875, 'grow_policy': 'Depthwise', 'min_data_in_leaf': 17}. Best is trial 814 with value: 2060.357404924192.[0m
[32m[I 2024-10-13 11:07:13,936][0m Trial 902 finished with value: 2799.653148516589 and parameters: {'depth': 9, 'learning_rate': 0.0005630349840838148, 'iterations': 2945, 'l2_leaf_reg': 4.1131208197895656e-08, 'border_count': 12, 'bagging_temperature': 0.0020804650363192775, 'random_strength': 0.9653588606888082, 'grow_policy': 'Depthwise', 'min_data_in_leaf': 44}. Best is trial 814 with value: 2060.357404924192.[0m
[32m[I 2024-10-13 11:07:18,171][0m Trial 903 finished with value: 2840.9930233287228 and parameters: {'depth': 9, 'learning_rate': 0.0003988307245248954, 'iterations': 2848, 'l2_leaf_reg': 5.936488542669497e-08, 'border_count': 6, 'bagging_temperature': 0.016886488599142113, 'random_strength': 1.2956036583350676, 'grow_policy': 'Depthwise', 'min_data_in_leaf': 35}. Best is trial 814 with value: 2060.357404924192.[0m
[32m[I 2024-10-13 11:07:24,205][0m Trial 904 finished with value: 2374.7607849961523 and parameters: {'depth': 9, 'learning_rate': 0.0005092619669363274, 'iterations': 2893, 'l2_leaf_reg': 2.7223728176311085e-08, 'border_count': 16, 'bagging_temperature': 0.0004353142405206928, 'random_strength': 1.2473533808758024, 'grow_policy': 'Depthwise', 'min_data_in_leaf': 16}. Best is trial 814 with value: 2060.357404924192.[0m
[32m[I 2024-10-13 11:07:28,084][0m Trial 905 finished with value: 2842.231350371829 and parameters: {'depth': 8, 'learning_rate': 0.0006314987687842951, 'iterations': 2951, 'l2_leaf_reg': 1.7608226036665002, 'border_count': 11, 'bagging_temperature': 0.0386864034993815, 'random_strength': 1.5343768065068557, 'grow_policy': 'Depthwise', 'min_data_in_leaf': 48}. Best is trial 814 with value: 2060.357404924192.[0m
[32m[I 2024-10-13 11:07:34,292][0m Trial 906 finished with value: 2456.242661888065 and parameters: {'depth': 9, 'learning_rate': 0.000482536333290173, 'iterations': 2803, 'l2_leaf_reg': 1.0259819220529744e-07, 'border_count': 19, 'bagging_temperature': 0.0503258625058797, 'random_strength': 1.0542135406897346, 'grow_policy': 'Lossguide', 'min_data_in_leaf': 17, 'max_leaves': 201}. Best is trial 814 with value: 2060.357404924192.[0m
[32m[I 2024-10-13 11:07:46,551][0m Trial 907 finished with value: 2972.1759242475227 and parameters: {'depth': 9, 'learning_rate': 0.0007870645264736407, 'iterations': 2999, 'l2_leaf_reg': 3.744692256531566e-08, 'border_count': 15, 'bagging_temperature': 0.015649025087628776, 'random_strength': 1.3345967492944546, 'grow_policy': 'Depthwise', 'min_data_in_leaf': 1}. Best is trial 814 with value: 2060.357404924192.[0m
[32m[I 2024-10-13 11:07:50,812][0m Trial 908 finished with value: 2178.5984956514512 and parameters: {'depth': 9, 'learning_rate': 0.000568451328736261, 'iterations': 2862, 'l2_leaf_reg': 2.4762929870775832e-08, 'border_count': 25, 'bagging_temperature': 0.15282487941041342, 'random_strength': 1.6262574391745894, 'grow_policy': 'Depthwise', 'min_data_in_leaf': 38}. Best is trial 814 with value: 2060.357404924192.[0m
[32m[I 2024-10-13 11:07:54,235][0m Trial 909 finished with value: 2207.526797637537 and parameters: {'depth': 8, 'learning_rate': 0.0004208891759167011, 'iterations': 2784, 'l2_leaf_reg': 1.4414549347992216e-08, 'border_count': 19, 'bagging_temperature': 0.09252124579416902, 'random_strength': 1.4001060141052086, 'grow_policy': 'Depthwise', 'min_data_in_leaf': 62}. Best is trial 814 with value: 2060.357404924192.[0m
[32m[I 2024-10-13 11:07:58,571][0m Trial 910 finished with value: 2994.690048506707 and parameters: {'depth': 10, 'learning_rate': 0.00033019756649864293, 'iterations': 2919, 'l2_leaf_reg': 5.286879707298715e-08, 'border_count': 10, 'bagging_temperature': 0.11537032081881178, 'random_strength': 1.69478103071338, 'grow_policy': 'Depthwise', 'min_data_in_leaf': 34}. Best is trial 814 with value: 2060.357404924192.[0m
[32m[I 2024-10-13 11:08:04,774][0m Trial 911 finished with value: 2469.950180518727 and parameters: {'depth': 9, 'learning_rate': 0.0006968366596165937, 'iterations': 2832, 'l2_leaf_reg': 2.1498760976049815e-08, 'border_count': 98, 'bagging_temperature': 0.0005050022932356034, 'random_strength': 1.7163616003381792, 'grow_policy': 'Depthwise', 'min_data_in_leaf': 17}. Best is trial 814 with value: 2060.357404924192.[0m
[32m[I 2024-10-13 11:08:17,658][0m Trial 912 finished with value: 2960.2058904779446 and parameters: {'depth': 10, 'learning_rate': 0.0005389731090412151, 'iterations': 2997, 'l2_leaf_reg': 3.4793299365230726e-08, 'border_count': 31, 'bagging_temperature': 0.031963788388725455, 'random_strength': 1.5043172434536625, 'grow_policy': 'Depthwise', 'min_data_in_leaf': 1}. Best is trial 814 with value: 2060.357404924192.[0m
[32m[I 2024-10-13 11:08:21,809][0m Trial 913 finished with value: 2461.0304574235597 and parameters: {'depth': 10, 'learning_rate': 0.02029893844382791, 'iterations': 2903, 'l2_leaf_reg': 1.3843806981772087e-08, 'border_count': 25, 'bagging_temperature': 0.061081137471843266, 'random_strength': 0.856174443729141, 'grow_policy': 'Depthwise', 'min_data_in_leaf': 59}. Best is trial 814 with value: 2060.357404924192.[0m
[32m[I 2024-10-13 11:08:25,782][0m Trial 914 finished with value: 2796.1188173091355 and parameters: {'depth': 8, 'learning_rate': 0.0004706284388934084, 'iterations': 2765, 'l2_leaf_reg': 6.340275559336758e-08, 'border_count': 5, 'bagging_temperature': 0.03609074855399533, 'random_strength': 1.8485644430612806, 'grow_policy': 'Depthwise', 'min_data_in_leaf': 45}. Best is trial 814 with value: 2060.357404924192.[0m
[32m[I 2024-10-13 11:08:28,486][0m Trial 915 finished with value: 2198.689705871275 and parameters: {'depth': 9, 'learning_rate': 0.0006162967551635011, 'iterations': 2858, 'l2_leaf_reg': 2.591668825466915e-08, 'border_count': 37, 'bagging_temperature': 0.07494150735657515, 'random_strength': 1.885532799131014, 'grow_policy': 'Depthwise', 'min_data_in_leaf': 441}. Best is trial 814 with value: 2060.357404924192.[0m
[32m[I 2024-10-13 11:08:33,222][0m Trial 916 finished with value: 2195.639390919942 and parameters: {'depth': 10, 'learning_rate': 0.00040076766641887907, 'iterations': 2805, 'l2_leaf_reg': 1.1937767471887631e-07, 'border_count': 16, 'bagging_temperature': 0.020741838226517206, 'random_strength': 1.197004938945271, 'grow_policy': 'Depthwise', 'min_data_in_leaf': 26}. Best is trial 814 with value: 2060.357404924192.[0m
[32m[I 2024-10-13 11:08:36,831][0m Trial 917 finished with value: 2265.299641771841 and parameters: {'depth': 12, 'learning_rate': 0.0008014609497345491, 'iterations': 2946, 'l2_leaf_reg': 1.0029357336351507e-08, 'border_count': 20, 'bagging_temperature': 0.05303959015457939, 'random_strength': 1.5939666288737078, 'grow_policy': 'Depthwise', 'min_data_in_leaf': 64}. Best is trial 814 with value: 2060.357404924192.[0m
