[32m[I 2024-10-13 09:36:03,133][0m Trial 202 finished with value: 2246.349029180927 and parameters: {'depth': 3, 'learning_rate': 0.003105389223228525, 'iterations': 1422, 'l2_leaf_reg': 4.23268006211396e-06, 'border_count': 16, 'bagging_temperature': 0.6953249161666714, 'random_strength': 3.6091554804456485, 'grow_policy': 'Depthwise', 'min_data_in_leaf': 429}. Best is trial 52 with value: 2182.908535006516.[0m
[32m[I 2024-10-13 09:36:05,196][0m Trial 203 finished with value: 2938.3219455233566 and parameters: {'depth': 6, 'learning_rate': 0.0030103649643315016, 'iterations': 1419, 'l2_leaf_reg': 4.305305553808107e-06, 'border_count': 10, 'bagging_temperature': 0.7240925129421172, 'random_strength': 3.3684944953948235, 'grow_policy': 'Depthwise', 'min_data_in_leaf': 420}. Best is trial 52 with value: 2182.908535006516.[0m
[32m[I 2024-10-13 09:36:07,322][0m Trial 204 finished with value: 2282.5668472315906 and parameters: {'depth': 3, 'learning_rate': 0.004056016000104747, 'iterations': 1505, 'l2_leaf_reg': 6.12547984815977e-06, 'border_count': 20, 'bagging_temperature': 0.074108087877594, 'random_strength': 3.0152734858676054, 'grow_policy': 'Depthwise', 'min_data_in_leaf': 461}. Best is trial 52 with value: 2182.908535006516.[0m
[32m[I 2024-10-13 09:36:09,461][0m Trial 205 finished with value: 2354.275081406107 and parameters: {'depth': 3, 'learning_rate': 0.0059452667366823525, 'iterations': 1295, 'l2_leaf_reg': 3.6276827637590007e-06, 'border_count': 26, 'bagging_temperature': 0.7015446487796223, 'random_strength': 2.2642167118192984, 'grow_policy': 'Depthwise', 'min_data_in_leaf': 412}. Best is trial 52 with value: 2182.908535006516.[0m
[32m[I 2024-10-13 09:36:11,604][0m Trial 206 finished with value: 2219.6903704292663 and parameters: {'depth': 4, 'learning_rate': 0.001574069356236586, 'iterations': 1440, 'l2_leaf_reg': 1.0525397093104675e-06, 'border_count': 16, 'bagging_temperature': 0.6647238723684408, 'random_strength': 2.6683404922100067, 'grow_policy': 'Depthwise', 'min_data_in_leaf': 388}. Best is trial 52 with value: 2182.908535006516.[0m
[32m[I 2024-10-13 09:36:15,035][0m Trial 207 finished with value: 2837.5519858373814 and parameters: {'depth': 4, 'learning_rate': 0.0022272839294986686, 'iterations': 1570, 'l2_leaf_reg': 2.166790672860092e-06, 'border_count': 5, 'bagging_temperature': 0.6625858000193072, 'random_strength': 2.543465748152028, 'grow_policy': 'Depthwise', 'min_data_in_leaf': 412}. Best is trial 52 with value: 2182.908535006516.[0m
[32m[I 2024-10-13 09:36:17,420][0m Trial 208 finished with value: 2209.994984585073 and parameters: {'depth': 4, 'learning_rate': 0.0015901883036492442, 'iterations': 1440, 'l2_leaf_reg': 2.0810442173432612e-07, 'border_count': 17, 'bagging_temperature': 0.2630901993586705, 'random_strength': 2.788584018460397, 'grow_policy': 'Depthwise', 'min_data_in_leaf': 386}. Best is trial 52 with value: 2182.908535006516.[0m
[32m[I 2024-10-13 09:36:20,089][0m Trial 209 finished with value: 2372.5735528870214 and parameters: {'depth': 4, 'learning_rate': 0.0017112019364088696, 'iterations': 1423, 'l2_leaf_reg': 1.1129520388487959e-06, 'border_count': 214, 'bagging_temperature': 0.152258493069374, 'random_strength': 1.878068106776005, 'grow_policy': 'Depthwise', 'min_data_in_leaf': 384}. Best is trial 52 with value: 2182.908535006516.[0m
[32m[I 2024-10-13 09:36:22,459][0m Trial 210 finished with value: 2204.2676734316055 and parameters: {'depth': 4, 'learning_rate': 0.0013099693724538755, 'iterations': 1450, 'l2_leaf_reg': 2.1429299964618343e-07, 'border_count': 28, 'bagging_temperature': 0.20272554295701764, 'random_strength': 2.7680513765312815, 'grow_policy': 'Depthwise', 'min_data_in_leaf': 345}. Best is trial 52 with value: 2182.908535006516.[0m
[32m[I 2024-10-13 09:36:25,054][0m Trial 211 finished with value: 2210.8543609966805 and parameters: {'depth': 4, 'learning_rate': 0.001523910332405624, 'iterations': 1488, 'l2_leaf_reg': 4.6411329266353376e-07, 'border_count': 21, 'bagging_temperature': 0.20081452051698095, 'random_strength': 2.691585866675712, 'grow_policy': 'Depthwise', 'min_data_in_leaf': 283}. Best is trial 52 with value: 2182.908535006516.[0m
[32m[I 2024-10-13 09:36:28,057][0m Trial 212 finished with value: 2237.5847679087465 and parameters: {'depth': 4, 'learning_rate': 0.0015357328761398006, 'iterations': 1487, 'l2_leaf_reg': 2.178454882044196e-07, 'border_count': 28, 'bagging_temperature': 0.24210593767071753, 'random_strength': 2.7437590841126727, 'grow_policy': 'Depthwise', 'min_data_in_leaf': 346}. Best is trial 52 with value: 2182.908535006516.[0m
[32m[I 2024-10-13 09:36:30,177][0m Trial 213 finished with value: 2221.4695955939037 and parameters: {'depth': 4, 'learning_rate': 0.0013936205623881687, 'iterations': 1500, 'l2_leaf_reg': 1.7532087914559781e-07, 'border_count': 31, 'bagging_temperature': 0.24778273890399174, 'random_strength': 2.7151389130840315, 'grow_policy': 'Depthwise', 'min_data_in_leaf': 295}. Best is trial 52 with value: 2182.908535006516.[0m
[32m[I 2024-10-13 09:36:33,680][0m Trial 214 finished with value: 2228.7751948777363 and parameters: {'depth': 4, 'learning_rate': 0.001405500880699711, 'iterations': 1598, 'l2_leaf_reg': 2.2582460873348843e-07, 'border_count': 31, 'bagging_temperature': 0.1825216592036898, 'random_strength': 2.706538963141301, 'grow_policy': 'Depthwise', 'min_data_in_leaf': 287}. Best is trial 52 with value: 2182.908535006516.[0m
[32m[I 2024-10-13 09:36:36,793][0m Trial 215 finished with value: 2247.527188048751 and parameters: {'depth': 4, 'learning_rate': 0.0014593178699092674, 'iterations': 1600, 'l2_leaf_reg': 1.6801524438371315e-07, 'border_count': 35, 'bagging_temperature': 0.24953162764657913, 'random_strength': 2.3886859503858022, 'grow_policy': 'Depthwise', 'min_data_in_leaf': 283}. Best is trial 52 with value: 2182.908535006516.[0m
[32m[I 2024-10-13 09:36:39,074][0m Trial 216 finished with value: 2237.475749531764 and parameters: {'depth': 5, 'learning_rate': 0.0010063054370350686, 'iterations': 1481, 'l2_leaf_reg': 1.9215342559333712e-07, 'border_count': 30, 'bagging_temperature': 0.19778181693182934, 'random_strength': 2.699429439507499, 'grow_policy': 'Depthwise', 'min_data_in_leaf': 249}. Best is trial 52 with value: 2182.908535006516.[0m
[32m[I 2024-10-13 09:36:42,142][0m Trial 217 finished with value: 2234.5541871690384 and parameters: {'depth': 4, 'learning_rate': 0.00099914582057973, 'iterations': 1511, 'l2_leaf_reg': 1.067437233040073e-07, 'border_count': 30, 'bagging_temperature': 0.20982782306196698, 'random_strength': 2.6066091624989207, 'grow_policy': 'Depthwise', 'min_data_in_leaf': 225}. Best is trial 52 with value: 2182.908535006516.[0m
[32m[I 2024-10-13 09:36:45,207][0m Trial 218 finished with value: 2318.8498431546764 and parameters: {'depth': 4, 'learning_rate': 0.0010449193663501501, 'iterations': 1506, 'l2_leaf_reg': 1.0479536105707827e-07, 'border_count': 42, 'bagging_temperature': 0.20240183288089753, 'random_strength': 2.6983938937662635, 'grow_policy': 'Depthwise', 'min_data_in_leaf': 213}. Best is trial 52 with value: 2182.908535006516.[0m
[32m[I 2024-10-13 09:36:48,391][0m Trial 219 finished with value: 2234.298085376165 and parameters: {'depth': 4, 'learning_rate': 0.001327954587334704, 'iterations': 1611, 'l2_leaf_reg': 2.454716175785672e-07, 'border_count': 39, 'bagging_temperature': 0.22778182775604883, 'random_strength': 2.7277437514020626, 'grow_policy': 'Depthwise', 'min_data_in_leaf': 266}. Best is trial 52 with value: 2182.908535006516.[0m
[32m[I 2024-10-13 09:36:51,541][0m Trial 220 finished with value: 2221.8631480487275 and parameters: {'depth': 4, 'learning_rate': 0.0012922593819576426, 'iterations': 1585, 'l2_leaf_reg': 2.9197681102002574e-07, 'border_count': 39, 'bagging_temperature': 0.22351135365660885, 'random_strength': 2.122794462717713, 'grow_policy': 'Depthwise', 'min_data_in_leaf': 249}. Best is trial 52 with value: 2182.908535006516.[0m
[32m[I 2024-10-13 09:36:54,284][0m Trial 221 finished with value: 2311.383065738997 and parameters: {'depth': 4, 'learning_rate': 0.0012474578281178117, 'iterations': 1615, 'l2_leaf_reg': 1.9937798364920233e-07, 'border_count': 41, 'bagging_temperature': 0.23117544601250242, 'random_strength': 2.10914297780113, 'grow_policy': 'Depthwise', 'min_data_in_leaf': 248}. Best is trial 52 with value: 2182.908535006516.[0m
[32m[I 2024-10-13 09:36:57,599][0m Trial 222 finished with value: 2271.0619718221824 and parameters: {'depth': 4, 'learning_rate': 0.0008080135816773045, 'iterations': 1684, 'l2_leaf_reg': 7.122375115328829e-08, 'border_count': 35, 'bagging_temperature': 0.18151664416031663, 'random_strength': 2.675940469597005, 'grow_policy': 'Depthwise', 'min_data_in_leaf': 246}. Best is trial 52 with value: 2182.908535006516.[0m
[32m[I 2024-10-13 09:37:00,196][0m Trial 223 finished with value: 2230.3153876423185 and parameters: {'depth': 4, 'learning_rate': 0.0010047568560879222, 'iterations': 1525, 'l2_leaf_reg': 1.1415604101089702e-07, 'border_count': 31, 'bagging_temperature': 0.21362016085239224, 'random_strength': 2.406054535167252, 'grow_policy': 'Depthwise', 'min_data_in_leaf': 296}. Best is trial 52 with value: 2182.908535006516.[0m
[32m[I 2024-10-13 09:37:03,248][0m Trial 224 finished with value: 2252.6694855576434 and parameters: {'depth': 4, 'learning_rate': 0.001470467589205319, 'iterations': 1522, 'l2_leaf_reg': 2.787992894069054e-07, 'border_count': 39, 'bagging_temperature': 0.2665084945994888, 'random_strength': 2.359983797985494, 'grow_policy': 'Depthwise', 'min_data_in_leaf': 304}. Best is trial 52 with value: 2182.908535006516.[0m
[32m[I 2024-10-13 09:37:05,915][0m Trial 225 finished with value: 2487.8117883057603 and parameters: {'depth': 4, 'learning_rate': 0.000618022195387875, 'iterations': 1610, 'l2_leaf_reg': 1.1520472274966107e-07, 'border_count': 33, 'bagging_temperature': 0.2112743721402391, 'random_strength': 2.5542513839702403, 'grow_policy': 'Depthwise', 'min_data_in_leaf': 269}. Best is trial 52 with value: 2182.908535006516.[0m
[32m[I 2024-10-13 09:37:09,174][0m Trial 226 finished with value: 2259.5066431836626 and parameters: {'depth': 5, 'learning_rate': 0.0008907391871983313, 'iterations': 1563, 'l2_leaf_reg': 3.3220835729870073e-08, 'border_count': 30, 'bagging_temperature': 0.1935616149147553, 'random_strength': 2.752015583425183, 'grow_policy': 'Depthwise', 'min_data_in_leaf': 190}. Best is trial 52 with value: 2182.908535006516.[0m
[32m[I 2024-10-13 09:37:12,464][0m Trial 227 finished with value: 2298.290412399885 and parameters: {'depth': 4, 'learning_rate': 0.001071590263334074, 'iterations': 1522, 'l2_leaf_reg': 2.960863570469255e-07, 'border_count': 46, 'bagging_temperature': 0.1684187059853488, 'random_strength': 2.271462806936593, 'grow_policy': 'Depthwise', 'min_data_in_leaf': 290}. Best is trial 52 with value: 2182.908535006516.[0m
[32m[I 2024-10-13 09:37:14,939][0m Trial 228 finished with value: 2215.885685353223 and parameters: {'depth': 4, 'learning_rate': 0.001396065876044382, 'iterations': 1480, 'l2_leaf_reg': 4.787971676129847e-07, 'border_count': 38, 'bagging_temperature': 0.21915796120608727, 'random_strength': 2.497077125739659, 'grow_policy': 'Depthwise', 'min_data_in_leaf': 311}. Best is trial 52 with value: 2182.908535006516.[0m
[32m[I 2024-10-13 09:37:18,388][0m Trial 229 finished with value: 2294.549391311213 and parameters: {'depth': 4, 'learning_rate': 0.0014792677275587607, 'iterations': 1728, 'l2_leaf_reg': 4.813622094644324e-07, 'border_count': 40, 'bagging_temperature': 0.2224433857120667, 'random_strength': 2.848001997590118, 'grow_policy': 'Depthwise', 'min_data_in_leaf': 309}. Best is trial 52 with value: 2182.908535006516.[0m
[32m[I 2024-10-13 09:37:20,616][0m Trial 230 finished with value: 2323.727148467907 and parameters: {'depth': 4, 'learning_rate': 0.0013155965538788348, 'iterations': 1647, 'l2_leaf_reg': 1.70125868470945e-07, 'border_count': 49, 'bagging_temperature': 0.2477891709740826, 'random_strength': 2.549438348657346, 'grow_policy': 'Depthwise', 'min_data_in_leaf': 266}. Best is trial 52 with value: 2182.908535006516.[0m
[32m[I 2024-10-13 09:37:22,774][0m Trial 231 finished with value: 2245.4732141997983 and parameters: {'depth': 4, 'learning_rate': 0.0009905773301319637, 'iterations': 1476, 'l2_leaf_reg': 3.2441394990511226e-07, 'border_count': 31, 'bagging_temperature': 0.2152741100556286, 'random_strength': 2.441320363543829, 'grow_policy': 'Depthwise', 'min_data_in_leaf': 342}. Best is trial 52 with value: 2182.908535006516.[0m
[32m[I 2024-10-13 09:37:24,913][0m Trial 232 finished with value: 2267.8981437828393 and parameters: {'depth': 4, 'learning_rate': 0.0017302918968020765, 'iterations': 1485, 'l2_leaf_reg': 6.499682570978068e-08, 'border_count': 27, 'bagging_temperature': 0.24387283730504464, 'random_strength': 2.750418656839235, 'grow_policy': 'Depthwise', 'min_data_in_leaf': 231}. Best is trial 52 with value: 2182.908535006516.[0m
[32m[I 2024-10-13 09:37:27,110][0m Trial 233 finished with value: 2206.979278791577 and parameters: {'depth': 4, 'learning_rate': 0.0012906220464493315, 'iterations': 1563, 'l2_leaf_reg': 2.310860609520627e-07, 'border_count': 37, 'bagging_temperature': 0.17321651451967154, 'random_strength': 2.0701341677822023, 'grow_policy': 'Depthwise', 'min_data_in_leaf': 341}. Best is trial 52 with value: 2182.908535006516.[0m
[32m[I 2024-10-13 09:37:29,303][0m Trial 234 finished with value: 2240.7923267390474 and parameters: {'depth': 4, 'learning_rate': 0.0013415136627827247, 'iterations': 1602, 'l2_leaf_reg': 2.4921225895086567e-07, 'border_count': 39, 'bagging_temperature': 0.2702038304638589, 'random_strength': 1.9676602252385074, 'grow_policy': 'Depthwise', 'min_data_in_leaf': 337}. Best is trial 52 with value: 2182.908535006516.[0m
[32m[I 2024-10-13 09:37:31,441][0m Trial 235 finished with value: 2256.2204710644196 and parameters: {'depth': 4, 'learning_rate': 0.001603033548639822, 'iterations': 1558, 'l2_leaf_reg': 8.457936655165718e-08, 'border_count': 36, 'bagging_temperature': 0.18088933585381317, 'random_strength': 2.188397297759934, 'grow_policy': 'Depthwise', 'min_data_in_leaf': 288}. Best is trial 52 with value: 2182.908535006516.[0m
[32m[I 2024-10-13 09:37:33,678][0m Trial 236 finished with value: 2205.0670789652286 and parameters: {'depth': 4, 'learning_rate': 0.0011502415760311984, 'iterations': 1489, 'l2_leaf_reg': 1.7696697800528043e-07, 'border_count': 31, 'bagging_temperature': 0.16670145792631658, 'random_strength': 2.45596720639058, 'grow_policy': 'Depthwise', 'min_data_in_leaf': 311}. Best is trial 52 with value: 2182.908535006516.[0m
[32m[I 2024-10-13 09:37:36,614][0m Trial 237 finished with value: 2199.116808556858 and parameters: {'depth': 10, 'learning_rate': 0.0011335618338187586, 'iterations': 1518, 'l2_leaf_reg': 5.921488898821467e-07, 'border_count': 30, 'bagging_temperature': 0.11594571381077907, 'random_strength': 2.439105615501096, 'grow_policy': 'Depthwise', 'min_data_in_leaf': 317}. Best is trial 52 with value: 2182.908535006516.[0m
[32m[I 2024-10-13 09:37:39,632][0m Trial 238 finished with value: 2201.5763574958605 and parameters: {'depth': 10, 'learning_rate': 0.0012273646960385602, 'iterations': 1494, 'l2_leaf_reg': 1.3908189338624698e-07, 'border_count': 32, 'bagging_temperature': 0.16366855805287162, 'random_strength': 1.6761126508461293, 'grow_policy': 'Depthwise', 'min_data_in_leaf': 328}. Best is trial 52 with value: 2182.908535006516.[0m
[32m[I 2024-10-13 09:37:42,698][0m Trial 239 finished with value: 2293.4378799148167 and parameters: {'depth': 11, 'learning_rate': 0.0011975105542549659, 'iterations': 1527, 'l2_leaf_reg': 1.346078321723057e-07, 'border_count': 44, 'bagging_temperature': 0.15902881671203634, 'random_strength': 1.5320372679785894, 'grow_policy': 'Depthwise', 'min_data_in_leaf': 320}. Best is trial 52 with value: 2182.908535006516.[0m
[32m[I 2024-10-13 09:37:45,925][0m Trial 240 finished with value: 2205.798871129386 and parameters: {'depth': 10, 'learning_rate': 0.0011240616941467706, 'iterations': 1474, 'l2_leaf_reg': 4.855147494779818e-07, 'border_count': 32, 'bagging_temperature': 0.13583547096857487, 'random_strength': 2.0769887178076636, 'grow_policy': 'Depthwise', 'min_data_in_leaf': 280}. Best is trial 52 with value: 2182.908535006516.[0m
[32m[I 2024-10-13 09:37:49,084][0m Trial 241 finished with value: 2218.264660260524 and parameters: {'depth': 10, 'learning_rate': 0.0010690502624006385, 'iterations': 1490, 'l2_leaf_reg': 5.074820266615911e-07, 'border_count': 33, 'bagging_temperature': 0.19684613245277838, 'random_strength': 1.7464708613952042, 'grow_policy': 'Depthwise', 'min_data_in_leaf': 270}. Best is trial 52 with value: 2182.908535006516.[0m
[32m[I 2024-10-13 09:37:52,268][0m Trial 242 finished with value: 2199.0453833370098 and parameters: {'depth': 10, 'learning_rate': 0.0011758360317306348, 'iterations': 1480, 'l2_leaf_reg': 4.969149786133349e-07, 'border_count': 36, 'bagging_temperature': 0.12348558041748246, 'random_strength': 1.722881754956398, 'grow_policy': 'Depthwise', 'min_data_in_leaf': 281}. Best is trial 52 with value: 2182.908535006516.[0m
[32m[I 2024-10-13 09:37:55,512][0m Trial 243 finished with value: 2199.839827592848 and parameters: {'depth': 10, 'learning_rate': 0.0010898674201072732, 'iterations': 1582, 'l2_leaf_reg': 4.754915616853112e-07, 'border_count': 37, 'bagging_temperature': 0.1342978829557017, 'random_strength': 1.8111406603333096, 'grow_policy': 'Depthwise', 'min_data_in_leaf': 281}. Best is trial 52 with value: 2182.908535006516.[0m
[32m[I 2024-10-13 09:37:58,896][0m Trial 244 finished with value: 2199.1163467494425 and parameters: {'depth': 10, 'learning_rate': 0.0010991997045963352, 'iterations': 1592, 'l2_leaf_reg': 5.236000002582606e-07, 'border_count': 37, 'bagging_temperature': 0.12905034845372745, 'random_strength': 1.7796861448756025, 'grow_policy': 'Depthwise', 'min_data_in_leaf': 276}. Best is trial 52 with value: 2182.908535006516.[0m
[32m[I 2024-10-13 09:38:02,232][0m Trial 245 finished with value: 2325.4177221927844 and parameters: {'depth': 10, 'learning_rate': 0.0009151443581286887, 'iterations': 1555, 'l2_leaf_reg': 5.15938955136482e-07, 'border_count': 53, 'bagging_temperature': 0.12208539565348182, 'random_strength': 1.6849309872537215, 'grow_policy': 'Depthwise', 'min_data_in_leaf': 270}. Best is trial 52 with value: 2182.908535006516.[0m
[32m[I 2024-10-13 09:38:05,540][0m Trial 246 finished with value: 2196.406553866269 and parameters: {'depth': 10, 'learning_rate': 0.0011102186413291027, 'iterations': 1618, 'l2_leaf_reg': 3.811968419956186e-07, 'border_count': 35, 'bagging_temperature': 0.11334586030955511, 'random_strength': 1.894644501140173, 'grow_policy': 'Depthwise', 'min_data_in_leaf': 249}. Best is trial 52 with value: 2182.908535006516.[0m
[32m[I 2024-10-13 09:38:08,826][0m Trial 247 finished with value: 2201.096485498705 and parameters: {'depth': 10, 'learning_rate': 0.001179228632260065, 'iterations': 1661, 'l2_leaf_reg': 4.0234329566748915e-07, 'border_count': 36, 'bagging_temperature': 0.13307435044308227, 'random_strength': 1.367954644744097, 'grow_policy': 'Depthwise', 'min_data_in_leaf': 303}. Best is trial 52 with value: 2182.908535006516.[0m
[32m[I 2024-10-13 09:38:12,058][0m Trial 248 finished with value: 2288.9541472235455 and parameters: {'depth': 10, 'learning_rate': 0.0011569602941850137, 'iterations': 1644, 'l2_leaf_reg': 4.3456097399648495e-07, 'border_count': 44, 'bagging_temperature': 0.13420586536596874, 'random_strength': 1.8147601043311177, 'grow_policy': 'Depthwise', 'min_data_in_leaf': 301}. Best is trial 52 with value: 2182.908535006516.[0m
[32m[I 2024-10-13 09:38:14,104][0m Trial 249 finished with value: 2224.147423300677 and parameters: {'depth': 10, 'learning_rate': 0.0013070712109267632, 'iterations': 1668, 'l2_leaf_reg': 8.264410434326407e-07, 'border_count': 39, 'bagging_temperature': 0.11402278516544027, 'random_strength': 1.5070424709921941, 'grow_policy': 'Depthwise', 'min_data_in_leaf': 281}. Best is trial 52 with value: 2182.908535006516.[0m
[32m[I 2024-10-13 09:38:16,686][0m Trial 250 finished with value: 2345.774718971806 and parameters: {'depth': 10, 'learning_rate': 0.0007003658265283408, 'iterations': 1681, 'l2_leaf_reg': 7.997616285648805e-07, 'border_count': 34, 'bagging_temperature': 0.10093229703462117, 'random_strength': 1.4624129829031458, 'grow_policy': 'Depthwise', 'min_data_in_leaf': 286}. Best is trial 52 with value: 2182.908535006516.[0m
[32m[I 2024-10-13 09:38:19,259][0m Trial 251 finished with value: 2207.7901631487307 and parameters: {'depth': 10, 'learning_rate': 0.001198232813113241, 'iterations': 1756, 'l2_leaf_reg': 5.43599918534503e-07, 'border_count': 36, 'bagging_temperature': 0.1054333654395322, 'random_strength': 1.3128040979639857, 'grow_policy': 'Depthwise', 'min_data_in_leaf': 315}. Best is trial 52 with value: 2182.908535006516.[0m
[32m[I 2024-10-13 09:38:23,091][0m Trial 252 finished with value: 2204.700829808331 and parameters: {'depth': 10, 'learning_rate': 0.0011849627113274506, 'iterations': 1741, 'l2_leaf_reg': 5.952928204581324e-07, 'border_count': 38, 'bagging_temperature': 0.10705551711806674, 'random_strength': 1.1676792915807503, 'grow_policy': 'Depthwise', 'min_data_in_leaf': 315}. Best is trial 52 with value: 2182.908535006516.[0m
[32m[I 2024-10-13 09:38:26,534][0m Trial 253 finished with value: 2209.6875320917034 and parameters: {'depth': 10, 'learning_rate': 0.0011962941705864196, 'iterations': 1755, 'l2_leaf_reg': 3.811550702111876e-07, 'border_count': 38, 'bagging_temperature': 0.1266804366117703, 'random_strength': 1.1470779793231558, 'grow_policy': 'Depthwise', 'min_data_in_leaf': 317}. Best is trial 52 with value: 2182.908535006516.[0m
