[32m[I 2024-10-13 11:16:16,370][0m Trial 969 finished with value: 2168.322902470173 and parameters: {'depth': 10, 'learning_rate': 0.000507311356460492, 'iterations': 2635, 'l2_leaf_reg': 6.272310423275021e-08, 'border_count': 35, 'bagging_temperature': 0.04792283950709089, 'random_strength': 2.5025698703839585, 'grow_policy': 'Depthwise', 'min_data_in_leaf': 73}. Best is trial 814 with value: 2060.357404924192.[0m
[32m[I 2024-10-13 11:16:21,928][0m Trial 970 finished with value: 2338.2195970138537 and parameters: {'depth': 11, 'learning_rate': 0.0006382155137583201, 'iterations': 2721, 'l2_leaf_reg': 2.6832811714070644e-08, 'border_count': 22, 'bagging_temperature': 0.036364927421833566, 'random_strength': 2.2850420595681276, 'grow_policy': 'Depthwise', 'min_data_in_leaf': 18}. Best is trial 814 with value: 2060.357404924192.[0m
[32m[I 2024-10-13 11:16:25,725][0m Trial 971 finished with value: 2268.187151076565 and parameters: {'depth': 9, 'learning_rate': 0.0005478037655166784, 'iterations': 2901, 'l2_leaf_reg': 1.3879604945455312e-05, 'border_count': 80, 'bagging_temperature': 0.0761484567320212, 'random_strength': 1.711320248565242, 'grow_policy': 'Depthwise', 'min_data_in_leaf': 52}. Best is trial 814 with value: 2060.357404924192.[0m
[32m[I 2024-10-13 11:16:26,682][0m Trial 972 finished with value: 4308.699711204271 and parameters: {'depth': 11, 'learning_rate': 0.0004512739852571837, 'iterations': 350, 'l2_leaf_reg': 1.2601338903535768e-07, 'border_count': 12, 'bagging_temperature': 0.017625256158930347, 'random_strength': 2.6693899693127636, 'grow_policy': 'Lossguide', 'min_data_in_leaf': 37, 'max_leaves': 184}. Best is trial 814 with value: 2060.357404924192.[0m
[32m[I 2024-10-13 11:16:32,854][0m Trial 973 finished with value: 2503.8170826321507 and parameters: {'depth': 11, 'learning_rate': 0.0010058043634866942, 'iterations': 2848, 'l2_leaf_reg': 2.027396646469185e-08, 'border_count': 28, 'bagging_temperature': 0.06106643671131476, 'random_strength': 2.151605319174361, 'grow_policy': 'Depthwise', 'min_data_in_leaf': 18}. Best is trial 814 with value: 2060.357404924192.[0m
[32m[I 2024-10-13 11:16:46,247][0m Trial 974 finished with value: 2670.7064429603847 and parameters: {'depth': 11, 'learning_rate': 0.0007380290704934684, 'iterations': 2763, 'l2_leaf_reg': 4.2081628613510794e-08, 'border_count': 18, 'bagging_temperature': 0.11417919573583503, 'random_strength': 1.8664333967213365, 'grow_policy': 'Depthwise', 'min_data_in_leaf': 1}. Best is trial 814 with value: 2060.357404924192.[0m
[32m[I 2024-10-13 11:16:49,706][0m Trial 975 finished with value: 2225.3512790401655 and parameters: {'depth': 10, 'learning_rate': 0.00037268212116071383, 'iterations': 2940, 'l2_leaf_reg': 1.4719428596060379e-08, 'border_count': 23, 'bagging_temperature': 0.03554217074761212, 'random_strength': 2.243490135742508, 'grow_policy': 'Depthwise', 'min_data_in_leaf': 71}. Best is trial 814 with value: 2060.357404924192.[0m
[32m[I 2024-10-13 11:16:53,469][0m Trial 976 finished with value: 2775.9848957710346 and parameters: {'depth': 10, 'learning_rate': 0.0006045275158430302, 'iterations': 2801, 'l2_leaf_reg': 7.928444250922604e-08, 'border_count': 7, 'bagging_temperature': 0.01872053409171767, 'random_strength': 2.8231954210585295, 'grow_policy': 'Depthwise', 'min_data_in_leaf': 48}. Best is trial 814 with value: 2060.357404924192.[0m
[32m[I 2024-10-13 11:16:58,626][0m Trial 977 finished with value: 2305.7172689318168 and parameters: {'depth': 11, 'learning_rate': 0.0005061612428171881, 'iterations': 2868, 'l2_leaf_reg': 1.8941313886719741e-07, 'border_count': 142, 'bagging_temperature': 0.08909103155781438, 'random_strength': 1.9870560035481752, 'grow_policy': 'Depthwise', 'min_data_in_leaf': 30}. Best is trial 814 with value: 2060.357404924192.[0m
[32m[I 2024-10-13 11:17:04,158][0m Trial 978 finished with value: 2503.0978764581555 and parameters: {'depth': 8, 'learning_rate': 0.0008691785356637739, 'iterations': 2715, 'l2_leaf_reg': 3.086249261472816e-08, 'border_count': 14, 'bagging_temperature': 0.049903137869638806, 'random_strength': 1.6078906698027824, 'grow_policy': 'Depthwise', 'min_data_in_leaf': 19}. Best is trial 814 with value: 2060.357404924192.[0m
[32m[I 2024-10-13 11:17:07,621][0m Trial 979 finished with value: 2243.30812160394 and parameters: {'depth': 11, 'learning_rate': 0.0004226279746038595, 'iterations': 2607, 'l2_leaf_reg': 1.9763450242834517e-08, 'border_count': 33, 'bagging_temperature': 0.06774868152003224, 'random_strength': 2.495994347634488, 'grow_policy': 'Depthwise', 'min_data_in_leaf': 53}. Best is trial 814 with value: 2060.357404924192.[0m
[32m[I 2024-10-13 11:17:21,232][0m Trial 980 finished with value: 2589.005393770933 and parameters: {'depth': 10, 'learning_rate': 0.0006564525928903297, 'iterations': 2997, 'l2_leaf_reg': 5.121087414986225e-08, 'border_count': 20, 'bagging_temperature': 0.0004509448987132028, 'random_strength': 9.680609415146701, 'grow_policy': 'Depthwise', 'min_data_in_leaf': 1}. Best is trial 814 with value: 2060.357404924192.[0m
[32m[I 2024-10-13 11:17:23,830][0m Trial 981 finished with value: 3797.67356860906 and parameters: {'depth': 11, 'learning_rate': 0.0005501199164314099, 'iterations': 2895, 'l2_leaf_reg': 2.966129008924726e-08, 'border_count': 1, 'bagging_temperature': 0.02975977561286039, 'random_strength': 0.9647658085405864, 'grow_policy': 'Depthwise', 'min_data_in_leaf': 414}. Best is trial 814 with value: 2060.357404924192.[0m
[32m[I 2024-10-13 11:17:28,299][0m Trial 982 finished with value: 2188.7840507879678 and parameters: {'depth': 9, 'learning_rate': 0.0004828549266074949, 'iterations': 2804, 'l2_leaf_reg': 1.5853335968611488e-08, 'border_count': 27, 'bagging_temperature': 0.14665826134750803, 'random_strength': 1.4052813898829908, 'grow_policy': 'Depthwise', 'min_data_in_leaf': 33}. Best is trial 814 with value: 2060.357404924192.[0m
[32m[I 2024-10-13 11:17:31,562][0m Trial 983 finished with value: 2968.187441186299 and parameters: {'depth': 11, 'learning_rate': 0.0003300080469144055, 'iterations': 2670, 'l2_leaf_reg': 0.04077140207294421, 'border_count': 11, 'bagging_temperature': 0.047859014339229795, 'random_strength': 1.7267907790970862, 'grow_policy': 'Depthwise', 'min_data_in_leaf': 62}. Best is trial 814 with value: 2060.357404924192.[0m
[32m[I 2024-10-13 11:17:36,252][0m Trial 984 finished with value: 2225.578649615242 and parameters: {'depth': 10, 'learning_rate': 0.0006931933751933941, 'iterations': 2953, 'l2_leaf_reg': 2.5211628486091785e-08, 'border_count': 16, 'bagging_temperature': 0.01911264896749933, 'random_strength': 1.9963151314127905, 'grow_policy': 'Depthwise', 'min_data_in_leaf': 34}. Best is trial 814 with value: 2060.357404924192.[0m
[32m[I 2024-10-13 11:17:41,752][0m Trial 985 finished with value: 2487.738924675712 and parameters: {'depth': 11, 'learning_rate': 0.00041802746282224826, 'iterations': 2756, 'l2_leaf_reg': 1.0263392025941692e-08, 'border_count': 23, 'bagging_temperature': 0.862173438919535, 'random_strength': 2.376947037411349, 'grow_policy': 'Depthwise', 'min_data_in_leaf': 19}. Best is trial 814 with value: 2060.357404924192.[0m
[32m[I 2024-10-13 11:17:44,810][0m Trial 986 finished with value: 2171.936239738465 and parameters: {'depth': 10, 'learning_rate': 0.0005845499471180839, 'iterations': 2848, 'l2_leaf_reg': 4.1798210366236005e-08, 'border_count': 38, 'bagging_temperature': 0.074450441533993, 'random_strength': 2.1450037031795577, 'grow_policy': 'Depthwise', 'min_data_in_leaf': 76}. Best is trial 814 with value: 2060.357404924192.[0m
[32m[I 2024-10-13 11:17:48,829][0m Trial 987 finished with value: 2486.3683618841364 and parameters: {'depth': 11, 'learning_rate': 0.1224478547519557, 'iterations': 2901, 'l2_leaf_reg': 1.806171583819081e-08, 'border_count': 30, 'bagging_temperature': 0.03684647335819473, 'random_strength': 3.03843737593501, 'grow_policy': 'Depthwise', 'min_data_in_leaf': 50}. Best is trial 814 with value: 2060.357404924192.[0m
[32m[I 2024-10-13 11:18:11,885][0m Trial 988 finished with value: 2578.7358885791436 and parameters: {'depth': 9, 'learning_rate': 0.0005121690308005685, 'iterations': 2830, 'l2_leaf_reg': 8.472564258854925e-08, 'border_count': 18, 'bagging_temperature': 0.015635019424270702, 'random_strength': 2.55462448246696, 'grow_policy': 'SymmetricTree', 'min_data_in_leaf': 16}. Best is trial 814 with value: 2060.357404924192.[0m
[32m[I 2024-10-13 11:18:24,983][0m Trial 989 finished with value: 3386.7133473623635 and parameters: {'depth': 11, 'learning_rate': 0.0007894155250800555, 'iterations': 2741, 'l2_leaf_reg': 5.945367428471713e-08, 'border_count': 9, 'bagging_temperature': 0.00029940581819512535, 'random_strength': 3.9791404788358222, 'grow_policy': 'Depthwise', 'min_data_in_leaf': 1}. Best is trial 814 with value: 2060.357404924192.[0m
[32m[I 2024-10-13 11:18:29,088][0m Trial 990 finished with value: 2248.6507493361837 and parameters: {'depth': 11, 'learning_rate': 0.00037532862199519067, 'iterations': 2917, 'l2_leaf_reg': 3.574782539583475e-08, 'border_count': 24, 'bagging_temperature': 0.09131066134859979, 'random_strength': 2.247325355813702, 'grow_policy': 'Depthwise', 'min_data_in_leaf': 37}. Best is trial 814 with value: 2060.357404924192.[0m
[32m[I 2024-10-13 11:18:31,894][0m Trial 991 finished with value: 2245.1600597089787 and parameters: {'depth': 10, 'learning_rate': 0.00046651224727985727, 'iterations': 2997, 'l2_leaf_reg': 1.8332981674782425e-08, 'border_count': 15, 'bagging_temperature': 0.05534574245358081, 'random_strength': 2.7182018862905104, 'grow_policy': 'Depthwise', 'min_data_in_leaf': 569}. Best is trial 814 with value: 2060.357404924192.[0m
[32m[I 2024-10-13 11:18:35,460][0m Trial 992 finished with value: 2171.887196554104 and parameters: {'depth': 11, 'learning_rate': 0.0005950360531413151, 'iterations': 2677, 'l2_leaf_reg': 1.3833783354238667e-08, 'border_count': 32, 'bagging_temperature': 0.03455509676325745, 'random_strength': 1.8594550742762483, 'grow_policy': 'Depthwise', 'min_data_in_leaf': 57}. Best is trial 814 with value: 2060.357404924192.[0m
[32m[I 2024-10-13 11:18:40,117][0m Trial 993 finished with value: 2148.556828471388 and parameters: {'depth': 11, 'learning_rate': 0.0006702034646661981, 'iterations': 2784, 'l2_leaf_reg': 2.75613479955607e-08, 'border_count': 21, 'bagging_temperature': 0.06471887267126675, 'random_strength': 5.363291955259203, 'grow_policy': 'Depthwise', 'min_data_in_leaf': 31}. Best is trial 814 with value: 2060.357404924192.[0m
[32m[I 2024-10-13 11:18:46,895][0m Trial 994 finished with value: 2348.5630854626934 and parameters: {'depth': 11, 'learning_rate': 0.0008810190980173696, 'iterations': 2662, 'l2_leaf_reg': 2.4489243389496752e-08, 'border_count': 177, 'bagging_temperature': 0.3936072339447433, 'random_strength': 5.308606156858124, 'grow_policy': 'Lossguide', 'min_data_in_leaf': 17, 'max_leaves': 195}. Best is trial 814 with value: 2060.357404924192.[0m
[32m[I 2024-10-13 11:18:49,703][0m Trial 995 finished with value: 2188.1489098405777 and parameters: {'depth': 11, 'learning_rate': 0.000712256802960757, 'iterations': 2554, 'l2_leaf_reg': 1.4402472261026168e-08, 'border_count': 26, 'bagging_temperature': 0.07716133291553243, 'random_strength': 1.2329981510782067, 'grow_policy': 'Depthwise', 'min_data_in_leaf': 77}. Best is trial 814 with value: 2060.357404924192.[0m
[32m[I 2024-10-13 11:18:54,216][0m Trial 996 finished with value: 2214.60159474556 and parameters: {'depth': 11, 'learning_rate': 0.0007997774633655411, 'iterations': 2719, 'l2_leaf_reg': 2.7901056343714807e-08, 'border_count': 35, 'bagging_temperature': 0.13009949472998253, 'random_strength': 5.354567187602955, 'grow_policy': 'Depthwise', 'min_data_in_leaf': 39}. Best is trial 814 with value: 2060.357404924192.[0m
[32m[I 2024-10-13 11:18:55,384][0m Trial 997 finished with value: 3625.907428155371 and parameters: {'depth': 11, 'learning_rate': 0.0005324647924880889, 'iterations': 565, 'l2_leaf_reg': 1.91133155776939e-08, 'border_count': 28, 'bagging_temperature': 0.10466014391147765, 'random_strength': 1.4977476069484674, 'grow_policy': 'Depthwise', 'min_data_in_leaf': 52}. Best is trial 814 with value: 2060.357404924192.[0m
[32m[I 2024-10-13 11:19:01,187][0m Trial 998 finished with value: 2358.795841711356 and parameters: {'depth': 11, 'learning_rate': 0.0006511537154444151, 'iterations': 2772, 'l2_leaf_reg': 2.592928533278052e-08, 'border_count': 217, 'bagging_temperature': 0.09299447627265485, 'random_strength': 5.249771185101216, 'grow_policy': 'Depthwise', 'min_data_in_leaf': 20}. Best is trial 814 with value: 2060.357404924192.[0m
[32m[I 2024-10-13 11:19:05,311][0m Trial 999 finished with value: 2393.895148075367 and parameters: {'depth': 11, 'learning_rate': 0.0003168159390892729, 'iterations': 2785, 'l2_leaf_reg': 1.4225784869644125e-08, 'border_count': 23, 'bagging_temperature': 0.06565192890265356, 'random_strength': 5.82408940361481, 'grow_policy': 'Depthwise', 'min_data_in_leaf': 34}. Best is trial 814 with value: 2060.357404924192.[0m
CatBoost: RMSE = 2060.3574
      Model         RMSE
0  CatBoost  2060.357405

Best hyperparameters for CatBoost:
{'depth': 10, 'learning_rate': 0.0005223469739458939, 'iterations': 2903, 'l2_leaf_reg': 1.352409718656662e-07, 'border_count': 33, 'bagging_temperature': 0.04071483786461014, 'random_strength': 1.7488754021349995, 'grow_policy': 'Depthwise', 'min_data_in_leaf': 21}
