[32m[I 2024-10-13 11:08:41,025][0m Trial 918 finished with value: 2798.2298200338187 and parameters: {'depth': 9, 'learning_rate': 0.0005161510697899951, 'iterations': 2890, 'l2_leaf_reg': 5.502305759633831e-06, 'border_count': 11, 'bagging_temperature': 0.03400253128366113, 'random_strength': 0.7396009730334977, 'grow_policy': 'Depthwise', 'min_data_in_leaf': 35}. Best is trial 814 with value: 2060.357404924192.[0m
[32m[I 2024-10-13 11:08:46,701][0m Trial 919 finished with value: 2419.225350618339 and parameters: {'depth': 10, 'learning_rate': 0.0006273367690887341, 'iterations': 2750, 'l2_leaf_reg': 1.8436154003681553e-08, 'border_count': 27, 'bagging_temperature': 0.09886980402762088, 'random_strength': 1.7671766735810968, 'grow_policy': 'Depthwise', 'min_data_in_leaf': 18}. Best is trial 814 with value: 2060.357404924192.[0m
[32m[I 2024-10-13 11:08:59,290][0m Trial 920 finished with value: 2900.570534007914 and parameters: {'depth': 10, 'learning_rate': 0.00044717002469433354, 'iterations': 2822, 'l2_leaf_reg': 4.270257169221978e-08, 'border_count': 21, 'bagging_temperature': 5.2350326286460685e-05, 'random_strength': 4.501442310262629, 'grow_policy': 'Depthwise', 'min_data_in_leaf': 1}. Best is trial 814 with value: 2060.357404924192.[0m
[32m[I 2024-10-13 11:10:21,806][0m Trial 921 finished with value: 3159.872101004478 and parameters: {'depth': 12, 'learning_rate': 0.00023900521285152057, 'iterations': 2954, 'l2_leaf_reg': 2.7053275195325042e-08, 'border_count': 49, 'bagging_temperature': 2.0507018682867006e-05, 'random_strength': 2.004996208770576, 'grow_policy': 'SymmetricTree', 'min_data_in_leaf': 48}. Best is trial 814 with value: 2060.357404924192.[0m
[32m[I 2024-10-13 11:10:26,416][0m Trial 922 finished with value: 2257.8815931070253 and parameters: {'depth': 9, 'learning_rate': 0.0003798204807405613, 'iterations': 2903, 'l2_leaf_reg': 1.5581392967702904e-08, 'border_count': 13, 'bagging_temperature': 0.060742159325936046, 'random_strength': 7.524022517900884, 'grow_policy': 'Depthwise', 'min_data_in_leaf': 30}. Best is trial 814 with value: 2060.357404924192.[0m
[32m[I 2024-10-13 11:10:29,893][0m Trial 923 finished with value: 2234.8242308869744 and parameters: {'depth': 11, 'learning_rate': 0.0007078579381085655, 'iterations': 2766, 'l2_leaf_reg': 7.040913928085754e-08, 'border_count': 32, 'bagging_temperature': 0.03496531778075779, 'random_strength': 2.1325928691631946, 'grow_policy': 'Depthwise', 'min_data_in_leaf': 66}. Best is trial 814 with value: 2060.357404924192.[0m
[32m[I 2024-10-13 11:10:36,019][0m Trial 924 finished with value: 2389.600472041102 and parameters: {'depth': 10, 'learning_rate': 0.0005540317705321667, 'iterations': 2848, 'l2_leaf_reg': 3.561456708895364e-08, 'border_count': 17, 'bagging_temperature': 0.0831902195851455, 'random_strength': 1.4554173980539495, 'grow_policy': 'Depthwise', 'min_data_in_leaf': 16}. Best is trial 814 with value: 2060.357404924192.[0m
[32m[I 2024-10-13 11:10:40,264][0m Trial 925 finished with value: 2773.3145683981575 and parameters: {'depth': 12, 'learning_rate': 0.0005091574458949732, 'iterations': 2946, 'l2_leaf_reg': 2.0485336709576013e-08, 'border_count': 5, 'bagging_temperature': 0.05061482778885033, 'random_strength': 3.2471083573823583, 'grow_policy': 'Depthwise', 'min_data_in_leaf': 45}. Best is trial 814 with value: 2060.357404924192.[0m
[32m[I 2024-10-13 11:10:51,844][0m Trial 926 finished with value: 2779.723106492336 and parameters: {'depth': 11, 'learning_rate': 0.0003151452289108877, 'iterations': 2706, 'l2_leaf_reg': 1.4062013628249147e-08, 'border_count': 23, 'bagging_temperature': 0.9886300498109304, 'random_strength': 1.8230997913542422, 'grow_policy': 'Depthwise', 'min_data_in_leaf': 2}. Best is trial 814 with value: 2060.357404924192.[0m
[32m[I 2024-10-13 11:10:55,662][0m Trial 927 finished with value: 2920.858591994464 and parameters: {'depth': 10, 'learning_rate': 0.0004580080974167669, 'iterations': 2339, 'l2_leaf_reg': 2.494771072132576e-08, 'border_count': 9, 'bagging_temperature': 0.02099145442784297, 'random_strength': 0.6822091118225431, 'grow_policy': 'Depthwise', 'min_data_in_leaf': 31}. Best is trial 814 with value: 2060.357404924192.[0m
[32m[I 2024-10-13 11:10:59,536][0m Trial 928 finished with value: 2285.757848843785 and parameters: {'depth': 10, 'learning_rate': 0.0009433334848418705, 'iterations': 2795, 'l2_leaf_reg': 4.619912972621044e-08, 'border_count': 28, 'bagging_temperature': 0.016005200378919032, 'random_strength': 1.988452005058726, 'grow_policy': 'Lossguide', 'min_data_in_leaf': 49, 'max_leaves': 217}. Best is trial 814 with value: 2060.357404924192.[0m
[32m[I 2024-10-13 11:11:05,334][0m Trial 929 finished with value: 2411.4645144548213 and parameters: {'depth': 11, 'learning_rate': 0.0006193970459299182, 'iterations': 2996, 'l2_leaf_reg': 1.0031291233011894e-08, 'border_count': 15, 'bagging_temperature': 0.06890327982400701, 'random_strength': 1.6264381001477606, 'grow_policy': 'Depthwise', 'min_data_in_leaf': 20}. Best is trial 814 with value: 2060.357404924192.[0m
[32m[I 2024-10-13 11:11:08,731][0m Trial 930 finished with value: 2316.8738650572877 and parameters: {'depth': 11, 'learning_rate': 0.00038545024290159214, 'iterations': 2854, 'l2_leaf_reg': 8.147020622574842e-08, 'border_count': 41, 'bagging_temperature': 0.04502148058189308, 'random_strength': 1.324471047335161, 'grow_policy': 'Depthwise', 'min_data_in_leaf': 67}. Best is trial 814 with value: 2060.357404924192.[0m
[32m[I 2024-10-13 11:11:23,951][0m Trial 931 finished with value: 2627.0630802865644 and parameters: {'depth': 12, 'learning_rate': 0.0007635064819033404, 'iterations': 2919, 'l2_leaf_reg': 0.000712508950443144, 'border_count': 21, 'bagging_temperature': 0.0002708201771557549, 'random_strength': 2.1545791746990277, 'grow_policy': 'Depthwise', 'min_data_in_leaf': 1}. Best is trial 814 with value: 2060.357404924192.[0m
[32m[I 2024-10-13 11:11:28,674][0m Trial 932 finished with value: 2342.0621919814193 and parameters: {'depth': 11, 'learning_rate': 0.0005690164549637333, 'iterations': 2734, 'l2_leaf_reg': 3.1729876790936536e-08, 'border_count': 129, 'bagging_temperature': 0.031099737620980193, 'random_strength': 1.8285024781252455, 'grow_policy': 'Depthwise', 'min_data_in_leaf': 35}. Best is trial 814 with value: 2060.357404924192.[0m
[32m[I 2024-10-13 11:11:32,569][0m Trial 933 finished with value: 2191.033789047365 and parameters: {'depth': 10, 'learning_rate': 0.0004498817923799683, 'iterations': 2870, 'l2_leaf_reg': 2.0869709591163297e-08, 'border_count': 36, 'bagging_temperature': 0.08882487205834289, 'random_strength': 4.25886117639839, 'grow_policy': 'Depthwise', 'min_data_in_leaf': 45}. Best is trial 814 with value: 2060.357404924192.[0m
[32m[I 2024-10-13 11:11:44,061][0m Trial 934 finished with value: 2699.7528343349545 and parameters: {'depth': 9, 'learning_rate': 0.0006752449681938346, 'iterations': 2794, 'l2_leaf_reg': 1.4617148623716835e-08, 'border_count': 18, 'bagging_temperature': 0.13066662832272025, 'random_strength': 2.0581039840830115, 'grow_policy': 'Depthwise', 'min_data_in_leaf': 1}. Best is trial 814 with value: 2060.357404924192.[0m
[32m[I 2024-10-13 11:11:49,470][0m Trial 935 finished with value: 2186.7508043678517 and parameters: {'depth': 12, 'learning_rate': 0.0003489166837601275, 'iterations': 2999, 'l2_leaf_reg': 5.121190256309117e-08, 'border_count': 24, 'bagging_temperature': 0.06098603542038175, 'random_strength': 8.155913364324988, 'grow_policy': 'Depthwise', 'min_data_in_leaf': 24}. Best is trial 814 with value: 2060.357404924192.[0m
[32m[I 2024-10-13 11:11:52,908][0m Trial 936 finished with value: 2861.9690500300458 and parameters: {'depth': 11, 'learning_rate': 0.0005117905401283592, 'iterations': 2897, 'l2_leaf_reg': 3.346763851013781e-08, 'border_count': 9, 'bagging_temperature': 0.019941377697311916, 'random_strength': 2.2065574335854374, 'grow_policy': 'Depthwise', 'min_data_in_leaf': 65}. Best is trial 814 with value: 2060.357404924192.[0m
[32m[I 2024-10-13 11:11:58,264][0m Trial 937 finished with value: 2069.4308871093326 and parameters: {'depth': 11, 'learning_rate': 0.0005998040537045294, 'iterations': 2649, 'l2_leaf_reg': 2.00926970491291e-08, 'border_count': 30, 'bagging_temperature': 0.04708990491320981, 'random_strength': 3.0475932203497837, 'grow_policy': 'Depthwise', 'min_data_in_leaf': 21}. Best is trial 814 with value: 2060.357404924192.[0m
[32m[I 2024-10-13 11:12:11,334][0m Trial 938 finished with value: 3028.824034514985 and parameters: {'depth': 11, 'learning_rate': 0.0004317438677503654, 'iterations': 2671, 'l2_leaf_reg': 1.4722593905832444e-08, 'border_count': 35, 'bagging_temperature': 0.07749469181514615, 'random_strength': 3.0997894665506562, 'grow_policy': 'Depthwise', 'min_data_in_leaf': 1}. Best is trial 814 with value: 2060.357404924192.[0m
[32m[I 2024-10-13 11:12:16,927][0m Trial 939 finished with value: 2430.238190935657 and parameters: {'depth': 11, 'learning_rate': 0.0005435570651750457, 'iterations': 2742, 'l2_leaf_reg': 2.061397640378626e-08, 'border_count': 34, 'bagging_temperature': 0.1049214791901443, 'random_strength': 2.7795991087978393, 'grow_policy': 'Depthwise', 'min_data_in_leaf': 19}. Best is trial 814 with value: 2060.357404924192.[0m
[32m[I 2024-10-13 11:12:20,718][0m Trial 940 finished with value: 2264.199486516361 and parameters: {'depth': 11, 'learning_rate': 0.00047531630812830275, 'iterations': 2814, 'l2_leaf_reg': 1.4101798247736831e-08, 'border_count': 45, 'bagging_temperature': 0.0704583083139216, 'random_strength': 3.0739542165296796, 'grow_policy': 'Depthwise', 'min_data_in_leaf': 49}. Best is trial 814 with value: 2060.357404924192.[0m
[32m[I 2024-10-13 11:12:25,990][0m Trial 941 finished with value: 2963.213950714954 and parameters: {'depth': 11, 'learning_rate': 0.0002976382873133401, 'iterations': 2685, 'l2_leaf_reg': 1.915858606934929e-08, 'border_count': 30, 'bagging_temperature': 0.057606777326654264, 'random_strength': 3.372160567592976, 'grow_policy': 'Depthwise', 'min_data_in_leaf': 19}. Best is trial 814 with value: 2060.357404924192.[0m
[32m[I 2024-10-13 11:12:30,987][0m Trial 942 finished with value: 2339.96100914052 and parameters: {'depth': 11, 'learning_rate': 0.0008144532989921022, 'iterations': 2757, 'l2_leaf_reg': 1.3963119345878285e-08, 'border_count': 42, 'bagging_temperature': 0.0972707642383996, 'random_strength': 3.5315784109783492, 'grow_policy': 'Depthwise', 'min_data_in_leaf': 35}. Best is trial 814 with value: 2060.357404924192.[0m
[32m[I 2024-10-13 11:12:34,793][0m Trial 943 finished with value: 2256.3421162572313 and parameters: {'depth': 11, 'learning_rate': 0.00037240322063996544, 'iterations': 2844, 'l2_leaf_reg': 2.4488352641996943e-08, 'border_count': 31, 'bagging_temperature': 0.050520162321824866, 'random_strength': 3.285694311423398, 'grow_policy': 'Depthwise', 'min_data_in_leaf': 52}. Best is trial 814 with value: 2060.357404924192.[0m
[32m[I 2024-10-13 11:13:33,653][0m Trial 944 finished with value: 2457.491395625924 and parameters: {'depth': 11, 'learning_rate': 0.000655183027258522, 'iterations': 2935, 'l2_leaf_reg': 1.0138712010609043e-08, 'border_count': 37, 'bagging_temperature': 0.07783946847939194, 'random_strength': 2.984649196656398, 'grow_policy': 'SymmetricTree', 'min_data_in_leaf': 21}. Best is trial 814 with value: 2060.357404924192.[0m
[32m[I 2024-10-13 11:13:37,041][0m Trial 945 finished with value: 2172.5227366628883 and parameters: {'depth': 10, 'learning_rate': 0.0005591487867246678, 'iterations': 2803, 'l2_leaf_reg': 2.0664595754739245e-08, 'border_count': 29, 'bagging_temperature': 0.045030815567859594, 'random_strength': 3.040371440961721, 'grow_policy': 'Depthwise', 'min_data_in_leaf': 69}. Best is trial 814 with value: 2060.357404924192.[0m
[32m[I 2024-10-13 11:13:49,999][0m Trial 946 finished with value: 3079.6621833014988 and parameters: {'depth': 11, 'learning_rate': 0.00042594364499356943, 'iterations': 2656, 'l2_leaf_reg': 2.8012123502481506e-08, 'border_count': 26, 'bagging_temperature': 0.057604414907109845, 'random_strength': 2.9538156697812434, 'grow_policy': 'Depthwise', 'min_data_in_leaf': 1}. Best is trial 814 with value: 2060.357404924192.[0m
[32m[I 2024-10-13 11:13:54,971][0m Trial 947 finished with value: 2160.590010018374 and parameters: {'depth': 10, 'learning_rate': 0.0004918067268460852, 'iterations': 2881, 'l2_leaf_reg': 1.5377882234496604e-08, 'border_count': 30, 'bagging_temperature': 0.11811418250869624, 'random_strength': 2.884859139139751, 'grow_policy': 'Depthwise', 'min_data_in_leaf': 28}. Best is trial 814 with value: 2060.357404924192.[0m
[32m[I 2024-10-13 11:13:58,974][0m Trial 948 finished with value: 2201.993345066462 and parameters: {'depth': 11, 'learning_rate': 0.0006947327130463684, 'iterations': 2733, 'l2_leaf_reg': 2.0263258023678813e-08, 'border_count': 26, 'bagging_temperature': 0.08676670652928241, 'random_strength': 2.8066766959528566, 'grow_policy': 'Depthwise', 'min_data_in_leaf': 46}. Best is trial 814 with value: 2060.357404924192.[0m
[32m[I 2024-10-13 11:14:05,462][0m Trial 949 finished with value: 2405.181915442387 and parameters: {'depth': 11, 'learning_rate': 0.0005596268241609063, 'iterations': 2956, 'l2_leaf_reg': 3.0727858254646794e-08, 'border_count': 165, 'bagging_temperature': 0.04018569915465421, 'random_strength': 3.1742963930102586, 'grow_policy': 'Depthwise', 'min_data_in_leaf': 19}. Best is trial 814 with value: 2060.357404924192.[0m
[32m[I 2024-10-13 11:14:09,735][0m Trial 950 finished with value: 2204.0833747946785 and parameters: {'depth': 11, 'learning_rate': 0.00043084747358342507, 'iterations': 2843, 'l2_leaf_reg': 2.5289991178545715e-05, 'border_count': 39, 'bagging_temperature': 0.07232264310746375, 'random_strength': 2.6933832417777914, 'grow_policy': 'Depthwise', 'min_data_in_leaf': 39}. Best is trial 814 with value: 2060.357404924192.[0m
[32m[I 2024-10-13 11:14:12,988][0m Trial 951 finished with value: 2292.9324677541326 and parameters: {'depth': 10, 'learning_rate': 0.0009047288247823394, 'iterations': 2784, 'l2_leaf_reg': 1.5710820564236836e-08, 'border_count': 33, 'bagging_temperature': 0.040291224284273106, 'random_strength': 2.8679868154788317, 'grow_policy': 'Lossguide', 'min_data_in_leaf': 67, 'max_leaves': 32}. Best is trial 814 with value: 2060.357404924192.[0m
[32m[I 2024-10-13 11:14:27,294][0m Trial 952 finished with value: 2874.972799315669 and parameters: {'depth': 11, 'learning_rate': 0.0006048196723672394, 'iterations': 2888, 'l2_leaf_reg': 1.0262872022746237e-08, 'border_count': 25, 'bagging_temperature': 0.05532299746267376, 'random_strength': 3.4661286659099138, 'grow_policy': 'Depthwise', 'min_data_in_leaf': 1}. Best is trial 814 with value: 2060.357404924192.[0m
[32m[I 2024-10-13 11:14:31,428][0m Trial 953 finished with value: 2308.2010547522204 and parameters: {'depth': 10, 'learning_rate': 0.00035572178570289763, 'iterations': 2708, 'l2_leaf_reg': 2.6900573371878728e-08, 'border_count': 21, 'bagging_temperature': 0.03495546137186182, 'random_strength': 2.5575810493897304, 'grow_policy': 'Depthwise', 'min_data_in_leaf': 33}. Best is trial 814 with value: 2060.357404924192.[0m
[32m[I 2024-10-13 11:14:35,175][0m Trial 954 finished with value: 2375.3120162642344 and parameters: {'depth': 9, 'learning_rate': 0.0020252753931532465, 'iterations': 2635, 'l2_leaf_reg': 4.038988373116297e-08, 'border_count': 33, 'bagging_temperature': 0.34591827227670396, 'random_strength': 1.433338362334666, 'grow_policy': 'Depthwise', 'min_data_in_leaf': 55}. Best is trial 814 with value: 2060.357404924192.[0m
[32m[I 2024-10-13 11:14:41,272][0m Trial 955 finished with value: 2354.612562970517 and parameters: {'depth': 8, 'learning_rate': 0.0007308500069777193, 'iterations': 2935, 'l2_leaf_reg': 1.3945892129188901e-08, 'border_count': 25, 'bagging_temperature': 0.27508124014632246, 'random_strength': 1.1179222077319875, 'grow_policy': 'Depthwise', 'min_data_in_leaf': 18}. Best is trial 814 with value: 2060.357404924192.[0m
[32m[I 2024-10-13 11:14:45,009][0m Trial 956 finished with value: 2171.642612983721 and parameters: {'depth': 11, 'learning_rate': 0.0004824948150821998, 'iterations': 2820, 'l2_leaf_reg': 2.063766875557975e-08, 'border_count': 21, 'bagging_temperature': 0.09004534382928539, 'random_strength': 2.5042228797966017, 'grow_policy': 'Depthwise', 'min_data_in_leaf': 44}. Best is trial 814 with value: 2060.357404924192.[0m
[32m[I 2024-10-13 11:14:50,691][0m Trial 957 finished with value: 2381.643858789662 and parameters: {'depth': 11, 'learning_rate': 0.0005839688021845793, 'iterations': 2760, 'l2_leaf_reg': 2.999030851856462e-08, 'border_count': 29, 'bagging_temperature': 0.06890006980491457, 'random_strength': 2.738995876880811, 'grow_policy': 'Depthwise', 'min_data_in_leaf': 19}. Best is trial 814 with value: 2060.357404924192.[0m
[32m[I 2024-10-13 11:14:54,159][0m Trial 958 finished with value: 2319.697118598169 and parameters: {'depth': 10, 'learning_rate': 0.00040181510516846614, 'iterations': 2888, 'l2_leaf_reg': 1.381486431445902e-08, 'border_count': 184, 'bagging_temperature': 0.02853411025714704, 'random_strength': 3.232582720189015, 'grow_policy': 'Depthwise', 'min_data_in_leaf': 63}. Best is trial 814 with value: 2060.357404924192.[0m
[32m[I 2024-10-13 11:14:58,819][0m Trial 959 finished with value: 2957.7922132028566 and parameters: {'depth': 11, 'learning_rate': 0.00018400215311312833, 'iterations': 2949, 'l2_leaf_reg': 5.699641523264911e-08, 'border_count': 38, 'bagging_temperature': 0.05635487791868013, 'random_strength': 1.6344517801441987, 'grow_policy': 'Depthwise', 'min_data_in_leaf': 34}. Best is trial 814 with value: 2060.357404924192.[0m
[32m[I 2024-10-13 11:15:04,178][0m Trial 960 finished with value: 2498.459726286084 and parameters: {'depth': 11, 'learning_rate': 0.0005034817437540215, 'iterations': 2720, 'l2_leaf_reg': 2.0731691629460968e-08, 'border_count': 20, 'bagging_temperature': 0.10790949954403387, 'random_strength': 2.359293018042877, 'grow_policy': 'Depthwise', 'min_data_in_leaf': 19}. Best is trial 814 with value: 2060.357404924192.[0m
[32m[I 2024-10-13 11:15:07,354][0m Trial 961 finished with value: 2182.295645266181 and parameters: {'depth': 10, 'learning_rate': 0.0006281270950176268, 'iterations': 2840, 'l2_leaf_reg': 3.987237475577693e-08, 'border_count': 26, 'bagging_temperature': 0.01955505075731833, 'random_strength': 2.569808634219155, 'grow_policy': 'Depthwise', 'min_data_in_leaf': 73}. Best is trial 814 with value: 2060.357404924192.[0m
[32m[I 2024-10-13 11:15:11,597][0m Trial 962 finished with value: 2246.5659976634643 and parameters: {'depth': 9, 'learning_rate': 0.0008025109689535366, 'iterations': 2909, 'l2_leaf_reg': 2.615298664959122e-08, 'border_count': 15, 'bagging_temperature': 0.04433272949416937, 'random_strength': 1.2026476906860961, 'grow_policy': 'Depthwise', 'min_data_in_leaf': 48}. Best is trial 814 with value: 2060.357404924192.[0m
[32m[I 2024-10-13 11:15:26,259][0m Trial 963 finished with value: 2957.0666440284836 and parameters: {'depth': 11, 'learning_rate': 0.00045938549715117557, 'iterations': 3000, 'l2_leaf_reg': 1.446481920495623e-08, 'border_count': 23, 'bagging_temperature': 0.07341436563703028, 'random_strength': 2.9760326784795668, 'grow_policy': 'Depthwise', 'min_data_in_leaf': 1}. Best is trial 814 with value: 2060.357404924192.[0m
[32m[I 2024-10-13 11:15:30,875][0m Trial 964 finished with value: 2166.490917534994 and parameters: {'depth': 11, 'learning_rate': 0.0005486897722689973, 'iterations': 2781, 'l2_leaf_reg': 1.0256355801191046e-08, 'border_count': 31, 'bagging_temperature': 0.020877866885592917, 'random_strength': 1.8272735991578042, 'grow_policy': 'Depthwise', 'min_data_in_leaf': 34}. Best is trial 814 with value: 2060.357404924192.[0m
[32m[I 2024-10-13 11:15:59,310][0m Trial 965 finished with value: 2562.8755999929112 and parameters: {'depth': 11, 'learning_rate': 0.0007024038404057444, 'iterations': 2677, 'l2_leaf_reg': 3.774392799399642e-08, 'border_count': 18, 'bagging_temperature': 0.03393212085336785, 'random_strength': 1.5490547968759218, 'grow_policy': 'SymmetricTree', 'min_data_in_leaf': 1}. Best is trial 814 with value: 2060.357404924192.[0m
[32m[I 2024-10-13 11:16:04,842][0m Trial 966 finished with value: 2201.8753416224013 and parameters: {'depth': 10, 'learning_rate': 0.0003560205770639101, 'iterations': 2858, 'l2_leaf_reg': 0.010261518797970524, 'border_count': 27, 'bagging_temperature': 0.058825327984950854, 'random_strength': 2.344907512525778, 'grow_policy': 'Depthwise', 'min_data_in_leaf': 21}. Best is trial 814 with value: 2060.357404924192.[0m
[32m[I 2024-10-13 11:16:08,390][0m Trial 967 finished with value: 2488.690461047707 and parameters: {'depth': 9, 'learning_rate': 0.00028587243938337203, 'iterations': 2807, 'l2_leaf_reg': 1.9485338540774822e-08, 'border_count': 17, 'bagging_temperature': 0.08942170779864267, 'random_strength': 1.9171324945213077, 'grow_policy': 'Depthwise', 'min_data_in_leaf': 51}. Best is trial 814 with value: 2060.357404924192.[0m
[32m[I 2024-10-13 11:16:13,429][0m Trial 968 finished with value: 2284.117301051599 and parameters: {'depth': 11, 'learning_rate': 0.0004154637657615752, 'iterations': 2951, 'l2_leaf_reg': 1.0081802004995822e-08, 'border_count': 44, 'bagging_temperature': 0.018417420859621243, 'random_strength': 1.3787107032371726, 'grow_policy': 'Depthwise', 'min_data_in_leaf': 33}. Best is trial 814 with value: 2060.357404924192.[0m
