[32m[I 2024-10-13 04:29:16,726][0m Trial 869 finished with value: 1065.1913000767245 and parameters: {'depth': 11, 'learning_rate': 0.024069415698738477, 'iterations': 1194, 'l2_leaf_reg': 0.017100178405405137, 'border_count': 17, 'bagging_temperature': 0.22287465828411496, 'random_strength': 0.3420129078003, 'grow_policy': 'SymmetricTree', 'min_data_in_leaf': 177}. Best is trial 575 with value: 965.9974213974682.[0m
[32m[I 2024-10-13 04:29:23,069][0m Trial 870 finished with value: 1157.431031066416 and parameters: {'depth': 7, 'learning_rate': 0.011822600733609707, 'iterations': 1322, 'l2_leaf_reg': 0.09805323695417065, 'border_count': 25, 'bagging_temperature': 0.83021947839905, 'random_strength': 0.18098732500428064, 'grow_policy': 'SymmetricTree', 'min_data_in_leaf': 523}. Best is trial 575 with value: 965.9974213974682.[0m
[32m[I 2024-10-13 04:29:31,507][0m Trial 871 finished with value: 1141.9585247766418 and parameters: {'depth': 12, 'learning_rate': 0.018842792840220817, 'iterations': 1436, 'l2_leaf_reg': 0.026824610595019952, 'border_count': 13, 'bagging_temperature': 0.20080372174472533, 'random_strength': 0.5066234068436796, 'grow_policy': 'SymmetricTree', 'min_data_in_leaf': 227}. Best is trial 575 with value: 965.9974213974682.[0m
[32m[I 2024-10-13 04:29:38,265][0m Trial 872 finished with value: 1189.8869560230341 and parameters: {'depth': 6, 'learning_rate': 0.030093877230062082, 'iterations': 1540, 'l2_leaf_reg': 0.0017642128159005483, 'border_count': 31, 'bagging_temperature': 0.9698388876633167, 'random_strength': 0.0033419892324960234, 'grow_policy': 'SymmetricTree', 'min_data_in_leaf': 604}. Best is trial 575 with value: 965.9974213974682.[0m
[32m[I 2024-10-13 04:29:45,601][0m Trial 873 finished with value: 1343.1551199944577 and parameters: {'depth': 8, 'learning_rate': 0.014198408959152318, 'iterations': 1384, 'l2_leaf_reg': 0.05549325603887682, 'border_count': 6, 'bagging_temperature': 0.6738241600350223, 'random_strength': 0.00019123642181864036, 'grow_policy': 'SymmetricTree', 'min_data_in_leaf': 198}. Best is trial 575 with value: 965.9974213974682.[0m
[32m[I 2024-10-13 04:29:53,969][0m Trial 874 finished with value: 1116.0412220948301 and parameters: {'depth': 9, 'learning_rate': 0.021697803046224717, 'iterations': 1476, 'l2_leaf_reg': 0.006997879139838883, 'border_count': 21, 'bagging_temperature': 0.25354455702049433, 'random_strength': 0.7097054801472272, 'grow_policy': 'SymmetricTree', 'min_data_in_leaf': 240}. Best is trial 575 with value: 965.9974213974682.[0m
[32m[I 2024-10-13 04:30:05,682][0m Trial 875 finished with value: 1287.4728031686595 and parameters: {'depth': 11, 'learning_rate': 0.01603026337618021, 'iterations': 1274, 'l2_leaf_reg': 0.038761073461069995, 'border_count': 39, 'bagging_temperature': 0.38675244294975186, 'random_strength': 0.3174704335707982, 'grow_policy': 'SymmetricTree', 'min_data_in_leaf': 163}. Best is trial 575 with value: 965.9974213974682.[0m
[32m[I 2024-10-13 04:30:14,812][0m Trial 876 finished with value: 1063.1796294367673 and parameters: {'depth': 8, 'learning_rate': 0.01903038229336948, 'iterations': 1671, 'l2_leaf_reg': 0.02046498652206205, 'border_count': 18, 'bagging_temperature': 0.8926242947358635, 'random_strength': 0.003414926899894477, 'grow_policy': 'SymmetricTree', 'min_data_in_leaf': 581}. Best is trial 575 with value: 965.9974213974682.[0m
[32m[I 2024-10-13 04:30:24,264][0m Trial 877 finished with value: 1286.3159009146198 and parameters: {'depth': 7, 'learning_rate': 0.00998962585897845, 'iterations': 1343, 'l2_leaf_reg': 0.07586107991389554, 'border_count': 175, 'bagging_temperature': 0.7092047152803922, 'random_strength': 0.46583408821644556, 'grow_policy': 'SymmetricTree', 'min_data_in_leaf': 537}. Best is trial 575 with value: 965.9974213974682.[0m
[32m[I 2024-10-13 04:30:32,175][0m Trial 878 finished with value: 1232.4821213339194 and parameters: {'depth': 9, 'learning_rate': 0.026224568761855735, 'iterations': 1188, 'l2_leaf_reg': 0.004551785254788477, 'border_count': 25, 'bagging_temperature': 0.27475142105713507, 'random_strength': 0.19336932182780195, 'grow_policy': 'SymmetricTree', 'min_data_in_leaf': 219}. Best is trial 575 with value: 965.9974213974682.[0m
[32m[I 2024-10-13 04:30:45,569][0m Trial 879 finished with value: 1407.7824275698551 and parameters: {'depth': 8, 'learning_rate': 0.001577538004362237, 'iterations': 1420, 'l2_leaf_reg': 0.012733703587750209, 'border_count': 205, 'bagging_temperature': 0.1270914226309187, 'random_strength': 0.31436828032726666, 'grow_policy': 'SymmetricTree', 'min_data_in_leaf': 185}. Best is trial 575 with value: 965.9974213974682.[0m
[32m[I 2024-10-13 04:30:54,921][0m Trial 880 finished with value: 1164.112350028815 and parameters: {'depth': 11, 'learning_rate': 0.012325145845415149, 'iterations': 679, 'l2_leaf_reg': 0.030829854266664753, 'border_count': 12, 'bagging_temperature': 0.59792903226606, 'random_strength': 0.0008589570605315988, 'grow_policy': 'SymmetricTree', 'min_data_in_leaf': 556}. Best is trial 575 with value: 965.9974213974682.[0m
[32m[I 2024-10-13 04:31:17,183][0m Trial 881 finished with value: 1421.1210020368749 and parameters: {'depth': 13, 'learning_rate': 0.03561178915836339, 'iterations': 1566, 'l2_leaf_reg': 0.05882447059280458, 'border_count': 29, 'bagging_temperature': 0.15391184144848208, 'random_strength': 9.064246678090814, 'grow_policy': 'SymmetricTree', 'min_data_in_leaf': 255}. Best is trial 575 with value: 965.9974213974682.[0m
[32m[I 2024-10-13 04:31:23,493][0m Trial 882 finished with value: 1035.4854166798889 and parameters: {'depth': 8, 'learning_rate': 0.022119937639367128, 'iterations': 1248, 'l2_leaf_reg': 0.0029246925196246528, 'border_count': 21, 'bagging_temperature': 0.3317099212822791, 'random_strength': 0.6340059291386143, 'grow_policy': 'SymmetricTree', 'min_data_in_leaf': 120}. Best is trial 575 with value: 965.9974213974682.[0m
[32m[I 2024-10-13 04:31:29,523][0m Trial 883 finished with value: 1077.6066965767886 and parameters: {'depth': 7, 'learning_rate': 0.014814014618484863, 'iterations': 1319, 'l2_leaf_reg': 0.01985692942544963, 'border_count': 17, 'bagging_temperature': 0.6385848478351837, 'random_strength': 0.17374031746909196, 'grow_policy': 'SymmetricTree', 'min_data_in_leaf': 154}. Best is trial 575 with value: 965.9974213974682.[0m
[32m[I 2024-10-13 04:31:31,209][0m Trial 884 finished with value: 1249.3838715900704 and parameters: {'depth': 9, 'learning_rate': 0.018091358273226475, 'iterations': 1506, 'l2_leaf_reg': 0.009575641139011508, 'border_count': 34, 'bagging_temperature': 0.21105186580357546, 'random_strength': 0.3671154186425815, 'grow_policy': 'Depthwise', 'min_data_in_leaf': 208}. Best is trial 575 with value: 965.9974213974682.[0m
[32m[I 2024-10-13 04:31:37,467][0m Trial 885 finished with value: 1237.306239563619 and parameters: {'depth': 8, 'learning_rate': 0.028554852455580426, 'iterations': 1362, 'l2_leaf_reg': 0.11554510276368615, 'border_count': 9, 'bagging_temperature': 0.9261112581297416, 'random_strength': 0.1687396218053178, 'grow_policy': 'SymmetricTree', 'min_data_in_leaf': 587}. Best is trial 575 with value: 965.9974213974682.[0m
[32m[I 2024-10-13 04:31:52,559][0m Trial 886 finished with value: 1318.372143291088 and parameters: {'depth': 12, 'learning_rate': 0.013115096145811248, 'iterations': 1631, 'l2_leaf_reg': 0.029752855876252954, 'border_count': 24, 'bagging_temperature': 0.2952362096489874, 'random_strength': 5.6941966620620175, 'grow_policy': 'SymmetricTree', 'min_data_in_leaf': 558}. Best is trial 575 with value: 965.9974213974682.[0m
[32m[I 2024-10-13 04:31:57,523][0m Trial 887 finished with value: 1310.696672591311 and parameters: {'depth': 7, 'learning_rate': 0.02096417421214622, 'iterations': 1160, 'l2_leaf_reg': 0.053252627594108155, 'border_count': 29, 'bagging_temperature': 0.17875832741089978, 'random_strength': 0.8125490207002307, 'grow_policy': 'SymmetricTree', 'min_data_in_leaf': 503}. Best is trial 575 with value: 965.9974213974682.[0m
[32m[I 2024-10-13 04:32:06,680][0m Trial 888 finished with value: 1206.1268113762337 and parameters: {'depth': 9, 'learning_rate': 0.009737436041191904, 'iterations': 1461, 'l2_leaf_reg': 0.015482506326563, 'border_count': 15, 'bagging_temperature': 0.943814631424831, 'random_strength': 3.0601483094468693, 'grow_policy': 'SymmetricTree', 'min_data_in_leaf': 234}. Best is trial 575 with value: 965.9974213974682.[0m
[32m[I 2024-10-13 04:32:18,412][0m Trial 889 finished with value: 1071.603851309434 and parameters: {'depth': 11, 'learning_rate': 0.015978518603353403, 'iterations': 1390, 'l2_leaf_reg': 0.08199639482161576, 'border_count': 22, 'bagging_temperature': 0.5682580830428505, 'random_strength': 0.44544481231414323, 'grow_policy': 'SymmetricTree', 'min_data_in_leaf': 612}. Best is trial 575 with value: 965.9974213974682.[0m
[32m[I 2024-10-13 04:32:19,916][0m Trial 890 finished with value: 1348.0186401178808 and parameters: {'depth': 8, 'learning_rate': 0.025042126788463112, 'iterations': 1300, 'l2_leaf_reg': 0.0023146783813554187, 'border_count': 27, 'bagging_temperature': 0.6181092443823315, 'random_strength': 0.20304322617328716, 'grow_policy': 'Lossguide', 'min_data_in_leaf': 186, 'max_leaves': 84}. Best is trial 575 with value: 965.9974213974682.[0m
[32m[I 2024-10-13 04:32:25,435][0m Trial 891 finished with value: 2217.1424812546866 and parameters: {'depth': 7, 'learning_rate': 0.038132083207970874, 'iterations': 1540, 'l2_leaf_reg': 0.007837934331021547, 'border_count': 3, 'bagging_temperature': 0.8908885478141211, 'random_strength': 0.002460088778026292, 'grow_policy': 'SymmetricTree', 'min_data_in_leaf': 134}. Best is trial 575 with value: 965.9974213974682.[0m
[32m[I 2024-10-13 04:32:30,603][0m Trial 892 finished with value: 1136.8386747222155 and parameters: {'depth': 6, 'learning_rate': 0.011798851403688188, 'iterations': 1231, 'l2_leaf_reg': 0.04105135025765506, 'border_count': 17, 'bagging_temperature': 0.8107775202057281, 'random_strength': 0.6065045003965476, 'grow_policy': 'SymmetricTree', 'min_data_in_leaf': 202}. Best is trial 575 with value: 965.9974213974682.[0m
[32m[I 2024-10-13 04:32:36,296][0m Trial 893 finished with value: 1314.4301528811623 and parameters: {'depth': 8, 'learning_rate': 0.01878781804303691, 'iterations': 1435, 'l2_leaf_reg': 0.004890534832399319, 'border_count': 10, 'bagging_temperature': 0.2568770781465185, 'random_strength': 3.921790347745469, 'grow_policy': 'SymmetricTree', 'min_data_in_leaf': 525}. Best is trial 575 with value: 965.9974213974682.[0m
[32m[I 2024-10-13 04:33:01,573][0m Trial 894 finished with value: 1262.8230239968843 and parameters: {'depth': 9, 'learning_rate': 0.022981608403292764, 'iterations': 1843, 'l2_leaf_reg': 4.09802200881516e-05, 'border_count': 146, 'bagging_temperature': 0.2374479030591246, 'random_strength': 0.3232865540976933, 'grow_policy': 'SymmetricTree', 'min_data_in_leaf': 419}. Best is trial 575 with value: 965.9974213974682.[0m
[32m[I 2024-10-13 04:33:16,180][0m Trial 895 finished with value: 1229.7518097731106 and parameters: {'depth': 11, 'learning_rate': 0.0323734287124157, 'iterations': 1304, 'l2_leaf_reg': 0.09886871290706711, 'border_count': 35, 'bagging_temperature': 0.20018462663455105, 'random_strength': 1.383665531319046, 'grow_policy': 'SymmetricTree', 'min_data_in_leaf': 167}. Best is trial 575 with value: 965.9974213974682.[0m
[32m[I 2024-10-13 04:33:22,321][0m Trial 896 finished with value: 1157.6468324207885 and parameters: {'depth': 8, 'learning_rate': 0.045911368928398366, 'iterations': 1187, 'l2_leaf_reg': 0.04065294967391222, 'border_count': 22, 'bagging_temperature': 0.6844611692845793, 'random_strength': 0.19044531987816032, 'grow_policy': 'SymmetricTree', 'min_data_in_leaf': 572}. Best is trial 575 with value: 965.9974213974682.[0m
[32m[I 2024-10-13 04:33:28,838][0m Trial 897 finished with value: 1042.2023682448846 and parameters: {'depth': 7, 'learning_rate': 0.014204789213262464, 'iterations': 1384, 'l2_leaf_reg': 0.0014603482280190917, 'border_count': 18, 'bagging_temperature': 0.8490493458744285, 'random_strength': 0.0014279543791585175, 'grow_policy': 'SymmetricTree', 'min_data_in_leaf': 217}. Best is trial 575 with value: 965.9974213974682.[0m
[32m[I 2024-10-13 04:33:45,682][0m Trial 898 finished with value: 1247.5946405450427 and parameters: {'depth': 12, 'learning_rate': 0.01707120704743727, 'iterations': 1607, 'l2_leaf_reg': 0.027348285778938893, 'border_count': 27, 'bagging_temperature': 0.3047599319744561, 'random_strength': 0.4685675724252265, 'grow_policy': 'SymmetricTree', 'min_data_in_leaf': 261}. Best is trial 575 with value: 965.9974213974682.[0m
[32m[I 2024-10-13 04:34:00,149][0m Trial 899 finished with value: 1222.2749823652198 and parameters: {'depth': 8, 'learning_rate': 0.011412451909636539, 'iterations': 1448, 'l2_leaf_reg': 0.013505067390605308, 'border_count': 162, 'bagging_temperature': 0.910138998308995, 'random_strength': 0.3109010928974499, 'grow_policy': 'SymmetricTree', 'min_data_in_leaf': 243}. Best is trial 575 with value: 965.9974213974682.[0m
[32m[I 2024-10-13 04:34:13,989][0m Trial 900 finished with value: 1084.8254847713222 and parameters: {'depth': 11, 'learning_rate': 0.027529850047921273, 'iterations': 1524, 'l2_leaf_reg': 0.003499076580434675, 'border_count': 13, 'bagging_temperature': 0.37124745795562825, 'random_strength': 0.1753243957626336, 'grow_policy': 'SymmetricTree', 'min_data_in_leaf': 551}. Best is trial 575 with value: 965.9974213974682.[0m
[32m[I 2024-10-13 04:34:17,970][0m Trial 901 finished with value: 1171.1542943299883 and parameters: {'depth': 8, 'learning_rate': 0.02065700865831929, 'iterations': 747, 'l2_leaf_reg': 0.06626172992855797, 'border_count': 23, 'bagging_temperature': 0.27973765990033617, 'random_strength': 2.3306546675873636, 'grow_policy': 'SymmetricTree', 'min_data_in_leaf': 178}. Best is trial 575 with value: 965.9974213974682.[0m
[32m[I 2024-10-13 04:34:23,417][0m Trial 902 finished with value: 1267.760827284431 and parameters: {'depth': 6, 'learning_rate': 0.013845887058934468, 'iterations': 1263, 'l2_leaf_reg': 0.022750637843980334, 'border_count': 31, 'bagging_temperature': 0.6530866302557433, 'random_strength': 0.6325858545926156, 'grow_policy': 'SymmetricTree', 'min_data_in_leaf': 613}. Best is trial 575 with value: 965.9974213974682.[0m
[32m[I 2024-10-13 04:34:32,546][0m Trial 903 finished with value: 1124.1325348528933 and parameters: {'depth': 9, 'learning_rate': 0.015699277423287205, 'iterations': 1495, 'l2_leaf_reg': 0.007496614838471458, 'border_count': 19, 'bagging_temperature': 0.21877238799406884, 'random_strength': 0.4722403928309692, 'grow_policy': 'SymmetricTree', 'min_data_in_leaf': 150}. Best is trial 575 with value: 965.9974213974682.[0m
[32m[I 2024-10-13 04:34:39,432][0m Trial 904 finished with value: 1275.0540823258018 and parameters: {'depth': 7, 'learning_rate': 0.009843523358953315, 'iterations': 1342, 'l2_leaf_reg': 0.13064673136305596, 'border_count': 40, 'bagging_temperature': 0.15312731377458963, 'random_strength': 0.20422124599393193, 'grow_policy': 'SymmetricTree', 'min_data_in_leaf': 196}. Best is trial 575 with value: 965.9974213974682.[0m
[32m[I 2024-10-13 04:35:35,967][0m Trial 905 finished with value: 1298.174274867743 and parameters: {'depth': 12, 'learning_rate': 0.023355728613099126, 'iterations': 1416, 'l2_leaf_reg': 0.04049708396668786, 'border_count': 96, 'bagging_temperature': 0.18284211153297109, 'random_strength': 0.3210463522664865, 'grow_policy': 'SymmetricTree', 'min_data_in_leaf': 597}. Best is trial 575 with value: 965.9974213974682.[0m
[32m[I 2024-10-13 04:35:37,248][0m Trial 906 finished with value: 1251.8793341128649 and parameters: {'depth': 9, 'learning_rate': 0.017383292569767436, 'iterations': 1143, 'l2_leaf_reg': 0.019148886343594993, 'border_count': 13, 'bagging_temperature': 0.16944641313255468, 'random_strength': 0.8452431830236475, 'grow_policy': 'Depthwise', 'min_data_in_leaf': 213}. Best is trial 575 with value: 965.9974213974682.[0m
[32m[I 2024-10-13 04:35:43,223][0m Trial 907 finished with value: 1143.5188965656225 and parameters: {'depth': 7, 'learning_rate': 0.019629075626171996, 'iterations': 1336, 'l2_leaf_reg': 0.06404696788477802, 'border_count': 26, 'bagging_temperature': 0.12966864799941058, 'random_strength': 0.0013427899567051427, 'grow_policy': 'SymmetricTree', 'min_data_in_leaf': 538}. Best is trial 575 with value: 965.9974213974682.[0m
[32m[I 2024-10-13 04:35:56,238][0m Trial 908 finished with value: 1251.2296019867624 and parameters: {'depth': 8, 'learning_rate': 0.030948351014784343, 'iterations': 2938, 'l2_leaf_reg': 0.010951655243431573, 'border_count': 9, 'bagging_temperature': 0.4657485429716408, 'random_strength': 0.17967564477536696, 'grow_policy': 'SymmetricTree', 'min_data_in_leaf': 578}. Best is trial 575 with value: 965.9974213974682.[0m
[32m[I 2024-10-13 04:36:09,391][0m Trial 909 finished with value: 1103.290686020354 and parameters: {'depth': 11, 'learning_rate': 0.012850055211707062, 'iterations': 1263, 'l2_leaf_reg': 0.0050860069592486, 'border_count': 19, 'bagging_temperature': 0.8694956330419373, 'random_strength': 0.4769250058956195, 'grow_policy': 'SymmetricTree', 'min_data_in_leaf': 226}. Best is trial 575 with value: 965.9974213974682.[0m
[32m[I 2024-10-13 04:36:57,242][0m Trial 910 finished with value: 1165.8323267809117 and parameters: {'depth': 13, 'learning_rate': 0.025245787020099008, 'iterations': 1704, 'l2_leaf_reg': 0.0030353782855642364, 'border_count': 32, 'bagging_temperature': 0.23594640878986425, 'random_strength': 0.18113148185330685, 'grow_policy': 'SymmetricTree', 'min_data_in_leaf': 252}. Best is trial 575 with value: 965.9974213974682.[0m
[32m[I 2024-10-13 04:37:06,926][0m Trial 911 finished with value: 1117.9836366303944 and parameters: {'depth': 9, 'learning_rate': 0.011212054061119331, 'iterations': 1576, 'l2_leaf_reg': 0.028607740102921223, 'border_count': 24, 'bagging_temperature': 0.7010563824426548, 'random_strength': 0.38337585889847714, 'grow_policy': 'SymmetricTree', 'min_data_in_leaf': 167}. Best is trial 575 with value: 965.9974213974682.[0m
[32m[I 2024-10-13 04:37:08,561][0m Trial 912 finished with value: 1197.2490253204828 and parameters: {'depth': 7, 'learning_rate': 0.014629264523849566, 'iterations': 1498, 'l2_leaf_reg': 0.05131155116354938, 'border_count': 15, 'bagging_temperature': 0.32271052972507025, 'random_strength': 0.573635154362591, 'grow_policy': 'Lossguide', 'min_data_in_leaf': 509, 'max_leaves': 174}. Best is trial 575 with value: 965.9974213974682.[0m
[32m[I 2024-10-13 04:37:14,726][0m Trial 913 finished with value: 1044.4756516256004 and parameters: {'depth': 8, 'learning_rate': 0.02082087549367031, 'iterations': 1221, 'l2_leaf_reg': 0.01511520218702426, 'border_count': 22, 'bagging_temperature': 0.6260238856527303, 'random_strength': 0.2964444034948957, 'grow_policy': 'SymmetricTree', 'min_data_in_leaf': 192}. Best is trial 575 with value: 965.9974213974682.[0m
[32m[I 2024-10-13 04:37:22,058][0m Trial 914 finished with value: 1057.873595196644 and parameters: {'depth': 8, 'learning_rate': 0.01694584539518186, 'iterations': 1401, 'l2_leaf_reg': 0.10564188518497943, 'border_count': 30, 'bagging_temperature': 0.6665941993858205, 'random_strength': 0.17435155653479434, 'grow_policy': 'SymmetricTree', 'min_data_in_leaf': 115}. Best is trial 575 with value: 965.9974213974682.[0m
[32m[I 2024-10-13 04:37:24,464][0m Trial 915 finished with value: 2737.3098958079277 and parameters: {'depth': 12, 'learning_rate': 0.00891347532399395, 'iterations': 548, 'l2_leaf_reg': 0.0018606335928805162, 'border_count': 1, 'bagging_temperature': 0.9554982191437775, 'random_strength': 0.004395684943387635, 'grow_policy': 'SymmetricTree', 'min_data_in_leaf': 571}. Best is trial 575 with value: 965.9974213974682.[0m
[32m[I 2024-10-13 04:37:36,602][0m Trial 916 finished with value: 1086.2913210170477 and parameters: {'depth': 11, 'learning_rate': 0.029154470884872503, 'iterations': 1306, 'l2_leaf_reg': 0.0745308469748296, 'border_count': 19, 'bagging_temperature': 0.273559341232619, 'random_strength': 0.38036585406347434, 'grow_policy': 'SymmetricTree', 'min_data_in_leaf': 227}. Best is trial 575 with value: 965.9974213974682.[0m
[32m[I 2024-10-13 04:37:45,742][0m Trial 917 finished with value: 1214.9062548955992 and parameters: {'depth': 9, 'learning_rate': 0.02348147226606063, 'iterations': 1458, 'l2_leaf_reg': 0.03716306220709216, 'border_count': 25, 'bagging_temperature': 0.19523101376626076, 'random_strength': 0.7619720901915504, 'grow_policy': 'SymmetricTree', 'min_data_in_leaf': 592}. Best is trial 575 with value: 965.9974213974682.[0m
[32m[I 2024-10-13 04:37:52,086][0m Trial 918 finished with value: 1312.8500104748966 and parameters: {'depth': 7, 'learning_rate': 0.039233792437934116, 'iterations': 1359, 'l2_leaf_reg': 0.008096131366308493, 'border_count': 36, 'bagging_temperature': 0.21813715418541066, 'random_strength': 1.0302127987783605, 'grow_policy': 'SymmetricTree', 'min_data_in_leaf': 140}. Best is trial 575 with value: 965.9974213974682.[0m
[32m[I 2024-10-13 04:38:00,539][0m Trial 919 finished with value: 1269.784222208683 and parameters: {'depth': 8, 'learning_rate': 0.019178227557673466, 'iterations': 1629, 'l2_leaf_reg': 0.024298534537079933, 'border_count': 8, 'bagging_temperature': 0.9194185697503694, 'random_strength': 0.16959973670980327, 'grow_policy': 'SymmetricTree', 'min_data_in_leaf': 623}. Best is trial 575 with value: 965.9974213974682.[0m
