[32m[I 2024-10-13 03:02:31,411][0m Trial 410 finished with value: 1145.2779841073086 and parameters: {'depth': 9, 'learning_rate': 0.01762660526466409, 'iterations': 1235, 'l2_leaf_reg': 0.184584904257048, 'border_count': 26, 'bagging_temperature': 0.5325761915715378, 'random_strength': 0.17330118685082363, 'grow_policy': 'SymmetricTree', 'min_data_in_leaf': 266}. Best is trial 323 with value: 980.8485503758243.[0m
[32m[I 2024-10-13 03:02:40,809][0m Trial 411 finished with value: 1028.428029903018 and parameters: {'depth': 9, 'learning_rate': 0.02613459195872604, 'iterations': 1277, 'l2_leaf_reg': 0.00016532285014560856, 'border_count': 21, 'bagging_temperature': 0.5283578682027963, 'random_strength': 0.3222225743480987, 'grow_policy': 'SymmetricTree', 'min_data_in_leaf': 242}. Best is trial 323 with value: 980.8485503758243.[0m
[32m[I 2024-10-13 03:02:42,470][0m Trial 412 finished with value: 1265.8948810726172 and parameters: {'depth': 10, 'learning_rate': 0.024252036932479282, 'iterations': 1396, 'l2_leaf_reg': 0.00020051874807588607, 'border_count': 47, 'bagging_temperature': 0.6072481632979574, 'random_strength': 0.6880178903360794, 'grow_policy': 'Depthwise', 'min_data_in_leaf': 315}. Best is trial 323 with value: 980.8485503758243.[0m
[32m[I 2024-10-13 03:02:52,131][0m Trial 413 finished with value: 1291.940308748397 and parameters: {'depth': 9, 'learning_rate': 0.030702307590277325, 'iterations': 1323, 'l2_leaf_reg': 0.00015369422181701363, 'border_count': 32, 'bagging_temperature': 0.505371110875182, 'random_strength': 0.4541817374494089, 'grow_policy': 'SymmetricTree', 'min_data_in_leaf': 250}. Best is trial 323 with value: 980.8485503758243.[0m
[32m[I 2024-10-13 03:03:01,442][0m Trial 414 finished with value: 1064.023273993615 and parameters: {'depth': 9, 'learning_rate': 0.023537994274071085, 'iterations': 1145, 'l2_leaf_reg': 0.00010069107623171064, 'border_count': 24, 'bagging_temperature': 0.5376923392837026, 'random_strength': 0.32056892065682674, 'grow_policy': 'SymmetricTree', 'min_data_in_leaf': 273}. Best is trial 323 with value: 980.8485503758243.[0m
[32m[I 2024-10-13 03:03:18,758][0m Trial 415 finished with value: 3369.9678474845336 and parameters: {'depth': 10, 'learning_rate': 0.0004469150573450438, 'iterations': 1181, 'l2_leaf_reg': 0.00021865243755469772, 'border_count': 19, 'bagging_temperature': 0.9383579486193862, 'random_strength': 4.478548755199229, 'grow_policy': 'SymmetricTree', 'min_data_in_leaf': 241}. Best is trial 323 with value: 980.8485503758243.[0m
[32m[I 2024-10-13 03:03:28,468][0m Trial 416 finished with value: 1178.705697632463 and parameters: {'depth': 9, 'learning_rate': 0.03570008604456035, 'iterations': 1222, 'l2_leaf_reg': 8.159674777478332e-05, 'border_count': 26, 'bagging_temperature': 0.571769225906523, 'random_strength': 1.0671316464479508, 'grow_policy': 'SymmetricTree', 'min_data_in_leaf': 500}. Best is trial 323 with value: 980.8485503758243.[0m
[32m[I 2024-10-13 03:03:36,738][0m Trial 417 finished with value: 1057.2847712666558 and parameters: {'depth': 9, 'learning_rate': 0.02866550767059283, 'iterations': 1295, 'l2_leaf_reg': 0.0031685181330376047, 'border_count': 20, 'bagging_temperature': 0.5000086625533006, 'random_strength': 0.5149462471794121, 'grow_policy': 'SymmetricTree', 'min_data_in_leaf': 291}. Best is trial 323 with value: 980.8485503758243.[0m
[32m[I 2024-10-13 03:03:38,432][0m Trial 418 finished with value: 1262.6056538639887 and parameters: {'depth': 9, 'learning_rate': 0.01968429667671021, 'iterations': 1406, 'l2_leaf_reg': 0.0770820743406382, 'border_count': 36, 'bagging_temperature': 0.4687946856595631, 'random_strength': 0.19551293901711644, 'grow_policy': 'Lossguide', 'min_data_in_leaf': 257, 'max_leaves': 66}. Best is trial 323 with value: 980.8485503758243.[0m
[32m[I 2024-10-13 03:03:43,120][0m Trial 419 finished with value: 1234.684275329314 and parameters: {'depth': 9, 'learning_rate': 0.025044425367527216, 'iterations': 622, 'l2_leaf_reg': 2.06612672575551e-05, 'border_count': 29, 'bagging_temperature': 0.5261783519862879, 'random_strength': 0.7488546436876197, 'grow_policy': 'SymmetricTree', 'min_data_in_leaf': 229}. Best is trial 323 with value: 980.8485503758243.[0m
[32m[I 2024-10-13 03:03:55,267][0m Trial 420 finished with value: 4558.309520250399 and parameters: {'depth': 9, 'learning_rate': 0.0001124398695573812, 'iterations': 1117, 'l2_leaf_reg': 0.00010493545378575135, 'border_count': 23, 'bagging_temperature': 0.5268361041766279, 'random_strength': 0.3247770180894277, 'grow_policy': 'SymmetricTree', 'min_data_in_leaf': 1000}. Best is trial 323 with value: 980.8485503758243.[0m
[32m[I 2024-10-13 03:04:04,238][0m Trial 421 finished with value: 1030.3833863776704 and parameters: {'depth': 9, 'learning_rate': 0.018957233350740562, 'iterations': 1210, 'l2_leaf_reg': 0.00014898876466232054, 'border_count': 18, 'bagging_temperature': 0.486094254721261, 'random_strength': 0.0019015191155432876, 'grow_policy': 'SymmetricTree', 'min_data_in_leaf': 274}. Best is trial 323 with value: 980.8485503758243.[0m
[32m[I 2024-10-13 03:04:19,747][0m Trial 422 finished with value: 1327.7864148899882 and parameters: {'depth': 9, 'learning_rate': 0.0017317100909941693, 'iterations': 1263, 'l2_leaf_reg': 0.0005165476471061328, 'border_count': 19, 'bagging_temperature': 0.5542119390938252, 'random_strength': 0.009112583673307466, 'grow_policy': 'SymmetricTree', 'min_data_in_leaf': 283}. Best is trial 323 with value: 980.8485503758243.[0m
[32m[I 2024-10-13 03:04:32,270][0m Trial 423 finished with value: 1136.1639894156372 and parameters: {'depth': 10, 'learning_rate': 0.019866486001834112, 'iterations': 1243, 'l2_leaf_reg': 0.0001468896899761986, 'border_count': 25, 'bagging_temperature': 0.7619692416176364, 'random_strength': 0.17212712038247197, 'grow_policy': 'SymmetricTree', 'min_data_in_leaf': 298}. Best is trial 323 with value: 980.8485503758243.[0m
[32m[I 2024-10-13 03:04:46,333][0m Trial 424 finished with value: 1334.3085697812562 and parameters: {'depth': 9, 'learning_rate': 0.02689333912440824, 'iterations': 1211, 'l2_leaf_reg': 0.0003552612714526687, 'border_count': 81, 'bagging_temperature': 0.4559986313389862, 'random_strength': 2.198578368612919, 'grow_policy': 'SymmetricTree', 'min_data_in_leaf': 318}. Best is trial 323 with value: 980.8485503758243.[0m
[32m[I 2024-10-13 03:05:08,973][0m Trial 425 finished with value: 1360.4650374266826 and parameters: {'depth': 13, 'learning_rate': 0.016176201466852357, 'iterations': 1165, 'l2_leaf_reg': 7.41721424930036e-05, 'border_count': 33, 'bagging_temperature': 0.4862781090528331, 'random_strength': 9.632607263045385, 'grow_policy': 'SymmetricTree', 'min_data_in_leaf': 260}. Best is trial 323 with value: 980.8485503758243.[0m
[32m[I 2024-10-13 03:05:17,704][0m Trial 426 finished with value: 1078.899991633799 and parameters: {'depth': 9, 'learning_rate': 0.021162168117086017, 'iterations': 1304, 'l2_leaf_reg': 0.00016187281679250323, 'border_count': 21, 'bagging_temperature': 0.5506675611761116, 'random_strength': 0.36645341314352586, 'grow_policy': 'SymmetricTree', 'min_data_in_leaf': 281}. Best is trial 323 with value: 980.8485503758243.[0m
[32m[I 2024-10-13 03:05:25,567][0m Trial 427 finished with value: 1097.8571715871135 and parameters: {'depth': 9, 'learning_rate': 0.018559382869706393, 'iterations': 1172, 'l2_leaf_reg': 4.662165431421729e-05, 'border_count': 16, 'bagging_temperature': 0.5144468963239617, 'random_strength': 0.5320123023724936, 'grow_policy': 'SymmetricTree', 'min_data_in_leaf': 219}. Best is trial 323 with value: 980.8485503758243.[0m
[32m[I 2024-10-13 03:05:34,176][0m Trial 428 finished with value: 1352.0134645246753 and parameters: {'depth': 9, 'learning_rate': 0.014828754367389344, 'iterations': 1118, 'l2_leaf_reg': 0.0002524496660253595, 'border_count': 41, 'bagging_temperature': 0.5356494863191703, 'random_strength': 6.690822452749794, 'grow_policy': 'SymmetricTree', 'min_data_in_leaf': 248}. Best is trial 323 with value: 980.8485503758243.[0m
[32m[I 2024-10-13 03:05:44,931][0m Trial 429 finished with value: 1121.0662088613492 and parameters: {'depth': 9, 'learning_rate': 0.03154888312965543, 'iterations': 1363, 'l2_leaf_reg': 0.0023286448771373024, 'border_count': 27, 'bagging_temperature': 0.6169734076897371, 'random_strength': 0.004542757420738078, 'grow_policy': 'SymmetricTree', 'min_data_in_leaf': 273}. Best is trial 323 with value: 980.8485503758243.[0m
[32m[I 2024-10-13 03:05:53,165][0m Trial 430 finished with value: 1086.5191457151293 and parameters: {'depth': 9, 'learning_rate': 0.025756328746404794, 'iterations': 1219, 'l2_leaf_reg': 0.0038559572659877346, 'border_count': 15, 'bagging_temperature': 0.5824697975861671, 'random_strength': 0.2135090828780252, 'grow_policy': 'SymmetricTree', 'min_data_in_leaf': 127}. Best is trial 323 with value: 980.8485503758243.[0m
[32m[I 2024-10-13 03:05:55,257][0m Trial 431 finished with value: 1153.689478354222 and parameters: {'depth': 10, 'learning_rate': 0.015822713324317547, 'iterations': 344, 'l2_leaf_reg': 0.09744627669379205, 'border_count': 24, 'bagging_temperature': 0.48230374386094055, 'random_strength': 0.3463530789936709, 'grow_policy': 'SymmetricTree', 'min_data_in_leaf': 340}. Best is trial 323 with value: 980.8485503758243.[0m
[32m[I 2024-10-13 03:06:03,776][0m Trial 432 finished with value: 1304.1774869576445 and parameters: {'depth': 9, 'learning_rate': 0.01893940480256823, 'iterations': 1433, 'l2_leaf_reg': 0.04621794666997161, 'border_count': 9, 'bagging_temperature': 0.7141182725508561, 'random_strength': 0.577675305573711, 'grow_policy': 'SymmetricTree', 'min_data_in_leaf': 235}. Best is trial 323 with value: 980.8485503758243.[0m
[32m[I 2024-10-13 03:06:11,408][0m Trial 433 finished with value: 1180.5182347106845 and parameters: {'depth': 8, 'learning_rate': 0.012634616732815684, 'iterations': 1075, 'l2_leaf_reg': 0.0029545689134697294, 'border_count': 31, 'bagging_temperature': 0.5310882475061643, 'random_strength': 0.00030951320942953424, 'grow_policy': 'SymmetricTree', 'min_data_in_leaf': 217}. Best is trial 323 with value: 980.8485503758243.[0m
[32m[I 2024-10-13 03:06:13,013][0m Trial 434 finished with value: 1332.489792961454 and parameters: {'depth': 9, 'learning_rate': 0.014035473395065397, 'iterations': 1289, 'l2_leaf_reg': 0.00011544159876473771, 'border_count': 100, 'bagging_temperature': 0.4344397893704056, 'random_strength': 0.9195276200778102, 'grow_policy': 'Depthwise', 'min_data_in_leaf': 260}. Best is trial 323 with value: 980.8485503758243.[0m
[32m[I 2024-10-13 03:06:19,405][0m Trial 435 finished with value: 1069.8353498516442 and parameters: {'depth': 8, 'learning_rate': 0.020592086637617923, 'iterations': 1168, 'l2_leaf_reg': 0.06129442165988908, 'border_count': 19, 'bagging_temperature': 0.5113604926479611, 'random_strength': 0.19922933699678613, 'grow_policy': 'SymmetricTree', 'min_data_in_leaf': 313}. Best is trial 323 with value: 980.8485503758243.[0m
[32m[I 2024-10-13 03:06:25,008][0m Trial 436 finished with value: 1095.2973069341838 and parameters: {'depth': 8, 'learning_rate': 0.016314391506939977, 'iterations': 1091, 'l2_leaf_reg': 4.281578453650328e-05, 'border_count': 15, 'bagging_temperature': 0.4988227513412377, 'random_strength': 0.3474548488055797, 'grow_policy': 'SymmetricTree', 'min_data_in_leaf': 206}. Best is trial 323 with value: 980.8485503758243.[0m
[32m[I 2024-10-13 03:06:33,723][0m Trial 437 finished with value: 1008.4307628474619 and parameters: {'depth': 9, 'learning_rate': 0.011251125682834632, 'iterations': 1341, 'l2_leaf_reg': 0.00024134420776785107, 'border_count': 23, 'bagging_temperature': 0.1501203992658267, 'random_strength': 0.189951122192253, 'grow_policy': 'SymmetricTree', 'min_data_in_leaf': 581}. Best is trial 323 with value: 980.8485503758243.[0m
[32m[I 2024-10-13 03:06:44,580][0m Trial 438 finished with value: 1220.2434786444774 and parameters: {'depth': 10, 'learning_rate': 0.011059295924867115, 'iterations': 1356, 'l2_leaf_reg': 0.0002458530186020147, 'border_count': 26, 'bagging_temperature': 0.16148390621309683, 'random_strength': 0.1704179426604865, 'grow_policy': 'SymmetricTree', 'min_data_in_leaf': 617}. Best is trial 323 with value: 980.8485503758243.[0m
[32m[I 2024-10-13 03:07:02,440][0m Trial 439 finished with value: 1338.852128388699 and parameters: {'depth': 9, 'learning_rate': 0.011640866428207587, 'iterations': 1396, 'l2_leaf_reg': 0.0016107364008756855, 'border_count': 118, 'bagging_temperature': 0.11370829082236539, 'random_strength': 0.6670211188187617, 'grow_policy': 'SymmetricTree', 'min_data_in_leaf': 273}. Best is trial 323 with value: 980.8485503758243.[0m
[32m[I 2024-10-13 03:07:11,638][0m Trial 440 finished with value: 1015.7850260334898 and parameters: {'depth': 9, 'learning_rate': 0.0226815535726796, 'iterations': 1332, 'l2_leaf_reg': 0.0002009314944968411, 'border_count': 19, 'bagging_temperature': 0.5585477949779905, 'random_strength': 0.004599110611805362, 'grow_policy': 'SymmetricTree', 'min_data_in_leaf': 362}. Best is trial 323 with value: 980.8485503758243.[0m
[32m[I 2024-10-13 03:07:19,997][0m Trial 441 finished with value: 1282.1849188066624 and parameters: {'depth': 9, 'learning_rate': 0.0399865214471671, 'iterations': 1336, 'l2_leaf_reg': 0.00011158568560074218, 'border_count': 9, 'bagging_temperature': 0.13713077084283062, 'random_strength': 0.0155343580829018, 'grow_policy': 'SymmetricTree', 'min_data_in_leaf': 323}. Best is trial 323 with value: 980.8485503758243.[0m
[32m[I 2024-10-13 03:07:21,651][0m Trial 442 finished with value: 1181.8497325122432 and parameters: {'depth': 10, 'learning_rate': 0.0291720172374373, 'iterations': 1481, 'l2_leaf_reg': 0.00016510795258048121, 'border_count': 17, 'bagging_temperature': 0.0912077767348421, 'random_strength': 0.4107263596027283, 'grow_policy': 'Lossguide', 'min_data_in_leaf': 593, 'max_leaves': 96}. Best is trial 323 with value: 980.8485503758243.[0m
[32m[I 2024-10-13 03:07:30,401][0m Trial 443 finished with value: 1123.530526633703 and parameters: {'depth': 9, 'learning_rate': 0.02315977765288966, 'iterations': 1306, 'l2_leaf_reg': 0.00035476370218846944, 'border_count': 12, 'bagging_temperature': 0.5710915475619605, 'random_strength': 0.0022840220552773124, 'grow_policy': 'SymmetricTree', 'min_data_in_leaf': 733}. Best is trial 323 with value: 980.8485503758243.[0m
[32m[I 2024-10-13 03:07:40,487][0m Trial 444 finished with value: 1179.3877356619278 and parameters: {'depth': 9, 'learning_rate': 0.03263635297241874, 'iterations': 1404, 'l2_leaf_reg': 0.00016746011979903246, 'border_count': 29, 'bagging_temperature': 0.5541392439255336, 'random_strength': 0.19155982835090454, 'grow_policy': 'SymmetricTree', 'min_data_in_leaf': 373}. Best is trial 323 with value: 980.8485503758243.[0m
[32m[I 2024-10-13 03:07:56,605][0m Trial 445 finished with value: 1339.4801306909856 and parameters: {'depth': 9, 'learning_rate': 0.02662274066157448, 'iterations': 1249, 'l2_leaf_reg': 0.00036728553287110945, 'border_count': 207, 'bagging_temperature': 0.13244310465092338, 'random_strength': 0.42889215548504034, 'grow_policy': 'SymmetricTree', 'min_data_in_leaf': 657}. Best is trial 323 with value: 980.8485503758243.[0m
[32m[I 2024-10-13 03:08:02,232][0m Trial 446 finished with value: 1034.25980706368 and parameters: {'depth': 6, 'learning_rate': 0.022559589638869552, 'iterations': 1321, 'l2_leaf_reg': 0.00025088718340311115, 'border_count': 20, 'bagging_temperature': 0.5341170577073965, 'random_strength': 0.17330955799516423, 'grow_policy': 'SymmetricTree', 'min_data_in_leaf': 610}. Best is trial 323 with value: 980.8485503758243.[0m
[32m[I 2024-10-13 03:08:08,470][0m Trial 447 finished with value: 1534.137583387506 and parameters: {'depth': 6, 'learning_rate': 0.009619351055721388, 'iterations': 1440, 'l2_leaf_reg': 0.0006668355240424294, 'border_count': 5, 'bagging_temperature': 0.5529684811726409, 'random_strength': 0.5321118652774699, 'grow_policy': 'SymmetricTree', 'min_data_in_leaf': 537}. Best is trial 323 with value: 980.8485503758243.[0m
[32m[I 2024-10-13 03:08:21,923][0m Trial 448 finished with value: 1055.802151223379 and parameters: {'depth': 10, 'learning_rate': 0.019401546376793928, 'iterations': 1235, 'l2_leaf_reg': 7.265300932110518e-05, 'border_count': 23, 'bagging_temperature': 0.06286409550354916, 'random_strength': 0.0094735211687697, 'grow_policy': 'SymmetricTree', 'min_data_in_leaf': 359}. Best is trial 323 with value: 980.8485503758243.[0m
[32m[I 2024-10-13 03:08:30,180][0m Trial 449 finished with value: 1060.4789889801498 and parameters: {'depth': 9, 'learning_rate': 0.01417199626049442, 'iterations': 1356, 'l2_leaf_reg': 0.00018823520196861946, 'border_count': 14, 'bagging_temperature': 0.5408007151285196, 'random_strength': 0.26766617262973413, 'grow_policy': 'SymmetricTree', 'min_data_in_leaf': 557}. Best is trial 323 with value: 980.8485503758243.[0m
[32m[I 2024-10-13 03:09:03,491][0m Trial 450 finished with value: 1306.8785794746684 and parameters: {'depth': 14, 'learning_rate': 0.011897916782775285, 'iterations': 1255, 'l2_leaf_reg': 6.509418733934773e-05, 'border_count': 32, 'bagging_temperature': 0.5754568528377159, 'random_strength': 0.340495124650989, 'grow_policy': 'SymmetricTree', 'min_data_in_leaf': 640}. Best is trial 323 with value: 980.8485503758243.[0m
[32m[I 2024-10-13 03:09:21,849][0m Trial 451 finished with value: 1280.6087022946404 and parameters: {'depth': 9, 'learning_rate': 0.025506944126655835, 'iterations': 1285, 'l2_leaf_reg': 0.00011224473676102008, 'border_count': 185, 'bagging_temperature': 0.5989622209899756, 'random_strength': 0.7014656938492735, 'grow_policy': 'SymmetricTree', 'min_data_in_leaf': 571}. Best is trial 323 with value: 980.8485503758243.[0m
[32m[I 2024-10-13 03:09:29,495][0m Trial 452 finished with value: 1107.2350878175928 and parameters: {'depth': 8, 'learning_rate': 0.018135365366421033, 'iterations': 1185, 'l2_leaf_reg': 1.3824851466606702e-07, 'border_count': 18, 'bagging_temperature': 0.6584143216565438, 'random_strength': 0.1721815006186756, 'grow_policy': 'SymmetricTree', 'min_data_in_leaf': 467}. Best is trial 323 with value: 980.8485503758243.[0m
[32m[I 2024-10-13 03:09:41,366][0m Trial 453 finished with value: 1128.9942631725387 and parameters: {'depth': 9, 'learning_rate': 0.01068683048723239, 'iterations': 1407, 'l2_leaf_reg': 0.0002562468715786535, 'border_count': 25, 'bagging_temperature': 0.8603526972436909, 'random_strength': 0.010927219409073886, 'grow_policy': 'SymmetricTree', 'min_data_in_leaf': 364}. Best is trial 323 with value: 980.8485503758243.[0m
[32m[I 2024-10-13 03:09:48,722][0m Trial 454 finished with value: 1235.8587058612043 and parameters: {'depth': 8, 'learning_rate': 0.014943836243960916, 'iterations': 1500, 'l2_leaf_reg': 0.0004587636787221872, 'border_count': 11, 'bagging_temperature': 0.7562857214087447, 'random_strength': 0.495056258630469, 'grow_policy': 'SymmetricTree', 'min_data_in_leaf': 331}. Best is trial 323 with value: 980.8485503758243.[0m
[32m[I 2024-10-13 03:09:55,141][0m Trial 455 finished with value: 1119.4611649120654 and parameters: {'depth': 7, 'learning_rate': 0.021797567112791606, 'iterations': 1332, 'l2_leaf_reg': 0.00018828729448465306, 'border_count': 18, 'bagging_temperature': 0.1497703983692863, 'random_strength': 0.3273460573945614, 'grow_policy': 'SymmetricTree', 'min_data_in_leaf': 295}. Best is trial 323 with value: 980.8485503758243.[0m
[32m[I 2024-10-13 03:09:56,643][0m Trial 456 finished with value: 1402.2855211147535 and parameters: {'depth': 8, 'learning_rate': 0.036221830748410344, 'iterations': 1150, 'l2_leaf_reg': 0.0004431152841730836, 'border_count': 29, 'bagging_temperature': 0.1750292252569489, 'random_strength': 0.0033954671820610465, 'grow_policy': 'Depthwise', 'min_data_in_leaf': 490}. Best is trial 323 with value: 980.8485503758243.[0m
[32m[I 2024-10-13 03:10:14,595][0m Trial 457 finished with value: 1012.5680710059456 and parameters: {'depth': 12, 'learning_rate': 0.013244957636325562, 'iterations': 1573, 'l2_leaf_reg': 0.0002839911260488588, 'border_count': 22, 'bagging_temperature': 0.49930014028309994, 'random_strength': 0.2023285116780115, 'grow_policy': 'SymmetricTree', 'min_data_in_leaf': 303}. Best is trial 323 with value: 980.8485503758243.[0m
[32m[I 2024-10-13 03:10:28,898][0m Trial 458 finished with value: 1249.5261215992175 and parameters: {'depth': 11, 'learning_rate': 0.009838423778985713, 'iterations': 1114, 'l2_leaf_reg': 0.00012258299705400895, 'border_count': 36, 'bagging_temperature': 0.46615955070874343, 'random_strength': 0.34372762243611726, 'grow_policy': 'SymmetricTree', 'min_data_in_leaf': 346}. Best is trial 323 with value: 980.8485503758243.[0m
[32m[I 2024-10-13 03:11:00,155][0m Trial 459 finished with value: 1038.8579891697825 and parameters: {'depth': 12, 'learning_rate': 0.0122824677815286, 'iterations': 2011, 'l2_leaf_reg': 0.0002805807033046171, 'border_count': 23, 'bagging_temperature': 0.4934264078558431, 'random_strength': 0.18223003170694108, 'grow_policy': 'SymmetricTree', 'min_data_in_leaf': 310}. Best is trial 323 with value: 980.8485503758243.[0m
[32m[I 2024-10-13 03:11:24,944][0m Trial 460 finished with value: 1230.920695656204 and parameters: {'depth': 12, 'learning_rate': 0.013257256948222548, 'iterations': 1483, 'l2_leaf_reg': 0.00015535262980874242, 'border_count': 27, 'bagging_temperature': 0.5268024441629204, 'random_strength': 0.49802119624768626, 'grow_policy': 'SymmetricTree', 'min_data_in_leaf': 292}. Best is trial 323 with value: 980.8485503758243.[0m
