[32m[I 2024-10-13 02:43:42,428][0m Trial 257 finished with value: 1257.8748525930032 and parameters: {'depth': 8, 'learning_rate': 0.017006653126262407, 'iterations': 1215, 'l2_leaf_reg': 0.09179042924076124, 'border_count': 38, 'bagging_temperature': 0.27283925539151443, 'random_strength': 0.005469754581320707, 'grow_policy': 'Lossguide', 'min_data_in_leaf': 281, 'max_leaves': 139}. Best is trial 171 with value: 995.4334382975621.[0m
[32m[I 2024-10-13 02:43:48,208][0m Trial 258 finished with value: 1117.8175462967424 and parameters: {'depth': 8, 'learning_rate': 0.01616603278341227, 'iterations': 1070, 'l2_leaf_reg': 0.03922863237770943, 'border_count': 12, 'bagging_temperature': 0.5922502939998754, 'random_strength': 0.010544654847094576, 'grow_policy': 'SymmetricTree', 'min_data_in_leaf': 230}. Best is trial 171 with value: 995.4334382975621.[0m
[32m[I 2024-10-13 02:43:53,706][0m Trial 259 finished with value: 1127.0561665968721 and parameters: {'depth': 7, 'learning_rate': 0.02181343587283312, 'iterations': 1108, 'l2_leaf_reg': 0.05854798838709927, 'border_count': 24, 'bagging_temperature': 0.28937580861535833, 'random_strength': 0.33854592965336594, 'grow_policy': 'SymmetricTree', 'min_data_in_leaf': 195}. Best is trial 171 with value: 995.4334382975621.[0m
[32m[I 2024-10-13 02:44:00,110][0m Trial 260 finished with value: 1231.551938579081 and parameters: {'depth': 8, 'learning_rate': 0.014221495205372652, 'iterations': 1187, 'l2_leaf_reg': 0.017587987502966303, 'border_count': 29, 'bagging_temperature': 0.2520869476043178, 'random_strength': 0.20805126977710311, 'grow_policy': 'SymmetricTree', 'min_data_in_leaf': 262}. Best is trial 171 with value: 995.4334382975621.[0m
[32m[I 2024-10-13 02:44:10,986][0m Trial 261 finished with value: 1274.8804701402448 and parameters: {'depth': 8, 'learning_rate': 0.018191624864582836, 'iterations': 1039, 'l2_leaf_reg': 0.03269722140408075, 'border_count': 124, 'bagging_temperature': 0.9741424822796382, 'random_strength': 0.5291989391488324, 'grow_policy': 'SymmetricTree', 'min_data_in_leaf': 214}. Best is trial 171 with value: 995.4334382975621.[0m
[32m[I 2024-10-13 02:44:20,398][0m Trial 262 finished with value: 1235.5794644586556 and parameters: {'depth': 7, 'learning_rate': 0.01490686724223535, 'iterations': 1242, 'l2_leaf_reg': 0.008178751817325903, 'border_count': 82, 'bagging_temperature': 0.8768761744473883, 'random_strength': 0.007283400444048349, 'grow_policy': 'SymmetricTree', 'min_data_in_leaf': 237}. Best is trial 171 with value: 995.4334382975621.[0m
[32m[I 2024-10-13 02:44:25,231][0m Trial 263 finished with value: 1116.980160173928 and parameters: {'depth': 8, 'learning_rate': 0.010321369985029524, 'iterations': 624, 'l2_leaf_reg': 0.066890155086642, 'border_count': 16, 'bagging_temperature': 0.90391498982589, 'random_strength': 0.393687499080134, 'grow_policy': 'SymmetricTree', 'min_data_in_leaf': 194}. Best is trial 171 with value: 995.4334382975621.[0m
[32m[I 2024-10-13 02:44:30,764][0m Trial 264 finished with value: 1403.8192617815757 and parameters: {'depth': 7, 'learning_rate': 0.019649154344704246, 'iterations': 1154, 'l2_leaf_reg': 0.10934913947837774, 'border_count': 7, 'bagging_temperature': 0.3338369355360697, 'random_strength': 0.19787617715732417, 'grow_policy': 'SymmetricTree', 'min_data_in_leaf': 217}. Best is trial 171 with value: 995.4334382975621.[0m
[32m[I 2024-10-13 02:44:35,991][0m Trial 265 finished with value: 1078.2591373113096 and parameters: {'depth': 7, 'learning_rate': 0.014347484285171871, 'iterations': 955, 'l2_leaf_reg': 0.019220987877067258, 'border_count': 22, 'bagging_temperature': 0.9310880395598891, 'random_strength': 0.5204832697636715, 'grow_policy': 'SymmetricTree', 'min_data_in_leaf': 251}. Best is trial 171 with value: 995.4334382975621.[0m
[32m[I 2024-10-13 02:44:43,111][0m Trial 266 finished with value: 1057.8986642342402 and parameters: {'depth': 8, 'learning_rate': 0.01709153269743557, 'iterations': 1296, 'l2_leaf_reg': 0.032827623474511174, 'border_count': 15, 'bagging_temperature': 0.8659431092574893, 'random_strength': 0.1857560817306354, 'grow_policy': 'SymmetricTree', 'min_data_in_leaf': 272}. Best is trial 171 with value: 995.4334382975621.[0m
[32m[I 2024-10-13 02:44:50,141][0m Trial 267 finished with value: 1228.0065437083897 and parameters: {'depth': 8, 'learning_rate': 0.011649838543751342, 'iterations': 1317, 'l2_leaf_reg': 0.007417833708435116, 'border_count': 12, 'bagging_temperature': 0.8629081468589211, 'random_strength': 0.0018698101807250456, 'grow_policy': 'SymmetricTree', 'min_data_in_leaf': 299}. Best is trial 171 with value: 995.4334382975621.[0m
[32m[I 2024-10-13 02:44:58,201][0m Trial 268 finished with value: 1079.2378586442471 and parameters: {'depth': 8, 'learning_rate': 0.009579908875663332, 'iterations': 1274, 'l2_leaf_reg': 0.046246182129634744, 'border_count': 16, 'bagging_temperature': 0.9007057028154891, 'random_strength': 0.20009875143975117, 'grow_policy': 'SymmetricTree', 'min_data_in_leaf': 274}. Best is trial 171 with value: 995.4334382975621.[0m
[32m[I 2024-10-13 02:45:04,084][0m Trial 269 finished with value: 1521.4496853374217 and parameters: {'depth': 8, 'learning_rate': 0.02353203988557207, 'iterations': 1204, 'l2_leaf_reg': 0.07871931298781021, 'border_count': 5, 'bagging_temperature': 0.8296341606464018, 'random_strength': 0.19129824368066203, 'grow_policy': 'SymmetricTree', 'min_data_in_leaf': 508}. Best is trial 171 with value: 995.4334382975621.[0m
[32m[I 2024-10-13 02:45:10,615][0m Trial 270 finished with value: 1283.8603345263339 and parameters: {'depth': 8, 'learning_rate': 0.01416511134796047, 'iterations': 1090, 'l2_leaf_reg': 0.03548392695997102, 'border_count': 34, 'bagging_temperature': 0.889722122310932, 'random_strength': 0.33826096972282277, 'grow_policy': 'SymmetricTree', 'min_data_in_leaf': 274}. Best is trial 171 with value: 995.4334382975621.[0m
[32m[I 2024-10-13 02:45:14,343][0m Trial 271 finished with value: 1157.2537929978096 and parameters: {'depth': 7, 'learning_rate': 0.016902271090874537, 'iterations': 564, 'l2_leaf_reg': 0.01451188102412303, 'border_count': 26, 'bagging_temperature': 0.8663666559261337, 'random_strength': 0.0034722690752785022, 'grow_policy': 'SymmetricTree', 'min_data_in_leaf': 188}. Best is trial 171 with value: 995.4334382975621.[0m
[32m[I 2024-10-13 02:45:16,807][0m Trial 272 finished with value: 1348.8169454798983 and parameters: {'depth': 8, 'learning_rate': 0.008213821772759599, 'iterations': 2338, 'l2_leaf_reg': 0.12395810412651646, 'border_count': 10, 'bagging_temperature': 0.6650319692673432, 'random_strength': 0.6460710021617557, 'grow_policy': 'Depthwise', 'min_data_in_leaf': 250}. Best is trial 171 with value: 995.4334382975621.[0m
[32m[I 2024-10-13 02:45:22,949][0m Trial 273 finished with value: 1048.928321065913 and parameters: {'depth': 7, 'learning_rate': 0.01127631627948642, 'iterations': 1290, 'l2_leaf_reg': 0.026369203150684264, 'border_count': 17, 'bagging_temperature': 0.977931483909982, 'random_strength': 0.20219258193330703, 'grow_policy': 'SymmetricTree', 'min_data_in_leaf': 210}. Best is trial 171 with value: 995.4334382975621.[0m
[32m[I 2024-10-13 02:45:29,221][0m Trial 274 finished with value: 1098.0691905597555 and parameters: {'depth': 7, 'learning_rate': 0.011403651297461598, 'iterations': 1282, 'l2_leaf_reg': 0.017603575873189267, 'border_count': 15, 'bagging_temperature': 0.9827005854850973, 'random_strength': 0.20677062858342182, 'grow_policy': 'SymmetricTree', 'min_data_in_leaf': 294}. Best is trial 171 with value: 995.4334382975621.[0m
[32m[I 2024-10-13 02:45:35,945][0m Trial 275 finished with value: 1194.7397612099878 and parameters: {'depth': 7, 'learning_rate': 0.012242198480871715, 'iterations': 1327, 'l2_leaf_reg': 0.010097601370466733, 'border_count': 19, 'bagging_temperature': 0.9493461705473323, 'random_strength': 6.028321375183175, 'grow_policy': 'SymmetricTree', 'min_data_in_leaf': 212}. Best is trial 171 with value: 995.4334382975621.[0m
[32m[I 2024-10-13 02:45:41,120][0m Trial 276 finished with value: 1226.6253903949473 and parameters: {'depth': 7, 'learning_rate': 0.01977166849632225, 'iterations': 1154, 'l2_leaf_reg': 0.02412058037679151, 'border_count': 9, 'bagging_temperature': 0.9196948500513664, 'random_strength': 0.21495109691887732, 'grow_policy': 'SymmetricTree', 'min_data_in_leaf': 237}. Best is trial 171 with value: 995.4334382975621.[0m
[32m[I 2024-10-13 02:45:44,967][0m Trial 277 finished with value: 2772.401661230627 and parameters: {'depth': 7, 'learning_rate': 0.015552913361835957, 'iterations': 1036, 'l2_leaf_reg': 0.004768771995111458, 'border_count': 1, 'bagging_temperature': 0.9986191465463353, 'random_strength': 0.0010268464124733936, 'grow_policy': 'SymmetricTree', 'min_data_in_leaf': 265}. Best is trial 171 with value: 995.4334382975621.[0m
[32m[I 2024-10-13 02:45:56,508][0m Trial 278 finished with value: 1270.6193985049251 and parameters: {'depth': 8, 'learning_rate': 0.009959601579015778, 'iterations': 1226, 'l2_leaf_reg': 3.599242608613768e-08, 'border_count': 138, 'bagging_temperature': 0.9597625500502741, 'random_strength': 0.4593530424087897, 'grow_policy': 'SymmetricTree', 'min_data_in_leaf': 209}. Best is trial 171 with value: 995.4334382975621.[0m
[32m[I 2024-10-13 02:45:57,681][0m Trial 279 finished with value: 4461.844035152339 and parameters: {'depth': 7, 'learning_rate': 0.00023352772897316113, 'iterations': 928, 'l2_leaf_reg': 0.007393433991908212, 'border_count': 15, 'bagging_temperature': 0.9730703262265149, 'random_strength': 0.317111092551871, 'grow_policy': 'Lossguide', 'min_data_in_leaf': 347, 'max_leaves': 188}. Best is trial 171 with value: 995.4334382975621.[0m
[32m[I 2024-10-13 02:46:03,742][0m Trial 280 finished with value: 1038.4541436901432 and parameters: {'depth': 8, 'learning_rate': 0.013443012518537772, 'iterations': 1023, 'l2_leaf_reg': 0.04634702005798944, 'border_count': 23, 'bagging_temperature': 0.9363665622502526, 'random_strength': 0.21672470437609795, 'grow_policy': 'SymmetricTree', 'min_data_in_leaf': 186}. Best is trial 171 with value: 995.4334382975621.[0m
[32m[I 2024-10-13 02:46:11,382][0m Trial 281 finished with value: 1171.892534387745 and parameters: {'depth': 9, 'learning_rate': 0.013027869861115511, 'iterations': 1041, 'l2_leaf_reg': 0.046907582561538146, 'border_count': 30, 'bagging_temperature': 0.9435783552878114, 'random_strength': 0.4625955909175454, 'grow_policy': 'SymmetricTree', 'min_data_in_leaf': 183}. Best is trial 171 with value: 995.4334382975621.[0m
[32m[I 2024-10-13 02:46:21,696][0m Trial 282 finished with value: 1274.2019662010628 and parameters: {'depth': 8, 'learning_rate': 0.010781039583813367, 'iterations': 997, 'l2_leaf_reg': 0.05600426889156229, 'border_count': 194, 'bagging_temperature': 0.9396208094678964, 'random_strength': 0.3131875962272235, 'grow_policy': 'SymmetricTree', 'min_data_in_leaf': 157}. Best is trial 171 with value: 995.4334382975621.[0m
[32m[I 2024-10-13 02:46:27,691][0m Trial 283 finished with value: 1195.6202594132526 and parameters: {'depth': 7, 'learning_rate': 0.008230164114743357, 'iterations': 1078, 'l2_leaf_reg': 0.022687095552334134, 'border_count': 22, 'bagging_temperature': 0.9187874425056383, 'random_strength': 4.074491982533171, 'grow_policy': 'SymmetricTree', 'min_data_in_leaf': 188}. Best is trial 171 with value: 995.4334382975621.[0m
[32m[I 2024-10-13 02:46:32,832][0m Trial 284 finished with value: 1244.4969389090409 and parameters: {'depth': 7, 'learning_rate': 0.013980607469793417, 'iterations': 970, 'l2_leaf_reg': 0.012543203931205001, 'border_count': 24, 'bagging_temperature': 0.9638522593033265, 'random_strength': 8.176286060341972, 'grow_policy': 'SymmetricTree', 'min_data_in_leaf': 222}. Best is trial 171 with value: 995.4334382975621.[0m
[32m[I 2024-10-13 02:46:41,247][0m Trial 285 finished with value: 1181.7161075089557 and parameters: {'depth': 9, 'learning_rate': 0.012611489322482575, 'iterations': 1132, 'l2_leaf_reg': 0.005672248533450586, 'border_count': 29, 'bagging_temperature': 0.943202361653514, 'random_strength': 0.16918176267576296, 'grow_policy': 'SymmetricTree', 'min_data_in_leaf': 200}. Best is trial 171 with value: 995.4334382975621.[0m
[32m[I 2024-10-13 02:46:47,790][0m Trial 286 finished with value: 1092.7585445967297 and parameters: {'depth': 8, 'learning_rate': 0.009312320089114832, 'iterations': 899, 'l2_leaf_reg': 0.030589661589562393, 'border_count': 19, 'bagging_temperature': 0.9190662817779898, 'random_strength': 0.5246853664630727, 'grow_policy': 'SymmetricTree', 'min_data_in_leaf': 236}. Best is trial 171 with value: 995.4334382975621.[0m
[32m[I 2024-10-13 02:46:52,122][0m Trial 287 finished with value: 1066.4490736013238 and parameters: {'depth': 7, 'learning_rate': 0.015258666973255001, 'iterations': 735, 'l2_leaf_reg': 0.001924182825470139, 'border_count': 24, 'bagging_temperature': 0.8907036415296734, 'random_strength': 0.14440470100804523, 'grow_policy': 'SymmetricTree', 'min_data_in_leaf': 157}. Best is trial 171 with value: 995.4334382975621.[0m
[32m[I 2024-10-13 02:46:57,459][0m Trial 288 finished with value: 1111.221637304572 and parameters: {'depth': 8, 'learning_rate': 0.010975377955978595, 'iterations': 653, 'l2_leaf_reg': 0.01772356810781152, 'border_count': 19, 'bagging_temperature': 0.9755951265761458, 'random_strength': 0.3974486715689694, 'grow_policy': 'SymmetricTree', 'min_data_in_leaf': 217}. Best is trial 171 with value: 995.4334382975621.[0m
[32m[I 2024-10-13 02:47:04,515][0m Trial 289 finished with value: 1253.8479368368685 and parameters: {'depth': 8, 'learning_rate': 0.013387721824589808, 'iterations': 939, 'l2_leaf_reg': 0.04991800547940297, 'border_count': 34, 'bagging_temperature': 0.2545020292107566, 'random_strength': 0.17523861109776437, 'grow_policy': 'SymmetricTree', 'min_data_in_leaf': 184}. Best is trial 171 with value: 995.4334382975621.[0m
[32m[I 2024-10-13 02:47:09,390][0m Trial 290 finished with value: 1158.4116368766508 and parameters: {'depth': 7, 'learning_rate': 0.018961295624979998, 'iterations': 1018, 'l2_leaf_reg': 0.0012257875957687018, 'border_count': 11, 'bagging_temperature': 0.9122867187904522, 'random_strength': 0.003828024378786682, 'grow_policy': 'SymmetricTree', 'min_data_in_leaf': 578}. Best is trial 171 with value: 995.4334382975621.[0m
[32m[I 2024-10-13 02:47:16,736][0m Trial 291 finished with value: 1269.6204073449594 and parameters: {'depth': 8, 'learning_rate': 0.015850579870065967, 'iterations': 1107, 'l2_leaf_reg': 0.011334026873753691, 'border_count': 26, 'bagging_temperature': 0.9496254858014624, 'random_strength': 7.439210841142234, 'grow_policy': 'SymmetricTree', 'min_data_in_leaf': 243}. Best is trial 171 with value: 995.4334382975621.[0m
[32m[I 2024-10-13 02:47:22,731][0m Trial 292 finished with value: 1118.8258260989664 and parameters: {'depth': 7, 'learning_rate': 0.01164120297745624, 'iterations': 1172, 'l2_leaf_reg': 0.027716971778672567, 'border_count': 20, 'bagging_temperature': 0.6425786263724578, 'random_strength': 0.6590620781081387, 'grow_policy': 'SymmetricTree', 'min_data_in_leaf': 204}. Best is trial 171 with value: 995.4334382975621.[0m
[32m[I 2024-10-13 02:47:36,933][0m Trial 293 finished with value: 1073.0494224788429 and parameters: {'depth': 8, 'learning_rate': 0.022381571567515787, 'iterations': 2409, 'l2_leaf_reg': 0.007640401635982807, 'border_count': 13, 'bagging_temperature': 0.984482652262911, 'random_strength': 0.3436128803512034, 'grow_policy': 'SymmetricTree', 'min_data_in_leaf': 170}. Best is trial 171 with value: 995.4334382975621.[0m
[32m[I 2024-10-13 02:47:41,757][0m Trial 294 finished with value: 1369.4471442831389 and parameters: {'depth': 6, 'learning_rate': 0.013834337936965199, 'iterations': 1221, 'l2_leaf_reg': 0.07779633775825837, 'border_count': 7, 'bagging_temperature': 0.9290739403021789, 'random_strength': 0.1762842083163863, 'grow_policy': 'SymmetricTree', 'min_data_in_leaf': 233}. Best is trial 171 with value: 995.4334382975621.[0m
[32m[I 2024-10-13 02:48:21,269][0m Trial 295 finished with value: 1223.5673629001171 and parameters: {'depth': 12, 'learning_rate': 0.007066225962307529, 'iterations': 817, 'l2_leaf_reg': 0.004655205542984202, 'border_count': 28, 'bagging_temperature': 0.894308425445678, 'random_strength': 0.005464693589193223, 'grow_policy': 'SymmetricTree', 'min_data_in_leaf': 252}. Best is trial 171 with value: 995.4334382975621.[0m
[32m[I 2024-10-13 02:48:22,101][0m Trial 296 finished with value: 1270.1681400365478 and parameters: {'depth': 9, 'learning_rate': 0.009909075273588575, 'iterations': 446, 'l2_leaf_reg': 0.04457167889132729, 'border_count': 17, 'bagging_temperature': 0.9134853587878454, 'random_strength': 0.49491142761086415, 'grow_policy': 'Depthwise', 'min_data_in_leaf': 219}. Best is trial 171 with value: 995.4334382975621.[0m
[32m[I 2024-10-13 02:48:28,980][0m Trial 297 finished with value: 1234.4552925488883 and parameters: {'depth': 8, 'learning_rate': 0.017862406674657435, 'iterations': 1025, 'l2_leaf_reg': 0.0161306866979731, 'border_count': 38, 'bagging_temperature': 0.7005141720147219, 'random_strength': 0.005515746175623282, 'grow_policy': 'SymmetricTree', 'min_data_in_leaf': 194}. Best is trial 171 with value: 995.4334382975621.[0m
[32m[I 2024-10-13 02:48:33,527][0m Trial 298 finished with value: 1070.3655434653474 and parameters: {'depth': 7, 'learning_rate': 0.011614458913096145, 'iterations': 896, 'l2_leaf_reg': 0.023847470310136242, 'border_count': 23, 'bagging_temperature': 0.28715867897900227, 'random_strength': 0.3191021291737153, 'grow_policy': 'SymmetricTree', 'min_data_in_leaf': 148}. Best is trial 171 with value: 995.4334382975621.[0m
[32m[I 2024-10-13 02:48:39,224][0m Trial 299 finished with value: 1163.865150254312 and parameters: {'depth': 6, 'learning_rate': 0.008717059918744685, 'iterations': 1355, 'l2_leaf_reg': 0.0021172488666313435, 'border_count': 13, 'bagging_temperature': 0.959708751377001, 'random_strength': 0.6872955153049672, 'grow_policy': 'SymmetricTree', 'min_data_in_leaf': 178}. Best is trial 171 with value: 995.4334382975621.[0m
[32m[I 2024-10-13 02:48:46,168][0m Trial 300 finished with value: 1188.3232355503562 and parameters: {'depth': 9, 'learning_rate': 0.01519992077383303, 'iterations': 968, 'l2_leaf_reg': 0.11049728918539824, 'border_count': 28, 'bagging_temperature': 0.8928626027776562, 'random_strength': 0.32010057496288513, 'grow_policy': 'SymmetricTree', 'min_data_in_leaf': 131}. Best is trial 171 with value: 995.4334382975621.[0m
[32m[I 2024-10-13 02:48:57,345][0m Trial 301 finished with value: 1299.8780870152307 and parameters: {'depth': 8, 'learning_rate': 0.025383775460107914, 'iterations': 1257, 'l2_leaf_reg': 0.033415827465535744, 'border_count': 241, 'bagging_temperature': 0.23366567863176396, 'random_strength': 0.19155347797942845, 'grow_policy': 'SymmetricTree', 'min_data_in_leaf': 217}. Best is trial 171 with value: 995.4334382975621.[0m
[32m[I 2024-10-13 02:48:58,680][0m Trial 302 finished with value: 1202.236335582905 and parameters: {'depth': 7, 'learning_rate': 0.013306947027619944, 'iterations': 1069, 'l2_leaf_reg': 0.06583988700384683, 'border_count': 21, 'bagging_temperature': 0.2682894318267362, 'random_strength': 2.9424762789717733, 'grow_policy': 'Lossguide', 'min_data_in_leaf': 253, 'max_leaves': 97}. Best is trial 171 with value: 995.4334382975621.[0m
[32m[I 2024-10-13 02:49:02,159][0m Trial 303 finished with value: 1349.8143248872989 and parameters: {'depth': 6, 'learning_rate': 0.018461233770727586, 'iterations': 754, 'l2_leaf_reg': 0.011060926245237144, 'border_count': 7, 'bagging_temperature': 0.8328766677805848, 'random_strength': 0.5754246395185837, 'grow_policy': 'SymmetricTree', 'min_data_in_leaf': 200}. Best is trial 171 with value: 995.4334382975621.[0m
[32m[I 2024-10-13 02:49:40,342][0m Trial 304 finished with value: 1263.3643874881327 and parameters: {'depth': 10, 'learning_rate': 0.010749671673545116, 'iterations': 2226, 'l2_leaf_reg': 0.0007140961049120782, 'border_count': 159, 'bagging_temperature': 0.9313369600308131, 'random_strength': 0.1777323931880062, 'grow_policy': 'SymmetricTree', 'min_data_in_leaf': 229}. Best is trial 171 with value: 995.4334382975621.[0m
[32m[I 2024-10-13 02:49:49,496][0m Trial 305 finished with value: 1321.6329278977396 and parameters: {'depth': 9, 'learning_rate': 0.016360503821116246, 'iterations': 1135, 'l2_leaf_reg': 0.003411308975250228, 'border_count': 43, 'bagging_temperature': 0.8757762854451627, 'random_strength': 0.4464399606803423, 'grow_policy': 'SymmetricTree', 'min_data_in_leaf': 165}. Best is trial 171 with value: 995.4334382975621.[0m
[32m[I 2024-10-13 02:49:50,475][0m Trial 306 finished with value: 1097.8388861612198 and parameters: {'depth': 3, 'learning_rate': 0.020878003899553233, 'iterations': 494, 'l2_leaf_reg': 0.020153443705053786, 'border_count': 17, 'bagging_temperature': 0.9136794533698307, 'random_strength': 0.008879067521200212, 'grow_policy': 'SymmetricTree', 'min_data_in_leaf': 823}. Best is trial 171 with value: 995.4334382975621.[0m
[32m[I 2024-10-13 02:49:57,088][0m Trial 307 finished with value: 1268.5780872114053 and parameters: {'depth': 8, 'learning_rate': 0.012968342595266349, 'iterations': 591, 'l2_leaf_reg': 0.006473575618969198, 'border_count': 104, 'bagging_temperature': 0.9908652052474071, 'random_strength': 0.32381818381308636, 'grow_policy': 'SymmetricTree', 'min_data_in_leaf': 206}. Best is trial 171 with value: 995.4334382975621.[0m
