[32m[I 2024-10-13 03:56:22,466][0m Trial 716 finished with value: 1258.2237337688541 and parameters: {'depth': 11, 'learning_rate': 0.022451186632777006, 'iterations': 1470, 'l2_leaf_reg': 0.02046900274282437, 'border_count': 36, 'bagging_temperature': 0.36458441242631306, 'random_strength': 0.31655232816401485, 'grow_policy': 'SymmetricTree', 'min_data_in_leaf': 665}. Best is trial 575 with value: 965.9974213974682.[0m
[32m[I 2024-10-13 03:56:38,526][0m Trial 717 finished with value: 1045.4047025651369 and parameters: {'depth': 11, 'learning_rate': 0.027615636397773497, 'iterations': 1383, 'l2_leaf_reg': 0.05072158289934672, 'border_count': 22, 'bagging_temperature': 0.28554899044999843, 'random_strength': 0.34416980149345006, 'grow_policy': 'SymmetricTree', 'min_data_in_leaf': 677}. Best is trial 575 with value: 965.9974213974682.[0m
[32m[I 2024-10-13 03:56:44,315][0m Trial 718 finished with value: 1203.1213542338462 and parameters: {'depth': 7, 'learning_rate': 0.020154998187631033, 'iterations': 1351, 'l2_leaf_reg': 0.11526494223050994, 'border_count': 26, 'bagging_temperature': 0.2547926923134836, 'random_strength': 0.7013113699863673, 'grow_policy': 'SymmetricTree', 'min_data_in_leaf': 680}. Best is trial 575 with value: 965.9974213974682.[0m
[32m[I 2024-10-13 03:56:51,611][0m Trial 719 finished with value: 1028.835034595468 and parameters: {'depth': 7, 'learning_rate': 0.021759435815535706, 'iterations': 1520, 'l2_leaf_reg': 0.06523633599381369, 'border_count': 19, 'bagging_temperature': 0.315490884153254, 'random_strength': 0.19142495744600407, 'grow_policy': 'SymmetricTree', 'min_data_in_leaf': 708}. Best is trial 575 with value: 965.9974213974682.[0m
[32m[I 2024-10-13 03:57:06,775][0m Trial 720 finished with value: 1248.8276292652547 and parameters: {'depth': 12, 'learning_rate': 0.03326112085330159, 'iterations': 1395, 'l2_leaf_reg': 0.20152517921621957, 'border_count': 31, 'bagging_temperature': 0.2819374653090241, 'random_strength': 1.1694035191478291, 'grow_policy': 'SymmetricTree', 'min_data_in_leaf': 612}. Best is trial 575 with value: 965.9974213974682.[0m
[32m[I 2024-10-13 03:57:13,355][0m Trial 721 finished with value: 1216.9742883923664 and parameters: {'depth': 6, 'learning_rate': 0.02882793484208053, 'iterations': 1455, 'l2_leaf_reg': 0.0316597362089335, 'border_count': 25, 'bagging_temperature': 0.2656152861001884, 'random_strength': 0.4474428207269837, 'grow_policy': 'SymmetricTree', 'min_data_in_leaf': 205}. Best is trial 575 with value: 965.9974213974682.[0m
[32m[I 2024-10-13 03:57:18,991][0m Trial 722 finished with value: 1108.7914519597216 and parameters: {'depth': 6, 'learning_rate': 0.01759018457891348, 'iterations': 1257, 'l2_leaf_reg': 0.015410855574767285, 'border_count': 18, 'bagging_temperature': 0.2362952563763777, 'random_strength': 0.1945931242914403, 'grow_policy': 'SymmetricTree', 'min_data_in_leaf': 624}. Best is trial 575 with value: 965.9974213974682.[0m
[32m[I 2024-10-13 03:57:25,570][0m Trial 723 finished with value: 1153.3045217859374 and parameters: {'depth': 8, 'learning_rate': 0.05944237613363338, 'iterations': 1327, 'l2_leaf_reg': 0.09634358888348851, 'border_count': 22, 'bagging_temperature': 0.17135483612540378, 'random_strength': 0.49914516586418767, 'grow_policy': 'SymmetricTree', 'min_data_in_leaf': 164}. Best is trial 575 with value: 965.9974213974682.[0m
[32m[I 2024-10-13 03:57:43,967][0m Trial 724 finished with value: 1028.541644823623 and parameters: {'depth': 11, 'learning_rate': 0.024283405904829913, 'iterations': 1678, 'l2_leaf_reg': 0.029848212226511364, 'border_count': 14, 'bagging_temperature': 0.3452362321341686, 'random_strength': 0.17494036059616855, 'grow_policy': 'SymmetricTree', 'min_data_in_leaf': 230}. Best is trial 575 with value: 965.9974213974682.[0m
[32m[I 2024-10-13 03:57:51,675][0m Trial 725 finished with value: 1287.8553985428073 and parameters: {'depth': 7, 'learning_rate': 0.015158988871687703, 'iterations': 1437, 'l2_leaf_reg': 0.06275505519637788, 'border_count': 38, 'bagging_temperature': 0.30274301326875075, 'random_strength': 0.3578656543859274, 'grow_policy': 'SymmetricTree', 'min_data_in_leaf': 594}. Best is trial 575 with value: 965.9974213974682.[0m
[32m[I 2024-10-13 03:57:57,905][0m Trial 726 finished with value: 1236.2500634207815 and parameters: {'depth': 7, 'learning_rate': 0.020021474622555872, 'iterations': 1343, 'l2_leaf_reg': 0.009135990419344523, 'border_count': 29, 'bagging_temperature': 0.14579857733429813, 'random_strength': 0.7861249475899924, 'grow_policy': 'SymmetricTree', 'min_data_in_leaf': 192}. Best is trial 575 with value: 965.9974213974682.[0m
[32m[I 2024-10-13 03:57:59,714][0m Trial 727 finished with value: 1128.848688712651 and parameters: {'depth': 8, 'learning_rate': 0.039938777800638245, 'iterations': 1536, 'l2_leaf_reg': 0.020368700204156178, 'border_count': 20, 'bagging_temperature': 0.38780681010618406, 'random_strength': 0.1422200183877776, 'grow_policy': 'Depthwise', 'min_data_in_leaf': 216}. Best is trial 575 with value: 965.9974213974682.[0m
[32m[I 2024-10-13 03:58:08,604][0m Trial 728 finished with value: 1118.2839206135118 and parameters: {'depth': 9, 'learning_rate': 0.01324755190294227, 'iterations': 1374, 'l2_leaf_reg': 0.03840205457739342, 'border_count': 12, 'bagging_temperature': 0.22575420764144288, 'random_strength': 0.002811002404936672, 'grow_policy': 'SymmetricTree', 'min_data_in_leaf': 241}. Best is trial 575 with value: 965.9974213974682.[0m
[32m[I 2024-10-13 03:58:16,514][0m Trial 729 finished with value: 1189.4089903624485 and parameters: {'depth': 7, 'learning_rate': 0.01696841138345303, 'iterations': 1604, 'l2_leaf_reg': 0.1370239988067416, 'border_count': 26, 'bagging_temperature': 0.9010571633676541, 'random_strength': 0.610542585337718, 'grow_policy': 'SymmetricTree', 'min_data_in_leaf': 105}. Best is trial 575 with value: 965.9974213974682.[0m
[32m[I 2024-10-13 03:58:25,395][0m Trial 730 finished with value: 1245.0753574760877 and parameters: {'depth': 9, 'learning_rate': 0.023466445392052986, 'iterations': 1238, 'l2_leaf_reg': 0.07138828496329828, 'border_count': 33, 'bagging_temperature': 0.19372708743181816, 'random_strength': 0.34958979510131666, 'grow_policy': 'SymmetricTree', 'min_data_in_leaf': 167}. Best is trial 575 with value: 965.9974213974682.[0m
[32m[I 2024-10-13 03:58:32,663][0m Trial 731 finished with value: 1309.349039594595 and parameters: {'depth': 8, 'learning_rate': 0.02766835585746753, 'iterations': 910, 'l2_leaf_reg': 0.03998842393350811, 'border_count': 48, 'bagging_temperature': 0.2514785268104373, 'random_strength': 0.002355199106502718, 'grow_policy': 'SymmetricTree', 'min_data_in_leaf': 179}. Best is trial 575 with value: 965.9974213974682.[0m
[32m[I 2024-10-13 03:58:39,491][0m Trial 732 finished with value: 1166.556953963047 and parameters: {'depth': 8, 'learning_rate': 0.011731302694057618, 'iterations': 1311, 'l2_leaf_reg': 0.23555434104262649, 'border_count': 17, 'bagging_temperature': 0.18060036084722944, 'random_strength': 1.0347084352835032, 'grow_policy': 'SymmetricTree', 'min_data_in_leaf': 623}. Best is trial 575 with value: 965.9974213974682.[0m
[32m[I 2024-10-13 03:59:00,863][0m Trial 733 finished with value: 1170.944753693985 and parameters: {'depth': 12, 'learning_rate': 0.019326965210898103, 'iterations': 1422, 'l2_leaf_reg': 0.006042129753387817, 'border_count': 22, 'bagging_temperature': 0.8652537601517708, 'random_strength': 4.347274290432259, 'grow_policy': 'SymmetricTree', 'min_data_in_leaf': 209}. Best is trial 575 with value: 965.9974213974682.[0m
[32m[I 2024-10-13 03:59:02,728][0m Trial 734 finished with value: 1345.3296400899287 and parameters: {'depth': 11, 'learning_rate': 0.01447180169166581, 'iterations': 1484, 'l2_leaf_reg': 0.02320934393496403, 'border_count': 10, 'bagging_temperature': 0.9248286431394694, 'random_strength': 0.18976671732875022, 'grow_policy': 'Lossguide', 'min_data_in_leaf': 768, 'max_leaves': 129}. Best is trial 575 with value: 965.9974213974682.[0m
[32m[I 2024-10-13 03:59:09,112][0m Trial 735 finished with value: 1246.0392144149728 and parameters: {'depth': 7, 'learning_rate': 0.03611861034165484, 'iterations': 1204, 'l2_leaf_reg': 0.012914291340582681, 'border_count': 29, 'bagging_temperature': 0.6559752777535903, 'random_strength': 0.5241719119311078, 'grow_policy': 'SymmetricTree', 'min_data_in_leaf': 649}. Best is trial 575 with value: 965.9974213974682.[0m
[32m[I 2024-10-13 03:59:16,084][0m Trial 736 finished with value: 1045.3916944720233 and parameters: {'depth': 7, 'learning_rate': 0.017125756852949654, 'iterations': 1294, 'l2_leaf_reg': 0.09785640162591605, 'border_count': 15, 'bagging_temperature': 0.2965083969916109, 'random_strength': 0.0013147939543965426, 'grow_policy': 'SymmetricTree', 'min_data_in_leaf': 240}. Best is trial 575 with value: 965.9974213974682.[0m
[32m[I 2024-10-13 03:59:22,348][0m Trial 737 finished with value: 1091.4519631101869 and parameters: {'depth': 9, 'learning_rate': 0.023329473695231147, 'iterations': 873, 'l2_leaf_reg': 0.04439547447702555, 'border_count': 24, 'bagging_temperature': 0.11876892182356466, 'random_strength': 0.32050180504701176, 'grow_policy': 'SymmetricTree', 'min_data_in_leaf': 590}. Best is trial 575 with value: 965.9974213974682.[0m
[32m[I 2024-10-13 03:59:28,720][0m Trial 738 finished with value: 1024.2869678672512 and parameters: {'depth': 6, 'learning_rate': 0.013957503855353178, 'iterations': 1376, 'l2_leaf_reg': 0.02673196586956159, 'border_count': 19, 'bagging_temperature': 0.21836108786456182, 'random_strength': 0.2010004314490578, 'grow_policy': 'SymmetricTree', 'min_data_in_leaf': 133}. Best is trial 575 with value: 965.9974213974682.[0m
[32m[I 2024-10-13 03:59:35,565][0m Trial 739 finished with value: 1210.2578890084208 and parameters: {'depth': 8, 'learning_rate': 0.011557475861161876, 'iterations': 987, 'l2_leaf_reg': 0.09658598106261654, 'border_count': 27, 'bagging_temperature': 0.8903728810414351, 'random_strength': 0.3352251282536225, 'grow_policy': 'SymmetricTree', 'min_data_in_leaf': 216}. Best is trial 575 with value: 965.9974213974682.[0m
[32m[I 2024-10-13 04:00:13,075][0m Trial 740 finished with value: 1307.4508783014119 and parameters: {'depth': 13, 'learning_rate': 0.03171833772834114, 'iterations': 1269, 'l2_leaf_reg': 0.06193263024416178, 'border_count': 41, 'bagging_temperature': 0.27672950522383594, 'random_strength': 0.5040638235057042, 'grow_policy': 'SymmetricTree', 'min_data_in_leaf': 178}. Best is trial 575 with value: 965.9974213974682.[0m
[32m[I 2024-10-13 04:00:20,601][0m Trial 741 finished with value: 1423.273494887479 and parameters: {'depth': 11, 'learning_rate': 0.04921206956889057, 'iterations': 1342, 'l2_leaf_reg': 0.01539727869730754, 'border_count': 8, 'bagging_temperature': 0.32506028128823816, 'random_strength': 0.7173486986736994, 'grow_policy': 'SymmetricTree', 'min_data_in_leaf': 196}. Best is trial 575 with value: 965.9974213974682.[0m
[32m[I 2024-10-13 04:00:33,328][0m Trial 742 finished with value: 1053.0118718713222 and parameters: {'depth': 11, 'learning_rate': 0.02053536644175575, 'iterations': 1440, 'l2_leaf_reg': 0.14785617127124087, 'border_count': 15, 'bagging_temperature': 0.67713665209834, 'random_strength': 0.18463951011894014, 'grow_policy': 'SymmetricTree', 'min_data_in_leaf': 250}. Best is trial 575 with value: 965.9974213974682.[0m
[32m[I 2024-10-13 04:00:38,183][0m Trial 743 finished with value: 1109.0458663423685 and parameters: {'depth': 8, 'learning_rate': 0.01620854205830081, 'iterations': 933, 'l2_leaf_reg': 0.045916079619483775, 'border_count': 22, 'bagging_temperature': 0.16378804569171362, 'random_strength': 0.33867772644806776, 'grow_policy': 'SymmetricTree', 'min_data_in_leaf': 591}. Best is trial 575 with value: 965.9974213974682.[0m
[32m[I 2024-10-13 04:00:44,456][0m Trial 744 finished with value: 1215.357719227091 and parameters: {'depth': 9, 'learning_rate': 0.07982597091946436, 'iterations': 1039, 'l2_leaf_reg': 0.0711035522010749, 'border_count': 33, 'bagging_temperature': 0.26386325356830476, 'random_strength': 0.002852696940734898, 'grow_policy': 'SymmetricTree', 'min_data_in_leaf': 230}. Best is trial 575 with value: 965.9974213974682.[0m
[32m[I 2024-10-13 04:00:47,884][0m Trial 745 finished with value: 1042.3309539431907 and parameters: {'depth': 7, 'learning_rate': 0.201410438918979, 'iterations': 591, 'l2_leaf_reg': 0.02365866332810891, 'border_count': 19, 'bagging_temperature': 0.20197815026213317, 'random_strength': 0.1782874689374777, 'grow_policy': 'SymmetricTree', 'min_data_in_leaf': 642}. Best is trial 575 with value: 965.9974213974682.[0m
[32m[I 2024-10-13 04:00:53,452][0m Trial 746 finished with value: 1191.1270469161357 and parameters: {'depth': 12, 'learning_rate': 0.025571891847283583, 'iterations': 482, 'l2_leaf_reg': 0.03334482283490181, 'border_count': 26, 'bagging_temperature': 0.85314532673178, 'random_strength': 0.5689732033476678, 'grow_policy': 'SymmetricTree', 'min_data_in_leaf': 148}. Best is trial 575 with value: 965.9974213974682.[0m
[32m[I 2024-10-13 04:00:59,346][0m Trial 747 finished with value: 1246.1118186623585 and parameters: {'depth': 7, 'learning_rate': 0.012847868598710354, 'iterations': 1218, 'l2_leaf_reg': 0.0077096225521704476, 'border_count': 12, 'bagging_temperature': 0.14070062515246295, 'random_strength': 0.3617201831091655, 'grow_policy': 'SymmetricTree', 'min_data_in_leaf': 572}. Best is trial 575 with value: 965.9974213974682.[0m
[32m[I 2024-10-13 04:01:07,231][0m Trial 748 finished with value: 1497.883893237741 and parameters: {'depth': 9, 'learning_rate': 0.020033140040267027, 'iterations': 1508, 'l2_leaf_reg': 0.05592135504777704, 'border_count': 5, 'bagging_temperature': 0.9124676880481083, 'random_strength': 0.1698081145795615, 'grow_policy': 'SymmetricTree', 'min_data_in_leaf': 686}. Best is trial 575 with value: 965.9974213974682.[0m
[32m[I 2024-10-13 04:01:09,100][0m Trial 749 finished with value: 1303.4192260215095 and parameters: {'depth': 8, 'learning_rate': 0.01072332969840917, 'iterations': 1577, 'l2_leaf_reg': 0.0897279250121889, 'border_count': 76, 'bagging_temperature': 0.2366181641625924, 'random_strength': 0.908398998561692, 'grow_policy': 'Depthwise', 'min_data_in_leaf': 615}. Best is trial 575 with value: 965.9974213974682.[0m
[32m[I 2024-10-13 04:01:10,326][0m Trial 750 finished with value: 1194.790382053371 and parameters: {'depth': 8, 'learning_rate': 0.016240192724270856, 'iterations': 334, 'l2_leaf_reg': 0.2818208523875244, 'border_count': 21, 'bagging_temperature': 0.2997626636169697, 'random_strength': 0.002116585698876166, 'grow_policy': 'SymmetricTree', 'min_data_in_leaf': 201}. Best is trial 575 with value: 965.9974213974682.[0m
[32m[I 2024-10-13 04:01:24,807][0m Trial 751 finished with value: 1300.1309717036308 and parameters: {'depth': 10, 'learning_rate': 0.02794568523987661, 'iterations': 1298, 'l2_leaf_reg': 0.015401524310077713, 'border_count': 31, 'bagging_temperature': 0.8799476477779143, 'random_strength': 0.4983854999065602, 'grow_policy': 'SymmetricTree', 'min_data_in_leaf': 222}. Best is trial 575 with value: 965.9974213974682.[0m
[32m[I 2024-10-13 04:01:30,995][0m Trial 752 finished with value: 1083.9518392679968 and parameters: {'depth': 7, 'learning_rate': 0.013906006623733331, 'iterations': 1149, 'l2_leaf_reg': 0.14875831968571107, 'border_count': 16, 'bagging_temperature': 0.6277371639057601, 'random_strength': 0.3009566643016605, 'grow_policy': 'SymmetricTree', 'min_data_in_leaf': 254}. Best is trial 575 with value: 965.9974213974682.[0m
[32m[I 2024-10-13 04:02:23,700][0m Trial 753 finished with value: 1194.3550586670324 and parameters: {'depth': 14, 'learning_rate': 0.022577653338220992, 'iterations': 1405, 'l2_leaf_reg': 0.037119947388064185, 'border_count': 24, 'bagging_temperature': 0.7100492218081941, 'random_strength': 3.277085430497277, 'grow_policy': 'SymmetricTree', 'min_data_in_leaf': 606}. Best is trial 575 with value: 965.9974213974682.[0m
[32m[I 2024-10-13 04:02:28,922][0m Trial 754 finished with value: 1273.3266651095128 and parameters: {'depth': 9, 'learning_rate': 0.01823658965923018, 'iterations': 1010, 'l2_leaf_reg': 0.02158429139648907, 'border_count': 11, 'bagging_temperature': 0.2160232834616696, 'random_strength': 0.6990654626621335, 'grow_policy': 'SymmetricTree', 'min_data_in_leaf': 164}. Best is trial 575 with value: 965.9974213974682.[0m
[32m[I 2024-10-13 04:02:38,977][0m Trial 755 finished with value: 1072.734847711042 and parameters: {'depth': 11, 'learning_rate': 0.011954993069882198, 'iterations': 911, 'l2_leaf_reg': 0.06874611908789226, 'border_count': 17, 'bagging_temperature': 0.18715030076842473, 'random_strength': 0.20732244146328374, 'grow_policy': 'SymmetricTree', 'min_data_in_leaf': 60}. Best is trial 575 with value: 965.9974213974682.[0m
[32m[I 2024-10-13 04:02:44,170][0m Trial 756 finished with value: 1265.1389047933349 and parameters: {'depth': 7, 'learning_rate': 0.015617887616038644, 'iterations': 1243, 'l2_leaf_reg': 0.04696804916842031, 'border_count': 27, 'bagging_temperature': 0.16271298335318457, 'random_strength': 0.4143012354465784, 'grow_policy': 'SymmetricTree', 'min_data_in_leaf': 188}. Best is trial 575 with value: 965.9974213974682.[0m
[32m[I 2024-10-13 04:02:45,756][0m Trial 757 finished with value: 1143.859622409149 and parameters: {'depth': 9, 'learning_rate': 0.033919969403672215, 'iterations': 1372, 'l2_leaf_reg': 0.10604239744506105, 'border_count': 20, 'bagging_temperature': 0.24653014119242017, 'random_strength': 0.16855774992882477, 'grow_policy': 'Lossguide', 'min_data_in_leaf': 564, 'max_leaves': 105}. Best is trial 575 with value: 965.9974213974682.[0m
[32m[I 2024-10-13 04:03:04,407][0m Trial 758 finished with value: 1208.8940475371653 and parameters: {'depth': 10, 'learning_rate': 0.010184775989639702, 'iterations': 1156, 'l2_leaf_reg': 0.010315539894771377, 'border_count': 34, 'bagging_temperature': 0.26881926183133087, 'random_strength': 0.00420118266425774, 'grow_policy': 'SymmetricTree', 'min_data_in_leaf': 133}. Best is trial 575 with value: 965.9974213974682.[0m
[32m[I 2024-10-13 04:03:12,749][0m Trial 759 finished with value: 1009.4399605905734 and parameters: {'depth': 8, 'learning_rate': 0.019202497349337152, 'iterations': 1465, 'l2_leaf_reg': 0.005570765497650691, 'border_count': 23, 'bagging_temperature': 0.9366968997800981, 'random_strength': 0.17952300272820898, 'grow_policy': 'SymmetricTree', 'min_data_in_leaf': 236}. Best is trial 575 with value: 965.9974213974682.[0m
[32m[I 2024-10-13 04:03:27,742][0m Trial 760 finished with value: 1254.9466970538972 and parameters: {'depth': 8, 'learning_rate': 0.02151542830717317, 'iterations': 1516, 'l2_leaf_reg': 0.00451334968772058, 'border_count': 106, 'bagging_temperature': 0.9351284295554635, 'random_strength': 0.0007590600886056352, 'grow_policy': 'SymmetricTree', 'min_data_in_leaf': 845}. Best is trial 575 with value: 965.9974213974682.[0m
[32m[I 2024-10-13 04:03:38,589][0m Trial 761 finished with value: 1149.4812867561084 and parameters: {'depth': 8, 'learning_rate': 0.02457926961360808, 'iterations': 1568, 'l2_leaf_reg': 0.006213908564406911, 'border_count': 28, 'bagging_temperature': 0.9339320256896342, 'random_strength': 0.35965824628232845, 'grow_policy': 'SymmetricTree', 'min_data_in_leaf': 550}. Best is trial 575 with value: 965.9974213974682.[0m
[32m[I 2024-10-13 04:03:45,939][0m Trial 762 finished with value: 1244.3683508869144 and parameters: {'depth': 8, 'learning_rate': 0.01962129865963471, 'iterations': 1451, 'l2_leaf_reg': 0.0044799695639442605, 'border_count': 39, 'bagging_temperature': 0.28966598915550223, 'random_strength': 0.48461019051053766, 'grow_policy': 'SymmetricTree', 'min_data_in_leaf': 236}. Best is trial 575 with value: 965.9974213974682.[0m
[32m[I 2024-10-13 04:03:53,206][0m Trial 763 finished with value: 1103.9202307462929 and parameters: {'depth': 8, 'learning_rate': 0.027840655227115055, 'iterations': 1480, 'l2_leaf_reg': 0.002961451157465305, 'border_count': 24, 'bagging_temperature': 0.31130732791110866, 'random_strength': 0.18307307208710927, 'grow_policy': 'SymmetricTree', 'min_data_in_leaf': 577}. Best is trial 575 with value: 965.9974213974682.[0m
[32m[I 2024-10-13 04:04:01,159][0m Trial 764 finished with value: 1193.2263631827648 and parameters: {'depth': 8, 'learning_rate': 0.017562435884856085, 'iterations': 1620, 'l2_leaf_reg': 0.006294239423996116, 'border_count': 15, 'bagging_temperature': 0.33292765604486907, 'random_strength': 2.086745954179208, 'grow_policy': 'SymmetricTree', 'min_data_in_leaf': 209}. Best is trial 575 with value: 965.9974213974682.[0m
[32m[I 2024-10-13 04:04:09,967][0m Trial 765 finished with value: 1257.9256689141152 and parameters: {'depth': 8, 'learning_rate': 0.0207561387627985, 'iterations': 1502, 'l2_leaf_reg': 0.00429523742630615, 'border_count': 31, 'bagging_temperature': 0.42219586108790663, 'random_strength': 0.6487136658040003, 'grow_policy': 'SymmetricTree', 'min_data_in_leaf': 253}. Best is trial 575 with value: 965.9974213974682.[0m
[32m[I 2024-10-13 04:04:16,862][0m Trial 766 finished with value: 994.2707118986344 and parameters: {'depth': 8, 'learning_rate': 0.02258668928879652, 'iterations': 1423, 'l2_leaf_reg': 0.0034808436735947663, 'border_count': 22, 'bagging_temperature': 0.22429880341553093, 'random_strength': 0.17002074698678327, 'grow_policy': 'SymmetricTree', 'min_data_in_leaf': 175}. Best is trial 575 with value: 965.9974213974682.[0m
