[32m[I 2024-10-13 04:47:43,684][0m Trial 971 finished with value: 1289.6419681765965 and parameters: {'depth': 10, 'learning_rate': 0.0151021190805036, 'iterations': 1755, 'l2_leaf_reg': 0.009282622088349065, 'border_count': 6, 'bagging_temperature': 0.6796515435216979, 'random_strength': 0.002467727714649123, 'grow_policy': 'SymmetricTree', 'min_data_in_leaf': 531}. Best is trial 575 with value: 965.9974213974682.[0m
[32m[I 2024-10-13 04:47:49,606][0m Trial 972 finished with value: 1239.6858383523202 and parameters: {'depth': 8, 'learning_rate': 0.011139737623276743, 'iterations': 1295, 'l2_leaf_reg': 0.027748054576329107, 'border_count': 12, 'bagging_temperature': 0.2194317131776778, 'random_strength': 0.4820825528548276, 'grow_policy': 'SymmetricTree', 'min_data_in_leaf': 553}. Best is trial 575 with value: 965.9974213974682.[0m
[32m[I 2024-10-13 04:47:51,376][0m Trial 973 finished with value: 1294.7614898353997 and parameters: {'depth': 11, 'learning_rate': 0.02448477518812027, 'iterations': 1611, 'l2_leaf_reg': 0.07470644614848558, 'border_count': 63, 'bagging_temperature': 0.28048220163414567, 'random_strength': 0.1907363745389921, 'grow_policy': 'Depthwise', 'min_data_in_leaf': 555}. Best is trial 575 with value: 965.9974213974682.[0m
[32m[I 2024-10-13 04:47:57,491][0m Trial 974 finished with value: 1334.8635372849656 and parameters: {'depth': 7, 'learning_rate': 0.016838564383836723, 'iterations': 1376, 'l2_leaf_reg': 0.01850945426607096, 'border_count': 39, 'bagging_temperature': 0.20003553554478642, 'random_strength': 0.7426877941564723, 'grow_policy': 'SymmetricTree', 'min_data_in_leaf': 585}. Best is trial 575 with value: 965.9974213974682.[0m
[32m[I 2024-10-13 04:48:03,986][0m Trial 975 finished with value: 1225.5383633442427 and parameters: {'depth': 6, 'learning_rate': 0.012659808979992877, 'iterations': 1482, 'l2_leaf_reg': 0.0065366436350804205, 'border_count': 32, 'bagging_temperature': 0.9920063746435805, 'random_strength': 1.1862464536123123, 'grow_policy': 'SymmetricTree', 'min_data_in_leaf': 611}. Best is trial 575 with value: 965.9974213974682.[0m
[32m[I 2024-10-13 04:48:20,064][0m Trial 976 finished with value: 1306.1107667830934 and parameters: {'depth': 10, 'learning_rate': 0.021671453710500378, 'iterations': 752, 'l2_leaf_reg': 0.04306599700459816, 'border_count': 234, 'bagging_temperature': 0.25440408346020615, 'random_strength': 0.31861418200376534, 'grow_policy': 'SymmetricTree', 'min_data_in_leaf': 630}. Best is trial 575 with value: 965.9974213974682.[0m
[32m[I 2024-10-13 04:48:25,569][0m Trial 977 finished with value: 1083.7028376757737 and parameters: {'depth': 7, 'learning_rate': 0.03320991475462256, 'iterations': 1125, 'l2_leaf_reg': 0.0029488889609601927, 'border_count': 19, 'bagging_temperature': 0.7751268390194824, 'random_strength': 0.005223973795591717, 'grow_policy': 'SymmetricTree', 'min_data_in_leaf': 572}. Best is trial 575 with value: 965.9974213974682.[0m
[32m[I 2024-10-13 04:48:43,945][0m Trial 978 finished with value: 1139.9697207165798 and parameters: {'depth': 12, 'learning_rate': 0.018364873682584805, 'iterations': 1239, 'l2_leaf_reg': 0.012728170310030935, 'border_count': 25, 'bagging_temperature': 0.9332671354531132, 'random_strength': 0.17731389952516974, 'grow_policy': 'SymmetricTree', 'min_data_in_leaf': 647}. Best is trial 575 with value: 965.9974213974682.[0m
[32m[I 2024-10-13 04:48:45,464][0m Trial 979 finished with value: 1147.5313739885323 and parameters: {'depth': 8, 'learning_rate': 0.04461789500405885, 'iterations': 1391, 'l2_leaf_reg': 0.15737223823914703, 'border_count': 15, 'bagging_temperature': 0.6209767610884374, 'random_strength': 0.45525495766579144, 'grow_policy': 'Lossguide', 'min_data_in_leaf': 531, 'max_leaves': 215}. Best is trial 575 with value: 965.9974213974682.[0m
[32m[I 2024-10-13 04:48:53,806][0m Trial 980 finished with value: 1252.2296546070424 and parameters: {'depth': 9, 'learning_rate': 0.009585886776206127, 'iterations': 1333, 'l2_leaf_reg': 0.09557453799185582, 'border_count': 28, 'bagging_temperature': 0.23327680985571989, 'random_strength': 0.29664618710930996, 'grow_policy': 'SymmetricTree', 'min_data_in_leaf': 509}. Best is trial 575 with value: 965.9974213974682.[0m
[32m[I 2024-10-13 04:48:57,108][0m Trial 981 finished with value: 1123.9181315496924 and parameters: {'depth': 11, 'learning_rate': 0.015821034963987995, 'iterations': 460, 'l2_leaf_reg': 0.005147948584965117, 'border_count': 21, 'bagging_temperature': 0.6663021626896565, 'random_strength': 0.6459649188882749, 'grow_policy': 'SymmetricTree', 'min_data_in_leaf': 560}. Best is trial 575 with value: 965.9974213974682.[0m
[32m[I 2024-10-13 04:49:05,006][0m Trial 982 finished with value: 1141.0799320610568 and parameters: {'depth': 8, 'learning_rate': 0.02766675141819268, 'iterations': 1546, 'l2_leaf_reg': 0.02159410933304702, 'border_count': 16, 'bagging_temperature': 0.6959799948074267, 'random_strength': 0.9369832983808728, 'grow_policy': 'SymmetricTree', 'min_data_in_leaf': 598}. Best is trial 575 with value: 965.9974213974682.[0m
[32m[I 2024-10-13 04:49:13,475][0m Trial 983 finished with value: 1058.5490433334855 and parameters: {'depth': 10, 'learning_rate': 0.012778414688041258, 'iterations': 977, 'l2_leaf_reg': 0.056138456225786754, 'border_count': 23, 'bagging_temperature': 0.9124740387865363, 'random_strength': 0.19489921985461608, 'grow_policy': 'SymmetricTree', 'min_data_in_leaf': 541}. Best is trial 575 with value: 965.9974213974682.[0m
[32m[I 2024-10-13 04:49:25,779][0m Trial 984 finished with value: 1163.9721538296628 and parameters: {'depth': 12, 'learning_rate': 0.036871551663789574, 'iterations': 1457, 'l2_leaf_reg': 0.001426012529875828, 'border_count': 8, 'bagging_temperature': 0.17729631426180817, 'random_strength': 0.0017822549532645893, 'grow_policy': 'SymmetricTree', 'min_data_in_leaf': 574}. Best is trial 575 with value: 965.9974213974682.[0m
[32m[I 2024-10-13 04:49:31,093][0m Trial 985 finished with value: 1295.662197114881 and parameters: {'depth': 7, 'learning_rate': 0.01987981693666065, 'iterations': 1053, 'l2_leaf_reg': 0.03003188296873346, 'border_count': 34, 'bagging_temperature': 0.13374824972485344, 'random_strength': 0.4707949344403051, 'grow_policy': 'SymmetricTree', 'min_data_in_leaf': 595}. Best is trial 575 with value: 965.9974213974682.[0m
[32m[I 2024-10-13 04:49:36,292][0m Trial 986 finished with value: 1240.4646044595308 and parameters: {'depth': 6, 'learning_rate': 0.014195973490239967, 'iterations': 1284, 'l2_leaf_reg': 0.012380509377394731, 'border_count': 29, 'bagging_temperature': 0.2728473646207104, 'random_strength': 0.1733447085625356, 'grow_policy': 'SymmetricTree', 'min_data_in_leaf': 634}. Best is trial 575 with value: 965.9974213974682.[0m
[32m[I 2024-10-13 04:49:46,145][0m Trial 987 finished with value: 1077.3719122105276 and parameters: {'depth': 8, 'learning_rate': 0.004179838547091479, 'iterations': 1208, 'l2_leaf_reg': 0.007467615224677982, 'border_count': 20, 'bagging_temperature': 0.6451665933287546, 'random_strength': 0.329850363420108, 'grow_policy': 'SymmetricTree', 'min_data_in_leaf': 148}. Best is trial 575 with value: 965.9974213974682.[0m
[32m[I 2024-10-13 04:49:58,399][0m Trial 988 finished with value: 1130.0318509587753 and parameters: {'depth': 9, 'learning_rate': 0.024354120925284918, 'iterations': 1812, 'l2_leaf_reg': 0.04451622627843692, 'border_count': 13, 'bagging_temperature': 0.8175562276962828, 'random_strength': 0.1778941030964487, 'grow_policy': 'SymmetricTree', 'min_data_in_leaf': 68}. Best is trial 575 with value: 965.9974213974682.[0m
[32m[I 2024-10-13 04:50:20,029][0m Trial 989 finished with value: 1165.5582195926222 and parameters: {'depth': 11, 'learning_rate': 0.010345931384517906, 'iterations': 1433, 'l2_leaf_reg': 0.003374514908784207, 'border_count': 27, 'bagging_temperature': 0.19275170651280316, 'random_strength': 0.0006230231089027387, 'grow_policy': 'SymmetricTree', 'min_data_in_leaf': 488}. Best is trial 575 with value: 965.9974213974682.[0m
[32m[I 2024-10-13 04:50:24,663][0m Trial 990 finished with value: 1160.8824687801446 and parameters: {'depth': 8, 'learning_rate': 0.016891001482978445, 'iterations': 875, 'l2_leaf_reg': 0.08777899172162627, 'border_count': 18, 'bagging_temperature': 0.22044055130693146, 'random_strength': 0.5265250221732249, 'grow_policy': 'SymmetricTree', 'min_data_in_leaf': 553}. Best is trial 575 with value: 965.9974213974682.[0m
[32m[I 2024-10-13 04:50:34,562][0m Trial 991 finished with value: 1117.50548039043 and parameters: {'depth': 9, 'learning_rate': 0.011378311556013813, 'iterations': 1332, 'l2_leaf_reg': 0.02587623044969646, 'border_count': 24, 'bagging_temperature': 0.1575530511888778, 'random_strength': 0.003859521536908593, 'grow_policy': 'SymmetricTree', 'min_data_in_leaf': 127}. Best is trial 575 with value: 965.9974213974682.[0m
[32m[I 2024-10-13 04:50:40,715][0m Trial 992 finished with value: 1106.8631158396556 and parameters: {'depth': 7, 'learning_rate': 0.02252932575026785, 'iterations': 1666, 'l2_leaf_reg': 0.016733539755120583, 'border_count': 16, 'bagging_temperature': 0.25509504604957495, 'random_strength': 0.29382410547594007, 'grow_policy': 'SymmetricTree', 'min_data_in_leaf': 519}. Best is trial 575 with value: 965.9974213974682.[0m
[32m[I 2024-10-13 04:50:54,226][0m Trial 993 finished with value: 1228.8587339274584 and parameters: {'depth': 10, 'learning_rate': 0.1144658973960401, 'iterations': 1490, 'l2_leaf_reg': 0.010312408901435423, 'border_count': 10, 'bagging_temperature': 0.8879378782695293, 'random_strength': 0.3485458349489085, 'grow_policy': 'SymmetricTree', 'min_data_in_leaf': 609}. Best is trial 575 with value: 965.9974213974682.[0m
[32m[I 2024-10-13 04:50:58,230][0m Trial 994 finished with value: 1251.7595869687166 and parameters: {'depth': 4, 'learning_rate': 0.02977010700013163, 'iterations': 1111, 'l2_leaf_reg': 0.0049985802617727405, 'border_count': 32, 'bagging_temperature': 0.2956585044038153, 'random_strength': 0.5719179575623535, 'grow_policy': 'SymmetricTree', 'min_data_in_leaf': 575}. Best is trial 575 with value: 965.9974213974682.[0m
[32m[I 2024-10-13 04:50:59,823][0m Trial 995 finished with value: 1264.9728246582488 and parameters: {'depth': 7, 'learning_rate': 0.01947127198908618, 'iterations': 1399, 'l2_leaf_reg': 0.055997841718755034, 'border_count': 43, 'bagging_temperature': 0.854053419736786, 'random_strength': 0.8134176340494691, 'grow_policy': 'Depthwise', 'min_data_in_leaf': 538}. Best is trial 575 with value: 965.9974213974682.[0m
[32m[I 2024-10-13 04:51:06,843][0m Trial 996 finished with value: 1041.8517720442135 and parameters: {'depth': 8, 'learning_rate': 0.014818530542823144, 'iterations': 1271, 'l2_leaf_reg': 0.0020764088627633916, 'border_count': 21, 'bagging_temperature': 0.24315625565705104, 'random_strength': 0.19092875836201229, 'grow_policy': 'SymmetricTree', 'min_data_in_leaf': 658}. Best is trial 575 with value: 965.9974213974682.[0m
[32m[I 2024-10-13 04:51:12,568][0m Trial 997 finished with value: 2046.1206490284733 and parameters: {'depth': 12, 'learning_rate': 0.008460021603601525, 'iterations': 1581, 'l2_leaf_reg': 0.11768566004183005, 'border_count': 3, 'bagging_temperature': 0.7228445069217088, 'random_strength': 0.17534239866858917, 'grow_policy': 'SymmetricTree', 'min_data_in_leaf': 463}. Best is trial 575 with value: 965.9974213974682.[0m
[32m[I 2024-10-13 04:51:24,528][0m Trial 998 finished with value: 1147.8686058253236 and parameters: {'depth': 11, 'learning_rate': 0.025612394774227894, 'iterations': 942, 'l2_leaf_reg': 0.03328164802283107, 'border_count': 26, 'bagging_temperature': 0.928047192417082, 'random_strength': 0.4174668236732906, 'grow_policy': 'SymmetricTree', 'min_data_in_leaf': 586}. Best is trial 575 with value: 965.9974213974682.[0m
[32m[I 2024-10-13 04:51:31,370][0m Trial 999 finished with value: 1059.4663445745198 and parameters: {'depth': 9, 'learning_rate': 0.017700947020371602, 'iterations': 1165, 'l2_leaf_reg': 0.06702279395105874, 'border_count': 14, 'bagging_temperature': 0.6067750838766359, 'random_strength': 0.18350314809224572, 'grow_policy': 'SymmetricTree', 'min_data_in_leaf': 159}. Best is trial 575 with value: 965.9974213974682.[0m
CatBoost: RMSE = 965.9974
      Model        RMSE
0  CatBoost  965.997421

Best hyperparameters for CatBoost:
{'depth': 8, 'learning_rate': 0.010323481963590734, 'iterations': 921, 'l2_leaf_reg': 0.06246857598818564, 'border_count': 21, 'bagging_temperature': 0.6263036274077526, 'random_strength': 0.0020609074922681705, 'grow_policy': 'SymmetricTree', 'min_data_in_leaf': 147}
