[32m[I 2024-10-13 03:22:43,938][0m Trial 512 finished with value: 1170.7377266036694 and parameters: {'depth': 8, 'learning_rate': 0.006497645146711926, 'iterations': 1076, 'l2_leaf_reg': 0.002200545078383432, 'border_count': 10, 'bagging_temperature': 0.5266191143040294, 'random_strength': 0.0016150779257752303, 'grow_policy': 'SymmetricTree', 'min_data_in_leaf': 276}. Best is trial 323 with value: 980.8485503758243.[0m
[32m[I 2024-10-13 03:22:49,614][0m Trial 513 finished with value: 1125.4204248337546 and parameters: {'depth': 6, 'learning_rate': 0.01819265276502073, 'iterations': 1213, 'l2_leaf_reg': 0.00024381754748144493, 'border_count': 16, 'bagging_temperature': 0.49529168125584727, 'random_strength': 0.5088227421171653, 'grow_policy': 'SymmetricTree', 'min_data_in_leaf': 322}. Best is trial 323 with value: 980.8485503758243.[0m
[32m[I 2024-10-13 03:23:13,539][0m Trial 514 finished with value: 1206.3370287816933 and parameters: {'depth': 11, 'learning_rate': 0.015286384962650373, 'iterations': 1464, 'l2_leaf_reg': 0.0013243378841059983, 'border_count': 31, 'bagging_temperature': 0.7822331549995339, 'random_strength': 0.0021724777960880465, 'grow_policy': 'SymmetricTree', 'min_data_in_leaf': 244}. Best is trial 323 with value: 980.8485503758243.[0m
[32m[I 2024-10-13 03:23:20,700][0m Trial 515 finished with value: 1175.9320552177253 and parameters: {'depth': 8, 'learning_rate': 0.01204088385452786, 'iterations': 1126, 'l2_leaf_reg': 0.0007127969553678471, 'border_count': 22, 'bagging_temperature': 0.5875127041939612, 'random_strength': 8.59629148387306, 'grow_policy': 'SymmetricTree', 'min_data_in_leaf': 210}. Best is trial 323 with value: 980.8485503758243.[0m
[32m[I 2024-10-13 03:23:38,375][0m Trial 516 finished with value: 1190.7217586957606 and parameters: {'depth': 11, 'learning_rate': 0.007669663872726218, 'iterations': 1381, 'l2_leaf_reg': 0.00718647785596137, 'border_count': 26, 'bagging_temperature': 0.8671413339295649, 'random_strength': 0.21499129067838152, 'grow_policy': 'SymmetricTree', 'min_data_in_leaf': 249}. Best is trial 323 with value: 980.8485503758243.[0m
[32m[I 2024-10-13 03:23:48,441][0m Trial 517 finished with value: 1297.44233267767 and parameters: {'depth': 13, 'learning_rate': 0.010077282936038934, 'iterations': 1006, 'l2_leaf_reg': 8.645673037623974e-05, 'border_count': 12, 'bagging_temperature': 0.18827723263610383, 'random_strength': 1.008795589334028, 'grow_policy': 'SymmetricTree', 'min_data_in_leaf': 285}. Best is trial 323 with value: 980.8485503758243.[0m
[32m[I 2024-10-13 03:23:55,500][0m Trial 518 finished with value: 991.5466000904095 and parameters: {'depth': 10, 'learning_rate': 0.042435096629923855, 'iterations': 1263, 'l2_leaf_reg': 0.003399688214000555, 'border_count': 20, 'bagging_temperature': 0.15470165130621594, 'random_strength': 0.3312147077345717, 'grow_policy': 'SymmetricTree', 'min_data_in_leaf': 619}. Best is trial 323 with value: 980.8485503758243.[0m
[32m[I 2024-10-13 03:24:11,190][0m Trial 519 finished with value: 1219.051697139966 and parameters: {'depth': 10, 'learning_rate': 0.0333772497836737, 'iterations': 1301, 'l2_leaf_reg': 0.0037961222632885046, 'border_count': 34, 'bagging_temperature': 0.1375361826825479, 'random_strength': 0.6711928742542869, 'grow_policy': 'SymmetricTree', 'min_data_in_leaf': 625}. Best is trial 323 with value: 980.8485503758243.[0m
[32m[I 2024-10-13 03:24:18,786][0m Trial 520 finished with value: 1166.0643220580098 and parameters: {'depth': 9, 'learning_rate': 0.029873704078922564, 'iterations': 1345, 'l2_leaf_reg': 2.4558213515231495, 'border_count': 26, 'bagging_temperature': 0.15177310093757007, 'random_strength': 0.44309353925242717, 'grow_policy': 'SymmetricTree', 'min_data_in_leaf': 600}. Best is trial 323 with value: 980.8485503758243.[0m
[32m[I 2024-10-13 03:24:43,611][0m Trial 521 finished with value: 1429.5239275070649 and parameters: {'depth': 10, 'learning_rate': 0.06927895006177934, 'iterations': 1266, 'l2_leaf_reg': 0.005298929016960715, 'border_count': 252, 'bagging_temperature': 0.6839648446428825, 'random_strength': 0.6801172212066194, 'grow_policy': 'SymmetricTree', 'min_data_in_leaf': 571}. Best is trial 323 with value: 980.8485503758243.[0m
[32m[I 2024-10-13 03:24:50,834][0m Trial 522 finished with value: 1076.8191977074794 and parameters: {'depth': 9, 'learning_rate': 0.04906145090254382, 'iterations': 1407, 'l2_leaf_reg': 0.0025533678861739376, 'border_count': 21, 'bagging_temperature': 0.16426264995558587, 'random_strength': 0.31069042324632357, 'grow_policy': 'SymmetricTree', 'min_data_in_leaf': 580}. Best is trial 323 with value: 980.8485503758243.[0m
[32m[I 2024-10-13 03:24:57,948][0m Trial 523 finished with value: 1171.8679794197249 and parameters: {'depth': 8, 'learning_rate': 0.05790067232654633, 'iterations': 1219, 'l2_leaf_reg': 0.0048048735942163015, 'border_count': 16, 'bagging_temperature': 0.18432323342029425, 'random_strength': 0.8338854273338665, 'grow_policy': 'SymmetricTree', 'min_data_in_leaf': 631}. Best is trial 323 with value: 980.8485503758243.[0m
[32m[I 2024-10-13 03:24:59,677][0m Trial 524 finished with value: 1447.4000376183426 and parameters: {'depth': 10, 'learning_rate': 0.050276019291783824, 'iterations': 1340, 'l2_leaf_reg': 2.974290522490915e-06, 'border_count': 28, 'bagging_temperature': 0.1020769246849884, 'random_strength': 0.4725440193754592, 'grow_policy': 'Depthwise', 'min_data_in_leaf': 616}. Best is trial 323 with value: 980.8485503758243.[0m
[32m[I 2024-10-13 03:25:06,666][0m Trial 525 finished with value: 1296.7748600280904 and parameters: {'depth': 9, 'learning_rate': 0.02484440524658722, 'iterations': 1258, 'l2_leaf_reg': 0.002043509464919407, 'border_count': 7, 'bagging_temperature': 0.1351422478006252, 'random_strength': 0.26529141920131594, 'grow_policy': 'SymmetricTree', 'min_data_in_leaf': 223}. Best is trial 323 with value: 980.8485503758243.[0m
[32m[I 2024-10-13 03:25:13,020][0m Trial 526 finished with value: 1039.2191540819492 and parameters: {'depth': 6, 'learning_rate': 0.01780054944302138, 'iterations': 1496, 'l2_leaf_reg': 0.003300187861899092, 'border_count': 22, 'bagging_temperature': 0.22010951288981861, 'random_strength': 0.18570182632226304, 'grow_policy': 'SymmetricTree', 'min_data_in_leaf': 191}. Best is trial 323 with value: 980.8485503758243.[0m
[32m[I 2024-10-13 03:25:18,942][0m Trial 527 finished with value: 1238.802618690219 and parameters: {'depth': 9, 'learning_rate': 0.04048669641109132, 'iterations': 932, 'l2_leaf_reg': 0.0014576341948467988, 'border_count': 13, 'bagging_temperature': 0.1552532509910909, 'random_strength': 1.2332378796916315, 'grow_policy': 'SymmetricTree', 'min_data_in_leaf': 231}. Best is trial 323 with value: 980.8485503758243.[0m
[32m[I 2024-10-13 03:25:33,445][0m Trial 528 finished with value: 1370.4355708538858 and parameters: {'depth': 8, 'learning_rate': 0.019774733770523717, 'iterations': 2509, 'l2_leaf_reg': 0.0010453082846217788, 'border_count': 32, 'bagging_temperature': 0.11736629537598936, 'random_strength': 4.107828628215716, 'grow_policy': 'SymmetricTree', 'min_data_in_leaf': 674}. Best is trial 323 with value: 980.8485503758243.[0m
[32m[I 2024-10-13 03:25:45,072][0m Trial 529 finished with value: 1290.4537006884996 and parameters: {'depth': 9, 'learning_rate': 0.015095803901506848, 'iterations': 1296, 'l2_leaf_reg': 0.0028863458257851198, 'border_count': 126, 'bagging_temperature': 0.19916896209331433, 'random_strength': 0.5429305474658934, 'grow_policy': 'SymmetricTree', 'min_data_in_leaf': 247}. Best is trial 323 with value: 980.8485503758243.[0m
[32m[I 2024-10-13 03:26:13,847][0m Trial 530 finished with value: 1266.058036736461 and parameters: {'depth': 10, 'learning_rate': 0.04179961104665067, 'iterations': 1211, 'l2_leaf_reg': 0.008238489161803792, 'border_count': 137, 'bagging_temperature': 0.8827380514843284, 'random_strength': 0.34999657324300093, 'grow_policy': 'SymmetricTree', 'min_data_in_leaf': 214}. Best is trial 323 with value: 980.8485503758243.[0m
[32m[I 2024-10-13 03:26:22,249][0m Trial 531 finished with value: 1097.111739658023 and parameters: {'depth': 8, 'learning_rate': 0.04368468825262375, 'iterations': 1427, 'l2_leaf_reg': 0.0017683272527682843, 'border_count': 20, 'bagging_temperature': 0.8046842083878417, 'random_strength': 0.18265634834469757, 'grow_policy': 'SymmetricTree', 'min_data_in_leaf': 648}. Best is trial 323 with value: 980.8485503758243.[0m
[32m[I 2024-10-13 03:26:23,824][0m Trial 532 finished with value: 2552.236024594927 and parameters: {'depth': 8, 'learning_rate': 0.05791904683439275, 'iterations': 1058, 'l2_leaf_reg': 0.006089985805152661, 'border_count': 1, 'bagging_temperature': 0.2457851823782783, 'random_strength': 0.4055376648289832, 'grow_policy': 'Lossguide', 'min_data_in_leaf': 169, 'max_leaves': 165}. Best is trial 323 with value: 980.8485503758243.[0m
[32m[I 2024-10-13 03:26:30,738][0m Trial 533 finished with value: 1191.1582450446056 and parameters: {'depth': 9, 'learning_rate': 0.023816597273350955, 'iterations': 1258, 'l2_leaf_reg': 0.0008490281235535777, 'border_count': 24, 'bagging_temperature': 0.17026486005431285, 'random_strength': 0.6595737391160318, 'grow_policy': 'SymmetricTree', 'min_data_in_leaf': 601}. Best is trial 323 with value: 980.8485503758243.[0m
[32m[I 2024-10-13 03:26:42,693][0m Trial 534 finished with value: 1051.098704527408 and parameters: {'depth': 8, 'learning_rate': 0.01573224613554388, 'iterations': 2729, 'l2_leaf_reg': 0.000522828571802691, 'border_count': 16, 'bagging_temperature': 0.19108117096772323, 'random_strength': 0.16610593033904816, 'grow_policy': 'SymmetricTree', 'min_data_in_leaf': 428}. Best is trial 323 with value: 980.8485503758243.[0m
[32m[I 2024-10-13 03:26:49,157][0m Trial 535 finished with value: 1350.7638123026964 and parameters: {'depth': 9, 'learning_rate': 0.01324911600730473, 'iterations': 1179, 'l2_leaf_reg': 0.003572020832400783, 'border_count': 9, 'bagging_temperature': 0.23157846925777686, 'random_strength': 1.706859729605076, 'grow_policy': 'SymmetricTree', 'min_data_in_leaf': 621}. Best is trial 323 with value: 980.8485503758243.[0m
[32m[I 2024-10-13 03:27:01,911][0m Trial 536 finished with value: 1296.3255307406948 and parameters: {'depth': 6, 'learning_rate': 0.020942518267925682, 'iterations': 2174, 'l2_leaf_reg': 0.001651849498937081, 'border_count': 149, 'bagging_temperature': 0.5764902572610421, 'random_strength': 8.168950144242553, 'grow_policy': 'SymmetricTree', 'min_data_in_leaf': 199}. Best is trial 323 with value: 980.8485503758243.[0m
[32m[I 2024-10-13 03:27:11,403][0m Trial 537 finished with value: 1157.6645900078672 and parameters: {'depth': 8, 'learning_rate': 0.08303478167189324, 'iterations': 1339, 'l2_leaf_reg': 0.10914206979861495, 'border_count': 28, 'bagging_temperature': 0.6070793202696265, 'random_strength': 0.3510355359939821, 'grow_policy': 'SymmetricTree', 'min_data_in_leaf': 688}. Best is trial 323 with value: 980.8485503758243.[0m
[32m[I 2024-10-13 03:27:18,648][0m Trial 538 finished with value: 1196.1566131763825 and parameters: {'depth': 7, 'learning_rate': 0.02744939518815237, 'iterations': 1379, 'l2_leaf_reg': 0.002407767119448704, 'border_count': 40, 'bagging_temperature': 0.5571403263403369, 'random_strength': 0.17184383359131417, 'grow_policy': 'SymmetricTree', 'min_data_in_leaf': 265}. Best is trial 323 with value: 980.8485503758243.[0m
[32m[I 2024-10-13 03:27:27,983][0m Trial 539 finished with value: 1013.1385749527293 and parameters: {'depth': 10, 'learning_rate': 0.01792018318175152, 'iterations': 991, 'l2_leaf_reg': 0.19250524819493664, 'border_count': 19, 'bagging_temperature': 0.17406539252501055, 'random_strength': 0.006958395746884975, 'grow_policy': 'SymmetricTree', 'min_data_in_leaf': 644}. Best is trial 323 with value: 980.8485503758243.[0m
[32m[I 2024-10-13 03:27:35,290][0m Trial 540 finished with value: 1063.6778660343277 and parameters: {'depth': 10, 'learning_rate': 0.03619630547221202, 'iterations': 964, 'l2_leaf_reg': 0.16766328919520068, 'border_count': 24, 'bagging_temperature': 0.16799274603035003, 'random_strength': 0.46742083206784085, 'grow_policy': 'SymmetricTree', 'min_data_in_leaf': 657}. Best is trial 323 with value: 980.8485503758243.[0m
[32m[I 2024-10-13 03:27:44,920][0m Trial 541 finished with value: 1050.8404639096393 and parameters: {'depth': 10, 'learning_rate': 0.012557418388901412, 'iterations': 964, 'l2_leaf_reg': 0.2002047842414985, 'border_count': 14, 'bagging_temperature': 0.1789846498561142, 'random_strength': 0.004089227239303968, 'grow_policy': 'SymmetricTree', 'min_data_in_leaf': 660}. Best is trial 323 with value: 980.8485503758243.[0m
[32m[I 2024-10-13 03:28:09,632][0m Trial 542 finished with value: 1266.3509017090207 and parameters: {'depth': 10, 'learning_rate': 0.016957274897729552, 'iterations': 1013, 'l2_leaf_reg': 0.7866930398931351, 'border_count': 199, 'bagging_temperature': 0.14796424205446154, 'random_strength': 0.2962538581007982, 'grow_policy': 'SymmetricTree', 'min_data_in_leaf': 623}. Best is trial 323 with value: 980.8485503758243.[0m
[32m[I 2024-10-13 03:28:18,107][0m Trial 543 finished with value: 1190.6473061276986 and parameters: {'depth': 10, 'learning_rate': 0.011108227067820121, 'iterations': 919, 'l2_leaf_reg': 0.0657601708253712, 'border_count': 30, 'bagging_temperature': 0.20644640779894113, 'random_strength': 0.817400675005352, 'grow_policy': 'SymmetricTree', 'min_data_in_leaf': 631}. Best is trial 323 with value: 980.8485503758243.[0m
[32m[I 2024-10-13 03:28:29,013][0m Trial 544 finished with value: 1176.2279886325393 and parameters: {'depth': 10, 'learning_rate': 0.16804586760942283, 'iterations': 970, 'l2_leaf_reg': 1.2828276786029504, 'border_count': 20, 'bagging_temperature': 0.1563592879416181, 'random_strength': 0.5727637124016425, 'grow_policy': 'SymmetricTree', 'min_data_in_leaf': 569}. Best is trial 323 with value: 980.8485503758243.[0m
[32m[I 2024-10-13 03:28:36,701][0m Trial 545 finished with value: 1203.772880277428 and parameters: {'depth': 10, 'learning_rate': 0.014371006216924501, 'iterations': 862, 'l2_leaf_reg': 0.12629264307225557, 'border_count': 25, 'bagging_temperature': 0.12863368463575642, 'random_strength': 0.2239771548662639, 'grow_policy': 'SymmetricTree', 'min_data_in_leaf': 672}. Best is trial 323 with value: 980.8485503758243.[0m
[32m[I 2024-10-13 03:28:46,907][0m Trial 546 finished with value: 1285.2470765182532 and parameters: {'depth': 10, 'learning_rate': 0.012468096493447661, 'iterations': 1052, 'l2_leaf_reg': 0.40120880349945753, 'border_count': 36, 'bagging_temperature': 0.18542881184041063, 'random_strength': 2.960735687989755, 'grow_policy': 'SymmetricTree', 'min_data_in_leaf': 652}. Best is trial 323 with value: 980.8485503758243.[0m
[32m[I 2024-10-13 03:28:47,835][0m Trial 547 finished with value: 1250.6388923073087 and parameters: {'depth': 7, 'learning_rate': 0.01536647100087737, 'iterations': 518, 'l2_leaf_reg': 0.6505706422503078, 'border_count': 13, 'bagging_temperature': 0.8464247450381001, 'random_strength': 5.552661129220849, 'grow_policy': 'Depthwise', 'min_data_in_leaf': 469}. Best is trial 323 with value: 980.8485503758243.[0m
[32m[I 2024-10-13 03:29:12,850][0m Trial 548 finished with value: 1110.360351265111 and parameters: {'depth': 15, 'learning_rate': 0.021152556115736333, 'iterations': 1022, 'l2_leaf_reg': 0.3008726061970302, 'border_count': 20, 'bagging_temperature': 0.19383397677564457, 'random_strength': 0.34389687791179535, 'grow_policy': 'SymmetricTree', 'min_data_in_leaf': 695}. Best is trial 323 with value: 980.8485503758243.[0m
[32m[I 2024-10-13 03:29:17,976][0m Trial 549 finished with value: 1244.4533959037467 and parameters: {'depth': 6, 'learning_rate': 0.010684734179394183, 'iterations': 1098, 'l2_leaf_reg': 0.07704472612817363, 'border_count': 26, 'bagging_temperature': 0.22240528461501954, 'random_strength': 0.21527441930137325, 'grow_policy': 'SymmetricTree', 'min_data_in_leaf': 634}. Best is trial 323 with value: 980.8485503758243.[0m
[32m[I 2024-10-13 03:29:23,114][0m Trial 550 finished with value: 1264.789631505869 and parameters: {'depth': 8, 'learning_rate': 0.016897979255697155, 'iterations': 1084, 'l2_leaf_reg': 0.11133883813640623, 'border_count': 8, 'bagging_temperature': 0.1670739478430171, 'random_strength': 0.1600166130568981, 'grow_policy': 'SymmetricTree', 'min_data_in_leaf': 599}. Best is trial 323 with value: 980.8485503758243.[0m
[32m[I 2024-10-13 03:29:28,320][0m Trial 551 finished with value: 1231.4813846921568 and parameters: {'depth': 8, 'learning_rate': 0.014122020847205163, 'iterations': 826, 'l2_leaf_reg': 0.23983950273942828, 'border_count': 32, 'bagging_temperature': 0.2086110734039391, 'random_strength': 0.5460380305429299, 'grow_policy': 'SymmetricTree', 'min_data_in_leaf': 639}. Best is trial 323 with value: 980.8485503758243.[0m
[32m[I 2024-10-13 03:29:37,381][0m Trial 552 finished with value: 1013.2045961075354 and parameters: {'depth': 10, 'learning_rate': 0.02611261226047887, 'iterations': 899, 'l2_leaf_reg': 0.08247108423933835, 'border_count': 18, 'bagging_temperature': 0.7205836632742295, 'random_strength': 0.00105841976294771, 'grow_policy': 'SymmetricTree', 'min_data_in_leaf': 195}. Best is trial 323 with value: 980.8485503758243.[0m
[32m[I 2024-10-13 03:29:43,264][0m Trial 553 finished with value: 1289.6627413710535 and parameters: {'depth': 10, 'learning_rate': 0.0316752655896238, 'iterations': 849, 'l2_leaf_reg': 0.049388597937892666, 'border_count': 10, 'bagging_temperature': 0.7184647799135379, 'random_strength': 0.18934187406995726, 'grow_policy': 'SymmetricTree', 'min_data_in_leaf': 718}. Best is trial 323 with value: 980.8485503758243.[0m
[32m[I 2024-10-13 03:29:56,998][0m Trial 554 finished with value: 1059.757663663013 and parameters: {'depth': 10, 'learning_rate': 0.025234838879241172, 'iterations': 1566, 'l2_leaf_reg': 0.15314937817871535, 'border_count': 16, 'bagging_temperature': 0.798168560199098, 'random_strength': 0.02193951355056903, 'grow_policy': 'SymmetricTree', 'min_data_in_leaf': 172}. Best is trial 323 with value: 980.8485503758243.[0m
[32m[I 2024-10-13 03:29:58,328][0m Trial 555 finished with value: 1118.5878170430803 and parameters: {'depth': 10, 'learning_rate': 0.030057782188045598, 'iterations': 900, 'l2_leaf_reg': 0.09717246724680251, 'border_count': 19, 'bagging_temperature': 0.749895614317485, 'random_strength': 0.14036817102458632, 'grow_policy': 'Lossguide', 'min_data_in_leaf': 195, 'max_leaves': 42}. Best is trial 323 with value: 980.8485503758243.[0m
[32m[I 2024-10-13 03:30:10,428][0m Trial 556 finished with value: 993.3434812910093 and parameters: {'depth': 10, 'learning_rate': 0.02462442622602238, 'iterations': 1615, 'l2_leaf_reg': 0.08776347562638859, 'border_count': 14, 'bagging_temperature': 0.7403904201217824, 'random_strength': 0.013518744308375888, 'grow_policy': 'SymmetricTree', 'min_data_in_leaf': 157}. Best is trial 323 with value: 980.8485503758243.[0m
[32m[I 2024-10-13 03:30:19,233][0m Trial 557 finished with value: 1564.9111918891726 and parameters: {'depth': 10, 'learning_rate': 0.035668733527869, 'iterations': 1663, 'l2_leaf_reg': 0.12550350014637032, 'border_count': 5, 'bagging_temperature': 0.7403429976717811, 'random_strength': 5.282275461533345, 'grow_policy': 'SymmetricTree', 'min_data_in_leaf': 156}. Best is trial 323 with value: 980.8485503758243.[0m
[32m[I 2024-10-13 03:30:31,133][0m Trial 558 finished with value: 1182.718804792754 and parameters: {'depth': 10, 'learning_rate': 0.02145004948221749, 'iterations': 1616, 'l2_leaf_reg': 0.18786430875697888, 'border_count': 11, 'bagging_temperature': 0.6976417593941029, 'random_strength': 0.035465372188519, 'grow_policy': 'SymmetricTree', 'min_data_in_leaf': 139}. Best is trial 323 with value: 980.8485503758243.[0m
[32m[I 2024-10-13 03:30:40,578][0m Trial 559 finished with value: 1481.6924045829778 and parameters: {'depth': 10, 'learning_rate': 0.024617456903117448, 'iterations': 1605, 'l2_leaf_reg': 0.07917160914735757, 'border_count': 5, 'bagging_temperature': 0.7754915573790233, 'random_strength': 0.000200821030505614, 'grow_policy': 'SymmetricTree', 'min_data_in_leaf': 166}. Best is trial 323 with value: 980.8485503758243.[0m
[32m[I 2024-10-13 03:30:56,327][0m Trial 560 finished with value: 1037.5875501984408 and parameters: {'depth': 10, 'learning_rate': 0.028274341671145814, 'iterations': 1683, 'l2_leaf_reg': 0.09277987990788863, 'border_count': 13, 'bagging_temperature': 0.7710569978681657, 'random_strength': 0.012846018590878581, 'grow_policy': 'SymmetricTree', 'min_data_in_leaf': 139}. Best is trial 323 with value: 980.8485503758243.[0m
[32m[I 2024-10-13 03:31:06,403][0m Trial 561 finished with value: 1081.2581018857475 and parameters: {'depth': 10, 'learning_rate': 0.022342844799307295, 'iterations': 1532, 'l2_leaf_reg': 0.07035551380082017, 'border_count': 15, 'bagging_temperature': 0.7254827247138724, 'random_strength': 0.1719559577246638, 'grow_policy': 'SymmetricTree', 'min_data_in_leaf': 124}. Best is trial 323 with value: 980.8485503758243.[0m
[32m[I 2024-10-13 03:31:15,206][0m Trial 562 finished with value: 1244.8076663707482 and parameters: {'depth': 10, 'learning_rate': 0.017771267620630787, 'iterations': 1609, 'l2_leaf_reg': 0.03750825186095998, 'border_count': 10, 'bagging_temperature': 0.6604664656526672, 'random_strength': 0.3216344012013722, 'grow_policy': 'SymmetricTree', 'min_data_in_leaf': 182}. Best is trial 323 with value: 980.8485503758243.[0m
