[32m[I 2024-10-13 03:44:47,474][0m Trial 665 finished with value: 1203.250894953127 and parameters: {'depth': 7, 'learning_rate': 0.021972648699462593, 'iterations': 1348, 'l2_leaf_reg': 0.029073507234821477, 'border_count': 26, 'bagging_temperature': 0.3151443100050819, 'random_strength': 0.17942519271653115, 'grow_policy': 'SymmetricTree', 'min_data_in_leaf': 526}. Best is trial 575 with value: 965.9974213974682.[0m
[32m[I 2024-10-13 03:44:53,434][0m Trial 666 finished with value: 1088.2206315610333 and parameters: {'depth': 6, 'learning_rate': 0.01974366003839904, 'iterations': 1509, 'l2_leaf_reg': 0.045746258695347874, 'border_count': 14, 'bagging_temperature': 0.2814999612362112, 'random_strength': 0.6704744628901304, 'grow_policy': 'SymmetricTree', 'min_data_in_leaf': 537}. Best is trial 575 with value: 965.9974213974682.[0m
[32m[I 2024-10-13 03:44:55,237][0m Trial 667 finished with value: 1138.656896524433 and parameters: {'depth': 7, 'learning_rate': 0.03210989047601812, 'iterations': 1578, 'l2_leaf_reg': 0.008701941767338975, 'border_count': 18, 'bagging_temperature': 0.3239911514708095, 'random_strength': 0.19747840175506243, 'grow_policy': 'Lossguide', 'min_data_in_leaf': 528, 'max_leaves': 247}. Best is trial 575 with value: 965.9974213974682.[0m
[32m[I 2024-10-13 03:45:05,240][0m Trial 668 finished with value: 1008.1536586983216 and parameters: {'depth': 10, 'learning_rate': 0.02812613317546479, 'iterations': 1305, 'l2_leaf_reg': 0.047769875815475246, 'border_count': 23, 'bagging_temperature': 0.2673879519863221, 'random_strength': 0.4501508618519971, 'grow_policy': 'SymmetricTree', 'min_data_in_leaf': 570}. Best is trial 575 with value: 965.9974213974682.[0m
[32m[I 2024-10-13 03:45:16,022][0m Trial 669 finished with value: 1334.0532392247069 and parameters: {'depth': 10, 'learning_rate': 0.04350227384298621, 'iterations': 1293, 'l2_leaf_reg': 0.04321738455040664, 'border_count': 36, 'bagging_temperature': 0.26518152745077583, 'random_strength': 0.5624596489495661, 'grow_policy': 'SymmetricTree', 'min_data_in_leaf': 568}. Best is trial 575 with value: 965.9974213974682.[0m
[32m[I 2024-10-13 03:45:20,880][0m Trial 670 finished with value: 2814.772386373313 and parameters: {'depth': 10, 'learning_rate': 0.02921946439526725, 'iterations': 1285, 'l2_leaf_reg': 0.025815113395633978, 'border_count': 1, 'bagging_temperature': 0.2933296892074408, 'random_strength': 0.8530996413763114, 'grow_policy': 'SymmetricTree', 'min_data_in_leaf': 550}. Best is trial 575 with value: 965.9974213974682.[0m
[32m[I 2024-10-13 03:45:32,134][0m Trial 671 finished with value: 1300.7136058144472 and parameters: {'depth': 10, 'learning_rate': 0.04193244318862199, 'iterations': 1362, 'l2_leaf_reg': 0.05171446502331699, 'border_count': 32, 'bagging_temperature': 0.2659077186151529, 'random_strength': 0.7273244261225331, 'grow_policy': 'SymmetricTree', 'min_data_in_leaf': 567}. Best is trial 575 with value: 965.9974213974682.[0m
[32m[I 2024-10-13 03:46:00,604][0m Trial 672 finished with value: 1288.5023237427856 and parameters: {'depth': 11, 'learning_rate': 0.033415918640899364, 'iterations': 1461, 'l2_leaf_reg': 0.03246490293260287, 'border_count': 44, 'bagging_temperature': 0.29342285806071566, 'random_strength': 0.47124555174530947, 'grow_policy': 'SymmetricTree', 'min_data_in_leaf': 545}. Best is trial 575 with value: 965.9974213974682.[0m
[32m[I 2024-10-13 03:46:12,604][0m Trial 673 finished with value: 1110.7973439154246 and parameters: {'depth': 10, 'learning_rate': 0.027053802217250702, 'iterations': 1425, 'l2_leaf_reg': 0.01634280338044506, 'border_count': 26, 'bagging_temperature': 0.24673163080606286, 'random_strength': 0.3612198904903892, 'grow_policy': 'SymmetricTree', 'min_data_in_leaf': 517}. Best is trial 575 with value: 965.9974213974682.[0m
[32m[I 2024-10-13 03:46:35,903][0m Trial 674 finished with value: 1060.630677010653 and parameters: {'depth': 14, 'learning_rate': 0.01878195137799117, 'iterations': 1295, 'l2_leaf_reg': 0.06115079195141277, 'border_count': 23, 'bagging_temperature': 0.2548415127695066, 'random_strength': 0.41149834201261826, 'grow_policy': 'SymmetricTree', 'min_data_in_leaf': 577}. Best is trial 575 with value: 965.9974213974682.[0m
[32m[I 2024-10-13 03:46:47,606][0m Trial 675 finished with value: 1132.4062274890628 and parameters: {'depth': 10, 'learning_rate': 0.024094765806214287, 'iterations': 1362, 'l2_leaf_reg': 0.03536665535130259, 'border_count': 30, 'bagging_temperature': 0.23510277036256472, 'random_strength': 0.6950783304364517, 'grow_policy': 'SymmetricTree', 'min_data_in_leaf': 492}. Best is trial 575 with value: 965.9974213974682.[0m
[32m[I 2024-10-13 03:47:01,312][0m Trial 676 finished with value: 1052.682495220068 and parameters: {'depth': 10, 'learning_rate': 0.03153182654350109, 'iterations': 1639, 'l2_leaf_reg': 0.05803847329574846, 'border_count': 24, 'bagging_temperature': 0.26876543532908315, 'random_strength': 0.306770179958302, 'grow_policy': 'SymmetricTree', 'min_data_in_leaf': 564}. Best is trial 575 with value: 965.9974213974682.[0m
[32m[I 2024-10-13 03:47:10,500][0m Trial 677 finished with value: 1054.085337171545 and parameters: {'depth': 10, 'learning_rate': 0.038287098867347644, 'iterations': 1257, 'l2_leaf_reg': 0.01657772484209658, 'border_count': 14, 'bagging_temperature': 0.29027844772573763, 'random_strength': 0.19793184715423237, 'grow_policy': 'SymmetricTree', 'min_data_in_leaf': 528}. Best is trial 575 with value: 965.9974213974682.[0m
[32m[I 2024-10-13 03:47:19,771][0m Trial 678 finished with value: 1083.3121455101532 and parameters: {'depth': 11, 'learning_rate': 0.01738572226094615, 'iterations': 1298, 'l2_leaf_reg': 0.02407015597398197, 'border_count': 19, 'bagging_temperature': 0.23136494278980688, 'random_strength': 0.5031638704964677, 'grow_policy': 'SymmetricTree', 'min_data_in_leaf': 606}. Best is trial 575 with value: 965.9974213974682.[0m
[32m[I 2024-10-13 03:47:45,766][0m Trial 679 finished with value: 1193.2393741526691 and parameters: {'depth': 12, 'learning_rate': 0.02161918310165379, 'iterations': 1419, 'l2_leaf_reg': 0.08006994015729646, 'border_count': 28, 'bagging_temperature': 0.2749503021199498, 'random_strength': 0.19258818865013594, 'grow_policy': 'SymmetricTree', 'min_data_in_leaf': 640}. Best is trial 575 with value: 965.9974213974682.[0m
[32m[I 2024-10-13 03:47:54,845][0m Trial 680 finished with value: 1356.8615856089393 and parameters: {'depth': 6, 'learning_rate': 0.027702914351051933, 'iterations': 1554, 'l2_leaf_reg': 0.03954988614877957, 'border_count': 68, 'bagging_temperature': 0.3064137718791433, 'random_strength': 0.40914869140137144, 'grow_policy': 'SymmetricTree', 'min_data_in_leaf': 588}. Best is trial 575 with value: 965.9974213974682.[0m
[32m[I 2024-10-13 03:48:08,776][0m Trial 681 finished with value: 4191.100347643271 and parameters: {'depth': 10, 'learning_rate': 0.0001589477510311713, 'iterations': 1492, 'l2_leaf_reg': 0.010297589706051881, 'border_count': 8, 'bagging_temperature': 0.3129035300131358, 'random_strength': 1.2998011505677556, 'grow_policy': 'SymmetricTree', 'min_data_in_leaf': 74}. Best is trial 575 with value: 965.9974213974682.[0m
[32m[I 2024-10-13 03:48:15,395][0m Trial 682 finished with value: 1073.4702824624771 and parameters: {'depth': 7, 'learning_rate': 0.01769575304478561, 'iterations': 1370, 'l2_leaf_reg': 0.06419229550258809, 'border_count': 22, 'bagging_temperature': 0.2516275907392828, 'random_strength': 0.1707822864283679, 'grow_policy': 'SymmetricTree', 'min_data_in_leaf': 541}. Best is trial 575 with value: 965.9974213974682.[0m
[32m[I 2024-10-13 03:48:16,891][0m Trial 683 finished with value: 1212.7801901651833 and parameters: {'depth': 10, 'learning_rate': 0.015432443490398767, 'iterations': 1265, 'l2_leaf_reg': 0.11917395746796539, 'border_count': 15, 'bagging_temperature': 0.22025330578122024, 'random_strength': 0.5733103021576116, 'grow_policy': 'Depthwise', 'min_data_in_leaf': 620}. Best is trial 575 with value: 965.9974213974682.[0m
[32m[I 2024-10-13 03:48:22,555][0m Trial 684 finished with value: 1271.428649593017 and parameters: {'depth': 11, 'learning_rate': 0.020899896284424797, 'iterations': 561, 'l2_leaf_reg': 0.025349308635320984, 'border_count': 26, 'bagging_temperature': 0.3574260151497876, 'random_strength': 0.33894918160335996, 'grow_policy': 'SymmetricTree', 'min_data_in_leaf': 573}. Best is trial 575 with value: 965.9974213974682.[0m
[32m[I 2024-10-13 03:48:29,368][0m Trial 685 finished with value: 1336.7084416143555 and parameters: {'depth': 7, 'learning_rate': 0.02635500941698289, 'iterations': 1316, 'l2_leaf_reg': 0.04528919165938384, 'border_count': 34, 'bagging_temperature': 0.21169573289914434, 'random_strength': 0.0015553656300278341, 'grow_policy': 'SymmetricTree', 'min_data_in_leaf': 210}. Best is trial 575 with value: 965.9974213974682.[0m
[32m[I 2024-10-13 03:48:44,772][0m Trial 686 finished with value: 1166.3282730616668 and parameters: {'depth': 10, 'learning_rate': 0.051017199455841974, 'iterations': 1420, 'l2_leaf_reg': 0.09636707990262264, 'border_count': 12, 'bagging_temperature': 0.3341771238931628, 'random_strength': 0.00855246668608579, 'grow_policy': 'SymmetricTree', 'min_data_in_leaf': 557}. Best is trial 575 with value: 965.9974213974682.[0m
[32m[I 2024-10-13 03:48:55,120][0m Trial 687 finished with value: 1113.2059481388396 and parameters: {'depth': 7, 'learning_rate': 0.0023569743754341993, 'iterations': 1329, 'l2_leaf_reg': 0.03269602702610127, 'border_count': 20, 'bagging_temperature': 0.9255352257643219, 'random_strength': 0.001610102636509089, 'grow_policy': 'SymmetricTree', 'min_data_in_leaf': 609}. Best is trial 575 with value: 965.9974213974682.[0m
[32m[I 2024-10-13 03:49:04,276][0m Trial 688 finished with value: 1297.9887954420408 and parameters: {'depth': 10, 'learning_rate': 0.01514201560691627, 'iterations': 1229, 'l2_leaf_reg': 0.01937929888004982, 'border_count': 29, 'bagging_temperature': 0.2486465357362851, 'random_strength': 6.290504823533919, 'grow_policy': 'SymmetricTree', 'min_data_in_leaf': 510}. Best is trial 575 with value: 965.9974213974682.[0m
[32m[I 2024-10-13 03:49:05,972][0m Trial 689 finished with value: 1160.119866040346 and parameters: {'depth': 7, 'learning_rate': 0.023507239103311088, 'iterations': 1389, 'l2_leaf_reg': 0.04681471058038344, 'border_count': 17, 'bagging_temperature': 0.28343267109664294, 'random_strength': 0.3235242360206483, 'grow_policy': 'Lossguide', 'min_data_in_leaf': 189, 'max_leaves': 221}. Best is trial 575 with value: 965.9974213974682.[0m
[32m[I 2024-10-13 03:49:19,370][0m Trial 690 finished with value: 1316.4152516941726 and parameters: {'depth': 11, 'learning_rate': 0.019087691819059286, 'iterations': 1522, 'l2_leaf_reg': 0.06503483912054464, 'border_count': 40, 'bagging_temperature': 0.19115559363172516, 'random_strength': 0.6200550169742434, 'grow_policy': 'SymmetricTree', 'min_data_in_leaf': 147}. Best is trial 575 with value: 965.9974213974682.[0m
[32m[I 2024-10-13 03:49:29,224][0m Trial 691 finished with value: 1092.292618168874 and parameters: {'depth': 10, 'learning_rate': 0.013270231060564764, 'iterations': 1269, 'l2_leaf_reg': 0.17149301014160864, 'border_count': 22, 'bagging_temperature': 0.2605884967316506, 'random_strength': 0.9355841841568266, 'grow_policy': 'SymmetricTree', 'min_data_in_leaf': 537}. Best is trial 575 with value: 965.9974213974682.[0m
[32m[I 2024-10-13 03:49:37,885][0m Trial 692 finished with value: 1234.704085887806 and parameters: {'depth': 7, 'learning_rate': 0.033316364720928394, 'iterations': 1754, 'l2_leaf_reg': 0.011940617511298279, 'border_count': 8, 'bagging_temperature': 0.8713687834153757, 'random_strength': 0.18741831632148678, 'grow_policy': 'SymmetricTree', 'min_data_in_leaf': 120}. Best is trial 575 with value: 965.9974213974682.[0m
[32m[I 2024-10-13 03:50:12,193][0m Trial 693 finished with value: 1278.8575669878026 and parameters: {'depth': 12, 'learning_rate': 0.016298857614426912, 'iterations': 1594, 'l2_leaf_reg': 0.07212054220196806, 'border_count': 143, 'bagging_temperature': 0.22640867119101787, 'random_strength': 0.35326959173284156, 'grow_policy': 'SymmetricTree', 'min_data_in_leaf': 583}. Best is trial 575 with value: 965.9974213974682.[0m
[32m[I 2024-10-13 03:50:17,136][0m Trial 694 finished with value: 1132.0806117050693 and parameters: {'depth': 6, 'learning_rate': 0.019514190027657904, 'iterations': 999, 'l2_leaf_reg': 0.11159192980540912, 'border_count': 25, 'bagging_temperature': 0.8963690891775216, 'random_strength': 0.18174028914989684, 'grow_policy': 'SymmetricTree', 'min_data_in_leaf': 665}. Best is trial 575 with value: 965.9974213974682.[0m
[32m[I 2024-10-13 03:50:52,960][0m Trial 695 finished with value: 1066.8885210561602 and parameters: {'depth': 13, 'learning_rate': 0.02461279530743824, 'iterations': 1334, 'l2_leaf_reg': 0.025571431596565046, 'border_count': 16, 'bagging_temperature': 0.09982298930824027, 'random_strength': 0.0025485944110060915, 'grow_policy': 'SymmetricTree', 'min_data_in_leaf': 172}. Best is trial 575 with value: 965.9974213974682.[0m
[32m[I 2024-10-13 03:51:00,392][0m Trial 696 finished with value: 1248.0333653809337 and parameters: {'depth': 10, 'learning_rate': 0.014779456801051518, 'iterations': 966, 'l2_leaf_reg': 0.040606693962563126, 'border_count': 31, 'bagging_temperature': 0.15191397189600575, 'random_strength': 0.5084936716383118, 'grow_policy': 'SymmetricTree', 'min_data_in_leaf': 199}. Best is trial 575 with value: 965.9974213974682.[0m
[32m[I 2024-10-13 03:51:06,372][0m Trial 697 finished with value: 1286.0339352155706 and parameters: {'depth': 7, 'learning_rate': 0.030017647714570217, 'iterations': 1234, 'l2_leaf_reg': 0.008346543481218207, 'border_count': 11, 'bagging_temperature': 0.3106910172033984, 'random_strength': 0.3128529731769133, 'grow_policy': 'SymmetricTree', 'min_data_in_leaf': 466}. Best is trial 575 with value: 965.9974213974682.[0m
[32m[I 2024-10-13 03:51:26,094][0m Trial 698 finished with value: 1137.7246158074488 and parameters: {'depth': 11, 'learning_rate': 0.00514133884872007, 'iterations': 1424, 'l2_leaf_reg': 0.40216815563947356, 'border_count': 21, 'bagging_temperature': 0.1801572542662301, 'random_strength': 0.7461981236817576, 'grow_policy': 'SymmetricTree', 'min_data_in_leaf': 559}. Best is trial 575 with value: 965.9974213974682.[0m
[32m[I 2024-10-13 03:51:36,504][0m Trial 699 finished with value: 1291.7339918983414 and parameters: {'depth': 10, 'learning_rate': 0.012193376760735848, 'iterations': 1495, 'l2_leaf_reg': 0.01927489769805479, 'border_count': 26, 'bagging_temperature': 0.2098802578012541, 'random_strength': 3.8891962423498088, 'grow_policy': 'SymmetricTree', 'min_data_in_leaf': 227}. Best is trial 575 with value: 965.9974213974682.[0m
[32m[I 2024-10-13 03:51:41,295][0m Trial 700 finished with value: 1169.8698205620224 and parameters: {'depth': 7, 'learning_rate': 0.01725108462365898, 'iterations': 913, 'l2_leaf_reg': 0.05695225357123382, 'border_count': 16, 'bagging_temperature': 0.9161791031846944, 'random_strength': 1.5272417269219547, 'grow_policy': 'SymmetricTree', 'min_data_in_leaf': 602}. Best is trial 575 with value: 965.9974213974682.[0m
[32m[I 2024-10-13 03:51:46,737][0m Trial 701 finished with value: 1062.0772225239243 and parameters: {'depth': 7, 'learning_rate': 0.037654597282928984, 'iterations': 1023, 'l2_leaf_reg': 0.08739643457360562, 'border_count': 22, 'bagging_temperature': 0.28292168474491963, 'random_strength': 0.19511783877615435, 'grow_policy': 'SymmetricTree', 'min_data_in_leaf': 216}. Best is trial 575 with value: 965.9974213974682.[0m
[32m[I 2024-10-13 03:51:52,356][0m Trial 702 finished with value: 1505.5147924817013 and parameters: {'depth': 6, 'learning_rate': 0.02177706494275609, 'iterations': 1369, 'l2_leaf_reg': 0.032680510825473144, 'border_count': 5, 'bagging_temperature': 0.8439711219925026, 'random_strength': 6.878938622497129, 'grow_policy': 'SymmetricTree', 'min_data_in_leaf': 188}. Best is trial 575 with value: 965.9974213974682.[0m
[32m[I 2024-10-13 03:52:19,125][0m Trial 703 finished with value: 1185.6925146668436 and parameters: {'depth': 11, 'learning_rate': 0.013402882146931073, 'iterations': 1305, 'l2_leaf_reg': 0.15565720200042493, 'border_count': 33, 'bagging_temperature': 0.2410330016231436, 'random_strength': 0.0009910507736471397, 'grow_policy': 'SymmetricTree', 'min_data_in_leaf': 152}. Best is trial 575 with value: 965.9974213974682.[0m
[32m[I 2024-10-13 03:52:42,284][0m Trial 704 finished with value: 1291.6881109270566 and parameters: {'depth': 10, 'learning_rate': 0.008767285305631494, 'iterations': 1168, 'l2_leaf_reg': 0.013621601101715284, 'border_count': 119, 'bagging_temperature': 0.8159459157561149, 'random_strength': 0.4530693450512983, 'grow_policy': 'SymmetricTree', 'min_data_in_leaf': 234}. Best is trial 575 with value: 965.9974213974682.[0m
[32m[I 2024-10-13 03:52:43,825][0m Trial 705 finished with value: 1337.8416299350063 and parameters: {'depth': 10, 'learning_rate': 0.015627934953715457, 'iterations': 1283, 'l2_leaf_reg': 0.04900643663980507, 'border_count': 12, 'bagging_temperature': 0.0035568917062425154, 'random_strength': 0.19427554116872095, 'grow_policy': 'Depthwise', 'min_data_in_leaf': 521}. Best is trial 575 with value: 965.9974213974682.[0m
[32m[I 2024-10-13 03:52:49,787][0m Trial 706 finished with value: 1144.7953413286466 and parameters: {'depth': 7, 'learning_rate': 0.006627916151873566, 'iterations': 957, 'l2_leaf_reg': 0.08030518301904731, 'border_count': 18, 'bagging_temperature': 0.20314474639915356, 'random_strength': 0.5682687004176882, 'grow_policy': 'SymmetricTree', 'min_data_in_leaf': 563}. Best is trial 575 with value: 965.9974213974682.[0m
[32m[I 2024-10-13 03:53:30,107][0m Trial 707 finished with value: 1120.7528055849202 and parameters: {'depth': 12, 'learning_rate': 0.0188645011764934, 'iterations': 1645, 'l2_leaf_reg': 0.006942100767863057, 'border_count': 27, 'bagging_temperature': 0.8831710468490774, 'random_strength': 0.1969146469231025, 'grow_policy': 'SymmetricTree', 'min_data_in_leaf': 580}. Best is trial 575 with value: 965.9974213974682.[0m
[32m[I 2024-10-13 03:53:42,832][0m Trial 708 finished with value: 1007.1470339317386 and parameters: {'depth': 11, 'learning_rate': 0.027395371052544918, 'iterations': 1465, 'l2_leaf_reg': 0.029866602767303997, 'border_count': 22, 'bagging_temperature': 0.3244522854203323, 'random_strength': 0.4165647136862254, 'grow_policy': 'SymmetricTree', 'min_data_in_leaf': 644}. Best is trial 575 with value: 965.9974213974682.[0m
[32m[I 2024-10-13 03:53:57,667][0m Trial 709 finished with value: 1352.8646849018464 and parameters: {'depth': 11, 'learning_rate': 0.030432471309498346, 'iterations': 1467, 'l2_leaf_reg': 0.018901828012912087, 'border_count': 36, 'bagging_temperature': 0.32710846005803856, 'random_strength': 0.9386847232838941, 'grow_policy': 'SymmetricTree', 'min_data_in_leaf': 654}. Best is trial 575 with value: 965.9974213974682.[0m
[32m[I 2024-10-13 03:54:38,213][0m Trial 710 finished with value: 1264.3539471934362 and parameters: {'depth': 11, 'learning_rate': 0.027474759547074092, 'iterations': 1461, 'l2_leaf_reg': 0.024679889030806465, 'border_count': 95, 'bagging_temperature': 0.3006832914724867, 'random_strength': 0.5284270493853565, 'grow_policy': 'SymmetricTree', 'min_data_in_leaf': 638}. Best is trial 575 with value: 965.9974213974682.[0m
[32m[I 2024-10-13 03:55:06,225][0m Trial 711 finished with value: 1148.5378913391369 and parameters: {'depth': 11, 'learning_rate': 0.043504868960083175, 'iterations': 1529, 'l2_leaf_reg': 0.030119096990699933, 'border_count': 29, 'bagging_temperature': 0.340430571088409, 'random_strength': 0.7057761056842384, 'grow_policy': 'SymmetricTree', 'min_data_in_leaf': 638}. Best is trial 575 with value: 965.9974213974682.[0m
[32m[I 2024-10-13 03:55:07,839][0m Trial 712 finished with value: 1209.5691791440568 and parameters: {'depth': 11, 'learning_rate': 0.025286444542640316, 'iterations': 1434, 'l2_leaf_reg': 0.032755484233519136, 'border_count': 23, 'bagging_temperature': 0.2909264965368102, 'random_strength': 0.8115789827652597, 'grow_policy': 'Lossguide', 'min_data_in_leaf': 631, 'max_leaves': 157}. Best is trial 575 with value: 965.9974213974682.[0m
[32m[I 2024-10-13 03:55:38,393][0m Trial 713 finished with value: 1200.8671854045585 and parameters: {'depth': 12, 'learning_rate': 0.036251945360391905, 'iterations': 1548, 'l2_leaf_reg': 0.012689466420061997, 'border_count': 30, 'bagging_temperature': 0.2681889514528461, 'random_strength': 0.4457083369956354, 'grow_policy': 'SymmetricTree', 'min_data_in_leaf': 663}. Best is trial 575 with value: 965.9974213974682.[0m
[32m[I 2024-10-13 03:55:49,106][0m Trial 714 finished with value: 1081.57865570861 and parameters: {'depth': 11, 'learning_rate': 0.02480529553122011, 'iterations': 1400, 'l2_leaf_reg': 0.050708084232634724, 'border_count': 24, 'bagging_temperature': 0.3092203544345581, 'random_strength': 0.37900903616102083, 'grow_policy': 'SymmetricTree', 'min_data_in_leaf': 651}. Best is trial 575 with value: 965.9974213974682.[0m
[32m[I 2024-10-13 03:56:02,646][0m Trial 715 finished with value: 1134.066246488743 and parameters: {'depth': 11, 'learning_rate': 0.03147817573728778, 'iterations': 1595, 'l2_leaf_reg': 0.04041663144287785, 'border_count': 18, 'bagging_temperature': 0.3232802312507237, 'random_strength': 0.6014043652589764, 'grow_policy': 'SymmetricTree', 'min_data_in_leaf': 609}. Best is trial 575 with value: 965.9974213974682.[0m
