[32m[I 2024-10-13 03:31:30,243][0m Trial 563 finished with value: 1091.6293564381826 and parameters: {'depth': 10, 'learning_rate': 0.01937759641271798, 'iterations': 1653, 'l2_leaf_reg': 0.153509229935517, 'border_count': 16, 'bagging_temperature': 0.7066526778306113, 'random_strength': 0.010467919001793943, 'grow_policy': 'SymmetricTree', 'min_data_in_leaf': 167}. Best is trial 323 with value: 980.8485503758243.[0m
[32m[I 2024-10-13 03:31:43,682][0m Trial 564 finished with value: 1231.287507179502 and parameters: {'depth': 10, 'learning_rate': 0.010033132082868186, 'iterations': 1537, 'l2_leaf_reg': 0.07695041784345806, 'border_count': 21, 'bagging_temperature': 0.8337400131654829, 'random_strength': 7.852226946175725, 'grow_policy': 'SymmetricTree', 'min_data_in_leaf': 145}. Best is trial 323 with value: 980.8485503758243.[0m
[32m[I 2024-10-13 03:31:55,438][0m Trial 565 finished with value: 1362.4448730364195 and parameters: {'depth': 10, 'learning_rate': 0.025700715265068723, 'iterations': 1547, 'l2_leaf_reg': 0.050703380094182536, 'border_count': 7, 'bagging_temperature': 0.6826686260419841, 'random_strength': 0.19438283098350753, 'grow_policy': 'SymmetricTree', 'min_data_in_leaf': 193}. Best is trial 323 with value: 980.8485503758243.[0m
[32m[I 2024-10-13 03:32:04,769][0m Trial 566 finished with value: 1281.8423436195312 and parameters: {'depth': 6, 'learning_rate': 0.011706887673392395, 'iterations': 1476, 'l2_leaf_reg': 0.09762126686232744, 'border_count': 214, 'bagging_temperature': 0.7352724649680585, 'random_strength': 0.3940724428503841, 'grow_policy': 'SymmetricTree', 'min_data_in_leaf': 157}. Best is trial 323 with value: 980.8485503758243.[0m
[32m[I 2024-10-13 03:32:22,504][0m Trial 567 finished with value: 1089.5587387657397 and parameters: {'depth': 10, 'learning_rate': 0.005267454056193506, 'iterations': 786, 'l2_leaf_reg': 0.21098469580359358, 'border_count': 18, 'bagging_temperature': 0.7523091140168405, 'random_strength': 0.003029748709064653, 'grow_policy': 'SymmetricTree', 'min_data_in_leaf': 203}. Best is trial 323 with value: 980.8485503758243.[0m
[32m[I 2024-10-13 03:32:42,094][0m Trial 568 finished with value: 1140.4873544059433 and parameters: {'depth': 12, 'learning_rate': 0.03215348217908696, 'iterations': 952, 'l2_leaf_reg': 0.04123393430554258, 'border_count': 25, 'bagging_temperature': 0.7903754099089787, 'random_strength': 0.2193384004133914, 'grow_policy': 'SymmetricTree', 'min_data_in_leaf': 183}. Best is trial 323 with value: 980.8485503758243.[0m
[32m[I 2024-10-13 03:32:51,210][0m Trial 569 finished with value: 1320.3614890952076 and parameters: {'depth': 11, 'learning_rate': 0.03996643818830686, 'iterations': 883, 'l2_leaf_reg': 0.061097951699248254, 'border_count': 11, 'bagging_temperature': 0.8972658937012054, 'random_strength': 0.39999990087789383, 'grow_policy': 'SymmetricTree', 'min_data_in_leaf': 211}. Best is trial 323 with value: 980.8485503758243.[0m
[32m[I 2024-10-13 03:32:52,674][0m Trial 570 finished with value: 1193.0600010868088 and parameters: {'depth': 10, 'learning_rate': 0.00871332356837113, 'iterations': 1000, 'l2_leaf_reg': 0.001041219977972813, 'border_count': 17, 'bagging_temperature': 0.8169040089204216, 'random_strength': 0.008231108994804545, 'grow_policy': 'Depthwise', 'min_data_in_leaf': 550}. Best is trial 323 with value: 980.8485503758243.[0m
[32m[I 2024-10-13 03:33:01,058][0m Trial 571 finished with value: 1073.910397361291 and parameters: {'depth': 8, 'learning_rate': 0.01937625601744914, 'iterations': 1724, 'l2_leaf_reg': 0.13671261645211266, 'border_count': 23, 'bagging_temperature': 0.1427489623094123, 'random_strength': 0.21937901673284893, 'grow_policy': 'SymmetricTree', 'min_data_in_leaf': 614}. Best is trial 323 with value: 980.8485503758243.[0m
[32m[I 2024-10-13 03:33:06,798][0m Trial 572 finished with value: 1262.882187144943 and parameters: {'depth': 8, 'learning_rate': 0.013031830423927616, 'iterations': 947, 'l2_leaf_reg': 0.03418881145294637, 'border_count': 14, 'bagging_temperature': 0.8874476907111746, 'random_strength': 7.396648214247755, 'grow_policy': 'SymmetricTree', 'min_data_in_leaf': 182}. Best is trial 323 with value: 980.8485503758243.[0m
[32m[I 2024-10-13 03:33:13,415][0m Trial 573 finished with value: 2100.162859425844 and parameters: {'depth': 10, 'learning_rate': 0.007363785809907121, 'iterations': 1512, 'l2_leaf_reg': 0.08527640236993256, 'border_count': 3, 'bagging_temperature': 0.8765014777130126, 'random_strength': 0.4655654254554003, 'grow_policy': 'SymmetricTree', 'min_data_in_leaf': 120}. Best is trial 323 with value: 980.8485503758243.[0m
[32m[I 2024-10-13 03:33:27,062][0m Trial 574 finished with value: 1128.7320054376005 and parameters: {'depth': 11, 'learning_rate': 0.02321429545778947, 'iterations': 1026, 'l2_leaf_reg': 0.005654038375964972, 'border_count': 28, 'bagging_temperature': 0.8526323633679828, 'random_strength': 0.19051887595561187, 'grow_policy': 'SymmetricTree', 'min_data_in_leaf': 212}. Best is trial 323 with value: 980.8485503758243.[0m
[32m[I 2024-10-13 03:33:34,516][0m Trial 575 finished with value: 965.9974213974682 and parameters: {'depth': 8, 'learning_rate': 0.010323481963590734, 'iterations': 921, 'l2_leaf_reg': 0.06246857598818564, 'border_count': 21, 'bagging_temperature': 0.6263036274077526, 'random_strength': 0.0020609074922681705, 'grow_policy': 'SymmetricTree', 'min_data_in_leaf': 147}. Best is trial 575 with value: 965.9974213974682.[0m
[32m[I 2024-10-13 03:33:39,542][0m Trial 576 finished with value: 1025.1029118563447 and parameters: {'depth': 7, 'learning_rate': 0.016408565042781615, 'iterations': 880, 'l2_leaf_reg': 0.057594120352660844, 'border_count': 19, 'bagging_temperature': 0.6255327487880673, 'random_strength': 0.00832784272564442, 'grow_policy': 'SymmetricTree', 'min_data_in_leaf': 493}. Best is trial 575 with value: 965.9974213974682.[0m
[32m[I 2024-10-13 03:33:44,266][0m Trial 577 finished with value: 972.4218539462017 and parameters: {'depth': 7, 'learning_rate': 0.015657290866405243, 'iterations': 883, 'l2_leaf_reg': 0.05518528177253454, 'border_count': 21, 'bagging_temperature': 0.6945547253929556, 'random_strength': 0.003299726305682333, 'grow_policy': 'SymmetricTree', 'min_data_in_leaf': 569}. Best is trial 575 with value: 965.9974213974682.[0m
[32m[I 2024-10-13 03:33:45,384][0m Trial 578 finished with value: 1227.6032006211065 and parameters: {'depth': 7, 'learning_rate': 0.013703676265307939, 'iterations': 797, 'l2_leaf_reg': 0.11240617158097563, 'border_count': 30, 'bagging_temperature': 0.6887205827123792, 'random_strength': 0.34978600660232495, 'grow_policy': 'Lossguide', 'min_data_in_leaf': 563, 'max_leaves': 205}. Best is trial 575 with value: 965.9974213974682.[0m
[32m[I 2024-10-13 03:33:50,895][0m Trial 579 finished with value: 1242.356029367588 and parameters: {'depth': 7, 'learning_rate': 0.011379968618082088, 'iterations': 724, 'l2_leaf_reg': 0.037844204853057964, 'border_count': 87, 'bagging_temperature': 0.7158055103917675, 'random_strength': 0.1972266596047844, 'grow_policy': 'SymmetricTree', 'min_data_in_leaf': 595}. Best is trial 575 with value: 965.9974213974682.[0m
[32m[I 2024-10-13 03:33:56,609][0m Trial 580 finished with value: 1193.952808400428 and parameters: {'depth': 7, 'learning_rate': 0.10548436386830831, 'iterations': 901, 'l2_leaf_reg': 0.05676969633770077, 'border_count': 23, 'bagging_temperature': 0.6450601843489814, 'random_strength': 0.5561111779913102, 'grow_policy': 'SymmetricTree', 'min_data_in_leaf': 578}. Best is trial 575 with value: 965.9974213974682.[0m
[32m[I 2024-10-13 03:34:01,845][0m Trial 581 finished with value: 1017.0297962976865 and parameters: {'depth': 7, 'learning_rate': 0.015197154318483973, 'iterations': 810, 'l2_leaf_reg': 0.08129955080489248, 'border_count': 21, 'bagging_temperature': 0.7442780386124884, 'random_strength': 0.0023323264011516167, 'grow_policy': 'SymmetricTree', 'min_data_in_leaf': 590}. Best is trial 575 with value: 965.9974213974682.[0m
[32m[I 2024-10-13 03:34:06,424][0m Trial 582 finished with value: 1228.2262223689172 and parameters: {'depth': 7, 'learning_rate': 0.015936862144164305, 'iterations': 751, 'l2_leaf_reg': 0.0859300545529697, 'border_count': 27, 'bagging_temperature': 0.7433013767116115, 'random_strength': 0.34154786527470493, 'grow_policy': 'SymmetricTree', 'min_data_in_leaf': 567}. Best is trial 575 with value: 965.9974213974682.[0m
[32m[I 2024-10-13 03:34:11,529][0m Trial 583 finished with value: 1192.0419499173006 and parameters: {'depth': 7, 'learning_rate': 0.014810792665200155, 'iterations': 820, 'l2_leaf_reg': 0.26515115197883615, 'border_count': 33, 'bagging_temperature': 0.7201876982748868, 'random_strength': 0.18618827070254684, 'grow_policy': 'SymmetricTree', 'min_data_in_leaf': 542}. Best is trial 575 with value: 965.9974213974682.[0m
[32m[I 2024-10-13 03:34:15,671][0m Trial 584 finished with value: 1045.0471093866613 and parameters: {'depth': 7, 'learning_rate': 0.017128858637017578, 'iterations': 793, 'l2_leaf_reg': 0.11120084573738517, 'border_count': 22, 'bagging_temperature': 0.6935876746394446, 'random_strength': 0.4358575673278973, 'grow_policy': 'SymmetricTree', 'min_data_in_leaf': 577}. Best is trial 575 with value: 965.9974213974682.[0m
[32m[I 2024-10-13 03:34:20,346][0m Trial 585 finished with value: 1199.32774806759 and parameters: {'depth': 7, 'learning_rate': 0.013492013156993958, 'iterations': 847, 'l2_leaf_reg': 0.14228763485157583, 'border_count': 26, 'bagging_temperature': 0.6531262107468158, 'random_strength': 0.20064746868380628, 'grow_policy': 'SymmetricTree', 'min_data_in_leaf': 598}. Best is trial 575 with value: 965.9974213974682.[0m
[32m[I 2024-10-13 03:34:26,088][0m Trial 586 finished with value: 1250.945024975025 and parameters: {'depth': 7, 'learning_rate': 0.01974060645166302, 'iterations': 729, 'l2_leaf_reg': 0.06510175532058562, 'border_count': 227, 'bagging_temperature': 0.6202819268785182, 'random_strength': 0.005925496905545197, 'grow_policy': 'SymmetricTree', 'min_data_in_leaf': 611}. Best is trial 575 with value: 965.9974213974682.[0m
[32m[I 2024-10-13 03:34:30,555][0m Trial 587 finished with value: 1104.6009839370493 and parameters: {'depth': 7, 'learning_rate': 0.017791017456076964, 'iterations': 835, 'l2_leaf_reg': 0.03944301142248467, 'border_count': 20, 'bagging_temperature': 0.6705335708481018, 'random_strength': 0.6165027809896186, 'grow_policy': 'SymmetricTree', 'min_data_in_leaf': 586}. Best is trial 575 with value: 965.9974213974682.[0m
[32m[I 2024-10-13 03:34:35,983][0m Trial 588 finished with value: 1187.2202139765095 and parameters: {'depth': 7, 'learning_rate': 0.014667633531204772, 'iterations': 889, 'l2_leaf_reg': 0.0669037804612931, 'border_count': 31, 'bagging_temperature': 0.711503246563938, 'random_strength': 0.3360677064950055, 'grow_policy': 'SymmetricTree', 'min_data_in_leaf': 555}. Best is trial 575 with value: 965.9974213974682.[0m
[32m[I 2024-10-13 03:34:42,158][0m Trial 589 finished with value: 1446.1813530409122 and parameters: {'depth': 7, 'learning_rate': 0.0027822123344970217, 'iterations': 766, 'l2_leaf_reg': 0.042489770864998395, 'border_count': 50, 'bagging_temperature': 0.7303066042855741, 'random_strength': 0.19469048597335872, 'grow_policy': 'SymmetricTree', 'min_data_in_leaf': 527}. Best is trial 575 with value: 965.9974213974682.[0m
[32m[I 2024-10-13 03:35:16,961][0m Trial 590 finished with value: 2336.194387576877 and parameters: {'depth': 13, 'learning_rate': 0.0011781096998799178, 'iterations': 847, 'l2_leaf_reg': 0.19093715622069984, 'border_count': 36, 'bagging_temperature': 0.6708920118713853, 'random_strength': 0.0003720491164866946, 'grow_policy': 'SymmetricTree', 'min_data_in_leaf': 613}. Best is trial 575 with value: 965.9974213974682.[0m
[32m[I 2024-10-13 03:35:21,182][0m Trial 591 finished with value: 1127.5531105756816 and parameters: {'depth': 7, 'learning_rate': 0.01196695125826796, 'iterations': 693, 'l2_leaf_reg': 0.0910634315302431, 'border_count': 18, 'bagging_temperature': 0.760439760805141, 'random_strength': 0.5086386553075872, 'grow_policy': 'SymmetricTree', 'min_data_in_leaf': 588}. Best is trial 575 with value: 965.9974213974682.[0m
[32m[I 2024-10-13 03:35:34,312][0m Trial 592 finished with value: 1095.063724044173 and parameters: {'depth': 11, 'learning_rate': 0.01068646383940513, 'iterations': 862, 'l2_leaf_reg': 0.05903272653883263, 'border_count': 24, 'bagging_temperature': 0.693875088730825, 'random_strength': 0.1766930140607882, 'grow_policy': 'SymmetricTree', 'min_data_in_leaf': 550}. Best is trial 575 with value: 965.9974213974682.[0m
[32m[I 2024-10-13 03:35:40,692][0m Trial 593 finished with value: 1132.5515789883718 and parameters: {'depth': 10, 'learning_rate': 0.016266415407083838, 'iterations': 890, 'l2_leaf_reg': 0.1407482199831938, 'border_count': 13, 'bagging_temperature': 0.5982087277602507, 'random_strength': 0.7080913443165431, 'grow_policy': 'SymmetricTree', 'min_data_in_leaf': 629}. Best is trial 575 with value: 965.9974213974682.[0m
[32m[I 2024-10-13 03:35:53,634][0m Trial 594 finished with value: 1059.1595059023225 and parameters: {'depth': 12, 'learning_rate': 0.012919235362155664, 'iterations': 929, 'l2_leaf_reg': 0.028816909127634384, 'border_count': 21, 'bagging_temperature': 0.738814951200598, 'random_strength': 0.35470478295982966, 'grow_policy': 'SymmetricTree', 'min_data_in_leaf': 535}. Best is trial 575 with value: 965.9974213974682.[0m
[32m[I 2024-10-13 03:36:00,628][0m Trial 595 finished with value: 1301.056491032475 and parameters: {'depth': 7, 'learning_rate': 0.046063875872844245, 'iterations': 931, 'l2_leaf_reg': 0.3091541586114245, 'border_count': 43, 'bagging_temperature': 0.7044611298286558, 'random_strength': 0.0015394449094378474, 'grow_policy': 'SymmetricTree', 'min_data_in_leaf': 103}. Best is trial 575 with value: 965.9974213974682.[0m
[32m[I 2024-10-13 03:36:01,809][0m Trial 596 finished with value: 1345.577999140084 and parameters: {'depth': 10, 'learning_rate': 0.018968323572605243, 'iterations': 744, 'l2_leaf_reg': 0.10181366057414197, 'border_count': 28, 'bagging_temperature': 0.6698627820924961, 'random_strength': 0.18177063366093937, 'grow_policy': 'Depthwise', 'min_data_in_leaf': 579}. Best is trial 575 with value: 965.9974213974682.[0m
[32m[I 2024-10-13 03:36:07,439][0m Trial 597 finished with value: 1096.535762016766 and parameters: {'depth': 7, 'learning_rate': 0.0097574370761664, 'iterations': 951, 'l2_leaf_reg': 0.05058163714687742, 'border_count': 15, 'bagging_temperature': 0.6469341438376495, 'random_strength': 0.35645417080484265, 'grow_policy': 'SymmetricTree', 'min_data_in_leaf': 600}. Best is trial 575 with value: 965.9974213974682.[0m
[32m[I 2024-10-13 03:36:15,033][0m Trial 598 finished with value: 4010.4243917778067 and parameters: {'depth': 8, 'learning_rate': 0.00034949015820264493, 'iterations': 797, 'l2_leaf_reg': 0.034389169383711955, 'border_count': 23, 'bagging_temperature': 0.10782545160686674, 'random_strength': 0.19885640983948957, 'grow_policy': 'SymmetricTree', 'min_data_in_leaf': 563}. Best is trial 575 with value: 965.9974213974682.[0m
[32m[I 2024-10-13 03:36:20,690][0m Trial 599 finished with value: 1229.7788282846034 and parameters: {'depth': 10, 'learning_rate': 0.014569968922369114, 'iterations': 834, 'l2_leaf_reg': 0.07699749597050254, 'border_count': 9, 'bagging_temperature': 0.6283294600133785, 'random_strength': 0.47659379813308633, 'grow_policy': 'SymmetricTree', 'min_data_in_leaf': 530}. Best is trial 575 with value: 965.9974213974682.[0m
[32m[I 2024-10-13 03:36:22,045][0m Trial 600 finished with value: 1168.867573235301 and parameters: {'depth': 11, 'learning_rate': 0.012671085077704786, 'iterations': 983, 'l2_leaf_reg': 0.14562057479430657, 'border_count': 17, 'bagging_temperature': 0.771503622645765, 'random_strength': 0.17641974078393802, 'grow_policy': 'Lossguide', 'min_data_in_leaf': 625, 'max_leaves': 100}. Best is trial 575 with value: 965.9974213974682.[0m
[32m[I 2024-10-13 03:36:26,916][0m Trial 601 finished with value: 1259.8527635286193 and parameters: {'depth': 7, 'learning_rate': 0.020220169012342776, 'iterations': 927, 'l2_leaf_reg': 0.041117484189529166, 'border_count': 29, 'bagging_temperature': 0.7201577735208871, 'random_strength': 0.7457745522584838, 'grow_policy': 'SymmetricTree', 'min_data_in_leaf': 666}. Best is trial 575 with value: 965.9974213974682.[0m
[32m[I 2024-10-13 03:36:36,494][0m Trial 602 finished with value: 1084.228754145174 and parameters: {'depth': 10, 'learning_rate': 0.009351929759470159, 'iterations': 905, 'l2_leaf_reg': 0.2049755656581923, 'border_count': 20, 'bagging_temperature': 0.16816855869301806, 'random_strength': 0.36901576724396373, 'grow_policy': 'SymmetricTree', 'min_data_in_leaf': 573}. Best is trial 575 with value: 965.9974213974682.[0m
[32m[I 2024-10-13 03:36:41,672][0m Trial 603 finished with value: 1178.9265735318236 and parameters: {'depth': 8, 'learning_rate': 0.01656833232874549, 'iterations': 799, 'l2_leaf_reg': 0.07265003483219774, 'border_count': 26, 'bagging_temperature': 0.7453781245462833, 'random_strength': 0.16279263450309076, 'grow_policy': 'SymmetricTree', 'min_data_in_leaf': 506}. Best is trial 575 with value: 965.9974213974682.[0m
[32m[I 2024-10-13 03:36:54,479][0m Trial 604 finished with value: 1291.113527986524 and parameters: {'depth': 12, 'learning_rate': 0.0043087004281073355, 'iterations': 961, 'l2_leaf_reg': 0.029762447580002196, 'border_count': 12, 'bagging_temperature': 0.15351627242208438, 'random_strength': 0.5801949242535177, 'grow_policy': 'SymmetricTree', 'min_data_in_leaf': 610}. Best is trial 575 with value: 965.9974213974682.[0m
[32m[I 2024-10-13 03:37:02,118][0m Trial 605 finished with value: 1221.0462658881215 and parameters: {'depth': 8, 'learning_rate': 0.011428579581547771, 'iterations': 866, 'l2_leaf_reg': 0.054444580028403224, 'border_count': 35, 'bagging_temperature': 0.18691273610296052, 'random_strength': 0.005932105585655715, 'grow_policy': 'SymmetricTree', 'min_data_in_leaf': 581}. Best is trial 575 with value: 965.9974213974682.[0m
[32m[I 2024-10-13 03:37:10,418][0m Trial 606 finished with value: 1155.71850412823 and parameters: {'depth': 10, 'learning_rate': 0.01371534020848498, 'iterations': 1032, 'l2_leaf_reg': 0.10314613645440607, 'border_count': 18, 'bagging_temperature': 0.7039289839182316, 'random_strength': 0.9898731047992033, 'grow_policy': 'SymmetricTree', 'min_data_in_leaf': 654}. Best is trial 575 with value: 965.9974213974682.[0m
[32m[I 2024-10-13 03:37:19,746][0m Trial 607 finished with value: 1086.0627099675294 and parameters: {'depth': 8, 'learning_rate': 0.008373005908109483, 'iterations': 1629, 'l2_leaf_reg': 0.07870741159878772, 'border_count': 23, 'bagging_temperature': 0.12723513447243473, 'random_strength': 0.3368187578418761, 'grow_policy': 'SymmetricTree', 'min_data_in_leaf': 644}. Best is trial 575 with value: 965.9974213974682.[0m
[32m[I 2024-10-13 03:37:23,920][0m Trial 608 finished with value: 1178.2683257692731 and parameters: {'depth': 9, 'learning_rate': 0.02284608682151748, 'iterations': 690, 'l2_leaf_reg': 0.1335578420686596, 'border_count': 9, 'bagging_temperature': 0.34828250077735823, 'random_strength': 0.17399402809997783, 'grow_policy': 'SymmetricTree', 'min_data_in_leaf': 515}. Best is trial 575 with value: 965.9974213974682.[0m
[32m[I 2024-10-13 03:37:31,361][0m Trial 609 finished with value: 1039.0753944248056 and parameters: {'depth': 8, 'learning_rate': 0.028962470413153973, 'iterations': 1576, 'l2_leaf_reg': 0.04545346056653078, 'border_count': 15, 'bagging_temperature': 0.180451037369234, 'random_strength': 0.3364725522071901, 'grow_policy': 'SymmetricTree', 'min_data_in_leaf': 550}. Best is trial 575 with value: 965.9974213974682.[0m
[32m[I 2024-10-13 03:37:44,382][0m Trial 610 finished with value: 1253.088668958666 and parameters: {'depth': 11, 'learning_rate': 0.010523059770525674, 'iterations': 966, 'l2_leaf_reg': 0.014702172673854992, 'border_count': 31, 'bagging_temperature': 0.595349174615725, 'random_strength': 0.5315191877730642, 'grow_policy': 'SymmetricTree', 'min_data_in_leaf': 601}. Best is trial 575 with value: 965.9974213974682.[0m
[32m[I 2024-10-13 03:37:49,532][0m Trial 611 finished with value: 1123.643075799774 and parameters: {'depth': 7, 'learning_rate': 0.06511604416844849, 'iterations': 915, 'l2_leaf_reg': 0.02265236014026329, 'border_count': 24, 'bagging_temperature': 0.7545370447865007, 'random_strength': 0.0049346593703892706, 'grow_policy': 'SymmetricTree', 'min_data_in_leaf': 136}. Best is trial 575 with value: 965.9974213974682.[0m
[32m[I 2024-10-13 03:37:58,158][0m Trial 612 finished with value: 1038.4650330348234 and parameters: {'depth': 10, 'learning_rate': 0.01791361293111462, 'iterations': 1006, 'l2_leaf_reg': 0.033888665156641753, 'border_count': 19, 'bagging_temperature': 0.21003331380661902, 'random_strength': 0.18408499434792783, 'grow_policy': 'SymmetricTree', 'min_data_in_leaf': 225}. Best is trial 575 with value: 965.9974213974682.[0m
[32m[I 2024-10-13 03:38:04,660][0m Trial 613 finished with value: 1125.3797439619095 and parameters: {'depth': 9, 'learning_rate': 0.006958584231884467, 'iterations': 774, 'l2_leaf_reg': 0.05612928006719141, 'border_count': 13, 'bagging_temperature': 0.607077898436469, 'random_strength': 0.3476489274531008, 'grow_policy': 'SymmetricTree', 'min_data_in_leaf': 637}. Best is trial 575 with value: 965.9974213974682.[0m
