[32m[I 2024-10-13 04:04:25,230][0m Trial 767 finished with value: 1182.4514086145211 and parameters: {'depth': 8, 'learning_rate': 0.018700896604461108, 'iterations': 1442, 'l2_leaf_reg': 0.004189402128403332, 'border_count': 26, 'bagging_temperature': 0.21744455674959706, 'random_strength': 0.20609162950815008, 'grow_policy': 'SymmetricTree', 'min_data_in_leaf': 150}. Best is trial 575 with value: 965.9974213974682.[0m
[32m[I 2024-10-13 04:04:34,815][0m Trial 768 finished with value: 1015.6056101375207 and parameters: {'depth': 9, 'learning_rate': 0.021839567077247247, 'iterations': 1531, 'l2_leaf_reg': 0.0034104561053873994, 'border_count': 20, 'bagging_temperature': 0.22688197041818994, 'random_strength': 0.17327173474047478, 'grow_policy': 'SymmetricTree', 'min_data_in_leaf': 120}. Best is trial 575 with value: 965.9974213974682.[0m
[32m[I 2024-10-13 04:04:43,683][0m Trial 769 finished with value: 1199.7249285303574 and parameters: {'depth': 8, 'learning_rate': 0.017319411832750795, 'iterations': 1477, 'l2_leaf_reg': 0.0060714386947607005, 'border_count': 9, 'bagging_temperature': 0.19436157258673392, 'random_strength': 0.15904808415440946, 'grow_policy': 'SymmetricTree', 'min_data_in_leaf': 173}. Best is trial 575 with value: 965.9974213974682.[0m
[32m[I 2024-10-13 04:04:58,362][0m Trial 770 finished with value: 1265.7557425427233 and parameters: {'depth': 9, 'learning_rate': 0.02380740481295909, 'iterations': 1703, 'l2_leaf_reg': 0.004415478521601049, 'border_count': 36, 'bagging_temperature': 0.23678585699595467, 'random_strength': 0.32406069916320646, 'grow_policy': 'SymmetricTree', 'min_data_in_leaf': 133}. Best is trial 575 with value: 965.9974213974682.[0m
[32m[I 2024-10-13 04:05:06,194][0m Trial 771 finished with value: 1066.5435715922413 and parameters: {'depth': 8, 'learning_rate': 0.015471099412670903, 'iterations': 1560, 'l2_leaf_reg': 0.0024948247068937346, 'border_count': 15, 'bagging_temperature': 0.21031847493501488, 'random_strength': 0.17603409070271142, 'grow_policy': 'SymmetricTree', 'min_data_in_leaf': 156}. Best is trial 575 with value: 965.9974213974682.[0m
[32m[I 2024-10-13 04:05:07,873][0m Trial 772 finished with value: 1286.7622185082912 and parameters: {'depth': 11, 'learning_rate': 0.01808777297483497, 'iterations': 1404, 'l2_leaf_reg': 0.002002010858874403, 'border_count': 30, 'bagging_temperature': 0.18277755481466304, 'random_strength': 0.015980009180332905, 'grow_policy': 'Depthwise', 'min_data_in_leaf': 102}. Best is trial 575 with value: 965.9974213974682.[0m
[32m[I 2024-10-13 04:05:24,915][0m Trial 773 finished with value: 1076.0245988954825 and parameters: {'depth': 10, 'learning_rate': 0.02149658966330321, 'iterations': 1441, 'l2_leaf_reg': 0.007538626440294141, 'border_count': 24, 'bagging_temperature': 0.20430384598439055, 'random_strength': 0.0017398595690181484, 'grow_policy': 'SymmetricTree', 'min_data_in_leaf': 959}. Best is trial 575 with value: 965.9974213974682.[0m
[32m[I 2024-10-13 04:05:35,221][0m Trial 774 finished with value: 1078.9748372490185 and parameters: {'depth': 9, 'learning_rate': 0.014950617418735157, 'iterations': 1632, 'l2_leaf_reg': 0.002609106430088668, 'border_count': 19, 'bagging_temperature': 0.9548227355846248, 'random_strength': 0.4444745700410599, 'grow_policy': 'SymmetricTree', 'min_data_in_leaf': 2}. Best is trial 575 with value: 965.9974213974682.[0m
[32m[I 2024-10-13 04:06:06,323][0m Trial 775 finished with value: 1065.9674191142697 and parameters: {'depth': 12, 'learning_rate': 0.018698084781748163, 'iterations': 1414, 'l2_leaf_reg': 0.002823992577786718, 'border_count': 14, 'bagging_temperature': 0.128608073424427, 'random_strength': 0.33270507633592333, 'grow_policy': 'SymmetricTree', 'min_data_in_leaf': 626}. Best is trial 575 with value: 965.9974213974682.[0m
[32m[I 2024-10-13 04:06:12,865][0m Trial 776 finished with value: 1008.7347254792319 and parameters: {'depth': 8, 'learning_rate': 0.024410709374235402, 'iterations': 1487, 'l2_leaf_reg': 0.003932625444915726, 'border_count': 23, 'bagging_temperature': 0.16206288265726168, 'random_strength': 0.18264036314720636, 'grow_policy': 'SymmetricTree', 'min_data_in_leaf': 182}. Best is trial 575 with value: 965.9974213974682.[0m
[32m[I 2024-10-13 04:06:22,894][0m Trial 777 finished with value: 1187.3888224879681 and parameters: {'depth': 8, 'learning_rate': 0.025675619488077887, 'iterations': 1424, 'l2_leaf_reg': 0.00885379191066696, 'border_count': 27, 'bagging_temperature': 0.14521155571253264, 'random_strength': 0.5626062907237069, 'grow_policy': 'SymmetricTree', 'min_data_in_leaf': 179}. Best is trial 575 with value: 965.9974213974682.[0m
[32m[I 2024-10-13 04:06:40,982][0m Trial 778 finished with value: 1160.773140769998 and parameters: {'depth': 10, 'learning_rate': 0.02650089551769309, 'iterations': 1570, 'l2_leaf_reg': 0.006550142835418474, 'border_count': 33, 'bagging_temperature': 0.11499856840226041, 'random_strength': 0.1678904772651897, 'grow_policy': 'SymmetricTree', 'min_data_in_leaf': 164}. Best is trial 575 with value: 965.9974213974682.[0m
[32m[I 2024-10-13 04:06:42,588][0m Trial 779 finished with value: 1231.4826019867742 and parameters: {'depth': 8, 'learning_rate': 0.023660335184204916, 'iterations': 1493, 'l2_leaf_reg': 0.004424351331073607, 'border_count': 23, 'bagging_temperature': 0.16276319188840832, 'random_strength': 0.350340026819041, 'grow_policy': 'Lossguide', 'min_data_in_leaf': 156, 'max_leaves': 36}. Best is trial 575 with value: 965.9974213974682.[0m
[32m[I 2024-10-13 04:07:02,034][0m Trial 780 finished with value: 1192.1365041180532 and parameters: {'depth': 11, 'learning_rate': 0.022027834119042636, 'iterations': 1529, 'l2_leaf_reg': 0.010217596619208777, 'border_count': 28, 'bagging_temperature': 0.13671892260756865, 'random_strength': 0.00804602726079992, 'grow_policy': 'SymmetricTree', 'min_data_in_leaf': 185}. Best is trial 575 with value: 965.9974213974682.[0m
[32m[I 2024-10-13 04:07:17,013][0m Trial 781 finished with value: 1225.7877422125569 and parameters: {'depth': 10, 'learning_rate': 0.0291850103371195, 'iterations': 1621, 'l2_leaf_reg': 0.009671382964446083, 'border_count': 44, 'bagging_temperature': 0.16994409449338474, 'random_strength': 0.3601089952738668, 'grow_policy': 'SymmetricTree', 'min_data_in_leaf': 145}. Best is trial 575 with value: 965.9974213974682.[0m
[32m[I 2024-10-13 04:07:24,068][0m Trial 782 finished with value: 1544.484170720865 and parameters: {'depth': 8, 'learning_rate': 0.01964599873238194, 'iterations': 1505, 'l2_leaf_reg': 0.0036515491118711886, 'border_count': 5, 'bagging_temperature': 0.14919450532415232, 'random_strength': 0.5914381463651078, 'grow_policy': 'SymmetricTree', 'min_data_in_leaf': 177}. Best is trial 575 with value: 965.9974213974682.[0m
[32m[I 2024-10-13 04:07:32,676][0m Trial 783 finished with value: 1051.8177349652028 and parameters: {'depth': 9, 'learning_rate': 0.024540074082241233, 'iterations': 1471, 'l2_leaf_reg': 0.006405427605577933, 'border_count': 22, 'bagging_temperature': 0.17451665341596018, 'random_strength': 0.1557113414108037, 'grow_policy': 'SymmetricTree', 'min_data_in_leaf': 192}. Best is trial 575 with value: 965.9974213974682.[0m
[32m[I 2024-10-13 04:07:41,009][0m Trial 784 finished with value: 1305.4501988882378 and parameters: {'depth': 9, 'learning_rate': 0.030681743124160592, 'iterations': 1375, 'l2_leaf_reg': 0.2083570014931623, 'border_count': 34, 'bagging_temperature': 0.18361065578806876, 'random_strength': 0.8536972040434722, 'grow_policy': 'SymmetricTree', 'min_data_in_leaf': 164}. Best is trial 575 with value: 965.9974213974682.[0m
[32m[I 2024-10-13 04:07:49,618][0m Trial 785 finished with value: 1060.3289643225473 and parameters: {'depth': 8, 'learning_rate': 0.020411216682479943, 'iterations': 1575, 'l2_leaf_reg': 0.5065492142173503, 'border_count': 17, 'bagging_temperature': 0.15292734560701757, 'random_strength': 0.3202392856909515, 'grow_policy': 'SymmetricTree', 'min_data_in_leaf': 194}. Best is trial 575 with value: 965.9974213974682.[0m
[32m[I 2024-10-13 04:08:24,488][0m Trial 786 finished with value: 1415.5365742782647 and parameters: {'depth': 10, 'learning_rate': 0.01615016074192269, 'iterations': 1467, 'l2_leaf_reg': 9.26352657345359e-06, 'border_count': 133, 'bagging_temperature': 0.12237664975161341, 'random_strength': 0.16213853806859277, 'grow_policy': 'SymmetricTree', 'min_data_in_leaf': 126}. Best is trial 575 with value: 965.9974213974682.[0m
[32m[I 2024-10-13 04:08:40,245][0m Trial 787 finished with value: 1259.6843795956106 and parameters: {'depth': 11, 'learning_rate': 0.017928093441470547, 'iterations': 1337, 'l2_leaf_reg': 2.748227532276789e-05, 'border_count': 11, 'bagging_temperature': 0.09721400622427273, 'random_strength': 0.011122194131737484, 'grow_policy': 'SymmetricTree', 'min_data_in_leaf': 601}. Best is trial 575 with value: 965.9974213974682.[0m
[32m[I 2024-10-13 04:08:51,815][0m Trial 788 finished with value: 1177.6889044197965 and parameters: {'depth': 9, 'learning_rate': 0.022938582968874736, 'iterations': 1394, 'l2_leaf_reg': 0.004328934771608366, 'border_count': 28, 'bagging_temperature': 0.8004246470627411, 'random_strength': 5.1110217820039825, 'grow_policy': 'SymmetricTree', 'min_data_in_leaf': 199}. Best is trial 575 with value: 965.9974213974682.[0m
[32m[I 2024-10-13 04:09:17,633][0m Trial 789 finished with value: 1004.7109573964618 and parameters: {'depth': 12, 'learning_rate': 0.02668741722526147, 'iterations': 1541, 'l2_leaf_reg': 0.012153302906505258, 'border_count': 23, 'bagging_temperature': 0.6535464416350564, 'random_strength': 0.003807733151250936, 'grow_policy': 'SymmetricTree', 'min_data_in_leaf': 171}. Best is trial 575 with value: 965.9974213974682.[0m
[32m[I 2024-10-13 04:09:46,947][0m Trial 790 finished with value: 1250.024205608279 and parameters: {'depth': 12, 'learning_rate': 0.031082172685798222, 'iterations': 1584, 'l2_leaf_reg': 0.012236178153730409, 'border_count': 37, 'bagging_temperature': 0.6342502925160431, 'random_strength': 0.4919587620156126, 'grow_policy': 'SymmetricTree', 'min_data_in_leaf': 170}. Best is trial 575 with value: 965.9974213974682.[0m
[32m[I 2024-10-13 04:10:13,238][0m Trial 791 finished with value: 1111.5954994860513 and parameters: {'depth': 12, 'learning_rate': 0.01738012498196424, 'iterations': 1668, 'l2_leaf_reg': 0.011035260586582845, 'border_count': 30, 'bagging_temperature': 0.6525459593994154, 'random_strength': 0.3178856492506927, 'grow_policy': 'SymmetricTree', 'min_data_in_leaf': 137}. Best is trial 575 with value: 965.9974213974682.[0m
[32m[I 2024-10-13 04:10:53,938][0m Trial 792 finished with value: 1128.7410910368594 and parameters: {'depth': 13, 'learning_rate': 0.021044013645552105, 'iterations': 1509, 'l2_leaf_reg': 0.007178320799644692, 'border_count': 25, 'bagging_temperature': 0.6560393984939328, 'random_strength': 0.18174657071870143, 'grow_policy': 'SymmetricTree', 'min_data_in_leaf': 138}. Best is trial 575 with value: 965.9974213974682.[0m
[32m[I 2024-10-13 04:11:34,297][0m Trial 793 finished with value: 1078.931400453256 and parameters: {'depth': 12, 'learning_rate': 0.04116725976727033, 'iterations': 1543, 'l2_leaf_reg': 1.4992555250273692e-05, 'border_count': 23, 'bagging_temperature': 0.6153572649545378, 'random_strength': 0.6685512233739797, 'grow_policy': 'SymmetricTree', 'min_data_in_leaf': 147}. Best is trial 575 with value: 965.9974213974682.[0m
[32m[I 2024-10-13 04:11:54,067][0m Trial 794 finished with value: 1274.1655963601786 and parameters: {'depth': 12, 'learning_rate': 0.01574127198253746, 'iterations': 1637, 'l2_leaf_reg': 0.01128291046287753, 'border_count': 31, 'bagging_temperature': 0.6769611101964218, 'random_strength': 0.46820578679108704, 'grow_policy': 'SymmetricTree', 'min_data_in_leaf': 161}. Best is trial 575 with value: 965.9974213974682.[0m
[32m[I 2024-10-13 04:11:55,924][0m Trial 795 finished with value: 1213.6397759035488 and parameters: {'depth': 12, 'learning_rate': 0.01398623136929101, 'iterations': 1590, 'l2_leaf_reg': 0.006774407482696901, 'border_count': 22, 'bagging_temperature': 0.16183618712966427, 'random_strength': 0.18790742898015644, 'grow_policy': 'Depthwise', 'min_data_in_leaf': 86}. Best is trial 575 with value: 965.9974213974682.[0m
[32m[I 2024-10-13 04:12:37,441][0m Trial 796 finished with value: 1270.043446364032 and parameters: {'depth': 12, 'learning_rate': 0.01977004144748869, 'iterations': 1709, 'l2_leaf_reg': 0.015615622696683996, 'border_count': 38, 'bagging_temperature': 0.6658551394217728, 'random_strength': 0.0011326614993820983, 'grow_policy': 'SymmetricTree', 'min_data_in_leaf': 544}. Best is trial 575 with value: 965.9974213974682.[0m
[32m[I 2024-10-13 04:13:07,783][0m Trial 797 finished with value: 1261.6178070980052 and parameters: {'depth': 13, 'learning_rate': 0.03474033121375823, 'iterations': 1545, 'l2_leaf_reg': 0.011480371330535182, 'border_count': 26, 'bagging_temperature': 0.1947572770354314, 'random_strength': 8.315895332066319, 'grow_policy': 'SymmetricTree', 'min_data_in_leaf': 640}. Best is trial 575 with value: 965.9974213974682.[0m
[32m[I 2024-10-13 04:13:26,054][0m Trial 798 finished with value: 1136.4218613952432 and parameters: {'depth': 12, 'learning_rate': 0.026997027740475004, 'iterations': 1470, 'l2_leaf_reg': 0.005877572074543177, 'border_count': 18, 'bagging_temperature': 0.07696397254533952, 'random_strength': 0.0019515858214047435, 'grow_policy': 'SymmetricTree', 'min_data_in_leaf': 114}. Best is trial 575 with value: 965.9974213974682.[0m
[32m[I 2024-10-13 04:13:33,524][0m Trial 799 finished with value: 1214.1237955113243 and parameters: {'depth': 8, 'learning_rate': 0.013999281356433753, 'iterations': 1425, 'l2_leaf_reg': 0.01718043567499524, 'border_count': 33, 'bagging_temperature': 0.6350161286070144, 'random_strength': 0.36209192471085, 'grow_policy': 'SymmetricTree', 'min_data_in_leaf': 589}. Best is trial 575 with value: 965.9974213974682.[0m
[32m[I 2024-10-13 04:13:52,233][0m Trial 800 finished with value: 1115.1588870325095 and parameters: {'depth': 12, 'learning_rate': 0.023168378878563503, 'iterations': 1456, 'l2_leaf_reg': 0.009355504361693209, 'border_count': 13, 'bagging_temperature': 0.6452399730429454, 'random_strength': 0.615665154508071, 'grow_policy': 'SymmetricTree', 'min_data_in_leaf': 181}. Best is trial 575 with value: 965.9974213974682.[0m
[32m[I 2024-10-13 04:14:15,768][0m Trial 801 finished with value: 1013.4946017831254 and parameters: {'depth': 12, 'learning_rate': 0.016944726882775936, 'iterations': 1534, 'l2_leaf_reg': 0.0032973496892443133, 'border_count': 22, 'bagging_temperature': 0.5959740052906476, 'random_strength': 0.3108219707643612, 'grow_policy': 'SymmetricTree', 'min_data_in_leaf': 560}. Best is trial 575 with value: 965.9974213974682.[0m
[32m[I 2024-10-13 04:14:17,261][0m Trial 802 finished with value: 1415.8013064177321 and parameters: {'depth': 12, 'learning_rate': 0.019555351641086724, 'iterations': 1349, 'l2_leaf_reg': 0.004581437722923902, 'border_count': 29, 'bagging_temperature': 0.18229272132552757, 'random_strength': 0.1870514522545842, 'grow_policy': 'Lossguide', 'min_data_in_leaf': 581, 'max_leaves': 54}. Best is trial 575 with value: 965.9974213974682.[0m
[32m[I 2024-10-13 04:14:26,762][0m Trial 803 finished with value: 1096.4209936431798 and parameters: {'depth': 8, 'learning_rate': 0.02580556259403537, 'iterations': 1777, 'l2_leaf_reg': 0.016190013989947544, 'border_count': 17, 'bagging_temperature': 0.9452617565011555, 'random_strength': 0.0026834434281135747, 'grow_policy': 'SymmetricTree', 'min_data_in_leaf': 617}. Best is trial 575 with value: 965.9974213974682.[0m
[32m[I 2024-10-13 04:14:38,823][0m Trial 804 finished with value: 1075.4864385301184 and parameters: {'depth': 12, 'learning_rate': 0.013794503590395153, 'iterations': 1499, 'l2_leaf_reg': 0.007769839978697999, 'border_count': 22, 'bagging_temperature': 0.14852635976573542, 'random_strength': 0.47692273226829973, 'grow_policy': 'SymmetricTree', 'min_data_in_leaf': 666}. Best is trial 575 with value: 965.9974213974682.[0m
[32m[I 2024-10-13 04:14:49,144][0m Trial 805 finished with value: 1156.4348944285518 and parameters: {'depth': 8, 'learning_rate': 0.018058914287906788, 'iterations': 1599, 'l2_leaf_reg': 0.021565520149898234, 'border_count': 27, 'bagging_temperature': 0.6870082366317573, 'random_strength': 0.8297538593626501, 'grow_policy': 'SymmetricTree', 'min_data_in_leaf': 171}. Best is trial 575 with value: 965.9974213974682.[0m
[32m[I 2024-10-13 04:15:03,490][0m Trial 806 finished with value: 1305.4474466909771 and parameters: {'depth': 11, 'learning_rate': 0.030491979204250303, 'iterations': 1395, 'l2_leaf_reg': 0.005455113626269875, 'border_count': 10, 'bagging_temperature': 0.6111562244564372, 'random_strength': 0.3316966159864603, 'grow_policy': 'SymmetricTree', 'min_data_in_leaf': 149}. Best is trial 575 with value: 965.9974213974682.[0m
[32m[I 2024-10-13 04:15:09,015][0m Trial 807 finished with value: 1187.5374809356258 and parameters: {'depth': 6, 'learning_rate': 0.02296219083253319, 'iterations': 1310, 'l2_leaf_reg': 0.010596246159447296, 'border_count': 17, 'bagging_temperature': 0.9254003287444519, 'random_strength': 3.6188665895547385, 'grow_policy': 'SymmetricTree', 'min_data_in_leaf': 200}. Best is trial 575 with value: 965.9974213974682.[0m
[32m[I 2024-10-13 04:15:15,039][0m Trial 808 finished with value: 1132.8076784589964 and parameters: {'depth': 6, 'learning_rate': 0.015395398246435417, 'iterations': 1656, 'l2_leaf_reg': 0.013179800482641911, 'border_count': 24, 'bagging_temperature': 0.13342729783848822, 'random_strength': 0.18600494496799802, 'grow_policy': 'SymmetricTree', 'min_data_in_leaf': 214}. Best is trial 575 with value: 965.9974213974682.[0m
[32m[I 2024-10-13 04:15:39,641][0m Trial 809 finished with value: 1284.5409009864916 and parameters: {'depth': 13, 'learning_rate': 0.02084190465561819, 'iterations': 1434, 'l2_leaf_reg': 0.017200677002160606, 'border_count': 32, 'bagging_temperature': 0.6665873279070081, 'random_strength': 0.5561012470459176, 'grow_policy': 'SymmetricTree', 'min_data_in_leaf': 644}. Best is trial 575 with value: 965.9974213974682.[0m
[32m[I 2024-10-13 04:15:46,104][0m Trial 810 finished with value: 1026.068224433151 and parameters: {'depth': 8, 'learning_rate': 0.012939280257056422, 'iterations': 1330, 'l2_leaf_reg': 0.026118722849056777, 'border_count': 14, 'bagging_temperature': 0.16577295872380626, 'random_strength': 0.2268932515478501, 'grow_policy': 'SymmetricTree', 'min_data_in_leaf': 602}. Best is trial 575 with value: 965.9974213974682.[0m
[32m[I 2024-10-13 04:16:02,031][0m Trial 811 finished with value: 1027.1202517551606 and parameters: {'depth': 11, 'learning_rate': 0.016806514315226364, 'iterations': 1466, 'l2_leaf_reg': 0.0038491691307895436, 'border_count': 19, 'bagging_temperature': 0.9035606999340701, 'random_strength': 0.16297186348434467, 'grow_policy': 'SymmetricTree', 'min_data_in_leaf': 554}. Best is trial 575 with value: 965.9974213974682.[0m
[32m[I 2024-10-13 04:16:41,126][0m Trial 812 finished with value: 1256.1879793785115 and parameters: {'depth': 12, 'learning_rate': 0.02808771987926671, 'iterations': 1370, 'l2_leaf_reg': 0.02220109218611195, 'border_count': 193, 'bagging_temperature': 0.19079047254071463, 'random_strength': 0.44622643470761963, 'grow_policy': 'SymmetricTree', 'min_data_in_leaf': 707}. Best is trial 575 with value: 965.9974213974682.[0m
[32m[I 2024-10-13 04:16:51,755][0m Trial 813 finished with value: 1304.7906144506962 and parameters: {'depth': 8, 'learning_rate': 0.02317778145330528, 'iterations': 1551, 'l2_leaf_reg': 0.002950316364334277, 'border_count': 41, 'bagging_temperature': 0.20110462220127462, 'random_strength': 0.007257266569049015, 'grow_policy': 'SymmetricTree', 'min_data_in_leaf': 177}. Best is trial 575 with value: 965.9974213974682.[0m
[32m[I 2024-10-13 04:16:58,142][0m Trial 814 finished with value: 1318.9411271399642 and parameters: {'depth': 9, 'learning_rate': 0.0366469401358227, 'iterations': 1286, 'l2_leaf_reg': 0.008875957733444741, 'border_count': 26, 'bagging_temperature': 0.21470191193152643, 'random_strength': 2.773149439921, 'grow_policy': 'SymmetricTree', 'min_data_in_leaf': 625}. Best is trial 575 with value: 965.9974213974682.[0m
[32m[I 2024-10-13 04:17:19,919][0m Trial 815 finished with value: 1277.813792898699 and parameters: {'depth': 9, 'learning_rate': 0.015101903741168113, 'iterations': 1509, 'l2_leaf_reg': 0.006337247021258902, 'border_count': 155, 'bagging_temperature': 0.9152478425828369, 'random_strength': 0.31957751270323276, 'grow_policy': 'SymmetricTree', 'min_data_in_leaf': 584}. Best is trial 575 with value: 965.9974213974682.[0m
[32m[I 2024-10-13 04:17:39,397][0m Trial 816 finished with value: 1000.9574940873894 and parameters: {'depth': 11, 'learning_rate': 0.019119109079752436, 'iterations': 1379, 'l2_leaf_reg': 0.01642828103755998, 'border_count': 21, 'bagging_temperature': 0.6324662685428942, 'random_strength': 0.001253592811876743, 'grow_policy': 'SymmetricTree', 'min_data_in_leaf': 537}. Best is trial 575 with value: 965.9974213974682.[0m
[32m[I 2024-10-13 04:18:11,632][0m Trial 817 finished with value: 1279.954495261858 and parameters: {'depth': 11, 'learning_rate': 0.026651493444987004, 'iterations': 1404, 'l2_leaf_reg': 0.021904248550557993, 'border_count': 56, 'bagging_temperature': 0.6327628371572745, 'random_strength': 0.6735437256014508, 'grow_policy': 'SymmetricTree', 'min_data_in_leaf': 492}. Best is trial 575 with value: 965.9974213974682.[0m
