[32m[I 2024-10-13 04:18:13,215][0m Trial 818 finished with value: 1252.973207632212 and parameters: {'depth': 11, 'learning_rate': 0.019852741221740713, 'iterations': 1355, 'l2_leaf_reg': 0.014529005126570113, 'border_count': 35, 'bagging_temperature': 0.612764837835503, 'random_strength': 0.3290525691639234, 'grow_policy': 'Depthwise', 'min_data_in_leaf': 508}. Best is trial 575 with value: 965.9974213974682.[0m
[32m[I 2024-10-13 04:18:17,823][0m Trial 819 finished with value: 2862.51621460829 and parameters: {'depth': 11, 'learning_rate': 0.0323548878804969, 'iterations': 1431, 'l2_leaf_reg': 0.015027480600976419, 'border_count': 1, 'bagging_temperature': 0.8333194888817871, 'random_strength': 0.17112403846584917, 'grow_policy': 'SymmetricTree', 'min_data_in_leaf': 536}. Best is trial 575 with value: 965.9974213974682.[0m
[32m[I 2024-10-13 04:18:38,785][0m Trial 820 finished with value: 1159.18764659768 and parameters: {'depth': 11, 'learning_rate': 0.267840611332528, 'iterations': 1306, 'l2_leaf_reg': 0.027731098236994756, 'border_count': 29, 'bagging_temperature': 0.6182242511797809, 'random_strength': 0.0014414570362027423, 'grow_policy': 'SymmetricTree', 'min_data_in_leaf': 537}. Best is trial 575 with value: 965.9974213974682.[0m
[32m[I 2024-10-13 04:18:53,834][0m Trial 821 finished with value: 1186.187421301111 and parameters: {'depth': 11, 'learning_rate': 0.022858761877104675, 'iterations': 1379, 'l2_leaf_reg': 0.010409915274657372, 'border_count': 24, 'bagging_temperature': 0.6810380081085644, 'random_strength': 0.49649472901605873, 'grow_policy': 'SymmetricTree', 'min_data_in_leaf': 536}. Best is trial 575 with value: 965.9974213974682.[0m
[32m[I 2024-10-13 04:19:04,765][0m Trial 822 finished with value: 1125.2085984367961 and parameters: {'depth': 11, 'learning_rate': 0.012716050178655246, 'iterations': 1258, 'l2_leaf_reg': 5.271684810475863e-06, 'border_count': 21, 'bagging_temperature': 0.657190437931675, 'random_strength': 1.0769932133040612, 'grow_policy': 'SymmetricTree', 'min_data_in_leaf': 515}. Best is trial 575 with value: 965.9974213974682.[0m
[32m[I 2024-10-13 04:19:19,377][0m Trial 823 finished with value: 1200.9685435744664 and parameters: {'depth': 11, 'learning_rate': 0.019716675299133873, 'iterations': 1479, 'l2_leaf_reg': 0.017475593951634134, 'border_count': 12, 'bagging_temperature': 0.6484455237703018, 'random_strength': 0.19267209878341113, 'grow_policy': 'SymmetricTree', 'min_data_in_leaf': 562}. Best is trial 575 with value: 965.9974213974682.[0m
[32m[I 2024-10-13 04:19:50,355][0m Trial 824 finished with value: 1105.7870917398836 and parameters: {'depth': 12, 'learning_rate': 0.04256371558226955, 'iterations': 1333, 'l2_leaf_reg': 0.008896042578905751, 'border_count': 30, 'bagging_temperature': 0.8710262822711984, 'random_strength': 0.0028657664982945676, 'grow_policy': 'SymmetricTree', 'min_data_in_leaf': 553}. Best is trial 575 with value: 965.9974213974682.[0m
[32m[I 2024-10-13 04:19:51,898][0m Trial 825 finished with value: 1157.79540273021 and parameters: {'depth': 11, 'learning_rate': 0.015491011700562017, 'iterations': 1408, 'l2_leaf_reg': 0.0051916823472956475, 'border_count': 16, 'bagging_temperature': 0.5886647402046851, 'random_strength': 9.653360836246755, 'grow_policy': 'Lossguide', 'min_data_in_leaf': 535, 'max_leaves': 196}. Best is trial 575 with value: 965.9974213974682.[0m
[32m[I 2024-10-13 04:20:11,300][0m Trial 826 finished with value: 1177.2167186164263 and parameters: {'depth': 12, 'learning_rate': 0.02597476127531736, 'iterations': 1480, 'l2_leaf_reg': 0.03190149761575011, 'border_count': 24, 'bagging_temperature': 0.6189078400060283, 'random_strength': 7.592477503900533, 'grow_policy': 'SymmetricTree', 'min_data_in_leaf': 564}. Best is trial 575 with value: 965.9974213974682.[0m
[32m[I 2024-10-13 04:20:21,856][0m Trial 827 finished with value: 1108.0506385573403 and parameters: {'depth': 11, 'learning_rate': 0.012314264532808546, 'iterations': 1286, 'l2_leaf_reg': 0.01312179025541392, 'border_count': 19, 'bagging_temperature': 0.6412641154371546, 'random_strength': 0.3605037157595876, 'grow_policy': 'SymmetricTree', 'min_data_in_leaf': 504}. Best is trial 575 with value: 965.9974213974682.[0m
[32m[I 2024-10-13 04:20:29,078][0m Trial 828 finished with value: 1349.5068222338286 and parameters: {'depth': 8, 'learning_rate': 0.020696559388277264, 'iterations': 1560, 'l2_leaf_reg': 0.02125055001829651, 'border_count': 9, 'bagging_temperature': 0.6587571792725235, 'random_strength': 0.6704664837100243, 'grow_policy': 'SymmetricTree', 'min_data_in_leaf': 127}. Best is trial 575 with value: 965.9974213974682.[0m
[32m[I 2024-10-13 04:20:36,568][0m Trial 829 finished with value: 1217.8470175580592 and parameters: {'depth': 7, 'learning_rate': 0.06939211545938388, 'iterations': 1364, 'l2_leaf_reg': 0.03341497434889003, 'border_count': 27, 'bagging_temperature': 0.6427588001437414, 'random_strength': 8.759496269965698, 'grow_policy': 'SymmetricTree', 'min_data_in_leaf': 153}. Best is trial 575 with value: 965.9974213974682.[0m
[32m[I 2024-10-13 04:20:44,776][0m Trial 830 finished with value: 1191.599411723805 and parameters: {'depth': 8, 'learning_rate': 0.01789780056409626, 'iterations': 1430, 'l2_leaf_reg': 0.007688142528135091, 'border_count': 34, 'bagging_temperature': 0.6306890577557484, 'random_strength': 0.1696938999152117, 'grow_policy': 'SymmetricTree', 'min_data_in_leaf': 574}. Best is trial 575 with value: 965.9974213974682.[0m
[32m[I 2024-10-13 04:21:01,183][0m Trial 831 finished with value: 1056.061041370299 and parameters: {'depth': 12, 'learning_rate': 0.014618840729902516, 'iterations': 1263, 'l2_leaf_reg': 0.0023035335499500564, 'border_count': 21, 'bagging_temperature': 0.6938515727506657, 'random_strength': 0.4436988403016868, 'grow_policy': 'SymmetricTree', 'min_data_in_leaf': 480}. Best is trial 575 with value: 965.9974213974682.[0m
[32m[I 2024-10-13 04:21:07,705][0m Trial 832 finished with value: 1073.5933562265484 and parameters: {'depth': 7, 'learning_rate': 0.03105375336741685, 'iterations': 1514, 'l2_leaf_reg': 0.003395606344529091, 'border_count': 16, 'bagging_temperature': 0.6073068813169655, 'random_strength': 0.27659347827582326, 'grow_policy': 'SymmetricTree', 'min_data_in_leaf': 213}. Best is trial 575 with value: 965.9974213974682.[0m
[32m[I 2024-10-13 04:21:20,643][0m Trial 833 finished with value: 1473.8534712223684 and parameters: {'depth': 11, 'learning_rate': 0.02552031530541401, 'iterations': 1604, 'l2_leaf_reg': 0.04530562812577682, 'border_count': 7, 'bagging_temperature': 0.6698976898295154, 'random_strength': 7.168439133408462, 'grow_policy': 'SymmetricTree', 'min_data_in_leaf': 189}. Best is trial 575 with value: 965.9974213974682.[0m
[32m[I 2024-10-13 04:21:26,506][0m Trial 834 finished with value: 1119.6516184361274 and parameters: {'depth': 7, 'learning_rate': 0.01649495132618491, 'iterations': 1331, 'l2_leaf_reg': 0.01727091426183232, 'border_count': 29, 'bagging_temperature': 0.40400348229265093, 'random_strength': 0.16253137818273647, 'grow_policy': 'SymmetricTree', 'min_data_in_leaf': 523}. Best is trial 575 with value: 965.9974213974682.[0m
[32m[I 2024-10-13 04:21:32,600][0m Trial 835 finished with value: 1149.8458538232715 and parameters: {'depth': 8, 'learning_rate': 0.01151259152505091, 'iterations': 1227, 'l2_leaf_reg': 0.02456037359831899, 'border_count': 14, 'bagging_temperature': 0.3585787466991099, 'random_strength': 0.8463244650935329, 'grow_policy': 'SymmetricTree', 'min_data_in_leaf': 547}. Best is trial 575 with value: 965.9974213974682.[0m
[32m[I 2024-10-13 04:23:20,778][0m Trial 836 finished with value: 1032.7279458577636 and parameters: {'depth': 15, 'learning_rate': 0.03629423090690494, 'iterations': 1383, 'l2_leaf_reg': 1.8718293326909357e-06, 'border_count': 24, 'bagging_temperature': 0.8861381477350324, 'random_strength': 0.001740858027516591, 'grow_policy': 'SymmetricTree', 'min_data_in_leaf': 170}. Best is trial 575 with value: 965.9974213974682.[0m
[32m[I 2024-10-13 04:23:39,323][0m Trial 837 finished with value: 1105.9213610185811 and parameters: {'depth': 11, 'learning_rate': 0.020769556379028675, 'iterations': 1466, 'l2_leaf_reg': 0.005482380358774412, 'border_count': 20, 'bagging_temperature': 0.698409713094555, 'random_strength': 0.49000755527825274, 'grow_policy': 'SymmetricTree', 'min_data_in_leaf': 217}. Best is trial 575 with value: 965.9974213974682.[0m
[32m[I 2024-10-13 04:23:48,542][0m Trial 838 finished with value: 1254.069895108149 and parameters: {'depth': 8, 'learning_rate': 0.013634848452975844, 'iterations': 1689, 'l2_leaf_reg': 0.04628968484906397, 'border_count': 39, 'bagging_temperature': 0.952980886686753, 'random_strength': 0.31481617035054704, 'grow_policy': 'SymmetricTree', 'min_data_in_leaf': 194}. Best is trial 575 with value: 965.9974213974682.[0m
[32m[I 2024-10-13 04:23:55,785][0m Trial 839 finished with value: 2949.9273707232 and parameters: {'depth': 6, 'learning_rate': 0.0005011150835752458, 'iterations': 1313, 'l2_leaf_reg': 0.012151026334342434, 'border_count': 31, 'bagging_temperature': 0.9305994869311104, 'random_strength': 0.004660586673099892, 'grow_policy': 'SymmetricTree', 'min_data_in_leaf': 576}. Best is trial 575 with value: 965.9974213974682.[0m
[32m[I 2024-10-13 04:24:02,961][0m Trial 840 finished with value: 1142.3174656196102 and parameters: {'depth': 8, 'learning_rate': 0.017895119568839782, 'iterations': 1438, 'l2_leaf_reg': 0.029987274013756383, 'border_count': 25, 'bagging_temperature': 0.24474009264165783, 'random_strength': 0.5804520597868504, 'grow_policy': 'SymmetricTree', 'min_data_in_leaf': 155}. Best is trial 575 with value: 965.9974213974682.[0m
[32m[I 2024-10-13 04:24:04,637][0m Trial 841 finished with value: 1158.827310831761 and parameters: {'depth': 12, 'learning_rate': 0.02334251804228464, 'iterations': 1544, 'l2_leaf_reg': 0.0020346462384672574, 'border_count': 14, 'bagging_temperature': 0.589385090671363, 'random_strength': 0.3073581474504159, 'grow_policy': 'Depthwise', 'min_data_in_leaf': 116}. Best is trial 575 with value: 965.9974213974682.[0m
[32m[I 2024-10-13 04:24:31,039][0m Trial 842 finished with value: 1151.0404179525333 and parameters: {'depth': 13, 'learning_rate': 0.0551894199594392, 'iterations': 1220, 'l2_leaf_reg': 0.05951772987295907, 'border_count': 19, 'bagging_temperature': 0.6327100915365846, 'random_strength': 0.1913563998090086, 'grow_policy': 'SymmetricTree', 'min_data_in_leaf': 222}. Best is trial 575 with value: 965.9974213974682.[0m
[32m[I 2024-10-13 04:24:36,376][0m Trial 843 finished with value: 1323.3253806323453 and parameters: {'depth': 7, 'learning_rate': 0.028628285232666174, 'iterations': 1381, 'l2_leaf_reg': 0.01895138961830453, 'border_count': 11, 'bagging_temperature': 0.2548069689551693, 'random_strength': 0.45418931704470783, 'grow_policy': 'SymmetricTree', 'min_data_in_leaf': 176}. Best is trial 575 with value: 965.9974213974682.[0m
[32m[I 2024-10-13 04:24:43,610][0m Trial 844 finished with value: 1211.123853518045 and parameters: {'depth': 8, 'learning_rate': 0.015236673844384053, 'iterations': 1314, 'l2_leaf_reg': 0.007624272425496478, 'border_count': 25, 'bagging_temperature': 0.8539941069374554, 'random_strength': 0.7474631257773329, 'grow_policy': 'SymmetricTree', 'min_data_in_leaf': 547}. Best is trial 575 with value: 965.9974213974682.[0m
[32m[I 2024-10-13 04:24:51,840][0m Trial 845 finished with value: 1128.0122509488954 and parameters: {'depth': 9, 'learning_rate': 0.011501521061379565, 'iterations': 1491, 'l2_leaf_reg': 0.03423990128360654, 'border_count': 21, 'bagging_temperature': 0.44919716291115275, 'random_strength': 1.8080184848014214, 'grow_policy': 'SymmetricTree', 'min_data_in_leaf': 204}. Best is trial 575 with value: 965.9974213974682.[0m
[32m[I 2024-10-13 04:24:53,316][0m Trial 846 finished with value: 1218.812452368038 and parameters: {'depth': 7, 'learning_rate': 0.018469981845711674, 'iterations': 1270, 'l2_leaf_reg': 0.0036753028754085127, 'border_count': 33, 'bagging_temperature': 0.9008997235852065, 'random_strength': 0.18145212349768686, 'grow_policy': 'Lossguide', 'min_data_in_leaf': 594, 'max_leaves': 68}. Best is trial 575 with value: 965.9974213974682.[0m
[32m[I 2024-10-13 04:25:01,590][0m Trial 847 finished with value: 1292.6240564132722 and parameters: {'depth': 8, 'learning_rate': 0.02258482320279283, 'iterations': 1638, 'l2_leaf_reg': 3.2327574501699253e-07, 'border_count': 6, 'bagging_temperature': 0.27315458014356786, 'random_strength': 0.0027009181155490934, 'grow_policy': 'SymmetricTree', 'min_data_in_leaf': 510}. Best is trial 575 with value: 965.9974213974682.[0m
[32m[I 2024-10-13 04:25:12,173][0m Trial 848 finished with value: 1088.9952204510148 and parameters: {'depth': 11, 'learning_rate': 0.013382440593139826, 'iterations': 1418, 'l2_leaf_reg': 0.012202234664921497, 'border_count': 16, 'bagging_temperature': 0.5985297174880322, 'random_strength': 0.32572159414871216, 'grow_policy': 'SymmetricTree', 'min_data_in_leaf': 446}. Best is trial 575 with value: 965.9974213974682.[0m
[32m[I 2024-10-13 04:25:20,755][0m Trial 849 finished with value: 1197.6179424400852 and parameters: {'depth': 9, 'learning_rate': 0.02593587807706735, 'iterations': 1350, 'l2_leaf_reg': 0.04561240903810522, 'border_count': 29, 'bagging_temperature': 0.9205806970845984, 'random_strength': 0.19070576069553172, 'grow_policy': 'SymmetricTree', 'min_data_in_leaf': 567}. Best is trial 575 with value: 965.9974213974682.[0m
[32m[I 2024-10-13 04:25:30,917][0m Trial 850 finished with value: 1312.6239350016106 and parameters: {'depth': 8, 'learning_rate': 0.016532354411360112, 'iterations': 1205, 'l2_leaf_reg': 0.022460688162212528, 'border_count': 84, 'bagging_temperature': 0.6631743100896974, 'random_strength': 0.5038385101312154, 'grow_policy': 'SymmetricTree', 'min_data_in_leaf': 227}. Best is trial 575 with value: 965.9974213974682.[0m
[32m[I 2024-10-13 04:26:22,128][0m Trial 851 finished with value: 1286.2227639090931 and parameters: {'depth': 12, 'learning_rate': 0.020763259258271487, 'iterations': 1546, 'l2_leaf_reg': 0.004468863707702607, 'border_count': 46, 'bagging_temperature': 0.6860658089910671, 'random_strength': 0.006078674490913694, 'grow_policy': 'SymmetricTree', 'min_data_in_leaf': 528}. Best is trial 575 with value: 965.9974213974682.[0m
[32m[I 2024-10-13 04:26:29,379][0m Trial 852 finished with value: 1081.7133602922324 and parameters: {'depth': 7, 'learning_rate': 0.044708951595221605, 'iterations': 1467, 'l2_leaf_reg': 0.05366813503781713, 'border_count': 22, 'bagging_temperature': 0.9412449330625925, 'random_strength': 0.3597021567600958, 'grow_policy': 'SymmetricTree', 'min_data_in_leaf': 35}. Best is trial 575 with value: 965.9974213974682.[0m
[32m[I 2024-10-13 04:26:36,291][0m Trial 853 finished with value: 1223.3007753502857 and parameters: {'depth': 8, 'learning_rate': 0.031613857057369285, 'iterations': 1600, 'l2_leaf_reg': 0.008954300367876304, 'border_count': 12, 'bagging_temperature': 0.3205420891563169, 'random_strength': 0.1726589143106825, 'grow_policy': 'SymmetricTree', 'min_data_in_leaf': 142}. Best is trial 575 with value: 965.9974213974682.[0m
[32m[I 2024-10-13 04:26:41,965][0m Trial 854 finished with value: 1254.92884143823 and parameters: {'depth': 6, 'learning_rate': 0.010593352924867568, 'iterations': 1385, 'l2_leaf_reg': 0.02932577955162962, 'border_count': 26, 'bagging_temperature': 0.6227248760271945, 'random_strength': 0.6080712158266489, 'grow_policy': 'SymmetricTree', 'min_data_in_leaf': 186}. Best is trial 575 with value: 965.9974213974682.[0m
[32m[I 2024-10-13 04:26:55,891][0m Trial 855 finished with value: 1027.3839246770028 and parameters: {'depth': 11, 'learning_rate': 0.014879465103306833, 'iterations': 1297, 'l2_leaf_reg': 1.2069287514603238e-08, 'border_count': 17, 'bagging_temperature': 0.041830755892365956, 'random_strength': 0.2054952774617447, 'grow_policy': 'SymmetricTree', 'min_data_in_leaf': 232}. Best is trial 575 with value: 965.9974213974682.[0m
[32m[I 2024-10-13 04:27:07,063][0m Trial 856 finished with value: 1346.3689456521643 and parameters: {'depth': 8, 'learning_rate': 0.018337681246417666, 'iterations': 1255, 'l2_leaf_reg': 0.01633637399816547, 'border_count': 111, 'bagging_temperature': 0.431408631718811, 'random_strength': 0.4179017892007495, 'grow_policy': 'SymmetricTree', 'min_data_in_leaf': 206}. Best is trial 575 with value: 965.9974213974682.[0m
[32m[I 2024-10-13 04:27:17,250][0m Trial 857 finished with value: 1244.131366572466 and parameters: {'depth': 9, 'learning_rate': 0.012603298320366572, 'iterations': 1429, 'l2_leaf_reg': 0.0024147622601674956, 'border_count': 36, 'bagging_temperature': 0.34509002267904315, 'random_strength': 0.1762767998693841, 'grow_policy': 'SymmetricTree', 'min_data_in_leaf': 583}. Best is trial 575 with value: 965.9974213974682.[0m
[32m[I 2024-10-13 04:27:22,701][0m Trial 858 finished with value: 1061.8287586666208 and parameters: {'depth': 7, 'learning_rate': 0.02416650193362809, 'iterations': 1361, 'l2_leaf_reg': 0.034539463575292625, 'border_count': 21, 'bagging_temperature': 0.10947920817963433, 'random_strength': 0.7296555660945786, 'grow_policy': 'SymmetricTree', 'min_data_in_leaf': 168}. Best is trial 575 with value: 965.9974213974682.[0m
[32m[I 2024-10-13 04:27:27,632][0m Trial 859 finished with value: 1242.0869251562467 and parameters: {'depth': 3, 'learning_rate': 0.021050620017356764, 'iterations': 1511, 'l2_leaf_reg': 0.06751704935849405, 'border_count': 29, 'bagging_temperature': 0.2260828872071784, 'random_strength': 0.36270989044804697, 'grow_policy': 'SymmetricTree', 'min_data_in_leaf': 551}. Best is trial 575 with value: 965.9974213974682.[0m
[32m[I 2024-10-13 04:27:37,846][0m Trial 860 finished with value: 1061.6527738211394 and parameters: {'depth': 11, 'learning_rate': 0.02758034632399958, 'iterations': 1326, 'l2_leaf_reg': 0.005891960125987651, 'border_count': 16, 'bagging_temperature': 0.26346414228385473, 'random_strength': 0.17521006686187818, 'grow_policy': 'SymmetricTree', 'min_data_in_leaf': 97}. Best is trial 575 with value: 965.9974213974682.[0m
[32m[I 2024-10-13 04:27:39,282][0m Trial 861 finished with value: 1330.1166393125766 and parameters: {'depth': 7, 'learning_rate': 0.035258970980960584, 'iterations': 1225, 'l2_leaf_reg': 0.02342439451683449, 'border_count': 8, 'bagging_temperature': 0.8785448980990391, 'random_strength': 0.0051929899864915086, 'grow_policy': 'Depthwise', 'min_data_in_leaf': 188}. Best is trial 575 with value: 965.9974213974682.[0m
[32m[I 2024-10-13 04:27:54,149][0m Trial 862 finished with value: 3496.2697473196567 and parameters: {'depth': 9, 'learning_rate': 0.00034296516499233526, 'iterations': 1436, 'l2_leaf_reg': 0.012865102701528608, 'border_count': 25, 'bagging_temperature': 0.5811739394865527, 'random_strength': 4.756767019826035, 'grow_policy': 'SymmetricTree', 'min_data_in_leaf': 601}. Best is trial 575 with value: 965.9974213974682.[0m
[32m[I 2024-10-13 04:27:57,084][0m Trial 863 finished with value: 1137.4996108854755 and parameters: {'depth': 7, 'learning_rate': 0.09144558101550969, 'iterations': 634, 'l2_leaf_reg': 0.07563326988159846, 'border_count': 20, 'bagging_temperature': 0.28573747016085915, 'random_strength': 0.4563327453631385, 'grow_policy': 'SymmetricTree', 'min_data_in_leaf': 135}. Best is trial 575 with value: 965.9974213974682.[0m
[32m[I 2024-10-13 04:28:04,817][0m Trial 864 finished with value: 1102.565937431451 and parameters: {'depth': 8, 'learning_rate': 0.01608045507682353, 'iterations': 1738, 'l2_leaf_reg': 0.04774199771658475, 'border_count': 13, 'bagging_temperature': 0.6501138598170538, 'random_strength': 0.3097251961349532, 'grow_policy': 'SymmetricTree', 'min_data_in_leaf': 154}. Best is trial 575 with value: 965.9974213974682.[0m
[32m[I 2024-10-13 04:28:47,889][0m Trial 865 finished with value: 1302.6600763552938 and parameters: {'depth': 12, 'learning_rate': 0.010443067721625562, 'iterations': 1589, 'l2_leaf_reg': 0.0056874757953525885, 'border_count': 223, 'bagging_temperature': 0.9075106858721401, 'random_strength': 0.595961553923805, 'grow_policy': 'SymmetricTree', 'min_data_in_leaf': 207}. Best is trial 575 with value: 965.9974213974682.[0m
[32m[I 2024-10-13 04:28:55,887][0m Trial 866 finished with value: 1219.3830609409374 and parameters: {'depth': 8, 'learning_rate': 0.013602411150860574, 'iterations': 1496, 'l2_leaf_reg': 0.003421165522748027, 'border_count': 33, 'bagging_temperature': 0.8640161942840101, 'random_strength': 0.9609103350557691, 'grow_policy': 'SymmetricTree', 'min_data_in_leaf': 241}. Best is trial 575 with value: 965.9974213974682.[0m
[32m[I 2024-10-13 04:29:03,121][0m Trial 867 finished with value: 1225.8171979994424 and parameters: {'depth': 6, 'learning_rate': 0.003451270585401616, 'iterations': 1386, 'l2_leaf_reg': 0.03745033360800734, 'border_count': 27, 'bagging_temperature': 0.24219616961190693, 'random_strength': 0.16611041748674768, 'grow_policy': 'SymmetricTree', 'min_data_in_leaf': 570}. Best is trial 575 with value: 965.9974213974682.[0m
[32m[I 2024-10-13 04:29:04,566][0m Trial 868 finished with value: 1179.4841719232006 and parameters: {'depth': 9, 'learning_rate': 0.017426064361107815, 'iterations': 1272, 'l2_leaf_reg': 0.010070540437841191, 'border_count': 21, 'bagging_temperature': 0.3045595870302504, 'random_strength': 0.0062321491911082605, 'grow_policy': 'Lossguide', 'min_data_in_leaf': 487, 'max_leaves': 114}. Best is trial 575 with value: 965.9974213974682.[0m
