[32m[I 2024-10-13 03:38:09,362][0m Trial 614 finished with value: 1340.3542361336026 and parameters: {'depth': 7, 'learning_rate': 0.014590466324752027, 'iterations': 833, 'l2_leaf_reg': 0.2066484462114083, 'border_count': 27, 'bagging_temperature': 0.14424528120581764, 'random_strength': 4.670706532663322, 'grow_policy': 'SymmetricTree', 'min_data_in_leaf': 90}. Best is trial 575 with value: 965.9974213974682.[0m
[32m[I 2024-10-13 03:38:17,803][0m Trial 615 finished with value: 1254.0480866247992 and parameters: {'depth': 8, 'learning_rate': 0.02126094660624553, 'iterations': 1064, 'l2_leaf_reg': 0.08670508224407435, 'border_count': 38, 'bagging_temperature': 0.6801613666007645, 'random_strength': 0.011737436442622793, 'grow_policy': 'SymmetricTree', 'min_data_in_leaf': 557}. Best is trial 575 with value: 965.9974213974682.[0m
[32m[I 2024-10-13 03:38:19,087][0m Trial 616 finished with value: 1259.9843700867987 and parameters: {'depth': 8, 'learning_rate': 0.012584804530234568, 'iterations': 902, 'l2_leaf_reg': 0.027762635070187558, 'border_count': 62, 'bagging_temperature': 0.5731490039005275, 'random_strength': 0.5559004336692182, 'grow_policy': 'Depthwise', 'min_data_in_leaf': 159}. Best is trial 575 with value: 965.9974213974682.[0m
[32m[I 2024-10-13 03:38:25,402][0m Trial 617 finished with value: 1335.1270643593357 and parameters: {'depth': 9, 'learning_rate': 0.01593203447907579, 'iterations': 993, 'l2_leaf_reg': 0.1272201477242612, 'border_count': 6, 'bagging_temperature': 0.7316216107722628, 'random_strength': 0.1915907759048339, 'grow_policy': 'SymmetricTree', 'min_data_in_leaf': 342}. Best is trial 575 with value: 965.9974213974682.[0m
[32m[I 2024-10-13 03:38:38,712][0m Trial 618 finished with value: 1030.0696907845922 and parameters: {'depth': 10, 'learning_rate': 0.010223117332970518, 'iterations': 1668, 'l2_leaf_reg': 0.054851574817953004, 'border_count': 20, 'bagging_temperature': 0.19647155927193216, 'random_strength': 0.36386439969289447, 'grow_policy': 'SymmetricTree', 'min_data_in_leaf': 589}. Best is trial 575 with value: 965.9974213974682.[0m
[32m[I 2024-10-13 03:38:47,729][0m Trial 619 finished with value: 1093.3874605283693 and parameters: {'depth': 9, 'learning_rate': 0.03583603492474936, 'iterations': 1061, 'l2_leaf_reg': 0.012530855369156832, 'border_count': 16, 'bagging_temperature': 0.6303649277185505, 'random_strength': 0.7756773585187857, 'grow_policy': 'SymmetricTree', 'min_data_in_leaf': 229}. Best is trial 575 with value: 965.9974213974682.[0m
[32m[I 2024-10-13 03:38:55,396][0m Trial 620 finished with value: 1274.794455730725 and parameters: {'depth': 8, 'learning_rate': 0.018960786096811285, 'iterations': 647, 'l2_leaf_reg': 0.07108642710822591, 'border_count': 101, 'bagging_temperature': 0.3766179799618714, 'random_strength': 0.006554741618271018, 'grow_policy': 'SymmetricTree', 'min_data_in_leaf': 404}. Best is trial 575 with value: 965.9974213974682.[0m
[32m[I 2024-10-13 03:39:04,273][0m Trial 621 finished with value: 1063.8684232804587 and parameters: {'depth': 10, 'learning_rate': 0.027153050092995186, 'iterations': 1000, 'l2_leaf_reg': 0.04232335552640251, 'border_count': 30, 'bagging_temperature': 0.2603888918372456, 'random_strength': 0.178768097208486, 'grow_policy': 'SymmetricTree', 'min_data_in_leaf': 696}. Best is trial 575 with value: 965.9974213974682.[0m
[32m[I 2024-10-13 03:39:10,510][0m Trial 622 finished with value: 1068.8338770114815 and parameters: {'depth': 7, 'learning_rate': 0.008448757276551413, 'iterations': 1147, 'l2_leaf_reg': 0.31400106546995227, 'border_count': 23, 'bagging_temperature': 0.1548658237096368, 'random_strength': 0.49172437843254746, 'grow_policy': 'SymmetricTree', 'min_data_in_leaf': 213}. Best is trial 575 with value: 965.9974213974682.[0m
[32m[I 2024-10-13 03:39:11,662][0m Trial 623 finished with value: 1315.5975364456879 and parameters: {'depth': 8, 'learning_rate': 0.012730473413873258, 'iterations': 875, 'l2_leaf_reg': 0.0950141980578964, 'border_count': 180, 'bagging_temperature': 0.121972182084873, 'random_strength': 0.1894795586056877, 'grow_policy': 'Lossguide', 'min_data_in_leaf': 178, 'max_leaves': 174}. Best is trial 575 with value: 965.9974213974682.[0m
[32m[I 2024-10-13 03:39:20,632][0m Trial 624 finished with value: 1347.141599460309 and parameters: {'depth': 11, 'learning_rate': 0.01591536179295267, 'iterations': 1098, 'l2_leaf_reg': 0.02097135872119823, 'border_count': 12, 'bagging_temperature': 0.7691207061759566, 'random_strength': 5.864137280621647, 'grow_policy': 'SymmetricTree', 'min_data_in_leaf': 238}. Best is trial 575 with value: 965.9974213974682.[0m
[32m[I 2024-10-13 03:39:30,430][0m Trial 625 finished with value: 1151.761324161559 and parameters: {'depth': 8, 'learning_rate': 0.011356862117829693, 'iterations': 1726, 'l2_leaf_reg': 0.18818434979747156, 'border_count': 26, 'bagging_temperature': 0.17941500144154598, 'random_strength': 0.0076694650522811415, 'grow_policy': 'SymmetricTree', 'min_data_in_leaf': 484}. Best is trial 575 with value: 965.9974213974682.[0m
[32m[I 2024-10-13 03:39:48,949][0m Trial 626 finished with value: 1086.0294693842907 and parameters: {'depth': 13, 'learning_rate': 0.02341354863611654, 'iterations': 940, 'l2_leaf_reg': 0.052246880313052274, 'border_count': 19, 'bagging_temperature': 0.7247381316632787, 'random_strength': 0.34951479611923486, 'grow_policy': 'SymmetricTree', 'min_data_in_leaf': 386}. Best is trial 575 with value: 965.9974213974682.[0m
[32m[I 2024-10-13 03:39:56,395][0m Trial 627 finished with value: 1163.2704043755245 and parameters: {'depth': 9, 'learning_rate': 0.014619021957763748, 'iterations': 1051, 'l2_leaf_reg': 0.03308920719429486, 'border_count': 9, 'bagging_temperature': 0.22950035379527603, 'random_strength': 0.008511481856349801, 'grow_policy': 'SymmetricTree', 'min_data_in_leaf': 525}. Best is trial 575 with value: 965.9974213974682.[0m
[32m[I 2024-10-13 03:40:00,153][0m Trial 628 finished with value: 1323.9653837138828 and parameters: {'depth': 7, 'learning_rate': 0.052568705256148734, 'iterations': 732, 'l2_leaf_reg': 0.00040561125549723237, 'border_count': 32, 'bagging_temperature': 0.20815953589349723, 'random_strength': 0.6124056142905387, 'grow_policy': 'SymmetricTree', 'min_data_in_leaf': 613}. Best is trial 575 with value: 965.9974213974682.[0m
[32m[I 2024-10-13 03:40:09,100][0m Trial 629 finished with value: 1099.2990107868675 and parameters: {'depth': 10, 'learning_rate': 0.017668455676010785, 'iterations': 1138, 'l2_leaf_reg': 0.1388636980112372, 'border_count': 16, 'bagging_temperature': 0.25439018337308805, 'random_strength': 0.3095481137195159, 'grow_policy': 'SymmetricTree', 'min_data_in_leaf': 113}. Best is trial 575 with value: 965.9974213974682.[0m
[32m[I 2024-10-13 03:40:17,870][0m Trial 630 finished with value: 1041.3421425246993 and parameters: {'depth': 8, 'learning_rate': 0.010173369634649456, 'iterations': 1457, 'l2_leaf_reg': 0.08904129280503872, 'border_count': 22, 'bagging_temperature': 0.7025499138978705, 'random_strength': 0.1864333847685796, 'grow_policy': 'SymmetricTree', 'min_data_in_leaf': 203}. Best is trial 575 with value: 965.9974213974682.[0m
[32m[I 2024-10-13 03:40:21,308][0m Trial 631 finished with value: 2147.8042676662394 and parameters: {'depth': 12, 'learning_rate': 0.008886172622736808, 'iterations': 831, 'l2_leaf_reg': 0.0198754070795241, 'border_count': 3, 'bagging_temperature': 0.16962420406344944, 'random_strength': 0.47715634361087655, 'grow_policy': 'SymmetricTree', 'min_data_in_leaf': 544}. Best is trial 575 with value: 965.9974213974682.[0m
[32m[I 2024-10-13 03:40:27,882][0m Trial 632 finished with value: 1199.9723716840342 and parameters: {'depth': 9, 'learning_rate': 0.02083837462915648, 'iterations': 978, 'l2_leaf_reg': 0.009120650097498158, 'border_count': 27, 'bagging_temperature': 0.07992729900779358, 'random_strength': 0.16548400417515172, 'grow_policy': 'SymmetricTree', 'min_data_in_leaf': 890}. Best is trial 575 with value: 965.9974213974682.[0m
[32m[I 2024-10-13 03:40:33,903][0m Trial 633 finished with value: 1123.1990886403821 and parameters: {'depth': 7, 'learning_rate': 0.012298839615609616, 'iterations': 1191, 'l2_leaf_reg': 0.03688675094517066, 'border_count': 15, 'bagging_temperature': 0.5815727519569769, 'random_strength': 0.34751776951885227, 'grow_policy': 'SymmetricTree', 'min_data_in_leaf': 362}. Best is trial 575 with value: 965.9974213974682.[0m
[32m[I 2024-10-13 03:40:43,041][0m Trial 634 finished with value: 1091.8183099974412 and parameters: {'depth': 9, 'learning_rate': 0.006039945277212556, 'iterations': 918, 'l2_leaf_reg': 0.06226139580178994, 'border_count': 21, 'bagging_temperature': 0.6114286477789053, 'random_strength': 0.7121088887705046, 'grow_policy': 'SymmetricTree', 'min_data_in_leaf': 226}. Best is trial 575 with value: 965.9974213974682.[0m
[32m[I 2024-10-13 03:40:53,994][0m Trial 635 finished with value: 1343.7008473255146 and parameters: {'depth': 11, 'learning_rate': 0.013804818452752518, 'iterations': 1577, 'l2_leaf_reg': 0.0005828748085691618, 'border_count': 11, 'bagging_temperature': 0.6438878286721983, 'random_strength': 2.428603102852771, 'grow_policy': 'SymmetricTree', 'min_data_in_leaf': 163}. Best is trial 575 with value: 965.9974213974682.[0m
[32m[I 2024-10-13 03:41:04,141][0m Trial 636 finished with value: 1251.1497548595812 and parameters: {'depth': 10, 'learning_rate': 0.03150587545287158, 'iterations': 1014, 'l2_leaf_reg': 0.00030357617208112226, 'border_count': 25, 'bagging_temperature': 0.3364656629666336, 'random_strength': 9.27265871790501, 'grow_policy': 'SymmetricTree', 'min_data_in_leaf': 570}. Best is trial 575 with value: 965.9974213974682.[0m
[32m[I 2024-10-13 03:41:13,009][0m Trial 637 finished with value: 1338.0732247192436 and parameters: {'depth': 7, 'learning_rate': 0.02583618027525507, 'iterations': 1101, 'l2_leaf_reg': 0.10986951778706727, 'border_count': 166, 'bagging_temperature': 0.6646090386381287, 'random_strength': 0.004722237821260855, 'grow_policy': 'SymmetricTree', 'min_data_in_leaf': 251}. Best is trial 575 with value: 965.9974213974682.[0m
[32m[I 2024-10-13 03:41:14,649][0m Trial 638 finished with value: 1175.9961707575255 and parameters: {'depth': 8, 'learning_rate': 0.018265120502563657, 'iterations': 1184, 'l2_leaf_reg': 0.02979600823601869, 'border_count': 18, 'bagging_temperature': 0.23683408671745781, 'random_strength': 0.18001270608180714, 'grow_policy': 'Depthwise', 'min_data_in_leaf': 195}. Best is trial 575 with value: 965.9974213974682.[0m
[32m[I 2024-10-13 03:41:21,375][0m Trial 639 finished with value: 1229.2229389901813 and parameters: {'depth': 9, 'learning_rate': 0.010799770080207535, 'iterations': 794, 'l2_leaf_reg': 0.05180385781431105, 'border_count': 33, 'bagging_temperature': 0.413520744644394, 'random_strength': 0.4473033891193376, 'grow_policy': 'SymmetricTree', 'min_data_in_leaf': 332}. Best is trial 575 with value: 965.9974213974682.[0m
[32m[I 2024-10-13 03:41:51,609][0m Trial 640 finished with value: 1333.4153033183666 and parameters: {'depth': 10, 'learning_rate': 0.00787530677875112, 'iterations': 1330, 'l2_leaf_reg': 0.142287065772905, 'border_count': 75, 'bagging_temperature': 0.19639742005655833, 'random_strength': 0.009919158572923668, 'grow_policy': 'SymmetricTree', 'min_data_in_leaf': 222}. Best is trial 575 with value: 965.9974213974682.[0m
[32m[I 2024-10-13 03:41:57,970][0m Trial 641 finished with value: 1115.0769808634052 and parameters: {'depth': 8, 'learning_rate': 0.016557810565849845, 'iterations': 1245, 'l2_leaf_reg': 0.08141338360478631, 'border_count': 22, 'bagging_temperature': 0.133072094931618, 'random_strength': 0.31147331187321975, 'grow_policy': 'SymmetricTree', 'min_data_in_leaf': 142}. Best is trial 575 with value: 965.9974213974682.[0m
[32m[I 2024-10-13 03:42:04,354][0m Trial 642 finished with value: 1306.7024846704624 and parameters: {'depth': 9, 'learning_rate': 0.014072394486432323, 'iterations': 1052, 'l2_leaf_reg': 0.25664255151295257, 'border_count': 8, 'bagging_temperature': 0.7532100442277304, 'random_strength': 0.9089189661452165, 'grow_policy': 'SymmetricTree', 'min_data_in_leaf': 253}. Best is trial 575 with value: 965.9974213974682.[0m
[32m[I 2024-10-13 03:42:13,076][0m Trial 643 finished with value: 1055.5922514199262 and parameters: {'depth': 8, 'learning_rate': 0.011794137307660624, 'iterations': 1503, 'l2_leaf_reg': 0.01455459164499912, 'border_count': 16, 'bagging_temperature': 0.16605945350163206, 'random_strength': 0.1781386567628602, 'grow_policy': 'SymmetricTree', 'min_data_in_leaf': 177}. Best is trial 575 with value: 965.9974213974682.[0m
[32m[I 2024-10-13 03:42:14,293][0m Trial 644 finished with value: 1255.3837341499982 and parameters: {'depth': 11, 'learning_rate': 0.020706832469732615, 'iterations': 869, 'l2_leaf_reg': 0.06420372983727125, 'border_count': 40, 'bagging_temperature': 0.7851941314013193, 'random_strength': 0.006690309112072819, 'grow_policy': 'Lossguide', 'min_data_in_leaf': 271, 'max_leaves': 190}. Best is trial 575 with value: 965.9974213974682.[0m
[32m[I 2024-10-13 03:42:22,148][0m Trial 645 finished with value: 1265.4320844692602 and parameters: {'depth': 8, 'learning_rate': 0.007072772214418785, 'iterations': 959, 'l2_leaf_reg': 0.00033264912288191517, 'border_count': 28, 'bagging_temperature': 0.5571584169350468, 'random_strength': 0.5296197397591136, 'grow_policy': 'SymmetricTree', 'min_data_in_leaf': 512}. Best is trial 575 with value: 965.9974213974682.[0m
[32m[I 2024-10-13 03:42:30,142][0m Trial 646 finished with value: 1247.0231901370014 and parameters: {'depth': 10, 'learning_rate': 0.009567956012670234, 'iterations': 1097, 'l2_leaf_reg': 0.038866941465786224, 'border_count': 12, 'bagging_temperature': 0.688286086524243, 'random_strength': 0.294423212057877, 'grow_policy': 'SymmetricTree', 'min_data_in_leaf': 289}. Best is trial 575 with value: 965.9974213974682.[0m
[32m[I 2024-10-13 03:42:36,380][0m Trial 647 finished with value: 984.0811692464162 and parameters: {'depth': 7, 'learning_rate': 0.015797134792124207, 'iterations': 1429, 'l2_leaf_reg': 0.02340560225766289, 'border_count': 21, 'bagging_temperature': 0.2185821677599788, 'random_strength': 0.19375659503238096, 'grow_policy': 'SymmetricTree', 'min_data_in_leaf': 583}. Best is trial 575 with value: 965.9974213974682.[0m
[32m[I 2024-10-13 03:42:43,295][0m Trial 648 finished with value: 1126.5910128108244 and parameters: {'depth': 7, 'learning_rate': 0.024616311009727256, 'iterations': 1459, 'l2_leaf_reg': 0.025079868656090767, 'border_count': 27, 'bagging_temperature': 0.2410388384081549, 'random_strength': 0.00434825345286585, 'grow_policy': 'SymmetricTree', 'min_data_in_leaf': 613}. Best is trial 575 with value: 965.9974213974682.[0m
[32m[I 2024-10-13 03:42:52,202][0m Trial 649 finished with value: 1292.5348152307267 and parameters: {'depth': 7, 'learning_rate': 0.01763268151294989, 'iterations': 1435, 'l2_leaf_reg': 0.015144545673695293, 'border_count': 34, 'bagging_temperature': 0.26877620958007575, 'random_strength': 0.4332777175137551, 'grow_policy': 'SymmetricTree', 'min_data_in_leaf': 585}. Best is trial 575 with value: 965.9974213974682.[0m
[32m[I 2024-10-13 03:42:59,359][0m Trial 650 finished with value: 1001.2409912147472 and parameters: {'depth': 7, 'learning_rate': 0.02139731787463201, 'iterations': 1381, 'l2_leaf_reg': 0.022531254345359367, 'border_count': 22, 'bagging_temperature': 0.8820117724321894, 'random_strength': 0.17550113548810112, 'grow_policy': 'SymmetricTree', 'min_data_in_leaf': 588}. Best is trial 575 with value: 965.9974213974682.[0m
[32m[I 2024-10-13 03:43:07,051][0m Trial 651 finished with value: 1241.8781601599974 and parameters: {'depth': 7, 'learning_rate': 0.02824191949476978, 'iterations': 1409, 'l2_leaf_reg': 0.011704788994006558, 'border_count': 30, 'bagging_temperature': 0.8541687106272855, 'random_strength': 0.6406524434615994, 'grow_policy': 'SymmetricTree', 'min_data_in_leaf': 601}. Best is trial 575 with value: 965.9974213974682.[0m
[32m[I 2024-10-13 03:43:13,815][0m Trial 652 finished with value: 1086.713581037645 and parameters: {'depth': 7, 'learning_rate': 0.02529429443549259, 'iterations': 1380, 'l2_leaf_reg': 0.019366403299815208, 'border_count': 24, 'bagging_temperature': 0.874101365180283, 'random_strength': 0.322824603219923, 'grow_policy': 'SymmetricTree', 'min_data_in_leaf': 567}. Best is trial 575 with value: 965.9974213974682.[0m
[32m[I 2024-10-13 03:43:21,535][0m Trial 653 finished with value: 1067.4355579321436 and parameters: {'depth': 7, 'learning_rate': 0.021937494465163094, 'iterations': 1488, 'l2_leaf_reg': 0.01911970148552185, 'border_count': 22, 'bagging_temperature': 0.9014718961264802, 'random_strength': 0.6999316606927811, 'grow_policy': 'SymmetricTree', 'min_data_in_leaf': 577}. Best is trial 575 with value: 965.9974213974682.[0m
[32m[I 2024-10-13 03:43:32,347][0m Trial 654 finished with value: 2376.5012110974526 and parameters: {'depth': 7, 'learning_rate': 0.0007176941439758062, 'iterations': 1387, 'l2_leaf_reg': 0.025328573959588725, 'border_count': 36, 'bagging_temperature': 0.8895780287775419, 'random_strength': 0.4926712972936385, 'grow_policy': 'SymmetricTree', 'min_data_in_leaf': 559}. Best is trial 575 with value: 965.9974213974682.[0m
[32m[I 2024-10-13 03:43:39,134][0m Trial 655 finished with value: 1210.9685796588292 and parameters: {'depth': 6, 'learning_rate': 0.0377088837438775, 'iterations': 1445, 'l2_leaf_reg': 0.010244371401541235, 'border_count': 28, 'bagging_temperature': 0.8571411676502595, 'random_strength': 0.21268944438990545, 'grow_policy': 'SymmetricTree', 'min_data_in_leaf': 626}. Best is trial 575 with value: 965.9974213974682.[0m
[32m[I 2024-10-13 03:43:45,886][0m Trial 656 finished with value: 1083.1993642251532 and parameters: {'depth': 7, 'learning_rate': 0.01981948376216796, 'iterations': 1376, 'l2_leaf_reg': 0.028676409676431994, 'border_count': 20, 'bagging_temperature': 0.8845617306228167, 'random_strength': 1.0861641101195658, 'grow_policy': 'SymmetricTree', 'min_data_in_leaf': 597}. Best is trial 575 with value: 965.9974213974682.[0m
[32m[I 2024-10-13 03:43:52,905][0m Trial 657 finished with value: 1106.7572456212868 and parameters: {'depth': 7, 'learning_rate': 0.019351601733300007, 'iterations': 1336, 'l2_leaf_reg': 0.03606765548956652, 'border_count': 24, 'bagging_temperature': 0.9085062474784157, 'random_strength': 0.37649235463608055, 'grow_policy': 'SymmetricTree', 'min_data_in_leaf': 585}. Best is trial 575 with value: 965.9974213974682.[0m
[32m[I 2024-10-13 03:44:04,780][0m Trial 658 finished with value: 1245.5464196807043 and parameters: {'depth': 7, 'learning_rate': 0.022775585314256868, 'iterations': 1526, 'l2_leaf_reg': 0.012570914194360105, 'border_count': 240, 'bagging_temperature': 0.8694006944969763, 'random_strength': 0.18821451601913958, 'grow_policy': 'SymmetricTree', 'min_data_in_leaf': 547}. Best is trial 575 with value: 965.9974213974682.[0m
[32m[I 2024-10-13 03:44:11,627][0m Trial 659 finished with value: 1172.4112785143493 and parameters: {'depth': 7, 'learning_rate': 0.02906253641453497, 'iterations': 1451, 'l2_leaf_reg': 0.025624746653808737, 'border_count': 15, 'bagging_temperature': 0.8308970120137578, 'random_strength': 0.5496401736497425, 'grow_policy': 'SymmetricTree', 'min_data_in_leaf': 592}. Best is trial 575 with value: 965.9974213974682.[0m
[32m[I 2024-10-13 03:44:18,695][0m Trial 660 finished with value: 1204.65959155601 and parameters: {'depth': 6, 'learning_rate': 0.01645634739355873, 'iterations': 1403, 'l2_leaf_reg': 0.01759990129755831, 'border_count': 31, 'bagging_temperature': 0.9079988496840335, 'random_strength': 0.29854879493131736, 'grow_policy': 'SymmetricTree', 'min_data_in_leaf': 630}. Best is trial 575 with value: 965.9974213974682.[0m
[32m[I 2024-10-13 03:44:25,643][0m Trial 661 finished with value: 1009.6841005314204 and parameters: {'depth': 7, 'learning_rate': 0.02106147003200649, 'iterations': 1321, 'l2_leaf_reg': 0.044688158374756794, 'border_count': 19, 'bagging_temperature': 0.29107695883322304, 'random_strength': 0.003605661120083592, 'grow_policy': 'SymmetricTree', 'min_data_in_leaf': 540}. Best is trial 575 with value: 965.9974213974682.[0m
[32m[I 2024-10-13 03:44:31,417][0m Trial 662 finished with value: 1281.2208652974455 and parameters: {'depth': 6, 'learning_rate': 0.023869566612371648, 'iterations': 1344, 'l2_leaf_reg': 5.430249335722155e-08, 'border_count': 12, 'bagging_temperature': 0.3011147984421134, 'random_strength': 0.8714159323738129, 'grow_policy': 'SymmetricTree', 'min_data_in_leaf': 503}. Best is trial 575 with value: 965.9974213974682.[0m
[32m[I 2024-10-13 03:44:33,188][0m Trial 663 finished with value: 1453.0639774390324 and parameters: {'depth': 7, 'learning_rate': 0.034683266764474426, 'iterations': 1316, 'l2_leaf_reg': 0.04086599167801752, 'border_count': 7, 'bagging_temperature': 0.2927628962423236, 'random_strength': 0.20711276376967513, 'grow_policy': 'Depthwise', 'min_data_in_leaf': 556}. Best is trial 575 with value: 965.9974213974682.[0m
[32m[I 2024-10-13 03:44:39,707][0m Trial 664 finished with value: 1149.0545448121657 and parameters: {'depth': 7, 'learning_rate': 0.026085947921025254, 'iterations': 1402, 'l2_leaf_reg': 0.017799233170948833, 'border_count': 18, 'bagging_temperature': 0.2781832154584551, 'random_strength': 0.44918527462546853, 'grow_policy': 'SymmetricTree', 'min_data_in_leaf': 543}. Best is trial 575 with value: 965.9974213974682.[0m
