[32m[I 2024-10-13 03:11:36,887][0m Trial 461 finished with value: 1015.7478748584197 and parameters: {'depth': 10, 'learning_rate': 0.008517772024285625, 'iterations': 1077, 'l2_leaf_reg': 0.0002719982354109232, 'border_count': 14, 'bagging_temperature': 0.5095784352168311, 'random_strength': 0.00017517680170271244, 'grow_policy': 'SymmetricTree', 'min_data_in_leaf': 526}. Best is trial 323 with value: 980.8485503758243.[0m
[32m[I 2024-10-13 03:11:50,330][0m Trial 462 finished with value: 1492.9853647811872 and parameters: {'depth': 12, 'learning_rate': 0.007267547866881129, 'iterations': 2289, 'l2_leaf_reg': 0.0003192768013225764, 'border_count': 5, 'bagging_temperature': 0.48329880345902976, 'random_strength': 0.15307234123001093, 'grow_policy': 'SymmetricTree', 'min_data_in_leaf': 543}. Best is trial 323 with value: 980.8485503758243.[0m
[32m[I 2024-10-13 03:11:52,197][0m Trial 463 finished with value: 1366.3569416390571 and parameters: {'depth': 10, 'learning_rate': 0.008901650239684766, 'iterations': 1553, 'l2_leaf_reg': 0.0002595567036974613, 'border_count': 11, 'bagging_temperature': 0.5212440317097237, 'random_strength': 0.17110108197983473, 'grow_policy': 'Lossguide', 'min_data_in_leaf': 515, 'max_leaves': 127}. Best is trial 323 with value: 980.8485503758243.[0m
[32m[I 2024-10-13 03:12:05,020][0m Trial 464 finished with value: 1031.0643684024674 and parameters: {'depth': 10, 'learning_rate': 0.007979308292990652, 'iterations': 1222, 'l2_leaf_reg': 0.0004655563765424667, 'border_count': 15, 'bagging_temperature': 0.45481434629881645, 'random_strength': 0.009400588988318918, 'grow_policy': 'SymmetricTree', 'min_data_in_leaf': 524}. Best is trial 323 with value: 980.8485503758243.[0m
[32m[I 2024-10-13 03:12:22,124][0m Trial 465 finished with value: 1039.3129897491199 and parameters: {'depth': 11, 'learning_rate': 0.006190001082879811, 'iterations': 1202, 'l2_leaf_reg': 0.00019135669833749666, 'border_count': 15, 'bagging_temperature': 0.461457453277889, 'random_strength': 0.026698497530715508, 'grow_policy': 'SymmetricTree', 'min_data_in_leaf': 478}. Best is trial 323 with value: 980.8485503758243.[0m
[32m[I 2024-10-13 03:12:32,170][0m Trial 466 finished with value: 1254.9690168620762 and parameters: {'depth': 10, 'learning_rate': 0.007094088877158541, 'iterations': 1207, 'l2_leaf_reg': 0.0003392814017070835, 'border_count': 7, 'bagging_temperature': 0.49657526067978247, 'random_strength': 0.008310488380254864, 'grow_policy': 'SymmetricTree', 'min_data_in_leaf': 523}. Best is trial 323 with value: 980.8485503758243.[0m
[32m[I 2024-10-13 03:12:41,375][0m Trial 467 finished with value: 1100.5191967378903 and parameters: {'depth': 10, 'learning_rate': 0.008014691056209926, 'iterations': 1130, 'l2_leaf_reg': 0.0005944759319548762, 'border_count': 13, 'bagging_temperature': 0.47715562351041557, 'random_strength': 0.2853262472004794, 'grow_policy': 'SymmetricTree', 'min_data_in_leaf': 552}. Best is trial 323 with value: 980.8485503758243.[0m
[32m[I 2024-10-13 03:13:01,945][0m Trial 468 finished with value: 996.9298091443461 and parameters: {'depth': 11, 'learning_rate': 0.008514801117488174, 'iterations': 1251, 'l2_leaf_reg': 0.0004542833411562001, 'border_count': 21, 'bagging_temperature': 0.5062975438838464, 'random_strength': 0.005705882108809263, 'grow_policy': 'SymmetricTree', 'min_data_in_leaf': 529}. Best is trial 323 with value: 980.8485503758243.[0m
[32m[I 2024-10-13 03:13:16,696][0m Trial 469 finished with value: 1051.1138833284044 and parameters: {'depth': 11, 'learning_rate': 0.008628210804979244, 'iterations': 1290, 'l2_leaf_reg': 0.0004256679030634119, 'border_count': 23, 'bagging_temperature': 0.44067770445329246, 'random_strength': 0.18085597883358887, 'grow_policy': 'SymmetricTree', 'min_data_in_leaf': 533}. Best is trial 323 with value: 980.8485503758243.[0m
[32m[I 2024-10-13 03:13:22,210][0m Trial 470 finished with value: 2745.59410401842 and parameters: {'depth': 12, 'learning_rate': 0.007373096885372375, 'iterations': 1384, 'l2_leaf_reg': 0.0005096469739841948, 'border_count': 1, 'bagging_temperature': 0.5080853441000402, 'random_strength': 0.004917833688310487, 'grow_policy': 'SymmetricTree', 'min_data_in_leaf': 501}. Best is trial 323 with value: 980.8485503758243.[0m
[32m[I 2024-10-13 03:13:39,902][0m Trial 471 finished with value: 1225.8648027965228 and parameters: {'depth': 11, 'learning_rate': 0.007790014869891994, 'iterations': 1246, 'l2_leaf_reg': 0.0002662407307792919, 'border_count': 31, 'bagging_temperature': 0.4930228933475056, 'random_strength': 0.35778126329520704, 'grow_policy': 'SymmetricTree', 'min_data_in_leaf': 580}. Best is trial 323 with value: 980.8485503758243.[0m
[32m[I 2024-10-13 03:14:47,954][0m Trial 472 finished with value: 1038.1563860553147 and parameters: {'depth': 13, 'learning_rate': 0.0047551934175364165, 'iterations': 1340, 'l2_leaf_reg': 0.00011536823976862413, 'border_count': 17, 'bagging_temperature': 0.4602201701165455, 'random_strength': 0.005743449804269709, 'grow_policy': 'SymmetricTree', 'min_data_in_leaf': 517}. Best is trial 323 with value: 980.8485503758243.[0m
[32m[I 2024-10-13 03:15:05,234][0m Trial 473 finished with value: 1255.8421661602392 and parameters: {'depth': 11, 'learning_rate': 0.008510265990738824, 'iterations': 1284, 'l2_leaf_reg': 6.140905997805321e-05, 'border_count': 37, 'bagging_temperature': 0.5074738449652085, 'random_strength': 0.3456246079529071, 'grow_policy': 'SymmetricTree', 'min_data_in_leaf': 567}. Best is trial 323 with value: 980.8485503758243.[0m
[32m[I 2024-10-13 03:15:16,480][0m Trial 474 finished with value: 1272.9359435196586 and parameters: {'depth': 11, 'learning_rate': 0.005752165911090398, 'iterations': 1192, 'l2_leaf_reg': 0.0007345779664530604, 'border_count': 11, 'bagging_temperature': 0.47709295397604384, 'random_strength': 0.6098808416984034, 'grow_policy': 'SymmetricTree', 'min_data_in_leaf': 533}. Best is trial 323 with value: 980.8485503758243.[0m
[32m[I 2024-10-13 03:15:44,926][0m Trial 475 finished with value: 1061.0314527929943 and parameters: {'depth': 12, 'learning_rate': 0.04830004768544087, 'iterations': 1249, 'l2_leaf_reg': 0.00020722464231816054, 'border_count': 27, 'bagging_temperature': 0.5039231617871431, 'random_strength': 0.17523406978476935, 'grow_policy': 'SymmetricTree', 'min_data_in_leaf': 554}. Best is trial 323 with value: 980.8485503758243.[0m
[32m[I 2024-10-13 03:15:55,725][0m Trial 476 finished with value: 1071.2257700402738 and parameters: {'depth': 10, 'learning_rate': 0.009665162461307207, 'iterations': 1372, 'l2_leaf_reg': 0.0004265419953837348, 'border_count': 21, 'bagging_temperature': 0.5237898689313492, 'random_strength': 0.41910775735569905, 'grow_policy': 'SymmetricTree', 'min_data_in_leaf': 516}. Best is trial 323 with value: 980.8485503758243.[0m
[32m[I 2024-10-13 03:16:10,316][0m Trial 477 finished with value: 1069.5804072518142 and parameters: {'depth': 12, 'learning_rate': 0.008494582425898102, 'iterations': 1169, 'l2_leaf_reg': 0.0003020803701043538, 'border_count': 16, 'bagging_temperature': 0.48617704360078007, 'random_strength': 0.19405249163518315, 'grow_policy': 'SymmetricTree', 'min_data_in_leaf': 590}. Best is trial 323 with value: 980.8485503758243.[0m
[32m[I 2024-10-13 03:16:20,609][0m Trial 478 finished with value: 1199.337361220353 and parameters: {'depth': 10, 'learning_rate': 0.0061175687354376096, 'iterations': 1314, 'l2_leaf_reg': 0.0006589564781584199, 'border_count': 9, 'bagging_temperature': 0.5113922297458164, 'random_strength': 0.17493420938287427, 'grow_policy': 'SymmetricTree', 'min_data_in_leaf': 481}. Best is trial 323 with value: 980.8485503758243.[0m
[32m[I 2024-10-13 03:16:42,705][0m Trial 479 finished with value: 1148.8821235681894 and parameters: {'depth': 11, 'learning_rate': 0.009531187543056457, 'iterations': 1439, 'l2_leaf_reg': 0.00014640717149299443, 'border_count': 25, 'bagging_temperature': 0.4675352898183543, 'random_strength': 0.0034202635243424373, 'grow_policy': 'SymmetricTree', 'min_data_in_leaf': 448}. Best is trial 323 with value: 980.8485503758243.[0m
[32m[I 2024-10-13 03:16:44,370][0m Trial 480 finished with value: 1179.8677781865472 and parameters: {'depth': 11, 'learning_rate': 0.010050998354101429, 'iterations': 1222, 'l2_leaf_reg': 0.00020895155288979344, 'border_count': 19, 'bagging_temperature': 0.4519878685019329, 'random_strength': 6.136845358190934, 'grow_policy': 'Depthwise', 'min_data_in_leaf': 549}. Best is trial 323 with value: 980.8485503758243.[0m
[32m[I 2024-10-13 03:17:07,520][0m Trial 481 finished with value: 1267.0920731639662 and parameters: {'depth': 10, 'learning_rate': 0.006549777194588735, 'iterations': 1153, 'l2_leaf_reg': 0.0011691184889246098, 'border_count': 168, 'bagging_temperature': 0.4196621752508068, 'random_strength': 0.5308649863439834, 'grow_policy': 'SymmetricTree', 'min_data_in_leaf': 539}. Best is trial 323 with value: 980.8485503758243.[0m
[32m[I 2024-10-13 03:17:20,985][0m Trial 482 finished with value: 1272.7426608013204 and parameters: {'depth': 10, 'learning_rate': 0.007511939369432615, 'iterations': 1286, 'l2_leaf_reg': 0.0008484591428630928, 'border_count': 32, 'bagging_temperature': 0.5422922616746538, 'random_strength': 0.8435314953174855, 'grow_policy': 'SymmetricTree', 'min_data_in_leaf': 506}. Best is trial 323 with value: 980.8485503758243.[0m
[32m[I 2024-10-13 03:17:30,065][0m Trial 483 finished with value: 1086.497645655214 and parameters: {'depth': 10, 'learning_rate': 0.008646562887601591, 'iterations': 1221, 'l2_leaf_reg': 0.00038440933567323107, 'border_count': 14, 'bagging_temperature': 0.5165635947683521, 'random_strength': 0.3811439041989639, 'grow_policy': 'SymmetricTree', 'min_data_in_leaf': 592}. Best is trial 323 with value: 980.8485503758243.[0m
[32m[I 2024-10-13 03:17:40,821][0m Trial 484 finished with value: 1163.6892361889786 and parameters: {'depth': 10, 'learning_rate': 0.010460708947117167, 'iterations': 1101, 'l2_leaf_reg': 0.00010483288201883067, 'border_count': 23, 'bagging_temperature': 0.4924333446495652, 'random_strength': 3.738352776043724, 'grow_policy': 'SymmetricTree', 'min_data_in_leaf': 496}. Best is trial 323 with value: 980.8485503758243.[0m
[32m[I 2024-10-13 03:17:58,797][0m Trial 485 finished with value: 1149.7804018494949 and parameters: {'depth': 9, 'learning_rate': 0.0101197890675543, 'iterations': 1317, 'l2_leaf_reg': 5.291402208326673, 'border_count': 43, 'bagging_temperature': 0.3620580221983599, 'random_strength': 0.23868166932623958, 'grow_policy': 'SymmetricTree', 'min_data_in_leaf': 326}. Best is trial 323 with value: 980.8485503758243.[0m
[32m[I 2024-10-13 03:18:11,944][0m Trial 486 finished with value: 1321.1919966733205 and parameters: {'depth': 13, 'learning_rate': 0.006749078297876012, 'iterations': 1389, 'l2_leaf_reg': 0.0005671205226848356, 'border_count': 6, 'bagging_temperature': 0.5411437329391914, 'random_strength': 0.1789042965765458, 'grow_policy': 'SymmetricTree', 'min_data_in_leaf': 561}. Best is trial 323 with value: 980.8485503758243.[0m
[32m[I 2024-10-13 03:18:13,308][0m Trial 487 finished with value: 1467.6714992138623 and parameters: {'depth': 9, 'learning_rate': 0.01142885019058205, 'iterations': 254, 'l2_leaf_reg': 0.0011033846931608866, 'border_count': 29, 'bagging_temperature': 0.5192276994409147, 'random_strength': 1.954092208711221, 'grow_policy': 'SymmetricTree', 'min_data_in_leaf': 527}. Best is trial 323 with value: 980.8485503758243.[0m
[32m[I 2024-10-13 03:18:32,897][0m Trial 488 finished with value: 1030.7646710630252 and parameters: {'depth': 11, 'learning_rate': 0.008727908913741277, 'iterations': 1140, 'l2_leaf_reg': 0.00017936754852456333, 'border_count': 18, 'bagging_temperature': 0.4807794442518638, 'random_strength': 0.004270419464547315, 'grow_policy': 'SymmetricTree', 'min_data_in_leaf': 310}. Best is trial 323 with value: 980.8485503758243.[0m
[32m[I 2024-10-13 03:18:34,368][0m Trial 489 finished with value: 1226.140422022297 and parameters: {'depth': 11, 'learning_rate': 0.011240646032541378, 'iterations': 1047, 'l2_leaf_reg': 8.142027510279375e-05, 'border_count': 21, 'bagging_temperature': 0.11969494941987732, 'random_strength': 0.5921741179538585, 'grow_policy': 'Lossguide', 'min_data_in_leaf': 337, 'max_leaves': 231}. Best is trial 323 with value: 980.8485503758243.[0m
[32m[I 2024-10-13 03:18:48,449][0m Trial 490 finished with value: 1194.986855477646 and parameters: {'depth': 11, 'learning_rate': 0.031142208893909278, 'iterations': 1130, 'l2_leaf_reg': 0.00012066002004348297, 'border_count': 26, 'bagging_temperature': 0.4866297000412112, 'random_strength': 3.3658728664193713, 'grow_policy': 'SymmetricTree', 'min_data_in_leaf': 295}. Best is trial 323 with value: 980.8485503758243.[0m
[32m[I 2024-10-13 03:19:00,981][0m Trial 491 finished with value: 1119.1409350491022 and parameters: {'depth': 12, 'learning_rate': 0.01033372518907044, 'iterations': 1012, 'l2_leaf_reg': 0.00020890430425425974, 'border_count': 18, 'bagging_temperature': 0.039733767016123744, 'random_strength': 0.33175735944146734, 'grow_policy': 'SymmetricTree', 'min_data_in_leaf': 306}. Best is trial 323 with value: 980.8485503758243.[0m
[32m[I 2024-10-13 03:19:32,574][0m Trial 492 finished with value: 1238.5680577978092 and parameters: {'depth': 11, 'learning_rate': 0.01177366368111307, 'iterations': 1097, 'l2_leaf_reg': 0.0001766827055518191, 'border_count': 33, 'bagging_temperature': 0.2243422529524423, 'random_strength': 0.00010895578895862021, 'grow_policy': 'SymmetricTree', 'min_data_in_leaf': 407}. Best is trial 323 with value: 980.8485503758243.[0m
[32m[I 2024-10-13 03:19:46,724][0m Trial 493 finished with value: 1147.3105667205045 and parameters: {'depth': 12, 'learning_rate': 0.009265159692545847, 'iterations': 1169, 'l2_leaf_reg': 0.00014956555047088575, 'border_count': 24, 'bagging_temperature': 0.14858579049209336, 'random_strength': 0.3569064464567825, 'grow_policy': 'SymmetricTree', 'min_data_in_leaf': 305}. Best is trial 323 with value: 980.8485503758243.[0m
[32m[I 2024-10-13 03:19:48,080][0m Trial 494 finished with value: 1420.4695136282073 and parameters: {'depth': 11, 'learning_rate': 0.028020654138322467, 'iterations': 123, 'l2_leaf_reg': 5.238086201974196e-07, 'border_count': 12, 'bagging_temperature': 0.19760316798640348, 'random_strength': 0.18295101679739892, 'grow_policy': 'SymmetricTree', 'min_data_in_leaf': 312}. Best is trial 323 with value: 980.8485503758243.[0m
[32m[I 2024-10-13 03:19:59,707][0m Trial 495 finished with value: 1081.8767047627205 and parameters: {'depth': 11, 'learning_rate': 0.012400310858984333, 'iterations': 1091, 'l2_leaf_reg': 1.3054428760872226e-08, 'border_count': 20, 'bagging_temperature': 0.5023011441339194, 'random_strength': 0.4811364677560201, 'grow_policy': 'SymmetricTree', 'min_data_in_leaf': 289}. Best is trial 323 with value: 980.8485503758243.[0m
[32m[I 2024-10-13 03:20:12,408][0m Trial 496 finished with value: 1139.8514453980254 and parameters: {'depth': 9, 'learning_rate': 0.008392168613312403, 'iterations': 987, 'l2_leaf_reg': 0.000252354285986914, 'border_count': 28, 'bagging_temperature': 0.08594513980447308, 'random_strength': 0.006559051863033704, 'grow_policy': 'SymmetricTree', 'min_data_in_leaf': 353}. Best is trial 323 with value: 980.8485503758243.[0m
[32m[I 2024-10-13 03:20:24,170][0m Trial 497 finished with value: 1236.4277593836853 and parameters: {'depth': 9, 'learning_rate': 0.01092726705376024, 'iterations': 1142, 'l2_leaf_reg': 5.089861320129599e-05, 'border_count': 38, 'bagging_temperature': 0.5297224362577102, 'random_strength': 0.0023194224847302713, 'grow_policy': 'SymmetricTree', 'min_data_in_leaf': 338}. Best is trial 323 with value: 980.8485503758243.[0m
[32m[I 2024-10-13 03:20:31,012][0m Trial 498 finished with value: 1221.0549615780626 and parameters: {'depth': 9, 'learning_rate': 0.022873755522796878, 'iterations': 1051, 'l2_leaf_reg': 8.96862617075148e-05, 'border_count': 19, 'bagging_temperature': 0.6394360264202913, 'random_strength': 2.677680840529113, 'grow_policy': 'SymmetricTree', 'min_data_in_leaf': 321}. Best is trial 323 with value: 980.8485503758243.[0m
[32m[I 2024-10-13 03:20:41,401][0m Trial 499 finished with value: 1105.1019124356937 and parameters: {'depth': 11, 'learning_rate': 0.01338929649884741, 'iterations': 1275, 'l2_leaf_reg': 0.00030619401930878144, 'border_count': 15, 'bagging_temperature': 0.5620932695662589, 'random_strength': 0.3275573781764532, 'grow_policy': 'SymmetricTree', 'min_data_in_leaf': 286}. Best is trial 323 with value: 980.8485503758243.[0m
[32m[I 2024-10-13 03:20:48,876][0m Trial 500 finished with value: 1276.85691628697 and parameters: {'depth': 9, 'learning_rate': 0.009057798926439408, 'iterations': 1423, 'l2_leaf_reg': 0.2752325958525266, 'border_count': 9, 'bagging_temperature': 0.3952423986115042, 'random_strength': 0.6843896769298327, 'grow_policy': 'SymmetricTree', 'min_data_in_leaf': 329}. Best is trial 323 with value: 980.8485503758243.[0m
[32m[I 2024-10-13 03:21:21,996][0m Trial 501 finished with value: 1119.8167718422146 and parameters: {'depth': 12, 'learning_rate': 0.0038466792385389546, 'iterations': 1354, 'l2_leaf_reg': 8.793919899098112e-06, 'border_count': 24, 'bagging_temperature': 0.479945422252519, 'random_strength': 0.19399566868118603, 'grow_policy': 'SymmetricTree', 'min_data_in_leaf': 272}. Best is trial 323 with value: 980.8485503758243.[0m
[32m[I 2024-10-13 03:21:23,548][0m Trial 502 finished with value: 1431.3692579361189 and parameters: {'depth': 9, 'learning_rate': 0.012258580884790062, 'iterations': 1188, 'l2_leaf_reg': 0.0025974072117293428, 'border_count': 29, 'bagging_temperature': 0.17243847700086645, 'random_strength': 0.47412401009673677, 'grow_policy': 'Depthwise', 'min_data_in_leaf': 373}. Best is trial 323 with value: 980.8485503758243.[0m
[32m[I 2024-10-13 03:21:34,375][0m Trial 503 finished with value: 1297.1896268330754 and parameters: {'depth': 9, 'learning_rate': 0.027097850830099014, 'iterations': 1052, 'l2_leaf_reg': 0.004833824550963061, 'border_count': 55, 'bagging_temperature': 0.20949448631635897, 'random_strength': 0.20460497330749003, 'grow_policy': 'SymmetricTree', 'min_data_in_leaf': 799}. Best is trial 323 with value: 980.8485503758243.[0m
[32m[I 2024-10-13 03:21:43,974][0m Trial 504 finished with value: 1106.9428127178558 and parameters: {'depth': 11, 'learning_rate': 0.03497046719415928, 'iterations': 1127, 'l2_leaf_reg': 0.0015152287619610986, 'border_count': 18, 'bagging_temperature': 0.5448079551201155, 'random_strength': 0.8134262946083854, 'grow_policy': 'SymmetricTree', 'min_data_in_leaf': 269}. Best is trial 323 with value: 980.8485503758243.[0m
[32m[I 2024-10-13 03:21:50,249][0m Trial 505 finished with value: 1033.733838033042 and parameters: {'depth': 9, 'learning_rate': 0.01507419081435951, 'iterations': 919, 'l2_leaf_reg': 2.712356624391383e-05, 'border_count': 23, 'bagging_temperature': 0.5133801608631706, 'random_strength': 0.33728453556659, 'grow_policy': 'SymmetricTree', 'min_data_in_leaf': 308}. Best is trial 323 with value: 980.8485503758243.[0m
[32m[I 2024-10-13 03:22:02,505][0m Trial 506 finished with value: 1139.2724239393774 and parameters: {'depth': 10, 'learning_rate': 0.13921583758927566, 'iterations': 1583, 'l2_leaf_reg': 0.003909083526428369, 'border_count': 13, 'bagging_temperature': 0.24429030003885044, 'random_strength': 0.00012677379912245934, 'grow_policy': 'SymmetricTree', 'min_data_in_leaf': 286}. Best is trial 323 with value: 980.8485503758243.[0m
[32m[I 2024-10-13 03:22:08,554][0m Trial 507 finished with value: 1510.6819377810896 and parameters: {'depth': 9, 'learning_rate': 0.010873277480360202, 'iterations': 1254, 'l2_leaf_reg': 0.00016349696988628701, 'border_count': 5, 'bagging_temperature': 0.2205537227025871, 'random_strength': 0.588127237150169, 'grow_policy': 'SymmetricTree', 'min_data_in_leaf': 601}. Best is trial 323 with value: 980.8485503758243.[0m
[32m[I 2024-10-13 03:22:13,688][0m Trial 508 finished with value: 1305.5743287941452 and parameters: {'depth': 12, 'learning_rate': 0.013371164145893653, 'iterations': 416, 'l2_leaf_reg': 0.1606428022133062, 'border_count': 35, 'bagging_temperature': 0.4408923866049465, 'random_strength': 0.1900377736180344, 'grow_policy': 'SymmetricTree', 'min_data_in_leaf': 262}. Best is trial 323 with value: 980.8485503758243.[0m
[32m[I 2024-10-13 03:22:15,028][0m Trial 509 finished with value: 1370.249334309123 and parameters: {'depth': 8, 'learning_rate': 0.021801191461300617, 'iterations': 991, 'l2_leaf_reg': 0.4674235786965492, 'border_count': 28, 'bagging_temperature': 0.5031575737818682, 'random_strength': 4.924463097029357, 'grow_policy': 'Lossguide', 'min_data_in_leaf': 354, 'max_leaves': 185}. Best is trial 323 with value: 980.8485503758243.[0m
[32m[I 2024-10-13 03:22:23,759][0m Trial 510 finished with value: 1110.939815745816 and parameters: {'depth': 9, 'learning_rate': 0.009501182064865079, 'iterations': 1315, 'l2_leaf_reg': 0.00012710689980698935, 'border_count': 17, 'bagging_temperature': 0.47229656659908, 'random_strength': 0.392306165032725, 'grow_policy': 'SymmetricTree', 'min_data_in_leaf': 249}. Best is trial 323 with value: 980.8485503758243.[0m
[32m[I 2024-10-13 03:22:35,652][0m Trial 511 finished with value: 4016.9356148117754 and parameters: {'depth': 9, 'learning_rate': 0.0002363902227244895, 'iterations': 1169, 'l2_leaf_reg': 0.0003618844177745837, 'border_count': 22, 'bagging_temperature': 0.5438685009291501, 'random_strength': 0.2125690656644606, 'grow_policy': 'SymmetricTree', 'min_data_in_leaf': 305}. Best is trial 323 with value: 980.8485503758243.[0m
