Optimizing CatBoost...
[32m[I 2024-10-13 01:47:35,038][0m Trial 0 finished with value: 4783.451854352374 and parameters: {'depth': 11, 'learning_rate': 0.0008597305247066017, 'iterations': 112, 'l2_leaf_reg': 1.1997056743879681e-05, 'border_count': 161, 'bagging_temperature': 0.5258317068543857, 'random_strength': 7.65399449338891, 'grow_policy': 'Lossguide', 'min_data_in_leaf': 588, 'max_leaves': 119}. Best is trial 0 with value: 4783.451854352374.[0m
[32m[I 2024-10-13 01:47:36,664][0m Trial 1 finished with value: 1343.6096931331674 and parameters: {'depth': 9, 'learning_rate': 0.0700953891168318, 'iterations': 1332, 'l2_leaf_reg': 1.818715495014576e-05, 'border_count': 87, 'bagging_temperature': 0.7624362409642249, 'random_strength': 2.9265959649614537, 'grow_policy': 'Depthwise', 'min_data_in_leaf': 544}. Best is trial 1 with value: 1343.6096931331674.[0m
[32m[I 2024-10-13 01:47:38,196][0m Trial 2 finished with value: 4188.803123280221 and parameters: {'depth': 4, 'learning_rate': 0.00023821742805031504, 'iterations': 1346, 'l2_leaf_reg': 9.959005587625996e-06, 'border_count': 101, 'bagging_temperature': 0.49215660591078547, 'random_strength': 2.1572020141464296, 'grow_policy': 'Lossguide', 'min_data_in_leaf': 279, 'max_leaves': 42}. Best is trial 1 with value: 1343.6096931331674.[0m
[32m[I 2024-10-13 01:47:40,309][0m Trial 3 finished with value: 1355.6595043902512 and parameters: {'depth': 3, 'learning_rate': 0.10617895319379127, 'iterations': 2082, 'l2_leaf_reg': 0.33813897133315235, 'border_count': 175, 'bagging_temperature': 0.6980333498666847, 'random_strength': 9.658530940856435, 'grow_policy': 'Depthwise', 'min_data_in_leaf': 838}. Best is trial 1 with value: 1343.6096931331674.[0m
[32m[I 2024-10-13 01:47:42,441][0m Trial 4 finished with value: 3220.4437008791756 and parameters: {'depth': 13, 'learning_rate': 0.00037246286916134804, 'iterations': 2141, 'l2_leaf_reg': 1.6613339045124118e-06, 'border_count': 154, 'bagging_temperature': 0.27984620606088195, 'random_strength': 0.12610509658722013, 'grow_policy': 'Lossguide', 'min_data_in_leaf': 742, 'max_leaves': 180}. Best is trial 1 with value: 1343.6096931331674.[0m
[32m[I 2024-10-13 01:47:43,950][0m Trial 5 finished with value: 1367.5229049816771 and parameters: {'depth': 11, 'learning_rate': 0.13513160122598625, 'iterations': 1060, 'l2_leaf_reg': 0.00837528992559486, 'border_count': 156, 'bagging_temperature': 0.7056746722745753, 'random_strength': 5.1107317747128, 'grow_policy': 'Depthwise', 'min_data_in_leaf': 361}. Best is trial 1 with value: 1343.6096931331674.[0m
[32m[I 2024-10-13 01:47:47,909][0m Trial 6 finished with value: 1278.398417011189 and parameters: {'depth': 10, 'learning_rate': 0.003817927857166267, 'iterations': 1579, 'l2_leaf_reg': 0.0009186355421813673, 'border_count': 189, 'bagging_temperature': 0.12749495044129722, 'random_strength': 2.3873052629594262, 'grow_policy': 'Lossguide', 'min_data_in_leaf': 312, 'max_leaves': 167}. Best is trial 6 with value: 1278.398417011189.[0m
[32m[I 2024-10-13 01:47:52,769][0m Trial 7 finished with value: 1389.5816857834604 and parameters: {'depth': 7, 'learning_rate': 0.11846419609061459, 'iterations': 1416, 'l2_leaf_reg': 0.0001380432169269402, 'border_count': 130, 'bagging_temperature': 0.26717698428795045, 'random_strength': 5.953145205529811, 'grow_policy': 'Lossguide', 'min_data_in_leaf': 655, 'max_leaves': 201}. Best is trial 6 with value: 1278.398417011189.[0m
[32m[I 2024-10-13 01:48:02,720][0m Trial 8 finished with value: 1366.6154125367336 and parameters: {'depth': 9, 'learning_rate': 0.015136662118015067, 'iterations': 882, 'l2_leaf_reg': 0.006563272097258242, 'border_count': 207, 'bagging_temperature': 0.27566708433249043, 'random_strength': 4.2239253606363745, 'grow_policy': 'SymmetricTree', 'min_data_in_leaf': 878}. Best is trial 6 with value: 1278.398417011189.[0m
[32m[I 2024-10-13 01:48:05,220][0m Trial 9 finished with value: 3990.852750837421 and parameters: {'depth': 14, 'learning_rate': 0.0001595249776495816, 'iterations': 2563, 'l2_leaf_reg': 3.767998093080537e-06, 'border_count': 233, 'bagging_temperature': 0.88405787067024, 'random_strength': 6.951605147263563, 'grow_policy': 'Lossguide', 'min_data_in_leaf': 772, 'max_leaves': 255}. Best is trial 6 with value: 1278.398417011189.[0m
[32m[I 2024-10-13 01:48:25,108][0m Trial 10 finished with value: 1292.195755691767 and parameters: {'depth': 6, 'learning_rate': 0.0030584033529118646, 'iterations': 2939, 'l2_leaf_reg': 2.6258472843178515e-08, 'border_count': 26, 'bagging_temperature': 0.011119132049926012, 'random_strength': 0.5753182025267156, 'grow_policy': 'SymmetricTree', 'min_data_in_leaf': 42}. Best is trial 6 with value: 1278.398417011189.[0m
[32m[I 2024-10-13 01:48:36,124][0m Trial 11 finished with value: 1835.6842960913648 and parameters: {'depth': 6, 'learning_rate': 0.0034730231181606393, 'iterations': 2902, 'l2_leaf_reg': 1.0610294285514666e-08, 'border_count': 4, 'bagging_temperature': 0.05546865628179665, 'random_strength': 0.16407627981074313, 'grow_policy': 'SymmetricTree', 'min_data_in_leaf': 45}. Best is trial 6 with value: 1278.398417011189.[0m
[32m[I 2024-10-13 01:48:44,344][0m Trial 12 finished with value: 1536.0962843609943 and parameters: {'depth': 6, 'learning_rate': 0.0035512253935421198, 'iterations': 2014, 'l2_leaf_reg': 2.6969774971239503e-08, 'border_count': 5, 'bagging_temperature': 0.03195242882820659, 'random_strength': 2.0584692326760123, 'grow_policy': 'SymmetricTree', 'min_data_in_leaf': 9}. Best is trial 6 with value: 1278.398417011189.[0m
[32m[I 2024-10-13 01:49:02,680][0m Trial 13 finished with value: 1401.6420129613125 and parameters: {'depth': 8, 'learning_rate': 0.01708503924692595, 'iterations': 2998, 'l2_leaf_reg': 0.005167934081300774, 'border_count': 53, 'bagging_temperature': 0.14520638912502534, 'random_strength': 1.2965133296844786, 'grow_policy': 'SymmetricTree', 'min_data_in_leaf': 197}. Best is trial 6 with value: 1278.398417011189.[0m
[32m[I 2024-10-13 01:49:05,581][0m Trial 14 finished with value: 3937.2591286998295 and parameters: {'depth': 11, 'learning_rate': 0.0013210683116413394, 'iterations': 373, 'l2_leaf_reg': 4.156785925808364, 'border_count': 248, 'bagging_temperature': 0.1652825570128166, 'random_strength': 3.5473071460405747, 'grow_policy': 'SymmetricTree', 'min_data_in_leaf': 409}. Best is trial 6 with value: 1278.398417011189.[0m
[32m[I 2024-10-13 01:49:08,202][0m Trial 15 finished with value: 1237.1186279958924 and parameters: {'depth': 5, 'learning_rate': 0.01893826463724987, 'iterations': 1768, 'l2_leaf_reg': 3.0508220891067804e-07, 'border_count': 47, 'bagging_temperature': 0.3988109656156426, 'random_strength': 1.293769440246948, 'grow_policy': 'Lossguide', 'min_data_in_leaf': 161, 'max_leaves': 122}. Best is trial 15 with value: 1237.1186279958924.[0m
[32m[I 2024-10-13 01:49:09,929][0m Trial 16 finished with value: 1332.5434544131836 and parameters: {'depth': 4, 'learning_rate': 0.016984977993512805, 'iterations': 741, 'l2_leaf_reg': 0.00046654113801302804, 'border_count': 204, 'bagging_temperature': 0.42918520147891803, 'random_strength': 2.286169023274335, 'grow_policy': 'Lossguide', 'min_data_in_leaf': 170, 'max_leaves': 114}. Best is trial 15 with value: 1237.1186279958924.[0m
[32m[I 2024-10-13 01:49:15,024][0m Trial 17 finished with value: 1310.0576384041822 and parameters: {'depth': 10, 'learning_rate': 0.031987706953789, 'iterations': 1954, 'l2_leaf_reg': 3.048958264087785e-07, 'border_count': 63, 'bagging_temperature': 0.37753271533118726, 'random_strength': 3.8877281434477218, 'grow_policy': 'Lossguide', 'min_data_in_leaf': 424, 'max_leaves': 150}. Best is trial 15 with value: 1237.1186279958924.[0m
[32m[I 2024-10-13 01:49:16,864][0m Trial 18 finished with value: 1316.6333130096527 and parameters: {'depth': 15, 'learning_rate': 0.007882214343321791, 'iterations': 1776, 'l2_leaf_reg': 0.00043280549794446515, 'border_count': 104, 'bagging_temperature': 0.5978089967961935, 'random_strength': 1.5021068558560455, 'grow_policy': 'Lossguide', 'min_data_in_leaf': 185, 'max_leaves': 77}. Best is trial 15 with value: 1237.1186279958924.[0m
[32m[I 2024-10-13 01:49:19,135][0m Trial 19 finished with value: 1478.722715365733 and parameters: {'depth': 12, 'learning_rate': 0.0012462628129885445, 'iterations': 2362, 'l2_leaf_reg': 0.12270178568093547, 'border_count': 199, 'bagging_temperature': 0.9672147031057411, 'random_strength': 3.101293407185467, 'grow_policy': 'Lossguide', 'min_data_in_leaf': 293, 'max_leaves': 168}. Best is trial 15 with value: 1237.1186279958924.[0m
[32m[I 2024-10-13 01:49:20,908][0m Trial 20 finished with value: 1343.6385565127061 and parameters: {'depth': 8, 'learning_rate': 0.036257412875875375, 'iterations': 1553, 'l2_leaf_reg': 2.208705562675074e-07, 'border_count': 124, 'bagging_temperature': 0.16658641041724442, 'random_strength': 4.95641251067124, 'grow_policy': 'Lossguide', 'min_data_in_leaf': 965, 'max_leaves': 218}. Best is trial 15 with value: 1237.1186279958924.[0m
[32m[I 2024-10-13 01:49:30,983][0m Trial 21 finished with value: 1371.9558790709398 and parameters: {'depth': 5, 'learning_rate': 0.005786628754234909, 'iterations': 2636, 'l2_leaf_reg': 1.0491627075245264e-07, 'border_count': 40, 'bagging_temperature': 0.011230254229976477, 'random_strength': 0.9587988285144404, 'grow_policy': 'SymmetricTree', 'min_data_in_leaf': 106}. Best is trial 15 with value: 1237.1186279958924.[0m
[32m[I 2024-10-13 01:49:36,985][0m Trial 22 finished with value: 1206.3436647801352 and parameters: {'depth': 6, 'learning_rate': 0.2908525768670518, 'iterations': 1703, 'l2_leaf_reg': 9.34472052784453e-05, 'border_count': 17, 'bagging_temperature': 0.10720886378439277, 'random_strength': 0.7736982818990521, 'grow_policy': 'SymmetricTree', 'min_data_in_leaf': 108}. Best is trial 22 with value: 1206.3436647801352.[0m
[32m[I 2024-10-13 01:49:42,009][0m Trial 23 finished with value: 1514.4077864473047 and parameters: {'depth': 7, 'learning_rate': 0.29980995738695165, 'iterations': 1835, 'l2_leaf_reg': 0.0001015504579425376, 'border_count': 74, 'bagging_temperature': 0.35676060459544584, 'random_strength': 1.268837952305264, 'grow_policy': 'Depthwise', 'min_data_in_leaf': 278}. Best is trial 22 with value: 1206.3436647801352.[0m
[32m[I 2024-10-13 01:49:47,520][0m Trial 24 finished with value: 1305.1375921141234 and parameters: {'depth': 3, 'learning_rate': 0.04643795025938737, 'iterations': 1654, 'l2_leaf_reg': 0.0013373541893111072, 'border_count': 31, 'bagging_temperature': 0.12488944655735044, 'random_strength': 2.5629413859453445, 'grow_policy': 'Lossguide', 'min_data_in_leaf': 133, 'max_leaves': 113}. Best is trial 22 with value: 1206.3436647801352.[0m
[32m[I 2024-10-13 01:49:54,594][0m Trial 25 finished with value: 1264.909286384726 and parameters: {'depth': 5, 'learning_rate': 0.19993593430508322, 'iterations': 2286, 'l2_leaf_reg': 6.781762459586749e-05, 'border_count': 17, 'bagging_temperature': 0.1882131445632485, 'random_strength': 1.773584109167472, 'grow_policy': 'SymmetricTree', 'min_data_in_leaf': 242}. Best is trial 22 with value: 1206.3436647801352.[0m
[32m[I 2024-10-13 01:50:06,497][0m Trial 26 finished with value: 1349.6363875565057 and parameters: {'depth': 5, 'learning_rate': 0.2640753691387994, 'iterations': 2333, 'l2_leaf_reg': 3.844607604497537e-05, 'border_count': 19, 'bagging_temperature': 0.22568978537289516, 'random_strength': 1.568911211253746, 'grow_policy': 'SymmetricTree', 'min_data_in_leaf': 469}. Best is trial 22 with value: 1206.3436647801352.[0m
[32m[I 2024-10-13 01:50:16,388][0m Trial 27 finished with value: 1393.907922221792 and parameters: {'depth': 5, 'learning_rate': 0.21040891069941203, 'iterations': 2309, 'l2_leaf_reg': 1.2686442796276885e-06, 'border_count': 51, 'bagging_temperature': 0.3431254991826735, 'random_strength': 0.9492636998446573, 'grow_policy': 'SymmetricTree', 'min_data_in_leaf': 100}. Best is trial 22 with value: 1206.3436647801352.[0m
[32m[I 2024-10-13 01:50:28,381][0m Trial 28 finished with value: 1131.2072920761798 and parameters: {'depth': 4, 'learning_rate': 0.06794137930573504, 'iterations': 2687, 'l2_leaf_reg': 0.03337717675580078, 'border_count': 18, 'bagging_temperature': 0.45224232588800856, 'random_strength': 0.14613994725746426, 'grow_policy': 'SymmetricTree', 'min_data_in_leaf': 226}. Best is trial 28 with value: 1131.2072920761798.[0m
[32m[I 2024-10-13 01:50:42,525][0m Trial 29 finished with value: 1219.161188258704 and parameters: {'depth': 4, 'learning_rate': 0.07738078236573777, 'iterations': 2651, 'l2_leaf_reg': 0.08253133065877032, 'border_count': 75, 'bagging_temperature': 0.5321444542690563, 'random_strength': 9.368538924175484, 'grow_policy': 'SymmetricTree', 'min_data_in_leaf': 218}. Best is trial 28 with value: 1131.2072920761798.[0m
[32m[I 2024-10-13 01:50:51,283][0m Trial 30 finished with value: 1407.14323700434 and parameters: {'depth': 3, 'learning_rate': 0.06868410807165856, 'iterations': 2629, 'l2_leaf_reg': 0.1104658826277927, 'border_count': 75, 'bagging_temperature': 0.565140513167888, 'random_strength': 9.927350590163092, 'grow_policy': 'SymmetricTree', 'min_data_in_leaf': 614}. Best is trial 28 with value: 1131.2072920761798.[0m
[32m[I 2024-10-13 01:51:00,523][0m Trial 31 finished with value: 1357.702433105473 and parameters: {'depth': 4, 'learning_rate': 0.07127661912762492, 'iterations': 2580, 'l2_leaf_reg': 1.2964150046178726, 'border_count': 41, 'bagging_temperature': 0.5004385624334654, 'random_strength': 8.425142095533646, 'grow_policy': 'SymmetricTree', 'min_data_in_leaf': 223}. Best is trial 28 with value: 1131.2072920761798.[0m
[32m[I 2024-10-13 01:51:09,202][0m Trial 32 finished with value: 1225.3625371977655 and parameters: {'depth': 4, 'learning_rate': 0.026335052418994136, 'iterations': 1109, 'l2_leaf_reg': 0.03402362037049632, 'border_count': 62, 'bagging_temperature': 0.6177718956716847, 'random_strength': 8.569487062807326, 'grow_policy': 'SymmetricTree', 'min_data_in_leaf': 123}. Best is trial 28 with value: 1131.2072920761798.[0m
[32m[I 2024-10-13 01:51:17,203][0m Trial 33 finished with value: 1224.7701639771972 and parameters: {'depth': 4, 'learning_rate': 0.061787879080448006, 'iterations': 1035, 'l2_leaf_reg': 0.03152306203245376, 'border_count': 73, 'bagging_temperature': 0.659256123843077, 'random_strength': 8.90626342511474, 'grow_policy': 'SymmetricTree', 'min_data_in_leaf': 85}. Best is trial 28 with value: 1131.2072920761798.[0m
[32m[I 2024-10-13 01:51:19,535][0m Trial 34 finished with value: 1273.366970695289 and parameters: {'depth': 3, 'learning_rate': 0.06629918298986723, 'iterations': 546, 'l2_leaf_reg': 0.0356350423718141, 'border_count': 94, 'bagging_temperature': 0.7629048155374107, 'random_strength': 9.085845143842455, 'grow_policy': 'SymmetricTree', 'min_data_in_leaf': 51}. Best is trial 28 with value: 1131.2072920761798.[0m
[32m[I 2024-10-13 01:51:20,349][0m Trial 35 finished with value: 1285.9587984636757 and parameters: {'depth': 4, 'learning_rate': 0.14757494148034575, 'iterations': 200, 'l2_leaf_reg': 0.6328419048806403, 'border_count': 108, 'bagging_temperature': 0.4518333956576815, 'random_strength': 7.324673654018342, 'grow_policy': 'SymmetricTree', 'min_data_in_leaf': 534}. Best is trial 28 with value: 1131.2072920761798.[0m
[32m[I 2024-10-13 01:51:21,833][0m Trial 36 finished with value: 1354.129025475794 and parameters: {'depth': 7, 'learning_rate': 0.09319340973232565, 'iterations': 1215, 'l2_leaf_reg': 0.01997855543757451, 'border_count': 81, 'bagging_temperature': 0.6738014925971173, 'random_strength': 7.8276083820575035, 'grow_policy': 'Depthwise', 'min_data_in_leaf': 352}. Best is trial 28 with value: 1131.2072920761798.[0m
[32m[I 2024-10-13 01:51:31,429][0m Trial 37 finished with value: 1287.4452260480487 and parameters: {'depth': 3, 'learning_rate': 0.04997217043085714, 'iterations': 2777, 'l2_leaf_reg': 0.00219344670544793, 'border_count': 132, 'bagging_temperature': 0.7918594995842533, 'random_strength': 6.341232847600491, 'grow_policy': 'SymmetricTree', 'min_data_in_leaf': 83}. Best is trial 28 with value: 1131.2072920761798.[0m
[32m[I 2024-10-13 01:51:35,704][0m Trial 38 finished with value: 1382.486451141305 and parameters: {'depth': 6, 'learning_rate': 0.1564349081848381, 'iterations': 929, 'l2_leaf_reg': 0.10069397905804582, 'border_count': 16, 'bagging_temperature': 0.5283535856860606, 'random_strength': 9.236220432624457, 'grow_policy': 'SymmetricTree', 'min_data_in_leaf': 246}. Best is trial 28 with value: 1131.2072920761798.[0m
[32m[I 2024-10-13 01:51:36,778][0m Trial 39 finished with value: 1276.466446766825 and parameters: {'depth': 4, 'learning_rate': 0.0099910990016462, 'iterations': 615, 'l2_leaf_reg': 2.827335279115898, 'border_count': 63, 'bagging_temperature': 0.658185690349498, 'random_strength': 8.143231870985888, 'grow_policy': 'Depthwise', 'min_data_in_leaf': 358}. Best is trial 28 with value: 1131.2072920761798.[0m
[32m[I 2024-10-13 01:51:57,324][0m Trial 40 finished with value: 1340.7315519857568 and parameters: {'depth': 7, 'learning_rate': 0.09018782371196037, 'iterations': 2442, 'l2_leaf_reg': 1.0739541595924312e-05, 'border_count': 117, 'bagging_temperature': 0.8234187870682259, 'random_strength': 9.403273862027124, 'grow_policy': 'SymmetricTree', 'min_data_in_leaf': 8}. Best is trial 28 with value: 1131.2072920761798.[0m
[32m[I 2024-10-13 01:52:01,760][0m Trial 41 finished with value: 1339.1470057923307 and parameters: {'depth': 4, 'learning_rate': 0.027797594966477317, 'iterations': 1045, 'l2_leaf_reg': 0.028190090986894355, 'border_count': 65, 'bagging_temperature': 0.6224895133899613, 'random_strength': 8.615809550885356, 'grow_policy': 'SymmetricTree', 'min_data_in_leaf': 128}. Best is trial 28 with value: 1131.2072920761798.[0m
[32m[I 2024-10-13 01:52:06,864][0m Trial 42 finished with value: 1236.2700615992803 and parameters: {'depth': 4, 'learning_rate': 0.0244895967431098, 'iterations': 1308, 'l2_leaf_reg': 0.3049858620887858, 'border_count': 88, 'bagging_temperature': 0.5512097867858408, 'random_strength': 8.785772717030984, 'grow_policy': 'SymmetricTree', 'min_data_in_leaf': 75}. Best is trial 28 with value: 1131.2072920761798.[0m
[32m[I 2024-10-13 01:52:11,044][0m Trial 43 finished with value: 1410.7834045266877 and parameters: {'depth': 3, 'learning_rate': 0.0526598316573939, 'iterations': 1188, 'l2_leaf_reg': 0.0031724469230411255, 'border_count': 35, 'bagging_temperature': 0.7228200688457401, 'random_strength': 7.146768147270749, 'grow_policy': 'SymmetricTree', 'min_data_in_leaf': 150}. Best is trial 28 with value: 1131.2072920761798.[0m
[32m[I 2024-10-13 01:52:17,093][0m Trial 44 finished with value: 1311.1453583624468 and parameters: {'depth': 5, 'learning_rate': 0.11251003142579499, 'iterations': 1417, 'l2_leaf_reg': 0.009451043011618985, 'border_count': 57, 'bagging_temperature': 0.47226696702075965, 'random_strength': 6.500875997879289, 'grow_policy': 'SymmetricTree', 'min_data_in_leaf': 324}. Best is trial 28 with value: 1131.2072920761798.[0m
[32m[I 2024-10-13 01:52:31,397][0m Trial 45 finished with value: 2528.2341976230496 and parameters: {'depth': 6, 'learning_rate': 0.18009123123395634, 'iterations': 2813, 'l2_leaf_reg': 0.5005392497546486, 'border_count': 3, 'bagging_temperature': 0.606531387270645, 'random_strength': 9.739418509704521, 'grow_policy': 'SymmetricTree', 'min_data_in_leaf': 223}. Best is trial 28 with value: 1131.2072920761798.[0m
[32m[I 2024-10-13 01:52:38,893][0m Trial 46 finished with value: 1056.1705970057285 and parameters: {'depth': 4, 'learning_rate': 0.010811966408023822, 'iterations': 2162, 'l2_leaf_reg': 0.055064582768759175, 'border_count': 23, 'bagging_temperature': 0.30838010962973184, 'random_strength': 0.10479737250454621, 'grow_policy': 'SymmetricTree', 'min_data_in_leaf': 267}. Best is trial 46 with value: 1056.1705970057285.[0m
[32m[I 2024-10-13 01:53:04,758][0m Trial 47 finished with value: 1320.5571311412555 and parameters: {'depth': 8, 'learning_rate': 0.01106851347168607, 'iterations': 2192, 'l2_leaf_reg': 0.20767581181145053, 'border_count': 142, 'bagging_temperature': 0.28730961786921666, 'random_strength': 0.01782691889911925, 'grow_policy': 'SymmetricTree', 'min_data_in_leaf': 273}. Best is trial 46 with value: 1056.1705970057285.[0m
[32m[I 2024-10-13 01:53:07,721][0m Trial 48 finished with value: 3221.8573747197083 and parameters: {'depth': 6, 'learning_rate': 0.0004193380547719186, 'iterations': 1951, 'l2_leaf_reg': 0.06294341652851763, 'border_count': 25, 'bagging_temperature': 0.3093284049102408, 'random_strength': 0.3945278027615449, 'grow_policy': 'Depthwise', 'min_data_in_leaf': 425}. Best is trial 46 with value: 1056.1705970057285.[0m
[32m[I 2024-10-13 01:53:15,546][0m Trial 49 finished with value: 1382.963057374865 and parameters: {'depth': 3, 'learning_rate': 0.0020838341767874507, 'iterations': 2134, 'l2_leaf_reg': 0.009683127501019998, 'border_count': 11, 'bagging_temperature': 0.1024548620302923, 'random_strength': 0.6516433863724025, 'grow_policy': 'SymmetricTree', 'min_data_in_leaf': 203}. Best is trial 46 with value: 1056.1705970057285.[0m
[32m[I 2024-10-13 01:53:26,247][0m Trial 50 finished with value: 1232.1044375238546 and parameters: {'depth': 5, 'learning_rate': 0.03793911240604385, 'iterations': 2469, 'l2_leaf_reg': 7.134881283479153, 'border_count': 36, 'bagging_temperature': 0.42941779956044923, 'random_strength': 5.077399912877722, 'grow_policy': 'SymmetricTree', 'min_data_in_leaf': 713}. Best is trial 46 with value: 1056.1705970057285.[0m
