[32m[I 2024-10-13 01:53:45,993][0m Trial 51 finished with value: 1169.248000184885 and parameters: {'depth': 4, 'learning_rate': 0.02617687603593404, 'iterations': 2744, 'l2_leaf_reg': 0.039426650497322385, 'border_count': 25, 'bagging_temperature': 0.5118450193179348, 'random_strength': 7.754636489272192, 'grow_policy': 'SymmetricTree', 'min_data_in_leaf': 151}. Best is trial 46 with value: 1056.1705970057285.[0m
[32m[I 2024-10-13 01:53:55,958][0m Trial 52 finished with value: 1240.2531009960599 and parameters: {'depth': 4, 'learning_rate': 0.02219121187779519, 'iterations': 2765, 'l2_leaf_reg': 0.0002035746853750502, 'border_count': 169, 'bagging_temperature': 0.5036703642704404, 'random_strength': 5.540209530508048, 'grow_policy': 'SymmetricTree', 'min_data_in_leaf': 173}. Best is trial 46 with value: 1056.1705970057285.[0m
[32m[I 2024-10-13 01:54:04,230][0m Trial 53 finished with value: 2751.284988891979 and parameters: {'depth': 3, 'learning_rate': 0.006913011139031861, 'iterations': 2714, 'l2_leaf_reg': 0.014751267637892508, 'border_count': 1, 'bagging_temperature': 0.07994765073907553, 'random_strength': 7.852778032688805, 'grow_policy': 'SymmetricTree', 'min_data_in_leaf': 40}. Best is trial 46 with value: 1056.1705970057285.[0m
[32m[I 2024-10-13 01:54:13,240][0m Trial 54 finished with value: 1029.42640243851 and parameters: {'depth': 5, 'learning_rate': 0.014695097907906575, 'iterations': 2471, 'l2_leaf_reg': 0.9288752075737655, 'border_count': 23, 'bagging_temperature': 0.2374206287680294, 'random_strength': 0.7178977541754247, 'grow_policy': 'SymmetricTree', 'min_data_in_leaf': 258}. Best is trial 54 with value: 1029.42640243851.[0m
[32m[I 2024-10-13 01:54:24,731][0m Trial 55 finished with value: 1225.8795827750484 and parameters: {'depth': 5, 'learning_rate': 0.011341182310125826, 'iterations': 2910, 'l2_leaf_reg': 1.5968435241184518, 'border_count': 25, 'bagging_temperature': 0.26039003551040374, 'random_strength': 0.4857440807591995, 'grow_policy': 'SymmetricTree', 'min_data_in_leaf': 314}. Best is trial 54 with value: 1029.42640243851.[0m
[32m[I 2024-10-13 01:54:36,410][0m Trial 56 finished with value: 1274.3115434730125 and parameters: {'depth': 6, 'learning_rate': 0.015015371449433632, 'iterations': 2520, 'l2_leaf_reg': 0.7556541917822208, 'border_count': 46, 'bagging_temperature': 0.21917138832686045, 'random_strength': 0.8747237492892478, 'grow_policy': 'SymmetricTree', 'min_data_in_leaf': 392}. Best is trial 54 with value: 1029.42640243851.[0m
[32m[I 2024-10-13 01:54:45,184][0m Trial 57 finished with value: 1180.883296844195 and parameters: {'depth': 6, 'learning_rate': 0.013753378518416478, 'iterations': 2219, 'l2_leaf_reg': 0.22125192038231814, 'border_count': 11, 'bagging_temperature': 0.4006453918928507, 'random_strength': 0.12368623725202377, 'grow_policy': 'SymmetricTree', 'min_data_in_leaf': 264}. Best is trial 54 with value: 1029.42640243851.[0m
[32m[I 2024-10-13 01:54:47,383][0m Trial 58 finished with value: 1395.1893598833133 and parameters: {'depth': 9, 'learning_rate': 0.0042100060363950975, 'iterations': 2213, 'l2_leaf_reg': 0.0008361550354122338, 'border_count': 11, 'bagging_temperature': 0.39919796800312085, 'random_strength': 0.21576588458012635, 'grow_policy': 'Depthwise', 'min_data_in_leaf': 260}. Best is trial 54 with value: 1029.42640243851.[0m
[32m[I 2024-10-13 01:54:55,413][0m Trial 59 finished with value: 1321.6780884582806 and parameters: {'depth': 7, 'learning_rate': 0.014484758961636576, 'iterations': 2036, 'l2_leaf_reg': 0.17568985526910957, 'border_count': 28, 'bagging_temperature': 0.23519854977002272, 'random_strength': 2.044151659644119, 'grow_policy': 'SymmetricTree', 'min_data_in_leaf': 478}. Best is trial 54 with value: 1029.42640243851.[0m
[32m[I 2024-10-13 01:55:04,947][0m Trial 60 finished with value: 1270.1872822203534 and parameters: {'depth': 6, 'learning_rate': 0.009070074485119116, 'iterations': 2427, 'l2_leaf_reg': 7.330895935712146, 'border_count': 13, 'bagging_temperature': 0.32774019377363794, 'random_strength': 2.7659053340202613, 'grow_policy': 'SymmetricTree', 'min_data_in_leaf': 327}. Best is trial 54 with value: 1029.42640243851.[0m
[32m[I 2024-10-13 01:55:15,330][0m Trial 61 finished with value: 1060.434611868405 and parameters: {'depth': 5, 'learning_rate': 0.04164653762442845, 'iterations': 2684, 'l2_leaf_reg': 0.07797905420071927, 'border_count': 23, 'bagging_temperature': 0.382518985685905, 'random_strength': 0.7203318875211648, 'grow_policy': 'SymmetricTree', 'min_data_in_leaf': 196}. Best is trial 54 with value: 1029.42640243851.[0m
[32m[I 2024-10-13 01:55:22,366][0m Trial 62 finished with value: 1167.420638887334 and parameters: {'depth': 5, 'learning_rate': 0.03818091636824862, 'iterations': 1877, 'l2_leaf_reg': 1.4455371067845413, 'border_count': 23, 'bagging_temperature': 0.3734955783464507, 'random_strength': 0.7802514053416454, 'grow_policy': 'SymmetricTree', 'min_data_in_leaf': 165}. Best is trial 54 with value: 1029.42640243851.[0m
[32m[I 2024-10-13 01:55:33,621][0m Trial 63 finished with value: 1087.3654275910776 and parameters: {'depth': 5, 'learning_rate': 0.018903681553525214, 'iterations': 2855, 'l2_leaf_reg': 1.3540798159200926, 'border_count': 23, 'bagging_temperature': 0.3918784653610146, 'random_strength': 0.07787038054091211, 'grow_policy': 'SymmetricTree', 'min_data_in_leaf': 180}. Best is trial 54 with value: 1029.42640243851.[0m
[32m[I 2024-10-13 01:55:46,305][0m Trial 64 finished with value: 1232.8907172833183 and parameters: {'depth': 5, 'learning_rate': 0.02002970868404917, 'iterations': 2968, 'l2_leaf_reg': 2.374540394690371, 'border_count': 44, 'bagging_temperature': 0.363219294610058, 'random_strength': 1.140245173993978, 'grow_policy': 'SymmetricTree', 'min_data_in_leaf': 184}. Best is trial 54 with value: 1029.42640243851.[0m
[32m[I 2024-10-13 01:55:57,137][0m Trial 65 finished with value: 1145.9274233811964 and parameters: {'depth': 5, 'learning_rate': 0.0414482842434791, 'iterations': 2874, 'l2_leaf_reg': 1.1648960952911758, 'border_count': 23, 'bagging_temperature': 0.30743512692215264, 'random_strength': 1.7720909661157975, 'grow_policy': 'SymmetricTree', 'min_data_in_leaf': 158}. Best is trial 54 with value: 1029.42640243851.[0m
[32m[I 2024-10-13 01:56:08,708][0m Trial 66 finished with value: 1432.986071044384 and parameters: {'depth': 5, 'learning_rate': 0.03789591018576659, 'iterations': 2853, 'l2_leaf_reg': 0.8776994109185033, 'border_count': 35, 'bagging_temperature': 0.3061210100535471, 'random_strength': 1.8830497888157591, 'grow_policy': 'SymmetricTree', 'min_data_in_leaf': 290}. Best is trial 54 with value: 1029.42640243851.[0m
[32m[I 2024-10-13 01:56:18,471][0m Trial 67 finished with value: 1112.392058574774 and parameters: {'depth': 5, 'learning_rate': 0.04496514656828922, 'iterations': 2536, 'l2_leaf_reg': 3.551673975382756, 'border_count': 22, 'bagging_temperature': 0.3822151742674697, 'random_strength': 1.453275653287864, 'grow_policy': 'SymmetricTree', 'min_data_in_leaf': 205}. Best is trial 54 with value: 1029.42640243851.[0m
[32m[I 2024-10-13 01:56:29,954][0m Trial 68 finished with value: 1286.304055019702 and parameters: {'depth': 5, 'learning_rate': 0.0060502521567946214, 'iterations': 2660, 'l2_leaf_reg': 4.208435339246661, 'border_count': 55, 'bagging_temperature': 0.4430044422535748, 'random_strength': 1.6047920394066413, 'grow_policy': 'SymmetricTree', 'min_data_in_leaf': 202}. Best is trial 54 with value: 1029.42640243851.[0m
[32m[I 2024-10-13 01:56:32,317][0m Trial 69 finished with value: 1284.7106690672088 and parameters: {'depth': 7, 'learning_rate': 0.0475518195527718, 'iterations': 2542, 'l2_leaf_reg': 0.43308428019668715, 'border_count': 8, 'bagging_temperature': 0.19716178567671655, 'random_strength': 3.1922672787109097, 'grow_policy': 'Lossguide', 'min_data_in_leaf': 230, 'max_leaves': 54}. Best is trial 54 with value: 1029.42640243851.[0m
[32m[I 2024-10-13 01:59:04,318][0m Trial 70 finished with value: 1152.4372726493732 and parameters: {'depth': 13, 'learning_rate': 0.004548807898339226, 'iterations': 2993, 'l2_leaf_reg': 8.505818593040782, 'border_count': 30, 'bagging_temperature': 0.26033801246718735, 'random_strength': 0.40013267106503925, 'grow_policy': 'SymmetricTree', 'min_data_in_leaf': 298}. Best is trial 54 with value: 1029.42640243851.[0m
[32m[I 2024-10-13 02:00:05,868][0m Trial 71 finished with value: 1162.851620941014 and parameters: {'depth': 12, 'learning_rate': 0.004705279775857213, 'iterations': 2874, 'l2_leaf_reg': 4.018826863283068, 'border_count': 33, 'bagging_temperature': 0.2661904486379092, 'random_strength': 0.3967451052296722, 'grow_policy': 'SymmetricTree', 'min_data_in_leaf': 308}. Best is trial 54 with value: 1029.42640243851.[0m
[32m[I 2024-10-13 02:00:50,514][0m Trial 72 finished with value: 1210.7316907771744 and parameters: {'depth': 10, 'learning_rate': 0.0021815308948397853, 'iterations': 2697, 'l2_leaf_reg': 8.434102545798583, 'border_count': 20, 'bagging_temperature': 0.3444646649860965, 'random_strength': 1.2164587960417617, 'grow_policy': 'SymmetricTree', 'min_data_in_leaf': 195}. Best is trial 54 with value: 1029.42640243851.[0m
[32m[I 2024-10-13 02:02:48,996][0m Trial 73 finished with value: 1200.0948704717566 and parameters: {'depth': 13, 'learning_rate': 0.002686433412623619, 'iterations': 2949, 'l2_leaf_reg': 2.1656569300183874, 'border_count': 39, 'bagging_temperature': 0.3990817696686943, 'random_strength': 0.5416146417747773, 'grow_policy': 'SymmetricTree', 'min_data_in_leaf': 393}. Best is trial 54 with value: 1029.42640243851.[0m
[32m[I 2024-10-13 02:03:06,721][0m Trial 74 finished with value: 1301.593205500919 and parameters: {'depth': 8, 'learning_rate': 0.030747274987662918, 'iterations': 2582, 'l2_leaf_reg': 1.0476288237964255, 'border_count': 50, 'bagging_temperature': 0.31986808372639147, 'random_strength': 1.4392664116518943, 'grow_policy': 'SymmetricTree', 'min_data_in_leaf': 253}. Best is trial 54 with value: 1029.42640243851.[0m
[32m[I 2024-10-13 02:07:49,898][0m Trial 75 finished with value: 1267.392346439297 and parameters: {'depth': 13, 'learning_rate': 0.008835630006433956, 'iterations': 2992, 'l2_leaf_reg': 3.6973584013510483, 'border_count': 217, 'bagging_temperature': 0.4788868462856096, 'random_strength': 0.004192344407737303, 'grow_policy': 'SymmetricTree', 'min_data_in_leaf': 348}. Best is trial 54 with value: 1029.42640243851.[0m
[32m[I 2024-10-13 02:08:06,651][0m Trial 76 finished with value: 1258.816517671042 and parameters: {'depth': 10, 'learning_rate': 0.01861412945524698, 'iterations': 2399, 'l2_leaf_reg': 0.6068592767595875, 'border_count': 32, 'bagging_temperature': 0.28226131122616177, 'random_strength': 1.0019859441715875, 'grow_policy': 'SymmetricTree', 'min_data_in_leaf': 134}. Best is trial 54 with value: 1029.42640243851.[0m
[32m[I 2024-10-13 02:08:09,623][0m Trial 77 finished with value: 1176.3602276429497 and parameters: {'depth': 15, 'learning_rate': 0.012446353939888273, 'iterations': 2813, 'l2_leaf_reg': 0.33087165669605656, 'border_count': 17, 'bagging_temperature': 0.249379474910366, 'random_strength': 0.30943266605785624, 'grow_policy': 'Depthwise', 'min_data_in_leaf': 289}. Best is trial 54 with value: 1029.42640243851.[0m
[32m[I 2024-10-13 02:08:17,978][0m Trial 78 finished with value: 2355.7894696315157 and parameters: {'depth': 12, 'learning_rate': 0.058580019184952946, 'iterations': 2485, 'l2_leaf_reg': 0.07216395206168902, 'border_count': 2, 'bagging_temperature': 0.17654983069539337, 'random_strength': 0.6963920301156076, 'grow_policy': 'SymmetricTree', 'min_data_in_leaf': 237}. Best is trial 54 with value: 1029.42640243851.[0m
[32m[I 2024-10-13 02:08:27,937][0m Trial 79 finished with value: 1324.0598008211014 and parameters: {'depth': 5, 'learning_rate': 0.007435095193078639, 'iterations': 2605, 'l2_leaf_reg': 0.15451924963816818, 'border_count': 44, 'bagging_temperature': 0.42134160733134446, 'random_strength': 2.24308311609614, 'grow_policy': 'SymmetricTree', 'min_data_in_leaf': 211}. Best is trial 54 with value: 1029.42640243851.[0m
[32m[I 2024-10-13 02:08:30,482][0m Trial 80 finished with value: 1432.4377272554077 and parameters: {'depth': 14, 'learning_rate': 0.08369288591147962, 'iterations': 2869, 'l2_leaf_reg': 9.627325644414482, 'border_count': 28, 'bagging_temperature': 0.29482443258118024, 'random_strength': 1.0649670181591986, 'grow_policy': 'Lossguide', 'min_data_in_leaf': 839, 'max_leaves': 254}. Best is trial 54 with value: 1029.42640243851.[0m
[32m[I 2024-10-13 02:09:44,944][0m Trial 81 finished with value: 1219.4197254906312 and parameters: {'depth': 12, 'learning_rate': 0.00406202940464127, 'iterations': 2871, 'l2_leaf_reg': 3.9649598107055426, 'border_count': 32, 'bagging_temperature': 0.20010137204099235, 'random_strength': 0.3864514312193919, 'grow_policy': 'SymmetricTree', 'min_data_in_leaf': 287}. Best is trial 54 with value: 1029.42640243851.[0m
[32m[I 2024-10-13 02:10:40,964][0m Trial 82 finished with value: 1177.452320264966 and parameters: {'depth': 14, 'learning_rate': 0.005660411559301149, 'iterations': 2708, 'l2_leaf_reg': 5.070206899798475, 'border_count': 20, 'bagging_temperature': 0.3398585148030804, 'random_strength': 1.7345802782599358, 'grow_policy': 'SymmetricTree', 'min_data_in_leaf': 310}. Best is trial 54 with value: 1029.42640243851.[0m
[32m[I 2024-10-13 02:10:55,952][0m Trial 83 finished with value: 1247.4797114497435 and parameters: {'depth': 11, 'learning_rate': 0.005149627838471699, 'iterations': 2798, 'l2_leaf_reg': 1.9997548237044154, 'border_count': 9, 'bagging_temperature': 0.24942497364673638, 'random_strength': 0.614866976839936, 'grow_policy': 'SymmetricTree', 'min_data_in_leaf': 169}. Best is trial 54 with value: 1029.42640243851.[0m
[32m[I 2024-10-13 02:12:34,665][0m Trial 84 finished with value: 1227.6047939847763 and parameters: {'depth': 13, 'learning_rate': 0.0029717199439936613, 'iterations': 2998, 'l2_leaf_reg': 1.1767706708705084, 'border_count': 39, 'bagging_temperature': 0.37660744446400185, 'random_strength': 1.3962148423038343, 'grow_policy': 'SymmetricTree', 'min_data_in_leaf': 247}. Best is trial 54 with value: 1029.42640243851.[0m
[32m[I 2024-10-13 02:13:25,640][0m Trial 85 finished with value: 1209.665651395307 and parameters: {'depth': 12, 'learning_rate': 0.001483569984358955, 'iterations': 2904, 'l2_leaf_reg': 2.995893358890621, 'border_count': 18, 'bagging_temperature': 0.27615303394187596, 'random_strength': 0.211920659639795, 'grow_policy': 'SymmetricTree', 'min_data_in_leaf': 332}. Best is trial 54 with value: 1029.42640243851.[0m
[32m[I 2024-10-13 02:13:33,798][0m Trial 86 finished with value: 1233.1782022299703 and parameters: {'depth': 4, 'learning_rate': 0.0335546349219026, 'iterations': 2369, 'l2_leaf_reg': 0.336637757612396, 'border_count': 29, 'bagging_temperature': 0.15806288205884297, 'random_strength': 4.300487659631238, 'grow_policy': 'SymmetricTree', 'min_data_in_leaf': 377}. Best is trial 54 with value: 1029.42640243851.[0m
[32m[I 2024-10-13 02:16:55,162][0m Trial 87 finished with value: 1233.2454206881266 and parameters: {'depth': 14, 'learning_rate': 0.004784740911197063, 'iterations': 2282, 'l2_leaf_reg': 5.3749114986232716, 'border_count': 57, 'bagging_temperature': 0.21097123379026145, 'random_strength': 0.8056808740670695, 'grow_policy': 'SymmetricTree', 'min_data_in_leaf': 135}. Best is trial 54 with value: 1029.42640243851.[0m
[32m[I 2024-10-13 02:17:04,520][0m Trial 88 finished with value: 1382.0393197986027 and parameters: {'depth': 4, 'learning_rate': 0.12251471424669969, 'iterations': 2675, 'l2_leaf_reg': 0.004663883438617804, 'border_count': 6, 'bagging_temperature': 0.47126072608794056, 'random_strength': 0.44726084358389273, 'grow_policy': 'SymmetricTree', 'min_data_in_leaf': 220}. Best is trial 54 with value: 1029.42640243851.[0m
[32m[I 2024-10-13 02:18:07,809][0m Trial 89 finished with value: 1237.1937097445589 and parameters: {'depth': 11, 'learning_rate': 0.01834977629505779, 'iterations': 2531, 'l2_leaf_reg': 0.8895790142631552, 'border_count': 68, 'bagging_temperature': 0.32462646655921107, 'random_strength': 1.1840749758468492, 'grow_policy': 'SymmetricTree', 'min_data_in_leaf': 66}. Best is trial 54 with value: 1029.42640243851.[0m
[32m[I 2024-10-13 02:18:18,886][0m Trial 90 finished with value: 1290.1838513347575 and parameters: {'depth': 5, 'learning_rate': 0.039844906211447366, 'iterations': 2760, 'l2_leaf_reg': 0.0587444407149493, 'border_count': 50, 'bagging_temperature': 0.4183466108757474, 'random_strength': 0.04812520996191565, 'grow_policy': 'SymmetricTree', 'min_data_in_leaf': 432}. Best is trial 54 with value: 1029.42640243851.[0m
[32m[I 2024-10-13 02:18:25,744][0m Trial 91 finished with value: 1078.914490259306 and parameters: {'depth': 5, 'learning_rate': 0.021819216904351967, 'iterations': 1797, 'l2_leaf_reg': 1.4695056056592064, 'border_count': 22, 'bagging_temperature': 0.37418402801053735, 'random_strength': 0.8054376670651983, 'grow_policy': 'SymmetricTree', 'min_data_in_leaf': 105}. Best is trial 54 with value: 1029.42640243851.[0m
[32m[I 2024-10-13 02:18:31,476][0m Trial 92 finished with value: 1118.7814642797014 and parameters: {'depth': 4, 'learning_rate': 0.023103653390757446, 'iterations': 1604, 'l2_leaf_reg': 1.5267635500172465, 'border_count': 23, 'bagging_temperature': 0.3538037866780734, 'random_strength': 0.9247753823737863, 'grow_policy': 'SymmetricTree', 'min_data_in_leaf': 100}. Best is trial 54 with value: 1029.42640243851.[0m
[32m[I 2024-10-13 02:18:37,015][0m Trial 93 finished with value: 1118.3633233205192 and parameters: {'depth': 4, 'learning_rate': 0.02325807790112584, 'iterations': 1475, 'l2_leaf_reg': 1.6750920932545519, 'border_count': 23, 'bagging_temperature': 0.3561760431282242, 'random_strength': 0.8972671741568927, 'grow_policy': 'SymmetricTree', 'min_data_in_leaf': 109}. Best is trial 54 with value: 1029.42640243851.[0m
[32m[I 2024-10-13 02:18:42,367][0m Trial 94 finished with value: 1149.8646813132111 and parameters: {'depth': 4, 'learning_rate': 0.02317520066053498, 'iterations': 1541, 'l2_leaf_reg': 0.25620020878951133, 'border_count': 14, 'bagging_temperature': 0.44971692403183905, 'random_strength': 0.9767495884789759, 'grow_policy': 'SymmetricTree', 'min_data_in_leaf': 105}. Best is trial 54 with value: 1029.42640243851.[0m
[32m[I 2024-10-13 02:18:47,250][0m Trial 95 finished with value: 1274.8897798351516 and parameters: {'depth': 3, 'learning_rate': 0.028499546182600442, 'iterations': 1469, 'l2_leaf_reg': 0.5146390016061735, 'border_count': 20, 'bagging_temperature': 0.35429717711577774, 'random_strength': 2.002889186236196, 'grow_policy': 'SymmetricTree', 'min_data_in_leaf': 46}. Best is trial 54 with value: 1029.42640243851.[0m
[32m[I 2024-10-13 02:18:49,200][0m Trial 96 finished with value: 1327.621633332962 and parameters: {'depth': 4, 'learning_rate': 0.046532605801374374, 'iterations': 1670, 'l2_leaf_reg': 1.6733908552575756, 'border_count': 185, 'bagging_temperature': 0.38790285876657427, 'random_strength': 1.604560404749714, 'grow_policy': 'Depthwise', 'min_data_in_leaf': 97}. Best is trial 54 with value: 1029.42640243851.[0m
[32m[I 2024-10-13 02:18:55,656][0m Trial 97 finished with value: 1342.3995265049089 and parameters: {'depth': 5, 'learning_rate': 0.016791780910344188, 'iterations': 1579, 'l2_leaf_reg': 0.1339370996146099, 'border_count': 38, 'bagging_temperature': 0.3578162922652487, 'random_strength': 2.601443047681517, 'grow_policy': 'SymmetricTree', 'min_data_in_leaf': 21}. Best is trial 54 with value: 1029.42640243851.[0m
[32m[I 2024-10-13 02:19:02,719][0m Trial 98 finished with value: 1186.5514160863315 and parameters: {'depth': 6, 'learning_rate': 0.03217506119670954, 'iterations': 1781, 'l2_leaf_reg': 0.7056995241871696, 'border_count': 23, 'bagging_temperature': 0.4140739899855739, 'random_strength': 1.3210567929339079, 'grow_policy': 'SymmetricTree', 'min_data_in_leaf': 148}. Best is trial 54 with value: 1029.42640243851.[0m
[32m[I 2024-10-13 02:19:07,151][0m Trial 99 finished with value: 1380.101145470312 and parameters: {'depth': 3, 'learning_rate': 0.02184898995898659, 'iterations': 1332, 'l2_leaf_reg': 0.014131666087178594, 'border_count': 7, 'bagging_temperature': 0.3068440532448689, 'random_strength': 0.7532354463687752, 'grow_policy': 'SymmetricTree', 'min_data_in_leaf': 64}. Best is trial 54 with value: 1029.42640243851.[0m
[32m[I 2024-10-13 02:19:09,065][0m Trial 100 finished with value: 1259.7205787746418 and parameters: {'depth': 4, 'learning_rate': 0.057268524060129986, 'iterations': 1904, 'l2_leaf_reg': 2.213180962727809, 'border_count': 43, 'bagging_temperature': 0.37966500365208694, 'random_strength': 0.9313662887622012, 'grow_policy': 'Lossguide', 'min_data_in_leaf': 108, 'max_leaves': 78}. Best is trial 54 with value: 1029.42640243851.[0m
[32m[I 2024-10-13 02:19:14,541][0m Trial 101 finished with value: 1183.3104282646284 and parameters: {'depth': 4, 'learning_rate': 0.024766040099124514, 'iterations': 1592, 'l2_leaf_reg': 0.36238209271347555, 'border_count': 15, 'bagging_temperature': 0.45120865574925617, 'random_strength': 1.0918501501171642, 'grow_policy': 'SymmetricTree', 'min_data_in_leaf': 185}. Best is trial 54 with value: 1029.42640243851.[0m
[32m[I 2024-10-13 02:19:21,043][0m Trial 102 finished with value: 1145.2846404072739 and parameters: {'depth': 5, 'learning_rate': 0.02218018756555454, 'iterations': 1727, 'l2_leaf_reg': 0.24799751635013084, 'border_count': 13, 'bagging_temperature': 0.4531189337809672, 'random_strength': 0.5936591307177785, 'grow_policy': 'SymmetricTree', 'min_data_in_leaf': 129}. Best is trial 54 with value: 1029.42640243851.[0m
