[32m[I 2024-10-13 02:35:56,811][0m Trial 206 finished with value: 1473.2389726820097 and parameters: {'depth': 8, 'learning_rate': 0.013904419793755039, 'iterations': 821, 'l2_leaf_reg': 0.0010406720314351818, 'border_count': 7, 'bagging_temperature': 0.9056551599290948, 'random_strength': 6.548693528180047, 'grow_policy': 'SymmetricTree', 'min_data_in_leaf': 249}. Best is trial 171 with value: 995.4334382975621.[0m
[32m[I 2024-10-13 02:36:02,637][0m Trial 207 finished with value: 2322.5361929364785 and parameters: {'depth': 8, 'learning_rate': 0.01710993477275795, 'iterations': 981, 'l2_leaf_reg': 0.0002595609248176104, 'border_count': 2, 'bagging_temperature': 0.2589121841539813, 'random_strength': 0.6022634140249221, 'grow_policy': 'SymmetricTree', 'min_data_in_leaf': 305}. Best is trial 171 with value: 995.4334382975621.[0m
[32m[I 2024-10-13 02:36:04,655][0m Trial 208 finished with value: 1315.4263622062224 and parameters: {'depth': 9, 'learning_rate': 0.011152726720731107, 'iterations': 997, 'l2_leaf_reg': 0.00038657219259607007, 'border_count': 214, 'bagging_temperature': 0.27057659236401405, 'random_strength': 0.35915247455351573, 'grow_policy': 'Depthwise', 'min_data_in_leaf': 261}. Best is trial 171 with value: 995.4334382975621.[0m
[32m[I 2024-10-13 02:36:13,890][0m Trial 209 finished with value: 1096.2095131420415 and parameters: {'depth': 8, 'learning_rate': 0.02090675605059713, 'iterations': 1106, 'l2_leaf_reg': 0.0005378055538916166, 'border_count': 22, 'bagging_temperature': 0.9242900377425072, 'random_strength': 0.8682730476445555, 'grow_policy': 'SymmetricTree', 'min_data_in_leaf': 144}. Best is trial 171 with value: 995.4334382975621.[0m
[32m[I 2024-10-13 02:36:22,609][0m Trial 210 finished with value: 1143.9780322299089 and parameters: {'depth': 8, 'learning_rate': 0.01354833129289881, 'iterations': 856, 'l2_leaf_reg': 0.0014806850346639538, 'border_count': 30, 'bagging_temperature': 0.24585320425957233, 'random_strength': 0.20767389139168213, 'grow_policy': 'SymmetricTree', 'min_data_in_leaf': 181}. Best is trial 171 with value: 995.4334382975621.[0m
[32m[I 2024-10-13 02:36:33,746][0m Trial 211 finished with value: 1073.5386789467384 and parameters: {'depth': 8, 'learning_rate': 0.009371050795011928, 'iterations': 1177, 'l2_leaf_reg': 0.004085954803502829, 'border_count': 15, 'bagging_temperature': 0.8783692299863616, 'random_strength': 0.22913742673132986, 'grow_policy': 'SymmetricTree', 'min_data_in_leaf': 226}. Best is trial 171 with value: 995.4334382975621.[0m
[32m[I 2024-10-13 02:36:42,156][0m Trial 212 finished with value: 1155.314386079655 and parameters: {'depth': 7, 'learning_rate': 0.007198655253373441, 'iterations': 943, 'l2_leaf_reg': 0.002565908296478767, 'border_count': 13, 'bagging_temperature': 0.954707302617339, 'random_strength': 0.48240605113790924, 'grow_policy': 'SymmetricTree', 'min_data_in_leaf': 192}. Best is trial 171 with value: 995.4334382975621.[0m
[32m[I 2024-10-13 02:36:51,243][0m Trial 213 finished with value: 1002.2201521782288 and parameters: {'depth': 7, 'learning_rate': 0.011815509096180234, 'iterations': 1042, 'l2_leaf_reg': 0.056963003137593844, 'border_count': 20, 'bagging_temperature': 0.903790175776922, 'random_strength': 0.22486828943603723, 'grow_policy': 'SymmetricTree', 'min_data_in_leaf': 222}. Best is trial 171 with value: 995.4334382975621.[0m
[32m[I 2024-10-13 02:37:00,002][0m Trial 214 finished with value: 1015.692416392678 and parameters: {'depth': 7, 'learning_rate': 0.011886258944987516, 'iterations': 1038, 'l2_leaf_reg': 0.03317155325707819, 'border_count': 21, 'bagging_temperature': 0.9048580068137445, 'random_strength': 0.17811689331185726, 'grow_policy': 'SymmetricTree', 'min_data_in_leaf': 234}. Best is trial 171 with value: 995.4334382975621.[0m
[32m[I 2024-10-13 02:37:08,040][0m Trial 215 finished with value: 1107.9179463891046 and parameters: {'depth': 7, 'learning_rate': 0.01574019220867813, 'iterations': 994, 'l2_leaf_reg': 0.035246987984446844, 'border_count': 21, 'bagging_temperature': 0.9182821419323784, 'random_strength': 0.5866640195181236, 'grow_policy': 'SymmetricTree', 'min_data_in_leaf': 236}. Best is trial 171 with value: 995.4334382975621.[0m
[32m[I 2024-10-13 02:37:16,845][0m Trial 216 finished with value: 1172.9949796113865 and parameters: {'depth': 7, 'learning_rate': 0.01217295128836928, 'iterations': 1037, 'l2_leaf_reg': 0.06665914982103463, 'border_count': 26, 'bagging_temperature': 0.27626246512134667, 'random_strength': 0.020307198751616407, 'grow_policy': 'SymmetricTree', 'min_data_in_leaf': 281}. Best is trial 171 with value: 995.4334382975621.[0m
[32m[I 2024-10-13 02:37:26,327][0m Trial 217 finished with value: 1032.0104770112728 and parameters: {'depth': 7, 'learning_rate': 0.01412059294352163, 'iterations': 1060, 'l2_leaf_reg': 0.0533587797111151, 'border_count': 20, 'bagging_temperature': 0.9735886806643462, 'random_strength': 0.001913577015747181, 'grow_policy': 'SymmetricTree', 'min_data_in_leaf': 257}. Best is trial 171 with value: 995.4334382975621.[0m
[32m[I 2024-10-13 02:37:37,593][0m Trial 218 finished with value: 1106.2965538177102 and parameters: {'depth': 8, 'learning_rate': 0.018026422893378354, 'iterations': 1139, 'l2_leaf_reg': 0.04213212519907757, 'border_count': 24, 'bagging_temperature': 0.9658689081512333, 'random_strength': 0.3776573197576335, 'grow_policy': 'SymmetricTree', 'min_data_in_leaf': 258}. Best is trial 171 with value: 995.4334382975621.[0m
[32m[I 2024-10-13 02:37:39,452][0m Trial 219 finished with value: 1305.22613267068 and parameters: {'depth': 7, 'learning_rate': 0.01626874774407942, 'iterations': 1044, 'l2_leaf_reg': 0.055828689303672664, 'border_count': 132, 'bagging_temperature': 0.9363417065891997, 'random_strength': 0.21280441935612565, 'grow_policy': 'Lossguide', 'min_data_in_leaf': 242, 'max_leaves': 234}. Best is trial 171 with value: 995.4334382975621.[0m
[32m[I 2024-10-13 02:37:49,360][0m Trial 220 finished with value: 1253.0007923755843 and parameters: {'depth': 7, 'learning_rate': 0.014666205728598223, 'iterations': 1092, 'l2_leaf_reg': 0.10526560541406148, 'border_count': 32, 'bagging_temperature': 0.9650102051257001, 'random_strength': 0.7302390425869173, 'grow_policy': 'SymmetricTree', 'min_data_in_leaf': 268}. Best is trial 171 with value: 995.4334382975621.[0m
[32m[I 2024-10-13 02:38:00,867][0m Trial 221 finished with value: 1008.0296865441039 and parameters: {'depth': 9, 'learning_rate': 0.011996701402029216, 'iterations': 923, 'l2_leaf_reg': 0.02266867999220381, 'border_count': 19, 'bagging_temperature': 0.9006371852133713, 'random_strength': 0.020680336742954115, 'grow_policy': 'SymmetricTree', 'min_data_in_leaf': 224}. Best is trial 171 with value: 995.4334382975621.[0m
[32m[I 2024-10-13 02:38:12,249][0m Trial 222 finished with value: 1057.345781393474 and parameters: {'depth': 9, 'learning_rate': 0.011622308247404517, 'iterations': 925, 'l2_leaf_reg': 0.024558257061375533, 'border_count': 20, 'bagging_temperature': 0.9194066055148093, 'random_strength': 0.19024894689949184, 'grow_policy': 'SymmetricTree', 'min_data_in_leaf': 295}. Best is trial 171 with value: 995.4334382975621.[0m
[32m[I 2024-10-13 02:38:22,408][0m Trial 223 finished with value: 1075.2936040467732 and parameters: {'depth': 9, 'learning_rate': 0.011076420361314314, 'iterations': 921, 'l2_leaf_reg': 0.030328790996521516, 'border_count': 22, 'bagging_temperature': 0.9102346700291571, 'random_strength': 0.44171476418256084, 'grow_policy': 'SymmetricTree', 'min_data_in_leaf': 301}. Best is trial 171 with value: 995.4334382975621.[0m
[32m[I 2024-10-13 02:38:33,114][0m Trial 224 finished with value: 1199.3359066594912 and parameters: {'depth': 9, 'learning_rate': 0.010876399454326726, 'iterations': 805, 'l2_leaf_reg': 0.020633658684264287, 'border_count': 29, 'bagging_temperature': 0.937683913868443, 'random_strength': 0.22017523491364088, 'grow_policy': 'SymmetricTree', 'min_data_in_leaf': 254}. Best is trial 171 with value: 995.4334382975621.[0m
[32m[I 2024-10-13 02:38:43,425][0m Trial 225 finished with value: 1061.3580517576556 and parameters: {'depth': 9, 'learning_rate': 0.013018330741313044, 'iterations': 989, 'l2_leaf_reg': 0.023152031795025278, 'border_count': 20, 'bagging_temperature': 0.18776034719063506, 'random_strength': 0.3710951386876843, 'grow_policy': 'SymmetricTree', 'min_data_in_leaf': 226}. Best is trial 171 with value: 995.4334382975621.[0m
[32m[I 2024-10-13 02:38:54,298][0m Trial 226 finished with value: 1094.96491949767 and parameters: {'depth': 10, 'learning_rate': 0.01276081478849801, 'iterations': 876, 'l2_leaf_reg': 0.01925657208249462, 'border_count': 21, 'bagging_temperature': 0.1828617264396423, 'random_strength': 0.479011979633366, 'grow_policy': 'SymmetricTree', 'min_data_in_leaf': 290}. Best is trial 171 with value: 995.4334382975621.[0m
[32m[I 2024-10-13 02:39:05,584][0m Trial 227 finished with value: 1240.8546677458557 and parameters: {'depth': 9, 'learning_rate': 0.010565423190037539, 'iterations': 958, 'l2_leaf_reg': 0.03035548122437051, 'border_count': 26, 'bagging_temperature': 0.19432596242005723, 'random_strength': 0.5981673480075849, 'grow_policy': 'SymmetricTree', 'min_data_in_leaf': 220}. Best is trial 171 with value: 995.4334382975621.[0m
[32m[I 2024-10-13 02:39:17,257][0m Trial 228 finished with value: 1237.965910557909 and parameters: {'depth': 9, 'learning_rate': 0.012712452796714032, 'iterations': 1014, 'l2_leaf_reg': 0.08334999186125375, 'border_count': 10, 'bagging_temperature': 0.9795511584134479, 'random_strength': 0.308119554854319, 'grow_policy': 'SymmetricTree', 'min_data_in_leaf': 241}. Best is trial 171 with value: 995.4334382975621.[0m
[32m[I 2024-10-13 02:39:28,261][0m Trial 229 finished with value: 1149.0287772862969 and parameters: {'depth': 7, 'learning_rate': 0.019221361893821173, 'iterations': 1062, 'l2_leaf_reg': 0.06542928354586017, 'border_count': 20, 'bagging_temperature': 0.1468927934519501, 'random_strength': 0.9048817345774546, 'grow_policy': 'SymmetricTree', 'min_data_in_leaf': 281}. Best is trial 171 with value: 995.4334382975621.[0m
[32m[I 2024-10-13 02:39:37,478][0m Trial 230 finished with value: 1187.395299528879 and parameters: {'depth': 9, 'learning_rate': 0.013812268092969612, 'iterations': 922, 'l2_leaf_reg': 0.04535573144748692, 'border_count': 29, 'bagging_temperature': 0.22255318683774913, 'random_strength': 0.19477667626093217, 'grow_policy': 'SymmetricTree', 'min_data_in_leaf': 324}. Best is trial 171 with value: 995.4334382975621.[0m
[32m[I 2024-10-13 02:39:45,381][0m Trial 231 finished with value: 1038.8979701140668 and parameters: {'depth': 8, 'learning_rate': 0.016673424056133486, 'iterations': 869, 'l2_leaf_reg': 0.024263085098094873, 'border_count': 19, 'bagging_temperature': 0.2968772254905445, 'random_strength': 0.1691983980237206, 'grow_policy': 'SymmetricTree', 'min_data_in_leaf': 235}. Best is trial 171 with value: 995.4334382975621.[0m
[32m[I 2024-10-13 02:39:54,094][0m Trial 232 finished with value: 1060.5049620962855 and parameters: {'depth': 10, 'learning_rate': 0.01744895983450894, 'iterations': 860, 'l2_leaf_reg': 0.028285832732340085, 'border_count': 20, 'bagging_temperature': 0.3081467957338567, 'random_strength': 0.39081347661909743, 'grow_policy': 'SymmetricTree', 'min_data_in_leaf': 228}. Best is trial 171 with value: 995.4334382975621.[0m
[32m[I 2024-10-13 02:40:04,186][0m Trial 233 finished with value: 1113.9109333965382 and parameters: {'depth': 10, 'learning_rate': 0.022959380282950713, 'iterations': 847, 'l2_leaf_reg': 0.016369200342552667, 'border_count': 24, 'bagging_temperature': 0.9272106043352852, 'random_strength': 0.462714370564976, 'grow_policy': 'SymmetricTree', 'min_data_in_leaf': 223}. Best is trial 171 with value: 995.4334382975621.[0m
[32m[I 2024-10-13 02:40:11,192][0m Trial 234 finished with value: 1034.3531182800366 and parameters: {'depth': 9, 'learning_rate': 0.0171395331904997, 'iterations': 653, 'l2_leaf_reg': 0.02843648577851799, 'border_count': 21, 'bagging_temperature': 0.3280104072509413, 'random_strength': 0.17539499544173595, 'grow_policy': 'SymmetricTree', 'min_data_in_leaf': 225}. Best is trial 171 with value: 995.4334382975621.[0m
[32m[I 2024-10-13 02:40:13,766][0m Trial 235 finished with value: 1192.5839482503388 and parameters: {'depth': 9, 'learning_rate': 0.016750771613577922, 'iterations': 446, 'l2_leaf_reg': 0.029444137933569762, 'border_count': 19, 'bagging_temperature': 0.2887362376009306, 'random_strength': 0.17381074290957657, 'grow_policy': 'SymmetricTree', 'min_data_in_leaf': 232}. Best is trial 171 with value: 995.4334382975621.[0m
[32m[I 2024-10-13 02:40:24,214][0m Trial 236 finished with value: 1230.8318377272756 and parameters: {'depth': 10, 'learning_rate': 0.011202850768903464, 'iterations': 745, 'l2_leaf_reg': 0.045505722365722354, 'border_count': 26, 'bagging_temperature': 0.30426189388459085, 'random_strength': 0.17889417048402917, 'grow_policy': 'SymmetricTree', 'min_data_in_leaf': 203}. Best is trial 171 with value: 995.4334382975621.[0m
[32m[I 2024-10-13 02:40:36,587][0m Trial 237 finished with value: 1239.6409550842902 and parameters: {'depth': 10, 'learning_rate': 0.017765630923029026, 'iterations': 520, 'l2_leaf_reg': 0.02407298619717232, 'border_count': 33, 'bagging_temperature': 0.317284095739485, 'random_strength': 0.0105372602943745, 'grow_policy': 'SymmetricTree', 'min_data_in_leaf': 225}. Best is trial 171 with value: 995.4334382975621.[0m
[32m[I 2024-10-13 02:40:38,258][0m Trial 238 finished with value: 1178.8240632323216 and parameters: {'depth': 9, 'learning_rate': 0.01429130836240704, 'iterations': 258, 'l2_leaf_reg': 0.015172405443633439, 'border_count': 20, 'bagging_temperature': 0.956298121709161, 'random_strength': 0.6583690340518279, 'grow_policy': 'SymmetricTree', 'min_data_in_leaf': 258}. Best is trial 171 with value: 995.4334382975621.[0m
[32m[I 2024-10-13 02:40:47,024][0m Trial 239 finished with value: 1215.5797603922674 and parameters: {'depth': 9, 'learning_rate': 0.010042677064159483, 'iterations': 898, 'l2_leaf_reg': 0.02616127254351108, 'border_count': 12, 'bagging_temperature': 0.32068064951045067, 'random_strength': 0.36516240062476657, 'grow_policy': 'SymmetricTree', 'min_data_in_leaf': 269}. Best is trial 171 with value: 995.4334382975621.[0m
[32m[I 2024-10-13 02:40:55,797][0m Trial 240 finished with value: 1050.6320170374845 and parameters: {'depth': 11, 'learning_rate': 0.02063583010848402, 'iterations': 642, 'l2_leaf_reg': 0.04440752231271531, 'border_count': 19, 'bagging_temperature': 0.3007254214968202, 'random_strength': 0.1914742299901095, 'grow_policy': 'SymmetricTree', 'min_data_in_leaf': 204}. Best is trial 171 with value: 995.4334382975621.[0m
[32m[I 2024-10-13 02:41:01,516][0m Trial 241 finished with value: 1138.5845205476023 and parameters: {'depth': 8, 'learning_rate': 0.021479828365054337, 'iterations': 641, 'l2_leaf_reg': 0.04249030185575965, 'border_count': 18, 'bagging_temperature': 0.29398454393255535, 'random_strength': 0.16918614014059818, 'grow_policy': 'SymmetricTree', 'min_data_in_leaf': 212}. Best is trial 171 with value: 995.4334382975621.[0m
[32m[I 2024-10-13 02:41:16,193][0m Trial 242 finished with value: 998.6025782635279 and parameters: {'depth': 11, 'learning_rate': 0.01667355018353986, 'iterations': 712, 'l2_leaf_reg': 0.06202816015364999, 'border_count': 23, 'bagging_temperature': 0.30210881765556136, 'random_strength': 0.003005323201534099, 'grow_policy': 'SymmetricTree', 'min_data_in_leaf': 232}. Best is trial 171 with value: 995.4334382975621.[0m
[32m[I 2024-10-13 02:41:29,011][0m Trial 243 finished with value: 1162.4541947549071 and parameters: {'depth': 11, 'learning_rate': 0.015620389312571837, 'iterations': 683, 'l2_leaf_reg': 0.05628793757679712, 'border_count': 26, 'bagging_temperature': 0.3275618349824172, 'random_strength': 0.00977145764880159, 'grow_policy': 'SymmetricTree', 'min_data_in_leaf': 237}. Best is trial 171 with value: 995.4334382975621.[0m
[32m[I 2024-10-13 02:41:42,446][0m Trial 244 finished with value: 1061.2072652455854 and parameters: {'depth': 11, 'learning_rate': 0.01217291913584989, 'iterations': 806, 'l2_leaf_reg': 0.012162833384647987, 'border_count': 18, 'bagging_temperature': 0.30743435130137453, 'random_strength': 0.22518900029807762, 'grow_policy': 'SymmetricTree', 'min_data_in_leaf': 208}. Best is trial 171 with value: 995.4334382975621.[0m
[32m[I 2024-10-13 02:41:50,188][0m Trial 245 finished with value: 1200.1854557010583 and parameters: {'depth': 10, 'learning_rate': 0.01220088817004102, 'iterations': 680, 'l2_leaf_reg': 0.01183729106539476, 'border_count': 12, 'bagging_temperature': 0.30290988630623067, 'random_strength': 0.1959176998222717, 'grow_policy': 'SymmetricTree', 'min_data_in_leaf': 210}. Best is trial 171 with value: 995.4334382975621.[0m
[32m[I 2024-10-13 02:42:04,001][0m Trial 246 finished with value: 1088.6713473149273 and parameters: {'depth': 12, 'learning_rate': 0.013739119720762933, 'iterations': 792, 'l2_leaf_reg': 0.02326028070041394, 'border_count': 18, 'bagging_temperature': 0.34018792907999695, 'random_strength': 0.32243368850867943, 'grow_policy': 'SymmetricTree', 'min_data_in_leaf': 243}. Best is trial 171 with value: 995.4334382975621.[0m
[32m[I 2024-10-13 02:42:17,417][0m Trial 247 finished with value: 1091.9509655738946 and parameters: {'depth': 11, 'learning_rate': 0.011738899720039164, 'iterations': 702, 'l2_leaf_reg': 0.012169669630004373, 'border_count': 24, 'bagging_temperature': 0.3146184826867818, 'random_strength': 0.17527479025053483, 'grow_policy': 'SymmetricTree', 'min_data_in_leaf': 222}. Best is trial 171 with value: 995.4334382975621.[0m
[32m[I 2024-10-13 02:42:32,980][0m Trial 248 finished with value: 1178.898683533255 and parameters: {'depth': 11, 'learning_rate': 0.010035126920013111, 'iterations': 847, 'l2_leaf_reg': 0.0345522376994515, 'border_count': 9, 'bagging_temperature': 0.9126184065684828, 'random_strength': 0.003993263499447786, 'grow_policy': 'SymmetricTree', 'min_data_in_leaf': 198}. Best is trial 171 with value: 995.4334382975621.[0m
[32m[I 2024-10-13 02:42:46,684][0m Trial 249 finished with value: 1077.5819963893528 and parameters: {'depth': 11, 'learning_rate': 0.014308851774286346, 'iterations': 956, 'l2_leaf_reg': 0.06792735958739322, 'border_count': 16, 'bagging_temperature': 0.9480515872092371, 'random_strength': 0.314486735212239, 'grow_policy': 'SymmetricTree', 'min_data_in_leaf': 228}. Best is trial 171 with value: 995.4334382975621.[0m
[32m[I 2024-10-13 02:42:48,368][0m Trial 250 finished with value: 1218.7114521804456 and parameters: {'depth': 11, 'learning_rate': 0.016522936309699126, 'iterations': 883, 'l2_leaf_reg': 0.014493736442170484, 'border_count': 31, 'bagging_temperature': 0.9031038129537718, 'random_strength': 0.17244519364079344, 'grow_policy': 'Depthwise', 'min_data_in_leaf': 265}. Best is trial 171 with value: 995.4334382975621.[0m
[32m[I 2024-10-13 02:42:59,941][0m Trial 251 finished with value: 1344.8805616093027 and parameters: {'depth': 9, 'learning_rate': 0.011962188327628688, 'iterations': 602, 'l2_leaf_reg': 0.02889058957418401, 'border_count': 175, 'bagging_temperature': 0.8740856416783207, 'random_strength': 3.159817688874072, 'grow_policy': 'SymmetricTree', 'min_data_in_leaf': 245}. Best is trial 171 with value: 995.4334382975621.[0m
[32m[I 2024-10-13 02:43:13,861][0m Trial 252 finished with value: 1236.9489307065887 and parameters: {'depth': 11, 'learning_rate': 0.008904271685387148, 'iterations': 550, 'l2_leaf_reg': 0.0094475518069804, 'border_count': 26, 'bagging_temperature': 0.92856851068589, 'random_strength': 0.391994726127607, 'grow_policy': 'SymmetricTree', 'min_data_in_leaf': 203}. Best is trial 171 with value: 995.4334382975621.[0m
[32m[I 2024-10-13 02:43:21,383][0m Trial 253 finished with value: 1010.5684800325198 and parameters: {'depth': 8, 'learning_rate': 0.014387758123453883, 'iterations': 1217, 'l2_leaf_reg': 0.019984528251238455, 'border_count': 19, 'bagging_temperature': 0.2870957186328908, 'random_strength': 0.019412189897248532, 'grow_policy': 'SymmetricTree', 'min_data_in_leaf': 218}. Best is trial 171 with value: 995.4334382975621.[0m
[32m[I 2024-10-13 02:43:28,317][0m Trial 254 finished with value: 1046.5620896768726 and parameters: {'depth': 8, 'learning_rate': 0.01748415046791349, 'iterations': 1221, 'l2_leaf_reg': 0.019270450936483916, 'border_count': 14, 'bagging_temperature': 0.27823897171498674, 'random_strength': 0.01471725442360449, 'grow_policy': 'SymmetricTree', 'min_data_in_leaf': 194}. Best is trial 171 with value: 995.4334382975621.[0m
[32m[I 2024-10-13 02:43:34,682][0m Trial 255 finished with value: 1316.2288999511056 and parameters: {'depth': 8, 'learning_rate': 0.02005548867842901, 'iterations': 1231, 'l2_leaf_reg': 0.045282319458728244, 'border_count': 7, 'bagging_temperature': 0.27042221209989775, 'random_strength': 0.12653880221078143, 'grow_policy': 'SymmetricTree', 'min_data_in_leaf': 195}. Best is trial 171 with value: 995.4334382975621.[0m
[32m[I 2024-10-13 02:43:41,015][0m Trial 256 finished with value: 1076.8380355925708 and parameters: {'depth': 8, 'learning_rate': 0.025645585900609644, 'iterations': 1153, 'l2_leaf_reg': 0.01987424659840209, 'border_count': 13, 'bagging_temperature': 0.2863842508503836, 'random_strength': 0.01444468356855394, 'grow_policy': 'SymmetricTree', 'min_data_in_leaf': 250}. Best is trial 171 with value: 995.4334382975621.[0m
