[32m[I 2024-10-13 02:19:28,158][0m Trial 103 finished with value: 1096.3767965920122 and parameters: {'depth': 5, 'learning_rate': 0.04231618110317074, 'iterations': 1712, 'l2_leaf_reg': 1.0995402392563178, 'border_count': 26, 'bagging_temperature': 0.4828207579024306, 'random_strength': 0.6436911259423862, 'grow_policy': 'SymmetricTree', 'min_data_in_leaf': 117}. Best is trial 54 with value: 1029.42640243851.[0m
[32m[I 2024-10-13 02:19:34,221][0m Trial 104 finished with value: 2355.6088842231516 and parameters: {'depth': 5, 'learning_rate': 0.016304459164555814, 'iterations': 1732, 'l2_leaf_reg': 0.12502362852789076, 'border_count': 2, 'bagging_temperature': 0.5510419402230641, 'random_strength': 0.22974071080593206, 'grow_policy': 'SymmetricTree', 'min_data_in_leaf': 119}. Best is trial 54 with value: 1029.42640243851.[0m
[32m[I 2024-10-13 02:19:40,802][0m Trial 105 finished with value: 1268.66480057473 and parameters: {'depth': 6, 'learning_rate': 0.01258474248919678, 'iterations': 1832, 'l2_leaf_reg': 0.5810994199644746, 'border_count': 12, 'bagging_temperature': 0.49267662405649826, 'random_strength': 0.6007778833599603, 'grow_policy': 'SymmetricTree', 'min_data_in_leaf': 138}. Best is trial 54 with value: 1029.42640243851.[0m
[32m[I 2024-10-13 02:19:45,985][0m Trial 106 finished with value: 1143.811638281368 and parameters: {'depth': 5, 'learning_rate': 0.020597014891370582, 'iterations': 1399, 'l2_leaf_reg': 0.04822602661597432, 'border_count': 24, 'bagging_temperature': 0.43762909804822103, 'random_strength': 0.6736761796369254, 'grow_policy': 'SymmetricTree', 'min_data_in_leaf': 25}. Best is trial 54 with value: 1029.42640243851.[0m
[32m[I 2024-10-13 02:19:51,224][0m Trial 107 finished with value: 1372.8128131366684 and parameters: {'depth': 4, 'learning_rate': 0.010602276101814627, 'iterations': 1441, 'l2_leaf_reg': 0.02347052713540477, 'border_count': 35, 'bagging_temperature': 0.427701235374136, 'random_strength': 0.21698483784638428, 'grow_policy': 'SymmetricTree', 'min_data_in_leaf': 84}. Best is trial 54 with value: 1029.42640243851.[0m
[32m[I 2024-10-13 02:19:56,616][0m Trial 108 finished with value: 1190.1522950224223 and parameters: {'depth': 6, 'learning_rate': 0.04363730519945429, 'iterations': 1234, 'l2_leaf_reg': 0.04329959144553667, 'border_count': 25, 'bagging_temperature': 0.46779291650884297, 'random_strength': 0.8233016511718286, 'grow_policy': 'SymmetricTree', 'min_data_in_leaf': 24}. Best is trial 54 with value: 1029.42640243851.[0m
[32m[I 2024-10-13 02:20:02,275][0m Trial 109 finished with value: 1336.0494486673492 and parameters: {'depth': 4, 'learning_rate': 0.02725986874154711, 'iterations': 1497, 'l2_leaf_reg': 0.08778280543989099, 'border_count': 247, 'bagging_temperature': 0.40295466638825067, 'random_strength': 0.024018389092910652, 'grow_policy': 'SymmetricTree', 'min_data_in_leaf': 57}. Best is trial 54 with value: 1029.42640243851.[0m
[32m[I 2024-10-13 02:20:07,974][0m Trial 110 finished with value: 1173.01355923022 and parameters: {'depth': 5, 'learning_rate': 0.09931499930711642, 'iterations': 1371, 'l2_leaf_reg': 1.5659159779868859, 'border_count': 28, 'bagging_temperature': 0.5169867974769122, 'random_strength': 1.4417144884228956, 'grow_policy': 'SymmetricTree', 'min_data_in_leaf': 36}. Best is trial 54 with value: 1029.42640243851.[0m
[32m[I 2024-10-13 02:20:14,537][0m Trial 111 finished with value: 1107.4046718025409 and parameters: {'depth': 5, 'learning_rate': 0.020625685692088714, 'iterations': 1662, 'l2_leaf_reg': 0.22213793859320505, 'border_count': 20, 'bagging_temperature': 0.4349660596112741, 'random_strength': 0.6135543619495736, 'grow_policy': 'SymmetricTree', 'min_data_in_leaf': 87}. Best is trial 54 with value: 1029.42640243851.[0m
[32m[I 2024-10-13 02:20:23,386][0m Trial 112 finished with value: 1062.3001127038187 and parameters: {'depth': 6, 'learning_rate': 0.019393187682451362, 'iterations': 1981, 'l2_leaf_reg': 0.9938385436857794, 'border_count': 21, 'bagging_temperature': 0.3332510313622348, 'random_strength': 0.4814494203581268, 'grow_policy': 'SymmetricTree', 'min_data_in_leaf': 88}. Best is trial 54 with value: 1029.42640243851.[0m
[32m[I 2024-10-13 02:20:30,266][0m Trial 113 finished with value: 1182.5298647778584 and parameters: {'depth': 4, 'learning_rate': 0.07190183741747194, 'iterations': 2043, 'l2_leaf_reg': 0.8987256442150817, 'border_count': 19, 'bagging_temperature': 0.3363171440347081, 'random_strength': 0.47805118616041287, 'grow_policy': 'SymmetricTree', 'min_data_in_leaf': 178}. Best is trial 54 with value: 1029.42640243851.[0m
[32m[I 2024-10-13 02:20:38,003][0m Trial 114 finished with value: 1379.0245399926644 and parameters: {'depth': 6, 'learning_rate': 0.014146962757929205, 'iterations': 2121, 'l2_leaf_reg': 2.8095899439195584, 'border_count': 7, 'bagging_temperature': 0.3658743539148238, 'random_strength': 1.2152009805062574, 'grow_policy': 'SymmetricTree', 'min_data_in_leaf': 81}. Best is trial 54 with value: 1029.42640243851.[0m
[32m[I 2024-10-13 02:20:45,001][0m Trial 115 finished with value: 4417.838981021485 and parameters: {'depth': 5, 'learning_rate': 0.0001004062636072423, 'iterations': 1618, 'l2_leaf_reg': 5.75062417364625e-06, 'border_count': 32, 'bagging_temperature': 0.39605268546274497, 'random_strength': 0.29399543316354027, 'grow_policy': 'SymmetricTree', 'min_data_in_leaf': 114}. Best is trial 54 with value: 1029.42640243851.[0m
[32m[I 2024-10-13 02:20:47,997][0m Trial 116 finished with value: 1283.9899069130572 and parameters: {'depth': 3, 'learning_rate': 0.03334590606151879, 'iterations': 1982, 'l2_leaf_reg': 0.5026561130318393, 'border_count': 152, 'bagging_temperature': 0.32728533044040786, 'random_strength': 0.9792555653781436, 'grow_policy': 'Depthwise', 'min_data_in_leaf': 4}. Best is trial 54 with value: 1029.42640243851.[0m
[32m[I 2024-10-13 02:20:55,306][0m Trial 117 finished with value: 1298.9685290100408 and parameters: {'depth': 5, 'learning_rate': 0.008929404525197665, 'iterations': 1791, 'l2_leaf_reg': 1.2218868691993183, 'border_count': 41, 'bagging_temperature': 0.37880727378280277, 'random_strength': 0.7892006824231955, 'grow_policy': 'SymmetricTree', 'min_data_in_leaf': 94}. Best is trial 54 with value: 1029.42640243851.[0m
[32m[I 2024-10-13 02:21:01,190][0m Trial 118 finished with value: 1107.3000071418917 and parameters: {'depth': 4, 'learning_rate': 0.016343664358445788, 'iterations': 1618, 'l2_leaf_reg': 0.17956807988855375, 'border_count': 21, 'bagging_temperature': 0.35586908321427946, 'random_strength': 0.5382970803188089, 'grow_policy': 'SymmetricTree', 'min_data_in_leaf': 157}. Best is trial 54 with value: 1029.42640243851.[0m
[32m[I 2024-10-13 02:21:06,458][0m Trial 119 finished with value: 1061.99955275472 and parameters: {'depth': 5, 'learning_rate': 0.017731509448571162, 'iterations': 1520, 'l2_leaf_reg': 0.180939779711738, 'border_count': 21, 'bagging_temperature': 0.2348479436764317, 'random_strength': 0.5740736535184641, 'grow_policy': 'SymmetricTree', 'min_data_in_leaf': 157}. Best is trial 54 with value: 1029.42640243851.[0m
[32m[I 2024-10-13 02:21:08,211][0m Trial 120 finished with value: 1234.2126626481063 and parameters: {'depth': 6, 'learning_rate': 0.0161851164921238, 'iterations': 1668, 'l2_leaf_reg': 0.16932889160831316, 'border_count': 48, 'bagging_temperature': 0.22796977270080362, 'random_strength': 0.4938775273051452, 'grow_policy': 'Lossguide', 'min_data_in_leaf': 157, 'max_leaves': 208}. Best is trial 54 with value: 1029.42640243851.[0m
[32m[I 2024-10-13 02:21:14,110][0m Trial 121 finished with value: 1061.4062108961969 and parameters: {'depth': 5, 'learning_rate': 0.01928369490702204, 'iterations': 1527, 'l2_leaf_reg': 0.3700754432041772, 'border_count': 21, 'bagging_temperature': 0.291947707617539, 'random_strength': 1.086388241147441, 'grow_policy': 'SymmetricTree', 'min_data_in_leaf': 177}. Best is trial 54 with value: 1029.42640243851.[0m
[32m[I 2024-10-13 02:21:19,882][0m Trial 122 finished with value: 1146.05707717857 and parameters: {'depth': 5, 'learning_rate': 0.012025359451816453, 'iterations': 1541, 'l2_leaf_reg': 0.433011571637599, 'border_count': 15, 'bagging_temperature': 0.24639583129476816, 'random_strength': 1.3002253222995026, 'grow_policy': 'SymmetricTree', 'min_data_in_leaf': 180}. Best is trial 54 with value: 1029.42640243851.[0m
[32m[I 2024-10-13 02:21:26,503][0m Trial 123 finished with value: 1072.5338238494917 and parameters: {'depth': 5, 'learning_rate': 0.018388011026365374, 'iterations': 1678, 'l2_leaf_reg': 0.22531668876142483, 'border_count': 30, 'bagging_temperature': 0.9995772865931271, 'random_strength': 0.31637622302681434, 'grow_policy': 'SymmetricTree', 'min_data_in_leaf': 203}. Best is trial 54 with value: 1029.42640243851.[0m
[32m[I 2024-10-13 02:21:33,337][0m Trial 124 finished with value: 1164.8257064818483 and parameters: {'depth': 5, 'learning_rate': 0.01844392718620933, 'iterations': 1702, 'l2_leaf_reg': 0.21693793158068514, 'border_count': 29, 'bagging_temperature': 0.9898634592598574, 'random_strength': 0.260623928994565, 'grow_policy': 'SymmetricTree', 'min_data_in_leaf': 197}. Best is trial 54 with value: 1029.42640243851.[0m
[32m[I 2024-10-13 02:21:42,132][0m Trial 125 finished with value: 1234.9852372600844 and parameters: {'depth': 6, 'learning_rate': 0.013744365975480675, 'iterations': 1903, 'l2_leaf_reg': 0.08519671187813542, 'border_count': 35, 'bagging_temperature': 0.29928671114239574, 'random_strength': 0.011348578144140031, 'grow_policy': 'SymmetricTree', 'min_data_in_leaf': 204}. Best is trial 54 with value: 1029.42640243851.[0m
[32m[I 2024-10-13 02:21:49,085][0m Trial 126 finished with value: 1243.8012361317762 and parameters: {'depth': 5, 'learning_rate': 0.009909514697814788, 'iterations': 1838, 'l2_leaf_reg': 0.30601139116330656, 'border_count': 9, 'bagging_temperature': 0.2894840397551379, 'random_strength': 0.6263194361501979, 'grow_policy': 'SymmetricTree', 'min_data_in_leaf': 159}. Best is trial 54 with value: 1029.42640243851.[0m
[32m[I 2024-10-13 02:21:55,586][0m Trial 127 finished with value: 1155.5594928299508 and parameters: {'depth': 5, 'learning_rate': 0.01795479722793643, 'iterations': 1640, 'l2_leaf_reg': 0.10582307703633649, 'border_count': 18, 'bagging_temperature': 0.31362438205666415, 'random_strength': 0.4011625918098063, 'grow_policy': 'SymmetricTree', 'min_data_in_leaf': 265}. Best is trial 54 with value: 1029.42640243851.[0m
[32m[I 2024-10-13 02:22:01,358][0m Trial 128 finished with value: 2836.3570552713295 and parameters: {'depth': 6, 'learning_rate': 0.028040604918969918, 'iterations': 1755, 'l2_leaf_reg': 0.8289292070200778, 'border_count': 1, 'bagging_temperature': 0.28079310615835684, 'random_strength': 1.1234240521480516, 'grow_policy': 'SymmetricTree', 'min_data_in_leaf': 242}. Best is trial 54 with value: 1029.42640243851.[0m
[32m[I 2024-10-13 02:22:20,194][0m Trial 129 finished with value: 1390.0404608204806 and parameters: {'depth': 5, 'learning_rate': 0.015439242347314494, 'iterations': 1960, 'l2_leaf_reg': 0.17566596989837482, 'border_count': 38, 'bagging_temperature': 0.12919741528984358, 'random_strength': 0.2081385502886895, 'grow_policy': 'SymmetricTree', 'min_data_in_leaf': 979}. Best is trial 54 with value: 1029.42640243851.[0m
[32m[I 2024-10-13 02:22:39,547][0m Trial 130 finished with value: 1226.9394753391548 and parameters: {'depth': 6, 'learning_rate': 0.006738880675749702, 'iterations': 2081, 'l2_leaf_reg': 0.40690805915663, 'border_count': 27, 'bagging_temperature': 0.8407885569852919, 'random_strength': 0.5798643853501673, 'grow_policy': 'SymmetricTree', 'min_data_in_leaf': 216}. Best is trial 54 with value: 1029.42640243851.[0m
[32m[I 2024-10-13 02:22:52,585][0m Trial 131 finished with value: 1112.6348703856693 and parameters: {'depth': 5, 'learning_rate': 0.021133930646830938, 'iterations': 1524, 'l2_leaf_reg': 3.0346773732727696e-05, 'border_count': 21, 'bagging_temperature': 0.34022964216709656, 'random_strength': 0.7990219821514812, 'grow_policy': 'SymmetricTree', 'min_data_in_leaf': 149}. Best is trial 54 with value: 1029.42640243851.[0m
[32m[I 2024-10-13 02:23:03,488][0m Trial 132 finished with value: 1111.1162359890802 and parameters: {'depth': 5, 'learning_rate': 0.020230797898408117, 'iterations': 1553, 'l2_leaf_reg': 7.298803136481198e-05, 'border_count': 19, 'bagging_temperature': 0.40933386283252343, 'random_strength': 0.6996748348593627, 'grow_policy': 'SymmetricTree', 'min_data_in_leaf': 148}. Best is trial 54 with value: 1029.42640243851.[0m
[32m[I 2024-10-13 02:23:16,545][0m Trial 133 finished with value: 1091.7349309106226 and parameters: {'depth': 5, 'learning_rate': 0.01342209390579099, 'iterations': 1829, 'l2_leaf_reg': 0.0005287704422992875, 'border_count': 15, 'bagging_temperature': 0.9276168108576003, 'random_strength': 0.4492533486819338, 'grow_policy': 'SymmetricTree', 'min_data_in_leaf': 170}. Best is trial 54 with value: 1029.42640243851.[0m
[32m[I 2024-10-13 02:23:26,753][0m Trial 134 finished with value: 1110.7492463569945 and parameters: {'depth': 5, 'learning_rate': 0.014205500642366238, 'iterations': 1829, 'l2_leaf_reg': 0.0003171179021568224, 'border_count': 13, 'bagging_temperature': 0.9941337022417116, 'random_strength': 0.37453214776510435, 'grow_policy': 'SymmetricTree', 'min_data_in_leaf': 126}. Best is trial 54 with value: 1029.42640243851.[0m
[32m[I 2024-10-13 02:23:38,718][0m Trial 135 finished with value: 1239.4683341652503 and parameters: {'depth': 5, 'learning_rate': 0.012489900240145376, 'iterations': 1859, 'l2_leaf_reg': 0.0003163645885450559, 'border_count': 12, 'bagging_temperature': 0.9356369902182595, 'random_strength': 0.38810984977545915, 'grow_policy': 'SymmetricTree', 'min_data_in_leaf': 172}. Best is trial 54 with value: 1029.42640243851.[0m
[32m[I 2024-10-13 02:23:51,619][0m Trial 136 finished with value: 1359.94162073624 and parameters: {'depth': 6, 'learning_rate': 0.008263658292036211, 'iterations': 1796, 'l2_leaf_reg': 0.00016600268952993315, 'border_count': 6, 'bagging_temperature': 0.9472734764648726, 'random_strength': 0.17577832258587056, 'grow_policy': 'SymmetricTree', 'min_data_in_leaf': 547}. Best is trial 54 with value: 1029.42640243851.[0m
[32m[I 2024-10-13 02:24:05,206][0m Trial 137 finished with value: 1265.947545713173 and parameters: {'depth': 7, 'learning_rate': 0.0109901762579158, 'iterations': 1694, 'l2_leaf_reg': 0.7084467595788216, 'border_count': 33, 'bagging_temperature': 0.9015632080722179, 'random_strength': 4.6161277554611315, 'grow_policy': 'SymmetricTree', 'min_data_in_leaf': 74}. Best is trial 54 with value: 1029.42640243851.[0m
[32m[I 2024-10-13 02:24:16,870][0m Trial 138 finished with value: 1033.5826528410657 and parameters: {'depth': 5, 'learning_rate': 0.014177223701729856, 'iterations': 1908, 'l2_leaf_reg': 0.0005163316478962244, 'border_count': 15, 'bagging_temperature': 0.9859726606199952, 'random_strength': 0.3829662305274666, 'grow_policy': 'SymmetricTree', 'min_data_in_leaf': 231}. Best is trial 54 with value: 1029.42640243851.[0m
[32m[I 2024-10-13 02:24:19,678][0m Trial 139 finished with value: 1285.8535500412333 and parameters: {'depth': 4, 'learning_rate': 0.01674448735136856, 'iterations': 1995, 'l2_leaf_reg': 1.0758769348598292e-06, 'border_count': 27, 'bagging_temperature': 0.9301977535507124, 'random_strength': 0.02767965885557999, 'grow_policy': 'Depthwise', 'min_data_in_leaf': 231}. Best is trial 54 with value: 1029.42640243851.[0m
[32m[I 2024-10-13 02:24:30,843][0m Trial 140 finished with value: 1086.772849370722 and parameters: {'depth': 5, 'learning_rate': 0.030551619969810467, 'iterations': 1635, 'l2_leaf_reg': 0.0020600221930178815, 'border_count': 15, 'bagging_temperature': 0.8902194030795763, 'random_strength': 0.5870855689709242, 'grow_policy': 'SymmetricTree', 'min_data_in_leaf': 192}. Best is trial 54 with value: 1029.42640243851.[0m
[32m[I 2024-10-13 02:24:43,484][0m Trial 141 finished with value: 1132.2520886605878 and parameters: {'depth': 5, 'learning_rate': 0.03167190310600073, 'iterations': 1916, 'l2_leaf_reg': 0.0010504939910801936, 'border_count': 15, 'bagging_temperature': 0.8687801467261829, 'random_strength': 0.5333793797323039, 'grow_policy': 'SymmetricTree', 'min_data_in_leaf': 165}. Best is trial 54 with value: 1029.42640243851.[0m
[32m[I 2024-10-13 02:24:52,998][0m Trial 142 finished with value: 1549.136415759197 and parameters: {'depth': 4, 'learning_rate': 0.025464193400271617, 'iterations': 1614, 'l2_leaf_reg': 0.0009801199399432602, 'border_count': 7, 'bagging_temperature': 0.9824572319782863, 'random_strength': 1.0535772491208877, 'grow_policy': 'SymmetricTree', 'min_data_in_leaf': 186}. Best is trial 54 with value: 1029.42640243851.[0m
[32m[I 2024-10-13 02:25:03,052][0m Trial 143 finished with value: 1104.806335384763 and parameters: {'depth': 5, 'learning_rate': 0.01936440389207735, 'iterations': 1732, 'l2_leaf_reg': 0.0005714092449527842, 'border_count': 17, 'bagging_temperature': 0.9552643834333353, 'random_strength': 0.7496014744247349, 'grow_policy': 'SymmetricTree', 'min_data_in_leaf': 195}. Best is trial 54 with value: 1029.42640243851.[0m
[32m[I 2024-10-13 02:25:16,092][0m Trial 144 finished with value: 1127.7949061243492 and parameters: {'depth': 5, 'learning_rate': 0.03618129322832071, 'iterations': 1760, 'l2_leaf_reg': 0.000571624646856815, 'border_count': 28, 'bagging_temperature': 0.9616419033158463, 'random_strength': 0.29582841842555696, 'grow_policy': 'SymmetricTree', 'min_data_in_leaf': 273}. Best is trial 54 with value: 1029.42640243851.[0m
[32m[I 2024-10-13 02:25:27,295][0m Trial 145 finished with value: 1317.5765973400291 and parameters: {'depth': 4, 'learning_rate': 0.010226291095554363, 'iterations': 1713, 'l2_leaf_reg': 0.0005783198269797326, 'border_count': 10, 'bagging_temperature': 0.9203548296535494, 'random_strength': 0.9639989706513612, 'grow_policy': 'SymmetricTree', 'min_data_in_leaf': 208}. Best is trial 54 with value: 1029.42640243851.[0m
[32m[I 2024-10-13 02:25:57,789][0m Trial 146 finished with value: 2052.8684420100903 and parameters: {'depth': 9, 'learning_rate': 0.0006131394577566829, 'iterations': 2065, 'l2_leaf_reg': 0.0004117879041317624, 'border_count': 16, 'bagging_temperature': 0.9619586384380515, 'random_strength': 0.7236596505268766, 'grow_policy': 'SymmetricTree', 'min_data_in_leaf': 232}. Best is trial 54 with value: 1029.42640243851.[0m
[32m[I 2024-10-13 02:26:16,430][0m Trial 147 finished with value: 1267.3383514188747 and parameters: {'depth': 6, 'learning_rate': 0.013341328715105004, 'iterations': 2163, 'l2_leaf_reg': 0.0017923377992426974, 'border_count': 32, 'bagging_temperature': 0.9738778457919726, 'random_strength': 0.4796979337959574, 'grow_policy': 'SymmetricTree', 'min_data_in_leaf': 192}. Best is trial 54 with value: 1029.42640243851.[0m
[32m[I 2024-10-13 02:26:19,672][0m Trial 148 finished with value: 1167.9223121216376 and parameters: {'depth': 6, 'learning_rate': 0.017340809143872985, 'iterations': 1922, 'l2_leaf_reg': 0.0001292818096539198, 'border_count': 23, 'bagging_temperature': 0.9072843424336571, 'random_strength': 0.17770474961745852, 'grow_policy': 'Lossguide', 'min_data_in_leaf': 253, 'max_leaves': 31}. Best is trial 54 with value: 1029.42640243851.[0m
[32m[I 2024-10-13 02:26:30,246][0m Trial 149 finished with value: 2838.9695857689803 and parameters: {'depth': 4, 'learning_rate': 0.027986647559906173, 'iterations': 1809, 'l2_leaf_reg': 0.00020698043223539686, 'border_count': 1, 'bagging_temperature': 0.9467446081114712, 'random_strength': 0.8278659888415444, 'grow_policy': 'SymmetricTree', 'min_data_in_leaf': 131}. Best is trial 54 with value: 1029.42640243851.[0m
[32m[I 2024-10-13 02:26:41,292][0m Trial 150 finished with value: 1065.2822811572971 and parameters: {'depth': 5, 'learning_rate': 0.015143019186553211, 'iterations': 1474, 'l2_leaf_reg': 0.003128928930385527, 'border_count': 16, 'bagging_temperature': 0.8908174491968848, 'random_strength': 0.007367685917882227, 'grow_policy': 'SymmetricTree', 'min_data_in_leaf': 175}. Best is trial 54 with value: 1029.42640243851.[0m
[32m[I 2024-10-13 02:26:51,919][0m Trial 151 finished with value: 1064.467573672578 and parameters: {'depth': 5, 'learning_rate': 0.015025970897931257, 'iterations': 1442, 'l2_leaf_reg': 0.003002586672765558, 'border_count': 16, 'bagging_temperature': 0.8898241225047534, 'random_strength': 0.017219931628716212, 'grow_policy': 'SymmetricTree', 'min_data_in_leaf': 174}. Best is trial 54 with value: 1029.42640243851.[0m
[32m[I 2024-10-13 02:27:02,805][0m Trial 152 finished with value: 1070.6550792846197 and parameters: {'depth': 5, 'learning_rate': 0.011814047160165876, 'iterations': 1453, 'l2_leaf_reg': 0.0033846654177399137, 'border_count': 15, 'bagging_temperature': 0.8814895539638771, 'random_strength': 0.1426011696475559, 'grow_policy': 'SymmetricTree', 'min_data_in_leaf': 185}. Best is trial 54 with value: 1029.42640243851.[0m
[32m[I 2024-10-13 02:27:13,049][0m Trial 153 finished with value: 1373.5419508293533 and parameters: {'depth': 5, 'learning_rate': 0.010985280111343526, 'iterations': 1326, 'l2_leaf_reg': 0.004195069301190594, 'border_count': 11, 'bagging_temperature': 0.847225161232155, 'random_strength': 3.6644026653839887, 'grow_policy': 'SymmetricTree', 'min_data_in_leaf': 221}. Best is trial 54 with value: 1029.42640243851.[0m
[32m[I 2024-10-13 02:27:21,524][0m Trial 154 finished with value: 1183.3470102034737 and parameters: {'depth': 5, 'learning_rate': 0.007626002512696688, 'iterations': 1248, 'l2_leaf_reg': 0.002056697241251915, 'border_count': 27, 'bagging_temperature': 0.8690539694974421, 'random_strength': 0.07792370144288667, 'grow_policy': 'SymmetricTree', 'min_data_in_leaf': 185}. Best is trial 54 with value: 1029.42640243851.[0m
