[32m[I 2024-10-13 04:38:09,266][0m Trial 920 finished with value: 1120.9584512046522 and parameters: {'depth': 11, 'learning_rate': 0.013227919572855799, 'iterations': 1220, 'l2_leaf_reg': 0.04795938805330923, 'border_count': 15, 'bagging_temperature': 0.25071928780438496, 'random_strength': 0.5328838236865737, 'grow_policy': 'SymmetricTree', 'min_data_in_leaf': 547}. Best is trial 575 with value: 965.9974213974682.[0m
[32m[I 2024-10-13 04:38:16,621][0m Trial 921 finished with value: 1218.508595106054 and parameters: {'depth': 8, 'learning_rate': 0.010789949566542747, 'iterations': 1145, 'l2_leaf_reg': 0.005117950863600964, 'border_count': 28, 'bagging_temperature': 0.5984223410673257, 'random_strength': 0.0076195547323592155, 'grow_policy': 'SymmetricTree', 'min_data_in_leaf': 179}. Best is trial 575 with value: 965.9974213974682.[0m
[32m[I 2024-10-13 04:38:23,353][0m Trial 922 finished with value: 1074.5173513901811 and parameters: {'depth': 7, 'learning_rate': 0.015276347435638814, 'iterations': 1398, 'l2_leaf_reg': 0.017751615969837126, 'border_count': 20, 'bagging_temperature': 0.7256597021599409, 'random_strength': 0.3256515263807981, 'grow_policy': 'SymmetricTree', 'min_data_in_leaf': 204}. Best is trial 575 with value: 965.9974213974682.[0m
[32m[I 2024-10-13 04:38:28,991][0m Trial 923 finished with value: 1170.134752686397 and parameters: {'depth': 7, 'learning_rate': 0.0618146737965279, 'iterations': 1283, 'l2_leaf_reg': 0.12321237619631592, 'border_count': 12, 'bagging_temperature': 0.10973584897866343, 'random_strength': 0.17965795234790044, 'grow_policy': 'SymmetricTree', 'min_data_in_leaf': 242}. Best is trial 575 with value: 965.9974213974682.[0m
[32m[I 2024-10-13 04:38:34,610][0m Trial 924 finished with value: 1032.246968180797 and parameters: {'depth': 9, 'learning_rate': 0.023371765944119858, 'iterations': 810, 'l2_leaf_reg': 0.011034053153532238, 'border_count': 24, 'bagging_temperature': 0.8788990466608084, 'random_strength': 0.004936765329060318, 'grow_policy': 'SymmetricTree', 'min_data_in_leaf': 530}. Best is trial 575 with value: 965.9974213974682.[0m
[32m[I 2024-10-13 04:38:42,325][0m Trial 925 finished with value: 1151.8280179868345 and parameters: {'depth': 8, 'learning_rate': 0.017631873437968047, 'iterations': 1544, 'l2_leaf_reg': 0.0025248613610700777, 'border_count': 17, 'bagging_temperature': 0.30748016031870623, 'random_strength': 0.5157597894997124, 'grow_policy': 'SymmetricTree', 'min_data_in_leaf': 474}. Best is trial 575 with value: 965.9974213974682.[0m
[32m[I 2024-10-13 04:39:09,519][0m Trial 926 finished with value: 1699.7341813527892 and parameters: {'depth': 12, 'learning_rate': 0.001167366600379752, 'iterations': 1447, 'l2_leaf_reg': 0.03202477248248907, 'border_count': 32, 'bagging_temperature': 0.34022525343889376, 'random_strength': 0.3267660198201972, 'grow_policy': 'SymmetricTree', 'min_data_in_leaf': 263}. Best is trial 575 with value: 965.9974213974682.[0m
[32m[I 2024-10-13 04:39:11,157][0m Trial 927 finished with value: 1323.9832662820204 and parameters: {'depth': 6, 'learning_rate': 0.012415222190411104, 'iterations': 1491, 'l2_leaf_reg': 0.0762446613265129, 'border_count': 123, 'bagging_temperature': 0.6450782067456603, 'random_strength': 0.17756307786948464, 'grow_policy': 'Depthwise', 'min_data_in_leaf': 157}. Best is trial 575 with value: 965.9974213974682.[0m
[32m[I 2024-10-13 04:39:16,969][0m Trial 928 finished with value: 1201.9763090304416 and parameters: {'depth': 7, 'learning_rate': 0.028430975659937293, 'iterations': 1353, 'l2_leaf_reg': 0.0036550689250983764, 'border_count': 28, 'bagging_temperature': 0.2886994163021136, 'random_strength': 0.7161842418710879, 'grow_policy': 'SymmetricTree', 'min_data_in_leaf': 565}. Best is trial 575 with value: 965.9974213974682.[0m
[32m[I 2024-10-13 04:39:27,121][0m Trial 929 finished with value: 1064.5825025919146 and parameters: {'depth': 11, 'learning_rate': 0.020314178783533525, 'iterations': 1180, 'l2_leaf_reg': 0.0558117358846897, 'border_count': 21, 'bagging_temperature': 0.1399798800341034, 'random_strength': 0.3312196828970372, 'grow_policy': 'SymmetricTree', 'min_data_in_leaf': 216}. Best is trial 575 with value: 965.9974213974682.[0m
[32m[I 2024-10-13 04:39:38,377][0m Trial 930 finished with value: 4291.255776673929 and parameters: {'depth': 9, 'learning_rate': 0.00015583339095891286, 'iterations': 1285, 'l2_leaf_reg': 0.020873767267660076, 'border_count': 15, 'bagging_temperature': 0.25890951302728243, 'random_strength': 0.1794696754860579, 'grow_policy': 'SymmetricTree', 'min_data_in_leaf': 189}. Best is trial 575 with value: 965.9974213974682.[0m
[32m[I 2024-10-13 04:39:44,738][0m Trial 931 finished with value: 1380.2472939406116 and parameters: {'depth': 8, 'learning_rate': 0.015386320723722549, 'iterations': 1397, 'l2_leaf_reg': 0.0061876007501319155, 'border_count': 7, 'bagging_temperature': 0.8958119721318109, 'random_strength': 0.4843188577001233, 'grow_policy': 'SymmetricTree', 'min_data_in_leaf': 597}. Best is trial 575 with value: 965.9974213974682.[0m
[32m[I 2024-10-13 04:39:55,803][0m Trial 932 finished with value: 1037.1745658475656 and parameters: {'depth': 8, 'learning_rate': 0.050318044020606814, 'iterations': 1576, 'l2_leaf_reg': 0.03734362652328988, 'border_count': 23, 'bagging_temperature': 0.17347960732213683, 'random_strength': 0.17020113556560745, 'grow_policy': 'SymmetricTree', 'min_data_in_leaf': 99}. Best is trial 575 with value: 965.9974213974682.[0m
[32m[I 2024-10-13 04:39:57,144][0m Trial 933 finished with value: 1316.9363990765528 and parameters: {'depth': 11, 'learning_rate': 0.03202378379905666, 'iterations': 1119, 'l2_leaf_reg': 0.013937156226704021, 'border_count': 12, 'bagging_temperature': 0.9381589955919492, 'random_strength': 0.6348535399487414, 'grow_policy': 'Lossguide', 'min_data_in_leaf': 173, 'max_leaves': 145}. Best is trial 575 with value: 965.9974213974682.[0m
[32m[I 2024-10-13 04:40:05,061][0m Trial 934 finished with value: 1276.1195002054724 and parameters: {'depth': 8, 'learning_rate': 0.010900184461856824, 'iterations': 1357, 'l2_leaf_reg': 0.0015494495004978021, 'border_count': 43, 'bagging_temperature': 0.20156198921836183, 'random_strength': 0.3659722662590172, 'grow_policy': 'SymmetricTree', 'min_data_in_leaf': 234}. Best is trial 575 with value: 965.9974213974682.[0m
[32m[I 2024-10-13 04:40:10,535][0m Trial 935 finished with value: 1135.2692294697806 and parameters: {'depth': 7, 'learning_rate': 0.017974146952505782, 'iterations': 1247, 'l2_leaf_reg': 0.1532906779603453, 'border_count': 27, 'bagging_temperature': 0.1588798687541948, 'random_strength': 0.16104909994917835, 'grow_policy': 'SymmetricTree', 'min_data_in_leaf': 134}. Best is trial 575 with value: 965.9974213974682.[0m
[32m[I 2024-10-13 04:40:16,099][0m Trial 936 finished with value: 1222.840390689248 and parameters: {'depth': 9, 'learning_rate': 0.024940435741613583, 'iterations': 706, 'l2_leaf_reg': 0.08407716196282396, 'border_count': 36, 'bagging_temperature': 0.5755137635648406, 'random_strength': 0.18318983951696588, 'grow_policy': 'SymmetricTree', 'min_data_in_leaf': 204}. Best is trial 575 with value: 965.9974213974682.[0m
[32m[I 2024-10-13 04:40:26,990][0m Trial 937 finished with value: 1093.746502254627 and parameters: {'depth': 10, 'learning_rate': 0.009169945773499602, 'iterations': 1501, 'l2_leaf_reg': 0.026136196303654883, 'border_count': 18, 'bagging_temperature': 0.8427785184665338, 'random_strength': 0.38279263755532256, 'grow_policy': 'SymmetricTree', 'min_data_in_leaf': 620}. Best is trial 575 with value: 965.9974213974682.[0m
[32m[I 2024-10-13 04:41:00,448][0m Trial 938 finished with value: 997.4848671953561 and parameters: {'depth': 12, 'learning_rate': 0.014262580333101273, 'iterations': 1673, 'l2_leaf_reg': 0.009080495340499383, 'border_count': 22, 'bagging_temperature': 0.235017731492932, 'random_strength': 0.0016892091154246847, 'grow_policy': 'SymmetricTree', 'min_data_in_leaf': 557}. Best is trial 575 with value: 965.9974213974682.[0m
[32m[I 2024-10-13 04:41:10,624][0m Trial 939 finished with value: 1230.750937816459 and parameters: {'depth': 8, 'learning_rate': 0.02105072383427551, 'iterations': 1313, 'l2_leaf_reg': 0.009368915504360607, 'border_count': 31, 'bagging_temperature': 0.24319653962610727, 'random_strength': 0.004375078951002228, 'grow_policy': 'SymmetricTree', 'min_data_in_leaf': 538}. Best is trial 575 with value: 965.9974213974682.[0m
[32m[I 2024-10-13 04:41:17,386][0m Trial 940 finished with value: 1094.5153240946786 and parameters: {'depth': 7, 'learning_rate': 0.015852476815684663, 'iterations': 1639, 'l2_leaf_reg': 0.008552837449028888, 'border_count': 17, 'bagging_temperature': 0.249650566021405, 'random_strength': 0.16687426633750926, 'grow_policy': 'SymmetricTree', 'min_data_in_leaf': 555}. Best is trial 575 with value: 965.9974213974682.[0m
[32m[I 2024-10-13 04:41:30,617][0m Trial 941 finished with value: 1175.4042605159775 and parameters: {'depth': 10, 'learning_rate': 0.01878406781822674, 'iterations': 1712, 'l2_leaf_reg': 0.006421072132687344, 'border_count': 25, 'bagging_temperature': 0.2209058891383371, 'random_strength': 0.019236889969439442, 'grow_policy': 'SymmetricTree', 'min_data_in_leaf': 565}. Best is trial 575 with value: 965.9974213974682.[0m
[32m[I 2024-10-13 04:41:37,456][0m Trial 942 finished with value: 1107.3756210942568 and parameters: {'depth': 6, 'learning_rate': 0.023765882819150954, 'iterations': 1760, 'l2_leaf_reg': 0.011623699208148505, 'border_count': 21, 'bagging_temperature': 0.229211598376907, 'random_strength': 0.3021987587333836, 'grow_policy': 'SymmetricTree', 'min_data_in_leaf': 748}. Best is trial 575 with value: 965.9974213974682.[0m
[32m[I 2024-10-13 04:41:49,006][0m Trial 943 finished with value: 1197.2517215190637 and parameters: {'depth': 9, 'learning_rate': 0.013919521522597046, 'iterations': 1770, 'l2_leaf_reg': 0.004284525203176273, 'border_count': 11, 'bagging_temperature': 0.23331372727354233, 'random_strength': 0.008041390193109708, 'grow_policy': 'SymmetricTree', 'min_data_in_leaf': 564}. Best is trial 575 with value: 965.9974213974682.[0m
[32m[I 2024-10-13 04:42:19,860][0m Trial 944 finished with value: 1145.3340434932895 and parameters: {'depth': 12, 'learning_rate': 0.028115669490968, 'iterations': 1803, 'l2_leaf_reg': 0.007388881523203205, 'border_count': 15, 'bagging_temperature': 0.21205627237025662, 'random_strength': 0.007095622284911689, 'grow_policy': 'SymmetricTree', 'min_data_in_leaf': 515}. Best is trial 575 with value: 965.9974213974682.[0m
[32m[I 2024-10-13 04:42:31,836][0m Trial 945 finished with value: 1356.8794746578508 and parameters: {'depth': 7, 'learning_rate': 0.016460670485229735, 'iterations': 1708, 'l2_leaf_reg': 0.015586018012508251, 'border_count': 255, 'bagging_temperature': 0.2558045805248562, 'random_strength': 0.47996607104327726, 'grow_policy': 'SymmetricTree', 'min_data_in_leaf': 494}. Best is trial 575 with value: 965.9974213974682.[0m
[32m[I 2024-10-13 04:42:47,062][0m Trial 946 finished with value: 1174.4507364643498 and parameters: {'depth': 11, 'learning_rate': 0.03399117199803411, 'iterations': 840, 'l2_leaf_reg': 0.0051357812350301115, 'border_count': 28, 'bagging_temperature': 0.23067567108978965, 'random_strength': 0.007939857795489322, 'grow_policy': 'SymmetricTree', 'min_data_in_leaf': 587}. Best is trial 575 with value: 965.9974213974682.[0m
[32m[I 2024-10-13 04:42:54,380][0m Trial 947 finished with value: 1631.237001205892 and parameters: {'depth': 9, 'learning_rate': 0.02088182931546808, 'iterations': 1664, 'l2_leaf_reg': 0.014383509799227418, 'border_count': 5, 'bagging_temperature': 0.20681409252361527, 'random_strength': 5.329775908414171, 'grow_policy': 'SymmetricTree', 'min_data_in_leaf': 548}. Best is trial 575 with value: 965.9974213974682.[0m
[32m[I 2024-10-13 04:43:01,536][0m Trial 948 finished with value: 993.2769422477161 and parameters: {'depth': 8, 'learning_rate': 0.013160909053167271, 'iterations': 1153, 'l2_leaf_reg': 0.00931569498241191, 'border_count': 20, 'bagging_temperature': 0.262852548726232, 'random_strength': 0.008269762819971077, 'grow_policy': 'SymmetricTree', 'min_data_in_leaf': 576}. Best is trial 575 with value: 965.9974213974682.[0m
[32m[I 2024-10-13 04:43:08,551][0m Trial 949 finished with value: 1241.1435769310829 and parameters: {'depth': 8, 'learning_rate': 0.011321341531071307, 'iterations': 1110, 'l2_leaf_reg': 0.0060104848279955, 'border_count': 34, 'bagging_temperature': 0.25412064054240474, 'random_strength': 0.2953060816577341, 'grow_policy': 'SymmetricTree', 'min_data_in_leaf': 574}. Best is trial 575 with value: 965.9974213974682.[0m
[32m[I 2024-10-13 04:43:18,759][0m Trial 950 finished with value: 1152.377099194553 and parameters: {'depth': 11, 'learning_rate': 0.012986276215582853, 'iterations': 1089, 'l2_leaf_reg': 0.009035818393854715, 'border_count': 24, 'bagging_temperature': 0.23290141541770254, 'random_strength': 0.2182367231665249, 'grow_policy': 'SymmetricTree', 'min_data_in_leaf': 590}. Best is trial 575 with value: 965.9974213974682.[0m
[32m[I 2024-10-13 04:43:20,257][0m Trial 951 finished with value: 1151.3171615653077 and parameters: {'depth': 8, 'learning_rate': 0.03990858556359468, 'iterations': 1169, 'l2_leaf_reg': 0.0036066114931240707, 'border_count': 20, 'bagging_temperature': 0.27056177611134663, 'random_strength': 0.007551086637152159, 'grow_policy': 'Depthwise', 'min_data_in_leaf': 531}. Best is trial 575 with value: 965.9974213974682.[0m
[32m[I 2024-10-13 04:43:29,480][0m Trial 952 finished with value: 1380.7865189124566 and parameters: {'depth': 9, 'learning_rate': 0.007467267413806522, 'iterations': 1144, 'l2_leaf_reg': 0.00894383947018099, 'border_count': 29, 'bagging_temperature': 0.21944333801682844, 'random_strength': 7.98007563203887, 'grow_policy': 'SymmetricTree', 'min_data_in_leaf': 608}. Best is trial 575 with value: 965.9974213974682.[0m
[32m[I 2024-10-13 04:43:42,445][0m Trial 953 finished with value: 1136.4582871414614 and parameters: {'depth': 13, 'learning_rate': 0.010002781757930861, 'iterations': 1088, 'l2_leaf_reg': 0.002765281792105877, 'border_count': 16, 'bagging_temperature': 0.19761159377411355, 'random_strength': 0.5508036141871062, 'grow_policy': 'SymmetricTree', 'min_data_in_leaf': 577}. Best is trial 575 with value: 965.9974213974682.[0m
[32m[I 2024-10-13 04:43:48,051][0m Trial 954 finished with value: 1082.9299499464007 and parameters: {'depth': 7, 'learning_rate': 0.02613590152876154, 'iterations': 1186, 'l2_leaf_reg': 0.005998721160944502, 'border_count': 24, 'bagging_temperature': 0.2646359136299762, 'random_strength': 0.33439344596126597, 'grow_policy': 'SymmetricTree', 'min_data_in_leaf': 540}. Best is trial 575 with value: 965.9974213974682.[0m
[32m[I 2024-10-13 04:44:19,294][0m Trial 955 finished with value: 1212.5734883428568 and parameters: {'depth': 11, 'learning_rate': 0.016060993509163093, 'iterations': 2817, 'l2_leaf_reg': 0.0037855644572493564, 'border_count': 11, 'bagging_temperature': 0.23811979130553967, 'random_strength': 0.20750994126589234, 'grow_policy': 'SymmetricTree', 'min_data_in_leaf': 561}. Best is trial 575 with value: 965.9974213974682.[0m
[32m[I 2024-10-13 04:44:27,740][0m Trial 956 finished with value: 1192.3469922497925 and parameters: {'depth': 8, 'learning_rate': 0.01267264207452018, 'iterations': 1070, 'l2_leaf_reg': 0.011263868395379024, 'border_count': 52, 'bagging_temperature': 0.24559010371849246, 'random_strength': 0.16712765096299356, 'grow_policy': 'SymmetricTree', 'min_data_in_leaf': 601}. Best is trial 575 with value: 965.9974213974682.[0m
[32m[I 2024-10-13 04:44:29,264][0m Trial 957 finished with value: 1247.3123973147492 and parameters: {'depth': 7, 'learning_rate': 0.018954055171196405, 'iterations': 1229, 'l2_leaf_reg': 0.0050466904137525396, 'border_count': 37, 'bagging_temperature': 0.18361019005182566, 'random_strength': 0.4481448086484703, 'grow_policy': 'Lossguide', 'min_data_in_leaf': 553, 'max_leaves': 45}. Best is trial 575 with value: 965.9974213974682.[0m
[32m[I 2024-10-13 04:44:32,121][0m Trial 958 finished with value: 1092.7216852878778 and parameters: {'depth': 6, 'learning_rate': 0.022998548379603006, 'iterations': 626, 'l2_leaf_reg': 9.782490591344486e-08, 'border_count': 20, 'bagging_temperature': 0.26255778219852816, 'random_strength': 0.8440926577388231, 'grow_policy': 'SymmetricTree', 'min_data_in_leaf': 589}. Best is trial 575 with value: 965.9974213974682.[0m
[32m[I 2024-10-13 04:44:33,719][0m Trial 959 finished with value: 1313.1752414765278 and parameters: {'depth': 9, 'learning_rate': 0.014431451561454168, 'iterations': 393, 'l2_leaf_reg': 0.007962086636560891, 'border_count': 30, 'bagging_temperature': 0.2212251220851023, 'random_strength': 6.532565927970854, 'grow_policy': 'SymmetricTree', 'min_data_in_leaf': 569}. Best is trial 575 with value: 965.9974213974682.[0m
[32m[I 2024-10-13 04:44:43,726][0m Trial 960 finished with value: 1085.7061245105547 and parameters: {'depth': 10, 'learning_rate': 0.0324784338426988, 'iterations': 1877, 'l2_leaf_reg': 0.0022496549432631146, 'border_count': 23, 'bagging_temperature': 0.1934440764158937, 'random_strength': 0.17984472324329684, 'grow_policy': 'SymmetricTree', 'min_data_in_leaf': 628}. Best is trial 575 with value: 965.9974213974682.[0m
[32m[I 2024-10-13 04:45:10,479][0m Trial 961 finished with value: 1040.4873887428366 and parameters: {'depth': 12, 'learning_rate': 0.00918813557636741, 'iterations': 1176, 'l2_leaf_reg': 0.011254866419267739, 'border_count': 17, 'bagging_temperature': 0.9108343474979037, 'random_strength': 0.009489504904300228, 'grow_policy': 'SymmetricTree', 'min_data_in_leaf': 522}. Best is trial 575 with value: 965.9974213974682.[0m
[32m[I 2024-10-13 04:45:20,775][0m Trial 962 finished with value: 1207.680039738426 and parameters: {'depth': 8, 'learning_rate': 0.02669300900775491, 'iterations': 1673, 'l2_leaf_reg': 0.0037255712415059567, 'border_count': 27, 'bagging_temperature': 0.27665605154107586, 'random_strength': 0.624869867569883, 'grow_policy': 'SymmetricTree', 'min_data_in_leaf': 582}. Best is trial 575 with value: 965.9974213974682.[0m
[32m[I 2024-10-13 04:45:28,727][0m Trial 963 finished with value: 1213.4610528488784 and parameters: {'depth': 8, 'learning_rate': 0.011459205830296307, 'iterations': 1438, 'l2_leaf_reg': 0.0067639352684116276, 'border_count': 10, 'bagging_temperature': 0.24031780737273514, 'random_strength': 0.007413481320261567, 'grow_policy': 'SymmetricTree', 'min_data_in_leaf': 546}. Best is trial 575 with value: 965.9974213974682.[0m
[32m[I 2024-10-13 04:45:35,783][0m Trial 964 finished with value: 1269.6620717493176 and parameters: {'depth': 9, 'learning_rate': 0.020749823775972828, 'iterations': 1331, 'l2_leaf_reg': 0.019676048263600743, 'border_count': 21, 'bagging_temperature': 0.21004199506072382, 'random_strength': 9.451928858744902, 'grow_policy': 'SymmetricTree', 'min_data_in_leaf': 521}. Best is trial 575 with value: 965.9974213974682.[0m
[32m[I 2024-10-13 04:45:43,025][0m Trial 965 finished with value: 1020.9105243675136 and parameters: {'depth': 10, 'learning_rate': 0.017372342147148598, 'iterations': 1124, 'l2_leaf_reg': 0.11188673548618971, 'border_count': 14, 'bagging_temperature': 0.1763832953982604, 'random_strength': 0.3776887205902113, 'grow_policy': 'SymmetricTree', 'min_data_in_leaf': 613}. Best is trial 575 with value: 965.9974213974682.[0m
[32m[I 2024-10-13 04:45:51,660][0m Trial 966 finished with value: 1295.2580970623023 and parameters: {'depth': 7, 'learning_rate': 0.013804047109138599, 'iterations': 1257, 'l2_leaf_reg': 0.01484815409068511, 'border_count': 244, 'bagging_temperature': 0.8662739561332975, 'random_strength': 0.3394559270101356, 'grow_policy': 'SymmetricTree', 'min_data_in_leaf': 587}. Best is trial 575 with value: 965.9974213974682.[0m
[32m[I 2024-10-13 04:45:57,339][0m Trial 967 finished with value: 1211.0614714943847 and parameters: {'depth': 8, 'learning_rate': 0.022488668639310313, 'iterations': 1047, 'l2_leaf_reg': 0.06030582375120849, 'border_count': 32, 'bagging_temperature': 0.09140464896412415, 'random_strength': 0.17073795268748984, 'grow_policy': 'SymmetricTree', 'min_data_in_leaf': 569}. Best is trial 575 with value: 965.9974213974682.[0m
[32m[I 2024-10-13 04:47:09,234][0m Trial 968 finished with value: 1136.326742495011 and parameters: {'depth': 14, 'learning_rate': 0.0082037752233874, 'iterations': 1375, 'l2_leaf_reg': 0.0042824169204704245, 'border_count': 26, 'bagging_temperature': 0.8912363510547524, 'random_strength': 0.007616797027179101, 'grow_policy': 'SymmetricTree', 'min_data_in_leaf': 502}. Best is trial 575 with value: 965.9974213974682.[0m
[32m[I 2024-10-13 04:47:26,610][0m Trial 969 finished with value: 1105.3911725871415 and parameters: {'depth': 11, 'learning_rate': 0.018745480117232854, 'iterations': 1429, 'l2_leaf_reg': 0.04347438533646433, 'border_count': 18, 'bagging_temperature': 0.9647883207905226, 'random_strength': 0.5704353003706679, 'grow_policy': 'SymmetricTree', 'min_data_in_leaf': 603}. Best is trial 575 with value: 965.9974213974682.[0m
[32m[I 2024-10-13 04:47:32,331][0m Trial 970 finished with value: 1142.3979059974824 and parameters: {'depth': 9, 'learning_rate': 0.028700469228204933, 'iterations': 1198, 'l2_leaf_reg': 0.0022521932408820357, 'border_count': 24, 'bagging_temperature': 0.15122438600927934, 'random_strength': 0.342832459616811, 'grow_policy': 'SymmetricTree', 'min_data_in_leaf': 802}. Best is trial 575 with value: 965.9974213974682.[0m
