[32m[I 2024-10-13 02:27:30,254][0m Trial 155 finished with value: 1539.2037513830664 and parameters: {'depth': 6, 'learning_rate': 0.015033904050665152, 'iterations': 1465, 'l2_leaf_reg': 0.008532425021687193, 'border_count': 5, 'bagging_temperature': 0.8846422633762083, 'random_strength': 0.016771688949575148, 'grow_policy': 'SymmetricTree', 'min_data_in_leaf': 142}. Best is trial 54 with value: 1029.42640243851.[0m
[32m[I 2024-10-13 02:27:38,566][0m Trial 156 finished with value: 1078.3495584143175 and parameters: {'depth': 5, 'learning_rate': 0.013226614182689474, 'iterations': 1405, 'l2_leaf_reg': 0.003403045749063559, 'border_count': 16, 'bagging_temperature': 0.8957393720637978, 'random_strength': 0.25308770900075905, 'grow_policy': 'SymmetricTree', 'min_data_in_leaf': 165}. Best is trial 54 with value: 1029.42640243851.[0m
[32m[I 2024-10-13 02:27:47,673][0m Trial 157 finished with value: 1067.0570907892484 and parameters: {'depth': 5, 'learning_rate': 0.009155994941406263, 'iterations': 1415, 'l2_leaf_reg': 0.0033488754439661996, 'border_count': 15, 'bagging_temperature': 0.8966831941994029, 'random_strength': 0.2628452198364046, 'grow_policy': 'SymmetricTree', 'min_data_in_leaf': 169}. Best is trial 54 with value: 1029.42640243851.[0m
[32m[I 2024-10-13 02:27:58,274][0m Trial 158 finished with value: 1244.9511413576909 and parameters: {'depth': 5, 'learning_rate': 0.009832475548879236, 'iterations': 1397, 'l2_leaf_reg': 0.003185670534981415, 'border_count': 9, 'bagging_temperature': 0.8169059767778611, 'random_strength': 0.21015684581894267, 'grow_policy': 'SymmetricTree', 'min_data_in_leaf': 654}. Best is trial 54 with value: 1029.42640243851.[0m
[32m[I 2024-10-13 02:28:09,476][0m Trial 159 finished with value: 1023.6621066186796 and parameters: {'depth': 6, 'learning_rate': 0.011796214724664711, 'iterations': 1420, 'l2_leaf_reg': 0.0015342639093960501, 'border_count': 17, 'bagging_temperature': 0.7909340528792838, 'random_strength': 0.003763154993153023, 'grow_policy': 'SymmetricTree', 'min_data_in_leaf': 205}. Best is trial 159 with value: 1023.6621066186796.[0m
[32m[I 2024-10-13 02:28:20,512][0m Trial 160 finished with value: 1067.7059829806813 and parameters: {'depth': 6, 'learning_rate': 0.008048454364214074, 'iterations': 1426, 'l2_leaf_reg': 0.005610726102747064, 'border_count': 16, 'bagging_temperature': 0.7950163310036563, 'random_strength': 0.24994226550546156, 'grow_policy': 'SymmetricTree', 'min_data_in_leaf': 214}. Best is trial 159 with value: 1023.6621066186796.[0m
[32m[I 2024-10-13 02:28:29,728][0m Trial 161 finished with value: 1092.8721764860227 and parameters: {'depth': 6, 'learning_rate': 0.007938949849889241, 'iterations': 1289, 'l2_leaf_reg': 0.005845504882248661, 'border_count': 16, 'bagging_temperature': 0.7637970606658793, 'random_strength': 0.3141150295789015, 'grow_policy': 'SymmetricTree', 'min_data_in_leaf': 216}. Best is trial 159 with value: 1023.6621066186796.[0m
[32m[I 2024-10-13 02:28:41,567][0m Trial 162 finished with value: 1249.3800695514092 and parameters: {'depth': 7, 'learning_rate': 0.0065684944104803635, 'iterations': 1165, 'l2_leaf_reg': 0.0027054862977206537, 'border_count': 11, 'bagging_temperature': 0.800908806471734, 'random_strength': 0.28637060438466505, 'grow_policy': 'SymmetricTree', 'min_data_in_leaf': 244}. Best is trial 159 with value: 1023.6621066186796.[0m
[32m[I 2024-10-13 02:28:51,896][0m Trial 163 finished with value: 1345.9624817232445 and parameters: {'depth': 6, 'learning_rate': 0.012008866460484017, 'iterations': 1431, 'l2_leaf_reg': 0.001310287704846484, 'border_count': 6, 'bagging_temperature': 0.8902837830537534, 'random_strength': 0.014276683275723151, 'grow_policy': 'SymmetricTree', 'min_data_in_leaf': 915}. Best is trial 159 with value: 1023.6621066186796.[0m
[32m[I 2024-10-13 02:29:02,797][0m Trial 164 finished with value: 1113.6467790728739 and parameters: {'depth': 6, 'learning_rate': 0.00878671287731546, 'iterations': 1488, 'l2_leaf_reg': 0.001986534123077482, 'border_count': 20, 'bagging_temperature': 0.8578602978383012, 'random_strength': 0.37096142271119753, 'grow_policy': 'SymmetricTree', 'min_data_in_leaf': 199}. Best is trial 159 with value: 1023.6621066186796.[0m
[32m[I 2024-10-13 02:29:12,980][0m Trial 165 finished with value: 1149.8585526676438 and parameters: {'depth': 5, 'learning_rate': 0.011297748053172829, 'iterations': 1398, 'l2_leaf_reg': 0.004285745597610579, 'border_count': 31, 'bagging_temperature': 0.7339201663853754, 'random_strength': 0.2761699148428949, 'grow_policy': 'SymmetricTree', 'min_data_in_leaf': 264}. Best is trial 159 with value: 1023.6621066186796.[0m
[32m[I 2024-10-13 02:29:20,771][0m Trial 166 finished with value: 1048.1499049729814 and parameters: {'depth': 5, 'learning_rate': 0.014725895189181758, 'iterations': 1289, 'l2_leaf_reg': 0.007175628192279723, 'border_count': 16, 'bagging_temperature': 0.8314993104606601, 'random_strength': 0.0008889925647594943, 'grow_policy': 'SymmetricTree', 'min_data_in_leaf': 221}. Best is trial 159 with value: 1023.6621066186796.[0m
[32m[I 2024-10-13 02:29:30,219][0m Trial 167 finished with value: 1056.6664113738846 and parameters: {'depth': 6, 'learning_rate': 0.014237480521685933, 'iterations': 1296, 'l2_leaf_reg': 0.005957987109772954, 'border_count': 24, 'bagging_temperature': 0.8211350040632672, 'random_strength': 0.2135144005078084, 'grow_policy': 'SymmetricTree', 'min_data_in_leaf': 228}. Best is trial 159 with value: 1023.6621066186796.[0m
[32m[I 2024-10-13 02:29:43,803][0m Trial 168 finished with value: 1275.5565892320567 and parameters: {'depth': 7, 'learning_rate': 0.012513506441329836, 'iterations': 1262, 'l2_leaf_reg': 0.011572556926710454, 'border_count': 114, 'bagging_temperature': 0.8339351625574412, 'random_strength': 0.16594999807561564, 'grow_policy': 'SymmetricTree', 'min_data_in_leaf': 224}. Best is trial 159 with value: 1023.6621066186796.[0m
[32m[I 2024-10-13 02:29:53,253][0m Trial 169 finished with value: 1179.5014872649388 and parameters: {'depth': 6, 'learning_rate': 0.009271323035193612, 'iterations': 1125, 'l2_leaf_reg': 0.006135806802077234, 'border_count': 27, 'bagging_temperature': 0.7929182637878995, 'random_strength': 0.03675560703434571, 'grow_policy': 'SymmetricTree', 'min_data_in_leaf': 283}. Best is trial 159 with value: 1023.6621066186796.[0m
[32m[I 2024-10-13 02:29:55,225][0m Trial 170 finished with value: 1135.5398234520073 and parameters: {'depth': 7, 'learning_rate': 0.015475462913341745, 'iterations': 1329, 'l2_leaf_reg': 0.016816223699660474, 'border_count': 19, 'bagging_temperature': 0.8191463526305304, 'random_strength': 0.2983147900837251, 'grow_policy': 'Depthwise', 'min_data_in_leaf': 244}. Best is trial 159 with value: 1023.6621066186796.[0m
[32m[I 2024-10-13 02:30:04,667][0m Trial 171 finished with value: 995.4334382975621 and parameters: {'depth': 6, 'learning_rate': 0.014541615730137762, 'iterations': 1357, 'l2_leaf_reg': 0.0035183587562493696, 'border_count': 22, 'bagging_temperature': 0.8648268198957192, 'random_strength': 0.0018016561593833247, 'grow_policy': 'SymmetricTree', 'min_data_in_leaf': 212}. Best is trial 171 with value: 995.4334382975621.[0m
[32m[I 2024-10-13 02:30:16,037][0m Trial 172 finished with value: 1100.3473201644329 and parameters: {'depth': 6, 'learning_rate': 0.01050307866142678, 'iterations': 1348, 'l2_leaf_reg': 0.0077269876035263385, 'border_count': 23, 'bagging_temperature': 0.7765471194372189, 'random_strength': 0.44753874220864026, 'grow_policy': 'SymmetricTree', 'min_data_in_leaf': 217}. Best is trial 171 with value: 995.4334382975621.[0m
[32m[I 2024-10-13 02:30:29,031][0m Trial 173 finished with value: 1184.8400068354545 and parameters: {'depth': 6, 'learning_rate': 0.013753368424136615, 'iterations': 1433, 'l2_leaf_reg': 0.0031439091974695315, 'border_count': 12, 'bagging_temperature': 0.8605534510242385, 'random_strength': 0.02571215177455549, 'grow_policy': 'SymmetricTree', 'min_data_in_leaf': 235}. Best is trial 171 with value: 995.4334382975621.[0m
[32m[I 2024-10-13 02:30:39,750][0m Trial 174 finished with value: 1247.1276790845143 and parameters: {'depth': 6, 'learning_rate': 0.007133200449375506, 'iterations': 1198, 'l2_leaf_reg': 0.004278829336259311, 'border_count': 36, 'bagging_temperature': 0.9008071706912747, 'random_strength': 0.18291376804346932, 'grow_policy': 'SymmetricTree', 'min_data_in_leaf': 171}. Best is trial 171 with value: 995.4334382975621.[0m
[32m[I 2024-10-13 02:30:53,192][0m Trial 175 finished with value: 1089.7937109329127 and parameters: {'depth': 7, 'learning_rate': 0.014932607864179631, 'iterations': 1352, 'l2_leaf_reg': 0.0013247967693961061, 'border_count': 18, 'bagging_temperature': 0.8111055072182168, 'random_strength': 0.43775636111212296, 'grow_policy': 'SymmetricTree', 'min_data_in_leaf': 208}. Best is trial 171 with value: 995.4334382975621.[0m
[32m[I 2024-10-13 02:31:11,471][0m Trial 176 finished with value: 1269.784205207811 and parameters: {'depth': 6, 'learning_rate': 0.009050325468975655, 'iterations': 1488, 'l2_leaf_reg': 0.006691785954515799, 'border_count': 94, 'bagging_temperature': 0.8363913026042908, 'random_strength': 0.004860950851933249, 'grow_policy': 'SymmetricTree', 'min_data_in_leaf': 258}. Best is trial 171 with value: 995.4334382975621.[0m
[32m[I 2024-10-13 02:31:21,785][0m Trial 177 finished with value: 1555.812420340164 and parameters: {'depth': 5, 'learning_rate': 0.011713502350324236, 'iterations': 1276, 'l2_leaf_reg': 0.02219886005094574, 'border_count': 5, 'bagging_temperature': 0.9141634771766918, 'random_strength': 0.23148052599619795, 'grow_policy': 'SymmetricTree', 'min_data_in_leaf': 180}. Best is trial 171 with value: 995.4334382975621.[0m
[32m[I 2024-10-13 02:31:31,583][0m Trial 178 finished with value: 1093.6862497965876 and parameters: {'depth': 5, 'learning_rate': 0.01747583812379507, 'iterations': 1555, 'l2_leaf_reg': 0.0028329836162911785, 'border_count': 24, 'bagging_temperature': 0.8704530724190535, 'random_strength': 0.5188638595358095, 'grow_policy': 'SymmetricTree', 'min_data_in_leaf': 226}. Best is trial 171 with value: 995.4334382975621.[0m
[32m[I 2024-10-13 02:31:42,139][0m Trial 179 finished with value: 1253.0504973668183 and parameters: {'depth': 6, 'learning_rate': 0.012626270738718916, 'iterations': 1416, 'l2_leaf_reg': 0.010739713720650806, 'border_count': 32, 'bagging_temperature': 0.7325340224485575, 'random_strength': 0.3655060270161656, 'grow_policy': 'SymmetricTree', 'min_data_in_leaf': 203}. Best is trial 171 with value: 995.4334382975621.[0m
[32m[I 2024-10-13 02:31:44,384][0m Trial 180 finished with value: 1362.2047120646732 and parameters: {'depth': 5, 'learning_rate': 0.010115248998434403, 'iterations': 1370, 'l2_leaf_reg': 0.0016479088408311718, 'border_count': 11, 'bagging_temperature': 0.7852650921237411, 'random_strength': 0.1884299730317905, 'grow_policy': 'Lossguide', 'min_data_in_leaf': 158, 'max_leaves': 86}. Best is trial 171 with value: 995.4334382975621.[0m
[32m[I 2024-10-13 02:31:53,900][0m Trial 181 finished with value: 1089.0623939159095 and parameters: {'depth': 5, 'learning_rate': 0.019302997908195882, 'iterations': 1524, 'l2_leaf_reg': 0.0036655632862325053, 'border_count': 22, 'bagging_temperature': 0.8765865409773498, 'random_strength': 0.6895992593485262, 'grow_policy': 'SymmetricTree', 'min_data_in_leaf': 143}. Best is trial 171 with value: 995.4334382975621.[0m
[32m[I 2024-10-13 02:32:04,293][0m Trial 182 finished with value: 1067.8187270199373 and parameters: {'depth': 5, 'learning_rate': 0.015366623938494932, 'iterations': 1466, 'l2_leaf_reg': 0.005700936091462086, 'border_count': 17, 'bagging_temperature': 0.850281221026311, 'random_strength': 0.005834297743365413, 'grow_policy': 'SymmetricTree', 'min_data_in_leaf': 171}. Best is trial 171 with value: 995.4334382975621.[0m
[32m[I 2024-10-13 02:32:13,652][0m Trial 183 finished with value: 1065.6198483897479 and parameters: {'depth': 5, 'learning_rate': 0.01270941763261465, 'iterations': 1447, 'l2_leaf_reg': 0.0008330582642336754, 'border_count': 17, 'bagging_temperature': 0.8490984773228204, 'random_strength': 0.020373364468739493, 'grow_policy': 'SymmetricTree', 'min_data_in_leaf': 175}. Best is trial 171 with value: 995.4334382975621.[0m
[32m[I 2024-10-13 02:32:23,327][0m Trial 184 finished with value: 1170.58077490394 and parameters: {'depth': 5, 'learning_rate': 0.015561659484545076, 'iterations': 1462, 'l2_leaf_reg': 0.005728414215535395, 'border_count': 27, 'bagging_temperature': 0.8481136781447639, 'random_strength': 0.0198892675071341, 'grow_policy': 'SymmetricTree', 'min_data_in_leaf': 193}. Best is trial 171 with value: 995.4334382975621.[0m
[32m[I 2024-10-13 02:32:36,822][0m Trial 185 finished with value: 1081.7499401178134 and parameters: {'depth': 5, 'learning_rate': 0.017470460759787323, 'iterations': 2268, 'l2_leaf_reg': 0.001316783570693441, 'border_count': 15, 'bagging_temperature': 0.8401182022905314, 'random_strength': 0.41211315254145675, 'grow_policy': 'SymmetricTree', 'min_data_in_leaf': 243}. Best is trial 171 with value: 995.4334382975621.[0m
[32m[I 2024-10-13 02:32:47,268][0m Trial 186 finished with value: 1181.817449695348 and parameters: {'depth': 6, 'learning_rate': 0.008104859132613183, 'iterations': 1308, 'l2_leaf_reg': 0.0008065271855380353, 'border_count': 9, 'bagging_temperature': 0.8231332215293216, 'random_strength': 0.011021906689997488, 'grow_policy': 'SymmetricTree', 'min_data_in_leaf': 211}. Best is trial 171 with value: 995.4334382975621.[0m
[32m[I 2024-10-13 02:32:57,458][0m Trial 187 finished with value: 1086.281444178686 and parameters: {'depth': 5, 'learning_rate': 0.005962673478415678, 'iterations': 1501, 'l2_leaf_reg': 0.0009039225548906277, 'border_count': 20, 'bagging_temperature': 0.8588953162450204, 'random_strength': 0.5875257172155425, 'grow_policy': 'SymmetricTree', 'min_data_in_leaf': 275}. Best is trial 171 with value: 995.4334382975621.[0m
[32m[I 2024-10-13 02:33:07,333][0m Trial 188 finished with value: 1188.813448667821 and parameters: {'depth': 5, 'learning_rate': 0.011214924921294403, 'iterations': 1374, 'l2_leaf_reg': 0.009199378486440151, 'border_count': 29, 'bagging_temperature': 0.9977037435468324, 'random_strength': 0.20966459873176682, 'grow_policy': 'SymmetricTree', 'min_data_in_leaf': 231}. Best is trial 171 with value: 995.4334382975621.[0m
[32m[I 2024-10-13 02:33:17,145][0m Trial 189 finished with value: 1279.1737682613984 and parameters: {'depth': 5, 'learning_rate': 0.014144582627727505, 'iterations': 1538, 'l2_leaf_reg': 0.005022344662736091, 'border_count': 13, 'bagging_temperature': 0.8113478665429925, 'random_strength': 5.384319180206852, 'grow_policy': 'SymmetricTree', 'min_data_in_leaf': 174}. Best is trial 171 with value: 995.4334382975621.[0m
[32m[I 2024-10-13 02:33:25,960][0m Trial 190 finished with value: 1512.0418722063964 and parameters: {'depth': 6, 'learning_rate': 0.023564062674840156, 'iterations': 1458, 'l2_leaf_reg': 0.002552978644658457, 'border_count': 5, 'bagging_temperature': 0.21131266133864174, 'random_strength': 0.42118851936795076, 'grow_policy': 'SymmetricTree', 'min_data_in_leaf': 188}. Best is trial 171 with value: 995.4334382975621.[0m
[32m[I 2024-10-13 02:33:37,461][0m Trial 191 finished with value: 1071.0989906539855 and parameters: {'depth': 5, 'learning_rate': 0.012805661823759132, 'iterations': 1403, 'l2_leaf_reg': 0.0025006466680669815, 'border_count': 17, 'bagging_temperature': 0.8861006744701712, 'random_strength': 0.2030400879024327, 'grow_policy': 'SymmetricTree', 'min_data_in_leaf': 169}. Best is trial 171 with value: 995.4334382975621.[0m
[32m[I 2024-10-13 02:33:47,948][0m Trial 192 finished with value: 1033.8300202657426 and parameters: {'depth': 8, 'learning_rate': 0.01633544982780278, 'iterations': 1267, 'l2_leaf_reg': 0.0020907853968556195, 'border_count': 19, 'bagging_temperature': 0.9164582521463238, 'random_strength': 0.21832506486638426, 'grow_policy': 'SymmetricTree', 'min_data_in_leaf': 149}. Best is trial 171 with value: 995.4334382975621.[0m
[32m[I 2024-10-13 02:33:56,813][0m Trial 193 finished with value: 1098.7627474289893 and parameters: {'depth': 4, 'learning_rate': 0.015202375597713615, 'iterations': 1281, 'l2_leaf_reg': 0.0018103917288480413, 'border_count': 20, 'bagging_temperature': 0.8802791915077698, 'random_strength': 0.16647718689346475, 'grow_policy': 'SymmetricTree', 'min_data_in_leaf': 140}. Best is trial 171 with value: 995.4334382975621.[0m
[32m[I 2024-10-13 02:34:02,612][0m Trial 194 finished with value: 1055.4898590701644 and parameters: {'depth': 5, 'learning_rate': 0.012096634610333959, 'iterations': 965, 'l2_leaf_reg': 0.0008432331502419124, 'border_count': 16, 'bagging_temperature': 0.9097706832944146, 'random_strength': 0.009385710269740749, 'grow_policy': 'SymmetricTree', 'min_data_in_leaf': 153}. Best is trial 171 with value: 995.4334382975621.[0m
[32m[I 2024-10-13 02:34:13,705][0m Trial 195 finished with value: 1027.2058655204078 and parameters: {'depth': 8, 'learning_rate': 0.009751643824283552, 'iterations': 1021, 'l2_leaf_reg': 0.001374122331378982, 'border_count': 24, 'bagging_temperature': 0.9220254649761557, 'random_strength': 0.02475631589787733, 'grow_policy': 'SymmetricTree', 'min_data_in_leaf': 153}. Best is trial 171 with value: 995.4334382975621.[0m
[32m[I 2024-10-13 02:34:24,525][0m Trial 196 finished with value: 1136.187816809349 and parameters: {'depth': 8, 'learning_rate': 0.009865376910675513, 'iterations': 926, 'l2_leaf_reg': 0.0015078434945193198, 'border_count': 24, 'bagging_temperature': 0.9226900833959515, 'random_strength': 0.5076400958649621, 'grow_policy': 'SymmetricTree', 'min_data_in_leaf': 125}. Best is trial 171 with value: 995.4334382975621.[0m
[32m[I 2024-10-13 02:34:35,041][0m Trial 197 finished with value: 1185.0456937246736 and parameters: {'depth': 8, 'learning_rate': 0.015602748595803063, 'iterations': 1051, 'l2_leaf_reg': 0.0007661943863538326, 'border_count': 25, 'bagging_temperature': 0.9127483601522762, 'random_strength': 0.023140760808214422, 'grow_policy': 'SymmetricTree', 'min_data_in_leaf': 148}. Best is trial 171 with value: 995.4334382975621.[0m
[32m[I 2024-10-13 02:34:44,106][0m Trial 198 finished with value: 1303.224775123084 and parameters: {'depth': 7, 'learning_rate': 0.008438752767844579, 'iterations': 734, 'l2_leaf_reg': 0.013951747330790144, 'border_count': 10, 'bagging_temperature': 0.9332750116323159, 'random_strength': 0.35329625589801356, 'grow_policy': 'SymmetricTree', 'min_data_in_leaf': 162}. Best is trial 171 with value: 995.4334382975621.[0m
[32m[I 2024-10-13 02:34:57,119][0m Trial 199 finished with value: 1264.052891136269 and parameters: {'depth': 8, 'learning_rate': 0.010903041000366853, 'iterations': 892, 'l2_leaf_reg': 0.0010766172739648295, 'border_count': 36, 'bagging_temperature': 0.8506416628157935, 'random_strength': 0.00856425459897545, 'grow_policy': 'SymmetricTree', 'min_data_in_leaf': 761}. Best is trial 171 with value: 995.4334382975621.[0m
[32m[I 2024-10-13 02:35:06,157][0m Trial 200 finished with value: 1138.8521571720503 and parameters: {'depth': 9, 'learning_rate': 0.01925686158836127, 'iterations': 768, 'l2_leaf_reg': 0.0007079249673318642, 'border_count': 20, 'bagging_temperature': 0.2352487085130776, 'random_strength': 0.7647074034138286, 'grow_policy': 'SymmetricTree', 'min_data_in_leaf': 116}. Best is trial 171 with value: 995.4334382975621.[0m
[32m[I 2024-10-13 02:35:14,246][0m Trial 201 finished with value: 1046.344381100891 and parameters: {'depth': 7, 'learning_rate': 0.012247835083132722, 'iterations': 957, 'l2_leaf_reg': 0.004805654722975564, 'border_count': 17, 'bagging_temperature': 0.9113706415199224, 'random_strength': 0.2594910502262053, 'grow_policy': 'SymmetricTree', 'min_data_in_leaf': 184}. Best is trial 171 with value: 995.4334382975621.[0m
[32m[I 2024-10-13 02:35:23,853][0m Trial 202 finished with value: 1039.219959883764 and parameters: {'depth': 8, 'learning_rate': 0.013617508524718505, 'iterations': 1029, 'l2_leaf_reg': 0.00643909643509116, 'border_count': 14, 'bagging_temperature': 0.9034595446252605, 'random_strength': 0.3459939073155692, 'grow_policy': 'SymmetricTree', 'min_data_in_leaf': 207}. Best is trial 171 with value: 995.4334382975621.[0m
[32m[I 2024-10-13 02:35:32,465][0m Trial 203 finished with value: 1296.8801780386502 and parameters: {'depth': 7, 'learning_rate': 0.009552567491485052, 'iterations': 985, 'l2_leaf_reg': 0.001915965847079538, 'border_count': 11, 'bagging_temperature': 0.9027903051261101, 'random_strength': 0.5954476376593743, 'grow_policy': 'SymmetricTree', 'min_data_in_leaf': 212}. Best is trial 171 with value: 995.4334382975621.[0m
[32m[I 2024-10-13 02:35:42,333][0m Trial 204 finished with value: 1175.7435188403963 and parameters: {'depth': 8, 'learning_rate': 0.012634526887121767, 'iterations': 1098, 'l2_leaf_reg': 0.008341551571377578, 'border_count': 25, 'bagging_temperature': 0.941349535212131, 'random_strength': 0.40463180747865346, 'grow_policy': 'SymmetricTree', 'min_data_in_leaf': 203}. Best is trial 171 with value: 995.4334382975621.[0m
[32m[I 2024-10-13 02:35:50,556][0m Trial 205 finished with value: 1063.7444252906794 and parameters: {'depth': 8, 'learning_rate': 0.013168479077138716, 'iterations': 990, 'l2_leaf_reg': 0.00036819236777282087, 'border_count': 14, 'bagging_temperature': 0.26614599640025616, 'random_strength': 0.31936992999135466, 'grow_policy': 'SymmetricTree', 'min_data_in_leaf': 251}. Best is trial 171 with value: 995.4334382975621.[0m
