[32m[I 2024-10-13 02:50:03,608][0m Trial 308 finished with value: 1052.5827580036919 and parameters: {'depth': 7, 'learning_rate': 0.009433543736859585, 'iterations': 1317, 'l2_leaf_reg': 0.0013345196125341514, 'border_count': 23, 'bagging_temperature': 0.3034782891739171, 'random_strength': 0.17191731268997318, 'grow_policy': 'SymmetricTree', 'min_data_in_leaf': 242}. Best is trial 171 with value: 995.4334382975621.[0m
[32m[I 2024-10-13 02:50:11,116][0m Trial 309 finished with value: 1327.3130707659316 and parameters: {'depth': 7, 'learning_rate': 0.007592290492054796, 'iterations': 1356, 'l2_leaf_reg': 0.0012182988819698598, 'border_count': 33, 'bagging_temperature': 0.3182474347781061, 'random_strength': 3.442411977866036, 'grow_policy': 'SymmetricTree', 'min_data_in_leaf': 238}. Best is trial 171 with value: 995.4334382975621.[0m
[32m[I 2024-10-13 02:50:18,016][0m Trial 310 finished with value: 1250.2477242483292 and parameters: {'depth': 7, 'learning_rate': 0.0062430941039531085, 'iterations': 1195, 'l2_leaf_reg': 0.0015994361954722019, 'border_count': 25, 'bagging_temperature': 0.30203165508851865, 'random_strength': 0.5180197988250699, 'grow_policy': 'SymmetricTree', 'min_data_in_leaf': 185}. Best is trial 171 with value: 995.4334382975621.[0m
[32m[I 2024-10-13 02:50:24,855][0m Trial 311 finished with value: 1039.2114474018563 and parameters: {'depth': 7, 'learning_rate': 0.00946295980127916, 'iterations': 1274, 'l2_leaf_reg': 0.0008521399773709292, 'border_count': 13, 'bagging_temperature': 0.2731618397425582, 'random_strength': 0.0013445236005734662, 'grow_policy': 'SymmetricTree', 'min_data_in_leaf': 220}. Best is trial 171 with value: 995.4334382975621.[0m
[32m[I 2024-10-13 02:50:35,844][0m Trial 312 finished with value: 1233.280516946773 and parameters: {'depth': 7, 'learning_rate': 0.008431964787937618, 'iterations': 2466, 'l2_leaf_reg': 0.0004497752697005857, 'border_count': 10, 'bagging_temperature': 0.25646467992989996, 'random_strength': 0.010904020965890689, 'grow_policy': 'SymmetricTree', 'min_data_in_leaf': 210}. Best is trial 171 with value: 995.4334382975621.[0m
[32m[I 2024-10-13 02:50:42,284][0m Trial 313 finished with value: 1504.5564433811091 and parameters: {'depth': 7, 'learning_rate': 0.0053559922521260045, 'iterations': 1306, 'l2_leaf_reg': 0.0008503981956852945, 'border_count': 5, 'bagging_temperature': 0.27987091402105335, 'random_strength': 0.007785044613878189, 'grow_policy': 'SymmetricTree', 'min_data_in_leaf': 255}. Best is trial 171 with value: 995.4334382975621.[0m
[32m[I 2024-10-13 02:50:48,311][0m Trial 314 finished with value: 1068.0998145669066 and parameters: {'depth': 7, 'learning_rate': 0.009086593234192742, 'iterations': 1225, 'l2_leaf_reg': 0.000990904349056283, 'border_count': 14, 'bagging_temperature': 0.2914458704321202, 'random_strength': 0.3198162390525908, 'grow_policy': 'SymmetricTree', 'min_data_in_leaf': 184}. Best is trial 171 with value: 995.4334382975621.[0m
[32m[I 2024-10-13 02:50:54,214][0m Trial 315 finished with value: 1300.6257570766636 and parameters: {'depth': 7, 'learning_rate': 0.010273344426571747, 'iterations': 1349, 'l2_leaf_reg': 0.000552628379049632, 'border_count': 12, 'bagging_temperature': 0.06403293287944989, 'random_strength': 0.7912384486535293, 'grow_policy': 'SymmetricTree', 'min_data_in_leaf': 157}. Best is trial 171 with value: 995.4334382975621.[0m
[32m[I 2024-10-13 02:50:59,754][0m Trial 316 finished with value: 1271.2370858550821 and parameters: {'depth': 7, 'learning_rate': 0.00744147515753073, 'iterations': 689, 'l2_leaf_reg': 0.001579097448347473, 'border_count': 150, 'bagging_temperature': 0.24472794242543028, 'random_strength': 0.17968128696835264, 'grow_policy': 'SymmetricTree', 'min_data_in_leaf': 222}. Best is trial 171 with value: 995.4334382975621.[0m
[32m[I 2024-10-13 02:51:06,346][0m Trial 317 finished with value: 1113.1277951780312 and parameters: {'depth': 8, 'learning_rate': 0.009955015717988446, 'iterations': 1089, 'l2_leaf_reg': 0.0024235854589302356, 'border_count': 17, 'bagging_temperature': 0.2705989584979045, 'random_strength': 0.4212279195963534, 'grow_policy': 'SymmetricTree', 'min_data_in_leaf': 200}. Best is trial 171 with value: 995.4334382975621.[0m
[32m[I 2024-10-13 02:51:07,924][0m Trial 318 finished with value: 1188.8095702367252 and parameters: {'depth': 7, 'learning_rate': 0.011381653189668378, 'iterations': 1282, 'l2_leaf_reg': 0.001243748454418828, 'border_count': 21, 'bagging_temperature': 0.3414749838421862, 'random_strength': 0.16967870332096227, 'grow_policy': 'Depthwise', 'min_data_in_leaf': 235}. Best is trial 171 with value: 995.4334382975621.[0m
[32m[I 2024-10-13 02:51:16,910][0m Trial 319 finished with value: 1356.1330352241698 and parameters: {'depth': 13, 'learning_rate': 0.015782902471421313, 'iterations': 1153, 'l2_leaf_reg': 0.0007217195684701765, 'border_count': 9, 'bagging_temperature': 0.3021439116952492, 'random_strength': 4.909325311749484, 'grow_policy': 'SymmetricTree', 'min_data_in_leaf': 265}. Best is trial 171 with value: 995.4334382975621.[0m
[32m[I 2024-10-13 02:51:22,742][0m Trial 320 finished with value: 1199.6865339892697 and parameters: {'depth': 8, 'learning_rate': 0.012956821772189733, 'iterations': 1018, 'l2_leaf_reg': 0.00036012778586062057, 'border_count': 30, 'bagging_temperature': 0.22873709111952067, 'random_strength': 0.5768045668731616, 'grow_policy': 'SymmetricTree', 'min_data_in_leaf': 133}. Best is trial 171 with value: 995.4334382975621.[0m
[32m[I 2024-10-13 02:51:29,463][0m Trial 321 finished with value: 1122.7409936163926 and parameters: {'depth': 8, 'learning_rate': 0.009675076595503325, 'iterations': 1241, 'l2_leaf_reg': 0.0021829021605029838, 'border_count': 16, 'bagging_temperature': 0.31528598091137655, 'random_strength': 0.3351696129941839, 'grow_policy': 'SymmetricTree', 'min_data_in_leaf': 180}. Best is trial 171 with value: 995.4334382975621.[0m
[32m[I 2024-10-13 02:51:36,816][0m Trial 322 finished with value: 2181.8673056602165 and parameters: {'depth': 7, 'learning_rate': 0.020572862737633396, 'iterations': 2105, 'l2_leaf_reg': 0.043625036681392435, 'border_count': 3, 'bagging_temperature': 0.2682492381083626, 'random_strength': 2.467415752602065, 'grow_policy': 'SymmetricTree', 'min_data_in_leaf': 221}. Best is trial 171 with value: 995.4334382975621.[0m
[32m[I 2024-10-13 02:51:43,587][0m Trial 323 finished with value: 980.8485503758243 and parameters: {'depth': 8, 'learning_rate': 0.014574602702952867, 'iterations': 1068, 'l2_leaf_reg': 0.07564947612291828, 'border_count': 23, 'bagging_temperature': 0.21467865093928273, 'random_strength': 0.0013507342581566715, 'grow_policy': 'SymmetricTree', 'min_data_in_leaf': 245}. Best is trial 323 with value: 980.8485503758243.[0m
[32m[I 2024-10-13 02:51:49,972][0m Trial 324 finished with value: 1077.350401226304 and parameters: {'depth': 8, 'learning_rate': 0.017407388207455677, 'iterations': 1103, 'l2_leaf_reg': 0.1281997484063734, 'border_count': 24, 'bagging_temperature': 0.2519127675171681, 'random_strength': 0.17321695890077704, 'grow_policy': 'SymmetricTree', 'min_data_in_leaf': 204}. Best is trial 323 with value: 980.8485503758243.[0m
[32m[I 2024-10-13 02:51:51,280][0m Trial 325 finished with value: 1220.818235359938 and parameters: {'depth': 8, 'learning_rate': 0.014748231399468587, 'iterations': 995, 'l2_leaf_reg': 0.0011166476612573754, 'border_count': 14, 'bagging_temperature': 0.16340647624806556, 'random_strength': 0.00684221476101482, 'grow_policy': 'Lossguide', 'min_data_in_leaf': 247, 'max_leaves': 58}. Best is trial 323 with value: 980.8485503758243.[0m
[32m[I 2024-10-13 02:51:56,596][0m Trial 326 finished with value: 1006.4441908882824 and parameters: {'depth': 8, 'learning_rate': 0.024263835850437034, 'iterations': 1073, 'l2_leaf_reg': 0.07463774214059944, 'border_count': 20, 'bagging_temperature': 0.19877423796066204, 'random_strength': 0.3751743890039272, 'grow_policy': 'SymmetricTree', 'min_data_in_leaf': 172}. Best is trial 323 with value: 980.8485503758243.[0m
[32m[I 2024-10-13 02:52:03,107][0m Trial 327 finished with value: 1202.9408912093108 and parameters: {'depth': 8, 'learning_rate': 0.027034415449201397, 'iterations': 1179, 'l2_leaf_reg': 0.09348384108317169, 'border_count': 29, 'bagging_temperature': 0.24076429112963818, 'random_strength': 0.7485008605170852, 'grow_policy': 'SymmetricTree', 'min_data_in_leaf': 196}. Best is trial 323 with value: 980.8485503758243.[0m
[32m[I 2024-10-13 02:52:27,395][0m Trial 328 finished with value: 1056.4154575351115 and parameters: {'depth': 15, 'learning_rate': 0.022968581391419333, 'iterations': 1075, 'l2_leaf_reg': 0.06764126210207008, 'border_count': 21, 'bagging_temperature': 0.21352065452474708, 'random_strength': 0.47349553985440157, 'grow_policy': 'SymmetricTree', 'min_data_in_leaf': 232}. Best is trial 323 with value: 980.8485503758243.[0m
[32m[I 2024-10-13 02:52:33,135][0m Trial 329 finished with value: 1229.2410355745221 and parameters: {'depth': 8, 'learning_rate': 0.024931733711294327, 'iterations': 1124, 'l2_leaf_reg': 0.14411003077730766, 'border_count': 25, 'bagging_temperature': 0.1821999879614568, 'random_strength': 0.3268642443015841, 'grow_policy': 'SymmetricTree', 'min_data_in_leaf': 171}. Best is trial 323 with value: 980.8485503758243.[0m
[32m[I 2024-10-13 02:52:39,795][0m Trial 330 finished with value: 1298.4939974596107 and parameters: {'depth': 8, 'learning_rate': 0.01953093755684354, 'iterations': 1050, 'l2_leaf_reg': 0.03916947533326646, 'border_count': 35, 'bagging_temperature': 0.23179956234407398, 'random_strength': 0.5602764021565585, 'grow_policy': 'SymmetricTree', 'min_data_in_leaf': 220}. Best is trial 323 with value: 980.8485503758243.[0m
[32m[I 2024-10-13 02:52:45,725][0m Trial 331 finished with value: 1191.5686251571062 and parameters: {'depth': 8, 'learning_rate': 0.017326135043234978, 'iterations': 1184, 'l2_leaf_reg': 0.061501930055462596, 'border_count': 10, 'bagging_temperature': 0.2217438564223343, 'random_strength': 0.22116417026522614, 'grow_policy': 'SymmetricTree', 'min_data_in_leaf': 193}. Best is trial 323 with value: 980.8485503758243.[0m
[32m[I 2024-10-13 02:52:54,765][0m Trial 332 finished with value: 2073.473723025772 and parameters: {'depth': 7, 'learning_rate': 0.0009594219622289124, 'iterations': 1292, 'l2_leaf_reg': 0.0876470821438065, 'border_count': 18, 'bagging_temperature': 0.21087297917564893, 'random_strength': 0.0026737505979750817, 'grow_policy': 'SymmetricTree', 'min_data_in_leaf': 247}. Best is trial 323 with value: 980.8485503758243.[0m
[32m[I 2024-10-13 02:53:01,385][0m Trial 333 finished with value: 1014.9029259943558 and parameters: {'depth': 8, 'learning_rate': 0.028917019224486338, 'iterations': 1359, 'l2_leaf_reg': 0.03269820796462349, 'border_count': 21, 'bagging_temperature': 0.28969691550470716, 'random_strength': 0.37226228512488585, 'grow_policy': 'SymmetricTree', 'min_data_in_leaf': 212}. Best is trial 323 with value: 980.8485503758243.[0m
[32m[I 2024-10-13 02:53:07,889][0m Trial 334 finished with value: 1138.7492404239838 and parameters: {'depth': 8, 'learning_rate': 0.03432265387730883, 'iterations': 1041, 'l2_leaf_reg': 0.03598224235102511, 'border_count': 19, 'bagging_temperature': 0.9779976680785553, 'random_strength': 0.8091658786548829, 'grow_policy': 'SymmetricTree', 'min_data_in_leaf': 168}. Best is trial 323 with value: 980.8485503758243.[0m
[32m[I 2024-10-13 02:53:14,724][0m Trial 335 finished with value: 1262.2440850206822 and parameters: {'depth': 8, 'learning_rate': 0.027041494670234343, 'iterations': 1383, 'l2_leaf_reg': 0.05284464315386913, 'border_count': 11, 'bagging_temperature': 0.20915116863291627, 'random_strength': 0.6153309668686271, 'grow_policy': 'SymmetricTree', 'min_data_in_leaf': 437}. Best is trial 323 with value: 980.8485503758243.[0m
[32m[I 2024-10-13 02:53:21,299][0m Trial 336 finished with value: 1186.9130267314324 and parameters: {'depth': 8, 'learning_rate': 0.03165582970507076, 'iterations': 1128, 'l2_leaf_reg': 0.015683224133272163, 'border_count': 29, 'bagging_temperature': 0.1679885847436963, 'random_strength': 0.41053962491192486, 'grow_policy': 'SymmetricTree', 'min_data_in_leaf': 682}. Best is trial 323 with value: 980.8485503758243.[0m
[32m[I 2024-10-13 02:53:26,641][0m Trial 337 finished with value: 1516.0210461811182 and parameters: {'depth': 8, 'learning_rate': 0.024426953908305536, 'iterations': 1245, 'l2_leaf_reg': 0.029049844822843587, 'border_count': 5, 'bagging_temperature': 0.27716266249282173, 'random_strength': 0.35307348258928506, 'grow_policy': 'SymmetricTree', 'min_data_in_leaf': 208}. Best is trial 323 with value: 980.8485503758243.[0m
[32m[I 2024-10-13 02:53:32,362][0m Trial 338 finished with value: 1048.1094350877438 and parameters: {'depth': 9, 'learning_rate': 0.020640376476940253, 'iterations': 993, 'l2_leaf_reg': 0.045161384046038894, 'border_count': 15, 'bagging_temperature': 0.9568577972291525, 'random_strength': 0.21034060734280785, 'grow_policy': 'SymmetricTree', 'min_data_in_leaf': 183}. Best is trial 323 with value: 980.8485503758243.[0m
[32m[I 2024-10-13 02:53:36,866][0m Trial 339 finished with value: 1170.364156367217 and parameters: {'depth': 9, 'learning_rate': 0.03033193914640754, 'iterations': 974, 'l2_leaf_reg': 0.0775235142524132, 'border_count': 14, 'bagging_temperature': 0.012216545902769438, 'random_strength': 0.6628954402915934, 'grow_policy': 'SymmetricTree', 'min_data_in_leaf': 147}. Best is trial 323 with value: 980.8485503758243.[0m
[32m[I 2024-10-13 02:53:42,416][0m Trial 340 finished with value: 1403.9840296031916 and parameters: {'depth': 9, 'learning_rate': 0.022245634800064834, 'iterations': 880, 'l2_leaf_reg': 0.02437135320431939, 'border_count': 8, 'bagging_temperature': 0.9634648065875749, 'random_strength': 0.44057355637997764, 'grow_policy': 'SymmetricTree', 'min_data_in_leaf': 179}. Best is trial 323 with value: 980.8485503758243.[0m
[32m[I 2024-10-13 02:53:56,900][0m Trial 341 finished with value: 1239.9416766521617 and parameters: {'depth': 9, 'learning_rate': 0.015974530282795288, 'iterations': 1069, 'l2_leaf_reg': 0.15777386600961282, 'border_count': 70, 'bagging_temperature': 0.9961281764068659, 'random_strength': 0.18908022850176728, 'grow_policy': 'SymmetricTree', 'min_data_in_leaf': 184}. Best is trial 323 with value: 980.8485503758243.[0m
[32m[I 2024-10-13 02:53:58,248][0m Trial 342 finished with value: 1125.6376871370837 and parameters: {'depth': 9, 'learning_rate': 0.018873228784226984, 'iterations': 988, 'l2_leaf_reg': 0.010360774582703444, 'border_count': 15, 'bagging_temperature': 0.9312907539089652, 'random_strength': 0.9280132779745622, 'grow_policy': 'Depthwise', 'min_data_in_leaf': 215}. Best is trial 323 with value: 980.8485503758243.[0m
[32m[I 2024-10-13 02:54:04,369][0m Trial 343 finished with value: 1137.868118292141 and parameters: {'depth': 9, 'learning_rate': 0.01523745673436002, 'iterations': 931, 'l2_leaf_reg': 0.018950687533476666, 'border_count': 24, 'bagging_temperature': 0.20093546861571113, 'random_strength': 0.3469648002945652, 'grow_policy': 'SymmetricTree', 'min_data_in_leaf': 166}. Best is trial 323 with value: 980.8485503758243.[0m
[32m[I 2024-10-13 02:54:16,507][0m Trial 344 finished with value: 1285.0361930447311 and parameters: {'depth': 8, 'learning_rate': 0.013808230268544979, 'iterations': 1036, 'l2_leaf_reg': 0.03593760527532137, 'border_count': 227, 'bagging_temperature': 0.9524213251514777, 'random_strength': 0.008203456277803875, 'grow_policy': 'SymmetricTree', 'min_data_in_leaf': 192}. Best is trial 323 with value: 980.8485503758243.[0m
[32m[I 2024-10-13 02:54:23,111][0m Trial 345 finished with value: 1097.8786648882053 and parameters: {'depth': 8, 'learning_rate': 0.020115742532943164, 'iterations': 1189, 'l2_leaf_reg': 0.058447586869531276, 'border_count': 20, 'bagging_temperature': 0.1116145890033863, 'random_strength': 0.5368205325828322, 'grow_policy': 'SymmetricTree', 'min_data_in_leaf': 224}. Best is trial 323 with value: 980.8485503758243.[0m
[32m[I 2024-10-13 02:54:27,485][0m Trial 346 finished with value: 2355.737147319754 and parameters: {'depth': 9, 'learning_rate': 0.017607721177502995, 'iterations': 1117, 'l2_leaf_reg': 0.004062517342104681, 'border_count': 2, 'bagging_temperature': 0.9501656558299939, 'random_strength': 0.22414523160659108, 'grow_policy': 'SymmetricTree', 'min_data_in_leaf': 278}. Best is trial 323 with value: 980.8485503758243.[0m
[32m[I 2024-10-13 02:54:36,284][0m Trial 347 finished with value: 1202.6518599396845 and parameters: {'depth': 8, 'learning_rate': 0.01325509649666901, 'iterations': 1342, 'l2_leaf_reg': 0.01581608258888299, 'border_count': 31, 'bagging_temperature': 0.9721382576770669, 'random_strength': 0.002459474971177232, 'grow_policy': 'SymmetricTree', 'min_data_in_leaf': 132}. Best is trial 323 with value: 980.8485503758243.[0m
[32m[I 2024-10-13 02:54:37,477][0m Trial 348 finished with value: 1342.8860911927948 and parameters: {'depth': 9, 'learning_rate': 0.027966315560959357, 'iterations': 847, 'l2_leaf_reg': 0.029130544901664838, 'border_count': 12, 'bagging_temperature': 0.9457246502613463, 'random_strength': 0.34765511238685104, 'grow_policy': 'Lossguide', 'min_data_in_leaf': 210, 'max_leaves': 233}. Best is trial 323 with value: 980.8485503758243.[0m
[32m[I 2024-10-13 02:54:43,259][0m Trial 349 finished with value: 1262.7382751379575 and parameters: {'depth': 8, 'learning_rate': 0.01485710094863918, 'iterations': 945, 'l2_leaf_reg': 0.08445806712989579, 'border_count': 26, 'bagging_temperature': 0.8835176810647283, 'random_strength': 0.7053639215895595, 'grow_policy': 'SymmetricTree', 'min_data_in_leaf': 256}. Best is trial 323 with value: 980.8485503758243.[0m
[32m[I 2024-10-13 02:54:49,186][0m Trial 350 finished with value: 1056.5306060930666 and parameters: {'depth': 8, 'learning_rate': 0.011963239173334986, 'iterations': 1012, 'l2_leaf_reg': 0.04710930069810235, 'border_count': 17, 'bagging_temperature': 0.9722029246149796, 'random_strength': 0.2147570182496038, 'grow_policy': 'SymmetricTree', 'min_data_in_leaf': 154}. Best is trial 323 with value: 980.8485503758243.[0m
[32m[I 2024-10-13 02:54:55,000][0m Trial 351 finished with value: 1291.217415080758 and parameters: {'depth': 8, 'learning_rate': 0.02375847871818152, 'iterations': 1255, 'l2_leaf_reg': 0.007433300581207085, 'border_count': 9, 'bagging_temperature': 0.197035244618388, 'random_strength': 0.4710507883599604, 'grow_policy': 'SymmetricTree', 'min_data_in_leaf': 185}. Best is trial 323 with value: 980.8485503758243.[0m
[32m[I 2024-10-13 02:55:00,617][0m Trial 352 finished with value: 1033.8235514548167 and parameters: {'depth': 8, 'learning_rate': 0.017333032670330043, 'iterations': 1085, 'l2_leaf_reg': 0.022242822600617107, 'border_count': 21, 'bagging_temperature': 0.5565939076246196, 'random_strength': 0.19251027003454838, 'grow_policy': 'SymmetricTree', 'min_data_in_leaf': 234}. Best is trial 323 with value: 980.8485503758243.[0m
[32m[I 2024-10-13 02:55:12,383][0m Trial 353 finished with value: 1295.774348459072 and parameters: {'depth': 9, 'learning_rate': 0.020495952061852903, 'iterations': 1052, 'l2_leaf_reg': 0.010463592807369224, 'border_count': 34, 'bagging_temperature': 0.255274008482688, 'random_strength': 0.0032748681906610037, 'grow_policy': 'SymmetricTree', 'min_data_in_leaf': 241}. Best is trial 323 with value: 980.8485503758243.[0m
[32m[I 2024-10-13 02:55:18,014][0m Trial 354 finished with value: 1103.549878507177 and parameters: {'depth': 8, 'learning_rate': 0.017079356058653128, 'iterations': 1088, 'l2_leaf_reg': 0.014187368585089908, 'border_count': 22, 'bagging_temperature': 0.5615870056349218, 'random_strength': 0.3669119895461386, 'grow_policy': 'SymmetricTree', 'min_data_in_leaf': 260}. Best is trial 323 with value: 980.8485503758243.[0m
[32m[I 2024-10-13 02:55:24,070][0m Trial 355 finished with value: 1217.525318583167 and parameters: {'depth': 8, 'learning_rate': 0.017578797885741678, 'iterations': 1154, 'l2_leaf_reg': 0.0030120496262995475, 'border_count': 28, 'bagging_temperature': 0.7404525028710074, 'random_strength': 0.1945830698014709, 'grow_policy': 'SymmetricTree', 'min_data_in_leaf': 233}. Best is trial 323 with value: 980.8485503758243.[0m
[32m[I 2024-10-13 02:55:30,589][0m Trial 356 finished with value: 1067.1465248414402 and parameters: {'depth': 9, 'learning_rate': 0.014857038109141678, 'iterations': 1012, 'l2_leaf_reg': 0.0375855729284043, 'border_count': 21, 'bagging_temperature': 0.5857399519632499, 'random_strength': 0.5540786776418778, 'grow_policy': 'SymmetricTree', 'min_data_in_leaf': 281}. Best is trial 323 with value: 980.8485503758243.[0m
[32m[I 2024-10-13 02:55:36,818][0m Trial 357 finished with value: 1252.5851884615352 and parameters: {'depth': 8, 'learning_rate': 0.02046933099782613, 'iterations': 937, 'l2_leaf_reg': 0.12422117526122163, 'border_count': 41, 'bagging_temperature': 0.13789133290521874, 'random_strength': 0.17607221325033673, 'grow_policy': 'SymmetricTree', 'min_data_in_leaf': 228}. Best is trial 323 with value: 980.8485503758243.[0m
[32m[I 2024-10-13 02:55:42,958][0m Trial 358 finished with value: 1026.3077724125494 and parameters: {'depth': 8, 'learning_rate': 0.022564589028224204, 'iterations': 1105, 'l2_leaf_reg': 0.0047148942156417266, 'border_count': 14, 'bagging_temperature': 0.5371026964837344, 'random_strength': 0.0003226797245063687, 'grow_policy': 'SymmetricTree', 'min_data_in_leaf': 196}. Best is trial 323 with value: 980.8485503758243.[0m
