[32m[I 2024-10-13 02:55:48,374][0m Trial 359 finished with value: 1109.3009591819982 and parameters: {'depth': 8, 'learning_rate': 0.02851623934137469, 'iterations': 1102, 'l2_leaf_reg': 0.059642827969297485, 'border_count': 13, 'bagging_temperature': 0.5353173308428282, 'random_strength': 0.35533111367968695, 'grow_policy': 'SymmetricTree', 'min_data_in_leaf': 160}. Best is trial 323 with value: 980.8485503758243.[0m
[32m[I 2024-10-13 02:55:54,528][0m Trial 360 finished with value: 1198.2070853785851 and parameters: {'depth': 8, 'learning_rate': 0.024642537695534854, 'iterations': 1064, 'l2_leaf_reg': 0.003729563290075688, 'border_count': 27, 'bagging_temperature': 0.5869668833511569, 'random_strength': 0.7741239318336617, 'grow_policy': 'SymmetricTree', 'min_data_in_leaf': 192}. Best is trial 323 with value: 980.8485503758243.[0m
[32m[I 2024-10-13 02:56:00,763][0m Trial 361 finished with value: 1298.4501459079434 and parameters: {'depth': 8, 'learning_rate': 0.021849440958488665, 'iterations': 1135, 'l2_leaf_reg': 0.022219002444831708, 'border_count': 7, 'bagging_temperature': 0.6321851429812084, 'random_strength': 0.0016002361404640181, 'grow_policy': 'SymmetricTree', 'min_data_in_leaf': 202}. Best is trial 323 with value: 980.8485503758243.[0m
[32m[I 2024-10-13 02:56:09,393][0m Trial 362 finished with value: 1170.496703822858 and parameters: {'depth': 8, 'learning_rate': 0.0033541111546709994, 'iterations': 1002, 'l2_leaf_reg': 0.0023618078942505864, 'border_count': 22, 'bagging_temperature': 0.5644879164214147, 'random_strength': 0.5281965848250201, 'grow_policy': 'SymmetricTree', 'min_data_in_leaf': 113}. Best is trial 323 with value: 980.8485503758243.[0m
[32m[I 2024-10-13 02:56:14,171][0m Trial 363 finished with value: 1290.3013789640627 and parameters: {'depth': 8, 'learning_rate': 0.018184523586806126, 'iterations': 890, 'l2_leaf_reg': 0.00023280307465104954, 'border_count': 16, 'bagging_temperature': 0.5142804025082442, 'random_strength': 9.953450494723825, 'grow_policy': 'SymmetricTree', 'min_data_in_leaf': 172}. Best is trial 323 with value: 980.8485503758243.[0m
[32m[I 2024-10-13 02:56:22,210][0m Trial 364 finished with value: 1166.8972409272526 and parameters: {'depth': 9, 'learning_rate': 0.034677363607214046, 'iterations': 1176, 'l2_leaf_reg': 0.0050245621735564945, 'border_count': 25, 'bagging_temperature': 0.525316430809715, 'random_strength': 0.31229577307575784, 'grow_policy': 'SymmetricTree', 'min_data_in_leaf': 147}. Best is trial 323 with value: 980.8485503758243.[0m
[32m[I 2024-10-13 02:56:23,667][0m Trial 365 finished with value: 2574.242667349492 and parameters: {'depth': 8, 'learning_rate': 0.024744574138798384, 'iterations': 1078, 'l2_leaf_reg': 0.08189480926218672, 'border_count': 1, 'bagging_temperature': 0.5438361840922676, 'random_strength': 0.23993377143965705, 'grow_policy': 'Depthwise', 'min_data_in_leaf': 188}. Best is trial 323 with value: 980.8485503758243.[0m
[32m[I 2024-10-13 02:56:29,577][0m Trial 366 finished with value: 1227.1470417751498 and parameters: {'depth': 8, 'learning_rate': 0.021802918762096665, 'iterations': 998, 'l2_leaf_reg': 0.03645064893895957, 'border_count': 32, 'bagging_temperature': 0.4918146682953243, 'random_strength': 0.17170864940140596, 'grow_policy': 'SymmetricTree', 'min_data_in_leaf': 216}. Best is trial 323 with value: 980.8485503758243.[0m
[32m[I 2024-10-13 02:56:34,736][0m Trial 367 finished with value: 1275.230186798208 and parameters: {'depth': 8, 'learning_rate': 0.01647150042475029, 'iterations': 959, 'l2_leaf_reg': 0.051271314569844594, 'border_count': 11, 'bagging_temperature': 0.9289481874575916, 'random_strength': 0.5011791951336945, 'grow_policy': 'SymmetricTree', 'min_data_in_leaf': 258}. Best is trial 323 with value: 980.8485503758243.[0m
[32m[I 2024-10-13 02:56:42,335][0m Trial 368 finished with value: 1070.6837851746518 and parameters: {'depth': 9, 'learning_rate': 0.23609843958568796, 'iterations': 769, 'l2_leaf_reg': 0.23994173559367024, 'border_count': 21, 'bagging_temperature': 0.9012846943860604, 'random_strength': 0.6736583634314347, 'grow_policy': 'SymmetricTree', 'min_data_in_leaf': 239}. Best is trial 323 with value: 980.8485503758243.[0m
[32m[I 2024-10-13 02:56:49,723][0m Trial 369 finished with value: 1043.10523303633 and parameters: {'depth': 8, 'learning_rate': 0.013115831216120342, 'iterations': 1150, 'l2_leaf_reg': 0.024906900464234633, 'border_count': 18, 'bagging_temperature': 0.2563039021801482, 'random_strength': 0.01250848921534306, 'grow_policy': 'SymmetricTree', 'min_data_in_leaf': 206}. Best is trial 323 with value: 980.8485503758243.[0m
[32m[I 2024-10-13 02:56:57,332][0m Trial 370 finished with value: 1317.3566173383574 and parameters: {'depth': 8, 'learning_rate': 0.012789638703322963, 'iterations': 1203, 'l2_leaf_reg': 0.018650430548790637, 'border_count': 37, 'bagging_temperature': 0.23689789064640973, 'random_strength': 0.16036250177333142, 'grow_policy': 'SymmetricTree', 'min_data_in_leaf': 320}. Best is trial 323 with value: 980.8485503758243.[0m
[32m[I 2024-10-13 02:57:55,469][0m Trial 371 finished with value: 1154.0912556068681 and parameters: {'depth': 14, 'learning_rate': 0.013063437207582998, 'iterations': 1196, 'l2_leaf_reg': 0.011794617879141437, 'border_count': 27, 'bagging_temperature': 0.25470927662114023, 'random_strength': 0.008883556240595641, 'grow_policy': 'SymmetricTree', 'min_data_in_leaf': 219}. Best is trial 323 with value: 980.8485503758243.[0m
[32m[I 2024-10-13 02:57:56,798][0m Trial 372 finished with value: 1189.7140357510618 and parameters: {'depth': 8, 'learning_rate': 0.014231726729166373, 'iterations': 1133, 'l2_leaf_reg': 0.024526551399025875, 'border_count': 19, 'bagging_temperature': 0.2755689717391303, 'random_strength': 7.007380549625365, 'grow_policy': 'Lossguide', 'min_data_in_leaf': 238, 'max_leaves': 138}. Best is trial 323 with value: 980.8485503758243.[0m
[32m[I 2024-10-13 02:58:03,045][0m Trial 373 finished with value: 1071.214687388216 and parameters: {'depth': 8, 'learning_rate': 0.010975083966996195, 'iterations': 1089, 'l2_leaf_reg': 9.793278166077523e-07, 'border_count': 23, 'bagging_temperature': 0.22332189353488235, 'random_strength': 0.3850170080438192, 'grow_policy': 'SymmetricTree', 'min_data_in_leaf': 206}. Best is trial 323 with value: 980.8485503758243.[0m
[32m[I 2024-10-13 02:58:08,332][0m Trial 374 finished with value: 1125.603196481406 and parameters: {'depth': 7, 'learning_rate': 0.015465491519425615, 'iterations': 1128, 'l2_leaf_reg': 0.007878251273858224, 'border_count': 30, 'bagging_temperature': 0.2448110164046879, 'random_strength': 0.16702921758202946, 'grow_policy': 'SymmetricTree', 'min_data_in_leaf': 263}. Best is trial 323 with value: 980.8485503758243.[0m
[32m[I 2024-10-13 02:58:15,367][0m Trial 375 finished with value: 1053.1023634499977 and parameters: {'depth': 8, 'learning_rate': 0.011988256410784496, 'iterations': 1048, 'l2_leaf_reg': 0.0018907640560565711, 'border_count': 18, 'bagging_temperature': 0.27898657548733946, 'random_strength': 0.018714160475331212, 'grow_policy': 'SymmetricTree', 'min_data_in_leaf': 226}. Best is trial 323 with value: 980.8485503758243.[0m
[32m[I 2024-10-13 02:58:20,591][0m Trial 376 finished with value: 1229.511272189812 and parameters: {'depth': 7, 'learning_rate': 0.017837170357444303, 'iterations': 1232, 'l2_leaf_reg': 0.0154523983477102, 'border_count': 9, 'bagging_temperature': 0.2879386350674654, 'random_strength': 0.3890638267359598, 'grow_policy': 'SymmetricTree', 'min_data_in_leaf': 926}. Best is trial 323 with value: 980.8485503758243.[0m
[32m[I 2024-10-13 02:58:26,251][0m Trial 377 finished with value: 1075.6447573644057 and parameters: {'depth': 7, 'learning_rate': 0.014045991909410293, 'iterations': 1157, 'l2_leaf_reg': 0.004903952605997196, 'border_count': 14, 'bagging_temperature': 0.1802126923717403, 'random_strength': 0.9143409821678421, 'grow_policy': 'SymmetricTree', 'min_data_in_leaf': 199}. Best is trial 323 with value: 980.8485503758243.[0m
[32m[I 2024-10-13 02:58:32,277][0m Trial 378 finished with value: 1231.5932906447902 and parameters: {'depth': 8, 'learning_rate': 0.010993977720616027, 'iterations': 1059, 'l2_leaf_reg': 0.029249165735328715, 'border_count': 25, 'bagging_temperature': 0.2613525325654743, 'random_strength': 0.3402350406532362, 'grow_policy': 'SymmetricTree', 'min_data_in_leaf': 172}. Best is trial 323 with value: 980.8485503758243.[0m
[32m[I 2024-10-13 02:58:41,181][0m Trial 379 finished with value: 1291.6271910430119 and parameters: {'depth': 8, 'learning_rate': 0.016360297689582488, 'iterations': 843, 'l2_leaf_reg': 0.02114840444347914, 'border_count': 91, 'bagging_temperature': 0.8986615768798643, 'random_strength': 0.6183993757638456, 'grow_policy': 'SymmetricTree', 'min_data_in_leaf': 248}. Best is trial 323 with value: 980.8485503758243.[0m
[32m[I 2024-10-13 02:58:47,037][0m Trial 380 finished with value: 1019.4855060135194 and parameters: {'depth': 8, 'learning_rate': 0.01323937511353555, 'iterations': 1105, 'l2_leaf_reg': 0.0029385979630824816, 'border_count': 19, 'bagging_temperature': 0.21303090146423376, 'random_strength': 0.18230256451027227, 'grow_policy': 'SymmetricTree', 'min_data_in_leaf': 288}. Best is trial 323 with value: 980.8485503758243.[0m
[32m[I 2024-10-13 02:58:52,362][0m Trial 381 finished with value: 1194.8168351487363 and parameters: {'depth': 7, 'learning_rate': 0.012817693406768407, 'iterations': 1113, 'l2_leaf_reg': 0.0028377431609926, 'border_count': 31, 'bagging_temperature': 0.20852510964473495, 'random_strength': 0.4654891445160281, 'grow_policy': 'SymmetricTree', 'min_data_in_leaf': 296}. Best is trial 323 with value: 980.8485503758243.[0m
[32m[I 2024-10-13 02:58:59,690][0m Trial 382 finished with value: 1013.5272837946832 and parameters: {'depth': 8, 'learning_rate': 0.008649771668213941, 'iterations': 1055, 'l2_leaf_reg': 0.0017283876414592593, 'border_count': 20, 'bagging_temperature': 0.22887725126400205, 'random_strength': 0.1703174201774794, 'grow_policy': 'SymmetricTree', 'min_data_in_leaf': 279}. Best is trial 323 with value: 980.8485503758243.[0m
[32m[I 2024-10-13 02:59:06,839][0m Trial 383 finished with value: 1042.1109719820595 and parameters: {'depth': 8, 'learning_rate': 0.007817778078648337, 'iterations': 1046, 'l2_leaf_reg': 0.001436879443380088, 'border_count': 22, 'bagging_temperature': 0.20706448665558697, 'random_strength': 0.202912287133339, 'grow_policy': 'SymmetricTree', 'min_data_in_leaf': 288}. Best is trial 323 with value: 980.8485503758243.[0m
[32m[I 2024-10-13 02:59:13,878][0m Trial 384 finished with value: 1273.740353469888 and parameters: {'depth': 8, 'learning_rate': 0.008262188039104544, 'iterations': 1031, 'l2_leaf_reg': 0.00210417904794825, 'border_count': 27, 'bagging_temperature': 0.1913313371334867, 'random_strength': 0.7062415508741415, 'grow_policy': 'SymmetricTree', 'min_data_in_leaf': 306}. Best is trial 323 with value: 980.8485503758243.[0m
[32m[I 2024-10-13 02:59:23,923][0m Trial 385 finished with value: 1305.7913650542873 and parameters: {'depth': 8, 'learning_rate': 0.006278697694746471, 'iterations': 1072, 'l2_leaf_reg': 0.00136454331959949, 'border_count': 61, 'bagging_temperature': 0.2085689926843961, 'random_strength': 0.49012301599751634, 'grow_policy': 'SymmetricTree', 'min_data_in_leaf': 320}. Best is trial 323 with value: 980.8485503758243.[0m
[32m[I 2024-10-13 02:59:31,919][0m Trial 386 finished with value: 1218.3007792970095 and parameters: {'depth': 8, 'learning_rate': 0.008334091836538568, 'iterations': 1021, 'l2_leaf_reg': 0.0005877400013930121, 'border_count': 36, 'bagging_temperature': 0.21704895718187242, 'random_strength': 0.3085514029994202, 'grow_policy': 'SymmetricTree', 'min_data_in_leaf': 293}. Best is trial 323 with value: 980.8485503758243.[0m
[32m[I 2024-10-13 02:59:40,127][0m Trial 387 finished with value: 1117.6618583861211 and parameters: {'depth': 8, 'learning_rate': 0.0070887038619238864, 'iterations': 1091, 'l2_leaf_reg': 0.0007994892833075672, 'border_count': 24, 'bagging_temperature': 0.22865080653200898, 'random_strength': 0.1873120175136423, 'grow_policy': 'SymmetricTree', 'min_data_in_leaf': 272}. Best is trial 323 with value: 980.8485503758243.[0m
[32m[I 2024-10-13 02:59:41,467][0m Trial 388 finished with value: 1252.460672483438 and parameters: {'depth': 8, 'learning_rate': 0.007653163946039699, 'iterations': 963, 'l2_leaf_reg': 0.0016210064924799155, 'border_count': 22, 'bagging_temperature': 0.1595613008072061, 'random_strength': 0.5047798396803997, 'grow_policy': 'Depthwise', 'min_data_in_leaf': 278}. Best is trial 323 with value: 980.8485503758243.[0m
[32m[I 2024-10-13 02:59:48,330][0m Trial 389 finished with value: 1213.822056861574 and parameters: {'depth': 8, 'learning_rate': 0.009309805025039477, 'iterations': 903, 'l2_leaf_reg': 0.0010736343553906275, 'border_count': 29, 'bagging_temperature': 0.6842183957750394, 'random_strength': 0.18445473468081958, 'grow_policy': 'SymmetricTree', 'min_data_in_leaf': 348}. Best is trial 323 with value: 980.8485503758243.[0m
[32m[I 2024-10-13 02:59:56,546][0m Trial 390 finished with value: 1059.6293704846091 and parameters: {'depth': 8, 'learning_rate': 0.006673668934162036, 'iterations': 1018, 'l2_leaf_reg': 0.0019411901025038914, 'border_count': 20, 'bagging_temperature': 0.18266331288286763, 'random_strength': 0.33833387981289254, 'grow_policy': 'SymmetricTree', 'min_data_in_leaf': 287}. Best is trial 323 with value: 980.8485503758243.[0m
[32m[I 2024-10-13 03:00:05,502][0m Trial 391 finished with value: 1156.9540679625798 and parameters: {'depth': 8, 'learning_rate': 0.00953643747752136, 'iterations': 1106, 'l2_leaf_reg': 0.0030373954750841678, 'border_count': 33, 'bagging_temperature': 0.1927789451250584, 'random_strength': 0.01063689466403206, 'grow_policy': 'SymmetricTree', 'min_data_in_leaf': 308}. Best is trial 323 with value: 980.8485503758243.[0m
[32m[I 2024-10-13 03:00:14,436][0m Trial 392 finished with value: 1098.8008838211272 and parameters: {'depth': 8, 'learning_rate': 0.005047655289048457, 'iterations': 1036, 'l2_leaf_reg': 0.0015373493823905306, 'border_count': 23, 'bagging_temperature': 0.16763695976698076, 'random_strength': 0.8237037433488902, 'grow_policy': 'SymmetricTree', 'min_data_in_leaf': 264}. Best is trial 323 with value: 980.8485503758243.[0m
[32m[I 2024-10-13 03:00:26,286][0m Trial 393 finished with value: 1323.9592114762172 and parameters: {'depth': 8, 'learning_rate': 0.009661865465034848, 'iterations': 1165, 'l2_leaf_reg': 0.0005981106470816324, 'border_count': 111, 'bagging_temperature': 0.2203654279923706, 'random_strength': 0.6027165707476698, 'grow_policy': 'SymmetricTree', 'min_data_in_leaf': 281}. Best is trial 323 with value: 980.8485503758243.[0m
[32m[I 2024-10-13 03:00:27,675][0m Trial 394 finished with value: 1267.8298097357222 and parameters: {'depth': 9, 'learning_rate': 0.010606340830947815, 'iterations': 948, 'l2_leaf_reg': 0.001009730143231023, 'border_count': 13, 'bagging_temperature': 0.22996030070981804, 'random_strength': 0.18689688138111238, 'grow_policy': 'Lossguide', 'min_data_in_leaf': 456, 'max_leaves': 154}. Best is trial 323 with value: 980.8485503758243.[0m
[32m[I 2024-10-13 03:00:35,792][0m Trial 395 finished with value: 1098.4756652573874 and parameters: {'depth': 8, 'learning_rate': 0.008050530196843543, 'iterations': 1377, 'l2_leaf_reg': 0.002669487779633865, 'border_count': 18, 'bagging_temperature': 0.20103268682773454, 'random_strength': 0.35972623670844794, 'grow_policy': 'SymmetricTree', 'min_data_in_leaf': 274}. Best is trial 323 with value: 980.8485503758243.[0m
[32m[I 2024-10-13 03:00:45,705][0m Trial 396 finished with value: 1354.6747418662158 and parameters: {'depth': 10, 'learning_rate': 0.011099645748442702, 'iterations': 1074, 'l2_leaf_reg': 0.0040219318883295664, 'border_count': 28, 'bagging_temperature': 0.2418271822936597, 'random_strength': 5.6354970205330135, 'grow_policy': 'SymmetricTree', 'min_data_in_leaf': 257}. Best is trial 323 with value: 980.8485503758243.[0m
[32m[I 2024-10-13 03:00:50,969][0m Trial 397 finished with value: 1340.60865241453 and parameters: {'depth': 6, 'learning_rate': 0.005657383794002355, 'iterations': 1124, 'l2_leaf_reg': 0.0021389588773856947, 'border_count': 6, 'bagging_temperature': 0.19871958793230876, 'random_strength': 0.17336476843629164, 'grow_policy': 'SymmetricTree', 'min_data_in_leaf': 257}. Best is trial 323 with value: 980.8485503758243.[0m
[32m[I 2024-10-13 03:00:55,733][0m Trial 398 finished with value: 1058.6432288327865 and parameters: {'depth': 8, 'learning_rate': 0.039255445289897745, 'iterations': 978, 'l2_leaf_reg': 0.12010655302764033, 'border_count': 22, 'bagging_temperature': 0.23539595420531148, 'random_strength': 0.4065227037592607, 'grow_policy': 'SymmetricTree', 'min_data_in_leaf': 242}. Best is trial 323 with value: 980.8485503758243.[0m
[32m[I 2024-10-13 03:01:03,920][0m Trial 399 finished with value: 1130.8490264134432 and parameters: {'depth': 9, 'learning_rate': 0.009051501879955952, 'iterations': 787, 'l2_leaf_reg': 0.0003759144437674082, 'border_count': 12, 'bagging_temperature': 0.1806607391665756, 'random_strength': 0.0009316774539050721, 'grow_policy': 'SymmetricTree', 'min_data_in_leaf': 299}. Best is trial 323 with value: 980.8485503758243.[0m
[32m[I 2024-10-13 03:01:12,617][0m Trial 400 finished with value: 1019.3117432041391 and parameters: {'depth': 8, 'learning_rate': 0.010589978469106566, 'iterations': 1200, 'l2_leaf_reg': 0.00087903812624692, 'border_count': 18, 'bagging_temperature': 0.5097511528390426, 'random_strength': 0.001067677957803159, 'grow_policy': 'SymmetricTree', 'min_data_in_leaf': 329}. Best is trial 323 with value: 980.8485503758243.[0m
[32m[I 2024-10-13 03:01:25,070][0m Trial 401 finished with value: 1262.860966085007 and parameters: {'depth': 8, 'learning_rate': 0.014368295814032775, 'iterations': 2599, 'l2_leaf_reg': 0.00047817713849667554, 'border_count': 16, 'bagging_temperature': 0.4986822923733339, 'random_strength': 8.942253348974827, 'grow_policy': 'SymmetricTree', 'min_data_in_leaf': 395}. Best is trial 323 with value: 980.8485503758243.[0m
[32m[I 2024-10-13 03:01:30,696][0m Trial 402 finished with value: 1281.758676292036 and parameters: {'depth': 7, 'learning_rate': 0.011645573278397976, 'iterations': 1197, 'l2_leaf_reg': 0.0007298095552012555, 'border_count': 8, 'bagging_temperature': 0.51161864950966, 'random_strength': 0.16644413679893788, 'grow_policy': 'SymmetricTree', 'min_data_in_leaf': 241}. Best is trial 323 with value: 980.8485503758243.[0m
[32m[I 2024-10-13 03:01:37,846][0m Trial 403 finished with value: 1136.1154046808688 and parameters: {'depth': 9, 'learning_rate': 0.029132569887117918, 'iterations': 1250, 'l2_leaf_reg': 0.06436719389500117, 'border_count': 18, 'bagging_temperature': 0.558460484143263, 'random_strength': 0.5349577180616284, 'grow_policy': 'SymmetricTree', 'min_data_in_leaf': 335}. Best is trial 323 with value: 980.8485503758243.[0m
[32m[I 2024-10-13 03:01:45,059][0m Trial 404 finished with value: 1278.4465725918378 and parameters: {'depth': 8, 'learning_rate': 0.015667676277170133, 'iterations': 1333, 'l2_leaf_reg': 0.0009408596242543326, 'border_count': 39, 'bagging_temperature': 0.3216656231210695, 'random_strength': 0.34800442421548466, 'grow_policy': 'SymmetricTree', 'min_data_in_leaf': 228}. Best is trial 323 with value: 980.8485503758243.[0m
[32m[I 2024-10-13 03:01:51,097][0m Trial 405 finished with value: 1083.7392510026345 and parameters: {'depth': 6, 'learning_rate': 0.012976423158550403, 'iterations': 1186, 'l2_leaf_reg': 0.0002952977452121978, 'border_count': 30, 'bagging_temperature': 0.47707831715498156, 'random_strength': 0.007667222713715227, 'grow_policy': 'SymmetricTree', 'min_data_in_leaf': 262}. Best is trial 323 with value: 980.8485503758243.[0m
[32m[I 2024-10-13 03:01:55,948][0m Trial 406 finished with value: 1219.8541010355152 and parameters: {'depth': 8, 'learning_rate': 0.010681101179624817, 'iterations': 708, 'l2_leaf_reg': 0.1061907211048106, 'border_count': 12, 'bagging_temperature': 0.5160408177213331, 'random_strength': 0.21079905158453024, 'grow_policy': 'SymmetricTree', 'min_data_in_leaf': 246}. Best is trial 323 with value: 980.8485503758243.[0m
[32m[I 2024-10-13 03:02:06,599][0m Trial 407 finished with value: 992.629036036817 and parameters: {'depth': 9, 'learning_rate': 0.018438919521529155, 'iterations': 1269, 'l2_leaf_reg': 0.003273695144026087, 'border_count': 24, 'bagging_temperature': 0.5413182673371979, 'random_strength': 0.0022938614954751066, 'grow_policy': 'SymmetricTree', 'min_data_in_leaf': 226}. Best is trial 323 with value: 980.8485503758243.[0m
[32m[I 2024-10-13 03:02:12,509][0m Trial 408 finished with value: 1137.2607011411947 and parameters: {'depth': 6, 'learning_rate': 0.019606616547911657, 'iterations': 1359, 'l2_leaf_reg': 0.0017074082737921382, 'border_count': 27, 'bagging_temperature': 0.5473203436894375, 'random_strength': 0.014494884818136959, 'grow_policy': 'SymmetricTree', 'min_data_in_leaf': 379}. Best is trial 323 with value: 980.8485503758243.[0m
[32m[I 2024-10-13 03:02:23,377][0m Trial 409 finished with value: 1272.1341963382013 and parameters: {'depth': 9, 'learning_rate': 0.02265559669448399, 'iterations': 1267, 'l2_leaf_reg': 0.001076196327410554, 'border_count': 34, 'bagging_temperature': 0.5704948681088887, 'random_strength': 0.0004569215018587758, 'grow_policy': 'SymmetricTree', 'min_data_in_leaf': 229}. Best is trial 323 with value: 980.8485503758243.[0m
